16:27:02.710467 IP 112.26.0.8.41770 > 112.26.0.1.targus-getdata1: Flags [S], seq 2031178631, win 65535, options [mss 1460,sackOK,TS val 4294859235 ecr 0,nop,wscale 6,mptcp capable csum {0x57c080ebc044a6f2}], length 0
16:27:02.732743 IP 112.26.0.8.41770 > 112.26.0.1.targus-getdata1: Flags [S], seq 2031178631, win 65535, options [mss 1460,sackOK,TS val 4294859235 ecr 0,nop,wscale 6,mptcp capable csum {0x57c080ebc044a6f2}], length 0
16:27:02.918135 IP 112.26.0.1.targus-getdata1 > 112.26.0.8.41770: Flags [S.], seq 1386844041, ack 2031178632, win 65535, options [mss 1460,sackOK,TS val 113413 ecr 4294859235,nop,wscale 6,mptcp capable csum {0xdcbc4ddaee5b51ac}], length 0
16:27:02.918410 IP 112.26.0.8.41770 > 112.26.0.1.targus-getdata1: Flags [.], ack 1, win 1369, options [nop,nop,TS val 4294859483 ecr 113413,mptcp capable csum {0x57c080ebc044a6f2,0xdcbc4ddaee5b51ac},mptcp dss ack 196611476], length 0
16:27:02.918451 IP 112.26.0.8.41770 > 112.26.0.1.targus-getdata1: Flags [.], ack 1, win 1369, options [nop,nop,TS val 4294859483 ecr 113413,mptcp add-addr id 3 112.26.1.8,mptcp dss ack 196611476], length 0
16:27:02.918474 IP 112.26.0.8.41770 > 112.26.0.1.targus-getdata1: Flags [.], ack 1, win 1369, options [nop,nop,TS val 4294859483 ecr 113413,mptcp add-addr id 5 112.26.3.8,mptcp dss ack 196611476], length 0
16:27:02.918496 IP 112.26.0.8.41770 > 112.26.0.1.targus-getdata1: Flags [.], ack 1, win 1369, options [nop,nop,TS val 4294859483 ecr 113413,mptcp add-addr id 6 112.26.2.8,mptcp dss ack 196611476], length 0
16:27:50.999207 IP 112.26.0.1.targus-getdata1 > 112.26.0.8.41772: Flags [.], ack 1772731111, win 24509, options [nop,nop,TS val 161543 ecr 4294905381,nop,nop,sack 1 {1429:5713},mptcp dss ack 2343418791], length 0
16:27:51.024195 IP 112.26.0.8.54549 > 112.26.2.1.targus-getdata1: Flags [.], seq 1666355189:1666356617, ack 1824504722, win 4107, options [nop,nop,TS val 4294907205 ecr 161198,mptcp dss ack 3825203810 seq 2343468771 subseq 241333 len 1428 csum 0x3d39], length 1428
16:27:51.039707 IP 112.26.2.1.targus-getdata1 > 112.26.0.8.54549: Flags [.], ack 2856, win 24509, options [nop,nop,TS val 161625 ecr 4294907205,mptcp dss ack 2343418791], length 0
16:27:51.040090 IP 112.26.0.8.54549 > 112.26.2.1.targus-getdata1: Flags [.], seq 4284:5712, ack 1, win 4107, options [nop,nop,TS val 4294907604 ecr 161625,mptcp dss ack 3825203810 seq 2343470199 subseq 245617 len 1428 csum 0xfe17], length 1428
16:28:04.794636 IP 112.26.0.8.54549 > 112.26.2.1.targus-getdata1: Flags [.], seq 69972:71400, ack 1, win 4107, options [nop,nop,TS val 4294920852 ecr 174808,mptcp dss ack 3825203810 seq 2343654411 subseq 311305 len 1428 csum 0x17a9], length 1428
16:28:27.844633 IP 112.26.0.8.41772 > 112.26.0.1.targus-getdata1: Flags [.], seq 144229:145657, ack 0, win 4107, options [nop,nop,TS val 4294943907 ecr 197838,mptcp dss ack 3825203810 seq 2344032831 subseq 237086 len 1428 csum 0xd05e], length 1428
16:28:43.436516 IP 112.26.0.8.59987 > 112.26.1.1.targus-getdata1: Flags [.], seq 4001489957:4001491385, ack 3659179008, win 4107, options [nop,nop,TS val 4294959497 ecr 213438,mptcp dss ack 3825203810 seq 2344279875 subseq 458389 len 1428 csum 0x602a], length 1428
16:28:43.447254 IP 112.26.2.1.targus-getdata1 > 112.26.0.8.54549: Flags [.], ack 279888, win 24291, options [nop,nop,TS val 213854 ecr 4294958591,nop,nop,sack 1 {281316:287028},mptcp dss ack 2344234179], length 0
16:28:58.699207 IP 112.26.0.8.41772 > 112.26.0.1.targus-getdata1: Flags [.], seq 324157:325585, ack 0, win 4107, options [nop,nop,TS val 7213 ecr 228216,mptcp dss ack 3825203810 seq 2344549767 subseq 417014 len 1428 csum 0x2f9c], length 1428
16:28:58.718296 IP 112.26.0.1.targus-getdata1 > 112.26.0.8.41772: Flags [.], ack 319873, win 24558, options [nop,nop,TS val 228822 ecr 6986,mptcp dss ack 2344542627], length 0
16:28:58.718538 IP 112.26.0.8.41772 > 112.26.0.1.targus-getdata1: Flags [.], seq 327013:328441, ack 0, win 4107, options [nop,nop,TS val 7987 ecr 228822,mptcp dss ack 3825203810 seq 2344565475 subseq 419870 len 1428 csum 0x5eb1], length 1428
16:28:58.731358 IP 112.26.0.8.41772 > 112.26.0.1.targus-getdata1: Flags [.], seq 325585:327013, ack 0, win 4107, options [nop,nop,TS val 7305 ecr 228299,mptcp dss ack 3825203810 seq 2344551195 subseq 418442 len 1428 csum 0xb510], length 1428
16:28:58.800624 IP 112.26.0.1.targus-getdata1 > 112.26.0.8.41772: Flags [.], ack 321301, win 24558, options [nop,nop,TS val 228911 ecr 6986,mptcp dss ack 2344544055], length 0
16:29:12.703353 IP 112.26.1.1.targus-getdata1 > 112.26.0.8.59987: Flags [.], ack 124236, win 24488, options [nop,nop,TS val 242884 ecr 20662,nop,nop,sack 1 {125664:128520},mptcp dss ack 2344682571], length 0
16:29:12.709725 IP 112.26.0.8.41772 > 112.26.0.1.targus-getdata1: Flags [.], seq 402697:404125, ack 0, win 4107, options [nop,nop,TS val 21473 ecr 242303,mptcp dss ack 3825203810 seq 2344806807 subseq 495554 len 1428 csum 0x703f], length 1428
16:29:12.790712 IP 112.26.0.8.41772 > 112.26.0.1.targus-getdata1: Flags [.], seq 411265:412693, ack 0, win 4107, options [nop,nop,TS val 21585 ecr 242385,mptcp dss ack 3825203810 seq 2344806807 subseq 504122 len 1428 csum 0x4ec7], length 1428
16:29:12.799978 IP 112.26.0.1.targus-getdata1 > 112.26.0.8.41772: Flags [.], ack 402697, win 24488, options [nop,nop,TS val 242912 ecr 20840,nop,nop,sack 2 {409837:411265}{404125:408409},mptcp dss ack 2344682571], length 0
16:29:12.800250 IP 112.26.0.8.59987 > 112.26.1.1.targus-getdata1: Flags [.], seq 138516:139944, ack 1, win 4107, options [nop,nop,TS val 22069 ecr 242884,mptcp dss ack 3825203810 seq 2344813947 subseq 596905 len 1428 csum 0xdba5], length 1428
16:29:12.800335 IP 112.26.0.8.41772 > 112.26.0.1.targus-getdata1: Flags [.], seq 412693:414121, ack 0, win 4107, options [nop,nop,TS val 22069 ecr 242912,mptcp dss ack 3825203810 seq 2344815375 subseq 505550 len 1428 csum 0xf846], length 1428
16:29:12.800392 IP 112.26.0.8.41772 > 112.26.0.1.targus-getdata1: Flags [.], seq 414121:415549, ack 0, win 4107, options [nop,nop,TS val 22069 ecr 242912,mptcp dss ack 3825203810 seq 2344816803 subseq 506978 len 1428 csum 0x4452], length 1428
16:29:12.821172 IP 112.26.1.1.targus-getdata1 > 112.26.0.8.59987: Flags [.], ack 124236, win 24488, options [nop,nop,TS val 242993 ecr 20662,nop,nop,sack 1 {125664:129948},mptcp dss ack 2344682571], length 0
16:29:12.821404 IP 112.26.0.8.59987 > 112.26.1.1.targus-getdata1: Flags [.], seq 124236:125664, ack 1, win 4107, options [nop,nop,TS val 22090 ecr 242993,mptcp dss ack 3825203810 seq 2344798239 subseq 582625 len 1428 csum 0x7861], length 1428
16:29:12.888426 IP 112.26.0.8.41772 > 112.26.0.1.targus-getdata1: Flags [.], seq 408409:409837, ack 0, win 4107, options [nop,nop,TS val 21682 ecr 242514,mptcp dss ack 3825203810 seq 2344812519 subseq 501266 len 1428 csum 0x3018], length 1428
16:29:12.910959 IP 112.26.2.1.targus-getdata1 > 112.26.0.8.54549: Flags [.], ack 536928, win 24488, options [nop,nop,TS val 243083 ecr 19274,nop,nop,sack 2 {538356:544068}{545496:546924},mptcp dss ack 2344682571], length 0
16:29:12.911245 IP 112.26.0.8.54549 > 112.26.2.1.targus-getdata1: Flags [.], seq 536928:538356, ack 1, win 4107, options [nop,nop,TS val 22180 ecr 243083,mptcp dss ack 3825203810 seq 2344779675 subseq 778261 len 1428 csum 0xe753], length 1428
16:29:12.988939 IP 112.26.1.1.targus-getdata1 > 112.26.0.8.59987: Flags [.], ack 124236, win 24488, options [nop,nop,TS val 243115 ecr 20662,nop,nop,sack 1 {125664:131376},mptcp dss ack 2344682571], length 0
16:29:13.002822 IP 112.26.0.8.59987 > 112.26.1.1.targus-getdata1: Flags [.], seq 134232:135660, ack 1, win 4107, options [nop,nop,TS val 21874 ecr 242818,mptcp dss ack 3825203810 seq 2344809663 subseq 592621 len 1428 csum 0xeb91], length 1428
16:29:13.019001 IP 112.26.2.1.targus-getdata1 > 112.26.0.8.54549: Flags [.], ack 536928, win 24488, options [nop,nop,TS val 243216 ecr 19274,nop,nop,sack 1 {538356:546924},mptcp dss ack 2344682571], length 0
16:29:13.019259 IP 112.26.0.8.59987 > 112.26.1.1.targus-getdata1: Flags [.], seq 139944:141372, ack 1, win 4107, options [nop,nop,TS val 22288 ecr 243115,mptcp dss ack 3825203810 seq 2344818231 subseq 598333 len 1428 csum 0x65d1], length 1428
16:29:13.019333 IP 112.26.0.8.54549 > 112.26.2.1.targus-getdata1: Flags [.], seq 546924:548352, ack 1, win 4107, options [nop,nop,TS val 22288 ecr 243216,mptcp dss ack 3825203810 seq 2344789671 subseq 788257 len 1428 csum 0x5a31], length 1428
16:29:13.094524 IP 112.26.0.8.59987 > 112.26.1.1.targus-getdata1: Flags [.], seq 135660:137088, ack 1, win 4107, options [nop,nop,TS val 21874 ecr 242818,mptcp dss ack 3825203810 seq 2344811091 subseq 594049 len 1428 csum 0xf909], length 1428
16:29:13.115992 IP 112.26.0.1.targus-getdata1 > 112.26.0.8.41772: Flags [.], ack 408409, win 24488, options [nop,nop,TS val 243317 ecr 21473,nop,nop,sack 1 {409837:411265},mptcp dss ack 2344682571], length 0
16:29:13.116248 IP 112.26.0.8.41772 > 112.26.0.1.targus-getdata1: Flags [.], seq 415549:416977, ack 0, win 4107, options [nop,nop,TS val 22384 ecr 243317,mptcp dss ack 3825203810 seq 2344819659 subseq 508406 len 1428 csum 0x4856], length 1428
16:29:13.187531 IP 112.26.0.8.59987 > 112.26.1.1.targus-getdata1: Flags [.], seq 137088:138516, ack 1, win 4107, options [nop,nop,TS val 21874 ecr 242818,mptcp dss ack 3825203810 seq 2344812519 subseq 595477 len 1428 csum 0xc013], length 1428
16:29:13.200441 IP 112.26.0.1.targus-getdata1 > 112.26.0.8.41772: Flags [.], ack 408409, win 24488, options [nop,nop,TS val 243397 ecr 21473,nop,nop,sack 1 {409837:412693},mptcp dss ack 2344682571], length 0
16:29:13.220323 IP 112.26.0.8.59987 > 112.26.1.1.targus-getdata1: Flags [.], seq 138516:139944, ack 1, win 4107, options [nop,nop,TS val 22069 ecr 242884,mptcp dss ack 3825203810 seq 2344813947 subseq 596905 len 1428 csum 0xdba5], length 1428
16:29:13.293793 IP 112.26.0.1.targus-getdata1 > 112.26.0.8.41772: Flags [.], ack 412693, win 24488, options [nop,nop,TS val 243490 ecr 21682,mptcp dss ack 2344682571], length 0
16:29:13.294135 IP 112.26.0.8.41772 > 112.26.0.1.targus-getdata1: Flags [.], seq 416977:418405, ack 0, win 4107, options [nop,nop,TS val 22562 ecr 243397,mptcp dss ack 3825203810 seq 2344821087 subseq 509834 len 1428 csum 0x250], length 1428
16:29:13.294248 IP 112.26.0.8.41772 > 112.26.0.1.targus-getdata1: Flags [.], seq 418405:419833, ack 0, win 4107, options [nop,nop,TS val 22562 ecr 243490,mptcp dss ack 3825203810 seq 2344822515 subseq 511262 len 1428 csum 0xd39c], length 1428
16:29:13.307689 IP 112.26.0.8.41772 > 112.26.0.1.targus-getdata1: Flags [.], seq 412693:414121, ack 0, win 4107, options [nop,nop,TS val 22069 ecr 242912,mptcp dss ack 3825203810 seq 2344815375 subseq 505550 len 1428 csum 0xf846], length 1428
16:29:13.391798 IP 112.26.0.8.41772 > 112.26.0.1.targus-getdata1: Flags [.], seq 414121:415549, ack 0, win 4107, options [nop,nop,TS val 22069 ecr 242912,mptcp dss ack 3825203810 seq 2344816803 subseq 506978 len 1428 csum 0x4452], length 1428
16:29:13.418443 IP 112.26.0.8.59987 > 112.26.1.1.targus-getdata1: Flags [.], seq 124236:125664, ack 1, win 4107, options [nop,nop,TS val 22090 ecr 242993,mptcp dss ack 3825203810 seq 2344798239 subseq 582625 len 1428 csum 0x7861], length 1428
16:29:13.423950 IP 112.26.1.1.targus-getdata1 > 112.26.0.8.59987: Flags [.], ack 124236, win 24488, options [nop,nop,TS val 243604 ecr 20662,nop,nop,sack 2 {134232:135660}{125664:131376},mptcp dss ack 2344682571], length 0
16:29:13.424312 IP 112.26.0.8.59987 > 112.26.1.1.targus-getdata1: Flags [.], seq 131376:132804, ack 1, win 4107, options [nop,nop,TS val 22693 ecr 243604,mptcp dss ack 3825203810 seq 2344805379 subseq 589765 len 1428 csum 0x700], length 1428
16:29:13.500064 IP 112.26.0.8.54549 > 112.26.2.1.targus-getdata1: Flags [.], seq 536928:538356, ack 1, win 4107, options [nop,nop,TS val 22180 ecr 243083,mptcp dss ack 3825203810 seq 2344779675 subseq 778261 len 1428 csum 0xe753], length 1428
16:29:13.514079 IP 112.26.0.8.59987 > 112.26.1.1.targus-getdata1: Flags [.], seq 139944:141372, ack 1, win 4107, options [nop,nop,TS val 22288 ecr 243115,mptcp dss ack 3825203810 seq 2344818231 subseq 598333 len 1428 csum 0x65d1], length 1428
16:29:13.523763 IP 112.26.1.1.targus-getdata1 > 112.26.0.8.59987: Flags [.], ack 124236, win 24488, options [nop,nop,TS val 243697 ecr 20662,nop,nop,sack 2 {134232:137088}{125664:131376},mptcp dss ack 2344682571], length 0
16:29:13.524057 IP 112.26.0.8.59987 > 112.26.1.1.targus-getdata1: Flags [.], seq 132804:134232, ack 1, win 4107, options [nop,nop,TS val 22792 ecr 243697,mptcp dss ack 3825203810 seq 2344808235 subseq 591193 len 1428 csum 0x4eaf], length 1428
16:29:13.595321 IP 112.26.0.8.54549 > 112.26.2.1.targus-getdata1: Flags [.], seq 546924:548352, ack 1, win 4107, options [nop,nop,TS val 22288 ecr 243216,mptcp dss ack 3825203810 seq 2344789671 subseq 788257 len 1428 csum 0x5a31], length 1428
16:29:13.612769 IP 112.26.1.1.targus-getdata1 > 112.26.0.8.59987: Flags [.], ack 124236, win 24488, options [nop,nop,TS val 243789 ecr 20662,nop,nop,sack 2 {134232:138516}{125664:131376},mptcp dss ack 2344682571], length 0
16:29:13.620125 IP 112.26.0.8.41772 > 112.26.0.1.targus-getdata1: Flags [.], seq 415549:416977, ack 0, win 4107, options [nop,nop,TS val 22384 ecr 243317,mptcp dss ack 3825203810 seq 2344819659 subseq 508406 len 1428 csum 0x4856], length 1428
16:29:13.629450 IP 112.26.1.1.targus-getdata1 > 112.26.0.8.59987: Flags [.], ack 124236, win 24488, options [nop,nop,TS val 243821 ecr 20662,nop,nop,sack 2 {134232:139944}{125664:131376},mptcp dss ack 2344682571], length 0
16:29:13.629719 IP 112.26.0.8.59987 > 112.26.1.1.targus-getdata1: Flags [.], seq 141372:142800, ack 1, win 4107, options [nop,nop,TS val 22898 ecr 243789,mptcp dss ack 3825203810 seq 2344823943 subseq 599761 len 1428 csum 0xc0e2], length 1428
16:29:13.709877 IP 112.26.0.1.targus-getdata1 > 112.26.0.8.41772: Flags [.], ack 414121, win 24488, options [nop,nop,TS val 243911 ecr 22069,mptcp dss ack 2344682571], length 0
16:29:13.710162 IP 112.26.0.8.59987 > 112.26.1.1.targus-getdata1: Flags [.], seq 142800:144228, ack 1, win 4107, options [nop,nop,TS val 22978 ecr 243821,mptcp dss ack 3825203810 seq 2344825371 subseq 601189 len 1428 csum 0xc782], length 1428
16:29:13.710246 IP 112.26.0.8.41772 > 112.26.0.1.targus-getdata1: Flags [.], seq 419833:421261, ack 0, win 4107, options [nop,nop,TS val 22978 ecr 243911,mptcp dss ack 3825203810 seq 2344826799 subseq 512690 len 1428 csum 0x41c], length 1428
16:29:13.710308 IP 112.26.0.8.41772 > 112.26.0.1.targus-getdata1: Flags [.], seq 421261:422689, ack 0, win 4107, options [nop,nop,TS val 22978 ecr 243911,mptcp dss ack 3825203810 seq 2344828227 subseq 514118 len 1428 csum 0x9a9e], length 1428
16:29:13.720939 IP 112.26.0.8.41772 > 112.26.0.1.targus-getdata1: Flags [.], seq 416977:418405, ack 0, win 4107, options [nop,nop,TS val 22562 ecr 243397,mptcp dss ack 3825203810 seq 2344821087 subseq 509834 len 1428 csum 0x250], length 1428
16:29:13.737159 IP 112.26.0.1.targus-getdata1 > 112.26.0.8.41772: Flags [.], ack 415549, win 24488, options [nop,nop,TS val 243993 ecr 22069,mptcp dss ack 2344682571], length 0
16:29:13.737433 IP 112.26.0.8.41772 > 112.26.0.1.targus-getdata1: Flags [.], seq 422689:424117, ack 0, win 4107, options [nop,nop,TS val 23006 ecr 243993,mptcp dss ack 3825203810 seq 2344829655 subseq 515546 len 1428 csum 0x156d], length 1428
16:29:13.809016 IP 112.26.0.8.41772 > 112.26.0.1.targus-getdata1: Flags [.], seq 418405:419833, ack 0, win 4107, options [nop,nop,TS val 22562 ecr 243490,mptcp dss ack 3825203810 seq 2344822515 subseq 511262 len 1428 csum 0xd39c], length 1428
16:29:13.823952 IP 112.26.1.1.targus-getdata1 > 112.26.0.8.59987: Flags [.], ack 131376, win 24488, options [nop,nop,TS val 244026 ecr 22090,nop,nop,sack 1 {134232:139944},mptcp dss ack 2344682571], length 0
16:29:13.824270 IP 112.26.0.8.59987 > 112.26.1.1.targus-getdata1: Flags [.], seq 144228:145656, ack 1, win 4107, options [nop,nop,TS val 23092 ecr 244026,mptcp dss ack 3825203810 seq 2344831083 subseq 602617 len 1428 csum 0xa687], length 1428
16:29:13.893699 IP 112.26.0.8.59987 > 112.26.1.1.targus-getdata1: Flags [.], seq 131376:132804, ack 1, win 4107, options [nop,nop,TS val 22693 ecr 243604,mptcp dss ack 3825203810 seq 2344805379 subseq 589765 len 1428 csum 0x700], length 1428
16:29:13.917334 IP 112.26.0.8.59987 > 112.26.1.1.targus-getdata1: Flags [.], seq 132804:134232, ack 1, win 4107, options [nop,nop,TS val 22792 ecr 243697,mptcp dss ack 3825203810 seq 2344808235 subseq 591193 len 1428 csum 0x4eaf], length 1428
16:29:13.935008 IP 112.26.2.1.targus-getdata1 > 112.26.0.8.54549: Flags [.], ack 546924, win 24488, options [nop,nop,TS val 244109 ecr 22180,mptcp dss ack 2344682571], length 0
16:29:13.935308 IP 112.26.0.8.54549 > 112.26.2.1.targus-getdata1: Flags [.], seq 548352:549780, ack 1, win 4107, options [nop,nop,TS val 23204 ecr 244109,mptcp dss ack 3825203810 seq 2344832511 subseq 789685 len 1428 csum 0xf6e5], length 1428
16:29:14.013575 IP 112.26.0.8.59987 > 112.26.1.1.targus-getdata1: Flags [.], seq 141372:142800, ack 1, win 4107, options [nop,nop,TS val 22898 ecr 243789,mptcp dss ack 3825203810 seq 2344823943 subseq 599761 len 1428 csum 0xc0e2], length 1428
16:29:14.016424 IP 112.26.1.1.targus-getdata1 > 112.26.0.8.59987: Flags [.], ack 131376, win 24488, options [nop,nop,TS val 244201 ecr 22090,nop,nop,sack 1 {134232:141372},mptcp dss ack 2344682571], length 0
16:29:14.096428 IP 112.26.0.8.59987 > 112.26.1.1.targus-getdata1: Flags [.], seq 142800:144228, ack 1, win 4107, options [nop,nop,TS val 22978 ecr 243821,mptcp dss ack 3825203810 seq 2344825371 subseq 601189 len 1428 csum 0xc782], length 1428
16:29:14.107546 IP 112.26.2.1.targus-getdata1 > 112.26.0.8.54549: Flags [.], ack 548352, win 24488, options [nop,nop,TS val 244292 ecr 22288,mptcp dss ack 2344682571], length 0
16:29:14.107771 IP 112.26.0.8.59987 > 112.26.1.1.targus-getdata1: Flags [.], seq 145656:147084, ack 1, win 4107, options [nop,nop,TS val 23377 ecr 244201,mptcp dss ack 3825203810 seq 2344833939 subseq 604045 len 1428 csum 0xd558], length 1428
16:29:14.107871 IP 112.26.0.8.54549 > 112.26.2.1.targus-getdata1: Flags [.], seq 549780:551208, ack 1, win 4107, options [nop,nop,TS val 23377 ecr 244292,mptcp dss ack 3825203810 seq 2344835367 subseq 791113 len 1428 csum 0x1809], length 1428
16:29:14.130319 IP 112.26.0.8.41772 > 112.26.0.1.targus-getdata1: Flags [.], seq 419833:421261, ack 0, win 4107, options [nop,nop,TS val 22978 ecr 243911,mptcp dss ack 3825203810 seq 2344826799 subseq 512690 len 1428 csum 0x41c], length 1428
16:29:14.139131 IP 112.26.0.1.targus-getdata1 > 112.26.0.8.41772: Flags [.], ack 416977, win 24488, options [nop,nop,TS val 244325 ecr 22384,mptcp dss ack 2344682571], length 0
16:29:14.139425 IP 112.26.0.8.41772 > 112.26.0.1.targus-getdata1: Flags [.], seq 424117:425545, ack 0, win 4107, options [nop,nop,TS val 23408 ecr 244325,mptcp dss ack 3825203810 seq 2344836795 subseq 516974 len 1428 csum 0xd8cc], length 1428
16:29:14.218896 IP 112.26.0.1.targus-getdata1 > 112.26.0.8.41772: Flags [.], ack 418405, win 24488, options [nop,nop,TS val 244400 ecr 22562,mptcp dss ack 2344682571], length 0
16:29:14.219176 IP 112.26.0.8.41772 > 112.26.0.1.targus-getdata1: Flags [.], seq 425545:426973, ack 0, win 4107, options [nop,nop,TS val 23488 ecr 244400,mptcp dss ack 3825203810 seq 2344838223 subseq 518402 len 1428 csum 0x57c8], length 1428
16:29:14.219240 IP 112.26.0.8.41772 > 112.26.0.1.targus-getdata1: Flags [.], seq 426973:428401, ack 0, win 4107, options [nop,nop,TS val 23488 ecr 244400,mptcp dss ack 3825203810 seq 2344839651 subseq 519830 len 1428 csum 0x89fe], length 1428
16:29:14.224120 IP 112.26.0.8.41772 > 112.26.0.1.targus-getdata1: Flags [.], seq 421261:422689, ack 0, win 4107, options [nop,nop,TS val 22978 ecr 243911,mptcp dss ack 3825203810 seq 2344828227 subseq 514118 len 1428 csum 0x9a9e], length 1428
16:29:14.303110 IP 112.26.0.8.41772 > 112.26.0.1.targus-getdata1: Flags [.], seq 422689:424117, ack 0, win 4107, options [nop,nop,TS val 23006 ecr 243993,mptcp dss ack 3825203810 seq 2344829655 subseq 515546 len 1428 csum 0x156d], length 1428
16:29:14.316232 IP 112.26.0.1.targus-getdata1 > 112.26.0.8.41772: Flags [.], ack 419833, win 24488, options [nop,nop,TS val 244429 ecr 22562,mptcp dss ack 2344682571], length 0
16:29:14.316740 IP 112.26.0.8.41772 > 112.26.0.1.targus-getdata1: Flags [.], seq 428401:429829, ack 0, win 4107, options [nop,nop,TS val 23585 ecr 244429,mptcp dss ack 3825203810 seq 2344841079 subseq 521258 len 1428 csum 0x835e], length 1428
16:29:14.388181 IP 112.26.0.8.59987 > 112.26.1.1.targus-getdata1: Flags [.], seq 144228:145656, ack 1, win 4107, options [nop,nop,TS val 23092 ecr 244026,mptcp dss ack 3825203810 seq 2344831083 subseq 602617 len 1428 csum 0xa687], length 1428
16:29:14.396635 IP 112.26.1.1.targus-getdata1 > 112.26.0.8.59987: Flags [.], ack 132804, win 24488, options [nop,nop,TS val 244507 ecr 22693,nop,nop,sack 1 {134232:141372},mptcp dss ack 2344682571], length 0
16:29:14.397010 IP 112.26.0.8.59987 > 112.26.1.1.targus-getdata1: Flags [.], seq 147084:148512, ack 1, win 4107, options [nop,nop,TS val 23666 ecr 244507,mptcp dss ack 3825203810 seq 2344842507 subseq 605473 len 1428 csum 0xefb3], length 1428
16:29:14.428968 IP 112.26.0.8.54549 > 112.26.2.1.targus-getdata1: Flags [.], seq 548352:549780, ack 1, win 4107, options [nop,nop,TS val 23204 ecr 244109,mptcp dss ack 3825203810 seq 2344832511 subseq 789685 len 1428 csum 0xf6e5], length 1428
16:29:14.493433 IP 112.26.1.1.targus-getdata1 > 112.26.0.8.59987: Flags [.], ack 141372, win 24488, options [nop,nop,TS val 244598 ecr 22792,mptcp dss ack 2344682571], length 0
16:29:14.493890 IP 112.26.0.8.59987 > 112.26.1.1.targus-getdata1: Flags [.], seq 148512:149940, ack 1, win 4107, options [nop,nop,TS val 23763 ecr 244598,mptcp dss ack 3825203810 seq 2344843935 subseq 606901 len 1428 csum 0xe580], length 1428
16:29:14.512060 IP 112.26.0.8.59987 > 112.26.1.1.targus-getdata1: Flags [.], seq 145656:147084, ack 1, win 4107, options [nop,nop,TS val 23377 ecr 244201,mptcp dss ack 3825203810 seq 2344833939 subseq 604045 len 1428 csum 0xd558], length 1428
16:29:14.532846 IP 112.26.1.1.targus-getdata1 > 112.26.0.8.59987: Flags [.], ack 142800, win 24488, options [nop,nop,TS val 244627 ecr 22898,mptcp dss ack 2344682571], length 0
16:29:14.533114 IP 112.26.0.8.59987 > 112.26.1.1.targus-getdata1: Flags [.], seq 149940:151368, ack 1, win 4107, options [nop,nop,TS val 23802 ecr 244627,mptcp dss ack 3825203810 seq 2344845363 subseq 608329 len 1428 csum 0xf770], length 1428
16:29:14.588802 IP 112.26.0.8.54549 > 112.26.2.1.targus-getdata1: Flags [.], seq 549780:551208, ack 1, win 4107, options [nop,nop,TS val 23377 ecr 244292,mptcp dss ack 3825203810 seq 2344835367 subseq 791113 len 1428 csum 0x1809], length 1428
16:29:14.609977 IP 112.26.1.1.targus-getdata1 > 112.26.0.8.59987: Flags [.], ack 144228, win 24488, options [nop,nop,TS val 244716 ecr 22978,mptcp dss ack 2344682571], length 0
16:29:14.610286 IP 112.26.0.8.59987 > 112.26.1.1.targus-getdata1: Flags [.], seq 151368:152796, ack 1, win 4107, options [nop,nop,TS val 23879 ecr 244716,mptcp dss ack 3825203810 seq 2344846791 subseq 609757 len 1428 csum 0xe40], length 1428
16:29:14.610348 IP 112.26.0.8.59987 > 112.26.1.1.targus-getdata1: Flags [.], seq 152796:154224, ack 1, win 4107, options [nop,nop,TS val 23879 ecr 244716,mptcp dss ack 3825203810 seq 2344848219 subseq 611185 len 1428 csum 0x7456], length 1428
16:29:14.626839 IP 112.26.0.8.41772 > 112.26.0.1.targus-getdata1: Flags [.], seq 424117:425545, ack 0, win 4107, options [nop,nop,TS val 23408 ecr 244325,mptcp dss ack 3825203810 seq 2344836795 subseq 516974 len 1428 csum 0xd8cc], length 1428
16:29:14.641420 IP 112.26.0.1.targus-getdata1 > 112.26.0.8.41772: Flags [.], ack 421261, win 24488, options [nop,nop,TS val 244798 ecr 22978,mptcp dss ack 2344682571], length 0
16:29:14.641716 IP 112.26.0.8.41772 > 112.26.0.1.targus-getdata1: Flags [.], seq 429829:431257, ack 0, win 4107, options [nop,nop,TS val 23910 ecr 244798,mptcp dss ack 3825203810 seq 2344849647 subseq 522686 len 1428 csum 0x6f3f], length 1428
16:29:14.707464 IP 112.26.0.8.41772 > 112.26.0.1.targus-getdata1: Flags [.], seq 425545:426973, ack 0, win 4107, options [nop,nop,TS val 23488 ecr 244400,mptcp dss ack 3825203810 seq 2344838223 subseq 518402 len 1428 csum 0x57c8], length 1428
16:29:14.722025 IP 112.26.0.1.targus-getdata1 > 112.26.0.8.41772: Flags [.], ack 422689, win 24488, options [nop,nop,TS val 244889 ecr 22978,mptcp dss ack 2344682571], length 0
16:29:14.722314 IP 112.26.0.8.41772 > 112.26.0.1.targus-getdata1: Flags [.], seq 431257:432685, ack 0, win 4107, options [nop,nop,TS val 23991 ecr 244889,mptcp dss ack 3825203810 seq 2344851075 subseq 524114 len 1428 csum 0xde01], length 1428
16:29:14.734923 IP 112.26.0.1.targus-getdata1 > 112.26.0.8.41772: Flags [.], ack 424117, win 24488, options [nop,nop,TS val 244910 ecr 23006,mptcp dss ack 2344682571], length 0
16:29:14.735192 IP 112.26.0.8.41772 > 112.26.0.1.targus-getdata1: Flags [.], seq 432685:434113, ack 0, win 4107, options [nop,nop,TS val 24004 ecr 244910,mptcp dss ack 3825203810 seq 2344852503 subseq 525542 len 1428 csum 0x9047], length 1428
16:29:14.794677 IP 112.26.0.8.41772 > 112.26.0.1.targus-getdata1: Flags [.], seq 426973:428401, ack 0, win 4107, options [nop,nop,TS val 23488 ecr 244400,mptcp dss ack 3825203810 seq 2344839651 subseq 519830 len 1428 csum 0x89fe], length 1428
16:29:14.821065 IP 112.26.0.8.41772 > 112.26.0.1.targus-getdata1: Flags [.], seq 428401:429829, ack 0, win 4107, options [nop,nop,TS val 23585 ecr 244429,mptcp dss ack 3825203810 seq 2344841079 subseq 521258 len 1428 csum 0x835e], length 1428
16:29:14.823922 IP 112.26.1.1.targus-getdata1 > 112.26.0.8.59987: Flags [.], ack 145656, win 24488, options [nop,nop,TS val 245002 ecr 23092,mptcp dss ack 2344682571], length 0
16:29:14.824216 IP 112.26.0.8.59987 > 112.26.1.1.targus-getdata1: Flags [.], seq 154224:155652, ack 1, win 4107, options [nop,nop,TS val 24093 ecr 245002,mptcp dss ack 3825203810 seq 2344853931 subseq 612613 len 1428 csum 0x8ae], length 1428
16:29:14.902409 IP 112.26.0.8.59987 > 112.26.1.1.targus-getdata1: Flags [.], seq 147084:148512, ack 1, win 4107, options [nop,nop,TS val 23666 ecr 244507,mptcp dss ack 3825203810 seq 2344842507 subseq 605473 len 1428 csum 0xefb3], length 1428
16:29:14.916318 IP 112.26.2.1.targus-getdata1 > 112.26.0.8.54549: Flags [.], ack 549780, win 24488, options [nop,nop,TS val 245031 ecr 23204,mptcp dss ack 2344682571], length 0
16:29:14.916571 IP 112.26.0.8.54549 > 112.26.2.1.targus-getdata1: Flags [.], seq 551208:552636, ack 1, win 4107, options [nop,nop,TS val 24185 ecr 245031,mptcp dss ack 3825203810 seq 2344855359 subseq 792541 len 1428 csum 0x6dba], length 1428
16:29:14.916638 IP 112.26.0.8.54549 > 112.26.2.1.targus-getdata1: Flags [.], seq 552636:554064, ack 1, win 4107, options [nop,nop,TS val 24185 ecr 245031,mptcp dss ack 3825203810 seq 2344856787 subseq 793969 len 1428 csum 0xaec0], length 1428
16:29:14.941964 IP 112.26.0.8.59987 > 112.26.1.1.targus-getdata1: Flags [.], seq 148512:149940, ack 1, win 4107, options [nop,nop,TS val 23763 ecr 244598,mptcp dss ack 3825203810 seq 2344843935 subseq 606901 len 1428 csum 0xe580], length 1428
16:29:15.005334 IP 112.26.1.1.targus-getdata1 > 112.26.0.8.59987: Flags [.], ack 147084, win 24488, options [nop,nop,TS val 245115 ecr 23377,mptcp dss ack 2344682571], length 0
16:29:15.005604 IP 112.26.0.8.59987 > 112.26.1.1.targus-getdata1: Flags [.], seq 155652:157080, ack 1, win 4107, options [nop,nop,TS val 24274 ecr 245115,mptcp dss ack 3825203810 seq 2344858215 subseq 614041 len 1428 csum 0x178a], length 1428
16:29:15.005673 IP 112.26.0.8.59987 > 112.26.1.1.targus-getdata1: Flags [.], seq 157080:158508, ack 1, win 4107, options [nop,nop,TS val 24274 ecr 245115,mptcp dss ack 3825203810 seq 2344859643 subseq 615469 len 1428 csum 0xa2f3], length 1428
16:29:15.022956 IP 112.26.0.8.59987 > 112.26.1.1.targus-getdata1: Flags [.], seq 149940:151368, ack 1, win 4107, options [nop,nop,TS val 23802 ecr 244627,mptcp dss ack 3825203810 seq 2344845363 subseq 608329 len 1428 csum 0xf770], length 1428
16:29:15.093072 IP 112.26.2.1.targus-getdata1 > 112.26.0.8.54549: Flags [.], ack 551208, win 24488, options [nop,nop,TS val 245195 ecr 23377,mptcp dss ack 2344682571], length 0
16:29:15.093412 IP 112.26.0.8.54549 > 112.26.2.1.targus-getdata1: Flags [.], seq 554064:555492, ack 1, win 4107, options [nop,nop,TS val 24362 ecr 245195,mptcp dss ack 3825203810 seq 2344861071 subseq 795397 len 1428 csum 0x181b], length 1428
16:29:15.107938 IP 112.26.0.8.59987 > 112.26.1.1.targus-getdata1: Flags [.], seq 151368:152796, ack 1, win 4107, options [nop,nop,TS val 23879 ecr 244716,mptcp dss ack 3825203810 seq 2344846791 subseq 609757 len 1428 csum 0xe40], length 1428
16:29:15.129862 IP 112.26.0.8.59987 > 112.26.1.1.targus-getdata1: Flags [.], seq 152796:154224, ack 1, win 4107, options [nop,nop,TS val 23879 ecr 244716,mptcp dss ack 3825203810 seq 2344848219 subseq 611185 len 1428 csum 0x7456], length 1428
16:29:15.138141 IP 112.26.0.1.targus-getdata1 > 112.26.0.8.41772: Flags [.], ack 426973, win 24488, options [nop,nop,TS val 245308 ecr 23488,mptcp dss ack 2344682571], length 0
16:29:15.138400 IP 112.26.0.8.41772 > 112.26.0.1.targus-getdata1: Flags [.], seq 434113:435541, ack 0, win 4107, options [nop,nop,TS val 24407 ecr 245308,mptcp dss ack 3825203810 seq 2344862499 subseq 526970 len 1428 csum 0xcaae], length 1428
16:29:15.138466 IP 112.26.0.8.41772 > 112.26.0.1.targus-getdata1: Flags [.], seq 435541:436969, ack 0, win 4107, options [nop,nop,TS val 24407 ecr 245308,mptcp dss ack 3825203810 seq 2344863927 subseq 528398 len 1428 csum 0xf59c], length 1428
16:29:15.214540 IP 112.26.0.8.41772 > 112.26.0.1.targus-getdata1: Flags [.], seq 429829:431257, ack 0, win 4107, options [nop,nop,TS val 23910 ecr 244798,mptcp dss ack 3825203810 seq 2344849647 subseq 522686 len 1428 csum 0x6f3f], length 1428
16:29:15.225125 IP 112.26.0.1.targus-getdata1 > 112.26.0.8.41772: Flags [.], ack 428401, win 24488, options [nop,nop,TS val 245397 ecr 23488,mptcp dss ack 2344682571], length 0
16:29:15.225415 IP 112.26.0.8.41772 > 112.26.0.1.targus-getdata1: Flags [.], seq 436969:438397, ack 0, win 4107, options [nop,nop,TS val 24494 ecr 245397,mptcp dss ack 3825203810 seq 2344865355 subseq 529826 len 1428 csum 0x9e1], length 1428
16:29:15.225479 IP 112.26.0.8.41772 > 112.26.0.1.targus-getdata1: Flags [.], seq 438397:439825, ack 0, win 4107, options [nop,nop,TS val 24494 ecr 245397,mptcp dss ack 3825203810 seq 2344866783 subseq 531254 len 1428 csum 0xc2de], length 1428
16:29:15.299971 IP 112.26.0.8.41772 > 112.26.0.1.targus-getdata1: Flags [.], seq 431257:432685, ack 0, win 4107, options [nop,nop,TS val 23991 ecr 244889,mptcp dss ack 3825203810 seq 2344851075 subseq 524114 len 1428 csum 0xde01], length 1428
16:29:15.333327 IP 112.26.0.8.41772 > 112.26.0.1.targus-getdata1: Flags [.], seq 432685:434113, ack 0, win 4107, options [nop,nop,TS val 24004 ecr 244910,mptcp dss ack 3825203810 seq 2344852503 subseq 525542 len 1428 csum 0x9047], length 1428
16:29:15.410196 IP 112.26.1.1.targus-getdata1 > 112.26.0.8.59987: Flags [.], ack 148512, win 24488, options [nop,nop,TS val 245524 ecr 23666,mptcp dss ack 2344682571], length 0
16:29:15.410613 IP 112.26.0.8.59987 > 112.26.1.1.targus-getdata1: Flags [.], seq 158508:159936, ack 1, win 4107, options [nop,nop,TS val 24679 ecr 245524,mptcp dss ack 3825203810 seq 2344868211 subseq 616897 len 1428 csum 0x5f1b], length 1428
16:29:15.423161 IP 112.26.0.8.54549 > 112.26.2.1.targus-getdata1: Flags [.], seq 551208:552636, ack 1, win 4107, options [nop,nop,TS val 24185 ecr 245031,mptcp dss ack 3825203810 seq 2344855359 subseq 792541 len 1428 csum 0x6dba], length 1428
16:29:15.497347 IP 112.26.1.1.targus-getdata1 > 112.26.0.8.59987: Flags [.], ack 149940, win 24488, options [nop,nop,TS val 245546 ecr 23763,mptcp dss ack 2344682571], length 0
16:29:15.497698 IP 112.26.0.8.59987 > 112.26.1.1.targus-getdata1: Flags [.], seq 159936:161364, ack 1, win 4107, options [nop,nop,TS val 24766 ecr 245546,mptcp dss ack 3825203810 seq 2344869639 subseq 618325 len 1428 csum 0xd3ee], length 1428
16:29:15.518611 IP 112.26.0.8.59987 > 112.26.1.1.targus-getdata1: Flags [.], seq 155652:157080, ack 1, win 4107, options [nop,nop,TS val 24274 ecr 245115,mptcp dss ack 3825203810 seq 2344858215 subseq 614041 len 1428 csum 0x178a], length 1428
16:29:15.519869 IP 112.26.1.1.targus-getdata1 > 112.26.0.8.59987: Flags [.], ack 151368, win 24488, options [nop,nop,TS val 245626 ecr 23802,mptcp dss ack 2344682571], length 0
16:29:15.520138 IP 112.26.0.8.59987 > 112.26.1.1.targus-getdata1: Flags [.], seq 161364:162792, ack 1, win 4107, options [nop,nop,TS val 24789 ecr 245626,mptcp dss ack 3825203810 seq 2344871067 subseq 619753 len 1428 csum 0xdb6b], length 1428
16:29:15.596589 IP 112.26.0.8.59987 > 112.26.1.1.targus-getdata1: Flags [.], seq 157080:158508, ack 1, win 4107, options [nop,nop,TS val 24274 ecr 245115,mptcp dss ack 3825203810 seq 2344859643 subseq 615469 len 1428 csum 0xa2f3], length 1428
16:29:15.598140 IP 112.26.1.1.targus-getdata1 > 112.26.0.8.59987: Flags [.], ack 152796, win 24488, options [nop,nop,TS val 245709 ecr 23879,mptcp dss ack 2344682571], length 0
16:29:15.598486 IP 112.26.0.8.59987 > 112.26.1.1.targus-getdata1: Flags [.], seq 162792:164220, ack 1, win 4107, options [nop,nop,TS val 24867 ecr 245709,mptcp dss ack 3825203810 seq 2344872495 subseq 621181 len 1428 csum 0x1ad5], length 1428
16:29:15.632191 IP 112.26.0.8.54549 > 112.26.2.1.targus-getdata1: Flags [.], seq 554064:555492, ack 1, win 4107, options [nop,nop,TS val 24362 ecr 245195,mptcp dss ack 3825203810 seq 2344861071 subseq 795397 len 1428 csum 0x181b], length 1428
16:29:15.704288 IP 112.26.1.1.targus-getdata1 > 112.26.0.8.59987: Flags [.], ack 154224, win 24488, options [nop,nop,TS val 245800 ecr 23879,mptcp dss ack 2344682571], length 0
16:29:15.704662 IP 112.26.0.8.59987 > 112.26.1.1.targus-getdata1: Flags [.], seq 164220:165648, ack 1, win 4107, options [nop,nop,TS val 24973 ecr 245800,mptcp dss ack 3825203810 seq 2344873923 subseq 622609 len 1428 csum 0x5e75], length 1428
16:29:15.707010 IP 112.26.0.8.41772 > 112.26.0.1.targus-getdata1: Flags [.], seq 434113:435541, ack 0, win 4107, options [nop,nop,TS val 24407 ecr 245308,mptcp dss ack 3825203810 seq 2344862499 subseq 526970 len 1428 csum 0xcaae], length 1428
16:29:15.723114 IP 112.26.0.8.41772 > 112.26.0.1.targus-getdata1: Flags [.], seq 435541:436969, ack 0, win 4107, options [nop,nop,TS val 24407 ecr 245308,mptcp dss ack 3825203810 seq 2344863927 subseq 528398 len 1428 csum 0xf59c], length 1428
16:29:15.731911 IP 112.26.0.1.targus-getdata1 > 112.26.0.8.41772: Flags [.], ack 431257, win 24488, options [nop,nop,TS val 245832 ecr 23910,mptcp dss ack 2344682571], length 0
16:29:15.732181 IP 112.26.0.8.41772 > 112.26.0.1.targus-getdata1: Flags [.], seq 439825:441253, ack 0, win 4107, options [nop,nop,TS val 25001 ecr 245832,mptcp dss ack 3825203810 seq 2344875351 subseq 532682 len 1428 csum 0x9e32], length 1428
16:29:15.732246 IP 112.26.0.8.41772 > 112.26.0.1.targus-getdata1: Flags [.], seq 441253:442681, ack 0, win 4107, options [nop,nop,TS val 25001 ecr 245832,mptcp dss ack 3825203810 seq 2344876779 subseq 534110 len 1428 csum 0xdb34], length 1428
16:29:15.795402 IP 112.26.0.8.41772 > 112.26.0.1.targus-getdata1: Flags [.], seq 436969:438397, ack 0, win 4107, options [nop,nop,TS val 24494 ecr 245397,mptcp dss ack 3825203810 seq 2344865355 subseq 529826 len 1428 csum 0x9e1], length 1428
16:29:15.806946 IP 112.26.0.1.targus-getdata1 > 112.26.0.8.41772: Flags [.], ack 432685, win 24488, options [nop,nop,TS val 245901 ecr 23991,mptcp dss ack 2344682571], length 0
16:29:15.807236 IP 112.26.0.8.41772 > 112.26.0.1.targus-getdata1: Flags [.], seq 442681:444109, ack 0, win 4107, options [nop,nop,TS val 25076 ecr 245901,mptcp dss ack 3825203810 seq 2344878207 subseq 535538 len 1428 csum 0x874a], length 1428
16:29:15.838565 IP 112.26.0.8.41772 > 112.26.0.1.targus-getdata1: Flags [.], seq 438397:439825, ack 0, win 4107, options [nop,nop,TS val 24494 ecr 245397,mptcp dss ack 3825203810 seq 2344866783 subseq 531254 len 1428 csum 0xc2de], length 1428
16:29:15.906608 IP 112.26.2.1.targus-getdata1 > 112.26.0.8.54549: Flags [.], ack 552636, win 24488, options [nop,nop,TS val 246024 ecr 24185,mptcp dss ack 2344682571], length 0
16:29:15.906876 IP 112.26.0.8.54549 > 112.26.2.1.targus-getdata1: Flags [.], seq 555492:556920, ack 1, win 4107, options [nop,nop,TS val 25175 ecr 246024,mptcp dss ack 3825203810 seq 2344879635 subseq 796825 len 1428 csum 0x9312], length 1428
16:29:15.929378 IP 112.26.0.8.59987 > 112.26.1.1.targus-getdata1: Flags [.], seq 158508:159936, ack 1, win 4107, options [nop,nop,TS val 24679 ecr 245524,mptcp dss ack 3825203810 seq 2344868211 subseq 616897 len 1428 csum 0x5f1b], length 1428
16:29:15.947992 IP 112.26.1.1.targus-getdata1 > 112.26.0.8.59987: Flags [.], ack 154224, win 24488, options [nop,nop,TS val 246119 ecr 23879,nop,nop,sack 1 {155652:157080},mptcp dss ack 2344682571], length 0
16:29:16.006149 IP 112.26.1.1.targus-getdata1 > 112.26.0.8.59987: Flags [.], ack 154224, win 24488, options [nop,nop,TS val 246215 ecr 23879,nop,nop,sack 1 {155652:158508},mptcp dss ack 2344682571], length 0
16:29:16.006466 IP 112.26.0.8.59987 > 112.26.1.1.targus-getdata1: Flags [.], seq 165648:167076, ack 1, win 4107, options [nop,nop,TS val 25275 ecr 246119,mptcp dss ack 3825203810 seq 2344881063 subseq 624037 len 1428 csum 0x6f40], length 1428
16:29:16.025521 IP 112.26.0.8.59987 > 112.26.1.1.targus-getdata1: Flags [.], seq 161364:162792, ack 1, win 4107, options [nop,nop,TS val 24789 ecr 245626,mptcp dss ack 3825203810 seq 2344871067 subseq 619753 len 1428 csum 0xdb6b], length 1428
16:29:16.037878 IP 112.26.2.1.targus-getdata1 > 112.26.0.8.54549: Flags [.], ack 552636, win 24488, options [nop,nop,TS val 246243 ecr 24185,nop,nop,sack 1 {554064:555492},mptcp dss ack 2344682571], length 0
16:29:16.038152 IP 112.26.0.8.59987 > 112.26.1.1.targus-getdata1: Flags [.], seq 167076:168504, ack 1, win 4107, options [nop,nop,TS val 25307 ecr 246215,mptcp dss ack 3825203810 seq 2344882491 subseq 625465 len 1428 csum 0x4f68], length 1428
16:29:16.108137 IP 112.26.0.1.targus-getdata1 > 112.26.0.8.41772: Flags [.], ack 435541, win 24488, options [nop,nop,TS val 246338 ecr 24407,mptcp dss ack 2344682571], length 0
16:29:16.108367 IP 112.26.0.8.54549 > 112.26.2.1.targus-getdata1: Flags [.], seq 556920:558348, ack 1, win 4107, options [nop,nop,TS val 25377 ecr 246243,mptcp dss ack 3825203810 seq 2344883919 subseq 798253 len 1428 csum 0x71a3], length 1428
16:29:16.108445 IP 112.26.0.8.41772 > 112.26.0.1.targus-getdata1: Flags [.], seq 444109:445537, ack 0, win 4107, options [nop,nop,TS val 25377 ecr 246338,mptcp dss ack 3825203810 seq 2344885347 subseq 536966 len 1428 csum 0x4bfa], length 1428
16:29:16.108507 IP 112.26.0.8.41772 > 112.26.0.1.targus-getdata1: Flags [.], seq 445537:446965, ack 0, win 4107, options [nop,nop,TS val 25377 ecr 246338,mptcp dss ack 3825203810 seq 2344886775 subseq 538394 len 1428 csum 0x6c37], length 1428
16:29:16.108655 IP 112.26.0.8.41772 > 112.26.0.1.targus-getdata1: Flags [.], seq 446965:448393, ack 0, win 4107, options [nop,nop,TS val 25377 ecr 246338,mptcp dss ack 3825203810 seq 2344888203 subseq 539822 len 1428 csum 0x2ef5], length 1428
16:29:16.118749 IP 112.26.0.8.59987 > 112.26.1.1.targus-getdata1: Flags [.], seq 164220:165648, ack 1, win 4107, options [nop,nop,TS val 24973 ecr 245800,mptcp dss ack 3825203810 seq 2344873923 subseq 622609 len 1428 csum 0x5e75], length 1428
16:29:16.205765 IP 112.26.0.1.targus-getdata1 > 112.26.0.8.41772: Flags [.], ack 436969, win 24488, options [nop,nop,TS val 246419 ecr 24407,mptcp dss ack 2344682571], length 0
