16:27:02.733328 IP 112.26.0.8.41770 > 112.26.0.1.targus-getdata1: Flags [S], seq 2031178631, win 65535, options [mss 1460,sackOK,TS val 4294859235 ecr 0,nop,wscale 6,mptcp capable csum {0x57c080ebc044a6f2}], length 0
16:27:02.813170 IP 112.26.0.8.41770 > 112.26.0.1.targus-getdata1: Flags [S], seq 2031178631, win 65535, options [mss 1460,sackOK,TS val 4294859235 ecr 0,nop,wscale 6,mptcp capable csum {0x57c080ebc044a6f2}], length 0
16:27:02.828714 IP 112.26.0.1.targus-getdata1 > 112.26.0.8.41770: Flags [S.], seq 1386844041, ack 2031178632, win 65535, options [mss 1460,sackOK,TS val 113413 ecr 4294859235,nop,wscale 6,mptcp capable csum {0xdcbc4ddaee5b51ac}], length 0
16:27:02.841921 IP 112.26.0.1.targus-getdata1 > 112.26.0.8.41770: Flags [S.], seq 1386844041, ack 2031178632, win 65535, options [mss 1460,sackOK,TS val 113413 ecr 4294859235,nop,wscale 6,mptcp capable csum {0xdcbc4ddaee5b51ac}], length 0
16:27:02.918249 IP 112.26.0.1.targus-getdata1 > 112.26.0.8.41770: Flags [S.], seq 1386844041, ack 2031178632, win 65535, options [mss 1460,sackOK,TS val 113413 ecr 4294859235,nop,wscale 6,mptcp capable csum {0xdcbc4ddaee5b51ac}], length 0
16:27:03.033277 IP 112.26.0.8.41770 > 112.26.0.1.targus-getdata1: Flags [.], ack 1, win 1369, options [nop,nop,TS val 4294859483 ecr 113413,mptcp capable csum {0x57c080ebc044a6f2,0xdcbc4ddaee5b51ac},mptcp dss ack 196611476], length 0
16:27:03.037767 IP 112.26.0.8.41770 > 112.26.0.1.targus-getdata1: Flags [.], ack 1, win 1369, options [nop,nop,TS val 4294859483 ecr 113413,mptcp capable csum {0x57c080ebc044a6f2,0xdcbc4ddaee5b51ac},mptcp dss ack 196611476], length 0
16:27:51.002547 IP 112.26.0.1.targus-getdata1 > 112.26.0.8.41772: Flags [.], ack 1772731111, win 24509, options [nop,nop,TS val 161543 ecr 4294905381,nop,nop,sack 1 {1429:5713},mptcp dss ack 2343418791], length 0
16:27:51.023833 IP 112.26.0.8.54549 > 112.26.2.1.targus-getdata1: Flags [.], seq 1666355189:1666356617, ack 1824504722, win 4107, options [nop,nop,TS val 4294907205 ecr 161198,mptcp dss ack 3825203810 seq 2343468771 subseq 241333 len 1428 csum 0x3d39], length 1428
16:27:51.026591 IP 112.26.0.8.54549 > 112.26.2.1.targus-getdata1: Flags [.], seq 0:1428, ack 1, win 4107, options [nop,nop,TS val 4294907205 ecr 161198,mptcp dss ack 3825203810 seq 2343468771 subseq 241333 len 1428 csum 0x3d39], length 1428
16:27:51.027670 IP 112.26.2.1.targus-getdata1 > 112.26.0.8.54549: Flags [.], ack 2856, win 24509, options [nop,nop,TS val 161625 ecr 4294907205,mptcp dss ack 2343418791], length 0
16:27:51.039826 IP 112.26.2.1.targus-getdata1 > 112.26.0.8.54549: Flags [.], ack 2856, win 24509, options [nop,nop,TS val 161625 ecr 4294907205,mptcp dss ack 2343418791], length 0
16:27:51.103512 IP 112.26.0.8.60507 > 112.26.3.1.targus-getdata1: Flags [.], seq 3537363710:3537365138, ack 3490778089, win 4107, options [nop,nop,TS val 4294907272 ecr 160895,mptcp dss ack 3825203810 seq 2343418791 subseq 211345 len 1428 csum 0x4757], length 1428
16:27:51.105712 IP 112.26.0.8.60507 > 112.26.3.1.targus-getdata1: Flags [.], seq 0:1428, ack 1, win 4107, options [nop,nop,TS val 4294907272 ecr 160895,mptcp dss ack 3825203810 seq 2343418791 subseq 211345 len 1428 csum 0x4757], length 1428
16:27:51.107757 IP 112.26.3.1.targus-getdata1 > 112.26.0.8.60507: Flags [.], ack 11424, win 24041, options [nop,nop,TS val 161705 ecr 4294907272,mptcp dss ack 2343448779], length 0
16:28:09.035276 IP 112.26.0.1.targus-getdata1 > 112.26.0.8.41772: Flags [.], ack 58549, win 24558, options [nop,nop,TS val 179629 ecr 4294924390,nop,nop,sack 1 {59977:62833},mptcp dss ack 2343722955], length 0
16:28:09.035580 IP 112.26.0.1.targus-getdata1 > 112.26.0.8.41772: Flags [.], ack 58549, win 24558, options [nop,nop,TS val 179629 ecr 4294924390,nop,nop,sack 1 {59977:62833},mptcp dss ack 2343722955], length 0
16:28:09.041066 IP 112.26.0.1.targus-getdata1 > 112.26.0.8.41772: Flags [.], ack 58549, win 24558, options [nop,nop,TS val 179629 ecr 4294924390,nop,nop,sack 1 {59977:62833},mptcp dss ack 2343722955], length 0
16:28:09.120177 IP 112.26.0.8.59987 > 112.26.1.1.targus-getdata1: Flags [.], seq 4001368577:4001370005, ack 3659179008, win 4107, options [nop,nop,TS val 4294925222 ecr 179208,mptcp dss ack 3825203810 seq 2343738663 subseq 337009 len 1428 csum 0x59f9], length 1428
16:28:28.574337 IP 112.26.2.1.targus-getdata1 > 112.26.0.8.54549: Flags [.], ack 189924, win 24322, options [nop,nop,TS val 199166 ecr 4294944628,mptcp dss ack 2343972855], length 0
16:28:28.629983 IP 112.26.0.1.targus-getdata1 > 112.26.0.8.41772: Flags [.], ack 137089, win 24411, options [nop,nop,TS val 198964 ecr 4294942991,nop,nop,sack 2 {147085:149941}{144229:145657},mptcp dss ack 2343967143], length 0
16:28:28.644894 IP 112.26.0.8.54549 > 112.26.2.1.targus-getdata1: Flags [.], seq 189924:191352, ack 1, win 4107, options [nop,nop,TS val 4294944703 ecr 198448,mptcp dss ack 3825203810 seq 2344035687 subseq 431257 len 1428 csum 0xf9c2], length 1428
16:28:28.668696 IP 112.26.0.8.59987 > 112.26.1.1.targus-getdata1: Flags [.], seq 44268:45696, ack 1, win 4107, options [nop,nop,TS val 4294945003 ecr 198860,mptcp dss ack 3825203810 seq 2343981423 subseq 381277 len 1428 csum 0xc16f], length 1428
16:28:28.670260 IP 112.26.2.1.targus-getdata1 > 112.26.0.8.54549: Flags [.], ack 191352, win 24322, options [nop,nop,TS val 199244 ecr 4294944703,mptcp dss ack 2343972855], length 0
16:28:28.671395 IP 112.26.0.1.targus-getdata1 > 112.26.0.8.41772: Flags [.], ack 142801, win 24411, options [nop,nop,TS val 199045 ecr 4294944288,nop,nop,sack 2 {147085:149941}{144229:145657},mptcp dss ack 2343967143], length 0
16:28:49.756485 IP 112.26.0.8.54549 > 112.26.2.1.targus-getdata1: Flags [.], seq 337008:338436, ack 1, win 4107, options [nop,nop,TS val 4294965947 ecr 219573,mptcp dss ack 3825203810 seq 2344384119 subseq 578341 len 1428 csum 0xd756], length 1428
16:28:49.759220 IP 112.26.2.1.targus-getdata1 > 112.26.0.8.54549: Flags [.], ack 338436, win 24558, options [nop,nop,TS val 220357 ecr 4294965947,mptcp dss ack 2344385547], length 0
16:28:49.762911 IP 112.26.0.8.54549 > 112.26.2.1.targus-getdata1: Flags [.], seq 337008:338436, ack 1, win 4107, options [nop,nop,TS val 4294965947 ecr 219573,mptcp dss ack 3825203810 seq 2344384119 subseq 578341 len 1428 csum 0xd756], length 1428
16:28:49.774451 IP 112.26.1.1.targus-getdata1 > 112.26.0.8.59987: Flags [.], ack 155652, win 24558, options [nop,nop,TS val 219960 ecr 4294965613,mptcp dss ack 2344376979], length 0
16:28:49.787606 IP 112.26.0.8.54549 > 112.26.2.1.targus-getdata1: Flags [.], seq 338436:339864, ack 1, win 4107, options [nop,nop,TS val 4294965947 ecr 219573,mptcp dss ack 3825203810 seq 2344385547 subseq 579769 len 1428 csum 0xfcdf], length 1428
16:28:49.844180 IP 112.26.2.1.targus-getdata1 > 112.26.0.8.54549: Flags [.], ack 339864, win 24558, options [nop,nop,TS val 220388 ecr 4294965947,mptcp dss ack 2344386975], length 0
16:28:49.845478 IP 112.26.0.8.54549 > 112.26.2.1.targus-getdata1: Flags [.], seq 338436:339864, ack 1, win 4107, options [nop,nop,TS val 4294965947 ecr 219573,mptcp dss ack 3825203810 seq 2344385547 subseq 579769 len 1428 csum 0xfcdf], length 1428
16:28:49.872054 IP 112.26.0.1.targus-getdata1 > 112.26.0.8.41772: Flags [.], ack 261325, win 24558, options [nop,nop,TS val 220051 ecr 4294965637,mptcp dss ack 2344378407], length 0
16:28:49.943630 IP 112.26.0.8.54549 > 112.26.2.1.targus-getdata1: Flags [.], seq 339864:341292, ack 1, win 4107, options [nop,nop,TS val 4294965947 ecr 219573,mptcp dss ack 3825203810 seq 2344386975 subseq 581197 len 1428 csum 0x94], length 1428
16:28:49.945410 IP 112.26.0.8.54549 > 112.26.2.1.targus-getdata1: Flags [.], seq 339864:341292, ack 1, win 4107, options [nop,nop,TS val 4294965947 ecr 219573,mptcp dss ack 3825203810 seq 2344386975 subseq 581197 len 1428 csum 0x94], length 1428
16:28:49.949333 IP 112.26.2.1.targus-getdata1 > 112.26.0.8.54549: Flags [.], ack 341292, win 24558, options [nop,nop,TS val 220544 ecr 4294965947,mptcp dss ack 2344388403], length 0
16:28:49.962219 IP 112.26.0.1.targus-getdata1 > 112.26.0.8.41772: Flags [.], ack 262753, win 24558, options [nop,nop,TS val 220082 ecr 4294965722,mptcp dss ack 2344379835], length 0
16:28:49.983204 IP 112.26.0.8.54549 > 112.26.2.1.targus-getdata1: Flags [.], seq 341292:342720, ack 1, win 4107, options [nop,nop,TS val 4294966040 ecr 219685,mptcp dss ack 3825203810 seq 2344388403 subseq 582625 len 1428 csum 0x186f], length 1428
16:28:49.985874 IP 112.26.2.1.targus-getdata1 > 112.26.0.8.54549: Flags [.], ack 342720, win 24558, options [nop,nop,TS val 220584 ecr 4294966040,mptcp dss ack 2344389831], length 0
16:28:49.988844 IP 112.26.0.8.54549 > 112.26.2.1.targus-getdata1: Flags [.], seq 341292:342720, ack 1, win 4107, options [nop,nop,TS val 4294966040 ecr 219685,mptcp dss ack 3825203810 seq 2344388403 subseq 582625 len 1428 csum 0x186f], length 1428
16:28:50.053651 IP 112.26.0.1.targus-getdata1 > 112.26.0.8.41772: Flags [.], ack 264181, win 24558, options [nop,nop,TS val 220159 ecr 4294965722,mptcp dss ack 2344381263], length 0
16:28:50.062474 IP 112.26.0.8.54549 > 112.26.2.1.targus-getdata1: Flags [.], seq 342720:344148, ack 1, win 4107, options [nop,nop,TS val 4294966040 ecr 219685,mptcp dss ack 3825203810 seq 2344389831 subseq 584053 len 1428 csum 0xa4bf], length 1428
16:28:50.067246 IP 112.26.0.8.54549 > 112.26.2.1.targus-getdata1: Flags [.], seq 342720:344148, ack 1, win 4107, options [nop,nop,TS val 4294966040 ecr 219685,mptcp dss ack 3825203810 seq 2344389831 subseq 584053 len 1428 csum 0xa4bf], length 1428
16:28:50.068848 IP 112.26.2.1.targus-getdata1 > 112.26.0.8.54549: Flags [.], ack 344148, win 24558, options [nop,nop,TS val 220667 ecr 4294966040,mptcp dss ack 2344391259], length 0
16:28:50.147775 IP 112.26.1.1.targus-getdata1 > 112.26.0.8.59987: Flags [.], ack 157080, win 24558, options [nop,nop,TS val 220189 ecr 4294965741,mptcp dss ack 2344382691], length 0
16:28:50.166981 IP 112.26.0.8.54549 > 112.26.2.1.targus-getdata1: Flags [.], seq 344148:345576, ack 1, win 4107, options [nop,nop,TS val 4294966133 ecr 219814,mptcp dss ack 3825203810 seq 2344391259 subseq 585481 len 1428 csum 0x23bb], length 1428
16:28:50.174045 IP 112.26.0.8.54549 > 112.26.2.1.targus-getdata1: Flags [.], seq 344148:345576, ack 1, win 4107, options [nop,nop,TS val 4294966133 ecr 219814,mptcp dss ack 3825203810 seq 2344391259 subseq 585481 len 1428 csum 0x23bb], length 1428
16:28:50.175237 IP 112.26.2.1.targus-getdata1 > 112.26.0.8.54549: Flags [.], ack 345576, win 24558, options [nop,nop,TS val 220774 ecr 4294966133,mptcp dss ack 2344392687], length 0
16:28:50.179964 IP 112.26.1.1.targus-getdata1 > 112.26.0.8.59987: Flags [.], ack 158508, win 24558, options [nop,nop,TS val 220281 ecr 4294965856,mptcp dss ack 2344384119], length 0
16:28:50.247624 IP 112.26.0.8.41772 > 112.26.0.1.targus-getdata1: Flags [.], seq 264181:265609, ack 0, win 4107, options [nop,nop,TS val 4294966213 ecr 219856,mptcp dss ack 3825203810 seq 2344392687 subseq 357038 len 1428 csum 0xd7e3], length 1428
16:28:50.254517 IP 112.26.2.1.targus-getdata1 > 112.26.0.8.54549: Flags [.], ack 338436, win 24558, options [nop,nop,TS val 220357 ecr 4294965947,mptcp dss ack 2344385547], length 0
16:28:50.265627 IP 112.26.0.8.41772 > 112.26.0.1.targus-getdata1: Flags [.], seq 264181:265609, ack 0, win 4107, options [nop,nop,TS val 4294966213 ecr 219856,mptcp dss ack 3825203810 seq 2344392687 subseq 357038 len 1428 csum 0xd7e3], length 1428
16:28:50.266876 IP 112.26.0.1.targus-getdata1 > 112.26.0.8.41772: Flags [.], ack 265609, win 24558, options [nop,nop,TS val 220865 ecr 4294966213,mptcp dss ack 2344394115], length 0
16:28:50.267161 IP 112.26.0.1.targus-getdata1 > 112.26.0.8.41772: Flags [.], ack 265609, win 24558, options [nop,nop,TS val 220865 ecr 4294966213,mptcp dss ack 2344394115], length 0
16:28:50.279897 IP 112.26.0.8.59987 > 112.26.1.1.targus-getdata1: Flags [.], seq 158508:159936, ack 1, win 4107, options [nop,nop,TS val 4294966243 ecr 219881,mptcp dss ack 3825203810 seq 2344394115 subseq 495517 len 1428 csum 0xb9e6], length 1428
16:28:50.293228 IP 112.26.2.1.targus-getdata1 > 112.26.0.8.54549: Flags [.], ack 339864, win 24558, options [nop,nop,TS val 220388 ecr 4294965947,mptcp dss ack 2344386975], length 0
16:28:50.358612 IP 112.26.0.8.59987 > 112.26.1.1.targus-getdata1: Flags [.], seq 158508:159936, ack 1, win 4107, options [nop,nop,TS val 4294966243 ecr 219881,mptcp dss ack 3825203810 seq 2344394115 subseq 495517 len 1428 csum 0xb9e6], length 1428
16:28:50.370009 IP 112.26.0.8.59987 > 112.26.1.1.targus-getdata1: Flags [.], seq 159936:161364, ack 1, win 4107, options [nop,nop,TS val 4294966339 ecr 219960,mptcp dss ack 3825203810 seq 2344395543 subseq 496945 len 1428 csum 0x69a0], length 1428
16:28:50.381758 IP 112.26.1.1.targus-getdata1 > 112.26.0.8.59987: Flags [.], ack 159936, win 24558, options [nop,nop,TS val 220958 ecr 4294966243,mptcp dss ack 2344395543], length 0
16:28:50.393309 IP 112.26.2.1.targus-getdata1 > 112.26.0.8.54549: Flags [.], ack 341292, win 24558, options [nop,nop,TS val 220544 ecr 4294965947,mptcp dss ack 2344388403], length 0
16:28:50.402628 IP 112.26.0.8.59987 > 112.26.1.1.targus-getdata1: Flags [.], seq 159936:161364, ack 1, win 4107, options [nop,nop,TS val 4294966339 ecr 219960,mptcp dss ack 3825203810 seq 2344395543 subseq 496945 len 1428 csum 0x69a0], length 1428
16:28:50.452681 IP 112.26.1.1.targus-getdata1 > 112.26.0.8.59987: Flags [.], ack 161364, win 24558, options [nop,nop,TS val 221002 ecr 4294966339,mptcp dss ack 2344396971], length 0
16:28:50.470611 IP 112.26.0.8.59987 > 112.26.1.1.targus-getdata1: Flags [.], seq 161364:162792, ack 1, win 4107, options [nop,nop,TS val 4294966339 ecr 219960,mptcp dss ack 3825203810 seq 2344396971 subseq 498373 len 1428 csum 0x5f6d], length 1428
16:28:50.476126 IP 112.26.0.8.59987 > 112.26.1.1.targus-getdata1: Flags [.], seq 161364:162792, ack 1, win 4107, options [nop,nop,TS val 4294966339 ecr 219960,mptcp dss ack 3825203810 seq 2344396971 subseq 498373 len 1428 csum 0x5f6d], length 1428
16:28:50.480310 IP 112.26.2.1.targus-getdata1 > 112.26.0.8.54549: Flags [.], ack 342720, win 24558, options [nop,nop,TS val 220584 ecr 4294966040,mptcp dss ack 2344389831], length 0
16:28:50.486614 IP 112.26.1.1.targus-getdata1 > 112.26.0.8.59987: Flags [.], ack 162792, win 24558, options [nop,nop,TS val 221076 ecr 4294966339,mptcp dss ack 2344398399], length 0
16:28:50.499054 IP 112.26.0.8.41772 > 112.26.0.1.targus-getdata1: Flags [.], seq 265609:267037, ack 0, win 4107, options [nop,nop,TS val 4294966437 ecr 220051,mptcp dss ack 3825203810 seq 2344398399 subseq 358466 len 1428 csum 0x9976], length 1428
16:28:50.553708 IP 112.26.0.8.41772 > 112.26.0.1.targus-getdata1: Flags [.], seq 265609:267037, ack 0, win 4107, options [nop,nop,TS val 4294966437 ecr 220051,mptcp dss ack 3825203810 seq 2344398399 subseq 358466 len 1428 csum 0x9976], length 1428
16:28:50.555538 IP 112.26.0.1.targus-getdata1 > 112.26.0.8.41772: Flags [.], ack 267037, win 24558, options [nop,nop,TS val 221153 ecr 4294966437,mptcp dss ack 2344399827], length 0
16:28:50.555909 IP 112.26.0.1.targus-getdata1 > 112.26.0.8.41772: Flags [.], ack 267037, win 24558, options [nop,nop,TS val 221153 ecr 4294966437,mptcp dss ack 2344399827], length 0
16:28:50.583903 IP 112.26.2.1.targus-getdata1 > 112.26.0.8.54549: Flags [.], ack 344148, win 24558, options [nop,nop,TS val 220667 ecr 4294966040,mptcp dss ack 2344391259], length 0
16:28:50.593659 IP 112.26.0.8.41772 > 112.26.0.1.targus-getdata1: Flags [.], seq 267037:268465, ack 0, win 4107, options [nop,nop,TS val 4294966527 ecr 220082,mptcp dss ack 3825203810 seq 2344399827 subseq 359894 len 1428 csum 0xb045], length 1428
16:28:50.610741 IP 112.26.0.8.41772 > 112.26.0.1.targus-getdata1: Flags [.], seq 267037:268465, ack 0, win 4107, options [nop,nop,TS val 4294966527 ecr 220082,mptcp dss ack 3825203810 seq 2344399827 subseq 359894 len 1428 csum 0xb045], length 1428
16:28:50.613892 IP 112.26.0.1.targus-getdata1 > 112.26.0.8.41772: Flags [.], ack 268465, win 24558, options [nop,nop,TS val 221210 ecr 4294966527,mptcp dss ack 2344401255], length 0
16:28:50.614167 IP 112.26.0.1.targus-getdata1 > 112.26.0.8.41772: Flags [.], ack 268465, win 24558, options [nop,nop,TS val 221210 ecr 4294966527,mptcp dss ack 2344401255], length 0
16:28:50.659490 IP 112.26.2.1.targus-getdata1 > 112.26.0.8.54549: Flags [.], ack 345576, win 24558, options [nop,nop,TS val 220774 ecr 4294966133,mptcp dss ack 2344392687], length 0
16:28:50.663656 IP 112.26.0.8.41772 > 112.26.0.1.targus-getdata1: Flags [.], seq 268465:269893, ack 0, win 4107, options [nop,nop,TS val 4294966618 ecr 220159,mptcp dss ack 3825203810 seq 2344401255 subseq 361322 len 1428 csum 0x165c], length 1428
16:28:50.691708 IP 112.26.0.8.59987 > 112.26.1.1.targus-getdata1: Flags [.], seq 164220:165648, ack 1, win 4107, options [nop,nop,TS val 4294966744 ecr 220281,mptcp dss ack 3825203810 seq 2344404111 subseq 501229 len 1428 csum 0x962], length 1428
16:28:50.770260 IP 112.26.0.1.targus-getdata1 > 112.26.0.8.41772: Flags [.], ack 265609, win 24558, options [nop,nop,TS val 220865 ecr 4294966213,mptcp dss ack 2344394115], length 0
16:28:50.771197 IP 112.26.0.8.54549 > 112.26.2.1.targus-getdata1: Flags [.], seq 345576:347004, ack 1, win 4107, options [nop,nop,TS val 4294966819 ecr 220357,mptcp dss ack 3825203810 seq 2344405539 subseq 586909 len 1428 csum 0x728a], length 1428
16:28:50.787257 IP 112.26.0.8.41772 > 112.26.0.1.targus-getdata1: Flags [.], seq 268465:269893, ack 0, win 4107, options [nop,nop,TS val 4294966618 ecr 220159,mptcp dss ack 3825203810 seq 2344401255 subseq 361322 len 1428 csum 0x165c], length 1428
16:28:50.788561 IP 112.26.0.1.targus-getdata1 > 112.26.0.8.41772: Flags [.], ack 269893, win 24558, options [nop,nop,TS val 221387 ecr 4294966618,mptcp dss ack 2344402683], length 0
16:28:50.788910 IP 112.26.0.1.targus-getdata1 > 112.26.0.8.41772: Flags [.], ack 269893, win 24558, options [nop,nop,TS val 221387 ecr 4294966618,mptcp dss ack 2344402683], length 0
16:28:50.855929 IP 112.26.1.1.targus-getdata1 > 112.26.0.8.59987: Flags [.], ack 159936, win 24558, options [nop,nop,TS val 220958 ecr 4294966243,mptcp dss ack 2344395543], length 0
16:28:50.869030 IP 112.26.0.8.54549 > 112.26.2.1.targus-getdata1: Flags [.], seq 347004:348432, ack 1, win 4107, options [nop,nop,TS val 4294966819 ecr 220357,mptcp dss ack 3825203810 seq 2344406967 subseq 588337 len 1428 csum 0x397d], length 1428
16:28:50.874072 IP 112.26.0.8.59987 > 112.26.1.1.targus-getdata1: Flags [.], seq 164220:165648, ack 1, win 4107, options [nop,nop,TS val 4294966744 ecr 220281,mptcp dss ack 3825203810 seq 2344404111 subseq 501229 len 1428 csum 0x962], length 1428
16:28:50.875273 IP 112.26.1.1.targus-getdata1 > 112.26.0.8.59987: Flags [.], ack 162792, win 24576, options [nop,nop,TS val 221473 ecr 4294966339,nop,nop,sack 1 {164220:165648},mptcp dss ack 2344402683], length 0
16:28:50.891852 IP 112.26.1.1.targus-getdata1 > 112.26.0.8.59987: Flags [.], ack 161364, win 24558, options [nop,nop,TS val 221002 ecr 4294966339,mptcp dss ack 2344396971], length 0
16:28:50.900202 IP 112.26.0.8.54549 > 112.26.2.1.targus-getdata1: Flags [.], seq 349860:351288, ack 1, win 4107, options [nop,nop,TS val 4294966858 ecr 220388,mptcp dss ack 3825203810 seq 2344409823 subseq 591193 len 1428 csum 0x98d6], length 1428
16:28:50.952828 IP 112.26.0.8.54549 > 112.26.2.1.targus-getdata1: Flags [.], seq 345576:347004, ack 1, win 4107, options [nop,nop,TS val 4294966819 ecr 220357,mptcp dss ack 3825203810 seq 2344405539 subseq 586909 len 1428 csum 0x728a], length 1428
16:28:50.959659 IP 112.26.2.1.targus-getdata1 > 112.26.0.8.54549: Flags [.], ack 347004, win 24576, options [nop,nop,TS val 221552 ecr 4294966819,mptcp dss ack 2344402683], length 0
16:28:50.978354 IP 112.26.0.8.54549 > 112.26.2.1.targus-getdata1: Flags [.], seq 351288:352716, ack 1, win 4107, options [nop,nop,TS val 4294966958 ecr 220544,mptcp dss ack 3825203810 seq 2344411251 subseq 592621 len 1428 csum 0x3d31], length 1428
16:28:50.982221 IP 112.26.0.8.54549 > 112.26.2.1.targus-getdata1: Flags [.], seq 347004:348432, ack 1, win 4107, options [nop,nop,TS val 4294966819 ecr 220357,mptcp dss ack 3825203810 seq 2344406967 subseq 588337 len 1428 csum 0x397d], length 1428
16:28:50.984882 IP 112.26.2.1.targus-getdata1 > 112.26.0.8.54549: Flags [.], ack 348432, win 24576, options [nop,nop,TS val 221582 ecr 4294966819,mptcp dss ack 2344402683], length 0
16:28:50.999062 IP 112.26.0.1.targus-getdata1 > 112.26.0.8.41772: Flags [.], ack 267037, win 24558, options [nop,nop,TS val 221153 ecr 4294966437,mptcp dss ack 2344399827], length 0
16:28:51.061872 IP 112.26.0.8.54549 > 112.26.2.1.targus-getdata1: Flags [.], seq 349860:351288, ack 1, win 4107, options [nop,nop,TS val 4294966858 ecr 220388,mptcp dss ack 3825203810 seq 2344409823 subseq 591193 len 1428 csum 0x98d6], length 1428
16:28:51.063092 IP 112.26.2.1.targus-getdata1 > 112.26.0.8.54549: Flags [.], ack 348432, win 24576, options [nop,nop,TS val 221661 ecr 4294966819,nop,nop,sack 1 {349860:351288},mptcp dss ack 2344402683], length 0
16:28:51.070885 IP 112.26.0.8.54549 > 112.26.2.1.targus-getdata1: Flags [.], seq 352716:354144, ack 1, win 4107, options [nop,nop,TS val 4294967045 ecr 220584,mptcp dss ack 3825203810 seq 2344412679 subseq 594049 len 1428 csum 0xc89a], length 1428
16:28:51.074231 IP 112.26.0.1.targus-getdata1 > 112.26.0.8.41772: Flags [.], ack 268465, win 24558, options [nop,nop,TS val 221210 ecr 4294966527,mptcp dss ack 2344401255], length 0
16:28:51.085909 IP 112.26.0.8.54549 > 112.26.2.1.targus-getdata1: Flags [.], seq 351288:352716, ack 1, win 4107, options [nop,nop,TS val 4294966958 ecr 220544,mptcp dss ack 3825203810 seq 2344411251 subseq 592621 len 1428 csum 0x3d31], length 1428
16:28:51.097100 IP 112.26.2.1.targus-getdata1 > 112.26.0.8.54549: Flags [.], ack 348432, win 24576, options [nop,nop,TS val 221685 ecr 4294966819,nop,nop,sack 1 {349860:352716},mptcp dss ack 2344402683], length 0
16:28:51.153251 IP 112.26.0.8.54549 > 112.26.2.1.targus-getdata1: Flags [.], seq 352716:354144, ack 1, win 4107, options [nop,nop,TS val 4294967045 ecr 220584,mptcp dss ack 3825203810 seq 2344412679 subseq 594049 len 1428 csum 0xc89a], length 1428
16:28:51.162492 IP 112.26.0.8.54549 > 112.26.2.1.targus-getdata1: Flags [.], seq 355572:357000, ack 1, win 4107, options [nop,nop,TS val 4294967148 ecr 220667,mptcp dss ack 3825203810 seq 2344415535 subseq 596905 len 1428 csum 0x8b79], length 1428
16:28:51.166402 IP 112.26.2.1.targus-getdata1 > 112.26.0.8.54549: Flags [.], ack 348432, win 24576, options [nop,nop,TS val 221753 ecr 4294966819,nop,nop,sack 1 {349860:354144},mptcp dss ack 2344402683], length 0
16:28:51.177622 IP 112.26.0.1.targus-getdata1 > 112.26.0.8.41772: Flags [.], ack 269893, win 24558, options [nop,nop,TS val 221387 ecr 4294966618,mptcp dss ack 2344402683], length 0
16:28:51.196630 IP 112.26.0.8.54549 > 112.26.2.1.targus-getdata1: Flags [.], seq 357000:358428, ack 1, win 4107, options [nop,nop,TS val 4294967224 ecr 220774,mptcp dss ack 3825203810 seq 2344416963 subseq 598333 len 1428 csum 0xb667], length 1428
16:28:51.253824 IP 112.26.1.1.targus-getdata1 > 112.26.0.8.59987: Flags [.], ack 162792, win 24576, options [nop,nop,TS val 221473 ecr 4294966339,nop,nop,sack 1 {164220:165648},mptcp dss ack 2344402683], length 0
16:28:51.261999 IP 112.26.0.8.54549 > 112.26.2.1.targus-getdata1: Flags [.], seq 358428:359856, ack 1, win 4107, options [nop,nop,TS val 4294967224 ecr 220774,mptcp dss ack 3825203810 seq 2344418391 subseq 599761 len 1428 csum 0xcaab], length 1428
16:28:51.265951 IP 112.26.0.8.54549 > 112.26.2.1.targus-getdata1: Flags [.], seq 355572:357000, ack 1, win 4107, options [nop,nop,TS val 4294967148 ecr 220667,mptcp dss ack 3825203810 seq 2344415535 subseq 596905 len 1428 csum 0x8b79], length 1428
16:28:51.267382 IP 112.26.2.1.targus-getdata1 > 112.26.0.8.54549: Flags [.], ack 348432, win 24576, options [nop,nop,TS val 221866 ecr 4294966819,nop,nop,sack 2 {355572:357000}{349860:354144},mptcp dss ack 2344402683], length 0
16:28:51.298024 IP 112.26.0.8.60507 > 112.26.3.1.targus-getdata1: Flags [.], seq 247044:248472, ack 1, win 4107, options [nop,nop,TS val 0 ecr 212214,mptcp dss ack 3825203810 seq 2344214187 subseq 458389 len 1428 csum 0xc508], length 1428
16:28:51.306828 IP 112.26.2.1.targus-getdata1 > 112.26.0.8.54549: Flags [.], ack 347004, win 24576, options [nop,nop,TS val 221552 ecr 4294966819,mptcp dss ack 2344402683], length 0
16:28:51.310121 IP 112.26.0.8.54549 > 112.26.2.1.targus-getdata1: Flags [.], seq 357000:358428, ack 1, win 4107, options [nop,nop,TS val 4294967224 ecr 220774,mptcp dss ack 3825203810 seq 2344416963 subseq 598333 len 1428 csum 0xb667], length 1428
16:28:51.356217 IP 112.26.2.1.targus-getdata1 > 112.26.0.8.54549: Flags [.], ack 348432, win 24576, options [nop,nop,TS val 221910 ecr 4294966819,nop,nop,sack 2 {355572:358428}{349860:354144},mptcp dss ack 2344402683], length 0
16:28:51.366227 IP 112.26.0.8.41772 > 112.26.0.1.targus-getdata1: Flags [.], seq 269893:271321, ack 0, win 4107, options [nop,nop,TS val 39 ecr 220865,mptcp dss ack 3825203810 seq 2344419819 subseq 362750 len 1428 csum 0x2714], length 1428
16:28:51.384167 IP 112.26.0.8.54549 > 112.26.2.1.targus-getdata1: Flags [.], seq 358428:359856, ack 1, win 4107, options [nop,nop,TS val 4294967224 ecr 220774,mptcp dss ack 3825203810 seq 2344418391 subseq 599761 len 1428 csum 0xcaab], length 1428
16:28:51.385379 IP 112.26.2.1.targus-getdata1 > 112.26.0.8.54549: Flags [.], ack 348432, win 24576, options [nop,nop,TS val 221984 ecr 4294966819,nop,nop,sack 2 {355572:359856}{349860:354144},mptcp dss ack 2344402683], length 0
16:28:51.458628 IP 112.26.0.8.41772 > 112.26.0.1.targus-getdata1: Flags [.], seq 271321:272749, ack 0, win 4107, options [nop,nop,TS val 39 ecr 220865,mptcp dss ack 3825203810 seq 2344421247 subseq 364178 len 1428 csum 0xc49], length 1428
16:28:51.466758 IP 112.26.2.1.targus-getdata1 > 112.26.0.8.54549: Flags [.], ack 348432, win 24576, options [nop,nop,TS val 221582 ecr 4294966819,mptcp dss ack 2344402683], length 0
16:28:51.473785 IP 112.26.0.8.60507 > 112.26.3.1.targus-getdata1: Flags [.], seq 247044:248472, ack 1, win 4107, options [nop,nop,TS val 0 ecr 212214,mptcp dss ack 3825203810 seq 2344214187 subseq 458389 len 1428 csum 0xc508], length 1428
16:28:51.476319 IP 112.26.3.1.targus-getdata1 > 112.26.0.8.60507: Flags [.], ack 251328, win 24576, options [nop,nop,TS val 222073 ecr 4294958620,nop,nop,sack 2 {247044:248472}{252756:254184},mptcp dss ack 2344402683], length 0
16:28:51.476636 IP 112.26.3.1.targus-getdata1 > 112.26.0.8.60507: Flags [.], ack 251328, win 24576, options [nop,nop,TS val 222073 ecr 4294958620,nop,nop,sack 2 {247044:248472}{252756:254184},mptcp dss ack 2344402683], length 0
16:28:51.492614 IP 112.26.0.8.59987 > 112.26.1.1.targus-getdata1: Flags [.], seq 165648:167076, ack 1, win 4107, options [nop,nop,TS val 124 ecr 220958,mptcp dss ack 3825203810 seq 2344422675 subseq 502657 len 1428 csum 0x69bf], length 1428
16:28:51.558106 IP 112.26.0.8.41772 > 112.26.0.1.targus-getdata1: Flags [.], seq 269893:271321, ack 0, win 4107, options [nop,nop,TS val 39 ecr 220865,mptcp dss ack 3825203810 seq 2344419819 subseq 362750 len 1428 csum 0x2714], length 1428
16:28:51.559835 IP 112.26.0.1.targus-getdata1 > 112.26.0.8.41772: Flags [.], ack 271321, win 24576, options [nop,nop,TS val 222158 ecr 39,mptcp dss ack 2344402683], length 0
16:28:51.560139 IP 112.26.0.1.targus-getdata1 > 112.26.0.8.41772: Flags [.], ack 271321, win 24576, options [nop,nop,TS val 222158 ecr 39,mptcp dss ack 2344402683], length 0
16:28:51.561643 IP 112.26.2.1.targus-getdata1 > 112.26.0.8.54549: Flags [.], ack 348432, win 24576, options [nop,nop,TS val 221661 ecr 4294966819,nop,nop,sack 1 {349860:351288},mptcp dss ack 2344402683], length 0
16:28:51.590732 IP 112.26.0.8.41772 > 112.26.0.1.targus-getdata1: Flags [.], seq 271321:272749, ack 0, win 4107, options [nop,nop,TS val 39 ecr 220865,mptcp dss ack 3825203810 seq 2344421247 subseq 364178 len 1428 csum 0xc49], length 1428
16:28:51.591959 IP 112.26.0.1.targus-getdata1 > 112.26.0.8.41772: Flags [.], ack 272749, win 24576, options [nop,nop,TS val 222190 ecr 39,mptcp dss ack 2344402683], length 0
16:28:51.592248 IP 112.26.0.1.targus-getdata1 > 112.26.0.8.41772: Flags [.], ack 272749, win 24576, options [nop,nop,TS val 222190 ecr 39,mptcp dss ack 2344402683], length 0
16:28:51.659029 IP 112.26.0.8.41772 > 112.26.0.1.targus-getdata1: Flags [.], seq 274177:275605, ack 0, win 4107, options [nop,nop,TS val 343 ecr 221210,mptcp dss ack 3825203810 seq 2344426959 subseq 367034 len 1428 csum 0x16cb], length 1428
16:28:51.663092 IP 112.26.2.1.targus-getdata1 > 112.26.0.8.54549: Flags [.], ack 348432, win 24576, options [nop,nop,TS val 221753 ecr 4294966819,nop,nop,sack 1 {349860:354144},mptcp dss ack 2344402683], length 0
16:28:51.676215 IP 112.26.0.8.59987 > 112.26.1.1.targus-getdata1: Flags [.], seq 165648:167076, ack 1, win 4107, options [nop,nop,TS val 124 ecr 220958,mptcp dss ack 3825203810 seq 2344422675 subseq 502657 len 1428 csum 0x69bf], length 1428
16:28:51.684348 IP 112.26.0.8.41772 > 112.26.0.1.targus-getdata1: Flags [.], seq 275605:277033, ack 0, win 4107, options [nop,nop,TS val 343 ecr 221210,mptcp dss ack 3825203810 seq 2344428387 subseq 368462 len 1428 csum 0xf1ab], length 1428
16:28:51.688199 IP 112.26.1.1.targus-getdata1 > 112.26.0.8.59987: Flags [.], ack 162792, win 24576, options [nop,nop,TS val 222276 ecr 4294966339,nop,nop,sack 1 {164220:167076},mptcp dss ack 2344402683], length 0
16:28:51.699086 IP 112.26.2.1.targus-getdata1 > 112.26.0.8.54549: Flags [.], ack 348432, win 24576, options [nop,nop,TS val 221866 ecr 4294966819,nop,nop,sack 2 {355572:357000}{349860:354144},mptcp dss ack 2344402683], length 0
16:28:51.706059 IP 112.26.0.8.41772 > 112.26.0.1.targus-getdata1: Flags [.], seq 274177:275605, ack 0, win 4107, options [nop,nop,TS val 343 ecr 221210,mptcp dss ack 3825203810 seq 2344426959 subseq 367034 len 1428 csum 0x16cb], length 1428
16:28:51.764443 IP 112.26.0.1.targus-getdata1 > 112.26.0.8.41772: Flags [.], ack 272749, win 24576, options [nop,nop,TS val 222306 ecr 39,nop,nop,sack 1 {274177:275605},mptcp dss ack 2344402683], length 0
16:28:51.764826 IP 112.26.0.1.targus-getdata1 > 112.26.0.8.41772: Flags [.], ack 272749, win 24576, options [nop,nop,TS val 222306 ecr 39,nop,nop,sack 1 {274177:275605},mptcp dss ack 2344402683], length 0
16:28:51.770493 IP 112.26.0.8.41772 > 112.26.0.1.targus-getdata1: Flags [.], seq 277033:278461, ack 0, win 4107, options [nop,nop,TS val 443 ecr 221387,mptcp dss ack 3825203810 seq 2344429815 subseq 369890 len 1428 csum 0x2eae], length 1428
16:28:51.785198 IP 112.26.2.1.targus-getdata1 > 112.26.0.8.54549: Flags [.], ack 348432, win 24576, options [nop,nop,TS val 221910 ecr 4294966819,nop,nop,sack 2 {355572:358428}{349860:354144},mptcp dss ack 2344402683], length 0
16:28:51.786084 IP 112.26.0.8.41772 > 112.26.0.1.targus-getdata1: Flags [.], seq 275605:277033, ack 0, win 4107, options [nop,nop,TS val 343 ecr 221210,mptcp dss ack 3825203810 seq 2344428387 subseq 368462 len 1428 csum 0xf1ab], length 1428
16:28:51.787303 IP 112.26.0.1.targus-getdata1 > 112.26.0.8.41772: Flags [.], ack 272749, win 24576, options [nop,nop,TS val 222386 ecr 39,nop,nop,sack 1 {274177:277033},mptcp dss ack 2344402683], length 0
16:28:51.787577 IP 112.26.0.1.targus-getdata1 > 112.26.0.8.41772: Flags [.], ack 272749, win 24576, options [nop,nop,TS val 222386 ecr 39,nop,nop,sack 1 {274177:277033},mptcp dss ack 2344402683], length 0
16:28:51.809791 IP 112.26.2.1.targus-getdata1 > 112.26.0.8.54549: Flags [.], ack 348432, win 24576, options [nop,nop,TS val 221984 ecr 4294966819,nop,nop,sack 2 {355572:359856}{349860:354144},mptcp dss ack 2344402683], length 0
16:28:51.867526 IP 112.26.0.8.41772 > 112.26.0.1.targus-getdata1: Flags [.], seq 277033:278461, ack 0, win 4107, options [nop,nop,TS val 443 ecr 221387,mptcp dss ack 3825203810 seq 2344429815 subseq 369890 len 1428 csum 0x2eae], length 1428
16:28:51.868747 IP 112.26.0.1.targus-getdata1 > 112.26.0.8.41772: Flags [.], ack 272749, win 24576, options [nop,nop,TS val 222467 ecr 39,nop,nop,sack 1 {274177:278461},mptcp dss ack 2344402683], length 0
16:28:51.868998 IP 112.26.0.1.targus-getdata1 > 112.26.0.8.41772: Flags [.], ack 272749, win 24576, options [nop,nop,TS val 222467 ecr 39,nop,nop,sack 1 {274177:278461},mptcp dss ack 2344402683], length 0
16:28:51.888849 IP 112.26.0.8.59987 > 112.26.1.1.targus-getdata1: Flags [.], seq 169932:171360, ack 1, win 4107, options [nop,nop,TS val 523 ecr 221473,mptcp dss ack 3825203810 seq 2344432671 subseq 506941 len 1428 csum 0xd16d], length 1428
16:28:51.893171 IP 112.26.0.1.targus-getdata1 > 112.26.0.8.41772: Flags [.], ack 271321, win 24576, options [nop,nop,TS val 222158 ecr 39,mptcp dss ack 2344402683], length 0
16:28:51.896616 IP 112.26.0.8.59987 > 112.26.1.1.targus-getdata1: Flags [.], seq 169932:171360, ack 1, win 4107, options [nop,nop,TS val 523 ecr 221473,mptcp dss ack 3825203810 seq 2344432671 subseq 506941 len 1428 csum 0xd16d], length 1428
16:28:51.898340 IP 112.26.1.1.targus-getdata1 > 112.26.0.8.59987: Flags [.], ack 162792, win 24576, options [nop,nop,TS val 222496 ecr 4294966339,nop,nop,sack 2 {169932:171360}{164220:167076},mptcp dss ack 2344402683], length 0
16:28:51.976333 IP 112.26.0.1.targus-getdata1 > 112.26.0.8.41772: Flags [.], ack 272749, win 24576, options [nop,nop,TS val 222190 ecr 39,mptcp dss ack 2344402683], length 0
16:28:51.978780 IP 112.26.0.8.59987 > 112.26.1.1.targus-getdata1: Flags [.], seq 171360:172788, ack 1, win 4107, options [nop,nop,TS val 523 ecr 221473,mptcp dss ack 3825203810 seq 2344434099 subseq 508369 len 1428 csum 0x511], length 1428
16:28:51.985252 IP 112.26.0.8.59987 > 112.26.1.1.targus-getdata1: Flags [.], seq 171360:172788, ack 1, win 4107, options [nop,nop,TS val 523 ecr 221473,mptcp dss ack 3825203810 seq 2344434099 subseq 508369 len 1428 csum 0x511], length 1428
16:28:51.986272 IP 112.26.1.1.targus-getdata1 > 112.26.0.8.59987: Flags [.], ack 162792, win 24576, options [nop,nop,TS val 222580 ecr 4294966339,nop,nop,sack 2 {169932:172788}{164220:167076},mptcp dss ack 2344402683], length 0
16:28:52.069751 IP 112.26.1.1.targus-getdata1 > 112.26.0.8.59987: Flags [.], ack 162792, win 24576, options [nop,nop,TS val 222276 ecr 4294966339,nop,nop,sack 1 {164220:167076},mptcp dss ack 2344402683], length 0
16:28:52.077495 IP 112.26.0.8.54549 > 112.26.2.1.targus-getdata1: Flags [.], seq 359856:361284, ack 1, win 4107, options [nop,nop,TS val 576 ecr 221552,mptcp dss ack 3825203810 seq 2344436955 subseq 601189 len 1428 csum 0x4569], length 1428
16:28:52.079160 IP 112.26.0.8.54549 > 112.26.2.1.targus-getdata1: Flags [.], seq 359856:361284, ack 1, win 4107, options [nop,nop,TS val 576 ecr 221552,mptcp dss ack 3825203810 seq 2344436955 subseq 601189 len 1428 csum 0x4569], length 1428
16:28:52.080224 IP 112.26.2.1.targus-getdata1 > 112.26.0.8.54549: Flags [.], ack 348432, win 24576, options [nop,nop,TS val 222679 ecr 4294966819,nop,nop,sack 2 {355572:361284}{349860:354144},mptcp dss ack 2344402683], length 0
16:28:52.100234 IP 112.26.0.1.targus-getdata1 > 112.26.0.8.41772: Flags [.], ack 272749, win 24576, options [nop,nop,TS val 222306 ecr 39,nop,nop,sack 1 {274177:275605},mptcp dss ack 2344402683], length 0
16:28:52.162585 IP 112.26.0.8.54549 > 112.26.2.1.targus-getdata1: Flags [.], seq 362712:364140, ack 1, win 4107, options [nop,nop,TS val 736 ecr 221582,mptcp dss ack 3825203810 seq 2344439811 subseq 604045 len 1428 csum 0x3dbe], length 1428
16:28:52.164802 IP 112.26.0.8.54549 > 112.26.2.1.targus-getdata1: Flags [.], seq 362712:364140, ack 1, win 4107, options [nop,nop,TS val 736 ecr 221582,mptcp dss ack 3825203810 seq 2344439811 subseq 604045 len 1428 csum 0x3dbe], length 1428
16:28:52.171741 IP 112.26.2.1.targus-getdata1 > 112.26.0.8.54549: Flags [.], ack 348432, win 24576, options [nop,nop,TS val 222764 ecr 4294966819,nop,nop,sack 2 {362712:364140}{355572:361284},mptcp dss ack 2344402683], length 0
16:28:52.188467 IP 112.26.0.8.54549 > 112.26.2.1.targus-getdata1: Flags [.], seq 364140:365568, ack 1, win 4107, options [nop,nop,TS val 932 ecr 221661,mptcp dss ack 3825203810 seq 2344441239 subseq 605473 len 1428 csum 0x7c], length 1428
16:28:52.192156 IP 112.26.0.1.targus-getdata1 > 112.26.0.8.41772: Flags [.], ack 272749, win 24576, options [nop,nop,TS val 222386 ecr 39,nop,nop,sack 1 {274177:277033},mptcp dss ack 2344402683], length 0
16:28:52.196005 IP 112.26.0.8.54549 > 112.26.2.1.targus-getdata1: Flags [.], seq 364140:365568, ack 1, win 4107, options [nop,nop,TS val 932 ecr 221661,mptcp dss ack 3825203810 seq 2344441239 subseq 605473 len 1428 csum 0x7c], length 1428
16:28:52.198472 IP 112.26.2.1.targus-getdata1 > 112.26.0.8.54549: Flags [.], ack 348432, win 24576, options [nop,nop,TS val 222795 ecr 4294966819,nop,nop,sack 2 {362712:365568}{355572:361284},mptcp dss ack 2344402683], length 0
16:28:52.269700 IP 112.26.0.8.54549 > 112.26.2.1.targus-getdata1: Flags [.], seq 348432:349860, ack 1, win 4107, options [nop,nop,TS val 932 ecr 221753,mptcp dss ack 3825203810 seq 2344408395 subseq 589765 len 1428 csum 0x57d0], length 1428
16:28:52.276549 IP 112.26.0.8.54549 > 112.26.2.1.targus-getdata1: Flags [.], seq 348432:349860, ack 1, win 4107, options [nop,nop,TS val 932 ecr 221753,mptcp dss ack 3825203810 seq 2344408395 subseq 589765 len 1428 csum 0x57d0], length 1428
16:28:52.278115 IP 112.26.2.1.targus-getdata1 > 112.26.0.8.54549: Flags [.], ack 354144, win 24576, options [nop,nop,TS val 222876 ecr 932,nop,nop,sack 2 {362712:365568}{355572:361284},mptcp dss ack 2344402683], length 0
16:28:52.293838 IP 112.26.0.1.targus-getdata1 > 112.26.0.8.41772: Flags [.], ack 272749, win 24576, options [nop,nop,TS val 222467 ecr 39,nop,nop,sack 1 {274177:278461},mptcp dss ack 2344402683], length 0
16:28:52.297044 IP 112.26.0.8.54549 > 112.26.2.1.targus-getdata1: Flags [.], seq 365568:366996, ack 1, win 4107, options [nop,nop,TS val 968 ecr 221753,mptcp dss ack 3825203810 seq 2344442667 subseq 606901 len 1428 csum 0xe419], length 1428
16:28:52.372917 IP 112.26.1.1.targus-getdata1 > 112.26.0.8.59987: Flags [.], ack 162792, win 24576, options [nop,nop,TS val 222496 ecr 4294966339,nop,nop,sack 2 {169932:171360}{164220:167076},mptcp dss ack 2344402683], length 0
16:28:52.374488 IP 112.26.0.8.54549 > 112.26.2.1.targus-getdata1: Flags [.], seq 354144:355572, ack 1, win 4107, options [nop,nop,TS val 1079 ecr 221984,mptcp dss ack 3825203810 seq 2344414107 subseq 595477 len 1428 csum 0xf708], length 1428
16:28:52.380716 IP 112.26.0.8.54549 > 112.26.2.1.targus-getdata1: Flags [.], seq 365568:366996, ack 1, win 4107, options [nop,nop,TS val 968 ecr 221753,mptcp dss ack 3825203810 seq 2344442667 subseq 606901 len 1428 csum 0xe419], length 1428
16:28:52.381926 IP 112.26.2.1.targus-getdata1 > 112.26.0.8.54549: Flags [.], ack 354144, win 24576, options [nop,nop,TS val 222980 ecr 932,nop,nop,sack 2 {362712:366996}{355572:361284},mptcp dss ack 2344402683], length 0
16:28:52.404754 IP 112.26.0.8.54549 > 112.26.2.1.targus-getdata1: Flags [.], seq 354144:355572, ack 1, win 4107, options [nop,nop,TS val 1079 ecr 221984,mptcp dss ack 3825203810 seq 2344414107 subseq 595477 len 1428 csum 0xf708], length 1428
16:28:52.405934 IP 112.26.2.1.targus-getdata1 > 112.26.0.8.54549: Flags [.], ack 361284, win 24576, options [nop,nop,TS val 223004 ecr 1079,nop,nop,sack 1 {362712:366996},mptcp dss ack 2344402683], length 0
16:28:52.475005 IP 112.26.0.8.41772 > 112.26.0.1.targus-getdata1: Flags [.], seq 279889:281317, ack 0, win 4107, options [nop,nop,TS val 1162 ecr 222158,mptcp dss ack 3825203810 seq 2344445523 subseq 372746 len 1428 csum 0x1506], length 1428
16:28:52.478090 IP 112.26.1.1.targus-getdata1 > 112.26.0.8.59987: Flags [.], ack 162792, win 24576, options [nop,nop,TS val 222580 ecr 4294966339,nop,nop,sack 2 {169932:172788}{164220:167076},mptcp dss ack 2344402683], length 0
