16:27:02.712942 IP 112.26.0.8.41770 > 112.26.0.1.targus-getdata1: Flags [S], seq 2031178631, win 65535, options [mss 1460,sackOK,TS val 4294859235 ecr 0,nop,wscale 6,mptcp capable csum {0x57c080ebc044a6f2}], length 0
16:27:02.733454 IP 112.26.0.8.41770 > 112.26.0.1.targus-getdata1: Flags [S], seq 2031178631, win 65535, options [mss 1460,sackOK,TS val 4294859235 ecr 0,nop,wscale 6,mptcp capable csum {0x57c080ebc044a6f2}], length 0
16:27:02.813460 IP 112.26.0.8.41770 > 112.26.0.1.targus-getdata1: Flags [S], seq 2031178631, win 65535, options [mss 1460,sackOK,TS val 4294859235 ecr 0,nop,wscale 6,mptcp capable csum {0x57c080ebc044a6f2}], length 0
16:27:02.842130 IP 112.26.0.1.targus-getdata1 > 112.26.0.8.41770: Flags [S.], seq 1386844041, ack 2031178632, win 65535, options [mss 1460,sackOK,TS val 113413 ecr 4294859235,nop,wscale 6,mptcp capable csum {0xdcbc4ddaee5b51ac}], length 0
16:27:02.916426 IP 112.26.0.1.targus-getdata1 > 112.26.0.8.41770: Flags [S.], seq 1386844041, ack 2031178632, win 65535, options [mss 1460,sackOK,TS val 113413 ecr 4294859235,nop,wscale 6,mptcp capable csum {0xdcbc4ddaee5b51ac}], length 0
16:27:02.926606 IP 112.26.0.8.41770 > 112.26.0.1.targus-getdata1: Flags [.], ack 1, win 1369, options [nop,nop,TS val 4294859483 ecr 113413,mptcp capable csum {0x57c080ebc044a6f2,0xdcbc4ddaee5b51ac},mptcp dss ack 196611476], length 0
16:27:03.010084 IP 112.26.0.8.41770 > 112.26.0.1.targus-getdata1: Flags [.], ack 1, win 1369, options [nop,nop,TS val 4294859483 ecr 113413,mptcp add-addr id 3 112.26.1.8,mptcp dss ack 196611476], length 0
16:27:50.997071 IP 112.26.0.1.targus-getdata1 > 112.26.0.8.41772: Flags [.], ack 1772731111, win 24509, options [nop,nop,TS val 161543 ecr 4294905381,nop,nop,sack 1 {1429:5713},mptcp dss ack 2343418791], length 0
16:27:50.997370 IP 112.26.0.1.targus-getdata1 > 112.26.0.8.41772: Flags [.], ack 1, win 24509, options [nop,nop,TS val 161543 ecr 4294905381,nop,nop,sack 1 {1429:5713},mptcp dss ack 2343418791], length 0
16:27:51.018695 IP 112.26.0.8.54549 > 112.26.2.1.targus-getdata1: Flags [.], seq 1666358045:1666359473, ack 1824504722, win 4107, options [nop,nop,TS val 4294907456 ecr 161417,mptcp dss ack 3825203810 seq 2343448779 subseq 244189 len 1428 csum 0x55a7], length 1428
16:27:51.023966 IP 112.26.0.8.54549 > 112.26.2.1.targus-getdata1: Flags [.], seq 4294964440:4294965868, ack 1, win 4107, options [nop,nop,TS val 4294907205 ecr 161198,mptcp dss ack 3825203810 seq 2343468771 subseq 241333 len 1428 csum 0x3d39], length 1428
16:27:51.026751 IP 112.26.0.8.54549 > 112.26.2.1.targus-getdata1: Flags [.], seq 4294964440:4294965868, ack 1, win 4107, options [nop,nop,TS val 4294907205 ecr 161198,mptcp dss ack 3825203810 seq 2343468771 subseq 241333 len 1428 csum 0x3d39], length 1428
16:27:51.030774 IP 112.26.2.1.targus-getdata1 > 112.26.0.8.54549: Flags [.], ack 0, win 24509, options [nop,nop,TS val 161625 ecr 4294907205,mptcp dss ack 2343418791], length 0
16:28:04.794415 IP 112.26.0.8.54549 > 112.26.2.1.targus-getdata1: Flags [.], seq 67116:68544, ack 1, win 4107, options [nop,nop,TS val 4294920852 ecr 174808,mptcp dss ack 3825203810 seq 2343654411 subseq 311305 len 1428 csum 0x17a9], length 1428
16:28:04.800354 IP 112.26.0.8.54549 > 112.26.2.1.targus-getdata1: Flags [.], seq 67116:68544, ack 1, win 4107, options [nop,nop,TS val 4294920852 ecr 174808,mptcp dss ack 3825203810 seq 2343654411 subseq 311305 len 1428 csum 0x17a9], length 1428
16:28:04.801300 IP 112.26.2.1.targus-getdata1 > 112.26.0.8.54549: Flags [.], ack 69972, win 24476, options [nop,nop,TS val 175396 ecr 4294920852,mptcp dss ack 2343658695], length 0
16:28:24.613039 IP 112.26.0.8.41772 > 112.26.0.1.targus-getdata1: Flags [.], seq 114241:115669, ack 0, win 4107, options [nop,nop,TS val 4294940799 ecr 194214,mptcp dss ack 3825203810 seq 2343931443 subseq 207098 len 1428 csum 0x89dd], length 1428
16:28:24.614408 IP 112.26.0.8.54549 > 112.26.2.1.targus-getdata1: Flags [.], seq 157080:158508, ack 1, win 4107, options [nop,nop,TS val 4294940918 ecr 194319,mptcp dss ack 3825203810 seq 2343979995 subseq 401269 len 1428 csum 0xf70c], length 1428
16:28:24.623818 IP 112.26.0.8.41772 > 112.26.0.1.targus-getdata1: Flags [.], seq 121381:122809, ack 0, win 4107, options [nop,nop,TS val 4294940884 ecr 194214,mptcp dss ack 3825203810 seq 2343974283 subseq 214238 len 1428 csum 0x4f43], length 1428
16:28:24.628940 IP 112.26.0.8.60507 > 112.26.3.1.targus-getdata1: Flags [.], seq 3537576482:3537577910, ack 3490778089, win 4107, options [nop,nop,TS val 4294940972 ecr 194817,mptcp dss ack 3825203810 seq 2343981423 subseq 424117 len 1428 csum 0x1a17], length 1428
16:28:24.634645 IP 112.26.0.8.41772 > 112.26.0.1.targus-getdata1: Flags [.], seq 121381:122809, ack 0, win 4107, options [nop,nop,TS val 4294940884 ecr 194214,mptcp dss ack 3825203810 seq 2343974283 subseq 214238 len 1428 csum 0x4f43], length 1428
16:28:24.649422 IP 112.26.0.1.targus-getdata1 > 112.26.0.8.41772: Flags [.], ack 112813, win 24510, options [nop,nop,TS val 195234 ecr 4294939269,nop,nop,sack 1 {114241:122809},mptcp dss ack 2343930015], length 0
16:28:24.649625 IP 112.26.0.1.targus-getdata1 > 112.26.0.8.41772: Flags [.], ack 112813, win 24510, options [nop,nop,TS val 195234 ecr 4294939269,nop,nop,sack 1 {114241:122809},mptcp dss ack 2343930015], length 0
16:28:24.720966 IP 112.26.0.8.41772 > 112.26.0.1.targus-getdata1: Flags [.], seq 122809:124237, ack 0, win 4107, options [nop,nop,TS val 4294940884 ecr 194242,mptcp dss ack 3825203810 seq 2343975711 subseq 215666 len 1428 csum 0x5d1e], length 1428
16:28:24.728340 IP 112.26.0.8.41772 > 112.26.0.1.targus-getdata1: Flags [.], seq 122809:124237, ack 0, win 4107, options [nop,nop,TS val 4294940884 ecr 194242,mptcp dss ack 3825203810 seq 2343975711 subseq 215666 len 1428 csum 0x5d1e], length 1428
16:28:24.735189 IP 112.26.0.1.targus-getdata1 > 112.26.0.8.41772: Flags [.], ack 112813, win 24510, options [nop,nop,TS val 195328 ecr 4294939269,nop,nop,sack 1 {114241:124237},mptcp dss ack 2343930015], length 0
16:28:42.612386 IP 112.26.2.1.targus-getdata1 > 112.26.0.8.54549: Flags [.], ack 275604, win 24558, options [nop,nop,TS val 213164 ecr 4294958401,mptcp dss ack 2344217043], length 0
16:28:42.612573 IP 112.26.2.1.targus-getdata1 > 112.26.0.8.54549: Flags [.], ack 275604, win 24558, options [nop,nop,TS val 213164 ecr 4294958401,mptcp dss ack 2344217043], length 0
16:28:42.616240 IP 112.26.0.8.54549 > 112.26.2.1.targus-getdata1: Flags [.], seq 275604:277032, ack 1, win 4107, options [nop,nop,TS val 4294958591 ecr 212508,mptcp dss ack 3825203810 seq 2344261311 subseq 519793 len 1428 csum 0x3521], length 1428
16:28:42.626773 IP 112.26.0.8.54549 > 112.26.2.1.targus-getdata1: Flags [.], seq 275604:277032, ack 1, win 4107, options [nop,nop,TS val 4294958591 ecr 212508,mptcp dss ack 3825203810 seq 2344261311 subseq 519793 len 1428 csum 0x3521], length 1428
16:28:42.631254 IP 112.26.0.8.54549 > 112.26.2.1.targus-getdata1: Flags [.], seq 279888:281316, ack 1, win 4107, options [nop,nop,TS val 4294959100 ecr 212929,mptcp dss ack 3825203810 seq 2344271307 subseq 524077 len 1428 csum 0xd704], length 1428
16:28:42.638928 IP 112.26.0.8.60507 > 112.26.3.1.targus-getdata1: Flags [.], seq 34272:35700, ack 1, win 4107, options [nop,nop,TS val 4294958620 ecr 212214,mptcp dss ack 3825203810 seq 2344214187 subseq 458389 len 1428 csum 0xc508], length 1428
16:28:42.710028 IP 112.26.0.8.60507 > 112.26.3.1.targus-getdata1: Flags [.], seq 34272:35700, ack 1, win 4107, options [nop,nop,TS val 4294958620 ecr 212214,mptcp dss ack 3825203810 seq 2344214187 subseq 458389 len 1428 csum 0xc508], length 1428
16:28:42.719841 IP 112.26.0.8.54549 > 112.26.2.1.targus-getdata1: Flags [.], seq 281316:282744, ack 1, win 4107, options [nop,nop,TS val 4294959280 ecr 213164,mptcp dss ack 3825203810 seq 2344272735 subseq 525505 len 1428 csum 0xc983], length 1428
16:28:42.720970 IP 112.26.3.1.targus-getdata1 > 112.26.0.8.60507: Flags [.], ack 38556, win 24291, options [nop,nop,TS val 213309 ecr 4294958620,nop,nop,sack 1 {39984:41412},mptcp dss ack 2344234179], length 0
16:28:42.735599 IP 112.26.0.8.59987 > 112.26.1.1.targus-getdata1: Flags [.], seq 4001485673:4001487101, ack 3659179008, win 4107, options [nop,nop,TS val 4294958880 ecr 212634,mptcp dss ack 3825203810 seq 2344264167 subseq 454105 len 1428 csum 0x827], length 1428
16:28:42.738497 IP 112.26.0.8.54549 > 112.26.2.1.targus-getdata1: Flags [.], seq 282744:284172, ack 1, win 4107, options [nop,nop,TS val 4294959280 ecr 213164,mptcp dss ack 3825203810 seq 2344274163 subseq 526933 len 1428 csum 0x303e], length 1428
16:28:42.745126 IP 112.26.2.1.targus-getdata1 > 112.26.0.8.54549: Flags [.], ack 277032, win 24291, options [nop,nop,TS val 213312 ecr 4294958591,mptcp dss ack 2344234179], length 0
16:28:42.745324 IP 112.26.2.1.targus-getdata1 > 112.26.0.8.54549: Flags [.], ack 277032, win 24291, options [nop,nop,TS val 213312 ecr 4294958591,mptcp dss ack 2344234179], length 0
16:28:42.756446 IP 112.26.0.8.59987 > 112.26.1.1.targus-getdata1: Flags [.], seq 0:1428, ack 1, win 4107, options [nop,nop,TS val 4294958880 ecr 212634,mptcp dss ack 3825203810 seq 2344264167 subseq 454105 len 1428 csum 0x827], length 1428
16:28:42.812460 IP 112.26.0.8.59987 > 112.26.1.1.targus-getdata1: Flags [.], seq 1428:2856, ack 1, win 4107, options [nop,nop,TS val 4294958913 ecr 212663,mptcp dss ack 3825203810 seq 2344265595 subseq 455533 len 1428 csum 0xc80c], length 1428
16:28:42.820146 IP 112.26.1.1.targus-getdata1 > 112.26.0.8.59987: Flags [.], ack 1428, win 24291, options [nop,nop,TS val 213356 ecr 4294958880,mptcp dss ack 2344234179], length 0
16:28:59.922039 IP 112.26.0.8.54549 > 112.26.2.1.targus-getdata1: Flags [.], seq 432684:434112, ack 1, win 4107, options [nop,nop,TS val 8786 ecr 229530,mptcp dss ack 3825203810 seq 2344581183 subseq 676873 len 1428 csum 0x7525], length 1428
16:28:59.934292 IP 112.26.0.8.41772 > 112.26.0.1.targus-getdata1: Flags [.], seq 338437:339865, ack 0, win 4107, options [nop,nop,TS val 9200 ecr 230009,mptcp dss ack 3825203810 seq 2344585467 subseq 431294 len 1428 csum 0xb1dc], length 1428
16:28:59.950981 IP 112.26.1.1.targus-getdata1 > 112.26.0.8.59987: Flags [.], ack 74256, win 24576, options [nop,nop,TS val 230538 ecr 7396,nop,nop,sack 2 {78540:79968}{75684:77112},mptcp dss ack 2344546911], length 0
16:28:59.951190 IP 112.26.1.1.targus-getdata1 > 112.26.0.8.59987: Flags [.], ack 74256, win 24576, options [nop,nop,TS val 230538 ecr 7396,nop,nop,sack 2 {78540:79968}{75684:77112},mptcp dss ack 2344546911], length 0
16:28:59.951929 IP 112.26.0.8.59987 > 112.26.1.1.targus-getdata1: Flags [.], seq 78540:79968, ack 1, win 4107, options [nop,nop,TS val 8596 ecr 229442,mptcp dss ack 3825203810 seq 2344579755 subseq 532645 len 1428 csum 0xb917], length 1428
16:28:59.957008 IP 112.26.0.8.41772 > 112.26.0.1.targus-getdata1: Flags [.], seq 327013:328441, ack 0, win 4107, options [nop,nop,TS val 9200 ecr 230045,mptcp dss ack 3825203810 seq 2344565475 subseq 419870 len 1428 csum 0x5eb1], length 1428
16:29:00.007629 IP 112.26.0.8.54549 > 112.26.2.1.targus-getdata1: Flags [.], seq 434112:435540, ack 1, win 4107, options [nop,nop,TS val 8870 ecr 229640,mptcp dss ack 3825203810 seq 2344582611 subseq 678301 len 1428 csum 0xb37e], length 1428
16:29:00.013677 IP 112.26.0.8.54549 > 112.26.2.1.targus-getdata1: Flags [.], seq 432684:434112, ack 1, win 4107, options [nop,nop,TS val 8786 ecr 229530,mptcp dss ack 3825203810 seq 2344581183 subseq 676873 len 1428 csum 0x7525], length 1428
16:29:00.025797 IP 112.26.2.1.targus-getdata1 > 112.26.0.8.54549: Flags [.], ack 419832, win 24576, options [nop,nop,TS val 230613 ecr 7107,nop,nop,sack 2 {425544:434112}{421260:424116},mptcp dss ack 2344546911], length 0
16:29:00.025995 IP 112.26.2.1.targus-getdata1 > 112.26.0.8.54549: Flags [.], ack 419832, win 24576, options [nop,nop,TS val 230613 ecr 7107,nop,nop,sack 2 {425544:434112}{421260:424116},mptcp dss ack 2344546911], length 0
16:29:00.036990 IP 112.26.0.8.54549 > 112.26.2.1.targus-getdata1: Flags [.], seq 419832:421260, ack 1, win 4107, options [nop,nop,TS val 8870 ecr 229734,mptcp dss ack 3825203810 seq 2344546911 subseq 664021 len 1428 csum 0xc27b], length 1428
16:29:00.047196 IP 112.26.0.8.54549 > 112.26.2.1.targus-getdata1: Flags [.], seq 434112:435540, ack 1, win 4107, options [nop,nop,TS val 8870 ecr 229640,mptcp dss ack 3825203810 seq 2344582611 subseq 678301 len 1428 csum 0xb37e], length 1428
16:29:00.107443 IP 112.26.0.8.54549 > 112.26.2.1.targus-getdata1: Flags [.], seq 435540:436968, ack 1, win 4107, options [nop,nop,TS val 9326 ecr 230129,mptcp dss ack 3825203810 seq 2344586895 subseq 679729 len 1428 csum 0x783c], length 1428
16:29:00.111611 IP 112.26.2.1.targus-getdata1 > 112.26.0.8.54549: Flags [.], ack 419832, win 24576, options [nop,nop,TS val 230646 ecr 7107,nop,nop,sack 2 {425544:435540}{421260:424116},mptcp dss ack 2344546911], length 0
16:29:00.111960 IP 112.26.2.1.targus-getdata1 > 112.26.0.8.54549: Flags [.], ack 419832, win 24576, options [nop,nop,TS val 230646 ecr 7107,nop,nop,sack 2 {425544:435540}{421260:424116},mptcp dss ack 2344546911], length 0
16:29:00.118778 IP 112.26.0.8.54549 > 112.26.2.1.targus-getdata1: Flags [.], seq 424116:425544, ack 1, win 4107, options [nop,nop,TS val 9000 ecr 229838,mptcp dss ack 3825203810 seq 2344559763 subseq 668305 len 1428 csum 0x8c1d], length 1428
16:29:00.133697 IP 112.26.0.8.54549 > 112.26.2.1.targus-getdata1: Flags [.], seq 419832:421260, ack 1, win 4107, options [nop,nop,TS val 8870 ecr 229734,mptcp dss ack 3825203810 seq 2344546911 subseq 664021 len 1428 csum 0xc27b], length 1428
16:29:00.137516 IP 112.26.2.1.targus-getdata1 > 112.26.0.8.54549: Flags [.], ack 424116, win 24465, options [nop,nop,TS val 230728 ecr 8870,nop,nop,sack 1 {425544:435540},mptcp dss ack 2344554051], length 0
16:29:00.137710 IP 112.26.2.1.targus-getdata1 > 112.26.0.8.54549: Flags [.], ack 424116, win 24465, options [nop,nop,TS val 230728 ecr 8870,nop,nop,sack 1 {425544:435540},mptcp dss ack 2344554051], length 0
16:29:00.146975 IP 112.26.0.8.41772 > 112.26.0.1.targus-getdata1: Flags [.], seq 337009:338437, ack 0, win 4107, options [nop,nop,TS val 9106 ecr 229929,mptcp dss ack 3825203810 seq 2344584039 subseq 429866 len 1428 csum 0xc2ed], length 1428
16:29:00.207938 IP 112.26.0.8.54549 > 112.26.2.1.targus-getdata1: Flags [.], seq 436968:438396, ack 1, win 4107, options [nop,nop,TS val 9422 ecr 230214,mptcp dss ack 3825203810 seq 2344588323 subseq 681157 len 1428 csum 0x859b], length 1428
16:29:00.223531 IP 112.26.0.8.41772 > 112.26.0.1.targus-getdata1: Flags [.], seq 338437:339865, ack 0, win 4107, options [nop,nop,TS val 9200 ecr 230009,mptcp dss ack 3825203810 seq 2344585467 subseq 431294 len 1428 csum 0xb1dc], length 1428
16:29:00.239545 IP 112.26.2.1.targus-getdata1 > 112.26.0.8.54549: Flags [.], ack 435540, win 24465, options [nop,nop,TS val 230836 ecr 9000,mptcp dss ack 2344554051], length 0
16:29:00.239744 IP 112.26.2.1.targus-getdata1 > 112.26.0.8.54549: Flags [.], ack 435540, win 24465, options [nop,nop,TS val 230836 ecr 9000,mptcp dss ack 2344554051], length 0
16:29:00.250056 IP 112.26.0.8.54549 > 112.26.2.1.targus-getdata1: Flags [.], seq 424116:425544, ack 1, win 4107, options [nop,nop,TS val 9000 ecr 229838,mptcp dss ack 3825203810 seq 2344559763 subseq 668305 len 1428 csum 0x8c1d], length 1428
16:29:00.251264 IP 112.26.0.8.41772 > 112.26.0.1.targus-getdata1: Flags [.], seq 339865:341293, ack 0, win 4107, options [nop,nop,TS val 9498 ecr 230303,mptcp dss ack 3825203810 seq 2344589751 subseq 432722 len 1428 csum 0xdd66], length 1428
16:29:00.255734 IP 112.26.0.8.41772 > 112.26.0.1.targus-getdata1: Flags [.], seq 327013:328441, ack 0, win 4107, options [nop,nop,TS val 9200 ecr 230045,mptcp dss ack 3825203810 seq 2344565475 subseq 419870 len 1428 csum 0x5eb1], length 1428
16:29:00.319409 IP 112.26.0.8.41772 > 112.26.0.1.targus-getdata1: Flags [.], seq 337009:338437, ack 0, win 4107, options [nop,nop,TS val 9106 ecr 229929,mptcp dss ack 3825203810 seq 2344584039 subseq 429866 len 1428 csum 0xc2ed], length 1428
16:29:00.324975 IP 112.26.0.1.targus-getdata1 > 112.26.0.8.41772: Flags [.], ack 327013, win 24465, options [nop,nop,TS val 230919 ecr 7305,nop,nop,sack 1 {328441:338437},mptcp dss ack 2344554051], length 0
16:29:00.325243 IP 112.26.0.1.targus-getdata1 > 112.26.0.8.41772: Flags [.], ack 327013, win 24465, options [nop,nop,TS val 230919 ecr 7305,nop,nop,sack 1 {328441:338437},mptcp dss ack 2344554051], length 0
16:29:00.337662 IP 112.26.0.8.54549 > 112.26.2.1.targus-getdata1: Flags [.], seq 435540:436968, ack 1, win 4107, options [nop,nop,TS val 9326 ecr 230129,mptcp dss ack 3825203810 seq 2344586895 subseq 679729 len 1428 csum 0x783c], length 1428
16:29:00.347268 IP 112.26.0.8.41772 > 112.26.0.1.targus-getdata1: Flags [.], seq 338437:339865, ack 0, win 4107, options [nop,nop,TS val 9200 ecr 230009,mptcp dss ack 3825203810 seq 2344585467 subseq 431294 len 1428 csum 0xb1dc], length 1428
16:29:00.406978 IP 112.26.0.1.targus-getdata1 > 112.26.0.8.41772: Flags [.], ack 327013, win 24465, options [nop,nop,TS val 230947 ecr 7305,nop,nop,sack 1 {328441:339865},mptcp dss ack 2344554051], length 0
16:29:00.407257 IP 112.26.0.1.targus-getdata1 > 112.26.0.8.41772: Flags [.], ack 327013, win 24465, options [nop,nop,TS val 230947 ecr 7305,nop,nop,sack 1 {328441:339865},mptcp dss ack 2344554051], length 0
16:29:00.424996 IP 112.26.0.8.54549 > 112.26.2.1.targus-getdata1: Flags [.], seq 436968:438396, ack 1, win 4107, options [nop,nop,TS val 9422 ecr 230214,mptcp dss ack 3825203810 seq 2344588323 subseq 681157 len 1428 csum 0x859b], length 1428
16:29:00.434848 IP 112.26.0.8.41772 > 112.26.0.1.targus-getdata1: Flags [.], seq 327013:328441, ack 0, win 4107, options [nop,nop,TS val 9200 ecr 230045,mptcp dss ack 3825203810 seq 2344565475 subseq 419870 len 1428 csum 0x5eb1], length 1428
16:29:00.440714 IP 112.26.0.8.59987 > 112.26.1.1.targus-getdata1: Flags [.], seq 74256:75684, ack 1, win 4107, options [nop,nop,TS val 9699 ecr 230538,mptcp dss ack 3825203810 seq 2344554051 subseq 528361 len 1428 csum 0xdeb4], length 1428
16:29:00.444856 IP 112.26.0.1.targus-getdata1 > 112.26.0.8.41772: Flags [.], ack 339865, win 24465, options [nop,nop,TS val 231034 ecr 9200,mptcp dss ack 2344554051], length 0
16:29:00.445026 IP 112.26.0.1.targus-getdata1 > 112.26.0.8.41772: Flags [.], ack 339865, win 24465, options [nop,nop,TS val 231034 ecr 9200,mptcp dss ack 2344554051], length 0
16:29:00.510931 IP 112.26.0.8.41772 > 112.26.0.1.targus-getdata1: Flags [.], seq 339865:341293, ack 0, win 4107, options [nop,nop,TS val 9498 ecr 230303,mptcp dss ack 3825203810 seq 2344589751 subseq 432722 len 1428 csum 0xdd66], length 1428
16:29:00.515990 IP 112.26.0.8.54549 > 112.26.2.1.targus-getdata1: Flags [.], seq 435540:436968, ack 1, win 4107, options [nop,nop,TS val 9326 ecr 230129,mptcp dss ack 3825203810 seq 2344586895 subseq 679729 len 1428 csum 0x783c], length 1428
16:29:00.519745 IP 112.26.2.1.targus-getdata1 > 112.26.0.8.54549: Flags [.], ack 436968, win 24465, options [nop,nop,TS val 231115 ecr 9326,mptcp dss ack 2344554051], length 0
16:29:00.519919 IP 112.26.2.1.targus-getdata1 > 112.26.0.8.54549: Flags [.], ack 436968, win 24465, options [nop,nop,TS val 231115 ecr 9326,mptcp dss ack 2344554051], length 0
16:29:00.540970 IP 112.26.0.8.59987 > 112.26.1.1.targus-getdata1: Flags [.], seq 74256:75684, ack 1, win 4107, options [nop,nop,TS val 9699 ecr 230538,mptcp dss ack 3825203810 seq 2344554051 subseq 528361 len 1428 csum 0xdeb4], length 1428
16:29:00.604461 IP 112.26.0.8.54549 > 112.26.2.1.targus-getdata1: Flags [.], seq 436968:438396, ack 1, win 4107, options [nop,nop,TS val 9422 ecr 230214,mptcp dss ack 3825203810 seq 2344588323 subseq 681157 len 1428 csum 0x859b], length 1428
16:29:00.607660 IP 112.26.2.1.targus-getdata1 > 112.26.0.8.54549: Flags [.], ack 438396, win 24465, options [nop,nop,TS val 231204 ecr 9422,mptcp dss ack 2344554051], length 0
16:29:00.607859 IP 112.26.2.1.targus-getdata1 > 112.26.0.8.54549: Flags [.], ack 438396, win 24465, options [nop,nop,TS val 231204 ecr 9422,mptcp dss ack 2344554051], length 0
16:29:00.626058 IP 112.26.0.8.54549 > 112.26.2.1.targus-getdata1: Flags [.], seq 438396:439824, ack 1, win 4107, options [nop,nop,TS val 9893 ecr 230613,mptcp dss ack 3825203810 seq 2344591179 subseq 682585 len 1428 csum 0xbe5e], length 1428
16:29:00.628024 IP 112.26.0.8.54549 > 112.26.2.1.targus-getdata1: Flags [.], seq 438396:439824, ack 1, win 4107, options [nop,nop,TS val 9893 ecr 230613,mptcp dss ack 3825203810 seq 2344591179 subseq 682585 len 1428 csum 0xbe5e], length 1428
16:29:00.638639 IP 112.26.0.8.41772 > 112.26.0.1.targus-getdata1: Flags [.], seq 339865:341293, ack 0, win 4107, options [nop,nop,TS val 9498 ecr 230303,mptcp dss ack 3825203810 seq 2344589751 subseq 432722 len 1428 csum 0xdd66], length 1428
16:29:00.643129 IP 112.26.0.1.targus-getdata1 > 112.26.0.8.41772: Flags [.], ack 341293, win 24465, options [nop,nop,TS val 231238 ecr 9498,mptcp dss ack 2344554051], length 0
16:29:00.643315 IP 112.26.0.1.targus-getdata1 > 112.26.0.8.41772: Flags [.], ack 341293, win 24465, options [nop,nop,TS val 231238 ecr 9498,mptcp dss ack 2344554051], length 0
16:29:00.653345 IP 112.26.0.8.54549 > 112.26.2.1.targus-getdata1: Flags [.], seq 439824:441252, ack 1, win 4107, options [nop,nop,TS val 9893 ecr 230728,mptcp dss ack 3825203810 seq 2344592607 subseq 684013 len 1428 csum 0xc5e], length 1428
16:29:00.713898 IP 112.26.0.8.59987 > 112.26.1.1.targus-getdata1: Flags [.], seq 74256:75684, ack 1, win 4107, options [nop,nop,TS val 9699 ecr 230538,mptcp dss ack 3825203810 seq 2344554051 subseq 528361 len 1428 csum 0xdeb4], length 1428
16:29:00.716543 IP 112.26.1.1.targus-getdata1 > 112.26.0.8.59987: Flags [.], ack 77112, win 24199, options [nop,nop,TS val 231313 ecr 9699,nop,nop,sack 1 {78540:79968},mptcp dss ack 2344578327], length 0
16:29:00.716718 IP 112.26.1.1.targus-getdata1 > 112.26.0.8.59987: Flags [.], ack 77112, win 24199, options [nop,nop,TS val 231313 ecr 9699,nop,nop,sack 1 {78540:79968},mptcp dss ack 2344578327], length 0
16:29:00.728560 IP 112.26.0.8.54549 > 112.26.2.1.targus-getdata1: Flags [.], seq 441252:442680, ack 1, win 4107, options [nop,nop,TS val 9893 ecr 230728,mptcp dss ack 3825203810 seq 2344594035 subseq 685441 len 1428 csum 0xb4de], length 1428
16:29:00.733335 IP 112.26.0.8.54549 > 112.26.2.1.targus-getdata1: Flags [.], seq 439824:441252, ack 1, win 4107, options [nop,nop,TS val 9893 ecr 230728,mptcp dss ack 3825203810 seq 2344592607 subseq 684013 len 1428 csum 0xc5e], length 1428
16:29:00.739627 IP 112.26.0.8.54549 > 112.26.2.1.targus-getdata1: Flags [.], seq 442680:444108, ack 1, win 4107, options [nop,nop,TS val 9920 ecr 230836,mptcp dss ack 3825203810 seq 2344595463 subseq 686869 len 1428 csum 0x1e60], length 1428
16:29:00.749412 IP 112.26.2.1.targus-getdata1 > 112.26.0.8.54549: Flags [.], ack 439824, win 24450, options [nop,nop,TS val 231346 ecr 9893,mptcp dss ack 2344578327], length 0
16:29:00.749592 IP 112.26.2.1.targus-getdata1 > 112.26.0.8.54549: Flags [.], ack 439824, win 24450, options [nop,nop,TS val 231346 ecr 9893,mptcp dss ack 2344578327], length 0
16:29:00.750389 IP 112.26.0.8.54549 > 112.26.2.1.targus-getdata1: Flags [.], seq 438396:439824, ack 1, win 4107, options [nop,nop,TS val 9893 ecr 230613,mptcp dss ack 3825203810 seq 2344591179 subseq 682585 len 1428 csum 0xbe5e], length 1428
16:29:00.817374 IP 112.26.0.8.54549 > 112.26.2.1.targus-getdata1: Flags [.], seq 441252:442680, ack 1, win 4107, options [nop,nop,TS val 9893 ecr 230728,mptcp dss ack 3825203810 seq 2344594035 subseq 685441 len 1428 csum 0xb4de], length 1428
16:29:00.836853 IP 112.26.0.8.54549 > 112.26.2.1.targus-getdata1: Flags [.], seq 439824:441252, ack 1, win 4107, options [nop,nop,TS val 9893 ecr 230728,mptcp dss ack 3825203810 seq 2344592607 subseq 684013 len 1428 csum 0xc5e], length 1428
16:29:00.852127 IP 112.26.0.8.54549 > 112.26.2.1.targus-getdata1: Flags [.], seq 442680:444108, ack 1, win 4107, options [nop,nop,TS val 9920 ecr 230836,mptcp dss ack 3825203810 seq 2344595463 subseq 686869 len 1428 csum 0x1e60], length 1428
16:29:00.867333 IP 112.26.2.1.targus-getdata1 > 112.26.0.8.54549: Flags [.], ack 441252, win 24450, options [nop,nop,TS val 231434 ecr 9893,mptcp dss ack 2344578327], length 0
16:29:00.867525 IP 112.26.2.1.targus-getdata1 > 112.26.0.8.54549: Flags [.], ack 441252, win 24450, options [nop,nop,TS val 231434 ecr 9893,mptcp dss ack 2344578327], length 0
16:29:00.908572 IP 112.26.0.8.41772 > 112.26.0.1.targus-getdata1: Flags [.], seq 341293:342721, ack 0, win 4107, options [nop,nop,TS val 10099 ecr 230919,mptcp dss ack 3825203810 seq 2344596891 subseq 434150 len 1428 csum 0x3a8b], length 1428
16:29:00.912372 IP 112.26.0.8.41772 > 112.26.0.1.targus-getdata1: Flags [.], seq 342721:344149, ack 0, win 4107, options [nop,nop,TS val 10130 ecr 230947,mptcp dss ack 3825203810 seq 2344598319 subseq 435578 len 1428 csum 0x9a35], length 1428
16:29:00.920059 IP 112.26.0.8.54549 > 112.26.2.1.targus-getdata1: Flags [.], seq 441252:442680, ack 1, win 4107, options [nop,nop,TS val 9893 ecr 230728,mptcp dss ack 3825203810 seq 2344594035 subseq 685441 len 1428 csum 0xb4de], length 1428
16:29:00.931498 IP 112.26.0.8.41772 > 112.26.0.1.targus-getdata1: Flags [.], seq 341293:342721, ack 0, win 4107, options [nop,nop,TS val 10099 ecr 230919,mptcp dss ack 3825203810 seq 2344596891 subseq 434150 len 1428 csum 0x3a8b], length 1428
16:29:00.932528 IP 112.26.2.1.targus-getdata1 > 112.26.0.8.54549: Flags [.], ack 442680, win 24450, options [nop,nop,TS val 231519 ecr 9893,mptcp dss ack 2344578327], length 0
16:29:00.932696 IP 112.26.2.1.targus-getdata1 > 112.26.0.8.54549: Flags [.], ack 442680, win 24450, options [nop,nop,TS val 231519 ecr 9893,mptcp dss ack 2344578327], length 0
16:29:00.937637 IP 112.26.0.8.41772 > 112.26.0.1.targus-getdata1: Flags [.], seq 344149:345577, ack 0, win 4107, options [nop,nop,TS val 10130 ecr 231034,mptcp dss ack 3825203810 seq 2344599747 subseq 437006 len 1428 csum 0x7e63], length 1428
16:29:00.953116 IP 112.26.0.8.54549 > 112.26.2.1.targus-getdata1: Flags [.], seq 442680:444108, ack 1, win 4107, options [nop,nop,TS val 9920 ecr 230836,mptcp dss ack 3825203810 seq 2344595463 subseq 686869 len 1428 csum 0x1e60], length 1428
16:29:00.956475 IP 112.26.2.1.targus-getdata1 > 112.26.0.8.54549: Flags [.], ack 444108, win 24450, options [nop,nop,TS val 231552 ecr 9920,mptcp dss ack 2344578327], length 0
16:29:00.956624 IP 112.26.2.1.targus-getdata1 > 112.26.0.8.54549: Flags [.], ack 444108, win 24450, options [nop,nop,TS val 231552 ecr 9920,mptcp dss ack 2344578327], length 0
16:29:01.011588 IP 112.26.0.8.54549 > 112.26.2.1.targus-getdata1: Flags [.], seq 444108:445536, ack 1, win 4107, options [nop,nop,TS val 10213 ecr 231115,mptcp dss ack 3825203810 seq 2344601175 subseq 688297 len 1428 csum 0x443d], length 1428
16:29:01.021699 IP 112.26.0.8.41772 > 112.26.0.1.targus-getdata1: Flags [.], seq 342721:344149, ack 0, win 4107, options [nop,nop,TS val 10130 ecr 230947,mptcp dss ack 3825203810 seq 2344598319 subseq 435578 len 1428 csum 0x9a35], length 1428
16:29:01.033505 IP 112.26.0.8.54549 > 112.26.2.1.targus-getdata1: Flags [.], seq 445536:446964, ack 1, win 4107, options [nop,nop,TS val 10213 ecr 231115,mptcp dss ack 3825203810 seq 2344602603 subseq 689725 len 1428 csum 0x45f4], length 1428
16:29:01.039784 IP 112.26.0.8.41772 > 112.26.0.1.targus-getdata1: Flags [.], seq 341293:342721, ack 0, win 4107, options [nop,nop,TS val 10099 ecr 230919,mptcp dss ack 3825203810 seq 2344596891 subseq 434150 len 1428 csum 0x3a8b], length 1428
16:29:01.043985 IP 112.26.0.1.targus-getdata1 > 112.26.0.8.41772: Flags [.], ack 342721, win 24450, options [nop,nop,TS val 231638 ecr 10099,mptcp dss ack 2344578327], length 0
16:29:01.044156 IP 112.26.0.1.targus-getdata1 > 112.26.0.8.41772: Flags [.], ack 342721, win 24450, options [nop,nop,TS val 231638 ecr 10099,mptcp dss ack 2344578327], length 0
16:29:01.109948 IP 112.26.0.8.41772 > 112.26.0.1.targus-getdata1: Flags [.], seq 344149:345577, ack 0, win 4107, options [nop,nop,TS val 10130 ecr 231034,mptcp dss ack 3825203810 seq 2344599747 subseq 437006 len 1428 csum 0x7e63], length 1428
16:29:01.124603 IP 112.26.0.8.41772 > 112.26.0.1.targus-getdata1: Flags [.], seq 342721:344149, ack 0, win 4107, options [nop,nop,TS val 10130 ecr 230947,mptcp dss ack 3825203810 seq 2344598319 subseq 435578 len 1428 csum 0x9a35], length 1428
16:29:01.130826 IP 112.26.0.1.targus-getdata1 > 112.26.0.8.41772: Flags [.], ack 344149, win 24450, options [nop,nop,TS val 231724 ecr 10130,mptcp dss ack 2344578327], length 0
16:29:01.130960 IP 112.26.0.1.targus-getdata1 > 112.26.0.8.41772: Flags [.], ack 344149, win 24450, options [nop,nop,TS val 231724 ecr 10130,mptcp dss ack 2344578327], length 0
16:29:01.152332 IP 112.26.0.8.54549 > 112.26.2.1.targus-getdata1: Flags [.], seq 446964:448392, ack 1, win 4107, options [nop,nop,TS val 10298 ecr 231204,mptcp dss ack 3825203810 seq 2344604031 subseq 691153 len 1428 csum 0xea7d], length 1428
16:29:01.162033 IP 112.26.0.8.41772 > 112.26.0.1.targus-getdata1: Flags [.], seq 344149:345577, ack 0, win 4107, options [nop,nop,TS val 10130 ecr 231034,mptcp dss ack 3825203810 seq 2344599747 subseq 437006 len 1428 csum 0x7e63], length 1428
16:29:01.168122 IP 112.26.0.1.targus-getdata1 > 112.26.0.8.41772: Flags [.], ack 345577, win 24450, options [nop,nop,TS val 231758 ecr 10130,mptcp dss ack 2344578327], length 0
16:29:01.168386 IP 112.26.0.1.targus-getdata1 > 112.26.0.8.41772: Flags [.], ack 345577, win 24450, options [nop,nop,TS val 231758 ecr 10130,mptcp dss ack 2344578327], length 0
16:29:01.211127 IP 112.26.0.8.54549 > 112.26.2.1.targus-getdata1: Flags [.], seq 444108:445536, ack 1, win 4107, options [nop,nop,TS val 10213 ecr 231115,mptcp dss ack 3825203810 seq 2344601175 subseq 688297 len 1428 csum 0x443d], length 1428
16:29:01.229116 IP 112.26.2.1.targus-getdata1 > 112.26.0.8.54549: Flags [.], ack 445536, win 24450, options [nop,nop,TS val 231823 ecr 10213,mptcp dss ack 2344578327], length 0
16:29:01.229309 IP 112.26.2.1.targus-getdata1 > 112.26.0.8.54549: Flags [.], ack 445536, win 24450, options [nop,nop,TS val 231823 ecr 10213,mptcp dss ack 2344578327], length 0
16:29:01.233830 IP 112.26.0.8.54549 > 112.26.2.1.targus-getdata1: Flags [.], seq 444108:445536, ack 1, win 4107, options [nop,nop,TS val 10213 ecr 231115,mptcp dss ack 3825203810 seq 2344601175 subseq 688297 len 1428 csum 0x443d], length 1428
16:29:01.238796 IP 112.26.0.8.41772 > 112.26.0.1.targus-getdata1: Flags [.], seq 345577:347005, ack 0, win 4107, options [nop,nop,TS val 10386 ecr 231238,mptcp dss ack 3825203810 seq 2344605459 subseq 438434 len 1428 csum 0xa71d], length 1428
16:29:01.245216 IP 112.26.0.8.54549 > 112.26.2.1.targus-getdata1: Flags [.], seq 445536:446964, ack 1, win 4107, options [nop,nop,TS val 10213 ecr 231115,mptcp dss ack 3825203810 seq 2344602603 subseq 689725 len 1428 csum 0x45f4], length 1428
16:29:01.254360 IP 112.26.0.8.41772 > 112.26.0.1.targus-getdata1: Flags [.], seq 347005:348433, ack 0, win 4107, options [nop,nop,TS val 10386 ecr 231238,mptcp dss ack 3825203810 seq 2344606887 subseq 439862 len 1428 csum 0xcfb9], length 1428
16:29:01.312066 IP 112.26.2.1.targus-getdata1 > 112.26.0.8.54549: Flags [.], ack 446964, win 24450, options [nop,nop,TS val 231862 ecr 10213,mptcp dss ack 2344578327], length 0
16:29:01.312435 IP 112.26.2.1.targus-getdata1 > 112.26.0.8.54549: Flags [.], ack 446964, win 24450, options [nop,nop,TS val 231862 ecr 10213,mptcp dss ack 2344578327], length 0
16:29:01.314427 IP 112.26.0.8.54549 > 112.26.2.1.targus-getdata1: Flags [.], seq 445536:446964, ack 1, win 4107, options [nop,nop,TS val 10213 ecr 231115,mptcp dss ack 3825203810 seq 2344602603 subseq 689725 len 1428 csum 0x45f4], length 1428
16:29:01.326474 IP 112.26.0.8.59987 > 112.26.1.1.targus-getdata1: Flags [.], seq 77112:78540, ack 1, win 4107, options [nop,nop,TS val 10429 ecr 231313,mptcp dss ack 3825203810 seq 2344578327 subseq 531217 len 1428 csum 0x5a72], length 1428
16:29:01.346299 IP 112.26.0.8.59987 > 112.26.1.1.targus-getdata1: Flags [.], seq 79968:81396, ack 1, win 4107, options [nop,nop,TS val 10429 ecr 231313,mptcp dss ack 3825203810 seq 2344608315 subseq 534073 len 1428 csum 0x8e30], length 1428
16:29:01.415502 IP 112.26.0.8.54549 > 112.26.2.1.targus-getdata1: Flags [.], seq 446964:448392, ack 1, win 4107, options [nop,nop,TS val 10298 ecr 231204,mptcp dss ack 3825203810 seq 2344604031 subseq 691153 len 1428 csum 0xea7d], length 1428
16:29:01.422179 IP 112.26.2.1.targus-getdata1 > 112.26.0.8.54549: Flags [.], ack 448392, win 24450, options [nop,nop,TS val 232017 ecr 10298,mptcp dss ack 2344578327], length 0
16:29:01.422411 IP 112.26.2.1.targus-getdata1 > 112.26.0.8.54549: Flags [.], ack 448392, win 24450, options [nop,nop,TS val 232017 ecr 10298,mptcp dss ack 2344578327], length 0
16:29:01.424519 IP 112.26.0.8.54549 > 112.26.2.1.targus-getdata1: Flags [.], seq 446964:448392, ack 1, win 4107, options [nop,nop,TS val 10298 ecr 231204,mptcp dss ack 3825203810 seq 2344604031 subseq 691153 len 1428 csum 0xea7d], length 1428
16:29:01.431085 IP 112.26.0.8.54549 > 112.26.2.1.targus-getdata1: Flags [.], seq 448392:449820, ack 1, win 4107, options [nop,nop,TS val 10504 ecr 231346,mptcp dss ack 3825203810 seq 2344609743 subseq 692581 len 1428 csum 0x5957], length 1428
16:29:01.441550 IP 112.26.0.8.54549 > 112.26.2.1.targus-getdata1: Flags [.], seq 449820:451248, ack 1, win 4107, options [nop,nop,TS val 10591 ecr 231434,mptcp dss ack 3825203810 seq 2344611171 subseq 694009 len 1428 csum 0x72ea], length 1428
16:29:01.449200 IP 112.26.0.8.41772 > 112.26.0.1.targus-getdata1: Flags [.], seq 345577:347005, ack 0, win 4107, options [nop,nop,TS val 10386 ecr 231238,mptcp dss ack 3825203810 seq 2344605459 subseq 438434 len 1428 csum 0xa71d], length 1428
16:29:01.455501 IP 112.26.0.1.targus-getdata1 > 112.26.0.8.41772: Flags [.], ack 347005, win 24450, options [nop,nop,TS val 232051 ecr 10386,mptcp dss ack 2344578327], length 0
16:29:01.455663 IP 112.26.0.1.targus-getdata1 > 112.26.0.8.41772: Flags [.], ack 347005, win 24450, options [nop,nop,TS val 232051 ecr 10386,mptcp dss ack 2344578327], length 0
16:29:01.456532 IP 112.26.0.8.41772 > 112.26.0.1.targus-getdata1: Flags [.], seq 345577:347005, ack 0, win 4107, options [nop,nop,TS val 10386 ecr 231238,mptcp dss ack 3825203810 seq 2344605459 subseq 438434 len 1428 csum 0xa71d], length 1428
16:29:01.514844 IP 112.26.0.8.54549 > 112.26.2.1.targus-getdata1: Flags [.], seq 451248:452676, ack 1, win 4107, options [nop,nop,TS val 10591 ecr 231434,mptcp dss ack 3825203810 seq 2344612599 subseq 695437 len 1428 csum 0x7af9], length 1428
16:29:01.542103 IP 112.26.0.8.41772 > 112.26.0.1.targus-getdata1: Flags [.], seq 347005:348433, ack 0, win 4107, options [nop,nop,TS val 10386 ecr 231238,mptcp dss ack 3825203810 seq 2344606887 subseq 439862 len 1428 csum 0xcfb9], length 1428
16:29:01.545870 IP 112.26.0.8.41772 > 112.26.0.1.targus-getdata1: Flags [.], seq 347005:348433, ack 0, win 4107, options [nop,nop,TS val 10386 ecr 231238,mptcp dss ack 3825203810 seq 2344606887 subseq 439862 len 1428 csum 0xcfb9], length 1428
16:29:01.547895 IP 112.26.0.1.targus-getdata1 > 112.26.0.8.41772: Flags [.], ack 348433, win 24450, options [nop,nop,TS val 232143 ecr 10386,mptcp dss ack 2344578327], length 0
16:29:01.548095 IP 112.26.0.1.targus-getdata1 > 112.26.0.8.41772: Flags [.], ack 348433, win 24450, options [nop,nop,TS val 232143 ecr 10386,mptcp dss ack 2344578327], length 0
16:29:01.558270 IP 112.26.0.8.54549 > 112.26.2.1.targus-getdata1: Flags [.], seq 452676:454104, ack 1, win 4107, options [nop,nop,TS val 10613 ecr 231519,mptcp dss ack 3825203810 seq 2344614027 subseq 696865 len 1428 csum 0x1b83], length 1428
16:29:01.621910 IP 112.26.0.8.59987 > 112.26.1.1.targus-getdata1: Flags [.], seq 77112:78540, ack 1, win 4107, options [nop,nop,TS val 10429 ecr 231313,mptcp dss ack 3825203810 seq 2344578327 subseq 531217 len 1428 csum 0x5a72], length 1428
16:29:01.625233 IP 112.26.0.8.59987 > 112.26.1.1.targus-getdata1: Flags [.], seq 77112:78540, ack 1, win 4107, options [nop,nop,TS val 10429 ecr 231313,mptcp dss ack 3825203810 seq 2344578327 subseq 531217 len 1428 csum 0x5a72], length 1428
16:29:01.632577 IP 112.26.1.1.targus-getdata1 > 112.26.0.8.59987: Flags [.], ack 79968, win 24243, options [nop,nop,TS val 232224 ecr 10429,mptcp dss ack 2344608315], length 0
16:29:01.632707 IP 112.26.1.1.targus-getdata1 > 112.26.0.8.59987: Flags [.], ack 79968, win 24243, options [nop,nop,TS val 232224 ecr 10429,mptcp dss ack 2344608315], length 0
16:29:01.635317 IP 112.26.0.8.54549 > 112.26.2.1.targus-getdata1: Flags [.], seq 454104:455532, ack 1, win 4107, options [nop,nop,TS val 10715 ecr 231552,mptcp dss ack 3825203810 seq 2344615455 subseq 698293 len 1428 csum 0xd26c], length 1428
16:29:01.648554 IP 112.26.0.8.41772 > 112.26.0.1.targus-getdata1: Flags [.], seq 348433:349861, ack 0, win 4107, options [nop,nop,TS val 10800 ecr 231638,mptcp dss ack 3825203810 seq 2344616883 subseq 441290 len 1428 csum 0x9b6a], length 1428
16:29:01.717648 IP 112.26.0.8.59987 > 112.26.1.1.targus-getdata1: Flags [.], seq 79968:81396, ack 1, win 4107, options [nop,nop,TS val 10429 ecr 231313,mptcp dss ack 3825203810 seq 2344608315 subseq 534073 len 1428 csum 0x8e30], length 1428
16:29:01.724405 IP 112.26.0.8.59987 > 112.26.1.1.targus-getdata1: Flags [.], seq 79968:81396, ack 1, win 4107, options [nop,nop,TS val 10429 ecr 231313,mptcp dss ack 3825203810 seq 2344608315 subseq 534073 len 1428 csum 0x8e30], length 1428
16:29:01.728745 IP 112.26.1.1.targus-getdata1 > 112.26.0.8.59987: Flags [.], ack 81396, win 24558, options [nop,nop,TS val 232319 ecr 10429,mptcp dss ack 2344609743], length 0
16:29:01.728964 IP 112.26.1.1.targus-getdata1 > 112.26.0.8.59987: Flags [.], ack 81396, win 24558, options [nop,nop,TS val 232319 ecr 10429,mptcp dss ack 2344609743], length 0
16:29:01.733861 IP 112.26.0.8.41772 > 112.26.0.1.targus-getdata1: Flags [.], seq 349861:351289, ack 0, win 4107, options [nop,nop,TS val 10831 ecr 231724,mptcp dss ack 3825203810 seq 2344618311 subseq 442718 len 1428 csum 0x8c93], length 1428
16:29:01.754874 IP 112.26.0.8.54549 > 112.26.2.1.targus-getdata1: Flags [.], seq 448392:449820, ack 1, win 4107, options [nop,nop,TS val 10504 ecr 231346,mptcp dss ack 3825203810 seq 2344609743 subseq 692581 len 1428 csum 0x5957], length 1428
16:29:01.766997 IP 112.26.2.1.targus-getdata1 > 112.26.0.8.54549: Flags [.], ack 449820, win 24558, options [nop,nop,TS val 232360 ecr 10504,mptcp dss ack 2344611171], length 0
16:29:01.767170 IP 112.26.2.1.targus-getdata1 > 112.26.0.8.54549: Flags [.], ack 449820, win 24558, options [nop,nop,TS val 232360 ecr 10504,mptcp dss ack 2344611171], length 0
16:29:01.770930 IP 112.26.0.8.54549 > 112.26.2.1.targus-getdata1: Flags [.], seq 448392:449820, ack 1, win 4107, options [nop,nop,TS val 10504 ecr 231346,mptcp dss ack 3825203810 seq 2344609743 subseq 692581 len 1428 csum 0x5957], length 1428
16:29:01.817662 IP 112.26.0.8.41772 > 112.26.0.1.targus-getdata1: Flags [.], seq 351289:352717, ack 0, win 4107, options [nop,nop,TS val 10831 ecr 231724,mptcp dss ack 3825203810 seq 2344619739 subseq 444146 len 1428 csum 0x962c], length 1428
16:29:01.821165 IP 112.26.0.8.41772 > 112.26.0.1.targus-getdata1: Flags [.], seq 352717:354145, ack 0, win 4107, options [nop,nop,TS val 10886 ecr 231758,mptcp dss ack 3825203810 seq 2344621167 subseq 445574 len 1428 csum 0x7ce], length 1428
16:29:01.829622 IP 112.26.0.8.54549 > 112.26.2.1.targus-getdata1: Flags [.], seq 449820:451248, ack 1, win 4107, options [nop,nop,TS val 10591 ecr 231434,mptcp dss ack 3825203810 seq 2344611171 subseq 694009 len 1428 csum 0x72ea], length 1428
16:29:01.836924 IP 112.26.0.8.54549 > 112.26.2.1.targus-getdata1: Flags [.], seq 449820:451248, ack 1, win 4107, options [nop,nop,TS val 10591 ecr 231434,mptcp dss ack 3825203810 seq 2344611171 subseq 694009 len 1428 csum 0x72ea], length 1428
