17:00:34.907164 IP 112.26.3.8.33535 > 112.26.3.1.targus-getdata1: Flags [S], seq 746739866, win 29200, options [mss 1460,sackOK,TS val 4294813937 ecr 0,nop,wscale 7,mptcp join id 5 token 0xb697b9d8 nonce 0x70a62e96], length 0
17:00:34.961765 IP 112.26.3.8.33535 > 112.26.3.1.targus-getdata1: Flags [S], seq 746739866, win 29200, options [mss 1460,sackOK,TS val 4294813937 ecr 0,nop,wscale 7,mptcp join id 5 token 0xb697b9d8 nonce 0x70a62e96], length 0
17:00:35.075394 IP 112.26.3.1.targus-getdata1 > 112.26.3.8.33535: Flags [S.], seq 3165522081, ack 746739867, win 65535, options [mss 1460,sackOK,TS val 68577 ecr 4294813937,nop,wscale 6,mptcp join id 5 hmac 0x86563cd91da36402 nonce 0x767b2bac], length 0
17:00:35.233265 IP 112.26.3.8.33535 > 112.26.3.1.targus-getdata1: Flags [.], ack 1, win 913, options [nop,nop,TS val 4294814337 ecr 68577,mptcp join hmac 0x0658a1a4ba17b9341d4604c566e33c7d3bb3fb39], length 0
17:00:35.236443 IP 112.26.3.8.33535 > 112.26.3.1.targus-getdata1: Flags [.], ack 1, win 913, options [nop,nop,TS val 4294814337 ecr 68577,mptcp join hmac 0x0658a1a4ba17b9341d4604c566e33c7d3bb3fb39], length 0
17:00:35.247222 IP 112.26.3.1.targus-getdata1 > 112.26.3.8.33535: Flags [.], ack 1, win 2678, options [nop,nop,TS val 68792 ecr 4294814337,mptcp dss ack 2376860407], length 0
17:00:36.121836 IP 112.26.3.8.45289 > 112.26.3.1.targus-getdata1: Flags [S], seq 2366768115, win 29200, options [mss 1460,sackOK,TS val 4294815255 ecr 0,nop,wscale 7,mptcp join id 5 token 0xc6830f5c nonce 0xbca4b955], length 0
17:03:38.939878 IP 112.26.3.1.targus-getdata1 > 112.26.3.8.33535: Flags [P.], seq 1:2, ack 1, win 4017, options [nop,nop,TS val 252482 ecr 4294814337,mptcp dss ack 2376860491 seq 116031161 subseq 1 len 1 csum 0x3719], length 1
17:03:38.983561 IP 112.26.3.1.targus-getdata1 > 112.26.3.8.33535: Flags [P.], seq 1:2, ack 1, win 4017, options [nop,nop,TS val 252482 ecr 4294814337,mptcp dss ack 2376860491 seq 116031161 subseq 1 len 1 csum 0x3719], length 1
17:03:39.040745 IP 112.26.3.1.targus-getdata1 > 112.26.3.8.33535: Flags [P.], seq 1:2, ack 1, win 4017, options [nop,nop,TS val 252482 ecr 4294814337,mptcp dss ack 2376860491 seq 116031161 subseq 1 len 1 csum 0x3719], length 1
17:03:39.045306 IP 112.26.3.8.33535 > 112.26.3.1.targus-getdata1: Flags [.], ack 2, win 913, options [nop,nop,TS val 30883 ecr 252482,mptcp dss ack 116031162], length 0
17:03:39.052850 IP 112.26.3.8.33535 > 112.26.3.1.targus-getdata1: Flags [.], ack 2, win 913, options [nop,nop,TS val 30883 ecr 252482,mptcp dss ack 116031162], length 0
17:03:39.448504 IP 112.26.3.8.33535 > 112.26.3.1.targus-getdata1: Flags [P.], seq 1:220, ack 2, win 913, options [nop,nop,TS val 31264 ecr 252482,mptcp dss ack 116031162 seq 2376860495 subseq 1 len 219 csum 0x30ec], length 219
17:03:39.450628 IP 112.26.3.8.33535 > 112.26.3.1.targus-getdata1: Flags [P.], seq 1:220, ack 2, win 913, options [nop,nop,TS val 31264 ecr 252482,mptcp dss ack 116031162 seq 2376860495 subseq 1 len 219 csum 0x30ec], length 219
17:03:39.452741 IP 112.26.3.1.targus-getdata1 > 112.26.3.8.33535: Flags [.], ack 220, win 4017, options [nop,nop,TS val 252998 ecr 31264,mptcp dss ack 2376860714], length 0
17:03:39.453092 IP 112.26.3.1.targus-getdata1 > 112.26.3.8.33535: Flags [.], ack 220, win 4017, options [nop,nop,TS val 252998 ecr 31264,mptcp dss ack 2376860714], length 0
17:03:39.479243 IP 112.26.3.1.targus-getdata1 > 112.26.3.8.33535: Flags [.], ack 220, win 4017, options [nop,nop,TS val 252998 ecr 31264,mptcp dss ack 2376860714], length 0
17:03:39.482909 IP 112.26.3.1.targus-getdata1 > 112.26.3.8.33535: Flags [P.], seq 2:6, ack 220, win 4017, options [nop,nop,TS val 252999 ecr 31264,mptcp dss ack 2376860714 seq 116031162 subseq 2 len 4 csum 0x4337], length 4
17:03:39.483236 IP 112.26.3.1.targus-getdata1 > 112.26.3.8.33535: Flags [P.], seq 2:6, ack 220, win 4017, options [nop,nop,TS val 252999 ecr 31264,mptcp dss ack 2376860714 seq 116031162 subseq 2 len 4 csum 0x4337], length 4
17:03:39.534261 IP 112.26.3.1.targus-getdata1 > 112.26.3.8.33535: Flags [P.], seq 2:6, ack 220, win 4017, options [nop,nop,TS val 252999 ecr 31264,mptcp dss ack 2376860714 seq 116031162 subseq 2 len 4 csum 0x4337], length 4
17:03:39.552913 IP 112.26.3.8.33535 > 112.26.3.1.targus-getdata1: Flags [.], ack 6, win 913, options [nop,nop,TS val 31376 ecr 252999,mptcp dss ack 116031166], length 0
17:03:39.618638 IP 112.26.3.1.targus-getdata1 > 112.26.3.8.33535: Flags [P.], seq 6:228, ack 220, win 4017, options [nop,nop,TS val 253102 ecr 31264,mptcp dss ack 2376860714 seq 116031166 subseq 6 len 222 csum 0x6956], length 222
17:03:39.619053 IP 112.26.3.1.targus-getdata1 > 112.26.3.8.33535: Flags [P.], seq 6:228, ack 220, win 4017, options [nop,nop,TS val 253102 ecr 31264,mptcp dss ack 2376860714 seq 116031166 subseq 6 len 222 csum 0x6956], length 222
17:03:39.620164 IP 112.26.3.8.33535 > 112.26.3.1.targus-getdata1: Flags [.], ack 6, win 913, options [nop,nop,TS val 31376 ecr 252999,mptcp dss ack 116031166], length 0
17:03:39.641811 IP 112.26.3.1.targus-getdata1 > 112.26.3.8.33535: Flags [P.], seq 6:228, ack 220, win 4017, options [nop,nop,TS val 253102 ecr 31264,mptcp dss ack 2376860714 seq 116031166 subseq 6 len 222 csum 0x6956], length 222
17:03:39.647218 IP 112.26.3.8.33535 > 112.26.3.1.targus-getdata1: Flags [.], ack 228, win 916, options [nop,nop,TS val 31484 ecr 253102,mptcp dss ack 116031388], length 0
17:03:39.648919 IP 112.26.3.8.33535 > 112.26.3.1.targus-getdata1: Flags [.], ack 228, win 916, options [nop,nop,TS val 31484 ecr 253102,mptcp dss ack 116031388], length 0
17:03:39.730102 IP 112.26.3.8.33535 > 112.26.3.1.targus-getdata1: Flags [P.], seq 220:221, ack 228, win 916, options [nop,nop,TS val 31485 ecr 253102,mptcp dss ack 116031388 seq 2376860714 subseq 220 len 1 csum 0x99d4], length 1
17:03:39.732213 IP 112.26.3.8.33535 > 112.26.3.1.targus-getdata1: Flags [P.], seq 220:221, ack 228, win 916, options [nop,nop,TS val 31485 ecr 253102,mptcp dss ack 116031388 seq 2376860714 subseq 220 len 1 csum 0x99d4], length 1
17:03:39.735753 IP 112.26.3.1.targus-getdata1 > 112.26.3.8.33535: Flags [F.], seq 228, ack 221, win 4017, options [nop,nop,TS val 253280 ecr 31485,mptcp dss fin ack 2376860715 seq 116031388 subseq 0 len 1 csum 0x4337], length 0
17:03:39.736164 IP 112.26.3.1.targus-getdata1 > 112.26.3.8.33535: Flags [F.], seq 228, ack 221, win 4017, options [nop,nop,TS val 253280 ecr 31485,mptcp dss fin ack 2376860715 seq 116031388 subseq 0 len 1 csum 0x4337], length 0
17:03:39.741602 IP 112.26.3.1.targus-getdata1 > 112.26.3.8.33535: Flags [F.], seq 228, ack 221, win 4017, options [nop,nop,TS val 253280 ecr 31485,mptcp dss fin ack 2376860715 seq 116031388 subseq 0 len 1 csum 0x4337], length 0
17:03:39.820460 IP 112.26.3.8.33535 > 112.26.3.1.targus-getdata1: Flags [.], ack 228, win 916, options [nop,nop,TS val 31486 ecr 253102,mptcp dss fin ack 116031388 seq 2376860715 subseq 0 len 1 csum 0xaaaf], length 0
17:03:39.827654 IP 112.26.3.1.targus-getdata1 > 112.26.3.8.33535: Flags [.], ack 221, win 4017, options [nop,nop,TS val 253371 ecr 31486,mptcp dss ack 2376860716], length 0
17:03:39.828067 IP 112.26.3.1.targus-getdata1 > 112.26.3.8.33535: Flags [.], ack 221, win 4017, options [nop,nop,TS val 253371 ecr 31486,mptcp dss ack 2376860716], length 0
17:03:39.828716 IP 112.26.3.8.33535 > 112.26.3.1.targus-getdata1: Flags [.], ack 228, win 916, options [nop,nop,TS val 31486 ecr 253102,mptcp dss fin ack 116031388 seq 2376860715 subseq 0 len 1 csum 0xaaaf], length 0
17:03:39.845524 IP 112.26.3.1.targus-getdata1 > 112.26.3.8.33535: Flags [.], ack 221, win 4017, options [nop,nop,TS val 253371 ecr 31486,mptcp dss ack 2376860716], length 0
17:03:39.853198 IP 112.26.3.8.33535 > 112.26.3.1.targus-getdata1: Flags [.], ack 229, win 916, options [nop,nop,TS val 31584 ecr 253280,mptcp dss ack 116031389], length 0
17:03:39.856295 IP 112.26.3.8.33535 > 112.26.3.1.targus-getdata1: Flags [.], ack 229, win 916, options [nop,nop,TS val 31584 ecr 253280,mptcp dss ack 116031389], length 0
17:03:39.949242 IP 112.26.3.8.33535 > 112.26.3.1.targus-getdata1: Flags [F.], seq 221, ack 229, win 916, options [nop,nop,TS val 31688 ecr 253280,mptcp dss ack 116031389], length 0
17:03:39.951146 IP 112.26.3.8.33535 > 112.26.3.1.targus-getdata1: Flags [F.], seq 221, ack 229, win 916, options [nop,nop,TS val 31688 ecr 253280,mptcp dss ack 116031389], length 0
17:03:39.977413 IP 112.26.3.1.targus-getdata1 > 112.26.3.8.33535: Flags [.], ack 222, win 4017, options [nop,nop,TS val 253499 ecr 31688,mptcp dss ack 2376860716], length 0
17:03:39.977769 IP 112.26.3.1.targus-getdata1 > 112.26.3.8.33535: Flags [.], ack 222, win 4017, options [nop,nop,TS val 253499 ecr 31688,mptcp dss ack 2376860716], length 0
17:03:40.019669 IP 112.26.3.1.targus-getdata1 > 112.26.3.8.33535: Flags [.], ack 222, win 4017, options [nop,nop,TS val 253499 ecr 31688,mptcp dss ack 2376860716], length 0

