17:00:33.034556 IP 112.26.0.8.36626 > 112.26.0.1.targus-getdata1: Flags [S], seq 2988296203, win 29200, options [mss 1460,sackOK,TS val 4294812145 ecr 0,nop,wscale 7,mptcp capable csum {0x8701148e479d40e2}], length 0
17:00:33.049700 IP 112.26.0.8.36626 > 112.26.0.1.targus-getdata1: Flags [S], seq 2988296203, win 29200, options [mss 1460,sackOK,TS val 4294812145 ecr 0,nop,wscale 7,mptcp capable csum {0x8701148e479d40e2}], length 0
17:00:33.061982 IP 112.26.0.8.36626 > 112.26.0.1.targus-getdata1: Flags [S], seq 2988296203, win 29200, options [mss 1460,sackOK,TS val 4294812145 ecr 0,nop,wscale 7,mptcp capable csum {0x8701148e479d40e2}], length 0
17:00:33.358343 IP 112.26.0.1.targus-getdata1 > 112.26.0.8.36626: Flags [S.], seq 2270931063, ack 2988296204, win 65535, options [mss 1460,sackOK,TS val 66611 ecr 4294812145,nop,wscale 6,mptcp capable csum {0xad3b304b2196ec90}], length 0
17:00:34.175306 IP 112.26.0.8.36626 > 112.26.0.1.targus-getdata1: Flags [.], ack 1, win 229, options [nop,nop,TS val 4294812496 ecr 66611,mptcp capable csum {0x8701148e479d40e2,0xad3b304b2196ec90},mptcp dss ack 116031157], length 0
17:00:34.198002 IP 112.26.0.8.36626 > 112.26.0.1.targus-getdata1: Flags [.], ack 1, win 229, options [nop,nop,TS val 4294812496 ecr 66611,mptcp add-addr id 4 112.26.2.8,mptcp dss ack 116031157], length 0
17:00:34.253039 IP 112.26.0.8.36626 > 112.26.0.1.targus-getdata1: Flags [.], ack 1, win 229, options [nop,nop,TS val 4294812496 ecr 66611,mptcp capable csum {0x8701148e479d40e2,0xad3b304b2196ec90},mptcp dss ack 116031157], length 0
17:01:09.164262 IP 112.26.0.1.targus-getdata1 > 112.26.0.8.36628: Flags [.], ack 1632788631, win 24558, options [nop,nop,TS val 102454 ecr 4294847051,nop,nop,sack 1 {1429:9997},mptcp dss ack 3983983791], length 0
17:01:09.164587 IP 112.26.0.1.targus-getdata1 > 112.26.0.8.36628: Flags [.], ack 1, win 24558, options [nop,nop,TS val 102454 ecr 4294847051,nop,nop,sack 1 {1429:9997},mptcp dss ack 3983983791], length 0
17:01:09.219666 IP 112.26.0.1.targus-getdata1 > 112.26.0.8.36628: Flags [.], ack 1, win 24558, options [nop,nop,TS val 102534 ecr 4294847051,nop,nop,sack 1 {1429:11425},mptcp dss ack 3983983791], length 0
17:01:09.219865 IP 112.26.0.1.targus-getdata1 > 112.26.0.8.36628: Flags [.], ack 1, win 24558, options [nop,nop,TS val 102534 ecr 4294847051,nop,nop,sack 1 {1429:11425},mptcp dss ack 3983983791], length 0
17:01:09.294519 IP 112.26.0.1.targus-getdata1 > 112.26.0.8.36628: Flags [.], ack 1, win 24558, options [nop,nop,TS val 102604 ecr 4294847051,nop,nop,sack 1 {1429:12853},mptcp dss ack 3983983791], length 0
17:01:26.540270 IP 112.26.0.1.targus-getdata1 > 112.26.0.8.36628: Flags [.], ack 301309, win 24494, options [nop,nop,TS val 120055 ecr 4294864084,nop,nop,sack 1 {302737:319873},mptcp dss ack 3984633531], length 0
17:01:26.540473 IP 112.26.0.1.targus-getdata1 > 112.26.0.8.36628: Flags [.], ack 301309, win 24494, options [nop,nop,TS val 120055 ecr 4294864084,nop,nop,sack 1 {302737:319873},mptcp dss ack 3984633531], length 0
17:01:26.546206 IP 112.26.0.8.36628 > 112.26.0.1.targus-getdata1: Flags [.], seq 325585:327013, ack 0, win 685, options [nop,nop,TS val 4294865653 ecr 119990,mptcp dss ack 1375043541 seq 3984739203 subseq 678338 len 1428 csum 0xdefb], length 1428
17:01:26.614547 IP 112.26.0.8.36628 > 112.26.0.1.targus-getdata1: Flags [.], seq 327013:328441, ack 0, win 685, options [nop,nop,TS val 4294865722 ecr 120055,mptcp dss ack 1375043541 seq 3984740631 subseq 679766 len 1428 csum 0x435], length 1428
17:01:26.648476 IP 112.26.0.1.targus-getdata1 > 112.26.0.8.36628: Flags [.], ack 319873, win 24153, options [nop,nop,TS val 120140 ecr 4294864941,mptcp dss ack 3984677799], length 0
17:01:26.648677 IP 112.26.0.1.targus-getdata1 > 112.26.0.8.36628: Flags [.], ack 319873, win 24153, options [nop,nop,TS val 120140 ecr 4294864941,mptcp dss ack 3984677799], length 0
17:01:26.657987 IP 112.26.0.8.36628 > 112.26.0.1.targus-getdata1: Flags [.], seq 328441:329869, ack 0, win 685, options [nop,nop,TS val 4294865790 ecr 120140,mptcp dss ack 1375043541 seq 3984747771 subseq 681194 len 1428 csum 0x6af5], length 1428
17:01:26.745494 IP 112.26.0.1.targus-getdata1 > 112.26.0.8.36628: Flags [.], ack 321301, win 24187, options [nop,nop,TS val 120230 ecr 4294865131,mptcp dss ack 3984677799], length 0
17:01:26.745663 IP 112.26.0.1.targus-getdata1 > 112.26.0.8.36628: Flags [.], ack 321301, win 24187, options [nop,nop,TS val 120230 ecr 4294865131,mptcp dss ack 3984677799], length 0
17:01:26.761156 IP 112.26.0.8.36628 > 112.26.0.1.targus-getdata1: Flags [.], seq 329869:331297, ack 0, win 685, options [nop,nop,TS val 4294865885 ecr 120230,mptcp dss ack 1375043541 seq 3984750627 subseq 682622 len 1428 csum 0x49ae], length 1428
17:01:26.840931 IP 112.26.0.1.targus-getdata1 > 112.26.0.8.36628: Flags [.], ack 322729, win 24187, options [nop,nop,TS val 120269 ecr 4294865293,mptcp dss ack 3984677799], length 0
17:01:26.841126 IP 112.26.0.1.targus-getdata1 > 112.26.0.8.36628: Flags [.], ack 322729, win 24187, options [nop,nop,TS val 120269 ecr 4294865293,mptcp dss ack 3984677799], length 0
17:01:26.855470 IP 112.26.0.8.36628 > 112.26.0.1.targus-getdata1: Flags [.], seq 331297:332725, ack 0, win 685, options [nop,nop,TS val 4294865981 ecr 120269,mptcp dss ack 1375043541 seq 3984753483 subseq 684050 len 1428 csum 0x5819], length 1428
17:01:26.875639 IP 112.26.0.1.targus-getdata1 > 112.26.0.8.36628: Flags [.], ack 324157, win 24187, options [nop,nop,TS val 120355 ecr 4294865351,mptcp dss ack 3984677799], length 0
17:01:26.875787 IP 112.26.0.1.targus-getdata1 > 112.26.0.8.36628: Flags [.], ack 324157, win 24187, options [nop,nop,TS val 120355 ecr 4294865351,mptcp dss ack 3984677799], length 0
17:01:26.890259 IP 112.26.0.8.36628 > 112.26.0.1.targus-getdata1: Flags [.], seq 332725:334153, ack 0, win 685, options [nop,nop,TS val 4294865981 ecr 120269,mptcp dss ack 1375043541 seq 3984754911 subseq 685478 len 1428 csum 0x3752], length 1428
17:01:26.961303 IP 112.26.0.8.36628 > 112.26.0.1.targus-getdata1: Flags [.], seq 334153:335581, ack 0, win 685, options [nop,nop,TS val 4294866063 ecr 120355,mptcp dss ack 1375043541 seq 3984757767 subseq 686906 len 1428 csum 0xe39e], length 1428
17:01:26.968796 IP 112.26.0.1.targus-getdata1 > 112.26.0.8.36628: Flags [.], ack 325585, win 24558, options [nop,nop,TS val 120408 ecr 4294865593,mptcp dss ack 3984734919], length 0
17:01:26.968953 IP 112.26.0.1.targus-getdata1 > 112.26.0.8.36628: Flags [.], ack 325585, win 24558, options [nop,nop,TS val 120408 ecr 4294865593,mptcp dss ack 3984734919], length 0
17:01:27.013450 IP 112.26.0.8.36628 > 112.26.0.1.targus-getdata1: Flags [.], seq 335581:337009, ack 0, win 685, options [nop,nop,TS val 4294866148 ecr 120408,mptcp dss ack 1375043541 seq 3984769191 subseq 688334 len 1428 csum 0x79f9], length 1428
17:01:27.053449 IP 112.26.0.1.targus-getdata1 > 112.26.0.8.36628: Flags [.], ack 327013, win 24558, options [nop,nop,TS val 120490 ecr 4294865653,mptcp dss ack 3984737775], length 0
17:01:27.053678 IP 112.26.0.1.targus-getdata1 > 112.26.0.8.36628: Flags [.], ack 327013, win 24558, options [nop,nop,TS val 120490 ecr 4294865653,mptcp dss ack 3984737775], length 0
17:01:27.082568 IP 112.26.0.1.targus-getdata1 > 112.26.0.8.36628: Flags [.], ack 328441, win 24540, options [nop,nop,TS val 120551 ecr 4294865722,mptcp dss ack 3984742059], length 0
17:01:27.082899 IP 112.26.0.1.targus-getdata1 > 112.26.0.8.36628: Flags [.], ack 328441, win 24540, options [nop,nop,TS val 120551 ecr 4294865722,mptcp dss ack 3984742059], length 0
17:01:27.094265 IP 112.26.0.8.36628 > 112.26.0.1.targus-getdata1: Flags [.], seq 337009:338437, ack 0, win 685, options [nop,nop,TS val 4294866230 ecr 120490,mptcp dss ack 1375043541 seq 3984774903 subseq 689762 len 1428 csum 0x5486], length 1428
17:01:27.153316 IP 112.26.0.1.targus-getdata1 > 112.26.0.8.36628: Flags [.], ack 329869, win 24558, options [nop,nop,TS val 120642 ecr 4294865790,mptcp dss ack 3984746343], length 0
17:01:27.153527 IP 112.26.0.1.targus-getdata1 > 112.26.0.8.36628: Flags [.], ack 329869, win 24558, options [nop,nop,TS val 120642 ecr 4294865790,mptcp dss ack 3984746343], length 0
17:01:27.178350 IP 112.26.0.8.36628 > 112.26.0.1.targus-getdata1: Flags [.], seq 338437:339865, ack 0, win 685, options [nop,nop,TS val 4294866313 ecr 120551,mptcp dss ack 1375043541 seq 3984777759 subseq 691190 len 1428 csum 0xf826], length 1428
17:01:27.226733 IP 112.26.0.8.36628 > 112.26.0.1.targus-getdata1: Flags [.], seq 339865:341293, ack 0, win 685, options [nop,nop,TS val 4294866363 ecr 120642,mptcp dss ack 1375043541 seq 3984779187 subseq 692618 len 1428 csum 0x4817], length 1428
17:01:27.275519 IP 112.26.0.1.targus-getdata1 > 112.26.0.8.36628: Flags [.], ack 331297, win 24576, options [nop,nop,TS val 120731 ecr 4294865885,mptcp dss ack 3984749199], length 0
17:01:27.275699 IP 112.26.0.1.targus-getdata1 > 112.26.0.8.36628: Flags [.], ack 331297, win 24576, options [nop,nop,TS val 120731 ecr 4294865885,mptcp dss ack 3984749199], length 0
17:01:27.318133 IP 112.26.0.8.36628 > 112.26.0.1.targus-getdata1: Flags [.], seq 341293:342721, ack 0, win 685, options [nop,nop,TS val 4294866421 ecr 120731,mptcp dss ack 1375043541 seq 3984787755 subseq 694046 len 1428 csum 0xdbdd], length 1428
17:01:27.338107 IP 112.26.0.1.targus-getdata1 > 112.26.0.8.36628: Flags [.], ack 332725, win 24576, options [nop,nop,TS val 120792 ecr 4294865981,mptcp dss ack 3984749199], length 0
17:01:27.338318 IP 112.26.0.1.targus-getdata1 > 112.26.0.8.36628: Flags [.], ack 332725, win 24576, options [nop,nop,TS val 120792 ecr 4294865981,mptcp dss ack 3984749199], length 0
17:01:27.381319 IP 112.26.0.8.36628 > 112.26.0.1.targus-getdata1: Flags [.], seq 342721:344149, ack 0, win 685, options [nop,nop,TS val 4294866483 ecr 120792,mptcp dss ack 1375043541 seq 3984790611 subseq 695474 len 1428 csum 0x2235], length 1428
17:01:27.444252 IP 112.26.0.1.targus-getdata1 > 112.26.0.8.36628: Flags [.], ack 334153, win 24532, options [nop,nop,TS val 120892 ecr 4294865981,mptcp dss ack 3984752055], length 0
17:01:27.444446 IP 112.26.0.1.targus-getdata1 > 112.26.0.8.36628: Flags [.], ack 334153, win 24532, options [nop,nop,TS val 120892 ecr 4294865981,mptcp dss ack 3984752055], length 0
17:01:27.463955 IP 112.26.0.8.36628 > 112.26.0.1.targus-getdata1: Flags [.], seq 344149:345577, ack 0, win 685, options [nop,nop,TS val 4294866584 ecr 120892,mptcp dss ack 1375043541 seq 3984793467 subseq 696902 len 1428 csum 0xdd5c], length 1428
17:01:27.491135 IP 112.26.0.1.targus-getdata1 > 112.26.0.8.36628: Flags [.], ack 335581, win 24543, options [nop,nop,TS val 120968 ecr 4294866063,mptcp dss ack 3984756339], length 0
17:01:27.491298 IP 112.26.0.1.targus-getdata1 > 112.26.0.8.36628: Flags [.], ack 335581, win 24543, options [nop,nop,TS val 120968 ecr 4294866063,mptcp dss ack 3984756339], length 0
17:01:27.502319 IP 112.26.0.8.36628 > 112.26.0.1.targus-getdata1: Flags [.], seq 345577:347005, ack 0, win 685, options [nop,nop,TS val 4294866584 ecr 120892,mptcp dss ack 1375043541 seq 3984794895 subseq 698330 len 1428 csum 0xd745], length 1428
17:01:27.582222 IP 112.26.0.8.36628 > 112.26.0.1.targus-getdata1: Flags [.], seq 347005:348433, ack 0, win 685, options [nop,nop,TS val 4294866638 ecr 120968,mptcp dss ack 1375043541 seq 3984796323 subseq 699758 len 1428 csum 0x5f9e], length 1428
17:01:27.588915 IP 112.26.0.1.targus-getdata1 > 112.26.0.8.36628: Flags [.], ack 337009, win 24543, options [nop,nop,TS val 121068 ecr 4294866148,mptcp dss ack 3984756339], length 0
17:01:27.589114 IP 112.26.0.1.targus-getdata1 > 112.26.0.8.36628: Flags [.], ack 337009, win 24543, options [nop,nop,TS val 121068 ecr 4294866148,mptcp dss ack 3984756339], length 0
17:01:27.628419 IP 112.26.0.8.36628 > 112.26.0.1.targus-getdata1: Flags [.], seq 348433:349861, ack 0, win 685, options [nop,nop,TS val 4294866732 ecr 121068,mptcp dss ack 1375043541 seq 3984800607 subseq 701186 len 1428 csum 0xf8a8], length 1428
17:01:27.663189 IP 112.26.0.1.targus-getdata1 > 112.26.0.8.36628: Flags [.], ack 338437, win 24540, options [nop,nop,TS val 121154 ecr 4294866230,mptcp dss ack 3984764907], length 0
17:01:27.663386 IP 112.26.0.1.targus-getdata1 > 112.26.0.8.36628: Flags [.], ack 338437, win 24540, options [nop,nop,TS val 121154 ecr 4294866230,mptcp dss ack 3984764907], length 0
17:01:27.746675 IP 112.26.0.8.36628 > 112.26.0.1.targus-getdata1: Flags [.], seq 349861:351289, ack 0, win 685, options [nop,nop,TS val 4294866803 ecr 121154,mptcp dss ack 1375043541 seq 3984804891 subseq 702614 len 1428 csum 0x6e2f], length 1428
17:01:27.759033 IP 112.26.0.1.targus-getdata1 > 112.26.0.8.36628: Flags [.], ack 339865, win 24540, options [nop,nop,TS val 121241 ecr 4294866313,mptcp dss ack 3984764907], length 0
17:01:27.759234 IP 112.26.0.1.targus-getdata1 > 112.26.0.8.36628: Flags [.], ack 339865, win 24540, options [nop,nop,TS val 121241 ecr 4294866313,mptcp dss ack 3984764907], length 0
17:01:27.801005 IP 112.26.0.8.36628 > 112.26.0.1.targus-getdata1: Flags [.], seq 351289:352717, ack 0, win 685, options [nop,nop,TS val 4294866899 ecr 121241,mptcp dss ack 1375043541 seq 3984807747 subseq 704042 len 1428 csum 0x7101], length 1428
17:01:27.846307 IP 112.26.0.1.targus-getdata1 > 112.26.0.8.36628: Flags [.], ack 341293, win 24518, options [nop,nop,TS val 121295 ecr 4294866363,mptcp dss ack 3984766335], length 0
17:01:27.846503 IP 112.26.0.1.targus-getdata1 > 112.26.0.8.36628: Flags [.], ack 341293, win 24518, options [nop,nop,TS val 121295 ecr 4294866363,mptcp dss ack 3984766335], length 0
17:01:27.852957 IP 112.26.0.8.36628 > 112.26.0.1.targus-getdata1: Flags [.], seq 352717:354145, ack 0, win 685, options [nop,nop,TS val 4294866988 ecr 121295,mptcp dss ack 1375043541 seq 3984813459 subseq 705470 len 1428 csum 0x46dc], length 1428
17:01:27.913014 IP 112.26.0.1.targus-getdata1 > 112.26.0.8.36628: Flags [.], ack 342721, win 24496, options [nop,nop,TS val 121417 ecr 4294866421,mptcp dss ack 3984767763], length 0
17:01:27.913211 IP 112.26.0.1.targus-getdata1 > 112.26.0.8.36628: Flags [.], ack 342721, win 24496, options [nop,nop,TS val 121417 ecr 4294866421,mptcp dss ack 3984767763], length 0
17:01:27.927070 IP 112.26.0.8.36628 > 112.26.0.1.targus-getdata1: Flags [.], seq 354145:355573, ack 0, win 685, options [nop,nop,TS val 4294867061 ecr 121417,mptcp dss ack 1375043541 seq 3984817743 subseq 706898 len 1428 csum 0xeba2], length 1428
17:01:28.003380 IP 112.26.0.1.targus-getdata1 > 112.26.0.8.36628: Flags [.], ack 344149, win 24469, options [nop,nop,TS val 121546 ecr 4294866483,mptcp dss ack 3984773475], length 0
17:01:28.003589 IP 112.26.0.1.targus-getdata1 > 112.26.0.8.36628: Flags [.], ack 344149, win 24469, options [nop,nop,TS val 121546 ecr 4294866483,mptcp dss ack 3984773475], length 0
17:01:28.006899 IP 112.26.0.8.36628 > 112.26.0.1.targus-getdata1: Flags [.], seq 355573:357001, ack 0, win 685, options [nop,nop,TS val 4294867143 ecr 121546,mptcp dss ack 1375043541 seq 3984819171 subseq 708326 len 1428 csum 0x52e5], length 1428
17:01:28.089265 IP 112.26.0.1.targus-getdata1 > 112.26.0.8.36628: Flags [.], ack 345577, win 24469, options [nop,nop,TS val 121605 ecr 4294866584,mptcp dss ack 3984773475], length 0
17:01:28.089594 IP 112.26.0.1.targus-getdata1 > 112.26.0.8.36628: Flags [.], ack 345577, win 24469, options [nop,nop,TS val 121605 ecr 4294866584,mptcp dss ack 3984773475], length 0
17:01:28.095446 IP 112.26.0.8.36628 > 112.26.0.1.targus-getdata1: Flags [.], seq 357001:358429, ack 0, win 685, options [nop,nop,TS val 4294867229 ecr 121605,mptcp dss ack 1375043541 seq 3984826311 subseq 709754 len 1428 csum 0xcf3c], length 1428
17:01:28.182269 IP 112.26.0.1.targus-getdata1 > 112.26.0.8.36628: Flags [.], ack 347005, win 24469, options [nop,nop,TS val 121718 ecr 4294866584,mptcp dss ack 3984773475], length 0
17:01:28.182441 IP 112.26.0.1.targus-getdata1 > 112.26.0.8.36628: Flags [.], ack 347005, win 24469, options [nop,nop,TS val 121718 ecr 4294866584,mptcp dss ack 3984773475], length 0
17:01:28.189968 IP 112.26.0.8.36628 > 112.26.0.1.targus-getdata1: Flags [.], seq 358429:359857, ack 0, win 685, options [nop,nop,TS val 4294867322 ecr 121718,mptcp dss ack 1375043541 seq 3984827739 subseq 711182 len 1428 csum 0x999e], length 1428
17:01:28.461322 IP 112.26.0.1.targus-getdata1 > 112.26.0.8.36628: Flags [.], ack 348433, win 24469, options [nop,nop,TS val 121790 ecr 4294866638,mptcp dss ack 3984773475], length 0
17:01:28.461518 IP 112.26.0.1.targus-getdata1 > 112.26.0.8.36628: Flags [.], ack 348433, win 24469, options [nop,nop,TS val 121790 ecr 4294866638,mptcp dss ack 3984773475], length 0
17:01:28.479026 IP 112.26.0.8.36628 > 112.26.0.1.targus-getdata1: Flags [.], seq 359857:361285, ack 0, win 685, options [nop,nop,TS val 4294867601 ecr 121790,mptcp dss ack 1375043541 seq 3984836307 subseq 712610 len 1428 csum 0xba6e], length 1428
17:01:28.524773 IP 112.26.0.1.targus-getdata1 > 112.26.0.8.36628: Flags [.], ack 349861, win 24469, options [nop,nop,TS val 121871 ecr 4294866732,mptcp dss ack 3984773475], length 0
17:01:28.524989 IP 112.26.0.1.targus-getdata1 > 112.26.0.8.36628: Flags [.], ack 349861, win 24469, options [nop,nop,TS val 121871 ecr 4294866732,mptcp dss ack 3984773475], length 0
17:01:28.600210 IP 112.26.0.8.36628 > 112.26.0.1.targus-getdata1: Flags [.], seq 361285:362713, ack 0, win 685, options [nop,nop,TS val 4294867665 ecr 121871,mptcp dss ack 1375043541 seq 3984837735 subseq 714038 len 1428 csum 0xe447], length 1428
17:01:28.622199 IP 112.26.0.1.targus-getdata1 > 112.26.0.8.36628: Flags [.], ack 351289, win 24469, options [nop,nop,TS val 122058 ecr 4294866803,mptcp dss ack 3984773475], length 0
17:01:28.622370 IP 112.26.0.1.targus-getdata1 > 112.26.0.8.36628: Flags [.], ack 351289, win 24469, options [nop,nop,TS val 122058 ecr 4294866803,mptcp dss ack 3984773475], length 0
17:01:28.656893 IP 112.26.0.8.36628 > 112.26.0.1.targus-getdata1: Flags [.], seq 362713:364141, ack 0, win 685, options [nop,nop,TS val 4294867767 ecr 122058,mptcp dss ack 1375043541 seq 3984839163 subseq 715466 len 1428 csum 0x2a88], length 1428
17:01:28.778921 IP 112.26.0.1.targus-getdata1 > 112.26.0.8.36628: Flags [.], ack 352717, win 24469, options [nop,nop,TS val 122158 ecr 4294866899,mptcp dss ack 3984773475], length 0
17:01:28.779116 IP 112.26.0.1.targus-getdata1 > 112.26.0.8.36628: Flags [.], ack 352717, win 24469, options [nop,nop,TS val 122158 ecr 4294866899,mptcp dss ack 3984773475], length 0
17:01:28.794700 IP 112.26.0.8.36628 > 112.26.0.1.targus-getdata1: Flags [.], seq 364141:365569, ack 0, win 685, options [nop,nop,TS val 4294867918 ecr 122158,mptcp dss ack 1375043541 seq 3984856299 subseq 716894 len 1428 csum 0x26d1], length 1428
17:01:28.863912 IP 112.26.0.1.targus-getdata1 > 112.26.0.8.36628: Flags [.], ack 354145, win 24469, options [nop,nop,TS val 122242 ecr 4294866988,mptcp dss ack 3984773475], length 0
17:01:28.864110 IP 112.26.0.1.targus-getdata1 > 112.26.0.8.36628: Flags [.], ack 354145, win 24469, options [nop,nop,TS val 122242 ecr 4294866988,mptcp dss ack 3984773475], length 0
17:01:28.866735 IP 112.26.0.8.36628 > 112.26.0.1.targus-getdata1: Flags [.], seq 365569:366997, ack 0, win 685, options [nop,nop,TS val 4294868003 ecr 122242,mptcp dss ack 1375043541 seq 3984859155 subseq 718322 len 1428 csum 0xef56], length 1428
17:01:28.978584 IP 112.26.0.1.targus-getdata1 > 112.26.0.8.36628: Flags [.], ack 354145, win 24469, options [nop,nop,TS val 122268 ecr 4294866988,nop,nop,sack 1 {355573:357001},mptcp dss ack 3984773475], length 0
17:01:28.978803 IP 112.26.0.1.targus-getdata1 > 112.26.0.8.36628: Flags [.], ack 354145, win 24469, options [nop,nop,TS val 122268 ecr 4294866988,nop,nop,sack 1 {355573:357001},mptcp dss ack 3984773475], length 0
17:01:29.021165 IP 112.26.0.8.36628 > 112.26.0.1.targus-getdata1: Flags [.], seq 366997:368425, ack 0, win 685, options [nop,nop,TS val 4294868155 ecr 122268,mptcp dss ack 1375043541 seq 3984860583 subseq 719750 len 1428 csum 0x7dee], length 1428
17:01:29.034997 IP 112.26.0.1.targus-getdata1 > 112.26.0.8.36628: Flags [.], ack 354145, win 24469, options [nop,nop,TS val 122340 ecr 4294866988,nop,nop,sack 1 {355573:358429},mptcp dss ack 3984773475], length 0
17:01:29.035203 IP 112.26.0.1.targus-getdata1 > 112.26.0.8.36628: Flags [.], ack 354145, win 24469, options [nop,nop,TS val 122340 ecr 4294866988,nop,nop,sack 1 {355573:358429},mptcp dss ack 3984773475], length 0
17:01:29.099971 IP 112.26.0.1.targus-getdata1 > 112.26.0.8.36628: Flags [.], ack 354145, win 24469, options [nop,nop,TS val 122418 ecr 4294866988,nop,nop,sack 1 {355573:359857},mptcp dss ack 3984773475], length 0
17:01:29.100300 IP 112.26.0.1.targus-getdata1 > 112.26.0.8.36628: Flags [.], ack 354145, win 24469, options [nop,nop,TS val 122418 ecr 4294866988,nop,nop,sack 1 {355573:359857},mptcp dss ack 3984773475], length 0
17:01:29.105618 IP 112.26.0.8.36628 > 112.26.0.1.targus-getdata1: Flags [.], seq 368425:369853, ack 0, win 685, options [nop,nop,TS val 4294868240 ecr 122340,mptcp dss ack 1375043541 seq 3984863439 subseq 721178 len 1428 csum 0xa6b8], length 1428
17:01:29.142987 IP 112.26.0.8.36628 > 112.26.0.1.targus-getdata1: Flags [.], seq 354145:355573, ack 0, win 685, options [nop,nop,TS val 4294868240 ecr 122418,mptcp dss ack 1375043541 seq 3984817743 subseq 706898 len 1428 csum 0xeba2], length 1428
17:01:29.168224 IP 112.26.0.1.targus-getdata1 > 112.26.0.8.36628: Flags [.], ack 354145, win 24469, options [nop,nop,TS val 122489 ecr 4294866988,nop,nop,sack 1 {355573:361285},mptcp dss ack 3984773475], length 0
17:01:29.168397 IP 112.26.0.1.targus-getdata1 > 112.26.0.8.36628: Flags [.], ack 354145, win 24469, options [nop,nop,TS val 122489 ecr 4294866988,nop,nop,sack 1 {355573:361285},mptcp dss ack 3984773475], length 0
17:01:29.238332 IP 112.26.0.1.targus-getdata1 > 112.26.0.8.36628: Flags [.], ack 354145, win 24469, options [nop,nop,TS val 122557 ecr 4294866988,nop,nop,sack 1 {355573:362713},mptcp dss ack 3984773475], length 0
17:01:29.238526 IP 112.26.0.1.targus-getdata1 > 112.26.0.8.36628: Flags [.], ack 354145, win 24469, options [nop,nop,TS val 122557 ecr 4294866988,nop,nop,sack 1 {355573:362713},mptcp dss ack 3984773475], length 0
17:01:29.242101 IP 112.26.0.1.targus-getdata1 > 112.26.0.8.36628: Flags [.], ack 354145, win 24469, options [nop,nop,TS val 122634 ecr 4294866988,nop,nop,sack 1 {355573:364141},mptcp dss ack 3984773475], length 0
17:01:29.247401 IP 112.26.0.8.36628 > 112.26.0.1.targus-getdata1: Flags [.], seq 369853:371281, ack 0, win 685, options [nop,nop,TS val 4294868374 ecr 122489,mptcp dss ack 1375043541 seq 3984869151 subseq 722606 len 1428 csum 0x9ac8], length 1428
17:01:29.498872 IP 112.26.0.1.targus-getdata1 > 112.26.0.8.36628: Flags [.], ack 354145, win 24469, options [nop,nop,TS val 122885 ecr 4294866988,nop,nop,sack 1 {355573:365569},mptcp dss ack 3984773475], length 0
17:01:29.558099 IP 112.26.0.1.targus-getdata1 > 112.26.0.8.36628: Flags [.], ack 354145, win 24469, options [nop,nop,TS val 122936 ecr 4294866988,nop,nop,sack 1 {355573:366997},mptcp dss ack 3984773475], length 0
17:01:29.560951 IP 112.26.0.8.36628 > 112.26.0.1.targus-getdata1: Flags [P.], seq 371281:372709, ack 0, win 685, options [nop,nop,TS val 4294868696 ecr 122885,mptcp dss ack 1375043541 seq 3984873435 subseq 724034 len 1428 csum 0x205b], length 1428
17:01:29.612395 IP 112.26.0.8.36628 > 112.26.0.1.targus-getdata1: Flags [.], seq 372709:374137, ack 0, win 685, options [nop,nop,TS val 4294868708 ecr 122936,mptcp dss ack 1375043541 seq 3984874863 subseq 725462 len 1428 csum 0x1e7e], length 1428
17:01:29.873586 IP 112.26.0.1.targus-getdata1 > 112.26.0.8.36628: Flags [.], ack 354145, win 24469, options [nop,nop,TS val 123145 ecr 4294866988,nop,nop,sack 1 {355573:368425},mptcp dss ack 3984773475], length 0
17:01:29.913927 IP 112.26.0.1.targus-getdata1 > 112.26.0.8.36628: Flags [.], ack 354145, win 24469, options [nop,nop,TS val 123205 ecr 4294866988,nop,nop,sack 1 {355573:369853},mptcp dss ack 3984773475], length 0
17:01:29.916270 IP 112.26.0.8.36628 > 112.26.0.1.targus-getdata1: Flags [.], seq 374137:375565, ack 0, win 685, options [nop,nop,TS val 4294869052 ecr 123145,mptcp dss ack 1375043541 seq 3984880575 subseq 726890 len 1428 csum 0x4146], length 1428
17:01:29.990949 IP 112.26.0.8.36628 > 112.26.0.1.targus-getdata1: Flags [.], seq 375565:376993, ack 0, win 685, options [nop,nop,TS val 4294869065 ecr 123205,mptcp dss ack 1375043541 seq 3984882003 subseq 728318 len 1428 csum 0x1f4d], length 1428
17:01:30.052409 IP 112.26.0.1.targus-getdata1 > 112.26.0.8.36628: Flags [.], ack 369853, win 24469, options [nop,nop,TS val 123258 ecr 4294868240,mptcp dss ack 3984773475], length 0
17:01:30.057766 IP 112.26.0.8.36628 > 112.26.0.1.targus-getdata1: Flags [.], seq 376993:378421, ack 0, win 685, options [nop,nop,TS val 4294869191 ecr 123258,mptcp dss ack 1375043541 seq 3984890571 subseq 729746 len 1428 csum 0xeb48], length 1428
17:01:30.166777 IP 112.26.0.1.targus-getdata1 > 112.26.0.8.36628: Flags [.], ack 374137, win 24469, options [nop,nop,TS val 123703 ecr 4294868708,mptcp dss ack 3984773475], length 0
17:01:30.167001 IP 112.26.0.1.targus-getdata1 > 112.26.0.8.36628: Flags [.], ack 374137, win 24469, options [nop,nop,TS val 123703 ecr 4294868708,mptcp dss ack 3984773475], length 0
17:01:30.177197 IP 112.26.0.8.36628 > 112.26.0.1.targus-getdata1: Flags [.], seq 378421:379849, ack 0, win 685, options [nop,nop,TS val 4294869307 ecr 123703,mptcp dss ack 1375043541 seq 3984891999 subseq 731174 len 1428 csum 0x5c2d], length 1428
17:01:30.238842 IP 112.26.0.8.36628 > 112.26.0.1.targus-getdata1: Flags [.], seq 379849:381277, ack 0, win 685, options [nop,nop,TS val 4294869307 ecr 123703,mptcp dss ack 1375043541 seq 3984893427 subseq 732602 len 1428 csum 0xf3e0], length 1428
17:01:30.287478 IP 112.26.0.1.targus-getdata1 > 112.26.0.8.36628: Flags [.], ack 371281, win 24469, options [nop,nop,TS val 123327 ecr 4294868374,mptcp dss ack 3984773475], length 0
17:01:30.312451 IP 112.26.0.8.36628 > 112.26.0.1.targus-getdata1: Flags [.], seq 381277:382705, ack 0, win 685, options [nop,nop,TS val 4294869307 ecr 123703,mptcp dss ack 1375043541 seq 3984894855 subseq 734030 len 1428 csum 0x91c8], length 1428
17:01:30.349453 IP 112.26.0.1.targus-getdata1 > 112.26.0.8.36628: Flags [.], ack 375565, win 24469, options [nop,nop,TS val 123886 ecr 4294869052,mptcp dss ack 3984773475], length 0
17:01:30.349646 IP 112.26.0.1.targus-getdata1 > 112.26.0.8.36628: Flags [.], ack 375565, win 24469, options [nop,nop,TS val 123886 ecr 4294869052,mptcp dss ack 3984773475], length 0
17:01:30.398036 IP 112.26.0.8.36628 > 112.26.0.1.targus-getdata1: Flags [.], seq 382705:384133, ack 0, win 685, options [nop,nop,TS val 4294869307 ecr 123703,mptcp dss ack 1375043541 seq 3984896283 subseq 735458 len 1428 csum 0xda16], length 1428
17:01:30.416124 IP 112.26.0.1.targus-getdata1 > 112.26.0.8.36628: Flags [.], ack 376993, win 24469, options [nop,nop,TS val 123936 ecr 4294869065,mptcp dss ack 3984773475], length 0
17:01:30.416294 IP 112.26.0.1.targus-getdata1 > 112.26.0.8.36628: Flags [.], ack 376993, win 24469, options [nop,nop,TS val 123936 ecr 4294869065,mptcp dss ack 3984773475], length 0
17:01:30.469663 IP 112.26.0.8.36628 > 112.26.0.1.targus-getdata1: Flags [.], ack 0, win 685, options [nop,nop,TS val 4294869425 ecr 123703,mptcp dss ack 1375043541], length 0
17:01:30.477709 IP 112.26.0.1.targus-getdata1 > 112.26.0.8.36628: Flags [.], ack 372709, win 24469, options [nop,nop,TS val 123543 ecr 4294868696,mptcp dss ack 3984773475], length 0
17:01:30.517493 IP 112.26.0.1.targus-getdata1 > 112.26.0.8.36628: Flags [.], ack 378421, win 24469, options [nop,nop,TS val 124060 ecr 4294869191,mptcp dss ack 3984773475], length 0
17:01:30.517670 IP 112.26.0.1.targus-getdata1 > 112.26.0.8.36628: Flags [.], ack 378421, win 24469, options [nop,nop,TS val 124060 ecr 4294869191,mptcp dss ack 3984773475], length 0
17:01:30.549433 IP 112.26.0.8.36628 > 112.26.0.1.targus-getdata1: Flags [.], seq 384133:385561, ack 0, win 685, options [nop,nop,TS val 4294869489 ecr 123886,mptcp dss ack 1375043541 seq 3984900567 subseq 736886 len 1428 csum 0xdcc], length 1428
17:01:30.599710 IP 112.26.0.1.targus-getdata1 > 112.26.0.8.36628: Flags [.], ack 379849, win 24469, options [nop,nop,TS val 124111 ecr 4294869307,mptcp dss ack 3984773475], length 0
17:01:30.599924 IP 112.26.0.1.targus-getdata1 > 112.26.0.8.36628: Flags [.], ack 379849, win 24469, options [nop,nop,TS val 124111 ecr 4294869307,mptcp dss ack 3984773475], length 0
17:01:30.631506 IP 112.26.0.8.36628 > 112.26.0.1.targus-getdata1: Flags [.], seq 385561:386989, ack 0, win 685, options [nop,nop,TS val 4294869557 ecr 123936,mptcp dss ack 1375043541 seq 3984903423 subseq 738314 len 1428 csum 0x1590], length 1428
17:01:30.659528 IP 112.26.0.8.36628 > 112.26.0.1.targus-getdata1: Flags [.], seq 386989:388417, ack 0, win 685, options [nop,nop,TS val 4294869557 ecr 123936,mptcp dss ack 1375043541 seq 3984904851 subseq 739742 len 1428 csum 0x2588], length 1428
17:01:30.663964 IP 112.26.0.1.targus-getdata1 > 112.26.0.8.36628: Flags [.], ack 381277, win 24469, options [nop,nop,TS val 124181 ecr 4294869307,mptcp dss ack 3984773475], length 0
17:01:30.664138 IP 112.26.0.1.targus-getdata1 > 112.26.0.8.36628: Flags [.], ack 381277, win 24469, options [nop,nop,TS val 124181 ecr 4294869307,mptcp dss ack 3984773475], length 0
17:01:30.720137 IP 112.26.0.8.36628 > 112.26.0.1.targus-getdata1: Flags [.], seq 388417:389845, ack 0, win 685, options [nop,nop,TS val 4294869657 ecr 124060,mptcp dss ack 1375043541 seq 3984906279 subseq 741170 len 1428 csum 0x39a9], length 1428
17:01:30.757153 IP 112.26.0.1.targus-getdata1 > 112.26.0.8.36628: Flags [.], ack 382705, win 24469, options [nop,nop,TS val 124266 ecr 4294869307,mptcp dss ack 3984773475], length 0
17:01:30.757306 IP 112.26.0.1.targus-getdata1 > 112.26.0.8.36628: Flags [.], ack 382705, win 24469, options [nop,nop,TS val 124266 ecr 4294869307,mptcp dss ack 3984773475], length 0
17:01:30.766028 IP 112.26.0.8.36628 > 112.26.0.1.targus-getdata1: Flags [.], seq 389845:391273, ack 0, win 685, options [nop,nop,TS val 4294869744 ecr 124111,mptcp dss ack 1375043541 seq 3984909135 subseq 742598 len 1428 csum 0x30d3], length 1428
17:01:30.801956 IP 112.26.0.1.targus-getdata1 > 112.26.0.8.36628: Flags [.], ack 384133, win 24469, options [nop,nop,TS val 124341 ecr 4294869307,mptcp dss ack 3984773475], length 0
17:01:30.802155 IP 112.26.0.1.targus-getdata1 > 112.26.0.8.36628: Flags [.], ack 384133, win 24469, options [nop,nop,TS val 124341 ecr 4294869307,mptcp dss ack 3984773475], length 0
17:01:30.859636 IP 112.26.0.8.36628 > 112.26.0.1.targus-getdata1: Flags [.], seq 391273:392701, ack 0, win 685, options [nop,nop,TS val 4294869827 ecr 124181,mptcp dss ack 1375043541 seq 3984913419 subseq 744026 len 1428 csum 0x9a60], length 1428
17:01:30.877795 IP 112.26.0.1.targus-getdata1 > 112.26.0.8.36628: Flags [.], ack 385561, win 24469, options [nop,nop,TS val 124420 ecr 4294869489,mptcp dss ack 3984773475], length 0
17:01:30.877992 IP 112.26.0.1.targus-getdata1 > 112.26.0.8.36628: Flags [.], ack 385561, win 24469, options [nop,nop,TS val 124420 ecr 4294869489,mptcp dss ack 3984773475], length 0
17:01:30.910210 IP 112.26.0.8.36628 > 112.26.0.1.targus-getdata1: Flags [.], seq 392701:394129, ack 0, win 685, options [nop,nop,TS val 4294869896 ecr 124266,mptcp dss ack 1375043541 seq 3984916275 subseq 745454 len 1428 csum 0x557d], length 1428
17:01:30.959788 IP 112.26.0.8.36628 > 112.26.0.1.targus-getdata1: Flags [.], seq 394129:395557, ack 0, win 685, options [nop,nop,TS val 4294869941 ecr 124341,mptcp dss ack 1375043541 seq 3984919131 subseq 746882 len 1428 csum 0xcc75], length 1428
17:01:30.977760 IP 112.26.0.1.targus-getdata1 > 112.26.0.8.36628: Flags [.], ack 386989, win 24469, options [nop,nop,TS val 124500 ecr 4294869557,mptcp dss ack 3984773475], length 0
17:01:30.977981 IP 112.26.0.1.targus-getdata1 > 112.26.0.8.36628: Flags [.], ack 386989, win 24469, options [nop,nop,TS val 124500 ecr 4294869557,mptcp dss ack 3984773475], length 0
17:01:31.048957 IP 112.26.0.8.36628 > 112.26.0.1.targus-getdata1: Flags [.], seq 395557:396985, ack 0, win 685, options [nop,nop,TS val 4294870017 ecr 124420,mptcp dss ack 1375043541 seq 3984921987 subseq 748310 len 1428 csum 0xb559], length 1428
17:01:31.057285 IP 112.26.0.1.targus-getdata1 > 112.26.0.8.36628: Flags [.], ack 388417, win 24469, options [nop,nop,TS val 124580 ecr 4294869557,mptcp dss ack 3984773475], length 0
17:01:31.057536 IP 112.26.0.1.targus-getdata1 > 112.26.0.8.36628: Flags [.], ack 388417, win 24469, options [nop,nop,TS val 124580 ecr 4294869557,mptcp dss ack 3984773475], length 0
17:01:31.139998 IP 112.26.0.1.targus-getdata1 > 112.26.0.8.36628: Flags [.], ack 389845, win 24469, options [nop,nop,TS val 124670 ecr 4294869657,mptcp dss ack 3984773475], length 0
17:01:31.140215 IP 112.26.0.1.targus-getdata1 > 112.26.0.8.36628: Flags [.], ack 389845, win 24469, options [nop,nop,TS val 124670 ecr 4294869657,mptcp dss ack 3984773475], length 0
17:01:31.150874 IP 112.26.0.8.36628 > 112.26.0.1.targus-getdata1: Flags [.], seq 396985:398413, ack 0, win 685, options [nop,nop,TS val 4294870121 ecr 124500,mptcp dss ack 1375043541 seq 3984924843 subseq 749738 len 1428 csum 0x7d63], length 1428
17:01:31.190327 IP 112.26.0.8.36628 > 112.26.0.1.targus-getdata1: Flags [.], seq 398413:399841, ack 0, win 685, options [nop,nop,TS val 4294870200 ecr 124580,mptcp dss ack 1375043541 seq 3984927699 subseq 751166 len 1428 csum 0x7215], length 1428
17:01:31.248585 IP 112.26.0.1.targus-getdata1 > 112.26.0.8.36628: Flags [.], ack 391273, win 24469, options [nop,nop,TS val 124739 ecr 4294869744,mptcp dss ack 3984773475], length 0
17:01:31.248756 IP 112.26.0.1.targus-getdata1 > 112.26.0.8.36628: Flags [.], ack 391273, win 24469, options [nop,nop,TS val 124739 ecr 4294869744,mptcp dss ack 3984773475], length 0
17:01:31.256498 IP 112.26.0.8.36628 > 112.26.0.1.targus-getdata1: Flags [.], seq 399841:401269, ack 0, win 685, options [nop,nop,TS val 4294870200 ecr 124580,mptcp dss ack 1375043541 seq 3984929127 subseq 752594 len 1428 csum 0x9e39], length 1428
17:01:31.308254 IP 112.26.0.8.36628 > 112.26.0.1.targus-getdata1: Flags [.], seq 401269:402697, ack 0, win 685, options [nop,nop,TS val 4294870279 ecr 124670,mptcp dss ack 1375043541 seq 3984931983 subseq 754022 len 1428 csum 0x1986], length 1428
17:01:31.339256 IP 112.26.0.1.targus-getdata1 > 112.26.0.8.36628: Flags [.], ack 392701, win 24043, options [nop,nop,TS val 124879 ecr 4294869827,mptcp dss ack 3984820599], length 0
17:01:31.339431 IP 112.26.0.1.targus-getdata1 > 112.26.0.8.36628: Flags [.], ack 392701, win 24043, options [nop,nop,TS val 124879 ecr 4294869827,mptcp dss ack 3984820599], length 0
17:01:31.373930 IP 112.26.0.8.36628 > 112.26.0.1.targus-getdata1: Flags [.], seq 402697:404125, ack 0, win 685, options [nop,nop,TS val 4294870391 ecr 124739,mptcp dss ack 1375043541 seq 3984936267 subseq 755450 len 1428 csum 0x19ea], length 1428
17:01:31.405113 IP 112.26.0.1.targus-getdata1 > 112.26.0.8.36628: Flags [.], ack 395557, win 24043, options [nop,nop,TS val 124950 ecr 4294869896,mptcp dss ack 3984820599], length 0
17:01:31.405279 IP 112.26.0.1.targus-getdata1 > 112.26.0.8.36628: Flags [.], ack 395557, win 24043, options [nop,nop,TS val 124950 ecr 4294869896,mptcp dss ack 3984820599], length 0
17:01:31.472263 IP 112.26.0.8.36628 > 112.26.0.1.targus-getdata1: Flags [.], seq 404125:405553, ack 0, win 685, options [nop,nop,TS val 4294870481 ecr 124879,mptcp dss ack 1375043541 seq 3984937695 subseq 756878 len 1428 csum 0x9842], length 1428
17:01:31.506525 IP 112.26.0.8.36628 > 112.26.0.1.targus-getdata1: Flags [.], seq 405553:406981, ack 0, win 685, options [nop,nop,TS val 4294870549 ecr 124950,mptcp dss ack 1375043541 seq 3984941979 subseq 758306 len 1428 csum 0x4c48], length 1428
17:01:31.552320 IP 112.26.0.1.targus-getdata1 > 112.26.0.8.36628: Flags [.], ack 398413, win 24043, options [nop,nop,TS val 125083 ecr 4294870017,mptcp dss ack 3984820599], length 0
17:01:31.552563 IP 112.26.0.1.targus-getdata1 > 112.26.0.8.36628: Flags [.], ack 398413, win 24043, options [nop,nop,TS val 125083 ecr 4294870017,mptcp dss ack 3984820599], length 0
17:01:31.590946 IP 112.26.0.8.36628 > 112.26.0.1.targus-getdata1: Flags [.], seq 406981:408409, ack 0, win 685, options [nop,nop,TS val 4294870549 ecr 124950,mptcp dss ack 1375043541 seq 3984943407 subseq 759734 len 1428 csum 0xfd64], length 1428
17:01:31.641857 IP 112.26.0.8.36628 > 112.26.0.1.targus-getdata1: Flags [.], seq 408409:409837, ack 0, win 685, options [nop,nop,TS val 4294870692 ecr 125083,mptcp dss ack 1375043541 seq 3984947691 subseq 761162 len 1428 csum 0xba37], length 1428
17:01:31.662764 IP 112.26.0.1.targus-getdata1 > 112.26.0.8.36628: Flags [.], ack 401269, win 23867, options [nop,nop,TS val 125195 ecr 4294870200,mptcp dss ack 3984846303], length 0
17:01:31.663042 IP 112.26.0.1.targus-getdata1 > 112.26.0.8.36628: Flags [.], ack 401269, win 23867, options [nop,nop,TS val 125195 ecr 4294870200,mptcp dss ack 3984846303], length 0
17:01:31.717165 IP 112.26.0.8.36628 > 112.26.0.1.targus-getdata1: Flags [.], seq 409837:411265, ack 0, win 685, options [nop,nop,TS val 4294870692 ecr 125083,mptcp dss ack 1375043541 seq 3984949119 subseq 762590 len 1428 csum 0x59fd], length 1428
17:01:31.774410 IP 112.26.0.1.targus-getdata1 > 112.26.0.8.36628: Flags [.], ack 402697, win 23867, options [nop,nop,TS val 125306 ecr 4294870279,mptcp dss ack 3984846303], length 0
17:01:31.774663 IP 112.26.0.1.targus-getdata1 > 112.26.0.8.36628: Flags [.], ack 402697, win 23867, options [nop,nop,TS val 125306 ecr 4294870279,mptcp dss ack 3984846303], length 0
17:01:31.789712 IP 112.26.0.8.36628 > 112.26.0.1.targus-getdata1: Flags [.], seq 411265:412693, ack 0, win 685, options [nop,nop,TS val 4294870803 ecr 125195,mptcp dss ack 1375043541 seq 3984953403 subseq 764018 len 1428 csum 0x2d8b], length 1428
17:01:31.841159 IP 112.26.0.1.targus-getdata1 > 112.26.0.8.36628: Flags [.], ack 404125, win 23867, options [nop,nop,TS val 125384 ecr 4294870391,mptcp dss ack 3984846303], length 0
17:01:31.841357 IP 112.26.0.1.targus-getdata1 > 112.26.0.8.36628: Flags [.], ack 404125, win 23867, options [nop,nop,TS val 125384 ecr 4294870391,mptcp dss ack 3984846303], length 0
17:01:31.855263 IP 112.26.0.8.36628 > 112.26.0.1.targus-getdata1: Flags [.], seq 412693:414121, ack 0, win 685, options [nop,nop,TS val 4294870803 ecr 125195,mptcp dss ack 1375043541 seq 3984954831 subseq 765446 len 1428 csum 0x7d7b], length 1428
17:01:31.915292 IP 112.26.0.8.36628 > 112.26.0.1.targus-getdata1: Flags [.], seq 414121:415549, ack 0, win 685, options [nop,nop,TS val 4294870915 ecr 125306,mptcp dss ack 1375043541 seq 3984957687 subseq 766874 len 1428 csum 0x8849], length 1428
17:01:31.923248 IP 112.26.0.1.targus-getdata1 > 112.26.0.8.36628: Flags [.], ack 405553, win 23867, options [nop,nop,TS val 125467 ecr 4294870481,mptcp dss ack 3984846303], length 0
17:01:31.923449 IP 112.26.0.1.targus-getdata1 > 112.26.0.8.36628: Flags [.], ack 405553, win 23867, options [nop,nop,TS val 125467 ecr 4294870481,mptcp dss ack 3984846303], length 0
17:01:31.973175 IP 112.26.0.8.36628 > 112.26.0.1.targus-getdata1: Flags [.], seq 415549:416977, ack 0, win 685, options [nop,nop,TS val 4294870984 ecr 125384,mptcp dss ack 1375043541 seq 3984966255 subseq 768302 len 1428 csum 0x5799], length 1428
17:01:32.037845 IP 112.26.0.8.36628 > 112.26.0.1.targus-getdata1: Flags [.], seq 416977:418405, ack 0, win 685, options [nop,nop,TS val 4294871064 ecr 125467,mptcp dss ack 1375043541 seq 3984967683 subseq 769730 len 1428 csum 0x904e], length 1428
17:01:32.048997 IP 112.26.0.1.targus-getdata1 > 112.26.0.8.36628: Flags [.], ack 406981, win 23867, options [nop,nop,TS val 125532 ecr 4294870549,mptcp dss ack 3984846303], length 0
17:01:32.049192 IP 112.26.0.1.targus-getdata1 > 112.26.0.8.36628: Flags [.], ack 406981, win 23867, options [nop,nop,TS val 125532 ecr 4294870549,mptcp dss ack 3984846303], length 0
