17:00:33.034396 IP 112.26.0.8.36626 > 112.26.0.1.targus-getdata1: Flags [S], seq 2988296203, win 29200, options [mss 1460,sackOK,TS val 4294812145 ecr 0,nop,wscale 7,mptcp capable csum {0x8701148e479d40e2}], length 0
17:00:33.049593 IP 112.26.0.8.36626 > 112.26.0.1.targus-getdata1: Flags [S], seq 2988296203, win 29200, options [mss 1460,sackOK,TS val 4294812145 ecr 0,nop,wscale 7,mptcp capable csum {0x8701148e479d40e2}], length 0
17:00:33.061870 IP 112.26.0.8.36626 > 112.26.0.1.targus-getdata1: Flags [S], seq 2988296203, win 29200, options [mss 1460,sackOK,TS val 4294812145 ecr 0,nop,wscale 7,mptcp capable csum {0x8701148e479d40e2}], length 0
17:00:33.235995 IP 112.26.0.1.targus-getdata1 > 112.26.0.8.36626: Flags [S.], seq 2270931063, ack 2988296204, win 65535, options [mss 1460,sackOK,TS val 66611 ecr 4294812145,nop,wscale 6,mptcp capable csum {0xad3b304b2196ec90}], length 0
17:00:33.346350 IP 112.26.0.1.targus-getdata1 > 112.26.0.8.36626: Flags [S.], seq 2270931063, ack 2988296204, win 65535, options [mss 1460,sackOK,TS val 66611 ecr 4294812145,nop,wscale 6,mptcp capable csum {0xad3b304b2196ec90}], length 0
17:00:33.358221 IP 112.26.0.1.targus-getdata1 > 112.26.0.8.36626: Flags [S.], seq 2270931063, ack 2988296204, win 65535, options [mss 1460,sackOK,TS val 66611 ecr 4294812145,nop,wscale 6,mptcp capable csum {0xad3b304b2196ec90}], length 0
17:00:34.170617 IP 112.26.0.1.targus-getdata1 > 112.26.0.8.36626: Flags [S.], seq 2270931063, ack 2988296204, win 65535, options [mss 1460,sackOK,TS val 67648 ecr 4294812145,nop,wscale 6,mptcp capable csum {0xad3b304b2196ec90}], length 0
17:01:09.138317 IP 112.26.0.8.36628 > 112.26.0.1.targus-getdata1: Flags [.], seq 1632801483:1632802911, ack 3203504563, win 685, options [nop,nop,TS val 4294847851 ecr 102107,mptcp dss ack 1375043541 seq 3984012351 subseq 365606 len 1428 csum 0x4667], length 1428
17:01:09.164149 IP 112.26.0.1.targus-getdata1 > 112.26.0.8.36628: Flags [.], ack 4294954444, win 24558, options [nop,nop,TS val 102454 ecr 4294847051,nop,nop,sack 1 {4294955872:4294964440},mptcp dss ack 3983983791], length 0
17:01:09.187720 IP 112.26.0.8.36628 > 112.26.0.1.targus-getdata1: Flags [.], seq 1428:2856, ack 1, win 685, options [nop,nop,TS val 4294847913 ecr 102173,mptcp dss ack 1375043541 seq 3984022347 subseq 367034 len 1428 csum 0xf5a3], length 1428
17:01:09.219547 IP 112.26.0.1.targus-getdata1 > 112.26.0.8.36628: Flags [.], ack 4294954444, win 24558, options [nop,nop,TS val 102534 ecr 4294847051,nop,nop,sack 1 {4294955872:4294965868},mptcp dss ack 3983983791], length 0
17:01:09.235992 IP 112.26.0.8.36628 > 112.26.0.1.targus-getdata1: Flags [.], seq 4294954444:4294955872, ack 1, win 685, options [nop,nop,TS val 4294847944 ecr 102173,mptcp dss ack 1375043541 seq 3983983791 subseq 352754 len 1428 csum 0x9d86], length 1428
17:01:09.294409 IP 112.26.0.1.targus-getdata1 > 112.26.0.8.36628: Flags [.], ack 4294954444, win 24558, options [nop,nop,TS val 102604 ecr 4294847051,nop,nop,sack 1 {4294955872:0},mptcp dss ack 3983983791], length 0
17:01:09.321035 IP 112.26.0.8.36628 > 112.26.0.1.targus-getdata1: Flags [.], seq 5712:7140, ack 1, win 685, options [nop,nop,TS val 4294848456 ecr 102604,mptcp dss ack 1375043541 seq 3984022347 subseq 371318 len 1428 csum 0xe4e7], length 1428
17:01:09.321268 IP 112.26.0.8.36628 > 112.26.0.1.targus-getdata1: Flags [.], seq 5712:7140, ack 1, win 685, options [nop,nop,TS val 4294848456 ecr 102604,mptcp dss ack 1375043541 seq 3984022347 subseq 371318 len 1428 csum 0xe4e7], length 1428
17:01:09.335101 IP 112.26.0.8.36628 > 112.26.0.1.targus-getdata1: Flags [.], seq 2856:4284, ack 1, win 685, options [nop,nop,TS val 4294848085 ecr 102254,mptcp dss ack 1375043541 seq 3983988075 subseq 368462 len 1428 csum 0x9973], length 1428
17:01:09.384992 IP 112.26.0.1.targus-getdata1 > 112.26.0.8.36628: Flags [.], ack 4294954444, win 24558, options [nop,nop,TS val 102687 ecr 4294847051,nop,nop,sack 1 {4294955872:1428},mptcp dss ack 3983983791], length 0
17:01:09.409004 IP 112.26.0.8.36628 > 112.26.0.1.targus-getdata1: Flags [.], seq 4284:5712, ack 1, win 685, options [nop,nop,TS val 4294848143 ecr 102333,mptcp dss ack 1375043541 seq 3983996643 subseq 369890 len 1428 csum 0xcd36], length 1428
17:01:09.433190 IP 112.26.0.8.36628 > 112.26.0.1.targus-getdata1: Flags [.], seq 7140:8568, ack 1, win 685, options [nop,nop,TS val 4294848568 ecr 102687,mptcp dss ack 1375043541 seq 3984028059 subseq 372746 len 1428 csum 0x588f], length 1428
17:01:09.433448 IP 112.26.0.8.36628 > 112.26.0.1.targus-getdata1: Flags [.], seq 7140:8568, ack 1, win 685, options [nop,nop,TS val 4294848568 ecr 102687,mptcp dss ack 1375043541 seq 3984028059 subseq 372746 len 1428 csum 0x588f], length 1428
17:01:09.452347 IP 112.26.0.1.targus-getdata1 > 112.26.0.8.36628: Flags [.], ack 4294954444, win 24558, options [nop,nop,TS val 102736 ecr 4294847051,nop,nop,sack 1 {4294955872:2856},mptcp dss ack 3983983791], length 0
17:01:09.481592 IP 112.26.0.8.36628 > 112.26.0.1.targus-getdata1: Flags [.], seq 5712:7140, ack 1, win 685, options [nop,nop,TS val 4294848456 ecr 102604,mptcp dss ack 1375043541 seq 3984022347 subseq 371318 len 1428 csum 0xe4e7], length 1428
17:01:09.502813 IP 112.26.0.1.targus-getdata1 > 112.26.0.8.36628: Flags [.], ack 2856, win 24243, options [nop,nop,TS val 102784 ecr 4294847944,mptcp dss ack 3984015207], length 0
17:01:09.530949 IP 112.26.0.8.36628 > 112.26.0.1.targus-getdata1: Flags [.], seq 8568:9996, ack 1, win 685, options [nop,nop,TS val 4294848647 ecr 102736,mptcp dss ack 1375043541 seq 3984030915 subseq 374174 len 1428 csum 0xcbfc], length 1428
17:01:09.531174 IP 112.26.0.8.36628 > 112.26.0.1.targus-getdata1: Flags [.], seq 8568:9996, ack 1, win 685, options [nop,nop,TS val 4294848647 ecr 102736,mptcp dss ack 1375043541 seq 3984030915 subseq 374174 len 1428 csum 0xcbfc], length 1428
17:01:09.539474 IP 112.26.0.8.36628 > 112.26.0.1.targus-getdata1: Flags [.], seq 7140:8568, ack 1, win 685, options [nop,nop,TS val 4294848568 ecr 102687,mptcp dss ack 1375043541 seq 3984028059 subseq 372746 len 1428 csum 0x588f], length 1428
17:01:09.577000 IP 112.26.0.8.36628 > 112.26.0.1.targus-getdata1: Flags [.], seq 9996:11424, ack 1, win 685, options [nop,nop,TS val 4294848647 ecr 102784,mptcp dss ack 1375043541 seq 3984032343 subseq 375602 len 1428 csum 0x7df5], length 1428
17:01:09.577233 IP 112.26.0.8.36628 > 112.26.0.1.targus-getdata1: Flags [.], seq 9996:11424, ack 1, win 685, options [nop,nop,TS val 4294848647 ecr 102784,mptcp dss ack 1375043541 seq 3984032343 subseq 375602 len 1428 csum 0x7df5], length 1428
17:01:09.584819 IP 112.26.0.1.targus-getdata1 > 112.26.0.8.36628: Flags [.], ack 4284, win 24543, options [nop,nop,TS val 102884 ecr 4294848085,mptcp dss ack 3984016635], length 0
17:01:09.620006 IP 112.26.0.8.36628 > 112.26.0.1.targus-getdata1: Flags [.], seq 8568:9996, ack 1, win 685, options [nop,nop,TS val 4294848647 ecr 102736,mptcp dss ack 1375043541 seq 3984030915 subseq 374174 len 1428 csum 0xcbfc], length 1428
17:01:09.641814 IP 112.26.0.8.36628 > 112.26.0.1.targus-getdata1: Flags [.], seq 11424:12852, ack 1, win 685, options [nop,nop,TS val 4294848724 ecr 102884,mptcp dss ack 1375043541 seq 3984033771 subseq 377030 len 1428 csum 0x46b0], length 1428
17:01:09.642088 IP 112.26.0.8.36628 > 112.26.0.1.targus-getdata1: Flags [.], seq 11424:12852, ack 1, win 685, options [nop,nop,TS val 4294848724 ecr 102884,mptcp dss ack 1375043541 seq 3984033771 subseq 377030 len 1428 csum 0x46b0], length 1428
17:01:09.662795 IP 112.26.0.1.targus-getdata1 > 112.26.0.8.36628: Flags [.], ack 5712, win 24543, options [nop,nop,TS val 102957 ecr 4294848143,mptcp dss ack 3984018063], length 0
17:01:09.681227 IP 112.26.0.8.36628 > 112.26.0.1.targus-getdata1: Flags [.], seq 9996:11424, ack 1, win 685, options [nop,nop,TS val 4294848647 ecr 102784,mptcp dss ack 1375043541 seq 3984032343 subseq 375602 len 1428 csum 0x7df5], length 1428
17:01:09.725717 IP 112.26.0.8.36628 > 112.26.0.1.targus-getdata1: Flags [.], seq 12852:14280, ack 1, win 685, options [nop,nop,TS val 4294848724 ecr 102884,mptcp dss ack 1375043541 seq 3984035199 subseq 378458 len 1428 csum 0x7da7], length 1428
17:01:09.726074 IP 112.26.0.8.36628 > 112.26.0.1.targus-getdata1: Flags [.], seq 12852:14280, ack 1, win 685, options [nop,nop,TS val 4294848724 ecr 102884,mptcp dss ack 1375043541 seq 3984035199 subseq 378458 len 1428 csum 0x7da7], length 1428
17:01:09.752236 IP 112.26.0.8.36628 > 112.26.0.1.targus-getdata1: Flags [.], seq 11424:12852, ack 1, win 685, options [nop,nop,TS val 4294848724 ecr 102884,mptcp dss ack 1375043541 seq 3984033771 subseq 377030 len 1428 csum 0x46b0], length 1428
17:01:09.772004 IP 112.26.0.1.targus-getdata1 > 112.26.0.8.36628: Flags [.], ack 7140, win 24543, options [nop,nop,TS val 103030 ecr 4294848456,mptcp dss ack 3984019491], length 0
17:01:09.778350 IP 112.26.0.8.36628 > 112.26.0.1.targus-getdata1: Flags [.], seq 14280:15708, ack 1, win 685, options [nop,nop,TS val 4294848806 ecr 102957,mptcp dss ack 1375043541 seq 3984042339 subseq 379886 len 1428 csum 0x4c13], length 1428
17:01:09.778635 IP 112.26.0.8.36628 > 112.26.0.1.targus-getdata1: Flags [.], seq 14280:15708, ack 1, win 685, options [nop,nop,TS val 4294848806 ecr 102957,mptcp dss ack 1375043541 seq 3984042339 subseq 379886 len 1428 csum 0x4c13], length 1428
17:01:09.798206 IP 112.26.0.1.targus-getdata1 > 112.26.0.8.36628: Flags [.], ack 8568, win 24558, options [nop,nop,TS val 103088 ecr 4294848568,mptcp dss ack 3984023775], length 0
17:01:09.843727 IP 112.26.0.8.36628 > 112.26.0.1.targus-getdata1: Flags [.], seq 12852:14280, ack 1, win 685, options [nop,nop,TS val 4294848724 ecr 102884,mptcp dss ack 1375043541 seq 3984035199 subseq 378458 len 1428 csum 0x7da7], length 1428
17:01:09.862869 IP 112.26.0.1.targus-getdata1 > 112.26.0.8.36628: Flags [.], ack 9996, win 24558, options [nop,nop,TS val 103168 ecr 4294848647,mptcp dss ack 3984023775], length 0
17:01:09.882249 IP 112.26.0.8.36628 > 112.26.0.1.targus-getdata1: Flags [.], seq 15708:17136, ack 1, win 685, options [nop,nop,TS val 4294848912 ecr 103030,mptcp dss ack 1375043541 seq 3984048051 subseq 381314 len 1428 csum 0x7984], length 1428
17:01:09.882486 IP 112.26.0.8.36628 > 112.26.0.1.targus-getdata1: Flags [.], seq 15708:17136, ack 1, win 685, options [nop,nop,TS val 4294848912 ecr 103030,mptcp dss ack 1375043541 seq 3984048051 subseq 381314 len 1428 csum 0x7984], length 1428
17:01:09.886517 IP 112.26.0.8.36628 > 112.26.0.1.targus-getdata1: Flags [.], seq 17136:18564, ack 1, win 685, options [nop,nop,TS val 4294848963 ecr 103088,mptcp dss ack 1375043541 seq 3984049479 subseq 382742 len 1428 csum 0xf947], length 1428
17:01:09.886789 IP 112.26.0.8.36628 > 112.26.0.1.targus-getdata1: Flags [.], seq 17136:18564, ack 1, win 685, options [nop,nop,TS val 4294848963 ecr 103088,mptcp dss ack 1375043541 seq 3984049479 subseq 382742 len 1428 csum 0xf947], length 1428
17:01:09.923193 IP 112.26.0.8.36628 > 112.26.0.1.targus-getdata1: Flags [.], seq 14280:15708, ack 1, win 685, options [nop,nop,TS val 4294848806 ecr 102957,mptcp dss ack 1375043541 seq 3984042339 subseq 379886 len 1428 csum 0x4c13], length 1428
17:01:09.935180 IP 112.26.0.8.36628 > 112.26.0.1.targus-getdata1: Flags [.], seq 18564:19992, ack 1, win 685, options [nop,nop,TS val 4294848963 ecr 103088,mptcp dss ack 1375043541 seq 3984050907 subseq 384170 len 1428 csum 0xd4b1], length 1428
17:01:09.935439 IP 112.26.0.8.36628 > 112.26.0.1.targus-getdata1: Flags [.], seq 18564:19992, ack 1, win 685, options [nop,nop,TS val 4294848963 ecr 103088,mptcp dss ack 1375043541 seq 3984050907 subseq 384170 len 1428 csum 0xd4b1], length 1428
17:01:09.945363 IP 112.26.0.1.targus-getdata1 > 112.26.0.8.36628: Flags [.], ack 11424, win 24558, options [nop,nop,TS val 103230 ecr 4294848647,mptcp dss ack 3984023775], length 0
17:01:10.008240 IP 112.26.0.8.36628 > 112.26.0.1.targus-getdata1: Flags [.], seq 15708:17136, ack 1, win 685, options [nop,nop,TS val 4294848912 ecr 103030,mptcp dss ack 1375043541 seq 3984048051 subseq 381314 len 1428 csum 0x7984], length 1428
17:01:10.030685 IP 112.26.0.8.36628 > 112.26.0.1.targus-getdata1: Flags [.], seq 19992:21420, ack 1, win 685, options [nop,nop,TS val 4294849017 ecr 103168,mptcp dss ack 1375043541 seq 3984053763 subseq 385598 len 1428 csum 0x1b09], length 1428
17:01:10.030912 IP 112.26.0.8.36628 > 112.26.0.1.targus-getdata1: Flags [.], seq 19992:21420, ack 1, win 685, options [nop,nop,TS val 4294849017 ecr 103168,mptcp dss ack 1375043541 seq 3984053763 subseq 385598 len 1428 csum 0x1b09], length 1428
17:01:10.037460 IP 112.26.0.1.targus-getdata1 > 112.26.0.8.36628: Flags [.], ack 12852, win 24558, options [nop,nop,TS val 103301 ecr 4294848724,mptcp dss ack 3984023775], length 0
17:01:10.088484 IP 112.26.0.8.36628 > 112.26.0.1.targus-getdata1: Flags [.], seq 17136:18564, ack 1, win 685, options [nop,nop,TS val 4294848963 ecr 103088,mptcp dss ack 1375043541 seq 3984049479 subseq 382742 len 1428 csum 0xf947], length 1428
17:01:10.096401 IP 112.26.0.8.36628 > 112.26.0.1.targus-getdata1: Flags [.], seq 21420:22848, ack 1, win 685, options [nop,nop,TS val 4294849085 ecr 103230,mptcp dss ack 1375043541 seq 3984055191 subseq 387026 len 1428 csum 0x53be], length 1428
17:01:10.096708 IP 112.26.0.8.36628 > 112.26.0.1.targus-getdata1: Flags [.], seq 21420:22848, ack 1, win 685, options [nop,nop,TS val 4294849085 ecr 103230,mptcp dss ack 1375043541 seq 3984055191 subseq 387026 len 1428 csum 0x53be], length 1428
17:01:10.147400 IP 112.26.0.8.36628 > 112.26.0.1.targus-getdata1: Flags [.], seq 18564:19992, ack 1, win 685, options [nop,nop,TS val 4294848963 ecr 103088,mptcp dss ack 1375043541 seq 3984050907 subseq 384170 len 1428 csum 0xd4b1], length 1428
17:01:10.153668 IP 112.26.0.8.36628 > 112.26.0.1.targus-getdata1: Flags [.], seq 22848:24276, ack 1, win 685, options [nop,nop,TS val 4294849176 ecr 103301,mptcp dss ack 1375043541 seq 3984062331 subseq 388454 len 1428 csum 0x1139], length 1428
17:01:10.153959 IP 112.26.0.8.36628 > 112.26.0.1.targus-getdata1: Flags [.], seq 22848:24276, ack 1, win 685, options [nop,nop,TS val 4294849176 ecr 103301,mptcp dss ack 1375043541 seq 3984062331 subseq 388454 len 1428 csum 0x1139], length 1428
17:01:10.166539 IP 112.26.0.1.targus-getdata1 > 112.26.0.8.36628: Flags [.], ack 14280, win 24536, options [nop,nop,TS val 103392 ecr 4294848724,mptcp dss ack 3984025203], length 0
17:01:10.237015 IP 112.26.0.1.targus-getdata1 > 112.26.0.8.36628: Flags [.], ack 15708, win 24536, options [nop,nop,TS val 103471 ecr 4294848806,mptcp dss ack 3984025203], length 0
17:01:10.239343 IP 112.26.0.8.36628 > 112.26.0.1.targus-getdata1: Flags [.], seq 19992:21420, ack 1, win 685, options [nop,nop,TS val 4294849017 ecr 103168,mptcp dss ack 1375043541 seq 3984053763 subseq 385598 len 1428 csum 0x1b09], length 1428
17:01:10.244024 IP 112.26.0.8.36628 > 112.26.0.1.targus-getdata1: Flags [.], seq 24276:25704, ack 1, win 685, options [nop,nop,TS val 4294849306 ecr 103392,mptcp dss ack 1375043541 seq 3984068043 subseq 389882 len 1428 csum 0x722b], length 1428
17:01:10.244285 IP 112.26.0.8.36628 > 112.26.0.1.targus-getdata1: Flags [.], seq 24276:25704, ack 1, win 685, options [nop,nop,TS val 4294849306 ecr 103392,mptcp dss ack 1375043541 seq 3984068043 subseq 389882 len 1428 csum 0x722b], length 1428
17:01:10.282300 IP 112.26.0.8.36628 > 112.26.0.1.targus-getdata1: Flags [.], seq 25704:27132, ack 1, win 685, options [nop,nop,TS val 4294849376 ecr 103471,mptcp dss ack 1375043541 seq 3984069471 subseq 391310 len 1428 csum 0x3640], length 1428
17:01:10.282557 IP 112.26.0.8.36628 > 112.26.0.1.targus-getdata1: Flags [.], seq 25704:27132, ack 1, win 685, options [nop,nop,TS val 4294849376 ecr 103471,mptcp dss ack 1375043541 seq 3984069471 subseq 391310 len 1428 csum 0x3640], length 1428
17:01:10.307781 IP 112.26.0.1.targus-getdata1 > 112.26.0.8.36628: Flags [.], ack 17136, win 24514, options [nop,nop,TS val 103555 ecr 4294848912,mptcp dss ack 3984026631], length 0
17:01:10.320095 IP 112.26.0.8.36628 > 112.26.0.1.targus-getdata1: Flags [.], seq 21420:22848, ack 1, win 685, options [nop,nop,TS val 4294849085 ecr 103230,mptcp dss ack 1375043541 seq 3984055191 subseq 387026 len 1428 csum 0x53be], length 1428
17:01:10.344695 IP 112.26.0.8.36628 > 112.26.0.1.targus-getdata1: Flags [.], seq 27132:28560, ack 1, win 685, options [nop,nop,TS val 4294849455 ecr 103555,mptcp dss ack 1375043541 seq 3984073755 subseq 392738 len 1428 csum 0xa4a8], length 1428
17:01:10.344989 IP 112.26.0.8.36628 > 112.26.0.1.targus-getdata1: Flags [.], seq 27132:28560, ack 1, win 685, options [nop,nop,TS val 4294849455 ecr 103555,mptcp dss ack 1375043541 seq 3984073755 subseq 392738 len 1428 csum 0xa4a8], length 1428
17:01:10.399764 IP 112.26.0.8.36628 > 112.26.0.1.targus-getdata1: Flags [.], seq 22848:24276, ack 1, win 685, options [nop,nop,TS val 4294849176 ecr 103301,mptcp dss ack 1375043541 seq 3984062331 subseq 388454 len 1428 csum 0x1139], length 1428
17:01:10.403690 IP 112.26.0.1.targus-getdata1 > 112.26.0.8.36628: Flags [.], ack 18564, win 24540, options [nop,nop,TS val 103637 ecr 4294848963,mptcp dss ack 3984036627], length 0
17:01:10.425998 IP 112.26.0.8.36628 > 112.26.0.1.targus-getdata1: Flags [.], seq 28560:29988, ack 1, win 685, options [nop,nop,TS val 4294849543 ecr 103637,mptcp dss ack 1375043541 seq 3984079467 subseq 394166 len 1428 csum 0x286d], length 1428
17:01:10.426259 IP 112.26.0.8.36628 > 112.26.0.1.targus-getdata1: Flags [.], seq 28560:29988, ack 1, win 685, options [nop,nop,TS val 4294849543 ecr 103637,mptcp dss ack 1375043541 seq 3984079467 subseq 394166 len 1428 csum 0x286d], length 1428
17:01:10.451277 IP 112.26.0.1.targus-getdata1 > 112.26.0.8.36628: Flags [.], ack 19992, win 24518, options [nop,nop,TS val 103688 ecr 4294848963,mptcp dss ack 3984038055], length 0
17:01:10.481447 IP 112.26.0.8.36628 > 112.26.0.1.targus-getdata1: Flags [.], seq 29988:31416, ack 1, win 685, options [nop,nop,TS val 4294849618 ecr 103688,mptcp dss ack 1375043541 seq 3984082323 subseq 395594 len 1428 csum 0x56e1], length 1428
17:01:10.481706 IP 112.26.0.8.36628 > 112.26.0.1.targus-getdata1: Flags [.], seq 29988:31416, ack 1, win 685, options [nop,nop,TS val 4294849618 ecr 103688,mptcp dss ack 1375043541 seq 3984082323 subseq 395594 len 1428 csum 0x56e1], length 1428
17:01:10.499955 IP 112.26.0.8.36628 > 112.26.0.1.targus-getdata1: Flags [.], seq 24276:25704, ack 1, win 685, options [nop,nop,TS val 4294849306 ecr 103392,mptcp dss ack 1375043541 seq 3984068043 subseq 389882 len 1428 csum 0x722b], length 1428
17:01:10.536445 IP 112.26.0.1.targus-getdata1 > 112.26.0.8.36628: Flags [.], ack 21420, win 24518, options [nop,nop,TS val 103778 ecr 4294849017,mptcp dss ack 3984038055], length 0
17:01:10.546120 IP 112.26.0.8.36628 > 112.26.0.1.targus-getdata1: Flags [.], seq 31416:32844, ack 1, win 685, options [nop,nop,TS val 4294849618 ecr 103688,mptcp dss ack 1375043541 seq 3984083751 subseq 397022 len 1428 csum 0x2e60], length 1428
17:01:10.546316 IP 112.26.0.8.36628 > 112.26.0.1.targus-getdata1: Flags [.], seq 31416:32844, ack 1, win 685, options [nop,nop,TS val 4294849618 ecr 103688,mptcp dss ack 1375043541 seq 3984083751 subseq 397022 len 1428 csum 0x2e60], length 1428
17:01:10.552108 IP 112.26.0.8.36628 > 112.26.0.1.targus-getdata1: Flags [.], seq 25704:27132, ack 1, win 685, options [nop,nop,TS val 4294849376 ecr 103471,mptcp dss ack 1375043541 seq 3984069471 subseq 391310 len 1428 csum 0x3640], length 1428
17:01:10.617849 IP 112.26.0.1.targus-getdata1 > 112.26.0.8.36628: Flags [.], ack 22848, win 24478, options [nop,nop,TS val 103860 ecr 4294849085,mptcp dss ack 3984043767], length 0
17:01:10.637326 IP 112.26.0.8.36628 > 112.26.0.1.targus-getdata1: Flags [.], seq 32844:34272, ack 1, win 685, options [nop,nop,TS val 4294849693 ecr 103778,mptcp dss ack 1375043541 seq 3984090891 subseq 398450 len 1428 csum 0x9d9a], length 1428
17:01:10.637600 IP 112.26.0.8.36628 > 112.26.0.1.targus-getdata1: Flags [.], seq 32844:34272, ack 1, win 685, options [nop,nop,TS val 4294849693 ecr 103778,mptcp dss ack 1375043541 seq 3984090891 subseq 398450 len 1428 csum 0x9d9a], length 1428
17:01:10.650259 IP 112.26.0.8.36628 > 112.26.0.1.targus-getdata1: Flags [.], seq 27132:28560, ack 1, win 685, options [nop,nop,TS val 4294849455 ecr 103555,mptcp dss ack 1375043541 seq 3984073755 subseq 392738 len 1428 csum 0xa4a8], length 1428
17:01:10.672409 IP 112.26.0.8.36628 > 112.26.0.1.targus-getdata1: Flags [.], seq 28560:29988, ack 1, win 685, options [nop,nop,TS val 4294849543 ecr 103637,mptcp dss ack 1375043541 seq 3984079467 subseq 394166 len 1428 csum 0x286d], length 1428
17:01:10.710326 IP 112.26.0.8.36628 > 112.26.0.1.targus-getdata1: Flags [.], seq 34272:35700, ack 1, win 685, options [nop,nop,TS val 4294849758 ecr 103860,mptcp dss ack 1375043541 seq 3984092319 subseq 399878 len 1428 csum 0x366c], length 1428
17:01:10.710567 IP 112.26.0.8.36628 > 112.26.0.1.targus-getdata1: Flags [.], seq 34272:35700, ack 1, win 685, options [nop,nop,TS val 4294849758 ecr 103860,mptcp dss ack 1375043541 seq 3984092319 subseq 399878 len 1428 csum 0x366c], length 1428
17:01:10.722726 IP 112.26.0.1.targus-getdata1 > 112.26.0.8.36628: Flags [.], ack 24276, win 24460, options [nop,nop,TS val 103948 ecr 4294849176,mptcp dss ack 3984045195], length 0
17:01:10.746620 IP 112.26.0.8.36628 > 112.26.0.1.targus-getdata1: Flags [.], seq 29988:31416, ack 1, win 685, options [nop,nop,TS val 4294849618 ecr 103688,mptcp dss ack 1375043541 seq 3984082323 subseq 395594 len 1428 csum 0x56e1], length 1428
17:01:10.772243 IP 112.26.0.8.36628 > 112.26.0.1.targus-getdata1: Flags [.], seq 35700:37128, ack 1, win 685, options [nop,nop,TS val 4294849862 ecr 103948,mptcp dss ack 1375043541 seq 3984096603 subseq 401306 len 1428 csum 0xceea], length 1428
17:01:10.772470 IP 112.26.0.8.36628 > 112.26.0.1.targus-getdata1: Flags [.], seq 35700:37128, ack 1, win 685, options [nop,nop,TS val 4294849862 ecr 103948,mptcp dss ack 1375043541 seq 3984096603 subseq 401306 len 1428 csum 0xceea], length 1428
17:01:10.787222 IP 112.26.0.1.targus-getdata1 > 112.26.0.8.36628: Flags [.], ack 25704, win 24460, options [nop,nop,TS val 104086 ecr 4294849306,mptcp dss ack 3984046623], length 0
17:01:10.839131 IP 112.26.0.8.36628 > 112.26.0.1.targus-getdata1: Flags [.], seq 31416:32844, ack 1, win 685, options [nop,nop,TS val 4294849618 ecr 103688,mptcp dss ack 1375043541 seq 3984083751 subseq 397022 len 1428 csum 0x2e60], length 1428
17:01:10.857598 IP 112.26.0.8.36628 > 112.26.0.1.targus-getdata1: Flags [.], seq 37128:38556, ack 1, win 685, options [nop,nop,TS val 4294849931 ecr 104086,mptcp dss ack 1375043541 seq 3984100887 subseq 402734 len 1428 csum 0xe2af], length 1428
17:01:10.857858 IP 112.26.0.8.36628 > 112.26.0.1.targus-getdata1: Flags [.], seq 37128:38556, ack 1, win 685, options [nop,nop,TS val 4294849931 ecr 104086,mptcp dss ack 1375043541 seq 3984100887 subseq 402734 len 1428 csum 0xe2af], length 1428
17:01:10.872892 IP 112.26.0.1.targus-getdata1 > 112.26.0.8.36628: Flags [.], ack 27132, win 24460, options [nop,nop,TS val 104150 ecr 4294849376,mptcp dss ack 3984046623], length 0
17:01:10.881429 IP 112.26.0.8.36628 > 112.26.0.1.targus-getdata1: Flags [.], seq 32844:34272, ack 1, win 685, options [nop,nop,TS val 4294849693 ecr 103778,mptcp dss ack 1375043541 seq 3984090891 subseq 398450 len 1428 csum 0x9d9a], length 1428
17:01:10.930454 IP 112.26.0.8.36628 > 112.26.0.1.targus-getdata1: Flags [.], seq 38556:39984, ack 1, win 685, options [nop,nop,TS val 4294850013 ecr 104150,mptcp dss ack 1375043541 seq 3984102315 subseq 404162 len 1428 csum 0x28f0], length 1428
17:01:10.930705 IP 112.26.0.8.36628 > 112.26.0.1.targus-getdata1: Flags [.], seq 38556:39984, ack 1, win 685, options [nop,nop,TS val 4294850013 ecr 104150,mptcp dss ack 1375043541 seq 3984102315 subseq 404162 len 1428 csum 0x28f0], length 1428
17:01:10.946041 IP 112.26.0.1.targus-getdata1 > 112.26.0.8.36628: Flags [.], ack 29988, win 24460, options [nop,nop,TS val 104240 ecr 4294849455,mptcp dss ack 3984046623], length 0
17:01:10.963788 IP 112.26.0.8.36628 > 112.26.0.1.targus-getdata1: Flags [.], seq 34272:35700, ack 1, win 685, options [nop,nop,TS val 4294849758 ecr 103860,mptcp dss ack 1375043541 seq 3984092319 subseq 399878 len 1428 csum 0x366c], length 1428
17:01:10.999891 IP 112.26.0.8.36628 > 112.26.0.1.targus-getdata1: Flags [.], seq 39984:41412, ack 1, win 685, options [nop,nop,TS val 4294850089 ecr 104240,mptcp dss ack 1375043541 seq 3984109455 subseq 405590 len 1428 csum 0x21c7], length 1428
17:01:11.000186 IP 112.26.0.8.36628 > 112.26.0.1.targus-getdata1: Flags [.], seq 39984:41412, ack 1, win 685, options [nop,nop,TS val 4294850089 ecr 104240,mptcp dss ack 1375043541 seq 3984109455 subseq 405590 len 1428 csum 0x21c7], length 1428
17:01:11.019288 IP 112.26.0.8.36628 > 112.26.0.1.targus-getdata1: Flags [.], seq 35700:37128, ack 1, win 685, options [nop,nop,TS val 4294849862 ecr 103948,mptcp dss ack 1375043541 seq 3984096603 subseq 401306 len 1428 csum 0xceea], length 1428
17:01:11.028063 IP 112.26.0.1.targus-getdata1 > 112.26.0.8.36628: Flags [.], ack 31416, win 24460, options [nop,nop,TS val 104345 ecr 4294849618,mptcp dss ack 3984046623], length 0
17:01:11.065684 IP 112.26.0.8.36628 > 112.26.0.1.targus-getdata1: Flags [.], seq 41412:42840, ack 1, win 685, options [nop,nop,TS val 4294850089 ecr 104240,mptcp dss ack 1375043541 seq 3984110883 subseq 407018 len 1428 csum 0x2bb8], length 1428
17:01:11.065951 IP 112.26.0.8.36628 > 112.26.0.1.targus-getdata1: Flags [.], seq 41412:42840, ack 1, win 685, options [nop,nop,TS val 4294850089 ecr 104240,mptcp dss ack 1375043541 seq 3984110883 subseq 407018 len 1428 csum 0x2bb8], length 1428
17:01:11.106384 IP 112.26.0.8.36628 > 112.26.0.1.targus-getdata1: Flags [.], seq 37128:38556, ack 1, win 685, options [nop,nop,TS val 4294849931 ecr 104086,mptcp dss ack 1375043541 seq 3984100887 subseq 402734 len 1428 csum 0xe2af], length 1428
17:01:11.121180 IP 112.26.0.1.targus-getdata1 > 112.26.0.8.36628: Flags [.], ack 34272, win 24460, options [nop,nop,TS val 104430 ecr 4294849618,mptcp dss ack 3984046623], length 0
17:01:11.127188 IP 112.26.0.8.36628 > 112.26.0.1.targus-getdata1: Flags [.], seq 42840:44268, ack 1, win 685, options [nop,nop,TS val 4294850168 ecr 104345,mptcp dss ack 1375043541 seq 3984115167 subseq 408446 len 1428 csum 0x1af8], length 1428
17:01:11.127417 IP 112.26.0.8.36628 > 112.26.0.1.targus-getdata1: Flags [.], seq 42840:44268, ack 1, win 685, options [nop,nop,TS val 4294850168 ecr 104345,mptcp dss ack 1375043541 seq 3984115167 subseq 408446 len 1428 csum 0x1af8], length 1428
17:01:11.167999 IP 112.26.0.8.36628 > 112.26.0.1.targus-getdata1: Flags [.], seq 38556:39984, ack 1, win 685, options [nop,nop,TS val 4294850013 ecr 104150,mptcp dss ack 1375043541 seq 3984102315 subseq 404162 len 1428 csum 0x28f0], length 1428
17:01:11.179972 IP 112.26.0.8.36628 > 112.26.0.1.targus-getdata1: Flags [.], seq 44268:45696, ack 1, win 685, options [nop,nop,TS val 4294850262 ecr 104430,mptcp dss ack 1375043541 seq 3984116595 subseq 409874 len 1428 csum 0x7f2f], length 1428
17:01:11.180180 IP 112.26.0.8.36628 > 112.26.0.1.targus-getdata1: Flags [.], seq 44268:45696, ack 1, win 685, options [nop,nop,TS val 4294850262 ecr 104430,mptcp dss ack 1375043541 seq 3984116595 subseq 409874 len 1428 csum 0x7f2f], length 1428
17:01:11.216018 IP 112.26.0.1.targus-getdata1 > 112.26.0.8.36628: Flags [.], ack 35700, win 24460, options [nop,nop,TS val 104562 ecr 4294849758,mptcp dss ack 3984046623], length 0
17:01:11.230260 IP 112.26.0.8.36628 > 112.26.0.1.targus-getdata1: Flags [.], seq 39984:41412, ack 1, win 685, options [nop,nop,TS val 4294850089 ecr 104240,mptcp dss ack 1375043541 seq 3984109455 subseq 405590 len 1428 csum 0x21c7], length 1428
17:01:11.260882 IP 112.26.0.8.36628 > 112.26.0.1.targus-getdata1: Flags [.], seq 45696:47124, ack 1, win 685, options [nop,nop,TS val 4294850262 ecr 104430,mptcp dss ack 1375043541 seq 3984118023 subseq 411302 len 1428 csum 0x2f12], length 1428
17:01:11.261150 IP 112.26.0.8.36628 > 112.26.0.1.targus-getdata1: Flags [.], seq 45696:47124, ack 1, win 685, options [nop,nop,TS val 4294850262 ecr 104430,mptcp dss ack 1375043541 seq 3984118023 subseq 411302 len 1428 csum 0x2f12], length 1428
17:01:11.274257 IP 112.26.0.1.targus-getdata1 > 112.26.0.8.36628: Flags [.], ack 37128, win 24460, options [nop,nop,TS val 104617 ecr 4294849862,mptcp dss ack 3984046623], length 0
17:01:11.328990 IP 112.26.0.8.36628 > 112.26.0.1.targus-getdata1: Flags [.], seq 41412:42840, ack 1, win 685, options [nop,nop,TS val 4294850089 ecr 104240,mptcp dss ack 1375043541 seq 3984110883 subseq 407018 len 1428 csum 0x2bb8], length 1428
17:01:11.357823 IP 112.26.0.1.targus-getdata1 > 112.26.0.8.36628: Flags [.], ack 38556, win 24460, options [nop,nop,TS val 104705 ecr 4294849931,mptcp dss ack 3984046623], length 0
17:01:11.366163 IP 112.26.0.1.targus-getdata1 > 112.26.0.8.36628: Flags [.], ack 39984, win 24460, options [nop,nop,TS val 104766 ecr 4294850013,mptcp dss ack 3984046623], length 0
17:01:11.390372 IP 112.26.0.8.36628 > 112.26.0.1.targus-getdata1: Flags [.], seq 47124:48552, ack 1, win 685, options [nop,nop,TS val 4294850359 ecr 104562,mptcp dss ack 1375043541 seq 3984128019 subseq 412730 len 1428 csum 0x561b], length 1428
17:01:11.390588 IP 112.26.0.8.36628 > 112.26.0.1.targus-getdata1: Flags [.], seq 47124:48552, ack 1, win 685, options [nop,nop,TS val 4294850359 ecr 104562,mptcp dss ack 1375043541 seq 3984128019 subseq 412730 len 1428 csum 0x561b], length 1428
17:01:11.392730 IP 112.26.0.8.36628 > 112.26.0.1.targus-getdata1: Flags [.], seq 48552:49980, ack 1, win 685, options [nop,nop,TS val 4294850414 ecr 104617,mptcp dss ack 1375043541 seq 3984129447 subseq 414158 len 1428 csum 0x2573], length 1428
17:01:11.392851 IP 112.26.0.8.36628 > 112.26.0.1.targus-getdata1: Flags [.], seq 48552:49980, ack 1, win 685, options [nop,nop,TS val 4294850414 ecr 104617,mptcp dss ack 1375043541 seq 3984129447 subseq 414158 len 1428 csum 0x2573], length 1428
17:01:11.431849 IP 112.26.0.8.36628 > 112.26.0.1.targus-getdata1: Flags [.], seq 42840:44268, ack 1, win 685, options [nop,nop,TS val 4294850168 ecr 104345,mptcp dss ack 1375043541 seq 3984115167 subseq 408446 len 1428 csum 0x1af8], length 1428
17:01:11.449747 IP 112.26.0.1.targus-getdata1 > 112.26.0.8.36628: Flags [.], ack 41412, win 24460, options [nop,nop,TS val 104829 ecr 4294850089,mptcp dss ack 3984046623], length 0
17:01:11.465411 IP 112.26.0.8.36628 > 112.26.0.1.targus-getdata1: Flags [.], seq 49980:51408, ack 1, win 685, options [nop,nop,TS val 4294850498 ecr 104705,mptcp dss ack 1375043541 seq 3984130875 subseq 415586 len 1428 csum 0x7c1a], length 1428
17:01:11.465695 IP 112.26.0.8.36628 > 112.26.0.1.targus-getdata1: Flags [.], seq 49980:51408, ack 1, win 685, options [nop,nop,TS val 4294850498 ecr 104705,mptcp dss ack 1375043541 seq 3984130875 subseq 415586 len 1428 csum 0x7c1a], length 1428
17:01:11.502814 IP 112.26.0.8.36628 > 112.26.0.1.targus-getdata1: Flags [.], seq 44268:45696, ack 1, win 685, options [nop,nop,TS val 4294850262 ecr 104430,mptcp dss ack 1375043541 seq 3984116595 subseq 409874 len 1428 csum 0x7f2f], length 1428
17:01:11.525763 IP 112.26.0.1.targus-getdata1 > 112.26.0.8.36628: Flags [.], ack 42840, win 24460, options [nop,nop,TS val 104927 ecr 4294850089,mptcp dss ack 3984046623], length 0
17:01:11.539002 IP 112.26.0.8.36628 > 112.26.0.1.targus-getdata1: Flags [.], seq 51408:52836, ack 1, win 685, options [nop,nop,TS val 4294850576 ecr 104766,mptcp dss ack 1375043541 seq 3984142299 subseq 417014 len 1428 csum 0xd410], length 1428
17:01:11.539279 IP 112.26.0.8.36628 > 112.26.0.1.targus-getdata1: Flags [.], seq 51408:52836, ack 1, win 685, options [nop,nop,TS val 4294850576 ecr 104766,mptcp dss ack 1375043541 seq 3984142299 subseq 417014 len 1428 csum 0xd410], length 1428
17:01:11.593480 IP 112.26.0.1.targus-getdata1 > 112.26.0.8.36628: Flags [.], ack 44268, win 24460, options [nop,nop,TS val 105026 ecr 4294850168,mptcp dss ack 3984046623], length 0
17:01:11.613759 IP 112.26.0.8.36628 > 112.26.0.1.targus-getdata1: Flags [.], seq 45696:47124, ack 1, win 685, options [nop,nop,TS val 4294850262 ecr 104430,mptcp dss ack 1375043541 seq 3984118023 subseq 411302 len 1428 csum 0x2f12], length 1428
17:01:11.632460 IP 112.26.0.8.36628 > 112.26.0.1.targus-getdata1: Flags [.], seq 52836:54264, ack 1, win 685, options [nop,nop,TS val 4294850644 ecr 104829,mptcp dss ack 1375043541 seq 3984143727 subseq 418442 len 1428 csum 0xb2d5], length 1428
17:01:11.632797 IP 112.26.0.8.36628 > 112.26.0.1.targus-getdata1: Flags [.], seq 52836:54264, ack 1, win 685, options [nop,nop,TS val 4294850644 ecr 104829,mptcp dss ack 1375043541 seq 3984143727 subseq 418442 len 1428 csum 0xb2d5], length 1428
17:01:11.643979 IP 112.26.0.8.36628 > 112.26.0.1.targus-getdata1: Flags [.], seq 54264:55692, ack 1, win 685, options [nop,nop,TS val 4294850706 ecr 104927,mptcp dss ack 1375043541 seq 3984145155 subseq 419870 len 1428 csum 0x16e2], length 1428
17:01:11.644284 IP 112.26.0.8.36628 > 112.26.0.1.targus-getdata1: Flags [.], seq 54264:55692, ack 1, win 685, options [nop,nop,TS val 4294850706 ecr 104927,mptcp dss ack 1375043541 seq 3984145155 subseq 419870 len 1428 csum 0x16e2], length 1428
17:01:11.655739 IP 112.26.0.1.targus-getdata1 > 112.26.0.8.36628: Flags [.], ack 45696, win 24460, options [nop,nop,TS val 105101 ecr 4294850262,mptcp dss ack 3984046623], length 0
17:01:11.695634 IP 112.26.0.8.36628 > 112.26.0.1.targus-getdata1: Flags [.], seq 47124:48552, ack 1, win 685, options [nop,nop,TS val 4294850359 ecr 104562,mptcp dss ack 1375043541 seq 3984128019 subseq 412730 len 1428 csum 0x561b], length 1428
17:01:11.713841 IP 112.26.0.8.36628 > 112.26.0.1.targus-getdata1: Flags [.], seq 55692:57120, ack 1, win 685, options [nop,nop,TS val 4294850762 ecr 105026,mptcp dss ack 1375043541 seq 3984146583 subseq 421298 len 1428 csum 0xa084], length 1428
17:01:11.714187 IP 112.26.0.8.36628 > 112.26.0.1.targus-getdata1: Flags [.], seq 55692:57120, ack 1, win 685, options [nop,nop,TS val 4294850762 ecr 105026,mptcp dss ack 1375043541 seq 3984146583 subseq 421298 len 1428 csum 0xa084], length 1428
17:01:11.736780 IP 112.26.0.1.targus-getdata1 > 112.26.0.8.36628: Flags [.], ack 47124, win 24460, options [nop,nop,TS val 105207 ecr 4294850262,mptcp dss ack 3984046623], length 0
17:01:11.758854 IP 112.26.0.8.36628 > 112.26.0.1.targus-getdata1: Flags [.], seq 57120:58548, ack 1, win 685, options [nop,nop,TS val 4294850826 ecr 105101,mptcp dss ack 1375043541 seq 3984150867 subseq 422726 len 1428 csum 0x5e1f], length 1428
17:01:11.759199 IP 112.26.0.8.36628 > 112.26.0.1.targus-getdata1: Flags [.], seq 57120:58548, ack 1, win 685, options [nop,nop,TS val 4294850826 ecr 105101,mptcp dss ack 1375043541 seq 3984150867 subseq 422726 len 1428 csum 0x5e1f], length 1428
17:01:11.791072 IP 112.26.0.8.36628 > 112.26.0.1.targus-getdata1: Flags [.], seq 48552:49980, ack 1, win 685, options [nop,nop,TS val 4294850414 ecr 104617,mptcp dss ack 1375043541 seq 3984129447 subseq 414158 len 1428 csum 0x2573], length 1428
17:01:11.818579 IP 112.26.0.1.targus-getdata1 > 112.26.0.8.36628: Flags [.], ack 48552, win 24460, options [nop,nop,TS val 105294 ecr 4294850359,mptcp dss ack 3984046623], length 0
17:01:11.828706 IP 112.26.0.8.36628 > 112.26.0.1.targus-getdata1: Flags [.], seq 58548:59976, ack 1, win 685, options [nop,nop,TS val 4294850907 ecr 105207,mptcp dss ack 1375043541 seq 3984155151 subseq 424154 len 1428 csum 0x324a], length 1428
17:01:11.828994 IP 112.26.0.8.36628 > 112.26.0.1.targus-getdata1: Flags [.], seq 58548:59976, ack 1, win 685, options [nop,nop,TS val 4294850907 ecr 105207,mptcp dss ack 1375043541 seq 3984155151 subseq 424154 len 1428 csum 0x324a], length 1428
17:01:11.855841 IP 112.26.0.1.targus-getdata1 > 112.26.0.8.36628: Flags [.], ack 49980, win 24460, options [nop,nop,TS val 105387 ecr 4294850414,mptcp dss ack 3984046623], length 0
17:01:11.872919 IP 112.26.0.8.36628 > 112.26.0.1.targus-getdata1: Flags [.], seq 59976:61404, ack 1, win 685, options [nop,nop,TS val 4294850960 ecr 105294,mptcp dss ack 1375043541 seq 3984156579 subseq 425582 len 1428 csum 0xde4c], length 1428
17:01:11.873252 IP 112.26.0.8.36628 > 112.26.0.1.targus-getdata1: Flags [.], seq 59976:61404, ack 1, win 685, options [nop,nop,TS val 4294850960 ecr 105294,mptcp dss ack 1375043541 seq 3984156579 subseq 425582 len 1428 csum 0xde4c], length 1428
17:01:11.897344 IP 112.26.0.8.36628 > 112.26.0.1.targus-getdata1: Flags [.], seq 49980:51408, ack 1, win 685, options [nop,nop,TS val 4294850498 ecr 104705,mptcp dss ack 1375043541 seq 3984130875 subseq 415586 len 1428 csum 0x7c1a], length 1428
17:01:11.959921 IP 112.26.0.1.targus-getdata1 > 112.26.0.8.36628: Flags [.], ack 51408, win 24460, options [nop,nop,TS val 105495 ecr 4294850498,mptcp dss ack 3984046623], length 0
17:01:11.973669 IP 112.26.0.8.36628 > 112.26.0.1.targus-getdata1: Flags [.], seq 61404:62832, ack 1, win 685, options [nop,nop,TS val 4294851009 ecr 105387,mptcp dss ack 1375043541 seq 3984158007 subseq 427010 len 1428 csum 0x3e80], length 1428
17:01:11.973931 IP 112.26.0.8.36628 > 112.26.0.1.targus-getdata1: Flags [.], seq 61404:62832, ack 1, win 685, options [nop,nop,TS val 4294851009 ecr 105387,mptcp dss ack 1375043541 seq 3984158007 subseq 427010 len 1428 csum 0x3e80], length 1428
17:01:11.990662 IP 112.26.0.8.36628 > 112.26.0.1.targus-getdata1: Flags [.], seq 51408:52836, ack 1, win 685, options [nop,nop,TS val 4294850576 ecr 104766,mptcp dss ack 1375043541 seq 3984142299 subseq 417014 len 1428 csum 0xd410], length 1428
17:01:12.017157 IP 112.26.0.8.36628 > 112.26.0.1.targus-getdata1: Flags [.], seq 62832:64260, ack 1, win 685, options [nop,nop,TS val 4294851115 ecr 105495,mptcp dss ack 1375043541 seq 3984162291 subseq 428438 len 1428 csum 0xda12], length 1428
17:01:12.017419 IP 112.26.0.8.36628 > 112.26.0.1.targus-getdata1: Flags [.], seq 62832:64260, ack 1, win 685, options [nop,nop,TS val 4294851115 ecr 105495,mptcp dss ack 1375043541 seq 3984162291 subseq 428438 len 1428 csum 0xda12], length 1428
17:01:12.050329 IP 112.26.0.1.targus-getdata1 > 112.26.0.8.36628: Flags [.], ack 52836, win 24460, options [nop,nop,TS val 105589 ecr 4294850576,mptcp dss ack 3984046623], length 0
17:01:12.068507 IP 112.26.0.8.36628 > 112.26.0.1.targus-getdata1: Flags [.], seq 64260:65688, ack 1, win 685, options [nop,nop,TS val 4294851191 ecr 105589,mptcp dss ack 1375043541 seq 3984170859 subseq 429866 len 1428 csum 0x984], length 1428
17:01:12.068794 IP 112.26.0.8.36628 > 112.26.0.1.targus-getdata1: Flags [.], seq 64260:65688, ack 1, win 685, options [nop,nop,TS val 4294851191 ecr 105589,mptcp dss ack 1375043541 seq 3984170859 subseq 429866 len 1428 csum 0x984], length 1428
17:01:12.093146 IP 112.26.0.8.36628 > 112.26.0.1.targus-getdata1: Flags [.], seq 52836:54264, ack 1, win 685, options [nop,nop,TS val 4294850644 ecr 104829,mptcp dss ack 1375043541 seq 3984143727 subseq 418442 len 1428 csum 0xb2d5], length 1428
17:01:12.130343 IP 112.26.0.8.36628 > 112.26.0.1.targus-getdata1: Flags [.], seq 54264:55692, ack 1, win 685, options [nop,nop,TS val 4294850706 ecr 104927,mptcp dss ack 1375043541 seq 3984145155 subseq 419870 len 1428 csum 0x16e2], length 1428
17:01:12.151809 IP 112.26.0.1.targus-getdata1 > 112.26.0.8.36628: Flags [.], ack 55692, win 24460, options [nop,nop,TS val 105679 ecr 4294850644,mptcp dss ack 3984046623], length 0
17:01:12.176704 IP 112.26.0.8.36628 > 112.26.0.1.targus-getdata1: Flags [.], seq 65688:67116, ack 1, win 685, options [nop,nop,TS val 4294851281 ecr 105679,mptcp dss ack 1375043541 seq 3984176571 subseq 431294 len 1428 csum 0x6b34], length 1428
17:01:12.177016 IP 112.26.0.8.36628 > 112.26.0.1.targus-getdata1: Flags [.], seq 65688:67116, ack 1, win 685, options [nop,nop,TS val 4294851281 ecr 105679,mptcp dss ack 1375043541 seq 3984176571 subseq 431294 len 1428 csum 0x6b34], length 1428
