17:00:34.822290 IP 112.26.3.8.33535 > 112.26.3.1.targus-getdata1: Flags [S], seq 746739866, win 29200, options [mss 1460,sackOK,TS val 4294813937 ecr 0,nop,wscale 7,mptcp join id 5 token 0xb697b9d8 nonce 0x70a62e96], length 0
17:00:34.906185 IP 112.26.3.8.33535 > 112.26.3.1.targus-getdata1: Flags [S], seq 746739866, win 29200, options [mss 1460,sackOK,TS val 4294813937 ecr 0,nop,wscale 7,mptcp join id 5 token 0xb697b9d8 nonce 0x70a62e96], length 0
17:00:34.962088 IP 112.26.3.8.33535 > 112.26.3.1.targus-getdata1: Flags [S], seq 746739866, win 29200, options [mss 1460,sackOK,TS val 4294813937 ecr 0,nop,wscale 7,mptcp join id 5 token 0xb697b9d8 nonce 0x70a62e96], length 0
17:00:35.231741 IP 112.26.3.8.33535 > 112.26.3.1.targus-getdata1: Flags [.], ack 3165522082, win 913, options [nop,nop,TS val 4294814337 ecr 68577,mptcp join hmac 0x0658a1a4ba17b9341d4604c566e33c7d3bb3fb39], length 0
17:00:35.231958 IP 112.26.3.8.33535 > 112.26.3.1.targus-getdata1: Flags [.], ack 1, win 913, options [nop,nop,TS val 4294814337 ecr 68577,mptcp join hmac 0x0658a1a4ba17b9341d4604c566e33c7d3bb3fb39], length 0
17:00:35.236777 IP 112.26.3.8.33535 > 112.26.3.1.targus-getdata1: Flags [.], ack 1, win 913, options [nop,nop,TS val 4294814337 ecr 68577,mptcp join hmac 0x0658a1a4ba17b9341d4604c566e33c7d3bb3fb39], length 0
17:00:36.119258 IP 112.26.3.8.45289 > 112.26.3.1.targus-getdata1: Flags [S], seq 2366768115, win 29200, options [mss 1460,sackOK,TS val 4294815255 ecr 0,nop,wscale 7,mptcp join id 5 token 0xc6830f5c nonce 0xbca4b955], length 0
17:03:38.985929 IP 112.26.3.1.targus-getdata1 > 112.26.3.8.33535: Flags [P.], seq 1:2, ack 0, win 4017, options [nop,nop,TS val 252482 ecr 4294814337,mptcp dss ack 2376860491 seq 116031161 subseq 1 len 1 csum 0x3719], length 1
17:03:39.040395 IP 112.26.3.1.targus-getdata1 > 112.26.3.8.33535: Flags [P.], seq 1:2, ack 0, win 4017, options [nop,nop,TS val 252482 ecr 4294814337,mptcp dss ack 2376860491 seq 116031161 subseq 1 len 1 csum 0x3719], length 1
17:03:39.042253 IP 112.26.3.8.33535 > 112.26.3.1.targus-getdata1: Flags [.], ack 2, win 913, options [nop,nop,TS val 30883 ecr 252482,mptcp dss ack 116031162], length 0
17:03:39.042599 IP 112.26.3.8.33535 > 112.26.3.1.targus-getdata1: Flags [.], ack 2, win 913, options [nop,nop,TS val 30883 ecr 252482,mptcp dss ack 116031162], length 0
17:03:39.054106 IP 112.26.3.8.33535 > 112.26.3.1.targus-getdata1: Flags [.], ack 2, win 913, options [nop,nop,TS val 30883 ecr 252482,mptcp dss ack 116031162], length 0
17:03:39.423746 IP 112.26.3.8.33535 > 112.26.3.1.targus-getdata1: Flags [P.], seq 0:219, ack 2, win 913, options [nop,nop,TS val 31264 ecr 252482,mptcp dss ack 116031162 seq 2376860495 subseq 1 len 219 csum 0x30ec], length 219
17:03:39.424129 IP 112.26.3.8.33535 > 112.26.3.1.targus-getdata1: Flags [P.], seq 0:219, ack 2, win 913, options [nop,nop,TS val 31264 ecr 252482,mptcp dss ack 116031162 seq 2376860495 subseq 1 len 219 csum 0x30ec], length 219
17:03:39.450972 IP 112.26.3.8.33535 > 112.26.3.1.targus-getdata1: Flags [P.], seq 0:219, ack 2, win 913, options [nop,nop,TS val 31264 ecr 252482,mptcp dss ack 116031162 seq 2376860495 subseq 1 len 219 csum 0x30ec], length 219
17:03:39.475521 IP 112.26.3.1.targus-getdata1 > 112.26.3.8.33535: Flags [.], ack 219, win 4017, options [nop,nop,TS val 252998 ecr 31264,mptcp dss ack 2376860714], length 0
17:03:39.478911 IP 112.26.3.1.targus-getdata1 > 112.26.3.8.33535: Flags [.], ack 219, win 4017, options [nop,nop,TS val 252998 ecr 31264,mptcp dss ack 2376860714], length 0
17:03:39.532021 IP 112.26.3.1.targus-getdata1 > 112.26.3.8.33535: Flags [P.], seq 2:6, ack 219, win 4017, options [nop,nop,TS val 252999 ecr 31264,mptcp dss ack 2376860714 seq 116031162 subseq 2 len 4 csum 0x4337], length 4
17:03:39.533925 IP 112.26.3.1.targus-getdata1 > 112.26.3.8.33535: Flags [P.], seq 2:6, ack 219, win 4017, options [nop,nop,TS val 252999 ecr 31264,mptcp dss ack 2376860714 seq 116031162 subseq 2 len 4 csum 0x4337], length 4
17:03:39.536053 IP 112.26.3.8.33535 > 112.26.3.1.targus-getdata1: Flags [.], ack 6, win 913, options [nop,nop,TS val 31376 ecr 252999,mptcp dss ack 116031166], length 0
17:03:39.536382 IP 112.26.3.8.33535 > 112.26.3.1.targus-getdata1: Flags [.], ack 6, win 913, options [nop,nop,TS val 31376 ecr 252999,mptcp dss ack 116031166], length 0
17:03:39.620559 IP 112.26.3.8.33535 > 112.26.3.1.targus-getdata1: Flags [.], ack 6, win 913, options [nop,nop,TS val 31376 ecr 252999,mptcp dss ack 116031166], length 0
17:03:39.639580 IP 112.26.3.1.targus-getdata1 > 112.26.3.8.33535: Flags [P.], seq 6:228, ack 219, win 4017, options [nop,nop,TS val 253102 ecr 31264,mptcp dss ack 2376860714 seq 116031166 subseq 6 len 222 csum 0x6956], length 222
17:03:39.641466 IP 112.26.3.1.targus-getdata1 > 112.26.3.8.33535: Flags [P.], seq 6:228, ack 219, win 4017, options [nop,nop,TS val 253102 ecr 31264,mptcp dss ack 2376860714 seq 116031166 subseq 6 len 222 csum 0x6956], length 222
17:03:39.645652 IP 112.26.3.8.33535 > 112.26.3.1.targus-getdata1: Flags [.], ack 228, win 916, options [nop,nop,TS val 31484 ecr 253102,mptcp dss ack 116031388], length 0
17:03:39.645911 IP 112.26.3.8.33535 > 112.26.3.1.targus-getdata1: Flags [.], ack 228, win 916, options [nop,nop,TS val 31484 ecr 253102,mptcp dss ack 116031388], length 0
17:03:39.650797 IP 112.26.3.8.33535 > 112.26.3.1.targus-getdata1: Flags [.], ack 228, win 916, options [nop,nop,TS val 31484 ecr 253102,mptcp dss ack 116031388], length 0
17:03:39.662909 IP 112.26.3.8.33535 > 112.26.3.1.targus-getdata1: Flags [P.], seq 219:220, ack 228, win 916, options [nop,nop,TS val 31485 ecr 253102,mptcp dss ack 116031388 seq 2376860714 subseq 220 len 1 csum 0x99d4], length 1
17:03:39.663143 IP 112.26.3.8.33535 > 112.26.3.1.targus-getdata1: Flags [P.], seq 219:220, ack 228, win 916, options [nop,nop,TS val 31485 ecr 253102,mptcp dss ack 116031388 seq 2376860714 subseq 220 len 1 csum 0x99d4], length 1
17:03:39.732551 IP 112.26.3.8.33535 > 112.26.3.1.targus-getdata1: Flags [P.], seq 219:220, ack 228, win 916, options [nop,nop,TS val 31485 ecr 253102,mptcp dss ack 116031388 seq 2376860714 subseq 220 len 1 csum 0x99d4], length 1
17:03:39.737440 IP 112.26.3.1.targus-getdata1 > 112.26.3.8.33535: Flags [F.], seq 228, ack 220, win 4017, options [nop,nop,TS val 253280 ecr 31485,mptcp dss fin ack 2376860715 seq 116031388 subseq 0 len 1 csum 0x4337], length 0
17:03:39.741227 IP 112.26.3.1.targus-getdata1 > 112.26.3.8.33535: Flags [F.], seq 228, ack 220, win 4017, options [nop,nop,TS val 253280 ecr 31485,mptcp dss fin ack 2376860715 seq 116031388 subseq 0 len 1 csum 0x4337], length 0
17:03:39.763185 IP 112.26.3.8.33535 > 112.26.3.1.targus-getdata1: Flags [.], ack 228, win 916, options [nop,nop,TS val 31486 ecr 253102,mptcp dss fin ack 116031388 seq 2376860715 subseq 0 len 1 csum 0xaaaf], length 0
17:03:39.763733 IP 112.26.3.8.33535 > 112.26.3.1.targus-getdata1: Flags [.], ack 228, win 916, options [nop,nop,TS val 31486 ecr 253102,mptcp dss fin ack 116031388 seq 2376860715 subseq 0 len 1 csum 0xaaaf], length 0
17:03:39.777367 IP 112.26.3.8.33535 > 112.26.3.1.targus-getdata1: Flags [.], ack 229, win 916, options [nop,nop,TS val 31584 ecr 253280,mptcp dss ack 116031389], length 0
17:03:39.777696 IP 112.26.3.8.33535 > 112.26.3.1.targus-getdata1: Flags [.], ack 229, win 916, options [nop,nop,TS val 31584 ecr 253280,mptcp dss ack 116031389], length 0
17:03:39.824903 IP 112.26.3.8.33535 > 112.26.3.1.targus-getdata1: Flags [.], ack 228, win 916, options [nop,nop,TS val 31486 ecr 253102,mptcp dss fin ack 116031388 seq 2376860715 subseq 0 len 1 csum 0xaaaf], length 0
17:03:39.843276 IP 112.26.3.1.targus-getdata1 > 112.26.3.8.33535: Flags [.], ack 220, win 4017, options [nop,nop,TS val 253371 ecr 31486,mptcp dss ack 2376860716], length 0
17:03:39.845191 IP 112.26.3.1.targus-getdata1 > 112.26.3.8.33535: Flags [.], ack 220, win 4017, options [nop,nop,TS val 253371 ecr 31486,mptcp dss ack 2376860716], length 0
17:03:39.857634 IP 112.26.3.8.33535 > 112.26.3.1.targus-getdata1: Flags [.], ack 229, win 916, options [nop,nop,TS val 31584 ecr 253280,mptcp dss ack 116031389], length 0
17:03:39.860213 IP 112.26.3.8.33535 > 112.26.3.1.targus-getdata1: Flags [F.], seq 220, ack 229, win 916, options [nop,nop,TS val 31688 ecr 253280,mptcp dss ack 116031389], length 0
17:03:39.860529 IP 112.26.3.8.33535 > 112.26.3.1.targus-getdata1: Flags [F.], seq 220, ack 229, win 916, options [nop,nop,TS val 31688 ecr 253280,mptcp dss ack 116031389], length 0
17:03:39.951612 IP 112.26.3.8.33535 > 112.26.3.1.targus-getdata1: Flags [F.], seq 220, ack 229, win 916, options [nop,nop,TS val 31688 ecr 253280,mptcp dss ack 116031389], length 0
17:03:40.016568 IP 112.26.3.1.targus-getdata1 > 112.26.3.8.33535: Flags [.], ack 221, win 4017, options [nop,nop,TS val 253499 ecr 31688,mptcp dss ack 2376860716], length 0
17:03:40.019328 IP 112.26.3.1.targus-getdata1 > 112.26.3.8.33535: Flags [.], ack 221, win 4017, options [nop,nop,TS val 253499 ecr 31688,mptcp dss ack 2376860716], length 0

