17:00:34.827687 IP 112.26.2.8.48913 > 112.26.2.1.targus-getdata1: Flags [S], seq 844081511, win 29200, options [mss 1460,sackOK,TS val 4294813938 ecr 0,nop,wscale 7,mptcp join id 4 token 0xb697b9d8 nonce 0xce3bd09d], length 0
17:00:34.925510 IP 112.26.2.8.48913 > 112.26.2.1.targus-getdata1: Flags [S], seq 844081511, win 29200, options [mss 1460,sackOK,TS val 4294813938 ecr 0,nop,wscale 7,mptcp join id 4 token 0xb697b9d8 nonce 0xce3bd09d], length 0
17:00:34.988073 IP 112.26.2.8.48913 > 112.26.2.1.targus-getdata1: Flags [S], seq 844081511, win 29200, options [mss 1460,sackOK,TS val 4294813938 ecr 0,nop,wscale 7,mptcp join id 4 token 0xb697b9d8 nonce 0xce3bd09d], length 0
17:00:35.059810 IP 112.26.2.8.48913 > 112.26.2.1.targus-getdata1: Flags [S], seq 844081511, win 29200, options [mss 1460,sackOK,TS val 4294813938 ecr 0,nop,wscale 7,mptcp join id 4 token 0xb697b9d8 nonce 0xce3bd09d], length 0
17:00:35.172185 IP 112.26.2.1.targus-getdata1 > 112.26.2.8.48913: Flags [S.], seq 2785160212, ack 844081512, win 65535, options [mss 1460,sackOK,TS val 68608 ecr 4294813938,nop,wscale 6,mptcp join id 6 hmac 0x2ce8a16ede77d8a3 nonce 0xfd3fd87c], length 0
17:00:35.174253 IP 112.26.2.1.targus-getdata1 > 112.26.2.8.48913: Flags [S.], seq 2785160212, ack 844081512, win 65535, options [mss 1460,sackOK,TS val 68608 ecr 4294813938,nop,wscale 6,mptcp join id 6 hmac 0x2ce8a16ede77d8a3 nonce 0xfd3fd87c], length 0
17:00:35.176384 IP 112.26.2.8.48913 > 112.26.2.1.targus-getdata1: Flags [.], ack 1, win 685, options [nop,nop,TS val 4294814313 ecr 68608,mptcp join hmac 0x101998dfcdcfd4ab411f9dc0f51d8f4addf56090], length 0
17:01:17.936694 IP 112.26.2.8.45243 > 112.26.2.1.targus-getdata1: Flags [.], seq 3041231867:3041233295, ack 2387809400, win 685, options [nop,nop,TS val 4294856650 ecr 110278,mptcp dss ack 1375043541 seq 3984393627 subseq 368425 len 1428 csum 0xf0a9], length 1428
17:01:17.939356 IP 112.26.2.8.45243 > 112.26.2.1.targus-getdata1: Flags [.], seq 4294965868:0, ack 1, win 685, options [nop,nop,TS val 4294856527 ecr 110200,mptcp dss ack 1375043541 seq 3984390771 subseq 366997 len 1428 csum 0xf042], length 1428
17:01:17.999381 IP 112.26.2.8.45243 > 112.26.2.1.targus-getdata1: Flags [.], seq 0:1428, ack 1, win 685, options [nop,nop,TS val 4294856650 ecr 110278,mptcp dss ack 1375043541 seq 3984393627 subseq 368425 len 1428 csum 0xf0a9], length 1428
17:01:18.003187 IP 112.26.2.1.targus-getdata1 > 112.26.2.8.45243: Flags [.], ack 4294945876, win 24215, options [nop,nop,TS val 110830 ecr 4294854830,nop,nop,sack 2 {4294953016:4294963012}{4294947304:4294951588},mptcp dss ack 3984270819], length 0
17:01:18.008250 IP 112.26.2.8.45243 > 112.26.2.1.targus-getdata1: Flags [.], seq 5712:7140, ack 1, win 685, options [nop,nop,TS val 4294857141 ecr 110766,mptcp dss ack 1375043541 seq 3984412191 subseq 374137 len 1428 csum 0xeaa4], length 1428
17:01:18.052602 IP 112.26.2.1.targus-getdata1 > 112.26.2.8.45243: Flags [.], ack 0, win 24471, options [nop,nop,TS val 111487 ecr 4294856527,mptcp dss ack 3984357927], length 0
17:01:18.071934 IP 112.26.2.8.45243 > 112.26.2.1.targus-getdata1: Flags [.], seq 7140:8568, ack 1, win 685, options [nop,nop,TS val 4294857156 ecr 110830,mptcp dss ack 1375043541 seq 3984413619 subseq 375565 len 1428 csum 0x68fd], length 1428
17:01:18.075552 IP 112.26.2.8.45243 > 112.26.2.1.targus-getdata1: Flags [.], seq 1428:2856, ack 1, win 685, options [nop,nop,TS val 4294856693 ecr 110343,mptcp dss ack 1375043541 seq 3984395055 subseq 369853 len 1428 csum 0x8c74], length 1428
17:01:18.106398 IP 112.26.2.1.targus-getdata1 > 112.26.2.8.45243: Flags [.], ack 1428, win 24486, options [nop,nop,TS val 111547 ecr 4294856650,mptcp dss ack 3984362211], length 0
17:01:18.128871 IP 112.26.2.8.45243 > 112.26.2.1.targus-getdata1: Flags [.], seq 1428:2856, ack 1, win 685, options [nop,nop,TS val 4294856693 ecr 110343,mptcp dss ack 1375043541 seq 3984395055 subseq 369853 len 1428 csum 0x8c74], length 1428
17:01:18.146799 IP 112.26.2.1.targus-getdata1 > 112.26.2.8.45243: Flags [.], ack 4294945876, win 24215, options [nop,nop,TS val 110945 ecr 4294854830,nop,nop,sack 2 {4294953016:4294964440}{4294947304:4294951588},mptcp dss ack 3984270819], length 0
17:01:18.162965 IP 112.26.2.1.targus-getdata1 > 112.26.2.8.45243: Flags [.], ack 2856, win 24420, options [nop,nop,TS val 111674 ecr 4294856693,mptcp dss ack 3984366495], length 0
17:01:18.180061 IP 112.26.2.8.45243 > 112.26.2.1.targus-getdata1: Flags [.], seq 8568:9996, ack 1, win 685, options [nop,nop,TS val 4294857311 ecr 110945,mptcp dss ack 1375043541 seq 3984420759 subseq 376993 len 1428 csum 0x8b40], length 1428
17:01:18.209691 IP 112.26.2.8.45243 > 112.26.2.1.targus-getdata1: Flags [.], seq 2856:4284, ack 1, win 685, options [nop,nop,TS val 4294856812 ecr 110437,mptcp dss ack 1375043541 seq 3984399339 subseq 371281 len 1428 csum 0x76a8], length 1428
17:01:18.228035 IP 112.26.2.8.45243 > 112.26.2.1.targus-getdata1: Flags [.], seq 2856:4284, ack 1, win 685, options [nop,nop,TS val 4294856812 ecr 110437,mptcp dss ack 1375043541 seq 3984399339 subseq 371281 len 1428 csum 0x76a8], length 1428
17:01:18.254487 IP 112.26.2.1.targus-getdata1 > 112.26.2.8.45243: Flags [.], ack 4284, win 24420, options [nop,nop,TS val 111776 ecr 4294856812,mptcp dss ack 3984366495], length 0
17:01:18.278251 IP 112.26.2.1.targus-getdata1 > 112.26.2.8.45243: Flags [.], ack 4294951588, win 24182, options [nop,nop,TS val 111051 ecr 4294855960,nop,nop,sack 1 {4294953016:4294964440},mptcp dss ack 3984310803], length 0
17:01:18.282264 IP 112.26.2.8.45243 > 112.26.2.1.targus-getdata1: Flags [.], seq 9996:11424, ack 1, win 685, options [nop,nop,TS val 4294857416 ecr 111051,mptcp dss ack 1375043541 seq 3984427899 subseq 378421 len 1428 csum 0xc9f1], length 1428
17:01:18.353908 IP 112.26.2.1.targus-getdata1 > 112.26.2.8.45243: Flags [.], ack 4294951588, win 24262, options [nop,nop,TS val 111200 ecr 4294855960,nop,nop,sack 1 {4294953016:4294965868},mptcp dss ack 3984310803], length 0
17:01:18.377510 IP 112.26.2.8.45243 > 112.26.2.1.targus-getdata1: Flags [.], seq 11424:12852, ack 1, win 685, options [nop,nop,TS val 4294857511 ecr 111200,mptcp dss ack 1375043541 seq 3984430755 subseq 379849 len 1428 csum 0x5ef2], length 1428
17:01:18.382820 IP 112.26.2.8.45243 > 112.26.2.1.targus-getdata1: Flags [.], seq 4284:5712, ack 1, win 685, options [nop,nop,TS val 4294856988 ecr 110699,mptcp dss ack 1375043541 seq 3984406479 subseq 372709 len 1428 csum 0x4e2d], length 1428
17:01:18.386213 IP 112.26.2.8.45243 > 112.26.2.1.targus-getdata1: Flags [.], seq 4284:5712, ack 1, win 685, options [nop,nop,TS val 4294856988 ecr 110699,mptcp dss ack 1375043541 seq 3984406479 subseq 372709 len 1428 csum 0x4e2d], length 1428
17:01:18.452373 IP 112.26.2.1.targus-getdata1 > 112.26.2.8.45243: Flags [.], ack 4294965868, win 24262, options [nop,nop,TS val 111351 ecr 4294856433,mptcp dss ack 3984310803], length 0
17:01:18.456228 IP 112.26.2.8.45243 > 112.26.2.1.targus-getdata1: Flags [.], seq 12852:14280, ack 1, win 685, options [nop,nop,TS val 4294857591 ecr 111351,mptcp dss ack 1375043541 seq 3984433611 subseq 381277 len 1428 csum 0x69c0], length 1428
17:01:18.465212 IP 112.26.2.1.targus-getdata1 > 112.26.2.8.45243: Flags [.], ack 5712, win 24420, options [nop,nop,TS val 111934 ecr 4294856988,mptcp dss ack 3984366495], length 0
17:01:18.497647 IP 112.26.2.8.45243 > 112.26.2.1.targus-getdata1: Flags [.], seq 5712:7140, ack 1, win 685, options [nop,nop,TS val 4294857141 ecr 110766,mptcp dss ack 1375043541 seq 3984412191 subseq 374137 len 1428 csum 0xeaa4], length 1428
17:01:18.503697 IP 112.26.2.8.45243 > 112.26.2.1.targus-getdata1: Flags [.], seq 5712:7140, ack 1, win 685, options [nop,nop,TS val 4294857141 ecr 110766,mptcp dss ack 1375043541 seq 3984412191 subseq 374137 len 1428 csum 0xeaa4], length 1428
17:01:18.564085 IP 112.26.2.1.targus-getdata1 > 112.26.2.8.45243: Flags [.], ack 7140, win 24420, options [nop,nop,TS val 112051 ecr 4294857141,mptcp dss ack 3984366495], length 0
17:01:18.583238 IP 112.26.2.1.targus-getdata1 > 112.26.2.8.45243: Flags [.], ack 0, win 24471, options [nop,nop,TS val 111487 ecr 4294856527,mptcp dss ack 3984357927], length 0
17:01:18.585909 IP 112.26.2.8.45243 > 112.26.2.1.targus-getdata1: Flags [.], seq 14280:15708, ack 1, win 685, options [nop,nop,TS val 4294857721 ecr 111487,mptcp dss ack 1375043541 seq 3984439323 subseq 382705 len 1428 csum 0xed24], length 1428
17:01:18.616411 IP 112.26.2.8.45243 > 112.26.2.1.targus-getdata1: Flags [.], seq 7140:8568, ack 1, win 685, options [nop,nop,TS val 4294857156 ecr 110830,mptcp dss ack 1375043541 seq 3984413619 subseq 375565 len 1428 csum 0x68fd], length 1428
17:01:18.618151 IP 112.26.2.8.45243 > 112.26.2.1.targus-getdata1: Flags [.], seq 7140:8568, ack 1, win 685, options [nop,nop,TS val 4294857156 ecr 110830,mptcp dss ack 1375043541 seq 3984413619 subseq 375565 len 1428 csum 0x68fd], length 1428
17:01:18.693626 IP 112.26.2.1.targus-getdata1 > 112.26.2.8.45243: Flags [.], ack 2856, win 24420, options [nop,nop,TS val 111674 ecr 4294856693,mptcp dss ack 3984366495], length 0
17:01:18.701726 IP 112.26.2.1.targus-getdata1 > 112.26.2.8.45243: Flags [.], ack 8568, win 24420, options [nop,nop,TS val 112166 ecr 4294857156,mptcp dss ack 3984366495], length 0
17:01:18.706647 IP 112.26.2.8.45243 > 112.26.2.1.targus-getdata1: Flags [.], seq 15708:17136, ack 1, win 685, options [nop,nop,TS val 4294857831 ecr 111674,mptcp dss ack 1375043541 seq 3984443607 subseq 384133 len 1428 csum 0x71c5], length 1428
17:01:18.744055 IP 112.26.2.8.45243 > 112.26.2.1.targus-getdata1: Flags [.], seq 8568:9996, ack 1, win 685, options [nop,nop,TS val 4294857311 ecr 110945,mptcp dss ack 1375043541 seq 3984420759 subseq 376993 len 1428 csum 0x8b40], length 1428
17:01:18.747621 IP 112.26.2.8.45243 > 112.26.2.1.targus-getdata1: Flags [.], seq 8568:9996, ack 1, win 685, options [nop,nop,TS val 4294857311 ecr 110945,mptcp dss ack 1375043541 seq 3984420759 subseq 376993 len 1428 csum 0x8b40], length 1428
17:01:18.765904 IP 112.26.2.8.45243 > 112.26.2.1.targus-getdata1: Flags [.], seq 17136:18564, ack 1, win 685, options [nop,nop,TS val 4294857831 ecr 111674,mptcp dss ack 1375043541 seq 3984445035 subseq 385561 len 1428 csum 0xeea3], length 1428
17:01:18.803231 IP 112.26.2.1.targus-getdata1 > 112.26.2.8.45243: Flags [.], ack 9996, win 24420, options [nop,nop,TS val 112295 ecr 4294857311,mptcp dss ack 3984366495], length 0
17:01:18.823849 IP 112.26.2.1.targus-getdata1 > 112.26.2.8.45243: Flags [.], ack 4284, win 24420, options [nop,nop,TS val 111776 ecr 4294856812,mptcp dss ack 3984366495], length 0
17:01:18.835645 IP 112.26.2.8.45243 > 112.26.2.1.targus-getdata1: Flags [.], seq 18564:19992, ack 1, win 685, options [nop,nop,TS val 4294857962 ecr 111776,mptcp dss ack 1375043541 seq 3984452175 subseq 386989 len 1428 csum 0x1518], length 1428
17:01:18.861131 IP 112.26.2.8.45243 > 112.26.2.1.targus-getdata1: Flags [.], seq 19992:21420, ack 1, win 685, options [nop,nop,TS val 4294857962 ecr 111776,mptcp dss ack 1375043541 seq 3984453603 subseq 388417 len 1428 csum 0xe4cc], length 1428
17:01:18.863005 IP 112.26.2.8.45243 > 112.26.2.1.targus-getdata1: Flags [.], seq 9996:11424, ack 1, win 685, options [nop,nop,TS val 4294857416 ecr 111051,mptcp dss ack 1375043541 seq 3984427899 subseq 378421 len 1428 csum 0xc9f1], length 1428
17:01:18.884018 IP 112.26.2.8.45243 > 112.26.2.1.targus-getdata1: Flags [.], seq 9996:11424, ack 1, win 685, options [nop,nop,TS val 4294857416 ecr 111051,mptcp dss ack 1375043541 seq 3984427899 subseq 378421 len 1428 csum 0xc9f1], length 1428
17:01:18.930654 IP 112.26.2.8.45243 > 112.26.2.1.targus-getdata1: Flags [.], seq 11424:12852, ack 1, win 685, options [nop,nop,TS val 4294857511 ecr 111200,mptcp dss ack 1375043541 seq 3984430755 subseq 379849 len 1428 csum 0x5ef2], length 1428
17:01:18.936266 IP 112.26.2.1.targus-getdata1 > 112.26.2.8.45243: Flags [.], ack 11424, win 24420, options [nop,nop,TS val 112417 ecr 4294857416,mptcp dss ack 3984366495], length 0
17:01:18.972359 IP 112.26.2.8.45243 > 112.26.2.1.targus-getdata1: Flags [.], seq 11424:12852, ack 1, win 685, options [nop,nop,TS val 4294857511 ecr 111200,mptcp dss ack 1375043541 seq 3984430755 subseq 379849 len 1428 csum 0x5ef2], length 1428
17:01:18.982287 IP 112.26.2.8.45243 > 112.26.2.1.targus-getdata1: Flags [.], seq 12852:14280, ack 1, win 685, options [nop,nop,TS val 4294857591 ecr 111351,mptcp dss ack 1375043541 seq 3984433611 subseq 381277 len 1428 csum 0x69c0], length 1428
17:01:19.056627 IP 112.26.2.1.targus-getdata1 > 112.26.2.8.45243: Flags [.], ack 5712, win 24420, options [nop,nop,TS val 111934 ecr 4294856988,mptcp dss ack 3984366495], length 0
17:01:19.059095 IP 112.26.2.8.45243 > 112.26.2.1.targus-getdata1: Flags [.], seq 21420:22848, ack 1, win 685, options [nop,nop,TS val 4294858195 ecr 111934,mptcp dss ack 1375043541 seq 3984459315 subseq 389845 len 1428 csum 0x8d70], length 1428
17:01:19.065859 IP 112.26.2.1.targus-getdata1 > 112.26.2.8.45243: Flags [.], ack 12852, win 24420, options [nop,nop,TS val 112520 ecr 4294857511,mptcp dss ack 3984366495], length 0
17:01:19.105719 IP 112.26.2.1.targus-getdata1 > 112.26.2.8.45243: Flags [.], ack 7140, win 24420, options [nop,nop,TS val 112051 ecr 4294857141,mptcp dss ack 3984366495], length 0
17:01:19.115783 IP 112.26.2.8.45243 > 112.26.2.1.targus-getdata1: Flags [.], seq 12852:14280, ack 1, win 685, options [nop,nop,TS val 4294857591 ecr 111351,mptcp dss ack 1375043541 seq 3984433611 subseq 381277 len 1428 csum 0x69c0], length 1428
17:01:19.137561 IP 112.26.2.8.45243 > 112.26.2.1.targus-getdata1: Flags [.], seq 22848:24276, ack 1, win 685, options [nop,nop,TS val 4294858244 ecr 112051,mptcp dss ack 1375043541 seq 3984460743 subseq 391273 len 1428 csum 0x543e], length 1428
17:01:19.181213 IP 112.26.2.8.45243 > 112.26.2.1.targus-getdata1: Flags [.], seq 14280:15708, ack 1, win 685, options [nop,nop,TS val 4294857721 ecr 111487,mptcp dss ack 1375043541 seq 3984439323 subseq 382705 len 1428 csum 0xed24], length 1428
17:01:19.207211 IP 112.26.2.1.targus-getdata1 > 112.26.2.8.45243: Flags [.], ack 14280, win 24420, options [nop,nop,TS val 112663 ecr 4294857591,mptcp dss ack 3984366495], length 0
17:01:19.236357 IP 112.26.2.1.targus-getdata1 > 112.26.2.8.45243: Flags [.], ack 8568, win 24420, options [nop,nop,TS val 112166 ecr 4294857156,mptcp dss ack 3984366495], length 0
17:01:19.239366 IP 112.26.2.8.45243 > 112.26.2.1.targus-getdata1: Flags [.], seq 24276:25704, ack 1, win 685, options [nop,nop,TS val 4294858374 ecr 112166,mptcp dss ack 1375043541 seq 3984463599 subseq 392701 len 1428 csum 0x4cfd], length 1428
17:01:19.257249 IP 112.26.2.8.45243 > 112.26.2.1.targus-getdata1: Flags [.], seq 14280:15708, ack 1, win 685, options [nop,nop,TS val 4294857721 ecr 111487,mptcp dss ack 1375043541 seq 3984439323 subseq 382705 len 1428 csum 0xed24], length 1428
17:01:19.309547 IP 112.26.2.8.45243 > 112.26.2.1.targus-getdata1: Flags [.], seq 15708:17136, ack 1, win 685, options [nop,nop,TS val 4294857831 ecr 111674,mptcp dss ack 1375043541 seq 3984443607 subseq 384133 len 1428 csum 0x71c5], length 1428
17:01:19.336885 IP 112.26.2.1.targus-getdata1 > 112.26.2.8.45243: Flags [.], ack 15708, win 24420, options [nop,nop,TS val 112803 ecr 4294857721,mptcp dss ack 3984366495], length 0
17:01:19.341760 IP 112.26.2.8.45243 > 112.26.2.1.targus-getdata1: Flags [.], seq 17136:18564, ack 1, win 685, options [nop,nop,TS val 4294857831 ecr 111674,mptcp dss ack 1375043541 seq 3984445035 subseq 385561 len 1428 csum 0xeea3], length 1428
17:01:19.386496 IP 112.26.2.1.targus-getdata1 > 112.26.2.8.45243: Flags [.], ack 9996, win 24420, options [nop,nop,TS val 112295 ecr 4294857311,mptcp dss ack 3984366495], length 0
17:01:19.390708 IP 112.26.2.8.45243 > 112.26.2.1.targus-getdata1: Flags [.], seq 25704:27132, ack 1, win 685, options [nop,nop,TS val 4294858524 ecr 112295,mptcp dss ack 1375043541 seq 3984467883 subseq 394129 len 1428 csum 0x3b4c], length 1428
17:01:19.405108 IP 112.26.2.8.45243 > 112.26.2.1.targus-getdata1: Flags [.], seq 15708:17136, ack 1, win 685, options [nop,nop,TS val 4294857831 ecr 111674,mptcp dss ack 1375043541 seq 3984443607 subseq 384133 len 1428 csum 0x71c5], length 1428
17:01:19.458623 IP 112.26.2.8.45243 > 112.26.2.1.targus-getdata1: Flags [.], seq 17136:18564, ack 1, win 685, options [nop,nop,TS val 4294857831 ecr 111674,mptcp dss ack 1375043541 seq 3984445035 subseq 385561 len 1428 csum 0xeea3], length 1428
17:01:19.482416 IP 112.26.2.8.45243 > 112.26.2.1.targus-getdata1: Flags [.], seq 19992:21420, ack 1, win 685, options [nop,nop,TS val 4294857962 ecr 111776,mptcp dss ack 1375043541 seq 3984453603 subseq 388417 len 1428 csum 0xe4cc], length 1428
17:01:19.516110 IP 112.26.2.1.targus-getdata1 > 112.26.2.8.45243: Flags [.], ack 11424, win 24420, options [nop,nop,TS val 112417 ecr 4294857416,mptcp dss ack 3984366495], length 0
17:01:19.518875 IP 112.26.2.8.45243 > 112.26.2.1.targus-getdata1: Flags [.], seq 27132:28560, ack 1, win 685, options [nop,nop,TS val 4294858654 ecr 112417,mptcp dss ack 1375043541 seq 3984472167 subseq 395557 len 1428 csum 0x46d3], length 1428
17:01:19.523433 IP 112.26.2.1.targus-getdata1 > 112.26.2.8.45243: Flags [.], ack 17136, win 24453, options [nop,nop,TS val 112949 ecr 4294857831,mptcp dss ack 3984419331], length 0
17:01:19.583101 IP 112.26.2.1.targus-getdata1 > 112.26.2.8.45243: Flags [.], ack 18564, win 24453, options [nop,nop,TS val 113006 ecr 4294857831,mptcp dss ack 3984419331], length 0
17:01:19.595410 IP 112.26.2.8.45243 > 112.26.2.1.targus-getdata1: Flags [.], seq 21420:22848, ack 1, win 685, options [nop,nop,TS val 4294858195 ecr 111934,mptcp dss ack 1375043541 seq 3984459315 subseq 389845 len 1428 csum 0x8d70], length 1428
17:01:19.621986 IP 112.26.2.1.targus-getdata1 > 112.26.2.8.45243: Flags [.], ack 12852, win 24420, options [nop,nop,TS val 112520 ecr 4294857511,mptcp dss ack 3984366495], length 0
17:01:19.651448 IP 112.26.2.8.45243 > 112.26.2.1.targus-getdata1: Flags [.], seq 19992:21420, ack 1, win 685, options [nop,nop,TS val 4294857962 ecr 111776,mptcp dss ack 1375043541 seq 3984453603 subseq 388417 len 1428 csum 0xe4cc], length 1428
17:01:19.665143 IP 112.26.2.8.45243 > 112.26.2.1.targus-getdata1: Flags [.], seq 28560:29988, ack 1, win 685, options [nop,nop,TS val 4294858760 ecr 112520,mptcp dss ack 1375043541 seq 3984476451 subseq 396985 len 1428 csum 0x4d40], length 1428
17:01:19.694457 IP 112.26.2.8.45243 > 112.26.2.1.targus-getdata1: Flags [.], seq 21420:22848, ack 1, win 685, options [nop,nop,TS val 4294858195 ecr 111934,mptcp dss ack 1375043541 seq 3984459315 subseq 389845 len 1428 csum 0x8d70], length 1428
17:01:19.695222 IP 112.26.2.8.45243 > 112.26.2.1.targus-getdata1: Flags [.], seq 29988:31416, ack 1, win 685, options [nop,nop,TS val 4294858760 ecr 112520,mptcp dss ack 1375043541 seq 3984477879 subseq 398413 len 1428 csum 0xe083], length 1428
17:01:19.722286 IP 112.26.2.8.45243 > 112.26.2.1.targus-getdata1: Flags [.], seq 22848:24276, ack 1, win 685, options [nop,nop,TS val 4294858244 ecr 112051,mptcp dss ack 1375043541 seq 3984460743 subseq 391273 len 1428 csum 0x543e], length 1428
17:01:19.760837 IP 112.26.2.1.targus-getdata1 > 112.26.2.8.45243: Flags [.], ack 18564, win 24543, options [nop,nop,TS val 113175 ecr 4294857831,nop,nop,sack 1 {19992:21420},mptcp dss ack 3984442179], length 0
17:01:19.784336 IP 112.26.2.1.targus-getdata1 > 112.26.2.8.45243: Flags [.], ack 14280, win 24420, options [nop,nop,TS val 112663 ecr 4294857591,mptcp dss ack 3984366495], length 0
17:01:19.788624 IP 112.26.2.8.45243 > 112.26.2.1.targus-getdata1: Flags [.], seq 31416:32844, ack 1, win 685, options [nop,nop,TS val 4294858922 ecr 112663,mptcp dss ack 1375043541 seq 3984483591 subseq 399841 len 1428 csum 0x17b8], length 1428
17:01:19.830985 IP 112.26.2.1.targus-getdata1 > 112.26.2.8.45243: Flags [.], ack 18564, win 24543, options [nop,nop,TS val 113240 ecr 4294857831,nop,nop,sack 1 {19992:22848},mptcp dss ack 3984442179], length 0
17:01:19.832689 IP 112.26.2.8.45243 > 112.26.2.1.targus-getdata1: Flags [.], seq 24276:25704, ack 1, win 685, options [nop,nop,TS val 4294858374 ecr 112166,mptcp dss ack 1375043541 seq 3984463599 subseq 392701 len 1428 csum 0x4cfd], length 1428
17:01:19.882540 IP 112.26.2.8.45243 > 112.26.2.1.targus-getdata1: Flags [.], seq 22848:24276, ack 1, win 685, options [nop,nop,TS val 4294858244 ecr 112051,mptcp dss ack 1375043541 seq 3984460743 subseq 391273 len 1428 csum 0x543e], length 1428
17:01:19.901298 IP 112.26.2.1.targus-getdata1 > 112.26.2.8.45243: Flags [.], ack 15708, win 24420, options [nop,nop,TS val 112803 ecr 4294857721,mptcp dss ack 3984366495], length 0
17:01:19.904066 IP 112.26.2.8.45243 > 112.26.2.1.targus-getdata1: Flags [.], seq 32844:34272, ack 1, win 685, options [nop,nop,TS val 4294859039 ecr 112803,mptcp dss ack 1375043541 seq 3984487875 subseq 401269 len 1428 csum 0xcbb5], length 1428
17:01:19.950756 IP 112.26.2.8.45243 > 112.26.2.1.targus-getdata1: Flags [.], seq 24276:25704, ack 1, win 685, options [nop,nop,TS val 4294858374 ecr 112166,mptcp dss ack 1375043541 seq 3984463599 subseq 392701 len 1428 csum 0x4cfd], length 1428
17:01:19.968428 IP 112.26.2.8.45243 > 112.26.2.1.targus-getdata1: Flags [.], seq 25704:27132, ack 1, win 685, options [nop,nop,TS val 4294858524 ecr 112295,mptcp dss ack 1375043541 seq 3984467883 subseq 394129 len 1428 csum 0x3b4c], length 1428
17:01:19.994558 IP 112.26.2.8.45243 > 112.26.2.1.targus-getdata1: Flags [.], seq 27132:28560, ack 1, win 685, options [nop,nop,TS val 4294858654 ecr 112417,mptcp dss ack 1375043541 seq 3984472167 subseq 395557 len 1428 csum 0x46d3], length 1428
17:01:20.028871 IP 112.26.2.1.targus-getdata1 > 112.26.2.8.45243: Flags [.], ack 18564, win 24522, options [nop,nop,TS val 113430 ecr 4294857831,nop,nop,sack 1 {19992:24276},mptcp dss ack 3984452175], length 0
17:01:20.045006 IP 112.26.2.1.targus-getdata1 > 112.26.2.8.45243: Flags [.], ack 17136, win 24453, options [nop,nop,TS val 112949 ecr 4294857831,mptcp dss ack 3984419331], length 0
17:01:20.052250 IP 112.26.2.8.45243 > 112.26.2.1.targus-getdata1: Flags [.], seq 34272:35700, ack 1, win 685, options [nop,nop,TS val 4294859183 ecr 112949,mptcp dss ack 1375043541 seq 3984492159 subseq 402697 len 1428 csum 0xea19], length 1428
17:01:20.078280 IP 112.26.2.1.targus-getdata1 > 112.26.2.8.45243: Flags [.], ack 18564, win 24522, options [nop,nop,TS val 113498 ecr 4294857831,nop,nop,sack 1 {19992:25704},mptcp dss ack 3984452175], length 0
17:01:20.106447 IP 112.26.2.1.targus-getdata1 > 112.26.2.8.45243: Flags [.], ack 18564, win 24453, options [nop,nop,TS val 113006 ecr 4294857831,mptcp dss ack 3984419331], length 0
17:01:20.108756 IP 112.26.2.8.45243 > 112.26.2.1.targus-getdata1: Flags [.], seq 35700:37128, ack 1, win 685, options [nop,nop,TS val 4294859245 ecr 113006,mptcp dss ack 1375043541 seq 3984496443 subseq 404125 len 1428 csum 0x9038], length 1428
17:01:20.152355 IP 112.26.2.8.45243 > 112.26.2.1.targus-getdata1: Flags [.], seq 25704:27132, ack 1, win 685, options [nop,nop,TS val 4294858524 ecr 112295,mptcp dss ack 1375043541 seq 3984467883 subseq 394129 len 1428 csum 0x3b4c], length 1428
17:01:20.186301 IP 112.26.2.8.45243 > 112.26.2.1.targus-getdata1: Flags [.], seq 28560:29988, ack 1, win 685, options [nop,nop,TS val 4294858760 ecr 112520,mptcp dss ack 1375043541 seq 3984476451 subseq 396985 len 1428 csum 0x4d40], length 1428
17:01:20.195880 IP 112.26.2.8.45243 > 112.26.2.1.targus-getdata1: Flags [.], seq 27132:28560, ack 1, win 685, options [nop,nop,TS val 4294858654 ecr 112417,mptcp dss ack 1375043541 seq 3984472167 subseq 395557 len 1428 csum 0x46d3], length 1428
17:01:20.240259 IP 112.26.2.8.45243 > 112.26.2.1.targus-getdata1: Flags [.], seq 29988:31416, ack 1, win 685, options [nop,nop,TS val 4294858760 ecr 112520,mptcp dss ack 1375043541 seq 3984477879 subseq 398413 len 1428 csum 0xe083], length 1428
17:01:20.275606 IP 112.26.2.1.targus-getdata1 > 112.26.2.8.45243: Flags [.], ack 18564, win 24522, options [nop,nop,TS val 113693 ecr 4294857831,nop,nop,sack 1 {19992:27132},mptcp dss ack 3984452175], length 0
17:01:20.286193 IP 112.26.2.1.targus-getdata1 > 112.26.2.8.45243: Flags [.], ack 18564, win 24543, options [nop,nop,TS val 113175 ecr 4294857831,nop,nop,sack 1 {19992:21420},mptcp dss ack 3984442179], length 0
17:01:20.322145 IP 112.26.2.8.45243 > 112.26.2.1.targus-getdata1: Flags [.], seq 37128:38556, ack 1, win 685, options [nop,nop,TS val 4294859458 ecr 113175,mptcp dss ack 1375043541 seq 3984505011 subseq 405553 len 1428 csum 0xa2ca], length 1428
17:01:20.330455 IP 112.26.2.8.45243 > 112.26.2.1.targus-getdata1: Flags [.], seq 28560:29988, ack 1, win 685, options [nop,nop,TS val 4294858760 ecr 112520,mptcp dss ack 1375043541 seq 3984476451 subseq 396985 len 1428 csum 0x4d40], length 1428
17:01:20.350897 IP 112.26.2.8.45243 > 112.26.2.1.targus-getdata1: Flags [.], seq 31416:32844, ack 1, win 685, options [nop,nop,TS val 4294858922 ecr 112663,mptcp dss ack 1375043541 seq 3984483591 subseq 399841 len 1428 csum 0x17b8], length 1428
17:01:20.403037 IP 112.26.2.1.targus-getdata1 > 112.26.2.8.45243: Flags [.], ack 18564, win 24522, options [nop,nop,TS val 113743 ecr 4294857831,nop,nop,sack 1 {19992:28560},mptcp dss ack 3984452175], length 0
17:01:20.408457 IP 112.26.2.1.targus-getdata1 > 112.26.2.8.45243: Flags [.], ack 18564, win 24543, options [nop,nop,TS val 113240 ecr 4294857831,nop,nop,sack 1 {19992:22848},mptcp dss ack 3984442179], length 0
17:01:20.427466 IP 112.26.2.8.45243 > 112.26.2.1.targus-getdata1: Flags [.], seq 38556:39984, ack 1, win 685, options [nop,nop,TS val 4294859563 ecr 113240,mptcp dss ack 1375043541 seq 3984510723 subseq 406981 len 1428 csum 0x9e], length 1428
17:01:20.450646 IP 112.26.2.8.45243 > 112.26.2.1.targus-getdata1: Flags [.], seq 29988:31416, ack 1, win 685, options [nop,nop,TS val 4294858760 ecr 112520,mptcp dss ack 1375043541 seq 3984477879 subseq 398413 len 1428 csum 0xe083], length 1428
17:01:20.476380 IP 112.26.2.8.45243 > 112.26.2.1.targus-getdata1: Flags [.], seq 32844:34272, ack 1, win 685, options [nop,nop,TS val 4294859039 ecr 112803,mptcp dss ack 1375043541 seq 3984487875 subseq 401269 len 1428 csum 0xcbb5], length 1428
17:01:20.515341 IP 112.26.2.1.targus-getdata1 > 112.26.2.8.45243: Flags [.], ack 18564, win 24522, options [nop,nop,TS val 113874 ecr 4294857831,nop,nop,sack 1 {19992:29988},mptcp dss ack 3984452175], length 0
17:01:20.541877 IP 112.26.2.1.targus-getdata1 > 112.26.2.8.45243: Flags [.], ack 18564, win 24522, options [nop,nop,TS val 113430 ecr 4294857831,nop,nop,sack 1 {19992:24276},mptcp dss ack 3984452175], length 0
17:01:20.566347 IP 112.26.2.8.45243 > 112.26.2.1.targus-getdata1: Flags [.], seq 31416:32844, ack 1, win 685, options [nop,nop,TS val 4294858922 ecr 112663,mptcp dss ack 1375043541 seq 3984483591 subseq 399841 len 1428 csum 0x17b8], length 1428
17:01:20.601565 IP 112.26.2.8.45243 > 112.26.2.1.targus-getdata1: Flags [.], seq 34272:35700, ack 1, win 685, options [nop,nop,TS val 4294859183 ecr 112949,mptcp dss ack 1375043541 seq 3984492159 subseq 402697 len 1428 csum 0xea19], length 1428
17:01:20.630649 IP 112.26.2.1.targus-getdata1 > 112.26.2.8.45243: Flags [.], ack 18564, win 24522, options [nop,nop,TS val 113992 ecr 4294857831,nop,nop,sack 1 {19992:31416},mptcp dss ack 3984452175], length 0
17:01:20.635370 IP 112.26.2.8.45243 > 112.26.2.1.targus-getdata1: Flags [P.], seq 39984:41412, ack 1, win 685, options [nop,nop,TS val 4294859750 ecr 113430,mptcp dss ack 1375043541 seq 3984517863 subseq 408409 len 1428 csum 0x4ea2], length 1428
17:01:20.675912 IP 112.26.2.8.45243 > 112.26.2.1.targus-getdata1: Flags [.], seq 35700:37128, ack 1, win 685, options [nop,nop,TS val 4294859245 ecr 113006,mptcp dss ack 1375043541 seq 3984496443 subseq 404125 len 1428 csum 0x9038], length 1428
17:01:20.684488 IP 112.26.2.8.45243 > 112.26.2.1.targus-getdata1: Flags [.], seq 32844:34272, ack 1, win 685, options [nop,nop,TS val 4294859039 ecr 112803,mptcp dss ack 1375043541 seq 3984487875 subseq 401269 len 1428 csum 0xcbb5], length 1428
17:01:20.724312 IP 112.26.2.1.targus-getdata1 > 112.26.2.8.45243: Flags [.], ack 18564, win 24522, options [nop,nop,TS val 113693 ecr 4294857831,nop,nop,sack 1 {19992:27132},mptcp dss ack 3984452175], length 0
17:01:20.753829 IP 112.26.2.8.45243 > 112.26.2.1.targus-getdata1: Flags [.], seq 41412:42840, ack 1, win 685, options [nop,nop,TS val 4294859883 ecr 113693,mptcp dss ack 1375043541 seq 3984523575 subseq 409837 len 1428 csum 0x7504], length 1428
17:01:20.768610 IP 112.26.2.1.targus-getdata1 > 112.26.2.8.45243: Flags [.], ack 18564, win 24522, options [nop,nop,TS val 114114 ecr 4294857831,nop,nop,sack 1 {19992:32844},mptcp dss ack 3984452175], length 0
17:01:20.798769 IP 112.26.2.8.45243 > 112.26.2.1.targus-getdata1: Flags [.], seq 37128:38556, ack 1, win 685, options [nop,nop,TS val 4294859458 ecr 113175,mptcp dss ack 1375043541 seq 3984505011 subseq 405553 len 1428 csum 0xa2ca], length 1428
17:01:20.817406 IP 112.26.2.8.45243 > 112.26.2.1.targus-getdata1: Flags [.], seq 42840:44268, ack 1, win 685, options [nop,nop,TS val 4294859883 ecr 113693,mptcp dss ack 1375043541 seq 3984525003 subseq 411265 len 1428 csum 0x7f2d], length 1428
17:01:20.829139 IP 112.26.2.8.45243 > 112.26.2.1.targus-getdata1: Flags [.], seq 34272:35700, ack 1, win 685, options [nop,nop,TS val 4294859183 ecr 112949,mptcp dss ack 1375043541 seq 3984492159 subseq 402697 len 1428 csum 0xea19], length 1428
17:01:20.869694 IP 112.26.2.8.45243 > 112.26.2.1.targus-getdata1: Flags [.], seq 35700:37128, ack 1, win 685, options [nop,nop,TS val 4294859245 ecr 113006,mptcp dss ack 1375043541 seq 3984496443 subseq 404125 len 1428 csum 0x9038], length 1428
17:01:20.877410 IP 112.26.2.1.targus-getdata1 > 112.26.2.8.45243: Flags [.], ack 18564, win 24522, options [nop,nop,TS val 113743 ecr 4294857831,nop,nop,sack 1 {19992:28560},mptcp dss ack 3984452175], length 0
17:01:20.906823 IP 112.26.2.8.45243 > 112.26.2.1.targus-getdata1: Flags [.], seq 38556:39984, ack 1, win 685, options [nop,nop,TS val 4294859563 ecr 113240,mptcp dss ack 1375043541 seq 3984510723 subseq 406981 len 1428 csum 0x9e], length 1428
17:01:20.927441 IP 112.26.2.1.targus-getdata1 > 112.26.2.8.45243: Flags [.], ack 18564, win 24522, options [nop,nop,TS val 114232 ecr 4294857831,nop,nop,sack 1 {19992:34272},mptcp dss ack 3984452175], length 0
17:01:20.943492 IP 112.26.2.8.45243 > 112.26.2.1.targus-getdata1: Flags [.], seq 44268:45696, ack 1, win 685, options [nop,nop,TS val 4294860067 ecr 113743,mptcp dss ack 1375043541 seq 3984529287 subseq 412693 len 1428 csum 0xb41e], length 1428
17:01:20.953070 IP 112.26.2.1.targus-getdata1 > 112.26.2.8.45243: Flags [.], ack 18564, win 24522, options [nop,nop,TS val 113874 ecr 4294857831,nop,nop,sack 1 {19992:29988},mptcp dss ack 3984452175], length 0
17:01:21.001027 IP 112.26.2.8.45243 > 112.26.2.1.targus-getdata1: Flags [.], seq 37128:38556, ack 1, win 685, options [nop,nop,TS val 4294859458 ecr 113175,mptcp dss ack 1375043541 seq 3984505011 subseq 405553 len 1428 csum 0xa2ca], length 1428
17:01:21.014690 IP 112.26.2.8.45243 > 112.26.2.1.targus-getdata1: Flags [.], seq 45696:47124, ack 1, win 685, options [nop,nop,TS val 4294860100 ecr 113874,mptcp dss ack 1375043541 seq 3984532143 subseq 414121 len 1428 csum 0xc0df], length 1428
17:01:21.045688 IP 112.26.2.1.targus-getdata1 > 112.26.2.8.45243: Flags [.], ack 18564, win 24522, options [nop,nop,TS val 113992 ecr 4294857831,nop,nop,sack 1 {19992:31416},mptcp dss ack 3984452175], length 0
17:01:21.063968 IP 112.26.2.1.targus-getdata1 > 112.26.2.8.45243: Flags [.], ack 18564, win 24522, options [nop,nop,TS val 114355 ecr 4294857831,nop,nop,sack 1 {19992:35700},mptcp dss ack 3984452175], length 0
17:01:21.080432 IP 112.26.2.8.45243 > 112.26.2.1.targus-getdata1: Flags [.], seq 47124:48552, ack 1, win 685, options [nop,nop,TS val 4294860214 ecr 113992,mptcp dss ack 1375043541 seq 3984534999 subseq 415549 len 1428 csum 0x239c], length 1428
17:01:21.102968 IP 112.26.2.8.45243 > 112.26.2.1.targus-getdata1: Flags [P.], seq 39984:41412, ack 1, win 685, options [nop,nop,TS val 4294859750 ecr 113430,mptcp dss ack 1375043541 seq 3984517863 subseq 408409 len 1428 csum 0x4ea2], length 1428
17:01:21.126995 IP 112.26.2.1.targus-getdata1 > 112.26.2.8.45243: Flags [.], ack 18564, win 24522, options [nop,nop,TS val 114417 ecr 4294857831,nop,nop,sack 1 {19992:37128},mptcp dss ack 3984452175], length 0
17:01:21.142793 IP 112.26.2.8.45243 > 112.26.2.1.targus-getdata1: Flags [.], seq 18564:19992, ack 1, win 685, options [nop,nop,TS val 4294860224 ecr 113992,mptcp dss ack 1375043541 seq 3984452175 subseq 386989 len 1428 csum 0x1518], length 1428
17:01:21.163212 IP 112.26.2.8.45243 > 112.26.2.1.targus-getdata1: Flags [.], seq 41412:42840, ack 1, win 685, options [nop,nop,TS val 4294859883 ecr 113693,mptcp dss ack 1375043541 seq 3984523575 subseq 409837 len 1428 csum 0x7504], length 1428
17:01:21.179217 IP 112.26.2.8.45243 > 112.26.2.1.targus-getdata1: Flags [.], seq 38556:39984, ack 1, win 685, options [nop,nop,TS val 4294859563 ecr 113240,mptcp dss ack 1375043541 seq 3984510723 subseq 406981 len 1428 csum 0x9e], length 1428
17:01:21.211685 IP 112.26.2.1.targus-getdata1 > 112.26.2.8.45243: Flags [.], ack 18564, win 24522, options [nop,nop,TS val 114114 ecr 4294857831,nop,nop,sack 1 {19992:32844},mptcp dss ack 3984452175], length 0
17:01:21.258924 IP 112.26.2.1.targus-getdata1 > 112.26.2.8.45243: Flags [.], ack 18564, win 24522, options [nop,nop,TS val 114548 ecr 4294857831,nop,nop,sack 1 {19992:38556},mptcp dss ack 3984452175], length 0
17:01:21.270152 IP 112.26.2.8.45243 > 112.26.2.1.targus-getdata1: Flags [.], seq 42840:44268, ack 1, win 685, options [nop,nop,TS val 4294859883 ecr 113693,mptcp dss ack 1375043541 seq 3984525003 subseq 411265 len 1428 csum 0x7f2d], length 1428
17:01:21.293281 IP 112.26.2.8.45243 > 112.26.2.1.targus-getdata1: Flags [.], seq 48552:49980, ack 1, win 685, options [nop,nop,TS val 4294860427 ecr 114114,mptcp dss ack 1375043541 seq 3984460743 subseq 416977 len 1428 csum 0xefd5], length 1428
17:01:21.312381 IP 112.26.2.8.45243 > 112.26.2.1.targus-getdata1: Flags [P.], seq 39984:41412, ack 1, win 685, options [nop,nop,TS val 4294859750 ecr 113430,mptcp dss ack 1375043541 seq 3984517863 subseq 408409 len 1428 csum 0x4ea2], length 1428
17:01:21.339443 IP 112.26.2.1.targus-getdata1 > 112.26.2.8.45243: Flags [.], ack 18564, win 24522, options [nop,nop,TS val 114232 ecr 4294857831,nop,nop,sack 1 {19992:34272},mptcp dss ack 3984452175], length 0
17:01:21.395025 IP 112.26.2.8.45243 > 112.26.2.1.targus-getdata1: Flags [.], seq 44268:45696, ack 1, win 685, options [nop,nop,TS val 4294860067 ecr 113743,mptcp dss ack 1375043541 seq 3984529287 subseq 412693 len 1428 csum 0xb41e], length 1428
17:01:21.408032 IP 112.26.2.8.45243 > 112.26.2.1.targus-getdata1: Flags [.], seq 41412:42840, ack 1, win 685, options [nop,nop,TS val 4294859883 ecr 113693,mptcp dss ack 1375043541 seq 3984523575 subseq 409837 len 1428 csum 0x7504], length 1428
17:01:21.423263 IP 112.26.2.8.45243 > 112.26.2.1.targus-getdata1: Flags [.], seq 49980:51408, ack 1, win 685, options [nop,nop,TS val 4294860559 ecr 114232,mptcp dss ack 1375043541 seq 3984476451 subseq 418405 len 1428 csum 0xf993], length 1428
17:01:21.439242 IP 112.26.2.1.targus-getdata1 > 112.26.2.8.45243: Flags [.], ack 18564, win 24522, options [nop,nop,TS val 114727 ecr 4294857831,nop,nop,sack 1 {19992:39984},mptcp dss ack 3984452175], length 0
17:01:21.452123 IP 112.26.2.8.45243 > 112.26.2.1.targus-getdata1: Flags [.], seq 45696:47124, ack 1, win 685, options [nop,nop,TS val 4294860100 ecr 113874,mptcp dss ack 1375043541 seq 3984532143 subseq 414121 len 1428 csum 0xc0df], length 1428
17:01:21.501631 IP 112.26.2.8.45243 > 112.26.2.1.targus-getdata1: Flags [.], seq 42840:44268, ack 1, win 685, options [nop,nop,TS val 4294859883 ecr 113693,mptcp dss ack 1375043541 seq 3984525003 subseq 411265 len 1428 csum 0x7f2d], length 1428
17:01:21.537997 IP 112.26.2.1.targus-getdata1 > 112.26.2.8.45243: Flags [.], ack 18564, win 24522, options [nop,nop,TS val 114355 ecr 4294857831,nop,nop,sack 1 {19992:35700},mptcp dss ack 3984452175], length 0
17:01:21.550479 IP 112.26.2.1.targus-getdata1 > 112.26.2.8.45243: Flags [.], ack 18564, win 24522, options [nop,nop,TS val 114860 ecr 4294857831,nop,nop,sack 1 {19992:41412},mptcp dss ack 3984452175], length 0
17:01:21.568610 IP 112.26.2.8.45243 > 112.26.2.1.targus-getdata1: Flags [.], seq 47124:48552, ack 1, win 685, options [nop,nop,TS val 4294860214 ecr 113992,mptcp dss ack 1375043541 seq 3984534999 subseq 415549 len 1428 csum 0x239c], length 1428
17:01:21.613492 IP 112.26.2.1.targus-getdata1 > 112.26.2.8.45243: Flags [.], ack 18564, win 24522, options [nop,nop,TS val 114417 ecr 4294857831,nop,nop,sack 1 {19992:37128},mptcp dss ack 3984452175], length 0
17:01:21.615214 IP 112.26.2.8.45243 > 112.26.2.1.targus-getdata1: Flags [.], seq 51408:52836, ack 1, win 685, options [nop,nop,TS val 4294860751 ecr 114355,mptcp dss ack 1375043541 seq 3984510723 subseq 419833 len 1428 csum 0xce69], length 1428
17:01:21.639106 IP 112.26.2.8.45243 > 112.26.2.1.targus-getdata1: Flags [.], seq 44268:45696, ack 1, win 685, options [nop,nop,TS val 4294860067 ecr 113743,mptcp dss ack 1375043541 seq 3984529287 subseq 412693 len 1428 csum 0xb41e], length 1428
17:01:21.676243 IP 112.26.2.8.45243 > 112.26.2.1.targus-getdata1: Flags [.], seq 18564:19992, ack 1, win 685, options [nop,nop,TS val 4294860224 ecr 113992,mptcp dss ack 1375043541 seq 3984452175 subseq 386989 len 1428 csum 0x1518], length 1428
17:01:21.695232 IP 112.26.2.1.targus-getdata1 > 112.26.2.8.45243: Flags [.], ack 18564, win 24522, options [nop,nop,TS val 114956 ecr 4294857831,nop,nop,sack 1 {19992:42840},mptcp dss ack 3984452175], length 0
17:01:21.740094 IP 112.26.2.1.targus-getdata1 > 112.26.2.8.45243: Flags [.], ack 18564, win 24522, options [nop,nop,TS val 114548 ecr 4294857831,nop,nop,sack 1 {19992:38556},mptcp dss ack 3984452175], length 0
17:01:21.753895 IP 112.26.2.8.45243 > 112.26.2.1.targus-getdata1: Flags [.], seq 45696:47124, ack 1, win 685, options [nop,nop,TS val 4294860100 ecr 113874,mptcp dss ack 1375043541 seq 3984532143 subseq 414121 len 1428 csum 0xc0df], length 1428
17:01:21.790834 IP 112.26.2.8.45243 > 112.26.2.1.targus-getdata1: Flags [.], seq 48552:49980, ack 1, win 685, options [nop,nop,TS val 4294860427 ecr 114114,mptcp dss ack 1375043541 seq 3984460743 subseq 416977 len 1428 csum 0xefd5], length 1428
17:01:21.793187 IP 112.26.2.8.45243 > 112.26.2.1.targus-getdata1: Flags [.], seq 52836:54264, ack 1, win 685, options [nop,nop,TS val 4294860922 ecr 114548,mptcp dss ack 1375043541 seq 3984536427 subseq 421261 len 1428 csum 0x83c4], length 1428
17:01:21.806552 IP 112.26.2.1.targus-getdata1 > 112.26.2.8.45243: Flags [.], ack 18564, win 24522, options [nop,nop,TS val 115049 ecr 4294857831,nop,nop,sack 1 {19992:44268},mptcp dss ack 3984452175], length 0
17:01:21.846197 IP 112.26.2.8.45243 > 112.26.2.1.targus-getdata1: Flags [.], seq 49980:51408, ack 1, win 685, options [nop,nop,TS val 4294860559 ecr 114232,mptcp dss ack 1375043541 seq 3984476451 subseq 418405 len 1428 csum 0xf993], length 1428
17:01:21.870541 IP 112.26.2.8.45243 > 112.26.2.1.targus-getdata1: Flags [.], seq 47124:48552, ack 1, win 685, options [nop,nop,TS val 4294860214 ecr 113992,mptcp dss ack 1375043541 seq 3984534999 subseq 415549 len 1428 csum 0x239c], length 1428
17:01:21.884758 IP 112.26.2.1.targus-getdata1 > 112.26.2.8.45243: Flags [.], ack 18564, win 24522, options [nop,nop,TS val 114727 ecr 4294857831,nop,nop,sack 1 {19992:39984},mptcp dss ack 3984452175], length 0
17:01:21.910079 IP 112.26.2.1.targus-getdata1 > 112.26.2.8.45243: Flags [.], ack 18564, win 24500, options [nop,nop,TS val 115179 ecr 4294857831,nop,nop,sack 1 {19992:45696},mptcp dss ack 3984453603], length 0
