17:00:34.824128 IP 112.26.2.8.48913 > 112.26.2.1.targus-getdata1: Flags [S], seq 844081511, win 29200, options [mss 1460,sackOK,TS val 4294813938 ecr 0,nop,wscale 7,mptcp join id 4 token 0xb697b9d8 nonce 0xce3bd09d], length 0
17:00:34.925626 IP 112.26.2.8.48913 > 112.26.2.1.targus-getdata1: Flags [S], seq 844081511, win 29200, options [mss 1460,sackOK,TS val 4294813938 ecr 0,nop,wscale 7,mptcp join id 4 token 0xb697b9d8 nonce 0xce3bd09d], length 0
17:00:35.174359 IP 112.26.2.1.targus-getdata1 > 112.26.2.8.48913: Flags [S.], seq 2785160212, ack 844081512, win 65535, options [mss 1460,sackOK,TS val 68608 ecr 4294813938,nop,wscale 6,mptcp join id 6 hmac 0x2ce8a16ede77d8a3 nonce 0xfd3fd87c], length 0
17:00:35.174737 IP 112.26.2.8.48913 > 112.26.2.1.targus-getdata1: Flags [.], ack 1, win 685, options [nop,nop,TS val 4294814313 ecr 68608,mptcp join hmac 0x101998dfcdcfd4ab411f9dc0f51d8f4addf56090], length 0
17:00:35.240206 IP 112.26.2.8.48913 > 112.26.2.1.targus-getdata1: Flags [.], ack 1, win 685, options [nop,nop,TS val 4294814313 ecr 68608,mptcp join hmac 0x101998dfcdcfd4ab411f9dc0f51d8f4addf56090], length 0
17:00:35.325221 IP 112.26.2.1.targus-getdata1 > 112.26.2.8.48913: Flags [.], ack 1, win 4017, options [nop,nop,TS val 68799 ecr 4294814313,mptcp dss ack 2376860407], length 0
17:00:35.429083 IP 112.26.2.1.targus-getdata1 > 112.26.2.8.48913: Flags [P.], seq 1:2, ack 1, win 4017, options [nop,nop,TS val 68972 ecr 4294814313,mptcp dss ack 2376860490 seq 116031158 subseq 1 len 1 csum 0x3a1c], length 1
17:01:17.936807 IP 112.26.2.8.45243 > 112.26.2.1.targus-getdata1: Flags [.], seq 3041231867:3041233295, ack 2387809400, win 685, options [nop,nop,TS val 4294856650 ecr 110278,mptcp dss ack 1375043541 seq 3984393627 subseq 368425 len 1428 csum 0xf0a9], length 1428
17:01:18.003296 IP 112.26.2.1.targus-getdata1 > 112.26.2.8.45243: Flags [.], ack 4294945876, win 24215, options [nop,nop,TS val 110830 ecr 4294854830,nop,nop,sack 2 {4294953016:4294963012}{4294947304:4294951588},mptcp dss ack 3984270819], length 0
17:01:18.003478 IP 112.26.2.8.45243 > 112.26.2.1.targus-getdata1: Flags [.], seq 5712:7140, ack 1, win 685, options [nop,nop,TS val 4294857141 ecr 110766,mptcp dss ack 1375043541 seq 3984412191 subseq 374137 len 1428 csum 0xeaa4], length 1428
17:01:18.018889 IP 112.26.2.8.45243 > 112.26.2.1.targus-getdata1: Flags [.], seq 7140:8568, ack 1, win 685, options [nop,nop,TS val 4294857156 ecr 110830,mptcp dss ack 1375043541 seq 3984413619 subseq 375565 len 1428 csum 0x68fd], length 1428
17:01:18.075693 IP 112.26.2.8.45243 > 112.26.2.1.targus-getdata1: Flags [.], seq 1428:2856, ack 1, win 685, options [nop,nop,TS val 4294856693 ecr 110343,mptcp dss ack 1375043541 seq 3984395055 subseq 369853 len 1428 csum 0x8c74], length 1428
17:01:18.146911 IP 112.26.2.1.targus-getdata1 > 112.26.2.8.45243: Flags [.], ack 4294945876, win 24215, options [nop,nop,TS val 110945 ecr 4294854830,nop,nop,sack 2 {4294953016:4294964440}{4294947304:4294951588},mptcp dss ack 3984270819], length 0
17:01:18.173744 IP 112.26.2.8.45243 > 112.26.2.1.targus-getdata1: Flags [.], seq 8568:9996, ack 1, win 685, options [nop,nop,TS val 4294857311 ecr 110945,mptcp dss ack 1375043541 seq 3984420759 subseq 376993 len 1428 csum 0x8b40], length 1428
17:01:18.209809 IP 112.26.2.8.45243 > 112.26.2.1.targus-getdata1: Flags [.], seq 2856:4284, ack 1, win 685, options [nop,nop,TS val 4294856812 ecr 110437,mptcp dss ack 1375043541 seq 3984399339 subseq 371281 len 1428 csum 0x76a8], length 1428
17:01:18.278361 IP 112.26.2.1.targus-getdata1 > 112.26.2.8.45243: Flags [.], ack 4294951588, win 24182, options [nop,nop,TS val 111051 ecr 4294855960,nop,nop,sack 1 {4294953016:4294964440},mptcp dss ack 3984310803], length 0
17:01:18.278548 IP 112.26.2.8.45243 > 112.26.2.1.targus-getdata1: Flags [.], seq 9996:11424, ack 1, win 685, options [nop,nop,TS val 4294857416 ecr 111051,mptcp dss ack 1375043541 seq 3984427899 subseq 378421 len 1428 csum 0xc9f1], length 1428
17:01:18.354018 IP 112.26.2.1.targus-getdata1 > 112.26.2.8.45243: Flags [.], ack 4294951588, win 24262, options [nop,nop,TS val 111200 ecr 4294855960,nop,nop,sack 1 {4294953016:4294965868},mptcp dss ack 3984310803], length 0
17:01:18.374186 IP 112.26.2.8.45243 > 112.26.2.1.targus-getdata1: Flags [.], seq 11424:12852, ack 1, win 685, options [nop,nop,TS val 4294857511 ecr 111200,mptcp dss ack 1375043541 seq 3984430755 subseq 379849 len 1428 csum 0x5ef2], length 1428
17:01:18.382942 IP 112.26.2.8.45243 > 112.26.2.1.targus-getdata1: Flags [.], seq 4284:5712, ack 1, win 685, options [nop,nop,TS val 4294856988 ecr 110699,mptcp dss ack 1375043541 seq 3984406479 subseq 372709 len 1428 csum 0x4e2d], length 1428
17:01:18.452482 IP 112.26.2.1.targus-getdata1 > 112.26.2.8.45243: Flags [.], ack 4294965868, win 24262, options [nop,nop,TS val 111351 ecr 4294856433,mptcp dss ack 3984310803], length 0
17:01:18.452747 IP 112.26.2.8.45243 > 112.26.2.1.targus-getdata1: Flags [.], seq 12852:14280, ack 1, win 685, options [nop,nop,TS val 4294857591 ecr 111351,mptcp dss ack 1375043541 seq 3984433611 subseq 381277 len 1428 csum 0x69c0], length 1428
17:01:18.497758 IP 112.26.2.8.45243 > 112.26.2.1.targus-getdata1: Flags [.], seq 5712:7140, ack 1, win 685, options [nop,nop,TS val 4294857141 ecr 110766,mptcp dss ack 1375043541 seq 3984412191 subseq 374137 len 1428 csum 0xeaa4], length 1428
17:01:18.583349 IP 112.26.2.1.targus-getdata1 > 112.26.2.8.45243: Flags [.], ack 0, win 24471, options [nop,nop,TS val 111487 ecr 4294856527,mptcp dss ack 3984357927], length 0
17:01:18.583529 IP 112.26.2.8.45243 > 112.26.2.1.targus-getdata1: Flags [.], seq 14280:15708, ack 1, win 685, options [nop,nop,TS val 4294857721 ecr 111487,mptcp dss ack 1375043541 seq 3984439323 subseq 382705 len 1428 csum 0xed24], length 1428
17:01:18.616522 IP 112.26.2.8.45243 > 112.26.2.1.targus-getdata1: Flags [.], seq 7140:8568, ack 1, win 685, options [nop,nop,TS val 4294857156 ecr 110830,mptcp dss ack 1375043541 seq 3984413619 subseq 375565 len 1428 csum 0x68fd], length 1428
17:01:18.693737 IP 112.26.2.1.targus-getdata1 > 112.26.2.8.45243: Flags [.], ack 2856, win 24420, options [nop,nop,TS val 111674 ecr 4294856693,mptcp dss ack 3984366495], length 0
17:01:18.693912 IP 112.26.2.8.45243 > 112.26.2.1.targus-getdata1: Flags [.], seq 15708:17136, ack 1, win 685, options [nop,nop,TS val 4294857831 ecr 111674,mptcp dss ack 1375043541 seq 3984443607 subseq 384133 len 1428 csum 0x71c5], length 1428
17:01:18.693961 IP 112.26.2.8.45243 > 112.26.2.1.targus-getdata1: Flags [.], seq 17136:18564, ack 1, win 685, options [nop,nop,TS val 4294857831 ecr 111674,mptcp dss ack 1375043541 seq 3984445035 subseq 385561 len 1428 csum 0xeea3], length 1428
17:01:18.744166 IP 112.26.2.8.45243 > 112.26.2.1.targus-getdata1: Flags [.], seq 8568:9996, ack 1, win 685, options [nop,nop,TS val 4294857311 ecr 110945,mptcp dss ack 1375043541 seq 3984420759 subseq 376993 len 1428 csum 0x8b40], length 1428
17:01:18.823959 IP 112.26.2.1.targus-getdata1 > 112.26.2.8.45243: Flags [.], ack 4284, win 24420, options [nop,nop,TS val 111776 ecr 4294856812,mptcp dss ack 3984366495], length 0
17:01:18.824234 IP 112.26.2.8.45243 > 112.26.2.1.targus-getdata1: Flags [.], seq 18564:19992, ack 1, win 685, options [nop,nop,TS val 4294857962 ecr 111776,mptcp dss ack 1375043541 seq 3984452175 subseq 386989 len 1428 csum 0x1518], length 1428
17:01:18.824287 IP 112.26.2.8.45243 > 112.26.2.1.targus-getdata1: Flags [.], seq 19992:21420, ack 1, win 685, options [nop,nop,TS val 4294857962 ecr 111776,mptcp dss ack 1375043541 seq 3984453603 subseq 388417 len 1428 csum 0xe4cc], length 1428
17:01:18.863135 IP 112.26.2.8.45243 > 112.26.2.1.targus-getdata1: Flags [.], seq 9996:11424, ack 1, win 685, options [nop,nop,TS val 4294857416 ecr 111051,mptcp dss ack 1375043541 seq 3984427899 subseq 378421 len 1428 csum 0xc9f1], length 1428
17:01:18.930766 IP 112.26.2.8.45243 > 112.26.2.1.targus-getdata1: Flags [.], seq 11424:12852, ack 1, win 685, options [nop,nop,TS val 4294857511 ecr 111200,mptcp dss ack 1375043541 seq 3984430755 subseq 379849 len 1428 csum 0x5ef2], length 1428
17:01:18.982397 IP 112.26.2.8.45243 > 112.26.2.1.targus-getdata1: Flags [.], seq 12852:14280, ack 1, win 685, options [nop,nop,TS val 4294857591 ecr 111351,mptcp dss ack 1375043541 seq 3984433611 subseq 381277 len 1428 csum 0x69c0], length 1428
17:01:19.056739 IP 112.26.2.1.targus-getdata1 > 112.26.2.8.45243: Flags [.], ack 5712, win 24420, options [nop,nop,TS val 111934 ecr 4294856988,mptcp dss ack 3984366495], length 0
17:01:19.057100 IP 112.26.2.8.45243 > 112.26.2.1.targus-getdata1: Flags [.], seq 21420:22848, ack 1, win 685, options [nop,nop,TS val 4294858195 ecr 111934,mptcp dss ack 1375043541 seq 3984459315 subseq 389845 len 1428 csum 0x8d70], length 1428
17:01:19.105837 IP 112.26.2.1.targus-getdata1 > 112.26.2.8.45243: Flags [.], ack 7140, win 24420, options [nop,nop,TS val 112051 ecr 4294857141,mptcp dss ack 3984366495], length 0
17:01:19.106028 IP 112.26.2.8.45243 > 112.26.2.1.targus-getdata1: Flags [.], seq 22848:24276, ack 1, win 685, options [nop,nop,TS val 4294858244 ecr 112051,mptcp dss ack 1375043541 seq 3984460743 subseq 391273 len 1428 csum 0x543e], length 1428
17:01:19.181323 IP 112.26.2.8.45243 > 112.26.2.1.targus-getdata1: Flags [.], seq 14280:15708, ack 1, win 685, options [nop,nop,TS val 4294857721 ecr 111487,mptcp dss ack 1375043541 seq 3984439323 subseq 382705 len 1428 csum 0xed24], length 1428
17:01:19.236467 IP 112.26.2.1.targus-getdata1 > 112.26.2.8.45243: Flags [.], ack 8568, win 24420, options [nop,nop,TS val 112166 ecr 4294857156,mptcp dss ack 3984366495], length 0
17:01:19.236646 IP 112.26.2.8.45243 > 112.26.2.1.targus-getdata1: Flags [.], seq 24276:25704, ack 1, win 685, options [nop,nop,TS val 4294858374 ecr 112166,mptcp dss ack 1375043541 seq 3984463599 subseq 392701 len 1428 csum 0x4cfd], length 1428
17:01:19.309670 IP 112.26.2.8.45243 > 112.26.2.1.targus-getdata1: Flags [.], seq 15708:17136, ack 1, win 685, options [nop,nop,TS val 4294857831 ecr 111674,mptcp dss ack 1375043541 seq 3984443607 subseq 384133 len 1428 csum 0x71c5], length 1428
17:01:19.341870 IP 112.26.2.8.45243 > 112.26.2.1.targus-getdata1: Flags [.], seq 17136:18564, ack 1, win 685, options [nop,nop,TS val 4294857831 ecr 111674,mptcp dss ack 1375043541 seq 3984445035 subseq 385561 len 1428 csum 0xeea3], length 1428
17:01:19.386616 IP 112.26.2.1.targus-getdata1 > 112.26.2.8.45243: Flags [.], ack 9996, win 24420, options [nop,nop,TS val 112295 ecr 4294857311,mptcp dss ack 3984366495], length 0
17:01:19.386849 IP 112.26.2.8.45243 > 112.26.2.1.targus-getdata1: Flags [.], seq 25704:27132, ack 1, win 685, options [nop,nop,TS val 4294858524 ecr 112295,mptcp dss ack 1375043541 seq 3984467883 subseq 394129 len 1428 csum 0x3b4c], length 1428
17:01:19.482527 IP 112.26.2.8.45243 > 112.26.2.1.targus-getdata1: Flags [.], seq 19992:21420, ack 1, win 685, options [nop,nop,TS val 4294857962 ecr 111776,mptcp dss ack 1375043541 seq 3984453603 subseq 388417 len 1428 csum 0xe4cc], length 1428
17:01:19.516220 IP 112.26.2.1.targus-getdata1 > 112.26.2.8.45243: Flags [.], ack 11424, win 24420, options [nop,nop,TS val 112417 ecr 4294857416,mptcp dss ack 3984366495], length 0
17:01:19.516518 IP 112.26.2.8.45243 > 112.26.2.1.targus-getdata1: Flags [.], seq 27132:28560, ack 1, win 685, options [nop,nop,TS val 4294858654 ecr 112417,mptcp dss ack 1375043541 seq 3984472167 subseq 395557 len 1428 csum 0x46d3], length 1428
17:01:19.595521 IP 112.26.2.8.45243 > 112.26.2.1.targus-getdata1: Flags [.], seq 21420:22848, ack 1, win 685, options [nop,nop,TS val 4294858195 ecr 111934,mptcp dss ack 1375043541 seq 3984459315 subseq 389845 len 1428 csum 0x8d70], length 1428
17:01:19.622098 IP 112.26.2.1.targus-getdata1 > 112.26.2.8.45243: Flags [.], ack 12852, win 24420, options [nop,nop,TS val 112520 ecr 4294857511,mptcp dss ack 3984366495], length 0
17:01:19.622334 IP 112.26.2.8.45243 > 112.26.2.1.targus-getdata1: Flags [.], seq 28560:29988, ack 1, win 685, options [nop,nop,TS val 4294858760 ecr 112520,mptcp dss ack 1375043541 seq 3984476451 subseq 396985 len 1428 csum 0x4d40], length 1428
17:01:19.622379 IP 112.26.2.8.45243 > 112.26.2.1.targus-getdata1: Flags [.], seq 29988:31416, ack 1, win 685, options [nop,nop,TS val 4294858760 ecr 112520,mptcp dss ack 1375043541 seq 3984477879 subseq 398413 len 1428 csum 0xe083], length 1428
17:01:19.722399 IP 112.26.2.8.45243 > 112.26.2.1.targus-getdata1: Flags [.], seq 22848:24276, ack 1, win 685, options [nop,nop,TS val 4294858244 ecr 112051,mptcp dss ack 1375043541 seq 3984460743 subseq 391273 len 1428 csum 0x543e], length 1428
17:01:19.784446 IP 112.26.2.1.targus-getdata1 > 112.26.2.8.45243: Flags [.], ack 14280, win 24420, options [nop,nop,TS val 112663 ecr 4294857591,mptcp dss ack 3984366495], length 0
17:01:19.784759 IP 112.26.2.8.45243 > 112.26.2.1.targus-getdata1: Flags [.], seq 31416:32844, ack 1, win 685, options [nop,nop,TS val 4294858922 ecr 112663,mptcp dss ack 1375043541 seq 3984483591 subseq 399841 len 1428 csum 0x17b8], length 1428
17:01:19.832800 IP 112.26.2.8.45243 > 112.26.2.1.targus-getdata1: Flags [.], seq 24276:25704, ack 1, win 685, options [nop,nop,TS val 4294858374 ecr 112166,mptcp dss ack 1375043541 seq 3984463599 subseq 392701 len 1428 csum 0x4cfd], length 1428
17:01:19.901459 IP 112.26.2.1.targus-getdata1 > 112.26.2.8.45243: Flags [.], ack 15708, win 24420, options [nop,nop,TS val 112803 ecr 4294857721,mptcp dss ack 3984366495], length 0
17:01:19.901740 IP 112.26.2.8.45243 > 112.26.2.1.targus-getdata1: Flags [.], seq 32844:34272, ack 1, win 685, options [nop,nop,TS val 4294859039 ecr 112803,mptcp dss ack 1375043541 seq 3984487875 subseq 401269 len 1428 csum 0xcbb5], length 1428
17:01:19.968552 IP 112.26.2.8.45243 > 112.26.2.1.targus-getdata1: Flags [.], seq 25704:27132, ack 1, win 685, options [nop,nop,TS val 4294858524 ecr 112295,mptcp dss ack 1375043541 seq 3984467883 subseq 394129 len 1428 csum 0x3b4c], length 1428
17:01:19.994680 IP 112.26.2.8.45243 > 112.26.2.1.targus-getdata1: Flags [.], seq 27132:28560, ack 1, win 685, options [nop,nop,TS val 4294858654 ecr 112417,mptcp dss ack 1375043541 seq 3984472167 subseq 395557 len 1428 csum 0x46d3], length 1428
17:01:20.045117 IP 112.26.2.1.targus-getdata1 > 112.26.2.8.45243: Flags [.], ack 17136, win 24453, options [nop,nop,TS val 112949 ecr 4294857831,mptcp dss ack 3984419331], length 0
17:01:20.045274 IP 112.26.2.8.45243 > 112.26.2.1.targus-getdata1: Flags [.], seq 34272:35700, ack 1, win 685, options [nop,nop,TS val 4294859183 ecr 112949,mptcp dss ack 1375043541 seq 3984492159 subseq 402697 len 1428 csum 0xea19], length 1428
17:01:20.106563 IP 112.26.2.1.targus-getdata1 > 112.26.2.8.45243: Flags [.], ack 18564, win 24453, options [nop,nop,TS val 113006 ecr 4294857831,mptcp dss ack 3984419331], length 0
17:01:20.106852 IP 112.26.2.8.45243 > 112.26.2.1.targus-getdata1: Flags [.], seq 35700:37128, ack 1, win 685, options [nop,nop,TS val 4294859245 ecr 113006,mptcp dss ack 1375043541 seq 3984496443 subseq 404125 len 1428 csum 0x9038], length 1428
17:01:20.186413 IP 112.26.2.8.45243 > 112.26.2.1.targus-getdata1: Flags [.], seq 28560:29988, ack 1, win 685, options [nop,nop,TS val 4294858760 ecr 112520,mptcp dss ack 1375043541 seq 3984476451 subseq 396985 len 1428 csum 0x4d40], length 1428
17:01:20.240382 IP 112.26.2.8.45243 > 112.26.2.1.targus-getdata1: Flags [.], seq 29988:31416, ack 1, win 685, options [nop,nop,TS val 4294858760 ecr 112520,mptcp dss ack 1375043541 seq 3984477879 subseq 398413 len 1428 csum 0xe083], length 1428
17:01:20.286303 IP 112.26.2.1.targus-getdata1 > 112.26.2.8.45243: Flags [.], ack 18564, win 24543, options [nop,nop,TS val 113175 ecr 4294857831,nop,nop,sack 1 {19992:21420},mptcp dss ack 3984442179], length 0
17:01:20.319916 IP 112.26.2.8.45243 > 112.26.2.1.targus-getdata1: Flags [.], seq 37128:38556, ack 1, win 685, options [nop,nop,TS val 4294859458 ecr 113175,mptcp dss ack 1375043541 seq 3984505011 subseq 405553 len 1428 csum 0xa2ca], length 1428
17:01:20.351009 IP 112.26.2.8.45243 > 112.26.2.1.targus-getdata1: Flags [.], seq 31416:32844, ack 1, win 685, options [nop,nop,TS val 4294858922 ecr 112663,mptcp dss ack 1375043541 seq 3984483591 subseq 399841 len 1428 csum 0x17b8], length 1428
17:01:20.408566 IP 112.26.2.1.targus-getdata1 > 112.26.2.8.45243: Flags [.], ack 18564, win 24543, options [nop,nop,TS val 113240 ecr 4294857831,nop,nop,sack 1 {19992:22848},mptcp dss ack 3984442179], length 0
17:01:20.425129 IP 112.26.2.8.45243 > 112.26.2.1.targus-getdata1: Flags [.], seq 38556:39984, ack 1, win 685, options [nop,nop,TS val 4294859563 ecr 113240,mptcp dss ack 1375043541 seq 3984510723 subseq 406981 len 1428 csum 0x9e], length 1428
17:01:20.476492 IP 112.26.2.8.45243 > 112.26.2.1.targus-getdata1: Flags [.], seq 32844:34272, ack 1, win 685, options [nop,nop,TS val 4294859039 ecr 112803,mptcp dss ack 1375043541 seq 3984487875 subseq 401269 len 1428 csum 0xcbb5], length 1428
17:01:20.541986 IP 112.26.2.1.targus-getdata1 > 112.26.2.8.45243: Flags [.], ack 18564, win 24522, options [nop,nop,TS val 113430 ecr 4294857831,nop,nop,sack 1 {19992:24276},mptcp dss ack 3984452175], length 0
17:01:20.601699 IP 112.26.2.8.45243 > 112.26.2.1.targus-getdata1: Flags [.], seq 34272:35700, ack 1, win 685, options [nop,nop,TS val 4294859183 ecr 112949,mptcp dss ack 1375043541 seq 3984492159 subseq 402697 len 1428 csum 0xea19], length 1428
17:01:20.612062 IP 112.26.2.8.45243 > 112.26.2.1.targus-getdata1: Flags [P.], seq 39984:41412, ack 1, win 685, options [nop,nop,TS val 4294859750 ecr 113430,mptcp dss ack 1375043541 seq 3984517863 subseq 408409 len 1428 csum 0x4ea2], length 1428
17:01:20.676023 IP 112.26.2.8.45243 > 112.26.2.1.targus-getdata1: Flags [.], seq 35700:37128, ack 1, win 685, options [nop,nop,TS val 4294859245 ecr 113006,mptcp dss ack 1375043541 seq 3984496443 subseq 404125 len 1428 csum 0x9038], length 1428
17:01:20.724422 IP 112.26.2.1.targus-getdata1 > 112.26.2.8.45243: Flags [.], ack 18564, win 24522, options [nop,nop,TS val 113693 ecr 4294857831,nop,nop,sack 1 {19992:27132},mptcp dss ack 3984452175], length 0
17:01:20.745113 IP 112.26.2.8.45243 > 112.26.2.1.targus-getdata1: Flags [.], seq 41412:42840, ack 1, win 685, options [nop,nop,TS val 4294859883 ecr 113693,mptcp dss ack 1375043541 seq 3984523575 subseq 409837 len 1428 csum 0x7504], length 1428
17:01:20.745212 IP 112.26.2.8.45243 > 112.26.2.1.targus-getdata1: Flags [.], seq 42840:44268, ack 1, win 685, options [nop,nop,TS val 4294859883 ecr 113693,mptcp dss ack 1375043541 seq 3984525003 subseq 411265 len 1428 csum 0x7f2d], length 1428
17:01:20.798880 IP 112.26.2.8.45243 > 112.26.2.1.targus-getdata1: Flags [.], seq 37128:38556, ack 1, win 685, options [nop,nop,TS val 4294859458 ecr 113175,mptcp dss ack 1375043541 seq 3984505011 subseq 405553 len 1428 csum 0xa2ca], length 1428
17:01:20.877520 IP 112.26.2.1.targus-getdata1 > 112.26.2.8.45243: Flags [.], ack 18564, win 24522, options [nop,nop,TS val 113743 ecr 4294857831,nop,nop,sack 1 {19992:28560},mptcp dss ack 3984452175], length 0
17:01:20.906933 IP 112.26.2.8.45243 > 112.26.2.1.targus-getdata1: Flags [.], seq 38556:39984, ack 1, win 685, options [nop,nop,TS val 4294859563 ecr 113240,mptcp dss ack 1375043541 seq 3984510723 subseq 406981 len 1428 csum 0x9e], length 1428
17:01:20.929845 IP 112.26.2.8.45243 > 112.26.2.1.targus-getdata1: Flags [.], seq 44268:45696, ack 1, win 685, options [nop,nop,TS val 4294860067 ecr 113743,mptcp dss ack 1375043541 seq 3984529287 subseq 412693 len 1428 csum 0xb41e], length 1428
17:01:20.953190 IP 112.26.2.1.targus-getdata1 > 112.26.2.8.45243: Flags [.], ack 18564, win 24522, options [nop,nop,TS val 113874 ecr 4294857831,nop,nop,sack 1 {19992:29988},mptcp dss ack 3984452175], length 0
17:01:20.962422 IP 112.26.2.8.45243 > 112.26.2.1.targus-getdata1: Flags [.], seq 45696:47124, ack 1, win 685, options [nop,nop,TS val 4294860100 ecr 113874,mptcp dss ack 1375043541 seq 3984532143 subseq 414121 len 1428 csum 0xc0df], length 1428
17:01:21.045799 IP 112.26.2.1.targus-getdata1 > 112.26.2.8.45243: Flags [.], ack 18564, win 24522, options [nop,nop,TS val 113992 ecr 4294857831,nop,nop,sack 1 {19992:31416},mptcp dss ack 3984452175], length 0
17:01:21.075532 IP 112.26.2.8.45243 > 112.26.2.1.targus-getdata1: Flags [.], seq 47124:48552, ack 1, win 685, options [nop,nop,TS val 4294860214 ecr 113992,mptcp dss ack 1375043541 seq 3984534999 subseq 415549 len 1428 csum 0x239c], length 1428
17:01:21.085793 IP 112.26.2.8.45243 > 112.26.2.1.targus-getdata1: Flags [.], seq 18564:19992, ack 1, win 685, options [nop,nop,TS val 4294860224 ecr 113992,mptcp dss ack 1375043541 seq 3984452175 subseq 386989 len 1428 csum 0x1518], length 1428
17:01:21.103135 IP 112.26.2.8.45243 > 112.26.2.1.targus-getdata1: Flags [P.], seq 39984:41412, ack 1, win 685, options [nop,nop,TS val 4294859750 ecr 113430,mptcp dss ack 1375043541 seq 3984517863 subseq 408409 len 1428 csum 0x4ea2], length 1428
17:01:21.163324 IP 112.26.2.8.45243 > 112.26.2.1.targus-getdata1: Flags [.], seq 41412:42840, ack 1, win 685, options [nop,nop,TS val 4294859883 ecr 113693,mptcp dss ack 1375043541 seq 3984523575 subseq 409837 len 1428 csum 0x7504], length 1428
17:01:21.211794 IP 112.26.2.1.targus-getdata1 > 112.26.2.8.45243: Flags [.], ack 18564, win 24522, options [nop,nop,TS val 114114 ecr 4294857831,nop,nop,sack 1 {19992:32844},mptcp dss ack 3984452175], length 0
17:01:21.270262 IP 112.26.2.8.45243 > 112.26.2.1.targus-getdata1: Flags [.], seq 42840:44268, ack 1, win 685, options [nop,nop,TS val 4294859883 ecr 113693,mptcp dss ack 1375043541 seq 3984525003 subseq 411265 len 1428 csum 0x7f2d], length 1428
17:01:21.289479 IP 112.26.2.8.45243 > 112.26.2.1.targus-getdata1: Flags [.], seq 48552:49980, ack 1, win 685, options [nop,nop,TS val 4294860427 ecr 114114,mptcp dss ack 1375043541 seq 3984460743 subseq 416977 len 1428 csum 0xefd5], length 1428
17:01:21.339553 IP 112.26.2.1.targus-getdata1 > 112.26.2.8.45243: Flags [.], ack 18564, win 24522, options [nop,nop,TS val 114232 ecr 4294857831,nop,nop,sack 1 {19992:34272},mptcp dss ack 3984452175], length 0
17:01:21.395136 IP 112.26.2.8.45243 > 112.26.2.1.targus-getdata1: Flags [.], seq 44268:45696, ack 1, win 685, options [nop,nop,TS val 4294860067 ecr 113743,mptcp dss ack 1375043541 seq 3984529287 subseq 412693 len 1428 csum 0xb41e], length 1428
17:01:21.420900 IP 112.26.2.8.45243 > 112.26.2.1.targus-getdata1: Flags [.], seq 49980:51408, ack 1, win 685, options [nop,nop,TS val 4294860559 ecr 114232,mptcp dss ack 1375043541 seq 3984476451 subseq 418405 len 1428 csum 0xf993], length 1428
17:01:21.452234 IP 112.26.2.8.45243 > 112.26.2.1.targus-getdata1: Flags [.], seq 45696:47124, ack 1, win 685, options [nop,nop,TS val 4294860100 ecr 113874,mptcp dss ack 1375043541 seq 3984532143 subseq 414121 len 1428 csum 0xc0df], length 1428
17:01:21.538106 IP 112.26.2.1.targus-getdata1 > 112.26.2.8.45243: Flags [.], ack 18564, win 24522, options [nop,nop,TS val 114355 ecr 4294857831,nop,nop,sack 1 {19992:35700},mptcp dss ack 3984452175], length 0
17:01:21.568732 IP 112.26.2.8.45243 > 112.26.2.1.targus-getdata1: Flags [.], seq 47124:48552, ack 1, win 685, options [nop,nop,TS val 4294860214 ecr 113992,mptcp dss ack 1375043541 seq 3984534999 subseq 415549 len 1428 csum 0x239c], length 1428
17:01:21.613612 IP 112.26.2.1.targus-getdata1 > 112.26.2.8.45243: Flags [.], ack 18564, win 24522, options [nop,nop,TS val 114417 ecr 4294857831,nop,nop,sack 1 {19992:37128},mptcp dss ack 3984452175], length 0
17:01:21.613803 IP 112.26.2.8.45243 > 112.26.2.1.targus-getdata1: Flags [.], seq 51408:52836, ack 1, win 685, options [nop,nop,TS val 4294860751 ecr 114355,mptcp dss ack 1375043541 seq 3984510723 subseq 419833 len 1428 csum 0xce69], length 1428
17:01:21.676352 IP 112.26.2.8.45243 > 112.26.2.1.targus-getdata1: Flags [.], seq 18564:19992, ack 1, win 685, options [nop,nop,TS val 4294860224 ecr 113992,mptcp dss ack 1375043541 seq 3984452175 subseq 386989 len 1428 csum 0x1518], length 1428
17:01:21.740204 IP 112.26.2.1.targus-getdata1 > 112.26.2.8.45243: Flags [.], ack 18564, win 24522, options [nop,nop,TS val 114548 ecr 4294857831,nop,nop,sack 1 {19992:38556},mptcp dss ack 3984452175], length 0
17:01:21.784337 IP 112.26.2.8.45243 > 112.26.2.1.targus-getdata1: Flags [.], seq 52836:54264, ack 1, win 685, options [nop,nop,TS val 4294860922 ecr 114548,mptcp dss ack 1375043541 seq 3984536427 subseq 421261 len 1428 csum 0x83c4], length 1428
17:01:21.790945 IP 112.26.2.8.45243 > 112.26.2.1.targus-getdata1: Flags [.], seq 48552:49980, ack 1, win 685, options [nop,nop,TS val 4294860427 ecr 114114,mptcp dss ack 1375043541 seq 3984460743 subseq 416977 len 1428 csum 0xefd5], length 1428
17:01:21.846308 IP 112.26.2.8.45243 > 112.26.2.1.targus-getdata1: Flags [.], seq 49980:51408, ack 1, win 685, options [nop,nop,TS val 4294860559 ecr 114232,mptcp dss ack 1375043541 seq 3984476451 subseq 418405 len 1428 csum 0xf993], length 1428
17:01:21.884867 IP 112.26.2.1.targus-getdata1 > 112.26.2.8.45243: Flags [.], ack 18564, win 24522, options [nop,nop,TS val 114727 ecr 4294857831,nop,nop,sack 1 {19992:39984},mptcp dss ack 3984452175], length 0
17:01:21.916512 IP 112.26.2.8.45243 > 112.26.2.1.targus-getdata1: Flags [.], seq 54264:55692, ack 1, win 685, options [nop,nop,TS val 4294861054 ecr 114727,mptcp dss ack 1375043541 seq 3984539283 subseq 422689 len 1428 csum 0xbef3], length 1428
17:01:21.968652 IP 112.26.2.1.targus-getdata1 > 112.26.2.8.45243: Flags [.], ack 18564, win 24522, options [nop,nop,TS val 114860 ecr 4294857831,nop,nop,sack 1 {19992:41412},mptcp dss ack 3984452175], length 0
17:01:22.003855 IP 112.26.2.8.45243 > 112.26.2.1.targus-getdata1: Flags [.], seq 51408:52836, ack 1, win 685, options [nop,nop,TS val 4294860751 ecr 114355,mptcp dss ack 1375043541 seq 3984510723 subseq 419833 len 1428 csum 0xce69], length 1428
17:01:22.083169 IP 112.26.2.1.targus-getdata1 > 112.26.2.8.45243: Flags [.], ack 18564, win 24522, options [nop,nop,TS val 114956 ecr 4294857831,nop,nop,sack 1 {19992:42840},mptcp dss ack 3984452175], length 0
17:01:22.114374 IP 112.26.2.8.45243 > 112.26.2.1.targus-getdata1: Flags [.], seq 55692:57120, ack 1, win 685, options [nop,nop,TS val 4294861252 ecr 114956,mptcp dss ack 1375043541 seq 3984546423 subseq 424117 len 1428 csum 0x623c], length 1428
17:01:22.138438 IP 112.26.2.8.45243 > 112.26.2.1.targus-getdata1: Flags [.], seq 52836:54264, ack 1, win 685, options [nop,nop,TS val 4294860922 ecr 114548,mptcp dss ack 1375043541 seq 3984536427 subseq 421261 len 1428 csum 0x83c4], length 1428
17:01:22.213242 IP 112.26.2.1.targus-getdata1 > 112.26.2.8.45243: Flags [.], ack 18564, win 24522, options [nop,nop,TS val 115049 ecr 4294857831,nop,nop,sack 1 {19992:44268},mptcp dss ack 3984452175], length 0
17:01:22.257380 IP 112.26.2.1.targus-getdata1 > 112.26.2.8.45243: Flags [.], ack 18564, win 24500, options [nop,nop,TS val 115179 ecr 4294857831,nop,nop,sack 1 {19992:45696},mptcp dss ack 3984453603], length 0
17:01:22.257615 IP 112.26.2.8.45243 > 112.26.2.1.targus-getdata1: Flags [.], seq 57120:58548, ack 1, win 685, options [nop,nop,TS val 4294861395 ecr 115049,mptcp dss ack 1375043541 seq 3984553563 subseq 425545 len 1428 csum 0x744e], length 1428
17:01:22.299787 IP 112.26.2.8.45243 > 112.26.2.1.targus-getdata1: Flags [.], seq 54264:55692, ack 1, win 685, options [nop,nop,TS val 4294861054 ecr 114727,mptcp dss ack 1375043541 seq 3984539283 subseq 422689 len 1428 csum 0xbef3], length 1428
17:01:22.366138 IP 112.26.2.1.targus-getdata1 > 112.26.2.8.45243: Flags [.], ack 18564, win 24389, options [nop,nop,TS val 115302 ecr 4294857831,nop,nop,sack 1 {19992:47124},mptcp dss ack 3984460743], length 0
17:01:22.389498 IP 112.26.2.8.45243 > 112.26.2.1.targus-getdata1: Flags [.], seq 55692:57120, ack 1, win 685, options [nop,nop,TS val 4294861252 ecr 114956,mptcp dss ack 1375043541 seq 3984546423 subseq 424117 len 1428 csum 0x623c], length 1428
17:01:22.437971 IP 112.26.2.1.targus-getdata1 > 112.26.2.8.45243: Flags [.], ack 18564, win 24389, options [nop,nop,TS val 115418 ecr 4294857831,nop,nop,sack 1 {19992:48552},mptcp dss ack 3984460743], length 0
17:01:22.459314 IP 112.26.2.8.45243 > 112.26.2.1.targus-getdata1: Flags [.], seq 58548:59976, ack 1, win 685, options [nop,nop,TS val 4294861597 ecr 115418,mptcp dss ack 1375043541 seq 3984559275 subseq 426973 len 1428 csum 0x73bf], length 1428
17:01:22.482265 IP 112.26.2.1.targus-getdata1 > 112.26.2.8.45243: Flags [.], ack 48552, win 23747, options [nop,nop,TS val 115500 ecr 4294860224,mptcp dss ack 3984536427], length 0
17:01:22.482505 IP 112.26.2.8.45243 > 112.26.2.1.targus-getdata1: Flags [.], seq 59976:61404, ack 1, win 685, options [nop,nop,TS val 4294861620 ecr 115500,mptcp dss ack 1375043541 seq 3984562131 subseq 428401 len 1428 csum 0x7426], length 1428
17:01:22.548160 IP 112.26.2.8.45243 > 112.26.2.1.targus-getdata1: Flags [.], seq 57120:58548, ack 1, win 685, options [nop,nop,TS val 4294861395 ecr 115049,mptcp dss ack 1375043541 seq 3984553563 subseq 425545 len 1428 csum 0x744e], length 1428
17:01:22.606260 IP 112.26.2.1.targus-getdata1 > 112.26.2.8.45243: Flags [.], ack 49980, win 24576, options [nop,nop,TS val 115594 ecr 4294860427,mptcp dss ack 3984536427], length 0
17:01:22.606483 IP 112.26.2.8.45243 > 112.26.2.1.targus-getdata1: Flags [.], seq 61404:62832, ack 1, win 685, options [nop,nop,TS val 4294861744 ecr 115594,mptcp dss ack 1375043541 seq 3984569271 subseq 429829 len 1428 csum 0xcc06], length 1428
17:01:22.606528 IP 112.26.2.8.45243 > 112.26.2.1.targus-getdata1: Flags [.], seq 62832:64260, ack 1, win 685, options [nop,nop,TS val 4294861744 ecr 115594,mptcp dss ack 1375043541 seq 3984570699 subseq 431257 len 1428 csum 0xde71], length 1428
17:01:22.695622 IP 112.26.2.1.targus-getdata1 > 112.26.2.8.45243: Flags [.], ack 51408, win 24576, options [nop,nop,TS val 115668 ecr 4294860559,mptcp dss ack 3984536427], length 0
17:01:22.695823 IP 112.26.2.8.45243 > 112.26.2.1.targus-getdata1: Flags [.], seq 64260:65688, ack 1, win 685, options [nop,nop,TS val 4294861834 ecr 115668,mptcp dss ack 1375043541 seq 3984573555 subseq 432685 len 1428 csum 0xecdc], length 1428
17:01:22.774959 IP 112.26.2.8.45243 > 112.26.2.1.targus-getdata1: Flags [.], seq 58548:59976, ack 1, win 685, options [nop,nop,TS val 4294861597 ecr 115418,mptcp dss ack 1375043541 seq 3984559275 subseq 426973 len 1428 csum 0x73bf], length 1428
17:01:22.861950 IP 112.26.2.8.45243 > 112.26.2.1.targus-getdata1: Flags [.], seq 59976:61404, ack 1, win 685, options [nop,nop,TS val 4294861620 ecr 115500,mptcp dss ack 1375043541 seq 3984562131 subseq 428401 len 1428 csum 0x7426], length 1428
17:01:22.904086 IP 112.26.2.1.targus-getdata1 > 112.26.2.8.45243: Flags [.], ack 52836, win 24576, options [nop,nop,TS val 115857 ecr 4294860751,mptcp dss ack 3984536427], length 0
17:01:22.904282 IP 112.26.2.8.45243 > 112.26.2.1.targus-getdata1: Flags [.], seq 65688:67116, ack 1, win 685, options [nop,nop,TS val 4294862042 ecr 115857,mptcp dss ack 1375043541 seq 3984580695 subseq 434113 len 1428 csum 0x6e21], length 1428
17:01:22.963100 IP 112.26.2.8.45243 > 112.26.2.1.targus-getdata1: Flags [.], seq 61404:62832, ack 1, win 685, options [nop,nop,TS val 4294861744 ecr 115594,mptcp dss ack 1375043541 seq 3984569271 subseq 429829 len 1428 csum 0xcc06], length 1428
17:01:23.032824 IP 112.26.2.8.45243 > 112.26.2.1.targus-getdata1: Flags [.], seq 62832:64260, ack 1, win 685, options [nop,nop,TS val 4294861744 ecr 115594,mptcp dss ack 1375043541 seq 3984570699 subseq 431257 len 1428 csum 0xde71], length 1428
17:01:23.071409 IP 112.26.2.1.targus-getdata1 > 112.26.2.8.45243: Flags [.], ack 54264, win 24543, options [nop,nop,TS val 116002 ecr 4294860922,mptcp dss ack 3984539283], length 0
17:01:23.071786 IP 112.26.2.8.45243 > 112.26.2.1.targus-getdata1: Flags [.], seq 67116:68544, ack 1, win 685, options [nop,nop,TS val 4294862210 ecr 116002,mptcp dss ack 1375043541 seq 3984587835 subseq 435541 len 1428 csum 0x5cc4], length 1428
17:01:23.071839 IP 112.26.2.8.45243 > 112.26.2.1.targus-getdata1: Flags [.], seq 68544:69972, ack 1, win 685, options [nop,nop,TS val 4294862210 ecr 116002,mptcp dss ack 1375043541 seq 3984589263 subseq 436969 len 1428 csum 0xebd], length 1428
17:01:23.191127 IP 112.26.2.8.45243 > 112.26.2.1.targus-getdata1: Flags [.], seq 64260:65688, ack 1, win 685, options [nop,nop,TS val 4294861834 ecr 115668,mptcp dss ack 1375043541 seq 3984573555 subseq 432685 len 1428 csum 0xecdc], length 1428
17:01:23.234407 IP 112.26.2.1.targus-getdata1 > 112.26.2.8.45243: Flags [.], ack 55692, win 24525, options [nop,nop,TS val 116058 ecr 4294861054,mptcp dss ack 3984542139], length 0
17:01:23.234661 IP 112.26.2.8.45243 > 112.26.2.1.targus-getdata1: Flags [.], seq 69972:71400, ack 1, win 685, options [nop,nop,TS val 4294862372 ecr 116058,mptcp dss ack 1375043541 seq 3984597831 subseq 438397 len 1428 csum 0x927e], length 1428
17:01:23.283185 IP 112.26.2.1.targus-getdata1 > 112.26.2.8.45243: Flags [.], ack 57120, win 24540, options [nop,nop,TS val 116201 ecr 4294861252,mptcp dss ack 3984547851], length 0
17:01:23.283411 IP 112.26.2.8.45243 > 112.26.2.1.targus-getdata1: Flags [.], seq 71400:72828, ack 1, win 685, options [nop,nop,TS val 4294862421 ecr 116201,mptcp dss ack 1375043541 seq 3984599259 subseq 439825 len 1428 csum 0xe26e], length 1428
17:01:23.371565 IP 112.26.2.8.45243 > 112.26.2.1.targus-getdata1: Flags [.], seq 65688:67116, ack 1, win 685, options [nop,nop,TS val 4294862042 ecr 115857,mptcp dss ack 1375043541 seq 3984580695 subseq 434113 len 1428 csum 0x6e21], length 1428
17:01:23.425040 IP 112.26.2.1.targus-getdata1 > 112.26.2.8.45243: Flags [.], ack 58548, win 24576, options [nop,nop,TS val 116340 ecr 4294861395,mptcp dss ack 3984552135], length 0
17:01:23.425226 IP 112.26.2.8.45243 > 112.26.2.1.targus-getdata1: Flags [.], seq 72828:74256, ack 1, win 685, options [nop,nop,TS val 4294862563 ecr 116340,mptcp dss ack 1375043541 seq 3984606399 subseq 441253 len 1428 csum 0x9537], length 1428
17:01:23.511425 IP 112.26.2.8.45243 > 112.26.2.1.targus-getdata1: Flags [.], seq 67116:68544, ack 1, win 685, options [nop,nop,TS val 4294862210 ecr 116002,mptcp dss ack 1375043541 seq 3984587835 subseq 435541 len 1428 csum 0x5cc4], length 1428
17:01:23.561060 IP 112.26.2.1.targus-getdata1 > 112.26.2.8.45243: Flags [.], ack 59976, win 24558, options [nop,nop,TS val 116489 ecr 4294861597,mptcp dss ack 3984557847], length 0
17:01:23.561368 IP 112.26.2.8.45243 > 112.26.2.1.targus-getdata1: Flags [.], seq 74256:75684, ack 1, win 685, options [nop,nop,TS val 4294862699 ecr 116489,mptcp dss ack 1375043541 seq 3984613539 subseq 442681 len 1428 csum 0x7d48], length 1428
17:01:23.619206 IP 112.26.2.8.45243 > 112.26.2.1.targus-getdata1: Flags [.], seq 68544:69972, ack 1, win 685, options [nop,nop,TS val 4294862210 ecr 116002,mptcp dss ack 1375043541 seq 3984589263 subseq 436969 len 1428 csum 0xebd], length 1428
17:01:23.675437 IP 112.26.2.8.45243 > 112.26.2.1.targus-getdata1: Flags [.], seq 69972:71400, ack 1, win 685, options [nop,nop,TS val 4294862372 ecr 116058,mptcp dss ack 1375043541 seq 3984597831 subseq 438397 len 1428 csum 0x927e], length 1428
17:01:23.743831 IP 112.26.2.1.targus-getdata1 > 112.26.2.8.45243: Flags [.], ack 61404, win 24554, options [nop,nop,TS val 116563 ecr 4294861620,mptcp dss ack 3984563559], length 0
17:01:23.744060 IP 112.26.2.8.45243 > 112.26.2.1.targus-getdata1: Flags [.], seq 75684:77112, ack 1, win 685, options [nop,nop,TS val 4294862882 ecr 116563,mptcp dss ack 1375043541 seq 3984617823 subseq 444109 len 1428 csum 0x37a6], length 1428
17:01:23.744107 IP 112.26.2.8.45243 > 112.26.2.1.targus-getdata1: Flags [.], seq 77112:78540, ack 1, win 685, options [nop,nop,TS val 4294862882 ecr 116563,mptcp dss ack 1375043541 seq 3984619251 subseq 445537 len 1428 csum 0xb2bc], length 1428
17:01:23.830766 IP 112.26.2.8.45243 > 112.26.2.1.targus-getdata1: Flags [.], seq 71400:72828, ack 1, win 685, options [nop,nop,TS val 4294862421 ecr 116201,mptcp dss ack 1375043541 seq 3984599259 subseq 439825 len 1428 csum 0xe26e], length 1428
17:01:23.868783 IP 112.26.2.1.targus-getdata1 > 112.26.2.8.45243: Flags [.], ack 62832, win 24558, options [nop,nop,TS val 116685 ecr 4294861744,mptcp dss ack 3984567843], length 0
17:01:23.868982 IP 112.26.2.8.45243 > 112.26.2.1.targus-getdata1: Flags [.], seq 78540:79968, ack 1, win 685, options [nop,nop,TS val 4294863007 ecr 116685,mptcp dss ack 1375043541 seq 3984622107 subseq 446965 len 1428 csum 0x6ddd], length 1428
17:01:23.916164 IP 112.26.2.8.45243 > 112.26.2.1.targus-getdata1: Flags [.], seq 72828:74256, ack 1, win 685, options [nop,nop,TS val 4294862563 ecr 116340,mptcp dss ack 1375043541 seq 3984606399 subseq 441253 len 1428 csum 0x9537], length 1428
17:01:23.982037 IP 112.26.2.1.targus-getdata1 > 112.26.2.8.45243: Flags [.], ack 64260, win 24540, options [nop,nop,TS val 116851 ecr 4294861744,mptcp dss ack 3984572127], length 0
17:01:23.982247 IP 112.26.2.8.45243 > 112.26.2.1.targus-getdata1: Flags [.], seq 79968:81396, ack 1, win 685, options [nop,nop,TS val 4294863120 ecr 116851,mptcp dss ack 1375043541 seq 3984624963 subseq 448393 len 1428 csum 0xe1b], length 1428
17:01:24.025290 IP 112.26.2.8.45243 > 112.26.2.1.targus-getdata1: Flags [.], seq 74256:75684, ack 1, win 685, options [nop,nop,TS val 4294862699 ecr 116489,mptcp dss ack 1375043541 seq 3984613539 subseq 442681 len 1428 csum 0x7d48], length 1428
17:01:24.083945 IP 112.26.2.1.targus-getdata1 > 112.26.2.8.45243: Flags [.], ack 65688, win 24525, options [nop,nop,TS val 116956 ecr 4294861834,mptcp dss ack 3984576411], length 0
17:01:24.084319 IP 112.26.2.8.45243 > 112.26.2.1.targus-getdata1: Flags [.], seq 81396:82824, ack 1, win 685, options [nop,nop,TS val 4294863222 ecr 116956,mptcp dss ack 1375043541 seq 3984629247 subseq 449821 len 1428 csum 0xdd4e], length 1428
17:01:24.153979 IP 112.26.2.1.targus-getdata1 > 112.26.2.8.45243: Flags [.], ack 67116, win 24558, options [nop,nop,TS val 117054 ecr 4294862042,mptcp dss ack 3984576411], length 0
17:01:24.154192 IP 112.26.2.8.45243 > 112.26.2.1.targus-getdata1: Flags [.], seq 82824:84252, ack 1, win 685, options [nop,nop,TS val 4294863292 ecr 117054,mptcp dss ack 1375043541 seq 3984633531 subseq 451249 len 1428 csum 0xe6c7], length 1428
17:01:24.215064 IP 112.26.2.8.45243 > 112.26.2.1.targus-getdata1: Flags [.], seq 75684:77112, ack 1, win 685, options [nop,nop,TS val 4294862882 ecr 116563,mptcp dss ack 1375043541 seq 3984617823 subseq 444109 len 1428 csum 0x37a6], length 1428
17:01:24.293404 IP 112.26.2.8.45243 > 112.26.2.1.targus-getdata1: Flags [.], seq 77112:78540, ack 1, win 685, options [nop,nop,TS val 4294862882 ecr 116563,mptcp dss ack 1375043541 seq 3984619251 subseq 445537 len 1428 csum 0xb2bc], length 1428
17:01:24.359476 IP 112.26.2.1.targus-getdata1 > 112.26.2.8.45243: Flags [.], ack 68544, win 24558, options [nop,nop,TS val 117200 ecr 4294862210,mptcp dss ack 3984576411], length 0
17:01:24.359691 IP 112.26.2.8.45243 > 112.26.2.1.targus-getdata1: Flags [.], seq 84252:85680, ack 1, win 685, options [nop,nop,TS val 4294863497 ecr 117200,mptcp dss ack 1375043541 seq 3984640671 subseq 452677 len 1428 csum 0xd577], length 1428
17:01:24.432197 IP 112.26.2.8.45243 > 112.26.2.1.targus-getdata1: Flags [.], seq 78540:79968, ack 1, win 685, options [nop,nop,TS val 4294863007 ecr 116685,mptcp dss ack 1375043541 seq 3984622107 subseq 446965 len 1428 csum 0x6ddd], length 1428
17:01:24.494923 IP 112.26.2.1.targus-getdata1 > 112.26.2.8.45243: Flags [.], ack 69972, win 24558, options [nop,nop,TS val 117310 ecr 4294862210,mptcp dss ack 3984576411], length 0
17:01:24.495155 IP 112.26.2.8.45243 > 112.26.2.1.targus-getdata1: Flags [.], seq 85680:87108, ack 1, win 685, options [nop,nop,TS val 4294863633 ecr 117310,mptcp dss ack 1375043541 seq 3984649239 subseq 454105 len 1428 csum 0xe317], length 1428
