17:00:34.827370 IP 112.26.2.8.48913 > 112.26.2.1.targus-getdata1: Flags [S], seq 844081511, win 29200, options [mss 1460,sackOK,TS val 4294813938 ecr 0,nop,wscale 7,mptcp join id 4 token 0xb697b9d8 nonce 0xce3bd09d], length 0
17:00:34.922735 IP 112.26.2.8.48913 > 112.26.2.1.targus-getdata1: Flags [S], seq 844081511, win 29200, options [mss 1460,sackOK,TS val 4294813938 ecr 0,nop,wscale 7,mptcp join id 4 token 0xb697b9d8 nonce 0xce3bd09d], length 0
17:00:34.987847 IP 112.26.2.8.48913 > 112.26.2.1.targus-getdata1: Flags [S], seq 844081511, win 29200, options [mss 1460,sackOK,TS val 4294813938 ecr 0,nop,wscale 7,mptcp join id 4 token 0xb697b9d8 nonce 0xce3bd09d], length 0
17:00:35.060024 IP 112.26.2.8.48913 > 112.26.2.1.targus-getdata1: Flags [S], seq 844081511, win 29200, options [mss 1460,sackOK,TS val 4294813938 ecr 0,nop,wscale 7,mptcp join id 4 token 0xb697b9d8 nonce 0xce3bd09d], length 0
17:00:35.171969 IP 112.26.2.1.targus-getdata1 > 112.26.2.8.48913: Flags [S.], seq 2785160212, ack 844081512, win 65535, options [mss 1460,sackOK,TS val 68608 ecr 4294813938,nop,wscale 6,mptcp join id 6 hmac 0x2ce8a16ede77d8a3 nonce 0xfd3fd87c], length 0
17:00:35.172152 IP 112.26.2.1.targus-getdata1 > 112.26.2.8.48913: Flags [S.], seq 2785160212, ack 844081512, win 65535, options [mss 1460,sackOK,TS val 68608 ecr 4294813938,nop,wscale 6,mptcp join id 6 hmac 0x2ce8a16ede77d8a3 nonce 0xfd3fd87c], length 0
17:00:35.176051 IP 112.26.2.8.48913 > 112.26.2.1.targus-getdata1: Flags [.], ack 1, win 685, options [nop,nop,TS val 4294814313 ecr 68608,mptcp join hmac 0x101998dfcdcfd4ab411f9dc0f51d8f4addf56090], length 0
17:01:17.939125 IP 112.26.2.8.45243 > 112.26.2.1.targus-getdata1: Flags [.], seq 3041230439:3041231867, ack 2387809400, win 685, options [nop,nop,TS val 4294856527 ecr 110200,mptcp dss ack 1375043541 seq 3984390771 subseq 366997 len 1428 csum 0xf042], length 1428
17:01:17.999065 IP 112.26.2.8.45243 > 112.26.2.1.targus-getdata1: Flags [.], seq 1428:2856, ack 1, win 685, options [nop,nop,TS val 4294856650 ecr 110278,mptcp dss ack 1375043541 seq 3984393627 subseq 368425 len 1428 csum 0xf0a9], length 1428
17:01:18.007955 IP 112.26.2.8.45243 > 112.26.2.1.targus-getdata1: Flags [.], seq 7140:8568, ack 1, win 685, options [nop,nop,TS val 4294857141 ecr 110766,mptcp dss ack 1375043541 seq 3984412191 subseq 374137 len 1428 csum 0xeaa4], length 1428
17:01:18.008168 IP 112.26.2.8.45243 > 112.26.2.1.targus-getdata1: Flags [.], seq 7140:8568, ack 1, win 685, options [nop,nop,TS val 4294857141 ecr 110766,mptcp dss ack 1375043541 seq 3984412191 subseq 374137 len 1428 csum 0xeaa4], length 1428
17:01:18.052293 IP 112.26.2.1.targus-getdata1 > 112.26.2.8.45243: Flags [.], ack 1428, win 24471, options [nop,nop,TS val 111487 ecr 4294856527,mptcp dss ack 3984357927], length 0
17:01:18.052516 IP 112.26.2.1.targus-getdata1 > 112.26.2.8.45243: Flags [.], ack 1428, win 24471, options [nop,nop,TS val 111487 ecr 4294856527,mptcp dss ack 3984357927], length 0
17:01:18.071694 IP 112.26.2.8.45243 > 112.26.2.1.targus-getdata1: Flags [.], seq 8568:9996, ack 1, win 685, options [nop,nop,TS val 4294857156 ecr 110830,mptcp dss ack 1375043541 seq 3984413619 subseq 375565 len 1428 csum 0x68fd], length 1428
17:01:18.071970 IP 112.26.2.8.45243 > 112.26.2.1.targus-getdata1: Flags [.], seq 8568:9996, ack 1, win 685, options [nop,nop,TS val 4294857156 ecr 110830,mptcp dss ack 1375043541 seq 3984413619 subseq 375565 len 1428 csum 0x68fd], length 1428
17:01:18.106160 IP 112.26.2.1.targus-getdata1 > 112.26.2.8.45243: Flags [.], ack 2856, win 24486, options [nop,nop,TS val 111547 ecr 4294856650,mptcp dss ack 3984362211], length 0
17:01:18.106390 IP 112.26.2.1.targus-getdata1 > 112.26.2.8.45243: Flags [.], ack 2856, win 24486, options [nop,nop,TS val 111547 ecr 4294856650,mptcp dss ack 3984362211], length 0
17:01:18.128649 IP 112.26.2.8.45243 > 112.26.2.1.targus-getdata1: Flags [.], seq 2856:4284, ack 1, win 685, options [nop,nop,TS val 4294856693 ecr 110343,mptcp dss ack 1375043541 seq 3984395055 subseq 369853 len 1428 csum 0x8c74], length 1428
17:01:18.162744 IP 112.26.2.1.targus-getdata1 > 112.26.2.8.45243: Flags [.], ack 4284, win 24420, options [nop,nop,TS val 111674 ecr 4294856693,mptcp dss ack 3984366495], length 0
17:01:18.162960 IP 112.26.2.1.targus-getdata1 > 112.26.2.8.45243: Flags [.], ack 4284, win 24420, options [nop,nop,TS val 111674 ecr 4294856693,mptcp dss ack 3984366495], length 0
17:01:18.179836 IP 112.26.2.8.45243 > 112.26.2.1.targus-getdata1: Flags [.], seq 9996:11424, ack 1, win 685, options [nop,nop,TS val 4294857311 ecr 110945,mptcp dss ack 1375043541 seq 3984420759 subseq 376993 len 1428 csum 0x8b40], length 1428
17:01:18.180052 IP 112.26.2.8.45243 > 112.26.2.1.targus-getdata1: Flags [.], seq 9996:11424, ack 1, win 685, options [nop,nop,TS val 4294857311 ecr 110945,mptcp dss ack 1375043541 seq 3984420759 subseq 376993 len 1428 csum 0x8b40], length 1428
17:01:18.227802 IP 112.26.2.8.45243 > 112.26.2.1.targus-getdata1: Flags [.], seq 4284:5712, ack 1, win 685, options [nop,nop,TS val 4294856812 ecr 110437,mptcp dss ack 1375043541 seq 3984399339 subseq 371281 len 1428 csum 0x76a8], length 1428
17:01:18.254262 IP 112.26.2.1.targus-getdata1 > 112.26.2.8.45243: Flags [.], ack 5712, win 24420, options [nop,nop,TS val 111776 ecr 4294856812,mptcp dss ack 3984366495], length 0
17:01:18.254433 IP 112.26.2.1.targus-getdata1 > 112.26.2.8.45243: Flags [.], ack 5712, win 24420, options [nop,nop,TS val 111776 ecr 4294856812,mptcp dss ack 3984366495], length 0
17:01:18.282037 IP 112.26.2.8.45243 > 112.26.2.1.targus-getdata1: Flags [.], seq 11424:12852, ack 1, win 685, options [nop,nop,TS val 4294857416 ecr 111051,mptcp dss ack 1375043541 seq 3984427899 subseq 378421 len 1428 csum 0xc9f1], length 1428
17:01:18.282257 IP 112.26.2.8.45243 > 112.26.2.1.targus-getdata1: Flags [.], seq 11424:12852, ack 1, win 685, options [nop,nop,TS val 4294857416 ecr 111051,mptcp dss ack 1375043541 seq 3984427899 subseq 378421 len 1428 csum 0xc9f1], length 1428
17:01:18.377283 IP 112.26.2.8.45243 > 112.26.2.1.targus-getdata1: Flags [.], seq 12852:14280, ack 1, win 685, options [nop,nop,TS val 4294857511 ecr 111200,mptcp dss ack 1375043541 seq 3984430755 subseq 379849 len 1428 csum 0x5ef2], length 1428
17:01:18.377508 IP 112.26.2.8.45243 > 112.26.2.1.targus-getdata1: Flags [.], seq 12852:14280, ack 1, win 685, options [nop,nop,TS val 4294857511 ecr 111200,mptcp dss ack 1375043541 seq 3984430755 subseq 379849 len 1428 csum 0x5ef2], length 1428
17:01:18.385866 IP 112.26.2.8.45243 > 112.26.2.1.targus-getdata1: Flags [.], seq 5712:7140, ack 1, win 685, options [nop,nop,TS val 4294856988 ecr 110699,mptcp dss ack 1375043541 seq 3984406479 subseq 372709 len 1428 csum 0x4e2d], length 1428
17:01:18.456001 IP 112.26.2.8.45243 > 112.26.2.1.targus-getdata1: Flags [.], seq 14280:15708, ack 1, win 685, options [nop,nop,TS val 4294857591 ecr 111351,mptcp dss ack 1375043541 seq 3984433611 subseq 381277 len 1428 csum 0x69c0], length 1428
17:01:18.456190 IP 112.26.2.8.45243 > 112.26.2.1.targus-getdata1: Flags [.], seq 14280:15708, ack 1, win 685, options [nop,nop,TS val 4294857591 ecr 111351,mptcp dss ack 1375043541 seq 3984433611 subseq 381277 len 1428 csum 0x69c0], length 1428
17:01:18.464988 IP 112.26.2.1.targus-getdata1 > 112.26.2.8.45243: Flags [.], ack 7140, win 24420, options [nop,nop,TS val 111934 ecr 4294856988,mptcp dss ack 3984366495], length 0
17:01:18.465160 IP 112.26.2.1.targus-getdata1 > 112.26.2.8.45243: Flags [.], ack 7140, win 24420, options [nop,nop,TS val 111934 ecr 4294856988,mptcp dss ack 3984366495], length 0
17:01:18.503338 IP 112.26.2.8.45243 > 112.26.2.1.targus-getdata1: Flags [.], seq 7140:8568, ack 1, win 685, options [nop,nop,TS val 4294857141 ecr 110766,mptcp dss ack 1375043541 seq 3984412191 subseq 374137 len 1428 csum 0xeaa4], length 1428
17:01:18.563861 IP 112.26.2.1.targus-getdata1 > 112.26.2.8.45243: Flags [.], ack 8568, win 24420, options [nop,nop,TS val 112051 ecr 4294857141,mptcp dss ack 3984366495], length 0
17:01:18.564072 IP 112.26.2.1.targus-getdata1 > 112.26.2.8.45243: Flags [.], ack 8568, win 24420, options [nop,nop,TS val 112051 ecr 4294857141,mptcp dss ack 3984366495], length 0
17:01:18.585680 IP 112.26.2.8.45243 > 112.26.2.1.targus-getdata1: Flags [.], seq 15708:17136, ack 1, win 685, options [nop,nop,TS val 4294857721 ecr 111487,mptcp dss ack 1375043541 seq 3984439323 subseq 382705 len 1428 csum 0xed24], length 1428
17:01:18.585892 IP 112.26.2.8.45243 > 112.26.2.1.targus-getdata1: Flags [.], seq 15708:17136, ack 1, win 685, options [nop,nop,TS val 4294857721 ecr 111487,mptcp dss ack 1375043541 seq 3984439323 subseq 382705 len 1428 csum 0xed24], length 1428
17:01:18.617917 IP 112.26.2.8.45243 > 112.26.2.1.targus-getdata1: Flags [.], seq 8568:9996, ack 1, win 685, options [nop,nop,TS val 4294857156 ecr 110830,mptcp dss ack 1375043541 seq 3984413619 subseq 375565 len 1428 csum 0x68fd], length 1428
17:01:18.701492 IP 112.26.2.1.targus-getdata1 > 112.26.2.8.45243: Flags [.], ack 9996, win 24420, options [nop,nop,TS val 112166 ecr 4294857156,mptcp dss ack 3984366495], length 0
17:01:18.701668 IP 112.26.2.1.targus-getdata1 > 112.26.2.8.45243: Flags [.], ack 9996, win 24420, options [nop,nop,TS val 112166 ecr 4294857156,mptcp dss ack 3984366495], length 0
17:01:18.706409 IP 112.26.2.8.45243 > 112.26.2.1.targus-getdata1: Flags [.], seq 17136:18564, ack 1, win 685, options [nop,nop,TS val 4294857831 ecr 111674,mptcp dss ack 1375043541 seq 3984443607 subseq 384133 len 1428 csum 0x71c5], length 1428
17:01:18.706607 IP 112.26.2.8.45243 > 112.26.2.1.targus-getdata1: Flags [.], seq 17136:18564, ack 1, win 685, options [nop,nop,TS val 4294857831 ecr 111674,mptcp dss ack 1375043541 seq 3984443607 subseq 384133 len 1428 csum 0x71c5], length 1428
17:01:18.747150 IP 112.26.2.8.45243 > 112.26.2.1.targus-getdata1: Flags [.], seq 9996:11424, ack 1, win 685, options [nop,nop,TS val 4294857311 ecr 110945,mptcp dss ack 1375043541 seq 3984420759 subseq 376993 len 1428 csum 0x8b40], length 1428
17:01:18.765653 IP 112.26.2.8.45243 > 112.26.2.1.targus-getdata1: Flags [.], seq 18564:19992, ack 1, win 685, options [nop,nop,TS val 4294857831 ecr 111674,mptcp dss ack 1375043541 seq 3984445035 subseq 385561 len 1428 csum 0xeea3], length 1428
17:01:18.765871 IP 112.26.2.8.45243 > 112.26.2.1.targus-getdata1: Flags [.], seq 18564:19992, ack 1, win 685, options [nop,nop,TS val 4294857831 ecr 111674,mptcp dss ack 1375043541 seq 3984445035 subseq 385561 len 1428 csum 0xeea3], length 1428
17:01:18.802991 IP 112.26.2.1.targus-getdata1 > 112.26.2.8.45243: Flags [.], ack 11424, win 24420, options [nop,nop,TS val 112295 ecr 4294857311,mptcp dss ack 3984366495], length 0
17:01:18.803149 IP 112.26.2.1.targus-getdata1 > 112.26.2.8.45243: Flags [.], ack 11424, win 24420, options [nop,nop,TS val 112295 ecr 4294857311,mptcp dss ack 3984366495], length 0
17:01:18.835408 IP 112.26.2.8.45243 > 112.26.2.1.targus-getdata1: Flags [.], seq 19992:21420, ack 1, win 685, options [nop,nop,TS val 4294857962 ecr 111776,mptcp dss ack 1375043541 seq 3984452175 subseq 386989 len 1428 csum 0x1518], length 1428
17:01:18.835553 IP 112.26.2.8.45243 > 112.26.2.1.targus-getdata1: Flags [.], seq 19992:21420, ack 1, win 685, options [nop,nop,TS val 4294857962 ecr 111776,mptcp dss ack 1375043541 seq 3984452175 subseq 386989 len 1428 csum 0x1518], length 1428
17:01:18.860902 IP 112.26.2.8.45243 > 112.26.2.1.targus-getdata1: Flags [.], seq 21420:22848, ack 1, win 685, options [nop,nop,TS val 4294857962 ecr 111776,mptcp dss ack 1375043541 seq 3984453603 subseq 388417 len 1428 csum 0xe4cc], length 1428
17:01:18.861090 IP 112.26.2.8.45243 > 112.26.2.1.targus-getdata1: Flags [.], seq 21420:22848, ack 1, win 685, options [nop,nop,TS val 4294857962 ecr 111776,mptcp dss ack 1375043541 seq 3984453603 subseq 388417 len 1428 csum 0xe4cc], length 1428
17:01:18.883796 IP 112.26.2.8.45243 > 112.26.2.1.targus-getdata1: Flags [.], seq 11424:12852, ack 1, win 685, options [nop,nop,TS val 4294857416 ecr 111051,mptcp dss ack 1375043541 seq 3984427899 subseq 378421 len 1428 csum 0xc9f1], length 1428
17:01:18.935951 IP 112.26.2.1.targus-getdata1 > 112.26.2.8.45243: Flags [.], ack 12852, win 24420, options [nop,nop,TS val 112417 ecr 4294857416,mptcp dss ack 3984366495], length 0
17:01:18.936112 IP 112.26.2.1.targus-getdata1 > 112.26.2.8.45243: Flags [.], ack 12852, win 24420, options [nop,nop,TS val 112417 ecr 4294857416,mptcp dss ack 3984366495], length 0
17:01:18.972128 IP 112.26.2.8.45243 > 112.26.2.1.targus-getdata1: Flags [.], seq 12852:14280, ack 1, win 685, options [nop,nop,TS val 4294857511 ecr 111200,mptcp dss ack 1375043541 seq 3984430755 subseq 379849 len 1428 csum 0x5ef2], length 1428
17:01:19.058650 IP 112.26.2.8.45243 > 112.26.2.1.targus-getdata1: Flags [.], seq 22848:24276, ack 1, win 685, options [nop,nop,TS val 4294858195 ecr 111934,mptcp dss ack 1375043541 seq 3984459315 subseq 389845 len 1428 csum 0x8d70], length 1428
17:01:19.058879 IP 112.26.2.8.45243 > 112.26.2.1.targus-getdata1: Flags [.], seq 22848:24276, ack 1, win 685, options [nop,nop,TS val 4294858195 ecr 111934,mptcp dss ack 1375043541 seq 3984459315 subseq 389845 len 1428 csum 0x8d70], length 1428
17:01:19.065621 IP 112.26.2.1.targus-getdata1 > 112.26.2.8.45243: Flags [.], ack 14280, win 24420, options [nop,nop,TS val 112520 ecr 4294857511,mptcp dss ack 3984366495], length 0
17:01:19.065832 IP 112.26.2.1.targus-getdata1 > 112.26.2.8.45243: Flags [.], ack 14280, win 24420, options [nop,nop,TS val 112520 ecr 4294857511,mptcp dss ack 3984366495], length 0
17:01:19.115541 IP 112.26.2.8.45243 > 112.26.2.1.targus-getdata1: Flags [.], seq 14280:15708, ack 1, win 685, options [nop,nop,TS val 4294857591 ecr 111351,mptcp dss ack 1375043541 seq 3984433611 subseq 381277 len 1428 csum 0x69c0], length 1428
17:01:19.137308 IP 112.26.2.8.45243 > 112.26.2.1.targus-getdata1: Flags [.], seq 24276:25704, ack 1, win 685, options [nop,nop,TS val 4294858244 ecr 112051,mptcp dss ack 1375043541 seq 3984460743 subseq 391273 len 1428 csum 0x543e], length 1428
17:01:19.137524 IP 112.26.2.8.45243 > 112.26.2.1.targus-getdata1: Flags [.], seq 24276:25704, ack 1, win 685, options [nop,nop,TS val 4294858244 ecr 112051,mptcp dss ack 1375043541 seq 3984460743 subseq 391273 len 1428 csum 0x543e], length 1428
17:01:19.206991 IP 112.26.2.1.targus-getdata1 > 112.26.2.8.45243: Flags [.], ack 15708, win 24420, options [nop,nop,TS val 112663 ecr 4294857591,mptcp dss ack 3984366495], length 0
17:01:19.207177 IP 112.26.2.1.targus-getdata1 > 112.26.2.8.45243: Flags [.], ack 15708, win 24420, options [nop,nop,TS val 112663 ecr 4294857591,mptcp dss ack 3984366495], length 0
17:01:19.239130 IP 112.26.2.8.45243 > 112.26.2.1.targus-getdata1: Flags [.], seq 25704:27132, ack 1, win 685, options [nop,nop,TS val 4294858374 ecr 112166,mptcp dss ack 1375043541 seq 3984463599 subseq 392701 len 1428 csum 0x4cfd], length 1428
17:01:19.239352 IP 112.26.2.8.45243 > 112.26.2.1.targus-getdata1: Flags [.], seq 25704:27132, ack 1, win 685, options [nop,nop,TS val 4294858374 ecr 112166,mptcp dss ack 1375043541 seq 3984463599 subseq 392701 len 1428 csum 0x4cfd], length 1428
17:01:19.257028 IP 112.26.2.8.45243 > 112.26.2.1.targus-getdata1: Flags [.], seq 15708:17136, ack 1, win 685, options [nop,nop,TS val 4294857721 ecr 111487,mptcp dss ack 1375043541 seq 3984439323 subseq 382705 len 1428 csum 0xed24], length 1428
17:01:19.336663 IP 112.26.2.1.targus-getdata1 > 112.26.2.8.45243: Flags [.], ack 17136, win 24420, options [nop,nop,TS val 112803 ecr 4294857721,mptcp dss ack 3984366495], length 0
17:01:19.336865 IP 112.26.2.1.targus-getdata1 > 112.26.2.8.45243: Flags [.], ack 17136, win 24420, options [nop,nop,TS val 112803 ecr 4294857721,mptcp dss ack 3984366495], length 0
17:01:19.390470 IP 112.26.2.8.45243 > 112.26.2.1.targus-getdata1: Flags [.], seq 27132:28560, ack 1, win 685, options [nop,nop,TS val 4294858524 ecr 112295,mptcp dss ack 1375043541 seq 3984467883 subseq 394129 len 1428 csum 0x3b4c], length 1428
17:01:19.390643 IP 112.26.2.8.45243 > 112.26.2.1.targus-getdata1: Flags [.], seq 27132:28560, ack 1, win 685, options [nop,nop,TS val 4294858524 ecr 112295,mptcp dss ack 1375043541 seq 3984467883 subseq 394129 len 1428 csum 0x3b4c], length 1428
17:01:19.404794 IP 112.26.2.8.45243 > 112.26.2.1.targus-getdata1: Flags [.], seq 17136:18564, ack 1, win 685, options [nop,nop,TS val 4294857831 ecr 111674,mptcp dss ack 1375043541 seq 3984443607 subseq 384133 len 1428 csum 0x71c5], length 1428
17:01:19.458381 IP 112.26.2.8.45243 > 112.26.2.1.targus-getdata1: Flags [.], seq 18564:19992, ack 1, win 685, options [nop,nop,TS val 4294857831 ecr 111674,mptcp dss ack 1375043541 seq 3984445035 subseq 385561 len 1428 csum 0xeea3], length 1428
17:01:19.518646 IP 112.26.2.8.45243 > 112.26.2.1.targus-getdata1: Flags [.], seq 28560:29988, ack 1, win 685, options [nop,nop,TS val 4294858654 ecr 112417,mptcp dss ack 1375043541 seq 3984472167 subseq 395557 len 1428 csum 0x46d3], length 1428
17:01:19.518861 IP 112.26.2.8.45243 > 112.26.2.1.targus-getdata1: Flags [.], seq 28560:29988, ack 1, win 685, options [nop,nop,TS val 4294858654 ecr 112417,mptcp dss ack 1375043541 seq 3984472167 subseq 395557 len 1428 csum 0x46d3], length 1428
17:01:19.523211 IP 112.26.2.1.targus-getdata1 > 112.26.2.8.45243: Flags [.], ack 18564, win 24453, options [nop,nop,TS val 112949 ecr 4294857831,mptcp dss ack 3984419331], length 0
17:01:19.523387 IP 112.26.2.1.targus-getdata1 > 112.26.2.8.45243: Flags [.], ack 18564, win 24453, options [nop,nop,TS val 112949 ecr 4294857831,mptcp dss ack 3984419331], length 0
17:01:19.582745 IP 112.26.2.1.targus-getdata1 > 112.26.2.8.45243: Flags [.], ack 19992, win 24453, options [nop,nop,TS val 113006 ecr 4294857831,mptcp dss ack 3984419331], length 0
17:01:19.582923 IP 112.26.2.1.targus-getdata1 > 112.26.2.8.45243: Flags [.], ack 19992, win 24453, options [nop,nop,TS val 113006 ecr 4294857831,mptcp dss ack 3984419331], length 0
17:01:19.651224 IP 112.26.2.8.45243 > 112.26.2.1.targus-getdata1: Flags [.], seq 21420:22848, ack 1, win 685, options [nop,nop,TS val 4294857962 ecr 111776,mptcp dss ack 1375043541 seq 3984453603 subseq 388417 len 1428 csum 0xe4cc], length 1428
17:01:19.664851 IP 112.26.2.8.45243 > 112.26.2.1.targus-getdata1: Flags [.], seq 29988:31416, ack 1, win 685, options [nop,nop,TS val 4294858760 ecr 112520,mptcp dss ack 1375043541 seq 3984476451 subseq 396985 len 1428 csum 0x4d40], length 1428
17:01:19.665113 IP 112.26.2.8.45243 > 112.26.2.1.targus-getdata1: Flags [.], seq 29988:31416, ack 1, win 685, options [nop,nop,TS val 4294858760 ecr 112520,mptcp dss ack 1375043541 seq 3984476451 subseq 396985 len 1428 csum 0x4d40], length 1428
17:01:19.694234 IP 112.26.2.8.45243 > 112.26.2.1.targus-getdata1: Flags [.], seq 22848:24276, ack 1, win 685, options [nop,nop,TS val 4294858195 ecr 111934,mptcp dss ack 1375043541 seq 3984459315 subseq 389845 len 1428 csum 0x8d70], length 1428
17:01:19.694995 IP 112.26.2.8.45243 > 112.26.2.1.targus-getdata1: Flags [.], seq 31416:32844, ack 1, win 685, options [nop,nop,TS val 4294858760 ecr 112520,mptcp dss ack 1375043541 seq 3984477879 subseq 398413 len 1428 csum 0xe083], length 1428
17:01:19.695215 IP 112.26.2.8.45243 > 112.26.2.1.targus-getdata1: Flags [.], seq 31416:32844, ack 1, win 685, options [nop,nop,TS val 4294858760 ecr 112520,mptcp dss ack 1375043541 seq 3984477879 subseq 398413 len 1428 csum 0xe083], length 1428
17:01:19.760285 IP 112.26.2.1.targus-getdata1 > 112.26.2.8.45243: Flags [.], ack 19992, win 24543, options [nop,nop,TS val 113175 ecr 4294857831,nop,nop,sack 1 {21420:22848},mptcp dss ack 3984442179], length 0
17:01:19.760464 IP 112.26.2.1.targus-getdata1 > 112.26.2.8.45243: Flags [.], ack 19992, win 24543, options [nop,nop,TS val 113175 ecr 4294857831,nop,nop,sack 1 {21420:22848},mptcp dss ack 3984442179], length 0
17:01:19.788385 IP 112.26.2.8.45243 > 112.26.2.1.targus-getdata1: Flags [.], seq 32844:34272, ack 1, win 685, options [nop,nop,TS val 4294858922 ecr 112663,mptcp dss ack 1375043541 seq 3984483591 subseq 399841 len 1428 csum 0x17b8], length 1428
17:01:19.788611 IP 112.26.2.8.45243 > 112.26.2.1.targus-getdata1: Flags [.], seq 32844:34272, ack 1, win 685, options [nop,nop,TS val 4294858922 ecr 112663,mptcp dss ack 1375043541 seq 3984483591 subseq 399841 len 1428 csum 0x17b8], length 1428
17:01:19.830764 IP 112.26.2.1.targus-getdata1 > 112.26.2.8.45243: Flags [.], ack 19992, win 24543, options [nop,nop,TS val 113240 ecr 4294857831,nop,nop,sack 1 {21420:24276},mptcp dss ack 3984442179], length 0
17:01:19.830946 IP 112.26.2.1.targus-getdata1 > 112.26.2.8.45243: Flags [.], ack 19992, win 24543, options [nop,nop,TS val 113240 ecr 4294857831,nop,nop,sack 1 {21420:24276},mptcp dss ack 3984442179], length 0
17:01:19.882308 IP 112.26.2.8.45243 > 112.26.2.1.targus-getdata1: Flags [.], seq 24276:25704, ack 1, win 685, options [nop,nop,TS val 4294858244 ecr 112051,mptcp dss ack 1375043541 seq 3984460743 subseq 391273 len 1428 csum 0x543e], length 1428
17:01:19.903760 IP 112.26.2.8.45243 > 112.26.2.1.targus-getdata1: Flags [.], seq 34272:35700, ack 1, win 685, options [nop,nop,TS val 4294859039 ecr 112803,mptcp dss ack 1375043541 seq 3984487875 subseq 401269 len 1428 csum 0xcbb5], length 1428
17:01:19.904029 IP 112.26.2.8.45243 > 112.26.2.1.targus-getdata1: Flags [.], seq 34272:35700, ack 1, win 685, options [nop,nop,TS val 4294859039 ecr 112803,mptcp dss ack 1375043541 seq 3984487875 subseq 401269 len 1428 csum 0xcbb5], length 1428
17:01:19.950515 IP 112.26.2.8.45243 > 112.26.2.1.targus-getdata1: Flags [.], seq 25704:27132, ack 1, win 685, options [nop,nop,TS val 4294858374 ecr 112166,mptcp dss ack 1375043541 seq 3984463599 subseq 392701 len 1428 csum 0x4cfd], length 1428
17:01:20.028609 IP 112.26.2.1.targus-getdata1 > 112.26.2.8.45243: Flags [.], ack 19992, win 24522, options [nop,nop,TS val 113430 ecr 4294857831,nop,nop,sack 1 {21420:25704},mptcp dss ack 3984452175], length 0
17:01:20.028809 IP 112.26.2.1.targus-getdata1 > 112.26.2.8.45243: Flags [.], ack 19992, win 24522, options [nop,nop,TS val 113430 ecr 4294857831,nop,nop,sack 1 {21420:25704},mptcp dss ack 3984452175], length 0
17:01:20.052022 IP 112.26.2.8.45243 > 112.26.2.1.targus-getdata1: Flags [.], seq 35700:37128, ack 1, win 685, options [nop,nop,TS val 4294859183 ecr 112949,mptcp dss ack 1375043541 seq 3984492159 subseq 402697 len 1428 csum 0xea19], length 1428
17:01:20.052209 IP 112.26.2.8.45243 > 112.26.2.1.targus-getdata1: Flags [.], seq 35700:37128, ack 1, win 685, options [nop,nop,TS val 4294859183 ecr 112949,mptcp dss ack 1375043541 seq 3984492159 subseq 402697 len 1428 csum 0xea19], length 1428
17:01:20.078045 IP 112.26.2.1.targus-getdata1 > 112.26.2.8.45243: Flags [.], ack 19992, win 24522, options [nop,nop,TS val 113498 ecr 4294857831,nop,nop,sack 1 {21420:27132},mptcp dss ack 3984452175], length 0
17:01:20.078295 IP 112.26.2.1.targus-getdata1 > 112.26.2.8.45243: Flags [.], ack 19992, win 24522, options [nop,nop,TS val 113498 ecr 4294857831,nop,nop,sack 1 {21420:27132},mptcp dss ack 3984452175], length 0
17:01:20.108512 IP 112.26.2.8.45243 > 112.26.2.1.targus-getdata1: Flags [.], seq 37128:38556, ack 1, win 685, options [nop,nop,TS val 4294859245 ecr 113006,mptcp dss ack 1375043541 seq 3984496443 subseq 404125 len 1428 csum 0x9038], length 1428
17:01:20.108729 IP 112.26.2.8.45243 > 112.26.2.1.targus-getdata1: Flags [.], seq 37128:38556, ack 1, win 685, options [nop,nop,TS val 4294859245 ecr 113006,mptcp dss ack 1375043541 seq 3984496443 subseq 404125 len 1428 csum 0x9038], length 1428
17:01:20.152132 IP 112.26.2.8.45243 > 112.26.2.1.targus-getdata1: Flags [.], seq 27132:28560, ack 1, win 685, options [nop,nop,TS val 4294858524 ecr 112295,mptcp dss ack 1375043541 seq 3984467883 subseq 394129 len 1428 csum 0x3b4c], length 1428
17:01:20.195245 IP 112.26.2.8.45243 > 112.26.2.1.targus-getdata1: Flags [.], seq 28560:29988, ack 1, win 685, options [nop,nop,TS val 4294858654 ecr 112417,mptcp dss ack 1375043541 seq 3984472167 subseq 395557 len 1428 csum 0x46d3], length 1428
17:01:20.275373 IP 112.26.2.1.targus-getdata1 > 112.26.2.8.45243: Flags [.], ack 19992, win 24522, options [nop,nop,TS val 113693 ecr 4294857831,nop,nop,sack 1 {21420:28560},mptcp dss ack 3984452175], length 0
17:01:20.275595 IP 112.26.2.1.targus-getdata1 > 112.26.2.8.45243: Flags [.], ack 19992, win 24522, options [nop,nop,TS val 113693 ecr 4294857831,nop,nop,sack 1 {21420:28560},mptcp dss ack 3984452175], length 0
17:01:20.321917 IP 112.26.2.8.45243 > 112.26.2.1.targus-getdata1: Flags [.], seq 38556:39984, ack 1, win 685, options [nop,nop,TS val 4294859458 ecr 113175,mptcp dss ack 1375043541 seq 3984505011 subseq 405553 len 1428 csum 0xa2ca], length 1428
17:01:20.322133 IP 112.26.2.8.45243 > 112.26.2.1.targus-getdata1: Flags [.], seq 38556:39984, ack 1, win 685, options [nop,nop,TS val 4294859458 ecr 113175,mptcp dss ack 1375043541 seq 3984505011 subseq 405553 len 1428 csum 0xa2ca], length 1428
17:01:20.330233 IP 112.26.2.8.45243 > 112.26.2.1.targus-getdata1: Flags [.], seq 29988:31416, ack 1, win 685, options [nop,nop,TS val 4294858760 ecr 112520,mptcp dss ack 1375043541 seq 3984476451 subseq 396985 len 1428 csum 0x4d40], length 1428
17:01:20.402815 IP 112.26.2.1.targus-getdata1 > 112.26.2.8.45243: Flags [.], ack 19992, win 24522, options [nop,nop,TS val 113743 ecr 4294857831,nop,nop,sack 1 {21420:29988},mptcp dss ack 3984452175], length 0
17:01:20.402987 IP 112.26.2.1.targus-getdata1 > 112.26.2.8.45243: Flags [.], ack 19992, win 24522, options [nop,nop,TS val 113743 ecr 4294857831,nop,nop,sack 1 {21420:29988},mptcp dss ack 3984452175], length 0
17:01:20.427117 IP 112.26.2.8.45243 > 112.26.2.1.targus-getdata1: Flags [.], seq 39984:41412, ack 1, win 685, options [nop,nop,TS val 4294859563 ecr 113240,mptcp dss ack 1375043541 seq 3984510723 subseq 406981 len 1428 csum 0x9e], length 1428
17:01:20.427292 IP 112.26.2.8.45243 > 112.26.2.1.targus-getdata1: Flags [.], seq 39984:41412, ack 1, win 685, options [nop,nop,TS val 4294859563 ecr 113240,mptcp dss ack 1375043541 seq 3984510723 subseq 406981 len 1428 csum 0x9e], length 1428
17:01:20.450414 IP 112.26.2.8.45243 > 112.26.2.1.targus-getdata1: Flags [.], seq 31416:32844, ack 1, win 685, options [nop,nop,TS val 4294858760 ecr 112520,mptcp dss ack 1375043541 seq 3984477879 subseq 398413 len 1428 csum 0xe083], length 1428
17:01:20.515045 IP 112.26.2.1.targus-getdata1 > 112.26.2.8.45243: Flags [.], ack 19992, win 24522, options [nop,nop,TS val 113874 ecr 4294857831,nop,nop,sack 1 {21420:31416},mptcp dss ack 3984452175], length 0
17:01:20.515266 IP 112.26.2.1.targus-getdata1 > 112.26.2.8.45243: Flags [.], ack 19992, win 24522, options [nop,nop,TS val 113874 ecr 4294857831,nop,nop,sack 1 {21420:31416},mptcp dss ack 3984452175], length 0
17:01:20.566118 IP 112.26.2.8.45243 > 112.26.2.1.targus-getdata1: Flags [.], seq 32844:34272, ack 1, win 685, options [nop,nop,TS val 4294858922 ecr 112663,mptcp dss ack 1375043541 seq 3984483591 subseq 399841 len 1428 csum 0x17b8], length 1428
17:01:20.630325 IP 112.26.2.1.targus-getdata1 > 112.26.2.8.45243: Flags [.], ack 19992, win 24522, options [nop,nop,TS val 113992 ecr 4294857831,nop,nop,sack 1 {21420:32844},mptcp dss ack 3984452175], length 0
17:01:20.630542 IP 112.26.2.1.targus-getdata1 > 112.26.2.8.45243: Flags [.], ack 19992, win 24522, options [nop,nop,TS val 113992 ecr 4294857831,nop,nop,sack 1 {21420:32844},mptcp dss ack 3984452175], length 0
17:01:20.635140 IP 112.26.2.8.45243 > 112.26.2.1.targus-getdata1: Flags [P.], seq 41412:42840, ack 1, win 685, options [nop,nop,TS val 4294859750 ecr 113430,mptcp dss ack 1375043541 seq 3984517863 subseq 408409 len 1428 csum 0x4ea2], length 1428
17:01:20.635348 IP 112.26.2.8.45243 > 112.26.2.1.targus-getdata1: Flags [P.], seq 41412:42840, ack 1, win 685, options [nop,nop,TS val 4294859750 ecr 113430,mptcp dss ack 1375043541 seq 3984517863 subseq 408409 len 1428 csum 0x4ea2], length 1428
17:01:20.684256 IP 112.26.2.8.45243 > 112.26.2.1.targus-getdata1: Flags [.], seq 34272:35700, ack 1, win 685, options [nop,nop,TS val 4294859039 ecr 112803,mptcp dss ack 1375043541 seq 3984487875 subseq 401269 len 1428 csum 0xcbb5], length 1428
17:01:20.753593 IP 112.26.2.8.45243 > 112.26.2.1.targus-getdata1: Flags [.], seq 42840:44268, ack 1, win 685, options [nop,nop,TS val 4294859883 ecr 113693,mptcp dss ack 1375043541 seq 3984523575 subseq 409837 len 1428 csum 0x7504], length 1428
17:01:20.753779 IP 112.26.2.8.45243 > 112.26.2.1.targus-getdata1: Flags [.], seq 42840:44268, ack 1, win 685, options [nop,nop,TS val 4294859883 ecr 113693,mptcp dss ack 1375043541 seq 3984523575 subseq 409837 len 1428 csum 0x7504], length 1428
17:01:20.768380 IP 112.26.2.1.targus-getdata1 > 112.26.2.8.45243: Flags [.], ack 19992, win 24522, options [nop,nop,TS val 114114 ecr 4294857831,nop,nop,sack 1 {21420:34272},mptcp dss ack 3984452175], length 0
17:01:20.768545 IP 112.26.2.1.targus-getdata1 > 112.26.2.8.45243: Flags [.], ack 19992, win 24522, options [nop,nop,TS val 114114 ecr 4294857831,nop,nop,sack 1 {21420:34272},mptcp dss ack 3984452175], length 0
17:01:20.817138 IP 112.26.2.8.45243 > 112.26.2.1.targus-getdata1: Flags [.], seq 44268:45696, ack 1, win 685, options [nop,nop,TS val 4294859883 ecr 113693,mptcp dss ack 1375043541 seq 3984525003 subseq 411265 len 1428 csum 0x7f2d], length 1428
17:01:20.817327 IP 112.26.2.8.45243 > 112.26.2.1.targus-getdata1: Flags [.], seq 44268:45696, ack 1, win 685, options [nop,nop,TS val 4294859883 ecr 113693,mptcp dss ack 1375043541 seq 3984525003 subseq 411265 len 1428 csum 0x7f2d], length 1428
17:01:20.828814 IP 112.26.2.8.45243 > 112.26.2.1.targus-getdata1: Flags [.], seq 35700:37128, ack 1, win 685, options [nop,nop,TS val 4294859183 ecr 112949,mptcp dss ack 1375043541 seq 3984492159 subseq 402697 len 1428 csum 0xea19], length 1428
17:01:20.869453 IP 112.26.2.8.45243 > 112.26.2.1.targus-getdata1: Flags [.], seq 37128:38556, ack 1, win 685, options [nop,nop,TS val 4294859245 ecr 113006,mptcp dss ack 1375043541 seq 3984496443 subseq 404125 len 1428 csum 0x9038], length 1428
17:01:20.927217 IP 112.26.2.1.targus-getdata1 > 112.26.2.8.45243: Flags [.], ack 19992, win 24522, options [nop,nop,TS val 114232 ecr 4294857831,nop,nop,sack 1 {21420:35700},mptcp dss ack 3984452175], length 0
17:01:20.927397 IP 112.26.2.1.targus-getdata1 > 112.26.2.8.45243: Flags [.], ack 19992, win 24522, options [nop,nop,TS val 114232 ecr 4294857831,nop,nop,sack 1 {21420:35700},mptcp dss ack 3984452175], length 0
17:01:20.943263 IP 112.26.2.8.45243 > 112.26.2.1.targus-getdata1: Flags [.], seq 45696:47124, ack 1, win 685, options [nop,nop,TS val 4294860067 ecr 113743,mptcp dss ack 1375043541 seq 3984529287 subseq 412693 len 1428 csum 0xb41e], length 1428
17:01:20.943407 IP 112.26.2.8.45243 > 112.26.2.1.targus-getdata1: Flags [.], seq 45696:47124, ack 1, win 685, options [nop,nop,TS val 4294860067 ecr 113743,mptcp dss ack 1375043541 seq 3984529287 subseq 412693 len 1428 csum 0xb41e], length 1428
17:01:21.000588 IP 112.26.2.8.45243 > 112.26.2.1.targus-getdata1: Flags [.], seq 38556:39984, ack 1, win 685, options [nop,nop,TS val 4294859458 ecr 113175,mptcp dss ack 1375043541 seq 3984505011 subseq 405553 len 1428 csum 0xa2ca], length 1428
17:01:21.014447 IP 112.26.2.8.45243 > 112.26.2.1.targus-getdata1: Flags [.], seq 47124:48552, ack 1, win 685, options [nop,nop,TS val 4294860100 ecr 113874,mptcp dss ack 1375043541 seq 3984532143 subseq 414121 len 1428 csum 0xc0df], length 1428
17:01:21.014647 IP 112.26.2.8.45243 > 112.26.2.1.targus-getdata1: Flags [.], seq 47124:48552, ack 1, win 685, options [nop,nop,TS val 4294860100 ecr 113874,mptcp dss ack 1375043541 seq 3984532143 subseq 414121 len 1428 csum 0xc0df], length 1428
17:01:21.063721 IP 112.26.2.1.targus-getdata1 > 112.26.2.8.45243: Flags [.], ack 19992, win 24522, options [nop,nop,TS val 114355 ecr 4294857831,nop,nop,sack 1 {21420:37128},mptcp dss ack 3984452175], length 0
17:01:21.063960 IP 112.26.2.1.targus-getdata1 > 112.26.2.8.45243: Flags [.], ack 19992, win 24522, options [nop,nop,TS val 114355 ecr 4294857831,nop,nop,sack 1 {21420:37128},mptcp dss ack 3984452175], length 0
17:01:21.080197 IP 112.26.2.8.45243 > 112.26.2.1.targus-getdata1: Flags [.], seq 48552:49980, ack 1, win 685, options [nop,nop,TS val 4294860214 ecr 113992,mptcp dss ack 1375043541 seq 3984534999 subseq 415549 len 1428 csum 0x239c], length 1428
17:01:21.080413 IP 112.26.2.8.45243 > 112.26.2.1.targus-getdata1: Flags [.], seq 48552:49980, ack 1, win 685, options [nop,nop,TS val 4294860214 ecr 113992,mptcp dss ack 1375043541 seq 3984534999 subseq 415549 len 1428 csum 0x239c], length 1428
17:01:21.126770 IP 112.26.2.1.targus-getdata1 > 112.26.2.8.45243: Flags [.], ack 19992, win 24522, options [nop,nop,TS val 114417 ecr 4294857831,nop,nop,sack 1 {21420:38556},mptcp dss ack 3984452175], length 0
17:01:21.126935 IP 112.26.2.1.targus-getdata1 > 112.26.2.8.45243: Flags [.], ack 19992, win 24522, options [nop,nop,TS val 114417 ecr 4294857831,nop,nop,sack 1 {21420:38556},mptcp dss ack 3984452175], length 0
17:01:21.142555 IP 112.26.2.8.45243 > 112.26.2.1.targus-getdata1: Flags [.], seq 19992:21420, ack 1, win 685, options [nop,nop,TS val 4294860224 ecr 113992,mptcp dss ack 1375043541 seq 3984452175 subseq 386989 len 1428 csum 0x1518], length 1428
17:01:21.142763 IP 112.26.2.8.45243 > 112.26.2.1.targus-getdata1: Flags [.], seq 19992:21420, ack 1, win 685, options [nop,nop,TS val 4294860224 ecr 113992,mptcp dss ack 1375043541 seq 3984452175 subseq 386989 len 1428 csum 0x1518], length 1428
17:01:21.178990 IP 112.26.2.8.45243 > 112.26.2.1.targus-getdata1: Flags [.], seq 39984:41412, ack 1, win 685, options [nop,nop,TS val 4294859563 ecr 113240,mptcp dss ack 1375043541 seq 3984510723 subseq 406981 len 1428 csum 0x9e], length 1428
17:01:21.258702 IP 112.26.2.1.targus-getdata1 > 112.26.2.8.45243: Flags [.], ack 19992, win 24522, options [nop,nop,TS val 114548 ecr 4294857831,nop,nop,sack 1 {21420:39984},mptcp dss ack 3984452175], length 0
17:01:21.258834 IP 112.26.2.1.targus-getdata1 > 112.26.2.8.45243: Flags [.], ack 19992, win 24522, options [nop,nop,TS val 114548 ecr 4294857831,nop,nop,sack 1 {21420:39984},mptcp dss ack 3984452175], length 0
17:01:21.293037 IP 112.26.2.8.45243 > 112.26.2.1.targus-getdata1: Flags [.], seq 49980:51408, ack 1, win 685, options [nop,nop,TS val 4294860427 ecr 114114,mptcp dss ack 1375043541 seq 3984460743 subseq 416977 len 1428 csum 0xefd5], length 1428
17:01:21.293240 IP 112.26.2.8.45243 > 112.26.2.1.targus-getdata1: Flags [.], seq 49980:51408, ack 1, win 685, options [nop,nop,TS val 4294860427 ecr 114114,mptcp dss ack 1375043541 seq 3984460743 subseq 416977 len 1428 csum 0xefd5], length 1428
17:01:21.312150 IP 112.26.2.8.45243 > 112.26.2.1.targus-getdata1: Flags [P.], seq 41412:42840, ack 1, win 685, options [nop,nop,TS val 4294859750 ecr 113430,mptcp dss ack 1375043541 seq 3984517863 subseq 408409 len 1428 csum 0x4ea2], length 1428
17:01:21.407810 IP 112.26.2.8.45243 > 112.26.2.1.targus-getdata1: Flags [.], seq 42840:44268, ack 1, win 685, options [nop,nop,TS val 4294859883 ecr 113693,mptcp dss ack 1375043541 seq 3984523575 subseq 409837 len 1428 csum 0x7504], length 1428
17:01:21.423002 IP 112.26.2.8.45243 > 112.26.2.1.targus-getdata1: Flags [.], seq 51408:52836, ack 1, win 685, options [nop,nop,TS val 4294860559 ecr 114232,mptcp dss ack 1375043541 seq 3984476451 subseq 418405 len 1428 csum 0xf993], length 1428
17:01:21.423196 IP 112.26.2.8.45243 > 112.26.2.1.targus-getdata1: Flags [.], seq 51408:52836, ack 1, win 685, options [nop,nop,TS val 4294860559 ecr 114232,mptcp dss ack 1375043541 seq 3984476451 subseq 418405 len 1428 csum 0xf993], length 1428
17:01:21.439017 IP 112.26.2.1.targus-getdata1 > 112.26.2.8.45243: Flags [.], ack 19992, win 24522, options [nop,nop,TS val 114727 ecr 4294857831,nop,nop,sack 1 {21420:41412},mptcp dss ack 3984452175], length 0
17:01:21.439153 IP 112.26.2.1.targus-getdata1 > 112.26.2.8.45243: Flags [.], ack 19992, win 24522, options [nop,nop,TS val 114727 ecr 4294857831,nop,nop,sack 1 {21420:41412},mptcp dss ack 3984452175], length 0
17:01:21.501281 IP 112.26.2.8.45243 > 112.26.2.1.targus-getdata1: Flags [.], seq 44268:45696, ack 1, win 685, options [nop,nop,TS val 4294859883 ecr 113693,mptcp dss ack 1375043541 seq 3984525003 subseq 411265 len 1428 csum 0x7f2d], length 1428
17:01:21.550256 IP 112.26.2.1.targus-getdata1 > 112.26.2.8.45243: Flags [.], ack 19992, win 24522, options [nop,nop,TS val 114860 ecr 4294857831,nop,nop,sack 1 {21420:42840},mptcp dss ack 3984452175], length 0
17:01:21.550390 IP 112.26.2.1.targus-getdata1 > 112.26.2.8.45243: Flags [.], ack 19992, win 24522, options [nop,nop,TS val 114860 ecr 4294857831,nop,nop,sack 1 {21420:42840},mptcp dss ack 3984452175], length 0
17:01:21.614984 IP 112.26.2.8.45243 > 112.26.2.1.targus-getdata1: Flags [.], seq 52836:54264, ack 1, win 685, options [nop,nop,TS val 4294860751 ecr 114355,mptcp dss ack 1375043541 seq 3984510723 subseq 419833 len 1428 csum 0xce69], length 1428
17:01:21.615160 IP 112.26.2.8.45243 > 112.26.2.1.targus-getdata1: Flags [.], seq 52836:54264, ack 1, win 685, options [nop,nop,TS val 4294860751 ecr 114355,mptcp dss ack 1375043541 seq 3984510723 subseq 419833 len 1428 csum 0xce69], length 1428
17:01:21.638874 IP 112.26.2.8.45243 > 112.26.2.1.targus-getdata1: Flags [.], seq 45696:47124, ack 1, win 685, options [nop,nop,TS val 4294860067 ecr 113743,mptcp dss ack 1375043541 seq 3984529287 subseq 412693 len 1428 csum 0xb41e], length 1428
17:01:21.695007 IP 112.26.2.1.targus-getdata1 > 112.26.2.8.45243: Flags [.], ack 19992, win 24522, options [nop,nop,TS val 114956 ecr 4294857831,nop,nop,sack 1 {21420:44268},mptcp dss ack 3984452175], length 0
17:01:21.695139 IP 112.26.2.1.targus-getdata1 > 112.26.2.8.45243: Flags [.], ack 19992, win 24522, options [nop,nop,TS val 114956 ecr 4294857831,nop,nop,sack 1 {21420:44268},mptcp dss ack 3984452175], length 0
17:01:21.753669 IP 112.26.2.8.45243 > 112.26.2.1.targus-getdata1: Flags [.], seq 47124:48552, ack 1, win 685, options [nop,nop,TS val 4294860100 ecr 113874,mptcp dss ack 1375043541 seq 3984532143 subseq 414121 len 1428 csum 0xc0df], length 1428
17:01:21.792947 IP 112.26.2.8.45243 > 112.26.2.1.targus-getdata1: Flags [.], seq 54264:55692, ack 1, win 685, options [nop,nop,TS val 4294860922 ecr 114548,mptcp dss ack 1375043541 seq 3984536427 subseq 421261 len 1428 csum 0x83c4], length 1428
17:01:21.793100 IP 112.26.2.8.45243 > 112.26.2.1.targus-getdata1: Flags [.], seq 54264:55692, ack 1, win 685, options [nop,nop,TS val 4294860922 ecr 114548,mptcp dss ack 1375043541 seq 3984536427 subseq 421261 len 1428 csum 0x83c4], length 1428
17:01:21.806327 IP 112.26.2.1.targus-getdata1 > 112.26.2.8.45243: Flags [.], ack 19992, win 24522, options [nop,nop,TS val 115049 ecr 4294857831,nop,nop,sack 1 {21420:45696},mptcp dss ack 3984452175], length 0
17:01:21.806495 IP 112.26.2.1.targus-getdata1 > 112.26.2.8.45243: Flags [.], ack 19992, win 24522, options [nop,nop,TS val 115049 ecr 4294857831,nop,nop,sack 1 {21420:45696},mptcp dss ack 3984452175], length 0
17:01:21.870309 IP 112.26.2.8.45243 > 112.26.2.1.targus-getdata1: Flags [.], seq 48552:49980, ack 1, win 685, options [nop,nop,TS val 4294860214 ecr 113992,mptcp dss ack 1375043541 seq 3984534999 subseq 415549 len 1428 csum 0x239c], length 1428
17:01:21.909843 IP 112.26.2.1.targus-getdata1 > 112.26.2.8.45243: Flags [.], ack 19992, win 24500, options [nop,nop,TS val 115179 ecr 4294857831,nop,nop,sack 1 {21420:47124},mptcp dss ack 3984453603], length 0
17:01:21.910043 IP 112.26.2.1.targus-getdata1 > 112.26.2.8.45243: Flags [.], ack 19992, win 24500, options [nop,nop,TS val 115179 ecr 4294857831,nop,nop,sack 1 {21420:47124},mptcp dss ack 3984453603], length 0
17:01:21.926894 IP 112.26.2.8.45243 > 112.26.2.1.targus-getdata1: Flags [.], seq 55692:57120, ack 1, win 685, options [nop,nop,TS val 4294861054 ecr 114727,mptcp dss ack 1375043541 seq 3984539283 subseq 422689 len 1428 csum 0xbef3], length 1428
