17:00:34.953650 IP 112.26.1.8.37793 > 112.26.1.1.targus-getdata1: Flags [S], seq 821926341, win 29200, options [mss 1460,sackOK,TS val 4294813937 ecr 0,nop,wscale 7,mptcp join id 6 token 0xb697b9d8 nonce 0x92d71eaf], length 0
17:00:35.010051 IP 112.26.1.1.targus-getdata1 > 112.26.1.8.37793: Flags [S.], seq 3006354698, ack 821926342, win 65535, options [mss 1460,sackOK,TS val 68502 ecr 4294813937,nop,wscale 6,mptcp join id 3 hmac 0x735be13dace5516d nonce 0xff58075], length 0
17:00:35.094160 IP 112.26.1.1.targus-getdata1 > 112.26.1.8.37793: Flags [S.], seq 3006354698, ack 821926342, win 65535, options [mss 1460,sackOK,TS val 68502 ecr 4294813937,nop,wscale 6,mptcp join id 3 hmac 0x735be13dace5516d nonce 0xff58075], length 0
17:00:35.248932 IP 112.26.1.8.37793 > 112.26.1.1.targus-getdata1: Flags [.], ack 1, win 457, options [nop,nop,TS val 4294814285 ecr 68502,mptcp join hmac 0x3c5a046c3b2eb72e2d38f0fd78874c77de3325f3], length 0
17:00:35.328249 IP 112.26.1.8.37793 > 112.26.1.1.targus-getdata1: Flags [.], ack 1, win 457, options [nop,nop,TS val 4294814285 ecr 68502,mptcp join hmac 0x3c5a046c3b2eb72e2d38f0fd78874c77de3325f3], length 0
17:00:35.328477 IP 112.26.1.1.targus-getdata1 > 112.26.1.8.37793: Flags [.], ack 1, win 4017, options [nop,nop,TS val 68876 ecr 4294814285,mptcp dss ack 2376860407], length 0
17:00:35.385896 IP 112.26.1.1.targus-getdata1 > 112.26.1.8.37793: Flags [.], ack 1, win 4017, options [nop,nop,TS val 68876 ecr 4294814285,mptcp dss ack 2376860407], length 0
17:01:02.825384 IP 112.26.1.8.38391 > 112.26.1.1.targus-getdata1: Flags [P.], seq 2612413840:2612415268, ack 1284021609, win 685, options [nop,nop,TS val 4294841416 ecr 95261,mptcp dss ack 1375043541 seq 3983762451 subseq 214201 len 1428 csum 0x144d], length 1428
17:01:02.825747 IP 112.26.1.1.targus-getdata1 > 112.26.1.8.38391: Flags [.], ack 1428, win 24223, options [nop,nop,TS val 96373 ecr 4294841416,mptcp dss ack 3983701047], length 0
17:01:02.876980 IP 112.26.1.1.targus-getdata1 > 112.26.1.8.38391: Flags [.], ack 0, win 24223, options [nop,nop,TS val 96279 ecr 4294841291,mptcp dss ack 3983701047], length 0
17:01:02.932793 IP 112.26.1.8.38391 > 112.26.1.1.targus-getdata1: Flags [.], seq 1428:2856, ack 1, win 685, options [nop,nop,TS val 4294841557 ecr 95366,mptcp dss ack 1375043541 seq 3983768163 subseq 215629 len 1428 csum 0xf286], length 1428
17:01:02.933122 IP 112.26.1.1.targus-getdata1 > 112.26.1.8.38391: Flags [.], ack 2856, win 24223, options [nop,nop,TS val 96481 ecr 4294841557,mptcp dss ack 3983701047], length 0
17:01:03.002495 IP 112.26.1.1.targus-getdata1 > 112.26.1.8.38391: Flags [.], ack 1428, win 24223, options [nop,nop,TS val 96373 ecr 4294841416,mptcp dss ack 3983701047], length 0
17:01:03.066999 IP 112.26.1.1.targus-getdata1 > 112.26.1.8.38391: Flags [.], ack 2856, win 24223, options [nop,nop,TS val 96481 ecr 4294841557,mptcp dss ack 3983701047], length 0
17:01:03.101460 IP 112.26.1.8.38391 > 112.26.1.1.targus-getdata1: Flags [.], seq 2856:4284, ack 1, win 685, options [nop,nop,TS val 4294841645 ecr 95496,mptcp dss ack 1375043541 seq 3983772447 subseq 217057 len 1428 csum 0xde33], length 1428
17:01:03.101848 IP 112.26.1.1.targus-getdata1 > 112.26.1.8.38391: Flags [.], ack 4284, win 24223, options [nop,nop,TS val 96650 ecr 4294841645,mptcp dss ack 3983701047], length 0
17:01:03.132367 IP 112.26.1.8.38391 > 112.26.1.1.targus-getdata1: Flags [.], seq 4284:5712, ack 1, win 685, options [nop,nop,TS val 4294841755 ecr 95566,mptcp dss ack 1375043541 seq 3983775303 subseq 218485 len 1428 csum 0x1336], length 1428
17:01:03.132699 IP 112.26.1.1.targus-getdata1 > 112.26.1.8.38391: Flags [.], ack 5712, win 24223, options [nop,nop,TS val 96681 ecr 4294841755,mptcp dss ack 3983701047], length 0
17:01:03.216406 IP 112.26.1.1.targus-getdata1 > 112.26.1.8.38391: Flags [.], ack 4284, win 24223, options [nop,nop,TS val 96650 ecr 4294841645,mptcp dss ack 3983701047], length 0
17:01:03.261368 IP 112.26.1.1.targus-getdata1 > 112.26.1.8.38391: Flags [.], ack 5712, win 24223, options [nop,nop,TS val 96681 ecr 4294841755,mptcp dss ack 3983701047], length 0
17:01:03.321024 IP 112.26.1.8.38391 > 112.26.1.1.targus-getdata1: Flags [.], seq 5712:7140, ack 1, win 685, options [nop,nop,TS val 4294841846 ecr 95670,mptcp dss ack 1375043541 seq 3983778159 subseq 219913 len 1428 csum 0xb910], length 1428
17:01:03.321361 IP 112.26.1.1.targus-getdata1 > 112.26.1.8.38391: Flags [.], ack 7140, win 24365, options [nop,nop,TS val 96869 ecr 4294841846,mptcp dss ack 3983736747], length 0
17:01:03.361734 IP 112.26.1.8.38391 > 112.26.1.1.targus-getdata1: Flags [.], seq 7140:8568, ack 1, win 685, options [nop,nop,TS val 4294841846 ecr 95670,mptcp dss ack 1375043541 seq 3983779587 subseq 221341 len 1428 csum 0xa11e], length 1428
17:01:03.362081 IP 112.26.1.1.targus-getdata1 > 112.26.1.8.38391: Flags [.], ack 8568, win 24365, options [nop,nop,TS val 96910 ecr 4294841846,mptcp dss ack 3983736747], length 0
17:01:03.440215 IP 112.26.1.1.targus-getdata1 > 112.26.1.8.38391: Flags [.], ack 7140, win 24365, options [nop,nop,TS val 96869 ecr 4294841846,mptcp dss ack 3983736747], length 0
17:01:03.482024 IP 112.26.1.1.targus-getdata1 > 112.26.1.8.38391: Flags [.], ack 8568, win 24365, options [nop,nop,TS val 96910 ecr 4294841846,mptcp dss ack 3983736747], length 0
17:01:03.540647 IP 112.26.1.8.38391 > 112.26.1.1.targus-getdata1: Flags [.], seq 8568:9996, ack 1, win 685, options [nop,nop,TS val 4294842006 ecr 95802,mptcp dss ack 1375043541 seq 3983781015 subseq 222769 len 1428 csum 0x1203], length 1428
17:01:03.540911 IP 112.26.1.1.targus-getdata1 > 112.26.1.8.38391: Flags [.], ack 9996, win 24401, options [nop,nop,TS val 97089 ecr 4294842006,mptcp dss ack 3983746743], length 0
17:01:03.605656 IP 112.26.1.8.38391 > 112.26.1.1.targus-getdata1: Flags [.], seq 9996:11424, ack 1, win 685, options [nop,nop,TS val 4294842085 ecr 95896,mptcp dss ack 1375043541 seq 3983782443 subseq 224197 len 1428 csum 0xa9b6], length 1428
17:01:03.605980 IP 112.26.1.1.targus-getdata1 > 112.26.1.8.38391: Flags [.], ack 11424, win 24422, options [nop,nop,TS val 97154 ecr 4294842085,mptcp dss ack 3983752455], length 0
17:01:03.649713 IP 112.26.1.1.targus-getdata1 > 112.26.1.8.38391: Flags [.], ack 9996, win 24401, options [nop,nop,TS val 97089 ecr 4294842006,mptcp dss ack 3983746743], length 0
17:01:03.729358 IP 112.26.1.1.targus-getdata1 > 112.26.1.8.38391: Flags [.], ack 11424, win 24422, options [nop,nop,TS val 97154 ecr 4294842085,mptcp dss ack 3983752455], length 0
17:01:03.772807 IP 112.26.1.8.38391 > 112.26.1.1.targus-getdata1: Flags [.], seq 11424:12852, ack 1, win 685, options [nop,nop,TS val 4294842228 ecr 96078,mptcp dss ack 1375043541 seq 3983785299 subseq 225625 len 1428 csum 0x9580], length 1428
17:01:03.773139 IP 112.26.1.1.targus-getdata1 > 112.26.1.8.38391: Flags [.], ack 12852, win 24400, options [nop,nop,TS val 97321 ecr 4294842228,mptcp dss ack 3983753883], length 0
17:01:03.867891 IP 112.26.1.1.targus-getdata1 > 112.26.1.8.38391: Flags [.], ack 12852, win 24400, options [nop,nop,TS val 97321 ecr 4294842228,mptcp dss ack 3983753883], length 0
17:01:03.946918 IP 112.26.1.8.38391 > 112.26.1.1.targus-getdata1: Flags [.], seq 12852:14280, ack 1, win 685, options [nop,nop,TS val 4294842438 ecr 96153,mptcp dss ack 1375043541 seq 3983792439 subseq 227053 len 1428 csum 0xd68d], length 1428
17:01:03.947241 IP 112.26.1.1.targus-getdata1 > 112.26.1.8.38391: Flags [.], ack 14280, win 24400, options [nop,nop,TS val 97495 ecr 4294842438,mptcp dss ack 3983753883], length 0
17:01:03.999827 IP 112.26.1.8.38391 > 112.26.1.1.targus-getdata1: Flags [.], seq 14280:15708, ack 1, win 685, options [nop,nop,TS val 4294842512 ecr 96279,mptcp dss ack 1375043541 seq 3983796723 subseq 228481 len 1428 csum 0xc361], length 1428
17:01:04.000106 IP 112.26.1.1.targus-getdata1 > 112.26.1.8.38391: Flags [.], ack 15708, win 24400, options [nop,nop,TS val 97548 ecr 4294842512,mptcp dss ack 3983753883], length 0
17:01:04.069224 IP 112.26.1.1.targus-getdata1 > 112.26.1.8.38391: Flags [.], ack 14280, win 24400, options [nop,nop,TS val 97495 ecr 4294842438,mptcp dss ack 3983753883], length 0
17:01:04.116743 IP 112.26.1.1.targus-getdata1 > 112.26.1.8.38391: Flags [.], ack 15708, win 24400, options [nop,nop,TS val 97548 ecr 4294842512,mptcp dss ack 3983753883], length 0
17:01:04.186022 IP 112.26.1.8.38391 > 112.26.1.1.targus-getdata1: Flags [.], seq 15708:17136, ack 1, win 685, options [nop,nop,TS val 4294842704 ecr 96373,mptcp dss ack 1375043541 seq 3983802435 subseq 229909 len 1428 csum 0x6686], length 1428
17:01:04.186352 IP 112.26.1.1.targus-getdata1 > 112.26.1.8.38391: Flags [.], ack 17136, win 24301, options [nop,nop,TS val 97734 ecr 4294842704,mptcp dss ack 3983761023], length 0
17:01:04.259027 IP 112.26.1.8.38391 > 112.26.1.1.targus-getdata1: Flags [.], seq 17136:18564, ack 1, win 685, options [nop,nop,TS val 4294842736 ecr 96481,mptcp dss ack 1375043541 seq 3983803863 subseq 231337 len 1428 csum 0xf6d5], length 1428
17:01:04.259317 IP 112.26.1.1.targus-getdata1 > 112.26.1.8.38391: Flags [.], ack 18564, win 24301, options [nop,nop,TS val 97807 ecr 4294842736,mptcp dss ack 3983761023], length 0
17:01:04.341158 IP 112.26.1.1.targus-getdata1 > 112.26.1.8.38391: Flags [.], ack 17136, win 24301, options [nop,nop,TS val 97734 ecr 4294842704,mptcp dss ack 3983761023], length 0
17:01:04.396864 IP 112.26.1.1.targus-getdata1 > 112.26.1.8.38391: Flags [.], ack 18564, win 24301, options [nop,nop,TS val 97807 ecr 4294842736,mptcp dss ack 3983761023], length 0
17:01:04.442694 IP 112.26.1.8.38391 > 112.26.1.1.targus-getdata1: Flags [.], seq 18564:19992, ack 1, win 685, options [nop,nop,TS val 4294842884 ecr 96650,mptcp dss ack 1375043541 seq 3983811003 subseq 232765 len 1428 csum 0x8713], length 1428
17:01:04.443028 IP 112.26.1.1.targus-getdata1 > 112.26.1.8.38391: Flags [.], ack 19992, win 24301, options [nop,nop,TS val 97991 ecr 4294842884,mptcp dss ack 3983761023], length 0
17:01:04.522338 IP 112.26.1.8.38391 > 112.26.1.1.targus-getdata1: Flags [.], seq 19992:21420, ack 1, win 685, options [nop,nop,TS val 4294842943 ecr 96681,mptcp dss ack 1375043541 seq 3983813859 subseq 234193 len 1428 csum 0x4f1d], length 1428
17:01:04.522682 IP 112.26.1.1.targus-getdata1 > 112.26.1.8.38391: Flags [.], ack 21420, win 24502, options [nop,nop,TS val 98071 ecr 4294842943,mptcp dss ack 3983816715], length 0
17:01:04.586859 IP 112.26.1.1.targus-getdata1 > 112.26.1.8.38391: Flags [.], ack 19992, win 24301, options [nop,nop,TS val 97991 ecr 4294842884,mptcp dss ack 3983761023], length 0
17:01:04.628242 IP 112.26.1.8.38391 > 112.26.1.1.targus-getdata1: Flags [.], seq 21420:22848, ack 1, win 685, options [nop,nop,TS val 4294843074 ecr 96869,mptcp dss ack 1375043541 seq 3983818143 subseq 235621 len 1428 csum 0x7587], length 1428
17:01:04.628636 IP 112.26.1.1.targus-getdata1 > 112.26.1.8.38391: Flags [.], ack 22848, win 24543, options [nop,nop,TS val 98177 ecr 4294843074,mptcp dss ack 3983820999], length 0
17:01:04.672764 IP 112.26.1.1.targus-getdata1 > 112.26.1.8.38391: Flags [.], ack 21420, win 24502, options [nop,nop,TS val 98071 ecr 4294842943,mptcp dss ack 3983816715], length 0
17:01:04.745501 IP 112.26.1.8.38391 > 112.26.1.1.targus-getdata1: Flags [.], seq 22848:24276, ack 1, win 685, options [nop,nop,TS val 4294843172 ecr 96910,mptcp dss ack 1375043541 seq 3983822427 subseq 237049 len 1428 csum 0x6a1], length 1428
17:01:04.745857 IP 112.26.1.1.targus-getdata1 > 112.26.1.8.38391: Flags [.], ack 24276, win 24558, options [nop,nop,TS val 98294 ecr 4294843172,mptcp dss ack 3983820999], length 0
17:01:04.789373 IP 112.26.1.1.targus-getdata1 > 112.26.1.8.38391: Flags [.], ack 22848, win 24543, options [nop,nop,TS val 98177 ecr 4294843074,mptcp dss ack 3983820999], length 0
17:01:04.835929 IP 112.26.1.8.38391 > 112.26.1.1.targus-getdata1: Flags [.], seq 25704:27132, ack 1, win 685, options [nop,nop,TS val 4294843351 ecr 97089,mptcp dss ack 1375043541 seq 3983828139 subseq 239905 len 1428 csum 0x11f4], length 1428
17:01:04.836174 IP 112.26.1.1.targus-getdata1 > 112.26.1.8.38391: Flags [.], ack 24276, win 24558, options [nop,nop,TS val 98384 ecr 4294843172,nop,nop,sack 1 {25704:27132},mptcp dss ack 3983820999], length 0
17:01:04.912083 IP 112.26.1.1.targus-getdata1 > 112.26.1.8.38391: Flags [.], ack 24276, win 24558, options [nop,nop,TS val 98294 ecr 4294843172,mptcp dss ack 3983820999], length 0
17:01:04.941369 IP 112.26.1.8.38391 > 112.26.1.1.targus-getdata1: Flags [.], seq 27132:28560, ack 1, win 685, options [nop,nop,TS val 4294843415 ecr 97154,mptcp dss ack 1375043541 seq 3983832423 subseq 241333 len 1428 csum 0xda46], length 1428
17:01:04.941659 IP 112.26.1.1.targus-getdata1 > 112.26.1.8.38391: Flags [.], ack 24276, win 24558, options [nop,nop,TS val 98489 ecr 4294843172,nop,nop,sack 1 {25704:28560},mptcp dss ack 3983820999], length 0
17:01:05.015689 IP 112.26.1.1.targus-getdata1 > 112.26.1.8.38391: Flags [.], ack 24276, win 24558, options [nop,nop,TS val 98384 ecr 4294843172,nop,nop,sack 1 {25704:27132},mptcp dss ack 3983820999], length 0
17:01:05.049968 IP 112.26.1.1.targus-getdata1 > 112.26.1.8.38391: Flags [.], ack 24276, win 24558, options [nop,nop,TS val 98489 ecr 4294843172,nop,nop,sack 1 {25704:28560},mptcp dss ack 3983820999], length 0
17:01:05.111640 IP 112.26.1.8.38391 > 112.26.1.1.targus-getdata1: Flags [.], seq 28560:29988, ack 1, win 685, options [nop,nop,TS val 4294843557 ecr 97321,mptcp dss ack 1375043541 seq 3983836707 subseq 242761 len 1428 csum 0x9719], length 1428
17:01:05.111990 IP 112.26.1.1.targus-getdata1 > 112.26.1.8.38391: Flags [.], ack 24276, win 24558, options [nop,nop,TS val 98660 ecr 4294843172,nop,nop,sack 1 {25704:29988},mptcp dss ack 3983820999], length 0
17:01:05.163622 IP 112.26.1.8.38391 > 112.26.1.1.targus-getdata1: Flags [.], seq 29988:31416, ack 1, win 685, options [nop,nop,TS val 4294843719 ecr 97495,mptcp dss ack 1375043541 seq 3983842419 subseq 244189 len 1428 csum 0x1001], length 1428
17:01:05.163955 IP 112.26.1.1.targus-getdata1 > 112.26.1.8.38391: Flags [.], ack 24276, win 24558, options [nop,nop,TS val 98712 ecr 4294843172,nop,nop,sack 1 {25704:31416},mptcp dss ack 3983820999], length 0
17:01:05.225220 IP 112.26.1.1.targus-getdata1 > 112.26.1.8.38391: Flags [.], ack 24276, win 24558, options [nop,nop,TS val 98660 ecr 4294843172,nop,nop,sack 1 {25704:29988},mptcp dss ack 3983820999], length 0
17:01:05.275239 IP 112.26.1.8.38391 > 112.26.1.1.targus-getdata1: Flags [.], seq 31416:32844, ack 1, win 685, options [nop,nop,TS val 4294843719 ecr 97495,mptcp dss ack 1375043541 seq 3983843847 subseq 245617 len 1428 csum 0x5ff1], length 1428
17:01:05.275456 IP 112.26.1.1.targus-getdata1 > 112.26.1.8.38391: Flags [.], ack 24276, win 24558, options [nop,nop,TS val 98824 ecr 4294843172,nop,nop,sack 1 {25704:32844},mptcp dss ack 3983820999], length 0
17:01:05.334530 IP 112.26.1.1.targus-getdata1 > 112.26.1.8.38391: Flags [.], ack 24276, win 24558, options [nop,nop,TS val 98712 ecr 4294843172,nop,nop,sack 1 {25704:31416},mptcp dss ack 3983820999], length 0
17:01:05.384043 IP 112.26.1.8.38391 > 112.26.1.1.targus-getdata1: Flags [.], seq 32844:34272, ack 1, win 685, options [nop,nop,TS val 4294843823 ecr 97548,mptcp dss ack 1375043541 seq 3983848131 subseq 247045 len 1428 csum 0x640d], length 1428
17:01:05.384255 IP 112.26.1.1.targus-getdata1 > 112.26.1.8.38391: Flags [.], ack 24276, win 24558, options [nop,nop,TS val 98932 ecr 4294843172,nop,nop,sack 1 {25704:34272},mptcp dss ack 3983820999], length 0
17:01:05.449533 IP 112.26.1.1.targus-getdata1 > 112.26.1.8.38391: Flags [.], ack 24276, win 24558, options [nop,nop,TS val 98824 ecr 4294843172,nop,nop,sack 1 {25704:32844},mptcp dss ack 3983820999], length 0
17:01:05.486441 IP 112.26.1.8.38391 > 112.26.1.1.targus-getdata1: Flags [.], seq 34272:35700, ack 1, win 685, options [nop,nop,TS val 4294843968 ecr 97734,mptcp dss ack 1375043541 seq 3983853843 subseq 248473 len 1428 csum 0x51ff], length 1428
17:01:05.486664 IP 112.26.1.1.targus-getdata1 > 112.26.1.8.38391: Flags [.], ack 24276, win 24514, options [nop,nop,TS val 99035 ecr 4294843172,nop,nop,sack 1 {25704:35700},mptcp dss ack 3983823855], length 0
17:01:05.573725 IP 112.26.1.1.targus-getdata1 > 112.26.1.8.38391: Flags [.], ack 24276, win 24558, options [nop,nop,TS val 98932 ecr 4294843172,nop,nop,sack 1 {25704:34272},mptcp dss ack 3983820999], length 0
17:01:05.623881 IP 112.26.1.1.targus-getdata1 > 112.26.1.8.38391: Flags [.], ack 24276, win 24514, options [nop,nop,TS val 99035 ecr 4294843172,nop,nop,sack 1 {25704:35700},mptcp dss ack 3983823855], length 0
17:01:05.686499 IP 112.26.1.8.38391 > 112.26.1.1.targus-getdata1: Flags [.], seq 38556:39984, ack 1, win 685, options [nop,nop,TS val 4294844146 ecr 97991,mptcp dss ack 1375043541 seq 3983863839 subseq 252757 len 1428 csum 0x2aab], length 1428
17:01:05.686734 IP 112.26.1.1.targus-getdata1 > 112.26.1.8.38391: Flags [.], ack 24276, win 24514, options [nop,nop,TS val 99235 ecr 4294843172,nop,nop,sack 2 {38556:39984}{25704:35700},mptcp dss ack 3983823855], length 0
17:01:05.720993 IP 112.26.1.8.38391 > 112.26.1.1.targus-getdata1: Flags [.], seq 39984:41412, ack 1, win 685, options [nop,nop,TS val 4294844292 ecr 98071,mptcp dss ack 1375043541 seq 3983866695 subseq 254185 len 1428 csum 0xe5cb], length 1428
17:01:05.721221 IP 112.26.1.1.targus-getdata1 > 112.26.1.8.38391: Flags [.], ack 24276, win 24514, options [nop,nop,TS val 99269 ecr 4294843172,nop,nop,sack 2 {38556:41412}{25704:35700},mptcp dss ack 3983823855], length 0
17:01:05.796668 IP 112.26.1.1.targus-getdata1 > 112.26.1.8.38391: Flags [.], ack 24276, win 24514, options [nop,nop,TS val 99235 ecr 4294843172,nop,nop,sack 2 {38556:39984}{25704:35700},mptcp dss ack 3983823855], length 0
17:01:05.828312 IP 112.26.1.8.38391 > 112.26.1.1.targus-getdata1: Flags [.], seq 41412:42840, ack 1, win 685, options [nop,nop,TS val 4294844292 ecr 98071,mptcp dss ack 1375043541 seq 3983868123 subseq 255613 len 1428 csum 0x7d09], length 1428
17:01:05.828507 IP 112.26.1.1.targus-getdata1 > 112.26.1.8.38391: Flags [.], ack 24276, win 24514, options [nop,nop,TS val 99377 ecr 4294843172,nop,nop,sack 2 {38556:42840}{25704:35700},mptcp dss ack 3983823855], length 0
17:01:05.892741 IP 112.26.1.1.targus-getdata1 > 112.26.1.8.38391: Flags [.], ack 24276, win 24514, options [nop,nop,TS val 99269 ecr 4294843172,nop,nop,sack 2 {38556:41412}{25704:35700},mptcp dss ack 3983823855], length 0
17:01:05.932808 IP 112.26.1.1.targus-getdata1 > 112.26.1.8.38391: Flags [.], ack 24276, win 24514, options [nop,nop,TS val 99377 ecr 4294843172,nop,nop,sack 2 {38556:42840}{25704:35700},mptcp dss ack 3983823855], length 0
17:01:05.966454 IP 112.26.1.8.38391 > 112.26.1.1.targus-getdata1: Flags [.], seq 42840:44268, ack 1, win 685, options [nop,nop,TS val 4294844447 ecr 98177,mptcp dss ack 1375043541 seq 3983872407 subseq 257041 len 1428 csum 0x88db], length 1428
17:01:05.966685 IP 112.26.1.1.targus-getdata1 > 112.26.1.8.38391: Flags [.], ack 24276, win 24514, options [nop,nop,TS val 99515 ecr 4294843172,nop,nop,sack 2 {38556:44268}{25704:35700},mptcp dss ack 3983823855], length 0
17:01:06.000644 IP 112.26.1.8.38391 > 112.26.1.1.targus-getdata1: Flags [.], seq 44268:45696, ack 1, win 685, options [nop,nop,TS val 4294844447 ecr 98177,mptcp dss ack 1375043541 seq 3983873835 subseq 258469 len 1428 csum 0x4fa9], length 1428
17:01:06.000838 IP 112.26.1.1.targus-getdata1 > 112.26.1.8.38391: Flags [.], ack 24276, win 24514, options [nop,nop,TS val 99549 ecr 4294843172,nop,nop,sack 2 {38556:45696}{25704:35700},mptcp dss ack 3983823855], length 0
17:01:06.063464 IP 112.26.1.1.targus-getdata1 > 112.26.1.8.38391: Flags [.], ack 24276, win 24514, options [nop,nop,TS val 99515 ecr 4294843172,nop,nop,sack 2 {38556:44268}{25704:35700},mptcp dss ack 3983823855], length 0
17:01:06.123371 IP 112.26.1.1.targus-getdata1 > 112.26.1.8.38391: Flags [.], ack 24276, win 24514, options [nop,nop,TS val 99549 ecr 4294843172,nop,nop,sack 2 {38556:45696}{25704:35700},mptcp dss ack 3983823855], length 0
17:01:06.183397 IP 112.26.1.8.38391 > 112.26.1.1.targus-getdata1: Flags [.], seq 47124:48552, ack 1, win 685, options [nop,nop,TS val 4294844665 ecr 98384,mptcp dss ack 1375043541 seq 3983883831 subseq 261325 len 1428 csum 0x6abf], length 1428
17:01:06.183630 IP 112.26.1.1.targus-getdata1 > 112.26.1.8.38391: Flags [.], ack 24276, win 24514, options [nop,nop,TS val 99732 ecr 4294843172,nop,nop,sack 2 {47124:48552}{38556:45696},mptcp dss ack 3983823855], length 0
17:01:06.250339 IP 112.26.1.1.targus-getdata1 > 112.26.1.8.38391: Flags [.], ack 24276, win 24514, options [nop,nop,TS val 99732 ecr 4294843172,nop,nop,sack 2 {47124:48552}{38556:45696},mptcp dss ack 3983823855], length 0
17:01:06.313474 IP 112.26.1.8.38391 > 112.26.1.1.targus-getdata1: Flags [.], seq 24276:25704, ack 1, win 685, options [nop,nop,TS val 4294844922 ecr 98660,mptcp dss ack 1375043541 seq 3983823855 subseq 238477 len 1428 csum 0xf331], length 1428
17:01:06.313703 IP 112.26.1.1.targus-getdata1 > 112.26.1.8.38391: Flags [.], ack 35700, win 24024, options [nop,nop,TS val 99862 ecr 4294844922,nop,nop,sack 2 {47124:48552}{38556:45696},mptcp dss ack 3983855271], length 0
17:01:06.372900 IP 112.26.1.1.targus-getdata1 > 112.26.1.8.38391: Flags [.], ack 35700, win 24024, options [nop,nop,TS val 99862 ecr 4294844922,nop,nop,sack 2 {47124:48552}{38556:45696},mptcp dss ack 3983855271], length 0
17:01:06.433550 IP 112.26.1.8.38391 > 112.26.1.1.targus-getdata1: Flags [.], seq 48552:49980, ack 1, win 685, options [nop,nop,TS val 4294845000 ecr 98660,mptcp dss ack 1375043541 seq 3983893827 subseq 262753 len 1428 csum 0x5572], length 1428
17:01:06.433738 IP 112.26.1.1.targus-getdata1 > 112.26.1.8.38391: Flags [.], ack 35700, win 24223, options [nop,nop,TS val 99982 ecr 4294844922,nop,nop,sack 2 {47124:49980}{38556:45696},mptcp dss ack 3983855271], length 0
17:01:06.506024 IP 112.26.1.1.targus-getdata1 > 112.26.1.8.38391: Flags [.], ack 35700, win 24223, options [nop,nop,TS val 99982 ecr 4294844922,nop,nop,sack 2 {47124:49980}{38556:45696},mptcp dss ack 3983855271], length 0
17:01:06.664241 IP 112.26.1.8.38391 > 112.26.1.1.targus-getdata1: Flags [.], seq 49980:51408, ack 1, win 685, options [nop,nop,TS val 4294845192 ecr 98824,mptcp dss ack 1375043541 seq 3983899539 subseq 264181 len 1428 csum 0x3b48], length 1428
17:01:06.664432 IP 112.26.1.1.targus-getdata1 > 112.26.1.8.38391: Flags [.], ack 35700, win 24223, options [nop,nop,TS val 100213 ecr 4294844922,nop,nop,sack 2 {47124:51408}{38556:45696},mptcp dss ack 3983855271], length 0
17:01:06.723055 IP 112.26.1.1.targus-getdata1 > 112.26.1.8.38391: Flags [.], ack 35700, win 24223, options [nop,nop,TS val 100213 ecr 4294844922,nop,nop,sack 2 {47124:51408}{38556:45696},mptcp dss ack 3983855271], length 0
17:01:06.788807 IP 112.26.1.8.38391 > 112.26.1.1.targus-getdata1: Flags [.], seq 52836:54264, ack 1, win 685, options [nop,nop,TS val 4294845364 ecr 99035,mptcp dss ack 1375043541 seq 3983908107 subseq 267037 len 1428 csum 0x64ce], length 1428
17:01:06.788963 IP 112.26.1.1.targus-getdata1 > 112.26.1.8.38391: Flags [.], ack 35700, win 24223, options [nop,nop,TS val 100337 ecr 4294844922,nop,nop,sack 2 {52836:54264}{47124:51408},mptcp dss ack 3983855271], length 0
17:01:06.851688 IP 112.26.1.1.targus-getdata1 > 112.26.1.8.38391: Flags [.], ack 35700, win 24223, options [nop,nop,TS val 100337 ecr 4294844922,nop,nop,sack 2 {52836:54264}{47124:51408},mptcp dss ack 3983855271], length 0
17:01:07.007341 IP 112.26.1.8.38391 > 112.26.1.1.targus-getdata1: Flags [.], seq 35700:37128, ack 1, win 685, options [nop,nop,TS val 4294845628 ecr 99269,mptcp dss ack 1375043541 seq 3983855271 subseq 249901 len 1428 csum 0x347b], length 1428
17:01:07.007554 IP 112.26.1.1.targus-getdata1 > 112.26.1.8.38391: Flags [.], ack 37128, win 24179, options [nop,nop,TS val 100556 ecr 4294845628,nop,nop,sack 2 {52836:54264}{47124:51408},mptcp dss ack 3983858127], length 0
17:01:07.091300 IP 112.26.1.1.targus-getdata1 > 112.26.1.8.38391: Flags [.], ack 37128, win 24179, options [nop,nop,TS val 100556 ecr 4294845628,nop,nop,sack 2 {52836:54264}{47124:51408},mptcp dss ack 3983858127], length 0
17:01:07.157771 IP 112.26.1.8.38391 > 112.26.1.1.targus-getdata1: Flags [.], seq 37128:38556, ack 1, win 685, options [nop,nop,TS val 4294845695 ecr 99377,mptcp dss ack 1375043541 seq 3983858127 subseq 251329 len 1428 csum 0xefa2], length 1428
17:01:07.158009 IP 112.26.1.1.targus-getdata1 > 112.26.1.8.38391: Flags [.], ack 45696, win 23857, options [nop,nop,TS val 100706 ecr 4294845695,nop,nop,sack 2 {52836:54264}{47124:51408},mptcp dss ack 3983880975], length 0
17:01:07.209528 IP 112.26.1.1.targus-getdata1 > 112.26.1.8.38391: Flags [.], ack 45696, win 23857, options [nop,nop,TS val 100706 ecr 4294845695,nop,nop,sack 2 {52836:54264}{47124:51408},mptcp dss ack 3983880975], length 0
17:01:07.300523 IP 112.26.1.8.38391 > 112.26.1.1.targus-getdata1: Flags [.], seq 55692:57120, ack 1, win 685, options [nop,nop,TS val 4294845870 ecr 99549,mptcp dss ack 1375043541 seq 3983928099 subseq 269893 len 1428 csum 0xcf4e], length 1428
17:01:07.300669 IP 112.26.1.1.targus-getdata1 > 112.26.1.8.38391: Flags [.], ack 45696, win 24107, options [nop,nop,TS val 100849 ecr 4294845695,nop,nop,sack 2 {55692:57120}{52836:54264},mptcp dss ack 3983880975], length 0
17:01:07.359318 IP 112.26.1.1.targus-getdata1 > 112.26.1.8.38391: Flags [.], ack 45696, win 24107, options [nop,nop,TS val 100849 ecr 4294845695,nop,nop,sack 2 {55692:57120}{52836:54264},mptcp dss ack 3983880975], length 0
17:01:07.421460 IP 112.26.1.8.38391 > 112.26.1.1.targus-getdata1: Flags [.], seq 45696:47124, ack 1, win 685, options [nop,nop,TS val 4294845980 ecr 99732,mptcp dss ack 1375043541 seq 3983880975 subseq 259897 len 1428 csum 0x3c4b], length 1428
17:01:07.421629 IP 112.26.1.1.targus-getdata1 > 112.26.1.8.38391: Flags [.], ack 51408, win 23962, options [nop,nop,TS val 100970 ecr 4294845980,nop,nop,sack 2 {55692:57120}{52836:54264},mptcp dss ack 3983905251], length 0
17:01:07.512137 IP 112.26.1.1.targus-getdata1 > 112.26.1.8.38391: Flags [.], ack 51408, win 23962, options [nop,nop,TS val 100970 ecr 4294845980,nop,nop,sack 2 {55692:57120}{52836:54264},mptcp dss ack 3983905251], length 0
17:01:07.542563 IP 112.26.1.8.38391 > 112.26.1.1.targus-getdata1: Flags [.], seq 57120:58548, ack 1, win 685, options [nop,nop,TS val 4294846083 ecr 99862,mptcp dss ack 1375043541 seq 3983935239 subseq 271321 len 1428 csum 0x5c19], length 1428
17:01:07.542718 IP 112.26.1.1.targus-getdata1 > 112.26.1.8.38391: Flags [.], ack 51408, win 24228, options [nop,nop,TS val 101091 ecr 4294845980,nop,nop,sack 2 {55692:58548}{52836:54264},mptcp dss ack 3983905251], length 0
17:01:07.604219 IP 112.26.1.1.targus-getdata1 > 112.26.1.8.38391: Flags [.], ack 51408, win 24228, options [nop,nop,TS val 101091 ecr 4294845980,nop,nop,sack 2 {55692:58548}{52836:54264},mptcp dss ack 3983905251], length 0
17:01:07.662801 IP 112.26.1.8.38391 > 112.26.1.1.targus-getdata1: Flags [.], seq 58548:59976, ack 1, win 685, options [nop,nop,TS val 4294846083 ecr 99862,mptcp dss ack 1375043541 seq 3983936667 subseq 272749 len 1428 csum 0x200], length 1428
17:01:07.662999 IP 112.26.1.1.targus-getdata1 > 112.26.1.8.38391: Flags [.], ack 51408, win 24228, options [nop,nop,TS val 101211 ecr 4294845980,nop,nop,sack 2 {55692:59976}{52836:54264},mptcp dss ack 3983905251], length 0
17:01:07.748519 IP 112.26.1.8.38391 > 112.26.1.1.targus-getdata1: Flags [.], seq 59976:61404, ack 1, win 685, options [nop,nop,TS val 4294846245 ecr 99982,mptcp dss ack 1375043541 seq 3983943807 subseq 274177 len 1428 csum 0x967], length 1428
17:01:07.748719 IP 112.26.1.1.targus-getdata1 > 112.26.1.8.38391: Flags [.], ack 51408, win 24228, options [nop,nop,TS val 101296 ecr 4294845980,nop,nop,sack 2 {55692:61404}{52836:54264},mptcp dss ack 3983905251], length 0
17:01:07.874075 IP 112.26.1.1.targus-getdata1 > 112.26.1.8.38391: Flags [.], ack 51408, win 24228, options [nop,nop,TS val 101211 ecr 4294845980,nop,nop,sack 2 {55692:59976}{52836:54264},mptcp dss ack 3983905251], length 0
17:01:07.894607 IP 112.26.1.1.targus-getdata1 > 112.26.1.8.38391: Flags [.], ack 51408, win 24228, options [nop,nop,TS val 101296 ecr 4294845980,nop,nop,sack 2 {55692:61404}{52836:54264},mptcp dss ack 3983905251], length 0
17:01:07.942670 IP 112.26.1.8.38391 > 112.26.1.1.targus-getdata1: Flags [.], seq 61404:62832, ack 1, win 685, options [nop,nop,TS val 4294846405 ecr 100213,mptcp dss ack 1375043541 seq 3983952375 subseq 275605 len 1428 csum 0xa431], length 1428
17:01:07.942894 IP 112.26.1.1.targus-getdata1 > 112.26.1.8.38391: Flags [.], ack 51408, win 24228, options [nop,nop,TS val 101490 ecr 4294845980,nop,nop,sack 2 {55692:62832}{52836:54264},mptcp dss ack 3983905251], length 0
17:01:07.991742 IP 112.26.1.8.38391 > 112.26.1.1.targus-getdata1: Flags [.], seq 51408:52836, ack 1, win 685, options [nop,nop,TS val 4294846549 ecr 100337,mptcp dss ack 1375043541 seq 3983905251 subseq 265609 len 1428 csum 0xf640], length 1428
17:01:07.991974 IP 112.26.1.1.targus-getdata1 > 112.26.1.8.38391: Flags [.], ack 54264, win 24027, options [nop,nop,TS val 101540 ecr 4294846549,nop,nop,sack 1 {55692:62832},mptcp dss ack 3983923815], length 0
17:01:08.027425 IP 112.26.1.1.targus-getdata1 > 112.26.1.8.38391: Flags [.], ack 51408, win 24228, options [nop,nop,TS val 101490 ecr 4294845980,nop,nop,sack 2 {55692:62832}{52836:54264},mptcp dss ack 3983905251], length 0
17:01:08.058941 IP 112.26.1.1.targus-getdata1 > 112.26.1.8.38391: Flags [.], ack 54264, win 24027, options [nop,nop,TS val 101540 ecr 4294846549,nop,nop,sack 1 {55692:62832},mptcp dss ack 3983923815], length 0
17:01:08.126067 IP 112.26.1.8.38391 > 112.26.1.1.targus-getdata1: Flags [.], seq 62832:64260, ack 1, win 685, options [nop,nop,TS val 4294846750 ecr 100556,mptcp dss ack 1375043541 seq 3983968083 subseq 277033 len 1428 csum 0xb08], length 1428
17:01:08.126264 IP 112.26.1.1.targus-getdata1 > 112.26.1.8.38391: Flags [.], ack 54264, win 24200, options [nop,nop,TS val 101674 ecr 4294846549,nop,nop,sack 1 {55692:64260},mptcp dss ack 3983923815], length 0
17:01:08.179781 IP 112.26.1.1.targus-getdata1 > 112.26.1.8.38391: Flags [.], ack 54264, win 24200, options [nop,nop,TS val 101674 ecr 4294846549,nop,nop,sack 1 {55692:64260},mptcp dss ack 3983923815], length 0
17:01:08.255209 IP 112.26.1.8.38391 > 112.26.1.1.targus-getdata1: Flags [.], seq 64260:65688, ack 1, win 685, options [nop,nop,TS val 4294846750 ecr 100556,mptcp dss ack 1375043541 seq 3983969511 subseq 278461 len 1428 csum 0xe90e], length 1428
17:01:08.255427 IP 112.26.1.1.targus-getdata1 > 112.26.1.8.38391: Flags [.], ack 54264, win 24200, options [nop,nop,TS val 101803 ecr 4294846549,nop,nop,sack 1 {55692:65688},mptcp dss ack 3983923815], length 0
17:01:08.316984 IP 112.26.1.8.38391 > 112.26.1.1.targus-getdata1: Flags [.], seq 65688:67116, ack 1, win 685, options [nop,nop,TS val 4294846839 ecr 100706,mptcp dss ack 1375043541 seq 3983972367 subseq 279889 len 1428 csum 0x3a65], length 1428
17:01:08.317198 IP 112.26.1.1.targus-getdata1 > 112.26.1.8.38391: Flags [.], ack 54264, win 24200, options [nop,nop,TS val 101865 ecr 4294846549,nop,nop,sack 1 {55692:67116},mptcp dss ack 3983923815], length 0
17:01:08.363978 IP 112.26.1.8.38391 > 112.26.1.1.targus-getdata1: Flags [.], seq 54264:55692, ack 1, win 685, options [nop,nop,TS val 4294846995 ecr 100849,mptcp dss ack 1375043541 seq 3983923815 subseq 268465 len 1428 csum 0x1259], length 1428
17:01:08.364189 IP 112.26.1.1.targus-getdata1 > 112.26.1.8.38391: Flags [.], ack 67116, win 23946, options [nop,nop,TS val 101912 ecr 4294846995,mptcp dss ack 3983978079], length 0
17:01:08.450309 IP 112.26.1.1.targus-getdata1 > 112.26.1.8.38391: Flags [.], ack 54264, win 24200, options [nop,nop,TS val 101803 ecr 4294846549,nop,nop,sack 1 {55692:65688},mptcp dss ack 3983923815], length 0
17:01:08.484434 IP 112.26.1.1.targus-getdata1 > 112.26.1.8.38391: Flags [.], ack 54264, win 24200, options [nop,nop,TS val 101865 ecr 4294846549,nop,nop,sack 1 {55692:67116},mptcp dss ack 3983923815], length 0
17:01:08.516845 IP 112.26.1.1.targus-getdata1 > 112.26.1.8.38391: Flags [.], ack 67116, win 23946, options [nop,nop,TS val 101912 ecr 4294846995,mptcp dss ack 3983978079], length 0
17:01:08.580490 IP 112.26.1.8.38391 > 112.26.1.1.targus-getdata1: Flags [.], seq 67116:68544, ack 1, win 685, options [nop,nop,TS val 4294847144 ecr 100970,mptcp dss ack 1375043541 seq 3983985219 subseq 281317 len 1428 csum 0x41b1], length 1428
17:01:08.580703 IP 112.26.1.1.targus-getdata1 > 112.26.1.8.38391: Flags [.], ack 68544, win 24558, options [nop,nop,TS val 102129 ecr 4294847144,mptcp dss ack 3983983791], length 0
17:01:08.623844 IP 112.26.1.8.38391 > 112.26.1.1.targus-getdata1: Flags [.], seq 68544:69972, ack 1, win 685, options [nop,nop,TS val 4294847206 ecr 101091,mptcp dss ack 1375043541 seq 3983986647 subseq 282745 len 1428 csum 0x6832], length 1428
17:01:08.624038 IP 112.26.1.1.targus-getdata1 > 112.26.1.8.38391: Flags [.], ack 69972, win 24558, options [nop,nop,TS val 102172 ecr 4294847206,mptcp dss ack 3983983791], length 0
17:01:08.686717 IP 112.26.1.1.targus-getdata1 > 112.26.1.8.38391: Flags [.], ack 68544, win 24558, options [nop,nop,TS val 102129 ecr 4294847144,mptcp dss ack 3983983791], length 0
17:01:08.699051 IP 112.26.1.1.targus-getdata1 > 112.26.1.8.38391: Flags [.], ack 69972, win 24558, options [nop,nop,TS val 102172 ecr 4294847206,mptcp dss ack 3983983791], length 0
17:01:08.742247 IP 112.26.1.8.38391 > 112.26.1.1.targus-getdata1: Flags [.], seq 69972:71400, ack 1, win 685, options [nop,nop,TS val 4294847539 ecr 101296,mptcp dss ack 1375043541 seq 3984000927 subseq 284173 len 1428 csum 0x8b2e], length 1428
17:01:08.742401 IP 112.26.1.1.targus-getdata1 > 112.26.1.8.38391: Flags [.], ack 71400, win 24558, options [nop,nop,TS val 102290 ecr 4294847539,mptcp dss ack 3983983791], length 0
17:01:08.833496 IP 112.26.1.1.targus-getdata1 > 112.26.1.8.38391: Flags [.], ack 71400, win 24558, options [nop,nop,TS val 102290 ecr 4294847539,mptcp dss ack 3983983791], length 0
17:01:08.906561 IP 112.26.1.8.38391 > 112.26.1.1.targus-getdata1: Flags [.], seq 71400:72828, ack 1, win 685, options [nop,nop,TS val 4294847643 ecr 101490,mptcp dss ack 1375043541 seq 3984009495 subseq 285601 len 1428 csum 0xb14f], length 1428
17:01:08.906776 IP 112.26.1.1.targus-getdata1 > 112.26.1.8.38391: Flags [.], ack 72828, win 24558, options [nop,nop,TS val 102455 ecr 4294847643,mptcp dss ack 3983983791], length 0
17:01:08.966713 IP 112.26.1.1.targus-getdata1 > 112.26.1.8.38391: Flags [.], ack 72828, win 24558, options [nop,nop,TS val 102455 ecr 4294847643,mptcp dss ack 3983983791], length 0
17:01:09.096728 IP 112.26.1.8.38391 > 112.26.1.1.targus-getdata1: Flags [.], seq 72828:74256, ack 1, win 685, options [nop,nop,TS val 4294847883 ecr 101803,mptcp dss ack 1375043541 seq 3984020919 subseq 287029 len 1428 csum 0x3c05], length 1428
17:01:09.096959 IP 112.26.1.1.targus-getdata1 > 112.26.1.8.38391: Flags [.], ack 74256, win 24558, options [nop,nop,TS val 102645 ecr 4294847883,mptcp dss ack 3983983791], length 0
17:01:09.156255 IP 112.26.1.1.targus-getdata1 > 112.26.1.8.38391: Flags [.], ack 74256, win 24558, options [nop,nop,TS val 102645 ecr 4294847883,mptcp dss ack 3983983791], length 0
17:01:09.214343 IP 112.26.1.8.38391 > 112.26.1.1.targus-getdata1: Flags [.], seq 74256:75684, ack 1, win 685, options [nop,nop,TS val 4294847944 ecr 101865,mptcp dss ack 1375043541 seq 3983983791 subseq 288457 len 1428 csum 0x98b0], length 1428
17:01:09.214517 IP 112.26.1.1.targus-getdata1 > 112.26.1.8.38391: Flags [.], ack 75684, win 24492, options [nop,nop,TS val 102763 ecr 4294847944,mptcp dss ack 3983988075], length 0
17:01:09.276882 IP 112.26.1.1.targus-getdata1 > 112.26.1.8.38391: Flags [.], ack 75684, win 24492, options [nop,nop,TS val 102763 ecr 4294847944,mptcp dss ack 3983988075], length 0
17:01:09.344126 IP 112.26.1.8.38391 > 112.26.1.1.targus-getdata1: Flags [.], seq 75684:77112, ack 1, win 685, options [nop,nop,TS val 4294848085 ecr 101912,mptcp dss ack 1375043541 seq 3983989503 subseq 289885 len 1428 csum 0xee16], length 1428
17:01:09.344349 IP 112.26.1.1.targus-getdata1 > 112.26.1.8.38391: Flags [.], ack 77112, win 24543, options [nop,nop,TS val 102892 ecr 4294848085,mptcp dss ack 3984016635], length 0
17:01:09.397403 IP 112.26.1.1.targus-getdata1 > 112.26.1.8.38391: Flags [.], ack 77112, win 24543, options [nop,nop,TS val 102892 ecr 4294848085,mptcp dss ack 3984016635], length 0
17:01:09.506833 IP 112.26.1.8.38391 > 112.26.1.1.targus-getdata1: Flags [.], seq 77112:78540, ack 1, win 685, options [nop,nop,TS val 4294848143 ecr 102129,mptcp dss ack 1375043541 seq 3983998071 subseq 291313 len 1428 csum 0x722e], length 1428
17:01:09.507057 IP 112.26.1.1.targus-getdata1 > 112.26.1.8.38391: Flags [.], ack 78540, win 24543, options [nop,nop,TS val 103055 ecr 4294848143,mptcp dss ack 3984019491], length 0
17:01:09.572660 IP 112.26.1.1.targus-getdata1 > 112.26.1.8.38391: Flags [.], ack 78540, win 24543, options [nop,nop,TS val 103055 ecr 4294848143,mptcp dss ack 3984019491], length 0
17:01:09.640336 IP 112.26.1.8.38391 > 112.26.1.1.targus-getdata1: Flags [.], seq 78540:79968, ack 1, win 685, options [nop,nop,TS val 4294848187 ecr 102172,mptcp dss ack 1375043541 seq 3984003783 subseq 292741 len 1428 csum 0x2a67], length 1428
17:01:09.640587 IP 112.26.1.1.targus-getdata1 > 112.26.1.8.38391: Flags [.], ack 79968, win 24558, options [nop,nop,TS val 103189 ecr 4294848187,mptcp dss ack 3984023775], length 0
17:01:09.706065 IP 112.26.1.1.targus-getdata1 > 112.26.1.8.38391: Flags [.], ack 79968, win 24558, options [nop,nop,TS val 103189 ecr 4294848187,mptcp dss ack 3984023775], length 0
17:01:09.768261 IP 112.26.1.8.38391 > 112.26.1.1.targus-getdata1: Flags [.], seq 79968:81396, ack 1, win 685, options [nop,nop,TS val 4294848433 ecr 102290,mptcp dss ack 1375043541 seq 3984010923 subseq 294169 len 1428 csum 0x9127], length 1428
17:01:09.768640 IP 112.26.1.1.targus-getdata1 > 112.26.1.8.38391: Flags [.], ack 81396, win 24558, options [nop,nop,TS val 103316 ecr 4294848433,mptcp dss ack 3984023775], length 0
17:01:09.863487 IP 112.26.1.1.targus-getdata1 > 112.26.1.8.38391: Flags [.], ack 81396, win 24558, options [nop,nop,TS val 103316 ecr 4294848433,mptcp dss ack 3984023775], length 0
17:01:09.917110 IP 112.26.1.8.38391 > 112.26.1.1.targus-getdata1: Flags [.], seq 81396:82824, ack 1, win 685, options [nop,nop,TS val 4294848433 ecr 102290,mptcp dss ack 1375043541 seq 3984012351 subseq 295597 len 1428 csum 0x57e1], length 1428
17:01:09.917400 IP 112.26.1.1.targus-getdata1 > 112.26.1.8.38391: Flags [.], ack 82824, win 24536, options [nop,nop,TS val 103465 ecr 4294848433,mptcp dss ack 3984025203], length 0
17:01:10.000619 IP 112.26.1.8.38391 > 112.26.1.1.targus-getdata1: Flags [.], seq 82824:84252, ack 1, win 685, options [nop,nop,TS val 4294848568 ecr 102455,mptcp dss ack 1375043541 seq 3984029487 subseq 297025 len 1428 csum 0x42aa], length 1428
17:01:10.000941 IP 112.26.1.1.targus-getdata1 > 112.26.1.8.38391: Flags [.], ack 84252, win 24514, options [nop,nop,TS val 103549 ecr 4294848568,mptcp dss ack 3984026631], length 0
17:01:10.047318 IP 112.26.1.1.targus-getdata1 > 112.26.1.8.38391: Flags [.], ack 82824, win 24536, options [nop,nop,TS val 103465 ecr 4294848433,mptcp dss ack 3984025203], length 0
17:01:10.109854 IP 112.26.1.1.targus-getdata1 > 112.26.1.8.38391: Flags [.], ack 84252, win 24514, options [nop,nop,TS val 103549 ecr 4294848568,mptcp dss ack 3984026631], length 0
17:01:10.176588 IP 112.26.1.8.38391 > 112.26.1.1.targus-getdata1: Flags [.], seq 84252:85680, ack 1, win 685, options [nop,nop,TS val 4294848747 ecr 102645,mptcp dss ack 1375043541 seq 3984039483 subseq 298453 len 1428 csum 0xef98], length 1428
17:01:10.176884 IP 112.26.1.1.targus-getdata1 > 112.26.1.8.38391: Flags [.], ack 85680, win 24518, options [nop,nop,TS val 103725 ecr 4294848747,mptcp dss ack 3984038055], length 0
