10:40:36.002058 IP 112.26.2.8.38357 > 112.26.2.1.39713: Flags [S], seq 45655212, win 65535, options [mss 1460,sackOK,TS val 3530995 ecr 0,nop,wscale 6,mptcp join id 4 token 0x2fb3bb97 nonce 0x3eaaa39d], length 0
10:40:36.006693 IP 112.26.2.8.38357 > 112.26.2.1.39713: Flags [S], seq 45655212, win 65535, options [mss 1460,sackOK,TS val 3530995 ecr 0,nop,wscale 6,mptcp join id 4 token 0x2fb3bb97 nonce 0x3eaaa39d], length 0
10:40:36.010357 IP 112.26.2.1.39713 > 112.26.2.8.38357: Flags [S.], seq 1224612546, ack 45655213, win 28560, options [mss 1460,sackOK,TS val 3764812 ecr 3530995,nop,wscale 7,mptcp join id 6 hmac 0xb7c0c5844a0930f2 nonce 0xccf3c37], length 0
10:40:36.098007 IP 112.26.2.1.39713 > 112.26.2.8.38357: Flags [S.], seq 1224612546, ack 45655213, win 28560, options [mss 1460,sackOK,TS val 3764812 ecr 3530995,nop,wscale 7,mptcp join id 6 hmac 0xb7c0c5844a0930f2 nonce 0xccf3c37], length 0
10:40:36.099896 IP 112.26.2.1.39713 > 112.26.2.8.38357: Flags [S.], seq 1224612546, ack 45655213, win 28560, options [mss 1460,sackOK,TS val 3764812 ecr 3530995,nop,wscale 7,mptcp join id 6 hmac 0xb7c0c5844a0930f2 nonce 0xccf3c37], length 0
10:40:36.218110 IP 112.26.2.8.38357 > 112.26.2.1.39713: Flags [.], ack 1, win 6981, options [nop,nop,TS val 3531111 ecr 3764812,mptcp join hmac 0x16439cd5341a2b4bb68e37bf35ac62ccb940b9aa], length 0
10:40:36.220358 IP 112.26.2.8.38357 > 112.26.2.1.39713: Flags [.], ack 1, win 6981, options [nop,nop,TS val 3531111 ecr 3764812,mptcp join hmac 0x16439cd5341a2b4bb68e37bf35ac62ccb940b9aa], length 0
10:40:36.225532 IP 112.26.2.1.39713 > 112.26.2.8.38357: Flags [.], ack 1, win 670, options [nop,nop,TS val 3765025 ecr 3531111,mptcp dss ack 177854901], length 0
10:40:36.232581 IP 112.26.2.1.39713 > 112.26.2.8.38357: Flags [.], ack 1, win 670, options [nop,nop,TS val 3765025 ecr 3531111,mptcp dss ack 177854901], length 0
10:40:36.284411 IP 112.26.2.1.39713 > 112.26.2.8.38357: Flags [.], ack 1, win 670, options [nop,nop,TS val 3765025 ecr 3531111,mptcp dss ack 177854901], length 0
10:40:36.308991 IP 112.26.2.1.39713 > 112.26.2.8.38357: Flags [.], seq 1:1429, ack 1, win 670, options [nop,nop,TS val 3765026 ecr 3531111,mptcp dss ack 177854901 seq 420623073 subseq 1 len 1428 csum 0x397e], length 1428
10:40:36.383673 IP 112.26.2.1.39713 > 112.26.2.8.38357: Flags [.], seq 1429:2857, ack 1, win 670, options [nop,nop,TS val 3765026 ecr 3531111,mptcp dss ack 177854901 seq 420624501 subseq 1429 len 1428 csum 0xecda], length 1428
10:40:36.398559 IP 112.26.2.1.39713 > 112.26.2.8.38357: Flags [.], seq 1:1429, ack 1, win 670, options [nop,nop,TS val 3765026 ecr 3531111,mptcp dss ack 177854901 seq 420623073 subseq 1 len 1428 csum 0x397e], length 1428
10:40:36.415235 IP 112.26.2.1.39713 > 112.26.2.8.38357: Flags [.], seq 1:1429, ack 1, win 670, options [nop,nop,TS val 3765026 ecr 3531111,mptcp dss ack 177854901 seq 420623073 subseq 1 len 1428 csum 0x397e], length 1428
10:40:36.544563 IP 112.26.2.1.39713 > 112.26.2.8.38357: Flags [.], seq 2857:4285, ack 1, win 670, options [nop,nop,TS val 3765028 ecr 3531111,mptcp dss ack 177854901 seq 420625929 subseq 2857 len 1428 csum 0x603b], length 1428
10:40:36.566043 IP 112.26.2.1.39713 > 112.26.2.8.38357: Flags [.], seq 1429:2857, ack 1, win 670, options [nop,nop,TS val 3765026 ecr 3531111,mptcp dss ack 177854901 seq 420624501 subseq 1429 len 1428 csum 0xecda], length 1428
10:40:36.619647 IP 112.26.2.8.38357 > 112.26.2.1.39713: Flags [.], ack 1429, win 7209, options [nop,nop,TS val 3531427 ecr 3765026,mptcp dss ack 420605937], length 0
10:40:36.621580 IP 112.26.2.8.38357 > 112.26.2.1.39713: Flags [.], ack 1429, win 7209, options [nop,nop,TS val 3531427 ecr 3765026,mptcp dss ack 420605937], length 0
10:40:36.657319 IP 112.26.2.1.39713 > 112.26.2.8.38357: Flags [.], seq 4285:5713, ack 1, win 670, options [nop,nop,TS val 3765028 ecr 3531111,mptcp dss ack 177854901 seq 420627357 subseq 4285 len 1428 csum 0x6db5], length 1428
10:40:36.723285 IP 112.26.2.1.39713 > 112.26.2.8.38357: Flags [.], seq 1429:2857, ack 1, win 670, options [nop,nop,TS val 3765026 ecr 3531111,mptcp dss ack 177854901 seq 420624501 subseq 1429 len 1428 csum 0xecda], length 1428
10:40:36.751417 IP 112.26.2.1.39713 > 112.26.2.8.38357: Flags [.], seq 5713:7141, ack 1, win 670, options [nop,nop,TS val 3765028 ecr 3531111,mptcp dss ack 177854901 seq 420628785 subseq 5713 len 1428 csum 0x6558], length 1428
10:40:36.830512 IP 112.26.2.8.38357 > 112.26.2.1.39713: Flags [.], ack 2857, win 7529, options [nop,nop,TS val 3531682 ecr 3765026,mptcp dss ack 420614505], length 0
10:40:36.833423 IP 112.26.2.8.38357 > 112.26.2.1.39713: Flags [.], ack 2857, win 7529, options [nop,nop,TS val 3531682 ecr 3765026,mptcp dss ack 420614505], length 0
10:40:36.888913 IP 112.26.2.1.39713 > 112.26.2.8.38357: Flags [.], seq 14281:15709, ack 1, win 893, options [nop,nop,TS val 3765427 ecr 3531427,mptcp dss ack 177854901 seq 420664485 subseq 14281 len 1428 csum 0xb57], length 1428
10:40:36.909649 IP 112.26.2.1.39713 > 112.26.2.8.38357: Flags [.], seq 2857:4285, ack 1, win 670, options [nop,nop,TS val 3765028 ecr 3531111,mptcp dss ack 177854901 seq 420625929 subseq 2857 len 1428 csum 0x603b], length 1428
10:40:36.953330 IP 112.26.2.1.39713 > 112.26.2.8.38357: Flags [.], seq 2857:4285, ack 1, win 670, options [nop,nop,TS val 3765028 ecr 3531111,mptcp dss ack 177854901 seq 420625929 subseq 2857 len 1428 csum 0x603b], length 1428
10:40:37.030678 IP 112.26.2.8.38357 > 112.26.2.1.39713: Flags [.], ack 4285, win 7665, options [nop,nop,TS val 3531929 ecr 3765028,mptcp dss ack 420615933], length 0
10:40:37.043018 IP 112.26.2.8.38357 > 112.26.2.1.39713: Flags [.], ack 4285, win 7665, options [nop,nop,TS val 3531929 ecr 3765028,mptcp dss ack 420615933], length 0
10:40:37.050686 IP 112.26.2.1.39713 > 112.26.2.8.38357: Flags [.], seq 15709:17137, ack 1, win 893, options [nop,nop,TS val 3765427 ecr 3531427,mptcp dss ack 177854901 seq 420665913 subseq 15709 len 1428 csum 0x1c76], length 1428
10:40:37.105087 IP 112.26.2.1.39713 > 112.26.2.8.38357: Flags [.], seq 4285:5713, ack 1, win 670, options [nop,nop,TS val 3765028 ecr 3531111,mptcp dss ack 177854901 seq 420627357 subseq 4285 len 1428 csum 0x6db5], length 1428
10:40:37.121069 IP 112.26.2.1.39713 > 112.26.2.8.38357: Flags [.], seq 4285:5713, ack 1, win 670, options [nop,nop,TS val 3765028 ecr 3531111,mptcp dss ack 177854901 seq 420627357 subseq 4285 len 1428 csum 0x6db5], length 1428
10:40:37.139602 IP 112.26.2.1.39713 > 112.26.2.8.38357: Flags [.], seq 17137:18565, ack 1, win 893, options [nop,nop,TS val 3765639 ecr 3531682,mptcp dss ack 177854901 seq 420678765 subseq 17137 len 1428 csum 0x443a], length 1428
10:40:37.259879 IP 112.26.2.1.39713 > 112.26.2.8.38357: Flags [.], seq 18565:19993, ack 1, win 893, options [nop,nop,TS val 3765639 ecr 3531682,mptcp dss ack 177854901 seq 420680193 subseq 18565 len 1428 csum 0xe31c], length 1428
10:40:37.263983 IP 112.26.2.1.39713 > 112.26.2.8.38357: Flags [.], seq 5713:7141, ack 1, win 670, options [nop,nop,TS val 3765028 ecr 3531111,mptcp dss ack 177854901 seq 420628785 subseq 5713 len 1428 csum 0x6558], length 1428
10:40:37.307967 IP 112.26.2.8.38357 > 112.26.2.1.39713: Flags [.], ack 5713, win 7939, options [nop,nop,TS val 3532116 ecr 3765028,mptcp dss ack 420618789], length 0
10:40:37.333839 IP 112.26.2.8.38357 > 112.26.2.1.39713: Flags [.], ack 5713, win 7939, options [nop,nop,TS val 3532116 ecr 3765028,mptcp dss ack 420618789], length 0
10:40:37.341806 IP 112.26.2.1.39713 > 112.26.2.8.38357: Flags [.], seq 5713:7141, ack 1, win 670, options [nop,nop,TS val 3765028 ecr 3531111,mptcp dss ack 177854901 seq 420628785 subseq 5713 len 1428 csum 0x6558], length 1428
10:40:37.361818 IP 112.26.2.1.39713 > 112.26.2.8.38357: Flags [.], seq 19993:21421, ack 1, win 893, options [nop,nop,TS val 3765848 ecr 3531929,mptcp dss ack 177854901 seq 420685905 subseq 19993 len 1428 csum 0x51ac], length 1428
10:40:37.412345 IP 112.26.2.8.38357 > 112.26.2.1.39713: Flags [.], ack 7141, win 8304, options [nop,nop,TS val 3532334 ecr 3765028,mptcp dss ack 420618789], length 0
10:40:37.417005 IP 112.26.2.8.38357 > 112.26.2.1.39713: Flags [.], ack 7141, win 8304, options [nop,nop,TS val 3532334 ecr 3765028,mptcp dss ack 420618789], length 0
10:40:37.454663 IP 112.26.2.1.39713 > 112.26.2.8.38357: Flags [.], seq 15709:17137, ack 1, win 893, options [nop,nop,TS val 3765427 ecr 3531427,mptcp dss ack 177854901 seq 420665913 subseq 15709 len 1428 csum 0x1c76], length 1428
10:40:37.481651 IP 112.26.2.1.39713 > 112.26.2.8.38357: Flags [.], seq 21421:22849, ack 1, win 893, options [nop,nop,TS val 3765848 ecr 3531929,mptcp dss ack 177854901 seq 420687333 subseq 21421 len 1428 csum 0x757e], length 1428
10:40:37.557652 IP 112.26.2.1.39713 > 112.26.2.8.38357: Flags [.], seq 15709:17137, ack 1, win 893, options [nop,nop,TS val 3765427 ecr 3531427,mptcp dss ack 177854901 seq 420665913 subseq 15709 len 1428 csum 0x1c76], length 1428
10:40:37.580382 IP 112.26.2.1.39713 > 112.26.2.8.38357: Flags [.], seq 22849:24277, ack 1, win 893, options [nop,nop,TS val 3766139 ecr 3532116,mptcp dss ack 177854901 seq 420697329 subseq 22849 len 1428 csum 0x81ae], length 1428
10:40:37.641242 IP 112.26.2.8.38357 > 112.26.2.1.39713: Flags [.], ack 7141, win 8441, options [nop,nop,TS val 3532506 ecr 3765028,nop,nop,sack 1 {15709:17137},mptcp dss ack 420618789], length 0
10:40:37.643336 IP 112.26.2.8.38357 > 112.26.2.1.39713: Flags [.], ack 7141, win 8441, options [nop,nop,TS val 3532506 ecr 3765028,nop,nop,sack 1 {15709:17137},mptcp dss ack 420618789], length 0
10:40:37.681369 IP 112.26.2.1.39713 > 112.26.2.8.38357: Flags [.], seq 18565:19993, ack 1, win 893, options [nop,nop,TS val 3765639 ecr 3531682,mptcp dss ack 177854901 seq 420680193 subseq 18565 len 1428 csum 0xe31c], length 1428
10:40:37.689625 IP 112.26.2.1.39713 > 112.26.2.8.38357: Flags [.], seq 18565:19993, ack 1, win 893, options [nop,nop,TS val 3765639 ecr 3531682,mptcp dss ack 177854901 seq 420680193 subseq 18565 len 1428 csum 0xe31c], length 1428
10:40:37.724257 IP 112.26.2.1.39713 > 112.26.2.8.38357: Flags [.], seq 24277:25705, ack 1, win 893, options [nop,nop,TS val 3766139 ecr 3532116,mptcp dss ack 177854901 seq 420698757 subseq 24277 len 1428 csum 0x5e7e], length 1428
10:40:37.800985 IP 112.26.2.8.38357 > 112.26.2.1.39713: Flags [.], ack 7141, win 8669, options [nop,nop,TS val 3532701 ecr 3765028,nop,nop,sack 2 {18565:19993}{15709:17137},mptcp dss ack 420618789], length 0
10:40:37.810191 IP 112.26.2.8.38357 > 112.26.2.1.39713: Flags [.], ack 7141, win 8669, options [nop,nop,TS val 3532701 ecr 3765028,nop,nop,sack 2 {18565:19993}{15709:17137},mptcp dss ack 420618789], length 0
10:40:37.838582 IP 112.26.2.1.39713 > 112.26.2.8.38357: Flags [.], seq 25705:27133, ack 1, win 893, options [nop,nop,TS val 3766222 ecr 3532334,mptcp dss ack 177854901 seq 420700185 subseq 25705 len 1428 csum 0xde36], length 1428
10:40:37.907173 IP 112.26.2.1.39713 > 112.26.2.8.38357: Flags [.], seq 19993:21421, ack 1, win 893, options [nop,nop,TS val 3765848 ecr 3531929,mptcp dss ack 177854901 seq 420685905 subseq 19993 len 1428 csum 0x51ac], length 1428
10:40:37.967552 IP 112.26.2.1.39713 > 112.26.2.8.38357: Flags [.], seq 27133:28561, ack 1, win 893, options [nop,nop,TS val 3766222 ecr 3532334,mptcp dss ack 177854901 seq 420701613 subseq 27133 len 1428 csum 0x7a1f], length 1428
10:40:38.048102 IP 112.26.2.8.38357 > 112.26.2.1.39713: Flags [.], ack 7141, win 8852, options [nop,nop,TS val 3532923 ecr 3765028,nop,nop,sack 2 {18565:21421}{15709:17137},mptcp dss ack 420618789], length 0
10:40:38.061131 IP 112.26.2.8.38357 > 112.26.2.1.39713: Flags [.], ack 7141, win 8852, options [nop,nop,TS val 3532923 ecr 3765028,nop,nop,sack 2 {18565:21421}{15709:17137},mptcp dss ack 420618789], length 0
10:40:38.068434 IP 112.26.2.1.39713 > 112.26.2.8.38357: Flags [.], seq 7141:8569, ack 1, win 893, options [nop,nop,TS val 3766449 ecr 3532506,mptcp dss ack 177854901 seq 420630213 subseq 7141 len 1428 csum 0x7009], length 1428
10:40:38.138185 IP 112.26.2.1.39713 > 112.26.2.8.38357: Flags [.], seq 8569:9997, ack 1, win 893, options [nop,nop,TS val 3766616 ecr 3532701,mptcp dss ack 177854901 seq 420631641 subseq 8569 len 1428 csum 0xc930], length 1428
10:40:38.154915 IP 112.26.2.1.39713 > 112.26.2.8.38357: Flags [.], seq 24277:25705, ack 1, win 893, options [nop,nop,TS val 3766139 ecr 3532116,mptcp dss ack 177854901 seq 420698757 subseq 24277 len 1428 csum 0x5e7e], length 1428
10:40:38.215390 IP 112.26.2.1.39713 > 112.26.2.8.38357: Flags [.], seq 24277:25705, ack 1, win 893, options [nop,nop,TS val 3766139 ecr 3532116,mptcp dss ack 177854901 seq 420698757 subseq 24277 len 1428 csum 0x5e7e], length 1428
10:40:38.244516 IP 112.26.2.1.39713 > 112.26.2.8.38357: Flags [.], seq 9997:11425, ack 1, win 893, options [nop,nop,TS val 3766867 ecr 3532923,mptcp dss ack 177854901 seq 420633069 subseq 9997 len 1428 csum 0x4e64], length 1428
10:40:38.264625 IP 112.26.2.8.38357 > 112.26.2.1.39713: Flags [.], ack 7141, win 9125, options [nop,nop,TS val 3533171 ecr 3765028,nop,nop,sack 2 {24277:25705}{18565:21421},mptcp dss ack 420618789], length 0
10:40:38.265871 IP 112.26.2.8.38357 > 112.26.2.1.39713: Flags [.], ack 7141, win 9125, options [nop,nop,TS val 3533171 ecr 3765028,nop,nop,sack 2 {24277:25705}{18565:21421},mptcp dss ack 420618789], length 0
10:40:38.334918 IP 112.26.2.1.39713 > 112.26.2.8.38357: Flags [.], seq 11425:12853, ack 1, win 893, options [nop,nop,TS val 3767071 ecr 3533171,mptcp dss ack 177854901 seq 420634497 subseq 11425 len 1428 csum 0x7225], length 1428
10:40:38.349522 IP 112.26.2.1.39713 > 112.26.2.8.38357: Flags [.], seq 27133:28561, ack 1, win 893, options [nop,nop,TS val 3766222 ecr 3532334,mptcp dss ack 177854901 seq 420701613 subseq 27133 len 1428 csum 0x7a1f], length 1428
10:40:38.381505 IP 112.26.2.1.39713 > 112.26.2.8.38357: Flags [.], seq 27133:28561, ack 1, win 893, options [nop,nop,TS val 3766222 ecr 3532334,mptcp dss ack 177854901 seq 420701613 subseq 27133 len 1428 csum 0x7a1f], length 1428
10:40:38.477940 IP 112.26.2.8.38357 > 112.26.2.1.39713: Flags [.], ack 7141, win 9399, options [nop,nop,TS val 3533370 ecr 3765028,nop,nop,sack 2 {27133:28561}{24277:25705},mptcp dss ack 420618789], length 0
10:40:38.487099 IP 112.26.2.1.39713 > 112.26.2.8.38357: Flags [.], seq 12853:14281, ack 1, win 893, options [nop,nop,TS val 3767286 ecr 3533370,mptcp dss ack 177854901 seq 420635925 subseq 12853 len 1428 csum 0xa0a0], length 1428
10:40:38.489338 IP 112.26.2.8.38357 > 112.26.2.1.39713: Flags [.], ack 7141, win 9399, options [nop,nop,TS val 3533370 ecr 3765028,nop,nop,sack 2 {27133:28561}{24277:25705},mptcp dss ack 420618789], length 0
10:40:38.520198 IP 112.26.2.1.39713 > 112.26.2.8.38357: Flags [.], seq 7141:8569, ack 1, win 893, options [nop,nop,TS val 3766449 ecr 3532506,mptcp dss ack 177854901 seq 420630213 subseq 7141 len 1428 csum 0x7009], length 1428
10:40:38.575448 IP 112.26.2.1.39713 > 112.26.2.8.38357: Flags [.], seq 7141:8569, ack 1, win 893, options [nop,nop,TS val 3766449 ecr 3532506,mptcp dss ack 177854901 seq 420630213 subseq 7141 len 1428 csum 0x7009], length 1428
10:40:38.669938 IP 112.26.2.1.39713 > 112.26.2.8.38357: Flags [.], seq 9997:11425, ack 1, win 893, options [nop,nop,TS val 3766867 ecr 3532923,mptcp dss ack 177854901 seq 420633069 subseq 9997 len 1428 csum 0x4e64], length 1428
10:40:38.690977 IP 112.26.2.8.38357 > 112.26.2.1.39713: Flags [.], ack 8569, win 9627, options [nop,nop,TS val 3533569 ecr 3766449,nop,nop,sack 2 {27133:28561}{24277:25705},mptcp dss ack 420618789], length 0
10:40:38.692371 IP 112.26.2.8.38357 > 112.26.2.1.39713: Flags [.], ack 8569, win 9627, options [nop,nop,TS val 3533569 ecr 3766449,nop,nop,sack 2 {27133:28561}{24277:25705},mptcp dss ack 420618789], length 0
10:40:38.716706 IP 112.26.2.1.39713 > 112.26.2.8.38357: Flags [.], seq 14281:15709, ack 1, win 893, options [nop,nop,TS val 3767497 ecr 3533569,mptcp dss ack 177854901 seq 420664485 subseq 14281 len 1428 csum 0xb57], length 1428
10:40:38.766528 IP 112.26.2.1.39713 > 112.26.2.8.38357: Flags [.], seq 9997:11425, ack 1, win 893, options [nop,nop,TS val 3766867 ecr 3532923,mptcp dss ack 177854901 seq 420633069 subseq 9997 len 1428 csum 0x4e64], length 1428
10:40:38.794405 IP 112.26.2.1.39713 > 112.26.2.8.38357: Flags [.], seq 11425:12853, ack 1, win 893, options [nop,nop,TS val 3767071 ecr 3533171,mptcp dss ack 177854901 seq 420634497 subseq 11425 len 1428 csum 0x7225], length 1428
10:40:38.847817 IP 112.26.2.1.39713 > 112.26.2.8.38357: Flags [.], seq 17137:18565, ack 1, win 893, options [nop,nop,TS val 3767497 ecr 3533569,mptcp dss ack 177854901 seq 420678765 subseq 17137 len 1428 csum 0x443a], length 1428
10:40:38.848895 IP 112.26.2.8.38357 > 112.26.2.1.39713: Flags [.], ack 8569, win 9901, options [nop,nop,TS val 3533762 ecr 3766449,nop,nop,sack 2 {9997:11425}{27133:28561},mptcp dss ack 420621645], length 0
10:40:38.850854 IP 112.26.2.8.38357 > 112.26.2.1.39713: Flags [.], ack 8569, win 9901, options [nop,nop,TS val 3533762 ecr 3766449,nop,nop,sack 2 {9997:11425}{27133:28561},mptcp dss ack 420621645], length 0
10:40:38.922951 IP 112.26.2.1.39713 > 112.26.2.8.38357: Flags [.], seq 8569:9997, ack 1, win 893, options [nop,nop,TS val 3767656 ecr 3533762,mptcp dss ack 177854901 seq 420631641 subseq 8569 len 1428 csum 0xc930], length 1428
10:40:38.954031 IP 112.26.2.1.39713 > 112.26.2.8.38357: Flags [.], seq 11425:12853, ack 1, win 893, options [nop,nop,TS val 3767071 ecr 3533171,mptcp dss ack 177854901 seq 420634497 subseq 11425 len 1428 csum 0x7225], length 1428
10:40:38.984677 IP 112.26.2.8.38357 > 112.26.2.1.39713: Flags [.], ack 8569, win 10038, options [nop,nop,TS val 3533903 ecr 3766449,nop,nop,sack 2 {9997:12853}{27133:28561},mptcp dss ack 420621645], length 0
10:40:38.994292 IP 112.26.2.1.39713 > 112.26.2.8.38357: Flags [.], seq 21421:22849, ack 1, win 893, options [nop,nop,TS val 3767794 ecr 3533903,mptcp dss ack 177854901 seq 420687333 subseq 21421 len 1428 csum 0x757e], length 1428
10:40:38.996162 IP 112.26.2.8.38357 > 112.26.2.1.39713: Flags [.], ack 8569, win 10038, options [nop,nop,TS val 3533903 ecr 3766449,nop,nop,sack 2 {9997:12853}{27133:28561},mptcp dss ack 420621645], length 0
10:40:39.024894 IP 112.26.2.1.39713 > 112.26.2.8.38357: Flags [.], seq 14281:15709, ack 1, win 893, options [nop,nop,TS val 3767497 ecr 3533569,mptcp dss ack 177854901 seq 420664485 subseq 14281 len 1428 csum 0xb57], length 1428
10:40:39.106513 IP 112.26.2.1.39713 > 112.26.2.8.38357: Flags [.], seq 14281:15709, ack 1, win 893, options [nop,nop,TS val 3767497 ecr 3533569,mptcp dss ack 177854901 seq 420664485 subseq 14281 len 1428 csum 0xb57], length 1428
10:40:39.176655 IP 112.26.2.8.38357 > 112.26.2.1.39713: Flags [.], ack 8569, win 10266, options [nop,nop,TS val 3534083 ecr 3766449,nop,nop,sack 2 {14281:15709}{9997:12853},mptcp dss ack 420621645], length 0
10:40:39.178606 IP 112.26.2.8.38357 > 112.26.2.1.39713: Flags [.], ack 8569, win 10266, options [nop,nop,TS val 3534083 ecr 3766449,nop,nop,sack 2 {14281:15709}{9997:12853},mptcp dss ack 420621645], length 0
10:40:39.191462 IP 112.26.2.1.39713 > 112.26.2.8.38357: Flags [.], seq 12853:14281, ack 1, win 893, options [nop,nop,TS val 3767984 ecr 3534083,mptcp dss ack 177854901 seq 420635925 subseq 12853 len 1428 csum 0xa0a0], length 1428
10:40:39.213927 IP 112.26.2.1.39713 > 112.26.2.8.38357: Flags [.], seq 17137:18565, ack 1, win 893, options [nop,nop,TS val 3767497 ecr 3533569,mptcp dss ack 177854901 seq 420678765 subseq 17137 len 1428 csum 0x443a], length 1428
10:40:39.244556 IP 112.26.2.1.39713 > 112.26.2.8.38357: Flags [.], seq 17137:18565, ack 1, win 893, options [nop,nop,TS val 3767497 ecr 3533569,mptcp dss ack 177854901 seq 420678765 subseq 17137 len 1428 csum 0x443a], length 1428
10:40:39.403160 IP 112.26.2.8.38357 > 112.26.2.1.39713: Flags [.], ack 8569, win 10494, options [nop,nop,TS val 3534251 ecr 3766449,nop,nop,sack 2 {17137:18565}{14281:15709},mptcp dss ack 420621645], length 0
10:40:39.405185 IP 112.26.2.8.38357 > 112.26.2.1.39713: Flags [.], ack 8569, win 10494, options [nop,nop,TS val 3534251 ecr 3766449,nop,nop,sack 2 {17137:18565}{14281:15709},mptcp dss ack 420621645], length 0
10:40:39.411063 IP 112.26.2.1.39713 > 112.26.2.8.38357: Flags [.], seq 22849:24277, ack 1, win 893, options [nop,nop,TS val 3768211 ecr 3534251,mptcp dss ack 177854901 seq 420697329 subseq 22849 len 1428 csum 0x81ae], length 1428
10:40:39.433537 IP 112.26.2.1.39713 > 112.26.2.8.38357: Flags [.], seq 8569:9997, ack 1, win 893, options [nop,nop,TS val 3767656 ecr 3533762,mptcp dss ack 177854901 seq 420631641 subseq 8569 len 1428 csum 0xc930], length 1428
10:40:39.493715 IP 112.26.2.1.39713 > 112.26.2.8.38357: Flags [.], seq 8569:9997, ack 1, win 893, options [nop,nop,TS val 3767656 ecr 3533762,mptcp dss ack 177854901 seq 420631641 subseq 8569 len 1428 csum 0xc930], length 1428
10:40:39.579947 IP 112.26.2.1.39713 > 112.26.2.8.38357: Flags [.], seq 12853:14281, ack 1, win 893, options [nop,nop,TS val 3767984 ecr 3534083,mptcp dss ack 177854901 seq 420635925 subseq 12853 len 1428 csum 0xa0a0], length 1428
10:40:39.628122 IP 112.26.2.8.38357 > 112.26.2.1.39713: Flags [.], ack 12853, win 10768, options [nop,nop,TS val 3534497 ecr 3767656,nop,nop,sack 2 {17137:18565}{14281:15709},mptcp dss ack 420621645], length 0
10:40:39.630554 IP 112.26.2.8.38357 > 112.26.2.1.39713: Flags [.], ack 12853, win 10768, options [nop,nop,TS val 3534497 ecr 3767656,nop,nop,sack 2 {17137:18565}{14281:15709},mptcp dss ack 420621645], length 0
10:40:39.644298 IP 112.26.2.1.39713 > 112.26.2.8.38357: Flags [.], seq 25705:27133, ack 1, win 893, options [nop,nop,TS val 3768436 ecr 3534497,mptcp dss ack 177854901 seq 420700185 subseq 25705 len 1428 csum 0xde36], length 1428
10:40:39.693916 IP 112.26.2.1.39713 > 112.26.2.8.38357: Flags [.], seq 22849:24277, ack 1, win 893, options [nop,nop,TS val 3768211 ecr 3534251,mptcp dss ack 177854901 seq 420697329 subseq 22849 len 1428 csum 0x81ae], length 1428
10:40:39.720752 IP 112.26.2.1.39713 > 112.26.2.8.38357: Flags [.], seq 12853:14281, ack 1, win 893, options [nop,nop,TS val 3767984 ecr 3534083,mptcp dss ack 177854901 seq 420635925 subseq 12853 len 1428 csum 0xa0a0], length 1428
10:40:39.792766 IP 112.26.2.1.39713 > 112.26.2.8.38357: Flags [.], seq 28561:29989, ack 1, win 893, options [nop,nop,TS val 3768436 ecr 3534497,mptcp dss ack 177854901 seq 420754449 subseq 28561 len 1428 csum 0x796d], length 1428
10:40:39.840289 IP 112.26.2.1.39713 > 112.26.2.8.38357: Flags [.], seq 22849:24277, ack 1, win 893, options [nop,nop,TS val 3768211 ecr 3534251,mptcp dss ack 177854901 seq 420697329 subseq 22849 len 1428 csum 0x81ae], length 1428
10:40:39.875407 IP 112.26.2.1.39713 > 112.26.2.8.38357: Flags [.], seq 25705:27133, ack 1, win 893, options [nop,nop,TS val 3768436 ecr 3534497,mptcp dss ack 177854901 seq 420700185 subseq 25705 len 1428 csum 0xde36], length 1428
10:40:39.908865 IP 112.26.2.8.38357 > 112.26.2.1.39713: Flags [.], ack 21421, win 11042, options [nop,nop,TS val 3534728 ecr 3767984,nop,nop,sack 1 {27133:28561},mptcp dss ack 420621645], length 0
10:40:39.911022 IP 112.26.2.8.38357 > 112.26.2.1.39713: Flags [.], ack 21421, win 11042, options [nop,nop,TS val 3534728 ecr 3767984,nop,nop,sack 1 {27133:28561},mptcp dss ack 420621645], length 0
10:40:39.921631 IP 112.26.2.1.39713 > 112.26.2.8.38357: Flags [.], seq 21421:22849, ack 1, win 893, options [nop,nop,TS val 3768716 ecr 3534728,mptcp dss ack 177854901 seq 420687333 subseq 21421 len 1428 csum 0x757e], length 1428
10:40:39.968869 IP 112.26.2.8.38357 > 112.26.2.1.39713: Flags [.], ack 21421, win 11133, options [nop,nop,TS val 3534814 ecr 3767984,nop,nop,sack 2 {22849:24277}{27133:28561},mptcp dss ack 420621645], length 0
10:40:40.021368 IP 112.26.2.1.39713 > 112.26.2.8.38357: Flags [.], seq 28561:29989, ack 1, win 893, options [nop,nop,TS val 3768436 ecr 3534497,mptcp dss ack 177854901 seq 420754449 subseq 28561 len 1428 csum 0x796d], length 1428
10:40:40.111528 IP 112.26.2.1.39713 > 112.26.2.8.38357: Flags [.], seq 21421:22849, ack 1, win 893, options [nop,nop,TS val 3768716 ecr 3534728,mptcp dss ack 177854901 seq 420687333 subseq 21421 len 1428 csum 0x757e], length 1428
10:40:40.123911 IP 112.26.2.1.39713 > 112.26.2.8.38357: Flags [.], seq 25705:27133, ack 1, win 893, options [nop,nop,TS val 3768436 ecr 3534497,mptcp dss ack 177854901 seq 420700185 subseq 25705 len 1428 csum 0xde36], length 1428
10:40:40.216491 IP 112.26.2.1.39713 > 112.26.2.8.38357: Flags [.], seq 28561:29989, ack 1, win 893, options [nop,nop,TS val 3768436 ecr 3534497,mptcp dss ack 177854901 seq 420754449 subseq 28561 len 1428 csum 0x796d], length 1428
10:40:40.306526 IP 112.26.2.1.39713 > 112.26.2.8.38357: Flags [.], seq 21421:22849, ack 1, win 893, options [nop,nop,TS val 3768716 ecr 3534728,mptcp dss ack 177854901 seq 420687333 subseq 21421 len 1428 csum 0x757e], length 1428
10:40:40.363138 IP 112.26.2.8.38357 > 112.26.2.1.39713: Flags [.], ack 21421, win 11544, options [nop,nop,TS val 3535135 ecr 3767984,nop,nop,sack 2 {25705:28561}{22849:24277},mptcp dss ack 420645921], length 0
10:40:40.395112 IP 112.26.2.8.38357 > 112.26.2.1.39713: Flags [.], ack 21421, win 11544, options [nop,nop,TS val 3535135 ecr 3767984,nop,nop,sack 2 {25705:28561}{22849:24277},mptcp dss ack 420645921], length 0
10:40:40.422431 IP 112.26.2.8.38357 > 112.26.2.1.39713: Flags [.], ack 21421, win 11680, options [nop,nop,TS val 3535228 ecr 3767984,nop,nop,sack 2 {25705:29989}{22849:24277},mptcp dss ack 420647349], length 0
10:40:40.448455 IP 112.26.2.1.39713 > 112.26.2.8.38357: Flags [.], seq 29989:31417, ack 1, win 893, options [nop,nop,TS val 3769245 ecr 3535135,mptcp dss ack 177854901 seq 420778725 subseq 29989 len 1428 csum 0x9618], length 1428
10:40:40.452702 IP 112.26.2.8.38357 > 112.26.2.1.39713: Flags [.], ack 21421, win 11680, options [nop,nop,TS val 3535228 ecr 3767984,nop,nop,sack 2 {25705:29989}{22849:24277},mptcp dss ack 420647349], length 0
10:40:40.459262 IP 112.26.2.8.38357 > 112.26.2.1.39713: Flags [.], ack 29989, win 11772, options [nop,nop,TS val 3535318 ecr 3768716,mptcp dss ack 420647349], length 0
10:40:40.473332 IP 112.26.2.1.39713 > 112.26.2.8.38357: Flags [.], seq 29989:31417, ack 1, win 893, options [nop,nop,TS val 3769245 ecr 3535135,mptcp dss ack 177854901 seq 420778725 subseq 29989 len 1428 csum 0x9618], length 1428
10:40:40.536048 IP 112.26.2.8.38357 > 112.26.2.1.39713: Flags [.], ack 29989, win 11772, options [nop,nop,TS val 3535318 ecr 3768716,mptcp dss ack 420647349], length 0
10:40:40.564533 IP 112.26.2.1.39713 > 112.26.2.8.38357: Flags [.], seq 29989:31417, ack 1, win 893, options [nop,nop,TS val 3769245 ecr 3535135,mptcp dss ack 177854901 seq 420778725 subseq 29989 len 1428 csum 0x9618], length 1428
10:40:40.588158 IP 112.26.2.1.39713 > 112.26.2.8.38357: Flags [.], seq 31417:32845, ack 1, win 893, options [nop,nop,TS val 3769245 ecr 3535135,mptcp dss ack 177854901 seq 420780153 subseq 31417 len 1428 csum 0xaf53], length 1428
10:40:40.619948 IP 112.26.2.8.38357 > 112.26.2.1.39713: Flags [.], ack 31417, win 12045, options [nop,nop,TS val 3535565 ecr 3769245,mptcp dss ack 420647349], length 0
10:40:40.650933 IP 112.26.2.1.39713 > 112.26.2.8.38357: Flags [.], seq 32845:34273, ack 1, win 893, options [nop,nop,TS val 3769289 ecr 3535228,mptcp dss ack 177854901 seq 420784437 subseq 32845 len 1428 csum 0x406c], length 1428
10:40:40.673245 IP 112.26.2.1.39713 > 112.26.2.8.38357: Flags [.], seq 31417:32845, ack 1, win 893, options [nop,nop,TS val 3769245 ecr 3535135,mptcp dss ack 177854901 seq 420780153 subseq 31417 len 1428 csum 0xaf53], length 1428
10:40:40.710700 IP 112.26.2.1.39713 > 112.26.2.8.38357: Flags [.], seq 31417:32845, ack 1, win 893, options [nop,nop,TS val 3769245 ecr 3535135,mptcp dss ack 177854901 seq 420780153 subseq 31417 len 1428 csum 0xaf53], length 1428
10:40:40.738196 IP 112.26.2.1.39713 > 112.26.2.8.38357: Flags [.], seq 34273:35701, ack 1, win 893, options [nop,nop,TS val 3769342 ecr 3535318,mptcp dss ack 177854901 seq 420788721 subseq 34273 len 1428 csum 0x6828], length 1428
10:40:40.776488 IP 112.26.2.8.38357 > 112.26.2.1.39713: Flags [.], ack 31417, win 12045, options [nop,nop,TS val 3535565 ecr 3769245,mptcp dss ack 420647349], length 0
10:40:40.783350 IP 112.26.2.8.38357 > 112.26.2.1.39713: Flags [.], ack 32845, win 12274, options [nop,nop,TS val 3535690 ecr 3769245,mptcp dss ack 420647349], length 0
10:40:40.814004 IP 112.26.2.8.38357 > 112.26.2.1.39713: Flags [.], ack 32845, win 12274, options [nop,nop,TS val 3535690 ecr 3769245,mptcp dss ack 420647349], length 0
10:40:40.857180 IP 112.26.2.1.39713 > 112.26.2.8.38357: Flags [.], seq 35701:37129, ack 1, win 893, options [nop,nop,TS val 3769342 ecr 3535318,mptcp dss ack 177854901 seq 420790149 subseq 35701 len 1428 csum 0xab83], length 1428
10:40:40.885676 IP 112.26.2.1.39713 > 112.26.2.8.38357: Flags [.], seq 32845:34273, ack 1, win 893, options [nop,nop,TS val 3769289 ecr 3535228,mptcp dss ack 177854901 seq 420784437 subseq 32845 len 1428 csum 0x406c], length 1428
10:40:40.946033 IP 112.26.2.1.39713 > 112.26.2.8.38357: Flags [.], seq 32845:34273, ack 1, win 893, options [nop,nop,TS val 3769289 ecr 3535228,mptcp dss ack 177854901 seq 420784437 subseq 32845 len 1428 csum 0x406c], length 1428
10:40:40.986738 IP 112.26.2.1.39713 > 112.26.2.8.38357: Flags [.], seq 37129:38557, ack 1, win 893, options [nop,nop,TS val 3769342 ecr 3535318,mptcp dss ack 177854901 seq 420791577 subseq 37129 len 1428 csum 0x93a], length 1428
10:40:41.004316 IP 112.26.2.8.38357 > 112.26.2.1.39713: Flags [.], ack 34273, win 12456, options [nop,nop,TS val 3535900 ecr 3769289,mptcp dss ack 420647349], length 0
10:40:41.024492 IP 112.26.2.8.38357 > 112.26.2.1.39713: Flags [.], ack 34273, win 12456, options [nop,nop,TS val 3535900 ecr 3769289,mptcp dss ack 420647349], length 0
10:40:41.055136 IP 112.26.2.1.39713 > 112.26.2.8.38357: Flags [.], seq 34273:35701, ack 1, win 893, options [nop,nop,TS val 3769342 ecr 3535318,mptcp dss ack 177854901 seq 420788721 subseq 34273 len 1428 csum 0x6828], length 1428
10:40:41.116735 IP 112.26.2.1.39713 > 112.26.2.8.38357: Flags [.], seq 44269:45697, ack 1, win 893, options [nop,nop,TS val 3769582 ecr 3535565,mptcp dss ack 177854901 seq 420808713 subseq 44269 len 1428 csum 0xce20], length 1428
10:40:41.168375 IP 112.26.2.1.39713 > 112.26.2.8.38357: Flags [.], seq 34273:35701, ack 1, win 893, options [nop,nop,TS val 3769342 ecr 3535318,mptcp dss ack 177854901 seq 420788721 subseq 34273 len 1428 csum 0x6828], length 1428
10:40:41.193684 IP 112.26.2.1.39713 > 112.26.2.8.38357: Flags [.], seq 35701:37129, ack 1, win 893, options [nop,nop,TS val 3769342 ecr 3535318,mptcp dss ack 177854901 seq 420790149 subseq 35701 len 1428 csum 0xab83], length 1428
10:40:41.232724 IP 112.26.2.1.39713 > 112.26.2.8.38357: Flags [.], seq 45697:47125, ack 1, win 893, options [nop,nop,TS val 3769620 ecr 3535690,mptcp dss ack 177854901 seq 420814425 subseq 45697 len 1428 csum 0x805e], length 1428
10:40:41.243191 IP 112.26.2.8.38357 > 112.26.2.1.39713: Flags [.], ack 35701, win 12730, options [nop,nop,TS val 3536102 ecr 3769342,mptcp dss ack 420647349], length 0
10:40:41.248765 IP 112.26.2.8.38357 > 112.26.2.1.39713: Flags [.], ack 35701, win 12730, options [nop,nop,TS val 3536102 ecr 3769342,mptcp dss ack 420647349], length 0
10:40:41.292215 IP 112.26.2.1.39713 > 112.26.2.8.38357: Flags [.], seq 35701:37129, ack 1, win 893, options [nop,nop,TS val 3769342 ecr 3535318,mptcp dss ack 177854901 seq 420790149 subseq 35701 len 1428 csum 0xab83], length 1428
10:40:41.349627 IP 112.26.2.1.39713 > 112.26.2.8.38357: Flags [.], seq 47125:48553, ack 1, win 893, options [nop,nop,TS val 3769620 ecr 3535690,mptcp dss ack 177854901 seq 420815853 subseq 47125 len 1428 csum 0x9eaa], length 1428
10:40:41.383382 IP 112.26.2.8.38357 > 112.26.2.1.39713: Flags [.], ack 37129, win 12867, options [nop,nop,TS val 3536297 ecr 3769342,mptcp dss ack 420647349], length 0
10:40:41.434783 IP 112.26.2.1.39713 > 112.26.2.8.38357: Flags [.], seq 37129:38557, ack 1, win 893, options [nop,nop,TS val 3769342 ecr 3535318,mptcp dss ack 177854901 seq 420791577 subseq 37129 len 1428 csum 0x93a], length 1428
10:40:41.442806 IP 112.26.2.8.38357 > 112.26.2.1.39713: Flags [.], ack 37129, win 12867, options [nop,nop,TS val 3536297 ecr 3769342,mptcp dss ack 420647349], length 0
10:40:41.464458 IP 112.26.2.1.39713 > 112.26.2.8.38357: Flags [.], seq 48553:49981, ack 1, win 893, options [nop,nop,TS val 3769830 ecr 3535900,mptcp dss ack 177854901 seq 420820137 subseq 48553 len 1428 csum 0x5c4c], length 1428
10:40:41.558168 IP 112.26.2.1.39713 > 112.26.2.8.38357: Flags [.], seq 44269:45697, ack 1, win 893, options [nop,nop,TS val 3769582 ecr 3535565,mptcp dss ack 177854901 seq 420808713 subseq 44269 len 1428 csum 0xce20], length 1428
10:40:41.618596 IP 112.26.2.1.39713 > 112.26.2.8.38357: Flags [.], seq 49981:51409, ack 1, win 893, options [nop,nop,TS val 3770054 ecr 3536102,mptcp dss ack 177854901 seq 420831561 subseq 49981 len 1428 csum 0xf79e], length 1428
10:40:41.706070 IP 112.26.2.1.39713 > 112.26.2.8.38357: Flags [.], seq 51409:52837, ack 1, win 893, options [nop,nop,TS val 3770054 ecr 3536102,mptcp dss ack 177854901 seq 420832989 subseq 51409 len 1428 csum 0x84dc], length 1428
10:40:41.746361 IP 112.26.2.1.39713 > 112.26.2.8.38357: Flags [.], seq 37129:38557, ack 1, win 893, options [nop,nop,TS val 3769342 ecr 3535318,mptcp dss ack 177854901 seq 420791577 subseq 37129 len 1428 csum 0x93a], length 1428
10:40:41.806135 IP 112.26.2.1.39713 > 112.26.2.8.38357: Flags [.], seq 45697:47125, ack 1, win 893, options [nop,nop,TS val 3769620 ecr 3535690,mptcp dss ack 177854901 seq 420814425 subseq 45697 len 1428 csum 0x805e], length 1428
10:40:41.847906 IP 112.26.2.1.39713 > 112.26.2.8.38357: Flags [.], seq 44269:45697, ack 1, win 893, options [nop,nop,TS val 3769582 ecr 3535565,mptcp dss ack 177854901 seq 420808713 subseq 44269 len 1428 csum 0xce20], length 1428
10:40:41.915586 IP 112.26.2.1.39713 > 112.26.2.8.38357: Flags [.], seq 52837:54265, ack 1, win 893, options [nop,nop,TS val 3770248 ecr 3536297,mptcp dss ack 177854901 seq 420834417 subseq 52837 len 1428 csum 0x79f0], length 1428
10:40:41.922426 IP 112.26.2.8.38357 > 112.26.2.1.39713: Flags [.], ack 38557, win 13414, options [nop,nop,TS val 3536692 ecr 3769342,mptcp dss ack 420647349], length 0
10:40:41.925050 IP 112.26.2.8.38357 > 112.26.2.1.39713: Flags [.], ack 38557, win 13414, options [nop,nop,TS val 3536692 ecr 3769342,mptcp dss ack 420647349], length 0
10:40:41.943997 IP 112.26.2.1.39713 > 112.26.2.8.38357: Flags [.], seq 54265:55693, ack 1, win 893, options [nop,nop,TS val 3770730 ecr 3536692,mptcp dss ack 177854901 seq 420848697 subseq 54265 len 1428 csum 0xb414], length 1428
10:40:41.977682 IP 112.26.2.8.38357 > 112.26.2.1.39713: Flags [.], ack 38557, win 13551, options [nop,nop,TS val 3536793 ecr 3769342,nop,nop,sack 1 {44269:45697},mptcp dss ack 420647349], length 0
10:40:42.019917 IP 112.26.2.1.39713 > 112.26.2.8.38357: Flags [.], seq 45697:47125, ack 1, win 893, options [nop,nop,TS val 3769620 ecr 3535690,mptcp dss ack 177854901 seq 420814425 subseq 45697 len 1428 csum 0x805e], length 1428
10:40:42.033241 IP 112.26.2.8.38357 > 112.26.2.1.39713: Flags [.], ack 38557, win 13551, options [nop,nop,TS val 3536793 ecr 3769342,nop,nop,sack 1 {44269:45697},mptcp dss ack 420647349], length 0
10:40:42.056168 IP 112.26.2.1.39713 > 112.26.2.8.38357: Flags [.], seq 38557:39985, ack 1, win 893, options [nop,nop,TS val 3770838 ecr 3536793,mptcp dss ack 177854901 seq 420793005 subseq 38557 len 1428 csum 0xb791], length 1428
10:40:42.178350 IP 112.26.2.1.39713 > 112.26.2.8.38357: Flags [.], seq 51409:52837, ack 1, win 893, options [nop,nop,TS val 3770054 ecr 3536102,mptcp dss ack 177854901 seq 420832989 subseq 51409 len 1428 csum 0x84dc], length 1428
10:40:42.256913 IP 112.26.2.1.39713 > 112.26.2.8.38357: Flags [.], seq 54265:55693, ack 1, win 893, options [nop,nop,TS val 3770730 ecr 3536692,mptcp dss ack 177854901 seq 420848697 subseq 54265 len 1428 csum 0xb414], length 1428
10:40:42.324354 IP 112.26.2.8.38357 > 112.26.2.1.39713: Flags [.], ack 38557, win 13734, options [nop,nop,TS val 3537031 ecr 3769342,nop,nop,sack 1 {44269:47125},mptcp dss ack 420647349], length 0
10:40:42.328169 IP 112.26.2.8.38357 > 112.26.2.1.39713: Flags [.], ack 38557, win 13734, options [nop,nop,TS val 3537031 ecr 3769342,nop,nop,sack 1 {44269:47125},mptcp dss ack 420647349], length 0
10:40:42.356050 IP 112.26.2.1.39713 > 112.26.2.8.38357: Flags [.], seq 39985:41413, ack 1, win 893, options [nop,nop,TS val 3771134 ecr 3537031,mptcp dss ack 177854901 seq 420794433 subseq 39985 len 1428 csum 0xab71], length 1428
10:40:42.386394 IP 112.26.2.1.39713 > 112.26.2.8.38357: Flags [.], seq 51409:52837, ack 1, win 893, options [nop,nop,TS val 3770054 ecr 3536102,mptcp dss ack 177854901 seq 420832989 subseq 51409 len 1428 csum 0x84dc], length 1428
10:40:42.393773 IP 112.26.2.1.39713 > 112.26.2.8.38357: Flags [.], seq 38557:39985, ack 1, win 893, options [nop,nop,TS val 3770838 ecr 3536793,mptcp dss ack 177854901 seq 420793005 subseq 38557 len 1428 csum 0xb791], length 1428
10:40:42.485511 IP 112.26.2.1.39713 > 112.26.2.8.38357: Flags [.], seq 39985:41413, ack 1, win 893, options [nop,nop,TS val 3771134 ecr 3537031,mptcp dss ack 177854901 seq 420794433 subseq 39985 len 1428 csum 0xab71], length 1428
10:40:42.527947 IP 112.26.2.1.39713 > 112.26.2.8.38357: Flags [.], seq 54265:55693, ack 1, win 893, options [nop,nop,TS val 3770730 ecr 3536692,mptcp dss ack 177854901 seq 420848697 subseq 54265 len 1428 csum 0xb414], length 1428
10:40:42.635937 IP 112.26.2.8.38357 > 112.26.2.1.39713: Flags [.], ack 38557, win 14053, options [nop,nop,TS val 3537373 ecr 3769342,nop,nop,sack 2 {51409:52837}{44269:47125},mptcp dss ack 420648777], length 0
10:40:42.645277 IP 112.26.2.8.38357 > 112.26.2.1.39713: Flags [.], ack 38557, win 14053, options [nop,nop,TS val 3537373 ecr 3769342,nop,nop,sack 2 {51409:52837}{44269:47125},mptcp dss ack 420648777], length 0
10:40:42.652547 IP 112.26.2.1.39713 > 112.26.2.8.38357: Flags [.], seq 41413:42841, ack 1, win 893, options [nop,nop,TS val 3771441 ecr 3537373,mptcp dss ack 177854901 seq 420795861 subseq 41413 len 1428 csum 0x4992], length 1428
10:40:42.692214 IP 112.26.2.1.39713 > 112.26.2.8.38357: Flags [.], seq 38557:39985, ack 1, win 893, options [nop,nop,TS val 3770838 ecr 3536793,mptcp dss ack 177854901 seq 420793005 subseq 38557 len 1428 csum 0xb791], length 1428
10:40:42.743238 IP 112.26.2.1.39713 > 112.26.2.8.38357: Flags [.], seq 41413:42841, ack 1, win 893, options [nop,nop,TS val 3771441 ecr 3537373,mptcp dss ack 177854901 seq 420795861 subseq 41413 len 1428 csum 0x4992], length 1428
10:40:42.844035 IP 112.26.2.1.39713 > 112.26.2.8.38357: Flags [.], seq 39985:41413, ack 1, win 893, options [nop,nop,TS val 3771134 ecr 3537031,mptcp dss ack 177854901 seq 420794433 subseq 39985 len 1428 csum 0xab71], length 1428
10:40:42.946305 IP 112.26.2.8.38357 > 112.26.2.1.39713: Flags [.], ack 38557, win 14235, options [nop,nop,TS val 3537539 ecr 3769342,nop,nop,sack 2 {54265:55693}{51409:52837},mptcp dss ack 420648777], length 0
10:40:42.948571 IP 112.26.2.8.38357 > 112.26.2.1.39713: Flags [.], ack 38557, win 14235, options [nop,nop,TS val 3537539 ecr 3769342,nop,nop,sack 2 {54265:55693}{51409:52837},mptcp dss ack 420648777], length 0
10:40:42.982639 IP 112.26.2.1.39713 > 112.26.2.8.38357: Flags [.], seq 42841:44269, ack 1, win 893, options [nop,nop,TS val 3771754 ecr 3537539,mptcp dss ack 177854901 seq 420797289 subseq 42841 len 1428 csum 0x7f6d], length 1428
10:40:42.989489 IP 112.26.2.1.39713 > 112.26.2.8.38357: Flags [.], seq 42841:44269, ack 1, win 893, options [nop,nop,TS val 3771754 ecr 3537539,mptcp dss ack 177854901 seq 420797289 subseq 42841 len 1428 csum 0x7f6d], length 1428
10:40:43.018712 IP 112.26.2.8.38357 > 112.26.2.1.39713: Flags [.], ack 39985, win 14509, options [nop,nop,TS val 3537704 ecr 3770838,nop,nop,sack 2 {54265:55693}{51409:52837},mptcp dss ack 420765873], length 0
