10:40:35.994014 IP 112.26.3.8.41803 > 112.26.3.1.39713: Flags [S], seq 636516537, win 65535, options [mss 1460,sackOK,TS val 3530994 ecr 0,nop,wscale 6,mptcp join id 6 token 0x2fb3bb97 nonce 0x876ec077], length 0
10:40:35.999139 IP 112.26.3.8.41803 > 112.26.3.1.39713: Flags [S], seq 636516537, win 65535, options [mss 1460,sackOK,TS val 3530994 ecr 0,nop,wscale 6,mptcp join id 6 token 0x2fb3bb97 nonce 0x876ec077], length 0
10:40:36.150732 IP 112.26.3.1.39713 > 112.26.3.8.41803: Flags [S.], seq 2121612591, ack 636516538, win 28560, options [mss 1460,sackOK,TS val 3764813 ecr 3530994,nop,wscale 7,mptcp join id 5 hmac 0x5e121756d07c3a83 nonce 0xd7201c93], length 0
10:40:36.152472 IP 112.26.3.8.41803 > 112.26.3.1.39713: Flags [.], ack 1, win 6981, options [nop,nop,TS val 3531162 ecr 3764813,mptcp join hmac 0x6c30200052791c7ef610af211b99eaa9c24def9f], length 0
10:40:36.252900 IP 112.26.3.8.41803 > 112.26.3.1.39713: Flags [.], ack 1, win 6981, options [nop,nop,TS val 3531162 ecr 3764813,mptcp join hmac 0x6c30200052791c7ef610af211b99eaa9c24def9f], length 0
10:40:36.444339 IP 112.26.3.1.39713 > 112.26.3.8.41803: Flags [.], ack 1, win 893, options [nop,nop,TS val 3765061 ecr 3531162,mptcp dss ack 177854901], length 0
10:40:36.668876 IP 112.26.3.1.39713 > 112.26.3.8.41803: Flags [.], seq 1:1429, ack 1, win 893, options [nop,nop,TS val 3765061 ecr 3531162,mptcp dss ack 177854901 seq 420637353 subseq 1 len 1428 csum 0x8af1], length 1428
10:40:36.671697 IP 112.26.3.8.41803 > 112.26.3.1.39713: Flags [.], ack 1429, win 7483, options [nop,nop,TS val 3531680 ecr 3765061,mptcp dss ack 420614505], length 0
10:40:36.923548 IP 112.26.3.8.41803 > 112.26.3.1.39713: Flags [.], ack 1429, win 7483, options [nop,nop,TS val 3531680 ecr 3765061,mptcp dss ack 420614505], length 0
10:40:37.138830 IP 112.26.3.1.39713 > 112.26.3.8.41803: Flags [.], seq 2857:4285, ack 1, win 893, options [nop,nop,TS val 3765062 ecr 3531162,mptcp dss ack 177854901 seq 420640209 subseq 2857 len 1428 csum 0x27c1], length 1428
10:40:37.141488 IP 112.26.3.8.41803 > 112.26.3.1.39713: Flags [.], ack 1429, win 7985, options [nop,nop,TS val 3532150 ecr 3765061,nop,nop,sack 1 {2857:4285},mptcp dss ack 420618789], length 0
10:40:37.468019 IP 112.26.3.8.41803 > 112.26.3.1.39713: Flags [.], ack 1429, win 7985, options [nop,nop,TS val 3532150 ecr 3765061,nop,nop,sack 1 {2857:4285},mptcp dss ack 420618789], length 0
10:40:37.547518 IP 112.26.3.1.39713 > 112.26.3.8.41803: Flags [.], seq 12853:14281, ack 1, win 893, options [nop,nop,TS val 3765568 ecr 3531162,mptcp dss ack 177854901 seq 420650205 subseq 12853 len 1428 csum 0x19cf], length 1428
10:40:37.551122 IP 112.26.3.8.41803 > 112.26.3.1.39713: Flags [.], ack 1429, win 8532, options [nop,nop,TS val 3532558 ecr 3765061,nop,nop,sack 2 {12853:14281}{2857:4285},mptcp dss ack 420618789], length 0
10:40:37.716640 IP 112.26.3.8.41803 > 112.26.3.1.39713: Flags [.], ack 1429, win 8532, options [nop,nop,TS val 3532558 ecr 3765061,nop,nop,sack 2 {12853:14281}{2857:4285},mptcp dss ack 420618789], length 0
10:40:38.010259 IP 112.26.3.1.39713 > 112.26.3.8.41803: Flags [.], seq 14281:15709, ack 1, win 893, options [nop,nop,TS val 3766278 ecr 3532150,mptcp dss ack 177854901 seq 420707325 subseq 14281 len 1428 csum 0xef9], length 1428
10:40:38.012812 IP 112.26.3.8.41803 > 112.26.3.1.39713: Flags [.], ack 1429, win 8989, options [nop,nop,TS val 3533021 ecr 3765061,nop,nop,sack 2 {12853:15709}{2857:4285},mptcp dss ack 420618789], length 0
10:40:38.167309 IP 112.26.3.8.41803 > 112.26.3.1.39713: Flags [.], ack 1429, win 8989, options [nop,nop,TS val 3533021 ecr 3765061,nop,nop,sack 2 {12853:15709}{2857:4285},mptcp dss ack 420618789], length 0
10:40:38.269267 IP 112.26.3.1.39713 > 112.26.3.8.41803: Flags [.], seq 17137:18565, ack 1, win 893, options [nop,nop,TS val 3766278 ecr 3532150,mptcp dss ack 177854901 seq 420710181 subseq 17137 len 1428 csum 0x9797], length 1428
10:40:38.273014 IP 112.26.3.8.41803 > 112.26.3.1.39713: Flags [.], ack 1429, win 9217, options [nop,nop,TS val 3533280 ecr 3765061,nop,nop,sack 2 {17137:18565}{12853:15709},mptcp dss ack 420618789], length 0
10:40:38.495895 IP 112.26.3.8.41803 > 112.26.3.1.39713: Flags [.], ack 1429, win 9217, options [nop,nop,TS val 3533280 ecr 3765061,nop,nop,sack 2 {17137:18565}{12853:15709},mptcp dss ack 420618789], length 0
10:40:38.763700 IP 112.26.3.1.39713 > 112.26.3.8.41803: Flags [P.], seq 1429:2857, ack 1, win 893, options [nop,nop,TS val 3767242 ecr 3533021,mptcp dss ack 177854901 seq 420638781 subseq 1429 len 1428 csum 0x78f8], length 1428
10:40:38.766268 IP 112.26.3.8.41803 > 112.26.3.1.39713: Flags [.], ack 4285, win 9947, options [nop,nop,TS val 3533775 ecr 3767242,nop,nop,sack 2 {17137:18565}{12853:15709},mptcp dss ack 420621645], length 0
10:40:38.951117 IP 112.26.3.8.41803 > 112.26.3.1.39713: Flags [.], ack 4285, win 9947, options [nop,nop,TS val 3533775 ecr 3767242,nop,nop,sack 2 {17137:18565}{12853:15709},mptcp dss ack 420621645], length 0
10:40:39.089747 IP 112.26.3.1.39713 > 112.26.3.8.41803: Flags [.], seq 4285:5713, ack 1, win 893, options [nop,nop,TS val 3767242 ecr 3533021,mptcp dss ack 177854901 seq 420641637 subseq 4285 len 1428 csum 0xa0af], length 1428
10:40:39.101035 IP 112.26.3.8.41803 > 112.26.3.1.39713: Flags [.], ack 5713, win 10312, options [nop,nop,TS val 3534101 ecr 3767242,nop,nop,sack 2 {17137:18565}{12853:15709},mptcp dss ack 420621645], length 0
10:40:39.266879 IP 112.26.3.8.41803 > 112.26.3.1.39713: Flags [.], ack 5713, win 10312, options [nop,nop,TS val 3534101 ecr 3767242,nop,nop,sack 2 {17137:18565}{12853:15709},mptcp dss ack 420621645], length 0
10:40:39.381423 IP 112.26.3.1.39713 > 112.26.3.8.41803: Flags [.], seq 5713:7141, ack 1, win 893, options [nop,nop,TS val 3767710 ecr 3533280,mptcp dss ack 177854901 seq 420643065 subseq 5713 len 1428 csum 0x971d], length 1428
10:40:39.383906 IP 112.26.3.8.41803 > 112.26.3.1.39713: Flags [.], ack 7141, win 10677, options [nop,nop,TS val 3534393 ecr 3767710,nop,nop,sack 2 {17137:18565}{12853:15709},mptcp dss ack 420621645], length 0
10:40:39.543072 IP 112.26.3.8.41803 > 112.26.3.1.39713: Flags [.], ack 7141, win 10677, options [nop,nop,TS val 3534393 ecr 3767710,nop,nop,sack 2 {17137:18565}{12853:15709},mptcp dss ack 420621645], length 0
10:40:39.714244 IP 112.26.3.1.39713 > 112.26.3.8.41803: Flags [.], seq 7141:8569, ack 1, win 893, options [nop,nop,TS val 3768303 ecr 3534101,mptcp dss ack 177854901 seq 420644493 subseq 7141 len 1428 csum 0x9bc6], length 1428
10:40:39.724607 IP 112.26.3.8.41803 > 112.26.3.1.39713: Flags [.], ack 8569, win 10996, options [nop,nop,TS val 3534725 ecr 3768303,nop,nop,sack 2 {17137:18565}{12853:15709},mptcp dss ack 420621645], length 0
10:40:39.994110 IP 112.26.3.8.41803 > 112.26.3.1.39713: Flags [.], ack 8569, win 10996, options [nop,nop,TS val 3534725 ecr 3768303,nop,nop,sack 2 {17137:18565}{12853:15709},mptcp dss ack 420621645], length 0
10:40:40.152743 IP 112.26.3.1.39713 > 112.26.3.8.41803: Flags [.], seq 8569:9997, ack 1, win 893, options [nop,nop,TS val 3768303 ecr 3534101,mptcp dss ack 177854901 seq 420645921 subseq 8569 len 1428 csum 0xde8c], length 1428
10:40:40.163643 IP 112.26.3.8.41803 > 112.26.3.1.39713: Flags [.], ack 9997, win 11635, options [nop,nop,TS val 3535164 ecr 3768303,nop,nop,sack 2 {17137:18565}{12853:15709},mptcp dss ack 420647349], length 0
10:40:40.281164 IP 112.26.3.8.41803 > 112.26.3.1.39713: Flags [.], ack 9997, win 11635, options [nop,nop,TS val 3535164 ecr 3768303,nop,nop,sack 2 {17137:18565}{12853:15709},mptcp dss ack 420647349], length 0
10:40:40.593759 IP 112.26.3.1.39713 > 112.26.3.8.41803: Flags [.], seq 15709:17137, ack 1, win 893, options [nop,nop,TS val 3768754 ecr 3534393,mptcp dss ack 177854901 seq 420708753 subseq 15709 len 1428 csum 0xea1], length 1428
10:40:40.595831 IP 112.26.3.8.41803 > 112.26.3.1.39713: Flags [.], ack 9997, win 12091, options [nop,nop,TS val 3535605 ecr 3768303,nop,nop,sack 1 {12853:18565},mptcp dss ack 420647349], length 0
10:40:40.751501 IP 112.26.3.8.41803 > 112.26.3.1.39713: Flags [.], ack 9997, win 12091, options [nop,nop,TS val 3535605 ecr 3768303,nop,nop,sack 1 {12853:18565},mptcp dss ack 420647349], length 0
10:40:40.951471 IP 112.26.3.1.39713 > 112.26.3.8.41803: Flags [.], seq 18565:19993, ack 1, win 893, options [nop,nop,TS val 3769164 ecr 3534725,mptcp dss ack 177854901 seq 420711609 subseq 18565 len 1428 csum 0x335b], length 1428
10:40:40.953245 IP 112.26.3.8.41803 > 112.26.3.1.39713: Flags [.], ack 9997, win 12593, options [nop,nop,TS val 3535963 ecr 3768303,nop,nop,sack 1 {12853:19993},mptcp dss ack 420647349], length 0
10:40:41.098546 IP 112.26.3.8.41803 > 112.26.3.1.39713: Flags [.], ack 9997, win 12593, options [nop,nop,TS val 3535963 ecr 3768303,nop,nop,sack 1 {12853:19993},mptcp dss ack 420647349], length 0
10:40:41.583723 IP 112.26.3.1.39713 > 112.26.3.8.41803: Flags [.], seq 21421:22849, ack 1, win 893, options [nop,nop,TS val 3769603 ecr 3535164,mptcp dss ack 177854901 seq 420811569 subseq 21421 len 1428 csum 0xd54c], length 1428
10:40:41.588548 IP 112.26.3.8.41803 > 112.26.3.1.39713: Flags [.], ack 9997, win 13232, options [nop,nop,TS val 3536595 ecr 3768303,nop,nop,sack 2 {21421:22849}{12853:19993},mptcp dss ack 420647349], length 0
10:40:41.907491 IP 112.26.3.1.39713 > 112.26.3.8.41803: Flags [.], seq 22849:24277, ack 1, win 893, options [nop,nop,TS val 3769603 ecr 3535164,mptcp dss ack 177854901 seq 420812997 subseq 22849 len 1428 csum 0x3169], length 1428
10:40:41.919883 IP 112.26.3.8.41803 > 112.26.3.1.39713: Flags [.], ack 9997, win 13642, options [nop,nop,TS val 3536918 ecr 3768303,nop,nop,sack 2 {21421:24277}{12853:19993},mptcp dss ack 420647349], length 0
10:40:42.049613 IP 112.26.3.8.41803 > 112.26.3.1.39713: Flags [.], ack 9997, win 13232, options [nop,nop,TS val 3536595 ecr 3768303,nop,nop,sack 2 {21421:22849}{12853:19993},mptcp dss ack 420647349], length 0
10:40:42.126295 IP 112.26.3.1.39713 > 112.26.3.8.41803: Flags [.], seq 9997:11425, ack 1, win 893, options [nop,nop,TS val 3769997 ecr 3535605,mptcp dss ack 177854901 seq 420647349 subseq 9997 len 1428 csum 0xceff], length 1428
10:40:42.129683 IP 112.26.3.8.41803 > 112.26.3.1.39713: Flags [.], ack 11425, win 13870, options [nop,nop,TS val 3537137 ecr 3769997,nop,nop,sack 2 {21421:24277}{12853:19993},mptcp dss ack 420648777], length 0
10:40:42.371508 IP 112.26.3.8.41803 > 112.26.3.1.39713: Flags [.], ack 9997, win 13642, options [nop,nop,TS val 3536918 ecr 3768303,nop,nop,sack 2 {21421:24277}{12853:19993},mptcp dss ack 420647349], length 0
10:40:42.462049 IP 112.26.3.8.41803 > 112.26.3.1.39713: Flags [.], ack 11425, win 13870, options [nop,nop,TS val 3537137 ecr 3769997,nop,nop,sack 2 {21421:24277}{12853:19993},mptcp dss ack 420648777], length 0
10:40:42.563138 IP 112.26.3.1.39713 > 112.26.3.8.41803: Flags [.], seq 11425:12853, ack 1, win 893, options [nop,nop,TS val 3770858 ecr 3536595,mptcp dss ack 177854901 seq 420648777 subseq 11425 len 1428 csum 0x5ea7], length 1428
10:40:42.564991 IP 112.26.3.8.41803 > 112.26.3.1.39713: Flags [.], ack 19993, win 14372, options [nop,nop,TS val 3537574 ecr 3770858,nop,nop,sack 1 {21421:24277},mptcp dss ack 420765873], length 0
10:40:42.694049 IP 112.26.3.1.39713 > 112.26.3.8.41803: Flags [.], seq 19993:21421, ack 1, win 893, options [nop,nop,TS val 3770858 ecr 3536595,mptcp dss ack 177854901 seq 420777297 subseq 19993 len 1428 csum 0x5294], length 1428
10:40:42.696082 IP 112.26.3.8.41803 > 112.26.3.1.39713: Flags [.], ack 24277, win 14555, options [nop,nop,TS val 3537705 ecr 3770858,mptcp dss ack 420765873], length 0
10:40:42.871158 IP 112.26.3.8.41803 > 112.26.3.1.39713: Flags [.], ack 19993, win 14372, options [nop,nop,TS val 3537574 ecr 3770858,nop,nop,sack 1 {21421:24277},mptcp dss ack 420765873], length 0
10:40:42.937509 IP 112.26.3.8.41803 > 112.26.3.1.39713: Flags [.], ack 24277, win 14555, options [nop,nop,TS val 3537705 ecr 3770858,mptcp dss ack 420765873], length 0
10:40:43.155566 IP 112.26.3.1.39713 > 112.26.3.8.41803: Flags [.], seq 24277:25705, ack 1, win 893, options [nop,nop,TS val 3771441 ecr 3536918,mptcp dss ack 177854901 seq 420862977 subseq 24277 len 1428 csum 0x3ede], length 1428
10:40:43.158758 IP 112.26.3.8.41803 > 112.26.3.1.39713: Flags [.], ack 25705, win 15011, options [nop,nop,TS val 3538166 ecr 3771441,mptcp dss ack 420797289], length 0
10:40:43.308580 IP 112.26.3.8.41803 > 112.26.3.1.39713: Flags [.], ack 25705, win 15011, options [nop,nop,TS val 3538166 ecr 3771441,mptcp dss ack 420797289], length 0
10:40:43.530080 IP 112.26.3.1.39713 > 112.26.3.8.41803: Flags [.], seq 27133:28561, ack 1, win 893, options [nop,nop,TS val 3771599 ecr 3537137,mptcp dss ack 177854901 seq 420867261 subseq 27133 len 1428 csum 0x102b], length 1428
10:40:43.533377 IP 112.26.3.8.41803 > 112.26.3.1.39713: Flags [.], ack 25705, win 15467, options [nop,nop,TS val 3538541 ecr 3771441,nop,nop,sack 1 {27133:28561},mptcp dss ack 420820137], length 0
10:40:43.663219 IP 112.26.3.8.41803 > 112.26.3.1.39713: Flags [.], ack 25705, win 15467, options [nop,nop,TS val 3538541 ecr 3771441,nop,nop,sack 1 {27133:28561},mptcp dss ack 420820137], length 0
10:40:43.898686 IP 112.26.3.1.39713 > 112.26.3.8.41803: Flags [.], seq 28561:29989, ack 1, win 893, options [nop,nop,TS val 3772164 ecr 3537574,mptcp dss ack 177854901 seq 420882969 subseq 28561 len 1428 csum 0xeb0b], length 1428
10:40:43.900922 IP 112.26.3.8.41803 > 112.26.3.1.39713: Flags [.], ack 25705, win 15924, options [nop,nop,TS val 3538909 ecr 3771441,nop,nop,sack 1 {27133:29989},mptcp dss ack 420834417], length 0
10:40:44.080832 IP 112.26.3.8.41803 > 112.26.3.1.39713: Flags [.], ack 25705, win 15924, options [nop,nop,TS val 3538909 ecr 3771441,nop,nop,sack 1 {27133:29989},mptcp dss ack 420834417], length 0
10:40:44.251367 IP 112.26.3.1.39713 > 112.26.3.8.41803: Flags [.], seq 29989:31417, ack 1, win 893, options [nop,nop,TS val 3772523 ecr 3538166,mptcp dss ack 177854901 seq 420895821 subseq 29989 len 1428 csum 0xb05b], length 1428
10:40:44.253800 IP 112.26.3.8.41803 > 112.26.3.1.39713: Flags [.], ack 25705, win 16380, options [nop,nop,TS val 3539263 ecr 3771441,nop,nop,sack 1 {27133:31417},mptcp dss ack 420865833], length 0
10:40:44.466210 IP 112.26.3.8.41803 > 112.26.3.1.39713: Flags [.], ack 25705, win 16380, options [nop,nop,TS val 3539263 ecr 3771441,nop,nop,sack 1 {27133:31417},mptcp dss ack 420865833], length 0
10:40:44.601919 IP 112.26.3.1.39713 > 112.26.3.8.41803: Flags [.], seq 25705:27133, ack 1, win 893, options [nop,nop,TS val 3772904 ecr 3538541,mptcp dss ack 177854901 seq 420865833 subseq 25705 len 1428 csum 0xdead], length 1428
10:40:44.620771 IP 112.26.3.8.41803 > 112.26.3.1.39713: Flags [.], ack 31417, win 16790, options [nop,nop,TS val 3539613 ecr 3772904,mptcp dss ack 420897249], length 0
10:40:44.835744 IP 112.26.3.1.39713 > 112.26.3.8.41803: Flags [.], seq 32845:34273, ack 1, win 893, options [nop,nop,TS val 3773250 ecr 3538909,mptcp dss ack 177854901 seq 420927237 subseq 32845 len 1428 csum 0xa5f8], length 1428
10:40:44.838782 IP 112.26.3.8.41803 > 112.26.3.1.39713: Flags [.], ack 31417, win 17110, options [nop,nop,TS val 3539847 ecr 3772904,nop,nop,sack 1 {32845:34273},mptcp dss ack 420897249], length 0
10:40:48.167493 IP 112.26.3.1.39713 > 112.26.3.8.41803: Flags [.], seq 25705:27133, ack 1, win 893, options [nop,nop,TS val 3776768 ecr 3538909,mptcp dss ack 177854901 seq 420865833 subseq 25705 len 1428 csum 0xdead], length 1428
10:40:48.170731 IP 112.26.3.8.41803 > 112.26.3.1.39713: Flags [.], ack 31417, win 20942, options [nop,nop,TS val 3543178 ecr 3772904,nop,nop,sack 2 {25705:27133}{32845:34273},mptcp dss ack 420897249], length 0
10:40:48.393369 IP 112.26.3.8.41803 > 112.26.3.1.39713: Flags [.], ack 31417, win 20942, options [nop,nop,TS val 3543178 ecr 3772904,nop,nop,sack 2 {25705:27133}{32845:34273},mptcp dss ack 420897249], length 0
10:40:48.565138 IP 112.26.3.1.39713 > 112.26.3.8.41803: Flags [.], seq 31417:32845, ack 1, win 893, options [nop,nop,TS val 3777201 ecr 3543178,mptcp dss ack 177854901 seq 420897249 subseq 31417 len 1428 csum 0x8748], length 1428
10:40:48.567228 IP 112.26.3.8.41803 > 112.26.3.1.39713: Flags [.], ack 34273, win 21307, options [nop,nop,TS val 3543577 ecr 3777201,mptcp dss ack 421031481], length 0
10:40:48.753306 IP 112.26.3.8.41803 > 112.26.3.1.39713: Flags [.], ack 34273, win 21307, options [nop,nop,TS val 3543577 ecr 3777201,mptcp dss ack 421031481], length 0
10:40:48.900352 IP 112.26.3.1.39713 > 112.26.3.8.41803: Flags [.], seq 34273:35701, ack 1, win 893, options [nop,nop,TS val 3777561 ecr 3543577,mptcp dss ack 177854901 seq 421084317 subseq 34273 len 1428 csum 0x20c], length 1428
10:40:48.903039 IP 112.26.3.8.41803 > 112.26.3.1.39713: Flags [.], ack 35701, win 21855, options [nop,nop,TS val 3543912 ecr 3777561,mptcp dss ack 421031481], length 0
10:40:49.089230 IP 112.26.3.8.41803 > 112.26.3.1.39713: Flags [.], ack 35701, win 21855, options [nop,nop,TS val 3543912 ecr 3777561,mptcp dss ack 421031481], length 0
10:40:49.235127 IP 112.26.3.1.39713 > 112.26.3.8.41803: Flags [.], seq 35701:37129, ack 1, win 893, options [nop,nop,TS val 3777561 ecr 3543577,mptcp dss ack 177854901 seq 421085745 subseq 35701 len 1428 csum 0x4a47], length 1428
10:40:49.239001 IP 112.26.3.8.41803 > 112.26.3.1.39713: Flags [.], ack 37129, win 22265, options [nop,nop,TS val 3544246 ecr 3777561,mptcp dss ack 421031481], length 0
10:40:49.432429 IP 112.26.3.8.41803 > 112.26.3.1.39713: Flags [.], ack 37129, win 22265, options [nop,nop,TS val 3544246 ecr 3777561,mptcp dss ack 421031481], length 0
10:40:49.512784 IP 112.26.3.1.39713 > 112.26.3.8.41803: Flags [.], seq 37129:38557, ack 1, win 893, options [nop,nop,TS val 3777561 ecr 3543577,mptcp dss ack 177854901 seq 421087173 subseq 37129 len 1428 csum 0x32c0], length 1428
10:40:49.525585 IP 112.26.3.8.41803 > 112.26.3.1.39713: Flags [.], ack 38557, win 22539, options [nop,nop,TS val 3544524 ecr 3777561,mptcp dss ack 421040049], length 0
10:40:49.714809 IP 112.26.3.8.41803 > 112.26.3.1.39713: Flags [.], ack 38557, win 22539, options [nop,nop,TS val 3544524 ecr 3777561,mptcp dss ack 421040049], length 0
10:40:49.802083 IP 112.26.3.1.39713 > 112.26.3.8.41803: Flags [.], seq 38557:39985, ack 1, win 893, options [nop,nop,TS val 3777561 ecr 3543577,mptcp dss ack 177854901 seq 421088601 subseq 38557 len 1428 csum 0xf2d0], length 1428
10:40:49.803679 IP 112.26.3.8.41803 > 112.26.3.1.39713: Flags [.], ack 39985, win 22904, options [nop,nop,TS val 3544814 ecr 3777561,mptcp dss ack 421077177], length 0
10:40:49.929151 IP 112.26.3.8.41803 > 112.26.3.1.39713: Flags [.], ack 39985, win 22904, options [nop,nop,TS val 3544814 ecr 3777561,mptcp dss ack 421077177], length 0
10:40:50.255944 IP 112.26.3.1.39713 > 112.26.3.8.41803: Flags [.], seq 41413:42841, ack 1, win 893, options [nop,nop,TS val 3778649 ecr 3544246,mptcp dss ack 177854901 seq 421121445 subseq 41413 len 1428 csum 0x7485], length 1428
10:40:50.257891 IP 112.26.3.8.41803 > 112.26.3.1.39713: Flags [.], ack 39985, win 23406, options [nop,nop,TS val 3545267 ecr 3777561,nop,nop,sack 1 {41413:42841},mptcp dss ack 421077177], length 0
10:40:50.396196 IP 112.26.3.8.41803 > 112.26.3.1.39713: Flags [.], ack 39985, win 23406, options [nop,nop,TS val 3545267 ecr 3777561,nop,nop,sack 1 {41413:42841},mptcp dss ack 421077177], length 0
10:40:50.593587 IP 112.26.3.1.39713 > 112.26.3.8.41803: Flags [.], seq 44269:45697, ack 1, win 893, options [nop,nop,TS val 3778915 ecr 3544524,mptcp dss ack 177854901 seq 421131441 subseq 44269 len 1428 csum 0xca8c], length 1428
10:40:50.596152 IP 112.26.3.8.41803 > 112.26.3.1.39713: Flags [.], ack 39985, win 23771, options [nop,nop,TS val 3545605 ecr 3777561,nop,nop,sack 2 {44269:45697}{41413:42841},mptcp dss ack 421078605], length 0
10:40:50.803787 IP 112.26.3.8.41803 > 112.26.3.1.39713: Flags [.], ack 39985, win 23771, options [nop,nop,TS val 3545605 ecr 3777561,nop,nop,sack 2 {44269:45697}{41413:42841},mptcp dss ack 421078605], length 0
10:40:50.948073 IP 112.26.3.1.39713 > 112.26.3.8.41803: Flags [.], seq 45697:47125, ack 1, win 893, options [nop,nop,TS val 3778915 ecr 3544524,mptcp dss ack 177854901 seq 421132869 subseq 45697 len 1428 csum 0x2c78], length 1428
10:40:50.950945 IP 112.26.3.8.41803 > 112.26.3.1.39713: Flags [.], ack 39985, win 24138, options [nop,nop,TS val 3545959 ecr 3777561,nop,nop,sack 2 {44269:47125}{41413:42841},mptcp dss ack 421078605], length 0
10:40:51.138464 IP 112.26.3.8.41803 > 112.26.3.1.39713: Flags [.], ack 39985, win 24138, options [nop,nop,TS val 3545959 ecr 3777561,nop,nop,sack 2 {44269:47125}{41413:42841},mptcp dss ack 421078605], length 0
10:40:51.264135 IP 112.26.3.1.39713 > 112.26.3.8.41803: Flags [.], seq 48553:49981, ack 1, win 893, options [nop,nop,TS val 3779581 ecr 3545267,mptcp dss ack 177854901 seq 421160001 subseq 48553 len 1428 csum 0x1371], length 1428
10:40:51.265762 IP 112.26.3.8.41803 > 112.26.3.1.39713: Flags [.], ack 39985, win 24138, options [nop,nop,TS val 3546275 ecr 3777561,nop,nop,sack 2 {48553:49981}{44269:47125},mptcp dss ack 421078605], length 0
10:40:51.490268 IP 112.26.3.8.41803 > 112.26.3.1.39713: Flags [.], ack 39985, win 24138, options [nop,nop,TS val 3546275 ecr 3777561,nop,nop,sack 2 {48553:49981}{44269:47125},mptcp dss ack 421078605], length 0
10:40:51.591201 IP 112.26.3.1.39713 > 112.26.3.8.41803: Flags [.], seq 39985:41413, ack 1, win 893, options [nop,nop,TS val 3779900 ecr 3545605,mptcp dss ack 177854901 seq 421090029 subseq 39985 len 1428 csum 0xd648], length 1428
10:40:51.593973 IP 112.26.3.8.41803 > 112.26.3.1.39713: Flags [.], ack 42841, win 24138, options [nop,nop,TS val 3546602 ecr 3779900,nop,nop,sack 2 {48553:49981}{44269:47125},mptcp dss ack 421078605], length 0
10:40:51.739153 IP 112.26.3.8.41803 > 112.26.3.1.39713: Flags [.], ack 42841, win 24138, options [nop,nop,TS val 3546602 ecr 3779900,nop,nop,sack 2 {48553:49981}{44269:47125},mptcp dss ack 421078605], length 0
10:40:51.909272 IP 112.26.3.1.39713 > 112.26.3.8.41803: Flags [.], seq 42841:44269, ack 1, win 893, options [nop,nop,TS val 3780334 ecr 3545959,mptcp dss ack 177854901 seq 421122873 subseq 42841 len 1428 csum 0x3dbb], length 1428
10:40:51.911716 IP 112.26.3.8.41803 > 112.26.3.1.39713: Flags [.], ack 47125, win 23973, options [nop,nop,TS val 3546921 ecr 3780334,nop,nop,sack 1 {48553:49981},mptcp dss ack 421144293], length 0
10:40:52.109617 IP 112.26.3.8.41803 > 112.26.3.1.39713: Flags [.], ack 47125, win 23973, options [nop,nop,TS val 3546921 ecr 3780334,nop,nop,sack 1 {48553:49981},mptcp dss ack 421144293], length 0
10:40:52.303331 IP 112.26.3.1.39713 > 112.26.3.8.41803: Flags [.], seq 47125:48553, ack 1, win 893, options [nop,nop,TS val 3780546 ecr 3546275,mptcp dss ack 177854901 seq 421144293 subseq 47125 len 1428 csum 0x9448], length 1428
10:40:52.306613 IP 112.26.3.8.41803 > 112.26.3.1.39713: Flags [.], ack 49981, win 24044, options [nop,nop,TS val 3547315 ecr 3780546,mptcp dss ack 421192845], length 0
10:40:52.541642 IP 112.26.3.8.41803 > 112.26.3.1.39713: Flags [.], ack 49981, win 24044, options [nop,nop,TS val 3547315 ecr 3780546,mptcp dss ack 421192845], length 0
10:40:52.693363 IP 112.26.3.1.39713 > 112.26.3.8.41803: Flags [.], seq 49981:51409, ack 1, win 893, options [nop,nop,TS val 3780896 ecr 3546602,mptcp dss ack 177854901 seq 421201413 subseq 49981 len 1428 csum 0xa700], length 1428
10:40:52.696845 IP 112.26.3.8.41803 > 112.26.3.1.39713: Flags [.], ack 51409, win 24522, options [nop,nop,TS val 3547705 ecr 3780896,mptcp dss ack 421202841], length 0
10:40:52.862421 IP 112.26.3.1.39713 > 112.26.3.8.41803: Flags [.], seq 51409:52837, ack 1, win 893, options [nop,nop,TS val 3780896 ecr 3546602,mptcp dss ack 177854901 seq 421202841 subseq 51409 len 1428 csum 0x4882], length 1428
10:40:52.865314 IP 112.26.3.8.41803 > 112.26.3.1.39713: Flags [.], ack 52837, win 24445, options [nop,nop,TS val 3547874 ecr 3780896,mptcp dss ack 421211409], length 0
10:40:53.000885 IP 112.26.3.8.41803 > 112.26.3.1.39713: Flags [.], ack 51409, win 24522, options [nop,nop,TS val 3547705 ecr 3780896,mptcp dss ack 421202841], length 0
10:40:53.050306 IP 112.26.3.8.41803 > 112.26.3.1.39713: Flags [.], ack 52837, win 24445, options [nop,nop,TS val 3547874 ecr 3780896,mptcp dss ack 421211409], length 0
10:40:53.140378 IP 112.26.3.1.39713 > 112.26.3.8.41803: Flags [.], seq 52837:54265, ack 1, win 893, options [nop,nop,TS val 3781641 ecr 3547315,mptcp dss ack 177854901 seq 421232829 subseq 52837 len 1428 csum 0x7a81], length 1428
10:40:53.144379 IP 112.26.3.8.41803 > 112.26.3.1.39713: Flags [.], ack 54265, win 24522, options [nop,nop,TS val 3548151 ecr 3781641,mptcp dss ack 421217121], length 0
10:40:53.250657 IP 112.26.3.8.41803 > 112.26.3.1.39713: Flags [.], ack 54265, win 24522, options [nop,nop,TS val 3548151 ecr 3781641,mptcp dss ack 421217121], length 0
10:40:53.485700 IP 112.26.3.1.39713 > 112.26.3.8.41803: Flags [.], seq 54265:55693, ack 1, win 893, options [nop,nop,TS val 3781641 ecr 3547315,mptcp dss ack 177854901 seq 421234257 subseq 54265 len 1428 csum 0xa2e5], length 1428
10:40:53.487482 IP 112.26.3.8.41803 > 112.26.3.1.39713: Flags [.], ack 55693, win 24522, options [nop,nop,TS val 3548497 ecr 3781641,mptcp dss ack 421217121], length 0
10:40:53.659351 IP 112.26.3.8.41803 > 112.26.3.1.39713: Flags [.], ack 55693, win 24522, options [nop,nop,TS val 3548497 ecr 3781641,mptcp dss ack 421217121], length 0
10:40:53.815265 IP 112.26.3.1.39713 > 112.26.3.8.41803: Flags [.], seq 55693:57121, ack 1, win 893, options [nop,nop,TS val 3781641 ecr 3547315,mptcp dss ack 177854901 seq 421235685 subseq 55693 len 1428 csum 0x1d99], length 1428
10:40:53.817084 IP 112.26.3.8.41803 > 112.26.3.1.39713: Flags [.], ack 57121, win 24522, options [nop,nop,TS val 3548826 ecr 3781641,mptcp dss ack 421217121], length 0
10:40:53.944455 IP 112.26.3.8.41803 > 112.26.3.1.39713: Flags [.], ack 57121, win 24522, options [nop,nop,TS val 3548826 ecr 3781641,mptcp dss ack 421217121], length 0
10:40:54.146944 IP 112.26.3.1.39713 > 112.26.3.8.41803: Flags [.], seq 58549:59977, ack 1, win 893, options [nop,nop,TS val 3782722 ecr 3548497,mptcp dss ack 177854901 seq 421275669 subseq 58549 len 1428 csum 0x5adf], length 1428
10:40:54.150532 IP 112.26.3.8.41803 > 112.26.3.1.39713: Flags [.], ack 57121, win 24522, options [nop,nop,TS val 3549158 ecr 3781641,nop,nop,sack 1 {58549:59977},mptcp dss ack 421217121], length 0
10:40:54.292749 IP 112.26.3.8.41803 > 112.26.3.1.39713: Flags [.], ack 57121, win 24522, options [nop,nop,TS val 3549158 ecr 3781641,nop,nop,sack 1 {58549:59977},mptcp dss ack 421217121], length 0
10:40:54.525417 IP 112.26.3.1.39713 > 112.26.3.8.41803: Flags [.], seq 59977:61405, ack 1, win 893, options [nop,nop,TS val 3782722 ecr 3548497,mptcp dss ack 177854901 seq 421277097 subseq 59977 len 1428 csum 0x5edc], length 1428
10:40:54.529356 IP 112.26.3.8.41803 > 112.26.3.1.39713: Flags [.], ack 57121, win 24393, options [nop,nop,TS val 3549537 ecr 3781641,nop,nop,sack 1 {58549:61405},mptcp dss ack 421245681], length 0
10:40:54.700509 IP 112.26.3.8.41803 > 112.26.3.1.39713: Flags [.], ack 57121, win 24393, options [nop,nop,TS val 3549537 ecr 3781641,nop,nop,sack 1 {58549:61405},mptcp dss ack 421245681], length 0
10:40:54.844145 IP 112.26.3.1.39713 > 112.26.3.8.41803: Flags [.], seq 61405:62833, ack 1, win 893, options [nop,nop,TS val 3782722 ecr 3548497,mptcp dss ack 177854901 seq 421278525 subseq 61405 len 1428 csum 0x7c88], length 1428
10:40:54.846177 IP 112.26.3.8.41803 > 112.26.3.1.39713: Flags [.], ack 57121, win 24393, options [nop,nop,TS val 3549855 ecr 3781641,nop,nop,sack 1 {58549:62833},mptcp dss ack 421245681], length 0
10:40:55.079303 IP 112.26.3.8.41803 > 112.26.3.1.39713: Flags [.], ack 57121, win 24393, options [nop,nop,TS val 3549855 ecr 3781641,nop,nop,sack 1 {58549:62833},mptcp dss ack 421245681], length 0
10:40:55.135027 IP 112.26.3.1.39713 > 112.26.3.8.41803: Flags [.], seq 62833:64261, ack 1, win 893, options [nop,nop,TS val 3783201 ecr 3548826,mptcp dss ack 177854901 seq 421295661 subseq 62833 len 1428 csum 0xa11a], length 1428
10:40:55.136492 IP 112.26.3.8.41803 > 112.26.3.1.39713: Flags [.], ack 57121, win 24393, options [nop,nop,TS val 3550146 ecr 3781641,nop,nop,sack 1 {58549:64261},mptcp dss ack 421245681], length 0
10:40:55.246669 IP 112.26.3.8.41803 > 112.26.3.1.39713: Flags [.], ack 57121, win 24393, options [nop,nop,TS val 3550146 ecr 3781641,nop,nop,sack 1 {58549:64261},mptcp dss ack 421245681], length 0
10:40:55.337778 IP 112.26.3.1.39713 > 112.26.3.8.41803: Flags [.], seq 64261:65689, ack 1, win 893, options [nop,nop,TS val 3783923 ecr 3549537,mptcp dss ack 177854901 seq 421321365 subseq 64261 len 1428 csum 0xc4d6], length 1428
10:40:55.341244 IP 112.26.3.8.41803 > 112.26.3.1.39713: Flags [.], ack 57121, win 24393, options [nop,nop,TS val 3550349 ecr 3781641,nop,nop,sack 1 {58549:65689},mptcp dss ack 421245681], length 0
10:40:55.509151 IP 112.26.3.8.41803 > 112.26.3.1.39713: Flags [.], ack 57121, win 24393, options [nop,nop,TS val 3550349 ecr 3781641,nop,nop,sack 1 {58549:65689},mptcp dss ack 421245681], length 0
10:40:55.676081 IP 112.26.3.1.39713 > 112.26.3.8.41803: Flags [.], seq 65689:67117, ack 1, win 893, options [nop,nop,TS val 3783923 ecr 3549537,mptcp dss ack 177854901 seq 421322793 subseq 65689 len 1428 csum 0x33e2], length 1428
10:40:55.678464 IP 112.26.3.8.41803 > 112.26.3.1.39713: Flags [.], ack 57121, win 24237, options [nop,nop,TS val 3550687 ecr 3781641,nop,nop,sack 1 {58549:67117},mptcp dss ack 421255677], length 0
10:40:55.843802 IP 112.26.3.8.41803 > 112.26.3.1.39713: Flags [.], ack 57121, win 24237, options [nop,nop,TS val 3550687 ecr 3781641,nop,nop,sack 1 {58549:67117},mptcp dss ack 421255677], length 0
10:40:55.999060 IP 112.26.3.1.39713 > 112.26.3.8.41803: Flags [.], seq 57121:58549, ack 1, win 893, options [nop,nop,TS val 3783923 ecr 3549855,mptcp dss ack 177854901 seq 421255677 subseq 57121 len 1428 csum 0x2caf], length 1428
10:40:56.007085 IP 112.26.3.8.41803 > 112.26.3.1.39713: Flags [.], ack 67117, win 23631, options [nop,nop,TS val 3551010 ecr 3783923,mptcp dss ack 421337073], length 0
10:40:56.148036 IP 112.26.3.8.41803 > 112.26.3.1.39713: Flags [.], ack 67117, win 23631, options [nop,nop,TS val 3551010 ecr 3783923,mptcp dss ack 421337073], length 0
10:40:56.243571 IP 112.26.3.1.39713 > 112.26.3.8.41803: Flags [.], seq 67117:68545, ack 1, win 893, options [nop,nop,TS val 3784864 ecr 3550687,mptcp dss ack 177854901 seq 421361349 subseq 67117 len 1428 csum 0xb3a7], length 1428
10:40:56.256317 IP 112.26.3.8.41803 > 112.26.3.1.39713: Flags [.], ack 68545, win 24558, options [nop,nop,TS val 3551255 ecr 3784864,mptcp dss ack 421348497], length 0
10:40:56.380638 IP 112.26.3.8.41803 > 112.26.3.1.39713: Flags [.], ack 68545, win 24558, options [nop,nop,TS val 3551255 ecr 3784864,mptcp dss ack 421348497], length 0
10:40:56.651870 IP 112.26.3.1.39713 > 112.26.3.8.41803: Flags [.], seq 68545:69973, ack 1, win 893, options [nop,nop,TS val 3784864 ecr 3550687,mptcp dss ack 177854901 seq 421362777 subseq 68545 len 1428 csum 0xd4cd], length 1428
10:40:56.655466 IP 112.26.3.8.41803 > 112.26.3.1.39713: Flags [.], ack 69973, win 24512, options [nop,nop,TS val 3551663 ecr 3784864,mptcp dss ack 421368489], length 0
10:40:56.837012 IP 112.26.3.8.41803 > 112.26.3.1.39713: Flags [.], ack 69973, win 24512, options [nop,nop,TS val 3551663 ecr 3784864,mptcp dss ack 421368489], length 0
10:40:56.964416 IP 112.26.3.1.39713 > 112.26.3.8.41803: Flags [.], seq 69973:71401, ack 1, win 893, options [nop,nop,TS val 3785273 ecr 3551010,mptcp dss ack 177854901 seq 421382769 subseq 69973 len 1428 csum 0x86fd], length 1428
10:40:56.969131 IP 112.26.3.8.41803 > 112.26.3.1.39713: Flags [.], ack 71401, win 24540, options [nop,nop,TS val 3551975 ecr 3785273,mptcp dss ack 421377057], length 0
10:40:57.214447 IP 112.26.3.8.41803 > 112.26.3.1.39713: Flags [.], ack 71401, win 24540, options [nop,nop,TS val 3551975 ecr 3785273,mptcp dss ack 421377057], length 0
10:40:57.299020 IP 112.26.3.1.39713 > 112.26.3.8.41803: Flags [.], seq 71401:72829, ack 1, win 893, options [nop,nop,TS val 3785591 ecr 3551255,mptcp dss ack 177854901 seq 421404189 subseq 71401 len 1428 csum 0x2786], length 1428
10:40:57.300655 IP 112.26.3.8.41803 > 112.26.3.1.39713: Flags [.], ack 72829, win 24558, options [nop,nop,TS val 3552310 ecr 3785591,mptcp dss ack 421397049], length 0
10:40:57.423628 IP 112.26.3.8.41803 > 112.26.3.1.39713: Flags [.], ack 72829, win 24558, options [nop,nop,TS val 3552310 ecr 3785591,mptcp dss ack 421397049], length 0
10:40:57.703616 IP 112.26.3.1.39713 > 112.26.3.8.41803: Flags [.], seq 72829:74257, ack 1, win 893, options [nop,nop,TS val 3786106 ecr 3551663,mptcp dss ack 177854901 seq 421427037 subseq 72829 len 1428 csum 0xd8c7], length 1428
10:40:57.705716 IP 112.26.3.8.41803 > 112.26.3.1.39713: Flags [.], ack 74257, win 24509, options [nop,nop,TS val 3552715 ecr 3786106,mptcp dss ack 421407045], length 0
10:40:57.895468 IP 112.26.3.8.41803 > 112.26.3.1.39713: Flags [.], ack 74257, win 24509, options [nop,nop,TS val 3552715 ecr 3786106,mptcp dss ack 421407045], length 0
10:40:58.014265 IP 112.26.3.1.39713 > 112.26.3.8.41803: Flags [.], seq 75685:77113, ack 1, win 893, options [nop,nop,TS val 3786313 ecr 3551975,mptcp dss ack 177854901 seq 421444173 subseq 75685 len 1428 csum 0x9ca6], length 1428
10:40:58.027425 IP 112.26.3.8.41803 > 112.26.3.1.39713: Flags [.], ack 74257, win 24471, options [nop,nop,TS val 3553025 ecr 3786106,nop,nop,sack 1 {75685:77113},mptcp dss ack 421415613], length 0
10:40:58.231296 IP 112.26.3.1.39713 > 112.26.3.8.41803: Flags [.], seq 77113:78541, ack 1, win 893, options [nop,nop,TS val 3786664 ecr 3552310,mptcp dss ack 177854901 seq 421464165 subseq 77113 len 1428 csum 0xcae], length 1428
10:40:58.233503 IP 112.26.3.8.41803 > 112.26.3.1.39713: Flags [.], ack 74257, win 24427, options [nop,nop,TS val 3553242 ecr 3786106,nop,nop,sack 1 {75685:78541},mptcp dss ack 421418469], length 0
10:40:58.385808 IP 112.26.3.8.41803 > 112.26.3.1.39713: Flags [.], ack 74257, win 24427, options [nop,nop,TS val 3553242 ecr 3786106,nop,nop,sack 1 {75685:78541},mptcp dss ack 421418469], length 0
10:40:58.580609 IP 112.26.3.1.39713 > 112.26.3.8.41803: Flags [.], seq 78541:79969, ack 1, win 893, options [nop,nop,TS val 3787253 ecr 3553242,mptcp dss ack 177854901 seq 421491297 subseq 78541 len 1428 csum 0x4fe4], length 1428
10:40:58.583371 IP 112.26.3.8.41803 > 112.26.3.1.39713: Flags [.], ack 74257, win 24427, options [nop,nop,TS val 3553591 ecr 3786106,nop,nop,sack 1 {75685:79969},mptcp dss ack 421418469], length 0
10:40:58.785180 IP 112.26.3.8.41803 > 112.26.3.1.39713: Flags [.], ack 74257, win 24427, options [nop,nop,TS val 3553591 ecr 3786106,nop,nop,sack 1 {75685:79969},mptcp dss ack 421418469], length 0
10:40:58.938508 IP 112.26.3.1.39713 > 112.26.3.8.41803: Flags [.], seq 79969:81397, ack 1, win 893, options [nop,nop,TS val 3787253 ecr 3553242,mptcp dss ack 177854901 seq 421492725 subseq 79969 len 1428 csum 0x57c5], length 1428
10:40:58.941603 IP 112.26.3.8.41803 > 112.26.3.1.39713: Flags [.], ack 74257, win 24427, options [nop,nop,TS val 3553950 ecr 3786106,nop,nop,sack 1 {75685:81397},mptcp dss ack 421418469], length 0
10:40:59.127364 IP 112.26.3.8.41803 > 112.26.3.1.39713: Flags [.], ack 74257, win 24427, options [nop,nop,TS val 3553950 ecr 3786106,nop,nop,sack 1 {75685:81397},mptcp dss ack 421418469], length 0
10:40:59.270236 IP 112.26.3.1.39713 > 112.26.3.8.41803: Flags [.], seq 81397:82825, ack 1, win 893, options [nop,nop,TS val 3787253 ecr 3553242,mptcp dss ack 177854901 seq 421494153 subseq 81397 len 1428 csum 0xbec7], length 1428
10:40:59.273135 IP 112.26.3.8.41803 > 112.26.3.1.39713: Flags [.], ack 74257, win 24405, options [nop,nop,TS val 3554282 ecr 3786106,nop,nop,sack 1 {75685:82825},mptcp dss ack 421419897], length 0
10:40:59.509591 IP 112.26.3.8.41803 > 112.26.3.1.39713: Flags [.], ack 74257, win 24405, options [nop,nop,TS val 3554282 ecr 3786106,nop,nop,sack 1 {75685:82825},mptcp dss ack 421419897], length 0
10:40:59.601376 IP 112.26.3.1.39713 > 112.26.3.8.41803: Flags [.], seq 74257:75685, ack 1, win 893, options [nop,nop,TS val 3787910 ecr 3553591,mptcp dss ack 177854901 seq 421428465 subseq 74257 len 1428 csum 0xd687], length 1428
10:40:59.603113 IP 112.26.3.8.41803 > 112.26.3.1.39713: Flags [.], ack 82825, win 24405, options [nop,nop,TS val 3554613 ecr 3787910,mptcp dss ack 421419897], length 0
10:40:59.718348 IP 112.26.3.8.41803 > 112.26.3.1.39713: Flags [.], ack 82825, win 24405, options [nop,nop,TS val 3554613 ecr 3787910,mptcp dss ack 421419897], length 0
10:40:59.841052 IP 112.26.3.1.39713 > 112.26.3.8.41803: Flags [.], seq 82825:84253, ack 1, win 893, options [nop,nop,TS val 3788378 ecr 3554282,mptcp dss ack 177854901 seq 421521285 subseq 82825 len 1428 csum 0x1aef], length 1428
10:40:59.844426 IP 112.26.3.8.41803 > 112.26.3.1.39713: Flags [.], ack 84253, win 24405, options [nop,nop,TS val 3554852 ecr 3788378,mptcp dss ack 421419897], length 0
10:40:59.997915 IP 112.26.3.8.41803 > 112.26.3.1.39713: Flags [.], ack 84253, win 24405, options [nop,nop,TS val 3554852 ecr 3788378,mptcp dss ack 421419897], length 0
10:41:00.093011 IP 112.26.3.1.39713 > 112.26.3.8.41803: Flags [.], seq 84253:85681, ack 1, win 893, options [nop,nop,TS val 3788716 ecr 3554613,mptcp dss ack 177854901 seq 421531281 subseq 84253 len 1428 csum 0x2fdb], length 1428
10:41:00.096261 IP 112.26.3.8.41803 > 112.26.3.1.39713: Flags [.], ack 85681, win 24405, options [nop,nop,TS val 3555104 ecr 3788716,mptcp dss ack 421419897], length 0
10:41:00.234791 IP 112.26.3.8.41803 > 112.26.3.1.39713: Flags [.], ack 85681, win 24405, options [nop,nop,TS val 3555104 ecr 3788716,mptcp dss ack 421419897], length 0
10:41:00.613731 IP 112.26.3.1.39713 > 112.26.3.8.41803: Flags [.], seq 85681:87109, ack 1, win 893, options [nop,nop,TS val 3789082 ecr 3554852,mptcp dss ack 177854901 seq 421544133 subseq 85681 len 1428 csum 0x12c5], length 1428
10:41:00.617004 IP 112.26.3.8.41803 > 112.26.3.1.39713: Flags [.], ack 87109, win 24405, options [nop,nop,TS val 3555625 ecr 3789082,mptcp dss ack 421419897], length 0
10:41:00.869513 IP 112.26.3.8.41803 > 112.26.3.1.39713: Flags [.], ack 87109, win 24405, options [nop,nop,TS val 3555625 ecr 3789082,mptcp dss ack 421419897], length 0
10:41:01.039656 IP 112.26.3.1.39713 > 112.26.3.8.41803: Flags [.], seq 87109:88537, ack 1, win 893, options [nop,nop,TS val 3789082 ecr 3554852,mptcp dss ack 177854901 seq 421545561 subseq 87109 len 1428 csum 0x9f50], length 1428
10:41:01.042670 IP 112.26.3.8.41803 > 112.26.3.1.39713: Flags [.], ack 88537, win 24405, options [nop,nop,TS val 3556051 ecr 3789082,mptcp dss ack 421419897], length 0
10:41:01.193472 IP 112.26.3.1.39713 > 112.26.3.8.41803: Flags [.], seq 88537:89965, ack 1, win 893, options [nop,nop,TS val 3789295 ecr 3555104,mptcp dss ack 177854901 seq 421552701 subseq 88537 len 1428 csum 0xa811], length 1428
10:41:01.205303 IP 112.26.3.8.41803 > 112.26.3.1.39713: Flags [.], ack 89965, win 24405, options [nop,nop,TS val 3556205 ecr 3789295,mptcp dss ack 421419897], length 0
10:41:01.407390 IP 112.26.3.8.41803 > 112.26.3.1.39713: Flags [.], ack 88537, win 24405, options [nop,nop,TS val 3556051 ecr 3789082,mptcp dss ack 421419897], length 0
10:41:01.437595 IP 112.26.3.8.41803 > 112.26.3.1.39713: Flags [.], ack 89965, win 24405, options [nop,nop,TS val 3556205 ecr 3789295,mptcp dss ack 421419897], length 0
10:41:01.507540 IP 112.26.3.1.39713 > 112.26.3.8.41803: Flags [.], seq 89965:91393, ack 1, win 893, options [nop,nop,TS val 3789925 ecr 3555625,mptcp dss ack 177854901 seq 421576977 subseq 89965 len 1428 csum 0xbe07], length 1428
10:41:01.509312 IP 112.26.3.8.41803 > 112.26.3.1.39713: Flags [.], ack 91393, win 24405, options [nop,nop,TS val 3556519 ecr 3789925,mptcp dss ack 421419897], length 0
10:41:01.640040 IP 112.26.3.8.41803 > 112.26.3.1.39713: Flags [.], ack 91393, win 24405, options [nop,nop,TS val 3556519 ecr 3789925,mptcp dss ack 421419897], length 0
