10:40:35.990371 IP 112.26.1.8.37253 > 112.26.1.1.39713: Flags [S], seq 3854583478, win 65535, options [mss 1460,sackOK,TS val 3530993 ecr 0,nop,wscale 6,mptcp join id 3 token 0x2fb3bb97 nonce 0xd0e43474], length 0
10:40:35.993339 IP 112.26.1.8.37253 > 112.26.1.1.39713: Flags [S], seq 3854583478, win 65535, options [mss 1460,sackOK,TS val 3530993 ecr 0,nop,wscale 6,mptcp join id 3 token 0x2fb3bb97 nonce 0xd0e43474], length 0
10:40:36.000279 IP 112.26.1.1.39713 > 112.26.1.8.37253: Flags [S.], seq 4191845760, ack 3854583479, win 28560, options [mss 1460,sackOK,TS val 3764799 ecr 3530993,nop,wscale 7,mptcp join id 3 hmac 0xe7aa1673b3db3f00 nonce 0x19c9929d], length 0
10:40:36.070273 IP 112.26.1.1.39713 > 112.26.1.8.37253: Flags [S.], seq 4191845760, ack 3854583479, win 28560, options [mss 1460,sackOK,TS val 3764799 ecr 3530993,nop,wscale 7,mptcp join id 3 hmac 0xe7aa1673b3db3f00 nonce 0x19c9929d], length 0
10:40:36.090545 IP 112.26.1.1.39713 > 112.26.1.8.37253: Flags [S.], seq 4191845760, ack 3854583479, win 28560, options [mss 1460,sackOK,TS val 3764799 ecr 3530993,nop,wscale 7,mptcp join id 3 hmac 0xe7aa1673b3db3f00 nonce 0x19c9929d], length 0
10:40:36.167001 IP 112.26.1.8.37253 > 112.26.1.1.39713: Flags [.], ack 1, win 5612, options [nop,nop,TS val 3531102 ecr 3764799,mptcp join hmac 0x2227837949b985e5465d1467ec3696c97113dc65], length 0
10:40:36.168462 IP 112.26.1.8.37253 > 112.26.1.1.39713: Flags [.], ack 1, win 5612, options [nop,nop,TS val 3531102 ecr 3764799,mptcp join hmac 0x2227837949b985e5465d1467ec3696c97113dc65], length 0
10:40:36.173112 IP 112.26.1.1.39713 > 112.26.1.8.37253: Flags [.], ack 1, win 447, options [nop,nop,TS val 3764974 ecr 3531102,mptcp dss ack 177854901], length 0
10:40:36.186349 IP 112.26.1.1.39713 > 112.26.1.8.37253: Flags [.], ack 1, win 447, options [nop,nop,TS val 3764974 ecr 3531102,mptcp dss ack 177854901], length 0
10:40:36.206541 IP 112.26.1.1.39713 > 112.26.1.8.37253: Flags [.], ack 1, win 447, options [nop,nop,TS val 3764974 ecr 3531102,mptcp dss ack 177854901], length 0
10:40:36.248776 IP 112.26.1.1.39713 > 112.26.1.8.37253: Flags [.], seq 1:1429, ack 1, win 447, options [nop,nop,TS val 3764974 ecr 3531102,mptcp dss ack 177854901 seq 420608793 subseq 1 len 1428 csum 0xe8a6], length 1428
10:40:36.255793 IP 112.26.1.1.39713 > 112.26.1.8.37253: Flags [.], seq 1:1429, ack 1, win 447, options [nop,nop,TS val 3764974 ecr 3531102,mptcp dss ack 177854901 seq 420608793 subseq 1 len 1428 csum 0xe8a6], length 1428
10:40:36.279896 IP 112.26.1.1.39713 > 112.26.1.8.37253: Flags [.], seq 1:1429, ack 1, win 447, options [nop,nop,TS val 3764974 ecr 3531102,mptcp dss ack 177854901 seq 420608793 subseq 1 len 1428 csum 0xe8a6], length 1428
10:40:36.345871 IP 112.26.1.1.39713 > 112.26.1.8.37253: Flags [.], seq 1429:2857, ack 1, win 447, options [nop,nop,TS val 3764974 ecr 3531102,mptcp dss ack 177854901 seq 420610221 subseq 1429 len 1428 csum 0xa1a2], length 1428
10:40:36.360703 IP 112.26.1.8.37253 > 112.26.1.1.39713: Flags [.], ack 1429, win 7072, options [nop,nop,TS val 3531285 ecr 3764974,mptcp dss ack 420603081], length 0
10:40:36.362432 IP 112.26.1.8.37253 > 112.26.1.1.39713: Flags [.], ack 1429, win 7072, options [nop,nop,TS val 3531285 ecr 3764974,mptcp dss ack 420603081], length 0
10:40:36.389578 IP 112.26.1.1.39713 > 112.26.1.8.37253: Flags [.], seq 1429:2857, ack 1, win 447, options [nop,nop,TS val 3764974 ecr 3531102,mptcp dss ack 177854901 seq 420610221 subseq 1429 len 1428 csum 0xa1a2], length 1428
10:40:36.398202 IP 112.26.1.1.39713 > 112.26.1.8.37253: Flags [.], seq 2857:4285, ack 1, win 447, options [nop,nop,TS val 3764976 ecr 3531102,mptcp dss ack 177854901 seq 420611649 subseq 2857 len 1428 csum 0xebba], length 1428
10:40:36.426692 IP 112.26.1.1.39713 > 112.26.1.8.37253: Flags [.], seq 1429:2857, ack 1, win 447, options [nop,nop,TS val 3764974 ecr 3531102,mptcp dss ack 177854901 seq 420610221 subseq 1429 len 1428 csum 0xa1a2], length 1428
10:40:36.471745 IP 112.26.1.1.39713 > 112.26.1.8.37253: Flags [.], seq 2857:4285, ack 1, win 447, options [nop,nop,TS val 3764976 ecr 3531102,mptcp dss ack 177854901 seq 420611649 subseq 2857 len 1428 csum 0xebba], length 1428
10:40:36.498904 IP 112.26.1.1.39713 > 112.26.1.8.37253: Flags [.], seq 4285:5713, ack 1, win 447, options [nop,nop,TS val 3764976 ecr 3531102,mptcp dss ack 177854901 seq 420613077 subseq 4285 len 1428 csum 0xf0a4], length 1428
10:40:36.540359 IP 112.26.1.1.39713 > 112.26.1.8.37253: Flags [.], seq 4285:5713, ack 1, win 447, options [nop,nop,TS val 3764976 ecr 3531102,mptcp dss ack 177854901 seq 420613077 subseq 4285 len 1428 csum 0xf0a4], length 1428
10:40:36.548062 IP 112.26.1.8.37253 > 112.26.1.1.39713: Flags [.], ack 2857, win 7255, options [nop,nop,TS val 3531433 ecr 3764974,mptcp dss ack 420605937], length 0
10:40:36.549544 IP 112.26.1.8.37253 > 112.26.1.1.39713: Flags [.], ack 2857, win 7255, options [nop,nop,TS val 3531433 ecr 3764974,mptcp dss ack 420605937], length 0
10:40:36.551407 IP 112.26.1.1.39713 > 112.26.1.8.37253: Flags [.], seq 2857:4285, ack 1, win 447, options [nop,nop,TS val 3764976 ecr 3531102,mptcp dss ack 177854901 seq 420611649 subseq 2857 len 1428 csum 0xebba], length 1428
10:40:36.571021 IP 112.26.1.1.39713 > 112.26.1.8.37253: Flags [.], seq 5713:7141, ack 1, win 447, options [nop,nop,TS val 3764976 ecr 3531102,mptcp dss ack 177854901 seq 420614505 subseq 5713 len 1428 csum 0xbbdf], length 1428
10:40:36.587713 IP 112.26.1.1.39713 > 112.26.1.8.37253: Flags [.], seq 4285:5713, ack 1, win 447, options [nop,nop,TS val 3764976 ecr 3531102,mptcp dss ack 177854901 seq 420613077 subseq 4285 len 1428 csum 0xf0a4], length 1428
10:40:36.604692 IP 112.26.1.1.39713 > 112.26.1.8.37253: Flags [.], seq 7141:8569, ack 1, win 447, options [nop,nop,TS val 3764976 ecr 3531102,mptcp dss ack 177854901 seq 420615933 subseq 7141 len 1428 csum 0xe36b], length 1428
10:40:36.701889 IP 112.26.1.1.39713 > 112.26.1.8.37253: Flags [.], seq 8569:9997, ack 1, win 447, options [nop,nop,TS val 3764976 ecr 3531102,mptcp dss ack 177854901 seq 420617361 subseq 8569 len 1428 csum 0x773e], length 1428
10:40:36.711576 IP 112.26.1.8.37253 > 112.26.1.1.39713: Flags [.], ack 4285, win 7346, options [nop,nop,TS val 3531563 ecr 3764976,mptcp dss ack 420607365], length 0
10:40:36.713270 IP 112.26.1.8.37253 > 112.26.1.1.39713: Flags [.], ack 4285, win 7346, options [nop,nop,TS val 3531563 ecr 3764976,mptcp dss ack 420607365], length 0
10:40:36.746708 IP 112.26.1.8.37253 > 112.26.1.1.39713: Flags [.], ack 5713, win 7437, options [nop,nop,TS val 3531599 ecr 3764976,mptcp dss ack 420614505], length 0
10:40:36.756859 IP 112.26.1.1.39713 > 112.26.1.8.37253: Flags [.], seq 5713:7141, ack 1, win 447, options [nop,nop,TS val 3764976 ecr 3531102,mptcp dss ack 177854901 seq 420614505 subseq 5713 len 1428 csum 0xbbdf], length 1428
10:40:36.769323 IP 112.26.1.8.37253 > 112.26.1.1.39713: Flags [.], ack 5713, win 7437, options [nop,nop,TS val 3531599 ecr 3764976,mptcp dss ack 420614505], length 0
10:40:36.781352 IP 112.26.1.1.39713 > 112.26.1.8.37253: Flags [.], seq 14281:15709, ack 1, win 893, options [nop,nop,TS val 3765168 ecr 3531285,mptcp dss ack 177854901 seq 420651633 subseq 14281 len 1428 csum 0x9398], length 1428
10:40:36.805173 IP 112.26.1.1.39713 > 112.26.1.8.37253: Flags [.], seq 5713:7141, ack 1, win 447, options [nop,nop,TS val 3764976 ecr 3531102,mptcp dss ack 177854901 seq 420614505 subseq 5713 len 1428 csum 0xbbdf], length 1428
10:40:36.846346 IP 112.26.1.1.39713 > 112.26.1.8.37253: Flags [.], seq 15709:17137, ack 1, win 893, options [nop,nop,TS val 3765168 ecr 3531285,mptcp dss ack 177854901 seq 420653061 subseq 15709 len 1428 csum 0x4d13], length 1428
10:40:36.869521 IP 112.26.1.8.37253 > 112.26.1.1.39713: Flags [.], ack 7141, win 7574, options [nop,nop,TS val 3531812 ecr 3764976,mptcp dss ack 420615933], length 0
10:40:36.878869 IP 112.26.1.1.39713 > 112.26.1.8.37253: Flags [.], seq 7141:8569, ack 1, win 447, options [nop,nop,TS val 3764976 ecr 3531102,mptcp dss ack 177854901 seq 420615933 subseq 7141 len 1428 csum 0xe36b], length 1428
10:40:36.885943 IP 112.26.1.8.37253 > 112.26.1.1.39713: Flags [.], ack 7141, win 7574, options [nop,nop,TS val 3531812 ecr 3764976,mptcp dss ack 420615933], length 0
10:40:36.911827 IP 112.26.1.1.39713 > 112.26.1.8.37253: Flags [.], seq 17137:18565, ack 1, win 893, options [nop,nop,TS val 3765355 ecr 3531433,mptcp dss ack 177854901 seq 420661629 subseq 17137 len 1428 csum 0xc60d], length 1428
10:40:36.945150 IP 112.26.1.1.39713 > 112.26.1.8.37253: Flags [.], seq 8569:9997, ack 1, win 447, options [nop,nop,TS val 3764976 ecr 3531102,mptcp dss ack 177854901 seq 420617361 subseq 8569 len 1428 csum 0x773e], length 1428
10:40:36.951425 IP 112.26.1.1.39713 > 112.26.1.8.37253: Flags [.], seq 7141:8569, ack 1, win 447, options [nop,nop,TS val 3764976 ecr 3531102,mptcp dss ack 177854901 seq 420615933 subseq 7141 len 1428 csum 0xe36b], length 1428
10:40:37.003070 IP 112.26.1.1.39713 > 112.26.1.8.37253: Flags [.], seq 18565:19993, ack 1, win 893, options [nop,nop,TS val 3765355 ecr 3531433,mptcp dss ack 177854901 seq 420663057 subseq 18565 len 1428 csum 0x7628], length 1428
10:40:37.014667 IP 112.26.1.1.39713 > 112.26.1.8.37253: Flags [.], seq 8569:9997, ack 1, win 447, options [nop,nop,TS val 3764976 ecr 3531102,mptcp dss ack 177854901 seq 420617361 subseq 8569 len 1428 csum 0x773e], length 1428
10:40:37.047425 IP 112.26.1.1.39713 > 112.26.1.8.37253: Flags [.], seq 19993:21421, ack 1, win 893, options [nop,nop,TS val 3765519 ecr 3531563,mptcp dss ack 177854901 seq 420670197 subseq 19993 len 1428 csum 0x5ed3], length 1428
10:40:37.052946 IP 112.26.1.1.39713 > 112.26.1.8.37253: Flags [.], seq 14281:15709, ack 1, win 893, options [nop,nop,TS val 3765168 ecr 3531285,mptcp dss ack 177854901 seq 420651633 subseq 14281 len 1428 csum 0x9398], length 1428
10:40:37.112846 IP 112.26.1.1.39713 > 112.26.1.8.37253: Flags [.], seq 21421:22849, ack 1, win 893, options [nop,nop,TS val 3765519 ecr 3531563,mptcp dss ack 177854901 seq 420671625 subseq 21421 len 1428 csum 0x4ff1], length 1428
10:40:37.145449 IP 112.26.1.8.37253 > 112.26.1.1.39713: Flags [.], ack 8569, win 7711, options [nop,nop,TS val 3531933 ecr 3764976,mptcp dss ack 420617361], length 0
10:40:37.146975 IP 112.26.1.8.37253 > 112.26.1.1.39713: Flags [.], ack 8569, win 7711, options [nop,nop,TS val 3531933 ecr 3764976,mptcp dss ack 420617361], length 0
10:40:37.159812 IP 112.26.1.1.39713 > 112.26.1.8.37253: Flags [.], seq 15709:17137, ack 1, win 893, options [nop,nop,TS val 3765168 ecr 3531285,mptcp dss ack 177854901 seq 420653061 subseq 15709 len 1428 csum 0x4d13], length 1428
10:40:37.174985 IP 112.26.1.1.39713 > 112.26.1.8.37253: Flags [.], seq 22849:24277, ack 1, win 893, options [nop,nop,TS val 3765575 ecr 3531599,mptcp dss ack 177854901 seq 420675909 subseq 22849 len 1428 csum 0x935b], length 1428
10:40:37.204832 IP 112.26.1.8.37253 > 112.26.1.1.39713: Flags [.], ack 9997, win 7848, options [nop,nop,TS val 3532026 ecr 3764976,mptcp dss ack 420618789], length 0
10:40:37.206818 IP 112.26.1.8.37253 > 112.26.1.1.39713: Flags [.], ack 9997, win 7848, options [nop,nop,TS val 3532026 ecr 3764976,mptcp dss ack 420618789], length 0
10:40:37.218111 IP 112.26.1.1.39713 > 112.26.1.8.37253: Flags [.], seq 24277:25705, ack 1, win 893, options [nop,nop,TS val 3765575 ecr 3531599,mptcp dss ack 177854901 seq 420677337 subseq 24277 len 1428 csum 0x77db], length 1428
10:40:37.238845 IP 112.26.1.1.39713 > 112.26.1.8.37253: Flags [.], seq 14281:15709, ack 1, win 893, options [nop,nop,TS val 3765168 ecr 3531285,mptcp dss ack 177854901 seq 420651633 subseq 14281 len 1428 csum 0x9398], length 1428
10:40:37.265052 IP 112.26.1.1.39713 > 112.26.1.8.37253: Flags [.], seq 25705:27133, ack 1, win 893, options [nop,nop,TS val 3765691 ecr 3531812,mptcp dss ack 177854901 seq 420681621 subseq 25705 len 1428 csum 0xe076], length 1428
10:40:37.320785 IP 112.26.1.1.39713 > 112.26.1.8.37253: Flags [.], seq 15709:17137, ack 1, win 893, options [nop,nop,TS val 3765168 ecr 3531285,mptcp dss ack 177854901 seq 420653061 subseq 15709 len 1428 csum 0x4d13], length 1428
10:40:37.346384 IP 112.26.1.1.39713 > 112.26.1.8.37253: Flags [.], seq 27133:28561, ack 1, win 893, options [nop,nop,TS val 3765691 ecr 3531812,mptcp dss ack 177854901 seq 420683049 subseq 27133 len 1428 csum 0xb085], length 1428
10:40:37.352544 IP 112.26.1.1.39713 > 112.26.1.8.37253: Flags [.], seq 17137:18565, ack 1, win 893, options [nop,nop,TS val 3765355 ecr 3531433,mptcp dss ack 177854901 seq 420661629 subseq 17137 len 1428 csum 0xc60d], length 1428
10:40:37.425192 IP 112.26.1.1.39713 > 112.26.1.8.37253: Flags [.], seq 18565:19993, ack 1, win 893, options [nop,nop,TS val 3765355 ecr 3531433,mptcp dss ack 177854901 seq 420663057 subseq 18565 len 1428 csum 0x7628], length 1428
10:40:37.449685 IP 112.26.1.8.37253 > 112.26.1.1.39713: Flags [.], ack 9997, win 8213, options [nop,nop,TS val 3532332 ecr 3764976,nop,nop,sack 1 {14281:17137},mptcp dss ack 420618789], length 0
10:40:37.451196 IP 112.26.1.8.37253 > 112.26.1.1.39713: Flags [.], ack 9997, win 8213, options [nop,nop,TS val 3532332 ecr 3764976,nop,nop,sack 1 {14281:17137},mptcp dss ack 420618789], length 0
10:40:37.500172 IP 112.26.1.1.39713 > 112.26.1.8.37253: Flags [.], seq 28561:29989, ack 1, win 893, options [nop,nop,TS val 3765952 ecr 3531933,mptcp dss ack 177854901 seq 420691617 subseq 28561 len 1428 csum 0x4853], length 1428
10:40:37.504096 IP 112.26.1.1.39713 > 112.26.1.8.37253: Flags [.], seq 29989:31417, ack 1, win 893, options [nop,nop,TS val 3765952 ecr 3531933,mptcp dss ack 177854901 seq 420693045 subseq 29989 len 1428 csum 0xf883], length 1428
10:40:37.515089 IP 112.26.1.1.39713 > 112.26.1.8.37253: Flags [.], seq 17137:18565, ack 1, win 893, options [nop,nop,TS val 3765355 ecr 3531433,mptcp dss ack 177854901 seq 420661629 subseq 17137 len 1428 csum 0xc60d], length 1428
10:40:37.540154 IP 112.26.1.1.39713 > 112.26.1.8.37253: Flags [.], seq 19993:21421, ack 1, win 893, options [nop,nop,TS val 3765519 ecr 3531563,mptcp dss ack 177854901 seq 420670197 subseq 19993 len 1428 csum 0x5ed3], length 1428
10:40:37.562303 IP 112.26.1.1.39713 > 112.26.1.8.37253: Flags [.], seq 31417:32845, ack 1, win 893, options [nop,nop,TS val 3766012 ecr 3532026,mptcp dss ack 177854901 seq 420694473 subseq 31417 len 1428 csum 0xbca4], length 1428
10:40:37.591695 IP 112.26.1.1.39713 > 112.26.1.8.37253: Flags [.], seq 18565:19993, ack 1, win 893, options [nop,nop,TS val 3765355 ecr 3531433,mptcp dss ack 177854901 seq 420663057 subseq 18565 len 1428 csum 0x7628], length 1428
10:40:37.620568 IP 112.26.1.1.39713 > 112.26.1.8.37253: Flags [.], seq 32845:34273, ack 1, win 893, options [nop,nop,TS val 3766012 ecr 3532026,mptcp dss ack 177854901 seq 420695901 subseq 32845 len 1428 csum 0x8b71], length 1428
10:40:37.653407 IP 112.26.1.1.39713 > 112.26.1.8.37253: Flags [.], seq 22849:24277, ack 1, win 893, options [nop,nop,TS val 3765575 ecr 3531599,mptcp dss ack 177854901 seq 420675909 subseq 22849 len 1428 csum 0x935b], length 1428
10:40:37.668795 IP 112.26.1.8.37253 > 112.26.1.1.39713: Flags [.], ack 9997, win 8487, options [nop,nop,TS val 3532526 ecr 3764976,nop,nop,sack 1 {14281:18565},mptcp dss ack 420618789], length 0
10:40:37.673081 IP 112.26.1.8.37253 > 112.26.1.1.39713: Flags [.], ack 9997, win 8487, options [nop,nop,TS val 3532526 ecr 3764976,nop,nop,sack 1 {14281:18565},mptcp dss ack 420618789], length 0
10:40:37.691086 IP 112.26.1.1.39713 > 112.26.1.8.37253: Flags [P.], seq 9997:11425, ack 1, win 893, options [nop,nop,TS val 3766256 ecr 3532332,mptcp dss ack 177854901 seq 420618789 subseq 9997 len 1428 csum 0x21], length 1428
10:40:37.730917 IP 112.26.1.1.39713 > 112.26.1.8.37253: Flags [.], seq 19993:21421, ack 1, win 893, options [nop,nop,TS val 3765519 ecr 3531563,mptcp dss ack 177854901 seq 420670197 subseq 19993 len 1428 csum 0x5ed3], length 1428
10:40:37.745227 IP 112.26.1.1.39713 > 112.26.1.8.37253: Flags [.], seq 24277:25705, ack 1, win 893, options [nop,nop,TS val 3765575 ecr 3531599,mptcp dss ack 177854901 seq 420677337 subseq 24277 len 1428 csum 0x77db], length 1428
10:40:37.765274 IP 112.26.1.1.39713 > 112.26.1.8.37253: Flags [.], seq 11425:12853, ack 1, win 893, options [nop,nop,TS val 3766256 ecr 3532332,mptcp dss ack 177854901 seq 420620217 subseq 11425 len 1428 csum 0x2191], length 1428
10:40:37.784138 IP 112.26.1.8.37253 > 112.26.1.1.39713: Flags [.], ack 9997, win 8578, options [nop,nop,TS val 3532603 ecr 3764976,nop,nop,sack 1 {14281:19993},mptcp dss ack 420618789], length 0
10:40:37.786928 IP 112.26.1.8.37253 > 112.26.1.1.39713: Flags [.], ack 9997, win 8578, options [nop,nop,TS val 3532603 ecr 3764976,nop,nop,sack 1 {14281:19993},mptcp dss ack 420618789], length 0
10:40:37.849442 IP 112.26.1.1.39713 > 112.26.1.8.37253: Flags [.], seq 27133:28561, ack 1, win 893, options [nop,nop,TS val 3765691 ecr 3531812,mptcp dss ack 177854901 seq 420683049 subseq 27133 len 1428 csum 0xb085], length 1428
10:40:37.872763 IP 112.26.1.1.39713 > 112.26.1.8.37253: Flags [.], seq 12853:14281, ack 1, win 893, options [nop,nop,TS val 3766593 ecr 3532603,mptcp dss ack 177854901 seq 420621645 subseq 12853 len 1428 csum 0xb3ad], length 1428
10:40:37.882646 IP 112.26.1.1.39713 > 112.26.1.8.37253: Flags [.], seq 22849:24277, ack 1, win 893, options [nop,nop,TS val 3765575 ecr 3531599,mptcp dss ack 177854901 seq 420675909 subseq 22849 len 1428 csum 0x935b], length 1428
10:40:37.896527 IP 112.26.1.1.39713 > 112.26.1.8.37253: Flags [.], seq 28561:29989, ack 1, win 893, options [nop,nop,TS val 3765952 ecr 3531933,mptcp dss ack 177854901 seq 420691617 subseq 28561 len 1428 csum 0x4853], length 1428
10:40:37.939486 IP 112.26.1.1.39713 > 112.26.1.8.37253: Flags [.], seq 24277:25705, ack 1, win 893, options [nop,nop,TS val 3765575 ecr 3531599,mptcp dss ack 177854901 seq 420677337 subseq 24277 len 1428 csum 0x77db], length 1428
10:40:37.971193 IP 112.26.1.1.39713 > 112.26.1.8.37253: Flags [.], seq 29989:31417, ack 1, win 893, options [nop,nop,TS val 3765952 ecr 3531933,mptcp dss ack 177854901 seq 420693045 subseq 29989 len 1428 csum 0xf883], length 1428
10:40:38.067408 IP 112.26.1.1.39713 > 112.26.1.8.37253: Flags [.], seq 31417:32845, ack 1, win 893, options [nop,nop,TS val 3766012 ecr 3532026,mptcp dss ack 177854901 seq 420694473 subseq 31417 len 1428 csum 0xbca4], length 1428
10:40:38.101134 IP 112.26.1.8.37253 > 112.26.1.1.39713: Flags [.], ack 9997, win 8715, options [nop,nop,TS val 3532739 ecr 3764976,nop,nop,sack 1 {14281:21421},mptcp dss ack 420618789], length 0
10:40:38.102910 IP 112.26.1.8.37253 > 112.26.1.1.39713: Flags [.], ack 9997, win 8715, options [nop,nop,TS val 3532739 ecr 3764976,nop,nop,sack 1 {14281:21421},mptcp dss ack 420618789], length 0
10:40:38.120126 IP 112.26.1.1.39713 > 112.26.1.8.37253: Flags [.], seq 32845:34273, ack 1, win 893, options [nop,nop,TS val 3766012 ecr 3532026,mptcp dss ack 177854901 seq 420695901 subseq 32845 len 1428 csum 0x8b71], length 1428
10:40:38.163996 IP 112.26.1.1.39713 > 112.26.1.8.37253: Flags [P.], seq 9997:11425, ack 1, win 893, options [nop,nop,TS val 3766256 ecr 3532332,mptcp dss ack 177854901 seq 420618789 subseq 9997 len 1428 csum 0x21], length 1428
10:40:38.169766 IP 112.26.1.1.39713 > 112.26.1.8.37253: Flags [.], seq 27133:28561, ack 1, win 893, options [nop,nop,TS val 3765691 ecr 3531812,mptcp dss ack 177854901 seq 420683049 subseq 27133 len 1428 csum 0xb085], length 1428
10:40:38.208356 IP 112.26.1.8.37253 > 112.26.1.1.39713: Flags [.], ack 9997, win 8806, options [nop,nop,TS val 3532877 ecr 3764976,nop,nop,sack 2 {22849:24277}{14281:21421},mptcp dss ack 420618789], length 0
10:40:38.210110 IP 112.26.1.8.37253 > 112.26.1.1.39713: Flags [.], ack 9997, win 8806, options [nop,nop,TS val 3532877 ecr 3764976,nop,nop,sack 2 {22849:24277}{14281:21421},mptcp dss ack 420618789], length 0
10:40:38.215919 IP 112.26.1.1.39713 > 112.26.1.8.37253: Flags [.], seq 34273:35701, ack 1, win 893, options [nop,nop,TS val 3767015 ecr 3532739,mptcp dss ack 177854901 seq 420730173 subseq 34273 len 1428 csum 0x6c74], length 1428
10:40:38.261743 IP 112.26.1.1.39713 > 112.26.1.8.37253: Flags [.], seq 11425:12853, ack 1, win 893, options [nop,nop,TS val 3766256 ecr 3532332,mptcp dss ack 177854901 seq 420620217 subseq 11425 len 1428 csum 0x2191], length 1428
10:40:38.274881 IP 112.26.1.1.39713 > 112.26.1.8.37253: Flags [.], seq 28561:29989, ack 1, win 893, options [nop,nop,TS val 3765952 ecr 3531933,mptcp dss ack 177854901 seq 420691617 subseq 28561 len 1428 csum 0x4853], length 1428
10:40:38.316016 IP 112.26.1.1.39713 > 112.26.1.8.37253: Flags [.], seq 12853:14281, ack 1, win 893, options [nop,nop,TS val 3766593 ecr 3532603,mptcp dss ack 177854901 seq 420621645 subseq 12853 len 1428 csum 0xb3ad], length 1428
10:40:38.348086 IP 112.26.1.8.37253 > 112.26.1.1.39713: Flags [.], ack 9997, win 8897, options [nop,nop,TS val 3532951 ecr 3764976,nop,nop,sack 2 {22849:25705}{14281:21421},mptcp dss ack 420618789], length 0
10:40:38.350561 IP 112.26.1.8.37253 > 112.26.1.1.39713: Flags [.], ack 9997, win 8897, options [nop,nop,TS val 3532951 ecr 3764976,nop,nop,sack 2 {22849:25705}{14281:21421},mptcp dss ack 420618789], length 0
10:40:38.360872 IP 112.26.1.1.39713 > 112.26.1.8.37253: Flags [.], seq 21421:22849, ack 1, win 893, options [nop,nop,TS val 3767156 ecr 3532951,mptcp dss ack 177854901 seq 420671625 subseq 21421 len 1428 csum 0x4ff1], length 1428
10:40:38.379750 IP 112.26.1.1.39713 > 112.26.1.8.37253: Flags [.], seq 34273:35701, ack 1, win 893, options [nop,nop,TS val 3767015 ecr 3532739,mptcp dss ack 177854901 seq 420730173 subseq 34273 len 1428 csum 0x6c74], length 1428
10:40:38.394246 IP 112.26.1.1.39713 > 112.26.1.8.37253: Flags [.], seq 29989:31417, ack 1, win 893, options [nop,nop,TS val 3765952 ecr 3531933,mptcp dss ack 177854901 seq 420693045 subseq 29989 len 1428 csum 0xf883], length 1428
10:40:38.450112 IP 112.26.1.1.39713 > 112.26.1.8.37253: Flags [.], seq 21421:22849, ack 1, win 893, options [nop,nop,TS val 3767156 ecr 3532951,mptcp dss ack 177854901 seq 420671625 subseq 21421 len 1428 csum 0x4ff1], length 1428
10:40:38.485903 IP 112.26.1.1.39713 > 112.26.1.8.37253: Flags [.], seq 31417:32845, ack 1, win 893, options [nop,nop,TS val 3766012 ecr 3532026,mptcp dss ack 177854901 seq 420694473 subseq 31417 len 1428 csum 0xbca4], length 1428
10:40:38.543762 IP 112.26.1.1.39713 > 112.26.1.8.37253: Flags [.], seq 32845:34273, ack 1, win 893, options [nop,nop,TS val 3766012 ecr 3532026,mptcp dss ack 177854901 seq 420695901 subseq 32845 len 1428 csum 0x8b71], length 1428
10:40:38.581814 IP 112.26.1.1.39713 > 112.26.1.8.37253: Flags [P.], seq 9997:11425, ack 1, win 893, options [nop,nop,TS val 3766256 ecr 3532332,mptcp dss ack 177854901 seq 420618789 subseq 9997 len 1428 csum 0x21], length 1428
10:40:38.640428 IP 112.26.1.8.37253 > 112.26.1.1.39713: Flags [.], ack 9997, win 9171, options [nop,nop,TS val 3533181 ecr 3764976,nop,nop,sack 2 {27133:28561}{22849:25705},mptcp dss ack 420618789], length 0
10:40:38.642986 IP 112.26.1.8.37253 > 112.26.1.1.39713: Flags [.], ack 9997, win 9171, options [nop,nop,TS val 3533181 ecr 3764976,nop,nop,sack 2 {27133:28561}{22849:25705},mptcp dss ack 420618789], length 0
10:40:38.656717 IP 112.26.1.1.39713 > 112.26.1.8.37253: Flags [.], seq 25705:27133, ack 1, win 893, options [nop,nop,TS val 3767449 ecr 3533181,mptcp dss ack 177854901 seq 420681621 subseq 25705 len 1428 csum 0xe076], length 1428
10:40:38.659878 IP 112.26.1.1.39713 > 112.26.1.8.37253: Flags [.], seq 25705:27133, ack 1, win 893, options [nop,nop,TS val 3767449 ecr 3533181,mptcp dss ack 177854901 seq 420681621 subseq 25705 len 1428 csum 0xe076], length 1428
10:40:38.698083 IP 112.26.1.1.39713 > 112.26.1.8.37253: Flags [.], seq 11425:12853, ack 1, win 893, options [nop,nop,TS val 3766256 ecr 3532332,mptcp dss ack 177854901 seq 420620217 subseq 11425 len 1428 csum 0x2191], length 1428
10:40:38.758896 IP 112.26.1.8.37253 > 112.26.1.1.39713: Flags [.], ack 9997, win 9262, options [nop,nop,TS val 3533286 ecr 3764976,nop,nop,sack 2 {27133:29989}{22849:25705},mptcp dss ack 420618789], length 0
10:40:38.760633 IP 112.26.1.8.37253 > 112.26.1.1.39713: Flags [.], ack 9997, win 9262, options [nop,nop,TS val 3533286 ecr 3764976,nop,nop,sack 2 {27133:29989}{22849:25705},mptcp dss ack 420618789], length 0
10:40:38.786890 IP 112.26.1.1.39713 > 112.26.1.8.37253: Flags [.], seq 35701:37129, ack 1, win 893, options [nop,nop,TS val 3767588 ecr 3533286,mptcp dss ack 177854901 seq 420740169 subseq 35701 len 1428 csum 0xc5a2], length 1428
10:40:38.790631 IP 112.26.1.1.39713 > 112.26.1.8.37253: Flags [.], seq 35701:37129, ack 1, win 893, options [nop,nop,TS val 3767588 ecr 3533286,mptcp dss ack 177854901 seq 420740169 subseq 35701 len 1428 csum 0xc5a2], length 1428
10:40:38.815149 IP 112.26.1.1.39713 > 112.26.1.8.37253: Flags [.], seq 34273:35701, ack 1, win 893, options [nop,nop,TS val 3767015 ecr 3532739,mptcp dss ack 177854901 seq 420730173 subseq 34273 len 1428 csum 0x6c74], length 1428
10:40:38.887789 IP 112.26.1.8.37253 > 112.26.1.1.39713: Flags [.], ack 9997, win 9445, options [nop,nop,TS val 3533405 ecr 3764976,nop,nop,sack 2 {27133:31417}{22849:25705},mptcp dss ack 420618789], length 0
10:40:38.890939 IP 112.26.1.8.37253 > 112.26.1.1.39713: Flags [.], ack 9997, win 9445, options [nop,nop,TS val 3533405 ecr 3764976,nop,nop,sack 2 {27133:31417}{22849:25705},mptcp dss ack 420618789], length 0
10:40:38.910687 IP 112.26.1.1.39713 > 112.26.1.8.37253: Flags [.], seq 37129:38557, ack 1, win 893, options [nop,nop,TS val 3767710 ecr 3533405,mptcp dss ack 177854901 seq 420741597 subseq 37129 len 1428 csum 0x722e], length 1428
10:40:38.957391 IP 112.26.1.1.39713 > 112.26.1.8.37253: Flags [.], seq 21421:22849, ack 1, win 893, options [nop,nop,TS val 3767156 ecr 3532951,mptcp dss ack 177854901 seq 420671625 subseq 21421 len 1428 csum 0x4ff1], length 1428
10:40:38.980972 IP 112.26.1.1.39713 > 112.26.1.8.37253: Flags [.], seq 37129:38557, ack 1, win 893, options [nop,nop,TS val 3767710 ecr 3533405,mptcp dss ack 177854901 seq 420741597 subseq 37129 len 1428 csum 0x722e], length 1428
10:40:39.010007 IP 112.26.1.8.37253 > 112.26.1.1.39713: Flags [.], ack 9997, win 9582, options [nop,nop,TS val 3533556 ecr 3764976,nop,nop,sack 2 {27133:34273}{22849:25705},mptcp dss ack 420618789], length 0
10:40:39.011412 IP 112.26.1.8.37253 > 112.26.1.1.39713: Flags [.], ack 9997, win 9582, options [nop,nop,TS val 3533556 ecr 3764976,nop,nop,sack 2 {27133:34273}{22849:25705},mptcp dss ack 420618789], length 0
10:40:39.051762 IP 112.26.1.8.37253 > 112.26.1.1.39713: Flags [.], ack 11425, win 9719, options [nop,nop,TS val 3533594 ecr 3766256,nop,nop,sack 2 {27133:34273}{22849:25705},mptcp dss ack 420620217], length 0
10:40:39.067218 IP 112.26.1.8.37253 > 112.26.1.1.39713: Flags [.], ack 11425, win 9719, options [nop,nop,TS val 3533594 ecr 3766256,nop,nop,sack 2 {27133:34273}{22849:25705},mptcp dss ack 420620217], length 0
10:40:39.083761 IP 112.26.1.1.39713 > 112.26.1.8.37253: Flags [.], seq 38557:39985, ack 1, win 893, options [nop,nop,TS val 3767873 ecr 3533556,mptcp dss ack 177854901 seq 420743025 subseq 38557 len 1428 csum 0x964a], length 1428
10:40:39.104036 IP 112.26.1.1.39713 > 112.26.1.8.37253: Flags [.], seq 38557:39985, ack 1, win 893, options [nop,nop,TS val 3767873 ecr 3533556,mptcp dss ack 177854901 seq 420743025 subseq 38557 len 1428 csum 0x964a], length 1428
10:40:39.119358 IP 112.26.1.1.39713 > 112.26.1.8.37253: Flags [.], seq 25705:27133, ack 1, win 893, options [nop,nop,TS val 3767449 ecr 3533181,mptcp dss ack 177854901 seq 420681621 subseq 25705 len 1428 csum 0xe076], length 1428
10:40:39.141543 IP 112.26.1.1.39713 > 112.26.1.8.37253: Flags [.], seq 39985:41413, ack 1, win 893, options [nop,nop,TS val 3767873 ecr 3533556,mptcp dss ack 177854901 seq 420744453 subseq 39985 len 1428 csum 0x9ec9], length 1428
10:40:39.174593 IP 112.26.1.8.37253 > 112.26.1.1.39713: Flags [.], ack 12853, win 9810, options [nop,nop,TS val 3533710 ecr 3766256,nop,nop,sack 2 {27133:34273}{22849:25705},mptcp dss ack 420621645], length 0
10:40:39.176163 IP 112.26.1.8.37253 > 112.26.1.1.39713: Flags [.], ack 12853, win 9810, options [nop,nop,TS val 3533710 ecr 3766256,nop,nop,sack 2 {27133:34273}{22849:25705},mptcp dss ack 420621645], length 0
10:40:39.191014 IP 112.26.1.1.39713 > 112.26.1.8.37253: Flags [.], seq 39985:41413, ack 1, win 893, options [nop,nop,TS val 3767873 ecr 3533556,mptcp dss ack 177854901 seq 420744453 subseq 39985 len 1428 csum 0x9ec9], length 1428
10:40:39.236566 IP 112.26.1.1.39713 > 112.26.1.8.37253: Flags [.], seq 41413:42841, ack 1, win 893, options [nop,nop,TS val 3767873 ecr 3533594,mptcp dss ack 177854901 seq 420745881 subseq 41413 len 1428 csum 0x23f8], length 1428
10:40:39.241415 IP 112.26.1.1.39713 > 112.26.1.8.37253: Flags [.], seq 41413:42841, ack 1, win 893, options [nop,nop,TS val 3767873 ecr 3533594,mptcp dss ack 177854901 seq 420745881 subseq 41413 len 1428 csum 0x23f8], length 1428
10:40:39.292072 IP 112.26.1.1.39713 > 112.26.1.8.37253: Flags [.], seq 42841:44269, ack 1, win 893, options [nop,nop,TS val 3767873 ecr 3533594,mptcp dss ack 177854901 seq 420747309 subseq 42841 len 1428 csum 0xf8a1], length 1428
10:40:39.299908 IP 112.26.1.8.37253 > 112.26.1.1.39713: Flags [.], ack 12853, win 9992, options [nop,nop,TS val 3533827 ecr 3766256,nop,nop,sack 2 {27133:35701}{22849:25705},mptcp dss ack 420621645], length 0
10:40:39.301382 IP 112.26.1.8.37253 > 112.26.1.1.39713: Flags [.], ack 12853, win 9992, options [nop,nop,TS val 3533827 ecr 3766256,nop,nop,sack 2 {27133:35701}{22849:25705},mptcp dss ack 420621645], length 0
10:40:39.311044 IP 112.26.1.1.39713 > 112.26.1.8.37253: Flags [.], seq 42841:44269, ack 1, win 893, options [nop,nop,TS val 3767873 ecr 3533594,mptcp dss ack 177854901 seq 420747309 subseq 42841 len 1428 csum 0xf8a1], length 1428
10:40:39.366549 IP 112.26.1.8.37253 > 112.26.1.1.39713: Flags [.], ack 12853, win 10129, options [nop,nop,TS val 3533969 ecr 3766256,nop,nop,sack 2 {14281:25705}{27133:35701},mptcp dss ack 420621645], length 0
10:40:39.379035 IP 112.26.1.1.39713 > 112.26.1.8.37253: Flags [.], seq 44269:45697, ack 1, win 893, options [nop,nop,TS val 3767982 ecr 3533710,mptcp dss ack 177854901 seq 420748737 subseq 44269 len 1428 csum 0x5268], length 1428
10:40:39.385162 IP 112.26.1.1.39713 > 112.26.1.8.37253: Flags [.], seq 44269:45697, ack 1, win 893, options [nop,nop,TS val 3767982 ecr 3533710,mptcp dss ack 177854901 seq 420748737 subseq 44269 len 1428 csum 0x5268], length 1428
10:40:39.393282 IP 112.26.1.8.37253 > 112.26.1.1.39713: Flags [.], ack 12853, win 10129, options [nop,nop,TS val 3533969 ecr 3766256,nop,nop,sack 2 {14281:25705}{27133:35701},mptcp dss ack 420621645], length 0
10:40:39.399662 IP 112.26.1.1.39713 > 112.26.1.8.37253: Flags [.], seq 12853:14281, ack 1, win 893, options [nop,nop,TS val 3768107 ecr 3533827,mptcp dss ack 177854901 seq 420621645 subseq 12853 len 1428 csum 0xb3ad], length 1428
10:40:39.427421 IP 112.26.1.1.39713 > 112.26.1.8.37253: Flags [.], seq 37129:38557, ack 1, win 893, options [nop,nop,TS val 3767710 ecr 3533405,mptcp dss ack 177854901 seq 420741597 subseq 37129 len 1428 csum 0x722e], length 1428
10:40:39.469024 IP 112.26.1.1.39713 > 112.26.1.8.37253: Flags [.], seq 12853:14281, ack 1, win 893, options [nop,nop,TS val 3768107 ecr 3533827,mptcp dss ack 177854901 seq 420621645 subseq 12853 len 1428 csum 0xb3ad], length 1428
10:40:39.481433 IP 112.26.1.1.39713 > 112.26.1.8.37253: Flags [.], seq 45697:47125, ack 1, win 893, options [nop,nop,TS val 3768211 ecr 3533969,mptcp dss ack 177854901 seq 420750165 subseq 45697 len 1428 csum 0xd2f3], length 1428
10:40:39.503154 IP 112.26.1.1.39713 > 112.26.1.8.37253: Flags [.], seq 38557:39985, ack 1, win 893, options [nop,nop,TS val 3767873 ecr 3533556,mptcp dss ack 177854901 seq 420743025 subseq 38557 len 1428 csum 0x964a], length 1428
10:40:39.547360 IP 112.26.1.1.39713 > 112.26.1.8.37253: Flags [.], seq 45697:47125, ack 1, win 893, options [nop,nop,TS val 3768211 ecr 3533969,mptcp dss ack 177854901 seq 420750165 subseq 45697 len 1428 csum 0xd2f3], length 1428
10:40:39.608338 IP 112.26.1.8.37253 > 112.26.1.1.39713: Flags [.], ack 12853, win 10357, options [nop,nop,TS val 3534125 ecr 3766256,nop,nop,sack 1 {14281:35701},mptcp dss ack 420621645], length 0
10:40:39.613128 IP 112.26.1.8.37253 > 112.26.1.1.39713: Flags [.], ack 12853, win 10357, options [nop,nop,TS val 3534125 ecr 3766256,nop,nop,sack 1 {14281:35701},mptcp dss ack 420621645], length 0
10:40:39.633404 IP 112.26.1.1.39713 > 112.26.1.8.37253: Flags [.], seq 47125:48553, ack 1, win 893, options [nop,nop,TS val 3768436 ecr 3534125,mptcp dss ack 177854901 seq 420753021 subseq 47125 len 1428 csum 0xf21c], length 1428
10:40:39.637115 IP 112.26.1.1.39713 > 112.26.1.8.37253: Flags [.], seq 47125:48553, ack 1, win 893, options [nop,nop,TS val 3768436 ecr 3534125,mptcp dss ack 177854901 seq 420753021 subseq 47125 len 1428 csum 0xf21c], length 1428
10:40:39.673288 IP 112.26.1.1.39713 > 112.26.1.8.37253: Flags [.], seq 39985:41413, ack 1, win 893, options [nop,nop,TS val 3767873 ecr 3533556,mptcp dss ack 177854901 seq 420744453 subseq 39985 len 1428 csum 0x9ec9], length 1428
10:40:39.743691 IP 112.26.1.1.39713 > 112.26.1.8.37253: Flags [.], seq 41413:42841, ack 1, win 893, options [nop,nop,TS val 3767873 ecr 3533594,mptcp dss ack 177854901 seq 420745881 subseq 41413 len 1428 csum 0x23f8], length 1428
10:40:39.808060 IP 112.26.1.1.39713 > 112.26.1.8.37253: Flags [.], seq 42841:44269, ack 1, win 893, options [nop,nop,TS val 3767873 ecr 3533594,mptcp dss ack 177854901 seq 420747309 subseq 42841 len 1428 csum 0xf8a1], length 1428
10:40:39.859617 IP 112.26.1.1.39713 > 112.26.1.8.37253: Flags [.], seq 44269:45697, ack 1, win 893, options [nop,nop,TS val 3767982 ecr 3533710,mptcp dss ack 177854901 seq 420748737 subseq 44269 len 1428 csum 0x5268], length 1428
10:40:39.905858 IP 112.26.1.8.37253 > 112.26.1.1.39713: Flags [.], ack 12853, win 10722, options [nop,nop,TS val 3534435 ecr 3766256,nop,nop,sack 1 {14281:38557},mptcp dss ack 420621645], length 0
10:40:39.908287 IP 112.26.1.8.37253 > 112.26.1.1.39713: Flags [.], ack 12853, win 10722, options [nop,nop,TS val 3534435 ecr 3766256,nop,nop,sack 1 {14281:38557},mptcp dss ack 420621645], length 0
10:40:39.920279 IP 112.26.1.1.39713 > 112.26.1.8.37253: Flags [.], seq 48553:49981, ack 1, win 893, options [nop,nop,TS val 3768716 ecr 3534435,mptcp dss ack 177854901 seq 420764445 subseq 48553 len 1428 csum 0xead7], length 1428
10:40:39.931160 IP 112.26.1.1.39713 > 112.26.1.8.37253: Flags [.], seq 48553:49981, ack 1, win 893, options [nop,nop,TS val 3768716 ecr 3534435,mptcp dss ack 177854901 seq 420764445 subseq 48553 len 1428 csum 0xead7], length 1428
10:40:39.965247 IP 112.26.1.1.39713 > 112.26.1.8.37253: Flags [.], seq 12853:14281, ack 1, win 893, options [nop,nop,TS val 3768107 ecr 3533827,mptcp dss ack 177854901 seq 420621645 subseq 12853 len 1428 csum 0xb3ad], length 1428
10:40:40.000630 IP 112.26.1.1.39713 > 112.26.1.8.37253: Flags [.], seq 49981:51409, ack 1, win 893, options [nop,nop,TS val 3768716 ecr 3534435,mptcp dss ack 177854901 seq 420765873 subseq 49981 len 1428 csum 0x8413], length 1428
10:40:40.004189 IP 112.26.1.1.39713 > 112.26.1.8.37253: Flags [.], seq 49981:51409, ack 1, win 893, options [nop,nop,TS val 3768716 ecr 3534435,mptcp dss ack 177854901 seq 420765873 subseq 49981 len 1428 csum 0x8413], length 1428
10:40:40.039315 IP 112.26.1.1.39713 > 112.26.1.8.37253: Flags [.], seq 45697:47125, ack 1, win 893, options [nop,nop,TS val 3768211 ecr 3533969,mptcp dss ack 177854901 seq 420750165 subseq 45697 len 1428 csum 0xd2f3], length 1428
10:40:40.119980 IP 112.26.1.1.39713 > 112.26.1.8.37253: Flags [.], seq 47125:48553, ack 1, win 893, options [nop,nop,TS val 3768436 ecr 3534125,mptcp dss ack 177854901 seq 420753021 subseq 47125 len 1428 csum 0xf21c], length 1428
10:40:40.162739 IP 112.26.1.8.37253 > 112.26.1.1.39713: Flags [.], ack 12853, win 10905, options [nop,nop,TS val 3534685 ecr 3766256,nop,nop,sack 1 {14281:41413},mptcp dss ack 420621645], length 0
10:40:40.164837 IP 112.26.1.8.37253 > 112.26.1.1.39713: Flags [.], ack 12853, win 10905, options [nop,nop,TS val 3534685 ecr 3766256,nop,nop,sack 1 {14281:41413},mptcp dss ack 420621645], length 0
10:40:40.206632 IP 112.26.1.1.39713 > 112.26.1.8.37253: Flags [.], seq 51409:52837, ack 1, win 893, options [nop,nop,TS val 3769009 ecr 3534685,mptcp dss ack 177854901 seq 420768729 subseq 51409 len 1428 csum 0xb79d], length 1428
10:40:40.210663 IP 112.26.1.1.39713 > 112.26.1.8.37253: Flags [.], seq 51409:52837, ack 1, win 893, options [nop,nop,TS val 3769009 ecr 3534685,mptcp dss ack 177854901 seq 420768729 subseq 51409 len 1428 csum 0xb79d], length 1428
10:40:40.227497 IP 112.26.1.8.37253 > 112.26.1.1.39713: Flags [.], ack 12853, win 11087, options [nop,nop,TS val 3534755 ecr 3766256,nop,nop,sack 1 {14281:42841},mptcp dss ack 420621645], length 0
10:40:40.233290 IP 112.26.1.8.37253 > 112.26.1.1.39713: Flags [.], ack 12853, win 11087, options [nop,nop,TS val 3534755 ecr 3766256,nop,nop,sack 1 {14281:42841},mptcp dss ack 420621645], length 0
10:40:40.253933 IP 112.26.1.8.37253 > 112.26.1.1.39713: Flags [.], ack 12853, win 11179, options [nop,nop,TS val 3534819 ecr 3766256,nop,nop,sack 1 {14281:44269},mptcp dss ack 420621645], length 0
10:40:40.266310 IP 112.26.1.1.39713 > 112.26.1.8.37253: Flags [.], seq 52837:54265, ack 1, win 893, options [nop,nop,TS val 3769009 ecr 3534685,mptcp dss ack 177854901 seq 420770157 subseq 52837 len 1428 csum 0x5bef], length 1428
10:40:40.273955 IP 112.26.1.1.39713 > 112.26.1.8.37253: Flags [.], seq 52837:54265, ack 1, win 893, options [nop,nop,TS val 3769009 ecr 3534685,mptcp dss ack 177854901 seq 420770157 subseq 52837 len 1428 csum 0x5bef], length 1428
10:40:40.308212 IP 112.26.1.8.37253 > 112.26.1.1.39713: Flags [.], ack 12853, win 11179, options [nop,nop,TS val 3534819 ecr 3766256,nop,nop,sack 1 {14281:44269},mptcp dss ack 420621645], length 0
10:40:40.318529 IP 112.26.1.8.37253 > 112.26.1.1.39713: Flags [.], ack 12853, win 11270, options [nop,nop,TS val 3534871 ecr 3766256,nop,nop,sack 1 {14281:45697},mptcp dss ack 420621645], length 0
10:40:40.332374 IP 112.26.1.8.37253 > 112.26.1.1.39713: Flags [.], ack 12853, win 11270, options [nop,nop,TS val 3534871 ecr 3766256,nop,nop,sack 1 {14281:45697},mptcp dss ack 420621645], length 0
10:40:40.335208 IP 112.26.1.1.39713 > 112.26.1.8.37253: Flags [.], seq 54265:55693, ack 1, win 893, options [nop,nop,TS val 3769113 ecr 3534755,mptcp dss ack 177854901 seq 420773013 subseq 54265 len 1428 csum 0x6a57], length 1428
10:40:40.338733 IP 112.26.1.1.39713 > 112.26.1.8.37253: Flags [.], seq 54265:55693, ack 1, win 893, options [nop,nop,TS val 3769113 ecr 3534755,mptcp dss ack 177854901 seq 420773013 subseq 54265 len 1428 csum 0x6a57], length 1428
10:40:40.405292 IP 112.26.1.1.39713 > 112.26.1.8.37253: Flags [.], seq 48553:49981, ack 1, win 893, options [nop,nop,TS val 3768716 ecr 3534435,mptcp dss ack 177854901 seq 420764445 subseq 48553 len 1428 csum 0xead7], length 1428
10:40:40.420023 IP 112.26.1.1.39713 > 112.26.1.8.37253: Flags [.], seq 55693:57121, ack 1, win 893, options [nop,nop,TS val 3769137 ecr 3534819,mptcp dss ack 177854901 seq 420774441 subseq 55693 len 1428 csum 0xabc5], length 1428
10:40:40.445158 IP 112.26.1.1.39713 > 112.26.1.8.37253: Flags [.], seq 55693:57121, ack 1, win 893, options [nop,nop,TS val 3769137 ecr 3534819,mptcp dss ack 177854901 seq 420774441 subseq 55693 len 1428 csum 0xabc5], length 1428
10:40:40.475189 IP 112.26.1.1.39713 > 112.26.1.8.37253: Flags [.], seq 57121:58549, ack 1, win 893, options [nop,nop,TS val 3769164 ecr 3534871,mptcp dss ack 177854901 seq 420775869 subseq 57121 len 1428 csum 0x17d5], length 1428
10:40:40.482465 IP 112.26.1.8.37253 > 112.26.1.1.39713: Flags [.], ack 45697, win 11361, options [nop,nop,TS val 3534976 ecr 3768107,mptcp dss ack 420645921], length 0
