10:40:35.990848 IP 112.26.1.8.37253 > 112.26.1.1.39713: Flags [S], seq 3854583478, win 65535, options [mss 1460,sackOK,TS val 3530993 ecr 0,nop,wscale 6,mptcp join id 3 token 0x2fb3bb97 nonce 0xd0e43474], length 0
10:40:35.991201 IP 112.26.1.8.37253 > 112.26.1.1.39713: Flags [S], seq 3854583478, win 65535, options [mss 1460,sackOK,TS val 3530993 ecr 0,nop,wscale 6,mptcp join id 3 token 0x2fb3bb97 nonce 0xd0e43474], length 0
10:40:36.000404 IP 112.26.1.1.39713 > 112.26.1.8.37253: Flags [S.], seq 4191845760, ack 3854583479, win 28560, options [mss 1460,sackOK,TS val 3764799 ecr 3530993,nop,wscale 7,mptcp join id 3 hmac 0xe7aa1673b3db3f00 nonce 0x19c9929d], length 0
10:40:36.091010 IP 112.26.1.1.39713 > 112.26.1.8.37253: Flags [S.], seq 4191845760, ack 3854583479, win 28560, options [mss 1460,sackOK,TS val 3764799 ecr 3530993,nop,wscale 7,mptcp join id 3 hmac 0xe7aa1673b3db3f00 nonce 0x19c9929d], length 0
10:40:36.167462 IP 112.26.1.8.37253 > 112.26.1.1.39713: Flags [.], ack 1, win 5612, options [nop,nop,TS val 3531102 ecr 3764799,mptcp join hmac 0x2227837949b985e5465d1467ec3696c97113dc65], length 0
10:40:36.167714 IP 112.26.1.8.37253 > 112.26.1.1.39713: Flags [.], ack 1, win 5612, options [nop,nop,TS val 3531102 ecr 3764799,mptcp join hmac 0x2227837949b985e5465d1467ec3696c97113dc65], length 0
10:40:36.173235 IP 112.26.1.1.39713 > 112.26.1.8.37253: Flags [.], ack 1, win 447, options [nop,nop,TS val 3764974 ecr 3531102,mptcp dss ack 177854901], length 0
10:40:36.207002 IP 112.26.1.1.39713 > 112.26.1.8.37253: Flags [.], ack 1, win 447, options [nop,nop,TS val 3764974 ecr 3531102,mptcp dss ack 177854901], length 0
10:40:36.248907 IP 112.26.1.1.39713 > 112.26.1.8.37253: Flags [.], seq 1:1429, ack 1, win 447, options [nop,nop,TS val 3764974 ecr 3531102,mptcp dss ack 177854901 seq 420608793 subseq 1 len 1428 csum 0xe8a6], length 1428
10:40:36.280196 IP 112.26.1.1.39713 > 112.26.1.8.37253: Flags [.], seq 1:1429, ack 1, win 447, options [nop,nop,TS val 3764974 ecr 3531102,mptcp dss ack 177854901 seq 420608793 subseq 1 len 1428 csum 0xe8a6], length 1428
10:40:36.345995 IP 112.26.1.1.39713 > 112.26.1.8.37253: Flags [.], seq 1429:2857, ack 1, win 447, options [nop,nop,TS val 3764974 ecr 3531102,mptcp dss ack 177854901 seq 420610221 subseq 1429 len 1428 csum 0xa1a2], length 1428
10:40:36.361164 IP 112.26.1.8.37253 > 112.26.1.1.39713: Flags [.], ack 1429, win 7072, options [nop,nop,TS val 3531285 ecr 3764974,mptcp dss ack 420603081], length 0
10:40:36.361358 IP 112.26.1.8.37253 > 112.26.1.1.39713: Flags [.], ack 1429, win 7072, options [nop,nop,TS val 3531285 ecr 3764974,mptcp dss ack 420603081], length 0
10:40:36.398326 IP 112.26.1.1.39713 > 112.26.1.8.37253: Flags [.], seq 2857:4285, ack 1, win 447, options [nop,nop,TS val 3764976 ecr 3531102,mptcp dss ack 177854901 seq 420611649 subseq 2857 len 1428 csum 0xebba], length 1428
10:40:36.426977 IP 112.26.1.1.39713 > 112.26.1.8.37253: Flags [.], seq 1429:2857, ack 1, win 447, options [nop,nop,TS val 3764974 ecr 3531102,mptcp dss ack 177854901 seq 420610221 subseq 1429 len 1428 csum 0xa1a2], length 1428
10:40:36.499029 IP 112.26.1.1.39713 > 112.26.1.8.37253: Flags [.], seq 4285:5713, ack 1, win 447, options [nop,nop,TS val 3764976 ecr 3531102,mptcp dss ack 177854901 seq 420613077 subseq 4285 len 1428 csum 0xf0a4], length 1428
10:40:36.548345 IP 112.26.1.8.37253 > 112.26.1.1.39713: Flags [.], ack 2857, win 7255, options [nop,nop,TS val 3531433 ecr 3764974,mptcp dss ack 420605937], length 0
10:40:36.548658 IP 112.26.1.8.37253 > 112.26.1.1.39713: Flags [.], ack 2857, win 7255, options [nop,nop,TS val 3531433 ecr 3764974,mptcp dss ack 420605937], length 0
10:40:36.551883 IP 112.26.1.1.39713 > 112.26.1.8.37253: Flags [.], seq 2857:4285, ack 1, win 447, options [nop,nop,TS val 3764976 ecr 3531102,mptcp dss ack 177854901 seq 420611649 subseq 2857 len 1428 csum 0xebba], length 1428
10:40:36.571157 IP 112.26.1.1.39713 > 112.26.1.8.37253: Flags [.], seq 5713:7141, ack 1, win 447, options [nop,nop,TS val 3764976 ecr 3531102,mptcp dss ack 177854901 seq 420614505 subseq 5713 len 1428 csum 0xbbdf], length 1428
10:40:36.588193 IP 112.26.1.1.39713 > 112.26.1.8.37253: Flags [.], seq 4285:5713, ack 1, win 447, options [nop,nop,TS val 3764976 ecr 3531102,mptcp dss ack 177854901 seq 420613077 subseq 4285 len 1428 csum 0xf0a4], length 1428
10:40:36.604817 IP 112.26.1.1.39713 > 112.26.1.8.37253: Flags [.], seq 7141:8569, ack 1, win 447, options [nop,nop,TS val 3764976 ecr 3531102,mptcp dss ack 177854901 seq 420615933 subseq 7141 len 1428 csum 0xe36b], length 1428
10:40:36.702014 IP 112.26.1.1.39713 > 112.26.1.8.37253: Flags [.], seq 8569:9997, ack 1, win 447, options [nop,nop,TS val 3764976 ecr 3531102,mptcp dss ack 177854901 seq 420617361 subseq 8569 len 1428 csum 0x773e], length 1428
10:40:36.712033 IP 112.26.1.8.37253 > 112.26.1.1.39713: Flags [.], ack 4285, win 7346, options [nop,nop,TS val 3531563 ecr 3764976,mptcp dss ack 420607365], length 0
10:40:36.712281 IP 112.26.1.8.37253 > 112.26.1.1.39713: Flags [.], ack 4285, win 7346, options [nop,nop,TS val 3531563 ecr 3764976,mptcp dss ack 420607365], length 0
10:40:36.747304 IP 112.26.1.8.37253 > 112.26.1.1.39713: Flags [.], ack 5713, win 7437, options [nop,nop,TS val 3531599 ecr 3764976,mptcp dss ack 420614505], length 0
10:40:36.747565 IP 112.26.1.8.37253 > 112.26.1.1.39713: Flags [.], ack 5713, win 7437, options [nop,nop,TS val 3531599 ecr 3764976,mptcp dss ack 420614505], length 0
10:40:36.781484 IP 112.26.1.1.39713 > 112.26.1.8.37253: Flags [.], seq 14281:15709, ack 1, win 893, options [nop,nop,TS val 3765168 ecr 3531285,mptcp dss ack 177854901 seq 420651633 subseq 14281 len 1428 csum 0x9398], length 1428
10:40:36.805465 IP 112.26.1.1.39713 > 112.26.1.8.37253: Flags [.], seq 5713:7141, ack 1, win 447, options [nop,nop,TS val 3764976 ecr 3531102,mptcp dss ack 177854901 seq 420614505 subseq 5713 len 1428 csum 0xbbdf], length 1428
10:40:36.846487 IP 112.26.1.1.39713 > 112.26.1.8.37253: Flags [.], seq 15709:17137, ack 1, win 893, options [nop,nop,TS val 3765168 ecr 3531285,mptcp dss ack 177854901 seq 420653061 subseq 15709 len 1428 csum 0x4d13], length 1428
10:40:36.869988 IP 112.26.1.8.37253 > 112.26.1.1.39713: Flags [.], ack 7141, win 7574, options [nop,nop,TS val 3531812 ecr 3764976,mptcp dss ack 420615933], length 0
10:40:36.870179 IP 112.26.1.8.37253 > 112.26.1.1.39713: Flags [.], ack 7141, win 7574, options [nop,nop,TS val 3531812 ecr 3764976,mptcp dss ack 420615933], length 0
10:40:36.911962 IP 112.26.1.1.39713 > 112.26.1.8.37253: Flags [.], seq 17137:18565, ack 1, win 893, options [nop,nop,TS val 3765355 ecr 3531433,mptcp dss ack 177854901 seq 420661629 subseq 17137 len 1428 csum 0xc60d], length 1428
10:40:36.951731 IP 112.26.1.1.39713 > 112.26.1.8.37253: Flags [.], seq 7141:8569, ack 1, win 447, options [nop,nop,TS val 3764976 ecr 3531102,mptcp dss ack 177854901 seq 420615933 subseq 7141 len 1428 csum 0xe36b], length 1428
10:40:37.003194 IP 112.26.1.1.39713 > 112.26.1.8.37253: Flags [.], seq 18565:19993, ack 1, win 893, options [nop,nop,TS val 3765355 ecr 3531433,mptcp dss ack 177854901 seq 420663057 subseq 18565 len 1428 csum 0x7628], length 1428
10:40:37.015134 IP 112.26.1.1.39713 > 112.26.1.8.37253: Flags [.], seq 8569:9997, ack 1, win 447, options [nop,nop,TS val 3764976 ecr 3531102,mptcp dss ack 177854901 seq 420617361 subseq 8569 len 1428 csum 0x773e], length 1428
10:40:37.047574 IP 112.26.1.1.39713 > 112.26.1.8.37253: Flags [.], seq 19993:21421, ack 1, win 893, options [nop,nop,TS val 3765519 ecr 3531563,mptcp dss ack 177854901 seq 420670197 subseq 19993 len 1428 csum 0x5ed3], length 1428
10:40:37.112970 IP 112.26.1.1.39713 > 112.26.1.8.37253: Flags [.], seq 21421:22849, ack 1, win 893, options [nop,nop,TS val 3765519 ecr 3531563,mptcp dss ack 177854901 seq 420671625 subseq 21421 len 1428 csum 0x4ff1], length 1428
10:40:37.145915 IP 112.26.1.8.37253 > 112.26.1.1.39713: Flags [.], ack 8569, win 7711, options [nop,nop,TS val 3531933 ecr 3764976,mptcp dss ack 420617361], length 0
10:40:37.146222 IP 112.26.1.8.37253 > 112.26.1.1.39713: Flags [.], ack 8569, win 7711, options [nop,nop,TS val 3531933 ecr 3764976,mptcp dss ack 420617361], length 0
10:40:37.175110 IP 112.26.1.1.39713 > 112.26.1.8.37253: Flags [.], seq 22849:24277, ack 1, win 893, options [nop,nop,TS val 3765575 ecr 3531599,mptcp dss ack 177854901 seq 420675909 subseq 22849 len 1428 csum 0x935b], length 1428
10:40:37.205115 IP 112.26.1.8.37253 > 112.26.1.1.39713: Flags [.], ack 9997, win 7848, options [nop,nop,TS val 3532026 ecr 3764976,mptcp dss ack 420618789], length 0
10:40:37.205403 IP 112.26.1.8.37253 > 112.26.1.1.39713: Flags [.], ack 9997, win 7848, options [nop,nop,TS val 3532026 ecr 3764976,mptcp dss ack 420618789], length 0
10:40:37.218245 IP 112.26.1.1.39713 > 112.26.1.8.37253: Flags [.], seq 24277:25705, ack 1, win 893, options [nop,nop,TS val 3765575 ecr 3531599,mptcp dss ack 177854901 seq 420677337 subseq 24277 len 1428 csum 0x77db], length 1428
10:40:37.239314 IP 112.26.1.1.39713 > 112.26.1.8.37253: Flags [.], seq 14281:15709, ack 1, win 893, options [nop,nop,TS val 3765168 ecr 3531285,mptcp dss ack 177854901 seq 420651633 subseq 14281 len 1428 csum 0x9398], length 1428
10:40:37.265177 IP 112.26.1.1.39713 > 112.26.1.8.37253: Flags [.], seq 25705:27133, ack 1, win 893, options [nop,nop,TS val 3765691 ecr 3531812,mptcp dss ack 177854901 seq 420681621 subseq 25705 len 1428 csum 0xe076], length 1428
10:40:37.321267 IP 112.26.1.1.39713 > 112.26.1.8.37253: Flags [.], seq 15709:17137, ack 1, win 893, options [nop,nop,TS val 3765168 ecr 3531285,mptcp dss ack 177854901 seq 420653061 subseq 15709 len 1428 csum 0x4d13], length 1428
10:40:37.346518 IP 112.26.1.1.39713 > 112.26.1.8.37253: Flags [.], seq 27133:28561, ack 1, win 893, options [nop,nop,TS val 3765691 ecr 3531812,mptcp dss ack 177854901 seq 420683049 subseq 27133 len 1428 csum 0xb085], length 1428
10:40:37.450147 IP 112.26.1.8.37253 > 112.26.1.1.39713: Flags [.], ack 9997, win 8213, options [nop,nop,TS val 3532332 ecr 3764976,nop,nop,sack 1 {14281:17137},mptcp dss ack 420618789], length 0
10:40:37.450442 IP 112.26.1.8.37253 > 112.26.1.1.39713: Flags [.], ack 9997, win 8213, options [nop,nop,TS val 3532332 ecr 3764976,nop,nop,sack 1 {14281:17137},mptcp dss ack 420618789], length 0
10:40:37.500328 IP 112.26.1.1.39713 > 112.26.1.8.37253: Flags [.], seq 28561:29989, ack 1, win 893, options [nop,nop,TS val 3765952 ecr 3531933,mptcp dss ack 177854901 seq 420691617 subseq 28561 len 1428 csum 0x4853], length 1428
10:40:37.504232 IP 112.26.1.1.39713 > 112.26.1.8.37253: Flags [.], seq 29989:31417, ack 1, win 893, options [nop,nop,TS val 3765952 ecr 3531933,mptcp dss ack 177854901 seq 420693045 subseq 29989 len 1428 csum 0xf883], length 1428
10:40:37.515688 IP 112.26.1.1.39713 > 112.26.1.8.37253: Flags [.], seq 17137:18565, ack 1, win 893, options [nop,nop,TS val 3765355 ecr 3531433,mptcp dss ack 177854901 seq 420661629 subseq 17137 len 1428 csum 0xc60d], length 1428
10:40:37.562438 IP 112.26.1.1.39713 > 112.26.1.8.37253: Flags [.], seq 31417:32845, ack 1, win 893, options [nop,nop,TS val 3766012 ecr 3532026,mptcp dss ack 177854901 seq 420694473 subseq 31417 len 1428 csum 0xbca4], length 1428
10:40:37.592157 IP 112.26.1.1.39713 > 112.26.1.8.37253: Flags [.], seq 18565:19993, ack 1, win 893, options [nop,nop,TS val 3765355 ecr 3531433,mptcp dss ack 177854901 seq 420663057 subseq 18565 len 1428 csum 0x7628], length 1428
10:40:37.620703 IP 112.26.1.1.39713 > 112.26.1.8.37253: Flags [.], seq 32845:34273, ack 1, win 893, options [nop,nop,TS val 3766012 ecr 3532026,mptcp dss ack 177854901 seq 420695901 subseq 32845 len 1428 csum 0x8b71], length 1428
10:40:37.669249 IP 112.26.1.8.37253 > 112.26.1.1.39713: Flags [.], ack 9997, win 8487, options [nop,nop,TS val 3532526 ecr 3764976,nop,nop,sack 1 {14281:18565},mptcp dss ack 420618789], length 0
10:40:37.669557 IP 112.26.1.8.37253 > 112.26.1.1.39713: Flags [.], ack 9997, win 8487, options [nop,nop,TS val 3532526 ecr 3764976,nop,nop,sack 1 {14281:18565},mptcp dss ack 420618789], length 0
10:40:37.691210 IP 112.26.1.1.39713 > 112.26.1.8.37253: Flags [P.], seq 9997:11425, ack 1, win 893, options [nop,nop,TS val 3766256 ecr 3532332,mptcp dss ack 177854901 seq 420618789 subseq 9997 len 1428 csum 0x21], length 1428
10:40:37.731230 IP 112.26.1.1.39713 > 112.26.1.8.37253: Flags [.], seq 19993:21421, ack 1, win 893, options [nop,nop,TS val 3765519 ecr 3531563,mptcp dss ack 177854901 seq 420670197 subseq 19993 len 1428 csum 0x5ed3], length 1428
10:40:37.765405 IP 112.26.1.1.39713 > 112.26.1.8.37253: Flags [.], seq 11425:12853, ack 1, win 893, options [nop,nop,TS val 3766256 ecr 3532332,mptcp dss ack 177854901 seq 420620217 subseq 11425 len 1428 csum 0x2191], length 1428
10:40:37.784607 IP 112.26.1.8.37253 > 112.26.1.1.39713: Flags [.], ack 9997, win 8578, options [nop,nop,TS val 3532603 ecr 3764976,nop,nop,sack 1 {14281:19993},mptcp dss ack 420618789], length 0
10:40:37.784899 IP 112.26.1.8.37253 > 112.26.1.1.39713: Flags [.], ack 9997, win 8578, options [nop,nop,TS val 3532603 ecr 3764976,nop,nop,sack 1 {14281:19993},mptcp dss ack 420618789], length 0
10:40:37.872908 IP 112.26.1.1.39713 > 112.26.1.8.37253: Flags [.], seq 12853:14281, ack 1, win 893, options [nop,nop,TS val 3766593 ecr 3532603,mptcp dss ack 177854901 seq 420621645 subseq 12853 len 1428 csum 0xb3ad], length 1428
10:40:37.882940 IP 112.26.1.1.39713 > 112.26.1.8.37253: Flags [.], seq 22849:24277, ack 1, win 893, options [nop,nop,TS val 3765575 ecr 3531599,mptcp dss ack 177854901 seq 420675909 subseq 22849 len 1428 csum 0x935b], length 1428
10:40:37.939963 IP 112.26.1.1.39713 > 112.26.1.8.37253: Flags [.], seq 24277:25705, ack 1, win 893, options [nop,nop,TS val 3765575 ecr 3531599,mptcp dss ack 177854901 seq 420677337 subseq 24277 len 1428 csum 0x77db], length 1428
10:40:38.101604 IP 112.26.1.8.37253 > 112.26.1.1.39713: Flags [.], ack 9997, win 8715, options [nop,nop,TS val 3532739 ecr 3764976,nop,nop,sack 1 {14281:21421},mptcp dss ack 420618789], length 0
10:40:38.101868 IP 112.26.1.8.37253 > 112.26.1.1.39713: Flags [.], ack 9997, win 8715, options [nop,nop,TS val 3532739 ecr 3764976,nop,nop,sack 1 {14281:21421},mptcp dss ack 420618789], length 0
10:40:38.170231 IP 112.26.1.1.39713 > 112.26.1.8.37253: Flags [.], seq 27133:28561, ack 1, win 893, options [nop,nop,TS val 3765691 ecr 3531812,mptcp dss ack 177854901 seq 420683049 subseq 27133 len 1428 csum 0xb085], length 1428
10:40:38.208822 IP 112.26.1.8.37253 > 112.26.1.1.39713: Flags [.], ack 9997, win 8806, options [nop,nop,TS val 3532877 ecr 3764976,nop,nop,sack 2 {22849:24277}{14281:21421},mptcp dss ack 420618789], length 0
10:40:38.209079 IP 112.26.1.8.37253 > 112.26.1.1.39713: Flags [.], ack 9997, win 8806, options [nop,nop,TS val 3532877 ecr 3764976,nop,nop,sack 2 {22849:24277}{14281:21421},mptcp dss ack 420618789], length 0
10:40:38.216066 IP 112.26.1.1.39713 > 112.26.1.8.37253: Flags [.], seq 34273:35701, ack 1, win 893, options [nop,nop,TS val 3767015 ecr 3532739,mptcp dss ack 177854901 seq 420730173 subseq 34273 len 1428 csum 0x6c74], length 1428
10:40:38.275348 IP 112.26.1.1.39713 > 112.26.1.8.37253: Flags [.], seq 28561:29989, ack 1, win 893, options [nop,nop,TS val 3765952 ecr 3531933,mptcp dss ack 177854901 seq 420691617 subseq 28561 len 1428 csum 0x4853], length 1428
10:40:38.348560 IP 112.26.1.8.37253 > 112.26.1.1.39713: Flags [.], ack 9997, win 8897, options [nop,nop,TS val 3532951 ecr 3764976,nop,nop,sack 2 {22849:25705}{14281:21421},mptcp dss ack 420618789], length 0
10:40:38.348854 IP 112.26.1.8.37253 > 112.26.1.1.39713: Flags [.], ack 9997, win 8897, options [nop,nop,TS val 3532951 ecr 3764976,nop,nop,sack 2 {22849:25705}{14281:21421},mptcp dss ack 420618789], length 0
10:40:38.360997 IP 112.26.1.1.39713 > 112.26.1.8.37253: Flags [.], seq 21421:22849, ack 1, win 893, options [nop,nop,TS val 3767156 ecr 3532951,mptcp dss ack 177854901 seq 420671625 subseq 21421 len 1428 csum 0x4ff1], length 1428
10:40:38.394724 IP 112.26.1.1.39713 > 112.26.1.8.37253: Flags [.], seq 29989:31417, ack 1, win 893, options [nop,nop,TS val 3765952 ecr 3531933,mptcp dss ack 177854901 seq 420693045 subseq 29989 len 1428 csum 0xf883], length 1428
10:40:38.486382 IP 112.26.1.1.39713 > 112.26.1.8.37253: Flags [.], seq 31417:32845, ack 1, win 893, options [nop,nop,TS val 3766012 ecr 3532026,mptcp dss ack 177854901 seq 420694473 subseq 31417 len 1428 csum 0xbca4], length 1428
10:40:38.544375 IP 112.26.1.1.39713 > 112.26.1.8.37253: Flags [.], seq 32845:34273, ack 1, win 893, options [nop,nop,TS val 3766012 ecr 3532026,mptcp dss ack 177854901 seq 420695901 subseq 32845 len 1428 csum 0x8b71], length 1428
10:40:38.582288 IP 112.26.1.1.39713 > 112.26.1.8.37253: Flags [P.], seq 9997:11425, ack 1, win 893, options [nop,nop,TS val 3766256 ecr 3532332,mptcp dss ack 177854901 seq 420618789 subseq 9997 len 1428 csum 0x21], length 1428
10:40:38.641067 IP 112.26.1.8.37253 > 112.26.1.1.39713: Flags [.], ack 9997, win 9171, options [nop,nop,TS val 3533181 ecr 3764976,nop,nop,sack 2 {27133:28561}{22849:25705},mptcp dss ack 420618789], length 0
10:40:38.641362 IP 112.26.1.8.37253 > 112.26.1.1.39713: Flags [.], ack 9997, win 9171, options [nop,nop,TS val 3533181 ecr 3764976,nop,nop,sack 2 {27133:28561}{22849:25705},mptcp dss ack 420618789], length 0
10:40:38.656841 IP 112.26.1.1.39713 > 112.26.1.8.37253: Flags [.], seq 25705:27133, ack 1, win 893, options [nop,nop,TS val 3767449 ecr 3533181,mptcp dss ack 177854901 seq 420681621 subseq 25705 len 1428 csum 0xe076], length 1428
10:40:38.698573 IP 112.26.1.1.39713 > 112.26.1.8.37253: Flags [.], seq 11425:12853, ack 1, win 893, options [nop,nop,TS val 3766256 ecr 3532332,mptcp dss ack 177854901 seq 420620217 subseq 11425 len 1428 csum 0x2191], length 1428
10:40:38.759351 IP 112.26.1.8.37253 > 112.26.1.1.39713: Flags [.], ack 9997, win 9262, options [nop,nop,TS val 3533286 ecr 3764976,nop,nop,sack 2 {27133:29989}{22849:25705},mptcp dss ack 420618789], length 0
10:40:38.759562 IP 112.26.1.8.37253 > 112.26.1.1.39713: Flags [.], ack 9997, win 9262, options [nop,nop,TS val 3533286 ecr 3764976,nop,nop,sack 2 {27133:29989}{22849:25705},mptcp dss ack 420618789], length 0
10:40:38.787015 IP 112.26.1.1.39713 > 112.26.1.8.37253: Flags [.], seq 35701:37129, ack 1, win 893, options [nop,nop,TS val 3767588 ecr 3533286,mptcp dss ack 177854901 seq 420740169 subseq 35701 len 1428 csum 0xc5a2], length 1428
10:40:38.815640 IP 112.26.1.1.39713 > 112.26.1.8.37253: Flags [.], seq 34273:35701, ack 1, win 893, options [nop,nop,TS val 3767015 ecr 3532739,mptcp dss ack 177854901 seq 420730173 subseq 34273 len 1428 csum 0x6c74], length 1428
10:40:38.888537 IP 112.26.1.8.37253 > 112.26.1.1.39713: Flags [.], ack 9997, win 9445, options [nop,nop,TS val 3533405 ecr 3764976,nop,nop,sack 2 {27133:31417}{22849:25705},mptcp dss ack 420618789], length 0
10:40:38.888719 IP 112.26.1.8.37253 > 112.26.1.1.39713: Flags [.], ack 9997, win 9445, options [nop,nop,TS val 3533405 ecr 3764976,nop,nop,sack 2 {27133:31417}{22849:25705},mptcp dss ack 420618789], length 0
10:40:38.908625 IP 112.26.1.1.39713 > 112.26.1.8.37253: Flags [.], seq 37129:38557, ack 1, win 893, options [nop,nop,TS val 3767710 ecr 3533405,mptcp dss ack 177854901 seq 420741597 subseq 37129 len 1428 csum 0x722e], length 1428
10:40:38.957888 IP 112.26.1.1.39713 > 112.26.1.8.37253: Flags [.], seq 21421:22849, ack 1, win 893, options [nop,nop,TS val 3767156 ecr 3532951,mptcp dss ack 177854901 seq 420671625 subseq 21421 len 1428 csum 0x4ff1], length 1428
10:40:39.010463 IP 112.26.1.8.37253 > 112.26.1.1.39713: Flags [.], ack 9997, win 9582, options [nop,nop,TS val 3533556 ecr 3764976,nop,nop,sack 2 {27133:34273}{22849:25705},mptcp dss ack 420618789], length 0
10:40:39.010643 IP 112.26.1.8.37253 > 112.26.1.1.39713: Flags [.], ack 9997, win 9582, options [nop,nop,TS val 3533556 ecr 3764976,nop,nop,sack 2 {27133:34273}{22849:25705},mptcp dss ack 420618789], length 0
10:40:39.052219 IP 112.26.1.8.37253 > 112.26.1.1.39713: Flags [.], ack 11425, win 9719, options [nop,nop,TS val 3533594 ecr 3766256,nop,nop,sack 2 {27133:34273}{22849:25705},mptcp dss ack 420620217], length 0
10:40:39.052369 IP 112.26.1.8.37253 > 112.26.1.1.39713: Flags [.], ack 11425, win 9719, options [nop,nop,TS val 3533594 ecr 3766256,nop,nop,sack 2 {27133:34273}{22849:25705},mptcp dss ack 420620217], length 0
10:40:39.083894 IP 112.26.1.1.39713 > 112.26.1.8.37253: Flags [.], seq 38557:39985, ack 1, win 893, options [nop,nop,TS val 3767873 ecr 3533556,mptcp dss ack 177854901 seq 420743025 subseq 38557 len 1428 csum 0x964a], length 1428
10:40:39.119656 IP 112.26.1.1.39713 > 112.26.1.8.37253: Flags [.], seq 25705:27133, ack 1, win 893, options [nop,nop,TS val 3767449 ecr 3533181,mptcp dss ack 177854901 seq 420681621 subseq 25705 len 1428 csum 0xe076], length 1428
10:40:39.141676 IP 112.26.1.1.39713 > 112.26.1.8.37253: Flags [.], seq 39985:41413, ack 1, win 893, options [nop,nop,TS val 3767873 ecr 3533556,mptcp dss ack 177854901 seq 420744453 subseq 39985 len 1428 csum 0x9ec9], length 1428
10:40:39.174877 IP 112.26.1.8.37253 > 112.26.1.1.39713: Flags [.], ack 12853, win 9810, options [nop,nop,TS val 3533710 ecr 3766256,nop,nop,sack 2 {27133:34273}{22849:25705},mptcp dss ack 420621645], length 0
10:40:39.175138 IP 112.26.1.8.37253 > 112.26.1.1.39713: Flags [.], ack 12853, win 9810, options [nop,nop,TS val 3533710 ecr 3766256,nop,nop,sack 2 {27133:34273}{22849:25705},mptcp dss ack 420621645], length 0
10:40:39.236699 IP 112.26.1.1.39713 > 112.26.1.8.37253: Flags [.], seq 41413:42841, ack 1, win 893, options [nop,nop,TS val 3767873 ecr 3533594,mptcp dss ack 177854901 seq 420745881 subseq 41413 len 1428 csum 0x23f8], length 1428
10:40:39.292197 IP 112.26.1.1.39713 > 112.26.1.8.37253: Flags [.], seq 42841:44269, ack 1, win 893, options [nop,nop,TS val 3767873 ecr 3533594,mptcp dss ack 177854901 seq 420747309 subseq 42841 len 1428 csum 0xf8a1], length 1428
10:40:39.300369 IP 112.26.1.8.37253 > 112.26.1.1.39713: Flags [.], ack 12853, win 9992, options [nop,nop,TS val 3533827 ecr 3766256,nop,nop,sack 2 {27133:35701}{22849:25705},mptcp dss ack 420621645], length 0
10:40:39.300564 IP 112.26.1.8.37253 > 112.26.1.1.39713: Flags [.], ack 12853, win 9992, options [nop,nop,TS val 3533827 ecr 3766256,nop,nop,sack 2 {27133:35701}{22849:25705},mptcp dss ack 420621645], length 0
10:40:39.366927 IP 112.26.1.8.37253 > 112.26.1.1.39713: Flags [.], ack 12853, win 10129, options [nop,nop,TS val 3533969 ecr 3766256,nop,nop,sack 2 {14281:25705}{27133:35701},mptcp dss ack 420621645], length 0
10:40:39.367197 IP 112.26.1.8.37253 > 112.26.1.1.39713: Flags [.], ack 12853, win 10129, options [nop,nop,TS val 3533969 ecr 3766256,nop,nop,sack 2 {14281:25705}{27133:35701},mptcp dss ack 420621645], length 0
10:40:39.379158 IP 112.26.1.1.39713 > 112.26.1.8.37253: Flags [.], seq 44269:45697, ack 1, win 893, options [nop,nop,TS val 3767982 ecr 3533710,mptcp dss ack 177854901 seq 420748737 subseq 44269 len 1428 csum 0x5268], length 1428
10:40:39.399858 IP 112.26.1.1.39713 > 112.26.1.8.37253: Flags [.], seq 12853:14281, ack 1, win 893, options [nop,nop,TS val 3768107 ecr 3533827,mptcp dss ack 177854901 seq 420621645 subseq 12853 len 1428 csum 0xb3ad], length 1428
10:40:39.427730 IP 112.26.1.1.39713 > 112.26.1.8.37253: Flags [.], seq 37129:38557, ack 1, win 893, options [nop,nop,TS val 3767710 ecr 3533405,mptcp dss ack 177854901 seq 420741597 subseq 37129 len 1428 csum 0x722e], length 1428
10:40:39.481580 IP 112.26.1.1.39713 > 112.26.1.8.37253: Flags [.], seq 45697:47125, ack 1, win 893, options [nop,nop,TS val 3768211 ecr 3533969,mptcp dss ack 177854901 seq 420750165 subseq 45697 len 1428 csum 0xd2f3], length 1428
10:40:39.503752 IP 112.26.1.1.39713 > 112.26.1.8.37253: Flags [.], seq 38557:39985, ack 1, win 893, options [nop,nop,TS val 3767873 ecr 3533556,mptcp dss ack 177854901 seq 420743025 subseq 38557 len 1428 csum 0x964a], length 1428
10:40:39.608974 IP 112.26.1.8.37253 > 112.26.1.1.39713: Flags [.], ack 12853, win 10357, options [nop,nop,TS val 3534125 ecr 3766256,nop,nop,sack 1 {14281:35701},mptcp dss ack 420621645], length 0
10:40:39.609157 IP 112.26.1.8.37253 > 112.26.1.1.39713: Flags [.], ack 12853, win 10357, options [nop,nop,TS val 3534125 ecr 3766256,nop,nop,sack 1 {14281:35701},mptcp dss ack 420621645], length 0
10:40:39.633541 IP 112.26.1.1.39713 > 112.26.1.8.37253: Flags [.], seq 47125:48553, ack 1, win 893, options [nop,nop,TS val 3768436 ecr 3534125,mptcp dss ack 177854901 seq 420753021 subseq 47125 len 1428 csum 0xf21c], length 1428
10:40:39.673949 IP 112.26.1.1.39713 > 112.26.1.8.37253: Flags [.], seq 39985:41413, ack 1, win 893, options [nop,nop,TS val 3767873 ecr 3533556,mptcp dss ack 177854901 seq 420744453 subseq 39985 len 1428 csum 0x9ec9], length 1428
10:40:39.744164 IP 112.26.1.1.39713 > 112.26.1.8.37253: Flags [.], seq 41413:42841, ack 1, win 893, options [nop,nop,TS val 3767873 ecr 3533594,mptcp dss ack 177854901 seq 420745881 subseq 41413 len 1428 csum 0x23f8], length 1428
10:40:39.808545 IP 112.26.1.1.39713 > 112.26.1.8.37253: Flags [.], seq 42841:44269, ack 1, win 893, options [nop,nop,TS val 3767873 ecr 3533594,mptcp dss ack 177854901 seq 420747309 subseq 42841 len 1428 csum 0xf8a1], length 1428
10:40:39.860084 IP 112.26.1.1.39713 > 112.26.1.8.37253: Flags [.], seq 44269:45697, ack 1, win 893, options [nop,nop,TS val 3767982 ecr 3533710,mptcp dss ack 177854901 seq 420748737 subseq 44269 len 1428 csum 0x5268], length 1428
10:40:39.906312 IP 112.26.1.8.37253 > 112.26.1.1.39713: Flags [.], ack 12853, win 10722, options [nop,nop,TS val 3534435 ecr 3766256,nop,nop,sack 1 {14281:38557},mptcp dss ack 420621645], length 0
10:40:39.906612 IP 112.26.1.8.37253 > 112.26.1.1.39713: Flags [.], ack 12853, win 10722, options [nop,nop,TS val 3534435 ecr 3766256,nop,nop,sack 1 {14281:38557},mptcp dss ack 420621645], length 0
10:40:39.920402 IP 112.26.1.1.39713 > 112.26.1.8.37253: Flags [.], seq 48553:49981, ack 1, win 893, options [nop,nop,TS val 3768716 ecr 3534435,mptcp dss ack 177854901 seq 420764445 subseq 48553 len 1428 csum 0xead7], length 1428
10:40:39.965722 IP 112.26.1.1.39713 > 112.26.1.8.37253: Flags [.], seq 12853:14281, ack 1, win 893, options [nop,nop,TS val 3768107 ecr 3533827,mptcp dss ack 177854901 seq 420621645 subseq 12853 len 1428 csum 0xb3ad], length 1428
10:40:40.000755 IP 112.26.1.1.39713 > 112.26.1.8.37253: Flags [.], seq 49981:51409, ack 1, win 893, options [nop,nop,TS val 3768716 ecr 3534435,mptcp dss ack 177854901 seq 420765873 subseq 49981 len 1428 csum 0x8413], length 1428
10:40:40.039795 IP 112.26.1.1.39713 > 112.26.1.8.37253: Flags [.], seq 45697:47125, ack 1, win 893, options [nop,nop,TS val 3768211 ecr 3533969,mptcp dss ack 177854901 seq 420750165 subseq 45697 len 1428 csum 0xd2f3], length 1428
10:40:40.120460 IP 112.26.1.1.39713 > 112.26.1.8.37253: Flags [.], seq 47125:48553, ack 1, win 893, options [nop,nop,TS val 3768436 ecr 3534125,mptcp dss ack 177854901 seq 420753021 subseq 47125 len 1428 csum 0xf21c], length 1428
10:40:40.163196 IP 112.26.1.8.37253 > 112.26.1.1.39713: Flags [.], ack 12853, win 10905, options [nop,nop,TS val 3534685 ecr 3766256,nop,nop,sack 1 {14281:41413},mptcp dss ack 420621645], length 0
10:40:40.163509 IP 112.26.1.8.37253 > 112.26.1.1.39713: Flags [.], ack 12853, win 10905, options [nop,nop,TS val 3534685 ecr 3766256,nop,nop,sack 1 {14281:41413},mptcp dss ack 420621645], length 0
10:40:40.206758 IP 112.26.1.1.39713 > 112.26.1.8.37253: Flags [.], seq 51409:52837, ack 1, win 893, options [nop,nop,TS val 3769009 ecr 3534685,mptcp dss ack 177854901 seq 420768729 subseq 51409 len 1428 csum 0xb79d], length 1428
10:40:40.227957 IP 112.26.1.8.37253 > 112.26.1.1.39713: Flags [.], ack 12853, win 11087, options [nop,nop,TS val 3534755 ecr 3766256,nop,nop,sack 1 {14281:42841},mptcp dss ack 420621645], length 0
10:40:40.228246 IP 112.26.1.8.37253 > 112.26.1.1.39713: Flags [.], ack 12853, win 11087, options [nop,nop,TS val 3534755 ecr 3766256,nop,nop,sack 1 {14281:42841},mptcp dss ack 420621645], length 0
10:40:40.254213 IP 112.26.1.8.37253 > 112.26.1.1.39713: Flags [.], ack 12853, win 11179, options [nop,nop,TS val 3534819 ecr 3766256,nop,nop,sack 1 {14281:44269},mptcp dss ack 420621645], length 0
10:40:40.254524 IP 112.26.1.8.37253 > 112.26.1.1.39713: Flags [.], ack 12853, win 11179, options [nop,nop,TS val 3534819 ecr 3766256,nop,nop,sack 1 {14281:44269},mptcp dss ack 420621645], length 0
10:40:40.266442 IP 112.26.1.1.39713 > 112.26.1.8.37253: Flags [.], seq 52837:54265, ack 1, win 893, options [nop,nop,TS val 3769009 ecr 3534685,mptcp dss ack 177854901 seq 420770157 subseq 52837 len 1428 csum 0x5bef], length 1428
10:40:40.318986 IP 112.26.1.8.37253 > 112.26.1.1.39713: Flags [.], ack 12853, win 11270, options [nop,nop,TS val 3534871 ecr 3766256,nop,nop,sack 1 {14281:45697},mptcp dss ack 420621645], length 0
10:40:40.319235 IP 112.26.1.8.37253 > 112.26.1.1.39713: Flags [.], ack 12853, win 11270, options [nop,nop,TS val 3534871 ecr 3766256,nop,nop,sack 1 {14281:45697},mptcp dss ack 420621645], length 0
10:40:40.335343 IP 112.26.1.1.39713 > 112.26.1.8.37253: Flags [.], seq 54265:55693, ack 1, win 893, options [nop,nop,TS val 3769113 ecr 3534755,mptcp dss ack 177854901 seq 420773013 subseq 54265 len 1428 csum 0x6a57], length 1428
10:40:40.405594 IP 112.26.1.1.39713 > 112.26.1.8.37253: Flags [.], seq 48553:49981, ack 1, win 893, options [nop,nop,TS val 3768716 ecr 3534435,mptcp dss ack 177854901 seq 420764445 subseq 48553 len 1428 csum 0xead7], length 1428
10:40:40.420158 IP 112.26.1.1.39713 > 112.26.1.8.37253: Flags [.], seq 55693:57121, ack 1, win 893, options [nop,nop,TS val 3769137 ecr 3534819,mptcp dss ack 177854901 seq 420774441 subseq 55693 len 1428 csum 0xabc5], length 1428
10:40:40.475322 IP 112.26.1.1.39713 > 112.26.1.8.37253: Flags [.], seq 57121:58549, ack 1, win 893, options [nop,nop,TS val 3769164 ecr 3534871,mptcp dss ack 177854901 seq 420775869 subseq 57121 len 1428 csum 0x17d5], length 1428
10:40:40.482933 IP 112.26.1.8.37253 > 112.26.1.1.39713: Flags [.], ack 45697, win 11361, options [nop,nop,TS val 3534976 ecr 3768107,mptcp dss ack 420645921], length 0
10:40:40.483179 IP 112.26.1.8.37253 > 112.26.1.1.39713: Flags [.], ack 45697, win 11361, options [nop,nop,TS val 3534976 ecr 3768107,mptcp dss ack 420645921], length 0
10:40:40.524368 IP 112.26.1.1.39713 > 112.26.1.8.37253: Flags [.], seq 58549:59977, ack 1, win 893, options [nop,nop,TS val 3769289 ecr 3534976,mptcp dss ack 177854901 seq 420785865 subseq 58549 len 1428 csum 0x7c59], length 1428
10:40:40.543061 IP 112.26.1.8.37253 > 112.26.1.1.39713: Flags [.], ack 47125, win 11452, options [nop,nop,TS val 3535051 ecr 3768211,mptcp dss ack 420645921], length 0
10:40:40.543343 IP 112.26.1.8.37253 > 112.26.1.1.39713: Flags [.], ack 47125, win 11452, options [nop,nop,TS val 3535051 ecr 3768211,mptcp dss ack 420645921], length 0
10:40:40.575617 IP 112.26.1.8.37253 > 112.26.1.1.39713: Flags [.], ack 48553, win 11498, options [nop,nop,TS val 3535131 ecr 3768436,mptcp dss ack 420645921], length 0
10:40:40.575902 IP 112.26.1.8.37253 > 112.26.1.1.39713: Flags [.], ack 48553, win 11498, options [nop,nop,TS val 3535131 ecr 3768436,mptcp dss ack 420645921], length 0
10:40:40.588459 IP 112.26.1.1.39713 > 112.26.1.8.37253: Flags [.], seq 59977:61405, ack 1, win 893, options [nop,nop,TS val 3769289 ecr 3534976,mptcp dss ack 177854901 seq 420787293 subseq 59977 len 1428 csum 0x5901], length 1428
10:40:40.629445 IP 112.26.1.1.39713 > 112.26.1.8.37253: Flags [.], seq 51409:52837, ack 1, win 893, options [nop,nop,TS val 3769009 ecr 3534685,mptcp dss ack 177854901 seq 420768729 subseq 51409 len 1428 csum 0xb79d], length 1428
10:40:40.656471 IP 112.26.1.1.39713 > 112.26.1.8.37253: Flags [.], seq 61405:62833, ack 1, win 893, options [nop,nop,TS val 3769350 ecr 3535051,mptcp dss ack 177854901 seq 420798717 subseq 61405 len 1428 csum 0x77d5], length 1428
10:40:40.691045 IP 112.26.1.1.39713 > 112.26.1.8.37253: Flags [.], seq 52837:54265, ack 1, win 893, options [nop,nop,TS val 3769009 ecr 3534685,mptcp dss ack 177854901 seq 420770157 subseq 52837 len 1428 csum 0x5bef], length 1428
10:40:40.729506 IP 112.26.1.1.39713 > 112.26.1.8.37253: Flags [.], seq 62833:64261, ack 1, win 893, options [nop,nop,TS val 3769442 ecr 3535131,mptcp dss ack 177854901 seq 420800145 subseq 62833 len 1428 csum 0xb868], length 1428
10:40:40.762534 IP 112.26.1.1.39713 > 112.26.1.8.37253: Flags [.], seq 54265:55693, ack 1, win 893, options [nop,nop,TS val 3769113 ecr 3534755,mptcp dss ack 177854901 seq 420773013 subseq 54265 len 1428 csum 0x6a57], length 1428
10:40:40.777074 IP 112.26.1.1.39713 > 112.26.1.8.37253: Flags [.], seq 64261:65689, ack 1, win 893, options [nop,nop,TS val 3769442 ecr 3535131,mptcp dss ack 177854901 seq 420801573 subseq 64261 len 1428 csum 0xc8cc], length 1428
10:40:40.848153 IP 112.26.1.8.37253 > 112.26.1.1.39713: Flags [.], ack 49981, win 11863, options [nop,nop,TS val 3535409 ecr 3768716,mptcp dss ack 420647349], length 0
10:40:40.848440 IP 112.26.1.8.37253 > 112.26.1.1.39713: Flags [.], ack 49981, win 11863, options [nop,nop,TS val 3535409 ecr 3768716,mptcp dss ack 420647349], length 0
10:40:40.856959 IP 112.26.1.1.39713 > 112.26.1.8.37253: Flags [.], seq 65689:67117, ack 1, win 893, options [nop,nop,TS val 3769655 ecr 3535409,mptcp dss ack 177854901 seq 420817281 subseq 65689 len 1428 csum 0x46e4], length 1428
10:40:40.926967 IP 112.26.1.1.39713 > 112.26.1.8.37253: Flags [.], seq 55693:57121, ack 1, win 893, options [nop,nop,TS val 3769137 ecr 3534819,mptcp dss ack 177854901 seq 420774441 subseq 55693 len 1428 csum 0xabc5], length 1428
10:40:40.986009 IP 112.26.1.1.39713 > 112.26.1.8.37253: Flags [.], seq 57121:58549, ack 1, win 893, options [nop,nop,TS val 3769164 ecr 3534871,mptcp dss ack 177854901 seq 420775869 subseq 57121 len 1428 csum 0x17d5], length 1428
10:40:41.054850 IP 112.26.1.8.37253 > 112.26.1.1.39713: Flags [.], ack 49981, win 12182, options [nop,nop,TS val 3535633 ecr 3768716,nop,nop,sack 1 {51409:52837},mptcp dss ack 420647349], length 0
10:40:41.055141 IP 112.26.1.8.37253 > 112.26.1.1.39713: Flags [.], ack 49981, win 12182, options [nop,nop,TS val 3535633 ecr 3768716,nop,nop,sack 1 {51409:52837},mptcp dss ack 420647349], length 0
10:40:41.077665 IP 112.26.1.1.39713 > 112.26.1.8.37253: Flags [.], seq 67117:68545, ack 1, win 893, options [nop,nop,TS val 3769866 ecr 3535633,mptcp dss ack 177854901 seq 420827277 subseq 67117 len 1428 csum 0x17f1], length 1428
10:40:41.160126 IP 112.26.1.1.39713 > 112.26.1.8.37253: Flags [.], seq 58549:59977, ack 1, win 893, options [nop,nop,TS val 3769289 ecr 3534976,mptcp dss ack 177854901 seq 420785865 subseq 58549 len 1428 csum 0x7c59], length 1428
10:40:41.196009 IP 112.26.1.8.37253 > 112.26.1.1.39713: Flags [.], ack 49981, win 12319, options [nop,nop,TS val 3535702 ecr 3768716,nop,nop,sack 1 {51409:54265},mptcp dss ack 420647349], length 0
10:40:41.196330 IP 112.26.1.8.37253 > 112.26.1.1.39713: Flags [.], ack 49981, win 12319, options [nop,nop,TS val 3535702 ecr 3768716,nop,nop,sack 1 {51409:54265},mptcp dss ack 420647349], length 0
10:40:41.253376 IP 112.26.1.1.39713 > 112.26.1.8.37253: Flags [.], seq 68545:69973, ack 1, win 893, options [nop,nop,TS val 3770054 ecr 3535702,mptcp dss ack 177854901 seq 420830133 subseq 68545 len 1428 csum 0x2afa], length 1428
10:40:41.269680 IP 112.26.1.8.37253 > 112.26.1.1.39713: Flags [.], ack 49981, win 12410, options [nop,nop,TS val 3535773 ecr 3768716,nop,nop,sack 1 {51409:55693},mptcp dss ack 420647349], length 0
10:40:41.269969 IP 112.26.1.8.37253 > 112.26.1.1.39713: Flags [.], ack 49981, win 12410, options [nop,nop,TS val 3535773 ecr 3768716,nop,nop,sack 1 {51409:55693},mptcp dss ack 420647349], length 0
10:40:41.353321 IP 112.26.1.1.39713 > 112.26.1.8.37253: Flags [.], seq 61405:62833, ack 1, win 893, options [nop,nop,TS val 3769350 ecr 3535051,mptcp dss ack 177854901 seq 420798717 subseq 61405 len 1428 csum 0x77d5], length 1428
10:40:41.392590 IP 112.26.1.1.39713 > 112.26.1.8.37253: Flags [.], seq 49981:51409, ack 1, win 893, options [nop,nop,TS val 3770087 ecr 3535773,mptcp dss ack 177854901 seq 420765873 subseq 49981 len 1428 csum 0x8413], length 1428
10:40:41.403460 IP 112.26.1.1.39713 > 112.26.1.8.37253: Flags [.], seq 62833:64261, ack 1, win 893, options [nop,nop,TS val 3769442 ecr 3535131,mptcp dss ack 177854901 seq 420800145 subseq 62833 len 1428 csum 0xb868], length 1428
10:40:41.473439 IP 112.26.1.8.37253 > 112.26.1.1.39713: Flags [.], ack 49981, win 12547, options [nop,nop,TS val 3535938 ecr 3768716,nop,nop,sack 1 {51409:57121},mptcp dss ack 420647349], length 0
10:40:41.473755 IP 112.26.1.8.37253 > 112.26.1.1.39713: Flags [.], ack 49981, win 12547, options [nop,nop,TS val 3535938 ecr 3768716,nop,nop,sack 1 {51409:57121},mptcp dss ack 420647349], length 0
10:40:41.530038 IP 112.26.1.8.37253 > 112.26.1.1.39713: Flags [.], ack 49981, win 12639, options [nop,nop,TS val 3535997 ecr 3768716,nop,nop,sack 1 {51409:58549},mptcp dss ack 420647349], length 0
10:40:41.530333 IP 112.26.1.8.37253 > 112.26.1.1.39713: Flags [.], ack 49981, win 12639, options [nop,nop,TS val 3535997 ecr 3768716,nop,nop,sack 1 {51409:58549},mptcp dss ack 420647349], length 0
10:40:41.538419 IP 112.26.1.1.39713 > 112.26.1.8.37253: Flags [.], seq 69973:71401, ack 1, win 893, options [nop,nop,TS val 3770336 ecr 3535938,mptcp dss ack 177854901 seq 420840129 subseq 69973 len 1428 csum 0x940a], length 1428
10:40:41.566834 IP 112.26.1.1.39713 > 112.26.1.8.37253: Flags [.], seq 65689:67117, ack 1, win 893, options [nop,nop,TS val 3769655 ecr 3535409,mptcp dss ack 177854901 seq 420817281 subseq 65689 len 1428 csum 0x46e4], length 1428
10:40:41.645385 IP 112.26.1.1.39713 > 112.26.1.8.37253: Flags [.], seq 67117:68545, ack 1, win 893, options [nop,nop,TS val 3769866 ecr 3535633,mptcp dss ack 177854901 seq 420827277 subseq 67117 len 1428 csum 0x17f1], length 1428
10:40:41.697018 IP 112.26.1.8.37253 > 112.26.1.1.39713: Flags [.], ack 49981, win 12775, options [nop,nop,TS val 3536161 ecr 3768716,nop,nop,sack 1 {51409:59977},mptcp dss ack 420647349], length 0
10:40:41.697305 IP 112.26.1.8.37253 > 112.26.1.1.39713: Flags [.], ack 49981, win 12775, options [nop,nop,TS val 3536161 ecr 3768716,nop,nop,sack 1 {51409:59977},mptcp dss ack 420647349], length 0
10:40:41.733497 IP 112.26.1.1.39713 > 112.26.1.8.37253: Flags [.], seq 68545:69973, ack 1, win 893, options [nop,nop,TS val 3770054 ecr 3535702,mptcp dss ack 177854901 seq 420830133 subseq 68545 len 1428 csum 0x2afa], length 1428
10:40:41.750420 IP 112.26.1.1.39713 > 112.26.1.8.37253: Flags [.], seq 71401:72829, ack 1, win 893, options [nop,nop,TS val 3770542 ecr 3536161,mptcp dss ack 177854901 seq 420841557 subseq 71401 len 1428 csum 0x1bc2], length 1428
10:40:41.957254 IP 112.26.1.8.37253 > 112.26.1.1.39713: Flags [.], ack 49981, win 13049, options [nop,nop,TS val 3536414 ecr 3768716,nop,nop,sack 2 {61405:64261}{51409:59977},mptcp dss ack 420647349], length 0
10:40:41.957560 IP 112.26.1.8.37253 > 112.26.1.1.39713: Flags [.], ack 49981, win 13049, options [nop,nop,TS val 3536414 ecr 3768716,nop,nop,sack 2 {61405:64261}{51409:59977},mptcp dss ack 420647349], length 0
10:40:41.972777 IP 112.26.1.1.39713 > 112.26.1.8.37253: Flags [.], seq 59977:61405, ack 1, win 893, options [nop,nop,TS val 3770764 ecr 3536414,mptcp dss ack 177854901 seq 420787293 subseq 59977 len 1428 csum 0x5901], length 1428
10:40:42.028823 IP 112.26.1.8.37253 > 112.26.1.1.39713: Flags [.], ack 49981, win 13186, options [nop,nop,TS val 3536578 ecr 3768716,nop,nop,sack 2 {65689:67117}{61405:64261},mptcp dss ack 420647349], length 0
10:40:42.029071 IP 112.26.1.8.37253 > 112.26.1.1.39713: Flags [.], ack 49981, win 13186, options [nop,nop,TS val 3536578 ecr 3768716,nop,nop,sack 2 {65689:67117}{61405:64261},mptcp dss ack 420647349], length 0
