20:12:17.625782 IP 112.26.0.8.33728 > 112.26.0.1.45881: Flags [S], seq 503274601, win 65535, options [mss 1460,sackOK,TS val 4294819233 ecr 0,nop,wscale 6,mptcp capable csum {0xe03f2f5bd5989db8}], length 0
20:12:17.758267 IP 112.26.0.8.33728 > 112.26.0.1.45881: Flags [S], seq 503274601, win 65535, options [mss 1460,sackOK,TS val 4294819233 ecr 0,nop,wscale 6,mptcp capable csum {0xe03f2f5bd5989db8}], length 0
20:12:17.776992 IP 112.26.0.8.33728 > 112.26.0.1.45881: Flags [S], seq 503274601, win 65535, options [mss 1460,sackOK,TS val 4294819233 ecr 0,nop,wscale 6,mptcp capable csum {0xe03f2f5bd5989db8}], length 0
20:12:18.632708 IP 112.26.0.8.33728 > 112.26.0.1.45881: Flags [S], seq 503274601, win 65535, options [mss 1460,sackOK,TS val 4294820288 ecr 0,nop,wscale 6,mptcp capable csum {0xe03f2f5bd5989db8}], length 0
20:12:18.645330 IP 112.26.0.8.33728 > 112.26.0.1.45881: Flags [S], seq 503274601, win 65535, options [mss 1460,sackOK,TS val 4294820288 ecr 0,nop,wscale 6,mptcp capable csum {0xe03f2f5bd5989db8}], length 0
20:12:18.647098 IP 112.26.0.8.33728 > 112.26.0.1.45881: Flags [S], seq 503274601, win 65535, options [mss 1460,sackOK,TS val 4294820288 ecr 0,nop,wscale 6,mptcp capable csum {0xe03f2f5bd5989db8}], length 0
20:12:18.753048 IP 112.26.0.1.45881 > 112.26.0.8.33728: Flags [S.], seq 2940828125, ack 503274602, win 65535, options [mss 1460,sackOK,TS val 77594 ecr 4294819233,nop,wscale 6,mptcp capable csum {0x87139cfff9e67aae}], length 0
20:12:18.776833 IP 112.26.0.1.45881 > 112.26.0.8.33728: Flags [S.], seq 2940828125, ack 503274602, win 65535, options [mss 1460,sackOK,TS val 77594 ecr 4294819233,nop,wscale 6,mptcp capable csum {0x87139cfff9e67aae}], length 0
20:12:18.838980 IP 112.26.0.8.33728 > 112.26.0.1.45881: Flags [.], ack 1, win 1369, options [nop,nop,TS val 4294820485 ecr 77594,mptcp capable csum {0xe03f2f5bd5989db8,0x87139cfff9e67aae},mptcp dss ack 1976358045], length 0
20:12:18.839391 IP 112.26.0.8.33728 > 112.26.0.1.45881: Flags [.], ack 1, win 1369, options [nop,nop,TS val 4294820485 ecr 77594,mptcp capable csum {0xe03f2f5bd5989db8,0x87139cfff9e67aae},mptcp dss ack 1976358045], length 0
20:12:18.852052 IP 112.26.0.8.33728 > 112.26.0.1.45881: Flags [.], ack 1, win 1369, options [nop,nop,TS val 4294820485 ecr 77594,mptcp capable csum {0xe03f2f5bd5989db8,0x87139cfff9e67aae},mptcp dss ack 1976358045], length 0
20:12:18.865824 IP 112.26.0.8.33728 > 112.26.0.1.45881: Flags [.], ack 1, win 1369, options [nop,nop,TS val 4294820485 ecr 77594,mptcp add-addr id 3 112.26.1.8,mptcp dss ack 1976358045], length 0
20:12:18.866118 IP 112.26.0.8.33728 > 112.26.0.1.45881: Flags [.], ack 1, win 1369, options [nop,nop,TS val 4294820485 ecr 77594,mptcp add-addr id 3 112.26.1.8,mptcp dss ack 1976358045], length 0
20:12:18.887254 IP 112.26.0.1.45881 > 112.26.0.8.33728: Flags [.], ack 1, win 1339, options [nop,nop,TS val 77799 ecr 4294820485,mptcp add-addr id 3 112.26.1.1,mptcp dss ack 3262968525], length 0
20:12:18.887578 IP 112.26.0.1.45881 > 112.26.0.8.33728: Flags [.], ack 1, win 1339, options [nop,nop,TS val 77799 ecr 4294820485,mptcp add-addr id 3 112.26.1.1,mptcp dss ack 3262968525], length 0
20:12:18.935503 IP 112.26.0.8.33728 > 112.26.0.1.45881: Flags [.], ack 1, win 1369, options [nop,nop,TS val 4294820485 ecr 77594,mptcp add-addr id 5 112.26.3.8,mptcp dss ack 1976358045], length 0
20:12:18.935841 IP 112.26.0.8.33728 > 112.26.0.1.45881: Flags [.], ack 1, win 1369, options [nop,nop,TS val 4294820485 ecr 77594,mptcp add-addr id 5 112.26.3.8,mptcp dss ack 1976358045], length 0
20:12:18.951109 IP 112.26.0.8.33728 > 112.26.0.1.45881: Flags [.], ack 1, win 1369, options [nop,nop,TS val 4294820485 ecr 77594,mptcp add-addr id 3 112.26.1.8,mptcp dss ack 1976358045], length 0
20:12:18.958112 IP 112.26.0.8.33728 > 112.26.0.1.45881: Flags [.], ack 1, win 1369, options [nop,nop,TS val 4294820485 ecr 77594,mptcp add-addr id 6 112.26.2.8,mptcp dss ack 1976358045], length 0
20:12:18.958418 IP 112.26.0.8.33728 > 112.26.0.1.45881: Flags [.], ack 1, win 1369, options [nop,nop,TS val 4294820485 ecr 77594,mptcp add-addr id 6 112.26.2.8,mptcp dss ack 1976358045], length 0
20:12:18.971803 IP 112.26.0.1.45881 > 112.26.0.8.33728: Flags [.], ack 1, win 1339, options [nop,nop,TS val 77799 ecr 4294820485,mptcp add-addr id 4 112.26.2.1,mptcp dss ack 3262968525], length 0
20:12:18.972095 IP 112.26.0.1.45881 > 112.26.0.8.33728: Flags [.], ack 1, win 1339, options [nop,nop,TS val 77799 ecr 4294820485,mptcp add-addr id 4 112.26.2.1,mptcp dss ack 3262968525], length 0
20:12:19.059217 IP 112.26.0.1.45881 > 112.26.0.8.33728: Flags [.], ack 1, win 1339, options [nop,nop,TS val 77799 ecr 4294820485,mptcp add-addr id 6 112.26.3.1,mptcp dss ack 3262968525], length 0
20:12:19.059526 IP 112.26.0.1.45881 > 112.26.0.8.33728: Flags [.], ack 1, win 1339, options [nop,nop,TS val 77799 ecr 4294820485,mptcp add-addr id 6 112.26.3.1,mptcp dss ack 3262968525], length 0
20:12:19.143271 IP 112.26.0.1.45881 > 112.26.0.8.33728: Flags [.], seq 1:1429, ack 1, win 1339, options [nop,nop,TS val 77805 ecr 4294820485,mptcp dss ack 3262968525 seq 1976358045 subseq 1 len 1428 csum 0xaf6e], length 1428
20:12:19.143610 IP 112.26.0.1.45881 > 112.26.0.8.33728: Flags [.], seq 1:1429, ack 1, win 1339, options [nop,nop,TS val 77805 ecr 4294820485,mptcp dss ack 3262968525 seq 1976358045 subseq 1 len 1428 csum 0xaf6e], length 1428
20:12:19.155018 IP 112.26.0.1.45881 > 112.26.0.8.33728: Flags [.], seq 1429:2857, ack 1, win 1339, options [nop,nop,TS val 77805 ecr 4294820485,mptcp dss ack 3262968525 seq 1976359473 subseq 1429 len 1428 csum 0xcebc], length 1428
20:12:19.155371 IP 112.26.0.1.45881 > 112.26.0.8.33728: Flags [.], seq 1429:2857, ack 1, win 1339, options [nop,nop,TS val 77805 ecr 4294820485,mptcp dss ack 3262968525 seq 1976359473 subseq 1429 len 1428 csum 0xcebc], length 1428
20:12:19.240854 IP 112.26.0.8.33728 > 112.26.0.1.45881: Flags [.], ack 1429, win 1415, options [nop,nop,TS val 4294820945 ecr 77805,mptcp dss ack 1976359473], length 0
20:12:19.241308 IP 112.26.0.8.33728 > 112.26.0.1.45881: Flags [.], ack 1429, win 1415, options [nop,nop,TS val 4294820945 ecr 77805,mptcp dss ack 1976359473], length 0
20:12:19.249379 IP 112.26.0.8.33728 > 112.26.0.1.45881: Flags [.], ack 1, win 1369, options [nop,nop,TS val 4294820485 ecr 77594,mptcp add-addr id 5 112.26.3.8,mptcp dss ack 1976358045], length 0
20:12:19.260224 IP 112.26.0.8.33728 > 112.26.0.1.45881: Flags [.], ack 2857, win 1460, options [nop,nop,TS val 4294820964 ecr 77805,mptcp dss ack 1976360901], length 0
20:12:19.260560 IP 112.26.0.8.33728 > 112.26.0.1.45881: Flags [.], ack 2857, win 1460, options [nop,nop,TS val 4294820964 ecr 77805,mptcp dss ack 1976360901], length 0
20:12:19.332474 IP 112.26.0.1.45881 > 112.26.0.8.33728: Flags [P.], seq 2857:4097, ack 1, win 1339, options [nop,nop,TS val 77805 ecr 4294820485,mptcp dss ack 3262968525 seq 1976360901 subseq 2857 len 1240 csum 0xf8f], length 1240
20:12:19.332808 IP 112.26.0.1.45881 > 112.26.0.8.33728: Flags [P.], seq 2857:4097, ack 1, win 1339, options [nop,nop,TS val 77805 ecr 4294820485,mptcp dss ack 3262968525 seq 1976360901 subseq 2857 len 1240 csum 0xf8f], length 1240
20:12:19.349687 IP 112.26.0.8.33728 > 112.26.0.1.45881: Flags [.], ack 1, win 1369, options [nop,nop,TS val 4294820485 ecr 77594,mptcp add-addr id 6 112.26.2.8,mptcp dss ack 1976358045], length 0
20:12:19.447890 IP 112.26.0.1.45881 > 112.26.0.8.33728: Flags [.], seq 4097:5525, ack 1, win 1339, options [nop,nop,TS val 77805 ecr 4294820485,mptcp dss ack 3262968525 seq 1976362141 subseq 4097 len 1428 csum 0x3c8], length 1428
20:12:19.448236 IP 112.26.0.1.45881 > 112.26.0.8.33728: Flags [.], seq 4097:5525, ack 1, win 1339, options [nop,nop,TS val 77805 ecr 4294820485,mptcp dss ack 3262968525 seq 1976362141 subseq 4097 len 1428 csum 0x3c8], length 1428
20:12:19.458670 IP 112.26.0.8.33728 > 112.26.0.1.45881: Flags [.], ack 4097, win 1506, options [nop,nop,TS val 4294821163 ecr 77805,mptcp dss ack 1976362141], length 0
20:12:19.459050 IP 112.26.0.8.33728 > 112.26.0.1.45881: Flags [.], ack 4097, win 1506, options [nop,nop,TS val 4294821163 ecr 77805,mptcp dss ack 1976362141], length 0
20:12:19.549471 IP 112.26.0.1.45881 > 112.26.0.8.33728: Flags [.], seq 5525:6953, ack 1, win 1339, options [nop,nop,TS val 77806 ecr 4294820485,mptcp dss ack 3262968525 seq 1976363569 subseq 5525 len 1428 csum 0x603d], length 1428
20:12:19.549804 IP 112.26.0.1.45881 > 112.26.0.8.33728: Flags [.], seq 5525:6953, ack 1, win 1339, options [nop,nop,TS val 77806 ecr 4294820485,mptcp dss ack 3262968525 seq 1976363569 subseq 5525 len 1428 csum 0x603d], length 1428
20:12:19.556500 IP 112.26.0.8.33728 > 112.26.0.1.45881: Flags [.], ack 5525, win 1552, options [nop,nop,TS val 4294821250 ecr 77805,mptcp dss ack 1976363569], length 0
20:12:19.556769 IP 112.26.0.8.33728 > 112.26.0.1.45881: Flags [.], ack 5525, win 1552, options [nop,nop,TS val 4294821250 ecr 77805,mptcp dss ack 1976363569], length 0
20:12:19.570738 IP 112.26.0.1.45881 > 112.26.0.8.33728: Flags [.], seq 6953:8381, ack 1, win 1339, options [nop,nop,TS val 77806 ecr 4294820485,mptcp dss ack 3262968525 seq 1976364997 subseq 6953 len 1428 csum 0xfa09], length 1428
20:12:19.571016 IP 112.26.0.1.45881 > 112.26.0.8.33728: Flags [.], seq 6953:8381, ack 1, win 1339, options [nop,nop,TS val 77806 ecr 4294820485,mptcp dss ack 3262968525 seq 1976364997 subseq 6953 len 1428 csum 0xfa09], length 1428
20:12:19.652669 IP 112.26.0.1.45881 > 112.26.0.8.33728: Flags [.], seq 8381:9809, ack 1, win 1339, options [nop,nop,TS val 77806 ecr 4294820485,mptcp dss ack 3262968525 seq 1976366425 subseq 8381 len 1428 csum 0xc99b], length 1428
20:12:19.652991 IP 112.26.0.1.45881 > 112.26.0.8.33728: Flags [.], seq 8381:9809, ack 1, win 1339, options [nop,nop,TS val 77806 ecr 4294820485,mptcp dss ack 3262968525 seq 1976366425 subseq 8381 len 1428 csum 0xc99b], length 1428
20:12:19.663148 IP 112.26.0.8.33728 > 112.26.0.1.45881: Flags [.], ack 6953, win 1597, options [nop,nop,TS val 4294821366 ecr 77806,mptcp dss ack 1976364997], length 0
20:12:19.663437 IP 112.26.0.8.33728 > 112.26.0.1.45881: Flags [.], ack 6953, win 1597, options [nop,nop,TS val 4294821366 ecr 77806,mptcp dss ack 1976364997], length 0
20:12:19.738145 IP 112.26.0.1.45881 > 112.26.0.8.33728: Flags [.], seq 9809:11237, ack 1, win 1339, options [nop,nop,TS val 77806 ecr 4294820485,mptcp dss ack 3262968525 seq 1976367853 subseq 9809 len 1428 csum 0xc207], length 1428
20:12:19.738432 IP 112.26.0.1.45881 > 112.26.0.8.33728: Flags [.], seq 9809:11237, ack 1, win 1339, options [nop,nop,TS val 77806 ecr 4294820485,mptcp dss ack 3262968525 seq 1976367853 subseq 9809 len 1428 csum 0xc207], length 1428
20:12:19.747754 IP 112.26.0.8.33728 > 112.26.0.1.45881: Flags [.], ack 1429, win 1415, options [nop,nop,TS val 4294820945 ecr 77805,mptcp dss ack 1976359473], length 0
20:12:19.762971 IP 112.26.0.8.33728 > 112.26.0.1.45881: Flags [.], ack 8381, win 1643, options [nop,nop,TS val 4294821468 ecr 77806,mptcp dss ack 1976366425], length 0
20:12:19.763285 IP 112.26.0.8.33728 > 112.26.0.1.45881: Flags [.], ack 8381, win 1643, options [nop,nop,TS val 4294821468 ecr 77806,mptcp dss ack 1976366425], length 0
20:12:19.846969 IP 112.26.0.8.33728 > 112.26.0.1.45881: Flags [.], ack 2857, win 1460, options [nop,nop,TS val 4294820964 ecr 77805,mptcp dss ack 1976360901], length 0
20:12:19.853371 IP 112.26.0.8.33728 > 112.26.0.1.45881: Flags [.], ack 9809, win 1689, options [nop,nop,TS val 4294821557 ecr 77806,mptcp dss ack 1976367853], length 0
20:12:19.853754 IP 112.26.0.8.33728 > 112.26.0.1.45881: Flags [.], ack 9809, win 1689, options [nop,nop,TS val 4294821557 ecr 77806,mptcp dss ack 1976367853], length 0
20:12:19.952167 IP 112.26.0.8.33728 > 112.26.0.1.45881: Flags [.], ack 11237, win 1734, options [nop,nop,TS val 4294821657 ecr 77806,mptcp dss ack 1976369281], length 0
20:12:19.952479 IP 112.26.0.8.33728 > 112.26.0.1.45881: Flags [.], ack 11237, win 1734, options [nop,nop,TS val 4294821657 ecr 77806,mptcp dss ack 1976369281], length 0
20:12:19.959584 IP 112.26.0.1.45881 > 112.26.0.8.33728: Flags [.], seq 12665:14093, ack 1, win 1339, options [nop,nop,TS val 78424 ecr 4294820485,mptcp dss ack 3262968525 seq 1976370709 subseq 12665 len 1428 csum 0x338b], length 1428
20:12:19.959908 IP 112.26.0.1.45881 > 112.26.0.8.33728: Flags [.], seq 12665:14093, ack 1, win 1339, options [nop,nop,TS val 78424 ecr 4294820485,mptcp dss ack 3262968525 seq 1976370709 subseq 12665 len 1428 csum 0x338b], length 1428
20:12:20.038759 IP 112.26.0.8.33728 > 112.26.0.1.45881: Flags [.], ack 4097, win 1506, options [nop,nop,TS val 4294821163 ecr 77805,mptcp dss ack 1976362141], length 0
20:12:20.075691 IP 112.26.0.8.33728 > 112.26.0.1.45881: Flags [.], ack 5525, win 1552, options [nop,nop,TS val 4294821250 ecr 77805,mptcp dss ack 1976363569], length 0
20:12:20.168229 IP 112.26.0.1.45881 > 112.26.0.8.33728: Flags [.], seq 14093:15521, ack 1, win 1339, options [nop,nop,TS val 78695 ecr 4294820945,mptcp dss ack 3262968525 seq 1976372137 subseq 14093 len 1428 csum 0x8624], length 1428
20:12:20.168534 IP 112.26.0.1.45881 > 112.26.0.8.33728: Flags [.], seq 14093:15521, ack 1, win 1339, options [nop,nop,TS val 78695 ecr 4294820945,mptcp dss ack 3262968525 seq 1976372137 subseq 14093 len 1428 csum 0x8624], length 1428
20:12:20.178801 IP 112.26.0.8.33728 > 112.26.0.1.45881: Flags [.], ack 11237, win 1780, options [nop,nop,TS val 4294821883 ecr 77806,nop,nop,sack 1 {12665:14093},mptcp dss ack 1976369281], length 0
20:12:20.179138 IP 112.26.0.8.33728 > 112.26.0.1.45881: Flags [.], ack 11237, win 1780, options [nop,nop,TS val 4294821883 ecr 77806,nop,nop,sack 1 {12665:14093},mptcp dss ack 1976369281], length 0
20:12:20.182417 IP 112.26.0.1.45881 > 112.26.0.8.33728: Flags [.], seq 19805:21233, ack 1, win 1339, options [nop,nop,TS val 78986 ecr 4294821163,mptcp dss ack 3262968525 seq 1976377849 subseq 19805 len 1428 csum 0xa3c1], length 1428
20:12:20.188549 IP 112.26.0.1.45881 > 112.26.0.8.33728: Flags [.], seq 15521:16949, ack 1, win 1339, options [nop,nop,TS val 78695 ecr 4294820945,mptcp dss ack 3262968525 seq 1976373565 subseq 15521 len 1428 csum 0xf17f], length 1428
20:12:20.188890 IP 112.26.0.1.45881 > 112.26.0.8.33728: Flags [.], seq 15521:16949, ack 1, win 1339, options [nop,nop,TS val 78695 ecr 4294820945,mptcp dss ack 3262968525 seq 1976373565 subseq 15521 len 1428 csum 0xf17f], length 1428
20:12:20.256956 IP 112.26.0.8.33728 > 112.26.0.1.45881: Flags [.], ack 11237, win 1825, options [nop,nop,TS val 4294821949 ecr 77806,nop,nop,sack 2 {19805:21233}{12665:14093},mptcp dss ack 1976369281], length 0
20:12:20.257278 IP 112.26.0.8.33728 > 112.26.0.1.45881: Flags [.], ack 11237, win 1825, options [nop,nop,TS val 4294821949 ecr 77806,nop,nop,sack 2 {19805:21233}{12665:14093},mptcp dss ack 1976369281], length 0
20:12:20.259910 IP 112.26.0.1.45881 > 112.26.0.8.33728: Flags [.], seq 16949:18377, ack 1, win 1339, options [nop,nop,TS val 78794 ecr 4294820964,mptcp dss ack 3262968525 seq 1976374993 subseq 16949 len 1428 csum 0xdad3], length 1428
20:12:20.260214 IP 112.26.0.1.45881 > 112.26.0.8.33728: Flags [.], seq 16949:18377, ack 1, win 1339, options [nop,nop,TS val 78794 ecr 4294820964,mptcp dss ack 3262968525 seq 1976374993 subseq 16949 len 1428 csum 0xdad3], length 1428
20:12:20.264848 IP 112.26.0.1.45881 > 112.26.0.8.33728: Flags [.], seq 21233:22661, ack 1, win 1339, options [nop,nop,TS val 78986 ecr 4294821163,mptcp dss ack 3262968525 seq 1976379277 subseq 21233 len 1428 csum 0xecc1], length 1428
20:12:20.279596 IP 112.26.0.8.33728 > 112.26.0.1.45881: Flags [.], ack 11237, win 1871, options [nop,nop,TS val 4294821973 ecr 77806,nop,nop,sack 2 {19805:22661}{12665:14093},mptcp dss ack 1976369281], length 0
20:12:20.279915 IP 112.26.0.8.33728 > 112.26.0.1.45881: Flags [.], ack 11237, win 1871, options [nop,nop,TS val 4294821973 ecr 77806,nop,nop,sack 2 {19805:22661}{12665:14093},mptcp dss ack 1976369281], length 0
20:12:20.340372 IP 112.26.0.8.33728 > 112.26.0.1.45881: Flags [.], ack 6953, win 1597, options [nop,nop,TS val 4294821366 ecr 77806,mptcp dss ack 1976364997], length 0
20:12:20.351128 IP 112.26.0.8.33728 > 112.26.0.1.45881: Flags [.], ack 11237, win 1917, options [nop,nop,TS val 4294821978 ecr 77806,nop,nop,sack 2 {12665:15521}{19805:22661},mptcp dss ack 1976369281], length 0
20:12:20.351453 IP 112.26.0.8.33728 > 112.26.0.1.45881: Flags [.], ack 11237, win 1917, options [nop,nop,TS val 4294821978 ecr 77806,nop,nop,sack 2 {12665:15521}{19805:22661},mptcp dss ack 1976369281], length 0
20:12:20.358575 IP 112.26.0.1.45881 > 112.26.0.8.33728: Flags [.], seq 22661:24089, ack 1, win 1339, options [nop,nop,TS val 79023 ecr 4294821250,mptcp dss ack 3262968525 seq 1976380705 subseq 22661 len 1428 csum 0x495c], length 1428
20:12:20.374889 IP 112.26.0.8.33728 > 112.26.0.1.45881: Flags [.], ack 11237, win 1962, options [nop,nop,TS val 4294822067 ecr 77806,nop,nop,sack 2 {19805:24089}{12665:15521},mptcp dss ack 1976369281], length 0
20:12:20.375228 IP 112.26.0.8.33728 > 112.26.0.1.45881: Flags [.], ack 11237, win 1962, options [nop,nop,TS val 4294822067 ecr 77806,nop,nop,sack 2 {19805:24089}{12665:15521},mptcp dss ack 1976369281], length 0
20:12:20.379711 IP 112.26.0.1.45881 > 112.26.0.8.33728: Flags [.], seq 18377:19805, ack 1, win 1339, options [nop,nop,TS val 78794 ecr 4294820964,mptcp dss ack 3262968525 seq 1976376421 subseq 18377 len 1428 csum 0xe41f], length 1428
20:12:20.380043 IP 112.26.0.1.45881 > 112.26.0.8.33728: Flags [.], seq 18377:19805, ack 1, win 1339, options [nop,nop,TS val 78794 ecr 4294820964,mptcp dss ack 3262968525 seq 1976376421 subseq 18377 len 1428 csum 0xe41f], length 1428
20:12:20.447476 IP 112.26.0.1.45881 > 112.26.0.8.33728: Flags [.], seq 24089:25517, ack 1, win 1339, options [nop,nop,TS val 79023 ecr 4294821250,mptcp dss ack 3262968525 seq 1976382133 subseq 24089 len 1428 csum 0xe12a], length 1428
20:12:20.457929 IP 112.26.0.8.33728 > 112.26.0.1.45881: Flags [.], ack 11237, win 2008, options [nop,nop,TS val 4294822077 ecr 77806,nop,nop,sack 2 {12665:16949}{19805:24089},mptcp dss ack 1976369281], length 0
20:12:20.458215 IP 112.26.0.8.33728 > 112.26.0.1.45881: Flags [.], ack 11237, win 2008, options [nop,nop,TS val 4294822077 ecr 77806,nop,nop,sack 2 {12665:16949}{19805:24089},mptcp dss ack 1976369281], length 0
20:12:20.469711 IP 112.26.0.8.33728 > 112.26.0.1.45881: Flags [.], ack 8381, win 1643, options [nop,nop,TS val 4294821468 ecr 77806,mptcp dss ack 1976366425], length 0
20:12:20.484721 IP 112.26.0.8.33728 > 112.26.0.1.45881: Flags [.], ack 11237, win 2054, options [nop,nop,TS val 4294822156 ecr 77806,nop,nop,sack 2 {19805:25517}{12665:16949},mptcp dss ack 1976369281], length 0
20:12:20.484996 IP 112.26.0.8.33728 > 112.26.0.1.45881: Flags [.], ack 11237, win 2054, options [nop,nop,TS val 4294822156 ecr 77806,nop,nop,sack 2 {19805:25517}{12665:16949},mptcp dss ack 1976369281], length 0
20:12:20.541468 IP 112.26.0.8.33728 > 112.26.0.1.45881: Flags [.], ack 9809, win 1689, options [nop,nop,TS val 4294821557 ecr 77806,mptcp dss ack 1976367853], length 0
20:12:20.552879 IP 112.26.0.8.33728 > 112.26.0.1.45881: Flags [.], ack 11237, win 2099, options [nop,nop,TS val 4294822168 ecr 77806,nop,nop,sack 2 {12665:18377}{19805:25517},mptcp dss ack 1976369281], length 0
20:12:20.553274 IP 112.26.0.8.33728 > 112.26.0.1.45881: Flags [.], ack 11237, win 2099, options [nop,nop,TS val 4294822168 ecr 77806,nop,nop,sack 2 {12665:18377}{19805:25517},mptcp dss ack 1976369281], length 0
20:12:20.563400 IP 112.26.0.1.45881 > 112.26.0.8.33728: Flags [.], seq 25517:26945, ack 1, win 1339, options [nop,nop,TS val 79287 ecr 4294821366,mptcp dss ack 3262968525 seq 1976383561 subseq 25517 len 1428 csum 0xfb28], length 1428
20:12:20.566014 IP 112.26.0.8.33728 > 112.26.0.1.45881: Flags [.], ack 11237, win 2145, options [nop,nop,TS val 4294822272 ecr 77806,nop,nop,sack 2 {19805:26945}{12665:18377},mptcp dss ack 1976369281], length 0
20:12:20.566388 IP 112.26.0.8.33728 > 112.26.0.1.45881: Flags [.], ack 11237, win 2145, options [nop,nop,TS val 4294822272 ecr 77806,nop,nop,sack 2 {19805:26945}{12665:18377},mptcp dss ack 1976369281], length 0
20:12:20.646137 IP 112.26.0.1.45881 > 112.26.0.8.33728: Flags [.], seq 26945:28373, ack 1, win 1339, options [nop,nop,TS val 79287 ecr 4294821366,mptcp dss ack 3262968525 seq 1976384989 subseq 26945 len 1428 csum 0x8125], length 1428
20:12:20.648874 IP 112.26.0.8.33728 > 112.26.0.1.45881: Flags [.], ack 11237, win 2190, options [nop,nop,TS val 4294822354 ecr 77806,nop,nop,sack 2 {19805:28373}{12665:18377},mptcp dss ack 1976369281], length 0
20:12:20.649205 IP 112.26.0.8.33728 > 112.26.0.1.45881: Flags [.], ack 11237, win 2190, options [nop,nop,TS val 4294822354 ecr 77806,nop,nop,sack 2 {19805:28373}{12665:18377},mptcp dss ack 1976369281], length 0
20:12:20.672072 IP 112.26.0.8.33728 > 112.26.0.1.45881: Flags [.], ack 11237, win 1780, options [nop,nop,TS val 4294821883 ecr 77806,nop,nop,sack 1 {12665:14093},mptcp dss ack 1976369281], length 0
20:12:20.689580 IP 112.26.0.1.45881 > 112.26.0.8.33728: Flags [.], seq 28373:29801, ack 1, win 1339, options [nop,nop,TS val 79417 ecr 4294821468,mptcp dss ack 3262968525 seq 1976386417 subseq 28373 len 1428 csum 0x8d82], length 1428
20:12:20.739433 IP 112.26.0.8.33728 > 112.26.0.1.45881: Flags [.], ack 11237, win 2236, options [nop,nop,TS val 4294822389 ecr 77806,nop,nop,sack 1 {12665:28373},mptcp dss ack 1976369281], length 0
20:12:20.739745 IP 112.26.0.8.33728 > 112.26.0.1.45881: Flags [.], ack 11237, win 2236, options [nop,nop,TS val 4294822389 ecr 77806,nop,nop,sack 1 {12665:28373},mptcp dss ack 1976369281], length 0
20:12:20.744947 IP 112.26.0.8.33728 > 112.26.0.1.45881: Flags [.], ack 11237, win 2282, options [nop,nop,TS val 4294822402 ecr 77806,nop,nop,sack 1 {12665:29801},mptcp dss ack 1976369281], length 0
20:12:20.745256 IP 112.26.0.8.33728 > 112.26.0.1.45881: Flags [.], ack 11237, win 2282, options [nop,nop,TS val 4294822402 ecr 77806,nop,nop,sack 1 {12665:29801},mptcp dss ack 1976369281], length 0
20:12:20.756702 IP 112.26.0.1.45881 > 112.26.0.8.33728: Flags [.], seq 29801:31229, ack 1, win 1339, options [nop,nop,TS val 79417 ecr 4294821468,mptcp dss ack 3262968525 seq 1976387845 subseq 29801 len 1428 csum 0xb323], length 1428
20:12:20.764169 IP 112.26.0.8.33728 > 112.26.0.1.45881: Flags [.], ack 11237, win 1825, options [nop,nop,TS val 4294821949 ecr 77806,nop,nop,sack 2 {19805:21233}{12665:14093},mptcp dss ack 1976369281], length 0
20:12:20.779842 IP 112.26.0.8.33728 > 112.26.0.1.45881: Flags [.], ack 11237, win 2327, options [nop,nop,TS val 4294822477 ecr 77806,nop,nop,sack 1 {12665:31229},mptcp dss ack 1976369281], length 0
20:12:20.780156 IP 112.26.0.8.33728 > 112.26.0.1.45881: Flags [.], ack 11237, win 2327, options [nop,nop,TS val 4294822477 ecr 77806,nop,nop,sack 1 {12665:31229},mptcp dss ack 1976369281], length 0
20:12:20.792196 IP 112.26.0.8.33728 > 112.26.0.1.45881: Flags [.], ack 11237, win 1871, options [nop,nop,TS val 4294821973 ecr 77806,nop,nop,sack 2 {19805:22661}{12665:14093},mptcp dss ack 1976369281], length 0
20:12:20.854946 IP 112.26.0.1.45881 > 112.26.0.8.33728: Flags [.], seq 31229:32657, ack 1, win 1339, options [nop,nop,TS val 79488 ecr 4294821557,mptcp dss ack 3262968525 seq 1976389273 subseq 31229 len 1428 csum 0xa663], length 1428
20:12:20.868810 IP 112.26.0.8.33728 > 112.26.0.1.45881: Flags [.], ack 11237, win 1917, options [nop,nop,TS val 4294821978 ecr 77806,nop,nop,sack 2 {12665:15521}{19805:22661},mptcp dss ack 1976369281], length 0
20:12:20.878587 IP 112.26.0.8.33728 > 112.26.0.1.45881: Flags [.], ack 11237, win 2373, options [nop,nop,TS val 4294822572 ecr 77806,nop,nop,sack 1 {12665:32657},mptcp dss ack 1976369281], length 0
20:12:20.878883 IP 112.26.0.8.33728 > 112.26.0.1.45881: Flags [.], ack 11237, win 2373, options [nop,nop,TS val 4294822572 ecr 77806,nop,nop,sack 1 {12665:32657},mptcp dss ack 1976369281], length 0
20:12:20.887436 IP 112.26.0.1.45881 > 112.26.0.8.33728: Flags [.], seq 32657:34085, ack 1, win 1339, options [nop,nop,TS val 79488 ecr 4294821557,mptcp dss ack 3262968525 seq 1976390701 subseq 32657 len 1428 csum 0x220e], length 1428
20:12:20.897563 IP 112.26.0.8.33728 > 112.26.0.1.45881: Flags [.], ack 11237, win 1962, options [nop,nop,TS val 4294822067 ecr 77806,nop,nop,sack 2 {19805:24089}{12665:15521},mptcp dss ack 1976369281], length 0
20:12:20.954475 IP 112.26.0.8.33728 > 112.26.0.1.45881: Flags [.], ack 11237, win 2419, options [nop,nop,TS val 4294822596 ecr 77806,nop,nop,sack 1 {12665:34085},mptcp dss ack 1976369281], length 0
20:12:20.954774 IP 112.26.0.8.33728 > 112.26.0.1.45881: Flags [.], ack 11237, win 2419, options [nop,nop,TS val 4294822596 ecr 77806,nop,nop,sack 1 {12665:34085},mptcp dss ack 1976369281], length 0
20:12:20.973808 IP 112.26.0.8.33728 > 112.26.0.1.45881: Flags [.], ack 11237, win 2008, options [nop,nop,TS val 4294822077 ecr 77806,nop,nop,sack 2 {12665:16949}{19805:24089},mptcp dss ack 1976369281], length 0
20:12:21.048792 IP 112.26.0.1.45881 > 112.26.0.8.33728: Flags [.], seq 34085:35513, ack 1, win 1339, options [nop,nop,TS val 79619 ecr 4294821883,mptcp dss ack 3262968525 seq 1976392129 subseq 34085 len 1428 csum 0x42ff], length 1428
20:12:21.057635 IP 112.26.0.8.33728 > 112.26.0.1.45881: Flags [.], ack 11237, win 2464, options [nop,nop,TS val 4294822758 ecr 77806,nop,nop,sack 1 {12665:35513},mptcp dss ack 1976369281], length 0
20:12:21.057953 IP 112.26.0.8.33728 > 112.26.0.1.45881: Flags [.], ack 11237, win 2464, options [nop,nop,TS val 4294822758 ecr 77806,nop,nop,sack 1 {12665:35513},mptcp dss ack 1976369281], length 0
20:12:21.063881 IP 112.26.0.8.33728 > 112.26.0.1.45881: Flags [.], ack 11237, win 2054, options [nop,nop,TS val 4294822156 ecr 77806,nop,nop,sack 2 {19805:25517}{12665:16949},mptcp dss ack 1976369281], length 0
20:12:21.092632 IP 112.26.0.1.45881 > 112.26.0.8.33728: Flags [.], seq 35513:36941, ack 1, win 1339, options [nop,nop,TS val 79619 ecr 4294821883,mptcp dss ack 3262968525 seq 1976393557 subseq 35513 len 1428 csum 0x2fa4], length 1428
20:12:21.145235 IP 112.26.0.8.33728 > 112.26.0.1.45881: Flags [.], ack 11237, win 2510, options [nop,nop,TS val 4294822801 ecr 77806,nop,nop,sack 1 {12665:36941},mptcp dss ack 1976369281], length 0
20:12:21.145525 IP 112.26.0.8.33728 > 112.26.0.1.45881: Flags [.], ack 11237, win 2510, options [nop,nop,TS val 4294822801 ecr 77806,nop,nop,sack 1 {12665:36941},mptcp dss ack 1976369281], length 0
20:12:21.158682 IP 112.26.0.8.33728 > 112.26.0.1.45881: Flags [.], ack 11237, win 2099, options [nop,nop,TS val 4294822168 ecr 77806,nop,nop,sack 2 {12665:18377}{19805:25517},mptcp dss ack 1976369281], length 0
20:12:21.171233 IP 112.26.0.8.33728 > 112.26.0.1.45881: Flags [.], ack 11237, win 2145, options [nop,nop,TS val 4294822272 ecr 77806,nop,nop,sack 2 {19805:26945}{12665:18377},mptcp dss ack 1976369281], length 0
20:12:21.264624 IP 112.26.0.8.33728 > 112.26.0.1.45881: Flags [.], ack 11237, win 2190, options [nop,nop,TS val 4294822354 ecr 77806,nop,nop,sack 2 {19805:28373}{12665:18377},mptcp dss ack 1976369281], length 0
20:12:21.288653 IP 112.26.0.1.45881 > 112.26.0.8.33728: Flags [.], seq 36941:38369, ack 1, win 1339, options [nop,nop,TS val 79619 ecr 4294821883,mptcp dss ack 3262968525 seq 1976394985 subseq 36941 len 1428 csum 0x8817], length 1428
20:12:21.291239 IP 112.26.0.8.33728 > 112.26.0.1.45881: Flags [.], ack 11237, win 2555, options [nop,nop,TS val 4294822996 ecr 77806,nop,nop,sack 1 {12665:38369},mptcp dss ack 1976369281], length 0
20:12:21.291512 IP 112.26.0.8.33728 > 112.26.0.1.45881: Flags [.], ack 11237, win 2555, options [nop,nop,TS val 4294822996 ecr 77806,nop,nop,sack 1 {12665:38369},mptcp dss ack 1976369281], length 0
20:12:21.345893 IP 112.26.0.8.33728 > 112.26.0.1.45881: Flags [.], ack 11237, win 2236, options [nop,nop,TS val 4294822389 ecr 77806,nop,nop,sack 1 {12665:28373},mptcp dss ack 1976369281], length 0
20:12:21.359727 IP 112.26.0.1.45881 > 112.26.0.8.33728: Flags [.], seq 38369:39797, ack 1, win 1339, options [nop,nop,TS val 79619 ecr 4294821883,mptcp dss ack 3262968525 seq 1976396413 subseq 38369 len 1428 csum 0xe1d], length 1428
20:12:21.366307 IP 112.26.0.8.33728 > 112.26.0.1.45881: Flags [.], ack 11237, win 2601, options [nop,nop,TS val 4294823070 ecr 77806,nop,nop,sack 1 {12665:39797},mptcp dss ack 1976369281], length 0
20:12:21.366668 IP 112.26.0.8.33728 > 112.26.0.1.45881: Flags [.], ack 11237, win 2601, options [nop,nop,TS val 4294823070 ecr 77806,nop,nop,sack 1 {12665:39797},mptcp dss ack 1976369281], length 0
20:12:21.383186 IP 112.26.0.8.33728 > 112.26.0.1.45881: Flags [.], ack 11237, win 2282, options [nop,nop,TS val 4294822402 ecr 77806,nop,nop,sack 1 {12665:29801},mptcp dss ack 1976369281], length 0
20:12:21.392048 IP 112.26.0.1.45881 > 112.26.0.8.33728: Flags [.], seq 11237:12665, ack 1, win 1339, options [nop,nop,TS val 79711 ecr 4294821949,mptcp dss ack 3262968525 seq 1976369281 subseq 11237 len 1428 csum 0xf18d], length 1428
20:12:21.397756 IP 112.26.0.8.33728 > 112.26.0.1.45881: Flags [.], ack 39797, win 2647, options [nop,nop,TS val 4294823100 ecr 79711,mptcp dss ack 1976397841], length 0
20:12:21.398019 IP 112.26.0.8.33728 > 112.26.0.1.45881: Flags [.], ack 39797, win 2647, options [nop,nop,TS val 4294823100 ecr 79711,mptcp dss ack 1976397841], length 0
20:12:21.468856 IP 112.26.0.8.33728 > 112.26.0.1.45881: Flags [.], ack 11237, win 2327, options [nop,nop,TS val 4294822477 ecr 77806,nop,nop,sack 1 {12665:31229},mptcp dss ack 1976369281], length 0
20:12:21.478939 IP 112.26.0.8.33728 > 112.26.0.1.45881: Flags [.], ack 11237, win 2373, options [nop,nop,TS val 4294822572 ecr 77806,nop,nop,sack 1 {12665:32657},mptcp dss ack 1976369281], length 0
20:12:21.482665 IP 112.26.0.1.45881 > 112.26.0.8.33728: Flags [.], seq 15521:16949, ack 1, win 1339, options [nop,nop,TS val 79845 ecr 4294822067,mptcp dss ack 3262968525 seq 1976373565 subseq 15521 len 1428 csum 0xf17f], length 1428
20:12:21.485760 IP 112.26.0.8.33728 > 112.26.0.1.45881: Flags [.], ack 39797, win 2647, options [nop,nop,TS val 4294823191 ecr 79711,nop,nop,sack 1 {15521:16949},mptcp dss ack 1976397841], length 0
20:12:21.486029 IP 112.26.0.8.33728 > 112.26.0.1.45881: Flags [.], ack 39797, win 2647, options [nop,nop,TS val 4294823191 ecr 79711,nop,nop,sack 1 {15521:16949},mptcp dss ack 1976397841], length 0
20:12:21.564431 IP 112.26.0.8.33728 > 112.26.0.1.45881: Flags [.], ack 11237, win 2419, options [nop,nop,TS val 4294822596 ecr 77806,nop,nop,sack 1 {12665:34085},mptcp dss ack 1976369281], length 0
20:12:21.575217 IP 112.26.0.1.45881 > 112.26.0.8.33728: Flags [.], seq 16949:18377, ack 1, win 1339, options [nop,nop,TS val 79921 ecr 4294822077,mptcp dss ack 3262968525 seq 1976374993 subseq 16949 len 1428 csum 0xdad3], length 1428
20:12:21.577875 IP 112.26.0.8.33728 > 112.26.0.1.45881: Flags [.], ack 39797, win 2647, options [nop,nop,TS val 4294823283 ecr 79711,nop,nop,sack 1 {16949:18377},mptcp dss ack 1976397841], length 0
20:12:21.578156 IP 112.26.0.8.33728 > 112.26.0.1.45881: Flags [.], ack 39797, win 2647, options [nop,nop,TS val 4294823283 ecr 79711,nop,nop,sack 1 {16949:18377},mptcp dss ack 1976397841], length 0
20:12:21.588887 IP 112.26.0.8.33728 > 112.26.0.1.45881: Flags [.], ack 11237, win 2464, options [nop,nop,TS val 4294822758 ecr 77806,nop,nop,sack 1 {12665:35513},mptcp dss ack 1976369281], length 0
20:12:21.673708 IP 112.26.0.1.45881 > 112.26.0.8.33728: Flags [.], seq 39797:41225, ack 1, win 1339, options [nop,nop,TS val 80118 ecr 4294822168,mptcp dss ack 3262968525 seq 1976397841 subseq 39797 len 1428 csum 0xda7f], length 1428
20:12:21.676467 IP 112.26.0.8.33728 > 112.26.0.1.45881: Flags [.], ack 41225, win 2692, options [nop,nop,TS val 4294823381 ecr 80118,mptcp dss ack 1976399269], length 0
20:12:21.676788 IP 112.26.0.8.33728 > 112.26.0.1.45881: Flags [.], ack 41225, win 2692, options [nop,nop,TS val 4294823381 ecr 80118,mptcp dss ack 1976399269], length 0
20:12:21.693733 IP 112.26.0.8.33728 > 112.26.0.1.45881: Flags [.], ack 11237, win 2510, options [nop,nop,TS val 4294822801 ecr 77806,nop,nop,sack 1 {12665:36941},mptcp dss ack 1976369281], length 0
20:12:21.753103 IP 112.26.0.1.45881 > 112.26.0.8.33728: Flags [.], seq 41225:42653, ack 1, win 1339, options [nop,nop,TS val 80212 ecr 4294822272,mptcp dss ack 3262968525 seq 1976399269 subseq 41225 len 1428 csum 0xd3b8], length 1428
20:12:21.759900 IP 112.26.0.8.33728 > 112.26.0.1.45881: Flags [.], ack 42653, win 2738, options [nop,nop,TS val 4294823462 ecr 80212,mptcp dss ack 1976400697], length 0
20:12:21.760243 IP 112.26.0.8.33728 > 112.26.0.1.45881: Flags [.], ack 42653, win 2738, options [nop,nop,TS val 4294823462 ecr 80212,mptcp dss ack 1976400697], length 0
20:12:21.764251 IP 112.26.0.8.33728 > 112.26.0.1.45881: Flags [.], ack 11237, win 2555, options [nop,nop,TS val 4294822996 ecr 77806,nop,nop,sack 1 {12665:38369},mptcp dss ack 1976369281], length 0
20:12:21.788460 IP 112.26.0.1.45881 > 112.26.0.8.33728: Flags [.], seq 42653:44081, ack 1, win 1339, options [nop,nop,TS val 80293 ecr 4294822354,mptcp dss ack 3262968525 seq 1976400697 subseq 42653 len 1428 csum 0xf356], length 1428
20:12:21.791145 IP 112.26.0.8.33728 > 112.26.0.1.45881: Flags [.], ack 44081, win 2784, options [nop,nop,TS val 4294823497 ecr 80293,mptcp dss ack 1976402125], length 0
20:12:21.791425 IP 112.26.0.8.33728 > 112.26.0.1.45881: Flags [.], ack 44081, win 2784, options [nop,nop,TS val 4294823497 ecr 80293,mptcp dss ack 1976402125], length 0
20:12:21.857983 IP 112.26.0.8.33728 > 112.26.0.1.45881: Flags [.], ack 11237, win 2601, options [nop,nop,TS val 4294823070 ecr 77806,nop,nop,sack 1 {12665:39797},mptcp dss ack 1976369281], length 0
20:12:21.872926 IP 112.26.0.1.45881 > 112.26.0.8.33728: Flags [.], seq 11237:12665, ack 1, win 1339, options [nop,nop,TS val 80293 ecr 4294822389,mptcp dss ack 3262968525 seq 1976369281 subseq 11237 len 1428 csum 0xf18d], length 1428
20:12:21.875573 IP 112.26.0.8.33728 > 112.26.0.1.45881: Flags [.], ack 44081, win 2784, options [nop,nop,TS val 4294823581 ecr 80293,nop,nop,sack 1 {11237:12665},mptcp dss ack 1976402125], length 0
20:12:21.875967 IP 112.26.0.8.33728 > 112.26.0.1.45881: Flags [.], ack 44081, win 2784, options [nop,nop,TS val 4294823581 ecr 80293,nop,nop,sack 1 {11237:12665},mptcp dss ack 1976402125], length 0
20:12:21.882914 IP 112.26.0.8.33728 > 112.26.0.1.45881: Flags [.], ack 39797, win 2647, options [nop,nop,TS val 4294823100 ecr 79711,mptcp dss ack 1976397841], length 0
20:12:21.971285 IP 112.26.0.8.33728 > 112.26.0.1.45881: Flags [.], ack 39797, win 2647, options [nop,nop,TS val 4294823191 ecr 79711,nop,nop,sack 1 {15521:16949},mptcp dss ack 1976397841], length 0
20:12:21.974912 IP 112.26.0.1.45881 > 112.26.0.8.33728: Flags [.], seq 31229:32657, ack 1, win 1339, options [nop,nop,TS val 80416 ecr 4294822477,mptcp dss ack 3262968525 seq 1976389273 subseq 31229 len 1428 csum 0xa663], length 1428
20:12:21.979224 IP 112.26.0.8.33728 > 112.26.0.1.45881: Flags [.], ack 44081, win 2784, options [nop,nop,TS val 4294823683 ecr 80293,nop,nop,sack 1 {31229:32657},mptcp dss ack 1976402125], length 0
20:12:21.979501 IP 112.26.0.8.33728 > 112.26.0.1.45881: Flags [.], ack 44081, win 2784, options [nop,nop,TS val 4294823683 ecr 80293,nop,nop,sack 1 {31229:32657},mptcp dss ack 1976402125], length 0
20:12:22.052352 IP 112.26.0.8.33728 > 112.26.0.1.45881: Flags [.], ack 39797, win 2647, options [nop,nop,TS val 4294823283 ecr 79711,nop,nop,sack 1 {16949:18377},mptcp dss ack 1976397841], length 0
20:12:22.061398 IP 112.26.0.1.45881 > 112.26.0.8.33728: Flags [.], seq 32657:34085, ack 1, win 1339, options [nop,nop,TS val 80426 ecr 4294822572,mptcp dss ack 3262968525 seq 1976390701 subseq 32657 len 1428 csum 0x220e], length 1428
20:12:22.064126 IP 112.26.0.8.33728 > 112.26.0.1.45881: Flags [.], ack 44081, win 2784, options [nop,nop,TS val 4294823770 ecr 80293,nop,nop,sack 1 {32657:34085},mptcp dss ack 1976402125], length 0
20:12:22.064446 IP 112.26.0.8.33728 > 112.26.0.1.45881: Flags [.], ack 44081, win 2784, options [nop,nop,TS val 4294823770 ecr 80293,nop,nop,sack 1 {32657:34085},mptcp dss ack 1976402125], length 0
20:12:22.090925 IP 112.26.0.8.33728 > 112.26.0.1.45881: Flags [.], ack 41225, win 2692, options [nop,nop,TS val 4294823381 ecr 80118,mptcp dss ack 1976399269], length 0
20:12:22.151356 IP 112.26.0.1.45881 > 112.26.0.8.33728: Flags [.], seq 35513:36941, ack 1, win 1339, options [nop,nop,TS val 80536 ecr 4294822758,mptcp dss ack 3262968525 seq 1976393557 subseq 35513 len 1428 csum 0x2fa4], length 1428
20:12:22.158191 IP 112.26.0.8.33728 > 112.26.0.1.45881: Flags [.], ack 44081, win 2784, options [nop,nop,TS val 4294823860 ecr 80293,nop,nop,sack 1 {35513:36941},mptcp dss ack 1976402125], length 0
20:12:22.158524 IP 112.26.0.8.33728 > 112.26.0.1.45881: Flags [.], ack 44081, win 2784, options [nop,nop,TS val 4294823860 ecr 80293,nop,nop,sack 1 {35513:36941},mptcp dss ack 1976402125], length 0
20:12:22.169899 IP 112.26.0.8.33728 > 112.26.0.1.45881: Flags [.], ack 42653, win 2738, options [nop,nop,TS val 4294823462 ecr 80212,mptcp dss ack 1976400697], length 0
20:12:22.182186 IP 112.26.0.1.45881 > 112.26.0.8.33728: Flags [.], seq 36941:38369, ack 1, win 1339, options [nop,nop,TS val 80641 ecr 4294822801,mptcp dss ack 3262968525 seq 1976394985 subseq 36941 len 1428 csum 0x8817], length 1428
20:12:22.193752 IP 112.26.0.8.33728 > 112.26.0.1.45881: Flags [.], ack 44081, win 2784, options [nop,nop,TS val 4294823497 ecr 80293,mptcp dss ack 1976402125], length 0
20:12:22.200609 IP 112.26.0.8.33728 > 112.26.0.1.45881: Flags [.], ack 44081, win 2784, options [nop,nop,TS val 4294823898 ecr 80293,nop,nop,sack 1 {36941:38369},mptcp dss ack 1976402125], length 0
20:12:22.200926 IP 112.26.0.8.33728 > 112.26.0.1.45881: Flags [.], ack 44081, win 2784, options [nop,nop,TS val 4294823898 ecr 80293,nop,nop,sack 1 {36941:38369},mptcp dss ack 1976402125], length 0
20:12:22.258878 IP 112.26.0.1.45881 > 112.26.0.8.33728: Flags [.], seq 38369:39797, ack 1, win 1339, options [nop,nop,TS val 80712 ecr 4294822996,mptcp dss ack 3262968525 seq 1976396413 subseq 38369 len 1428 csum 0xe1d], length 1428
20:12:22.266269 IP 112.26.0.8.33728 > 112.26.0.1.45881: Flags [.], ack 44081, win 2784, options [nop,nop,TS val 4294823971 ecr 80293,nop,nop,sack 1 {38369:39797},mptcp dss ack 1976402125], length 0
20:12:22.266548 IP 112.26.0.8.33728 > 112.26.0.1.45881: Flags [.], ack 44081, win 2784, options [nop,nop,TS val 4294823971 ecr 80293,nop,nop,sack 1 {38369:39797},mptcp dss ack 1976402125], length 0
20:12:22.288860 IP 112.26.0.1.45881 > 112.26.0.8.33728: Flags [.], seq 44081:45509, ack 1, win 1339, options [nop,nop,TS val 80830 ecr 4294823070,mptcp dss ack 3262968525 seq 1976402125 subseq 44081 len 1428 csum 0xe3fc], length 1428
20:12:22.301753 IP 112.26.0.8.33728 > 112.26.0.1.45881: Flags [.], ack 45509, win 2829, options [nop,nop,TS val 4294824004 ecr 80830,mptcp dss ack 1976403553], length 0
20:12:22.302079 IP 112.26.0.8.33728 > 112.26.0.1.45881: Flags [.], ack 45509, win 2829, options [nop,nop,TS val 4294824004 ecr 80830,mptcp dss ack 1976403553], length 0
20:12:22.383044 IP 112.26.0.8.33728 > 112.26.0.1.45881: Flags [.], ack 44081, win 2784, options [nop,nop,TS val 4294823581 ecr 80293,nop,nop,sack 1 {11237:12665},mptcp dss ack 1976402125], length 0
20:12:22.452844 IP 112.26.0.1.45881 > 112.26.0.8.33728: Flags [.], seq 46937:48365, ack 1, win 1339, options [nop,nop,TS val 80830 ecr 4294823100,mptcp dss ack 3262968525 seq 1976404981 subseq 46937 len 1428 csum 0xc03b], length 1428
20:12:22.456440 IP 112.26.0.8.33728 > 112.26.0.1.45881: Flags [.], ack 45509, win 2875, options [nop,nop,TS val 4294824161 ecr 80830,nop,nop,sack 1 {46937:48365},mptcp dss ack 1976403553], length 0
20:12:22.456725 IP 112.26.0.8.33728 > 112.26.0.1.45881: Flags [.], ack 45509, win 2875, options [nop,nop,TS val 4294824161 ecr 80830,nop,nop,sack 1 {46937:48365},mptcp dss ack 1976403553], length 0
