20:12:17.629008 IP 112.26.0.8.33728 > 112.26.0.1.45881: Flags [S], seq 503274601, win 65535, options [mss 1460,sackOK,TS val 4294819233 ecr 0,nop,wscale 6,mptcp capable csum {0xe03f2f5bd5989db8}], length 0
20:12:17.660078 IP 112.26.0.8.33728 > 112.26.0.1.45881: Flags [S], seq 503274601, win 65535, options [mss 1460,sackOK,TS val 4294819233 ecr 0,nop,wscale 6,mptcp capable csum {0xe03f2f5bd5989db8}], length 0
20:12:17.776782 IP 112.26.0.8.33728 > 112.26.0.1.45881: Flags [S], seq 503274601, win 65535, options [mss 1460,sackOK,TS val 4294819233 ecr 0,nop,wscale 6,mptcp capable csum {0xe03f2f5bd5989db8}], length 0
20:12:18.632568 IP 112.26.0.8.33728 > 112.26.0.1.45881: Flags [S], seq 503274601, win 65535, options [mss 1460,sackOK,TS val 4294820288 ecr 0,nop,wscale 6,mptcp capable csum {0xe03f2f5bd5989db8}], length 0
20:12:18.632974 IP 112.26.0.8.33728 > 112.26.0.1.45881: Flags [S], seq 503274601, win 65535, options [mss 1460,sackOK,TS val 4294820288 ecr 0,nop,wscale 6,mptcp capable csum {0xe03f2f5bd5989db8}], length 0
20:12:18.646857 IP 112.26.0.8.33728 > 112.26.0.1.45881: Flags [S], seq 503274601, win 65535, options [mss 1460,sackOK,TS val 4294820288 ecr 0,nop,wscale 6,mptcp capable csum {0xe03f2f5bd5989db8}], length 0
20:12:18.753284 IP 112.26.0.1.45881 > 112.26.0.8.33728: Flags [S.], seq 2940828125, ack 503274602, win 65535, options [mss 1460,sackOK,TS val 77594 ecr 4294819233,nop,wscale 6,mptcp capable csum {0x87139cfff9e67aae}], length 0
20:12:18.778541 IP 112.26.0.1.45881 > 112.26.0.8.33728: Flags [S.], seq 2940828125, ack 503274602, win 65535, options [mss 1460,sackOK,TS val 77594 ecr 4294819233,nop,wscale 6,mptcp capable csum {0x87139cfff9e67aae}], length 0
20:12:18.838825 IP 112.26.0.8.33728 > 112.26.0.1.45881: Flags [.], ack 1, win 1369, options [nop,nop,TS val 4294820485 ecr 77594,mptcp capable csum {0xe03f2f5bd5989db8,0x87139cfff9e67aae},mptcp dss ack 1976358045], length 0
20:12:18.851045 IP 112.26.0.8.33728 > 112.26.0.1.45881: Flags [.], ack 1, win 1369, options [nop,nop,TS val 4294820485 ecr 77594,mptcp capable csum {0xe03f2f5bd5989db8,0x87139cfff9e67aae},mptcp dss ack 1976358045], length 0
20:12:18.852312 IP 112.26.0.8.33728 > 112.26.0.1.45881: Flags [.], ack 1, win 1369, options [nop,nop,TS val 4294820485 ecr 77594,mptcp capable csum {0xe03f2f5bd5989db8,0x87139cfff9e67aae},mptcp dss ack 1976358045], length 0
20:12:18.865711 IP 112.26.0.8.33728 > 112.26.0.1.45881: Flags [.], ack 1, win 1369, options [nop,nop,TS val 4294820485 ecr 77594,mptcp add-addr id 3 112.26.1.8,mptcp dss ack 1976358045], length 0
20:12:18.886209 IP 112.26.0.8.33728 > 112.26.0.1.45881: Flags [.], ack 1, win 1369, options [nop,nop,TS val 4294820485 ecr 77594,mptcp add-addr id 3 112.26.1.8,mptcp dss ack 1976358045], length 0
20:12:18.887506 IP 112.26.0.1.45881 > 112.26.0.8.33728: Flags [.], ack 1, win 1339, options [nop,nop,TS val 77799 ecr 4294820485,mptcp add-addr id 3 112.26.1.1,mptcp dss ack 3262968525], length 0
20:12:18.935351 IP 112.26.0.8.33728 > 112.26.0.1.45881: Flags [.], ack 1, win 1369, options [nop,nop,TS val 4294820485 ecr 77594,mptcp add-addr id 5 112.26.3.8,mptcp dss ack 1976358045], length 0
20:12:18.951337 IP 112.26.0.8.33728 > 112.26.0.1.45881: Flags [.], ack 1, win 1369, options [nop,nop,TS val 4294820485 ecr 77594,mptcp add-addr id 3 112.26.1.8,mptcp dss ack 1976358045], length 0
20:12:18.957981 IP 112.26.0.8.33728 > 112.26.0.1.45881: Flags [.], ack 1, win 1369, options [nop,nop,TS val 4294820485 ecr 77594,mptcp add-addr id 6 112.26.2.8,mptcp dss ack 1976358045], length 0
20:12:18.964393 IP 112.26.0.1.45881 > 112.26.0.8.33728: Flags [.], ack 1, win 1339, options [nop,nop,TS val 77799 ecr 4294820485,mptcp add-addr id 3 112.26.1.1,mptcp dss ack 3262968525], length 0
20:12:18.972029 IP 112.26.0.1.45881 > 112.26.0.8.33728: Flags [.], ack 1, win 1339, options [nop,nop,TS val 77799 ecr 4294820485,mptcp add-addr id 4 112.26.2.1,mptcp dss ack 3262968525], length 0
20:12:19.038598 IP 112.26.0.8.33728 > 112.26.0.1.45881: Flags [.], ack 1, win 1369, options [nop,nop,TS val 4294820485 ecr 77594,mptcp add-addr id 5 112.26.3.8,mptcp dss ack 1976358045], length 0
20:12:19.053053 IP 112.26.0.8.33728 > 112.26.0.1.45881: Flags [.], ack 1, win 1369, options [nop,nop,TS val 4294820485 ecr 77594,mptcp add-addr id 6 112.26.2.8,mptcp dss ack 1976358045], length 0
20:12:19.059444 IP 112.26.0.1.45881 > 112.26.0.8.33728: Flags [.], ack 1, win 1339, options [nop,nop,TS val 77799 ecr 4294820485,mptcp add-addr id 6 112.26.3.1,mptcp dss ack 3262968525], length 0
20:12:19.135107 IP 112.26.0.1.45881 > 112.26.0.8.33728: Flags [.], ack 1, win 1339, options [nop,nop,TS val 77799 ecr 4294820485,mptcp add-addr id 4 112.26.2.1,mptcp dss ack 3262968525], length 0
20:12:19.143497 IP 112.26.0.1.45881 > 112.26.0.8.33728: Flags [.], seq 1:1429, ack 1, win 1339, options [nop,nop,TS val 77805 ecr 4294820485,mptcp dss ack 3262968525 seq 1976358045 subseq 1 len 1428 csum 0xaf6e], length 1428
20:12:19.148310 IP 112.26.0.1.45881 > 112.26.0.8.33728: Flags [.], ack 1, win 1339, options [nop,nop,TS val 77799 ecr 4294820485,mptcp add-addr id 6 112.26.3.1,mptcp dss ack 3262968525], length 0
20:12:19.155265 IP 112.26.0.1.45881 > 112.26.0.8.33728: Flags [.], seq 1429:2857, ack 1, win 1339, options [nop,nop,TS val 77805 ecr 4294820485,mptcp dss ack 3262968525 seq 1976359473 subseq 1429 len 1428 csum 0xcebc], length 1428
20:12:19.239165 IP 112.26.0.1.45881 > 112.26.0.8.33728: Flags [.], seq 1:1429, ack 1, win 1339, options [nop,nop,TS val 77805 ecr 4294820485,mptcp dss ack 3262968525 seq 1976358045 subseq 1 len 1428 csum 0xaf6e], length 1428
20:12:19.240739 IP 112.26.0.8.33728 > 112.26.0.1.45881: Flags [.], ack 1429, win 1415, options [nop,nop,TS val 4294820945 ecr 77805,mptcp dss ack 1976359473], length 0
20:12:19.249619 IP 112.26.0.8.33728 > 112.26.0.1.45881: Flags [.], ack 1, win 1369, options [nop,nop,TS val 4294820485 ecr 77594,mptcp add-addr id 5 112.26.3.8,mptcp dss ack 1976358045], length 0
20:12:19.257529 IP 112.26.0.1.45881 > 112.26.0.8.33728: Flags [.], seq 1429:2857, ack 1, win 1339, options [nop,nop,TS val 77805 ecr 4294820485,mptcp dss ack 3262968525 seq 1976359473 subseq 1429 len 1428 csum 0xcebc], length 1428
20:12:19.260109 IP 112.26.0.8.33728 > 112.26.0.1.45881: Flags [.], ack 2857, win 1460, options [nop,nop,TS val 4294820964 ecr 77805,mptcp dss ack 1976360901], length 0
20:12:19.332823 IP 112.26.0.1.45881 > 112.26.0.8.33728: Flags [P.], seq 2857:4097, ack 1, win 1339, options [nop,nop,TS val 77805 ecr 4294820485,mptcp dss ack 3262968525 seq 1976360901 subseq 2857 len 1240 csum 0xf8f], length 1240
20:12:19.349911 IP 112.26.0.8.33728 > 112.26.0.1.45881: Flags [.], ack 1, win 1369, options [nop,nop,TS val 4294820485 ecr 77594,mptcp add-addr id 6 112.26.2.8,mptcp dss ack 1976358045], length 0
20:12:19.354625 IP 112.26.0.8.33728 > 112.26.0.1.45881: Flags [.], ack 1429, win 1415, options [nop,nop,TS val 4294820945 ecr 77805,mptcp dss ack 1976359473], length 0
20:12:19.444191 IP 112.26.0.8.33728 > 112.26.0.1.45881: Flags [.], ack 2857, win 1460, options [nop,nop,TS val 4294820964 ecr 77805,mptcp dss ack 1976360901], length 0
20:12:19.448125 IP 112.26.0.1.45881 > 112.26.0.8.33728: Flags [.], seq 4097:5525, ack 1, win 1339, options [nop,nop,TS val 77805 ecr 4294820485,mptcp dss ack 3262968525 seq 1976362141 subseq 4097 len 1428 csum 0x3c8], length 1428
20:12:19.458558 IP 112.26.0.8.33728 > 112.26.0.1.45881: Flags [.], ack 4097, win 1506, options [nop,nop,TS val 4294821163 ecr 77805,mptcp dss ack 1976362141], length 0
20:12:19.461229 IP 112.26.0.1.45881 > 112.26.0.8.33728: Flags [P.], seq 2857:4097, ack 1, win 1339, options [nop,nop,TS val 77805 ecr 4294820485,mptcp dss ack 3262968525 seq 1976360901 subseq 2857 len 1240 csum 0xf8f], length 1240
20:12:19.543178 IP 112.26.0.1.45881 > 112.26.0.8.33728: Flags [.], seq 4097:5525, ack 1, win 1339, options [nop,nop,TS val 77805 ecr 4294820485,mptcp dss ack 3262968525 seq 1976362141 subseq 4097 len 1428 csum 0x3c8], length 1428
20:12:19.549696 IP 112.26.0.1.45881 > 112.26.0.8.33728: Flags [.], seq 5525:6953, ack 1, win 1339, options [nop,nop,TS val 77806 ecr 4294820485,mptcp dss ack 3262968525 seq 1976363569 subseq 5525 len 1428 csum 0x603d], length 1428
20:12:19.556385 IP 112.26.0.8.33728 > 112.26.0.1.45881: Flags [.], ack 5525, win 1552, options [nop,nop,TS val 4294821250 ecr 77805,mptcp dss ack 1976363569], length 0
20:12:19.570963 IP 112.26.0.1.45881 > 112.26.0.8.33728: Flags [.], seq 6953:8381, ack 1, win 1339, options [nop,nop,TS val 77806 ecr 4294820485,mptcp dss ack 3262968525 seq 1976364997 subseq 6953 len 1428 csum 0xfa09], length 1428
20:12:19.643919 IP 112.26.0.8.33728 > 112.26.0.1.45881: Flags [.], ack 4097, win 1506, options [nop,nop,TS val 4294821163 ecr 77805,mptcp dss ack 1976362141], length 0
20:12:19.652892 IP 112.26.0.1.45881 > 112.26.0.8.33728: Flags [.], seq 8381:9809, ack 1, win 1339, options [nop,nop,TS val 77806 ecr 4294820485,mptcp dss ack 3262968525 seq 1976366425 subseq 8381 len 1428 csum 0xc99b], length 1428
20:12:19.658931 IP 112.26.0.1.45881 > 112.26.0.8.33728: Flags [.], seq 5525:6953, ack 1, win 1339, options [nop,nop,TS val 77806 ecr 4294820485,mptcp dss ack 3262968525 seq 1976363569 subseq 5525 len 1428 csum 0x603d], length 1428
20:12:19.663002 IP 112.26.0.8.33728 > 112.26.0.1.45881: Flags [.], ack 6953, win 1597, options [nop,nop,TS val 4294821366 ecr 77806,mptcp dss ack 1976364997], length 0
20:12:19.738453 IP 112.26.0.1.45881 > 112.26.0.8.33728: Flags [.], seq 9809:11237, ack 1, win 1339, options [nop,nop,TS val 77806 ecr 4294820485,mptcp dss ack 3262968525 seq 1976367853 subseq 9809 len 1428 csum 0xc207], length 1428
20:12:19.743370 IP 112.26.0.8.33728 > 112.26.0.1.45881: Flags [.], ack 5525, win 1552, options [nop,nop,TS val 4294821250 ecr 77805,mptcp dss ack 1976363569], length 0
20:12:19.747998 IP 112.26.0.8.33728 > 112.26.0.1.45881: Flags [.], ack 1429, win 1415, options [nop,nop,TS val 4294820945 ecr 77805,mptcp dss ack 1976359473], length 0
20:12:19.761478 IP 112.26.0.1.45881 > 112.26.0.8.33728: Flags [.], seq 6953:8381, ack 1, win 1339, options [nop,nop,TS val 77806 ecr 4294820485,mptcp dss ack 3262968525 seq 1976364997 subseq 6953 len 1428 csum 0xfa09], length 1428
20:12:19.762839 IP 112.26.0.8.33728 > 112.26.0.1.45881: Flags [.], ack 8381, win 1643, options [nop,nop,TS val 4294821468 ecr 77806,mptcp dss ack 1976366425], length 0
20:12:19.847209 IP 112.26.0.8.33728 > 112.26.0.1.45881: Flags [.], ack 2857, win 1460, options [nop,nop,TS val 4294820964 ecr 77805,mptcp dss ack 1976360901], length 0
20:12:19.849750 IP 112.26.0.1.45881 > 112.26.0.8.33728: Flags [.], seq 8381:9809, ack 1, win 1339, options [nop,nop,TS val 77806 ecr 4294820485,mptcp dss ack 3262968525 seq 1976366425 subseq 8381 len 1428 csum 0xc99b], length 1428
20:12:19.853257 IP 112.26.0.8.33728 > 112.26.0.1.45881: Flags [.], ack 9809, win 1689, options [nop,nop,TS val 4294821557 ecr 77806,mptcp dss ack 1976367853], length 0
20:12:19.866941 IP 112.26.0.8.33728 > 112.26.0.1.45881: Flags [.], ack 6953, win 1597, options [nop,nop,TS val 4294821366 ecr 77806,mptcp dss ack 1976364997], length 0
20:12:19.949895 IP 112.26.0.1.45881 > 112.26.0.8.33728: Flags [.], seq 9809:11237, ack 1, win 1339, options [nop,nop,TS val 77806 ecr 4294820485,mptcp dss ack 3262968525 seq 1976367853 subseq 9809 len 1428 csum 0xc207], length 1428
20:12:19.952042 IP 112.26.0.8.33728 > 112.26.0.1.45881: Flags [.], ack 11237, win 1734, options [nop,nop,TS val 4294821657 ecr 77806,mptcp dss ack 1976369281], length 0
20:12:19.959809 IP 112.26.0.1.45881 > 112.26.0.8.33728: Flags [.], seq 12665:14093, ack 1, win 1339, options [nop,nop,TS val 78424 ecr 4294820485,mptcp dss ack 3262968525 seq 1976370709 subseq 12665 len 1428 csum 0x338b], length 1428
20:12:19.965808 IP 112.26.0.8.33728 > 112.26.0.1.45881: Flags [.], ack 8381, win 1643, options [nop,nop,TS val 4294821468 ecr 77806,mptcp dss ack 1976366425], length 0
20:12:20.039055 IP 112.26.0.8.33728 > 112.26.0.1.45881: Flags [.], ack 4097, win 1506, options [nop,nop,TS val 4294821163 ecr 77805,mptcp dss ack 1976362141], length 0
20:12:20.065731 IP 112.26.0.8.33728 > 112.26.0.1.45881: Flags [.], ack 9809, win 1689, options [nop,nop,TS val 4294821557 ecr 77806,mptcp dss ack 1976367853], length 0
20:12:20.075912 IP 112.26.0.8.33728 > 112.26.0.1.45881: Flags [.], ack 5525, win 1552, options [nop,nop,TS val 4294821250 ecr 77805,mptcp dss ack 1976363569], length 0
20:12:20.153355 IP 112.26.0.8.33728 > 112.26.0.1.45881: Flags [.], ack 11237, win 1734, options [nop,nop,TS val 4294821657 ecr 77806,mptcp dss ack 1976369281], length 0
20:12:20.168470 IP 112.26.0.1.45881 > 112.26.0.8.33728: Flags [.], seq 14093:15521, ack 1, win 1339, options [nop,nop,TS val 78695 ecr 4294820945,mptcp dss ack 3262968525 seq 1976372137 subseq 14093 len 1428 csum 0x8624], length 1428
20:12:20.176379 IP 112.26.0.1.45881 > 112.26.0.8.33728: Flags [.], seq 12665:14093, ack 1, win 1339, options [nop,nop,TS val 78424 ecr 4294820485,mptcp dss ack 3262968525 seq 1976370709 subseq 12665 len 1428 csum 0x338b], length 1428
20:12:20.178687 IP 112.26.0.8.33728 > 112.26.0.1.45881: Flags [.], ack 11237, win 1780, options [nop,nop,TS val 4294821883 ecr 77806,nop,nop,sack 1 {12665:14093},mptcp dss ack 1976369281], length 0
20:12:20.182307 IP 112.26.0.1.45881 > 112.26.0.8.33728: Flags [.], seq 19805:21233, ack 1, win 1339, options [nop,nop,TS val 78986 ecr 4294821163,mptcp dss ack 3262968525 seq 1976377849 subseq 19805 len 1428 csum 0xa3c1], length 1428
20:12:20.188794 IP 112.26.0.1.45881 > 112.26.0.8.33728: Flags [.], seq 15521:16949, ack 1, win 1339, options [nop,nop,TS val 78695 ecr 4294820945,mptcp dss ack 3262968525 seq 1976373565 subseq 15521 len 1428 csum 0xf17f], length 1428
20:12:20.241861 IP 112.26.0.1.45881 > 112.26.0.8.33728: Flags [.], seq 19805:21233, ack 1, win 1339, options [nop,nop,TS val 78986 ecr 4294821163,mptcp dss ack 3262968525 seq 1976377849 subseq 19805 len 1428 csum 0xa3c1], length 1428
20:12:20.256844 IP 112.26.0.8.33728 > 112.26.0.1.45881: Flags [.], ack 11237, win 1825, options [nop,nop,TS val 4294821949 ecr 77806,nop,nop,sack 2 {19805:21233}{12665:14093},mptcp dss ack 1976369281], length 0
20:12:20.260151 IP 112.26.0.1.45881 > 112.26.0.8.33728: Flags [.], seq 16949:18377, ack 1, win 1339, options [nop,nop,TS val 78794 ecr 4294820964,mptcp dss ack 3262968525 seq 1976374993 subseq 16949 len 1428 csum 0xdad3], length 1428
20:12:20.264737 IP 112.26.0.1.45881 > 112.26.0.8.33728: Flags [.], seq 21233:22661, ack 1, win 1339, options [nop,nop,TS val 78986 ecr 4294821163,mptcp dss ack 3262968525 seq 1976379277 subseq 21233 len 1428 csum 0xecc1], length 1428
20:12:20.271069 IP 112.26.0.1.45881 > 112.26.0.8.33728: Flags [.], seq 14093:15521, ack 1, win 1339, options [nop,nop,TS val 78695 ecr 4294820945,mptcp dss ack 3262968525 seq 1976372137 subseq 14093 len 1428 csum 0x8624], length 1428
20:12:20.279482 IP 112.26.0.8.33728 > 112.26.0.1.45881: Flags [.], ack 11237, win 1871, options [nop,nop,TS val 4294821973 ecr 77806,nop,nop,sack 2 {19805:22661}{12665:14093},mptcp dss ack 1976369281], length 0
20:12:20.284991 IP 112.26.0.8.33728 > 112.26.0.1.45881: Flags [.], ack 11237, win 1780, options [nop,nop,TS val 4294821883 ecr 77806,nop,nop,sack 1 {12665:14093},mptcp dss ack 1976369281], length 0
20:12:20.340668 IP 112.26.0.8.33728 > 112.26.0.1.45881: Flags [.], ack 6953, win 1597, options [nop,nop,TS val 4294821366 ecr 77806,mptcp dss ack 1976364997], length 0
20:12:20.344975 IP 112.26.0.1.45881 > 112.26.0.8.33728: Flags [.], seq 21233:22661, ack 1, win 1339, options [nop,nop,TS val 78986 ecr 4294821163,mptcp dss ack 3262968525 seq 1976379277 subseq 21233 len 1428 csum 0xecc1], length 1428
20:12:20.351005 IP 112.26.0.8.33728 > 112.26.0.1.45881: Flags [.], ack 11237, win 1917, options [nop,nop,TS val 4294821978 ecr 77806,nop,nop,sack 2 {12665:15521}{19805:22661},mptcp dss ack 1976369281], length 0
20:12:20.358465 IP 112.26.0.1.45881 > 112.26.0.8.33728: Flags [.], seq 22661:24089, ack 1, win 1339, options [nop,nop,TS val 79023 ecr 4294821250,mptcp dss ack 3262968525 seq 1976380705 subseq 22661 len 1428 csum 0x495c], length 1428
20:12:20.361987 IP 112.26.0.1.45881 > 112.26.0.8.33728: Flags [.], seq 22661:24089, ack 1, win 1339, options [nop,nop,TS val 79023 ecr 4294821250,mptcp dss ack 3262968525 seq 1976380705 subseq 22661 len 1428 csum 0x495c], length 1428
20:12:20.369942 IP 112.26.0.1.45881 > 112.26.0.8.33728: Flags [.], seq 15521:16949, ack 1, win 1339, options [nop,nop,TS val 78695 ecr 4294820945,mptcp dss ack 3262968525 seq 1976373565 subseq 15521 len 1428 csum 0xf17f], length 1428
20:12:20.374776 IP 112.26.0.8.33728 > 112.26.0.1.45881: Flags [.], ack 11237, win 1962, options [nop,nop,TS val 4294822067 ecr 77806,nop,nop,sack 2 {19805:24089}{12665:15521},mptcp dss ack 1976369281], length 0
20:12:20.381007 IP 112.26.0.1.45881 > 112.26.0.8.33728: Flags [.], seq 18377:19805, ack 1, win 1339, options [nop,nop,TS val 78794 ecr 4294820964,mptcp dss ack 3262968525 seq 1976376421 subseq 18377 len 1428 csum 0xe41f], length 1428
20:12:20.440170 IP 112.26.0.8.33728 > 112.26.0.1.45881: Flags [.], ack 11237, win 1825, options [nop,nop,TS val 4294821949 ecr 77806,nop,nop,sack 2 {19805:21233}{12665:14093},mptcp dss ack 1976369281], length 0
20:12:20.447359 IP 112.26.0.1.45881 > 112.26.0.8.33728: Flags [.], seq 24089:25517, ack 1, win 1339, options [nop,nop,TS val 79023 ecr 4294821250,mptcp dss ack 3262968525 seq 1976382133 subseq 24089 len 1428 csum 0xe12a], length 1428
20:12:20.452942 IP 112.26.0.1.45881 > 112.26.0.8.33728: Flags [.], seq 24089:25517, ack 1, win 1339, options [nop,nop,TS val 79023 ecr 4294821250,mptcp dss ack 3262968525 seq 1976382133 subseq 24089 len 1428 csum 0xe12a], length 1428
20:12:20.457815 IP 112.26.0.8.33728 > 112.26.0.1.45881: Flags [.], ack 11237, win 2008, options [nop,nop,TS val 4294822077 ecr 77806,nop,nop,sack 2 {12665:16949}{19805:24089},mptcp dss ack 1976369281], length 0
20:12:20.461413 IP 112.26.0.1.45881 > 112.26.0.8.33728: Flags [.], seq 16949:18377, ack 1, win 1339, options [nop,nop,TS val 78794 ecr 4294820964,mptcp dss ack 3262968525 seq 1976374993 subseq 16949 len 1428 csum 0xdad3], length 1428
20:12:20.469931 IP 112.26.0.8.33728 > 112.26.0.1.45881: Flags [.], ack 8381, win 1643, options [nop,nop,TS val 4294821468 ecr 77806,mptcp dss ack 1976366425], length 0
20:12:20.484607 IP 112.26.0.8.33728 > 112.26.0.1.45881: Flags [.], ack 11237, win 2054, options [nop,nop,TS val 4294822156 ecr 77806,nop,nop,sack 2 {19805:25517}{12665:16949},mptcp dss ack 1976369281], length 0
20:12:20.541796 IP 112.26.0.8.33728 > 112.26.0.1.45881: Flags [.], ack 9809, win 1689, options [nop,nop,TS val 4294821557 ecr 77806,mptcp dss ack 1976367853], length 0
20:12:20.544229 IP 112.26.0.8.33728 > 112.26.0.1.45881: Flags [.], ack 11237, win 1871, options [nop,nop,TS val 4294821973 ecr 77806,nop,nop,sack 2 {19805:22661}{12665:14093},mptcp dss ack 1976369281], length 0
20:12:20.552759 IP 112.26.0.8.33728 > 112.26.0.1.45881: Flags [.], ack 11237, win 2099, options [nop,nop,TS val 4294822168 ecr 77806,nop,nop,sack 2 {12665:18377}{19805:25517},mptcp dss ack 1976369281], length 0
20:12:20.563288 IP 112.26.0.1.45881 > 112.26.0.8.33728: Flags [.], seq 25517:26945, ack 1, win 1339, options [nop,nop,TS val 79287 ecr 4294821366,mptcp dss ack 3262968525 seq 1976383561 subseq 25517 len 1428 csum 0xfb28], length 1428
20:12:20.567020 IP 112.26.0.8.33728 > 112.26.0.1.45881: Flags [.], ack 11237, win 2145, options [nop,nop,TS val 4294822272 ecr 77806,nop,nop,sack 2 {19805:26945}{12665:18377},mptcp dss ack 1976369281], length 0
20:12:20.568523 IP 112.26.0.1.45881 > 112.26.0.8.33728: Flags [.], seq 25517:26945, ack 1, win 1339, options [nop,nop,TS val 79287 ecr 4294821366,mptcp dss ack 3262968525 seq 1976383561 subseq 25517 len 1428 csum 0xfb28], length 1428
20:12:20.578234 IP 112.26.0.8.33728 > 112.26.0.1.45881: Flags [.], ack 11237, win 1917, options [nop,nop,TS val 4294821978 ecr 77806,nop,nop,sack 2 {12665:15521}{19805:22661},mptcp dss ack 1976369281], length 0
20:12:20.645933 IP 112.26.0.1.45881 > 112.26.0.8.33728: Flags [.], seq 26945:28373, ack 1, win 1339, options [nop,nop,TS val 79287 ecr 4294821366,mptcp dss ack 3262968525 seq 1976384989 subseq 26945 len 1428 csum 0x8125], length 1428
20:12:20.650301 IP 112.26.0.8.33728 > 112.26.0.1.45881: Flags [.], ack 11237, win 2190, options [nop,nop,TS val 4294822354 ecr 77806,nop,nop,sack 2 {19805:28373}{12665:18377},mptcp dss ack 1976369281], length 0
20:12:20.653360 IP 112.26.0.1.45881 > 112.26.0.8.33728: Flags [.], seq 26945:28373, ack 1, win 1339, options [nop,nop,TS val 79287 ecr 4294821366,mptcp dss ack 3262968525 seq 1976384989 subseq 26945 len 1428 csum 0x8125], length 1428
20:12:20.662147 IP 112.26.0.8.33728 > 112.26.0.1.45881: Flags [.], ack 11237, win 1962, options [nop,nop,TS val 4294822067 ecr 77806,nop,nop,sack 2 {19805:24089}{12665:15521},mptcp dss ack 1976369281], length 0
20:12:20.672297 IP 112.26.0.8.33728 > 112.26.0.1.45881: Flags [.], ack 11237, win 1780, options [nop,nop,TS val 4294821883 ecr 77806,nop,nop,sack 1 {12665:14093},mptcp dss ack 1976369281], length 0
20:12:20.686202 IP 112.26.0.1.45881 > 112.26.0.8.33728: Flags [.], seq 18377:19805, ack 1, win 1339, options [nop,nop,TS val 78794 ecr 4294820964,mptcp dss ack 3262968525 seq 1976376421 subseq 18377 len 1428 csum 0xe41f], length 1428
20:12:20.689467 IP 112.26.0.1.45881 > 112.26.0.8.33728: Flags [.], seq 28373:29801, ack 1, win 1339, options [nop,nop,TS val 79417 ecr 4294821468,mptcp dss ack 3262968525 seq 1976386417 subseq 28373 len 1428 csum 0x8d82], length 1428
20:12:20.694965 IP 112.26.0.1.45881 > 112.26.0.8.33728: Flags [.], seq 28373:29801, ack 1, win 1339, options [nop,nop,TS val 79417 ecr 4294821468,mptcp dss ack 3262968525 seq 1976386417 subseq 28373 len 1428 csum 0x8d82], length 1428
20:12:20.739255 IP 112.26.0.8.33728 > 112.26.0.1.45881: Flags [.], ack 11237, win 2236, options [nop,nop,TS val 4294822389 ecr 77806,nop,nop,sack 1 {12665:28373},mptcp dss ack 1976369281], length 0
20:12:20.744796 IP 112.26.0.8.33728 > 112.26.0.1.45881: Flags [.], ack 11237, win 2282, options [nop,nop,TS val 4294822402 ecr 77806,nop,nop,sack 1 {12665:29801},mptcp dss ack 1976369281], length 0
20:12:20.752656 IP 112.26.0.8.33728 > 112.26.0.1.45881: Flags [.], ack 11237, win 2008, options [nop,nop,TS val 4294822077 ecr 77806,nop,nop,sack 2 {12665:16949}{19805:24089},mptcp dss ack 1976369281], length 0
20:12:20.756592 IP 112.26.0.1.45881 > 112.26.0.8.33728: Flags [.], seq 29801:31229, ack 1, win 1339, options [nop,nop,TS val 79417 ecr 4294821468,mptcp dss ack 3262968525 seq 1976387845 subseq 29801 len 1428 csum 0xb323], length 1428
20:12:20.767317 IP 112.26.0.8.33728 > 112.26.0.1.45881: Flags [.], ack 11237, win 1825, options [nop,nop,TS val 4294821949 ecr 77806,nop,nop,sack 2 {19805:21233}{12665:14093},mptcp dss ack 1976369281], length 0
20:12:20.770658 IP 112.26.0.1.45881 > 112.26.0.8.33728: Flags [.], seq 29801:31229, ack 1, win 1339, options [nop,nop,TS val 79417 ecr 4294821468,mptcp dss ack 3262968525 seq 1976387845 subseq 29801 len 1428 csum 0xb323], length 1428
20:12:20.774935 IP 112.26.0.8.33728 > 112.26.0.1.45881: Flags [.], ack 11237, win 2054, options [nop,nop,TS val 4294822156 ecr 77806,nop,nop,sack 2 {19805:25517}{12665:16949},mptcp dss ack 1976369281], length 0
20:12:20.779728 IP 112.26.0.8.33728 > 112.26.0.1.45881: Flags [.], ack 11237, win 2327, options [nop,nop,TS val 4294822477 ecr 77806,nop,nop,sack 1 {12665:31229},mptcp dss ack 1976369281], length 0
20:12:20.795907 IP 112.26.0.8.33728 > 112.26.0.1.45881: Flags [.], ack 11237, win 1871, options [nop,nop,TS val 4294821973 ecr 77806,nop,nop,sack 2 {19805:22661}{12665:14093},mptcp dss ack 1976369281], length 0
20:12:20.854834 IP 112.26.0.1.45881 > 112.26.0.8.33728: Flags [.], seq 31229:32657, ack 1, win 1339, options [nop,nop,TS val 79488 ecr 4294821557,mptcp dss ack 3262968525 seq 1976389273 subseq 31229 len 1428 csum 0xa663], length 1428
20:12:20.864877 IP 112.26.0.1.45881 > 112.26.0.8.33728: Flags [.], seq 31229:32657, ack 1, win 1339, options [nop,nop,TS val 79488 ecr 4294821557,mptcp dss ack 3262968525 seq 1976389273 subseq 31229 len 1428 csum 0xa663], length 1428
20:12:20.870045 IP 112.26.0.8.33728 > 112.26.0.1.45881: Flags [.], ack 11237, win 1917, options [nop,nop,TS val 4294821978 ecr 77806,nop,nop,sack 2 {12665:15521}{19805:22661},mptcp dss ack 1976369281], length 0
20:12:20.875641 IP 112.26.0.8.33728 > 112.26.0.1.45881: Flags [.], ack 11237, win 2099, options [nop,nop,TS val 4294822168 ecr 77806,nop,nop,sack 2 {12665:18377}{19805:25517},mptcp dss ack 1976369281], length 0
20:12:20.878474 IP 112.26.0.8.33728 > 112.26.0.1.45881: Flags [.], ack 11237, win 2373, options [nop,nop,TS val 4294822572 ecr 77806,nop,nop,sack 1 {12665:32657},mptcp dss ack 1976369281], length 0
20:12:20.887327 IP 112.26.0.1.45881 > 112.26.0.8.33728: Flags [.], seq 32657:34085, ack 1, win 1339, options [nop,nop,TS val 79488 ecr 4294821557,mptcp dss ack 3262968525 seq 1976390701 subseq 32657 len 1428 csum 0x220e], length 1428
20:12:20.891915 IP 112.26.0.8.33728 > 112.26.0.1.45881: Flags [.], ack 11237, win 2145, options [nop,nop,TS val 4294822272 ecr 77806,nop,nop,sack 2 {19805:26945}{12665:18377},mptcp dss ack 1976369281], length 0
20:12:20.897785 IP 112.26.0.8.33728 > 112.26.0.1.45881: Flags [.], ack 11237, win 1962, options [nop,nop,TS val 4294822067 ecr 77806,nop,nop,sack 2 {19805:24089}{12665:15521},mptcp dss ack 1976369281], length 0
20:12:20.939161 IP 112.26.0.1.45881 > 112.26.0.8.33728: Flags [.], seq 32657:34085, ack 1, win 1339, options [nop,nop,TS val 79488 ecr 4294821557,mptcp dss ack 3262968525 seq 1976390701 subseq 32657 len 1428 csum 0x220e], length 1428
20:12:20.951504 IP 112.26.0.8.33728 > 112.26.0.1.45881: Flags [.], ack 11237, win 2190, options [nop,nop,TS val 4294822354 ecr 77806,nop,nop,sack 2 {19805:28373}{12665:18377},mptcp dss ack 1976369281], length 0
20:12:20.954362 IP 112.26.0.8.33728 > 112.26.0.1.45881: Flags [.], ack 11237, win 2419, options [nop,nop,TS val 4294822596 ecr 77806,nop,nop,sack 1 {12665:34085},mptcp dss ack 1976369281], length 0
20:12:20.974029 IP 112.26.0.8.33728 > 112.26.0.1.45881: Flags [.], ack 11237, win 2008, options [nop,nop,TS val 4294822077 ecr 77806,nop,nop,sack 2 {12665:16949}{19805:24089},mptcp dss ack 1976369281], length 0
20:12:20.981989 IP 112.26.0.8.33728 > 112.26.0.1.45881: Flags [.], ack 11237, win 2236, options [nop,nop,TS val 4294822389 ecr 77806,nop,nop,sack 1 {12665:28373},mptcp dss ack 1976369281], length 0
20:12:21.048602 IP 112.26.0.1.45881 > 112.26.0.8.33728: Flags [.], seq 34085:35513, ack 1, win 1339, options [nop,nop,TS val 79619 ecr 4294821883,mptcp dss ack 3262968525 seq 1976392129 subseq 34085 len 1428 csum 0x42ff], length 1428
20:12:21.055193 IP 112.26.0.8.33728 > 112.26.0.1.45881: Flags [.], ack 11237, win 2282, options [nop,nop,TS val 4294822402 ecr 77806,nop,nop,sack 1 {12665:29801},mptcp dss ack 1976369281], length 0
20:12:21.057522 IP 112.26.0.8.33728 > 112.26.0.1.45881: Flags [.], ack 11237, win 2464, options [nop,nop,TS val 4294822758 ecr 77806,nop,nop,sack 1 {12665:35513},mptcp dss ack 1976369281], length 0
20:12:21.059629 IP 112.26.0.1.45881 > 112.26.0.8.33728: Flags [.], seq 34085:35513, ack 1, win 1339, options [nop,nop,TS val 79619 ecr 4294821883,mptcp dss ack 3262968525 seq 1976392129 subseq 34085 len 1428 csum 0x42ff], length 1428
20:12:21.064115 IP 112.26.0.8.33728 > 112.26.0.1.45881: Flags [.], ack 11237, win 2054, options [nop,nop,TS val 4294822156 ecr 77806,nop,nop,sack 2 {19805:25517}{12665:16949},mptcp dss ack 1976369281], length 0
20:12:21.071769 IP 112.26.0.8.33728 > 112.26.0.1.45881: Flags [.], ack 11237, win 2327, options [nop,nop,TS val 4294822477 ecr 77806,nop,nop,sack 1 {12665:31229},mptcp dss ack 1976369281], length 0
20:12:21.085705 IP 112.26.0.8.33728 > 112.26.0.1.45881: Flags [.], ack 11237, win 2373, options [nop,nop,TS val 4294822572 ecr 77806,nop,nop,sack 1 {12665:32657},mptcp dss ack 1976369281], length 0
20:12:21.092523 IP 112.26.0.1.45881 > 112.26.0.8.33728: Flags [.], seq 35513:36941, ack 1, win 1339, options [nop,nop,TS val 79619 ecr 4294821883,mptcp dss ack 3262968525 seq 1976393557 subseq 35513 len 1428 csum 0x2fa4], length 1428
20:12:21.145044 IP 112.26.0.8.33728 > 112.26.0.1.45881: Flags [.], ack 11237, win 2510, options [nop,nop,TS val 4294822801 ecr 77806,nop,nop,sack 1 {12665:36941},mptcp dss ack 1976369281], length 0
20:12:21.147156 IP 112.26.0.1.45881 > 112.26.0.8.33728: Flags [.], seq 35513:36941, ack 1, win 1339, options [nop,nop,TS val 79619 ecr 4294821883,mptcp dss ack 3262968525 seq 1976393557 subseq 35513 len 1428 csum 0x2fa4], length 1428
20:12:21.158905 IP 112.26.0.8.33728 > 112.26.0.1.45881: Flags [.], ack 11237, win 2099, options [nop,nop,TS val 4294822168 ecr 77806,nop,nop,sack 2 {12665:18377}{19805:25517},mptcp dss ack 1976369281], length 0
20:12:21.165549 IP 112.26.0.8.33728 > 112.26.0.1.45881: Flags [.], ack 11237, win 2419, options [nop,nop,TS val 4294822596 ecr 77806,nop,nop,sack 1 {12665:34085},mptcp dss ack 1976369281], length 0
20:12:21.171456 IP 112.26.0.8.33728 > 112.26.0.1.45881: Flags [.], ack 11237, win 2145, options [nop,nop,TS val 4294822272 ecr 77806,nop,nop,sack 2 {19805:26945}{12665:18377},mptcp dss ack 1976369281], length 0
20:12:21.186483 IP 112.26.0.8.33728 > 112.26.0.1.45881: Flags [.], ack 11237, win 2464, options [nop,nop,TS val 4294822758 ecr 77806,nop,nop,sack 1 {12665:35513},mptcp dss ack 1976369281], length 0
20:12:21.257864 IP 112.26.0.8.33728 > 112.26.0.1.45881: Flags [.], ack 11237, win 2510, options [nop,nop,TS val 4294822801 ecr 77806,nop,nop,sack 1 {12665:36941},mptcp dss ack 1976369281], length 0
20:12:21.265545 IP 112.26.0.8.33728 > 112.26.0.1.45881: Flags [.], ack 11237, win 2190, options [nop,nop,TS val 4294822354 ecr 77806,nop,nop,sack 2 {19805:28373}{12665:18377},mptcp dss ack 1976369281], length 0
20:12:21.288542 IP 112.26.0.1.45881 > 112.26.0.8.33728: Flags [.], seq 36941:38369, ack 1, win 1339, options [nop,nop,TS val 79619 ecr 4294821883,mptcp dss ack 3262968525 seq 1976394985 subseq 36941 len 1428 csum 0x8817], length 1428
20:12:21.293699 IP 112.26.0.8.33728 > 112.26.0.1.45881: Flags [.], ack 11237, win 2555, options [nop,nop,TS val 4294822996 ecr 77806,nop,nop,sack 1 {12665:38369},mptcp dss ack 1976369281], length 0
20:12:21.299611 IP 112.26.0.8.33728 > 112.26.0.1.45881: Flags [.], ack 11237, win 2555, options [nop,nop,TS val 4294822996 ecr 77806,nop,nop,sack 1 {12665:38369},mptcp dss ack 1976369281], length 0
20:12:21.304296 IP 112.26.0.1.45881 > 112.26.0.8.33728: Flags [.], seq 36941:38369, ack 1, win 1339, options [nop,nop,TS val 79619 ecr 4294821883,mptcp dss ack 3262968525 seq 1976394985 subseq 36941 len 1428 csum 0x8817], length 1428
20:12:21.346246 IP 112.26.0.8.33728 > 112.26.0.1.45881: Flags [.], ack 11237, win 2236, options [nop,nop,TS val 4294822389 ecr 77806,nop,nop,sack 1 {12665:28373},mptcp dss ack 1976369281], length 0
20:12:21.359617 IP 112.26.0.1.45881 > 112.26.0.8.33728: Flags [.], seq 38369:39797, ack 1, win 1339, options [nop,nop,TS val 79619 ecr 4294821883,mptcp dss ack 3262968525 seq 1976396413 subseq 38369 len 1428 csum 0xe1d], length 1428
20:12:21.366177 IP 112.26.0.8.33728 > 112.26.0.1.45881: Flags [.], ack 11237, win 2601, options [nop,nop,TS val 4294823070 ecr 77806,nop,nop,sack 1 {12665:39797},mptcp dss ack 1976369281], length 0
20:12:21.369168 IP 112.26.0.8.33728 > 112.26.0.1.45881: Flags [.], ack 11237, win 2601, options [nop,nop,TS val 4294823070 ecr 77806,nop,nop,sack 1 {12665:39797},mptcp dss ack 1976369281], length 0
20:12:21.372159 IP 112.26.0.1.45881 > 112.26.0.8.33728: Flags [.], seq 38369:39797, ack 1, win 1339, options [nop,nop,TS val 79619 ecr 4294821883,mptcp dss ack 3262968525 seq 1976396413 subseq 38369 len 1428 csum 0xe1d], length 1428
20:12:21.383427 IP 112.26.0.8.33728 > 112.26.0.1.45881: Flags [.], ack 11237, win 2282, options [nop,nop,TS val 4294822402 ecr 77806,nop,nop,sack 1 {12665:29801},mptcp dss ack 1976369281], length 0
20:12:21.391937 IP 112.26.0.1.45881 > 112.26.0.8.33728: Flags [.], seq 11237:12665, ack 1, win 1339, options [nop,nop,TS val 79711 ecr 4294821949,mptcp dss ack 3262968525 seq 1976369281 subseq 11237 len 1428 csum 0xf18d], length 1428
20:12:21.396526 IP 112.26.0.1.45881 > 112.26.0.8.33728: Flags [.], seq 11237:12665, ack 1, win 1339, options [nop,nop,TS val 79711 ecr 4294821949,mptcp dss ack 3262968525 seq 1976369281 subseq 11237 len 1428 csum 0xf18d], length 1428
20:12:21.397644 IP 112.26.0.8.33728 > 112.26.0.1.45881: Flags [.], ack 39797, win 2647, options [nop,nop,TS val 4294823100 ecr 79711,mptcp dss ack 1976397841], length 0
20:12:21.455837 IP 112.26.0.8.33728 > 112.26.0.1.45881: Flags [.], ack 39797, win 2647, options [nop,nop,TS val 4294823100 ecr 79711,mptcp dss ack 1976397841], length 0
20:12:21.469189 IP 112.26.0.8.33728 > 112.26.0.1.45881: Flags [.], ack 11237, win 2327, options [nop,nop,TS val 4294822477 ecr 77806,nop,nop,sack 1 {12665:31229},mptcp dss ack 1976369281], length 0
20:12:21.479171 IP 112.26.0.8.33728 > 112.26.0.1.45881: Flags [.], ack 11237, win 2373, options [nop,nop,TS val 4294822572 ecr 77806,nop,nop,sack 1 {12665:32657},mptcp dss ack 1976369281], length 0
20:12:21.482554 IP 112.26.0.1.45881 > 112.26.0.8.33728: Flags [.], seq 15521:16949, ack 1, win 1339, options [nop,nop,TS val 79845 ecr 4294822067,mptcp dss ack 3262968525 seq 1976373565 subseq 15521 len 1428 csum 0xf17f], length 1428
20:12:21.485647 IP 112.26.0.8.33728 > 112.26.0.1.45881: Flags [.], ack 39797, win 2647, options [nop,nop,TS val 4294823191 ecr 79711,nop,nop,sack 1 {15521:16949},mptcp dss ack 1976397841], length 0
20:12:21.488674 IP 112.26.0.8.33728 > 112.26.0.1.45881: Flags [.], ack 39797, win 2647, options [nop,nop,TS val 4294823191 ecr 79711,nop,nop,sack 1 {15521:16949},mptcp dss ack 1976397841], length 0
20:12:21.489659 IP 112.26.0.1.45881 > 112.26.0.8.33728: Flags [.], seq 15521:16949, ack 1, win 1339, options [nop,nop,TS val 79845 ecr 4294822067,mptcp dss ack 3262968525 seq 1976373565 subseq 15521 len 1428 csum 0xf17f], length 1428
20:12:21.564653 IP 112.26.0.8.33728 > 112.26.0.1.45881: Flags [.], ack 11237, win 2419, options [nop,nop,TS val 4294822596 ecr 77806,nop,nop,sack 1 {12665:34085},mptcp dss ack 1976369281], length 0
20:12:21.575104 IP 112.26.0.1.45881 > 112.26.0.8.33728: Flags [.], seq 16949:18377, ack 1, win 1339, options [nop,nop,TS val 79921 ecr 4294822077,mptcp dss ack 3262968525 seq 1976374993 subseq 16949 len 1428 csum 0xdad3], length 1428
20:12:21.578902 IP 112.26.0.8.33728 > 112.26.0.1.45881: Flags [.], ack 39797, win 2647, options [nop,nop,TS val 4294823283 ecr 79711,nop,nop,sack 1 {16949:18377},mptcp dss ack 1976397841], length 0
20:12:21.581071 IP 112.26.0.1.45881 > 112.26.0.8.33728: Flags [.], seq 16949:18377, ack 1, win 1339, options [nop,nop,TS val 79921 ecr 4294822077,mptcp dss ack 3262968525 seq 1976374993 subseq 16949 len 1428 csum 0xdad3], length 1428
20:12:21.584628 IP 112.26.0.8.33728 > 112.26.0.1.45881: Flags [.], ack 39797, win 2647, options [nop,nop,TS val 4294823283 ecr 79711,nop,nop,sack 1 {16949:18377},mptcp dss ack 1976397841], length 0
20:12:21.589121 IP 112.26.0.8.33728 > 112.26.0.1.45881: Flags [.], ack 11237, win 2464, options [nop,nop,TS val 4294822758 ecr 77806,nop,nop,sack 1 {12665:35513},mptcp dss ack 1976369281], length 0
20:12:21.673597 IP 112.26.0.1.45881 > 112.26.0.8.33728: Flags [.], seq 39797:41225, ack 1, win 1339, options [nop,nop,TS val 80118 ecr 4294822168,mptcp dss ack 3262968525 seq 1976397841 subseq 39797 len 1428 csum 0xda7f], length 1428
20:12:21.678266 IP 112.26.0.8.33728 > 112.26.0.1.45881: Flags [.], ack 41225, win 2692, options [nop,nop,TS val 4294823381 ecr 80118,mptcp dss ack 1976399269], length 0
20:12:21.679143 IP 112.26.0.8.33728 > 112.26.0.1.45881: Flags [.], ack 41225, win 2692, options [nop,nop,TS val 4294823381 ecr 80118,mptcp dss ack 1976399269], length 0
20:12:21.684026 IP 112.26.0.1.45881 > 112.26.0.8.33728: Flags [.], seq 39797:41225, ack 1, win 1339, options [nop,nop,TS val 80118 ecr 4294822168,mptcp dss ack 3262968525 seq 1976397841 subseq 39797 len 1428 csum 0xda7f], length 1428
20:12:21.693958 IP 112.26.0.8.33728 > 112.26.0.1.45881: Flags [.], ack 11237, win 2510, options [nop,nop,TS val 4294822801 ecr 77806,nop,nop,sack 1 {12665:36941},mptcp dss ack 1976369281], length 0
20:12:21.752942 IP 112.26.0.1.45881 > 112.26.0.8.33728: Flags [.], seq 41225:42653, ack 1, win 1339, options [nop,nop,TS val 80212 ecr 4294822272,mptcp dss ack 3262968525 seq 1976399269 subseq 41225 len 1428 csum 0xd3b8], length 1428
20:12:21.757977 IP 112.26.0.1.45881 > 112.26.0.8.33728: Flags [.], seq 41225:42653, ack 1, win 1339, options [nop,nop,TS val 80212 ecr 4294822272,mptcp dss ack 3262968525 seq 1976399269 subseq 41225 len 1428 csum 0xd3b8], length 1428
20:12:21.759787 IP 112.26.0.8.33728 > 112.26.0.1.45881: Flags [.], ack 42653, win 2738, options [nop,nop,TS val 4294823462 ecr 80212,mptcp dss ack 1976400697], length 0
20:12:21.762997 IP 112.26.0.8.33728 > 112.26.0.1.45881: Flags [.], ack 42653, win 2738, options [nop,nop,TS val 4294823462 ecr 80212,mptcp dss ack 1976400697], length 0
20:12:21.767003 IP 112.26.0.8.33728 > 112.26.0.1.45881: Flags [.], ack 11237, win 2555, options [nop,nop,TS val 4294822996 ecr 77806,nop,nop,sack 1 {12665:38369},mptcp dss ack 1976369281], length 0
20:12:21.788349 IP 112.26.0.1.45881 > 112.26.0.8.33728: Flags [.], seq 42653:44081, ack 1, win 1339, options [nop,nop,TS val 80293 ecr 4294822354,mptcp dss ack 3262968525 seq 1976400697 subseq 42653 len 1428 csum 0xf356], length 1428
20:12:21.792287 IP 112.26.0.8.33728 > 112.26.0.1.45881: Flags [.], ack 44081, win 2784, options [nop,nop,TS val 4294823497 ecr 80293,mptcp dss ack 1976402125], length 0
20:12:21.795100 IP 112.26.0.8.33728 > 112.26.0.1.45881: Flags [.], ack 44081, win 2784, options [nop,nop,TS val 4294823497 ecr 80293,mptcp dss ack 1976402125], length 0
20:12:21.858219 IP 112.26.0.8.33728 > 112.26.0.1.45881: Flags [.], ack 11237, win 2601, options [nop,nop,TS val 4294823070 ecr 77806,nop,nop,sack 1 {12665:39797},mptcp dss ack 1976369281], length 0
20:12:21.867504 IP 112.26.0.1.45881 > 112.26.0.8.33728: Flags [.], seq 42653:44081, ack 1, win 1339, options [nop,nop,TS val 80293 ecr 4294822354,mptcp dss ack 3262968525 seq 1976400697 subseq 42653 len 1428 csum 0xf356], length 1428
20:12:21.872814 IP 112.26.0.1.45881 > 112.26.0.8.33728: Flags [.], seq 11237:12665, ack 1, win 1339, options [nop,nop,TS val 80293 ecr 4294822389,mptcp dss ack 3262968525 seq 1976369281 subseq 11237 len 1428 csum 0xf18d], length 1428
20:12:21.877719 IP 112.26.0.8.33728 > 112.26.0.1.45881: Flags [.], ack 44081, win 2784, options [nop,nop,TS val 4294823581 ecr 80293,nop,nop,sack 1 {11237:12665},mptcp dss ack 1976402125], length 0
20:12:21.889036 IP 112.26.0.8.33728 > 112.26.0.1.45881: Flags [.], ack 39797, win 2647, options [nop,nop,TS val 4294823100 ecr 79711,mptcp dss ack 1976397841], length 0
20:12:21.894047 IP 112.26.0.1.45881 > 112.26.0.8.33728: Flags [.], seq 11237:12665, ack 1, win 1339, options [nop,nop,TS val 80293 ecr 4294822389,mptcp dss ack 3262968525 seq 1976369281 subseq 11237 len 1428 csum 0xf18d], length 1428
20:12:21.897443 IP 112.26.0.8.33728 > 112.26.0.1.45881: Flags [.], ack 44081, win 2784, options [nop,nop,TS val 4294823581 ecr 80293,nop,nop,sack 1 {11237:12665},mptcp dss ack 1976402125], length 0
20:12:21.971509 IP 112.26.0.8.33728 > 112.26.0.1.45881: Flags [.], ack 39797, win 2647, options [nop,nop,TS val 4294823191 ecr 79711,nop,nop,sack 1 {15521:16949},mptcp dss ack 1976397841], length 0
20:12:21.974802 IP 112.26.0.1.45881 > 112.26.0.8.33728: Flags [.], seq 31229:32657, ack 1, win 1339, options [nop,nop,TS val 80416 ecr 4294822477,mptcp dss ack 3262968525 seq 1976389273 subseq 31229 len 1428 csum 0xa663], length 1428
