20:12:17.758810 IP 112.26.0.8.33728 > 112.26.0.1.45881: Flags [S], seq 503274601, win 65535, options [mss 1460,sackOK,TS val 4294819233 ecr 0,nop,wscale 6,mptcp capable csum {0xe03f2f5bd5989db8}], length 0
20:12:17.776672 IP 112.26.0.8.33728 > 112.26.0.1.45881: Flags [S], seq 503274601, win 65535, options [mss 1460,sackOK,TS val 4294819233 ecr 0,nop,wscale 6,mptcp capable csum {0xe03f2f5bd5989db8}], length 0
20:12:17.842757 IP 112.26.0.1.45881 > 112.26.0.8.33728: Flags [S.], seq 2940828125, ack 503274602, win 65535, options [mss 1460,sackOK,TS val 76724 ecr 4294819233,nop,wscale 6,mptcp capable csum {0x87139cfff9e67aae}], length 0
20:12:18.645894 IP 112.26.0.8.33728 > 112.26.0.1.45881: Flags [S], seq 503274601, win 65535, options [mss 1460,sackOK,TS val 4294820288 ecr 0,nop,wscale 6,mptcp capable csum {0xe03f2f5bd5989db8}], length 0
20:12:18.646748 IP 112.26.0.8.33728 > 112.26.0.1.45881: Flags [S], seq 503274601, win 65535, options [mss 1460,sackOK,TS val 4294820288 ecr 0,nop,wscale 6,mptcp capable csum {0xe03f2f5bd5989db8}], length 0
20:12:18.654230 IP 112.26.0.1.45881 > 112.26.0.8.33728: Flags [S.], seq 2940828125, ack 503274602, win 65535, options [mss 1460,sackOK,TS val 77594 ecr 4294819233,nop,wscale 6,mptcp capable csum {0x87139cfff9e67aae}], length 0
20:12:18.853617 IP 112.26.0.1.45881 > 112.26.0.8.33728: Flags [.], ack 1, win 1339, options [nop,nop,TS val 77799 ecr 4294820485,mptcp add-addr id 3 112.26.1.1,mptcp dss ack 3262968525], length 0
20:12:18.890324 IP 112.26.0.1.45881 > 112.26.0.8.33728: Flags [.], ack 1, win 1339, options [nop,nop,TS val 77799 ecr 4294820485,mptcp add-addr id 4 112.26.2.1,mptcp dss ack 3262968525], length 0
20:12:18.959532 IP 112.26.0.1.45881 > 112.26.0.8.33728: Flags [.], ack 1, win 1339, options [nop,nop,TS val 77799 ecr 4294820485,mptcp add-addr id 6 112.26.3.1,mptcp dss ack 3262968525], length 0
20:12:18.977763 IP 112.26.0.1.45881 > 112.26.0.8.33728: Flags [.], seq 1:1429, ack 1, win 1339, options [nop,nop,TS val 77805 ecr 4294820485,mptcp dss ack 3262968525 seq 1976358045 subseq 1 len 1428 csum 0xaf6e], length 1428
20:12:19.036272 IP 112.26.0.1.45881 > 112.26.0.8.33728: Flags [.], seq 1429:2857, ack 1, win 1339, options [nop,nop,TS val 77805 ecr 4294820485,mptcp dss ack 3262968525 seq 1976359473 subseq 1429 len 1428 csum 0xcebc], length 1428
20:12:19.050459 IP 112.26.0.1.45881 > 112.26.0.8.33728: Flags [P.], seq 2857:4097, ack 1, win 1339, options [nop,nop,TS val 77805 ecr 4294820485,mptcp dss ack 3262968525 seq 1976360901 subseq 2857 len 1240 csum 0xf8f], length 1240
20:12:19.131807 IP 112.26.0.1.45881 > 112.26.0.8.33728: Flags [.], seq 4097:5525, ack 1, win 1339, options [nop,nop,TS val 77805 ecr 4294820485,mptcp dss ack 3262968525 seq 1976362141 subseq 4097 len 1428 csum 0x3c8], length 1428
20:12:19.154192 IP 112.26.0.1.45881 > 112.26.0.8.33728: Flags [.], seq 5525:6953, ack 1, win 1339, options [nop,nop,TS val 77806 ecr 4294820485,mptcp dss ack 3262968525 seq 1976363569 subseq 5525 len 1428 csum 0x603d], length 1428
20:12:19.239498 IP 112.26.0.1.45881 > 112.26.0.8.33728: Flags [.], seq 6953:8381, ack 1, win 1339, options [nop,nop,TS val 77806 ecr 4294820485,mptcp dss ack 3262968525 seq 1976364997 subseq 6953 len 1428 csum 0xfa09], length 1428
20:12:19.262387 IP 112.26.0.1.45881 > 112.26.0.8.33728: Flags [.], seq 8381:9809, ack 1, win 1339, options [nop,nop,TS val 77806 ecr 4294820485,mptcp dss ack 3262968525 seq 1976366425 subseq 8381 len 1428 csum 0xc99b], length 1428
20:12:19.344512 IP 112.26.0.1.45881 > 112.26.0.8.33728: Flags [.], seq 9809:11237, ack 1, win 1339, options [nop,nop,TS val 77806 ecr 4294820485,mptcp dss ack 3262968525 seq 1976367853 subseq 9809 len 1428 csum 0xc207], length 1428
20:12:19.535454 IP 112.26.0.1.45881 > 112.26.0.8.33728: Flags [.], seq 12665:14093, ack 1, win 1339, options [nop,nop,TS val 78424 ecr 4294820485,mptcp dss ack 3262968525 seq 1976370709 subseq 12665 len 1428 csum 0x338b], length 1428
20:12:19.749376 IP 112.26.0.1.45881 > 112.26.0.8.33728: Flags [.], seq 14093:15521, ack 1, win 1339, options [nop,nop,TS val 78695 ecr 4294820945,mptcp dss ack 3262968525 seq 1976372137 subseq 14093 len 1428 csum 0x8624], length 1428
20:12:19.763544 IP 112.26.0.1.45881 > 112.26.0.8.33728: Flags [.], seq 15521:16949, ack 1, win 1339, options [nop,nop,TS val 78695 ecr 4294820945,mptcp dss ack 3262968525 seq 1976373565 subseq 15521 len 1428 csum 0xf17f], length 1428
20:12:19.848690 IP 112.26.0.1.45881 > 112.26.0.8.33728: Flags [.], seq 16949:18377, ack 1, win 1339, options [nop,nop,TS val 78794 ecr 4294820964,mptcp dss ack 3262968525 seq 1976374993 subseq 16949 len 1428 csum 0xdad3], length 1428
20:12:19.866270 IP 112.26.0.1.45881 > 112.26.0.8.33728: Flags [.], seq 18377:19805, ack 1, win 1339, options [nop,nop,TS val 78794 ecr 4294820964,mptcp dss ack 3262968525 seq 1976376421 subseq 18377 len 1428 csum 0xe41f], length 1428
20:12:20.040959 IP 112.26.0.1.45881 > 112.26.0.8.33728: Flags [.], seq 19805:21233, ack 1, win 1339, options [nop,nop,TS val 78986 ecr 4294821163,mptcp dss ack 3262968525 seq 1976377849 subseq 19805 len 1428 csum 0xa3c1], length 1428
20:12:20.052904 IP 112.26.0.1.45881 > 112.26.0.8.33728: Flags [.], seq 21233:22661, ack 1, win 1339, options [nop,nop,TS val 78986 ecr 4294821163,mptcp dss ack 3262968525 seq 1976379277 subseq 21233 len 1428 csum 0xecc1], length 1428
20:12:20.154955 IP 112.26.0.1.45881 > 112.26.0.8.33728: Flags [.], seq 22661:24089, ack 1, win 1339, options [nop,nop,TS val 79023 ecr 4294821250,mptcp dss ack 3262968525 seq 1976380705 subseq 22661 len 1428 csum 0x495c], length 1428
20:12:20.182197 IP 112.26.0.1.45881 > 112.26.0.8.33728: Flags [.], seq 19805:21233, ack 1, win 1339, options [nop,nop,TS val 78986 ecr 4294821163,mptcp dss ack 3262968525 seq 1976377849 subseq 19805 len 1428 csum 0xa3c1], length 1428
20:12:20.253767 IP 112.26.0.1.45881 > 112.26.0.8.33728: Flags [.], seq 24089:25517, ack 1, win 1339, options [nop,nop,TS val 79023 ecr 4294821250,mptcp dss ack 3262968525 seq 1976382133 subseq 24089 len 1428 csum 0xe12a], length 1428
20:12:20.257736 IP 112.26.0.1.45881 > 112.26.0.8.33728: Flags [.], seq 19805:21233, ack 1, win 1339, options [nop,nop,TS val 78986 ecr 4294821163,mptcp dss ack 3262968525 seq 1976377849 subseq 19805 len 1428 csum 0xa3c1], length 1428
20:12:20.264627 IP 112.26.0.1.45881 > 112.26.0.8.33728: Flags [.], seq 21233:22661, ack 1, win 1339, options [nop,nop,TS val 78986 ecr 4294821163,mptcp dss ack 3262968525 seq 1976379277 subseq 21233 len 1428 csum 0xecc1], length 1428
20:12:20.267699 IP 112.26.0.1.45881 > 112.26.0.8.33728: Flags [.], seq 21233:22661, ack 1, win 1339, options [nop,nop,TS val 78986 ecr 4294821163,mptcp dss ack 3262968525 seq 1976379277 subseq 21233 len 1428 csum 0xecc1], length 1428
20:12:20.342708 IP 112.26.0.1.45881 > 112.26.0.8.33728: Flags [.], seq 25517:26945, ack 1, win 1339, options [nop,nop,TS val 79287 ecr 4294821366,mptcp dss ack 3262968525 seq 1976383561 subseq 25517 len 1428 csum 0xfb28], length 1428
20:12:20.358355 IP 112.26.0.1.45881 > 112.26.0.8.33728: Flags [.], seq 22661:24089, ack 1, win 1339, options [nop,nop,TS val 79023 ecr 4294821250,mptcp dss ack 3262968525 seq 1976380705 subseq 22661 len 1428 csum 0x495c], length 1428
20:12:20.361861 IP 112.26.0.1.45881 > 112.26.0.8.33728: Flags [.], seq 22661:24089, ack 1, win 1339, options [nop,nop,TS val 79023 ecr 4294821250,mptcp dss ack 3262968525 seq 1976380705 subseq 22661 len 1428 csum 0x495c], length 1428
20:12:20.371494 IP 112.26.0.1.45881 > 112.26.0.8.33728: Flags [.], seq 26945:28373, ack 1, win 1339, options [nop,nop,TS val 79287 ecr 4294821366,mptcp dss ack 3262968525 seq 1976384989 subseq 26945 len 1428 csum 0x8125], length 1428
20:12:20.447247 IP 112.26.0.1.45881 > 112.26.0.8.33728: Flags [.], seq 24089:25517, ack 1, win 1339, options [nop,nop,TS val 79023 ecr 4294821250,mptcp dss ack 3262968525 seq 1976382133 subseq 24089 len 1428 csum 0xe12a], length 1428
20:12:20.450276 IP 112.26.0.1.45881 > 112.26.0.8.33728: Flags [.], seq 24089:25517, ack 1, win 1339, options [nop,nop,TS val 79023 ecr 4294821250,mptcp dss ack 3262968525 seq 1976382133 subseq 24089 len 1428 csum 0xe12a], length 1428
20:12:20.471400 IP 112.26.0.1.45881 > 112.26.0.8.33728: Flags [.], seq 28373:29801, ack 1, win 1339, options [nop,nop,TS val 79417 ecr 4294821468,mptcp dss ack 3262968525 seq 1976386417 subseq 28373 len 1428 csum 0x8d82], length 1428
20:12:20.549827 IP 112.26.0.1.45881 > 112.26.0.8.33728: Flags [.], seq 29801:31229, ack 1, win 1339, options [nop,nop,TS val 79417 ecr 4294821468,mptcp dss ack 3262968525 seq 1976387845 subseq 29801 len 1428 csum 0xb323], length 1428
20:12:20.562203 IP 112.26.0.1.45881 > 112.26.0.8.33728: Flags [.], seq 25517:26945, ack 1, win 1339, options [nop,nop,TS val 79287 ecr 4294821366,mptcp dss ack 3262968525 seq 1976383561 subseq 25517 len 1428 csum 0xfb28], length 1428
20:12:20.566182 IP 112.26.0.1.45881 > 112.26.0.8.33728: Flags [.], seq 25517:26945, ack 1, win 1339, options [nop,nop,TS val 79287 ecr 4294821366,mptcp dss ack 3262968525 seq 1976383561 subseq 25517 len 1428 csum 0xfb28], length 1428
20:12:20.577494 IP 112.26.0.1.45881 > 112.26.0.8.33728: Flags [.], seq 31229:32657, ack 1, win 1339, options [nop,nop,TS val 79488 ecr 4294821557,mptcp dss ack 3262968525 seq 1976389273 subseq 31229 len 1428 csum 0xa663], length 1428
20:12:20.636807 IP 112.26.0.1.45881 > 112.26.0.8.33728: Flags [.], seq 26945:28373, ack 1, win 1339, options [nop,nop,TS val 79287 ecr 4294821366,mptcp dss ack 3262968525 seq 1976384989 subseq 26945 len 1428 csum 0x8125], length 1428
20:12:20.649043 IP 112.26.0.1.45881 > 112.26.0.8.33728: Flags [.], seq 26945:28373, ack 1, win 1339, options [nop,nop,TS val 79287 ecr 4294821366,mptcp dss ack 3262968525 seq 1976384989 subseq 26945 len 1428 csum 0x8125], length 1428
20:12:20.665102 IP 112.26.0.1.45881 > 112.26.0.8.33728: Flags [.], seq 32657:34085, ack 1, win 1339, options [nop,nop,TS val 79488 ecr 4294821557,mptcp dss ack 3262968525 seq 1976390701 subseq 32657 len 1428 csum 0x220e], length 1428
20:12:20.688341 IP 112.26.0.1.45881 > 112.26.0.8.33728: Flags [.], seq 28373:29801, ack 1, win 1339, options [nop,nop,TS val 79417 ecr 4294821468,mptcp dss ack 3262968525 seq 1976386417 subseq 28373 len 1428 csum 0x8d82], length 1428
20:12:20.690898 IP 112.26.0.1.45881 > 112.26.0.8.33728: Flags [.], seq 28373:29801, ack 1, win 1339, options [nop,nop,TS val 79417 ecr 4294821468,mptcp dss ack 3262968525 seq 1976386417 subseq 28373 len 1428 csum 0x8d82], length 1428
20:12:20.746876 IP 112.26.0.1.45881 > 112.26.0.8.33728: Flags [.], seq 34085:35513, ack 1, win 1339, options [nop,nop,TS val 79619 ecr 4294821883,mptcp dss ack 3262968525 seq 1976392129 subseq 34085 len 1428 csum 0x42ff], length 1428
20:12:20.756480 IP 112.26.0.1.45881 > 112.26.0.8.33728: Flags [.], seq 29801:31229, ack 1, win 1339, options [nop,nop,TS val 79417 ecr 4294821468,mptcp dss ack 3262968525 seq 1976387845 subseq 29801 len 1428 csum 0xb323], length 1428
20:12:20.770545 IP 112.26.0.1.45881 > 112.26.0.8.33728: Flags [.], seq 29801:31229, ack 1, win 1339, options [nop,nop,TS val 79417 ecr 4294821468,mptcp dss ack 3262968525 seq 1976387845 subseq 29801 len 1428 csum 0xb323], length 1428
20:12:20.785379 IP 112.26.0.1.45881 > 112.26.0.8.33728: Flags [.], seq 35513:36941, ack 1, win 1339, options [nop,nop,TS val 79619 ecr 4294821883,mptcp dss ack 3262968525 seq 1976393557 subseq 35513 len 1428 csum 0x2fa4], length 1428
20:12:20.850999 IP 112.26.0.1.45881 > 112.26.0.8.33728: Flags [.], seq 31229:32657, ack 1, win 1339, options [nop,nop,TS val 79488 ecr 4294821557,mptcp dss ack 3262968525 seq 1976389273 subseq 31229 len 1428 csum 0xa663], length 1428
20:12:20.864759 IP 112.26.0.1.45881 > 112.26.0.8.33728: Flags [.], seq 31229:32657, ack 1, win 1339, options [nop,nop,TS val 79488 ecr 4294821557,mptcp dss ack 3262968525 seq 1976389273 subseq 31229 len 1428 csum 0xa663], length 1428
20:12:20.872152 IP 112.26.0.1.45881 > 112.26.0.8.33728: Flags [.], seq 36941:38369, ack 1, win 1339, options [nop,nop,TS val 79619 ecr 4294821883,mptcp dss ack 3262968525 seq 1976394985 subseq 36941 len 1428 csum 0x8817], length 1428
20:12:20.887216 IP 112.26.0.1.45881 > 112.26.0.8.33728: Flags [.], seq 32657:34085, ack 1, win 1339, options [nop,nop,TS val 79488 ecr 4294821557,mptcp dss ack 3262968525 seq 1976390701 subseq 32657 len 1428 csum 0x220e], length 1428
20:12:20.890928 IP 112.26.0.1.45881 > 112.26.0.8.33728: Flags [.], seq 32657:34085, ack 1, win 1339, options [nop,nop,TS val 79488 ecr 4294821557,mptcp dss ack 3262968525 seq 1976390701 subseq 32657 len 1428 csum 0x220e], length 1428
20:12:20.903116 IP 112.26.0.1.45881 > 112.26.0.8.33728: Flags [.], seq 38369:39797, ack 1, win 1339, options [nop,nop,TS val 79619 ecr 4294821883,mptcp dss ack 3262968525 seq 1976396413 subseq 38369 len 1428 csum 0xe1d], length 1428
20:12:20.958828 IP 112.26.0.1.45881 > 112.26.0.8.33728: Flags [.], seq 11237:12665, ack 1, win 1339, options [nop,nop,TS val 79711 ecr 4294821949,mptcp dss ack 3262968525 seq 1976369281 subseq 11237 len 1428 csum 0xf18d], length 1428
20:12:20.985574 IP 112.26.0.1.45881 > 112.26.0.8.33728: Flags [.], seq 15521:16949, ack 1, win 1339, options [nop,nop,TS val 79845 ecr 4294822067,mptcp dss ack 3262968525 seq 1976373565 subseq 15521 len 1428 csum 0xf17f], length 1428
20:12:21.048454 IP 112.26.0.1.45881 > 112.26.0.8.33728: Flags [.], seq 34085:35513, ack 1, win 1339, options [nop,nop,TS val 79619 ecr 4294821883,mptcp dss ack 3262968525 seq 1976392129 subseq 34085 len 1428 csum 0x42ff], length 1428
20:12:21.054113 IP 112.26.0.1.45881 > 112.26.0.8.33728: Flags [.], seq 34085:35513, ack 1, win 1339, options [nop,nop,TS val 79619 ecr 4294821883,mptcp dss ack 3262968525 seq 1976392129 subseq 34085 len 1428 csum 0x42ff], length 1428
20:12:21.075904 IP 112.26.0.1.45881 > 112.26.0.8.33728: Flags [.], seq 16949:18377, ack 1, win 1339, options [nop,nop,TS val 79921 ecr 4294822077,mptcp dss ack 3262968525 seq 1976374993 subseq 16949 len 1428 csum 0xdad3], length 1428
20:12:21.092410 IP 112.26.0.1.45881 > 112.26.0.8.33728: Flags [.], seq 35513:36941, ack 1, win 1339, options [nop,nop,TS val 79619 ecr 4294821883,mptcp dss ack 3262968525 seq 1976393557 subseq 35513 len 1428 csum 0x2fa4], length 1428
20:12:21.151524 IP 112.26.0.1.45881 > 112.26.0.8.33728: Flags [.], seq 18377:19805, ack 1, win 1339, options [nop,nop,TS val 80011 ecr 4294822156,mptcp dss ack 3262968525 seq 1976376421 subseq 18377 len 1428 csum 0xe41f], length 1428
20:12:21.154554 IP 112.26.0.1.45881 > 112.26.0.8.33728: Flags [.], seq 35513:36941, ack 1, win 1339, options [nop,nop,TS val 79619 ecr 4294821883,mptcp dss ack 3262968525 seq 1976393557 subseq 35513 len 1428 csum 0x2fa4], length 1428
20:12:21.183829 IP 112.26.0.1.45881 > 112.26.0.8.33728: Flags [.], seq 39797:41225, ack 1, win 1339, options [nop,nop,TS val 80118 ecr 4294822168,mptcp dss ack 3262968525 seq 1976397841 subseq 39797 len 1428 csum 0xda7f], length 1428
20:12:21.266937 IP 112.26.0.1.45881 > 112.26.0.8.33728: Flags [.], seq 41225:42653, ack 1, win 1339, options [nop,nop,TS val 80212 ecr 4294822272,mptcp dss ack 3262968525 seq 1976399269 subseq 41225 len 1428 csum 0xd3b8], length 1428
20:12:21.288431 IP 112.26.0.1.45881 > 112.26.0.8.33728: Flags [.], seq 36941:38369, ack 1, win 1339, options [nop,nop,TS val 79619 ecr 4294821883,mptcp dss ack 3262968525 seq 1976394985 subseq 36941 len 1428 csum 0x8817], length 1428
20:12:21.298667 IP 112.26.0.1.45881 > 112.26.0.8.33728: Flags [.], seq 36941:38369, ack 1, win 1339, options [nop,nop,TS val 79619 ecr 4294821883,mptcp dss ack 3262968525 seq 1976394985 subseq 36941 len 1428 csum 0x8817], length 1428
20:12:21.349087 IP 112.26.0.1.45881 > 112.26.0.8.33728: Flags [.], seq 42653:44081, ack 1, win 1339, options [nop,nop,TS val 80293 ecr 4294822354,mptcp dss ack 3262968525 seq 1976400697 subseq 42653 len 1428 csum 0xf356], length 1428
20:12:21.359507 IP 112.26.0.1.45881 > 112.26.0.8.33728: Flags [.], seq 38369:39797, ack 1, win 1339, options [nop,nop,TS val 79619 ecr 4294821883,mptcp dss ack 3262968525 seq 1976396413 subseq 38369 len 1428 csum 0xe1d], length 1428
20:12:21.363807 IP 112.26.0.1.45881 > 112.26.0.8.33728: Flags [.], seq 38369:39797, ack 1, win 1339, options [nop,nop,TS val 79619 ecr 4294821883,mptcp dss ack 3262968525 seq 1976396413 subseq 38369 len 1428 csum 0xe1d], length 1428
20:12:21.382363 IP 112.26.0.1.45881 > 112.26.0.8.33728: Flags [.], seq 11237:12665, ack 1, win 1339, options [nop,nop,TS val 80293 ecr 4294822389,mptcp dss ack 3262968525 seq 1976369281 subseq 11237 len 1428 csum 0xf18d], length 1428
20:12:21.391827 IP 112.26.0.1.45881 > 112.26.0.8.33728: Flags [.], seq 11237:12665, ack 1, win 1339, options [nop,nop,TS val 79711 ecr 4294821949,mptcp dss ack 3262968525 seq 1976369281 subseq 11237 len 1428 csum 0xf18d], length 1428
20:12:21.396408 IP 112.26.0.1.45881 > 112.26.0.8.33728: Flags [.], seq 11237:12665, ack 1, win 1339, options [nop,nop,TS val 79711 ecr 4294821949,mptcp dss ack 3262968525 seq 1976369281 subseq 11237 len 1428 csum 0xf18d], length 1428
20:12:21.462625 IP 112.26.0.1.45881 > 112.26.0.8.33728: Flags [.], seq 29801:31229, ack 1, win 1339, options [nop,nop,TS val 80330 ecr 4294822402,mptcp dss ack 3262968525 seq 1976387845 subseq 29801 len 1428 csum 0xb323], length 1428
20:12:21.482444 IP 112.26.0.1.45881 > 112.26.0.8.33728: Flags [.], seq 15521:16949, ack 1, win 1339, options [nop,nop,TS val 79845 ecr 4294822067,mptcp dss ack 3262968525 seq 1976373565 subseq 15521 len 1428 csum 0xf17f], length 1428
20:12:21.489545 IP 112.26.0.1.45881 > 112.26.0.8.33728: Flags [.], seq 15521:16949, ack 1, win 1339, options [nop,nop,TS val 79845 ecr 4294822067,mptcp dss ack 3262968525 seq 1976373565 subseq 15521 len 1428 csum 0xf17f], length 1428
20:12:21.545643 IP 112.26.0.1.45881 > 112.26.0.8.33728: Flags [.], seq 31229:32657, ack 1, win 1339, options [nop,nop,TS val 80416 ecr 4294822477,mptcp dss ack 3262968525 seq 1976389273 subseq 31229 len 1428 csum 0xa663], length 1428
20:12:21.565586 IP 112.26.0.1.45881 > 112.26.0.8.33728: Flags [.], seq 32657:34085, ack 1, win 1339, options [nop,nop,TS val 80426 ecr 4294822572,mptcp dss ack 3262968525 seq 1976390701 subseq 32657 len 1428 csum 0x220e], length 1428
20:12:21.574983 IP 112.26.0.1.45881 > 112.26.0.8.33728: Flags [.], seq 16949:18377, ack 1, win 1339, options [nop,nop,TS val 79921 ecr 4294822077,mptcp dss ack 3262968525 seq 1976374993 subseq 16949 len 1428 csum 0xdad3], length 1428
20:12:21.578068 IP 112.26.0.1.45881 > 112.26.0.8.33728: Flags [.], seq 16949:18377, ack 1, win 1339, options [nop,nop,TS val 79921 ecr 4294822077,mptcp dss ack 3262968525 seq 1976374993 subseq 16949 len 1428 csum 0xdad3], length 1428
20:12:21.592687 IP 112.26.0.1.45881 > 112.26.0.8.33728: Flags [.], seq 34085:35513, ack 1, win 1339, options [nop,nop,TS val 80512 ecr 4294822596,mptcp dss ack 3262968525 seq 1976392129 subseq 34085 len 1428 csum 0x42ff], length 1428
20:12:21.668205 IP 112.26.0.1.45881 > 112.26.0.8.33728: Flags [.], seq 35513:36941, ack 1, win 1339, options [nop,nop,TS val 80536 ecr 4294822758,mptcp dss ack 3262968525 seq 1976393557 subseq 35513 len 1428 csum 0x2fa4], length 1428
20:12:21.673487 IP 112.26.0.1.45881 > 112.26.0.8.33728: Flags [.], seq 39797:41225, ack 1, win 1339, options [nop,nop,TS val 80118 ecr 4294822168,mptcp dss ack 3262968525 seq 1976397841 subseq 39797 len 1428 csum 0xda7f], length 1428
20:12:21.677252 IP 112.26.0.1.45881 > 112.26.0.8.33728: Flags [.], seq 39797:41225, ack 1, win 1339, options [nop,nop,TS val 80118 ecr 4294822168,mptcp dss ack 3262968525 seq 1976397841 subseq 39797 len 1428 csum 0xda7f], length 1428
20:12:21.695504 IP 112.26.0.1.45881 > 112.26.0.8.33728: Flags [.], seq 36941:38369, ack 1, win 1339, options [nop,nop,TS val 80641 ecr 4294822801,mptcp dss ack 3262968525 seq 1976394985 subseq 36941 len 1428 csum 0x8817], length 1428
20:12:21.752793 IP 112.26.0.1.45881 > 112.26.0.8.33728: Flags [.], seq 41225:42653, ack 1, win 1339, options [nop,nop,TS val 80212 ecr 4294822272,mptcp dss ack 3262968525 seq 1976399269 subseq 41225 len 1428 csum 0xd3b8], length 1428
20:12:21.757865 IP 112.26.0.1.45881 > 112.26.0.8.33728: Flags [.], seq 41225:42653, ack 1, win 1339, options [nop,nop,TS val 80212 ecr 4294822272,mptcp dss ack 3262968525 seq 1976399269 subseq 41225 len 1428 csum 0xd3b8], length 1428
20:12:21.766143 IP 112.26.0.1.45881 > 112.26.0.8.33728: Flags [.], seq 38369:39797, ack 1, win 1339, options [nop,nop,TS val 80712 ecr 4294822996,mptcp dss ack 3262968525 seq 1976396413 subseq 38369 len 1428 csum 0xe1d], length 1428
20:12:21.788237 IP 112.26.0.1.45881 > 112.26.0.8.33728: Flags [.], seq 42653:44081, ack 1, win 1339, options [nop,nop,TS val 80293 ecr 4294822354,mptcp dss ack 3262968525 seq 1976400697 subseq 42653 len 1428 csum 0xf356], length 1428
20:12:21.791303 IP 112.26.0.1.45881 > 112.26.0.8.33728: Flags [.], seq 42653:44081, ack 1, win 1339, options [nop,nop,TS val 80293 ecr 4294822354,mptcp dss ack 3262968525 seq 1976400697 subseq 42653 len 1428 csum 0xf356], length 1428
20:12:21.872704 IP 112.26.0.1.45881 > 112.26.0.8.33728: Flags [.], seq 11237:12665, ack 1, win 1339, options [nop,nop,TS val 80293 ecr 4294822389,mptcp dss ack 3262968525 seq 1976369281 subseq 11237 len 1428 csum 0xf18d], length 1428
20:12:21.875739 IP 112.26.0.1.45881 > 112.26.0.8.33728: Flags [.], seq 11237:12665, ack 1, win 1339, options [nop,nop,TS val 80293 ecr 4294822389,mptcp dss ack 3262968525 seq 1976369281 subseq 11237 len 1428 csum 0xf18d], length 1428
20:12:21.885453 IP 112.26.0.1.45881 > 112.26.0.8.33728: Flags [.], seq 44081:45509, ack 1, win 1339, options [nop,nop,TS val 80830 ecr 4294823070,mptcp dss ack 3262968525 seq 1976402125 subseq 44081 len 1428 csum 0xe3fc], length 1428
20:12:21.955624 IP 112.26.0.1.45881 > 112.26.0.8.33728: Flags [.], seq 45509:46937, ack 1, win 1339, options [nop,nop,TS val 80830 ecr 4294823100,mptcp dss ack 3262968525 seq 1976403553 subseq 45509 len 1428 csum 0x71a2], length 1428
20:12:21.967286 IP 112.26.0.1.45881 > 112.26.0.8.33728: Flags [.], seq 46937:48365, ack 1, win 1339, options [nop,nop,TS val 80830 ecr 4294823100,mptcp dss ack 3262968525 seq 1976404981 subseq 46937 len 1428 csum 0xc03b], length 1428
20:12:21.974692 IP 112.26.0.1.45881 > 112.26.0.8.33728: Flags [.], seq 31229:32657, ack 1, win 1339, options [nop,nop,TS val 80416 ecr 4294822477,mptcp dss ack 3262968525 seq 1976389273 subseq 31229 len 1428 csum 0xa663], length 1428
20:12:21.987703 IP 112.26.0.1.45881 > 112.26.0.8.33728: Flags [.], seq 48365:49793, ack 1, win 1339, options [nop,nop,TS val 80830 ecr 4294823100,mptcp dss ack 3262968525 seq 1976406409 subseq 48365 len 1428 csum 0x5242], length 1428
20:12:22.050500 IP 112.26.0.1.45881 > 112.26.0.8.33728: Flags [.], seq 31229:32657, ack 1, win 1339, options [nop,nop,TS val 80416 ecr 4294822477,mptcp dss ack 3262968525 seq 1976389273 subseq 31229 len 1428 csum 0xa663], length 1428
20:12:22.061178 IP 112.26.0.1.45881 > 112.26.0.8.33728: Flags [.], seq 32657:34085, ack 1, win 1339, options [nop,nop,TS val 80426 ecr 4294822572,mptcp dss ack 3262968525 seq 1976390701 subseq 32657 len 1428 csum 0x220e], length 1428
20:12:22.064307 IP 112.26.0.1.45881 > 112.26.0.8.33728: Flags [.], seq 32657:34085, ack 1, win 1339, options [nop,nop,TS val 80426 ecr 4294822572,mptcp dss ack 3262968525 seq 1976390701 subseq 32657 len 1428 csum 0x220e], length 1428
20:12:22.075925 IP 112.26.0.1.45881 > 112.26.0.8.33728: Flags [.], seq 49793:51221, ack 1, win 1339, options [nop,nop,TS val 80830 ecr 4294823100,mptcp dss ack 3262968525 seq 1976407837 subseq 49793 len 1428 csum 0xdf3], length 1428
20:12:22.086031 IP 112.26.0.1.45881 > 112.26.0.8.33728: Flags [.], seq 51221:52649, ack 1, win 1339, options [nop,nop,TS val 80830 ecr 4294823100,mptcp dss ack 3262968525 seq 1976409265 subseq 51221 len 1428 csum 0xdc77], length 1428
20:12:22.151023 IP 112.26.0.1.45881 > 112.26.0.8.33728: Flags [.], seq 35513:36941, ack 1, win 1339, options [nop,nop,TS val 80536 ecr 4294822758,mptcp dss ack 3262968525 seq 1976393557 subseq 35513 len 1428 csum 0x2fa4], length 1428
20:12:22.163892 IP 112.26.0.1.45881 > 112.26.0.8.33728: Flags [.], seq 35513:36941, ack 1, win 1339, options [nop,nop,TS val 80536 ecr 4294822758,mptcp dss ack 3262968525 seq 1976393557 subseq 35513 len 1428 csum 0x2fa4], length 1428
20:12:22.173724 IP 112.26.0.1.45881 > 112.26.0.8.33728: Flags [.], seq 52649:54077, ack 1, win 1339, options [nop,nop,TS val 80830 ecr 4294823100,mptcp dss ack 3262968525 seq 1976410693 subseq 52649 len 1428 csum 0x18ec], length 1428
20:12:22.181952 IP 112.26.0.1.45881 > 112.26.0.8.33728: Flags [.], seq 36941:38369, ack 1, win 1339, options [nop,nop,TS val 80641 ecr 4294822801,mptcp dss ack 3262968525 seq 1976394985 subseq 36941 len 1428 csum 0x8817], length 1428
20:12:22.252592 IP 112.26.0.1.45881 > 112.26.0.8.33728: Flags [.], seq 54077:55505, ack 1, win 1339, options [nop,nop,TS val 80830 ecr 4294823100,mptcp dss ack 3262968525 seq 1976412121 subseq 54077 len 1428 csum 0x15f8], length 1428
20:12:22.258658 IP 112.26.0.1.45881 > 112.26.0.8.33728: Flags [.], seq 38369:39797, ack 1, win 1339, options [nop,nop,TS val 80712 ecr 4294822996,mptcp dss ack 3262968525 seq 1976396413 subseq 38369 len 1428 csum 0xe1d], length 1428
20:12:22.260425 IP 112.26.0.1.45881 > 112.26.0.8.33728: Flags [.], seq 36941:38369, ack 1, win 1339, options [nop,nop,TS val 80641 ecr 4294822801,mptcp dss ack 3262968525 seq 1976394985 subseq 36941 len 1428 csum 0x8817], length 1428
20:12:22.276547 IP 112.26.0.1.45881 > 112.26.0.8.33728: Flags [.], seq 55505:56933, ack 1, win 1339, options [nop,nop,TS val 80831 ecr 4294823100,mptcp dss ack 3262968525 seq 1976413549 subseq 55505 len 1428 csum 0x4df2], length 1428
20:12:22.277788 IP 112.26.0.1.45881 > 112.26.0.8.33728: Flags [.], seq 38369:39797, ack 1, win 1339, options [nop,nop,TS val 80712 ecr 4294822996,mptcp dss ack 3262968525 seq 1976396413 subseq 38369 len 1428 csum 0xe1d], length 1428
20:12:22.286718 IP 112.26.0.1.45881 > 112.26.0.8.33728: Flags [.], seq 56933:58361, ack 1, win 1339, options [nop,nop,TS val 80831 ecr 4294823100,mptcp dss ack 3262968525 seq 1976414977 subseq 56933 len 1428 csum 0x637c], length 1428
20:12:22.288639 IP 112.26.0.1.45881 > 112.26.0.8.33728: Flags [.], seq 44081:45509, ack 1, win 1339, options [nop,nop,TS val 80830 ecr 4294823070,mptcp dss ack 3262968525 seq 1976402125 subseq 44081 len 1428 csum 0xe3fc], length 1428
20:12:22.297039 IP 112.26.0.1.45881 > 112.26.0.8.33728: Flags [.], seq 44081:45509, ack 1, win 1339, options [nop,nop,TS val 80830 ecr 4294823070,mptcp dss ack 3262968525 seq 1976402125 subseq 44081 len 1428 csum 0xe3fc], length 1428
20:12:22.364481 IP 112.26.0.1.45881 > 112.26.0.8.33728: Flags [.], seq 58361:59789, ack 1, win 1339, options [nop,nop,TS val 81038 ecr 4294823381,mptcp dss ack 3262968525 seq 1976416405 subseq 58361 len 1428 csum 0xd189], length 1428
20:12:22.387498 IP 112.26.0.1.45881 > 112.26.0.8.33728: Flags [.], seq 59789:61217, ack 1, win 1339, options [nop,nop,TS val 81038 ecr 4294823381,mptcp dss ack 3262968525 seq 1976417833 subseq 59789 len 1428 csum 0x5e6f], length 1428
20:12:22.452552 IP 112.26.0.1.45881 > 112.26.0.8.33728: Flags [.], seq 46937:48365, ack 1, win 1339, options [nop,nop,TS val 80830 ecr 4294823100,mptcp dss ack 3262968525 seq 1976404981 subseq 46937 len 1428 csum 0xc03b], length 1428
20:12:22.456660 IP 112.26.0.1.45881 > 112.26.0.8.33728: Flags [.], seq 46937:48365, ack 1, win 1339, options [nop,nop,TS val 80830 ecr 4294823100,mptcp dss ack 3262968525 seq 1976404981 subseq 46937 len 1428 csum 0xc03b], length 1428
20:12:22.468710 IP 112.26.0.1.45881 > 112.26.0.8.33728: Flags [.], seq 61217:62645, ack 1, win 1339, options [nop,nop,TS val 81117 ecr 4294823462,mptcp dss ack 3262968525 seq 1976419261 subseq 61217 len 1428 csum 0xeca7], length 1428
20:12:22.495143 IP 112.26.0.1.45881 > 112.26.0.8.33728: Flags [.], seq 49793:51221, ack 1, win 1339, options [nop,nop,TS val 80830 ecr 4294823100,mptcp dss ack 3262968525 seq 1976407837 subseq 49793 len 1428 csum 0xdf3], length 1428
20:12:22.498212 IP 112.26.0.1.45881 > 112.26.0.8.33728: Flags [.], seq 49793:51221, ack 1, win 1339, options [nop,nop,TS val 80830 ecr 4294823100,mptcp dss ack 3262968525 seq 1976407837 subseq 49793 len 1428 csum 0xdf3], length 1428
20:12:22.555187 IP 112.26.0.1.45881 > 112.26.0.8.33728: Flags [.], seq 62645:64073, ack 1, win 1339, options [nop,nop,TS val 81141 ecr 4294823497,mptcp dss ack 3262968525 seq 1976420689 subseq 62645 len 1428 csum 0x3e2e], length 1428
20:12:22.575004 IP 112.26.0.1.45881 > 112.26.0.8.33728: Flags [.], seq 51221:52649, ack 1, win 1339, options [nop,nop,TS val 80830 ecr 4294823100,mptcp dss ack 3262968525 seq 1976409265 subseq 51221 len 1428 csum 0xdc77], length 1428
20:12:22.586500 IP 112.26.0.1.45881 > 112.26.0.8.33728: Flags [.], seq 51221:52649, ack 1, win 1339, options [nop,nop,TS val 80830 ecr 4294823100,mptcp dss ack 3262968525 seq 1976409265 subseq 51221 len 1428 csum 0xdc77], length 1428
20:12:22.599399 IP 112.26.0.1.45881 > 112.26.0.8.33728: Flags [.], seq 52649:54077, ack 1, win 1339, options [nop,nop,TS val 80830 ecr 4294823100,mptcp dss ack 3262968525 seq 1976410693 subseq 52649 len 1428 csum 0x18ec], length 1428
20:12:22.668471 IP 112.26.0.1.45881 > 112.26.0.8.33728: Flags [.], seq 52649:54077, ack 1, win 1339, options [nop,nop,TS val 80830 ecr 4294823100,mptcp dss ack 3262968525 seq 1976410693 subseq 52649 len 1428 csum 0x18ec], length 1428
20:12:22.683960 IP 112.26.0.1.45881 > 112.26.0.8.33728: Flags [.], seq 54077:55505, ack 1, win 1339, options [nop,nop,TS val 80830 ecr 4294823100,mptcp dss ack 3262968525 seq 1976412121 subseq 54077 len 1428 csum 0x15f8], length 1428
20:12:22.697715 IP 112.26.0.1.45881 > 112.26.0.8.33728: Flags [.], seq 54077:55505, ack 1, win 1339, options [nop,nop,TS val 80830 ecr 4294823100,mptcp dss ack 3262968525 seq 1976412121 subseq 54077 len 1428 csum 0x15f8], length 1428
20:12:22.763532 IP 112.26.0.1.45881 > 112.26.0.8.33728: Flags [.], seq 64073:65501, ack 1, win 1339, options [nop,nop,TS val 81708 ecr 4294824004,mptcp dss ack 3262968525 seq 1976422117 subseq 64073 len 1428 csum 0x18ae], length 1428
20:12:22.770760 IP 112.26.0.1.45881 > 112.26.0.8.33728: Flags [.], seq 55505:56933, ack 1, win 1339, options [nop,nop,TS val 80831 ecr 4294823100,mptcp dss ack 3262968525 seq 1976413549 subseq 55505 len 1428 csum 0x4df2], length 1428
20:12:22.791127 IP 112.26.0.1.45881 > 112.26.0.8.33728: Flags [.], seq 65501:66929, ack 1, win 1339, options [nop,nop,TS val 81708 ecr 4294824004,mptcp dss ack 3262968525 seq 1976423545 subseq 65501 len 1428 csum 0xf9c2], length 1428
20:12:22.809870 IP 112.26.0.1.45881 > 112.26.0.8.33728: Flags [.], seq 58361:59789, ack 1, win 1339, options [nop,nop,TS val 81038 ecr 4294823381,mptcp dss ack 3262968525 seq 1976416405 subseq 58361 len 1428 csum 0xd189], length 1428
20:12:22.860469 IP 112.26.0.1.45881 > 112.26.0.8.33728: Flags [.], seq 55505:56933, ack 1, win 1339, options [nop,nop,TS val 80831 ecr 4294823100,mptcp dss ack 3262968525 seq 1976413549 subseq 55505 len 1428 csum 0x4df2], length 1428
20:12:22.873599 IP 112.26.0.1.45881 > 112.26.0.8.33728: Flags [.], seq 66929:68357, ack 1, win 1339, options [nop,nop,TS val 81812 ecr 4294824161,mptcp dss ack 3262968525 seq 1976424973 subseq 66929 len 1428 csum 0x811f], length 1428
20:12:22.885163 IP 112.26.0.1.45881 > 112.26.0.8.33728: Flags [.], seq 58361:59789, ack 1, win 1339, options [nop,nop,TS val 81038 ecr 4294823381,mptcp dss ack 3262968525 seq 1976416405 subseq 58361 len 1428 csum 0xd189], length 1428
20:12:22.894155 IP 112.26.0.1.45881 > 112.26.0.8.33728: Flags [.], seq 68357:69785, ack 1, win 1339, options [nop,nop,TS val 81839 ecr 4294824203,mptcp dss ack 3262968525 seq 1976426401 subseq 68357 len 1428 csum 0xc617], length 1428
20:12:22.895826 IP 112.26.0.1.45881 > 112.26.0.8.33728: Flags [.], seq 59789:61217, ack 1, win 1339, options [nop,nop,TS val 81038 ecr 4294823381,mptcp dss ack 3262968525 seq 1976417833 subseq 59789 len 1428 csum 0x5e6f], length 1428
20:12:22.961432 IP 112.26.0.1.45881 > 112.26.0.8.33728: Flags [.], seq 69785:71213, ack 1, win 1339, options [nop,nop,TS val 81839 ecr 4294824203,mptcp dss ack 3262968525 seq 1976427829 subseq 69785 len 1428 csum 0x8fc6], length 1428
20:12:22.963734 IP 112.26.0.1.45881 > 112.26.0.8.33728: Flags [.], seq 59789:61217, ack 1, win 1339, options [nop,nop,TS val 81038 ecr 4294823381,mptcp dss ack 3262968525 seq 1976417833 subseq 59789 len 1428 csum 0x5e6f], length 1428
20:12:22.987114 IP 112.26.0.1.45881 > 112.26.0.8.33728: Flags [.], seq 62645:64073, ack 1, win 1339, options [nop,nop,TS val 81141 ecr 4294823497,mptcp dss ack 3262968525 seq 1976420689 subseq 62645 len 1428 csum 0x3e2e], length 1428
20:12:22.993417 IP 112.26.0.1.45881 > 112.26.0.8.33728: Flags [.], seq 62645:64073, ack 1, win 1339, options [nop,nop,TS val 81141 ecr 4294823497,mptcp dss ack 3262968525 seq 1976420689 subseq 62645 len 1428 csum 0x3e2e], length 1428
20:12:23.000350 IP 112.26.0.1.45881 > 112.26.0.8.33728: Flags [.], seq 71213:72641, ack 1, win 1339, options [nop,nop,TS val 81929 ecr 4294824293,mptcp dss ack 3262968525 seq 1976429257 subseq 71213 len 1428 csum 0xca73], length 1428
20:12:23.076234 IP 112.26.0.1.45881 > 112.26.0.8.33728: Flags [.], seq 72641:74069, ack 1, win 1339, options [nop,nop,TS val 82019 ecr 4294824377,mptcp dss ack 3262968525 seq 1976430685 subseq 72641 len 1428 csum 0xfb20], length 1428
20:12:23.079502 IP 112.26.0.1.45881 > 112.26.0.8.33728: Flags [.], seq 64073:65501, ack 1, win 1339, options [nop,nop,TS val 81708 ecr 4294824004,mptcp dss ack 3262968525 seq 1976422117 subseq 64073 len 1428 csum 0x18ae], length 1428
20:12:23.086427 IP 112.26.0.1.45881 > 112.26.0.8.33728: Flags [.], seq 64073:65501, ack 1, win 1339, options [nop,nop,TS val 81708 ecr 4294824004,mptcp dss ack 3262968525 seq 1976422117 subseq 64073 len 1428 csum 0x18ae], length 1428
20:12:23.173353 IP 112.26.0.1.45881 > 112.26.0.8.33728: Flags [.], seq 74069:75497, ack 1, win 1339, options [nop,nop,TS val 82114 ecr 4294824404,mptcp dss ack 3262968525 seq 1976432113 subseq 74069 len 1428 csum 0x9a81], length 1428
20:12:23.186427 IP 112.26.0.1.45881 > 112.26.0.8.33728: Flags [.], seq 65501:66929, ack 1, win 1339, options [nop,nop,TS val 81708 ecr 4294824004,mptcp dss ack 3262968525 seq 1976423545 subseq 65501 len 1428 csum 0xf9c2], length 1428
20:12:23.190900 IP 112.26.0.1.45881 > 112.26.0.8.33728: Flags [.], seq 65501:66929, ack 1, win 1339, options [nop,nop,TS val 81708 ecr 4294824004,mptcp dss ack 3262968525 seq 1976423545 subseq 65501 len 1428 csum 0xf9c2], length 1428
20:12:23.206762 IP 112.26.0.1.45881 > 112.26.0.8.33728: Flags [.], seq 45509:46937, ack 1, win 1339, options [nop,nop,TS val 82114 ecr 4294824570,mptcp dss ack 3262968525 seq 1976403553 subseq 45509 len 1428 csum 0x71a2], length 1428
20:12:23.263866 IP 112.26.0.1.45881 > 112.26.0.8.33728: Flags [.], seq 66929:68357, ack 1, win 1339, options [nop,nop,TS val 81812 ecr 4294824161,mptcp dss ack 3262968525 seq 1976424973 subseq 66929 len 1428 csum 0x811f], length 1428
20:12:23.267329 IP 112.26.0.1.45881 > 112.26.0.8.33728: Flags [.], seq 66929:68357, ack 1, win 1339, options [nop,nop,TS val 81812 ecr 4294824161,mptcp dss ack 3262968525 seq 1976424973 subseq 66929 len 1428 csum 0x811f], length 1428
20:12:23.275441 IP 112.26.0.1.45881 > 112.26.0.8.33728: Flags [.], seq 48365:49793, ack 1, win 1339, options [nop,nop,TS val 82131 ecr 4294824595,mptcp dss ack 3262968525 seq 1976406409 subseq 48365 len 1428 csum 0x5242], length 1428
20:12:23.293156 IP 112.26.0.1.45881 > 112.26.0.8.33728: Flags [.], seq 68357:69785, ack 1, win 1339, options [nop,nop,TS val 81839 ecr 4294824203,mptcp dss ack 3262968525 seq 1976426401 subseq 68357 len 1428 csum 0xc617], length 1428
20:12:23.296093 IP 112.26.0.1.45881 > 112.26.0.8.33728: Flags [.], seq 68357:69785, ack 1, win 1339, options [nop,nop,TS val 81839 ecr 4294824203,mptcp dss ack 3262968525 seq 1976426401 subseq 68357 len 1428 csum 0xc617], length 1428
20:12:23.302558 IP 112.26.0.1.45881 > 112.26.0.8.33728: Flags [.], seq 56933:58361, ack 1, win 1339, options [nop,nop,TS val 82159 ecr 4294824670,mptcp dss ack 3262968525 seq 1976414977 subseq 56933 len 1428 csum 0x637c], length 1428
20:12:23.386548 IP 112.26.0.1.45881 > 112.26.0.8.33728: Flags [.], seq 69785:71213, ack 1, win 1339, options [nop,nop,TS val 81839 ecr 4294824203,mptcp dss ack 3262968525 seq 1976427829 subseq 69785 len 1428 csum 0x8fc6], length 1428
20:12:23.391485 IP 112.26.0.1.45881 > 112.26.0.8.33728: Flags [.], seq 69785:71213, ack 1, win 1339, options [nop,nop,TS val 81839 ecr 4294824203,mptcp dss ack 3262968525 seq 1976427829 subseq 69785 len 1428 csum 0x8fc6], length 1428
20:12:23.398740 IP 112.26.0.1.45881 > 112.26.0.8.33728: Flags [.], seq 61217:62645, ack 1, win 1339, options [nop,nop,TS val 82326 ecr 4294824788,mptcp dss ack 3262968525 seq 1976419261 subseq 61217 len 1428 csum 0xeca7], length 1428
20:12:23.468829 IP 112.26.0.1.45881 > 112.26.0.8.33728: Flags [.], seq 71213:72641, ack 1, win 1339, options [nop,nop,TS val 81929 ecr 4294824293,mptcp dss ack 3262968525 seq 1976429257 subseq 71213 len 1428 csum 0xca73], length 1428
20:12:23.470760 IP 112.26.0.1.45881 > 112.26.0.8.33728: Flags [.], seq 71213:72641, ack 1, win 1339, options [nop,nop,TS val 81929 ecr 4294824293,mptcp dss ack 3262968525 seq 1976429257 subseq 71213 len 1428 csum 0xca73], length 1428
20:12:23.493500 IP 112.26.0.1.45881 > 112.26.0.8.33728: Flags [.], seq 72641:74069, ack 1, win 1339, options [nop,nop,TS val 82019 ecr 4294824377,mptcp dss ack 3262968525 seq 1976430685 subseq 72641 len 1428 csum 0xfb20], length 1428
20:12:23.566357 IP 112.26.0.1.45881 > 112.26.0.8.33728: Flags [.], seq 72641:74069, ack 1, win 1339, options [nop,nop,TS val 82019 ecr 4294824377,mptcp dss ack 3262968525 seq 1976430685 subseq 72641 len 1428 csum 0xfb20], length 1428
20:12:23.594304 IP 112.26.0.1.45881 > 112.26.0.8.33728: Flags [.], seq 75497:76925, ack 1, win 1339, options [nop,nop,TS val 82540 ecr 4294824895,mptcp dss ack 3262968525 seq 1976433541 subseq 75497 len 1428 csum 0x569], length 1428
20:12:23.675002 IP 112.26.0.1.45881 > 112.26.0.8.33728: Flags [.], seq 45509:46937, ack 1, win 1339, options [nop,nop,TS val 82114 ecr 4294824570,mptcp dss ack 3262968525 seq 1976403553 subseq 45509 len 1428 csum 0x71a2], length 1428
20:12:23.681732 IP 112.26.0.1.45881 > 112.26.0.8.33728: Flags [.], seq 76925:78353, ack 1, win 1339, options [nop,nop,TS val 82627 ecr 4294824973,mptcp dss ack 3262968525 seq 1976434969 subseq 76925 len 1428 csum 0x9af3], length 1428
20:12:23.690224 IP 112.26.0.1.45881 > 112.26.0.8.33728: Flags [.], seq 45509:46937, ack 1, win 1339, options [nop,nop,TS val 82114 ecr 4294824570,mptcp dss ack 3262968525 seq 1976403553 subseq 45509 len 1428 csum 0x71a2], length 1428
20:12:23.759228 IP 112.26.0.1.45881 > 112.26.0.8.33728: Flags [.], seq 78353:79781, ack 1, win 1339, options [nop,nop,TS val 82651 ecr 4294825003,mptcp dss ack 3262968525 seq 1976436397 subseq 78353 len 1428 csum 0xd64f], length 1428
20:12:23.760967 IP 112.26.0.1.45881 > 112.26.0.8.33728: Flags [.], seq 48365:49793, ack 1, win 1339, options [nop,nop,TS val 82131 ecr 4294824595,mptcp dss ack 3262968525 seq 1976406409 subseq 48365 len 1428 csum 0x5242], length 1428
20:12:23.771508 IP 112.26.0.1.45881 > 112.26.0.8.33728: Flags [.], seq 48365:49793, ack 1, win 1339, options [nop,nop,TS val 82131 ecr 4294824595,mptcp dss ack 3262968525 seq 1976406409 subseq 48365 len 1428 csum 0x5242], length 1428
20:12:23.789430 IP 112.26.0.1.45881 > 112.26.0.8.33728: Flags [.], seq 79781:81209, ack 1, win 1339, options [nop,nop,TS val 82735 ecr 4294825095,mptcp dss ack 3262968525 seq 1976437825 subseq 79781 len 1428 csum 0x1623], length 1428
20:12:23.801903 IP 112.26.0.1.45881 > 112.26.0.8.33728: Flags [.], seq 56933:58361, ack 1, win 1339, options [nop,nop,TS val 82159 ecr 4294824670,mptcp dss ack 3262968525 seq 1976414977 subseq 56933 len 1428 csum 0x637c], length 1428
