21:02:50.608032 IP 112.26.1.8.37183 > 112.26.1.1.44903: Flags [S], seq 4223755272, win 65535, options [mss 1460,sackOK,TS val 38902 ecr 0,nop,wscale 6,mptcp join id 3 token 0x7fa57e4e nonce 0x3f1218a8], length 0
21:02:50.709913 IP 112.26.1.8.37183 > 112.26.1.1.44903: Flags [S], seq 4223755272, win 65535, options [mss 1460,sackOK,TS val 38902 ecr 0,nop,wscale 6,mptcp join id 3 token 0x7fa57e4e nonce 0x3f1218a8], length 0
21:02:50.807077 IP 112.26.1.1.44903 > 112.26.1.8.37183: Flags [S.], seq 1531371114, ack 4223755273, win 65535, options [mss 1460,sackOK,TS val 262418 ecr 38902,nop,wscale 6,mptcp join id 6 hmac 0x5ef4629707bdf55d nonce 0x2932d1ec], length 0
21:02:50.810117 IP 112.26.1.8.37183 > 112.26.1.1.44903: Flags [.], ack 1, win 5658, options [nop,nop,TS val 39125 ecr 262418,mptcp join hmac 0x319fcf6b468b96b1c0c68db3aad6a0ca892cbfcf], length 0
21:02:50.912024 IP 112.26.1.8.37183 > 112.26.1.1.44903: Flags [.], ack 1, win 5658, options [nop,nop,TS val 39125 ecr 262418,mptcp join hmac 0x319fcf6b468b96b1c0c68db3aad6a0ca892cbfcf], length 0
21:02:51.056299 IP 112.26.1.1.44903 > 112.26.1.8.37183: Flags [.], ack 1, win 2678, options [nop,nop,TS val 262620 ecr 39125,mptcp dss ack 2872732397], length 0
21:02:51.127945 IP 112.26.1.1.44903 > 112.26.1.8.37183: Flags [.], seq 1:1429, ack 1, win 2678, options [nop,nop,TS val 262621 ecr 39125,mptcp dss ack 2872732397 seq 407978711 subseq 1 len 1428 csum 0x46b6], length 1428
21:02:51.152570 IP 112.26.1.8.37183 > 112.26.1.1.44903: Flags [.], ack 1429, win 7255, options [nop,nop,TS val 39466 ecr 262621,mptcp dss ack 407967287], length 0
21:02:51.299390 IP 112.26.1.1.44903 > 112.26.1.8.37183: Flags [.], seq 1429:2857, ack 1, win 2678, options [nop,nop,TS val 262621 ecr 39125,mptcp dss ack 2872732397 seq 407980139 subseq 1429 len 1428 csum 0x5167], length 1428
21:02:51.379995 IP 112.26.1.8.37183 > 112.26.1.1.44903: Flags [.], ack 2857, win 7437, options [nop,nop,TS val 39689 ecr 262621,mptcp dss ack 407970143], length 0
21:02:51.427697 IP 112.26.1.1.44903 > 112.26.1.8.37183: Flags [.], seq 2857:4285, ack 1, win 2678, options [nop,nop,TS val 262621 ecr 39125,mptcp dss ack 2872732397 seq 407981567 subseq 2857 len 1428 csum 0xaa8e], length 1428
21:02:51.604564 IP 112.26.1.8.37183 > 112.26.1.1.44903: Flags [.], ack 4285, win 7711, options [nop,nop,TS val 39919 ecr 262621,mptcp dss ack 407972999], length 0
21:02:51.667336 IP 112.26.1.1.44903 > 112.26.1.8.37183: Flags [.], seq 4285:5713, ack 1, win 2678, options [nop,nop,TS val 262621 ecr 39125,mptcp dss ack 2872732397 seq 407982995 subseq 4285 len 1428 csum 0x2fc2], length 1428
21:02:51.735366 IP 112.26.1.8.37183 > 112.26.1.1.44903: Flags [.], ack 1429, win 7255, options [nop,nop,TS val 39466 ecr 262621,mptcp dss ack 407967287], length 0
21:02:51.805517 IP 112.26.1.1.44903 > 112.26.1.8.37183: Flags [.], seq 5713:7141, ack 1, win 2678, options [nop,nop,TS val 262621 ecr 39125,mptcp dss ack 2872732397 seq 407984423 subseq 5713 len 1428 csum 0x5383], length 1428
21:02:51.846043 IP 112.26.1.8.37183 > 112.26.1.1.44903: Flags [.], ack 5713, win 7939, options [nop,nop,TS val 40161 ecr 262621,mptcp dss ack 407974427], length 0
21:02:51.880502 IP 112.26.1.1.44903 > 112.26.1.8.37183: Flags [.], seq 7141:8569, ack 1, win 2678, options [nop,nop,TS val 262621 ecr 39125,mptcp dss ack 2872732397 seq 407985851 subseq 7141 len 1428 csum 0x81fe], length 1428
21:02:51.947359 IP 112.26.1.8.37183 > 112.26.1.1.44903: Flags [.], ack 7141, win 8030, options [nop,nop,TS val 40260 ecr 262621,mptcp dss ack 407975855], length 0
21:02:52.028837 IP 112.26.1.1.44903 > 112.26.1.8.37183: Flags [.], seq 8569:9997, ack 1, win 2678, options [nop,nop,TS val 262621 ecr 39125,mptcp dss ack 2872732397 seq 407987279 subseq 8569 len 1428 csum 0x3487], length 1428
21:02:52.131240 IP 112.26.1.8.37183 > 112.26.1.1.44903: Flags [.], ack 2857, win 7437, options [nop,nop,TS val 39689 ecr 262621,mptcp dss ack 407970143], length 0
21:02:52.170269 IP 112.26.1.8.37183 > 112.26.1.1.44903: Flags [.], ack 8569, win 8350, options [nop,nop,TS val 40485 ecr 262621,mptcp dss ack 407987279], length 0
21:02:52.308123 IP 112.26.1.1.44903 > 112.26.1.8.37183: Flags [.], seq 9997:11425, ack 1, win 2678, options [nop,nop,TS val 262621 ecr 39125,mptcp dss ack 2872732397 seq 407988707 subseq 9997 len 1428 csum 0x228e], length 1428
21:02:52.324481 IP 112.26.1.8.37183 > 112.26.1.1.44903: Flags [.], ack 9997, win 8441, options [nop,nop,TS val 40630 ecr 262621,mptcp dss ack 407988707], length 0
21:02:52.410318 IP 112.26.1.1.44903 > 112.26.1.8.37183: Flags [.], seq 11425:12853, ack 1, win 2678, options [nop,nop,TS val 262622 ecr 39125,mptcp dss ack 2872732397 seq 407990135 subseq 11425 len 1428 csum 0xd156], length 1428
21:02:52.430016 IP 112.26.1.8.37183 > 112.26.1.1.44903: Flags [.], ack 11425, win 8624, options [nop,nop,TS val 40744 ecr 262621,mptcp dss ack 407990135], length 0
21:02:52.486503 IP 112.26.1.8.37183 > 112.26.1.1.44903: Flags [.], ack 12853, win 8715, options [nop,nop,TS val 40799 ecr 262622,mptcp dss ack 407991563], length 0
21:02:52.528349 IP 112.26.1.8.37183 > 112.26.1.1.44903: Flags [.], ack 4285, win 7711, options [nop,nop,TS val 39919 ecr 262621,mptcp dss ack 407972999], length 0
21:02:52.661730 IP 112.26.1.1.44903 > 112.26.1.8.37183: Flags [.], seq 14281:15709, ack 1, win 4017, options [nop,nop,TS val 263443 ecr 39466,mptcp dss ack 2872732397 seq 408042971 subseq 14281 len 1428 csum 0xee], length 1428
21:02:52.739132 IP 112.26.1.1.44903 > 112.26.1.8.37183: Flags [.], seq 15709:17137, ack 1, win 4017, options [nop,nop,TS val 263443 ecr 39466,mptcp dss ack 2872732397 seq 408044399 subseq 15709 len 1428 csum 0xc50e], length 1428
21:02:52.810268 IP 112.26.1.8.37183 > 112.26.1.1.44903: Flags [.], ack 5713, win 7939, options [nop,nop,TS val 40161 ecr 262621,mptcp dss ack 407974427], length 0
21:02:52.830125 IP 112.26.1.8.37183 > 112.26.1.1.44903: Flags [.], ack 12853, win 9125, options [nop,nop,TS val 41144 ecr 262622,nop,nop,sack 1 {14281:15709},mptcp dss ack 407991563], length 0
21:02:52.917943 IP 112.26.1.1.44903 > 112.26.1.8.37183: Flags [.], seq 1429:2857, ack 1, win 4017, options [nop,nop,TS val 263834 ecr 39466,mptcp dss ack 2872732397 seq 407980139 subseq 1429 len 1428 csum 0x5167], length 1428
21:02:52.923195 IP 112.26.1.8.37183 > 112.26.1.1.44903: Flags [.], ack 12853, win 9217, options [nop,nop,TS val 41192 ecr 262622,nop,nop,sack 1 {14281:17137},mptcp dss ack 407991563], length 0
21:02:53.008740 IP 112.26.1.1.44903 > 112.26.1.8.37183: Flags [.], seq 17137:18565, ack 1, win 4017, options [nop,nop,TS val 263853 ecr 39689,mptcp dss ack 2872732397 seq 407980139 subseq 17137 len 1428 csum 0x140b], length 1428
21:02:53.130733 IP 112.26.1.8.37183 > 112.26.1.1.44903: Flags [.], ack 7141, win 8030, options [nop,nop,TS val 40260 ecr 262621,mptcp dss ack 407975855], length 0
21:02:53.190993 IP 112.26.1.8.37183 > 112.26.1.1.44903: Flags [.], ack 12853, win 9399, options [nop,nop,TS val 41506 ecr 262622,nop,nop,sack 2 {1429:2857}{14281:17137},mptcp dss ack 407991563], length 0
21:02:53.210412 IP 112.26.1.1.44903 > 112.26.1.8.37183: Flags [.], seq 19993:21421, ack 1, win 4017, options [nop,nop,TS val 264236 ecr 39919,mptcp dss ack 2872732397 seq 408058679 subseq 19993 len 1428 csum 0xc8f2], length 1428
21:02:53.355266 IP 112.26.1.8.37183 > 112.26.1.1.44903: Flags [.], ack 12853, win 9536, options [nop,nop,TS val 41670 ecr 262622,nop,nop,sack 1 {14281:18565},mptcp dss ack 407991563], length 0
21:02:53.390847 IP 112.26.1.1.44903 > 112.26.1.8.37183: Flags [.], seq 21421:22849, ack 1, win 4017, options [nop,nop,TS val 264236 ecr 39919,mptcp dss ack 2872732397 seq 408060107 subseq 21421 len 1428 csum 0x51e9], length 1428
21:02:53.452111 IP 112.26.1.1.44903 > 112.26.1.8.37183: Flags [.], seq 22849:24277, ack 1, win 4017, options [nop,nop,TS val 264425 ecr 40485,mptcp dss ack 2872732397 seq 408071531 subseq 22849 len 1428 csum 0x3b57], length 1428
21:02:53.555373 IP 112.26.1.1.44903 > 112.26.1.8.37183: Flags [.], seq 24277:25705, ack 1, win 4017, options [nop,nop,TS val 264425 ecr 40485,mptcp dss ack 2872732397 seq 408072959 subseq 24277 len 1428 csum 0x6364], length 1428
21:02:53.588242 IP 112.26.1.8.37183 > 112.26.1.1.44903: Flags [.], ack 12853, win 9810, options [nop,nop,TS val 41902 ecr 262622,nop,nop,sack 2 {19993:21421}{14281:18565},mptcp dss ack 407991563], length 0
21:02:53.667108 IP 112.26.1.1.44903 > 112.26.1.8.37183: Flags [.], seq 25705:27133, ack 1, win 4017, options [nop,nop,TS val 264425 ecr 40485,mptcp dss ack 2872732397 seq 408074387 subseq 25705 len 1428 csum 0x272a], length 1428
21:02:53.762716 IP 112.26.1.8.37183 > 112.26.1.1.44903: Flags [.], ack 12853, win 10038, options [nop,nop,TS val 42073 ecr 262622,nop,nop,sack 2 {19993:22849}{14281:18565},mptcp dss ack 407991563], length 0
21:02:53.832925 IP 112.26.1.1.44903 > 112.26.1.8.37183: Flags [.], seq 27133:28561, ack 1, win 4017, options [nop,nop,TS val 264425 ecr 40485,mptcp dss ack 2872732397 seq 408075815 subseq 27133 len 1428 csum 0x475], length 1428
21:02:53.847842 IP 112.26.1.8.37183 > 112.26.1.1.44903: Flags [.], ack 12853, win 10129, options [nop,nop,TS val 42134 ecr 262622,nop,nop,sack 2 {19993:24277}{14281:18565},mptcp dss ack 407991563], length 0
21:02:53.966817 IP 112.26.1.8.37183 > 112.26.1.1.44903: Flags [.], ack 12853, win 10220, options [nop,nop,TS val 42219 ecr 262622,nop,nop,sack 2 {19993:25705}{14281:18565},mptcp dss ack 407991563], length 0
21:02:53.988009 IP 112.26.1.1.44903 > 112.26.1.8.37183: Flags [.], seq 28561:29989, ack 1, win 4017, options [nop,nop,TS val 264425 ecr 40485,mptcp dss ack 2872732397 seq 408077243 subseq 28561 len 1428 csum 0xa652], length 1428
21:02:54.096428 IP 112.26.1.8.37183 > 112.26.1.1.44903: Flags [.], ack 12853, win 10449, options [nop,nop,TS val 42403 ecr 262622,nop,nop,sack 2 {19993:27133}{14281:18565},mptcp dss ack 407991563], length 0
21:02:54.114389 IP 112.26.1.1.44903 > 112.26.1.8.37183: Flags [.], seq 29989:31417, ack 1, win 4017, options [nop,nop,TS val 264425 ecr 40485,mptcp dss ack 2872732397 seq 408078671 subseq 29989 len 1428 csum 0xa654], length 1428
21:02:54.208511 IP 112.26.1.1.44903 > 112.26.1.8.37183: Flags [.], seq 31417:32845, ack 1, win 4017, options [nop,nop,TS val 264514 ecr 40630,mptcp dss ack 2872732397 seq 408082955 subseq 31417 len 1428 csum 0x2c75], length 1428
21:02:54.266264 IP 112.26.1.8.37183 > 112.26.1.1.44903: Flags [.], ack 12853, win 10722, options [nop,nop,TS val 42580 ecr 262622,nop,nop,sack 2 {19993:28561}{14281:18565},mptcp dss ack 407991563], length 0
21:02:54.307404 IP 112.26.1.1.44903 > 112.26.1.8.37183: Flags [.], seq 32845:34273, ack 1, win 4017, options [nop,nop,TS val 264514 ecr 40630,mptcp dss ack 2872732397 seq 408084383 subseq 32845 len 1428 csum 0x77ec], length 1428
21:02:54.397072 IP 112.26.1.1.44903 > 112.26.1.8.37183: Flags [.], ack 1, win 4017, options [nop,nop,TS val 264518 ecr 40630,mptcp dss ack 2872732397], length 0
21:02:54.536320 IP 112.26.1.8.37183 > 112.26.1.1.44903: Flags [.], ack 12853, win 10996, options [nop,nop,TS val 42850 ecr 262622,nop,nop,sack 2 {19993:29989}{14281:18565},mptcp dss ack 407991563], length 0
21:02:54.642538 IP 112.26.1.1.44903 > 112.26.1.8.37183: Flags [.], seq 35701:37129, ack 1, win 4017, options [nop,nop,TS val 264750 ecr 40744,mptcp dss ack 2872732397 seq 408107231 subseq 35701 len 1428 csum 0x67e5], length 1428
21:02:54.662166 IP 112.26.1.8.37183 > 112.26.1.1.44903: Flags [.], ack 12853, win 11133, options [nop,nop,TS val 42977 ecr 262622,nop,nop,sack 2 {19993:31417}{14281:18565},mptcp dss ack 407991563], length 0
21:02:54.743215 IP 112.26.1.8.37183 > 112.26.1.1.44903: Flags [.], ack 12853, win 11179, options [nop,nop,TS val 43046 ecr 262622,nop,nop,sack 2 {19993:32845}{14281:18565},mptcp dss ack 407991563], length 0
21:02:54.767005 IP 112.26.1.1.44903 > 112.26.1.8.37183: Flags [.], seq 38557:39985, ack 1, win 4017, options [nop,nop,TS val 264810 ecr 40799,mptcp dss ack 2872732397 seq 408112943 subseq 38557 len 1428 csum 0xae81], length 1428
21:02:54.872622 IP 112.26.1.1.44903 > 112.26.1.8.37183: Flags [.], seq 39985:41413, ack 1, win 4017, options [nop,nop,TS val 264977 ecr 41144,mptcp dss ack 2872732397 seq 408120083 subseq 39985 len 1428 csum 0x5931], length 1428
21:02:54.968119 IP 112.26.1.1.44903 > 112.26.1.8.37183: Flags [.], seq 41413:42841, ack 1, win 4017, options [nop,nop,TS val 265131 ecr 41192,mptcp dss ack 2872732397 seq 408128651 subseq 41413 len 1428 csum 0x3486], length 1428
21:02:55.011475 IP 112.26.1.1.44903 > 112.26.1.8.37183: Flags [.], seq 12853:14281, ack 1, win 4017, options [nop,nop,TS val 265435 ecr 41670,mptcp dss ack 2872732397 seq 407991563 subseq 12853 len 1428 csum 0x4a45], length 1428
21:02:55.047763 IP 112.26.1.8.37183 > 112.26.1.1.44903: Flags [.], ack 12853, win 11544, options [nop,nop,TS val 43363 ecr 262622,nop,nop,sack 2 {19993:34273}{14281:18565},mptcp dss ack 407991563], length 0
21:02:55.077324 IP 112.26.1.1.44903 > 112.26.1.8.37183: Flags [.], seq 18565:19993, ack 1, win 4017, options [nop,nop,TS val 265710 ecr 41902,mptcp dss ack 2872732397 seq 407981567 subseq 18565 len 1428 csum 0x6d32], length 1428
21:02:55.158978 IP 112.26.1.1.44903 > 112.26.1.8.37183: Flags [.], seq 42841:44269, ack 1, win 4017, options [nop,nop,TS val 265993 ecr 42073,mptcp dss ack 2872732397 seq 408138647 subseq 42841 len 1428 csum 0x11be], length 1428
21:02:55.231045 IP 112.26.1.1.44903 > 112.26.1.8.37183: Flags [.], seq 44269:45697, ack 1, win 4017, options [nop,nop,TS val 266269 ecr 42219,mptcp dss ack 2872732397 seq 408142931 subseq 44269 len 1428 csum 0x6c4f], length 1428
21:02:55.305974 IP 112.26.1.8.37183 > 112.26.1.1.44903: Flags [.], ack 12853, win 11817, options [nop,nop,TS val 43620 ecr 262622,nop,nop,sack 2 {35701:37129}{19993:34273},mptcp dss ack 407991563], length 0
21:02:55.347171 IP 112.26.1.1.44903 > 112.26.1.8.37183: Flags [.], seq 45697:47125, ack 1, win 4017, options [nop,nop,TS val 266309 ecr 42403,mptcp dss ack 2872732397 seq 408145787 subseq 45697 len 1428 csum 0x3e4], length 1428
21:02:55.468192 IP 112.26.1.1.44903 > 112.26.1.8.37183: Flags [.], seq 47125:48553, ack 1, win 4017, options [nop,nop,TS val 266921 ecr 42850,mptcp dss ack 2872732397 seq 408154355 subseq 47125 len 1428 csum 0x6f0], length 1428
21:02:55.541680 IP 112.26.1.8.37183 > 112.26.1.1.44903: Flags [.], ack 12853, win 12137, options [nop,nop,TS val 43856 ecr 262622,nop,nop,sack 2 {38557:39985}{35701:37129},mptcp dss ack 407991563], length 0
21:02:55.581948 IP 112.26.1.1.44903 > 112.26.1.8.37183: Flags [.], seq 48553:49981, ack 1, win 4017, options [nop,nop,TS val 267116 ecr 42977,mptcp dss ack 2872732397 seq 408157211 subseq 48553 len 1428 csum 0x685a], length 1428
21:02:55.630297 IP 112.26.1.8.37183 > 112.26.1.1.44903: Flags [.], ack 12853, win 12182, options [nop,nop,TS val 43913 ecr 262622,nop,nop,sack 2 {38557:41413}{35701:37129},mptcp dss ack 407991563], length 0
21:02:55.709139 IP 112.26.1.8.37183 > 112.26.1.1.44903: Flags [.], ack 12853, win 12365, options [nop,nop,TS val 44023 ecr 262622,nop,nop,sack 2 {38557:42841}{35701:37129},mptcp dss ack 407991563], length 0
21:02:55.795554 IP 112.26.1.8.37183 > 112.26.1.1.44903: Flags [.], ack 18565, win 12502, options [nop,nop,TS val 44110 ecr 265435,nop,nop,sack 2 {38557:42841}{35701:37129},mptcp dss ack 408037259], length 0
21:02:55.922831 IP 112.26.1.8.37183 > 112.26.1.1.44903: Flags [.], ack 18565, win 12730, options [nop,nop,TS val 44236 ecr 265435,nop,nop,sack 2 {38557:44269}{35701:37129},mptcp dss ack 408037259], length 0
21:02:55.996193 IP 112.26.1.8.37183 > 112.26.1.1.44903: Flags [.], ack 18565, win 12912, options [nop,nop,TS val 44306 ecr 265435,nop,nop,sack 2 {38557:45697}{35701:37129},mptcp dss ack 408037259], length 0
21:02:56.072877 IP 112.26.1.1.44903 > 112.26.1.8.37183: Flags [.], seq 34273:35701, ack 1, win 4017, options [nop,nop,TS val 267762 ecr 43620,mptcp dss ack 2872732397 seq 408105803 subseq 34273 len 1428 csum 0x71e3], length 1428
21:02:56.152321 IP 112.26.1.8.37183 > 112.26.1.1.44903: Flags [.], ack 18565, win 13095, options [nop,nop,TS val 44464 ecr 265435,nop,nop,sack 2 {38557:47125}{35701:37129},mptcp dss ack 408037259], length 0
21:02:56.217347 IP 112.26.1.8.37183 > 112.26.1.1.44903: Flags [.], ack 18565, win 13232, options [nop,nop,TS val 44523 ecr 265435,nop,nop,sack 2 {38557:48553}{35701:37129},mptcp dss ack 408037259], length 0
21:02:56.381467 IP 112.26.1.8.37183 > 112.26.1.1.44903: Flags [.], ack 18565, win 13460, options [nop,nop,TS val 44695 ecr 265435,nop,nop,sack 2 {38557:49981}{35701:37129},mptcp dss ack 408058679], length 0
21:02:56.420799 IP 112.26.1.1.44903 > 112.26.1.8.37183: Flags [.], seq 37129:38557, ack 1, win 4017, options [nop,nop,TS val 268018 ecr 43856,mptcp dss ack 2872732397 seq 408111515 subseq 37129 len 1428 csum 0xc7cd], length 1428
21:02:56.528003 IP 112.26.1.1.44903 > 112.26.1.8.37183: Flags [.], seq 49981:51409, ack 1, win 4017, options [nop,nop,TS val 268197 ecr 44023,mptcp dss ack 2872732397 seq 408180059 subseq 49981 len 1428 csum 0x3e8c], length 1428
21:02:56.664022 IP 112.26.1.1.44903 > 112.26.1.8.37183: Flags [.], seq 51409:52837, ack 1, win 4017, options [nop,nop,TS val 268197 ecr 44023,mptcp dss ack 2872732397 seq 408181487 subseq 51409 len 1428 csum 0xbd18], length 1428
21:02:56.743992 IP 112.26.1.1.44903 > 112.26.1.8.37183: Flags [.], seq 52837:54265, ack 1, win 4017, options [nop,nop,TS val 268324 ecr 44110,mptcp dss ack 2872732397 seq 408187199 subseq 52837 len 1428 csum 0x8520], length 1428
21:02:56.859466 IP 112.26.1.1.44903 > 112.26.1.8.37183: Flags [.], seq 54265:55693, ack 1, win 4017, options [nop,nop,TS val 268324 ecr 44110,mptcp dss ack 2872732397 seq 408188627 subseq 54265 len 1428 csum 0x53ba], length 1428
21:02:56.957633 IP 112.26.1.8.37183 > 112.26.1.1.44903: Flags [.], ack 18565, win 14007, options [nop,nop,TS val 45272 ecr 265435,nop,nop,sack 2 {19993:37129}{38557:49981},mptcp dss ack 408058679], length 0
21:02:56.987452 IP 112.26.1.1.44903 > 112.26.1.8.37183: Flags [.], seq 55693:57121, ack 1, win 4017, options [nop,nop,TS val 268324 ecr 44110,mptcp dss ack 2872732397 seq 408190055 subseq 55693 len 1428 csum 0x96e0], length 1428
21:02:57.122644 IP 112.26.1.1.44903 > 112.26.1.8.37183: Flags [.], seq 18565:19993, ack 1, win 4017, options [nop,nop,TS val 268406 ecr 44236,mptcp dss ack 2872732397 seq 407981567 subseq 18565 len 1428 csum 0x6d32], length 1428
21:02:57.254111 IP 112.26.1.1.44903 > 112.26.1.8.37183: Flags [.], seq 57121:58549, ack 1, win 4017, options [nop,nop,TS val 268525 ecr 44306,mptcp dss ack 2872732397 seq 408195767 subseq 57121 len 1428 csum 0xf18e], length 1428
21:02:57.322256 IP 112.26.1.8.37183 > 112.26.1.1.44903: Flags [.], ack 18565, win 14235, options [nop,nop,TS val 45635 ecr 265435,nop,nop,sack 1 {19993:49981},mptcp dss ack 408058679], length 0
21:02:57.356264 IP 112.26.1.1.44903 > 112.26.1.8.37183: Flags [.], seq 58549:59977, ack 1, win 4017, options [nop,nop,TS val 268793 ecr 44464,mptcp dss ack 2872732397 seq 408202907 subseq 58549 len 1428 csum 0x37de], length 1428
21:02:57.445843 IP 112.26.1.8.37183 > 112.26.1.1.44903: Flags [.], ack 18565, win 14418, options [nop,nop,TS val 45746 ecr 265435,nop,nop,sack 1 {19993:51409},mptcp dss ack 408058679], length 0
21:02:57.502186 IP 112.26.1.1.44903 > 112.26.1.8.37183: Flags [.], seq 59977:61405, ack 1, win 4017, options [nop,nop,TS val 268923 ecr 44523,mptcp dss ack 2872732397 seq 408208619 subseq 59977 len 1428 csum 0x9d6], length 1428
21:02:57.517594 IP 112.26.1.8.37183 > 112.26.1.1.44903: Flags [.], ack 18565, win 14555, options [nop,nop,TS val 45831 ecr 265435,nop,nop,sack 1 {19993:52837},mptcp dss ack 408058679], length 0
21:02:57.576558 IP 112.26.1.1.44903 > 112.26.1.8.37183: Flags [.], seq 61405:62833, ack 1, win 4017, options [nop,nop,TS val 269019 ecr 44695,mptcp dss ack 2872732397 seq 408212903 subseq 61405 len 1428 csum 0x78e3], length 1428
21:02:57.656294 IP 112.26.1.8.37183 > 112.26.1.1.44903: Flags [.], ack 18565, win 14737, options [nop,nop,TS val 45970 ecr 265435,nop,nop,sack 1 {19993:54265},mptcp dss ack 408058679], length 0
21:02:57.746078 IP 112.26.1.8.37183 > 112.26.1.1.44903: Flags [.], ack 18565, win 14874, options [nop,nop,TS val 46039 ecr 265435,nop,nop,sack 1 {19993:55693},mptcp dss ack 408058679], length 0
21:02:57.866032 IP 112.26.1.8.37183 > 112.26.1.1.44903: Flags [.], ack 18565, win 15057, options [nop,nop,TS val 46178 ecr 265435,nop,nop,sack 1 {19993:57121},mptcp dss ack 408058679], length 0
21:02:57.969782 IP 112.26.1.8.37183 > 112.26.1.1.44903: Flags [.], ack 57121, win 15239, options [nop,nop,TS val 46269 ecr 268406,mptcp dss ack 408175775], length 0
21:02:58.056747 IP 112.26.1.8.37183 > 112.26.1.1.44903: Flags [.], ack 58549, win 15376, options [nop,nop,TS val 46334 ecr 268525,mptcp dss ack 408175775], length 0
21:02:58.145114 IP 112.26.1.8.37183 > 112.26.1.1.44903: Flags [.], ack 59977, win 15513, options [nop,nop,TS val 46436 ecr 268793,mptcp dss ack 408175775], length 0
21:02:58.175657 IP 112.26.1.1.44903 > 112.26.1.8.37183: Flags [.], seq 62833:64261, ack 1, win 4017, options [nop,nop,TS val 269864 ecr 45635,mptcp dss ack 2872732397 seq 408242891 subseq 62833 len 1428 csum 0xe202], length 1428
21:02:58.272561 IP 112.26.1.1.44903 > 112.26.1.8.37183: Flags [.], seq 64261:65689, ack 1, win 4017, options [nop,nop,TS val 269864 ecr 45635,mptcp dss ack 2872732397 seq 408244319 subseq 64261 len 1428 csum 0x500b], length 1428
21:02:58.308893 IP 112.26.1.8.37183 > 112.26.1.1.44903: Flags [.], ack 61405, win 15741, options [nop,nop,TS val 46622 ecr 268923,mptcp dss ack 408175775], length 0
21:02:58.401928 IP 112.26.1.8.37183 > 112.26.1.1.44903: Flags [.], ack 62833, win 15878, options [nop,nop,TS val 46716 ecr 269019,mptcp dss ack 408175775], length 0
21:02:58.431214 IP 112.26.1.1.44903 > 112.26.1.8.37183: Flags [.], seq 65689:67117, ack 1, win 4017, options [nop,nop,TS val 269938 ecr 45746,mptcp dss ack 2872732397 seq 408247175 subseq 65689 len 1428 csum 0xcc75], length 1428
21:02:58.556836 IP 112.26.1.1.44903 > 112.26.1.8.37183: Flags [.], seq 67117:68545, ack 1, win 4017, options [nop,nop,TS val 270096 ecr 45831,mptcp dss ack 2872732397 seq 408251459 subseq 67117 len 1428 csum 0x89d7], length 1428
21:02:58.673220 IP 112.26.1.1.44903 > 112.26.1.8.37183: Flags [.], seq 68545:69973, ack 1, win 4017, options [nop,nop,TS val 270258 ecr 45970,mptcp dss ack 2872732397 seq 408258599 subseq 68545 len 1428 csum 0xf46e], length 1428
21:02:58.802453 IP 112.26.1.1.44903 > 112.26.1.8.37183: Flags [.], seq 69973:71401, ack 1, win 4017, options [nop,nop,TS val 270319 ecr 46039,mptcp dss ack 2872732397 seq 408262883 subseq 69973 len 1428 csum 0xd5d7], length 1428
21:02:58.939488 IP 112.26.1.1.44903 > 112.26.1.8.37183: Flags [.], seq 71401:72829, ack 1, win 4017, options [nop,nop,TS val 270471 ecr 46178,mptcp dss ack 2872732397 seq 408268595 subseq 71401 len 1428 csum 0xcba5], length 1428
21:02:59.071216 IP 112.26.1.8.37183 > 112.26.1.1.44903: Flags [.], ack 64261, win 16380, options [nop,nop,TS val 47385 ecr 269864,mptcp dss ack 408175775], length 0
21:02:59.095663 IP 112.26.1.1.44903 > 112.26.1.8.37183: Flags [.], seq 72829:74257, ack 1, win 4017, options [nop,nop,TS val 270574 ecr 46269,mptcp dss ack 2872732397 seq 408274307 subseq 72829 len 1428 csum 0x6ec7], length 1428
21:02:59.161365 IP 112.26.1.8.37183 > 112.26.1.1.44903: Flags [.], ack 65689, win 16517, options [nop,nop,TS val 47476 ecr 269864,mptcp dss ack 408175775], length 0
21:02:59.173132 IP 112.26.1.1.44903 > 112.26.1.8.37183: Flags [.], seq 74257:75685, ack 1, win 4017, options [nop,nop,TS val 270574 ecr 46269,mptcp dss ack 2872732397 seq 408275735 subseq 74257 len 1428 csum 0x6683], length 1428
21:02:59.343710 IP 112.26.1.1.44903 > 112.26.1.8.37183: Flags [.], seq 75685:77113, ack 1, win 4017, options [nop,nop,TS val 270718 ecr 46334,mptcp dss ack 2872732397 seq 408282875 subseq 75685 len 1428 csum 0xfd72], length 1428
21:02:59.372279 IP 112.26.1.8.37183 > 112.26.1.1.44903: Flags [.], ack 67117, win 16790, options [nop,nop,TS val 47686 ecr 269938,mptcp dss ack 408175775], length 0
21:02:59.466434 IP 112.26.1.8.37183 > 112.26.1.1.44903: Flags [.], ack 68545, win 16927, options [nop,nop,TS val 47765 ecr 270096,mptcp dss ack 408175775], length 0
21:02:59.493814 IP 112.26.1.1.44903 > 112.26.1.8.37183: Flags [.], seq 77113:78541, ack 1, win 4017, options [nop,nop,TS val 270718 ecr 46334,mptcp dss ack 2872732397 seq 408284303 subseq 77113 len 1428 csum 0x9f27], length 1428
21:02:59.537411 IP 112.26.1.1.44903 > 112.26.1.8.37183: Flags [.], seq 78541:79969, ack 1, win 4017, options [nop,nop,TS val 270935 ecr 46436,mptcp dss ack 2872732397 seq 408290015 subseq 78541 len 1428 csum 0xda4c], length 1428
21:02:59.544958 IP 112.26.1.8.37183 > 112.26.1.1.44903: Flags [.], ack 69973, win 17110, options [nop,nop,TS val 47858 ecr 270258,mptcp dss ack 408175775], length 0
21:02:59.628879 IP 112.26.1.1.44903 > 112.26.1.8.37183: Flags [.], seq 79969:81397, ack 1, win 4017, options [nop,nop,TS val 271082 ecr 46716,mptcp dss ack 2872732397 seq 408295727 subseq 79969 len 1428 csum 0x3162], length 1428
21:02:59.651839 IP 112.26.1.8.37183 > 112.26.1.1.44903: Flags [.], ack 71401, win 17201, options [nop,nop,TS val 47955 ecr 270319,mptcp dss ack 408175775], length 0
21:02:59.725330 IP 112.26.1.8.37183 > 112.26.1.1.44903: Flags [.], ack 72829, win 17384, options [nop,nop,TS val 48040 ecr 270471,mptcp dss ack 408175775], length 0
21:02:59.789427 IP 112.26.1.1.44903 > 112.26.1.8.37183: Flags [.], seq 81397:82825, ack 1, win 4017, options [nop,nop,TS val 271082 ecr 46716,mptcp dss ack 2872732397 seq 408297155 subseq 81397 len 1428 csum 0xa03e], length 1428
21:02:59.895926 IP 112.26.1.8.37183 > 112.26.1.1.44903: Flags [.], ack 74257, win 17566, options [nop,nop,TS val 48210 ecr 270574,mptcp dss ack 408175775], length 0
21:02:59.944132 IP 112.26.1.1.44903 > 112.26.1.8.37183: Flags [.], seq 82825:84253, ack 1, win 4017, options [nop,nop,TS val 271082 ecr 46716,mptcp dss ack 2872732397 seq 408298583 subseq 82825 len 1428 csum 0x8bbd], length 1428
21:03:00.053005 IP 112.26.1.8.37183 > 112.26.1.1.44903: Flags [.], ack 75685, win 17840, options [nop,nop,TS val 48368 ecr 270574,mptcp dss ack 408175775], length 0
21:03:00.066782 IP 112.26.1.1.44903 > 112.26.1.8.37183: Flags [.], seq 84253:85681, ack 1, win 4017, options [nop,nop,TS val 271557 ecr 47385,mptcp dss ack 2872732397 seq 408312863 subseq 84253 len 1428 csum 0x67b8], length 1428
21:03:00.171297 IP 112.26.1.8.37183 > 112.26.1.1.44903: Flags [.], ack 77113, win 17931, options [nop,nop,TS val 48485 ecr 270718,mptcp dss ack 408175775], length 0
21:03:00.182993 IP 112.26.1.1.44903 > 112.26.1.8.37183: Flags [.], seq 85681:87109, ack 1, win 4017, options [nop,nop,TS val 271721 ecr 47476,mptcp dss ack 2872732397 seq 408320003 subseq 85681 len 1428 csum 0xf1e], length 1428
21:03:00.285253 IP 112.26.1.1.44903 > 112.26.1.8.37183: Flags [.], seq 87109:88537, ack 1, win 4017, options [nop,nop,TS val 271721 ecr 47476,mptcp dss ack 2872732397 seq 408321431 subseq 87109 len 1428 csum 0x299f], length 1428
21:03:00.377493 IP 112.26.1.1.44903 > 112.26.1.8.37183: Flags [.], seq 88537:89965, ack 1, win 4017, options [nop,nop,TS val 271947 ecr 47686,mptcp dss ack 2872732397 seq 408325715 subseq 88537 len 1428 csum 0xfc01], length 1428
21:03:00.445481 IP 112.26.1.8.37183 > 112.26.1.1.44903: Flags [.], ack 77113, win 18114, options [nop,nop,TS val 48760 ecr 270718,nop,nop,sack 1 {79969:81397},mptcp dss ack 408225755], length 0
21:03:00.509191 IP 112.26.1.1.44903 > 112.26.1.8.37183: Flags [.], seq 89965:91393, ack 1, win 4017, options [nop,nop,TS val 272043 ecr 47765,mptcp dss ack 2872732397 seq 408328571 subseq 89965 len 1428 csum 0x22e2], length 1428
21:03:00.593493 IP 112.26.1.1.44903 > 112.26.1.8.37183: Flags [.], seq 91393:92821, ack 1, win 4017, options [nop,nop,TS val 272245 ecr 47955,mptcp dss ack 2872732397 seq 408339995 subseq 91393 len 1428 csum 0x71da], length 1428
21:03:00.672129 IP 112.26.1.8.37183 > 112.26.1.1.44903: Flags [.], ack 77113, win 18296, options [nop,nop,TS val 48986 ecr 270718,nop,nop,sack 1 {79969:82825},mptcp dss ack 408225755], length 0
21:03:00.720152 IP 112.26.1.1.44903 > 112.26.1.8.37183: Flags [.], seq 92821:94249, ack 1, win 4017, options [nop,nop,TS val 272245 ecr 47955,mptcp dss ack 2872732397 seq 408341423 subseq 92821 len 1428 csum 0x56c4], length 1428
21:03:00.781398 IP 112.26.1.8.37183 > 112.26.1.1.44903: Flags [.], ack 77113, win 18479, options [nop,nop,TS val 49094 ecr 270718,nop,nop,sack 1 {79969:84253},mptcp dss ack 408225755], length 0
21:03:00.813451 IP 112.26.1.1.44903 > 112.26.1.8.37183: Flags [.], seq 94249:95677, ack 1, win 4017, options [nop,nop,TS val 272334 ecr 48040,mptcp dss ack 2872732397 seq 408345707 subseq 94249 len 1428 csum 0x34f8], length 1428
21:03:00.992767 IP 112.26.1.1.44903 > 112.26.1.8.37183: Flags [.], seq 95677:97105, ack 1, win 4017, options [nop,nop,TS val 272334 ecr 48040,mptcp dss ack 2872732397 seq 408347135 subseq 95677 len 1428 csum 0x7ceb], length 1428
21:03:01.088727 IP 112.26.1.1.44903 > 112.26.1.8.37183: Flags [.], seq 97105:98533, ack 1, win 4017, options [nop,nop,TS val 272616 ecr 48368,mptcp dss ack 2872732397 seq 408355703 subseq 97105 len 1428 csum 0x2ea3], length 1428
21:03:01.111811 IP 112.26.1.8.37183 > 112.26.1.1.44903: Flags [.], ack 77113, win 18844, options [nop,nop,TS val 49411 ecr 270718,nop,nop,sack 2 {87109:88537}{79969:84253},mptcp dss ack 408284303], length 0
21:03:01.155867 IP 112.26.1.1.44903 > 112.26.1.8.37183: Flags [.], seq 98533:99961, ack 1, win 4017, options [nop,nop,TS val 272616 ecr 48368,mptcp dss ack 2872732397 seq 408357131 subseq 98533 len 1428 csum 0x7727], length 1428
21:03:01.214556 IP 112.26.1.8.37183 > 112.26.1.1.44903: Flags [.], ack 77113, win 19026, options [nop,nop,TS val 49526 ecr 270718,nop,nop,sack 2 {87109:89965}{79969:84253},mptcp dss ack 408284303], length 0
21:03:01.238308 IP 112.26.1.1.44903 > 112.26.1.8.37183: Flags [.], seq 99961:101389, ack 1, win 4017, options [nop,nop,TS val 272724 ecr 48485,mptcp dss ack 2872732397 seq 408359987 subseq 99961 len 1428 csum 0x1bac], length 1428
21:03:01.323254 IP 112.26.1.8.37183 > 112.26.1.1.44903: Flags [.], ack 77113, win 19163, options [nop,nop,TS val 49609 ecr 270718,nop,nop,sack 2 {87109:91393}{79969:84253},mptcp dss ack 408284303], length 0
21:03:01.385464 IP 112.26.1.8.37183 > 112.26.1.1.44903: Flags [.], ack 77113, win 19300, options [nop,nop,TS val 49700 ecr 270718,nop,nop,sack 2 {87109:92821}{79969:84253},mptcp dss ack 408284303], length 0
21:03:01.535781 IP 112.26.1.8.37183 > 112.26.1.1.44903: Flags [.], ack 77113, win 19482, options [nop,nop,TS val 49850 ecr 270718,nop,nop,sack 2 {87109:94249}{79969:84253},mptcp dss ack 408284303], length 0
21:03:01.617314 IP 112.26.1.1.44903 > 112.26.1.8.37183: Flags [.], seq 77113:78541, ack 1, win 4017, options [nop,nop,TS val 273187 ecr 48986,mptcp dss ack 2872732397 seq 408284303 subseq 77113 len 1428 csum 0x9f27], length 1428
21:03:01.656154 IP 112.26.1.8.37183 > 112.26.1.1.44903: Flags [.], ack 77113, win 19665, options [nop,nop,TS val 49970 ecr 270718,nop,nop,sack 2 {87109:95677}{79969:84253},mptcp dss ack 408284303], length 0
21:03:01.727582 IP 112.26.1.1.44903 > 112.26.1.8.37183: Flags [.], seq 78541:79969, ack 1, win 4017, options [nop,nop,TS val 273187 ecr 48986,mptcp dss ack 2872732397 seq 408290015 subseq 78541 len 1428 csum 0xda4c], length 1428
21:03:01.755176 IP 112.26.1.8.37183 > 112.26.1.1.44903: Flags [.], ack 77113, win 19847, options [nop,nop,TS val 50068 ecr 270718,nop,nop,sack 2 {87109:97105}{79969:84253},mptcp dss ack 408284303], length 0
21:03:01.861677 IP 112.26.1.8.37183 > 112.26.1.1.44903: Flags [.], ack 77113, win 19893, options [nop,nop,TS val 50123 ecr 270718,nop,nop,sack 2 {87109:98533}{79969:84253},mptcp dss ack 408284303], length 0
21:03:01.905641 IP 112.26.1.1.44903 > 112.26.1.8.37183: Flags [.], seq 84253:85681, ack 1, win 4017, options [nop,nop,TS val 273602 ecr 49411,mptcp dss ack 2872732397 seq 408312863 subseq 84253 len 1428 csum 0x67b8], length 1428
21:03:01.954008 IP 112.26.1.8.37183 > 112.26.1.1.44903: Flags [.], ack 77113, win 20075, options [nop,nop,TS val 50258 ecr 270718,nop,nop,sack 2 {87109:99961}{79969:84253},mptcp dss ack 408284303], length 0
21:03:02.091993 IP 112.26.1.8.37183 > 112.26.1.1.44903: Flags [.], ack 77113, win 20349, options [nop,nop,TS val 50406 ecr 270718,nop,nop,sack 2 {87109:101389}{79969:84253},mptcp dss ack 408284303], length 0
21:03:02.204788 IP 112.26.1.1.44903 > 112.26.1.8.37183: Flags [.], seq 85681:87109, ack 1, win 4017, options [nop,nop,TS val 273875 ecr 49609,mptcp dss ack 2872732397 seq 408320003 subseq 85681 len 1428 csum 0xf1e], length 1428
21:03:02.385791 IP 112.26.1.8.37183 > 112.26.1.1.44903: Flags [.], ack 78541, win 20669, options [nop,nop,TS val 50699 ecr 273187,nop,nop,sack 2 {87109:101389}{79969:84253},mptcp dss ack 408290015], length 0
21:03:02.403718 IP 112.26.1.1.44903 > 112.26.1.8.37183: Flags [.], seq 101389:102817, ack 1, win 4017, options [nop,nop,TS val 274098 ecr 49850,mptcp dss ack 2872732397 seq 408397115 subseq 101389 len 1428 csum 0x5915], length 1428
21:03:02.523609 IP 112.26.1.1.44903 > 112.26.1.8.37183: Flags [.], seq 102817:104245, ack 1, win 4017, options [nop,nop,TS val 274098 ecr 49850,mptcp dss ack 2872732397 seq 408398543 subseq 102817 len 1428 csum 0x9a5a], length 1428
21:03:02.609699 IP 112.26.1.8.37183 > 112.26.1.1.44903: Flags [.], ack 84253, win 20942, options [nop,nop,TS val 50923 ecr 273187,nop,nop,sack 1 {87109:101389},mptcp dss ack 408312863], length 0
21:03:02.632368 IP 112.26.1.1.44903 > 112.26.1.8.37183: Flags [.], seq 104245:105673, ack 1, win 4017, options [nop,nop,TS val 274250 ecr 49970,mptcp dss ack 2872732397 seq 408408539 subseq 104245 len 1428 csum 0xe8a1], length 1428
21:03:02.750661 IP 112.26.1.1.44903 > 112.26.1.8.37183: Flags [.], seq 105673:107101, ack 1, win 4017, options [nop,nop,TS val 274422 ecr 50123,mptcp dss ack 2872732397 seq 408412823 subseq 105673 len 1428 csum 0x78c8], length 1428
21:03:02.776472 IP 112.26.1.8.37183 > 112.26.1.1.44903: Flags [.], ack 85681, win 21079, options [nop,nop,TS val 51080 ecr 273602,nop,nop,sack 1 {87109:101389},mptcp dss ack 408320003], length 0
21:03:02.874266 IP 112.26.1.1.44903 > 112.26.1.8.37183: Flags [.], seq 107101:108529, ack 1, win 4017, options [nop,nop,TS val 274422 ecr 50123,mptcp dss ack 2872732397 seq 408414251 subseq 107101 len 1428 csum 0xdc79], length 1428
21:03:02.974509 IP 112.26.1.1.44903 > 112.26.1.8.37183: Flags [.], seq 108529:109957, ack 1, win 4017, options [nop,nop,TS val 274659 ecr 50406,mptcp dss ack 2872732397 seq 408428531 subseq 108529 len 1428 csum 0x659d], length 1428
21:03:03.012386 IP 112.26.1.8.37183 > 112.26.1.1.44903: Flags [.], ack 101389, win 21353, options [nop,nop,TS val 51326 ecr 273875,mptcp dss ack 408395687], length 0
21:03:03.087224 IP 112.26.1.1.44903 > 112.26.1.8.37183: Flags [.], seq 109957:111385, ack 1, win 4017, options [nop,nop,TS val 274659 ecr 50406,mptcp dss ack 2872732397 seq 408429959 subseq 109957 len 1428 csum 0xe3ef], length 1428
21:03:03.209980 IP 112.26.1.1.44903 > 112.26.1.8.37183: Flags [.], seq 111385:112813, ack 1, win 4017, options [nop,nop,TS val 274847 ecr 50699,mptcp dss ack 2872732397 seq 408442811 subseq 111385 len 1428 csum 0x13d7], length 1428
21:03:03.227996 IP 112.26.1.8.37183 > 112.26.1.1.44903: Flags [.], ack 102817, win 21672, options [nop,nop,TS val 51533 ecr 274098,mptcp dss ack 408398543], length 0
21:03:03.297787 IP 112.26.1.8.37183 > 112.26.1.1.44903: Flags [.], ack 104245, win 21809, options [nop,nop,TS val 51611 ecr 274098,mptcp dss ack 408408539], length 0
21:03:03.393431 IP 112.26.1.1.44903 > 112.26.1.8.37183: Flags [.], seq 112813:114241, ack 1, win 4017, options [nop,nop,TS val 275090 ecr 50923,mptcp dss ack 2872732397 seq 408452807 subseq 112813 len 1428 csum 0x5c1d], length 1428
21:03:03.470892 IP 112.26.1.8.37183 > 112.26.1.1.44903: Flags [.], ack 105673, win 21992, options [nop,nop,TS val 51785 ecr 274250,mptcp dss ack 408412823], length 0
21:03:03.569375 IP 112.26.1.8.37183 > 112.26.1.1.44903: Flags [.], ack 107101, win 22174, options [nop,nop,TS val 51879 ecr 274422,mptcp dss ack 408414251], length 0
21:03:03.627628 IP 112.26.1.1.44903 > 112.26.1.8.37183: Flags [.], seq 114241:115669, ack 1, win 4017, options [nop,nop,TS val 275322 ecr 51080,mptcp dss ack 2872732397 seq 408461375 subseq 114241 len 1428 csum 0x3cc7], length 1428
21:03:03.694158 IP 112.26.1.8.37183 > 112.26.1.1.44903: Flags [.], ack 108529, win 22357, options [nop,nop,TS val 52008 ecr 274422,mptcp dss ack 408424247], length 0
21:03:03.773263 IP 112.26.1.8.37183 > 112.26.1.1.44903: Flags [.], ack 109957, win 22448, options [nop,nop,TS val 52087 ecr 274659,mptcp dss ack 408424247], length 0
21:03:03.856043 IP 112.26.1.1.44903 > 112.26.1.8.37183: Flags [.], seq 115669:117097, ack 1, win 4017, options [nop,nop,TS val 275552 ecr 51326,mptcp dss ack 2872732397 seq 408472799 subseq 115669 len 1428 csum 0xec4b], length 1428
21:03:03.975481 IP 112.26.1.8.37183 > 112.26.1.1.44903: Flags [.], ack 109957, win 22722, options [nop,nop,TS val 52290 ecr 274659,nop,nop,sack 1 {111385:112813},mptcp dss ack 408427103], length 0
21:03:04.053258 IP 112.26.1.1.44903 > 112.26.1.8.37183: Flags [.], seq 117097:118525, ack 1, win 4017, options [nop,nop,TS val 275749 ecr 51533,mptcp dss ack 2872732397 seq 408482795 subseq 117097 len 1428 csum 0xe09c], length 1428
21:03:04.188853 IP 112.26.1.8.37183 > 112.26.1.1.44903: Flags [.], ack 109957, win 22995, options [nop,nop,TS val 52502 ecr 274659,nop,nop,sack 1 {111385:114241},mptcp dss ack 408429959], length 0
21:03:04.241073 IP 112.26.1.1.44903 > 112.26.1.8.37183: Flags [.], seq 118525:119953, ack 1, win 4017, options [nop,nop,TS val 275846 ecr 51611,mptcp dss ack 2872732397 seq 408485651 subseq 118525 len 1428 csum 0x7e0f], length 1428
21:03:04.332768 IP 112.26.1.1.44903 > 112.26.1.8.37183: Flags [.], seq 119953:121381, ack 1, win 4017, options [nop,nop,TS val 275846 ecr 51611,mptcp dss ack 2872732397 seq 408487079 subseq 119953 len 1428 csum 0x8d4d], length 1428
21:03:04.438902 IP 112.26.1.1.44903 > 112.26.1.8.37183: Flags [.], seq 121381:122809, ack 1, win 4017, options [nop,nop,TS val 276006 ecr 51785,mptcp dss ack 2872732397 seq 408499931 subseq 121381 len 1428 csum 0xf70a], length 1428
21:03:04.464442 IP 112.26.1.8.37183 > 112.26.1.1.44903: Flags [.], ack 109957, win 23315, options [nop,nop,TS val 52779 ecr 274659,nop,nop,sack 1 {111385:115669},mptcp dss ack 408429959], length 0
21:03:04.559814 IP 112.26.1.1.44903 > 112.26.1.8.37183: Flags [.], seq 122809:124237, ack 1, win 4017, options [nop,nop,TS val 276183 ecr 51879,mptcp dss ack 2872732397 seq 408507071 subseq 122809 len 1428 csum 0xb57f], length 1428
21:03:04.707254 IP 112.26.1.1.44903 > 112.26.1.8.37183: Flags [.], seq 124237:125665, ack 1, win 4017, options [nop,nop,TS val 276309 ecr 52008,mptcp dss ack 2872732397 seq 408512783 subseq 124237 len 1428 csum 0x606f], length 1428
21:03:04.755888 IP 112.26.1.8.37183 > 112.26.1.1.44903: Flags [.], ack 109957, win 23634, options [nop,nop,TS val 53070 ecr 274659,nop,nop,sack 1 {111385:117097},mptcp dss ack 408429959], length 0
21:03:04.801557 IP 112.26.1.1.44903 > 112.26.1.8.37183: Flags [.], seq 125665:127093, ack 1, win 4017, options [nop,nop,TS val 276381 ecr 52087,mptcp dss ack 2872732397 seq 408518495 subseq 125665 len 1428 csum 0x797f], length 1428
21:03:04.894466 IP 112.26.1.1.44903 > 112.26.1.8.37183: Flags [.], seq 127093:128521, ack 1, win 4017, options [nop,nop,TS val 276590 ecr 52290,mptcp dss ack 2872732397 seq 408528491 subseq 127093 len 1428 csum 0x10af], length 1428
21:03:05.002550 IP 112.26.1.1.44903 > 112.26.1.8.37183: Flags [.], seq 128521:129949, ack 1, win 4017, options [nop,nop,TS val 276697 ecr 52502,mptcp dss ack 2872732397 seq 408532775 subseq 128521 len 1428 csum 0x6fc5], length 1428
