21:02:44.242839 IP 112.26.0.8.35796 > 112.26.0.1.44903: Flags [S], seq 865167143, win 65535, options [mss 1460,sackOK,TS val 32482 ecr 0,nop,wscale 6,mptcp capable csum {0x7c4ae10343fb2426}], length 0
21:02:44.258210 IP 112.26.0.8.35796 > 112.26.0.1.44903: Flags [S], seq 865167143, win 65535, options [mss 1460,sackOK,TS val 32482 ecr 0,nop,wscale 6,mptcp capable csum {0x7c4ae10343fb2426}], length 0
21:02:44.270597 IP 112.26.0.8.35796 > 112.26.0.1.44903: Flags [S], seq 865167143, win 65535, options [mss 1460,sackOK,TS val 32482 ecr 0,nop,wscale 6,mptcp capable csum {0x7c4ae10343fb2426}], length 0
21:02:44.455081 IP 112.26.0.1.44903 > 112.26.0.8.35796: Flags [S.], seq 2603015332, ack 865167144, win 65535, options [mss 1460,sackOK,TS val 255980 ecr 32482,nop,wscale 6,mptcp capable csum {0xff8bba28b9593c43}], length 0
21:02:44.493878 IP 112.26.0.8.35796 > 112.26.0.1.44903: Flags [.], ack 1, win 1369, options [nop,nop,TS val 32776 ecr 255980,mptcp capable csum {0x7c4ae10343fb2426,0xff8bba28b9593c43},mptcp dss ack 407874655], length 0
21:02:44.551334 IP 112.26.0.8.35796 > 112.26.0.1.44903: Flags [.], ack 1, win 1369, options [nop,nop,TS val 32776 ecr 255980,mptcp add-addr id 3 112.26.1.8,mptcp dss ack 407874655], length 0
21:02:44.559250 IP 112.26.0.8.35796 > 112.26.0.1.44903: Flags [.], ack 1, win 1369, options [nop,nop,TS val 32776 ecr 255980,mptcp capable csum {0x7c4ae10343fb2426,0xff8bba28b9593c43},mptcp dss ack 407874655], length 0
21:02:44.562531 IP 112.26.0.8.35796 > 112.26.0.1.44903: Flags [.], ack 1, win 1369, options [nop,nop,TS val 32776 ecr 255980,mptcp capable csum {0x7c4ae10343fb2426,0xff8bba28b9593c43},mptcp dss ack 407874655], length 0
21:02:44.581462 IP 112.26.0.8.35796 > 112.26.0.1.44903: Flags [.], ack 1, win 1369, options [nop,nop,TS val 32777 ecr 255980,mptcp add-addr id 4 112.26.2.8,mptcp dss ack 407874655], length 0
21:02:44.591771 IP 112.26.0.8.35796 > 112.26.0.1.44903: Flags [.], ack 1, win 1369, options [nop,nop,TS val 32777 ecr 255980,mptcp add-addr id 6 112.26.3.8,mptcp dss ack 407874655], length 0
21:02:44.594803 IP 112.26.0.8.35796 > 112.26.0.1.44903: Flags [.], ack 1, win 1369, options [nop,nop,TS val 32776 ecr 255980,mptcp add-addr id 3 112.26.1.8,mptcp dss ack 407874655], length 0
21:02:44.596470 IP 112.26.0.8.35796 > 112.26.0.1.44903: Flags [.], ack 1, win 1369, options [nop,nop,TS val 32776 ecr 255980,mptcp add-addr id 3 112.26.1.8,mptcp dss ack 407874655], length 0
21:02:44.668273 IP 112.26.0.8.35796 > 112.26.0.1.44903: Flags [.], ack 1, win 1369, options [nop,nop,TS val 32777 ecr 255980,mptcp add-addr id 4 112.26.2.8,mptcp dss ack 407874655], length 0
21:02:44.669911 IP 112.26.0.8.35796 > 112.26.0.1.44903: Flags [.], ack 1, win 1369, options [nop,nop,TS val 32777 ecr 255980,mptcp add-addr id 4 112.26.2.8,mptcp dss ack 407874655], length 0
21:02:44.746592 IP 112.26.0.8.35796 > 112.26.0.1.44903: Flags [.], ack 1, win 1369, options [nop,nop,TS val 32777 ecr 255980,mptcp add-addr id 6 112.26.3.8,mptcp dss ack 407874655], length 0
21:02:44.748781 IP 112.26.0.8.35796 > 112.26.0.1.44903: Flags [.], ack 1, win 1369, options [nop,nop,TS val 32777 ecr 255980,mptcp add-addr id 6 112.26.3.8,mptcp dss ack 407874655], length 0
21:02:45.771370 IP 112.26.0.1.44903 > 112.26.0.8.35796: Flags [.], ack 1, win 1339, options [nop,nop,TS val 256270 ecr 32776,mptcp add-addr id 4 112.26.2.1,mptcp dss ack 2872732397], length 0
21:02:45.778170 IP 112.26.0.1.44903 > 112.26.0.8.35796: Flags [.], ack 1, win 1339, options [nop,nop,TS val 256270 ecr 32776,mptcp add-addr id 4 112.26.2.1,mptcp dss ack 2872732397], length 0
21:02:45.850660 IP 112.26.0.1.44903 > 112.26.0.8.35796: Flags [.], ack 1, win 1339, options [nop,nop,TS val 256270 ecr 32776,mptcp add-addr id 5 112.26.3.1,mptcp dss ack 2872732397], length 0
21:02:45.859155 IP 112.26.0.1.44903 > 112.26.0.8.35796: Flags [.], ack 1, win 1339, options [nop,nop,TS val 256270 ecr 32776,mptcp add-addr id 5 112.26.3.1,mptcp dss ack 2872732397], length 0
21:02:45.869918 IP 112.26.0.1.44903 > 112.26.0.8.35796: Flags [.], ack 1, win 1339, options [nop,nop,TS val 256270 ecr 32776,mptcp add-addr id 6 112.26.1.1,mptcp dss ack 2872732397], length 0
21:02:45.877203 IP 112.26.0.1.44903 > 112.26.0.8.35796: Flags [.], ack 1, win 1339, options [nop,nop,TS val 256270 ecr 32776,mptcp add-addr id 6 112.26.1.1,mptcp dss ack 2872732397], length 0
21:02:45.967544 IP 112.26.0.1.44903 > 112.26.0.8.35796: Flags [.], seq 1:1429, ack 1, win 1339, options [nop,nop,TS val 256280 ecr 32776,mptcp dss ack 2872732397 seq 407874655 subseq 1 len 1428 csum 0x7033], length 1428
21:02:45.969850 IP 112.26.0.1.44903 > 112.26.0.8.35796: Flags [.], seq 1:1429, ack 1, win 1339, options [nop,nop,TS val 256280 ecr 32776,mptcp dss ack 2872732397 seq 407874655 subseq 1 len 1428 csum 0x7033], length 1428
21:02:45.974154 IP 112.26.0.8.35796 > 112.26.0.1.44903: Flags [.], ack 1429, win 1415, options [nop,nop,TS val 34286 ecr 256280,mptcp dss ack 407876083], length 0
21:02:45.975923 IP 112.26.0.8.35796 > 112.26.0.1.44903: Flags [.], ack 1429, win 1415, options [nop,nop,TS val 34286 ecr 256280,mptcp dss ack 407876083], length 0
21:02:46.054156 IP 112.26.0.1.44903 > 112.26.0.8.35796: Flags [.], seq 1429:2857, ack 1, win 1339, options [nop,nop,TS val 256280 ecr 32776,mptcp dss ack 2872732397 seq 407876083 subseq 1429 len 1428 csum 0x8f81], length 1428
21:02:46.058846 IP 112.26.0.1.44903 > 112.26.0.8.35796: Flags [.], seq 1429:2857, ack 1, win 1339, options [nop,nop,TS val 256280 ecr 32776,mptcp dss ack 2872732397 seq 407876083 subseq 1429 len 1428 csum 0x8f81], length 1428
21:02:46.062845 IP 112.26.0.8.35796 > 112.26.0.1.44903: Flags [.], ack 2857, win 1460, options [nop,nop,TS val 34372 ecr 256280,mptcp dss ack 407877511], length 0
21:02:46.083972 IP 112.26.0.8.35796 > 112.26.0.1.44903: Flags [.], ack 2857, win 1460, options [nop,nop,TS val 34372 ecr 256280,mptcp dss ack 407877511], length 0
21:02:46.156341 IP 112.26.0.1.44903 > 112.26.0.8.35796: Flags [.], seq 1:1429, ack 1, win 1339, options [nop,nop,TS val 257458 ecr 32777,mptcp dss ack 2872732397 seq 407874655 subseq 1 len 1428 csum 0x7033], length 1428
21:02:46.158400 IP 112.26.0.1.44903 > 112.26.0.8.35796: Flags [.], seq 1:1429, ack 1, win 1339, options [nop,nop,TS val 257458 ecr 32777,mptcp dss ack 2872732397 seq 407874655 subseq 1 len 1428 csum 0x7033], length 1428
21:02:46.160898 IP 112.26.0.8.35796 > 112.26.0.1.44903: Flags [.], ack 2857, win 1460, options [nop,nop,TS val 34474 ecr 256280,nop,nop,sack 1 {1:1429},mptcp dss ack 407877511], length 0
21:02:46.183013 IP 112.26.0.8.35796 > 112.26.0.1.44903: Flags [.], ack 2857, win 1460, options [nop,nop,TS val 34474 ecr 256280,nop,nop,sack 1 {1:1429},mptcp dss ack 407877511], length 0
21:02:46.254084 IP 112.26.0.1.44903 > 112.26.0.8.35796: Flags [P.], seq 2857:4097, ack 1, win 1339, options [nop,nop,TS val 257684 ecr 34286,mptcp dss ack 2872732397 seq 407877511 subseq 2857 len 1240 csum 0xd053], length 1240
21:02:46.265757 IP 112.26.0.1.44903 > 112.26.0.8.35796: Flags [P.], seq 2857:4097, ack 1, win 1339, options [nop,nop,TS val 257684 ecr 34286,mptcp dss ack 2872732397 seq 407877511 subseq 2857 len 1240 csum 0xd053], length 1240
21:02:46.267433 IP 112.26.0.8.35796 > 112.26.0.1.44903: Flags [.], ack 4097, win 1506, options [nop,nop,TS val 34582 ecr 257684,mptcp dss ack 407878751], length 0
21:02:46.291250 IP 112.26.0.1.44903 > 112.26.0.8.35796: Flags [.], seq 4097:5525, ack 1, win 1339, options [nop,nop,TS val 257684 ecr 34286,mptcp dss ack 2872732397 seq 407876083 subseq 4097 len 1428 csum 0x8515], length 1428
21:02:46.293375 IP 112.26.0.1.44903 > 112.26.0.8.35796: Flags [.], seq 4097:5525, ack 1, win 1339, options [nop,nop,TS val 257684 ecr 34286,mptcp dss ack 2872732397 seq 407876083 subseq 4097 len 1428 csum 0x8515], length 1428
21:02:46.300364 IP 112.26.0.8.35796 > 112.26.0.1.44903: Flags [.], ack 5525, win 1552, options [nop,nop,TS val 34609 ecr 257684,mptcp dss ack 407878751], length 0
21:02:46.360038 IP 112.26.0.8.35796 > 112.26.0.1.44903: Flags [.], ack 4097, win 1506, options [nop,nop,TS val 34582 ecr 257684,mptcp dss ack 407878751], length 0
21:02:46.369272 IP 112.26.0.1.44903 > 112.26.0.8.35796: Flags [P.], seq 5525:6765, ack 1, win 1339, options [nop,nop,TS val 257684 ecr 34286,mptcp dss ack 2872732397 seq 407877511 subseq 5525 len 1240 csum 0xc5e7], length 1240
21:02:46.375362 IP 112.26.0.1.44903 > 112.26.0.8.35796: Flags [P.], seq 5525:6765, ack 1, win 1339, options [nop,nop,TS val 257684 ecr 34286,mptcp dss ack 2872732397 seq 407877511 subseq 5525 len 1240 csum 0xc5e7], length 1240
21:02:46.377467 IP 112.26.0.8.35796 > 112.26.0.1.44903: Flags [.], ack 6765, win 1597, options [nop,nop,TS val 34691 ecr 257684,mptcp dss ack 407878751], length 0
21:02:46.399092 IP 112.26.0.8.35796 > 112.26.0.1.44903: Flags [.], ack 5525, win 1552, options [nop,nop,TS val 34609 ecr 257684,mptcp dss ack 407878751], length 0
21:02:46.471136 IP 112.26.0.8.35796 > 112.26.0.1.44903: Flags [.], ack 6765, win 1597, options [nop,nop,TS val 34691 ecr 257684,mptcp dss ack 407878751], length 0
21:02:46.482043 IP 112.26.0.1.44903 > 112.26.0.8.35796: Flags [.], seq 6765:8193, ack 1, win 1339, options [nop,nop,TS val 257684 ecr 34286,mptcp dss ack 2872732397 seq 407878751 subseq 6765 len 1428 csum 0xba20], length 1428
21:02:46.484407 IP 112.26.0.1.44903 > 112.26.0.8.35796: Flags [.], seq 6765:8193, ack 1, win 1339, options [nop,nop,TS val 257684 ecr 34286,mptcp dss ack 2872732397 seq 407878751 subseq 6765 len 1428 csum 0xba20], length 1428
21:02:46.486920 IP 112.26.0.8.35796 > 112.26.0.1.44903: Flags [.], ack 8193, win 1643, options [nop,nop,TS val 34800 ecr 257684,mptcp dss ack 407880179], length 0
21:02:46.496789 IP 112.26.0.8.35796 > 112.26.0.1.44903: Flags [.], ack 8193, win 1643, options [nop,nop,TS val 34800 ecr 257684,mptcp dss ack 407880179], length 0
21:02:46.569385 IP 112.26.0.1.44903 > 112.26.0.8.35796: Flags [.], seq 8193:9621, ack 1, win 1339, options [nop,nop,TS val 257684 ecr 34286,mptcp dss ack 2872732397 seq 407880179 subseq 8193 len 1428 csum 0x1696], length 1428
21:02:46.574137 IP 112.26.0.8.35796 > 112.26.0.1.44903: Flags [.], ack 9621, win 1689, options [nop,nop,TS val 34887 ecr 257684,mptcp dss ack 407881607], length 0
21:02:46.580714 IP 112.26.0.8.35796 > 112.26.0.1.44903: Flags [.], ack 9621, win 1689, options [nop,nop,TS val 34887 ecr 257684,mptcp dss ack 407881607], length 0
21:02:46.582541 IP 112.26.0.1.44903 > 112.26.0.8.35796: Flags [.], seq 8193:9621, ack 1, win 1339, options [nop,nop,TS val 257684 ecr 34286,mptcp dss ack 2872732397 seq 407880179 subseq 8193 len 1428 csum 0x1696], length 1428
21:02:46.653257 IP 112.26.0.1.44903 > 112.26.0.8.35796: Flags [.], seq 9621:11049, ack 1, win 1339, options [nop,nop,TS val 257684 ecr 34286,mptcp dss ack 2872732397 seq 407881607 subseq 9621 len 1428 csum 0xb062], length 1428
21:02:46.678946 IP 112.26.0.1.44903 > 112.26.0.8.35796: Flags [.], seq 9621:11049, ack 1, win 1339, options [nop,nop,TS val 257684 ecr 34286,mptcp dss ack 2872732397 seq 407881607 subseq 9621 len 1428 csum 0xb062], length 1428
21:02:46.683595 IP 112.26.0.1.44903 > 112.26.0.8.35796: Flags [.], seq 11049:12477, ack 1, win 1339, options [nop,nop,TS val 257684 ecr 34286,mptcp dss ack 2872732397 seq 407883035 subseq 11049 len 1428 csum 0x7ff4], length 1428
21:02:46.690286 IP 112.26.0.8.35796 > 112.26.0.1.44903: Flags [.], ack 11049, win 1734, options [nop,nop,TS val 34995 ecr 257684,mptcp dss ack 407883035], length 0
21:02:46.753137 IP 112.26.0.1.44903 > 112.26.0.8.35796: Flags [.], seq 11049:12477, ack 1, win 1339, options [nop,nop,TS val 257684 ecr 34286,mptcp dss ack 2872732397 seq 407883035 subseq 11049 len 1428 csum 0x7ff4], length 1428
21:02:46.764538 IP 112.26.0.8.35796 > 112.26.0.1.44903: Flags [.], ack 11049, win 1734, options [nop,nop,TS val 34995 ecr 257684,mptcp dss ack 407883035], length 0
21:02:46.773924 IP 112.26.0.8.35796 > 112.26.0.1.44903: Flags [.], ack 12477, win 1780, options [nop,nop,TS val 35069 ecr 257684,mptcp dss ack 407884463], length 0
21:02:46.789735 IP 112.26.0.1.44903 > 112.26.0.8.35796: Flags [.], seq 12477:13905, ack 1, win 1339, options [nop,nop,TS val 257684 ecr 34286,mptcp dss ack 2872732397 seq 407884463 subseq 12477 len 1428 csum 0x7860], length 1428
21:02:46.803356 IP 112.26.0.8.35796 > 112.26.0.1.44903: Flags [.], ack 12477, win 1780, options [nop,nop,TS val 35069 ecr 257684,mptcp dss ack 407884463], length 0
21:02:46.871374 IP 112.26.0.1.44903 > 112.26.0.8.35796: Flags [.], seq 13905:15333, ack 1, win 1339, options [nop,nop,TS val 257686 ecr 34286,mptcp dss ack 2872732397 seq 407885891 subseq 13905 len 1428 csum 0xa7e6], length 1428
21:02:46.877948 IP 112.26.0.1.44903 > 112.26.0.8.35796: Flags [.], seq 12477:13905, ack 1, win 1339, options [nop,nop,TS val 257684 ecr 34286,mptcp dss ack 2872732397 seq 407884463 subseq 12477 len 1428 csum 0x7860], length 1428
21:02:46.879653 IP 112.26.0.8.35796 > 112.26.0.1.44903: Flags [.], ack 13905, win 1825, options [nop,nop,TS val 35194 ecr 257684,mptcp dss ack 407885891], length 0
21:02:46.891330 IP 112.26.0.8.35796 > 112.26.0.1.44903: Flags [.], ack 13905, win 1825, options [nop,nop,TS val 35194 ecr 257684,mptcp dss ack 407885891], length 0
21:02:46.962971 IP 112.26.0.1.44903 > 112.26.0.8.35796: Flags [.], seq 13905:15333, ack 1, win 1339, options [nop,nop,TS val 257686 ecr 34286,mptcp dss ack 2872732397 seq 407885891 subseq 13905 len 1428 csum 0xa7e6], length 1428
21:02:46.985555 IP 112.26.0.1.44903 > 112.26.0.8.35796: Flags [.], seq 15333:16761, ack 1, win 1339, options [nop,nop,TS val 257789 ecr 34372,mptcp dss ack 2872732397 seq 407887319 subseq 15333 len 1428 csum 0xe9e3], length 1428
21:02:46.995615 IP 112.26.0.8.35796 > 112.26.0.1.44903: Flags [.], ack 15333, win 1871, options [nop,nop,TS val 35279 ecr 257686,mptcp dss ack 407887319], length 0
21:02:47.006624 IP 112.26.0.1.44903 > 112.26.0.8.35796: Flags [.], seq 15333:16761, ack 1, win 1339, options [nop,nop,TS val 257789 ecr 34372,mptcp dss ack 2872732397 seq 407887319 subseq 15333 len 1428 csum 0xe9e3], length 1428
21:02:47.069810 IP 112.26.0.8.35796 > 112.26.0.1.44903: Flags [.], ack 15333, win 1871, options [nop,nop,TS val 35279 ecr 257686,mptcp dss ack 407887319], length 0
21:02:47.093130 IP 112.26.0.1.44903 > 112.26.0.8.35796: Flags [.], seq 18189:19617, ack 1, win 1339, options [nop,nop,TS val 258067 ecr 34582,mptcp dss ack 2872732397 seq 407890175 subseq 18189 len 1428 csum 0xa7d8], length 1428
21:02:47.104816 IP 112.26.0.8.35796 > 112.26.0.1.44903: Flags [.], ack 16761, win 1917, options [nop,nop,TS val 35322 ecr 257789,mptcp dss ack 407888747], length 0
21:02:47.158910 IP 112.26.0.1.44903 > 112.26.0.8.35796: Flags [.], seq 19617:21045, ack 1, win 1339, options [nop,nop,TS val 258067 ecr 34582,mptcp dss ack 2872732397 seq 407891603 subseq 19617 len 1428 csum 0x912c], length 1428
21:02:47.165297 IP 112.26.0.1.44903 > 112.26.0.8.35796: Flags [.], seq 18189:19617, ack 1, win 1339, options [nop,nop,TS val 258067 ecr 34582,mptcp dss ack 2872732397 seq 407890175 subseq 18189 len 1428 csum 0xa7d8], length 1428
21:02:47.171909 IP 112.26.0.8.35796 > 112.26.0.1.44903: Flags [.], ack 16761, win 1962, options [nop,nop,TS val 35481 ecr 257789,nop,nop,sack 1 {18189:19617},mptcp dss ack 407888747], length 0
21:02:47.202276 IP 112.26.0.1.44903 > 112.26.0.8.35796: Flags [.], seq 21045:22473, ack 1, win 1339, options [nop,nop,TS val 258105 ecr 34609,mptcp dss ack 2872732397 seq 407893031 subseq 21045 len 1428 csum 0x9a78], length 1428
21:02:47.208417 IP 112.26.0.1.44903 > 112.26.0.8.35796: Flags [.], seq 19617:21045, ack 1, win 1339, options [nop,nop,TS val 258067 ecr 34582,mptcp dss ack 2872732397 seq 407891603 subseq 19617 len 1428 csum 0x912c], length 1428
21:02:47.260254 IP 112.26.0.8.35796 > 112.26.0.1.44903: Flags [.], ack 16761, win 2008, options [nop,nop,TS val 35524 ecr 257789,nop,nop,sack 1 {18189:21045},mptcp dss ack 407888747], length 0
21:02:47.276860 IP 112.26.0.8.35796 > 112.26.0.1.44903: Flags [.], ack 16761, win 1917, options [nop,nop,TS val 35322 ecr 257789,mptcp dss ack 407888747], length 0
21:02:47.280144 IP 112.26.0.1.44903 > 112.26.0.8.35796: Flags [.], seq 21045:22473, ack 1, win 1339, options [nop,nop,TS val 258105 ecr 34609,mptcp dss ack 2872732397 seq 407893031 subseq 21045 len 1428 csum 0x9a78], length 1428
21:02:47.286388 IP 112.26.0.8.35796 > 112.26.0.1.44903: Flags [.], ack 16761, win 2054, options [nop,nop,TS val 35596 ecr 257789,nop,nop,sack 1 {18189:22473},mptcp dss ack 407888747], length 0
21:02:47.294775 IP 112.26.0.1.44903 > 112.26.0.8.35796: Flags [.], seq 23901:25329, ack 1, win 1339, options [nop,nop,TS val 258179 ecr 34691,mptcp dss ack 2872732397 seq 407895887 subseq 23901 len 1428 csum 0xa31a], length 1428
21:02:47.358335 IP 112.26.0.8.35796 > 112.26.0.1.44903: Flags [.], ack 16761, win 1962, options [nop,nop,TS val 35481 ecr 257789,nop,nop,sack 1 {18189:19617},mptcp dss ack 407888747], length 0
21:02:47.364837 IP 112.26.0.1.44903 > 112.26.0.8.35796: Flags [.], seq 25329:26757, ack 1, win 1339, options [nop,nop,TS val 258179 ecr 34691,mptcp dss ack 2872732397 seq 407897315 subseq 25329 len 1428 csum 0xffb4], length 1428
21:02:47.377043 IP 112.26.0.1.44903 > 112.26.0.8.35796: Flags [.], seq 23901:25329, ack 1, win 1339, options [nop,nop,TS val 258179 ecr 34691,mptcp dss ack 2872732397 seq 407895887 subseq 23901 len 1428 csum 0xa31a], length 1428
21:02:47.379814 IP 112.26.0.8.35796 > 112.26.0.1.44903: Flags [.], ack 16761, win 2099, options [nop,nop,TS val 35693 ecr 257789,nop,nop,sack 2 {23901:25329}{18189:22473},mptcp dss ack 407888747], length 0
21:02:47.396207 IP 112.26.0.8.35796 > 112.26.0.1.44903: Flags [.], ack 16761, win 2008, options [nop,nop,TS val 35524 ecr 257789,nop,nop,sack 1 {18189:21045},mptcp dss ack 407888747], length 0
21:02:47.399166 IP 112.26.0.1.44903 > 112.26.0.8.35796: Flags [.], seq 26757:28185, ack 1, win 1339, options [nop,nop,TS val 258205 ecr 34800,mptcp dss ack 2872732397 seq 407898743 subseq 26757 len 1428 csum 0x9783], length 1428
21:02:47.463316 IP 112.26.0.1.44903 > 112.26.0.8.35796: Flags [.], seq 25329:26757, ack 1, win 1339, options [nop,nop,TS val 258179 ecr 34691,mptcp dss ack 2872732397 seq 407897315 subseq 25329 len 1428 csum 0xffb4], length 1428
21:02:47.464965 IP 112.26.0.8.35796 > 112.26.0.1.44903: Flags [.], ack 16761, win 2145, options [nop,nop,TS val 35779 ecr 257789,nop,nop,sack 2 {23901:26757}{18189:22473},mptcp dss ack 407888747], length 0
21:02:47.481009 IP 112.26.0.8.35796 > 112.26.0.1.44903: Flags [.], ack 16761, win 2054, options [nop,nop,TS val 35596 ecr 257789,nop,nop,sack 1 {18189:22473},mptcp dss ack 407888747], length 0
21:02:47.486679 IP 112.26.0.1.44903 > 112.26.0.8.35796: Flags [.], seq 26757:28185, ack 1, win 1339, options [nop,nop,TS val 258205 ecr 34800,mptcp dss ack 2872732397 seq 407898743 subseq 26757 len 1428 csum 0x9783], length 1428
21:02:47.501875 IP 112.26.0.8.35796 > 112.26.0.1.44903: Flags [.], ack 16761, win 2190, options [nop,nop,TS val 35802 ecr 257789,nop,nop,sack 2 {23901:28185}{18189:22473},mptcp dss ack 407888747], length 0
21:02:47.506340 IP 112.26.0.1.44903 > 112.26.0.8.35796: Flags [.], seq 28185:29613, ack 1, win 1339, options [nop,nop,TS val 258205 ecr 34800,mptcp dss ack 2872732397 seq 407900171 subseq 28185 len 1428 csum 0xb181], length 1428
21:02:47.511463 IP 112.26.0.1.44903 > 112.26.0.8.35796: Flags [.], seq 28185:29613, ack 1, win 1339, options [nop,nop,TS val 258205 ecr 34800,mptcp dss ack 2872732397 seq 407900171 subseq 28185 len 1428 csum 0xb181], length 1428
21:02:47.563409 IP 112.26.0.8.35796 > 112.26.0.1.44903: Flags [.], ack 16761, win 2236, options [nop,nop,TS val 35827 ecr 257789,nop,nop,sack 2 {23901:29613}{18189:22473},mptcp dss ack 407888747], length 0
21:02:47.577951 IP 112.26.0.8.35796 > 112.26.0.1.44903: Flags [.], ack 16761, win 2099, options [nop,nop,TS val 35693 ecr 257789,nop,nop,sack 2 {23901:25329}{18189:22473},mptcp dss ack 407888747], length 0
21:02:47.600364 IP 112.26.0.1.44903 > 112.26.0.8.35796: Flags [.], seq 32469:33897, ack 1, win 1339, options [nop,nop,TS val 258472 ecr 34995,mptcp dss ack 2872732397 seq 407904455 subseq 32469 len 1428 csum 0x697c], length 1428
21:02:47.606692 IP 112.26.0.1.44903 > 112.26.0.8.35796: Flags [.], seq 32469:33897, ack 1, win 1339, options [nop,nop,TS val 258472 ecr 34995,mptcp dss ack 2872732397 seq 407904455 subseq 32469 len 1428 csum 0x697c], length 1428
21:02:47.610652 IP 112.26.0.8.35796 > 112.26.0.1.44903: Flags [.], ack 16761, win 2282, options [nop,nop,TS val 35922 ecr 257789,nop,nop,sack 2 {32469:33897}{23901:29613},mptcp dss ack 407888747], length 0
21:02:47.683718 IP 112.26.0.8.35796 > 112.26.0.1.44903: Flags [.], ack 16761, win 2145, options [nop,nop,TS val 35779 ecr 257789,nop,nop,sack 2 {23901:26757}{18189:22473},mptcp dss ack 407888747], length 0
21:02:47.687798 IP 112.26.0.1.44903 > 112.26.0.8.35796: Flags [.], seq 33897:35325, ack 1, win 1339, options [nop,nop,TS val 258472 ecr 34995,mptcp dss ack 2872732397 seq 407905883 subseq 33897 len 1428 csum 0x5cbc], length 1428
21:02:47.689920 IP 112.26.0.1.44903 > 112.26.0.8.35796: Flags [.], seq 33897:35325, ack 1, win 1339, options [nop,nop,TS val 258472 ecr 34995,mptcp dss ack 2872732397 seq 407905883 subseq 33897 len 1428 csum 0x5cbc], length 1428
21:02:47.691562 IP 112.26.0.8.35796 > 112.26.0.1.44903: Flags [.], ack 16761, win 2327, options [nop,nop,TS val 36006 ecr 257789,nop,nop,sack 2 {32469:35325}{23901:29613},mptcp dss ack 407888747], length 0
21:02:47.776356 IP 112.26.0.8.35796 > 112.26.0.1.44903: Flags [.], ack 16761, win 2190, options [nop,nop,TS val 35802 ecr 257789,nop,nop,sack 2 {23901:28185}{18189:22473},mptcp dss ack 407888747], length 0
21:02:47.782748 IP 112.26.0.1.44903 > 112.26.0.8.35796: Flags [.], seq 38181:39609, ack 1, win 1339, options [nop,nop,TS val 258599 ecr 35194,mptcp dss ack 2872732397 seq 407910167 subseq 38181 len 1428 csum 0xe5fc], length 1428
21:02:47.784736 IP 112.26.0.1.44903 > 112.26.0.8.35796: Flags [.], seq 38181:39609, ack 1, win 1339, options [nop,nop,TS val 258599 ecr 35194,mptcp dss ack 2872732397 seq 407910167 subseq 38181 len 1428 csum 0xe5fc], length 1428
21:02:47.793094 IP 112.26.0.8.35796 > 112.26.0.1.44903: Flags [.], ack 16761, win 2373, options [nop,nop,TS val 36101 ecr 257789,nop,nop,sack 2 {38181:39609}{32469:35325},mptcp dss ack 407888747], length 0
21:02:47.863944 IP 112.26.0.8.35796 > 112.26.0.1.44903: Flags [.], ack 16761, win 2236, options [nop,nop,TS val 35827 ecr 257789,nop,nop,sack 2 {23901:29613}{18189:22473},mptcp dss ack 407888747], length 0
21:02:47.879545 IP 112.26.0.1.44903 > 112.26.0.8.35796: Flags [.], seq 41037:42465, ack 1, win 1339, options [nop,nop,TS val 258778 ecr 35279,mptcp dss ack 2872732397 seq 407913023 subseq 41037 len 1428 csum 0xc475], length 1428
21:02:47.881461 IP 112.26.0.1.44903 > 112.26.0.8.35796: Flags [.], seq 41037:42465, ack 1, win 1339, options [nop,nop,TS val 258778 ecr 35279,mptcp dss ack 2872732397 seq 407913023 subseq 41037 len 1428 csum 0xc475], length 1428
21:02:47.883082 IP 112.26.0.8.35796 > 112.26.0.1.44903: Flags [.], ack 16761, win 2419, options [nop,nop,TS val 36197 ecr 257789,nop,nop,sack 2 {41037:42465}{38181:39609},mptcp dss ack 407888747], length 0
21:02:47.902531 IP 112.26.0.1.44903 > 112.26.0.8.35796: Flags [.], seq 42465:43893, ack 1, win 1339, options [nop,nop,TS val 258778 ecr 35279,mptcp dss ack 2872732397 seq 407914451 subseq 42465 len 1428 csum 0x90d8], length 1428
21:02:47.906266 IP 112.26.0.8.35796 > 112.26.0.1.44903: Flags [.], ack 16761, win 2282, options [nop,nop,TS val 35922 ecr 257789,nop,nop,sack 2 {32469:33897}{23901:29613},mptcp dss ack 407888747], length 0
21:02:47.960395 IP 112.26.0.1.44903 > 112.26.0.8.35796: Flags [.], seq 42465:43893, ack 1, win 1339, options [nop,nop,TS val 258778 ecr 35279,mptcp dss ack 2872732397 seq 407914451 subseq 42465 len 1428 csum 0x90d8], length 1428
21:02:47.963727 IP 112.26.0.8.35796 > 112.26.0.1.44903: Flags [.], ack 16761, win 2464, options [nop,nop,TS val 36276 ecr 257789,nop,nop,sack 2 {41037:43893}{38181:39609},mptcp dss ack 407888747], length 0
21:02:47.988904 IP 112.26.0.8.35796 > 112.26.0.1.44903: Flags [.], ack 16761, win 2327, options [nop,nop,TS val 36006 ecr 257789,nop,nop,sack 2 {32469:35325}{23901:29613},mptcp dss ack 407888747], length 0
21:02:47.989592 IP 112.26.0.1.44903 > 112.26.0.8.35796: Flags [.], seq 43893:45321, ack 1, win 1339, options [nop,nop,TS val 258985 ecr 35322,mptcp dss ack 2872732397 seq 407915879 subseq 43893 len 1428 csum 0x8a11], length 1428
21:02:47.998172 IP 112.26.0.1.44903 > 112.26.0.8.35796: Flags [.], seq 43893:45321, ack 1, win 1339, options [nop,nop,TS val 258985 ecr 35322,mptcp dss ack 2872732397 seq 407915879 subseq 43893 len 1428 csum 0x8a11], length 1428
21:02:47.999379 IP 112.26.0.8.35796 > 112.26.0.1.44903: Flags [.], ack 16761, win 2510, options [nop,nop,TS val 36314 ecr 257789,nop,nop,sack 2 {41037:45321}{38181:39609},mptcp dss ack 407888747], length 0
21:02:48.008402 IP 112.26.0.1.44903 > 112.26.0.8.35796: Flags [.], seq 45321:46749, ack 1, win 1339, options [nop,nop,TS val 258985 ecr 35322,mptcp dss ack 2872732397 seq 407917307 subseq 45321 len 1428 csum 0xa9af], length 1428
21:02:48.071590 IP 112.26.0.8.35796 > 112.26.0.1.44903: Flags [.], ack 16761, win 2373, options [nop,nop,TS val 36101 ecr 257789,nop,nop,sack 2 {38181:39609}{32469:35325},mptcp dss ack 407888747], length 0
21:02:48.080750 IP 112.26.0.1.44903 > 112.26.0.8.35796: Flags [.], seq 45321:46749, ack 1, win 1339, options [nop,nop,TS val 258985 ecr 35322,mptcp dss ack 2872732397 seq 407917307 subseq 45321 len 1428 csum 0xa9af], length 1428
21:02:48.081991 IP 112.26.0.8.35796 > 112.26.0.1.44903: Flags [.], ack 16761, win 2555, options [nop,nop,TS val 36397 ecr 257789,nop,nop,sack 2 {41037:46749}{38181:39609},mptcp dss ack 407888747], length 0
21:02:48.100757 IP 112.26.0.8.35796 > 112.26.0.1.44903: Flags [.], ack 16761, win 2419, options [nop,nop,TS val 36197 ecr 257789,nop,nop,sack 2 {41037:42465}{38181:39609},mptcp dss ack 407888747], length 0
21:02:48.160847 IP 112.26.0.1.44903 > 112.26.0.8.35796: Flags [.], seq 46749:48177, ack 1, win 1339, options [nop,nop,TS val 259104 ecr 35481,mptcp dss ack 2872732397 seq 407918735 subseq 46749 len 1428 csum 0x9a55], length 1428
21:02:48.164475 IP 112.26.0.1.44903 > 112.26.0.8.35796: Flags [.], seq 46749:48177, ack 1, win 1339, options [nop,nop,TS val 259104 ecr 35481,mptcp dss ack 2872732397 seq 407918735 subseq 46749 len 1428 csum 0x9a55], length 1428
21:02:48.167650 IP 112.26.0.8.35796 > 112.26.0.1.44903: Flags [.], ack 16761, win 2601, options [nop,nop,TS val 36481 ecr 257789,nop,nop,sack 2 {41037:48177}{38181:39609},mptcp dss ack 407888747], length 0
21:02:48.183464 IP 112.26.0.8.35796 > 112.26.0.1.44903: Flags [.], ack 16761, win 2464, options [nop,nop,TS val 36276 ecr 257789,nop,nop,sack 2 {41037:43893}{38181:39609},mptcp dss ack 407888747], length 0
21:02:48.195370 IP 112.26.0.1.44903 > 112.26.0.8.35796: Flags [.], seq 48177:49605, ack 1, win 1339, options [nop,nop,TS val 259189 ecr 35524,mptcp dss ack 2872732397 seq 407920163 subseq 48177 len 1428 csum 0x27fb], length 1428
21:02:48.197318 IP 112.26.0.1.44903 > 112.26.0.8.35796: Flags [.], seq 48177:49605, ack 1, win 1339, options [nop,nop,TS val 259189 ecr 35524,mptcp dss ack 2872732397 seq 407920163 subseq 48177 len 1428 csum 0x27fb], length 1428
21:02:48.198510 IP 112.26.0.8.35796 > 112.26.0.1.44903: Flags [.], ack 16761, win 2647, options [nop,nop,TS val 36513 ecr 257789,nop,nop,sack 2 {41037:49605}{38181:39609},mptcp dss ack 407888747], length 0
21:02:48.274481 IP 112.26.0.1.44903 > 112.26.0.8.35796: Flags [.], seq 16761:18189, ack 1, win 1339, options [nop,nop,TS val 259189 ecr 35596,mptcp dss ack 2872732397 seq 407888747 subseq 16761 len 1428 csum 0x3c7d], length 1428
21:02:48.279681 IP 112.26.0.8.35796 > 112.26.0.1.44903: Flags [.], ack 16761, win 2510, options [nop,nop,TS val 36314 ecr 257789,nop,nop,sack 2 {41037:45321}{38181:39609},mptcp dss ack 407888747], length 0
21:02:48.288124 IP 112.26.0.1.44903 > 112.26.0.8.35796: Flags [.], seq 16761:18189, ack 1, win 1339, options [nop,nop,TS val 259189 ecr 35596,mptcp dss ack 2872732397 seq 407888747 subseq 16761 len 1428 csum 0x3c7d], length 1428
21:02:48.289757 IP 112.26.0.8.35796 > 112.26.0.1.44903: Flags [.], ack 22473, win 2692, options [nop,nop,TS val 36604 ecr 259189,nop,nop,sack 2 {41037:49605}{38181:39609},mptcp dss ack 407894459], length 0
21:02:48.305832 IP 112.26.0.1.44903 > 112.26.0.8.35796: Flags [.], seq 49605:51033, ack 1, win 1339, options [nop,nop,TS val 259571 ecr 35802,mptcp dss ack 2872732397 seq 407921591 subseq 49605 len 1428 csum 0x7694], length 1428
21:02:48.362240 IP 112.26.0.1.44903 > 112.26.0.8.35796: Flags [.], seq 49605:51033, ack 1, win 1339, options [nop,nop,TS val 259571 ecr 35802,mptcp dss ack 2872732397 seq 407921591 subseq 49605 len 1428 csum 0x7694], length 1428
21:02:48.370532 IP 112.26.0.8.35796 > 112.26.0.1.44903: Flags [.], ack 22473, win 2738, options [nop,nop,TS val 36678 ecr 259189,nop,nop,sack 2 {41037:51033}{38181:39609},mptcp dss ack 407894459], length 0
21:02:48.398640 IP 112.26.0.8.35796 > 112.26.0.1.44903: Flags [.], ack 16761, win 2555, options [nop,nop,TS val 36397 ecr 257789,nop,nop,sack 2 {41037:46749}{38181:39609},mptcp dss ack 407888747], length 0
21:02:48.407786 IP 112.26.0.1.44903 > 112.26.0.8.35796: Flags [.], seq 51033:52461, ack 1, win 1339, options [nop,nop,TS val 259614 ecr 35827,mptcp dss ack 2872732397 seq 407923019 subseq 51033 len 1428 csum 0x89b], length 1428
21:02:48.409705 IP 112.26.0.1.44903 > 112.26.0.8.35796: Flags [.], seq 51033:52461, ack 1, win 1339, options [nop,nop,TS val 259614 ecr 35827,mptcp dss ack 2872732397 seq 407923019 subseq 51033 len 1428 csum 0x89b], length 1428
21:02:48.411330 IP 112.26.0.8.35796 > 112.26.0.1.44903: Flags [.], ack 22473, win 2784, options [nop,nop,TS val 36726 ecr 259189,nop,nop,sack 2 {41037:52461}{38181:39609},mptcp dss ack 407894459], length 0
21:02:48.473523 IP 112.26.0.8.35796 > 112.26.0.1.44903: Flags [.], ack 16761, win 2601, options [nop,nop,TS val 36481 ecr 257789,nop,nop,sack 2 {41037:48177}{38181:39609},mptcp dss ack 407888747], length 0
21:02:48.484292 IP 112.26.0.8.35796 > 112.26.0.1.44903: Flags [.], ack 16761, win 2647, options [nop,nop,TS val 36513 ecr 257789,nop,nop,sack 2 {41037:49605}{38181:39609},mptcp dss ack 407888747], length 0
21:02:48.490520 IP 112.26.0.1.44903 > 112.26.0.8.35796: Flags [.], seq 29613:31041, ack 1, win 1339, options [nop,nop,TS val 259780 ecr 36101,mptcp dss ack 2872732397 seq 407901599 subseq 29613 len 1428 csum 0x377e], length 1428
21:02:48.492510 IP 112.26.0.1.44903 > 112.26.0.8.35796: Flags [.], seq 29613:31041, ack 1, win 1339, options [nop,nop,TS val 259780 ecr 36101,mptcp dss ack 2872732397 seq 407901599 subseq 29613 len 1428 csum 0x377e], length 1428
21:02:48.499065 IP 112.26.0.8.35796 > 112.26.0.1.44903: Flags [.], ack 22473, win 2829, options [nop,nop,TS val 36808 ecr 259189,nop,nop,sack 2 {23901:31041}{41037:52461},mptcp dss ack 407894459], length 0
21:02:48.570365 IP 112.26.0.8.35796 > 112.26.0.1.44903: Flags [.], ack 22473, win 2692, options [nop,nop,TS val 36604 ecr 259189,nop,nop,sack 2 {41037:49605}{38181:39609},mptcp dss ack 407894459], length 0
21:02:48.574605 IP 112.26.0.1.44903 > 112.26.0.8.35796: Flags [.], seq 31041:32469, ack 1, win 1339, options [nop,nop,TS val 259809 ecr 36197,mptcp dss ack 2872732397 seq 407903027 subseq 31041 len 1428 csum 0x43db], length 1428
21:02:48.579320 IP 112.26.0.1.44903 > 112.26.0.8.35796: Flags [.], seq 31041:32469, ack 1, win 1339, options [nop,nop,TS val 259809 ecr 36197,mptcp dss ack 2872732397 seq 407903027 subseq 31041 len 1428 csum 0x43db], length 1428
21:02:48.583464 IP 112.26.0.8.35796 > 112.26.0.1.44903: Flags [.], ack 22473, win 2875, options [nop,nop,TS val 36895 ecr 259189,nop,nop,sack 2 {23901:35325}{41037:52461},mptcp dss ack 407894459], length 0
21:02:48.600015 IP 112.26.0.1.44903 > 112.26.0.8.35796: Flags [.], seq 35325:36753, ack 1, win 1339, options [nop,nop,TS val 259892 ecr 36276,mptcp dss ack 2872732397 seq 407907311 subseq 35325 len 1428 csum 0xd866], length 1428
21:02:48.668649 IP 112.26.0.1.44903 > 112.26.0.8.35796: Flags [.], seq 35325:36753, ack 1, win 1339, options [nop,nop,TS val 259892 ecr 36276,mptcp dss ack 2872732397 seq 407907311 subseq 35325 len 1428 csum 0xd866], length 1428
21:02:48.670359 IP 112.26.0.8.35796 > 112.26.0.1.44903: Flags [.], ack 22473, win 2920, options [nop,nop,TS val 36985 ecr 259189,nop,nop,sack 2 {23901:36753}{41037:52461},mptcp dss ack 407894459], length 0
21:02:48.684551 IP 112.26.0.8.35796 > 112.26.0.1.44903: Flags [.], ack 22473, win 2738, options [nop,nop,TS val 36678 ecr 259189,nop,nop,sack 2 {41037:51033}{38181:39609},mptcp dss ack 407894459], length 0
21:02:48.704800 IP 112.26.0.1.44903 > 112.26.0.8.35796: Flags [.], seq 36753:38181, ack 1, win 1339, options [nop,nop,TS val 259988 ecr 36314,mptcp dss ack 2872732397 seq 407908739 subseq 36753 len 1428 csum 0xf957], length 1428
21:02:48.706911 IP 112.26.0.1.44903 > 112.26.0.8.35796: Flags [.], seq 36753:38181, ack 1, win 1339, options [nop,nop,TS val 259988 ecr 36314,mptcp dss ack 2872732397 seq 407908739 subseq 36753 len 1428 csum 0xf957], length 1428
21:02:48.708547 IP 112.26.0.8.35796 > 112.26.0.1.44903: Flags [.], ack 22473, win 2966, options [nop,nop,TS val 37023 ecr 259189,nop,nop,sack 2 {23901:39609}{41037:52461},mptcp dss ack 407894459], length 0
21:02:48.787344 IP 112.26.0.8.35796 > 112.26.0.1.44903: Flags [.], ack 22473, win 2784, options [nop,nop,TS val 36726 ecr 259189,nop,nop,sack 2 {41037:52461}{38181:39609},mptcp dss ack 407894459], length 0
21:02:48.790706 IP 112.26.0.1.44903 > 112.26.0.8.35796: Flags [.], seq 39609:41037, ack 1, win 1339, options [nop,nop,TS val 260107 ecr 36397,mptcp dss ack 2872732397 seq 407911595 subseq 39609 len 1428 csum 0x3e70], length 1428
21:02:48.792400 IP 112.26.0.1.44903 > 112.26.0.8.35796: Flags [.], seq 39609:41037, ack 1, win 1339, options [nop,nop,TS val 260107 ecr 36397,mptcp dss ack 2872732397 seq 407911595 subseq 39609 len 1428 csum 0x3e70], length 1428
21:02:48.799599 IP 112.26.0.8.35796 > 112.26.0.1.44903: Flags [.], ack 22473, win 3012, options [nop,nop,TS val 37108 ecr 259189,nop,nop,sack 1 {23901:52461},mptcp dss ack 407894459], length 0
21:02:48.866634 IP 112.26.0.1.44903 > 112.26.0.8.35796: Flags [.], seq 52461:53889, ack 1, win 1339, options [nop,nop,TS val 260192 ecr 36481,mptcp dss ack 2872732397 seq 407924447 subseq 52461 len 1428 csum 0xc44b], length 1428
21:02:48.875550 IP 112.26.0.1.44903 > 112.26.0.8.35796: Flags [.], seq 52461:53889, ack 1, win 1339, options [nop,nop,TS val 260192 ecr 36481,mptcp dss ack 2872732397 seq 407924447 subseq 52461 len 1428 csum 0xc44b], length 1428
21:02:48.879135 IP 112.26.0.8.35796 > 112.26.0.1.44903: Flags [.], ack 22473, win 3057, options [nop,nop,TS val 37191 ecr 259189,nop,nop,sack 1 {23901:53889},mptcp dss ack 407894459], length 0
21:02:48.901348 IP 112.26.0.8.35796 > 112.26.0.1.44903: Flags [.], ack 22473, win 2829, options [nop,nop,TS val 36808 ecr 259189,nop,nop,sack 2 {23901:31041}{41037:52461},mptcp dss ack 407894459], length 0
21:02:48.971684 IP 112.26.0.8.35796 > 112.26.0.1.44903: Flags [.], ack 22473, win 2875, options [nop,nop,TS val 36895 ecr 259189,nop,nop,sack 2 {23901:35325}{41037:52461},mptcp dss ack 407894459], length 0
21:02:48.974685 IP 112.26.0.1.44903 > 112.26.0.8.35796: Flags [.], seq 53889:55317, ack 1, win 1339, options [nop,nop,TS val 260277 ecr 36513,mptcp dss ack 2872732397 seq 407925875 subseq 53889 len 1428 csum 0x92d0], length 1428
21:02:48.978330 IP 112.26.0.1.44903 > 112.26.0.8.35796: Flags [.], seq 53889:55317, ack 1, win 1339, options [nop,nop,TS val 260277 ecr 36513,mptcp dss ack 2872732397 seq 407925875 subseq 53889 len 1428 csum 0x92d0], length 1428
21:02:48.979791 IP 112.26.0.8.35796 > 112.26.0.1.44903: Flags [.], ack 22473, win 3103, options [nop,nop,TS val 37293 ecr 259189,nop,nop,sack 1 {23901:55317},mptcp dss ack 407894459], length 0
21:02:49.005610 IP 112.26.0.8.35796 > 112.26.0.1.44903: Flags [.], ack 22473, win 2920, options [nop,nop,TS val 36985 ecr 259189,nop,nop,sack 2 {23901:36753}{41037:52461},mptcp dss ack 407894459], length 0
21:02:49.076338 IP 112.26.0.1.44903 > 112.26.0.8.35796: Flags [.], seq 55317:56745, ack 1, win 1339, options [nop,nop,TS val 260277 ecr 36604,mptcp dss ack 2872732397 seq 407927303 subseq 55317 len 1428 csum 0xcf44], length 1428
21:02:49.082364 IP 112.26.0.1.44903 > 112.26.0.8.35796: Flags [.], seq 55317:56745, ack 1, win 1339, options [nop,nop,TS val 260277 ecr 36604,mptcp dss ack 2872732397 seq 407927303 subseq 55317 len 1428 csum 0xcf44], length 1428
21:02:49.096195 IP 112.26.0.8.35796 > 112.26.0.1.44903: Flags [.], ack 22473, win 3149, options [nop,nop,TS val 37394 ecr 259189,nop,nop,sack 1 {23901:56745},mptcp dss ack 407894459], length 0
21:02:49.112552 IP 112.26.0.1.44903 > 112.26.0.8.35796: Flags [.], seq 56745:58173, ack 1, win 1339, options [nop,nop,TS val 260277 ecr 36604,mptcp dss ack 2872732397 seq 407928731 subseq 56745 len 1428 csum 0xcc50], length 1428
21:02:49.114523 IP 112.26.0.1.44903 > 112.26.0.8.35796: Flags [.], seq 56745:58173, ack 1, win 1339, options [nop,nop,TS val 260277 ecr 36604,mptcp dss ack 2872732397 seq 407928731 subseq 56745 len 1428 csum 0xcc50], length 1428
21:02:49.179678 IP 112.26.0.8.35796 > 112.26.0.1.44903: Flags [.], ack 22473, win 3194, options [nop,nop,TS val 37430 ecr 259189,nop,nop,sack 1 {23901:58173},mptcp dss ack 407894459], length 0
21:02:49.194795 IP 112.26.0.8.35796 > 112.26.0.1.44903: Flags [.], ack 22473, win 2966, options [nop,nop,TS val 37023 ecr 259189,nop,nop,sack 2 {23901:39609}{41037:52461},mptcp dss ack 407894459], length 0
21:02:49.195658 IP 112.26.0.1.44903 > 112.26.0.8.35796: Flags [.], seq 58173:59601, ack 1, win 1339, options [nop,nop,TS val 260277 ecr 36604,mptcp dss ack 2872732397 seq 407930159 subseq 58173 len 1428 csum 0x44b], length 1428
21:02:49.197384 IP 112.26.0.1.44903 > 112.26.0.8.35796: Flags [.], seq 58173:59601, ack 1, win 1339, options [nop,nop,TS val 260277 ecr 36604,mptcp dss ack 2872732397 seq 407930159 subseq 58173 len 1428 csum 0x44b], length 1428
21:02:49.204497 IP 112.26.0.8.35796 > 112.26.0.1.44903: Flags [.], ack 22473, win 3240, options [nop,nop,TS val 37513 ecr 259189,nop,nop,sack 1 {23901:59601},mptcp dss ack 407894459], length 0
21:02:49.275239 IP 112.26.0.8.35796 > 112.26.0.1.44903: Flags [.], ack 22473, win 3012, options [nop,nop,TS val 37108 ecr 259189,nop,nop,sack 1 {23901:52461},mptcp dss ack 407894459], length 0
21:02:49.277439 IP 112.26.0.1.44903 > 112.26.0.8.35796: Flags [.], seq 59601:61029, ack 1, win 1339, options [nop,nop,TS val 260277 ecr 36604,mptcp dss ack 2872732397 seq 407931587 subseq 59601 len 1428 csum 0x19d5], length 1428
21:02:49.289664 IP 112.26.0.1.44903 > 112.26.0.8.35796: Flags [.], seq 22473:23901, ack 1, win 1339, options [nop,nop,TS val 260392 ecr 36678,mptcp dss ack 2872732397 seq 407894459 subseq 22473 len 1428 csum 0x5a1a], length 1428
21:02:49.294708 IP 112.26.0.8.35796 > 112.26.0.1.44903: Flags [.], ack 22473, win 3285, options [nop,nop,TS val 37609 ecr 259189,nop,nop,sack 1 {23901:61029},mptcp dss ack 407894459], length 0
21:02:49.296358 IP 112.26.0.1.44903 > 112.26.0.8.35796: Flags [.], seq 59601:61029, ack 1, win 1339, options [nop,nop,TS val 260277 ecr 36604,mptcp dss ack 2872732397 seq 407931587 subseq 59601 len 1428 csum 0x19d5], length 1428
21:02:49.316127 IP 112.26.0.1.44903 > 112.26.0.8.35796: Flags [.], seq 22473:23901, ack 1, win 1339, options [nop,nop,TS val 260392 ecr 36678,mptcp dss ack 2872732397 seq 407894459 subseq 22473 len 1428 csum 0x5a1a], length 1428
21:02:49.318464 IP 112.26.0.8.35796 > 112.26.0.1.44903: Flags [.], ack 61029, win 3331, options [nop,nop,TS val 37632 ecr 260392,mptcp dss ack 407933015], length 0
