21:02:50.606346 IP 112.26.2.8.36911 > 112.26.2.1.44903: Flags [S], seq 3024332961, win 65535, options [mss 1460,sackOK,TS val 38902 ecr 0,nop,wscale 6,mptcp join id 4 token 0x7fa57e4e nonce 0x6cbd2b45], length 0
21:02:50.685624 IP 112.26.2.8.36911 > 112.26.2.1.44903: Flags [S], seq 3024332961, win 65535, options [mss 1460,sackOK,TS val 38902 ecr 0,nop,wscale 6,mptcp join id 4 token 0x7fa57e4e nonce 0x6cbd2b45], length 0
21:02:50.775816 IP 112.26.2.8.36911 > 112.26.2.1.44903: Flags [S], seq 3024332961, win 65535, options [mss 1460,sackOK,TS val 38902 ecr 0,nop,wscale 6,mptcp join id 4 token 0x7fa57e4e nonce 0x6cbd2b45], length 0
21:02:50.898572 IP 112.26.2.1.44903 > 112.26.2.8.36911: Flags [S.], seq 3736178959, ack 3024332962, win 65535, options [mss 1460,sackOK,TS val 262484 ecr 38902,nop,wscale 6,mptcp join id 4 hmac 0x66acd08f3037344d nonce 0x613115c6], length 0
21:02:50.898804 IP 112.26.2.1.44903 > 112.26.2.8.36911: Flags [S.], seq 3736178959, ack 3024332962, win 65535, options [mss 1460,sackOK,TS val 262484 ecr 38902,nop,wscale 6,mptcp join id 4 hmac 0x66acd08f3037344d nonce 0x613115c6], length 0
21:02:50.904344 IP 112.26.2.8.36911 > 112.26.2.1.44903: Flags [.], ack 1, win 7072, options [nop,nop,TS val 39216 ecr 262484,mptcp join hmac 0x05c6b708eb80334dcf623d2a60219d0b6e2dd70a], length 0
21:02:50.904760 IP 112.26.2.8.36911 > 112.26.2.1.44903: Flags [.], ack 1, win 7072, options [nop,nop,TS val 39216 ecr 262484,mptcp join hmac 0x05c6b708eb80334dcf623d2a60219d0b6e2dd70a], length 0
21:02:51.028217 IP 112.26.2.8.36911 > 112.26.2.1.44903: Flags [.], ack 1, win 7072, options [nop,nop,TS val 39216 ecr 262484,mptcp join hmac 0x05c6b708eb80334dcf623d2a60219d0b6e2dd70a], length 0
21:02:51.215641 IP 112.26.2.1.44903 > 112.26.2.8.36911: Flags [.], ack 1, win 4017, options [nop,nop,TS val 262737 ecr 39216,mptcp dss ack 2872732397], length 0
21:02:51.215906 IP 112.26.2.1.44903 > 112.26.2.8.36911: Flags [.], ack 1, win 4017, options [nop,nop,TS val 262737 ecr 39216,mptcp dss ack 2872732397], length 0
21:02:51.274747 IP 112.26.2.1.44903 > 112.26.2.8.36911: Flags [.], seq 1:1429, ack 1, win 4017, options [nop,nop,TS val 262737 ecr 39216,mptcp dss ack 2872732397 seq 407995847 subseq 1 len 1428 csum 0xcb12], length 1428
21:02:51.275044 IP 112.26.2.1.44903 > 112.26.2.8.36911: Flags [.], seq 1:1429, ack 1, win 4017, options [nop,nop,TS val 262737 ecr 39216,mptcp dss ack 2872732397 seq 407995847 subseq 1 len 1428 csum 0xcb12], length 1428
21:02:51.292545 IP 112.26.2.8.36911 > 112.26.2.1.44903: Flags [.], ack 1429, win 7346, options [nop,nop,TS val 39607 ecr 262737,mptcp dss ack 407968715], length 0
21:02:51.292868 IP 112.26.2.8.36911 > 112.26.2.1.44903: Flags [.], ack 1429, win 7346, options [nop,nop,TS val 39607 ecr 262737,mptcp dss ack 407968715], length 0
21:02:51.459539 IP 112.26.2.1.44903 > 112.26.2.8.36911: Flags [.], seq 1429:2857, ack 1, win 4017, options [nop,nop,TS val 262737 ecr 39216,mptcp dss ack 2872732397 seq 407997275 subseq 1429 len 1428 csum 0xbb85], length 1428
21:02:51.459837 IP 112.26.2.1.44903 > 112.26.2.8.36911: Flags [.], seq 1429:2857, ack 1, win 4017, options [nop,nop,TS val 262737 ecr 39216,mptcp dss ack 2872732397 seq 407997275 subseq 1429 len 1428 csum 0xbb85], length 1428
21:02:51.562839 IP 112.26.2.8.36911 > 112.26.2.1.44903: Flags [.], ack 2857, win 7665, options [nop,nop,TS val 39877 ecr 262737,mptcp dss ack 407972999], length 0
21:02:51.563234 IP 112.26.2.8.36911 > 112.26.2.1.44903: Flags [.], ack 2857, win 7665, options [nop,nop,TS val 39877 ecr 262737,mptcp dss ack 407972999], length 0
21:02:51.620118 IP 112.26.2.1.44903 > 112.26.2.8.36911: Flags [.], seq 2857:4285, ack 1, win 4017, options [nop,nop,TS val 262737 ecr 39216,mptcp dss ack 2872732397 seq 407998703 subseq 2857 len 1428 csum 0x4b2d], length 1428
21:02:51.620406 IP 112.26.2.1.44903 > 112.26.2.8.36911: Flags [.], seq 2857:4285, ack 1, win 4017, options [nop,nop,TS val 262737 ecr 39216,mptcp dss ack 2872732397 seq 407998703 subseq 2857 len 1428 csum 0x4b2d], length 1428
21:02:51.789213 IP 112.26.2.8.36911 > 112.26.2.1.44903: Flags [.], ack 4285, win 7848, options [nop,nop,TS val 40102 ecr 262737,mptcp dss ack 407974427], length 0
21:02:51.789533 IP 112.26.2.8.36911 > 112.26.2.1.44903: Flags [.], ack 4285, win 7848, options [nop,nop,TS val 40102 ecr 262737,mptcp dss ack 407974427], length 0
21:02:51.814016 IP 112.26.2.1.44903 > 112.26.2.8.36911: Flags [.], seq 4285:5713, ack 1, win 4017, options [nop,nop,TS val 262738 ecr 39216,mptcp dss ack 2872732397 seq 408000131 subseq 4285 len 1428 csum 0x655], length 1428
21:02:51.814346 IP 112.26.2.1.44903 > 112.26.2.8.36911: Flags [.], seq 4285:5713, ack 1, win 4017, options [nop,nop,TS val 262738 ecr 39216,mptcp dss ack 2872732397 seq 408000131 subseq 4285 len 1428 csum 0x655], length 1428
21:02:51.937880 IP 112.26.2.1.44903 > 112.26.2.8.36911: Flags [.], seq 5713:7141, ack 1, win 4017, options [nop,nop,TS val 262738 ecr 39216,mptcp dss ack 2872732397 seq 408001559 subseq 5713 len 1428 csum 0x801e], length 1428
21:02:51.938178 IP 112.26.2.1.44903 > 112.26.2.8.36911: Flags [.], seq 5713:7141, ack 1, win 4017, options [nop,nop,TS val 262738 ecr 39216,mptcp dss ack 2872732397 seq 408001559 subseq 5713 len 1428 csum 0x801e], length 1428
21:02:51.976900 IP 112.26.2.8.36911 > 112.26.2.1.44903: Flags [.], ack 5713, win 8076, options [nop,nop,TS val 40286 ecr 262738,mptcp dss ack 407975855], length 0
21:02:51.977279 IP 112.26.2.8.36911 > 112.26.2.1.44903: Flags [.], ack 5713, win 8076, options [nop,nop,TS val 40286 ecr 262738,mptcp dss ack 407975855], length 0
21:02:52.012302 IP 112.26.2.8.36911 > 112.26.2.1.44903: Flags [.], ack 1429, win 7346, options [nop,nop,TS val 39607 ecr 262737,mptcp dss ack 407968715], length 0
21:02:52.072733 IP 112.26.2.8.36911 > 112.26.2.1.44903: Flags [.], ack 7141, win 8213, options [nop,nop,TS val 40386 ecr 262738,mptcp dss ack 407977283], length 0
21:02:52.072996 IP 112.26.2.8.36911 > 112.26.2.1.44903: Flags [.], ack 7141, win 8213, options [nop,nop,TS val 40386 ecr 262738,mptcp dss ack 407977283], length 0
21:02:52.107103 IP 112.26.2.1.44903 > 112.26.2.8.36911: Flags [.], seq 7141:8569, ack 1, win 4017, options [nop,nop,TS val 262738 ecr 39216,mptcp dss ack 2872732397 seq 408002987 subseq 7141 len 1428 csum 0x3999], length 1428
21:02:52.107387 IP 112.26.2.1.44903 > 112.26.2.8.36911: Flags [.], seq 7141:8569, ack 1, win 4017, options [nop,nop,TS val 262738 ecr 39216,mptcp dss ack 2872732397 seq 408002987 subseq 7141 len 1428 csum 0x3999], length 1428
21:02:52.194878 IP 112.26.2.1.44903 > 112.26.2.8.36911: Flags [.], seq 8569:9997, ack 1, win 4017, options [nop,nop,TS val 262738 ecr 39216,mptcp dss ack 2872732397 seq 408004415 subseq 8569 len 1428 csum 0x9a86], length 1428
21:02:52.195144 IP 112.26.2.1.44903 > 112.26.2.8.36911: Flags [.], seq 8569:9997, ack 1, win 4017, options [nop,nop,TS val 262738 ecr 39216,mptcp dss ack 2872732397 seq 408004415 subseq 8569 len 1428 csum 0x9a86], length 1428
21:02:52.292434 IP 112.26.2.1.44903 > 112.26.2.8.36911: Flags [.], seq 9997:11425, ack 1, win 4017, options [nop,nop,TS val 262738 ecr 39216,mptcp dss ack 2872732397 seq 408005843 subseq 9997 len 1428 csum 0x2c94], length 1428
21:02:52.292755 IP 112.26.2.1.44903 > 112.26.2.8.36911: Flags [.], seq 9997:11425, ack 1, win 4017, options [nop,nop,TS val 262738 ecr 39216,mptcp dss ack 2872732397 seq 408005843 subseq 9997 len 1428 csum 0x2c94], length 1428
21:02:52.389303 IP 112.26.2.8.36911 > 112.26.2.1.44903: Flags [.], ack 2857, win 7665, options [nop,nop,TS val 39877 ecr 262737,mptcp dss ack 407972999], length 0
21:02:52.408039 IP 112.26.2.8.36911 > 112.26.2.1.44903: Flags [.], ack 8569, win 8578, options [nop,nop,TS val 40722 ecr 262738,mptcp dss ack 407988707], length 0
21:02:52.482533 IP 112.26.2.8.36911 > 112.26.2.1.44903: Flags [.], ack 9997, win 8669, options [nop,nop,TS val 40796 ecr 262738,mptcp dss ack 407990135], length 0
21:02:52.529116 IP 112.26.2.1.44903 > 112.26.2.8.36911: Flags [.], seq 11425:12853, ack 1, win 4017, options [nop,nop,TS val 262738 ecr 39216,mptcp dss ack 2872732397 seq 408007271 subseq 11425 len 1428 csum 0xc46c], length 1428
21:02:52.529441 IP 112.26.2.1.44903 > 112.26.2.8.36911: Flags [.], seq 11425:12853, ack 1, win 4017, options [nop,nop,TS val 262738 ecr 39216,mptcp dss ack 2872732397 seq 408007271 subseq 11425 len 1428 csum 0xc46c], length 1428
21:02:52.601659 IP 112.26.2.8.36911 > 112.26.2.1.44903: Flags [.], ack 11425, win 8852, options [nop,nop,TS val 40916 ecr 262738,mptcp dss ack 407991563], length 0
21:02:52.623018 IP 112.26.2.1.44903 > 112.26.2.8.36911: Flags [.], seq 12853:14281, ack 1, win 4017, options [nop,nop,TS val 262738 ecr 39216,mptcp dss ack 2872732397 seq 408008699 subseq 12853 len 1428 csum 0x4422], length 1428
21:02:52.623349 IP 112.26.2.1.44903 > 112.26.2.8.36911: Flags [.], seq 12853:14281, ack 1, win 4017, options [nop,nop,TS val 262738 ecr 39216,mptcp dss ack 2872732397 seq 408008699 subseq 12853 len 1428 csum 0x4422], length 1428
21:02:52.695461 IP 112.26.2.8.36911 > 112.26.2.1.44903: Flags [.], ack 8569, win 8578, options [nop,nop,TS val 40722 ecr 262738,mptcp dss ack 407988707], length 0
21:02:52.695505 IP 112.26.2.8.36911 > 112.26.2.1.44903: Flags [.], ack 9997, win 8669, options [nop,nop,TS val 40796 ecr 262738,mptcp dss ack 407990135], length 0
21:02:52.695529 IP 112.26.2.8.36911 > 112.26.2.1.44903: Flags [.], ack 11425, win 8852, options [nop,nop,TS val 40916 ecr 262738,mptcp dss ack 407991563], length 0
21:02:52.697161 IP 112.26.2.8.36911 > 112.26.2.1.44903: Flags [.], ack 12853, win 8989, options [nop,nop,TS val 40999 ecr 262738,mptcp dss ack 407991563], length 0
21:02:52.697564 IP 112.26.2.8.36911 > 112.26.2.1.44903: Flags [.], ack 12853, win 8989, options [nop,nop,TS val 40999 ecr 262738,mptcp dss ack 407991563], length 0
21:02:52.771194 IP 112.26.2.8.36911 > 112.26.2.1.44903: Flags [.], ack 4285, win 7848, options [nop,nop,TS val 40102 ecr 262737,mptcp dss ack 407974427], length 0
21:02:52.785716 IP 112.26.2.8.36911 > 112.26.2.1.44903: Flags [.], ack 14281, win 9034, options [nop,nop,TS val 41100 ecr 262738,mptcp dss ack 407991563], length 0
21:02:52.786027 IP 112.26.2.8.36911 > 112.26.2.1.44903: Flags [.], ack 14281, win 9034, options [nop,nop,TS val 41100 ecr 262738,mptcp dss ack 407991563], length 0
21:02:52.867650 IP 112.26.2.1.44903 > 112.26.2.8.36911: Flags [.], seq 14281:15709, ack 1, win 4017, options [nop,nop,TS val 263721 ecr 39607,mptcp dss ack 2872732397 seq 408054395 subseq 14281 len 1428 csum 0x352b], length 1428
21:02:52.867976 IP 112.26.2.1.44903 > 112.26.2.8.36911: Flags [.], seq 14281:15709, ack 1, win 4017, options [nop,nop,TS val 263721 ecr 39607,mptcp dss ack 2872732397 seq 408054395 subseq 14281 len 1428 csum 0x352b], length 1428
21:02:52.951583 IP 112.26.2.8.36911 > 112.26.2.1.44903: Flags [.], ack 8569, win 8578, options [nop,nop,TS val 40722 ecr 262738,mptcp dss ack 407988707], length 0
21:02:53.004671 IP 112.26.2.8.36911 > 112.26.2.1.44903: Flags [.], ack 5713, win 8076, options [nop,nop,TS val 40286 ecr 262738,mptcp dss ack 407975855], length 0
21:02:53.040112 IP 112.26.2.8.36911 > 112.26.2.1.44903: Flags [.], ack 9997, win 8669, options [nop,nop,TS val 40796 ecr 262738,mptcp dss ack 407990135], length 0
21:02:53.137529 IP 112.26.2.8.36911 > 112.26.2.1.44903: Flags [.], ack 7141, win 8213, options [nop,nop,TS val 40386 ecr 262738,mptcp dss ack 407977283], length 0
21:02:53.171165 IP 112.26.2.8.36911 > 112.26.2.1.44903: Flags [.], ack 11425, win 8852, options [nop,nop,TS val 40916 ecr 262738,mptcp dss ack 407991563], length 0
21:02:53.325818 IP 112.26.2.8.36911 > 112.26.2.1.44903: Flags [.], ack 12853, win 8989, options [nop,nop,TS val 40999 ecr 262738,mptcp dss ack 407991563], length 0
21:02:53.376945 IP 112.26.2.8.36911 > 112.26.2.1.44903: Flags [.], ack 15709, win 9627, options [nop,nop,TS val 41691 ecr 263721,mptcp dss ack 407991563], length 0
21:02:53.377269 IP 112.26.2.8.36911 > 112.26.2.1.44903: Flags [.], ack 15709, win 9627, options [nop,nop,TS val 41691 ecr 263721,mptcp dss ack 407991563], length 0
21:02:53.409718 IP 112.26.2.1.44903 > 112.26.2.8.36911: Flags [.], seq 18565:19993, ack 1, win 4017, options [nop,nop,TS val 264098 ecr 39877,mptcp dss ack 2872732397 seq 407991563 subseq 18565 len 1428 csum 0x33f5], length 1428
21:02:53.410043 IP 112.26.2.1.44903 > 112.26.2.8.36911: Flags [.], seq 18565:19993, ack 1, win 4017, options [nop,nop,TS val 264098 ecr 39877,mptcp dss ack 2872732397 seq 407991563 subseq 18565 len 1428 csum 0x33f5], length 1428
21:02:53.445298 IP 112.26.2.8.36911 > 112.26.2.1.44903: Flags [.], ack 14281, win 9034, options [nop,nop,TS val 41100 ecr 262738,mptcp dss ack 407991563], length 0
21:02:53.524499 IP 112.26.2.1.44903 > 112.26.2.8.36911: Flags [.], seq 19993:21421, ack 1, win 4017, options [nop,nop,TS val 264479 ecr 40102,mptcp dss ack 2872732397 seq 408080099 subseq 19993 len 1428 csum 0x6f4a], length 1428
21:02:53.524750 IP 112.26.2.1.44903 > 112.26.2.8.36911: Flags [.], seq 19993:21421, ack 1, win 4017, options [nop,nop,TS val 264479 ecr 40102,mptcp dss ack 2872732397 seq 408080099 subseq 19993 len 1428 csum 0x6f4a], length 1428
21:02:53.551861 IP 112.26.2.8.36911 > 112.26.2.1.44903: Flags [.], ack 15709, win 9764, options [nop,nop,TS val 41866 ecr 263721,nop,nop,sack 1 {18565:19993},mptcp dss ack 407991563], length 0
21:02:53.552188 IP 112.26.2.8.36911 > 112.26.2.1.44903: Flags [.], ack 15709, win 9764, options [nop,nop,TS val 41866 ecr 263721,nop,nop,sack 1 {18565:19993},mptcp dss ack 407991563], length 0
21:02:53.604962 IP 112.26.2.8.36911 > 112.26.2.1.44903: Flags [.], ack 15709, win 9627, options [nop,nop,TS val 41691 ecr 263721,mptcp dss ack 407991563], length 0
21:02:53.661142 IP 112.26.2.8.36911 > 112.26.2.1.44903: Flags [.], ack 15709, win 9947, options [nop,nop,TS val 41971 ecr 263721,nop,nop,sack 1 {18565:21421},mptcp dss ack 407991563], length 0
21:02:53.661472 IP 112.26.2.8.36911 > 112.26.2.1.44903: Flags [.], ack 15709, win 9947, options [nop,nop,TS val 41971 ecr 263721,nop,nop,sack 1 {18565:21421},mptcp dss ack 407991563], length 0
21:02:53.703685 IP 112.26.2.1.44903 > 112.26.2.8.36911: Flags [.], seq 21421:22849, ack 1, win 4017, options [nop,nop,TS val 264479 ecr 40102,mptcp dss ack 2872732397 seq 408081527 subseq 21421 len 1428 csum 0x49fa], length 1428
21:02:53.703979 IP 112.26.2.1.44903 > 112.26.2.8.36911: Flags [.], seq 21421:22849, ack 1, win 4017, options [nop,nop,TS val 264479 ecr 40102,mptcp dss ack 2872732397 seq 408081527 subseq 21421 len 1428 csum 0x49fa], length 1428
21:02:53.793361 IP 112.26.2.8.36911 > 112.26.2.1.44903: Flags [.], ack 15709, win 9764, options [nop,nop,TS val 41866 ecr 263721,nop,nop,sack 1 {18565:19993},mptcp dss ack 407991563], length 0
21:02:53.811122 IP 112.26.2.1.44903 > 112.26.2.8.36911: Flags [.], seq 22849:24277, ack 1, win 4017, options [nop,nop,TS val 264659 ecr 40722,mptcp dss ack 2872732397 seq 408091523 subseq 22849 len 1428 csum 0x7504], length 1428
21:02:53.811406 IP 112.26.2.1.44903 > 112.26.2.8.36911: Flags [.], seq 22849:24277, ack 1, win 4017, options [nop,nop,TS val 264659 ecr 40722,mptcp dss ack 2872732397 seq 408091523 subseq 22849 len 1428 csum 0x7504], length 1428
21:02:53.904913 IP 112.26.2.1.44903 > 112.26.2.8.36911: Flags [.], seq 24277:25705, ack 1, win 4017, options [nop,nop,TS val 264659 ecr 40722,mptcp dss ack 2872732397 seq 408092951 subseq 24277 len 1428 csum 0x9920], length 1428
21:02:53.905227 IP 112.26.2.1.44903 > 112.26.2.8.36911: Flags [.], seq 24277:25705, ack 1, win 4017, options [nop,nop,TS val 264659 ecr 40722,mptcp dss ack 2872732397 seq 408092951 subseq 24277 len 1428 csum 0x9920], length 1428
21:02:53.923599 IP 112.26.2.8.36911 > 112.26.2.1.44903: Flags [.], ack 15709, win 9947, options [nop,nop,TS val 41971 ecr 263721,nop,nop,sack 1 {18565:21421},mptcp dss ack 407991563], length 0
21:02:54.009216 IP 112.26.2.8.36911 > 112.26.2.1.44903: Flags [.], ack 15709, win 10357, options [nop,nop,TS val 42323 ecr 263721,nop,nop,sack 1 {18565:22849},mptcp dss ack 407991563], length 0
21:02:54.009565 IP 112.26.2.8.36911 > 112.26.2.1.44903: Flags [.], ack 15709, win 10357, options [nop,nop,TS val 42323 ecr 263721,nop,nop,sack 1 {18565:22849},mptcp dss ack 407991563], length 0
21:02:54.039235 IP 112.26.2.1.44903 > 112.26.2.8.36911: Flags [.], seq 25705:27133, ack 1, win 4017, options [nop,nop,TS val 264659 ecr 40722,mptcp dss ack 2872732397 seq 408094379 subseq 25705 len 1428 csum 0xa19f], length 1428
21:02:54.039475 IP 112.26.2.1.44903 > 112.26.2.8.36911: Flags [.], seq 25705:27133, ack 1, win 4017, options [nop,nop,TS val 264659 ecr 40722,mptcp dss ack 2872732397 seq 408094379 subseq 25705 len 1428 csum 0xa19f], length 1428
21:02:54.101976 IP 112.26.2.8.36911 > 112.26.2.1.44903: Flags [.], ack 15709, win 10494, options [nop,nop,TS val 42416 ecr 263721,nop,nop,sack 1 {18565:24277},mptcp dss ack 407991563], length 0
21:02:54.102331 IP 112.26.2.8.36911 > 112.26.2.1.44903: Flags [.], ack 15709, win 10494, options [nop,nop,TS val 42416 ecr 263721,nop,nop,sack 1 {18565:24277},mptcp dss ack 407991563], length 0
21:02:54.132646 IP 112.26.2.1.44903 > 112.26.2.8.36911: Flags [.], seq 27133:28561, ack 1, win 4017, options [nop,nop,TS val 264659 ecr 40722,mptcp dss ack 2872732397 seq 408095807 subseq 27133 len 1428 csum 0x26ce], length 1428
21:02:54.132979 IP 112.26.2.1.44903 > 112.26.2.8.36911: Flags [.], seq 27133:28561, ack 1, win 4017, options [nop,nop,TS val 264659 ecr 40722,mptcp dss ack 2872732397 seq 408095807 subseq 27133 len 1428 csum 0x26ce], length 1428
21:02:54.222077 IP 112.26.2.1.44903 > 112.26.2.8.36911: Flags [.], seq 28561:29989, ack 1, win 4017, options [nop,nop,TS val 264659 ecr 40722,mptcp dss ack 2872732397 seq 408097235 subseq 28561 len 1428 csum 0xfb77], length 1428
21:02:54.222431 IP 112.26.2.1.44903 > 112.26.2.8.36911: Flags [.], seq 28561:29989, ack 1, win 4017, options [nop,nop,TS val 264659 ecr 40722,mptcp dss ack 2872732397 seq 408097235 subseq 28561 len 1428 csum 0xfb77], length 1428
21:02:54.223408 IP 112.26.2.8.36911 > 112.26.2.1.44903: Flags [.], ack 15709, win 10631, options [nop,nop,TS val 42530 ecr 263721,nop,nop,sack 1 {18565:25705},mptcp dss ack 407991563], length 0
21:02:54.223708 IP 112.26.2.8.36911 > 112.26.2.1.44903: Flags [.], ack 15709, win 10631, options [nop,nop,TS val 42530 ecr 263721,nop,nop,sack 1 {18565:25705},mptcp dss ack 407991563], length 0
21:02:54.362357 IP 112.26.2.1.44903 > 112.26.2.8.36911: Flags [.], ack 1, win 4017, options [nop,nop,TS val 264713 ecr 40722,mptcp dss ack 2872732397], length 0
21:02:54.362678 IP 112.26.2.1.44903 > 112.26.2.8.36911: Flags [.], ack 1, win 4017, options [nop,nop,TS val 264713 ecr 40722,mptcp dss ack 2872732397], length 0
21:02:54.421733 IP 112.26.2.8.36911 > 112.26.2.1.44903: Flags [.], ack 15709, win 10357, options [nop,nop,TS val 42323 ecr 263721,nop,nop,sack 1 {18565:22849},mptcp dss ack 407991563], length 0
21:02:54.480087 IP 112.26.2.1.44903 > 112.26.2.8.36911: Flags [.], seq 31417:32845, ack 1, win 4017, options [nop,nop,TS val 264748 ecr 40796,mptcp dss ack 2872732397 seq 408102947 subseq 31417 len 1428 csum 0xfa86], length 1428
21:02:54.480439 IP 112.26.2.1.44903 > 112.26.2.8.36911: Flags [.], seq 31417:32845, ack 1, win 4017, options [nop,nop,TS val 264748 ecr 40796,mptcp dss ack 2872732397 seq 408102947 subseq 31417 len 1428 csum 0xfa86], length 1428
21:02:54.524343 IP 112.26.2.8.36911 > 112.26.2.1.44903: Flags [.], ack 15709, win 10950, options [nop,nop,TS val 42838 ecr 263721,nop,nop,sack 1 {18565:27133},mptcp dss ack 407991563], length 0
21:02:54.524649 IP 112.26.2.8.36911 > 112.26.2.1.44903: Flags [.], ack 15709, win 10950, options [nop,nop,TS val 42838 ecr 263721,nop,nop,sack 1 {18565:27133},mptcp dss ack 407991563], length 0
21:02:54.651836 IP 112.26.2.8.36911 > 112.26.2.1.44903: Flags [.], ack 15709, win 10494, options [nop,nop,TS val 42416 ecr 263721,nop,nop,sack 1 {18565:24277},mptcp dss ack 407991563], length 0
21:02:54.677612 IP 112.26.2.1.44903 > 112.26.2.8.36911: Flags [.], seq 34273:35701, ack 1, win 4017, options [nop,nop,TS val 264879 ecr 40916,mptcp dss ack 2872732397 seq 408117227 subseq 34273 len 1428 csum 0xb8ed], length 1428
21:02:54.677950 IP 112.26.2.1.44903 > 112.26.2.8.36911: Flags [.], seq 34273:35701, ack 1, win 4017, options [nop,nop,TS val 264879 ecr 40916,mptcp dss ack 2872732397 seq 408117227 subseq 34273 len 1428 csum 0xb8ed], length 1428
21:02:54.745805 IP 112.26.2.8.36911 > 112.26.2.1.44903: Flags [.], ack 15709, win 11224, options [nop,nop,TS val 43060 ecr 263721,nop,nop,sack 1 {18565:28561},mptcp dss ack 407991563], length 0
21:02:54.746109 IP 112.26.2.8.36911 > 112.26.2.1.44903: Flags [.], ack 15709, win 11224, options [nop,nop,TS val 43060 ecr 263721,nop,nop,sack 1 {18565:28561},mptcp dss ack 407991563], length 0
21:02:54.794123 IP 112.26.2.1.44903 > 112.26.2.8.36911: Flags [.], seq 35701:37129, ack 1, win 4017, options [nop,nop,TS val 264879 ecr 40916,mptcp dss ack 2872732397 seq 408118655 subseq 35701 len 1428 csum 0xc007], length 1428
21:02:54.794444 IP 112.26.2.1.44903 > 112.26.2.8.36911: Flags [.], seq 35701:37129, ack 1, win 4017, options [nop,nop,TS val 264879 ecr 40916,mptcp dss ack 2872732397 seq 408118655 subseq 35701 len 1428 csum 0xc007], length 1428
21:02:54.835395 IP 112.26.2.8.36911 > 112.26.2.1.44903: Flags [.], ack 15709, win 11361, options [nop,nop,TS val 43150 ecr 263721,nop,nop,sack 1 {18565:29989},mptcp dss ack 407991563], length 0
21:02:54.835704 IP 112.26.2.8.36911 > 112.26.2.1.44903: Flags [.], ack 15709, win 11361, options [nop,nop,TS val 43150 ecr 263721,nop,nop,sack 1 {18565:29989},mptcp dss ack 407991563], length 0
21:02:54.871270 IP 112.26.2.1.44903 > 112.26.2.8.36911: Flags [.], seq 37129:38557, ack 1, win 4017, options [nop,nop,TS val 265034 ecr 40999,mptcp dss ack 2872732397 seq 408125795 subseq 37129 len 1428 csum 0x30fb], length 1428
21:02:54.871595 IP 112.26.2.1.44903 > 112.26.2.8.36911: Flags [.], seq 37129:38557, ack 1, win 4017, options [nop,nop,TS val 265034 ecr 40999,mptcp dss ack 2872732397 seq 408125795 subseq 37129 len 1428 csum 0x30fb], length 1428
21:02:54.910798 IP 112.26.2.8.36911 > 112.26.2.1.44903: Flags [.], ack 15709, win 10631, options [nop,nop,TS val 42530 ecr 263721,nop,nop,sack 1 {18565:25705},mptcp dss ack 407991563], length 0
21:02:54.956224 IP 112.26.2.1.44903 > 112.26.2.8.36911: Flags [.], seq 38557:39985, ack 1, win 4017, options [nop,nop,TS val 265034 ecr 40999,mptcp dss ack 2872732397 seq 408127223 subseq 38557 len 1428 csum 0xd51d], length 1428
21:02:54.956503 IP 112.26.2.1.44903 > 112.26.2.8.36911: Flags [.], seq 38557:39985, ack 1, win 4017, options [nop,nop,TS val 265034 ecr 40999,mptcp dss ack 2872732397 seq 408127223 subseq 38557 len 1428 csum 0xd51d], length 1428
21:02:55.042149 IP 112.26.2.1.44903 > 112.26.2.8.36911: Flags [.], seq 39985:41413, ack 1, win 4017, options [nop,nop,TS val 265153 ecr 41100,mptcp dss ack 2872732397 seq 408131507 subseq 39985 len 1428 csum 0x32dd], length 1428
21:02:55.042443 IP 112.26.2.1.44903 > 112.26.2.8.36911: Flags [.], seq 39985:41413, ack 1, win 4017, options [nop,nop,TS val 265153 ecr 41100,mptcp dss ack 2872732397 seq 408131507 subseq 39985 len 1428 csum 0x32dd], length 1428
21:02:55.079490 IP 112.26.2.8.36911 > 112.26.2.1.44903: Flags [.], ack 15709, win 11589, options [nop,nop,TS val 43394 ecr 263721,nop,nop,sack 2 {31417:32845}{18565:29989},mptcp dss ack 407991563], length 0
21:02:55.079807 IP 112.26.2.8.36911 > 112.26.2.1.44903: Flags [.], ack 15709, win 11589, options [nop,nop,TS val 43394 ecr 263721,nop,nop,sack 2 {31417:32845}{18565:29989},mptcp dss ack 407991563], length 0
21:02:55.105502 IP 112.26.2.1.44903 > 112.26.2.8.36911: Flags [.], seq 41413:42841, ack 1, win 4017, options [nop,nop,TS val 265153 ecr 41100,mptcp dss ack 2872732397 seq 408132935 subseq 41413 len 1428 csum 0xad1b], length 1428
21:02:55.105781 IP 112.26.2.1.44903 > 112.26.2.8.36911: Flags [.], seq 41413:42841, ack 1, win 4017, options [nop,nop,TS val 265153 ecr 41100,mptcp dss ack 2872732397 seq 408132935 subseq 41413 len 1428 csum 0xad1b], length 1428
21:02:55.177242 IP 112.26.2.1.44903 > 112.26.2.8.36911: Flags [.], seq 15709:17137, ack 1, win 4017, options [nop,nop,TS val 265632 ecr 41971,mptcp dss ack 2872732397 seq 408055823 subseq 15709 len 1428 csum 0x9de1], length 1428
21:02:55.177566 IP 112.26.2.1.44903 > 112.26.2.8.36911: Flags [.], seq 15709:17137, ack 1, win 4017, options [nop,nop,TS val 265632 ecr 41971,mptcp dss ack 2872732397 seq 408055823 subseq 15709 len 1428 csum 0x9de1], length 1428
21:02:55.181400 IP 112.26.2.8.36911 > 112.26.2.1.44903: Flags [.], ack 15709, win 10950, options [nop,nop,TS val 42838 ecr 263721,nop,nop,sack 1 {18565:27133},mptcp dss ack 407991563], length 0
21:02:55.272564 IP 112.26.2.8.36911 > 112.26.2.1.44903: Flags [.], ack 15709, win 11772, options [nop,nop,TS val 43584 ecr 263721,nop,nop,sack 2 {34273:35701}{31417:32845},mptcp dss ack 407991563], length 0
21:02:55.272873 IP 112.26.2.8.36911 > 112.26.2.1.44903: Flags [.], ack 15709, win 11772, options [nop,nop,TS val 43584 ecr 263721,nop,nop,sack 2 {34273:35701}{31417:32845},mptcp dss ack 407991563], length 0
21:02:55.303882 IP 112.26.2.1.44903 > 112.26.2.8.36911: Flags [.], seq 17137:18565, ack 1, win 4017, options [nop,nop,TS val 266130 ecr 42323,mptcp dss ack 2872732397 seq 407990135 subseq 17137 len 1428 csum 0xbb06], length 1428
21:02:55.304221 IP 112.26.2.1.44903 > 112.26.2.8.36911: Flags [.], seq 17137:18565, ack 1, win 4017, options [nop,nop,TS val 266130 ecr 42323,mptcp dss ack 2872732397 seq 407990135 subseq 17137 len 1428 csum 0xbb06], length 1428
21:02:55.368356 IP 112.26.2.8.36911 > 112.26.2.1.44903: Flags [.], ack 15709, win 11224, options [nop,nop,TS val 43060 ecr 263721,nop,nop,sack 1 {18565:28561},mptcp dss ack 407991563], length 0
21:02:55.403416 IP 112.26.2.1.44903 > 112.26.2.8.36911: Flags [.], seq 42841:44269, ack 1, win 4017, options [nop,nop,TS val 266673 ecr 42530,mptcp dss ack 2872732397 seq 408148643 subseq 42841 len 1428 csum 0x8b67], length 1428
21:02:55.403659 IP 112.26.2.1.44903 > 112.26.2.8.36911: Flags [.], seq 42841:44269, ack 1, win 4017, options [nop,nop,TS val 266673 ecr 42530,mptcp dss ack 2872732397 seq 408148643 subseq 42841 len 1428 csum 0x8b67], length 1428
21:02:55.438907 IP 112.26.2.8.36911 > 112.26.2.1.44903: Flags [.], ack 15709, win 12000, options [nop,nop,TS val 43753 ecr 263721,nop,nop,sack 2 {34273:37129}{31417:32845},mptcp dss ack 407991563], length 0
21:02:55.439212 IP 112.26.2.8.36911 > 112.26.2.1.44903: Flags [.], ack 15709, win 12000, options [nop,nop,TS val 43753 ecr 263721,nop,nop,sack 2 {34273:37129}{31417:32845},mptcp dss ack 407991563], length 0
21:02:55.487281 IP 112.26.2.1.44903 > 112.26.2.8.36911: Flags [.], seq 44269:45697, ack 1, win 4017, options [nop,nop,TS val 266919 ecr 42838,mptcp dss ack 2872732397 seq 408152927 subseq 44269 len 1428 csum 0xf380], length 1428
21:02:55.487617 IP 112.26.2.1.44903 > 112.26.2.8.36911: Flags [.], seq 44269:45697, ack 1, win 4017, options [nop,nop,TS val 266919 ecr 42838,mptcp dss ack 2872732397 seq 408152927 subseq 44269 len 1428 csum 0xf380], length 1428
21:02:55.553402 IP 112.26.2.8.36911 > 112.26.2.1.44903: Flags [.], ack 15709, win 11361, options [nop,nop,TS val 43150 ecr 263721,nop,nop,sack 1 {18565:29989},mptcp dss ack 407991563], length 0
21:02:55.608662 IP 112.26.2.1.44903 > 112.26.2.8.36911: Flags [.], seq 45697:47125, ack 1, win 4017, options [nop,nop,TS val 267312 ecr 43150,mptcp dss ack 2872732397 seq 408158639 subseq 45697 len 1428 csum 0x939a], length 1428
21:02:55.608950 IP 112.26.2.1.44903 > 112.26.2.8.36911: Flags [.], seq 45697:47125, ack 1, win 4017, options [nop,nop,TS val 267312 ecr 43150,mptcp dss ack 2872732397 seq 408158639 subseq 45697 len 1428 csum 0x939a], length 1428
21:02:55.656949 IP 112.26.2.8.36911 > 112.26.2.1.44903: Flags [.], ack 15709, win 12274, options [nop,nop,TS val 43970 ecr 263721,nop,nop,sack 2 {34273:38557}{31417:32845},mptcp dss ack 407991563], length 0
21:02:55.657241 IP 112.26.2.8.36911 > 112.26.2.1.44903: Flags [.], ack 15709, win 12274, options [nop,nop,TS val 43970 ecr 263721,nop,nop,sack 2 {34273:38557}{31417:32845},mptcp dss ack 407991563], length 0
21:02:55.729969 IP 112.26.2.8.36911 > 112.26.2.1.44903: Flags [.], ack 15709, win 12410, options [nop,nop,TS val 44028 ecr 263721,nop,nop,sack 2 {34273:39985}{31417:32845},mptcp dss ack 407991563], length 0
21:02:55.730214 IP 112.26.2.8.36911 > 112.26.2.1.44903: Flags [.], ack 15709, win 12410, options [nop,nop,TS val 44028 ecr 263721,nop,nop,sack 2 {34273:39985}{31417:32845},mptcp dss ack 407991563], length 0
21:02:55.806262 IP 112.26.2.8.36911 > 112.26.2.1.44903: Flags [.], ack 15709, win 12547, options [nop,nop,TS val 44120 ecr 263721,nop,nop,sack 2 {34273:41413}{31417:32845},mptcp dss ack 408037259], length 0
21:02:55.806546 IP 112.26.2.8.36911 > 112.26.2.1.44903: Flags [.], ack 15709, win 12547, options [nop,nop,TS val 44120 ecr 263721,nop,nop,sack 2 {34273:41413}{31417:32845},mptcp dss ack 408037259], length 0
21:02:55.892806 IP 112.26.2.8.36911 > 112.26.2.1.44903: Flags [.], ack 15709, win 11589, options [nop,nop,TS val 43394 ecr 263721,nop,nop,sack 2 {31417:32845}{18565:29989},mptcp dss ack 407991563], length 0
21:02:55.907131 IP 112.26.2.1.44903 > 112.26.2.8.36911: Flags [.], seq 29989:31417, ack 1, win 4017, options [nop,nop,TS val 267601 ecr 43394,mptcp dss ack 2872732397 seq 408098663 subseq 29989 len 1428 csum 0x553e], length 1428
21:02:55.907455 IP 112.26.2.1.44903 > 112.26.2.8.36911: Flags [.], seq 29989:31417, ack 1, win 4017, options [nop,nop,TS val 267601 ecr 43394,mptcp dss ack 2872732397 seq 408098663 subseq 29989 len 1428 csum 0x553e], length 1428
21:02:55.975924 IP 112.26.2.8.36911 > 112.26.2.1.44903: Flags [.], ack 17137, win 12775, options [nop,nop,TS val 44291 ecr 265632,nop,nop,sack 2 {34273:41413}{31417:32845},mptcp dss ack 408037259], length 0
21:02:55.976210 IP 112.26.2.8.36911 > 112.26.2.1.44903: Flags [.], ack 17137, win 12775, options [nop,nop,TS val 44291 ecr 265632,nop,nop,sack 2 {34273:41413}{31417:32845},mptcp dss ack 408037259], length 0
21:02:56.046537 IP 112.26.2.8.36911 > 112.26.2.1.44903: Flags [.], ack 15709, win 11772, options [nop,nop,TS val 43584 ecr 263721,nop,nop,sack 2 {34273:35701}{31417:32845},mptcp dss ack 407991563], length 0
21:02:56.105772 IP 112.26.2.8.36911 > 112.26.2.1.44903: Flags [.], ack 29989, win 13049, options [nop,nop,TS val 44416 ecr 266130,nop,nop,sack 2 {34273:41413}{31417:32845},mptcp dss ack 408037259], length 0
21:02:56.106042 IP 112.26.2.8.36911 > 112.26.2.1.44903: Flags [.], ack 29989, win 13049, options [nop,nop,TS val 44416 ecr 266130,nop,nop,sack 2 {34273:41413}{31417:32845},mptcp dss ack 408037259], length 0
21:02:56.189418 IP 112.26.2.8.36911 > 112.26.2.1.44903: Flags [.], ack 29989, win 13140, options [nop,nop,TS val 44486 ecr 266130,nop,nop,sack 2 {42841:44269}{34273:41413},mptcp dss ack 408037259], length 0
21:02:56.189697 IP 112.26.2.8.36911 > 112.26.2.1.44903: Flags [.], ack 29989, win 13140, options [nop,nop,TS val 44486 ecr 266130,nop,nop,sack 2 {42841:44269}{34273:41413},mptcp dss ack 408037259], length 0
21:02:56.230639 IP 112.26.2.8.36911 > 112.26.2.1.44903: Flags [.], ack 15709, win 12000, options [nop,nop,TS val 43753 ecr 263721,nop,nop,sack 2 {34273:37129}{31417:32845},mptcp dss ack 407991563], length 0
21:02:56.253073 IP 112.26.2.1.44903 > 112.26.2.8.36911: Flags [.], seq 32845:34273, ack 1, win 4017, options [nop,nop,TS val 267939 ecr 43753,mptcp dss ack 2872732397 seq 408104375 subseq 32845 len 1428 csum 0x33bf], length 1428
21:02:56.253371 IP 112.26.2.1.44903 > 112.26.2.8.36911: Flags [.], seq 32845:34273, ack 1, win 4017, options [nop,nop,TS val 267939 ecr 43753,mptcp dss ack 2872732397 seq 408104375 subseq 32845 len 1428 csum 0x33bf], length 1428
21:02:56.336804 IP 112.26.2.8.36911 > 112.26.2.1.44903: Flags [.], ack 29989, win 13369, options [nop,nop,TS val 44651 ecr 266130,nop,nop,sack 2 {42841:45697}{34273:41413},mptcp dss ack 408058679], length 0
21:02:56.337151 IP 112.26.2.8.36911 > 112.26.2.1.44903: Flags [.], ack 29989, win 13369, options [nop,nop,TS val 44651 ecr 266130,nop,nop,sack 2 {42841:45697}{34273:41413},mptcp dss ack 408058679], length 0
21:02:56.416068 IP 112.26.2.8.36911 > 112.26.2.1.44903: Flags [.], ack 29989, win 13551, options [nop,nop,TS val 44730 ecr 266130,nop,nop,sack 2 {42841:47125}{34273:41413},mptcp dss ack 408058679], length 0
21:02:56.416351 IP 112.26.2.8.36911 > 112.26.2.1.44903: Flags [.], ack 29989, win 13551, options [nop,nop,TS val 44730 ecr 266130,nop,nop,sack 2 {42841:47125}{34273:41413},mptcp dss ack 408058679], length 0
21:02:56.489048 IP 112.26.2.8.36911 > 112.26.2.1.44903: Flags [.], ack 15709, win 12274, options [nop,nop,TS val 43970 ecr 263721,nop,nop,sack 2 {34273:38557}{31417:32845},mptcp dss ack 407991563], length 0
21:02:56.579867 IP 112.26.2.8.36911 > 112.26.2.1.44903: Flags [.], ack 15709, win 12410, options [nop,nop,TS val 44028 ecr 263721,nop,nop,sack 2 {34273:39985}{31417:32845},mptcp dss ack 407991563], length 0
21:02:56.654824 IP 112.26.2.1.44903 > 112.26.2.8.36911: Flags [.], seq 47125:48553, ack 1, win 4017, options [nop,nop,TS val 268223 ecr 43970,mptcp dss ack 2872732397 seq 408182915 subseq 47125 len 1428 csum 0x60a6], length 1428
21:02:56.655158 IP 112.26.2.1.44903 > 112.26.2.8.36911: Flags [.], seq 47125:48553, ack 1, win 4017, options [nop,nop,TS val 268223 ecr 43970,mptcp dss ack 2872732397 seq 408182915 subseq 47125 len 1428 csum 0x60a6], length 1428
21:02:56.691911 IP 112.26.2.8.36911 > 112.26.2.1.44903: Flags [.], ack 32845, win 13825, options [nop,nop,TS val 44990 ecr 267601,nop,nop,sack 2 {42841:47125}{34273:41413},mptcp dss ack 408058679], length 0
21:02:56.692265 IP 112.26.2.8.36911 > 112.26.2.1.44903: Flags [.], ack 32845, win 13825, options [nop,nop,TS val 44990 ecr 267601,nop,nop,sack 2 {42841:47125}{34273:41413},mptcp dss ack 408058679], length 0
21:02:56.750883 IP 112.26.2.8.36911 > 112.26.2.1.44903: Flags [.], ack 17137, win 12775, options [nop,nop,TS val 44291 ecr 265632,nop,nop,sack 2 {34273:41413}{31417:32845},mptcp dss ack 408037259], length 0
21:02:56.789999 IP 112.26.2.1.44903 > 112.26.2.8.36911: Flags [.], seq 41413:42841, ack 1, win 4017, options [nop,nop,TS val 268459 ecr 44291,mptcp dss ack 2872732397 seq 408132935 subseq 41413 len 1428 csum 0xad1b], length 1428
21:02:56.790336 IP 112.26.2.1.44903 > 112.26.2.8.36911: Flags [.], seq 41413:42841, ack 1, win 4017, options [nop,nop,TS val 268459 ecr 44291,mptcp dss ack 2872732397 seq 408132935 subseq 41413 len 1428 csum 0xad1b], length 1428
21:02:56.913541 IP 112.26.2.1.44903 > 112.26.2.8.36911: Flags [.], seq 48553:49981, ack 1, win 4017, options [nop,nop,TS val 268459 ecr 44291,mptcp dss ack 2872732397 seq 408194339 subseq 48553 len 1428 csum 0x11f1], length 1428
21:02:56.913870 IP 112.26.2.1.44903 > 112.26.2.8.36911: Flags [.], seq 48553:49981, ack 1, win 4017, options [nop,nop,TS val 268459 ecr 44291,mptcp dss ack 2872732397 seq 408194339 subseq 48553 len 1428 csum 0x11f1], length 1428
21:02:56.929142 IP 112.26.2.8.36911 > 112.26.2.1.44903: Flags [.], ack 29989, win 13049, options [nop,nop,TS val 44416 ecr 266130,nop,nop,sack 2 {34273:41413}{31417:32845},mptcp dss ack 408037259], length 0
21:02:57.055988 IP 112.26.2.1.44903 > 112.26.2.8.36911: Flags [.], seq 49981:51409, ack 1, win 4017, options [nop,nop,TS val 268637 ecr 44416,mptcp dss ack 2872732397 seq 408198623 subseq 49981 len 1428 csum 0x8fde], length 1428
21:02:57.056328 IP 112.26.2.1.44903 > 112.26.2.8.36911: Flags [.], seq 49981:51409, ack 1, win 4017, options [nop,nop,TS val 268637 ecr 44416,mptcp dss ack 2872732397 seq 408198623 subseq 49981 len 1428 csum 0x8fde], length 1428
21:02:57.084618 IP 112.26.2.8.36911 > 112.26.2.1.44903: Flags [.], ack 29989, win 13140, options [nop,nop,TS val 44486 ecr 266130,nop,nop,sack 2 {42841:44269}{34273:41413},mptcp dss ack 408037259], length 0
21:02:57.125869 IP 112.26.2.8.36911 > 112.26.2.1.44903: Flags [.], ack 41413, win 14144, options [nop,nop,TS val 45440 ecr 267939,nop,nop,sack 1 {42841:47125},mptcp dss ack 408058679], length 0
21:02:57.126172 IP 112.26.2.8.36911 > 112.26.2.1.44903: Flags [.], ack 41413, win 14144, options [nop,nop,TS val 45440 ecr 267939,nop,nop,sack 1 {42841:47125},mptcp dss ack 408058679], length 0
21:02:57.168363 IP 112.26.2.1.44903 > 112.26.2.8.36911: Flags [.], seq 51409:52837, ack 1, win 4017, options [nop,nop,TS val 268802 ecr 44486,mptcp dss ack 2872732397 seq 408204335 subseq 51409 len 1428 csum 0x8ad4], length 1428
21:02:57.168702 IP 112.26.2.1.44903 > 112.26.2.8.36911: Flags [.], seq 51409:52837, ack 1, win 4017, options [nop,nop,TS val 268802 ecr 44486,mptcp dss ack 2872732397 seq 408204335 subseq 51409 len 1428 csum 0x8ad4], length 1428
21:02:57.214931 IP 112.26.2.8.36911 > 112.26.2.1.44903: Flags [.], ack 29989, win 13369, options [nop,nop,TS val 44651 ecr 266130,nop,nop,sack 2 {42841:45697}{34273:41413},mptcp dss ack 408058679], length 0
21:02:57.277491 IP 112.26.2.1.44903 > 112.26.2.8.36911: Flags [.], seq 52837:54265, ack 1, win 4017, options [nop,nop,TS val 268946 ecr 44651,mptcp dss ack 2872732397 seq 408210047 subseq 52837 len 1428 csum 0x60a4], length 1428
21:02:57.277830 IP 112.26.2.1.44903 > 112.26.2.8.36911: Flags [.], seq 52837:54265, ack 1, win 4017, options [nop,nop,TS val 268946 ecr 44651,mptcp dss ack 2872732397 seq 408210047 subseq 52837 len 1428 csum 0x60a4], length 1428
21:02:57.345140 IP 112.26.2.8.36911 > 112.26.2.1.44903: Flags [.], ack 29989, win 13551, options [nop,nop,TS val 44730 ecr 266130,nop,nop,sack 2 {42841:47125}{34273:41413},mptcp dss ack 408058679], length 0
21:02:57.386787 IP 112.26.2.8.36911 > 112.26.2.1.44903: Flags [.], ack 41413, win 14372, options [nop,nop,TS val 45701 ecr 267939,nop,nop,sack 1 {42841:48553},mptcp dss ack 408058679], length 0
21:02:57.387089 IP 112.26.2.8.36911 > 112.26.2.1.44903: Flags [.], ack 41413, win 14372, options [nop,nop,TS val 45701 ecr 267939,nop,nop,sack 1 {42841:48553},mptcp dss ack 408058679], length 0
21:02:57.401850 IP 112.26.2.1.44903 > 112.26.2.8.36911: Flags [.], seq 54265:55693, ack 1, win 4017, options [nop,nop,TS val 269091 ecr 44730,mptcp dss ack 2872732397 seq 408227183 subseq 54265 len 1428 csum 0xacf8], length 1428
21:02:57.402192 IP 112.26.2.1.44903 > 112.26.2.8.36911: Flags [.], seq 54265:55693, ack 1, win 4017, options [nop,nop,TS val 269091 ecr 44730,mptcp dss ack 2872732397 seq 408227183 subseq 54265 len 1428 csum 0xacf8], length 1428
21:02:57.541459 IP 112.26.2.8.36911 > 112.26.2.1.44903: Flags [.], ack 32845, win 13825, options [nop,nop,TS val 44990 ecr 267601,nop,nop,sack 2 {42841:47125}{34273:41413},mptcp dss ack 408058679], length 0
21:02:57.557911 IP 112.26.2.1.44903 > 112.26.2.8.36911: Flags [.], seq 55693:57121, ack 1, win 4017, options [nop,nop,TS val 269250 ecr 44990,mptcp dss ack 2872732397 seq 408232895 subseq 55693 len 1428 csum 0x4c1d], length 1428
21:02:57.558217 IP 112.26.2.1.44903 > 112.26.2.8.36911: Flags [.], seq 55693:57121, ack 1, win 4017, options [nop,nop,TS val 269250 ecr 44990,mptcp dss ack 2872732397 seq 408232895 subseq 55693 len 1428 csum 0x4c1d], length 1428
21:02:57.649580 IP 112.26.2.8.36911 > 112.26.2.1.44903: Flags [.], ack 48553, win 14692, options [nop,nop,TS val 45963 ecr 268459,mptcp dss ack 408058679], length 0
21:02:57.649901 IP 112.26.2.8.36911 > 112.26.2.1.44903: Flags [.], ack 48553, win 14692, options [nop,nop,TS val 45963 ecr 268459,mptcp dss ack 408058679], length 0
21:02:57.728126 IP 112.26.2.8.36911 > 112.26.2.1.44903: Flags [.], ack 49981, win 14829, options [nop,nop,TS val 46034 ecr 268459,mptcp dss ack 408058679], length 0
21:02:57.728400 IP 112.26.2.8.36911 > 112.26.2.1.44903: Flags [.], ack 49981, win 14829, options [nop,nop,TS val 46034 ecr 268459,mptcp dss ack 408058679], length 0
21:02:57.808075 IP 112.26.2.8.36911 > 112.26.2.1.44903: Flags [.], ack 51409, win 15011, options [nop,nop,TS val 46122 ecr 268637,mptcp dss ack 408058679], length 0
