21:02:50.669665 IP 112.26.3.8.33629 > 112.26.3.1.44903: Flags [S], seq 3971283100, win 65535, options [mss 1460,sackOK,TS val 38902 ecr 0,nop,wscale 6,mptcp join id 6 token 0x7fa57e4e nonce 0xc247ffbd], length 0
21:02:50.742393 IP 112.26.3.8.33629 > 112.26.3.1.44903: Flags [S], seq 3971283100, win 65535, options [mss 1460,sackOK,TS val 38902 ecr 0,nop,wscale 6,mptcp join id 6 token 0x7fa57e4e nonce 0xc247ffbd], length 0
21:02:50.780410 IP 112.26.3.1.44903 > 112.26.3.8.33629: Flags [S.], seq 2159510627, ack 3971283101, win 65535, options [mss 1460,sackOK,TS val 262453 ecr 38902,nop,wscale 6,mptcp join id 5 hmac 0xe7ece21ed53d2c0b nonce 0xd823ce4a], length 0
21:02:50.899695 IP 112.26.3.1.44903 > 112.26.3.8.33629: Flags [S.], seq 2159510627, ack 3971283101, win 65535, options [mss 1460,sackOK,TS val 262453 ecr 38902,nop,wscale 6,mptcp join id 5 hmac 0xe7ece21ed53d2c0b nonce 0xd823ce4a], length 0
21:02:50.953744 IP 112.26.3.1.44903 > 112.26.3.8.33629: Flags [S.], seq 2159510627, ack 3971283101, win 65535, options [mss 1460,sackOK,TS val 262453 ecr 38902,nop,wscale 6,mptcp join id 5 hmac 0xe7ece21ed53d2c0b nonce 0xd823ce4a], length 0
21:02:51.066132 IP 112.26.3.8.33629 > 112.26.3.1.44903: Flags [.], ack 1, win 7072, options [nop,nop,TS val 39271 ecr 262453,mptcp join hmac 0xe3cc2e5246ed467bceebf989319b635bc71aea97], length 0
21:02:51.066371 IP 112.26.3.8.33629 > 112.26.3.1.44903: Flags [.], ack 1, win 7072, options [nop,nop,TS val 39271 ecr 262453,mptcp join hmac 0xe3cc2e5246ed467bceebf989319b635bc71aea97], length 0
21:02:51.076104 IP 112.26.3.1.44903 > 112.26.3.8.33629: Flags [.], ack 1, win 4017, options [nop,nop,TS val 262776 ecr 39271,mptcp dss ack 2872732397], length 0
21:02:51.078815 IP 112.26.3.1.44903 > 112.26.3.8.33629: Flags [.], ack 1, win 4017, options [nop,nop,TS val 262776 ecr 39271,mptcp dss ack 2872732397], length 0
21:02:51.082616 IP 112.26.3.1.44903 > 112.26.3.8.33629: Flags [.], ack 1, win 4017, options [nop,nop,TS val 262776 ecr 39271,mptcp dss ack 2872732397], length 0
21:02:51.137262 IP 112.26.3.1.44903 > 112.26.3.8.33629: Flags [.], seq 1:1429, ack 1, win 4017, options [nop,nop,TS val 262843 ecr 39271,mptcp dss ack 2872732397 seq 408010127 subseq 1 len 1428 csum 0xe19b], length 1428
21:02:51.139122 IP 112.26.3.1.44903 > 112.26.3.8.33629: Flags [.], seq 1:1429, ack 1, win 4017, options [nop,nop,TS val 262843 ecr 39271,mptcp dss ack 2872732397 seq 408010127 subseq 1 len 1428 csum 0xe19b], length 1428
21:02:51.147168 IP 112.26.3.1.44903 > 112.26.3.8.33629: Flags [.], seq 1:1429, ack 1, win 4017, options [nop,nop,TS val 262843 ecr 39271,mptcp dss ack 2872732397 seq 408010127 subseq 1 len 1428 csum 0xe19b], length 1428
21:02:51.232688 IP 112.26.3.8.33629 > 112.26.3.1.44903: Flags [.], ack 1429, win 7209, options [nop,nop,TS val 39459 ecr 262843,mptcp dss ack 407967287], length 0
21:02:51.232929 IP 112.26.3.8.33629 > 112.26.3.1.44903: Flags [.], ack 1429, win 7209, options [nop,nop,TS val 39459 ecr 262843,mptcp dss ack 407967287], length 0
21:02:51.247364 IP 112.26.3.1.44903 > 112.26.3.8.33629: Flags [.], seq 1429:2857, ack 1, win 4017, options [nop,nop,TS val 262843 ecr 39271,mptcp dss ack 2872732397 seq 408011555 subseq 1429 len 1428 csum 0xce77], length 1428
21:02:51.340374 IP 112.26.3.1.44903 > 112.26.3.8.33629: Flags [.], seq 2857:4285, ack 1, win 4017, options [nop,nop,TS val 262843 ecr 39271,mptcp dss ack 2872732397 seq 408012983 subseq 2857 len 1428 csum 0x7e92], length 1428
21:02:51.393826 IP 112.26.3.1.44903 > 112.26.3.8.33629: Flags [.], seq 1429:2857, ack 1, win 4017, options [nop,nop,TS val 262843 ecr 39271,mptcp dss ack 2872732397 seq 408011555 subseq 1429 len 1428 csum 0xce77], length 1428
21:02:51.397233 IP 112.26.3.1.44903 > 112.26.3.8.33629: Flags [.], seq 1429:2857, ack 1, win 4017, options [nop,nop,TS val 262843 ecr 39271,mptcp dss ack 2872732397 seq 408011555 subseq 1429 len 1428 csum 0xce77], length 1428
21:02:51.447485 IP 112.26.3.1.44903 > 112.26.3.8.33629: Flags [.], seq 4285:5713, ack 1, win 4017, options [nop,nop,TS val 262943 ecr 39271,mptcp dss ack 2872732397 seq 408015839 subseq 4285 len 1428 csum 0x1424], length 1428
21:02:51.463957 IP 112.26.3.1.44903 > 112.26.3.8.33629: Flags [.], seq 2857:4285, ack 1, win 4017, options [nop,nop,TS val 262843 ecr 39271,mptcp dss ack 2872732397 seq 408012983 subseq 2857 len 1428 csum 0x7e92], length 1428
21:02:51.474351 IP 112.26.3.8.33629 > 112.26.3.1.44903: Flags [.], ack 2857, win 7483, options [nop,nop,TS val 39713 ecr 262843,mptcp dss ack 407970143], length 0
21:02:51.474590 IP 112.26.3.8.33629 > 112.26.3.1.44903: Flags [.], ack 2857, win 7483, options [nop,nop,TS val 39713 ecr 262843,mptcp dss ack 407970143], length 0
21:02:51.524471 IP 112.26.3.1.44903 > 112.26.3.8.33629: Flags [.], seq 2857:4285, ack 1, win 4017, options [nop,nop,TS val 262843 ecr 39271,mptcp dss ack 2872732397 seq 408012983 subseq 2857 len 1428 csum 0x7e92], length 1428
21:02:51.539697 IP 112.26.3.1.44903 > 112.26.3.8.33629: Flags [.], seq 5713:7141, ack 1, win 4017, options [nop,nop,TS val 262943 ecr 39271,mptcp dss ack 2872732397 seq 408017267 subseq 5713 len 1428 csum 0x946d], length 1428
21:02:51.617229 IP 112.26.3.1.44903 > 112.26.3.8.33629: Flags [.], seq 7141:8569, ack 1, win 4017, options [nop,nop,TS val 262944 ecr 39459,mptcp dss ack 2872732397 seq 408018695 subseq 7141 len 1428 csum 0x76a2], length 1428
21:02:51.624589 IP 112.26.3.8.33629 > 112.26.3.1.44903: Flags [.], ack 4285, win 7574, options [nop,nop,TS val 39840 ecr 262843,mptcp dss ack 407971571], length 0
21:02:51.624876 IP 112.26.3.8.33629 > 112.26.3.1.44903: Flags [.], ack 4285, win 7574, options [nop,nop,TS val 39840 ecr 262843,mptcp dss ack 407971571], length 0
21:02:51.709979 IP 112.26.3.1.44903 > 112.26.3.8.33629: Flags [.], seq 8569:9997, ack 1, win 4017, options [nop,nop,TS val 262944 ecr 39459,mptcp dss ack 2872732397 seq 408020123 subseq 8569 len 1428 csum 0x5681], length 1428
21:02:51.719097 IP 112.26.3.1.44903 > 112.26.3.8.33629: Flags [.], seq 4285:5713, ack 1, win 4017, options [nop,nop,TS val 262943 ecr 39271,mptcp dss ack 2872732397 seq 408015839 subseq 4285 len 1428 csum 0x1424], length 1428
21:02:51.752338 IP 112.26.3.1.44903 > 112.26.3.8.33629: Flags [.], seq 4285:5713, ack 1, win 4017, options [nop,nop,TS val 262943 ecr 39271,mptcp dss ack 2872732397 seq 408015839 subseq 4285 len 1428 csum 0x1424], length 1428
21:02:51.794802 IP 112.26.3.1.44903 > 112.26.3.8.33629: Flags [.], seq 9997:11425, ack 1, win 4017, options [nop,nop,TS val 262944 ecr 39459,mptcp dss ack 2872732397 seq 408021551 subseq 9997 len 1428 csum 0x479f], length 1428
21:02:51.826540 IP 112.26.3.1.44903 > 112.26.3.8.33629: Flags [.], seq 5713:7141, ack 1, win 4017, options [nop,nop,TS val 262943 ecr 39271,mptcp dss ack 2872732397 seq 408017267 subseq 5713 len 1428 csum 0x946d], length 1428
21:02:51.841454 IP 112.26.3.1.44903 > 112.26.3.8.33629: Flags [.], seq 5713:7141, ack 1, win 4017, options [nop,nop,TS val 262943 ecr 39271,mptcp dss ack 2872732397 seq 408017267 subseq 5713 len 1428 csum 0x946d], length 1428
21:02:51.874519 IP 112.26.3.1.44903 > 112.26.3.8.33629: Flags [.], seq 11425:12853, ack 1, win 4017, options [nop,nop,TS val 262944 ecr 39459,mptcp dss ack 2872732397 seq 408022979 subseq 11425 len 1428 csum 0x880c], length 1428
21:02:51.886970 IP 112.26.3.8.33629 > 112.26.3.1.44903: Flags [.], ack 5713, win 7757, options [nop,nop,TS val 40040 ecr 262943,mptcp dss ack 407972999], length 0
21:02:51.887260 IP 112.26.3.8.33629 > 112.26.3.1.44903: Flags [.], ack 5713, win 7757, options [nop,nop,TS val 40040 ecr 262943,mptcp dss ack 407972999], length 0
21:02:51.940812 IP 112.26.3.8.33629 > 112.26.3.1.44903: Flags [.], ack 7141, win 7894, options [nop,nop,TS val 40149 ecr 262943,mptcp dss ack 407974427], length 0
21:02:51.941116 IP 112.26.3.8.33629 > 112.26.3.1.44903: Flags [.], ack 7141, win 7894, options [nop,nop,TS val 40149 ecr 262943,mptcp dss ack 407974427], length 0
21:02:51.955390 IP 112.26.3.1.44903 > 112.26.3.8.33629: Flags [.], seq 12853:14281, ack 1, win 4017, options [nop,nop,TS val 262944 ecr 39459,mptcp dss ack 2872732397 seq 408024407 subseq 12853 len 1428 csum 0x2e44], length 1428
21:02:52.016287 IP 112.26.3.1.44903 > 112.26.3.8.33629: Flags [.], seq 7141:8569, ack 1, win 4017, options [nop,nop,TS val 262944 ecr 39459,mptcp dss ack 2872732397 seq 408018695 subseq 7141 len 1428 csum 0x76a2], length 1428
21:02:52.034290 IP 112.26.3.1.44903 > 112.26.3.8.33629: Flags [.], seq 7141:8569, ack 1, win 4017, options [nop,nop,TS val 262944 ecr 39459,mptcp dss ack 2872732397 seq 408018695 subseq 7141 len 1428 csum 0x76a2], length 1428
21:02:52.044032 IP 112.26.3.1.44903 > 112.26.3.8.33629: Flags [.], seq 14281:15709, ack 1, win 4017, options [nop,nop,TS val 262944 ecr 39459,mptcp dss ack 2872732397 seq 408025835 subseq 14281 len 1428 csum 0x7fe1], length 1428
21:02:52.076719 IP 112.26.3.8.33629 > 112.26.3.1.44903: Flags [.], ack 8569, win 8167, options [nop,nop,TS val 40338 ecr 262944,mptcp dss ack 407977283], length 0
21:02:52.076969 IP 112.26.3.8.33629 > 112.26.3.1.44903: Flags [.], ack 8569, win 8167, options [nop,nop,TS val 40338 ecr 262944,mptcp dss ack 407977283], length 0
21:02:52.104163 IP 112.26.3.1.44903 > 112.26.3.8.33629: Flags [.], seq 8569:9997, ack 1, win 4017, options [nop,nop,TS val 262944 ecr 39459,mptcp dss ack 2872732397 seq 408020123 subseq 8569 len 1428 csum 0x5681], length 1428
21:02:52.138323 IP 112.26.3.1.44903 > 112.26.3.8.33629: Flags [.], seq 8569:9997, ack 1, win 4017, options [nop,nop,TS val 262944 ecr 39459,mptcp dss ack 2872732397 seq 408020123 subseq 8569 len 1428 csum 0x5681], length 1428
21:02:52.164780 IP 112.26.3.8.33629 > 112.26.3.1.44903: Flags [.], ack 9997, win 8304, options [nop,nop,TS val 40443 ecr 262944,mptcp dss ack 407985851], length 0
21:02:52.165030 IP 112.26.3.8.33629 > 112.26.3.1.44903: Flags [.], ack 9997, win 8304, options [nop,nop,TS val 40443 ecr 262944,mptcp dss ack 407985851], length 0
21:02:52.178208 IP 112.26.3.1.44903 > 112.26.3.8.33629: Flags [.], seq 15709:17137, ack 1, win 4017, options [nop,nop,TS val 263184 ecr 39713,mptcp dss ack 2872732397 seq 408032975 subseq 15709 len 1428 csum 0xa833], length 1428
21:02:52.232346 IP 112.26.3.1.44903 > 112.26.3.8.33629: Flags [.], seq 17137:18565, ack 1, win 4017, options [nop,nop,TS val 263184 ecr 39713,mptcp dss ack 2872732397 seq 408034403 subseq 17137 len 1428 csum 0x2184], length 1428
21:02:52.320648 IP 112.26.3.1.44903 > 112.26.3.8.33629: Flags [.], seq 18565:19993, ack 1, win 4017, options [nop,nop,TS val 263340 ecr 39840,mptcp dss ack 2872732397 seq 408035831 subseq 18565 len 1428 csum 0x224e], length 1428
21:02:52.327251 IP 112.26.3.1.44903 > 112.26.3.8.33629: Flags [.], seq 9997:11425, ack 1, win 4017, options [nop,nop,TS val 262944 ecr 39459,mptcp dss ack 2872732397 seq 408021551 subseq 9997 len 1428 csum 0x479f], length 1428
21:02:52.339069 IP 112.26.3.8.33629 > 112.26.3.1.44903: Flags [.], ack 11425, win 8532, options [nop,nop,TS val 40649 ecr 262944,mptcp dss ack 407988707], length 0
21:02:52.339362 IP 112.26.3.8.33629 > 112.26.3.1.44903: Flags [.], ack 11425, win 8532, options [nop,nop,TS val 40649 ecr 262944,mptcp dss ack 407988707], length 0
21:02:52.360203 IP 112.26.3.1.44903 > 112.26.3.8.33629: Flags [.], seq 19993:21421, ack 1, win 4017, options [nop,nop,TS val 263340 ecr 39840,mptcp dss ack 2872732397 seq 408037259 subseq 19993 len 1428 csum 0x4620], length 1428
21:02:52.389498 IP 112.26.3.1.44903 > 112.26.3.8.33629: Flags [.], seq 9997:11425, ack 1, win 4017, options [nop,nop,TS val 262944 ecr 39459,mptcp dss ack 2872732397 seq 408021551 subseq 9997 len 1428 csum 0x479f], length 1428
21:02:52.454162 IP 112.26.3.1.44903 > 112.26.3.8.33629: Flags [.], seq 21421:22849, ack 1, win 4017, options [nop,nop,TS val 263598 ecr 40040,mptcp dss ack 2872732397 seq 408047255 subseq 21421 len 1428 csum 0x5250], length 1428
21:02:52.502208 IP 112.26.3.1.44903 > 112.26.3.8.33629: Flags [.], seq 11425:12853, ack 1, win 4017, options [nop,nop,TS val 262944 ecr 39459,mptcp dss ack 2872732397 seq 408022979 subseq 11425 len 1428 csum 0x880c], length 1428
21:02:52.505447 IP 112.26.3.1.44903 > 112.26.3.8.33629: Flags [.], seq 11425:12853, ack 1, win 4017, options [nop,nop,TS val 262944 ecr 39459,mptcp dss ack 2872732397 seq 408022979 subseq 11425 len 1428 csum 0x880c], length 1428
21:02:52.545960 IP 112.26.3.1.44903 > 112.26.3.8.33629: Flags [.], seq 22849:24277, ack 1, win 4017, options [nop,nop,TS val 263598 ecr 40040,mptcp dss ack 2872732397 seq 408048683 subseq 22849 len 1428 csum 0x2f20], length 1428
21:02:52.587067 IP 112.26.3.8.33629 > 112.26.3.1.44903: Flags [.], ack 12853, win 8806, options [nop,nop,TS val 40821 ecr 262944,mptcp dss ack 407991563], length 0
21:02:52.587329 IP 112.26.3.8.33629 > 112.26.3.1.44903: Flags [.], ack 12853, win 8806, options [nop,nop,TS val 40821 ecr 262944,mptcp dss ack 407991563], length 0
21:02:52.610241 IP 112.26.3.1.44903 > 112.26.3.8.33629: Flags [.], seq 24277:25705, ack 1, win 4017, options [nop,nop,TS val 263689 ecr 40149,mptcp dss ack 2872732397 seq 408051539 subseq 24277 len 1428 csum 0x5055], length 1428
21:02:52.654960 IP 112.26.3.1.44903 > 112.26.3.8.33629: Flags [.], seq 12853:14281, ack 1, win 4017, options [nop,nop,TS val 262944 ecr 39459,mptcp dss ack 2872732397 seq 408024407 subseq 12853 len 1428 csum 0x2e44], length 1428
21:02:52.664370 IP 112.26.3.1.44903 > 112.26.3.8.33629: Flags [.], seq 12853:14281, ack 1, win 4017, options [nop,nop,TS val 262944 ecr 39459,mptcp dss ack 2872732397 seq 408024407 subseq 12853 len 1428 csum 0x2e44], length 1428
21:02:52.696387 IP 112.26.3.8.33629 > 112.26.3.1.44903: Flags [.], ack 14281, win 8943, options [nop,nop,TS val 40980 ecr 262944,mptcp dss ack 407991563], length 0
21:02:52.696669 IP 112.26.3.8.33629 > 112.26.3.1.44903: Flags [.], ack 14281, win 8943, options [nop,nop,TS val 40980 ecr 262944,mptcp dss ack 407991563], length 0
21:02:52.735371 IP 112.26.3.1.44903 > 112.26.3.8.33629: Flags [.], seq 25705:27133, ack 1, win 4017, options [nop,nop,TS val 263689 ecr 40149,mptcp dss ack 2872732397 seq 408052967 subseq 25705 len 1428 csum 0x780b], length 1428
21:02:52.786613 IP 112.26.3.1.44903 > 112.26.3.8.33629: Flags [.], seq 14281:15709, ack 1, win 4017, options [nop,nop,TS val 262944 ecr 39459,mptcp dss ack 2872732397 seq 408025835 subseq 14281 len 1428 csum 0x7fe1], length 1428
21:02:52.790018 IP 112.26.3.1.44903 > 112.26.3.8.33629: Flags [.], seq 14281:15709, ack 1, win 4017, options [nop,nop,TS val 262944 ecr 39459,mptcp dss ack 2872732397 seq 408025835 subseq 14281 len 1428 csum 0x7fe1], length 1428
21:02:52.834641 IP 112.26.3.8.33629 > 112.26.3.1.44903: Flags [.], ack 15709, win 9080, options [nop,nop,TS val 41106 ecr 262944,mptcp dss ack 407991563], length 0
21:02:52.834924 IP 112.26.3.8.33629 > 112.26.3.1.44903: Flags [.], ack 15709, win 9080, options [nop,nop,TS val 41106 ecr 262944,mptcp dss ack 407991563], length 0
21:02:52.903816 IP 112.26.3.1.44903 > 112.26.3.8.33629: Flags [.], seq 27133:28561, ack 1, win 4017, options [nop,nop,TS val 263853 ecr 40338,mptcp dss ack 2872732397 seq 407982995 subseq 27133 len 1428 csum 0xd681], length 1428
21:02:52.906346 IP 112.26.3.1.44903 > 112.26.3.8.33629: Flags [.], seq 28561:29989, ack 1, win 4017, options [nop,nop,TS val 263853 ecr 40338,mptcp dss ack 2872732397 seq 407984423 subseq 28561 len 1428 csum 0xfa42], length 1428
21:02:52.946823 IP 112.26.3.1.44903 > 112.26.3.8.33629: Flags [.], seq 15709:17137, ack 1, win 4017, options [nop,nop,TS val 263184 ecr 39713,mptcp dss ack 2872732397 seq 408032975 subseq 15709 len 1428 csum 0xa833], length 1428
21:02:52.963669 IP 112.26.3.8.33629 > 112.26.3.1.44903: Flags [.], ack 17137, win 9262, options [nop,nop,TS val 41270 ecr 263184,mptcp dss ack 407991563], length 0
21:02:52.963944 IP 112.26.3.8.33629 > 112.26.3.1.44903: Flags [.], ack 17137, win 9262, options [nop,nop,TS val 41270 ecr 263184,mptcp dss ack 407991563], length 0
21:02:52.968424 IP 112.26.3.1.44903 > 112.26.3.8.33629: Flags [.], seq 15709:17137, ack 1, win 4017, options [nop,nop,TS val 263184 ecr 39713,mptcp dss ack 2872732397 seq 408032975 subseq 15709 len 1428 csum 0xa833], length 1428
21:02:53.014021 IP 112.26.3.1.44903 > 112.26.3.8.33629: Flags [.], seq 29989:31417, ack 1, win 4017, options [nop,nop,TS val 263981 ecr 40443,mptcp dss ack 2872732397 seq 407985851 subseq 29989 len 1428 csum 0x28be], length 1428
21:02:53.073652 IP 112.26.3.1.44903 > 112.26.3.8.33629: Flags [.], seq 17137:18565, ack 1, win 4017, options [nop,nop,TS val 263184 ecr 39713,mptcp dss ack 2872732397 seq 408034403 subseq 17137 len 1428 csum 0x2184], length 1428
21:02:53.105999 IP 112.26.3.1.44903 > 112.26.3.8.33629: Flags [.], seq 17137:18565, ack 1, win 4017, options [nop,nop,TS val 263184 ecr 39713,mptcp dss ack 2872732397 seq 408034403 subseq 17137 len 1428 csum 0x2184], length 1428
21:02:53.108810 IP 112.26.3.1.44903 > 112.26.3.8.33629: Flags [.], seq 31417:32845, ack 1, win 4017, options [nop,nop,TS val 263981 ecr 40443,mptcp dss ack 2872732397 seq 407987279 subseq 31417 len 1428 csum 0xdb46], length 1428
21:02:53.114770 IP 112.26.3.8.33629 > 112.26.3.1.44903: Flags [.], ack 18565, win 9354, options [nop,nop,TS val 41403 ecr 263184,mptcp dss ack 407991563], length 0
21:02:53.115020 IP 112.26.3.8.33629 > 112.26.3.1.44903: Flags [.], ack 18565, win 9354, options [nop,nop,TS val 41403 ecr 263184,mptcp dss ack 407991563], length 0
21:02:53.193197 IP 112.26.3.1.44903 > 112.26.3.8.33629: Flags [.], seq 32845:34273, ack 1, win 4017, options [nop,nop,TS val 264113 ecr 40649,mptcp dss ack 2872732397 seq 408042971 subseq 32845 len 1428 csum 0xb869], length 1428
21:02:53.204459 IP 112.26.3.1.44903 > 112.26.3.8.33629: Flags [.], seq 18565:19993, ack 1, win 4017, options [nop,nop,TS val 263340 ecr 39840,mptcp dss ack 2872732397 seq 408035831 subseq 18565 len 1428 csum 0x224e], length 1428
21:02:53.211643 IP 112.26.3.1.44903 > 112.26.3.8.33629: Flags [.], seq 18565:19993, ack 1, win 4017, options [nop,nop,TS val 263340 ecr 39840,mptcp dss ack 2872732397 seq 408035831 subseq 18565 len 1428 csum 0x224e], length 1428
21:02:53.254202 IP 112.26.3.8.33629 > 112.26.3.1.44903: Flags [.], ack 19993, win 9445, options [nop,nop,TS val 41525 ecr 263340,mptcp dss ack 407991563], length 0
21:02:53.254486 IP 112.26.3.8.33629 > 112.26.3.1.44903: Flags [.], ack 19993, win 9445, options [nop,nop,TS val 41525 ecr 263340,mptcp dss ack 407991563], length 0
21:02:53.285704 IP 112.26.3.1.44903 > 112.26.3.8.33629: Flags [.], seq 34273:35701, ack 1, win 4017, options [nop,nop,TS val 264113 ecr 40649,mptcp dss ack 2872732397 seq 408044399 subseq 34273 len 1428 csum 0x7c8a], length 1428
21:02:53.398625 IP 112.26.3.1.44903 > 112.26.3.8.33629: Flags [.], seq 35701:37129, ack 1, win 4017, options [nop,nop,TS val 264297 ecr 40821,mptcp dss ack 2872732397 seq 408061535 subseq 35701 len 1428 csum 0xbb78], length 1428
21:02:53.448837 IP 112.26.3.1.44903 > 112.26.3.8.33629: Flags [.], seq 22849:24277, ack 1, win 4017, options [nop,nop,TS val 263598 ecr 40040,mptcp dss ack 2872732397 seq 408048683 subseq 22849 len 1428 csum 0x2f20], length 1428
21:02:53.452366 IP 112.26.3.1.44903 > 112.26.3.8.33629: Flags [.], seq 22849:24277, ack 1, win 4017, options [nop,nop,TS val 263598 ecr 40040,mptcp dss ack 2872732397 seq 408048683 subseq 22849 len 1428 csum 0x2f20], length 1428
21:02:53.464472 IP 112.26.3.8.33629 > 112.26.3.1.44903: Flags [.], ack 19993, win 9673, options [nop,nop,TS val 41769 ecr 263340,nop,nop,sack 1 {22849:24277},mptcp dss ack 407991563], length 0
21:02:53.464765 IP 112.26.3.8.33629 > 112.26.3.1.44903: Flags [.], ack 19993, win 9673, options [nop,nop,TS val 41769 ecr 263340,nop,nop,sack 1 {22849:24277},mptcp dss ack 407991563], length 0
21:02:53.478896 IP 112.26.3.1.44903 > 112.26.3.8.33629: Flags [.], seq 37129:38557, ack 1, win 4017, options [nop,nop,TS val 264297 ecr 40821,mptcp dss ack 2872732397 seq 408062963 subseq 37129 len 1428 csum 0x6470], length 1428
21:02:53.568185 IP 112.26.3.1.44903 > 112.26.3.8.33629: Flags [.], seq 25705:27133, ack 1, win 4017, options [nop,nop,TS val 263689 ecr 40149,mptcp dss ack 2872732397 seq 408052967 subseq 25705 len 1428 csum 0x780b], length 1428
21:02:53.597925 IP 112.26.3.8.33629 > 112.26.3.1.44903: Flags [.], ack 19993, win 9855, options [nop,nop,TS val 41909 ecr 263340,nop,nop,sack 2 {25705:27133}{22849:24277},mptcp dss ack 407991563], length 0
21:02:53.598236 IP 112.26.3.8.33629 > 112.26.3.1.44903: Flags [.], ack 19993, win 9855, options [nop,nop,TS val 41909 ecr 263340,nop,nop,sack 2 {25705:27133}{22849:24277},mptcp dss ack 407991563], length 0
21:02:53.602669 IP 112.26.3.1.44903 > 112.26.3.8.33629: Flags [.], seq 38557:39985, ack 1, win 4017, options [nop,nop,TS val 264407 ecr 40980,mptcp dss ack 2872732397 seq 408068675 subseq 38557 len 1428 csum 0xc425], length 1428
21:02:53.641554 IP 112.26.3.1.44903 > 112.26.3.8.33629: Flags [.], seq 25705:27133, ack 1, win 4017, options [nop,nop,TS val 263689 ecr 40149,mptcp dss ack 2872732397 seq 408052967 subseq 25705 len 1428 csum 0x780b], length 1428
21:02:53.707902 IP 112.26.3.1.44903 > 112.26.3.8.33629: Flags [.], seq 41413:42841, ack 1, win 4017, options [nop,nop,TS val 264594 ecr 41106,mptcp dss ack 2872732397 seq 408088667 subseq 41413 len 1428 csum 0x1318], length 1428
21:02:53.724186 IP 112.26.3.1.44903 > 112.26.3.8.33629: Flags [.], seq 27133:28561, ack 1, win 4017, options [nop,nop,TS val 263853 ecr 40338,mptcp dss ack 2872732397 seq 407982995 subseq 27133 len 1428 csum 0xd681], length 1428
21:02:53.734521 IP 112.26.3.1.44903 > 112.26.3.8.33629: Flags [.], seq 27133:28561, ack 1, win 4017, options [nop,nop,TS val 263853 ecr 40338,mptcp dss ack 2872732397 seq 407982995 subseq 27133 len 1428 csum 0xd681], length 1428
21:02:53.742323 IP 112.26.3.8.33629 > 112.26.3.1.44903: Flags [.], ack 19993, win 9992, options [nop,nop,TS val 42051 ecr 263340,nop,nop,sack 2 {25705:28561}{22849:24277},mptcp dss ack 407991563], length 0
21:02:53.742609 IP 112.26.3.8.33629 > 112.26.3.1.44903: Flags [.], ack 19993, win 9992, options [nop,nop,TS val 42051 ecr 263340,nop,nop,sack 2 {25705:28561}{22849:24277},mptcp dss ack 407991563], length 0
21:02:53.790318 IP 112.26.3.1.44903 > 112.26.3.8.33629: Flags [.], seq 28561:29989, ack 1, win 4017, options [nop,nop,TS val 263853 ecr 40338,mptcp dss ack 2872732397 seq 407984423 subseq 28561 len 1428 csum 0xfa42], length 1428
21:02:53.828708 IP 112.26.3.1.44903 > 112.26.3.8.33629: Flags [.], seq 44269:45697, ack 1, win 4017, options [nop,nop,TS val 264737 ecr 41270,mptcp dss ack 2872732397 seq 408100091 subseq 44269 len 1428 csum 0xa395], length 1428
21:02:53.853655 IP 112.26.3.1.44903 > 112.26.3.8.33629: Flags [.], seq 28561:29989, ack 1, win 4017, options [nop,nop,TS val 263853 ecr 40338,mptcp dss ack 2872732397 seq 407984423 subseq 28561 len 1428 csum 0xfa42], length 1428
21:02:53.929014 IP 112.26.3.1.44903 > 112.26.3.8.33629: Flags [.], seq 29989:31417, ack 1, win 4017, options [nop,nop,TS val 263981 ecr 40443,mptcp dss ack 2872732397 seq 407985851 subseq 29989 len 1428 csum 0x28be], length 1428
21:02:53.972675 IP 112.26.3.8.33629 > 112.26.3.1.44903: Flags [.], ack 19993, win 10175, options [nop,nop,TS val 42170 ecr 263340,nop,nop,sack 2 {25705:29989}{22849:24277},mptcp dss ack 407991563], length 0
21:02:53.972956 IP 112.26.3.8.33629 > 112.26.3.1.44903: Flags [.], ack 19993, win 10175, options [nop,nop,TS val 42170 ecr 263340,nop,nop,sack 2 {25705:29989}{22849:24277},mptcp dss ack 407991563], length 0
21:02:53.978550 IP 112.26.3.1.44903 > 112.26.3.8.33629: Flags [.], seq 47125:48553, ack 1, win 4017, options [nop,nop,TS val 264872 ecr 41403,mptcp dss ack 2872732397 seq 408114371 subseq 47125 len 1428 csum 0xbb79], length 1428
21:02:53.982124 IP 112.26.3.1.44903 > 112.26.3.8.33629: Flags [.], seq 29989:31417, ack 1, win 4017, options [nop,nop,TS val 263981 ecr 40443,mptcp dss ack 2872732397 seq 407985851 subseq 29989 len 1428 csum 0x28be], length 1428
21:02:54.017392 IP 112.26.3.1.44903 > 112.26.3.8.33629: Flags [.], seq 31417:32845, ack 1, win 4017, options [nop,nop,TS val 263981 ecr 40443,mptcp dss ack 2872732397 seq 407987279 subseq 31417 len 1428 csum 0xdb46], length 1428
21:02:54.067166 IP 112.26.3.1.44903 > 112.26.3.8.33629: Flags [.], seq 48553:49981, ack 1, win 4017, options [nop,nop,TS val 264872 ecr 41403,mptcp dss ack 2872732397 seq 408115799 subseq 48553 len 1428 csum 0x54b5], length 1428
21:02:54.098015 IP 112.26.3.1.44903 > 112.26.3.8.33629: Flags [.], seq 32845:34273, ack 1, win 4017, options [nop,nop,TS val 264113 ecr 40649,mptcp dss ack 2872732397 seq 408042971 subseq 32845 len 1428 csum 0xb869], length 1428
21:02:54.122225 IP 112.26.3.1.44903 > 112.26.3.8.33629: Flags [.], seq 31417:32845, ack 1, win 4017, options [nop,nop,TS val 263981 ecr 40443,mptcp dss ack 2872732397 seq 407987279 subseq 31417 len 1428 csum 0xdb46], length 1428
21:02:54.128372 IP 112.26.3.8.33629 > 112.26.3.1.44903: Flags [.], ack 19993, win 10312, options [nop,nop,TS val 42279 ecr 263340,nop,nop,sack 2 {25705:31417}{22849:24277},mptcp dss ack 407991563], length 0
21:02:54.128581 IP 112.26.3.8.33629 > 112.26.3.1.44903: Flags [.], ack 19993, win 10312, options [nop,nop,TS val 42279 ecr 263340,nop,nop,sack 2 {25705:31417}{22849:24277},mptcp dss ack 407991563], length 0
21:02:54.171462 IP 112.26.3.1.44903 > 112.26.3.8.33629: Flags [.], seq 49981:51409, ack 1, win 4017, options [nop,nop,TS val 265009 ecr 41525,mptcp dss ack 2872732397 seq 408122939 subseq 49981 len 1428 csum 0x4621], length 1428
21:02:54.191044 IP 112.26.3.1.44903 > 112.26.3.8.33629: Flags [.], seq 32845:34273, ack 1, win 4017, options [nop,nop,TS val 264113 ecr 40649,mptcp dss ack 2872732397 seq 408042971 subseq 32845 len 1428 csum 0xb869], length 1428
21:02:54.214550 IP 112.26.3.8.33629 > 112.26.3.1.44903: Flags [.], ack 19993, win 10540, options [nop,nop,TS val 42418 ecr 263340,nop,nop,sack 2 {25705:32845}{22849:24277},mptcp dss ack 407991563], length 0
21:02:54.214829 IP 112.26.3.8.33629 > 112.26.3.1.44903: Flags [.], ack 19993, win 10540, options [nop,nop,TS val 42418 ecr 263340,nop,nop,sack 2 {25705:32845}{22849:24277},mptcp dss ack 407991563], length 0
21:02:54.250938 IP 112.26.3.1.44903 > 112.26.3.8.33629: Flags [.], seq 52837:54265, ack 1, win 4017, options [nop,nop,TS val 265248 ecr 41769,mptcp dss ack 2872732397 seq 408134363 subseq 52837 len 1428 csum 0xbd61], length 1428
21:02:54.265797 IP 112.26.3.8.33629 > 112.26.3.1.44903: Flags [.], ack 19993, win 10585, options [nop,nop,TS val 42507 ecr 263340,nop,nop,sack 2 {25705:34273}{22849:24277},mptcp dss ack 407991563], length 0
21:02:54.266034 IP 112.26.3.8.33629 > 112.26.3.1.44903: Flags [.], ack 19993, win 10585, options [nop,nop,TS val 42507 ecr 263340,nop,nop,sack 2 {25705:34273}{22849:24277},mptcp dss ack 407991563], length 0
21:02:54.277751 IP 112.26.3.1.44903 > 112.26.3.8.33629: Flags [.], seq 35701:37129, ack 1, win 4017, options [nop,nop,TS val 264297 ecr 40821,mptcp dss ack 2872732397 seq 408061535 subseq 35701 len 1428 csum 0xbb78], length 1428
21:02:54.317445 IP 112.26.3.1.44903 > 112.26.3.8.33629: Flags [.], seq 35701:37129, ack 1, win 4017, options [nop,nop,TS val 264297 ecr 40821,mptcp dss ack 2872732397 seq 408061535 subseq 35701 len 1428 csum 0xbb78], length 1428
21:02:54.354034 IP 112.26.3.1.44903 > 112.26.3.8.33629: Flags [.], seq 19993:21421, ack 1, win 4017, options [nop,nop,TS val 265318 ecr 41909,mptcp dss ack 2872732397 seq 408037259 subseq 19993 len 1428 csum 0x4620], length 1428
21:02:54.393077 IP 112.26.3.8.33629 > 112.26.3.1.44903: Flags [.], ack 19993, win 10814, options [nop,nop,TS val 42634 ecr 263340,nop,nop,sack 2 {35701:37129}{25705:34273},mptcp dss ack 407991563], length 0
21:02:54.393368 IP 112.26.3.8.33629 > 112.26.3.1.44903: Flags [.], ack 19993, win 10814, options [nop,nop,TS val 42634 ecr 263340,nop,nop,sack 2 {35701:37129}{25705:34273},mptcp dss ack 407991563], length 0
21:02:54.441296 IP 112.26.3.1.44903 > 112.26.3.8.33629: Flags [.], seq 38557:39985, ack 1, win 4017, options [nop,nop,TS val 264407 ecr 40980,mptcp dss ack 2872732397 seq 408068675 subseq 38557 len 1428 csum 0xc425], length 1428
21:02:54.447199 IP 112.26.3.1.44903 > 112.26.3.8.33629: Flags [.], seq 38557:39985, ack 1, win 4017, options [nop,nop,TS val 264407 ecr 40980,mptcp dss ack 2872732397 seq 408068675 subseq 38557 len 1428 csum 0xc425], length 1428
21:02:54.471686 IP 112.26.3.1.44903 > 112.26.3.8.33629: Flags [.], seq 21421:22849, ack 1, win 4017, options [nop,nop,TS val 265485 ecr 42051,mptcp dss ack 2872732397 seq 408047255 subseq 21421 len 1428 csum 0x5250], length 1428
21:02:54.514078 IP 112.26.3.8.33629 > 112.26.3.1.44903: Flags [.], ack 19993, win 10905, options [nop,nop,TS val 42763 ecr 263340,nop,nop,sack 2 {38557:39985}{35701:37129},mptcp dss ack 407991563], length 0
21:02:54.514342 IP 112.26.3.8.33629 > 112.26.3.1.44903: Flags [.], ack 19993, win 10905, options [nop,nop,TS val 42763 ecr 263340,nop,nop,sack 2 {38557:39985}{35701:37129},mptcp dss ack 407991563], length 0
21:02:54.540077 IP 112.26.3.1.44903 > 112.26.3.8.33629: Flags [.], seq 41413:42841, ack 1, win 4017, options [nop,nop,TS val 264594 ecr 41106,mptcp dss ack 2872732397 seq 408088667 subseq 41413 len 1428 csum 0x1318], length 1428
21:02:54.551383 IP 112.26.3.1.44903 > 112.26.3.8.33629: Flags [.], seq 41413:42841, ack 1, win 4017, options [nop,nop,TS val 264594 ecr 41106,mptcp dss ack 2872732397 seq 408088667 subseq 41413 len 1428 csum 0x1318], length 1428
21:02:54.585023 IP 112.26.3.1.44903 > 112.26.3.8.33629: Flags [.], seq 24277:25705, ack 1, win 4017, options [nop,nop,TS val 265683 ecr 42170,mptcp dss ack 2872732397 seq 408051539 subseq 24277 len 1428 csum 0x5055], length 1428
21:02:54.645141 IP 112.26.3.8.33629 > 112.26.3.1.44903: Flags [.], ack 19993, win 11042, options [nop,nop,TS val 42868 ecr 263340,nop,nop,sack 2 {41413:42841}{38557:39985},mptcp dss ack 407991563], length 0
21:02:54.645437 IP 112.26.3.8.33629 > 112.26.3.1.44903: Flags [.], ack 19993, win 11042, options [nop,nop,TS val 42868 ecr 263340,nop,nop,sack 2 {41413:42841}{38557:39985},mptcp dss ack 407991563], length 0
21:02:54.685753 IP 112.26.3.1.44903 > 112.26.3.8.33629: Flags [.], seq 54265:55693, ack 1, win 4017, options [nop,nop,TS val 266041 ecr 42418,mptcp dss ack 2872732397 seq 408140075 subseq 54265 len 1428 csum 0x2e0d], length 1428
21:02:54.764649 IP 112.26.3.1.44903 > 112.26.3.8.33629: Flags [.], seq 47125:48553, ack 1, win 4017, options [nop,nop,TS val 264872 ecr 41403,mptcp dss ack 2872732397 seq 408114371 subseq 47125 len 1428 csum 0xbb79], length 1428
21:02:54.768738 IP 112.26.3.1.44903 > 112.26.3.8.33629: Flags [.], seq 47125:48553, ack 1, win 4017, options [nop,nop,TS val 264872 ecr 41403,mptcp dss ack 2872732397 seq 408114371 subseq 47125 len 1428 csum 0xbb79], length 1428
21:02:54.808544 IP 112.26.3.8.33629 > 112.26.3.1.44903: Flags [.], ack 19993, win 11270, options [nop,nop,TS val 43085 ecr 263340,nop,nop,sack 2 {47125:48553}{41413:42841},mptcp dss ack 407991563], length 0
21:02:54.808789 IP 112.26.3.8.33629 > 112.26.3.1.44903: Flags [.], ack 19993, win 11270, options [nop,nop,TS val 43085 ecr 263340,nop,nop,sack 2 {47125:48553}{41413:42841},mptcp dss ack 407991563], length 0
21:02:54.825455 IP 112.26.3.1.44903 > 112.26.3.8.33629: Flags [.], seq 55693:57121, ack 1, win 4017, options [nop,nop,TS val 266130 ecr 42507,mptcp dss ack 2872732397 seq 408141503 subseq 55693 len 1428 csum 0x8bc3], length 1428
21:02:54.874698 IP 112.26.3.1.44903 > 112.26.3.8.33629: Flags [.], seq 48553:49981, ack 1, win 4017, options [nop,nop,TS val 264872 ecr 41403,mptcp dss ack 2872732397 seq 408115799 subseq 48553 len 1428 csum 0x54b5], length 1428
21:02:54.880099 IP 112.26.3.1.44903 > 112.26.3.8.33629: Flags [.], seq 48553:49981, ack 1, win 4017, options [nop,nop,TS val 264872 ecr 41403,mptcp dss ack 2872732397 seq 408115799 subseq 48553 len 1428 csum 0x54b5], length 1428
21:02:54.883257 IP 112.26.3.8.33629 > 112.26.3.1.44903: Flags [.], ack 19993, win 11407, options [nop,nop,TS val 43196 ecr 263340,nop,nop,sack 2 {47125:49981}{41413:42841},mptcp dss ack 407991563], length 0
21:02:54.883498 IP 112.26.3.8.33629 > 112.26.3.1.44903: Flags [.], ack 19993, win 11407, options [nop,nop,TS val 43196 ecr 263340,nop,nop,sack 2 {47125:49981}{41413:42841},mptcp dss ack 407991563], length 0
21:02:54.898996 IP 112.26.3.1.44903 > 112.26.3.8.33629: Flags [.], seq 34273:35701, ack 1, win 4017, options [nop,nop,TS val 266419 ecr 42763,mptcp dss ack 2872732397 seq 408044399 subseq 34273 len 1428 csum 0x7c8a], length 1428
21:02:54.979849 IP 112.26.3.1.44903 > 112.26.3.8.33629: Flags [.], seq 49981:51409, ack 1, win 4017, options [nop,nop,TS val 265009 ecr 41525,mptcp dss ack 2872732397 seq 408122939 subseq 49981 len 1428 csum 0x4621], length 1428
21:02:54.983996 IP 112.26.3.1.44903 > 112.26.3.8.33629: Flags [.], seq 49981:51409, ack 1, win 4017, options [nop,nop,TS val 265009 ecr 41525,mptcp dss ack 2872732397 seq 408122939 subseq 49981 len 1428 csum 0x4621], length 1428
21:02:55.019642 IP 112.26.3.8.33629 > 112.26.3.1.44903: Flags [.], ack 19993, win 11498, options [nop,nop,TS val 43300 ecr 263340,nop,nop,sack 2 {47125:51409}{41413:42841},mptcp dss ack 407991563], length 0
21:02:55.019928 IP 112.26.3.8.33629 > 112.26.3.1.44903: Flags [.], ack 19993, win 11498, options [nop,nop,TS val 43300 ecr 263340,nop,nop,sack 2 {47125:51409}{41413:42841},mptcp dss ack 407991563], length 0
21:02:55.030932 IP 112.26.3.1.44903 > 112.26.3.8.33629: Flags [.], seq 37129:38557, ack 1, win 4017, options [nop,nop,TS val 266469 ecr 42868,mptcp dss ack 2872732397 seq 408062963 subseq 37129 len 1428 csum 0x6470], length 1428
21:02:55.094256 IP 112.26.3.1.44903 > 112.26.3.8.33629: Flags [.], seq 52837:54265, ack 1, win 4017, options [nop,nop,TS val 265248 ecr 41769,mptcp dss ack 2872732397 seq 408134363 subseq 52837 len 1428 csum 0xbd61], length 1428
21:02:55.104800 IP 112.26.3.8.33629 > 112.26.3.1.44903: Flags [.], ack 19993, win 11635, options [nop,nop,TS val 43417 ecr 263340,nop,nop,sack 2 {52837:54265}{47125:51409},mptcp dss ack 407991563], length 0
21:02:55.105054 IP 112.26.3.8.33629 > 112.26.3.1.44903: Flags [.], ack 19993, win 11635, options [nop,nop,TS val 43417 ecr 263340,nop,nop,sack 2 {52837:54265}{47125:51409},mptcp dss ack 407991563], length 0
21:02:55.108938 IP 112.26.3.1.44903 > 112.26.3.8.33629: Flags [.], seq 52837:54265, ack 1, win 4017, options [nop,nop,TS val 265248 ecr 41769,mptcp dss ack 2872732397 seq 408134363 subseq 52837 len 1428 csum 0xbd61], length 1428
21:02:55.150629 IP 112.26.3.1.44903 > 112.26.3.8.33629: Flags [.], seq 39985:41413, ack 1, win 4017, options [nop,nop,TS val 266572 ecr 43085,mptcp dss ack 2872732397 seq 408070103 subseq 39985 len 1428 csum 0xa20b], length 1428
21:02:55.193614 IP 112.26.3.1.44903 > 112.26.3.8.33629: Flags [.], seq 42841:44269, ack 1, win 4017, options [nop,nop,TS val 266673 ecr 43196,mptcp dss ack 2872732397 seq 408090095 subseq 42841 len 1428 csum 0x74cc], length 1428
21:02:55.237016 IP 112.26.3.1.44903 > 112.26.3.8.33629: Flags [.], seq 21421:22849, ack 1, win 4017, options [nop,nop,TS val 265485 ecr 42051,mptcp dss ack 2872732397 seq 408047255 subseq 21421 len 1428 csum 0x5250], length 1428
21:02:55.240799 IP 112.26.3.1.44903 > 112.26.3.8.33629: Flags [.], seq 21421:22849, ack 1, win 4017, options [nop,nop,TS val 265485 ecr 42051,mptcp dss ack 2872732397 seq 408047255 subseq 21421 len 1428 csum 0x5250], length 1428
21:02:55.251793 IP 112.26.3.8.33629 > 112.26.3.1.44903: Flags [.], ack 19993, win 11726, options [nop,nop,TS val 43557 ecr 263340,nop,nop,sack 2 {21421:22849}{52837:54265},mptcp dss ack 407991563], length 0
21:02:55.252111 IP 112.26.3.8.33629 > 112.26.3.1.44903: Flags [.], ack 19993, win 11726, options [nop,nop,TS val 43557 ecr 263340,nop,nop,sack 2 {21421:22849}{52837:54265},mptcp dss ack 407991563], length 0
21:02:55.279625 IP 112.26.3.1.44903 > 112.26.3.8.33629: Flags [.], seq 44269:45697, ack 1, win 4017, options [nop,nop,TS val 266797 ecr 43300,mptcp dss ack 2872732397 seq 408100091 subseq 44269 len 1428 csum 0xa395], length 1428
21:02:55.357815 IP 112.26.3.1.44903 > 112.26.3.8.33629: Flags [.], seq 45697:47125, ack 1, win 4017, options [nop,nop,TS val 266921 ecr 43417,mptcp dss ack 2872732397 seq 408101519 subseq 45697 len 1428 csum 0xe591], length 1428
21:02:55.388434 IP 112.26.3.1.44903 > 112.26.3.8.33629: Flags [.], seq 24277:25705, ack 1, win 4017, options [nop,nop,TS val 265683 ecr 42170,mptcp dss ack 2872732397 seq 408051539 subseq 24277 len 1428 csum 0x5055], length 1428
21:02:55.391219 IP 112.26.3.1.44903 > 112.26.3.8.33629: Flags [.], seq 24277:25705, ack 1, win 4017, options [nop,nop,TS val 265683 ecr 42170,mptcp dss ack 2872732397 seq 408051539 subseq 24277 len 1428 csum 0x5055], length 1428
21:02:55.402138 IP 112.26.3.8.33629 > 112.26.3.1.44903: Flags [.], ack 19993, win 11909, options [nop,nop,TS val 43707 ecr 263340,nop,nop,sack 2 {24277:25705}{21421:22849},mptcp dss ack 407991563], length 0
21:02:55.402424 IP 112.26.3.8.33629 > 112.26.3.1.44903: Flags [.], ack 19993, win 11909, options [nop,nop,TS val 43707 ecr 263340,nop,nop,sack 2 {24277:25705}{21421:22849},mptcp dss ack 407991563], length 0
21:02:55.476622 IP 112.26.3.1.44903 > 112.26.3.8.33629: Flags [.], seq 19993:21421, ack 1, win 4017, options [nop,nop,TS val 267028 ecr 43557,mptcp dss ack 2872732397 seq 408037259 subseq 19993 len 1428 csum 0x4620], length 1428
21:02:55.520782 IP 112.26.3.1.44903 > 112.26.3.8.33629: Flags [.], seq 55693:57121, ack 1, win 4017, options [nop,nop,TS val 266130 ecr 42507,mptcp dss ack 2872732397 seq 408141503 subseq 55693 len 1428 csum 0x8bc3], length 1428
21:02:55.527833 IP 112.26.3.1.44903 > 112.26.3.8.33629: Flags [.], seq 55693:57121, ack 1, win 4017, options [nop,nop,TS val 266130 ecr 42507,mptcp dss ack 2872732397 seq 408141503 subseq 55693 len 1428 csum 0x8bc3], length 1428
21:02:55.534342 IP 112.26.3.8.33629 > 112.26.3.1.44903: Flags [.], ack 19993, win 12091, options [nop,nop,TS val 43844 ecr 263340,nop,nop,sack 2 {55693:57121}{24277:25705},mptcp dss ack 407991563], length 0
21:02:55.534648 IP 112.26.3.8.33629 > 112.26.3.1.44903: Flags [.], ack 19993, win 12091, options [nop,nop,TS val 43844 ecr 263340,nop,nop,sack 2 {55693:57121}{24277:25705},mptcp dss ack 407991563], length 0
21:02:55.560216 IP 112.26.3.1.44903 > 112.26.3.8.33629: Flags [.], seq 51409:52837, ack 1, win 4017, options [nop,nop,TS val 267116 ecr 43707,mptcp dss ack 2872732397 seq 408124367 subseq 51409 len 1428 csum 0x878f], length 1428
21:02:55.598586 IP 112.26.3.1.44903 > 112.26.3.8.33629: Flags [.], seq 34273:35701, ack 1, win 4017, options [nop,nop,TS val 266419 ecr 42763,mptcp dss ack 2872732397 seq 408044399 subseq 34273 len 1428 csum 0x7c8a], length 1428
21:02:55.643788 IP 112.26.3.1.44903 > 112.26.3.8.33629: Flags [.], seq 54265:55693, ack 1, win 4017, options [nop,nop,TS val 267253 ecr 43844,mptcp dss ack 2872732397 seq 408140075 subseq 54265 len 1428 csum 0x2e0d], length 1428
21:02:55.668647 IP 112.26.3.1.44903 > 112.26.3.8.33629: Flags [.], seq 34273:35701, ack 1, win 4017, options [nop,nop,TS val 266419 ecr 42763,mptcp dss ack 2872732397 seq 408044399 subseq 34273 len 1428 csum 0x7c8a], length 1428
21:02:55.681399 IP 112.26.3.8.33629 > 112.26.3.1.44903: Flags [.], ack 19993, win 12319, options [nop,nop,TS val 43984 ecr 263340,nop,nop,sack 2 {34273:35701}{55693:57121},mptcp dss ack 407991563], length 0
21:02:55.681740 IP 112.26.3.8.33629 > 112.26.3.1.44903: Flags [.], ack 19993, win 12319, options [nop,nop,TS val 43984 ecr 263340,nop,nop,sack 2 {34273:35701}{55693:57121},mptcp dss ack 407991563], length 0
21:02:55.712825 IP 112.26.3.1.44903 > 112.26.3.8.33629: Flags [.], seq 37129:38557, ack 1, win 4017, options [nop,nop,TS val 266469 ecr 42868,mptcp dss ack 2872732397 seq 408062963 subseq 37129 len 1428 csum 0x6470], length 1428
