21:02:50.607419 IP 112.26.3.8.33629 > 112.26.3.1.44903: Flags [S], seq 3971283100, win 65535, options [mss 1460,sackOK,TS val 38902 ecr 0,nop,wscale 6,mptcp join id 6 token 0x7fa57e4e nonce 0xc247ffbd], length 0
21:02:50.669558 IP 112.26.3.8.33629 > 112.26.3.1.44903: Flags [S], seq 3971283100, win 65535, options [mss 1460,sackOK,TS val 38902 ecr 0,nop,wscale 6,mptcp join id 6 token 0x7fa57e4e nonce 0xc247ffbd], length 0
21:02:50.744235 IP 112.26.3.8.33629 > 112.26.3.1.44903: Flags [S], seq 3971283100, win 65535, options [mss 1460,sackOK,TS val 38902 ecr 0,nop,wscale 6,mptcp join id 6 token 0x7fa57e4e nonce 0xc247ffbd], length 0
21:02:50.900021 IP 112.26.3.1.44903 > 112.26.3.8.33629: Flags [S.], seq 2159510627, ack 3971283101, win 65535, options [mss 1460,sackOK,TS val 262453 ecr 38902,nop,wscale 6,mptcp join id 5 hmac 0xe7ece21ed53d2c0b nonce 0xd823ce4a], length 0
21:02:50.952795 IP 112.26.3.1.44903 > 112.26.3.8.33629: Flags [S.], seq 2159510627, ack 3971283101, win 65535, options [mss 1460,sackOK,TS val 262453 ecr 38902,nop,wscale 6,mptcp join id 5 hmac 0xe7ece21ed53d2c0b nonce 0xd823ce4a], length 0
21:02:50.993038 IP 112.26.3.8.33629 > 112.26.3.1.44903: Flags [.], ack 1, win 7072, options [nop,nop,TS val 39271 ecr 262453,mptcp join hmac 0xe3cc2e5246ed467bceebf989319b635bc71aea97], length 0
21:02:51.066011 IP 112.26.3.8.33629 > 112.26.3.1.44903: Flags [.], ack 1, win 7072, options [nop,nop,TS val 39271 ecr 262453,mptcp join hmac 0xe3cc2e5246ed467bceebf989319b635bc71aea97], length 0
21:02:51.068177 IP 112.26.3.8.33629 > 112.26.3.1.44903: Flags [.], ack 1, win 7072, options [nop,nop,TS val 39271 ecr 262453,mptcp join hmac 0xe3cc2e5246ed467bceebf989319b635bc71aea97], length 0
21:02:51.079151 IP 112.26.3.1.44903 > 112.26.3.8.33629: Flags [.], ack 1, win 4017, options [nop,nop,TS val 262776 ecr 39271,mptcp dss ack 2872732397], length 0
21:02:51.079431 IP 112.26.3.1.44903 > 112.26.3.8.33629: Flags [.], ack 1, win 4017, options [nop,nop,TS val 262776 ecr 39271,mptcp dss ack 2872732397], length 0
21:02:51.139466 IP 112.26.3.1.44903 > 112.26.3.8.33629: Flags [.], seq 1:1429, ack 1, win 4017, options [nop,nop,TS val 262843 ecr 39271,mptcp dss ack 2872732397 seq 408010127 subseq 1 len 1428 csum 0xe19b], length 1428
21:02:51.139728 IP 112.26.3.1.44903 > 112.26.3.8.33629: Flags [.], seq 1:1429, ack 1, win 4017, options [nop,nop,TS val 262843 ecr 39271,mptcp dss ack 2872732397 seq 408010127 subseq 1 len 1428 csum 0xe19b], length 1428
21:02:51.148896 IP 112.26.3.8.33629 > 112.26.3.1.44903: Flags [.], ack 1429, win 7209, options [nop,nop,TS val 39459 ecr 262843,mptcp dss ack 407967287], length 0
21:02:51.232578 IP 112.26.3.8.33629 > 112.26.3.1.44903: Flags [.], ack 1429, win 7209, options [nop,nop,TS val 39459 ecr 262843,mptcp dss ack 407967287], length 0
21:02:51.235148 IP 112.26.3.8.33629 > 112.26.3.1.44903: Flags [.], ack 1429, win 7209, options [nop,nop,TS val 39459 ecr 262843,mptcp dss ack 407967287], length 0
21:02:51.394173 IP 112.26.3.1.44903 > 112.26.3.8.33629: Flags [.], seq 1429:2857, ack 1, win 4017, options [nop,nop,TS val 262843 ecr 39271,mptcp dss ack 2872732397 seq 408011555 subseq 1429 len 1428 csum 0xce77], length 1428
21:02:51.394442 IP 112.26.3.1.44903 > 112.26.3.8.33629: Flags [.], seq 1429:2857, ack 1, win 4017, options [nop,nop,TS val 262843 ecr 39271,mptcp dss ack 2872732397 seq 408011555 subseq 1429 len 1428 csum 0xce77], length 1428
21:02:51.399310 IP 112.26.3.8.33629 > 112.26.3.1.44903: Flags [.], ack 2857, win 7483, options [nop,nop,TS val 39713 ecr 262843,mptcp dss ack 407970143], length 0
21:02:51.464299 IP 112.26.3.1.44903 > 112.26.3.8.33629: Flags [.], seq 2857:4285, ack 1, win 4017, options [nop,nop,TS val 262843 ecr 39271,mptcp dss ack 2872732397 seq 408012983 subseq 2857 len 1428 csum 0x7e92], length 1428
21:02:51.464556 IP 112.26.3.1.44903 > 112.26.3.8.33629: Flags [.], seq 2857:4285, ack 1, win 4017, options [nop,nop,TS val 262843 ecr 39271,mptcp dss ack 2872732397 seq 408012983 subseq 2857 len 1428 csum 0x7e92], length 1428
21:02:51.474244 IP 112.26.3.8.33629 > 112.26.3.1.44903: Flags [.], ack 2857, win 7483, options [nop,nop,TS val 39713 ecr 262843,mptcp dss ack 407970143], length 0
21:02:51.476330 IP 112.26.3.8.33629 > 112.26.3.1.44903: Flags [.], ack 2857, win 7483, options [nop,nop,TS val 39713 ecr 262843,mptcp dss ack 407970143], length 0
21:02:51.526952 IP 112.26.3.8.33629 > 112.26.3.1.44903: Flags [.], ack 4285, win 7574, options [nop,nop,TS val 39840 ecr 262843,mptcp dss ack 407971571], length 0
21:02:51.624481 IP 112.26.3.8.33629 > 112.26.3.1.44903: Flags [.], ack 4285, win 7574, options [nop,nop,TS val 39840 ecr 262843,mptcp dss ack 407971571], length 0
21:02:51.638527 IP 112.26.3.8.33629 > 112.26.3.1.44903: Flags [.], ack 4285, win 7574, options [nop,nop,TS val 39840 ecr 262843,mptcp dss ack 407971571], length 0
21:02:51.719430 IP 112.26.3.1.44903 > 112.26.3.8.33629: Flags [.], seq 4285:5713, ack 1, win 4017, options [nop,nop,TS val 262943 ecr 39271,mptcp dss ack 2872732397 seq 408015839 subseq 4285 len 1428 csum 0x1424], length 1428
21:02:51.719684 IP 112.26.3.1.44903 > 112.26.3.8.33629: Flags [.], seq 4285:5713, ack 1, win 4017, options [nop,nop,TS val 262943 ecr 39271,mptcp dss ack 2872732397 seq 408015839 subseq 4285 len 1428 csum 0x1424], length 1428
21:02:51.725767 IP 112.26.3.8.33629 > 112.26.3.1.44903: Flags [.], ack 5713, win 7757, options [nop,nop,TS val 40040 ecr 262943,mptcp dss ack 407972999], length 0
21:02:51.826865 IP 112.26.3.1.44903 > 112.26.3.8.33629: Flags [.], seq 5713:7141, ack 1, win 4017, options [nop,nop,TS val 262943 ecr 39271,mptcp dss ack 2872732397 seq 408017267 subseq 5713 len 1428 csum 0x946d], length 1428
21:02:51.827140 IP 112.26.3.1.44903 > 112.26.3.8.33629: Flags [.], seq 5713:7141, ack 1, win 4017, options [nop,nop,TS val 262943 ecr 39271,mptcp dss ack 2872732397 seq 408017267 subseq 5713 len 1428 csum 0x946d], length 1428
21:02:51.836279 IP 112.26.3.8.33629 > 112.26.3.1.44903: Flags [.], ack 7141, win 7894, options [nop,nop,TS val 40149 ecr 262943,mptcp dss ack 407974427], length 0
21:02:51.886862 IP 112.26.3.8.33629 > 112.26.3.1.44903: Flags [.], ack 5713, win 7757, options [nop,nop,TS val 40040 ecr 262943,mptcp dss ack 407972999], length 0
21:02:51.889805 IP 112.26.3.8.33629 > 112.26.3.1.44903: Flags [.], ack 5713, win 7757, options [nop,nop,TS val 40040 ecr 262943,mptcp dss ack 407972999], length 0
21:02:51.940705 IP 112.26.3.8.33629 > 112.26.3.1.44903: Flags [.], ack 7141, win 7894, options [nop,nop,TS val 40149 ecr 262943,mptcp dss ack 407974427], length 0
21:02:51.981107 IP 112.26.3.8.33629 > 112.26.3.1.44903: Flags [.], ack 7141, win 7894, options [nop,nop,TS val 40149 ecr 262943,mptcp dss ack 407974427], length 0
21:02:52.016740 IP 112.26.3.1.44903 > 112.26.3.8.33629: Flags [.], seq 7141:8569, ack 1, win 4017, options [nop,nop,TS val 262944 ecr 39459,mptcp dss ack 2872732397 seq 408018695 subseq 7141 len 1428 csum 0x76a2], length 1428
21:02:52.016990 IP 112.26.3.1.44903 > 112.26.3.8.33629: Flags [.], seq 7141:8569, ack 1, win 4017, options [nop,nop,TS val 262944 ecr 39459,mptcp dss ack 2872732397 seq 408018695 subseq 7141 len 1428 csum 0x76a2], length 1428
21:02:52.023380 IP 112.26.3.8.33629 > 112.26.3.1.44903: Flags [.], ack 8569, win 8167, options [nop,nop,TS val 40338 ecr 262944,mptcp dss ack 407977283], length 0
21:02:52.074089 IP 112.26.3.8.33629 > 112.26.3.1.44903: Flags [.], ack 8569, win 8167, options [nop,nop,TS val 40338 ecr 262944,mptcp dss ack 407977283], length 0
21:02:52.104499 IP 112.26.3.1.44903 > 112.26.3.8.33629: Flags [.], seq 8569:9997, ack 1, win 4017, options [nop,nop,TS val 262944 ecr 39459,mptcp dss ack 2872732397 seq 408020123 subseq 8569 len 1428 csum 0x5681], length 1428
21:02:52.104768 IP 112.26.3.1.44903 > 112.26.3.8.33629: Flags [.], seq 8569:9997, ack 1, win 4017, options [nop,nop,TS val 262944 ecr 39459,mptcp dss ack 2872732397 seq 408020123 subseq 8569 len 1428 csum 0x5681], length 1428
21:02:52.129223 IP 112.26.3.8.33629 > 112.26.3.1.44903: Flags [.], ack 9997, win 8304, options [nop,nop,TS val 40443 ecr 262944,mptcp dss ack 407985851], length 0
21:02:52.145186 IP 112.26.3.8.33629 > 112.26.3.1.44903: Flags [.], ack 8569, win 8167, options [nop,nop,TS val 40338 ecr 262944,mptcp dss ack 407977283], length 0
21:02:52.164673 IP 112.26.3.8.33629 > 112.26.3.1.44903: Flags [.], ack 9997, win 8304, options [nop,nop,TS val 40443 ecr 262944,mptcp dss ack 407985851], length 0
21:02:52.272956 IP 112.26.3.8.33629 > 112.26.3.1.44903: Flags [.], ack 9997, win 8304, options [nop,nop,TS val 40443 ecr 262944,mptcp dss ack 407985851], length 0
21:02:52.327582 IP 112.26.3.1.44903 > 112.26.3.8.33629: Flags [.], seq 9997:11425, ack 1, win 4017, options [nop,nop,TS val 262944 ecr 39459,mptcp dss ack 2872732397 seq 408021551 subseq 9997 len 1428 csum 0x479f], length 1428
21:02:52.327849 IP 112.26.3.1.44903 > 112.26.3.8.33629: Flags [.], seq 9997:11425, ack 1, win 4017, options [nop,nop,TS val 262944 ecr 39459,mptcp dss ack 2872732397 seq 408021551 subseq 9997 len 1428 csum 0x479f], length 1428
21:02:52.334233 IP 112.26.3.8.33629 > 112.26.3.1.44903: Flags [.], ack 11425, win 8532, options [nop,nop,TS val 40649 ecr 262944,mptcp dss ack 407988707], length 0
21:02:52.338953 IP 112.26.3.8.33629 > 112.26.3.1.44903: Flags [.], ack 11425, win 8532, options [nop,nop,TS val 40649 ecr 262944,mptcp dss ack 407988707], length 0
21:02:52.405301 IP 112.26.3.8.33629 > 112.26.3.1.44903: Flags [.], ack 11425, win 8532, options [nop,nop,TS val 40649 ecr 262944,mptcp dss ack 407988707], length 0
21:02:52.502551 IP 112.26.3.1.44903 > 112.26.3.8.33629: Flags [.], seq 11425:12853, ack 1, win 4017, options [nop,nop,TS val 262944 ecr 39459,mptcp dss ack 2872732397 seq 408022979 subseq 11425 len 1428 csum 0x880c], length 1428
21:02:52.502780 IP 112.26.3.1.44903 > 112.26.3.8.33629: Flags [.], seq 11425:12853, ack 1, win 4017, options [nop,nop,TS val 262944 ecr 39459,mptcp dss ack 2872732397 seq 408022979 subseq 11425 len 1428 csum 0x880c], length 1428
21:02:52.507655 IP 112.26.3.8.33629 > 112.26.3.1.44903: Flags [.], ack 12853, win 8806, options [nop,nop,TS val 40821 ecr 262944,mptcp dss ack 407991563], length 0
21:02:52.585145 IP 112.26.3.8.33629 > 112.26.3.1.44903: Flags [.], ack 12853, win 8806, options [nop,nop,TS val 40821 ecr 262944,mptcp dss ack 407991563], length 0
21:02:52.588611 IP 112.26.3.8.33629 > 112.26.3.1.44903: Flags [.], ack 12853, win 8806, options [nop,nop,TS val 40821 ecr 262944,mptcp dss ack 407991563], length 0
21:02:52.660629 IP 112.26.3.1.44903 > 112.26.3.8.33629: Flags [.], seq 12853:14281, ack 1, win 4017, options [nop,nop,TS val 262944 ecr 39459,mptcp dss ack 2872732397 seq 408024407 subseq 12853 len 1428 csum 0x2e44], length 1428
21:02:52.660850 IP 112.26.3.1.44903 > 112.26.3.8.33629: Flags [.], seq 12853:14281, ack 1, win 4017, options [nop,nop,TS val 262944 ecr 39459,mptcp dss ack 2872732397 seq 408024407 subseq 12853 len 1428 csum 0x2e44], length 1428
21:02:52.666081 IP 112.26.3.8.33629 > 112.26.3.1.44903: Flags [.], ack 14281, win 8943, options [nop,nop,TS val 40980 ecr 262944,mptcp dss ack 407991563], length 0
21:02:52.687743 IP 112.26.3.8.33629 > 112.26.3.1.44903: Flags [.], ack 14281, win 8943, options [nop,nop,TS val 40980 ecr 262944,mptcp dss ack 407991563], length 0
21:02:52.699233 IP 112.26.3.8.33629 > 112.26.3.1.44903: Flags [.], ack 14281, win 8943, options [nop,nop,TS val 40980 ecr 262944,mptcp dss ack 407991563], length 0
21:02:52.786946 IP 112.26.3.1.44903 > 112.26.3.8.33629: Flags [.], seq 14281:15709, ack 1, win 4017, options [nop,nop,TS val 262944 ecr 39459,mptcp dss ack 2872732397 seq 408025835 subseq 14281 len 1428 csum 0x7fe1], length 1428
21:02:52.787266 IP 112.26.3.1.44903 > 112.26.3.8.33629: Flags [.], seq 14281:15709, ack 1, win 4017, options [nop,nop,TS val 262944 ecr 39459,mptcp dss ack 2872732397 seq 408025835 subseq 14281 len 1428 csum 0x7fe1], length 1428
21:02:52.791928 IP 112.26.3.8.33629 > 112.26.3.1.44903: Flags [.], ack 15709, win 9080, options [nop,nop,TS val 41106 ecr 262944,mptcp dss ack 407991563], length 0
21:02:52.834534 IP 112.26.3.8.33629 > 112.26.3.1.44903: Flags [.], ack 15709, win 9080, options [nop,nop,TS val 41106 ecr 262944,mptcp dss ack 407991563], length 0
21:02:52.886399 IP 112.26.3.8.33629 > 112.26.3.1.44903: Flags [.], ack 15709, win 9080, options [nop,nop,TS val 41106 ecr 262944,mptcp dss ack 407991563], length 0
21:02:52.947297 IP 112.26.3.1.44903 > 112.26.3.8.33629: Flags [.], seq 15709:17137, ack 1, win 4017, options [nop,nop,TS val 263184 ecr 39713,mptcp dss ack 2872732397 seq 408032975 subseq 15709 len 1428 csum 0xa833], length 1428
21:02:52.947627 IP 112.26.3.1.44903 > 112.26.3.8.33629: Flags [.], seq 15709:17137, ack 1, win 4017, options [nop,nop,TS val 263184 ecr 39713,mptcp dss ack 2872732397 seq 408032975 subseq 15709 len 1428 csum 0xa833], length 1428
21:02:52.956045 IP 112.26.3.8.33629 > 112.26.3.1.44903: Flags [.], ack 17137, win 9262, options [nop,nop,TS val 41270 ecr 263184,mptcp dss ack 407991563], length 0
21:02:52.963562 IP 112.26.3.8.33629 > 112.26.3.1.44903: Flags [.], ack 17137, win 9262, options [nop,nop,TS val 41270 ecr 263184,mptcp dss ack 407991563], length 0
21:02:53.029272 IP 112.26.3.8.33629 > 112.26.3.1.44903: Flags [.], ack 17137, win 9262, options [nop,nop,TS val 41270 ecr 263184,mptcp dss ack 407991563], length 0
21:02:53.073987 IP 112.26.3.1.44903 > 112.26.3.8.33629: Flags [.], seq 17137:18565, ack 1, win 4017, options [nop,nop,TS val 263184 ecr 39713,mptcp dss ack 2872732397 seq 408034403 subseq 17137 len 1428 csum 0x2184], length 1428
21:02:53.074284 IP 112.26.3.1.44903 > 112.26.3.8.33629: Flags [.], seq 17137:18565, ack 1, win 4017, options [nop,nop,TS val 263184 ecr 39713,mptcp dss ack 2872732397 seq 408034403 subseq 17137 len 1428 csum 0x2184], length 1428
21:02:53.090179 IP 112.26.3.8.33629 > 112.26.3.1.44903: Flags [.], ack 18565, win 9354, options [nop,nop,TS val 41403 ecr 263184,mptcp dss ack 407991563], length 0
21:02:53.091976 IP 112.26.3.8.33629 > 112.26.3.1.44903: Flags [.], ack 18565, win 9354, options [nop,nop,TS val 41403 ecr 263184,mptcp dss ack 407991563], length 0
21:02:53.164618 IP 112.26.3.8.33629 > 112.26.3.1.44903: Flags [.], ack 18565, win 9354, options [nop,nop,TS val 41403 ecr 263184,mptcp dss ack 407991563], length 0
21:02:53.204794 IP 112.26.3.1.44903 > 112.26.3.8.33629: Flags [.], seq 18565:19993, ack 1, win 4017, options [nop,nop,TS val 263340 ecr 39840,mptcp dss ack 2872732397 seq 408035831 subseq 18565 len 1428 csum 0x224e], length 1428
21:02:53.205030 IP 112.26.3.1.44903 > 112.26.3.8.33629: Flags [.], seq 18565:19993, ack 1, win 4017, options [nop,nop,TS val 263340 ecr 39840,mptcp dss ack 2872732397 seq 408035831 subseq 18565 len 1428 csum 0x224e], length 1428
21:02:53.218637 IP 112.26.3.8.33629 > 112.26.3.1.44903: Flags [.], ack 19993, win 9445, options [nop,nop,TS val 41525 ecr 263340,mptcp dss ack 407991563], length 0
21:02:53.254094 IP 112.26.3.8.33629 > 112.26.3.1.44903: Flags [.], ack 19993, win 9445, options [nop,nop,TS val 41525 ecr 263340,mptcp dss ack 407991563], length 0
21:02:53.301580 IP 112.26.3.8.33629 > 112.26.3.1.44903: Flags [.], ack 19993, win 9445, options [nop,nop,TS val 41525 ecr 263340,mptcp dss ack 407991563], length 0
21:02:53.449183 IP 112.26.3.1.44903 > 112.26.3.8.33629: Flags [.], seq 22849:24277, ack 1, win 4017, options [nop,nop,TS val 263598 ecr 40040,mptcp dss ack 2872732397 seq 408048683 subseq 22849 len 1428 csum 0x2f20], length 1428
21:02:53.449482 IP 112.26.3.1.44903 > 112.26.3.8.33629: Flags [.], seq 22849:24277, ack 1, win 4017, options [nop,nop,TS val 263598 ecr 40040,mptcp dss ack 2872732397 seq 408048683 subseq 22849 len 1428 csum 0x2f20], length 1428
21:02:53.455102 IP 112.26.3.8.33629 > 112.26.3.1.44903: Flags [.], ack 19993, win 9673, options [nop,nop,TS val 41769 ecr 263340,nop,nop,sack 1 {22849:24277},mptcp dss ack 407991563], length 0
21:02:53.464364 IP 112.26.3.8.33629 > 112.26.3.1.44903: Flags [.], ack 19993, win 9673, options [nop,nop,TS val 41769 ecr 263340,nop,nop,sack 1 {22849:24277},mptcp dss ack 407991563], length 0
21:02:53.466160 IP 112.26.3.8.33629 > 112.26.3.1.44903: Flags [.], ack 19993, win 9673, options [nop,nop,TS val 41769 ecr 263340,nop,nop,sack 1 {22849:24277},mptcp dss ack 407991563], length 0
21:02:53.568521 IP 112.26.3.1.44903 > 112.26.3.8.33629: Flags [.], seq 25705:27133, ack 1, win 4017, options [nop,nop,TS val 263689 ecr 40149,mptcp dss ack 2872732397 seq 408052967 subseq 25705 len 1428 csum 0x780b], length 1428
21:02:53.568825 IP 112.26.3.1.44903 > 112.26.3.8.33629: Flags [.], seq 25705:27133, ack 1, win 4017, options [nop,nop,TS val 263689 ecr 40149,mptcp dss ack 2872732397 seq 408052967 subseq 25705 len 1428 csum 0x780b], length 1428
21:02:53.594724 IP 112.26.3.8.33629 > 112.26.3.1.44903: Flags [.], ack 19993, win 9855, options [nop,nop,TS val 41909 ecr 263340,nop,nop,sack 2 {25705:27133}{22849:24277},mptcp dss ack 407991563], length 0
21:02:53.597816 IP 112.26.3.8.33629 > 112.26.3.1.44903: Flags [.], ack 19993, win 9855, options [nop,nop,TS val 41909 ecr 263340,nop,nop,sack 2 {25705:27133}{22849:24277},mptcp dss ack 407991563], length 0
21:02:53.609881 IP 112.26.3.8.33629 > 112.26.3.1.44903: Flags [.], ack 19993, win 9855, options [nop,nop,TS val 41909 ecr 263340,nop,nop,sack 2 {25705:27133}{22849:24277},mptcp dss ack 407991563], length 0
21:02:53.724530 IP 112.26.3.1.44903 > 112.26.3.8.33629: Flags [.], seq 27133:28561, ack 1, win 4017, options [nop,nop,TS val 263853 ecr 40338,mptcp dss ack 2872732397 seq 407982995 subseq 27133 len 1428 csum 0xd681], length 1428
21:02:53.724865 IP 112.26.3.1.44903 > 112.26.3.8.33629: Flags [.], seq 27133:28561, ack 1, win 4017, options [nop,nop,TS val 263853 ecr 40338,mptcp dss ack 2872732397 seq 407982995 subseq 27133 len 1428 csum 0xd681], length 1428
21:02:53.738210 IP 112.26.3.8.33629 > 112.26.3.1.44903: Flags [.], ack 19993, win 9992, options [nop,nop,TS val 42051 ecr 263340,nop,nop,sack 2 {25705:28561}{22849:24277},mptcp dss ack 407991563], length 0
21:02:53.742216 IP 112.26.3.8.33629 > 112.26.3.1.44903: Flags [.], ack 19993, win 9992, options [nop,nop,TS val 42051 ecr 263340,nop,nop,sack 2 {25705:28561}{22849:24277},mptcp dss ack 407991563], length 0
21:02:53.776519 IP 112.26.3.8.33629 > 112.26.3.1.44903: Flags [.], ack 19993, win 9992, options [nop,nop,TS val 42051 ecr 263340,nop,nop,sack 2 {25705:28561}{22849:24277},mptcp dss ack 407991563], length 0
21:02:53.790648 IP 112.26.3.1.44903 > 112.26.3.8.33629: Flags [.], seq 28561:29989, ack 1, win 4017, options [nop,nop,TS val 263853 ecr 40338,mptcp dss ack 2872732397 seq 407984423 subseq 28561 len 1428 csum 0xfa42], length 1428
21:02:53.790939 IP 112.26.3.1.44903 > 112.26.3.8.33629: Flags [.], seq 28561:29989, ack 1, win 4017, options [nop,nop,TS val 263853 ecr 40338,mptcp dss ack 2872732397 seq 407984423 subseq 28561 len 1428 csum 0xfa42], length 1428
21:02:53.870878 IP 112.26.3.8.33629 > 112.26.3.1.44903: Flags [.], ack 19993, win 10175, options [nop,nop,TS val 42170 ecr 263340,nop,nop,sack 2 {25705:29989}{22849:24277},mptcp dss ack 407991563], length 0
21:02:53.934982 IP 112.26.3.1.44903 > 112.26.3.8.33629: Flags [.], seq 29989:31417, ack 1, win 4017, options [nop,nop,TS val 263981 ecr 40443,mptcp dss ack 2872732397 seq 407985851 subseq 29989 len 1428 csum 0x28be], length 1428
21:02:53.935292 IP 112.26.3.1.44903 > 112.26.3.8.33629: Flags [.], seq 29989:31417, ack 1, win 4017, options [nop,nop,TS val 263981 ecr 40443,mptcp dss ack 2872732397 seq 407985851 subseq 29989 len 1428 csum 0x28be], length 1428
21:02:53.964031 IP 112.26.3.8.33629 > 112.26.3.1.44903: Flags [.], ack 19993, win 10312, options [nop,nop,TS val 42279 ecr 263340,nop,nop,sack 2 {25705:31417}{22849:24277},mptcp dss ack 407991563], length 0
21:02:53.969494 IP 112.26.3.8.33629 > 112.26.3.1.44903: Flags [.], ack 19993, win 10175, options [nop,nop,TS val 42170 ecr 263340,nop,nop,sack 2 {25705:29989}{22849:24277},mptcp dss ack 407991563], length 0
21:02:53.974357 IP 112.26.3.8.33629 > 112.26.3.1.44903: Flags [.], ack 19993, win 10175, options [nop,nop,TS val 42170 ecr 263340,nop,nop,sack 2 {25705:29989}{22849:24277},mptcp dss ack 407991563], length 0
21:02:54.017723 IP 112.26.3.1.44903 > 112.26.3.8.33629: Flags [.], seq 31417:32845, ack 1, win 4017, options [nop,nop,TS val 263981 ecr 40443,mptcp dss ack 2872732397 seq 407987279 subseq 31417 len 1428 csum 0xdb46], length 1428
21:02:54.017973 IP 112.26.3.1.44903 > 112.26.3.8.33629: Flags [.], seq 31417:32845, ack 1, win 4017, options [nop,nop,TS val 263981 ecr 40443,mptcp dss ack 2872732397 seq 407987279 subseq 31417 len 1428 csum 0xdb46], length 1428
21:02:54.098361 IP 112.26.3.1.44903 > 112.26.3.8.33629: Flags [.], seq 32845:34273, ack 1, win 4017, options [nop,nop,TS val 264113 ecr 40649,mptcp dss ack 2872732397 seq 408042971 subseq 32845 len 1428 csum 0xb869], length 1428
21:02:54.098623 IP 112.26.3.1.44903 > 112.26.3.8.33629: Flags [.], seq 32845:34273, ack 1, win 4017, options [nop,nop,TS val 264113 ecr 40649,mptcp dss ack 2872732397 seq 408042971 subseq 32845 len 1428 csum 0xb869], length 1428
21:02:54.108291 IP 112.26.3.8.33629 > 112.26.3.1.44903: Flags [.], ack 19993, win 10540, options [nop,nop,TS val 42418 ecr 263340,nop,nop,sack 2 {25705:32845}{22849:24277},mptcp dss ack 407991563], length 0
21:02:54.128266 IP 112.26.3.8.33629 > 112.26.3.1.44903: Flags [.], ack 19993, win 10312, options [nop,nop,TS val 42279 ecr 263340,nop,nop,sack 2 {25705:31417}{22849:24277},mptcp dss ack 407991563], length 0
21:02:54.131856 IP 112.26.3.8.33629 > 112.26.3.1.44903: Flags [.], ack 19993, win 10312, options [nop,nop,TS val 42279 ecr 263340,nop,nop,sack 2 {25705:31417}{22849:24277},mptcp dss ack 407991563], length 0
21:02:54.186009 IP 112.26.3.8.33629 > 112.26.3.1.44903: Flags [.], ack 19993, win 10540, options [nop,nop,TS val 42418 ecr 263340,nop,nop,sack 2 {25705:32845}{22849:24277},mptcp dss ack 407991563], length 0
21:02:54.225139 IP 112.26.3.8.33629 > 112.26.3.1.44903: Flags [.], ack 19993, win 10585, options [nop,nop,TS val 42507 ecr 263340,nop,nop,sack 2 {25705:34273}{22849:24277},mptcp dss ack 407991563], length 0
21:02:54.265689 IP 112.26.3.8.33629 > 112.26.3.1.44903: Flags [.], ack 19993, win 10585, options [nop,nop,TS val 42507 ecr 263340,nop,nop,sack 2 {25705:34273}{22849:24277},mptcp dss ack 407991563], length 0
21:02:54.278092 IP 112.26.3.1.44903 > 112.26.3.8.33629: Flags [.], seq 35701:37129, ack 1, win 4017, options [nop,nop,TS val 264297 ecr 40821,mptcp dss ack 2872732397 seq 408061535 subseq 35701 len 1428 csum 0xbb78], length 1428
21:02:54.278349 IP 112.26.3.1.44903 > 112.26.3.8.33629: Flags [.], seq 35701:37129, ack 1, win 4017, options [nop,nop,TS val 264297 ecr 40821,mptcp dss ack 2872732397 seq 408061535 subseq 35701 len 1428 csum 0xbb78], length 1428
21:02:54.285318 IP 112.26.3.8.33629 > 112.26.3.1.44903: Flags [.], ack 19993, win 10540, options [nop,nop,TS val 42418 ecr 263340,nop,nop,sack 2 {25705:32845}{22849:24277},mptcp dss ack 407991563], length 0
21:02:54.319273 IP 112.26.3.8.33629 > 112.26.3.1.44903: Flags [.], ack 19993, win 10814, options [nop,nop,TS val 42634 ecr 263340,nop,nop,sack 2 {35701:37129}{25705:34273},mptcp dss ack 407991563], length 0
21:02:54.384313 IP 112.26.3.8.33629 > 112.26.3.1.44903: Flags [.], ack 19993, win 10585, options [nop,nop,TS val 42507 ecr 263340,nop,nop,sack 2 {25705:34273}{22849:24277},mptcp dss ack 407991563], length 0
21:02:54.392959 IP 112.26.3.8.33629 > 112.26.3.1.44903: Flags [.], ack 19993, win 10814, options [nop,nop,TS val 42634 ecr 263340,nop,nop,sack 2 {35701:37129}{25705:34273},mptcp dss ack 407991563], length 0
21:02:54.441636 IP 112.26.3.1.44903 > 112.26.3.8.33629: Flags [.], seq 38557:39985, ack 1, win 4017, options [nop,nop,TS val 264407 ecr 40980,mptcp dss ack 2872732397 seq 408068675 subseq 38557 len 1428 csum 0xc425], length 1428
21:02:54.441901 IP 112.26.3.1.44903 > 112.26.3.8.33629: Flags [.], seq 38557:39985, ack 1, win 4017, options [nop,nop,TS val 264407 ecr 40980,mptcp dss ack 2872732397 seq 408068675 subseq 38557 len 1428 csum 0xc425], length 1428
21:02:54.452806 IP 112.26.3.8.33629 > 112.26.3.1.44903: Flags [.], ack 19993, win 10905, options [nop,nop,TS val 42763 ecr 263340,nop,nop,sack 2 {38557:39985}{35701:37129},mptcp dss ack 407991563], length 0
21:02:54.513960 IP 112.26.3.8.33629 > 112.26.3.1.44903: Flags [.], ack 19993, win 10905, options [nop,nop,TS val 42763 ecr 263340,nop,nop,sack 2 {38557:39985}{35701:37129},mptcp dss ack 407991563], length 0
21:02:54.540416 IP 112.26.3.1.44903 > 112.26.3.8.33629: Flags [.], seq 41413:42841, ack 1, win 4017, options [nop,nop,TS val 264594 ecr 41106,mptcp dss ack 2872732397 seq 408088667 subseq 41413 len 1428 csum 0x1318], length 1428
21:02:54.540681 IP 112.26.3.1.44903 > 112.26.3.8.33629: Flags [.], seq 41413:42841, ack 1, win 4017, options [nop,nop,TS val 264594 ecr 41106,mptcp dss ack 2872732397 seq 408088667 subseq 41413 len 1428 csum 0x1318], length 1428
21:02:54.553601 IP 112.26.3.8.33629 > 112.26.3.1.44903: Flags [.], ack 19993, win 11042, options [nop,nop,TS val 42868 ecr 263340,nop,nop,sack 2 {41413:42841}{38557:39985},mptcp dss ack 407991563], length 0
21:02:54.601021 IP 112.26.3.8.33629 > 112.26.3.1.44903: Flags [.], ack 19993, win 10814, options [nop,nop,TS val 42634 ecr 263340,nop,nop,sack 2 {35701:37129}{25705:34273},mptcp dss ack 407991563], length 0
21:02:54.643468 IP 112.26.3.8.33629 > 112.26.3.1.44903: Flags [.], ack 19993, win 11042, options [nop,nop,TS val 42868 ecr 263340,nop,nop,sack 2 {41413:42841}{38557:39985},mptcp dss ack 407991563], length 0
21:02:54.711160 IP 112.26.3.8.33629 > 112.26.3.1.44903: Flags [.], ack 19993, win 10905, options [nop,nop,TS val 42763 ecr 263340,nop,nop,sack 2 {38557:39985}{35701:37129},mptcp dss ack 407991563], length 0
21:02:54.760963 IP 112.26.3.8.33629 > 112.26.3.1.44903: Flags [.], ack 19993, win 11042, options [nop,nop,TS val 42868 ecr 263340,nop,nop,sack 2 {41413:42841}{38557:39985},mptcp dss ack 407991563], length 0
21:02:54.764982 IP 112.26.3.1.44903 > 112.26.3.8.33629: Flags [.], seq 47125:48553, ack 1, win 4017, options [nop,nop,TS val 264872 ecr 41403,mptcp dss ack 2872732397 seq 408114371 subseq 47125 len 1428 csum 0xbb79], length 1428
21:02:54.765249 IP 112.26.3.1.44903 > 112.26.3.8.33629: Flags [.], seq 47125:48553, ack 1, win 4017, options [nop,nop,TS val 264872 ecr 41403,mptcp dss ack 2872732397 seq 408114371 subseq 47125 len 1428 csum 0xbb79], length 1428
21:02:54.799636 IP 112.26.3.8.33629 > 112.26.3.1.44903: Flags [.], ack 19993, win 11270, options [nop,nop,TS val 43085 ecr 263340,nop,nop,sack 2 {47125:48553}{41413:42841},mptcp dss ack 407991563], length 0
21:02:54.801668 IP 112.26.3.8.33629 > 112.26.3.1.44903: Flags [.], ack 19993, win 11270, options [nop,nop,TS val 43085 ecr 263340,nop,nop,sack 2 {47125:48553}{41413:42841},mptcp dss ack 407991563], length 0
21:02:54.864577 IP 112.26.3.8.33629 > 112.26.3.1.44903: Flags [.], ack 19993, win 11270, options [nop,nop,TS val 43085 ecr 263340,nop,nop,sack 2 {47125:48553}{41413:42841},mptcp dss ack 407991563], length 0
21:02:54.875032 IP 112.26.3.1.44903 > 112.26.3.8.33629: Flags [.], seq 48553:49981, ack 1, win 4017, options [nop,nop,TS val 264872 ecr 41403,mptcp dss ack 2872732397 seq 408115799 subseq 48553 len 1428 csum 0x54b5], length 1428
21:02:54.875344 IP 112.26.3.1.44903 > 112.26.3.8.33629: Flags [.], seq 48553:49981, ack 1, win 4017, options [nop,nop,TS val 264872 ecr 41403,mptcp dss ack 2872732397 seq 408115799 subseq 48553 len 1428 csum 0x54b5], length 1428
21:02:54.881380 IP 112.26.3.8.33629 > 112.26.3.1.44903: Flags [.], ack 19993, win 11407, options [nop,nop,TS val 43196 ecr 263340,nop,nop,sack 2 {47125:49981}{41413:42841},mptcp dss ack 407991563], length 0
21:02:54.883149 IP 112.26.3.8.33629 > 112.26.3.1.44903: Flags [.], ack 19993, win 11407, options [nop,nop,TS val 43196 ecr 263340,nop,nop,sack 2 {47125:49981}{41413:42841},mptcp dss ack 407991563], length 0
21:02:54.965013 IP 112.26.3.8.33629 > 112.26.3.1.44903: Flags [.], ack 19993, win 11407, options [nop,nop,TS val 43196 ecr 263340,nop,nop,sack 2 {47125:49981}{41413:42841},mptcp dss ack 407991563], length 0
21:02:54.980192 IP 112.26.3.1.44903 > 112.26.3.8.33629: Flags [.], seq 49981:51409, ack 1, win 4017, options [nop,nop,TS val 265009 ecr 41525,mptcp dss ack 2872732397 seq 408122939 subseq 49981 len 1428 csum 0x4621], length 1428
21:02:54.980490 IP 112.26.3.1.44903 > 112.26.3.8.33629: Flags [.], seq 49981:51409, ack 1, win 4017, options [nop,nop,TS val 265009 ecr 41525,mptcp dss ack 2872732397 seq 408122939 subseq 49981 len 1428 csum 0x4621], length 1428
21:02:55.014534 IP 112.26.3.8.33629 > 112.26.3.1.44903: Flags [.], ack 19993, win 11498, options [nop,nop,TS val 43300 ecr 263340,nop,nop,sack 2 {47125:51409}{41413:42841},mptcp dss ack 407991563], length 0
21:02:55.019535 IP 112.26.3.8.33629 > 112.26.3.1.44903: Flags [.], ack 19993, win 11498, options [nop,nop,TS val 43300 ecr 263340,nop,nop,sack 2 {47125:51409}{41413:42841},mptcp dss ack 407991563], length 0
21:02:55.089634 IP 112.26.3.8.33629 > 112.26.3.1.44903: Flags [.], ack 19993, win 11498, options [nop,nop,TS val 43300 ecr 263340,nop,nop,sack 2 {47125:51409}{41413:42841},mptcp dss ack 407991563], length 0
21:02:55.094588 IP 112.26.3.1.44903 > 112.26.3.8.33629: Flags [.], seq 52837:54265, ack 1, win 4017, options [nop,nop,TS val 265248 ecr 41769,mptcp dss ack 2872732397 seq 408134363 subseq 52837 len 1428 csum 0xbd61], length 1428
21:02:55.094859 IP 112.26.3.1.44903 > 112.26.3.8.33629: Flags [.], seq 52837:54265, ack 1, win 4017, options [nop,nop,TS val 265248 ecr 41769,mptcp dss ack 2872732397 seq 408134363 subseq 52837 len 1428 csum 0xbd61], length 1428
21:02:55.101925 IP 112.26.3.8.33629 > 112.26.3.1.44903: Flags [.], ack 19993, win 11635, options [nop,nop,TS val 43417 ecr 263340,nop,nop,sack 2 {52837:54265}{47125:51409},mptcp dss ack 407991563], length 0
21:02:55.104693 IP 112.26.3.8.33629 > 112.26.3.1.44903: Flags [.], ack 19993, win 11635, options [nop,nop,TS val 43417 ecr 263340,nop,nop,sack 2 {52837:54265}{47125:51409},mptcp dss ack 407991563], length 0
21:02:55.212897 IP 112.26.3.8.33629 > 112.26.3.1.44903: Flags [.], ack 19993, win 11635, options [nop,nop,TS val 43417 ecr 263340,nop,nop,sack 2 {52837:54265}{47125:51409},mptcp dss ack 407991563], length 0
21:02:55.237365 IP 112.26.3.1.44903 > 112.26.3.8.33629: Flags [.], seq 21421:22849, ack 1, win 4017, options [nop,nop,TS val 265485 ecr 42051,mptcp dss ack 2872732397 seq 408047255 subseq 21421 len 1428 csum 0x5250], length 1428
21:02:55.237665 IP 112.26.3.1.44903 > 112.26.3.8.33629: Flags [.], seq 21421:22849, ack 1, win 4017, options [nop,nop,TS val 265485 ecr 42051,mptcp dss ack 2872732397 seq 408047255 subseq 21421 len 1428 csum 0x5250], length 1428
21:02:55.244279 IP 112.26.3.8.33629 > 112.26.3.1.44903: Flags [.], ack 19993, win 11726, options [nop,nop,TS val 43557 ecr 263340,nop,nop,sack 2 {21421:22849}{52837:54265},mptcp dss ack 407991563], length 0
21:02:55.251686 IP 112.26.3.8.33629 > 112.26.3.1.44903: Flags [.], ack 19993, win 11726, options [nop,nop,TS val 43557 ecr 263340,nop,nop,sack 2 {21421:22849}{52837:54265},mptcp dss ack 407991563], length 0
21:02:55.320098 IP 112.26.3.8.33629 > 112.26.3.1.44903: Flags [.], ack 19993, win 11726, options [nop,nop,TS val 43557 ecr 263340,nop,nop,sack 2 {21421:22849}{52837:54265},mptcp dss ack 407991563], length 0
21:02:55.388767 IP 112.26.3.1.44903 > 112.26.3.8.33629: Flags [.], seq 24277:25705, ack 1, win 4017, options [nop,nop,TS val 265683 ecr 42170,mptcp dss ack 2872732397 seq 408051539 subseq 24277 len 1428 csum 0x5055], length 1428
21:02:55.389088 IP 112.26.3.1.44903 > 112.26.3.8.33629: Flags [.], seq 24277:25705, ack 1, win 4017, options [nop,nop,TS val 265683 ecr 42170,mptcp dss ack 2872732397 seq 408051539 subseq 24277 len 1428 csum 0x5055], length 1428
21:02:55.392813 IP 112.26.3.8.33629 > 112.26.3.1.44903: Flags [.], ack 19993, win 11909, options [nop,nop,TS val 43707 ecr 263340,nop,nop,sack 2 {24277:25705}{21421:22849},mptcp dss ack 407991563], length 0
21:02:55.402019 IP 112.26.3.8.33629 > 112.26.3.1.44903: Flags [.], ack 19993, win 11909, options [nop,nop,TS val 43707 ecr 263340,nop,nop,sack 2 {24277:25705}{21421:22849},mptcp dss ack 407991563], length 0
21:02:55.413847 IP 112.26.3.8.33629 > 112.26.3.1.44903: Flags [.], ack 19993, win 11909, options [nop,nop,TS val 43707 ecr 263340,nop,nop,sack 2 {24277:25705}{21421:22849},mptcp dss ack 407991563], length 0
21:02:55.521130 IP 112.26.3.1.44903 > 112.26.3.8.33629: Flags [.], seq 55693:57121, ack 1, win 4017, options [nop,nop,TS val 266130 ecr 42507,mptcp dss ack 2872732397 seq 408141503 subseq 55693 len 1428 csum 0x8bc3], length 1428
21:02:55.521393 IP 112.26.3.1.44903 > 112.26.3.8.33629: Flags [.], seq 55693:57121, ack 1, win 4017, options [nop,nop,TS val 266130 ecr 42507,mptcp dss ack 2872732397 seq 408141503 subseq 55693 len 1428 csum 0x8bc3], length 1428
21:02:55.532506 IP 112.26.3.8.33629 > 112.26.3.1.44903: Flags [.], ack 19993, win 12091, options [nop,nop,TS val 43844 ecr 263340,nop,nop,sack 2 {55693:57121}{24277:25705},mptcp dss ack 407991563], length 0
21:02:55.534234 IP 112.26.3.8.33629 > 112.26.3.1.44903: Flags [.], ack 19993, win 12091, options [nop,nop,TS val 43844 ecr 263340,nop,nop,sack 2 {55693:57121}{24277:25705},mptcp dss ack 407991563], length 0
21:02:55.546682 IP 112.26.3.8.33629 > 112.26.3.1.44903: Flags [.], ack 19993, win 12091, options [nop,nop,TS val 43844 ecr 263340,nop,nop,sack 2 {55693:57121}{24277:25705},mptcp dss ack 407991563], length 0
21:02:55.598916 IP 112.26.3.1.44903 > 112.26.3.8.33629: Flags [.], seq 34273:35701, ack 1, win 4017, options [nop,nop,TS val 266419 ecr 42763,mptcp dss ack 2872732397 seq 408044399 subseq 34273 len 1428 csum 0x7c8a], length 1428
21:02:55.599173 IP 112.26.3.1.44903 > 112.26.3.8.33629: Flags [.], seq 34273:35701, ack 1, win 4017, options [nop,nop,TS val 266419 ecr 42763,mptcp dss ack 2872732397 seq 408044399 subseq 34273 len 1428 csum 0x7c8a], length 1428
21:02:55.670180 IP 112.26.3.8.33629 > 112.26.3.1.44903: Flags [.], ack 19993, win 12319, options [nop,nop,TS val 43984 ecr 263340,nop,nop,sack 2 {34273:35701}{55693:57121},mptcp dss ack 407991563], length 0
21:02:55.675452 IP 112.26.3.8.33629 > 112.26.3.1.44903: Flags [.], ack 19993, win 12319, options [nop,nop,TS val 43984 ecr 263340,nop,nop,sack 2 {34273:35701}{55693:57121},mptcp dss ack 407991563], length 0
21:02:55.686365 IP 112.26.3.8.33629 > 112.26.3.1.44903: Flags [.], ack 19993, win 12319, options [nop,nop,TS val 43984 ecr 263340,nop,nop,sack 2 {34273:35701}{55693:57121},mptcp dss ack 407991563], length 0
21:02:55.713267 IP 112.26.3.1.44903 > 112.26.3.8.33629: Flags [.], seq 37129:38557, ack 1, win 4017, options [nop,nop,TS val 266469 ecr 42868,mptcp dss ack 2872732397 seq 408062963 subseq 37129 len 1428 csum 0x6470], length 1428
21:02:55.713555 IP 112.26.3.1.44903 > 112.26.3.8.33629: Flags [.], seq 37129:38557, ack 1, win 4017, options [nop,nop,TS val 266469 ecr 42868,mptcp dss ack 2872732397 seq 408062963 subseq 37129 len 1428 csum 0x6470], length 1428
21:02:55.745767 IP 112.26.3.8.33629 > 112.26.3.1.44903: Flags [.], ack 19993, win 12456, options [nop,nop,TS val 44056 ecr 263340,nop,nop,sack 2 {37129:38557}{34273:35701},mptcp dss ack 407991563], length 0
21:02:55.789667 IP 112.26.3.8.33629 > 112.26.3.1.44903: Flags [.], ack 19993, win 12456, options [nop,nop,TS val 44056 ecr 263340,nop,nop,sack 2 {37129:38557}{34273:35701},mptcp dss ack 407991563], length 0
21:02:55.822535 IP 112.26.3.8.33629 > 112.26.3.1.44903: Flags [.], ack 19993, win 12456, options [nop,nop,TS val 44056 ecr 263340,nop,nop,sack 2 {37129:38557}{34273:35701},mptcp dss ack 407991563], length 0
21:02:55.834110 IP 112.26.3.1.44903 > 112.26.3.8.33629: Flags [.], seq 39985:41413, ack 1, win 4017, options [nop,nop,TS val 266572 ecr 43085,mptcp dss ack 2872732397 seq 408070103 subseq 39985 len 1428 csum 0xa20b], length 1428
21:02:55.834367 IP 112.26.3.1.44903 > 112.26.3.8.33629: Flags [.], seq 39985:41413, ack 1, win 4017, options [nop,nop,TS val 266572 ecr 43085,mptcp dss ack 2872732397 seq 408070103 subseq 39985 len 1428 csum 0xa20b], length 1428
21:02:55.858403 IP 112.26.3.8.33629 > 112.26.3.1.44903: Flags [.], ack 19993, win 12639, options [nop,nop,TS val 44158 ecr 263340,nop,nop,sack 2 {39985:41413}{37129:38557},mptcp dss ack 408037259], length 0
21:02:55.915661 IP 112.26.3.8.33629 > 112.26.3.1.44903: Flags [.], ack 19993, win 12639, options [nop,nop,TS val 44158 ecr 263340,nop,nop,sack 2 {39985:41413}{37129:38557},mptcp dss ack 408037259], length 0
21:02:55.932366 IP 112.26.3.8.33629 > 112.26.3.1.44903: Flags [.], ack 19993, win 12639, options [nop,nop,TS val 44158 ecr 263340,nop,nop,sack 2 {39985:41413}{37129:38557},mptcp dss ack 408037259], length 0
21:02:55.972617 IP 112.26.3.1.44903 > 112.26.3.8.33629: Flags [.], seq 42841:44269, ack 1, win 4017, options [nop,nop,TS val 266673 ecr 43196,mptcp dss ack 2872732397 seq 408090095 subseq 42841 len 1428 csum 0x74cc], length 1428
21:02:55.972887 IP 112.26.3.1.44903 > 112.26.3.8.33629: Flags [.], seq 42841:44269, ack 1, win 4017, options [nop,nop,TS val 266673 ecr 43196,mptcp dss ack 2872732397 seq 408090095 subseq 42841 len 1428 csum 0x74cc], length 1428
21:02:55.979755 IP 112.26.3.8.33629 > 112.26.3.1.44903: Flags [.], ack 19993, win 12821, options [nop,nop,TS val 44292 ecr 263340,nop,nop,sack 2 {42841:44269}{39985:41413},mptcp dss ack 408037259], length 0
21:02:56.027512 IP 112.26.3.8.33629 > 112.26.3.1.44903: Flags [.], ack 19993, win 12821, options [nop,nop,TS val 44292 ecr 263340,nop,nop,sack 2 {42841:44269}{39985:41413},mptcp dss ack 408037259], length 0
21:02:56.071040 IP 112.26.3.8.33629 > 112.26.3.1.44903: Flags [.], ack 19993, win 12821, options [nop,nop,TS val 44292 ecr 263340,nop,nop,sack 2 {42841:44269}{39985:41413},mptcp dss ack 408037259], length 0
21:02:56.090522 IP 112.26.3.1.44903 > 112.26.3.8.33629: Flags [.], seq 44269:45697, ack 1, win 4017, options [nop,nop,TS val 266797 ecr 43300,mptcp dss ack 2872732397 seq 408100091 subseq 44269 len 1428 csum 0xa395], length 1428
21:02:56.090818 IP 112.26.3.1.44903 > 112.26.3.8.33629: Flags [.], seq 44269:45697, ack 1, win 4017, options [nop,nop,TS val 266797 ecr 43300,mptcp dss ack 2872732397 seq 408100091 subseq 44269 len 1428 csum 0xa395], length 1428
21:02:56.111197 IP 112.26.3.8.33629 > 112.26.3.1.44903: Flags [.], ack 19993, win 13004, options [nop,nop,TS val 44411 ecr 263340,nop,nop,sack 2 {42841:45697}{39985:41413},mptcp dss ack 408037259], length 0
21:02:56.171294 IP 112.26.3.8.33629 > 112.26.3.1.44903: Flags [.], ack 19993, win 13004, options [nop,nop,TS val 44411 ecr 263340,nop,nop,sack 2 {42841:45697}{39985:41413},mptcp dss ack 408037259], length 0
21:02:56.179409 IP 112.26.3.8.33629 > 112.26.3.1.44903: Flags [.], ack 19993, win 13004, options [nop,nop,TS val 44411 ecr 263340,nop,nop,sack 2 {42841:45697}{39985:41413},mptcp dss ack 408037259], length 0
21:02:56.225180 IP 112.26.3.1.44903 > 112.26.3.8.33629: Flags [.], seq 19993:21421, ack 1, win 4017, options [nop,nop,TS val 267028 ecr 43557,mptcp dss ack 2872732397 seq 408037259 subseq 19993 len 1428 csum 0x4620], length 1428
21:02:56.225488 IP 112.26.3.1.44903 > 112.26.3.8.33629: Flags [.], seq 19993:21421, ack 1, win 4017, options [nop,nop,TS val 267028 ecr 43557,mptcp dss ack 2872732397 seq 408037259 subseq 19993 len 1428 csum 0x4620], length 1428
21:02:56.232617 IP 112.26.3.8.33629 > 112.26.3.1.44903: Flags [.], ack 45697, win 13277, options [nop,nop,TS val 44545 ecr 267028,mptcp dss ack 408058679], length 0
21:02:56.258227 IP 112.26.3.8.33629 > 112.26.3.1.44903: Flags [.], ack 45697, win 13277, options [nop,nop,TS val 44545 ecr 267028,mptcp dss ack 408058679], length 0
21:02:56.281258 IP 112.26.3.8.33629 > 112.26.3.1.44903: Flags [.], ack 45697, win 13277, options [nop,nop,TS val 44545 ecr 267028,mptcp dss ack 408058679], length 0
