21:02:50.743890 IP 112.26.3.8.33629 > 112.26.3.1.44903: Flags [S], seq 3971283100, win 65535, options [mss 1460,sackOK,TS val 38902 ecr 0,nop,wscale 6,mptcp join id 6 token 0x7fa57e4e nonce 0xc247ffbd], length 0
21:02:50.779661 IP 112.26.3.1.44903 > 112.26.3.8.33629: Flags [S.], seq 2159510627, ack 3971283101, win 65535, options [mss 1460,sackOK,TS val 262453 ecr 38902,nop,wscale 6,mptcp join id 5 hmac 0xe7ece21ed53d2c0b nonce 0xd823ce4a], length 0
21:02:50.899914 IP 112.26.3.1.44903 > 112.26.3.8.33629: Flags [S.], seq 2159510627, ack 3971283101, win 65535, options [mss 1460,sackOK,TS val 262453 ecr 38902,nop,wscale 6,mptcp join id 5 hmac 0xe7ece21ed53d2c0b nonce 0xd823ce4a], length 0
21:02:51.067832 IP 112.26.3.8.33629 > 112.26.3.1.44903: Flags [.], ack 1, win 7072, options [nop,nop,TS val 39271 ecr 262453,mptcp join hmac 0xe3cc2e5246ed467bceebf989319b635bc71aea97], length 0
21:02:51.068237 IP 112.26.3.1.44903 > 112.26.3.8.33629: Flags [.], ack 1, win 4017, options [nop,nop,TS val 262776 ecr 39271,mptcp dss ack 2872732397], length 0
21:02:51.079033 IP 112.26.3.1.44903 > 112.26.3.8.33629: Flags [.], ack 1, win 4017, options [nop,nop,TS val 262776 ecr 39271,mptcp dss ack 2872732397], length 0
21:02:51.135281 IP 112.26.3.1.44903 > 112.26.3.8.33629: Flags [.], seq 1:1429, ack 1, win 4017, options [nop,nop,TS val 262843 ecr 39271,mptcp dss ack 2872732397 seq 408010127 subseq 1 len 1428 csum 0xe19b], length 1428
21:02:51.135456 IP 112.26.3.1.44903 > 112.26.3.8.33629: Flags [.], seq 1429:2857, ack 1, win 4017, options [nop,nop,TS val 262843 ecr 39271,mptcp dss ack 2872732397 seq 408011555 subseq 1429 len 1428 csum 0xce77], length 1428
21:02:51.135785 IP 112.26.3.1.44903 > 112.26.3.8.33629: Flags [.], seq 2857:4285, ack 1, win 4017, options [nop,nop,TS val 262843 ecr 39271,mptcp dss ack 2872732397 seq 408012983 subseq 2857 len 1428 csum 0x7e92], length 1428
21:02:51.139356 IP 112.26.3.1.44903 > 112.26.3.8.33629: Flags [.], seq 1:1429, ack 1, win 4017, options [nop,nop,TS val 262843 ecr 39271,mptcp dss ack 2872732397 seq 408010127 subseq 1 len 1428 csum 0xe19b], length 1428
21:02:51.234805 IP 112.26.3.8.33629 > 112.26.3.1.44903: Flags [.], ack 1429, win 7209, options [nop,nop,TS val 39459 ecr 262843,mptcp dss ack 407967287], length 0
21:02:51.235144 IP 112.26.3.1.44903 > 112.26.3.8.33629: Flags [.], seq 4285:5713, ack 1, win 4017, options [nop,nop,TS val 262943 ecr 39271,mptcp dss ack 2872732397 seq 408015839 subseq 4285 len 1428 csum 0x1424], length 1428
21:02:51.235220 IP 112.26.3.1.44903 > 112.26.3.8.33629: Flags [.], seq 5713:7141, ack 1, win 4017, options [nop,nop,TS val 262943 ecr 39271,mptcp dss ack 2872732397 seq 408017267 subseq 5713 len 1428 csum 0x946d], length 1428
21:02:51.235512 IP 112.26.3.1.44903 > 112.26.3.8.33629: Flags [.], seq 7141:8569, ack 1, win 4017, options [nop,nop,TS val 262944 ecr 39459,mptcp dss ack 2872732397 seq 408018695 subseq 7141 len 1428 csum 0x76a2], length 1428
21:02:51.235628 IP 112.26.3.1.44903 > 112.26.3.8.33629: Flags [.], seq 8569:9997, ack 1, win 4017, options [nop,nop,TS val 262944 ecr 39459,mptcp dss ack 2872732397 seq 408020123 subseq 8569 len 1428 csum 0x5681], length 1428
21:02:51.235776 IP 112.26.3.1.44903 > 112.26.3.8.33629: Flags [.], seq 9997:11425, ack 1, win 4017, options [nop,nop,TS val 262944 ecr 39459,mptcp dss ack 2872732397 seq 408021551 subseq 9997 len 1428 csum 0x479f], length 1428
21:02:51.235875 IP 112.26.3.1.44903 > 112.26.3.8.33629: Flags [.], seq 11425:12853, ack 1, win 4017, options [nop,nop,TS val 262944 ecr 39459,mptcp dss ack 2872732397 seq 408022979 subseq 11425 len 1428 csum 0x880c], length 1428
21:02:51.236019 IP 112.26.3.1.44903 > 112.26.3.8.33629: Flags [.], seq 12853:14281, ack 1, win 4017, options [nop,nop,TS val 262944 ecr 39459,mptcp dss ack 2872732397 seq 408024407 subseq 12853 len 1428 csum 0x2e44], length 1428
21:02:51.236193 IP 112.26.3.1.44903 > 112.26.3.8.33629: Flags [.], seq 14281:15709, ack 1, win 4017, options [nop,nop,TS val 262944 ecr 39459,mptcp dss ack 2872732397 seq 408025835 subseq 14281 len 1428 csum 0x7fe1], length 1428
21:02:51.394053 IP 112.26.3.1.44903 > 112.26.3.8.33629: Flags [.], seq 1429:2857, ack 1, win 4017, options [nop,nop,TS val 262843 ecr 39271,mptcp dss ack 2872732397 seq 408011555 subseq 1429 len 1428 csum 0xce77], length 1428
21:02:51.464191 IP 112.26.3.1.44903 > 112.26.3.8.33629: Flags [.], seq 2857:4285, ack 1, win 4017, options [nop,nop,TS val 262843 ecr 39271,mptcp dss ack 2872732397 seq 408012983 subseq 2857 len 1428 csum 0x7e92], length 1428
21:02:51.475982 IP 112.26.3.8.33629 > 112.26.3.1.44903: Flags [.], ack 2857, win 7483, options [nop,nop,TS val 39713 ecr 262843,mptcp dss ack 407970143], length 0
21:02:51.476353 IP 112.26.3.1.44903 > 112.26.3.8.33629: Flags [.], seq 15709:17137, ack 1, win 4017, options [nop,nop,TS val 263184 ecr 39713,mptcp dss ack 2872732397 seq 408032975 subseq 15709 len 1428 csum 0xa833], length 1428
21:02:51.476428 IP 112.26.3.1.44903 > 112.26.3.8.33629: Flags [.], seq 17137:18565, ack 1, win 4017, options [nop,nop,TS val 263184 ecr 39713,mptcp dss ack 2872732397 seq 408034403 subseq 17137 len 1428 csum 0x2184], length 1428
21:02:51.631692 IP 112.26.3.8.33629 > 112.26.3.1.44903: Flags [.], ack 4285, win 7574, options [nop,nop,TS val 39840 ecr 262843,mptcp dss ack 407971571], length 0
21:02:51.631946 IP 112.26.3.1.44903 > 112.26.3.8.33629: Flags [.], seq 18565:19993, ack 1, win 4017, options [nop,nop,TS val 263340 ecr 39840,mptcp dss ack 2872732397 seq 408035831 subseq 18565 len 1428 csum 0x224e], length 1428
21:02:51.632053 IP 112.26.3.1.44903 > 112.26.3.8.33629: Flags [.], seq 19993:21421, ack 1, win 4017, options [nop,nop,TS val 263340 ecr 39840,mptcp dss ack 2872732397 seq 408037259 subseq 19993 len 1428 csum 0x4620], length 1428
21:02:51.719321 IP 112.26.3.1.44903 > 112.26.3.8.33629: Flags [.], seq 4285:5713, ack 1, win 4017, options [nop,nop,TS val 262943 ecr 39271,mptcp dss ack 2872732397 seq 408015839 subseq 4285 len 1428 csum 0x1424], length 1428
21:02:51.826757 IP 112.26.3.1.44903 > 112.26.3.8.33629: Flags [.], seq 5713:7141, ack 1, win 4017, options [nop,nop,TS val 262943 ecr 39271,mptcp dss ack 2872732397 seq 408017267 subseq 5713 len 1428 csum 0x946d], length 1428
21:02:51.889470 IP 112.26.3.8.33629 > 112.26.3.1.44903: Flags [.], ack 5713, win 7757, options [nop,nop,TS val 40040 ecr 262943,mptcp dss ack 407972999], length 0
21:02:51.889795 IP 112.26.3.1.44903 > 112.26.3.8.33629: Flags [.], seq 21421:22849, ack 1, win 4017, options [nop,nop,TS val 263598 ecr 40040,mptcp dss ack 2872732397 seq 408047255 subseq 21421 len 1428 csum 0x5250], length 1428
21:02:51.889870 IP 112.26.3.1.44903 > 112.26.3.8.33629: Flags [.], seq 22849:24277, ack 1, win 4017, options [nop,nop,TS val 263598 ecr 40040,mptcp dss ack 2872732397 seq 408048683 subseq 22849 len 1428 csum 0x2f20], length 1428
21:02:51.980756 IP 112.26.3.8.33629 > 112.26.3.1.44903: Flags [.], ack 7141, win 7894, options [nop,nop,TS val 40149 ecr 262943,mptcp dss ack 407974427], length 0
21:02:51.981044 IP 112.26.3.1.44903 > 112.26.3.8.33629: Flags [.], seq 24277:25705, ack 1, win 4017, options [nop,nop,TS val 263689 ecr 40149,mptcp dss ack 2872732397 seq 408051539 subseq 24277 len 1428 csum 0x5055], length 1428
21:02:51.981140 IP 112.26.3.1.44903 > 112.26.3.8.33629: Flags [.], seq 25705:27133, ack 1, win 4017, options [nop,nop,TS val 263689 ecr 40149,mptcp dss ack 2872732397 seq 408052967 subseq 25705 len 1428 csum 0x780b], length 1428
21:02:52.016629 IP 112.26.3.1.44903 > 112.26.3.8.33629: Flags [.], seq 7141:8569, ack 1, win 4017, options [nop,nop,TS val 262944 ecr 39459,mptcp dss ack 2872732397 seq 408018695 subseq 7141 len 1428 csum 0x76a2], length 1428
21:02:52.104390 IP 112.26.3.1.44903 > 112.26.3.8.33629: Flags [.], seq 8569:9997, ack 1, win 4017, options [nop,nop,TS val 262944 ecr 39459,mptcp dss ack 2872732397 seq 408020123 subseq 8569 len 1428 csum 0x5681], length 1428
21:02:52.144840 IP 112.26.3.8.33629 > 112.26.3.1.44903: Flags [.], ack 8569, win 8167, options [nop,nop,TS val 40338 ecr 262944,mptcp dss ack 407977283], length 0
21:02:52.145391 IP 112.26.3.1.44903 > 112.26.3.8.33629: Flags [.], seq 27133:28561, ack 1, win 4017, options [nop,nop,TS val 263853 ecr 40338,mptcp dss ack 2872732397 seq 407982995 subseq 27133 len 1428 csum 0xd681], length 1428
21:02:52.145447 IP 112.26.3.1.44903 > 112.26.3.8.33629: Flags [.], seq 28561:29989, ack 1, win 4017, options [nop,nop,TS val 263853 ecr 40338,mptcp dss ack 2872732397 seq 407984423 subseq 28561 len 1428 csum 0xfa42], length 1428
21:02:52.272619 IP 112.26.3.8.33629 > 112.26.3.1.44903: Flags [.], ack 9997, win 8304, options [nop,nop,TS val 40443 ecr 262944,mptcp dss ack 407985851], length 0
21:02:52.272899 IP 112.26.3.1.44903 > 112.26.3.8.33629: Flags [.], seq 29989:31417, ack 1, win 4017, options [nop,nop,TS val 263981 ecr 40443,mptcp dss ack 2872732397 seq 407985851 subseq 29989 len 1428 csum 0x28be], length 1428
21:02:52.272968 IP 112.26.3.1.44903 > 112.26.3.8.33629: Flags [.], seq 31417:32845, ack 1, win 4017, options [nop,nop,TS val 263981 ecr 40443,mptcp dss ack 2872732397 seq 407987279 subseq 31417 len 1428 csum 0xdb46], length 1428
21:02:52.327473 IP 112.26.3.1.44903 > 112.26.3.8.33629: Flags [.], seq 9997:11425, ack 1, win 4017, options [nop,nop,TS val 262944 ecr 39459,mptcp dss ack 2872732397 seq 408021551 subseq 9997 len 1428 csum 0x479f], length 1428
21:02:52.404950 IP 112.26.3.8.33629 > 112.26.3.1.44903: Flags [.], ack 11425, win 8532, options [nop,nop,TS val 40649 ecr 262944,mptcp dss ack 407988707], length 0
21:02:52.405359 IP 112.26.3.1.44903 > 112.26.3.8.33629: Flags [.], seq 32845:34273, ack 1, win 4017, options [nop,nop,TS val 264113 ecr 40649,mptcp dss ack 2872732397 seq 408042971 subseq 32845 len 1428 csum 0xb869], length 1428
21:02:52.405435 IP 112.26.3.1.44903 > 112.26.3.8.33629: Flags [.], seq 34273:35701, ack 1, win 4017, options [nop,nop,TS val 264113 ecr 40649,mptcp dss ack 2872732397 seq 408044399 subseq 34273 len 1428 csum 0x7c8a], length 1428
21:02:52.502427 IP 112.26.3.1.44903 > 112.26.3.8.33629: Flags [.], seq 11425:12853, ack 1, win 4017, options [nop,nop,TS val 262944 ecr 39459,mptcp dss ack 2872732397 seq 408022979 subseq 11425 len 1428 csum 0x880c], length 1428
21:02:52.588268 IP 112.26.3.8.33629 > 112.26.3.1.44903: Flags [.], ack 12853, win 8806, options [nop,nop,TS val 40821 ecr 262944,mptcp dss ack 407991563], length 0
21:02:52.588590 IP 112.26.3.1.44903 > 112.26.3.8.33629: Flags [.], seq 35701:37129, ack 1, win 4017, options [nop,nop,TS val 264297 ecr 40821,mptcp dss ack 2872732397 seq 408061535 subseq 35701 len 1428 csum 0xbb78], length 1428
21:02:52.588704 IP 112.26.3.1.44903 > 112.26.3.8.33629: Flags [.], seq 37129:38557, ack 1, win 4017, options [nop,nop,TS val 264297 ecr 40821,mptcp dss ack 2872732397 seq 408062963 subseq 37129 len 1428 csum 0x6470], length 1428
21:02:52.655097 IP 112.26.3.1.44903 > 112.26.3.8.33629: Flags [.], seq 12853:14281, ack 1, win 4017, options [nop,nop,TS val 262944 ecr 39459,mptcp dss ack 2872732397 seq 408024407 subseq 12853 len 1428 csum 0x2e44], length 1428
21:02:52.698883 IP 112.26.3.8.33629 > 112.26.3.1.44903: Flags [.], ack 14281, win 8943, options [nop,nop,TS val 40980 ecr 262944,mptcp dss ack 407991563], length 0
21:02:52.699247 IP 112.26.3.1.44903 > 112.26.3.8.33629: Flags [.], seq 38557:39985, ack 1, win 4017, options [nop,nop,TS val 264407 ecr 40980,mptcp dss ack 2872732397 seq 408068675 subseq 38557 len 1428 csum 0xc425], length 1428
21:02:52.699324 IP 112.26.3.1.44903 > 112.26.3.8.33629: Flags [.], seq 39985:41413, ack 1, win 4017, options [nop,nop,TS val 264407 ecr 40980,mptcp dss ack 2872732397 seq 408070103 subseq 39985 len 1428 csum 0xa20b], length 1428
21:02:52.786832 IP 112.26.3.1.44903 > 112.26.3.8.33629: Flags [.], seq 14281:15709, ack 1, win 4017, options [nop,nop,TS val 262944 ecr 39459,mptcp dss ack 2872732397 seq 408025835 subseq 14281 len 1428 csum 0x7fe1], length 1428
21:02:52.886054 IP 112.26.3.8.33629 > 112.26.3.1.44903: Flags [.], ack 15709, win 9080, options [nop,nop,TS val 41106 ecr 262944,mptcp dss ack 407991563], length 0
21:02:52.886390 IP 112.26.3.1.44903 > 112.26.3.8.33629: Flags [.], seq 41413:42841, ack 1, win 4017, options [nop,nop,TS val 264594 ecr 41106,mptcp dss ack 2872732397 seq 408088667 subseq 41413 len 1428 csum 0x1318], length 1428
21:02:52.886465 IP 112.26.3.1.44903 > 112.26.3.8.33629: Flags [.], seq 42841:44269, ack 1, win 4017, options [nop,nop,TS val 264594 ecr 41106,mptcp dss ack 2872732397 seq 408090095 subseq 42841 len 1428 csum 0x74cc], length 1428
21:02:52.947133 IP 112.26.3.1.44903 > 112.26.3.8.33629: Flags [.], seq 15709:17137, ack 1, win 4017, options [nop,nop,TS val 263184 ecr 39713,mptcp dss ack 2872732397 seq 408032975 subseq 15709 len 1428 csum 0xa833], length 1428
21:02:53.028924 IP 112.26.3.8.33629 > 112.26.3.1.44903: Flags [.], ack 17137, win 9262, options [nop,nop,TS val 41270 ecr 263184,mptcp dss ack 407991563], length 0
21:02:53.029278 IP 112.26.3.1.44903 > 112.26.3.8.33629: Flags [.], seq 44269:45697, ack 1, win 4017, options [nop,nop,TS val 264737 ecr 41270,mptcp dss ack 2872732397 seq 408100091 subseq 44269 len 1428 csum 0xa395], length 1428
21:02:53.029356 IP 112.26.3.1.44903 > 112.26.3.8.33629: Flags [.], seq 45697:47125, ack 1, win 4017, options [nop,nop,TS val 264737 ecr 41270,mptcp dss ack 2872732397 seq 408101519 subseq 45697 len 1428 csum 0xe591], length 1428
21:02:53.073874 IP 112.26.3.1.44903 > 112.26.3.8.33629: Flags [.], seq 17137:18565, ack 1, win 4017, options [nop,nop,TS val 263184 ecr 39713,mptcp dss ack 2872732397 seq 408034403 subseq 17137 len 1428 csum 0x2184], length 1428
21:02:53.164283 IP 112.26.3.8.33629 > 112.26.3.1.44903: Flags [.], ack 18565, win 9354, options [nop,nop,TS val 41403 ecr 263184,mptcp dss ack 407991563], length 0
21:02:53.164619 IP 112.26.3.1.44903 > 112.26.3.8.33629: Flags [.], seq 47125:48553, ack 1, win 4017, options [nop,nop,TS val 264872 ecr 41403,mptcp dss ack 2872732397 seq 408114371 subseq 47125 len 1428 csum 0xbb79], length 1428
21:02:53.164692 IP 112.26.3.1.44903 > 112.26.3.8.33629: Flags [.], seq 48553:49981, ack 1, win 4017, options [nop,nop,TS val 264872 ecr 41403,mptcp dss ack 2872732397 seq 408115799 subseq 48553 len 1428 csum 0x54b5], length 1428
21:02:53.204679 IP 112.26.3.1.44903 > 112.26.3.8.33629: Flags [.], seq 18565:19993, ack 1, win 4017, options [nop,nop,TS val 263340 ecr 39840,mptcp dss ack 2872732397 seq 408035831 subseq 18565 len 1428 csum 0x224e], length 1428
21:02:53.301243 IP 112.26.3.8.33629 > 112.26.3.1.44903: Flags [.], ack 19993, win 9445, options [nop,nop,TS val 41525 ecr 263340,mptcp dss ack 407991563], length 0
21:02:53.301582 IP 112.26.3.1.44903 > 112.26.3.8.33629: Flags [.], seq 49981:51409, ack 1, win 4017, options [nop,nop,TS val 265009 ecr 41525,mptcp dss ack 2872732397 seq 408122939 subseq 49981 len 1428 csum 0x4621], length 1428
21:02:53.301661 IP 112.26.3.1.44903 > 112.26.3.8.33629: Flags [.], seq 51409:52837, ack 1, win 4017, options [nop,nop,TS val 265009 ecr 41525,mptcp dss ack 2872732397 seq 408124367 subseq 51409 len 1428 csum 0x878f], length 1428
21:02:53.449065 IP 112.26.3.1.44903 > 112.26.3.8.33629: Flags [.], seq 22849:24277, ack 1, win 4017, options [nop,nop,TS val 263598 ecr 40040,mptcp dss ack 2872732397 seq 408048683 subseq 22849 len 1428 csum 0x2f20], length 1428
21:02:53.465814 IP 112.26.3.8.33629 > 112.26.3.1.44903: Flags [.], ack 19993, win 9673, options [nop,nop,TS val 41769 ecr 263340,nop,nop,sack 1 {22849:24277},mptcp dss ack 407991563], length 0
21:02:53.539223 IP 112.26.3.1.44903 > 112.26.3.8.33629: Flags [.], seq 52837:54265, ack 1, win 4017, options [nop,nop,TS val 265248 ecr 41769,mptcp dss ack 2872732397 seq 408134363 subseq 52837 len 1428 csum 0xbd61], length 1428
21:02:53.568406 IP 112.26.3.1.44903 > 112.26.3.8.33629: Flags [.], seq 25705:27133, ack 1, win 4017, options [nop,nop,TS val 263689 ecr 40149,mptcp dss ack 2872732397 seq 408052967 subseq 25705 len 1428 csum 0x780b], length 1428
21:02:53.609546 IP 112.26.3.8.33629 > 112.26.3.1.44903: Flags [.], ack 19993, win 9855, options [nop,nop,TS val 41909 ecr 263340,nop,nop,sack 2 {25705:27133}{22849:24277},mptcp dss ack 407991563], length 0
21:02:53.609884 IP 112.26.3.1.44903 > 112.26.3.8.33629: Flags [.], seq 19993:21421, ack 1, win 4017, options [nop,nop,TS val 265318 ecr 41909,mptcp dss ack 2872732397 seq 408037259 subseq 19993 len 1428 csum 0x4620], length 1428
21:02:53.724404 IP 112.26.3.1.44903 > 112.26.3.8.33629: Flags [.], seq 27133:28561, ack 1, win 4017, options [nop,nop,TS val 263853 ecr 40338,mptcp dss ack 2872732397 seq 407982995 subseq 27133 len 1428 csum 0xd681], length 1428
21:02:53.776184 IP 112.26.3.8.33629 > 112.26.3.1.44903: Flags [.], ack 19993, win 9992, options [nop,nop,TS val 42051 ecr 263340,nop,nop,sack 2 {25705:28561}{22849:24277},mptcp dss ack 407991563], length 0
21:02:53.776465 IP 112.26.3.1.44903 > 112.26.3.8.33629: Flags [.], seq 21421:22849, ack 1, win 4017, options [nop,nop,TS val 265485 ecr 42051,mptcp dss ack 2872732397 seq 408047255 subseq 21421 len 1428 csum 0x5250], length 1428
21:02:53.790535 IP 112.26.3.1.44903 > 112.26.3.8.33629: Flags [.], seq 28561:29989, ack 1, win 4017, options [nop,nop,TS val 263853 ecr 40338,mptcp dss ack 2872732397 seq 407984423 subseq 28561 len 1428 csum 0xfa42], length 1428
21:02:53.929238 IP 112.26.3.1.44903 > 112.26.3.8.33629: Flags [.], seq 29989:31417, ack 1, win 4017, options [nop,nop,TS val 263981 ecr 40443,mptcp dss ack 2872732397 seq 407985851 subseq 29989 len 1428 csum 0x28be], length 1428
21:02:53.974006 IP 112.26.3.8.33629 > 112.26.3.1.44903: Flags [.], ack 19993, win 10175, options [nop,nop,TS val 42170 ecr 263340,nop,nop,sack 2 {25705:29989}{22849:24277},mptcp dss ack 407991563], length 0
21:02:53.974264 IP 112.26.3.1.44903 > 112.26.3.8.33629: Flags [.], seq 24277:25705, ack 1, win 4017, options [nop,nop,TS val 265683 ecr 42170,mptcp dss ack 2872732397 seq 408051539 subseq 24277 len 1428 csum 0x5055], length 1428
21:02:54.017610 IP 112.26.3.1.44903 > 112.26.3.8.33629: Flags [.], seq 31417:32845, ack 1, win 4017, options [nop,nop,TS val 263981 ecr 40443,mptcp dss ack 2872732397 seq 407987279 subseq 31417 len 1428 csum 0xdb46], length 1428
21:02:54.098248 IP 112.26.3.1.44903 > 112.26.3.8.33629: Flags [.], seq 32845:34273, ack 1, win 4017, options [nop,nop,TS val 264113 ecr 40649,mptcp dss ack 2872732397 seq 408042971 subseq 32845 len 1428 csum 0xb869], length 1428
21:02:54.131448 IP 112.26.3.8.33629 > 112.26.3.1.44903: Flags [.], ack 19993, win 10312, options [nop,nop,TS val 42279 ecr 263340,nop,nop,sack 2 {25705:31417}{22849:24277},mptcp dss ack 407991563], length 0
21:02:54.277971 IP 112.26.3.1.44903 > 112.26.3.8.33629: Flags [.], seq 35701:37129, ack 1, win 4017, options [nop,nop,TS val 264297 ecr 40821,mptcp dss ack 2872732397 seq 408061535 subseq 35701 len 1428 csum 0xbb78], length 1428
21:02:54.284970 IP 112.26.3.8.33629 > 112.26.3.1.44903: Flags [.], ack 19993, win 10540, options [nop,nop,TS val 42418 ecr 263340,nop,nop,sack 2 {25705:32845}{22849:24277},mptcp dss ack 407991563], length 0
21:02:54.332959 IP 112.26.3.1.44903 > 112.26.3.8.33629: Flags [.], seq 54265:55693, ack 1, win 4017, options [nop,nop,TS val 266041 ecr 42418,mptcp dss ack 2872732397 seq 408140075 subseq 54265 len 1428 csum 0x2e0d], length 1428
21:02:54.383955 IP 112.26.3.8.33629 > 112.26.3.1.44903: Flags [.], ack 19993, win 10585, options [nop,nop,TS val 42507 ecr 263340,nop,nop,sack 2 {25705:34273}{22849:24277},mptcp dss ack 407991563], length 0
21:02:54.421745 IP 112.26.3.1.44903 > 112.26.3.8.33629: Flags [.], seq 55693:57121, ack 1, win 4017, options [nop,nop,TS val 266130 ecr 42507,mptcp dss ack 2872732397 seq 408141503 subseq 55693 len 1428 csum 0x8bc3], length 1428
21:02:54.441520 IP 112.26.3.1.44903 > 112.26.3.8.33629: Flags [.], seq 38557:39985, ack 1, win 4017, options [nop,nop,TS val 264407 ecr 40980,mptcp dss ack 2872732397 seq 408068675 subseq 38557 len 1428 csum 0xc425], length 1428
21:02:54.540303 IP 112.26.3.1.44903 > 112.26.3.8.33629: Flags [.], seq 41413:42841, ack 1, win 4017, options [nop,nop,TS val 264594 ecr 41106,mptcp dss ack 2872732397 seq 408088667 subseq 41413 len 1428 csum 0x1318], length 1428
21:02:54.600683 IP 112.26.3.8.33629 > 112.26.3.1.44903: Flags [.], ack 19993, win 10814, options [nop,nop,TS val 42634 ecr 263340,nop,nop,sack 2 {35701:37129}{25705:34273},mptcp dss ack 407991563], length 0
21:02:54.710813 IP 112.26.3.8.33629 > 112.26.3.1.44903: Flags [.], ack 19993, win 10905, options [nop,nop,TS val 42763 ecr 263340,nop,nop,sack 2 {38557:39985}{35701:37129},mptcp dss ack 407991563], length 0
21:02:54.711213 IP 112.26.3.1.44903 > 112.26.3.8.33629: Flags [.], seq 34273:35701, ack 1, win 4017, options [nop,nop,TS val 266419 ecr 42763,mptcp dss ack 2872732397 seq 408044399 subseq 34273 len 1428 csum 0x7c8a], length 1428
21:02:54.760626 IP 112.26.3.8.33629 > 112.26.3.1.44903: Flags [.], ack 19993, win 11042, options [nop,nop,TS val 42868 ecr 263340,nop,nop,sack 2 {41413:42841}{38557:39985},mptcp dss ack 407991563], length 0
21:02:54.760957 IP 112.26.3.1.44903 > 112.26.3.8.33629: Flags [.], seq 37129:38557, ack 1, win 4017, options [nop,nop,TS val 266469 ecr 42868,mptcp dss ack 2872732397 seq 408062963 subseq 37129 len 1428 csum 0x6470], length 1428
21:02:54.764868 IP 112.26.3.1.44903 > 112.26.3.8.33629: Flags [.], seq 47125:48553, ack 1, win 4017, options [nop,nop,TS val 264872 ecr 41403,mptcp dss ack 2872732397 seq 408114371 subseq 47125 len 1428 csum 0xbb79], length 1428
21:02:54.864234 IP 112.26.3.8.33629 > 112.26.3.1.44903: Flags [.], ack 19993, win 11270, options [nop,nop,TS val 43085 ecr 263340,nop,nop,sack 2 {47125:48553}{41413:42841},mptcp dss ack 407991563], length 0
21:02:54.864700 IP 112.26.3.1.44903 > 112.26.3.8.33629: Flags [.], seq 39985:41413, ack 1, win 4017, options [nop,nop,TS val 266572 ecr 43085,mptcp dss ack 2872732397 seq 408070103 subseq 39985 len 1428 csum 0xa20b], length 1428
21:02:54.874918 IP 112.26.3.1.44903 > 112.26.3.8.33629: Flags [.], seq 48553:49981, ack 1, win 4017, options [nop,nop,TS val 264872 ecr 41403,mptcp dss ack 2872732397 seq 408115799 subseq 48553 len 1428 csum 0x54b5], length 1428
21:02:54.964586 IP 112.26.3.8.33629 > 112.26.3.1.44903: Flags [.], ack 19993, win 11407, options [nop,nop,TS val 43196 ecr 263340,nop,nop,sack 2 {47125:49981}{41413:42841},mptcp dss ack 407991563], length 0
21:02:54.964985 IP 112.26.3.1.44903 > 112.26.3.8.33629: Flags [.], seq 42841:44269, ack 1, win 4017, options [nop,nop,TS val 266673 ecr 43196,mptcp dss ack 2872732397 seq 408090095 subseq 42841 len 1428 csum 0x74cc], length 1428
21:02:54.980076 IP 112.26.3.1.44903 > 112.26.3.8.33629: Flags [.], seq 49981:51409, ack 1, win 4017, options [nop,nop,TS val 265009 ecr 41525,mptcp dss ack 2872732397 seq 408122939 subseq 49981 len 1428 csum 0x4621], length 1428
21:02:55.089299 IP 112.26.3.8.33629 > 112.26.3.1.44903: Flags [.], ack 19993, win 11498, options [nop,nop,TS val 43300 ecr 263340,nop,nop,sack 2 {47125:51409}{41413:42841},mptcp dss ack 407991563], length 0
21:02:55.089722 IP 112.26.3.1.44903 > 112.26.3.8.33629: Flags [.], seq 44269:45697, ack 1, win 4017, options [nop,nop,TS val 266797 ecr 43300,mptcp dss ack 2872732397 seq 408100091 subseq 44269 len 1428 csum 0xa395], length 1428
21:02:55.094474 IP 112.26.3.1.44903 > 112.26.3.8.33629: Flags [.], seq 52837:54265, ack 1, win 4017, options [nop,nop,TS val 265248 ecr 41769,mptcp dss ack 2872732397 seq 408134363 subseq 52837 len 1428 csum 0xbd61], length 1428
21:02:55.212556 IP 112.26.3.8.33629 > 112.26.3.1.44903: Flags [.], ack 19993, win 11635, options [nop,nop,TS val 43417 ecr 263340,nop,nop,sack 2 {52837:54265}{47125:51409},mptcp dss ack 407991563], length 0
21:02:55.212932 IP 112.26.3.1.44903 > 112.26.3.8.33629: Flags [.], seq 45697:47125, ack 1, win 4017, options [nop,nop,TS val 266921 ecr 43417,mptcp dss ack 2872732397 seq 408101519 subseq 45697 len 1428 csum 0xe591], length 1428
21:02:55.237251 IP 112.26.3.1.44903 > 112.26.3.8.33629: Flags [.], seq 21421:22849, ack 1, win 4017, options [nop,nop,TS val 265485 ecr 42051,mptcp dss ack 2872732397 seq 408047255 subseq 21421 len 1428 csum 0x5250], length 1428
21:02:55.319747 IP 112.26.3.8.33629 > 112.26.3.1.44903: Flags [.], ack 19993, win 11726, options [nop,nop,TS val 43557 ecr 263340,nop,nop,sack 2 {21421:22849}{52837:54265},mptcp dss ack 407991563], length 0
21:02:55.320266 IP 112.26.3.1.44903 > 112.26.3.8.33629: Flags [.], seq 19993:21421, ack 1, win 4017, options [nop,nop,TS val 267028 ecr 43557,mptcp dss ack 2872732397 seq 408037259 subseq 19993 len 1428 csum 0x4620], length 1428
21:02:55.388653 IP 112.26.3.1.44903 > 112.26.3.8.33629: Flags [.], seq 24277:25705, ack 1, win 4017, options [nop,nop,TS val 265683 ecr 42170,mptcp dss ack 2872732397 seq 408051539 subseq 24277 len 1428 csum 0x5055], length 1428
21:02:55.408168 IP 112.26.3.8.33629 > 112.26.3.1.44903: Flags [.], ack 19993, win 11909, options [nop,nop,TS val 43707 ecr 263340,nop,nop,sack 2 {24277:25705}{21421:22849},mptcp dss ack 407991563], length 0
21:02:55.408647 IP 112.26.3.1.44903 > 112.26.3.8.33629: Flags [.], seq 51409:52837, ack 1, win 4017, options [nop,nop,TS val 267116 ecr 43707,mptcp dss ack 2872732397 seq 408124367 subseq 51409 len 1428 csum 0x878f], length 1428
21:02:55.521003 IP 112.26.3.1.44903 > 112.26.3.8.33629: Flags [.], seq 55693:57121, ack 1, win 4017, options [nop,nop,TS val 266130 ecr 42507,mptcp dss ack 2872732397 seq 408141503 subseq 55693 len 1428 csum 0x8bc3], length 1428
21:02:55.544086 IP 112.26.3.8.33629 > 112.26.3.1.44903: Flags [.], ack 19993, win 12091, options [nop,nop,TS val 43844 ecr 263340,nop,nop,sack 2 {55693:57121}{24277:25705},mptcp dss ack 407991563], length 0
21:02:55.544434 IP 112.26.3.1.44903 > 112.26.3.8.33629: Flags [.], seq 54265:55693, ack 1, win 4017, options [nop,nop,TS val 267253 ecr 43844,mptcp dss ack 2872732397 seq 408140075 subseq 54265 len 1428 csum 0x2e0d], length 1428
21:02:55.598803 IP 112.26.3.1.44903 > 112.26.3.8.33629: Flags [.], seq 34273:35701, ack 1, win 4017, options [nop,nop,TS val 266419 ecr 42763,mptcp dss ack 2872732397 seq 408044399 subseq 34273 len 1428 csum 0x7c8a], length 1428
21:02:55.686018 IP 112.26.3.8.33629 > 112.26.3.1.44903: Flags [.], ack 19993, win 12319, options [nop,nop,TS val 43984 ecr 263340,nop,nop,sack 2 {34273:35701}{55693:57121},mptcp dss ack 407991563], length 0
21:02:55.713154 IP 112.26.3.1.44903 > 112.26.3.8.33629: Flags [.], seq 37129:38557, ack 1, win 4017, options [nop,nop,TS val 266469 ecr 42868,mptcp dss ack 2872732397 seq 408062963 subseq 37129 len 1428 csum 0x6470], length 1428
21:02:55.778969 IP 112.26.3.1.44903 > 112.26.3.8.33629: Flags [.], seq 57121:58549, ack 1, win 4017, options [nop,nop,TS val 267487 ecr 43984,mptcp dss ack 2872732397 seq 408164351 subseq 57121 len 1428 csum 0x1ecc], length 1428
21:02:55.822187 IP 112.26.3.8.33629 > 112.26.3.1.44903: Flags [.], ack 19993, win 12456, options [nop,nop,TS val 44056 ecr 263340,nop,nop,sack 2 {37129:38557}{34273:35701},mptcp dss ack 407991563], length 0
21:02:55.833980 IP 112.26.3.1.44903 > 112.26.3.8.33629: Flags [.], seq 39985:41413, ack 1, win 4017, options [nop,nop,TS val 266572 ecr 43085,mptcp dss ack 2872732397 seq 408070103 subseq 39985 len 1428 csum 0xa20b], length 1428
21:02:55.868361 IP 112.26.3.1.44903 > 112.26.3.8.33629: Flags [.], seq 58549:59977, ack 1, win 4017, options [nop,nop,TS val 267577 ecr 44056,mptcp dss ack 2872732397 seq 408168635 subseq 58549 len 1428 csum 0x3c3f], length 1428
21:02:55.932018 IP 112.26.3.8.33629 > 112.26.3.1.44903: Flags [.], ack 19993, win 12639, options [nop,nop,TS val 44158 ecr 263340,nop,nop,sack 2 {39985:41413}{37129:38557},mptcp dss ack 408037259], length 0
21:02:55.972503 IP 112.26.3.1.44903 > 112.26.3.8.33629: Flags [.], seq 42841:44269, ack 1, win 4017, options [nop,nop,TS val 266673 ecr 43196,mptcp dss ack 2872732397 seq 408090095 subseq 42841 len 1428 csum 0x74cc], length 1428
21:02:56.019581 IP 112.26.3.1.44903 > 112.26.3.8.33629: Flags [.], seq 59977:61405, ack 1, win 4017, options [nop,nop,TS val 267728 ecr 44158,mptcp dss ack 2872732397 seq 408170063 subseq 59977 len 1428 csum 0xfab9], length 1428
21:02:56.070699 IP 112.26.3.8.33629 > 112.26.3.1.44903: Flags [.], ack 19993, win 12821, options [nop,nop,TS val 44292 ecr 263340,nop,nop,sack 2 {42841:44269}{39985:41413},mptcp dss ack 408037259], length 0
21:02:56.090411 IP 112.26.3.1.44903 > 112.26.3.8.33629: Flags [.], seq 44269:45697, ack 1, win 4017, options [nop,nop,TS val 266797 ecr 43300,mptcp dss ack 2872732397 seq 408100091 subseq 44269 len 1428 csum 0xa395], length 1428
21:02:56.143361 IP 112.26.3.1.44903 > 112.26.3.8.33629: Flags [.], seq 61405:62833, ack 1, win 4017, options [nop,nop,TS val 267851 ecr 44292,mptcp dss ack 2872732397 seq 408172919 subseq 61405 len 1428 csum 0x30b], length 1428
21:02:56.179067 IP 112.26.3.8.33629 > 112.26.3.1.44903: Flags [.], ack 19993, win 13004, options [nop,nop,TS val 44411 ecr 263340,nop,nop,sack 2 {42841:45697}{39985:41413},mptcp dss ack 408037259], length 0
21:02:56.225065 IP 112.26.3.1.44903 > 112.26.3.8.33629: Flags [.], seq 19993:21421, ack 1, win 4017, options [nop,nop,TS val 267028 ecr 43557,mptcp dss ack 2872732397 seq 408037259 subseq 19993 len 1428 csum 0x4620], length 1428
21:02:56.230618 IP 112.26.3.1.44903 > 112.26.3.8.33629: Flags [.], seq 62833:64261, ack 1, win 4017, options [nop,nop,TS val 267939 ecr 44411,mptcp dss ack 2872732397 seq 408175775 subseq 62833 len 1428 csum 0x158b], length 1428
21:02:56.280907 IP 112.26.3.8.33629 > 112.26.3.1.44903: Flags [.], ack 45697, win 13277, options [nop,nop,TS val 44545 ecr 267028,mptcp dss ack 408058679], length 0
21:02:56.281401 IP 112.26.3.1.44903 > 112.26.3.8.33629: Flags [.], seq 45697:47125, ack 1, win 4017, options [nop,nop,TS val 267989 ecr 44545,mptcp dss ack 2872732397 seq 408101519 subseq 45697 len 1428 csum 0xe591], length 1428
21:02:56.390724 IP 112.26.3.1.44903 > 112.26.3.8.33629: Flags [.], seq 51409:52837, ack 1, win 4017, options [nop,nop,TS val 267116 ecr 43707,mptcp dss ack 2872732397 seq 408124367 subseq 51409 len 1428 csum 0x878f], length 1428
21:02:56.472095 IP 112.26.3.1.44903 > 112.26.3.8.33629: Flags [.], seq 54265:55693, ack 1, win 4017, options [nop,nop,TS val 267253 ecr 43844,mptcp dss ack 2872732397 seq 408140075 subseq 54265 len 1428 csum 0x2e0d], length 1428
21:02:56.561497 IP 112.26.3.8.33629 > 112.26.3.1.44903: Flags [.], ack 45697, win 13505, options [nop,nop,TS val 44712 ecr 267028,nop,nop,sack 1 {51409:52837},mptcp dss ack 408058679], length 0
21:02:56.579796 IP 112.26.3.1.44903 > 112.26.3.8.33629: Flags [.], seq 64261:65689, ack 1, win 4017, options [nop,nop,TS val 268288 ecr 44712,mptcp dss ack 2872732397 seq 408185771 subseq 64261 len 1428 csum 0xcd00], length 1428
21:02:56.609644 IP 112.26.3.1.44903 > 112.26.3.8.33629: Flags [.], seq 57121:58549, ack 1, win 4017, options [nop,nop,TS val 267487 ecr 43984,mptcp dss ack 2872732397 seq 408164351 subseq 57121 len 1428 csum 0x1ecc], length 1428
21:02:56.684252 IP 112.26.3.1.44903 > 112.26.3.8.33629: Flags [.], seq 58549:59977, ack 1, win 4017, options [nop,nop,TS val 267577 ecr 44056,mptcp dss ack 2872732397 seq 408168635 subseq 58549 len 1428 csum 0x3c3f], length 1428
21:02:56.724123 IP 112.26.3.8.33629 > 112.26.3.1.44903: Flags [.], ack 45697, win 13642, options [nop,nop,TS val 44791 ecr 267028,nop,nop,sack 2 {54265:55693}{51409:52837},mptcp dss ack 408058679], length 0
21:02:56.750855 IP 112.26.3.1.44903 > 112.26.3.8.33629: Flags [.], seq 65689:67117, ack 1, win 4017, options [nop,nop,TS val 268459 ecr 44791,mptcp dss ack 2872732397 seq 408192911 subseq 65689 len 1428 csum 0xaab0], length 1428
21:02:56.773937 IP 112.26.3.1.44903 > 112.26.3.8.33629: Flags [.], seq 59977:61405, ack 1, win 4017, options [nop,nop,TS val 267728 ecr 44158,mptcp dss ack 2872732397 seq 408170063 subseq 59977 len 1428 csum 0xfab9], length 1428
21:02:56.888325 IP 112.26.3.8.33629 > 112.26.3.1.44903: Flags [.], ack 45697, win 13734, options [nop,nop,TS val 44931 ecr 267028,nop,nop,sack 2 {57121:58549}{54265:55693},mptcp dss ack 408058679], length 0
21:02:56.929134 IP 112.26.3.1.44903 > 112.26.3.8.33629: Flags [.], seq 67117:68545, ack 1, win 4017, options [nop,nop,TS val 268637 ecr 44931,mptcp dss ack 2872732397 seq 408197195 subseq 67117 len 1428 csum 0xdb72], length 1428
21:02:57.006135 IP 112.26.3.8.33629 > 112.26.3.1.44903: Flags [.], ack 45697, win 13870, options [nop,nop,TS val 45050 ecr 267028,nop,nop,sack 2 {57121:59977}{54265:55693},mptcp dss ack 408058679], length 0
21:02:57.028154 IP 112.26.3.1.44903 > 112.26.3.8.33629: Flags [.], seq 61405:62833, ack 1, win 4017, options [nop,nop,TS val 267851 ecr 44292,mptcp dss ack 2872732397 seq 408172919 subseq 61405 len 1428 csum 0x30b], length 1428
21:02:57.060906 IP 112.26.3.1.44903 > 112.26.3.8.33629: Flags [.], seq 68545:69973, ack 1, win 4017, options [nop,nop,TS val 268769 ecr 45050,mptcp dss ack 2872732397 seq 408201479 subseq 68545 len 1428 csum 0xde8a], length 1428
21:02:57.151774 IP 112.26.3.8.33629 > 112.26.3.1.44903: Flags [.], ack 45697, win 13962, options [nop,nop,TS val 45163 ecr 267028,nop,nop,sack 2 {57121:61405}{54265:55693},mptcp dss ack 408058679], length 0
21:02:57.167225 IP 112.26.3.1.44903 > 112.26.3.8.33629: Flags [.], seq 69973:71401, ack 1, win 4017, options [nop,nop,TS val 268876 ecr 45163,mptcp dss ack 2872732397 seq 408207191 subseq 69973 len 1428 csum 0x8608], length 1428
21:02:57.184158 IP 112.26.3.1.44903 > 112.26.3.8.33629: Flags [.], seq 45697:47125, ack 1, win 4017, options [nop,nop,TS val 267989 ecr 44545,mptcp dss ack 2872732397 seq 408101519 subseq 45697 len 1428 csum 0xe591], length 1428
21:02:57.237165 IP 112.26.3.8.33629 > 112.26.3.1.44903: Flags [.], ack 45697, win 14099, options [nop,nop,TS val 45346 ecr 267028,nop,nop,sack 2 {57121:62833}{54265:55693},mptcp dss ack 408058679], length 0
21:02:57.242126 IP 112.26.3.1.44903 > 112.26.3.8.33629: Flags [.], seq 71401:72829, ack 1, win 4017, options [nop,nop,TS val 268950 ecr 45346,mptcp dss ack 2872732397 seq 408211475 subseq 71401 len 1428 csum 0xbcc3], length 1428
21:02:57.310323 IP 112.26.3.8.33629 > 112.26.3.1.44903: Flags [.], ack 62833, win 14190, options [nop,nop,TS val 45503 ecr 267989,mptcp dss ack 408058679], length 0
21:02:57.310810 IP 112.26.3.1.44903 > 112.26.3.8.33629: Flags [.], seq 72829:74257, ack 1, win 4017, options [nop,nop,TS val 269019 ecr 45503,mptcp dss ack 2872732397 seq 408214331 subseq 72829 len 1428 csum 0x115c], length 1428
21:02:57.310878 IP 112.26.3.1.44903 > 112.26.3.8.33629: Flags [.], seq 74257:75685, ack 1, win 4017, options [nop,nop,TS val 269019 ecr 45503,mptcp dss ack 2872732397 seq 408215759 subseq 74257 len 1428 csum 0xec12], length 1428
21:02:57.311049 IP 112.26.3.1.44903 > 112.26.3.8.33629: Flags [.], seq 75685:77113, ack 1, win 4017, options [nop,nop,TS val 269019 ecr 45503,mptcp dss ack 2872732397 seq 408217187 subseq 75685 len 1428 csum 0x1d90], length 1428
21:02:57.311181 IP 112.26.3.1.44903 > 112.26.3.8.33629: Flags [.], seq 77113:78541, ack 1, win 4017, options [nop,nop,TS val 269019 ecr 45503,mptcp dss ack 2872732397 seq 408218615 subseq 77113 len 1428 csum 0xe489], length 1428
21:02:57.311331 IP 112.26.3.1.44903 > 112.26.3.8.33629: Flags [.], seq 78541:79969, ack 1, win 4017, options [nop,nop,TS val 269019 ecr 45503,mptcp dss ack 2872732397 seq 408220043 subseq 78541 len 1428 csum 0xe490], length 1428
21:02:57.311475 IP 112.26.3.1.44903 > 112.26.3.8.33629: Flags [.], seq 79969:81397, ack 1, win 4017, options [nop,nop,TS val 269019 ecr 45503,mptcp dss ack 2872732397 seq 408221471 subseq 79969 len 1428 csum 0xf014], length 1428
21:02:57.311624 IP 112.26.3.1.44903 > 112.26.3.8.33629: Flags [.], seq 81397:82825, ack 1, win 4017, options [nop,nop,TS val 269019 ecr 45503,mptcp dss ack 2872732397 seq 408222899 subseq 81397 len 1428 csum 0x2869], length 1428
21:02:57.311723 IP 112.26.3.1.44903 > 112.26.3.8.33629: Flags [.], seq 82825:84253, ack 1, win 4017, options [nop,nop,TS val 269019 ecr 45503,mptcp dss ack 2872732397 seq 408224327 subseq 82825 len 1428 csum 0x2477], length 1428
21:02:57.311916 IP 112.26.3.1.44903 > 112.26.3.8.33629: Flags [.], seq 84253:85681, ack 1, win 4017, options [nop,nop,TS val 269020 ecr 45503,mptcp dss ack 2872732397 seq 408225755 subseq 84253 len 1428 csum 0x64e3], length 1428
21:02:57.371137 IP 112.26.3.1.44903 > 112.26.3.8.33629: Flags [.], seq 64261:65689, ack 1, win 4017, options [nop,nop,TS val 268288 ecr 44712,mptcp dss ack 2872732397 seq 408185771 subseq 64261 len 1428 csum 0xcd00], length 1428
21:02:57.471822 IP 112.26.3.8.33629 > 112.26.3.1.44903: Flags [.], ack 62833, win 14327, options [nop,nop,TS val 45689 ecr 267989,nop,nop,sack 1 {64261:65689},mptcp dss ack 408058679], length 0
21:02:57.490997 IP 112.26.3.1.44903 > 112.26.3.8.33629: Flags [.], seq 65689:67117, ack 1, win 4017, options [nop,nop,TS val 268459 ecr 44791,mptcp dss ack 2872732397 seq 408192911 subseq 65689 len 1428 csum 0xaab0], length 1428
21:02:57.541447 IP 112.26.3.1.44903 > 112.26.3.8.33629: Flags [.], seq 85681:87109, ack 1, win 4017, options [nop,nop,TS val 269250 ecr 45689,mptcp dss ack 2872732397 seq 408231467 subseq 85681 len 1428 csum 0x3ddc], length 1428
21:02:57.611514 IP 112.26.3.8.33629 > 112.26.3.1.44903: Flags [.], ack 62833, win 14509, options [nop,nop,TS val 45811 ecr 267989,nop,nop,sack 1 {64261:67117},mptcp dss ack 408058679], length 0
21:02:57.623140 IP 112.26.3.1.44903 > 112.26.3.8.33629: Flags [.], seq 67117:68545, ack 1, win 4017, options [nop,nop,TS val 268637 ecr 44931,mptcp dss ack 2872732397 seq 408197195 subseq 67117 len 1428 csum 0xdb72], length 1428
21:02:57.625480 IP 112.26.3.1.44903 > 112.26.3.8.33629: Flags [.], seq 87109:88537, ack 1, win 4017, options [nop,nop,TS val 269334 ecr 45811,mptcp dss ack 2872732397 seq 408234323 subseq 87109 len 1428 csum 0x8f98], length 1428
21:02:57.706602 IP 112.26.3.8.33629 > 112.26.3.1.44903: Flags [.], ack 62833, win 14646, options [nop,nop,TS val 45943 ecr 267989,nop,nop,sack 1 {64261:68545},mptcp dss ack 408058679], length 0
21:02:57.707045 IP 112.26.3.1.44903 > 112.26.3.8.33629: Flags [.], seq 62833:64261, ack 1, win 4017, options [nop,nop,TS val 269415 ecr 45943,mptcp dss ack 2872732397 seq 408175775 subseq 62833 len 1428 csum 0x158b], length 1428
21:02:57.745622 IP 112.26.3.1.44903 > 112.26.3.8.33629: Flags [.], seq 68545:69973, ack 1, win 4017, options [nop,nop,TS val 268769 ecr 45050,mptcp dss ack 2872732397 seq 408201479 subseq 68545 len 1428 csum 0xde8a], length 1428
21:02:57.825817 IP 112.26.3.8.33629 > 112.26.3.1.44903: Flags [.], ack 62833, win 14920, options [nop,nop,TS val 46064 ecr 267989,nop,nop,sack 1 {64261:69973},mptcp dss ack 408058679], length 0
21:02:57.842423 IP 112.26.3.1.44903 > 112.26.3.8.33629: Flags [.], seq 88537:89965, ack 1, win 4017, options [nop,nop,TS val 269550 ecr 46064,mptcp dss ack 2872732397 seq 408237179 subseq 88537 len 1428 csum 0xdbb2], length 1428
21:02:57.873043 IP 112.26.3.1.44903 > 112.26.3.8.33629: Flags [.], seq 69973:71401, ack 1, win 4017, options [nop,nop,TS val 268876 ecr 45163,mptcp dss ack 2872732397 seq 408207191 subseq 69973 len 1428 csum 0x8608], length 1428
21:02:57.938947 IP 112.26.3.8.33629 > 112.26.3.1.44903: Flags [.], ack 62833, win 15148, options [nop,nop,TS val 46198 ecr 267989,nop,nop,sack 1 {64261:71401},mptcp dss ack 408058679], length 0
21:02:57.994257 IP 112.26.3.1.44903 > 112.26.3.8.33629: Flags [.], seq 71401:72829, ack 1, win 4017, options [nop,nop,TS val 268950 ecr 45346,mptcp dss ack 2872732397 seq 408211475 subseq 71401 len 1428 csum 0xbcc3], length 1428
21:02:58.039718 IP 112.26.3.1.44903 > 112.26.3.8.33629: Flags [.], seq 89965:91393, ack 1, win 4017, options [nop,nop,TS val 269748 ecr 46198,mptcp dss ack 2872732397 seq 408241463 subseq 89965 len 1428 csum 0xfbe7], length 1428
