21:02:50.653901 IP 112.26.1.8.37183 > 112.26.1.1.44903: Flags [S], seq 4223755272, win 65535, options [mss 1460,sackOK,TS val 38902 ecr 0,nop,wscale 6,mptcp join id 3 token 0x7fa57e4e nonce 0x3f1218a8], length 0
21:02:50.709479 IP 112.26.1.8.37183 > 112.26.1.1.44903: Flags [S], seq 4223755272, win 65535, options [mss 1460,sackOK,TS val 38902 ecr 0,nop,wscale 6,mptcp join id 3 token 0x7fa57e4e nonce 0x3f1218a8], length 0
21:02:50.756776 IP 112.26.1.1.44903 > 112.26.1.8.37183: Flags [S.], seq 1531371114, ack 4223755273, win 65535, options [mss 1460,sackOK,TS val 262418 ecr 38902,nop,wscale 6,mptcp join id 6 hmac 0x5ef4629707bdf55d nonce 0x2932d1ec], length 0
21:02:50.806632 IP 112.26.1.1.44903 > 112.26.1.8.37183: Flags [S.], seq 1531371114, ack 4223755273, win 65535, options [mss 1460,sackOK,TS val 262418 ecr 38902,nop,wscale 6,mptcp join id 6 hmac 0x5ef4629707bdf55d nonce 0x2932d1ec], length 0
21:02:50.808551 IP 112.26.1.1.44903 > 112.26.1.8.37183: Flags [S.], seq 1531371114, ack 4223755273, win 65535, options [mss 1460,sackOK,TS val 262418 ecr 38902,nop,wscale 6,mptcp join id 6 hmac 0x5ef4629707bdf55d nonce 0x2932d1ec], length 0
21:02:50.907045 IP 112.26.1.8.37183 > 112.26.1.1.44903: Flags [.], ack 1, win 5658, options [nop,nop,TS val 39125 ecr 262418,mptcp join hmac 0x319fcf6b468b96b1c0c68db3aad6a0ca892cbfcf], length 0
21:02:50.911591 IP 112.26.1.8.37183 > 112.26.1.1.44903: Flags [.], ack 1, win 5658, options [nop,nop,TS val 39125 ecr 262418,mptcp join hmac 0x319fcf6b468b96b1c0c68db3aad6a0ca892cbfcf], length 0
21:02:50.915223 IP 112.26.1.1.44903 > 112.26.1.8.37183: Flags [.], ack 1, win 2678, options [nop,nop,TS val 262620 ecr 39125,mptcp dss ack 2872732397], length 0
21:02:50.967948 IP 112.26.1.1.44903 > 112.26.1.8.37183: Flags [.], seq 1:1429, ack 1, win 2678, options [nop,nop,TS val 262621 ecr 39125,mptcp dss ack 2872732397 seq 407978711 subseq 1 len 1428 csum 0x46b6], length 1428
21:02:51.040884 IP 112.26.1.1.44903 > 112.26.1.8.37183: Flags [.], seq 1429:2857, ack 1, win 2678, options [nop,nop,TS val 262621 ecr 39125,mptcp dss ack 2872732397 seq 407980139 subseq 1429 len 1428 csum 0x5167], length 1428
21:02:51.055719 IP 112.26.1.1.44903 > 112.26.1.8.37183: Flags [.], ack 1, win 2678, options [nop,nop,TS val 262620 ecr 39125,mptcp dss ack 2872732397], length 0
21:02:51.057679 IP 112.26.1.1.44903 > 112.26.1.8.37183: Flags [.], ack 1, win 2678, options [nop,nop,TS val 262620 ecr 39125,mptcp dss ack 2872732397], length 0
21:02:51.104822 IP 112.26.1.1.44903 > 112.26.1.8.37183: Flags [.], seq 2857:4285, ack 1, win 2678, options [nop,nop,TS val 262621 ecr 39125,mptcp dss ack 2872732397 seq 407981567 subseq 2857 len 1428 csum 0xaa8e], length 1428
21:02:51.127494 IP 112.26.1.1.44903 > 112.26.1.8.37183: Flags [.], seq 1:1429, ack 1, win 2678, options [nop,nop,TS val 262621 ecr 39125,mptcp dss ack 2872732397 seq 407978711 subseq 1 len 1428 csum 0x46b6], length 1428
21:02:51.150448 IP 112.26.1.1.44903 > 112.26.1.8.37183: Flags [.], seq 1:1429, ack 1, win 2678, options [nop,nop,TS val 262621 ecr 39125,mptcp dss ack 2872732397 seq 407978711 subseq 1 len 1428 csum 0x46b6], length 1428
21:02:51.212133 IP 112.26.1.1.44903 > 112.26.1.8.37183: Flags [.], seq 4285:5713, ack 1, win 2678, options [nop,nop,TS val 262621 ecr 39125,mptcp dss ack 2872732397 seq 407982995 subseq 4285 len 1428 csum 0x2fc2], length 1428
21:02:51.298934 IP 112.26.1.1.44903 > 112.26.1.8.37183: Flags [.], seq 1429:2857, ack 1, win 2678, options [nop,nop,TS val 262621 ecr 39125,mptcp dss ack 2872732397 seq 407980139 subseq 1429 len 1428 csum 0x5167], length 1428
21:02:51.312431 IP 112.26.1.8.37183 > 112.26.1.1.44903: Flags [.], ack 1429, win 7255, options [nop,nop,TS val 39466 ecr 262621,mptcp dss ack 407967287], length 0
21:02:51.343092 IP 112.26.1.1.44903 > 112.26.1.8.37183: Flags [.], seq 5713:7141, ack 1, win 2678, options [nop,nop,TS val 262621 ecr 39125,mptcp dss ack 2872732397 seq 407984423 subseq 5713 len 1428 csum 0x5383], length 1428
21:02:51.382139 IP 112.26.1.1.44903 > 112.26.1.8.37183: Flags [.], seq 1429:2857, ack 1, win 2678, options [nop,nop,TS val 262621 ecr 39125,mptcp dss ack 2872732397 seq 407980139 subseq 1429 len 1428 csum 0x5167], length 1428
21:02:51.406808 IP 112.26.1.1.44903 > 112.26.1.8.37183: Flags [.], seq 7141:8569, ack 1, win 2678, options [nop,nop,TS val 262621 ecr 39125,mptcp dss ack 2872732397 seq 407985851 subseq 7141 len 1428 csum 0x81fe], length 1428
21:02:51.427250 IP 112.26.1.1.44903 > 112.26.1.8.37183: Flags [.], seq 2857:4285, ack 1, win 2678, options [nop,nop,TS val 262621 ecr 39125,mptcp dss ack 2872732397 seq 407981567 subseq 2857 len 1428 csum 0xaa8e], length 1428
21:02:51.514783 IP 112.26.1.1.44903 > 112.26.1.8.37183: Flags [.], seq 8569:9997, ack 1, win 2678, options [nop,nop,TS val 262621 ecr 39125,mptcp dss ack 2872732397 seq 407987279 subseq 8569 len 1428 csum 0x3487], length 1428
21:02:51.548312 IP 112.26.1.8.37183 > 112.26.1.1.44903: Flags [.], ack 2857, win 7437, options [nop,nop,TS val 39689 ecr 262621,mptcp dss ack 407970143], length 0
21:02:51.572213 IP 112.26.1.1.44903 > 112.26.1.8.37183: Flags [.], seq 9997:11425, ack 1, win 2678, options [nop,nop,TS val 262621 ecr 39125,mptcp dss ack 2872732397 seq 407988707 subseq 9997 len 1428 csum 0x228e], length 1428
21:02:51.602926 IP 112.26.1.1.44903 > 112.26.1.8.37183: Flags [.], seq 2857:4285, ack 1, win 2678, options [nop,nop,TS val 262621 ecr 39125,mptcp dss ack 2872732397 seq 407981567 subseq 2857 len 1428 csum 0xaa8e], length 1428
21:02:51.646032 IP 112.26.1.1.44903 > 112.26.1.8.37183: Flags [.], seq 11425:12853, ack 1, win 2678, options [nop,nop,TS val 262622 ecr 39125,mptcp dss ack 2872732397 seq 407990135 subseq 11425 len 1428 csum 0xd156], length 1428
21:02:51.666879 IP 112.26.1.1.44903 > 112.26.1.8.37183: Flags [.], seq 4285:5713, ack 1, win 2678, options [nop,nop,TS val 262621 ecr 39125,mptcp dss ack 2872732397 seq 407982995 subseq 4285 len 1428 csum 0x2fc2], length 1428
21:02:51.727501 IP 112.26.1.8.37183 > 112.26.1.1.44903: Flags [.], ack 4285, win 7711, options [nop,nop,TS val 39919 ecr 262621,mptcp dss ack 407972999], length 0
21:02:51.734918 IP 112.26.1.8.37183 > 112.26.1.1.44903: Flags [.], ack 1429, win 7255, options [nop,nop,TS val 39466 ecr 262621,mptcp dss ack 407967287], length 0
21:02:51.763809 IP 112.26.1.1.44903 > 112.26.1.8.37183: Flags [.], seq 12853:14281, ack 1, win 4017, options [nop,nop,TS val 263032 ecr 39125,mptcp dss ack 2872732397 seq 407991563 subseq 12853 len 1428 csum 0x4a45], length 1428
21:02:51.804866 IP 112.26.1.1.44903 > 112.26.1.8.37183: Flags [.], seq 5713:7141, ack 1, win 2678, options [nop,nop,TS val 262621 ecr 39125,mptcp dss ack 2872732397 seq 407984423 subseq 5713 len 1428 csum 0x5383], length 1428
21:02:51.855578 IP 112.26.1.1.44903 > 112.26.1.8.37183: Flags [.], seq 14281:15709, ack 1, win 4017, options [nop,nop,TS val 263443 ecr 39466,mptcp dss ack 2872732397 seq 408042971 subseq 14281 len 1428 csum 0xee], length 1428
21:02:51.871930 IP 112.26.1.1.44903 > 112.26.1.8.37183: Flags [.], seq 4285:5713, ack 1, win 2678, options [nop,nop,TS val 262621 ecr 39125,mptcp dss ack 2872732397 seq 407982995 subseq 4285 len 1428 csum 0x2fc2], length 1428
21:02:51.879982 IP 112.26.1.1.44903 > 112.26.1.8.37183: Flags [.], seq 7141:8569, ack 1, win 2678, options [nop,nop,TS val 262621 ecr 39125,mptcp dss ack 2872732397 seq 407985851 subseq 7141 len 1428 csum 0x81fe], length 1428
21:02:51.936435 IP 112.26.1.1.44903 > 112.26.1.8.37183: Flags [.], seq 15709:17137, ack 1, win 4017, options [nop,nop,TS val 263443 ecr 39466,mptcp dss ack 2872732397 seq 408044399 subseq 15709 len 1428 csum 0xc50e], length 1428
21:02:51.950475 IP 112.26.1.1.44903 > 112.26.1.8.37183: Flags [.], seq 5713:7141, ack 1, win 2678, options [nop,nop,TS val 262621 ecr 39125,mptcp dss ack 2872732397 seq 407984423 subseq 5713 len 1428 csum 0x5383], length 1428
21:02:52.028381 IP 112.26.1.1.44903 > 112.26.1.8.37183: Flags [.], seq 8569:9997, ack 1, win 2678, options [nop,nop,TS val 262621 ecr 39125,mptcp dss ack 2872732397 seq 407987279 subseq 8569 len 1428 csum 0x3487], length 1428
21:02:52.108631 IP 112.26.1.8.37183 > 112.26.1.1.44903: Flags [.], ack 5713, win 7939, options [nop,nop,TS val 40161 ecr 262621,mptcp dss ack 407974427], length 0
21:02:52.128302 IP 112.26.1.1.44903 > 112.26.1.8.37183: Flags [.], seq 1429:2857, ack 1, win 4017, options [nop,nop,TS val 263834 ecr 39466,mptcp dss ack 2872732397 seq 407980139 subseq 1429 len 1428 csum 0x5167], length 1428
21:02:52.130787 IP 112.26.1.8.37183 > 112.26.1.1.44903: Flags [.], ack 2857, win 7437, options [nop,nop,TS val 39689 ecr 262621,mptcp dss ack 407970143], length 0
21:02:52.168772 IP 112.26.1.1.44903 > 112.26.1.8.37183: Flags [.], seq 7141:8569, ack 1, win 2678, options [nop,nop,TS val 262621 ecr 39125,mptcp dss ack 2872732397 seq 407985851 subseq 7141 len 1428 csum 0x81fe], length 1428
21:02:52.204669 IP 112.26.1.1.44903 > 112.26.1.8.37183: Flags [.], seq 17137:18565, ack 1, win 4017, options [nop,nop,TS val 263853 ecr 39689,mptcp dss ack 2872732397 seq 407980139 subseq 17137 len 1428 csum 0x140b], length 1428
21:02:52.255404 IP 112.26.1.8.37183 > 112.26.1.1.44903: Flags [.], ack 7141, win 8030, options [nop,nop,TS val 40260 ecr 262621,mptcp dss ack 407975855], length 0
21:02:52.284649 IP 112.26.1.1.44903 > 112.26.1.8.37183: Flags [.], seq 18565:19993, ack 1, win 4017, options [nop,nop,TS val 263853 ecr 39689,mptcp dss ack 2872732397 seq 407981567 subseq 18565 len 1428 csum 0x6d32], length 1428
21:02:52.307658 IP 112.26.1.1.44903 > 112.26.1.8.37183: Flags [.], seq 9997:11425, ack 1, win 2678, options [nop,nop,TS val 262621 ecr 39125,mptcp dss ack 2872732397 seq 407988707 subseq 9997 len 1428 csum 0x228e], length 1428
21:02:52.314124 IP 112.26.1.1.44903 > 112.26.1.8.37183: Flags [.], seq 8569:9997, ack 1, win 2678, options [nop,nop,TS val 262621 ecr 39125,mptcp dss ack 2872732397 seq 407987279 subseq 8569 len 1428 csum 0x3487], length 1428
21:02:52.409853 IP 112.26.1.1.44903 > 112.26.1.8.37183: Flags [.], seq 11425:12853, ack 1, win 2678, options [nop,nop,TS val 262622 ecr 39125,mptcp dss ack 2872732397 seq 407990135 subseq 11425 len 1428 csum 0xd156], length 1428
21:02:52.428219 IP 112.26.1.1.44903 > 112.26.1.8.37183: Flags [.], seq 9997:11425, ack 1, win 2678, options [nop,nop,TS val 262621 ecr 39125,mptcp dss ack 2872732397 seq 407988707 subseq 9997 len 1428 csum 0x228e], length 1428
21:02:52.483330 IP 112.26.1.1.44903 > 112.26.1.8.37183: Flags [.], seq 11425:12853, ack 1, win 2678, options [nop,nop,TS val 262622 ecr 39125,mptcp dss ack 2872732397 seq 407990135 subseq 11425 len 1428 csum 0xd156], length 1428
21:02:52.527874 IP 112.26.1.8.37183 > 112.26.1.1.44903: Flags [.], ack 4285, win 7711, options [nop,nop,TS val 39919 ecr 262621,mptcp dss ack 407972999], length 0
21:02:52.538459 IP 112.26.1.1.44903 > 112.26.1.8.37183: Flags [.], seq 19993:21421, ack 1, win 4017, options [nop,nop,TS val 264236 ecr 39919,mptcp dss ack 2872732397 seq 408058679 subseq 19993 len 1428 csum 0xc8f2], length 1428
21:02:52.571562 IP 112.26.1.8.37183 > 112.26.1.1.44903: Flags [.], ack 8569, win 8350, options [nop,nop,TS val 40485 ecr 262621,mptcp dss ack 407987279], length 0
21:02:52.623888 IP 112.26.1.1.44903 > 112.26.1.8.37183: Flags [.], seq 21421:22849, ack 1, win 4017, options [nop,nop,TS val 264236 ecr 39919,mptcp dss ack 2872732397 seq 408060107 subseq 21421 len 1428 csum 0x51e9], length 1428
21:02:52.629578 IP 112.26.1.8.37183 > 112.26.1.1.44903: Flags [.], ack 9997, win 8441, options [nop,nop,TS val 40630 ecr 262621,mptcp dss ack 407988707], length 0
21:02:52.647927 IP 112.26.1.1.44903 > 112.26.1.8.37183: Flags [.], seq 14281:15709, ack 1, win 4017, options [nop,nop,TS val 263443 ecr 39466,mptcp dss ack 2872732397 seq 408042971 subseq 14281 len 1428 csum 0xee], length 1428
21:02:52.696553 IP 112.26.1.8.37183 > 112.26.1.1.44903: Flags [.], ack 11425, win 8624, options [nop,nop,TS val 40744 ecr 262621,mptcp dss ack 407990135], length 0
21:02:52.713431 IP 112.26.1.8.37183 > 112.26.1.1.44903: Flags [.], ack 8569, win 8350, options [nop,nop,TS val 40485 ecr 262621,mptcp dss ack 407987279], length 0
21:02:52.713460 IP 112.26.1.8.37183 > 112.26.1.1.44903: Flags [.], ack 9997, win 8441, options [nop,nop,TS val 40630 ecr 262621,mptcp dss ack 407988707], length 0
21:02:52.713472 IP 112.26.1.8.37183 > 112.26.1.1.44903: Flags [.], ack 11425, win 8624, options [nop,nop,TS val 40744 ecr 262621,mptcp dss ack 407990135], length 0
21:02:52.738678 IP 112.26.1.1.44903 > 112.26.1.8.37183: Flags [.], seq 15709:17137, ack 1, win 4017, options [nop,nop,TS val 263443 ecr 39466,mptcp dss ack 2872732397 seq 408044399 subseq 15709 len 1428 csum 0xc50e], length 1428
21:02:52.763648 IP 112.26.1.8.37183 > 112.26.1.1.44903: Flags [.], ack 12853, win 8715, options [nop,nop,TS val 40799 ecr 262622,mptcp dss ack 407991563], length 0
21:02:52.763888 IP 112.26.1.8.37183 > 112.26.1.1.44903: Flags [.], ack 12853, win 8715, options [nop,nop,TS val 40799 ecr 262622,mptcp dss ack 407991563], length 0
21:02:52.809807 IP 112.26.1.8.37183 > 112.26.1.1.44903: Flags [.], ack 5713, win 7939, options [nop,nop,TS val 40161 ecr 262621,mptcp dss ack 407974427], length 0
21:02:52.812639 IP 112.26.1.1.44903 > 112.26.1.8.37183: Flags [.], seq 22849:24277, ack 1, win 4017, options [nop,nop,TS val 264425 ecr 40485,mptcp dss ack 2872732397 seq 408071531 subseq 22849 len 1428 csum 0x3b57], length 1428
21:02:52.835073 IP 112.26.1.1.44903 > 112.26.1.8.37183: Flags [.], seq 14281:15709, ack 1, win 4017, options [nop,nop,TS val 263443 ecr 39466,mptcp dss ack 2872732397 seq 408042971 subseq 14281 len 1428 csum 0xee], length 1428
21:02:52.875878 IP 112.26.1.1.44903 > 112.26.1.8.37183: Flags [.], seq 15709:17137, ack 1, win 4017, options [nop,nop,TS val 263443 ecr 39466,mptcp dss ack 2872732397 seq 408044399 subseq 15709 len 1428 csum 0xc50e], length 1428
21:02:52.901081 IP 112.26.1.1.44903 > 112.26.1.8.37183: Flags [.], seq 24277:25705, ack 1, win 4017, options [nop,nop,TS val 264425 ecr 40485,mptcp dss ack 2872732397 seq 408072959 subseq 24277 len 1428 csum 0x6364], length 1428
21:02:52.917496 IP 112.26.1.1.44903 > 112.26.1.8.37183: Flags [.], seq 1429:2857, ack 1, win 4017, options [nop,nop,TS val 263834 ecr 39466,mptcp dss ack 2872732397 seq 407980139 subseq 1429 len 1428 csum 0x5167], length 1428
21:02:52.996559 IP 112.26.1.1.44903 > 112.26.1.8.37183: Flags [.], seq 25705:27133, ack 1, win 4017, options [nop,nop,TS val 264425 ecr 40485,mptcp dss ack 2872732397 seq 408074387 subseq 25705 len 1428 csum 0x272a], length 1428
21:02:53.008295 IP 112.26.1.1.44903 > 112.26.1.8.37183: Flags [.], seq 17137:18565, ack 1, win 4017, options [nop,nop,TS val 263853 ecr 39689,mptcp dss ack 2872732397 seq 407980139 subseq 17137 len 1428 csum 0x140b], length 1428
21:02:53.067854 IP 112.26.1.8.37183 > 112.26.1.1.44903: Flags [.], ack 12853, win 9125, options [nop,nop,TS val 41144 ecr 262622,nop,nop,sack 1 {14281:15709},mptcp dss ack 407991563], length 0
21:02:53.068095 IP 112.26.1.8.37183 > 112.26.1.1.44903: Flags [.], ack 12853, win 9125, options [nop,nop,TS val 41144 ecr 262622,nop,nop,sack 1 {14281:15709},mptcp dss ack 407991563], length 0
21:02:53.107483 IP 112.26.1.1.44903 > 112.26.1.8.37183: Flags [.], seq 27133:28561, ack 1, win 4017, options [nop,nop,TS val 264425 ecr 40485,mptcp dss ack 2872732397 seq 408075815 subseq 27133 len 1428 csum 0x475], length 1428
21:02:53.130294 IP 112.26.1.8.37183 > 112.26.1.1.44903: Flags [.], ack 7141, win 8030, options [nop,nop,TS val 40260 ecr 262621,mptcp dss ack 407975855], length 0
21:02:53.189354 IP 112.26.1.1.44903 > 112.26.1.8.37183: Flags [.], seq 1429:2857, ack 1, win 4017, options [nop,nop,TS val 263834 ecr 39466,mptcp dss ack 2872732397 seq 407980139 subseq 1429 len 1428 csum 0x5167], length 1428
21:02:53.209954 IP 112.26.1.1.44903 > 112.26.1.8.37183: Flags [.], seq 19993:21421, ack 1, win 4017, options [nop,nop,TS val 264236 ecr 39919,mptcp dss ack 2872732397 seq 408058679 subseq 19993 len 1428 csum 0xc8f2], length 1428
21:02:53.237018 IP 112.26.1.1.44903 > 112.26.1.8.37183: Flags [.], seq 28561:29989, ack 1, win 4017, options [nop,nop,TS val 264425 ecr 40485,mptcp dss ack 2872732397 seq 408077243 subseq 28561 len 1428 csum 0xa652], length 1428
21:02:53.281664 IP 112.26.1.8.37183 > 112.26.1.1.44903: Flags [.], ack 12853, win 9217, options [nop,nop,TS val 41192 ecr 262622,nop,nop,sack 1 {14281:17137},mptcp dss ack 407991563], length 0
21:02:53.281863 IP 112.26.1.8.37183 > 112.26.1.1.44903: Flags [.], ack 12853, win 9217, options [nop,nop,TS val 41192 ecr 262622,nop,nop,sack 1 {14281:17137},mptcp dss ack 407991563], length 0
21:02:53.330825 IP 112.26.1.1.44903 > 112.26.1.8.37183: Flags [.], seq 29989:31417, ack 1, win 4017, options [nop,nop,TS val 264425 ecr 40485,mptcp dss ack 2872732397 seq 408078671 subseq 29989 len 1428 csum 0xa654], length 1428
21:02:53.353356 IP 112.26.1.1.44903 > 112.26.1.8.37183: Flags [.], seq 17137:18565, ack 1, win 4017, options [nop,nop,TS val 263853 ecr 39689,mptcp dss ack 2872732397 seq 407980139 subseq 17137 len 1428 csum 0x140b], length 1428
21:02:53.372182 IP 112.26.1.1.44903 > 112.26.1.8.37183: Flags [.], seq 31417:32845, ack 1, win 4017, options [nop,nop,TS val 264514 ecr 40630,mptcp dss ack 2872732397 seq 408082955 subseq 31417 len 1428 csum 0x2c75], length 1428
21:02:53.390403 IP 112.26.1.1.44903 > 112.26.1.8.37183: Flags [.], seq 21421:22849, ack 1, win 4017, options [nop,nop,TS val 264236 ecr 39919,mptcp dss ack 2872732397 seq 408060107 subseq 21421 len 1428 csum 0x51e9], length 1428
21:02:53.437960 IP 112.26.1.1.44903 > 112.26.1.8.37183: Flags [.], seq 32845:34273, ack 1, win 4017, options [nop,nop,TS val 264514 ecr 40630,mptcp dss ack 2872732397 seq 408084383 subseq 32845 len 1428 csum 0x77ec], length 1428
21:02:53.451654 IP 112.26.1.1.44903 > 112.26.1.8.37183: Flags [.], seq 22849:24277, ack 1, win 4017, options [nop,nop,TS val 264425 ecr 40485,mptcp dss ack 2872732397 seq 408071531 subseq 22849 len 1428 csum 0x3b57], length 1428
21:02:53.459868 IP 112.26.1.8.37183 > 112.26.1.1.44903: Flags [.], ack 12853, win 9399, options [nop,nop,TS val 41506 ecr 262622,nop,nop,sack 2 {1429:2857}{14281:17137},mptcp dss ack 407991563], length 0
21:02:53.460078 IP 112.26.1.8.37183 > 112.26.1.1.44903: Flags [.], ack 12853, win 9399, options [nop,nop,TS val 41506 ecr 262622,nop,nop,sack 2 {1429:2857}{14281:17137},mptcp dss ack 407991563], length 0
21:02:53.533251 IP 112.26.1.1.44903 > 112.26.1.8.37183: Flags [.], ack 1, win 4017, options [nop,nop,TS val 264518 ecr 40630,mptcp dss ack 2872732397], length 0
21:02:53.554915 IP 112.26.1.1.44903 > 112.26.1.8.37183: Flags [.], seq 24277:25705, ack 1, win 4017, options [nop,nop,TS val 264425 ecr 40485,mptcp dss ack 2872732397 seq 408072959 subseq 24277 len 1428 csum 0x6364], length 1428
21:02:53.585753 IP 112.26.1.1.44903 > 112.26.1.8.37183: Flags [.], seq 19993:21421, ack 1, win 4017, options [nop,nop,TS val 264236 ecr 39919,mptcp dss ack 2872732397 seq 408058679 subseq 19993 len 1428 csum 0xc8f2], length 1428
21:02:53.608580 IP 112.26.1.1.44903 > 112.26.1.8.37183: Flags [.], seq 34273:35701, ack 1, win 4017, options [nop,nop,TS val 264750 ecr 40744,mptcp dss ack 2872732397 seq 408105803 subseq 34273 len 1428 csum 0x71e3], length 1428
21:02:53.666653 IP 112.26.1.1.44903 > 112.26.1.8.37183: Flags [.], seq 25705:27133, ack 1, win 4017, options [nop,nop,TS val 264425 ecr 40485,mptcp dss ack 2872732397 seq 408074387 subseq 25705 len 1428 csum 0x272a], length 1428
21:02:53.694819 IP 112.26.1.8.37183 > 112.26.1.1.44903: Flags [.], ack 12853, win 9536, options [nop,nop,TS val 41670 ecr 262622,nop,nop,sack 1 {14281:18565},mptcp dss ack 407991563], length 0
21:02:53.695011 IP 112.26.1.8.37183 > 112.26.1.1.44903: Flags [.], ack 12853, win 9536, options [nop,nop,TS val 41670 ecr 262622,nop,nop,sack 1 {14281:18565},mptcp dss ack 407991563], length 0
21:02:53.748324 IP 112.26.1.1.44903 > 112.26.1.8.37183: Flags [.], seq 35701:37129, ack 1, win 4017, options [nop,nop,TS val 264750 ecr 40744,mptcp dss ack 2872732397 seq 408107231 subseq 35701 len 1428 csum 0x67e5], length 1428
21:02:53.765706 IP 112.26.1.1.44903 > 112.26.1.8.37183: Flags [.], seq 21421:22849, ack 1, win 4017, options [nop,nop,TS val 264236 ecr 39919,mptcp dss ack 2872732397 seq 408060107 subseq 21421 len 1428 csum 0x51e9], length 1428
21:02:53.817530 IP 112.26.1.1.44903 > 112.26.1.8.37183: Flags [.], seq 22849:24277, ack 1, win 4017, options [nop,nop,TS val 264425 ecr 40485,mptcp dss ack 2872732397 seq 408071531 subseq 22849 len 1428 csum 0x3b57], length 1428
21:02:53.829192 IP 112.26.1.1.44903 > 112.26.1.8.37183: Flags [.], seq 37129:38557, ack 1, win 4017, options [nop,nop,TS val 264810 ecr 40799,mptcp dss ack 2872732397 seq 408111515 subseq 37129 len 1428 csum 0xc7cd], length 1428
21:02:53.832473 IP 112.26.1.1.44903 > 112.26.1.8.37183: Flags [.], seq 27133:28561, ack 1, win 4017, options [nop,nop,TS val 264425 ecr 40485,mptcp dss ack 2872732397 seq 408075815 subseq 27133 len 1428 csum 0x475], length 1428
21:02:53.903055 IP 112.26.1.1.44903 > 112.26.1.8.37183: Flags [.], seq 24277:25705, ack 1, win 4017, options [nop,nop,TS val 264425 ecr 40485,mptcp dss ack 2872732397 seq 408072959 subseq 24277 len 1428 csum 0x6364], length 1428
21:02:53.932778 IP 112.26.1.1.44903 > 112.26.1.8.37183: Flags [.], seq 38557:39985, ack 1, win 4017, options [nop,nop,TS val 264810 ecr 40799,mptcp dss ack 2872732397 seq 408112943 subseq 38557 len 1428 csum 0xae81], length 1428
21:02:53.987564 IP 112.26.1.1.44903 > 112.26.1.8.37183: Flags [.], seq 28561:29989, ack 1, win 4017, options [nop,nop,TS val 264425 ecr 40485,mptcp dss ack 2872732397 seq 408077243 subseq 28561 len 1428 csum 0xa652], length 1428
21:02:53.991921 IP 112.26.1.8.37183 > 112.26.1.1.44903: Flags [.], ack 12853, win 9810, options [nop,nop,TS val 41902 ecr 262622,nop,nop,sack 2 {19993:21421}{14281:18565},mptcp dss ack 407991563], length 0
21:02:53.992157 IP 112.26.1.8.37183 > 112.26.1.1.44903: Flags [.], ack 12853, win 9810, options [nop,nop,TS val 41902 ecr 262622,nop,nop,sack 2 {19993:21421}{14281:18565},mptcp dss ack 407991563], length 0
21:02:54.029202 IP 112.26.1.1.44903 > 112.26.1.8.37183: Flags [.], seq 39985:41413, ack 1, win 4017, options [nop,nop,TS val 264977 ecr 41144,mptcp dss ack 2872732397 seq 408120083 subseq 39985 len 1428 csum 0x5931], length 1428
21:02:54.087109 IP 112.26.1.1.44903 > 112.26.1.8.37183: Flags [.], seq 25705:27133, ack 1, win 4017, options [nop,nop,TS val 264425 ecr 40485,mptcp dss ack 2872732397 seq 408074387 subseq 25705 len 1428 csum 0x272a], length 1428
21:02:54.091085 IP 112.26.1.1.44903 > 112.26.1.8.37183: Flags [.], seq 29989:31417, ack 1, win 4017, options [nop,nop,TS val 264425 ecr 40485,mptcp dss ack 2872732397 seq 408078671 subseq 29989 len 1428 csum 0xa654], length 1428
21:02:54.123998 IP 112.26.1.1.44903 > 112.26.1.8.37183: Flags [.], seq 41413:42841, ack 1, win 4017, options [nop,nop,TS val 265131 ecr 41192,mptcp dss ack 2872732397 seq 408128651 subseq 41413 len 1428 csum 0x3486], length 1428
21:02:54.156266 IP 112.26.1.8.37183 > 112.26.1.1.44903: Flags [.], ack 12853, win 10038, options [nop,nop,TS val 42073 ecr 262622,nop,nop,sack 2 {19993:22849}{14281:18565},mptcp dss ack 407991563], length 0
21:02:54.156491 IP 112.26.1.8.37183 > 112.26.1.1.44903: Flags [.], ack 12853, win 10038, options [nop,nop,TS val 42073 ecr 262622,nop,nop,sack 2 {19993:22849}{14281:18565},mptcp dss ack 407991563], length 0
21:02:54.205813 IP 112.26.1.1.44903 > 112.26.1.8.37183: Flags [.], seq 12853:14281, ack 1, win 4017, options [nop,nop,TS val 265435 ecr 41670,mptcp dss ack 2872732397 seq 407991563 subseq 12853 len 1428 csum 0x4a45], length 1428
21:02:54.208055 IP 112.26.1.1.44903 > 112.26.1.8.37183: Flags [.], seq 31417:32845, ack 1, win 4017, options [nop,nop,TS val 264514 ecr 40630,mptcp dss ack 2872732397 seq 408082955 subseq 31417 len 1428 csum 0x2c75], length 1428
21:02:54.264143 IP 112.26.1.1.44903 > 112.26.1.8.37183: Flags [.], seq 27133:28561, ack 1, win 4017, options [nop,nop,TS val 264425 ecr 40485,mptcp dss ack 2872732397 seq 408075815 subseq 27133 len 1428 csum 0x475], length 1428
21:02:54.306945 IP 112.26.1.1.44903 > 112.26.1.8.37183: Flags [.], seq 32845:34273, ack 1, win 4017, options [nop,nop,TS val 264514 ecr 40630,mptcp dss ack 2872732397 seq 408084383 subseq 32845 len 1428 csum 0x77ec], length 1428
21:02:54.342669 IP 112.26.1.1.44903 > 112.26.1.8.37183: Flags [.], seq 18565:19993, ack 1, win 4017, options [nop,nop,TS val 265710 ecr 41902,mptcp dss ack 2872732397 seq 407981567 subseq 18565 len 1428 csum 0x6d32], length 1428
21:02:54.371414 IP 112.26.1.8.37183 > 112.26.1.1.44903: Flags [.], ack 12853, win 10129, options [nop,nop,TS val 42134 ecr 262622,nop,nop,sack 2 {19993:24277}{14281:18565},mptcp dss ack 407991563], length 0
21:02:54.371657 IP 112.26.1.8.37183 > 112.26.1.1.44903: Flags [.], ack 12853, win 10129, options [nop,nop,TS val 42134 ecr 262622,nop,nop,sack 2 {19993:24277}{14281:18565},mptcp dss ack 407991563], length 0
21:02:54.396618 IP 112.26.1.1.44903 > 112.26.1.8.37183: Flags [.], ack 1, win 4017, options [nop,nop,TS val 264518 ecr 40630,mptcp dss ack 2872732397], length 0
21:02:54.454069 IP 112.26.1.1.44903 > 112.26.1.8.37183: Flags [.], seq 42841:44269, ack 1, win 4017, options [nop,nop,TS val 265993 ecr 42073,mptcp dss ack 2872732397 seq 408138647 subseq 42841 len 1428 csum 0x11be], length 1428
21:02:54.459752 IP 112.26.1.8.37183 > 112.26.1.1.44903: Flags [.], ack 12853, win 10220, options [nop,nop,TS val 42219 ecr 262622,nop,nop,sack 2 {19993:25705}{14281:18565},mptcp dss ack 407991563], length 0
21:02:54.459989 IP 112.26.1.8.37183 > 112.26.1.1.44903: Flags [.], ack 12853, win 10220, options [nop,nop,TS val 42219 ecr 262622,nop,nop,sack 2 {19993:25705}{14281:18565},mptcp dss ack 407991563], length 0
21:02:54.546731 IP 112.26.1.1.44903 > 112.26.1.8.37183: Flags [.], seq 28561:29989, ack 1, win 4017, options [nop,nop,TS val 264425 ecr 40485,mptcp dss ack 2872732397 seq 408077243 subseq 28561 len 1428 csum 0xa652], length 1428
21:02:54.563405 IP 112.26.1.1.44903 > 112.26.1.8.37183: Flags [.], seq 44269:45697, ack 1, win 4017, options [nop,nop,TS val 266269 ecr 42219,mptcp dss ack 2872732397 seq 408142931 subseq 44269 len 1428 csum 0x6c4f], length 1428
21:02:54.578903 IP 112.26.1.8.37183 > 112.26.1.1.44903: Flags [.], ack 12853, win 10449, options [nop,nop,TS val 42403 ecr 262622,nop,nop,sack 2 {19993:27133}{14281:18565},mptcp dss ack 407991563], length 0
21:02:54.579142 IP 112.26.1.8.37183 > 112.26.1.1.44903: Flags [.], ack 12853, win 10449, options [nop,nop,TS val 42403 ecr 262622,nop,nop,sack 2 {19993:27133}{14281:18565},mptcp dss ack 407991563], length 0
21:02:54.642083 IP 112.26.1.1.44903 > 112.26.1.8.37183: Flags [.], seq 35701:37129, ack 1, win 4017, options [nop,nop,TS val 264750 ecr 40744,mptcp dss ack 2872732397 seq 408107231 subseq 35701 len 1428 csum 0x67e5], length 1428
21:02:54.667611 IP 112.26.1.1.44903 > 112.26.1.8.37183: Flags [.], seq 29989:31417, ack 1, win 4017, options [nop,nop,TS val 264425 ecr 40485,mptcp dss ack 2872732397 seq 408078671 subseq 29989 len 1428 csum 0xa654], length 1428
21:02:54.671199 IP 112.26.1.1.44903 > 112.26.1.8.37183: Flags [.], seq 45697:47125, ack 1, win 4017, options [nop,nop,TS val 266309 ecr 42403,mptcp dss ack 2872732397 seq 408145787 subseq 45697 len 1428 csum 0x3e4], length 1428
21:02:54.747033 IP 112.26.1.1.44903 > 112.26.1.8.37183: Flags [.], seq 31417:32845, ack 1, win 4017, options [nop,nop,TS val 264514 ecr 40630,mptcp dss ack 2872732397 seq 408082955 subseq 31417 len 1428 csum 0x2c75], length 1428
21:02:54.766557 IP 112.26.1.1.44903 > 112.26.1.8.37183: Flags [.], seq 38557:39985, ack 1, win 4017, options [nop,nop,TS val 264810 ecr 40799,mptcp dss ack 2872732397 seq 408112943 subseq 38557 len 1428 csum 0xae81], length 1428
21:02:54.872170 IP 112.26.1.1.44903 > 112.26.1.8.37183: Flags [.], seq 39985:41413, ack 1, win 4017, options [nop,nop,TS val 264977 ecr 41144,mptcp dss ack 2872732397 seq 408120083 subseq 39985 len 1428 csum 0x5931], length 1428
21:02:54.905652 IP 112.26.1.8.37183 > 112.26.1.1.44903: Flags [.], ack 12853, win 10722, options [nop,nop,TS val 42580 ecr 262622,nop,nop,sack 2 {19993:28561}{14281:18565},mptcp dss ack 407991563], length 0
21:02:54.905916 IP 112.26.1.8.37183 > 112.26.1.1.44903: Flags [.], ack 12853, win 10722, options [nop,nop,TS val 42580 ecr 262622,nop,nop,sack 2 {19993:28561}{14281:18565},mptcp dss ack 407991563], length 0
21:02:54.967655 IP 112.26.1.1.44903 > 112.26.1.8.37183: Flags [.], seq 41413:42841, ack 1, win 4017, options [nop,nop,TS val 265131 ecr 41192,mptcp dss ack 2872732397 seq 408128651 subseq 41413 len 1428 csum 0x3486], length 1428
21:02:55.011013 IP 112.26.1.1.44903 > 112.26.1.8.37183: Flags [.], seq 12853:14281, ack 1, win 4017, options [nop,nop,TS val 265435 ecr 41670,mptcp dss ack 2872732397 seq 407991563 subseq 12853 len 1428 csum 0x4a45], length 1428
21:02:55.046305 IP 112.26.1.1.44903 > 112.26.1.8.37183: Flags [.], seq 32845:34273, ack 1, win 4017, options [nop,nop,TS val 264514 ecr 40630,mptcp dss ack 2872732397 seq 408084383 subseq 32845 len 1428 csum 0x77ec], length 1428
21:02:55.072335 IP 112.26.1.1.44903 > 112.26.1.8.37183: Flags [.], seq 18565:19993, ack 1, win 4017, options [nop,nop,TS val 265710 ecr 41902,mptcp dss ack 2872732397 seq 407981567 subseq 18565 len 1428 csum 0x6d32], length 1428
21:02:55.110146 IP 112.26.1.1.44903 > 112.26.1.8.37183: Flags [.], ack 1, win 4017, options [nop,nop,TS val 264518 ecr 40630,mptcp dss ack 2872732397], length 0
21:02:55.158528 IP 112.26.1.1.44903 > 112.26.1.8.37183: Flags [.], seq 42841:44269, ack 1, win 4017, options [nop,nop,TS val 265993 ecr 42073,mptcp dss ack 2872732397 seq 408138647 subseq 42841 len 1428 csum 0x11be], length 1428
21:02:55.208631 IP 112.26.1.8.37183 > 112.26.1.1.44903: Flags [.], ack 12853, win 10996, options [nop,nop,TS val 42850 ecr 262622,nop,nop,sack 2 {19993:29989}{14281:18565},mptcp dss ack 407991563], length 0
21:02:55.208877 IP 112.26.1.8.37183 > 112.26.1.1.44903: Flags [.], ack 12853, win 10996, options [nop,nop,TS val 42850 ecr 262622,nop,nop,sack 2 {19993:29989}{14281:18565},mptcp dss ack 407991563], length 0
21:02:55.223691 IP 112.26.1.1.44903 > 112.26.1.8.37183: Flags [.], seq 47125:48553, ack 1, win 4017, options [nop,nop,TS val 266921 ecr 42850,mptcp dss ack 2872732397 seq 408154355 subseq 47125 len 1428 csum 0x6f0], length 1428
21:02:55.230598 IP 112.26.1.1.44903 > 112.26.1.8.37183: Flags [.], seq 44269:45697, ack 1, win 4017, options [nop,nop,TS val 266269 ecr 42219,mptcp dss ack 2872732397 seq 408142931 subseq 44269 len 1428 csum 0x6c4f], length 1428
21:02:55.306161 IP 112.26.1.1.44903 > 112.26.1.8.37183: Flags [.], seq 35701:37129, ack 1, win 4017, options [nop,nop,TS val 264750 ecr 40744,mptcp dss ack 2872732397 seq 408107231 subseq 35701 len 1428 csum 0x67e5], length 1428
21:02:55.346715 IP 112.26.1.1.44903 > 112.26.1.8.37183: Flags [.], seq 45697:47125, ack 1, win 4017, options [nop,nop,TS val 266309 ecr 42403,mptcp dss ack 2872732397 seq 408145787 subseq 45697 len 1428 csum 0x3e4], length 1428
21:02:55.381050 IP 112.26.1.8.37183 > 112.26.1.1.44903: Flags [.], ack 12853, win 11133, options [nop,nop,TS val 42977 ecr 262622,nop,nop,sack 2 {19993:31417}{14281:18565},mptcp dss ack 407991563], length 0
21:02:55.381290 IP 112.26.1.8.37183 > 112.26.1.1.44903: Flags [.], ack 12853, win 11133, options [nop,nop,TS val 42977 ecr 262622,nop,nop,sack 2 {19993:31417}{14281:18565},mptcp dss ack 407991563], length 0
21:02:55.411101 IP 112.26.1.1.44903 > 112.26.1.8.37183: Flags [.], seq 48553:49981, ack 1, win 4017, options [nop,nop,TS val 267116 ecr 42977,mptcp dss ack 2872732397 seq 408157211 subseq 48553 len 1428 csum 0x685a], length 1428
21:02:55.449003 IP 112.26.1.8.37183 > 112.26.1.1.44903: Flags [.], ack 12853, win 11179, options [nop,nop,TS val 43046 ecr 262622,nop,nop,sack 2 {19993:32845}{14281:18565},mptcp dss ack 407991563], length 0
21:02:55.449211 IP 112.26.1.8.37183 > 112.26.1.1.44903: Flags [.], ack 12853, win 11179, options [nop,nop,TS val 43046 ecr 262622,nop,nop,sack 2 {19993:32845}{14281:18565},mptcp dss ack 407991563], length 0
21:02:55.467670 IP 112.26.1.1.44903 > 112.26.1.8.37183: Flags [.], seq 47125:48553, ack 1, win 4017, options [nop,nop,TS val 266921 ecr 42850,mptcp dss ack 2872732397 seq 408154355 subseq 47125 len 1428 csum 0x6f0], length 1428
21:02:55.539652 IP 112.26.1.1.44903 > 112.26.1.8.37183: Flags [.], seq 38557:39985, ack 1, win 4017, options [nop,nop,TS val 264810 ecr 40799,mptcp dss ack 2872732397 seq 408112943 subseq 38557 len 1428 csum 0xae81], length 1428
21:02:55.581499 IP 112.26.1.1.44903 > 112.26.1.8.37183: Flags [.], seq 48553:49981, ack 1, win 4017, options [nop,nop,TS val 267116 ecr 42977,mptcp dss ack 2872732397 seq 408157211 subseq 48553 len 1428 csum 0x685a], length 1428
21:02:55.597195 IP 112.26.1.1.44903 > 112.26.1.8.37183: Flags [.], seq 39985:41413, ack 1, win 4017, options [nop,nop,TS val 264977 ecr 41144,mptcp dss ack 2872732397 seq 408120083 subseq 39985 len 1428 csum 0x5931], length 1428
21:02:55.706888 IP 112.26.1.1.44903 > 112.26.1.8.37183: Flags [.], seq 41413:42841, ack 1, win 4017, options [nop,nop,TS val 265131 ecr 41192,mptcp dss ack 2872732397 seq 408128651 subseq 41413 len 1428 csum 0x3486], length 1428
21:02:55.793729 IP 112.26.1.1.44903 > 112.26.1.8.37183: Flags [.], seq 12853:14281, ack 1, win 4017, options [nop,nop,TS val 265435 ecr 41670,mptcp dss ack 2872732397 seq 407991563 subseq 12853 len 1428 csum 0x4a45], length 1428
21:02:55.865876 IP 112.26.1.8.37183 > 112.26.1.1.44903: Flags [.], ack 12853, win 11544, options [nop,nop,TS val 43363 ecr 262622,nop,nop,sack 2 {19993:34273}{14281:18565},mptcp dss ack 407991563], length 0
21:02:55.866119 IP 112.26.1.8.37183 > 112.26.1.1.44903: Flags [.], ack 12853, win 11544, options [nop,nop,TS val 43363 ecr 262622,nop,nop,sack 2 {19993:34273}{14281:18565},mptcp dss ack 407991563], length 0
21:02:55.920383 IP 112.26.1.1.44903 > 112.26.1.8.37183: Flags [.], seq 42841:44269, ack 1, win 4017, options [nop,nop,TS val 265993 ecr 42073,mptcp dss ack 2872732397 seq 408138647 subseq 42841 len 1428 csum 0x11be], length 1428
21:02:55.989637 IP 112.26.1.1.44903 > 112.26.1.8.37183: Flags [.], seq 44269:45697, ack 1, win 4017, options [nop,nop,TS val 266269 ecr 42219,mptcp dss ack 2872732397 seq 408142931 subseq 44269 len 1428 csum 0x6c4f], length 1428
21:02:56.049392 IP 112.26.1.8.37183 > 112.26.1.1.44903: Flags [.], ack 12853, win 11817, options [nop,nop,TS val 43620 ecr 262622,nop,nop,sack 2 {35701:37129}{19993:34273},mptcp dss ack 407991563], length 0
21:02:56.049637 IP 112.26.1.8.37183 > 112.26.1.1.44903: Flags [.], ack 12853, win 11817, options [nop,nop,TS val 43620 ecr 262622,nop,nop,sack 2 {35701:37129}{19993:34273},mptcp dss ack 407991563], length 0
21:02:56.066528 IP 112.26.1.1.44903 > 112.26.1.8.37183: Flags [.], seq 34273:35701, ack 1, win 4017, options [nop,nop,TS val 267762 ecr 43620,mptcp dss ack 2872732397 seq 408105803 subseq 34273 len 1428 csum 0x71e3], length 1428
21:02:56.072432 IP 112.26.1.1.44903 > 112.26.1.8.37183: Flags [.], seq 34273:35701, ack 1, win 4017, options [nop,nop,TS val 267762 ecr 43620,mptcp dss ack 2872732397 seq 408105803 subseq 34273 len 1428 csum 0x71e3], length 1428
21:02:56.154050 IP 112.26.1.1.44903 > 112.26.1.8.37183: Flags [.], seq 45697:47125, ack 1, win 4017, options [nop,nop,TS val 266309 ecr 42403,mptcp dss ack 2872732397 seq 408145787 subseq 45697 len 1428 csum 0x3e4], length 1428
21:02:56.207566 IP 112.26.1.1.44903 > 112.26.1.8.37183: Flags [.], seq 47125:48553, ack 1, win 4017, options [nop,nop,TS val 266921 ecr 42850,mptcp dss ack 2872732397 seq 408154355 subseq 47125 len 1428 csum 0x6f0], length 1428
21:02:56.305782 IP 112.26.1.8.37183 > 112.26.1.1.44903: Flags [.], ack 12853, win 12137, options [nop,nop,TS val 43856 ecr 262622,nop,nop,sack 2 {38557:39985}{35701:37129},mptcp dss ack 407991563], length 0
21:02:56.306031 IP 112.26.1.8.37183 > 112.26.1.1.44903: Flags [.], ack 12853, win 12137, options [nop,nop,TS val 43856 ecr 262622,nop,nop,sack 2 {38557:39985}{35701:37129},mptcp dss ack 407991563], length 0
21:02:56.316020 IP 112.26.1.1.44903 > 112.26.1.8.37183: Flags [.], seq 37129:38557, ack 1, win 4017, options [nop,nop,TS val 268018 ecr 43856,mptcp dss ack 2872732397 seq 408111515 subseq 37129 len 1428 csum 0xc7cd], length 1428
21:02:56.379216 IP 112.26.1.1.44903 > 112.26.1.8.37183: Flags [.], seq 48553:49981, ack 1, win 4017, options [nop,nop,TS val 267116 ecr 42977,mptcp dss ack 2872732397 seq 408157211 subseq 48553 len 1428 csum 0x685a], length 1428
21:02:56.420348 IP 112.26.1.1.44903 > 112.26.1.8.37183: Flags [.], seq 37129:38557, ack 1, win 4017, options [nop,nop,TS val 268018 ecr 43856,mptcp dss ack 2872732397 seq 408111515 subseq 37129 len 1428 csum 0xc7cd], length 1428
21:02:56.474561 IP 112.26.1.8.37183 > 112.26.1.1.44903: Flags [.], ack 12853, win 12365, options [nop,nop,TS val 44023 ecr 262622,nop,nop,sack 2 {38557:42841}{35701:37129},mptcp dss ack 407991563], length 0
21:02:56.474803 IP 112.26.1.8.37183 > 112.26.1.1.44903: Flags [.], ack 12853, win 12365, options [nop,nop,TS val 44023 ecr 262622,nop,nop,sack 2 {38557:42841}{35701:37129},mptcp dss ack 407991563], length 0
21:02:56.492238 IP 112.26.1.1.44903 > 112.26.1.8.37183: Flags [.], seq 49981:51409, ack 1, win 4017, options [nop,nop,TS val 268197 ecr 44023,mptcp dss ack 2872732397 seq 408180059 subseq 49981 len 1428 csum 0x3e8c], length 1428
21:02:56.527556 IP 112.26.1.1.44903 > 112.26.1.8.37183: Flags [.], seq 49981:51409, ack 1, win 4017, options [nop,nop,TS val 268197 ecr 44023,mptcp dss ack 2872732397 seq 408180059 subseq 49981 len 1428 csum 0x3e8c], length 1428
21:02:56.584368 IP 112.26.1.1.44903 > 112.26.1.8.37183: Flags [.], seq 51409:52837, ack 1, win 4017, options [nop,nop,TS val 268197 ecr 44023,mptcp dss ack 2872732397 seq 408181487 subseq 51409 len 1428 csum 0xbd18], length 1428
21:02:56.613208 IP 112.26.1.8.37183 > 112.26.1.1.44903: Flags [.], ack 18565, win 12502, options [nop,nop,TS val 44110 ecr 265435,nop,nop,sack 2 {38557:42841}{35701:37129},mptcp dss ack 408037259], length 0
21:02:56.613426 IP 112.26.1.8.37183 > 112.26.1.1.44903: Flags [.], ack 18565, win 12502, options [nop,nop,TS val 44110 ecr 265435,nop,nop,sack 2 {38557:42841}{35701:37129},mptcp dss ack 408037259], length 0
21:02:56.663574 IP 112.26.1.1.44903 > 112.26.1.8.37183: Flags [.], seq 51409:52837, ack 1, win 4017, options [nop,nop,TS val 268197 ecr 44023,mptcp dss ack 2872732397 seq 408181487 subseq 51409 len 1428 csum 0xbd18], length 1428
21:02:56.676975 IP 112.26.1.8.37183 > 112.26.1.1.44903: Flags [.], ack 18565, win 12730, options [nop,nop,TS val 44236 ecr 265435,nop,nop,sack 2 {38557:44269}{35701:37129},mptcp dss ack 408037259], length 0
21:02:56.677191 IP 112.26.1.8.37183 > 112.26.1.1.44903: Flags [.], ack 18565, win 12730, options [nop,nop,TS val 44236 ecr 265435,nop,nop,sack 2 {38557:44269}{35701:37129},mptcp dss ack 408037259], length 0
21:02:56.711671 IP 112.26.1.1.44903 > 112.26.1.8.37183: Flags [.], seq 52837:54265, ack 1, win 4017, options [nop,nop,TS val 268324 ecr 44110,mptcp dss ack 2872732397 seq 408187199 subseq 52837 len 1428 csum 0x8520], length 1428
21:02:56.743547 IP 112.26.1.1.44903 > 112.26.1.8.37183: Flags [.], seq 52837:54265, ack 1, win 4017, options [nop,nop,TS val 268324 ecr 44110,mptcp dss ack 2872732397 seq 408187199 subseq 52837 len 1428 csum 0x8520], length 1428
21:02:56.799642 IP 112.26.1.8.37183 > 112.26.1.1.44903: Flags [.], ack 18565, win 12912, options [nop,nop,TS val 44306 ecr 265435,nop,nop,sack 2 {38557:45697}{35701:37129},mptcp dss ack 408037259], length 0
21:02:56.799856 IP 112.26.1.8.37183 > 112.26.1.1.44903: Flags [.], ack 18565, win 12912, options [nop,nop,TS val 44306 ecr 265435,nop,nop,sack 2 {38557:45697}{35701:37129},mptcp dss ack 408037259], length 0
