21:02:50.606574 IP 112.26.2.8.36911 > 112.26.2.1.44903: Flags [S], seq 3024332961, win 65535, options [mss 1460,sackOK,TS val 38902 ecr 0,nop,wscale 6,mptcp join id 4 token 0x7fa57e4e nonce 0x6cbd2b45], length 0
21:02:50.688129 IP 112.26.2.8.36911 > 112.26.2.1.44903: Flags [S], seq 3024332961, win 65535, options [mss 1460,sackOK,TS val 38902 ecr 0,nop,wscale 6,mptcp join id 4 token 0x7fa57e4e nonce 0x6cbd2b45], length 0
21:02:50.775590 IP 112.26.2.8.36911 > 112.26.2.1.44903: Flags [S], seq 3024332961, win 65535, options [mss 1460,sackOK,TS val 38902 ecr 0,nop,wscale 6,mptcp join id 4 token 0x7fa57e4e nonce 0x6cbd2b45], length 0
21:02:50.898355 IP 112.26.2.1.44903 > 112.26.2.8.36911: Flags [S.], seq 3736178959, ack 3024332962, win 65535, options [mss 1460,sackOK,TS val 262484 ecr 38902,nop,wscale 6,mptcp join id 4 hmac 0x66acd08f3037344d nonce 0x613115c6], length 0
21:02:50.900430 IP 112.26.2.1.44903 > 112.26.2.8.36911: Flags [S.], seq 3736178959, ack 3024332962, win 65535, options [mss 1460,sackOK,TS val 262484 ecr 38902,nop,wscale 6,mptcp join id 4 hmac 0x66acd08f3037344d nonce 0x613115c6], length 0
21:02:50.904511 IP 112.26.2.8.36911 > 112.26.2.1.44903: Flags [.], ack 1, win 7072, options [nop,nop,TS val 39216 ecr 262484,mptcp join hmac 0x05c6b708eb80334dcf623d2a60219d0b6e2dd70a], length 0
21:02:51.026558 IP 112.26.2.8.36911 > 112.26.2.1.44903: Flags [.], ack 1, win 7072, options [nop,nop,TS val 39216 ecr 262484,mptcp join hmac 0x05c6b708eb80334dcf623d2a60219d0b6e2dd70a], length 0
21:02:51.027980 IP 112.26.2.8.36911 > 112.26.2.1.44903: Flags [.], ack 1, win 7072, options [nop,nop,TS val 39216 ecr 262484,mptcp join hmac 0x05c6b708eb80334dcf623d2a60219d0b6e2dd70a], length 0
21:02:51.215422 IP 112.26.2.1.44903 > 112.26.2.8.36911: Flags [.], ack 1, win 4017, options [nop,nop,TS val 262737 ecr 39216,mptcp dss ack 2872732397], length 0
21:02:51.219831 IP 112.26.2.1.44903 > 112.26.2.8.36911: Flags [.], ack 1, win 4017, options [nop,nop,TS val 262737 ecr 39216,mptcp dss ack 2872732397], length 0
21:02:51.274529 IP 112.26.2.1.44903 > 112.26.2.8.36911: Flags [.], seq 1:1429, ack 1, win 4017, options [nop,nop,TS val 262737 ecr 39216,mptcp dss ack 2872732397 seq 407995847 subseq 1 len 1428 csum 0xcb12], length 1428
21:02:51.290857 IP 112.26.2.1.44903 > 112.26.2.8.36911: Flags [.], seq 1:1429, ack 1, win 4017, options [nop,nop,TS val 262737 ecr 39216,mptcp dss ack 2872732397 seq 407995847 subseq 1 len 1428 csum 0xcb12], length 1428
21:02:51.292772 IP 112.26.2.8.36911 > 112.26.2.1.44903: Flags [.], ack 1429, win 7346, options [nop,nop,TS val 39607 ecr 262737,mptcp dss ack 407968715], length 0
21:02:51.450467 IP 112.26.2.8.36911 > 112.26.2.1.44903: Flags [.], ack 1429, win 7346, options [nop,nop,TS val 39607 ecr 262737,mptcp dss ack 407968715], length 0
21:02:51.459317 IP 112.26.2.1.44903 > 112.26.2.8.36911: Flags [.], seq 1429:2857, ack 1, win 4017, options [nop,nop,TS val 262737 ecr 39216,mptcp dss ack 2872732397 seq 407997275 subseq 1429 len 1428 csum 0xbb85], length 1428
21:02:51.561156 IP 112.26.2.1.44903 > 112.26.2.8.36911: Flags [.], seq 1429:2857, ack 1, win 4017, options [nop,nop,TS val 262737 ecr 39216,mptcp dss ack 2872732397 seq 407997275 subseq 1429 len 1428 csum 0xbb85], length 1428
21:02:51.563073 IP 112.26.2.8.36911 > 112.26.2.1.44903: Flags [.], ack 2857, win 7665, options [nop,nop,TS val 39877 ecr 262737,mptcp dss ack 407972999], length 0
21:02:51.619884 IP 112.26.2.1.44903 > 112.26.2.8.36911: Flags [.], seq 2857:4285, ack 1, win 4017, options [nop,nop,TS val 262737 ecr 39216,mptcp dss ack 2872732397 seq 407998703 subseq 2857 len 1428 csum 0x4b2d], length 1428
21:02:51.721698 IP 112.26.2.8.36911 > 112.26.2.1.44903: Flags [.], ack 2857, win 7665, options [nop,nop,TS val 39877 ecr 262737,mptcp dss ack 407972999], length 0
21:02:51.786189 IP 112.26.2.1.44903 > 112.26.2.8.36911: Flags [.], seq 2857:4285, ack 1, win 4017, options [nop,nop,TS val 262737 ecr 39216,mptcp dss ack 2872732397 seq 407998703 subseq 2857 len 1428 csum 0x4b2d], length 1428
21:02:51.789438 IP 112.26.2.8.36911 > 112.26.2.1.44903: Flags [.], ack 4285, win 7848, options [nop,nop,TS val 40102 ecr 262737,mptcp dss ack 407974427], length 0
21:02:51.813849 IP 112.26.2.1.44903 > 112.26.2.8.36911: Flags [.], seq 4285:5713, ack 1, win 4017, options [nop,nop,TS val 262738 ecr 39216,mptcp dss ack 2872732397 seq 408000131 subseq 4285 len 1428 csum 0x655], length 1428
21:02:51.899759 IP 112.26.2.8.36911 > 112.26.2.1.44903: Flags [.], ack 4285, win 7848, options [nop,nop,TS val 40102 ecr 262737,mptcp dss ack 407974427], length 0
21:02:51.937657 IP 112.26.2.1.44903 > 112.26.2.8.36911: Flags [.], seq 5713:7141, ack 1, win 4017, options [nop,nop,TS val 262738 ecr 39216,mptcp dss ack 2872732397 seq 408001559 subseq 5713 len 1428 csum 0x801e], length 1428
21:02:51.969639 IP 112.26.2.1.44903 > 112.26.2.8.36911: Flags [.], seq 4285:5713, ack 1, win 4017, options [nop,nop,TS val 262738 ecr 39216,mptcp dss ack 2872732397 seq 408000131 subseq 4285 len 1428 csum 0x655], length 1428
21:02:51.977076 IP 112.26.2.8.36911 > 112.26.2.1.44903: Flags [.], ack 5713, win 8076, options [nop,nop,TS val 40286 ecr 262738,mptcp dss ack 407975855], length 0
21:02:52.012070 IP 112.26.2.8.36911 > 112.26.2.1.44903: Flags [.], ack 1429, win 7346, options [nop,nop,TS val 39607 ecr 262737,mptcp dss ack 407968715], length 0
21:02:52.069571 IP 112.26.2.1.44903 > 112.26.2.8.36911: Flags [.], seq 5713:7141, ack 1, win 4017, options [nop,nop,TS val 262738 ecr 39216,mptcp dss ack 2872732397 seq 408001559 subseq 5713 len 1428 csum 0x801e], length 1428
21:02:52.072958 IP 112.26.2.8.36911 > 112.26.2.1.44903: Flags [.], ack 7141, win 8213, options [nop,nop,TS val 40386 ecr 262738,mptcp dss ack 407977283], length 0
21:02:52.106867 IP 112.26.2.1.44903 > 112.26.2.8.36911: Flags [.], seq 7141:8569, ack 1, win 4017, options [nop,nop,TS val 262738 ecr 39216,mptcp dss ack 2872732397 seq 408002987 subseq 7141 len 1428 csum 0x3999], length 1428
21:02:52.194657 IP 112.26.2.1.44903 > 112.26.2.8.36911: Flags [.], seq 8569:9997, ack 1, win 4017, options [nop,nop,TS val 262738 ecr 39216,mptcp dss ack 2872732397 seq 408004415 subseq 8569 len 1428 csum 0x9a86], length 1428
21:02:52.244673 IP 112.26.2.8.36911 > 112.26.2.1.44903: Flags [.], ack 5713, win 8076, options [nop,nop,TS val 40286 ecr 262738,mptcp dss ack 407975855], length 0
21:02:52.292202 IP 112.26.2.1.44903 > 112.26.2.8.36911: Flags [.], seq 9997:11425, ack 1, win 4017, options [nop,nop,TS val 262738 ecr 39216,mptcp dss ack 2872732397 seq 408005843 subseq 9997 len 1428 csum 0x2c94], length 1428
21:02:52.317580 IP 112.26.2.8.36911 > 112.26.2.1.44903: Flags [.], ack 7141, win 8213, options [nop,nop,TS val 40386 ecr 262738,mptcp dss ack 407977283], length 0
21:02:52.389072 IP 112.26.2.8.36911 > 112.26.2.1.44903: Flags [.], ack 2857, win 7665, options [nop,nop,TS val 39877 ecr 262737,mptcp dss ack 407972999], length 0
21:02:52.406514 IP 112.26.2.1.44903 > 112.26.2.8.36911: Flags [.], seq 7141:8569, ack 1, win 4017, options [nop,nop,TS val 262738 ecr 39216,mptcp dss ack 2872732397 seq 408002987 subseq 7141 len 1428 csum 0x3999], length 1428
21:02:52.408274 IP 112.26.2.8.36911 > 112.26.2.1.44903: Flags [.], ack 8569, win 8578, options [nop,nop,TS val 40722 ecr 262738,mptcp dss ack 407988707], length 0
21:02:52.480325 IP 112.26.2.1.44903 > 112.26.2.8.36911: Flags [.], seq 8569:9997, ack 1, win 4017, options [nop,nop,TS val 262738 ecr 39216,mptcp dss ack 2872732397 seq 408004415 subseq 8569 len 1428 csum 0x9a86], length 1428
21:02:52.482757 IP 112.26.2.8.36911 > 112.26.2.1.44903: Flags [.], ack 9997, win 8669, options [nop,nop,TS val 40796 ecr 262738,mptcp dss ack 407990135], length 0
21:02:52.528878 IP 112.26.2.1.44903 > 112.26.2.8.36911: Flags [.], seq 11425:12853, ack 1, win 4017, options [nop,nop,TS val 262738 ecr 39216,mptcp dss ack 2872732397 seq 408007271 subseq 11425 len 1428 csum 0xc46c], length 1428
21:02:52.599885 IP 112.26.2.1.44903 > 112.26.2.8.36911: Flags [.], seq 9997:11425, ack 1, win 4017, options [nop,nop,TS val 262738 ecr 39216,mptcp dss ack 2872732397 seq 408005843 subseq 9997 len 1428 csum 0x2c94], length 1428
21:02:52.601883 IP 112.26.2.8.36911 > 112.26.2.1.44903: Flags [.], ack 11425, win 8852, options [nop,nop,TS val 40916 ecr 262738,mptcp dss ack 407991563], length 0
21:02:52.622797 IP 112.26.2.1.44903 > 112.26.2.8.36911: Flags [.], seq 12853:14281, ack 1, win 4017, options [nop,nop,TS val 262738 ecr 39216,mptcp dss ack 2872732397 seq 408008699 subseq 12853 len 1428 csum 0x4422], length 1428
21:02:52.683489 IP 112.26.2.1.44903 > 112.26.2.8.36911: Flags [.], seq 11425:12853, ack 1, win 4017, options [nop,nop,TS val 262738 ecr 39216,mptcp dss ack 2872732397 seq 408007271 subseq 11425 len 1428 csum 0xc46c], length 1428
21:02:52.697384 IP 112.26.2.8.36911 > 112.26.2.1.44903: Flags [.], ack 12853, win 8989, options [nop,nop,TS val 40999 ecr 262738,mptcp dss ack 407991563], length 0
21:02:52.770959 IP 112.26.2.8.36911 > 112.26.2.1.44903: Flags [.], ack 4285, win 7848, options [nop,nop,TS val 40102 ecr 262737,mptcp dss ack 407974427], length 0
21:02:52.784014 IP 112.26.2.1.44903 > 112.26.2.8.36911: Flags [.], seq 12853:14281, ack 1, win 4017, options [nop,nop,TS val 262738 ecr 39216,mptcp dss ack 2872732397 seq 408008699 subseq 12853 len 1428 csum 0x4422], length 1428
21:02:52.785938 IP 112.26.2.8.36911 > 112.26.2.1.44903: Flags [.], ack 14281, win 9034, options [nop,nop,TS val 41100 ecr 262738,mptcp dss ack 407991563], length 0
21:02:52.853397 IP 112.26.2.8.36911 > 112.26.2.1.44903: Flags [.], ack 8569, win 8578, options [nop,nop,TS val 40722 ecr 262738,mptcp dss ack 407988707], length 0
21:02:52.867431 IP 112.26.2.1.44903 > 112.26.2.8.36911: Flags [.], seq 14281:15709, ack 1, win 4017, options [nop,nop,TS val 263721 ecr 39607,mptcp dss ack 2872732397 seq 408054395 subseq 14281 len 1428 csum 0x352b], length 1428
21:02:52.951821 IP 112.26.2.8.36911 > 112.26.2.1.44903: Flags [.], ack 8569, win 8578, options [nop,nop,TS val 40722 ecr 262738,mptcp dss ack 407988707], length 0
21:02:52.962492 IP 112.26.2.8.36911 > 112.26.2.1.44903: Flags [.], ack 9997, win 8669, options [nop,nop,TS val 40796 ecr 262738,mptcp dss ack 407990135], length 0
21:02:53.004447 IP 112.26.2.8.36911 > 112.26.2.1.44903: Flags [.], ack 5713, win 8076, options [nop,nop,TS val 40286 ecr 262738,mptcp dss ack 407975855], length 0
21:02:53.040341 IP 112.26.2.8.36911 > 112.26.2.1.44903: Flags [.], ack 9997, win 8669, options [nop,nop,TS val 40796 ecr 262738,mptcp dss ack 407990135], length 0
21:02:53.056434 IP 112.26.2.8.36911 > 112.26.2.1.44903: Flags [.], ack 11425, win 8852, options [nop,nop,TS val 40916 ecr 262738,mptcp dss ack 407991563], length 0
21:02:53.137227 IP 112.26.2.8.36911 > 112.26.2.1.44903: Flags [.], ack 7141, win 8213, options [nop,nop,TS val 40386 ecr 262738,mptcp dss ack 407977283], length 0
21:02:53.171392 IP 112.26.2.8.36911 > 112.26.2.1.44903: Flags [.], ack 11425, win 8852, options [nop,nop,TS val 40916 ecr 262738,mptcp dss ack 407991563], length 0
21:02:53.232864 IP 112.26.2.8.36911 > 112.26.2.1.44903: Flags [.], ack 12853, win 8989, options [nop,nop,TS val 40999 ecr 262738,mptcp dss ack 407991563], length 0
21:02:53.318958 IP 112.26.2.8.36911 > 112.26.2.1.44903: Flags [.], ack 14281, win 9034, options [nop,nop,TS val 41100 ecr 262738,mptcp dss ack 407991563], length 0
21:02:53.326117 IP 112.26.2.8.36911 > 112.26.2.1.44903: Flags [.], ack 12853, win 8989, options [nop,nop,TS val 40999 ecr 262738,mptcp dss ack 407991563], length 0
21:02:53.375285 IP 112.26.2.1.44903 > 112.26.2.8.36911: Flags [.], seq 14281:15709, ack 1, win 4017, options [nop,nop,TS val 263721 ecr 39607,mptcp dss ack 2872732397 seq 408054395 subseq 14281 len 1428 csum 0x352b], length 1428
21:02:53.377181 IP 112.26.2.8.36911 > 112.26.2.1.44903: Flags [.], ack 15709, win 9627, options [nop,nop,TS val 41691 ecr 263721,mptcp dss ack 407991563], length 0
21:02:53.409498 IP 112.26.2.1.44903 > 112.26.2.8.36911: Flags [.], seq 18565:19993, ack 1, win 4017, options [nop,nop,TS val 264098 ecr 39877,mptcp dss ack 2872732397 seq 407991563 subseq 18565 len 1428 csum 0x33f5], length 1428
21:02:53.445526 IP 112.26.2.8.36911 > 112.26.2.1.44903: Flags [.], ack 14281, win 9034, options [nop,nop,TS val 41100 ecr 262738,mptcp dss ack 407991563], length 0
21:02:53.470273 IP 112.26.2.8.36911 > 112.26.2.1.44903: Flags [.], ack 15709, win 9627, options [nop,nop,TS val 41691 ecr 263721,mptcp dss ack 407991563], length 0
21:02:53.524276 IP 112.26.2.1.44903 > 112.26.2.8.36911: Flags [.], seq 19993:21421, ack 1, win 4017, options [nop,nop,TS val 264479 ecr 40102,mptcp dss ack 2872732397 seq 408080099 subseq 19993 len 1428 csum 0x6f4a], length 1428
21:02:53.549681 IP 112.26.2.1.44903 > 112.26.2.8.36911: Flags [.], seq 18565:19993, ack 1, win 4017, options [nop,nop,TS val 264098 ecr 39877,mptcp dss ack 2872732397 seq 407991563 subseq 18565 len 1428 csum 0x33f5], length 1428
21:02:53.552100 IP 112.26.2.8.36911 > 112.26.2.1.44903: Flags [.], ack 15709, win 9764, options [nop,nop,TS val 41866 ecr 263721,nop,nop,sack 1 {18565:19993},mptcp dss ack 407991563], length 0
21:02:53.605188 IP 112.26.2.8.36911 > 112.26.2.1.44903: Flags [.], ack 15709, win 9627, options [nop,nop,TS val 41691 ecr 263721,mptcp dss ack 407991563], length 0
21:02:53.655450 IP 112.26.2.1.44903 > 112.26.2.8.36911: Flags [.], seq 19993:21421, ack 1, win 4017, options [nop,nop,TS val 264479 ecr 40102,mptcp dss ack 2872732397 seq 408080099 subseq 19993 len 1428 csum 0x6f4a], length 1428
21:02:53.661365 IP 112.26.2.8.36911 > 112.26.2.1.44903: Flags [.], ack 15709, win 9947, options [nop,nop,TS val 41971 ecr 263721,nop,nop,sack 1 {18565:21421},mptcp dss ack 407991563], length 0
21:02:53.703465 IP 112.26.2.1.44903 > 112.26.2.8.36911: Flags [.], seq 21421:22849, ack 1, win 4017, options [nop,nop,TS val 264479 ecr 40102,mptcp dss ack 2872732397 seq 408081527 subseq 21421 len 1428 csum 0x49fa], length 1428
21:02:53.789130 IP 112.26.2.8.36911 > 112.26.2.1.44903: Flags [.], ack 15709, win 9764, options [nop,nop,TS val 41866 ecr 263721,nop,nop,sack 1 {18565:19993},mptcp dss ack 407991563], length 0
21:02:53.793577 IP 112.26.2.8.36911 > 112.26.2.1.44903: Flags [.], ack 15709, win 9764, options [nop,nop,TS val 41866 ecr 263721,nop,nop,sack 1 {18565:19993},mptcp dss ack 407991563], length 0
21:02:53.810866 IP 112.26.2.1.44903 > 112.26.2.8.36911: Flags [.], seq 22849:24277, ack 1, win 4017, options [nop,nop,TS val 264659 ecr 40722,mptcp dss ack 2872732397 seq 408091523 subseq 22849 len 1428 csum 0x7504], length 1428
21:02:53.904694 IP 112.26.2.1.44903 > 112.26.2.8.36911: Flags [.], seq 24277:25705, ack 1, win 4017, options [nop,nop,TS val 264659 ecr 40722,mptcp dss ack 2872732397 seq 408092951 subseq 24277 len 1428 csum 0x9920], length 1428
21:02:53.917015 IP 112.26.2.8.36911 > 112.26.2.1.44903: Flags [.], ack 15709, win 9947, options [nop,nop,TS val 41971 ecr 263721,nop,nop,sack 1 {18565:21421},mptcp dss ack 407991563], length 0
21:02:53.923938 IP 112.26.2.8.36911 > 112.26.2.1.44903: Flags [.], ack 15709, win 9947, options [nop,nop,TS val 41971 ecr 263721,nop,nop,sack 1 {18565:21421},mptcp dss ack 407991563], length 0
21:02:54.006646 IP 112.26.2.1.44903 > 112.26.2.8.36911: Flags [.], seq 21421:22849, ack 1, win 4017, options [nop,nop,TS val 264479 ecr 40102,mptcp dss ack 2872732397 seq 408081527 subseq 21421 len 1428 csum 0x49fa], length 1428
21:02:54.009439 IP 112.26.2.8.36911 > 112.26.2.1.44903: Flags [.], ack 15709, win 10357, options [nop,nop,TS val 42323 ecr 263721,nop,nop,sack 1 {18565:22849},mptcp dss ack 407991563], length 0
21:02:54.039003 IP 112.26.2.1.44903 > 112.26.2.8.36911: Flags [.], seq 25705:27133, ack 1, win 4017, options [nop,nop,TS val 264659 ecr 40722,mptcp dss ack 2872732397 seq 408094379 subseq 25705 len 1428 csum 0xa19f], length 1428
21:02:54.100602 IP 112.26.2.1.44903 > 112.26.2.8.36911: Flags [.], seq 22849:24277, ack 1, win 4017, options [nop,nop,TS val 264659 ecr 40722,mptcp dss ack 2872732397 seq 408091523 subseq 22849 len 1428 csum 0x7504], length 1428
21:02:54.102213 IP 112.26.2.8.36911 > 112.26.2.1.44903: Flags [.], ack 15709, win 10494, options [nop,nop,TS val 42416 ecr 263721,nop,nop,sack 1 {18565:24277},mptcp dss ack 407991563], length 0
21:02:54.132427 IP 112.26.2.1.44903 > 112.26.2.8.36911: Flags [.], seq 27133:28561, ack 1, win 4017, options [nop,nop,TS val 264659 ecr 40722,mptcp dss ack 2872732397 seq 408095807 subseq 27133 len 1428 csum 0x26ce], length 1428
21:02:54.213782 IP 112.26.2.1.44903 > 112.26.2.8.36911: Flags [.], seq 24277:25705, ack 1, win 4017, options [nop,nop,TS val 264659 ecr 40722,mptcp dss ack 2872732397 seq 408092951 subseq 24277 len 1428 csum 0x9920], length 1428
21:02:54.221902 IP 112.26.2.1.44903 > 112.26.2.8.36911: Flags [.], seq 28561:29989, ack 1, win 4017, options [nop,nop,TS val 264659 ecr 40722,mptcp dss ack 2872732397 seq 408097235 subseq 28561 len 1428 csum 0xfb77], length 1428
21:02:54.223575 IP 112.26.2.8.36911 > 112.26.2.1.44903: Flags [.], ack 15709, win 10631, options [nop,nop,TS val 42530 ecr 263721,nop,nop,sack 1 {18565:25705},mptcp dss ack 407991563], length 0
21:02:54.362134 IP 112.26.2.1.44903 > 112.26.2.8.36911: Flags [.], ack 1, win 4017, options [nop,nop,TS val 264713 ecr 40722,mptcp dss ack 2872732397], length 0
21:02:54.420236 IP 112.26.2.8.36911 > 112.26.2.1.44903: Flags [.], ack 15709, win 10357, options [nop,nop,TS val 42323 ecr 263721,nop,nop,sack 1 {18565:22849},mptcp dss ack 407991563], length 0
21:02:54.421980 IP 112.26.2.8.36911 > 112.26.2.1.44903: Flags [.], ack 15709, win 10357, options [nop,nop,TS val 42323 ecr 263721,nop,nop,sack 1 {18565:22849},mptcp dss ack 407991563], length 0
21:02:54.479855 IP 112.26.2.1.44903 > 112.26.2.8.36911: Flags [.], seq 31417:32845, ack 1, win 4017, options [nop,nop,TS val 264748 ecr 40796,mptcp dss ack 2872732397 seq 408102947 subseq 31417 len 1428 csum 0xfa86], length 1428
21:02:54.522336 IP 112.26.2.1.44903 > 112.26.2.8.36911: Flags [.], seq 25705:27133, ack 1, win 4017, options [nop,nop,TS val 264659 ecr 40722,mptcp dss ack 2872732397 seq 408094379 subseq 25705 len 1428 csum 0xa19f], length 1428
21:02:54.524566 IP 112.26.2.8.36911 > 112.26.2.1.44903: Flags [.], ack 15709, win 10950, options [nop,nop,TS val 42838 ecr 263721,nop,nop,sack 1 {18565:27133},mptcp dss ack 407991563], length 0
21:02:54.649941 IP 112.26.2.8.36911 > 112.26.2.1.44903: Flags [.], ack 15709, win 10494, options [nop,nop,TS val 42416 ecr 263721,nop,nop,sack 1 {18565:24277},mptcp dss ack 407991563], length 0
21:02:54.652053 IP 112.26.2.8.36911 > 112.26.2.1.44903: Flags [.], ack 15709, win 10494, options [nop,nop,TS val 42416 ecr 263721,nop,nop,sack 1 {18565:24277},mptcp dss ack 407991563], length 0
21:02:54.677391 IP 112.26.2.1.44903 > 112.26.2.8.36911: Flags [.], seq 34273:35701, ack 1, win 4017, options [nop,nop,TS val 264879 ecr 40916,mptcp dss ack 2872732397 seq 408117227 subseq 34273 len 1428 csum 0xb8ed], length 1428
21:02:54.744322 IP 112.26.2.1.44903 > 112.26.2.8.36911: Flags [.], seq 27133:28561, ack 1, win 4017, options [nop,nop,TS val 264659 ecr 40722,mptcp dss ack 2872732397 seq 408095807 subseq 27133 len 1428 csum 0x26ce], length 1428
21:02:54.746029 IP 112.26.2.8.36911 > 112.26.2.1.44903: Flags [.], ack 15709, win 11224, options [nop,nop,TS val 43060 ecr 263721,nop,nop,sack 1 {18565:28561},mptcp dss ack 407991563], length 0
21:02:54.793882 IP 112.26.2.1.44903 > 112.26.2.8.36911: Flags [.], seq 35701:37129, ack 1, win 4017, options [nop,nop,TS val 264879 ecr 40916,mptcp dss ack 2872732397 seq 408118655 subseq 35701 len 1428 csum 0xc007], length 1428
21:02:54.833919 IP 112.26.2.1.44903 > 112.26.2.8.36911: Flags [.], seq 28561:29989, ack 1, win 4017, options [nop,nop,TS val 264659 ecr 40722,mptcp dss ack 2872732397 seq 408097235 subseq 28561 len 1428 csum 0xfb77], length 1428
21:02:54.835620 IP 112.26.2.8.36911 > 112.26.2.1.44903: Flags [.], ack 15709, win 11361, options [nop,nop,TS val 43150 ecr 263721,nop,nop,sack 1 {18565:29989},mptcp dss ack 407991563], length 0
21:02:54.871034 IP 112.26.2.1.44903 > 112.26.2.8.36911: Flags [.], seq 37129:38557, ack 1, win 4017, options [nop,nop,TS val 265034 ecr 40999,mptcp dss ack 2872732397 seq 408125795 subseq 37129 len 1428 csum 0x30fb], length 1428
21:02:54.908309 IP 112.26.2.8.36911 > 112.26.2.1.44903: Flags [.], ack 15709, win 10631, options [nop,nop,TS val 42530 ecr 263721,nop,nop,sack 1 {18565:25705},mptcp dss ack 407991563], length 0
21:02:54.911013 IP 112.26.2.8.36911 > 112.26.2.1.44903: Flags [.], ack 15709, win 10631, options [nop,nop,TS val 42530 ecr 263721,nop,nop,sack 1 {18565:25705},mptcp dss ack 407991563], length 0
21:02:54.955949 IP 112.26.2.1.44903 > 112.26.2.8.36911: Flags [.], seq 38557:39985, ack 1, win 4017, options [nop,nop,TS val 265034 ecr 40999,mptcp dss ack 2872732397 seq 408127223 subseq 38557 len 1428 csum 0xd51d], length 1428
21:02:55.003724 IP 112.26.2.1.44903 > 112.26.2.8.36911: Flags [.], ack 1, win 4017, options [nop,nop,TS val 264713 ecr 40722,mptcp dss ack 2872732397], length 0
21:02:55.041915 IP 112.26.2.1.44903 > 112.26.2.8.36911: Flags [.], seq 39985:41413, ack 1, win 4017, options [nop,nop,TS val 265153 ecr 41100,mptcp dss ack 2872732397 seq 408131507 subseq 39985 len 1428 csum 0x32dd], length 1428
21:02:55.077713 IP 112.26.2.1.44903 > 112.26.2.8.36911: Flags [.], seq 31417:32845, ack 1, win 4017, options [nop,nop,TS val 264748 ecr 40796,mptcp dss ack 2872732397 seq 408102947 subseq 31417 len 1428 csum 0xfa86], length 1428
21:02:55.079715 IP 112.26.2.8.36911 > 112.26.2.1.44903: Flags [.], ack 15709, win 11589, options [nop,nop,TS val 43394 ecr 263721,nop,nop,sack 2 {31417:32845}{18565:29989},mptcp dss ack 407991563], length 0
21:02:55.105178 IP 112.26.2.1.44903 > 112.26.2.8.36911: Flags [.], seq 41413:42841, ack 1, win 4017, options [nop,nop,TS val 265153 ecr 41100,mptcp dss ack 2872732397 seq 408132935 subseq 41413 len 1428 csum 0xad1b], length 1428
21:02:55.177006 IP 112.26.2.1.44903 > 112.26.2.8.36911: Flags [.], seq 15709:17137, ack 1, win 4017, options [nop,nop,TS val 265632 ecr 41971,mptcp dss ack 2872732397 seq 408055823 subseq 15709 len 1428 csum 0x9de1], length 1428
21:02:55.179407 IP 112.26.2.8.36911 > 112.26.2.1.44903: Flags [.], ack 15709, win 10950, options [nop,nop,TS val 42838 ecr 263721,nop,nop,sack 1 {18565:27133},mptcp dss ack 407991563], length 0
21:02:55.181619 IP 112.26.2.8.36911 > 112.26.2.1.44903: Flags [.], ack 15709, win 10950, options [nop,nop,TS val 42838 ecr 263721,nop,nop,sack 1 {18565:27133},mptcp dss ack 407991563], length 0
21:02:55.267601 IP 112.26.2.1.44903 > 112.26.2.8.36911: Flags [.], seq 34273:35701, ack 1, win 4017, options [nop,nop,TS val 264879 ecr 40916,mptcp dss ack 2872732397 seq 408117227 subseq 34273 len 1428 csum 0xb8ed], length 1428
21:02:55.272792 IP 112.26.2.8.36911 > 112.26.2.1.44903: Flags [.], ack 15709, win 11772, options [nop,nop,TS val 43584 ecr 263721,nop,nop,sack 2 {34273:35701}{31417:32845},mptcp dss ack 407991563], length 0
21:02:55.303659 IP 112.26.2.1.44903 > 112.26.2.8.36911: Flags [.], seq 17137:18565, ack 1, win 4017, options [nop,nop,TS val 266130 ecr 42323,mptcp dss ack 2872732397 seq 407990135 subseq 17137 len 1428 csum 0xbb06], length 1428
21:02:55.366460 IP 112.26.2.8.36911 > 112.26.2.1.44903: Flags [.], ack 15709, win 11224, options [nop,nop,TS val 43060 ecr 263721,nop,nop,sack 1 {18565:28561},mptcp dss ack 407991563], length 0
21:02:55.368574 IP 112.26.2.8.36911 > 112.26.2.1.44903: Flags [.], ack 15709, win 11224, options [nop,nop,TS val 43060 ecr 263721,nop,nop,sack 1 {18565:28561},mptcp dss ack 407991563], length 0
21:02:55.403195 IP 112.26.2.1.44903 > 112.26.2.8.36911: Flags [.], seq 42841:44269, ack 1, win 4017, options [nop,nop,TS val 266673 ecr 42530,mptcp dss ack 2872732397 seq 408148643 subseq 42841 len 1428 csum 0x8b67], length 1428
21:02:55.437464 IP 112.26.2.1.44903 > 112.26.2.8.36911: Flags [.], seq 35701:37129, ack 1, win 4017, options [nop,nop,TS val 264879 ecr 40916,mptcp dss ack 2872732397 seq 408118655 subseq 35701 len 1428 csum 0xc007], length 1428
21:02:55.439148 IP 112.26.2.8.36911 > 112.26.2.1.44903: Flags [.], ack 15709, win 12000, options [nop,nop,TS val 43753 ecr 263721,nop,nop,sack 2 {34273:37129}{31417:32845},mptcp dss ack 407991563], length 0
21:02:55.487050 IP 112.26.2.1.44903 > 112.26.2.8.36911: Flags [.], seq 44269:45697, ack 1, win 4017, options [nop,nop,TS val 266919 ecr 42838,mptcp dss ack 2872732397 seq 408152927 subseq 44269 len 1428 csum 0xf380], length 1428
21:02:55.550331 IP 112.26.2.8.36911 > 112.26.2.1.44903: Flags [.], ack 15709, win 11361, options [nop,nop,TS val 43150 ecr 263721,nop,nop,sack 1 {18565:29989},mptcp dss ack 407991563], length 0
21:02:55.553621 IP 112.26.2.8.36911 > 112.26.2.1.44903: Flags [.], ack 15709, win 11361, options [nop,nop,TS val 43150 ecr 263721,nop,nop,sack 1 {18565:29989},mptcp dss ack 407991563], length 0
21:02:55.608442 IP 112.26.2.1.44903 > 112.26.2.8.36911: Flags [.], seq 45697:47125, ack 1, win 4017, options [nop,nop,TS val 267312 ecr 43150,mptcp dss ack 2872732397 seq 408158639 subseq 45697 len 1428 csum 0x939a], length 1428
21:02:55.654843 IP 112.26.2.1.44903 > 112.26.2.8.36911: Flags [.], seq 37129:38557, ack 1, win 4017, options [nop,nop,TS val 265034 ecr 40999,mptcp dss ack 2872732397 seq 408125795 subseq 37129 len 1428 csum 0x30fb], length 1428
21:02:55.657193 IP 112.26.2.8.36911 > 112.26.2.1.44903: Flags [.], ack 15709, win 12274, options [nop,nop,TS val 43970 ecr 263721,nop,nop,sack 2 {34273:38557}{31417:32845},mptcp dss ack 407991563], length 0
21:02:55.712379 IP 112.26.2.1.44903 > 112.26.2.8.36911: Flags [.], seq 38557:39985, ack 1, win 4017, options [nop,nop,TS val 265034 ecr 40999,mptcp dss ack 2872732397 seq 408127223 subseq 38557 len 1428 csum 0xd51d], length 1428
21:02:55.730209 IP 112.26.2.8.36911 > 112.26.2.1.44903: Flags [.], ack 15709, win 12410, options [nop,nop,TS val 44028 ecr 263721,nop,nop,sack 2 {34273:39985}{31417:32845},mptcp dss ack 407991563], length 0
21:02:55.804046 IP 112.26.2.1.44903 > 112.26.2.8.36911: Flags [.], seq 39985:41413, ack 1, win 4017, options [nop,nop,TS val 265153 ecr 41100,mptcp dss ack 2872732397 seq 408131507 subseq 39985 len 1428 csum 0x32dd], length 1428
21:02:55.806490 IP 112.26.2.8.36911 > 112.26.2.1.44903: Flags [.], ack 15709, win 12547, options [nop,nop,TS val 44120 ecr 263721,nop,nop,sack 2 {34273:41413}{31417:32845},mptcp dss ack 408037259], length 0
21:02:55.890919 IP 112.26.2.8.36911 > 112.26.2.1.44903: Flags [.], ack 15709, win 11589, options [nop,nop,TS val 43394 ecr 263721,nop,nop,sack 2 {31417:32845}{18565:29989},mptcp dss ack 407991563], length 0
21:02:55.893037 IP 112.26.2.8.36911 > 112.26.2.1.44903: Flags [.], ack 15709, win 11589, options [nop,nop,TS val 43394 ecr 263721,nop,nop,sack 2 {31417:32845}{18565:29989},mptcp dss ack 407991563], length 0
21:02:55.906898 IP 112.26.2.1.44903 > 112.26.2.8.36911: Flags [.], seq 29989:31417, ack 1, win 4017, options [nop,nop,TS val 267601 ecr 43394,mptcp dss ack 2872732397 seq 408098663 subseq 29989 len 1428 csum 0x553e], length 1428
21:02:55.974735 IP 112.26.2.1.44903 > 112.26.2.8.36911: Flags [.], seq 15709:17137, ack 1, win 4017, options [nop,nop,TS val 265632 ecr 41971,mptcp dss ack 2872732397 seq 408055823 subseq 15709 len 1428 csum 0x9de1], length 1428
21:02:55.976163 IP 112.26.2.8.36911 > 112.26.2.1.44903: Flags [.], ack 17137, win 12775, options [nop,nop,TS val 44291 ecr 265632,nop,nop,sack 2 {34273:41413}{31417:32845},mptcp dss ack 408037259], length 0
21:02:56.044259 IP 112.26.2.8.36911 > 112.26.2.1.44903: Flags [.], ack 15709, win 11772, options [nop,nop,TS val 43584 ecr 263721,nop,nop,sack 2 {34273:35701}{31417:32845},mptcp dss ack 407991563], length 0
21:02:56.046770 IP 112.26.2.8.36911 > 112.26.2.1.44903: Flags [.], ack 15709, win 11772, options [nop,nop,TS val 43584 ecr 263721,nop,nop,sack 2 {34273:35701}{31417:32845},mptcp dss ack 407991563], length 0
21:02:56.099921 IP 112.26.2.1.44903 > 112.26.2.8.36911: Flags [.], seq 17137:18565, ack 1, win 4017, options [nop,nop,TS val 266130 ecr 42323,mptcp dss ack 2872732397 seq 407990135 subseq 17137 len 1428 csum 0xbb06], length 1428
21:02:56.105998 IP 112.26.2.8.36911 > 112.26.2.1.44903: Flags [.], ack 29989, win 13049, options [nop,nop,TS val 44416 ecr 266130,nop,nop,sack 2 {34273:41413}{31417:32845},mptcp dss ack 408037259], length 0
21:02:56.170169 IP 112.26.2.1.44903 > 112.26.2.8.36911: Flags [.], seq 42841:44269, ack 1, win 4017, options [nop,nop,TS val 266673 ecr 42530,mptcp dss ack 2872732397 seq 408148643 subseq 42841 len 1428 csum 0x8b67], length 1428
21:02:56.189645 IP 112.26.2.8.36911 > 112.26.2.1.44903: Flags [.], ack 29989, win 13140, options [nop,nop,TS val 44486 ecr 266130,nop,nop,sack 2 {42841:44269}{34273:41413},mptcp dss ack 408037259], length 0
21:02:56.227282 IP 112.26.2.8.36911 > 112.26.2.1.44903: Flags [.], ack 15709, win 12000, options [nop,nop,TS val 43753 ecr 263721,nop,nop,sack 2 {34273:37129}{31417:32845},mptcp dss ack 407991563], length 0
21:02:56.230871 IP 112.26.2.8.36911 > 112.26.2.1.44903: Flags [.], ack 15709, win 12000, options [nop,nop,TS val 43753 ecr 263721,nop,nop,sack 2 {34273:37129}{31417:32845},mptcp dss ack 407991563], length 0
21:02:56.252843 IP 112.26.2.1.44903 > 112.26.2.8.36911: Flags [.], seq 32845:34273, ack 1, win 4017, options [nop,nop,TS val 267939 ecr 43753,mptcp dss ack 2872732397 seq 408104375 subseq 32845 len 1428 csum 0x33bf], length 1428
21:02:56.335338 IP 112.26.2.1.44903 > 112.26.2.8.36911: Flags [.], seq 44269:45697, ack 1, win 4017, options [nop,nop,TS val 266919 ecr 42838,mptcp dss ack 2872732397 seq 408152927 subseq 44269 len 1428 csum 0xf380], length 1428
21:02:56.337146 IP 112.26.2.8.36911 > 112.26.2.1.44903: Flags [.], ack 29989, win 13369, options [nop,nop,TS val 44651 ecr 266130,nop,nop,sack 2 {42841:45697}{34273:41413},mptcp dss ack 408058679], length 0
21:02:56.414312 IP 112.26.2.1.44903 > 112.26.2.8.36911: Flags [.], seq 45697:47125, ack 1, win 4017, options [nop,nop,TS val 267312 ecr 43150,mptcp dss ack 2872732397 seq 408158639 subseq 45697 len 1428 csum 0x939a], length 1428
21:02:56.416299 IP 112.26.2.8.36911 > 112.26.2.1.44903: Flags [.], ack 29989, win 13551, options [nop,nop,TS val 44730 ecr 266130,nop,nop,sack 2 {42841:47125}{34273:41413},mptcp dss ack 408058679], length 0
21:02:56.483102 IP 112.26.2.8.36911 > 112.26.2.1.44903: Flags [.], ack 15709, win 12274, options [nop,nop,TS val 43970 ecr 263721,nop,nop,sack 2 {34273:38557}{31417:32845},mptcp dss ack 407991563], length 0
21:02:56.489293 IP 112.26.2.8.36911 > 112.26.2.1.44903: Flags [.], ack 15709, win 12274, options [nop,nop,TS val 43970 ecr 263721,nop,nop,sack 2 {34273:38557}{31417:32845},mptcp dss ack 407991563], length 0
21:02:56.570675 IP 112.26.2.8.36911 > 112.26.2.1.44903: Flags [.], ack 15709, win 12410, options [nop,nop,TS val 44028 ecr 263721,nop,nop,sack 2 {34273:39985}{31417:32845},mptcp dss ack 407991563], length 0
21:02:56.580420 IP 112.26.2.8.36911 > 112.26.2.1.44903: Flags [.], ack 15709, win 12410, options [nop,nop,TS val 44028 ecr 263721,nop,nop,sack 2 {34273:39985}{31417:32845},mptcp dss ack 407991563], length 0
21:02:56.654601 IP 112.26.2.1.44903 > 112.26.2.8.36911: Flags [.], seq 47125:48553, ack 1, win 4017, options [nop,nop,TS val 268223 ecr 43970,mptcp dss ack 2872732397 seq 408182915 subseq 47125 len 1428 csum 0x60a6], length 1428
21:02:56.673829 IP 112.26.2.1.44903 > 112.26.2.8.36911: Flags [.], seq 29989:31417, ack 1, win 4017, options [nop,nop,TS val 267601 ecr 43394,mptcp dss ack 2872732397 seq 408098663 subseq 29989 len 1428 csum 0x553e], length 1428
21:02:56.692091 IP 112.26.2.8.36911 > 112.26.2.1.44903: Flags [.], ack 32845, win 13825, options [nop,nop,TS val 44990 ecr 267601,nop,nop,sack 2 {42841:47125}{34273:41413},mptcp dss ack 408058679], length 0
21:02:56.749283 IP 112.26.2.8.36911 > 112.26.2.1.44903: Flags [.], ack 17137, win 12775, options [nop,nop,TS val 44291 ecr 265632,nop,nop,sack 2 {34273:41413}{31417:32845},mptcp dss ack 408037259], length 0
21:02:56.751140 IP 112.26.2.8.36911 > 112.26.2.1.44903: Flags [.], ack 17137, win 12775, options [nop,nop,TS val 44291 ecr 265632,nop,nop,sack 2 {34273:41413}{31417:32845},mptcp dss ack 408037259], length 0
21:02:56.789760 IP 112.26.2.1.44903 > 112.26.2.8.36911: Flags [.], seq 41413:42841, ack 1, win 4017, options [nop,nop,TS val 268459 ecr 44291,mptcp dss ack 2872732397 seq 408132935 subseq 41413 len 1428 csum 0xad1b], length 1428
21:02:56.913319 IP 112.26.2.1.44903 > 112.26.2.8.36911: Flags [.], seq 48553:49981, ack 1, win 4017, options [nop,nop,TS val 268459 ecr 44291,mptcp dss ack 2872732397 seq 408194339 subseq 48553 len 1428 csum 0x11f1], length 1428
21:02:56.922075 IP 112.26.2.8.36911 > 112.26.2.1.44903: Flags [.], ack 29989, win 13049, options [nop,nop,TS val 44416 ecr 266130,nop,nop,sack 2 {34273:41413}{31417:32845},mptcp dss ack 408037259], length 0
21:02:56.929387 IP 112.26.2.8.36911 > 112.26.2.1.44903: Flags [.], ack 29989, win 13049, options [nop,nop,TS val 44416 ecr 266130,nop,nop,sack 2 {34273:41413}{31417:32845},mptcp dss ack 408037259], length 0
21:02:57.014154 IP 112.26.2.8.36911 > 112.26.2.1.44903: Flags [.], ack 29989, win 13140, options [nop,nop,TS val 44486 ecr 266130,nop,nop,sack 2 {42841:44269}{34273:41413},mptcp dss ack 408037259], length 0
21:02:57.055695 IP 112.26.2.1.44903 > 112.26.2.8.36911: Flags [.], seq 49981:51409, ack 1, win 4017, options [nop,nop,TS val 268637 ecr 44416,mptcp dss ack 2872732397 seq 408198623 subseq 49981 len 1428 csum 0x8fde], length 1428
21:02:57.084849 IP 112.26.2.8.36911 > 112.26.2.1.44903: Flags [.], ack 29989, win 13140, options [nop,nop,TS val 44486 ecr 266130,nop,nop,sack 2 {42841:44269}{34273:41413},mptcp dss ack 408037259], length 0
21:02:57.124163 IP 112.26.2.1.44903 > 112.26.2.8.36911: Flags [.], seq 32845:34273, ack 1, win 4017, options [nop,nop,TS val 267939 ecr 43753,mptcp dss ack 2872732397 seq 408104375 subseq 32845 len 1428 csum 0x33bf], length 1428
21:02:57.126111 IP 112.26.2.8.36911 > 112.26.2.1.44903: Flags [.], ack 41413, win 14144, options [nop,nop,TS val 45440 ecr 267939,nop,nop,sack 1 {42841:47125},mptcp dss ack 408058679], length 0
21:02:57.168121 IP 112.26.2.1.44903 > 112.26.2.8.36911: Flags [.], seq 51409:52837, ack 1, win 4017, options [nop,nop,TS val 268802 ecr 44486,mptcp dss ack 2872732397 seq 408204335 subseq 51409 len 1428 csum 0x8ad4], length 1428
21:02:57.209295 IP 112.26.2.8.36911 > 112.26.2.1.44903: Flags [.], ack 29989, win 13369, options [nop,nop,TS val 44651 ecr 266130,nop,nop,sack 2 {42841:45697}{34273:41413},mptcp dss ack 408058679], length 0
21:02:57.215176 IP 112.26.2.8.36911 > 112.26.2.1.44903: Flags [.], ack 29989, win 13369, options [nop,nop,TS val 44651 ecr 266130,nop,nop,sack 2 {42841:45697}{34273:41413},mptcp dss ack 408058679], length 0
21:02:57.277250 IP 112.26.2.1.44903 > 112.26.2.8.36911: Flags [.], seq 52837:54265, ack 1, win 4017, options [nop,nop,TS val 268946 ecr 44651,mptcp dss ack 2872732397 seq 408210047 subseq 52837 len 1428 csum 0x60a4], length 1428
21:02:57.316017 IP 112.26.2.8.36911 > 112.26.2.1.44903: Flags [.], ack 29989, win 13551, options [nop,nop,TS val 44730 ecr 266130,nop,nop,sack 2 {42841:47125}{34273:41413},mptcp dss ack 408058679], length 0
21:02:57.345361 IP 112.26.2.8.36911 > 112.26.2.1.44903: Flags [.], ack 29989, win 13551, options [nop,nop,TS val 44730 ecr 266130,nop,nop,sack 2 {42841:47125}{34273:41413},mptcp dss ack 408058679], length 0
21:02:57.384690 IP 112.26.2.1.44903 > 112.26.2.8.36911: Flags [.], seq 47125:48553, ack 1, win 4017, options [nop,nop,TS val 268223 ecr 43970,mptcp dss ack 2872732397 seq 408182915 subseq 47125 len 1428 csum 0x60a6], length 1428
21:02:57.387128 IP 112.26.2.8.36911 > 112.26.2.1.44903: Flags [.], ack 41413, win 14372, options [nop,nop,TS val 45701 ecr 267939,nop,nop,sack 1 {42841:48553},mptcp dss ack 408058679], length 0
21:02:57.401624 IP 112.26.2.1.44903 > 112.26.2.8.36911: Flags [.], seq 54265:55693, ack 1, win 4017, options [nop,nop,TS val 269091 ecr 44730,mptcp dss ack 2872732397 seq 408227183 subseq 54265 len 1428 csum 0xacf8], length 1428
21:02:57.540018 IP 112.26.2.8.36911 > 112.26.2.1.44903: Flags [.], ack 32845, win 13825, options [nop,nop,TS val 44990 ecr 267601,nop,nop,sack 2 {42841:47125}{34273:41413},mptcp dss ack 408058679], length 0
21:02:57.541691 IP 112.26.2.8.36911 > 112.26.2.1.44903: Flags [.], ack 32845, win 13825, options [nop,nop,TS val 44990 ecr 267601,nop,nop,sack 2 {42841:47125}{34273:41413},mptcp dss ack 408058679], length 0
21:02:57.557686 IP 112.26.2.1.44903 > 112.26.2.8.36911: Flags [.], seq 55693:57121, ack 1, win 4017, options [nop,nop,TS val 269250 ecr 44990,mptcp dss ack 2872732397 seq 408232895 subseq 55693 len 1428 csum 0x4c1d], length 1428
21:02:57.646893 IP 112.26.2.1.44903 > 112.26.2.8.36911: Flags [.], seq 41413:42841, ack 1, win 4017, options [nop,nop,TS val 268459 ecr 44291,mptcp dss ack 2872732397 seq 408132935 subseq 41413 len 1428 csum 0xad1b], length 1428
21:02:57.649825 IP 112.26.2.8.36911 > 112.26.2.1.44903: Flags [.], ack 48553, win 14692, options [nop,nop,TS val 45963 ecr 268459,mptcp dss ack 408058679], length 0
21:02:57.718290 IP 112.26.2.1.44903 > 112.26.2.8.36911: Flags [.], seq 48553:49981, ack 1, win 4017, options [nop,nop,TS val 268459 ecr 44291,mptcp dss ack 2872732397 seq 408194339 subseq 48553 len 1428 csum 0x11f1], length 1428
21:02:57.728354 IP 112.26.2.8.36911 > 112.26.2.1.44903: Flags [.], ack 49981, win 14829, options [nop,nop,TS val 46034 ecr 268459,mptcp dss ack 408058679], length 0
21:02:57.806481 IP 112.26.2.1.44903 > 112.26.2.8.36911: Flags [.], seq 49981:51409, ack 1, win 4017, options [nop,nop,TS val 268637 ecr 44416,mptcp dss ack 2872732397 seq 408198623 subseq 49981 len 1428 csum 0x8fde], length 1428
21:02:57.808324 IP 112.26.2.8.36911 > 112.26.2.1.44903: Flags [.], ack 51409, win 15011, options [nop,nop,TS val 46122 ecr 268637,mptcp dss ack 408058679], length 0
21:02:57.861759 IP 112.26.2.8.36911 > 112.26.2.1.44903: Flags [.], ack 41413, win 14144, options [nop,nop,TS val 45440 ecr 267939,nop,nop,sack 1 {42841:47125},mptcp dss ack 408058679], length 0
21:02:57.864173 IP 112.26.2.8.36911 > 112.26.2.1.44903: Flags [.], ack 41413, win 14144, options [nop,nop,TS val 45440 ecr 267939,nop,nop,sack 1 {42841:47125},mptcp dss ack 408058679], length 0
21:02:57.884507 IP 112.26.2.1.44903 > 112.26.2.8.36911: Flags [.], seq 57121:58549, ack 1, win 4017, options [nop,nop,TS val 269572 ecr 45440,mptcp dss ack 2872732397 seq 408240035 subseq 57121 len 1428 csum 0xd860], length 1428
21:02:57.948883 IP 112.26.2.1.44903 > 112.26.2.8.36911: Flags [.], seq 51409:52837, ack 1, win 4017, options [nop,nop,TS val 268802 ecr 44486,mptcp dss ack 2872732397 seq 408204335 subseq 51409 len 1428 csum 0x8ad4], length 1428
21:02:57.951148 IP 112.26.2.8.36911 > 112.26.2.1.44903: Flags [.], ack 52837, win 15194, options [nop,nop,TS val 46265 ecr 268802,mptcp dss ack 408058679], length 0
21:02:58.023844 IP 112.26.2.1.44903 > 112.26.2.8.36911: Flags [.], seq 52837:54265, ack 1, win 4017, options [nop,nop,TS val 268946 ecr 44651,mptcp dss ack 2872732397 seq 408210047 subseq 52837 len 1428 csum 0x60a4], length 1428
21:02:58.042508 IP 112.26.2.8.36911 > 112.26.2.1.44903: Flags [.], ack 54265, win 15422, options [nop,nop,TS val 46340 ecr 268946,mptcp dss ack 408175775], length 0
21:02:58.154761 IP 112.26.2.8.36911 > 112.26.2.1.44903: Flags [.], ack 41413, win 14372, options [nop,nop,TS val 45701 ecr 267939,nop,nop,sack 1 {42841:48553},mptcp dss ack 408058679], length 0
21:02:58.157374 IP 112.26.2.8.36911 > 112.26.2.1.44903: Flags [.], ack 41413, win 14372, options [nop,nop,TS val 45701 ecr 267939,nop,nop,sack 1 {42841:48553},mptcp dss ack 408058679], length 0
21:02:58.219165 IP 112.26.2.1.44903 > 112.26.2.8.36911: Flags [.], seq 54265:55693, ack 1, win 4017, options [nop,nop,TS val 269091 ecr 44730,mptcp dss ack 2872732397 seq 408227183 subseq 54265 len 1428 csum 0xacf8], length 1428
