11:44:47.114221 IP 112.26.0.8.46222 > 112.26.0.1.38151: Flags [S], seq 1720921841, win 65535, options [mss 1460,sackOK,TS val 2985819 ecr 0,nop,wscale 6,mptcp capable csum {0xafc16660309eba07}], length 0
11:44:47.114615 IP 112.26.0.8.46222 > 112.26.0.1.38151: Flags [S], seq 1720921841, win 65535, options [mss 1460,sackOK,TS val 2985819 ecr 0,nop,wscale 6,mptcp capable csum {0xafc16660309eba07}], length 0
11:44:47.118251 IP 112.26.0.1.38151 > 112.26.0.8.46222: Flags [S.], seq 1145020541, ack 1720921842, win 28560, options [mss 1460,sackOK,TS val 3214979 ecr 2985819,nop,wscale 7,mptcp capable csum {0x9300c12f56515bbe}], length 0
11:44:47.133450 IP 112.26.0.1.38151 > 112.26.0.8.46222: Flags [S.], seq 1145020541, ack 1720921842, win 28560, options [mss 1460,sackOK,TS val 3214979 ecr 2985819,nop,wscale 7,mptcp capable csum {0x9300c12f56515bbe}], length 0
11:44:47.135256 IP 112.26.0.1.38151 > 112.26.0.8.46222: Flags [S.], seq 1145020541, ack 1720921842, win 28560, options [mss 1460,sackOK,TS val 3214979 ecr 2985819,nop,wscale 7,mptcp capable csum {0x9300c12f56515bbe}], length 0
11:44:47.157374 IP 112.26.0.8.46222 > 112.26.0.1.38151: Flags [.], ack 1, win 1369, options [nop,nop,TS val 2985913 ecr 3214979,mptcp capable csum {0xafc16660309eba07,0x9300c12f56515bbe},mptcp dss ack 1134334589], length 0
11:44:47.160975 IP 112.26.0.8.46222 > 112.26.0.1.38151: Flags [.], ack 1, win 1369, options [nop,nop,TS val 2985913 ecr 3214979,mptcp capable csum {0xafc16660309eba07,0x9300c12f56515bbe},mptcp dss ack 1134334589], length 0
11:44:47.164119 IP 112.26.0.1.38151 > 112.26.0.8.46222: Flags [.], ack 1, win 224, options [nop,nop,TS val 3215024 ecr 2985913,mptcp add-addr id 3 112.26.1.1,mptcp dss ack 2168003474], length 0
11:44:47.223200 IP 112.26.0.8.46222 > 112.26.0.1.38151: Flags [.], ack 1, win 1369, options [nop,nop,TS val 2985913 ecr 3214979,mptcp add-addr id 3 112.26.1.8,mptcp dss ack 1134334589], length 0
11:44:47.229817 IP 112.26.0.1.38151 > 112.26.0.8.46222: Flags [.], ack 1, win 224, options [nop,nop,TS val 3215024 ecr 2985913,mptcp add-addr id 5 112.26.3.1,mptcp dss ack 2168003474], length 0
11:44:47.239716 IP 112.26.0.1.38151 > 112.26.0.8.46222: Flags [.], ack 1, win 224, options [nop,nop,TS val 3215024 ecr 2985913,mptcp add-addr id 3 112.26.1.1,mptcp dss ack 2168003474], length 0
11:44:47.249256 IP 112.26.0.1.38151 > 112.26.0.8.46222: Flags [.], ack 1, win 224, options [nop,nop,TS val 3215024 ecr 2985913,mptcp add-addr id 6 112.26.2.1,mptcp dss ack 2168003474], length 0
11:44:47.256541 IP 112.26.0.8.46222 > 112.26.0.1.38151: Flags [.], ack 1, win 1369, options [nop,nop,TS val 2985913 ecr 3214979,mptcp add-addr id 3 112.26.1.8,mptcp dss ack 1134334589], length 0
11:44:47.314760 IP 112.26.0.8.46222 > 112.26.0.1.38151: Flags [.], ack 1, win 1369, options [nop,nop,TS val 2985913 ecr 3214979,mptcp add-addr id 5 112.26.3.8,mptcp dss ack 1134334589], length 0
11:44:47.326490 IP 112.26.0.1.38151 > 112.26.0.8.46222: Flags [.], seq 1:1429, ack 1, win 224, options [nop,nop,TS val 3215030 ecr 2985913,mptcp dss ack 2168003474 seq 1134334589 subseq 1 len 1428 csum 0xe807], length 1428
11:44:47.330138 IP 112.26.0.1.38151 > 112.26.0.8.46222: Flags [.], ack 1, win 224, options [nop,nop,TS val 3215024 ecr 2985913,mptcp add-addr id 5 112.26.3.1,mptcp dss ack 2168003474], length 0
11:44:47.338370 IP 112.26.0.8.46222 > 112.26.0.1.38151: Flags [.], ack 1, win 1369, options [nop,nop,TS val 2985913 ecr 3214979,mptcp add-addr id 6 112.26.2.8,mptcp dss ack 1134334589], length 0
11:44:47.350443 IP 112.26.0.1.38151 > 112.26.0.8.46222: Flags [.], seq 1429:2857, ack 1, win 224, options [nop,nop,TS val 3215030 ecr 2985913,mptcp dss ack 2168003474 seq 1134336017 subseq 1429 len 1428 csum 0x756], length 1428
11:44:47.414400 IP 112.26.0.1.38151 > 112.26.0.8.46222: Flags [.], ack 1, win 224, options [nop,nop,TS val 3215024 ecr 2985913,mptcp add-addr id 3 112.26.1.1,mptcp dss ack 2168003474], length 0
11:44:47.421874 IP 112.26.0.1.38151 > 112.26.0.8.46222: Flags [.], ack 1, win 224, options [nop,nop,TS val 3215024 ecr 2985913,mptcp add-addr id 6 112.26.2.1,mptcp dss ack 2168003474], length 0
11:44:47.431113 IP 112.26.0.1.38151 > 112.26.0.8.46222: Flags [P.], seq 2857:4097, ack 1, win 224, options [nop,nop,TS val 3215030 ecr 2985913,mptcp dss ack 2168003474 seq 1134337445 subseq 2857 len 1240 csum 0x4828], length 1240
11:44:47.440889 IP 112.26.0.8.46222 > 112.26.0.1.38151: Flags [.], ack 1, win 1369, options [nop,nop,TS val 2985913 ecr 3214979,mptcp add-addr id 5 112.26.3.8,mptcp dss ack 1134334589], length 0
11:44:47.446682 IP 112.26.0.1.38151 > 112.26.0.8.46222: Flags [.], ack 1, win 224, options [nop,nop,TS val 3215024 ecr 2985913,mptcp add-addr id 5 112.26.3.1,mptcp dss ack 2168003474], length 0
11:44:47.457377 IP 112.26.0.1.38151 > 112.26.0.8.46222: Flags [.], seq 1:1429, ack 1, win 224, options [nop,nop,TS val 3215030 ecr 2985913,mptcp dss ack 2168003474 seq 1134334589 subseq 1 len 1428 csum 0xe807], length 1428
11:44:47.458448 IP 112.26.0.1.38151 > 112.26.0.8.46222: Flags [.], seq 4097:5525, ack 1, win 224, options [nop,nop,TS val 3215030 ecr 2985913,mptcp dss ack 2168003474 seq 1134338685 subseq 4097 len 1428 csum 0x3c61], length 1428
11:44:47.523158 IP 112.26.0.1.38151 > 112.26.0.8.46222: Flags [.], seq 5525:6953, ack 1, win 224, options [nop,nop,TS val 3215030 ecr 2985913,mptcp dss ack 2168003474 seq 1134340113 subseq 5525 len 1428 csum 0x98d6], length 1428
11:44:47.528190 IP 112.26.0.1.38151 > 112.26.0.8.46222: Flags [.], ack 1, win 224, options [nop,nop,TS val 3215024 ecr 2985913,mptcp add-addr id 6 112.26.2.1,mptcp dss ack 2168003474], length 0
11:44:47.534159 IP 112.26.0.8.46222 > 112.26.0.1.38151: Flags [.], ack 1, win 1369, options [nop,nop,TS val 2985913 ecr 3214979,mptcp add-addr id 6 112.26.2.8,mptcp dss ack 1134334589], length 0
11:44:47.547275 IP 112.26.0.1.38151 > 112.26.0.8.46222: Flags [.], seq 1429:2857, ack 1, win 224, options [nop,nop,TS val 3215030 ecr 2985913,mptcp dss ack 2168003474 seq 1134336017 subseq 1429 len 1428 csum 0x756], length 1428
11:44:47.551185 IP 112.26.0.1.38151 > 112.26.0.8.46222: Flags [.], seq 6953:8381, ack 1, win 224, options [nop,nop,TS val 3215030 ecr 2985913,mptcp dss ack 2168003474 seq 1134341541 subseq 6953 len 1428 csum 0x32a3], length 1428
11:44:47.623281 IP 112.26.0.1.38151 > 112.26.0.8.46222: Flags [.], seq 1:1429, ack 1, win 224, options [nop,nop,TS val 3215030 ecr 2985913,mptcp dss ack 2168003474 seq 1134334589 subseq 1 len 1428 csum 0xe807], length 1428
11:44:47.636102 IP 112.26.0.1.38151 > 112.26.0.8.46222: Flags [.], seq 8381:9809, ack 1, win 224, options [nop,nop,TS val 3215031 ecr 2985913,mptcp dss ack 2168003474 seq 1134342969 subseq 8381 len 1428 csum 0x235], length 1428
11:44:47.649825 IP 112.26.0.1.38151 > 112.26.0.8.46222: Flags [.], seq 12665:14093, ack 1, win 224, options [nop,nop,TS val 3215216 ecr 2985913,mptcp dss ack 2168003474 seq 1134347253 subseq 12665 len 1428 csum 0x6c24], length 1428
11:44:47.650859 IP 112.26.0.1.38151 > 112.26.0.8.46222: Flags [.], seq 1429:2857, ack 1, win 224, options [nop,nop,TS val 3215030 ecr 2985913,mptcp dss ack 2168003474 seq 1134336017 subseq 1429 len 1428 csum 0x756], length 1428
11:44:47.716123 IP 112.26.0.1.38151 > 112.26.0.8.46222: Flags [P.], seq 2857:4097, ack 1, win 224, options [nop,nop,TS val 3215030 ecr 2985913,mptcp dss ack 2168003474 seq 1134337445 subseq 2857 len 1240 csum 0x4828], length 1240
11:44:47.733641 IP 112.26.0.1.38151 > 112.26.0.8.46222: Flags [.], seq 4097:5525, ack 1, win 224, options [nop,nop,TS val 3215030 ecr 2985913,mptcp dss ack 2168003474 seq 1134338685 subseq 4097 len 1428 csum 0x3c61], length 1428
11:44:47.741186 IP 112.26.0.1.38151 > 112.26.0.8.46222: Flags [.], seq 5525:6953, ack 1, win 224, options [nop,nop,TS val 3215030 ecr 2985913,mptcp dss ack 2168003474 seq 1134340113 subseq 5525 len 1428 csum 0x98d6], length 1428
11:44:47.823883 IP 112.26.0.1.38151 > 112.26.0.8.46222: Flags [.], seq 1:1429, ack 1, win 224, options [nop,nop,TS val 3215664 ecr 2985913,mptcp dss ack 2168003474 seq 1134334589 subseq 1 len 1428 csum 0xe807], length 1428
11:44:47.833447 IP 112.26.0.8.46222 > 112.26.0.1.38151: Flags [.], ack 1429, win 1415, options [nop,nop,TS val 2986401 ecr 3215030,mptcp dss ack 1134336017], length 0
11:44:47.841712 IP 112.26.0.8.46222 > 112.26.0.1.38151: Flags [.], ack 2857, win 1460, options [nop,nop,TS val 2986423 ecr 3215030,mptcp dss ack 1134337445], length 0
11:44:47.846730 IP 112.26.0.1.38151 > 112.26.0.8.46222: Flags [.], seq 6953:8381, ack 1, win 224, options [nop,nop,TS val 3215030 ecr 2985913,mptcp dss ack 2168003474 seq 1134341541 subseq 6953 len 1428 csum 0x32a3], length 1428
11:44:47.914845 IP 112.26.0.1.38151 > 112.26.0.8.46222: Flags [P.], seq 2857:4097, ack 1, win 224, options [nop,nop,TS val 3215030 ecr 2985913,mptcp dss ack 2168003474 seq 1134337445 subseq 2857 len 1240 csum 0x4828], length 1240
11:44:47.934499 IP 112.26.0.1.38151 > 112.26.0.8.46222: Flags [.], seq 8381:9809, ack 1, win 224, options [nop,nop,TS val 3215031 ecr 2985913,mptcp dss ack 2168003474 seq 1134342969 subseq 8381 len 1428 csum 0x235], length 1428
11:44:47.950659 IP 112.26.0.1.38151 > 112.26.0.8.46222: Flags [.], seq 12665:14093, ack 1, win 224, options [nop,nop,TS val 3215216 ecr 2985913,mptcp dss ack 2168003474 seq 1134347253 subseq 12665 len 1428 csum 0x6c24], length 1428
11:44:47.958277 IP 112.26.0.1.38151 > 112.26.0.8.46222: Flags [.], seq 4097:5525, ack 1, win 224, options [nop,nop,TS val 3215030 ecr 2985913,mptcp dss ack 2168003474 seq 1134338685 subseq 4097 len 1428 csum 0x3c61], length 1428
11:44:48.039095 IP 112.26.0.1.38151 > 112.26.0.8.46222: Flags [.], seq 5525:6953, ack 1, win 224, options [nop,nop,TS val 3215030 ecr 2985913,mptcp dss ack 2168003474 seq 1134340113 subseq 5525 len 1428 csum 0x98d6], length 1428
11:44:48.044033 IP 112.26.0.1.38151 > 112.26.0.8.46222: Flags [.], seq 1:1429, ack 1, win 224, options [nop,nop,TS val 3215664 ecr 2985913,mptcp dss ack 2168003474 seq 1134334589 subseq 1 len 1428 csum 0xe807], length 1428
11:44:48.128680 IP 112.26.0.8.46222 > 112.26.0.1.38151: Flags [.], ack 1429, win 1415, options [nop,nop,TS val 2986401 ecr 3215030,mptcp dss ack 1134336017], length 0
11:44:48.133779 IP 112.26.0.1.38151 > 112.26.0.8.46222: Flags [.], seq 14093:15521, ack 1, win 224, options [nop,nop,TS val 3215992 ecr 2986401,mptcp dss ack 2168003474 seq 1134336017 subseq 14093 len 1428 csum 0xd5dd], length 1428
11:44:48.153023 IP 112.26.0.8.46222 > 112.26.0.1.38151: Flags [.], ack 2857, win 1460, options [nop,nop,TS val 2986423 ecr 3215030,mptcp dss ack 1134337445], length 0
11:44:48.155917 IP 112.26.0.1.38151 > 112.26.0.8.46222: Flags [P.], seq 15521:16761, ack 1, win 224, options [nop,nop,TS val 3216016 ecr 2986423,mptcp dss ack 2168003474 seq 1134337445 subseq 15521 len 1240 csum 0x16b0], length 1240
11:44:48.217582 IP 112.26.0.1.38151 > 112.26.0.8.46222: Flags [.], seq 6953:8381, ack 1, win 224, options [nop,nop,TS val 3215030 ecr 2985913,mptcp dss ack 2168003474 seq 1134341541 subseq 6953 len 1428 csum 0x32a3], length 1428
11:44:48.241455 IP 112.26.0.1.38151 > 112.26.0.8.46222: Flags [.], seq 14093:15521, ack 1, win 224, options [nop,nop,TS val 3215992 ecr 2986401,mptcp dss ack 2168003474 seq 1134336017 subseq 14093 len 1428 csum 0xd5dd], length 1428
11:44:48.335801 IP 112.26.0.1.38151 > 112.26.0.8.46222: Flags [P.], seq 15521:16761, ack 1, win 224, options [nop,nop,TS val 3216016 ecr 2986423,mptcp dss ack 2168003474 seq 1134337445 subseq 15521 len 1240 csum 0x16b0], length 1240
11:44:48.344936 IP 112.26.0.1.38151 > 112.26.0.8.46222: Flags [.], seq 8381:9809, ack 1, win 224, options [nop,nop,TS val 3215031 ecr 2985913,mptcp dss ack 2168003474 seq 1134342969 subseq 8381 len 1428 csum 0x235], length 1428
11:44:48.435412 IP 112.26.0.8.46222 > 112.26.0.1.38151: Flags [.], ack 4097, win 1506, options [nop,nop,TS val 2986692 ecr 3215030,mptcp dss ack 1134338685], length 0
11:44:48.439215 IP 112.26.0.8.46222 > 112.26.0.1.38151: Flags [.], ack 4097, win 1506, options [nop,nop,TS val 2986692 ecr 3215030,mptcp dss ack 1134338685], length 0
11:44:48.442217 IP 112.26.0.1.38151 > 112.26.0.8.46222: Flags [.], seq 16761:18189, ack 1, win 224, options [nop,nop,TS val 3216302 ecr 2986692,mptcp dss ack 2168003474 seq 1134338685 subseq 16761 len 1428 csum 0xae9], length 1428
11:44:48.448801 IP 112.26.0.1.38151 > 112.26.0.8.46222: Flags [.], seq 12665:14093, ack 1, win 224, options [nop,nop,TS val 3215216 ecr 2985913,mptcp dss ack 2168003474 seq 1134347253 subseq 12665 len 1428 csum 0x6c24], length 1428
11:44:48.525138 IP 112.26.0.1.38151 > 112.26.0.8.46222: Flags [.], seq 1:1429, ack 1, win 224, options [nop,nop,TS val 3215664 ecr 2985913,mptcp dss ack 2168003474 seq 1134334589 subseq 1 len 1428 csum 0xe807], length 1428
11:44:48.534561 IP 112.26.0.1.38151 > 112.26.0.8.46222: Flags [.], seq 16761:18189, ack 1, win 224, options [nop,nop,TS val 3216302 ecr 2986692,mptcp dss ack 2168003474 seq 1134338685 subseq 16761 len 1428 csum 0xae9], length 1428
11:44:48.544661 IP 112.26.0.8.46222 > 112.26.0.1.38151: Flags [.], ack 6953, win 1597, options [nop,nop,TS val 2986816 ecr 3215030,mptcp dss ack 1134341541], length 0
11:44:48.549520 IP 112.26.0.1.38151 > 112.26.0.8.46222: Flags [.], seq 18189:19617, ack 1, win 224, options [nop,nop,TS val 3216409 ecr 2986816,mptcp dss ack 2168003474 seq 1134341541 subseq 18189 len 1428 csum 0x6bf], length 1428
11:44:48.552622 IP 112.26.0.8.46222 > 112.26.0.1.38151: Flags [.], ack 6953, win 1597, options [nop,nop,TS val 2986816 ecr 3215030,mptcp dss ack 1134341541], length 0
11:44:48.630580 IP 112.26.0.8.46222 > 112.26.0.1.38151: Flags [.], ack 8381, win 1643, options [nop,nop,TS val 2986936 ecr 3215030,mptcp dss ack 1134342969], length 0
11:44:48.634964 IP 112.26.0.1.38151 > 112.26.0.8.46222: Flags [.], seq 19617:21045, ack 1, win 224, options [nop,nop,TS val 3216409 ecr 2986816,mptcp dss ack 2168003474 seq 1134342969 subseq 19617 len 1428 csum 0xd650], length 1428
11:44:48.646201 IP 112.26.0.1.38151 > 112.26.0.8.46222: Flags [.], seq 14093:15521, ack 1, win 224, options [nop,nop,TS val 3215992 ecr 2986401,mptcp dss ack 2168003474 seq 1134336017 subseq 14093 len 1428 csum 0xd5dd], length 1428
11:44:48.723178 IP 112.26.0.1.38151 > 112.26.0.8.46222: Flags [.], seq 18189:19617, ack 1, win 224, options [nop,nop,TS val 3216409 ecr 2986816,mptcp dss ack 2168003474 seq 1134341541 subseq 18189 len 1428 csum 0x6bf], length 1428
11:44:48.739628 IP 112.26.0.8.46222 > 112.26.0.1.38151: Flags [.], ack 8381, win 1643, options [nop,nop,TS val 2986936 ecr 3215030,mptcp dss ack 1134342969], length 0
11:44:48.741783 IP 112.26.0.1.38151 > 112.26.0.8.46222: Flags [.], seq 21045:22473, ack 1, win 224, options [nop,nop,TS val 3216602 ecr 2986936,mptcp dss ack 2168003474 seq 1134344397 subseq 21045 len 1428 csum 0xcebc], length 1428
11:44:48.748206 IP 112.26.0.1.38151 > 112.26.0.8.46222: Flags [P.], seq 15521:16761, ack 1, win 224, options [nop,nop,TS val 3216016 ecr 2986423,mptcp dss ack 2168003474 seq 1134337445 subseq 15521 len 1240 csum 0x16b0], length 1240
11:44:48.823397 IP 112.26.0.1.38151 > 112.26.0.8.46222: Flags [.], seq 19617:21045, ack 1, win 224, options [nop,nop,TS val 3216409 ecr 2986816,mptcp dss ack 2168003474 seq 1134342969 subseq 19617 len 1428 csum 0xd650], length 1428
11:44:48.833317 IP 112.26.0.1.38151 > 112.26.0.8.46222: Flags [.], seq 21045:22473, ack 1, win 224, options [nop,nop,TS val 3216602 ecr 2986936,mptcp dss ack 2168003474 seq 1134344397 subseq 21045 len 1428 csum 0xcebc], length 1428
11:44:48.844588 IP 112.26.0.8.46222 > 112.26.0.1.38151: Flags [.], ack 9809, win 1734, options [nop,nop,TS val 2987226 ecr 3215031,nop,nop,sack 1 {12665:14093},mptcp dss ack 1134344397], length 0
11:44:48.847422 IP 112.26.0.8.46222 > 112.26.0.1.38151: Flags [.], ack 9809, win 1734, options [nop,nop,TS val 2987226 ecr 3215031,nop,nop,sack 1 {12665:14093},mptcp dss ack 1134344397], length 0
11:44:48.853415 IP 112.26.0.1.38151 > 112.26.0.8.46222: Flags [.], seq 22473:23901, ack 1, win 224, options [nop,nop,TS val 3216709 ecr 2987226,mptcp dss ack 2168003474 seq 1134345825 subseq 22473 len 1428 csum 0xfe42], length 1428
11:44:48.858544 IP 112.26.0.8.46222 > 112.26.0.1.38151: Flags [.], ack 9809, win 1734, options [nop,nop,TS val 2987303 ecr 3215031,nop,nop,sack 2 {1:1429}{12665:14093},mptcp dss ack 1134344397], length 0
11:44:48.862162 IP 112.26.0.1.38151 > 112.26.0.8.46222: Flags [.], seq 22473:23901, ack 1, win 224, options [nop,nop,TS val 3216709 ecr 2987226,mptcp dss ack 2168003474 seq 1134345825 subseq 22473 len 1428 csum 0xfe42], length 1428
11:44:48.926385 IP 112.26.0.1.38151 > 112.26.0.8.46222: Flags [.], seq 16761:18189, ack 1, win 224, options [nop,nop,TS val 3216302 ecr 2986692,mptcp dss ack 2168003474 seq 1134338685 subseq 16761 len 1428 csum 0xae9], length 1428
11:44:48.933857 IP 112.26.0.1.38151 > 112.26.0.8.46222: Flags [.], seq 23901:25329, ack 1, win 224, options [nop,nop,TS val 3216709 ecr 2987226,mptcp dss ack 2168003474 seq 1134347253 subseq 23901 len 1428 csum 0x4040], length 1428
11:44:48.943146 IP 112.26.0.8.46222 > 112.26.0.1.38151: Flags [.], ack 9809, win 1734, options [nop,nop,TS val 2987303 ecr 3215031,nop,nop,sack 2 {1:1429}{12665:14093},mptcp dss ack 1134344397], length 0
11:44:48.948668 IP 112.26.0.8.46222 > 112.26.0.1.38151: Flags [.], ack 9809, win 1780, options [nop,nop,TS val 2987424 ecr 3215031,nop,nop,sack 1 {12665:15521},mptcp dss ack 1134344397], length 0
11:44:48.956213 IP 112.26.0.1.38151 > 112.26.0.8.46222: Flags [.], seq 18189:19617, ack 1, win 224, options [nop,nop,TS val 3216409 ecr 2986816,mptcp dss ack 2168003474 seq 1134341541 subseq 18189 len 1428 csum 0x6bf], length 1428
11:44:49.025989 IP 112.26.0.1.38151 > 112.26.0.8.46222: Flags [.], seq 23901:25329, ack 1, win 224, options [nop,nop,TS val 3216709 ecr 2987226,mptcp dss ack 2168003474 seq 1134347253 subseq 23901 len 1428 csum 0x4040], length 1428
11:44:49.040006 IP 112.26.0.8.46222 > 112.26.0.1.38151: Flags [.], ack 9809, win 1825, options [nop,nop,TS val 2987526 ecr 3215031,nop,nop,sack 1 {12665:16761},mptcp dss ack 1134344397], length 0
11:44:49.042950 IP 112.26.0.8.46222 > 112.26.0.1.38151: Flags [.], ack 9809, win 1780, options [nop,nop,TS val 2987424 ecr 3215031,nop,nop,sack 1 {12665:15521},mptcp dss ack 1134344397], length 0
11:44:49.048724 IP 112.26.0.1.38151 > 112.26.0.8.46222: Flags [.], seq 9809:11237, ack 1, win 224, options [nop,nop,TS val 3216905 ecr 2987424,mptcp dss ack 2168003474 seq 1134344397 subseq 9809 len 1428 csum 0xfaa0], length 1428
11:44:49.054378 IP 112.26.0.1.38151 > 112.26.0.8.46222: Flags [.], seq 19617:21045, ack 1, win 224, options [nop,nop,TS val 3216409 ecr 2986816,mptcp dss ack 2168003474 seq 1134342969 subseq 19617 len 1428 csum 0xd650], length 1428
11:44:49.121323 IP 112.26.0.1.38151 > 112.26.0.8.46222: Flags [.], seq 21045:22473, ack 1, win 224, options [nop,nop,TS val 3216602 ecr 2986936,mptcp dss ack 2168003474 seq 1134344397 subseq 21045 len 1428 csum 0xcebc], length 1428
11:44:49.127071 IP 112.26.0.8.46222 > 112.26.0.1.38151: Flags [.], ack 9809, win 1825, options [nop,nop,TS val 2987526 ecr 3215031,nop,nop,sack 1 {12665:16761},mptcp dss ack 1134344397], length 0
11:44:49.141146 IP 112.26.0.1.38151 > 112.26.0.8.46222: Flags [.], seq 22473:23901, ack 1, win 224, options [nop,nop,TS val 3216709 ecr 2987226,mptcp dss ack 2168003474 seq 1134345825 subseq 22473 len 1428 csum 0xfe42], length 1428
11:44:49.146179 IP 112.26.0.1.38151 > 112.26.0.8.46222: Flags [.], seq 9809:11237, ack 1, win 224, options [nop,nop,TS val 3216905 ecr 2987424,mptcp dss ack 2168003474 seq 1134344397 subseq 9809 len 1428 csum 0xfaa0], length 1428
11:44:49.228013 IP 112.26.0.8.46222 > 112.26.0.1.38151: Flags [.], ack 9809, win 1871, options [nop,nop,TS val 2987704 ecr 3215031,nop,nop,sack 1 {12665:18189},mptcp dss ack 1134344397], length 0
11:44:49.231676 IP 112.26.0.8.46222 > 112.26.0.1.38151: Flags [.], ack 9809, win 1871, options [nop,nop,TS val 2987704 ecr 3215031,nop,nop,sack 1 {12665:18189},mptcp dss ack 1134344397], length 0
11:44:49.234280 IP 112.26.0.1.38151 > 112.26.0.8.46222: Flags [.], seq 11237:12665, ack 1, win 224, options [nop,nop,TS val 3217093 ecr 2987704,mptcp dss ack 2168003474 seq 1134345825 subseq 11237 len 1428 csum 0x2a27], length 1428
11:44:49.250500 IP 112.26.0.1.38151 > 112.26.0.8.46222: Flags [.], seq 11237:12665, ack 1, win 224, options [nop,nop,TS val 3217093 ecr 2987704,mptcp dss ack 2168003474 seq 1134345825 subseq 11237 len 1428 csum 0x2a27], length 1428
11:44:49.263280 IP 112.26.0.8.46222 > 112.26.0.1.38151: Flags [.], ack 9809, win 1917, options [nop,nop,TS val 2987733 ecr 3215031,nop,nop,sack 1 {12665:19617},mptcp dss ack 1134344397], length 0
11:44:49.325765 IP 112.26.0.8.46222 > 112.26.0.1.38151: Flags [.], ack 9809, win 1917, options [nop,nop,TS val 2987733 ecr 3215031,nop,nop,sack 1 {12665:19617},mptcp dss ack 1134344397], length 0
11:44:49.344447 IP 112.26.0.1.38151 > 112.26.0.8.46222: Flags [.], seq 23901:25329, ack 1, win 224, options [nop,nop,TS val 3216709 ecr 2987226,mptcp dss ack 2168003474 seq 1134347253 subseq 23901 len 1428 csum 0x4040], length 1428
11:44:49.366268 IP 112.26.0.8.46222 > 112.26.0.1.38151: Flags [.], ack 9809, win 1962, options [nop,nop,TS val 2987830 ecr 3215031,nop,nop,sack 1 {12665:21045},mptcp dss ack 1134344397], length 0
11:44:49.368760 IP 112.26.0.8.46222 > 112.26.0.1.38151: Flags [.], ack 9809, win 1962, options [nop,nop,TS val 2987830 ecr 3215031,nop,nop,sack 1 {12665:21045},mptcp dss ack 1134344397], length 0
11:44:49.372650 IP 112.26.0.1.38151 > 112.26.0.8.46222: Flags [.], seq 25329:26757, ack 1, win 224, options [nop,nop,TS val 3217232 ecr 2987733,mptcp dss ack 2168003474 seq 1134348681 subseq 25329 len 1428 csum 0x92d9], length 1428
11:44:49.438918 IP 112.26.0.8.46222 > 112.26.0.1.38151: Flags [.], ack 9809, win 2008, options [nop,nop,TS val 2987899 ecr 3215031,nop,nop,sack 1 {12665:22473},mptcp dss ack 1134344397], length 0
11:44:49.444633 IP 112.26.0.1.38151 > 112.26.0.8.46222: Flags [.], seq 25329:26757, ack 1, win 224, options [nop,nop,TS val 3217232 ecr 2987733,mptcp dss ack 2168003474 seq 1134348681 subseq 25329 len 1428 csum 0x92d9], length 1428
11:44:49.450928 IP 112.26.0.1.38151 > 112.26.0.8.46222: Flags [.], seq 9809:11237, ack 1, win 224, options [nop,nop,TS val 3216905 ecr 2987424,mptcp dss ack 2168003474 seq 1134344397 subseq 9809 len 1428 csum 0xfaa0], length 1428
11:44:49.530637 IP 112.26.0.8.46222 > 112.26.0.1.38151: Flags [.], ack 9809, win 2008, options [nop,nop,TS val 2987899 ecr 3215031,nop,nop,sack 1 {12665:22473},mptcp dss ack 1134344397], length 0
11:44:49.533466 IP 112.26.0.1.38151 > 112.26.0.8.46222: Flags [.], seq 26757:28185, ack 1, win 224, options [nop,nop,TS val 3217394 ecr 2987830,mptcp dss ack 2168003474 seq 1134350109 subseq 26757 len 1428 csum 0xfe34], length 1428
11:44:49.538988 IP 112.26.0.8.46222 > 112.26.0.1.38151: Flags [.], ack 9809, win 2054, options [nop,nop,TS val 2987918 ecr 3215031,nop,nop,sack 1 {12665:23901},mptcp dss ack 1134344397], length 0
11:44:49.547576 IP 112.26.0.1.38151 > 112.26.0.8.46222: Flags [.], seq 26757:28185, ack 1, win 224, options [nop,nop,TS val 3217394 ecr 2987830,mptcp dss ack 2168003474 seq 1134350109 subseq 26757 len 1428 csum 0xfe34], length 1428
11:44:49.553664 IP 112.26.0.1.38151 > 112.26.0.8.46222: Flags [.], seq 11237:12665, ack 1, win 224, options [nop,nop,TS val 3217093 ecr 2987704,mptcp dss ack 2168003474 seq 1134345825 subseq 11237 len 1428 csum 0x2a27], length 1428
11:44:49.630207 IP 112.26.0.8.46222 > 112.26.0.1.38151: Flags [.], ack 9809, win 2054, options [nop,nop,TS val 2987918 ecr 3215031,nop,nop,sack 1 {12665:23901},mptcp dss ack 1134344397], length 0
11:44:49.635055 IP 112.26.0.1.38151 > 112.26.0.8.46222: Flags [.], seq 28185:29613, ack 1, win 224, options [nop,nop,TS val 3217493 ecr 2987899,mptcp dss ack 2168003474 seq 1134351537 subseq 28185 len 1428 csum 0xe788], length 1428
11:44:49.640792 IP 112.26.0.8.46222 > 112.26.0.1.38151: Flags [.], ack 9809, win 2099, options [nop,nop,TS val 2988121 ecr 3215031,nop,nop,sack 1 {12665:25329},mptcp dss ack 1134344397], length 0
11:44:49.648593 IP 112.26.0.1.38151 > 112.26.0.8.46222: Flags [.], seq 28185:29613, ack 1, win 224, options [nop,nop,TS val 3217493 ecr 2987899,mptcp dss ack 2168003474 seq 1134351537 subseq 28185 len 1428 csum 0xe788], length 1428
11:44:49.654606 IP 112.26.0.1.38151 > 112.26.0.8.46222: Flags [.], seq 25329:26757, ack 1, win 224, options [nop,nop,TS val 3217232 ecr 2987733,mptcp dss ack 2168003474 seq 1134348681 subseq 25329 len 1428 csum 0x92d9], length 1428
11:44:49.728753 IP 112.26.0.8.46222 > 112.26.0.1.38151: Flags [.], ack 9809, win 2099, options [nop,nop,TS val 2988121 ecr 3215031,nop,nop,sack 1 {12665:25329},mptcp dss ack 1134344397], length 0
11:44:49.733751 IP 112.26.0.1.38151 > 112.26.0.8.46222: Flags [.], seq 29613:31041, ack 1, win 224, options [nop,nop,TS val 3217592 ecr 2987918,mptcp dss ack 2168003474 seq 1134352965 subseq 29613 len 1428 csum 0xf0d4], length 1428
11:44:49.739346 IP 112.26.0.8.46222 > 112.26.0.1.38151: Flags [.], ack 11237, win 2145, options [nop,nop,TS val 2988228 ecr 3216905,nop,nop,sack 1 {12665:25329},mptcp dss ack 1134345825], length 0
11:44:49.755851 IP 112.26.0.1.38151 > 112.26.0.8.46222: Flags [.], seq 26757:28185, ack 1, win 224, options [nop,nop,TS val 3217394 ecr 2987830,mptcp dss ack 2168003474 seq 1134350109 subseq 26757 len 1428 csum 0xfe34], length 1428
11:44:49.761676 IP 112.26.0.1.38151 > 112.26.0.8.46222: Flags [.], seq 29613:31041, ack 1, win 224, options [nop,nop,TS val 3217592 ecr 2987918,mptcp dss ack 2168003474 seq 1134352965 subseq 29613 len 1428 csum 0xf0d4], length 1428
11:44:49.832614 IP 112.26.0.8.46222 > 112.26.0.1.38151: Flags [.], ack 25329, win 2190, options [nop,nop,TS val 2988331 ecr 3217093,mptcp dss ack 1134348681], length 0
11:44:49.840363 IP 112.26.0.8.46222 > 112.26.0.1.38151: Flags [.], ack 11237, win 2145, options [nop,nop,TS val 2988228 ecr 3216905,nop,nop,sack 1 {12665:25329},mptcp dss ack 1134345825], length 0
11:44:49.845050 IP 112.26.0.1.38151 > 112.26.0.8.46222: Flags [.], seq 31041:32469, ack 1, win 224, options [nop,nop,TS val 3217703 ecr 2988121,mptcp dss ack 2168003474 seq 1134354393 subseq 31041 len 1428 csum 0xb076], length 1428
11:44:49.851457 IP 112.26.0.1.38151 > 112.26.0.8.46222: Flags [.], seq 28185:29613, ack 1, win 224, options [nop,nop,TS val 3217493 ecr 2987899,mptcp dss ack 2168003474 seq 1134351537 subseq 28185 len 1428 csum 0xe788], length 1428
11:44:49.857417 IP 112.26.0.8.46222 > 112.26.0.1.38151: Flags [.], ack 25329, win 2190, options [nop,nop,TS val 2988331 ecr 3217093,mptcp dss ack 1134348681], length 0
11:44:49.931171 IP 112.26.0.1.38151 > 112.26.0.8.46222: Flags [.], seq 32469:33897, ack 1, win 224, options [nop,nop,TS val 3217703 ecr 2988228,mptcp dss ack 2168003474 seq 1134355821 subseq 32469 len 1428 csum 0xf976], length 1428
11:44:49.944568 IP 112.26.0.8.46222 > 112.26.0.1.38151: Flags [.], ack 26757, win 2236, options [nop,nop,TS val 2988432 ecr 3217232,mptcp dss ack 1134350109], length 0
11:44:49.948721 IP 112.26.0.1.38151 > 112.26.0.8.46222: Flags [.], seq 33897:35325, ack 1, win 224, options [nop,nop,TS val 3217720 ecr 2988331,mptcp dss ack 2168003474 seq 1134357249 subseq 33897 len 1428 csum 0x5611], length 1428
11:44:49.954994 IP 112.26.0.1.38151 > 112.26.0.8.46222: Flags [.], seq 31041:32469, ack 1, win 224, options [nop,nop,TS val 3217703 ecr 2988121,mptcp dss ack 2168003474 seq 1134354393 subseq 31041 len 1428 csum 0xb076], length 1428
11:44:49.957669 IP 112.26.0.8.46222 > 112.26.0.1.38151: Flags [.], ack 28185, win 2282, options [nop,nop,TS val 2988533 ecr 3217394,mptcp dss ack 1134351537], length 0
11:44:50.033642 IP 112.26.0.1.38151 > 112.26.0.8.46222: Flags [.], seq 29613:31041, ack 1, win 224, options [nop,nop,TS val 3217592 ecr 2987918,mptcp dss ack 2168003474 seq 1134352965 subseq 29613 len 1428 csum 0xf0d4], length 1428
11:44:50.041590 IP 112.26.0.1.38151 > 112.26.0.8.46222: Flags [.], seq 32469:33897, ack 1, win 224, options [nop,nop,TS val 3217703 ecr 2988228,mptcp dss ack 2168003474 seq 1134355821 subseq 32469 len 1428 csum 0xf976], length 1428
11:44:50.051050 IP 112.26.0.8.46222 > 112.26.0.1.38151: Flags [.], ack 26757, win 2236, options [nop,nop,TS val 2988432 ecr 3217232,mptcp dss ack 1134350109], length 0
11:44:50.053288 IP 112.26.0.1.38151 > 112.26.0.8.46222: Flags [.], seq 35325:36753, ack 1, win 224, options [nop,nop,TS val 3217914 ecr 2988432,mptcp dss ack 2168003474 seq 1134358677 subseq 35325 len 1428 csum 0xeddf], length 1428
11:44:50.058162 IP 112.26.0.8.46222 > 112.26.0.1.38151: Flags [.], ack 29613, win 2327, options [nop,nop,TS val 2988628 ecr 3217493,mptcp dss ack 1134352965], length 0
11:44:50.133150 IP 112.26.0.1.38151 > 112.26.0.8.46222: Flags [.], seq 36753:38181, ack 1, win 224, options [nop,nop,TS val 3217914 ecr 2988432,mptcp dss ack 2168003474 seq 1134360105 subseq 36753 len 1428 csum 0x7de], length 1428
11:44:50.140804 IP 112.26.0.1.38151 > 112.26.0.8.46222: Flags [.], seq 31041:32469, ack 1, win 224, options [nop,nop,TS val 3217703 ecr 2988121,mptcp dss ack 2168003474 seq 1134354393 subseq 31041 len 1428 csum 0xb076], length 1428
11:44:50.143582 IP 112.26.0.1.38151 > 112.26.0.8.46222: Flags [.], seq 33897:35325, ack 1, win 224, options [nop,nop,TS val 3217720 ecr 2988331,mptcp dss ack 2168003474 seq 1134357249 subseq 33897 len 1428 csum 0x5611], length 1428
11:44:50.151545 IP 112.26.0.8.46222 > 112.26.0.1.38151: Flags [.], ack 31041, win 2373, options [nop,nop,TS val 2988811 ecr 3217592,mptcp dss ack 1134354393], length 0
11:44:50.154331 IP 112.26.0.8.46222 > 112.26.0.1.38151: Flags [.], ack 28185, win 2282, options [nop,nop,TS val 2988533 ecr 3217394,mptcp dss ack 1134351537], length 0
11:44:50.159333 IP 112.26.0.1.38151 > 112.26.0.8.46222: Flags [.], seq 38181:39609, ack 1, win 224, options [nop,nop,TS val 3218017 ecr 2988533,mptcp dss ack 2168003474 seq 1134361533 subseq 38181 len 1428 csum 0x8dda], length 1428
11:44:50.230527 IP 112.26.0.1.38151 > 112.26.0.8.46222: Flags [.], seq 32469:33897, ack 1, win 224, options [nop,nop,TS val 3217703 ecr 2988228,mptcp dss ack 2168003474 seq 1134355821 subseq 32469 len 1428 csum 0xf976], length 1428
11:44:50.242467 IP 112.26.0.8.46222 > 112.26.0.1.38151: Flags [.], ack 32469, win 2419, options [nop,nop,TS val 2988907 ecr 3217703,mptcp dss ack 1134355821], length 0
11:44:50.248664 IP 112.26.0.1.38151 > 112.26.0.8.46222: Flags [.], seq 35325:36753, ack 1, win 224, options [nop,nop,TS val 3217914 ecr 2988432,mptcp dss ack 2168003474 seq 1134358677 subseq 35325 len 1428 csum 0xeddf], length 1428
11:44:50.255617 IP 112.26.0.1.38151 > 112.26.0.8.46222: Flags [.], seq 33897:35325, ack 1, win 224, options [nop,nop,TS val 3217720 ecr 2988331,mptcp dss ack 2168003474 seq 1134357249 subseq 33897 len 1428 csum 0x5611], length 1428
11:44:50.335548 IP 112.26.0.8.46222 > 112.26.0.1.38151: Flags [.], ack 29613, win 2327, options [nop,nop,TS val 2988628 ecr 3217493,mptcp dss ack 1134352965], length 0
11:44:50.339052 IP 112.26.0.8.46222 > 112.26.0.1.38151: Flags [.], ack 33897, win 2464, options [nop,nop,TS val 2989008 ecr 3217703,mptcp dss ack 1134357249], length 0
11:44:50.342396 IP 112.26.0.1.38151 > 112.26.0.8.46222: Flags [.], seq 39609:41037, ack 1, win 224, options [nop,nop,TS val 3218198 ecr 2988628,mptcp dss ack 2168003474 seq 1134362961 subseq 39609 len 1428 csum 0x9a37], length 1428
11:44:50.349991 IP 112.26.0.1.38151 > 112.26.0.8.46222: Flags [.], seq 35325:36753, ack 1, win 224, options [nop,nop,TS val 3217914 ecr 2988432,mptcp dss ack 2168003474 seq 1134358677 subseq 35325 len 1428 csum 0xeddf], length 1428
11:44:50.362595 IP 112.26.0.8.46222 > 112.26.0.1.38151: Flags [.], ack 35325, win 2510, options [nop,nop,TS val 2989032 ecr 3217720,mptcp dss ack 1134358677], length 0
11:44:50.440813 IP 112.26.0.1.38151 > 112.26.0.8.46222: Flags [.], seq 36753:38181, ack 1, win 224, options [nop,nop,TS val 3217914 ecr 2988432,mptcp dss ack 2168003474 seq 1134360105 subseq 36753 len 1428 csum 0x7de], length 1428
11:44:50.447124 IP 112.26.0.8.46222 > 112.26.0.1.38151: Flags [.], ack 36753, win 2555, options [nop,nop,TS val 2989127 ecr 3217914,mptcp dss ack 1134360105], length 0
11:44:50.453021 IP 112.26.0.8.46222 > 112.26.0.1.38151: Flags [.], ack 31041, win 2373, options [nop,nop,TS val 2988811 ecr 3217592,mptcp dss ack 1134354393], length 0
11:44:50.455808 IP 112.26.0.1.38151 > 112.26.0.8.46222: Flags [.], seq 41037:42465, ack 1, win 224, options [nop,nop,TS val 3218315 ecr 2988811,mptcp dss ack 2168003474 seq 1134364389 subseq 41037 len 1428 csum 0xbfd8], length 1428
11:44:50.536617 IP 112.26.0.1.38151 > 112.26.0.8.46222: Flags [.], seq 38181:39609, ack 1, win 224, options [nop,nop,TS val 3218017 ecr 2988533,mptcp dss ack 2168003474 seq 1134361533 subseq 38181 len 1428 csum 0x8dda], length 1428
11:44:50.547115 IP 112.26.0.1.38151 > 112.26.0.8.46222: Flags [.], seq 36753:38181, ack 1, win 224, options [nop,nop,TS val 3217914 ecr 2988432,mptcp dss ack 2168003474 seq 1134360105 subseq 36753 len 1428 csum 0x7de], length 1428
11:44:50.554532 IP 112.26.0.8.46222 > 112.26.0.1.38151: Flags [.], ack 32469, win 2419, options [nop,nop,TS val 2988907 ecr 3217703,mptcp dss ack 1134355821], length 0
11:44:50.557613 IP 112.26.0.1.38151 > 112.26.0.8.46222: Flags [.], seq 42465:43893, ack 1, win 224, options [nop,nop,TS val 3218417 ecr 2988907,mptcp dss ack 2168003474 seq 1134365817 subseq 42465 len 1428 csum 0xb318], length 1428
11:44:50.639356 IP 112.26.0.1.38151 > 112.26.0.8.46222: Flags [.], seq 43893:45321, ack 1, win 224, options [nop,nop,TS val 3218417 ecr 2988907,mptcp dss ack 2168003474 seq 1134367245 subseq 43893 len 1428 csum 0x2ec3], length 1428
11:44:50.643456 IP 112.26.0.1.38151 > 112.26.0.8.46222: Flags [.], seq 38181:39609, ack 1, win 224, options [nop,nop,TS val 3218017 ecr 2988533,mptcp dss ack 2168003474 seq 1134361533 subseq 38181 len 1428 csum 0x8dda], length 1428
11:44:50.650402 IP 112.26.0.8.46222 > 112.26.0.1.38151: Flags [.], ack 33897, win 2464, options [nop,nop,TS val 2989008 ecr 3217703,mptcp dss ack 1134357249], length 0
11:44:50.653209 IP 112.26.0.1.38151 > 112.26.0.8.46222: Flags [.], seq 45321:46749, ack 1, win 224, options [nop,nop,TS val 3218513 ecr 2989008,mptcp dss ack 2168003474 seq 1134368673 subseq 45321 len 1428 csum 0x4fb4], length 1428
11:44:50.656627 IP 112.26.0.8.46222 > 112.26.0.1.38151: Flags [.], ack 38181, win 2601, options [nop,nop,TS val 2989325 ecr 3217914,mptcp dss ack 1134361533], length 0
11:44:50.666674 IP 112.26.0.1.38151 > 112.26.0.8.46222: Flags [.], seq 39609:41037, ack 1, win 224, options [nop,nop,TS val 3218198 ecr 2988628,mptcp dss ack 2168003474 seq 1134362961 subseq 39609 len 1428 csum 0x9a37], length 1428
11:44:50.735698 IP 112.26.0.8.46222 > 112.26.0.1.38151: Flags [.], ack 39609, win 2647, options [nop,nop,TS val 2989412 ecr 3218017,mptcp dss ack 1134362961], length 0
11:44:50.743894 IP 112.26.0.8.46222 > 112.26.0.1.38151: Flags [.], ack 35325, win 2510, options [nop,nop,TS val 2989032 ecr 3217720,mptcp dss ack 1134358677], length 0
11:44:50.748811 IP 112.26.0.1.38151 > 112.26.0.8.46222: Flags [.], seq 46749:48177, ack 1, win 224, options [nop,nop,TS val 3218607 ecr 2989032,mptcp dss ack 2168003474 seq 1134370101 subseq 46749 len 1428 csum 0x3c59], length 1428
11:44:50.754064 IP 112.26.0.1.38151 > 112.26.0.8.46222: Flags [.], seq 39609:41037, ack 1, win 224, options [nop,nop,TS val 3218198 ecr 2988628,mptcp dss ack 2168003474 seq 1134362961 subseq 39609 len 1428 csum 0x9a37], length 1428
11:44:50.764975 IP 112.26.0.8.46222 > 112.26.0.1.38151: Flags [.], ack 41037, win 2692, options [nop,nop,TS val 2989530 ecr 3218198,mptcp dss ack 1134364389], length 0
11:44:50.833151 IP 112.26.0.8.46222 > 112.26.0.1.38151: Flags [.], ack 36753, win 2555, options [nop,nop,TS val 2989127 ecr 3217914,mptcp dss ack 1134360105], length 0
11:44:50.840420 IP 112.26.0.1.38151 > 112.26.0.8.46222: Flags [.], seq 48177:49605, ack 1, win 224, options [nop,nop,TS val 3218696 ecr 2989127,mptcp dss ack 2168003474 seq 1134371529 subseq 48177 len 1428 csum 0x94cc], length 1428
11:44:50.846665 IP 112.26.0.1.38151 > 112.26.0.8.46222: Flags [.], seq 41037:42465, ack 1, win 224, options [nop,nop,TS val 3218315 ecr 2988811,mptcp dss ack 2168003474 seq 1134364389 subseq 41037 len 1428 csum 0xbfd8], length 1428
11:44:50.850654 IP 112.26.0.1.38151 > 112.26.0.8.46222: Flags [.], seq 41037:42465, ack 1, win 224, options [nop,nop,TS val 3218315 ecr 2988811,mptcp dss ack 2168003474 seq 1134364389 subseq 41037 len 1428 csum 0xbfd8], length 1428
11:44:50.862982 IP 112.26.0.8.46222 > 112.26.0.1.38151: Flags [.], ack 42465, win 2738, options [nop,nop,TS val 2989628 ecr 3218315,mptcp dss ack 1134365817], length 0
11:44:50.942758 IP 112.26.0.1.38151 > 112.26.0.8.46222: Flags [.], seq 42465:43893, ack 1, win 224, options [nop,nop,TS val 3218417 ecr 2988907,mptcp dss ack 2168003474 seq 1134365817 subseq 42465 len 1428 csum 0xb318], length 1428
11:44:50.948642 IP 112.26.0.1.38151 > 112.26.0.8.46222: Flags [.], seq 43893:45321, ack 1, win 224, options [nop,nop,TS val 3218417 ecr 2988907,mptcp dss ack 2168003474 seq 1134367245 subseq 43893 len 1428 csum 0x2ec3], length 1428
11:44:50.953236 IP 112.26.0.1.38151 > 112.26.0.8.46222: Flags [.], seq 42465:43893, ack 1, win 224, options [nop,nop,TS val 3218417 ecr 2988907,mptcp dss ack 2168003474 seq 1134365817 subseq 42465 len 1428 csum 0xb318], length 1428
11:44:51.034984 IP 112.26.0.1.38151 > 112.26.0.8.46222: Flags [.], seq 45321:46749, ack 1, win 224, options [nop,nop,TS val 3218513 ecr 2989008,mptcp dss ack 2168003474 seq 1134368673 subseq 45321 len 1428 csum 0x4fb4], length 1428
11:44:51.042933 IP 112.26.0.1.38151 > 112.26.0.8.46222: Flags [.], seq 43893:45321, ack 1, win 224, options [nop,nop,TS val 3218417 ecr 2988907,mptcp dss ack 2168003474 seq 1134367245 subseq 43893 len 1428 csum 0x2ec3], length 1428
11:44:51.053525 IP 112.26.0.8.46222 > 112.26.0.1.38151: Flags [.], ack 38181, win 2601, options [nop,nop,TS val 2989325 ecr 3217914,mptcp dss ack 1134361533], length 0
11:44:51.055627 IP 112.26.0.1.38151 > 112.26.0.8.46222: Flags [.], seq 49605:51033, ack 1, win 224, options [nop,nop,TS val 3218916 ecr 2989325,mptcp dss ack 2168003474 seq 1134372957 subseq 49605 len 1428 csum 0x1ad2], length 1428
11:44:51.059179 IP 112.26.0.8.46222 > 112.26.0.1.38151: Flags [.], ack 43893, win 2784, options [nop,nop,TS val 2989730 ecr 3218417,mptcp dss ack 1134367245], length 0
11:44:51.133049 IP 112.26.0.8.46222 > 112.26.0.1.38151: Flags [.], ack 39609, win 2647, options [nop,nop,TS val 2989412 ecr 3218017,mptcp dss ack 1134362961], length 0
11:44:51.135930 IP 112.26.0.1.38151 > 112.26.0.8.46222: Flags [.], seq 51033:52461, ack 1, win 224, options [nop,nop,TS val 3218996 ecr 2989412,mptcp dss ack 2168003474 seq 1134374385 subseq 51033 len 1428 csum 0xe734], length 1428
11:44:51.141823 IP 112.26.0.1.38151 > 112.26.0.8.46222: Flags [.], seq 45321:46749, ack 1, win 224, options [nop,nop,TS val 3218513 ecr 2989008,mptcp dss ack 2168003474 seq 1134368673 subseq 45321 len 1428 csum 0x4fb4], length 1428
11:44:51.152784 IP 112.26.0.1.38151 > 112.26.0.8.46222: Flags [.], seq 46749:48177, ack 1, win 224, options [nop,nop,TS val 3218607 ecr 2989032,mptcp dss ack 2168003474 seq 1134370101 subseq 46749 len 1428 csum 0x3c59], length 1428
11:44:51.156046 IP 112.26.0.8.46222 > 112.26.0.1.38151: Flags [.], ack 45321, win 2829, options [nop,nop,TS val 2989820 ecr 3218417,mptcp dss ack 1134368673], length 0
11:44:51.165915 IP 112.26.0.8.46222 > 112.26.0.1.38151: Flags [.], ack 46749, win 2875, options [nop,nop,TS val 2989917 ecr 3218513,mptcp dss ack 1134370101], length 0
11:44:51.171027 IP 112.26.0.8.46222 > 112.26.0.1.38151: Flags [.], ack 41037, win 2692, options [nop,nop,TS val 2989530 ecr 3218198,mptcp dss ack 1134364389], length 0
