11:44:54.497649 IP 112.26.1.8.43791 > 112.26.1.1.38151: Flags [S], seq 3649387865, win 65535, options [mss 1460,sackOK,TS val 2993265 ecr 0,nop,wscale 6,mptcp join id 3 token 0x3c5625f6 nonce 0x1fe1cd71], length 0
11:44:54.502430 IP 112.26.1.1.38151 > 112.26.1.8.43791: Flags [S.], seq 4004470037, ack 3649387866, win 28560, options [mss 1460,sackOK,TS val 3222362 ecr 2993265,nop,wscale 7,mptcp join id 3 hmac 0x3256875f4c329db nonce 0xea93cb59], length 0
11:44:54.654274 IP 112.26.1.1.38151 > 112.26.1.8.43791: Flags [S.], seq 4004470037, ack 3649387866, win 28560, options [mss 1460,sackOK,TS val 3222362 ecr 2993265,nop,wscale 7,mptcp join id 3 hmac 0x3256875f4c329db nonce 0xea93cb59], length 0
11:44:54.775191 IP 112.26.1.8.43791 > 112.26.1.1.38151: Flags [.], ack 1, win 6935, options [nop,nop,TS val 2993431 ecr 3222362,mptcp join hmac 0x51545920d2d732ac6a6f0dacd314dd6e9039c111], length 0
11:44:54.780234 IP 112.26.1.1.38151 > 112.26.1.8.43791: Flags [.], ack 1, win 893, options [nop,nop,TS val 3222640 ecr 2993431,mptcp dss ack 2168003474], length 0
11:44:54.847795 IP 112.26.1.1.38151 > 112.26.1.8.43791: Flags [.], seq 1:1429, ack 1, win 893, options [nop,nop,TS val 3222640 ecr 2993431,mptcp dss ack 2168003474 seq 1134448641 subseq 1 len 1428 csum 0xc16e], length 1428
11:44:54.877732 IP 112.26.1.1.38151 > 112.26.1.8.43791: Flags [.], ack 1, win 893, options [nop,nop,TS val 3222640 ecr 2993431,mptcp dss ack 2168003474], length 0
11:44:54.888300 IP 112.26.1.1.38151 > 112.26.1.8.43791: Flags [.], seq 1429:2857, ack 1, win 893, options [nop,nop,TS val 3222640 ecr 2993431,mptcp dss ack 2168003474 seq 1134450069 subseq 1429 len 1428 csum 0x7037], length 1428
11:44:54.917792 IP 112.26.1.1.38151 > 112.26.1.8.43791: Flags [.], seq 2857:4285, ack 1, win 893, options [nop,nop,TS val 3222641 ecr 2993431,mptcp dss ack 2168003474 seq 1134451497 subseq 2857 len 1428 csum 0xe925], length 1428
11:44:54.959626 IP 112.26.1.1.38151 > 112.26.1.8.43791: Flags [.], seq 1:1429, ack 1, win 893, options [nop,nop,TS val 3222640 ecr 2993431,mptcp dss ack 2168003474 seq 1134448641 subseq 1 len 1428 csum 0xc16e], length 1428
11:44:54.981363 IP 112.26.1.1.38151 > 112.26.1.8.43791: Flags [.], seq 4285:5713, ack 1, win 893, options [nop,nop,TS val 3222641 ecr 2993431,mptcp dss ack 2168003474 seq 1134452925 subseq 4285 len 1428 csum 0xdf93], length 1428
11:44:55.023779 IP 112.26.1.8.43791 > 112.26.1.1.38151: Flags [.], ack 1429, win 7164, options [nop,nop,TS val 2993727 ecr 3222640,mptcp dss ack 1134415797], length 0
11:44:55.031393 IP 112.26.1.1.38151 > 112.26.1.8.43791: Flags [.], seq 5713:7141, ack 1, win 893, options [nop,nop,TS val 3222641 ecr 2993431,mptcp dss ack 2168003474 seq 1134454353 subseq 5713 len 1428 csum 0xe43c], length 1428
11:44:55.100669 IP 112.26.1.1.38151 > 112.26.1.8.43791: Flags [.], seq 7141:8569, ack 1, win 893, options [nop,nop,TS val 3222641 ecr 2993431,mptcp dss ack 2168003474 seq 1134455781 subseq 7141 len 1428 csum 0x2703], length 1428
11:44:55.155727 IP 112.26.1.1.38151 > 112.26.1.8.43791: Flags [.], seq 1429:2857, ack 1, win 893, options [nop,nop,TS val 3222640 ecr 2993431,mptcp dss ack 2168003474 seq 1134450069 subseq 1429 len 1428 csum 0x7037], length 1428
11:44:55.169511 IP 112.26.1.1.38151 > 112.26.1.8.43791: Flags [.], seq 8569:9997, ack 1, win 893, options [nop,nop,TS val 3222641 ecr 2993431,mptcp dss ack 2168003474 seq 1134457209 subseq 8569 len 1428 csum 0x1776], length 1428
11:44:55.220257 IP 112.26.1.1.38151 > 112.26.1.8.43791: Flags [.], seq 9997:11425, ack 1, win 893, options [nop,nop,TS val 3222641 ecr 2993431,mptcp dss ack 2168003474 seq 1134458637 subseq 9997 len 1428 csum 0xa71d], length 1428
11:44:55.261206 IP 112.26.1.8.43791 > 112.26.1.1.38151: Flags [.], ack 2857, win 7392, options [nop,nop,TS val 2993906 ecr 3222640,mptcp dss ack 1134421509], length 0
11:44:55.309572 IP 112.26.1.1.38151 > 112.26.1.8.43791: Flags [.], seq 2857:4285, ack 1, win 893, options [nop,nop,TS val 3222641 ecr 2993431,mptcp dss ack 2168003474 seq 1134451497 subseq 2857 len 1428 csum 0xe925], length 1428
11:44:55.350030 IP 112.26.1.1.38151 > 112.26.1.8.43791: Flags [.], seq 14281:15709, ack 1, win 893, options [nop,nop,TS val 3223184 ecr 2993727,mptcp dss ack 2168003474 seq 1134472917 subseq 14281 len 1428 csum 0xc9c6], length 1428
11:44:55.382443 IP 112.26.1.1.38151 > 112.26.1.8.43791: Flags [.], seq 4285:5713, ack 1, win 893, options [nop,nop,TS val 3222641 ecr 2993431,mptcp dss ack 2168003474 seq 1134452925 subseq 4285 len 1428 csum 0xdf93], length 1428
11:44:55.425699 IP 112.26.1.1.38151 > 112.26.1.8.43791: Flags [.], seq 15709:17137, ack 1, win 893, options [nop,nop,TS val 3223184 ecr 2993727,mptcp dss ack 2168003474 seq 1134474345 subseq 15709 len 1428 csum 0x48a5], length 1428
11:44:55.459434 IP 112.26.1.8.43791 > 112.26.1.1.38151: Flags [.], ack 4285, win 7483, options [nop,nop,TS val 2994081 ecr 3222641,mptcp dss ack 1134421509], length 0
11:44:55.508487 IP 112.26.1.8.43791 > 112.26.1.1.38151: Flags [.], ack 5713, win 7620, options [nop,nop,TS val 2994159 ecr 3222641,mptcp dss ack 1134422937], length 0
11:44:55.538076 IP 112.26.1.1.38151 > 112.26.1.8.43791: Flags [.], seq 5713:7141, ack 1, win 893, options [nop,nop,TS val 3222641 ecr 2993431,mptcp dss ack 2168003474 seq 1134454353 subseq 5713 len 1428 csum 0xe43c], length 1428
11:44:55.660252 IP 112.26.1.8.43791 > 112.26.1.1.38151: Flags [.], ack 7141, win 7711, options [nop,nop,TS val 2994315 ecr 3222641,mptcp dss ack 1134422937], length 0
11:44:55.702897 IP 112.26.1.1.38151 > 112.26.1.8.43791: Flags [.], seq 7141:8569, ack 1, win 893, options [nop,nop,TS val 3222641 ecr 2993431,mptcp dss ack 2168003474 seq 1134455781 subseq 7141 len 1428 csum 0x2703], length 1428
11:44:55.772415 IP 112.26.1.1.38151 > 112.26.1.8.43791: Flags [.], seq 17137:18565, ack 1, win 893, options [nop,nop,TS val 3223631 ecr 2993906,mptcp dss ack 2168003474 seq 1134491481 subseq 17137 len 1428 csum 0x44d1], length 1428
11:44:55.796631 IP 112.26.1.1.38151 > 112.26.1.8.43791: Flags [.], seq 8569:9997, ack 1, win 893, options [nop,nop,TS val 3222641 ecr 2993431,mptcp dss ack 2168003474 seq 1134457209 subseq 8569 len 1428 csum 0x1776], length 1428
11:44:55.820780 IP 112.26.1.1.38151 > 112.26.1.8.43791: Flags [.], seq 18565:19993, ack 1, win 893, options [nop,nop,TS val 3223631 ecr 2993906,mptcp dss ack 2168003474 seq 1134492909 subseq 18565 len 1428 csum 0x14e0], length 1428
11:44:55.833164 IP 112.26.1.1.38151 > 112.26.1.8.43791: Flags [.], seq 9997:11425, ack 1, win 893, options [nop,nop,TS val 3222641 ecr 2993431,mptcp dss ack 2168003474 seq 1134458637 subseq 9997 len 1428 csum 0xa71d], length 1428
11:44:55.882748 IP 112.26.1.8.43791 > 112.26.1.1.38151: Flags [.], ack 8569, win 7894, options [nop,nop,TS val 2994480 ecr 3222641,mptcp dss ack 1134424365], length 0
11:44:55.899697 IP 112.26.1.8.43791 > 112.26.1.1.38151: Flags [.], ack 9997, win 8076, options [nop,nop,TS val 2994566 ecr 3222641,mptcp dss ack 1134424365], length 0
11:44:55.920666 IP 112.26.1.8.43791 > 112.26.1.1.38151: Flags [.], ack 11425, win 8122, options [nop,nop,TS val 2994610 ecr 3222641,mptcp dss ack 1134424365], length 0
11:44:55.952427 IP 112.26.1.1.38151 > 112.26.1.8.43791: Flags [.], seq 19993:21421, ack 1, win 893, options [nop,nop,TS val 3223798 ecr 2994081,mptcp dss ack 2168003474 seq 1134495765 subseq 19993 len 1428 csum 0x948e], length 1428
11:44:55.998678 IP 112.26.1.1.38151 > 112.26.1.8.43791: Flags [.], seq 21421:22849, ack 1, win 893, options [nop,nop,TS val 3223798 ecr 2994081,mptcp dss ack 2168003474 seq 1134497193 subseq 21421 len 1428 csum 0xb860], length 1428
11:44:56.053835 IP 112.26.1.1.38151 > 112.26.1.8.43791: Flags [.], seq 22849:24277, ack 1, win 893, options [nop,nop,TS val 3223872 ecr 2994315,mptcp dss ack 2168003474 seq 1134500049 subseq 22849 len 1428 csum 0x9e0d], length 1428
11:44:56.083235 IP 112.26.1.1.38151 > 112.26.1.8.43791: Flags [.], seq 17137:18565, ack 1, win 893, options [nop,nop,TS val 3223631 ecr 2993906,mptcp dss ack 2168003474 seq 1134491481 subseq 17137 len 1428 csum 0x44d1], length 1428
11:44:56.116622 IP 112.26.1.1.38151 > 112.26.1.8.43791: Flags [.], seq 24277:25705, ack 1, win 893, options [nop,nop,TS val 3223872 ecr 2994315,mptcp dss ack 2168003474 seq 1134501477 subseq 24277 len 1428 csum 0x9bf1], length 1428
11:44:56.164380 IP 112.26.1.8.43791 > 112.26.1.1.38151: Flags [.], ack 11425, win 8395, options [nop,nop,TS val 2994860 ecr 3222641,nop,nop,sack 1 {17137:18565},mptcp dss ack 1134424365], length 0
11:44:56.175448 IP 112.26.1.1.38151 > 112.26.1.8.43791: Flags [.], seq 25705:27133, ack 1, win 893, options [nop,nop,TS val 3223872 ecr 2994315,mptcp dss ack 2168003474 seq 1134502905 subseq 25705 len 1428 csum 0x4c22], length 1428
11:44:56.203216 IP 112.26.1.1.38151 > 112.26.1.8.43791: Flags [.], seq 18565:19993, ack 1, win 893, options [nop,nop,TS val 3223631 ecr 2993906,mptcp dss ack 2168003474 seq 1134492909 subseq 18565 len 1428 csum 0x14e0], length 1428
11:44:56.228905 IP 112.26.1.1.38151 > 112.26.1.8.43791: Flags [.], seq 27133:28561, ack 1, win 893, options [nop,nop,TS val 3223872 ecr 2994315,mptcp dss ack 2168003474 seq 1134504333 subseq 27133 len 1428 csum 0x1043], length 1428
11:44:56.299698 IP 112.26.1.1.38151 > 112.26.1.8.43791: Flags [.], seq 28561:29989, ack 1, win 893, options [nop,nop,TS val 3224136 ecr 2994480,mptcp dss ack 2168003474 seq 1134438645 subseq 28561 len 1428 csum 0x4efa], length 1428
11:44:56.323410 IP 112.26.1.8.43791 > 112.26.1.1.38151: Flags [.], ack 11425, win 8532, options [nop,nop,TS val 2994972 ecr 3222641,nop,nop,sack 1 {17137:19993},mptcp dss ack 1134424365], length 0
11:44:56.352801 IP 112.26.1.1.38151 > 112.26.1.8.43791: Flags [.], seq 29989:31417, ack 1, win 893, options [nop,nop,TS val 3224136 ecr 2994480,mptcp dss ack 2168003474 seq 1134440073 subseq 29989 len 1428 csum 0x59ab], length 1428
11:44:56.409676 IP 112.26.1.1.38151 > 112.26.1.8.43791: Flags [.], seq 31417:32845, ack 1, win 893, options [nop,nop,TS val 3224207 ecr 2994566,mptcp dss ack 2168003474 seq 1134444357 subseq 31417 len 1428 csum 0x66ef], length 1428
11:44:56.435876 IP 112.26.1.1.38151 > 112.26.1.8.43791: Flags [.], seq 19993:21421, ack 1, win 893, options [nop,nop,TS val 3223798 ecr 2994081,mptcp dss ack 2168003474 seq 1134495765 subseq 19993 len 1428 csum 0x948e], length 1428
11:44:56.488593 IP 112.26.1.1.38151 > 112.26.1.8.43791: Flags [.], seq 32845:34273, ack 1, win 893, options [nop,nop,TS val 3224207 ecr 2994566,mptcp dss ack 2168003474 seq 1134445785 subseq 32845 len 1428 csum 0x956a], length 1428
11:44:56.516153 IP 112.26.1.8.43791 > 112.26.1.1.38151: Flags [.], ack 11425, win 8806, options [nop,nop,TS val 2995212 ecr 3222641,nop,nop,sack 1 {17137:21421},mptcp dss ack 1134425793], length 0
11:44:56.528070 IP 112.26.1.1.38151 > 112.26.1.8.43791: Flags [.], seq 34273:35701, ack 1, win 893, options [nop,nop,TS val 3224247 ecr 2994610,mptcp dss ack 2168003474 seq 1134481485 subseq 34273 len 1428 csum 0x609f], length 1428
11:44:56.593508 IP 112.26.1.1.38151 > 112.26.1.8.43791: Flags [.], seq 22849:24277, ack 1, win 893, options [nop,nop,TS val 3223872 ecr 2994315,mptcp dss ack 2168003474 seq 1134500049 subseq 22849 len 1428 csum 0x9e0d], length 1428
11:44:56.623893 IP 112.26.1.1.38151 > 112.26.1.8.43791: Flags [.], seq 35701:37129, ack 1, win 893, options [nop,nop,TS val 3224247 ecr 2994610,mptcp dss ack 2168003474 seq 1134482913 subseq 35701 len 1428 csum 0xa10c], length 1428
11:44:56.652696 IP 112.26.1.8.43791 > 112.26.1.1.38151: Flags [.], ack 11425, win 8943, options [nop,nop,TS val 2995371 ecr 3222641,nop,nop,sack 2 {22849:24277}{17137:21421},mptcp dss ack 1134427221], length 0
11:44:56.698654 IP 112.26.1.1.38151 > 112.26.1.8.43791: Flags [.], seq 11425:12853, ack 1, win 893, options [nop,nop,TS val 3224539 ecr 2994860,mptcp dss ack 2168003474 seq 1134460065 subseq 11425 len 1428 csum 0x6245], length 1428
11:44:56.722866 IP 112.26.1.1.38151 > 112.26.1.8.43791: Flags [.], seq 27133:28561, ack 1, win 893, options [nop,nop,TS val 3223872 ecr 2994315,mptcp dss ack 2168003474 seq 1134504333 subseq 27133 len 1428 csum 0x1043], length 1428
11:44:56.789837 IP 112.26.1.8.43791 > 112.26.1.1.38151: Flags [.], ack 11425, win 9080, options [nop,nop,TS val 2995500 ecr 3222641,nop,nop,sack 2 {27133:28561}{22849:24277},mptcp dss ack 1134427221], length 0
11:44:56.833613 IP 112.26.1.1.38151 > 112.26.1.8.43791: Flags [.], seq 28561:29989, ack 1, win 893, options [nop,nop,TS val 3224136 ecr 2994480,mptcp dss ack 2168003474 seq 1134438645 subseq 28561 len 1428 csum 0x4efa], length 1428
11:44:56.880872 IP 112.26.1.8.43791 > 112.26.1.1.38151: Flags [.], ack 11425, win 9217, options [nop,nop,TS val 2995611 ecr 3222641,nop,nop,sack 2 {27133:29989}{22849:24277},mptcp dss ack 1134427221], length 0
11:44:56.920800 IP 112.26.1.1.38151 > 112.26.1.8.43791: Flags [.], seq 31417:32845, ack 1, win 893, options [nop,nop,TS val 3224207 ecr 2994566,mptcp dss ack 2168003474 seq 1134444357 subseq 31417 len 1428 csum 0x66ef], length 1428
11:44:57.005531 IP 112.26.1.8.43791 > 112.26.1.1.38151: Flags [.], ack 11425, win 9308, options [nop,nop,TS val 2995698 ecr 3222641,nop,nop,sack 2 {31417:32845}{27133:29989},mptcp dss ack 1134427221], length 0
11:44:57.080528 IP 112.26.1.1.38151 > 112.26.1.8.43791: Flags [.], seq 32845:34273, ack 1, win 893, options [nop,nop,TS val 3224207 ecr 2994566,mptcp dss ack 2168003474 seq 1134445785 subseq 32845 len 1428 csum 0x956a], length 1428
11:44:57.185428 IP 112.26.1.1.38151 > 112.26.1.8.43791: Flags [.], seq 34273:35701, ack 1, win 893, options [nop,nop,TS val 3224247 ecr 2994610,mptcp dss ack 2168003474 seq 1134481485 subseq 34273 len 1428 csum 0x609f], length 1428
11:44:57.190498 IP 112.26.1.1.38151 > 112.26.1.8.43791: Flags [.], seq 12853:14281, ack 1, win 893, options [nop,nop,TS val 3225002 ecr 2995371,mptcp dss ack 2168003474 seq 1134461493 subseq 12853 len 1428 csum 0xdc0e], length 1428
11:44:57.209686 IP 112.26.1.8.43791 > 112.26.1.1.38151: Flags [.], ack 11425, win 9490, options [nop,nop,TS val 2995857 ecr 3222641,nop,nop,sack 2 {31417:34273}{27133:29989},mptcp dss ack 1134427221], length 0
11:44:57.239922 IP 112.26.1.1.38151 > 112.26.1.8.43791: Flags [.], seq 35701:37129, ack 1, win 893, options [nop,nop,TS val 3224247 ecr 2994610,mptcp dss ack 2168003474 seq 1134482913 subseq 35701 len 1428 csum 0xa10c], length 1428
11:44:57.251971 IP 112.26.1.1.38151 > 112.26.1.8.43791: Flags [.], seq 14281:15709, ack 1, win 893, options [nop,nop,TS val 3225079 ecr 2995500,mptcp dss ack 2168003474 seq 1134472917 subseq 14281 len 1428 csum 0xc9c6], length 1428
11:44:57.302288 IP 112.26.1.8.43791 > 112.26.1.1.38151: Flags [.], ack 11425, win 9582, options [nop,nop,TS val 2995925 ecr 3222641,nop,nop,sack 2 {31417:35701}{27133:29989},mptcp dss ack 1134427221], length 0
11:44:57.313085 IP 112.26.1.1.38151 > 112.26.1.8.43791: Flags [.], seq 15709:17137, ack 1, win 893, options [nop,nop,TS val 3225146 ecr 2995611,mptcp dss ack 2168003474 seq 1134474345 subseq 15709 len 1428 csum 0x48a5], length 1428
11:44:57.330639 IP 112.26.1.8.43791 > 112.26.1.1.38151: Flags [.], ack 11425, win 9719, options [nop,nop,TS val 2996012 ecr 3222641,nop,nop,sack 2 {31417:37129}{27133:29989},mptcp dss ack 1134427221], length 0
11:44:57.357048 IP 112.26.1.1.38151 > 112.26.1.8.43791: Flags [.], seq 21421:22849, ack 1, win 893, options [nop,nop,TS val 3225218 ecr 2995698,mptcp dss ack 2168003474 seq 1134497193 subseq 21421 len 1428 csum 0xb860], length 1428
11:44:57.404138 IP 112.26.1.1.38151 > 112.26.1.8.43791: Flags [.], seq 12853:14281, ack 1, win 893, options [nop,nop,TS val 3225002 ecr 2995371,mptcp dss ack 2168003474 seq 1134461493 subseq 12853 len 1428 csum 0xdc0e], length 1428
11:44:57.455948 IP 112.26.1.8.43791 > 112.26.1.1.38151: Flags [.], ack 11425, win 9855, options [nop,nop,TS val 2996181 ecr 3222641,nop,nop,sack 2 {12853:14281}{31417:37129},mptcp dss ack 1134438645], length 0
11:44:57.502145 IP 112.26.1.1.38151 > 112.26.1.8.43791: Flags [.], seq 24277:25705, ack 1, win 893, options [nop,nop,TS val 3225362 ecr 2995857,mptcp dss ack 2168003474 seq 1134501477 subseq 24277 len 1428 csum 0x9bf1], length 1428
11:44:57.567381 IP 112.26.1.1.38151 > 112.26.1.8.43791: Flags [.], seq 14281:15709, ack 1, win 893, options [nop,nop,TS val 3225079 ecr 2995500,mptcp dss ack 2168003474 seq 1134472917 subseq 14281 len 1428 csum 0xc9c6], length 1428
11:44:57.636117 IP 112.26.1.1.38151 > 112.26.1.8.43791: Flags [.], seq 25705:27133, ack 1, win 893, options [nop,nop,TS val 3225490 ecr 2995925,mptcp dss ack 2168003474 seq 1134502905 subseq 25705 len 1428 csum 0x4c22], length 1428
11:44:57.702881 IP 112.26.1.8.43791 > 112.26.1.1.38151: Flags [.], ack 11425, win 10084, options [nop,nop,TS val 2996344 ecr 3222641,nop,nop,sack 2 {12853:15709}{31417:37129},mptcp dss ack 1134438645], length 0
11:44:57.750620 IP 112.26.1.1.38151 > 112.26.1.8.43791: Flags [.], seq 15709:17137, ack 1, win 893, options [nop,nop,TS val 3225146 ecr 2995611,mptcp dss ack 2168003474 seq 1134474345 subseq 15709 len 1428 csum 0x48a5], length 1428
11:44:57.784773 IP 112.26.1.1.38151 > 112.26.1.8.43791: Flags [.], seq 29989:31417, ack 1, win 893, options [nop,nop,TS val 3225624 ecr 2996012,mptcp dss ack 2168003474 seq 1134440073 subseq 29989 len 1428 csum 0x59ab], length 1428
11:44:57.817236 IP 112.26.1.8.43791 > 112.26.1.1.38151: Flags [.], ack 11425, win 10266, options [nop,nop,TS val 2996527 ecr 3222641,nop,nop,sack 2 {12853:17137}{31417:37129},mptcp dss ack 1134438645], length 0
11:44:57.854343 IP 112.26.1.1.38151 > 112.26.1.8.43791: Flags [.], seq 21421:22849, ack 1, win 893, options [nop,nop,TS val 3225218 ecr 2995698,mptcp dss ack 2168003474 seq 1134497193 subseq 21421 len 1428 csum 0xb860], length 1428
11:44:57.886943 IP 112.26.1.1.38151 > 112.26.1.8.43791: Flags [.], seq 11425:12853, ack 1, win 893, options [nop,nop,TS val 3225744 ecr 2996181,mptcp dss ack 2168003474 seq 1134460065 subseq 11425 len 1428 csum 0x6245], length 1428
11:44:57.924353 IP 112.26.1.8.43791 > 112.26.1.1.38151: Flags [.], ack 11425, win 10357, options [nop,nop,TS val 2996631 ecr 3222641,nop,nop,sack 2 {21421:24277}{12853:17137},mptcp dss ack 1134438645], length 0
11:44:57.990743 IP 112.26.1.1.38151 > 112.26.1.8.43791: Flags [.], seq 24277:25705, ack 1, win 893, options [nop,nop,TS val 3225362 ecr 2995857,mptcp dss ack 2168003474 seq 1134501477 subseq 24277 len 1428 csum 0x9bf1], length 1428
11:44:58.046658 IP 112.26.1.8.43791 > 112.26.1.1.38151: Flags [.], ack 11425, win 10494, options [nop,nop,TS val 2996767 ecr 3222641,nop,nop,sack 2 {21421:25705}{12853:17137},mptcp dss ack 1134438645], length 0
11:44:58.094447 IP 112.26.1.1.38151 > 112.26.1.8.43791: Flags [.], seq 25705:27133, ack 1, win 893, options [nop,nop,TS val 3225490 ecr 2995925,mptcp dss ack 2168003474 seq 1134502905 subseq 25705 len 1428 csum 0x4c22], length 1428
11:44:58.138032 IP 112.26.1.1.38151 > 112.26.1.8.43791: Flags [.], seq 37129:38557, ack 1, win 893, options [nop,nop,TS val 3225994 ecr 2996344,mptcp dss ack 2168003474 seq 1134535749 subseq 37129 len 1428 csum 0x553d], length 1428
11:44:58.149634 IP 112.26.1.8.43791 > 112.26.1.1.38151: Flags [.], ack 11425, win 10631, options [nop,nop,TS val 2996871 ecr 3222641,nop,nop,sack 2 {21421:29989}{12853:17137},mptcp dss ack 1134438645], length 0
11:44:58.214935 IP 112.26.1.1.38151 > 112.26.1.8.43791: Flags [.], seq 29989:31417, ack 1, win 893, options [nop,nop,TS val 3225624 ecr 2996012,mptcp dss ack 2168003474 seq 1134440073 subseq 29989 len 1428 csum 0x59ab], length 1428
11:44:58.263621 IP 112.26.1.8.43791 > 112.26.1.1.38151: Flags [.], ack 11425, win 10768, options [nop,nop,TS val 2996991 ecr 3222641,nop,nop,sack 2 {21421:37129}{12853:17137},mptcp dss ack 1134438645], length 0
11:44:58.310401 IP 112.26.1.1.38151 > 112.26.1.8.43791: Flags [.], seq 38557:39985, ack 1, win 893, options [nop,nop,TS val 3226171 ecr 2996527,mptcp dss ack 2168003474 seq 1134541461 subseq 38557 len 1428 csum 0x7ede], length 1428
11:44:58.334916 IP 112.26.1.1.38151 > 112.26.1.8.43791: Flags [.], seq 11425:12853, ack 1, win 893, options [nop,nop,TS val 3225744 ecr 2996181,mptcp dss ack 2168003474 seq 1134460065 subseq 11425 len 1428 csum 0x6245], length 1428
11:44:58.376399 IP 112.26.1.8.43791 > 112.26.1.1.38151: Flags [.], ack 37129, win 10859, options [nop,nop,TS val 2997095 ecr 3225744,mptcp dss ack 1134518613], length 0
11:44:58.424411 IP 112.26.1.1.38151 > 112.26.1.8.43791: Flags [.], seq 39985:41413, ack 1, win 893, options [nop,nop,TS val 3226285 ecr 2996631,mptcp dss ack 2168003474 seq 1134545745 subseq 39985 len 1428 csum 0xd70f], length 1428
11:44:58.464572 IP 112.26.1.1.38151 > 112.26.1.8.43791: Flags [.], seq 41413:42841, ack 1, win 893, options [nop,nop,TS val 3226296 ecr 2996767,mptcp dss ack 2168003474 seq 1134547173 subseq 41413 len 1428 csum 0x3056], length 1428
11:44:58.509620 IP 112.26.1.1.38151 > 112.26.1.8.43791: Flags [.], seq 37129:38557, ack 1, win 893, options [nop,nop,TS val 3225994 ecr 2996344,mptcp dss ack 2168003474 seq 1134535749 subseq 37129 len 1428 csum 0x553d], length 1428
11:44:58.577580 IP 112.26.1.8.43791 > 112.26.1.1.38151: Flags [.], ack 38557, win 11087, options [nop,nop,TS val 2997286 ecr 3225994,mptcp dss ack 1134518613], length 0
11:44:58.618413 IP 112.26.1.1.38151 > 112.26.1.8.43791: Flags [.], seq 42841:44269, ack 1, win 893, options [nop,nop,TS val 3226479 ecr 2996871,mptcp dss ack 2168003474 seq 1134551457 subseq 42841 len 1428 csum 0x9ec0], length 1428
11:44:58.660735 IP 112.26.1.1.38151 > 112.26.1.8.43791: Flags [.], seq 44269:45697, ack 1, win 893, options [nop,nop,TS val 3226514 ecr 2996991,mptcp dss ack 2168003474 seq 1134552885 subseq 44269 len 1428 csum 0xc2dc], length 1428
11:44:58.672357 IP 112.26.1.1.38151 > 112.26.1.8.43791: Flags [.], seq 38557:39985, ack 1, win 893, options [nop,nop,TS val 3226171 ecr 2996527,mptcp dss ack 2168003474 seq 1134541461 subseq 38557 len 1428 csum 0x7ede], length 1428
11:44:58.743798 IP 112.26.1.8.43791 > 112.26.1.1.38151: Flags [.], ack 39985, win 11270, options [nop,nop,TS val 2997449 ecr 3226171,mptcp dss ack 1134518613], length 0
11:44:58.757838 IP 112.26.1.1.38151 > 112.26.1.8.43791: Flags [.], seq 45697:47125, ack 1, win 893, options [nop,nop,TS val 3226611 ecr 2997095,mptcp dss ack 2168003474 seq 1134555741 subseq 45697 len 1428 csum 0x561e], length 1428
11:44:58.821408 IP 112.26.1.1.38151 > 112.26.1.8.43791: Flags [.], seq 47125:48553, ack 1, win 893, options [nop,nop,TS val 3226611 ecr 2997095,mptcp dss ack 2168003474 seq 1134557169 subseq 47125 len 1428 csum 0x2ac8], length 1428
11:44:58.846265 IP 112.26.1.1.38151 > 112.26.1.8.43791: Flags [.], seq 39985:41413, ack 1, win 893, options [nop,nop,TS val 3226285 ecr 2996631,mptcp dss ack 2168003474 seq 1134545745 subseq 39985 len 1428 csum 0xd70f], length 1428
11:44:58.910519 IP 112.26.1.1.38151 > 112.26.1.8.43791: Flags [.], seq 48553:49981, ack 1, win 893, options [nop,nop,TS val 3226611 ecr 2997095,mptcp dss ack 2168003474 seq 1134558597 subseq 48553 len 1428 csum 0x848e], length 1428
11:44:58.912278 IP 112.26.1.8.43791 > 112.26.1.1.38151: Flags [.], ack 41413, win 11498, options [nop,nop,TS val 2997611 ecr 3226285,mptcp dss ack 1134518613], length 0
11:44:58.948455 IP 112.26.1.1.38151 > 112.26.1.8.43791: Flags [.], seq 41413:42841, ack 1, win 893, options [nop,nop,TS val 3226296 ecr 2996767,mptcp dss ack 2168003474 seq 1134547173 subseq 41413 len 1428 csum 0x3056], length 1428
11:44:58.971103 IP 112.26.1.1.38151 > 112.26.1.8.43791: Flags [.], seq 49981:51409, ack 1, win 893, options [nop,nop,TS val 3226611 ecr 2997095,mptcp dss ack 2168003474 seq 1134560025 subseq 49981 len 1428 csum 0x51a], length 1428
11:44:59.023358 IP 112.26.1.8.43791 > 112.26.1.1.38151: Flags [.], ack 42841, win 11635, options [nop,nop,TS val 2997725 ecr 3226296,mptcp dss ack 1134521469], length 0
11:44:59.036072 IP 112.26.1.1.38151 > 112.26.1.8.43791: Flags [.], seq 51409:52837, ack 1, win 893, options [nop,nop,TS val 3226611 ecr 2997095,mptcp dss ack 2168003474 seq 1134561453 subseq 51409 len 1428 csum 0x4716], length 1428
11:44:59.067593 IP 112.26.1.1.38151 > 112.26.1.8.43791: Flags [.], seq 42841:44269, ack 1, win 893, options [nop,nop,TS val 3226479 ecr 2996871,mptcp dss ack 2168003474 seq 1134551457 subseq 42841 len 1428 csum 0x9ec0], length 1428
11:44:59.081426 IP 112.26.1.1.38151 > 112.26.1.8.43791: Flags [.], seq 52837:54265, ack 1, win 893, options [nop,nop,TS val 3226611 ecr 2997095,mptcp dss ack 2168003474 seq 1134562881 subseq 52837 len 1428 csum 0x1eaf], length 1428
11:44:59.120244 IP 112.26.1.8.43791 > 112.26.1.1.38151: Flags [.], ack 44269, win 11772, options [nop,nop,TS val 2997844 ecr 3226479,mptcp dss ack 1134521469], length 0
11:44:59.152005 IP 112.26.1.1.38151 > 112.26.1.8.43791: Flags [.], seq 54265:55693, ack 1, win 893, options [nop,nop,TS val 3226875 ecr 2997286,mptcp dss ack 2168003474 seq 1134572877 subseq 54265 len 1428 csum 0xe8f9], length 1428
11:44:59.212206 IP 112.26.1.1.38151 > 112.26.1.8.43791: Flags [.], seq 55693:57121, ack 1, win 893, options [nop,nop,TS val 3226875 ecr 2997286,mptcp dss ack 2168003474 seq 1134574305 subseq 55693 len 1428 csum 0x11d6], length 1428
11:44:59.254844 IP 112.26.1.1.38151 > 112.26.1.8.43791: Flags [.], seq 45697:47125, ack 1, win 893, options [nop,nop,TS val 3226611 ecr 2997095,mptcp dss ack 2168003474 seq 1134555741 subseq 45697 len 1428 csum 0x561e], length 1428
11:44:59.275016 IP 112.26.1.1.38151 > 112.26.1.8.43791: Flags [.], seq 57121:58549, ack 1, win 893, options [nop,nop,TS val 3227039 ecr 2997449,mptcp dss ack 2168003474 seq 1134578589 subseq 57121 len 1428 csum 0xe42f], length 1428
11:44:59.323662 IP 112.26.1.8.43791 > 112.26.1.1.38151: Flags [.], ack 44269, win 12000, options [nop,nop,TS val 2998032 ecr 3226479,nop,nop,sack 1 {45697:47125},mptcp dss ack 1134527181], length 0
11:44:59.363530 IP 112.26.1.1.38151 > 112.26.1.8.43791: Flags [.], seq 48553:49981, ack 1, win 893, options [nop,nop,TS val 3226611 ecr 2997095,mptcp dss ack 2168003474 seq 1134558597 subseq 48553 len 1428 csum 0x848e], length 1428
11:44:59.441964 IP 112.26.1.8.43791 > 112.26.1.1.38151: Flags [.], ack 44269, win 12137, options [nop,nop,TS val 2998140 ecr 3226479,nop,nop,sack 2 {48553:49981}{45697:47125},mptcp dss ack 1134527181], length 0
11:44:59.466931 IP 112.26.1.1.38151 > 112.26.1.8.43791: Flags [.], seq 58549:59977, ack 1, win 893, options [nop,nop,TS val 3227326 ecr 2997725,mptcp dss ack 2168003474 seq 1134585729 subseq 58549 len 1428 csum 0x5523], length 1428
11:44:59.493210 IP 112.26.1.1.38151 > 112.26.1.8.43791: Flags [.], seq 49981:51409, ack 1, win 893, options [nop,nop,TS val 3226611 ecr 2997095,mptcp dss ack 2168003474 seq 1134560025 subseq 49981 len 1428 csum 0x51a], length 1428
11:44:59.535203 IP 112.26.1.1.38151 > 112.26.1.8.43791: Flags [.], seq 59977:61405, ack 1, win 893, options [nop,nop,TS val 3227326 ecr 2997725,mptcp dss ack 2168003474 seq 1134587157 subseq 59977 len 1428 csum 0xf945], length 1428
11:44:59.540972 IP 112.26.1.8.43791 > 112.26.1.1.38151: Flags [.], ack 44269, win 12274, options [nop,nop,TS val 2998259 ecr 3226479,nop,nop,sack 2 {48553:51409}{45697:47125},mptcp dss ack 1134527181], length 0
11:44:59.569667 IP 112.26.1.1.38151 > 112.26.1.8.43791: Flags [.], seq 61405:62833, ack 1, win 893, options [nop,nop,TS val 3227326 ecr 2997725,mptcp dss ack 2168003474 seq 1134588585 subseq 61405 len 1428 csum 0x5e42], length 1428
11:44:59.594380 IP 112.26.1.1.38151 > 112.26.1.8.43791: Flags [.], seq 52837:54265, ack 1, win 893, options [nop,nop,TS val 3226611 ecr 2997095,mptcp dss ack 2168003474 seq 1134562881 subseq 52837 len 1428 csum 0x1eaf], length 1428
11:44:59.656329 IP 112.26.1.8.43791 > 112.26.1.1.38151: Flags [.], ack 44269, win 12410, options [nop,nop,TS val 2998367 ecr 3226479,nop,nop,sack 2 {52837:54265}{48553:51409},mptcp dss ack 1134527181], length 0
11:44:59.691814 IP 112.26.1.1.38151 > 112.26.1.8.43791: Flags [.], seq 54265:55693, ack 1, win 893, options [nop,nop,TS val 3226875 ecr 2997286,mptcp dss ack 2168003474 seq 1134572877 subseq 54265 len 1428 csum 0xe8f9], length 1428
11:44:59.759493 IP 112.26.1.8.43791 > 112.26.1.1.38151: Flags [.], ack 44269, win 12593, options [nop,nop,TS val 2998469 ecr 3226479,nop,nop,sack 2 {52837:55693}{48553:51409},mptcp dss ack 1134527181], length 0
11:44:59.812587 IP 112.26.1.1.38151 > 112.26.1.8.43791: Flags [.], seq 55693:57121, ack 1, win 893, options [nop,nop,TS val 3226875 ecr 2997286,mptcp dss ack 2168003474 seq 1134574305 subseq 55693 len 1428 csum 0x11d6], length 1428
11:44:59.872263 IP 112.26.1.1.38151 > 112.26.1.8.43791: Flags [.], seq 44269:45697, ack 1, win 893, options [nop,nop,TS val 3227733 ecr 2998140,mptcp dss ack 2168003474 seq 1134552885 subseq 44269 len 1428 csum 0xc2dc], length 1428
11:44:59.904868 IP 112.26.1.1.38151 > 112.26.1.8.43791: Flags [.], seq 57121:58549, ack 1, win 893, options [nop,nop,TS val 3227039 ecr 2997449,mptcp dss ack 2168003474 seq 1134578589 subseq 57121 len 1428 csum 0xe42f], length 1428
11:44:59.933711 IP 112.26.1.1.38151 > 112.26.1.8.43791: Flags [.], seq 47125:48553, ack 1, win 893, options [nop,nop,TS val 3227733 ecr 2998140,mptcp dss ack 2168003474 seq 1134557169 subseq 47125 len 1428 csum 0x2ac8], length 1428
11:44:59.957398 IP 112.26.1.8.43791 > 112.26.1.1.38151: Flags [.], ack 44269, win 12684, options [nop,nop,TS val 2998589 ecr 3226479,nop,nop,sack 2 {52837:57121}{48553:51409},mptcp dss ack 1134527181], length 0
11:45:00.028264 IP 112.26.1.8.43791 > 112.26.1.1.38151: Flags [.], ack 44269, win 12821, options [nop,nop,TS val 2998682 ecr 3226479,nop,nop,sack 2 {52837:58549}{48553:51409},mptcp dss ack 1134552885], length 0
11:45:00.070333 IP 112.26.1.1.38151 > 112.26.1.8.43791: Flags [.], seq 58549:59977, ack 1, win 893, options [nop,nop,TS val 3227326 ecr 2997725,mptcp dss ack 2168003474 seq 1134585729 subseq 58549 len 1428 csum 0x5523], length 1428
11:45:00.262102 IP 112.26.1.1.38151 > 112.26.1.8.43791: Flags [.], seq 59977:61405, ack 1, win 893, options [nop,nop,TS val 3227326 ecr 2997725,mptcp dss ack 2168003474 seq 1134587157 subseq 59977 len 1428 csum 0xf945], length 1428
11:45:00.279941 IP 112.26.1.1.38151 > 112.26.1.8.43791: Flags [.], seq 51409:52837, ack 1, win 893, options [nop,nop,TS val 3228105 ecr 2998469,mptcp dss ack 2168003474 seq 1134561453 subseq 51409 len 1428 csum 0x4716], length 1428
11:45:00.300196 IP 112.26.1.1.38151 > 112.26.1.8.43791: Flags [.], seq 61405:62833, ack 1, win 893, options [nop,nop,TS val 3227326 ecr 2997725,mptcp dss ack 2168003474 seq 1134588585 subseq 61405 len 1428 csum 0x5e42], length 1428
11:45:00.386060 IP 112.26.1.8.43791 > 112.26.1.1.38151: Flags [.], ack 44269, win 12958, options [nop,nop,TS val 2998847 ecr 3226479,nop,nop,sack 2 {52837:59977}{48553:51409},mptcp dss ack 1134552885], length 0
11:45:00.482711 IP 112.26.1.1.38151 > 112.26.1.8.43791: Flags [.], seq 62833:64261, ack 1, win 893, options [nop,nop,TS val 3228342 ecr 2998589,mptcp dss ack 2168003474 seq 1134618573 subseq 62833 len 1428 csum 0xc87e], length 1428
11:45:00.532685 IP 112.26.1.8.43791 > 112.26.1.1.38151: Flags [.], ack 44269, win 13140, options [nop,nop,TS val 2999033 ecr 3226479,nop,nop,sack 2 {52837:61405}{48553:51409},mptcp dss ack 1134552885], length 0
11:45:00.548973 IP 112.26.1.1.38151 > 112.26.1.8.43791: Flags [.], seq 64261:65689, ack 1, win 893, options [nop,nop,TS val 3228353 ecr 2998682,mptcp dss ack 2168003474 seq 1134620001 subseq 64261 len 1428 csum 0xcc37], length 1428
11:45:00.559125 IP 112.26.1.8.43791 > 112.26.1.1.38151: Flags [.], ack 44269, win 13186, options [nop,nop,TS val 2999077 ecr 3226479,nop,nop,sack 2 {52837:62833}{48553:51409},mptcp dss ack 1134552885], length 0
11:45:00.607789 IP 112.26.1.1.38151 > 112.26.1.8.43791: Flags [.], seq 44269:45697, ack 1, win 893, options [nop,nop,TS val 3227733 ecr 2998140,mptcp dss ack 2168003474 seq 1134552885 subseq 44269 len 1428 csum 0xc2dc], length 1428
11:45:00.691881 IP 112.26.1.1.38151 > 112.26.1.8.43791: Flags [.], seq 47125:48553, ack 1, win 893, options [nop,nop,TS val 3227733 ecr 2998140,mptcp dss ack 2168003474 seq 1134557169 subseq 47125 len 1428 csum 0x2ac8], length 1428
11:45:00.735541 IP 112.26.1.8.43791 > 112.26.1.1.38151: Flags [.], ack 47125, win 13505, options [nop,nop,TS val 2999385 ecr 3227733,nop,nop,sack 2 {52837:62833}{48553:51409},mptcp dss ack 1134557169], length 0
11:45:00.751365 IP 112.26.1.1.38151 > 112.26.1.8.43791: Flags [.], seq 65689:67117, ack 1, win 893, options [nop,nop,TS val 3228593 ecr 2998847,mptcp dss ack 2168003474 seq 1134632853 subseq 65689 len 1428 csum 0x6a23], length 1428
11:45:00.780542 IP 112.26.1.1.38151 > 112.26.1.8.43791: Flags [.], seq 51409:52837, ack 1, win 893, options [nop,nop,TS val 3228105 ecr 2998469,mptcp dss ack 2168003474 seq 1134561453 subseq 51409 len 1428 csum 0x4716], length 1428
11:45:00.831067 IP 112.26.1.8.43791 > 112.26.1.1.38151: Flags [.], ack 51409, win 13597, options [nop,nop,TS val 2999469 ecr 3227733,nop,nop,sack 1 {52837:62833},mptcp dss ack 1134561453], length 0
11:45:00.860221 IP 112.26.1.1.38151 > 112.26.1.8.43791: Flags [.], seq 67117:68545, ack 1, win 893, options [nop,nop,TS val 3228717 ecr 2999033,mptcp dss ack 2168003474 seq 1134635709 subseq 67117 len 1428 csum 0x7ca3], length 1428
11:45:00.912736 IP 112.26.1.8.43791 > 112.26.1.1.38151: Flags [.], ack 62833, win 13734, options [nop,nop,TS val 2999553 ecr 3228105,mptcp dss ack 1134575733], length 0
11:45:00.944333 IP 112.26.1.1.38151 > 112.26.1.8.43791: Flags [.], seq 62833:64261, ack 1, win 893, options [nop,nop,TS val 3228342 ecr 2998589,mptcp dss ack 2168003474 seq 1134618573 subseq 62833 len 1428 csum 0xc87e], length 1428
11:45:01.014181 IP 112.26.1.1.38151 > 112.26.1.8.43791: Flags [.], seq 64261:65689, ack 1, win 893, options [nop,nop,TS val 3228353 ecr 2998682,mptcp dss ack 2168003474 seq 1134620001 subseq 64261 len 1428 csum 0xcc37], length 1428
11:45:01.031220 IP 112.26.1.1.38151 > 112.26.1.8.43791: Flags [.], seq 68545:69973, ack 1, win 893, options [nop,nop,TS val 3228891 ecr 2999077,mptcp dss ack 2168003474 seq 1134641421 subseq 68545 len 1428 csum 0xf1fc], length 1428
11:45:01.058440 IP 112.26.1.8.43791 > 112.26.1.1.38151: Flags [.], ack 64261, win 13962, options [nop,nop,TS val 2999721 ecr 3228342,mptcp dss ack 1134575733], length 0
11:45:01.095386 IP 112.26.1.1.38151 > 112.26.1.8.43791: Flags [.], seq 69973:71401, ack 1, win 893, options [nop,nop,TS val 3228906 ecr 2999385,mptcp dss ack 2168003474 seq 1134644277 subseq 69973 len 1428 csum 0x79e2], length 1428
11:45:01.127434 IP 112.26.1.8.43791 > 112.26.1.1.38151: Flags [.], ack 65689, win 14053, options [nop,nop,TS val 2999791 ecr 3228353,mptcp dss ack 1134575733], length 0
11:45:01.154627 IP 112.26.1.1.38151 > 112.26.1.8.43791: Flags [.], seq 65689:67117, ack 1, win 893, options [nop,nop,TS val 3228593 ecr 2998847,mptcp dss ack 2168003474 seq 1134632853 subseq 65689 len 1428 csum 0x6a23], length 1428
11:45:01.177943 IP 112.26.1.1.38151 > 112.26.1.8.43791: Flags [.], seq 71401:72829, ack 1, win 893, options [nop,nop,TS val 3228906 ecr 2999385,mptcp dss ack 2168003474 seq 1134645705 subseq 71401 len 1428 csum 0x28f1], length 1428
11:45:01.208975 IP 112.26.1.8.43791 > 112.26.1.1.38151: Flags [.], ack 67117, win 14190, options [nop,nop,TS val 2999931 ecr 3228593,mptcp dss ack 1134580017], length 0
11:45:01.249338 IP 112.26.1.1.38151 > 112.26.1.8.43791: Flags [.], seq 72829:74257, ack 1, win 893, options [nop,nop,TS val 3229074 ecr 2999469,mptcp dss ack 2168003474 seq 1134651417 subseq 72829 len 1428 csum 0x5910], length 1428
11:45:01.291317 IP 112.26.1.1.38151 > 112.26.1.8.43791: Flags [.], seq 67117:68545, ack 1, win 893, options [nop,nop,TS val 3228717 ecr 2999033,mptcp dss ack 2168003474 seq 1134635709 subseq 67117 len 1428 csum 0x7ca3], length 1428
11:45:01.324607 IP 112.26.1.8.43791 > 112.26.1.1.38151: Flags [.], ack 68545, win 14327, options [nop,nop,TS val 3000056 ecr 3228717,mptcp dss ack 1134580017], length 0
11:45:01.345207 IP 112.26.1.1.38151 > 112.26.1.8.43791: Flags [.], seq 74257:75685, ack 1, win 893, options [nop,nop,TS val 3229205 ecr 2999553,mptcp dss ack 2168003474 seq 1134655701 subseq 74257 len 1428 csum 0x2673], length 1428
11:45:01.416712 IP 112.26.1.1.38151 > 112.26.1.8.43791: Flags [.], seq 68545:69973, ack 1, win 893, options [nop,nop,TS val 3228891 ecr 2999077,mptcp dss ack 2168003474 seq 1134641421 subseq 68545 len 1428 csum 0xf1fc], length 1428
11:45:01.467382 IP 112.26.1.8.43791 > 112.26.1.1.38151: Flags [.], ack 69973, win 14464, options [nop,nop,TS val 3000193 ecr 3228891,mptcp dss ack 1134580017], length 0
11:45:01.487206 IP 112.26.1.1.38151 > 112.26.1.8.43791: Flags [.], seq 75685:77113, ack 1, win 893, options [nop,nop,TS val 3229346 ecr 2999721,mptcp dss ack 2168003474 seq 1134662841 subseq 75685 len 1428 csum 0x6cc2], length 1428
11:45:01.542486 IP 112.26.1.1.38151 > 112.26.1.8.43791: Flags [.], seq 69973:71401, ack 1, win 893, options [nop,nop,TS val 3228906 ecr 2999385,mptcp dss ack 2168003474 seq 1134644277 subseq 69973 len 1428 csum 0x79e2], length 1428
11:45:01.635931 IP 112.26.1.8.43791 > 112.26.1.1.38151: Flags [.], ack 71401, win 14600, options [nop,nop,TS val 3000319 ecr 3228906,mptcp dss ack 1134580017], length 0
11:45:01.649466 IP 112.26.1.1.38151 > 112.26.1.8.43791: Flags [.], seq 77113:78541, ack 1, win 893, options [nop,nop,TS val 3229505 ecr 2999791,mptcp dss ack 2168003474 seq 1134668553 subseq 77113 len 1428 csum 0x3eba], length 1428
11:45:01.700887 IP 112.26.1.1.38151 > 112.26.1.8.43791: Flags [.], seq 71401:72829, ack 1, win 893, options [nop,nop,TS val 3228906 ecr 2999385,mptcp dss ack 2168003474 seq 1134645705 subseq 71401 len 1428 csum 0x28f1], length 1428
11:45:01.724310 IP 112.26.1.1.38151 > 112.26.1.8.43791: Flags [.], seq 78541:79969, ack 1, win 893, options [nop,nop,TS val 3229583 ecr 2999931,mptcp dss ack 2168003474 seq 1134671409 subseq 78541 len 1428 csum 0x18b4], length 1428
11:45:01.764048 IP 112.26.1.8.43791 > 112.26.1.1.38151: Flags [.], ack 72829, win 14783, options [nop,nop,TS val 3000477 ecr 3228906,mptcp dss ack 1134580017], length 0
11:45:01.780802 IP 112.26.1.1.38151 > 112.26.1.8.43791: Flags [.], seq 79969:81397, ack 1, win 893, options [nop,nop,TS val 3229583 ecr 2999931,mptcp dss ack 2168003474 seq 1134672837 subseq 79969 len 1428 csum 0xa833], length 1428
11:45:01.835047 IP 112.26.1.1.38151 > 112.26.1.8.43791: Flags [.], seq 74257:75685, ack 1, win 893, options [nop,nop,TS val 3229205 ecr 2999553,mptcp dss ack 2168003474 seq 1134655701 subseq 74257 len 1428 csum 0x2673], length 1428
11:45:01.860743 IP 112.26.1.1.38151 > 112.26.1.8.43791: Flags [.], seq 81397:82825, ack 1, win 893, options [nop,nop,TS val 3229657 ecr 3000056,mptcp dss ack 2168003474 seq 1134675693 subseq 81397 len 1428 csum 0x4803], length 1428
11:45:01.886100 IP 112.26.1.8.43791 > 112.26.1.1.38151: Flags [.], ack 72829, win 14965, options [nop,nop,TS val 3000611 ecr 3228906,nop,nop,sack 1 {74257:75685},mptcp dss ack 1134580017], length 0
11:45:01.939030 IP 112.26.1.1.38151 > 112.26.1.8.43791: Flags [.], seq 82825:84253, ack 1, win 893, options [nop,nop,TS val 3229760 ecr 3000193,mptcp dss ack 2168003474 seq 1134679977 subseq 82825 len 1428 csum 0x4ba9], length 1428
11:45:01.955305 IP 112.26.1.1.38151 > 112.26.1.8.43791: Flags [.], seq 75685:77113, ack 1, win 893, options [nop,nop,TS val 3229346 ecr 2999721,mptcp dss ack 2168003474 seq 1134662841 subseq 75685 len 1428 csum 0x6cc2], length 1428
11:45:02.002992 IP 112.26.1.8.43791 > 112.26.1.1.38151: Flags [.], ack 72829, win 15102, options [nop,nop,TS val 3000724 ecr 3228906,nop,nop,sack 1 {74257:77113},mptcp dss ack 1134580017], length 0
11:45:02.026744 IP 112.26.1.1.38151 > 112.26.1.8.43791: Flags [.], seq 84253:85681, ack 1, win 893, options [nop,nop,TS val 3229834 ecr 3000319,mptcp dss ack 2168003474 seq 1134681405 subseq 84253 len 1428 csum 0x572d], length 1428
