11:44:54.494785 IP 112.26.1.8.43791 > 112.26.1.1.38151: Flags [S], seq 3649387865, win 65535, options [mss 1460,sackOK,TS val 2993265 ecr 0,nop,wscale 6,mptcp join id 3 token 0x3c5625f6 nonce 0x1fe1cd71], length 0
11:44:54.495090 IP 112.26.1.8.43791 > 112.26.1.1.38151: Flags [S], seq 3649387865, win 65535, options [mss 1460,sackOK,TS val 2993265 ecr 0,nop,wscale 6,mptcp join id 3 token 0x3c5625f6 nonce 0x1fe1cd71], length 0
11:44:54.500313 IP 112.26.1.8.43791 > 112.26.1.1.38151: Flags [S], seq 3649387865, win 65535, options [mss 1460,sackOK,TS val 2993265 ecr 0,nop,wscale 6,mptcp join id 3 token 0x3c5625f6 nonce 0x1fe1cd71], length 0
11:44:54.651669 IP 112.26.1.1.38151 > 112.26.1.8.43791: Flags [S.], seq 4004470037, ack 3649387866, win 28560, options [mss 1460,sackOK,TS val 3222362 ecr 2993265,nop,wscale 7,mptcp join id 3 hmac 0x3256875f4c329db nonce 0xea93cb59], length 0
11:44:54.651860 IP 112.26.1.1.38151 > 112.26.1.8.43791: Flags [S.], seq 4004470037, ack 3649387866, win 28560, options [mss 1460,sackOK,TS val 3222362 ecr 2993265,nop,wscale 7,mptcp join id 3 hmac 0x3256875f4c329db nonce 0xea93cb59], length 0
11:44:54.659643 IP 112.26.1.8.43791 > 112.26.1.1.38151: Flags [.], ack 1, win 6935, options [nop,nop,TS val 2993431 ecr 3222362,mptcp join hmac 0x51545920d2d732ac6a6f0dacd314dd6e9039c111], length 0
11:44:54.659908 IP 112.26.1.8.43791 > 112.26.1.1.38151: Flags [.], ack 1, win 6935, options [nop,nop,TS val 2993431 ecr 3222362,mptcp join hmac 0x51545920d2d732ac6a6f0dacd314dd6e9039c111], length 0
11:44:54.777451 IP 112.26.1.8.43791 > 112.26.1.1.38151: Flags [.], ack 1, win 6935, options [nop,nop,TS val 2993431 ecr 3222362,mptcp join hmac 0x51545920d2d732ac6a6f0dacd314dd6e9039c111], length 0
11:44:54.876237 IP 112.26.1.1.38151 > 112.26.1.8.43791: Flags [.], ack 1, win 893, options [nop,nop,TS val 3222640 ecr 2993431,mptcp dss ack 2168003474], length 0
11:44:54.876421 IP 112.26.1.1.38151 > 112.26.1.8.43791: Flags [.], ack 1, win 893, options [nop,nop,TS val 3222640 ecr 2993431,mptcp dss ack 2168003474], length 0
11:44:54.924230 IP 112.26.1.1.38151 > 112.26.1.8.43791: Flags [.], seq 1:1429, ack 1, win 893, options [nop,nop,TS val 3222640 ecr 2993431,mptcp dss ack 2168003474 seq 1134448641 subseq 1 len 1428 csum 0xc16e], length 1428
11:44:54.924431 IP 112.26.1.1.38151 > 112.26.1.8.43791: Flags [.], seq 1:1429, ack 1, win 893, options [nop,nop,TS val 3222640 ecr 2993431,mptcp dss ack 2168003474 seq 1134448641 subseq 1 len 1428 csum 0xc16e], length 1428
11:44:54.952353 IP 112.26.1.8.43791 > 112.26.1.1.38151: Flags [.], ack 1429, win 7164, options [nop,nop,TS val 2993727 ecr 3222640,mptcp dss ack 1134415797], length 0
11:44:54.952670 IP 112.26.1.8.43791 > 112.26.1.1.38151: Flags [.], ack 1429, win 7164, options [nop,nop,TS val 2993727 ecr 3222640,mptcp dss ack 1134415797], length 0
11:44:55.124192 IP 112.26.1.1.38151 > 112.26.1.8.43791: Flags [.], seq 1429:2857, ack 1, win 893, options [nop,nop,TS val 3222640 ecr 2993431,mptcp dss ack 2168003474 seq 1134450069 subseq 1429 len 1428 csum 0x7037], length 1428
11:44:55.124388 IP 112.26.1.1.38151 > 112.26.1.8.43791: Flags [.], seq 1429:2857, ack 1, win 893, options [nop,nop,TS val 3222640 ecr 2993431,mptcp dss ack 2168003474 seq 1134450069 subseq 1429 len 1428 csum 0x7037], length 1428
11:44:55.145548 IP 112.26.1.8.43791 > 112.26.1.1.38151: Flags [.], ack 2857, win 7392, options [nop,nop,TS val 2993906 ecr 3222640,mptcp dss ack 1134421509], length 0
11:44:55.145831 IP 112.26.1.8.43791 > 112.26.1.1.38151: Flags [.], ack 2857, win 7392, options [nop,nop,TS val 2993906 ecr 3222640,mptcp dss ack 1134421509], length 0
11:44:55.227446 IP 112.26.1.1.38151 > 112.26.1.8.43791: Flags [.], seq 2857:4285, ack 1, win 893, options [nop,nop,TS val 3222641 ecr 2993431,mptcp dss ack 2168003474 seq 1134451497 subseq 2857 len 1428 csum 0xe925], length 1428
11:44:55.227664 IP 112.26.1.1.38151 > 112.26.1.8.43791: Flags [.], seq 2857:4285, ack 1, win 893, options [nop,nop,TS val 3222641 ecr 2993431,mptcp dss ack 2168003474 seq 1134451497 subseq 2857 len 1428 csum 0xe925], length 1428
11:44:55.277161 IP 112.26.1.1.38151 > 112.26.1.8.43791: Flags [.], seq 4285:5713, ack 1, win 893, options [nop,nop,TS val 3222641 ecr 2993431,mptcp dss ack 2168003474 seq 1134452925 subseq 4285 len 1428 csum 0xdf93], length 1428
11:44:55.277350 IP 112.26.1.1.38151 > 112.26.1.8.43791: Flags [.], seq 4285:5713, ack 1, win 893, options [nop,nop,TS val 3222641 ecr 2993431,mptcp dss ack 2168003474 seq 1134452925 subseq 4285 len 1428 csum 0xdf93], length 1428
11:44:55.307441 IP 112.26.1.8.43791 > 112.26.1.1.38151: Flags [.], ack 4285, win 7483, options [nop,nop,TS val 2994081 ecr 3222641,mptcp dss ack 1134421509], length 0
11:44:55.307674 IP 112.26.1.8.43791 > 112.26.1.1.38151: Flags [.], ack 4285, win 7483, options [nop,nop,TS val 2994081 ecr 3222641,mptcp dss ack 1134421509], length 0
11:44:55.321995 IP 112.26.1.8.43791 > 112.26.1.1.38151: Flags [.], ack 1429, win 7164, options [nop,nop,TS val 2993727 ecr 3222640,mptcp dss ack 1134415797], length 0
11:44:55.395967 IP 112.26.1.8.43791 > 112.26.1.1.38151: Flags [.], ack 5713, win 7620, options [nop,nop,TS val 2994159 ecr 3222641,mptcp dss ack 1134422937], length 0
11:44:55.396187 IP 112.26.1.8.43791 > 112.26.1.1.38151: Flags [.], ack 5713, win 7620, options [nop,nop,TS val 2994159 ecr 3222641,mptcp dss ack 1134422937], length 0
11:44:55.414525 IP 112.26.1.1.38151 > 112.26.1.8.43791: Flags [.], seq 5713:7141, ack 1, win 893, options [nop,nop,TS val 3222641 ecr 2993431,mptcp dss ack 2168003474 seq 1134454353 subseq 5713 len 1428 csum 0xe43c], length 1428
11:44:55.414768 IP 112.26.1.1.38151 > 112.26.1.8.43791: Flags [.], seq 5713:7141, ack 1, win 893, options [nop,nop,TS val 3222641 ecr 2993431,mptcp dss ack 2168003474 seq 1134454353 subseq 5713 len 1428 csum 0xe43c], length 1428
11:44:55.553778 IP 112.26.1.8.43791 > 112.26.1.1.38151: Flags [.], ack 7141, win 7711, options [nop,nop,TS val 2994315 ecr 3222641,mptcp dss ack 1134422937], length 0
11:44:55.554068 IP 112.26.1.8.43791 > 112.26.1.1.38151: Flags [.], ack 7141, win 7711, options [nop,nop,TS val 2994315 ecr 3222641,mptcp dss ack 1134422937], length 0
11:44:55.570228 IP 112.26.1.1.38151 > 112.26.1.8.43791: Flags [.], seq 7141:8569, ack 1, win 893, options [nop,nop,TS val 3222641 ecr 2993431,mptcp dss ack 2168003474 seq 1134455781 subseq 7141 len 1428 csum 0x2703], length 1428
11:44:55.570458 IP 112.26.1.1.38151 > 112.26.1.8.43791: Flags [.], seq 7141:8569, ack 1, win 893, options [nop,nop,TS val 3222641 ecr 2993431,mptcp dss ack 2168003474 seq 1134455781 subseq 7141 len 1428 csum 0x2703], length 1428
11:44:55.621202 IP 112.26.1.1.38151 > 112.26.1.8.43791: Flags [.], seq 8569:9997, ack 1, win 893, options [nop,nop,TS val 3222641 ecr 2993431,mptcp dss ack 2168003474 seq 1134457209 subseq 8569 len 1428 csum 0x1776], length 1428
11:44:55.621393 IP 112.26.1.1.38151 > 112.26.1.8.43791: Flags [.], seq 8569:9997, ack 1, win 893, options [nop,nop,TS val 3222641 ecr 2993431,mptcp dss ack 2168003474 seq 1134457209 subseq 8569 len 1428 csum 0x1776], length 1428
11:44:55.691045 IP 112.26.1.1.38151 > 112.26.1.8.43791: Flags [.], seq 9997:11425, ack 1, win 893, options [nop,nop,TS val 3222641 ecr 2993431,mptcp dss ack 2168003474 seq 1134458637 subseq 9997 len 1428 csum 0xa71d], length 1428
11:44:55.691242 IP 112.26.1.1.38151 > 112.26.1.8.43791: Flags [.], seq 9997:11425, ack 1, win 893, options [nop,nop,TS val 3222641 ecr 2993431,mptcp dss ack 2168003474 seq 1134458637 subseq 9997 len 1428 csum 0xa71d], length 1428
11:44:55.703856 IP 112.26.1.8.43791 > 112.26.1.1.38151: Flags [.], ack 8569, win 7894, options [nop,nop,TS val 2994480 ecr 3222641,mptcp dss ack 1134424365], length 0
11:44:55.704052 IP 112.26.1.8.43791 > 112.26.1.1.38151: Flags [.], ack 8569, win 7894, options [nop,nop,TS val 2994480 ecr 3222641,mptcp dss ack 1134424365], length 0
11:44:55.768116 IP 112.26.1.8.43791 > 112.26.1.1.38151: Flags [.], ack 2857, win 7392, options [nop,nop,TS val 2993906 ecr 3222640,mptcp dss ack 1134421509], length 0
11:44:55.789883 IP 112.26.1.8.43791 > 112.26.1.1.38151: Flags [.], ack 9997, win 8076, options [nop,nop,TS val 2994566 ecr 3222641,mptcp dss ack 1134424365], length 0
11:44:55.790110 IP 112.26.1.8.43791 > 112.26.1.1.38151: Flags [.], ack 9997, win 8076, options [nop,nop,TS val 2994566 ecr 3222641,mptcp dss ack 1134424365], length 0
11:44:55.836371 IP 112.26.1.8.43791 > 112.26.1.1.38151: Flags [.], ack 11425, win 8122, options [nop,nop,TS val 2994610 ecr 3222641,mptcp dss ack 1134424365], length 0
11:44:55.836622 IP 112.26.1.8.43791 > 112.26.1.1.38151: Flags [.], ack 11425, win 8122, options [nop,nop,TS val 2994610 ecr 3222641,mptcp dss ack 1134424365], length 0
11:44:55.935783 IP 112.26.1.8.43791 > 112.26.1.1.38151: Flags [.], ack 4285, win 7483, options [nop,nop,TS val 2994081 ecr 3222641,mptcp dss ack 1134421509], length 0
11:44:56.009811 IP 112.26.1.8.43791 > 112.26.1.1.38151: Flags [.], ack 7141, win 7711, options [nop,nop,TS val 2994315 ecr 3222641,mptcp dss ack 1134422937], length 0
11:44:56.079712 IP 112.26.1.1.38151 > 112.26.1.8.43791: Flags [.], seq 17137:18565, ack 1, win 893, options [nop,nop,TS val 3223631 ecr 2993906,mptcp dss ack 2168003474 seq 1134491481 subseq 17137 len 1428 csum 0x44d1], length 1428
11:44:56.079905 IP 112.26.1.1.38151 > 112.26.1.8.43791: Flags [.], seq 17137:18565, ack 1, win 893, options [nop,nop,TS val 3223631 ecr 2993906,mptcp dss ack 2168003474 seq 1134491481 subseq 17137 len 1428 csum 0x44d1], length 1428
11:44:56.084994 IP 112.26.1.8.43791 > 112.26.1.1.38151: Flags [.], ack 11425, win 8395, options [nop,nop,TS val 2994860 ecr 3222641,nop,nop,sack 1 {17137:18565},mptcp dss ack 1134424365], length 0
11:44:56.085212 IP 112.26.1.8.43791 > 112.26.1.1.38151: Flags [.], ack 11425, win 8395, options [nop,nop,TS val 2994860 ecr 3222641,nop,nop,sack 1 {17137:18565},mptcp dss ack 1134424365], length 0
11:44:56.191088 IP 112.26.1.1.38151 > 112.26.1.8.43791: Flags [.], seq 18565:19993, ack 1, win 893, options [nop,nop,TS val 3223631 ecr 2993906,mptcp dss ack 2168003474 seq 1134492909 subseq 18565 len 1428 csum 0x14e0], length 1428
11:44:56.191316 IP 112.26.1.1.38151 > 112.26.1.8.43791: Flags [.], seq 18565:19993, ack 1, win 893, options [nop,nop,TS val 3223631 ecr 2993906,mptcp dss ack 2168003474 seq 1134492909 subseq 18565 len 1428 csum 0x14e0], length 1428
11:44:56.206210 IP 112.26.1.8.43791 > 112.26.1.1.38151: Flags [.], ack 11425, win 8532, options [nop,nop,TS val 2994972 ecr 3222641,nop,nop,sack 1 {17137:19993},mptcp dss ack 1134424365], length 0
11:44:56.206512 IP 112.26.1.8.43791 > 112.26.1.1.38151: Flags [.], ack 11425, win 8532, options [nop,nop,TS val 2994972 ecr 3222641,nop,nop,sack 1 {17137:19993},mptcp dss ack 1134424365], length 0
11:44:56.274025 IP 112.26.1.8.43791 > 112.26.1.1.38151: Flags [.], ack 8569, win 7894, options [nop,nop,TS val 2994480 ecr 3222641,mptcp dss ack 1134424365], length 0
11:44:56.344212 IP 112.26.1.8.43791 > 112.26.1.1.38151: Flags [.], ack 9997, win 8076, options [nop,nop,TS val 2994566 ecr 3222641,mptcp dss ack 1134424365], length 0
11:44:56.384741 IP 112.26.1.8.43791 > 112.26.1.1.38151: Flags [.], ack 11425, win 8122, options [nop,nop,TS val 2994610 ecr 3222641,mptcp dss ack 1134424365], length 0
11:44:56.432460 IP 112.26.1.1.38151 > 112.26.1.8.43791: Flags [.], seq 19993:21421, ack 1, win 893, options [nop,nop,TS val 3223798 ecr 2994081,mptcp dss ack 2168003474 seq 1134495765 subseq 19993 len 1428 csum 0x948e], length 1428
11:44:56.432705 IP 112.26.1.1.38151 > 112.26.1.8.43791: Flags [.], seq 19993:21421, ack 1, win 893, options [nop,nop,TS val 3223798 ecr 2994081,mptcp dss ack 2168003474 seq 1134495765 subseq 19993 len 1428 csum 0x948e], length 1428
11:44:56.440534 IP 112.26.1.8.43791 > 112.26.1.1.38151: Flags [.], ack 11425, win 8806, options [nop,nop,TS val 2995212 ecr 3222641,nop,nop,sack 1 {17137:21421},mptcp dss ack 1134425793], length 0
11:44:56.440739 IP 112.26.1.8.43791 > 112.26.1.1.38151: Flags [.], ack 11425, win 8806, options [nop,nop,TS val 2995212 ecr 3222641,nop,nop,sack 1 {17137:21421},mptcp dss ack 1134425793], length 0
11:44:56.513769 IP 112.26.1.1.38151 > 112.26.1.8.43791: Flags [.], seq 22849:24277, ack 1, win 893, options [nop,nop,TS val 3223872 ecr 2994315,mptcp dss ack 2168003474 seq 1134500049 subseq 22849 len 1428 csum 0x9e0d], length 1428
11:44:56.513983 IP 112.26.1.1.38151 > 112.26.1.8.43791: Flags [.], seq 22849:24277, ack 1, win 893, options [nop,nop,TS val 3223872 ecr 2994315,mptcp dss ack 2168003474 seq 1134500049 subseq 22849 len 1428 csum 0x9e0d], length 1428
11:44:56.594895 IP 112.26.1.8.43791 > 112.26.1.1.38151: Flags [.], ack 11425, win 8943, options [nop,nop,TS val 2995371 ecr 3222641,nop,nop,sack 2 {22849:24277}{17137:21421},mptcp dss ack 1134427221], length 0
11:44:56.595153 IP 112.26.1.8.43791 > 112.26.1.1.38151: Flags [.], ack 11425, win 8943, options [nop,nop,TS val 2995371 ecr 3222641,nop,nop,sack 2 {22849:24277}{17137:21421},mptcp dss ack 1134427221], length 0
11:44:56.676921 IP 112.26.1.8.43791 > 112.26.1.1.38151: Flags [.], ack 11425, win 8395, options [nop,nop,TS val 2994860 ecr 3222641,nop,nop,sack 1 {17137:18565},mptcp dss ack 1134424365], length 0
11:44:56.720417 IP 112.26.1.1.38151 > 112.26.1.8.43791: Flags [.], seq 27133:28561, ack 1, win 893, options [nop,nop,TS val 3223872 ecr 2994315,mptcp dss ack 2168003474 seq 1134504333 subseq 27133 len 1428 csum 0x1043], length 1428
11:44:56.720652 IP 112.26.1.1.38151 > 112.26.1.8.43791: Flags [.], seq 27133:28561, ack 1, win 893, options [nop,nop,TS val 3223872 ecr 2994315,mptcp dss ack 2168003474 seq 1134504333 subseq 27133 len 1428 csum 0x1043], length 1428
11:44:56.732928 IP 112.26.1.8.43791 > 112.26.1.1.38151: Flags [.], ack 11425, win 9080, options [nop,nop,TS val 2995500 ecr 3222641,nop,nop,sack 2 {27133:28561}{22849:24277},mptcp dss ack 1134427221], length 0
11:44:56.733172 IP 112.26.1.8.43791 > 112.26.1.1.38151: Flags [.], ack 11425, win 9080, options [nop,nop,TS val 2995500 ecr 3222641,nop,nop,sack 2 {27133:28561}{22849:24277},mptcp dss ack 1134427221], length 0
11:44:56.810736 IP 112.26.1.1.38151 > 112.26.1.8.43791: Flags [.], seq 28561:29989, ack 1, win 893, options [nop,nop,TS val 3224136 ecr 2994480,mptcp dss ack 2168003474 seq 1134438645 subseq 28561 len 1428 csum 0x4efa], length 1428
11:44:56.811082 IP 112.26.1.1.38151 > 112.26.1.8.43791: Flags [.], seq 28561:29989, ack 1, win 893, options [nop,nop,TS val 3224136 ecr 2994480,mptcp dss ack 2168003474 seq 1134438645 subseq 28561 len 1428 csum 0x4efa], length 1428
11:44:56.834675 IP 112.26.1.8.43791 > 112.26.1.1.38151: Flags [.], ack 11425, win 9217, options [nop,nop,TS val 2995611 ecr 3222641,nop,nop,sack 2 {27133:29989}{22849:24277},mptcp dss ack 1134427221], length 0
11:44:56.834989 IP 112.26.1.8.43791 > 112.26.1.1.38151: Flags [.], ack 11425, win 9217, options [nop,nop,TS val 2995611 ecr 3222641,nop,nop,sack 2 {27133:29989}{22849:24277},mptcp dss ack 1134427221], length 0
11:44:56.890603 IP 112.26.1.1.38151 > 112.26.1.8.43791: Flags [.], seq 31417:32845, ack 1, win 893, options [nop,nop,TS val 3224207 ecr 2994566,mptcp dss ack 2168003474 seq 1134444357 subseq 31417 len 1428 csum 0x66ef], length 1428
11:44:56.890933 IP 112.26.1.1.38151 > 112.26.1.8.43791: Flags [.], seq 31417:32845, ack 1, win 893, options [nop,nop,TS val 3224207 ecr 2994566,mptcp dss ack 2168003474 seq 1134444357 subseq 31417 len 1428 csum 0x66ef], length 1428
11:44:56.925189 IP 112.26.1.8.43791 > 112.26.1.1.38151: Flags [.], ack 11425, win 9308, options [nop,nop,TS val 2995698 ecr 3222641,nop,nop,sack 2 {31417:32845}{27133:29989},mptcp dss ack 1134427221], length 0
11:44:56.925525 IP 112.26.1.8.43791 > 112.26.1.1.38151: Flags [.], ack 11425, win 9308, options [nop,nop,TS val 2995698 ecr 3222641,nop,nop,sack 2 {31417:32845}{27133:29989},mptcp dss ack 1134427221], length 0
11:44:56.938791 IP 112.26.1.1.38151 > 112.26.1.8.43791: Flags [.], seq 32845:34273, ack 1, win 893, options [nop,nop,TS val 3224207 ecr 2994566,mptcp dss ack 2168003474 seq 1134445785 subseq 32845 len 1428 csum 0x956a], length 1428
11:44:56.939058 IP 112.26.1.1.38151 > 112.26.1.8.43791: Flags [.], seq 32845:34273, ack 1, win 893, options [nop,nop,TS val 3224207 ecr 2994566,mptcp dss ack 2168003474 seq 1134445785 subseq 32845 len 1428 csum 0x956a], length 1428
11:44:56.999832 IP 112.26.1.8.43791 > 112.26.1.1.38151: Flags [.], ack 11425, win 8806, options [nop,nop,TS val 2995212 ecr 3222641,nop,nop,sack 1 {17137:21421},mptcp dss ack 1134425793], length 0
11:44:57.024483 IP 112.26.1.1.38151 > 112.26.1.8.43791: Flags [.], seq 34273:35701, ack 1, win 893, options [nop,nop,TS val 3224247 ecr 2994610,mptcp dss ack 2168003474 seq 1134481485 subseq 34273 len 1428 csum 0x609f], length 1428
11:44:57.024807 IP 112.26.1.1.38151 > 112.26.1.8.43791: Flags [.], seq 34273:35701, ack 1, win 893, options [nop,nop,TS val 3224247 ecr 2994610,mptcp dss ack 2168003474 seq 1134481485 subseq 34273 len 1428 csum 0x609f], length 1428
11:44:57.082009 IP 112.26.1.8.43791 > 112.26.1.1.38151: Flags [.], ack 11425, win 9490, options [nop,nop,TS val 2995857 ecr 3222641,nop,nop,sack 2 {31417:34273}{27133:29989},mptcp dss ack 1134427221], length 0
11:44:57.082287 IP 112.26.1.8.43791 > 112.26.1.1.38151: Flags [.], ack 11425, win 9490, options [nop,nop,TS val 2995857 ecr 3222641,nop,nop,sack 2 {31417:34273}{27133:29989},mptcp dss ack 1134427221], length 0
11:44:57.096850 IP 112.26.1.1.38151 > 112.26.1.8.43791: Flags [.], seq 35701:37129, ack 1, win 893, options [nop,nop,TS val 3224247 ecr 2994610,mptcp dss ack 2168003474 seq 1134482913 subseq 35701 len 1428 csum 0xa10c], length 1428
11:44:57.097130 IP 112.26.1.1.38151 > 112.26.1.8.43791: Flags [.], seq 35701:37129, ack 1, win 893, options [nop,nop,TS val 3224247 ecr 2994610,mptcp dss ack 2168003474 seq 1134482913 subseq 35701 len 1428 csum 0xa10c], length 1428
11:44:57.139215 IP 112.26.1.8.43791 > 112.26.1.1.38151: Flags [.], ack 11425, win 8943, options [nop,nop,TS val 2995371 ecr 3222641,nop,nop,sack 2 {22849:24277}{17137:21421},mptcp dss ack 1134427221], length 0
11:44:57.152936 IP 112.26.1.8.43791 > 112.26.1.1.38151: Flags [.], ack 11425, win 9582, options [nop,nop,TS val 2995925 ecr 3222641,nop,nop,sack 2 {31417:35701}{27133:29989},mptcp dss ack 1134427221], length 0
11:44:57.153214 IP 112.26.1.8.43791 > 112.26.1.1.38151: Flags [.], ack 11425, win 9582, options [nop,nop,TS val 2995925 ecr 3222641,nop,nop,sack 2 {31417:35701}{27133:29989},mptcp dss ack 1134427221], length 0
11:44:57.216553 IP 112.26.1.8.43791 > 112.26.1.1.38151: Flags [.], ack 11425, win 9080, options [nop,nop,TS val 2995500 ecr 3222641,nop,nop,sack 2 {27133:28561}{22849:24277},mptcp dss ack 1134427221], length 0
11:44:57.236199 IP 112.26.1.8.43791 > 112.26.1.1.38151: Flags [.], ack 11425, win 9719, options [nop,nop,TS val 2996012 ecr 3222641,nop,nop,sack 2 {31417:37129}{27133:29989},mptcp dss ack 1134427221], length 0
11:44:57.236506 IP 112.26.1.8.43791 > 112.26.1.1.38151: Flags [.], ack 11425, win 9719, options [nop,nop,TS val 2996012 ecr 3222641,nop,nop,sack 2 {31417:37129}{27133:29989},mptcp dss ack 1134427221], length 0
11:44:57.283900 IP 112.26.1.8.43791 > 112.26.1.1.38151: Flags [.], ack 11425, win 9217, options [nop,nop,TS val 2995611 ecr 3222641,nop,nop,sack 2 {27133:29989}{22849:24277},mptcp dss ack 1134427221], length 0
11:44:57.355286 IP 112.26.1.8.43791 > 112.26.1.1.38151: Flags [.], ack 11425, win 9308, options [nop,nop,TS val 2995698 ecr 3222641,nop,nop,sack 2 {31417:32845}{27133:29989},mptcp dss ack 1134427221], length 0
11:44:57.401787 IP 112.26.1.1.38151 > 112.26.1.8.43791: Flags [.], seq 12853:14281, ack 1, win 893, options [nop,nop,TS val 3225002 ecr 2995371,mptcp dss ack 2168003474 seq 1134461493 subseq 12853 len 1428 csum 0xdc0e], length 1428
11:44:57.402112 IP 112.26.1.1.38151 > 112.26.1.8.43791: Flags [.], seq 12853:14281, ack 1, win 893, options [nop,nop,TS val 3225002 ecr 2995371,mptcp dss ack 2168003474 seq 1134461493 subseq 12853 len 1428 csum 0xdc0e], length 1428
11:44:57.405613 IP 112.26.1.8.43791 > 112.26.1.1.38151: Flags [.], ack 11425, win 9855, options [nop,nop,TS val 2996181 ecr 3222641,nop,nop,sack 2 {12853:14281}{31417:37129},mptcp dss ack 1134438645], length 0
11:44:57.405918 IP 112.26.1.8.43791 > 112.26.1.1.38151: Flags [.], ack 11425, win 9855, options [nop,nop,TS val 2996181 ecr 3222641,nop,nop,sack 2 {12853:14281}{31417:37129},mptcp dss ack 1134438645], length 0
11:44:57.499897 IP 112.26.1.8.43791 > 112.26.1.1.38151: Flags [.], ack 11425, win 9490, options [nop,nop,TS val 2995857 ecr 3222641,nop,nop,sack 2 {31417:34273}{27133:29989},mptcp dss ack 1134427221], length 0
11:44:57.563715 IP 112.26.1.1.38151 > 112.26.1.8.43791: Flags [.], seq 14281:15709, ack 1, win 893, options [nop,nop,TS val 3225079 ecr 2995500,mptcp dss ack 2168003474 seq 1134472917 subseq 14281 len 1428 csum 0xc9c6], length 1428
11:44:57.563955 IP 112.26.1.1.38151 > 112.26.1.8.43791: Flags [.], seq 14281:15709, ack 1, win 893, options [nop,nop,TS val 3225079 ecr 2995500,mptcp dss ack 2168003474 seq 1134472917 subseq 14281 len 1428 csum 0xc9c6], length 1428
11:44:57.609502 IP 112.26.1.8.43791 > 112.26.1.1.38151: Flags [.], ack 11425, win 10084, options [nop,nop,TS val 2996344 ecr 3222641,nop,nop,sack 2 {12853:15709}{31417:37129},mptcp dss ack 1134438645], length 0
11:44:57.609898 IP 112.26.1.8.43791 > 112.26.1.1.38151: Flags [.], ack 11425, win 10084, options [nop,nop,TS val 2996344 ecr 3222641,nop,nop,sack 2 {12853:15709}{31417:37129},mptcp dss ack 1134438645], length 0
11:44:57.628064 IP 112.26.1.8.43791 > 112.26.1.1.38151: Flags [.], ack 11425, win 9582, options [nop,nop,TS val 2995925 ecr 3222641,nop,nop,sack 2 {31417:35701}{27133:29989},mptcp dss ack 1134427221], length 0
11:44:57.713455 IP 112.26.1.1.38151 > 112.26.1.8.43791: Flags [.], seq 15709:17137, ack 1, win 893, options [nop,nop,TS val 3225146 ecr 2995611,mptcp dss ack 2168003474 seq 1134474345 subseq 15709 len 1428 csum 0x48a5], length 1428
11:44:57.713750 IP 112.26.1.1.38151 > 112.26.1.8.43791: Flags [.], seq 15709:17137, ack 1, win 893, options [nop,nop,TS val 3225146 ecr 2995611,mptcp dss ack 2168003474 seq 1134474345 subseq 15709 len 1428 csum 0x48a5], length 1428
11:44:57.752330 IP 112.26.1.8.43791 > 112.26.1.1.38151: Flags [.], ack 11425, win 10266, options [nop,nop,TS val 2996527 ecr 3222641,nop,nop,sack 2 {12853:17137}{31417:37129},mptcp dss ack 1134438645], length 0
11:44:57.752625 IP 112.26.1.8.43791 > 112.26.1.1.38151: Flags [.], ack 11425, win 10266, options [nop,nop,TS val 2996527 ecr 3222641,nop,nop,sack 2 {12853:17137}{31417:37129},mptcp dss ack 1134438645], length 0
11:44:57.761802 IP 112.26.1.8.43791 > 112.26.1.1.38151: Flags [.], ack 11425, win 9719, options [nop,nop,TS val 2996012 ecr 3222641,nop,nop,sack 2 {31417:37129}{27133:29989},mptcp dss ack 1134427221], length 0
11:44:57.839243 IP 112.26.1.1.38151 > 112.26.1.8.43791: Flags [.], seq 21421:22849, ack 1, win 893, options [nop,nop,TS val 3225218 ecr 2995698,mptcp dss ack 2168003474 seq 1134497193 subseq 21421 len 1428 csum 0xb860], length 1428
11:44:57.839557 IP 112.26.1.1.38151 > 112.26.1.8.43791: Flags [.], seq 21421:22849, ack 1, win 893, options [nop,nop,TS val 3225218 ecr 2995698,mptcp dss ack 2168003474 seq 1134497193 subseq 21421 len 1428 csum 0xb860], length 1428
11:44:57.855621 IP 112.26.1.8.43791 > 112.26.1.1.38151: Flags [.], ack 11425, win 10357, options [nop,nop,TS val 2996631 ecr 3222641,nop,nop,sack 2 {21421:24277}{12853:17137},mptcp dss ack 1134438645], length 0
11:44:57.855896 IP 112.26.1.8.43791 > 112.26.1.1.38151: Flags [.], ack 11425, win 10357, options [nop,nop,TS val 2996631 ecr 3222641,nop,nop,sack 2 {21421:24277}{12853:17137},mptcp dss ack 1134438645], length 0
11:44:57.882059 IP 112.26.1.8.43791 > 112.26.1.1.38151: Flags [.], ack 11425, win 9855, options [nop,nop,TS val 2996181 ecr 3222641,nop,nop,sack 2 {12853:14281}{31417:37129},mptcp dss ack 1134438645], length 0
11:44:57.967762 IP 112.26.1.1.38151 > 112.26.1.8.43791: Flags [.], seq 24277:25705, ack 1, win 893, options [nop,nop,TS val 3225362 ecr 2995857,mptcp dss ack 2168003474 seq 1134501477 subseq 24277 len 1428 csum 0x9bf1], length 1428
11:44:57.968047 IP 112.26.1.1.38151 > 112.26.1.8.43791: Flags [.], seq 24277:25705, ack 1, win 893, options [nop,nop,TS val 3225362 ecr 2995857,mptcp dss ack 2168003474 seq 1134501477 subseq 24277 len 1428 csum 0x9bf1], length 1428
11:44:57.992401 IP 112.26.1.8.43791 > 112.26.1.1.38151: Flags [.], ack 11425, win 10494, options [nop,nop,TS val 2996767 ecr 3222641,nop,nop,sack 2 {21421:25705}{12853:17137},mptcp dss ack 1134438645], length 0
11:44:57.992690 IP 112.26.1.8.43791 > 112.26.1.1.38151: Flags [.], ack 11425, win 10494, options [nop,nop,TS val 2996767 ecr 3222641,nop,nop,sack 2 {21421:25705}{12853:17137},mptcp dss ack 1134438645], length 0
11:44:58.049769 IP 112.26.1.1.38151 > 112.26.1.8.43791: Flags [.], seq 25705:27133, ack 1, win 893, options [nop,nop,TS val 3225490 ecr 2995925,mptcp dss ack 2168003474 seq 1134502905 subseq 25705 len 1428 csum 0x4c22], length 1428
11:44:58.050048 IP 112.26.1.1.38151 > 112.26.1.8.43791: Flags [.], seq 25705:27133, ack 1, win 893, options [nop,nop,TS val 3225490 ecr 2995925,mptcp dss ack 2168003474 seq 1134502905 subseq 25705 len 1428 csum 0x4c22], length 1428
11:44:58.096500 IP 112.26.1.8.43791 > 112.26.1.1.38151: Flags [.], ack 11425, win 10631, options [nop,nop,TS val 2996871 ecr 3222641,nop,nop,sack 2 {21421:29989}{12853:17137},mptcp dss ack 1134438645], length 0
11:44:58.096781 IP 112.26.1.8.43791 > 112.26.1.1.38151: Flags [.], ack 11425, win 10631, options [nop,nop,TS val 2996871 ecr 3222641,nop,nop,sack 2 {21421:29989}{12853:17137},mptcp dss ack 1134438645], length 0
11:44:58.122647 IP 112.26.1.8.43791 > 112.26.1.1.38151: Flags [.], ack 11425, win 10084, options [nop,nop,TS val 2996344 ecr 3222641,nop,nop,sack 2 {12853:15709}{31417:37129},mptcp dss ack 1134438645], length 0
11:44:58.189905 IP 112.26.1.1.38151 > 112.26.1.8.43791: Flags [.], seq 29989:31417, ack 1, win 893, options [nop,nop,TS val 3225624 ecr 2996012,mptcp dss ack 2168003474 seq 1134440073 subseq 29989 len 1428 csum 0x59ab], length 1428
11:44:58.190201 IP 112.26.1.1.38151 > 112.26.1.8.43791: Flags [.], seq 29989:31417, ack 1, win 893, options [nop,nop,TS val 3225624 ecr 2996012,mptcp dss ack 2168003474 seq 1134440073 subseq 29989 len 1428 csum 0x59ab], length 1428
11:44:58.215912 IP 112.26.1.8.43791 > 112.26.1.1.38151: Flags [.], ack 11425, win 10768, options [nop,nop,TS val 2996991 ecr 3222641,nop,nop,sack 2 {21421:37129}{12853:17137},mptcp dss ack 1134438645], length 0
11:44:58.216186 IP 112.26.1.8.43791 > 112.26.1.1.38151: Flags [.], ack 11425, win 10768, options [nop,nop,TS val 2996991 ecr 3222641,nop,nop,sack 2 {21421:37129}{12853:17137},mptcp dss ack 1134438645], length 0
11:44:58.223346 IP 112.26.1.8.43791 > 112.26.1.1.38151: Flags [.], ack 11425, win 10266, options [nop,nop,TS val 2996527 ecr 3222641,nop,nop,sack 2 {12853:17137}{31417:37129},mptcp dss ack 1134438645], length 0
11:44:58.298616 IP 112.26.1.1.38151 > 112.26.1.8.43791: Flags [.], seq 11425:12853, ack 1, win 893, options [nop,nop,TS val 3225744 ecr 2996181,mptcp dss ack 2168003474 seq 1134460065 subseq 11425 len 1428 csum 0x6245], length 1428
11:44:58.298872 IP 112.26.1.1.38151 > 112.26.1.8.43791: Flags [.], seq 11425:12853, ack 1, win 893, options [nop,nop,TS val 3225744 ecr 2996181,mptcp dss ack 2168003474 seq 1134460065 subseq 11425 len 1428 csum 0x6245], length 1428
11:44:58.320944 IP 112.26.1.8.43791 > 112.26.1.1.38151: Flags [.], ack 37129, win 10859, options [nop,nop,TS val 2997095 ecr 3225744,mptcp dss ack 1134518613], length 0
11:44:58.321168 IP 112.26.1.8.43791 > 112.26.1.1.38151: Flags [.], ack 37129, win 10859, options [nop,nop,TS val 2997095 ecr 3225744,mptcp dss ack 1134518613], length 0
11:44:58.393740 IP 112.26.1.8.43791 > 112.26.1.1.38151: Flags [.], ack 11425, win 10357, options [nop,nop,TS val 2996631 ecr 3222641,nop,nop,sack 2 {21421:24277}{12853:17137},mptcp dss ack 1134438645], length 0
11:44:58.422129 IP 112.26.1.8.43791 > 112.26.1.1.38151: Flags [.], ack 11425, win 10494, options [nop,nop,TS val 2996767 ecr 3222641,nop,nop,sack 2 {21421:25705}{12853:17137},mptcp dss ack 1134438645], length 0
11:44:58.505136 IP 112.26.1.1.38151 > 112.26.1.8.43791: Flags [.], seq 37129:38557, ack 1, win 893, options [nop,nop,TS val 3225994 ecr 2996344,mptcp dss ack 2168003474 seq 1134535749 subseq 37129 len 1428 csum 0x553d], length 1428
11:44:58.505384 IP 112.26.1.1.38151 > 112.26.1.8.43791: Flags [.], seq 37129:38557, ack 1, win 893, options [nop,nop,TS val 3225994 ecr 2996344,mptcp dss ack 2168003474 seq 1134535749 subseq 37129 len 1428 csum 0x553d], length 1428
11:44:58.515276 IP 112.26.1.8.43791 > 112.26.1.1.38151: Flags [.], ack 38557, win 11087, options [nop,nop,TS val 2997286 ecr 3225994,mptcp dss ack 1134518613], length 0
11:44:58.515595 IP 112.26.1.8.43791 > 112.26.1.1.38151: Flags [.], ack 38557, win 11087, options [nop,nop,TS val 2997286 ecr 3225994,mptcp dss ack 1134518613], length 0
11:44:58.569370 IP 112.26.1.8.43791 > 112.26.1.1.38151: Flags [.], ack 11425, win 10631, options [nop,nop,TS val 2996871 ecr 3222641,nop,nop,sack 2 {21421:29989}{12853:17137},mptcp dss ack 1134438645], length 0
11:44:58.616640 IP 112.26.1.8.43791 > 112.26.1.1.38151: Flags [.], ack 11425, win 10768, options [nop,nop,TS val 2996991 ecr 3222641,nop,nop,sack 2 {21421:37129}{12853:17137},mptcp dss ack 1134438645], length 0
11:44:58.669926 IP 112.26.1.1.38151 > 112.26.1.8.43791: Flags [.], seq 38557:39985, ack 1, win 893, options [nop,nop,TS val 3226171 ecr 2996527,mptcp dss ack 2168003474 seq 1134541461 subseq 38557 len 1428 csum 0x7ede], length 1428
11:44:58.670264 IP 112.26.1.1.38151 > 112.26.1.8.43791: Flags [.], seq 38557:39985, ack 1, win 893, options [nop,nop,TS val 3226171 ecr 2996527,mptcp dss ack 2168003474 seq 1134541461 subseq 38557 len 1428 csum 0x7ede], length 1428
11:44:58.680548 IP 112.26.1.8.43791 > 112.26.1.1.38151: Flags [.], ack 39985, win 11270, options [nop,nop,TS val 2997449 ecr 3226171,mptcp dss ack 1134518613], length 0
11:44:58.680894 IP 112.26.1.8.43791 > 112.26.1.1.38151: Flags [.], ack 39985, win 11270, options [nop,nop,TS val 2997449 ecr 3226171,mptcp dss ack 1134518613], length 0
11:44:58.748793 IP 112.26.1.8.43791 > 112.26.1.1.38151: Flags [.], ack 37129, win 10859, options [nop,nop,TS val 2997095 ecr 3225744,mptcp dss ack 1134518613], length 0
11:44:58.830355 IP 112.26.1.1.38151 > 112.26.1.8.43791: Flags [.], seq 39985:41413, ack 1, win 893, options [nop,nop,TS val 3226285 ecr 2996631,mptcp dss ack 2168003474 seq 1134545745 subseq 39985 len 1428 csum 0xd70f], length 1428
11:44:58.830682 IP 112.26.1.1.38151 > 112.26.1.8.43791: Flags [.], seq 39985:41413, ack 1, win 893, options [nop,nop,TS val 3226285 ecr 2996631,mptcp dss ack 2168003474 seq 1134545745 subseq 39985 len 1428 csum 0xd70f], length 1428
11:44:58.835563 IP 112.26.1.8.43791 > 112.26.1.1.38151: Flags [.], ack 41413, win 11498, options [nop,nop,TS val 2997611 ecr 3226285,mptcp dss ack 1134518613], length 0
11:44:58.835875 IP 112.26.1.8.43791 > 112.26.1.1.38151: Flags [.], ack 41413, win 11498, options [nop,nop,TS val 2997611 ecr 3226285,mptcp dss ack 1134518613], length 0
11:44:58.938602 IP 112.26.1.1.38151 > 112.26.1.8.43791: Flags [.], seq 41413:42841, ack 1, win 893, options [nop,nop,TS val 3226296 ecr 2996767,mptcp dss ack 2168003474 seq 1134547173 subseq 41413 len 1428 csum 0x3056], length 1428
11:44:58.938931 IP 112.26.1.1.38151 > 112.26.1.8.43791: Flags [.], seq 41413:42841, ack 1, win 893, options [nop,nop,TS val 3226296 ecr 2996767,mptcp dss ack 2168003474 seq 1134547173 subseq 41413 len 1428 csum 0x3056], length 1428
11:44:58.951470 IP 112.26.1.8.43791 > 112.26.1.1.38151: Flags [.], ack 42841, win 11635, options [nop,nop,TS val 2997725 ecr 3226296,mptcp dss ack 1134521469], length 0
11:44:58.951764 IP 112.26.1.8.43791 > 112.26.1.1.38151: Flags [.], ack 42841, win 11635, options [nop,nop,TS val 2997725 ecr 3226296,mptcp dss ack 1134521469], length 0
11:44:59.012676 IP 112.26.1.8.43791 > 112.26.1.1.38151: Flags [.], ack 38557, win 11087, options [nop,nop,TS val 2997286 ecr 3225994,mptcp dss ack 1134518613], length 0
11:44:59.063224 IP 112.26.1.1.38151 > 112.26.1.8.43791: Flags [.], seq 42841:44269, ack 1, win 893, options [nop,nop,TS val 3226479 ecr 2996871,mptcp dss ack 2168003474 seq 1134551457 subseq 42841 len 1428 csum 0x9ec0], length 1428
11:44:59.063563 IP 112.26.1.1.38151 > 112.26.1.8.43791: Flags [.], seq 42841:44269, ack 1, win 893, options [nop,nop,TS val 3226479 ecr 2996871,mptcp dss ack 2168003474 seq 1134551457 subseq 42841 len 1428 csum 0x9ec0], length 1428
11:44:59.077785 IP 112.26.1.8.43791 > 112.26.1.1.38151: Flags [.], ack 44269, win 11772, options [nop,nop,TS val 2997844 ecr 3226479,mptcp dss ack 1134521469], length 0
11:44:59.078097 IP 112.26.1.8.43791 > 112.26.1.1.38151: Flags [.], ack 44269, win 11772, options [nop,nop,TS val 2997844 ecr 3226479,mptcp dss ack 1134521469], length 0
11:44:59.175775 IP 112.26.1.8.43791 > 112.26.1.1.38151: Flags [.], ack 39985, win 11270, options [nop,nop,TS val 2997449 ecr 3226171,mptcp dss ack 1134518613], length 0
11:44:59.249674 IP 112.26.1.1.38151 > 112.26.1.8.43791: Flags [.], seq 45697:47125, ack 1, win 893, options [nop,nop,TS val 3226611 ecr 2997095,mptcp dss ack 2168003474 seq 1134555741 subseq 45697 len 1428 csum 0x561e], length 1428
11:44:59.250003 IP 112.26.1.1.38151 > 112.26.1.8.43791: Flags [.], seq 45697:47125, ack 1, win 893, options [nop,nop,TS val 3226611 ecr 2997095,mptcp dss ack 2168003474 seq 1134555741 subseq 45697 len 1428 csum 0x561e], length 1428
11:44:59.256868 IP 112.26.1.8.43791 > 112.26.1.1.38151: Flags [.], ack 44269, win 12000, options [nop,nop,TS val 2998032 ecr 3226479,nop,nop,sack 1 {45697:47125},mptcp dss ack 1134527181], length 0
11:44:59.257142 IP 112.26.1.8.43791 > 112.26.1.1.38151: Flags [.], ack 44269, win 12000, options [nop,nop,TS val 2998032 ecr 3226479,nop,nop,sack 1 {45697:47125},mptcp dss ack 1134527181], length 0
11:44:59.343061 IP 112.26.1.1.38151 > 112.26.1.8.43791: Flags [.], seq 48553:49981, ack 1, win 893, options [nop,nop,TS val 3226611 ecr 2997095,mptcp dss ack 2168003474 seq 1134558597 subseq 48553 len 1428 csum 0x848e], length 1428
11:44:59.343378 IP 112.26.1.1.38151 > 112.26.1.8.43791: Flags [.], seq 48553:49981, ack 1, win 893, options [nop,nop,TS val 3226611 ecr 2997095,mptcp dss ack 2168003474 seq 1134558597 subseq 48553 len 1428 csum 0x848e], length 1428
11:44:59.365392 IP 112.26.1.8.43791 > 112.26.1.1.38151: Flags [.], ack 44269, win 12137, options [nop,nop,TS val 2998140 ecr 3226479,nop,nop,sack 2 {48553:49981}{45697:47125},mptcp dss ack 1134527181], length 0
11:44:59.365714 IP 112.26.1.8.43791 > 112.26.1.1.38151: Flags [.], ack 44269, win 12137, options [nop,nop,TS val 2998140 ecr 3226479,nop,nop,sack 2 {48553:49981}{45697:47125},mptcp dss ack 1134527181], length 0
11:44:59.423506 IP 112.26.1.1.38151 > 112.26.1.8.43791: Flags [.], seq 49981:51409, ack 1, win 893, options [nop,nop,TS val 3226611 ecr 2997095,mptcp dss ack 2168003474 seq 1134560025 subseq 49981 len 1428 csum 0x51a], length 1428
11:44:59.423843 IP 112.26.1.1.38151 > 112.26.1.8.43791: Flags [.], seq 49981:51409, ack 1, win 893, options [nop,nop,TS val 3226611 ecr 2997095,mptcp dss ack 2168003474 seq 1134560025 subseq 49981 len 1428 csum 0x51a], length 1428
11:44:59.463011 IP 112.26.1.8.43791 > 112.26.1.1.38151: Flags [.], ack 42841, win 11635, options [nop,nop,TS val 2997725 ecr 3226296,mptcp dss ack 1134521469], length 0
11:44:59.483890 IP 112.26.1.8.43791 > 112.26.1.1.38151: Flags [.], ack 44269, win 12274, options [nop,nop,TS val 2998259 ecr 3226479,nop,nop,sack 2 {48553:51409}{45697:47125},mptcp dss ack 1134527181], length 0
11:44:59.484202 IP 112.26.1.8.43791 > 112.26.1.1.38151: Flags [.], ack 44269, win 12274, options [nop,nop,TS val 2998259 ecr 3226479,nop,nop,sack 2 {48553:51409}{45697:47125},mptcp dss ack 1134527181], length 0
11:44:59.554273 IP 112.26.1.1.38151 > 112.26.1.8.43791: Flags [.], seq 52837:54265, ack 1, win 893, options [nop,nop,TS val 3226611 ecr 2997095,mptcp dss ack 2168003474 seq 1134562881 subseq 52837 len 1428 csum 0x1eaf], length 1428
11:44:59.554616 IP 112.26.1.1.38151 > 112.26.1.8.43791: Flags [.], seq 52837:54265, ack 1, win 893, options [nop,nop,TS val 3226611 ecr 2997095,mptcp dss ack 2168003474 seq 1134562881 subseq 52837 len 1428 csum 0x1eaf], length 1428
11:44:59.590680 IP 112.26.1.8.43791 > 112.26.1.1.38151: Flags [.], ack 44269, win 12410, options [nop,nop,TS val 2998367 ecr 3226479,nop,nop,sack 2 {52837:54265}{48553:51409},mptcp dss ack 1134527181], length 0
11:44:59.590986 IP 112.26.1.8.43791 > 112.26.1.1.38151: Flags [.], ack 44269, win 12410, options [nop,nop,TS val 2998367 ecr 3226479,nop,nop,sack 2 {52837:54265}{48553:51409},mptcp dss ack 1134527181], length 0
11:44:59.643377 IP 112.26.1.1.38151 > 112.26.1.8.43791: Flags [.], seq 54265:55693, ack 1, win 893, options [nop,nop,TS val 3226875 ecr 2997286,mptcp dss ack 2168003474 seq 1134572877 subseq 54265 len 1428 csum 0xe8f9], length 1428
11:44:59.643720 IP 112.26.1.1.38151 > 112.26.1.8.43791: Flags [.], seq 54265:55693, ack 1, win 893, options [nop,nop,TS val 3226875 ecr 2997286,mptcp dss ack 2168003474 seq 1134572877 subseq 54265 len 1428 csum 0xe8f9], length 1428
11:44:59.695097 IP 112.26.1.8.43791 > 112.26.1.1.38151: Flags [.], ack 44269, win 12593, options [nop,nop,TS val 2998469 ecr 3226479,nop,nop,sack 2 {52837:55693}{48553:51409},mptcp dss ack 1134527181], length 0
11:44:59.695369 IP 112.26.1.8.43791 > 112.26.1.1.38151: Flags [.], ack 44269, win 12593, options [nop,nop,TS val 2998469 ecr 3226479,nop,nop,sack 2 {52837:55693}{48553:51409},mptcp dss ack 1134527181], length 0
11:44:59.726229 IP 112.26.1.1.38151 > 112.26.1.8.43791: Flags [.], seq 55693:57121, ack 1, win 893, options [nop,nop,TS val 3226875 ecr 2997286,mptcp dss ack 2168003474 seq 1134574305 subseq 55693 len 1428 csum 0x11d6], length 1428
11:44:59.726537 IP 112.26.1.1.38151 > 112.26.1.8.43791: Flags [.], seq 55693:57121, ack 1, win 893, options [nop,nop,TS val 3226875 ecr 2997286,mptcp dss ack 2168003474 seq 1134574305 subseq 55693 len 1428 csum 0x11d6], length 1428
11:44:59.792095 IP 112.26.1.1.38151 > 112.26.1.8.43791: Flags [.], seq 57121:58549, ack 1, win 893, options [nop,nop,TS val 3227039 ecr 2997449,mptcp dss ack 2168003474 seq 1134578589 subseq 57121 len 1428 csum 0xe42f], length 1428
11:44:59.792420 IP 112.26.1.1.38151 > 112.26.1.8.43791: Flags [.], seq 57121:58549, ack 1, win 893, options [nop,nop,TS val 3227039 ecr 2997449,mptcp dss ack 2168003474 seq 1134578589 subseq 57121 len 1428 csum 0xe42f], length 1428
11:44:59.820509 IP 112.26.1.8.43791 > 112.26.1.1.38151: Flags [.], ack 44269, win 12684, options [nop,nop,TS val 2998589 ecr 3226479,nop,nop,sack 2 {52837:57121}{48553:51409},mptcp dss ack 1134527181], length 0
11:44:59.820814 IP 112.26.1.8.43791 > 112.26.1.1.38151: Flags [.], ack 44269, win 12684, options [nop,nop,TS val 2998589 ecr 3226479,nop,nop,sack 2 {52837:57121}{48553:51409},mptcp dss ack 1134527181], length 0
11:44:59.870291 IP 112.26.1.8.43791 > 112.26.1.1.38151: Flags [.], ack 44269, win 12137, options [nop,nop,TS val 2998140 ecr 3226479,nop,nop,sack 2 {48553:49981}{45697:47125},mptcp dss ack 1134527181], length 0
11:44:59.905724 IP 112.26.1.8.43791 > 112.26.1.1.38151: Flags [.], ack 44269, win 12821, options [nop,nop,TS val 2998682 ecr 3226479,nop,nop,sack 2 {52837:58549}{48553:51409},mptcp dss ack 1134552885], length 0
11:44:59.906030 IP 112.26.1.8.43791 > 112.26.1.1.38151: Flags [.], ack 44269, win 12821, options [nop,nop,TS val 2998682 ecr 3226479,nop,nop,sack 2 {52837:58549}{48553:51409},mptcp dss ack 1134552885], length 0
11:44:59.963863 IP 112.26.1.1.38151 > 112.26.1.8.43791: Flags [.], seq 58549:59977, ack 1, win 893, options [nop,nop,TS val 3227326 ecr 2997725,mptcp dss ack 2168003474 seq 1134585729 subseq 58549 len 1428 csum 0x5523], length 1428
