11:44:54.488734 IP 112.26.3.8.45245 > 112.26.3.1.38151: Flags [S], seq 1060292245, win 65535, options [mss 1460,sackOK,TS val 2993265 ecr 0,nop,wscale 6,mptcp join id 5 token 0x3c5625f6 nonce 0x3f4f57e3], length 0
11:44:54.513099 IP 112.26.3.8.45245 > 112.26.3.1.38151: Flags [S], seq 1060292245, win 65535, options [mss 1460,sackOK,TS val 2993265 ecr 0,nop,wscale 6,mptcp join id 5 token 0x3c5625f6 nonce 0x3f4f57e3], length 0
11:44:54.631710 IP 112.26.3.1.38151 > 112.26.3.8.45245: Flags [S.], seq 180304139, ack 1060292246, win 28560, options [mss 1460,sackOK,TS val 3222381 ecr 2993265,nop,wscale 7,mptcp join id 5 hmac 0xfe0657b2026d80b9 nonce 0x2321c834], length 0
11:44:54.631987 IP 112.26.3.8.45245 > 112.26.3.1.38151: Flags [.], ack 1, win 6935, options [nop,nop,TS val 2993409 ecr 3222381,mptcp join hmac 0x648012b906a0bfa19b7e7f9c0a372fe7c9ad35dd], length 0
11:44:54.762024 IP 112.26.3.8.45245 > 112.26.3.1.38151: Flags [.], ack 1, win 6935, options [nop,nop,TS val 2993409 ecr 3222381,mptcp join hmac 0x648012b906a0bfa19b7e7f9c0a372fe7c9ad35dd], length 0
11:44:54.828440 IP 112.26.3.1.38151 > 112.26.3.8.45245: Flags [.], ack 1, win 670, options [nop,nop,TS val 3222628 ecr 2993409,mptcp dss ack 2168003474], length 0
11:44:55.013782 IP 112.26.3.1.38151 > 112.26.3.8.45245: Flags [.], seq 1:1429, ack 1, win 670, options [nop,nop,TS val 3222628 ecr 2993409,mptcp dss ack 2168003474 seq 1134432933 subseq 1 len 1428 csum 0x7c60], length 1428
11:44:55.014074 IP 112.26.3.8.45245 > 112.26.3.1.38151: Flags [.], ack 1429, win 7255, options [nop,nop,TS val 2993791 ecr 3222628,mptcp dss ack 1134417225], length 0
11:44:55.371272 IP 112.26.3.1.38151 > 112.26.3.8.45245: Flags [.], seq 1429:2857, ack 1, win 670, options [nop,nop,TS val 3222629 ecr 2993409,mptcp dss ack 2168003474 seq 1134434361 subseq 1429 len 1428 csum 0x2fbd], length 1428
11:44:55.371591 IP 112.26.3.8.45245 > 112.26.3.1.38151: Flags [.], ack 2857, win 7574, options [nop,nop,TS val 2994148 ecr 3222629,mptcp dss ack 1134422937], length 0
11:44:55.591955 IP 112.26.3.8.45245 > 112.26.3.1.38151: Flags [.], ack 2857, win 7574, options [nop,nop,TS val 2994148 ecr 3222629,mptcp dss ack 1134422937], length 0
11:44:55.725518 IP 112.26.3.1.38151 > 112.26.3.8.45245: Flags [.], seq 2857:4285, ack 1, win 670, options [nop,nop,TS val 3222629 ecr 2993409,mptcp dss ack 2168003474 seq 1134435789 subseq 2857 len 1428 csum 0xa31d], length 1428
11:44:55.725894 IP 112.26.3.8.45245 > 112.26.3.1.38151: Flags [.], ack 4285, win 7939, options [nop,nop,TS val 2994502 ecr 3222629,mptcp dss ack 1134424365], length 0
11:44:55.962442 IP 112.26.3.8.45245 > 112.26.3.1.38151: Flags [.], ack 4285, win 7939, options [nop,nop,TS val 2994502 ecr 3222629,mptcp dss ack 1134424365], length 0
11:44:56.058742 IP 112.26.3.1.38151 > 112.26.3.8.45245: Flags [.], seq 14281:15709, ack 1, win 893, options [nop,nop,TS val 3223457 ecr 2994148,mptcp dss ack 2168003474 seq 1134481485 subseq 14281 len 1428 csum 0xaeb7], length 1428
11:44:56.059079 IP 112.26.3.8.45245 > 112.26.3.1.38151: Flags [.], ack 4285, win 8304, options [nop,nop,TS val 2994835 ecr 3222629,nop,nop,sack 1 {14281:15709},mptcp dss ack 1134424365], length 0
11:44:56.266067 IP 112.26.3.8.45245 > 112.26.3.1.38151: Flags [.], ack 4285, win 8304, options [nop,nop,TS val 2994835 ecr 3222629,nop,nop,sack 1 {14281:15709},mptcp dss ack 1134424365], length 0
11:44:56.399449 IP 112.26.3.1.38151 > 112.26.3.8.45245: Flags [.], seq 17137:18565, ack 1, win 893, options [nop,nop,TS val 3223457 ecr 2994148,mptcp dss ack 2168003474 seq 1134484341 subseq 17137 len 1428 csum 0x955c], length 1428
11:44:56.399761 IP 112.26.3.8.45245 > 112.26.3.1.38151: Flags [.], ack 4285, win 8715, options [nop,nop,TS val 2995176 ecr 3222629,nop,nop,sack 2 {17137:18565}{14281:15709},mptcp dss ack 1134425793], length 0
11:44:56.632498 IP 112.26.3.8.45245 > 112.26.3.1.38151: Flags [.], ack 4285, win 8715, options [nop,nop,TS val 2995176 ecr 3222629,nop,nop,sack 2 {17137:18565}{14281:15709},mptcp dss ack 1134425793], length 0
11:44:56.748059 IP 112.26.3.1.38151 > 112.26.3.8.45245: Flags [.], seq 2857:4285, ack 1, win 893, options [nop,nop,TS val 3223906 ecr 2994148,mptcp dss ack 2168003474 seq 1134435789 subseq 2857 len 1428 csum 0xa31d], length 1428
11:44:56.748343 IP 112.26.3.8.45245 > 112.26.3.1.38151: Flags [.], ack 4285, win 9080, options [nop,nop,TS val 2995525 ecr 3223906,nop,nop,sack 2 {2857:4285}{17137:18565},mptcp dss ack 1134427221], length 0
11:44:56.944131 IP 112.26.3.8.45245 > 112.26.3.1.38151: Flags [.], ack 4285, win 9080, options [nop,nop,TS val 2995525 ecr 3223906,nop,nop,sack 2 {2857:4285}{17137:18565},mptcp dss ack 1134427221], length 0
11:44:57.117496 IP 112.26.3.1.38151 > 112.26.3.8.45245: Flags [.], seq 4285:5713, ack 1, win 893, options [nop,nop,TS val 3224498 ecr 2995176,mptcp dss ack 2168003474 seq 1134437217 subseq 4285 len 1428 csum 0xb097], length 1428
11:44:57.117806 IP 112.26.3.8.45245 > 112.26.3.1.38151: Flags [.], ack 5713, win 9536, options [nop,nop,TS val 2995894 ecr 3224498,nop,nop,sack 2 {17137:18565}{14281:15709},mptcp dss ack 1134427221], length 0
11:44:57.299563 IP 112.26.3.8.45245 > 112.26.3.1.38151: Flags [.], ack 5713, win 9536, options [nop,nop,TS val 2995894 ecr 3224498,nop,nop,sack 2 {17137:18565}{14281:15709},mptcp dss ack 1134427221], length 0
11:44:57.445571 IP 112.26.3.1.38151 > 112.26.3.8.45245: Flags [.], seq 7141:8569, ack 1, win 893, options [nop,nop,TS val 3224498 ecr 2995176,mptcp dss ack 2168003474 seq 1134440073 subseq 7141 len 1428 csum 0xb2eb], length 1428
11:44:57.445897 IP 112.26.3.8.45245 > 112.26.3.1.38151: Flags [.], ack 5713, win 9947, options [nop,nop,TS val 2996222 ecr 3224498,nop,nop,sack 2 {7141:8569}{17137:18565},mptcp dss ack 1134438645], length 0
11:44:57.633684 IP 112.26.3.8.45245 > 112.26.3.1.38151: Flags [.], ack 5713, win 9947, options [nop,nop,TS val 2996222 ecr 3224498,nop,nop,sack 2 {7141:8569}{17137:18565},mptcp dss ack 1134438645], length 0
11:44:57.799618 IP 112.26.3.1.38151 > 112.26.3.8.45245: Flags [.], seq 11425:12853, ack 1, win 893, options [nop,nop,TS val 3225197 ecr 2995894,mptcp dss ack 2168003474 seq 1134444357 subseq 11425 len 1428 csum 0xb507], length 1428
11:44:57.799952 IP 112.26.3.8.45245 > 112.26.3.1.38151: Flags [.], ack 5713, win 10312, options [nop,nop,TS val 2996576 ecr 3224498,nop,nop,sack 2 {11425:12853}{7141:8569},mptcp dss ack 1134438645], length 0
11:44:57.964830 IP 112.26.3.8.45245 > 112.26.3.1.38151: Flags [.], ack 5713, win 10312, options [nop,nop,TS val 2996576 ecr 3224498,nop,nop,sack 2 {11425:12853}{7141:8569},mptcp dss ack 1134438645], length 0
11:44:58.102511 IP 112.26.3.1.38151 > 112.26.3.8.45245: Flags [.], seq 15709:17137, ack 1, win 893, options [nop,nop,TS val 3225498 ecr 2996222,mptcp dss ack 2168003474 seq 1134482913 subseq 15709 len 1428 csum 0xef24], length 1428
11:44:58.102720 IP 112.26.3.8.45245 > 112.26.3.1.38151: Flags [.], ack 5713, win 10677, options [nop,nop,TS val 2996879 ecr 3224498,nop,nop,sack 2 {14281:18565}{11425:12853},mptcp dss ack 1134438645], length 0
11:44:58.431180 IP 112.26.3.8.45245 > 112.26.3.1.38151: Flags [.], ack 5713, win 10677, options [nop,nop,TS val 2996879 ecr 3224498,nop,nop,sack 2 {14281:18565}{11425:12853},mptcp dss ack 1134438645], length 0
11:44:58.553147 IP 112.26.3.1.38151 > 112.26.3.8.45245: Flags [.], seq 5713:7141, ack 1, win 893, options [nop,nop,TS val 3225828 ecr 2996576,mptcp dss ack 2168003474 seq 1134438645 subseq 5713 len 1428 csum 0xa83a], length 1428
11:44:58.553391 IP 112.26.3.8.45245 > 112.26.3.1.38151: Flags [.], ack 8569, win 11179, options [nop,nop,TS val 2997330 ecr 3225828,nop,nop,sack 2 {14281:18565}{11425:12853},mptcp dss ack 1134518613], length 0
11:44:58.739599 IP 112.26.3.1.38151 > 112.26.3.8.45245: Flags [.], seq 8569:9997, ack 1, win 893, options [nop,nop,TS val 3226296 ecr 2996879,mptcp dss ack 2168003474 seq 1134441501 subseq 8569 len 1428 csum 0xc13], length 1428
11:44:58.739852 IP 112.26.3.8.45245 > 112.26.3.1.38151: Flags [.], ack 9997, win 11361, options [nop,nop,TS val 2997517 ecr 3226296,nop,nop,sack 2 {14281:18565}{11425:12853},mptcp dss ack 1134518613], length 0
11:44:58.872731 IP 112.26.3.8.45245 > 112.26.3.1.38151: Flags [.], ack 8569, win 11179, options [nop,nop,TS val 2997330 ecr 3225828,nop,nop,sack 2 {14281:18565}{11425:12853},mptcp dss ack 1134518613], length 0
11:44:58.962215 IP 112.26.3.8.45245 > 112.26.3.1.38151: Flags [.], ack 9997, win 11361, options [nop,nop,TS val 2997517 ecr 3226296,nop,nop,sack 2 {14281:18565}{11425:12853},mptcp dss ack 1134518613], length 0
11:44:59.032512 IP 112.26.3.1.38151 > 112.26.3.8.45245: Flags [.], seq 9997:11425, ack 1, win 893, options [nop,nop,TS val 3226740 ecr 2997330,mptcp dss ack 2168003474 seq 1134442929 subseq 9997 len 1428 csum 0x9146], length 1428
11:44:59.032730 IP 112.26.3.8.45245 > 112.26.3.1.38151: Flags [.], ack 12853, win 11726, options [nop,nop,TS val 2997810 ecr 3226740,nop,nop,sack 1 {14281:18565},mptcp dss ack 1134521469], length 0
11:44:59.128773 IP 112.26.3.8.45245 > 112.26.3.1.38151: Flags [.], ack 12853, win 11726, options [nop,nop,TS val 2997810 ecr 3226740,nop,nop,sack 1 {14281:18565},mptcp dss ack 1134521469], length 0
11:44:59.322077 IP 112.26.3.1.38151 > 112.26.3.8.45245: Flags [.], seq 12853:14281, ack 1, win 893, options [nop,nop,TS val 3226740 ecr 2997330,mptcp dss ack 2168003474 seq 1134445785 subseq 12853 len 1428 csum 0xe382], length 1428
11:44:59.322322 IP 112.26.3.8.45245 > 112.26.3.1.38151: Flags [.], ack 18565, win 12045, options [nop,nop,TS val 2998099 ecr 3226740,mptcp dss ack 1134527181], length 0
11:44:59.472549 IP 112.26.3.8.45245 > 112.26.3.1.38151: Flags [.], ack 18565, win 12045, options [nop,nop,TS val 2998099 ecr 3226740,mptcp dss ack 1134527181], length 0
11:44:59.616764 IP 112.26.3.1.38151 > 112.26.3.8.45245: Flags [.], seq 18565:19993, ack 1, win 893, options [nop,nop,TS val 3227084 ecr 2997517,mptcp dss ack 2168003474 seq 1134485769 subseq 18565 len 1428 csum 0xe6f9], length 1428
11:44:59.617037 IP 112.26.3.8.45245 > 112.26.3.1.38151: Flags [.], ack 19993, win 12456, options [nop,nop,TS val 2998394 ecr 3227084,mptcp dss ack 1134527181], length 0
11:44:59.824490 IP 112.26.3.8.45245 > 112.26.3.1.38151: Flags [.], ack 19993, win 12456, options [nop,nop,TS val 2998394 ecr 3227084,mptcp dss ack 1134527181], length 0
11:45:00.180404 IP 112.26.3.1.38151 > 112.26.3.8.45245: Flags [.], seq 21421:22849, ack 1, win 893, options [nop,nop,TS val 3227430 ecr 2997810,mptcp dss ack 2168003474 seq 1134592869 subseq 21421 len 1428 csum 0x7308], length 1428
11:45:00.180614 IP 112.26.3.8.45245 > 112.26.3.1.38151: Flags [.], ack 19993, win 13095, options [nop,nop,TS val 2998957 ecr 3227084,nop,nop,sack 1 {21421:22849},mptcp dss ack 1134552885], length 0
11:45:00.370808 IP 112.26.3.8.45245 > 112.26.3.1.38151: Flags [.], ack 19993, win 13095, options [nop,nop,TS val 2998957 ecr 3227084,nop,nop,sack 1 {21421:22849},mptcp dss ack 1134552885], length 0
11:45:00.432830 IP 112.26.3.1.38151 > 112.26.3.8.45245: Flags [.], seq 22849:24277, ack 1, win 893, options [nop,nop,TS val 3227430 ecr 2997810,mptcp dss ack 2168003474 seq 1134594297 subseq 22849 len 1428 csum 0xaa5a], length 1428
11:45:00.433041 IP 112.26.3.8.45245 > 112.26.3.1.38151: Flags [.], ack 19993, win 13369, options [nop,nop,TS val 2999210 ecr 3227084,nop,nop,sack 1 {21421:24277},mptcp dss ack 1134552885], length 0
11:45:00.616342 IP 112.26.3.8.45245 > 112.26.3.1.38151: Flags [.], ack 19993, win 13369, options [nop,nop,TS val 2999210 ecr 3227084,nop,nop,sack 1 {21421:24277},mptcp dss ack 1134552885], length 0
11:45:00.836570 IP 112.26.3.1.38151 > 112.26.3.8.45245: Flags [.], seq 27133:28561, ack 1, win 893, options [nop,nop,TS val 3228496 ecr 2998957,mptcp dss ack 2168003474 seq 1134624285 subseq 27133 len 1428 csum 0xbc5], length 1428
11:45:00.836778 IP 112.26.3.8.45245 > 112.26.3.1.38151: Flags [.], ack 19993, win 13825, options [nop,nop,TS val 2999613 ecr 3227084,nop,nop,sack 2 {27133:28561}{21421:24277},mptcp dss ack 1134575733], length 0
11:45:01.017679 IP 112.26.3.8.45245 > 112.26.3.1.38151: Flags [.], ack 19993, win 13825, options [nop,nop,TS val 2999613 ecr 3227084,nop,nop,sack 2 {27133:28561}{21421:24277},mptcp dss ack 1134575733], length 0
11:45:01.410612 IP 112.26.3.1.38151 > 112.26.3.8.45245: Flags [.], seq 29989:31417, ack 1, win 893, options [nop,nop,TS val 3228496 ecr 2998957,mptcp dss ack 2168003474 seq 1134627141 subseq 29989 len 1428 csum 0x153b], length 1428
11:45:01.411001 IP 112.26.3.8.45245 > 112.26.3.1.38151: Flags [.], ack 19993, win 14418, options [nop,nop,TS val 3000187 ecr 3227084,nop,nop,sack 2 {29989:31417}{27133:28561},mptcp dss ack 1134580017], length 0
11:45:01.551694 IP 112.26.3.8.45245 > 112.26.3.1.38151: Flags [.], ack 19993, win 14418, options [nop,nop,TS val 3000187 ecr 3227084,nop,nop,sack 2 {29989:31417}{27133:28561},mptcp dss ack 1134580017], length 0
11:45:01.741911 IP 112.26.3.1.38151 > 112.26.3.8.45245: Flags [.], seq 34273:35701, ack 1, win 893, options [nop,nop,TS val 3228906 ecr 2999210,mptcp dss ack 2168003474 seq 1134642849 subseq 34273 len 1428 csum 0xaaf], length 1428
11:45:01.742223 IP 112.26.3.8.45245 > 112.26.3.1.38151: Flags [.], ack 19993, win 14874, options [nop,nop,TS val 3000518 ecr 3227084,nop,nop,sack 2 {34273:35701}{29989:31417},mptcp dss ack 1134580017], length 0
11:45:01.966588 IP 112.26.3.8.45245 > 112.26.3.1.38151: Flags [.], ack 19993, win 14874, options [nop,nop,TS val 3000518 ecr 3227084,nop,nop,sack 2 {34273:35701}{29989:31417},mptcp dss ack 1134580017], length 0
11:45:02.040154 IP 112.26.3.1.38151 > 112.26.3.8.45245: Flags [.], seq 19993:21421, ack 1, win 893, options [nop,nop,TS val 3229097 ecr 2999613,mptcp dss ack 2168003474 seq 1134580017 subseq 19993 len 1428 csum 0x1f1e], length 1428
11:45:02.040533 IP 112.26.3.8.45245 > 112.26.3.1.38151: Flags [.], ack 24277, win 15194, options [nop,nop,TS val 3000817 ecr 3229097,nop,nop,sack 2 {34273:35701}{29989:31417},mptcp dss ack 1134600009], length 0
11:45:02.233647 IP 112.26.3.8.45245 > 112.26.3.1.38151: Flags [.], ack 24277, win 15194, options [nop,nop,TS val 3000817 ecr 3229097,nop,nop,sack 2 {34273:35701}{29989:31417},mptcp dss ack 1134600009], length 0
11:45:02.383804 IP 112.26.3.1.38151 > 112.26.3.8.45245: Flags [.], seq 25705:27133, ack 1, win 893, options [nop,nop,TS val 3229831 ecr 3000518,mptcp dss ack 2168003474 seq 1134601437 subseq 25705 len 1428 csum 0x78bc], length 1428
11:45:02.384111 IP 112.26.3.8.45245 > 112.26.3.1.38151: Flags [.], ack 24277, win 15650, options [nop,nop,TS val 3001161 ecr 3229097,nop,nop,sack 2 {25705:28561}{34273:35701},mptcp dss ack 1134600009], length 0
11:45:02.594397 IP 112.26.3.8.45245 > 112.26.3.1.38151: Flags [.], ack 24277, win 15650, options [nop,nop,TS val 3001161 ecr 3229097,nop,nop,sack 2 {25705:28561}{34273:35701},mptcp dss ack 1134600009], length 0
11:45:02.728283 IP 112.26.3.1.38151 > 112.26.3.8.45245: Flags [.], seq 28561:29989, ack 1, win 893, options [nop,nop,TS val 3230103 ecr 3000817,mptcp dss ack 2168003474 seq 1134625713 subseq 28561 len 1428 csum 0x2a11], length 1428
11:45:02.728629 IP 112.26.3.8.45245 > 112.26.3.1.38151: Flags [.], ack 24277, win 16060, options [nop,nop,TS val 3001505 ecr 3229097,nop,nop,sack 2 {25705:31417}{34273:35701},mptcp dss ack 1134600009], length 0
11:45:02.876674 IP 112.26.3.8.45245 > 112.26.3.1.38151: Flags [.], ack 24277, win 16060, options [nop,nop,TS val 3001505 ecr 3229097,nop,nop,sack 2 {25705:31417}{34273:35701},mptcp dss ack 1134600009], length 0
11:45:02.991791 IP 112.26.3.1.38151 > 112.26.3.8.45245: Flags [.], seq 24277:25705, ack 1, win 893, options [nop,nop,TS val 3230460 ecr 3001161,mptcp dss ack 2168003474 seq 1134600009 subseq 24277 len 1428 csum 0x1b06], length 1428
11:45:02.992255 IP 112.26.3.8.45245 > 112.26.3.1.38151: Flags [.], ack 31417, win 16380, options [nop,nop,TS val 3001768 ecr 3230460,nop,nop,sack 1 {34273:35701},mptcp dss ack 1134628569], length 0
11:45:03.212681 IP 112.26.3.8.45245 > 112.26.3.1.38151: Flags [.], ack 31417, win 16380, options [nop,nop,TS val 3001768 ecr 3230460,nop,nop,sack 1 {34273:35701},mptcp dss ack 1134628569], length 0
11:45:03.319752 IP 112.26.3.1.38151 > 112.26.3.8.45245: Flags [.], seq 32845:34273, ack 1, win 893, options [nop,nop,TS val 3230766 ecr 3001505,mptcp dss ack 2168003474 seq 1134629997 subseq 32845 len 1428 csum 0xdc8a], length 1428
11:45:03.320062 IP 112.26.3.8.45245 > 112.26.3.1.38151: Flags [.], ack 31417, win 16790, options [nop,nop,TS val 3002097 ecr 3230460,nop,nop,sack 1 {32845:35701},mptcp dss ack 1134628569], length 0
11:45:03.540507 IP 112.26.3.8.45245 > 112.26.3.1.38151: Flags [.], ack 31417, win 16790, options [nop,nop,TS val 3002097 ecr 3230460,nop,nop,sack 1 {32845:35701},mptcp dss ack 1134628569], length 0
11:45:03.632048 IP 112.26.3.1.38151 > 112.26.3.8.45245: Flags [.], seq 31417:32845, ack 1, win 893, options [nop,nop,TS val 3231079 ecr 3001768,mptcp dss ack 2168003474 seq 1134628569 subseq 31417 len 1428 csum 0x1e10], length 1428
11:45:03.632306 IP 112.26.3.8.45245 > 112.26.3.1.38151: Flags [.], ack 35701, win 17201, options [nop,nop,TS val 3002409 ecr 3231079,mptcp dss ack 1134711393], length 0
11:45:03.821774 IP 112.26.3.8.45245 > 112.26.3.1.38151: Flags [.], ack 35701, win 17201, options [nop,nop,TS val 3002409 ecr 3231079,mptcp dss ack 1134711393], length 0
11:45:03.897204 IP 112.26.3.1.38151 > 112.26.3.8.45245: Flags [.], seq 35701:37129, ack 1, win 893, options [nop,nop,TS val 3231467 ecr 3002097,mptcp dss ack 2168003474 seq 1134728529 subseq 35701 len 1428 csum 0xceee], length 1428
11:45:03.897556 IP 112.26.3.8.45245 > 112.26.3.1.38151: Flags [.], ack 37129, win 17520, options [nop,nop,TS val 3002674 ecr 3231467,mptcp dss ack 1134722817], length 0
11:45:04.035259 IP 112.26.3.8.45245 > 112.26.3.1.38151: Flags [.], ack 37129, win 17520, options [nop,nop,TS val 3002674 ecr 3231467,mptcp dss ack 1134722817], length 0
11:45:04.124214 IP 112.26.3.1.38151 > 112.26.3.8.45245: Flags [.], seq 37129:38557, ack 1, win 893, options [nop,nop,TS val 3231701 ecr 3002409,mptcp dss ack 2168003474 seq 1134739953 subseq 37129 len 1428 csum 0xbf2d], length 1428
11:45:04.124569 IP 112.26.3.8.45245 > 112.26.3.1.38151: Flags [.], ack 38557, win 17840, options [nop,nop,TS val 3002901 ecr 3231701,mptcp dss ack 1134732813], length 0
11:45:04.287357 IP 112.26.3.8.45245 > 112.26.3.1.38151: Flags [.], ack 38557, win 17840, options [nop,nop,TS val 3002901 ecr 3231701,mptcp dss ack 1134732813], length 0
11:45:04.422059 IP 112.26.3.1.38151 > 112.26.3.8.45245: Flags [.], seq 38557:39985, ack 1, win 893, options [nop,nop,TS val 3231701 ecr 3002409,mptcp dss ack 2168003474 seq 1134741381 subseq 38557 len 1428 csum 0x5fce], length 1428
11:45:04.422318 IP 112.26.3.8.45245 > 112.26.3.1.38151: Flags [.], ack 39985, win 18250, options [nop,nop,TS val 3003199 ecr 3231701,mptcp dss ack 1134742809], length 0
11:45:04.594163 IP 112.26.3.8.45245 > 112.26.3.1.38151: Flags [.], ack 39985, win 18250, options [nop,nop,TS val 3003199 ecr 3231701,mptcp dss ack 1134742809], length 0
11:45:04.751256 IP 112.26.3.1.38151 > 112.26.3.8.45245: Flags [.], seq 41413:42841, ack 1, win 893, options [nop,nop,TS val 3231703 ecr 3002409,mptcp dss ack 2168003474 seq 1134744237 subseq 41413 len 1428 csum 0xa270], length 1428
11:45:04.751465 IP 112.26.3.8.45245 > 112.26.3.1.38151: Flags [.], ack 39985, win 18615, options [nop,nop,TS val 3003528 ecr 3231701,nop,nop,sack 1 {41413:42841},mptcp dss ack 1134742809], length 0
11:45:04.917187 IP 112.26.3.8.45245 > 112.26.3.1.38151: Flags [.], ack 39985, win 18615, options [nop,nop,TS val 3003528 ecr 3231701,nop,nop,sack 1 {41413:42841},mptcp dss ack 1134742809], length 0
11:45:05.041935 IP 112.26.3.1.38151 > 112.26.3.8.45245: Flags [.], seq 44269:45697, ack 1, win 893, options [nop,nop,TS val 3231966 ecr 3002674,mptcp dss ack 2168003474 seq 1134757089 subseq 44269 len 1428 csum 0xa91b], length 1428
11:45:05.042137 IP 112.26.3.8.45245 > 112.26.3.1.38151: Flags [.], ack 39985, win 18980, options [nop,nop,TS val 3003819 ecr 3231701,nop,nop,sack 2 {44269:45697}{41413:42841},mptcp dss ack 1134742809], length 0
11:45:05.192315 IP 112.26.3.8.45245 > 112.26.3.1.38151: Flags [.], ack 39985, win 18980, options [nop,nop,TS val 3003819 ecr 3231701,nop,nop,sack 2 {44269:45697}{41413:42841},mptcp dss ack 1134742809], length 0
11:45:05.305030 IP 112.26.3.1.38151 > 112.26.3.8.45245: Flags [.], seq 47125:48553, ack 1, win 893, options [nop,nop,TS val 3232744 ecr 3003199,mptcp dss ack 2168003474 seq 1134787077 subseq 47125 len 1428 csum 0xac84], length 1428
11:45:05.305266 IP 112.26.3.8.45245 > 112.26.3.1.38151: Flags [.], ack 39985, win 19391, options [nop,nop,TS val 3004082 ecr 3231701,nop,nop,sack 2 {47125:48553}{44269:45697},mptcp dss ack 1134742809], length 0
11:45:05.456423 IP 112.26.3.8.45245 > 112.26.3.1.38151: Flags [.], ack 39985, win 19391, options [nop,nop,TS val 3004082 ecr 3231701,nop,nop,sack 2 {47125:48553}{44269:45697},mptcp dss ack 1134742809], length 0
11:45:05.639074 IP 112.26.3.1.38151 > 112.26.3.8.45245: Flags [.], seq 48553:49981, ack 1, win 893, options [nop,nop,TS val 3233083 ecr 3003528,mptcp dss ack 2168003474 seq 1134798501 subseq 48553 len 1428 csum 0x8ffb], length 1428
11:45:05.639316 IP 112.26.3.8.45245 > 112.26.3.1.38151: Flags [.], ack 39985, win 19710, options [nop,nop,TS val 3004416 ecr 3231701,nop,nop,sack 2 {47125:49981}{44269:45697},mptcp dss ack 1134742809], length 0
11:45:05.935538 IP 112.26.3.8.45245 > 112.26.3.1.38151: Flags [.], ack 39985, win 19710, options [nop,nop,TS val 3004416 ecr 3231701,nop,nop,sack 2 {47125:49981}{44269:45697},mptcp dss ack 1134742809], length 0
11:45:06.050633 IP 112.26.3.1.38151 > 112.26.3.8.45245: Flags [.], seq 42841:44269, ack 1, win 893, options [nop,nop,TS val 3233402 ecr 3004082,mptcp dss ack 2168003474 seq 1134745665 subseq 42841 len 1428 csum 0x8aeb], length 1428
11:45:06.050866 IP 112.26.3.8.45245 > 112.26.3.1.38151: Flags [.], ack 39985, win 19984, options [nop,nop,TS val 3004828 ecr 3231701,nop,nop,sack 2 {41413:45697}{47125:49981},mptcp dss ack 1134742809], length 0
11:45:06.347266 IP 112.26.3.8.45245 > 112.26.3.1.38151: Flags [.], ack 39985, win 19984, options [nop,nop,TS val 3004828 ecr 3231701,nop,nop,sack 2 {41413:45697}{47125:49981},mptcp dss ack 1134742809], length 0
11:45:06.425012 IP 112.26.3.1.38151 > 112.26.3.8.45245: Flags [.], seq 45697:47125, ack 1, win 893, options [nop,nop,TS val 3233800 ecr 3004416,mptcp dss ack 2168003474 seq 1134774225 subseq 45697 len 1428 csum 0xef34], length 1428
11:45:06.425216 IP 112.26.3.8.45245 > 112.26.3.1.38151: Flags [.], ack 39985, win 20486, options [nop,nop,TS val 3005202 ecr 3231701,nop,nop,sack 1 {41413:49981},mptcp dss ack 1134742809], length 0
11:45:06.524692 IP 112.26.3.8.45245 > 112.26.3.1.38151: Flags [.], ack 39985, win 20486, options [nop,nop,TS val 3005202 ecr 3231701,nop,nop,sack 1 {41413:49981},mptcp dss ack 1134742809], length 0
11:45:06.664693 IP 112.26.3.1.38151 > 112.26.3.8.45245: Flags [.], seq 39985:41413, ack 1, win 893, options [nop,nop,TS val 3234214 ecr 3004828,mptcp dss ack 2168003474 seq 1134742809 subseq 39985 len 1428 csum 0xbc], length 1428
11:45:06.664998 IP 112.26.3.8.45245 > 112.26.3.1.38151: Flags [.], ack 49981, win 20805, options [nop,nop,TS val 3005442 ecr 3234214,mptcp dss ack 1134825633], length 0
11:45:06.825585 IP 112.26.3.8.45245 > 112.26.3.1.38151: Flags [.], ack 49981, win 20805, options [nop,nop,TS val 3005442 ecr 3234214,mptcp dss ack 1134825633], length 0
11:45:06.985079 IP 112.26.3.1.38151 > 112.26.3.8.45245: Flags [.], seq 49981:51409, ack 1, win 893, options [nop,nop,TS val 3234581 ecr 3005202,mptcp dss ack 2168003474 seq 1134847053 subseq 49981 len 1428 csum 0xddb5], length 1428
11:45:06.985328 IP 112.26.3.8.45245 > 112.26.3.1.38151: Flags [.], ack 51409, win 21216, options [nop,nop,TS val 3005762 ecr 3234581,mptcp dss ack 1134827061], length 0
11:45:07.164008 IP 112.26.3.8.45245 > 112.26.3.1.38151: Flags [.], ack 51409, win 21216, options [nop,nop,TS val 3005762 ecr 3234581,mptcp dss ack 1134827061], length 0
11:45:07.256426 IP 112.26.3.1.38151 > 112.26.3.8.45245: Flags [.], seq 51409:52837, ack 1, win 893, options [nop,nop,TS val 3234886 ecr 3005442,mptcp dss ack 2168003474 seq 1134867045 subseq 51409 len 1428 csum 0x1213], length 1428
11:45:07.256675 IP 112.26.3.8.45245 > 112.26.3.1.38151: Flags [.], ack 52837, win 21535, options [nop,nop,TS val 3006033 ecr 3234886,mptcp dss ack 1134827061], length 0
11:45:07.386986 IP 112.26.3.8.45245 > 112.26.3.1.38151: Flags [.], ack 52837, win 21535, options [nop,nop,TS val 3006033 ecr 3234886,mptcp dss ack 1134827061], length 0
11:45:07.526900 IP 112.26.3.1.38151 > 112.26.3.8.45245: Flags [.], seq 52837:54265, ack 1, win 893, options [nop,nop,TS val 3234886 ecr 3005442,mptcp dss ack 2168003474 seq 1134868473 subseq 52837 len 1428 csum 0x2947], length 1428
11:45:07.527220 IP 112.26.3.8.45245 > 112.26.3.1.38151: Flags [.], ack 54265, win 21855, options [nop,nop,TS val 3006304 ecr 3234886,mptcp dss ack 1134827061], length 0
11:45:07.647985 IP 112.26.3.8.45245 > 112.26.3.1.38151: Flags [.], ack 54265, win 21855, options [nop,nop,TS val 3006304 ecr 3234886,mptcp dss ack 1134827061], length 0
11:45:07.754582 IP 112.26.3.1.38151 > 112.26.3.8.45245: Flags [.], seq 54265:55693, ack 1, win 893, options [nop,nop,TS val 3234886 ecr 3005442,mptcp dss ack 2168003474 seq 1134869901 subseq 54265 len 1428 csum 0xf2d6], length 1428
11:45:07.754822 IP 112.26.3.8.45245 > 112.26.3.1.38151: Flags [.], ack 55693, win 22129, options [nop,nop,TS val 3006531 ecr 3234886,mptcp dss ack 1134827061], length 0
11:45:07.881171 IP 112.26.3.8.45245 > 112.26.3.1.38151: Flags [.], ack 55693, win 22129, options [nop,nop,TS val 3006531 ecr 3234886,mptcp dss ack 1134827061], length 0
11:45:08.058332 IP 112.26.3.1.38151 > 112.26.3.8.45245: Flags [.], seq 55693:57121, ack 1, win 893, options [nop,nop,TS val 3235202 ecr 3005762,mptcp dss ack 2168003474 seq 1134878469 subseq 55693 len 1428 csum 0xdb6a], length 1428
11:45:08.058533 IP 112.26.3.8.45245 > 112.26.3.1.38151: Flags [.], ack 57121, win 22539, options [nop,nop,TS val 3006835 ecr 3235202,mptcp dss ack 1134827061], length 0
11:45:08.186198 IP 112.26.3.8.45245 > 112.26.3.1.38151: Flags [.], ack 57121, win 22539, options [nop,nop,TS val 3006835 ecr 3235202,mptcp dss ack 1134827061], length 0
11:45:08.398641 IP 112.26.3.1.38151 > 112.26.3.8.45245: Flags [.], seq 58549:59977, ack 1, win 893, options [nop,nop,TS val 3235812 ecr 3006304,mptcp dss ack 2168003474 seq 1134904173 subseq 58549 len 1428 csum 0x2934], length 1428
11:45:08.398804 IP 112.26.3.8.45245 > 112.26.3.1.38151: Flags [.], ack 57121, win 22995, options [nop,nop,TS val 3007175 ecr 3235202,nop,nop,sack 1 {58549:59977},mptcp dss ack 1134854193], length 0
11:45:08.576596 IP 112.26.3.8.45245 > 112.26.3.1.38151: Flags [.], ack 57121, win 22995, options [nop,nop,TS val 3007175 ecr 3235202,nop,nop,sack 1 {58549:59977},mptcp dss ack 1134854193], length 0
11:45:08.698839 IP 112.26.3.1.38151 > 112.26.3.8.45245: Flags [.], seq 61405:62833, ack 1, win 893, options [nop,nop,TS val 3236095 ecr 3006531,mptcp dss ack 2168003474 seq 1134918453 subseq 61405 len 1428 csum 0xc7f3], length 1428
11:45:08.699040 IP 112.26.3.8.45245 > 112.26.3.1.38151: Flags [.], ack 57121, win 23406, options [nop,nop,TS val 3007476 ecr 3235202,nop,nop,sack 2 {61405:62833}{58549:59977},mptcp dss ack 1134854193], length 0
11:45:08.863375 IP 112.26.3.8.45245 > 112.26.3.1.38151: Flags [.], ack 57121, win 23406, options [nop,nop,TS val 3007476 ecr 3235202,nop,nop,sack 2 {61405:62833}{58549:59977},mptcp dss ack 1134854193], length 0
11:45:09.003187 IP 112.26.3.1.38151 > 112.26.3.8.45245: Flags [.], seq 62833:64261, ack 1, win 893, options [nop,nop,TS val 3236390 ecr 3006835,mptcp dss ack 2168003474 seq 1134929877 subseq 62833 len 1428 csum 0xc6a3], length 1428
11:45:09.003391 IP 112.26.3.8.45245 > 112.26.3.1.38151: Flags [.], ack 57121, win 23771, options [nop,nop,TS val 3007780 ecr 3235202,nop,nop,sack 2 {61405:64261}{58549:59977},mptcp dss ack 1134854193], length 0
11:45:09.170861 IP 112.26.3.8.45245 > 112.26.3.1.38151: Flags [.], ack 57121, win 23771, options [nop,nop,TS val 3007780 ecr 3235202,nop,nop,sack 2 {61405:64261}{58549:59977},mptcp dss ack 1134854193], length 0
11:45:09.300209 IP 112.26.3.1.38151 > 112.26.3.8.45245: Flags [.], seq 64261:65689, ack 1, win 893, options [nop,nop,TS val 3236574 ecr 3007175,mptcp dss ack 2168003474 seq 1134934161 subseq 64261 len 1428 csum 0xf9bf], length 1428
11:45:09.300391 IP 112.26.3.8.45245 > 112.26.3.1.38151: Flags [.], ack 57121, win 24125, options [nop,nop,TS val 3008077 ecr 3235202,nop,nop,sack 2 {61405:65689}{58549:59977},mptcp dss ack 1134887037], length 0
11:45:09.482719 IP 112.26.3.8.45245 > 112.26.3.1.38151: Flags [.], ack 57121, win 24125, options [nop,nop,TS val 3008077 ecr 3235202,nop,nop,sack 2 {61405:65689}{58549:59977},mptcp dss ack 1134887037], length 0
11:45:09.596751 IP 112.26.3.1.38151 > 112.26.3.8.45245: Flags [.], seq 59977:61405, ack 1, win 893, options [nop,nop,TS val 3237037 ecr 3007780,mptcp dss ack 2168003474 seq 1134905601 subseq 59977 len 1428 csum 0xf593], length 1428
11:45:09.596958 IP 112.26.3.8.45245 > 112.26.3.1.38151: Flags [.], ack 57121, win 24125, options [nop,nop,TS val 3008374 ecr 3235202,nop,nop,sack 1 {58549:65689},mptcp dss ack 1134887037], length 0
11:45:09.752039 IP 112.26.3.8.45245 > 112.26.3.1.38151: Flags [.], ack 57121, win 24125, options [nop,nop,TS val 3008374 ecr 3235202,nop,nop,sack 1 {58549:65689},mptcp dss ack 1134887037], length 0
11:45:09.891625 IP 112.26.3.1.38151 > 112.26.3.8.45245: Flags [.], seq 65689:67117, ack 1, win 893, options [nop,nop,TS val 3237359 ecr 3008077,mptcp dss ack 2168003474 seq 1134964149 subseq 65689 len 1428 csum 0xb4d0], length 1428
11:45:09.891835 IP 112.26.3.8.45245 > 112.26.3.1.38151: Flags [.], ack 57121, win 24125, options [nop,nop,TS val 3008669 ecr 3235202,nop,nop,sack 1 {58549:67117},mptcp dss ack 1134887037], length 0
11:45:10.056766 IP 112.26.3.8.45245 > 112.26.3.1.38151: Flags [.], ack 57121, win 24125, options [nop,nop,TS val 3008669 ecr 3235202,nop,nop,sack 1 {58549:67117},mptcp dss ack 1134887037], length 0
11:45:10.197437 IP 112.26.3.1.38151 > 112.26.3.8.45245: Flags [.], seq 57121:58549, ack 1, win 893, options [nop,nop,TS val 3237660 ecr 3008374,mptcp dss ack 2168003474 seq 1134887037 subseq 57121 len 1428 csum 0x30a5], length 1428
11:45:10.197715 IP 112.26.3.8.45245 > 112.26.3.1.38151: Flags [.], ack 67117, win 23864, options [nop,nop,TS val 3008974 ecr 3237660,mptcp dss ack 1134925593], length 0
11:45:10.351944 IP 112.26.3.8.45245 > 112.26.3.1.38151: Flags [.], ack 67117, win 23864, options [nop,nop,TS val 3008974 ecr 3237660,mptcp dss ack 1134925593], length 0
11:45:10.488919 IP 112.26.3.1.38151 > 112.26.3.8.45245: Flags [.], seq 67117:68545, ack 1, win 893, options [nop,nop,TS val 3237953 ecr 3008669,mptcp dss ack 2168003474 seq 1134968433 subseq 67117 len 1428 csum 0xa410], length 1428
11:45:10.489126 IP 112.26.3.8.45245 > 112.26.3.1.38151: Flags [.], ack 68545, win 24208, options [nop,nop,TS val 3009266 ecr 3237953,mptcp dss ack 1134925593], length 0
11:45:10.663459 IP 112.26.3.8.45245 > 112.26.3.1.38151: Flags [.], ack 68545, win 24208, options [nop,nop,TS val 3009266 ecr 3237953,mptcp dss ack 1134925593], length 0
11:45:10.880931 IP 112.26.3.1.38151 > 112.26.3.8.45245: Flags [.], seq 68545:69973, ack 1, win 893, options [nop,nop,TS val 3238216 ecr 3008974,mptcp dss ack 2168003474 seq 1134978429 subseq 68545 len 1428 csum 0xd074], length 1428
11:45:10.881137 IP 112.26.3.8.45245 > 112.26.3.1.38151: Flags [.], ack 69973, win 24410, options [nop,nop,TS val 3009658 ecr 3238216,mptcp dss ack 1134969861], length 0
11:45:11.069748 IP 112.26.3.8.45245 > 112.26.3.1.38151: Flags [.], ack 69973, win 24410, options [nop,nop,TS val 3009658 ecr 3238216,mptcp dss ack 1134969861], length 0
11:45:11.211156 IP 112.26.3.1.38151 > 112.26.3.8.45245: Flags [.], seq 71401:72829, ack 1, win 893, options [nop,nop,TS val 3238576 ecr 3009266,mptcp dss ack 2168003474 seq 1134996993 subseq 71401 len 1428 csum 0x26b3], length 1428
11:45:11.211356 IP 112.26.3.8.45245 > 112.26.3.1.38151: Flags [.], ack 69973, win 24468, options [nop,nop,TS val 3009988 ecr 3238216,nop,nop,sack 1 {71401:72829},mptcp dss ack 1134969861], length 0
11:45:11.455266 IP 112.26.3.1.38151 > 112.26.3.8.45245: Flags [.], seq 74257:75685, ack 1, win 893, options [nop,nop,TS val 3238936 ecr 3009658,mptcp dss ack 2168003474 seq 1135014129 subseq 74257 len 1428 csum 0xbcb7], length 1428
11:45:11.455447 IP 112.26.3.8.45245 > 112.26.3.1.38151: Flags [.], ack 69973, win 24468, options [nop,nop,TS val 3010232 ecr 3238216,nop,nop,sack 2 {74257:75685}{71401:72829},mptcp dss ack 1134969861], length 0
11:45:11.607615 IP 112.26.3.8.45245 > 112.26.3.1.38151: Flags [.], ack 69973, win 24468, options [nop,nop,TS val 3010232 ecr 3238216,nop,nop,sack 2 {74257:75685}{71401:72829},mptcp dss ack 1134969861], length 0
11:45:11.697078 IP 112.26.3.1.38151 > 112.26.3.8.45245: Flags [.], seq 69973:71401, ack 1, win 893, options [nop,nop,TS val 3239472 ecr 3010232,mptcp dss ack 2168003474 seq 1134979857 subseq 69973 len 1428 csum 0x3de4], length 1428
11:45:11.697295 IP 112.26.3.8.45245 > 112.26.3.1.38151: Flags [.], ack 72829, win 24468, options [nop,nop,TS val 3010474 ecr 3239472,nop,nop,sack 1 {74257:75685},mptcp dss ack 1134969861], length 0
11:45:11.891779 IP 112.26.3.8.45245 > 112.26.3.1.38151: Flags [.], ack 72829, win 24468, options [nop,nop,TS val 3010474 ecr 3239472,nop,nop,sack 1 {74257:75685},mptcp dss ack 1134969861], length 0
11:45:11.966794 IP 112.26.3.1.38151 > 112.26.3.8.45245: Flags [.], seq 72829:74257, ack 1, win 893, options [nop,nop,TS val 3239776 ecr 3010474,mptcp dss ack 2168003474 seq 1134998421 subseq 72829 len 1428 csum 0x2768], length 1428
11:45:11.967048 IP 112.26.3.8.45245 > 112.26.3.1.38151: Flags [.], ack 75685, win 24468, options [nop,nop,TS val 3010743 ecr 3239776,mptcp dss ack 1134969861], length 0
11:45:12.129173 IP 112.26.3.8.45245 > 112.26.3.1.38151: Flags [.], ack 75685, win 24468, options [nop,nop,TS val 3010743 ecr 3239776,mptcp dss ack 1134969861], length 0
11:45:12.230229 IP 112.26.3.1.38151 > 112.26.3.8.45245: Flags [.], seq 75685:77113, ack 1, win 893, options [nop,nop,TS val 3239776 ecr 3010474,mptcp dss ack 2168003474 seq 1135041261 subseq 75685 len 1428 csum 0x165], length 1428
11:45:12.230439 IP 112.26.3.8.45245 > 112.26.3.1.38151: Flags [.], ack 77113, win 24329, options [nop,nop,TS val 3011007 ecr 3239776,mptcp dss ack 1134994137], length 0
11:45:12.432234 IP 112.26.3.8.45245 > 112.26.3.1.38151: Flags [.], ack 77113, win 24329, options [nop,nop,TS val 3011007 ecr 3239776,mptcp dss ack 1134994137], length 0
11:45:12.536964 IP 112.26.3.1.38151 > 112.26.3.8.45245: Flags [.], seq 77113:78541, ack 1, win 893, options [nop,nop,TS val 3240259 ecr 3010743,mptcp dss ack 2168003474 seq 1135051257 subseq 77113 len 1428 csum 0x718b], length 1428
11:45:12.537138 IP 112.26.3.8.45245 > 112.26.3.1.38151: Flags [.], ack 78541, win 24504, options [nop,nop,TS val 3011314 ecr 3240259,mptcp dss ack 1135016985], length 0
11:45:12.710500 IP 112.26.3.8.45245 > 112.26.3.1.38151: Flags [.], ack 78541, win 24504, options [nop,nop,TS val 3011314 ecr 3240259,mptcp dss ack 1135016985], length 0
11:45:12.879946 IP 112.26.3.1.38151 > 112.26.3.8.45245: Flags [.], seq 78541:79969, ack 1, win 893, options [nop,nop,TS val 3240497 ecr 3011007,mptcp dss ack 2168003474 seq 1135061253 subseq 78541 len 1428 csum 0x7093], length 1428
11:45:12.880121 IP 112.26.3.8.45245 > 112.26.3.1.38151: Flags [.], ack 79969, win 24558, options [nop,nop,TS val 3011656 ecr 3240497,mptcp dss ack 1135055541], length 0
11:45:12.998747 IP 112.26.3.8.45245 > 112.26.3.1.38151: Flags [.], ack 79969, win 24558, options [nop,nop,TS val 3011656 ecr 3240497,mptcp dss ack 1135055541], length 0
11:45:13.134430 IP 112.26.3.1.38151 > 112.26.3.8.45245: Flags [.], seq 79969:81397, ack 1, win 893, options [nop,nop,TS val 3240497 ecr 3011007,mptcp dss ack 2168003474 seq 1135062681 subseq 79969 len 1428 csum 0xf820], length 1428
11:45:13.134829 IP 112.26.3.8.45245 > 112.26.3.1.38151: Flags [.], ack 81397, win 24527, options [nop,nop,TS val 3011911 ecr 3240497,mptcp dss ack 1135066965], length 0
11:45:13.295688 IP 112.26.3.8.45245 > 112.26.3.1.38151: Flags [.], ack 81397, win 24527, options [nop,nop,TS val 3011911 ecr 3240497,mptcp dss ack 1135066965], length 0
11:45:13.433123 IP 112.26.3.1.38151 > 112.26.3.8.45245: Flags [.], seq 81397:82825, ack 1, win 893, options [nop,nop,TS val 3240827 ecr 3011314,mptcp dss ack 2168003474 seq 1135076961 subseq 81397 len 1428 csum 0x713b], length 1428
11:45:13.433445 IP 112.26.3.8.45245 > 112.26.3.1.38151: Flags [.], ack 82825, win 24558, options [nop,nop,TS val 3012210 ecr 3240827,mptcp dss ack 1135071249], length 0
11:45:13.590605 IP 112.26.3.8.45245 > 112.26.3.1.38151: Flags [.], ack 82825, win 24558, options [nop,nop,TS val 3012210 ecr 3240827,mptcp dss ack 1135071249], length 0
11:45:13.709727 IP 112.26.3.1.38151 > 112.26.3.8.45245: Flags [.], seq 82825:84253, ack 1, win 893, options [nop,nop,TS val 3241099 ecr 3011656,mptcp dss ack 2168003474 seq 1135089813 subseq 82825 len 1428 csum 0x4206], length 1428
11:45:13.710080 IP 112.26.3.8.45245 > 112.26.3.1.38151: Flags [.], ack 84253, win 24540, options [nop,nop,TS val 3012487 ecr 3241099,mptcp dss ack 1135082673], length 0
11:45:13.841223 IP 112.26.3.8.45245 > 112.26.3.1.38151: Flags [.], ack 84253, win 24540, options [nop,nop,TS val 3012487 ecr 3241099,mptcp dss ack 1135082673], length 0
11:45:14.044502 IP 112.26.3.1.38151 > 112.26.3.8.45245: Flags [.], seq 84253:85681, ack 1, win 893, options [nop,nop,TS val 3241369 ecr 3011911,mptcp dss ack 2168003474 seq 1135098381 subseq 84253 len 1428 csum 0x52d4], length 1428
11:45:14.044847 IP 112.26.3.8.45245 > 112.26.3.1.38151: Flags [.], ack 85681, win 24576, options [nop,nop,TS val 3012822 ecr 3241369,mptcp dss ack 1135095525], length 0
11:45:14.239584 IP 112.26.3.8.45245 > 112.26.3.1.38151: Flags [.], ack 85681, win 24576, options [nop,nop,TS val 3012822 ecr 3241369,mptcp dss ack 1135095525], length 0
11:45:14.315783 IP 112.26.3.1.38151 > 112.26.3.8.45245: Flags [.], seq 85681:87109, ack 1, win 893, options [nop,nop,TS val 3241604 ecr 3012210,mptcp dss ack 2168003474 seq 1135111233 subseq 85681 len 1428 csum 0xd5ce], length 1428
11:45:14.316070 IP 112.26.3.8.45245 > 112.26.3.1.38151: Flags [.], ack 87109, win 24576, options [nop,nop,TS val 3013093 ecr 3241604,mptcp dss ack 1135095525], length 0
11:45:14.516542 IP 112.26.3.8.45245 > 112.26.3.1.38151: Flags [.], ack 87109, win 24576, options [nop,nop,TS val 3013093 ecr 3241604,mptcp dss ack 1135095525], length 0
11:45:14.654508 IP 112.26.3.1.38151 > 112.26.3.8.45245: Flags [.], seq 88537:89965, ack 1, win 893, options [nop,nop,TS val 3242105 ecr 3012822,mptcp dss ack 2168003474 seq 1135134081 subseq 88537 len 1428 csum 0x362a], length 1428
11:45:14.654766 IP 112.26.3.8.45245 > 112.26.3.1.38151: Flags [.], ack 87109, win 24576, options [nop,nop,TS val 3013431 ecr 3241604,nop,nop,sack 1 {88537:89965},mptcp dss ack 1135095525], length 0
11:45:14.828154 IP 112.26.3.8.45245 > 112.26.3.1.38151: Flags [.], ack 87109, win 24576, options [nop,nop,TS val 3013431 ecr 3241604,nop,nop,sack 1 {88537:89965},mptcp dss ack 1135095525], length 0
11:45:14.958961 IP 112.26.3.1.38151 > 112.26.3.8.45245: Flags [.], seq 89965:91393, ack 1, win 893, options [nop,nop,TS val 3242380 ecr 3013093,mptcp dss ack 2168003474 seq 1135144077 subseq 89965 len 1428 csum 0xeaba], length 1428
11:45:14.959259 IP 112.26.3.8.45245 > 112.26.3.1.38151: Flags [.], ack 87109, win 24442, options [nop,nop,TS val 3013736 ecr 3241604,nop,nop,sack 1 {88537:91393},mptcp dss ack 1135121229], length 0
