11:44:47.116201 IP 112.26.0.8.46222 > 112.26.0.1.38151: Flags [S], seq 1720921841, win 65535, options [mss 1460,sackOK,TS val 2985819 ecr 0,nop,wscale 6,mptcp capable csum {0xafc16660309eba07}], length 0
11:44:47.116647 IP 112.26.0.1.38151 > 112.26.0.8.46222: Flags [S.], seq 1145020541, ack 1720921842, win 28560, options [mss 1460,sackOK,TS val 3214979 ecr 2985819,nop,wscale 7,mptcp capable csum {0x9300c12f56515bbe}], length 0
11:44:47.133685 IP 112.26.0.1.38151 > 112.26.0.8.46222: Flags [S.], seq 1145020541, ack 1720921842, win 28560, options [mss 1460,sackOK,TS val 3214979 ecr 2985819,nop,wscale 7,mptcp capable csum {0x9300c12f56515bbe}], length 0
11:44:47.161089 IP 112.26.0.8.46222 > 112.26.0.1.38151: Flags [.], ack 1, win 1369, options [nop,nop,TS val 2985913 ecr 3214979,mptcp capable csum {0xafc16660309eba07,0x9300c12f56515bbe},mptcp dss ack 1134334589], length 0
11:44:47.161440 IP 112.26.0.1.38151 > 112.26.0.8.46222: Flags [.], ack 1, win 224, options [nop,nop,TS val 3215024 ecr 2985913,mptcp add-addr id 3 112.26.1.1,mptcp dss ack 2168003474], length 0
11:44:47.161488 IP 112.26.0.1.38151 > 112.26.0.8.46222: Flags [.], ack 1, win 224, options [nop,nop,TS val 3215024 ecr 2985913,mptcp add-addr id 5 112.26.3.1,mptcp dss ack 2168003474], length 0
11:44:47.161518 IP 112.26.0.1.38151 > 112.26.0.8.46222: Flags [.], ack 1, win 224, options [nop,nop,TS val 3215024 ecr 2985913,mptcp add-addr id 6 112.26.2.1,mptcp dss ack 2168003474], length 0
11:44:47.167298 IP 112.26.0.1.38151 > 112.26.0.8.46222: Flags [.], seq 1:1429, ack 1, win 224, options [nop,nop,TS val 3215030 ecr 2985913,mptcp dss ack 2168003474 seq 1134334589 subseq 1 len 1428 csum 0xe807], length 1428
11:44:47.167408 IP 112.26.0.1.38151 > 112.26.0.8.46222: Flags [.], seq 1429:2857, ack 1, win 224, options [nop,nop,TS val 3215030 ecr 2985913,mptcp dss ack 2168003474 seq 1134336017 subseq 1429 len 1428 csum 0x756], length 1428
11:44:47.167504 IP 112.26.0.1.38151 > 112.26.0.8.46222: Flags [P.], seq 2857:4097, ack 1, win 224, options [nop,nop,TS val 3215030 ecr 2985913,mptcp dss ack 2168003474 seq 1134337445 subseq 2857 len 1240 csum 0x4828], length 1240
11:44:47.167602 IP 112.26.0.1.38151 > 112.26.0.8.46222: Flags [.], seq 4097:5525, ack 1, win 224, options [nop,nop,TS val 3215030 ecr 2985913,mptcp dss ack 2168003474 seq 1134338685 subseq 4097 len 1428 csum 0x3c61], length 1428
11:44:47.167684 IP 112.26.0.1.38151 > 112.26.0.8.46222: Flags [.], seq 5525:6953, ack 1, win 224, options [nop,nop,TS val 3215030 ecr 2985913,mptcp dss ack 2168003474 seq 1134340113 subseq 5525 len 1428 csum 0x98d6], length 1428
11:44:47.167771 IP 112.26.0.1.38151 > 112.26.0.8.46222: Flags [.], seq 6953:8381, ack 1, win 224, options [nop,nop,TS val 3215030 ecr 2985913,mptcp dss ack 2168003474 seq 1134341541 subseq 6953 len 1428 csum 0x32a3], length 1428
11:44:47.167899 IP 112.26.0.1.38151 > 112.26.0.8.46222: Flags [.], seq 8381:9809, ack 1, win 224, options [nop,nop,TS val 3215031 ecr 2985913,mptcp dss ack 2168003474 seq 1134342969 subseq 8381 len 1428 csum 0x235], length 1428
11:44:47.167982 IP 112.26.0.1.38151 > 112.26.0.8.46222: Flags [.], seq 9809:11237, ack 1, win 224, options [nop,nop,TS val 3215031 ecr 2985913,mptcp dss ack 2168003474 seq 1134344397 subseq 9809 len 1428 csum 0xfaa0], length 1428
11:44:47.168337 IP 112.26.0.1.38151 > 112.26.0.8.46222: Flags [.], seq 11237:12665, ack 1, win 224, options [nop,nop,TS val 3215031 ecr 2985913,mptcp dss ack 2168003474 seq 1134345825 subseq 11237 len 1428 csum 0x2a27], length 1428
11:44:47.168423 IP 112.26.0.1.38151 > 112.26.0.8.46222: Flags [.], seq 12665:14093, ack 1, win 224, options [nop,nop,TS val 3215031 ecr 2985913,mptcp dss ack 2168003474 seq 1134347253 subseq 12665 len 1428 csum 0x6c24], length 1428
11:44:47.239941 IP 112.26.0.1.38151 > 112.26.0.8.46222: Flags [.], ack 1, win 224, options [nop,nop,TS val 3215024 ecr 2985913,mptcp add-addr id 3 112.26.1.1,mptcp dss ack 2168003474], length 0
11:44:47.256766 IP 112.26.0.8.46222 > 112.26.0.1.38151: Flags [.], ack 1, win 1369, options [nop,nop,TS val 2985913 ecr 3214979,mptcp add-addr id 3 112.26.1.8,mptcp dss ack 1134334589], length 0
11:44:47.330362 IP 112.26.0.1.38151 > 112.26.0.8.46222: Flags [.], ack 1, win 224, options [nop,nop,TS val 3215024 ecr 2985913,mptcp add-addr id 5 112.26.3.1,mptcp dss ack 2168003474], length 0
11:44:47.353161 IP 112.26.0.1.38151 > 112.26.0.8.46222: Flags [.], seq 12665:14093, ack 1, win 224, options [nop,nop,TS val 3215216 ecr 2985913,mptcp dss ack 2168003474 seq 1134347253 subseq 12665 len 1428 csum 0x6c24], length 1428
11:44:47.422173 IP 112.26.0.1.38151 > 112.26.0.8.46222: Flags [.], ack 1, win 224, options [nop,nop,TS val 3215024 ecr 2985913,mptcp add-addr id 6 112.26.2.1,mptcp dss ack 2168003474], length 0
11:44:47.441115 IP 112.26.0.8.46222 > 112.26.0.1.38151: Flags [.], ack 1, win 1369, options [nop,nop,TS val 2985913 ecr 3214979,mptcp add-addr id 5 112.26.3.8,mptcp dss ack 1134334589], length 0
11:44:47.457618 IP 112.26.0.1.38151 > 112.26.0.8.46222: Flags [.], seq 1:1429, ack 1, win 224, options [nop,nop,TS val 3215030 ecr 2985913,mptcp dss ack 2168003474 seq 1134334589 subseq 1 len 1428 csum 0xe807], length 1428
11:44:47.534384 IP 112.26.0.8.46222 > 112.26.0.1.38151: Flags [.], ack 1, win 1369, options [nop,nop,TS val 2985913 ecr 3214979,mptcp add-addr id 6 112.26.2.8,mptcp dss ack 1134334589], length 0
11:44:47.547514 IP 112.26.0.1.38151 > 112.26.0.8.46222: Flags [.], seq 1429:2857, ack 1, win 224, options [nop,nop,TS val 3215030 ecr 2985913,mptcp dss ack 2168003474 seq 1134336017 subseq 1429 len 1428 csum 0x756], length 1428
11:44:47.716434 IP 112.26.0.1.38151 > 112.26.0.8.46222: Flags [P.], seq 2857:4097, ack 1, win 224, options [nop,nop,TS val 3215030 ecr 2985913,mptcp dss ack 2168003474 seq 1134337445 subseq 2857 len 1240 csum 0x4828], length 1240
11:44:47.733867 IP 112.26.0.1.38151 > 112.26.0.8.46222: Flags [.], seq 4097:5525, ack 1, win 224, options [nop,nop,TS val 3215030 ecr 2985913,mptcp dss ack 2168003474 seq 1134338685 subseq 4097 len 1428 csum 0x3c61], length 1428
11:44:47.741414 IP 112.26.0.1.38151 > 112.26.0.8.46222: Flags [.], seq 5525:6953, ack 1, win 224, options [nop,nop,TS val 3215030 ecr 2985913,mptcp dss ack 2168003474 seq 1134340113 subseq 5525 len 1428 csum 0x98d6], length 1428
11:44:47.801691 IP 112.26.0.1.38151 > 112.26.0.8.46222: Flags [.], seq 1:1429, ack 1, win 224, options [nop,nop,TS val 3215664 ecr 2985913,mptcp dss ack 2168003474 seq 1134334589 subseq 1 len 1428 csum 0xe807], length 1428
11:44:47.846957 IP 112.26.0.1.38151 > 112.26.0.8.46222: Flags [.], seq 6953:8381, ack 1, win 224, options [nop,nop,TS val 3215030 ecr 2985913,mptcp dss ack 2168003474 seq 1134341541 subseq 6953 len 1428 csum 0x32a3], length 1428
11:44:47.934704 IP 112.26.0.1.38151 > 112.26.0.8.46222: Flags [.], seq 8381:9809, ack 1, win 224, options [nop,nop,TS val 3215031 ecr 2985913,mptcp dss ack 2168003474 seq 1134342969 subseq 8381 len 1428 csum 0x235], length 1428
11:44:47.950884 IP 112.26.0.1.38151 > 112.26.0.8.46222: Flags [.], seq 12665:14093, ack 1, win 224, options [nop,nop,TS val 3215216 ecr 2985913,mptcp dss ack 2168003474 seq 1134347253 subseq 12665 len 1428 csum 0x6c24], length 1428
11:44:48.044259 IP 112.26.0.1.38151 > 112.26.0.8.46222: Flags [.], seq 1:1429, ack 1, win 224, options [nop,nop,TS val 3215664 ecr 2985913,mptcp dss ack 2168003474 seq 1134334589 subseq 1 len 1428 csum 0xe807], length 1428
11:44:48.129028 IP 112.26.0.8.46222 > 112.26.0.1.38151: Flags [.], ack 1429, win 1415, options [nop,nop,TS val 2986401 ecr 3215030,mptcp dss ack 1134336017], length 0
11:44:48.129301 IP 112.26.0.1.38151 > 112.26.0.8.46222: Flags [.], seq 14093:15521, ack 1, win 224, options [nop,nop,TS val 3215992 ecr 2986401,mptcp dss ack 2168003474 seq 1134336017 subseq 14093 len 1428 csum 0xd5dd], length 1428
11:44:48.153248 IP 112.26.0.8.46222 > 112.26.0.1.38151: Flags [.], ack 2857, win 1460, options [nop,nop,TS val 2986423 ecr 3215030,mptcp dss ack 1134337445], length 0
11:44:48.153484 IP 112.26.0.1.38151 > 112.26.0.8.46222: Flags [P.], seq 15521:16761, ack 1, win 224, options [nop,nop,TS val 3216016 ecr 2986423,mptcp dss ack 2168003474 seq 1134337445 subseq 15521 len 1240 csum 0x16b0], length 1240
11:44:48.241697 IP 112.26.0.1.38151 > 112.26.0.8.46222: Flags [.], seq 14093:15521, ack 1, win 224, options [nop,nop,TS val 3215992 ecr 2986401,mptcp dss ack 2168003474 seq 1134336017 subseq 14093 len 1428 csum 0xd5dd], length 1428
11:44:48.336028 IP 112.26.0.1.38151 > 112.26.0.8.46222: Flags [P.], seq 15521:16761, ack 1, win 224, options [nop,nop,TS val 3216016 ecr 2986423,mptcp dss ack 2168003474 seq 1134337445 subseq 15521 len 1240 csum 0x16b0], length 1240
11:44:48.439439 IP 112.26.0.8.46222 > 112.26.0.1.38151: Flags [.], ack 4097, win 1506, options [nop,nop,TS val 2986692 ecr 3215030,mptcp dss ack 1134338685], length 0
11:44:48.439700 IP 112.26.0.1.38151 > 112.26.0.8.46222: Flags [.], seq 16761:18189, ack 1, win 224, options [nop,nop,TS val 3216302 ecr 2986692,mptcp dss ack 2168003474 seq 1134338685 subseq 16761 len 1428 csum 0xae9], length 1428
11:44:48.534789 IP 112.26.0.1.38151 > 112.26.0.8.46222: Flags [.], seq 16761:18189, ack 1, win 224, options [nop,nop,TS val 3216302 ecr 2986692,mptcp dss ack 2168003474 seq 1134338685 subseq 16761 len 1428 csum 0xae9], length 1428
11:44:48.546629 IP 112.26.0.8.46222 > 112.26.0.1.38151: Flags [.], ack 6953, win 1597, options [nop,nop,TS val 2986816 ecr 3215030,mptcp dss ack 1134341541], length 0
11:44:48.546876 IP 112.26.0.1.38151 > 112.26.0.8.46222: Flags [.], seq 18189:19617, ack 1, win 224, options [nop,nop,TS val 3216409 ecr 2986816,mptcp dss ack 2168003474 seq 1134341541 subseq 18189 len 1428 csum 0x6bf], length 1428
11:44:48.546921 IP 112.26.0.1.38151 > 112.26.0.8.46222: Flags [.], seq 19617:21045, ack 1, win 224, options [nop,nop,TS val 3216409 ecr 2986816,mptcp dss ack 2168003474 seq 1134342969 subseq 19617 len 1428 csum 0xd650], length 1428
11:44:48.723411 IP 112.26.0.1.38151 > 112.26.0.8.46222: Flags [.], seq 18189:19617, ack 1, win 224, options [nop,nop,TS val 3216409 ecr 2986816,mptcp dss ack 2168003474 seq 1134341541 subseq 18189 len 1428 csum 0x6bf], length 1428
11:44:48.739851 IP 112.26.0.8.46222 > 112.26.0.1.38151: Flags [.], ack 8381, win 1643, options [nop,nop,TS val 2986936 ecr 3215030,mptcp dss ack 1134342969], length 0
11:44:48.740111 IP 112.26.0.1.38151 > 112.26.0.8.46222: Flags [.], seq 21045:22473, ack 1, win 224, options [nop,nop,TS val 3216602 ecr 2986936,mptcp dss ack 2168003474 seq 1134344397 subseq 21045 len 1428 csum 0xcebc], length 1428
11:44:48.823722 IP 112.26.0.1.38151 > 112.26.0.8.46222: Flags [.], seq 19617:21045, ack 1, win 224, options [nop,nop,TS val 3216409 ecr 2986816,mptcp dss ack 2168003474 seq 1134342969 subseq 19617 len 1428 csum 0xd650], length 1428
11:44:48.833554 IP 112.26.0.1.38151 > 112.26.0.8.46222: Flags [.], seq 21045:22473, ack 1, win 224, options [nop,nop,TS val 3216602 ecr 2986936,mptcp dss ack 2168003474 seq 1134344397 subseq 21045 len 1428 csum 0xcebc], length 1428
11:44:48.846567 IP 112.26.0.8.46222 > 112.26.0.1.38151: Flags [.], ack 9809, win 1734, options [nop,nop,TS val 2987226 ecr 3215031,nop,nop,sack 1 {12665:14093},mptcp dss ack 1134344397], length 0
11:44:48.846843 IP 112.26.0.1.38151 > 112.26.0.8.46222: Flags [.], seq 22473:23901, ack 1, win 224, options [nop,nop,TS val 3216709 ecr 2987226,mptcp dss ack 2168003474 seq 1134345825 subseq 22473 len 1428 csum 0xfe42], length 1428
11:44:48.846887 IP 112.26.0.1.38151 > 112.26.0.8.46222: Flags [.], seq 23901:25329, ack 1, win 224, options [nop,nop,TS val 3216709 ecr 2987226,mptcp dss ack 2168003474 seq 1134347253 subseq 23901 len 1428 csum 0x4040], length 1428
11:44:48.862388 IP 112.26.0.1.38151 > 112.26.0.8.46222: Flags [.], seq 22473:23901, ack 1, win 224, options [nop,nop,TS val 3216709 ecr 2987226,mptcp dss ack 2168003474 seq 1134345825 subseq 22473 len 1428 csum 0xfe42], length 1428
11:44:48.943371 IP 112.26.0.8.46222 > 112.26.0.1.38151: Flags [.], ack 9809, win 1734, options [nop,nop,TS val 2987303 ecr 3215031,nop,nop,sack 2 {1:1429}{12665:14093},mptcp dss ack 1134344397], length 0
11:44:49.026292 IP 112.26.0.1.38151 > 112.26.0.8.46222: Flags [.], seq 23901:25329, ack 1, win 224, options [nop,nop,TS val 3216709 ecr 2987226,mptcp dss ack 2168003474 seq 1134347253 subseq 23901 len 1428 csum 0x4040], length 1428
11:44:49.043174 IP 112.26.0.8.46222 > 112.26.0.1.38151: Flags [.], ack 9809, win 1780, options [nop,nop,TS val 2987424 ecr 3215031,nop,nop,sack 1 {12665:15521},mptcp dss ack 1134344397], length 0
11:44:49.043422 IP 112.26.0.1.38151 > 112.26.0.8.46222: Flags [.], seq 9809:11237, ack 1, win 224, options [nop,nop,TS val 3216905 ecr 2987424,mptcp dss ack 2168003474 seq 1134344397 subseq 9809 len 1428 csum 0xfaa0], length 1428
11:44:49.127370 IP 112.26.0.8.46222 > 112.26.0.1.38151: Flags [.], ack 9809, win 1825, options [nop,nop,TS val 2987526 ecr 3215031,nop,nop,sack 1 {12665:16761},mptcp dss ack 1134344397], length 0
11:44:49.146406 IP 112.26.0.1.38151 > 112.26.0.8.46222: Flags [.], seq 9809:11237, ack 1, win 224, options [nop,nop,TS val 3216905 ecr 2987424,mptcp dss ack 2168003474 seq 1134344397 subseq 9809 len 1428 csum 0xfaa0], length 1428
11:44:49.230679 IP 112.26.0.8.46222 > 112.26.0.1.38151: Flags [.], ack 9809, win 1871, options [nop,nop,TS val 2987704 ecr 3215031,nop,nop,sack 1 {12665:18189},mptcp dss ack 1134344397], length 0
11:44:49.231003 IP 112.26.0.1.38151 > 112.26.0.8.46222: Flags [.], seq 11237:12665, ack 1, win 224, options [nop,nop,TS val 3217093 ecr 2987704,mptcp dss ack 2168003474 seq 1134345825 subseq 11237 len 1428 csum 0x2a27], length 1428
11:44:49.250731 IP 112.26.0.1.38151 > 112.26.0.8.46222: Flags [.], seq 11237:12665, ack 1, win 224, options [nop,nop,TS val 3217093 ecr 2987704,mptcp dss ack 2168003474 seq 1134345825 subseq 11237 len 1428 csum 0x2a27], length 1428
11:44:49.326070 IP 112.26.0.8.46222 > 112.26.0.1.38151: Flags [.], ack 9809, win 1917, options [nop,nop,TS val 2987733 ecr 3215031,nop,nop,sack 1 {12665:19617},mptcp dss ack 1134344397], length 0
11:44:49.368925 IP 112.26.0.8.46222 > 112.26.0.1.38151: Flags [.], ack 9809, win 1962, options [nop,nop,TS val 2987830 ecr 3215031,nop,nop,sack 1 {12665:21045},mptcp dss ack 1134344397], length 0
11:44:49.369106 IP 112.26.0.1.38151 > 112.26.0.8.46222: Flags [.], seq 25329:26757, ack 1, win 224, options [nop,nop,TS val 3217232 ecr 2987733,mptcp dss ack 2168003474 seq 1134348681 subseq 25329 len 1428 csum 0x92d9], length 1428
11:44:49.444860 IP 112.26.0.1.38151 > 112.26.0.8.46222: Flags [.], seq 25329:26757, ack 1, win 224, options [nop,nop,TS val 3217232 ecr 2987733,mptcp dss ack 2168003474 seq 1134348681 subseq 25329 len 1428 csum 0x92d9], length 1428
11:44:49.530941 IP 112.26.0.8.46222 > 112.26.0.1.38151: Flags [.], ack 9809, win 2008, options [nop,nop,TS val 2987899 ecr 3215031,nop,nop,sack 1 {12665:22473},mptcp dss ack 1134344397], length 0
11:44:49.531188 IP 112.26.0.1.38151 > 112.26.0.8.46222: Flags [.], seq 26757:28185, ack 1, win 224, options [nop,nop,TS val 3217394 ecr 2987830,mptcp dss ack 2168003474 seq 1134350109 subseq 26757 len 1428 csum 0xfe34], length 1428
11:44:49.547804 IP 112.26.0.1.38151 > 112.26.0.8.46222: Flags [.], seq 26757:28185, ack 1, win 224, options [nop,nop,TS val 3217394 ecr 2987830,mptcp dss ack 2168003474 seq 1134350109 subseq 26757 len 1428 csum 0xfe34], length 1428
11:44:49.630505 IP 112.26.0.8.46222 > 112.26.0.1.38151: Flags [.], ack 9809, win 2054, options [nop,nop,TS val 2987918 ecr 3215031,nop,nop,sack 1 {12665:23901},mptcp dss ack 1134344397], length 0
11:44:49.630795 IP 112.26.0.1.38151 > 112.26.0.8.46222: Flags [.], seq 28185:29613, ack 1, win 224, options [nop,nop,TS val 3217493 ecr 2987899,mptcp dss ack 2168003474 seq 1134351537 subseq 28185 len 1428 csum 0xe788], length 1428
11:44:49.648820 IP 112.26.0.1.38151 > 112.26.0.8.46222: Flags [.], seq 28185:29613, ack 1, win 224, options [nop,nop,TS val 3217493 ecr 2987899,mptcp dss ack 2168003474 seq 1134351537 subseq 28185 len 1428 csum 0xe788], length 1428
11:44:49.729053 IP 112.26.0.8.46222 > 112.26.0.1.38151: Flags [.], ack 9809, win 2099, options [nop,nop,TS val 2988121 ecr 3215031,nop,nop,sack 1 {12665:25329},mptcp dss ack 1134344397], length 0
11:44:49.729345 IP 112.26.0.1.38151 > 112.26.0.8.46222: Flags [.], seq 29613:31041, ack 1, win 224, options [nop,nop,TS val 3217592 ecr 2987918,mptcp dss ack 2168003474 seq 1134352965 subseq 29613 len 1428 csum 0xf0d4], length 1428
11:44:49.761890 IP 112.26.0.1.38151 > 112.26.0.8.46222: Flags [.], seq 29613:31041, ack 1, win 224, options [nop,nop,TS val 3217592 ecr 2987918,mptcp dss ack 2168003474 seq 1134352965 subseq 29613 len 1428 csum 0xf0d4], length 1428
11:44:49.840599 IP 112.26.0.8.46222 > 112.26.0.1.38151: Flags [.], ack 11237, win 2145, options [nop,nop,TS val 2988228 ecr 3216905,nop,nop,sack 1 {12665:25329},mptcp dss ack 1134345825], length 0
11:44:49.840857 IP 112.26.0.1.38151 > 112.26.0.8.46222: Flags [.], seq 31041:32469, ack 1, win 224, options [nop,nop,TS val 3217703 ecr 2988121,mptcp dss ack 2168003474 seq 1134354393 subseq 31041 len 1428 csum 0xb076], length 1428
11:44:49.840919 IP 112.26.0.1.38151 > 112.26.0.8.46222: Flags [.], seq 32469:33897, ack 1, win 224, options [nop,nop,TS val 3217703 ecr 2988228,mptcp dss ack 2168003474 seq 1134355821 subseq 32469 len 1428 csum 0xf976], length 1428
11:44:49.857652 IP 112.26.0.8.46222 > 112.26.0.1.38151: Flags [.], ack 25329, win 2190, options [nop,nop,TS val 2988331 ecr 3217093,mptcp dss ack 1134348681], length 0
11:44:49.857890 IP 112.26.0.1.38151 > 112.26.0.8.46222: Flags [.], seq 33897:35325, ack 1, win 224, options [nop,nop,TS val 3217720 ecr 2988331,mptcp dss ack 2168003474 seq 1134357249 subseq 33897 len 1428 csum 0x5611], length 1428
11:44:49.955220 IP 112.26.0.1.38151 > 112.26.0.8.46222: Flags [.], seq 31041:32469, ack 1, win 224, options [nop,nop,TS val 3217703 ecr 2988121,mptcp dss ack 2168003474 seq 1134354393 subseq 31041 len 1428 csum 0xb076], length 1428
11:44:50.041806 IP 112.26.0.1.38151 > 112.26.0.8.46222: Flags [.], seq 32469:33897, ack 1, win 224, options [nop,nop,TS val 3217703 ecr 2988228,mptcp dss ack 2168003474 seq 1134355821 subseq 32469 len 1428 csum 0xf976], length 1428
11:44:50.051274 IP 112.26.0.8.46222 > 112.26.0.1.38151: Flags [.], ack 26757, win 2236, options [nop,nop,TS val 2988432 ecr 3217232,mptcp dss ack 1134350109], length 0
11:44:50.051554 IP 112.26.0.1.38151 > 112.26.0.8.46222: Flags [.], seq 35325:36753, ack 1, win 224, options [nop,nop,TS val 3217914 ecr 2988432,mptcp dss ack 2168003474 seq 1134358677 subseq 35325 len 1428 csum 0xeddf], length 1428
11:44:50.051601 IP 112.26.0.1.38151 > 112.26.0.8.46222: Flags [.], seq 36753:38181, ack 1, win 224, options [nop,nop,TS val 3217914 ecr 2988432,mptcp dss ack 2168003474 seq 1134360105 subseq 36753 len 1428 csum 0x7de], length 1428
11:44:50.143809 IP 112.26.0.1.38151 > 112.26.0.8.46222: Flags [.], seq 33897:35325, ack 1, win 224, options [nop,nop,TS val 3217720 ecr 2988331,mptcp dss ack 2168003474 seq 1134357249 subseq 33897 len 1428 csum 0x5611], length 1428
11:44:50.154567 IP 112.26.0.8.46222 > 112.26.0.1.38151: Flags [.], ack 28185, win 2282, options [nop,nop,TS val 2988533 ecr 3217394,mptcp dss ack 1134351537], length 0
11:44:50.154814 IP 112.26.0.1.38151 > 112.26.0.8.46222: Flags [.], seq 38181:39609, ack 1, win 224, options [nop,nop,TS val 3218017 ecr 2988533,mptcp dss ack 2168003474 seq 1134361533 subseq 38181 len 1428 csum 0x8dda], length 1428
11:44:50.248891 IP 112.26.0.1.38151 > 112.26.0.8.46222: Flags [.], seq 35325:36753, ack 1, win 224, options [nop,nop,TS val 3217914 ecr 2988432,mptcp dss ack 2168003474 seq 1134358677 subseq 35325 len 1428 csum 0xeddf], length 1428
11:44:50.335727 IP 112.26.0.8.46222 > 112.26.0.1.38151: Flags [.], ack 29613, win 2327, options [nop,nop,TS val 2988628 ecr 3217493,mptcp dss ack 1134352965], length 0
11:44:50.336093 IP 112.26.0.1.38151 > 112.26.0.8.46222: Flags [.], seq 39609:41037, ack 1, win 224, options [nop,nop,TS val 3218198 ecr 2988628,mptcp dss ack 2168003474 seq 1134362961 subseq 39609 len 1428 csum 0x9a37], length 1428
11:44:50.441041 IP 112.26.0.1.38151 > 112.26.0.8.46222: Flags [.], seq 36753:38181, ack 1, win 224, options [nop,nop,TS val 3217914 ecr 2988432,mptcp dss ack 2168003474 seq 1134360105 subseq 36753 len 1428 csum 0x7de], length 1428
11:44:50.453244 IP 112.26.0.8.46222 > 112.26.0.1.38151: Flags [.], ack 31041, win 2373, options [nop,nop,TS val 2988811 ecr 3217592,mptcp dss ack 1134354393], length 0
11:44:50.453520 IP 112.26.0.1.38151 > 112.26.0.8.46222: Flags [.], seq 41037:42465, ack 1, win 224, options [nop,nop,TS val 3218315 ecr 2988811,mptcp dss ack 2168003474 seq 1134364389 subseq 41037 len 1428 csum 0xbfd8], length 1428
11:44:50.536945 IP 112.26.0.1.38151 > 112.26.0.8.46222: Flags [.], seq 38181:39609, ack 1, win 224, options [nop,nop,TS val 3218017 ecr 2988533,mptcp dss ack 2168003474 seq 1134361533 subseq 38181 len 1428 csum 0x8dda], length 1428
11:44:50.554756 IP 112.26.0.8.46222 > 112.26.0.1.38151: Flags [.], ack 32469, win 2419, options [nop,nop,TS val 2988907 ecr 3217703,mptcp dss ack 1134355821], length 0
11:44:50.555016 IP 112.26.0.1.38151 > 112.26.0.8.46222: Flags [.], seq 42465:43893, ack 1, win 224, options [nop,nop,TS val 3218417 ecr 2988907,mptcp dss ack 2168003474 seq 1134365817 subseq 42465 len 1428 csum 0xb318], length 1428
11:44:50.555061 IP 112.26.0.1.38151 > 112.26.0.8.46222: Flags [.], seq 43893:45321, ack 1, win 224, options [nop,nop,TS val 3218417 ecr 2988907,mptcp dss ack 2168003474 seq 1134367245 subseq 43893 len 1428 csum 0x2ec3], length 1428
11:44:50.650639 IP 112.26.0.8.46222 > 112.26.0.1.38151: Flags [.], ack 33897, win 2464, options [nop,nop,TS val 2989008 ecr 3217703,mptcp dss ack 1134357249], length 0
11:44:50.650886 IP 112.26.0.1.38151 > 112.26.0.8.46222: Flags [.], seq 45321:46749, ack 1, win 224, options [nop,nop,TS val 3218513 ecr 2989008,mptcp dss ack 2168003474 seq 1134368673 subseq 45321 len 1428 csum 0x4fb4], length 1428
11:44:50.666901 IP 112.26.0.1.38151 > 112.26.0.8.46222: Flags [.], seq 39609:41037, ack 1, win 224, options [nop,nop,TS val 3218198 ecr 2988628,mptcp dss ack 2168003474 seq 1134362961 subseq 39609 len 1428 csum 0x9a37], length 1428
11:44:50.744119 IP 112.26.0.8.46222 > 112.26.0.1.38151: Flags [.], ack 35325, win 2510, options [nop,nop,TS val 2989032 ecr 3217720,mptcp dss ack 1134358677], length 0
11:44:50.744363 IP 112.26.0.1.38151 > 112.26.0.8.46222: Flags [.], seq 46749:48177, ack 1, win 224, options [nop,nop,TS val 3218607 ecr 2989032,mptcp dss ack 2168003474 seq 1134370101 subseq 46749 len 1428 csum 0x3c59], length 1428
11:44:50.833386 IP 112.26.0.8.46222 > 112.26.0.1.38151: Flags [.], ack 36753, win 2555, options [nop,nop,TS val 2989127 ecr 3217914,mptcp dss ack 1134360105], length 0
11:44:50.833682 IP 112.26.0.1.38151 > 112.26.0.8.46222: Flags [.], seq 48177:49605, ack 1, win 224, options [nop,nop,TS val 3218696 ecr 2989127,mptcp dss ack 2168003474 seq 1134371529 subseq 48177 len 1428 csum 0x94cc], length 1428
11:44:50.846891 IP 112.26.0.1.38151 > 112.26.0.8.46222: Flags [.], seq 41037:42465, ack 1, win 224, options [nop,nop,TS val 3218315 ecr 2988811,mptcp dss ack 2168003474 seq 1134364389 subseq 41037 len 1428 csum 0xbfd8], length 1428
11:44:50.942987 IP 112.26.0.1.38151 > 112.26.0.8.46222: Flags [.], seq 42465:43893, ack 1, win 224, options [nop,nop,TS val 3218417 ecr 2988907,mptcp dss ack 2168003474 seq 1134365817 subseq 42465 len 1428 csum 0xb318], length 1428
11:44:50.948869 IP 112.26.0.1.38151 > 112.26.0.8.46222: Flags [.], seq 43893:45321, ack 1, win 224, options [nop,nop,TS val 3218417 ecr 2988907,mptcp dss ack 2168003474 seq 1134367245 subseq 43893 len 1428 csum 0x2ec3], length 1428
11:44:51.035340 IP 112.26.0.1.38151 > 112.26.0.8.46222: Flags [.], seq 45321:46749, ack 1, win 224, options [nop,nop,TS val 3218513 ecr 2989008,mptcp dss ack 2168003474 seq 1134368673 subseq 45321 len 1428 csum 0x4fb4], length 1428
11:44:51.053750 IP 112.26.0.8.46222 > 112.26.0.1.38151: Flags [.], ack 38181, win 2601, options [nop,nop,TS val 2989325 ecr 3217914,mptcp dss ack 1134361533], length 0
11:44:51.054017 IP 112.26.0.1.38151 > 112.26.0.8.46222: Flags [.], seq 49605:51033, ack 1, win 224, options [nop,nop,TS val 3218916 ecr 2989325,mptcp dss ack 2168003474 seq 1134372957 subseq 49605 len 1428 csum 0x1ad2], length 1428
11:44:51.133355 IP 112.26.0.8.46222 > 112.26.0.1.38151: Flags [.], ack 39609, win 2647, options [nop,nop,TS val 2989412 ecr 3218017,mptcp dss ack 1134362961], length 0
11:44:51.133679 IP 112.26.0.1.38151 > 112.26.0.8.46222: Flags [.], seq 51033:52461, ack 1, win 224, options [nop,nop,TS val 3218996 ecr 2989412,mptcp dss ack 2168003474 seq 1134374385 subseq 51033 len 1428 csum 0xe734], length 1428
11:44:51.153010 IP 112.26.0.1.38151 > 112.26.0.8.46222: Flags [.], seq 46749:48177, ack 1, win 224, options [nop,nop,TS val 3218607 ecr 2989032,mptcp dss ack 2168003474 seq 1134370101 subseq 46749 len 1428 csum 0x3c59], length 1428
11:44:51.171251 IP 112.26.0.8.46222 > 112.26.0.1.38151: Flags [.], ack 41037, win 2692, options [nop,nop,TS val 2989530 ecr 3218198,mptcp dss ack 1134364389], length 0
11:44:51.171493 IP 112.26.0.1.38151 > 112.26.0.8.46222: Flags [.], seq 52461:53889, ack 1, win 224, options [nop,nop,TS val 3219034 ecr 2989530,mptcp dss ack 2168003474 seq 1134375813 subseq 52461 len 1428 csum 0xe06d], length 1428
11:44:51.258926 IP 112.26.0.1.38151 > 112.26.0.8.46222: Flags [.], seq 48177:49605, ack 1, win 224, options [nop,nop,TS val 3218696 ecr 2989127,mptcp dss ack 2168003474 seq 1134371529 subseq 48177 len 1428 csum 0x94cc], length 1428
11:44:51.352820 IP 112.26.0.8.46222 > 112.26.0.1.38151: Flags [.], ack 42465, win 2738, options [nop,nop,TS val 2989628 ecr 3218315,mptcp dss ack 1134365817], length 0
11:44:51.353043 IP 112.26.0.1.38151 > 112.26.0.8.46222: Flags [.], seq 53889:55317, ack 1, win 224, options [nop,nop,TS val 3219215 ecr 2989628,mptcp dss ack 2168003474 seq 1134377241 subseq 53889 len 1428 csum 0xc], length 1428
11:44:51.452695 IP 112.26.0.1.38151 > 112.26.0.8.46222: Flags [.], seq 49605:51033, ack 1, win 224, options [nop,nop,TS val 3218916 ecr 2989325,mptcp dss ack 2168003474 seq 1134372957 subseq 49605 len 1428 csum 0x1ad2], length 1428
11:44:51.474034 IP 112.26.0.8.46222 > 112.26.0.1.38151: Flags [.], ack 43893, win 2784, options [nop,nop,TS val 2989730 ecr 3218417,mptcp dss ack 1134367245], length 0
11:44:51.474285 IP 112.26.0.1.38151 > 112.26.0.8.46222: Flags [.], seq 55317:56745, ack 1, win 224, options [nop,nop,TS val 3219336 ecr 2989730,mptcp dss ack 2168003474 seq 1134378669 subseq 55317 len 1428 csum 0xf0b1], length 1428
11:44:51.551248 IP 112.26.0.1.38151 > 112.26.0.8.46222: Flags [.], seq 51033:52461, ack 1, win 224, options [nop,nop,TS val 3218996 ecr 2989412,mptcp dss ack 2168003474 seq 1134374385 subseq 51033 len 1428 csum 0xe734], length 1428
11:44:51.562876 IP 112.26.0.8.46222 > 112.26.0.1.38151: Flags [.], ack 45321, win 2829, options [nop,nop,TS val 2989820 ecr 3218417,mptcp dss ack 1134368673], length 0
11:44:51.563123 IP 112.26.0.1.38151 > 112.26.0.8.46222: Flags [.], seq 56745:58173, ack 1, win 224, options [nop,nop,TS val 3219425 ecr 2989820,mptcp dss ack 2168003474 seq 1134380097 subseq 56745 len 1428 csum 0x7e57], length 1428
11:44:51.563169 IP 112.26.0.1.38151 > 112.26.0.8.46222: Flags [.], seq 58173:59601, ack 1, win 224, options [nop,nop,TS val 3219425 ecr 2989820,mptcp dss ack 2168003474 seq 1134381525 subseq 58173 len 1428 csum 0xccf0], length 1428
11:44:51.657875 IP 112.26.0.8.46222 > 112.26.0.1.38151: Flags [.], ack 46749, win 2875, options [nop,nop,TS val 2989917 ecr 3218513,mptcp dss ack 1134370101], length 0
11:44:51.658108 IP 112.26.0.1.38151 > 112.26.0.8.46222: Flags [.], seq 59601:61029, ack 1, win 224, options [nop,nop,TS val 3219520 ecr 2989917,mptcp dss ack 2168003474 seq 1134382953 subseq 59601 len 1428 csum 0x5ef7], length 1428
11:44:51.745110 IP 112.26.0.8.46222 > 112.26.0.1.38151: Flags [.], ack 48177, win 2920, options [nop,nop,TS val 2990020 ecr 3218607,mptcp dss ack 1134371529], length 0
11:44:51.745354 IP 112.26.0.1.38151 > 112.26.0.8.46222: Flags [.], seq 61029:62457, ack 1, win 224, options [nop,nop,TS val 3219607 ecr 2990020,mptcp dss ack 2168003474 seq 1134384381 subseq 61029 len 1428 csum 0x1aa8], length 1428
11:44:51.753816 IP 112.26.0.1.38151 > 112.26.0.8.46222: Flags [.], seq 53889:55317, ack 1, win 224, options [nop,nop,TS val 3219215 ecr 2989628,mptcp dss ack 2168003474 seq 1134377241 subseq 53889 len 1428 csum 0xc], length 1428
11:44:51.842903 IP 112.26.0.8.46222 > 112.26.0.1.38151: Flags [.], ack 49605, win 2966, options [nop,nop,TS val 2990121 ecr 3218696,mptcp dss ack 1134372957], length 0
11:44:51.843238 IP 112.26.0.1.38151 > 112.26.0.8.46222: Flags [.], seq 62457:63885, ack 1, win 224, options [nop,nop,TS val 3219705 ecr 2990121,mptcp dss ack 2168003474 seq 1134385809 subseq 62457 len 1428 csum 0xe92c], length 1428
11:44:51.862819 IP 112.26.0.1.38151 > 112.26.0.8.46222: Flags [.], seq 55317:56745, ack 1, win 224, options [nop,nop,TS val 3219336 ecr 2989730,mptcp dss ack 2168003474 seq 1134378669 subseq 55317 len 1428 csum 0xf0b1], length 1428
11:44:51.942005 IP 112.26.0.8.46222 > 112.26.0.1.38151: Flags [.], ack 51033, win 3012, options [nop,nop,TS val 2990241 ecr 3218916,mptcp dss ack 1134374385], length 0
11:44:51.942312 IP 112.26.0.1.38151 > 112.26.0.8.46222: Flags [P.], seq 63885:65313, ack 1, win 224, options [nop,nop,TS val 3219804 ecr 2990241,mptcp dss ack 2168003474 seq 1134387237 subseq 63885 len 1428 csum 0x25a1], length 1428
11:44:51.955854 IP 112.26.0.1.38151 > 112.26.0.8.46222: Flags [.], seq 56745:58173, ack 1, win 224, options [nop,nop,TS val 3219425 ecr 2989820,mptcp dss ack 2168003474 seq 1134380097 subseq 56745 len 1428 csum 0x7e57], length 1428
11:44:51.970975 IP 112.26.0.1.38151 > 112.26.0.8.46222: Flags [.], seq 58173:59601, ack 1, win 224, options [nop,nop,TS val 3219425 ecr 2989820,mptcp dss ack 2168003474 seq 1134381525 subseq 58173 len 1428 csum 0xccf0], length 1428
11:44:52.046284 IP 112.26.0.8.46222 > 112.26.0.1.38151: Flags [.], ack 52461, win 3057, options [nop,nop,TS val 2990336 ecr 3218996,mptcp dss ack 1134375813], length 0
11:44:52.046619 IP 112.26.0.1.38151 > 112.26.0.8.46222: Flags [.], seq 65313:66741, ack 1, win 224, options [nop,nop,TS val 3219909 ecr 2990336,mptcp dss ack 2168003474 seq 1134388665 subseq 65313 len 1428 csum 0x22ad], length 1428
11:44:52.065846 IP 112.26.0.1.38151 > 112.26.0.8.46222: Flags [.], seq 59601:61029, ack 1, win 224, options [nop,nop,TS val 3219520 ecr 2989917,mptcp dss ack 2168003474 seq 1134382953 subseq 59601 len 1428 csum 0x5ef7], length 1428
11:44:52.150961 IP 112.26.0.1.38151 > 112.26.0.8.46222: Flags [.], seq 61029:62457, ack 1, win 224, options [nop,nop,TS val 3219607 ecr 2990020,mptcp dss ack 2168003474 seq 1134384381 subseq 61029 len 1428 csum 0x1aa8], length 1428
11:44:52.158496 IP 112.26.0.1.38151 > 112.26.0.8.46222: Flags [.], seq 62457:63885, ack 1, win 224, options [nop,nop,TS val 3219705 ecr 2990121,mptcp dss ack 2168003474 seq 1134385809 subseq 62457 len 1428 csum 0xe92c], length 1428
11:44:52.253105 IP 112.26.0.8.46222 > 112.26.0.1.38151: Flags [.], ack 52461, win 3103, options [nop,nop,TS val 2990532 ecr 3218996,nop,nop,sack 1 {53889:55317},mptcp dss ack 1134375813], length 0
11:44:52.271729 IP 112.26.0.8.46222 > 112.26.0.1.38151: Flags [.], ack 52461, win 3149, options [nop,nop,TS val 2990641 ecr 3218996,nop,nop,sack 1 {53889:56745},mptcp dss ack 1134375813], length 0
11:44:52.271954 IP 112.26.0.1.38151 > 112.26.0.8.46222: Flags [.], seq 66741:68169, ack 1, win 224, options [nop,nop,TS val 3220134 ecr 2990532,mptcp dss ack 2168003474 seq 1134390093 subseq 66741 len 1428 csum 0x5aa7], length 1428
11:44:52.369828 IP 112.26.0.1.38151 > 112.26.0.8.46222: Flags [P.], seq 63885:65313, ack 1, win 224, options [nop,nop,TS val 3219804 ecr 2990241,mptcp dss ack 2168003474 seq 1134387237 subseq 63885 len 1428 csum 0x25a1], length 1428
11:44:52.387910 IP 112.26.0.8.46222 > 112.26.0.1.38151: Flags [.], ack 52461, win 3194, options [nop,nop,TS val 2990738 ecr 3218996,nop,nop,sack 1 {53889:58173},mptcp dss ack 1134375813], length 0
11:44:52.388142 IP 112.26.0.1.38151 > 112.26.0.8.46222: Flags [.], seq 68169:69597, ack 1, win 224, options [nop,nop,TS val 3220250 ecr 2990641,mptcp dss ack 2168003474 seq 1134391521 subseq 68169 len 1428 csum 0x7031], length 1428
11:44:52.388193 IP 112.26.0.1.38151 > 112.26.0.8.46222: Flags [.], seq 52461:53889, ack 1, win 224, options [nop,nop,TS val 3220250 ecr 2990738,mptcp dss ack 2168003474 seq 1134375813 subseq 52461 len 1428 csum 0xe06d], length 1428
11:44:52.463642 IP 112.26.0.1.38151 > 112.26.0.8.46222: Flags [.], seq 65313:66741, ack 1, win 224, options [nop,nop,TS val 3219909 ecr 2990336,mptcp dss ack 2168003474 seq 1134388665 subseq 65313 len 1428 csum 0x22ad], length 1428
11:44:52.484782 IP 112.26.0.8.46222 > 112.26.0.1.38151: Flags [.], ack 52461, win 3240, options [nop,nop,TS val 2990836 ecr 3218996,nop,nop,sack 1 {53889:59601},mptcp dss ack 1134375813], length 0
11:44:52.554864 IP 112.26.0.1.38151 > 112.26.0.8.46222: Flags [.], seq 66741:68169, ack 1, win 224, options [nop,nop,TS val 3220134 ecr 2990532,mptcp dss ack 2168003474 seq 1134390093 subseq 66741 len 1428 csum 0x5aa7], length 1428
11:44:52.562922 IP 112.26.0.8.46222 > 112.26.0.1.38151: Flags [.], ack 52461, win 3285, options [nop,nop,TS val 2990939 ecr 3218996,nop,nop,sack 1 {53889:61029},mptcp dss ack 1134375813], length 0
11:44:52.563169 IP 112.26.0.1.38151 > 112.26.0.8.46222: Flags [.], seq 69597:71025, ack 1, win 224, options [nop,nop,TS val 3220425 ecr 2990836,mptcp dss ack 2168003474 seq 1134392949 subseq 69597 len 1428 csum 0xde3e], length 1428
11:44:52.659356 IP 112.26.0.8.46222 > 112.26.0.1.38151: Flags [.], ack 52461, win 3331, options [nop,nop,TS val 2991026 ecr 3218996,nop,nop,sack 1 {53889:62457},mptcp dss ack 1134375813], length 0
11:44:52.659603 IP 112.26.0.1.38151 > 112.26.0.8.46222: Flags [.], seq 71025:72453, ack 1, win 224, options [nop,nop,TS val 3220522 ecr 2990939,mptcp dss ack 2168003474 seq 1134394377 subseq 71025 len 1428 csum 0x6b24], length 1428
11:44:52.761560 IP 112.26.0.1.38151 > 112.26.0.8.46222: Flags [.], seq 68169:69597, ack 1, win 224, options [nop,nop,TS val 3220250 ecr 2990641,mptcp dss ack 2168003474 seq 1134391521 subseq 68169 len 1428 csum 0x7031], length 1428
11:44:52.773277 IP 112.26.0.1.38151 > 112.26.0.8.46222: Flags [.], seq 52461:53889, ack 1, win 224, options [nop,nop,TS val 3220250 ecr 2990738,mptcp dss ack 2168003474 seq 1134375813 subseq 52461 len 1428 csum 0xe06d], length 1428
11:44:52.853087 IP 112.26.0.8.46222 > 112.26.0.1.38151: Flags [.], ack 52461, win 3377, options [nop,nop,TS val 2991045 ecr 3218996,nop,nop,sack 1 {53889:63885},mptcp dss ack 1134375813], length 0
11:44:53.051231 IP 112.26.0.1.38151 > 112.26.0.8.46222: Flags [.], seq 69597:71025, ack 1, win 224, options [nop,nop,TS val 3220425 ecr 2990836,mptcp dss ack 2168003474 seq 1134392949 subseq 69597 len 1428 csum 0xde3e], length 1428
11:44:53.075245 IP 112.26.0.1.38151 > 112.26.0.8.46222: Flags [.], seq 71025:72453, ack 1, win 224, options [nop,nop,TS val 3220522 ecr 2990939,mptcp dss ack 2168003474 seq 1134394377 subseq 71025 len 1428 csum 0x6b24], length 1428
11:44:53.177922 IP 112.26.0.8.46222 > 112.26.0.1.38151: Flags [.], ack 52461, win 3422, options [nop,nop,TS val 2991443 ecr 3218996,nop,nop,sack 1 {53889:65313},mptcp dss ack 1134375813], length 0
11:44:53.186307 IP 112.26.0.8.46222 > 112.26.0.1.38151: Flags [.], ack 52461, win 3468, options [nop,nop,TS val 2991469 ecr 3218996,nop,nop,sack 1 {53889:66741},mptcp dss ack 1134375813], length 0
11:44:53.186546 IP 112.26.0.1.38151 > 112.26.0.8.46222: Flags [.], seq 72453:73881, ack 1, win 224, options [nop,nop,TS val 3221049 ecr 2991443,mptcp dss ack 2168003474 seq 1134395805 subseq 72453 len 1428 csum 0xf95c], length 1428
11:44:53.257157 IP 112.26.0.8.46222 > 112.26.0.1.38151: Flags [.], ack 52461, win 3514, options [nop,nop,TS val 2991545 ecr 3218996,nop,nop,sack 1 {53889:68169},mptcp dss ack 1134375813], length 0
11:44:53.257471 IP 112.26.0.1.38151 > 112.26.0.8.46222: Flags [.], seq 73881:75309, ack 1, win 224, options [nop,nop,TS val 3221120 ecr 2991469,mptcp dss ack 2168003474 seq 1134397233 subseq 73881 len 1428 csum 0x4ae3], length 1428
11:44:53.369289 IP 112.26.0.1.38151 > 112.26.0.8.46222: Flags [.], seq 72453:73881, ack 1, win 224, options [nop,nop,TS val 3221049 ecr 2991443,mptcp dss ack 2168003474 seq 1134395805 subseq 72453 len 1428 csum 0xf95c], length 1428
11:44:53.393117 IP 112.26.0.8.46222 > 112.26.0.1.38151: Flags [.], ack 52461, win 3559, options [nop,nop,TS val 2991736 ecr 3218996,nop,nop,sack 1 {53889:69597},mptcp dss ack 1134375813], length 0
11:44:53.393312 IP 112.26.0.1.38151 > 112.26.0.8.46222: Flags [.], seq 75309:76737, ack 1, win 224, options [nop,nop,TS val 3221256 ecr 2991545,mptcp dss ack 2168003474 seq 1134398661 subseq 75309 len 1428 csum 0x2563], length 1428
11:44:53.461530 IP 112.26.0.1.38151 > 112.26.0.8.46222: Flags [.], seq 73881:75309, ack 1, win 224, options [nop,nop,TS val 3221120 ecr 2991469,mptcp dss ack 2168003474 seq 1134397233 subseq 73881 len 1428 csum 0x4ae3], length 1428
11:44:53.483537 IP 112.26.0.1.38151 > 112.26.0.8.46222: Flags [.], seq 75309:76737, ack 1, win 224, options [nop,nop,TS val 3221256 ecr 2991545,mptcp dss ack 2168003474 seq 1134398661 subseq 75309 len 1428 csum 0x2563], length 1428
11:44:53.565937 IP 112.26.0.8.46222 > 112.26.0.1.38151: Flags [.], ack 69597, win 3605, options [nop,nop,TS val 2991836 ecr 3220250,mptcp dss ack 1134392949], length 0
11:44:53.566181 IP 112.26.0.1.38151 > 112.26.0.8.46222: Flags [.], seq 76737:78165, ack 1, win 224, options [nop,nop,TS val 3221428 ecr 2991736,mptcp dss ack 2168003474 seq 1134400089 subseq 76737 len 1428 csum 0x678], length 1428
11:44:53.566250 IP 112.26.0.1.38151 > 112.26.0.8.46222: Flags [.], seq 78165:79593, ack 1, win 224, options [nop,nop,TS val 3221428 ecr 2991836,mptcp dss ack 2168003474 seq 1134401517 subseq 78165 len 1428 csum 0x8dd4], length 1428
11:44:53.582120 IP 112.26.0.1.38151 > 112.26.0.8.46222: Flags [.], seq 76737:78165, ack 1, win 224, options [nop,nop,TS val 3221428 ecr 2991736,mptcp dss ack 2168003474 seq 1134400089 subseq 76737 len 1428 csum 0x678], length 1428
11:44:53.660245 IP 112.26.0.8.46222 > 112.26.0.1.38151: Flags [.], ack 71025, win 3650, options [nop,nop,TS val 2992142 ecr 3220425,mptcp dss ack 1134394377], length 0
11:44:53.660552 IP 112.26.0.1.38151 > 112.26.0.8.46222: Flags [.], seq 79593:81021, ack 1, win 224, options [nop,nop,TS val 3221523 ecr 2992142,mptcp dss ack 2168003474 seq 1134402945 subseq 79593 len 1428 csum 0xd2cc], length 1428
11:44:53.660611 IP 112.26.0.1.38151 > 112.26.0.8.46222: Flags [.], seq 81021:82449, ack 1, win 224, options [nop,nop,TS val 3221523 ecr 2992142,mptcp dss ack 2168003474 seq 1134404373 subseq 81021 len 1428 csum 0x9c7b], length 1428
11:44:53.685846 IP 112.26.0.1.38151 > 112.26.0.8.46222: Flags [.], seq 78165:79593, ack 1, win 224, options [nop,nop,TS val 3221428 ecr 2991836,mptcp dss ack 2168003474 seq 1134401517 subseq 78165 len 1428 csum 0x8dd4], length 1428
11:44:53.766303 IP 112.26.0.1.38151 > 112.26.0.8.46222: Flags [.], seq 79593:81021, ack 1, win 224, options [nop,nop,TS val 3221523 ecr 2992142,mptcp dss ack 2168003474 seq 1134402945 subseq 79593 len 1428 csum 0xd2cc], length 1428
11:44:53.853108 IP 112.26.0.8.46222 > 112.26.0.1.38151: Flags [.], ack 72453, win 3696, options [nop,nop,TS val 2992242 ecr 3220522,mptcp dss ack 1134395805], length 0
11:44:53.853407 IP 112.26.0.1.38151 > 112.26.0.8.46222: Flags [.], seq 82449:83877, ack 1, win 224, options [nop,nop,TS val 3221716 ecr 2992242,mptcp dss ack 2168003474 seq 1134405801 subseq 82449 len 1428 csum 0xd728], length 1428
