11:44:47.111734 IP 112.26.0.8.46222 > 112.26.0.1.38151: Flags [S], seq 1720921841, win 65535, options [mss 1460,sackOK,TS val 2985819 ecr 0,nop,wscale 6,mptcp capable csum {0xafc16660309eba07}], length 0
11:44:47.114051 IP 112.26.0.8.46222 > 112.26.0.1.38151: Flags [S], seq 1720921841, win 65535, options [mss 1460,sackOK,TS val 2985819 ecr 0,nop,wscale 6,mptcp capable csum {0xafc16660309eba07}], length 0
11:44:47.120038 IP 112.26.0.8.46222 > 112.26.0.1.38151: Flags [S], seq 1720921841, win 65535, options [mss 1460,sackOK,TS val 2985819 ecr 0,nop,wscale 6,mptcp capable csum {0xafc16660309eba07}], length 0
11:44:47.133795 IP 112.26.0.1.38151 > 112.26.0.8.46222: Flags [S.], seq 1145020541, ack 1720921842, win 28560, options [mss 1460,sackOK,TS val 3214979 ecr 2985819,nop,wscale 7,mptcp capable csum {0x9300c12f56515bbe}], length 0
11:44:47.134121 IP 112.26.0.1.38151 > 112.26.0.8.46222: Flags [S.], seq 1145020541, ack 1720921842, win 28560, options [mss 1460,sackOK,TS val 3214979 ecr 2985819,nop,wscale 7,mptcp capable csum {0x9300c12f56515bbe}], length 0
11:44:47.139531 IP 112.26.0.8.46222 > 112.26.0.1.38151: Flags [.], ack 1, win 1369, options [nop,nop,TS val 2985913 ecr 3214979,mptcp capable csum {0xafc16660309eba07,0x9300c12f56515bbe},mptcp dss ack 1134334589], length 0
11:44:47.139835 IP 112.26.0.8.46222 > 112.26.0.1.38151: Flags [.], ack 1, win 1369, options [nop,nop,TS val 2985913 ecr 3214979,mptcp capable csum {0xafc16660309eba07,0x9300c12f56515bbe},mptcp dss ack 1134334589], length 0
11:44:47.152979 IP 112.26.0.8.46222 > 112.26.0.1.38151: Flags [.], ack 1, win 1369, options [nop,nop,TS val 2985913 ecr 3214979,mptcp add-addr id 3 112.26.1.8,mptcp dss ack 1134334589], length 0
11:44:47.153180 IP 112.26.0.8.46222 > 112.26.0.1.38151: Flags [.], ack 1, win 1369, options [nop,nop,TS val 2985913 ecr 3214979,mptcp add-addr id 3 112.26.1.8,mptcp dss ack 1134334589], length 0
11:44:47.163573 IP 112.26.0.8.46222 > 112.26.0.1.38151: Flags [.], ack 1, win 1369, options [nop,nop,TS val 2985913 ecr 3214979,mptcp capable csum {0xafc16660309eba07,0x9300c12f56515bbe},mptcp dss ack 1134334589], length 0
11:44:47.212242 IP 112.26.0.8.46222 > 112.26.0.1.38151: Flags [.], ack 1, win 1369, options [nop,nop,TS val 2985913 ecr 3214979,mptcp add-addr id 5 112.26.3.8,mptcp dss ack 1134334589], length 0
11:44:47.212587 IP 112.26.0.8.46222 > 112.26.0.1.38151: Flags [.], ack 1, win 1369, options [nop,nop,TS val 2985913 ecr 3214979,mptcp add-addr id 5 112.26.3.8,mptcp dss ack 1134334589], length 0
11:44:47.233732 IP 112.26.0.8.46222 > 112.26.0.1.38151: Flags [.], ack 1, win 1369, options [nop,nop,TS val 2985913 ecr 3214979,mptcp add-addr id 6 112.26.2.8,mptcp dss ack 1134334589], length 0
11:44:47.233955 IP 112.26.0.8.46222 > 112.26.0.1.38151: Flags [.], ack 1, win 1369, options [nop,nop,TS val 2985913 ecr 3214979,mptcp add-addr id 6 112.26.2.8,mptcp dss ack 1134334589], length 0
11:44:47.240052 IP 112.26.0.1.38151 > 112.26.0.8.46222: Flags [.], ack 1, win 224, options [nop,nop,TS val 3215024 ecr 2985913,mptcp add-addr id 3 112.26.1.1,mptcp dss ack 2168003474], length 0
11:44:47.240254 IP 112.26.0.1.38151 > 112.26.0.8.46222: Flags [.], ack 1, win 224, options [nop,nop,TS val 3215024 ecr 2985913,mptcp add-addr id 3 112.26.1.1,mptcp dss ack 2168003474], length 0
11:44:47.256880 IP 112.26.0.8.46222 > 112.26.0.1.38151: Flags [.], ack 1, win 1369, options [nop,nop,TS val 2985913 ecr 3214979,mptcp add-addr id 3 112.26.1.8,mptcp dss ack 1134334589], length 0
11:44:47.330472 IP 112.26.0.1.38151 > 112.26.0.8.46222: Flags [.], ack 1, win 224, options [nop,nop,TS val 3215024 ecr 2985913,mptcp add-addr id 5 112.26.3.1,mptcp dss ack 2168003474], length 0
11:44:47.330698 IP 112.26.0.1.38151 > 112.26.0.8.46222: Flags [.], ack 1, win 224, options [nop,nop,TS val 3215024 ecr 2985913,mptcp add-addr id 5 112.26.3.1,mptcp dss ack 2168003474], length 0
11:44:47.422320 IP 112.26.0.1.38151 > 112.26.0.8.46222: Flags [.], ack 1, win 224, options [nop,nop,TS val 3215024 ecr 2985913,mptcp add-addr id 6 112.26.2.1,mptcp dss ack 2168003474], length 0
11:44:47.422619 IP 112.26.0.1.38151 > 112.26.0.8.46222: Flags [.], ack 1, win 224, options [nop,nop,TS val 3215024 ecr 2985913,mptcp add-addr id 6 112.26.2.1,mptcp dss ack 2168003474], length 0
11:44:47.441229 IP 112.26.0.8.46222 > 112.26.0.1.38151: Flags [.], ack 1, win 1369, options [nop,nop,TS val 2985913 ecr 3214979,mptcp add-addr id 5 112.26.3.8,mptcp dss ack 1134334589], length 0
11:44:47.457730 IP 112.26.0.1.38151 > 112.26.0.8.46222: Flags [.], seq 1:1429, ack 1, win 224, options [nop,nop,TS val 3215030 ecr 2985913,mptcp dss ack 2168003474 seq 1134334589 subseq 1 len 1428 csum 0xe807], length 1428
11:44:47.457939 IP 112.26.0.1.38151 > 112.26.0.8.46222: Flags [.], seq 1:1429, ack 1, win 224, options [nop,nop,TS val 3215030 ecr 2985913,mptcp dss ack 2168003474 seq 1134334589 subseq 1 len 1428 csum 0xe807], length 1428
11:44:47.534509 IP 112.26.0.8.46222 > 112.26.0.1.38151: Flags [.], ack 1, win 1369, options [nop,nop,TS val 2985913 ecr 3214979,mptcp add-addr id 6 112.26.2.8,mptcp dss ack 1134334589], length 0
11:44:47.547627 IP 112.26.0.1.38151 > 112.26.0.8.46222: Flags [.], seq 1429:2857, ack 1, win 224, options [nop,nop,TS val 3215030 ecr 2985913,mptcp dss ack 2168003474 seq 1134336017 subseq 1429 len 1428 csum 0x756], length 1428
11:44:47.547782 IP 112.26.0.1.38151 > 112.26.0.8.46222: Flags [.], seq 1429:2857, ack 1, win 224, options [nop,nop,TS val 3215030 ecr 2985913,mptcp dss ack 2168003474 seq 1134336017 subseq 1429 len 1428 csum 0x756], length 1428
11:44:47.626677 IP 112.26.0.8.46222 > 112.26.0.1.38151: Flags [.], ack 1429, win 1415, options [nop,nop,TS val 2986401 ecr 3215030,mptcp dss ack 1134336017], length 0
11:44:47.626914 IP 112.26.0.8.46222 > 112.26.0.1.38151: Flags [.], ack 1429, win 1415, options [nop,nop,TS val 2986401 ecr 3215030,mptcp dss ack 1134336017], length 0
11:44:47.646983 IP 112.26.0.8.46222 > 112.26.0.1.38151: Flags [.], ack 2857, win 1460, options [nop,nop,TS val 2986423 ecr 3215030,mptcp dss ack 1134337445], length 0
11:44:47.647148 IP 112.26.0.8.46222 > 112.26.0.1.38151: Flags [.], ack 2857, win 1460, options [nop,nop,TS val 2986423 ecr 3215030,mptcp dss ack 1134337445], length 0
11:44:47.716598 IP 112.26.0.1.38151 > 112.26.0.8.46222: Flags [P.], seq 2857:4097, ack 1, win 224, options [nop,nop,TS val 3215030 ecr 2985913,mptcp dss ack 2168003474 seq 1134337445 subseq 2857 len 1240 csum 0x4828], length 1240
11:44:47.716818 IP 112.26.0.1.38151 > 112.26.0.8.46222: Flags [P.], seq 2857:4097, ack 1, win 224, options [nop,nop,TS val 3215030 ecr 2985913,mptcp dss ack 2168003474 seq 1134337445 subseq 2857 len 1240 csum 0x4828], length 1240
11:44:47.733978 IP 112.26.0.1.38151 > 112.26.0.8.46222: Flags [.], seq 4097:5525, ack 1, win 224, options [nop,nop,TS val 3215030 ecr 2985913,mptcp dss ack 2168003474 seq 1134338685 subseq 4097 len 1428 csum 0x3c61], length 1428
11:44:47.734188 IP 112.26.0.1.38151 > 112.26.0.8.46222: Flags [.], seq 4097:5525, ack 1, win 224, options [nop,nop,TS val 3215030 ecr 2985913,mptcp dss ack 2168003474 seq 1134338685 subseq 4097 len 1428 csum 0x3c61], length 1428
11:44:47.741537 IP 112.26.0.1.38151 > 112.26.0.8.46222: Flags [.], seq 5525:6953, ack 1, win 224, options [nop,nop,TS val 3215030 ecr 2985913,mptcp dss ack 2168003474 seq 1134340113 subseq 5525 len 1428 csum 0x98d6], length 1428
11:44:47.741690 IP 112.26.0.1.38151 > 112.26.0.8.46222: Flags [.], seq 5525:6953, ack 1, win 224, options [nop,nop,TS val 3215030 ecr 2985913,mptcp dss ack 2168003474 seq 1134340113 subseq 5525 len 1428 csum 0x98d6], length 1428
11:44:47.847069 IP 112.26.0.1.38151 > 112.26.0.8.46222: Flags [.], seq 6953:8381, ack 1, win 224, options [nop,nop,TS val 3215030 ecr 2985913,mptcp dss ack 2168003474 seq 1134341541 subseq 6953 len 1428 csum 0x32a3], length 1428
11:44:47.847335 IP 112.26.0.1.38151 > 112.26.0.8.46222: Flags [.], seq 6953:8381, ack 1, win 224, options [nop,nop,TS val 3215030 ecr 2985913,mptcp dss ack 2168003474 seq 1134341541 subseq 6953 len 1428 csum 0x32a3], length 1428
11:44:47.936496 IP 112.26.0.1.38151 > 112.26.0.8.46222: Flags [.], seq 8381:9809, ack 1, win 224, options [nop,nop,TS val 3215031 ecr 2985913,mptcp dss ack 2168003474 seq 1134342969 subseq 8381 len 1428 csum 0x235], length 1428
11:44:47.936723 IP 112.26.0.1.38151 > 112.26.0.8.46222: Flags [.], seq 8381:9809, ack 1, win 224, options [nop,nop,TS val 3215031 ecr 2985913,mptcp dss ack 2168003474 seq 1134342969 subseq 8381 len 1428 csum 0x235], length 1428
11:44:47.943082 IP 112.26.0.8.46222 > 112.26.0.1.38151: Flags [.], ack 4097, win 1506, options [nop,nop,TS val 2986692 ecr 3215030,mptcp dss ack 1134338685], length 0
11:44:47.943342 IP 112.26.0.8.46222 > 112.26.0.1.38151: Flags [.], ack 4097, win 1506, options [nop,nop,TS val 2986692 ecr 3215030,mptcp dss ack 1134338685], length 0
11:44:47.950996 IP 112.26.0.1.38151 > 112.26.0.8.46222: Flags [.], seq 12665:14093, ack 1, win 224, options [nop,nop,TS val 3215216 ecr 2985913,mptcp dss ack 2168003474 seq 1134347253 subseq 12665 len 1428 csum 0x6c24], length 1428
11:44:47.951210 IP 112.26.0.1.38151 > 112.26.0.8.46222: Flags [.], seq 12665:14093, ack 1, win 224, options [nop,nop,TS val 3215216 ecr 2985913,mptcp dss ack 2168003474 seq 1134347253 subseq 12665 len 1428 csum 0x6c24], length 1428
11:44:47.960653 IP 112.26.0.8.46222 > 112.26.0.1.38151: Flags [.], ack 5525, win 1552, options [nop,nop,TS val 2986735 ecr 3215030,mptcp dss ack 1134340113], length 0
11:44:47.960863 IP 112.26.0.8.46222 > 112.26.0.1.38151: Flags [.], ack 5525, win 1552, options [nop,nop,TS val 2986735 ecr 3215030,mptcp dss ack 1134340113], length 0
11:44:48.044371 IP 112.26.0.1.38151 > 112.26.0.8.46222: Flags [.], seq 1:1429, ack 1, win 224, options [nop,nop,TS val 3215664 ecr 2985913,mptcp dss ack 2168003474 seq 1134334589 subseq 1 len 1428 csum 0xe807], length 1428
11:44:48.044600 IP 112.26.0.1.38151 > 112.26.0.8.46222: Flags [.], seq 1:1429, ack 1, win 224, options [nop,nop,TS val 3215664 ecr 2985913,mptcp dss ack 2168003474 seq 1134334589 subseq 1 len 1428 csum 0xe807], length 1428
11:44:48.049595 IP 112.26.0.8.46222 > 112.26.0.1.38151: Flags [.], ack 6953, win 1597, options [nop,nop,TS val 2986816 ecr 3215030,mptcp dss ack 1134341541], length 0
11:44:48.049771 IP 112.26.0.8.46222 > 112.26.0.1.38151: Flags [.], ack 6953, win 1597, options [nop,nop,TS val 2986816 ecr 3215030,mptcp dss ack 1134341541], length 0
11:44:48.129146 IP 112.26.0.8.46222 > 112.26.0.1.38151: Flags [.], ack 1429, win 1415, options [nop,nop,TS val 2986401 ecr 3215030,mptcp dss ack 1134336017], length 0
11:44:48.153363 IP 112.26.0.8.46222 > 112.26.0.1.38151: Flags [.], ack 2857, win 1460, options [nop,nop,TS val 2986423 ecr 3215030,mptcp dss ack 1134337445], length 0
11:44:48.227169 IP 112.26.0.8.46222 > 112.26.0.1.38151: Flags [.], ack 8381, win 1643, options [nop,nop,TS val 2986936 ecr 3215030,mptcp dss ack 1134342969], length 0
11:44:48.227470 IP 112.26.0.8.46222 > 112.26.0.1.38151: Flags [.], ack 8381, win 1643, options [nop,nop,TS val 2986936 ecr 3215030,mptcp dss ack 1134342969], length 0
11:44:48.241809 IP 112.26.0.1.38151 > 112.26.0.8.46222: Flags [.], seq 14093:15521, ack 1, win 224, options [nop,nop,TS val 3215992 ecr 2986401,mptcp dss ack 2168003474 seq 1134336017 subseq 14093 len 1428 csum 0xd5dd], length 1428
11:44:48.242018 IP 112.26.0.1.38151 > 112.26.0.8.46222: Flags [.], seq 14093:15521, ack 1, win 224, options [nop,nop,TS val 3215992 ecr 2986401,mptcp dss ack 2168003474 seq 1134336017 subseq 14093 len 1428 csum 0xd5dd], length 1428
11:44:48.336140 IP 112.26.0.1.38151 > 112.26.0.8.46222: Flags [P.], seq 15521:16761, ack 1, win 224, options [nop,nop,TS val 3216016 ecr 2986423,mptcp dss ack 2168003474 seq 1134337445 subseq 15521 len 1240 csum 0x16b0], length 1240
11:44:48.336352 IP 112.26.0.1.38151 > 112.26.0.8.46222: Flags [P.], seq 15521:16761, ack 1, win 224, options [nop,nop,TS val 3216016 ecr 2986423,mptcp dss ack 2168003474 seq 1134337445 subseq 15521 len 1240 csum 0x16b0], length 1240
11:44:48.347279 IP 112.26.0.8.46222 > 112.26.0.1.38151: Flags [.], ack 9809, win 1689, options [nop,nop,TS val 2987122 ecr 3215031,mptcp dss ack 1134344397], length 0
11:44:48.347557 IP 112.26.0.8.46222 > 112.26.0.1.38151: Flags [.], ack 9809, win 1689, options [nop,nop,TS val 2987122 ecr 3215031,mptcp dss ack 1134344397], length 0
11:44:48.439564 IP 112.26.0.8.46222 > 112.26.0.1.38151: Flags [.], ack 4097, win 1506, options [nop,nop,TS val 2986692 ecr 3215030,mptcp dss ack 1134338685], length 0
11:44:48.451156 IP 112.26.0.8.46222 > 112.26.0.1.38151: Flags [.], ack 9809, win 1734, options [nop,nop,TS val 2987226 ecr 3215031,nop,nop,sack 1 {12665:14093},mptcp dss ack 1134344397], length 0
11:44:48.451383 IP 112.26.0.8.46222 > 112.26.0.1.38151: Flags [.], ack 9809, win 1734, options [nop,nop,TS val 2987226 ecr 3215031,nop,nop,sack 1 {12665:14093},mptcp dss ack 1134344397], length 0
11:44:48.529884 IP 112.26.0.8.46222 > 112.26.0.1.38151: Flags [.], ack 9809, win 1734, options [nop,nop,TS val 2987303 ecr 3215031,nop,nop,sack 2 {1:1429}{12665:14093},mptcp dss ack 1134344397], length 0
11:44:48.530135 IP 112.26.0.8.46222 > 112.26.0.1.38151: Flags [.], ack 9809, win 1734, options [nop,nop,TS val 2987303 ecr 3215031,nop,nop,sack 2 {1:1429}{12665:14093},mptcp dss ack 1134344397], length 0
11:44:48.534901 IP 112.26.0.1.38151 > 112.26.0.8.46222: Flags [.], seq 16761:18189, ack 1, win 224, options [nop,nop,TS val 3216302 ecr 2986692,mptcp dss ack 2168003474 seq 1134338685 subseq 16761 len 1428 csum 0xae9], length 1428
11:44:48.535023 IP 112.26.0.1.38151 > 112.26.0.8.46222: Flags [.], seq 16761:18189, ack 1, win 224, options [nop,nop,TS val 3216302 ecr 2986692,mptcp dss ack 2168003474 seq 1134338685 subseq 16761 len 1428 csum 0xae9], length 1428
11:44:48.547982 IP 112.26.0.8.46222 > 112.26.0.1.38151: Flags [.], ack 6953, win 1597, options [nop,nop,TS val 2986816 ecr 3215030,mptcp dss ack 1134341541], length 0
11:44:48.648589 IP 112.26.0.8.46222 > 112.26.0.1.38151: Flags [.], ack 9809, win 1780, options [nop,nop,TS val 2987424 ecr 3215031,nop,nop,sack 1 {12665:15521},mptcp dss ack 1134344397], length 0
11:44:48.648806 IP 112.26.0.8.46222 > 112.26.0.1.38151: Flags [.], ack 9809, win 1780, options [nop,nop,TS val 2987424 ecr 3215031,nop,nop,sack 1 {12665:15521},mptcp dss ack 1134344397], length 0
11:44:48.723558 IP 112.26.0.1.38151 > 112.26.0.8.46222: Flags [.], seq 18189:19617, ack 1, win 224, options [nop,nop,TS val 3216409 ecr 2986816,mptcp dss ack 2168003474 seq 1134341541 subseq 18189 len 1428 csum 0x6bf], length 1428
11:44:48.723853 IP 112.26.0.1.38151 > 112.26.0.8.46222: Flags [.], seq 18189:19617, ack 1, win 224, options [nop,nop,TS val 3216409 ecr 2986816,mptcp dss ack 2168003474 seq 1134341541 subseq 18189 len 1428 csum 0x6bf], length 1428
11:44:48.739964 IP 112.26.0.8.46222 > 112.26.0.1.38151: Flags [.], ack 8381, win 1643, options [nop,nop,TS val 2986936 ecr 3215030,mptcp dss ack 1134342969], length 0
11:44:48.750560 IP 112.26.0.8.46222 > 112.26.0.1.38151: Flags [.], ack 9809, win 1825, options [nop,nop,TS val 2987526 ecr 3215031,nop,nop,sack 1 {12665:16761},mptcp dss ack 1134344397], length 0
11:44:48.750767 IP 112.26.0.8.46222 > 112.26.0.1.38151: Flags [.], ack 9809, win 1825, options [nop,nop,TS val 2987526 ecr 3215031,nop,nop,sack 1 {12665:16761},mptcp dss ack 1134344397], length 0
11:44:48.823872 IP 112.26.0.1.38151 > 112.26.0.8.46222: Flags [.], seq 19617:21045, ack 1, win 224, options [nop,nop,TS val 3216409 ecr 2986816,mptcp dss ack 2168003474 seq 1134342969 subseq 19617 len 1428 csum 0xd650], length 1428
11:44:48.824159 IP 112.26.0.1.38151 > 112.26.0.8.46222: Flags [.], seq 19617:21045, ack 1, win 224, options [nop,nop,TS val 3216409 ecr 2986816,mptcp dss ack 2168003474 seq 1134342969 subseq 19617 len 1428 csum 0xd650], length 1428
11:44:48.833666 IP 112.26.0.1.38151 > 112.26.0.8.46222: Flags [.], seq 21045:22473, ack 1, win 224, options [nop,nop,TS val 3216602 ecr 2986936,mptcp dss ack 2168003474 seq 1134344397 subseq 21045 len 1428 csum 0xcebc], length 1428
11:44:48.833873 IP 112.26.0.1.38151 > 112.26.0.8.46222: Flags [.], seq 21045:22473, ack 1, win 224, options [nop,nop,TS val 3216602 ecr 2986936,mptcp dss ack 2168003474 seq 1134344397 subseq 21045 len 1428 csum 0xcebc], length 1428
11:44:48.847712 IP 112.26.0.8.46222 > 112.26.0.1.38151: Flags [.], ack 9809, win 1734, options [nop,nop,TS val 2987226 ecr 3215031,nop,nop,sack 1 {12665:14093},mptcp dss ack 1134344397], length 0
11:44:48.862510 IP 112.26.0.1.38151 > 112.26.0.8.46222: Flags [.], seq 22473:23901, ack 1, win 224, options [nop,nop,TS val 3216709 ecr 2987226,mptcp dss ack 2168003474 seq 1134345825 subseq 22473 len 1428 csum 0xfe42], length 1428
11:44:48.862724 IP 112.26.0.1.38151 > 112.26.0.8.46222: Flags [.], seq 22473:23901, ack 1, win 224, options [nop,nop,TS val 3216709 ecr 2987226,mptcp dss ack 2168003474 seq 1134345825 subseq 22473 len 1428 csum 0xfe42], length 1428
11:44:48.928570 IP 112.26.0.8.46222 > 112.26.0.1.38151: Flags [.], ack 9809, win 1871, options [nop,nop,TS val 2987704 ecr 3215031,nop,nop,sack 1 {12665:18189},mptcp dss ack 1134344397], length 0
11:44:48.928853 IP 112.26.0.8.46222 > 112.26.0.1.38151: Flags [.], ack 9809, win 1871, options [nop,nop,TS val 2987704 ecr 3215031,nop,nop,sack 1 {12665:18189},mptcp dss ack 1134344397], length 0
11:44:48.943495 IP 112.26.0.8.46222 > 112.26.0.1.38151: Flags [.], ack 9809, win 1734, options [nop,nop,TS val 2987303 ecr 3215031,nop,nop,sack 2 {1:1429}{12665:14093},mptcp dss ack 1134344397], length 0
11:44:49.021921 IP 112.26.0.8.46222 > 112.26.0.1.38151: Flags [.], ack 9809, win 1917, options [nop,nop,TS val 2987733 ecr 3215031,nop,nop,sack 1 {12665:19617},mptcp dss ack 1134344397], length 0
11:44:49.022254 IP 112.26.0.8.46222 > 112.26.0.1.38151: Flags [.], ack 9809, win 1917, options [nop,nop,TS val 2987733 ecr 3215031,nop,nop,sack 1 {12665:19617},mptcp dss ack 1134344397], length 0
11:44:49.026443 IP 112.26.0.1.38151 > 112.26.0.8.46222: Flags [.], seq 23901:25329, ack 1, win 224, options [nop,nop,TS val 3216709 ecr 2987226,mptcp dss ack 2168003474 seq 1134347253 subseq 23901 len 1428 csum 0x4040], length 1428
11:44:49.026718 IP 112.26.0.1.38151 > 112.26.0.8.46222: Flags [.], seq 23901:25329, ack 1, win 224, options [nop,nop,TS val 3216709 ecr 2987226,mptcp dss ack 2168003474 seq 1134347253 subseq 23901 len 1428 csum 0x4040], length 1428
11:44:49.043288 IP 112.26.0.8.46222 > 112.26.0.1.38151: Flags [.], ack 9809, win 1780, options [nop,nop,TS val 2987424 ecr 3215031,nop,nop,sack 1 {12665:15521},mptcp dss ack 1134344397], length 0
11:44:49.055317 IP 112.26.0.8.46222 > 112.26.0.1.38151: Flags [.], ack 9809, win 1962, options [nop,nop,TS val 2987830 ecr 3215031,nop,nop,sack 1 {12665:21045},mptcp dss ack 1134344397], length 0
11:44:49.055507 IP 112.26.0.8.46222 > 112.26.0.1.38151: Flags [.], ack 9809, win 1962, options [nop,nop,TS val 2987830 ecr 3215031,nop,nop,sack 1 {12665:21045},mptcp dss ack 1134344397], length 0
11:44:49.127536 IP 112.26.0.8.46222 > 112.26.0.1.38151: Flags [.], ack 9809, win 1825, options [nop,nop,TS val 2987526 ecr 3215031,nop,nop,sack 1 {12665:16761},mptcp dss ack 1134344397], length 0
11:44:49.132509 IP 112.26.0.8.46222 > 112.26.0.1.38151: Flags [.], ack 9809, win 2008, options [nop,nop,TS val 2987899 ecr 3215031,nop,nop,sack 1 {12665:22473},mptcp dss ack 1134344397], length 0
11:44:49.132731 IP 112.26.0.8.46222 > 112.26.0.1.38151: Flags [.], ack 9809, win 2008, options [nop,nop,TS val 2987899 ecr 3215031,nop,nop,sack 1 {12665:22473},mptcp dss ack 1134344397], length 0
11:44:49.146528 IP 112.26.0.1.38151 > 112.26.0.8.46222: Flags [.], seq 9809:11237, ack 1, win 224, options [nop,nop,TS val 3216905 ecr 2987424,mptcp dss ack 2168003474 seq 1134344397 subseq 9809 len 1428 csum 0xfaa0], length 1428
11:44:49.146746 IP 112.26.0.1.38151 > 112.26.0.8.46222: Flags [.], seq 9809:11237, ack 1, win 224, options [nop,nop,TS val 3216905 ecr 2987424,mptcp dss ack 2168003474 seq 1134344397 subseq 9809 len 1428 csum 0xfaa0], length 1428
11:44:49.151367 IP 112.26.0.8.46222 > 112.26.0.1.38151: Flags [.], ack 9809, win 2054, options [nop,nop,TS val 2987918 ecr 3215031,nop,nop,sack 1 {12665:23901},mptcp dss ack 1134344397], length 0
11:44:49.151594 IP 112.26.0.8.46222 > 112.26.0.1.38151: Flags [.], ack 9809, win 2054, options [nop,nop,TS val 2987918 ecr 3215031,nop,nop,sack 1 {12665:23901},mptcp dss ack 1134344397], length 0
11:44:49.232048 IP 112.26.0.8.46222 > 112.26.0.1.38151: Flags [.], ack 9809, win 1871, options [nop,nop,TS val 2987704 ecr 3215031,nop,nop,sack 1 {12665:18189},mptcp dss ack 1134344397], length 0
11:44:49.250842 IP 112.26.0.1.38151 > 112.26.0.8.46222: Flags [.], seq 11237:12665, ack 1, win 224, options [nop,nop,TS val 3217093 ecr 2987704,mptcp dss ack 2168003474 seq 1134345825 subseq 11237 len 1428 csum 0x2a27], length 1428
11:44:49.251079 IP 112.26.0.1.38151 > 112.26.0.8.46222: Flags [.], seq 11237:12665, ack 1, win 224, options [nop,nop,TS val 3217093 ecr 2987704,mptcp dss ack 2168003474 seq 1134345825 subseq 11237 len 1428 csum 0x2a27], length 1428
11:44:49.326224 IP 112.26.0.8.46222 > 112.26.0.1.38151: Flags [.], ack 9809, win 1917, options [nop,nop,TS val 2987733 ecr 3215031,nop,nop,sack 1 {12665:19617},mptcp dss ack 1134344397], length 0
11:44:49.355575 IP 112.26.0.8.46222 > 112.26.0.1.38151: Flags [.], ack 9809, win 2099, options [nop,nop,TS val 2988121 ecr 3215031,nop,nop,sack 1 {12665:25329},mptcp dss ack 1134344397], length 0
11:44:49.355804 IP 112.26.0.8.46222 > 112.26.0.1.38151: Flags [.], ack 9809, win 2099, options [nop,nop,TS val 2988121 ecr 3215031,nop,nop,sack 1 {12665:25329},mptcp dss ack 1134344397], length 0
11:44:49.369039 IP 112.26.0.8.46222 > 112.26.0.1.38151: Flags [.], ack 9809, win 1962, options [nop,nop,TS val 2987830 ecr 3215031,nop,nop,sack 1 {12665:21045},mptcp dss ack 1134344397], length 0
11:44:49.444973 IP 112.26.0.1.38151 > 112.26.0.8.46222: Flags [.], seq 25329:26757, ack 1, win 224, options [nop,nop,TS val 3217232 ecr 2987733,mptcp dss ack 2168003474 seq 1134348681 subseq 25329 len 1428 csum 0x92d9], length 1428
11:44:49.445216 IP 112.26.0.1.38151 > 112.26.0.8.46222: Flags [.], seq 25329:26757, ack 1, win 224, options [nop,nop,TS val 3217232 ecr 2987733,mptcp dss ack 2168003474 seq 1134348681 subseq 25329 len 1428 csum 0x92d9], length 1428
11:44:49.453266 IP 112.26.0.8.46222 > 112.26.0.1.38151: Flags [.], ack 11237, win 2145, options [nop,nop,TS val 2988228 ecr 3216905,nop,nop,sack 1 {12665:25329},mptcp dss ack 1134345825], length 0
11:44:49.453484 IP 112.26.0.8.46222 > 112.26.0.1.38151: Flags [.], ack 11237, win 2145, options [nop,nop,TS val 2988228 ecr 3216905,nop,nop,sack 1 {12665:25329},mptcp dss ack 1134345825], length 0
11:44:49.531095 IP 112.26.0.8.46222 > 112.26.0.1.38151: Flags [.], ack 9809, win 2008, options [nop,nop,TS val 2987899 ecr 3215031,nop,nop,sack 1 {12665:22473},mptcp dss ack 1134344397], length 0
11:44:49.547916 IP 112.26.0.1.38151 > 112.26.0.8.46222: Flags [.], seq 26757:28185, ack 1, win 224, options [nop,nop,TS val 3217394 ecr 2987830,mptcp dss ack 2168003474 seq 1134350109 subseq 26757 len 1428 csum 0xfe34], length 1428
11:44:49.548093 IP 112.26.0.1.38151 > 112.26.0.8.46222: Flags [.], seq 26757:28185, ack 1, win 224, options [nop,nop,TS val 3217394 ecr 2987830,mptcp dss ack 2168003474 seq 1134350109 subseq 26757 len 1428 csum 0xfe34], length 1428
11:44:49.556007 IP 112.26.0.8.46222 > 112.26.0.1.38151: Flags [.], ack 25329, win 2190, options [nop,nop,TS val 2988331 ecr 3217093,mptcp dss ack 1134348681], length 0
11:44:49.556156 IP 112.26.0.8.46222 > 112.26.0.1.38151: Flags [.], ack 25329, win 2190, options [nop,nop,TS val 2988331 ecr 3217093,mptcp dss ack 1134348681], length 0
11:44:49.630651 IP 112.26.0.8.46222 > 112.26.0.1.38151: Flags [.], ack 9809, win 2054, options [nop,nop,TS val 2987918 ecr 3215031,nop,nop,sack 1 {12665:23901},mptcp dss ack 1134344397], length 0
11:44:49.648932 IP 112.26.0.1.38151 > 112.26.0.8.46222: Flags [.], seq 28185:29613, ack 1, win 224, options [nop,nop,TS val 3217493 ecr 2987899,mptcp dss ack 2168003474 seq 1134351537 subseq 28185 len 1428 csum 0xe788], length 1428
11:44:49.649149 IP 112.26.0.1.38151 > 112.26.0.8.46222: Flags [.], seq 28185:29613, ack 1, win 224, options [nop,nop,TS val 3217493 ecr 2987899,mptcp dss ack 2168003474 seq 1134351537 subseq 28185 len 1428 csum 0xe788], length 1428
11:44:49.656946 IP 112.26.0.8.46222 > 112.26.0.1.38151: Flags [.], ack 26757, win 2236, options [nop,nop,TS val 2988432 ecr 3217232,mptcp dss ack 1134350109], length 0
11:44:49.657159 IP 112.26.0.8.46222 > 112.26.0.1.38151: Flags [.], ack 26757, win 2236, options [nop,nop,TS val 2988432 ecr 3217232,mptcp dss ack 1134350109], length 0
11:44:49.729214 IP 112.26.0.8.46222 > 112.26.0.1.38151: Flags [.], ack 9809, win 2099, options [nop,nop,TS val 2988121 ecr 3215031,nop,nop,sack 1 {12665:25329},mptcp dss ack 1134344397], length 0
11:44:49.758209 IP 112.26.0.8.46222 > 112.26.0.1.38151: Flags [.], ack 28185, win 2282, options [nop,nop,TS val 2988533 ecr 3217394,mptcp dss ack 1134351537], length 0
11:44:49.758430 IP 112.26.0.8.46222 > 112.26.0.1.38151: Flags [.], ack 28185, win 2282, options [nop,nop,TS val 2988533 ecr 3217394,mptcp dss ack 1134351537], length 0
11:44:49.762787 IP 112.26.0.1.38151 > 112.26.0.8.46222: Flags [.], seq 29613:31041, ack 1, win 224, options [nop,nop,TS val 3217592 ecr 2987918,mptcp dss ack 2168003474 seq 1134352965 subseq 29613 len 1428 csum 0xf0d4], length 1428
11:44:49.762997 IP 112.26.0.1.38151 > 112.26.0.8.46222: Flags [.], seq 29613:31041, ack 1, win 224, options [nop,nop,TS val 3217592 ecr 2987918,mptcp dss ack 2168003474 seq 1134352965 subseq 29613 len 1428 csum 0xf0d4], length 1428
11:44:49.840715 IP 112.26.0.8.46222 > 112.26.0.1.38151: Flags [.], ack 11237, win 2145, options [nop,nop,TS val 2988228 ecr 3216905,nop,nop,sack 1 {12665:25329},mptcp dss ack 1134345825], length 0
11:44:49.853818 IP 112.26.0.8.46222 > 112.26.0.1.38151: Flags [.], ack 29613, win 2327, options [nop,nop,TS val 2988628 ecr 3217493,mptcp dss ack 1134352965], length 0
11:44:49.854032 IP 112.26.0.8.46222 > 112.26.0.1.38151: Flags [.], ack 29613, win 2327, options [nop,nop,TS val 2988628 ecr 3217493,mptcp dss ack 1134352965], length 0
11:44:49.857765 IP 112.26.0.8.46222 > 112.26.0.1.38151: Flags [.], ack 25329, win 2190, options [nop,nop,TS val 2988331 ecr 3217093,mptcp dss ack 1134348681], length 0
11:44:49.955331 IP 112.26.0.1.38151 > 112.26.0.8.46222: Flags [.], seq 31041:32469, ack 1, win 224, options [nop,nop,TS val 3217703 ecr 2988121,mptcp dss ack 2168003474 seq 1134354393 subseq 31041 len 1428 csum 0xb076], length 1428
11:44:49.955574 IP 112.26.0.1.38151 > 112.26.0.8.46222: Flags [.], seq 31041:32469, ack 1, win 224, options [nop,nop,TS val 3217703 ecr 2988121,mptcp dss ack 2168003474 seq 1134354393 subseq 31041 len 1428 csum 0xb076], length 1428
11:44:50.037318 IP 112.26.0.8.46222 > 112.26.0.1.38151: Flags [.], ack 31041, win 2373, options [nop,nop,TS val 2988811 ecr 3217592,mptcp dss ack 1134354393], length 0
11:44:50.037671 IP 112.26.0.8.46222 > 112.26.0.1.38151: Flags [.], ack 31041, win 2373, options [nop,nop,TS val 2988811 ecr 3217592,mptcp dss ack 1134354393], length 0
11:44:50.042717 IP 112.26.0.1.38151 > 112.26.0.8.46222: Flags [.], seq 32469:33897, ack 1, win 224, options [nop,nop,TS val 3217703 ecr 2988228,mptcp dss ack 2168003474 seq 1134355821 subseq 32469 len 1428 csum 0xf976], length 1428
11:44:50.042927 IP 112.26.0.1.38151 > 112.26.0.8.46222: Flags [.], seq 32469:33897, ack 1, win 224, options [nop,nop,TS val 3217703 ecr 2988228,mptcp dss ack 2168003474 seq 1134355821 subseq 32469 len 1428 csum 0xf976], length 1428
11:44:50.051388 IP 112.26.0.8.46222 > 112.26.0.1.38151: Flags [.], ack 26757, win 2236, options [nop,nop,TS val 2988432 ecr 3217232,mptcp dss ack 1134350109], length 0
11:44:50.132702 IP 112.26.0.8.46222 > 112.26.0.1.38151: Flags [.], ack 32469, win 2419, options [nop,nop,TS val 2988907 ecr 3217703,mptcp dss ack 1134355821], length 0
11:44:50.133007 IP 112.26.0.8.46222 > 112.26.0.1.38151: Flags [.], ack 32469, win 2419, options [nop,nop,TS val 2988907 ecr 3217703,mptcp dss ack 1134355821], length 0
11:44:50.143920 IP 112.26.0.1.38151 > 112.26.0.8.46222: Flags [.], seq 33897:35325, ack 1, win 224, options [nop,nop,TS val 3217720 ecr 2988331,mptcp dss ack 2168003474 seq 1134357249 subseq 33897 len 1428 csum 0x5611], length 1428
11:44:50.144137 IP 112.26.0.1.38151 > 112.26.0.8.46222: Flags [.], seq 33897:35325, ack 1, win 224, options [nop,nop,TS val 3217720 ecr 2988331,mptcp dss ack 2168003474 seq 1134357249 subseq 33897 len 1428 csum 0x5611], length 1428
11:44:50.154681 IP 112.26.0.8.46222 > 112.26.0.1.38151: Flags [.], ack 28185, win 2282, options [nop,nop,TS val 2988533 ecr 3217394,mptcp dss ack 1134351537], length 0
11:44:50.235628 IP 112.26.0.8.46222 > 112.26.0.1.38151: Flags [.], ack 33897, win 2464, options [nop,nop,TS val 2989008 ecr 3217703,mptcp dss ack 1134357249], length 0
11:44:50.235910 IP 112.26.0.8.46222 > 112.26.0.1.38151: Flags [.], ack 33897, win 2464, options [nop,nop,TS val 2989008 ecr 3217703,mptcp dss ack 1134357249], length 0
11:44:50.249001 IP 112.26.0.1.38151 > 112.26.0.8.46222: Flags [.], seq 35325:36753, ack 1, win 224, options [nop,nop,TS val 3217914 ecr 2988432,mptcp dss ack 2168003474 seq 1134358677 subseq 35325 len 1428 csum 0xeddf], length 1428
11:44:50.249207 IP 112.26.0.1.38151 > 112.26.0.8.46222: Flags [.], seq 35325:36753, ack 1, win 224, options [nop,nop,TS val 3217914 ecr 2988432,mptcp dss ack 2168003474 seq 1134358677 subseq 35325 len 1428 csum 0xeddf], length 1428
11:44:50.257967 IP 112.26.0.8.46222 > 112.26.0.1.38151: Flags [.], ack 35325, win 2510, options [nop,nop,TS val 2989032 ecr 3217720,mptcp dss ack 1134358677], length 0
11:44:50.258171 IP 112.26.0.8.46222 > 112.26.0.1.38151: Flags [.], ack 35325, win 2510, options [nop,nop,TS val 2989032 ecr 3217720,mptcp dss ack 1134358677], length 0
11:44:50.341846 IP 112.26.0.8.46222 > 112.26.0.1.38151: Flags [.], ack 29613, win 2327, options [nop,nop,TS val 2988628 ecr 3217493,mptcp dss ack 1134352965], length 0
11:44:50.354073 IP 112.26.0.8.46222 > 112.26.0.1.38151: Flags [.], ack 36753, win 2555, options [nop,nop,TS val 2989127 ecr 3217914,mptcp dss ack 1134360105], length 0
11:44:50.354355 IP 112.26.0.8.46222 > 112.26.0.1.38151: Flags [.], ack 36753, win 2555, options [nop,nop,TS val 2989127 ecr 3217914,mptcp dss ack 1134360105], length 0
11:44:50.441153 IP 112.26.0.1.38151 > 112.26.0.8.46222: Flags [.], seq 36753:38181, ack 1, win 224, options [nop,nop,TS val 3217914 ecr 2988432,mptcp dss ack 2168003474 seq 1134360105 subseq 36753 len 1428 csum 0x7de], length 1428
11:44:50.441382 IP 112.26.0.1.38151 > 112.26.0.8.46222: Flags [.], seq 36753:38181, ack 1, win 224, options [nop,nop,TS val 3217914 ecr 2988432,mptcp dss ack 2168003474 seq 1134360105 subseq 36753 len 1428 csum 0x7de], length 1428
11:44:50.453357 IP 112.26.0.8.46222 > 112.26.0.1.38151: Flags [.], ack 31041, win 2373, options [nop,nop,TS val 2988811 ecr 3217592,mptcp dss ack 1134354393], length 0
11:44:50.537104 IP 112.26.0.1.38151 > 112.26.0.8.46222: Flags [.], seq 38181:39609, ack 1, win 224, options [nop,nop,TS val 3218017 ecr 2988533,mptcp dss ack 2168003474 seq 1134361533 subseq 38181 len 1428 csum 0x8dda], length 1428
11:44:50.537415 IP 112.26.0.1.38151 > 112.26.0.8.46222: Flags [.], seq 38181:39609, ack 1, win 224, options [nop,nop,TS val 3218017 ecr 2988533,mptcp dss ack 2168003474 seq 1134361533 subseq 38181 len 1428 csum 0x8dda], length 1428
11:44:50.549498 IP 112.26.0.8.46222 > 112.26.0.1.38151: Flags [.], ack 38181, win 2601, options [nop,nop,TS val 2989325 ecr 3217914,mptcp dss ack 1134361533], length 0
11:44:50.549686 IP 112.26.0.8.46222 > 112.26.0.1.38151: Flags [.], ack 38181, win 2601, options [nop,nop,TS val 2989325 ecr 3217914,mptcp dss ack 1134361533], length 0
11:44:50.554870 IP 112.26.0.8.46222 > 112.26.0.1.38151: Flags [.], ack 32469, win 2419, options [nop,nop,TS val 2988907 ecr 3217703,mptcp dss ack 1134355821], length 0
11:44:50.637452 IP 112.26.0.8.46222 > 112.26.0.1.38151: Flags [.], ack 39609, win 2647, options [nop,nop,TS val 2989412 ecr 3218017,mptcp dss ack 1134362961], length 0
11:44:50.637724 IP 112.26.0.8.46222 > 112.26.0.1.38151: Flags [.], ack 39609, win 2647, options [nop,nop,TS val 2989412 ecr 3218017,mptcp dss ack 1134362961], length 0
11:44:50.650754 IP 112.26.0.8.46222 > 112.26.0.1.38151: Flags [.], ack 33897, win 2464, options [nop,nop,TS val 2989008 ecr 3217703,mptcp dss ack 1134357249], length 0
11:44:50.667012 IP 112.26.0.1.38151 > 112.26.0.8.46222: Flags [.], seq 39609:41037, ack 1, win 224, options [nop,nop,TS val 3218198 ecr 2988628,mptcp dss ack 2168003474 seq 1134362961 subseq 39609 len 1428 csum 0x9a37], length 1428
11:44:50.667225 IP 112.26.0.1.38151 > 112.26.0.8.46222: Flags [.], seq 39609:41037, ack 1, win 224, options [nop,nop,TS val 3218198 ecr 2988628,mptcp dss ack 2168003474 seq 1134362961 subseq 39609 len 1428 csum 0x9a37], length 1428
11:44:50.744233 IP 112.26.0.8.46222 > 112.26.0.1.38151: Flags [.], ack 35325, win 2510, options [nop,nop,TS val 2989032 ecr 3217720,mptcp dss ack 1134358677], length 0
11:44:50.755002 IP 112.26.0.8.46222 > 112.26.0.1.38151: Flags [.], ack 41037, win 2692, options [nop,nop,TS val 2989530 ecr 3218198,mptcp dss ack 1134364389], length 0
11:44:50.755160 IP 112.26.0.8.46222 > 112.26.0.1.38151: Flags [.], ack 41037, win 2692, options [nop,nop,TS val 2989530 ecr 3218198,mptcp dss ack 1134364389], length 0
11:44:50.833537 IP 112.26.0.8.46222 > 112.26.0.1.38151: Flags [.], ack 36753, win 2555, options [nop,nop,TS val 2989127 ecr 3217914,mptcp dss ack 1134360105], length 0
11:44:50.847003 IP 112.26.0.1.38151 > 112.26.0.8.46222: Flags [.], seq 41037:42465, ack 1, win 224, options [nop,nop,TS val 3218315 ecr 2988811,mptcp dss ack 2168003474 seq 1134364389 subseq 41037 len 1428 csum 0xbfd8], length 1428
11:44:50.847226 IP 112.26.0.1.38151 > 112.26.0.8.46222: Flags [.], seq 41037:42465, ack 1, win 224, options [nop,nop,TS val 3218315 ecr 2988811,mptcp dss ack 2168003474 seq 1134364389 subseq 41037 len 1428 csum 0xbfd8], length 1428
11:44:50.852998 IP 112.26.0.8.46222 > 112.26.0.1.38151: Flags [.], ack 42465, win 2738, options [nop,nop,TS val 2989628 ecr 3218315,mptcp dss ack 1134365817], length 0
11:44:50.853201 IP 112.26.0.8.46222 > 112.26.0.1.38151: Flags [.], ack 42465, win 2738, options [nop,nop,TS val 2989628 ecr 3218315,mptcp dss ack 1134365817], length 0
11:44:50.943098 IP 112.26.0.1.38151 > 112.26.0.8.46222: Flags [.], seq 42465:43893, ack 1, win 224, options [nop,nop,TS val 3218417 ecr 2988907,mptcp dss ack 2168003474 seq 1134365817 subseq 42465 len 1428 csum 0xb318], length 1428
11:44:50.943307 IP 112.26.0.1.38151 > 112.26.0.8.46222: Flags [.], seq 42465:43893, ack 1, win 224, options [nop,nop,TS val 3218417 ecr 2988907,mptcp dss ack 2168003474 seq 1134365817 subseq 42465 len 1428 csum 0xb318], length 1428
11:44:50.948980 IP 112.26.0.1.38151 > 112.26.0.8.46222: Flags [.], seq 43893:45321, ack 1, win 224, options [nop,nop,TS val 3218417 ecr 2988907,mptcp dss ack 2168003474 seq 1134367245 subseq 43893 len 1428 csum 0x2ec3], length 1428
11:44:50.949187 IP 112.26.0.1.38151 > 112.26.0.8.46222: Flags [.], seq 43893:45321, ack 1, win 224, options [nop,nop,TS val 3218417 ecr 2988907,mptcp dss ack 2168003474 seq 1134367245 subseq 43893 len 1428 csum 0x2ec3], length 1428
11:44:50.955569 IP 112.26.0.8.46222 > 112.26.0.1.38151: Flags [.], ack 43893, win 2784, options [nop,nop,TS val 2989730 ecr 3218417,mptcp dss ack 1134367245], length 0
11:44:50.955778 IP 112.26.0.8.46222 > 112.26.0.1.38151: Flags [.], ack 43893, win 2784, options [nop,nop,TS val 2989730 ecr 3218417,mptcp dss ack 1134367245], length 0
11:44:51.035526 IP 112.26.0.1.38151 > 112.26.0.8.46222: Flags [.], seq 45321:46749, ack 1, win 224, options [nop,nop,TS val 3218513 ecr 2989008,mptcp dss ack 2168003474 seq 1134368673 subseq 45321 len 1428 csum 0x4fb4], length 1428
11:44:51.035840 IP 112.26.0.1.38151 > 112.26.0.8.46222: Flags [.], seq 45321:46749, ack 1, win 224, options [nop,nop,TS val 3218513 ecr 2989008,mptcp dss ack 2168003474 seq 1134368673 subseq 45321 len 1428 csum 0x4fb4], length 1428
11:44:51.045511 IP 112.26.0.8.46222 > 112.26.0.1.38151: Flags [.], ack 45321, win 2829, options [nop,nop,TS val 2989820 ecr 3218417,mptcp dss ack 1134368673], length 0
11:44:51.045720 IP 112.26.0.8.46222 > 112.26.0.1.38151: Flags [.], ack 45321, win 2829, options [nop,nop,TS val 2989820 ecr 3218417,mptcp dss ack 1134368673], length 0
11:44:51.053864 IP 112.26.0.8.46222 > 112.26.0.1.38151: Flags [.], ack 38181, win 2601, options [nop,nop,TS val 2989325 ecr 3217914,mptcp dss ack 1134361533], length 0
11:44:51.133524 IP 112.26.0.8.46222 > 112.26.0.1.38151: Flags [.], ack 39609, win 2647, options [nop,nop,TS val 2989412 ecr 3218017,mptcp dss ack 1134362961], length 0
11:44:51.142943 IP 112.26.0.8.46222 > 112.26.0.1.38151: Flags [.], ack 46749, win 2875, options [nop,nop,TS val 2989917 ecr 3218513,mptcp dss ack 1134370101], length 0
11:44:51.143169 IP 112.26.0.8.46222 > 112.26.0.1.38151: Flags [.], ack 46749, win 2875, options [nop,nop,TS val 2989917 ecr 3218513,mptcp dss ack 1134370101], length 0
11:44:51.153122 IP 112.26.0.1.38151 > 112.26.0.8.46222: Flags [.], seq 46749:48177, ack 1, win 224, options [nop,nop,TS val 3218607 ecr 2989032,mptcp dss ack 2168003474 seq 1134370101 subseq 46749 len 1428 csum 0x3c59], length 1428
11:44:51.153335 IP 112.26.0.1.38151 > 112.26.0.8.46222: Flags [.], seq 46749:48177, ack 1, win 224, options [nop,nop,TS val 3218607 ecr 2989032,mptcp dss ack 2168003474 seq 1134370101 subseq 46749 len 1428 csum 0x3c59], length 1428
11:44:51.171364 IP 112.26.0.8.46222 > 112.26.0.1.38151: Flags [.], ack 41037, win 2692, options [nop,nop,TS val 2989530 ecr 3218198,mptcp dss ack 1134364389], length 0
11:44:51.245136 IP 112.26.0.8.46222 > 112.26.0.1.38151: Flags [.], ack 48177, win 2920, options [nop,nop,TS val 2990020 ecr 3218607,mptcp dss ack 1134371529], length 0
11:44:51.245359 IP 112.26.0.8.46222 > 112.26.0.1.38151: Flags [.], ack 48177, win 2920, options [nop,nop,TS val 2990020 ecr 3218607,mptcp dss ack 1134371529], length 0
11:44:51.259037 IP 112.26.0.1.38151 > 112.26.0.8.46222: Flags [.], seq 48177:49605, ack 1, win 224, options [nop,nop,TS val 3218696 ecr 2989127,mptcp dss ack 2168003474 seq 1134371529 subseq 48177 len 1428 csum 0x94cc], length 1428
11:44:51.259250 IP 112.26.0.1.38151 > 112.26.0.8.46222: Flags [.], seq 48177:49605, ack 1, win 224, options [nop,nop,TS val 3218696 ecr 2989127,mptcp dss ack 2168003474 seq 1134371529 subseq 48177 len 1428 csum 0x94cc], length 1428
11:44:51.346795 IP 112.26.0.8.46222 > 112.26.0.1.38151: Flags [.], ack 49605, win 2966, options [nop,nop,TS val 2990121 ecr 3218696,mptcp dss ack 1134372957], length 0
11:44:51.347009 IP 112.26.0.8.46222 > 112.26.0.1.38151: Flags [.], ack 49605, win 2966, options [nop,nop,TS val 2990121 ecr 3218696,mptcp dss ack 1134372957], length 0
11:44:51.360219 IP 112.26.0.8.46222 > 112.26.0.1.38151: Flags [.], ack 42465, win 2738, options [nop,nop,TS val 2989628 ecr 3218315,mptcp dss ack 1134365817], length 0
11:44:51.452807 IP 112.26.0.1.38151 > 112.26.0.8.46222: Flags [.], seq 49605:51033, ack 1, win 224, options [nop,nop,TS val 3218916 ecr 2989325,mptcp dss ack 2168003474 seq 1134372957 subseq 49605 len 1428 csum 0x1ad2], length 1428
11:44:51.453045 IP 112.26.0.1.38151 > 112.26.0.8.46222: Flags [.], seq 49605:51033, ack 1, win 224, options [nop,nop,TS val 3218916 ecr 2989325,mptcp dss ack 2168003474 seq 1134372957 subseq 49605 len 1428 csum 0x1ad2], length 1428
11:44:51.466258 IP 112.26.0.8.46222 > 112.26.0.1.38151: Flags [.], ack 51033, win 3012, options [nop,nop,TS val 2990241 ecr 3218916,mptcp dss ack 1134374385], length 0
11:44:51.466469 IP 112.26.0.8.46222 > 112.26.0.1.38151: Flags [.], ack 51033, win 3012, options [nop,nop,TS val 2990241 ecr 3218916,mptcp dss ack 1134374385], length 0
