11:44:54.513206 IP 112.26.3.8.45245 > 112.26.3.1.38151: Flags [S], seq 1060292245, win 65535, options [mss 1460,sackOK,TS val 2993265 ecr 0,nop,wscale 6,mptcp join id 5 token 0x3c5625f6 nonce 0x3f4f57e3], length 0
11:44:54.518629 IP 112.26.3.8.45245 > 112.26.3.1.38151: Flags [S], seq 1060292245, win 65535, options [mss 1460,sackOK,TS val 2993265 ecr 0,nop,wscale 6,mptcp join id 5 token 0x3c5625f6 nonce 0x3f4f57e3], length 0
11:44:54.523131 IP 112.26.3.1.38151 > 112.26.3.8.45245: Flags [S.], seq 180304139, ack 1060292246, win 28560, options [mss 1460,sackOK,TS val 3222381 ecr 2993265,nop,wscale 7,mptcp join id 5 hmac 0xfe0657b2026d80b9 nonce 0x2321c834], length 0
11:44:54.631821 IP 112.26.3.1.38151 > 112.26.3.8.45245: Flags [S.], seq 180304139, ack 1060292246, win 28560, options [mss 1460,sackOK,TS val 3222381 ecr 2993265,nop,wscale 7,mptcp join id 5 hmac 0xfe0657b2026d80b9 nonce 0x2321c834], length 0
11:44:54.762129 IP 112.26.3.8.45245 > 112.26.3.1.38151: Flags [.], ack 1, win 6935, options [nop,nop,TS val 2993409 ecr 3222381,mptcp join hmac 0x648012b906a0bfa19b7e7f9c0a372fe7c9ad35dd], length 0
11:44:54.765406 IP 112.26.3.8.45245 > 112.26.3.1.38151: Flags [.], ack 1, win 6935, options [nop,nop,TS val 2993409 ecr 3222381,mptcp join hmac 0x648012b906a0bfa19b7e7f9c0a372fe7c9ad35dd], length 0
11:44:54.768996 IP 112.26.3.1.38151 > 112.26.3.8.45245: Flags [.], ack 1, win 670, options [nop,nop,TS val 3222628 ecr 2993409,mptcp dss ack 2168003474], length 0
11:44:54.828561 IP 112.26.3.1.38151 > 112.26.3.8.45245: Flags [.], ack 1, win 670, options [nop,nop,TS val 3222628 ecr 2993409,mptcp dss ack 2168003474], length 0
11:44:54.861780 IP 112.26.3.1.38151 > 112.26.3.8.45245: Flags [.], seq 1:1429, ack 1, win 670, options [nop,nop,TS val 3222628 ecr 2993409,mptcp dss ack 2168003474 seq 1134432933 subseq 1 len 1428 csum 0x7c60], length 1428
11:44:55.013983 IP 112.26.3.1.38151 > 112.26.3.8.45245: Flags [.], seq 1:1429, ack 1, win 670, options [nop,nop,TS val 3222628 ecr 2993409,mptcp dss ack 2168003474 seq 1134432933 subseq 1 len 1428 csum 0x7c60], length 1428
11:44:55.071245 IP 112.26.3.1.38151 > 112.26.3.8.45245: Flags [.], seq 1429:2857, ack 1, win 670, options [nop,nop,TS val 3222629 ecr 2993409,mptcp dss ack 2168003474 seq 1134434361 subseq 1429 len 1428 csum 0x2fbd], length 1428
11:44:55.264079 IP 112.26.3.1.38151 > 112.26.3.8.45245: Flags [.], seq 2857:4285, ack 1, win 670, options [nop,nop,TS val 3222629 ecr 2993409,mptcp dss ack 2168003474 seq 1134435789 subseq 2857 len 1428 csum 0xa31d], length 1428
11:44:55.371388 IP 112.26.3.1.38151 > 112.26.3.8.45245: Flags [.], seq 1429:2857, ack 1, win 670, options [nop,nop,TS val 3222629 ecr 2993409,mptcp dss ack 2168003474 seq 1134434361 subseq 1429 len 1428 csum 0x2fbd], length 1428
11:44:55.482545 IP 112.26.3.1.38151 > 112.26.3.8.45245: Flags [.], seq 12853:14281, ack 1, win 893, options [nop,nop,TS val 3223128 ecr 2993409,mptcp dss ack 2168003474 seq 1134445785 subseq 12853 len 1428 csum 0xe382], length 1428
11:44:55.592187 IP 112.26.3.8.45245 > 112.26.3.1.38151: Flags [.], ack 2857, win 7574, options [nop,nop,TS val 2994148 ecr 3222629,mptcp dss ack 1134422937], length 0
11:44:55.595058 IP 112.26.3.8.45245 > 112.26.3.1.38151: Flags [.], ack 2857, win 7574, options [nop,nop,TS val 2994148 ecr 3222629,mptcp dss ack 1134422937], length 0
11:44:55.603822 IP 112.26.3.1.38151 > 112.26.3.8.45245: Flags [.], seq 14281:15709, ack 1, win 893, options [nop,nop,TS val 3223457 ecr 2994148,mptcp dss ack 2168003474 seq 1134481485 subseq 14281 len 1428 csum 0xaeb7], length 1428
11:44:55.725633 IP 112.26.3.1.38151 > 112.26.3.8.45245: Flags [.], seq 2857:4285, ack 1, win 670, options [nop,nop,TS val 3222629 ecr 2993409,mptcp dss ack 2168003474 seq 1134435789 subseq 2857 len 1428 csum 0xa31d], length 1428
11:44:55.824742 IP 112.26.3.1.38151 > 112.26.3.8.45245: Flags [.], seq 15709:17137, ack 1, win 893, options [nop,nop,TS val 3223457 ecr 2994148,mptcp dss ack 2168003474 seq 1134482913 subseq 15709 len 1428 csum 0xef24], length 1428
11:44:55.925365 IP 112.26.3.1.38151 > 112.26.3.8.45245: Flags [.], seq 17137:18565, ack 1, win 893, options [nop,nop,TS val 3223457 ecr 2994148,mptcp dss ack 2168003474 seq 1134484341 subseq 17137 len 1428 csum 0x955c], length 1428
11:44:56.058881 IP 112.26.3.1.38151 > 112.26.3.8.45245: Flags [.], seq 14281:15709, ack 1, win 893, options [nop,nop,TS val 3223457 ecr 2994148,mptcp dss ack 2168003474 seq 1134481485 subseq 14281 len 1428 csum 0xaeb7], length 1428
11:44:56.165391 IP 112.26.3.1.38151 > 112.26.3.8.45245: Flags [.], seq 18565:19993, ack 1, win 893, options [nop,nop,TS val 3223457 ecr 2994148,mptcp dss ack 2168003474 seq 1134485769 subseq 18565 len 1428 csum 0xe6f9], length 1428
11:44:56.261611 IP 112.26.3.1.38151 > 112.26.3.8.45245: Flags [.], seq 2857:4285, ack 1, win 893, options [nop,nop,TS val 3223906 ecr 2994148,mptcp dss ack 2168003474 seq 1134435789 subseq 2857 len 1428 csum 0xa31d], length 1428
11:44:56.399577 IP 112.26.3.1.38151 > 112.26.3.8.45245: Flags [.], seq 17137:18565, ack 1, win 893, options [nop,nop,TS val 3223457 ecr 2994148,mptcp dss ack 2168003474 seq 1134484341 subseq 17137 len 1428 csum 0x955c], length 1428
11:44:56.632606 IP 112.26.3.8.45245 > 112.26.3.1.38151: Flags [.], ack 4285, win 8715, options [nop,nop,TS val 2995176 ecr 3222629,nop,nop,sack 2 {17137:18565}{14281:15709},mptcp dss ack 1134425793], length 0
11:44:56.635387 IP 112.26.3.8.45245 > 112.26.3.1.38151: Flags [.], ack 4285, win 8715, options [nop,nop,TS val 2995176 ecr 3222629,nop,nop,sack 2 {17137:18565}{14281:15709},mptcp dss ack 1134425793], length 0
11:44:56.646056 IP 112.26.3.1.38151 > 112.26.3.8.45245: Flags [.], seq 4285:5713, ack 1, win 893, options [nop,nop,TS val 3224498 ecr 2995176,mptcp dss ack 2168003474 seq 1134437217 subseq 4285 len 1428 csum 0xb097], length 1428
11:44:56.748169 IP 112.26.3.1.38151 > 112.26.3.8.45245: Flags [.], seq 2857:4285, ack 1, win 893, options [nop,nop,TS val 3223906 ecr 2994148,mptcp dss ack 2168003474 seq 1134435789 subseq 2857 len 1428 csum 0xa31d], length 1428
11:44:56.852105 IP 112.26.3.1.38151 > 112.26.3.8.45245: Flags [.], seq 5713:7141, ack 1, win 893, options [nop,nop,TS val 3224498 ecr 2995176,mptcp dss ack 2168003474 seq 1134438645 subseq 5713 len 1428 csum 0xa83a], length 1428
11:44:56.976400 IP 112.26.3.8.45245 > 112.26.3.1.38151: Flags [.], ack 4285, win 9080, options [nop,nop,TS val 2995525 ecr 3223906,nop,nop,sack 2 {2857:4285}{17137:18565},mptcp dss ack 1134427221], length 0
11:44:56.994273 IP 112.26.3.1.38151 > 112.26.3.8.45245: Flags [.], seq 7141:8569, ack 1, win 893, options [nop,nop,TS val 3224498 ecr 2995176,mptcp dss ack 2168003474 seq 1134440073 subseq 7141 len 1428 csum 0xb2eb], length 1428
11:44:56.997615 IP 112.26.3.8.45245 > 112.26.3.1.38151: Flags [.], ack 4285, win 9080, options [nop,nop,TS val 2995525 ecr 3223906,nop,nop,sack 2 {2857:4285}{17137:18565},mptcp dss ack 1134427221], length 0
11:44:57.117612 IP 112.26.3.1.38151 > 112.26.3.8.45245: Flags [.], seq 4285:5713, ack 1, win 893, options [nop,nop,TS val 3224498 ecr 2995176,mptcp dss ack 2168003474 seq 1134437217 subseq 4285 len 1428 csum 0xb097], length 1428
11:44:57.157669 IP 112.26.3.1.38151 > 112.26.3.8.45245: Flags [.], seq 9997:11425, ack 1, win 893, options [nop,nop,TS val 3224860 ecr 2995525,mptcp dss ack 2168003474 seq 1134442929 subseq 9997 len 1428 csum 0x9146], length 1428
11:44:57.299771 IP 112.26.3.8.45245 > 112.26.3.1.38151: Flags [.], ack 5713, win 9536, options [nop,nop,TS val 2995894 ecr 3224498,nop,nop,sack 2 {17137:18565}{14281:15709},mptcp dss ack 1134427221], length 0
11:44:57.334072 IP 112.26.3.8.45245 > 112.26.3.1.38151: Flags [.], ack 5713, win 9536, options [nop,nop,TS val 2995894 ecr 3224498,nop,nop,sack 2 {17137:18565}{14281:15709},mptcp dss ack 1134427221], length 0
11:44:57.348034 IP 112.26.3.1.38151 > 112.26.3.8.45245: Flags [.], seq 11425:12853, ack 1, win 893, options [nop,nop,TS val 3225197 ecr 2995894,mptcp dss ack 2168003474 seq 1134444357 subseq 11425 len 1428 csum 0xb507], length 1428
11:44:57.445684 IP 112.26.3.1.38151 > 112.26.3.8.45245: Flags [.], seq 7141:8569, ack 1, win 893, options [nop,nop,TS val 3224498 ecr 2995176,mptcp dss ack 2168003474 seq 1134440073 subseq 7141 len 1428 csum 0xb2eb], length 1428
11:44:57.504072 IP 112.26.3.1.38151 > 112.26.3.8.45245: Flags [.], seq 12853:14281, ack 1, win 893, options [nop,nop,TS val 3225197 ecr 2995894,mptcp dss ack 2168003474 seq 1134445785 subseq 12853 len 1428 csum 0xe382], length 1428
11:44:57.633791 IP 112.26.3.8.45245 > 112.26.3.1.38151: Flags [.], ack 5713, win 9947, options [nop,nop,TS val 2996222 ecr 3224498,nop,nop,sack 2 {7141:8569}{17137:18565},mptcp dss ack 1134438645], length 0
11:44:57.635326 IP 112.26.3.8.45245 > 112.26.3.1.38151: Flags [.], ack 5713, win 9947, options [nop,nop,TS val 2996222 ecr 3224498,nop,nop,sack 2 {7141:8569}{17137:18565},mptcp dss ack 1134438645], length 0
11:44:57.648865 IP 112.26.3.1.38151 > 112.26.3.8.45245: Flags [.], seq 15709:17137, ack 1, win 893, options [nop,nop,TS val 3225498 ecr 2996222,mptcp dss ack 2168003474 seq 1134482913 subseq 15709 len 1428 csum 0xef24], length 1428
11:44:57.799733 IP 112.26.3.1.38151 > 112.26.3.8.45245: Flags [.], seq 11425:12853, ack 1, win 893, options [nop,nop,TS val 3225197 ecr 2995894,mptcp dss ack 2168003474 seq 1134444357 subseq 11425 len 1428 csum 0xb507], length 1428
11:44:57.964935 IP 112.26.3.8.45245 > 112.26.3.1.38151: Flags [.], ack 5713, win 10312, options [nop,nop,TS val 2996576 ecr 3224498,nop,nop,sack 2 {11425:12853}{7141:8569},mptcp dss ack 1134438645], length 0
11:44:57.965918 IP 112.26.3.8.45245 > 112.26.3.1.38151: Flags [.], ack 5713, win 10312, options [nop,nop,TS val 2996576 ecr 3224498,nop,nop,sack 2 {11425:12853}{7141:8569},mptcp dss ack 1134438645], length 0
11:44:58.010222 IP 112.26.3.1.38151 > 112.26.3.8.45245: Flags [.], seq 5713:7141, ack 1, win 893, options [nop,nop,TS val 3225828 ecr 2996576,mptcp dss ack 2168003474 seq 1134438645 subseq 5713 len 1428 csum 0xa83a], length 1428
11:44:58.102626 IP 112.26.3.1.38151 > 112.26.3.8.45245: Flags [.], seq 15709:17137, ack 1, win 893, options [nop,nop,TS val 3225498 ecr 2996222,mptcp dss ack 2168003474 seq 1134482913 subseq 15709 len 1428 csum 0xef24], length 1428
11:44:58.431520 IP 112.26.3.8.45245 > 112.26.3.1.38151: Flags [.], ack 5713, win 10677, options [nop,nop,TS val 2996879 ecr 3224498,nop,nop,sack 2 {14281:18565}{11425:12853},mptcp dss ack 1134438645], length 0
11:44:58.433023 IP 112.26.3.8.45245 > 112.26.3.1.38151: Flags [.], ack 5713, win 10677, options [nop,nop,TS val 2996879 ecr 3224498,nop,nop,sack 2 {14281:18565}{11425:12853},mptcp dss ack 1134438645], length 0
11:44:58.455404 IP 112.26.3.1.38151 > 112.26.3.8.45245: Flags [.], seq 8569:9997, ack 1, win 893, options [nop,nop,TS val 3226296 ecr 2996879,mptcp dss ack 2168003474 seq 1134441501 subseq 8569 len 1428 csum 0xc13], length 1428
11:44:58.617871 IP 112.26.3.1.38151 > 112.26.3.8.45245: Flags [.], seq 5713:7141, ack 1, win 893, options [nop,nop,TS val 3225828 ecr 2996576,mptcp dss ack 2168003474 seq 1134438645 subseq 5713 len 1428 csum 0xa83a], length 1428
11:44:58.739711 IP 112.26.3.1.38151 > 112.26.3.8.45245: Flags [.], seq 8569:9997, ack 1, win 893, options [nop,nop,TS val 3226296 ecr 2996879,mptcp dss ack 2168003474 seq 1134441501 subseq 8569 len 1428 csum 0xc13], length 1428
11:44:58.872835 IP 112.26.3.8.45245 > 112.26.3.1.38151: Flags [.], ack 8569, win 11179, options [nop,nop,TS val 2997330 ecr 3225828,nop,nop,sack 2 {14281:18565}{11425:12853},mptcp dss ack 1134518613], length 0
11:44:58.877781 IP 112.26.3.8.45245 > 112.26.3.1.38151: Flags [.], ack 8569, win 11179, options [nop,nop,TS val 2997330 ecr 3225828,nop,nop,sack 2 {14281:18565}{11425:12853},mptcp dss ack 1134518613], length 0
11:44:58.901358 IP 112.26.3.1.38151 > 112.26.3.8.45245: Flags [.], seq 9997:11425, ack 1, win 893, options [nop,nop,TS val 3226740 ecr 2997330,mptcp dss ack 2168003474 seq 1134442929 subseq 9997 len 1428 csum 0x9146], length 1428
11:44:59.004964 IP 112.26.3.8.45245 > 112.26.3.1.38151: Flags [.], ack 9997, win 11361, options [nop,nop,TS val 2997517 ecr 3226296,nop,nop,sack 2 {14281:18565}{11425:12853},mptcp dss ack 1134518613], length 0
11:44:59.032627 IP 112.26.3.1.38151 > 112.26.3.8.45245: Flags [.], seq 9997:11425, ack 1, win 893, options [nop,nop,TS val 3226740 ecr 2997330,mptcp dss ack 2168003474 seq 1134442929 subseq 9997 len 1428 csum 0x9146], length 1428
11:44:59.071648 IP 112.26.3.1.38151 > 112.26.3.8.45245: Flags [.], seq 12853:14281, ack 1, win 893, options [nop,nop,TS val 3226740 ecr 2997330,mptcp dss ack 2168003474 seq 1134445785 subseq 12853 len 1428 csum 0xe382], length 1428
11:44:59.138427 IP 112.26.3.8.45245 > 112.26.3.1.38151: Flags [.], ack 12853, win 11726, options [nop,nop,TS val 2997810 ecr 3226740,nop,nop,sack 1 {14281:18565},mptcp dss ack 1134521469], length 0
11:44:59.221145 IP 112.26.3.8.45245 > 112.26.3.1.38151: Flags [.], ack 9997, win 11361, options [nop,nop,TS val 2997517 ecr 3226296,nop,nop,sack 2 {14281:18565}{11425:12853},mptcp dss ack 1134518613], length 0
11:44:59.248524 IP 112.26.3.1.38151 > 112.26.3.8.45245: Flags [.], seq 18565:19993, ack 1, win 893, options [nop,nop,TS val 3227084 ecr 2997517,mptcp dss ack 2168003474 seq 1134485769 subseq 18565 len 1428 csum 0xe6f9], length 1428
11:44:59.332968 IP 112.26.3.1.38151 > 112.26.3.8.45245: Flags [.], seq 12853:14281, ack 1, win 893, options [nop,nop,TS val 3226740 ecr 2997330,mptcp dss ack 2168003474 seq 1134445785 subseq 12853 len 1428 csum 0xe382], length 1428
11:44:59.466003 IP 112.26.3.1.38151 > 112.26.3.8.45245: Flags [.], seq 19993:21421, ack 1, win 893, options [nop,nop,TS val 3227084 ecr 2997517,mptcp dss ack 2168003474 seq 1134580017 subseq 19993 len 1428 csum 0x1f1e], length 1428
11:44:59.472654 IP 112.26.3.8.45245 > 112.26.3.1.38151: Flags [.], ack 18565, win 12045, options [nop,nop,TS val 2998099 ecr 3226740,mptcp dss ack 1134527181], length 0
11:44:59.567184 IP 112.26.3.8.45245 > 112.26.3.1.38151: Flags [.], ack 12853, win 11726, options [nop,nop,TS val 2997810 ecr 3226740,nop,nop,sack 1 {14281:18565},mptcp dss ack 1134521469], length 0
11:44:59.616906 IP 112.26.3.1.38151 > 112.26.3.8.45245: Flags [.], seq 18565:19993, ack 1, win 893, options [nop,nop,TS val 3227084 ecr 2997517,mptcp dss ack 2168003474 seq 1134485769 subseq 18565 len 1428 csum 0xe6f9], length 1428
11:44:59.681913 IP 112.26.3.1.38151 > 112.26.3.8.45245: Flags [.], seq 21421:22849, ack 1, win 893, options [nop,nop,TS val 3227430 ecr 2997810,mptcp dss ack 2168003474 seq 1134592869 subseq 21421 len 1428 csum 0x7308], length 1428
11:44:59.789580 IP 112.26.3.8.45245 > 112.26.3.1.38151: Flags [.], ack 18565, win 12045, options [nop,nop,TS val 2998099 ecr 3226740,mptcp dss ack 1134527181], length 0
11:44:59.846862 IP 112.26.3.1.38151 > 112.26.3.8.45245: Flags [.], seq 22849:24277, ack 1, win 893, options [nop,nop,TS val 3227430 ecr 2997810,mptcp dss ack 2168003474 seq 1134594297 subseq 22849 len 1428 csum 0xaa5a], length 1428
11:44:59.955681 IP 112.26.3.1.38151 > 112.26.3.8.45245: Flags [.], seq 24277:25705, ack 1, win 893, options [nop,nop,TS val 3227652 ecr 2998099,mptcp dss ack 2168003474 seq 1134600009 subseq 24277 len 1428 csum 0x1b06], length 1428
11:45:00.180530 IP 112.26.3.1.38151 > 112.26.3.8.45245: Flags [.], seq 21421:22849, ack 1, win 893, options [nop,nop,TS val 3227430 ecr 2997810,mptcp dss ack 2168003474 seq 1134592869 subseq 21421 len 1428 csum 0x7308], length 1428
11:45:00.195914 IP 112.26.3.1.38151 > 112.26.3.8.45245: Flags [.], seq 25705:27133, ack 1, win 893, options [nop,nop,TS val 3227652 ecr 2998099,mptcp dss ack 2168003474 seq 1134601437 subseq 25705 len 1428 csum 0x78bc], length 1428
11:45:00.370913 IP 112.26.3.8.45245 > 112.26.3.1.38151: Flags [.], ack 19993, win 13095, options [nop,nop,TS val 2998957 ecr 3227084,nop,nop,sack 1 {21421:22849},mptcp dss ack 1134552885], length 0
11:45:00.432944 IP 112.26.3.1.38151 > 112.26.3.8.45245: Flags [.], seq 22849:24277, ack 1, win 893, options [nop,nop,TS val 3227430 ecr 2997810,mptcp dss ack 2168003474 seq 1134594297 subseq 22849 len 1428 csum 0xaa5a], length 1428
11:45:00.616446 IP 112.26.3.8.45245 > 112.26.3.1.38151: Flags [.], ack 19993, win 13369, options [nop,nop,TS val 2999210 ecr 3227084,nop,nop,sack 1 {21421:24277},mptcp dss ack 1134552885], length 0
11:45:00.632799 IP 112.26.3.8.45245 > 112.26.3.1.38151: Flags [.], ack 19993, win 13095, options [nop,nop,TS val 2998957 ecr 3227084,nop,nop,sack 1 {21421:22849},mptcp dss ack 1134552885], length 0
11:45:00.656107 IP 112.26.3.1.38151 > 112.26.3.8.45245: Flags [.], seq 27133:28561, ack 1, win 893, options [nop,nop,TS val 3228496 ecr 2998957,mptcp dss ack 2168003474 seq 1134624285 subseq 27133 len 1428 csum 0xbc5], length 1428
11:45:00.776677 IP 112.26.3.1.38151 > 112.26.3.8.45245: Flags [.], seq 28561:29989, ack 1, win 893, options [nop,nop,TS val 3228496 ecr 2998957,mptcp dss ack 2168003474 seq 1134625713 subseq 28561 len 1428 csum 0x2a11], length 1428
11:45:00.836685 IP 112.26.3.1.38151 > 112.26.3.8.45245: Flags [.], seq 27133:28561, ack 1, win 893, options [nop,nop,TS val 3228496 ecr 2998957,mptcp dss ack 2168003474 seq 1134624285 subseq 27133 len 1428 csum 0xbc5], length 1428
11:45:00.947596 IP 112.26.3.1.38151 > 112.26.3.8.45245: Flags [.], seq 29989:31417, ack 1, win 893, options [nop,nop,TS val 3228496 ecr 2998957,mptcp dss ack 2168003474 seq 1134627141 subseq 29989 len 1428 csum 0x153b], length 1428
11:45:01.023610 IP 112.26.3.8.45245 > 112.26.3.1.38151: Flags [.], ack 19993, win 13825, options [nop,nop,TS val 2999613 ecr 3227084,nop,nop,sack 2 {27133:28561}{21421:24277},mptcp dss ack 1134575733], length 0
11:45:01.028369 IP 112.26.3.8.45245 > 112.26.3.1.38151: Flags [.], ack 19993, win 13369, options [nop,nop,TS val 2999210 ecr 3227084,nop,nop,sack 1 {21421:24277},mptcp dss ack 1134552885], length 0
11:45:01.137783 IP 112.26.3.1.38151 > 112.26.3.8.45245: Flags [.], seq 31417:32845, ack 1, win 893, options [nop,nop,TS val 3228496 ecr 2998957,mptcp dss ack 2168003474 seq 1134628569 subseq 31417 len 1428 csum 0x1e10], length 1428
11:45:01.234154 IP 112.26.3.8.45245 > 112.26.3.1.38151: Flags [.], ack 19993, win 13825, options [nop,nop,TS val 2999613 ecr 3227084,nop,nop,sack 2 {27133:28561}{21421:24277},mptcp dss ack 1134575733], length 0
11:45:01.279615 IP 112.26.3.1.38151 > 112.26.3.8.45245: Flags [.], seq 34273:35701, ack 1, win 893, options [nop,nop,TS val 3228906 ecr 2999210,mptcp dss ack 2168003474 seq 1134642849 subseq 34273 len 1428 csum 0xaaf], length 1428
11:45:01.410776 IP 112.26.3.1.38151 > 112.26.3.8.45245: Flags [.], seq 29989:31417, ack 1, win 893, options [nop,nop,TS val 3228496 ecr 2998957,mptcp dss ack 2168003474 seq 1134627141 subseq 29989 len 1428 csum 0x153b], length 1428
11:45:01.527373 IP 112.26.3.1.38151 > 112.26.3.8.45245: Flags [.], seq 19993:21421, ack 1, win 893, options [nop,nop,TS val 3229097 ecr 2999613,mptcp dss ack 2168003474 seq 1134580017 subseq 19993 len 1428 csum 0x1f1e], length 1428
11:45:01.558321 IP 112.26.3.8.45245 > 112.26.3.1.38151: Flags [.], ack 19993, win 14418, options [nop,nop,TS val 3000187 ecr 3227084,nop,nop,sack 2 {29989:31417}{27133:28561},mptcp dss ack 1134580017], length 0
11:45:01.570732 IP 112.26.3.8.45245 > 112.26.3.1.38151: Flags [.], ack 19993, win 14418, options [nop,nop,TS val 3000187 ecr 3227084,nop,nop,sack 2 {29989:31417}{27133:28561},mptcp dss ack 1134580017], length 0
11:45:01.670859 IP 112.26.3.1.38151 > 112.26.3.8.45245: Flags [.], seq 24277:25705, ack 1, win 893, options [nop,nop,TS val 3229433 ecr 3000187,mptcp dss ack 2168003474 seq 1134600009 subseq 24277 len 1428 csum 0x1b06], length 1428
11:45:01.768265 IP 112.26.3.1.38151 > 112.26.3.8.45245: Flags [.], seq 34273:35701, ack 1, win 893, options [nop,nop,TS val 3228906 ecr 2999210,mptcp dss ack 2168003474 seq 1134642849 subseq 34273 len 1428 csum 0xaaf], length 1428
11:45:01.966693 IP 112.26.3.8.45245 > 112.26.3.1.38151: Flags [.], ack 19993, win 14874, options [nop,nop,TS val 3000518 ecr 3227084,nop,nop,sack 2 {34273:35701}{29989:31417},mptcp dss ack 1134580017], length 0
11:45:01.968779 IP 112.26.3.8.45245 > 112.26.3.1.38151: Flags [.], ack 19993, win 14874, options [nop,nop,TS val 3000518 ecr 3227084,nop,nop,sack 2 {34273:35701}{29989:31417},mptcp dss ack 1134580017], length 0
11:45:01.983898 IP 112.26.3.1.38151 > 112.26.3.8.45245: Flags [.], seq 25705:27133, ack 1, win 893, options [nop,nop,TS val 3229831 ecr 3000518,mptcp dss ack 2168003474 seq 1134601437 subseq 25705 len 1428 csum 0x78bc], length 1428
11:45:02.057724 IP 112.26.3.1.38151 > 112.26.3.8.45245: Flags [.], seq 19993:21421, ack 1, win 893, options [nop,nop,TS val 3229097 ecr 2999613,mptcp dss ack 2168003474 seq 1134580017 subseq 19993 len 1428 csum 0x1f1e], length 1428
11:45:02.233753 IP 112.26.3.8.45245 > 112.26.3.1.38151: Flags [.], ack 24277, win 15194, options [nop,nop,TS val 3000817 ecr 3229097,nop,nop,sack 2 {34273:35701}{29989:31417},mptcp dss ack 1134600009], length 0
11:45:02.240888 IP 112.26.3.8.45245 > 112.26.3.1.38151: Flags [.], ack 24277, win 15194, options [nop,nop,TS val 3000817 ecr 3229097,nop,nop,sack 2 {34273:35701}{29989:31417},mptcp dss ack 1134600009], length 0
11:45:02.288181 IP 112.26.3.1.38151 > 112.26.3.8.45245: Flags [.], seq 28561:29989, ack 1, win 893, options [nop,nop,TS val 3230103 ecr 3000817,mptcp dss ack 2168003474 seq 1134625713 subseq 28561 len 1428 csum 0x2a11], length 1428
11:45:02.391846 IP 112.26.3.1.38151 > 112.26.3.8.45245: Flags [.], seq 31417:32845, ack 1, win 893, options [nop,nop,TS val 3230103 ecr 3000817,mptcp dss ack 2168003474 seq 1134628569 subseq 31417 len 1428 csum 0x1e10], length 1428
11:45:02.465548 IP 112.26.3.1.38151 > 112.26.3.8.45245: Flags [.], seq 25705:27133, ack 1, win 893, options [nop,nop,TS val 3229831 ecr 3000518,mptcp dss ack 2168003474 seq 1134601437 subseq 25705 len 1428 csum 0x78bc], length 1428
11:45:02.594513 IP 112.26.3.8.45245 > 112.26.3.1.38151: Flags [.], ack 24277, win 15650, options [nop,nop,TS val 3001161 ecr 3229097,nop,nop,sack 2 {25705:28561}{34273:35701},mptcp dss ack 1134600009], length 0
11:45:02.597605 IP 112.26.3.8.45245 > 112.26.3.1.38151: Flags [.], ack 24277, win 15650, options [nop,nop,TS val 3001161 ecr 3229097,nop,nop,sack 2 {25705:28561}{34273:35701},mptcp dss ack 1134600009], length 0
11:45:02.612856 IP 112.26.3.1.38151 > 112.26.3.8.45245: Flags [.], seq 24277:25705, ack 1, win 893, options [nop,nop,TS val 3230460 ecr 3001161,mptcp dss ack 2168003474 seq 1134600009 subseq 24277 len 1428 csum 0x1b06], length 1428
11:45:02.728398 IP 112.26.3.1.38151 > 112.26.3.8.45245: Flags [.], seq 28561:29989, ack 1, win 893, options [nop,nop,TS val 3230103 ecr 3000817,mptcp dss ack 2168003474 seq 1134625713 subseq 28561 len 1428 csum 0x2a11], length 1428
11:45:02.876781 IP 112.26.3.8.45245 > 112.26.3.1.38151: Flags [.], ack 24277, win 16060, options [nop,nop,TS val 3001505 ecr 3229097,nop,nop,sack 2 {25705:31417}{34273:35701},mptcp dss ack 1134600009], length 0
11:45:02.903495 IP 112.26.3.8.45245 > 112.26.3.1.38151: Flags [.], ack 24277, win 16060, options [nop,nop,TS val 3001505 ecr 3229097,nop,nop,sack 2 {25705:31417}{34273:35701},mptcp dss ack 1134600009], length 0
11:45:02.914367 IP 112.26.3.1.38151 > 112.26.3.8.45245: Flags [.], seq 32845:34273, ack 1, win 893, options [nop,nop,TS val 3230766 ecr 3001505,mptcp dss ack 2168003474 seq 1134629997 subseq 32845 len 1428 csum 0xdc8a], length 1428
11:45:02.991906 IP 112.26.3.1.38151 > 112.26.3.8.45245: Flags [.], seq 24277:25705, ack 1, win 893, options [nop,nop,TS val 3230460 ecr 3001161,mptcp dss ack 2168003474 seq 1134600009 subseq 24277 len 1428 csum 0x1b06], length 1428
11:45:03.212782 IP 112.26.3.8.45245 > 112.26.3.1.38151: Flags [.], ack 31417, win 16380, options [nop,nop,TS val 3001768 ecr 3230460,nop,nop,sack 1 {34273:35701},mptcp dss ack 1134628569], length 0
11:45:03.217178 IP 112.26.3.8.45245 > 112.26.3.1.38151: Flags [.], ack 31417, win 16380, options [nop,nop,TS val 3001768 ecr 3230460,nop,nop,sack 1 {34273:35701},mptcp dss ack 1134628569], length 0
11:45:03.249285 IP 112.26.3.1.38151 > 112.26.3.8.45245: Flags [.], seq 31417:32845, ack 1, win 893, options [nop,nop,TS val 3231079 ecr 3001768,mptcp dss ack 2168003474 seq 1134628569 subseq 31417 len 1428 csum 0x1e10], length 1428
11:45:03.319864 IP 112.26.3.1.38151 > 112.26.3.8.45245: Flags [.], seq 32845:34273, ack 1, win 893, options [nop,nop,TS val 3230766 ecr 3001505,mptcp dss ack 2168003474 seq 1134629997 subseq 32845 len 1428 csum 0xdc8a], length 1428
11:45:03.540616 IP 112.26.3.8.45245 > 112.26.3.1.38151: Flags [.], ack 31417, win 16790, options [nop,nop,TS val 3002097 ecr 3230460,nop,nop,sack 1 {32845:35701},mptcp dss ack 1134628569], length 0
11:45:03.559298 IP 112.26.3.8.45245 > 112.26.3.1.38151: Flags [.], ack 31417, win 16790, options [nop,nop,TS val 3002097 ecr 3230460,nop,nop,sack 1 {32845:35701},mptcp dss ack 1134628569], length 0
11:45:03.622051 IP 112.26.3.1.38151 > 112.26.3.8.45245: Flags [.], seq 35701:37129, ack 1, win 893, options [nop,nop,TS val 3231467 ecr 3002097,mptcp dss ack 2168003474 seq 1134728529 subseq 35701 len 1428 csum 0xceee], length 1428
11:45:03.632284 IP 112.26.3.1.38151 > 112.26.3.8.45245: Flags [.], seq 31417:32845, ack 1, win 893, options [nop,nop,TS val 3231079 ecr 3001768,mptcp dss ack 2168003474 seq 1134628569 subseq 31417 len 1428 csum 0x1e10], length 1428
11:45:03.821882 IP 112.26.3.8.45245 > 112.26.3.1.38151: Flags [.], ack 35701, win 17201, options [nop,nop,TS val 3002409 ecr 3231079,mptcp dss ack 1134711393], length 0
11:45:03.838631 IP 112.26.3.8.45245 > 112.26.3.1.38151: Flags [.], ack 35701, win 17201, options [nop,nop,TS val 3002409 ecr 3231079,mptcp dss ack 1134711393], length 0
11:45:03.846710 IP 112.26.3.1.38151 > 112.26.3.8.45245: Flags [.], seq 37129:38557, ack 1, win 893, options [nop,nop,TS val 3231701 ecr 3002409,mptcp dss ack 2168003474 seq 1134739953 subseq 37129 len 1428 csum 0xbf2d], length 1428
11:45:03.969682 IP 112.26.3.1.38151 > 112.26.3.8.45245: Flags [.], seq 35701:37129, ack 1, win 893, options [nop,nop,TS val 3231467 ecr 3002097,mptcp dss ack 2168003474 seq 1134728529 subseq 35701 len 1428 csum 0xceee], length 1428
11:45:04.012289 IP 112.26.3.1.38151 > 112.26.3.8.45245: Flags [.], seq 38557:39985, ack 1, win 893, options [nop,nop,TS val 3231701 ecr 3002409,mptcp dss ack 2168003474 seq 1134741381 subseq 38557 len 1428 csum 0x5fce], length 1428
11:45:04.084639 IP 112.26.3.8.45245 > 112.26.3.1.38151: Flags [.], ack 37129, win 17520, options [nop,nop,TS val 3002674 ecr 3231467,mptcp dss ack 1134722817], length 0
11:45:04.103225 IP 112.26.3.8.45245 > 112.26.3.1.38151: Flags [.], ack 37129, win 17520, options [nop,nop,TS val 3002674 ecr 3231467,mptcp dss ack 1134722817], length 0
11:45:04.124322 IP 112.26.3.1.38151 > 112.26.3.8.45245: Flags [.], seq 37129:38557, ack 1, win 893, options [nop,nop,TS val 3231701 ecr 3002409,mptcp dss ack 2168003474 seq 1134739953 subseq 37129 len 1428 csum 0xbf2d], length 1428
11:45:04.174777 IP 112.26.3.1.38151 > 112.26.3.8.45245: Flags [.], seq 39985:41413, ack 1, win 893, options [nop,nop,TS val 3231703 ecr 3002409,mptcp dss ack 2168003474 seq 1134742809 subseq 39985 len 1428 csum 0xbc], length 1428
11:45:04.287460 IP 112.26.3.8.45245 > 112.26.3.1.38151: Flags [.], ack 38557, win 17840, options [nop,nop,TS val 3002901 ecr 3231701,mptcp dss ack 1134732813], length 0
11:45:04.329868 IP 112.26.3.1.38151 > 112.26.3.8.45245: Flags [.], seq 41413:42841, ack 1, win 893, options [nop,nop,TS val 3231703 ecr 3002409,mptcp dss ack 2168003474 seq 1134744237 subseq 41413 len 1428 csum 0xa270], length 1428
11:45:04.422217 IP 112.26.3.1.38151 > 112.26.3.8.45245: Flags [.], seq 38557:39985, ack 1, win 893, options [nop,nop,TS val 3231701 ecr 3002409,mptcp dss ack 2168003474 seq 1134741381 subseq 38557 len 1428 csum 0x5fce], length 1428
11:45:04.520958 IP 112.26.3.1.38151 > 112.26.3.8.45245: Flags [.], seq 44269:45697, ack 1, win 893, options [nop,nop,TS val 3231966 ecr 3002674,mptcp dss ack 2168003474 seq 1134757089 subseq 44269 len 1428 csum 0xa91b], length 1428
11:45:04.606128 IP 112.26.3.8.45245 > 112.26.3.1.38151: Flags [.], ack 38557, win 17840, options [nop,nop,TS val 3002901 ecr 3231701,mptcp dss ack 1134732813], length 0
11:45:04.634436 IP 112.26.3.8.45245 > 112.26.3.1.38151: Flags [.], ack 39985, win 18250, options [nop,nop,TS val 3003199 ecr 3231701,mptcp dss ack 1134742809], length 0
11:45:04.649090 IP 112.26.3.1.38151 > 112.26.3.8.45245: Flags [.], seq 45697:47125, ack 1, win 893, options [nop,nop,TS val 3232468 ecr 3002901,mptcp dss ack 2168003474 seq 1134774225 subseq 45697 len 1428 csum 0xef34], length 1428
11:45:04.751370 IP 112.26.3.1.38151 > 112.26.3.8.45245: Flags [.], seq 41413:42841, ack 1, win 893, options [nop,nop,TS val 3231703 ecr 3002409,mptcp dss ack 2168003474 seq 1134744237 subseq 41413 len 1428 csum 0xa270], length 1428
11:45:04.882094 IP 112.26.3.8.45245 > 112.26.3.1.38151: Flags [.], ack 39985, win 18250, options [nop,nop,TS val 3003199 ecr 3231701,mptcp dss ack 1134742809], length 0
11:45:04.893908 IP 112.26.3.1.38151 > 112.26.3.8.45245: Flags [.], seq 47125:48553, ack 1, win 893, options [nop,nop,TS val 3232744 ecr 3003199,mptcp dss ack 2168003474 seq 1134787077 subseq 47125 len 1428 csum 0xac84], length 1428
11:45:05.016128 IP 112.26.3.8.45245 > 112.26.3.1.38151: Flags [.], ack 39985, win 18615, options [nop,nop,TS val 3003528 ecr 3231701,nop,nop,sack 1 {41413:42841},mptcp dss ack 1134742809], length 0
11:45:05.055907 IP 112.26.3.1.38151 > 112.26.3.8.45245: Flags [.], seq 44269:45697, ack 1, win 893, options [nop,nop,TS val 3231966 ecr 3002674,mptcp dss ack 2168003474 seq 1134757089 subseq 44269 len 1428 csum 0xa91b], length 1428
11:45:05.192419 IP 112.26.3.8.45245 > 112.26.3.1.38151: Flags [.], ack 39985, win 18980, options [nop,nop,TS val 3003819 ecr 3231701,nop,nop,sack 2 {44269:45697}{41413:42841},mptcp dss ack 1134742809], length 0
11:45:05.199777 IP 112.26.3.8.45245 > 112.26.3.1.38151: Flags [.], ack 39985, win 18615, options [nop,nop,TS val 3003528 ecr 3231701,nop,nop,sack 1 {41413:42841},mptcp dss ack 1134742809], length 0
11:45:05.232905 IP 112.26.3.1.38151 > 112.26.3.8.45245: Flags [.], seq 48553:49981, ack 1, win 893, options [nop,nop,TS val 3233083 ecr 3003528,mptcp dss ack 2168003474 seq 1134798501 subseq 48553 len 1428 csum 0x8ffb], length 1428
11:45:05.305186 IP 112.26.3.1.38151 > 112.26.3.8.45245: Flags [.], seq 47125:48553, ack 1, win 893, options [nop,nop,TS val 3232744 ecr 3003199,mptcp dss ack 2168003474 seq 1134787077 subseq 47125 len 1428 csum 0xac84], length 1428
11:45:05.402725 IP 112.26.3.8.45245 > 112.26.3.1.38151: Flags [.], ack 39985, win 18980, options [nop,nop,TS val 3003819 ecr 3231701,nop,nop,sack 2 {44269:45697}{41413:42841},mptcp dss ack 1134742809], length 0
11:45:05.414310 IP 112.26.3.1.38151 > 112.26.3.8.45245: Flags [.], seq 39985:41413, ack 1, win 893, options [nop,nop,TS val 3233265 ecr 3003819,mptcp dss ack 2168003474 seq 1134742809 subseq 39985 len 1428 csum 0xbc], length 1428
11:45:05.493347 IP 112.26.3.8.45245 > 112.26.3.1.38151: Flags [.], ack 39985, win 19391, options [nop,nop,TS val 3004082 ecr 3231701,nop,nop,sack 2 {47125:48553}{44269:45697},mptcp dss ack 1134742809], length 0
11:45:05.539853 IP 112.26.3.8.45245 > 112.26.3.1.38151: Flags [.], ack 39985, win 19391, options [nop,nop,TS val 3004082 ecr 3231701,nop,nop,sack 2 {47125:48553}{44269:45697},mptcp dss ack 1134742809], length 0
11:45:05.590185 IP 112.26.3.1.38151 > 112.26.3.8.45245: Flags [.], seq 42841:44269, ack 1, win 893, options [nop,nop,TS val 3233402 ecr 3004082,mptcp dss ack 2168003474 seq 1134745665 subseq 42841 len 1428 csum 0x8aeb], length 1428
11:45:05.639187 IP 112.26.3.1.38151 > 112.26.3.8.45245: Flags [.], seq 48553:49981, ack 1, win 893, options [nop,nop,TS val 3233083 ecr 3003528,mptcp dss ack 2168003474 seq 1134798501 subseq 48553 len 1428 csum 0x8ffb], length 1428
11:45:05.935643 IP 112.26.3.8.45245 > 112.26.3.1.38151: Flags [.], ack 39985, win 19710, options [nop,nop,TS val 3004416 ecr 3231701,nop,nop,sack 2 {47125:49981}{44269:45697},mptcp dss ack 1134742809], length 0
11:45:05.937917 IP 112.26.3.8.45245 > 112.26.3.1.38151: Flags [.], ack 39985, win 19710, options [nop,nop,TS val 3004416 ecr 3231701,nop,nop,sack 2 {47125:49981}{44269:45697},mptcp dss ack 1134742809], length 0
11:45:05.961776 IP 112.26.3.1.38151 > 112.26.3.8.45245: Flags [.], seq 45697:47125, ack 1, win 893, options [nop,nop,TS val 3233800 ecr 3004416,mptcp dss ack 2168003474 seq 1134774225 subseq 45697 len 1428 csum 0xef34], length 1428
11:45:06.050746 IP 112.26.3.1.38151 > 112.26.3.8.45245: Flags [.], seq 42841:44269, ack 1, win 893, options [nop,nop,TS val 3233402 ecr 3004082,mptcp dss ack 2168003474 seq 1134745665 subseq 42841 len 1428 csum 0x8aeb], length 1428
11:45:06.347371 IP 112.26.3.8.45245 > 112.26.3.1.38151: Flags [.], ack 39985, win 19984, options [nop,nop,TS val 3004828 ecr 3231701,nop,nop,sack 2 {41413:45697}{47125:49981},mptcp dss ack 1134742809], length 0
11:45:06.351353 IP 112.26.3.8.45245 > 112.26.3.1.38151: Flags [.], ack 39985, win 19984, options [nop,nop,TS val 3004828 ecr 3231701,nop,nop,sack 2 {41413:45697}{47125:49981},mptcp dss ack 1134742809], length 0
11:45:06.361554 IP 112.26.3.1.38151 > 112.26.3.8.45245: Flags [.], seq 39985:41413, ack 1, win 893, options [nop,nop,TS val 3234214 ecr 3004828,mptcp dss ack 2168003474 seq 1134742809 subseq 39985 len 1428 csum 0xbc], length 1428
11:45:06.454773 IP 112.26.3.1.38151 > 112.26.3.8.45245: Flags [.], seq 45697:47125, ack 1, win 893, options [nop,nop,TS val 3233800 ecr 3004416,mptcp dss ack 2168003474 seq 1134774225 subseq 45697 len 1428 csum 0xef34], length 1428
11:45:06.524795 IP 112.26.3.8.45245 > 112.26.3.1.38151: Flags [.], ack 39985, win 20486, options [nop,nop,TS val 3005202 ecr 3231701,nop,nop,sack 1 {41413:49981},mptcp dss ack 1134742809], length 0
11:45:06.664804 IP 112.26.3.1.38151 > 112.26.3.8.45245: Flags [.], seq 39985:41413, ack 1, win 893, options [nop,nop,TS val 3234214 ecr 3004828,mptcp dss ack 2168003474 seq 1134742809 subseq 39985 len 1428 csum 0xbc], length 1428
11:45:06.708508 IP 112.26.3.8.45245 > 112.26.3.1.38151: Flags [.], ack 39985, win 20486, options [nop,nop,TS val 3005202 ecr 3231701,nop,nop,sack 1 {41413:49981},mptcp dss ack 1134742809], length 0
11:45:06.755401 IP 112.26.3.1.38151 > 112.26.3.8.45245: Flags [.], seq 49981:51409, ack 1, win 893, options [nop,nop,TS val 3234581 ecr 3005202,mptcp dss ack 2168003474 seq 1134847053 subseq 49981 len 1428 csum 0xddb5], length 1428
11:45:06.825689 IP 112.26.3.8.45245 > 112.26.3.1.38151: Flags [.], ack 49981, win 20805, options [nop,nop,TS val 3005442 ecr 3234214,mptcp dss ack 1134825633], length 0
11:45:06.985189 IP 112.26.3.1.38151 > 112.26.3.8.45245: Flags [.], seq 49981:51409, ack 1, win 893, options [nop,nop,TS val 3234581 ecr 3005202,mptcp dss ack 2168003474 seq 1134847053 subseq 49981 len 1428 csum 0xddb5], length 1428
11:45:07.023540 IP 112.26.3.8.45245 > 112.26.3.1.38151: Flags [.], ack 49981, win 20805, options [nop,nop,TS val 3005442 ecr 3234214,mptcp dss ack 1134825633], length 0
11:45:07.037741 IP 112.26.3.1.38151 > 112.26.3.8.45245: Flags [.], seq 51409:52837, ack 1, win 893, options [nop,nop,TS val 3234886 ecr 3005442,mptcp dss ack 2168003474 seq 1134867045 subseq 51409 len 1428 csum 0x1213], length 1428
11:45:07.176308 IP 112.26.3.8.45245 > 112.26.3.1.38151: Flags [.], ack 51409, win 21216, options [nop,nop,TS val 3005762 ecr 3234581,mptcp dss ack 1134827061], length 0
11:45:07.241046 IP 112.26.3.1.38151 > 112.26.3.8.45245: Flags [.], seq 52837:54265, ack 1, win 893, options [nop,nop,TS val 3234886 ecr 3005442,mptcp dss ack 2168003474 seq 1134868473 subseq 52837 len 1428 csum 0x2947], length 1428
11:45:07.256551 IP 112.26.3.1.38151 > 112.26.3.8.45245: Flags [.], seq 51409:52837, ack 1, win 893, options [nop,nop,TS val 3234886 ecr 3005442,mptcp dss ack 2168003474 seq 1134867045 subseq 51409 len 1428 csum 0x1213], length 1428
11:45:07.339523 IP 112.26.3.8.45245 > 112.26.3.1.38151: Flags [.], ack 51409, win 21216, options [nop,nop,TS val 3005762 ecr 3234581,mptcp dss ack 1134827061], length 0
11:45:07.380769 IP 112.26.3.1.38151 > 112.26.3.8.45245: Flags [.], seq 54265:55693, ack 1, win 893, options [nop,nop,TS val 3234886 ecr 3005442,mptcp dss ack 2168003474 seq 1134869901 subseq 54265 len 1428 csum 0xf2d6], length 1428
11:45:07.421143 IP 112.26.3.8.45245 > 112.26.3.1.38151: Flags [.], ack 52837, win 21535, options [nop,nop,TS val 3006033 ecr 3234886,mptcp dss ack 1134827061], length 0
11:45:07.548854 IP 112.26.3.1.38151 > 112.26.3.8.45245: Flags [.], seq 52837:54265, ack 1, win 893, options [nop,nop,TS val 3234886 ecr 3005442,mptcp dss ack 2168003474 seq 1134868473 subseq 52837 len 1428 csum 0x2947], length 1428
11:45:07.602591 IP 112.26.3.1.38151 > 112.26.3.8.45245: Flags [.], seq 55693:57121, ack 1, win 893, options [nop,nop,TS val 3235202 ecr 3005762,mptcp dss ack 2168003474 seq 1134878469 subseq 55693 len 1428 csum 0xdb6a], length 1428
11:45:07.664430 IP 112.26.3.8.45245 > 112.26.3.1.38151: Flags [.], ack 52837, win 21535, options [nop,nop,TS val 3006033 ecr 3234886,mptcp dss ack 1134827061], length 0
11:45:07.672460 IP 112.26.3.8.45245 > 112.26.3.1.38151: Flags [.], ack 54265, win 21855, options [nop,nop,TS val 3006304 ecr 3234886,mptcp dss ack 1134827061], length 0
11:45:07.754696 IP 112.26.3.1.38151 > 112.26.3.8.45245: Flags [.], seq 54265:55693, ack 1, win 893, options [nop,nop,TS val 3234886 ecr 3005442,mptcp dss ack 2168003474 seq 1134869901 subseq 54265 len 1428 csum 0xf2d6], length 1428
11:45:07.818579 IP 112.26.3.1.38151 > 112.26.3.8.45245: Flags [.], seq 57121:58549, ack 1, win 893, options [nop,nop,TS val 3235527 ecr 3006033,mptcp dss ack 2168003474 seq 1134887037 subseq 57121 len 1428 csum 0x30a5], length 1428
11:45:07.881274 IP 112.26.3.8.45245 > 112.26.3.1.38151: Flags [.], ack 55693, win 22129, options [nop,nop,TS val 3006531 ecr 3234886,mptcp dss ack 1134827061], length 0
11:45:07.950193 IP 112.26.3.8.45245 > 112.26.3.1.38151: Flags [.], ack 54265, win 21855, options [nop,nop,TS val 3006304 ecr 3234886,mptcp dss ack 1134827061], length 0
11:45:07.957750 IP 112.26.3.1.38151 > 112.26.3.8.45245: Flags [.], seq 58549:59977, ack 1, win 893, options [nop,nop,TS val 3235812 ecr 3006304,mptcp dss ack 2168003474 seq 1134904173 subseq 58549 len 1428 csum 0x2934], length 1428
11:45:08.058446 IP 112.26.3.1.38151 > 112.26.3.8.45245: Flags [.], seq 55693:57121, ack 1, win 893, options [nop,nop,TS val 3235202 ecr 3005762,mptcp dss ack 2168003474 seq 1134878469 subseq 55693 len 1428 csum 0xdb6a], length 1428
11:45:08.156095 IP 112.26.3.1.38151 > 112.26.3.8.45245: Flags [.], seq 59977:61405, ack 1, win 893, options [nop,nop,TS val 3235812 ecr 3006304,mptcp dss ack 2168003474 seq 1134905601 subseq 59977 len 1428 csum 0xf593], length 1428
11:45:08.188484 IP 112.26.3.8.45245 > 112.26.3.1.38151: Flags [.], ack 57121, win 22539, options [nop,nop,TS val 3006835 ecr 3235202,mptcp dss ack 1134827061], length 0
11:45:08.232627 IP 112.26.3.8.45245 > 112.26.3.1.38151: Flags [.], ack 55693, win 22129, options [nop,nop,TS val 3006531 ecr 3234886,mptcp dss ack 1134827061], length 0
11:45:08.300785 IP 112.26.3.1.38151 > 112.26.3.8.45245: Flags [.], seq 61405:62833, ack 1, win 893, options [nop,nop,TS val 3236095 ecr 3006531,mptcp dss ack 2168003474 seq 1134918453 subseq 61405 len 1428 csum 0xc7f3], length 1428
11:45:08.424939 IP 112.26.3.1.38151 > 112.26.3.8.45245: Flags [.], seq 58549:59977, ack 1, win 893, options [nop,nop,TS val 3235812 ecr 3006304,mptcp dss ack 2168003474 seq 1134904173 subseq 58549 len 1428 csum 0x2934], length 1428
11:45:08.527415 IP 112.26.3.8.45245 > 112.26.3.1.38151: Flags [.], ack 57121, win 22539, options [nop,nop,TS val 3006835 ecr 3235202,mptcp dss ack 1134827061], length 0
