11:44:54.497176 IP 112.26.1.8.43791 > 112.26.1.1.38151: Flags [S], seq 3649387865, win 65535, options [mss 1460,sackOK,TS val 2993265 ecr 0,nop,wscale 6,mptcp join id 3 token 0x3c5625f6 nonce 0x1fe1cd71], length 0
11:44:54.499923 IP 112.26.1.8.43791 > 112.26.1.1.38151: Flags [S], seq 3649387865, win 65535, options [mss 1460,sackOK,TS val 2993265 ecr 0,nop,wscale 6,mptcp join id 3 token 0x3c5625f6 nonce 0x1fe1cd71], length 0
11:44:54.502307 IP 112.26.1.1.38151 > 112.26.1.8.43791: Flags [S.], seq 4004470037, ack 3649387866, win 28560, options [mss 1460,sackOK,TS val 3222362 ecr 2993265,nop,wscale 7,mptcp join id 3 hmac 0x3256875f4c329db nonce 0xea93cb59], length 0
11:44:54.651075 IP 112.26.1.1.38151 > 112.26.1.8.43791: Flags [S.], seq 4004470037, ack 3649387866, win 28560, options [mss 1460,sackOK,TS val 3222362 ecr 2993265,nop,wscale 7,mptcp join id 3 hmac 0x3256875f4c329db nonce 0xea93cb59], length 0
11:44:54.653817 IP 112.26.1.1.38151 > 112.26.1.8.43791: Flags [S.], seq 4004470037, ack 3649387866, win 28560, options [mss 1460,sackOK,TS val 3222362 ecr 2993265,nop,wscale 7,mptcp join id 3 hmac 0x3256875f4c329db nonce 0xea93cb59], length 0
11:44:54.774746 IP 112.26.1.8.43791 > 112.26.1.1.38151: Flags [.], ack 1, win 6935, options [nop,nop,TS val 2993431 ecr 3222362,mptcp join hmac 0x51545920d2d732ac6a6f0dacd314dd6e9039c111], length 0
11:44:54.777111 IP 112.26.1.8.43791 > 112.26.1.1.38151: Flags [.], ack 1, win 6935, options [nop,nop,TS val 2993431 ecr 3222362,mptcp join hmac 0x51545920d2d732ac6a6f0dacd314dd6e9039c111], length 0
11:44:54.780121 IP 112.26.1.1.38151 > 112.26.1.8.43791: Flags [.], ack 1, win 893, options [nop,nop,TS val 3222640 ecr 2993431,mptcp dss ack 2168003474], length 0
11:44:54.847667 IP 112.26.1.1.38151 > 112.26.1.8.43791: Flags [.], seq 1:1429, ack 1, win 893, options [nop,nop,TS val 3222640 ecr 2993431,mptcp dss ack 2168003474 seq 1134448641 subseq 1 len 1428 csum 0xc16e], length 1428
11:44:54.875903 IP 112.26.1.1.38151 > 112.26.1.8.43791: Flags [.], ack 1, win 893, options [nop,nop,TS val 3222640 ecr 2993431,mptcp dss ack 2168003474], length 0
11:44:54.877269 IP 112.26.1.1.38151 > 112.26.1.8.43791: Flags [.], ack 1, win 893, options [nop,nop,TS val 3222640 ecr 2993431,mptcp dss ack 2168003474], length 0
11:44:54.888186 IP 112.26.1.1.38151 > 112.26.1.8.43791: Flags [.], seq 1429:2857, ack 1, win 893, options [nop,nop,TS val 3222640 ecr 2993431,mptcp dss ack 2168003474 seq 1134450069 subseq 1429 len 1428 csum 0x7037], length 1428
11:44:54.917677 IP 112.26.1.1.38151 > 112.26.1.8.43791: Flags [.], seq 2857:4285, ack 1, win 893, options [nop,nop,TS val 3222641 ecr 2993431,mptcp dss ack 2168003474 seq 1134451497 subseq 2857 len 1428 csum 0xe925], length 1428
11:44:54.923881 IP 112.26.1.1.38151 > 112.26.1.8.43791: Flags [.], seq 1:1429, ack 1, win 893, options [nop,nop,TS val 3222640 ecr 2993431,mptcp dss ack 2168003474 seq 1134448641 subseq 1 len 1428 csum 0xc16e], length 1428
11:44:54.959337 IP 112.26.1.1.38151 > 112.26.1.8.43791: Flags [.], seq 1:1429, ack 1, win 893, options [nop,nop,TS val 3222640 ecr 2993431,mptcp dss ack 2168003474 seq 1134448641 subseq 1 len 1428 csum 0xc16e], length 1428
11:44:54.981249 IP 112.26.1.1.38151 > 112.26.1.8.43791: Flags [.], seq 4285:5713, ack 1, win 893, options [nop,nop,TS val 3222641 ecr 2993431,mptcp dss ack 2168003474 seq 1134452925 subseq 4285 len 1428 csum 0xdf93], length 1428
11:44:55.023319 IP 112.26.1.8.43791 > 112.26.1.1.38151: Flags [.], ack 1429, win 7164, options [nop,nop,TS val 2993727 ecr 3222640,mptcp dss ack 1134415797], length 0
11:44:55.031279 IP 112.26.1.1.38151 > 112.26.1.8.43791: Flags [.], seq 5713:7141, ack 1, win 893, options [nop,nop,TS val 3222641 ecr 2993431,mptcp dss ack 2168003474 seq 1134454353 subseq 5713 len 1428 csum 0xe43c], length 1428
11:44:55.100554 IP 112.26.1.1.38151 > 112.26.1.8.43791: Flags [.], seq 7141:8569, ack 1, win 893, options [nop,nop,TS val 3222641 ecr 2993431,mptcp dss ack 2168003474 seq 1134455781 subseq 7141 len 1428 csum 0x2703], length 1428
11:44:55.123854 IP 112.26.1.1.38151 > 112.26.1.8.43791: Flags [.], seq 1429:2857, ack 1, win 893, options [nop,nop,TS val 3222640 ecr 2993431,mptcp dss ack 2168003474 seq 1134450069 subseq 1429 len 1428 csum 0x7037], length 1428
11:44:55.155343 IP 112.26.1.1.38151 > 112.26.1.8.43791: Flags [.], seq 1429:2857, ack 1, win 893, options [nop,nop,TS val 3222640 ecr 2993431,mptcp dss ack 2168003474 seq 1134450069 subseq 1429 len 1428 csum 0x7037], length 1428
11:44:55.169385 IP 112.26.1.1.38151 > 112.26.1.8.43791: Flags [.], seq 8569:9997, ack 1, win 893, options [nop,nop,TS val 3222641 ecr 2993431,mptcp dss ack 2168003474 seq 1134457209 subseq 8569 len 1428 csum 0x1776], length 1428
11:44:55.220143 IP 112.26.1.1.38151 > 112.26.1.8.43791: Flags [.], seq 9997:11425, ack 1, win 893, options [nop,nop,TS val 3222641 ecr 2993431,mptcp dss ack 2168003474 seq 1134458637 subseq 9997 len 1428 csum 0xa71d], length 1428
11:44:55.227106 IP 112.26.1.1.38151 > 112.26.1.8.43791: Flags [.], seq 2857:4285, ack 1, win 893, options [nop,nop,TS val 3222641 ecr 2993431,mptcp dss ack 2168003474 seq 1134451497 subseq 2857 len 1428 csum 0xe925], length 1428
11:44:55.260759 IP 112.26.1.8.43791 > 112.26.1.1.38151: Flags [.], ack 2857, win 7392, options [nop,nop,TS val 2993906 ecr 3222640,mptcp dss ack 1134421509], length 0
11:44:55.276826 IP 112.26.1.1.38151 > 112.26.1.8.43791: Flags [.], seq 4285:5713, ack 1, win 893, options [nop,nop,TS val 3222641 ecr 2993431,mptcp dss ack 2168003474 seq 1134452925 subseq 4285 len 1428 csum 0xdf93], length 1428
11:44:55.309284 IP 112.26.1.1.38151 > 112.26.1.8.43791: Flags [.], seq 2857:4285, ack 1, win 893, options [nop,nop,TS val 3222641 ecr 2993431,mptcp dss ack 2168003474 seq 1134451497 subseq 2857 len 1428 csum 0xe925], length 1428
11:44:55.321657 IP 112.26.1.8.43791 > 112.26.1.1.38151: Flags [.], ack 1429, win 7164, options [nop,nop,TS val 2993727 ecr 3222640,mptcp dss ack 1134415797], length 0
11:44:55.349871 IP 112.26.1.1.38151 > 112.26.1.8.43791: Flags [.], seq 14281:15709, ack 1, win 893, options [nop,nop,TS val 3223184 ecr 2993727,mptcp dss ack 2168003474 seq 1134472917 subseq 14281 len 1428 csum 0xc9c6], length 1428
11:44:55.381986 IP 112.26.1.1.38151 > 112.26.1.8.43791: Flags [.], seq 4285:5713, ack 1, win 893, options [nop,nop,TS val 3222641 ecr 2993431,mptcp dss ack 2168003474 seq 1134452925 subseq 4285 len 1428 csum 0xdf93], length 1428
11:44:55.387314 IP 112.26.1.1.38151 > 112.26.1.8.43791: Flags [.], seq 5713:7141, ack 1, win 893, options [nop,nop,TS val 3222641 ecr 2993431,mptcp dss ack 2168003474 seq 1134454353 subseq 5713 len 1428 csum 0xe43c], length 1428
11:44:55.425584 IP 112.26.1.1.38151 > 112.26.1.8.43791: Flags [.], seq 15709:17137, ack 1, win 893, options [nop,nop,TS val 3223184 ecr 2993727,mptcp dss ack 2168003474 seq 1134474345 subseq 15709 len 1428 csum 0x48a5], length 1428
11:44:55.458979 IP 112.26.1.8.43791 > 112.26.1.1.38151: Flags [.], ack 4285, win 7483, options [nop,nop,TS val 2994081 ecr 3222641,mptcp dss ack 1134421509], length 0
11:44:55.508032 IP 112.26.1.8.43791 > 112.26.1.1.38151: Flags [.], ack 5713, win 7620, options [nop,nop,TS val 2994159 ecr 3222641,mptcp dss ack 1134422937], length 0
11:44:55.537618 IP 112.26.1.1.38151 > 112.26.1.8.43791: Flags [.], seq 5713:7141, ack 1, win 893, options [nop,nop,TS val 3222641 ecr 2993431,mptcp dss ack 2168003474 seq 1134454353 subseq 5713 len 1428 csum 0xe43c], length 1428
11:44:55.566032 IP 112.26.1.1.38151 > 112.26.1.8.43791: Flags [.], seq 7141:8569, ack 1, win 893, options [nop,nop,TS val 3222641 ecr 2993431,mptcp dss ack 2168003474 seq 1134455781 subseq 7141 len 1428 csum 0x2703], length 1428
11:44:55.620733 IP 112.26.1.1.38151 > 112.26.1.8.43791: Flags [.], seq 8569:9997, ack 1, win 893, options [nop,nop,TS val 3222641 ecr 2993431,mptcp dss ack 2168003474 seq 1134457209 subseq 8569 len 1428 csum 0x1776], length 1428
11:44:55.659630 IP 112.26.1.8.43791 > 112.26.1.1.38151: Flags [.], ack 7141, win 7711, options [nop,nop,TS val 2994315 ecr 3222641,mptcp dss ack 1134422937], length 0
11:44:55.690707 IP 112.26.1.1.38151 > 112.26.1.8.43791: Flags [.], seq 9997:11425, ack 1, win 893, options [nop,nop,TS val 3222641 ecr 2993431,mptcp dss ack 2168003474 seq 1134458637 subseq 9997 len 1428 csum 0xa71d], length 1428
11:44:55.702429 IP 112.26.1.1.38151 > 112.26.1.8.43791: Flags [.], seq 7141:8569, ack 1, win 893, options [nop,nop,TS val 3222641 ecr 2993431,mptcp dss ack 2168003474 seq 1134455781 subseq 7141 len 1428 csum 0x2703], length 1428
11:44:55.767776 IP 112.26.1.8.43791 > 112.26.1.1.38151: Flags [.], ack 2857, win 7392, options [nop,nop,TS val 2993906 ecr 3222640,mptcp dss ack 1134421509], length 0
11:44:55.772298 IP 112.26.1.1.38151 > 112.26.1.8.43791: Flags [.], seq 17137:18565, ack 1, win 893, options [nop,nop,TS val 3223631 ecr 2993906,mptcp dss ack 2168003474 seq 1134491481 subseq 17137 len 1428 csum 0x44d1], length 1428
11:44:55.792187 IP 112.26.1.1.38151 > 112.26.1.8.43791: Flags [.], seq 8569:9997, ack 1, win 893, options [nop,nop,TS val 3222641 ecr 2993431,mptcp dss ack 2168003474 seq 1134457209 subseq 8569 len 1428 csum 0x1776], length 1428
11:44:55.820666 IP 112.26.1.1.38151 > 112.26.1.8.43791: Flags [.], seq 18565:19993, ack 1, win 893, options [nop,nop,TS val 3223631 ecr 2993906,mptcp dss ack 2168003474 seq 1134492909 subseq 18565 len 1428 csum 0x14e0], length 1428
11:44:55.832708 IP 112.26.1.1.38151 > 112.26.1.8.43791: Flags [.], seq 9997:11425, ack 1, win 893, options [nop,nop,TS val 3222641 ecr 2993431,mptcp dss ack 2168003474 seq 1134458637 subseq 9997 len 1428 csum 0xa71d], length 1428
11:44:55.882291 IP 112.26.1.8.43791 > 112.26.1.1.38151: Flags [.], ack 8569, win 7894, options [nop,nop,TS val 2994480 ecr 3222641,mptcp dss ack 1134424365], length 0
11:44:55.899244 IP 112.26.1.8.43791 > 112.26.1.1.38151: Flags [.], ack 9997, win 8076, options [nop,nop,TS val 2994566 ecr 3222641,mptcp dss ack 1134424365], length 0
11:44:55.920209 IP 112.26.1.8.43791 > 112.26.1.1.38151: Flags [.], ack 11425, win 8122, options [nop,nop,TS val 2994610 ecr 3222641,mptcp dss ack 1134424365], length 0
11:44:55.935433 IP 112.26.1.8.43791 > 112.26.1.1.38151: Flags [.], ack 4285, win 7483, options [nop,nop,TS val 2994081 ecr 3222641,mptcp dss ack 1134421509], length 0
11:44:55.952306 IP 112.26.1.1.38151 > 112.26.1.8.43791: Flags [.], seq 19993:21421, ack 1, win 893, options [nop,nop,TS val 3223798 ecr 2994081,mptcp dss ack 2168003474 seq 1134495765 subseq 19993 len 1428 csum 0x948e], length 1428
11:44:55.998562 IP 112.26.1.1.38151 > 112.26.1.8.43791: Flags [.], seq 21421:22849, ack 1, win 893, options [nop,nop,TS val 3223798 ecr 2994081,mptcp dss ack 2168003474 seq 1134497193 subseq 21421 len 1428 csum 0xb860], length 1428
11:44:56.009315 IP 112.26.1.8.43791 > 112.26.1.1.38151: Flags [.], ack 7141, win 7711, options [nop,nop,TS val 2994315 ecr 3222641,mptcp dss ack 1134422937], length 0
11:44:56.053686 IP 112.26.1.1.38151 > 112.26.1.8.43791: Flags [.], seq 22849:24277, ack 1, win 893, options [nop,nop,TS val 3223872 ecr 2994315,mptcp dss ack 2168003474 seq 1134500049 subseq 22849 len 1428 csum 0x9e0d], length 1428
11:44:56.079361 IP 112.26.1.1.38151 > 112.26.1.8.43791: Flags [.], seq 17137:18565, ack 1, win 893, options [nop,nop,TS val 3223631 ecr 2993906,mptcp dss ack 2168003474 seq 1134491481 subseq 17137 len 1428 csum 0x44d1], length 1428
11:44:56.087798 IP 112.26.1.1.38151 > 112.26.1.8.43791: Flags [.], seq 17137:18565, ack 1, win 893, options [nop,nop,TS val 3223631 ecr 2993906,mptcp dss ack 2168003474 seq 1134491481 subseq 17137 len 1428 csum 0x44d1], length 1428
11:44:56.116507 IP 112.26.1.1.38151 > 112.26.1.8.43791: Flags [.], seq 24277:25705, ack 1, win 893, options [nop,nop,TS val 3223872 ecr 2994315,mptcp dss ack 2168003474 seq 1134501477 subseq 24277 len 1428 csum 0x9bf1], length 1428
11:44:56.163935 IP 112.26.1.8.43791 > 112.26.1.1.38151: Flags [.], ack 11425, win 8395, options [nop,nop,TS val 2994860 ecr 3222641,nop,nop,sack 1 {17137:18565},mptcp dss ack 1134424365], length 0
11:44:56.175333 IP 112.26.1.1.38151 > 112.26.1.8.43791: Flags [.], seq 25705:27133, ack 1, win 893, options [nop,nop,TS val 3223872 ecr 2994315,mptcp dss ack 2168003474 seq 1134502905 subseq 25705 len 1428 csum 0x4c22], length 1428
11:44:56.190754 IP 112.26.1.1.38151 > 112.26.1.8.43791: Flags [.], seq 18565:19993, ack 1, win 893, options [nop,nop,TS val 3223631 ecr 2993906,mptcp dss ack 2168003474 seq 1134492909 subseq 18565 len 1428 csum 0x14e0], length 1428
11:44:56.202943 IP 112.26.1.1.38151 > 112.26.1.8.43791: Flags [.], seq 18565:19993, ack 1, win 893, options [nop,nop,TS val 3223631 ecr 2993906,mptcp dss ack 2168003474 seq 1134492909 subseq 18565 len 1428 csum 0x14e0], length 1428
11:44:56.228777 IP 112.26.1.1.38151 > 112.26.1.8.43791: Flags [.], seq 27133:28561, ack 1, win 893, options [nop,nop,TS val 3223872 ecr 2994315,mptcp dss ack 2168003474 seq 1134504333 subseq 27133 len 1428 csum 0x1043], length 1428
11:44:56.273683 IP 112.26.1.8.43791 > 112.26.1.1.38151: Flags [.], ack 8569, win 7894, options [nop,nop,TS val 2994480 ecr 3222641,mptcp dss ack 1134424365], length 0
11:44:56.299583 IP 112.26.1.1.38151 > 112.26.1.8.43791: Flags [.], seq 28561:29989, ack 1, win 893, options [nop,nop,TS val 3224136 ecr 2994480,mptcp dss ack 2168003474 seq 1134438645 subseq 28561 len 1428 csum 0x4efa], length 1428
11:44:56.322964 IP 112.26.1.8.43791 > 112.26.1.1.38151: Flags [.], ack 11425, win 8532, options [nop,nop,TS val 2994972 ecr 3222641,nop,nop,sack 1 {17137:19993},mptcp dss ack 1134424365], length 0
11:44:56.343872 IP 112.26.1.8.43791 > 112.26.1.1.38151: Flags [.], ack 9997, win 8076, options [nop,nop,TS val 2994566 ecr 3222641,mptcp dss ack 1134424365], length 0
11:44:56.352687 IP 112.26.1.1.38151 > 112.26.1.8.43791: Flags [.], seq 29989:31417, ack 1, win 893, options [nop,nop,TS val 3224136 ecr 2994480,mptcp dss ack 2168003474 seq 1134440073 subseq 29989 len 1428 csum 0x59ab], length 1428
11:44:56.384392 IP 112.26.1.8.43791 > 112.26.1.1.38151: Flags [.], ack 11425, win 8122, options [nop,nop,TS val 2994610 ecr 3222641,mptcp dss ack 1134424365], length 0
11:44:56.409560 IP 112.26.1.1.38151 > 112.26.1.8.43791: Flags [.], seq 31417:32845, ack 1, win 893, options [nop,nop,TS val 3224207 ecr 2994566,mptcp dss ack 2168003474 seq 1134444357 subseq 31417 len 1428 csum 0x66ef], length 1428
11:44:56.432125 IP 112.26.1.1.38151 > 112.26.1.8.43791: Flags [.], seq 19993:21421, ack 1, win 893, options [nop,nop,TS val 3223798 ecr 2994081,mptcp dss ack 2168003474 seq 1134495765 subseq 19993 len 1428 csum 0x948e], length 1428
11:44:56.439228 IP 112.26.1.1.38151 > 112.26.1.8.43791: Flags [.], seq 19993:21421, ack 1, win 893, options [nop,nop,TS val 3223798 ecr 2994081,mptcp dss ack 2168003474 seq 1134495765 subseq 19993 len 1428 csum 0x948e], length 1428
11:44:56.488455 IP 112.26.1.1.38151 > 112.26.1.8.43791: Flags [.], seq 32845:34273, ack 1, win 893, options [nop,nop,TS val 3224207 ecr 2994566,mptcp dss ack 2168003474 seq 1134445785 subseq 32845 len 1428 csum 0x956a], length 1428
11:44:56.513420 IP 112.26.1.1.38151 > 112.26.1.8.43791: Flags [.], seq 22849:24277, ack 1, win 893, options [nop,nop,TS val 3223872 ecr 2994315,mptcp dss ack 2168003474 seq 1134500049 subseq 22849 len 1428 csum 0x9e0d], length 1428
11:44:56.515881 IP 112.26.1.8.43791 > 112.26.1.1.38151: Flags [.], ack 11425, win 8806, options [nop,nop,TS val 2995212 ecr 3222641,nop,nop,sack 1 {17137:21421},mptcp dss ack 1134425793], length 0
11:44:56.527956 IP 112.26.1.1.38151 > 112.26.1.8.43791: Flags [.], seq 34273:35701, ack 1, win 893, options [nop,nop,TS val 3224247 ecr 2994610,mptcp dss ack 2168003474 seq 1134481485 subseq 34273 len 1428 csum 0x609f], length 1428
11:44:56.593039 IP 112.26.1.1.38151 > 112.26.1.8.43791: Flags [.], seq 22849:24277, ack 1, win 893, options [nop,nop,TS val 3223872 ecr 2994315,mptcp dss ack 2168003474 seq 1134500049 subseq 22849 len 1428 csum 0x9e0d], length 1428
11:44:56.623764 IP 112.26.1.1.38151 > 112.26.1.8.43791: Flags [.], seq 35701:37129, ack 1, win 893, options [nop,nop,TS val 3224247 ecr 2994610,mptcp dss ack 2168003474 seq 1134482913 subseq 35701 len 1428 csum 0xa10c], length 1428
11:44:56.652412 IP 112.26.1.8.43791 > 112.26.1.1.38151: Flags [.], ack 11425, win 8943, options [nop,nop,TS val 2995371 ecr 3222641,nop,nop,sack 2 {22849:24277}{17137:21421},mptcp dss ack 1134427221], length 0
11:44:56.676440 IP 112.26.1.8.43791 > 112.26.1.1.38151: Flags [.], ack 11425, win 8395, options [nop,nop,TS val 2994860 ecr 3222641,nop,nop,sack 1 {17137:18565},mptcp dss ack 1134424365], length 0
11:44:56.698538 IP 112.26.1.1.38151 > 112.26.1.8.43791: Flags [.], seq 11425:12853, ack 1, win 893, options [nop,nop,TS val 3224539 ecr 2994860,mptcp dss ack 2168003474 seq 1134460065 subseq 11425 len 1428 csum 0x6245], length 1428
11:44:56.720080 IP 112.26.1.1.38151 > 112.26.1.8.43791: Flags [.], seq 27133:28561, ack 1, win 893, options [nop,nop,TS val 3223872 ecr 2994315,mptcp dss ack 2168003474 seq 1134504333 subseq 27133 len 1428 csum 0x1043], length 1428
11:44:56.722398 IP 112.26.1.1.38151 > 112.26.1.8.43791: Flags [.], seq 27133:28561, ack 1, win 893, options [nop,nop,TS val 3223872 ecr 2994315,mptcp dss ack 2168003474 seq 1134504333 subseq 27133 len 1428 csum 0x1043], length 1428
11:44:56.789379 IP 112.26.1.8.43791 > 112.26.1.1.38151: Flags [.], ack 11425, win 9080, options [nop,nop,TS val 2995500 ecr 3222641,nop,nop,sack 2 {27133:28561}{22849:24277},mptcp dss ack 1134427221], length 0
11:44:56.810379 IP 112.26.1.1.38151 > 112.26.1.8.43791: Flags [.], seq 28561:29989, ack 1, win 893, options [nop,nop,TS val 3224136 ecr 2994480,mptcp dss ack 2168003474 seq 1134438645 subseq 28561 len 1428 csum 0x4efa], length 1428
11:44:56.833144 IP 112.26.1.1.38151 > 112.26.1.8.43791: Flags [.], seq 28561:29989, ack 1, win 893, options [nop,nop,TS val 3224136 ecr 2994480,mptcp dss ack 2168003474 seq 1134438645 subseq 28561 len 1428 csum 0x4efa], length 1428
11:44:56.880382 IP 112.26.1.8.43791 > 112.26.1.1.38151: Flags [.], ack 11425, win 9217, options [nop,nop,TS val 2995611 ecr 3222641,nop,nop,sack 2 {27133:29989}{22849:24277},mptcp dss ack 1134427221], length 0
11:44:56.890253 IP 112.26.1.1.38151 > 112.26.1.8.43791: Flags [.], seq 31417:32845, ack 1, win 893, options [nop,nop,TS val 3224207 ecr 2994566,mptcp dss ack 2168003474 seq 1134444357 subseq 31417 len 1428 csum 0x66ef], length 1428
11:44:56.920332 IP 112.26.1.1.38151 > 112.26.1.8.43791: Flags [.], seq 31417:32845, ack 1, win 893, options [nop,nop,TS val 3224207 ecr 2994566,mptcp dss ack 2168003474 seq 1134444357 subseq 31417 len 1428 csum 0x66ef], length 1428
11:44:56.938442 IP 112.26.1.1.38151 > 112.26.1.8.43791: Flags [.], seq 32845:34273, ack 1, win 893, options [nop,nop,TS val 3224207 ecr 2994566,mptcp dss ack 2168003474 seq 1134445785 subseq 32845 len 1428 csum 0x956a], length 1428
11:44:56.999491 IP 112.26.1.8.43791 > 112.26.1.1.38151: Flags [.], ack 11425, win 8806, options [nop,nop,TS val 2995212 ecr 3222641,nop,nop,sack 1 {17137:21421},mptcp dss ack 1134425793], length 0
11:44:57.005080 IP 112.26.1.8.43791 > 112.26.1.1.38151: Flags [.], ack 11425, win 9308, options [nop,nop,TS val 2995698 ecr 3222641,nop,nop,sack 2 {31417:32845}{27133:29989},mptcp dss ack 1134427221], length 0
11:44:57.024137 IP 112.26.1.1.38151 > 112.26.1.8.43791: Flags [.], seq 34273:35701, ack 1, win 893, options [nop,nop,TS val 3224247 ecr 2994610,mptcp dss ack 2168003474 seq 1134481485 subseq 34273 len 1428 csum 0x609f], length 1428
11:44:57.079937 IP 112.26.1.1.38151 > 112.26.1.8.43791: Flags [.], seq 32845:34273, ack 1, win 893, options [nop,nop,TS val 3224207 ecr 2994566,mptcp dss ack 2168003474 seq 1134445785 subseq 32845 len 1428 csum 0x956a], length 1428
11:44:57.096512 IP 112.26.1.1.38151 > 112.26.1.8.43791: Flags [.], seq 35701:37129, ack 1, win 893, options [nop,nop,TS val 3224247 ecr 2994610,mptcp dss ack 2168003474 seq 1134482913 subseq 35701 len 1428 csum 0xa10c], length 1428
11:44:57.138874 IP 112.26.1.8.43791 > 112.26.1.1.38151: Flags [.], ack 11425, win 8943, options [nop,nop,TS val 2995371 ecr 3222641,nop,nop,sack 2 {22849:24277}{17137:21421},mptcp dss ack 1134427221], length 0
11:44:57.185065 IP 112.26.1.1.38151 > 112.26.1.8.43791: Flags [.], seq 34273:35701, ack 1, win 893, options [nop,nop,TS val 3224247 ecr 2994610,mptcp dss ack 2168003474 seq 1134481485 subseq 34273 len 1428 csum 0x609f], length 1428
11:44:57.190374 IP 112.26.1.1.38151 > 112.26.1.8.43791: Flags [.], seq 12853:14281, ack 1, win 893, options [nop,nop,TS val 3225002 ecr 2995371,mptcp dss ack 2168003474 seq 1134461493 subseq 12853 len 1428 csum 0xdc0e], length 1428
11:44:57.209230 IP 112.26.1.8.43791 > 112.26.1.1.38151: Flags [.], ack 11425, win 9490, options [nop,nop,TS val 2995857 ecr 3222641,nop,nop,sack 2 {31417:34273}{27133:29989},mptcp dss ack 1134427221], length 0
11:44:57.216197 IP 112.26.1.8.43791 > 112.26.1.1.38151: Flags [.], ack 11425, win 9080, options [nop,nop,TS val 2995500 ecr 3222641,nop,nop,sack 2 {27133:28561}{22849:24277},mptcp dss ack 1134427221], length 0
11:44:57.239650 IP 112.26.1.1.38151 > 112.26.1.8.43791: Flags [.], seq 35701:37129, ack 1, win 893, options [nop,nop,TS val 3224247 ecr 2994610,mptcp dss ack 2168003474 seq 1134482913 subseq 35701 len 1428 csum 0xa10c], length 1428
11:44:57.251843 IP 112.26.1.1.38151 > 112.26.1.8.43791: Flags [.], seq 14281:15709, ack 1, win 893, options [nop,nop,TS val 3225079 ecr 2995500,mptcp dss ack 2168003474 seq 1134472917 subseq 14281 len 1428 csum 0xc9c6], length 1428
11:44:57.283556 IP 112.26.1.8.43791 > 112.26.1.1.38151: Flags [.], ack 11425, win 9217, options [nop,nop,TS val 2995611 ecr 3222641,nop,nop,sack 2 {27133:29989}{22849:24277},mptcp dss ack 1134427221], length 0
11:44:57.301845 IP 112.26.1.8.43791 > 112.26.1.1.38151: Flags [.], ack 11425, win 9582, options [nop,nop,TS val 2995925 ecr 3222641,nop,nop,sack 2 {31417:35701}{27133:29989},mptcp dss ack 1134427221], length 0
11:44:57.312966 IP 112.26.1.1.38151 > 112.26.1.8.43791: Flags [.], seq 15709:17137, ack 1, win 893, options [nop,nop,TS val 3225146 ecr 2995611,mptcp dss ack 2168003474 seq 1134474345 subseq 15709 len 1428 csum 0x48a5], length 1428
11:44:57.330351 IP 112.26.1.8.43791 > 112.26.1.1.38151: Flags [.], ack 11425, win 9719, options [nop,nop,TS val 2996012 ecr 3222641,nop,nop,sack 2 {31417:37129}{27133:29989},mptcp dss ack 1134427221], length 0
11:44:57.354943 IP 112.26.1.8.43791 > 112.26.1.1.38151: Flags [.], ack 11425, win 9308, options [nop,nop,TS val 2995698 ecr 3222641,nop,nop,sack 2 {31417:32845}{27133:29989},mptcp dss ack 1134427221], length 0
11:44:57.365124 IP 112.26.1.1.38151 > 112.26.1.8.43791: Flags [.], seq 21421:22849, ack 1, win 893, options [nop,nop,TS val 3225218 ecr 2995698,mptcp dss ack 2168003474 seq 1134497193 subseq 21421 len 1428 csum 0xb860], length 1428
11:44:57.401436 IP 112.26.1.1.38151 > 112.26.1.8.43791: Flags [.], seq 12853:14281, ack 1, win 893, options [nop,nop,TS val 3225002 ecr 2995371,mptcp dss ack 2168003474 seq 1134461493 subseq 12853 len 1428 csum 0xdc0e], length 1428
11:44:57.403684 IP 112.26.1.1.38151 > 112.26.1.8.43791: Flags [.], seq 12853:14281, ack 1, win 893, options [nop,nop,TS val 3225002 ecr 2995371,mptcp dss ack 2168003474 seq 1134461493 subseq 12853 len 1428 csum 0xdc0e], length 1428
11:44:57.455505 IP 112.26.1.8.43791 > 112.26.1.1.38151: Flags [.], ack 11425, win 9855, options [nop,nop,TS val 2996181 ecr 3222641,nop,nop,sack 2 {12853:14281}{31417:37129},mptcp dss ack 1134438645], length 0
11:44:57.499555 IP 112.26.1.8.43791 > 112.26.1.1.38151: Flags [.], ack 11425, win 9490, options [nop,nop,TS val 2995857 ecr 3222641,nop,nop,sack 2 {31417:34273}{27133:29989},mptcp dss ack 1134427221], length 0
11:44:57.502031 IP 112.26.1.1.38151 > 112.26.1.8.43791: Flags [.], seq 24277:25705, ack 1, win 893, options [nop,nop,TS val 3225362 ecr 2995857,mptcp dss ack 2168003474 seq 1134501477 subseq 24277 len 1428 csum 0x9bf1], length 1428
11:44:57.563364 IP 112.26.1.1.38151 > 112.26.1.8.43791: Flags [.], seq 14281:15709, ack 1, win 893, options [nop,nop,TS val 3225079 ecr 2995500,mptcp dss ack 2168003474 seq 1134472917 subseq 14281 len 1428 csum 0xc9c6], length 1428
11:44:57.566923 IP 112.26.1.1.38151 > 112.26.1.8.43791: Flags [.], seq 14281:15709, ack 1, win 893, options [nop,nop,TS val 3225079 ecr 2995500,mptcp dss ack 2168003474 seq 1134472917 subseq 14281 len 1428 csum 0xc9c6], length 1428
11:44:57.627722 IP 112.26.1.8.43791 > 112.26.1.1.38151: Flags [.], ack 11425, win 9582, options [nop,nop,TS val 2995925 ecr 3222641,nop,nop,sack 2 {31417:35701}{27133:29989},mptcp dss ack 1134427221], length 0
11:44:57.636002 IP 112.26.1.1.38151 > 112.26.1.8.43791: Flags [.], seq 25705:27133, ack 1, win 893, options [nop,nop,TS val 3225490 ecr 2995925,mptcp dss ack 2168003474 seq 1134502905 subseq 25705 len 1428 csum 0x4c22], length 1428
11:44:57.702612 IP 112.26.1.8.43791 > 112.26.1.1.38151: Flags [.], ack 11425, win 10084, options [nop,nop,TS val 2996344 ecr 3222641,nop,nop,sack 2 {12853:15709}{31417:37129},mptcp dss ack 1134438645], length 0
11:44:57.713116 IP 112.26.1.1.38151 > 112.26.1.8.43791: Flags [.], seq 15709:17137, ack 1, win 893, options [nop,nop,TS val 3225146 ecr 2995611,mptcp dss ack 2168003474 seq 1134474345 subseq 15709 len 1428 csum 0x48a5], length 1428
11:44:57.750156 IP 112.26.1.1.38151 > 112.26.1.8.43791: Flags [.], seq 15709:17137, ack 1, win 893, options [nop,nop,TS val 3225146 ecr 2995611,mptcp dss ack 2168003474 seq 1134474345 subseq 15709 len 1428 csum 0x48a5], length 1428
11:44:57.761449 IP 112.26.1.8.43791 > 112.26.1.1.38151: Flags [.], ack 11425, win 9719, options [nop,nop,TS val 2996012 ecr 3222641,nop,nop,sack 2 {31417:37129}{27133:29989},mptcp dss ack 1134427221], length 0
11:44:57.784611 IP 112.26.1.1.38151 > 112.26.1.8.43791: Flags [.], seq 29989:31417, ack 1, win 893, options [nop,nop,TS val 3225624 ecr 2996012,mptcp dss ack 2168003474 seq 1134440073 subseq 29989 len 1428 csum 0x59ab], length 1428
11:44:57.816788 IP 112.26.1.8.43791 > 112.26.1.1.38151: Flags [.], ack 11425, win 10266, options [nop,nop,TS val 2996527 ecr 3222641,nop,nop,sack 2 {12853:17137}{31417:37129},mptcp dss ack 1134438645], length 0
11:44:57.838903 IP 112.26.1.1.38151 > 112.26.1.8.43791: Flags [.], seq 21421:22849, ack 1, win 893, options [nop,nop,TS val 3225218 ecr 2995698,mptcp dss ack 2168003474 seq 1134497193 subseq 21421 len 1428 csum 0xb860], length 1428
11:44:57.853891 IP 112.26.1.1.38151 > 112.26.1.8.43791: Flags [.], seq 21421:22849, ack 1, win 893, options [nop,nop,TS val 3225218 ecr 2995698,mptcp dss ack 2168003474 seq 1134497193 subseq 21421 len 1428 csum 0xb860], length 1428
11:44:57.881584 IP 112.26.1.8.43791 > 112.26.1.1.38151: Flags [.], ack 11425, win 9855, options [nop,nop,TS val 2996181 ecr 3222641,nop,nop,sack 2 {12853:14281}{31417:37129},mptcp dss ack 1134438645], length 0
11:44:57.886678 IP 112.26.1.1.38151 > 112.26.1.8.43791: Flags [.], seq 11425:12853, ack 1, win 893, options [nop,nop,TS val 3225744 ecr 2996181,mptcp dss ack 2168003474 seq 1134460065 subseq 11425 len 1428 csum 0x6245], length 1428
11:44:57.923911 IP 112.26.1.8.43791 > 112.26.1.1.38151: Flags [.], ack 11425, win 10357, options [nop,nop,TS val 2996631 ecr 3222641,nop,nop,sack 2 {21421:24277}{12853:17137},mptcp dss ack 1134438645], length 0
11:44:57.967413 IP 112.26.1.1.38151 > 112.26.1.8.43791: Flags [.], seq 24277:25705, ack 1, win 893, options [nop,nop,TS val 3225362 ecr 2995857,mptcp dss ack 2168003474 seq 1134501477 subseq 24277 len 1428 csum 0x9bf1], length 1428
11:44:57.990182 IP 112.26.1.1.38151 > 112.26.1.8.43791: Flags [.], seq 24277:25705, ack 1, win 893, options [nop,nop,TS val 3225362 ecr 2995857,mptcp dss ack 2168003474 seq 1134501477 subseq 24277 len 1428 csum 0x9bf1], length 1428
11:44:58.046196 IP 112.26.1.8.43791 > 112.26.1.1.38151: Flags [.], ack 11425, win 10494, options [nop,nop,TS val 2996767 ecr 3222641,nop,nop,sack 2 {21421:25705}{12853:17137},mptcp dss ack 1134438645], length 0
11:44:58.049422 IP 112.26.1.1.38151 > 112.26.1.8.43791: Flags [.], seq 25705:27133, ack 1, win 893, options [nop,nop,TS val 3225490 ecr 2995925,mptcp dss ack 2168003474 seq 1134502905 subseq 25705 len 1428 csum 0x4c22], length 1428
11:44:58.093944 IP 112.26.1.1.38151 > 112.26.1.8.43791: Flags [.], seq 25705:27133, ack 1, win 893, options [nop,nop,TS val 3225490 ecr 2995925,mptcp dss ack 2168003474 seq 1134502905 subseq 25705 len 1428 csum 0x4c22], length 1428
11:44:58.122292 IP 112.26.1.8.43791 > 112.26.1.1.38151: Flags [.], ack 11425, win 10084, options [nop,nop,TS val 2996344 ecr 3222641,nop,nop,sack 2 {12853:15709}{31417:37129},mptcp dss ack 1134438645], length 0
11:44:58.137916 IP 112.26.1.1.38151 > 112.26.1.8.43791: Flags [.], seq 37129:38557, ack 1, win 893, options [nop,nop,TS val 3225994 ecr 2996344,mptcp dss ack 2168003474 seq 1134535749 subseq 37129 len 1428 csum 0x553d], length 1428
11:44:58.149176 IP 112.26.1.8.43791 > 112.26.1.1.38151: Flags [.], ack 11425, win 10631, options [nop,nop,TS val 2996871 ecr 3222641,nop,nop,sack 2 {21421:29989}{12853:17137},mptcp dss ack 1134438645], length 0
11:44:58.189432 IP 112.26.1.1.38151 > 112.26.1.8.43791: Flags [.], seq 29989:31417, ack 1, win 893, options [nop,nop,TS val 3225624 ecr 2996012,mptcp dss ack 2168003474 seq 1134440073 subseq 29989 len 1428 csum 0x59ab], length 1428
11:44:58.214472 IP 112.26.1.1.38151 > 112.26.1.8.43791: Flags [.], seq 29989:31417, ack 1, win 893, options [nop,nop,TS val 3225624 ecr 2996012,mptcp dss ack 2168003474 seq 1134440073 subseq 29989 len 1428 csum 0x59ab], length 1428
11:44:58.222924 IP 112.26.1.8.43791 > 112.26.1.1.38151: Flags [.], ack 11425, win 10266, options [nop,nop,TS val 2996527 ecr 3222641,nop,nop,sack 2 {12853:17137}{31417:37129},mptcp dss ack 1134438645], length 0
11:44:58.263165 IP 112.26.1.8.43791 > 112.26.1.1.38151: Flags [.], ack 11425, win 10768, options [nop,nop,TS val 2996991 ecr 3222641,nop,nop,sack 2 {21421:37129}{12853:17137},mptcp dss ack 1134438645], length 0
11:44:58.298164 IP 112.26.1.1.38151 > 112.26.1.8.43791: Flags [.], seq 11425:12853, ack 1, win 893, options [nop,nop,TS val 3225744 ecr 2996181,mptcp dss ack 2168003474 seq 1134460065 subseq 11425 len 1428 csum 0x6245], length 1428
11:44:58.310287 IP 112.26.1.1.38151 > 112.26.1.8.43791: Flags [.], seq 38557:39985, ack 1, win 893, options [nop,nop,TS val 3226171 ecr 2996527,mptcp dss ack 2168003474 seq 1134541461 subseq 38557 len 1428 csum 0x7ede], length 1428
11:44:58.334646 IP 112.26.1.1.38151 > 112.26.1.8.43791: Flags [.], seq 11425:12853, ack 1, win 893, options [nop,nop,TS val 3225744 ecr 2996181,mptcp dss ack 2168003474 seq 1134460065 subseq 11425 len 1428 csum 0x6245], length 1428
11:44:58.375952 IP 112.26.1.8.43791 > 112.26.1.1.38151: Flags [.], ack 37129, win 10859, options [nop,nop,TS val 2997095 ecr 3225744,mptcp dss ack 1134518613], length 0
11:44:58.393386 IP 112.26.1.8.43791 > 112.26.1.1.38151: Flags [.], ack 11425, win 10357, options [nop,nop,TS val 2996631 ecr 3222641,nop,nop,sack 2 {21421:24277}{12853:17137},mptcp dss ack 1134438645], length 0
11:44:58.421788 IP 112.26.1.8.43791 > 112.26.1.1.38151: Flags [.], ack 11425, win 10494, options [nop,nop,TS val 2996767 ecr 3222641,nop,nop,sack 2 {21421:25705}{12853:17137},mptcp dss ack 1134438645], length 0
11:44:58.424296 IP 112.26.1.1.38151 > 112.26.1.8.43791: Flags [.], seq 39985:41413, ack 1, win 893, options [nop,nop,TS val 3226285 ecr 2996631,mptcp dss ack 2168003474 seq 1134545745 subseq 39985 len 1428 csum 0xd70f], length 1428
11:44:58.464445 IP 112.26.1.1.38151 > 112.26.1.8.43791: Flags [.], seq 41413:42841, ack 1, win 893, options [nop,nop,TS val 3226296 ecr 2996767,mptcp dss ack 2168003474 seq 1134547173 subseq 41413 len 1428 csum 0x3056], length 1428
11:44:58.504796 IP 112.26.1.1.38151 > 112.26.1.8.43791: Flags [.], seq 37129:38557, ack 1, win 893, options [nop,nop,TS val 3225994 ecr 2996344,mptcp dss ack 2168003474 seq 1134535749 subseq 37129 len 1428 csum 0x553d], length 1428
11:44:58.509146 IP 112.26.1.1.38151 > 112.26.1.8.43791: Flags [.], seq 37129:38557, ack 1, win 893, options [nop,nop,TS val 3225994 ecr 2996344,mptcp dss ack 2168003474 seq 1134535749 subseq 37129 len 1428 csum 0x553d], length 1428
11:44:58.569031 IP 112.26.1.8.43791 > 112.26.1.1.38151: Flags [.], ack 11425, win 10631, options [nop,nop,TS val 2996871 ecr 3222641,nop,nop,sack 2 {21421:29989}{12853:17137},mptcp dss ack 1134438645], length 0
11:44:58.577122 IP 112.26.1.8.43791 > 112.26.1.1.38151: Flags [.], ack 38557, win 11087, options [nop,nop,TS val 2997286 ecr 3225994,mptcp dss ack 1134518613], length 0
11:44:58.616289 IP 112.26.1.8.43791 > 112.26.1.1.38151: Flags [.], ack 11425, win 10768, options [nop,nop,TS val 2996991 ecr 3222641,nop,nop,sack 2 {21421:37129}{12853:17137},mptcp dss ack 1134438645], length 0
11:44:58.621596 IP 112.26.1.1.38151 > 112.26.1.8.43791: Flags [.], seq 42841:44269, ack 1, win 893, options [nop,nop,TS val 3226479 ecr 2996871,mptcp dss ack 2168003474 seq 1134551457 subseq 42841 len 1428 csum 0x9ec0], length 1428
11:44:58.660622 IP 112.26.1.1.38151 > 112.26.1.8.43791: Flags [.], seq 44269:45697, ack 1, win 893, options [nop,nop,TS val 3226514 ecr 2996991,mptcp dss ack 2168003474 seq 1134552885 subseq 44269 len 1428 csum 0xc2dc], length 1428
11:44:58.669578 IP 112.26.1.1.38151 > 112.26.1.8.43791: Flags [.], seq 38557:39985, ack 1, win 893, options [nop,nop,TS val 3226171 ecr 2996527,mptcp dss ack 2168003474 seq 1134541461 subseq 38557 len 1428 csum 0x7ede], length 1428
11:44:58.671898 IP 112.26.1.1.38151 > 112.26.1.8.43791: Flags [.], seq 38557:39985, ack 1, win 893, options [nop,nop,TS val 3226171 ecr 2996527,mptcp dss ack 2168003474 seq 1134541461 subseq 38557 len 1428 csum 0x7ede], length 1428
11:44:58.743339 IP 112.26.1.8.43791 > 112.26.1.1.38151: Flags [.], ack 39985, win 11270, options [nop,nop,TS val 2997449 ecr 3226171,mptcp dss ack 1134518613], length 0
11:44:58.748442 IP 112.26.1.8.43791 > 112.26.1.1.38151: Flags [.], ack 37129, win 10859, options [nop,nop,TS val 2997095 ecr 3225744,mptcp dss ack 1134518613], length 0
11:44:58.757723 IP 112.26.1.1.38151 > 112.26.1.8.43791: Flags [.], seq 45697:47125, ack 1, win 893, options [nop,nop,TS val 3226611 ecr 2997095,mptcp dss ack 2168003474 seq 1134555741 subseq 45697 len 1428 csum 0x561e], length 1428
11:44:58.821292 IP 112.26.1.1.38151 > 112.26.1.8.43791: Flags [.], seq 47125:48553, ack 1, win 893, options [nop,nop,TS val 3226611 ecr 2997095,mptcp dss ack 2168003474 seq 1134557169 subseq 47125 len 1428 csum 0x2ac8], length 1428
11:44:58.830013 IP 112.26.1.1.38151 > 112.26.1.8.43791: Flags [.], seq 39985:41413, ack 1, win 893, options [nop,nop,TS val 3226285 ecr 2996631,mptcp dss ack 2168003474 seq 1134545745 subseq 39985 len 1428 csum 0xd70f], length 1428
11:44:58.845993 IP 112.26.1.1.38151 > 112.26.1.8.43791: Flags [.], seq 39985:41413, ack 1, win 893, options [nop,nop,TS val 3226285 ecr 2996631,mptcp dss ack 2168003474 seq 1134545745 subseq 39985 len 1428 csum 0xd70f], length 1428
11:44:58.910393 IP 112.26.1.1.38151 > 112.26.1.8.43791: Flags [.], seq 48553:49981, ack 1, win 893, options [nop,nop,TS val 3226611 ecr 2997095,mptcp dss ack 2168003474 seq 1134558597 subseq 48553 len 1428 csum 0x848e], length 1428
11:44:58.912010 IP 112.26.1.8.43791 > 112.26.1.1.38151: Flags [.], ack 41413, win 11498, options [nop,nop,TS val 2997611 ecr 3226285,mptcp dss ack 1134518613], length 0
11:44:58.938254 IP 112.26.1.1.38151 > 112.26.1.8.43791: Flags [.], seq 41413:42841, ack 1, win 893, options [nop,nop,TS val 3226296 ecr 2996767,mptcp dss ack 2168003474 seq 1134547173 subseq 41413 len 1428 csum 0x3056], length 1428
11:44:58.948000 IP 112.26.1.1.38151 > 112.26.1.8.43791: Flags [.], seq 41413:42841, ack 1, win 893, options [nop,nop,TS val 3226296 ecr 2996767,mptcp dss ack 2168003474 seq 1134547173 subseq 41413 len 1428 csum 0x3056], length 1428
11:44:58.970989 IP 112.26.1.1.38151 > 112.26.1.8.43791: Flags [.], seq 49981:51409, ack 1, win 893, options [nop,nop,TS val 3226611 ecr 2997095,mptcp dss ack 2168003474 seq 1134560025 subseq 49981 len 1428 csum 0x51a], length 1428
11:44:59.012285 IP 112.26.1.8.43791 > 112.26.1.1.38151: Flags [.], ack 38557, win 11087, options [nop,nop,TS val 2997286 ecr 3225994,mptcp dss ack 1134518613], length 0
11:44:59.022909 IP 112.26.1.8.43791 > 112.26.1.1.38151: Flags [.], ack 42841, win 11635, options [nop,nop,TS val 2997725 ecr 3226296,mptcp dss ack 1134521469], length 0
11:44:59.035956 IP 112.26.1.1.38151 > 112.26.1.8.43791: Flags [.], seq 51409:52837, ack 1, win 893, options [nop,nop,TS val 3226611 ecr 2997095,mptcp dss ack 2168003474 seq 1134561453 subseq 51409 len 1428 csum 0x4716], length 1428
11:44:59.062887 IP 112.26.1.1.38151 > 112.26.1.8.43791: Flags [.], seq 42841:44269, ack 1, win 893, options [nop,nop,TS val 3226479 ecr 2996871,mptcp dss ack 2168003474 seq 1134551457 subseq 42841 len 1428 csum 0x9ec0], length 1428
11:44:59.067030 IP 112.26.1.1.38151 > 112.26.1.8.43791: Flags [.], seq 42841:44269, ack 1, win 893, options [nop,nop,TS val 3226479 ecr 2996871,mptcp dss ack 2168003474 seq 1134551457 subseq 42841 len 1428 csum 0x9ec0], length 1428
11:44:59.081312 IP 112.26.1.1.38151 > 112.26.1.8.43791: Flags [.], seq 52837:54265, ack 1, win 893, options [nop,nop,TS val 3226611 ecr 2997095,mptcp dss ack 2168003474 seq 1134562881 subseq 52837 len 1428 csum 0x1eaf], length 1428
11:44:59.119793 IP 112.26.1.8.43791 > 112.26.1.1.38151: Flags [.], ack 44269, win 11772, options [nop,nop,TS val 2997844 ecr 3226479,mptcp dss ack 1134521469], length 0
11:44:59.151890 IP 112.26.1.1.38151 > 112.26.1.8.43791: Flags [.], seq 54265:55693, ack 1, win 893, options [nop,nop,TS val 3226875 ecr 2997286,mptcp dss ack 2168003474 seq 1134572877 subseq 54265 len 1428 csum 0xe8f9], length 1428
11:44:59.175422 IP 112.26.1.8.43791 > 112.26.1.1.38151: Flags [.], ack 39985, win 11270, options [nop,nop,TS val 2997449 ecr 3226171,mptcp dss ack 1134518613], length 0
11:44:59.212070 IP 112.26.1.1.38151 > 112.26.1.8.43791: Flags [.], seq 55693:57121, ack 1, win 893, options [nop,nop,TS val 3226875 ecr 2997286,mptcp dss ack 2168003474 seq 1134574305 subseq 55693 len 1428 csum 0x11d6], length 1428
11:44:59.249318 IP 112.26.1.1.38151 > 112.26.1.8.43791: Flags [.], seq 45697:47125, ack 1, win 893, options [nop,nop,TS val 3226611 ecr 2997095,mptcp dss ack 2168003474 seq 1134555741 subseq 45697 len 1428 csum 0x561e], length 1428
11:44:59.254367 IP 112.26.1.1.38151 > 112.26.1.8.43791: Flags [.], seq 45697:47125, ack 1, win 893, options [nop,nop,TS val 3226611 ecr 2997095,mptcp dss ack 2168003474 seq 1134555741 subseq 45697 len 1428 csum 0x561e], length 1428
11:44:59.278813 IP 112.26.1.1.38151 > 112.26.1.8.43791: Flags [.], seq 57121:58549, ack 1, win 893, options [nop,nop,TS val 3227039 ecr 2997449,mptcp dss ack 2168003474 seq 1134578589 subseq 57121 len 1428 csum 0xe42f], length 1428
11:44:59.323374 IP 112.26.1.8.43791 > 112.26.1.1.38151: Flags [.], ack 44269, win 12000, options [nop,nop,TS val 2998032 ecr 3226479,nop,nop,sack 1 {45697:47125},mptcp dss ack 1134527181], length 0
11:44:59.342721 IP 112.26.1.1.38151 > 112.26.1.8.43791: Flags [.], seq 48553:49981, ack 1, win 893, options [nop,nop,TS val 3226611 ecr 2997095,mptcp dss ack 2168003474 seq 1134558597 subseq 48553 len 1428 csum 0x848e], length 1428
11:44:59.363066 IP 112.26.1.1.38151 > 112.26.1.8.43791: Flags [.], seq 48553:49981, ack 1, win 893, options [nop,nop,TS val 3226611 ecr 2997095,mptcp dss ack 2168003474 seq 1134558597 subseq 48553 len 1428 csum 0x848e], length 1428
11:44:59.423156 IP 112.26.1.1.38151 > 112.26.1.8.43791: Flags [.], seq 49981:51409, ack 1, win 893, options [nop,nop,TS val 3226611 ecr 2997095,mptcp dss ack 2168003474 seq 1134560025 subseq 49981 len 1428 csum 0x51a], length 1428
11:44:59.441514 IP 112.26.1.8.43791 > 112.26.1.1.38151: Flags [.], ack 44269, win 12137, options [nop,nop,TS val 2998140 ecr 3226479,nop,nop,sack 2 {48553:49981}{45697:47125},mptcp dss ack 1134527181], length 0
