11:44:54.513769 IP 112.26.2.8.41433 > 112.26.2.1.38151: Flags [S], seq 592233833, win 65535, options [mss 1460,sackOK,TS val 2993266 ecr 0,nop,wscale 6,mptcp join id 6 token 0x3c5625f6 nonce 0x5e368ff7], length 0
11:44:54.521273 IP 112.26.2.1.38151 > 112.26.2.8.41433: Flags [S.], seq 1257471719, ack 592233834, win 28560, options [mss 1460,sackOK,TS val 3222376 ecr 2993266,nop,wscale 7,mptcp join id 6 hmac 0xb4a61f7b6656817d nonce 0x635cfde7], length 0
11:44:54.595903 IP 112.26.2.1.38151 > 112.26.2.8.41433: Flags [S.], seq 1257471719, ack 592233834, win 28560, options [mss 1460,sackOK,TS val 3222376 ecr 2993266,nop,wscale 7,mptcp join id 6 hmac 0xb4a61f7b6656817d nonce 0x635cfde7], length 0
11:44:54.647314 IP 112.26.2.8.41433 > 112.26.2.1.38151: Flags [.], ack 1, win 5567, options [nop,nop,TS val 2993373 ecr 3222376,mptcp join hmac 0x92833a65c4aee7232b2727db06d8f66e60d25629], length 0
11:44:54.651954 IP 112.26.2.1.38151 > 112.26.2.8.41433: Flags [.], ack 1, win 447, options [nop,nop,TS val 3222510 ecr 2993373,mptcp dss ack 2168003474], length 0
11:44:54.722184 IP 112.26.2.1.38151 > 112.26.2.8.41433: Flags [.], ack 1, win 447, options [nop,nop,TS val 3222510 ecr 2993373,mptcp dss ack 2168003474], length 0
11:44:54.738176 IP 112.26.2.1.38151 > 112.26.2.8.41433: Flags [.], seq 1:1429, ack 1, win 447, options [nop,nop,TS val 3222510 ecr 2993373,mptcp dss ack 2168003474 seq 1134418653 subseq 1 len 1428 csum 0x2b89], length 1428
11:44:54.819597 IP 112.26.2.1.38151 > 112.26.2.8.41433: Flags [.], seq 1429:2857, ack 1, win 447, options [nop,nop,TS val 3222511 ecr 2993373,mptcp dss ack 2168003474 seq 1134420081 subseq 1429 len 1428 csum 0xe484], length 1428
11:44:54.902133 IP 112.26.2.1.38151 > 112.26.2.8.41433: Flags [.], seq 1:1429, ack 1, win 447, options [nop,nop,TS val 3222510 ecr 2993373,mptcp dss ack 2168003474 seq 1134418653 subseq 1 len 1428 csum 0x2b89], length 1428
11:44:54.960064 IP 112.26.2.1.38151 > 112.26.2.8.41433: Flags [.], seq 2857:4285, ack 1, win 447, options [nop,nop,TS val 3222512 ecr 2993373,mptcp dss ack 2168003474 seq 1134421509 subseq 2857 len 1428 csum 0x2e9d], length 1428
11:44:55.025663 IP 112.26.2.1.38151 > 112.26.2.8.41433: Flags [.], seq 4285:5713, ack 1, win 447, options [nop,nop,TS val 3222513 ecr 2993373,mptcp dss ack 2168003474 seq 1134422937 subseq 4285 len 1428 csum 0x3387], length 1428
11:44:55.078422 IP 112.26.2.8.41433 > 112.26.2.1.38151: Flags [.], ack 1429, win 7118, options [nop,nop,TS val 2993679 ecr 3222510,mptcp dss ack 1134415797], length 0
11:44:55.105079 IP 112.26.2.1.38151 > 112.26.2.8.41433: Flags [.], seq 1429:2857, ack 1, win 447, options [nop,nop,TS val 3222511 ecr 2993373,mptcp dss ack 2168003474 seq 1134420081 subseq 1429 len 1428 csum 0xe484], length 1428
11:44:55.170278 IP 112.26.2.1.38151 > 112.26.2.8.41433: Flags [.], seq 5713:7141, ack 1, win 447, options [nop,nop,TS val 3222513 ecr 2993373,mptcp dss ack 2168003474 seq 1134424365 subseq 5713 len 1428 csum 0xfec1], length 1428
11:44:55.232821 IP 112.26.2.8.41433 > 112.26.2.1.38151: Flags [.], ack 2857, win 7300, options [nop,nop,TS val 2993857 ecr 3222511,mptcp dss ack 1134417225], length 0
11:44:55.269674 IP 112.26.2.1.38151 > 112.26.2.8.41433: Flags [.], seq 12853:14281, ack 1, win 893, options [nop,nop,TS val 3222792 ecr 2993373,mptcp dss ack 2168003474 seq 1134431505 subseq 12853 len 1428 csum 0xf68f], length 1428
11:44:55.407250 IP 112.26.2.8.41433 > 112.26.2.1.38151: Flags [.], ack 4285, win 7529, options [nop,nop,TS val 2994145 ecr 3222512,mptcp dss ack 1134422937], length 0
11:44:55.415570 IP 112.26.2.1.38151 > 112.26.2.8.41433: Flags [.], seq 14281:15709, ack 1, win 893, options [nop,nop,TS val 3222941 ecr 2993679,mptcp dss ack 2168003474 seq 1134464349 subseq 14281 len 1428 csum 0xfc0a], length 1428
11:44:55.489336 IP 112.26.2.1.38151 > 112.26.2.8.41433: Flags [.], seq 15709:17137, ack 1, win 893, options [nop,nop,TS val 3223095 ecr 2993857,mptcp dss ack 2168003474 seq 1134468633 subseq 15709 len 1428 csum 0xb0ce], length 1428
11:44:55.556655 IP 112.26.2.1.38151 > 112.26.2.8.41433: Flags [.], seq 4285:5713, ack 1, win 447, options [nop,nop,TS val 3222513 ecr 2993373,mptcp dss ack 2168003474 seq 1134422937 subseq 4285 len 1428 csum 0x3387], length 1428
11:44:55.607600 IP 112.26.2.1.38151 > 112.26.2.8.41433: Flags [.], seq 17137:18565, ack 1, win 893, options [nop,nop,TS val 3223269 ecr 2994145,mptcp dss ack 2168003474 seq 1134477201 subseq 17137 len 1428 csum 0xdfa1], length 1428
11:44:55.686196 IP 112.26.2.8.41433 > 112.26.2.1.38151: Flags [.], ack 5713, win 7757, options [nop,nop,TS val 2994333 ecr 3222513,mptcp dss ack 1134424365], length 0
11:44:55.692266 IP 112.26.2.1.38151 > 112.26.2.8.41433: Flags [.], seq 18565:19993, ack 1, win 893, options [nop,nop,TS val 3223549 ecr 2994333,mptcp dss ack 2168003474 seq 1134488625 subseq 18565 len 1428 csum 0x8188], length 1428
11:44:55.755295 IP 112.26.2.1.38151 > 112.26.2.8.41433: Flags [.], seq 12853:14281, ack 1, win 893, options [nop,nop,TS val 3222792 ecr 2993373,mptcp dss ack 2168003474 seq 1134431505 subseq 12853 len 1428 csum 0xf68f], length 1428
11:44:55.856330 IP 112.26.2.8.41433 > 112.26.2.1.38151: Flags [.], ack 5713, win 7985, options [nop,nop,TS val 2994532 ecr 3222513,nop,nop,sack 1 {12853:14281},mptcp dss ack 1134424365], length 0
11:44:55.861522 IP 112.26.2.1.38151 > 112.26.2.8.41433: Flags [.], seq 5713:7141, ack 1, win 893, options [nop,nop,TS val 3223719 ecr 2994532,mptcp dss ack 2168003474 seq 1134424365 subseq 5713 len 1428 csum 0xfec1], length 1428
11:44:55.976760 IP 112.26.2.1.38151 > 112.26.2.8.41433: Flags [.], seq 14281:15709, ack 1, win 893, options [nop,nop,TS val 3222941 ecr 2993679,mptcp dss ack 2168003474 seq 1134464349 subseq 14281 len 1428 csum 0xfc0a], length 1428
11:44:56.021449 IP 112.26.2.8.41433 > 112.26.2.1.38151: Flags [.], ack 5713, win 8213, options [nop,nop,TS val 2994741 ecr 3222513,nop,nop,sack 1 {12853:15709},mptcp dss ack 1134424365], length 0
11:44:56.025912 IP 112.26.2.1.38151 > 112.26.2.8.41433: Flags [.], seq 7141:8569, ack 1, win 893, options [nop,nop,TS val 3223884 ecr 2994741,mptcp dss ack 2168003474 seq 1134425793 subseq 7141 len 1428 csum 0x264e], length 1428
11:44:56.119727 IP 112.26.2.1.38151 > 112.26.2.8.41433: Flags [.], seq 17137:18565, ack 1, win 893, options [nop,nop,TS val 3223269 ecr 2994145,mptcp dss ack 2168003474 seq 1134477201 subseq 17137 len 1428 csum 0xdfa1], length 1428
11:44:56.189087 IP 112.26.2.8.41433 > 112.26.2.1.38151: Flags [.], ack 5713, win 8441, options [nop,nop,TS val 2994877 ecr 3222513,nop,nop,sack 2 {17137:18565}{12853:15709},mptcp dss ack 1134424365], length 0
11:44:56.204804 IP 112.26.2.1.38151 > 112.26.2.8.41433: Flags [P.], seq 8569:9997, ack 1, win 893, options [nop,nop,TS val 3224052 ecr 2994877,mptcp dss ack 2168003474 seq 1134427221 subseq 8569 len 1428 csum 0xba20], length 1428
11:44:56.293975 IP 112.26.2.1.38151 > 112.26.2.8.41433: Flags [.], seq 5713:7141, ack 1, win 893, options [nop,nop,TS val 3223719 ecr 2994532,mptcp dss ack 2168003474 seq 1134424365 subseq 5713 len 1428 csum 0xfec1], length 1428
11:44:56.390885 IP 112.26.2.8.41433 > 112.26.2.1.38151: Flags [.], ack 7141, win 8624, options [nop,nop,TS val 2995070 ecr 3223719,nop,nop,sack 2 {17137:18565}{12853:15709},mptcp dss ack 1134425793], length 0
11:44:56.398992 IP 112.26.2.1.38151 > 112.26.2.8.41433: Flags [.], seq 9997:11425, ack 1, win 893, options [nop,nop,TS val 3224253 ecr 2995070,mptcp dss ack 2168003474 seq 1134428649 subseq 9997 len 1428 csum 0x4303], length 1428
11:44:56.463726 IP 112.26.2.1.38151 > 112.26.2.8.41433: Flags [.], seq 7141:8569, ack 1, win 893, options [nop,nop,TS val 3223884 ecr 2994741,mptcp dss ack 2168003474 seq 1134425793 subseq 7141 len 1428 csum 0x264e], length 1428
11:44:56.521370 IP 112.26.2.1.38151 > 112.26.2.8.41433: Flags [.], seq 11425:12853, ack 1, win 893, options [nop,nop,TS val 3224253 ecr 2995070,mptcp dss ack 2168003474 seq 1134430077 subseq 11425 len 1428 csum 0x6473], length 1428
11:44:56.630523 IP 112.26.2.8.41433 > 112.26.2.1.38151: Flags [.], ack 8569, win 8852, options [nop,nop,TS val 2995240 ecr 3223884,nop,nop,sack 2 {17137:18565}{12853:15709},mptcp dss ack 1134427221], length 0
11:44:56.645012 IP 112.26.2.1.38151 > 112.26.2.8.41433: Flags [.], seq 15709:17137, ack 1, win 893, options [nop,nop,TS val 3224493 ecr 2995240,mptcp dss ack 2168003474 seq 1134468633 subseq 15709 len 1428 csum 0xb0ce], length 1428
11:44:56.736466 IP 112.26.2.1.38151 > 112.26.2.8.41433: Flags [.], seq 18565:19993, ack 1, win 893, options [nop,nop,TS val 3224493 ecr 2995240,mptcp dss ack 2168003474 seq 1134488625 subseq 18565 len 1428 csum 0x8188], length 1428
11:44:56.795673 IP 112.26.2.1.38151 > 112.26.2.8.41433: Flags [.], seq 9997:11425, ack 1, win 893, options [nop,nop,TS val 3224253 ecr 2995070,mptcp dss ack 2168003474 seq 1134428649 subseq 9997 len 1428 csum 0x4303], length 1428
11:44:56.817165 IP 112.26.2.8.41433 > 112.26.2.1.38151: Flags [.], ack 8569, win 9125, options [nop,nop,TS val 2995573 ecr 3223884,nop,nop,sack 2 {9997:11425}{17137:18565},mptcp dss ack 1134427221], length 0
11:44:56.887864 IP 112.26.2.1.38151 > 112.26.2.8.41433: Flags [P.], seq 8569:9997, ack 1, win 893, options [nop,nop,TS val 3224679 ecr 2995573,mptcp dss ack 2168003474 seq 1134427221 subseq 8569 len 1428 csum 0xba20], length 1428
11:44:56.917181 IP 112.26.2.1.38151 > 112.26.2.8.41433: Flags [.], seq 11425:12853, ack 1, win 893, options [nop,nop,TS val 3224253 ecr 2995070,mptcp dss ack 2168003474 seq 1134430077 subseq 11425 len 1428 csum 0x6473], length 1428
11:44:57.036166 IP 112.26.2.1.38151 > 112.26.2.8.41433: Flags [.], seq 15709:17137, ack 1, win 893, options [nop,nop,TS val 3224493 ecr 2995240,mptcp dss ack 2168003474 seq 1134468633 subseq 15709 len 1428 csum 0xb0ce], length 1428
11:44:57.087144 IP 112.26.2.8.41433 > 112.26.2.1.38151: Flags [.], ack 8569, win 9262, options [nop,nop,TS val 2995694 ecr 3223884,nop,nop,sack 2 {9997:15709}{17137:18565},mptcp dss ack 1134427221], length 0
11:44:57.140380 IP 112.26.2.1.38151 > 112.26.2.8.41433: Flags [.], seq 19993:21421, ack 1, win 893, options [nop,nop,TS val 3224997 ecr 2995694,mptcp dss ack 2168003474 seq 1134510045 subseq 19993 len 1428 csum 0x3769], length 1428
11:44:57.204764 IP 112.26.2.8.41433 > 112.26.2.1.38151: Flags [.], ack 8569, win 9445, options [nop,nop,TS val 2995813 ecr 3223884,nop,nop,sack 1 {9997:18565},mptcp dss ack 1134427221], length 0
11:44:57.227198 IP 112.26.2.1.38151 > 112.26.2.8.41433: Flags [.], seq 18565:19993, ack 1, win 893, options [nop,nop,TS val 3224493 ecr 2995240,mptcp dss ack 2168003474 seq 1134488625 subseq 18565 len 1428 csum 0x8188], length 1428
11:44:57.255965 IP 112.26.2.1.38151 > 112.26.2.8.41433: Flags [.], seq 21421:22849, ack 1, win 893, options [nop,nop,TS val 3225079 ecr 2995813,mptcp dss ack 2168003474 seq 1134512901 subseq 21421 len 1428 csum 0x9c], length 1428
11:44:57.322150 IP 112.26.2.8.41433 > 112.26.2.1.38151: Flags [.], ack 8569, win 9673, options [nop,nop,TS val 2995990 ecr 3223884,nop,nop,sack 1 {9997:19993},mptcp dss ack 1134427221], length 0
11:44:57.365484 IP 112.26.2.1.38151 > 112.26.2.8.41433: Flags [.], seq 22849:24277, ack 1, win 893, options [nop,nop,TS val 3225197 ecr 2995990,mptcp dss ack 2168003474 seq 1134514329 subseq 22849 len 1428 csum 0x8b87], length 1428
11:44:57.440490 IP 112.26.2.1.38151 > 112.26.2.8.41433: Flags [P.], seq 8569:9997, ack 1, win 893, options [nop,nop,TS val 3224679 ecr 2995573,mptcp dss ack 2168003474 seq 1134427221 subseq 8569 len 1428 csum 0xba20], length 1428
11:44:57.456274 IP 112.26.2.8.41433 > 112.26.2.1.38151: Flags [.], ack 19993, win 9810, options [nop,nop,TS val 2996135 ecr 3224679,mptcp dss ack 1134438645], length 0
11:44:57.486763 IP 112.26.2.1.38151 > 112.26.2.8.41433: Flags [.], seq 24277:25705, ack 1, win 893, options [nop,nop,TS val 3225319 ecr 2996135,mptcp dss ack 2168003474 seq 1134518613 subseq 24277 len 1428 csum 0x300b], length 1428
11:44:57.534685 IP 112.26.2.1.38151 > 112.26.2.8.41433: Flags [.], seq 19993:21421, ack 1, win 893, options [nop,nop,TS val 3224997 ecr 2995694,mptcp dss ack 2168003474 seq 1134510045 subseq 19993 len 1428 csum 0x3769], length 1428
11:44:57.601884 IP 112.26.2.1.38151 > 112.26.2.8.41433: Flags [.], seq 25705:27133, ack 1, win 893, options [nop,nop,TS val 3225319 ecr 2996135,mptcp dss ack 2168003474 seq 1134520041 subseq 25705 len 1428 csum 0xb901], length 1428
11:44:57.664384 IP 112.26.2.8.41433 > 112.26.2.1.38151: Flags [.], ack 21421, win 10038, options [nop,nop,TS val 2996305 ecr 3224997,mptcp dss ack 1134438645], length 0
11:44:57.690848 IP 112.26.2.1.38151 > 112.26.2.8.41433: Flags [.], seq 27133:28561, ack 1, win 893, options [nop,nop,TS val 3225319 ecr 2996135,mptcp dss ack 2168003474 seq 1134521469 subseq 27133 len 1428 csum 0x54c5], length 1428
11:44:57.730878 IP 112.26.2.1.38151 > 112.26.2.8.41433: Flags [.], seq 21421:22849, ack 1, win 893, options [nop,nop,TS val 3225079 ecr 2995813,mptcp dss ack 2168003474 seq 1134512901 subseq 21421 len 1428 csum 0x9c], length 1428
11:44:57.835486 IP 112.26.2.1.38151 > 112.26.2.8.41433: Flags [.], seq 28561:29989, ack 1, win 893, options [nop,nop,TS val 3225319 ecr 2996135,mptcp dss ack 2168003474 seq 1134522897 subseq 28561 len 1428 csum 0xfdbc], length 1428
11:44:57.866024 IP 112.26.2.1.38151 > 112.26.2.8.41433: Flags [.], seq 22849:24277, ack 1, win 893, options [nop,nop,TS val 3225197 ecr 2995990,mptcp dss ack 2168003474 seq 1134514329 subseq 22849 len 1428 csum 0x8b87], length 1428
11:44:57.944063 IP 112.26.2.1.38151 > 112.26.2.8.41433: Flags [.], seq 29989:31417, ack 1, win 893, options [nop,nop,TS val 3225527 ecr 2996305,mptcp dss ack 2168003474 seq 1134525753 subseq 29989 len 1428 csum 0xd41], length 1428
11:44:57.952960 IP 112.26.2.8.41433 > 112.26.2.1.38151: Flags [.], ack 22849, win 10175, options [nop,nop,TS val 2996502 ecr 3225079,mptcp dss ack 1134438645], length 0
11:44:58.021177 IP 112.26.2.1.38151 > 112.26.2.8.41433: Flags [.], seq 31417:32845, ack 1, win 893, options [nop,nop,TS val 3225527 ecr 2996305,mptcp dss ack 2168003474 seq 1134527181 subseq 31417 len 1428 csum 0xc7ae], length 1428
11:44:58.085428 IP 112.26.2.1.38151 > 112.26.2.8.41433: Flags [.], seq 25705:27133, ack 1, win 893, options [nop,nop,TS val 3225319 ecr 2996135,mptcp dss ack 2168003474 seq 1134520041 subseq 25705 len 1428 csum 0xb901], length 1428
11:44:58.131445 IP 112.26.2.8.41433 > 112.26.2.1.38151: Flags [.], ack 24277, win 10403, options [nop,nop,TS val 2996643 ecr 3225197,mptcp dss ack 1134438645], length 0
11:44:58.177581 IP 112.26.2.1.38151 > 112.26.2.8.41433: Flags [.], seq 32845:34273, ack 1, win 893, options [nop,nop,TS val 3225820 ecr 2996502,mptcp dss ack 2168003474 seq 1134531465 subseq 32845 len 1428 csum 0x8c1f], length 1428
11:44:58.210332 IP 112.26.2.8.41433 > 112.26.2.1.38151: Flags [.], ack 24277, win 10585, options [nop,nop,TS val 2996817 ecr 3225197,nop,nop,sack 1 {25705:27133},mptcp dss ack 1134438645], length 0
11:44:58.299456 IP 112.26.2.1.38151 > 112.26.2.8.41433: Flags [.], seq 28561:29989, ack 1, win 893, options [nop,nop,TS val 3225319 ecr 2996135,mptcp dss ack 2168003474 seq 1134522897 subseq 28561 len 1428 csum 0xfdbc], length 1428
11:44:58.344772 IP 112.26.2.1.38151 > 112.26.2.8.41433: Flags [.], seq 34273:35701, ack 1, win 893, options [nop,nop,TS val 3225994 ecr 2996643,mptcp dss ack 2168003474 seq 1134537177 subseq 34273 len 1428 csum 0x7d7], length 1428
11:44:58.349949 IP 112.26.2.8.41433 > 112.26.2.1.38151: Flags [.], ack 24277, win 10814, options [nop,nop,TS val 2997013 ecr 3225197,nop,nop,sack 2 {28561:29989}{25705:27133},mptcp dss ack 1134438645], length 0
11:44:58.373206 IP 112.26.2.1.38151 > 112.26.2.8.41433: Flags [.], seq 35701:37129, ack 1, win 893, options [nop,nop,TS val 3226085 ecr 2996817,mptcp dss ack 2168003474 seq 1134540033 subseq 35701 len 1428 csum 0xa9c2], length 1428
11:44:58.417957 IP 112.26.2.1.38151 > 112.26.2.8.41433: Flags [.], seq 29989:31417, ack 1, win 893, options [nop,nop,TS val 3225527 ecr 2996305,mptcp dss ack 2168003474 seq 1134525753 subseq 29989 len 1428 csum 0xd41], length 1428
11:44:58.511524 IP 112.26.2.1.38151 > 112.26.2.8.41433: Flags [.], seq 24277:25705, ack 1, win 893, options [nop,nop,TS val 3226213 ecr 2997013,mptcp dss ack 2168003474 seq 1134518613 subseq 24277 len 1428 csum 0x300b], length 1428
11:44:58.562795 IP 112.26.2.8.41433 > 112.26.2.1.38151: Flags [.], ack 24277, win 10996, options [nop,nop,TS val 2997194 ecr 3225197,nop,nop,sack 2 {28561:31417}{25705:27133},mptcp dss ack 1134518613], length 0
11:44:58.625667 IP 112.26.2.1.38151 > 112.26.2.8.41433: Flags [.], seq 32845:34273, ack 1, win 893, options [nop,nop,TS val 3225820 ecr 2996502,mptcp dss ack 2168003474 seq 1134531465 subseq 32845 len 1428 csum 0x8c1f], length 1428
11:44:58.651775 IP 112.26.2.8.41433 > 112.26.2.1.38151: Flags [.], ack 24277, win 11224, options [nop,nop,TS val 2997403 ecr 3225197,nop,nop,sack 2 {32845:34273}{28561:31417},mptcp dss ack 1134518613], length 0
11:44:58.656570 IP 112.26.2.1.38151 > 112.26.2.8.41433: Flags [.], seq 27133:28561, ack 1, win 893, options [nop,nop,TS val 3226514 ecr 2997403,mptcp dss ack 2168003474 seq 1134521469 subseq 27133 len 1428 csum 0x54c5], length 1428
11:44:58.765406 IP 112.26.2.1.38151 > 112.26.2.8.41433: Flags [.], seq 34273:35701, ack 1, win 893, options [nop,nop,TS val 3225994 ecr 2996643,mptcp dss ack 2168003474 seq 1134537177 subseq 34273 len 1428 csum 0x7d7], length 1428
11:44:58.778886 IP 112.26.2.8.41433 > 112.26.2.1.38151: Flags [.], ack 24277, win 11407, options [nop,nop,TS val 2997542 ecr 3225197,nop,nop,sack 2 {32845:35701}{28561:31417},mptcp dss ack 1134518613], length 0
11:44:58.815910 IP 112.26.2.1.38151 > 112.26.2.8.41433: Flags [.], seq 31417:32845, ack 1, win 893, options [nop,nop,TS val 3226642 ecr 2997542,mptcp dss ack 2168003474 seq 1134527181 subseq 31417 len 1428 csum 0xc7ae], length 1428
11:44:58.936878 IP 112.26.2.1.38151 > 112.26.2.8.41433: Flags [.], seq 24277:25705, ack 1, win 893, options [nop,nop,TS val 3226213 ecr 2997013,mptcp dss ack 2168003474 seq 1134518613 subseq 24277 len 1428 csum 0x300b], length 1428
11:44:58.987011 IP 112.26.2.8.41433 > 112.26.2.1.38151: Flags [.], ack 27133, win 11589, options [nop,nop,TS val 2997714 ecr 3226213,nop,nop,sack 2 {32845:35701}{28561:31417},mptcp dss ack 1134521469], length 0
11:44:58.990624 IP 112.26.2.1.38151 > 112.26.2.8.41433: Flags [.], seq 35701:37129, ack 1, win 893, options [nop,nop,TS val 3226850 ecr 2997714,mptcp dss ack 2168003474 seq 1134540033 subseq 35701 len 1428 csum 0xa9c2], length 1428
11:44:59.080549 IP 112.26.2.1.38151 > 112.26.2.8.41433: Flags [.], seq 37129:38557, ack 1, win 893, options [nop,nop,TS val 3226850 ecr 2997714,mptcp dss ack 2168003474 seq 1134570021 subseq 37129 len 1428 csum 0x50c2], length 1428
11:44:59.130967 IP 112.26.2.1.38151 > 112.26.2.8.41433: Flags [.], seq 27133:28561, ack 1, win 893, options [nop,nop,TS val 3226514 ecr 2997403,mptcp dss ack 2168003474 seq 1134521469 subseq 27133 len 1428 csum 0x54c5], length 1428
11:44:59.149395 IP 112.26.2.8.41433 > 112.26.2.1.38151: Flags [.], ack 31417, win 11817, options [nop,nop,TS val 2997908 ecr 3226514,nop,nop,sack 1 {32845:35701},mptcp dss ack 1134527181], length 0
11:44:59.203794 IP 112.26.2.1.38151 > 112.26.2.8.41433: Flags [.], seq 38557:39985, ack 1, win 893, options [nop,nop,TS val 3226850 ecr 2997714,mptcp dss ack 2168003474 seq 1134571449 subseq 38557 len 1428 csum 0x3a0e], length 1428
11:44:59.288150 IP 112.26.2.1.38151 > 112.26.2.8.41433: Flags [.], seq 39985:41413, ack 1, win 893, options [nop,nop,TS val 3227012 ecr 2997908,mptcp dss ack 2168003474 seq 1134575733 subseq 39985 len 1428 csum 0xee01], length 1428
11:44:59.353029 IP 112.26.2.1.38151 > 112.26.2.8.41433: Flags [.], seq 35701:37129, ack 1, win 893, options [nop,nop,TS val 3226850 ecr 2997714,mptcp dss ack 2168003474 seq 1134540033 subseq 35701 len 1428 csum 0xa9c2], length 1428
11:44:59.355103 IP 112.26.2.8.41433 > 112.26.2.1.38151: Flags [.], ack 31417, win 12091, options [nop,nop,TS val 2998115 ecr 3226514,nop,nop,sack 1 {32845:37129},mptcp dss ack 1134527181], length 0
11:44:59.454383 IP 112.26.2.1.38151 > 112.26.2.8.41433: Flags [.], seq 31417:32845, ack 1, win 893, options [nop,nop,TS val 3227218 ecr 2998115,mptcp dss ack 2168003474 seq 1134527181 subseq 31417 len 1428 csum 0xc7ae], length 1428
11:44:59.516531 IP 112.26.2.1.38151 > 112.26.2.8.41433: Flags [.], seq 37129:38557, ack 1, win 893, options [nop,nop,TS val 3226850 ecr 2997714,mptcp dss ack 2168003474 seq 1134570021 subseq 37129 len 1428 csum 0x50c2], length 1428
11:44:59.546629 IP 112.26.2.8.41433 > 112.26.2.1.38151: Flags [.], ack 31417, win 12319, options [nop,nop,TS val 2998294 ecr 3226514,nop,nop,sack 1 {32845:38557},mptcp dss ack 1134527181], length 0
11:44:59.573534 IP 112.26.2.1.38151 > 112.26.2.8.41433: Flags [.], seq 41413:42841, ack 1, win 893, options [nop,nop,TS val 3227430 ecr 2998294,mptcp dss ack 2168003474 seq 1134591441 subseq 41413 len 1428 csum 0xa51d], length 1428
11:44:59.673105 IP 112.26.2.1.38151 > 112.26.2.8.41433: Flags [.], seq 38557:39985, ack 1, win 893, options [nop,nop,TS val 3226850 ecr 2997714,mptcp dss ack 2168003474 seq 1134571449 subseq 38557 len 1428 csum 0x3a0e], length 1428
11:44:59.803914 IP 112.26.2.8.41433 > 112.26.2.1.38151: Flags [.], ack 31417, win 12547, options [nop,nop,TS val 2998450 ecr 3226514,nop,nop,sack 1 {32845:39985},mptcp dss ack 1134527181], length 0
11:44:59.852000 IP 112.26.2.1.38151 > 112.26.2.8.41433: Flags [.], seq 31417:32845, ack 1, win 893, options [nop,nop,TS val 3227218 ecr 2998115,mptcp dss ack 2168003474 seq 1134527181 subseq 31417 len 1428 csum 0xc7ae], length 1428
11:44:59.886098 IP 112.26.2.1.38151 > 112.26.2.8.41433: Flags [.], seq 42841:44269, ack 1, win 893, options [nop,nop,TS val 3227733 ecr 2998450,mptcp dss ack 2168003474 seq 1134602865 subseq 42841 len 1428 csum 0xe9b7], length 1428
11:44:59.983672 IP 112.26.2.8.41433 > 112.26.2.1.38151: Flags [.], ack 39985, win 12730, options [nop,nop,TS val 2998629 ecr 3227218,mptcp dss ack 1134552885], length 0
11:45:00.041207 IP 112.26.2.1.38151 > 112.26.2.8.41433: Flags [.], seq 44269:45697, ack 1, win 893, options [nop,nop,TS val 3227846 ecr 2998629,mptcp dss ack 2168003474 seq 1134607149 subseq 44269 len 1428 csum 0xbcbb], length 1428
11:45:00.071741 IP 112.26.2.1.38151 > 112.26.2.8.41433: Flags [.], seq 41413:42841, ack 1, win 893, options [nop,nop,TS val 3227430 ecr 2998294,mptcp dss ack 2168003474 seq 1134591441 subseq 41413 len 1428 csum 0xa51d], length 1428
11:45:00.088413 IP 112.26.2.8.41433 > 112.26.2.1.38151: Flags [.], ack 39985, win 12912, options [nop,nop,TS val 2998836 ecr 3227218,nop,nop,sack 1 {41413:42841},mptcp dss ack 1134552885], length 0
11:45:00.137337 IP 112.26.2.1.38151 > 112.26.2.8.41433: Flags [.], seq 45697:47125, ack 1, win 893, options [nop,nop,TS val 3227846 ecr 2998629,mptcp dss ack 2168003474 seq 1134608577 subseq 45697 len 1428 csum 0xf813], length 1428
11:45:00.211590 IP 112.26.2.1.38151 > 112.26.2.8.41433: Flags [.], seq 47125:48553, ack 1, win 893, options [nop,nop,TS val 3227998 ecr 2998836,mptcp dss ack 2168003474 seq 1134611433 subseq 47125 len 1428 csum 0x4e9f], length 1428
11:45:00.314755 IP 112.26.2.1.38151 > 112.26.2.8.41433: Flags [.], seq 42841:44269, ack 1, win 893, options [nop,nop,TS val 3227733 ecr 2998450,mptcp dss ack 2168003474 seq 1134602865 subseq 42841 len 1428 csum 0xe9b7], length 1428
11:45:00.417757 IP 112.26.2.8.41433 > 112.26.2.1.38151: Flags [.], ack 39985, win 13232, options [nop,nop,TS val 2999092 ecr 3227218,nop,nop,sack 1 {41413:44269},mptcp dss ack 1134552885], length 0
11:45:00.462857 IP 112.26.2.1.38151 > 112.26.2.8.41433: Flags [.], seq 48553:49981, ack 1, win 893, options [nop,nop,TS val 3228293 ecr 2999092,mptcp dss ack 2168003474 seq 1134617145 subseq 48553 len 1428 csum 0xe02e], length 1428
11:45:00.515457 IP 112.26.2.1.38151 > 112.26.2.8.41433: Flags [.], seq 44269:45697, ack 1, win 893, options [nop,nop,TS val 3227846 ecr 2998629,mptcp dss ack 2168003474 seq 1134607149 subseq 44269 len 1428 csum 0xbcbb], length 1428
11:45:00.622618 IP 112.26.2.8.41433 > 112.26.2.1.38151: Flags [.], ack 39985, win 13414, options [nop,nop,TS val 2999283 ecr 3227218,nop,nop,sack 1 {41413:45697},mptcp dss ack 1134552885], length 0
11:45:00.631718 IP 112.26.2.1.38151 > 112.26.2.8.41433: Flags [.], seq 39985:41413, ack 1, win 893, options [nop,nop,TS val 3228485 ecr 2999283,mptcp dss ack 2168003474 seq 1134575733 subseq 39985 len 1428 csum 0xee01], length 1428
11:45:00.714019 IP 112.26.2.1.38151 > 112.26.2.8.41433: Flags [.], seq 47125:48553, ack 1, win 893, options [nop,nop,TS val 3227998 ecr 2998836,mptcp dss ack 2168003474 seq 1134611433 subseq 47125 len 1428 csum 0x4e9f], length 1428
11:45:00.765839 IP 112.26.2.8.41433 > 112.26.2.1.38151: Flags [.], ack 39985, win 13688, options [nop,nop,TS val 2999491 ecr 3227218,nop,nop,sack 2 {47125:48553}{41413:45697},mptcp dss ack 1134561453], length 0
11:45:00.773342 IP 112.26.2.1.38151 > 112.26.2.8.41433: Flags [.], seq 45697:47125, ack 1, win 893, options [nop,nop,TS val 3228629 ecr 2999491,mptcp dss ack 2168003474 seq 1134608577 subseq 45697 len 1428 csum 0xf813], length 1428
11:45:00.857070 IP 112.26.2.1.38151 > 112.26.2.8.41433: Flags [.], seq 48553:49981, ack 1, win 893, options [nop,nop,TS val 3228293 ecr 2999092,mptcp dss ack 2168003474 seq 1134617145 subseq 48553 len 1428 csum 0xe02e], length 1428
11:45:00.964250 IP 112.26.2.8.41433 > 112.26.2.1.38151: Flags [.], ack 39985, win 13870, options [nop,nop,TS val 2999634 ecr 3227218,nop,nop,sack 2 {47125:49981}{41413:45697},mptcp dss ack 1134575733], length 0
11:45:00.980700 IP 112.26.2.1.38151 > 112.26.2.8.41433: Flags [.], seq 49981:51409, ack 1, win 893, options [nop,nop,TS val 3228829 ecr 2999634,mptcp dss ack 2168003474 seq 1134639993 subseq 49981 len 1428 csum 0xb660], length 1428
11:45:01.060000 IP 112.26.2.1.38151 > 112.26.2.8.41433: Flags [.], seq 39985:41413, ack 1, win 893, options [nop,nop,TS val 3228485 ecr 2999283,mptcp dss ack 2168003474 seq 1134575733 subseq 39985 len 1428 csum 0xee01], length 1428
11:45:01.121816 IP 112.26.2.8.41433 > 112.26.2.1.38151: Flags [.], ack 45697, win 14099, options [nop,nop,TS val 2999836 ecr 3228485,nop,nop,sack 1 {47125:49981},mptcp dss ack 1134580017], length 0
11:45:01.129239 IP 112.26.2.1.38151 > 112.26.2.8.41433: Flags [.], seq 51409:52837, ack 1, win 893, options [nop,nop,TS val 3228984 ecr 2999836,mptcp dss ack 2168003474 seq 1134648561 subseq 51409 len 1428 csum 0xd6b6], length 1428
11:45:01.265143 IP 112.26.2.1.38151 > 112.26.2.8.41433: Flags [.], seq 45697:47125, ack 1, win 893, options [nop,nop,TS val 3228629 ecr 2999491,mptcp dss ack 2168003474 seq 1134608577 subseq 45697 len 1428 csum 0xf813], length 1428
11:45:01.273516 IP 112.26.2.8.41433 > 112.26.2.1.38151: Flags [.], ack 49981, win 14281, options [nop,nop,TS val 3000042 ecr 3228629,mptcp dss ack 1134580017], length 0
11:45:01.313171 IP 112.26.2.1.38151 > 112.26.2.8.41433: Flags [.], seq 52837:54265, ack 1, win 893, options [nop,nop,TS val 3229136 ecr 3000042,mptcp dss ack 2168003474 seq 1134654273 subseq 52837 len 1428 csum 0x7909], length 1428
11:45:01.432422 IP 112.26.2.1.38151 > 112.26.2.8.41433: Flags [.], seq 49981:51409, ack 1, win 893, options [nop,nop,TS val 3228829 ecr 2999634,mptcp dss ack 2168003474 seq 1134639993 subseq 49981 len 1428 csum 0xb660], length 1428
11:45:01.459032 IP 112.26.2.8.41433 > 112.26.2.1.38151: Flags [.], ack 51409, win 14509, options [nop,nop,TS val 3000209 ecr 3228829,mptcp dss ack 1134580017], length 0
11:45:01.464939 IP 112.26.2.1.38151 > 112.26.2.8.41433: Flags [.], seq 54265:55693, ack 1, win 893, options [nop,nop,TS val 3229321 ecr 3000209,mptcp dss ack 2168003474 seq 1134658557 subseq 54265 len 1428 csum 0xf6f6], length 1428
11:45:01.567716 IP 112.26.2.1.38151 > 112.26.2.8.41433: Flags [.], seq 51409:52837, ack 1, win 893, options [nop,nop,TS val 3228984 ecr 2999836,mptcp dss ack 2168003474 seq 1134648561 subseq 51409 len 1428 csum 0xd6b6], length 1428
11:45:01.581493 IP 112.26.2.8.41433 > 112.26.2.1.38151: Flags [.], ack 52837, win 14692, options [nop,nop,TS val 3000344 ecr 3228984,mptcp dss ack 1134580017], length 0
11:45:01.629892 IP 112.26.2.1.38151 > 112.26.2.8.41433: Flags [.], seq 55693:57121, ack 1, win 893, options [nop,nop,TS val 3229444 ecr 3000344,mptcp dss ack 2168003474 seq 1134665697 subseq 55693 len 1428 csum 0x36d9], length 1428
11:45:01.733451 IP 112.26.2.1.38151 > 112.26.2.8.41433: Flags [.], seq 57121:58549, ack 1, win 893, options [nop,nop,TS val 3229444 ecr 3000344,mptcp dss ack 2168003474 seq 1134667125 subseq 57121 len 1428 csum 0x3011], length 1428
11:45:01.810226 IP 112.26.2.1.38151 > 112.26.2.8.41433: Flags [.], seq 52837:54265, ack 1, win 893, options [nop,nop,TS val 3229136 ecr 3000042,mptcp dss ack 2168003474 seq 1134654273 subseq 52837 len 1428 csum 0x7909], length 1428
11:45:01.854003 IP 112.26.2.8.41433 > 112.26.2.1.38151: Flags [.], ack 54265, win 14920, options [nop,nop,TS val 3000537 ecr 3229136,mptcp dss ack 1134580017], length 0
11:45:01.867373 IP 112.26.2.1.38151 > 112.26.2.8.41433: Flags [.], seq 58549:59977, ack 1, win 893, options [nop,nop,TS val 3229717 ecr 3000537,mptcp dss ack 2168003474 seq 1134678549 subseq 58549 len 1428 csum 0xa4e2], length 1428
11:45:01.900040 IP 112.26.2.1.38151 > 112.26.2.8.41433: Flags [.], seq 54265:55693, ack 1, win 893, options [nop,nop,TS val 3229321 ecr 3000209,mptcp dss ack 2168003474 seq 1134658557 subseq 54265 len 1428 csum 0xf6f6], length 1428
11:45:02.012793 IP 112.26.2.8.41433 > 112.26.2.1.38151: Flags [.], ack 55693, win 15057, options [nop,nop,TS val 3000677 ecr 3229321,mptcp dss ack 1134580017], length 0
11:45:02.023227 IP 112.26.2.1.38151 > 112.26.2.8.41433: Flags [.], seq 59977:61405, ack 1, win 893, options [nop,nop,TS val 3229875 ecr 3000677,mptcp dss ack 2168003474 seq 1134682833 subseq 59977 len 1428 csum 0xf3e9], length 1428
11:45:02.100435 IP 112.26.2.1.38151 > 112.26.2.8.41433: Flags [.], seq 55693:57121, ack 1, win 893, options [nop,nop,TS val 3229444 ecr 3000344,mptcp dss ack 2168003474 seq 1134665697 subseq 55693 len 1428 csum 0x36d9], length 1428
11:45:02.168903 IP 112.26.2.8.41433 > 112.26.2.1.38151: Flags [.], ack 57121, win 15285, options [nop,nop,TS val 3000844 ecr 3229444,mptcp dss ack 1134600009], length 0
11:45:02.175203 IP 112.26.2.1.38151 > 112.26.2.8.41433: Flags [.], seq 61405:62833, ack 1, win 893, options [nop,nop,TS val 3230031 ecr 3000844,mptcp dss ack 2168003474 seq 1134684261 subseq 61405 len 1428 csum 0xeff7], length 1428
11:45:02.266862 IP 112.26.2.1.38151 > 112.26.2.8.41433: Flags [.], seq 58549:59977, ack 1, win 893, options [nop,nop,TS val 3229717 ecr 3000537,mptcp dss ack 2168003474 seq 1134678549 subseq 58549 len 1428 csum 0xa4e2], length 1428
11:45:02.282900 IP 112.26.2.8.41433 > 112.26.2.1.38151: Flags [.], ack 57121, win 15467, options [nop,nop,TS val 3001044 ecr 3229444,nop,nop,sack 1 {58549:59977},mptcp dss ack 1134600009], length 0
11:45:02.374763 IP 112.26.2.1.38151 > 112.26.2.8.41433: Flags [.], seq 62833:64261, ack 1, win 893, options [nop,nop,TS val 3230224 ecr 3001044,mptcp dss ack 2168003474 seq 1134688545 subseq 62833 len 1428 csum 0xa7a0], length 1428
11:45:02.445266 IP 112.26.2.1.38151 > 112.26.2.8.41433: Flags [.], seq 59977:61405, ack 1, win 893, options [nop,nop,TS val 3229875 ecr 3000677,mptcp dss ack 2168003474 seq 1134682833 subseq 59977 len 1428 csum 0xf3e9], length 1428
11:45:02.452799 IP 112.26.2.8.41433 > 112.26.2.1.38151: Flags [.], ack 57121, win 15695, options [nop,nop,TS val 3001169 ecr 3229444,nop,nop,sack 1 {58549:61405},mptcp dss ack 1134600009], length 0
11:45:02.497352 IP 112.26.2.1.38151 > 112.26.2.8.41433: Flags [.], seq 64261:65689, ack 1, win 893, options [nop,nop,TS val 3230350 ecr 3001169,mptcp dss ack 2168003474 seq 1134691401 subseq 64261 len 1428 csum 0x95d], length 1428
11:45:02.600696 IP 112.26.2.1.38151 > 112.26.2.8.41433: Flags [.], seq 61405:62833, ack 1, win 893, options [nop,nop,TS val 3230031 ecr 3000844,mptcp dss ack 2168003474 seq 1134684261 subseq 61405 len 1428 csum 0xeff7], length 1428
11:45:02.602849 IP 112.26.2.8.41433 > 112.26.2.1.38151: Flags [.], ack 57121, win 15924, options [nop,nop,TS val 3001365 ecr 3229444,nop,nop,sack 1 {58549:62833},mptcp dss ack 1134600009], length 0
11:45:02.673960 IP 112.26.2.1.38151 > 112.26.2.8.41433: Flags [.], seq 57121:58549, ack 1, win 893, options [nop,nop,TS val 3230465 ecr 3001365,mptcp dss ack 2168003474 seq 1134667125 subseq 57121 len 1428 csum 0x3011], length 1428
11:45:02.766596 IP 112.26.2.1.38151 > 112.26.2.8.41433: Flags [.], seq 62833:64261, ack 1, win 893, options [nop,nop,TS val 3230224 ecr 3001044,mptcp dss ack 2168003474 seq 1134688545 subseq 62833 len 1428 csum 0xa7a0], length 1428
11:45:02.815203 IP 112.26.2.8.41433 > 112.26.2.1.38151: Flags [.], ack 57121, win 16106, options [nop,nop,TS val 3001540 ecr 3229444,nop,nop,sack 1 {58549:64261},mptcp dss ack 1134600009], length 0
11:45:02.917592 IP 112.26.2.1.38151 > 112.26.2.8.41433: Flags [.], seq 64261:65689, ack 1, win 893, options [nop,nop,TS val 3230350 ecr 3001169,mptcp dss ack 2168003474 seq 1134691401 subseq 64261 len 1428 csum 0x95d], length 1428
11:45:02.996440 IP 112.26.2.8.41433 > 112.26.2.1.38151: Flags [.], ack 57121, win 16289, options [nop,nop,TS val 3001694 ecr 3229444,nop,nop,sack 1 {58549:65689},mptcp dss ack 1134600009], length 0
11:45:03.028574 IP 112.26.2.1.38151 > 112.26.2.8.41433: Flags [.], seq 65689:67117, ack 1, win 893, options [nop,nop,TS val 3230878 ecr 3001694,mptcp dss ack 2168003474 seq 1134707109 subseq 65689 len 1428 csum 0x444a], length 1428
11:45:03.136258 IP 112.26.2.1.38151 > 112.26.2.8.41433: Flags [.], seq 57121:58549, ack 1, win 893, options [nop,nop,TS val 3230465 ecr 3001365,mptcp dss ack 2168003474 seq 1134667125 subseq 57121 len 1428 csum 0x3011], length 1428
11:45:03.185739 IP 112.26.2.1.38151 > 112.26.2.8.41433: Flags [.], seq 65689:67117, ack 1, win 893, options [nop,nop,TS val 3230878 ecr 3001694,mptcp dss ack 2168003474 seq 1134707109 subseq 65689 len 1428 csum 0x444a], length 1428
11:45:03.262518 IP 112.26.2.8.41433 > 112.26.2.1.38151: Flags [.], ack 65689, win 16517, options [nop,nop,TS val 3001844 ecr 3230465,mptcp dss ack 1134628569], length 0
11:45:03.271471 IP 112.26.2.1.38151 > 112.26.2.8.41433: Flags [.], seq 67117:68545, ack 1, win 893, options [nop,nop,TS val 3231125 ecr 3001844,mptcp dss ack 2168003474 seq 1134714249 subseq 67117 len 1428 csum 0x4fce], length 1428
11:45:03.378547 IP 112.26.2.1.38151 > 112.26.2.8.41433: Flags [.], seq 67117:68545, ack 1, win 893, options [nop,nop,TS val 3231125 ecr 3001844,mptcp dss ack 2168003474 seq 1134714249 subseq 67117 len 1428 csum 0x4fce], length 1428
11:45:03.408872 IP 112.26.2.8.41433 > 112.26.2.1.38151: Flags [.], ack 67117, win 16654, options [nop,nop,TS val 3001962 ecr 3230878,mptcp dss ack 1134628569], length 0
11:45:03.418084 IP 112.26.2.1.38151 > 112.26.2.8.41433: Flags [.], seq 68545:69973, ack 1, win 893, options [nop,nop,TS val 3231271 ecr 3001962,mptcp dss ack 2168003474 seq 1134718533 subseq 68545 len 1428 csum 0x6c43], length 1428
11:45:03.506624 IP 112.26.2.1.38151 > 112.26.2.8.41433: Flags [.], seq 69973:71401, ack 1, win 893, options [nop,nop,TS val 3231271 ecr 3001962,mptcp dss ack 2168003474 seq 1134719961 subseq 69973 len 1428 csum 0x315e], length 1428
11:45:03.589548 IP 112.26.2.1.38151 > 112.26.2.8.41433: Flags [.], seq 68545:69973, ack 1, win 893, options [nop,nop,TS val 3231271 ecr 3001962,mptcp dss ack 2168003474 seq 1134718533 subseq 68545 len 1428 csum 0x6c43], length 1428
11:45:03.671121 IP 112.26.2.8.41433 > 112.26.2.1.38151: Flags [.], ack 68545, win 16882, options [nop,nop,TS val 3002156 ecr 3231125,mptcp dss ack 1134628569], length 0
11:45:03.679902 IP 112.26.2.1.38151 > 112.26.2.8.41433: Flags [.], seq 71401:72829, ack 1, win 893, options [nop,nop,TS val 3231533 ecr 3002156,mptcp dss ack 2168003474 seq 1134731385 subseq 71401 len 1428 csum 0x83fa], length 1428
11:45:03.743303 IP 112.26.2.1.38151 > 112.26.2.8.41433: Flags [.], seq 69973:71401, ack 1, win 893, options [nop,nop,TS val 3231271 ecr 3001962,mptcp dss ack 2168003474 seq 1134719961 subseq 69973 len 1428 csum 0x315e], length 1428
11:45:03.829366 IP 112.26.2.8.41433 > 112.26.2.1.38151: Flags [.], ack 69973, win 17155, options [nop,nop,TS val 3002367 ecr 3231271,mptcp dss ack 1134628569], length 0
11:45:03.834940 IP 112.26.2.1.38151 > 112.26.2.8.41433: Flags [.], seq 72829:74257, ack 1, win 893, options [nop,nop,TS val 3231692 ecr 3002367,mptcp dss ack 2168003474 seq 1134738525 subseq 72829 len 1428 csum 0xc71e], length 1428
11:45:03.906069 IP 112.26.2.1.38151 > 112.26.2.8.41433: Flags [.], seq 71401:72829, ack 1, win 893, options [nop,nop,TS val 3231533 ecr 3002156,mptcp dss ack 2168003474 seq 1134731385 subseq 71401 len 1428 csum 0x83fa], length 1428
11:45:04.027933 IP 112.26.2.1.38151 > 112.26.2.8.41433: Flags [.], seq 72829:74257, ack 1, win 893, options [nop,nop,TS val 3231692 ecr 3002367,mptcp dss ack 2168003474 seq 1134738525 subseq 72829 len 1428 csum 0xc71e], length 1428
11:45:04.090371 IP 112.26.2.8.41433 > 112.26.2.1.38151: Flags [.], ack 71401, win 17384, options [nop,nop,TS val 3002520 ecr 3231271,mptcp dss ack 1134721389], length 0
11:45:04.110037 IP 112.26.2.1.38151 > 112.26.2.8.41433: Flags [.], seq 74257:75685, ack 1, win 893, options [nop,nop,TS val 3231953 ecr 3002520,mptcp dss ack 2168003474 seq 1134754233 subseq 74257 len 1428 csum 0xd0db], length 1428
11:45:04.194916 IP 112.26.2.1.38151 > 112.26.2.8.41433: Flags [.], seq 74257:75685, ack 1, win 893, options [nop,nop,TS val 3231953 ecr 3002520,mptcp dss ack 2168003474 seq 1134754233 subseq 74257 len 1428 csum 0xd0db], length 1428
11:45:04.252857 IP 112.26.2.1.38151 > 112.26.2.8.41433: Flags [.], seq 75685:77113, ack 1, win 893, options [nop,nop,TS val 3231953 ecr 3002520,mptcp dss ack 2168003474 seq 1134755661 subseq 75685 len 1428 csum 0xb9f2], length 1428
11:45:04.296342 IP 112.26.2.8.41433 > 112.26.2.1.38151: Flags [.], ack 72829, win 17566, options [nop,nop,TS val 3002683 ecr 3231533,mptcp dss ack 1134722817], length 0
11:45:04.307894 IP 112.26.2.1.38151 > 112.26.2.8.41433: Flags [.], seq 77113:78541, ack 1, win 893, options [nop,nop,TS val 3232159 ecr 3002683,mptcp dss ack 2168003474 seq 1134761373 subseq 77113 len 1428 csum 0x83d5], length 1428
11:45:04.389469 IP 112.26.2.1.38151 > 112.26.2.8.41433: Flags [.], seq 75685:77113, ack 1, win 893, options [nop,nop,TS val 3231953 ecr 3002520,mptcp dss ack 2168003474 seq 1134755661 subseq 75685 len 1428 csum 0xb9f2], length 1428
11:45:04.509066 IP 112.26.2.8.41433 > 112.26.2.1.38151: Flags [.], ack 74257, win 17703, options [nop,nop,TS val 3002805 ecr 3231692,mptcp dss ack 1134727101], length 0
11:45:04.586702 IP 112.26.2.1.38151 > 112.26.2.8.41433: Flags [.], seq 77113:78541, ack 1, win 893, options [nop,nop,TS val 3232159 ecr 3002683,mptcp dss ack 2168003474 seq 1134761373 subseq 77113 len 1428 csum 0x83d5], length 1428
11:45:04.591912 IP 112.26.2.1.38151 > 112.26.2.8.41433: Flags [.], seq 78541:79969, ack 1, win 893, options [nop,nop,TS val 3232371 ecr 3002805,mptcp dss ack 2168003474 seq 1134771369 subseq 78541 len 1428 csum 0x1a27], length 1428
11:45:04.686388 IP 112.26.2.1.38151 > 112.26.2.8.41433: Flags [.], seq 78541:79969, ack 1, win 893, options [nop,nop,TS val 3232371 ecr 3002805,mptcp dss ack 2168003474 seq 1134771369 subseq 78541 len 1428 csum 0x1a27], length 1428
11:45:04.748798 IP 112.26.2.8.41433 > 112.26.2.1.38151: Flags [.], ack 77113, win 18159, options [nop,nop,TS val 3003166 ecr 3231953,mptcp dss ack 1134741381], length 0
11:45:04.759636 IP 112.26.2.1.38151 > 112.26.2.8.41433: Flags [.], seq 79969:81397, ack 1, win 893, options [nop,nop,TS val 3232611 ecr 3003166,mptcp dss ack 2168003474 seq 1134782793 subseq 79969 len 1428 csum 0x5fe9], length 1428
