15:11:18.704457 IP 112.26.1.8.38393 > 112.26.1.1.34615: Flags [S], seq 3475975781, win 65535, options [mss 1460,sackOK,TS val 2881078 ecr 0,nop,wscale 6,mptcp join id 3 token 0x7761ebfe nonce 0x5f4b76c8], length 0
15:11:18.707931 IP 112.26.1.8.38393 > 112.26.1.1.34615: Flags [S], seq 3475975781, win 65535, options [mss 1460,sackOK,TS val 2881078 ecr 0,nop,wscale 6,mptcp join id 3 token 0x7761ebfe nonce 0x5f4b76c8], length 0
15:11:18.734704 IP 112.26.1.8.38393 > 112.26.1.1.34615: Flags [S], seq 3475975781, win 65535, options [mss 1460,sackOK,TS val 2881078 ecr 0,nop,wscale 6,mptcp join id 3 token 0x7761ebfe nonce 0x5f4b76c8], length 0
15:11:18.790690 IP 112.26.1.1.34615 > 112.26.1.8.38393: Flags [S.], seq 67390057, ack 3475975782, win 65535, options [mss 1460,sackOK,TS val 3119171 ecr 2881078,nop,wscale 6,mptcp join id 6 hmac 0x5eef369b1b5052f8 nonce 0x44bb49f2], length 0
15:11:18.792539 IP 112.26.1.1.34615 > 112.26.1.8.38393: Flags [S.], seq 67390057, ack 3475975782, win 65535, options [mss 1460,sackOK,TS val 3119171 ecr 2881078,nop,wscale 6,mptcp join id 6 hmac 0x5eef369b1b5052f8 nonce 0x44bb49f2], length 0
15:11:18.797247 IP 112.26.1.8.38393 > 112.26.1.1.34615: Flags [.], ack 1, win 5567, options [nop,nop,TS val 2881177 ecr 3119171,mptcp join hmac 0xfa882c67f6be83c03803eec44ba866ef50b76129], length 0
15:11:18.926706 IP 112.26.1.8.38393 > 112.26.1.1.34615: Flags [.], ack 1, win 5567, options [nop,nop,TS val 2881177 ecr 3119171,mptcp join hmac 0xfa882c67f6be83c03803eec44ba866ef50b76129], length 0
15:11:18.929856 IP 112.26.1.8.38393 > 112.26.1.1.34615: Flags [.], ack 1, win 5567, options [nop,nop,TS val 2881177 ecr 3119171,mptcp join hmac 0xfa882c67f6be83c03803eec44ba866ef50b76129], length 0
15:11:18.937027 IP 112.26.1.1.34615 > 112.26.1.8.38393: Flags [.], ack 1, win 2678, options [nop,nop,TS val 3119384 ecr 2881177,mptcp dss ack 3193170700], length 0
15:11:19.005103 IP 112.26.1.1.34615 > 112.26.1.8.38393: Flags [.], ack 1, win 2678, options [nop,nop,TS val 3119384 ecr 2881177,mptcp dss ack 3193170700], length 0
15:11:19.117926 IP 112.26.1.1.34615 > 112.26.1.8.38393: Flags [.], seq 1:1429, ack 1, win 2678, options [nop,nop,TS val 3119384 ecr 2881177,mptcp dss ack 3193170700 seq 2058730907 subseq 1 len 1428 csum 0x44aa], length 1428
15:11:19.122882 IP 112.26.1.1.34615 > 112.26.1.8.38393: Flags [.], seq 1:1429, ack 1, win 2678, options [nop,nop,TS val 3119384 ecr 2881177,mptcp dss ack 3193170700 seq 2058730907 subseq 1 len 1428 csum 0x44aa], length 1428
15:11:19.141453 IP 112.26.1.8.38393 > 112.26.1.1.34615: Flags [.], ack 1429, win 7118, options [nop,nop,TS val 2881508 ecr 3119384,mptcp dss ack 2058722339], length 0
15:11:19.202120 IP 112.26.1.8.38393 > 112.26.1.1.34615: Flags [.], ack 1429, win 7118, options [nop,nop,TS val 2881508 ecr 3119384,mptcp dss ack 2058722339], length 0
15:11:19.204412 IP 112.26.1.8.38393 > 112.26.1.1.34615: Flags [.], ack 1429, win 7118, options [nop,nop,TS val 2881508 ecr 3119384,mptcp dss ack 2058722339], length 0
15:11:19.248197 IP 112.26.1.1.34615 > 112.26.1.8.38393: Flags [.], seq 1429:2857, ack 1, win 2678, options [nop,nop,TS val 3119384 ecr 2881177,mptcp dss ack 3193170700 seq 2058732335 subseq 1429 len 1428 csum 0xd87c], length 1428
15:11:19.296343 IP 112.26.1.1.34615 > 112.26.1.8.38393: Flags [.], seq 1429:2857, ack 1, win 2678, options [nop,nop,TS val 3119384 ecr 2881177,mptcp dss ack 3193170700 seq 2058732335 subseq 1429 len 1428 csum 0xd87c], length 1428
15:11:19.297890 IP 112.26.1.8.38393 > 112.26.1.1.34615: Flags [.], ack 2857, win 7255, options [nop,nop,TS val 2881681 ecr 3119384,mptcp dss ack 2058722339], length 0
15:11:19.365814 IP 112.26.1.8.38393 > 112.26.1.1.34615: Flags [.], ack 2857, win 7255, options [nop,nop,TS val 2881681 ecr 3119384,mptcp dss ack 2058722339], length 0
15:11:19.370339 IP 112.26.1.8.38393 > 112.26.1.1.34615: Flags [.], ack 2857, win 7255, options [nop,nop,TS val 2881681 ecr 3119384,mptcp dss ack 2058722339], length 0
15:11:19.388079 IP 112.26.1.1.34615 > 112.26.1.8.38393: Flags [.], seq 2857:4285, ack 1, win 2678, options [nop,nop,TS val 3119384 ecr 2881177,mptcp dss ack 3193170700 seq 2058733763 subseq 2857 len 1428 csum 0x615f], length 1428
15:11:19.413185 IP 112.26.1.1.34615 > 112.26.1.8.38393: Flags [.], seq 2857:4285, ack 1, win 2678, options [nop,nop,TS val 3119384 ecr 2881177,mptcp dss ack 3193170700 seq 2058733763 subseq 2857 len 1428 csum 0x615f], length 1428
15:11:19.415013 IP 112.26.1.8.38393 > 112.26.1.1.34615: Flags [.], ack 4285, win 7392, options [nop,nop,TS val 2881798 ecr 3119384,mptcp dss ack 2058722339], length 0
15:11:19.509265 IP 112.26.1.8.38393 > 112.26.1.1.34615: Flags [.], ack 4285, win 7392, options [nop,nop,TS val 2881798 ecr 3119384,mptcp dss ack 2058722339], length 0
15:11:19.511252 IP 112.26.1.8.38393 > 112.26.1.1.34615: Flags [.], ack 4285, win 7392, options [nop,nop,TS val 2881798 ecr 3119384,mptcp dss ack 2058722339], length 0
15:11:19.571515 IP 112.26.1.1.34615 > 112.26.1.8.38393: Flags [.], seq 4285:5713, ack 1, win 2678, options [nop,nop,TS val 3119384 ecr 2881177,mptcp dss ack 3193170700 seq 2058735191 subseq 4285 len 1428 csum 0x82cf], length 1428
15:11:19.575456 IP 112.26.1.1.34615 > 112.26.1.8.38393: Flags [.], seq 4285:5713, ack 1, win 2678, options [nop,nop,TS val 3119384 ecr 2881177,mptcp dss ack 3193170700 seq 2058735191 subseq 4285 len 1428 csum 0x82cf], length 1428
15:11:19.580988 IP 112.26.1.8.38393 > 112.26.1.1.34615: Flags [.], ack 5713, win 7574, options [nop,nop,TS val 2881960 ecr 3119384,mptcp dss ack 2058722339], length 0
15:11:19.628125 IP 112.26.1.8.38393 > 112.26.1.1.34615: Flags [.], ack 5713, win 7574, options [nop,nop,TS val 2881960 ecr 3119384,mptcp dss ack 2058722339], length 0
15:11:19.633283 IP 112.26.1.8.38393 > 112.26.1.1.34615: Flags [.], ack 5713, win 7574, options [nop,nop,TS val 2881960 ecr 3119384,mptcp dss ack 2058722339], length 0
15:11:19.690373 IP 112.26.1.1.34615 > 112.26.1.8.38393: Flags [.], seq 5713:7141, ack 1, win 2678, options [nop,nop,TS val 3119384 ecr 2881177,mptcp dss ack 3193170700 seq 2058736619 subseq 5713 len 1428 csum 0x14ec], length 1428
15:11:19.693009 IP 112.26.1.1.34615 > 112.26.1.8.38393: Flags [.], seq 5713:7141, ack 1, win 2678, options [nop,nop,TS val 3119384 ecr 2881177,mptcp dss ack 3193170700 seq 2058736619 subseq 5713 len 1428 csum 0x14ec], length 1428
15:11:19.695860 IP 112.26.1.8.38393 > 112.26.1.1.34615: Flags [.], ack 7141, win 7665, options [nop,nop,TS val 2882078 ecr 3119384,mptcp dss ack 2058722339], length 0
15:11:19.775224 IP 112.26.1.8.38393 > 112.26.1.1.34615: Flags [.], ack 7141, win 7665, options [nop,nop,TS val 2882078 ecr 3119384,mptcp dss ack 2058722339], length 0
15:11:19.778978 IP 112.26.1.8.38393 > 112.26.1.1.34615: Flags [.], ack 7141, win 7665, options [nop,nop,TS val 2882078 ecr 3119384,mptcp dss ack 2058722339], length 0
15:11:19.846753 IP 112.26.1.1.34615 > 112.26.1.8.38393: Flags [.], seq 7141:8569, ack 1, win 2678, options [nop,nop,TS val 3119384 ecr 2881177,mptcp dss ack 3193170700 seq 2058738047 subseq 7141 len 1428 csum 0x62f4], length 1428
15:11:19.869512 IP 112.26.1.1.34615 > 112.26.1.8.38393: Flags [.], seq 7141:8569, ack 1, win 2678, options [nop,nop,TS val 3119384 ecr 2881177,mptcp dss ack 3193170700 seq 2058738047 subseq 7141 len 1428 csum 0x62f4], length 1428
15:11:19.870880 IP 112.26.1.8.38393 > 112.26.1.1.34615: Flags [.], ack 8569, win 7894, options [nop,nop,TS val 2882254 ecr 3119384,mptcp dss ack 2058722339], length 0
15:11:19.977816 IP 112.26.1.1.34615 > 112.26.1.8.38393: Flags [.], seq 9997:11425, ack 1, win 2678, options [nop,nop,TS val 3119385 ecr 2881177,mptcp dss ack 3193170700 seq 2058740903 subseq 9997 len 1428 csum 0x89b1], length 1428
15:11:19.991906 IP 112.26.1.8.38393 > 112.26.1.1.34615: Flags [.], ack 8569, win 7894, options [nop,nop,TS val 2882254 ecr 3119384,mptcp dss ack 2058722339], length 0
15:11:19.993644 IP 112.26.1.8.38393 > 112.26.1.1.34615: Flags [.], ack 8569, win 7894, options [nop,nop,TS val 2882254 ecr 3119384,mptcp dss ack 2058722339], length 0
15:11:20.052591 IP 112.26.1.1.34615 > 112.26.1.8.38393: Flags [.], seq 9997:11425, ack 1, win 2678, options [nop,nop,TS val 3119385 ecr 2881177,mptcp dss ack 3193170700 seq 2058740903 subseq 9997 len 1428 csum 0x89b1], length 1428
15:11:20.054262 IP 112.26.1.8.38393 > 112.26.1.1.34615: Flags [.], ack 8569, win 8030, options [nop,nop,TS val 2882437 ecr 3119384,nop,nop,sack 1 {9997:11425},mptcp dss ack 2058726623], length 0
15:11:20.102280 IP 112.26.1.8.38393 > 112.26.1.1.34615: Flags [.], ack 8569, win 8030, options [nop,nop,TS val 2882437 ecr 3119384,nop,nop,sack 1 {9997:11425},mptcp dss ack 2058726623], length 0
15:11:20.135236 IP 112.26.1.8.38393 > 112.26.1.1.34615: Flags [.], ack 8569, win 8030, options [nop,nop,TS val 2882437 ecr 3119384,nop,nop,sack 1 {9997:11425},mptcp dss ack 2058726623], length 0
15:11:20.191030 IP 112.26.1.1.34615 > 112.26.1.8.38393: Flags [.], seq 14281:15709, ack 1, win 4017, options [nop,nop,TS val 3119658 ecr 2881508,mptcp dss ack 3193170700 seq 2058769463 subseq 14281 len 1428 csum 0xfe82], length 1428
15:11:20.193164 IP 112.26.1.1.34615 > 112.26.1.8.38393: Flags [.], seq 14281:15709, ack 1, win 4017, options [nop,nop,TS val 3119658 ecr 2881508,mptcp dss ack 3193170700 seq 2058769463 subseq 14281 len 1428 csum 0xfe82], length 1428
15:11:20.200332 IP 112.26.1.8.38393 > 112.26.1.1.34615: Flags [.], ack 8569, win 8213, options [nop,nop,TS val 2882578 ecr 3119384,nop,nop,sack 2 {14281:15709}{9997:11425},mptcp dss ack 2058739475], length 0
15:11:20.249241 IP 112.26.1.8.38393 > 112.26.1.1.34615: Flags [.], ack 8569, win 8213, options [nop,nop,TS val 2882578 ecr 3119384,nop,nop,sack 2 {14281:15709}{9997:11425},mptcp dss ack 2058739475], length 0
15:11:20.253558 IP 112.26.1.8.38393 > 112.26.1.1.34615: Flags [.], ack 8569, win 8213, options [nop,nop,TS val 2882578 ecr 3119384,nop,nop,sack 2 {14281:15709}{9997:11425},mptcp dss ack 2058739475], length 0
15:11:20.288490 IP 112.26.1.1.34615 > 112.26.1.8.38393: Flags [.], seq 15709:17137, ack 1, win 4017, options [nop,nop,TS val 3119658 ecr 2881508,mptcp dss ack 3193170700 seq 2058770891 subseq 15709 len 1428 csum 0x9090], length 1428
15:11:20.314352 IP 112.26.1.1.34615 > 112.26.1.8.38393: Flags [.], seq 15709:17137, ack 1, win 4017, options [nop,nop,TS val 3119658 ecr 2881508,mptcp dss ack 3193170700 seq 2058770891 subseq 15709 len 1428 csum 0x9090], length 1428
15:11:20.327001 IP 112.26.1.8.38393 > 112.26.1.1.34615: Flags [.], ack 8569, win 8304, options [nop,nop,TS val 2882699 ecr 3119384,nop,nop,sack 2 {14281:17137}{9997:11425},mptcp dss ack 2058739475], length 0
15:11:20.357722 IP 112.26.1.8.38393 > 112.26.1.1.34615: Flags [.], ack 8569, win 8304, options [nop,nop,TS val 2882699 ecr 3119384,nop,nop,sack 2 {14281:17137}{9997:11425},mptcp dss ack 2058739475], length 0
15:11:20.380774 IP 112.26.1.8.38393 > 112.26.1.1.34615: Flags [.], ack 8569, win 8304, options [nop,nop,TS val 2882699 ecr 3119384,nop,nop,sack 2 {14281:17137}{9997:11425},mptcp dss ack 2058739475], length 0
15:11:20.409943 IP 112.26.1.1.34615 > 112.26.1.8.38393: Flags [.], seq 18565:19993, ack 1, win 4017, options [nop,nop,TS val 3119824 ecr 2881681,mptcp dss ack 3193170700 seq 2058785171 subseq 18565 len 1428 csum 0xa9c1], length 1428
15:11:20.412752 IP 112.26.1.1.34615 > 112.26.1.8.38393: Flags [.], seq 18565:19993, ack 1, win 4017, options [nop,nop,TS val 3119824 ecr 2881681,mptcp dss ack 3193170700 seq 2058785171 subseq 18565 len 1428 csum 0xa9c1], length 1428
15:11:20.420343 IP 112.26.1.8.38393 > 112.26.1.1.34615: Flags [.], ack 8569, win 8487, options [nop,nop,TS val 2882797 ecr 3119384,nop,nop,sack 2 {18565:19993}{14281:17137},mptcp dss ack 2058739475], length 0
15:11:20.472955 IP 112.26.1.8.38393 > 112.26.1.1.34615: Flags [.], ack 8569, win 8487, options [nop,nop,TS val 2882797 ecr 3119384,nop,nop,sack 2 {18565:19993}{14281:17137},mptcp dss ack 2058739475], length 0
15:11:20.490243 IP 112.26.1.8.38393 > 112.26.1.1.34615: Flags [.], ack 8569, win 8487, options [nop,nop,TS val 2882797 ecr 3119384,nop,nop,sack 2 {18565:19993}{14281:17137},mptcp dss ack 2058739475], length 0
15:11:20.506676 IP 112.26.1.1.34615 > 112.26.1.8.38393: Flags [.], seq 21421:22849, ack 1, win 4017, options [nop,nop,TS val 3119965 ecr 2881798,mptcp dss ack 3193170700 seq 2058789455 subseq 21421 len 1428 csum 0x8718], length 1428
15:11:20.546128 IP 112.26.1.1.34615 > 112.26.1.8.38393: Flags [.], seq 21421:22849, ack 1, win 4017, options [nop,nop,TS val 3119965 ecr 2881798,mptcp dss ack 3193170700 seq 2058789455 subseq 21421 len 1428 csum 0x8718], length 1428
15:11:20.550711 IP 112.26.1.8.38393 > 112.26.1.1.34615: Flags [.], ack 8569, win 8624, options [nop,nop,TS val 2882931 ecr 3119384,nop,nop,sack 2 {21421:22849}{18565:19993},mptcp dss ack 2058739475], length 0
15:11:20.617993 IP 112.26.1.1.34615 > 112.26.1.8.38393: Flags [.], seq 24277:25705, ack 1, win 4017, options [nop,nop,TS val 3120087 ecr 2881960,mptcp dss ack 3193170700 seq 2058796595 subseq 24277 len 1428 csum 0x2b65], length 1428
15:11:20.644269 IP 112.26.1.8.38393 > 112.26.1.1.34615: Flags [.], ack 8569, win 8624, options [nop,nop,TS val 2882931 ecr 3119384,nop,nop,sack 2 {21421:22849}{18565:19993},mptcp dss ack 2058739475], length 0
15:11:20.645934 IP 112.26.1.8.38393 > 112.26.1.1.34615: Flags [.], ack 8569, win 8624, options [nop,nop,TS val 2882931 ecr 3119384,nop,nop,sack 2 {21421:22849}{18565:19993},mptcp dss ack 2058739475], length 0
15:11:20.686984 IP 112.26.1.1.34615 > 112.26.1.8.38393: Flags [.], seq 24277:25705, ack 1, win 4017, options [nop,nop,TS val 3120087 ecr 2881960,mptcp dss ack 3193170700 seq 2058796595 subseq 24277 len 1428 csum 0x2b65], length 1428
15:11:20.688375 IP 112.26.1.8.38393 > 112.26.1.1.34615: Flags [.], ack 8569, win 8852, options [nop,nop,TS val 2883072 ecr 3119384,nop,nop,sack 2 {24277:25705}{21421:22849},mptcp dss ack 2058739475], length 0
15:11:20.783267 IP 112.26.1.8.38393 > 112.26.1.1.34615: Flags [.], ack 8569, win 8852, options [nop,nop,TS val 2883072 ecr 3119384,nop,nop,sack 2 {24277:25705}{21421:22849},mptcp dss ack 2058739475], length 0
15:11:20.786218 IP 112.26.1.8.38393 > 112.26.1.1.34615: Flags [.], ack 8569, win 8852, options [nop,nop,TS val 2883072 ecr 3119384,nop,nop,sack 2 {24277:25705}{21421:22849},mptcp dss ack 2058739475], length 0
15:11:20.854162 IP 112.26.1.1.34615 > 112.26.1.8.38393: Flags [.], seq 27133:28561, ack 1, win 4017, options [nop,nop,TS val 3120233 ecr 2882078,mptcp dss ack 3193170700 seq 2058802307 subseq 27133 len 1428 csum 0xa488], length 1428
15:11:20.858006 IP 112.26.1.1.34615 > 112.26.1.8.38393: Flags [.], seq 27133:28561, ack 1, win 4017, options [nop,nop,TS val 3120233 ecr 2882078,mptcp dss ack 3193170700 seq 2058802307 subseq 27133 len 1428 csum 0xa488], length 1428
15:11:20.859947 IP 112.26.1.8.38393 > 112.26.1.1.34615: Flags [.], ack 8569, win 8989, options [nop,nop,TS val 2883243 ecr 3119384,nop,nop,sack 2 {27133:28561}{24277:25705},mptcp dss ack 2058739475], length 0
15:11:20.938681 IP 112.26.1.1.34615 > 112.26.1.8.38393: Flags [.], seq 29989:31417, ack 1, win 4017, options [nop,nop,TS val 3120448 ecr 2882254,mptcp dss ack 3193170700 seq 2058748043 subseq 29989 len 1428 csum 0x45a6], length 1428
15:11:20.952582 IP 112.26.1.8.38393 > 112.26.1.1.34615: Flags [.], ack 8569, win 8989, options [nop,nop,TS val 2883243 ecr 3119384,nop,nop,sack 2 {27133:28561}{24277:25705},mptcp dss ack 2058739475], length 0
15:11:20.958589 IP 112.26.1.8.38393 > 112.26.1.1.34615: Flags [.], ack 8569, win 8989, options [nop,nop,TS val 2883243 ecr 3119384,nop,nop,sack 2 {27133:28561}{24277:25705},mptcp dss ack 2058739475], length 0
15:11:21.002449 IP 112.26.1.1.34615 > 112.26.1.8.38393: Flags [.], seq 29989:31417, ack 1, win 4017, options [nop,nop,TS val 3120448 ecr 2882254,mptcp dss ack 3193170700 seq 2058748043 subseq 29989 len 1428 csum 0x45a6], length 1428
15:11:21.006808 IP 112.26.1.8.38393 > 112.26.1.1.34615: Flags [.], ack 8569, win 9125, options [nop,nop,TS val 2883387 ecr 3119384,nop,nop,sack 2 {29989:31417}{27133:28561},mptcp dss ack 2058739475], length 0
15:11:21.035497 IP 112.26.1.1.34615 > 112.26.1.8.38393: Flags [.], seq 31417:32845, ack 1, win 4017, options [nop,nop,TS val 3120672 ecr 2882437,mptcp dss ack 3193170700 seq 2058752327 subseq 31417 len 1428 csum 0x5593], length 1428
15:11:21.082163 IP 112.26.1.1.34615 > 112.26.1.8.38393: Flags [.], seq 8569:9997, ack 1, win 4017, options [nop,nop,TS val 3120712 ecr 2882578,mptcp dss ack 3193170700 seq 2058739475 subseq 8569 len 1428 csum 0x1651], length 1428
15:11:21.092195 IP 112.26.1.8.38393 > 112.26.1.1.34615: Flags [.], ack 8569, win 9125, options [nop,nop,TS val 2883387 ecr 3119384,nop,nop,sack 2 {29989:31417}{27133:28561},mptcp dss ack 2058739475], length 0
15:11:21.099016 IP 112.26.1.8.38393 > 112.26.1.1.34615: Flags [.], ack 8569, win 9125, options [nop,nop,TS val 2883387 ecr 3119384,nop,nop,sack 2 {29989:31417}{27133:28561},mptcp dss ack 2058739475], length 0
15:11:21.157000 IP 112.26.1.1.34615 > 112.26.1.8.38393: Flags [.], seq 31417:32845, ack 1, win 4017, options [nop,nop,TS val 3120672 ecr 2882437,mptcp dss ack 3193170700 seq 2058752327 subseq 31417 len 1428 csum 0x5593], length 1428
15:11:21.158677 IP 112.26.1.8.38393 > 112.26.1.1.34615: Flags [.], ack 8569, win 9399, options [nop,nop,TS val 2883541 ecr 3119384,nop,nop,sack 2 {29989:32845}{27133:28561},mptcp dss ack 2058739475], length 0
15:11:21.200182 IP 112.26.1.1.34615 > 112.26.1.8.38393: Flags [.], seq 11425:12853, ack 1, win 4017, options [nop,nop,TS val 3120835 ecr 2882699,mptcp dss ack 3193170700 seq 2058742331 subseq 11425 len 1428 csum 0x972b], length 1428
15:11:21.236709 IP 112.26.1.1.34615 > 112.26.1.8.38393: Flags [.], seq 12853:14281, ack 1, win 4017, options [nop,nop,TS val 3120944 ecr 2882797,mptcp dss ack 3193170700 seq 2058743759 subseq 12853 len 1428 csum 0x8ece], length 1428
15:11:21.279679 IP 112.26.1.1.34615 > 112.26.1.8.38393: Flags [.], seq 17137:18565, ack 1, win 4017, options [nop,nop,TS val 3121240 ecr 2883072,mptcp dss ack 3193170700 seq 2058783743 subseq 17137 len 1428 csum 0xc9e2], length 1428
15:11:21.299333 IP 112.26.1.1.34615 > 112.26.1.8.38393: Flags [.], seq 8569:9997, ack 1, win 4017, options [nop,nop,TS val 3120712 ecr 2882578,mptcp dss ack 3193170700 seq 2058739475 subseq 8569 len 1428 csum 0x1651], length 1428
15:11:21.306056 IP 112.26.1.8.38393 > 112.26.1.1.34615: Flags [.], ack 11425, win 9445, options [nop,nop,TS val 2883684 ecr 3120712,nop,nop,sack 2 {29989:32845}{27133:28561},mptcp dss ack 2058742331], length 0
15:11:21.360527 IP 112.26.1.1.34615 > 112.26.1.8.38393: Flags [.], seq 19993:21421, ack 1, win 4017, options [nop,nop,TS val 3121413 ecr 2883243,mptcp dss ack 3193170700 seq 2058788027 subseq 19993 len 1428 csum 0xe0e0], length 1428
15:11:21.385389 IP 112.26.1.8.38393 > 112.26.1.1.34615: Flags [.], ack 8569, win 9399, options [nop,nop,TS val 2883541 ecr 3119384,nop,nop,sack 2 {29989:32845}{27133:28561},mptcp dss ack 2058739475], length 0
15:11:21.387226 IP 112.26.1.8.38393 > 112.26.1.1.34615: Flags [.], ack 8569, win 9399, options [nop,nop,TS val 2883541 ecr 3119384,nop,nop,sack 2 {29989:32845}{27133:28561},mptcp dss ack 2058739475], length 0
15:11:21.440098 IP 112.26.1.1.34615 > 112.26.1.8.38393: Flags [.], seq 11425:12853, ack 1, win 4017, options [nop,nop,TS val 3120835 ecr 2882699,mptcp dss ack 3193170700 seq 2058742331 subseq 11425 len 1428 csum 0x972b], length 1428
15:11:21.446855 IP 112.26.1.8.38393 > 112.26.1.1.34615: Flags [.], ack 12853, win 9582, options [nop,nop,TS val 2883824 ecr 3120835,nop,nop,sack 2 {29989:32845}{27133:28561},mptcp dss ack 2058743759], length 0
15:11:21.464680 IP 112.26.1.1.34615 > 112.26.1.8.38393: Flags [.], seq 22849:24277, ack 1, win 4017, options [nop,nop,TS val 3121553 ecr 2883387,mptcp dss ack 3193170700 seq 2058795167 subseq 22849 len 1428 csum 0x17bb], length 1428
15:11:21.501606 IP 112.26.1.1.34615 > 112.26.1.8.38393: Flags [.], seq 12853:14281, ack 1, win 4017, options [nop,nop,TS val 3120944 ecr 2882797,mptcp dss ack 3193170700 seq 2058743759 subseq 12853 len 1428 csum 0x8ece], length 1428
15:11:21.504098 IP 112.26.1.8.38393 > 112.26.1.1.34615: Flags [.], ack 17137, win 9719, options [nop,nop,TS val 2883886 ecr 3120944,nop,nop,sack 2 {29989:32845}{27133:28561},mptcp dss ack 2058752327], length 0
15:11:21.545088 IP 112.26.1.1.34615 > 112.26.1.8.38393: Flags [.], seq 25705:27133, ack 1, win 4017, options [nop,nop,TS val 3121841 ecr 2883541,mptcp dss ack 3193170700 seq 2058800879 subseq 25705 len 1428 csum 0x80b6], length 1428
15:11:21.581505 IP 112.26.1.1.34615 > 112.26.1.8.38393: Flags [.], seq 17137:18565, ack 1, win 4017, options [nop,nop,TS val 3121240 ecr 2883072,mptcp dss ack 3193170700 seq 2058783743 subseq 17137 len 1428 csum 0xc9e2], length 1428
15:11:21.584578 IP 112.26.1.8.38393 > 112.26.1.1.34615: Flags [.], ack 19993, win 9855, options [nop,nop,TS val 2883966 ecr 3121240,nop,nop,sack 2 {29989:32845}{27133:28561},mptcp dss ack 2058752327], length 0
15:11:21.651624 IP 112.26.1.8.38393 > 112.26.1.1.34615: Flags [.], ack 11425, win 9445, options [nop,nop,TS val 2883684 ecr 3120712,nop,nop,sack 2 {29989:32845}{27133:28561},mptcp dss ack 2058742331], length 0
15:11:21.654123 IP 112.26.1.8.38393 > 112.26.1.1.34615: Flags [.], ack 11425, win 9445, options [nop,nop,TS val 2883684 ecr 3120712,nop,nop,sack 2 {29989:32845}{27133:28561},mptcp dss ack 2058742331], length 0
15:11:21.717481 IP 112.26.1.1.34615 > 112.26.1.8.38393: Flags [.], seq 19993:21421, ack 1, win 4017, options [nop,nop,TS val 3121413 ecr 2883243,mptcp dss ack 3193170700 seq 2058788027 subseq 19993 len 1428 csum 0xe0e0], length 1428
15:11:21.733281 IP 112.26.1.8.38393 > 112.26.1.1.34615: Flags [.], ack 22849, win 9947, options [nop,nop,TS val 2884102 ecr 3121413,nop,nop,sack 2 {29989:32845}{27133:28561},mptcp dss ack 2058752327], length 0
15:11:21.765935 IP 112.26.1.1.34615 > 112.26.1.8.38393: Flags [.], seq 28561:29989, ack 1, win 4017, options [nop,nop,TS val 3122108 ecr 2883684,mptcp dss ack 3193170700 seq 2058746615 subseq 28561 len 1428 csum 0xc072], length 1428
15:11:21.802699 IP 112.26.1.8.38393 > 112.26.1.1.34615: Flags [.], ack 12853, win 9582, options [nop,nop,TS val 2883824 ecr 3120835,nop,nop,sack 2 {29989:32845}{27133:28561},mptcp dss ack 2058743759], length 0
15:11:21.805721 IP 112.26.1.8.38393 > 112.26.1.1.34615: Flags [.], ack 12853, win 9582, options [nop,nop,TS val 2883824 ecr 3120835,nop,nop,sack 2 {29989:32845}{27133:28561},mptcp dss ack 2058743759], length 0
15:11:21.838616 IP 112.26.1.1.34615 > 112.26.1.8.38393: Flags [.], seq 22849:24277, ack 1, win 4017, options [nop,nop,TS val 3121553 ecr 2883387,mptcp dss ack 3193170700 seq 2058795167 subseq 22849 len 1428 csum 0x17bb], length 1428
15:11:21.841374 IP 112.26.1.8.38393 > 112.26.1.1.34615: Flags [.], ack 25705, win 10084, options [nop,nop,TS val 2884223 ecr 3121553,nop,nop,sack 2 {29989:32845}{27133:28561},mptcp dss ack 2058752327], length 0
15:11:21.913636 IP 112.26.1.1.34615 > 112.26.1.8.38393: Flags [.], seq 32845:34273, ack 1, win 4017, options [nop,nop,TS val 3122108 ecr 2883684,mptcp dss ack 3193170700 seq 2058828011 subseq 32845 len 1428 csum 0xef78], length 1428
15:11:21.939428 IP 112.26.1.8.38393 > 112.26.1.1.34615: Flags [.], ack 17137, win 9719, options [nop,nop,TS val 2883886 ecr 3120944,nop,nop,sack 2 {29989:32845}{27133:28561},mptcp dss ack 2058752327], length 0
15:11:21.944558 IP 112.26.1.8.38393 > 112.26.1.1.34615: Flags [.], ack 17137, win 9719, options [nop,nop,TS val 2883886 ecr 3120944,nop,nop,sack 2 {29989:32845}{27133:28561},mptcp dss ack 2058752327], length 0
15:11:21.995952 IP 112.26.1.1.34615 > 112.26.1.8.38393: Flags [.], seq 34273:35701, ack 1, win 4017, options [nop,nop,TS val 3122108 ecr 2883684,mptcp dss ack 3193170700 seq 2058829439 subseq 34273 len 1428 csum 0x822a], length 1428
15:11:22.020734 IP 112.26.1.1.34615 > 112.26.1.8.38393: Flags [.], seq 25705:27133, ack 1, win 4017, options [nop,nop,TS val 3121841 ecr 2883541,mptcp dss ack 3193170700 seq 2058800879 subseq 25705 len 1428 csum 0x80b6], length 1428
15:11:22.022079 IP 112.26.1.8.38393 > 112.26.1.1.34615: Flags [.], ack 28561, win 10312, options [nop,nop,TS val 2884405 ecr 3121841,nop,nop,sack 1 {29989:32845},mptcp dss ack 2058752327], length 0
15:11:22.057976 IP 112.26.1.8.38393 > 112.26.1.1.34615: Flags [.], ack 19993, win 9855, options [nop,nop,TS val 2883966 ecr 3121240,nop,nop,sack 2 {29989:32845}{27133:28561},mptcp dss ack 2058752327], length 0
15:11:22.059542 IP 112.26.1.8.38393 > 112.26.1.1.34615: Flags [.], ack 19993, win 9855, options [nop,nop,TS val 2883966 ecr 3121240,nop,nop,sack 2 {29989:32845}{27133:28561},mptcp dss ack 2058752327], length 0
15:11:22.090919 IP 112.26.1.8.38393 > 112.26.1.1.34615: Flags [.], ack 22849, win 9947, options [nop,nop,TS val 2884102 ecr 3121413,nop,nop,sack 2 {29989:32845}{27133:28561},mptcp dss ack 2058752327], length 0
15:11:22.107035 IP 112.26.1.1.34615 > 112.26.1.8.38393: Flags [.], seq 35701:37129, ack 1, win 4017, options [nop,nop,TS val 3122259 ecr 2883824,mptcp dss ack 3193170700 seq 2058833723 subseq 35701 len 1428 csum 0x499a], length 1428
15:11:22.134010 IP 112.26.1.1.34615 > 112.26.1.8.38393: Flags [.], seq 28561:29989, ack 1, win 4017, options [nop,nop,TS val 3122108 ecr 2883684,mptcp dss ack 3193170700 seq 2058746615 subseq 28561 len 1428 csum 0xc072], length 1428
15:11:22.138270 IP 112.26.1.8.38393 > 112.26.1.1.34615: Flags [.], ack 32845, win 10449, options [nop,nop,TS val 2884519 ecr 3122108,mptcp dss ack 2058756611], length 0
15:11:22.167287 IP 112.26.1.8.38393 > 112.26.1.1.34615: Flags [.], ack 22849, win 9947, options [nop,nop,TS val 2884102 ecr 3121413,nop,nop,sack 2 {29989:32845}{27133:28561},mptcp dss ack 2058752327], length 0
15:11:22.236649 IP 112.26.1.1.34615 > 112.26.1.8.38393: Flags [.], seq 37129:38557, ack 1, win 4017, options [nop,nop,TS val 3122259 ecr 2883824,mptcp dss ack 3193170700 seq 2058835151 subseq 37129 len 1428 csum 0x2780], length 1428
15:11:22.259570 IP 112.26.1.8.38393 > 112.26.1.1.34615: Flags [.], ack 25705, win 10084, options [nop,nop,TS val 2884223 ecr 3121553,nop,nop,sack 2 {29989:32845}{27133:28561},mptcp dss ack 2058752327], length 0
15:11:22.264306 IP 112.26.1.8.38393 > 112.26.1.1.34615: Flags [.], ack 25705, win 10084, options [nop,nop,TS val 2884223 ecr 3121553,nop,nop,sack 2 {29989:32845}{27133:28561},mptcp dss ack 2058752327], length 0
15:11:22.313177 IP 112.26.1.1.34615 > 112.26.1.8.38393: Flags [.], seq 32845:34273, ack 1, win 4017, options [nop,nop,TS val 3122108 ecr 2883684,mptcp dss ack 3193170700 seq 2058828011 subseq 32845 len 1428 csum 0xef78], length 1428
15:11:22.318466 IP 112.26.1.8.38393 > 112.26.1.1.34615: Flags [.], ack 34273, win 10631, options [nop,nop,TS val 2884698 ecr 3122108,mptcp dss ack 2058756611], length 0
15:11:22.344937 IP 112.26.1.1.34615 > 112.26.1.8.38393: Flags [.], seq 38557:39985, ack 1, win 4017, options [nop,nop,TS val 3122398 ecr 2883886,mptcp dss ack 3193170700 seq 2058840863 subseq 38557 len 1428 csum 0x5221], length 1428
15:11:22.390980 IP 112.26.1.1.34615 > 112.26.1.8.38393: Flags [.], seq 34273:35701, ack 1, win 4017, options [nop,nop,TS val 3122108 ecr 2883684,mptcp dss ack 3193170700 seq 2058829439 subseq 34273 len 1428 csum 0x822a], length 1428
15:11:22.396588 IP 112.26.1.8.38393 > 112.26.1.1.34615: Flags [.], ack 35701, win 10768, options [nop,nop,TS val 2884775 ecr 3122108,mptcp dss ack 2058756611], length 0
15:11:22.431801 IP 112.26.1.1.34615 > 112.26.1.8.38393: Flags [.], seq 39985:41413, ack 1, win 4017, options [nop,nop,TS val 3122398 ecr 2883886,mptcp dss ack 3193170700 seq 2058842291 subseq 39985 len 1428 csum 0xf3fe], length 1428
15:11:22.457284 IP 112.26.1.8.38393 > 112.26.1.1.34615: Flags [.], ack 28561, win 10312, options [nop,nop,TS val 2884405 ecr 3121841,nop,nop,sack 1 {29989:32845},mptcp dss ack 2058752327], length 0
15:11:22.460953 IP 112.26.1.8.38393 > 112.26.1.1.34615: Flags [.], ack 28561, win 10312, options [nop,nop,TS val 2884405 ecr 3121841,nop,nop,sack 1 {29989:32845},mptcp dss ack 2058752327], length 0
15:11:22.503611 IP 112.26.1.1.34615 > 112.26.1.8.38393: Flags [.], seq 41413:42841, ack 1, win 4017, options [nop,nop,TS val 3122513 ecr 2883966,mptcp dss ack 3193170700 seq 2058846575 subseq 41413 len 1428 csum 0x762e], length 1428
15:11:22.538091 IP 112.26.1.1.34615 > 112.26.1.8.38393: Flags [.], seq 35701:37129, ack 1, win 4017, options [nop,nop,TS val 3122259 ecr 2883824,mptcp dss ack 3193170700 seq 2058833723 subseq 35701 len 1428 csum 0x499a], length 1428
15:11:22.539862 IP 112.26.1.8.38393 > 112.26.1.1.34615: Flags [.], ack 37129, win 10905, options [nop,nop,TS val 2884923 ecr 3122259,mptcp dss ack 2058756611], length 0
15:11:22.591498 IP 112.26.1.1.34615 > 112.26.1.8.38393: Flags [.], seq 42841:44269, ack 1, win 4017, options [nop,nop,TS val 3122621 ecr 2884102,mptcp dss ack 3193170700 seq 2058849431 subseq 42841 len 1428 csum 0xcb2c], length 1428
15:11:22.600986 IP 112.26.1.8.38393 > 112.26.1.1.34615: Flags [.], ack 32845, win 10449, options [nop,nop,TS val 2884519 ecr 3122108,mptcp dss ack 2058756611], length 0
15:11:22.606117 IP 112.26.1.8.38393 > 112.26.1.1.34615: Flags [.], ack 32845, win 10449, options [nop,nop,TS val 2884519 ecr 3122108,mptcp dss ack 2058756611], length 0
15:11:22.662941 IP 112.26.1.1.34615 > 112.26.1.8.38393: Flags [.], seq 37129:38557, ack 1, win 4017, options [nop,nop,TS val 3122259 ecr 2883824,mptcp dss ack 3193170700 seq 2058835151 subseq 37129 len 1428 csum 0x2780], length 1428
15:11:22.665562 IP 112.26.1.8.38393 > 112.26.1.1.34615: Flags [.], ack 38557, win 11133, options [nop,nop,TS val 2885047 ecr 3122259,mptcp dss ack 2058756611], length 0
15:11:22.688267 IP 112.26.1.1.34615 > 112.26.1.8.38393: Flags [.], seq 44269:45697, ack 1, win 4017, options [nop,nop,TS val 3122718 ecr 2884223,mptcp dss ack 3193170700 seq 2058852287 subseq 44269 len 1428 csum 0x27a6], length 1428
15:11:22.735217 IP 112.26.1.8.38393 > 112.26.1.1.34615: Flags [.], ack 34273, win 10631, options [nop,nop,TS val 2884698 ecr 3122108,mptcp dss ack 2058756611], length 0
15:11:22.737517 IP 112.26.1.8.38393 > 112.26.1.1.34615: Flags [.], ack 34273, win 10631, options [nop,nop,TS val 2884698 ecr 3122108,mptcp dss ack 2058756611], length 0
15:11:22.789647 IP 112.26.1.1.34615 > 112.26.1.8.38393: Flags [.], seq 45697:47125, ack 1, win 4017, options [nop,nop,TS val 3122915 ecr 2884405,mptcp dss ack 3193170700 seq 2058853715 subseq 45697 len 1428 csum 0x7ca8], length 1428
15:11:22.805101 IP 112.26.1.1.34615 > 112.26.1.8.38393: Flags [.], seq 38557:39985, ack 1, win 4017, options [nop,nop,TS val 3122398 ecr 2883886,mptcp dss ack 3193170700 seq 2058840863 subseq 38557 len 1428 csum 0x5221], length 1428
15:11:22.819107 IP 112.26.1.8.38393 > 112.26.1.1.34615: Flags [.], ack 39985, win 11315, options [nop,nop,TS val 2885189 ecr 3122398,mptcp dss ack 2058756611], length 0
15:11:22.869153 IP 112.26.1.8.38393 > 112.26.1.1.34615: Flags [.], ack 35701, win 10768, options [nop,nop,TS val 2884775 ecr 3122108,mptcp dss ack 2058756611], length 0
15:11:22.880616 IP 112.26.1.8.38393 > 112.26.1.1.34615: Flags [.], ack 35701, win 10768, options [nop,nop,TS val 2884775 ecr 3122108,mptcp dss ack 2058756611], length 0
15:11:22.934051 IP 112.26.1.1.34615 > 112.26.1.8.38393: Flags [.], seq 47125:48553, ack 1, win 4017, options [nop,nop,TS val 3123057 ecr 2884519,mptcp dss ack 3193170700 seq 2058859427 subseq 47125 len 1428 csum 0xc83f], length 1428
15:11:22.950432 IP 112.26.1.1.34615 > 112.26.1.8.38393: Flags [.], seq 39985:41413, ack 1, win 4017, options [nop,nop,TS val 3122398 ecr 2883886,mptcp dss ack 3193170700 seq 2058842291 subseq 39985 len 1428 csum 0xf3fe], length 1428
15:11:22.951890 IP 112.26.1.8.38393 > 112.26.1.1.34615: Flags [.], ack 41413, win 11407, options [nop,nop,TS val 2885335 ecr 3122398,mptcp dss ack 2058756611], length 0
15:11:23.022961 IP 112.26.1.1.34615 > 112.26.1.8.38393: Flags [.], seq 48553:49981, ack 1, win 4017, options [nop,nop,TS val 3123191 ecr 2884698,mptcp dss ack 3193170700 seq 2058863711 subseq 48553 len 1428 csum 0x8706], length 1428
15:11:23.034462 IP 112.26.1.1.34615 > 112.26.1.8.38393: Flags [.], seq 41413:42841, ack 1, win 4017, options [nop,nop,TS val 3122513 ecr 2883966,mptcp dss ack 3193170700 seq 2058846575 subseq 41413 len 1428 csum 0x762e], length 1428
15:11:23.047811 IP 112.26.1.8.38393 > 112.26.1.1.34615: Flags [.], ack 42841, win 11544, options [nop,nop,TS val 2885419 ecr 3122513,mptcp dss ack 2058756611], length 0
15:11:23.104345 IP 112.26.1.1.34615 > 112.26.1.8.38393: Flags [.], seq 49981:51409, ack 1, win 4017, options [nop,nop,TS val 3123325 ecr 2884775,mptcp dss ack 3193170700 seq 2058867995 subseq 49981 len 1428 csum 0x2c4f], length 1428
15:11:23.110495 IP 112.26.1.8.38393 > 112.26.1.1.34615: Flags [.], ack 37129, win 10905, options [nop,nop,TS val 2884923 ecr 3122259,mptcp dss ack 2058756611], length 0
15:11:23.111981 IP 112.26.1.8.38393 > 112.26.1.1.34615: Flags [.], ack 37129, win 10905, options [nop,nop,TS val 2884923 ecr 3122259,mptcp dss ack 2058756611], length 0
15:11:23.151393 IP 112.26.1.1.34615 > 112.26.1.8.38393: Flags [.], seq 42841:44269, ack 1, win 4017, options [nop,nop,TS val 3122621 ecr 2884102,mptcp dss ack 3193170700 seq 2058849431 subseq 42841 len 1428 csum 0xcb2c], length 1428
15:11:23.153181 IP 112.26.1.8.38393 > 112.26.1.1.34615: Flags [.], ack 44269, win 11726, options [nop,nop,TS val 2885536 ecr 3122621,mptcp dss ack 2058756611], length 0
15:11:23.204050 IP 112.26.1.8.38393 > 112.26.1.1.34615: Flags [.], ack 38557, win 11133, options [nop,nop,TS val 2885047 ecr 3122259,mptcp dss ack 2058756611], length 0
15:11:23.206820 IP 112.26.1.8.38393 > 112.26.1.1.34615: Flags [.], ack 38557, win 11133, options [nop,nop,TS val 2885047 ecr 3122259,mptcp dss ack 2058756611], length 0
15:11:23.221311 IP 112.26.1.1.34615 > 112.26.1.8.38393: Flags [.], seq 51409:52837, ack 1, win 4017, options [nop,nop,TS val 3123325 ecr 2884775,mptcp dss ack 3193170700 seq 2058869423 subseq 51409 len 1428 csum 0x6587], length 1428
15:11:23.248492 IP 112.26.1.1.34615 > 112.26.1.8.38393: Flags [.], seq 44269:45697, ack 1, win 4017, options [nop,nop,TS val 3122718 ecr 2884223,mptcp dss ack 3193170700 seq 2058852287 subseq 44269 len 1428 csum 0x27a6], length 1428
15:11:23.252823 IP 112.26.1.8.38393 > 112.26.1.1.34615: Flags [.], ack 45697, win 11817, options [nop,nop,TS val 2885633 ecr 3122718,mptcp dss ack 2058756611], length 0
15:11:23.311923 IP 112.26.1.1.34615 > 112.26.1.8.38393: Flags [.], seq 45697:47125, ack 1, win 4017, options [nop,nop,TS val 3122915 ecr 2884405,mptcp dss ack 3193170700 seq 2058853715 subseq 45697 len 1428 csum 0x7ca8], length 1428
15:11:23.318368 IP 112.26.1.8.38393 > 112.26.1.1.34615: Flags [.], ack 47125, win 11954, options [nop,nop,TS val 2885697 ecr 3122915,mptcp dss ack 2058756611], length 0
15:11:23.329245 IP 112.26.1.1.34615 > 112.26.1.8.38393: Flags [.], seq 52837:54265, ack 1, win 4017, options [nop,nop,TS val 3123566 ecr 2884923,mptcp dss ack 3193170700 seq 2058875135 subseq 52837 len 1428 csum 0x15de], length 1428
15:11:23.361605 IP 112.26.1.1.34615 > 112.26.1.8.38393: Flags [.], seq 47125:48553, ack 1, win 4017, options [nop,nop,TS val 3123057 ecr 2884519,mptcp dss ack 3193170700 seq 2058859427 subseq 47125 len 1428 csum 0xc83f], length 1428
15:11:23.362792 IP 112.26.1.8.38393 > 112.26.1.1.34615: Flags [.], ack 48553, win 12045, options [nop,nop,TS val 2885746 ecr 3123057,mptcp dss ack 2058782315], length 0
15:11:23.370256 IP 112.26.1.1.34615 > 112.26.1.8.38393: Flags [.], seq 54265:55693, ack 1, win 4017, options [nop,nop,TS val 3123660 ecr 2885047,mptcp dss ack 3193170700 seq 2058879419 subseq 54265 len 1428 csum 0x19e2], length 1428
15:11:23.442060 IP 112.26.1.8.38393 > 112.26.1.1.34615: Flags [.], ack 41413, win 11407, options [nop,nop,TS val 2885335 ecr 3122398,mptcp dss ack 2058756611], length 0
15:11:23.444268 IP 112.26.1.8.38393 > 112.26.1.1.34615: Flags [.], ack 41413, win 11407, options [nop,nop,TS val 2885335 ecr 3122398,mptcp dss ack 2058756611], length 0
15:11:23.483859 IP 112.26.1.1.34615 > 112.26.1.8.38393: Flags [.], seq 48553:49981, ack 1, win 4017, options [nop,nop,TS val 3123191 ecr 2884698,mptcp dss ack 3193170700 seq 2058863711 subseq 48553 len 1428 csum 0x8706], length 1428
15:11:23.501151 IP 112.26.1.8.38393 > 112.26.1.1.34615: Flags [.], ack 49981, win 12182, options [nop,nop,TS val 2885869 ecr 3123191,mptcp dss ack 2058782315], length 0
15:11:23.530767 IP 112.26.1.1.34615 > 112.26.1.8.38393: Flags [.], seq 55693:57121, ack 1, win 4017, options [nop,nop,TS val 3123899 ecr 2885335,mptcp dss ack 3193170700 seq 2058885131 subseq 55693 len 1428 csum 0x9621], length 1428
15:11:23.567070 IP 112.26.1.1.34615 > 112.26.1.8.38393: Flags [.], seq 49981:51409, ack 1, win 4017, options [nop,nop,TS val 3123325 ecr 2884775,mptcp dss ack 3193170700 seq 2058867995 subseq 49981 len 1428 csum 0x2c4f], length 1428
15:11:23.568725 IP 112.26.1.8.38393 > 112.26.1.1.34615: Flags [.], ack 51409, win 12274, options [nop,nop,TS val 2885952 ecr 3123325,mptcp dss ack 2058782315], length 0
15:11:23.604600 IP 112.26.1.1.34615 > 112.26.1.8.38393: Flags [.], seq 57121:58549, ack 1, win 4017, options [nop,nop,TS val 3123899 ecr 2885335,mptcp dss ack 3193170700 seq 2058886559 subseq 57121 len 1428 csum 0xcc33], length 1428
15:11:23.631428 IP 112.26.1.8.38393 > 112.26.1.1.34615: Flags [.], ack 44269, win 11726, options [nop,nop,TS val 2885536 ecr 3122621,mptcp dss ack 2058756611], length 0
15:11:23.657064 IP 112.26.1.1.34615 > 112.26.1.8.38393: Flags [.], seq 58549:59977, ack 1, win 4017, options [nop,nop,TS val 3123899 ecr 2885335,mptcp dss ack 3193170700 seq 2058887987 subseq 58549 len 1428 csum 0x9ef5], length 1428
15:11:23.668565 IP 112.26.1.1.34615 > 112.26.1.8.38393: Flags [.], seq 51409:52837, ack 1, win 4017, options [nop,nop,TS val 3123325 ecr 2884775,mptcp dss ack 3193170700 seq 2058869423 subseq 51409 len 1428 csum 0x6587], length 1428
15:11:23.670073 IP 112.26.1.8.38393 > 112.26.1.1.34615: Flags [.], ack 52837, win 12410, options [nop,nop,TS val 2886053 ecr 3123325,mptcp dss ack 2058782315], length 0
15:11:23.721286 IP 112.26.1.8.38393 > 112.26.1.1.34615: Flags [.], ack 45697, win 11817, options [nop,nop,TS val 2885633 ecr 3122718,mptcp dss ack 2058756611], length 0
15:11:23.730030 IP 112.26.1.8.38393 > 112.26.1.1.34615: Flags [.], ack 44269, win 11726, options [nop,nop,TS val 2885536 ecr 3122621,mptcp dss ack 2058756611], length 0
15:11:23.768652 IP 112.26.1.8.38393 > 112.26.1.1.34615: Flags [.], ack 47125, win 11954, options [nop,nop,TS val 2885697 ecr 3122915,mptcp dss ack 2058756611], length 0
15:11:23.777676 IP 112.26.1.8.38393 > 112.26.1.1.34615: Flags [.], ack 45697, win 11817, options [nop,nop,TS val 2885633 ecr 3122718,mptcp dss ack 2058756611], length 0
15:11:23.813569 IP 112.26.1.1.34615 > 112.26.1.8.38393: Flags [.], seq 52837:54265, ack 1, win 4017, options [nop,nop,TS val 3123566 ecr 2884923,mptcp dss ack 3193170700 seq 2058875135 subseq 52837 len 1428 csum 0x15de], length 1428
15:11:23.815635 IP 112.26.1.8.38393 > 112.26.1.1.34615: Flags [.], ack 54265, win 12639, options [nop,nop,TS val 2886198 ecr 3123566,mptcp dss ack 2058782315], length 0
15:11:23.865741 IP 112.26.1.1.34615 > 112.26.1.8.38393: Flags [.], seq 59977:61405, ack 1, win 4017, options [nop,nop,TS val 3124184 ecr 2885536,mptcp dss ack 3193170700 seq 2058900839 subseq 59977 len 1428 csum 0xbc1f], length 1428
15:11:23.898017 IP 112.26.1.1.34615 > 112.26.1.8.38393: Flags [.], seq 54265:55693, ack 1, win 4017, options [nop,nop,TS val 3123660 ecr 2885047,mptcp dss ack 3193170700 seq 2058879419 subseq 54265 len 1428 csum 0x19e2], length 1428
15:11:23.914829 IP 112.26.1.8.38393 > 112.26.1.1.34615: Flags [.], ack 55693, win 12730, options [nop,nop,TS val 2886283 ecr 3123660,mptcp dss ack 2058782315], length 0
15:11:23.952463 IP 112.26.1.8.38393 > 112.26.1.1.34615: Flags [.], ack 49981, win 12182, options [nop,nop,TS val 2885869 ecr 3123191,mptcp dss ack 2058782315], length 0
