15:11:18.693377 IP 112.26.1.8.38393 > 112.26.1.1.34615: Flags [S], seq 3475975781, win 65535, options [mss 1460,sackOK,TS val 2881078 ecr 0,nop,wscale 6,mptcp join id 3 token 0x7761ebfe nonce 0x5f4b76c8], length 0
15:11:18.708174 IP 112.26.1.8.38393 > 112.26.1.1.34615: Flags [S], seq 3475975781, win 65535, options [mss 1460,sackOK,TS val 2881078 ecr 0,nop,wscale 6,mptcp join id 3 token 0x7761ebfe nonce 0x5f4b76c8], length 0
15:11:18.792763 IP 112.26.1.1.34615 > 112.26.1.8.38393: Flags [S.], seq 67390057, ack 3475975782, win 65535, options [mss 1460,sackOK,TS val 3119171 ecr 2881078,nop,wscale 6,mptcp join id 6 hmac 0x5eef369b1b5052f8 nonce 0x44bb49f2], length 0
15:11:18.793083 IP 112.26.1.8.38393 > 112.26.1.1.34615: Flags [.], ack 1, win 5567, options [nop,nop,TS val 2881177 ecr 3119171,mptcp join hmac 0xfa882c67f6be83c03803eec44ba866ef50b76129], length 0
15:11:18.927061 IP 112.26.1.8.38393 > 112.26.1.1.34615: Flags [.], ack 1, win 5567, options [nop,nop,TS val 2881177 ecr 3119171,mptcp join hmac 0xfa882c67f6be83c03803eec44ba866ef50b76129], length 0
15:11:19.005324 IP 112.26.1.1.34615 > 112.26.1.8.38393: Flags [.], ack 1, win 2678, options [nop,nop,TS val 3119384 ecr 2881177,mptcp dss ack 3193170700], length 0
15:11:19.123105 IP 112.26.1.1.34615 > 112.26.1.8.38393: Flags [.], seq 1:1429, ack 1, win 2678, options [nop,nop,TS val 3119384 ecr 2881177,mptcp dss ack 3193170700 seq 2058730907 subseq 1 len 1428 csum 0x44aa], length 1428
15:11:19.123465 IP 112.26.1.8.38393 > 112.26.1.1.34615: Flags [.], ack 1429, win 7118, options [nop,nop,TS val 2881508 ecr 3119384,mptcp dss ack 2058722339], length 0
15:11:19.202344 IP 112.26.1.8.38393 > 112.26.1.1.34615: Flags [.], ack 1429, win 7118, options [nop,nop,TS val 2881508 ecr 3119384,mptcp dss ack 2058722339], length 0
15:11:19.296577 IP 112.26.1.1.34615 > 112.26.1.8.38393: Flags [.], seq 1429:2857, ack 1, win 2678, options [nop,nop,TS val 3119384 ecr 2881177,mptcp dss ack 3193170700 seq 2058732335 subseq 1429 len 1428 csum 0xd87c], length 1428
15:11:19.296926 IP 112.26.1.8.38393 > 112.26.1.1.34615: Flags [.], ack 2857, win 7255, options [nop,nop,TS val 2881681 ecr 3119384,mptcp dss ack 2058722339], length 0
15:11:19.366018 IP 112.26.1.8.38393 > 112.26.1.1.34615: Flags [.], ack 2857, win 7255, options [nop,nop,TS val 2881681 ecr 3119384,mptcp dss ack 2058722339], length 0
15:11:19.413407 IP 112.26.1.1.34615 > 112.26.1.8.38393: Flags [.], seq 2857:4285, ack 1, win 2678, options [nop,nop,TS val 3119384 ecr 2881177,mptcp dss ack 3193170700 seq 2058733763 subseq 2857 len 1428 csum 0x615f], length 1428
15:11:19.413774 IP 112.26.1.8.38393 > 112.26.1.1.34615: Flags [.], ack 4285, win 7392, options [nop,nop,TS val 2881798 ecr 3119384,mptcp dss ack 2058722339], length 0
15:11:19.509501 IP 112.26.1.8.38393 > 112.26.1.1.34615: Flags [.], ack 4285, win 7392, options [nop,nop,TS val 2881798 ecr 3119384,mptcp dss ack 2058722339], length 0
15:11:19.575595 IP 112.26.1.1.34615 > 112.26.1.8.38393: Flags [.], seq 4285:5713, ack 1, win 2678, options [nop,nop,TS val 3119384 ecr 2881177,mptcp dss ack 3193170700 seq 2058735191 subseq 4285 len 1428 csum 0x82cf], length 1428
15:11:19.575908 IP 112.26.1.8.38393 > 112.26.1.1.34615: Flags [.], ack 5713, win 7574, options [nop,nop,TS val 2881960 ecr 3119384,mptcp dss ack 2058722339], length 0
15:11:19.628237 IP 112.26.1.8.38393 > 112.26.1.1.34615: Flags [.], ack 5713, win 7574, options [nop,nop,TS val 2881960 ecr 3119384,mptcp dss ack 2058722339], length 0
15:11:19.693217 IP 112.26.1.1.34615 > 112.26.1.8.38393: Flags [.], seq 5713:7141, ack 1, win 2678, options [nop,nop,TS val 3119384 ecr 2881177,mptcp dss ack 3193170700 seq 2058736619 subseq 5713 len 1428 csum 0x14ec], length 1428
15:11:19.693582 IP 112.26.1.8.38393 > 112.26.1.1.34615: Flags [.], ack 7141, win 7665, options [nop,nop,TS val 2882078 ecr 3119384,mptcp dss ack 2058722339], length 0
15:11:19.775418 IP 112.26.1.8.38393 > 112.26.1.1.34615: Flags [.], ack 7141, win 7665, options [nop,nop,TS val 2882078 ecr 3119384,mptcp dss ack 2058722339], length 0
15:11:19.869737 IP 112.26.1.1.34615 > 112.26.1.8.38393: Flags [.], seq 7141:8569, ack 1, win 2678, options [nop,nop,TS val 3119384 ecr 2881177,mptcp dss ack 3193170700 seq 2058738047 subseq 7141 len 1428 csum 0x62f4], length 1428
15:11:19.870059 IP 112.26.1.8.38393 > 112.26.1.1.34615: Flags [.], ack 8569, win 7894, options [nop,nop,TS val 2882254 ecr 3119384,mptcp dss ack 2058722339], length 0
15:11:19.992133 IP 112.26.1.8.38393 > 112.26.1.1.34615: Flags [.], ack 8569, win 7894, options [nop,nop,TS val 2882254 ecr 3119384,mptcp dss ack 2058722339], length 0
15:11:20.052714 IP 112.26.1.1.34615 > 112.26.1.8.38393: Flags [.], seq 9997:11425, ack 1, win 2678, options [nop,nop,TS val 3119385 ecr 2881177,mptcp dss ack 3193170700 seq 2058740903 subseq 9997 len 1428 csum 0x89b1], length 1428
15:11:20.053029 IP 112.26.1.8.38393 > 112.26.1.1.34615: Flags [.], ack 8569, win 8030, options [nop,nop,TS val 2882437 ecr 3119384,nop,nop,sack 1 {9997:11425},mptcp dss ack 2058726623], length 0
15:11:20.102518 IP 112.26.1.8.38393 > 112.26.1.1.34615: Flags [.], ack 8569, win 8030, options [nop,nop,TS val 2882437 ecr 3119384,nop,nop,sack 1 {9997:11425},mptcp dss ack 2058726623], length 0
15:11:20.193391 IP 112.26.1.1.34615 > 112.26.1.8.38393: Flags [.], seq 14281:15709, ack 1, win 4017, options [nop,nop,TS val 3119658 ecr 2881508,mptcp dss ack 3193170700 seq 2058769463 subseq 14281 len 1428 csum 0xfe82], length 1428
15:11:20.193756 IP 112.26.1.8.38393 > 112.26.1.1.34615: Flags [.], ack 8569, win 8213, options [nop,nop,TS val 2882578 ecr 3119384,nop,nop,sack 2 {14281:15709}{9997:11425},mptcp dss ack 2058739475], length 0
15:11:20.249356 IP 112.26.1.8.38393 > 112.26.1.1.34615: Flags [.], ack 8569, win 8213, options [nop,nop,TS val 2882578 ecr 3119384,nop,nop,sack 2 {14281:15709}{9997:11425},mptcp dss ack 2058739475], length 0
15:11:20.314575 IP 112.26.1.1.34615 > 112.26.1.8.38393: Flags [.], seq 15709:17137, ack 1, win 4017, options [nop,nop,TS val 3119658 ecr 2881508,mptcp dss ack 3193170700 seq 2058770891 subseq 15709 len 1428 csum 0x9090], length 1428
15:11:20.314825 IP 112.26.1.8.38393 > 112.26.1.1.34615: Flags [.], ack 8569, win 8304, options [nop,nop,TS val 2882699 ecr 3119384,nop,nop,sack 2 {14281:17137}{9997:11425},mptcp dss ack 2058739475], length 0
15:11:20.357949 IP 112.26.1.8.38393 > 112.26.1.1.34615: Flags [.], ack 8569, win 8304, options [nop,nop,TS val 2882699 ecr 3119384,nop,nop,sack 2 {14281:17137}{9997:11425},mptcp dss ack 2058739475], length 0
15:11:20.412976 IP 112.26.1.1.34615 > 112.26.1.8.38393: Flags [.], seq 18565:19993, ack 1, win 4017, options [nop,nop,TS val 3119824 ecr 2881681,mptcp dss ack 3193170700 seq 2058785171 subseq 18565 len 1428 csum 0xa9c1], length 1428
15:11:20.413317 IP 112.26.1.8.38393 > 112.26.1.1.34615: Flags [.], ack 8569, win 8487, options [nop,nop,TS val 2882797 ecr 3119384,nop,nop,sack 2 {18565:19993}{14281:17137},mptcp dss ack 2058739475], length 0
15:11:20.473069 IP 112.26.1.8.38393 > 112.26.1.1.34615: Flags [.], ack 8569, win 8487, options [nop,nop,TS val 2882797 ecr 3119384,nop,nop,sack 2 {18565:19993}{14281:17137},mptcp dss ack 2058739475], length 0
15:11:20.546353 IP 112.26.1.1.34615 > 112.26.1.8.38393: Flags [.], seq 21421:22849, ack 1, win 4017, options [nop,nop,TS val 3119965 ecr 2881798,mptcp dss ack 3193170700 seq 2058789455 subseq 21421 len 1428 csum 0x8718], length 1428
15:11:20.546710 IP 112.26.1.8.38393 > 112.26.1.1.34615: Flags [.], ack 8569, win 8624, options [nop,nop,TS val 2882931 ecr 3119384,nop,nop,sack 2 {21421:22849}{18565:19993},mptcp dss ack 2058739475], length 0
15:11:20.644510 IP 112.26.1.8.38393 > 112.26.1.1.34615: Flags [.], ack 8569, win 8624, options [nop,nop,TS val 2882931 ecr 3119384,nop,nop,sack 2 {21421:22849}{18565:19993},mptcp dss ack 2058739475], length 0
15:11:20.687207 IP 112.26.1.1.34615 > 112.26.1.8.38393: Flags [.], seq 24277:25705, ack 1, win 4017, options [nop,nop,TS val 3120087 ecr 2881960,mptcp dss ack 3193170700 seq 2058796595 subseq 24277 len 1428 csum 0x2b65], length 1428
15:11:20.687568 IP 112.26.1.8.38393 > 112.26.1.1.34615: Flags [.], ack 8569, win 8852, options [nop,nop,TS val 2883072 ecr 3119384,nop,nop,sack 2 {24277:25705}{21421:22849},mptcp dss ack 2058739475], length 0
15:11:20.783505 IP 112.26.1.8.38393 > 112.26.1.1.34615: Flags [.], ack 8569, win 8852, options [nop,nop,TS val 2883072 ecr 3119384,nop,nop,sack 2 {24277:25705}{21421:22849},mptcp dss ack 2058739475], length 0
15:11:20.858231 IP 112.26.1.1.34615 > 112.26.1.8.38393: Flags [.], seq 27133:28561, ack 1, win 4017, options [nop,nop,TS val 3120233 ecr 2882078,mptcp dss ack 3193170700 seq 2058802307 subseq 27133 len 1428 csum 0xa488], length 1428
15:11:20.858505 IP 112.26.1.8.38393 > 112.26.1.1.34615: Flags [.], ack 8569, win 8989, options [nop,nop,TS val 2883243 ecr 3119384,nop,nop,sack 2 {27133:28561}{24277:25705},mptcp dss ack 2058739475], length 0
15:11:20.952815 IP 112.26.1.8.38393 > 112.26.1.1.34615: Flags [.], ack 8569, win 8989, options [nop,nop,TS val 2883243 ecr 3119384,nop,nop,sack 2 {27133:28561}{24277:25705},mptcp dss ack 2058739475], length 0
15:11:21.002584 IP 112.26.1.1.34615 > 112.26.1.8.38393: Flags [.], seq 29989:31417, ack 1, win 4017, options [nop,nop,TS val 3120448 ecr 2882254,mptcp dss ack 3193170700 seq 2058748043 subseq 29989 len 1428 csum 0x45a6], length 1428
15:11:21.002936 IP 112.26.1.8.38393 > 112.26.1.1.34615: Flags [.], ack 8569, win 9125, options [nop,nop,TS val 2883387 ecr 3119384,nop,nop,sack 2 {29989:31417}{27133:28561},mptcp dss ack 2058739475], length 0
15:11:21.092564 IP 112.26.1.8.38393 > 112.26.1.1.34615: Flags [.], ack 8569, win 9125, options [nop,nop,TS val 2883387 ecr 3119384,nop,nop,sack 2 {29989:31417}{27133:28561},mptcp dss ack 2058739475], length 0
15:11:21.157210 IP 112.26.1.1.34615 > 112.26.1.8.38393: Flags [.], seq 31417:32845, ack 1, win 4017, options [nop,nop,TS val 3120672 ecr 2882437,mptcp dss ack 3193170700 seq 2058752327 subseq 31417 len 1428 csum 0x5593], length 1428
15:11:21.157614 IP 112.26.1.8.38393 > 112.26.1.1.34615: Flags [.], ack 8569, win 9399, options [nop,nop,TS val 2883541 ecr 3119384,nop,nop,sack 2 {29989:32845}{27133:28561},mptcp dss ack 2058739475], length 0
15:11:21.299631 IP 112.26.1.1.34615 > 112.26.1.8.38393: Flags [.], seq 8569:9997, ack 1, win 4017, options [nop,nop,TS val 3120712 ecr 2882578,mptcp dss ack 3193170700 seq 2058739475 subseq 8569 len 1428 csum 0x1651], length 1428
15:11:21.300034 IP 112.26.1.8.38393 > 112.26.1.1.34615: Flags [.], ack 11425, win 9445, options [nop,nop,TS val 2883684 ecr 3120712,nop,nop,sack 2 {29989:32845}{27133:28561},mptcp dss ack 2058742331], length 0
15:11:21.385627 IP 112.26.1.8.38393 > 112.26.1.1.34615: Flags [.], ack 8569, win 9399, options [nop,nop,TS val 2883541 ecr 3119384,nop,nop,sack 2 {29989:32845}{27133:28561},mptcp dss ack 2058739475], length 0
15:11:21.440322 IP 112.26.1.1.34615 > 112.26.1.8.38393: Flags [.], seq 11425:12853, ack 1, win 4017, options [nop,nop,TS val 3120835 ecr 2882699,mptcp dss ack 3193170700 seq 2058742331 subseq 11425 len 1428 csum 0x972b], length 1428
15:11:21.440736 IP 112.26.1.8.38393 > 112.26.1.1.34615: Flags [.], ack 12853, win 9582, options [nop,nop,TS val 2883824 ecr 3120835,nop,nop,sack 2 {29989:32845}{27133:28561},mptcp dss ack 2058743759], length 0
15:11:21.501833 IP 112.26.1.1.34615 > 112.26.1.8.38393: Flags [.], seq 12853:14281, ack 1, win 4017, options [nop,nop,TS val 3120944 ecr 2882797,mptcp dss ack 3193170700 seq 2058743759 subseq 12853 len 1428 csum 0x8ece], length 1428
15:11:21.502264 IP 112.26.1.8.38393 > 112.26.1.1.34615: Flags [.], ack 17137, win 9719, options [nop,nop,TS val 2883886 ecr 3120944,nop,nop,sack 2 {29989:32845}{27133:28561},mptcp dss ack 2058752327], length 0
15:11:21.581730 IP 112.26.1.1.34615 > 112.26.1.8.38393: Flags [.], seq 17137:18565, ack 1, win 4017, options [nop,nop,TS val 3121240 ecr 2883072,mptcp dss ack 3193170700 seq 2058783743 subseq 17137 len 1428 csum 0xc9e2], length 1428
15:11:21.582073 IP 112.26.1.8.38393 > 112.26.1.1.34615: Flags [.], ack 19993, win 9855, options [nop,nop,TS val 2883966 ecr 3121240,nop,nop,sack 2 {29989:32845}{27133:28561},mptcp dss ack 2058752327], length 0
15:11:21.651852 IP 112.26.1.8.38393 > 112.26.1.1.34615: Flags [.], ack 11425, win 9445, options [nop,nop,TS val 2883684 ecr 3120712,nop,nop,sack 2 {29989:32845}{27133:28561},mptcp dss ack 2058742331], length 0
15:11:21.717692 IP 112.26.1.1.34615 > 112.26.1.8.38393: Flags [.], seq 19993:21421, ack 1, win 4017, options [nop,nop,TS val 3121413 ecr 2883243,mptcp dss ack 3193170700 seq 2058788027 subseq 19993 len 1428 csum 0xe0e0], length 1428
15:11:21.718047 IP 112.26.1.8.38393 > 112.26.1.1.34615: Flags [.], ack 22849, win 9947, options [nop,nop,TS val 2884102 ecr 3121413,nop,nop,sack 2 {29989:32845}{27133:28561},mptcp dss ack 2058752327], length 0
15:11:21.802925 IP 112.26.1.8.38393 > 112.26.1.1.34615: Flags [.], ack 12853, win 9582, options [nop,nop,TS val 2883824 ecr 3120835,nop,nop,sack 2 {29989:32845}{27133:28561},mptcp dss ack 2058743759], length 0
15:11:21.838842 IP 112.26.1.1.34615 > 112.26.1.8.38393: Flags [.], seq 22849:24277, ack 1, win 4017, options [nop,nop,TS val 3121553 ecr 2883387,mptcp dss ack 3193170700 seq 2058795167 subseq 22849 len 1428 csum 0x17bb], length 1428
15:11:21.839197 IP 112.26.1.8.38393 > 112.26.1.1.34615: Flags [.], ack 25705, win 10084, options [nop,nop,TS val 2884223 ecr 3121553,nop,nop,sack 2 {29989:32845}{27133:28561},mptcp dss ack 2058752327], length 0
15:11:21.939670 IP 112.26.1.8.38393 > 112.26.1.1.34615: Flags [.], ack 17137, win 9719, options [nop,nop,TS val 2883886 ecr 3120944,nop,nop,sack 2 {29989:32845}{27133:28561},mptcp dss ack 2058752327], length 0
15:11:22.020865 IP 112.26.1.1.34615 > 112.26.1.8.38393: Flags [.], seq 25705:27133, ack 1, win 4017, options [nop,nop,TS val 3121841 ecr 2883541,mptcp dss ack 3193170700 seq 2058800879 subseq 25705 len 1428 csum 0x80b6], length 1428
15:11:22.021138 IP 112.26.1.8.38393 > 112.26.1.1.34615: Flags [.], ack 28561, win 10312, options [nop,nop,TS val 2884405 ecr 3121841,nop,nop,sack 1 {29989:32845},mptcp dss ack 2058752327], length 0
15:11:22.058202 IP 112.26.1.8.38393 > 112.26.1.1.34615: Flags [.], ack 19993, win 9855, options [nop,nop,TS val 2883966 ecr 3121240,nop,nop,sack 2 {29989:32845}{27133:28561},mptcp dss ack 2058752327], length 0
15:11:22.091203 IP 112.26.1.8.38393 > 112.26.1.1.34615: Flags [.], ack 22849, win 9947, options [nop,nop,TS val 2884102 ecr 3121413,nop,nop,sack 2 {29989:32845}{27133:28561},mptcp dss ack 2058752327], length 0
15:11:22.134235 IP 112.26.1.1.34615 > 112.26.1.8.38393: Flags [.], seq 28561:29989, ack 1, win 4017, options [nop,nop,TS val 3122108 ecr 2883684,mptcp dss ack 3193170700 seq 2058746615 subseq 28561 len 1428 csum 0xc072], length 1428
15:11:22.134672 IP 112.26.1.8.38393 > 112.26.1.1.34615: Flags [.], ack 32845, win 10449, options [nop,nop,TS val 2884519 ecr 3122108,mptcp dss ack 2058756611], length 0
15:11:22.259798 IP 112.26.1.8.38393 > 112.26.1.1.34615: Flags [.], ack 25705, win 10084, options [nop,nop,TS val 2884223 ecr 3121553,nop,nop,sack 2 {29989:32845}{27133:28561},mptcp dss ack 2058752327], length 0
15:11:22.313427 IP 112.26.1.1.34615 > 112.26.1.8.38393: Flags [.], seq 32845:34273, ack 1, win 4017, options [nop,nop,TS val 3122108 ecr 2883684,mptcp dss ack 3193170700 seq 2058828011 subseq 32845 len 1428 csum 0xef78], length 1428
15:11:22.313763 IP 112.26.1.8.38393 > 112.26.1.1.34615: Flags [.], ack 34273, win 10631, options [nop,nop,TS val 2884698 ecr 3122108,mptcp dss ack 2058756611], length 0
15:11:22.391205 IP 112.26.1.1.34615 > 112.26.1.8.38393: Flags [.], seq 34273:35701, ack 1, win 4017, options [nop,nop,TS val 3122108 ecr 2883684,mptcp dss ack 3193170700 seq 2058829439 subseq 34273 len 1428 csum 0x822a], length 1428
15:11:22.391528 IP 112.26.1.8.38393 > 112.26.1.1.34615: Flags [.], ack 35701, win 10768, options [nop,nop,TS val 2884775 ecr 3122108,mptcp dss ack 2058756611], length 0
15:11:22.457528 IP 112.26.1.8.38393 > 112.26.1.1.34615: Flags [.], ack 28561, win 10312, options [nop,nop,TS val 2884405 ecr 3121841,nop,nop,sack 1 {29989:32845},mptcp dss ack 2058752327], length 0
15:11:22.538302 IP 112.26.1.1.34615 > 112.26.1.8.38393: Flags [.], seq 35701:37129, ack 1, win 4017, options [nop,nop,TS val 3122259 ecr 2883824,mptcp dss ack 3193170700 seq 2058833723 subseq 35701 len 1428 csum 0x499a], length 1428
15:11:22.538623 IP 112.26.1.8.38393 > 112.26.1.1.34615: Flags [.], ack 37129, win 10905, options [nop,nop,TS val 2884923 ecr 3122259,mptcp dss ack 2058756611], length 0
15:11:22.601210 IP 112.26.1.8.38393 > 112.26.1.1.34615: Flags [.], ack 32845, win 10449, options [nop,nop,TS val 2884519 ecr 3122108,mptcp dss ack 2058756611], length 0
15:11:22.663150 IP 112.26.1.1.34615 > 112.26.1.8.38393: Flags [.], seq 37129:38557, ack 1, win 4017, options [nop,nop,TS val 3122259 ecr 2883824,mptcp dss ack 3193170700 seq 2058835151 subseq 37129 len 1428 csum 0x2780], length 1428
15:11:22.663417 IP 112.26.1.8.38393 > 112.26.1.1.34615: Flags [.], ack 38557, win 11133, options [nop,nop,TS val 2885047 ecr 3122259,mptcp dss ack 2058756611], length 0
15:11:22.735483 IP 112.26.1.8.38393 > 112.26.1.1.34615: Flags [.], ack 34273, win 10631, options [nop,nop,TS val 2884698 ecr 3122108,mptcp dss ack 2058756611], length 0
15:11:22.805309 IP 112.26.1.1.34615 > 112.26.1.8.38393: Flags [.], seq 38557:39985, ack 1, win 4017, options [nop,nop,TS val 3122398 ecr 2883886,mptcp dss ack 3193170700 seq 2058840863 subseq 38557 len 1428 csum 0x5221], length 1428
15:11:22.805613 IP 112.26.1.8.38393 > 112.26.1.1.34615: Flags [.], ack 39985, win 11315, options [nop,nop,TS val 2885189 ecr 3122398,mptcp dss ack 2058756611], length 0
15:11:22.869419 IP 112.26.1.8.38393 > 112.26.1.1.34615: Flags [.], ack 35701, win 10768, options [nop,nop,TS val 2884775 ecr 3122108,mptcp dss ack 2058756611], length 0
15:11:22.950568 IP 112.26.1.1.34615 > 112.26.1.8.38393: Flags [.], seq 39985:41413, ack 1, win 4017, options [nop,nop,TS val 3122398 ecr 2883886,mptcp dss ack 3193170700 seq 2058842291 subseq 39985 len 1428 csum 0xf3fe], length 1428
15:11:22.950859 IP 112.26.1.8.38393 > 112.26.1.1.34615: Flags [.], ack 41413, win 11407, options [nop,nop,TS val 2885335 ecr 3122398,mptcp dss ack 2058756611], length 0
15:11:23.034597 IP 112.26.1.1.34615 > 112.26.1.8.38393: Flags [.], seq 41413:42841, ack 1, win 4017, options [nop,nop,TS val 3122513 ecr 2883966,mptcp dss ack 3193170700 seq 2058846575 subseq 41413 len 1428 csum 0x762e], length 1428
15:11:23.034839 IP 112.26.1.8.38393 > 112.26.1.1.34615: Flags [.], ack 42841, win 11544, options [nop,nop,TS val 2885419 ecr 3122513,mptcp dss ack 2058756611], length 0
15:11:23.110724 IP 112.26.1.8.38393 > 112.26.1.1.34615: Flags [.], ack 37129, win 10905, options [nop,nop,TS val 2884923 ecr 3122259,mptcp dss ack 2058756611], length 0
15:11:23.151630 IP 112.26.1.1.34615 > 112.26.1.8.38393: Flags [.], seq 42841:44269, ack 1, win 4017, options [nop,nop,TS val 3122621 ecr 2884102,mptcp dss ack 3193170700 seq 2058849431 subseq 42841 len 1428 csum 0xcb2c], length 1428
15:11:23.151856 IP 112.26.1.8.38393 > 112.26.1.1.34615: Flags [.], ack 44269, win 11726, options [nop,nop,TS val 2885536 ecr 3122621,mptcp dss ack 2058756611], length 0
15:11:23.204301 IP 112.26.1.8.38393 > 112.26.1.1.34615: Flags [.], ack 38557, win 11133, options [nop,nop,TS val 2885047 ecr 3122259,mptcp dss ack 2058756611], length 0
15:11:23.248846 IP 112.26.1.1.34615 > 112.26.1.8.38393: Flags [.], seq 44269:45697, ack 1, win 4017, options [nop,nop,TS val 3122718 ecr 2884223,mptcp dss ack 3193170700 seq 2058852287 subseq 44269 len 1428 csum 0x27a6], length 1428
15:11:23.249230 IP 112.26.1.8.38393 > 112.26.1.1.34615: Flags [.], ack 45697, win 11817, options [nop,nop,TS val 2885633 ecr 3122718,mptcp dss ack 2058756611], length 0
15:11:23.312147 IP 112.26.1.1.34615 > 112.26.1.8.38393: Flags [.], seq 45697:47125, ack 1, win 4017, options [nop,nop,TS val 3122915 ecr 2884405,mptcp dss ack 3193170700 seq 2058853715 subseq 45697 len 1428 csum 0x7ca8], length 1428
15:11:23.312336 IP 112.26.1.8.38393 > 112.26.1.1.34615: Flags [.], ack 47125, win 11954, options [nop,nop,TS val 2885697 ecr 3122915,mptcp dss ack 2058756611], length 0
15:11:23.361829 IP 112.26.1.1.34615 > 112.26.1.8.38393: Flags [.], seq 47125:48553, ack 1, win 4017, options [nop,nop,TS val 3123057 ecr 2884519,mptcp dss ack 3193170700 seq 2058859427 subseq 47125 len 1428 csum 0xc83f], length 1428
15:11:23.362085 IP 112.26.1.8.38393 > 112.26.1.1.34615: Flags [.], ack 48553, win 12045, options [nop,nop,TS val 2885746 ecr 3123057,mptcp dss ack 2058782315], length 0
15:11:23.442286 IP 112.26.1.8.38393 > 112.26.1.1.34615: Flags [.], ack 41413, win 11407, options [nop,nop,TS val 2885335 ecr 3122398,mptcp dss ack 2058756611], length 0
15:11:23.484067 IP 112.26.1.1.34615 > 112.26.1.8.38393: Flags [.], seq 48553:49981, ack 1, win 4017, options [nop,nop,TS val 3123191 ecr 2884698,mptcp dss ack 3193170700 seq 2058863711 subseq 48553 len 1428 csum 0x8706], length 1428
15:11:23.484322 IP 112.26.1.8.38393 > 112.26.1.1.34615: Flags [.], ack 49981, win 12182, options [nop,nop,TS val 2885869 ecr 3123191,mptcp dss ack 2058782315], length 0
15:11:23.567294 IP 112.26.1.1.34615 > 112.26.1.8.38393: Flags [.], seq 49981:51409, ack 1, win 4017, options [nop,nop,TS val 3123325 ecr 2884775,mptcp dss ack 3193170700 seq 2058867995 subseq 49981 len 1428 csum 0x2c4f], length 1428
15:11:23.567550 IP 112.26.1.8.38393 > 112.26.1.1.34615: Flags [.], ack 51409, win 12274, options [nop,nop,TS val 2885952 ecr 3123325,mptcp dss ack 2058782315], length 0
15:11:23.631665 IP 112.26.1.8.38393 > 112.26.1.1.34615: Flags [.], ack 44269, win 11726, options [nop,nop,TS val 2885536 ecr 3122621,mptcp dss ack 2058756611], length 0
15:11:23.668789 IP 112.26.1.1.34615 > 112.26.1.8.38393: Flags [.], seq 51409:52837, ack 1, win 4017, options [nop,nop,TS val 3123325 ecr 2884775,mptcp dss ack 3193170700 seq 2058869423 subseq 51409 len 1428 csum 0x6587], length 1428
15:11:23.669070 IP 112.26.1.8.38393 > 112.26.1.1.34615: Flags [.], ack 52837, win 12410, options [nop,nop,TS val 2886053 ecr 3123325,mptcp dss ack 2058782315], length 0
15:11:23.721523 IP 112.26.1.8.38393 > 112.26.1.1.34615: Flags [.], ack 45697, win 11817, options [nop,nop,TS val 2885633 ecr 3122718,mptcp dss ack 2058756611], length 0
15:11:23.768878 IP 112.26.1.8.38393 > 112.26.1.1.34615: Flags [.], ack 47125, win 11954, options [nop,nop,TS val 2885697 ecr 3122915,mptcp dss ack 2058756611], length 0
15:11:23.813793 IP 112.26.1.1.34615 > 112.26.1.8.38393: Flags [.], seq 52837:54265, ack 1, win 4017, options [nop,nop,TS val 3123566 ecr 2884923,mptcp dss ack 3193170700 seq 2058875135 subseq 52837 len 1428 csum 0x15de], length 1428
15:11:23.814039 IP 112.26.1.8.38393 > 112.26.1.1.34615: Flags [.], ack 54265, win 12639, options [nop,nop,TS val 2886198 ecr 3123566,mptcp dss ack 2058782315], length 0
15:11:23.898280 IP 112.26.1.1.34615 > 112.26.1.8.38393: Flags [.], seq 54265:55693, ack 1, win 4017, options [nop,nop,TS val 3123660 ecr 2885047,mptcp dss ack 3193170700 seq 2058879419 subseq 54265 len 1428 csum 0x19e2], length 1428
15:11:23.898542 IP 112.26.1.8.38393 > 112.26.1.1.34615: Flags [.], ack 55693, win 12730, options [nop,nop,TS val 2886283 ecr 3123660,mptcp dss ack 2058782315], length 0
15:11:23.952700 IP 112.26.1.8.38393 > 112.26.1.1.34615: Flags [.], ack 49981, win 12182, options [nop,nop,TS val 2885869 ecr 3123191,mptcp dss ack 2058782315], length 0
15:11:23.996390 IP 112.26.1.1.34615 > 112.26.1.8.38393: Flags [.], seq 55693:57121, ack 1, win 4017, options [nop,nop,TS val 3123899 ecr 2885335,mptcp dss ack 3193170700 seq 2058885131 subseq 55693 len 1428 csum 0x9621], length 1428
15:11:23.996671 IP 112.26.1.8.38393 > 112.26.1.1.34615: Flags [.], ack 57121, win 12775, options [nop,nop,TS val 2886381 ecr 3123899,mptcp dss ack 2058782315], length 0
15:11:24.074492 IP 112.26.1.8.38393 > 112.26.1.1.34615: Flags [.], ack 51409, win 12274, options [nop,nop,TS val 2885952 ecr 3123325,mptcp dss ack 2058782315], length 0
15:11:24.118931 IP 112.26.1.1.34615 > 112.26.1.8.38393: Flags [.], seq 57121:58549, ack 1, win 4017, options [nop,nop,TS val 3123899 ecr 2885335,mptcp dss ack 3193170700 seq 2058886559 subseq 57121 len 1428 csum 0xcc33], length 1428
15:11:24.119215 IP 112.26.1.8.38393 > 112.26.1.1.34615: Flags [.], ack 58549, win 13004, options [nop,nop,TS val 2886503 ecr 3123899,mptcp dss ack 2058782315], length 0
15:11:24.189801 IP 112.26.1.1.34615 > 112.26.1.8.38393: Flags [.], seq 58549:59977, ack 1, win 4017, options [nop,nop,TS val 3123899 ecr 2885335,mptcp dss ack 3193170700 seq 2058887987 subseq 58549 len 1428 csum 0x9ef5], length 1428
15:11:24.190058 IP 112.26.1.8.38393 > 112.26.1.1.34615: Flags [.], ack 59977, win 13049, options [nop,nop,TS val 2886574 ecr 3123899,mptcp dss ack 2058782315], length 0
15:11:24.406018 IP 112.26.1.1.34615 > 112.26.1.8.38393: Flags [.], seq 59977:61405, ack 1, win 4017, options [nop,nop,TS val 3124184 ecr 2885536,mptcp dss ack 3193170700 seq 2058900839 subseq 59977 len 1428 csum 0xbc1f], length 1428
15:11:24.406316 IP 112.26.1.8.38393 > 112.26.1.1.34615: Flags [.], ack 61405, win 13140, options [nop,nop,TS val 2886790 ecr 3124184,mptcp dss ack 2058782315], length 0
15:11:24.451340 IP 112.26.1.8.38393 > 112.26.1.1.34615: Flags [.], ack 55693, win 12730, options [nop,nop,TS val 2886283 ecr 3123660,mptcp dss ack 2058782315], length 0
15:11:24.502927 IP 112.26.1.8.38393 > 112.26.1.1.34615: Flags [.], ack 57121, win 12775, options [nop,nop,TS val 2886381 ecr 3123899,mptcp dss ack 2058782315], length 0
15:11:24.539650 IP 112.26.1.1.34615 > 112.26.1.8.38393: Flags [.], seq 61405:62833, ack 1, win 4017, options [nop,nop,TS val 3124184 ecr 2885536,mptcp dss ack 3193170700 seq 2058902267 subseq 61405 len 1428 csum 0x98c7], length 1428
15:11:24.539927 IP 112.26.1.8.38393 > 112.26.1.1.34615: Flags [.], ack 62833, win 13323, options [nop,nop,TS val 2886924 ecr 3124184,mptcp dss ack 2058782315], length 0
15:11:24.613517 IP 112.26.1.1.34615 > 112.26.1.8.38393: Flags [.], seq 62833:64261, ack 1, win 4017, options [nop,nop,TS val 3124232 ecr 2885633,mptcp dss ack 3193170700 seq 2058903695 subseq 62833 len 1428 csum 0x3df2], length 1428
15:11:24.613756 IP 112.26.1.8.38393 > 112.26.1.1.34615: Flags [.], ack 64261, win 13414, options [nop,nop,TS val 2886998 ecr 3124232,mptcp dss ack 2058782315], length 0
15:11:24.690720 IP 112.26.1.8.38393 > 112.26.1.1.34615: Flags [.], ack 59977, win 13049, options [nop,nop,TS val 2886574 ecr 3123899,mptcp dss ack 2058782315], length 0
15:11:24.707888 IP 112.26.1.1.34615 > 112.26.1.8.38393: Flags [.], seq 64261:65689, ack 1, win 4017, options [nop,nop,TS val 3124232 ecr 2885633,mptcp dss ack 3193170700 seq 2058905123 subseq 64261 len 1428 csum 0x814d], length 1428
15:11:24.708156 IP 112.26.1.8.38393 > 112.26.1.1.34615: Flags [.], ack 65689, win 13505, options [nop,nop,TS val 2887092 ecr 3124232,mptcp dss ack 2058782315], length 0
15:11:24.834948 IP 112.26.1.8.38393 > 112.26.1.1.34615: Flags [.], ack 61405, win 13140, options [nop,nop,TS val 2886790 ecr 3124184,mptcp dss ack 2058782315], length 0
15:11:24.858972 IP 112.26.1.1.34615 > 112.26.1.8.38393: Flags [.], seq 65689:67117, ack 1, win 4017, options [nop,nop,TS val 3124430 ecr 2885697,mptcp dss ack 3193170700 seq 2058909407 subseq 65689 len 1428 csum 0x8c63], length 1428
15:11:24.859208 IP 112.26.1.8.38393 > 112.26.1.1.34615: Flags [.], ack 67117, win 13734, options [nop,nop,TS val 2887244 ecr 3124430,mptcp dss ack 2058895127], length 0
15:11:24.932712 IP 112.26.1.1.34615 > 112.26.1.8.38393: Flags [.], seq 67117:68545, ack 1, win 4017, options [nop,nop,TS val 3124621 ecr 2885869,mptcp dss ack 3193170700 seq 2058913691 subseq 67117 len 1428 csum 0xa6df], length 1428
15:11:24.932952 IP 112.26.1.8.38393 > 112.26.1.1.34615: Flags [.], ack 68545, win 13870, options [nop,nop,TS val 2887317 ecr 3124621,mptcp dss ack 2058895127], length 0
15:11:25.002823 IP 112.26.1.8.38393 > 112.26.1.1.34615: Flags [.], ack 62833, win 13323, options [nop,nop,TS val 2886924 ecr 3124184,mptcp dss ack 2058782315], length 0
15:11:25.057652 IP 112.26.1.1.34615 > 112.26.1.8.38393: Flags [.], seq 68545:69973, ack 1, win 4017, options [nop,nop,TS val 3124621 ecr 2885869,mptcp dss ack 3193170700 seq 2058915119 subseq 68545 len 1428 csum 0xe772], length 1428
15:11:25.057890 IP 112.26.1.8.38393 > 112.26.1.1.34615: Flags [.], ack 69973, win 14007, options [nop,nop,TS val 2887442 ecr 3124621,mptcp dss ack 2058895127], length 0
15:11:25.127868 IP 112.26.1.8.38393 > 112.26.1.1.34615: Flags [.], ack 64261, win 13414, options [nop,nop,TS val 2886998 ecr 3124232,mptcp dss ack 2058782315], length 0
15:11:25.160457 IP 112.26.1.8.38393 > 112.26.1.1.34615: Flags [.], ack 65689, win 13505, options [nop,nop,TS val 2887092 ecr 3124232,mptcp dss ack 2058782315], length 0
15:11:25.211691 IP 112.26.1.1.34615 > 112.26.1.8.38393: Flags [.], seq 69973:71401, ack 1, win 4017, options [nop,nop,TS val 3124895 ecr 2885952,mptcp dss ack 3193170700 seq 2058923687 subseq 69973 len 1428 csum 0xaf12], length 1428
15:11:25.211945 IP 112.26.1.8.38393 > 112.26.1.1.34615: Flags [.], ack 71401, win 14144, options [nop,nop,TS val 2887596 ecr 3124895,mptcp dss ack 2058895127], length 0
15:11:25.258901 IP 112.26.1.8.38393 > 112.26.1.1.34615: Flags [.], ack 67117, win 13734, options [nop,nop,TS val 2887244 ecr 3124430,mptcp dss ack 2058895127], length 0
15:11:25.311264 IP 112.26.1.8.38393 > 112.26.1.1.34615: Flags [.], ack 68545, win 13870, options [nop,nop,TS val 2887317 ecr 3124621,mptcp dss ack 2058895127], length 0
15:11:25.333727 IP 112.26.1.1.34615 > 112.26.1.8.38393: Flags [.], seq 71401:72829, ack 1, win 4017, options [nop,nop,TS val 3125211 ecr 2886283,mptcp dss ack 3193170700 seq 2058932255 subseq 71401 len 1428 csum 0x75ee], length 1428
15:11:25.333982 IP 112.26.1.8.38393 > 112.26.1.1.34615: Flags [.], ack 72829, win 14281, options [nop,nop,TS val 2887718 ecr 3125211,mptcp dss ack 2058895127], length 0
15:11:25.434334 IP 112.26.1.8.38393 > 112.26.1.1.34615: Flags [.], ack 69973, win 14007, options [nop,nop,TS val 2887442 ecr 3124621,mptcp dss ack 2058895127], length 0
15:11:25.470921 IP 112.26.1.8.38393 > 112.26.1.1.34615: Flags [.], ack 71401, win 14144, options [nop,nop,TS val 2887596 ecr 3124895,mptcp dss ack 2058895127], length 0
15:11:25.513773 IP 112.26.1.1.34615 > 112.26.1.8.38393: Flags [.], seq 72829:74257, ack 1, win 4017, options [nop,nop,TS val 3125211 ecr 2886283,mptcp dss ack 3193170700 seq 2058933683 subseq 72829 len 1428 csum 0x7ec3], length 1428
15:11:25.514011 IP 112.26.1.8.38393 > 112.26.1.1.34615: Flags [.], ack 74257, win 14464, options [nop,nop,TS val 2887898 ecr 3125211,mptcp dss ack 2058895127], length 0
15:11:25.594195 IP 112.26.1.1.34615 > 112.26.1.8.38393: Flags [.], seq 74257:75685, ack 1, win 4017, options [nop,nop,TS val 3125211 ecr 2886283,mptcp dss ack 3193170700 seq 2058935111 subseq 74257 len 1428 csum 0x3d3e], length 1428
15:11:25.594613 IP 112.26.1.8.38393 > 112.26.1.1.34615: Flags [.], ack 75685, win 14555, options [nop,nop,TS val 2887979 ecr 3125211,mptcp dss ack 2058895127], length 0
15:11:25.648237 IP 112.26.1.8.38393 > 112.26.1.1.34615: Flags [.], ack 72829, win 14281, options [nop,nop,TS val 2887718 ecr 3125211,mptcp dss ack 2058895127], length 0
15:11:25.706617 IP 112.26.1.1.34615 > 112.26.1.8.38393: Flags [.], seq 75685:77113, ack 1, win 4017, options [nop,nop,TS val 3125211 ecr 2886283,mptcp dss ack 3193170700 seq 2058936539 subseq 75685 len 1428 csum 0xceaf], length 1428
15:11:25.706914 IP 112.26.1.8.38393 > 112.26.1.1.34615: Flags [.], ack 77113, win 14692, options [nop,nop,TS val 2888091 ecr 3125211,mptcp dss ack 2058895127], length 0
15:11:25.743222 IP 112.26.1.1.34615 > 112.26.1.8.38393: Flags [.], seq 77113:78541, ack 1, win 4017, options [nop,nop,TS val 3125259 ecr 2886381,mptcp dss ack 3193170700 seq 2058939395 subseq 77113 len 1428 csum 0xa0a4], length 1428
15:11:25.743510 IP 112.26.1.8.38393 > 112.26.1.1.34615: Flags [.], ack 78541, win 14737, options [nop,nop,TS val 2888128 ecr 3125259,mptcp dss ack 2058895127], length 0
15:11:25.777113 IP 112.26.1.8.38393 > 112.26.1.1.34615: Flags [.], ack 74257, win 14464, options [nop,nop,TS val 2887898 ecr 3125211,mptcp dss ack 2058895127], length 0
15:11:25.830339 IP 112.26.1.1.34615 > 112.26.1.8.38393: Flags [.], seq 78541:79969, ack 1, win 4017, options [nop,nop,TS val 3125361 ecr 2886574,mptcp dss ack 3193170700 seq 2058940823 subseq 78541 len 1428 csum 0x527b], length 1428
15:11:25.830632 IP 112.26.1.8.38393 > 112.26.1.1.34615: Flags [.], ack 79969, win 14874, options [nop,nop,TS val 2888214 ecr 3125361,mptcp dss ack 2058895127], length 0
15:11:25.892877 IP 112.26.1.8.38393 > 112.26.1.1.34615: Flags [.], ack 75685, win 14555, options [nop,nop,TS val 2887979 ecr 3125211,mptcp dss ack 2058895127], length 0
15:11:25.923023 IP 112.26.1.8.38393 > 112.26.1.1.34615: Flags [.], ack 77113, win 14692, options [nop,nop,TS val 2888091 ecr 3125211,mptcp dss ack 2058895127], length 0
15:11:25.951385 IP 112.26.1.8.38393 > 112.26.1.1.34615: Flags [.], ack 78541, win 14737, options [nop,nop,TS val 2888128 ecr 3125259,mptcp dss ack 2058895127], length 0
15:11:26.024142 IP 112.26.1.8.38393 > 112.26.1.1.34615: Flags [.], ack 79969, win 14874, options [nop,nop,TS val 2888214 ecr 3125361,mptcp dss ack 2058895127], length 0
15:11:26.064117 IP 112.26.1.1.34615 > 112.26.1.8.38393: Flags [.], seq 82825:84253, ack 1, win 4017, options [nop,nop,TS val 3125910 ecr 2886924,mptcp dss ack 3193170700 seq 2058962243 subseq 82825 len 1428 csum 0x1863], length 1428
15:11:26.064345 IP 112.26.1.8.38393 > 112.26.1.1.34615: Flags [.], ack 79969, win 15102, options [nop,nop,TS val 2888448 ecr 3125361,nop,nop,sack 1 {82825:84253},mptcp dss ack 2058895127], length 0
15:11:26.135234 IP 112.26.1.1.34615 > 112.26.1.8.38393: Flags [.], seq 84253:85681, ack 1, win 4017, options [nop,nop,TS val 3126068 ecr 2886998,mptcp dss ack 3193170700 seq 2058965099 subseq 84253 len 1428 csum 0xb551], length 1428
15:11:26.135510 IP 112.26.1.8.38393 > 112.26.1.1.34615: Flags [.], ack 79969, win 15148, options [nop,nop,TS val 2888519 ecr 3125361,nop,nop,sack 1 {82825:85681},mptcp dss ack 2058895127], length 0
15:11:26.166952 IP 112.26.1.8.38393 > 112.26.1.1.34615: Flags [.], ack 79969, win 15102, options [nop,nop,TS val 2888448 ecr 3125361,nop,nop,sack 1 {82825:84253},mptcp dss ack 2058895127], length 0
15:11:26.254205 IP 112.26.1.8.38393 > 112.26.1.1.34615: Flags [.], ack 79969, win 15148, options [nop,nop,TS val 2888519 ecr 3125361,nop,nop,sack 1 {82825:85681},mptcp dss ack 2058895127], length 0
15:11:26.320422 IP 112.26.1.1.34615 > 112.26.1.8.38393: Flags [.], seq 87109:88537, ack 1, win 4017, options [nop,nop,TS val 3126184 ecr 2887244,mptcp dss ack 3193170700 seq 2058972239 subseq 87109 len 1428 csum 0xbd64], length 1428
15:11:26.320787 IP 112.26.1.8.38393 > 112.26.1.1.34615: Flags [.], ack 79969, win 15330, options [nop,nop,TS val 2888705 ecr 3125361,nop,nop,sack 2 {87109:88537}{82825:85681},mptcp dss ack 2058895127], length 0
15:11:26.409035 IP 112.26.1.1.34615 > 112.26.1.8.38393: Flags [.], seq 88537:89965, ack 1, win 4017, options [nop,nop,TS val 3126264 ecr 2887317,mptcp dss ack 3193170700 seq 2058973667 subseq 88537 len 1428 csum 0x1492], length 1428
15:11:26.409397 IP 112.26.1.8.38393 > 112.26.1.1.34615: Flags [.], ack 79969, win 15467, options [nop,nop,TS val 2888793 ecr 3125361,nop,nop,sack 2 {87109:89965}{82825:85681},mptcp dss ack 2058895127], length 0
15:11:26.464681 IP 112.26.1.8.38393 > 112.26.1.1.34615: Flags [.], ack 79969, win 15330, options [nop,nop,TS val 2888705 ecr 3125361,nop,nop,sack 2 {87109:88537}{82825:85681},mptcp dss ack 2058895127], length 0
15:11:26.522161 IP 112.26.1.1.34615 > 112.26.1.8.38393: Flags [.], seq 89965:91393, ack 1, win 4017, options [nop,nop,TS val 3126333 ecr 2887442,mptcp dss ack 3193170700 seq 2058976523 subseq 89965 len 1428 csum 0xee8b], length 1428
15:11:26.522444 IP 112.26.1.8.38393 > 112.26.1.1.34615: Flags [.], ack 79969, win 15650, options [nop,nop,TS val 2888906 ecr 3125361,nop,nop,sack 2 {87109:91393}{82825:85681},mptcp dss ack 2058895127], length 0
15:11:26.567566 IP 112.26.1.8.38393 > 112.26.1.1.34615: Flags [.], ack 79969, win 15467, options [nop,nop,TS val 2888793 ecr 3125361,nop,nop,sack 2 {87109:89965}{82825:85681},mptcp dss ack 2058895127], length 0
15:11:26.613317 IP 112.26.1.8.38393 > 112.26.1.1.34615: Flags [.], ack 79969, win 15650, options [nop,nop,TS val 2888906 ecr 3125361,nop,nop,sack 2 {87109:91393}{82825:85681},mptcp dss ack 2058895127], length 0
15:11:26.674939 IP 112.26.1.1.34615 > 112.26.1.8.38393: Flags [.], seq 92821:94249, ack 1, win 4017, options [nop,nop,TS val 3126576 ecr 2887718,mptcp dss ack 3193170700 seq 2058986519 subseq 92821 len 1428 csum 0x382d], length 1428
15:11:26.675243 IP 112.26.1.8.38393 > 112.26.1.1.34615: Flags [.], ack 79969, win 15878, options [nop,nop,TS val 2889059 ecr 3125361,nop,nop,sack 2 {92821:94249}{87109:91393},mptcp dss ack 2058895127], length 0
15:11:26.743656 IP 112.26.1.1.34615 > 112.26.1.8.38393: Flags [.], seq 94249:95677, ack 1, win 4017, options [nop,nop,TS val 3126576 ecr 2887718,mptcp dss ack 3193170700 seq 2058987947 subseq 94249 len 1428 csum 0x7081], length 1428
15:11:26.744008 IP 112.26.1.8.38393 > 112.26.1.1.34615: Flags [.], ack 79969, win 15969, options [nop,nop,TS val 2889128 ecr 3125361,nop,nop,sack 2 {92821:95677}{87109:91393},mptcp dss ack 2058895127], length 0
15:11:26.820724 IP 112.26.1.8.38393 > 112.26.1.1.34615: Flags [.], ack 79969, win 15878, options [nop,nop,TS val 2889059 ecr 3125361,nop,nop,sack 2 {92821:94249}{87109:91393},mptcp dss ack 2058895127], length 0
15:11:26.878946 IP 112.26.1.8.38393 > 112.26.1.1.34615: Flags [.], ack 79969, win 15969, options [nop,nop,TS val 2889128 ecr 3125361,nop,nop,sack 2 {92821:95677}{87109:91393},mptcp dss ack 2058895127], length 0
15:11:26.918999 IP 112.26.1.1.34615 > 112.26.1.8.38393: Flags [.], seq 97105:98533, ack 1, win 4017, options [nop,nop,TS val 3126890 ecr 2888128,mptcp dss ack 3193170700 seq 2058999371 subseq 97105 len 1428 csum 0xe2d8], length 1428
15:11:26.919361 IP 112.26.1.8.38393 > 112.26.1.1.34615: Flags [.], ack 79969, win 16152, options [nop,nop,TS val 2889303 ecr 3125361,nop,nop,sack 2 {97105:98533}{92821:95677},mptcp dss ack 2058895127], length 0
15:11:26.959095 IP 112.26.1.8.38393 > 112.26.1.1.34615: Flags [.], ack 79969, win 16152, options [nop,nop,TS val 2889303 ecr 3125361,nop,nop,sack 2 {97105:98533}{92821:95677},mptcp dss ack 2058895127], length 0
15:11:26.978976 IP 112.26.1.1.34615 > 112.26.1.8.38393: Flags [.], seq 98533:99961, ack 1, win 4017, options [nop,nop,TS val 3126890 ecr 2888128,mptcp dss ack 3193170700 seq 2059000799 subseq 98533 len 1428 csum 0x26be], length 1428
15:11:26.979352 IP 112.26.1.8.38393 > 112.26.1.1.34615: Flags [.], ack 79969, win 16197, options [nop,nop,TS val 2889363 ecr 3125361,nop,nop,sack 2 {97105:99961}{92821:95677},mptcp dss ack 2058895127], length 0
15:11:27.042987 IP 112.26.1.8.38393 > 112.26.1.1.34615: Flags [.], ack 79969, win 16197, options [nop,nop,TS val 2889363 ecr 3125361,nop,nop,sack 2 {97105:99961}{92821:95677},mptcp dss ack 2058895127], length 0
15:11:27.063947 IP 112.26.1.1.34615 > 112.26.1.8.38393: Flags [.], seq 99961:101389, ack 1, win 4017, options [nop,nop,TS val 3126890 ecr 2888128,mptcp dss ack 3193170700 seq 2059002227 subseq 99961 len 1428 csum 0x295f], length 1428
15:11:27.064302 IP 112.26.1.8.38393 > 112.26.1.1.34615: Flags [.], ack 79969, win 16243, options [nop,nop,TS val 2889448 ecr 3125361,nop,nop,sack 2 {97105:101389}{92821:95677},mptcp dss ack 2058895127], length 0
15:11:27.162132 IP 112.26.1.8.38393 > 112.26.1.1.34615: Flags [.], ack 79969, win 16243, options [nop,nop,TS val 2889448 ecr 3125361,nop,nop,sack 2 {97105:101389}{92821:95677},mptcp dss ack 2058895127], length 0
