15:11:18.716533 IP 112.26.1.8.38393 > 112.26.1.1.34615: Flags [S], seq 3475975781, win 65535, options [mss 1460,sackOK,TS val 2881078 ecr 0,nop,wscale 6,mptcp join id 3 token 0x7761ebfe nonce 0x5f4b76c8], length 0
15:11:18.720786 IP 112.26.1.1.34615 > 112.26.1.8.38393: Flags [S.], seq 67390057, ack 3475975782, win 65535, options [mss 1460,sackOK,TS val 3119171 ecr 2881078,nop,wscale 6,mptcp join id 6 hmac 0x5eef369b1b5052f8 nonce 0x44bb49f2], length 0
15:11:18.929747 IP 112.26.1.8.38393 > 112.26.1.1.34615: Flags [.], ack 1, win 5567, options [nop,nop,TS val 2881177 ecr 3119171,mptcp join hmac 0xfa882c67f6be83c03803eec44ba866ef50b76129], length 0
15:11:18.934688 IP 112.26.1.1.34615 > 112.26.1.8.38393: Flags [.], ack 1, win 2678, options [nop,nop,TS val 3119384 ecr 2881177,mptcp dss ack 3193170700], length 0
15:11:19.019275 IP 112.26.1.1.34615 > 112.26.1.8.38393: Flags [.], seq 1:1429, ack 1, win 2678, options [nop,nop,TS val 3119384 ecr 2881177,mptcp dss ack 3193170700 seq 2058730907 subseq 1 len 1428 csum 0x44aa], length 1428
15:11:19.082685 IP 112.26.1.1.34615 > 112.26.1.8.38393: Flags [.], seq 1429:2857, ack 1, win 2678, options [nop,nop,TS val 3119384 ecr 2881177,mptcp dss ack 3193170700 seq 2058732335 subseq 1429 len 1428 csum 0xd87c], length 1428
15:11:19.146527 IP 112.26.1.1.34615 > 112.26.1.8.38393: Flags [.], seq 2857:4285, ack 1, win 2678, options [nop,nop,TS val 3119384 ecr 2881177,mptcp dss ack 3193170700 seq 2058733763 subseq 2857 len 1428 csum 0x615f], length 1428
15:11:19.191655 IP 112.26.1.1.34615 > 112.26.1.8.38393: Flags [.], seq 4285:5713, ack 1, win 2678, options [nop,nop,TS val 3119384 ecr 2881177,mptcp dss ack 3193170700 seq 2058735191 subseq 4285 len 1428 csum 0x82cf], length 1428
15:11:19.204302 IP 112.26.1.8.38393 > 112.26.1.1.34615: Flags [.], ack 1429, win 7118, options [nop,nop,TS val 2881508 ecr 3119384,mptcp dss ack 2058722339], length 0
15:11:19.274534 IP 112.26.1.1.34615 > 112.26.1.8.38393: Flags [.], seq 5713:7141, ack 1, win 2678, options [nop,nop,TS val 3119384 ecr 2881177,mptcp dss ack 3193170700 seq 2058736619 subseq 5713 len 1428 csum 0x14ec], length 1428
15:11:19.340009 IP 112.26.1.1.34615 > 112.26.1.8.38393: Flags [.], seq 7141:8569, ack 1, win 2678, options [nop,nop,TS val 3119384 ecr 2881177,mptcp dss ack 3193170700 seq 2058738047 subseq 7141 len 1428 csum 0x62f4], length 1428
15:11:19.367587 IP 112.26.1.1.34615 > 112.26.1.8.38393: Flags [.], seq 8569:9997, ack 1, win 2678, options [nop,nop,TS val 3119385 ecr 2881177,mptcp dss ack 3193170700 seq 2058739475 subseq 8569 len 1428 csum 0x1651], length 1428
15:11:19.370227 IP 112.26.1.8.38393 > 112.26.1.1.34615: Flags [.], ack 2857, win 7255, options [nop,nop,TS val 2881681 ecr 3119384,mptcp dss ack 2058722339], length 0
15:11:19.441139 IP 112.26.1.1.34615 > 112.26.1.8.38393: Flags [.], seq 9997:11425, ack 1, win 2678, options [nop,nop,TS val 3119385 ecr 2881177,mptcp dss ack 3193170700 seq 2058740903 subseq 9997 len 1428 csum 0x89b1], length 1428
15:11:19.511139 IP 112.26.1.8.38393 > 112.26.1.1.34615: Flags [.], ack 4285, win 7392, options [nop,nop,TS val 2881798 ecr 3119384,mptcp dss ack 2058722339], length 0
15:11:19.522586 IP 112.26.1.1.34615 > 112.26.1.8.38393: Flags [.], seq 11425:12853, ack 1, win 2678, options [nop,nop,TS val 3119385 ecr 2881177,mptcp dss ack 3193170700 seq 2058742331 subseq 11425 len 1428 csum 0x972b], length 1428
15:11:19.622494 IP 112.26.1.1.34615 > 112.26.1.8.38393: Flags [.], seq 14281:15709, ack 1, win 4017, options [nop,nop,TS val 3119658 ecr 2881508,mptcp dss ack 3193170700 seq 2058769463 subseq 14281 len 1428 csum 0xfe82], length 1428
15:11:19.633172 IP 112.26.1.8.38393 > 112.26.1.1.34615: Flags [.], ack 5713, win 7574, options [nop,nop,TS val 2881960 ecr 3119384,mptcp dss ack 2058722339], length 0
15:11:19.700027 IP 112.26.1.1.34615 > 112.26.1.8.38393: Flags [.], seq 15709:17137, ack 1, win 4017, options [nop,nop,TS val 3119658 ecr 2881508,mptcp dss ack 3193170700 seq 2058770891 subseq 15709 len 1428 csum 0x9090], length 1428
15:11:19.766416 IP 112.26.1.1.34615 > 112.26.1.8.38393: Flags [.], seq 17137:18565, ack 1, win 4017, options [nop,nop,TS val 3119824 ecr 2881681,mptcp dss ack 3193170700 seq 2058783743 subseq 17137 len 1428 csum 0xc9e2], length 1428
15:11:19.778866 IP 112.26.1.8.38393 > 112.26.1.1.34615: Flags [.], ack 7141, win 7665, options [nop,nop,TS val 2882078 ecr 3119384,mptcp dss ack 2058722339], length 0
15:11:19.833188 IP 112.26.1.1.34615 > 112.26.1.8.38393: Flags [.], seq 18565:19993, ack 1, win 4017, options [nop,nop,TS val 3119824 ecr 2881681,mptcp dss ack 3193170700 seq 2058785171 subseq 18565 len 1428 csum 0xa9c1], length 1428
15:11:19.904392 IP 112.26.1.1.34615 > 112.26.1.8.38393: Flags [.], seq 19993:21421, ack 1, win 4017, options [nop,nop,TS val 3119965 ecr 2881798,mptcp dss ack 3193170700 seq 2058788027 subseq 19993 len 1428 csum 0xe0e0], length 1428
15:11:19.964136 IP 112.26.1.1.34615 > 112.26.1.8.38393: Flags [.], seq 21421:22849, ack 1, win 4017, options [nop,nop,TS val 3119965 ecr 2881798,mptcp dss ack 3193170700 seq 2058789455 subseq 21421 len 1428 csum 0x8718], length 1428
15:11:19.993532 IP 112.26.1.8.38393 > 112.26.1.1.34615: Flags [.], ack 8569, win 7894, options [nop,nop,TS val 2882254 ecr 3119384,mptcp dss ack 2058722339], length 0
15:11:20.043185 IP 112.26.1.1.34615 > 112.26.1.8.38393: Flags [.], seq 22849:24277, ack 1, win 4017, options [nop,nop,TS val 3120087 ecr 2881960,mptcp dss ack 3193170700 seq 2058795167 subseq 22849 len 1428 csum 0x17bb], length 1428
15:11:20.088070 IP 112.26.1.1.34615 > 112.26.1.8.38393: Flags [.], seq 24277:25705, ack 1, win 4017, options [nop,nop,TS val 3120087 ecr 2881960,mptcp dss ack 3193170700 seq 2058796595 subseq 24277 len 1428 csum 0x2b65], length 1428
15:11:20.135112 IP 112.26.1.8.38393 > 112.26.1.1.34615: Flags [.], ack 8569, win 8030, options [nop,nop,TS val 2882437 ecr 3119384,nop,nop,sack 1 {9997:11425},mptcp dss ack 2058726623], length 0
15:11:20.165557 IP 112.26.1.1.34615 > 112.26.1.8.38393: Flags [.], seq 25705:27133, ack 1, win 4017, options [nop,nop,TS val 3120233 ecr 2882078,mptcp dss ack 3193170700 seq 2058800879 subseq 25705 len 1428 csum 0x80b6], length 1428
15:11:20.244024 IP 112.26.1.1.34615 > 112.26.1.8.38393: Flags [.], seq 27133:28561, ack 1, win 4017, options [nop,nop,TS val 3120233 ecr 2882078,mptcp dss ack 3193170700 seq 2058802307 subseq 27133 len 1428 csum 0xa488], length 1428
15:11:20.257732 IP 112.26.1.8.38393 > 112.26.1.1.34615: Flags [.], ack 8569, win 8213, options [nop,nop,TS val 2882578 ecr 3119384,nop,nop,sack 2 {14281:15709}{9997:11425},mptcp dss ack 2058739475], length 0
15:11:20.341784 IP 112.26.1.1.34615 > 112.26.1.8.38393: Flags [.], seq 28561:29989, ack 1, win 4017, options [nop,nop,TS val 3120448 ecr 2882254,mptcp dss ack 3193170700 seq 2058746615 subseq 28561 len 1428 csum 0xc072], length 1428
15:11:20.380643 IP 112.26.1.8.38393 > 112.26.1.1.34615: Flags [.], ack 8569, win 8304, options [nop,nop,TS val 2882699 ecr 3119384,nop,nop,sack 2 {14281:17137}{9997:11425},mptcp dss ack 2058739475], length 0
15:11:20.424382 IP 112.26.1.1.34615 > 112.26.1.8.38393: Flags [.], seq 29989:31417, ack 1, win 4017, options [nop,nop,TS val 3120448 ecr 2882254,mptcp dss ack 3193170700 seq 2058748043 subseq 29989 len 1428 csum 0x45a6], length 1428
15:11:20.473549 IP 112.26.1.1.34615 > 112.26.1.8.38393: Flags [.], seq 31417:32845, ack 1, win 4017, options [nop,nop,TS val 3120672 ecr 2882437,mptcp dss ack 3193170700 seq 2058752327 subseq 31417 len 1428 csum 0x5593], length 1428
15:11:20.490104 IP 112.26.1.8.38393 > 112.26.1.1.34615: Flags [.], ack 8569, win 8487, options [nop,nop,TS val 2882797 ecr 3119384,nop,nop,sack 2 {18565:19993}{14281:17137},mptcp dss ack 2058739475], length 0
15:11:20.563227 IP 112.26.1.1.34615 > 112.26.1.8.38393: Flags [.], seq 8569:9997, ack 1, win 4017, options [nop,nop,TS val 3120712 ecr 2882578,mptcp dss ack 3193170700 seq 2058739475 subseq 8569 len 1428 csum 0x1651], length 1428
15:11:20.645822 IP 112.26.1.8.38393 > 112.26.1.1.34615: Flags [.], ack 8569, win 8624, options [nop,nop,TS val 2882931 ecr 3119384,nop,nop,sack 2 {21421:22849}{18565:19993},mptcp dss ack 2058739475], length 0
15:11:20.653791 IP 112.26.1.1.34615 > 112.26.1.8.38393: Flags [.], seq 11425:12853, ack 1, win 4017, options [nop,nop,TS val 3120835 ecr 2882699,mptcp dss ack 3193170700 seq 2058742331 subseq 11425 len 1428 csum 0x972b], length 1428
15:11:20.730496 IP 112.26.1.1.34615 > 112.26.1.8.38393: Flags [.], seq 12853:14281, ack 1, win 4017, options [nop,nop,TS val 3120944 ecr 2882797,mptcp dss ack 3193170700 seq 2058743759 subseq 12853 len 1428 csum 0x8ece], length 1428
15:11:20.786107 IP 112.26.1.8.38393 > 112.26.1.1.34615: Flags [.], ack 8569, win 8852, options [nop,nop,TS val 2883072 ecr 3119384,nop,nop,sack 2 {24277:25705}{21421:22849},mptcp dss ack 2058739475], length 0
15:11:20.814759 IP 112.26.1.1.34615 > 112.26.1.8.38393: Flags [.], seq 17137:18565, ack 1, win 4017, options [nop,nop,TS val 3121240 ecr 2883072,mptcp dss ack 3193170700 seq 2058783743 subseq 17137 len 1428 csum 0xc9e2], length 1428
15:11:20.954593 IP 112.26.1.8.38393 > 112.26.1.1.34615: Flags [.], ack 8569, win 8989, options [nop,nop,TS val 2883243 ecr 3119384,nop,nop,sack 2 {27133:28561}{24277:25705},mptcp dss ack 2058739475], length 0
15:11:20.964746 IP 112.26.1.1.34615 > 112.26.1.8.38393: Flags [.], seq 19993:21421, ack 1, win 4017, options [nop,nop,TS val 3121413 ecr 2883243,mptcp dss ack 3193170700 seq 2058788027 subseq 19993 len 1428 csum 0xe0e0], length 1428
15:11:21.098903 IP 112.26.1.8.38393 > 112.26.1.1.34615: Flags [.], ack 8569, win 9125, options [nop,nop,TS val 2883387 ecr 3119384,nop,nop,sack 2 {29989:31417}{27133:28561},mptcp dss ack 2058739475], length 0
15:11:21.102135 IP 112.26.1.1.34615 > 112.26.1.8.38393: Flags [.], seq 22849:24277, ack 1, win 4017, options [nop,nop,TS val 3121553 ecr 2883387,mptcp dss ack 3193170700 seq 2058795167 subseq 22849 len 1428 csum 0x17bb], length 1428
15:11:21.387112 IP 112.26.1.8.38393 > 112.26.1.1.34615: Flags [.], ack 8569, win 9399, options [nop,nop,TS val 2883541 ecr 3119384,nop,nop,sack 2 {29989:32845}{27133:28561},mptcp dss ack 2058739475], length 0
15:11:21.390604 IP 112.26.1.1.34615 > 112.26.1.8.38393: Flags [.], seq 25705:27133, ack 1, win 4017, options [nop,nop,TS val 3121841 ecr 2883541,mptcp dss ack 3193170700 seq 2058800879 subseq 25705 len 1428 csum 0x80b6], length 1428
15:11:21.654010 IP 112.26.1.8.38393 > 112.26.1.1.34615: Flags [.], ack 11425, win 9445, options [nop,nop,TS val 2883684 ecr 3120712,nop,nop,sack 2 {29989:32845}{27133:28561},mptcp dss ack 2058742331], length 0
15:11:21.658785 IP 112.26.1.1.34615 > 112.26.1.8.38393: Flags [.], seq 28561:29989, ack 1, win 4017, options [nop,nop,TS val 3122108 ecr 2883684,mptcp dss ack 3193170700 seq 2058746615 subseq 28561 len 1428 csum 0xc072], length 1428
15:11:21.722859 IP 112.26.1.1.34615 > 112.26.1.8.38393: Flags [.], seq 32845:34273, ack 1, win 4017, options [nop,nop,TS val 3122108 ecr 2883684,mptcp dss ack 3193170700 seq 2058828011 subseq 32845 len 1428 csum 0xef78], length 1428
15:11:21.805610 IP 112.26.1.8.38393 > 112.26.1.1.34615: Flags [.], ack 12853, win 9582, options [nop,nop,TS val 2883824 ecr 3120835,nop,nop,sack 2 {29989:32845}{27133:28561},mptcp dss ack 2058743759], length 0
15:11:21.816880 IP 112.26.1.1.34615 > 112.26.1.8.38393: Flags [.], seq 34273:35701, ack 1, win 4017, options [nop,nop,TS val 3122108 ecr 2883684,mptcp dss ack 3193170700 seq 2058829439 subseq 34273 len 1428 csum 0x822a], length 1428
15:11:21.885012 IP 112.26.1.1.34615 > 112.26.1.8.38393: Flags [.], seq 35701:37129, ack 1, win 4017, options [nop,nop,TS val 3122259 ecr 2883824,mptcp dss ack 3193170700 seq 2058833723 subseq 35701 len 1428 csum 0x499a], length 1428
15:11:21.944434 IP 112.26.1.8.38393 > 112.26.1.1.34615: Flags [.], ack 17137, win 9719, options [nop,nop,TS val 2883886 ecr 3120944,nop,nop,sack 2 {29989:32845}{27133:28561},mptcp dss ack 2058752327], length 0
15:11:21.950095 IP 112.26.1.1.34615 > 112.26.1.8.38393: Flags [.], seq 37129:38557, ack 1, win 4017, options [nop,nop,TS val 3122259 ecr 2883824,mptcp dss ack 3193170700 seq 2058835151 subseq 37129 len 1428 csum 0x2780], length 1428
15:11:22.027541 IP 112.26.1.1.34615 > 112.26.1.8.38393: Flags [.], seq 38557:39985, ack 1, win 4017, options [nop,nop,TS val 3122398 ecr 2883886,mptcp dss ack 3193170700 seq 2058840863 subseq 38557 len 1428 csum 0x5221], length 1428
15:11:22.059419 IP 112.26.1.8.38393 > 112.26.1.1.34615: Flags [.], ack 19993, win 9855, options [nop,nop,TS val 2883966 ecr 3121240,nop,nop,sack 2 {29989:32845}{27133:28561},mptcp dss ack 2058752327], length 0
15:11:22.116109 IP 112.26.1.1.34615 > 112.26.1.8.38393: Flags [.], seq 39985:41413, ack 1, win 4017, options [nop,nop,TS val 3122398 ecr 2883886,mptcp dss ack 3193170700 seq 2058842291 subseq 39985 len 1428 csum 0xf3fe], length 1428
15:11:22.148157 IP 112.26.1.1.34615 > 112.26.1.8.38393: Flags [.], seq 41413:42841, ack 1, win 4017, options [nop,nop,TS val 3122513 ecr 2883966,mptcp dss ack 3193170700 seq 2058846575 subseq 41413 len 1428 csum 0x762e], length 1428
15:11:22.167166 IP 112.26.1.8.38393 > 112.26.1.1.34615: Flags [.], ack 22849, win 9947, options [nop,nop,TS val 2884102 ecr 3121413,nop,nop,sack 2 {29989:32845}{27133:28561},mptcp dss ack 2058752327], length 0
15:11:22.226635 IP 112.26.1.1.34615 > 112.26.1.8.38393: Flags [.], seq 42841:44269, ack 1, win 4017, options [nop,nop,TS val 3122621 ecr 2884102,mptcp dss ack 3193170700 seq 2058849431 subseq 42841 len 1428 csum 0xcb2c], length 1428
15:11:22.261268 IP 112.26.1.8.38393 > 112.26.1.1.34615: Flags [.], ack 25705, win 10084, options [nop,nop,TS val 2884223 ecr 3121553,nop,nop,sack 2 {29989:32845}{27133:28561},mptcp dss ack 2058752327], length 0
15:11:22.295070 IP 112.26.1.1.34615 > 112.26.1.8.38393: Flags [.], seq 44269:45697, ack 1, win 4017, options [nop,nop,TS val 3122718 ecr 2884223,mptcp dss ack 3193170700 seq 2058852287 subseq 44269 len 1428 csum 0x27a6], length 1428
15:11:22.460841 IP 112.26.1.8.38393 > 112.26.1.1.34615: Flags [.], ack 28561, win 10312, options [nop,nop,TS val 2884405 ecr 3121841,nop,nop,sack 1 {29989:32845},mptcp dss ack 2058752327], length 0
15:11:22.464351 IP 112.26.1.1.34615 > 112.26.1.8.38393: Flags [.], seq 45697:47125, ack 1, win 4017, options [nop,nop,TS val 3122915 ecr 2884405,mptcp dss ack 3193170700 seq 2058853715 subseq 45697 len 1428 csum 0x7ca8], length 1428
15:11:22.602583 IP 112.26.1.8.38393 > 112.26.1.1.34615: Flags [.], ack 32845, win 10449, options [nop,nop,TS val 2884519 ecr 3122108,mptcp dss ack 2058756611], length 0
15:11:22.604730 IP 112.26.1.1.34615 > 112.26.1.8.38393: Flags [.], seq 47125:48553, ack 1, win 4017, options [nop,nop,TS val 3123057 ecr 2884519,mptcp dss ack 3193170700 seq 2058859427 subseq 47125 len 1428 csum 0xc83f], length 1428
15:11:22.737352 IP 112.26.1.8.38393 > 112.26.1.1.34615: Flags [.], ack 34273, win 10631, options [nop,nop,TS val 2884698 ecr 3122108,mptcp dss ack 2058756611], length 0
15:11:22.742890 IP 112.26.1.1.34615 > 112.26.1.8.38393: Flags [.], seq 48553:49981, ack 1, win 4017, options [nop,nop,TS val 3123191 ecr 2884698,mptcp dss ack 3193170700 seq 2058863711 subseq 48553 len 1428 csum 0x8706], length 1428
15:11:22.871088 IP 112.26.1.8.38393 > 112.26.1.1.34615: Flags [.], ack 35701, win 10768, options [nop,nop,TS val 2884775 ecr 3122108,mptcp dss ack 2058756611], length 0
15:11:22.875907 IP 112.26.1.1.34615 > 112.26.1.8.38393: Flags [.], seq 49981:51409, ack 1, win 4017, options [nop,nop,TS val 3123325 ecr 2884775,mptcp dss ack 3193170700 seq 2058867995 subseq 49981 len 1428 csum 0x2c4f], length 1428
15:11:22.952646 IP 112.26.1.1.34615 > 112.26.1.8.38393: Flags [.], seq 51409:52837, ack 1, win 4017, options [nop,nop,TS val 3123325 ecr 2884775,mptcp dss ack 3193170700 seq 2058869423 subseq 51409 len 1428 csum 0x6587], length 1428
15:11:23.111866 IP 112.26.1.8.38393 > 112.26.1.1.34615: Flags [.], ack 37129, win 10905, options [nop,nop,TS val 2884923 ecr 3122259,mptcp dss ack 2058756611], length 0
15:11:23.117326 IP 112.26.1.1.34615 > 112.26.1.8.38393: Flags [.], seq 52837:54265, ack 1, win 4017, options [nop,nop,TS val 3123566 ecr 2884923,mptcp dss ack 3193170700 seq 2058875135 subseq 52837 len 1428 csum 0x15de], length 1428
15:11:23.206708 IP 112.26.1.8.38393 > 112.26.1.1.34615: Flags [.], ack 38557, win 11133, options [nop,nop,TS val 2885047 ecr 3122259,mptcp dss ack 2058756611], length 0
15:11:23.210677 IP 112.26.1.1.34615 > 112.26.1.8.38393: Flags [.], seq 54265:55693, ack 1, win 4017, options [nop,nop,TS val 3123660 ecr 2885047,mptcp dss ack 3193170700 seq 2058879419 subseq 54265 len 1428 csum 0x19e2], length 1428
15:11:23.448853 IP 112.26.1.1.34615 > 112.26.1.8.38393: Flags [.], seq 55693:57121, ack 1, win 4017, options [nop,nop,TS val 3123899 ecr 2885335,mptcp dss ack 3193170700 seq 2058885131 subseq 55693 len 1428 csum 0x9621], length 1428
15:11:23.519956 IP 112.26.1.1.34615 > 112.26.1.8.38393: Flags [.], seq 57121:58549, ack 1, win 4017, options [nop,nop,TS val 3123899 ecr 2885335,mptcp dss ack 3193170700 seq 2058886559 subseq 57121 len 1428 csum 0xcc33], length 1428
15:11:23.575776 IP 112.26.1.1.34615 > 112.26.1.8.38393: Flags [.], seq 58549:59977, ack 1, win 4017, options [nop,nop,TS val 3123899 ecr 2885335,mptcp dss ack 3193170700 seq 2058887987 subseq 58549 len 1428 csum 0x9ef5], length 1428
15:11:23.733334 IP 112.26.1.1.34615 > 112.26.1.8.38393: Flags [.], seq 59977:61405, ack 1, win 4017, options [nop,nop,TS val 3124184 ecr 2885536,mptcp dss ack 3193170700 seq 2058900839 subseq 59977 len 1428 csum 0xbc1f], length 1428
15:11:23.825359 IP 112.26.1.1.34615 > 112.26.1.8.38393: Flags [.], seq 61405:62833, ack 1, win 4017, options [nop,nop,TS val 3124184 ecr 2885536,mptcp dss ack 3193170700 seq 2058902267 subseq 61405 len 1428 csum 0x98c7], length 1428
15:11:23.912890 IP 112.26.1.1.34615 > 112.26.1.8.38393: Flags [.], seq 62833:64261, ack 1, win 4017, options [nop,nop,TS val 3124232 ecr 2885633,mptcp dss ack 3193170700 seq 2058903695 subseq 62833 len 1428 csum 0x3df2], length 1428
15:11:23.965807 IP 112.26.1.1.34615 > 112.26.1.8.38393: Flags [.], seq 64261:65689, ack 1, win 4017, options [nop,nop,TS val 3124232 ecr 2885633,mptcp dss ack 3193170700 seq 2058905123 subseq 64261 len 1428 csum 0x814d], length 1428
15:11:24.077536 IP 112.26.1.1.34615 > 112.26.1.8.38393: Flags [.], seq 65689:67117, ack 1, win 4017, options [nop,nop,TS val 3124430 ecr 2885697,mptcp dss ack 3193170700 seq 2058909407 subseq 65689 len 1428 csum 0x8c63], length 1428
15:11:24.170777 IP 112.26.1.1.34615 > 112.26.1.8.38393: Flags [.], seq 67117:68545, ack 1, win 4017, options [nop,nop,TS val 3124621 ecr 2885869,mptcp dss ack 3193170700 seq 2058913691 subseq 67117 len 1428 csum 0xa6df], length 1428
15:11:24.220969 IP 112.26.1.1.34615 > 112.26.1.8.38393: Flags [.], seq 68545:69973, ack 1, win 4017, options [nop,nop,TS val 3124621 ecr 2885869,mptcp dss ack 3193170700 seq 2058915119 subseq 68545 len 1428 csum 0xe772], length 1428
15:11:24.443383 IP 112.26.1.1.34615 > 112.26.1.8.38393: Flags [.], seq 69973:71401, ack 1, win 4017, options [nop,nop,TS val 3124895 ecr 2885952,mptcp dss ack 3193170700 seq 2058923687 subseq 69973 len 1428 csum 0xaf12], length 1428
15:11:24.759761 IP 112.26.1.1.34615 > 112.26.1.8.38393: Flags [.], seq 71401:72829, ack 1, win 4017, options [nop,nop,TS val 3125211 ecr 2886283,mptcp dss ack 3193170700 seq 2058932255 subseq 71401 len 1428 csum 0x75ee], length 1428
15:11:24.824712 IP 112.26.1.1.34615 > 112.26.1.8.38393: Flags [.], seq 72829:74257, ack 1, win 4017, options [nop,nop,TS val 3125211 ecr 2886283,mptcp dss ack 3193170700 seq 2058933683 subseq 72829 len 1428 csum 0x7ec3], length 1428
15:11:24.897406 IP 112.26.1.1.34615 > 112.26.1.8.38393: Flags [.], seq 74257:75685, ack 1, win 4017, options [nop,nop,TS val 3125211 ecr 2886283,mptcp dss ack 3193170700 seq 2058935111 subseq 74257 len 1428 csum 0x3d3e], length 1428
15:11:24.959387 IP 112.26.1.1.34615 > 112.26.1.8.38393: Flags [.], seq 75685:77113, ack 1, win 4017, options [nop,nop,TS val 3125211 ecr 2886283,mptcp dss ack 3193170700 seq 2058936539 subseq 75685 len 1428 csum 0xceaf], length 1428
15:11:25.003297 IP 112.26.1.1.34615 > 112.26.1.8.38393: Flags [.], seq 77113:78541, ack 1, win 4017, options [nop,nop,TS val 3125259 ecr 2886381,mptcp dss ack 3193170700 seq 2058939395 subseq 77113 len 1428 csum 0xa0a4], length 1428
15:11:25.062210 IP 112.26.1.1.34615 > 112.26.1.8.38393: Flags [.], seq 78541:79969, ack 1, win 4017, options [nop,nop,TS val 3125361 ecr 2886574,mptcp dss ack 3193170700 seq 2058940823 subseq 78541 len 1428 csum 0x527b], length 1428
15:11:25.126674 IP 112.26.1.1.34615 > 112.26.1.8.38393: Flags [.], seq 79969:81397, ack 1, win 4017, options [nop,nop,TS val 3125361 ecr 2886574,mptcp dss ack 3193170700 seq 2058942251 subseq 79969 len 1428 csum 0x2b17], length 1428
15:11:25.194053 IP 112.26.1.1.34615 > 112.26.1.8.38393: Flags [.], seq 81397:82825, ack 1, win 4017, options [nop,nop,TS val 3125564 ecr 2886790,mptcp dss ack 3193170700 seq 2058947963 subseq 81397 len 1428 csum 0x5512], length 1428
15:11:25.458863 IP 112.26.1.1.34615 > 112.26.1.8.38393: Flags [.], seq 82825:84253, ack 1, win 4017, options [nop,nop,TS val 3125910 ecr 2886924,mptcp dss ack 3193170700 seq 2058962243 subseq 82825 len 1428 csum 0x1863], length 1428
15:11:25.617392 IP 112.26.1.1.34615 > 112.26.1.8.38393: Flags [.], seq 84253:85681, ack 1, win 4017, options [nop,nop,TS val 3126068 ecr 2886998,mptcp dss ack 3193170700 seq 2058965099 subseq 84253 len 1428 csum 0xb551], length 1428
15:11:25.672882 IP 112.26.1.1.34615 > 112.26.1.8.38393: Flags [.], seq 85681:87109, ack 1, win 4017, options [nop,nop,TS val 3126113 ecr 2887092,mptcp dss ack 3193170700 seq 2058967955 subseq 85681 len 1428 csum 0x482e], length 1428
15:11:25.731832 IP 112.26.1.1.34615 > 112.26.1.8.38393: Flags [.], seq 87109:88537, ack 1, win 4017, options [nop,nop,TS val 3126184 ecr 2887244,mptcp dss ack 3193170700 seq 2058972239 subseq 87109 len 1428 csum 0xbd64], length 1428
15:11:25.816483 IP 112.26.1.1.34615 > 112.26.1.8.38393: Flags [.], seq 88537:89965, ack 1, win 4017, options [nop,nop,TS val 3126264 ecr 2887317,mptcp dss ack 3193170700 seq 2058973667 subseq 88537 len 1428 csum 0x1492], length 1428
15:11:25.881168 IP 112.26.1.1.34615 > 112.26.1.8.38393: Flags [.], seq 89965:91393, ack 1, win 4017, options [nop,nop,TS val 3126333 ecr 2887442,mptcp dss ack 3193170700 seq 2058976523 subseq 89965 len 1428 csum 0xee8b], length 1428
15:11:25.972205 IP 112.26.1.1.34615 > 112.26.1.8.38393: Flags [.], seq 91393:92821, ack 1, win 4017, options [nop,nop,TS val 3126422 ecr 2887596,mptcp dss ack 3193170700 seq 2058980807 subseq 91393 len 1428 csum 0x236f], length 1428
15:11:26.124524 IP 112.26.1.1.34615 > 112.26.1.8.38393: Flags [.], seq 92821:94249, ack 1, win 4017, options [nop,nop,TS val 3126576 ecr 2887718,mptcp dss ack 3193170700 seq 2058986519 subseq 92821 len 1428 csum 0x382d], length 1428
15:11:26.170863 IP 112.26.1.1.34615 > 112.26.1.8.38393: Flags [.], seq 94249:95677, ack 1, win 4017, options [nop,nop,TS val 3126576 ecr 2887718,mptcp dss ack 3193170700 seq 2058987947 subseq 94249 len 1428 csum 0x7081], length 1428
15:11:26.257632 IP 112.26.1.1.34615 > 112.26.1.8.38393: Flags [.], seq 95677:97105, ack 1, win 4017, options [nop,nop,TS val 3126697 ecr 2887898,mptcp dss ack 3193170700 seq 2058992231 subseq 95677 len 1428 csum 0x8580], length 1428
15:11:26.441265 IP 112.26.1.1.34615 > 112.26.1.8.38393: Flags [.], seq 97105:98533, ack 1, win 4017, options [nop,nop,TS val 3126890 ecr 2888128,mptcp dss ack 3193170700 seq 2058999371 subseq 97105 len 1428 csum 0xe2d8], length 1428
15:11:26.483597 IP 112.26.1.1.34615 > 112.26.1.8.38393: Flags [.], seq 98533:99961, ack 1, win 4017, options [nop,nop,TS val 3126890 ecr 2888128,mptcp dss ack 3193170700 seq 2059000799 subseq 98533 len 1428 csum 0x26be], length 1428
15:11:26.550609 IP 112.26.1.1.34615 > 112.26.1.8.38393: Flags [.], seq 99961:101389, ack 1, win 4017, options [nop,nop,TS val 3126890 ecr 2888128,mptcp dss ack 3193170700 seq 2059002227 subseq 99961 len 1428 csum 0x295f], length 1428
15:11:26.583378 IP 112.26.1.1.34615 > 112.26.1.8.38393: Flags [.], seq 101389:102817, ack 1, win 4017, options [nop,nop,TS val 3126963 ecr 2888214,mptcp dss ack 3193170700 seq 2059003655 subseq 101389 len 1428 csum 0x7ae0], length 1428
15:11:26.673185 IP 112.26.1.1.34615 > 112.26.1.8.38393: Flags [.], seq 102817:104245, ack 1, win 4017, options [nop,nop,TS val 3127121 ecr 2888448,mptcp dss ack 3193170700 seq 2059006511 subseq 102817 len 1428 csum 0x4400], length 1428
15:11:26.780941 IP 112.26.1.1.34615 > 112.26.1.8.38393: Flags [.], seq 79969:81397, ack 1, win 4017, options [nop,nop,TS val 3127216 ecr 2888519,mptcp dss ack 3193170700 seq 2058942251 subseq 79969 len 1428 csum 0x2b17], length 1428
15:11:26.876106 IP 112.26.1.1.34615 > 112.26.1.8.38393: Flags [.], seq 81397:82825, ack 1, win 4017, options [nop,nop,TS val 3127325 ecr 2888705,mptcp dss ack 3193170700 seq 2058947963 subseq 81397 len 1428 csum 0x5512], length 1428
15:11:27.266620 IP 112.26.1.1.34615 > 112.26.1.8.38393: Flags [.], seq 85681:87109, ack 1, win 4017, options [nop,nop,TS val 3127718 ecr 2889059,mptcp dss ack 3193170700 seq 2058967955 subseq 85681 len 1428 csum 0x482e], length 1428
15:11:27.402657 IP 112.26.1.1.34615 > 112.26.1.8.38393: Flags [.], seq 91393:92821, ack 1, win 4017, options [nop,nop,TS val 3127852 ecr 2889303,mptcp dss ack 3193170700 seq 2058980807 subseq 91393 len 1428 csum 0x236f], length 1428
15:11:27.478588 IP 112.26.1.1.34615 > 112.26.1.8.38393: Flags [.], seq 95677:97105, ack 1, win 4017, options [nop,nop,TS val 3127852 ecr 2889303,mptcp dss ack 3193170700 seq 2058992231 subseq 95677 len 1428 csum 0x8580], length 1428
15:11:27.561718 IP 112.26.1.1.34615 > 112.26.1.8.38393: Flags [.], seq 104245:105673, ack 1, win 4017, options [nop,nop,TS val 3127959 ecr 2889363,mptcp dss ack 3193170700 seq 2059036499 subseq 104245 len 1428 csum 0x626], length 1428
15:11:27.690814 IP 112.26.1.1.34615 > 112.26.1.8.38393: Flags [.], seq 105673:107101, ack 1, win 4017, options [nop,nop,TS val 3128141 ecr 2889448,mptcp dss ack 3193170700 seq 2059040783 subseq 105673 len 1428 csum 0x6617], length 1428
15:11:27.748008 IP 112.26.1.1.34615 > 112.26.1.8.38393: Flags [.], seq 101389:102817, ack 1, win 4017, options [nop,nop,TS val 3128141 ecr 2889626,mptcp dss ack 3193170700 seq 2059003655 subseq 101389 len 1428 csum 0x7ae0], length 1428
15:11:27.847013 IP 112.26.1.1.34615 > 112.26.1.8.38393: Flags [.], seq 107101:108529, ack 1, win 4017, options [nop,nop,TS val 3128286 ecr 2889702,mptcp dss ack 3193170700 seq 2059049351 subseq 107101 len 1428 csum 0xa44f], length 1428
15:11:27.939888 IP 112.26.1.1.34615 > 112.26.1.8.38393: Flags [.], seq 108529:109957, ack 1, win 4017, options [nop,nop,TS val 3128286 ecr 2889702,mptcp dss ack 3193170700 seq 2059050779 subseq 108529 len 1428 csum 0x8cca], length 1428
15:11:28.020365 IP 112.26.1.1.34615 > 112.26.1.8.38393: Flags [.], seq 109957:111385, ack 1, win 4017, options [nop,nop,TS val 3128286 ecr 2889702,mptcp dss ack 3193170700 seq 2059052207 subseq 109957 len 1428 csum 0x59f3], length 1428
15:11:28.056262 IP 112.26.1.1.34615 > 112.26.1.8.38393: Flags [.], seq 111385:112813, ack 1, win 4017, options [nop,nop,TS val 3128286 ecr 2889702,mptcp dss ack 3193170700 seq 2059053635 subseq 111385 len 1428 csum 0x4a0f], length 1428
15:11:28.109756 IP 112.26.1.1.34615 > 112.26.1.8.38393: Flags [.], seq 112813:114241, ack 1, win 4017, options [nop,nop,TS val 3128438 ecr 2889878,mptcp dss ack 3193170700 seq 2059060775 subseq 112813 len 1428 csum 0x2b62], length 1428
15:11:28.155172 IP 112.26.1.1.34615 > 112.26.1.8.38393: Flags [.], seq 114241:115669, ack 1, win 4017, options [nop,nop,TS val 3128596 ecr 2889992,mptcp dss ack 3193170700 seq 2059069343 subseq 114241 len 1428 csum 0xbe6b], length 1428
15:11:28.354369 IP 112.26.1.1.34615 > 112.26.1.8.38393: Flags [.], seq 115669:117097, ack 1, win 4017, options [nop,nop,TS val 3128804 ecr 2890161,mptcp dss ack 3193170700 seq 2059076483 subseq 115669 len 1428 csum 0x8b96], length 1428
15:11:28.478889 IP 112.26.1.1.34615 > 112.26.1.8.38393: Flags [.], seq 117097:118525, ack 1, win 4017, options [nop,nop,TS val 3128912 ecr 2890307,mptcp dss ack 3193170700 seq 2059079339 subseq 117097 len 1428 csum 0xdac3], length 1428
15:11:28.639235 IP 112.26.1.1.34615 > 112.26.1.8.38393: Flags [.], seq 118525:119953, ack 1, win 4017, options [nop,nop,TS val 3129088 ecr 2890422,mptcp dss ack 3193170700 seq 2059027931 subseq 118525 len 1428 csum 0x927b], length 1428
15:11:28.735307 IP 112.26.1.1.34615 > 112.26.1.8.38393: Flags [.], seq 119953:121381, ack 1, win 4017, options [nop,nop,TS val 3129184 ecr 2890580,mptcp dss ack 3193170700 seq 2059033643 subseq 119953 len 1428 csum 0x8849], length 1428
15:11:28.814653 IP 112.26.1.1.34615 > 112.26.1.8.38393: Flags [.], seq 101389:102817, ack 1, win 4017, options [nop,nop,TS val 3129265 ecr 2890691,mptcp dss ack 3193170700 seq 2059003655 subseq 101389 len 1428 csum 0x7ae0], length 1428
15:11:29.087160 IP 112.26.1.1.34615 > 112.26.1.8.38393: Flags [.], seq 121381:122809, ack 1, win 4017, options [nop,nop,TS val 3129538 ecr 2890799,mptcp dss ack 3193170700 seq 2059057919 subseq 121381 len 1428 csum 0x3862], length 1428
15:11:29.186358 IP 112.26.1.1.34615 > 112.26.1.8.38393: Flags [.], seq 109957:111385, ack 1, win 4017, options [nop,nop,TS val 3129609 ecr 2890990,mptcp dss ack 3193170700 seq 2059052207 subseq 109957 len 1428 csum 0x59f3], length 1428
15:11:29.287325 IP 112.26.1.1.34615 > 112.26.1.8.38393: Flags [.], seq 112813:114241, ack 1, win 4017, options [nop,nop,TS val 3129738 ecr 2891106,mptcp dss ack 3193170700 seq 2059060775 subseq 112813 len 1428 csum 0x2b62], length 1428
15:11:29.393170 IP 112.26.1.1.34615 > 112.26.1.8.38393: Flags [.], seq 122809:124237, ack 1, win 4017, options [nop,nop,TS val 3129844 ecr 2891240,mptcp dss ack 3193170700 seq 2059065059 subseq 122809 len 1428 csum 0xa92c], length 1428
15:11:29.467787 IP 112.26.1.1.34615 > 112.26.1.8.38393: Flags [.], seq 124237:125665, ack 1, win 4017, options [nop,nop,TS val 3129919 ecr 2891331,mptcp dss ack 3193170700 seq 2059066487 subseq 124237 len 1428 csum 0xce38], length 1428
15:11:29.752949 IP 112.26.1.1.34615 > 112.26.1.8.38393: Flags [.], seq 125665:127093, ack 1, win 4017, options [nop,nop,TS val 3130201 ecr 2891481,mptcp dss ack 3193170700 seq 2059087907 subseq 125665 len 1428 csum 0xafe0], length 1428
15:11:29.809892 IP 112.26.1.1.34615 > 112.26.1.8.38393: Flags [.], seq 101389:102817, ack 1, win 4017, options [nop,nop,TS val 3130228 ecr 2891819,mptcp dss ack 3193170700 seq 2059003655 subseq 101389 len 1428 csum 0x7ae0], length 1428
15:11:29.849302 IP 112.26.1.1.34615 > 112.26.1.8.38393: Flags [.], seq 127093:128521, ack 1, win 4017, options [nop,nop,TS val 3130256 ecr 2891819,mptcp dss ack 3193170700 seq 2059092191 subseq 127093 len 1428 csum 0x769b], length 1428
15:11:29.932500 IP 112.26.1.1.34615 > 112.26.1.8.38393: Flags [.], seq 128521:129949, ack 1, win 4017, options [nop,nop,TS val 3130349 ecr 2891924,mptcp dss ack 3193170700 seq 2059097903 subseq 128521 len 1428 csum 0x8de8], length 1428
15:11:30.313744 IP 112.26.1.1.34615 > 112.26.1.8.38393: Flags [.], seq 129949:131377, ack 1, win 4017, options [nop,nop,TS val 3130765 ecr 2892140,mptcp dss ack 3193170700 seq 2059107899 subseq 129949 len 1428 csum 0x1745], length 1428
15:11:30.382337 IP 112.26.1.1.34615 > 112.26.1.8.38393: Flags [.], seq 131377:132805, ack 1, win 4017, options [nop,nop,TS val 3130772 ecr 2892209,mptcp dss ack 3193170700 seq 2059109327 subseq 131377 len 1428 csum 0x4fd], length 1428
15:11:30.453309 IP 112.26.1.1.34615 > 112.26.1.8.38393: Flags [.], seq 132805:134233, ack 1, win 4017, options [nop,nop,TS val 3130904 ecr 2892287,mptcp dss ack 3193170700 seq 2059113611 subseq 132805 len 1428 csum 0x3bc], length 1428
15:11:30.537291 IP 112.26.1.1.34615 > 112.26.1.8.38393: Flags [.], seq 134233:135661, ack 1, win 4017, options [nop,nop,TS val 3130924 ecr 2892509,mptcp dss ack 3193170700 seq 2059115039 subseq 134233 len 1428 csum 0x7063], length 1428
15:11:30.585213 IP 112.26.1.1.34615 > 112.26.1.8.38393: Flags [.], seq 135661:137089, ack 1, win 4017, options [nop,nop,TS val 3131011 ecr 2892568,mptcp dss ack 3193170700 seq 2059119323 subseq 135661 len 1428 csum 0x644c], length 1428
15:11:30.667931 IP 112.26.1.1.34615 > 112.26.1.8.38393: Flags [.], seq 137089:138517, ack 1, win 4017, options [nop,nop,TS val 3131011 ecr 2892568,mptcp dss ack 3193170700 seq 2059120751 subseq 137089 len 1428 csum 0xcbf], length 1428
15:11:30.733582 IP 112.26.1.1.34615 > 112.26.1.8.38393: Flags [.], seq 138517:139945, ack 1, win 4017, options [nop,nop,TS val 3131011 ecr 2892568,mptcp dss ack 3193170700 seq 2059122179 subseq 138517 len 1428 csum 0x5543], length 1428
15:11:30.772425 IP 112.26.1.1.34615 > 112.26.1.8.38393: Flags [.], seq 139945:141373, ack 1, win 4017, options [nop,nop,TS val 3131011 ecr 2892568,mptcp dss ack 3193170700 seq 2059123607 subseq 139945 len 1428 csum 0x6411], length 1428
15:11:30.845999 IP 112.26.1.1.34615 > 112.26.1.8.38393: Flags [.], seq 141373:142801, ack 1, win 4017, options [nop,nop,TS val 3131011 ecr 2892568,mptcp dss ack 3193170700 seq 2059125035 subseq 141373 len 1428 csum 0xf433], length 1428
15:11:30.891565 IP 112.26.1.1.34615 > 112.26.1.8.38393: Flags [.], seq 142801:144229, ack 1, win 4017, options [nop,nop,TS val 3131153 ecr 2892641,mptcp dss ack 3193170700 seq 2059130747 subseq 142801 len 1428 csum 0x3476], length 1428
15:11:30.985116 IP 112.26.1.1.34615 > 112.26.1.8.38393: Flags [.], seq 144229:145657, ack 1, win 4017, options [nop,nop,TS val 3131328 ecr 2892717,mptcp dss ack 3193170700 seq 2059137887 subseq 144229 len 1428 csum 0xa767], length 1428
15:11:31.054893 IP 112.26.1.1.34615 > 112.26.1.8.38393: Flags [.], seq 145657:147085, ack 1, win 4017, options [nop,nop,TS val 3131328 ecr 2892717,mptcp dss ack 3193170700 seq 2059139315 subseq 145657 len 1428 csum 0x6032], length 1428
15:11:31.107172 IP 112.26.1.1.34615 > 112.26.1.8.38393: Flags [.], seq 147085:148513, ack 1, win 4017, options [nop,nop,TS val 3131499 ecr 2892880,mptcp dss ack 3193170700 seq 2059145027 subseq 147085 len 1428 csum 0xe05a], length 1428
15:11:31.182773 IP 112.26.1.1.34615 > 112.26.1.8.38393: Flags [.], seq 148513:149941, ack 1, win 4017, options [nop,nop,TS val 3131634 ecr 2893012,mptcp dss ack 3193170700 seq 2059149311 subseq 148513 len 1428 csum 0x8ed0], length 1428
15:11:31.761636 IP 112.26.1.1.34615 > 112.26.1.8.38393: Flags [.], seq 149941:151369, ack 1, win 4017, options [nop,nop,TS val 3132212 ecr 2893637,mptcp dss ack 3193170700 seq 2059157879 subseq 149941 len 1428 csum 0x8f8b], length 1428
15:11:31.806629 IP 112.26.1.1.34615 > 112.26.1.8.38393: Flags [.], seq 151369:152797, ack 1, win 4017, options [nop,nop,TS val 3132212 ecr 2893637,mptcp dss ack 3193170700 seq 2059159307 subseq 151369 len 1428 csum 0x1a40], length 1428
15:11:31.883067 IP 112.26.1.1.34615 > 112.26.1.8.38393: Flags [.], seq 152797:154225, ack 1, win 4017, options [nop,nop,TS val 3132212 ecr 2893637,mptcp dss ack 3193170700 seq 2059160735 subseq 152797 len 1428 csum 0xbd34], length 1428
15:11:31.944163 IP 112.26.1.1.34615 > 112.26.1.8.38393: Flags [.], seq 154225:155653, ack 1, win 4017, options [nop,nop,TS val 3132212 ecr 2893637,mptcp dss ack 3193170700 seq 2059162163 subseq 154225 len 1428 csum 0x4fd], length 1428
15:11:31.995419 IP 112.26.1.1.34615 > 112.26.1.8.38393: Flags [.], seq 155653:157081, ack 1, win 4017, options [nop,nop,TS val 3132212 ecr 2893637,mptcp dss ack 3193170700 seq 2059163591 subseq 155653 len 1428 csum 0x4642], length 1428
15:11:32.052390 IP 112.26.1.1.34615 > 112.26.1.8.38393: Flags [.], seq 157081:158509, ack 1, win 4017, options [nop,nop,TS val 3132212 ecr 2893637,mptcp dss ack 3193170700 seq 2059165019 subseq 157081 len 1428 csum 0xbb13], length 1428
15:11:32.125042 IP 112.26.1.1.34615 > 112.26.1.8.38393: Flags [.], seq 137089:138517, ack 1, win 4017, options [nop,nop,TS val 3132317 ecr 2893738,mptcp dss ack 3193170700 seq 2059120751 subseq 137089 len 1428 csum 0xcbf], length 1428
15:11:32.196603 IP 112.26.1.1.34615 > 112.26.1.8.38393: Flags [.], seq 138517:139945, ack 1, win 4017, options [nop,nop,TS val 3132372 ecr 2893866,mptcp dss ack 3193170700 seq 2059122179 subseq 138517 len 1428 csum 0x5543], length 1428
15:11:32.371427 IP 112.26.1.1.34615 > 112.26.1.8.38393: Flags [.], seq 158509:159937, ack 1, win 4017, options [nop,nop,TS val 3132821 ecr 2894051,mptcp dss ack 3193170700 seq 2059179299 subseq 158509 len 1428 csum 0x8df5], length 1428
15:11:32.403945 IP 112.26.1.1.34615 > 112.26.1.8.38393: Flags [.], seq 159937:161365, ack 1, win 4017, options [nop,nop,TS val 3132852 ecr 2894155,mptcp dss ack 3193170700 seq 2059182155 subseq 159937 len 1428 csum 0x8b8a], length 1428
15:11:32.702178 IP 112.26.1.1.34615 > 112.26.1.8.38393: Flags [.], seq 161365:162793, ack 1, win 4017, options [nop,nop,TS val 3133152 ecr 2894549,mptcp dss ack 3193170700 seq 2059192151 subseq 161365 len 1428 csum 0x9be7], length 1428
15:11:32.859814 IP 112.26.1.1.34615 > 112.26.1.8.38393: Flags [.], seq 162793:164221, ack 1, win 4017, options [nop,nop,TS val 3133309 ecr 2894675,mptcp dss ack 3193170700 seq 2059199291 subseq 162793 len 1428 csum 0x515c], length 1428
15:11:32.974840 IP 112.26.1.1.34615 > 112.26.1.8.38393: Flags [.], seq 164221:165649, ack 1, win 4017, options [nop,nop,TS val 3133424 ecr 2894805,mptcp dss ack 3193170700 seq 2059202147 subseq 164221 len 1428 csum 0x87a4], length 1428
15:11:33.090050 IP 112.26.1.1.34615 > 112.26.1.8.38393: Flags [.], seq 165649:167077, ack 1, win 4017, options [nop,nop,TS val 3133540 ecr 2894953,mptcp dss ack 3193170700 seq 2059207859 subseq 165649 len 1428 csum 0xba2a], length 1428
15:11:33.176754 IP 112.26.1.1.34615 > 112.26.1.8.38393: Flags [.], seq 167077:168505, ack 1, win 4017, options [nop,nop,TS val 3133627 ecr 2895002,mptcp dss ack 3193170700 seq 2059212143 subseq 167077 len 1428 csum 0xe754], length 1428
15:11:33.205546 IP 112.26.1.1.34615 > 112.26.1.8.38393: Flags [.], seq 168505:169933, ack 1, win 4017, options [nop,nop,TS val 3133652 ecr 2895087,mptcp dss ack 3193170700 seq 2059214999 subseq 168505 len 1428 csum 0xad5d], length 1428
15:11:33.323751 IP 112.26.1.1.34615 > 112.26.1.8.38393: Flags [.], seq 138517:139945, ack 1, win 4017, options [nop,nop,TS val 3133775 ecr 2895244,mptcp dss ack 3193170700 seq 2059122179 subseq 138517 len 1428 csum 0x5543], length 1428
15:11:33.411185 IP 112.26.1.1.34615 > 112.26.1.8.38393: Flags [.], seq 169933:171361, ack 1, win 4017, options [nop,nop,TS val 3133862 ecr 2895368,mptcp dss ack 3193170700 seq 2059222139 subseq 169933 len 1428 csum 0x8989], length 1428
15:11:33.583877 IP 112.26.1.1.34615 > 112.26.1.8.38393: Flags [.], seq 171361:172789, ack 1, win 4017, options [nop,nop,TS val 3134034 ecr 2895461,mptcp dss ack 3193170700 seq 2059226423 subseq 171361 len 1428 csum 0xd7f2], length 1428
15:11:33.773089 IP 112.26.1.1.34615 > 112.26.1.8.38393: Flags [.], seq 172789:174217, ack 1, win 4017, options [nop,nop,TS val 3134223 ecr 2895663,mptcp dss ack 3193170700 seq 2059234991 subseq 172789 len 1428 csum 0x1b96], length 1428
15:11:33.930091 IP 112.26.1.1.34615 > 112.26.1.8.38393: Flags [.], seq 164221:165649, ack 1, win 4017, options [nop,nop,TS val 3134381 ecr 2895810,mptcp dss ack 3193170700 seq 2059202147 subseq 164221 len 1428 csum 0x87a4], length 1428
15:11:34.119279 IP 112.26.1.1.34615 > 112.26.1.8.38393: Flags [.], seq 174217:175645, ack 1, win 4017, options [nop,nop,TS val 3134570 ecr 2895947,mptcp dss ack 3193170700 seq 2059247843 subseq 174217 len 1428 csum 0x7bc8], length 1428
15:11:34.206086 IP 112.26.1.1.34615 > 112.26.1.8.38393: Flags [.], seq 175645:177073, ack 1, win 4017, options [nop,nop,TS val 3134649 ecr 2896056,mptcp dss ack 3193170700 seq 2059249271 subseq 175645 len 1428 csum 0xd945], length 1428
