15:11:18.702134 IP 112.26.3.8.43525 > 112.26.3.1.34615: Flags [S], seq 1229268343, win 65535, options [mss 1460,sackOK,TS val 2881077 ecr 0,nop,wscale 6,mptcp join id 6 token 0x7761ebfe nonce 0x9fead8c2], length 0
15:11:18.708429 IP 112.26.3.8.43525 > 112.26.3.1.34615: Flags [S], seq 1229268343, win 65535, options [mss 1460,sackOK,TS val 2881077 ecr 0,nop,wscale 6,mptcp join id 6 token 0x7761ebfe nonce 0x9fead8c2], length 0
15:11:18.714119 IP 112.26.3.8.43525 > 112.26.3.1.34615: Flags [S], seq 1229268343, win 65535, options [mss 1460,sackOK,TS val 2881077 ecr 0,nop,wscale 6,mptcp join id 6 token 0x7761ebfe nonce 0x9fead8c2], length 0
15:11:18.837668 IP 112.26.3.1.34615 > 112.26.3.8.43525: Flags [S.], seq 450080758, ack 1229268344, win 65535, options [mss 1460,sackOK,TS val 3119168 ecr 2881077,nop,wscale 6,mptcp join id 5 hmac 0x562114ae8e48a180 nonce 0x44054f4b], length 0
15:11:18.837948 IP 112.26.3.1.34615 > 112.26.3.8.43525: Flags [S.], seq 450080758, ack 1229268344, win 65535, options [mss 1460,sackOK,TS val 3119168 ecr 2881077,nop,wscale 6,mptcp join id 5 hmac 0x562114ae8e48a180 nonce 0x44054f4b], length 0
15:11:18.843033 IP 112.26.3.8.43525 > 112.26.3.1.34615: Flags [.], ack 1, win 6935, options [nop,nop,TS val 2881225 ecr 3119168,mptcp join hmac 0x4759602301f376696cd07ac785aee41faa6fbfc8], length 0
15:11:18.926264 IP 112.26.3.8.43525 > 112.26.3.1.34615: Flags [.], ack 1, win 6935, options [nop,nop,TS val 2881225 ecr 3119168,mptcp join hmac 0x4759602301f376696cd07ac785aee41faa6fbfc8], length 0
15:11:18.933072 IP 112.26.3.8.43525 > 112.26.3.1.34615: Flags [.], ack 1, win 6935, options [nop,nop,TS val 2881225 ecr 3119168,mptcp join hmac 0x4759602301f376696cd07ac785aee41faa6fbfc8], length 0
15:11:18.982186 IP 112.26.3.1.34615 > 112.26.3.8.43525: Flags [.], ack 1, win 4017, options [nop,nop,TS val 3119387 ecr 2881225,mptcp dss ack 3193170700], length 0
15:11:18.982437 IP 112.26.3.1.34615 > 112.26.3.8.43525: Flags [.], ack 1, win 4017, options [nop,nop,TS val 3119387 ecr 2881225,mptcp dss ack 3193170700], length 0
15:11:19.315447 IP 112.26.3.1.34615 > 112.26.3.8.43525: Flags [.], seq 1:1429, ack 1, win 4017, options [nop,nop,TS val 3119398 ecr 2881225,mptcp dss ack 3193170700 seq 2058745187 subseq 1 len 1428 csum 0xd147], length 1428
15:11:19.315727 IP 112.26.3.1.34615 > 112.26.3.8.43525: Flags [.], seq 1:1429, ack 1, win 4017, options [nop,nop,TS val 3119398 ecr 2881225,mptcp dss ack 3193170700 seq 2058745187 subseq 1 len 1428 csum 0xd147], length 1428
15:11:19.326459 IP 112.26.3.8.43525 > 112.26.3.1.34615: Flags [.], ack 1429, win 7300, options [nop,nop,TS val 2881709 ecr 3119398,mptcp dss ack 2058722339], length 0
15:11:19.523162 IP 112.26.3.8.43525 > 112.26.3.1.34615: Flags [.], ack 1429, win 7300, options [nop,nop,TS val 2881709 ecr 3119398,mptcp dss ack 2058722339], length 0
15:11:19.540881 IP 112.26.3.8.43525 > 112.26.3.1.34615: Flags [.], ack 1429, win 7300, options [nop,nop,TS val 2881709 ecr 3119398,mptcp dss ack 2058722339], length 0
15:11:19.777330 IP 112.26.3.1.34615 > 112.26.3.8.43525: Flags [.], seq 1429:2857, ack 1, win 4017, options [nop,nop,TS val 3119398 ecr 2881225,mptcp dss ack 3193170700 seq 2058746615 subseq 1429 len 1428 csum 0x2a6f], length 1428
15:11:19.777530 IP 112.26.3.1.34615 > 112.26.3.8.43525: Flags [.], seq 1429:2857, ack 1, win 4017, options [nop,nop,TS val 3119398 ecr 2881225,mptcp dss ack 3193170700 seq 2058746615 subseq 1429 len 1428 csum 0x2a6f], length 1428
15:11:19.805095 IP 112.26.3.8.43525 > 112.26.3.1.34615: Flags [.], ack 2857, win 7802, options [nop,nop,TS val 2882187 ecr 3119398,mptcp dss ack 2058722339], length 0
15:11:20.013429 IP 112.26.3.8.43525 > 112.26.3.1.34615: Flags [.], ack 2857, win 7802, options [nop,nop,TS val 2882187 ecr 3119398,mptcp dss ack 2058722339], length 0
15:11:20.305240 IP 112.26.3.1.34615 > 112.26.3.8.43525: Flags [.], seq 14281:15709, ack 1, win 4017, options [nop,nop,TS val 3119994 ecr 2881709,mptcp dss ack 3193170700 seq 2058792311 subseq 14281 len 1428 csum 0xe441], length 1428
15:11:20.305524 IP 112.26.3.1.34615 > 112.26.3.8.43525: Flags [.], seq 14281:15709, ack 1, win 4017, options [nop,nop,TS val 3119994 ecr 2881709,mptcp dss ack 3193170700 seq 2058792311 subseq 14281 len 1428 csum 0xe441], length 1428
15:11:20.391343 IP 112.26.3.8.43525 > 112.26.3.1.34615: Flags [.], ack 2857, win 8350, options [nop,nop,TS val 2882701 ecr 3119398,nop,nop,sack 1 {14281:15709},mptcp dss ack 2058739475], length 0
15:11:20.559880 IP 112.26.3.1.34615 > 112.26.3.8.43525: Flags [.], seq 15709:17137, ack 1, win 4017, options [nop,nop,TS val 3119994 ecr 2881709,mptcp dss ack 3193170700 seq 2058793739 subseq 15709 len 1428 csum 0x8f28], length 1428
15:11:20.560123 IP 112.26.3.1.34615 > 112.26.3.8.43525: Flags [.], seq 15709:17137, ack 1, win 4017, options [nop,nop,TS val 3119994 ecr 2881709,mptcp dss ack 3193170700 seq 2058793739 subseq 15709 len 1428 csum 0x8f28], length 1428
15:11:20.575348 IP 112.26.3.8.43525 > 112.26.3.1.34615: Flags [.], ack 2857, win 8350, options [nop,nop,TS val 2882701 ecr 3119398,nop,nop,sack 1 {14281:15709},mptcp dss ack 2058739475], length 0
15:11:20.578571 IP 112.26.3.8.43525 > 112.26.3.1.34615: Flags [.], ack 2857, win 8350, options [nop,nop,TS val 2882701 ecr 3119398,nop,nop,sack 1 {14281:15709},mptcp dss ack 2058739475], length 0
15:11:20.666709 IP 112.26.3.8.43525 > 112.26.3.1.34615: Flags [.], ack 2857, win 8669, options [nop,nop,TS val 2882957 ecr 3119398,nop,nop,sack 1 {14281:17137},mptcp dss ack 2058739475], length 0
15:11:20.736114 IP 112.26.3.8.43525 > 112.26.3.1.34615: Flags [.], ack 2857, win 8669, options [nop,nop,TS val 2882957 ecr 3119398,nop,nop,sack 1 {14281:17137},mptcp dss ack 2058739475], length 0
15:11:20.990023 IP 112.26.3.8.43525 > 112.26.3.1.34615: Flags [.], ack 2857, win 8669, options [nop,nop,TS val 2882957 ecr 3119398,nop,nop,sack 1 {14281:17137},mptcp dss ack 2058739475], length 0
15:11:21.121470 IP 112.26.3.1.34615 > 112.26.3.8.43525: Flags [.], seq 2857:4285, ack 1, win 4017, options [nop,nop,TS val 3121032 ecr 2882701,mptcp dss ack 3193170700 seq 2058748043 subseq 2857 len 1428 csum 0xafa2], length 1428
15:11:21.121690 IP 112.26.3.1.34615 > 112.26.3.8.43525: Flags [.], seq 2857:4285, ack 1, win 4017, options [nop,nop,TS val 3121032 ecr 2882701,mptcp dss ack 3193170700 seq 2058748043 subseq 2857 len 1428 csum 0xafa2], length 1428
15:11:21.137369 IP 112.26.3.8.43525 > 112.26.3.1.34615: Flags [.], ack 4285, win 9262, options [nop,nop,TS val 2883519 ecr 3121032,nop,nop,sack 1 {14281:17137},mptcp dss ack 2058739475], length 0
15:11:21.308774 IP 112.26.3.8.43525 > 112.26.3.1.34615: Flags [.], ack 4285, win 9262, options [nop,nop,TS val 2883519 ecr 3121032,nop,nop,sack 1 {14281:17137},mptcp dss ack 2058739475], length 0
15:11:21.355666 IP 112.26.3.8.43525 > 112.26.3.1.34615: Flags [.], ack 4285, win 9262, options [nop,nop,TS val 2883519 ecr 3121032,nop,nop,sack 1 {14281:17137},mptcp dss ack 2058739475], length 0
15:11:21.539696 IP 112.26.3.1.34615 > 112.26.3.8.43525: Flags [.], seq 5713:7141, ack 1, win 4017, options [nop,nop,TS val 3121032 ecr 2882701,mptcp dss ack 3193170700 seq 2058750899 subseq 5713 len 1428 csum 0x1df], length 1428
15:11:21.539926 IP 112.26.3.1.34615 > 112.26.3.8.43525: Flags [.], seq 5713:7141, ack 1, win 4017, options [nop,nop,TS val 3121032 ecr 2882701,mptcp dss ack 3193170700 seq 2058750899 subseq 5713 len 1428 csum 0x1df], length 1428
15:11:21.555907 IP 112.26.3.8.43525 > 112.26.3.1.34615: Flags [.], ack 4285, win 9810, options [nop,nop,TS val 2883937 ecr 3121032,nop,nop,sack 2 {5713:7141}{14281:17137},mptcp dss ack 2058752327], length 0
15:11:21.558905 IP 112.26.3.8.43525 > 112.26.3.1.34615: Flags [.], ack 4285, win 9810, options [nop,nop,TS val 2883937 ecr 3121032,nop,nop,sack 2 {5713:7141}{14281:17137},mptcp dss ack 2058752327], length 0
15:11:21.640564 IP 112.26.3.8.43525 > 112.26.3.1.34615: Flags [.], ack 4285, win 9810, options [nop,nop,TS val 2883937 ecr 3121032,nop,nop,sack 2 {5713:7141}{14281:17137},mptcp dss ack 2058752327], length 0
15:11:21.934018 IP 112.26.3.1.34615 > 112.26.3.8.43525: Flags [.], seq 8569:9997, ack 1, win 4017, options [nop,nop,TS val 3121810 ecr 2883519,mptcp dss ack 3193170700 seq 2058753755 subseq 8569 len 1428 csum 0xa26e], length 1428
15:11:21.934299 IP 112.26.3.1.34615 > 112.26.3.8.43525: Flags [.], seq 8569:9997, ack 1, win 4017, options [nop,nop,TS val 3121810 ecr 2883519,mptcp dss ack 3193170700 seq 2058753755 subseq 8569 len 1428 csum 0xa26e], length 1428
15:11:21.950600 IP 112.26.3.8.43525 > 112.26.3.1.34615: Flags [.], ack 4285, win 10220, options [nop,nop,TS val 2884332 ecr 3121032,nop,nop,sack 2 {8569:9997}{5713:7141},mptcp dss ack 2058752327], length 0
15:11:22.176418 IP 112.26.3.1.34615 > 112.26.3.8.43525: Flags [.], seq 11425:12853, ack 1, win 4017, options [nop,nop,TS val 3122095 ecr 2883937,mptcp dss ack 3193170700 seq 2058756611 subseq 11425 len 1428 csum 0xca25], length 1428
15:11:22.176686 IP 112.26.3.1.34615 > 112.26.3.8.43525: Flags [.], seq 11425:12853, ack 1, win 4017, options [nop,nop,TS val 3122095 ecr 2883937,mptcp dss ack 3193170700 seq 2058756611 subseq 11425 len 1428 csum 0xca25], length 1428
15:11:22.206100 IP 112.26.3.8.43525 > 112.26.3.1.34615: Flags [.], ack 4285, win 10540, options [nop,nop,TS val 2884584 ecr 3121032,nop,nop,sack 2 {11425:12853}{8569:9997},mptcp dss ack 2058756611], length 0
15:11:22.220293 IP 112.26.3.8.43525 > 112.26.3.1.34615: Flags [.], ack 4285, win 10540, options [nop,nop,TS val 2884584 ecr 3121032,nop,nop,sack 2 {11425:12853}{8569:9997},mptcp dss ack 2058756611], length 0
15:11:22.229808 IP 112.26.3.8.43525 > 112.26.3.1.34615: Flags [.], ack 4285, win 10540, options [nop,nop,TS val 2884584 ecr 3121032,nop,nop,sack 2 {11425:12853}{8569:9997},mptcp dss ack 2058756611], length 0
15:11:22.643363 IP 112.26.3.1.34615 > 112.26.3.8.43525: Flags [.], seq 4285:5713, ack 1, win 4017, options [nop,nop,TS val 3122683 ecr 2884584,mptcp dss ack 3193170700 seq 2058749471 subseq 4285 len 1428 csum 0xd363], length 1428
15:11:22.643667 IP 112.26.3.1.34615 > 112.26.3.8.43525: Flags [.], seq 4285:5713, ack 1, win 4017, options [nop,nop,TS val 3122683 ecr 2884584,mptcp dss ack 3193170700 seq 2058749471 subseq 4285 len 1428 csum 0xd363], length 1428
15:11:22.660644 IP 112.26.3.8.43525 > 112.26.3.1.34615: Flags [.], ack 7141, win 11087, options [nop,nop,TS val 2885041 ecr 3122683,nop,nop,sack 2 {11425:12853}{8569:9997},mptcp dss ack 2058756611], length 0
15:11:22.805816 IP 112.26.3.8.43525 > 112.26.3.1.34615: Flags [.], ack 7141, win 11087, options [nop,nop,TS val 2885041 ecr 3122683,nop,nop,sack 2 {11425:12853}{8569:9997},mptcp dss ack 2058756611], length 0
15:11:22.846764 IP 112.26.3.8.43525 > 112.26.3.1.34615: Flags [.], ack 7141, win 11087, options [nop,nop,TS val 2885041 ecr 3122683,nop,nop,sack 2 {11425:12853}{8569:9997},mptcp dss ack 2058756611], length 0
15:11:22.988125 IP 112.26.3.1.34615 > 112.26.3.8.43525: Flags [.], seq 7141:8569, ack 1, win 4017, options [nop,nop,TS val 3122683 ecr 2884584,mptcp dss ack 3193170700 seq 2058752327 subseq 7141 len 1428 csum 0xb467], length 1428
15:11:22.988425 IP 112.26.3.1.34615 > 112.26.3.8.43525: Flags [.], seq 7141:8569, ack 1, win 4017, options [nop,nop,TS val 3122683 ecr 2884584,mptcp dss ack 3193170700 seq 2058752327 subseq 7141 len 1428 csum 0xb467], length 1428
15:11:23.004540 IP 112.26.3.8.43525 > 112.26.3.1.34615: Flags [.], ack 9997, win 11498, options [nop,nop,TS val 2885386 ecr 3122683,nop,nop,sack 2 {11425:12853}{14281:17137},mptcp dss ack 2058756611], length 0
15:11:23.007843 IP 112.26.3.8.43525 > 112.26.3.1.34615: Flags [.], ack 9997, win 11498, options [nop,nop,TS val 2885386 ecr 3122683,nop,nop,sack 2 {11425:12853}{14281:17137},mptcp dss ack 2058756611], length 0
15:11:23.156212 IP 112.26.3.8.43525 > 112.26.3.1.34615: Flags [.], ack 9997, win 11498, options [nop,nop,TS val 2885386 ecr 3122683,nop,nop,sack 2 {11425:12853}{14281:17137},mptcp dss ack 2058756611], length 0
15:11:23.327030 IP 112.26.3.1.34615 > 112.26.3.8.43525: Flags [.], seq 9997:11425, ack 1, win 4017, options [nop,nop,TS val 3123265 ecr 2885041,mptcp dss ack 3193170700 seq 2058755183 subseq 9997 len 1428 csum 0x5137], length 1428
15:11:23.327331 IP 112.26.3.1.34615 > 112.26.3.8.43525: Flags [.], seq 9997:11425, ack 1, win 4017, options [nop,nop,TS val 3123265 ecr 2885041,mptcp dss ack 3193170700 seq 2058755183 subseq 9997 len 1428 csum 0x5137], length 1428
15:11:23.346668 IP 112.26.3.8.43525 > 112.26.3.1.34615: Flags [.], ack 12853, win 12000, options [nop,nop,TS val 2885720 ecr 3123265,nop,nop,sack 1 {14281:17137},mptcp dss ack 2058782315], length 0
15:11:23.348572 IP 112.26.3.8.43525 > 112.26.3.1.34615: Flags [.], ack 12853, win 12000, options [nop,nop,TS val 2885720 ecr 3123265,nop,nop,sack 1 {14281:17137},mptcp dss ack 2058782315], length 0
15:11:23.538759 IP 112.26.3.8.43525 > 112.26.3.1.34615: Flags [.], ack 12853, win 12000, options [nop,nop,TS val 2885720 ecr 3123265,nop,nop,sack 1 {14281:17137},mptcp dss ack 2058782315], length 0
15:11:23.738595 IP 112.26.3.1.34615 > 112.26.3.8.43525: Flags [.], seq 18565:19993, ack 1, win 4017, options [nop,nop,TS val 3123610 ecr 2885386,mptcp dss ack 3193170700 seq 2058877991 subseq 18565 len 1428 csum 0x76e6], length 1428
15:11:23.738927 IP 112.26.3.1.34615 > 112.26.3.8.43525: Flags [.], seq 18565:19993, ack 1, win 4017, options [nop,nop,TS val 3123610 ecr 2885386,mptcp dss ack 3193170700 seq 2058877991 subseq 18565 len 1428 csum 0x76e6], length 1428
15:11:23.756688 IP 112.26.3.8.43525 > 112.26.3.1.34615: Flags [.], ack 12853, win 12547, options [nop,nop,TS val 2886139 ecr 3123265,nop,nop,sack 2 {18565:19993}{14281:17137},mptcp dss ack 2058782315], length 0
15:11:23.781561 IP 112.26.3.8.43525 > 112.26.3.1.34615: Flags [.], ack 12853, win 12547, options [nop,nop,TS val 2886139 ecr 3123265,nop,nop,sack 2 {18565:19993}{14281:17137},mptcp dss ack 2058782315], length 0
15:11:23.900345 IP 112.26.3.8.43525 > 112.26.3.1.34615: Flags [.], ack 12853, win 12547, options [nop,nop,TS val 2886139 ecr 3123265,nop,nop,sack 2 {18565:19993}{14281:17137},mptcp dss ack 2058782315], length 0
15:11:24.056274 IP 112.26.3.1.34615 > 112.26.3.8.43525: Flags [.], seq 19993:21421, ack 1, win 4017, options [nop,nop,TS val 3123993 ecr 2885720,mptcp dss ack 3193170700 seq 2058893699 subseq 19993 len 1428 csum 0x27f], length 1428
15:11:24.056543 IP 112.26.3.1.34615 > 112.26.3.8.43525: Flags [.], seq 19993:21421, ack 1, win 4017, options [nop,nop,TS val 3123993 ecr 2885720,mptcp dss ack 3193170700 seq 2058893699 subseq 19993 len 1428 csum 0x27f], length 1428
15:11:24.083586 IP 112.26.3.8.43525 > 112.26.3.1.34615: Flags [.], ack 12853, win 12912, options [nop,nop,TS val 2886465 ecr 3123265,nop,nop,sack 2 {18565:21421}{14281:17137},mptcp dss ack 2058782315], length 0
15:11:24.095500 IP 112.26.3.8.43525 > 112.26.3.1.34615: Flags [.], ack 12853, win 12912, options [nop,nop,TS val 2886465 ecr 3123265,nop,nop,sack 2 {18565:21421}{14281:17137},mptcp dss ack 2058782315], length 0
15:11:24.285340 IP 112.26.3.8.43525 > 112.26.3.1.34615: Flags [.], ack 12853, win 12912, options [nop,nop,TS val 2886465 ecr 3123265,nop,nop,sack 2 {18565:21421}{14281:17137},mptcp dss ack 2058782315], length 0
15:11:24.465739 IP 112.26.3.1.34615 > 112.26.3.8.43525: Flags [.], seq 12853:14281, ack 1, win 4017, options [nop,nop,TS val 3124354 ecr 2886139,mptcp dss ack 3193170700 seq 2058758039 subseq 12853 len 1428 csum 0xc093], length 1428
15:11:24.466071 IP 112.26.3.1.34615 > 112.26.3.8.43525: Flags [.], seq 12853:14281, ack 1, win 4017, options [nop,nop,TS val 3124354 ecr 2886139,mptcp dss ack 3193170700 seq 2058758039 subseq 12853 len 1428 csum 0xc093], length 1428
15:11:24.497453 IP 112.26.3.8.43525 > 112.26.3.1.34615: Flags [.], ack 17137, win 13232, options [nop,nop,TS val 2886864 ecr 3124354,nop,nop,sack 1 {18565:21421},mptcp dss ack 2058782315], length 0
15:11:24.501951 IP 112.26.3.8.43525 > 112.26.3.1.34615: Flags [.], ack 17137, win 13232, options [nop,nop,TS val 2886864 ecr 3124354,nop,nop,sack 1 {18565:21421},mptcp dss ack 2058782315], length 0
15:11:24.644075 IP 112.26.3.8.43525 > 112.26.3.1.34615: Flags [.], ack 17137, win 13232, options [nop,nop,TS val 2886864 ecr 3124354,nop,nop,sack 1 {18565:21421},mptcp dss ack 2058782315], length 0
15:11:24.736056 IP 112.26.3.1.34615 > 112.26.3.8.43525: Flags [.], seq 17137:18565, ack 1, win 4017, options [nop,nop,TS val 3124739 ecr 2886465,mptcp dss ack 3193170700 seq 2058876563 subseq 17137 len 1428 csum 0x9032], length 1428
15:11:24.736327 IP 112.26.3.1.34615 > 112.26.3.8.43525: Flags [.], seq 17137:18565, ack 1, win 4017, options [nop,nop,TS val 3124739 ecr 2886465,mptcp dss ack 3193170700 seq 2058876563 subseq 17137 len 1428 csum 0x9032], length 1428
15:11:25.028264 IP 112.26.3.1.34615 > 112.26.3.8.43525: Flags [.], seq 22849:24277, ack 1, win 4017, options [nop,nop,TS val 3125098 ecr 2886864,mptcp dss ack 3193170700 seq 2058927971 subseq 22849 len 1428 csum 0x76c3], length 1428
15:11:25.028617 IP 112.26.3.1.34615 > 112.26.3.8.43525: Flags [.], seq 22849:24277, ack 1, win 4017, options [nop,nop,TS val 3125098 ecr 2886864,mptcp dss ack 3193170700 seq 2058927971 subseq 22849 len 1428 csum 0x76c3], length 1428
15:11:25.045073 IP 112.26.3.8.43525 > 112.26.3.1.34615: Flags [.], ack 21421, win 13962, options [nop,nop,TS val 2887427 ecr 3124739,nop,nop,sack 1 {22849:24277},mptcp dss ack 2058895127], length 0
15:11:25.064246 IP 112.26.3.8.43525 > 112.26.3.1.34615: Flags [.], ack 21421, win 13962, options [nop,nop,TS val 2887427 ecr 3124739,nop,nop,sack 1 {22849:24277},mptcp dss ack 2058895127], length 0
15:11:25.272206 IP 112.26.3.8.43525 > 112.26.3.1.34615: Flags [.], ack 21421, win 13962, options [nop,nop,TS val 2887427 ecr 3124739,nop,nop,sack 1 {22849:24277},mptcp dss ack 2058895127], length 0
15:11:25.393573 IP 112.26.3.1.34615 > 112.26.3.8.43525: Flags [.], seq 24277:25705, ack 1, win 4017, options [nop,nop,TS val 3125098 ecr 2886864,mptcp dss ack 3193170700 seq 2058929399 subseq 24277 len 1428 csum 0x1965], length 1428
15:11:25.393871 IP 112.26.3.1.34615 > 112.26.3.8.43525: Flags [.], seq 24277:25705, ack 1, win 4017, options [nop,nop,TS val 3125098 ecr 2886864,mptcp dss ack 3193170700 seq 2058929399 subseq 24277 len 1428 csum 0x1965], length 1428
15:11:25.403195 IP 112.26.3.8.43525 > 112.26.3.1.34615: Flags [.], ack 21421, win 14327, options [nop,nop,TS val 2887786 ecr 3124739,nop,nop,sack 1 {22849:25705},mptcp dss ack 2058895127], length 0
15:11:25.535229 IP 112.26.3.8.43525 > 112.26.3.1.34615: Flags [.], ack 21421, win 14327, options [nop,nop,TS val 2887786 ecr 3124739,nop,nop,sack 1 {22849:25705},mptcp dss ack 2058895127], length 0
15:11:25.662465 IP 112.26.3.8.43525 > 112.26.3.1.34615: Flags [.], ack 21421, win 14327, options [nop,nop,TS val 2887786 ecr 3124739,nop,nop,sack 1 {22849:25705},mptcp dss ack 2058895127], length 0
15:11:25.847154 IP 112.26.3.1.34615 > 112.26.3.8.43525: Flags [.], seq 25705:27133, ack 1, win 4017, options [nop,nop,TS val 3125726 ecr 2887427,mptcp dss ack 3193170700 seq 2058955103 subseq 25705 len 1428 csum 0x8651], length 1428
15:11:25.847416 IP 112.26.3.1.34615 > 112.26.3.8.43525: Flags [.], seq 25705:27133, ack 1, win 4017, options [nop,nop,TS val 3125726 ecr 2887427,mptcp dss ack 3193170700 seq 2058955103 subseq 25705 len 1428 csum 0x8651], length 1428
15:11:25.863964 IP 112.26.3.8.43525 > 112.26.3.1.34615: Flags [.], ack 21421, win 14965, options [nop,nop,TS val 2888246 ecr 3124739,nop,nop,sack 1 {22849:27133},mptcp dss ack 2058895127], length 0
15:11:25.867005 IP 112.26.3.8.43525 > 112.26.3.1.34615: Flags [.], ack 21421, win 14965, options [nop,nop,TS val 2888246 ecr 3124739,nop,nop,sack 1 {22849:27133},mptcp dss ack 2058895127], length 0
15:11:26.028608 IP 112.26.3.1.34615 > 112.26.3.8.43525: Flags [.], seq 27133:28561, ack 1, win 4017, options [nop,nop,TS val 3125726 ecr 2887427,mptcp dss ack 3193170700 seq 2058956531 subseq 27133 len 1428 csum 0xe09], length 1428
15:11:26.028875 IP 112.26.3.1.34615 > 112.26.3.8.43525: Flags [.], seq 27133:28561, ack 1, win 4017, options [nop,nop,TS val 3125726 ecr 2887427,mptcp dss ack 3193170700 seq 2058956531 subseq 27133 len 1428 csum 0xe09], length 1428
15:11:26.054571 IP 112.26.3.8.43525 > 112.26.3.1.34615: Flags [.], ack 21421, win 14965, options [nop,nop,TS val 2888246 ecr 3124739,nop,nop,sack 1 {22849:27133},mptcp dss ack 2058895127], length 0
15:11:26.141817 IP 112.26.3.8.43525 > 112.26.3.1.34615: Flags [.], ack 21421, win 15194, options [nop,nop,TS val 2888524 ecr 3124739,nop,nop,sack 1 {22849:28561},mptcp dss ack 2058895127], length 0
15:11:26.143391 IP 112.26.3.8.43525 > 112.26.3.1.34615: Flags [.], ack 21421, win 15194, options [nop,nop,TS val 2888524 ecr 3124739,nop,nop,sack 1 {22849:28561},mptcp dss ack 2058895127], length 0
15:11:26.256690 IP 112.26.3.1.34615 > 112.26.3.8.43525: Flags [.], seq 28561:29989, ack 1, win 4017, options [nop,nop,TS val 3126179 ecr 2887786,mptcp dss ack 3193170700 seq 2058969383 subseq 28561 len 1428 csum 0x5e61], length 1428
15:11:26.256968 IP 112.26.3.1.34615 > 112.26.3.8.43525: Flags [.], seq 28561:29989, ack 1, win 4017, options [nop,nop,TS val 3126179 ecr 2887786,mptcp dss ack 3193170700 seq 2058969383 subseq 28561 len 1428 csum 0x5e61], length 1428
15:11:26.348189 IP 112.26.3.8.43525 > 112.26.3.1.34615: Flags [.], ack 21421, win 15194, options [nop,nop,TS val 2888524 ecr 3124739,nop,nop,sack 1 {22849:28561},mptcp dss ack 2058895127], length 0
15:11:26.424320 IP 112.26.3.8.43525 > 112.26.3.1.34615: Flags [.], ack 21421, win 15513, options [nop,nop,TS val 2888798 ecr 3124739,nop,nop,sack 1 {22849:29989},mptcp dss ack 2058895127], length 0
15:11:26.426811 IP 112.26.3.8.43525 > 112.26.3.1.34615: Flags [.], ack 21421, win 15513, options [nop,nop,TS val 2888798 ecr 3124739,nop,nop,sack 1 {22849:29989},mptcp dss ack 2058895127], length 0
15:11:26.561862 IP 112.26.3.1.34615 > 112.26.3.8.43525: Flags [.], seq 29989:31417, ack 1, win 4017, options [nop,nop,TS val 3126568 ecr 2888246,mptcp dss ack 3193170700 seq 2058983663 subseq 29989 len 1428 csum 0x16eb], length 1428
15:11:26.562125 IP 112.26.3.1.34615 > 112.26.3.8.43525: Flags [.], seq 29989:31417, ack 1, win 4017, options [nop,nop,TS val 3126568 ecr 2888246,mptcp dss ack 3193170700 seq 2058983663 subseq 29989 len 1428 csum 0x16eb], length 1428
15:11:26.662731 IP 112.26.3.8.43525 > 112.26.3.1.34615: Flags [.], ack 21421, win 15695, options [nop,nop,TS val 2888955 ecr 3124739,nop,nop,sack 1 {22849:31417},mptcp dss ack 2058895127], length 0
15:11:26.679728 IP 112.26.3.8.43525 > 112.26.3.1.34615: Flags [.], ack 21421, win 15695, options [nop,nop,TS val 2888955 ecr 3124739,nop,nop,sack 1 {22849:31417},mptcp dss ack 2058895127], length 0
15:11:26.714153 IP 112.26.3.8.43525 > 112.26.3.1.34615: Flags [.], ack 21421, win 15513, options [nop,nop,TS val 2888798 ecr 3124739,nop,nop,sack 1 {22849:29989},mptcp dss ack 2058895127], length 0
15:11:26.822472 IP 112.26.3.8.43525 > 112.26.3.1.34615: Flags [.], ack 21421, win 15695, options [nop,nop,TS val 2888955 ecr 3124739,nop,nop,sack 1 {22849:31417},mptcp dss ack 2058895127], length 0
15:11:26.859796 IP 112.26.3.1.34615 > 112.26.3.8.43525: Flags [.], seq 31417:32845, ack 1, win 4017, options [nop,nop,TS val 3126890 ecr 2888524,mptcp dss ack 3193170700 seq 2058997943 subseq 31417 len 1428 csum 0x253e], length 1428
15:11:26.860019 IP 112.26.3.1.34615 > 112.26.3.8.43525: Flags [.], seq 31417:32845, ack 1, win 4017, options [nop,nop,TS val 3126890 ecr 2888524,mptcp dss ack 3193170700 seq 2058997943 subseq 31417 len 1428 csum 0x253e], length 1428
15:11:26.887791 IP 112.26.3.8.43525 > 112.26.3.1.34615: Flags [.], ack 21421, win 16060, options [nop,nop,TS val 2889252 ecr 3124739,nop,nop,sack 1 {22849:32845},mptcp dss ack 2058895127], length 0
15:11:26.891385 IP 112.26.3.8.43525 > 112.26.3.1.34615: Flags [.], ack 21421, win 16060, options [nop,nop,TS val 2889252 ecr 3124739,nop,nop,sack 1 {22849:32845},mptcp dss ack 2058895127], length 0
15:11:27.072993 IP 112.26.3.1.34615 > 112.26.3.8.43525: Flags [.], seq 21421:22849, ack 1, win 4017, options [nop,nop,TS val 3127168 ecr 2888798,mptcp dss ack 3193170700 seq 2058895127 subseq 21421 len 1428 csum 0x1bba], length 1428
15:11:27.073236 IP 112.26.3.1.34615 > 112.26.3.8.43525: Flags [.], seq 21421:22849, ack 1, win 4017, options [nop,nop,TS val 3127168 ecr 2888798,mptcp dss ack 3193170700 seq 2058895127 subseq 21421 len 1428 csum 0x1bba], length 1428
15:11:27.120250 IP 112.26.3.8.43525 > 112.26.3.1.34615: Flags [.], ack 32845, win 16289, options [nop,nop,TS val 2889501 ecr 3127168,mptcp dss ack 2058942251], length 0
15:11:27.187739 IP 112.26.3.8.43525 > 112.26.3.1.34615: Flags [.], ack 21421, win 16060, options [nop,nop,TS val 2889252 ecr 3124739,nop,nop,sack 1 {22849:32845},mptcp dss ack 2058895127], length 0
15:11:27.239330 IP 112.26.3.8.43525 > 112.26.3.1.34615: Flags [.], ack 32845, win 16289, options [nop,nop,TS val 2889501 ecr 3127168,mptcp dss ack 2058942251], length 0
15:11:27.347891 IP 112.26.3.1.34615 > 112.26.3.8.43525: Flags [.], seq 32845:34273, ack 1, win 4017, options [nop,nop,TS val 3127325 ecr 2888955,mptcp dss ack 3193170700 seq 2059015079 subseq 32845 len 1428 csum 0x4ff7], length 1428
15:11:27.348113 IP 112.26.3.1.34615 > 112.26.3.8.43525: Flags [.], seq 32845:34273, ack 1, win 4017, options [nop,nop,TS val 3127325 ecr 2888955,mptcp dss ack 3193170700 seq 2059015079 subseq 32845 len 1428 csum 0x4ff7], length 1428
15:11:27.362699 IP 112.26.3.8.43525 > 112.26.3.1.34615: Flags [.], ack 34273, win 16654, options [nop,nop,TS val 2889745 ecr 3127325,mptcp dss ack 2058947963], length 0
15:11:27.377173 IP 112.26.3.8.43525 > 112.26.3.1.34615: Flags [.], ack 34273, win 16654, options [nop,nop,TS val 2889745 ecr 3127325,mptcp dss ack 2058947963], length 0
15:11:27.505034 IP 112.26.3.8.43525 > 112.26.3.1.34615: Flags [.], ack 32845, win 16289, options [nop,nop,TS val 2889501 ecr 3127168,mptcp dss ack 2058942251], length 0
15:11:27.649812 IP 112.26.3.1.34615 > 112.26.3.8.43525: Flags [.], seq 34273:35701, ack 1, win 4017, options [nop,nop,TS val 3127718 ecr 2889252,mptcp dss ack 3193170700 seq 2059032215 subseq 34273 len 1428 csum 0xf06f], length 1428
15:11:27.650082 IP 112.26.3.1.34615 > 112.26.3.8.43525: Flags [.], seq 34273:35701, ack 1, win 4017, options [nop,nop,TS val 3127718 ecr 2889252,mptcp dss ack 3193170700 seq 2059032215 subseq 34273 len 1428 csum 0xf06f], length 1428
15:11:27.664681 IP 112.26.3.8.43525 > 112.26.3.1.34615: Flags [.], ack 35701, win 17064, options [nop,nop,TS val 2890047 ecr 3127718,mptcp dss ack 2058980807], length 0
15:11:27.669375 IP 112.26.3.8.43525 > 112.26.3.1.34615: Flags [.], ack 35701, win 17064, options [nop,nop,TS val 2890047 ecr 3127718,mptcp dss ack 2058980807], length 0
15:11:27.801545 IP 112.26.3.8.43525 > 112.26.3.1.34615: Flags [.], ack 34273, win 16654, options [nop,nop,TS val 2889745 ecr 3127325,mptcp dss ack 2058947963], length 0
15:11:27.933224 IP 112.26.3.1.34615 > 112.26.3.8.43525: Flags [.], seq 35701:37129, ack 1, win 4017, options [nop,nop,TS val 3127959 ecr 2889501,mptcp dss ack 3193170700 seq 2059037927 subseq 35701 len 1428 csum 0x9efa], length 1428
15:11:27.933493 IP 112.26.3.1.34615 > 112.26.3.8.43525: Flags [.], seq 35701:37129, ack 1, win 4017, options [nop,nop,TS val 3127959 ecr 2889501,mptcp dss ack 3193170700 seq 2059037927 subseq 35701 len 1428 csum 0x9efa], length 1428
15:11:27.947071 IP 112.26.3.8.43525 > 112.26.3.1.34615: Flags [.], ack 37129, win 17384, options [nop,nop,TS val 2890328 ecr 3127959,mptcp dss ack 2058995087], length 0
15:11:27.986535 IP 112.26.3.8.43525 > 112.26.3.1.34615: Flags [.], ack 37129, win 17384, options [nop,nop,TS val 2890328 ecr 3127959,mptcp dss ack 2058995087], length 0
15:11:28.147689 IP 112.26.3.8.43525 > 112.26.3.1.34615: Flags [.], ack 35701, win 17064, options [nop,nop,TS val 2890047 ecr 3127718,mptcp dss ack 2058980807], length 0
15:11:28.199084 IP 112.26.3.1.34615 > 112.26.3.8.43525: Flags [.], seq 37129:38557, ack 1, win 4017, options [nop,nop,TS val 3127959 ecr 2889501,mptcp dss ack 3193170700 seq 2059039355 subseq 37129 len 1428 csum 0x7488], length 1428
15:11:28.199408 IP 112.26.3.1.34615 > 112.26.3.8.43525: Flags [.], seq 37129:38557, ack 1, win 4017, options [nop,nop,TS val 3127959 ecr 2889501,mptcp dss ack 3193170700 seq 2059039355 subseq 37129 len 1428 csum 0x7488], length 1428
15:11:28.214494 IP 112.26.3.8.43525 > 112.26.3.1.34615: Flags [.], ack 38557, win 17657, options [nop,nop,TS val 2890595 ecr 3127959,mptcp dss ack 2058995087], length 0
15:11:28.217211 IP 112.26.3.8.43525 > 112.26.3.1.34615: Flags [.], ack 38557, win 17657, options [nop,nop,TS val 2890595 ecr 3127959,mptcp dss ack 2058995087], length 0
15:11:28.440980 IP 112.26.3.1.34615 > 112.26.3.8.43525: Flags [.], seq 38557:39985, ack 1, win 4017, options [nop,nop,TS val 3128256 ecr 2889745,mptcp dss ack 3193170700 seq 2059047923 subseq 38557 len 1428 csum 0x8c8], length 1428
15:11:28.441310 IP 112.26.3.1.34615 > 112.26.3.8.43525: Flags [.], seq 38557:39985, ack 1, win 4017, options [nop,nop,TS val 3128256 ecr 2889745,mptcp dss ack 3193170700 seq 2059047923 subseq 38557 len 1428 csum 0x8c8], length 1428
15:11:28.453629 IP 112.26.3.8.43525 > 112.26.3.1.34615: Flags [.], ack 39985, win 17977, options [nop,nop,TS val 2890836 ecr 3128256,mptcp dss ack 2059003655], length 0
15:11:28.510822 IP 112.26.3.8.43525 > 112.26.3.1.34615: Flags [.], ack 39985, win 17977, options [nop,nop,TS val 2890836 ecr 3128256,mptcp dss ack 2059003655], length 0
15:11:28.513943 IP 112.26.3.8.43525 > 112.26.3.1.34615: Flags [.], ack 38557, win 17657, options [nop,nop,TS val 2890595 ecr 3127959,mptcp dss ack 2058995087], length 0
15:11:28.754543 IP 112.26.3.1.34615 > 112.26.3.8.43525: Flags [.], seq 41413:42841, ack 1, win 4017, options [nop,nop,TS val 3128968 ecr 2890595,mptcp dss ack 3193170700 seq 2059080767 subseq 41413 len 1428 csum 0xc230], length 1428
15:11:28.754800 IP 112.26.3.1.34615 > 112.26.3.8.43525: Flags [.], seq 41413:42841, ack 1, win 4017, options [nop,nop,TS val 3128968 ecr 2890595,mptcp dss ack 3193170700 seq 2059080767 subseq 41413 len 1428 csum 0xc230], length 1428
15:11:28.812259 IP 112.26.3.8.43525 > 112.26.3.1.34615: Flags [.], ack 39985, win 18342, options [nop,nop,TS val 2891164 ecr 3128256,nop,nop,sack 1 {41413:42841},mptcp dss ack 2059003655], length 0
15:11:28.841985 IP 112.26.3.8.43525 > 112.26.3.1.34615: Flags [.], ack 39985, win 18342, options [nop,nop,TS val 2891164 ecr 3128256,nop,nop,sack 1 {41413:42841},mptcp dss ack 2059003655], length 0
15:11:28.997383 IP 112.26.3.8.43525 > 112.26.3.1.34615: Flags [.], ack 39985, win 17977, options [nop,nop,TS val 2890836 ecr 3128256,mptcp dss ack 2059003655], length 0
15:11:29.106733 IP 112.26.3.1.34615 > 112.26.3.8.43525: Flags [.], seq 42841:44269, ack 1, win 4017, options [nop,nop,TS val 3128968 ecr 2890595,mptcp dss ack 3193170700 seq 2059082195 subseq 42841 len 1428 csum 0x5c40], length 1428
15:11:29.107049 IP 112.26.3.1.34615 > 112.26.3.8.43525: Flags [.], seq 42841:44269, ack 1, win 4017, options [nop,nop,TS val 3128968 ecr 2890595,mptcp dss ack 3193170700 seq 2059082195 subseq 42841 len 1428 csum 0x5c40], length 1428
15:11:29.123405 IP 112.26.3.8.43525 > 112.26.3.1.34615: Flags [.], ack 39985, win 18752, options [nop,nop,TS val 2891505 ecr 3128256,nop,nop,sack 1 {41413:44269},mptcp dss ack 2059003655], length 0
15:11:29.126022 IP 112.26.3.8.43525 > 112.26.3.1.34615: Flags [.], ack 39985, win 18752, options [nop,nop,TS val 2891505 ecr 3128256,nop,nop,sack 1 {41413:44269},mptcp dss ack 2059003655], length 0
15:11:29.231789 IP 112.26.3.8.43525 > 112.26.3.1.34615: Flags [.], ack 39985, win 18342, options [nop,nop,TS val 2891164 ecr 3128256,nop,nop,sack 1 {41413:42841},mptcp dss ack 2059003655], length 0
15:11:29.408560 IP 112.26.3.1.34615 > 112.26.3.8.43525: Flags [.], seq 45697:47125, ack 1, win 4017, options [nop,nop,TS val 3129451 ecr 2890836,mptcp dss ack 3193170700 seq 2059056491 subseq 45697 len 1428 csum 0x2eb2], length 1428
15:11:29.408878 IP 112.26.3.1.34615 > 112.26.3.8.43525: Flags [.], seq 45697:47125, ack 1, win 4017, options [nop,nop,TS val 3129451 ecr 2890836,mptcp dss ack 3193170700 seq 2059056491 subseq 45697 len 1428 csum 0x2eb2], length 1428
15:11:29.418115 IP 112.26.3.8.43525 > 112.26.3.1.34615: Flags [.], ack 39985, win 19072, options [nop,nop,TS val 2891801 ecr 3128256,nop,nop,sack 2 {45697:47125}{41413:44269},mptcp dss ack 2059003655], length 0
15:11:29.430016 IP 112.26.3.8.43525 > 112.26.3.1.34615: Flags [.], ack 39985, win 19072, options [nop,nop,TS val 2891801 ecr 3128256,nop,nop,sack 2 {45697:47125}{41413:44269},mptcp dss ack 2059003655], length 0
15:11:29.518735 IP 112.26.3.8.43525 > 112.26.3.1.34615: Flags [.], ack 39985, win 18752, options [nop,nop,TS val 2891505 ecr 3128256,nop,nop,sack 1 {41413:44269},mptcp dss ack 2059003655], length 0
15:11:29.635969 IP 112.26.3.1.34615 > 112.26.3.8.43525: Flags [.], seq 47125:48553, ack 1, win 4017, options [nop,nop,TS val 3129718 ecr 2891164,mptcp dss ack 3193170700 seq 2059062203 subseq 47125 len 1428 csum 0xa06b], length 1428
15:11:29.636298 IP 112.26.3.1.34615 > 112.26.3.8.43525: Flags [.], seq 47125:48553, ack 1, win 4017, options [nop,nop,TS val 3129718 ecr 2891164,mptcp dss ack 3193170700 seq 2059062203 subseq 47125 len 1428 csum 0xa06b], length 1428
15:11:29.697430 IP 112.26.3.8.43525 > 112.26.3.1.34615: Flags [.], ack 39985, win 19345, options [nop,nop,TS val 2892038 ecr 3128256,nop,nop,sack 2 {45697:48553}{41413:44269},mptcp dss ack 2059003655], length 0
15:11:29.699247 IP 112.26.3.8.43525 > 112.26.3.1.34615: Flags [.], ack 39985, win 19345, options [nop,nop,TS val 2892038 ecr 3128256,nop,nop,sack 2 {45697:48553}{41413:44269},mptcp dss ack 2059003655], length 0
15:11:29.802143 IP 112.26.3.8.43525 > 112.26.3.1.34615: Flags [.], ack 39985, win 19072, options [nop,nop,TS val 2891801 ecr 3128256,nop,nop,sack 2 {45697:47125}{41413:44269},mptcp dss ack 2059003655], length 0
15:11:29.894974 IP 112.26.3.8.43525 > 112.26.3.1.34615: Flags [.], ack 39985, win 19345, options [nop,nop,TS val 2892038 ecr 3128256,nop,nop,sack 2 {45697:48553}{41413:44269},mptcp dss ack 2059003655], length 0
15:11:29.947272 IP 112.26.3.1.34615 > 112.26.3.8.43525: Flags [.], seq 48553:49981, ack 1, win 4017, options [nop,nop,TS val 3129979 ecr 2891505,mptcp dss ack 3193170700 seq 2059072199 subseq 48553 len 1428 csum 0x1365], length 1428
15:11:29.947632 IP 112.26.3.1.34615 > 112.26.3.8.43525: Flags [.], seq 48553:49981, ack 1, win 4017, options [nop,nop,TS val 3129979 ecr 2891505,mptcp dss ack 3193170700 seq 2059072199 subseq 48553 len 1428 csum 0x1365], length 1428
15:11:29.958086 IP 112.26.3.8.43525 > 112.26.3.1.34615: Flags [.], ack 39985, win 19619, options [nop,nop,TS val 2892341 ecr 3128256,nop,nop,sack 2 {45697:49981}{41413:44269},mptcp dss ack 2059003655], length 0
15:11:30.057062 IP 112.26.3.8.43525 > 112.26.3.1.34615: Flags [.], ack 39985, win 19619, options [nop,nop,TS val 2892341 ecr 3128256,nop,nop,sack 2 {45697:49981}{41413:44269},mptcp dss ack 2059003655], length 0
15:11:30.144198 IP 112.26.3.8.43525 > 112.26.3.1.34615: Flags [.], ack 39985, win 19619, options [nop,nop,TS val 2892341 ecr 3128256,nop,nop,sack 2 {45697:49981}{41413:44269},mptcp dss ack 2059003655], length 0
15:11:30.208808 IP 112.26.3.1.34615 > 112.26.3.8.43525: Flags [.], seq 39985:41413, ack 1, win 4017, options [nop,nop,TS val 3130256 ecr 2891801,mptcp dss ack 3193170700 seq 2059070771 subseq 39985 len 1428 csum 0x5a6b], length 1428
15:11:30.209132 IP 112.26.3.1.34615 > 112.26.3.8.43525: Flags [.], seq 39985:41413, ack 1, win 4017, options [nop,nop,TS val 3130256 ecr 2891801,mptcp dss ack 3193170700 seq 2059070771 subseq 39985 len 1428 csum 0x5a6b], length 1428
15:11:30.223650 IP 112.26.3.8.43525 > 112.26.3.1.34615: Flags [.], ack 44269, win 19984, options [nop,nop,TS val 2892605 ecr 3130256,nop,nop,sack 1 {45697:49981},mptcp dss ack 2059083623], length 0
15:11:30.267721 IP 112.26.3.8.43525 > 112.26.3.1.34615: Flags [.], ack 44269, win 19984, options [nop,nop,TS val 2892605 ecr 3130256,nop,nop,sack 1 {45697:49981},mptcp dss ack 2059083623], length 0
15:11:30.396962 IP 112.26.3.8.43525 > 112.26.3.1.34615: Flags [.], ack 44269, win 19984, options [nop,nop,TS val 2892605 ecr 3130256,nop,nop,sack 1 {45697:49981},mptcp dss ack 2059083623], length 0
15:11:30.584193 IP 112.26.3.1.34615 > 112.26.3.8.43525: Flags [.], seq 44269:45697, ack 1, win 4017, options [nop,nop,TS val 3130349 ecr 2892038,mptcp dss ack 3193170700 seq 2059083623 subseq 44269 len 1428 csum 0x504a], length 1428
15:11:30.584421 IP 112.26.3.1.34615 > 112.26.3.8.43525: Flags [.], seq 44269:45697, ack 1, win 4017, options [nop,nop,TS val 3130349 ecr 2892038,mptcp dss ack 3193170700 seq 2059083623 subseq 44269 len 1428 csum 0x504a], length 1428
15:11:30.596706 IP 112.26.3.8.43525 > 112.26.3.1.34615: Flags [.], ack 49981, win 20440, options [nop,nop,TS val 2892978 ecr 3130349,mptcp dss ack 2059085051], length 0
15:11:30.772079 IP 112.26.3.1.34615 > 112.26.3.8.43525: Flags [.], seq 51409:52837, ack 1, win 4017, options [nop,nop,TS val 3130851 ecr 2892605,mptcp dss ack 3193170700 seq 2059112183 subseq 51409 len 1428 csum 0xa424], length 1428
15:11:30.772418 IP 112.26.3.1.34615 > 112.26.3.8.43525: Flags [.], seq 51409:52837, ack 1, win 4017, options [nop,nop,TS val 3130851 ecr 2892605,mptcp dss ack 3193170700 seq 2059112183 subseq 51409 len 1428 csum 0xa424], length 1428
15:11:30.850773 IP 112.26.3.8.43525 > 112.26.3.1.34615: Flags [.], ack 49981, win 20669, options [nop,nop,TS val 2893232 ecr 3130349,nop,nop,sack 1 {51409:52837},mptcp dss ack 2059085051], length 0
15:11:30.963845 IP 112.26.3.8.43525 > 112.26.3.1.34615: Flags [.], ack 49981, win 20440, options [nop,nop,TS val 2892978 ecr 3130349,mptcp dss ack 2059085051], length 0
15:11:30.966167 IP 112.26.3.8.43525 > 112.26.3.1.34615: Flags [.], ack 49981, win 20440, options [nop,nop,TS val 2892978 ecr 3130349,mptcp dss ack 2059085051], length 0
15:11:31.061049 IP 112.26.3.8.43525 > 112.26.3.1.34615: Flags [.], ack 49981, win 20669, options [nop,nop,TS val 2893232 ecr 3130349,nop,nop,sack 1 {51409:52837},mptcp dss ack 2059085051], length 0
15:11:31.147622 IP 112.26.3.8.43525 > 112.26.3.1.34615: Flags [.], ack 49981, win 20669, options [nop,nop,TS val 2893232 ecr 3130349,nop,nop,sack 1 {51409:52837},mptcp dss ack 2059085051], length 0
15:11:31.258247 IP 112.26.3.1.34615 > 112.26.3.8.43525: Flags [.], seq 52837:54265, ack 1, win 4017, options [nop,nop,TS val 3131420 ecr 2892978,mptcp dss ack 3193170700 seq 2059140743 subseq 52837 len 1428 csum 0x4f18], length 1428
15:11:31.258613 IP 112.26.3.1.34615 > 112.26.3.8.43525: Flags [.], seq 52837:54265, ack 1, win 4017, options [nop,nop,TS val 3131420 ecr 2892978,mptcp dss ack 3193170700 seq 2059140743 subseq 52837 len 1428 csum 0x4f18], length 1428
15:11:31.464833 IP 112.26.3.1.34615 > 112.26.3.8.43525: Flags [.], seq 54265:55693, ack 1, win 4017, options [nop,nop,TS val 3131606 ecr 2893232,mptcp dss ack 3193170700 seq 2059146455 subseq 54265 len 1428 csum 0xe5e], length 1428
15:11:31.465163 IP 112.26.3.1.34615 > 112.26.3.8.43525: Flags [.], seq 54265:55693, ack 1, win 4017, options [nop,nop,TS val 3131606 ecr 2893232,mptcp dss ack 3193170700 seq 2059146455 subseq 54265 len 1428 csum 0xe5e], length 1428
15:11:31.533275 IP 112.26.3.8.43525 > 112.26.3.1.34615: Flags [.], ack 49981, win 21535, options [nop,nop,TS val 2893915 ecr 3130349,nop,nop,sack 1 {51409:55693},mptcp dss ack 2059096475], length 0
15:11:31.544521 IP 112.26.3.8.43525 > 112.26.3.1.34615: Flags [.], ack 49981, win 21535, options [nop,nop,TS val 2893915 ecr 3130349,nop,nop,sack 1 {51409:55693},mptcp dss ack 2059096475], length 0
15:11:31.559401 IP 112.26.3.8.43525 > 112.26.3.1.34615: Flags [.], ack 49981, win 21535, options [nop,nop,TS val 2893915 ecr 3130349,nop,nop,sack 1 {51409:55693},mptcp dss ack 2059096475], length 0
