15:11:18.708696 IP 112.26.3.8.43525 > 112.26.3.1.34615: Flags [S], seq 1229268343, win 65535, options [mss 1460,sackOK,TS val 2881077 ecr 0,nop,wscale 6,mptcp join id 6 token 0x7761ebfe nonce 0x9fead8c2], length 0
15:11:18.708903 IP 112.26.3.8.43525 > 112.26.3.1.34615: Flags [S], seq 1229268343, win 65535, options [mss 1460,sackOK,TS val 2881077 ecr 0,nop,wscale 6,mptcp join id 6 token 0x7761ebfe nonce 0x9fead8c2], length 0
15:11:18.727020 IP 112.26.3.1.34615 > 112.26.3.8.43525: Flags [S.], seq 450080758, ack 1229268344, win 65535, options [mss 1460,sackOK,TS val 3119168 ecr 2881077,nop,wscale 6,mptcp join id 5 hmac 0x562114ae8e48a180 nonce 0x44054f4b], length 0
15:11:18.837340 IP 112.26.3.1.34615 > 112.26.3.8.43525: Flags [S.], seq 450080758, ack 1229268344, win 65535, options [mss 1460,sackOK,TS val 3119168 ecr 2881077,nop,wscale 6,mptcp join id 5 hmac 0x562114ae8e48a180 nonce 0x44054f4b], length 0
15:11:18.840005 IP 112.26.3.1.34615 > 112.26.3.8.43525: Flags [S.], seq 450080758, ack 1229268344, win 65535, options [mss 1460,sackOK,TS val 3119168 ecr 2881077,nop,wscale 6,mptcp join id 5 hmac 0x562114ae8e48a180 nonce 0x44054f4b], length 0
15:11:18.926367 IP 112.26.3.8.43525 > 112.26.3.1.34615: Flags [.], ack 1, win 6935, options [nop,nop,TS val 2881225 ecr 3119168,mptcp join hmac 0x4759602301f376696cd07ac785aee41faa6fbfc8], length 0
15:11:18.926580 IP 112.26.3.8.43525 > 112.26.3.1.34615: Flags [.], ack 1, win 6935, options [nop,nop,TS val 2881225 ecr 3119168,mptcp join hmac 0x4759602301f376696cd07ac785aee41faa6fbfc8], length 0
15:11:18.945705 IP 112.26.3.1.34615 > 112.26.3.8.43525: Flags [.], ack 1, win 4017, options [nop,nop,TS val 3119387 ecr 2881225,mptcp dss ack 3193170700], length 0
15:11:18.981872 IP 112.26.3.1.34615 > 112.26.3.8.43525: Flags [.], ack 1, win 4017, options [nop,nop,TS val 3119387 ecr 2881225,mptcp dss ack 3193170700], length 0
15:11:18.985253 IP 112.26.3.1.34615 > 112.26.3.8.43525: Flags [.], ack 1, win 4017, options [nop,nop,TS val 3119387 ecr 2881225,mptcp dss ack 3193170700], length 0
15:11:19.043809 IP 112.26.3.1.34615 > 112.26.3.8.43525: Flags [.], seq 1:1429, ack 1, win 4017, options [nop,nop,TS val 3119398 ecr 2881225,mptcp dss ack 3193170700 seq 2058745187 subseq 1 len 1428 csum 0xd147], length 1428
15:11:19.241888 IP 112.26.3.1.34615 > 112.26.3.8.43525: Flags [.], seq 1429:2857, ack 1, win 4017, options [nop,nop,TS val 3119398 ecr 2881225,mptcp dss ack 3193170700 seq 2058746615 subseq 1429 len 1428 csum 0x2a6f], length 1428
15:11:19.315104 IP 112.26.3.1.34615 > 112.26.3.8.43525: Flags [.], seq 1:1429, ack 1, win 4017, options [nop,nop,TS val 3119398 ecr 2881225,mptcp dss ack 3193170700 seq 2058745187 subseq 1 len 1428 csum 0xd147], length 1428
15:11:19.323921 IP 112.26.3.1.34615 > 112.26.3.8.43525: Flags [.], seq 1:1429, ack 1, win 4017, options [nop,nop,TS val 3119398 ecr 2881225,mptcp dss ack 3193170700 seq 2058745187 subseq 1 len 1428 csum 0xd147], length 1428
15:11:19.455276 IP 112.26.3.1.34615 > 112.26.3.8.43525: Flags [.], seq 2857:4285, ack 1, win 4017, options [nop,nop,TS val 3119398 ecr 2881225,mptcp dss ack 3193170700 seq 2058748043 subseq 2857 len 1428 csum 0xafa2], length 1428
15:11:19.523269 IP 112.26.3.8.43525 > 112.26.3.1.34615: Flags [.], ack 1429, win 7300, options [nop,nop,TS val 2881709 ecr 3119398,mptcp dss ack 2058722339], length 0
15:11:19.523469 IP 112.26.3.8.43525 > 112.26.3.1.34615: Flags [.], ack 1429, win 7300, options [nop,nop,TS val 2881709 ecr 3119398,mptcp dss ack 2058722339], length 0
15:11:19.669354 IP 112.26.3.1.34615 > 112.26.3.8.43525: Flags [.], seq 12853:14281, ack 1, win 4017, options [nop,nop,TS val 3119840 ecr 2881225,mptcp dss ack 3193170700 seq 2058758039 subseq 12853 len 1428 csum 0xc093], length 1428
15:11:19.776882 IP 112.26.3.1.34615 > 112.26.3.8.43525: Flags [.], seq 1429:2857, ack 1, win 4017, options [nop,nop,TS val 3119398 ecr 2881225,mptcp dss ack 3193170700 seq 2058746615 subseq 1429 len 1428 csum 0x2a6f], length 1428
15:11:19.802286 IP 112.26.3.1.34615 > 112.26.3.8.43525: Flags [.], seq 1429:2857, ack 1, win 4017, options [nop,nop,TS val 3119398 ecr 2881225,mptcp dss ack 3193170700 seq 2058746615 subseq 1429 len 1428 csum 0x2a6f], length 1428
15:11:19.982790 IP 112.26.3.1.34615 > 112.26.3.8.43525: Flags [.], seq 14281:15709, ack 1, win 4017, options [nop,nop,TS val 3119994 ecr 2881709,mptcp dss ack 3193170700 seq 2058792311 subseq 14281 len 1428 csum 0xe441], length 1428
15:11:20.066832 IP 112.26.3.1.34615 > 112.26.3.8.43525: Flags [.], seq 15709:17137, ack 1, win 4017, options [nop,nop,TS val 3119994 ecr 2881709,mptcp dss ack 3193170700 seq 2058793739 subseq 15709 len 1428 csum 0x8f28], length 1428
15:11:20.281321 IP 112.26.3.1.34615 > 112.26.3.8.43525: Flags [.], seq 1429:2857, ack 1, win 4017, options [nop,nop,TS val 3120378 ecr 2881709,mptcp dss ack 3193170700 seq 2058746615 subseq 1429 len 1428 csum 0x2a6f], length 1428
15:11:20.304902 IP 112.26.3.1.34615 > 112.26.3.8.43525: Flags [.], seq 14281:15709, ack 1, win 4017, options [nop,nop,TS val 3119994 ecr 2881709,mptcp dss ack 3193170700 seq 2058792311 subseq 14281 len 1428 csum 0xe441], length 1428
15:11:20.349263 IP 112.26.3.1.34615 > 112.26.3.8.43525: Flags [.], seq 14281:15709, ack 1, win 4017, options [nop,nop,TS val 3119994 ecr 2881709,mptcp dss ack 3193170700 seq 2058792311 subseq 14281 len 1428 csum 0xe441], length 1428
15:11:20.559538 IP 112.26.3.1.34615 > 112.26.3.8.43525: Flags [.], seq 15709:17137, ack 1, win 4017, options [nop,nop,TS val 3119994 ecr 2881709,mptcp dss ack 3193170700 seq 2058793739 subseq 15709 len 1428 csum 0x8f28], length 1428
15:11:20.572175 IP 112.26.3.1.34615 > 112.26.3.8.43525: Flags [.], seq 15709:17137, ack 1, win 4017, options [nop,nop,TS val 3119994 ecr 2881709,mptcp dss ack 3193170700 seq 2058793739 subseq 15709 len 1428 csum 0x8f28], length 1428
15:11:20.575453 IP 112.26.3.8.43525 > 112.26.3.1.34615: Flags [.], ack 2857, win 8350, options [nop,nop,TS val 2882701 ecr 3119398,nop,nop,sack 1 {14281:15709},mptcp dss ack 2058739475], length 0
15:11:20.575712 IP 112.26.3.8.43525 > 112.26.3.1.34615: Flags [.], ack 2857, win 8350, options [nop,nop,TS val 2882701 ecr 3119398,nop,nop,sack 1 {14281:15709},mptcp dss ack 2058739475], length 0
15:11:20.618820 IP 112.26.3.1.34615 > 112.26.3.8.43525: Flags [.], seq 2857:4285, ack 1, win 4017, options [nop,nop,TS val 3121032 ecr 2882701,mptcp dss ack 3193170700 seq 2058748043 subseq 2857 len 1428 csum 0xafa2], length 1428
15:11:20.736221 IP 112.26.3.8.43525 > 112.26.3.1.34615: Flags [.], ack 2857, win 8669, options [nop,nop,TS val 2882957 ecr 3119398,nop,nop,sack 1 {14281:17137},mptcp dss ack 2058739475], length 0
15:11:20.736441 IP 112.26.3.8.43525 > 112.26.3.1.34615: Flags [.], ack 2857, win 8669, options [nop,nop,TS val 2882957 ecr 3119398,nop,nop,sack 1 {14281:17137},mptcp dss ack 2058739475], length 0
15:11:20.817985 IP 112.26.3.1.34615 > 112.26.3.8.43525: Flags [.], seq 4285:5713, ack 1, win 4017, options [nop,nop,TS val 3121032 ecr 2882701,mptcp dss ack 3193170700 seq 2058749471 subseq 4285 len 1428 csum 0xd363], length 1428
15:11:21.022362 IP 112.26.3.1.34615 > 112.26.3.8.43525: Flags [.], seq 5713:7141, ack 1, win 4017, options [nop,nop,TS val 3121032 ecr 2882701,mptcp dss ack 3193170700 seq 2058750899 subseq 5713 len 1428 csum 0x1df], length 1428
15:11:21.121138 IP 112.26.3.1.34615 > 112.26.3.8.43525: Flags [.], seq 2857:4285, ack 1, win 4017, options [nop,nop,TS val 3121032 ecr 2882701,mptcp dss ack 3193170700 seq 2058748043 subseq 2857 len 1428 csum 0xafa2], length 1428
15:11:21.134571 IP 112.26.3.1.34615 > 112.26.3.8.43525: Flags [.], seq 2857:4285, ack 1, win 4017, options [nop,nop,TS val 3121032 ecr 2882701,mptcp dss ack 3193170700 seq 2058748043 subseq 2857 len 1428 csum 0xafa2], length 1428
15:11:21.238097 IP 112.26.3.1.34615 > 112.26.3.8.43525: Flags [.], seq 7141:8569, ack 1, win 4017, options [nop,nop,TS val 3121444 ecr 2882957,mptcp dss ack 3193170700 seq 2058752327 subseq 7141 len 1428 csum 0xb467], length 1428
15:11:21.308878 IP 112.26.3.8.43525 > 112.26.3.1.34615: Flags [.], ack 4285, win 9262, options [nop,nop,TS val 2883519 ecr 3121032,nop,nop,sack 1 {14281:17137},mptcp dss ack 2058739475], length 0
15:11:21.309098 IP 112.26.3.8.43525 > 112.26.3.1.34615: Flags [.], ack 4285, win 9262, options [nop,nop,TS val 2883519 ecr 3121032,nop,nop,sack 1 {14281:17137},mptcp dss ack 2058739475], length 0
15:11:21.371561 IP 112.26.3.1.34615 > 112.26.3.8.43525: Flags [.], seq 8569:9997, ack 1, win 4017, options [nop,nop,TS val 3121810 ecr 2883519,mptcp dss ack 3193170700 seq 2058753755 subseq 8569 len 1428 csum 0xa26e], length 1428
15:11:21.539347 IP 112.26.3.1.34615 > 112.26.3.8.43525: Flags [.], seq 5713:7141, ack 1, win 4017, options [nop,nop,TS val 3121032 ecr 2882701,mptcp dss ack 3193170700 seq 2058750899 subseq 5713 len 1428 csum 0x1df], length 1428
15:11:21.552564 IP 112.26.3.1.34615 > 112.26.3.8.43525: Flags [.], seq 5713:7141, ack 1, win 4017, options [nop,nop,TS val 3121032 ecr 2882701,mptcp dss ack 3193170700 seq 2058750899 subseq 5713 len 1428 csum 0x1df], length 1428
15:11:21.567445 IP 112.26.3.1.34615 > 112.26.3.8.43525: Flags [.], seq 9997:11425, ack 1, win 4017, options [nop,nop,TS val 3121810 ecr 2883519,mptcp dss ack 3193170700 seq 2058755183 subseq 9997 len 1428 csum 0x5137], length 1428
15:11:21.637970 IP 112.26.3.8.43525 > 112.26.3.1.34615: Flags [.], ack 4285, win 9810, options [nop,nop,TS val 2883937 ecr 3121032,nop,nop,sack 2 {5713:7141}{14281:17137},mptcp dss ack 2058752327], length 0
15:11:21.638199 IP 112.26.3.8.43525 > 112.26.3.1.34615: Flags [.], ack 4285, win 9810, options [nop,nop,TS val 2883937 ecr 3121032,nop,nop,sack 2 {5713:7141}{14281:17137},mptcp dss ack 2058752327], length 0
15:11:21.754097 IP 112.26.3.1.34615 > 112.26.3.8.43525: Flags [.], seq 11425:12853, ack 1, win 4017, options [nop,nop,TS val 3122095 ecr 2883937,mptcp dss ack 3193170700 seq 2058756611 subseq 11425 len 1428 csum 0xca25], length 1428
15:11:21.933681 IP 112.26.3.1.34615 > 112.26.3.8.43525: Flags [.], seq 8569:9997, ack 1, win 4017, options [nop,nop,TS val 3121810 ecr 2883519,mptcp dss ack 3193170700 seq 2058753755 subseq 8569 len 1428 csum 0xa26e], length 1428
15:11:21.947448 IP 112.26.3.1.34615 > 112.26.3.8.43525: Flags [.], seq 8569:9997, ack 1, win 4017, options [nop,nop,TS val 3121810 ecr 2883519,mptcp dss ack 3193170700 seq 2058753755 subseq 8569 len 1428 csum 0xa26e], length 1428
15:11:22.176070 IP 112.26.3.1.34615 > 112.26.3.8.43525: Flags [.], seq 11425:12853, ack 1, win 4017, options [nop,nop,TS val 3122095 ecr 2883937,mptcp dss ack 3193170700 seq 2058756611 subseq 11425 len 1428 csum 0xca25], length 1428
15:11:22.199625 IP 112.26.3.1.34615 > 112.26.3.8.43525: Flags [.], seq 11425:12853, ack 1, win 4017, options [nop,nop,TS val 3122095 ecr 2883937,mptcp dss ack 3193170700 seq 2058756611 subseq 11425 len 1428 csum 0xca25], length 1428
15:11:22.220396 IP 112.26.3.8.43525 > 112.26.3.1.34615: Flags [.], ack 4285, win 10540, options [nop,nop,TS val 2884584 ecr 3121032,nop,nop,sack 2 {11425:12853}{8569:9997},mptcp dss ack 2058756611], length 0
15:11:22.220628 IP 112.26.3.8.43525 > 112.26.3.1.34615: Flags [.], ack 4285, win 10540, options [nop,nop,TS val 2884584 ecr 3121032,nop,nop,sack 2 {11425:12853}{8569:9997},mptcp dss ack 2058756611], length 0
15:11:22.243403 IP 112.26.3.1.34615 > 112.26.3.8.43525: Flags [.], seq 4285:5713, ack 1, win 4017, options [nop,nop,TS val 3122683 ecr 2884584,mptcp dss ack 3193170700 seq 2058749471 subseq 4285 len 1428 csum 0xd363], length 1428
15:11:22.412309 IP 112.26.3.1.34615 > 112.26.3.8.43525: Flags [.], seq 7141:8569, ack 1, win 4017, options [nop,nop,TS val 3122683 ecr 2884584,mptcp dss ack 3193170700 seq 2058752327 subseq 7141 len 1428 csum 0xb467], length 1428
15:11:22.643006 IP 112.26.3.1.34615 > 112.26.3.8.43525: Flags [.], seq 4285:5713, ack 1, win 4017, options [nop,nop,TS val 3122683 ecr 2884584,mptcp dss ack 3193170700 seq 2058749471 subseq 4285 len 1428 csum 0xd363], length 1428
15:11:22.656596 IP 112.26.3.1.34615 > 112.26.3.8.43525: Flags [.], seq 4285:5713, ack 1, win 4017, options [nop,nop,TS val 3122683 ecr 2884584,mptcp dss ack 3193170700 seq 2058749471 subseq 4285 len 1428 csum 0xd363], length 1428
15:11:22.806012 IP 112.26.3.8.43525 > 112.26.3.1.34615: Flags [.], ack 7141, win 11087, options [nop,nop,TS val 2885041 ecr 3122683,nop,nop,sack 2 {11425:12853}{8569:9997},mptcp dss ack 2058756611], length 0
15:11:22.806229 IP 112.26.3.8.43525 > 112.26.3.1.34615: Flags [.], ack 7141, win 11087, options [nop,nop,TS val 2885041 ecr 3122683,nop,nop,sack 2 {11425:12853}{8569:9997},mptcp dss ack 2058756611], length 0
15:11:22.829378 IP 112.26.3.1.34615 > 112.26.3.8.43525: Flags [.], seq 9997:11425, ack 1, win 4017, options [nop,nop,TS val 3123265 ecr 2885041,mptcp dss ack 3193170700 seq 2058755183 subseq 9997 len 1428 csum 0x5137], length 1428
15:11:22.987768 IP 112.26.3.1.34615 > 112.26.3.8.43525: Flags [.], seq 7141:8569, ack 1, win 4017, options [nop,nop,TS val 3122683 ecr 2884584,mptcp dss ack 3193170700 seq 2058752327 subseq 7141 len 1428 csum 0xb467], length 1428
15:11:23.001855 IP 112.26.3.1.34615 > 112.26.3.8.43525: Flags [.], seq 7141:8569, ack 1, win 4017, options [nop,nop,TS val 3122683 ecr 2884584,mptcp dss ack 3193170700 seq 2058752327 subseq 7141 len 1428 csum 0xb467], length 1428
15:11:23.007946 IP 112.26.3.8.43525 > 112.26.3.1.34615: Flags [.], ack 9997, win 11498, options [nop,nop,TS val 2885386 ecr 3122683,nop,nop,sack 2 {11425:12853}{14281:17137},mptcp dss ack 2058756611], length 0
15:11:23.008135 IP 112.26.3.8.43525 > 112.26.3.1.34615: Flags [.], ack 9997, win 11498, options [nop,nop,TS val 2885386 ecr 3122683,nop,nop,sack 2 {11425:12853}{14281:17137},mptcp dss ack 2058756611], length 0
15:11:23.076707 IP 112.26.3.1.34615 > 112.26.3.8.43525: Flags [.], seq 12853:14281, ack 1, win 4017, options [nop,nop,TS val 3123265 ecr 2885041,mptcp dss ack 3193170700 seq 2058758039 subseq 12853 len 1428 csum 0xc093], length 1428
15:11:23.212801 IP 112.26.3.1.34615 > 112.26.3.8.43525: Flags [.], seq 17137:18565, ack 1, win 4017, options [nop,nop,TS val 3123610 ecr 2885386,mptcp dss ack 3193170700 seq 2058876563 subseq 17137 len 1428 csum 0x9032], length 1428
15:11:23.326709 IP 112.26.3.1.34615 > 112.26.3.8.43525: Flags [.], seq 9997:11425, ack 1, win 4017, options [nop,nop,TS val 3123265 ecr 2885041,mptcp dss ack 3193170700 seq 2058755183 subseq 9997 len 1428 csum 0x5137], length 1428
15:11:23.334825 IP 112.26.3.1.34615 > 112.26.3.8.43525: Flags [.], seq 9997:11425, ack 1, win 4017, options [nop,nop,TS val 3123265 ecr 2885041,mptcp dss ack 3193170700 seq 2058755183 subseq 9997 len 1428 csum 0x5137], length 1428
15:11:23.348672 IP 112.26.3.8.43525 > 112.26.3.1.34615: Flags [.], ack 12853, win 12000, options [nop,nop,TS val 2885720 ecr 3123265,nop,nop,sack 1 {14281:17137},mptcp dss ack 2058782315], length 0
15:11:23.348928 IP 112.26.3.8.43525 > 112.26.3.1.34615: Flags [.], ack 12853, win 12000, options [nop,nop,TS val 2885720 ecr 3123265,nop,nop,sack 1 {14281:17137},mptcp dss ack 2058782315], length 0
15:11:23.439184 IP 112.26.3.1.34615 > 112.26.3.8.43525: Flags [.], seq 18565:19993, ack 1, win 4017, options [nop,nop,TS val 3123610 ecr 2885386,mptcp dss ack 3193170700 seq 2058877991 subseq 18565 len 1428 csum 0x76e6], length 1428
15:11:23.553905 IP 112.26.3.1.34615 > 112.26.3.8.43525: Flags [.], seq 19993:21421, ack 1, win 4017, options [nop,nop,TS val 3123993 ecr 2885720,mptcp dss ack 3193170700 seq 2058893699 subseq 19993 len 1428 csum 0x27f], length 1428
15:11:23.664116 IP 112.26.3.1.34615 > 112.26.3.8.43525: Flags [.], seq 21421:22849, ack 1, win 4017, options [nop,nop,TS val 3123993 ecr 2885720,mptcp dss ack 3193170700 seq 2058895127 subseq 21421 len 1428 csum 0x1bba], length 1428
15:11:23.738261 IP 112.26.3.1.34615 > 112.26.3.8.43525: Flags [.], seq 18565:19993, ack 1, win 4017, options [nop,nop,TS val 3123610 ecr 2885386,mptcp dss ack 3193170700 seq 2058877991 subseq 18565 len 1428 csum 0x76e6], length 1428
15:11:23.754412 IP 112.26.3.1.34615 > 112.26.3.8.43525: Flags [.], seq 18565:19993, ack 1, win 4017, options [nop,nop,TS val 3123610 ecr 2885386,mptcp dss ack 3193170700 seq 2058877991 subseq 18565 len 1428 csum 0x76e6], length 1428
15:11:23.781666 IP 112.26.3.8.43525 > 112.26.3.1.34615: Flags [.], ack 12853, win 12547, options [nop,nop,TS val 2886139 ecr 3123265,nop,nop,sack 2 {18565:19993}{14281:17137},mptcp dss ack 2058782315], length 0
15:11:23.781894 IP 112.26.3.8.43525 > 112.26.3.1.34615: Flags [.], ack 12853, win 12547, options [nop,nop,TS val 2886139 ecr 3123265,nop,nop,sack 2 {18565:19993}{14281:17137},mptcp dss ack 2058782315], length 0
15:11:23.916891 IP 112.26.3.1.34615 > 112.26.3.8.43525: Flags [.], seq 12853:14281, ack 1, win 4017, options [nop,nop,TS val 3124354 ecr 2886139,mptcp dss ack 3193170700 seq 2058758039 subseq 12853 len 1428 csum 0xc093], length 1428
15:11:24.055961 IP 112.26.3.1.34615 > 112.26.3.8.43525: Flags [.], seq 19993:21421, ack 1, win 4017, options [nop,nop,TS val 3123993 ecr 2885720,mptcp dss ack 3193170700 seq 2058893699 subseq 19993 len 1428 csum 0x27f], length 1428
15:11:24.080737 IP 112.26.3.1.34615 > 112.26.3.8.43525: Flags [.], seq 19993:21421, ack 1, win 4017, options [nop,nop,TS val 3123993 ecr 2885720,mptcp dss ack 3193170700 seq 2058893699 subseq 19993 len 1428 csum 0x27f], length 1428
15:11:24.095603 IP 112.26.3.8.43525 > 112.26.3.1.34615: Flags [.], ack 12853, win 12912, options [nop,nop,TS val 2886465 ecr 3123265,nop,nop,sack 2 {18565:21421}{14281:17137},mptcp dss ack 2058782315], length 0
15:11:24.095822 IP 112.26.3.8.43525 > 112.26.3.1.34615: Flags [.], ack 12853, win 12912, options [nop,nop,TS val 2886465 ecr 3123265,nop,nop,sack 2 {18565:21421}{14281:17137},mptcp dss ack 2058782315], length 0
15:11:24.298926 IP 112.26.3.1.34615 > 112.26.3.8.43525: Flags [.], seq 17137:18565, ack 1, win 4017, options [nop,nop,TS val 3124739 ecr 2886465,mptcp dss ack 3193170700 seq 2058876563 subseq 17137 len 1428 csum 0x9032], length 1428
15:11:24.465319 IP 112.26.3.1.34615 > 112.26.3.8.43525: Flags [.], seq 12853:14281, ack 1, win 4017, options [nop,nop,TS val 3124354 ecr 2886139,mptcp dss ack 3193170700 seq 2058758039 subseq 12853 len 1428 csum 0xc093], length 1428
15:11:24.479564 IP 112.26.3.1.34615 > 112.26.3.8.43525: Flags [.], seq 12853:14281, ack 1, win 4017, options [nop,nop,TS val 3124354 ecr 2886139,mptcp dss ack 3193170700 seq 2058758039 subseq 12853 len 1428 csum 0xc093], length 1428
15:11:24.502055 IP 112.26.3.8.43525 > 112.26.3.1.34615: Flags [.], ack 17137, win 13232, options [nop,nop,TS val 2886864 ecr 3124354,nop,nop,sack 1 {18565:21421},mptcp dss ack 2058782315], length 0
15:11:24.502248 IP 112.26.3.8.43525 > 112.26.3.1.34615: Flags [.], ack 17137, win 13232, options [nop,nop,TS val 2886864 ecr 3124354,nop,nop,sack 1 {18565:21421},mptcp dss ack 2058782315], length 0
15:11:24.673326 IP 112.26.3.1.34615 > 112.26.3.8.43525: Flags [.], seq 22849:24277, ack 1, win 4017, options [nop,nop,TS val 3125098 ecr 2886864,mptcp dss ack 3193170700 seq 2058927971 subseq 22849 len 1428 csum 0x76c3], length 1428
15:11:24.735735 IP 112.26.3.1.34615 > 112.26.3.8.43525: Flags [.], seq 17137:18565, ack 1, win 4017, options [nop,nop,TS val 3124739 ecr 2886465,mptcp dss ack 3193170700 seq 2058876563 subseq 17137 len 1428 csum 0x9032], length 1428
15:11:24.780360 IP 112.26.3.1.34615 > 112.26.3.8.43525: Flags [.], seq 17137:18565, ack 1, win 4017, options [nop,nop,TS val 3124739 ecr 2886465,mptcp dss ack 3193170700 seq 2058876563 subseq 17137 len 1428 csum 0x9032], length 1428
15:11:24.859085 IP 112.26.3.1.34615 > 112.26.3.8.43525: Flags [.], seq 24277:25705, ack 1, win 4017, options [nop,nop,TS val 3125098 ecr 2886864,mptcp dss ack 3193170700 seq 2058929399 subseq 24277 len 1428 csum 0x1965], length 1428
15:11:25.027942 IP 112.26.3.1.34615 > 112.26.3.8.43525: Flags [.], seq 22849:24277, ack 1, win 4017, options [nop,nop,TS val 3125098 ecr 2886864,mptcp dss ack 3193170700 seq 2058927971 subseq 22849 len 1428 csum 0x76c3], length 1428
15:11:25.041805 IP 112.26.3.1.34615 > 112.26.3.8.43525: Flags [.], seq 22849:24277, ack 1, win 4017, options [nop,nop,TS val 3125098 ecr 2886864,mptcp dss ack 3193170700 seq 2058927971 subseq 22849 len 1428 csum 0x76c3], length 1428
15:11:25.064346 IP 112.26.3.8.43525 > 112.26.3.1.34615: Flags [.], ack 21421, win 13962, options [nop,nop,TS val 2887427 ecr 3124739,nop,nop,sack 1 {22849:24277},mptcp dss ack 2058895127], length 0
15:11:25.064562 IP 112.26.3.8.43525 > 112.26.3.1.34615: Flags [.], ack 21421, win 13962, options [nop,nop,TS val 2887427 ecr 3124739,nop,nop,sack 1 {22849:24277},mptcp dss ack 2058895127], length 0
15:11:25.297461 IP 112.26.3.1.34615 > 112.26.3.8.43525: Flags [.], seq 21421:22849, ack 1, win 4017, options [nop,nop,TS val 3125726 ecr 2887427,mptcp dss ack 3193170700 seq 2058895127 subseq 21421 len 1428 csum 0x1bba], length 1428
15:11:25.393096 IP 112.26.3.1.34615 > 112.26.3.8.43525: Flags [.], seq 24277:25705, ack 1, win 4017, options [nop,nop,TS val 3125098 ecr 2886864,mptcp dss ack 3193170700 seq 2058929399 subseq 24277 len 1428 csum 0x1965], length 1428
15:11:25.401343 IP 112.26.3.1.34615 > 112.26.3.8.43525: Flags [.], seq 24277:25705, ack 1, win 4017, options [nop,nop,TS val 3125098 ecr 2886864,mptcp dss ack 3193170700 seq 2058929399 subseq 24277 len 1428 csum 0x1965], length 1428
15:11:25.535334 IP 112.26.3.8.43525 > 112.26.3.1.34615: Flags [.], ack 21421, win 14327, options [nop,nop,TS val 2887786 ecr 3124739,nop,nop,sack 1 {22849:25705},mptcp dss ack 2058895127], length 0
15:11:25.535537 IP 112.26.3.8.43525 > 112.26.3.1.34615: Flags [.], ack 21421, win 14327, options [nop,nop,TS val 2887786 ecr 3124739,nop,nop,sack 1 {22849:25705},mptcp dss ack 2058895127], length 0
15:11:25.547803 IP 112.26.3.1.34615 > 112.26.3.8.43525: Flags [.], seq 25705:27133, ack 1, win 4017, options [nop,nop,TS val 3125726 ecr 2887427,mptcp dss ack 3193170700 seq 2058955103 subseq 25705 len 1428 csum 0x8651], length 1428
15:11:25.605032 IP 112.26.3.1.34615 > 112.26.3.8.43525: Flags [.], seq 27133:28561, ack 1, win 4017, options [nop,nop,TS val 3125726 ecr 2887427,mptcp dss ack 3193170700 seq 2058956531 subseq 27133 len 1428 csum 0xe09], length 1428
15:11:25.738726 IP 112.26.3.1.34615 > 112.26.3.8.43525: Flags [.], seq 28561:29989, ack 1, win 4017, options [nop,nop,TS val 3126179 ecr 2887786,mptcp dss ack 3193170700 seq 2058969383 subseq 28561 len 1428 csum 0x5e61], length 1428
15:11:25.846831 IP 112.26.3.1.34615 > 112.26.3.8.43525: Flags [.], seq 25705:27133, ack 1, win 4017, options [nop,nop,TS val 3125726 ecr 2887427,mptcp dss ack 3193170700 seq 2058955103 subseq 25705 len 1428 csum 0x8651], length 1428
15:11:25.861455 IP 112.26.3.1.34615 > 112.26.3.8.43525: Flags [.], seq 25705:27133, ack 1, win 4017, options [nop,nop,TS val 3125726 ecr 2887427,mptcp dss ack 3193170700 seq 2058955103 subseq 25705 len 1428 csum 0x8651], length 1428
15:11:25.867110 IP 112.26.3.8.43525 > 112.26.3.1.34615: Flags [.], ack 21421, win 14965, options [nop,nop,TS val 2888246 ecr 3124739,nop,nop,sack 1 {22849:27133},mptcp dss ack 2058895127], length 0
15:11:25.867276 IP 112.26.3.8.43525 > 112.26.3.1.34615: Flags [.], ack 21421, win 14965, options [nop,nop,TS val 2888246 ecr 3124739,nop,nop,sack 1 {22849:27133},mptcp dss ack 2058895127], length 0
15:11:26.028263 IP 112.26.3.1.34615 > 112.26.3.8.43525: Flags [.], seq 27133:28561, ack 1, win 4017, options [nop,nop,TS val 3125726 ecr 2887427,mptcp dss ack 3193170700 seq 2058956531 subseq 27133 len 1428 csum 0xe09], length 1428
15:11:26.126579 IP 112.26.3.1.34615 > 112.26.3.8.43525: Flags [.], seq 29989:31417, ack 1, win 4017, options [nop,nop,TS val 3126568 ecr 2888246,mptcp dss ack 3193170700 seq 2058983663 subseq 29989 len 1428 csum 0x16eb], length 1428
15:11:26.225343 IP 112.26.3.8.43525 > 112.26.3.1.34615: Flags [.], ack 21421, win 15194, options [nop,nop,TS val 2888524 ecr 3124739,nop,nop,sack 1 {22849:28561},mptcp dss ack 2058895127], length 0
15:11:26.225565 IP 112.26.3.8.43525 > 112.26.3.1.34615: Flags [.], ack 21421, win 15194, options [nop,nop,TS val 2888524 ecr 3124739,nop,nop,sack 1 {22849:28561},mptcp dss ack 2058895127], length 0
15:11:26.247033 IP 112.26.3.1.34615 > 112.26.3.8.43525: Flags [.], seq 28561:29989, ack 1, win 4017, options [nop,nop,TS val 3126179 ecr 2887786,mptcp dss ack 3193170700 seq 2058969383 subseq 28561 len 1428 csum 0x5e61], length 1428
15:11:26.322593 IP 112.26.3.1.34615 > 112.26.3.8.43525: Flags [.], seq 27133:28561, ack 1, win 4017, options [nop,nop,TS val 3125726 ecr 2887427,mptcp dss ack 3193170700 seq 2058956531 subseq 27133 len 1428 csum 0xe09], length 1428
15:11:26.413579 IP 112.26.3.1.34615 > 112.26.3.8.43525: Flags [.], seq 28561:29989, ack 1, win 4017, options [nop,nop,TS val 3126179 ecr 2887786,mptcp dss ack 3193170700 seq 2058969383 subseq 28561 len 1428 csum 0x5e61], length 1428
15:11:26.426914 IP 112.26.3.8.43525 > 112.26.3.1.34615: Flags [.], ack 21421, win 15513, options [nop,nop,TS val 2888798 ecr 3124739,nop,nop,sack 1 {22849:29989},mptcp dss ack 2058895127], length 0
15:11:26.427091 IP 112.26.3.8.43525 > 112.26.3.1.34615: Flags [.], ack 21421, win 15513, options [nop,nop,TS val 2888798 ecr 3124739,nop,nop,sack 1 {22849:29989},mptcp dss ack 2058895127], length 0
15:11:26.461915 IP 112.26.3.1.34615 > 112.26.3.8.43525: Flags [.], seq 31417:32845, ack 1, win 4017, options [nop,nop,TS val 3126890 ecr 2888524,mptcp dss ack 3193170700 seq 2058997943 subseq 31417 len 1428 csum 0x253e], length 1428
15:11:26.561539 IP 112.26.3.1.34615 > 112.26.3.8.43525: Flags [.], seq 29989:31417, ack 1, win 4017, options [nop,nop,TS val 3126568 ecr 2888246,mptcp dss ack 3193170700 seq 2058983663 subseq 29989 len 1428 csum 0x16eb], length 1428
15:11:26.602460 IP 112.26.3.1.34615 > 112.26.3.8.43525: Flags [.], seq 29989:31417, ack 1, win 4017, options [nop,nop,TS val 3126568 ecr 2888246,mptcp dss ack 3193170700 seq 2058983663 subseq 29989 len 1428 csum 0x16eb], length 1428
15:11:26.679832 IP 112.26.3.8.43525 > 112.26.3.1.34615: Flags [.], ack 21421, win 15695, options [nop,nop,TS val 2888955 ecr 3124739,nop,nop,sack 1 {22849:31417},mptcp dss ack 2058895127], length 0
15:11:26.679998 IP 112.26.3.8.43525 > 112.26.3.1.34615: Flags [.], ack 21421, win 15695, options [nop,nop,TS val 2888955 ecr 3124739,nop,nop,sack 1 {22849:31417},mptcp dss ack 2058895127], length 0
15:11:26.725821 IP 112.26.3.1.34615 > 112.26.3.8.43525: Flags [.], seq 21421:22849, ack 1, win 4017, options [nop,nop,TS val 3127168 ecr 2888798,mptcp dss ack 3193170700 seq 2058895127 subseq 21421 len 1428 csum 0x1bba], length 1428
15:11:26.859482 IP 112.26.3.1.34615 > 112.26.3.8.43525: Flags [.], seq 31417:32845, ack 1, win 4017, options [nop,nop,TS val 3126890 ecr 2888524,mptcp dss ack 3193170700 seq 2058997943 subseq 31417 len 1428 csum 0x253e], length 1428
15:11:26.868121 IP 112.26.3.1.34615 > 112.26.3.8.43525: Flags [.], seq 31417:32845, ack 1, win 4017, options [nop,nop,TS val 3126890 ecr 2888524,mptcp dss ack 3193170700 seq 2058997943 subseq 31417 len 1428 csum 0x253e], length 1428
15:11:26.891499 IP 112.26.3.8.43525 > 112.26.3.1.34615: Flags [.], ack 21421, win 16060, options [nop,nop,TS val 2889252 ecr 3124739,nop,nop,sack 1 {22849:32845},mptcp dss ack 2058895127], length 0
15:11:26.891666 IP 112.26.3.8.43525 > 112.26.3.1.34615: Flags [.], ack 21421, win 16060, options [nop,nop,TS val 2889252 ecr 3124739,nop,nop,sack 1 {22849:32845},mptcp dss ack 2058895127], length 0
15:11:26.939409 IP 112.26.3.1.34615 > 112.26.3.8.43525: Flags [.], seq 32845:34273, ack 1, win 4017, options [nop,nop,TS val 3127325 ecr 2888955,mptcp dss ack 3193170700 seq 2059015079 subseq 32845 len 1428 csum 0x4ff7], length 1428
15:11:27.072672 IP 112.26.3.1.34615 > 112.26.3.8.43525: Flags [.], seq 21421:22849, ack 1, win 4017, options [nop,nop,TS val 3127168 ecr 2888798,mptcp dss ack 3193170700 seq 2058895127 subseq 21421 len 1428 csum 0x1bba], length 1428
15:11:27.116503 IP 112.26.3.1.34615 > 112.26.3.8.43525: Flags [.], seq 21421:22849, ack 1, win 4017, options [nop,nop,TS val 3127168 ecr 2888798,mptcp dss ack 3193170700 seq 2058895127 subseq 21421 len 1428 csum 0x1bba], length 1428
15:11:27.239436 IP 112.26.3.8.43525 > 112.26.3.1.34615: Flags [.], ack 32845, win 16289, options [nop,nop,TS val 2889501 ecr 3127168,mptcp dss ack 2058942251], length 0
15:11:27.239643 IP 112.26.3.8.43525 > 112.26.3.1.34615: Flags [.], ack 32845, win 16289, options [nop,nop,TS val 2889501 ecr 3127168,mptcp dss ack 2058942251], length 0
15:11:27.290284 IP 112.26.3.1.34615 > 112.26.3.8.43525: Flags [.], seq 34273:35701, ack 1, win 4017, options [nop,nop,TS val 3127718 ecr 2889252,mptcp dss ack 3193170700 seq 2059032215 subseq 34273 len 1428 csum 0xf06f], length 1428
15:11:27.347569 IP 112.26.3.1.34615 > 112.26.3.8.43525: Flags [.], seq 32845:34273, ack 1, win 4017, options [nop,nop,TS val 3127325 ecr 2888955,mptcp dss ack 3193170700 seq 2059015079 subseq 32845 len 1428 csum 0x4ff7], length 1428
15:11:27.359727 IP 112.26.3.1.34615 > 112.26.3.8.43525: Flags [.], seq 32845:34273, ack 1, win 4017, options [nop,nop,TS val 3127325 ecr 2888955,mptcp dss ack 3193170700 seq 2059015079 subseq 32845 len 1428 csum 0x4ff7], length 1428
15:11:27.377275 IP 112.26.3.8.43525 > 112.26.3.1.34615: Flags [.], ack 34273, win 16654, options [nop,nop,TS val 2889745 ecr 3127325,mptcp dss ack 2058947963], length 0
15:11:27.377454 IP 112.26.3.8.43525 > 112.26.3.1.34615: Flags [.], ack 34273, win 16654, options [nop,nop,TS val 2889745 ecr 3127325,mptcp dss ack 2058947963], length 0
15:11:27.521929 IP 112.26.3.1.34615 > 112.26.3.8.43525: Flags [.], seq 35701:37129, ack 1, win 4017, options [nop,nop,TS val 3127959 ecr 2889501,mptcp dss ack 3193170700 seq 2059037927 subseq 35701 len 1428 csum 0x9efa], length 1428
15:11:27.649486 IP 112.26.3.1.34615 > 112.26.3.8.43525: Flags [.], seq 34273:35701, ack 1, win 4017, options [nop,nop,TS val 3127718 ecr 2889252,mptcp dss ack 3193170700 seq 2059032215 subseq 34273 len 1428 csum 0xf06f], length 1428
15:11:27.662001 IP 112.26.3.1.34615 > 112.26.3.8.43525: Flags [.], seq 34273:35701, ack 1, win 4017, options [nop,nop,TS val 3127718 ecr 2889252,mptcp dss ack 3193170700 seq 2059032215 subseq 34273 len 1428 csum 0xf06f], length 1428
15:11:27.669487 IP 112.26.3.8.43525 > 112.26.3.1.34615: Flags [.], ack 35701, win 17064, options [nop,nop,TS val 2890047 ecr 3127718,mptcp dss ack 2058980807], length 0
15:11:27.669668 IP 112.26.3.8.43525 > 112.26.3.1.34615: Flags [.], ack 35701, win 17064, options [nop,nop,TS val 2890047 ecr 3127718,mptcp dss ack 2058980807], length 0
15:11:27.734140 IP 112.26.3.1.34615 > 112.26.3.8.43525: Flags [.], seq 37129:38557, ack 1, win 4017, options [nop,nop,TS val 3127959 ecr 2889501,mptcp dss ack 3193170700 seq 2059039355 subseq 37129 len 1428 csum 0x7488], length 1428
15:11:27.932908 IP 112.26.3.1.34615 > 112.26.3.8.43525: Flags [.], seq 35701:37129, ack 1, win 4017, options [nop,nop,TS val 3127959 ecr 2889501,mptcp dss ack 3193170700 seq 2059037927 subseq 35701 len 1428 csum 0x9efa], length 1428
15:11:27.943564 IP 112.26.3.1.34615 > 112.26.3.8.43525: Flags [.], seq 35701:37129, ack 1, win 4017, options [nop,nop,TS val 3127959 ecr 2889501,mptcp dss ack 3193170700 seq 2059037927 subseq 35701 len 1428 csum 0x9efa], length 1428
15:11:27.986643 IP 112.26.3.8.43525 > 112.26.3.1.34615: Flags [.], ack 37129, win 17384, options [nop,nop,TS val 2890328 ecr 3127959,mptcp dss ack 2058995087], length 0
15:11:27.986804 IP 112.26.3.8.43525 > 112.26.3.1.34615: Flags [.], ack 37129, win 17384, options [nop,nop,TS val 2890328 ecr 3127959,mptcp dss ack 2058995087], length 0
15:11:28.101303 IP 112.26.3.1.34615 > 112.26.3.8.43525: Flags [.], seq 38557:39985, ack 1, win 4017, options [nop,nop,TS val 3128256 ecr 2889745,mptcp dss ack 3193170700 seq 2059047923 subseq 38557 len 1428 csum 0x8c8], length 1428
15:11:28.174102 IP 112.26.3.1.34615 > 112.26.3.8.43525: Flags [.], seq 39985:41413, ack 1, win 4017, options [nop,nop,TS val 3128602 ecr 2890047,mptcp dss ack 3193170700 seq 2059070771 subseq 39985 len 1428 csum 0x5a6b], length 1428
15:11:28.198665 IP 112.26.3.1.34615 > 112.26.3.8.43525: Flags [.], seq 37129:38557, ack 1, win 4017, options [nop,nop,TS val 3127959 ecr 2889501,mptcp dss ack 3193170700 seq 2059039355 subseq 37129 len 1428 csum 0x7488], length 1428
15:11:28.283801 IP 112.26.3.1.34615 > 112.26.3.8.43525: Flags [.], seq 37129:38557, ack 1, win 4017, options [nop,nop,TS val 3127959 ecr 2889501,mptcp dss ack 3193170700 seq 2059039355 subseq 37129 len 1428 csum 0x7488], length 1428
15:11:28.302558 IP 112.26.3.8.43525 > 112.26.3.1.34615: Flags [.], ack 38557, win 17657, options [nop,nop,TS val 2890595 ecr 3127959,mptcp dss ack 2058995087], length 0
15:11:28.302743 IP 112.26.3.8.43525 > 112.26.3.1.34615: Flags [.], ack 38557, win 17657, options [nop,nop,TS val 2890595 ecr 3127959,mptcp dss ack 2058995087], length 0
15:11:28.440656 IP 112.26.3.1.34615 > 112.26.3.8.43525: Flags [.], seq 38557:39985, ack 1, win 4017, options [nop,nop,TS val 3128256 ecr 2889745,mptcp dss ack 3193170700 seq 2059047923 subseq 38557 len 1428 csum 0x8c8], length 1428
15:11:28.451191 IP 112.26.3.1.34615 > 112.26.3.8.43525: Flags [.], seq 38557:39985, ack 1, win 4017, options [nop,nop,TS val 3128256 ecr 2889745,mptcp dss ack 3193170700 seq 2059047923 subseq 38557 len 1428 csum 0x8c8], length 1428
15:11:28.510924 IP 112.26.3.8.43525 > 112.26.3.1.34615: Flags [.], ack 39985, win 17977, options [nop,nop,TS val 2890836 ecr 3128256,mptcp dss ack 2059003655], length 0
15:11:28.511084 IP 112.26.3.8.43525 > 112.26.3.1.34615: Flags [.], ack 39985, win 17977, options [nop,nop,TS val 2890836 ecr 3128256,mptcp dss ack 2059003655], length 0
15:11:28.643398 IP 112.26.3.1.34615 > 112.26.3.8.43525: Flags [.], seq 41413:42841, ack 1, win 4017, options [nop,nop,TS val 3128968 ecr 2890595,mptcp dss ack 3193170700 seq 2059080767 subseq 41413 len 1428 csum 0xc230], length 1428
15:11:28.654914 IP 112.26.3.1.34615 > 112.26.3.8.43525: Flags [.], seq 42841:44269, ack 1, win 4017, options [nop,nop,TS val 3128968 ecr 2890595,mptcp dss ack 3193170700 seq 2059082195 subseq 42841 len 1428 csum 0x5c40], length 1428
15:11:28.754206 IP 112.26.3.1.34615 > 112.26.3.8.43525: Flags [.], seq 41413:42841, ack 1, win 4017, options [nop,nop,TS val 3128968 ecr 2890595,mptcp dss ack 3193170700 seq 2059080767 subseq 41413 len 1428 csum 0xc230], length 1428
15:11:28.797533 IP 112.26.3.1.34615 > 112.26.3.8.43525: Flags [.], seq 41413:42841, ack 1, win 4017, options [nop,nop,TS val 3128968 ecr 2890595,mptcp dss ack 3193170700 seq 2059080767 subseq 41413 len 1428 csum 0xc230], length 1428
15:11:28.842085 IP 112.26.3.8.43525 > 112.26.3.1.34615: Flags [.], ack 39985, win 18342, options [nop,nop,TS val 2891164 ecr 3128256,nop,nop,sack 1 {41413:42841},mptcp dss ack 2059003655], length 0
15:11:28.842255 IP 112.26.3.8.43525 > 112.26.3.1.34615: Flags [.], ack 39985, win 18342, options [nop,nop,TS val 2891164 ecr 3128256,nop,nop,sack 1 {41413:42841},mptcp dss ack 2059003655], length 0
15:11:28.866964 IP 112.26.3.1.34615 > 112.26.3.8.43525: Flags [.], seq 44269:45697, ack 1, win 4017, options [nop,nop,TS val 3128968 ecr 2890595,mptcp dss ack 3193170700 seq 2059083623 subseq 44269 len 1428 csum 0x504a], length 1428
15:11:29.007117 IP 112.26.3.1.34615 > 112.26.3.8.43525: Flags [.], seq 45697:47125, ack 1, win 4017, options [nop,nop,TS val 3129451 ecr 2890836,mptcp dss ack 3193170700 seq 2059056491 subseq 45697 len 1428 csum 0x2eb2], length 1428
15:11:29.106399 IP 112.26.3.1.34615 > 112.26.3.8.43525: Flags [.], seq 42841:44269, ack 1, win 4017, options [nop,nop,TS val 3128968 ecr 2890595,mptcp dss ack 3193170700 seq 2059082195 subseq 42841 len 1428 csum 0x5c40], length 1428
15:11:29.120409 IP 112.26.3.1.34615 > 112.26.3.8.43525: Flags [.], seq 42841:44269, ack 1, win 4017, options [nop,nop,TS val 3128968 ecr 2890595,mptcp dss ack 3193170700 seq 2059082195 subseq 42841 len 1428 csum 0x5c40], length 1428
15:11:29.126122 IP 112.26.3.8.43525 > 112.26.3.1.34615: Flags [.], ack 39985, win 18752, options [nop,nop,TS val 2891505 ecr 3128256,nop,nop,sack 1 {41413:44269},mptcp dss ack 2059003655], length 0
15:11:29.126317 IP 112.26.3.8.43525 > 112.26.3.1.34615: Flags [.], ack 39985, win 18752, options [nop,nop,TS val 2891505 ecr 3128256,nop,nop,sack 1 {41413:44269},mptcp dss ack 2059003655], length 0
15:11:29.284856 IP 112.26.3.1.34615 > 112.26.3.8.43525: Flags [.], seq 47125:48553, ack 1, win 4017, options [nop,nop,TS val 3129718 ecr 2891164,mptcp dss ack 3193170700 seq 2059062203 subseq 47125 len 1428 csum 0xa06b], length 1428
15:11:29.408226 IP 112.26.3.1.34615 > 112.26.3.8.43525: Flags [.], seq 45697:47125, ack 1, win 4017, options [nop,nop,TS val 3129451 ecr 2890836,mptcp dss ack 3193170700 seq 2059056491 subseq 45697 len 1428 csum 0x2eb2], length 1428
15:11:29.430120 IP 112.26.3.8.43525 > 112.26.3.1.34615: Flags [.], ack 39985, win 19072, options [nop,nop,TS val 2891801 ecr 3128256,nop,nop,sack 2 {45697:47125}{41413:44269},mptcp dss ack 2059003655], length 0
15:11:29.430337 IP 112.26.3.8.43525 > 112.26.3.1.34615: Flags [.], ack 39985, win 19072, options [nop,nop,TS val 2891801 ecr 3128256,nop,nop,sack 2 {45697:47125}{41413:44269},mptcp dss ack 2059003655], length 0
15:11:29.441616 IP 112.26.3.1.34615 > 112.26.3.8.43525: Flags [.], seq 45697:47125, ack 1, win 4017, options [nop,nop,TS val 3129451 ecr 2890836,mptcp dss ack 3193170700 seq 2059056491 subseq 45697 len 1428 csum 0x2eb2], length 1428
15:11:29.541253 IP 112.26.3.1.34615 > 112.26.3.8.43525: Flags [.], seq 48553:49981, ack 1, win 4017, options [nop,nop,TS val 3129979 ecr 2891505,mptcp dss ack 3193170700 seq 2059072199 subseq 48553 len 1428 csum 0x1365], length 1428
15:11:29.635648 IP 112.26.3.1.34615 > 112.26.3.8.43525: Flags [.], seq 47125:48553, ack 1, win 4017, options [nop,nop,TS val 3129718 ecr 2891164,mptcp dss ack 3193170700 seq 2059062203 subseq 47125 len 1428 csum 0xa06b], length 1428
15:11:29.652795 IP 112.26.3.1.34615 > 112.26.3.8.43525: Flags [.], seq 47125:48553, ack 1, win 4017, options [nop,nop,TS val 3129718 ecr 2891164,mptcp dss ack 3193170700 seq 2059062203 subseq 47125 len 1428 csum 0xa06b], length 1428
15:11:29.699346 IP 112.26.3.8.43525 > 112.26.3.1.34615: Flags [.], ack 39985, win 19345, options [nop,nop,TS val 2892038 ecr 3128256,nop,nop,sack 2 {45697:48553}{41413:44269},mptcp dss ack 2059003655], length 0
15:11:29.699550 IP 112.26.3.8.43525 > 112.26.3.1.34615: Flags [.], ack 39985, win 19345, options [nop,nop,TS val 2892038 ecr 3128256,nop,nop,sack 2 {45697:48553}{41413:44269},mptcp dss ack 2059003655], length 0
15:11:29.814253 IP 112.26.3.1.34615 > 112.26.3.8.43525: Flags [.], seq 39985:41413, ack 1, win 4017, options [nop,nop,TS val 3130256 ecr 2891801,mptcp dss ack 3193170700 seq 2059070771 subseq 39985 len 1428 csum 0x5a6b], length 1428
15:11:29.946952 IP 112.26.3.1.34615 > 112.26.3.8.43525: Flags [.], seq 48553:49981, ack 1, win 4017, options [nop,nop,TS val 3129979 ecr 2891505,mptcp dss ack 3193170700 seq 2059072199 subseq 48553 len 1428 csum 0x1365], length 1428
15:11:29.955885 IP 112.26.3.1.34615 > 112.26.3.8.43525: Flags [.], seq 48553:49981, ack 1, win 4017, options [nop,nop,TS val 3129979 ecr 2891505,mptcp dss ack 3193170700 seq 2059072199 subseq 48553 len 1428 csum 0x1365], length 1428
15:11:30.050951 IP 112.26.3.1.34615 > 112.26.3.8.43525: Flags [.], seq 44269:45697, ack 1, win 4017, options [nop,nop,TS val 3130349 ecr 2892038,mptcp dss ack 3193170700 seq 2059083623 subseq 44269 len 1428 csum 0x504a], length 1428
15:11:30.109724 IP 112.26.3.8.43525 > 112.26.3.1.34615: Flags [.], ack 39985, win 19619, options [nop,nop,TS val 2892341 ecr 3128256,nop,nop,sack 2 {45697:49981}{41413:44269},mptcp dss ack 2059003655], length 0
15:11:30.109917 IP 112.26.3.8.43525 > 112.26.3.1.34615: Flags [.], ack 39985, win 19619, options [nop,nop,TS val 2892341 ecr 3128256,nop,nop,sack 2 {45697:49981}{41413:44269},mptcp dss ack 2059003655], length 0
