15:11:18.704699 IP 112.26.1.8.38393 > 112.26.1.1.34615: Flags [S], seq 3475975781, win 65535, options [mss 1460,sackOK,TS val 2881078 ecr 0,nop,wscale 6,mptcp join id 3 token 0x7761ebfe nonce 0x5f4b76c8], length 0
15:11:18.734925 IP 112.26.1.8.38393 > 112.26.1.1.34615: Flags [S], seq 3475975781, win 65535, options [mss 1460,sackOK,TS val 2881078 ecr 0,nop,wscale 6,mptcp join id 3 token 0x7761ebfe nonce 0x5f4b76c8], length 0
15:11:18.795085 IP 112.26.1.8.38393 > 112.26.1.1.34615: Flags [.], ack 67390058, win 5567, options [nop,nop,TS val 2881177 ecr 3119171,mptcp join hmac 0xfa882c67f6be83c03803eec44ba866ef50b76129], length 0
15:11:18.930090 IP 112.26.1.8.38393 > 112.26.1.1.34615: Flags [.], ack 1, win 5567, options [nop,nop,TS val 2881177 ecr 3119171,mptcp join hmac 0xfa882c67f6be83c03803eec44ba866ef50b76129], length 0
15:11:19.125184 IP 112.26.1.8.38393 > 112.26.1.1.34615: Flags [.], ack 1429, win 7118, options [nop,nop,TS val 2881508 ecr 3119384,mptcp dss ack 2058722339], length 0
15:11:19.204863 IP 112.26.1.8.38393 > 112.26.1.1.34615: Flags [.], ack 1429, win 7118, options [nop,nop,TS val 2881508 ecr 3119384,mptcp dss ack 2058722339], length 0
15:11:19.298118 IP 112.26.1.8.38393 > 112.26.1.1.34615: Flags [.], ack 2857, win 7255, options [nop,nop,TS val 2881681 ecr 3119384,mptcp dss ack 2058722339], length 0
15:11:19.370584 IP 112.26.1.8.38393 > 112.26.1.1.34615: Flags [.], ack 2857, win 7255, options [nop,nop,TS val 2881681 ecr 3119384,mptcp dss ack 2058722339], length 0
15:11:19.415241 IP 112.26.1.8.38393 > 112.26.1.1.34615: Flags [.], ack 4285, win 7392, options [nop,nop,TS val 2881798 ecr 3119384,mptcp dss ack 2058722339], length 0
15:11:19.511841 IP 112.26.1.8.38393 > 112.26.1.1.34615: Flags [.], ack 4285, win 7392, options [nop,nop,TS val 2881798 ecr 3119384,mptcp dss ack 2058722339], length 0
15:11:19.577282 IP 112.26.1.8.38393 > 112.26.1.1.34615: Flags [.], ack 5713, win 7574, options [nop,nop,TS val 2881960 ecr 3119384,mptcp dss ack 2058722339], length 0
15:11:19.633745 IP 112.26.1.8.38393 > 112.26.1.1.34615: Flags [.], ack 5713, win 7574, options [nop,nop,TS val 2881960 ecr 3119384,mptcp dss ack 2058722339], length 0
15:11:19.696090 IP 112.26.1.8.38393 > 112.26.1.1.34615: Flags [.], ack 7141, win 7665, options [nop,nop,TS val 2882078 ecr 3119384,mptcp dss ack 2058722339], length 0
15:11:19.779418 IP 112.26.1.8.38393 > 112.26.1.1.34615: Flags [.], ack 7141, win 7665, options [nop,nop,TS val 2882078 ecr 3119384,mptcp dss ack 2058722339], length 0
15:11:19.871111 IP 112.26.1.8.38393 > 112.26.1.1.34615: Flags [.], ack 8569, win 7894, options [nop,nop,TS val 2882254 ecr 3119384,mptcp dss ack 2058722339], length 0
15:11:19.994087 IP 112.26.1.8.38393 > 112.26.1.1.34615: Flags [.], ack 8569, win 7894, options [nop,nop,TS val 2882254 ecr 3119384,mptcp dss ack 2058722339], length 0
15:11:20.054520 IP 112.26.1.8.38393 > 112.26.1.1.34615: Flags [.], ack 8569, win 8030, options [nop,nop,TS val 2882437 ecr 3119384,nop,nop,sack 1 {9997:11425},mptcp dss ack 2058726623], length 0
15:11:20.135724 IP 112.26.1.8.38393 > 112.26.1.1.34615: Flags [.], ack 8569, win 8030, options [nop,nop,TS val 2882437 ecr 3119384,nop,nop,sack 1 {9997:11425},mptcp dss ack 2058726623], length 0
15:11:20.194826 IP 112.26.1.8.38393 > 112.26.1.1.34615: Flags [.], ack 8569, win 8213, options [nop,nop,TS val 2882578 ecr 3119384,nop,nop,sack 2 {14281:15709}{9997:11425},mptcp dss ack 2058739475], length 0
15:11:20.253786 IP 112.26.1.8.38393 > 112.26.1.1.34615: Flags [.], ack 8569, win 8213, options [nop,nop,TS val 2882578 ecr 3119384,nop,nop,sack 2 {14281:15709}{9997:11425},mptcp dss ack 2058739475], length 0
15:11:20.316604 IP 112.26.1.8.38393 > 112.26.1.1.34615: Flags [.], ack 8569, win 8304, options [nop,nop,TS val 2882699 ecr 3119384,nop,nop,sack 2 {14281:17137}{9997:11425},mptcp dss ack 2058739475], length 0
15:11:20.381304 IP 112.26.1.8.38393 > 112.26.1.1.34615: Flags [.], ack 8569, win 8304, options [nop,nop,TS val 2882699 ecr 3119384,nop,nop,sack 2 {14281:17137}{9997:11425},mptcp dss ack 2058739475], length 0
15:11:20.414833 IP 112.26.1.8.38393 > 112.26.1.1.34615: Flags [.], ack 8569, win 8487, options [nop,nop,TS val 2882797 ecr 3119384,nop,nop,sack 2 {18565:19993}{14281:17137},mptcp dss ack 2058739475], length 0
15:11:20.490695 IP 112.26.1.8.38393 > 112.26.1.1.34615: Flags [.], ack 8569, win 8487, options [nop,nop,TS val 2882797 ecr 3119384,nop,nop,sack 2 {18565:19993}{14281:17137},mptcp dss ack 2058739475], length 0
15:11:20.548068 IP 112.26.1.8.38393 > 112.26.1.1.34615: Flags [.], ack 8569, win 8624, options [nop,nop,TS val 2882931 ecr 3119384,nop,nop,sack 2 {21421:22849}{18565:19993},mptcp dss ack 2058739475], length 0
15:11:20.646156 IP 112.26.1.8.38393 > 112.26.1.1.34615: Flags [.], ack 8569, win 8624, options [nop,nop,TS val 2882931 ecr 3119384,nop,nop,sack 2 {21421:22849}{18565:19993},mptcp dss ack 2058739475], length 0
15:11:20.688616 IP 112.26.1.8.38393 > 112.26.1.1.34615: Flags [.], ack 8569, win 8852, options [nop,nop,TS val 2883072 ecr 3119384,nop,nop,sack 2 {24277:25705}{21421:22849},mptcp dss ack 2058739475], length 0
15:11:20.786650 IP 112.26.1.8.38393 > 112.26.1.1.34615: Flags [.], ack 8569, win 8852, options [nop,nop,TS val 2883072 ecr 3119384,nop,nop,sack 2 {24277:25705}{21421:22849},mptcp dss ack 2058739475], length 0
15:11:20.860177 IP 112.26.1.8.38393 > 112.26.1.1.34615: Flags [.], ack 8569, win 8989, options [nop,nop,TS val 2883243 ecr 3119384,nop,nop,sack 2 {27133:28561}{24277:25705},mptcp dss ack 2058739475], length 0
15:11:20.954855 IP 112.26.1.8.38393 > 112.26.1.1.34615: Flags [.], ack 8569, win 8989, options [nop,nop,TS val 2883243 ecr 3119384,nop,nop,sack 2 {27133:28561}{24277:25705},mptcp dss ack 2058739475], length 0
15:11:21.004266 IP 112.26.1.8.38393 > 112.26.1.1.34615: Flags [.], ack 8569, win 9125, options [nop,nop,TS val 2883387 ecr 3119384,nop,nop,sack 2 {29989:31417}{27133:28561},mptcp dss ack 2058739475], length 0
15:11:21.099385 IP 112.26.1.8.38393 > 112.26.1.1.34615: Flags [.], ack 8569, win 9125, options [nop,nop,TS val 2883387 ecr 3119384,nop,nop,sack 2 {29989:31417}{27133:28561},mptcp dss ack 2058739475], length 0
15:11:21.158908 IP 112.26.1.8.38393 > 112.26.1.1.34615: Flags [.], ack 8569, win 9399, options [nop,nop,TS val 2883541 ecr 3119384,nop,nop,sack 2 {29989:32845}{27133:28561},mptcp dss ack 2058739475], length 0
15:11:21.302376 IP 112.26.1.8.38393 > 112.26.1.1.34615: Flags [.], ack 11425, win 9445, options [nop,nop,TS val 2883684 ecr 3120712,nop,nop,sack 2 {29989:32845}{27133:28561},mptcp dss ack 2058742331], length 0
15:11:21.387608 IP 112.26.1.8.38393 > 112.26.1.1.34615: Flags [.], ack 8569, win 9399, options [nop,nop,TS val 2883541 ecr 3119384,nop,nop,sack 2 {29989:32845}{27133:28561},mptcp dss ack 2058739475], length 0
15:11:21.447085 IP 112.26.1.8.38393 > 112.26.1.1.34615: Flags [.], ack 12853, win 9582, options [nop,nop,TS val 2883824 ecr 3120835,nop,nop,sack 2 {29989:32845}{27133:28561},mptcp dss ack 2058743759], length 0
15:11:21.504328 IP 112.26.1.8.38393 > 112.26.1.1.34615: Flags [.], ack 17137, win 9719, options [nop,nop,TS val 2883886 ecr 3120944,nop,nop,sack 2 {29989:32845}{27133:28561},mptcp dss ack 2058752327], length 0
15:11:21.584801 IP 112.26.1.8.38393 > 112.26.1.1.34615: Flags [.], ack 19993, win 9855, options [nop,nop,TS val 2883966 ecr 3121240,nop,nop,sack 2 {29989:32845}{27133:28561},mptcp dss ack 2058752327], length 0
15:11:21.654713 IP 112.26.1.8.38393 > 112.26.1.1.34615: Flags [.], ack 11425, win 9445, options [nop,nop,TS val 2883684 ecr 3120712,nop,nop,sack 2 {29989:32845}{27133:28561},mptcp dss ack 2058742331], length 0
15:11:21.733617 IP 112.26.1.8.38393 > 112.26.1.1.34615: Flags [.], ack 22849, win 9947, options [nop,nop,TS val 2884102 ecr 3121413,nop,nop,sack 2 {29989:32845}{27133:28561},mptcp dss ack 2058752327], length 0
15:11:21.806160 IP 112.26.1.8.38393 > 112.26.1.1.34615: Flags [.], ack 12853, win 9582, options [nop,nop,TS val 2883824 ecr 3120835,nop,nop,sack 2 {29989:32845}{27133:28561},mptcp dss ack 2058743759], length 0
15:11:21.841614 IP 112.26.1.8.38393 > 112.26.1.1.34615: Flags [.], ack 25705, win 10084, options [nop,nop,TS val 2884223 ecr 3121553,nop,nop,sack 2 {29989:32845}{27133:28561},mptcp dss ack 2058752327], length 0
15:11:21.945014 IP 112.26.1.8.38393 > 112.26.1.1.34615: Flags [.], ack 17137, win 9719, options [nop,nop,TS val 2883886 ecr 3120944,nop,nop,sack 2 {29989:32845}{27133:28561},mptcp dss ack 2058752327], length 0
15:11:22.022310 IP 112.26.1.8.38393 > 112.26.1.1.34615: Flags [.], ack 28561, win 10312, options [nop,nop,TS val 2884405 ecr 3121841,nop,nop,sack 1 {29989:32845},mptcp dss ack 2058752327], length 0
15:11:22.059883 IP 112.26.1.8.38393 > 112.26.1.1.34615: Flags [.], ack 19993, win 9855, options [nop,nop,TS val 2883966 ecr 3121240,nop,nop,sack 2 {29989:32845}{27133:28561},mptcp dss ack 2058752327], length 0
15:11:22.138510 IP 112.26.1.8.38393 > 112.26.1.1.34615: Flags [.], ack 32845, win 10449, options [nop,nop,TS val 2884519 ecr 3122108,mptcp dss ack 2058756611], length 0
15:11:22.168022 IP 112.26.1.8.38393 > 112.26.1.1.34615: Flags [.], ack 22849, win 9947, options [nop,nop,TS val 2884102 ecr 3121413,nop,nop,sack 2 {29989:32845}{27133:28561},mptcp dss ack 2058752327], length 0
15:11:22.261463 IP 112.26.1.8.38393 > 112.26.1.1.34615: Flags [.], ack 25705, win 10084, options [nop,nop,TS val 2884223 ecr 3121553,nop,nop,sack 2 {29989:32845}{27133:28561},mptcp dss ack 2058752327], length 0
15:11:22.314992 IP 112.26.1.8.38393 > 112.26.1.1.34615: Flags [.], ack 34273, win 10631, options [nop,nop,TS val 2884698 ecr 3122108,mptcp dss ack 2058756611], length 0
15:11:22.396933 IP 112.26.1.8.38393 > 112.26.1.1.34615: Flags [.], ack 35701, win 10768, options [nop,nop,TS val 2884775 ecr 3122108,mptcp dss ack 2058756611], length 0
15:11:22.461186 IP 112.26.1.8.38393 > 112.26.1.1.34615: Flags [.], ack 28561, win 10312, options [nop,nop,TS val 2884405 ecr 3121841,nop,nop,sack 1 {29989:32845},mptcp dss ack 2058752327], length 0
15:11:22.540093 IP 112.26.1.8.38393 > 112.26.1.1.34615: Flags [.], ack 37129, win 10905, options [nop,nop,TS val 2884923 ecr 3122259,mptcp dss ack 2058756611], length 0
15:11:22.602754 IP 112.26.1.8.38393 > 112.26.1.1.34615: Flags [.], ack 32845, win 10449, options [nop,nop,TS val 2884519 ecr 3122108,mptcp dss ack 2058756611], length 0
15:11:22.665796 IP 112.26.1.8.38393 > 112.26.1.1.34615: Flags [.], ack 38557, win 11133, options [nop,nop,TS val 2885047 ecr 3122259,mptcp dss ack 2058756611], length 0
15:11:22.737781 IP 112.26.1.8.38393 > 112.26.1.1.34615: Flags [.], ack 34273, win 10631, options [nop,nop,TS val 2884698 ecr 3122108,mptcp dss ack 2058756611], length 0
15:11:22.819506 IP 112.26.1.8.38393 > 112.26.1.1.34615: Flags [.], ack 39985, win 11315, options [nop,nop,TS val 2885189 ecr 3122398,mptcp dss ack 2058756611], length 0
15:11:22.871289 IP 112.26.1.8.38393 > 112.26.1.1.34615: Flags [.], ack 35701, win 10768, options [nop,nop,TS val 2884775 ecr 3122108,mptcp dss ack 2058756611], length 0
15:11:22.952118 IP 112.26.1.8.38393 > 112.26.1.1.34615: Flags [.], ack 41413, win 11407, options [nop,nop,TS val 2885335 ecr 3122398,mptcp dss ack 2058756611], length 0
15:11:23.036029 IP 112.26.1.8.38393 > 112.26.1.1.34615: Flags [.], ack 42841, win 11544, options [nop,nop,TS val 2885419 ecr 3122513,mptcp dss ack 2058756611], length 0
15:11:23.112217 IP 112.26.1.8.38393 > 112.26.1.1.34615: Flags [.], ack 37129, win 10905, options [nop,nop,TS val 2884923 ecr 3122259,mptcp dss ack 2058756611], length 0
15:11:23.153410 IP 112.26.1.8.38393 > 112.26.1.1.34615: Flags [.], ack 44269, win 11726, options [nop,nop,TS val 2885536 ecr 3122621,mptcp dss ack 2058756611], length 0
15:11:23.207054 IP 112.26.1.8.38393 > 112.26.1.1.34615: Flags [.], ack 38557, win 11133, options [nop,nop,TS val 2885047 ecr 3122259,mptcp dss ack 2058756611], length 0
15:11:23.253057 IP 112.26.1.8.38393 > 112.26.1.1.34615: Flags [.], ack 45697, win 11817, options [nop,nop,TS val 2885633 ecr 3122718,mptcp dss ack 2058756611], length 0
15:11:23.313134 IP 112.26.1.8.38393 > 112.26.1.1.34615: Flags [.], ack 47125, win 11954, options [nop,nop,TS val 2885697 ecr 3122915,mptcp dss ack 2058756611], length 0
15:11:23.363022 IP 112.26.1.8.38393 > 112.26.1.1.34615: Flags [.], ack 48553, win 12045, options [nop,nop,TS val 2885746 ecr 3123057,mptcp dss ack 2058782315], length 0
15:11:23.485213 IP 112.26.1.8.38393 > 112.26.1.1.34615: Flags [.], ack 49981, win 12182, options [nop,nop,TS val 2885869 ecr 3123191,mptcp dss ack 2058782315], length 0
15:11:23.568955 IP 112.26.1.8.38393 > 112.26.1.1.34615: Flags [.], ack 51409, win 12274, options [nop,nop,TS val 2885952 ecr 3123325,mptcp dss ack 2058782315], length 0
15:11:23.670303 IP 112.26.1.8.38393 > 112.26.1.1.34615: Flags [.], ack 52837, win 12410, options [nop,nop,TS val 2886053 ecr 3123325,mptcp dss ack 2058782315], length 0
15:11:23.815882 IP 112.26.1.8.38393 > 112.26.1.1.34615: Flags [.], ack 54265, win 12639, options [nop,nop,TS val 2886198 ecr 3123566,mptcp dss ack 2058782315], length 0
15:11:23.902198 IP 112.26.1.8.38393 > 112.26.1.1.34615: Flags [.], ack 55693, win 12730, options [nop,nop,TS val 2886283 ecr 3123660,mptcp dss ack 2058782315], length 0
15:11:23.998120 IP 112.26.1.8.38393 > 112.26.1.1.34615: Flags [.], ack 57121, win 12775, options [nop,nop,TS val 2886381 ecr 3123899,mptcp dss ack 2058782315], length 0
15:11:24.120068 IP 112.26.1.8.38393 > 112.26.1.1.34615: Flags [.], ack 58549, win 13004, options [nop,nop,TS val 2886503 ecr 3123899,mptcp dss ack 2058782315], length 0
15:11:24.196386 IP 112.26.1.8.38393 > 112.26.1.1.34615: Flags [.], ack 59977, win 13049, options [nop,nop,TS val 2886574 ecr 3123899,mptcp dss ack 2058782315], length 0
15:11:24.407763 IP 112.26.1.8.38393 > 112.26.1.1.34615: Flags [.], ack 61405, win 13140, options [nop,nop,TS val 2886790 ecr 3124184,mptcp dss ack 2058782315], length 0
15:11:24.540864 IP 112.26.1.8.38393 > 112.26.1.1.34615: Flags [.], ack 62833, win 13323, options [nop,nop,TS val 2886924 ecr 3124184,mptcp dss ack 2058782315], length 0
15:11:24.620512 IP 112.26.1.8.38393 > 112.26.1.1.34615: Flags [.], ack 64261, win 13414, options [nop,nop,TS val 2886998 ecr 3124232,mptcp dss ack 2058782315], length 0
15:11:24.709648 IP 112.26.1.8.38393 > 112.26.1.1.34615: Flags [.], ack 65689, win 13505, options [nop,nop,TS val 2887092 ecr 3124232,mptcp dss ack 2058782315], length 0
15:11:24.860769 IP 112.26.1.8.38393 > 112.26.1.1.34615: Flags [.], ack 67117, win 13734, options [nop,nop,TS val 2887244 ecr 3124430,mptcp dss ack 2058895127], length 0
15:11:24.948028 IP 112.26.1.8.38393 > 112.26.1.1.34615: Flags [.], ack 68545, win 13870, options [nop,nop,TS val 2887317 ecr 3124621,mptcp dss ack 2058895127], length 0
15:11:25.058893 IP 112.26.1.8.38393 > 112.26.1.1.34615: Flags [.], ack 69973, win 14007, options [nop,nop,TS val 2887442 ecr 3124621,mptcp dss ack 2058895127], length 0
15:11:25.213560 IP 112.26.1.8.38393 > 112.26.1.1.34615: Flags [.], ack 71401, win 14144, options [nop,nop,TS val 2887596 ecr 3124895,mptcp dss ack 2058895127], length 0
15:11:25.335515 IP 112.26.1.8.38393 > 112.26.1.1.34615: Flags [.], ack 72829, win 14281, options [nop,nop,TS val 2887718 ecr 3125211,mptcp dss ack 2058895127], length 0
15:11:25.515195 IP 112.26.1.8.38393 > 112.26.1.1.34615: Flags [.], ack 74257, win 14464, options [nop,nop,TS val 2887898 ecr 3125211,mptcp dss ack 2058895127], length 0
15:11:25.596233 IP 112.26.1.8.38393 > 112.26.1.1.34615: Flags [.], ack 75685, win 14555, options [nop,nop,TS val 2887979 ecr 3125211,mptcp dss ack 2058895127], length 0
15:11:25.708830 IP 112.26.1.8.38393 > 112.26.1.1.34615: Flags [.], ack 77113, win 14692, options [nop,nop,TS val 2888091 ecr 3125211,mptcp dss ack 2058895127], length 0
15:11:25.758967 IP 112.26.1.8.38393 > 112.26.1.1.34615: Flags [.], ack 78541, win 14737, options [nop,nop,TS val 2888128 ecr 3125259,mptcp dss ack 2058895127], length 0
15:11:25.832297 IP 112.26.1.8.38393 > 112.26.1.1.34615: Flags [.], ack 79969, win 14874, options [nop,nop,TS val 2888214 ecr 3125361,mptcp dss ack 2058895127], length 0
15:11:26.065660 IP 112.26.1.8.38393 > 112.26.1.1.34615: Flags [.], ack 79969, win 15102, options [nop,nop,TS val 2888448 ecr 3125361,nop,nop,sack 1 {82825:84253},mptcp dss ack 2058895127], length 0
15:11:26.138352 IP 112.26.1.8.38393 > 112.26.1.1.34615: Flags [.], ack 79969, win 15148, options [nop,nop,TS val 2888519 ecr 3125361,nop,nop,sack 1 {82825:85681},mptcp dss ack 2058895127], length 0
15:11:26.321815 IP 112.26.1.8.38393 > 112.26.1.1.34615: Flags [.], ack 79969, win 15330, options [nop,nop,TS val 2888705 ecr 3125361,nop,nop,sack 2 {87109:88537}{82825:85681},mptcp dss ack 2058895127], length 0
15:11:26.410435 IP 112.26.1.8.38393 > 112.26.1.1.34615: Flags [.], ack 79969, win 15467, options [nop,nop,TS val 2888793 ecr 3125361,nop,nop,sack 2 {87109:89965}{82825:85681},mptcp dss ack 2058895127], length 0
15:11:26.523784 IP 112.26.1.8.38393 > 112.26.1.1.34615: Flags [.], ack 79969, win 15650, options [nop,nop,TS val 2888906 ecr 3125361,nop,nop,sack 2 {87109:91393}{82825:85681},mptcp dss ack 2058895127], length 0
15:11:26.680053 IP 112.26.1.8.38393 > 112.26.1.1.34615: Flags [.], ack 79969, win 15878, options [nop,nop,TS val 2889059 ecr 3125361,nop,nop,sack 2 {92821:94249}{87109:91393},mptcp dss ack 2058895127], length 0
15:11:26.746098 IP 112.26.1.8.38393 > 112.26.1.1.34615: Flags [.], ack 79969, win 15969, options [nop,nop,TS val 2889128 ecr 3125361,nop,nop,sack 2 {92821:95677}{87109:91393},mptcp dss ack 2058895127], length 0
15:11:26.920969 IP 112.26.1.8.38393 > 112.26.1.1.34615: Flags [.], ack 79969, win 16152, options [nop,nop,TS val 2889303 ecr 3125361,nop,nop,sack 2 {97105:98533}{92821:95677},mptcp dss ack 2058895127], length 0
15:11:26.980532 IP 112.26.1.8.38393 > 112.26.1.1.34615: Flags [.], ack 79969, win 16197, options [nop,nop,TS val 2889363 ecr 3125361,nop,nop,sack 2 {97105:99961}{92821:95677},mptcp dss ack 2058895127], length 0
15:11:27.065276 IP 112.26.1.8.38393 > 112.26.1.1.34615: Flags [.], ack 79969, win 16243, options [nop,nop,TS val 2889448 ecr 3125361,nop,nop,sack 2 {97105:101389}{92821:95677},mptcp dss ack 2058895127], length 0
15:11:27.243628 IP 112.26.1.8.38393 > 112.26.1.1.34615: Flags [.], ack 79969, win 16471, options [nop,nop,TS val 2889626 ecr 3125361,nop,nop,sack 2 {102817:104245}{97105:101389},mptcp dss ack 2058942251], length 0
15:11:27.319498 IP 112.26.1.8.38393 > 112.26.1.1.34615: Flags [.], ack 81397, win 16562, options [nop,nop,TS val 2889702 ecr 3127216,nop,nop,sack 2 {102817:104245}{97105:101389},mptcp dss ack 2058947963], length 0
15:11:27.499942 IP 112.26.1.8.38393 > 112.26.1.1.34615: Flags [.], ack 85681, win 16790, options [nop,nop,TS val 2889878 ecr 3127325,nop,nop,sack 2 {102817:104245}{97105:101389},mptcp dss ack 2058967955], length 0
15:11:27.609322 IP 112.26.1.8.38393 > 112.26.1.1.34615: Flags [.], ack 91393, win 16973, options [nop,nop,TS val 2889992 ecr 3127718,nop,nop,sack 2 {102817:104245}{97105:101389},mptcp dss ack 2058980807], length 0
15:11:27.777879 IP 112.26.1.8.38393 > 112.26.1.1.34615: Flags [.], ack 95677, win 17247, options [nop,nop,TS val 2890161 ecr 3127852,nop,nop,sack 2 {102817:104245}{97105:101389},mptcp dss ack 2058992231], length 0
15:11:27.924695 IP 112.26.1.8.38393 > 112.26.1.1.34615: Flags [.], ack 101389, win 17338, options [nop,nop,TS val 2890307 ecr 3127852,nop,nop,sack 1 {102817:104245},mptcp dss ack 2058995087], length 0
15:11:28.040732 IP 112.26.1.8.38393 > 112.26.1.1.34615: Flags [.], ack 101389, win 17475, options [nop,nop,TS val 2890422 ecr 3127852,nop,nop,sack 1 {102817:105673},mptcp dss ack 2058995087], length 0
15:11:28.201159 IP 112.26.1.8.38393 > 112.26.1.1.34615: Flags [.], ack 101389, win 17612, options [nop,nop,TS val 2890580 ecr 3127852,nop,nop,sack 1 {102817:107101},mptcp dss ack 2058995087], length 0
15:11:28.308373 IP 112.26.1.8.38393 > 112.26.1.1.34615: Flags [.], ack 101389, win 17794, options [nop,nop,TS val 2890691 ecr 3127852,nop,nop,sack 1 {102817:108529},mptcp dss ack 2059003655], length 0
15:11:28.415977 IP 112.26.1.8.38393 > 112.26.1.1.34615: Flags [.], ack 101389, win 17931, options [nop,nop,TS val 2890799 ecr 3127852,nop,nop,sack 1 {102817:109957},mptcp dss ack 2059003655], length 0
15:11:28.607417 IP 112.26.1.8.38393 > 112.26.1.1.34615: Flags [.], ack 101389, win 18159, options [nop,nop,TS val 2890990 ecr 3127852,nop,nop,sack 2 {111385:112813}{102817:109957},mptcp dss ack 2059003655], length 0
15:11:28.723125 IP 112.26.1.8.38393 > 112.26.1.1.34615: Flags [.], ack 101389, win 18296, options [nop,nop,TS val 2891106 ecr 3127852,nop,nop,sack 2 {114241:115669}{111385:112813},mptcp dss ack 2059003655], length 0
15:11:28.858078 IP 112.26.1.8.38393 > 112.26.1.1.34615: Flags [.], ack 101389, win 18479, options [nop,nop,TS val 2891240 ecr 3127852,nop,nop,sack 2 {114241:117097}{111385:112813},mptcp dss ack 2059003655], length 0
15:11:28.947981 IP 112.26.1.8.38393 > 112.26.1.1.34615: Flags [.], ack 101389, win 18524, options [nop,nop,TS val 2891331 ecr 3127852,nop,nop,sack 2 {114241:118525}{111385:112813},mptcp dss ack 2059003655], length 0
15:11:29.098174 IP 112.26.1.8.38393 > 112.26.1.1.34615: Flags [.], ack 101389, win 18661, options [nop,nop,TS val 2891481 ecr 3127852,nop,nop,sack 2 {114241:119953}{111385:112813},mptcp dss ack 2059003655], length 0
15:11:29.231205 IP 112.26.1.8.38393 > 112.26.1.1.34615: Flags [.], ack 101389, win 18844, options [nop,nop,TS val 2891614 ecr 3127852,nop,nop,sack 2 {114241:121381}{111385:112813},mptcp dss ack 2059003655], length 0
15:11:29.435804 IP 112.26.1.8.38393 > 112.26.1.1.34615: Flags [.], ack 101389, win 19163, options [nop,nop,TS val 2891819 ecr 3127852,nop,nop,sack 2 {114241:122809}{111385:112813},mptcp dss ack 2059003655], length 0
15:11:29.541100 IP 112.26.1.8.38393 > 112.26.1.1.34615: Flags [.], ack 101389, win 19209, options [nop,nop,TS val 2891924 ecr 3127852,nop,nop,sack 2 {102817:112813}{114241:122809},mptcp dss ack 2059003655], length 0
15:11:29.757608 IP 112.26.1.8.38393 > 112.26.1.1.34615: Flags [.], ack 101389, win 19482, options [nop,nop,TS val 2892140 ecr 3127852,nop,nop,sack 1 {102817:122809},mptcp dss ack 2059003655], length 0
15:11:29.826523 IP 112.26.1.8.38393 > 112.26.1.1.34615: Flags [.], ack 101389, win 19528, options [nop,nop,TS val 2892209 ecr 3127852,nop,nop,sack 1 {102817:124237},mptcp dss ack 2059003655], length 0
15:11:29.903565 IP 112.26.1.8.38393 > 112.26.1.1.34615: Flags [.], ack 101389, win 19574, options [nop,nop,TS val 2892287 ecr 3127852,nop,nop,sack 1 {102817:125665},mptcp dss ack 2059003655], length 0
15:11:30.125979 IP 112.26.1.8.38393 > 112.26.1.1.34615: Flags [.], ack 101389, win 19802, options [nop,nop,TS val 2892509 ecr 3127852,nop,nop,sack 1 {102817:127093},mptcp dss ack 2059003655], length 0
15:11:30.185874 IP 112.26.1.8.38393 > 112.26.1.1.34615: Flags [.], ack 127093, win 19893, options [nop,nop,TS val 2892568 ecr 3130228,mptcp dss ack 2059070771], length 0
15:11:30.258288 IP 112.26.1.8.38393 > 112.26.1.1.34615: Flags [.], ack 128521, win 20075, options [nop,nop,TS val 2892641 ecr 3130256,mptcp dss ack 2059083623], length 0
15:11:30.337410 IP 112.26.1.8.38393 > 112.26.1.1.34615: Flags [.], ack 129949, win 20167, options [nop,nop,TS val 2892717 ecr 3130349,mptcp dss ack 2059083623], length 0
15:11:30.503201 IP 112.26.1.8.38393 > 112.26.1.1.34615: Flags [.], ack 131377, win 20349, options [nop,nop,TS val 2892880 ecr 3130765,mptcp dss ack 2059083623], length 0
15:11:30.629897 IP 112.26.1.8.38393 > 112.26.1.1.34615: Flags [.], ack 132805, win 20532, options [nop,nop,TS val 2893012 ecr 3130772,mptcp dss ack 2059085051], length 0
15:11:30.748188 IP 112.26.1.8.38393 > 112.26.1.1.34615: Flags [.], ack 134233, win 20623, options [nop,nop,TS val 2893131 ecr 3130904,mptcp dss ack 2059085051], length 0
15:11:30.955949 IP 112.26.1.8.38393 > 112.26.1.1.34615: Flags [.], ack 135661, win 20805, options [nop,nop,TS val 2893339 ecr 3130924,mptcp dss ack 2059085051], length 0
15:11:31.086996 IP 112.26.1.8.38393 > 112.26.1.1.34615: Flags [.], ack 137089, win 20942, options [nop,nop,TS val 2893469 ecr 3131011,mptcp dss ack 2059085051], length 0
15:11:31.254782 IP 112.26.1.8.38393 > 112.26.1.1.34615: Flags [.], ack 137089, win 21125, options [nop,nop,TS val 2893637 ecr 3131011,nop,nop,sack 1 {139945:141373},mptcp dss ack 2059085051], length 0
15:11:31.354463 IP 112.26.1.8.38393 > 112.26.1.1.34615: Flags [.], ack 137089, win 21262, options [nop,nop,TS val 2893738 ecr 3131011,nop,nop,sack 1 {139945:142801},mptcp dss ack 2059085051], length 0
15:11:31.483299 IP 112.26.1.8.38393 > 112.26.1.1.34615: Flags [.], ack 137089, win 21444, options [nop,nop,TS val 2893866 ecr 3131011,nop,nop,sack 1 {139945:144229},mptcp dss ack 2059096475], length 0
15:11:31.568315 IP 112.26.1.8.38393 > 112.26.1.1.34615: Flags [.], ack 137089, win 21581, options [nop,nop,TS val 2893948 ecr 3131011,nop,nop,sack 1 {139945:145657},mptcp dss ack 2059096475], length 0
15:11:31.667761 IP 112.26.1.8.38393 > 112.26.1.1.34615: Flags [.], ack 137089, win 21672, options [nop,nop,TS val 2894051 ecr 3131011,nop,nop,sack 1 {139945:147085},mptcp dss ack 2059096475], length 0
15:11:31.771404 IP 112.26.1.8.38393 > 112.26.1.1.34615: Flags [.], ack 137089, win 21764, options [nop,nop,TS val 2894155 ecr 3131011,nop,nop,sack 1 {139945:148513},mptcp dss ack 2059105043], length 0
15:11:31.842665 IP 112.26.1.8.38393 > 112.26.1.1.34615: Flags [.], ack 137089, win 21855, options [nop,nop,TS val 2894200 ecr 3131011,nop,nop,sack 1 {139945:149941},mptcp dss ack 2059106471], length 0
15:11:32.071174 IP 112.26.1.8.38393 > 112.26.1.1.34615: Flags [.], ack 137089, win 22129, options [nop,nop,TS val 2894454 ecr 3131011,nop,nop,sack 1 {139945:151369},mptcp dss ack 2059120751], length 0
15:11:32.165604 IP 112.26.1.8.38393 > 112.26.1.1.34615: Flags [.], ack 137089, win 22220, options [nop,nop,TS val 2894549 ecr 3131011,nop,nop,sack 1 {139945:152797},mptcp dss ack 2059120751], length 0
15:11:32.291766 IP 112.26.1.8.38393 > 112.26.1.1.34615: Flags [.], ack 137089, win 22448, options [nop,nop,TS val 2894675 ecr 3131011,nop,nop,sack 1 {139945:154225},mptcp dss ack 2059120751], length 0
15:11:32.422976 IP 112.26.1.8.38393 > 112.26.1.1.34615: Flags [.], ack 137089, win 22585, options [nop,nop,TS val 2894805 ecr 3131011,nop,nop,sack 1 {139945:155653},mptcp dss ack 2059120751], length 0
15:11:32.569739 IP 112.26.1.8.38393 > 112.26.1.1.34615: Flags [.], ack 137089, win 22722, options [nop,nop,TS val 2894953 ecr 3131011,nop,nop,sack 1 {139945:157081},mptcp dss ack 2059120751], length 0
15:11:32.618558 IP 112.26.1.8.38393 > 112.26.1.1.34615: Flags [.], ack 137089, win 22813, options [nop,nop,TS val 2895002 ecr 3131011,nop,nop,sack 1 {139945:158509},mptcp dss ack 2059120751], length 0
15:11:32.704422 IP 112.26.1.8.38393 > 112.26.1.1.34615: Flags [.], ack 138517, win 22904, options [nop,nop,TS val 2895087 ecr 3132317,nop,nop,sack 1 {139945:158509},mptcp dss ack 2059122179], length 0
15:11:32.861547 IP 112.26.1.8.38393 > 112.26.1.1.34615: Flags [.], ack 138517, win 23041, options [nop,nop,TS val 2895244 ecr 3132317,nop,nop,sack 1 {139945:159937},mptcp dss ack 2059122179], length 0
15:11:32.986977 IP 112.26.1.8.38393 > 112.26.1.1.34615: Flags [.], ack 138517, win 23224, options [nop,nop,TS val 2895368 ecr 3132317,nop,nop,sack 1 {139945:161365},mptcp dss ack 2059122179], length 0
15:11:33.080347 IP 112.26.1.8.38393 > 112.26.1.1.34615: Flags [.], ack 138517, win 23360, options [nop,nop,TS val 2895461 ecr 3132317,nop,nop,sack 1 {139945:162793},mptcp dss ack 2059122179], length 0
15:11:33.280356 IP 112.26.1.8.38393 > 112.26.1.1.34615: Flags [.], ack 138517, win 23543, options [nop,nop,TS val 2895663 ecr 3132317,nop,nop,sack 1 {139945:164221},mptcp dss ack 2059122179], length 0
15:11:33.426951 IP 112.26.1.8.38393 > 112.26.1.1.34615: Flags [.], ack 138517, win 23680, options [nop,nop,TS val 2895810 ecr 3132317,nop,nop,sack 2 {165649:167077}{139945:164221},mptcp dss ack 2059122179], length 0
15:11:33.564629 IP 112.26.1.8.38393 > 112.26.1.1.34615: Flags [.], ack 138517, win 23870, options [nop,nop,TS val 2895947 ecr 3132317,nop,nop,sack 2 {165649:168505}{139945:164221},mptcp dss ack 2059122179], length 0
15:11:33.672803 IP 112.26.1.8.38393 > 112.26.1.1.34615: Flags [.], ack 138517, win 23870, options [nop,nop,TS val 2896056 ecr 3132317,nop,nop,sack 2 {165649:169933}{139945:164221},mptcp dss ack 2059122179], length 0
15:11:33.789216 IP 112.26.1.8.38393 > 112.26.1.1.34615: Flags [.], ack 164221, win 23613, options [nop,nop,TS val 2896172 ecr 3133775,nop,nop,sack 1 {165649:169933},mptcp dss ack 2059202147], length 0
15:11:33.915847 IP 112.26.1.8.38393 > 112.26.1.1.34615: Flags [.], ack 164221, win 24045, options [nop,nop,TS val 2896297 ecr 3133775,nop,nop,sack 1 {165649:171361},mptcp dss ack 2059202147], length 0
15:11:34.032897 IP 112.26.1.8.38393 > 112.26.1.1.34615: Flags [.], ack 164221, win 24182, options [nop,nop,TS val 2896415 ecr 3133775,nop,nop,sack 1 {165649:172789},mptcp dss ack 2059202147], length 0
15:11:34.171216 IP 112.26.1.8.38393 > 112.26.1.1.34615: Flags [.], ack 164221, win 24364, options [nop,nop,TS val 2896554 ecr 3133775,nop,nop,sack 1 {165649:174217},mptcp dss ack 2059202147], length 0
15:11:34.306209 IP 112.26.1.8.38393 > 112.26.1.1.34615: Flags [.], ack 174217, win 24299, options [nop,nop,TS val 2896686 ecr 3134381,mptcp dss ack 2059209287], length 0
15:11:34.475848 IP 112.26.1.8.38393 > 112.26.1.1.34615: Flags [.], ack 175645, win 24373, options [nop,nop,TS val 2896858 ecr 3134570,mptcp dss ack 2059209287], length 0
15:11:34.579500 IP 112.26.1.8.38393 > 112.26.1.1.34615: Flags [.], ack 177073, win 24373, options [nop,nop,TS val 2896962 ecr 3134649,mptcp dss ack 2059209287], length 0
15:11:34.689510 IP 112.26.1.8.38393 > 112.26.1.1.34615: Flags [.], ack 178501, win 24373, options [nop,nop,TS val 2897071 ecr 3134695,mptcp dss ack 2059209287], length 0
15:11:34.808662 IP 112.26.1.8.38393 > 112.26.1.1.34615: Flags [.], ack 179929, win 24373, options [nop,nop,TS val 2897191 ecr 3134951,mptcp dss ack 2059209287], length 0
15:11:34.920174 IP 112.26.1.8.38393 > 112.26.1.1.34615: Flags [.], ack 181357, win 24373, options [nop,nop,TS val 2897302 ecr 3135082,mptcp dss ack 2059209287], length 0
15:11:35.066785 IP 112.26.1.8.38393 > 112.26.1.1.34615: Flags [.], ack 182785, win 24373, options [nop,nop,TS val 2897450 ecr 3135198,mptcp dss ack 2059209287], length 0
15:11:35.206150 IP 112.26.1.8.38393 > 112.26.1.1.34615: Flags [.], ack 184213, win 24373, options [nop,nop,TS val 2897589 ecr 3135292,mptcp dss ack 2059209287], length 0
15:11:35.301023 IP 112.26.1.8.38393 > 112.26.1.1.34615: Flags [.], ack 185641, win 24342, options [nop,nop,TS val 2897684 ecr 3135439,mptcp dss ack 2059250699], length 0
15:11:35.430105 IP 112.26.1.8.38393 > 112.26.1.1.34615: Flags [.], ack 187069, win 24342, options [nop,nop,TS val 2897813 ecr 3135472,mptcp dss ack 2059250699], length 0
15:11:35.553240 IP 112.26.1.8.38393 > 112.26.1.1.34615: Flags [.], ack 188497, win 24540, options [nop,nop,TS val 2897936 ecr 3135647,mptcp dss ack 2059282115], length 0
15:11:35.671400 IP 112.26.1.8.38393 > 112.26.1.1.34615: Flags [.], ack 189925, win 24540, options [nop,nop,TS val 2898050 ecr 3135712,mptcp dss ack 2059282115], length 0
15:11:35.809103 IP 112.26.1.8.38393 > 112.26.1.1.34615: Flags [.], ack 191353, win 24540, options [nop,nop,TS val 2898191 ecr 3135865,mptcp dss ack 2059282115], length 0
15:11:35.933663 IP 112.26.1.8.38393 > 112.26.1.1.34615: Flags [.], ack 192781, win 24540, options [nop,nop,TS val 2898316 ecr 3136040,mptcp dss ack 2059282115], length 0
15:11:36.034023 IP 112.26.1.8.38393 > 112.26.1.1.34615: Flags [.], ack 194209, win 24540, options [nop,nop,TS val 2898417 ecr 3136040,mptcp dss ack 2059282115], length 0
15:11:36.200071 IP 112.26.1.8.38393 > 112.26.1.1.34615: Flags [.], ack 195637, win 24540, options [nop,nop,TS val 2898582 ecr 3136166,mptcp dss ack 2059282115], length 0
15:11:36.304456 IP 112.26.1.8.38393 > 112.26.1.1.34615: Flags [.], ack 197065, win 24540, options [nop,nop,TS val 2898687 ecr 3136300,mptcp dss ack 2059282115], length 0
15:11:36.502807 IP 112.26.1.8.38393 > 112.26.1.1.34615: Flags [.], ack 198493, win 24540, options [nop,nop,TS val 2898864 ecr 3136414,mptcp dss ack 2059282115], length 0
15:11:36.641153 IP 112.26.1.8.38393 > 112.26.1.1.34615: Flags [.], ack 201349, win 24540, options [nop,nop,TS val 2899022 ecr 3136637,mptcp dss ack 2059282115], length 0
15:11:36.904559 IP 112.26.1.8.38393 > 112.26.1.1.34615: Flags [.], ack 204205, win 24273, options [nop,nop,TS val 2899264 ecr 3136845,mptcp dss ack 2059299251], length 0
15:11:37.037317 IP 112.26.1.8.38393 > 112.26.1.1.34615: Flags [.], ack 207061, win 24273, options [nop,nop,TS val 2899417 ecr 3137066,mptcp dss ack 2059299251], length 0
15:11:37.273209 IP 112.26.1.8.38393 > 112.26.1.1.34615: Flags [.], ack 208489, win 24273, options [nop,nop,TS val 2899656 ecr 3137314,mptcp dss ack 2059299251], length 0
15:11:37.464406 IP 112.26.1.8.38393 > 112.26.1.1.34615: Flags [.], ack 211345, win 24273, options [nop,nop,TS val 2899847 ecr 3137578,mptcp dss ack 2059299251], length 0
15:11:37.656036 IP 112.26.1.8.38393 > 112.26.1.1.34615: Flags [.], ack 214201, win 24275, options [nop,nop,TS val 2900038 ecr 3137685,mptcp dss ack 2059319243], length 0
15:11:37.878178 IP 112.26.1.8.38393 > 112.26.1.1.34615: Flags [.], ack 217057, win 24543, options [nop,nop,TS val 2900261 ecr 3137769,mptcp dss ack 2059362083], length 0
15:11:38.031557 IP 112.26.1.8.38393 > 112.26.1.1.34615: Flags [.], ack 219913, win 24558, options [nop,nop,TS val 2900413 ecr 3138076,mptcp dss ack 2059367795], length 0
15:11:38.258833 IP 112.26.1.8.38393 > 112.26.1.1.34615: Flags [.], ack 222769, win 24518, options [nop,nop,TS val 2900642 ecr 3138294,mptcp dss ack 2059370651], length 0
15:11:38.560328 IP 112.26.1.8.38393 > 112.26.1.1.34615: Flags [.], ack 224197, win 24518, options [nop,nop,TS val 2900944 ecr 3138551,mptcp dss ack 2059370651], length 0
15:11:38.680923 IP 112.26.1.8.38393 > 112.26.1.1.34615: Flags [.], ack 225625, win 24518, options [nop,nop,TS val 2901064 ecr 3138551,mptcp dss ack 2059370651], length 0
15:11:38.781326 IP 112.26.1.8.38393 > 112.26.1.1.34615: Flags [.], ack 228481, win 24518, options [nop,nop,TS val 2901165 ecr 3138551,mptcp dss ack 2059370651], length 0
15:11:39.033014 IP 112.26.1.8.38393 > 112.26.1.1.34615: Flags [.], ack 231337, win 24518, options [nop,nop,TS val 2901416 ecr 3138806,mptcp dss ack 2059370651], length 0
15:11:39.152401 IP 112.26.1.8.38393 > 112.26.1.1.34615: Flags [.], ack 234193, win 24518, options [nop,nop,TS val 2901536 ecr 3138845,mptcp dss ack 2059370651], length 0
15:11:39.296618 IP 112.26.1.8.38393 > 112.26.1.1.34615: Flags [.], ack 235621, win 24518, options [nop,nop,TS val 2901680 ecr 3139131,mptcp dss ack 2059370651], length 0
15:11:39.438366 IP 112.26.1.8.38393 > 112.26.1.1.34615: Flags [.], ack 237049, win 24518, options [nop,nop,TS val 2901808 ecr 3139131,mptcp dss ack 2059370651], length 0
15:11:39.560753 IP 112.26.1.8.38393 > 112.26.1.1.34615: Flags [.], ack 239905, win 24518, options [nop,nop,TS val 2901944 ecr 3139131,mptcp dss ack 2059370651], length 0
15:11:39.727284 IP 112.26.1.8.38393 > 112.26.1.1.34615: Flags [.], ack 242761, win 24362, options [nop,nop,TS val 2902110 ecr 3139534,mptcp dss ack 2059380647], length 0
15:11:39.968289 IP 112.26.1.8.38393 > 112.26.1.1.34615: Flags [.], ack 245617, win 24365, options [nop,nop,TS val 2902352 ecr 3139960,mptcp dss ack 2059420631], length 0
15:11:40.174665 IP 112.26.1.8.38393 > 112.26.1.1.34615: Flags [.], ack 248473, win 24365, options [nop,nop,TS val 2902557 ecr 3140024,mptcp dss ack 2059420631], length 0
15:11:40.325291 IP 112.26.1.8.38393 > 112.26.1.1.34615: Flags [.], ack 249901, win 24365, options [nop,nop,TS val 2902708 ecr 3140024,nop,nop,sack 1 {251329:252757},mptcp dss ack 2059420631], length 0
15:11:40.470484 IP 112.26.1.8.38393 > 112.26.1.1.34615: Flags [.], ack 249901, win 24365, options [nop,nop,TS val 2902850 ecr 3140024,nop,nop,sack 1 {251329:254185},mptcp dss ack 2059420631], length 0
15:11:40.522330 IP 112.26.1.8.38393 > 112.26.1.1.34615: Flags [.], ack 249901, win 24365, options [nop,nop,TS val 2902894 ecr 3140024,nop,nop,sack 1 {251329:255613},mptcp dss ack 2059420631], length 0
15:11:40.669307 IP 112.26.1.8.38393 > 112.26.1.1.34615: Flags [.], ack 249901, win 24391, options [nop,nop,TS val 2903052 ecr 3140024,nop,nop,sack 1 {251329:257041},mptcp dss ack 2059436339], length 0
15:11:40.715461 IP 112.26.1.8.38393 > 112.26.1.1.34615: Flags [.], ack 249901, win 24391, options [nop,nop,TS val 2903074 ecr 3140024,nop,nop,sack 1 {251329:258469},mptcp dss ack 2059436339], length 0
15:11:40.815431 IP 112.26.1.8.38393 > 112.26.1.1.34615: Flags [.], ack 249901, win 24409, options [nop,nop,TS val 2903198 ecr 3140024,nop,nop,sack 2 {259897:261325}{251329:258469},mptcp dss ack 2059439195], length 0
15:11:40.992314 IP 112.26.1.8.38393 > 112.26.1.1.34615: Flags [.], ack 249901, win 24326, options [nop,nop,TS val 2903375 ecr 3140024,nop,nop,sack 2 {259897:262753}{251329:258469},mptcp dss ack 2059446335], length 0
15:11:41.127386 IP 112.26.1.8.38393 > 112.26.1.1.34615: Flags [.], ack 249901, win 24326, options [nop,nop,TS val 2903510 ecr 3140024,nop,nop,sack 2 {259897:264181}{251329:258469},mptcp dss ack 2059446335], length 0
15:11:41.302256 IP 112.26.1.8.38393 > 112.26.1.1.34615: Flags [.], ack 249901, win 24326, options [nop,nop,TS val 2903685 ecr 3140024,nop,nop,sack 2 {259897:265609}{251329:258469},mptcp dss ack 2059446335], length 0
15:11:41.402087 IP 112.26.1.8.38393 > 112.26.1.1.34615: Flags [.], ack 249901, win 24326, options [nop,nop,TS val 2903784 ecr 3140024,nop,nop,sack 2 {259897:267037}{251329:258469},mptcp dss ack 2059446335], length 0
15:11:41.524762 IP 112.26.1.8.38393 > 112.26.1.1.34615: Flags [.], ack 249901, win 24311, options [nop,nop,TS val 2903905 ecr 3140024,nop,nop,sack 2 {259897:268465}{251329:258469},mptcp dss ack 2059456331], length 0
15:11:41.687865 IP 112.26.1.8.38393 > 112.26.1.1.34615: Flags [.], ack 249901, win 24311, options [nop,nop,TS val 2904071 ecr 3140024,nop,nop,sack 2 {259897:269893}{251329:258469},mptcp dss ack 2059456331], length 0
15:11:41.735156 IP 112.26.1.8.38393 > 112.26.1.1.34615: Flags [.], ack 258469, win 24169, options [nop,nop,TS val 2904117 ecr 3141477,nop,nop,sack 1 {259897:269893},mptcp dss ack 2059469183], length 0
15:11:41.818201 IP 112.26.1.8.38393 > 112.26.1.1.34615: Flags [.], ack 258469, win 24311, options [nop,nop,TS val 2904177 ecr 3141477,nop,nop,sack 2 {271321:272749}{259897:269893},mptcp dss ack 2059469183], length 0
15:11:42.005023 IP 112.26.1.8.38393 > 112.26.1.1.34615: Flags [.], ack 269893, win 24148, options [nop,nop,TS val 2904384 ecr 3142165,nop,nop,sack 1 {271321:272749},mptcp dss ack 2059499171], length 0
15:11:42.116559 IP 112.26.1.8.38393 > 112.26.1.1.34615: Flags [.], ack 269893, win 24460, options [nop,nop,TS val 2904499 ecr 3142165,nop,nop,sack 2 {274177:275605}{271321:272749},mptcp dss ack 2059499171], length 0
15:11:42.276205 IP 112.26.1.8.38393 > 112.26.1.1.34615: Flags [.], ack 269893, win 24460, options [nop,nop,TS val 2904659 ecr 3142165,nop,nop,sack 2 {274177:277033}{271321:272749},mptcp dss ack 2059499171], length 0
15:11:42.392156 IP 112.26.1.8.38393 > 112.26.1.1.34615: Flags [.], ack 269893, win 24460, options [nop,nop,TS val 2904775 ecr 3142165,nop,nop,sack 2 {274177:278461}{271321:272749},mptcp dss ack 2059499171], length 0
15:11:42.517331 IP 112.26.1.8.38393 > 112.26.1.1.34615: Flags [.], ack 269893, win 24460, options [nop,nop,TS val 2904900 ecr 3142165,nop,nop,sack 2 {274177:279889}{271321:272749},mptcp dss ack 2059499171], length 0
15:11:42.615540 IP 112.26.1.8.38393 > 112.26.1.1.34615: Flags [.], ack 272749, win 24438, options [nop,nop,TS val 2904996 ecr 3142643,nop,nop,sack 1 {274177:279889},mptcp dss ack 2059500599], length 0
