15:11:18.716053 IP 112.26.2.8.46267 > 112.26.2.1.34615: Flags [S], seq 4009900882, win 65535, options [mss 1460,sackOK,TS val 2881076 ecr 0,nop,wscale 6,mptcp join id 4 token 0x7761ebfe nonce 0x2cbf564], length 0
15:11:18.716334 IP 112.26.2.1.34615 > 112.26.2.8.46267: Flags [S.], seq 663231018, ack 4009900883, win 65535, options [mss 1460,sackOK,TS val 3119170 ecr 2881076,nop,wscale 6,mptcp join id 4 hmac 0x9138e1f4b7e27bfb nonce 0xaa1f1181], length 0
15:11:18.796201 IP 112.26.2.1.34615 > 112.26.2.8.46267: Flags [S.], seq 663231018, ack 4009900883, win 65535, options [mss 1460,sackOK,TS val 3119170 ecr 2881076,nop,wscale 6,mptcp join id 4 hmac 0x9138e1f4b7e27bfb nonce 0xaa1f1181], length 0
15:11:18.958357 IP 112.26.2.8.46267 > 112.26.2.1.34615: Flags [.], ack 1, win 6935, options [nop,nop,TS val 2881232 ecr 3119170,mptcp join hmac 0x45bc29ba2e60960c114bafd545a16769c66c78e6], length 0
15:11:18.958660 IP 112.26.2.1.34615 > 112.26.2.8.46267: Flags [.], ack 1, win 4017, options [nop,nop,TS val 3119413 ecr 2881232,mptcp dss ack 3193170700], length 0
15:11:18.976539 IP 112.26.2.1.34615 > 112.26.2.8.46267: Flags [.], ack 1, win 4017, options [nop,nop,TS val 3119413 ecr 2881232,mptcp dss ack 3193170700], length 0
15:11:19.030277 IP 112.26.2.1.34615 > 112.26.2.8.46267: Flags [.], seq 1:1429, ack 1, win 4017, options [nop,nop,TS val 3119484 ecr 2881232,mptcp dss ack 3193170700 seq 2058759467 subseq 1 len 1428 csum 0xfd04], length 1428
15:11:19.030380 IP 112.26.2.1.34615 > 112.26.2.8.46267: Flags [.], seq 1429:2857, ack 1, win 4017, options [nop,nop,TS val 3119484 ecr 2881232,mptcp dss ack 3193170700 seq 2058760895 subseq 1429 len 1428 csum 0x3fcb], length 1428
15:11:19.030649 IP 112.26.2.1.34615 > 112.26.2.8.46267: Flags [.], seq 2857:4285, ack 1, win 4017, options [nop,nop,TS val 3119484 ecr 2881232,mptcp dss ack 3193170700 seq 2058762323 subseq 2857 len 1428 csum 0x303e], length 1428
15:11:19.076216 IP 112.26.2.1.34615 > 112.26.2.8.46267: Flags [.], seq 1:1429, ack 1, win 4017, options [nop,nop,TS val 3119484 ecr 2881232,mptcp dss ack 3193170700 seq 2058759467 subseq 1 len 1428 csum 0xfd04], length 1428
15:11:19.262572 IP 112.26.2.8.46267 > 112.26.2.1.34615: Flags [.], ack 1429, win 7027, options [nop,nop,TS val 2881467 ecr 3119484,mptcp dss ack 2058720911], length 0
15:11:19.262914 IP 112.26.2.1.34615 > 112.26.2.8.46267: Flags [.], seq 4285:5713, ack 1, win 4017, options [nop,nop,TS val 3119717 ecr 2881232,mptcp dss ack 3193170700 seq 2058772319 subseq 4285 len 1428 csum 0x5a9d], length 1428
15:11:19.263029 IP 112.26.2.1.34615 > 112.26.2.8.46267: Flags [.], seq 5713:7141, ack 1, win 4017, options [nop,nop,TS val 3119717 ecr 2881232,mptcp dss ack 3193170700 seq 2058773747 subseq 5713 len 1428 csum 0xda52], length 1428
15:11:19.263221 IP 112.26.2.1.34615 > 112.26.2.8.46267: Flags [.], seq 7141:8569, ack 1, win 4017, options [nop,nop,TS val 3119717 ecr 2881467,mptcp dss ack 3193170700 seq 2058775175 subseq 7141 len 1428 csum 0x4004], length 1428
15:11:19.263327 IP 112.26.2.1.34615 > 112.26.2.8.46267: Flags [.], seq 8569:9997, ack 1, win 4017, options [nop,nop,TS val 3119717 ecr 2881467,mptcp dss ack 3193170700 seq 2058776603 subseq 8569 len 1428 csum 0x2ce0], length 1428
15:11:19.263488 IP 112.26.2.1.34615 > 112.26.2.8.46267: Flags [.], seq 9997:11425, ack 1, win 4017, options [nop,nop,TS val 3119717 ecr 2881467,mptcp dss ack 3193170700 seq 2058778031 subseq 9997 len 1428 csum 0xdcfa], length 1428
15:11:19.263605 IP 112.26.2.1.34615 > 112.26.2.8.46267: Flags [.], seq 11425:12853, ack 1, win 4017, options [nop,nop,TS val 3119717 ecr 2881467,mptcp dss ack 3193170700 seq 2058779459 subseq 11425 len 1428 csum 0x5bd9], length 1428
15:11:19.263755 IP 112.26.2.1.34615 > 112.26.2.8.46267: Flags [.], seq 12853:14281, ack 1, win 4017, options [nop,nop,TS val 3119717 ecr 2881467,mptcp dss ack 3193170700 seq 2058780887 subseq 12853 len 1428 csum 0x6cf8], length 1428
15:11:19.263858 IP 112.26.2.1.34615 > 112.26.2.8.46267: Flags [.], seq 14281:15709, ack 1, win 4017, options [nop,nop,TS val 3119717 ecr 2881467,mptcp dss ack 3193170700 seq 2058782315 subseq 14281 len 1428 csum 0xed41], length 1428
15:11:19.489470 IP 112.26.2.1.34615 > 112.26.2.8.46267: Flags [.], seq 1429:2857, ack 1, win 4017, options [nop,nop,TS val 3119484 ecr 2881232,mptcp dss ack 3193170700 seq 2058760895 subseq 1429 len 1428 csum 0x3fcb], length 1428
15:11:19.668935 IP 112.26.2.8.46267 > 112.26.2.1.34615: Flags [.], ack 2857, win 7483, options [nop,nop,TS val 2881882 ecr 3119484,mptcp dss ack 2058722339], length 0
15:11:19.669207 IP 112.26.2.1.34615 > 112.26.2.8.46267: Flags [.], seq 15709:17137, ack 1, win 4017, options [nop,nop,TS val 3120123 ecr 2881882,mptcp dss ack 3193170700 seq 2058798023 subseq 15709 len 1428 csum 0x2280], length 1428
15:11:19.669266 IP 112.26.2.1.34615 > 112.26.2.8.46267: Flags [.], seq 17137:18565, ack 1, win 4017, options [nop,nop,TS val 3120123 ecr 2881882,mptcp dss ack 3193170700 seq 2058799451 subseq 17137 len 1428 csum 0x9bd0], length 1428
15:11:19.729959 IP 112.26.2.1.34615 > 112.26.2.8.46267: Flags [.], seq 2857:4285, ack 1, win 4017, options [nop,nop,TS val 3119484 ecr 2881232,mptcp dss ack 3193170700 seq 2058762323 subseq 2857 len 1428 csum 0x303e], length 1428
15:11:19.900218 IP 112.26.2.8.46267 > 112.26.2.1.34615: Flags [.], ack 4285, win 7757, options [nop,nop,TS val 2882167 ecr 3119484,mptcp dss ack 2058722339], length 0
15:11:19.900584 IP 112.26.2.1.34615 > 112.26.2.8.46267: Flags [.], seq 18565:19993, ack 1, win 4017, options [nop,nop,TS val 3120355 ecr 2882167,mptcp dss ack 3193170700 seq 2058805163 subseq 18565 len 1428 csum 0xb141], length 1428
15:11:19.900622 IP 112.26.2.1.34615 > 112.26.2.8.46267: Flags [.], seq 19993:21421, ack 1, win 4017, options [nop,nop,TS val 3120355 ecr 2882167,mptcp dss ack 3193170700 seq 2058806591 subseq 19993 len 1428 csum 0xaf25], length 1428
15:11:20.075776 IP 112.26.2.1.34615 > 112.26.2.8.46267: Flags [.], seq 7141:8569, ack 1, win 4017, options [nop,nop,TS val 3119717 ecr 2881467,mptcp dss ack 3193170700 seq 2058775175 subseq 7141 len 1428 csum 0x4004], length 1428
15:11:20.248576 IP 112.26.2.8.46267 > 112.26.2.1.34615: Flags [.], ack 4285, win 8122, options [nop,nop,TS val 2882466 ecr 3119484,nop,nop,sack 1 {7141:8569},mptcp dss ack 2058739475], length 0
15:11:20.257762 IP 112.26.2.1.34615 > 112.26.2.8.46267: Flags [.], seq 21421:22849, ack 1, win 4017, options [nop,nop,TS val 3120712 ecr 2882466,mptcp dss ack 3193170700 seq 2058756611 subseq 21421 len 1428 csum 0xa319], length 1428
15:11:20.442361 IP 112.26.2.1.34615 > 112.26.2.8.46267: Flags [.], seq 15709:17137, ack 1, win 4017, options [nop,nop,TS val 3120123 ecr 2881882,mptcp dss ack 3193170700 seq 2058798023 subseq 15709 len 1428 csum 0x2280], length 1428
15:11:20.542055 IP 112.26.2.8.46267 > 112.26.2.1.34615: Flags [.], ack 4285, win 8532, options [nop,nop,TS val 2882834 ecr 3119484,nop,nop,sack 2 {15709:17137}{7141:8569},mptcp dss ack 2058739475], length 0
15:11:20.542240 IP 112.26.2.1.34615 > 112.26.2.8.46267: Flags [.], seq 4285:5713, ack 1, win 4017, options [nop,nop,TS val 3120996 ecr 2882834,mptcp dss ack 3193170700 seq 2058772319 subseq 4285 len 1428 csum 0x5a9d], length 1428
15:11:20.626823 IP 112.26.2.1.34615 > 112.26.2.8.46267: Flags [.], seq 18565:19993, ack 1, win 4017, options [nop,nop,TS val 3120355 ecr 2882167,mptcp dss ack 3193170700 seq 2058805163 subseq 18565 len 1428 csum 0xb141], length 1428
15:11:20.744182 IP 112.26.2.8.46267 > 112.26.2.1.34615: Flags [.], ack 4285, win 8760, options [nop,nop,TS val 2883021 ecr 3119484,nop,nop,sack 2 {18565:19993}{15709:17137},mptcp dss ack 2058739475], length 0
15:11:20.744490 IP 112.26.2.1.34615 > 112.26.2.8.46267: Flags [.], seq 5713:7141, ack 1, win 4017, options [nop,nop,TS val 3121198 ecr 2883021,mptcp dss ack 3193170700 seq 2058773747 subseq 5713 len 1428 csum 0xda52], length 1428
15:11:20.849298 IP 112.26.2.1.34615 > 112.26.2.8.46267: Flags [.], seq 21421:22849, ack 1, win 4017, options [nop,nop,TS val 3120712 ecr 2882466,mptcp dss ack 3193170700 seq 2058756611 subseq 21421 len 1428 csum 0xa319], length 1428
15:11:21.022723 IP 112.26.2.1.34615 > 112.26.2.8.46267: Flags [.], seq 4285:5713, ack 1, win 4017, options [nop,nop,TS val 3120996 ecr 2882834,mptcp dss ack 3193170700 seq 2058772319 subseq 4285 len 1428 csum 0x5a9d], length 1428
15:11:21.094614 IP 112.26.2.8.46267 > 112.26.2.1.34615: Flags [.], ack 4285, win 8943, options [nop,nop,TS val 2883242 ecr 3119484,nop,nop,sack 2 {21421:22849}{18565:19993},mptcp dss ack 2058739475], length 0
15:11:21.094887 IP 112.26.2.1.34615 > 112.26.2.8.46267: Flags [.], seq 8569:9997, ack 1, win 4017, options [nop,nop,TS val 3121549 ecr 2883242,mptcp dss ack 3193170700 seq 2058776603 subseq 8569 len 1428 csum 0x2ce0], length 1428
15:11:21.188068 IP 112.26.2.1.34615 > 112.26.2.8.46267: Flags [.], seq 5713:7141, ack 1, win 4017, options [nop,nop,TS val 3121198 ecr 2883021,mptcp dss ack 3193170700 seq 2058773747 subseq 5713 len 1428 csum 0xda52], length 1428
15:11:21.258855 IP 112.26.2.8.46267 > 112.26.2.1.34615: Flags [.], ack 5713, win 9354, options [nop,nop,TS val 2883537 ecr 3120996,nop,nop,sack 2 {21421:22849}{18565:19993},mptcp dss ack 2058739475], length 0
15:11:21.259143 IP 112.26.2.1.34615 > 112.26.2.8.46267: Flags [.], seq 9997:11425, ack 1, win 4017, options [nop,nop,TS val 3121713 ecr 2883537,mptcp dss ack 3193170700 seq 2058778031 subseq 9997 len 1428 csum 0xdcfa], length 1428
15:11:21.259182 IP 112.26.2.1.34615 > 112.26.2.8.46267: Flags [.], seq 11425:12853, ack 1, win 4017, options [nop,nop,TS val 3121713 ecr 2883537,mptcp dss ack 3193170700 seq 2058779459 subseq 11425 len 1428 csum 0x5bd9], length 1428
15:11:21.436318 IP 112.26.2.1.34615 > 112.26.2.8.46267: Flags [.], seq 8569:9997, ack 1, win 4017, options [nop,nop,TS val 3121549 ecr 2883242,mptcp dss ack 3193170700 seq 2058776603 subseq 8569 len 1428 csum 0x2ce0], length 1428
15:11:21.463450 IP 112.26.2.8.46267 > 112.26.2.1.34615: Flags [.], ack 8569, win 9490, options [nop,nop,TS val 2883705 ecr 3121198,nop,nop,sack 2 {21421:22849}{18565:19993},mptcp dss ack 2058742331], length 0
15:11:21.463772 IP 112.26.2.1.34615 > 112.26.2.8.46267: Flags [.], seq 12853:14281, ack 1, win 4017, options [nop,nop,TS val 3121918 ecr 2883705,mptcp dss ack 3193170700 seq 2058780887 subseq 12853 len 1428 csum 0x6cf8], length 1428
15:11:21.463813 IP 112.26.2.1.34615 > 112.26.2.8.46267: Flags [.], seq 14281:15709, ack 1, win 4017, options [nop,nop,TS val 3121918 ecr 2883705,mptcp dss ack 3193170700 seq 2058782315 subseq 14281 len 1428 csum 0xed41], length 1428
15:11:21.569132 IP 112.26.2.1.34615 > 112.26.2.8.46267: Flags [.], seq 9997:11425, ack 1, win 4017, options [nop,nop,TS val 3121713 ecr 2883537,mptcp dss ack 3193170700 seq 2058778031 subseq 9997 len 1428 csum 0xdcfa], length 1428
15:11:21.660555 IP 112.26.2.8.46267 > 112.26.2.1.34615: Flags [.], ack 9997, win 9673, options [nop,nop,TS val 2883884 ecr 3121549,nop,nop,sack 2 {21421:22849}{18565:19993},mptcp dss ack 2058743759], length 0
15:11:21.660814 IP 112.26.2.1.34615 > 112.26.2.8.46267: Flags [.], seq 17137:18565, ack 1, win 4017, options [nop,nop,TS val 3122115 ecr 2883884,mptcp dss ack 3193170700 seq 2058799451 subseq 17137 len 1428 csum 0x9bd0], length 1428
15:11:21.660853 IP 112.26.2.1.34615 > 112.26.2.8.46267: Flags [.], seq 19993:21421, ack 1, win 4017, options [nop,nop,TS val 3122115 ecr 2883884,mptcp dss ack 3193170700 seq 2058806591 subseq 19993 len 1428 csum 0xaf25], length 1428
15:11:21.883193 IP 112.26.2.1.34615 > 112.26.2.8.46267: Flags [.], seq 11425:12853, ack 1, win 4017, options [nop,nop,TS val 3121713 ecr 2883537,mptcp dss ack 3193170700 seq 2058779459 subseq 11425 len 1428 csum 0x5bd9], length 1428
15:11:21.912372 IP 112.26.2.8.46267 > 112.26.2.1.34615: Flags [.], ack 11425, win 9992, options [nop,nop,TS val 2884103 ecr 3121713,nop,nop,sack 2 {21421:22849}{18565:19993},mptcp dss ack 2058752327], length 0
15:11:21.912658 IP 112.26.2.1.34615 > 112.26.2.8.46267: Flags [.], seq 22849:24277, ack 1, win 4017, options [nop,nop,TS val 3122366 ecr 2884103,mptcp dss ack 3193170700 seq 2058838007 subseq 22849 len 1428 csum 0xe344], length 1428
15:11:21.912704 IP 112.26.2.1.34615 > 112.26.2.8.46267: Flags [.], seq 24277:25705, ack 1, win 4017, options [nop,nop,TS val 3122366 ecr 2884103,mptcp dss ack 3193170700 seq 2058839435 subseq 24277 len 1428 csum 0xa70a], length 1428
15:11:22.117680 IP 112.26.2.1.34615 > 112.26.2.8.46267: Flags [.], seq 12853:14281, ack 1, win 4017, options [nop,nop,TS val 3121918 ecr 2883705,mptcp dss ack 3193170700 seq 2058780887 subseq 12853 len 1428 csum 0x6cf8], length 1428
15:11:22.243814 IP 112.26.2.1.34615 > 112.26.2.8.46267: Flags [.], seq 17137:18565, ack 1, win 4017, options [nop,nop,TS val 3122115 ecr 2883884,mptcp dss ack 3193170700 seq 2058799451 subseq 17137 len 1428 csum 0x9bd0], length 1428
15:11:22.362349 IP 112.26.2.1.34615 > 112.26.2.8.46267: Flags [.], seq 19993:21421, ack 1, win 4017, options [nop,nop,TS val 3122115 ecr 2883884,mptcp dss ack 3193170700 seq 2058806591 subseq 19993 len 1428 csum 0xaf25], length 1428
15:11:22.517562 IP 112.26.2.8.46267 > 112.26.2.1.34615: Flags [.], ack 12853, win 10175, options [nop,nop,TS val 2884307 ecr 3121713,nop,nop,sack 2 {21421:22849}{18565:19993},mptcp dss ack 2058752327], length 0
15:11:22.518015 IP 112.26.2.1.34615 > 112.26.2.8.46267: Flags [.], seq 25705:27133, ack 1, win 4017, options [nop,nop,TS val 3122972 ecr 2884307,mptcp dss ack 3193170700 seq 2058856571 subseq 25705 len 1428 csum 0xe428], length 1428
15:11:22.518063 IP 112.26.2.1.34615 > 112.26.2.8.46267: Flags [.], seq 27133:28561, ack 1, win 4017, options [nop,nop,TS val 3122972 ecr 2884307,mptcp dss ack 3193170700 seq 2058857999 subseq 27133 len 1428 csum 0x845], length 1428
15:11:22.593035 IP 112.26.2.1.34615 > 112.26.2.8.46267: Flags [.], seq 24277:25705, ack 1, win 4017, options [nop,nop,TS val 3122366 ecr 2884103,mptcp dss ack 3193170700 seq 2058839435 subseq 24277 len 1428 csum 0xa70a], length 1428
15:11:22.750880 IP 112.26.2.8.46267 > 112.26.2.1.34615: Flags [.], ack 14281, win 10403, options [nop,nop,TS val 2884509 ecr 3121918,nop,nop,sack 2 {21421:22849}{18565:19993},mptcp dss ack 2058752327], length 0
15:11:22.751255 IP 112.26.2.1.34615 > 112.26.2.8.46267: Flags [.], seq 28561:29989, ack 1, win 4017, options [nop,nop,TS val 3123205 ecr 2884509,mptcp dss ack 3193170700 seq 2058865139 subseq 28561 len 1428 csum 0x5b3e], length 1428
15:11:22.918617 IP 112.26.2.1.34615 > 112.26.2.8.46267: Flags [.], seq 25705:27133, ack 1, win 4017, options [nop,nop,TS val 3122972 ecr 2884307,mptcp dss ack 3193170700 seq 2058856571 subseq 25705 len 1428 csum 0xe428], length 1428
15:11:23.005992 IP 112.26.2.8.46267 > 112.26.2.1.34615: Flags [.], ack 14281, win 10722, options [nop,nop,TS val 2884717 ecr 3121918,nop,nop,sack 2 {15709:19993}{21421:22849},mptcp dss ack 2058756611], length 0
15:11:23.006325 IP 112.26.2.1.34615 > 112.26.2.8.46267: Flags [.], seq 14281:15709, ack 1, win 4017, options [nop,nop,TS val 3123460 ecr 2884717,mptcp dss ack 3193170700 seq 2058782315 subseq 14281 len 1428 csum 0xed41], length 1428
15:11:23.128298 IP 112.26.2.1.34615 > 112.26.2.8.46267: Flags [.], seq 27133:28561, ack 1, win 4017, options [nop,nop,TS val 3122972 ecr 2884307,mptcp dss ack 3193170700 seq 2058857999 subseq 27133 len 1428 csum 0x845], length 1428
15:11:23.233633 IP 112.26.2.1.34615 > 112.26.2.8.46267: Flags [.], seq 28561:29989, ack 1, win 4017, options [nop,nop,TS val 3123205 ecr 2884509,mptcp dss ack 3193170700 seq 2058865139 subseq 28561 len 1428 csum 0x5b3e], length 1428
15:11:23.337728 IP 112.26.2.8.46267 > 112.26.2.1.34615: Flags [.], ack 14281, win 11042, options [nop,nop,TS val 2885037 ecr 3121918,nop,nop,sack 1 {15709:22849},mptcp dss ack 2058756611], length 0
15:11:23.376027 IP 112.26.2.1.34615 > 112.26.2.8.46267: Flags [.], seq 29989:31417, ack 1, win 4017, options [nop,nop,TS val 3123830 ecr 2885037,mptcp dss ack 3193170700 seq 2058882275 subseq 29989 len 1428 csum 0x43f6], length 1428
15:11:23.433219 IP 112.26.2.8.46267 > 112.26.2.1.34615: Flags [.], ack 14281, win 11224, options [nop,nop,TS val 2885153 ecr 3121918,nop,nop,sack 2 {24277:25705}{15709:22849},mptcp dss ack 2058756611], length 0
15:11:23.433542 IP 112.26.2.1.34615 > 112.26.2.8.46267: Flags [.], seq 22849:24277, ack 1, win 4017, options [nop,nop,TS val 3123888 ecr 2885153,mptcp dss ack 3193170700 seq 2058838007 subseq 22849 len 1428 csum 0xe344], length 1428
15:11:23.539359 IP 112.26.2.8.46267 > 112.26.2.1.34615: Flags [.], ack 14281, win 11589, options [nop,nop,TS val 2885440 ecr 3121918,nop,nop,sack 2 {24277:27133}{15709:22849},mptcp dss ack 2058756611], length 0
15:11:23.579870 IP 112.26.2.1.34615 > 112.26.2.8.46267: Flags [.], seq 29989:31417, ack 1, win 4017, options [nop,nop,TS val 3123830 ecr 2885037,mptcp dss ack 3193170700 seq 2058882275 subseq 29989 len 1428 csum 0x43f6], length 1428
15:11:23.600982 IP 112.26.2.1.34615 > 112.26.2.8.46267: Flags [.], seq 31417:32845, ack 1, win 4017, options [nop,nop,TS val 3124055 ecr 2885440,mptcp dss ack 3193170700 seq 2058896555 subseq 31417 len 1428 csum 0xcea1], length 1428
15:11:23.726652 IP 112.26.2.1.34615 > 112.26.2.8.46267: Flags [.], seq 22849:24277, ack 1, win 4017, options [nop,nop,TS val 3123888 ecr 2885153,mptcp dss ack 3193170700 seq 2058838007 subseq 22849 len 1428 csum 0xe344], length 1428
15:11:23.890704 IP 112.26.2.8.46267 > 112.26.2.1.34615: Flags [.], ack 14281, win 11863, options [nop,nop,TS val 2885647 ecr 3121918,nop,nop,sack 2 {24277:28561}{15709:22849},mptcp dss ack 2058756611], length 0
15:11:23.900349 IP 112.26.2.1.34615 > 112.26.2.8.46267: Flags [.], seq 32845:34273, ack 1, win 4017, options [nop,nop,TS val 3124354 ecr 2885647,mptcp dss ack 3193170700 seq 2058906551 subseq 32845 len 1428 csum 0x5f50], length 1428
15:11:23.986929 IP 112.26.2.8.46267 > 112.26.2.1.34615: Flags [.], ack 14281, win 12091, options [nop,nop,TS val 2885752 ecr 3121918,nop,nop,sack 2 {24277:29989}{15709:22849},mptcp dss ack 2058782315], length 0
15:11:24.052540 IP 112.26.2.1.34615 > 112.26.2.8.46267: Flags [.], seq 31417:32845, ack 1, win 4017, options [nop,nop,TS val 3124055 ecr 2885440,mptcp dss ack 3193170700 seq 2058896555 subseq 31417 len 1428 csum 0xcea1], length 1428
15:11:24.062350 IP 112.26.2.1.34615 > 112.26.2.8.46267: Flags [.], seq 34273:35701, ack 1, win 4017, options [nop,nop,TS val 3124516 ecr 2885752,mptcp dss ack 3193170700 seq 2058910835 subseq 34273 len 1428 csum 0xaad0], length 1428
15:11:24.177061 IP 112.26.2.8.46267 > 112.26.2.1.34615: Flags [.], ack 14281, win 12319, options [nop,nop,TS val 2885971 ecr 3121918,nop,nop,sack 2 {24277:31417}{15709:22849},mptcp dss ack 2058782315], length 0
15:11:24.177391 IP 112.26.2.1.34615 > 112.26.2.8.46267: Flags [.], seq 14281:15709, ack 1, win 4017, options [nop,nop,TS val 3124631 ecr 2885971,mptcp dss ack 3193170700 seq 2058782315 subseq 14281 len 1428 csum 0xed41], length 1428
15:11:24.382508 IP 112.26.2.8.46267 > 112.26.2.1.34615: Flags [.], ack 14281, win 12456, options [nop,nop,TS val 2886116 ecr 3121918,nop,nop,sack 1 {15709:31417},mptcp dss ack 2058782315], length 0
15:11:24.418801 IP 112.26.2.1.34615 > 112.26.2.8.46267: Flags [.], seq 35701:37129, ack 1, win 4017, options [nop,nop,TS val 3124872 ecr 2886116,mptcp dss ack 3193170700 seq 2058920831 subseq 35701 len 1428 csum 0xfaca], length 1428
15:11:24.471711 IP 112.26.2.1.34615 > 112.26.2.8.46267: Flags [.], seq 34273:35701, ack 1, win 4017, options [nop,nop,TS val 3124516 ecr 2885752,mptcp dss ack 3193170700 seq 2058910835 subseq 34273 len 1428 csum 0xaad0], length 1428
15:11:24.588420 IP 112.26.2.1.34615 > 112.26.2.8.46267: Flags [.], seq 14281:15709, ack 1, win 4017, options [nop,nop,TS val 3124631 ecr 2885971,mptcp dss ack 3193170700 seq 2058782315 subseq 14281 len 1428 csum 0xed41], length 1428
15:11:24.680468 IP 112.26.2.8.46267 > 112.26.2.1.34615: Flags [.], ack 14281, win 12867, options [nop,nop,TS val 2886442 ecr 3121918,nop,nop,sack 1 {15709:32845},mptcp dss ack 2058782315], length 0
15:11:24.733821 IP 112.26.2.1.34615 > 112.26.2.8.46267: Flags [.], seq 35701:37129, ack 1, win 4017, options [nop,nop,TS val 3124872 ecr 2886116,mptcp dss ack 3193170700 seq 2058920831 subseq 35701 len 1428 csum 0xfaca], length 1428
15:11:24.756493 IP 112.26.2.1.34615 > 112.26.2.8.46267: Flags [.], seq 37129:38557, ack 1, win 4017, options [nop,nop,TS val 3125211 ecr 2886442,mptcp dss ack 3193170700 seq 2058930827 subseq 37129 len 1428 csum 0xb11], length 1428
15:11:24.912917 IP 112.26.2.8.46267 > 112.26.2.1.34615: Flags [.], ack 14281, win 13186, options [nop,nop,TS val 2886862 ecr 3121918,nop,nop,sack 2 {34273:35701}{15709:32845},mptcp dss ack 2058782315], length 0
15:11:24.913190 IP 112.26.2.1.34615 > 112.26.2.8.46267: Flags [.], seq 32845:34273, ack 1, win 4017, options [nop,nop,TS val 3125367 ecr 2886862,mptcp dss ack 3193170700 seq 2058906551 subseq 32845 len 1428 csum 0x5f50], length 1428
15:11:25.067688 IP 112.26.2.1.34615 > 112.26.2.8.46267: Flags [.], seq 37129:38557, ack 1, win 4017, options [nop,nop,TS val 3125211 ecr 2886442,mptcp dss ack 3193170700 seq 2058930827 subseq 37129 len 1428 csum 0xb11], length 1428
15:11:25.204706 IP 112.26.2.8.46267 > 112.26.2.1.34615: Flags [.], ack 32845, win 13551, options [nop,nop,TS val 2887096 ecr 3124631,nop,nop,sack 1 {34273:35701},mptcp dss ack 2058876563], length 0
15:11:25.205131 IP 112.26.2.1.34615 > 112.26.2.8.46267: Flags [.], seq 38557:39985, ack 1, win 4017, options [nop,nop,TS val 3125659 ecr 2887096,mptcp dss ack 3193170700 seq 2058950819 subseq 38557 len 1428 csum 0xabb5], length 1428
15:11:25.205205 IP 112.26.2.1.34615 > 112.26.2.8.46267: Flags [.], seq 39985:41413, ack 1, win 4017, options [nop,nop,TS val 3125659 ecr 2887096,mptcp dss ack 3193170700 seq 2058952247 subseq 39985 len 1428 csum 0x31a1], length 1428
15:11:25.317224 IP 112.26.2.1.34615 > 112.26.2.8.46267: Flags [.], seq 32845:34273, ack 1, win 4017, options [nop,nop,TS val 3125367 ecr 2886862,mptcp dss ack 3193170700 seq 2058906551 subseq 32845 len 1428 csum 0x5f50], length 1428
15:11:25.442887 IP 112.26.2.8.46267 > 112.26.2.1.34615: Flags [.], ack 32845, win 13779, options [nop,nop,TS val 2887267 ecr 3124631,nop,nop,sack 1 {34273:37129},mptcp dss ack 2058895127], length 0
15:11:25.456744 IP 112.26.2.1.34615 > 112.26.2.8.46267: Flags [.], seq 41413:42841, ack 1, win 4017, options [nop,nop,TS val 3125910 ecr 2887267,mptcp dss ack 3193170700 seq 2058960815 subseq 41413 len 1428 csum 0xa937], length 1428
15:11:25.547037 IP 112.26.2.1.34615 > 112.26.2.8.46267: Flags [.], seq 38557:39985, ack 1, win 4017, options [nop,nop,TS val 3125659 ecr 2887096,mptcp dss ack 3193170700 seq 2058950819 subseq 38557 len 1428 csum 0xabb5], length 1428
15:11:25.641825 IP 112.26.2.8.46267 > 112.26.2.1.34615: Flags [.], ack 32845, win 14053, options [nop,nop,TS val 2887457 ecr 3124631,nop,nop,sack 1 {34273:38557},mptcp dss ack 2058895127], length 0
15:11:25.659222 IP 112.26.2.1.34615 > 112.26.2.8.46267: Flags [.], seq 42841:44269, ack 1, win 4017, options [nop,nop,TS val 3126113 ecr 2887457,mptcp dss ack 3193170700 seq 2058966527 subseq 42841 len 1428 csum 0xbd3f], length 1428
15:11:25.739636 IP 112.26.2.1.34615 > 112.26.2.8.46267: Flags [.], seq 39985:41413, ack 1, win 4017, options [nop,nop,TS val 3125659 ecr 2887096,mptcp dss ack 3193170700 seq 2058952247 subseq 39985 len 1428 csum 0x31a1], length 1428
15:11:25.874677 IP 112.26.2.8.46267 > 112.26.2.1.34615: Flags [.], ack 38557, win 14235, options [nop,nop,TS val 2887704 ecr 3125367,mptcp dss ack 2058895127], length 0
15:11:25.875084 IP 112.26.2.1.34615 > 112.26.2.8.46267: Flags [.], seq 44269:45697, ack 1, win 4017, options [nop,nop,TS val 3126329 ecr 2887704,mptcp dss ack 3193170700 seq 2058975095 subseq 44269 len 1428 csum 0xfc68], length 1428
15:11:25.962298 IP 112.26.2.1.34615 > 112.26.2.8.46267: Flags [.], seq 41413:42841, ack 1, win 4017, options [nop,nop,TS val 3125910 ecr 2887267,mptcp dss ack 3193170700 seq 2058960815 subseq 41413 len 1428 csum 0xa937], length 1428
15:11:26.117573 IP 112.26.2.1.34615 > 112.26.2.8.46267: Flags [.], seq 42841:44269, ack 1, win 4017, options [nop,nop,TS val 3126113 ecr 2887457,mptcp dss ack 3193170700 seq 2058966527 subseq 42841 len 1428 csum 0xbd3f], length 1428
15:11:26.168208 IP 112.26.2.8.46267 > 112.26.2.1.34615: Flags [.], ack 39985, win 14509, options [nop,nop,TS val 2887938 ecr 3125659,mptcp dss ack 2058895127], length 0
15:11:26.168576 IP 112.26.2.1.34615 > 112.26.2.8.46267: Flags [.], seq 45697:47125, ack 1, win 4017, options [nop,nop,TS val 3126622 ecr 2887938,mptcp dss ack 3193170700 seq 2058990803 subseq 45697 len 1428 csum 0x75cc], length 1428
15:11:26.268107 IP 112.26.2.8.46267 > 112.26.2.1.34615: Flags [.], ack 41413, win 14783, options [nop,nop,TS val 2888131 ecr 3125659,mptcp dss ack 2058895127], length 0
15:11:26.268469 IP 112.26.2.1.34615 > 112.26.2.8.46267: Flags [.], seq 47125:48553, ack 1, win 4017, options [nop,nop,TS val 3126722 ecr 2888131,mptcp dss ack 3193170700 seq 2058995087 subseq 47125 len 1428 csum 0x5d9a], length 1428
15:11:26.358458 IP 112.26.2.1.34615 > 112.26.2.8.46267: Flags [.], seq 44269:45697, ack 1, win 4017, options [nop,nop,TS val 3126329 ecr 2887704,mptcp dss ack 3193170700 seq 2058975095 subseq 44269 len 1428 csum 0xfc68], length 1428
15:11:26.519927 IP 112.26.2.8.46267 > 112.26.2.1.34615: Flags [.], ack 42841, win 15011, options [nop,nop,TS val 2888354 ecr 3125910,mptcp dss ack 2058895127], length 0
15:11:26.520317 IP 112.26.2.1.34615 > 112.26.2.8.46267: Flags [.], seq 48553:49981, ack 1, win 4017, options [nop,nop,TS val 3126974 ecr 2888354,mptcp dss ack 3193170700 seq 2059005083 subseq 48553 len 1428 csum 0x7425], length 1428
15:11:26.607637 IP 112.26.2.1.34615 > 112.26.2.8.46267: Flags [.], seq 45697:47125, ack 1, win 4017, options [nop,nop,TS val 3126622 ecr 2887938,mptcp dss ack 3193170700 seq 2058990803 subseq 45697 len 1428 csum 0x75cc], length 1428
15:11:26.732575 IP 112.26.2.8.46267 > 112.26.2.1.34615: Flags [.], ack 44269, win 15239, options [nop,nop,TS val 2888592 ecr 3126113,mptcp dss ack 2058895127], length 0
15:11:26.732843 IP 112.26.2.1.34615 > 112.26.2.8.46267: Flags [.], seq 49981:51409, ack 1, win 4017, options [nop,nop,TS val 3127187 ecr 2888592,mptcp dss ack 3193170700 seq 2059012223 subseq 49981 len 1428 csum 0x841e], length 1428
15:11:26.732913 IP 112.26.2.1.34615 > 112.26.2.8.46267: Flags [.], seq 51409:52837, ack 1, win 4017, options [nop,nop,TS val 3127187 ecr 2888592,mptcp dss ack 3193170700 seq 2059013651 subseq 51409 len 1428 csum 0x2c1e], length 1428
15:11:26.871694 IP 112.26.2.1.34615 > 112.26.2.8.46267: Flags [.], seq 48553:49981, ack 1, win 4017, options [nop,nop,TS val 3126974 ecr 2888354,mptcp dss ack 3193170700 seq 2059005083 subseq 48553 len 1428 csum 0x7425], length 1428
15:11:26.974341 IP 112.26.2.8.46267 > 112.26.2.1.34615: Flags [.], ack 45697, win 15422, options [nop,nop,TS val 2888752 ecr 3126329,mptcp dss ack 2058895127], length 0
15:11:26.974667 IP 112.26.2.1.34615 > 112.26.2.8.46267: Flags [.], seq 52837:54265, ack 1, win 4017, options [nop,nop,TS val 3127428 ecr 2888752,mptcp dss ack 3193170700 seq 2059023647 subseq 52837 len 1428 csum 0xac17], length 1428
15:11:27.050023 IP 112.26.2.8.46267 > 112.26.2.1.34615: Flags [.], ack 47125, win 15787, options [nop,nop,TS val 2888999 ecr 3126622,mptcp dss ack 2058895127], length 0
15:11:27.050379 IP 112.26.2.1.34615 > 112.26.2.8.46267: Flags [.], seq 54265:55693, ack 1, win 4017, options [nop,nop,TS val 3127504 ecr 2888999,mptcp dss ack 3193170700 seq 2059026503 subseq 54265 len 1428 csum 0xf1b1], length 1428
15:11:27.157470 IP 112.26.2.1.34615 > 112.26.2.8.46267: Flags [.], seq 49981:51409, ack 1, win 4017, options [nop,nop,TS val 3127187 ecr 2888592,mptcp dss ack 3193170700 seq 2059012223 subseq 49981 len 1428 csum 0x841e], length 1428
15:11:27.262287 IP 112.26.2.1.34615 > 112.26.2.8.46267: Flags [.], seq 51409:52837, ack 1, win 4017, options [nop,nop,TS val 3127187 ecr 2888592,mptcp dss ack 3193170700 seq 2059013651 subseq 51409 len 1428 csum 0x2c1e], length 1428
15:11:27.344798 IP 112.26.2.1.34615 > 112.26.2.8.46267: Flags [.], seq 52837:54265, ack 1, win 4017, options [nop,nop,TS val 3127428 ecr 2888752,mptcp dss ack 3193170700 seq 2059023647 subseq 52837 len 1428 csum 0xac17], length 1428
15:11:27.419006 IP 112.26.2.8.46267 > 112.26.2.1.34615: Flags [.], ack 47125, win 16106, options [nop,nop,TS val 2889265 ecr 3126622,nop,nop,sack 1 {48553:49981},mptcp dss ack 2058895127], length 0
15:11:27.469399 IP 112.26.2.1.34615 > 112.26.2.8.46267: Flags [.], seq 55693:57121, ack 1, win 4017, options [nop,nop,TS val 3127924 ecr 2889265,mptcp dss ack 3193170700 seq 2059035071 subseq 55693 len 1428 csum 0x2ad8], length 1428
15:11:27.514460 IP 112.26.2.1.34615 > 112.26.2.8.46267: Flags [.], seq 54265:55693, ack 1, win 4017, options [nop,nop,TS val 3127504 ecr 2888999,mptcp dss ack 3193170700 seq 2059026503 subseq 54265 len 1428 csum 0xf1b1], length 1428
15:11:27.697803 IP 112.26.2.8.46267 > 112.26.2.1.34615: Flags [.], ack 47125, win 16380, options [nop,nop,TS val 2889550 ecr 3126622,nop,nop,sack 1 {48553:51409},mptcp dss ack 2058942251], length 0
15:11:27.713672 IP 112.26.2.1.34615 > 112.26.2.8.46267: Flags [.], seq 57121:58549, ack 1, win 4017, options [nop,nop,TS val 3128168 ecr 2889550,mptcp dss ack 3193170700 seq 2059042211 subseq 57121 len 1428 csum 0x8c7e], length 1428
15:11:27.808466 IP 112.26.2.1.34615 > 112.26.2.8.46267: Flags [.], seq 55693:57121, ack 1, win 4017, options [nop,nop,TS val 3127924 ecr 2889265,mptcp dss ack 3193170700 seq 2059035071 subseq 55693 len 1428 csum 0x2ad8], length 1428
15:11:27.901916 IP 112.26.2.8.46267 > 112.26.2.1.34615: Flags [.], ack 47125, win 16699, options [nop,nop,TS val 2889834 ecr 3126622,nop,nop,sack 1 {48553:52837},mptcp dss ack 2058947963], length 0
15:11:27.902209 IP 112.26.2.1.34615 > 112.26.2.8.46267: Flags [.], seq 47125:48553, ack 1, win 4017, options [nop,nop,TS val 3128356 ecr 2889834,mptcp dss ack 3193170700 seq 2058995087 subseq 47125 len 1428 csum 0x5d9a], length 1428
15:11:28.011550 IP 112.26.2.1.34615 > 112.26.2.8.46267: Flags [.], seq 57121:58549, ack 1, win 4017, options [nop,nop,TS val 3128168 ecr 2889550,mptcp dss ack 3193170700 seq 2059042211 subseq 57121 len 1428 csum 0x8c7e], length 1428
15:11:28.130658 IP 112.26.2.1.34615 > 112.26.2.8.46267: Flags [.], seq 47125:48553, ack 1, win 4017, options [nop,nop,TS val 3128356 ecr 2889834,mptcp dss ack 3193170700 seq 2058995087 subseq 47125 len 1428 csum 0x5d9a], length 1428
15:11:28.239046 IP 112.26.2.8.46267 > 112.26.2.1.34615: Flags [.], ack 47125, win 16882, options [nop,nop,TS val 2889945 ecr 3126622,nop,nop,sack 1 {48553:54265},mptcp dss ack 2058967955], length 0
15:11:28.332360 IP 112.26.2.8.46267 > 112.26.2.1.34615: Flags [.], ack 47125, win 17155, options [nop,nop,TS val 2890137 ecr 3126622,nop,nop,sack 1 {48553:55693},mptcp dss ack 2058980807], length 0
15:11:28.350606 IP 112.26.2.1.34615 > 112.26.2.8.46267: Flags [.], seq 58549:59977, ack 1, win 4017, options [nop,nop,TS val 3128804 ecr 2890137,mptcp dss ack 3193170700 seq 2059075055 subseq 58549 len 1428 csum 0x4bb2], length 1428
15:11:28.444122 IP 112.26.2.8.46267 > 112.26.2.1.34615: Flags [.], ack 47125, win 17429, options [nop,nop,TS val 2890389 ecr 3126622,nop,nop,sack 1 {48553:57121},mptcp dss ack 2058995087], length 0
15:11:28.457764 IP 112.26.2.1.34615 > 112.26.2.8.46267: Flags [.], seq 59977:61405, ack 1, win 4017, options [nop,nop,TS val 3128912 ecr 2890389,mptcp dss ack 3193170700 seq 2059077911 subseq 59977 len 1428 csum 0x40d9], length 1428
15:11:28.534386 IP 112.26.2.1.34615 > 112.26.2.8.46267: Flags [.], seq 58549:59977, ack 1, win 4017, options [nop,nop,TS val 3128804 ecr 2890137,mptcp dss ack 3193170700 seq 2059075055 subseq 58549 len 1428 csum 0x4bb2], length 1428
15:11:28.657958 IP 112.26.2.8.46267 > 112.26.2.1.34615: Flags [.], ack 47125, win 17566, options [nop,nop,TS val 2890576 ecr 3126622,nop,nop,sack 1 {48553:58549},mptcp dss ack 2058995087], length 0
15:11:28.706816 IP 112.26.2.8.46267 > 112.26.2.1.34615: Flags [.], ack 58549, win 17749, options [nop,nop,TS val 2890677 ecr 3128356,mptcp dss ack 2059003655], length 0
15:11:28.707158 IP 112.26.2.1.34615 > 112.26.2.8.46267: Flags [.], seq 61405:62833, ack 1, win 4017, options [nop,nop,TS val 3129161 ecr 2890576,mptcp dss ack 3193170700 seq 2059029359 subseq 61405 len 1428 csum 0x7c2c], length 1428
15:11:28.707255 IP 112.26.2.1.34615 > 112.26.2.8.46267: Flags [.], seq 62833:64261, ack 1, win 4017, options [nop,nop,TS val 3129161 ecr 2890677,mptcp dss ack 3193170700 seq 2059030787 subseq 62833 len 1428 csum 0x2f0e], length 1428
15:11:28.796410 IP 112.26.2.1.34615 > 112.26.2.8.46267: Flags [.], seq 59977:61405, ack 1, win 4017, options [nop,nop,TS val 3128912 ecr 2890389,mptcp dss ack 3193170700 seq 2059077911 subseq 59977 len 1428 csum 0x40d9], length 1428
15:11:28.896915 IP 112.26.2.8.46267 > 112.26.2.1.34615: Flags [.], ack 59977, win 18114, options [nop,nop,TS val 2890929 ecr 3128804,mptcp dss ack 2059003655], length 0
15:11:28.897269 IP 112.26.2.1.34615 > 112.26.2.8.46267: Flags [.], seq 64261:65689, ack 1, win 4017, options [nop,nop,TS val 3129351 ecr 2890929,mptcp dss ack 3193170700 seq 2059046495 subseq 64261 len 1428 csum 0xfddd], length 1428
15:11:28.897345 IP 112.26.2.1.34615 > 112.26.2.8.46267: Flags [.], seq 65689:67117, ack 1, win 4017, options [nop,nop,TS val 3129351 ecr 2890929,mptcp dss ack 3193170700 seq 2059055063 subseq 65689 len 1428 csum 0x86cd], length 1428
15:11:29.014224 IP 112.26.2.1.34615 > 112.26.2.8.46267: Flags [.], seq 61405:62833, ack 1, win 4017, options [nop,nop,TS val 3129161 ecr 2890576,mptcp dss ack 3193170700 seq 2059029359 subseq 61405 len 1428 csum 0x7c2c], length 1428
15:11:29.140354 IP 112.26.2.1.34615 > 112.26.2.8.46267: Flags [.], seq 62833:64261, ack 1, win 4017, options [nop,nop,TS val 3129161 ecr 2890677,mptcp dss ack 3193170700 seq 2059030787 subseq 62833 len 1428 csum 0x2f0e], length 1428
15:11:29.263274 IP 112.26.2.8.46267 > 112.26.2.1.34615: Flags [.], ack 61405, win 18433, options [nop,nop,TS val 2891189 ecr 3128912,mptcp dss ack 2059003655], length 0
15:11:29.263859 IP 112.26.2.1.34615 > 112.26.2.8.46267: Flags [.], seq 67117:68545, ack 1, win 4017, options [nop,nop,TS val 3129718 ecr 2891189,mptcp dss ack 3193170700 seq 2059063631 subseq 67117 len 1428 csum 0x4366], length 1428
15:11:29.340235 IP 112.26.2.1.34615 > 112.26.2.8.46267: Flags [.], seq 64261:65689, ack 1, win 4017, options [nop,nop,TS val 3129351 ecr 2890929,mptcp dss ack 3193170700 seq 2059046495 subseq 64261 len 1428 csum 0xfddd], length 1428
15:11:29.452356 IP 112.26.2.1.34615 > 112.26.2.8.46267: Flags [.], seq 65689:67117, ack 1, win 4017, options [nop,nop,TS val 3129351 ecr 2890929,mptcp dss ack 3193170700 seq 2059055063 subseq 65689 len 1428 csum 0x86cd], length 1428
15:11:29.547352 IP 112.26.2.8.46267 > 112.26.2.1.34615: Flags [.], ack 62833, win 18570, options [nop,nop,TS val 2891403 ecr 3129161,mptcp dss ack 2059003655], length 0
15:11:29.547743 IP 112.26.2.1.34615 > 112.26.2.8.46267: Flags [.], seq 68545:69973, ack 1, win 4017, options [nop,nop,TS val 3130002 ecr 2891403,mptcp dss ack 3193170700 seq 2059086479 subseq 68545 len 1428 csum 0xec6f], length 1428
15:11:29.659030 IP 112.26.2.1.34615 > 112.26.2.8.46267: Flags [.], seq 67117:68545, ack 1, win 4017, options [nop,nop,TS val 3129718 ecr 2891189,mptcp dss ack 3193170700 seq 2059063631 subseq 67117 len 1428 csum 0x4366], length 1428
15:11:29.747351 IP 112.26.2.8.46267 > 112.26.2.1.34615: Flags [.], ack 64261, win 18798, options [nop,nop,TS val 2891590 ecr 3129161,mptcp dss ack 2059003655], length 0
15:11:29.747854 IP 112.26.2.1.34615 > 112.26.2.8.46267: Flags [.], seq 69973:71401, ack 1, win 4017, options [nop,nop,TS val 3130201 ecr 2891590,mptcp dss ack 3193170700 seq 2059090763 subseq 69973 len 1428 csum 0xbed2], length 1428
15:11:29.842686 IP 112.26.2.8.46267 > 112.26.2.1.34615: Flags [.], ack 65689, win 18980, options [nop,nop,TS val 2891730 ecr 3129351,mptcp dss ack 2059003655], length 0
15:11:29.843001 IP 112.26.2.1.34615 > 112.26.2.8.46267: Flags [.], seq 71401:72829, ack 1, win 4017, options [nop,nop,TS val 3130297 ecr 2891730,mptcp dss ack 3193170700 seq 2059096475 subseq 71401 len 1428 csum 0x7b41], length 1428
15:11:29.967385 IP 112.26.2.1.34615 > 112.26.2.8.46267: Flags [.], seq 68545:69973, ack 1, win 4017, options [nop,nop,TS val 3130002 ecr 2891403,mptcp dss ack 3193170700 seq 2059086479 subseq 68545 len 1428 csum 0xec6f], length 1428
15:11:30.062927 IP 112.26.2.8.46267 > 112.26.2.1.34615: Flags [.], ack 67117, win 19254, options [nop,nop,TS val 2891947 ecr 3129351,mptcp dss ack 2059003655], length 0
15:11:30.063269 IP 112.26.2.1.34615 > 112.26.2.8.46267: Flags [.], seq 72829:74257, ack 1, win 4017, options [nop,nop,TS val 3130517 ecr 2891947,mptcp dss ack 3193170700 seq 2059100759 subseq 72829 len 1428 csum 0x3843], length 1428
15:11:30.063347 IP 112.26.2.1.34615 > 112.26.2.8.46267: Flags [.], seq 74257:75685, ack 1, win 4017, options [nop,nop,TS val 3130517 ecr 2891947,mptcp dss ack 3193170700 seq 2059102187 subseq 74257 len 1428 csum 0x6411], length 1428
15:11:30.204159 IP 112.26.2.1.34615 > 112.26.2.8.46267: Flags [.], seq 69973:71401, ack 1, win 4017, options [nop,nop,TS val 3130201 ecr 2891590,mptcp dss ack 3193170700 seq 2059090763 subseq 69973 len 1428 csum 0xbed2], length 1428
15:11:30.317690 IP 112.26.2.8.46267 > 112.26.2.1.34615: Flags [.], ack 68545, win 19437, options [nop,nop,TS val 2892115 ecr 3129718,mptcp dss ack 2059003655], length 0
15:11:30.318117 IP 112.26.2.1.34615 > 112.26.2.8.46267: Flags [.], seq 75685:77113, ack 1, win 4017, options [nop,nop,TS val 3130772 ecr 2892115,mptcp dss ack 3193170700 seq 2059110755 subseq 75685 len 1428 csum 0xf7c8], length 1428
15:11:30.461942 IP 112.26.2.1.34615 > 112.26.2.8.46267: Flags [.], seq 72829:74257, ack 1, win 4017, options [nop,nop,TS val 3130517 ecr 2891947,mptcp dss ack 3193170700 seq 2059100759 subseq 72829 len 1428 csum 0x3843], length 1428
15:11:30.583053 IP 112.26.2.8.46267 > 112.26.2.1.34615: Flags [.], ack 69973, win 19710, options [nop,nop,TS val 2892359 ecr 3130002,mptcp dss ack 2059003655], length 0
15:11:30.583398 IP 112.26.2.1.34615 > 112.26.2.8.46267: Flags [.], seq 77113:78541, ack 1, win 4017, options [nop,nop,TS val 3131038 ecr 2892359,mptcp dss ack 3193170700 seq 2059126463 subseq 77113 len 1428 csum 0xff80], length 1428
15:11:30.664980 IP 112.26.2.1.34615 > 112.26.2.8.46267: Flags [.], seq 74257:75685, ack 1, win 4017, options [nop,nop,TS val 3130517 ecr 2891947,mptcp dss ack 3193170700 seq 2059102187 subseq 74257 len 1428 csum 0x6411], length 1428
15:11:30.768635 IP 112.26.2.1.34615 > 112.26.2.8.46267: Flags [.], seq 75685:77113, ack 1, win 4017, options [nop,nop,TS val 3130772 ecr 2892115,mptcp dss ack 3193170700 seq 2059110755 subseq 75685 len 1428 csum 0xf7c8], length 1428
15:11:30.854483 IP 112.26.2.8.46267 > 112.26.2.1.34615: Flags [.], ack 71401, win 19939, options [nop,nop,TS val 2892596 ecr 3130201,mptcp dss ack 2059070771], length 0
15:11:30.854964 IP 112.26.2.1.34615 > 112.26.2.8.46267: Flags [.], seq 78541:79969, ack 1, win 4017, options [nop,nop,TS val 3131309 ecr 2892596,mptcp dss ack 3193170700 seq 2059136459 subseq 78541 len 1428 csum 0xd68b], length 1428
15:11:30.987824 IP 112.26.2.8.46267 > 112.26.2.1.34615: Flags [.], ack 71401, win 20304, options [nop,nop,TS val 2892855 ecr 3130201,nop,nop,sack 1 {72829:74257},mptcp dss ack 2059083623], length 0
15:11:31.031950 IP 112.26.2.1.34615 > 112.26.2.8.46267: Flags [.], seq 77113:78541, ack 1, win 4017, options [nop,nop,TS val 3131038 ecr 2892359,mptcp dss ack 3193170700 seq 2059126463 subseq 77113 len 1428 csum 0xff80], length 1428
15:11:31.045411 IP 112.26.2.1.34615 > 112.26.2.8.46267: Flags [.], seq 79969:81397, ack 1, win 4017, options [nop,nop,TS val 3131499 ecr 2892855,mptcp dss ack 3193170700 seq 2059143599 subseq 79969 len 1428 csum 0x6729], length 1428
