17:21:40.270033 IP 112.26.0.1.targus-getdata1 > 112.26.0.8.55610: Flags [S.], seq 2442340864, ack 2827260081, win 65535, options [mss 1460,sackOK,TS val 102975 ecr 4294845470,nop,wscale 6,mptcp capable csum {0x723fcdbd34ba0730}], length 0
17:21:40.286100 IP 112.26.0.1.targus-getdata1 > 112.26.0.8.55610: Flags [S.], seq 2442340864, ack 2827260081, win 65535, options [mss 1460,sackOK,TS val 102975 ecr 4294845470,nop,wscale 6,mptcp capable csum {0x723fcdbd34ba0730}], length 0
17:21:40.356522 IP 112.26.0.1.targus-getdata1 > 112.26.0.8.55610: Flags [S.], seq 2442340864, ack 2827260081, win 65535, options [mss 1460,sackOK,TS val 102975 ecr 4294845470,nop,wscale 6,mptcp capable csum {0x723fcdbd34ba0730}], length 0
17:21:41.307316 IP 112.26.0.1.targus-getdata1 > 112.26.0.8.55610: Flags [S.], seq 2442340864, ack 2827260081, win 65535, options [mss 1460,sackOK,TS val 104000 ecr 4294845470,nop,wscale 6,mptcp capable csum {0x723fcdbd34ba0730}], length 0
17:21:41.307837 IP 112.26.0.1.targus-getdata1 > 112.26.0.8.55610: Flags [S.], seq 2442340864, ack 2827260081, win 65535, options [mss 1460,sackOK,TS val 104000 ecr 4294845470,nop,wscale 6,mptcp capable csum {0x723fcdbd34ba0730}], length 0
17:21:41.382431 IP 112.26.0.1.targus-getdata1 > 112.26.0.8.55610: Flags [S.], seq 2442340864, ack 2827260081, win 65535, options [mss 1460,sackOK,TS val 104000 ecr 4294845470,nop,wscale 6,mptcp capable csum {0x723fcdbd34ba0730}], length 0
17:21:41.469122 IP 112.26.0.8.55610 > 112.26.0.1.targus-getdata1: Flags [.], ack 1, win 1369, options [nop,nop,TS val 4294846723 ecr 102975,mptcp capable csum {0x622703ee8f7d13ee,0x723fcdbd34ba0730},mptcp dss ack 2790937176], length 0
17:22:06.671827 IP 112.26.0.1.targus-getdata1 > 112.26.0.8.55612: Flags [.], ack 1501987430, win 24260, options [nop,nop,TS val 129371 ecr 4294872240,mptcp dss ack 2397555940], length 0
17:22:06.699888 IP 112.26.0.1.targus-getdata1 > 112.26.0.8.55612: Flags [.], ack 1, win 24260, options [nop,nop,TS val 129371 ecr 4294872240,mptcp dss ack 2397555940], length 0
17:22:06.750404 IP 112.26.0.8.55612 > 112.26.0.1.targus-getdata1: Flags [.], seq 1:1429, ack 0, win 4107, options [nop,nop,TS val 4294872362 ecr 128168,mptcp dss ack 2097709625 seq 2397660184 subseq 179966 len 1428 csum 0xd7ac], length 1428
17:22:06.750732 IP 112.26.0.8.55612 > 112.26.0.1.targus-getdata1: Flags [.], seq 1:1429, ack 0, win 4107, options [nop,nop,TS val 4294872362 ecr 128168,mptcp dss ack 2097709625 seq 2397660184 subseq 179966 len 1428 csum 0xd7ac], length 1428
17:22:06.794974 IP 112.26.0.1.targus-getdata1 > 112.26.0.8.55612: Flags [.], ack 1429, win 24171, options [nop,nop,TS val 129501 ecr 4294872362,mptcp dss ack 2397561652], length 0
17:22:06.841853 IP 112.26.0.1.targus-getdata1 > 112.26.0.8.55612: Flags [.], ack 1429, win 24171, options [nop,nop,TS val 129501 ecr 4294872362,mptcp dss ack 2397561652], length 0
17:22:06.956975 IP 112.26.0.1.targus-getdata1 > 112.26.0.8.55612: Flags [.], ack 4294963013, win 24260, options [nop,nop,TS val 128874 ecr 4294871970,mptcp dss ack 2397555940], length 0
17:22:07.036081 IP 112.26.0.8.55612 > 112.26.0.1.targus-getdata1: Flags [.], seq 1429:2857, ack 0, win 4107, options [nop,nop,TS val 4294872603 ecr 128235,mptcp dss ack 2097709625 seq 2397664468 subseq 181394 len 1428 csum 0x85eb], length 1428
17:22:07.036403 IP 112.26.0.8.55612 > 112.26.0.1.targus-getdata1: Flags [.], seq 1429:2857, ack 0, win 4107, options [nop,nop,TS val 4294872603 ecr 128235,mptcp dss ack 2097709625 seq 2397664468 subseq 181394 len 1428 csum 0x85eb], length 1428
17:22:07.044781 IP 112.26.0.1.targus-getdata1 > 112.26.0.8.55612: Flags [.], ack 2857, win 24171, options [nop,nop,TS val 129754 ecr 4294872603,mptcp dss ack 2397561652], length 0
17:22:07.047166 IP 112.26.0.1.targus-getdata1 > 112.26.0.8.55612: Flags [.], ack 2857, win 24171, options [nop,nop,TS val 129754 ecr 4294872603,mptcp dss ack 2397561652], length 0
17:22:07.141915 IP 112.26.0.1.targus-getdata1 > 112.26.0.8.55612: Flags [.], ack 4294964441, win 24260, options [nop,nop,TS val 129057 ecr 4294872045,mptcp dss ack 2397555940], length 0
17:22:07.227764 IP 112.26.0.8.55612 > 112.26.0.1.targus-getdata1: Flags [.], seq 2857:4285, ack 0, win 4107, options [nop,nop,TS val 4294872792 ecr 128480,mptcp dss ack 2097709625 seq 2397670180 subseq 182822 len 1428 csum 0x9ae5], length 1428
17:22:07.228063 IP 112.26.0.8.55612 > 112.26.0.1.targus-getdata1: Flags [.], seq 2857:4285, ack 0, win 4107, options [nop,nop,TS val 4294872792 ecr 128480,mptcp dss ack 2097709625 seq 2397670180 subseq 182822 len 1428 csum 0x9ae5], length 1428
17:22:07.277527 IP 112.26.0.1.targus-getdata1 > 112.26.0.8.55612: Flags [.], ack 4285, win 24171, options [nop,nop,TS val 129942 ecr 4294872792,mptcp dss ack 2397561652], length 0
17:22:07.282379 IP 112.26.0.1.targus-getdata1 > 112.26.0.8.55612: Flags [.], ack 4285, win 24171, options [nop,nop,TS val 129942 ecr 4294872792,mptcp dss ack 2397561652], length 0
17:22:07.344001 IP 112.26.0.8.55612 > 112.26.0.1.targus-getdata1: Flags [.], seq 4285:5713, ack 0, win 4107, options [nop,nop,TS val 4294872792 ecr 128480,mptcp dss ack 2097709625 seq 2397671608 subseq 184250 len 1428 csum 0xe4d7], length 1428
17:22:07.344233 IP 112.26.0.8.55612 > 112.26.0.1.targus-getdata1: Flags [.], seq 4285:5713, ack 0, win 4107, options [nop,nop,TS val 4294872792 ecr 128480,mptcp dss ack 2097709625 seq 2397671608 subseq 184250 len 1428 csum 0xe4d7], length 1428
17:22:07.384985 IP 112.26.0.1.targus-getdata1 > 112.26.0.8.55612: Flags [.], ack 5713, win 24171, options [nop,nop,TS val 130089 ecr 4294872792,mptcp dss ack 2397561652], length 0
17:22:07.386346 IP 112.26.0.1.targus-getdata1 > 112.26.0.8.55612: Flags [.], ack 5713, win 24171, options [nop,nop,TS val 130089 ecr 4294872792,mptcp dss ack 2397561652], length 0
17:22:07.533386 IP 112.26.0.1.targus-getdata1 > 112.26.0.8.55612: Flags [.], ack 1, win 24260, options [nop,nop,TS val 129371 ecr 4294872240,mptcp dss ack 2397555940], length 0
17:22:07.601625 IP 112.26.0.1.targus-getdata1 > 112.26.0.8.55612: Flags [.], ack 1429, win 24171, options [nop,nop,TS val 129501 ecr 4294872362,mptcp dss ack 2397561652], length 0
17:22:07.659434 IP 112.26.0.8.55612 > 112.26.0.1.targus-getdata1: Flags [.], seq 5713:7141, ack 0, win 4107, options [nop,nop,TS val 4294873323 ecr 128874,mptcp dss ack 2097709625 seq 2397685888 subseq 185678 len 1428 csum 0x3542], length 1428
17:22:07.659645 IP 112.26.0.8.55612 > 112.26.0.1.targus-getdata1: Flags [.], seq 5713:7141, ack 0, win 4107, options [nop,nop,TS val 4294873323 ecr 128874,mptcp dss ack 2097709625 seq 2397685888 subseq 185678 len 1428 csum 0x3542], length 1428
17:22:07.665925 IP 112.26.0.1.targus-getdata1 > 112.26.0.8.55612: Flags [.], ack 7141, win 23705, options [nop,nop,TS val 130375 ecr 4294873323,mptcp dss ack 2397593068], length 0
17:22:07.683789 IP 112.26.0.1.targus-getdata1 > 112.26.0.8.55612: Flags [.], ack 7141, win 23705, options [nop,nop,TS val 130375 ecr 4294873323,mptcp dss ack 2397593068], length 0
17:22:07.775297 IP 112.26.0.1.targus-getdata1 > 112.26.0.8.55612: Flags [.], ack 2857, win 24171, options [nop,nop,TS val 129754 ecr 4294872603,mptcp dss ack 2397561652], length 0
17:22:07.899101 IP 112.26.0.8.55612 > 112.26.0.1.targus-getdata1: Flags [.], seq 7141:8569, ack 0, win 4107, options [nop,nop,TS val 4294873509 ecr 129057,mptcp dss ack 2097709625 seq 2397695884 subseq 187106 len 1428 csum 0x6fa5], length 1428
17:22:07.899323 IP 112.26.0.8.55612 > 112.26.0.1.targus-getdata1: Flags [.], seq 7141:8569, ack 0, win 4107, options [nop,nop,TS val 4294873509 ecr 129057,mptcp dss ack 2097709625 seq 2397695884 subseq 187106 len 1428 csum 0x6fa5], length 1428
17:22:07.944759 IP 112.26.0.1.targus-getdata1 > 112.26.0.8.55612: Flags [.], ack 8569, win 23705, options [nop,nop,TS val 130656 ecr 4294873509,mptcp dss ack 2397593068], length 0
17:22:07.948200 IP 112.26.0.1.targus-getdata1 > 112.26.0.8.55612: Flags [.], ack 8569, win 23705, options [nop,nop,TS val 130656 ecr 4294873509,mptcp dss ack 2397593068], length 0
17:22:08.047552 IP 112.26.0.1.targus-getdata1 > 112.26.0.8.55612: Flags [.], ack 4285, win 24171, options [nop,nop,TS val 129942 ecr 4294872792,mptcp dss ack 2397561652], length 0
17:22:08.132287 IP 112.26.0.1.targus-getdata1 > 112.26.0.8.55612: Flags [.], ack 5713, win 24171, options [nop,nop,TS val 130089 ecr 4294872792,mptcp dss ack 2397561652], length 0
17:22:08.174949 IP 112.26.0.8.55612 > 112.26.0.1.targus-getdata1: Flags [.], seq 8569:9997, ack 0, win 4107, options [nop,nop,TS val 4294873900 ecr 129371,mptcp dss ack 2097709625 seq 2397711592 subseq 188534 len 1428 csum 0xb8e1], length 1428
17:22:08.175164 IP 112.26.0.8.55612 > 112.26.0.1.targus-getdata1: Flags [.], seq 8569:9997, ack 0, win 4107, options [nop,nop,TS val 4294873900 ecr 129371,mptcp dss ack 2097709625 seq 2397711592 subseq 188534 len 1428 csum 0xb8e1], length 1428
17:22:08.186034 IP 112.26.0.1.targus-getdata1 > 112.26.0.8.55612: Flags [.], ack 9997, win 24504, options [nop,nop,TS val 130889 ecr 4294873900,mptcp dss ack 2397703024], length 0
17:22:08.196271 IP 112.26.0.1.targus-getdata1 > 112.26.0.8.55612: Flags [.], ack 9997, win 24504, options [nop,nop,TS val 130889 ecr 4294873900,mptcp dss ack 2397703024], length 0
17:22:08.340590 IP 112.26.0.8.55612 > 112.26.0.1.targus-getdata1: Flags [.], seq 9997:11425, ack 0, win 4107, options [nop,nop,TS val 4294873900 ecr 129371,mptcp dss ack 2097709625 seq 2397713020 subseq 189962 len 1428 csum 0xd33a], length 1428
17:22:08.340830 IP 112.26.0.8.55612 > 112.26.0.1.targus-getdata1: Flags [.], seq 9997:11425, ack 0, win 4107, options [nop,nop,TS val 4294873900 ecr 129371,mptcp dss ack 2097709625 seq 2397713020 subseq 189962 len 1428 csum 0xd33a], length 1428
17:22:08.388539 IP 112.26.0.1.targus-getdata1 > 112.26.0.8.55612: Flags [.], ack 11425, win 24540, options [nop,nop,TS val 131099 ecr 4294873900,mptcp dss ack 2397714448], length 0
17:22:08.403148 IP 112.26.0.1.targus-getdata1 > 112.26.0.8.55612: Flags [.], ack 11425, win 24540, options [nop,nop,TS val 131099 ecr 4294873900,mptcp dss ack 2397714448], length 0
17:22:08.525985 IP 112.26.0.1.targus-getdata1 > 112.26.0.8.55612: Flags [.], ack 7141, win 23705, options [nop,nop,TS val 130375 ecr 4294873323,mptcp dss ack 2397593068], length 0
17:22:08.619517 IP 112.26.0.8.55612 > 112.26.0.1.targus-getdata1: Flags [.], seq 12853:14281, ack 0, win 4107, options [nop,nop,TS val 4294874142 ecr 129754,mptcp dss ack 2097709625 seq 2397730156 subseq 192818 len 1428 csum 0x395d], length 1428
17:22:08.619752 IP 112.26.0.8.55612 > 112.26.0.1.targus-getdata1: Flags [.], seq 12853:14281, ack 0, win 4107, options [nop,nop,TS val 4294874142 ecr 129754,mptcp dss ack 2097709625 seq 2397730156 subseq 192818 len 1428 csum 0x395d], length 1428
17:22:08.629381 IP 112.26.0.1.targus-getdata1 > 112.26.0.8.55612: Flags [.], ack 11425, win 24522, options [nop,nop,TS val 131335 ecr 4294873900,nop,nop,sack 1 {12853:14281},mptcp dss ack 2397717304], length 0
17:22:08.630723 IP 112.26.0.1.targus-getdata1 > 112.26.0.8.55612: Flags [.], ack 11425, win 24522, options [nop,nop,TS val 131335 ecr 4294873900,nop,nop,sack 1 {12853:14281},mptcp dss ack 2397717304], length 0
17:22:08.698242 IP 112.26.0.1.targus-getdata1 > 112.26.0.8.55612: Flags [.], ack 8569, win 23705, options [nop,nop,TS val 130656 ecr 4294873509,mptcp dss ack 2397593068], length 0
17:22:08.786313 IP 112.26.0.8.55612 > 112.26.0.1.targus-getdata1: Flags [.], seq 14281:15709, ack 0, win 4107, options [nop,nop,TS val 4294874414 ecr 129942,mptcp dss ack 2097709625 seq 2397744436 subseq 194246 len 1428 csum 0x8a57], length 1428
17:22:08.786499 IP 112.26.0.8.55612 > 112.26.0.1.targus-getdata1: Flags [.], seq 14281:15709, ack 0, win 4107, options [nop,nop,TS val 4294874414 ecr 129942,mptcp dss ack 2097709625 seq 2397744436 subseq 194246 len 1428 csum 0x8a57], length 1428
17:22:08.802812 IP 112.26.0.1.targus-getdata1 > 112.26.0.8.55612: Flags [.], ack 11425, win 24522, options [nop,nop,TS val 131501 ecr 4294873900,nop,nop,sack 1 {12853:15709},mptcp dss ack 2397717304], length 0
17:22:08.804016 IP 112.26.0.1.targus-getdata1 > 112.26.0.8.55612: Flags [.], ack 11425, win 24522, options [nop,nop,TS val 131501 ecr 4294873900,nop,nop,sack 1 {12853:15709},mptcp dss ack 2397717304], length 0
17:22:08.903168 IP 112.26.0.8.55612 > 112.26.0.1.targus-getdata1: Flags [.], seq 15709:17137, ack 0, win 4107, options [nop,nop,TS val 4294874499 ecr 130089,mptcp dss ack 2097709625 seq 2397750148 subseq 195674 len 1428 csum 0xf320], length 1428
17:22:08.903389 IP 112.26.0.8.55612 > 112.26.0.1.targus-getdata1: Flags [.], seq 15709:17137, ack 0, win 4107, options [nop,nop,TS val 4294874499 ecr 130089,mptcp dss ack 2097709625 seq 2397750148 subseq 195674 len 1428 csum 0xf320], length 1428
17:22:08.990398 IP 112.26.0.1.targus-getdata1 > 112.26.0.8.55612: Flags [.], ack 11425, win 24522, options [nop,nop,TS val 131617 ecr 4294873900,nop,nop,sack 1 {12853:17137},mptcp dss ack 2397717304], length 0
17:22:08.992092 IP 112.26.0.1.targus-getdata1 > 112.26.0.8.55612: Flags [.], ack 11425, win 24522, options [nop,nop,TS val 131617 ecr 4294873900,nop,nop,sack 1 {12853:17137},mptcp dss ack 2397717304], length 0
17:22:09.013035 IP 112.26.0.1.targus-getdata1 > 112.26.0.8.55612: Flags [.], ack 9997, win 24504, options [nop,nop,TS val 130889 ecr 4294873900,mptcp dss ack 2397703024], length 0
17:22:09.129861 IP 112.26.0.1.targus-getdata1 > 112.26.0.8.55612: Flags [.], ack 11425, win 24540, options [nop,nop,TS val 131099 ecr 4294873900,mptcp dss ack 2397714448], length 0
17:22:09.198095 IP 112.26.0.8.55612 > 112.26.0.1.targus-getdata1: Flags [.], seq 18565:19993, ack 0, win 4107, options [nop,nop,TS val 4294874893 ecr 130375,mptcp dss ack 2097709625 seq 2397767284 subseq 198530 len 1428 csum 0xcdb7], length 1428
17:22:09.198310 IP 112.26.0.8.55612 > 112.26.0.1.targus-getdata1: Flags [.], seq 18565:19993, ack 0, win 4107, options [nop,nop,TS val 4294874893 ecr 130375,mptcp dss ack 2097709625 seq 2397767284 subseq 198530 len 1428 csum 0xcdb7], length 1428
17:22:09.214989 IP 112.26.0.1.targus-getdata1 > 112.26.0.8.55612: Flags [.], ack 11425, win 24522, options [nop,nop,TS val 131924 ecr 4294873900,nop,nop,sack 2 {18565:19993}{12853:17137},mptcp dss ack 2397717304], length 0
17:22:09.225819 IP 112.26.0.1.targus-getdata1 > 112.26.0.8.55612: Flags [.], ack 11425, win 24522, options [nop,nop,TS val 131924 ecr 4294873900,nop,nop,sack 2 {18565:19993}{12853:17137},mptcp dss ack 2397717304], length 0
17:22:09.287489 IP 112.26.0.1.targus-getdata1 > 112.26.0.8.55612: Flags [.], ack 11425, win 24522, options [nop,nop,TS val 131335 ecr 4294873900,nop,nop,sack 1 {12853:14281},mptcp dss ack 2397717304], length 0
17:22:09.369950 IP 112.26.0.8.55612 > 112.26.0.1.targus-getdata1: Flags [.], seq 19993:21421, ack 0, win 4107, options [nop,nop,TS val 4294875065 ecr 130656,mptcp dss ack 2097709625 seq 2397778708 subseq 199958 len 1428 csum 0xee69], length 1428
17:22:09.370222 IP 112.26.0.8.55612 > 112.26.0.1.targus-getdata1: Flags [.], seq 19993:21421, ack 0, win 4107, options [nop,nop,TS val 4294875065 ecr 130656,mptcp dss ack 2097709625 seq 2397778708 subseq 199958 len 1428 csum 0xee69], length 1428
17:22:09.375325 IP 112.26.0.1.targus-getdata1 > 112.26.0.8.55612: Flags [.], ack 11425, win 24522, options [nop,nop,TS val 132086 ecr 4294873900,nop,nop,sack 2 {18565:21421}{12853:17137},mptcp dss ack 2397717304], length 0
17:22:09.391699 IP 112.26.0.1.targus-getdata1 > 112.26.0.8.55612: Flags [.], ack 11425, win 24522, options [nop,nop,TS val 132086 ecr 4294873900,nop,nop,sack 2 {18565:21421}{12853:17137},mptcp dss ack 2397717304], length 0
17:22:09.480789 IP 112.26.0.1.targus-getdata1 > 112.26.0.8.55612: Flags [.], ack 11425, win 24522, options [nop,nop,TS val 131501 ecr 4294873900,nop,nop,sack 1 {12853:15709},mptcp dss ack 2397717304], length 0
17:22:09.503582 IP 112.26.0.8.55612 > 112.26.0.1.targus-getdata1: Flags [.], seq 21421:22849, ack 0, win 4107, options [nop,nop,TS val 4294875356 ecr 130889,mptcp dss ack 2097709625 seq 2397790132 subseq 201386 len 1428 csum 0xb410], length 1428
17:22:09.503724 IP 112.26.0.8.55612 > 112.26.0.1.targus-getdata1: Flags [.], seq 21421:22849, ack 0, win 4107, options [nop,nop,TS val 4294875356 ecr 130889,mptcp dss ack 2097709625 seq 2397790132 subseq 201386 len 1428 csum 0xb410], length 1428
17:22:09.506917 IP 112.26.0.1.targus-getdata1 > 112.26.0.8.55612: Flags [.], ack 11425, win 24522, options [nop,nop,TS val 132217 ecr 4294873900,nop,nop,sack 2 {18565:22849}{12853:17137},mptcp dss ack 2397717304], length 0
17:22:09.555485 IP 112.26.0.1.targus-getdata1 > 112.26.0.8.55612: Flags [.], ack 11425, win 24522, options [nop,nop,TS val 132217 ecr 4294873900,nop,nop,sack 2 {18565:22849}{12853:17137},mptcp dss ack 2397717304], length 0
17:22:09.613527 IP 112.26.0.1.targus-getdata1 > 112.26.0.8.55612: Flags [.], ack 11425, win 24522, options [nop,nop,TS val 131617 ecr 4294873900,nop,nop,sack 1 {12853:17137},mptcp dss ack 2397717304], length 0
17:22:09.689728 IP 112.26.0.8.55612 > 112.26.0.1.targus-getdata1: Flags [.], seq 22849:24277, ack 0, win 4107, options [nop,nop,TS val 4294875356 ecr 130889,mptcp dss ack 2097709625 seq 2397791560 subseq 202814 len 1428 csum 0xf835], length 1428
17:22:09.689937 IP 112.26.0.8.55612 > 112.26.0.1.targus-getdata1: Flags [.], seq 22849:24277, ack 0, win 4107, options [nop,nop,TS val 4294875356 ecr 130889,mptcp dss ack 2097709625 seq 2397791560 subseq 202814 len 1428 csum 0xf835], length 1428
17:22:09.705568 IP 112.26.0.1.targus-getdata1 > 112.26.0.8.55612: Flags [.], ack 11425, win 24522, options [nop,nop,TS val 132414 ecr 4294873900,nop,nop,sack 2 {18565:24277}{12853:17137},mptcp dss ack 2397717304], length 0
17:22:09.717080 IP 112.26.0.1.targus-getdata1 > 112.26.0.8.55612: Flags [.], ack 11425, win 24522, options [nop,nop,TS val 132414 ecr 4294873900,nop,nop,sack 2 {18565:24277}{12853:17137},mptcp dss ack 2397717304], length 0
17:22:09.789290 IP 112.26.0.8.55612 > 112.26.0.1.targus-getdata1: Flags [.], seq 24277:25705, ack 0, win 4107, options [nop,nop,TS val 4294875497 ecr 131099,mptcp dss ack 2097709625 seq 2397797272 subseq 204242 len 1428 csum 0x389c], length 1428
17:22:09.789507 IP 112.26.0.8.55612 > 112.26.0.1.targus-getdata1: Flags [.], seq 24277:25705, ack 0, win 4107, options [nop,nop,TS val 4294875497 ecr 131099,mptcp dss ack 2097709625 seq 2397797272 subseq 204242 len 1428 csum 0x389c], length 1428
17:22:09.842095 IP 112.26.0.1.targus-getdata1 > 112.26.0.8.55612: Flags [.], ack 11425, win 24522, options [nop,nop,TS val 132552 ecr 4294873900,nop,nop,sack 2 {18565:25705}{12853:17137},mptcp dss ack 2397717304], length 0
17:22:09.853223 IP 112.26.0.1.targus-getdata1 > 112.26.0.8.55612: Flags [.], ack 11425, win 24522, options [nop,nop,TS val 132552 ecr 4294873900,nop,nop,sack 2 {18565:25705}{12853:17137},mptcp dss ack 2397717304], length 0
17:22:09.862208 IP 112.26.0.1.targus-getdata1 > 112.26.0.8.55612: Flags [.], ack 11425, win 24522, options [nop,nop,TS val 131924 ecr 4294873900,nop,nop,sack 2 {18565:19993}{12853:17137},mptcp dss ack 2397717304], length 0
17:22:09.958863 IP 112.26.0.8.55612 > 112.26.0.1.targus-getdata1: Flags [.], seq 25705:27133, ack 0, win 4107, options [nop,nop,TS val 4294875497 ecr 131099,mptcp dss ack 2097709625 seq 2397798700 subseq 205670 len 1428 csum 0xa4f], length 1428
17:22:09.959098 IP 112.26.0.8.55612 > 112.26.0.1.targus-getdata1: Flags [.], seq 25705:27133, ack 0, win 4107, options [nop,nop,TS val 4294875497 ecr 131099,mptcp dss ack 2097709625 seq 2397798700 subseq 205670 len 1428 csum 0xa4f], length 1428
17:22:09.965816 IP 112.26.0.1.targus-getdata1 > 112.26.0.8.55612: Flags [.], ack 11425, win 24522, options [nop,nop,TS val 132676 ecr 4294873900,nop,nop,sack 2 {18565:27133}{12853:17137},mptcp dss ack 2397717304], length 0
17:22:09.967645 IP 112.26.0.1.targus-getdata1 > 112.26.0.8.55612: Flags [.], ack 11425, win 24522, options [nop,nop,TS val 132676 ecr 4294873900,nop,nop,sack 2 {18565:27133}{12853:17137},mptcp dss ack 2397717304], length 0
17:22:10.067216 IP 112.26.0.8.55612 > 112.26.0.1.targus-getdata1: Flags [.], seq 27133:28561, ack 0, win 4107, options [nop,nop,TS val 4294875670 ecr 131335,mptcp dss ack 2097709625 seq 2397807268 subseq 207098 len 1428 csum 0x8c34], length 1428
17:22:10.067434 IP 112.26.0.8.55612 > 112.26.0.1.targus-getdata1: Flags [.], seq 27133:28561, ack 0, win 4107, options [nop,nop,TS val 4294875670 ecr 131335,mptcp dss ack 2097709625 seq 2397807268 subseq 207098 len 1428 csum 0x8c34], length 1428
17:22:10.081404 IP 112.26.0.1.targus-getdata1 > 112.26.0.8.55612: Flags [.], ack 11425, win 24522, options [nop,nop,TS val 132784 ecr 4294873900,nop,nop,sack 2 {18565:28561}{12853:17137},mptcp dss ack 2397717304], length 0
17:22:10.088652 IP 112.26.0.1.targus-getdata1 > 112.26.0.8.55612: Flags [.], ack 11425, win 24522, options [nop,nop,TS val 132784 ecr 4294873900,nop,nop,sack 2 {18565:28561}{12853:17137},mptcp dss ack 2397717304], length 0
17:22:10.153220 IP 112.26.0.1.targus-getdata1 > 112.26.0.8.55612: Flags [.], ack 11425, win 24522, options [nop,nop,TS val 132086 ecr 4294873900,nop,nop,sack 2 {18565:21421}{12853:17137},mptcp dss ack 2397717304], length 0
17:22:10.260836 IP 112.26.0.1.targus-getdata1 > 112.26.0.8.55612: Flags [.], ack 11425, win 24522, options [nop,nop,TS val 132217 ecr 4294873900,nop,nop,sack 2 {18565:22849}{12853:17137},mptcp dss ack 2397717304], length 0
17:22:10.312487 IP 112.26.0.8.55612 > 112.26.0.1.targus-getdata1: Flags [.], seq 28561:29989, ack 0, win 4107, options [nop,nop,TS val 4294875915 ecr 131501,mptcp dss ack 2097709625 seq 2397818692 subseq 208526 len 1428 csum 0xf2bd], length 1428
17:22:10.312739 IP 112.26.0.8.55612 > 112.26.0.1.targus-getdata1: Flags [.], seq 28561:29989, ack 0, win 4107, options [nop,nop,TS val 4294875915 ecr 131501,mptcp dss ack 2097709625 seq 2397818692 subseq 208526 len 1428 csum 0xf2bd], length 1428
17:22:10.317624 IP 112.26.0.1.targus-getdata1 > 112.26.0.8.55612: Flags [.], ack 11425, win 24522, options [nop,nop,TS val 133028 ecr 4294873900,nop,nop,sack 2 {18565:29989}{12853:17137},mptcp dss ack 2397717304], length 0
17:22:10.319518 IP 112.26.0.1.targus-getdata1 > 112.26.0.8.55612: Flags [.], ack 11425, win 24522, options [nop,nop,TS val 133028 ecr 4294873900,nop,nop,sack 2 {18565:29989}{12853:17137},mptcp dss ack 2397717304], length 0
17:22:10.427860 IP 112.26.0.8.55612 > 112.26.0.1.targus-getdata1: Flags [.], seq 11425:12853, ack 0, win 4107, options [nop,nop,TS val 4294875980 ecr 131617,mptcp dss ack 2097709625 seq 2397717304 subseq 191390 len 1428 csum 0xa027], length 1428
17:22:10.428168 IP 112.26.0.8.55612 > 112.26.0.1.targus-getdata1: Flags [.], seq 11425:12853, ack 0, win 4107, options [nop,nop,TS val 4294875980 ecr 131617,mptcp dss ack 2097709625 seq 2397717304 subseq 191390 len 1428 csum 0xa027], length 1428
17:22:10.446066 IP 112.26.0.1.targus-getdata1 > 112.26.0.8.55612: Flags [.], ack 17137, win 24054, options [nop,nop,TS val 133144 ecr 4294875980,nop,nop,sack 1 {18565:29989},mptcp dss ack 2397747292], length 0
17:22:10.447840 IP 112.26.0.1.targus-getdata1 > 112.26.0.8.55612: Flags [.], ack 17137, win 24054, options [nop,nop,TS val 133144 ecr 4294875980,nop,nop,sack 1 {18565:29989},mptcp dss ack 2397747292], length 0
17:22:10.506939 IP 112.26.0.1.targus-getdata1 > 112.26.0.8.55612: Flags [.], ack 11425, win 24522, options [nop,nop,TS val 132414 ecr 4294873900,nop,nop,sack 2 {18565:24277}{12853:17137},mptcp dss ack 2397717304], length 0
17:22:10.560058 IP 112.26.0.1.targus-getdata1 > 112.26.0.8.55612: Flags [.], ack 11425, win 24522, options [nop,nop,TS val 132552 ecr 4294873900,nop,nop,sack 2 {18565:25705}{12853:17137},mptcp dss ack 2397717304], length 0
17:22:10.621006 IP 112.26.0.8.55612 > 112.26.0.1.targus-getdata1: Flags [.], seq 17137:18565, ack 0, win 4107, options [nop,nop,TS val 4294876221 ecr 131924,mptcp dss ack 2097709625 seq 2397751576 subseq 197102 len 1428 csum 0x34dd], length 1428
17:22:10.621202 IP 112.26.0.8.55612 > 112.26.0.1.targus-getdata1: Flags [.], seq 17137:18565, ack 0, win 4107, options [nop,nop,TS val 4294876221 ecr 131924,mptcp dss ack 2097709625 seq 2397751576 subseq 197102 len 1428 csum 0x34dd], length 1428
17:22:10.634211 IP 112.26.0.1.targus-getdata1 > 112.26.0.8.55612: Flags [.], ack 29989, win 24077, options [nop,nop,TS val 133336 ecr 4294876221,mptcp dss ack 2397747292], length 0
17:22:10.635765 IP 112.26.0.1.targus-getdata1 > 112.26.0.8.55612: Flags [.], ack 29989, win 24077, options [nop,nop,TS val 133336 ecr 4294876221,mptcp dss ack 2397747292], length 0
17:22:10.740000 IP 112.26.0.1.targus-getdata1 > 112.26.0.8.55612: Flags [.], ack 11425, win 24522, options [nop,nop,TS val 132676 ecr 4294873900,nop,nop,sack 2 {18565:27133}{12853:17137},mptcp dss ack 2397717304], length 0
17:22:10.815196 IP 112.26.0.1.targus-getdata1 > 112.26.0.8.55612: Flags [.], ack 11425, win 24522, options [nop,nop,TS val 132784 ecr 4294873900,nop,nop,sack 2 {18565:28561}{12853:17137},mptcp dss ack 2397717304], length 0
17:22:10.891888 IP 112.26.0.1.targus-getdata1 > 112.26.0.8.55612: Flags [.], ack 11425, win 24522, options [nop,nop,TS val 133028 ecr 4294873900,nop,nop,sack 2 {18565:29989}{12853:17137},mptcp dss ack 2397717304], length 0
17:22:10.949241 IP 112.26.0.1.targus-getdata1 > 112.26.0.8.55612: Flags [.], ack 17137, win 24054, options [nop,nop,TS val 133144 ecr 4294875980,nop,nop,sack 1 {18565:29989},mptcp dss ack 2397747292], length 0
17:22:11.013847 IP 112.26.0.8.55612 > 112.26.0.1.targus-getdata1: Flags [.], seq 29989:31417, ack 0, win 4107, options [nop,nop,TS val 4294876927 ecr 132414,mptcp dss ack 2097709625 seq 2397860104 subseq 209954 len 1428 csum 0x8eb7], length 1428
17:22:11.014130 IP 112.26.0.8.55612 > 112.26.0.1.targus-getdata1: Flags [.], seq 29989:31417, ack 0, win 4107, options [nop,nop,TS val 4294876927 ecr 132414,mptcp dss ack 2097709625 seq 2397860104 subseq 209954 len 1428 csum 0x8eb7], length 1428
17:22:11.018491 IP 112.26.0.1.targus-getdata1 > 112.26.0.8.55612: Flags [.], ack 31417, win 24077, options [nop,nop,TS val 133729 ecr 4294876927,mptcp dss ack 2397747292], length 0
17:22:11.081640 IP 112.26.0.1.targus-getdata1 > 112.26.0.8.55612: Flags [.], ack 31417, win 24077, options [nop,nop,TS val 133729 ecr 4294876927,mptcp dss ack 2397747292], length 0
17:22:11.133742 IP 112.26.0.1.targus-getdata1 > 112.26.0.8.55612: Flags [.], ack 29989, win 24077, options [nop,nop,TS val 133336 ecr 4294876221,mptcp dss ack 2397747292], length 0
17:22:11.258564 IP 112.26.0.8.55612 > 112.26.0.1.targus-getdata1: Flags [.], seq 31417:32845, ack 0, win 4107, options [nop,nop,TS val 4294876943 ecr 132552,mptcp dss ack 2097709625 seq 2397861532 subseq 211382 len 1428 csum 0x93fb], length 1428
17:22:11.258815 IP 112.26.0.8.55612 > 112.26.0.1.targus-getdata1: Flags [.], seq 31417:32845, ack 0, win 4107, options [nop,nop,TS val 4294876943 ecr 132552,mptcp dss ack 2097709625 seq 2397861532 subseq 211382 len 1428 csum 0x93fb], length 1428
17:22:11.316092 IP 112.26.0.1.targus-getdata1 > 112.26.0.8.55612: Flags [.], ack 32845, win 24040, options [nop,nop,TS val 134021 ecr 4294876943,mptcp dss ack 2397780136], length 0
17:22:11.336799 IP 112.26.0.1.targus-getdata1 > 112.26.0.8.55612: Flags [.], ack 32845, win 24040, options [nop,nop,TS val 134021 ecr 4294876943,mptcp dss ack 2397780136], length 0
17:22:11.354534 IP 112.26.0.8.55612 > 112.26.0.1.targus-getdata1: Flags [.], seq 32845:34273, ack 0, win 4107, options [nop,nop,TS val 4294877134 ecr 132676,mptcp dss ack 2097709625 seq 2397874384 subseq 212810 len 1428 csum 0x27b6], length 1428
17:22:11.354768 IP 112.26.0.8.55612 > 112.26.0.1.targus-getdata1: Flags [.], seq 32845:34273, ack 0, win 4107, options [nop,nop,TS val 4294877134 ecr 132676,mptcp dss ack 2097709625 seq 2397874384 subseq 212810 len 1428 csum 0x27b6], length 1428
17:22:11.441021 IP 112.26.0.1.targus-getdata1 > 112.26.0.8.55612: Flags [.], ack 34273, win 24040, options [nop,nop,TS val 134130 ecr 4294877134,mptcp dss ack 2397780136], length 0
17:22:11.457924 IP 112.26.0.8.55612 > 112.26.0.1.targus-getdata1: Flags [.], seq 34273:35701, ack 0, win 4107, options [nop,nop,TS val 4294877190 ecr 132784,mptcp dss ack 2097709625 seq 2397877240 subseq 214238 len 1428 csum 0x71a1], length 1428
17:22:11.458151 IP 112.26.0.8.55612 > 112.26.0.1.targus-getdata1: Flags [.], seq 34273:35701, ack 0, win 4107, options [nop,nop,TS val 4294877190 ecr 132784,mptcp dss ack 2097709625 seq 2397877240 subseq 214238 len 1428 csum 0x71a1], length 1428
17:22:11.476899 IP 112.26.0.1.targus-getdata1 > 112.26.0.8.55612: Flags [.], ack 34273, win 24040, options [nop,nop,TS val 134130 ecr 4294877134,mptcp dss ack 2397780136], length 0
17:22:11.575132 IP 112.26.0.8.55612 > 112.26.0.1.targus-getdata1: Flags [.], seq 35701:37129, ack 0, win 4107, options [nop,nop,TS val 4294877316 ecr 133028,mptcp dss ack 2097709625 seq 2397887236 subseq 215666 len 1428 csum 0x3b27], length 1428
17:22:11.575318 IP 112.26.0.8.55612 > 112.26.0.1.targus-getdata1: Flags [.], seq 35701:37129, ack 0, win 4107, options [nop,nop,TS val 4294877316 ecr 133028,mptcp dss ack 2097709625 seq 2397887236 subseq 215666 len 1428 csum 0x3b27], length 1428
17:22:11.637850 IP 112.26.0.1.targus-getdata1 > 112.26.0.8.55612: Flags [.], ack 35701, win 24040, options [nop,nop,TS val 134243 ecr 4294877190,mptcp dss ack 2397780136], length 0
17:22:11.642553 IP 112.26.0.1.targus-getdata1 > 112.26.0.8.55612: Flags [.], ack 35701, win 24040, options [nop,nop,TS val 134243 ecr 4294877190,mptcp dss ack 2397780136], length 0
17:22:11.652072 IP 112.26.0.8.55612 > 112.26.0.1.targus-getdata1: Flags [.], seq 37129:38557, ack 0, win 4107, options [nop,nop,TS val 4294877316 ecr 133144,mptcp dss ack 2097709625 seq 2397888664 subseq 217094 len 1428 csum 0x1a9d], length 1428
17:22:11.652260 IP 112.26.0.8.55612 > 112.26.0.1.targus-getdata1: Flags [.], seq 37129:38557, ack 0, win 4107, options [nop,nop,TS val 4294877316 ecr 133144,mptcp dss ack 2097709625 seq 2397888664 subseq 217094 len 1428 csum 0x1a9d], length 1428
17:22:11.688130 IP 112.26.0.1.targus-getdata1 > 112.26.0.8.55612: Flags [.], ack 37129, win 24018, options [nop,nop,TS val 134327 ecr 4294877316,mptcp dss ack 2397781564], length 0
17:22:11.698511 IP 112.26.0.1.targus-getdata1 > 112.26.0.8.55612: Flags [.], ack 31417, win 24077, options [nop,nop,TS val 133729 ecr 4294876927,mptcp dss ack 2397747292], length 0
17:22:11.763474 IP 112.26.0.1.targus-getdata1 > 112.26.0.8.55612: Flags [.], ack 38557, win 24018, options [nop,nop,TS val 134464 ecr 4294877316,mptcp dss ack 2397781564], length 0
17:22:11.796317 IP 112.26.0.1.targus-getdata1 > 112.26.0.8.55612: Flags [.], ack 37129, win 24018, options [nop,nop,TS val 134327 ecr 4294877316,mptcp dss ack 2397781564], length 0
17:22:11.839491 IP 112.26.0.8.55612 > 112.26.0.1.targus-getdata1: Flags [.], seq 38557:39985, ack 0, win 4107, options [nop,nop,TS val 4294877500 ecr 133336,mptcp dss ack 2097709625 seq 2397897232 subseq 218522 len 1428 csum 0x6387], length 1428
17:22:11.839663 IP 112.26.0.8.55612 > 112.26.0.1.targus-getdata1: Flags [.], seq 38557:39985, ack 0, win 4107, options [nop,nop,TS val 4294877500 ecr 133336,mptcp dss ack 2097709625 seq 2397897232 subseq 218522 len 1428 csum 0x6387], length 1428
17:22:11.908928 IP 112.26.0.1.targus-getdata1 > 112.26.0.8.55612: Flags [.], ack 38557, win 24018, options [nop,nop,TS val 134464 ecr 4294877316,mptcp dss ack 2397781564], length 0
17:22:11.936067 IP 112.26.0.1.targus-getdata1 > 112.26.0.8.55612: Flags [.], ack 39985, win 24018, options [nop,nop,TS val 134568 ecr 4294877500,mptcp dss ack 2397781564], length 0
17:22:11.956352 IP 112.26.0.1.targus-getdata1 > 112.26.0.8.55612: Flags [.], ack 32845, win 24040, options [nop,nop,TS val 134021 ecr 4294876943,mptcp dss ack 2397780136], length 0
17:22:11.988217 IP 112.26.0.1.targus-getdata1 > 112.26.0.8.55612: Flags [.], ack 39985, win 24018, options [nop,nop,TS val 134568 ecr 4294877500,mptcp dss ack 2397781564], length 0
17:22:12.036278 IP 112.26.0.1.targus-getdata1 > 112.26.0.8.55612: Flags [.], ack 34273, win 24040, options [nop,nop,TS val 134130 ecr 4294877134,mptcp dss ack 2397780136], length 0
17:22:12.130649 IP 112.26.0.1.targus-getdata1 > 112.26.0.8.55612: Flags [.], ack 35701, win 24040, options [nop,nop,TS val 134243 ecr 4294877190,mptcp dss ack 2397780136], length 0
17:22:12.214407 IP 112.26.0.8.55612 > 112.26.0.1.targus-getdata1: Flags [.], seq 39985:41413, ack 0, win 4107, options [nop,nop,TS val 4294878065 ecr 133729,mptcp dss ack 2097709625 seq 2397911512 subseq 219950 len 1428 csum 0x1722], length 1428
17:22:12.214647 IP 112.26.0.8.55612 > 112.26.0.1.targus-getdata1: Flags [.], seq 39985:41413, ack 0, win 4107, options [nop,nop,TS val 4294878065 ecr 133729,mptcp dss ack 2097709625 seq 2397911512 subseq 219950 len 1428 csum 0x1722], length 1428
17:22:12.226166 IP 112.26.0.1.targus-getdata1 > 112.26.0.8.55612: Flags [.], ack 41413, win 24018, options [nop,nop,TS val 134930 ecr 4294878065,mptcp dss ack 2397781564], length 0
17:22:12.227521 IP 112.26.0.1.targus-getdata1 > 112.26.0.8.55612: Flags [.], ack 41413, win 24018, options [nop,nop,TS val 134930 ecr 4294878065,mptcp dss ack 2397781564], length 0
17:22:12.321706 IP 112.26.0.8.55612 > 112.26.0.1.targus-getdata1: Flags [.], seq 41413:42841, ack 0, win 4107, options [nop,nop,TS val 4294878065 ecr 133729,mptcp dss ack 2097709625 seq 2397912940 subseq 221378 len 1428 csum 0xb0f6], length 1428
17:22:12.321917 IP 112.26.0.8.55612 > 112.26.0.1.targus-getdata1: Flags [.], seq 41413:42841, ack 0, win 4107, options [nop,nop,TS val 4294878065 ecr 133729,mptcp dss ack 2097709625 seq 2397912940 subseq 221378 len 1428 csum 0xb0f6], length 1428
17:22:12.327236 IP 112.26.0.1.targus-getdata1 > 112.26.0.8.55612: Flags [.], ack 42841, win 24018, options [nop,nop,TS val 135038 ecr 4294878065,mptcp dss ack 2397781564], length 0
17:22:12.370363 IP 112.26.0.1.targus-getdata1 > 112.26.0.8.55612: Flags [.], ack 42841, win 24018, options [nop,nop,TS val 135038 ecr 4294878065,mptcp dss ack 2397781564], length 0
17:22:12.420152 IP 112.26.0.1.targus-getdata1 > 112.26.0.8.55612: Flags [.], ack 37129, win 24018, options [nop,nop,TS val 134327 ecr 4294877316,mptcp dss ack 2397781564], length 0
17:22:12.499224 IP 112.26.0.1.targus-getdata1 > 112.26.0.8.55612: Flags [.], ack 38557, win 24018, options [nop,nop,TS val 134464 ecr 4294877316,mptcp dss ack 2397781564], length 0
17:22:12.592355 IP 112.26.0.8.55612 > 112.26.0.1.targus-getdata1: Flags [.], seq 42841:44269, ack 0, win 4107, options [nop,nop,TS val 4294878323 ecr 134021,mptcp dss ack 2097709625 seq 2397921508 subseq 222806 len 1428 csum 0xc9d3], length 1428
17:22:12.592549 IP 112.26.0.8.55612 > 112.26.0.1.targus-getdata1: Flags [.], seq 42841:44269, ack 0, win 4107, options [nop,nop,TS val 4294878323 ecr 134021,mptcp dss ack 2097709625 seq 2397921508 subseq 222806 len 1428 csum 0xc9d3], length 1428
17:22:12.602751 IP 112.26.0.1.targus-getdata1 > 112.26.0.8.55612: Flags [.], ack 44269, win 24018, options [nop,nop,TS val 135308 ecr 4294878323,mptcp dss ack 2397781564], length 0
17:22:12.612973 IP 112.26.0.1.targus-getdata1 > 112.26.0.8.55612: Flags [.], ack 44269, win 24018, options [nop,nop,TS val 135308 ecr 4294878323,mptcp dss ack 2397781564], length 0
17:22:12.676930 IP 112.26.0.1.targus-getdata1 > 112.26.0.8.55612: Flags [.], ack 39985, win 24018, options [nop,nop,TS val 134568 ecr 4294877500,mptcp dss ack 2397781564], length 0
17:22:12.784232 IP 112.26.0.8.55612 > 112.26.0.1.targus-getdata1: Flags [.], seq 44269:45697, ack 0, win 4107, options [nop,nop,TS val 4294878403 ecr 134130,mptcp dss ack 2097709625 seq 2397924364 subseq 224234 len 1428 csum 0x251d], length 1428
17:22:12.784429 IP 112.26.0.8.55612 > 112.26.0.1.targus-getdata1: Flags [.], seq 44269:45697, ack 0, win 4107, options [nop,nop,TS val 4294878403 ecr 134130,mptcp dss ack 2097709625 seq 2397924364 subseq 224234 len 1428 csum 0x251d], length 1428
17:22:12.790723 IP 112.26.0.1.targus-getdata1 > 112.26.0.8.55612: Flags [.], ack 45697, win 24339, options [nop,nop,TS val 135500 ecr 4294878403,mptcp dss ack 2397885808], length 0
17:22:12.792729 IP 112.26.0.1.targus-getdata1 > 112.26.0.8.55612: Flags [.], ack 45697, win 24339, options [nop,nop,TS val 135500 ecr 4294878403,mptcp dss ack 2397885808], length 0
17:22:12.891578 IP 112.26.0.8.55612 > 112.26.0.1.targus-getdata1: Flags [.], seq 45697:47125, ack 0, win 4107, options [nop,nop,TS val 4294878403 ecr 134130,mptcp dss ack 2097709625 seq 2397925792 subseq 225662 len 1428 csum 0x9aba], length 1428
17:22:12.891770 IP 112.26.0.8.55612 > 112.26.0.1.targus-getdata1: Flags [.], seq 45697:47125, ack 0, win 4107, options [nop,nop,TS val 4294878403 ecr 134130,mptcp dss ack 2097709625 seq 2397925792 subseq 225662 len 1428 csum 0x9aba], length 1428
17:22:12.934146 IP 112.26.0.1.targus-getdata1 > 112.26.0.8.55612: Flags [.], ack 47125, win 24339, options [nop,nop,TS val 135644 ecr 4294878403,mptcp dss ack 2397885808], length 0
17:22:12.937374 IP 112.26.0.1.targus-getdata1 > 112.26.0.8.55612: Flags [.], ack 47125, win 24339, options [nop,nop,TS val 135644 ecr 4294878403,mptcp dss ack 2397885808], length 0
17:22:13.008235 IP 112.26.0.1.targus-getdata1 > 112.26.0.8.55612: Flags [.], ack 41413, win 24018, options [nop,nop,TS val 134930 ecr 4294878065,mptcp dss ack 2397781564], length 0
17:22:13.084378 IP 112.26.0.1.targus-getdata1 > 112.26.0.8.55612: Flags [.], ack 42841, win 24018, options [nop,nop,TS val 135038 ecr 4294878065,mptcp dss ack 2397781564], length 0
17:22:13.158645 IP 112.26.0.8.55612 > 112.26.0.1.targus-getdata1: Flags [.], seq 48553:49981, ack 0, win 4107, options [nop,nop,TS val 4294878787 ecr 134327,mptcp dss ack 2097709625 seq 2397945784 subseq 228518 len 1428 csum 0xef83], length 1428
17:22:13.158854 IP 112.26.0.8.55612 > 112.26.0.1.targus-getdata1: Flags [.], seq 48553:49981, ack 0, win 4107, options [nop,nop,TS val 4294878787 ecr 134327,mptcp dss ack 2097709625 seq 2397945784 subseq 228518 len 1428 csum 0xef83], length 1428
17:22:13.170284 IP 112.26.0.1.targus-getdata1 > 112.26.0.8.55612: Flags [.], ack 47125, win 24342, options [nop,nop,TS val 135877 ecr 4294878403,nop,nop,sack 1 {48553:49981},mptcp dss ack 2397902944], length 0
17:22:13.175458 IP 112.26.0.1.targus-getdata1 > 112.26.0.8.55612: Flags [.], ack 47125, win 24342, options [nop,nop,TS val 135877 ecr 4294878403,nop,nop,sack 1 {48553:49981},mptcp dss ack 2397902944], length 0
17:22:13.253468 IP 112.26.0.8.55612 > 112.26.0.1.targus-getdata1: Flags [.], seq 49981:51409, ack 0, win 4107, options [nop,nop,TS val 4294878866 ecr 134464,mptcp dss ack 2097709625 seq 2397950068 subseq 229946 len 1428 csum 0xe67f], length 1428
17:22:13.253704 IP 112.26.0.8.55612 > 112.26.0.1.targus-getdata1: Flags [.], seq 49981:51409, ack 0, win 4107, options [nop,nop,TS val 4294878866 ecr 134464,mptcp dss ack 2097709625 seq 2397950068 subseq 229946 len 1428 csum 0xe67f], length 1428
17:22:13.273841 IP 112.26.0.1.targus-getdata1 > 112.26.0.8.55612: Flags [.], ack 47125, win 24342, options [nop,nop,TS val 135983 ecr 4294878403,nop,nop,sack 1 {48553:51409},mptcp dss ack 2397902944], length 0
17:22:13.288974 IP 112.26.0.1.targus-getdata1 > 112.26.0.8.55612: Flags [.], ack 47125, win 24342, options [nop,nop,TS val 135983 ecr 4294878403,nop,nop,sack 1 {48553:51409},mptcp dss ack 2397902944], length 0
17:22:13.359721 IP 112.26.0.1.targus-getdata1 > 112.26.0.8.55612: Flags [.], ack 44269, win 24018, options [nop,nop,TS val 135308 ecr 4294878323,mptcp dss ack 2397781564], length 0
17:22:13.438827 IP 112.26.0.8.55612 > 112.26.0.1.targus-getdata1: Flags [.], seq 51409:52837, ack 0, win 4107, options [nop,nop,TS val 4294879043 ecr 134568,mptcp dss ack 2097709625 seq 2397957208 subseq 231374 len 1428 csum 0x2e6a], length 1428
17:22:13.439062 IP 112.26.0.8.55612 > 112.26.0.1.targus-getdata1: Flags [.], seq 51409:52837, ack 0, win 4107, options [nop,nop,TS val 4294879043 ecr 134568,mptcp dss ack 2097709625 seq 2397957208 subseq 231374 len 1428 csum 0x2e6a], length 1428
