17:21:39.255871 IP 112.26.0.8.55610 > 112.26.0.1.targus-getdata1: Flags [S], seq 2827260080, win 65535, options [mss 1460,sackOK,TS val 4294845470 ecr 0,nop,wscale 6,mptcp capable csum {0x622703ee8f7d13ee}], length 0
17:21:39.344864 IP 112.26.0.8.55610 > 112.26.0.1.targus-getdata1: Flags [S], seq 2827260080, win 65535, options [mss 1460,sackOK,TS val 4294845470 ecr 0,nop,wscale 6,mptcp capable csum {0x622703ee8f7d13ee}], length 0
17:21:40.260328 IP 112.26.0.8.55610 > 112.26.0.1.targus-getdata1: Flags [S], seq 2827260080, win 65535, options [mss 1460,sackOK,TS val 4294846528 ecr 0,nop,wscale 6,mptcp capable csum {0x622703ee8f7d13ee}], length 0
17:21:40.262918 IP 112.26.0.8.55610 > 112.26.0.1.targus-getdata1: Flags [S], seq 2827260080, win 65535, options [mss 1460,sackOK,TS val 4294846528 ecr 0,nop,wscale 6,mptcp capable csum {0x622703ee8f7d13ee}], length 0
17:21:40.269925 IP 112.26.0.1.targus-getdata1 > 112.26.0.8.55610: Flags [S.], seq 2442340864, ack 2827260081, win 65535, options [mss 1460,sackOK,TS val 102975 ecr 4294845470,nop,wscale 6,mptcp capable csum {0x723fcdbd34ba0730}], length 0
17:21:40.288238 IP 112.26.0.1.targus-getdata1 > 112.26.0.8.55610: Flags [S.], seq 2442340864, ack 2827260081, win 65535, options [mss 1460,sackOK,TS val 102975 ecr 4294845470,nop,wscale 6,mptcp capable csum {0x723fcdbd34ba0730}], length 0
17:21:40.356759 IP 112.26.0.1.targus-getdata1 > 112.26.0.8.55610: Flags [S.], seq 2442340864, ack 2827260081, win 65535, options [mss 1460,sackOK,TS val 102975 ecr 4294845470,nop,wscale 6,mptcp capable csum {0x723fcdbd34ba0730}], length 0
17:22:17.199632 IP 112.26.0.1.targus-getdata1 > 112.26.0.8.55612: Flags [.], ack 1502065970, win 24272, options [nop,nop,TS val 139268 ecr 4294882355,mptcp dss ack 2397988624], length 0
17:22:17.264754 IP 112.26.0.8.55612 > 112.26.0.1.targus-getdata1: Flags [.], seq 4285:5713, ack 0, win 4107, options [nop,nop,TS val 4294882829 ecr 138613,mptcp dss ack 2097709625 seq 2398131424 subseq 262790 len 1428 csum 0xaf7a], length 1428
17:22:17.267360 IP 112.26.0.8.55612 > 112.26.0.1.targus-getdata1: Flags [.], seq 4285:5713, ack 0, win 4107, options [nop,nop,TS val 4294882829 ecr 138613,mptcp dss ack 2097709625 seq 2398131424 subseq 262790 len 1428 csum 0xaf7a], length 1428
17:22:17.278932 IP 112.26.0.1.targus-getdata1 > 112.26.0.8.55612: Flags [.], ack 5713, win 24272, options [nop,nop,TS val 139979 ecr 4294882829,mptcp dss ack 2397988624], length 0
17:22:17.279209 IP 112.26.0.1.targus-getdata1 > 112.26.0.8.55612: Flags [.], ack 5713, win 24272, options [nop,nop,TS val 139979 ecr 4294882829,mptcp dss ack 2397988624], length 0
17:22:17.357521 IP 112.26.0.1.targus-getdata1 > 112.26.0.8.55612: Flags [.], ack 1429, win 24272, options [nop,nop,TS val 139430 ecr 4294882596,mptcp dss ack 2397988624], length 0
17:22:17.421189 IP 112.26.0.8.55612 > 112.26.0.1.targus-getdata1: Flags [.], seq 5713:7141, ack 0, win 4107, options [nop,nop,TS val 4294883152 ecr 138777,mptcp dss ack 2097709625 seq 2398139992 subseq 264218 len 1428 csum 0x28ad], length 1428
17:22:17.425354 IP 112.26.0.8.55612 > 112.26.0.1.targus-getdata1: Flags [.], seq 5713:7141, ack 0, win 4107, options [nop,nop,TS val 4294883152 ecr 138777,mptcp dss ack 2097709625 seq 2398139992 subseq 264218 len 1428 csum 0x28ad], length 1428
17:22:17.430997 IP 112.26.0.1.targus-getdata1 > 112.26.0.8.55612: Flags [.], ack 7141, win 24272, options [nop,nop,TS val 140137 ecr 4294883152,mptcp dss ack 2397988624], length 0
17:22:17.431352 IP 112.26.0.1.targus-getdata1 > 112.26.0.8.55612: Flags [.], ack 7141, win 24272, options [nop,nop,TS val 140137 ecr 4294883152,mptcp dss ack 2397988624], length 0
17:22:17.521811 IP 112.26.0.8.55612 > 112.26.0.1.targus-getdata1: Flags [.], seq 7141:8569, ack 0, win 4107, options [nop,nop,TS val 4294883271 ecr 138882,mptcp dss ack 2097709625 seq 2398145704 subseq 265646 len 1428 csum 0xb67f], length 1428
17:22:17.523859 IP 112.26.0.8.55612 > 112.26.0.1.targus-getdata1: Flags [.], seq 7141:8569, ack 0, win 4107, options [nop,nop,TS val 4294883271 ecr 138882,mptcp dss ack 2097709625 seq 2398145704 subseq 265646 len 1428 csum 0xb67f], length 1428
17:22:17.565942 IP 112.26.0.1.targus-getdata1 > 112.26.0.8.55612: Flags [.], ack 8569, win 24272, options [nop,nop,TS val 140277 ecr 4294883271,mptcp dss ack 2397988624], length 0
17:22:17.566251 IP 112.26.0.1.targus-getdata1 > 112.26.0.8.55612: Flags [.], ack 8569, win 24272, options [nop,nop,TS val 140277 ecr 4294883271,mptcp dss ack 2397988624], length 0
17:22:17.587820 IP 112.26.0.1.targus-getdata1 > 112.26.0.8.55612: Flags [.], ack 2857, win 24272, options [nop,nop,TS val 139669 ecr 4294882790,mptcp dss ack 2397988624], length 0
17:22:17.672636 IP 112.26.0.8.55612 > 112.26.0.1.targus-getdata1: Flags [.], seq 8569:9997, ack 0, win 4107, options [nop,nop,TS val 4294883415 ecr 139013,mptcp dss ack 2097709625 seq 2398151416 subseq 267074 len 1428 csum 0x93f3], length 1428
17:22:17.677939 IP 112.26.0.8.55612 > 112.26.0.1.targus-getdata1: Flags [.], seq 8569:9997, ack 0, win 4107, options [nop,nop,TS val 4294883415 ecr 139013,mptcp dss ack 2097709625 seq 2398151416 subseq 267074 len 1428 csum 0x93f3], length 1428
17:22:17.732842 IP 112.26.0.1.targus-getdata1 > 112.26.0.8.55612: Flags [.], ack 4285, win 24272, options [nop,nop,TS val 139830 ecr 4294882829,mptcp dss ack 2397988624], length 0
17:22:17.767209 IP 112.26.0.1.targus-getdata1 > 112.26.0.8.55612: Flags [.], ack 9997, win 24272, options [nop,nop,TS val 140472 ecr 4294883415,mptcp dss ack 2397988624], length 0
17:22:17.767540 IP 112.26.0.1.targus-getdata1 > 112.26.0.8.55612: Flags [.], ack 9997, win 24272, options [nop,nop,TS val 140472 ecr 4294883415,mptcp dss ack 2397988624], length 0
17:22:17.816213 IP 112.26.0.8.55612 > 112.26.0.1.targus-getdata1: Flags [.], seq 9997:11425, ack 0, win 4107, options [nop,nop,TS val 4294883566 ecr 139268,mptcp dss ack 2097709625 seq 2398159984 subseq 268502 len 1428 csum 0xfeb1], length 1428
17:22:17.819478 IP 112.26.0.8.55612 > 112.26.0.1.targus-getdata1: Flags [.], seq 9997:11425, ack 0, win 4107, options [nop,nop,TS val 4294883566 ecr 139268,mptcp dss ack 2097709625 seq 2398159984 subseq 268502 len 1428 csum 0xfeb1], length 1428
17:22:17.903590 IP 112.26.0.1.targus-getdata1 > 112.26.0.8.55612: Flags [.], ack 5713, win 24272, options [nop,nop,TS val 139979 ecr 4294882829,mptcp dss ack 2397988624], length 0
17:22:18.024401 IP 112.26.0.8.55612 > 112.26.0.1.targus-getdata1: Flags [.], seq 11425:12853, ack 0, win 4107, options [nop,nop,TS val 4294883724 ecr 139430,mptcp dss ack 2097709625 seq 2398168552 subseq 269930 len 1428 csum 0xe9c9], length 1428
17:22:18.027293 IP 112.26.0.8.55612 > 112.26.0.1.targus-getdata1: Flags [.], seq 11425:12853, ack 0, win 4107, options [nop,nop,TS val 4294883724 ecr 139430,mptcp dss ack 2097709625 seq 2398168552 subseq 269930 len 1428 csum 0xe9c9], length 1428
17:22:18.029427 IP 112.26.0.1.targus-getdata1 > 112.26.0.8.55612: Flags [.], ack 12853, win 24272, options [nop,nop,TS val 140740 ecr 4294883566,mptcp dss ack 2397988624], length 0
17:22:18.029768 IP 112.26.0.1.targus-getdata1 > 112.26.0.8.55612: Flags [.], ack 12853, win 24272, options [nop,nop,TS val 140740 ecr 4294883566,mptcp dss ack 2397988624], length 0
17:22:18.129415 IP 112.26.0.1.targus-getdata1 > 112.26.0.8.55612: Flags [.], ack 7141, win 24272, options [nop,nop,TS val 140137 ecr 4294883152,mptcp dss ack 2397988624], length 0
17:22:18.201611 IP 112.26.0.1.targus-getdata1 > 112.26.0.8.55612: Flags [.], ack 8569, win 24272, options [nop,nop,TS val 140277 ecr 4294883271,mptcp dss ack 2397988624], length 0
17:22:18.281721 IP 112.26.0.8.55612 > 112.26.0.1.targus-getdata1: Flags [.], seq 12853:14281, ack 0, win 4107, options [nop,nop,TS val 4294883945 ecr 139669,mptcp dss ack 2097709625 seq 2398177120 subseq 271358 len 1428 csum 0xae9e], length 1428
17:22:18.289346 IP 112.26.0.8.55612 > 112.26.0.1.targus-getdata1: Flags [.], seq 12853:14281, ack 0, win 4107, options [nop,nop,TS val 4294883945 ecr 139669,mptcp dss ack 2097709625 seq 2398177120 subseq 271358 len 1428 csum 0xae9e], length 1428
17:22:18.354253 IP 112.26.0.8.55612 > 112.26.0.1.targus-getdata1: Flags [.], seq 14281:15709, ack 0, win 4107, options [nop,nop,TS val 4294884099 ecr 139830,mptcp dss ack 2097709625 seq 2398184260 subseq 272786 len 1428 csum 0xc0db], length 1428
17:22:18.383060 IP 112.26.0.8.55612 > 112.26.0.1.targus-getdata1: Flags [.], seq 14281:15709, ack 0, win 4107, options [nop,nop,TS val 4294884099 ecr 139830,mptcp dss ack 2097709625 seq 2398184260 subseq 272786 len 1428 csum 0xc0db], length 1428
17:22:18.421999 IP 112.26.0.1.targus-getdata1 > 112.26.0.8.55612: Flags [.], ack 9997, win 24272, options [nop,nop,TS val 140472 ecr 4294883415,mptcp dss ack 2397988624], length 0
17:22:18.482314 IP 112.26.0.8.55612 > 112.26.0.1.targus-getdata1: Flags [.], seq 15709:17137, ack 0, win 4107, options [nop,nop,TS val 4294884270 ecr 139979,mptcp dss ack 2097709625 seq 2398189972 subseq 274214 len 1428 csum 0x22b3], length 1428
17:22:18.485646 IP 112.26.0.8.55612 > 112.26.0.1.targus-getdata1: Flags [.], seq 15709:17137, ack 0, win 4107, options [nop,nop,TS val 4294884270 ecr 139979,mptcp dss ack 2097709625 seq 2398189972 subseq 274214 len 1428 csum 0x22b3], length 1428
17:22:18.559989 IP 112.26.0.8.55612 > 112.26.0.1.targus-getdata1: Flags [.], seq 17137:18565, ack 0, win 4107, options [nop,nop,TS val 4294884270 ecr 139979,mptcp dss ack 2097709625 seq 2398191400 subseq 275642 len 1428 csum 0xe33b], length 1428
17:22:18.584219 IP 112.26.0.8.55612 > 112.26.0.1.targus-getdata1: Flags [.], seq 17137:18565, ack 0, win 4107, options [nop,nop,TS val 4294884270 ecr 139979,mptcp dss ack 2097709625 seq 2398191400 subseq 275642 len 1428 csum 0xe33b], length 1428
17:22:18.590391 IP 112.26.0.1.targus-getdata1 > 112.26.0.8.55612: Flags [.], ack 18565, win 24272, options [nop,nop,TS val 141296 ecr 4294883945,mptcp dss ack 2397988624], length 0
17:22:18.590715 IP 112.26.0.1.targus-getdata1 > 112.26.0.8.55612: Flags [.], ack 18565, win 24272, options [nop,nop,TS val 141296 ecr 4294883945,mptcp dss ack 2397988624], length 0
17:22:18.632381 IP 112.26.0.1.targus-getdata1 > 112.26.0.8.55612: Flags [.], ack 12853, win 24272, options [nop,nop,TS val 140740 ecr 4294883566,mptcp dss ack 2397988624], length 0
17:22:18.704001 IP 112.26.0.8.55612 > 112.26.0.1.targus-getdata1: Flags [.], seq 18565:19993, ack 0, win 4107, options [nop,nop,TS val 4294884496 ecr 140137,mptcp dss ack 2097709625 seq 2398198540 subseq 277070 len 1428 csum 0xc4f1], length 1428
17:22:18.708174 IP 112.26.0.8.55612 > 112.26.0.1.targus-getdata1: Flags [.], seq 18565:19993, ack 0, win 4107, options [nop,nop,TS val 4294884496 ecr 140137,mptcp dss ack 2097709625 seq 2398198540 subseq 277070 len 1428 csum 0xc4f1], length 1428
17:22:18.770810 IP 112.26.0.8.55612 > 112.26.0.1.targus-getdata1: Flags [.], seq 19993:21421, ack 0, win 4107, options [nop,nop,TS val 4294884568 ecr 140277,mptcp dss ack 2097709625 seq 2398207108 subseq 278498 len 1428 csum 0x3589], length 1428
17:22:18.772180 IP 112.26.0.8.55612 > 112.26.0.1.targus-getdata1: Flags [.], seq 19993:21421, ack 0, win 4107, options [nop,nop,TS val 4294884568 ecr 140277,mptcp dss ack 2097709625 seq 2398207108 subseq 278498 len 1428 csum 0x3589], length 1428
17:22:18.921665 IP 112.26.0.8.55612 > 112.26.0.1.targus-getdata1: Flags [.], seq 21421:22849, ack 0, win 4107, options [nop,nop,TS val 4294884788 ecr 140472,mptcp dss ack 2097709625 seq 2398215676 subseq 279926 len 1428 csum 0x9210], length 1428
17:22:18.947026 IP 112.26.0.8.55612 > 112.26.0.1.targus-getdata1: Flags [.], seq 21421:22849, ack 0, win 4107, options [nop,nop,TS val 4294884788 ecr 140472,mptcp dss ack 2097709625 seq 2398215676 subseq 279926 len 1428 csum 0x9210], length 1428
17:22:18.949676 IP 112.26.0.1.targus-getdata1 > 112.26.0.8.55612: Flags [.], ack 22849, win 24272, options [nop,nop,TS val 141659 ecr 4294884496,mptcp dss ack 2397988624], length 0
17:22:18.949999 IP 112.26.0.1.targus-getdata1 > 112.26.0.8.55612: Flags [.], ack 22849, win 24272, options [nop,nop,TS val 141659 ecr 4294884496,mptcp dss ack 2397988624], length 0
17:22:19.045183 IP 112.26.0.1.targus-getdata1 > 112.26.0.8.55612: Flags [.], ack 18565, win 24272, options [nop,nop,TS val 141296 ecr 4294883945,mptcp dss ack 2397988624], length 0
17:22:19.113019 IP 112.26.0.8.55612 > 112.26.0.1.targus-getdata1: Flags [.], seq 22849:24277, ack 0, win 4107, options [nop,nop,TS val 4294884999 ecr 140740,mptcp dss ack 2097709625 seq 2398229956 subseq 281354 len 1428 csum 0x5f2d], length 1428
17:22:19.114542 IP 112.26.0.8.55612 > 112.26.0.1.targus-getdata1: Flags [.], seq 22849:24277, ack 0, win 4107, options [nop,nop,TS val 4294884999 ecr 140740,mptcp dss ack 2097709625 seq 2398229956 subseq 281354 len 1428 csum 0x5f2d], length 1428
17:22:19.184806 IP 112.26.0.8.55612 > 112.26.0.1.targus-getdata1: Flags [.], seq 24277:25705, ack 0, win 4107, options [nop,nop,TS val 4294884999 ecr 140740,mptcp dss ack 2097709625 seq 2398231384 subseq 282782 len 1428 csum 0x3d8], length 1428
17:22:19.186059 IP 112.26.0.8.55612 > 112.26.0.1.targus-getdata1: Flags [.], seq 24277:25705, ack 0, win 4107, options [nop,nop,TS val 4294884999 ecr 140740,mptcp dss ack 2097709625 seq 2398231384 subseq 282782 len 1428 csum 0x3d8], length 1428
17:22:19.284260 IP 112.26.0.8.55612 > 112.26.0.1.targus-getdata1: Flags [.], seq 25705:27133, ack 0, win 4107, options [nop,nop,TS val 4294884999 ecr 140740,mptcp dss ack 2097709625 seq 2398232812 subseq 284210 len 1428 csum 0xf51a], length 1428
17:22:19.307817 IP 112.26.0.8.55612 > 112.26.0.1.targus-getdata1: Flags [.], seq 25705:27133, ack 0, win 4107, options [nop,nop,TS val 4294884999 ecr 140740,mptcp dss ack 2097709625 seq 2398232812 subseq 284210 len 1428 csum 0xf51a], length 1428
17:22:19.408869 IP 112.26.0.1.targus-getdata1 > 112.26.0.8.55612: Flags [.], ack 27133, win 24272, options [nop,nop,TS val 142120 ecr 4294884999,mptcp dss ack 2397988624], length 0
17:22:19.409157 IP 112.26.0.1.targus-getdata1 > 112.26.0.8.55612: Flags [.], ack 27133, win 24272, options [nop,nop,TS val 142120 ecr 4294884999,mptcp dss ack 2397988624], length 0
17:22:19.423662 IP 112.26.0.1.targus-getdata1 > 112.26.0.8.55612: Flags [.], ack 22849, win 24272, options [nop,nop,TS val 141659 ecr 4294884496,mptcp dss ack 2397988624], length 0
17:22:19.468542 IP 112.26.0.8.55612 > 112.26.0.1.targus-getdata1: Flags [.], seq 27133:28561, ack 0, win 4107, options [nop,nop,TS val 4294885412 ecr 141296,mptcp dss ack 2097709625 seq 2398247092 subseq 285638 len 1428 csum 0x975c], length 1428
17:22:19.471239 IP 112.26.0.8.55612 > 112.26.0.1.targus-getdata1: Flags [.], seq 27133:28561, ack 0, win 4107, options [nop,nop,TS val 4294885412 ecr 141296,mptcp dss ack 2097709625 seq 2398247092 subseq 285638 len 1428 csum 0x975c], length 1428
17:22:19.560007 IP 112.26.0.8.55612 > 112.26.0.1.targus-getdata1: Flags [.], seq 28561:29989, ack 0, win 4107, options [nop,nop,TS val 4294885412 ecr 141296,mptcp dss ack 2097709625 seq 2398248520 subseq 287066 len 1428 csum 0x7b8b], length 1428
17:22:19.573383 IP 112.26.0.8.55612 > 112.26.0.1.targus-getdata1: Flags [.], seq 28561:29989, ack 0, win 4107, options [nop,nop,TS val 4294885412 ecr 141296,mptcp dss ack 2097709625 seq 2398248520 subseq 287066 len 1428 csum 0x7b8b], length 1428
17:22:19.663394 IP 112.26.0.8.55612 > 112.26.0.1.targus-getdata1: Flags [.], seq 29989:31417, ack 0, win 4107, options [nop,nop,TS val 4294885412 ecr 141296,mptcp dss ack 2097709625 seq 2398249948 subseq 288494 len 1428 csum 0xb2ac], length 1428
17:22:19.668913 IP 112.26.0.8.55612 > 112.26.0.1.targus-getdata1: Flags [.], seq 29989:31417, ack 0, win 4107, options [nop,nop,TS val 4294885412 ecr 141296,mptcp dss ack 2097709625 seq 2398249948 subseq 288494 len 1428 csum 0xb2ac], length 1428
17:22:19.769516 IP 112.26.0.8.55612 > 112.26.0.1.targus-getdata1: Flags [.], seq 31417:32845, ack 0, win 4107, options [nop,nop,TS val 4294885412 ecr 141296,mptcp dss ack 2097709625 seq 2398251376 subseq 289922 len 1428 csum 0xad97], length 1428
17:22:19.772002 IP 112.26.0.8.55612 > 112.26.0.1.targus-getdata1: Flags [.], seq 31417:32845, ack 0, win 4107, options [nop,nop,TS val 4294885412 ecr 141296,mptcp dss ack 2097709625 seq 2398251376 subseq 289922 len 1428 csum 0xad97], length 1428
17:22:19.776559 IP 112.26.0.1.targus-getdata1 > 112.26.0.8.55612: Flags [.], ack 32845, win 24272, options [nop,nop,TS val 142484 ecr 4294885412,mptcp dss ack 2397988624], length 0
17:22:19.776844 IP 112.26.0.1.targus-getdata1 > 112.26.0.8.55612: Flags [.], ack 32845, win 24272, options [nop,nop,TS val 142484 ecr 4294885412,mptcp dss ack 2397988624], length 0
17:22:19.887032 IP 112.26.0.8.55612 > 112.26.0.1.targus-getdata1: Flags [.], seq 32845:34273, ack 0, win 4107, options [nop,nop,TS val 4294885412 ecr 141296,mptcp dss ack 2097709625 seq 2398252804 subseq 291350 len 1428 csum 0x91cb], length 1428
17:22:19.889971 IP 112.26.0.8.55612 > 112.26.0.1.targus-getdata1: Flags [.], seq 32845:34273, ack 0, win 4107, options [nop,nop,TS val 4294885412 ecr 141296,mptcp dss ack 2097709625 seq 2398252804 subseq 291350 len 1428 csum 0x91cb], length 1428
17:22:19.988473 IP 112.26.0.1.targus-getdata1 > 112.26.0.8.55612: Flags [.], ack 27133, win 24272, options [nop,nop,TS val 142120 ecr 4294884999,mptcp dss ack 2397988624], length 0
17:22:20.031974 IP 112.26.0.8.55612 > 112.26.0.1.targus-getdata1: Flags [.], seq 34273:35701, ack 0, win 4107, options [nop,nop,TS val 4294885412 ecr 141296,mptcp dss ack 2097709625 seq 2398254232 subseq 292778 len 1428 csum 0xbc81], length 1428
17:22:20.037246 IP 112.26.0.8.55612 > 112.26.0.1.targus-getdata1: Flags [.], seq 34273:35701, ack 0, win 4107, options [nop,nop,TS val 4294885412 ecr 141296,mptcp dss ack 2097709625 seq 2398254232 subseq 292778 len 1428 csum 0xbc81], length 1428
17:22:20.159844 IP 112.26.0.1.targus-getdata1 > 112.26.0.8.55612: Flags [.], ack 35701, win 24272, options [nop,nop,TS val 142832 ecr 4294885412,mptcp dss ack 2397988624], length 0
17:22:20.160086 IP 112.26.0.1.targus-getdata1 > 112.26.0.8.55612: Flags [.], ack 35701, win 24272, options [nop,nop,TS val 142832 ecr 4294885412,mptcp dss ack 2397988624], length 0
17:22:20.259585 IP 112.26.0.8.55612 > 112.26.0.1.targus-getdata1: Flags [.], seq 35701:37129, ack 0, win 4107, options [nop,nop,TS val 4294885412 ecr 141296,mptcp dss ack 2097709625 seq 2398255660 subseq 294206 len 1428 csum 0x562f], length 1428
17:22:20.269526 IP 112.26.0.8.55612 > 112.26.0.1.targus-getdata1: Flags [.], seq 35701:37129, ack 0, win 4107, options [nop,nop,TS val 4294885412 ecr 141296,mptcp dss ack 2097709625 seq 2398255660 subseq 294206 len 1428 csum 0x562f], length 1428
17:22:20.362798 IP 112.26.0.8.55612 > 112.26.0.1.targus-getdata1: Flags [.], seq 37129:38557, ack 0, win 4107, options [nop,nop,TS val 4294885790 ecr 141659,mptcp dss ack 2097709625 seq 2398271368 subseq 295634 len 1428 csum 0x2a12], length 1428
17:22:20.392642 IP 112.26.0.8.55612 > 112.26.0.1.targus-getdata1: Flags [.], seq 37129:38557, ack 0, win 4107, options [nop,nop,TS val 4294885790 ecr 141659,mptcp dss ack 2097709625 seq 2398271368 subseq 295634 len 1428 csum 0x2a12], length 1428
17:22:20.416325 IP 112.26.0.1.targus-getdata1 > 112.26.0.8.55612: Flags [.], ack 38557, win 22787, options [nop,nop,TS val 143123 ecr 4294885412,mptcp dss ack 2398238524], length 0
17:22:20.416641 IP 112.26.0.1.targus-getdata1 > 112.26.0.8.55612: Flags [.], ack 38557, win 22787, options [nop,nop,TS val 143123 ecr 4294885412,mptcp dss ack 2398238524], length 0
17:22:20.454649 IP 112.26.0.8.55612 > 112.26.0.1.targus-getdata1: Flags [.], seq 38557:39985, ack 0, win 4107, options [nop,nop,TS val 4294885790 ecr 141659,mptcp dss ack 2097709625 seq 2398272796 subseq 297062 len 1428 csum 0x3698], length 1428
17:22:20.483408 IP 112.26.0.8.55612 > 112.26.0.1.targus-getdata1: Flags [.], seq 38557:39985, ack 0, win 4107, options [nop,nop,TS val 4294885790 ecr 141659,mptcp dss ack 2097709625 seq 2398272796 subseq 297062 len 1428 csum 0x3698], length 1428
17:22:20.546466 IP 112.26.0.1.targus-getdata1 > 112.26.0.8.55612: Flags [.], ack 32845, win 24272, options [nop,nop,TS val 142484 ecr 4294885412,mptcp dss ack 2397988624], length 0
17:22:20.590075 IP 112.26.0.8.55612 > 112.26.0.1.targus-getdata1: Flags [.], seq 39985:41413, ack 0, win 4107, options [nop,nop,TS val 4294885790 ecr 141659,mptcp dss ack 2097709625 seq 2398274224 subseq 298490 len 1428 csum 0x3810], length 1428
17:22:20.591600 IP 112.26.0.8.55612 > 112.26.0.1.targus-getdata1: Flags [.], seq 39985:41413, ack 0, win 4107, options [nop,nop,TS val 4294885790 ecr 141659,mptcp dss ack 2097709625 seq 2398274224 subseq 298490 len 1428 csum 0x3810], length 1428
17:22:20.596723 IP 112.26.0.1.targus-getdata1 > 112.26.0.8.55612: Flags [.], ack 41413, win 24226, options [nop,nop,TS val 143304 ecr 4294885790,mptcp dss ack 2398238524], length 0
17:22:20.596994 IP 112.26.0.1.targus-getdata1 > 112.26.0.8.55612: Flags [.], ack 41413, win 24226, options [nop,nop,TS val 143304 ecr 4294885790,mptcp dss ack 2398238524], length 0
17:22:20.703459 IP 112.26.0.8.55612 > 112.26.0.1.targus-getdata1: Flags [.], seq 41413:42841, ack 0, win 4107, options [nop,nop,TS val 4294886355 ecr 142120,mptcp dss ack 2097709625 seq 2398301356 subseq 299918 len 1428 csum 0xba2e], length 1428
17:22:20.717274 IP 112.26.0.8.55612 > 112.26.0.1.targus-getdata1: Flags [.], seq 41413:42841, ack 0, win 4107, options [nop,nop,TS val 4294886355 ecr 142120,mptcp dss ack 2097709625 seq 2398301356 subseq 299918 len 1428 csum 0xba2e], length 1428
17:22:20.807463 IP 112.26.0.1.targus-getdata1 > 112.26.0.8.55612: Flags [.], ack 35701, win 24272, options [nop,nop,TS val 142832 ecr 4294885412,mptcp dss ack 2397988624], length 0
17:22:20.931049 IP 112.26.0.8.55612 > 112.26.0.1.targus-getdata1: Flags [.], seq 42841:44269, ack 0, win 4107, options [nop,nop,TS val 4294886355 ecr 142120,mptcp dss ack 2097709625 seq 2398302784 subseq 301346 len 1428 csum 0x5541], length 1428
17:22:20.933096 IP 112.26.0.8.55612 > 112.26.0.1.targus-getdata1: Flags [.], seq 42841:44269, ack 0, win 4107, options [nop,nop,TS val 4294886355 ecr 142120,mptcp dss ack 2097709625 seq 2398302784 subseq 301346 len 1428 csum 0x5541], length 1428
17:22:20.934580 IP 112.26.0.1.targus-getdata1 > 112.26.0.8.55612: Flags [.], ack 44269, win 24226, options [nop,nop,TS val 143645 ecr 4294886355,mptcp dss ack 2398238524], length 0
17:22:20.934851 IP 112.26.0.1.targus-getdata1 > 112.26.0.8.55612: Flags [.], ack 44269, win 24226, options [nop,nop,TS val 143645 ecr 4294886355,mptcp dss ack 2398238524], length 0
17:22:21.051409 IP 112.26.0.8.55612 > 112.26.0.1.targus-getdata1: Flags [.], seq 44269:45697, ack 0, win 4107, options [nop,nop,TS val 4294886355 ecr 142120,mptcp dss ack 2097709625 seq 2398304212 subseq 302774 len 1428 csum 0x9656], length 1428
17:22:21.072710 IP 112.26.0.8.55612 > 112.26.0.1.targus-getdata1: Flags [.], seq 44269:45697, ack 0, win 4107, options [nop,nop,TS val 4294886355 ecr 142120,mptcp dss ack 2097709625 seq 2398304212 subseq 302774 len 1428 csum 0x9656], length 1428
17:22:21.135980 IP 112.26.0.1.targus-getdata1 > 112.26.0.8.55612: Flags [.], ack 38557, win 22787, options [nop,nop,TS val 143123 ecr 4294885412,mptcp dss ack 2398238524], length 0
17:22:21.238671 IP 112.26.0.8.55612 > 112.26.0.1.targus-getdata1: Flags [.], seq 45697:47125, ack 0, win 4107, options [nop,nop,TS val 4294886913 ecr 142484,mptcp dss ack 2097709625 seq 2398318492 subseq 304202 len 1428 csum 0xa8ef], length 1428
17:22:21.242166 IP 112.26.0.8.55612 > 112.26.0.1.targus-getdata1: Flags [.], seq 45697:47125, ack 0, win 4107, options [nop,nop,TS val 4294886913 ecr 142484,mptcp dss ack 2097709625 seq 2398318492 subseq 304202 len 1428 csum 0xa8ef], length 1428
17:22:21.318259 IP 112.26.0.1.targus-getdata1 > 112.26.0.8.55612: Flags [.], ack 41413, win 24226, options [nop,nop,TS val 143304 ecr 4294885790,mptcp dss ack 2398238524], length 0
17:22:21.365237 IP 112.26.0.1.targus-getdata1 > 112.26.0.8.55612: Flags [.], ack 47125, win 24102, options [nop,nop,TS val 144075 ecr 4294886355,mptcp dss ack 2398264228], length 0
17:22:21.365458 IP 112.26.0.1.targus-getdata1 > 112.26.0.8.55612: Flags [.], ack 47125, win 24102, options [nop,nop,TS val 144075 ecr 4294886355,mptcp dss ack 2398264228], length 0
17:22:21.418673 IP 112.26.0.8.55612 > 112.26.0.1.targus-getdata1: Flags [.], seq 47125:48553, ack 0, win 4107, options [nop,nop,TS val 4294886913 ecr 142484,mptcp dss ack 2097709625 seq 2398319920 subseq 305630 len 1428 csum 0x1185], length 1428
17:22:21.425299 IP 112.26.0.8.55612 > 112.26.0.1.targus-getdata1: Flags [.], seq 47125:48553, ack 0, win 4107, options [nop,nop,TS val 4294886913 ecr 142484,mptcp dss ack 2097709625 seq 2398319920 subseq 305630 len 1428 csum 0x1185], length 1428
17:22:21.518285 IP 112.26.0.8.55612 > 112.26.0.1.targus-getdata1: Flags [.], seq 48553:49981, ack 0, win 4107, options [nop,nop,TS val 4294886913 ecr 142484,mptcp dss ack 2097709625 seq 2398321348 subseq 307058 len 1428 csum 0x65ae], length 1428
17:22:21.531594 IP 112.26.0.8.55612 > 112.26.0.1.targus-getdata1: Flags [.], seq 48553:49981, ack 0, win 4107, options [nop,nop,TS val 4294886913 ecr 142484,mptcp dss ack 2097709625 seq 2398321348 subseq 307058 len 1428 csum 0x65ae], length 1428
17:22:21.568816 IP 112.26.0.1.targus-getdata1 > 112.26.0.8.55612: Flags [.], ack 49981, win 24169, options [nop,nop,TS val 144280 ecr 4294886913,mptcp dss ack 2398278508], length 0
17:22:21.569086 IP 112.26.0.1.targus-getdata1 > 112.26.0.8.55612: Flags [.], ack 49981, win 24169, options [nop,nop,TS val 144280 ecr 4294886913,mptcp dss ack 2398278508], length 0
17:22:21.625323 IP 112.26.0.8.55612 > 112.26.0.1.targus-getdata1: Flags [.], seq 49981:51409, ack 0, win 4107, options [nop,nop,TS val 4294886913 ecr 142484,mptcp dss ack 2097709625 seq 2398322776 subseq 308486 len 1428 csum 0xd74f], length 1428
17:22:21.638147 IP 112.26.0.8.55612 > 112.26.0.1.targus-getdata1: Flags [.], seq 49981:51409, ack 0, win 4107, options [nop,nop,TS val 4294886913 ecr 142484,mptcp dss ack 2097709625 seq 2398322776 subseq 308486 len 1428 csum 0xd74f], length 1428
17:22:21.732716 IP 112.26.0.8.55612 > 112.26.0.1.targus-getdata1: Flags [.], seq 51409:52837, ack 0, win 4107, options [nop,nop,TS val 4294887173 ecr 142832,mptcp dss ack 2097709625 seq 2398331344 subseq 309914 len 1428 csum 0x39cd], length 1428
17:22:21.735281 IP 112.26.0.8.55612 > 112.26.0.1.targus-getdata1: Flags [.], seq 51409:52837, ack 0, win 4107, options [nop,nop,TS val 4294887173 ecr 142832,mptcp dss ack 2097709625 seq 2398331344 subseq 309914 len 1428 csum 0x39cd], length 1428
17:22:21.768074 IP 112.26.0.1.targus-getdata1 > 112.26.0.8.55612: Flags [.], ack 52837, win 24136, options [nop,nop,TS val 144475 ecr 4294886913,mptcp dss ack 2398289932], length 0
17:22:21.768355 IP 112.26.0.1.targus-getdata1 > 112.26.0.8.55612: Flags [.], ack 52837, win 24136, options [nop,nop,TS val 144475 ecr 4294886913,mptcp dss ack 2398289932], length 0
17:22:21.815134 IP 112.26.0.8.55612 > 112.26.0.1.targus-getdata1: Flags [.], seq 52837:54265, ack 0, win 4107, options [nop,nop,TS val 4294887173 ecr 142832,mptcp dss ack 2097709625 seq 2398332772 subseq 311342 len 1428 csum 0x1f1f], length 1428
17:22:21.829809 IP 112.26.0.8.55612 > 112.26.0.1.targus-getdata1: Flags [.], seq 52837:54265, ack 0, win 4107, options [nop,nop,TS val 4294887173 ecr 142832,mptcp dss ack 2097709625 seq 2398332772 subseq 311342 len 1428 csum 0x1f1f], length 1428
17:22:21.926117 IP 112.26.0.8.55612 > 112.26.0.1.targus-getdata1: Flags [.], seq 55693:57121, ack 0, win 4107, options [nop,nop,TS val 4294887502 ecr 143123,mptcp dss ack 2097709625 seq 2398344196 subseq 314198 len 1428 csum 0x2974], length 1428
17:22:21.928000 IP 112.26.0.8.55612 > 112.26.0.1.targus-getdata1: Flags [.], seq 55693:57121, ack 0, win 4107, options [nop,nop,TS val 4294887502 ecr 143123,mptcp dss ack 2097709625 seq 2398344196 subseq 314198 len 1428 csum 0x2974], length 1428
17:22:21.931558 IP 112.26.0.1.targus-getdata1 > 112.26.0.8.55612: Flags [.], ack 54265, win 24136, options [nop,nop,TS val 144640 ecr 4294887173,nop,nop,sack 1 {55693:57121},mptcp dss ack 2398289932], length 0
17:22:21.931831 IP 112.26.0.1.targus-getdata1 > 112.26.0.8.55612: Flags [.], ack 54265, win 24136, options [nop,nop,TS val 144640 ecr 4294887173,nop,nop,sack 1 {55693:57121},mptcp dss ack 2398289932], length 0
17:22:22.040277 IP 112.26.0.8.55612 > 112.26.0.1.targus-getdata1: Flags [.], seq 57121:58549, ack 0, win 4107, options [nop,nop,TS val 4294887502 ecr 143123,mptcp dss ack 2097709625 seq 2398345624 subseq 315626 len 1428 csum 0x7d6b], length 1428
17:22:22.043932 IP 112.26.0.8.55612 > 112.26.0.1.targus-getdata1: Flags [.], seq 57121:58549, ack 0, win 4107, options [nop,nop,TS val 4294887502 ecr 143123,mptcp dss ack 2097709625 seq 2398345624 subseq 315626 len 1428 csum 0x7d6b], length 1428
17:22:22.051121 IP 112.26.0.1.targus-getdata1 > 112.26.0.8.55612: Flags [.], ack 54265, win 24401, options [nop,nop,TS val 144756 ecr 4294887173,nop,nop,sack 1 {55693:58549},mptcp dss ack 2398325632], length 0
17:22:22.051344 IP 112.26.0.1.targus-getdata1 > 112.26.0.8.55612: Flags [.], ack 54265, win 24401, options [nop,nop,TS val 144756 ecr 4294887173,nop,nop,sack 1 {55693:58549},mptcp dss ack 2398325632], length 0
17:22:22.128222 IP 112.26.0.8.55612 > 112.26.0.1.targus-getdata1: Flags [.], seq 58549:59977, ack 0, win 4107, options [nop,nop,TS val 4294887502 ecr 143123,mptcp dss ack 2097709625 seq 2398347052 subseq 317054 len 1428 csum 0x10da], length 1428
17:22:22.138779 IP 112.26.0.8.55612 > 112.26.0.1.targus-getdata1: Flags [.], seq 58549:59977, ack 0, win 4107, options [nop,nop,TS val 4294887502 ecr 143123,mptcp dss ack 2097709625 seq 2398347052 subseq 317054 len 1428 csum 0x10da], length 1428
17:22:22.140990 IP 112.26.0.1.targus-getdata1 > 112.26.0.8.55612: Flags [.], ack 54265, win 24401, options [nop,nop,TS val 144851 ecr 4294887173,nop,nop,sack 1 {55693:59977},mptcp dss ack 2398325632], length 0
17:22:22.141221 IP 112.26.0.1.targus-getdata1 > 112.26.0.8.55612: Flags [.], ack 54265, win 24401, options [nop,nop,TS val 144851 ecr 4294887173,nop,nop,sack 1 {55693:59977},mptcp dss ack 2398325632], length 0
17:22:22.218679 IP 112.26.0.8.55612 > 112.26.0.1.targus-getdata1: Flags [.], seq 59977:61405, ack 0, win 4107, options [nop,nop,TS val 4294887685 ecr 143304,mptcp dss ack 2097709625 seq 2398362760 subseq 318482 len 1428 csum 0x9372], length 1428
17:22:22.266877 IP 112.26.0.8.55612 > 112.26.0.1.targus-getdata1: Flags [.], seq 59977:61405, ack 0, win 4107, options [nop,nop,TS val 4294887685 ecr 143304,mptcp dss ack 2097709625 seq 2398362760 subseq 318482 len 1428 csum 0x9372], length 1428
17:22:22.268499 IP 112.26.0.1.targus-getdata1 > 112.26.0.8.55612: Flags [.], ack 54265, win 24401, options [nop,nop,TS val 144979 ecr 4294887173,nop,nop,sack 1 {55693:61405},mptcp dss ack 2398325632], length 0
17:22:22.268717 IP 112.26.0.1.targus-getdata1 > 112.26.0.8.55612: Flags [.], ack 54265, win 24401, options [nop,nop,TS val 144979 ecr 4294887173,nop,nop,sack 1 {55693:61405},mptcp dss ack 2398325632], length 0
17:22:22.340376 IP 112.26.0.1.targus-getdata1 > 112.26.0.8.55612: Flags [.], ack 49981, win 24169, options [nop,nop,TS val 144280 ecr 4294886913,mptcp dss ack 2398278508], length 0
17:22:22.451783 IP 112.26.0.1.targus-getdata1 > 112.26.0.8.55612: Flags [.], ack 52837, win 24136, options [nop,nop,TS val 144475 ecr 4294886913,mptcp dss ack 2398289932], length 0
17:22:22.524836 IP 112.26.0.1.targus-getdata1 > 112.26.0.8.55612: Flags [.], ack 54265, win 24136, options [nop,nop,TS val 144640 ecr 4294887173,nop,nop,sack 1 {55693:57121},mptcp dss ack 2398289932], length 0
17:22:22.577538 IP 112.26.0.1.targus-getdata1 > 112.26.0.8.55612: Flags [.], ack 54265, win 24401, options [nop,nop,TS val 144756 ecr 4294887173,nop,nop,sack 1 {55693:58549},mptcp dss ack 2398325632], length 0
17:22:22.651460 IP 112.26.0.1.targus-getdata1 > 112.26.0.8.55612: Flags [.], ack 54265, win 24401, options [nop,nop,TS val 144851 ecr 4294887173,nop,nop,sack 1 {55693:59977},mptcp dss ack 2398325632], length 0
17:22:22.724390 IP 112.26.0.1.targus-getdata1 > 112.26.0.8.55612: Flags [.], ack 54265, win 24401, options [nop,nop,TS val 144979 ecr 4294887173,nop,nop,sack 1 {55693:61405},mptcp dss ack 2398325632], length 0
17:22:22.764377 IP 112.26.0.8.55612 > 112.26.0.1.targus-getdata1: Flags [.], seq 62833:64261, ack 0, win 4107, options [nop,nop,TS val 4294888697 ecr 144280,mptcp dss ack 2097709625 seq 2398407028 subseq 321338 len 1428 csum 0x9692], length 1428
17:22:22.767450 IP 112.26.0.8.55612 > 112.26.0.1.targus-getdata1: Flags [.], seq 62833:64261, ack 0, win 4107, options [nop,nop,TS val 4294888697 ecr 144280,mptcp dss ack 2097709625 seq 2398407028 subseq 321338 len 1428 csum 0x9692], length 1428
17:22:22.769199 IP 112.26.0.1.targus-getdata1 > 112.26.0.8.55612: Flags [.], ack 54265, win 24401, options [nop,nop,TS val 145479 ecr 4294887173,nop,nop,sack 2 {62833:64261}{55693:61405},mptcp dss ack 2398325632], length 0
17:22:22.769518 IP 112.26.0.1.targus-getdata1 > 112.26.0.8.55612: Flags [.], ack 54265, win 24401, options [nop,nop,TS val 145479 ecr 4294887173,nop,nop,sack 2 {62833:64261}{55693:61405},mptcp dss ack 2398325632], length 0
17:22:22.880307 IP 112.26.0.8.55612 > 112.26.0.1.targus-getdata1: Flags [.], seq 64261:65689, ack 0, win 4107, options [nop,nop,TS val 4294888697 ecr 144280,mptcp dss ack 2097709625 seq 2398408456 subseq 322766 len 1428 csum 0xefca], length 1428
17:22:22.884267 IP 112.26.0.8.55612 > 112.26.0.1.targus-getdata1: Flags [.], seq 64261:65689, ack 0, win 4107, options [nop,nop,TS val 4294888697 ecr 144280,mptcp dss ack 2097709625 seq 2398408456 subseq 322766 len 1428 csum 0xefca], length 1428
17:22:22.896900 IP 112.26.0.1.targus-getdata1 > 112.26.0.8.55612: Flags [.], ack 54265, win 24401, options [nop,nop,TS val 145596 ecr 4294887173,nop,nop,sack 2 {62833:65689}{55693:61405},mptcp dss ack 2398325632], length 0
17:22:22.897217 IP 112.26.0.1.targus-getdata1 > 112.26.0.8.55612: Flags [.], ack 54265, win 24401, options [nop,nop,TS val 145596 ecr 4294887173,nop,nop,sack 2 {62833:65689}{55693:61405},mptcp dss ack 2398325632], length 0
17:22:22.970706 IP 112.26.0.8.55612 > 112.26.0.1.targus-getdata1: Flags [.], seq 65689:67117, ack 0, win 4107, options [nop,nop,TS val 4294888697 ecr 144280,mptcp dss ack 2097709625 seq 2398409884 subseq 324194 len 1428 csum 0x2210], length 1428
17:22:22.974424 IP 112.26.0.8.55612 > 112.26.0.1.targus-getdata1: Flags [.], seq 65689:67117, ack 0, win 4107, options [nop,nop,TS val 4294888697 ecr 144280,mptcp dss ack 2097709625 seq 2398409884 subseq 324194 len 1428 csum 0x2210], length 1428
17:22:22.976170 IP 112.26.0.1.targus-getdata1 > 112.26.0.8.55612: Flags [.], ack 54265, win 24401, options [nop,nop,TS val 145686 ecr 4294887173,nop,nop,sack 2 {62833:67117}{55693:61405},mptcp dss ack 2398325632], length 0
17:22:22.976500 IP 112.26.0.1.targus-getdata1 > 112.26.0.8.55612: Flags [.], ack 54265, win 24401, options [nop,nop,TS val 145686 ecr 4294887173,nop,nop,sack 2 {62833:67117}{55693:61405},mptcp dss ack 2398325632], length 0
17:22:23.053441 IP 112.26.0.8.55612 > 112.26.0.1.targus-getdata1: Flags [.], seq 67117:68545, ack 0, win 4107, options [nop,nop,TS val 4294888697 ecr 144280,mptcp dss ack 2097709625 seq 2398411312 subseq 325622 len 1428 csum 0x1d29], length 1428
17:22:23.066500 IP 112.26.0.8.55612 > 112.26.0.1.targus-getdata1: Flags [.], seq 67117:68545, ack 0, win 4107, options [nop,nop,TS val 4294888697 ecr 144280,mptcp dss ack 2097709625 seq 2398411312 subseq 325622 len 1428 csum 0x1d29], length 1428
17:22:23.077850 IP 112.26.0.1.targus-getdata1 > 112.26.0.8.55612: Flags [.], ack 54265, win 24401, options [nop,nop,TS val 145778 ecr 4294887173,nop,nop,sack 2 {62833:68545}{55693:61405},mptcp dss ack 2398325632], length 0
17:22:23.078170 IP 112.26.0.1.targus-getdata1 > 112.26.0.8.55612: Flags [.], ack 54265, win 24401, options [nop,nop,TS val 145778 ecr 4294887173,nop,nop,sack 2 {62833:68545}{55693:61405},mptcp dss ack 2398325632], length 0
17:22:23.196630 IP 112.26.0.8.55612 > 112.26.0.1.targus-getdata1: Flags [.], seq 68545:69973, ack 0, win 4107, options [nop,nop,TS val 4294888697 ecr 144280,mptcp dss ack 2097709625 seq 2398412740 subseq 327050 len 1428 csum 0x5509], length 1428
17:22:23.200872 IP 112.26.0.8.55612 > 112.26.0.1.targus-getdata1: Flags [.], seq 68545:69973, ack 0, win 4107, options [nop,nop,TS val 4294888697 ecr 144280,mptcp dss ack 2097709625 seq 2398412740 subseq 327050 len 1428 csum 0x5509], length 1428
17:22:23.205639 IP 112.26.0.1.targus-getdata1 > 112.26.0.8.55612: Flags [.], ack 54265, win 24401, options [nop,nop,TS val 145912 ecr 4294887173,nop,nop,sack 2 {62833:69973}{55693:61405},mptcp dss ack 2398325632], length 0
17:22:23.205927 IP 112.26.0.1.targus-getdata1 > 112.26.0.8.55612: Flags [.], ack 54265, win 24401, options [nop,nop,TS val 145912 ecr 4294887173,nop,nop,sack 2 {62833:69973}{55693:61405},mptcp dss ack 2398325632], length 0
17:22:23.314286 IP 112.26.0.8.55612 > 112.26.0.1.targus-getdata1: Flags [.], seq 69973:71401, ack 0, win 4107, options [nop,nop,TS val 4294888697 ecr 144280,mptcp dss ack 2097709625 seq 2398414168 subseq 328478 len 1428 csum 0x811d], length 1428
17:22:23.317061 IP 112.26.0.8.55612 > 112.26.0.1.targus-getdata1: Flags [.], seq 69973:71401, ack 0, win 4107, options [nop,nop,TS val 4294888697 ecr 144280,mptcp dss ack 2097709625 seq 2398414168 subseq 328478 len 1428 csum 0x811d], length 1428
17:22:23.318623 IP 112.26.0.1.targus-getdata1 > 112.26.0.8.55612: Flags [.], ack 54265, win 24401, options [nop,nop,TS val 146029 ecr 4294887173,nop,nop,sack 2 {62833:71401}{55693:61405},mptcp dss ack 2398325632], length 0
17:22:23.318970 IP 112.26.0.1.targus-getdata1 > 112.26.0.8.55612: Flags [.], ack 54265, win 24401, options [nop,nop,TS val 146029 ecr 4294887173,nop,nop,sack 2 {62833:71401}{55693:61405},mptcp dss ack 2398325632], length 0
17:22:23.416654 IP 112.26.0.1.targus-getdata1 > 112.26.0.8.55612: Flags [.], ack 54265, win 24401, options [nop,nop,TS val 145479 ecr 4294887173,nop,nop,sack 2 {62833:64261}{55693:61405},mptcp dss ack 2398325632], length 0
17:22:23.509547 IP 112.26.0.8.55612 > 112.26.0.1.targus-getdata1: Flags [.], seq 71401:72829, ack 0, win 4107, options [nop,nop,TS val 4294888697 ecr 144280,mptcp dss ack 2097709625 seq 2398415596 subseq 329906 len 1428 csum 0xe434], length 1428
17:22:23.512466 IP 112.26.0.8.55612 > 112.26.0.1.targus-getdata1: Flags [.], seq 71401:72829, ack 0, win 4107, options [nop,nop,TS val 4294888697 ecr 144280,mptcp dss ack 2097709625 seq 2398415596 subseq 329906 len 1428 csum 0xe434], length 1428
17:22:23.517083 IP 112.26.0.1.targus-getdata1 > 112.26.0.8.55612: Flags [.], ack 54265, win 24401, options [nop,nop,TS val 146225 ecr 4294887173,nop,nop,sack 2 {62833:72829}{55693:61405},mptcp dss ack 2398325632], length 0
17:22:23.517367 IP 112.26.0.1.targus-getdata1 > 112.26.0.8.55612: Flags [.], ack 54265, win 24401, options [nop,nop,TS val 146225 ecr 4294887173,nop,nop,sack 2 {62833:72829}{55693:61405},mptcp dss ack 2398325632], length 0
17:22:23.612533 IP 112.26.0.1.targus-getdata1 > 112.26.0.8.55612: Flags [.], ack 54265, win 24401, options [nop,nop,TS val 145596 ecr 4294887173,nop,nop,sack 2 {62833:65689}{55693:61405},mptcp dss ack 2398325632], length 0
17:22:23.698962 IP 112.26.0.8.55612 > 112.26.0.1.targus-getdata1: Flags [.], seq 72829:74257, ack 0, win 4107, options [nop,nop,TS val 4294888698 ecr 144280,mptcp dss ack 2097709625 seq 2398417024 subseq 331334 len 1428 csum 0x3145], length 1428
17:22:23.700358 IP 112.26.0.8.55612 > 112.26.0.1.targus-getdata1: Flags [.], seq 72829:74257, ack 0, win 4107, options [nop,nop,TS val 4294888698 ecr 144280,mptcp dss ack 2097709625 seq 2398417024 subseq 331334 len 1428 csum 0x3145], length 1428
