17:21:39.243210 IP 112.26.0.8.55610 > 112.26.0.1.targus-getdata1: Flags [S], seq 2827260080, win 65535, options [mss 1460,sackOK,TS val 4294845470 ecr 0,nop,wscale 6,mptcp capable csum {0x622703ee8f7d13ee}], length 0
17:21:40.249182 IP 112.26.0.8.55610 > 112.26.0.1.targus-getdata1: Flags [S], seq 2827260080, win 65535, options [mss 1460,sackOK,TS val 4294846528 ecr 0,nop,wscale 6,mptcp capable csum {0x622703ee8f7d13ee}], length 0
17:21:40.287369 IP 112.26.0.1.targus-getdata1 > 112.26.0.8.55610: Flags [S.], seq 2442340864, ack 2827260081, win 65535, options [mss 1460,sackOK,TS val 102975 ecr 4294845470,nop,wscale 6,mptcp capable csum {0x723fcdbd34ba0730}], length 0
17:21:40.355403 IP 112.26.0.1.targus-getdata1 > 112.26.0.8.55610: Flags [S.], seq 2442340864, ack 2827260081, win 65535, options [mss 1460,sackOK,TS val 102975 ecr 4294845470,nop,wscale 6,mptcp capable csum {0x723fcdbd34ba0730}], length 0
17:21:40.366632 IP 112.26.0.8.55610 > 112.26.0.1.targus-getdata1: Flags [.], ack 1, win 1369, options [nop,nop,TS val 4294846723 ecr 102975,mptcp capable csum {0x622703ee8f7d13ee,0x723fcdbd34ba0730},mptcp dss ack 2790937176], length 0
17:21:40.375062 IP 112.26.0.8.55610 > 112.26.0.1.targus-getdata1: Flags [.], ack 1, win 1369, options [nop,nop,TS val 4294846723 ecr 102975,mptcp add-addr id 4 112.26.2.8,mptcp dss ack 2790937176], length 0
17:21:40.458282 IP 112.26.0.8.55610 > 112.26.0.1.targus-getdata1: Flags [.], ack 1, win 1369, options [nop,nop,TS val 4294846723 ecr 102975,mptcp add-addr id 5 112.26.3.8,mptcp dss ack 2790937176], length 0
17:22:17.204014 IP 112.26.0.8.55612 > 112.26.0.1.targus-getdata1: Flags [.], seq 1502075966:1502077394, ack 3919312136, win 4107, options [nop,nop,TS val 4294883566 ecr 139268,mptcp dss ack 2097709625 seq 2398159984 subseq 268502 len 1428 csum 0xfeb1], length 1428
17:22:17.204354 IP 112.26.0.8.55612 > 112.26.0.1.targus-getdata1: Flags [.], seq 0:1428, ack 1, win 4107, options [nop,nop,TS val 4294883566 ecr 139268,mptcp dss ack 2097709625 seq 2398159984 subseq 268502 len 1428 csum 0xfeb1], length 1428
17:22:17.267475 IP 112.26.0.8.55612 > 112.26.0.1.targus-getdata1: Flags [.], seq 4294961584:4294963012, ack 1, win 4107, options [nop,nop,TS val 4294882829 ecr 138613,mptcp dss ack 2097709625 seq 2398131424 subseq 262790 len 1428 csum 0xaf7a], length 1428
17:22:17.283481 IP 112.26.0.1.targus-getdata1 > 112.26.0.8.55612: Flags [.], ack 4294963012, win 24272, options [nop,nop,TS val 139979 ecr 4294882829,mptcp dss ack 2397988624], length 0
17:22:17.283786 IP 112.26.0.1.targus-getdata1 > 112.26.0.8.55612: Flags [.], ack 4294963012, win 24272, options [nop,nop,TS val 139979 ecr 4294882829,mptcp dss ack 2397988624], length 0
17:22:32.124281 IP 112.26.0.8.55612 > 112.26.0.1.targus-getdata1: Flags [.], seq 139944:141372, ack 1, win 4107, options [nop,nop,TS val 4294898400 ecr 153961,mptcp dss ack 2097709625 seq 2398832572 subseq 408446 len 1428 csum 0x886d], length 1428
17:22:47.286010 IP 112.26.0.8.55612 > 112.26.0.1.targus-getdata1: Flags [.], seq 272748:274176, ack 1, win 4107, options [nop,nop,TS val 4294913646 ecr 169342,mptcp dss ack 2097709625 seq 2399548000 subseq 541250 len 1428 csum 0x500a], length 1428
17:22:47.286372 IP 112.26.0.8.55612 > 112.26.0.1.targus-getdata1: Flags [.], seq 272748:274176, ack 1, win 4107, options [nop,nop,TS val 4294913646 ecr 169342,mptcp dss ack 2097709625 seq 2399548000 subseq 541250 len 1428 csum 0x500a], length 1428
17:22:47.374958 IP 112.26.0.8.55612 > 112.26.0.1.targus-getdata1: Flags [.], seq 265608:267036, ack 1, win 4107, options [nop,nop,TS val 4294913115 ecr 168638,mptcp dss ack 2097709625 seq 2399526580 subseq 534110 len 1428 csum 0xfeec], length 1428
17:22:47.383662 IP 112.26.0.1.targus-getdata1 > 112.26.0.8.55612: Flags [.], ack 267036, win 24422, options [nop,nop,TS val 170087 ecr 4294913115,mptcp dss ack 2399473744], length 0
17:22:47.383890 IP 112.26.0.1.targus-getdata1 > 112.26.0.8.55612: Flags [.], ack 267036, win 24422, options [nop,nop,TS val 170087 ecr 4294913115,mptcp dss ack 2399473744], length 0
17:22:47.497596 IP 112.26.0.8.55612 > 112.26.0.1.targus-getdata1: Flags [.], seq 267036:268464, ack 1, win 4107, options [nop,nop,TS val 4294913232 ecr 168753,mptcp dss ack 2097709625 seq 2399530864 subseq 535538 len 1428 csum 0xadd3], length 1428
17:22:47.505711 IP 112.26.0.1.targus-getdata1 > 112.26.0.8.55612: Flags [.], ack 268464, win 24356, options [nop,nop,TS val 170209 ecr 4294913232,mptcp dss ack 2399478028], length 0
17:22:47.505938 IP 112.26.0.1.targus-getdata1 > 112.26.0.8.55612: Flags [.], ack 268464, win 24356, options [nop,nop,TS val 170209 ecr 4294913232,mptcp dss ack 2399478028], length 0
17:22:47.625432 IP 112.26.0.8.55612 > 112.26.0.1.targus-getdata1: Flags [.], seq 268464:269892, ack 1, win 4107, options [nop,nop,TS val 4294913332 ecr 168920,mptcp dss ack 2097709625 seq 2399535148 subseq 536966 len 1428 csum 0xa682], length 1428
17:22:47.674605 IP 112.26.0.1.targus-getdata1 > 112.26.0.8.55612: Flags [.], ack 269892, win 24356, options [nop,nop,TS val 170337 ecr 4294913332,mptcp dss ack 2399478028], length 0
17:22:47.674915 IP 112.26.0.1.targus-getdata1 > 112.26.0.8.55612: Flags [.], ack 269892, win 24356, options [nop,nop,TS val 170337 ecr 4294913332,mptcp dss ack 2399478028], length 0
17:22:47.718648 IP 112.26.0.8.55612 > 112.26.0.1.targus-getdata1: Flags [.], seq 274176:275604, ack 1, win 4107, options [nop,nop,TS val 4294914081 ecr 169737,mptcp dss ack 2097709625 seq 2399565136 subseq 542678 len 1428 csum 0xfd24], length 1428
17:22:47.718987 IP 112.26.0.8.55612 > 112.26.0.1.targus-getdata1: Flags [.], seq 274176:275604, ack 1, win 4107, options [nop,nop,TS val 4294914081 ecr 169737,mptcp dss ack 2097709625 seq 2399565136 subseq 542678 len 1428 csum 0xfd24], length 1428
17:22:47.793545 IP 112.26.0.8.55612 > 112.26.0.1.targus-getdata1: Flags [.], seq 275604:277032, ack 1, win 4107, options [nop,nop,TS val 4294914081 ecr 169737,mptcp dss ack 2097709625 seq 2399566564 subseq 544106 len 1428 csum 0x953e], length 1428
17:22:47.793852 IP 112.26.0.8.55612 > 112.26.0.1.targus-getdata1: Flags [.], seq 275604:277032, ack 1, win 4107, options [nop,nop,TS val 4294914081 ecr 169737,mptcp dss ack 2097709625 seq 2399566564 subseq 544106 len 1428 csum 0x953e], length 1428
17:22:47.821939 IP 112.26.0.8.55612 > 112.26.0.1.targus-getdata1: Flags [.], seq 269892:271320, ack 1, win 4107, options [nop,nop,TS val 4294913450 ecr 169028,mptcp dss ack 2097709625 seq 2399539432 subseq 538394 len 1428 csum 0x9f32], length 1428
17:22:47.835691 IP 112.26.0.1.targus-getdata1 > 112.26.0.8.55612: Flags [.], ack 271320, win 24356, options [nop,nop,TS val 170533 ecr 4294913450,mptcp dss ack 2399478028], length 0
17:22:47.836016 IP 112.26.0.1.targus-getdata1 > 112.26.0.8.55612: Flags [.], ack 271320, win 24356, options [nop,nop,TS val 170533 ecr 4294913450,mptcp dss ack 2399478028], length 0
17:22:47.965032 IP 112.26.0.8.55612 > 112.26.0.1.targus-getdata1: Flags [.], seq 271320:272748, ack 1, win 4107, options [nop,nop,TS val 4294913487 ecr 169155,mptcp dss ack 2097709625 seq 2399542288 subseq 539822 len 1428 csum 0xce19], length 1428
17:22:47.972605 IP 112.26.0.1.targus-getdata1 > 112.26.0.8.55612: Flags [.], ack 272748, win 24356, options [nop,nop,TS val 170677 ecr 4294913487,mptcp dss ack 2399478028], length 0
17:22:47.972891 IP 112.26.0.1.targus-getdata1 > 112.26.0.8.55612: Flags [.], ack 272748, win 24356, options [nop,nop,TS val 170677 ecr 4294913487,mptcp dss ack 2399478028], length 0
17:22:48.059151 IP 112.26.0.8.55612 > 112.26.0.1.targus-getdata1: Flags [.], seq 277032:278460, ack 1, win 4107, options [nop,nop,TS val 4294914405 ecr 169901,mptcp dss ack 2097709625 seq 2399582272 subseq 545534 len 1428 csum 0x13be], length 1428
17:22:48.059482 IP 112.26.0.8.55612 > 112.26.0.1.targus-getdata1: Flags [.], seq 277032:278460, ack 1, win 4107, options [nop,nop,TS val 4294914405 ecr 169901,mptcp dss ack 2097709625 seq 2399582272 subseq 545534 len 1428 csum 0x13be], length 1428
17:22:48.131213 IP 112.26.0.8.55612 > 112.26.0.1.targus-getdata1: Flags [.], seq 272748:274176, ack 1, win 4107, options [nop,nop,TS val 4294913646 ecr 169342,mptcp dss ack 2097709625 seq 2399548000 subseq 541250 len 1428 csum 0x500a], length 1428
17:22:48.144591 IP 112.26.0.1.targus-getdata1 > 112.26.0.8.55612: Flags [.], ack 274176, win 24356, options [nop,nop,TS val 170843 ecr 4294913646,mptcp dss ack 2399478028], length 0
17:22:48.144880 IP 112.26.0.1.targus-getdata1 > 112.26.0.8.55612: Flags [.], ack 274176, win 24356, options [nop,nop,TS val 170843 ecr 4294913646,mptcp dss ack 2399478028], length 0
17:22:48.233428 IP 112.26.0.8.55612 > 112.26.0.1.targus-getdata1: Flags [.], seq 278460:279888, ack 1, win 4107, options [nop,nop,TS val 4294914598 ecr 170087,mptcp dss ack 2097709625 seq 2399596552 subseq 546962 len 1428 csum 0x7eb], length 1428
17:22:48.233766 IP 112.26.0.8.55612 > 112.26.0.1.targus-getdata1: Flags [.], seq 278460:279888, ack 1, win 4107, options [nop,nop,TS val 4294914598 ecr 170087,mptcp dss ack 2097709625 seq 2399596552 subseq 546962 len 1428 csum 0x7eb], length 1428
17:22:48.325289 IP 112.26.0.8.55612 > 112.26.0.1.targus-getdata1: Flags [.], seq 279888:281316, ack 1, win 4107, options [nop,nop,TS val 4294914688 ecr 170209,mptcp dss ack 2097709625 seq 2399600836 subseq 548390 len 1428 csum 0x881a], length 1428
17:22:48.325634 IP 112.26.0.8.55612 > 112.26.0.1.targus-getdata1: Flags [.], seq 279888:281316, ack 1, win 4107, options [nop,nop,TS val 4294914688 ecr 170209,mptcp dss ack 2097709625 seq 2399600836 subseq 548390 len 1428 csum 0x881a], length 1428
17:22:48.438731 IP 112.26.0.8.55612 > 112.26.0.1.targus-getdata1: Flags [.], seq 281316:282744, ack 1, win 4107, options [nop,nop,TS val 4294914688 ecr 170209,mptcp dss ack 2097709625 seq 2399602264 subseq 549818 len 1428 csum 0x4e31], length 1428
17:22:48.439092 IP 112.26.0.8.55612 > 112.26.0.1.targus-getdata1: Flags [.], seq 281316:282744, ack 1, win 4107, options [nop,nop,TS val 4294914688 ecr 170209,mptcp dss ack 2097709625 seq 2399602264 subseq 549818 len 1428 csum 0x4e31], length 1428
17:22:48.459179 IP 112.26.0.8.55612 > 112.26.0.1.targus-getdata1: Flags [.], seq 274176:275604, ack 1, win 4107, options [nop,nop,TS val 4294914081 ecr 169737,mptcp dss ack 2097709625 seq 2399565136 subseq 542678 len 1428 csum 0xfd24], length 1428
17:22:48.465963 IP 112.26.0.1.targus-getdata1 > 112.26.0.8.55612: Flags [.], ack 275604, win 24356, options [nop,nop,TS val 171171 ecr 4294914081,mptcp dss ack 2399478028], length 0
17:22:48.466234 IP 112.26.0.1.targus-getdata1 > 112.26.0.8.55612: Flags [.], ack 275604, win 24356, options [nop,nop,TS val 171171 ecr 4294914081,mptcp dss ack 2399478028], length 0
17:22:48.531407 IP 112.26.0.8.55612 > 112.26.0.1.targus-getdata1: Flags [.], seq 282744:284172, ack 1, win 4107, options [nop,nop,TS val 4294914759 ecr 170337,mptcp dss ack 2097709625 seq 2399605120 subseq 551246 len 1428 csum 0xa88d], length 1428
17:22:48.531743 IP 112.26.0.8.55612 > 112.26.0.1.targus-getdata1: Flags [.], seq 282744:284172, ack 1, win 4107, options [nop,nop,TS val 4294914759 ecr 170337,mptcp dss ack 2097709625 seq 2399605120 subseq 551246 len 1428 csum 0xa88d], length 1428
17:22:48.646664 IP 112.26.0.1.targus-getdata1 > 112.26.0.8.55612: Flags [.], ack 277032, win 24356, options [nop,nop,TS val 171342 ecr 4294914081,mptcp dss ack 2399478028], length 0
17:22:48.646931 IP 112.26.0.1.targus-getdata1 > 112.26.0.8.55612: Flags [.], ack 277032, win 24356, options [nop,nop,TS val 171342 ecr 4294914081,mptcp dss ack 2399478028], length 0
17:22:48.659187 IP 112.26.0.8.55612 > 112.26.0.1.targus-getdata1: Flags [.], seq 284172:285600, ack 1, win 4107, options [nop,nop,TS val 4294914962 ecr 170533,mptcp dss ack 2097709625 seq 2399612260 subseq 552674 len 1428 csum 0xedcc], length 1428
17:22:48.659511 IP 112.26.0.8.55612 > 112.26.0.1.targus-getdata1: Flags [.], seq 284172:285600, ack 1, win 4107, options [nop,nop,TS val 4294914962 ecr 170533,mptcp dss ack 2097709625 seq 2399612260 subseq 552674 len 1428 csum 0xedcc], length 1428
17:22:48.665178 IP 112.26.0.8.55612 > 112.26.0.1.targus-getdata1: Flags [.], seq 275604:277032, ack 1, win 4107, options [nop,nop,TS val 4294914081 ecr 169737,mptcp dss ack 2097709625 seq 2399566564 subseq 544106 len 1428 csum 0x953e], length 1428
17:22:48.688360 IP 112.26.0.8.55612 > 112.26.0.1.targus-getdata1: Flags [.], seq 285600:287028, ack 1, win 4107, options [nop,nop,TS val 4294915006 ecr 170677,mptcp dss ack 2097709625 seq 2399615116 subseq 554102 len 1428 csum 0x25b4], length 1428
17:22:48.688715 IP 112.26.0.8.55612 > 112.26.0.1.targus-getdata1: Flags [.], seq 285600:287028, ack 1, win 4107, options [nop,nop,TS val 4294915006 ecr 170677,mptcp dss ack 2097709625 seq 2399615116 subseq 554102 len 1428 csum 0x25b4], length 1428
17:22:48.769313 IP 112.26.0.8.55612 > 112.26.0.1.targus-getdata1: Flags [.], seq 277032:278460, ack 1, win 4107, options [nop,nop,TS val 4294914405 ecr 169901,mptcp dss ack 2097709625 seq 2399582272 subseq 545534 len 1428 csum 0x13be], length 1428
17:22:48.779892 IP 112.26.0.1.targus-getdata1 > 112.26.0.8.55612: Flags [.], ack 278460, win 24356, options [nop,nop,TS val 171472 ecr 4294914405,mptcp dss ack 2399478028], length 0
17:22:48.780211 IP 112.26.0.1.targus-getdata1 > 112.26.0.8.55612: Flags [.], ack 278460, win 24356, options [nop,nop,TS val 171472 ecr 4294914405,mptcp dss ack 2399478028], length 0
17:22:48.847874 IP 112.26.0.8.55612 > 112.26.0.1.targus-getdata1: Flags [.], seq 287028:288456, ack 1, win 4107, options [nop,nop,TS val 4294915211 ecr 170843,mptcp dss ack 2097709625 seq 2399620828 subseq 555530 len 1428 csum 0x52f7], length 1428
17:22:48.848202 IP 112.26.0.8.55612 > 112.26.0.1.targus-getdata1: Flags [.], seq 287028:288456, ack 1, win 4107, options [nop,nop,TS val 4294915211 ecr 170843,mptcp dss ack 2097709625 seq 2399620828 subseq 555530 len 1428 csum 0x52f7], length 1428
17:22:48.938120 IP 112.26.0.8.55612 > 112.26.0.1.targus-getdata1: Flags [.], seq 278460:279888, ack 1, win 4107, options [nop,nop,TS val 4294914598 ecr 170087,mptcp dss ack 2097709625 seq 2399596552 subseq 546962 len 1428 csum 0x7eb], length 1428
17:22:48.948343 IP 112.26.0.1.targus-getdata1 > 112.26.0.8.55612: Flags [.], ack 279888, win 24356, options [nop,nop,TS val 171650 ecr 4294914598,mptcp dss ack 2399478028], length 0
17:22:48.948685 IP 112.26.0.1.targus-getdata1 > 112.26.0.8.55612: Flags [.], ack 279888, win 24356, options [nop,nop,TS val 171650 ecr 4294914598,mptcp dss ack 2399478028], length 0
17:22:49.080598 IP 112.26.0.8.55612 > 112.26.0.1.targus-getdata1: Flags [.], seq 279888:281316, ack 1, win 4107, options [nop,nop,TS val 4294914688 ecr 170209,mptcp dss ack 2097709625 seq 2399600836 subseq 548390 len 1428 csum 0x881a], length 1428
17:22:49.097925 IP 112.26.0.1.targus-getdata1 > 112.26.0.8.55612: Flags [.], ack 281316, win 24356, options [nop,nop,TS val 171792 ecr 4294914688,mptcp dss ack 2399478028], length 0
17:22:49.098248 IP 112.26.0.1.targus-getdata1 > 112.26.0.8.55612: Flags [.], ack 281316, win 24356, options [nop,nop,TS val 171792 ecr 4294914688,mptcp dss ack 2399478028], length 0
17:22:49.172671 IP 112.26.0.8.55612 > 112.26.0.1.targus-getdata1: Flags [.], seq 281316:282744, ack 1, win 4107, options [nop,nop,TS val 4294914688 ecr 170209,mptcp dss ack 2097709625 seq 2399602264 subseq 549818 len 1428 csum 0x4e31], length 1428
17:22:49.176508 IP 112.26.0.1.targus-getdata1 > 112.26.0.8.55612: Flags [.], ack 282744, win 24356, options [nop,nop,TS val 171884 ecr 4294914688,mptcp dss ack 2399478028], length 0
17:22:49.176774 IP 112.26.0.1.targus-getdata1 > 112.26.0.8.55612: Flags [.], ack 282744, win 24356, options [nop,nop,TS val 171884 ecr 4294914688,mptcp dss ack 2399478028], length 0
17:22:49.252286 IP 112.26.0.8.55612 > 112.26.0.1.targus-getdata1: Flags [.], seq 288456:289884, ack 1, win 4107, options [nop,nop,TS val 4294915600 ecr 171171,mptcp dss ack 2097709625 seq 2399636536 subseq 556958 len 1428 csum 0xcb21], length 1428
17:22:49.252646 IP 112.26.0.8.55612 > 112.26.0.1.targus-getdata1: Flags [.], seq 288456:289884, ack 1, win 4107, options [nop,nop,TS val 4294915600 ecr 171171,mptcp dss ack 2097709625 seq 2399636536 subseq 556958 len 1428 csum 0xcb21], length 1428
17:22:49.300711 IP 112.26.0.8.55612 > 112.26.0.1.targus-getdata1: Flags [.], seq 289884:291312, ack 1, win 4107, options [nop,nop,TS val 4294915600 ecr 171171,mptcp dss ack 2097709625 seq 2399637964 subseq 558386 len 1428 csum 0x2e4], length 1428
17:22:49.301034 IP 112.26.0.8.55612 > 112.26.0.1.targus-getdata1: Flags [.], seq 289884:291312, ack 1, win 4107, options [nop,nop,TS val 4294915600 ecr 171171,mptcp dss ack 2097709625 seq 2399637964 subseq 558386 len 1428 csum 0x2e4], length 1428
17:22:49.322865 IP 112.26.0.8.55612 > 112.26.0.1.targus-getdata1: Flags [.], seq 282744:284172, ack 1, win 4107, options [nop,nop,TS val 4294914759 ecr 170337,mptcp dss ack 2097709625 seq 2399605120 subseq 551246 len 1428 csum 0xa88d], length 1428
17:22:49.372370 IP 112.26.0.8.55612 > 112.26.0.1.targus-getdata1: Flags [.], seq 291312:292740, ack 1, win 4107, options [nop,nop,TS val 4294915737 ecr 171342,mptcp dss ack 2097709625 seq 2399645104 subseq 559814 len 1428 csum 0x1521], length 1428
17:22:49.372610 IP 112.26.0.8.55612 > 112.26.0.1.targus-getdata1: Flags [.], seq 291312:292740, ack 1, win 4107, options [nop,nop,TS val 4294915737 ecr 171342,mptcp dss ack 2097709625 seq 2399645104 subseq 559814 len 1428 csum 0x1521], length 1428
17:22:49.380479 IP 112.26.0.1.targus-getdata1 > 112.26.0.8.55612: Flags [.], ack 284172, win 24356, options [nop,nop,TS val 172076 ecr 4294914759,mptcp dss ack 2399478028], length 0
17:22:49.380702 IP 112.26.0.1.targus-getdata1 > 112.26.0.8.55612: Flags [.], ack 284172, win 24356, options [nop,nop,TS val 172076 ecr 4294914759,mptcp dss ack 2399478028], length 0
17:22:49.488298 IP 112.26.0.8.55612 > 112.26.0.1.targus-getdata1: Flags [.], seq 284172:285600, ack 1, win 4107, options [nop,nop,TS val 4294914962 ecr 170533,mptcp dss ack 2097709625 seq 2399612260 subseq 552674 len 1428 csum 0xedcc], length 1428
17:22:49.579440 IP 112.26.0.1.targus-getdata1 > 112.26.0.8.55612: Flags [.], ack 285600, win 24356, options [nop,nop,TS val 172288 ecr 4294914962,mptcp dss ack 2399478028], length 0
17:22:49.579772 IP 112.26.0.1.targus-getdata1 > 112.26.0.8.55612: Flags [.], ack 285600, win 24356, options [nop,nop,TS val 172288 ecr 4294914962,mptcp dss ack 2399478028], length 0
17:22:49.593547 IP 112.26.0.8.55612 > 112.26.0.1.targus-getdata1: Flags [.], seq 292740:294168, ack 1, win 4107, options [nop,nop,TS val 4294915951 ecr 171472,mptcp dss ack 2097709625 seq 2399653672 subseq 561242 len 1428 csum 0xc560], length 1428
17:22:49.593881 IP 112.26.0.8.55612 > 112.26.0.1.targus-getdata1: Flags [.], seq 292740:294168, ack 1, win 4107, options [nop,nop,TS val 4294915951 ecr 171472,mptcp dss ack 2097709625 seq 2399653672 subseq 561242 len 1428 csum 0xc560], length 1428
17:22:49.649097 IP 112.26.0.8.55612 > 112.26.0.1.targus-getdata1: Flags [.], seq 287028:288456, ack 1, win 4107, options [nop,nop,TS val 4294915211 ecr 170843,mptcp dss ack 2097709625 seq 2399620828 subseq 555530 len 1428 csum 0x52f7], length 1428
17:22:49.666157 IP 112.26.0.1.targus-getdata1 > 112.26.0.8.55612: Flags [.], ack 285600, win 24356, options [nop,nop,TS val 172361 ecr 4294914962,nop,nop,sack 1 {287028:288456},mptcp dss ack 2399478028], length 0
17:22:49.666474 IP 112.26.0.1.targus-getdata1 > 112.26.0.8.55612: Flags [.], ack 285600, win 24356, options [nop,nop,TS val 172361 ecr 4294914962,nop,nop,sack 1 {287028:288456},mptcp dss ack 2399478028], length 0
17:22:49.753315 IP 112.26.0.8.55612 > 112.26.0.1.targus-getdata1: Flags [.], seq 294168:295596, ack 1, win 4107, options [nop,nop,TS val 4294916118 ecr 171792,mptcp dss ack 2097709625 seq 2399663668 subseq 562670 len 1428 csum 0x3ef], length 1428
17:22:49.753600 IP 112.26.0.8.55612 > 112.26.0.1.targus-getdata1: Flags [.], seq 294168:295596, ack 1, win 4107, options [nop,nop,TS val 4294916118 ecr 171792,mptcp dss ack 2097709625 seq 2399663668 subseq 562670 len 1428 csum 0x3ef], length 1428
17:22:49.806710 IP 112.26.0.8.55612 > 112.26.0.1.targus-getdata1: Flags [.], seq 295596:297024, ack 1, win 4107, options [nop,nop,TS val 4294916118 ecr 171792,mptcp dss ack 2097709625 seq 2399665096 subseq 564098 len 1428 csum 0x50ad], length 1428
17:22:49.806989 IP 112.26.0.8.55612 > 112.26.0.1.targus-getdata1: Flags [.], seq 295596:297024, ack 1, win 4107, options [nop,nop,TS val 4294916118 ecr 171792,mptcp dss ack 2097709625 seq 2399665096 subseq 564098 len 1428 csum 0x50ad], length 1428
17:22:49.865006 IP 112.26.0.8.55612 > 112.26.0.1.targus-getdata1: Flags [.], seq 297024:298452, ack 1, win 4107, options [nop,nop,TS val 4294916161 ecr 171884,mptcp dss ack 2097709625 seq 2399666524 subseq 565526 len 1428 csum 0x7840], length 1428
17:22:49.865348 IP 112.26.0.8.55612 > 112.26.0.1.targus-getdata1: Flags [.], seq 297024:298452, ack 1, win 4107, options [nop,nop,TS val 4294916161 ecr 171884,mptcp dss ack 2097709625 seq 2399666524 subseq 565526 len 1428 csum 0x7840], length 1428
17:22:49.879832 IP 112.26.0.8.55612 > 112.26.0.1.targus-getdata1: Flags [.], seq 288456:289884, ack 1, win 4107, options [nop,nop,TS val 4294915600 ecr 171171,mptcp dss ack 2097709625 seq 2399636536 subseq 556958 len 1428 csum 0xcb21], length 1428
17:22:49.900658 IP 112.26.0.1.targus-getdata1 > 112.26.0.8.55612: Flags [.], ack 285600, win 24356, options [nop,nop,TS val 172592 ecr 4294914962,nop,nop,sack 1 {287028:289884},mptcp dss ack 2399478028], length 0
17:22:49.900958 IP 112.26.0.1.targus-getdata1 > 112.26.0.8.55612: Flags [.], ack 285600, win 24356, options [nop,nop,TS val 172592 ecr 4294914962,nop,nop,sack 1 {287028:289884},mptcp dss ack 2399478028], length 0
17:22:50.017401 IP 112.26.0.8.55612 > 112.26.0.1.targus-getdata1: Flags [.], seq 289884:291312, ack 1, win 4107, options [nop,nop,TS val 4294915600 ecr 171171,mptcp dss ack 2097709625 seq 2399637964 subseq 558386 len 1428 csum 0x2e4], length 1428
17:22:50.031398 IP 112.26.0.1.targus-getdata1 > 112.26.0.8.55612: Flags [.], ack 285600, win 24356, options [nop,nop,TS val 172729 ecr 4294914962,nop,nop,sack 1 {287028:291312},mptcp dss ack 2399478028], length 0
17:22:50.031732 IP 112.26.0.1.targus-getdata1 > 112.26.0.8.55612: Flags [.], ack 285600, win 24356, options [nop,nop,TS val 172729 ecr 4294914962,nop,nop,sack 1 {287028:291312},mptcp dss ack 2399478028], length 0
17:22:50.112695 IP 112.26.0.8.55612 > 112.26.0.1.targus-getdata1: Flags [.], seq 291312:292740, ack 1, win 4107, options [nop,nop,TS val 4294915737 ecr 171342,mptcp dss ack 2097709625 seq 2399645104 subseq 559814 len 1428 csum 0x1521], length 1428
17:22:50.120782 IP 112.26.0.1.targus-getdata1 > 112.26.0.8.55612: Flags [.], ack 285600, win 24356, options [nop,nop,TS val 172824 ecr 4294914962,nop,nop,sack 1 {287028:292740},mptcp dss ack 2399478028], length 0
17:22:50.121033 IP 112.26.0.1.targus-getdata1 > 112.26.0.8.55612: Flags [.], ack 285600, win 24356, options [nop,nop,TS val 172824 ecr 4294914962,nop,nop,sack 1 {287028:292740},mptcp dss ack 2399478028], length 0
17:22:50.198435 IP 112.26.0.8.55612 > 112.26.0.1.targus-getdata1: Flags [.], seq 298452:299880, ack 1, win 4107, options [nop,nop,TS val 4294916562 ecr 172288,mptcp dss ack 2097709625 seq 2399699368 subseq 566954 len 1428 csum 0x16bd], length 1428
17:22:50.198688 IP 112.26.0.8.55612 > 112.26.0.1.targus-getdata1: Flags [.], seq 298452:299880, ack 1, win 4107, options [nop,nop,TS val 4294916562 ecr 172288,mptcp dss ack 2097709625 seq 2399699368 subseq 566954 len 1428 csum 0x16bd], length 1428
17:22:50.251404 IP 112.26.0.8.55612 > 112.26.0.1.targus-getdata1: Flags [.], seq 299880:301308, ack 1, win 4107, options [nop,nop,TS val 4294916562 ecr 172288,mptcp dss ack 2097709625 seq 2399700796 subseq 568382 len 1428 csum 0x7805], length 1428
17:22:50.251686 IP 112.26.0.8.55612 > 112.26.0.1.targus-getdata1: Flags [.], seq 299880:301308, ack 1, win 4107, options [nop,nop,TS val 4294916562 ecr 172288,mptcp dss ack 2097709625 seq 2399700796 subseq 568382 len 1428 csum 0x7805], length 1428
17:22:50.274210 IP 112.26.0.8.55612 > 112.26.0.1.targus-getdata1: Flags [.], seq 292740:294168, ack 1, win 4107, options [nop,nop,TS val 4294915951 ecr 171472,mptcp dss ack 2097709625 seq 2399653672 subseq 561242 len 1428 csum 0xc560], length 1428
17:22:50.277316 IP 112.26.0.1.targus-getdata1 > 112.26.0.8.55612: Flags [.], ack 285600, win 24356, options [nop,nop,TS val 172969 ecr 4294914962,nop,nop,sack 1 {287028:294168},mptcp dss ack 2399478028], length 0
17:22:50.277599 IP 112.26.0.1.targus-getdata1 > 112.26.0.8.55612: Flags [.], ack 285600, win 24356, options [nop,nop,TS val 172969 ecr 4294914962,nop,nop,sack 1 {287028:294168},mptcp dss ack 2399478028], length 0
17:22:50.414669 IP 112.26.0.8.55612 > 112.26.0.1.targus-getdata1: Flags [.], seq 294168:295596, ack 1, win 4107, options [nop,nop,TS val 4294916118 ecr 171792,mptcp dss ack 2097709625 seq 2399663668 subseq 562670 len 1428 csum 0x3ef], length 1428
17:22:50.420636 IP 112.26.0.1.targus-getdata1 > 112.26.0.8.55612: Flags [.], ack 285600, win 24356, options [nop,nop,TS val 173126 ecr 4294914962,nop,nop,sack 1 {287028:295596},mptcp dss ack 2399478028], length 0
17:22:50.420884 IP 112.26.0.1.targus-getdata1 > 112.26.0.8.55612: Flags [.], ack 285600, win 24356, options [nop,nop,TS val 173126 ecr 4294914962,nop,nop,sack 1 {287028:295596},mptcp dss ack 2399478028], length 0
17:22:50.453255 IP 112.26.0.8.55612 > 112.26.0.1.targus-getdata1: Flags [.], seq 301308:302736, ack 1, win 4107, options [nop,nop,TS val 4294916809 ecr 172361,mptcp dss ack 2097709625 seq 2399707936 subseq 569810 len 1428 csum 0xf6c9], length 1428
17:22:50.453586 IP 112.26.0.8.55612 > 112.26.0.1.targus-getdata1: Flags [.], seq 301308:302736, ack 1, win 4107, options [nop,nop,TS val 4294916809 ecr 172361,mptcp dss ack 2097709625 seq 2399707936 subseq 569810 len 1428 csum 0xf6c9], length 1428
17:22:50.539361 IP 112.26.0.8.55612 > 112.26.0.1.targus-getdata1: Flags [.], seq 295596:297024, ack 1, win 4107, options [nop,nop,TS val 4294916118 ecr 171792,mptcp dss ack 2097709625 seq 2399665096 subseq 564098 len 1428 csum 0x50ad], length 1428
17:22:50.564520 IP 112.26.0.1.targus-getdata1 > 112.26.0.8.55612: Flags [.], ack 285600, win 24356, options [nop,nop,TS val 173251 ecr 4294914962,nop,nop,sack 1 {287028:297024},mptcp dss ack 2399478028], length 0
17:22:50.564845 IP 112.26.0.1.targus-getdata1 > 112.26.0.8.55612: Flags [.], ack 285600, win 24356, options [nop,nop,TS val 173251 ecr 4294914962,nop,nop,sack 1 {287028:297024},mptcp dss ack 2399478028], length 0
17:22:50.651536 IP 112.26.0.8.55612 > 112.26.0.1.targus-getdata1: Flags [.], seq 297024:298452, ack 1, win 4107, options [nop,nop,TS val 4294916161 ecr 171884,mptcp dss ack 2097709625 seq 2399666524 subseq 565526 len 1428 csum 0x7840], length 1428
17:22:50.655362 IP 112.26.0.1.targus-getdata1 > 112.26.0.8.55612: Flags [.], ack 285600, win 24356, options [nop,nop,TS val 173364 ecr 4294914962,nop,nop,sack 1 {287028:298452},mptcp dss ack 2399478028], length 0
17:22:50.655653 IP 112.26.0.1.targus-getdata1 > 112.26.0.8.55612: Flags [.], ack 285600, win 24356, options [nop,nop,TS val 173364 ecr 4294914962,nop,nop,sack 1 {287028:298452},mptcp dss ack 2399478028], length 0
17:22:50.673383 IP 112.26.0.8.55612 > 112.26.0.1.targus-getdata1: Flags [.], seq 285600:287028, ack 1, win 4107, options [nop,nop,TS val 4294917037 ecr 172729,mptcp dss ack 2097709625 seq 2399615116 subseq 554102 len 1428 csum 0x25b4], length 1428
17:22:50.673698 IP 112.26.0.8.55612 > 112.26.0.1.targus-getdata1: Flags [.], seq 285600:287028, ack 1, win 4107, options [nop,nop,TS val 4294917037 ecr 172729,mptcp dss ack 2097709625 seq 2399615116 subseq 554102 len 1428 csum 0x25b4], length 1428
17:22:50.723420 IP 112.26.0.8.55612 > 112.26.0.1.targus-getdata1: Flags [.], seq 302736:304164, ack 1, win 4107, options [nop,nop,TS val 4294917058 ecr 172729,mptcp dss ack 2097709625 seq 2399717932 subseq 571238 len 1428 csum 0x6f98], length 1428
17:22:50.723725 IP 112.26.0.8.55612 > 112.26.0.1.targus-getdata1: Flags [.], seq 302736:304164, ack 1, win 4107, options [nop,nop,TS val 4294917058 ecr 172729,mptcp dss ack 2097709625 seq 2399717932 subseq 571238 len 1428 csum 0x6f98], length 1428
17:22:50.800781 IP 112.26.0.8.55612 > 112.26.0.1.targus-getdata1: Flags [.], seq 298452:299880, ack 1, win 4107, options [nop,nop,TS val 4294916562 ecr 172288,mptcp dss ack 2097709625 seq 2399699368 subseq 566954 len 1428 csum 0x16bd], length 1428
17:22:50.818834 IP 112.26.0.1.targus-getdata1 > 112.26.0.8.55612: Flags [.], ack 285600, win 24356, options [nop,nop,TS val 173513 ecr 4294914962,nop,nop,sack 1 {287028:299880},mptcp dss ack 2399478028], length 0
17:22:50.819112 IP 112.26.0.1.targus-getdata1 > 112.26.0.8.55612: Flags [.], ack 285600, win 24356, options [nop,nop,TS val 173513 ecr 4294914962,nop,nop,sack 1 {287028:299880},mptcp dss ack 2399478028], length 0
17:22:50.903062 IP 112.26.0.8.55612 > 112.26.0.1.targus-getdata1: Flags [.], seq 299880:301308, ack 1, win 4107, options [nop,nop,TS val 4294916562 ecr 172288,mptcp dss ack 2097709625 seq 2399700796 subseq 568382 len 1428 csum 0x7805], length 1428
17:22:50.906910 IP 112.26.0.1.targus-getdata1 > 112.26.0.8.55612: Flags [.], ack 285600, win 24356, options [nop,nop,TS val 173615 ecr 4294914962,nop,nop,sack 1 {287028:301308},mptcp dss ack 2399478028], length 0
17:22:50.907223 IP 112.26.0.1.targus-getdata1 > 112.26.0.8.55612: Flags [.], ack 285600, win 24356, options [nop,nop,TS val 173615 ecr 4294914962,nop,nop,sack 1 {287028:301308},mptcp dss ack 2399478028], length 0
17:22:51.006114 IP 112.26.0.8.55612 > 112.26.0.1.targus-getdata1: Flags [.], seq 304164:305592, ack 1, win 4107, options [nop,nop,TS val 4294917368 ecr 172969,mptcp dss ack 2097709625 seq 2399732212 subseq 572666 len 1428 csum 0xa563], length 1428
17:22:51.006438 IP 112.26.0.8.55612 > 112.26.0.1.targus-getdata1: Flags [.], seq 304164:305592, ack 1, win 4107, options [nop,nop,TS val 4294917368 ecr 172969,mptcp dss ack 2097709625 seq 2399732212 subseq 572666 len 1428 csum 0xa563], length 1428
17:22:51.052525 IP 112.26.0.8.55612 > 112.26.0.1.targus-getdata1: Flags [.], seq 301308:302736, ack 1, win 4107, options [nop,nop,TS val 4294916809 ecr 172361,mptcp dss ack 2097709625 seq 2399707936 subseq 569810 len 1428 csum 0xf6c9], length 1428
17:22:51.062359 IP 112.26.0.1.targus-getdata1 > 112.26.0.8.55612: Flags [.], ack 285600, win 24356, options [nop,nop,TS val 173764 ecr 4294914962,nop,nop,sack 1 {287028:302736},mptcp dss ack 2399478028], length 0
17:22:51.062697 IP 112.26.0.1.targus-getdata1 > 112.26.0.8.55612: Flags [.], ack 285600, win 24356, options [nop,nop,TS val 173764 ecr 4294914962,nop,nop,sack 1 {287028:302736},mptcp dss ack 2399478028], length 0
17:22:51.097586 IP 112.26.0.8.55612 > 112.26.0.1.targus-getdata1: Flags [.], seq 305592:307020, ack 1, win 4107, options [nop,nop,TS val 4294917460 ecr 173126,mptcp dss ack 2097709625 seq 2399733640 subseq 574094 len 1428 csum 0xb1e9], length 1428
17:22:51.097915 IP 112.26.0.8.55612 > 112.26.0.1.targus-getdata1: Flags [.], seq 305592:307020, ack 1, win 4107, options [nop,nop,TS val 4294917460 ecr 173126,mptcp dss ack 2097709625 seq 2399733640 subseq 574094 len 1428 csum 0xb1e9], length 1428
17:22:51.269061 IP 112.26.0.8.55612 > 112.26.0.1.targus-getdata1: Flags [.], seq 285600:287028, ack 1, win 4107, options [nop,nop,TS val 4294917037 ecr 172729,mptcp dss ack 2097709625 seq 2399615116 subseq 554102 len 1428 csum 0x25b4], length 1428
17:22:51.276215 IP 112.26.0.1.targus-getdata1 > 112.26.0.8.55612: Flags [.], ack 302736, win 24356, options [nop,nop,TS val 173981 ecr 4294917037,mptcp dss ack 2399478028], length 0
17:22:51.276520 IP 112.26.0.1.targus-getdata1 > 112.26.0.8.55612: Flags [.], ack 302736, win 24356, options [nop,nop,TS val 173981 ecr 4294917037,mptcp dss ack 2399478028], length 0
17:22:51.364632 IP 112.26.0.8.55612 > 112.26.0.1.targus-getdata1: Flags [.], seq 302736:304164, ack 1, win 4107, options [nop,nop,TS val 4294917058 ecr 172729,mptcp dss ack 2097709625 seq 2399717932 subseq 571238 len 1428 csum 0x6f98], length 1428
17:22:51.372873 IP 112.26.0.1.targus-getdata1 > 112.26.0.8.55612: Flags [.], ack 304164, win 24356, options [nop,nop,TS val 174077 ecr 4294917058,mptcp dss ack 2399478028], length 0
17:22:51.373081 IP 112.26.0.1.targus-getdata1 > 112.26.0.8.55612: Flags [.], ack 304164, win 24356, options [nop,nop,TS val 174077 ecr 4294917058,mptcp dss ack 2399478028], length 0
17:22:51.494894 IP 112.26.0.8.55612 > 112.26.0.1.targus-getdata1: Flags [.], seq 307020:308448, ack 1, win 4107, options [nop,nop,TS val 4294917859 ecr 173513,mptcp dss ack 2097709625 seq 2399756488 subseq 575522 len 1428 csum 0x5d10], length 1428
17:22:51.495146 IP 112.26.0.8.55612 > 112.26.0.1.targus-getdata1: Flags [.], seq 307020:308448, ack 1, win 4107, options [nop,nop,TS val 4294917859 ecr 173513,mptcp dss ack 2097709625 seq 2399756488 subseq 575522 len 1428 csum 0x5d10], length 1428
17:22:51.534856 IP 112.26.0.8.55612 > 112.26.0.1.targus-getdata1: Flags [.], seq 304164:305592, ack 1, win 4107, options [nop,nop,TS val 4294917368 ecr 172969,mptcp dss ack 2097709625 seq 2399732212 subseq 572666 len 1428 csum 0xa563], length 1428
17:22:51.555128 IP 112.26.0.1.targus-getdata1 > 112.26.0.8.55612: Flags [.], ack 305592, win 24356, options [nop,nop,TS val 174247 ecr 4294917368,mptcp dss ack 2399478028], length 0
17:22:51.555412 IP 112.26.0.1.targus-getdata1 > 112.26.0.8.55612: Flags [.], ack 305592, win 24356, options [nop,nop,TS val 174247 ecr 4294917368,mptcp dss ack 2399478028], length 0
17:22:51.590199 IP 112.26.0.8.55612 > 112.26.0.1.targus-getdata1: Flags [.], seq 308448:309876, ack 1, win 4107, options [nop,nop,TS val 4294917881 ecr 173615,mptcp dss ack 2097709625 seq 2399757916 subseq 576950 len 1428 csum 0x3fcc], length 1428
17:22:51.590503 IP 112.26.0.8.55612 > 112.26.0.1.targus-getdata1: Flags [.], seq 308448:309876, ack 1, win 4107, options [nop,nop,TS val 4294917881 ecr 173615,mptcp dss ack 2097709625 seq 2399757916 subseq 576950 len 1428 csum 0x3fcc], length 1428
17:22:51.714976 IP 112.26.0.8.55612 > 112.26.0.1.targus-getdata1: Flags [.], seq 305592:307020, ack 1, win 4107, options [nop,nop,TS val 4294917460 ecr 173126,mptcp dss ack 2097709625 seq 2399733640 subseq 574094 len 1428 csum 0xb1e9], length 1428
17:22:51.723013 IP 112.26.0.1.targus-getdata1 > 112.26.0.8.55612: Flags [.], ack 307020, win 24356, options [nop,nop,TS val 174427 ecr 4294917460,mptcp dss ack 2399478028], length 0
17:22:51.723332 IP 112.26.0.1.targus-getdata1 > 112.26.0.8.55612: Flags [.], ack 307020, win 24356, options [nop,nop,TS val 174427 ecr 4294917460,mptcp dss ack 2399478028], length 0
17:22:51.786402 IP 112.26.0.8.55612 > 112.26.0.1.targus-getdata1: Flags [.], seq 309876:311304, ack 1, win 4107, options [nop,nop,TS val 4294918145 ecr 173764,mptcp dss ack 2097709625 seq 2399770768 subseq 578378 len 1428 csum 0xf0d7], length 1428
17:22:51.786832 IP 112.26.0.8.55612 > 112.26.0.1.targus-getdata1: Flags [.], seq 309876:311304, ack 1, win 4107, options [nop,nop,TS val 4294918145 ecr 173764,mptcp dss ack 2097709625 seq 2399770768 subseq 578378 len 1428 csum 0xf0d7], length 1428
17:22:51.847292 IP 112.26.0.8.55612 > 112.26.0.1.targus-getdata1: Flags [.], seq 311304:312732, ack 1, win 4107, options [nop,nop,TS val 4294918149 ecr 173981,mptcp dss ack 2097709625 seq 2399773624 subseq 579806 len 1428 csum 0x7796], length 1428
17:22:51.847657 IP 112.26.0.8.55612 > 112.26.0.1.targus-getdata1: Flags [.], seq 311304:312732, ack 1, win 4107, options [nop,nop,TS val 4294918149 ecr 173981,mptcp dss ack 2097709625 seq 2399773624 subseq 579806 len 1428 csum 0x7796], length 1428
17:22:51.894896 IP 112.26.0.8.55612 > 112.26.0.1.targus-getdata1: Flags [.], seq 307020:308448, ack 1, win 4107, options [nop,nop,TS val 4294917859 ecr 173513,mptcp dss ack 2097709625 seq 2399756488 subseq 575522 len 1428 csum 0x5d10], length 1428
17:22:51.917777 IP 112.26.0.1.targus-getdata1 > 112.26.0.8.55612: Flags [.], ack 308448, win 24356, options [nop,nop,TS val 174607 ecr 4294917859,mptcp dss ack 2399478028], length 0
17:22:51.918086 IP 112.26.0.1.targus-getdata1 > 112.26.0.8.55612: Flags [.], ack 308448, win 24356, options [nop,nop,TS val 174607 ecr 4294917859,mptcp dss ack 2399478028], length 0
17:22:51.945304 IP 112.26.0.8.55612 > 112.26.0.1.targus-getdata1: Flags [.], seq 312732:314160, ack 1, win 4107, options [nop,nop,TS val 4294918196 ecr 174077,mptcp dss ack 2097709625 seq 2399775052 subseq 581234 len 1428 csum 0x4c4d], length 1428
17:22:51.945678 IP 112.26.0.8.55612 > 112.26.0.1.targus-getdata1: Flags [.], seq 312732:314160, ack 1, win 4107, options [nop,nop,TS val 4294918196 ecr 174077,mptcp dss ack 2097709625 seq 2399775052 subseq 581234 len 1428 csum 0x4c4d], length 1428
17:22:52.041843 IP 112.26.0.8.55612 > 112.26.0.1.targus-getdata1: Flags [.], seq 314160:315588, ack 1, win 4107, options [nop,nop,TS val 4294918377 ecr 174247,mptcp dss ack 2097709625 seq 2399789332 subseq 582662 len 1428 csum 0xe38e], length 1428
17:22:52.042142 IP 112.26.0.8.55612 > 112.26.0.1.targus-getdata1: Flags [.], seq 314160:315588, ack 1, win 4107, options [nop,nop,TS val 4294918377 ecr 174247,mptcp dss ack 2097709625 seq 2399789332 subseq 582662 len 1428 csum 0xe38e], length 1428
17:22:52.101153 IP 112.26.0.8.55612 > 112.26.0.1.targus-getdata1: Flags [.], seq 308448:309876, ack 1, win 4107, options [nop,nop,TS val 4294917881 ecr 173615,mptcp dss ack 2097709625 seq 2399757916 subseq 576950 len 1428 csum 0x3fcc], length 1428
17:22:52.110639 IP 112.26.0.1.targus-getdata1 > 112.26.0.8.55612: Flags [.], ack 309876, win 24356, options [nop,nop,TS val 174813 ecr 4294917881,mptcp dss ack 2399478028], length 0
17:22:52.110980 IP 112.26.0.1.targus-getdata1 > 112.26.0.8.55612: Flags [.], ack 309876, win 24356, options [nop,nop,TS val 174813 ecr 4294917881,mptcp dss ack 2399478028], length 0
17:22:52.130738 IP 112.26.0.8.55612 > 112.26.0.1.targus-getdata1: Flags [.], seq 315588:317016, ack 1, win 4107, options [nop,nop,TS val 4294918377 ecr 174247,mptcp dss ack 2097709625 seq 2399790760 subseq 584090 len 1428 csum 0x80d9], length 1428
17:22:52.131072 IP 112.26.0.8.55612 > 112.26.0.1.targus-getdata1: Flags [.], seq 315588:317016, ack 1, win 4107, options [nop,nop,TS val 4294918377 ecr 174247,mptcp dss ack 2097709625 seq 2399790760 subseq 584090 len 1428 csum 0x80d9], length 1428
17:22:52.213036 IP 112.26.0.8.55612 > 112.26.0.1.targus-getdata1: Flags [.], seq 317016:318444, ack 1, win 4107, options [nop,nop,TS val 4294918547 ecr 174427,mptcp dss ack 2097709625 seq 2399797900 subseq 585518 len 1428 csum 0x4652], length 1428
17:22:52.213362 IP 112.26.0.8.55612 > 112.26.0.1.targus-getdata1: Flags [.], seq 317016:318444, ack 1, win 4107, options [nop,nop,TS val 4294918547 ecr 174427,mptcp dss ack 2097709625 seq 2399797900 subseq 585518 len 1428 csum 0x4652], length 1428
17:22:52.283608 IP 112.26.0.8.55612 > 112.26.0.1.targus-getdata1: Flags [.], seq 309876:311304, ack 1, win 4107, options [nop,nop,TS val 4294918145 ecr 173764,mptcp dss ack 2097709625 seq 2399770768 subseq 578378 len 1428 csum 0xf0d7], length 1428
17:22:52.287745 IP 112.26.0.1.targus-getdata1 > 112.26.0.8.55612: Flags [.], ack 311304, win 24356, options [nop,nop,TS val 174995 ecr 4294918145,mptcp dss ack 2399478028], length 0
17:22:52.288026 IP 112.26.0.1.targus-getdata1 > 112.26.0.8.55612: Flags [.], ack 311304, win 24356, options [nop,nop,TS val 174995 ecr 4294918145,mptcp dss ack 2399478028], length 0
17:22:52.348304 IP 112.26.0.8.55612 > 112.26.0.1.targus-getdata1: Flags [.], seq 311304:312732, ack 1, win 4107, options [nop,nop,TS val 4294918149 ecr 173981,mptcp dss ack 2097709625 seq 2399773624 subseq 579806 len 1428 csum 0x7796], length 1428
