17:21:39.244088 IP 112.26.0.8.55610 > 112.26.0.1.targus-getdata1: Flags [S], seq 2827260080, win 65535, options [mss 1460,sackOK,TS val 4294845470 ecr 0,nop,wscale 6,mptcp capable csum {0x622703ee8f7d13ee}], length 0
17:21:39.255765 IP 112.26.0.8.55610 > 112.26.0.1.targus-getdata1: Flags [S], seq 2827260080, win 65535, options [mss 1460,sackOK,TS val 4294845470 ecr 0,nop,wscale 6,mptcp capable csum {0x622703ee8f7d13ee}], length 0
17:21:39.343968 IP 112.26.0.8.55610 > 112.26.0.1.targus-getdata1: Flags [S], seq 2827260080, win 65535, options [mss 1460,sackOK,TS val 4294845470 ecr 0,nop,wscale 6,mptcp capable csum {0x622703ee8f7d13ee}], length 0
17:21:40.248997 IP 112.26.0.8.55610 > 112.26.0.1.targus-getdata1: Flags [S], seq 2827260080, win 65535, options [mss 1460,sackOK,TS val 4294846528 ecr 0,nop,wscale 6,mptcp capable csum {0x622703ee8f7d13ee}], length 0
17:21:40.260223 IP 112.26.0.8.55610 > 112.26.0.1.targus-getdata1: Flags [S], seq 2827260080, win 65535, options [mss 1460,sackOK,TS val 4294846528 ecr 0,nop,wscale 6,mptcp capable csum {0x622703ee8f7d13ee}], length 0
17:21:40.263238 IP 112.26.0.8.55610 > 112.26.0.1.targus-getdata1: Flags [S], seq 2827260080, win 65535, options [mss 1460,sackOK,TS val 4294846528 ecr 0,nop,wscale 6,mptcp capable csum {0x622703ee8f7d13ee}], length 0
17:21:40.288448 IP 112.26.0.1.targus-getdata1 > 112.26.0.8.55610: Flags [S.], seq 2442340864, ack 2827260081, win 65535, options [mss 1460,sackOK,TS val 102975 ecr 4294845470,nop,wscale 6,mptcp capable csum {0x723fcdbd34ba0730}], length 0
17:22:17.199507 IP 112.26.0.1.targus-getdata1 > 112.26.0.8.55612: Flags [.], ack 1502065970, win 24272, options [nop,nop,TS val 139268 ecr 4294882355,mptcp dss ack 2397988624], length 0
17:22:17.203900 IP 112.26.0.8.55612 > 112.26.0.1.targus-getdata1: Flags [.], seq 9997:11425, ack 0, win 4107, options [nop,nop,TS val 4294883566 ecr 139268,mptcp dss ack 2097709625 seq 2398159984 subseq 268502 len 1428 csum 0xfeb1], length 1428
17:22:17.264637 IP 112.26.0.8.55612 > 112.26.0.1.targus-getdata1: Flags [.], seq 4285:5713, ack 0, win 4107, options [nop,nop,TS val 4294882829 ecr 138613,mptcp dss ack 2097709625 seq 2398131424 subseq 262790 len 1428 csum 0xaf7a], length 1428
17:22:17.267716 IP 112.26.0.8.55612 > 112.26.0.1.targus-getdata1: Flags [.], seq 4285:5713, ack 0, win 4107, options [nop,nop,TS val 4294882829 ecr 138613,mptcp dss ack 2097709625 seq 2398131424 subseq 262790 len 1428 csum 0xaf7a], length 1428
17:22:17.283371 IP 112.26.0.1.targus-getdata1 > 112.26.0.8.55612: Flags [.], ack 5713, win 24272, options [nop,nop,TS val 139979 ecr 4294882829,mptcp dss ack 2397988624], length 0
17:22:17.357406 IP 112.26.0.1.targus-getdata1 > 112.26.0.8.55612: Flags [.], ack 1429, win 24272, options [nop,nop,TS val 139430 ecr 4294882596,mptcp dss ack 2397988624], length 0
17:22:17.360802 IP 112.26.0.8.55612 > 112.26.0.1.targus-getdata1: Flags [.], seq 11425:12853, ack 0, win 4107, options [nop,nop,TS val 4294883724 ecr 139430,mptcp dss ack 2097709625 seq 2398168552 subseq 269930 len 1428 csum 0xe9c9], length 1428
17:22:17.421067 IP 112.26.0.8.55612 > 112.26.0.1.targus-getdata1: Flags [.], seq 5713:7141, ack 0, win 4107, options [nop,nop,TS val 4294883152 ecr 138777,mptcp dss ack 2097709625 seq 2398139992 subseq 264218 len 1428 csum 0x28ad], length 1428
17:22:17.425720 IP 112.26.0.8.55612 > 112.26.0.1.targus-getdata1: Flags [.], seq 5713:7141, ack 0, win 4107, options [nop,nop,TS val 4294883152 ecr 138777,mptcp dss ack 2097709625 seq 2398139992 subseq 264218 len 1428 csum 0x28ad], length 1428
17:22:17.437301 IP 112.26.0.1.targus-getdata1 > 112.26.0.8.55612: Flags [.], ack 7141, win 24272, options [nop,nop,TS val 140137 ecr 4294883152,mptcp dss ack 2397988624], length 0
17:22:17.521693 IP 112.26.0.8.55612 > 112.26.0.1.targus-getdata1: Flags [.], seq 7141:8569, ack 0, win 4107, options [nop,nop,TS val 4294883271 ecr 138882,mptcp dss ack 2097709625 seq 2398145704 subseq 265646 len 1428 csum 0xb67f], length 1428
17:22:17.524195 IP 112.26.0.8.55612 > 112.26.0.1.targus-getdata1: Flags [.], seq 7141:8569, ack 0, win 4107, options [nop,nop,TS val 4294883271 ecr 138882,mptcp dss ack 2097709625 seq 2398145704 subseq 265646 len 1428 csum 0xb67f], length 1428
17:22:17.567398 IP 112.26.0.1.targus-getdata1 > 112.26.0.8.55612: Flags [.], ack 8569, win 24272, options [nop,nop,TS val 140277 ecr 4294883271,mptcp dss ack 2397988624], length 0
17:22:17.578252 IP 112.26.0.1.targus-getdata1 > 112.26.0.8.55612: Flags [.], ack 2857, win 24272, options [nop,nop,TS val 139669 ecr 4294882790,mptcp dss ack 2397988624], length 0
17:22:17.591007 IP 112.26.0.8.55612 > 112.26.0.1.targus-getdata1: Flags [.], seq 12853:14281, ack 0, win 4107, options [nop,nop,TS val 4294883945 ecr 139669,mptcp dss ack 2097709625 seq 2398177120 subseq 271358 len 1428 csum 0xae9e], length 1428
17:22:17.672512 IP 112.26.0.8.55612 > 112.26.0.1.targus-getdata1: Flags [.], seq 8569:9997, ack 0, win 4107, options [nop,nop,TS val 4294883415 ecr 139013,mptcp dss ack 2097709625 seq 2398151416 subseq 267074 len 1428 csum 0x93f3], length 1428
17:22:17.678279 IP 112.26.0.8.55612 > 112.26.0.1.targus-getdata1: Flags [.], seq 8569:9997, ack 0, win 4107, options [nop,nop,TS val 4294883415 ecr 139013,mptcp dss ack 2097709625 seq 2398151416 subseq 267074 len 1428 csum 0x93f3], length 1428
17:22:17.732732 IP 112.26.0.1.targus-getdata1 > 112.26.0.8.55612: Flags [.], ack 4285, win 24272, options [nop,nop,TS val 139830 ecr 4294882829,mptcp dss ack 2397988624], length 0
17:22:17.740481 IP 112.26.0.8.55612 > 112.26.0.1.targus-getdata1: Flags [.], seq 14281:15709, ack 0, win 4107, options [nop,nop,TS val 4294884099 ecr 139830,mptcp dss ack 2097709625 seq 2398184260 subseq 272786 len 1428 csum 0xc0db], length 1428
17:22:17.771293 IP 112.26.0.1.targus-getdata1 > 112.26.0.8.55612: Flags [.], ack 9997, win 24272, options [nop,nop,TS val 140472 ecr 4294883415,mptcp dss ack 2397988624], length 0
17:22:17.816101 IP 112.26.0.8.55612 > 112.26.0.1.targus-getdata1: Flags [.], seq 9997:11425, ack 0, win 4107, options [nop,nop,TS val 4294883566 ecr 139268,mptcp dss ack 2097709625 seq 2398159984 subseq 268502 len 1428 csum 0xfeb1], length 1428
17:22:17.819825 IP 112.26.0.8.55612 > 112.26.0.1.targus-getdata1: Flags [.], seq 9997:11425, ack 0, win 4107, options [nop,nop,TS val 4294883566 ecr 139268,mptcp dss ack 2097709625 seq 2398159984 subseq 268502 len 1428 csum 0xfeb1], length 1428
17:22:17.903471 IP 112.26.0.1.targus-getdata1 > 112.26.0.8.55612: Flags [.], ack 5713, win 24272, options [nop,nop,TS val 139979 ecr 4294882829,mptcp dss ack 2397988624], length 0
17:22:17.913619 IP 112.26.0.8.55612 > 112.26.0.1.targus-getdata1: Flags [.], seq 15709:17137, ack 0, win 4107, options [nop,nop,TS val 4294884270 ecr 139979,mptcp dss ack 2097709625 seq 2398189972 subseq 274214 len 1428 csum 0x22b3], length 1428
17:22:17.979067 IP 112.26.0.8.55612 > 112.26.0.1.targus-getdata1: Flags [.], seq 17137:18565, ack 0, win 4107, options [nop,nop,TS val 4294884270 ecr 139979,mptcp dss ack 2097709625 seq 2398191400 subseq 275642 len 1428 csum 0xe33b], length 1428
17:22:18.024289 IP 112.26.0.8.55612 > 112.26.0.1.targus-getdata1: Flags [.], seq 11425:12853, ack 0, win 4107, options [nop,nop,TS val 4294883724 ecr 139430,mptcp dss ack 2097709625 seq 2398168552 subseq 269930 len 1428 csum 0xe9c9], length 1428
17:22:18.027636 IP 112.26.0.8.55612 > 112.26.0.1.targus-getdata1: Flags [.], seq 11425:12853, ack 0, win 4107, options [nop,nop,TS val 4294883724 ecr 139430,mptcp dss ack 2097709625 seq 2398168552 subseq 269930 len 1428 csum 0xe9c9], length 1428
17:22:18.035652 IP 112.26.0.1.targus-getdata1 > 112.26.0.8.55612: Flags [.], ack 12853, win 24272, options [nop,nop,TS val 140740 ecr 4294883566,mptcp dss ack 2397988624], length 0
17:22:18.129303 IP 112.26.0.1.targus-getdata1 > 112.26.0.8.55612: Flags [.], ack 7141, win 24272, options [nop,nop,TS val 140137 ecr 4294883152,mptcp dss ack 2397988624], length 0
17:22:18.133375 IP 112.26.0.8.55612 > 112.26.0.1.targus-getdata1: Flags [.], seq 18565:19993, ack 0, win 4107, options [nop,nop,TS val 4294884496 ecr 140137,mptcp dss ack 2097709625 seq 2398198540 subseq 277070 len 1428 csum 0xc4f1], length 1428
17:22:18.201490 IP 112.26.0.1.targus-getdata1 > 112.26.0.8.55612: Flags [.], ack 8569, win 24272, options [nop,nop,TS val 140277 ecr 4294883271,mptcp dss ack 2397988624], length 0
17:22:18.211733 IP 112.26.0.8.55612 > 112.26.0.1.targus-getdata1: Flags [.], seq 19993:21421, ack 0, win 4107, options [nop,nop,TS val 4294884568 ecr 140277,mptcp dss ack 2097709625 seq 2398207108 subseq 278498 len 1428 csum 0x3589], length 1428
17:22:18.281341 IP 112.26.0.8.55612 > 112.26.0.1.targus-getdata1: Flags [.], seq 12853:14281, ack 0, win 4107, options [nop,nop,TS val 4294883945 ecr 139669,mptcp dss ack 2097709625 seq 2398177120 subseq 271358 len 1428 csum 0xae9e], length 1428
17:22:18.289704 IP 112.26.0.8.55612 > 112.26.0.1.targus-getdata1: Flags [.], seq 12853:14281, ack 0, win 4107, options [nop,nop,TS val 4294883945 ecr 139669,mptcp dss ack 2097709625 seq 2398177120 subseq 271358 len 1428 csum 0xae9e], length 1428
17:22:18.354137 IP 112.26.0.8.55612 > 112.26.0.1.targus-getdata1: Flags [.], seq 14281:15709, ack 0, win 4107, options [nop,nop,TS val 4294884099 ecr 139830,mptcp dss ack 2097709625 seq 2398184260 subseq 272786 len 1428 csum 0xc0db], length 1428
17:22:18.383502 IP 112.26.0.8.55612 > 112.26.0.1.targus-getdata1: Flags [.], seq 14281:15709, ack 0, win 4107, options [nop,nop,TS val 4294884099 ecr 139830,mptcp dss ack 2097709625 seq 2398184260 subseq 272786 len 1428 csum 0xc0db], length 1428
17:22:18.421887 IP 112.26.0.1.targus-getdata1 > 112.26.0.8.55612: Flags [.], ack 9997, win 24272, options [nop,nop,TS val 140472 ecr 4294883415,mptcp dss ack 2397988624], length 0
17:22:18.425924 IP 112.26.0.8.55612 > 112.26.0.1.targus-getdata1: Flags [.], seq 21421:22849, ack 0, win 4107, options [nop,nop,TS val 4294884788 ecr 140472,mptcp dss ack 2097709625 seq 2398215676 subseq 279926 len 1428 csum 0x9210], length 1428
17:22:18.482203 IP 112.26.0.8.55612 > 112.26.0.1.targus-getdata1: Flags [.], seq 15709:17137, ack 0, win 4107, options [nop,nop,TS val 4294884270 ecr 139979,mptcp dss ack 2097709625 seq 2398189972 subseq 274214 len 1428 csum 0x22b3], length 1428
17:22:18.485983 IP 112.26.0.8.55612 > 112.26.0.1.targus-getdata1: Flags [.], seq 15709:17137, ack 0, win 4107, options [nop,nop,TS val 4294884270 ecr 139979,mptcp dss ack 2097709625 seq 2398189972 subseq 274214 len 1428 csum 0x22b3], length 1428
17:22:18.559875 IP 112.26.0.8.55612 > 112.26.0.1.targus-getdata1: Flags [.], seq 17137:18565, ack 0, win 4107, options [nop,nop,TS val 4294884270 ecr 139979,mptcp dss ack 2097709625 seq 2398191400 subseq 275642 len 1428 csum 0xe33b], length 1428
17:22:18.584551 IP 112.26.0.8.55612 > 112.26.0.1.targus-getdata1: Flags [.], seq 17137:18565, ack 0, win 4107, options [nop,nop,TS val 4294884270 ecr 139979,mptcp dss ack 2097709625 seq 2398191400 subseq 275642 len 1428 csum 0xe33b], length 1428
17:22:18.592064 IP 112.26.0.1.targus-getdata1 > 112.26.0.8.55612: Flags [.], ack 18565, win 24272, options [nop,nop,TS val 141296 ecr 4294883945,mptcp dss ack 2397988624], length 0
17:22:18.632271 IP 112.26.0.1.targus-getdata1 > 112.26.0.8.55612: Flags [.], ack 12853, win 24272, options [nop,nop,TS val 140740 ecr 4294883566,mptcp dss ack 2397988624], length 0
17:22:18.647218 IP 112.26.0.8.55612 > 112.26.0.1.targus-getdata1: Flags [.], seq 22849:24277, ack 0, win 4107, options [nop,nop,TS val 4294884999 ecr 140740,mptcp dss ack 2097709625 seq 2398229956 subseq 281354 len 1428 csum 0x5f2d], length 1428
17:22:18.679710 IP 112.26.0.8.55612 > 112.26.0.1.targus-getdata1: Flags [.], seq 24277:25705, ack 0, win 4107, options [nop,nop,TS val 4294884999 ecr 140740,mptcp dss ack 2097709625 seq 2398231384 subseq 282782 len 1428 csum 0x3d8], length 1428
17:22:18.703888 IP 112.26.0.8.55612 > 112.26.0.1.targus-getdata1: Flags [.], seq 18565:19993, ack 0, win 4107, options [nop,nop,TS val 4294884496 ecr 140137,mptcp dss ack 2097709625 seq 2398198540 subseq 277070 len 1428 csum 0xc4f1], length 1428
17:22:18.708510 IP 112.26.0.8.55612 > 112.26.0.1.targus-getdata1: Flags [.], seq 18565:19993, ack 0, win 4107, options [nop,nop,TS val 4294884496 ecr 140137,mptcp dss ack 2097709625 seq 2398198540 subseq 277070 len 1428 csum 0xc4f1], length 1428
17:22:18.750431 IP 112.26.0.8.55612 > 112.26.0.1.targus-getdata1: Flags [.], seq 25705:27133, ack 0, win 4107, options [nop,nop,TS val 4294884999 ecr 140740,mptcp dss ack 2097709625 seq 2398232812 subseq 284210 len 1428 csum 0xf51a], length 1428
17:22:18.770699 IP 112.26.0.8.55612 > 112.26.0.1.targus-getdata1: Flags [.], seq 19993:21421, ack 0, win 4107, options [nop,nop,TS val 4294884568 ecr 140277,mptcp dss ack 2097709625 seq 2398207108 subseq 278498 len 1428 csum 0x3589], length 1428
17:22:18.773749 IP 112.26.0.8.55612 > 112.26.0.1.targus-getdata1: Flags [.], seq 19993:21421, ack 0, win 4107, options [nop,nop,TS val 4294884568 ecr 140277,mptcp dss ack 2097709625 seq 2398207108 subseq 278498 len 1428 csum 0x3589], length 1428
17:22:18.921542 IP 112.26.0.8.55612 > 112.26.0.1.targus-getdata1: Flags [.], seq 21421:22849, ack 0, win 4107, options [nop,nop,TS val 4294884788 ecr 140472,mptcp dss ack 2097709625 seq 2398215676 subseq 279926 len 1428 csum 0x9210], length 1428
17:22:18.947490 IP 112.26.0.8.55612 > 112.26.0.1.targus-getdata1: Flags [.], seq 21421:22849, ack 0, win 4107, options [nop,nop,TS val 4294884788 ecr 140472,mptcp dss ack 2097709625 seq 2398215676 subseq 279926 len 1428 csum 0x9210], length 1428
17:22:18.955132 IP 112.26.0.1.targus-getdata1 > 112.26.0.8.55612: Flags [.], ack 22849, win 24272, options [nop,nop,TS val 141659 ecr 4294884496,mptcp dss ack 2397988624], length 0
17:22:19.045072 IP 112.26.0.1.targus-getdata1 > 112.26.0.8.55612: Flags [.], ack 18565, win 24272, options [nop,nop,TS val 141296 ecr 4294883945,mptcp dss ack 2397988624], length 0
17:22:19.048924 IP 112.26.0.8.55612 > 112.26.0.1.targus-getdata1: Flags [.], seq 27133:28561, ack 0, win 4107, options [nop,nop,TS val 4294885412 ecr 141296,mptcp dss ack 2097709625 seq 2398247092 subseq 285638 len 1428 csum 0x975c], length 1428
17:22:19.112905 IP 112.26.0.8.55612 > 112.26.0.1.targus-getdata1: Flags [.], seq 22849:24277, ack 0, win 4107, options [nop,nop,TS val 4294884999 ecr 140740,mptcp dss ack 2097709625 seq 2398229956 subseq 281354 len 1428 csum 0x5f2d], length 1428
17:22:19.114892 IP 112.26.0.8.55612 > 112.26.0.1.targus-getdata1: Flags [.], seq 22849:24277, ack 0, win 4107, options [nop,nop,TS val 4294884999 ecr 140740,mptcp dss ack 2097709625 seq 2398229956 subseq 281354 len 1428 csum 0x5f2d], length 1428
17:22:19.147960 IP 112.26.0.8.55612 > 112.26.0.1.targus-getdata1: Flags [.], seq 28561:29989, ack 0, win 4107, options [nop,nop,TS val 4294885412 ecr 141296,mptcp dss ack 2097709625 seq 2398248520 subseq 287066 len 1428 csum 0x7b8b], length 1428
17:22:19.184694 IP 112.26.0.8.55612 > 112.26.0.1.targus-getdata1: Flags [.], seq 24277:25705, ack 0, win 4107, options [nop,nop,TS val 4294884999 ecr 140740,mptcp dss ack 2097709625 seq 2398231384 subseq 282782 len 1428 csum 0x3d8], length 1428
17:22:19.186390 IP 112.26.0.8.55612 > 112.26.0.1.targus-getdata1: Flags [.], seq 24277:25705, ack 0, win 4107, options [nop,nop,TS val 4294884999 ecr 140740,mptcp dss ack 2097709625 seq 2398231384 subseq 282782 len 1428 csum 0x3d8], length 1428
17:22:19.260290 IP 112.26.0.8.55612 > 112.26.0.1.targus-getdata1: Flags [.], seq 29989:31417, ack 0, win 4107, options [nop,nop,TS val 4294885412 ecr 141296,mptcp dss ack 2097709625 seq 2398249948 subseq 288494 len 1428 csum 0xb2ac], length 1428
17:22:19.284144 IP 112.26.0.8.55612 > 112.26.0.1.targus-getdata1: Flags [.], seq 25705:27133, ack 0, win 4107, options [nop,nop,TS val 4294884999 ecr 140740,mptcp dss ack 2097709625 seq 2398232812 subseq 284210 len 1428 csum 0xf51a], length 1428
17:22:19.308309 IP 112.26.0.8.55612 > 112.26.0.1.targus-getdata1: Flags [.], seq 25705:27133, ack 0, win 4107, options [nop,nop,TS val 4294884999 ecr 140740,mptcp dss ack 2097709625 seq 2398232812 subseq 284210 len 1428 csum 0xf51a], length 1428
17:22:19.343691 IP 112.26.0.8.55612 > 112.26.0.1.targus-getdata1: Flags [.], seq 31417:32845, ack 0, win 4107, options [nop,nop,TS val 4294885412 ecr 141296,mptcp dss ack 2097709625 seq 2398251376 subseq 289922 len 1428 csum 0xad97], length 1428
17:22:19.399424 IP 112.26.0.8.55612 > 112.26.0.1.targus-getdata1: Flags [.], seq 32845:34273, ack 0, win 4107, options [nop,nop,TS val 4294885412 ecr 141296,mptcp dss ack 2097709625 seq 2398252804 subseq 291350 len 1428 csum 0x91cb], length 1428
17:22:19.410675 IP 112.26.0.1.targus-getdata1 > 112.26.0.8.55612: Flags [.], ack 27133, win 24272, options [nop,nop,TS val 142120 ecr 4294884999,mptcp dss ack 2397988624], length 0
17:22:19.423539 IP 112.26.0.1.targus-getdata1 > 112.26.0.8.55612: Flags [.], ack 22849, win 24272, options [nop,nop,TS val 141659 ecr 4294884496,mptcp dss ack 2397988624], length 0
17:22:19.465637 IP 112.26.0.8.55612 > 112.26.0.1.targus-getdata1: Flags [.], seq 27133:28561, ack 0, win 4107, options [nop,nop,TS val 4294885412 ecr 141296,mptcp dss ack 2097709625 seq 2398247092 subseq 285638 len 1428 csum 0x975c], length 1428
17:22:19.483494 IP 112.26.0.8.55612 > 112.26.0.1.targus-getdata1: Flags [.], seq 34273:35701, ack 0, win 4107, options [nop,nop,TS val 4294885412 ecr 141296,mptcp dss ack 2097709625 seq 2398254232 subseq 292778 len 1428 csum 0xbc81], length 1428
17:22:19.526251 IP 112.26.0.8.55612 > 112.26.0.1.targus-getdata1: Flags [.], seq 27133:28561, ack 0, win 4107, options [nop,nop,TS val 4294885412 ecr 141296,mptcp dss ack 2097709625 seq 2398247092 subseq 285638 len 1428 csum 0x975c], length 1428
17:22:19.559894 IP 112.26.0.8.55612 > 112.26.0.1.targus-getdata1: Flags [.], seq 28561:29989, ack 0, win 4107, options [nop,nop,TS val 4294885412 ecr 141296,mptcp dss ack 2097709625 seq 2398248520 subseq 287066 len 1428 csum 0x7b8b], length 1428
17:22:19.573756 IP 112.26.0.8.55612 > 112.26.0.1.targus-getdata1: Flags [.], seq 28561:29989, ack 0, win 4107, options [nop,nop,TS val 4294885412 ecr 141296,mptcp dss ack 2097709625 seq 2398248520 subseq 287066 len 1428 csum 0x7b8b], length 1428
17:22:19.596450 IP 112.26.0.8.55612 > 112.26.0.1.targus-getdata1: Flags [.], seq 35701:37129, ack 0, win 4107, options [nop,nop,TS val 4294885412 ecr 141296,mptcp dss ack 2097709625 seq 2398255660 subseq 294206 len 1428 csum 0x562f], length 1428
17:22:19.663282 IP 112.26.0.8.55612 > 112.26.0.1.targus-getdata1: Flags [.], seq 29989:31417, ack 0, win 4107, options [nop,nop,TS val 4294885412 ecr 141296,mptcp dss ack 2097709625 seq 2398249948 subseq 288494 len 1428 csum 0xb2ac], length 1428
17:22:19.669244 IP 112.26.0.8.55612 > 112.26.0.1.targus-getdata1: Flags [.], seq 29989:31417, ack 0, win 4107, options [nop,nop,TS val 4294885412 ecr 141296,mptcp dss ack 2097709625 seq 2398249948 subseq 288494 len 1428 csum 0xb2ac], length 1428
17:22:19.688221 IP 112.26.0.8.55612 > 112.26.0.1.targus-getdata1: Flags [.], seq 37129:38557, ack 0, win 4107, options [nop,nop,TS val 4294885790 ecr 141659,mptcp dss ack 2097709625 seq 2398271368 subseq 295634 len 1428 csum 0x2a12], length 1428
17:22:19.754780 IP 112.26.0.8.55612 > 112.26.0.1.targus-getdata1: Flags [.], seq 38557:39985, ack 0, win 4107, options [nop,nop,TS val 4294885790 ecr 141659,mptcp dss ack 2097709625 seq 2398272796 subseq 297062 len 1428 csum 0x3698], length 1428
17:22:19.769404 IP 112.26.0.8.55612 > 112.26.0.1.targus-getdata1: Flags [.], seq 31417:32845, ack 0, win 4107, options [nop,nop,TS val 4294885412 ecr 141296,mptcp dss ack 2097709625 seq 2398251376 subseq 289922 len 1428 csum 0xad97], length 1428
17:22:19.772333 IP 112.26.0.8.55612 > 112.26.0.1.targus-getdata1: Flags [.], seq 31417:32845, ack 0, win 4107, options [nop,nop,TS val 4294885412 ecr 141296,mptcp dss ack 2097709625 seq 2398251376 subseq 289922 len 1428 csum 0xad97], length 1428
17:22:19.781287 IP 112.26.0.1.targus-getdata1 > 112.26.0.8.55612: Flags [.], ack 32845, win 24272, options [nop,nop,TS val 142484 ecr 4294885412,mptcp dss ack 2397988624], length 0
17:22:19.831485 IP 112.26.0.8.55612 > 112.26.0.1.targus-getdata1: Flags [.], seq 39985:41413, ack 0, win 4107, options [nop,nop,TS val 4294885790 ecr 141659,mptcp dss ack 2097709625 seq 2398274224 subseq 298490 len 1428 csum 0x3810], length 1428
17:22:19.887453 IP 112.26.0.8.55612 > 112.26.0.1.targus-getdata1: Flags [.], seq 32845:34273, ack 0, win 4107, options [nop,nop,TS val 4294885412 ecr 141296,mptcp dss ack 2097709625 seq 2398252804 subseq 291350 len 1428 csum 0x91cb], length 1428
17:22:19.889831 IP 112.26.0.8.55612 > 112.26.0.1.targus-getdata1: Flags [.], seq 32845:34273, ack 0, win 4107, options [nop,nop,TS val 4294885412 ecr 141296,mptcp dss ack 2097709625 seq 2398252804 subseq 291350 len 1428 csum 0x91cb], length 1428
17:22:19.988363 IP 112.26.0.1.targus-getdata1 > 112.26.0.8.55612: Flags [.], ack 27133, win 24272, options [nop,nop,TS val 142120 ecr 4294884999,mptcp dss ack 2397988624], length 0
17:22:19.992310 IP 112.26.0.8.55612 > 112.26.0.1.targus-getdata1: Flags [.], seq 41413:42841, ack 0, win 4107, options [nop,nop,TS val 4294886355 ecr 142120,mptcp dss ack 2097709625 seq 2398301356 subseq 299918 len 1428 csum 0xba2e], length 1428
17:22:20.031863 IP 112.26.0.8.55612 > 112.26.0.1.targus-getdata1: Flags [.], seq 34273:35701, ack 0, win 4107, options [nop,nop,TS val 4294885412 ecr 141296,mptcp dss ack 2097709625 seq 2398254232 subseq 292778 len 1428 csum 0xbc81], length 1428
17:22:20.037589 IP 112.26.0.8.55612 > 112.26.0.1.targus-getdata1: Flags [.], seq 34273:35701, ack 0, win 4107, options [nop,nop,TS val 4294885412 ecr 141296,mptcp dss ack 2097709625 seq 2398254232 subseq 292778 len 1428 csum 0xbc81], length 1428
17:22:20.168257 IP 112.26.0.1.targus-getdata1 > 112.26.0.8.55612: Flags [.], ack 35701, win 24272, options [nop,nop,TS val 142832 ecr 4294885412,mptcp dss ack 2397988624], length 0
17:22:20.205369 IP 112.26.0.8.55612 > 112.26.0.1.targus-getdata1: Flags [.], seq 42841:44269, ack 0, win 4107, options [nop,nop,TS val 4294886355 ecr 142120,mptcp dss ack 2097709625 seq 2398302784 subseq 301346 len 1428 csum 0x5541], length 1428
17:22:20.239665 IP 112.26.0.8.55612 > 112.26.0.1.targus-getdata1: Flags [.], seq 44269:45697, ack 0, win 4107, options [nop,nop,TS val 4294886355 ecr 142120,mptcp dss ack 2097709625 seq 2398304212 subseq 302774 len 1428 csum 0x9656], length 1428
17:22:20.259462 IP 112.26.0.8.55612 > 112.26.0.1.targus-getdata1: Flags [.], seq 35701:37129, ack 0, win 4107, options [nop,nop,TS val 4294885412 ecr 141296,mptcp dss ack 2097709625 seq 2398255660 subseq 294206 len 1428 csum 0x562f], length 1428
17:22:20.269877 IP 112.26.0.8.55612 > 112.26.0.1.targus-getdata1: Flags [.], seq 35701:37129, ack 0, win 4107, options [nop,nop,TS val 4294885412 ecr 141296,mptcp dss ack 2097709625 seq 2398255660 subseq 294206 len 1428 csum 0x562f], length 1428
17:22:20.362682 IP 112.26.0.8.55612 > 112.26.0.1.targus-getdata1: Flags [.], seq 37129:38557, ack 0, win 4107, options [nop,nop,TS val 4294885790 ecr 141659,mptcp dss ack 2097709625 seq 2398271368 subseq 295634 len 1428 csum 0x2a12], length 1428
17:22:20.392993 IP 112.26.0.8.55612 > 112.26.0.1.targus-getdata1: Flags [.], seq 37129:38557, ack 0, win 4107, options [nop,nop,TS val 4294885790 ecr 141659,mptcp dss ack 2097709625 seq 2398271368 subseq 295634 len 1428 csum 0x2a12], length 1428
17:22:20.418584 IP 112.26.0.1.targus-getdata1 > 112.26.0.8.55612: Flags [.], ack 38557, win 22787, options [nop,nop,TS val 143123 ecr 4294885412,mptcp dss ack 2398238524], length 0
17:22:20.454525 IP 112.26.0.8.55612 > 112.26.0.1.targus-getdata1: Flags [.], seq 38557:39985, ack 0, win 4107, options [nop,nop,TS val 4294885790 ecr 141659,mptcp dss ack 2097709625 seq 2398272796 subseq 297062 len 1428 csum 0x3698], length 1428
17:22:20.483753 IP 112.26.0.8.55612 > 112.26.0.1.targus-getdata1: Flags [.], seq 38557:39985, ack 0, win 4107, options [nop,nop,TS val 4294885790 ecr 141659,mptcp dss ack 2097709625 seq 2398272796 subseq 297062 len 1428 csum 0x3698], length 1428
17:22:20.546354 IP 112.26.0.1.targus-getdata1 > 112.26.0.8.55612: Flags [.], ack 32845, win 24272, options [nop,nop,TS val 142484 ecr 4294885412,mptcp dss ack 2397988624], length 0
17:22:20.550192 IP 112.26.0.8.55612 > 112.26.0.1.targus-getdata1: Flags [.], seq 45697:47125, ack 0, win 4107, options [nop,nop,TS val 4294886913 ecr 142484,mptcp dss ack 2097709625 seq 2398318492 subseq 304202 len 1428 csum 0xa8ef], length 1428
17:22:20.589962 IP 112.26.0.8.55612 > 112.26.0.1.targus-getdata1: Flags [.], seq 39985:41413, ack 0, win 4107, options [nop,nop,TS val 4294885790 ecr 141659,mptcp dss ack 2097709625 seq 2398274224 subseq 298490 len 1428 csum 0x3810], length 1428
17:22:20.591939 IP 112.26.0.8.55612 > 112.26.0.1.targus-getdata1: Flags [.], seq 39985:41413, ack 0, win 4107, options [nop,nop,TS val 4294885790 ecr 141659,mptcp dss ack 2097709625 seq 2398274224 subseq 298490 len 1428 csum 0x3810], length 1428
17:22:20.599328 IP 112.26.0.1.targus-getdata1 > 112.26.0.8.55612: Flags [.], ack 41413, win 24226, options [nop,nop,TS val 143304 ecr 4294885790,mptcp dss ack 2398238524], length 0
17:22:20.656114 IP 112.26.0.8.55612 > 112.26.0.1.targus-getdata1: Flags [.], seq 47125:48553, ack 0, win 4107, options [nop,nop,TS val 4294886913 ecr 142484,mptcp dss ack 2097709625 seq 2398319920 subseq 305630 len 1428 csum 0x1185], length 1428
17:22:20.703343 IP 112.26.0.8.55612 > 112.26.0.1.targus-getdata1: Flags [.], seq 41413:42841, ack 0, win 4107, options [nop,nop,TS val 4294886355 ecr 142120,mptcp dss ack 2097709625 seq 2398301356 subseq 299918 len 1428 csum 0xba2e], length 1428
17:22:20.717618 IP 112.26.0.8.55612 > 112.26.0.1.targus-getdata1: Flags [.], seq 41413:42841, ack 0, win 4107, options [nop,nop,TS val 4294886355 ecr 142120,mptcp dss ack 2097709625 seq 2398301356 subseq 299918 len 1428 csum 0xba2e], length 1428
17:22:20.756095 IP 112.26.0.8.55612 > 112.26.0.1.targus-getdata1: Flags [.], seq 48553:49981, ack 0, win 4107, options [nop,nop,TS val 4294886913 ecr 142484,mptcp dss ack 2097709625 seq 2398321348 subseq 307058 len 1428 csum 0x65ae], length 1428
17:22:20.807353 IP 112.26.0.1.targus-getdata1 > 112.26.0.8.55612: Flags [.], ack 35701, win 24272, options [nop,nop,TS val 142832 ecr 4294885412,mptcp dss ack 2397988624], length 0
17:22:20.831457 IP 112.26.0.8.55612 > 112.26.0.1.targus-getdata1: Flags [.], seq 49981:51409, ack 0, win 4107, options [nop,nop,TS val 4294886913 ecr 142484,mptcp dss ack 2097709625 seq 2398322776 subseq 308486 len 1428 csum 0xd74f], length 1428
17:22:20.899531 IP 112.26.0.8.55612 > 112.26.0.1.targus-getdata1: Flags [.], seq 51409:52837, ack 0, win 4107, options [nop,nop,TS val 4294887173 ecr 142832,mptcp dss ack 2097709625 seq 2398331344 subseq 309914 len 1428 csum 0x39cd], length 1428
17:22:20.930938 IP 112.26.0.8.55612 > 112.26.0.1.targus-getdata1: Flags [.], seq 42841:44269, ack 0, win 4107, options [nop,nop,TS val 4294886355 ecr 142120,mptcp dss ack 2097709625 seq 2398302784 subseq 301346 len 1428 csum 0x5541], length 1428
17:22:20.933428 IP 112.26.0.8.55612 > 112.26.0.1.targus-getdata1: Flags [.], seq 42841:44269, ack 0, win 4107, options [nop,nop,TS val 4294886355 ecr 142120,mptcp dss ack 2097709625 seq 2398302784 subseq 301346 len 1428 csum 0x5541], length 1428
17:22:20.944589 IP 112.26.0.1.targus-getdata1 > 112.26.0.8.55612: Flags [.], ack 44269, win 24226, options [nop,nop,TS val 143645 ecr 4294886355,mptcp dss ack 2398238524], length 0
17:22:20.978193 IP 112.26.0.8.55612 > 112.26.0.1.targus-getdata1: Flags [.], seq 52837:54265, ack 0, win 4107, options [nop,nop,TS val 4294887173 ecr 142832,mptcp dss ack 2097709625 seq 2398332772 subseq 311342 len 1428 csum 0x1f1f], length 1428
17:22:21.051294 IP 112.26.0.8.55612 > 112.26.0.1.targus-getdata1: Flags [.], seq 44269:45697, ack 0, win 4107, options [nop,nop,TS val 4294886355 ecr 142120,mptcp dss ack 2097709625 seq 2398304212 subseq 302774 len 1428 csum 0x9656], length 1428
17:22:21.066013 IP 112.26.0.8.55612 > 112.26.0.1.targus-getdata1: Flags [.], seq 54265:55693, ack 0, win 4107, options [nop,nop,TS val 4294887173 ecr 142832,mptcp dss ack 2097709625 seq 2398334200 subseq 312770 len 1428 csum 0xc5ed], length 1428
17:22:21.073044 IP 112.26.0.8.55612 > 112.26.0.1.targus-getdata1: Flags [.], seq 44269:45697, ack 0, win 4107, options [nop,nop,TS val 4294886355 ecr 142120,mptcp dss ack 2097709625 seq 2398304212 subseq 302774 len 1428 csum 0x9656], length 1428
17:22:21.135870 IP 112.26.0.1.targus-getdata1 > 112.26.0.8.55612: Flags [.], ack 38557, win 22787, options [nop,nop,TS val 143123 ecr 4294885412,mptcp dss ack 2398238524], length 0
17:22:21.141507 IP 112.26.0.8.55612 > 112.26.0.1.targus-getdata1: Flags [.], seq 55693:57121, ack 0, win 4107, options [nop,nop,TS val 4294887502 ecr 143123,mptcp dss ack 2097709625 seq 2398344196 subseq 314198 len 1428 csum 0x2974], length 1428
17:22:21.221296 IP 112.26.0.8.55612 > 112.26.0.1.targus-getdata1: Flags [.], seq 57121:58549, ack 0, win 4107, options [nop,nop,TS val 4294887502 ecr 143123,mptcp dss ack 2097709625 seq 2398345624 subseq 315626 len 1428 csum 0x7d6b], length 1428
17:22:21.238548 IP 112.26.0.8.55612 > 112.26.0.1.targus-getdata1: Flags [.], seq 45697:47125, ack 0, win 4107, options [nop,nop,TS val 4294886913 ecr 142484,mptcp dss ack 2097709625 seq 2398318492 subseq 304202 len 1428 csum 0xa8ef], length 1428
17:22:21.242504 IP 112.26.0.8.55612 > 112.26.0.1.targus-getdata1: Flags [.], seq 45697:47125, ack 0, win 4107, options [nop,nop,TS val 4294886913 ecr 142484,mptcp dss ack 2097709625 seq 2398318492 subseq 304202 len 1428 csum 0xa8ef], length 1428
17:22:21.302461 IP 112.26.0.8.55612 > 112.26.0.1.targus-getdata1: Flags [.], seq 58549:59977, ack 0, win 4107, options [nop,nop,TS val 4294887502 ecr 143123,mptcp dss ack 2097709625 seq 2398347052 subseq 317054 len 1428 csum 0x10da], length 1428
17:22:21.318147 IP 112.26.0.1.targus-getdata1 > 112.26.0.8.55612: Flags [.], ack 41413, win 24226, options [nop,nop,TS val 143304 ecr 4294885790,mptcp dss ack 2398238524], length 0
17:22:21.368566 IP 112.26.0.1.targus-getdata1 > 112.26.0.8.55612: Flags [.], ack 47125, win 24102, options [nop,nop,TS val 144075 ecr 4294886355,mptcp dss ack 2398264228], length 0
17:22:21.396581 IP 112.26.0.8.55612 > 112.26.0.1.targus-getdata1: Flags [.], seq 59977:61405, ack 0, win 4107, options [nop,nop,TS val 4294887685 ecr 143304,mptcp dss ack 2097709625 seq 2398362760 subseq 318482 len 1428 csum 0x9372], length 1428
17:22:21.418546 IP 112.26.0.8.55612 > 112.26.0.1.targus-getdata1: Flags [.], seq 47125:48553, ack 0, win 4107, options [nop,nop,TS val 4294886913 ecr 142484,mptcp dss ack 2097709625 seq 2398319920 subseq 305630 len 1428 csum 0x1185], length 1428
17:22:21.428069 IP 112.26.0.8.55612 > 112.26.0.1.targus-getdata1: Flags [.], seq 47125:48553, ack 0, win 4107, options [nop,nop,TS val 4294886913 ecr 142484,mptcp dss ack 2097709625 seq 2398319920 subseq 305630 len 1428 csum 0x1185], length 1428
17:22:21.441743 IP 112.26.0.8.55612 > 112.26.0.1.targus-getdata1: Flags [.], seq 61405:62833, ack 0, win 4107, options [nop,nop,TS val 4294887685 ecr 143304,mptcp dss ack 2097709625 seq 2398364188 subseq 319910 len 1428 csum 0x716a], length 1428
17:22:21.518174 IP 112.26.0.8.55612 > 112.26.0.1.targus-getdata1: Flags [.], seq 48553:49981, ack 0, win 4107, options [nop,nop,TS val 4294886913 ecr 142484,mptcp dss ack 2097709625 seq 2398321348 subseq 307058 len 1428 csum 0x65ae], length 1428
17:22:21.532028 IP 112.26.0.8.55612 > 112.26.0.1.targus-getdata1: Flags [.], seq 48553:49981, ack 0, win 4107, options [nop,nop,TS val 4294886913 ecr 142484,mptcp dss ack 2097709625 seq 2398321348 subseq 307058 len 1428 csum 0x65ae], length 1428
17:22:21.572846 IP 112.26.0.1.targus-getdata1 > 112.26.0.8.55612: Flags [.], ack 49981, win 24169, options [nop,nop,TS val 144280 ecr 4294886913,mptcp dss ack 2398278508], length 0
17:22:21.623032 IP 112.26.0.8.55612 > 112.26.0.1.targus-getdata1: Flags [.], seq 49981:51409, ack 0, win 4107, options [nop,nop,TS val 4294886913 ecr 142484,mptcp dss ack 2097709625 seq 2398322776 subseq 308486 len 1428 csum 0xd74f], length 1428
17:22:21.638478 IP 112.26.0.8.55612 > 112.26.0.1.targus-getdata1: Flags [.], seq 49981:51409, ack 0, win 4107, options [nop,nop,TS val 4294886913 ecr 142484,mptcp dss ack 2097709625 seq 2398322776 subseq 308486 len 1428 csum 0xd74f], length 1428
17:22:21.732547 IP 112.26.0.8.55612 > 112.26.0.1.targus-getdata1: Flags [.], seq 51409:52837, ack 0, win 4107, options [nop,nop,TS val 4294887173 ecr 142832,mptcp dss ack 2097709625 seq 2398331344 subseq 309914 len 1428 csum 0x39cd], length 1428
17:22:21.735624 IP 112.26.0.8.55612 > 112.26.0.1.targus-getdata1: Flags [.], seq 51409:52837, ack 0, win 4107, options [nop,nop,TS val 4294887173 ecr 142832,mptcp dss ack 2097709625 seq 2398331344 subseq 309914 len 1428 csum 0x39cd], length 1428
17:22:21.770312 IP 112.26.0.1.targus-getdata1 > 112.26.0.8.55612: Flags [.], ack 52837, win 24136, options [nop,nop,TS val 144475 ecr 4294886913,mptcp dss ack 2398289932], length 0
17:22:21.815019 IP 112.26.0.8.55612 > 112.26.0.1.targus-getdata1: Flags [.], seq 52837:54265, ack 0, win 4107, options [nop,nop,TS val 4294887173 ecr 142832,mptcp dss ack 2097709625 seq 2398332772 subseq 311342 len 1428 csum 0x1f1f], length 1428
17:22:21.830142 IP 112.26.0.8.55612 > 112.26.0.1.targus-getdata1: Flags [.], seq 52837:54265, ack 0, win 4107, options [nop,nop,TS val 4294887173 ecr 142832,mptcp dss ack 2097709625 seq 2398332772 subseq 311342 len 1428 csum 0x1f1f], length 1428
17:22:21.925952 IP 112.26.0.8.55612 > 112.26.0.1.targus-getdata1: Flags [.], seq 55693:57121, ack 0, win 4107, options [nop,nop,TS val 4294887502 ecr 143123,mptcp dss ack 2097709625 seq 2398344196 subseq 314198 len 1428 csum 0x2974], length 1428
17:22:21.928373 IP 112.26.0.8.55612 > 112.26.0.1.targus-getdata1: Flags [.], seq 55693:57121, ack 0, win 4107, options [nop,nop,TS val 4294887502 ecr 143123,mptcp dss ack 2097709625 seq 2398344196 subseq 314198 len 1428 csum 0x2974], length 1428
17:22:21.935983 IP 112.26.0.1.targus-getdata1 > 112.26.0.8.55612: Flags [.], ack 54265, win 24136, options [nop,nop,TS val 144640 ecr 4294887173,nop,nop,sack 1 {55693:57121},mptcp dss ack 2398289932], length 0
17:22:22.040162 IP 112.26.0.8.55612 > 112.26.0.1.targus-getdata1: Flags [.], seq 57121:58549, ack 0, win 4107, options [nop,nop,TS val 4294887502 ecr 143123,mptcp dss ack 2097709625 seq 2398345624 subseq 315626 len 1428 csum 0x7d6b], length 1428
17:22:22.044266 IP 112.26.0.8.55612 > 112.26.0.1.targus-getdata1: Flags [.], seq 57121:58549, ack 0, win 4107, options [nop,nop,TS val 4294887502 ecr 143123,mptcp dss ack 2097709625 seq 2398345624 subseq 315626 len 1428 csum 0x7d6b], length 1428
17:22:22.053791 IP 112.26.0.1.targus-getdata1 > 112.26.0.8.55612: Flags [.], ack 54265, win 24401, options [nop,nop,TS val 144756 ecr 4294887173,nop,nop,sack 1 {55693:58549},mptcp dss ack 2398325632], length 0
17:22:22.128110 IP 112.26.0.8.55612 > 112.26.0.1.targus-getdata1: Flags [.], seq 58549:59977, ack 0, win 4107, options [nop,nop,TS val 4294887502 ecr 143123,mptcp dss ack 2097709625 seq 2398347052 subseq 317054 len 1428 csum 0x10da], length 1428
17:22:22.139113 IP 112.26.0.8.55612 > 112.26.0.1.targus-getdata1: Flags [.], seq 58549:59977, ack 0, win 4107, options [nop,nop,TS val 4294887502 ecr 143123,mptcp dss ack 2097709625 seq 2398347052 subseq 317054 len 1428 csum 0x10da], length 1428
17:22:22.163212 IP 112.26.0.1.targus-getdata1 > 112.26.0.8.55612: Flags [.], ack 54265, win 24401, options [nop,nop,TS val 144851 ecr 4294887173,nop,nop,sack 1 {55693:59977},mptcp dss ack 2398325632], length 0
17:22:22.215074 IP 112.26.0.8.55612 > 112.26.0.1.targus-getdata1: Flags [.], seq 59977:61405, ack 0, win 4107, options [nop,nop,TS val 4294887685 ecr 143304,mptcp dss ack 2097709625 seq 2398362760 subseq 318482 len 1428 csum 0x9372], length 1428
17:22:22.267220 IP 112.26.0.8.55612 > 112.26.0.1.targus-getdata1: Flags [.], seq 59977:61405, ack 0, win 4107, options [nop,nop,TS val 4294887685 ecr 143304,mptcp dss ack 2097709625 seq 2398362760 subseq 318482 len 1428 csum 0x9372], length 1428
17:22:22.279255 IP 112.26.0.1.targus-getdata1 > 112.26.0.8.55612: Flags [.], ack 54265, win 24401, options [nop,nop,TS val 144979 ecr 4294887173,nop,nop,sack 1 {55693:61405},mptcp dss ack 2398325632], length 0
17:22:22.329845 IP 112.26.0.1.targus-getdata1 > 112.26.0.8.55612: Flags [.], ack 49981, win 24169, options [nop,nop,TS val 144280 ecr 4294886913,mptcp dss ack 2398278508], length 0
17:22:22.333178 IP 112.26.0.8.55612 > 112.26.0.1.targus-getdata1: Flags [.], seq 62833:64261, ack 0, win 4107, options [nop,nop,TS val 4294888697 ecr 144280,mptcp dss ack 2097709625 seq 2398407028 subseq 321338 len 1428 csum 0x9692], length 1428
17:22:22.444774 IP 112.26.0.8.55612 > 112.26.0.1.targus-getdata1: Flags [.], seq 64261:65689, ack 0, win 4107, options [nop,nop,TS val 4294888697 ecr 144280,mptcp dss ack 2097709625 seq 2398408456 subseq 322766 len 1428 csum 0xefca], length 1428
17:22:22.451669 IP 112.26.0.1.targus-getdata1 > 112.26.0.8.55612: Flags [.], ack 52837, win 24136, options [nop,nop,TS val 144475 ecr 4294886913,mptcp dss ack 2398289932], length 0
17:22:22.524724 IP 112.26.0.1.targus-getdata1 > 112.26.0.8.55612: Flags [.], ack 54265, win 24136, options [nop,nop,TS val 144640 ecr 4294887173,nop,nop,sack 1 {55693:57121},mptcp dss ack 2398289932], length 0
17:22:22.527405 IP 112.26.0.8.55612 > 112.26.0.1.targus-getdata1: Flags [.], seq 65689:67117, ack 0, win 4107, options [nop,nop,TS val 4294888697 ecr 144280,mptcp dss ack 2097709625 seq 2398409884 subseq 324194 len 1428 csum 0x2210], length 1428
17:22:22.577428 IP 112.26.0.1.targus-getdata1 > 112.26.0.8.55612: Flags [.], ack 54265, win 24401, options [nop,nop,TS val 144756 ecr 4294887173,nop,nop,sack 1 {55693:58549},mptcp dss ack 2398325632], length 0
17:22:22.605498 IP 112.26.0.8.55612 > 112.26.0.1.targus-getdata1: Flags [.], seq 67117:68545, ack 0, win 4107, options [nop,nop,TS val 4294888697 ecr 144280,mptcp dss ack 2097709625 seq 2398411312 subseq 325622 len 1428 csum 0x1d29], length 1428
17:22:22.651225 IP 112.26.0.1.targus-getdata1 > 112.26.0.8.55612: Flags [.], ack 54265, win 24401, options [nop,nop,TS val 144851 ecr 4294887173,nop,nop,sack 1 {55693:59977},mptcp dss ack 2398325632], length 0
17:22:22.694433 IP 112.26.0.8.55612 > 112.26.0.1.targus-getdata1: Flags [.], seq 68545:69973, ack 0, win 4107, options [nop,nop,TS val 4294888697 ecr 144280,mptcp dss ack 2097709625 seq 2398412740 subseq 327050 len 1428 csum 0x5509], length 1428
17:22:22.724279 IP 112.26.0.1.targus-getdata1 > 112.26.0.8.55612: Flags [.], ack 54265, win 24401, options [nop,nop,TS val 144979 ecr 4294887173,nop,nop,sack 1 {55693:61405},mptcp dss ack 2398325632], length 0
17:22:22.747583 IP 112.26.0.8.55612 > 112.26.0.1.targus-getdata1: Flags [.], seq 69973:71401, ack 0, win 4107, options [nop,nop,TS val 4294888697 ecr 144280,mptcp dss ack 2097709625 seq 2398414168 subseq 328478 len 1428 csum 0x811d], length 1428
17:22:22.764266 IP 112.26.0.8.55612 > 112.26.0.1.targus-getdata1: Flags [.], seq 62833:64261, ack 0, win 4107, options [nop,nop,TS val 4294888697 ecr 144280,mptcp dss ack 2097709625 seq 2398407028 subseq 321338 len 1428 csum 0x9692], length 1428
17:22:22.774498 IP 112.26.0.1.targus-getdata1 > 112.26.0.8.55612: Flags [.], ack 54265, win 24401, options [nop,nop,TS val 145479 ecr 4294887173,nop,nop,sack 2 {62833:64261}{55693:61405},mptcp dss ack 2398325632], length 0
17:22:22.780316 IP 112.26.0.8.55612 > 112.26.0.1.targus-getdata1: Flags [.], seq 62833:64261, ack 0, win 4107, options [nop,nop,TS val 4294888697 ecr 144280,mptcp dss ack 2097709625 seq 2398407028 subseq 321338 len 1428 csum 0x9692], length 1428
