17:21:39.241475 IP 112.26.0.8.55610 > 112.26.0.1.targus-getdata1: Flags [S], seq 2827260080, win 65535, options [mss 1460,sackOK,TS val 4294845470 ecr 0,nop,wscale 6,mptcp capable csum {0x622703ee8f7d13ee}], length 0
17:21:39.255981 IP 112.26.0.8.55610 > 112.26.0.1.targus-getdata1: Flags [S], seq 2827260080, win 65535, options [mss 1460,sackOK,TS val 4294845470 ecr 0,nop,wscale 6,mptcp capable csum {0x622703ee8f7d13ee}], length 0
17:21:40.161652 IP 112.26.0.8.55610 > 112.26.0.1.targus-getdata1: Flags [S], seq 2827260080, win 65535, options [mss 1460,sackOK,TS val 4294846528 ecr 0,nop,wscale 6,mptcp capable csum {0x622703ee8f7d13ee}], length 0
17:21:40.260432 IP 112.26.0.8.55610 > 112.26.0.1.targus-getdata1: Flags [S], seq 2827260080, win 65535, options [mss 1460,sackOK,TS val 4294846528 ecr 0,nop,wscale 6,mptcp capable csum {0x622703ee8f7d13ee}], length 0
17:21:40.356869 IP 112.26.0.1.targus-getdata1 > 112.26.0.8.55610: Flags [S.], seq 2442340864, ack 2827260081, win 65535, options [mss 1460,sackOK,TS val 102975 ecr 4294845470,nop,wscale 6,mptcp capable csum {0x723fcdbd34ba0730}], length 0
17:21:40.364409 IP 112.26.0.8.55610 > 112.26.0.1.targus-getdata1: Flags [.], ack 1, win 1369, options [nop,nop,TS val 4294846723 ecr 102975,mptcp capable csum {0x622703ee8f7d13ee,0x723fcdbd34ba0730},mptcp dss ack 2790937176], length 0
17:21:40.364438 IP 112.26.0.8.55610 > 112.26.0.1.targus-getdata1: Flags [.], ack 1, win 1369, options [nop,nop,TS val 4294846723 ecr 102975,mptcp add-addr id 4 112.26.2.8,mptcp dss ack 2790937176], length 0
17:22:17.199745 IP 112.26.0.1.targus-getdata1 > 112.26.0.8.55612: Flags [.], ack 1502065970, win 24272, options [nop,nop,TS val 139268 ecr 4294882355,mptcp dss ack 2397988624], length 0
17:22:17.200077 IP 112.26.0.8.55612 > 112.26.0.1.targus-getdata1: Flags [.], seq 9997:11425, ack 0, win 4107, options [nop,nop,TS val 4294883566 ecr 139268,mptcp dss ack 2097709625 seq 2398159984 subseq 268502 len 1428 csum 0xfeb1], length 1428
17:22:17.264867 IP 112.26.0.8.55612 > 112.26.0.1.targus-getdata1: Flags [.], seq 4285:5713, ack 0, win 4107, options [nop,nop,TS val 4294882829 ecr 138613,mptcp dss ack 2097709625 seq 2398131424 subseq 262790 len 1428 csum 0xaf7a], length 1428
17:22:17.357647 IP 112.26.0.1.targus-getdata1 > 112.26.0.8.55612: Flags [.], ack 1429, win 24272, options [nop,nop,TS val 139430 ecr 4294882596,mptcp dss ack 2397988624], length 0
17:22:17.357814 IP 112.26.0.8.55612 > 112.26.0.1.targus-getdata1: Flags [.], seq 11425:12853, ack 0, win 4107, options [nop,nop,TS val 4294883724 ecr 139430,mptcp dss ack 2097709625 seq 2398168552 subseq 269930 len 1428 csum 0xe9c9], length 1428
17:22:17.421313 IP 112.26.0.8.55612 > 112.26.0.1.targus-getdata1: Flags [.], seq 5713:7141, ack 0, win 4107, options [nop,nop,TS val 4294883152 ecr 138777,mptcp dss ack 2097709625 seq 2398139992 subseq 264218 len 1428 csum 0x28ad], length 1428
17:22:32.092361 IP 112.26.0.1.targus-getdata1 > 112.26.0.8.55612: Flags [.], ack 138517, win 24290, options [nop,nop,TS val 154085 ecr 4294896973,mptcp dss ack 2398719760], length 0
17:22:32.092702 IP 112.26.0.8.55612 > 112.26.0.1.targus-getdata1: Flags [.], seq 151369:152797, ack 0, win 4107, options [nop,nop,TS val 4294898458 ecr 154085,mptcp dss ack 2097709625 seq 2398835428 subseq 409874 len 1428 csum 0x90f1], length 1428
17:22:32.189620 IP 112.26.0.1.targus-getdata1 > 112.26.0.8.55612: Flags [.], ack 139945, win 24370, options [nop,nop,TS val 154186 ecr 4294896997,mptcp dss ack 2398739752], length 0
17:22:32.189970 IP 112.26.0.8.55612 > 112.26.0.1.targus-getdata1: Flags [.], seq 152797:154225, ack 0, win 4107, options [nop,nop,TS val 4294898556 ecr 154186,mptcp dss ack 2097709625 seq 2398839712 subseq 411302 len 1428 csum 0xcbb1], length 1428
17:22:32.259453 IP 112.26.0.8.55612 > 112.26.0.1.targus-getdata1: Flags [.], seq 145657:147085, ack 0, win 4107, options [nop,nop,TS val 4294897942 ecr 153488,mptcp dss ack 2097709625 seq 2398814008 subseq 404162 len 1428 csum 0xfe2], length 1428
17:22:32.353243 IP 112.26.0.1.targus-getdata1 > 112.26.0.8.55612: Flags [.], ack 141373, win 24370, options [nop,nop,TS val 154374 ecr 4294896997,mptcp dss ack 2398739752], length 0
17:22:32.353481 IP 112.26.0.8.55612 > 112.26.0.1.targus-getdata1: Flags [.], seq 154225:155653, ack 0, win 4107, options [nop,nop,TS val 4294898720 ecr 154374,mptcp dss ack 2097709625 seq 2398848280 subseq 412730 len 1428 csum 0xecc2], length 1428
17:22:32.353533 IP 112.26.0.8.55612 > 112.26.0.1.targus-getdata1: Flags [.], seq 155653:157081, ack 0, win 4107, options [nop,nop,TS val 4294898720 ecr 154374,mptcp dss ack 2097709625 seq 2398849708 subseq 414158 len 1428 csum 0x2d02], length 1428
17:22:32.501410 IP 112.26.0.1.targus-getdata1 > 112.26.0.8.55612: Flags [.], ack 142801, win 24326, options [nop,nop,TS val 154495 ecr 4294897079,mptcp dss ack 2398742608], length 0
17:22:32.501831 IP 112.26.0.8.55612 > 112.26.0.1.targus-getdata1: Flags [.], seq 157081:158509, ack 0, win 4107, options [nop,nop,TS val 4294898868 ecr 154495,mptcp dss ack 2097709625 seq 2398855420 subseq 415586 len 1428 csum 0x7118], length 1428
17:22:32.555274 IP 112.26.0.8.55612 > 112.26.0.1.targus-getdata1: Flags [.], seq 147085:148513, ack 0, win 4107, options [nop,nop,TS val 4294898223 ecr 153688,mptcp dss ack 2097709625 seq 2398824004 subseq 405590 len 1428 csum 0x283b], length 1428
17:22:32.642097 IP 112.26.0.1.targus-getdata1 > 112.26.0.8.55612: Flags [.], ack 142801, win 24326, options [nop,nop,TS val 154642 ecr 4294897079,nop,nop,sack 1 {144229:145657},mptcp dss ack 2398742608], length 0
17:22:32.652952 IP 112.26.0.8.55612 > 112.26.0.1.targus-getdata1: Flags [.], seq 158509:159937, ack 0, win 4107, options [nop,nop,TS val 4294899019 ecr 154642,mptcp dss ack 2097709625 seq 2398861132 subseq 417014 len 1428 csum 0x400b], length 1428
17:22:32.709205 IP 112.26.0.8.55612 > 112.26.0.1.targus-getdata1: Flags [.], seq 148513:149941, ack 0, win 4107, options [nop,nop,TS val 4294898400 ecr 153961,mptcp dss ack 2097709625 seq 2398831144 subseq 407018 len 1428 csum 0xc5d1], length 1428
17:22:32.822419 IP 112.26.0.8.55612 > 112.26.0.1.targus-getdata1: Flags [.], seq 149941:151369, ack 0, win 4107, options [nop,nop,TS val 4294898400 ecr 153961,mptcp dss ack 2097709625 seq 2398832572 subseq 408446 len 1428 csum 0x886d], length 1428
17:22:32.898782 IP 112.26.0.8.55612 > 112.26.0.1.targus-getdata1: Flags [.], seq 151369:152797, ack 0, win 4107, options [nop,nop,TS val 4294898458 ecr 154085,mptcp dss ack 2097709625 seq 2398835428 subseq 409874 len 1428 csum 0x90f1], length 1428
17:22:32.975661 IP 112.26.0.1.targus-getdata1 > 112.26.0.8.55612: Flags [.], ack 142801, win 24326, options [nop,nop,TS val 154979 ecr 4294897079,nop,nop,sack 1 {144229:147085},mptcp dss ack 2398742608], length 0
17:22:32.994713 IP 112.26.0.8.55612 > 112.26.0.1.targus-getdata1: Flags [.], seq 159937:161365, ack 0, win 4107, options [nop,nop,TS val 4294899361 ecr 154979,mptcp dss ack 2097709625 seq 2398873984 subseq 418442 len 1428 csum 0x1c94], length 1428
17:22:33.073129 IP 112.26.0.8.55612 > 112.26.0.1.targus-getdata1: Flags [.], seq 152797:154225, ack 0, win 4107, options [nop,nop,TS val 4294898556 ecr 154186,mptcp dss ack 2097709625 seq 2398839712 subseq 411302 len 1428 csum 0xcbb1], length 1428
17:22:33.145304 IP 112.26.0.8.55612 > 112.26.0.1.targus-getdata1: Flags [.], seq 154225:155653, ack 0, win 4107, options [nop,nop,TS val 4294898720 ecr 154374,mptcp dss ack 2097709625 seq 2398848280 subseq 412730 len 1428 csum 0xecc2], length 1428
17:22:33.236292 IP 112.26.0.8.55612 > 112.26.0.1.targus-getdata1: Flags [.], seq 155653:157081, ack 0, win 4107, options [nop,nop,TS val 4294898720 ecr 154374,mptcp dss ack 2097709625 seq 2398849708 subseq 414158 len 1428 csum 0x2d02], length 1428
17:22:33.346566 IP 112.26.0.1.targus-getdata1 > 112.26.0.8.55612: Flags [.], ack 142801, win 24326, options [nop,nop,TS val 155272 ecr 4294897079,nop,nop,sack 1 {144229:148513},mptcp dss ack 2398742608], length 0
17:22:33.346704 IP 112.26.0.8.55612 > 112.26.0.1.targus-getdata1: Flags [.], seq 142801:144229, ack 0, win 4107, options [nop,nop,TS val 4294899713 ecr 155272,mptcp dss ack 2097709625 seq 2398794016 subseq 401306 len 1428 csum 0x5fd0], length 1428
17:22:33.459175 IP 112.26.0.8.55612 > 112.26.0.1.targus-getdata1: Flags [.], seq 157081:158509, ack 0, win 4107, options [nop,nop,TS val 4294898868 ecr 154495,mptcp dss ack 2097709625 seq 2398855420 subseq 415586 len 1428 csum 0x7118], length 1428
17:22:33.549272 IP 112.26.0.1.targus-getdata1 > 112.26.0.8.55612: Flags [.], ack 142801, win 24326, options [nop,nop,TS val 155427 ecr 4294897079,nop,nop,sack 1 {144229:149941},mptcp dss ack 2398742608], length 0
17:22:33.586721 IP 112.26.0.8.55612 > 112.26.0.1.targus-getdata1: Flags [.], seq 161365:162793, ack 0, win 4107, options [nop,nop,TS val 4294899953 ecr 155427,mptcp dss ack 2097709625 seq 2398898260 subseq 419870 len 1428 csum 0x3f30], length 1428
17:22:33.613490 IP 112.26.0.1.targus-getdata1 > 112.26.0.8.55612: Flags [.], ack 142801, win 24326, options [nop,nop,TS val 155537 ecr 4294897079,nop,nop,sack 1 {144229:151369},mptcp dss ack 2398742608], length 0
17:22:33.688938 IP 112.26.0.1.targus-getdata1 > 112.26.0.8.55612: Flags [.], ack 142801, win 24326, options [nop,nop,TS val 155662 ecr 4294897079,nop,nop,sack 1 {144229:152797},mptcp dss ack 2398742608], length 0
17:22:33.723237 IP 112.26.0.8.55612 > 112.26.0.1.targus-getdata1: Flags [.], seq 162793:164221, ack 0, win 4107, options [nop,nop,TS val 4294900089 ecr 155662,mptcp dss ack 2097709625 seq 2398903972 subseq 421298 len 1428 csum 0x49b8], length 1428
17:22:33.744910 IP 112.26.0.8.55612 > 112.26.0.1.targus-getdata1: Flags [.], seq 159937:161365, ack 0, win 4107, options [nop,nop,TS val 4294899361 ecr 154979,mptcp dss ack 2097709625 seq 2398873984 subseq 418442 len 1428 csum 0x1c94], length 1428
17:22:33.861088 IP 112.26.0.1.targus-getdata1 > 112.26.0.8.55612: Flags [.], ack 142801, win 24105, options [nop,nop,TS val 155795 ecr 4294897079,nop,nop,sack 1 {144229:154225},mptcp dss ack 2398794016], length 0
17:22:33.903024 IP 112.26.0.1.targus-getdata1 > 112.26.0.8.55612: Flags [.], ack 142801, win 24105, options [nop,nop,TS val 155876 ecr 4294897079,nop,nop,sack 1 {144229:155653},mptcp dss ack 2398794016], length 0
17:22:33.903367 IP 112.26.0.8.55612 > 112.26.0.1.targus-getdata1: Flags [.], seq 164221:165649, ack 0, win 4107, options [nop,nop,TS val 4294900269 ecr 155795,mptcp dss ack 2097709625 seq 2398916824 subseq 422726 len 1428 csum 0x562a], length 1428
17:22:33.955294 IP 112.26.0.1.targus-getdata1 > 112.26.0.8.55612: Flags [.], ack 142801, win 24105, options [nop,nop,TS val 156003 ecr 4294897079,nop,nop,sack 1 {144229:157081},mptcp dss ack 2398794016], length 0
17:22:34.019954 IP 112.26.0.8.55612 > 112.26.0.1.targus-getdata1: Flags [.], seq 142801:144229, ack 0, win 4107, options [nop,nop,TS val 4294899713 ecr 155272,mptcp dss ack 2097709625 seq 2398794016 subseq 401306 len 1428 csum 0x5fd0], length 1428
17:22:34.132292 IP 112.26.0.1.targus-getdata1 > 112.26.0.8.55612: Flags [.], ack 142801, win 24105, options [nop,nop,TS val 156178 ecr 4294897079,nop,nop,sack 1 {144229:158509},mptcp dss ack 2398794016], length 0
17:22:34.153771 IP 112.26.0.8.55612 > 112.26.0.1.targus-getdata1: Flags [.], seq 161365:162793, ack 0, win 4107, options [nop,nop,TS val 4294899953 ecr 155427,mptcp dss ack 2097709625 seq 2398898260 subseq 419870 len 1428 csum 0x3f30], length 1428
17:22:34.201655 IP 112.26.0.8.55612 > 112.26.0.1.targus-getdata1: Flags [.], seq 165649:167077, ack 0, win 4107, options [nop,nop,TS val 4294900568 ecr 156178,mptcp dss ack 2097709625 seq 2398925392 subseq 424154 len 1428 csum 0x6712], length 1428
17:22:34.234068 IP 112.26.0.8.55612 > 112.26.0.1.targus-getdata1: Flags [.], seq 162793:164221, ack 0, win 4107, options [nop,nop,TS val 4294900089 ecr 155662,mptcp dss ack 2097709625 seq 2398903972 subseq 421298 len 1428 csum 0x49b8], length 1428
17:22:34.368040 IP 112.26.0.1.targus-getdata1 > 112.26.0.8.55612: Flags [.], ack 142801, win 24105, options [nop,nop,TS val 156460 ecr 4294897079,nop,nop,sack 2 {159937:161365}{144229:158509},mptcp dss ack 2398794016], length 0
17:22:34.368353 IP 112.26.0.8.55612 > 112.26.0.1.targus-getdata1: Flags [.], seq 158509:159937, ack 0, win 4107, options [nop,nop,TS val 4294900734 ecr 156460,mptcp dss ack 2097709625 seq 2398861132 subseq 417014 len 1428 csum 0x400b], length 1428
17:22:34.443762 IP 112.26.0.8.55612 > 112.26.0.1.targus-getdata1: Flags [.], seq 164221:165649, ack 0, win 4107, options [nop,nop,TS val 4294900269 ecr 155795,mptcp dss ack 2097709625 seq 2398916824 subseq 422726 len 1428 csum 0x562a], length 1428
17:22:34.510005 IP 112.26.0.1.targus-getdata1 > 112.26.0.8.55612: Flags [.], ack 158509, win 23598, options [nop,nop,TS val 156735 ecr 4294899713,nop,nop,sack 1 {159937:161365},mptcp dss ack 2398861132], length 0
17:22:34.510508 IP 112.26.0.8.55612 > 112.26.0.1.targus-getdata1: Flags [.], seq 167077:168505, ack 0, win 4107, options [nop,nop,TS val 4294900876 ecr 156735,mptcp dss ack 2097709625 seq 2398938244 subseq 425582 len 1428 csum 0xdecb], length 1428
17:22:34.510585 IP 112.26.0.8.55612 > 112.26.0.1.targus-getdata1: Flags [.], seq 168505:169933, ack 0, win 4107, options [nop,nop,TS val 4294900876 ecr 156735,mptcp dss ack 2097709625 seq 2398939672 subseq 427010 len 1428 csum 0x4c14], length 1428
17:22:34.627350 IP 112.26.0.1.targus-getdata1 > 112.26.0.8.55612: Flags [.], ack 158509, win 24334, options [nop,nop,TS val 156867 ecr 4294899713,nop,nop,sack 1 {159937:162793},mptcp dss ack 2398861132], length 0
17:22:34.654368 IP 112.26.0.8.55612 > 112.26.0.1.targus-getdata1: Flags [.], seq 169933:171361, ack 0, win 4107, options [nop,nop,TS val 4294901020 ecr 156867,mptcp dss ack 2097709625 seq 2398946812 subseq 428438 len 1428 csum 0xe4c1], length 1428
17:22:34.677244 IP 112.26.0.8.55612 > 112.26.0.1.targus-getdata1: Flags [.], seq 165649:167077, ack 0, win 4107, options [nop,nop,TS val 4294900568 ecr 156178,mptcp dss ack 2097709625 seq 2398925392 subseq 424154 len 1428 csum 0x6712], length 1428
17:22:34.796652 IP 112.26.0.1.targus-getdata1 > 112.26.0.8.55612: Flags [.], ack 158509, win 24334, options [nop,nop,TS val 156972 ecr 4294899713,nop,nop,sack 1 {159937:164221},mptcp dss ack 2398861132], length 0
17:22:34.843321 IP 112.26.0.8.55612 > 112.26.0.1.targus-getdata1: Flags [.], seq 158509:159937, ack 0, win 4107, options [nop,nop,TS val 4294900734 ecr 156460,mptcp dss ack 2097709625 seq 2398861132 subseq 417014 len 1428 csum 0x400b], length 1428
17:22:34.893058 IP 112.26.0.8.55612 > 112.26.0.1.targus-getdata1: Flags [.], seq 171361:172789, ack 0, win 4107, options [nop,nop,TS val 4294901259 ecr 156972,mptcp dss ack 2097709625 seq 2398961092 subseq 429866 len 1428 csum 0xd505], length 1428
17:22:34.966278 IP 112.26.0.1.targus-getdata1 > 112.26.0.8.55612: Flags [.], ack 158509, win 24334, options [nop,nop,TS val 157158 ecr 4294899713,nop,nop,sack 1 {159937:165649},mptcp dss ack 2398861132], length 0
17:22:34.987128 IP 112.26.0.8.55612 > 112.26.0.1.targus-getdata1: Flags [.], seq 172789:174217, ack 0, win 4107, options [nop,nop,TS val 4294901353 ecr 157158,mptcp dss ack 2097709625 seq 2398965376 subseq 431294 len 1428 csum 0x23ab], length 1428
17:22:35.042279 IP 112.26.0.8.55612 > 112.26.0.1.targus-getdata1: Flags [.], seq 167077:168505, ack 0, win 4107, options [nop,nop,TS val 4294900876 ecr 156735,mptcp dss ack 2097709625 seq 2398938244 subseq 425582 len 1428 csum 0xdecb], length 1428
17:22:35.134316 IP 112.26.0.8.55612 > 112.26.0.1.targus-getdata1: Flags [.], seq 168505:169933, ack 0, win 4107, options [nop,nop,TS val 4294900876 ecr 156735,mptcp dss ack 2097709625 seq 2398939672 subseq 427010 len 1428 csum 0x4c14], length 1428
17:22:35.204158 IP 112.26.0.8.55612 > 112.26.0.1.targus-getdata1: Flags [.], seq 169933:171361, ack 0, win 4107, options [nop,nop,TS val 4294901020 ecr 156867,mptcp dss ack 2097709625 seq 2398946812 subseq 428438 len 1428 csum 0xe4c1], length 1428
17:22:35.289115 IP 112.26.0.1.targus-getdata1 > 112.26.0.8.55612: Flags [.], ack 158509, win 24334, options [nop,nop,TS val 157394 ecr 4294899713,nop,nop,sack 1 {159937:167077},mptcp dss ack 2398861132], length 0
17:22:35.309287 IP 112.26.0.8.55612 > 112.26.0.1.targus-getdata1: Flags [.], seq 174217:175645, ack 0, win 4107, options [nop,nop,TS val 4294901675 ecr 157394,mptcp dss ack 2097709625 seq 2398978228 subseq 432722 len 1428 csum 0x7502], length 1428
17:22:35.360627 IP 112.26.0.1.targus-getdata1 > 112.26.0.8.55612: Flags [.], ack 167077, win 23856, options [nop,nop,TS val 157559 ecr 4294900734,mptcp dss ack 2398915396], length 0
17:22:35.360859 IP 112.26.0.8.55612 > 112.26.0.1.targus-getdata1: Flags [.], seq 175645:177073, ack 0, win 4107, options [nop,nop,TS val 4294901727 ecr 157559,mptcp dss ack 2097709625 seq 2398982512 subseq 434150 len 1428 csum 0x4b2a], length 1428
17:22:35.436459 IP 112.26.0.8.55612 > 112.26.0.1.targus-getdata1: Flags [.], seq 171361:172789, ack 0, win 4107, options [nop,nop,TS val 4294901259 ecr 156972,mptcp dss ack 2097709625 seq 2398961092 subseq 429866 len 1428 csum 0xd505], length 1428
17:22:35.549461 IP 112.26.0.8.55612 > 112.26.0.1.targus-getdata1: Flags [.], seq 172789:174217, ack 0, win 4107, options [nop,nop,TS val 4294901353 ecr 157158,mptcp dss ack 2097709625 seq 2398965376 subseq 431294 len 1428 csum 0x23ab], length 1428
17:22:35.645238 IP 112.26.0.1.targus-getdata1 > 112.26.0.8.55612: Flags [.], ack 168505, win 24453, options [nop,nop,TS val 157756 ecr 4294900876,mptcp dss ack 2398915396], length 0
17:22:35.645656 IP 112.26.0.8.55612 > 112.26.0.1.targus-getdata1: Flags [.], seq 177073:178501, ack 0, win 4107, options [nop,nop,TS val 4294902012 ecr 157756,mptcp dss ack 2097709625 seq 2398995364 subseq 435578 len 1428 csum 0x39f2], length 1428
17:22:35.645734 IP 112.26.0.8.55612 > 112.26.0.1.targus-getdata1: Flags [.], seq 178501:179929, ack 0, win 4107, options [nop,nop,TS val 4294902012 ecr 157756,mptcp dss ack 2097709625 seq 2398996792 subseq 437006 len 1428 csum 0x63f8], length 1428
17:22:35.757959 IP 112.26.0.1.targus-getdata1 > 112.26.0.8.55612: Flags [.], ack 169933, win 24453, options [nop,nop,TS val 157875 ecr 4294900876,mptcp dss ack 2398915396], length 0
17:22:35.758318 IP 112.26.0.8.55612 > 112.26.0.1.targus-getdata1: Flags [.], seq 179929:181357, ack 0, win 4107, options [nop,nop,TS val 4294902124 ecr 157875,mptcp dss ack 2097709625 seq 2399005360 subseq 438434 len 1428 csum 0x2295], length 1428
17:22:35.839031 IP 112.26.0.1.targus-getdata1 > 112.26.0.8.55612: Flags [.], ack 171361, win 24453, options [nop,nop,TS val 157975 ecr 4294901020,mptcp dss ack 2398915396], length 0
17:22:35.839306 IP 112.26.0.8.55612 > 112.26.0.1.targus-getdata1: Flags [.], seq 181357:182785, ack 0, win 4107, options [nop,nop,TS val 4294902205 ecr 157975,mptcp dss ack 2097709625 seq 2399011072 subseq 439862 len 1428 csum 0xe9e5], length 1428
17:22:35.839384 IP 112.26.0.8.55612 > 112.26.0.1.targus-getdata1: Flags [.], seq 182785:184213, ack 0, win 4107, options [nop,nop,TS val 4294902205 ecr 157975,mptcp dss ack 2097709625 seq 2399012500 subseq 441290 len 1428 csum 0x8301], length 1428
17:22:35.905065 IP 112.26.0.8.55612 > 112.26.0.1.targus-getdata1: Flags [.], seq 174217:175645, ack 0, win 4107, options [nop,nop,TS val 4294901675 ecr 157394,mptcp dss ack 2097709625 seq 2398978228 subseq 432722 len 1428 csum 0x7502], length 1428
17:22:36.041134 IP 112.26.0.8.55612 > 112.26.0.1.targus-getdata1: Flags [.], seq 175645:177073, ack 0, win 4107, options [nop,nop,TS val 4294901727 ecr 157559,mptcp dss ack 2097709625 seq 2398982512 subseq 434150 len 1428 csum 0x4b2a], length 1428
17:22:36.176018 IP 112.26.0.1.targus-getdata1 > 112.26.0.8.55612: Flags [.], ack 172789, win 24558, options [nop,nop,TS val 158150 ecr 4294901259,mptcp dss ack 2398952524], length 0
17:22:36.176380 IP 112.26.0.8.55612 > 112.26.0.1.targus-getdata1: Flags [.], seq 184213:185641, ack 0, win 4107, options [nop,nop,TS val 4294902542 ecr 158150,mptcp dss ack 2097709625 seq 2399028208 subseq 442718 len 1428 csum 0x5848], length 1428
17:22:36.213919 IP 112.26.0.1.targus-getdata1 > 112.26.0.8.55612: Flags [.], ack 174217, win 24540, options [nop,nop,TS val 158264 ecr 4294901353,mptcp dss ack 2398953952], length 0
17:22:36.214234 IP 112.26.0.8.55612 > 112.26.0.1.targus-getdata1: Flags [.], seq 185641:187069, ack 0, win 4107, options [nop,nop,TS val 4294902580 ecr 158264,mptcp dss ack 2097709625 seq 2399031064 subseq 444146 len 1428 csum 0x6d07], length 1428
17:22:36.292794 IP 112.26.0.8.55612 > 112.26.0.1.targus-getdata1: Flags [.], seq 177073:178501, ack 0, win 4107, options [nop,nop,TS val 4294902012 ecr 157756,mptcp dss ack 2097709625 seq 2398995364 subseq 435578 len 1428 csum 0x39f2], length 1428
17:22:36.396771 IP 112.26.0.8.55612 > 112.26.0.1.targus-getdata1: Flags [.], seq 178501:179929, ack 0, win 4107, options [nop,nop,TS val 4294902012 ecr 157756,mptcp dss ack 2097709625 seq 2398996792 subseq 437006 len 1428 csum 0x63f8], length 1428
17:22:36.464873 IP 112.26.0.8.55612 > 112.26.0.1.targus-getdata1: Flags [.], seq 179929:181357, ack 0, win 4107, options [nop,nop,TS val 4294902124 ecr 157875,mptcp dss ack 2097709625 seq 2399005360 subseq 438434 len 1428 csum 0x2295], length 1428
17:22:36.589748 IP 112.26.0.8.55612 > 112.26.0.1.targus-getdata1: Flags [.], seq 181357:182785, ack 0, win 4107, options [nop,nop,TS val 4294902205 ecr 157975,mptcp dss ack 2097709625 seq 2399011072 subseq 439862 len 1428 csum 0xe9e5], length 1428
17:22:36.642288 IP 112.26.0.1.targus-getdata1 > 112.26.0.8.55612: Flags [.], ack 175645, win 24558, options [nop,nop,TS val 158631 ecr 4294901675,mptcp dss ack 2398975372], length 0
17:22:36.642696 IP 112.26.0.8.55612 > 112.26.0.1.targus-getdata1: Flags [.], seq 187069:188497, ack 0, win 4107, options [nop,nop,TS val 4294903009 ecr 158631,mptcp dss ack 2097709625 seq 2399051056 subseq 445574 len 1428 csum 0xb5cf], length 1428
17:22:36.720295 IP 112.26.0.8.55612 > 112.26.0.1.targus-getdata1: Flags [.], seq 182785:184213, ack 0, win 4107, options [nop,nop,TS val 4294902205 ecr 157975,mptcp dss ack 2097709625 seq 2399012500 subseq 441290 len 1428 csum 0x8301], length 1428
17:22:36.814940 IP 112.26.0.1.targus-getdata1 > 112.26.0.8.55612: Flags [.], ack 177073, win 24543, options [nop,nop,TS val 158755 ecr 4294901727,mptcp dss ack 2398976800], length 0
17:22:36.815269 IP 112.26.0.8.55612 > 112.26.0.1.targus-getdata1: Flags [.], seq 188497:189925, ack 0, win 4107, options [nop,nop,TS val 4294903181 ecr 158755,mptcp dss ack 2097709625 seq 2399062480 subseq 447002 len 1428 csum 0x4b24], length 1428
17:22:36.815350 IP 112.26.0.8.55612 > 112.26.0.1.targus-getdata1: Flags [.], seq 189925:191353, ack 0, win 4107, options [nop,nop,TS val 4294903181 ecr 158755,mptcp dss ack 2097709625 seq 2399063908 subseq 448430 len 1428 csum 0x113b], length 1428
17:22:36.917261 IP 112.26.0.8.55612 > 112.26.0.1.targus-getdata1: Flags [.], seq 184213:185641, ack 0, win 4107, options [nop,nop,TS val 4294902542 ecr 158150,mptcp dss ack 2097709625 seq 2399028208 subseq 442718 len 1428 csum 0x5848], length 1428
17:22:37.011541 IP 112.26.0.8.55612 > 112.26.0.1.targus-getdata1: Flags [.], seq 185641:187069, ack 0, win 4107, options [nop,nop,TS val 4294902580 ecr 158264,mptcp dss ack 2097709625 seq 2399031064 subseq 444146 len 1428 csum 0x6d07], length 1428
17:22:37.125918 IP 112.26.0.1.targus-getdata1 > 112.26.0.8.55612: Flags [.], ack 178501, win 24543, options [nop,nop,TS val 159007 ecr 4294902012,mptcp dss ack 2398988224], length 0
17:22:37.126270 IP 112.26.0.8.55612 > 112.26.0.1.targus-getdata1: Flags [.], seq 191353:192781, ack 0, win 4107, options [nop,nop,TS val 4294903492 ecr 159007,mptcp dss ack 2097709625 seq 2399075332 subseq 449858 len 1428 csum 0x2c59], length 1428
17:22:37.184585 IP 112.26.0.1.targus-getdata1 > 112.26.0.8.55612: Flags [.], ack 179929, win 24525, options [nop,nop,TS val 159167 ecr 4294902012,mptcp dss ack 2398999648], length 0
17:22:37.184927 IP 112.26.0.8.55612 > 112.26.0.1.targus-getdata1: Flags [.], seq 192781:194209, ack 0, win 4107, options [nop,nop,TS val 4294903551 ecr 159167,mptcp dss ack 2097709625 seq 2399076760 subseq 451286 len 1428 csum 0xee51], length 1428
17:22:37.268884 IP 112.26.0.1.targus-getdata1 > 112.26.0.8.55612: Flags [.], ack 181357, win 24540, options [nop,nop,TS val 159242 ecr 4294902124,mptcp dss ack 2399001076], length 0
17:22:37.269200 IP 112.26.0.8.55612 > 112.26.0.1.targus-getdata1: Flags [.], seq 194209:195637, ack 0, win 4107, options [nop,nop,TS val 4294903635 ecr 159242,mptcp dss ack 2097709625 seq 2399081044 subseq 452714 len 1428 csum 0xa1ab], length 1428
17:22:37.331194 IP 112.26.0.8.55612 > 112.26.0.1.targus-getdata1: Flags [.], seq 187069:188497, ack 0, win 4107, options [nop,nop,TS val 4294903009 ecr 158631,mptcp dss ack 2097709625 seq 2399051056 subseq 445574 len 1428 csum 0xb5cf], length 1428
17:22:37.424597 IP 112.26.0.1.targus-getdata1 > 112.26.0.8.55612: Flags [.], ack 182785, win 24500, options [nop,nop,TS val 159363 ecr 4294902205,mptcp dss ack 2399003932], length 0
17:22:37.425014 IP 112.26.0.8.55612 > 112.26.0.1.targus-getdata1: Flags [.], seq 195637:197065, ack 0, win 4107, options [nop,nop,TS val 4294903791 ecr 159363,mptcp dss ack 2097709625 seq 2399085328 subseq 454142 len 1428 csum 0x2f1], length 1428
17:22:37.479897 IP 112.26.0.1.targus-getdata1 > 112.26.0.8.55612: Flags [.], ack 184213, win 24500, options [nop,nop,TS val 159507 ecr 4294902205,mptcp dss ack 2399003932], length 0
17:22:37.480431 IP 112.26.0.8.55612 > 112.26.0.1.targus-getdata1: Flags [.], seq 197065:198493, ack 0, win 4107, options [nop,nop,TS val 4294903846 ecr 159507,mptcp dss ack 2097709625 seq 2399092468 subseq 455570 len 1428 csum 0x60ed], length 1428
17:22:37.545185 IP 112.26.0.8.55612 > 112.26.0.1.targus-getdata1: Flags [.], seq 188497:189925, ack 0, win 4107, options [nop,nop,TS val 4294903181 ecr 158755,mptcp dss ack 2097709625 seq 2399062480 subseq 447002 len 1428 csum 0x4b24], length 1428
17:22:37.621503 IP 112.26.0.8.55612 > 112.26.0.1.targus-getdata1: Flags [.], seq 189925:191353, ack 0, win 4107, options [nop,nop,TS val 4294903181 ecr 158755,mptcp dss ack 2097709625 seq 2399063908 subseq 448430 len 1428 csum 0x113b], length 1428
17:22:37.727939 IP 112.26.0.1.targus-getdata1 > 112.26.0.8.55612: Flags [.], ack 187069, win 24500, options [nop,nop,TS val 159727 ecr 4294902580,mptcp dss ack 2399003932], length 0
17:22:37.728396 IP 112.26.0.8.55612 > 112.26.0.1.targus-getdata1: Flags [.], seq 198493:199921, ack 0, win 4107, options [nop,nop,TS val 4294904094 ecr 159727,mptcp dss ack 2097709625 seq 2399106748 subseq 456998 len 1428 csum 0xddbe], length 1428
17:22:37.728462 IP 112.26.0.8.55612 > 112.26.0.1.targus-getdata1: Flags [.], seq 199921:201349, ack 0, win 4107, options [nop,nop,TS val 4294904094 ecr 159727,mptcp dss ack 2097709625 seq 2399108176 subseq 458426 len 1428 csum 0xd7ed], length 1428
17:22:37.812936 IP 112.26.0.8.55612 > 112.26.0.1.targus-getdata1: Flags [.], seq 191353:192781, ack 0, win 4107, options [nop,nop,TS val 4294903492 ecr 159007,mptcp dss ack 2097709625 seq 2399075332 subseq 449858 len 1428 csum 0x2c59], length 1428
17:22:37.926081 IP 112.26.0.8.55612 > 112.26.0.1.targus-getdata1: Flags [.], seq 192781:194209, ack 0, win 4107, options [nop,nop,TS val 4294903551 ecr 159167,mptcp dss ack 2097709625 seq 2399076760 subseq 451286 len 1428 csum 0xee51], length 1428
17:22:38.040817 IP 112.26.0.8.55612 > 112.26.0.1.targus-getdata1: Flags [.], seq 194209:195637, ack 0, win 4107, options [nop,nop,TS val 4294903635 ecr 159242,mptcp dss ack 2097709625 seq 2399081044 subseq 452714 len 1428 csum 0xa1ab], length 1428
17:22:38.105201 IP 112.26.0.1.targus-getdata1 > 112.26.0.8.55612: Flags [.], ack 188497, win 24500, options [nop,nop,TS val 160087 ecr 4294903009,mptcp dss ack 2399003932], length 0
17:22:38.105558 IP 112.26.0.8.55612 > 112.26.0.1.targus-getdata1: Flags [.], seq 201349:202777, ack 0, win 4107, options [nop,nop,TS val 4294904471 ecr 160087,mptcp dss ack 2097709625 seq 2399119600 subseq 459854 len 1428 csum 0x1736], length 1428
17:22:38.183395 IP 112.26.0.8.55612 > 112.26.0.1.targus-getdata1: Flags [.], seq 195637:197065, ack 0, win 4107, options [nop,nop,TS val 4294903791 ecr 159363,mptcp dss ack 2097709625 seq 2399085328 subseq 454142 len 1428 csum 0x2f1], length 1428
17:22:38.278604 IP 112.26.0.8.55612 > 112.26.0.1.targus-getdata1: Flags [.], seq 197065:198493, ack 0, win 4107, options [nop,nop,TS val 4294903846 ecr 159507,mptcp dss ack 2097709625 seq 2399092468 subseq 455570 len 1428 csum 0x60ed], length 1428
17:22:38.438071 IP 112.26.0.8.55612 > 112.26.0.1.targus-getdata1: Flags [.], seq 198493:199921, ack 0, win 4107, options [nop,nop,TS val 4294904094 ecr 159727,mptcp dss ack 2097709625 seq 2399106748 subseq 456998 len 1428 csum 0xddbe], length 1428
17:22:38.546680 IP 112.26.0.1.targus-getdata1 > 112.26.0.8.55612: Flags [.], ack 191353, win 24500, options [nop,nop,TS val 160340 ecr 4294903181,mptcp dss ack 2399003932], length 0
17:22:38.547036 IP 112.26.0.8.55612 > 112.26.0.1.targus-getdata1: Flags [.], seq 202777:204205, ack 0, win 4107, options [nop,nop,TS val 4294904913 ecr 160340,mptcp dss ack 2097709625 seq 2399139592 subseq 461282 len 1428 csum 0x62be], length 1428
17:22:38.547116 IP 112.26.0.8.55612 > 112.26.0.1.targus-getdata1: Flags [.], seq 204205:205633, ack 0, win 4107, options [nop,nop,TS val 4294904913 ecr 160340,mptcp dss ack 2097709625 seq 2399141020 subseq 462710 len 1428 csum 0x1ea5], length 1428
17:22:38.547267 IP 112.26.0.8.55612 > 112.26.0.1.targus-getdata1: Flags [.], seq 205633:207061, ack 0, win 4107, options [nop,nop,TS val 4294904913 ecr 160340,mptcp dss ack 2097709625 seq 2399142448 subseq 464138 len 1428 csum 0x1077], length 1428
17:22:38.629410 IP 112.26.0.1.targus-getdata1 > 112.26.0.8.55612: Flags [.], ack 194209, win 24300, options [nop,nop,TS val 160641 ecr 4294903492,mptcp dss ack 2399016784], length 0
17:22:38.629909 IP 112.26.0.8.55612 > 112.26.0.1.targus-getdata1: Flags [.], seq 207061:208489, ack 0, win 4107, options [nop,nop,TS val 4294904996 ecr 160641,mptcp dss ack 2097709625 seq 2399146732 subseq 465566 len 1428 csum 0x1efc], length 1428
17:22:38.629971 IP 112.26.0.8.55612 > 112.26.0.1.targus-getdata1: Flags [.], seq 208489:209917, ack 0, win 4107, options [nop,nop,TS val 4294904996 ecr 160641,mptcp dss ack 2097709625 seq 2399148160 subseq 466994 len 1428 csum 0x821], length 1428
17:22:38.720499 IP 112.26.0.8.55612 > 112.26.0.1.targus-getdata1: Flags [.], seq 201349:202777, ack 0, win 4107, options [nop,nop,TS val 4294904471 ecr 160087,mptcp dss ack 2097709625 seq 2399119600 subseq 459854 len 1428 csum 0x1736], length 1428
17:22:38.823605 IP 112.26.0.1.targus-getdata1 > 112.26.0.8.55612: Flags [.], ack 197065, win 24393, options [nop,nop,TS val 160898 ecr 4294903635,mptcp dss ack 2399059624], length 0
17:22:38.823921 IP 112.26.0.8.55612 > 112.26.0.1.targus-getdata1: Flags [.], seq 209917:211345, ack 0, win 4107, options [nop,nop,TS val 4294905190 ecr 160898,mptcp dss ack 2097709625 seq 2399162440 subseq 468422 len 1428 csum 0x357b], length 1428
17:22:38.823998 IP 112.26.0.8.55612 > 112.26.0.1.targus-getdata1: Flags [.], seq 211345:212773, ack 0, win 4107, options [nop,nop,TS val 4294905190 ecr 160898,mptcp dss ack 2097709625 seq 2399163868 subseq 469850 len 1428 csum 0xc89a], length 1428
17:22:38.879147 IP 112.26.0.1.targus-getdata1 > 112.26.0.8.55612: Flags [.], ack 199921, win 24304, options [nop,nop,TS val 161203 ecr 4294903846,mptcp dss ack 2399065336], length 0
17:22:38.879502 IP 112.26.0.8.55612 > 112.26.0.1.targus-getdata1: Flags [.], seq 212773:214201, ack 0, win 4107, options [nop,nop,TS val 4294905245 ecr 161203,mptcp dss ack 2097709625 seq 2399165296 subseq 471278 len 1428 csum 0x13d5], length 1428
17:22:38.879595 IP 112.26.0.8.55612 > 112.26.0.1.targus-getdata1: Flags [.], seq 214201:215629, ack 0, win 4107, options [nop,nop,TS val 4294905245 ecr 161203,mptcp dss ack 2097709625 seq 2399166724 subseq 472706 len 1428 csum 0xf78a], length 1428
17:22:38.879750 IP 112.26.0.8.55612 > 112.26.0.1.targus-getdata1: Flags [.], seq 215629:217057, ack 0, win 4107, options [nop,nop,TS val 4294905245 ecr 161203,mptcp dss ack 2097709625 seq 2399168152 subseq 474134 len 1428 csum 0xd60c], length 1428
17:22:38.987818 IP 112.26.0.8.55612 > 112.26.0.1.targus-getdata1: Flags [.], seq 202777:204205, ack 0, win 4107, options [nop,nop,TS val 4294904913 ecr 160340,mptcp dss ack 2097709625 seq 2399139592 subseq 461282 len 1428 csum 0x62be], length 1428
17:22:39.074770 IP 112.26.0.8.55612 > 112.26.0.1.targus-getdata1: Flags [.], seq 204205:205633, ack 0, win 4107, options [nop,nop,TS val 4294904913 ecr 160340,mptcp dss ack 2097709625 seq 2399141020 subseq 462710 len 1428 csum 0x1ea5], length 1428
17:22:39.182789 IP 112.26.0.8.55612 > 112.26.0.1.targus-getdata1: Flags [.], seq 205633:207061, ack 0, win 4107, options [nop,nop,TS val 4294904913 ecr 160340,mptcp dss ack 2097709625 seq 2399142448 subseq 464138 len 1428 csum 0x1077], length 1428
17:22:39.289427 IP 112.26.0.1.targus-getdata1 > 112.26.0.8.55612: Flags [.], ack 199921, win 24304, options [nop,nop,TS val 161435 ecr 4294903846,nop,nop,sack 1 {201349:202777},mptcp dss ack 2399065336], length 0
17:22:39.339082 IP 112.26.0.8.55612 > 112.26.0.1.targus-getdata1: Flags [.], seq 217057:218485, ack 0, win 4107, options [nop,nop,TS val 4294905705 ecr 161435,mptcp dss ack 2097709625 seq 2399188144 subseq 475562 len 1428 csum 0x8203], length 1428
17:22:39.374306 IP 112.26.0.8.55612 > 112.26.0.1.targus-getdata1: Flags [.], seq 207061:208489, ack 0, win 4107, options [nop,nop,TS val 4294904996 ecr 160641,mptcp dss ack 2097709625 seq 2399146732 subseq 465566 len 1428 csum 0x1efc], length 1428
17:22:39.453524 IP 112.26.0.8.55612 > 112.26.0.1.targus-getdata1: Flags [.], seq 208489:209917, ack 0, win 4107, options [nop,nop,TS val 4294904996 ecr 160641,mptcp dss ack 2097709625 seq 2399148160 subseq 466994 len 1428 csum 0x821], length 1428
17:22:39.587759 IP 112.26.0.8.55612 > 112.26.0.1.targus-getdata1: Flags [.], seq 209917:211345, ack 0, win 4107, options [nop,nop,TS val 4294905190 ecr 160898,mptcp dss ack 2097709625 seq 2399162440 subseq 468422 len 1428 csum 0x357b], length 1428
17:22:39.654206 IP 112.26.0.1.targus-getdata1 > 112.26.0.8.55612: Flags [.], ack 199921, win 24304, options [nop,nop,TS val 161694 ecr 4294903846,nop,nop,sack 1 {201349:204205},mptcp dss ack 2399065336], length 0
17:22:39.712094 IP 112.26.0.8.55612 > 112.26.0.1.targus-getdata1: Flags [.], seq 218485:219913, ack 0, win 4107, options [nop,nop,TS val 4294906078 ecr 161694,mptcp dss ack 2097709625 seq 2399208136 subseq 476990 len 1428 csum 0x9944], length 1428
17:22:39.737587 IP 112.26.0.8.55612 > 112.26.0.1.targus-getdata1: Flags [.], seq 211345:212773, ack 0, win 4107, options [nop,nop,TS val 4294905190 ecr 160898,mptcp dss ack 2097709625 seq 2399163868 subseq 469850 len 1428 csum 0xc89a], length 1428
17:22:39.855387 IP 112.26.0.1.targus-getdata1 > 112.26.0.8.55612: Flags [.], ack 199921, win 24304, options [nop,nop,TS val 161791 ecr 4294903846,nop,nop,sack 1 {201349:205633},mptcp dss ack 2399065336], length 0
17:22:39.855712 IP 112.26.0.8.55612 > 112.26.0.1.targus-getdata1: Flags [.], seq 199921:201349, ack 0, win 4107, options [nop,nop,TS val 4294906222 ecr 161791,mptcp dss ack 2097709625 seq 2399108176 subseq 458426 len 1428 csum 0xd7ed], length 1428
17:22:39.932754 IP 112.26.0.8.55612 > 112.26.0.1.targus-getdata1: Flags [.], seq 212773:214201, ack 0, win 4107, options [nop,nop,TS val 4294905245 ecr 161203,mptcp dss ack 2097709625 seq 2399165296 subseq 471278 len 1428 csum 0x13d5], length 1428
17:22:40.047347 IP 112.26.0.8.55612 > 112.26.0.1.targus-getdata1: Flags [.], seq 214201:215629, ack 0, win 4107, options [nop,nop,TS val 4294905245 ecr 161203,mptcp dss ack 2097709625 seq 2399166724 subseq 472706 len 1428 csum 0xf78a], length 1428
17:22:40.165443 IP 112.26.0.8.55612 > 112.26.0.1.targus-getdata1: Flags [.], seq 217057:218485, ack 0, win 4107, options [nop,nop,TS val 4294905705 ecr 161435,mptcp dss ack 2097709625 seq 2399188144 subseq 475562 len 1428 csum 0x8203], length 1428
17:22:40.260011 IP 112.26.0.1.targus-getdata1 > 112.26.0.8.55612: Flags [.], ack 199921, win 24304, options [nop,nop,TS val 162181 ecr 4294903846,nop,nop,sack 1 {201349:209917},mptcp dss ack 2399065336], length 0
17:22:40.320956 IP 112.26.0.1.targus-getdata1 > 112.26.0.8.55612: Flags [.], ack 199921, win 24156, options [nop,nop,TS val 162313 ecr 4294903846,nop,nop,sack 1 {201349:211345},mptcp dss ack 2399108176], length 0
17:22:40.365934 IP 112.26.0.8.55612 > 112.26.0.1.targus-getdata1: Flags [.], seq 219913:221341, ack 0, win 4107, options [nop,nop,TS val 4294906732 ecr 162313,mptcp dss ack 2097709625 seq 2399240980 subseq 478418 len 1428 csum 0xecde], length 1428
17:22:40.383853 IP 112.26.0.8.55612 > 112.26.0.1.targus-getdata1: Flags [.], seq 218485:219913, ack 0, win 4107, options [nop,nop,TS val 4294906078 ecr 161694,mptcp dss ack 2097709625 seq 2399208136 subseq 476990 len 1428 csum 0x9944], length 1428
17:22:40.467289 IP 112.26.0.1.targus-getdata1 > 112.26.0.8.55612: Flags [.], ack 199921, win 24156, options [nop,nop,TS val 162451 ecr 4294903846,nop,nop,sack 1 {201349:212773},mptcp dss ack 2399108176], length 0
17:22:40.475035 IP 112.26.0.8.55612 > 112.26.0.1.targus-getdata1: Flags [.], seq 221341:222769, ack 0, win 4107, options [nop,nop,TS val 4294906841 ecr 162451,mptcp dss ack 2097709625 seq 2399245264 subseq 479846 len 1428 csum 0x2667], length 1428
17:22:40.542518 IP 112.26.0.8.55612 > 112.26.0.1.targus-getdata1: Flags [.], seq 199921:201349, ack 0, win 4107, options [nop,nop,TS val 4294906222 ecr 161791,mptcp dss ack 2097709625 seq 2399108176 subseq 458426 len 1428 csum 0xd7ed], length 1428
17:22:40.629479 IP 112.26.0.1.targus-getdata1 > 112.26.0.8.55612: Flags [.], ack 199921, win 24156, options [nop,nop,TS val 162649 ecr 4294903846,nop,nop,sack 1 {201349:214201},mptcp dss ack 2399108176], length 0
17:22:40.651911 IP 112.26.0.8.55612 > 112.26.0.1.targus-getdata1: Flags [.], seq 222769:224197, ack 0, win 4107, options [nop,nop,TS val 4294907018 ecr 162649,mptcp dss ack 2097709625 seq 2399250976 subseq 481274 len 1428 csum 0xa698], length 1428
17:22:40.716193 IP 112.26.0.1.targus-getdata1 > 112.26.0.8.55612: Flags [.], ack 199921, win 24156, options [nop,nop,TS val 162763 ecr 4294903846,nop,nop,sack 1 {201349:215629},mptcp dss ack 2399108176], length 0
17:22:40.735132 IP 112.26.0.8.55612 > 112.26.0.1.targus-getdata1: Flags [.], seq 224197:225625, ack 0, win 4107, options [nop,nop,TS val 4294907101 ecr 162763,mptcp dss ack 2097709625 seq 2399256688 subseq 482702 len 1428 csum 0x1a99], length 1428
17:22:40.785393 IP 112.26.0.1.targus-getdata1 > 112.26.0.8.55612: Flags [.], ack 199921, win 24156, options [nop,nop,TS val 162881 ecr 4294903846,nop,nop,sack 2 {217057:218485}{201349:215629},mptcp dss ack 2399108176], length 0
17:22:40.785769 IP 112.26.0.8.55612 > 112.26.0.1.targus-getdata1: Flags [.], seq 215629:217057, ack 0, win 4107, options [nop,nop,TS val 4294907152 ecr 162881,mptcp dss ack 2097709625 seq 2399168152 subseq 474134 len 1428 csum 0xd60c], length 1428
17:22:40.818632 IP 112.26.0.1.targus-getdata1 > 112.26.0.8.55612: Flags [.], ack 199921, win 24156, options [nop,nop,TS val 163084 ecr 4294903846,nop,nop,sack 2 {217057:219913}{201349:215629},mptcp dss ack 2399108176], length 0
17:22:40.820608 IP 112.26.0.8.55612 > 112.26.0.1.targus-getdata1: Flags [.], seq 225625:227053, ack 0, win 4107, options [nop,nop,TS val 4294907187 ecr 163084,mptcp dss ack 2097709625 seq 2399259544 subseq 484130 len 1428 csum 0x95c], length 1428
17:22:40.881925 IP 112.26.0.8.55612 > 112.26.0.1.targus-getdata1: Flags [.], seq 219913:221341, ack 0, win 4107, options [nop,nop,TS val 4294906732 ecr 162313,mptcp dss ack 2097709625 seq 2399240980 subseq 478418 len 1428 csum 0xecde], length 1428
