17:21:41.727931 IP 112.26.3.8.51099 > 112.26.3.1.targus-getdata1: Flags [S], seq 1043068251, win 65535, options [mss 1460,sackOK,TS val 4294848073 ecr 0,nop,wscale 6,mptcp join id 5 token 0xf09729a5 nonce 0x40949c80], length 0
17:21:41.789255 IP 112.26.3.8.51099 > 112.26.3.1.targus-getdata1: Flags [S], seq 1043068251, win 65535, options [mss 1460,sackOK,TS val 4294848073 ecr 0,nop,wscale 6,mptcp join id 5 token 0xf09729a5 nonce 0x40949c80], length 0
17:21:41.844781 IP 112.26.3.8.51099 > 112.26.3.1.targus-getdata1: Flags [S], seq 1043068251, win 65535, options [mss 1460,sackOK,TS val 4294848073 ecr 0,nop,wscale 6,mptcp join id 5 token 0xf09729a5 nonce 0x40949c80], length 0
17:21:42.003732 IP 112.26.3.1.targus-getdata1 > 112.26.3.8.51099: Flags [S.], seq 2056967710, ack 1043068252, win 65535, options [mss 1460,sackOK,TS val 104557 ecr 4294848073,nop,wscale 6,mptcp join id 5 hmac 0xa947946d5b84d3c5 nonce 0xbd654c3b], length 0
17:21:42.041388 IP 112.26.3.1.targus-getdata1 > 112.26.3.8.51099: Flags [S.], seq 2056967710, ack 1043068252, win 65535, options [mss 1460,sackOK,TS val 104557 ecr 4294848073,nop,wscale 6,mptcp join id 5 hmac 0xa947946d5b84d3c5 nonce 0xbd654c3b], length 0
17:21:42.103659 IP 112.26.3.8.51099 > 112.26.3.1.targus-getdata1: Flags [.], ack 1, win 2738, options [nop,nop,TS val 4294848408 ecr 104557,mptcp join hmac 0xe32ad7085cdee7f9450a7ceadcf0dbcf0a5bbba6], length 0
17:21:42.103885 IP 112.26.3.8.51099 > 112.26.3.1.targus-getdata1: Flags [.], ack 1, win 2738, options [nop,nop,TS val 4294848408 ecr 104557,mptcp join hmac 0xe32ad7085cdee7f9450a7ceadcf0dbcf0a5bbba6], length 0
17:22:15.780008 IP 112.26.3.8.38791 > 112.26.3.1.targus-getdata1: Flags [.], seq 925039075:925040503, ack 3198620660, win 4107, options [nop,nop,TS val 4294881171 ecr 137434,mptcp dss ack 2097709625 seq 2398052884 subseq 394129 len 1428 csum 0x3dcb], length 1428
17:22:15.829468 IP 112.26.3.8.38791 > 112.26.3.1.targus-getdata1: Flags [.], seq 12852:14280, ack 1, win 4107, options [nop,nop,TS val 4294882090 ecr 138427,mptcp dss ack 2097709625 seq 2398104292 subseq 406981 len 1428 csum 0x59ba], length 1428
17:22:15.866926 IP 112.26.3.8.38791 > 112.26.3.1.targus-getdata1: Flags [.], seq 0:1428, ack 1, win 4107, options [nop,nop,TS val 4294881171 ecr 137434,mptcp dss ack 2097709625 seq 2398052884 subseq 394129 len 1428 csum 0x3dcb], length 1428
17:22:15.880403 IP 112.26.3.8.38791 > 112.26.3.1.targus-getdata1: Flags [.], seq 2856:4284, ack 1, win 4107, options [nop,nop,TS val 4294881411 ecr 137698,mptcp dss ack 2097709625 seq 2398062880 subseq 396985 len 1428 csum 0x9ff5], length 1428
17:22:15.907369 IP 112.26.3.8.38791 > 112.26.3.1.targus-getdata1: Flags [.], seq 2856:4284, ack 1, win 4107, options [nop,nop,TS val 4294881411 ecr 137698,mptcp dss ack 2097709625 seq 2398062880 subseq 396985 len 1428 csum 0x9ff5], length 1428
17:22:15.919637 IP 112.26.3.1.targus-getdata1 > 112.26.3.8.38791: Flags [.], ack 1428, win 24272, options [nop,nop,TS val 138619 ecr 4294881171,nop,nop,sack 1 {2856:4284},mptcp dss ack 2397988624], length 0
17:22:15.938229 IP 112.26.3.1.targus-getdata1 > 112.26.3.8.38791: Flags [.], ack 1428, win 24272, options [nop,nop,TS val 138619 ecr 4294881171,nop,nop,sack 1 {2856:4284},mptcp dss ack 2397988624], length 0
17:22:15.955956 IP 112.26.3.8.38791 > 112.26.3.1.targus-getdata1: Flags [.], seq 14280:15708, ack 1, win 4107, options [nop,nop,TS val 4294882279 ecr 138619,mptcp dss ack 2097709625 seq 2398110004 subseq 408409 len 1428 csum 0x14ad], length 1428
17:22:15.984538 IP 112.26.3.8.38791 > 112.26.3.1.targus-getdata1: Flags [.], seq 4284:5712, ack 1, win 4107, options [nop,nop,TS val 4294881483 ecr 137819,mptcp dss ack 2097709625 seq 2398067164 subseq 398413 len 1428 csum 0x9ff4], length 1428
17:22:16.031085 IP 112.26.3.1.targus-getdata1 > 112.26.3.8.38791: Flags [.], ack 1428, win 24272, options [nop,nop,TS val 138731 ecr 4294881171,nop,nop,sack 1 {2856:5712},mptcp dss ack 2397988624], length 0
17:22:16.037975 IP 112.26.3.1.targus-getdata1 > 112.26.3.8.38791: Flags [.], ack 1428, win 24272, options [nop,nop,TS val 138731 ecr 4294881171,nop,nop,sack 1 {2856:5712},mptcp dss ack 2397988624], length 0
17:22:16.054834 IP 112.26.3.8.38791 > 112.26.3.1.targus-getdata1: Flags [.], seq 15708:17136, ack 1, win 4107, options [nop,nop,TS val 4294882279 ecr 138619,mptcp dss ack 2097709625 seq 2398111432 subseq 409837 len 1428 csum 0x4cb7], length 1428
17:22:16.092023 IP 112.26.3.8.38791 > 112.26.3.1.targus-getdata1: Flags [.], seq 4284:5712, ack 1, win 4107, options [nop,nop,TS val 4294881483 ecr 137819,mptcp dss ack 2097709625 seq 2398067164 subseq 398413 len 1428 csum 0x9ff4], length 1428
17:22:16.100350 IP 112.26.3.8.38791 > 112.26.3.1.targus-getdata1: Flags [.], seq 5712:7140, ack 1, win 4107, options [nop,nop,TS val 4294881620 ecr 137959,mptcp dss ack 2097709625 seq 2398075732 subseq 399841 len 1428 csum 0x14ca], length 1428
17:22:16.103927 IP 112.26.3.8.38791 > 112.26.3.1.targus-getdata1: Flags [.], seq 5712:7140, ack 1, win 4107, options [nop,nop,TS val 4294881620 ecr 137959,mptcp dss ack 2097709625 seq 2398075732 subseq 399841 len 1428 csum 0x14ca], length 1428
17:22:16.107926 IP 112.26.3.1.targus-getdata1 > 112.26.3.8.38791: Flags [.], ack 1428, win 24272, options [nop,nop,TS val 138816 ecr 4294881171,nop,nop,sack 1 {2856:7140},mptcp dss ack 2397988624], length 0
17:22:16.134616 IP 112.26.3.8.38791 > 112.26.3.1.targus-getdata1: Flags [.], seq 17136:18564, ack 1, win 4107, options [nop,nop,TS val 4294882414 ecr 138731,mptcp dss ack 2097709625 seq 2398117144 subseq 411265 len 1428 csum 0x433b], length 1428
17:22:16.158207 IP 112.26.3.1.targus-getdata1 > 112.26.3.8.38791: Flags [.], ack 1428, win 24272, options [nop,nop,TS val 138816 ecr 4294881171,nop,nop,sack 1 {2856:7140},mptcp dss ack 2397988624], length 0
17:22:16.201511 IP 112.26.3.8.38791 > 112.26.3.1.targus-getdata1: Flags [.], seq 1428:2856, ack 1, win 4107, options [nop,nop,TS val 4294882524 ecr 138816,mptcp dss ack 2097709625 seq 2398060024 subseq 395557 len 1428 csum 0xf571], length 1428
17:22:16.257786 IP 112.26.3.8.38791 > 112.26.3.1.targus-getdata1: Flags [.], seq 7140:8568, ack 1, win 4107, options [nop,nop,TS val 4294881759 ecr 138096,mptcp dss ack 2097709625 seq 2398081444 subseq 401269 len 1428 csum 0x35d7], length 1428
17:22:16.260466 IP 112.26.3.8.38791 > 112.26.3.1.targus-getdata1: Flags [.], seq 7140:8568, ack 1, win 4107, options [nop,nop,TS val 4294881759 ecr 138096,mptcp dss ack 2097709625 seq 2398081444 subseq 401269 len 1428 csum 0x35d7], length 1428
17:22:16.270493 IP 112.26.3.1.targus-getdata1 > 112.26.3.8.38791: Flags [.], ack 1428, win 24272, options [nop,nop,TS val 138972 ecr 4294881171,nop,nop,sack 1 {2856:8568},mptcp dss ack 2397988624], length 0
17:22:16.318116 IP 112.26.3.1.targus-getdata1 > 112.26.3.8.38791: Flags [.], ack 1428, win 24272, options [nop,nop,TS val 138972 ecr 4294881171,nop,nop,sack 1 {2856:8568},mptcp dss ack 2397988624], length 0
17:22:16.331660 IP 112.26.3.8.38791 > 112.26.3.1.targus-getdata1: Flags [.], seq 18564:19992, ack 1, win 4107, options [nop,nop,TS val 4294882692 ecr 138972,mptcp dss ack 2097709625 seq 2398124284 subseq 412693 len 1428 csum 0xf3b4], length 1428
17:22:16.366956 IP 112.26.3.8.38791 > 112.26.3.1.targus-getdata1: Flags [.], seq 8568:9996, ack 1, win 4107, options [nop,nop,TS val 4294881902 ecr 138238,mptcp dss ack 2097709625 seq 2398088584 subseq 402697 len 1428 csum 0x8e99], length 1428
17:22:16.382626 IP 112.26.3.1.targus-getdata1 > 112.26.3.8.38791: Flags [.], ack 1428, win 24272, options [nop,nop,TS val 139086 ecr 4294881171,nop,nop,sack 1 {2856:9996},mptcp dss ack 2397988624], length 0
17:22:16.390387 IP 112.26.3.1.targus-getdata1 > 112.26.3.8.38791: Flags [.], ack 1428, win 24272, options [nop,nop,TS val 139086 ecr 4294881171,nop,nop,sack 1 {2856:9996},mptcp dss ack 2397988624], length 0
17:22:16.396934 IP 112.26.3.8.38791 > 112.26.3.1.targus-getdata1: Flags [.], seq 8568:9996, ack 1, win 4107, options [nop,nop,TS val 4294881902 ecr 138238,mptcp dss ack 2097709625 seq 2398088584 subseq 402697 len 1428 csum 0x8e99], length 1428
17:22:16.427450 IP 112.26.3.8.38791 > 112.26.3.1.targus-getdata1: Flags [.], seq 19992:21420, ack 1, win 4107, options [nop,nop,TS val 4294882790 ecr 139086,mptcp dss ack 2097709625 seq 2398127140 subseq 414121 len 1428 csum 0x9d1], length 1428
17:22:16.469752 IP 112.26.3.8.38791 > 112.26.3.1.targus-getdata1: Flags [.], seq 11424:12852, ack 1, win 4107, options [nop,nop,TS val 4294882090 ecr 138427,mptcp dss ack 2097709625 seq 2398102864 subseq 405553 len 1428 csum 0x9867], length 1428
17:22:16.474311 IP 112.26.3.8.38791 > 112.26.3.1.targus-getdata1: Flags [.], seq 11424:12852, ack 1, win 4107, options [nop,nop,TS val 4294882090 ecr 138427,mptcp dss ack 2097709625 seq 2398102864 subseq 405553 len 1428 csum 0x9867], length 1428
17:22:16.483718 IP 112.26.3.1.targus-getdata1 > 112.26.3.8.38791: Flags [.], ack 1428, win 24272, options [nop,nop,TS val 139186 ecr 4294881171,nop,nop,sack 2 {11424:12852}{2856:9996},mptcp dss ack 2397988624], length 0
17:22:16.504635 IP 112.26.3.1.targus-getdata1 > 112.26.3.8.38791: Flags [.], ack 1428, win 24272, options [nop,nop,TS val 139186 ecr 4294881171,nop,nop,sack 2 {11424:12852}{2856:9996},mptcp dss ack 2397988624], length 0
17:22:16.555175 IP 112.26.3.8.38791 > 112.26.3.1.targus-getdata1: Flags [.], seq 12852:14280, ack 1, win 4107, options [nop,nop,TS val 4294882090 ecr 138427,mptcp dss ack 2097709625 seq 2398104292 subseq 406981 len 1428 csum 0x59ba], length 1428
17:22:16.600549 IP 112.26.3.8.38791 > 112.26.3.1.targus-getdata1: Flags [.], seq 12852:14280, ack 1, win 4107, options [nop,nop,TS val 4294882090 ecr 138427,mptcp dss ack 2097709625 seq 2398104292 subseq 406981 len 1428 csum 0x59ba], length 1428
17:22:16.604742 IP 112.26.3.1.targus-getdata1 > 112.26.3.8.38791: Flags [.], ack 1428, win 24272, options [nop,nop,TS val 139312 ecr 4294881171,nop,nop,sack 2 {11424:14280}{2856:9996},mptcp dss ack 2397988624], length 0
17:22:16.621415 IP 112.26.3.1.targus-getdata1 > 112.26.3.8.38791: Flags [.], ack 1428, win 24272, options [nop,nop,TS val 139312 ecr 4294881171,nop,nop,sack 2 {11424:14280}{2856:9996},mptcp dss ack 2397988624], length 0
17:22:16.631164 IP 112.26.3.8.38791 > 112.26.3.1.targus-getdata1: Flags [.], seq 9996:11424, ack 1, win 4107, options [nop,nop,TS val 4294882973 ecr 139312,mptcp dss ack 2097709625 seq 2398090012 subseq 404125 len 1428 csum 0x27b5], length 1428
17:22:16.652831 IP 112.26.3.8.38791 > 112.26.3.1.targus-getdata1: Flags [.], seq 14280:15708, ack 1, win 4107, options [nop,nop,TS val 4294882279 ecr 138619,mptcp dss ack 2097709625 seq 2398110004 subseq 408409 len 1428 csum 0x14ad], length 1428
17:22:16.697260 IP 112.26.3.8.38791 > 112.26.3.1.targus-getdata1: Flags [.], seq 14280:15708, ack 1, win 4107, options [nop,nop,TS val 4294882279 ecr 138619,mptcp dss ack 2097709625 seq 2398110004 subseq 408409 len 1428 csum 0x14ad], length 1428
17:22:16.703014 IP 112.26.3.1.targus-getdata1 > 112.26.3.8.38791: Flags [.], ack 1428, win 24272, options [nop,nop,TS val 139409 ecr 4294881171,nop,nop,sack 2 {11424:15708}{2856:9996},mptcp dss ack 2397988624], length 0
17:22:16.711110 IP 112.26.3.1.targus-getdata1 > 112.26.3.8.38791: Flags [.], ack 1428, win 24272, options [nop,nop,TS val 139409 ecr 4294881171,nop,nop,sack 2 {11424:15708}{2856:9996},mptcp dss ack 2397988624], length 0
17:22:16.723568 IP 112.26.3.8.38791 > 112.26.3.1.targus-getdata1: Flags [.], seq 15708:17136, ack 1, win 4107, options [nop,nop,TS val 4294882279 ecr 138619,mptcp dss ack 2097709625 seq 2398111432 subseq 409837 len 1428 csum 0x4cb7], length 1428
17:22:16.756577 IP 112.26.3.8.38791 > 112.26.3.1.targus-getdata1: Flags [.], seq 21420:22848, ack 1, win 4107, options [nop,nop,TS val 4294883120 ecr 139409,mptcp dss ack 2097709625 seq 2398135708 subseq 415549 len 1428 csum 0x53c4], length 1428
17:22:16.775943 IP 112.26.3.8.38791 > 112.26.3.1.targus-getdata1: Flags [.], seq 15708:17136, ack 1, win 4107, options [nop,nop,TS val 4294882279 ecr 138619,mptcp dss ack 2097709625 seq 2398111432 subseq 409837 len 1428 csum 0x4cb7], length 1428
17:22:16.781305 IP 112.26.3.1.targus-getdata1 > 112.26.3.8.38791: Flags [.], ack 1428, win 24272, options [nop,nop,TS val 139483 ecr 4294881171,nop,nop,sack 2 {11424:17136}{2856:9996},mptcp dss ack 2397988624], length 0
17:22:16.792968 IP 112.26.3.1.targus-getdata1 > 112.26.3.8.38791: Flags [.], ack 1428, win 24272, options [nop,nop,TS val 139483 ecr 4294881171,nop,nop,sack 2 {11424:17136}{2856:9996},mptcp dss ack 2397988624], length 0
17:22:16.828438 IP 112.26.3.8.38791 > 112.26.3.1.targus-getdata1: Flags [.], seq 17136:18564, ack 1, win 4107, options [nop,nop,TS val 4294882414 ecr 138731,mptcp dss ack 2097709625 seq 2398117144 subseq 411265 len 1428 csum 0x433b], length 1428
17:22:16.837896 IP 112.26.3.8.38791 > 112.26.3.1.targus-getdata1: Flags [.], seq 17136:18564, ack 1, win 4107, options [nop,nop,TS val 4294882414 ecr 138731,mptcp dss ack 2097709625 seq 2398117144 subseq 411265 len 1428 csum 0x433b], length 1428
17:22:16.862748 IP 112.26.3.8.38791 > 112.26.3.1.targus-getdata1: Flags [.], seq 22848:24276, ack 1, win 4107, options [nop,nop,TS val 4294883152 ecr 139483,mptcp dss ack 2097709625 seq 2398138564 subseq 416977 len 1428 csum 0x700], length 1428
17:22:16.891706 IP 112.26.3.1.targus-getdata1 > 112.26.3.8.38791: Flags [.], ack 1428, win 24272, options [nop,nop,TS val 139540 ecr 4294881171,nop,nop,sack 2 {11424:18564}{2856:9996},mptcp dss ack 2397988624], length 0
17:22:16.892914 IP 112.26.3.1.targus-getdata1 > 112.26.3.8.38791: Flags [.], ack 1428, win 24272, options [nop,nop,TS val 139540 ecr 4294881171,nop,nop,sack 2 {11424:18564}{2856:9996},mptcp dss ack 2397988624], length 0
17:22:16.904947 IP 112.26.3.8.38791 > 112.26.3.1.targus-getdata1: Flags [.], seq 1428:2856, ack 1, win 4107, options [nop,nop,TS val 4294882524 ecr 138816,mptcp dss ack 2097709625 seq 2398060024 subseq 395557 len 1428 csum 0xf571], length 1428
17:22:16.916267 IP 112.26.3.8.38791 > 112.26.3.1.targus-getdata1: Flags [.], seq 1428:2856, ack 1, win 4107, options [nop,nop,TS val 4294882524 ecr 138816,mptcp dss ack 2097709625 seq 2398060024 subseq 395557 len 1428 csum 0xf571], length 1428
17:22:16.940909 IP 112.26.3.8.38791 > 112.26.3.1.targus-getdata1: Flags [.], seq 24276:25704, ack 1, win 4107, options [nop,nop,TS val 4294883271 ecr 139540,mptcp dss ack 2097709625 seq 2398144276 subseq 418405 len 1428 csum 0xf9fa], length 1428
17:22:16.972972 IP 112.26.3.1.targus-getdata1 > 112.26.3.8.38791: Flags [.], ack 9996, win 24272, options [nop,nop,TS val 139621 ecr 4294882524,nop,nop,sack 1 {11424:18564},mptcp dss ack 2397988624], length 0
17:22:16.974130 IP 112.26.3.1.targus-getdata1 > 112.26.3.8.38791: Flags [.], ack 9996, win 24272, options [nop,nop,TS val 139621 ecr 4294882524,nop,nop,sack 1 {11424:18564},mptcp dss ack 2397988624], length 0
17:22:17.019489 IP 112.26.3.8.38791 > 112.26.3.1.targus-getdata1: Flags [.], seq 18564:19992, ack 1, win 4107, options [nop,nop,TS val 4294882692 ecr 138972,mptcp dss ack 2097709625 seq 2398124284 subseq 412693 len 1428 csum 0xf3b4], length 1428
17:22:17.022417 IP 112.26.3.8.38791 > 112.26.3.1.targus-getdata1: Flags [.], seq 18564:19992, ack 1, win 4107, options [nop,nop,TS val 4294882692 ecr 138972,mptcp dss ack 2097709625 seq 2398124284 subseq 412693 len 1428 csum 0xf3b4], length 1428
17:22:17.032910 IP 112.26.3.8.38791 > 112.26.3.1.targus-getdata1: Flags [.], seq 25704:27132, ack 1, win 4107, options [nop,nop,TS val 4294883341 ecr 139621,mptcp dss ack 2097709625 seq 2398149988 subseq 419833 len 1428 csum 0x4d5c], length 1428
17:22:17.065198 IP 112.26.3.1.targus-getdata1 > 112.26.3.8.38791: Flags [.], ack 9996, win 24272, options [nop,nop,TS val 139731 ecr 4294882524,nop,nop,sack 1 {11424:19992},mptcp dss ack 2397988624], length 0
17:22:17.069088 IP 112.26.3.1.targus-getdata1 > 112.26.3.8.38791: Flags [.], ack 9996, win 24272, options [nop,nop,TS val 139731 ecr 4294882524,nop,nop,sack 1 {11424:19992},mptcp dss ack 2397988624], length 0
17:22:17.094754 IP 112.26.3.8.38791 > 112.26.3.1.targus-getdata1: Flags [.], seq 19992:21420, ack 1, win 4107, options [nop,nop,TS val 4294882790 ecr 139086,mptcp dss ack 2097709625 seq 2398127140 subseq 414121 len 1428 csum 0x9d1], length 1428
17:22:17.112360 IP 112.26.3.8.38791 > 112.26.3.1.targus-getdata1: Flags [.], seq 19992:21420, ack 1, win 4107, options [nop,nop,TS val 4294882790 ecr 139086,mptcp dss ack 2097709625 seq 2398127140 subseq 414121 len 1428 csum 0x9d1], length 1428
17:22:17.115645 IP 112.26.3.1.targus-getdata1 > 112.26.3.8.38791: Flags [.], ack 9996, win 24272, options [nop,nop,TS val 139824 ecr 4294882524,nop,nop,sack 1 {11424:21420},mptcp dss ack 2397988624], length 0
17:22:17.129589 IP 112.26.3.1.targus-getdata1 > 112.26.3.8.38791: Flags [.], ack 9996, win 24272, options [nop,nop,TS val 139824 ecr 4294882524,nop,nop,sack 1 {11424:21420},mptcp dss ack 2397988624], length 0
17:22:17.133990 IP 112.26.3.8.38791 > 112.26.3.1.targus-getdata1: Flags [.], seq 27132:28560, ack 1, win 4107, options [nop,nop,TS val 4294883494 ecr 139731,mptcp dss ack 2097709625 seq 2398152844 subseq 421261 len 1428 csum 0xaf94], length 1428
17:22:17.191816 IP 112.26.3.8.38791 > 112.26.3.1.targus-getdata1: Flags [.], seq 9996:11424, ack 1, win 4107, options [nop,nop,TS val 4294882973 ecr 139312,mptcp dss ack 2097709625 seq 2398090012 subseq 404125 len 1428 csum 0x27b5], length 1428
17:22:17.226564 IP 112.26.3.1.targus-getdata1 > 112.26.3.8.38791: Flags [.], ack 21420, win 24272, options [nop,nop,TS val 139933 ecr 4294882973,mptcp dss ack 2397988624], length 0
17:22:17.227671 IP 112.26.3.1.targus-getdata1 > 112.26.3.8.38791: Flags [.], ack 21420, win 24272, options [nop,nop,TS val 139933 ecr 4294882973,mptcp dss ack 2397988624], length 0
17:22:17.237821 IP 112.26.3.8.38791 > 112.26.3.1.targus-getdata1: Flags [.], seq 28560:29988, ack 1, win 4107, options [nop,nop,TS val 4294883514 ecr 139824,mptcp dss ack 2097709625 seq 2398154272 subseq 422689 len 1428 csum 0x718d], length 1428
17:22:17.244222 IP 112.26.3.8.38791 > 112.26.3.1.targus-getdata1: Flags [.], seq 9996:11424, ack 1, win 4107, options [nop,nop,TS val 4294882973 ecr 139312,mptcp dss ack 2097709625 seq 2398090012 subseq 404125 len 1428 csum 0x27b5], length 1428
17:22:17.286153 IP 112.26.3.8.38791 > 112.26.3.1.targus-getdata1: Flags [.], seq 29988:31416, ack 1, win 4107, options [nop,nop,TS val 4294883594 ecr 139933,mptcp dss ack 2097709625 seq 2398161412 subseq 424117 len 1428 csum 0xbc3f], length 1428
17:22:17.290235 IP 112.26.3.8.38791 > 112.26.3.1.targus-getdata1: Flags [.], seq 21420:22848, ack 1, win 4107, options [nop,nop,TS val 4294883120 ecr 139409,mptcp dss ack 2097709625 seq 2398135708 subseq 415549 len 1428 csum 0x53c4], length 1428
17:22:17.307474 IP 112.26.3.1.targus-getdata1 > 112.26.3.8.38791: Flags [.], ack 22848, win 24272, options [nop,nop,TS val 140016 ecr 4294883120,mptcp dss ack 2397988624], length 0
17:22:17.333202 IP 112.26.3.8.38791 > 112.26.3.1.targus-getdata1: Flags [.], seq 21420:22848, ack 1, win 4107, options [nop,nop,TS val 4294883120 ecr 139409,mptcp dss ack 2097709625 seq 2398135708 subseq 415549 len 1428 csum 0x53c4], length 1428
17:22:17.334524 IP 112.26.3.1.targus-getdata1 > 112.26.3.8.38791: Flags [.], ack 22848, win 24272, options [nop,nop,TS val 140016 ecr 4294883120,mptcp dss ack 2397988624], length 0
17:22:17.390045 IP 112.26.3.8.38791 > 112.26.3.1.targus-getdata1: Flags [.], seq 31416:32844, ack 1, win 4107, options [nop,nop,TS val 4294883680 ecr 140016,mptcp dss ack 2097709625 seq 2398165696 subseq 425545 len 1428 csum 0x5298], length 1428
17:22:17.422363 IP 112.26.3.8.38791 > 112.26.3.1.targus-getdata1: Flags [.], seq 32844:34272, ack 1, win 4107, options [nop,nop,TS val 4294883680 ecr 140016,mptcp dss ack 2097709625 seq 2398167124 subseq 426973 len 1428 csum 0x7819], length 1428
17:22:17.441281 IP 112.26.3.8.38791 > 112.26.3.1.targus-getdata1: Flags [.], seq 22848:24276, ack 1, win 4107, options [nop,nop,TS val 4294883152 ecr 139483,mptcp dss ack 2097709625 seq 2398138564 subseq 416977 len 1428 csum 0x700], length 1428
17:22:17.448701 IP 112.26.3.8.38791 > 112.26.3.1.targus-getdata1: Flags [.], seq 22848:24276, ack 1, win 4107, options [nop,nop,TS val 4294883152 ecr 139483,mptcp dss ack 2097709625 seq 2398138564 subseq 416977 len 1428 csum 0x700], length 1428
17:22:17.455745 IP 112.26.3.1.targus-getdata1 > 112.26.3.8.38791: Flags [.], ack 24276, win 24272, options [nop,nop,TS val 140157 ecr 4294883152,mptcp dss ack 2397988624], length 0
17:22:17.472699 IP 112.26.3.1.targus-getdata1 > 112.26.3.8.38791: Flags [.], ack 24276, win 24272, options [nop,nop,TS val 140157 ecr 4294883152,mptcp dss ack 2397988624], length 0
17:22:17.513555 IP 112.26.3.8.38791 > 112.26.3.1.targus-getdata1: Flags [.], seq 24276:25704, ack 1, win 4107, options [nop,nop,TS val 4294883271 ecr 139540,mptcp dss ack 2097709625 seq 2398144276 subseq 418405 len 1428 csum 0xf9fa], length 1428
17:22:17.539139 IP 112.26.3.8.38791 > 112.26.3.1.targus-getdata1: Flags [.], seq 34272:35700, ack 1, win 4107, options [nop,nop,TS val 4294883822 ecr 140157,mptcp dss ack 2097709625 seq 2398174264 subseq 428401 len 1428 csum 0x3cad], length 1428
17:22:17.549990 IP 112.26.3.8.38791 > 112.26.3.1.targus-getdata1: Flags [.], seq 24276:25704, ack 1, win 4107, options [nop,nop,TS val 4294883271 ecr 139540,mptcp dss ack 2097709625 seq 2398144276 subseq 418405 len 1428 csum 0xf9fa], length 1428
17:22:17.555138 IP 112.26.3.1.targus-getdata1 > 112.26.3.8.38791: Flags [.], ack 25704, win 24272, options [nop,nop,TS val 140262 ecr 4294883271,mptcp dss ack 2397988624], length 0
17:22:17.556385 IP 112.26.3.1.targus-getdata1 > 112.26.3.8.38791: Flags [.], ack 25704, win 24272, options [nop,nop,TS val 140262 ecr 4294883271,mptcp dss ack 2397988624], length 0
17:22:17.614515 IP 112.26.3.8.38791 > 112.26.3.1.targus-getdata1: Flags [.], seq 35700:37128, ack 1, win 4107, options [nop,nop,TS val 4294883923 ecr 140262,mptcp dss ack 2097709625 seq 2398175692 subseq 429829 len 1428 csum 0x63f], length 1428
17:22:17.647191 IP 112.26.3.8.38791 > 112.26.3.1.targus-getdata1: Flags [.], seq 25704:27132, ack 1, win 4107, options [nop,nop,TS val 4294883341 ecr 139621,mptcp dss ack 2097709625 seq 2398149988 subseq 419833 len 1428 csum 0x4d5c], length 1428
17:22:17.651693 IP 112.26.3.8.38791 > 112.26.3.1.targus-getdata1: Flags [.], seq 25704:27132, ack 1, win 4107, options [nop,nop,TS val 4294883341 ecr 139621,mptcp dss ack 2097709625 seq 2398149988 subseq 419833 len 1428 csum 0x4d5c], length 1428
17:22:17.655797 IP 112.26.3.1.targus-getdata1 > 112.26.3.8.38791: Flags [.], ack 27132, win 24272, options [nop,nop,TS val 140363 ecr 4294883341,mptcp dss ack 2397988624], length 0
17:22:17.672233 IP 112.26.3.1.targus-getdata1 > 112.26.3.8.38791: Flags [.], ack 27132, win 24272, options [nop,nop,TS val 140363 ecr 4294883341,mptcp dss ack 2397988624], length 0
17:22:17.705010 IP 112.26.3.8.38791 > 112.26.3.1.targus-getdata1: Flags [.], seq 37128:38556, ack 1, win 4107, options [nop,nop,TS val 4294884022 ecr 140363,mptcp dss ack 2097709625 seq 2398182832 subseq 431257 len 1428 csum 0x1dfc], length 1428
17:22:17.744652 IP 112.26.3.8.38791 > 112.26.3.1.targus-getdata1: Flags [.], seq 27132:28560, ack 1, win 4107, options [nop,nop,TS val 4294883494 ecr 139731,mptcp dss ack 2097709625 seq 2398152844 subseq 421261 len 1428 csum 0xaf94], length 1428
17:22:17.747453 IP 112.26.3.8.38791 > 112.26.3.1.targus-getdata1: Flags [.], seq 27132:28560, ack 1, win 4107, options [nop,nop,TS val 4294883494 ecr 139731,mptcp dss ack 2097709625 seq 2398152844 subseq 421261 len 1428 csum 0xaf94], length 1428
17:22:17.750488 IP 112.26.3.1.targus-getdata1 > 112.26.3.8.38791: Flags [.], ack 28560, win 24272, options [nop,nop,TS val 140459 ecr 4294883494,mptcp dss ack 2397988624], length 0
17:22:17.779352 IP 112.26.3.8.38791 > 112.26.3.1.targus-getdata1: Flags [.], seq 38556:39984, ack 1, win 4107, options [nop,nop,TS val 4294884118 ecr 140459,mptcp dss ack 2097709625 seq 2398185688 subseq 432685 len 1428 csum 0x5001], length 1428
17:22:17.799460 IP 112.26.3.1.targus-getdata1 > 112.26.3.8.38791: Flags [.], ack 28560, win 24272, options [nop,nop,TS val 140459 ecr 4294883494,mptcp dss ack 2397988624], length 0
17:22:17.843777 IP 112.26.3.8.38791 > 112.26.3.1.targus-getdata1: Flags [.], seq 39984:41412, ack 1, win 4107, options [nop,nop,TS val 4294884118 ecr 140459,mptcp dss ack 2097709625 seq 2398187116 subseq 434113 len 1428 csum 0x93c4], length 1428
17:22:17.861749 IP 112.26.3.8.38791 > 112.26.3.1.targus-getdata1: Flags [.], seq 28560:29988, ack 1, win 4107, options [nop,nop,TS val 4294883514 ecr 139824,mptcp dss ack 2097709625 seq 2398154272 subseq 422689 len 1428 csum 0x718d], length 1428
17:22:17.863953 IP 112.26.3.8.38791 > 112.26.3.1.targus-getdata1: Flags [.], seq 28560:29988, ack 1, win 4107, options [nop,nop,TS val 4294883514 ecr 139824,mptcp dss ack 2097709625 seq 2398154272 subseq 422689 len 1428 csum 0x718d], length 1428
17:22:17.897398 IP 112.26.3.1.targus-getdata1 > 112.26.3.8.38791: Flags [.], ack 29988, win 24272, options [nop,nop,TS val 140575 ecr 4294883514,mptcp dss ack 2397988624], length 0
17:22:17.917678 IP 112.26.3.1.targus-getdata1 > 112.26.3.8.38791: Flags [.], ack 29988, win 24272, options [nop,nop,TS val 140575 ecr 4294883514,mptcp dss ack 2397988624], length 0
17:22:17.942399 IP 112.26.3.8.38791 > 112.26.3.1.targus-getdata1: Flags [.], seq 29988:31416, ack 1, win 4107, options [nop,nop,TS val 4294883594 ecr 139933,mptcp dss ack 2097709625 seq 2398161412 subseq 424117 len 1428 csum 0xbc3f], length 1428
17:22:17.965562 IP 112.26.3.1.targus-getdata1 > 112.26.3.8.38791: Flags [.], ack 31416, win 24272, options [nop,nop,TS val 140674 ecr 4294883594,mptcp dss ack 2397988624], length 0
17:22:17.966807 IP 112.26.3.1.targus-getdata1 > 112.26.3.8.38791: Flags [.], ack 31416, win 24272, options [nop,nop,TS val 140674 ecr 4294883594,mptcp dss ack 2397988624], length 0
17:22:17.978162 IP 112.26.3.8.38791 > 112.26.3.1.targus-getdata1: Flags [.], seq 41412:42840, ack 1, win 4107, options [nop,nop,TS val 4294884240 ecr 140575,mptcp dss ack 2097709625 seq 2398188544 subseq 435541 len 1428 csum 0x813d], length 1428
17:22:18.009740 IP 112.26.3.8.38791 > 112.26.3.1.targus-getdata1: Flags [.], seq 29988:31416, ack 1, win 4107, options [nop,nop,TS val 4294883594 ecr 139933,mptcp dss ack 2097709625 seq 2398161412 subseq 424117 len 1428 csum 0xbc3f], length 1428
17:22:18.028308 IP 112.26.3.8.38791 > 112.26.3.1.targus-getdata1: Flags [.], seq 42840:44268, ack 1, win 4107, options [nop,nop,TS val 4294884333 ecr 140674,mptcp dss ack 2097709625 seq 2398195684 subseq 436969 len 1428 csum 0xb607], length 1428
17:22:18.052454 IP 112.26.3.8.38791 > 112.26.3.1.targus-getdata1: Flags [.], seq 31416:32844, ack 1, win 4107, options [nop,nop,TS val 4294883680 ecr 140016,mptcp dss ack 2097709625 seq 2398165696 subseq 425545 len 1428 csum 0x5298], length 1428
17:22:18.054330 IP 112.26.3.8.38791 > 112.26.3.1.targus-getdata1: Flags [.], seq 31416:32844, ack 1, win 4107, options [nop,nop,TS val 4294883680 ecr 140016,mptcp dss ack 2097709625 seq 2398165696 subseq 425545 len 1428 csum 0x5298], length 1428
17:22:18.063155 IP 112.26.3.1.targus-getdata1 > 112.26.3.8.38791: Flags [.], ack 32844, win 24272, options [nop,nop,TS val 140766 ecr 4294883680,mptcp dss ack 2397988624], length 0
17:22:18.065037 IP 112.26.3.1.targus-getdata1 > 112.26.3.8.38791: Flags [.], ack 32844, win 24272, options [nop,nop,TS val 140766 ecr 4294883680,mptcp dss ack 2397988624], length 0
17:22:18.125517 IP 112.26.3.8.38791 > 112.26.3.1.targus-getdata1: Flags [.], seq 44268:45696, ack 1, win 4107, options [nop,nop,TS val 4294884427 ecr 140766,mptcp dss ack 2097709625 seq 2398197112 subseq 438397 len 1428 csum 0x7e8d], length 1428
17:22:18.130812 IP 112.26.3.8.38791 > 112.26.3.1.targus-getdata1: Flags [.], seq 32844:34272, ack 1, win 4107, options [nop,nop,TS val 4294883680 ecr 140016,mptcp dss ack 2097709625 seq 2398167124 subseq 426973 len 1428 csum 0x7819], length 1428
17:22:18.172351 IP 112.26.3.1.targus-getdata1 > 112.26.3.8.38791: Flags [.], ack 34272, win 24272, options [nop,nop,TS val 140869 ecr 4294883680,mptcp dss ack 2397988624], length 0
17:22:18.178630 IP 112.26.3.1.targus-getdata1 > 112.26.3.8.38791: Flags [.], ack 34272, win 24272, options [nop,nop,TS val 140869 ecr 4294883680,mptcp dss ack 2397988624], length 0
17:22:18.183388 IP 112.26.3.8.38791 > 112.26.3.1.targus-getdata1: Flags [.], seq 32844:34272, ack 1, win 4107, options [nop,nop,TS val 4294883680 ecr 140016,mptcp dss ack 2097709625 seq 2398167124 subseq 426973 len 1428 csum 0x7819], length 1428
17:22:18.204378 IP 112.26.3.8.38791 > 112.26.3.1.targus-getdata1: Flags [.], seq 34272:35700, ack 1, win 4107, options [nop,nop,TS val 4294883822 ecr 140157,mptcp dss ack 2097709625 seq 2398174264 subseq 428401 len 1428 csum 0x3cad], length 1428
17:22:18.217124 IP 112.26.3.8.38791 > 112.26.3.1.targus-getdata1: Flags [.], seq 45696:47124, ack 1, win 4107, options [nop,nop,TS val 4294884533 ecr 140869,mptcp dss ack 2097709625 seq 2398205680 subseq 439825 len 1428 csum 0xadc9], length 1428
17:22:18.224686 IP 112.26.3.1.targus-getdata1 > 112.26.3.8.38791: Flags [.], ack 35700, win 24272, options [nop,nop,TS val 140921 ecr 4294883822,mptcp dss ack 2397988624], length 0
17:22:18.260948 IP 112.26.3.1.targus-getdata1 > 112.26.3.8.38791: Flags [.], ack 35700, win 24272, options [nop,nop,TS val 140921 ecr 4294883822,mptcp dss ack 2397988624], length 0
17:22:18.271485 IP 112.26.3.8.38791 > 112.26.3.1.targus-getdata1: Flags [.], seq 47124:48552, ack 1, win 4107, options [nop,nop,TS val 4294884627 ecr 140921,mptcp dss ack 2097709625 seq 2398208536 subseq 441253 len 1428 csum 0xd699], length 1428
17:22:18.310687 IP 112.26.3.8.38791 > 112.26.3.1.targus-getdata1: Flags [.], seq 35700:37128, ack 1, win 4107, options [nop,nop,TS val 4294883923 ecr 140262,mptcp dss ack 2097709625 seq 2398175692 subseq 429829 len 1428 csum 0x63f], length 1428
17:22:18.313109 IP 112.26.3.8.38791 > 112.26.3.1.targus-getdata1: Flags [.], seq 35700:37128, ack 1, win 4107, options [nop,nop,TS val 4294883923 ecr 140262,mptcp dss ack 2097709625 seq 2398175692 subseq 429829 len 1428 csum 0x63f], length 1428
17:22:18.318910 IP 112.26.3.1.targus-getdata1 > 112.26.3.8.38791: Flags [.], ack 37128, win 24272, options [nop,nop,TS val 141025 ecr 4294883923,mptcp dss ack 2397988624], length 0
17:22:18.323975 IP 112.26.3.1.targus-getdata1 > 112.26.3.8.38791: Flags [.], ack 37128, win 24272, options [nop,nop,TS val 141025 ecr 4294883923,mptcp dss ack 2397988624], length 0
17:22:18.354799 IP 112.26.3.8.38791 > 112.26.3.1.targus-getdata1: Flags [.], seq 48552:49980, ack 1, win 4107, options [nop,nop,TS val 4294884685 ecr 141025,mptcp dss ack 2097709625 seq 2398211392 subseq 442681 len 1428 csum 0x6d78], length 1428
17:22:18.413716 IP 112.26.3.8.38791 > 112.26.3.1.targus-getdata1: Flags [.], seq 37128:38556, ack 1, win 4107, options [nop,nop,TS val 4294884022 ecr 140363,mptcp dss ack 2097709625 seq 2398182832 subseq 431257 len 1428 csum 0x1dfc], length 1428
17:22:18.419117 IP 112.26.3.8.38791 > 112.26.3.1.targus-getdata1: Flags [.], seq 37128:38556, ack 1, win 4107, options [nop,nop,TS val 4294884022 ecr 140363,mptcp dss ack 2097709625 seq 2398182832 subseq 431257 len 1428 csum 0x1dfc], length 1428
17:22:18.433643 IP 112.26.3.1.targus-getdata1 > 112.26.3.8.38791: Flags [.], ack 38556, win 24272, options [nop,nop,TS val 141131 ecr 4294884022,mptcp dss ack 2397988624], length 0
17:22:18.434379 IP 112.26.3.1.targus-getdata1 > 112.26.3.8.38791: Flags [.], ack 38556, win 24272, options [nop,nop,TS val 141131 ecr 4294884022,mptcp dss ack 2397988624], length 0
17:22:18.443134 IP 112.26.3.8.38791 > 112.26.3.1.targus-getdata1: Flags [.], seq 49980:51408, ack 1, win 4107, options [nop,nop,TS val 4294884801 ecr 141131,mptcp dss ack 2097709625 seq 2398217104 subseq 444109 len 1428 csum 0xb959], length 1428
17:22:18.497324 IP 112.26.3.8.38791 > 112.26.3.1.targus-getdata1: Flags [.], seq 38556:39984, ack 1, win 4107, options [nop,nop,TS val 4294884118 ecr 140459,mptcp dss ack 2097709625 seq 2398185688 subseq 432685 len 1428 csum 0x5001], length 1428
17:22:18.501564 IP 112.26.3.8.38791 > 112.26.3.1.targus-getdata1: Flags [.], seq 38556:39984, ack 1, win 4107, options [nop,nop,TS val 4294884118 ecr 140459,mptcp dss ack 2097709625 seq 2398185688 subseq 432685 len 1428 csum 0x5001], length 1428
17:22:18.526168 IP 112.26.3.1.targus-getdata1 > 112.26.3.8.38791: Flags [.], ack 39984, win 24272, options [nop,nop,TS val 141213 ecr 4294884118,mptcp dss ack 2397988624], length 0
17:22:18.530752 IP 112.26.3.8.38791 > 112.26.3.1.targus-getdata1: Flags [.], seq 51408:52836, ack 1, win 4107, options [nop,nop,TS val 4294884892 ecr 141213,mptcp dss ack 2097709625 seq 2398219960 subseq 445537 len 1428 csum 0x6ca6], length 1428
17:22:18.532149 IP 112.26.3.1.targus-getdata1 > 112.26.3.8.38791: Flags [.], ack 39984, win 24272, options [nop,nop,TS val 141213 ecr 4294884118,mptcp dss ack 2397988624], length 0
17:22:18.608893 IP 112.26.3.8.38791 > 112.26.3.1.targus-getdata1: Flags [.], seq 41412:42840, ack 1, win 4107, options [nop,nop,TS val 4294884240 ecr 140575,mptcp dss ack 2097709625 seq 2398188544 subseq 435541 len 1428 csum 0x813d], length 1428
17:22:18.610487 IP 112.26.3.8.38791 > 112.26.3.1.targus-getdata1: Flags [.], seq 41412:42840, ack 1, win 4107, options [nop,nop,TS val 4294884240 ecr 140575,mptcp dss ack 2097709625 seq 2398188544 subseq 435541 len 1428 csum 0x813d], length 1428
17:22:18.617088 IP 112.26.3.1.targus-getdata1 > 112.26.3.8.38791: Flags [.], ack 39984, win 24272, options [nop,nop,TS val 141322 ecr 4294884118,nop,nop,sack 1 {41412:42840},mptcp dss ack 2397988624], length 0
17:22:18.626097 IP 112.26.3.1.targus-getdata1 > 112.26.3.8.38791: Flags [.], ack 39984, win 24272, options [nop,nop,TS val 141322 ecr 4294884118,nop,nop,sack 1 {41412:42840},mptcp dss ack 2397988624], length 0
17:22:18.635630 IP 112.26.3.8.38791 > 112.26.3.1.targus-getdata1: Flags [.], seq 52836:54264, ack 1, win 4107, options [nop,nop,TS val 4294884999 ecr 141322,mptcp dss ack 2097709625 seq 2398228528 subseq 446965 len 1428 csum 0x484d], length 1428
17:22:18.697342 IP 112.26.3.8.38791 > 112.26.3.1.targus-getdata1: Flags [.], seq 42840:44268, ack 1, win 4107, options [nop,nop,TS val 4294884333 ecr 140674,mptcp dss ack 2097709625 seq 2398195684 subseq 436969 len 1428 csum 0xb607], length 1428
17:22:18.700255 IP 112.26.3.8.38791 > 112.26.3.1.targus-getdata1: Flags [.], seq 42840:44268, ack 1, win 4107, options [nop,nop,TS val 4294884333 ecr 140674,mptcp dss ack 2097709625 seq 2398195684 subseq 436969 len 1428 csum 0xb607], length 1428
17:22:18.707484 IP 112.26.3.1.targus-getdata1 > 112.26.3.8.38791: Flags [.], ack 39984, win 24272, options [nop,nop,TS val 141412 ecr 4294884118,nop,nop,sack 1 {41412:44268},mptcp dss ack 2397988624], length 0
17:22:18.741008 IP 112.26.3.8.38791 > 112.26.3.1.targus-getdata1: Flags [.], seq 44268:45696, ack 1, win 4107, options [nop,nop,TS val 4294884427 ecr 140766,mptcp dss ack 2097709625 seq 2398197112 subseq 438397 len 1428 csum 0x7e8d], length 1428
17:22:18.752663 IP 112.26.3.1.targus-getdata1 > 112.26.3.8.38791: Flags [.], ack 39984, win 24272, options [nop,nop,TS val 141412 ecr 4294884118,nop,nop,sack 1 {41412:44268},mptcp dss ack 2397988624], length 0
17:22:18.763935 IP 112.26.3.8.38791 > 112.26.3.1.targus-getdata1: Flags [.], seq 54264:55692, ack 1, win 4107, options [nop,nop,TS val 4294885123 ecr 141412,mptcp dss ack 2097709625 seq 2398234240 subseq 448393 len 1428 csum 0x5bc4], length 1428
17:22:18.794460 IP 112.26.3.8.38791 > 112.26.3.1.targus-getdata1: Flags [.], seq 45696:47124, ack 1, win 4107, options [nop,nop,TS val 4294884533 ecr 140869,mptcp dss ack 2097709625 seq 2398205680 subseq 439825 len 1428 csum 0xadc9], length 1428
17:22:18.801269 IP 112.26.3.8.38791 > 112.26.3.1.targus-getdata1: Flags [.], seq 44268:45696, ack 1, win 4107, options [nop,nop,TS val 4294884427 ecr 140766,mptcp dss ack 2097709625 seq 2398197112 subseq 438397 len 1428 csum 0x7e8d], length 1428
17:22:18.806291 IP 112.26.3.1.targus-getdata1 > 112.26.3.8.38791: Flags [.], ack 39984, win 24272, options [nop,nop,TS val 141513 ecr 4294884118,nop,nop,sack 1 {41412:45696},mptcp dss ack 2397988624], length 0
17:22:18.809332 IP 112.26.3.1.targus-getdata1 > 112.26.3.8.38791: Flags [.], ack 39984, win 24272, options [nop,nop,TS val 141513 ecr 4294884118,nop,nop,sack 1 {41412:45696},mptcp dss ack 2397988624], length 0
17:22:18.848162 IP 112.26.3.8.38791 > 112.26.3.1.targus-getdata1: Flags [.], seq 39984:41412, ack 1, win 4107, options [nop,nop,TS val 4294885174 ecr 141513,mptcp dss ack 2097709625 seq 2398187116 subseq 434113 len 1428 csum 0x93c4], length 1428
17:22:18.883434 IP 112.26.3.8.38791 > 112.26.3.1.targus-getdata1: Flags [.], seq 47124:48552, ack 1, win 4107, options [nop,nop,TS val 4294884627 ecr 140921,mptcp dss ack 2097709625 seq 2398208536 subseq 441253 len 1428 csum 0xd699], length 1428
17:22:18.909158 IP 112.26.3.1.targus-getdata1 > 112.26.3.8.38791: Flags [.], ack 39984, win 24272, options [nop,nop,TS val 141617 ecr 4294884118,nop,nop,sack 1 {41412:47124},mptcp dss ack 2397988624], length 0
17:22:18.911499 IP 112.26.3.1.targus-getdata1 > 112.26.3.8.38791: Flags [.], ack 39984, win 24272, options [nop,nop,TS val 141617 ecr 4294884118,nop,nop,sack 1 {41412:47124},mptcp dss ack 2397988624], length 0
17:22:18.922283 IP 112.26.3.8.38791 > 112.26.3.1.targus-getdata1: Flags [.], seq 45696:47124, ack 1, win 4107, options [nop,nop,TS val 4294884533 ecr 140869,mptcp dss ack 2097709625 seq 2398205680 subseq 439825 len 1428 csum 0xadc9], length 1428
17:22:18.935803 IP 112.26.3.8.38791 > 112.26.3.1.targus-getdata1: Flags [.], seq 48552:49980, ack 1, win 4107, options [nop,nop,TS val 4294884685 ecr 141025,mptcp dss ack 2097709625 seq 2398211392 subseq 442681 len 1428 csum 0x6d78], length 1428
17:22:19.007884 IP 112.26.3.8.38791 > 112.26.3.1.targus-getdata1: Flags [.], seq 55692:57120, ack 1, win 4107, options [nop,nop,TS val 4294885372 ecr 141617,mptcp dss ack 2097709625 seq 2398244236 subseq 449821 len 1428 csum 0x6476], length 1428
17:22:19.024452 IP 112.26.3.1.targus-getdata1 > 112.26.3.8.38791: Flags [.], ack 39984, win 24272, options [nop,nop,TS val 141733 ecr 4294884118,nop,nop,sack 1 {41412:48552},mptcp dss ack 2397988624], length 0
17:22:19.030789 IP 112.26.3.1.targus-getdata1 > 112.26.3.8.38791: Flags [.], ack 39984, win 24272, options [nop,nop,TS val 141733 ecr 4294884118,nop,nop,sack 1 {41412:48552},mptcp dss ack 2397988624], length 0
17:22:19.036074 IP 112.26.3.8.38791 > 112.26.3.1.targus-getdata1: Flags [.], seq 49980:51408, ack 1, win 4107, options [nop,nop,TS val 4294884801 ecr 141131,mptcp dss ack 2097709625 seq 2398217104 subseq 444109 len 1428 csum 0xb959], length 1428
17:22:19.081936 IP 112.26.3.8.38791 > 112.26.3.1.targus-getdata1: Flags [.], seq 47124:48552, ack 1, win 4107, options [nop,nop,TS val 4294884627 ecr 140921,mptcp dss ack 2097709625 seq 2398208536 subseq 441253 len 1428 csum 0xd699], length 1428
17:22:19.084399 IP 112.26.3.8.38791 > 112.26.3.1.targus-getdata1: Flags [.], seq 48552:49980, ack 1, win 4107, options [nop,nop,TS val 4294884685 ecr 141025,mptcp dss ack 2097709625 seq 2398211392 subseq 442681 len 1428 csum 0x6d78], length 1428
17:22:19.119033 IP 112.26.3.1.targus-getdata1 > 112.26.3.8.38791: Flags [.], ack 39984, win 24272, options [nop,nop,TS val 141796 ecr 4294884118,nop,nop,sack 1 {41412:49980},mptcp dss ack 2397988624], length 0
17:22:19.120849 IP 112.26.3.1.targus-getdata1 > 112.26.3.8.38791: Flags [.], ack 39984, win 24272, options [nop,nop,TS val 141796 ecr 4294884118,nop,nop,sack 1 {41412:49980},mptcp dss ack 2397988624], length 0
