17:21:41.816590 IP 112.26.1.8.42347 > 112.26.1.1.targus-getdata1: Flags [S], seq 290770274, win 65535, options [mss 1460,sackOK,TS val 4294848073 ecr 0,nop,wscale 6,mptcp join id 6 token 0xf09729a5 nonce 0x76221797], length 0
17:21:41.868260 IP 112.26.1.8.42347 > 112.26.1.1.targus-getdata1: Flags [S], seq 290770274, win 65535, options [mss 1460,sackOK,TS val 4294848073 ecr 0,nop,wscale 6,mptcp join id 6 token 0xf09729a5 nonce 0x76221797], length 0
17:21:41.914184 IP 112.26.1.1.targus-getdata1 > 112.26.1.8.42347: Flags [S.], seq 3532344014, ack 290770275, win 65535, options [mss 1460,sackOK,TS val 104580 ecr 4294848073,nop,wscale 6,mptcp join id 3 hmac 0xb5ad88ec9ee7a553 nonce 0xf9fc2354], length 0
17:21:42.009554 IP 112.26.1.1.targus-getdata1 > 112.26.1.8.42347: Flags [S.], seq 3532344014, ack 290770275, win 65535, options [mss 1460,sackOK,TS val 104580 ecr 4294848073,nop,wscale 6,mptcp join id 3 hmac 0xb5ad88ec9ee7a553 nonce 0xf9fc2354], length 0
17:21:42.070559 IP 112.26.1.1.targus-getdata1 > 112.26.1.8.42347: Flags [S.], seq 3532344014, ack 290770275, win 65535, options [mss 1460,sackOK,TS val 104580 ecr 4294848073,nop,wscale 6,mptcp join id 3 hmac 0xb5ad88ec9ee7a553 nonce 0xf9fc2354], length 0
17:21:42.160444 IP 112.26.1.8.42347 > 112.26.1.1.targus-getdata1: Flags [.], ack 1, win 4107, options [nop,nop,TS val 4294848437 ecr 104580,mptcp join hmac 0xebf55a9000fa74197b29d5827a2bb16fd3f0e1da], length 0
17:21:42.162821 IP 112.26.1.8.42347 > 112.26.1.1.targus-getdata1: Flags [.], ack 1, win 4107, options [nop,nop,TS val 4294848437 ecr 104580,mptcp join hmac 0xebf55a9000fa74197b29d5827a2bb16fd3f0e1da], length 0
17:22:20.412475 IP 112.26.1.1.targus-getdata1 > 112.26.1.8.38587: Flags [.], ack 3983406344, win 21504, options [nop,nop,TS val 143122 ecr 4294885913,mptcp dss ack 2398238524], length 0
17:22:20.412889 IP 112.26.1.1.targus-getdata1 > 112.26.1.8.38587: Flags [.], ack 1, win 21504, options [nop,nop,TS val 143122 ecr 4294885913,mptcp dss ack 2398238524], length 0
17:22:20.442329 IP 112.26.1.8.38587 > 112.26.1.1.targus-getdata1: Flags [.], seq 4285:5713, ack 0, win 4107, options [nop,nop,TS val 4294886751 ecr 142298,mptcp dss ack 2097709625 seq 2398312780 subseq 325585 len 1428 csum 0xa329], length 1428
17:22:20.442683 IP 112.26.1.8.38587 > 112.26.1.1.targus-getdata1: Flags [.], seq 4285:5713, ack 0, win 4107, options [nop,nop,TS val 4294886751 ecr 142298,mptcp dss ack 2097709625 seq 2398312780 subseq 325585 len 1428 csum 0xa329], length 1428
17:22:20.512222 IP 112.26.1.1.targus-getdata1 > 112.26.1.8.38587: Flags [.], ack 4294910177, win 24272, options [nop,nop,TS val 142369 ecr 4294879203,nop,nop,sack 1 {4294920173:4294961585},mptcp dss ack 2397988624], length 0
17:22:20.559891 IP 112.26.1.8.38587 > 112.26.1.1.targus-getdata1: Flags [.], seq 5713:7141, ack 0, win 4107, options [nop,nop,TS val 4294886900 ecr 142369,mptcp dss ack 2097709625 seq 2398317064 subseq 327013 len 1428 csum 0x33df], length 1428
17:22:20.560165 IP 112.26.1.8.38587 > 112.26.1.1.targus-getdata1: Flags [.], seq 5713:7141, ack 0, win 4107, options [nop,nop,TS val 4294886900 ecr 142369,mptcp dss ack 2097709625 seq 2398317064 subseq 327013 len 1428 csum 0x33df], length 1428
17:22:20.626848 IP 112.26.1.1.targus-getdata1 > 112.26.1.8.38587: Flags [.], ack 1429, win 24226, options [nop,nop,TS val 143337 ecr 4294886207,mptcp dss ack 2398238524], length 0
17:22:20.627171 IP 112.26.1.1.targus-getdata1 > 112.26.1.8.38587: Flags [.], ack 1429, win 24226, options [nop,nop,TS val 143337 ecr 4294886207,mptcp dss ack 2398238524], length 0
17:22:20.634352 IP 112.26.1.1.targus-getdata1 > 112.26.1.8.38587: Flags [.], ack 4294910177, win 24272, options [nop,nop,TS val 142516 ecr 4294879203,nop,nop,sack 1 {4294920173:4294963013},mptcp dss ack 2397988624], length 0
17:22:20.677526 IP 112.26.1.8.38587 > 112.26.1.1.targus-getdata1: Flags [.], seq 7141:8569, ack 0, win 4107, options [nop,nop,TS val 4294887021 ecr 142516,mptcp dss ack 2097709625 seq 2398325632 subseq 328441 len 1428 csum 0x7b06], length 1428
17:22:20.677856 IP 112.26.1.8.38587 > 112.26.1.1.targus-getdata1: Flags [.], seq 7141:8569, ack 0, win 4107, options [nop,nop,TS val 4294887021 ecr 142516,mptcp dss ack 2097709625 seq 2398325632 subseq 328441 len 1428 csum 0x7b06], length 1428
17:22:20.746262 IP 112.26.1.1.targus-getdata1 > 112.26.1.8.38587: Flags [.], ack 4294910177, win 24272, options [nop,nop,TS val 142602 ecr 4294879203,nop,nop,sack 1 {4294920173:4294964441},mptcp dss ack 2397988624], length 0
17:22:20.777216 IP 112.26.1.8.38587 > 112.26.1.1.targus-getdata1: Flags [.], seq 8569:9997, ack 0, win 4107, options [nop,nop,TS val 4294887134 ecr 142602,mptcp dss ack 2097709625 seq 2398328488 subseq 329869 len 1428 csum 0x98e], length 1428
17:22:20.777555 IP 112.26.1.8.38587 > 112.26.1.1.targus-getdata1: Flags [.], seq 8569:9997, ack 0, win 4107, options [nop,nop,TS val 4294887134 ecr 142602,mptcp dss ack 2097709625 seq 2398328488 subseq 329869 len 1428 csum 0x98e], length 1428
17:22:20.805386 IP 112.26.1.1.targus-getdata1 > 112.26.1.8.38587: Flags [.], ack 2857, win 24226, options [nop,nop,TS val 143513 ecr 4294886338,mptcp dss ack 2398238524], length 0
17:22:20.805726 IP 112.26.1.1.targus-getdata1 > 112.26.1.8.38587: Flags [.], ack 2857, win 24226, options [nop,nop,TS val 143513 ecr 4294886338,mptcp dss ack 2398238524], length 0
17:22:20.881746 IP 112.26.1.1.targus-getdata1 > 112.26.1.8.38587: Flags [.], ack 4294910177, win 24272, options [nop,nop,TS val 142730 ecr 4294879203,nop,nop,sack 1 {4294920173:4294965869},mptcp dss ack 2397988624], length 0
17:22:20.914065 IP 112.26.1.8.38587 > 112.26.1.1.targus-getdata1: Flags [.], seq 9997:11425, ack 0, win 4107, options [nop,nop,TS val 4294887275 ecr 142730,mptcp dss ack 2097709625 seq 2398337056 subseq 331297 len 1428 csum 0x71e5], length 1428
17:22:20.914409 IP 112.26.1.8.38587 > 112.26.1.1.targus-getdata1: Flags [.], seq 9997:11425, ack 0, win 4107, options [nop,nop,TS val 4294887275 ecr 142730,mptcp dss ack 2097709625 seq 2398337056 subseq 331297 len 1428 csum 0x71e5], length 1428
17:22:20.984138 IP 112.26.1.1.targus-getdata1 > 112.26.1.8.38587: Flags [.], ack 4294910177, win 24272, options [nop,nop,TS val 142979 ecr 4294879203,nop,nop,sack 1 {4294920173:1},mptcp dss ack 2397988624], length 0
17:22:21.054337 IP 112.26.1.1.targus-getdata1 > 112.26.1.8.38587: Flags [.], ack 4285, win 24226, options [nop,nop,TS val 143764 ecr 4294886647,mptcp dss ack 2398238524], length 0
17:22:21.054632 IP 112.26.1.1.targus-getdata1 > 112.26.1.8.38587: Flags [.], ack 4285, win 24226, options [nop,nop,TS val 143764 ecr 4294886647,mptcp dss ack 2398238524], length 0
17:22:21.087703 IP 112.26.1.8.38587 > 112.26.1.1.targus-getdata1: Flags [.], seq 11425:12853, ack 0, win 4107, options [nop,nop,TS val 4294887445 ecr 142979,mptcp dss ack 2097709625 seq 2398339912 subseq 332725 len 1428 csum 0x62e7], length 1428
17:22:21.088026 IP 112.26.1.8.38587 > 112.26.1.1.targus-getdata1: Flags [.], seq 11425:12853, ack 0, win 4107, options [nop,nop,TS val 4294887445 ecr 142979,mptcp dss ack 2097709625 seq 2398339912 subseq 332725 len 1428 csum 0x62e7], length 1428
17:22:21.136317 IP 112.26.1.1.targus-getdata1 > 112.26.1.8.38587: Flags [.], ack 1, win 21504, options [nop,nop,TS val 143122 ecr 4294885913,mptcp dss ack 2398238524], length 0
17:22:21.208528 IP 112.26.1.8.38587 > 112.26.1.1.targus-getdata1: Flags [.], seq 12853:14281, ack 0, win 4107, options [nop,nop,TS val 4294887503 ecr 143122,mptcp dss ack 2097709625 seq 2398348480 subseq 334153 len 1428 csum 0xe7e1], length 1428
17:22:21.208896 IP 112.26.1.8.38587 > 112.26.1.1.targus-getdata1: Flags [.], seq 12853:14281, ack 0, win 4107, options [nop,nop,TS val 4294887503 ecr 143122,mptcp dss ack 2097709625 seq 2398348480 subseq 334153 len 1428 csum 0xe7e1], length 1428
17:22:21.240517 IP 112.26.1.1.targus-getdata1 > 112.26.1.8.38587: Flags [.], ack 5713, win 24226, options [nop,nop,TS val 143949 ecr 4294886751,mptcp dss ack 2398238524], length 0
17:22:21.240800 IP 112.26.1.1.targus-getdata1 > 112.26.1.8.38587: Flags [.], ack 5713, win 24226, options [nop,nop,TS val 143949 ecr 4294886751,mptcp dss ack 2398238524], length 0
17:22:21.263272 IP 112.26.1.8.38587 > 112.26.1.1.targus-getdata1: Flags [.], seq 14281:15709, ack 0, win 4107, options [nop,nop,TS val 4294887503 ecr 143122,mptcp dss ack 2097709625 seq 2398349908 subseq 335581 len 1428 csum 0x75ac], length 1428
17:22:21.263525 IP 112.26.1.8.38587 > 112.26.1.1.targus-getdata1: Flags [.], seq 14281:15709, ack 0, win 4107, options [nop,nop,TS val 4294887503 ecr 143122,mptcp dss ack 2097709625 seq 2398349908 subseq 335581 len 1428 csum 0x75ac], length 1428
17:22:21.320410 IP 112.26.1.1.targus-getdata1 > 112.26.1.8.38587: Flags [.], ack 7141, win 24226, options [nop,nop,TS val 144028 ecr 4294886900,mptcp dss ack 2398238524], length 0
17:22:21.320694 IP 112.26.1.1.targus-getdata1 > 112.26.1.8.38587: Flags [.], ack 7141, win 24226, options [nop,nop,TS val 144028 ecr 4294886900,mptcp dss ack 2398238524], length 0
17:22:21.335374 IP 112.26.1.8.38587 > 112.26.1.1.targus-getdata1: Flags [.], seq 15709:17137, ack 0, win 4107, options [nop,nop,TS val 4294887503 ecr 143122,mptcp dss ack 2097709625 seq 2398351336 subseq 337009 len 1428 csum 0xa7e9], length 1428
17:22:21.335732 IP 112.26.1.8.38587 > 112.26.1.1.targus-getdata1: Flags [.], seq 15709:17137, ack 0, win 4107, options [nop,nop,TS val 4294887503 ecr 143122,mptcp dss ack 2097709625 seq 2398351336 subseq 337009 len 1428 csum 0xa7e9], length 1428
17:22:21.442815 IP 112.26.1.8.38587 > 112.26.1.1.targus-getdata1: Flags [.], seq 17137:18565, ack 0, win 4107, options [nop,nop,TS val 4294887503 ecr 143122,mptcp dss ack 2097709625 seq 2398352764 subseq 338437 len 1428 csum 0xe126], length 1428
17:22:21.443136 IP 112.26.1.8.38587 > 112.26.1.1.targus-getdata1: Flags [.], seq 17137:18565, ack 0, win 4107, options [nop,nop,TS val 4294887503 ecr 143122,mptcp dss ack 2097709625 seq 2398352764 subseq 338437 len 1428 csum 0xe126], length 1428
17:22:21.453937 IP 112.26.1.1.targus-getdata1 > 112.26.1.8.38587: Flags [.], ack 1429, win 24226, options [nop,nop,TS val 143337 ecr 4294886207,mptcp dss ack 2398238524], length 0
17:22:21.549182 IP 112.26.1.1.targus-getdata1 > 112.26.1.8.38587: Flags [.], ack 7141, win 24102, options [nop,nop,TS val 144259 ecr 4294886900,nop,nop,sack 1 {8569:9997},mptcp dss ack 2398264228], length 0
17:22:21.549506 IP 112.26.1.1.targus-getdata1 > 112.26.1.8.38587: Flags [.], ack 7141, win 24102, options [nop,nop,TS val 144259 ecr 4294886900,nop,nop,sack 1 {8569:9997},mptcp dss ack 2398264228], length 0
17:22:21.575300 IP 112.26.1.8.38587 > 112.26.1.1.targus-getdata1: Flags [.], seq 18565:19993, ack 0, win 4107, options [nop,nop,TS val 4294887503 ecr 143122,mptcp dss ack 2097709625 seq 2398354192 subseq 339865 len 1428 csum 0x8abd], length 1428
17:22:21.575647 IP 112.26.1.8.38587 > 112.26.1.1.targus-getdata1: Flags [.], seq 18565:19993, ack 0, win 4107, options [nop,nop,TS val 4294887503 ecr 143122,mptcp dss ack 2097709625 seq 2398354192 subseq 339865 len 1428 csum 0x8abd], length 1428
17:22:21.653935 IP 112.26.1.1.targus-getdata1 > 112.26.1.8.38587: Flags [.], ack 7141, win 24169, options [nop,nop,TS val 144364 ecr 4294886900,nop,nop,sack 1 {8569:11425},mptcp dss ack 2398278508], length 0
17:22:21.654245 IP 112.26.1.1.targus-getdata1 > 112.26.1.8.38587: Flags [.], ack 7141, win 24169, options [nop,nop,TS val 144364 ecr 4294886900,nop,nop,sack 1 {8569:11425},mptcp dss ack 2398278508], length 0
17:22:21.706444 IP 112.26.1.8.38587 > 112.26.1.1.targus-getdata1: Flags [.], seq 19993:21421, ack 0, win 4107, options [nop,nop,TS val 4294887503 ecr 143122,mptcp dss ack 2097709625 seq 2398355620 subseq 341293 len 1428 csum 0xdeea], length 1428
17:22:21.706772 IP 112.26.1.8.38587 > 112.26.1.1.targus-getdata1: Flags [.], seq 19993:21421, ack 0, win 4107, options [nop,nop,TS val 4294887503 ecr 143122,mptcp dss ack 2097709625 seq 2398355620 subseq 341293 len 1428 csum 0xdeea], length 1428
17:22:21.729628 IP 112.26.1.1.targus-getdata1 > 112.26.1.8.38587: Flags [.], ack 4285, win 24226, options [nop,nop,TS val 143764 ecr 4294886647,mptcp dss ack 2398238524], length 0
17:22:21.788877 IP 112.26.1.1.targus-getdata1 > 112.26.1.8.38587: Flags [.], ack 7141, win 24136, options [nop,nop,TS val 144499 ecr 4294886900,nop,nop,sack 1 {8569:12853},mptcp dss ack 2398289932], length 0
17:22:21.789110 IP 112.26.1.1.targus-getdata1 > 112.26.1.8.38587: Flags [.], ack 7141, win 24136, options [nop,nop,TS val 144499 ecr 4294886900,nop,nop,sack 1 {8569:12853},mptcp dss ack 2398289932], length 0
17:22:21.830462 IP 112.26.1.8.38587 > 112.26.1.1.targus-getdata1: Flags [.], seq 21421:22849, ack 0, win 4107, options [nop,nop,TS val 4294887503 ecr 143122,mptcp dss ack 2097709625 seq 2398357048 subseq 342721 len 1428 csum 0xfcf2], length 1428
17:22:21.830806 IP 112.26.1.8.38587 > 112.26.1.1.targus-getdata1: Flags [.], seq 21421:22849, ack 0, win 4107, options [nop,nop,TS val 4294887503 ecr 143122,mptcp dss ack 2097709625 seq 2398357048 subseq 342721 len 1428 csum 0xfcf2], length 1428
17:22:21.878523 IP 112.26.1.1.targus-getdata1 > 112.26.1.8.38587: Flags [.], ack 7141, win 24136, options [nop,nop,TS val 144585 ecr 4294886900,nop,nop,sack 1 {8569:14281},mptcp dss ack 2398289932], length 0
17:22:21.878855 IP 112.26.1.1.targus-getdata1 > 112.26.1.8.38587: Flags [.], ack 7141, win 24136, options [nop,nop,TS val 144585 ecr 4294886900,nop,nop,sack 1 {8569:14281},mptcp dss ack 2398289932], length 0
17:22:21.944858 IP 112.26.1.8.38587 > 112.26.1.1.targus-getdata1: Flags [.], seq 22849:24277, ack 0, win 4107, options [nop,nop,TS val 4294887503 ecr 143122,mptcp dss ack 2097709625 seq 2398358476 subseq 344149 len 1428 csum 0xbf8e], length 1428
17:22:21.945157 IP 112.26.1.8.38587 > 112.26.1.1.targus-getdata1: Flags [.], seq 22849:24277, ack 0, win 4107, options [nop,nop,TS val 4294887503 ecr 143122,mptcp dss ack 2097709625 seq 2398358476 subseq 344149 len 1428 csum 0xbf8e], length 1428
17:22:21.961799 IP 112.26.1.1.targus-getdata1 > 112.26.1.8.38587: Flags [.], ack 5713, win 24226, options [nop,nop,TS val 143949 ecr 4294886751,mptcp dss ack 2398238524], length 0
17:22:22.031360 IP 112.26.1.1.targus-getdata1 > 112.26.1.8.38587: Flags [.], ack 7141, win 24401, options [nop,nop,TS val 144740 ecr 4294886900,nop,nop,sack 1 {8569:15709},mptcp dss ack 2398325632], length 0
17:22:22.031699 IP 112.26.1.1.targus-getdata1 > 112.26.1.8.38587: Flags [.], ack 7141, win 24401, options [nop,nop,TS val 144740 ecr 4294886900,nop,nop,sack 1 {8569:15709},mptcp dss ack 2398325632], length 0
17:22:22.047839 IP 112.26.1.8.38587 > 112.26.1.1.targus-getdata1: Flags [.], seq 24277:25705, ack 0, win 4107, options [nop,nop,TS val 4294887821 ecr 143337,mptcp dss ack 2097709625 seq 2398371328 subseq 345577 len 1428 csum 0x9558], length 1428
17:22:22.048119 IP 112.26.1.8.38587 > 112.26.1.1.targus-getdata1: Flags [.], seq 24277:25705, ack 0, win 4107, options [nop,nop,TS val 4294887821 ecr 143337,mptcp dss ack 2097709625 seq 2398371328 subseq 345577 len 1428 csum 0x9558], length 1428
17:22:22.113743 IP 112.26.1.1.targus-getdata1 > 112.26.1.8.38587: Flags [.], ack 7141, win 24226, options [nop,nop,TS val 144028 ecr 4294886900,mptcp dss ack 2398238524], length 0
17:22:22.185653 IP 112.26.1.8.38587 > 112.26.1.1.targus-getdata1: Flags [.], seq 25705:27133, ack 0, win 4107, options [nop,nop,TS val 4294888096 ecr 143764,mptcp dss ack 2097709625 seq 2398379896 subseq 347005 len 1428 csum 0x7932], length 1428
17:22:22.186028 IP 112.26.1.8.38587 > 112.26.1.1.targus-getdata1: Flags [.], seq 25705:27133, ack 0, win 4107, options [nop,nop,TS val 4294888096 ecr 143764,mptcp dss ack 2097709625 seq 2398379896 subseq 347005 len 1428 csum 0x7932], length 1428
17:22:22.229643 IP 112.26.1.1.targus-getdata1 > 112.26.1.8.38587: Flags [.], ack 7141, win 24401, options [nop,nop,TS val 144936 ecr 4294886900,nop,nop,sack 2 {17137:18565}{8569:15709},mptcp dss ack 2398325632], length 0
17:22:22.229971 IP 112.26.1.1.targus-getdata1 > 112.26.1.8.38587: Flags [.], ack 7141, win 24401, options [nop,nop,TS val 144936 ecr 4294886900,nop,nop,sack 2 {17137:18565}{8569:15709},mptcp dss ack 2398325632], length 0
17:22:22.294948 IP 112.26.1.8.38587 > 112.26.1.1.targus-getdata1: Flags [.], seq 27133:28561, ack 0, win 4107, options [nop,nop,TS val 4294888096 ecr 143764,mptcp dss ack 2097709625 seq 2398381324 subseq 348433 len 1428 csum 0xb361], length 1428
17:22:22.295302 IP 112.26.1.8.38587 > 112.26.1.1.targus-getdata1: Flags [.], seq 27133:28561, ack 0, win 4107, options [nop,nop,TS val 4294888096 ecr 143764,mptcp dss ack 2097709625 seq 2398381324 subseq 348433 len 1428 csum 0xb361], length 1428
17:22:22.328211 IP 112.26.1.1.targus-getdata1 > 112.26.1.8.38587: Flags [.], ack 7141, win 24102, options [nop,nop,TS val 144259 ecr 4294886900,nop,nop,sack 1 {8569:9997},mptcp dss ack 2398264228], length 0
17:22:22.336783 IP 112.26.1.8.38587 > 112.26.1.1.targus-getdata1: Flags [.], seq 28561:29989, ack 0, win 4107, options [nop,nop,TS val 4294888096 ecr 143764,mptcp dss ack 2097709625 seq 2398382752 subseq 349861 len 1428 csum 0x3618], length 1428
17:22:22.337064 IP 112.26.1.8.38587 > 112.26.1.1.targus-getdata1: Flags [.], seq 28561:29989, ack 0, win 4107, options [nop,nop,TS val 4294888096 ecr 143764,mptcp dss ack 2097709625 seq 2398382752 subseq 349861 len 1428 csum 0x3618], length 1428
17:22:22.402588 IP 112.26.1.1.targus-getdata1 > 112.26.1.8.38587: Flags [.], ack 7141, win 24401, options [nop,nop,TS val 145113 ecr 4294886900,nop,nop,sack 2 {17137:19993}{8569:15709},mptcp dss ack 2398325632], length 0
17:22:22.402913 IP 112.26.1.1.targus-getdata1 > 112.26.1.8.38587: Flags [.], ack 7141, win 24401, options [nop,nop,TS val 145113 ecr 4294886900,nop,nop,sack 2 {17137:19993}{8569:15709},mptcp dss ack 2398325632], length 0
17:22:22.449194 IP 112.26.1.8.38587 > 112.26.1.1.targus-getdata1: Flags [.], seq 29989:31417, ack 0, win 4107, options [nop,nop,TS val 4294888328 ecr 143949,mptcp dss ack 2097709625 seq 2398391320 subseq 351289 len 1428 csum 0x87ed], length 1428
17:22:22.449552 IP 112.26.1.8.38587 > 112.26.1.1.targus-getdata1: Flags [.], seq 29989:31417, ack 0, win 4107, options [nop,nop,TS val 4294888328 ecr 143949,mptcp dss ack 2097709625 seq 2398391320 subseq 351289 len 1428 csum 0x87ed], length 1428
17:22:22.464753 IP 112.26.1.1.targus-getdata1 > 112.26.1.8.38587: Flags [.], ack 7141, win 24169, options [nop,nop,TS val 144364 ecr 4294886900,nop,nop,sack 1 {8569:11425},mptcp dss ack 2398278508], length 0
17:22:22.536405 IP 112.26.1.1.targus-getdata1 > 112.26.1.8.38587: Flags [.], ack 7141, win 24136, options [nop,nop,TS val 144499 ecr 4294886900,nop,nop,sack 1 {8569:12853},mptcp dss ack 2398289932], length 0
17:22:22.567657 IP 112.26.1.8.38587 > 112.26.1.1.targus-getdata1: Flags [.], seq 31417:32845, ack 0, win 4107, options [nop,nop,TS val 4294888480 ecr 144028,mptcp dss ack 2097709625 seq 2398398460 subseq 352717 len 1428 csum 0xcc28], length 1428
17:22:22.567996 IP 112.26.1.8.38587 > 112.26.1.1.targus-getdata1: Flags [.], seq 31417:32845, ack 0, win 4107, options [nop,nop,TS val 4294888480 ecr 144028,mptcp dss ack 2097709625 seq 2398398460 subseq 352717 len 1428 csum 0xcc28], length 1428
17:22:22.625969 IP 112.26.1.1.targus-getdata1 > 112.26.1.8.38587: Flags [.], ack 7141, win 24401, options [nop,nop,TS val 145330 ecr 4294886900,nop,nop,sack 2 {21421:22849}{17137:19993},mptcp dss ack 2398325632], length 0
17:22:22.626246 IP 112.26.1.1.targus-getdata1 > 112.26.1.8.38587: Flags [.], ack 7141, win 24401, options [nop,nop,TS val 145330 ecr 4294886900,nop,nop,sack 2 {21421:22849}{17137:19993},mptcp dss ack 2398325632], length 0
17:22:22.650809 IP 112.26.1.8.38587 > 112.26.1.1.targus-getdata1: Flags [.], seq 32845:34273, ack 0, win 4107, options [nop,nop,TS val 4294888480 ecr 144028,mptcp dss ack 2097709625 seq 2398399888 subseq 354145 len 1428 csum 0x53b5], length 1428
17:22:22.651138 IP 112.26.1.8.38587 > 112.26.1.1.targus-getdata1: Flags [.], seq 32845:34273, ack 0, win 4107, options [nop,nop,TS val 4294888480 ecr 144028,mptcp dss ack 2097709625 seq 2398399888 subseq 354145 len 1428 csum 0x53b5], length 1428
17:22:22.718849 IP 112.26.1.1.targus-getdata1 > 112.26.1.8.38587: Flags [.], ack 7141, win 24401, options [nop,nop,TS val 145427 ecr 4294886900,nop,nop,sack 2 {21421:24277}{17137:19993},mptcp dss ack 2398325632], length 0
17:22:22.719171 IP 112.26.1.1.targus-getdata1 > 112.26.1.8.38587: Flags [.], ack 7141, win 24401, options [nop,nop,TS val 145427 ecr 4294886900,nop,nop,sack 2 {21421:24277}{17137:19993},mptcp dss ack 2398325632], length 0
17:22:22.740660 IP 112.26.1.8.38587 > 112.26.1.1.targus-getdata1: Flags [.], seq 34273:35701, ack 0, win 4107, options [nop,nop,TS val 4294888696 ecr 144259,mptcp dss ack 2097709625 seq 2398405600 subseq 355573 len 1428 csum 0x72a5], length 1428
17:22:22.740980 IP 112.26.1.8.38587 > 112.26.1.1.targus-getdata1: Flags [.], seq 34273:35701, ack 0, win 4107, options [nop,nop,TS val 4294888696 ecr 144259,mptcp dss ack 2097709625 seq 2398405600 subseq 355573 len 1428 csum 0x72a5], length 1428
17:22:22.781908 IP 112.26.1.8.38587 > 112.26.1.1.targus-getdata1: Flags [.], seq 35701:37129, ack 0, win 4107, options [nop,nop,TS val 4294888860 ecr 144364,mptcp dss ack 2097709625 seq 2398429876 subseq 357001 len 1428 csum 0x80d9], length 1428
17:22:22.782243 IP 112.26.1.8.38587 > 112.26.1.1.targus-getdata1: Flags [.], seq 35701:37129, ack 0, win 4107, options [nop,nop,TS val 4294888860 ecr 144364,mptcp dss ack 2097709625 seq 2398429876 subseq 357001 len 1428 csum 0x80d9], length 1428
17:22:22.847080 IP 112.26.1.1.targus-getdata1 > 112.26.1.8.38587: Flags [.], ack 7141, win 24401, options [nop,nop,TS val 145555 ecr 4294886900,nop,nop,sack 2 {21421:25705}{17137:19993},mptcp dss ack 2398325632], length 0
17:22:22.847405 IP 112.26.1.1.targus-getdata1 > 112.26.1.8.38587: Flags [.], ack 7141, win 24401, options [nop,nop,TS val 145555 ecr 4294886900,nop,nop,sack 2 {21421:25705}{17137:19993},mptcp dss ack 2398325632], length 0
17:22:22.879167 IP 112.26.1.8.38587 > 112.26.1.1.targus-getdata1: Flags [.], seq 37129:38557, ack 0, win 4107, options [nop,nop,TS val 4294888944 ecr 144499,mptcp dss ack 2097709625 seq 2398437016 subseq 358429 len 1428 csum 0x72c4], length 1428
17:22:22.879468 IP 112.26.1.8.38587 > 112.26.1.1.targus-getdata1: Flags [.], seq 37129:38557, ack 0, win 4107, options [nop,nop,TS val 4294888944 ecr 144499,mptcp dss ack 2097709625 seq 2398437016 subseq 358429 len 1428 csum 0x72c4], length 1428
17:22:22.926611 IP 112.26.1.1.targus-getdata1 > 112.26.1.8.38587: Flags [.], ack 7141, win 24401, options [nop,nop,TS val 145635 ecr 4294886900,nop,nop,sack 2 {21421:27133}{17137:19993},mptcp dss ack 2398325632], length 0
17:22:22.926922 IP 112.26.1.1.targus-getdata1 > 112.26.1.8.38587: Flags [.], ack 7141, win 24401, options [nop,nop,TS val 145635 ecr 4294886900,nop,nop,sack 2 {21421:27133}{17137:19993},mptcp dss ack 2398325632], length 0
17:22:22.985396 IP 112.26.1.8.38587 > 112.26.1.1.targus-getdata1: Flags [.], seq 38557:39985, ack 0, win 4107, options [nop,nop,TS val 4294888944 ecr 144499,mptcp dss ack 2097709625 seq 2398438444 subseq 359857 len 1428 csum 0x1700], length 1428
17:22:22.985656 IP 112.26.1.8.38587 > 112.26.1.1.targus-getdata1: Flags [.], seq 38557:39985, ack 0, win 4107, options [nop,nop,TS val 4294888944 ecr 144499,mptcp dss ack 2097709625 seq 2398438444 subseq 359857 len 1428 csum 0x1700], length 1428
17:22:23.044485 IP 112.26.1.1.targus-getdata1 > 112.26.1.8.38587: Flags [.], ack 7141, win 24401, options [nop,nop,TS val 144936 ecr 4294886900,nop,nop,sack 2 {17137:18565}{8569:15709},mptcp dss ack 2398325632], length 0
17:22:23.114637 IP 112.26.1.8.38587 > 112.26.1.1.targus-getdata1: Flags [.], seq 7141:8569, ack 0, win 4107, options [nop,nop,TS val 4294889407 ecr 144936,mptcp dss ack 2097709625 seq 2398325632 subseq 328441 len 1428 csum 0x7b06], length 1428
17:22:23.114931 IP 112.26.1.8.38587 > 112.26.1.1.targus-getdata1: Flags [.], seq 7141:8569, ack 0, win 4107, options [nop,nop,TS val 4294889407 ecr 144936,mptcp dss ack 2097709625 seq 2398325632 subseq 328441 len 1428 csum 0x7b06], length 1428
17:22:23.127337 IP 112.26.1.1.targus-getdata1 > 112.26.1.8.38587: Flags [.], ack 7141, win 24401, options [nop,nop,TS val 145835 ecr 4294886900,nop,nop,sack 2 {28561:29989}{21421:27133},mptcp dss ack 2398325632], length 0
17:22:23.127642 IP 112.26.1.1.targus-getdata1 > 112.26.1.8.38587: Flags [.], ack 7141, win 24401, options [nop,nop,TS val 145835 ecr 4294886900,nop,nop,sack 2 {28561:29989}{21421:27133},mptcp dss ack 2398325632], length 0
17:22:23.189640 IP 112.26.1.1.targus-getdata1 > 112.26.1.8.38587: Flags [.], ack 7141, win 24401, options [nop,nop,TS val 145113 ecr 4294886900,nop,nop,sack 2 {17137:19993}{8569:15709},mptcp dss ack 2398325632], length 0
17:22:23.218067 IP 112.26.1.8.38587 > 112.26.1.1.targus-getdata1: Flags [.], seq 15709:17137, ack 0, win 4107, options [nop,nop,TS val 4294889407 ecr 144936,mptcp dss ack 2097709625 seq 2398351336 subseq 337009 len 1428 csum 0xa7e9], length 1428
17:22:23.218358 IP 112.26.1.8.38587 > 112.26.1.1.targus-getdata1: Flags [.], seq 15709:17137, ack 0, win 4107, options [nop,nop,TS val 4294889407 ecr 144936,mptcp dss ack 2097709625 seq 2398351336 subseq 337009 len 1428 csum 0xa7e9], length 1428
17:22:23.254377 IP 112.26.1.1.targus-getdata1 > 112.26.1.8.38587: Flags [.], ack 7141, win 24401, options [nop,nop,TS val 145959 ecr 4294886900,nop,nop,sack 2 {28561:31417}{21421:27133},mptcp dss ack 2398325632], length 0
17:22:23.254555 IP 112.26.1.1.targus-getdata1 > 112.26.1.8.38587: Flags [.], ack 7141, win 24401, options [nop,nop,TS val 145959 ecr 4294886900,nop,nop,sack 2 {28561:31417}{21421:27133},mptcp dss ack 2398325632], length 0
17:22:23.323770 IP 112.26.1.1.targus-getdata1 > 112.26.1.8.38587: Flags [.], ack 7141, win 24401, options [nop,nop,TS val 146033 ecr 4294886900,nop,nop,sack 2 {28561:32845}{21421:27133},mptcp dss ack 2398325632], length 0
17:22:23.324003 IP 112.26.1.1.targus-getdata1 > 112.26.1.8.38587: Flags [.], ack 7141, win 24401, options [nop,nop,TS val 146033 ecr 4294886900,nop,nop,sack 2 {28561:32845}{21421:27133},mptcp dss ack 2398325632], length 0
17:22:23.352065 IP 112.26.1.8.38587 > 112.26.1.1.targus-getdata1: Flags [.], seq 39985:41413, ack 0, win 4107, options [nop,nop,TS val 4294889492 ecr 144936,mptcp dss ack 2097709625 seq 2398459864 subseq 361285 len 1428 csum 0x4ed7], length 1428
17:22:23.352293 IP 112.26.1.8.38587 > 112.26.1.1.targus-getdata1: Flags [.], seq 39985:41413, ack 0, win 4107, options [nop,nop,TS val 4294889492 ecr 144936,mptcp dss ack 2097709625 seq 2398459864 subseq 361285 len 1428 csum 0x4ed7], length 1428
17:22:23.431953 IP 112.26.1.1.targus-getdata1 > 112.26.1.8.38587: Flags [.], ack 7141, win 24401, options [nop,nop,TS val 145330 ecr 4294886900,nop,nop,sack 2 {21421:22849}{17137:19993},mptcp dss ack 2398325632], length 0
17:22:23.443685 IP 112.26.1.8.38587 > 112.26.1.1.targus-getdata1: Flags [.], seq 19993:21421, ack 0, win 4107, options [nop,nop,TS val 4294889799 ecr 145330,mptcp dss ack 2097709625 seq 2398355620 subseq 341293 len 1428 csum 0xdeea], length 1428
17:22:23.443987 IP 112.26.1.8.38587 > 112.26.1.1.targus-getdata1: Flags [.], seq 19993:21421, ack 0, win 4107, options [nop,nop,TS val 4294889799 ecr 145330,mptcp dss ack 2097709625 seq 2398355620 subseq 341293 len 1428 csum 0xdeea], length 1428
17:22:23.521904 IP 112.26.1.1.targus-getdata1 > 112.26.1.8.38587: Flags [.], ack 7141, win 24401, options [nop,nop,TS val 145427 ecr 4294886900,nop,nop,sack 2 {21421:24277}{17137:19993},mptcp dss ack 2398325632], length 0
17:22:23.543808 IP 112.26.1.8.38587 > 112.26.1.1.targus-getdata1: Flags [.], seq 41413:42841, ack 0, win 4107, options [nop,nop,TS val 4294889904 ecr 145427,mptcp dss ack 2097709625 seq 2398478428 subseq 362713 len 1428 csum 0x791b], length 1428
17:22:23.544042 IP 112.26.1.8.38587 > 112.26.1.1.targus-getdata1: Flags [.], seq 41413:42841, ack 0, win 4107, options [nop,nop,TS val 4294889904 ecr 145427,mptcp dss ack 2097709625 seq 2398478428 subseq 362713 len 1428 csum 0x791b], length 1428
17:22:23.574229 IP 112.26.1.1.targus-getdata1 > 112.26.1.8.38587: Flags [.], ack 7141, win 24401, options [nop,nop,TS val 146284 ecr 4294886900,nop,nop,sack 2 {34273:35701}{28561:32845},mptcp dss ack 2398325632], length 0
17:22:23.574503 IP 112.26.1.1.targus-getdata1 > 112.26.1.8.38587: Flags [.], ack 7141, win 24401, options [nop,nop,TS val 146284 ecr 4294886900,nop,nop,sack 2 {34273:35701}{28561:32845},mptcp dss ack 2398325632], length 0
17:22:23.666484 IP 112.26.1.1.targus-getdata1 > 112.26.1.8.38587: Flags [.], ack 7141, win 24401, options [nop,nop,TS val 145555 ecr 4294886900,nop,nop,sack 2 {21421:25705}{17137:19993},mptcp dss ack 2398325632], length 0
17:22:23.734505 IP 112.26.1.1.targus-getdata1 > 112.26.1.8.38587: Flags [.], ack 7141, win 24401, options [nop,nop,TS val 145635 ecr 4294886900,nop,nop,sack 2 {21421:27133}{17137:19993},mptcp dss ack 2398325632], length 0
17:22:23.783323 IP 112.26.1.1.targus-getdata1 > 112.26.1.8.38587: Flags [.], ack 7141, win 24401, options [nop,nop,TS val 146493 ecr 4294886900,nop,nop,sack 2 {38557:39985}{34273:35701},mptcp dss ack 2398325632], length 0
17:22:23.783663 IP 112.26.1.1.targus-getdata1 > 112.26.1.8.38587: Flags [.], ack 7141, win 24401, options [nop,nop,TS val 146493 ecr 4294886900,nop,nop,sack 2 {38557:39985}{34273:35701},mptcp dss ack 2398325632], length 0
17:22:23.876128 IP 112.26.1.1.targus-getdata1 > 112.26.1.8.38587: Flags [.], ack 15709, win 24268, options [nop,nop,TS val 146586 ecr 4294889407,nop,nop,sack 2 {38557:39985}{34273:35701},mptcp dss ack 2398334200], length 0
17:22:23.876452 IP 112.26.1.1.targus-getdata1 > 112.26.1.8.38587: Flags [.], ack 15709, win 24268, options [nop,nop,TS val 146586 ecr 4294889407,nop,nop,sack 2 {38557:39985}{34273:35701},mptcp dss ack 2398334200], length 0
17:22:23.922750 IP 112.26.1.1.targus-getdata1 > 112.26.1.8.38587: Flags [.], ack 7141, win 24401, options [nop,nop,TS val 145835 ecr 4294886900,nop,nop,sack 2 {28561:29989}{21421:27133},mptcp dss ack 2398325632], length 0
17:22:23.929250 IP 112.26.1.8.38587 > 112.26.1.1.targus-getdata1: Flags [.], seq 27133:28561, ack 0, win 4107, options [nop,nop,TS val 4294890282 ecr 145835,mptcp dss ack 2097709625 seq 2398381324 subseq 348433 len 1428 csum 0xb361], length 1428
17:22:23.929606 IP 112.26.1.8.38587 > 112.26.1.1.targus-getdata1: Flags [.], seq 27133:28561, ack 0, win 4107, options [nop,nop,TS val 4294890282 ecr 145835,mptcp dss ack 2097709625 seq 2398381324 subseq 348433 len 1428 csum 0xb361], length 1428
17:22:24.006012 IP 112.26.1.1.targus-getdata1 > 112.26.1.8.38587: Flags [.], ack 7141, win 24401, options [nop,nop,TS val 145959 ecr 4294886900,nop,nop,sack 2 {28561:31417}{21421:27133},mptcp dss ack 2398325632], length 0
17:22:24.045110 IP 112.26.1.8.38587 > 112.26.1.1.targus-getdata1: Flags [.], seq 42841:44269, ack 0, win 4107, options [nop,nop,TS val 4294890401 ecr 145959,mptcp dss ack 2097709625 seq 2398492708 subseq 364141 len 1428 csum 0xd937], length 1428
17:22:24.045433 IP 112.26.1.8.38587 > 112.26.1.1.targus-getdata1: Flags [.], seq 42841:44269, ack 0, win 4107, options [nop,nop,TS val 4294890401 ecr 145959,mptcp dss ack 2097709625 seq 2398492708 subseq 364141 len 1428 csum 0xd937], length 1428
17:22:24.084791 IP 112.26.1.1.targus-getdata1 > 112.26.1.8.38587: Flags [.], ack 7141, win 24401, options [nop,nop,TS val 146033 ecr 4294886900,nop,nop,sack 2 {28561:32845}{21421:27133},mptcp dss ack 2398325632], length 0
17:22:24.128897 IP 112.26.1.1.targus-getdata1 > 112.26.1.8.38587: Flags [.], ack 15709, win 24268, options [nop,nop,TS val 146839 ecr 4294889407,nop,nop,sack 2 {19993:27133}{38557:39985},mptcp dss ack 2398334200], length 0
17:22:24.129127 IP 112.26.1.1.targus-getdata1 > 112.26.1.8.38587: Flags [.], ack 15709, win 24268, options [nop,nop,TS val 146839 ecr 4294889407,nop,nop,sack 2 {19993:27133}{38557:39985},mptcp dss ack 2398334200], length 0
17:22:24.174478 IP 112.26.1.8.38587 > 112.26.1.1.targus-getdata1: Flags [.], seq 44269:45697, ack 0, win 4107, options [nop,nop,TS val 4294890532 ecr 146033,mptcp dss ack 2097709625 seq 2398499848 subseq 365569 len 1428 csum 0xb2b5], length 1428
17:22:24.174863 IP 112.26.1.8.38587 > 112.26.1.1.targus-getdata1: Flags [.], seq 44269:45697, ack 0, win 4107, options [nop,nop,TS val 4294890532 ecr 146033,mptcp dss ack 2097709625 seq 2398499848 subseq 365569 len 1428 csum 0xb2b5], length 1428
17:22:24.222250 IP 112.26.1.1.targus-getdata1 > 112.26.1.8.38587: Flags [.], ack 15709, win 24014, options [nop,nop,TS val 146931 ecr 4294889407,nop,nop,sack 2 {41413:42841}{19993:27133},mptcp dss ack 2398351336], length 0
17:22:24.222564 IP 112.26.1.1.targus-getdata1 > 112.26.1.8.38587: Flags [.], ack 15709, win 24014, options [nop,nop,TS val 146931 ecr 4294889407,nop,nop,sack 2 {41413:42841}{19993:27133},mptcp dss ack 2398351336], length 0
17:22:24.297260 IP 112.26.1.1.targus-getdata1 > 112.26.1.8.38587: Flags [.], ack 7141, win 24401, options [nop,nop,TS val 146284 ecr 4294886900,nop,nop,sack 2 {34273:35701}{28561:32845},mptcp dss ack 2398325632], length 0
17:22:24.307532 IP 112.26.1.8.38587 > 112.26.1.1.targus-getdata1: Flags [.], seq 32845:34273, ack 0, win 4107, options [nop,nop,TS val 4294890664 ecr 146284,mptcp dss ack 2097709625 seq 2398399888 subseq 354145 len 1428 csum 0x53b5], length 1428
17:22:24.307885 IP 112.26.1.8.38587 > 112.26.1.1.targus-getdata1: Flags [.], seq 32845:34273, ack 0, win 4107, options [nop,nop,TS val 4294890664 ecr 146284,mptcp dss ack 2097709625 seq 2398399888 subseq 354145 len 1428 csum 0x53b5], length 1428
17:22:24.360759 IP 112.26.1.1.targus-getdata1 > 112.26.1.8.38587: Flags [.], ack 7141, win 24401, options [nop,nop,TS val 146493 ecr 4294886900,nop,nop,sack 2 {38557:39985}{34273:35701},mptcp dss ack 2398325632], length 0
17:22:24.399730 IP 112.26.1.8.38587 > 112.26.1.1.targus-getdata1: Flags [.], seq 35701:37129, ack 0, win 4107, options [nop,nop,TS val 4294890728 ecr 146493,mptcp dss ack 2097709625 seq 2398429876 subseq 357001 len 1428 csum 0x80d9], length 1428
17:22:24.400093 IP 112.26.1.8.38587 > 112.26.1.1.targus-getdata1: Flags [.], seq 35701:37129, ack 0, win 4107, options [nop,nop,TS val 4294890728 ecr 146493,mptcp dss ack 2097709625 seq 2398429876 subseq 357001 len 1428 csum 0x80d9], length 1428
17:22:24.521281 IP 112.26.1.1.targus-getdata1 > 112.26.1.8.38587: Flags [.], ack 15709, win 24268, options [nop,nop,TS val 146586 ecr 4294889407,nop,nop,sack 2 {38557:39985}{34273:35701},mptcp dss ack 2398334200], length 0
17:22:24.554220 IP 112.26.1.8.38587 > 112.26.1.1.targus-getdata1: Flags [.], seq 37129:38557, ack 0, win 4107, options [nop,nop,TS val 4294890888 ecr 146586,mptcp dss ack 2097709625 seq 2398437016 subseq 358429 len 1428 csum 0x72c4], length 1428
17:22:24.554503 IP 112.26.1.8.38587 > 112.26.1.1.targus-getdata1: Flags [.], seq 37129:38557, ack 0, win 4107, options [nop,nop,TS val 4294890888 ecr 146586,mptcp dss ack 2097709625 seq 2398437016 subseq 358429 len 1428 csum 0x72c4], length 1428
17:22:24.607582 IP 112.26.1.1.targus-getdata1 > 112.26.1.8.38587: Flags [.], ack 15709, win 24014, options [nop,nop,TS val 147302 ecr 4294889407,nop,nop,sack 2 {19993:28561}{41413:42841},mptcp dss ack 2398351336], length 0
17:22:24.607906 IP 112.26.1.1.targus-getdata1 > 112.26.1.8.38587: Flags [.], ack 15709, win 24014, options [nop,nop,TS val 147302 ecr 4294889407,nop,nop,sack 2 {19993:28561}{41413:42841},mptcp dss ack 2398351336], length 0
17:22:24.666446 IP 112.26.1.8.38587 > 112.26.1.1.targus-getdata1: Flags [.], seq 45697:47125, ack 0, win 4107, options [nop,nop,TS val 4294890888 ecr 146586,mptcp dss ack 2097709625 seq 2398514128 subseq 366997 len 1428 csum 0x101d], length 1428
17:22:24.666758 IP 112.26.1.8.38587 > 112.26.1.1.targus-getdata1: Flags [.], seq 45697:47125, ack 0, win 4107, options [nop,nop,TS val 4294890888 ecr 146586,mptcp dss ack 2097709625 seq 2398514128 subseq 366997 len 1428 csum 0x101d], length 1428
17:22:24.717056 IP 112.26.1.1.targus-getdata1 > 112.26.1.8.38587: Flags [.], ack 15709, win 24014, options [nop,nop,TS val 147424 ecr 4294889407,nop,nop,sack 2 {41413:44269}{19993:28561},mptcp dss ack 2398351336], length 0
17:22:24.717376 IP 112.26.1.1.targus-getdata1 > 112.26.1.8.38587: Flags [.], ack 15709, win 24014, options [nop,nop,TS val 147424 ecr 4294889407,nop,nop,sack 2 {41413:44269}{19993:28561},mptcp dss ack 2398351336], length 0
17:22:24.794851 IP 112.26.1.8.38587 > 112.26.1.1.targus-getdata1: Flags [P.], seq 47125:48553, ack 0, win 4107, options [nop,nop,TS val 4294890888 ecr 146586,mptcp dss ack 2097709625 seq 2398515556 subseq 368425 len 1428 csum 0x5da6], length 1428
17:22:24.795109 IP 112.26.1.8.38587 > 112.26.1.1.targus-getdata1: Flags [P.], seq 47125:48553, ack 0, win 4107, options [nop,nop,TS val 4294890888 ecr 146586,mptcp dss ack 2097709625 seq 2398515556 subseq 368425 len 1428 csum 0x5da6], length 1428
17:22:24.828853 IP 112.26.1.1.targus-getdata1 > 112.26.1.8.38587: Flags [.], ack 15709, win 24268, options [nop,nop,TS val 146839 ecr 4294889407,nop,nop,sack 2 {19993:27133}{38557:39985},mptcp dss ack 2398334200], length 0
17:22:24.895365 IP 112.26.1.8.38587 > 112.26.1.1.targus-getdata1: Flags [.], seq 48553:49981, ack 0, win 4107, options [nop,nop,TS val 4294890888 ecr 146586,mptcp dss ack 2097709625 seq 2398516984 subseq 369853 len 1428 csum 0xeb3b], length 1428
17:22:24.895720 IP 112.26.1.8.38587 > 112.26.1.1.targus-getdata1: Flags [.], seq 48553:49981, ack 0, win 4107, options [nop,nop,TS val 4294890888 ecr 146586,mptcp dss ack 2097709625 seq 2398516984 subseq 369853 len 1428 csum 0xeb3b], length 1428
17:22:24.911596 IP 112.26.1.1.targus-getdata1 > 112.26.1.8.38587: Flags [.], ack 15709, win 24014, options [nop,nop,TS val 147622 ecr 4294889407,nop,nop,sack 2 {41413:45697}{19993:28561},mptcp dss ack 2398351336], length 0
17:22:24.911863 IP 112.26.1.1.targus-getdata1 > 112.26.1.8.38587: Flags [.], ack 15709, win 24014, options [nop,nop,TS val 147622 ecr 4294889407,nop,nop,sack 2 {41413:45697}{19993:28561},mptcp dss ack 2398351336], length 0
17:22:25.008321 IP 112.26.1.1.targus-getdata1 > 112.26.1.8.38587: Flags [.], ack 15709, win 24014, options [nop,nop,TS val 146931 ecr 4294889407,nop,nop,sack 2 {41413:42841}{19993:27133},mptcp dss ack 2398351336], length 0
17:22:25.039123 IP 112.26.1.8.38587 > 112.26.1.1.targus-getdata1: Flags [.], seq 49981:51409, ack 0, win 4107, options [nop,nop,TS val 4294890888 ecr 146586,mptcp dss ack 2097709625 seq 2398518412 subseq 371281 len 1428 csum 0x740a], length 1428
17:22:25.039446 IP 112.26.1.8.38587 > 112.26.1.1.targus-getdata1: Flags [.], seq 49981:51409, ack 0, win 4107, options [nop,nop,TS val 4294890888 ecr 146586,mptcp dss ack 2097709625 seq 2398518412 subseq 371281 len 1428 csum 0x740a], length 1428
17:22:25.082561 IP 112.26.1.1.targus-getdata1 > 112.26.1.8.38587: Flags [.], ack 15709, win 24014, options [nop,nop,TS val 147792 ecr 4294889407,nop,nop,sack 2 {32845:35701}{41413:45697},mptcp dss ack 2398351336], length 0
17:22:25.082867 IP 112.26.1.1.targus-getdata1 > 112.26.1.8.38587: Flags [.], ack 15709, win 24014, options [nop,nop,TS val 147792 ecr 4294889407,nop,nop,sack 2 {32845:35701}{41413:45697},mptcp dss ack 2398351336], length 0
17:22:25.142554 IP 112.26.1.8.38587 > 112.26.1.1.targus-getdata1: Flags [.], seq 15709:17137, ack 0, win 4107, options [nop,nop,TS val 4294891195 ecr 146839,mptcp dss ack 2097709625 seq 2398351336 subseq 337009 len 1428 csum 0xa7e9], length 1428
17:22:25.142885 IP 112.26.1.8.38587 > 112.26.1.1.targus-getdata1: Flags [.], seq 15709:17137, ack 0, win 4107, options [nop,nop,TS val 4294891195 ecr 146839,mptcp dss ack 2097709625 seq 2398351336 subseq 337009 len 1428 csum 0xa7e9], length 1428
17:22:25.212398 IP 112.26.1.1.targus-getdata1 > 112.26.1.8.38587: Flags [.], ack 15709, win 24014, options [nop,nop,TS val 147919 ecr 4294889407,nop,nop,sack 2 {32845:37129}{41413:45697},mptcp dss ack 2398351336], length 0
