17:21:41.835357 IP 112.26.2.8.51265 > 112.26.2.1.targus-getdata1: Flags [S], seq 2239226479, win 65535, options [mss 1460,sackOK,TS val 4294848074 ecr 0,nop,wscale 6,mptcp join id 4 token 0xf09729a5 nonce 0x613bd9e3], length 0
17:21:41.903950 IP 112.26.2.8.51265 > 112.26.2.1.targus-getdata1: Flags [S], seq 2239226479, win 65535, options [mss 1460,sackOK,TS val 4294848074 ecr 0,nop,wscale 6,mptcp join id 4 token 0xf09729a5 nonce 0x613bd9e3], length 0
17:21:41.943768 IP 112.26.2.1.targus-getdata1 > 112.26.2.8.51265: Flags [S.], seq 3268204220, ack 2239226480, win 65535, options [mss 1460,sackOK,TS val 104616 ecr 4294848074,nop,wscale 6,mptcp join id 6 hmac 0xe36b8bbfcbac360d nonce 0x3a338135], length 0
17:21:42.028477 IP 112.26.2.1.targus-getdata1 > 112.26.2.8.51265: Flags [S.], seq 3268204220, ack 2239226480, win 65535, options [mss 1460,sackOK,TS val 104616 ecr 4294848074,nop,wscale 6,mptcp join id 6 hmac 0xe36b8bbfcbac360d nonce 0x3a338135], length 0
17:21:42.097818 IP 112.26.2.1.targus-getdata1 > 112.26.2.8.51265: Flags [S.], seq 3268204220, ack 2239226480, win 65535, options [mss 1460,sackOK,TS val 104616 ecr 4294848074,nop,wscale 6,mptcp join id 6 hmac 0xe36b8bbfcbac360d nonce 0x3a338135], length 0
17:21:42.207253 IP 112.26.2.8.51265 > 112.26.2.1.targus-getdata1: Flags [.], ack 1, win 4107, options [nop,nop,TS val 4294848464 ecr 104616,mptcp join hmac 0x30bd180ea69308b733eeaa2c441970af63beb689], length 0
17:21:42.209982 IP 112.26.2.8.51265 > 112.26.2.1.targus-getdata1: Flags [.], ack 1, win 4107, options [nop,nop,TS val 4294848464 ecr 104616,mptcp join hmac 0x30bd180ea69308b733eeaa2c441970af63beb689], length 0
17:22:23.789715 IP 112.26.2.1.targus-getdata1 > 112.26.2.8.43985: Flags [.], ack 2646186019, win 24401, options [nop,nop,TS val 146135 ecr 4294888396,nop,nop,sack 1 {1429:8569},mptcp dss ack 2398325632], length 0
17:22:23.834106 IP 112.26.2.8.43985 > 112.26.2.1.targus-getdata1: Flags [.], seq 14281:15709, ack 0, win 4107, options [nop,nop,TS val 4294889492 ecr 145486,mptcp dss ack 2097709625 seq 2398461292 subseq 479809 len 1428 csum 0x1c2d], length 1428
17:22:23.839565 IP 112.26.2.8.43985 > 112.26.2.1.targus-getdata1: Flags [.], seq 14281:15709, ack 0, win 4107, options [nop,nop,TS val 4294889492 ecr 145486,mptcp dss ack 2097709625 seq 2398461292 subseq 479809 len 1428 csum 0x1c2d], length 1428
17:22:23.849109 IP 112.26.2.1.targus-getdata1 > 112.26.2.8.43985: Flags [.], ack 1, win 24401, options [nop,nop,TS val 146551 ecr 4294888396,nop,nop,sack 2 {14281:15709}{1429:12853},mptcp dss ack 2398325632], length 0
17:22:23.850632 IP 112.26.2.1.targus-getdata1 > 112.26.2.8.43985: Flags [.], ack 1, win 24401, options [nop,nop,TS val 146551 ecr 4294888396,nop,nop,sack 2 {14281:15709}{1429:12853},mptcp dss ack 2398325632], length 0
17:22:23.906865 IP 112.26.2.8.43985 > 112.26.2.1.targus-getdata1: Flags [.], seq 15709:17137, ack 0, win 4107, options [nop,nop,TS val 4294889617 ecr 145567,mptcp dss ack 2097709625 seq 2398468432 subseq 481237 len 1428 csum 0xf526], length 1428
17:22:23.915852 IP 112.26.2.8.43985 > 112.26.2.1.targus-getdata1: Flags [.], seq 15709:17137, ack 0, win 4107, options [nop,nop,TS val 4294889617 ecr 145567,mptcp dss ack 2097709625 seq 2398468432 subseq 481237 len 1428 csum 0xf526], length 1428
17:22:23.920942 IP 112.26.2.1.targus-getdata1 > 112.26.2.8.43985: Flags [.], ack 1, win 24268, options [nop,nop,TS val 146628 ecr 4294888396,nop,nop,sack 2 {14281:17137}{1429:12853},mptcp dss ack 2398334200], length 0
17:22:23.924794 IP 112.26.2.1.targus-getdata1 > 112.26.2.8.43985: Flags [.], ack 1, win 24268, options [nop,nop,TS val 146628 ecr 4294888396,nop,nop,sack 2 {14281:17137}{1429:12853},mptcp dss ack 2398334200], length 0
17:22:23.937316 IP 112.26.2.1.targus-getdata1 > 112.26.2.8.43985: Flags [.], ack 1, win 24401, options [nop,nop,TS val 146269 ecr 4294888396,nop,nop,sack 1 {1429:9997},mptcp dss ack 2398325632], length 0
17:22:23.998018 IP 112.26.2.8.43985 > 112.26.2.1.targus-getdata1: Flags [.], seq 17137:18565, ack 0, win 4107, options [nop,nop,TS val 4294889617 ecr 145567,mptcp dss ack 2097709625 seq 2398469860 subseq 482665 len 1428 csum 0x62a7], length 1428
17:22:24.031958 IP 112.26.2.8.43985 > 112.26.2.1.targus-getdata1: Flags [.], seq 17137:18565, ack 0, win 4107, options [nop,nop,TS val 4294889617 ecr 145567,mptcp dss ack 2097709625 seq 2398469860 subseq 482665 len 1428 csum 0x62a7], length 1428
17:22:24.036950 IP 112.26.2.1.targus-getdata1 > 112.26.2.8.43985: Flags [.], ack 1, win 24401, options [nop,nop,TS val 146395 ecr 4294888396,nop,nop,sack 1 {1429:11425},mptcp dss ack 2398325632], length 0
17:22:24.042270 IP 112.26.2.1.targus-getdata1 > 112.26.2.8.43985: Flags [.], ack 1, win 24268, options [nop,nop,TS val 146744 ecr 4294888396,nop,nop,sack 2 {14281:18565}{1429:12853},mptcp dss ack 2398334200], length 0
17:22:24.043705 IP 112.26.2.1.targus-getdata1 > 112.26.2.8.43985: Flags [.], ack 1, win 24268, options [nop,nop,TS val 146744 ecr 4294888396,nop,nop,sack 2 {14281:18565}{1429:12853},mptcp dss ack 2398334200], length 0
17:22:24.074676 IP 112.26.2.8.43985 > 112.26.2.1.targus-getdata1: Flags [.], seq 18565:19993, ack 0, win 4107, options [nop,nop,TS val 4294889760 ecr 145704,mptcp dss ack 2097709625 seq 2398471288 subseq 484093 len 1428 csum 0x1430], length 1428
17:22:24.142912 IP 112.26.2.8.43985 > 112.26.2.1.targus-getdata1: Flags [.], seq 18565:19993, ack 0, win 4107, options [nop,nop,TS val 4294889760 ecr 145704,mptcp dss ack 2097709625 seq 2398471288 subseq 484093 len 1428 csum 0x1430], length 1428
17:22:24.144880 IP 112.26.2.1.targus-getdata1 > 112.26.2.8.43985: Flags [.], ack 1, win 24268, options [nop,nop,TS val 146855 ecr 4294888396,nop,nop,sack 2 {14281:19993}{1429:12853},mptcp dss ack 2398334200], length 0
17:22:24.155447 IP 112.26.2.1.targus-getdata1 > 112.26.2.8.43985: Flags [.], ack 1, win 24268, options [nop,nop,TS val 146855 ecr 4294888396,nop,nop,sack 2 {14281:19993}{1429:12853},mptcp dss ack 2398334200], length 0
17:22:24.166290 IP 112.26.2.1.targus-getdata1 > 112.26.2.8.43985: Flags [.], ack 1, win 24401, options [nop,nop,TS val 146457 ecr 4294888396,nop,nop,sack 1 {1429:12853},mptcp dss ack 2398325632], length 0
17:22:24.199536 IP 112.26.2.8.43985 > 112.26.2.1.targus-getdata1: Flags [.], seq 19993:21421, ack 0, win 4107, options [nop,nop,TS val 4294889888 ecr 145777,mptcp dss ack 2097709625 seq 2398477000 subseq 485521 len 1428 csum 0x19d7], length 1428
17:22:24.202197 IP 112.26.2.8.43985 > 112.26.2.1.targus-getdata1: Flags [.], seq 19993:21421, ack 0, win 4107, options [nop,nop,TS val 4294889888 ecr 145777,mptcp dss ack 2097709625 seq 2398477000 subseq 485521 len 1428 csum 0x19d7], length 1428
17:22:24.211460 IP 112.26.2.1.targus-getdata1 > 112.26.2.8.43985: Flags [.], ack 1, win 24268, options [nop,nop,TS val 146914 ecr 4294888396,nop,nop,sack 2 {14281:21421}{1429:12853},mptcp dss ack 2398334200], length 0
17:22:24.226366 IP 112.26.2.1.targus-getdata1 > 112.26.2.8.43985: Flags [.], ack 1, win 24268, options [nop,nop,TS val 146914 ecr 4294888396,nop,nop,sack 2 {14281:21421}{1429:12853},mptcp dss ack 2398334200], length 0
17:22:24.251298 IP 112.26.2.1.targus-getdata1 > 112.26.2.8.43985: Flags [.], ack 1, win 24401, options [nop,nop,TS val 146551 ecr 4294888396,nop,nop,sack 2 {14281:15709}{1429:12853},mptcp dss ack 2398325632], length 0
17:22:24.313127 IP 112.26.2.8.43985 > 112.26.2.1.targus-getdata1: Flags [.], seq 1:1429, ack 0, win 4107, options [nop,nop,TS val 4294889904 ecr 145870,mptcp dss ack 2097709625 seq 2398397032 subseq 465529 len 1428 csum 0x6d27], length 1428
17:22:24.317063 IP 112.26.2.8.43985 > 112.26.2.1.targus-getdata1: Flags [.], seq 1:1429, ack 0, win 4107, options [nop,nop,TS val 4294889904 ecr 145870,mptcp dss ack 2097709625 seq 2398397032 subseq 465529 len 1428 csum 0x6d27], length 1428
17:22:24.318535 IP 112.26.2.1.targus-getdata1 > 112.26.2.8.43985: Flags [.], ack 12853, win 24014, options [nop,nop,TS val 147029 ecr 4294889904,nop,nop,sack 1 {14281:21421},mptcp dss ack 2398351336], length 0
17:22:24.324596 IP 112.26.2.1.targus-getdata1 > 112.26.2.8.43985: Flags [.], ack 12853, win 24014, options [nop,nop,TS val 147029 ecr 4294889904,nop,nop,sack 1 {14281:21421},mptcp dss ack 2398351336], length 0
17:22:24.347161 IP 112.26.2.1.targus-getdata1 > 112.26.2.8.43985: Flags [.], ack 1, win 24268, options [nop,nop,TS val 146628 ecr 4294888396,nop,nop,sack 2 {14281:17137}{1429:12853},mptcp dss ack 2398334200], length 0
17:22:24.391620 IP 112.26.2.8.43985 > 112.26.2.1.targus-getdata1: Flags [.], seq 21421:22849, ack 0, win 4107, options [nop,nop,TS val 4294890033 ecr 146002,mptcp dss ack 2097709625 seq 2398484140 subseq 486949 len 1428 csum 0xc64], length 1428
17:22:24.395179 IP 112.26.2.8.43985 > 112.26.2.1.targus-getdata1: Flags [.], seq 21421:22849, ack 0, win 4107, options [nop,nop,TS val 4294890033 ecr 146002,mptcp dss ack 2097709625 seq 2398484140 subseq 486949 len 1428 csum 0xc64], length 1428
17:22:24.397435 IP 112.26.2.1.targus-getdata1 > 112.26.2.8.43985: Flags [.], ack 12853, win 24014, options [nop,nop,TS val 147107 ecr 4294889904,nop,nop,sack 1 {14281:22849},mptcp dss ack 2398351336], length 0
17:22:24.465242 IP 112.26.2.8.43985 > 112.26.2.1.targus-getdata1: Flags [.], seq 22849:24277, ack 0, win 4107, options [nop,nop,TS val 4294890201 ecr 146135,mptcp dss ack 2097709625 seq 2398486996 subseq 488377 len 1428 csum 0x2c6d], length 1428
17:22:24.480547 IP 112.26.2.1.targus-getdata1 > 112.26.2.8.43985: Flags [.], ack 1, win 24268, options [nop,nop,TS val 146744 ecr 4294888396,nop,nop,sack 2 {14281:18565}{1429:12853},mptcp dss ack 2398334200], length 0
17:22:24.526049 IP 112.26.2.1.targus-getdata1 > 112.26.2.8.43985: Flags [.], ack 1, win 24268, options [nop,nop,TS val 146855 ecr 4294888396,nop,nop,sack 2 {14281:19993}{1429:12853},mptcp dss ack 2398334200], length 0
17:22:24.538232 IP 112.26.2.8.43985 > 112.26.2.1.targus-getdata1: Flags [.], seq 22849:24277, ack 0, win 4107, options [nop,nop,TS val 4294890201 ecr 146135,mptcp dss ack 2097709625 seq 2398486996 subseq 488377 len 1428 csum 0x2c6d], length 1428
17:22:24.543752 IP 112.26.2.1.targus-getdata1 > 112.26.2.8.43985: Flags [.], ack 12853, win 24014, options [nop,nop,TS val 147250 ecr 4294889904,nop,nop,sack 1 {14281:24277},mptcp dss ack 2398351336], length 0
17:22:24.555660 IP 112.26.2.1.targus-getdata1 > 112.26.2.8.43985: Flags [.], ack 12853, win 24014, options [nop,nop,TS val 147250 ecr 4294889904,nop,nop,sack 1 {14281:24277},mptcp dss ack 2398351336], length 0
17:22:24.581448 IP 112.26.2.8.43985 > 112.26.2.1.targus-getdata1: Flags [.], seq 24277:25705, ack 0, win 4107, options [nop,nop,TS val 4294890429 ecr 146395,mptcp dss ack 2097709625 seq 2398494136 subseq 489805 len 1428 csum 0x2de9], length 1428
17:22:24.624078 IP 112.26.2.8.43985 > 112.26.2.1.targus-getdata1: Flags [.], seq 24277:25705, ack 0, win 4107, options [nop,nop,TS val 4294890429 ecr 146395,mptcp dss ack 2097709625 seq 2398494136 subseq 489805 len 1428 csum 0x2de9], length 1428
17:22:24.644749 IP 112.26.2.1.targus-getdata1 > 112.26.2.8.43985: Flags [.], ack 1, win 24268, options [nop,nop,TS val 146914 ecr 4294888396,nop,nop,sack 2 {14281:21421}{1429:12853},mptcp dss ack 2398334200], length 0
17:22:24.669449 IP 112.26.2.1.targus-getdata1 > 112.26.2.8.43985: Flags [.], ack 12853, win 24014, options [nop,nop,TS val 147336 ecr 4294889904,nop,nop,sack 1 {14281:25705},mptcp dss ack 2398351336], length 0
17:22:24.671356 IP 112.26.2.1.targus-getdata1 > 112.26.2.8.43985: Flags [.], ack 12853, win 24014, options [nop,nop,TS val 147336 ecr 4294889904,nop,nop,sack 1 {14281:25705},mptcp dss ack 2398351336], length 0
17:22:24.704215 IP 112.26.2.1.targus-getdata1 > 112.26.2.8.43985: Flags [.], ack 12853, win 24014, options [nop,nop,TS val 147029 ecr 4294889904,nop,nop,sack 1 {14281:21421},mptcp dss ack 2398351336], length 0
17:22:24.714228 IP 112.26.2.8.43985 > 112.26.2.1.targus-getdata1: Flags [.], seq 25705:27133, ack 0, win 4107, options [nop,nop,TS val 4294890580 ecr 146457,mptcp dss ack 2097709625 seq 2398501276 subseq 491233 len 1428 csum 0x4018], length 1428
17:22:24.719436 IP 112.26.2.8.43985 > 112.26.2.1.targus-getdata1: Flags [.], seq 25705:27133, ack 0, win 4107, options [nop,nop,TS val 4294890580 ecr 146457,mptcp dss ack 2097709625 seq 2398501276 subseq 491233 len 1428 csum 0x4018], length 1428
17:22:24.727224 IP 112.26.2.1.targus-getdata1 > 112.26.2.8.43985: Flags [.], ack 12853, win 24014, options [nop,nop,TS val 147431 ecr 4294889904,nop,nop,sack 1 {14281:27133},mptcp dss ack 2398351336], length 0
17:22:24.776023 IP 112.26.2.1.targus-getdata1 > 112.26.2.8.43985: Flags [.], ack 12853, win 24014, options [nop,nop,TS val 147431 ecr 4294889904,nop,nop,sack 1 {14281:27133},mptcp dss ack 2398351336], length 0
17:22:24.794269 IP 112.26.2.8.43985 > 112.26.2.1.targus-getdata1: Flags [.], seq 12853:14281, ack 0, win 4107, options [nop,nop,TS val 4294890714 ecr 146628,mptcp dss ack 2097709625 seq 2398458436 subseq 478381 len 1428 csum 0x25d2], length 1428
17:22:24.807790 IP 112.26.2.8.43985 > 112.26.2.1.targus-getdata1: Flags [.], seq 12853:14281, ack 0, win 4107, options [nop,nop,TS val 4294890714 ecr 146628,mptcp dss ack 2097709625 seq 2398458436 subseq 478381 len 1428 csum 0x25d2], length 1428
17:22:24.836048 IP 112.26.2.1.targus-getdata1 > 112.26.2.8.43985: Flags [.], ack 27133, win 24014, options [nop,nop,TS val 147520 ecr 4294890714,mptcp dss ack 2398351336], length 0
17:22:24.852480 IP 112.26.2.1.targus-getdata1 > 112.26.2.8.43985: Flags [.], ack 27133, win 24014, options [nop,nop,TS val 147520 ecr 4294890714,mptcp dss ack 2398351336], length 0
17:22:24.864746 IP 112.26.2.1.targus-getdata1 > 112.26.2.8.43985: Flags [.], ack 12853, win 24014, options [nop,nop,TS val 147250 ecr 4294889904,nop,nop,sack 1 {14281:24277},mptcp dss ack 2398351336], length 0
17:22:24.873119 IP 112.26.2.8.43985 > 112.26.2.1.targus-getdata1: Flags [.], seq 27133:28561, ack 0, win 4107, options [nop,nop,TS val 4294890887 ecr 146744,mptcp dss ack 2097709625 seq 2398511272 subseq 492661 len 1428 csum 0x13a2], length 1428
17:22:24.929743 IP 112.26.2.8.43985 > 112.26.2.1.targus-getdata1: Flags [.], seq 27133:28561, ack 0, win 4107, options [nop,nop,TS val 4294890887 ecr 146744,mptcp dss ack 2097709625 seq 2398511272 subseq 492661 len 1428 csum 0x13a2], length 1428
17:22:24.932839 IP 112.26.2.1.targus-getdata1 > 112.26.2.8.43985: Flags [.], ack 28561, win 24014, options [nop,nop,TS val 147641 ecr 4294890887,mptcp dss ack 2398351336], length 0
17:22:24.953649 IP 112.26.2.1.targus-getdata1 > 112.26.2.8.43985: Flags [.], ack 28561, win 24014, options [nop,nop,TS val 147641 ecr 4294890887,mptcp dss ack 2398351336], length 0
17:22:24.984416 IP 112.26.2.1.targus-getdata1 > 112.26.2.8.43985: Flags [.], ack 12853, win 24014, options [nop,nop,TS val 147336 ecr 4294889904,nop,nop,sack 1 {14281:25705},mptcp dss ack 2398351336], length 0
17:22:24.989080 IP 112.26.2.8.43985 > 112.26.2.1.targus-getdata1: Flags [.], seq 28561:29989, ack 0, win 4107, options [nop,nop,TS val 4294891002 ecr 146855,mptcp dss ack 2097709625 seq 2398519840 subseq 494089 len 1428 csum 0xbb29], length 1428
17:22:25.029435 IP 112.26.2.8.43985 > 112.26.2.1.targus-getdata1: Flags [.], seq 28561:29989, ack 0, win 4107, options [nop,nop,TS val 4294891002 ecr 146855,mptcp dss ack 2097709625 seq 2398519840 subseq 494089 len 1428 csum 0xbb29], length 1428
17:22:25.030799 IP 112.26.2.1.targus-getdata1 > 112.26.2.8.43985: Flags [.], ack 29989, win 24014, options [nop,nop,TS val 147741 ecr 4294891002,mptcp dss ack 2398351336], length 0
17:22:25.034563 IP 112.26.2.1.targus-getdata1 > 112.26.2.8.43985: Flags [.], ack 29989, win 24014, options [nop,nop,TS val 147741 ecr 4294891002,mptcp dss ack 2398351336], length 0
17:22:25.057585 IP 112.26.2.8.43985 > 112.26.2.1.targus-getdata1: Flags [.], seq 29989:31417, ack 0, win 4107, options [nop,nop,TS val 4294891021 ecr 146914,mptcp dss ack 2097709625 seq 2398522696 subseq 495517 len 1428 csum 0xf062], length 1428
17:22:25.115244 IP 112.26.2.1.targus-getdata1 > 112.26.2.8.43985: Flags [.], ack 12853, win 24014, options [nop,nop,TS val 147431 ecr 4294889904,nop,nop,sack 1 {14281:27133},mptcp dss ack 2398351336], length 0
17:22:25.132622 IP 112.26.2.8.43985 > 112.26.2.1.targus-getdata1: Flags [.], seq 31417:32845, ack 0, win 4107, options [nop,nop,TS val 4294891071 ecr 147029,mptcp dss ack 2097709625 seq 2398524124 subseq 496945 len 1428 csum 0x739], length 1428
17:22:25.136604 IP 112.26.2.8.43985 > 112.26.2.1.targus-getdata1: Flags [.], seq 29989:31417, ack 0, win 4107, options [nop,nop,TS val 4294891021 ecr 146914,mptcp dss ack 2097709625 seq 2398522696 subseq 495517 len 1428 csum 0xf062], length 1428
17:22:25.138140 IP 112.26.2.1.targus-getdata1 > 112.26.2.8.43985: Flags [.], ack 31417, win 24014, options [nop,nop,TS val 147848 ecr 4294891021,mptcp dss ack 2398351336], length 0
17:22:25.170202 IP 112.26.2.1.targus-getdata1 > 112.26.2.8.43985: Flags [.], ack 31417, win 24014, options [nop,nop,TS val 147848 ecr 4294891021,mptcp dss ack 2398351336], length 0
17:22:25.228654 IP 112.26.2.8.43985 > 112.26.2.1.targus-getdata1: Flags [.], seq 32845:34273, ack 0, win 4107, options [nop,nop,TS val 4294891291 ecr 147250,mptcp dss ack 2097709625 seq 2398526980 subseq 498373 len 1428 csum 0x6a9e], length 1428
17:22:25.240144 IP 112.26.2.8.43985 > 112.26.2.1.targus-getdata1: Flags [.], seq 31417:32845, ack 0, win 4107, options [nop,nop,TS val 4294891071 ecr 147029,mptcp dss ack 2097709625 seq 2398524124 subseq 496945 len 1428 csum 0x739], length 1428
17:22:25.252134 IP 112.26.2.1.targus-getdata1 > 112.26.2.8.43985: Flags [.], ack 32845, win 24014, options [nop,nop,TS val 147952 ecr 4294891071,mptcp dss ack 2398351336], length 0
17:22:25.254910 IP 112.26.2.1.targus-getdata1 > 112.26.2.8.43985: Flags [.], ack 32845, win 24014, options [nop,nop,TS val 147952 ecr 4294891071,mptcp dss ack 2398351336], length 0
17:22:25.293011 IP 112.26.2.1.targus-getdata1 > 112.26.2.8.43985: Flags [.], ack 27133, win 24014, options [nop,nop,TS val 147520 ecr 4294890714,mptcp dss ack 2398351336], length 0
17:22:25.327871 IP 112.26.2.8.43985 > 112.26.2.1.targus-getdata1: Flags [.], seq 34273:35701, ack 0, win 4107, options [nop,nop,TS val 4294891291 ecr 147250,mptcp dss ack 2097709625 seq 2398528408 subseq 499801 len 1428 csum 0x6292], length 1428
17:22:25.339087 IP 112.26.2.8.43985 > 112.26.2.1.targus-getdata1: Flags [.], seq 32845:34273, ack 0, win 4107, options [nop,nop,TS val 4294891291 ecr 147250,mptcp dss ack 2097709625 seq 2398526980 subseq 498373 len 1428 csum 0x6a9e], length 1428
17:22:25.349000 IP 112.26.2.1.targus-getdata1 > 112.26.2.8.43985: Flags [.], ack 34273, win 24014, options [nop,nop,TS val 148051 ecr 4294891291,mptcp dss ack 2398351336], length 0
17:22:25.359614 IP 112.26.2.1.targus-getdata1 > 112.26.2.8.43985: Flags [.], ack 34273, win 24014, options [nop,nop,TS val 148051 ecr 4294891291,mptcp dss ack 2398351336], length 0
17:22:25.394180 IP 112.26.2.1.targus-getdata1 > 112.26.2.8.43985: Flags [.], ack 28561, win 24014, options [nop,nop,TS val 147641 ecr 4294890887,mptcp dss ack 2398351336], length 0
17:22:25.443492 IP 112.26.2.1.targus-getdata1 > 112.26.2.8.43985: Flags [.], ack 29989, win 24014, options [nop,nop,TS val 147741 ecr 4294891002,mptcp dss ack 2398351336], length 0
17:22:25.449502 IP 112.26.2.8.43985 > 112.26.2.1.targus-getdata1: Flags [.], seq 34273:35701, ack 0, win 4107, options [nop,nop,TS val 4294891291 ecr 147250,mptcp dss ack 2097709625 seq 2398528408 subseq 499801 len 1428 csum 0x6292], length 1428
17:22:25.450753 IP 112.26.2.1.targus-getdata1 > 112.26.2.8.43985: Flags [.], ack 35701, win 24014, options [nop,nop,TS val 148162 ecr 4294891291,mptcp dss ack 2398351336], length 0
17:22:25.455561 IP 112.26.2.1.targus-getdata1 > 112.26.2.8.43985: Flags [.], ack 35701, win 24014, options [nop,nop,TS val 148162 ecr 4294891291,mptcp dss ack 2398351336], length 0
17:22:25.491213 IP 112.26.2.8.43985 > 112.26.2.1.targus-getdata1: Flags [.], seq 35701:37129, ack 0, win 4107, options [nop,nop,TS val 4294891375 ecr 147336,mptcp dss ack 2097709625 seq 2398531264 subseq 501229 len 1428 csum 0xcd6], length 1428
17:22:25.535879 IP 112.26.2.1.targus-getdata1 > 112.26.2.8.43985: Flags [.], ack 31417, win 24014, options [nop,nop,TS val 147848 ecr 4294891021,mptcp dss ack 2398351336], length 0
17:22:25.553171 IP 112.26.2.8.43985 > 112.26.2.1.targus-getdata1: Flags [.], seq 35701:37129, ack 0, win 4107, options [nop,nop,TS val 4294891375 ecr 147336,mptcp dss ack 2097709625 seq 2398531264 subseq 501229 len 1428 csum 0xcd6], length 1428
17:22:25.555637 IP 112.26.2.1.targus-getdata1 > 112.26.2.8.43985: Flags [.], ack 37129, win 24014, options [nop,nop,TS val 148265 ecr 4294891375,mptcp dss ack 2398351336], length 0
17:22:25.557474 IP 112.26.2.1.targus-getdata1 > 112.26.2.8.43985: Flags [.], ack 37129, win 24014, options [nop,nop,TS val 148265 ecr 4294891375,mptcp dss ack 2398351336], length 0
17:22:25.618671 IP 112.26.2.1.targus-getdata1 > 112.26.2.8.43985: Flags [.], ack 32845, win 24014, options [nop,nop,TS val 147952 ecr 4294891071,mptcp dss ack 2398351336], length 0
17:22:25.644490 IP 112.26.2.8.43985 > 112.26.2.1.targus-getdata1: Flags [.], seq 37129:38557, ack 0, win 4107, options [nop,nop,TS val 4294891523 ecr 147431,mptcp dss ack 2097709625 seq 2398536976 subseq 502657 len 1428 csum 0xc734], length 1428
17:22:25.677854 IP 112.26.2.8.43985 > 112.26.2.1.targus-getdata1: Flags [.], seq 37129:38557, ack 0, win 4107, options [nop,nop,TS val 4294891523 ecr 147431,mptcp dss ack 2097709625 seq 2398536976 subseq 502657 len 1428 csum 0xc734], length 1428
17:22:25.686511 IP 112.26.2.1.targus-getdata1 > 112.26.2.8.43985: Flags [.], ack 38557, win 24014, options [nop,nop,TS val 148390 ecr 4294891523,mptcp dss ack 2398351336], length 0
17:22:25.689156 IP 112.26.2.1.targus-getdata1 > 112.26.2.8.43985: Flags [.], ack 38557, win 24014, options [nop,nop,TS val 148390 ecr 4294891523,mptcp dss ack 2398351336], length 0
17:22:25.743523 IP 112.26.2.8.43985 > 112.26.2.1.targus-getdata1: Flags [.], seq 38557:39985, ack 0, win 4107, options [nop,nop,TS val 4294891659 ecr 147520,mptcp dss ack 2097709625 seq 2398539832 subseq 504085 len 1428 csum 0x82c1], length 1428
17:22:25.781730 IP 112.26.2.1.targus-getdata1 > 112.26.2.8.43985: Flags [.], ack 34273, win 24014, options [nop,nop,TS val 148051 ecr 4294891291,mptcp dss ack 2398351336], length 0
17:22:25.788012 IP 112.26.2.8.43985 > 112.26.2.1.targus-getdata1: Flags [.], seq 38557:39985, ack 0, win 4107, options [nop,nop,TS val 4294891659 ecr 147520,mptcp dss ack 2097709625 seq 2398539832 subseq 504085 len 1428 csum 0x82c1], length 1428
17:22:25.794433 IP 112.26.2.1.targus-getdata1 > 112.26.2.8.43985: Flags [.], ack 39985, win 24014, options [nop,nop,TS val 148500 ecr 4294891659,mptcp dss ack 2398351336], length 0
17:22:25.796344 IP 112.26.2.1.targus-getdata1 > 112.26.2.8.43985: Flags [.], ack 39985, win 24014, options [nop,nop,TS val 148500 ecr 4294891659,mptcp dss ack 2398351336], length 0
17:22:25.850288 IP 112.26.2.8.43985 > 112.26.2.1.targus-getdata1: Flags [.], seq 39985:41413, ack 0, win 4107, options [nop,nop,TS val 4294891761 ecr 147641,mptcp dss ack 2097709625 seq 2398544116 subseq 505513 len 1428 csum 0x31a8], length 1428
17:22:25.867022 IP 112.26.2.1.targus-getdata1 > 112.26.2.8.43985: Flags [.], ack 35701, win 24014, options [nop,nop,TS val 148162 ecr 4294891291,mptcp dss ack 2398351336], length 0
17:22:25.902148 IP 112.26.2.8.43985 > 112.26.2.1.targus-getdata1: Flags [.], seq 39985:41413, ack 0, win 4107, options [nop,nop,TS val 4294891761 ecr 147641,mptcp dss ack 2097709625 seq 2398544116 subseq 505513 len 1428 csum 0x31a8], length 1428
17:22:25.916550 IP 112.26.2.1.targus-getdata1 > 112.26.2.8.43985: Flags [.], ack 41413, win 23999, options [nop,nop,TS val 148614 ecr 4294891761,mptcp dss ack 2398439872], length 0
17:22:25.924355 IP 112.26.2.1.targus-getdata1 > 112.26.2.8.43985: Flags [.], ack 41413, win 23999, options [nop,nop,TS val 148614 ecr 4294891761,mptcp dss ack 2398439872], length 0
17:22:25.944136 IP 112.26.2.8.43985 > 112.26.2.1.targus-getdata1: Flags [.], seq 41413:42841, ack 0, win 4107, options [nop,nop,TS val 4294891810 ecr 147741,mptcp dss ack 2097709625 seq 2398545544 subseq 506941 len 1428 csum 0x5b9a], length 1428
17:22:25.980310 IP 112.26.2.1.targus-getdata1 > 112.26.2.8.43985: Flags [.], ack 37129, win 24014, options [nop,nop,TS val 148265 ecr 4294891375,mptcp dss ack 2398351336], length 0
17:22:26.027126 IP 112.26.2.8.43985 > 112.26.2.1.targus-getdata1: Flags [.], seq 42841:44269, ack 0, win 4107, options [nop,nop,TS val 4294891903 ecr 147848,mptcp dss ack 2097709625 seq 2398548400 subseq 508369 len 1428 csum 0x24c3], length 1428
17:22:26.045252 IP 112.26.2.8.43985 > 112.26.2.1.targus-getdata1: Flags [.], seq 41413:42841, ack 0, win 4107, options [nop,nop,TS val 4294891810 ecr 147741,mptcp dss ack 2097709625 seq 2398545544 subseq 506941 len 1428 csum 0x5b9a], length 1428
17:22:26.047597 IP 112.26.2.1.targus-getdata1 > 112.26.2.8.43985: Flags [.], ack 42841, win 23984, options [nop,nop,TS val 148757 ecr 4294891810,mptcp dss ack 2398447012], length 0
17:22:26.050663 IP 112.26.2.1.targus-getdata1 > 112.26.2.8.43985: Flags [.], ack 42841, win 23984, options [nop,nop,TS val 148757 ecr 4294891810,mptcp dss ack 2398447012], length 0
17:22:26.101192 IP 112.26.2.8.43985 > 112.26.2.1.targus-getdata1: Flags [.], seq 44269:45697, ack 0, win 4107, options [nop,nop,TS val 4294891903 ecr 147848,mptcp dss ack 2097709625 seq 2398549828 subseq 509797 len 1428 csum 0x2b4d], length 1428
17:22:26.119145 IP 112.26.2.1.targus-getdata1 > 112.26.2.8.43985: Flags [.], ack 38557, win 24014, options [nop,nop,TS val 148390 ecr 4294891523,mptcp dss ack 2398351336], length 0
17:22:26.175381 IP 112.26.2.8.43985 > 112.26.2.1.targus-getdata1: Flags [.], seq 42841:44269, ack 0, win 4107, options [nop,nop,TS val 4294891903 ecr 147848,mptcp dss ack 2097709625 seq 2398548400 subseq 508369 len 1428 csum 0x24c3], length 1428
17:22:26.183209 IP 112.26.2.1.targus-getdata1 > 112.26.2.8.43985: Flags [.], ack 44269, win 23909, options [nop,nop,TS val 148887 ecr 4294891903,mptcp dss ack 2398459864], length 0
17:22:26.184878 IP 112.26.2.1.targus-getdata1 > 112.26.2.8.43985: Flags [.], ack 44269, win 23909, options [nop,nop,TS val 148887 ecr 4294891903,mptcp dss ack 2398459864], length 0
17:22:26.215822 IP 112.26.2.1.targus-getdata1 > 112.26.2.8.43985: Flags [.], ack 39985, win 24014, options [nop,nop,TS val 148500 ecr 4294891659,mptcp dss ack 2398351336], length 0
17:22:26.223858 IP 112.26.2.8.43985 > 112.26.2.1.targus-getdata1: Flags [.], seq 44269:45697, ack 0, win 4107, options [nop,nop,TS val 4294891903 ecr 147848,mptcp dss ack 2097709625 seq 2398549828 subseq 509797 len 1428 csum 0x2b4d], length 1428
17:22:26.279755 IP 112.26.2.8.43985 > 112.26.2.1.targus-getdata1: Flags [.], seq 45697:47125, ack 0, win 4107, options [nop,nop,TS val 4294891985 ecr 147952,mptcp dss ack 2097709625 seq 2398554112 subseq 511225 len 1428 csum 0x6017], length 1428
17:22:26.295435 IP 112.26.2.1.targus-getdata1 > 112.26.2.8.43985: Flags [.], ack 45697, win 23909, options [nop,nop,TS val 148936 ecr 4294891903,mptcp dss ack 2398459864], length 0
17:22:26.296628 IP 112.26.2.1.targus-getdata1 > 112.26.2.8.43985: Flags [.], ack 45697, win 23909, options [nop,nop,TS val 148936 ecr 4294891903,mptcp dss ack 2398459864], length 0
17:22:26.330852 IP 112.26.2.8.43985 > 112.26.2.1.targus-getdata1: Flags [.], seq 45697:47125, ack 0, win 4107, options [nop,nop,TS val 4294891985 ecr 147952,mptcp dss ack 2097709625 seq 2398554112 subseq 511225 len 1428 csum 0x6017], length 1428
17:22:26.365962 IP 112.26.2.8.43985 > 112.26.2.1.targus-getdata1: Flags [.], seq 47125:48553, ack 0, win 4107, options [nop,nop,TS val 4294892148 ecr 148051,mptcp dss ack 2097709625 seq 2398558396 subseq 512653 len 1428 csum 0xdf99], length 1428
17:22:26.373600 IP 112.26.2.1.targus-getdata1 > 112.26.2.8.43985: Flags [.], ack 41413, win 23999, options [nop,nop,TS val 148614 ecr 4294891761,mptcp dss ack 2398439872], length 0
17:22:26.399715 IP 112.26.2.1.targus-getdata1 > 112.26.2.8.43985: Flags [.], ack 47125, win 23909, options [nop,nop,TS val 149043 ecr 4294891985,mptcp dss ack 2398459864], length 0
17:22:26.401128 IP 112.26.2.1.targus-getdata1 > 112.26.2.8.43985: Flags [.], ack 47125, win 23909, options [nop,nop,TS val 149043 ecr 4294891985,mptcp dss ack 2398459864], length 0
17:22:26.417678 IP 112.26.2.8.43985 > 112.26.2.1.targus-getdata1: Flags [.], seq 47125:48553, ack 0, win 4107, options [nop,nop,TS val 4294892148 ecr 148051,mptcp dss ack 2097709625 seq 2398558396 subseq 512653 len 1428 csum 0xdf99], length 1428
17:22:26.460336 IP 112.26.2.1.targus-getdata1 > 112.26.2.8.43985: Flags [.], ack 48553, win 23909, options [nop,nop,TS val 149171 ecr 4294892148,mptcp dss ack 2398459864], length 0
17:22:26.464727 IP 112.26.2.1.targus-getdata1 > 112.26.2.8.43985: Flags [.], ack 42841, win 23984, options [nop,nop,TS val 148757 ecr 4294891810,mptcp dss ack 2398447012], length 0
17:22:26.482368 IP 112.26.2.1.targus-getdata1 > 112.26.2.8.43985: Flags [.], ack 48553, win 23909, options [nop,nop,TS val 149171 ecr 4294892148,mptcp dss ack 2398459864], length 0
17:22:26.488677 IP 112.26.2.8.43985 > 112.26.2.1.targus-getdata1: Flags [.], seq 48553:49981, ack 0, win 4107, options [nop,nop,TS val 4294892233 ecr 148162,mptcp dss ack 2097709625 seq 2398564108 subseq 514081 len 1428 csum 0x3e38], length 1428
17:22:26.535582 IP 112.26.2.8.43985 > 112.26.2.1.targus-getdata1: Flags [.], seq 48553:49981, ack 0, win 4107, options [nop,nop,TS val 4294892233 ecr 148162,mptcp dss ack 2097709625 seq 2398564108 subseq 514081 len 1428 csum 0x3e38], length 1428
17:22:26.608319 IP 112.26.2.1.targus-getdata1 > 112.26.2.8.43985: Flags [.], ack 44269, win 23909, options [nop,nop,TS val 148887 ecr 4294891903,mptcp dss ack 2398459864], length 0
17:22:26.617677 IP 112.26.2.1.targus-getdata1 > 112.26.2.8.43985: Flags [.], ack 49981, win 23909, options [nop,nop,TS val 149328 ecr 4294892233,mptcp dss ack 2398459864], length 0
17:22:26.619002 IP 112.26.2.1.targus-getdata1 > 112.26.2.8.43985: Flags [.], ack 49981, win 23909, options [nop,nop,TS val 149328 ecr 4294892233,mptcp dss ack 2398459864], length 0
17:22:26.651050 IP 112.26.2.8.43985 > 112.26.2.1.targus-getdata1: Flags [.], seq 49981:51409, ack 0, win 4107, options [nop,nop,TS val 4294892347 ecr 148265,mptcp dss ack 2097709625 seq 2398566964 subseq 515509 len 1428 csum 0x36bb], length 1428
17:22:26.654116 IP 112.26.2.8.43985 > 112.26.2.1.targus-getdata1: Flags [.], seq 49981:51409, ack 0, win 4107, options [nop,nop,TS val 4294892347 ecr 148265,mptcp dss ack 2097709625 seq 2398566964 subseq 515509 len 1428 csum 0x36bb], length 1428
17:22:26.718036 IP 112.26.2.1.targus-getdata1 > 112.26.2.8.43985: Flags [.], ack 45697, win 23909, options [nop,nop,TS val 148936 ecr 4294891903,mptcp dss ack 2398459864], length 0
17:22:26.755489 IP 112.26.2.8.43985 > 112.26.2.1.targus-getdata1: Flags [.], seq 51409:52837, ack 0, win 4107, options [nop,nop,TS val 4294892485 ecr 148390,mptcp dss ack 2097709625 seq 2398571248 subseq 516937 len 1428 csum 0xd77b], length 1428
17:22:26.757931 IP 112.26.2.8.43985 > 112.26.2.1.targus-getdata1: Flags [.], seq 51409:52837, ack 0, win 4107, options [nop,nop,TS val 4294892485 ecr 148390,mptcp dss ack 2097709625 seq 2398571248 subseq 516937 len 1428 csum 0xd77b], length 1428
17:22:26.804962 IP 112.26.2.1.targus-getdata1 > 112.26.2.8.43985: Flags [.], ack 47125, win 23909, options [nop,nop,TS val 149043 ecr 4294891985,mptcp dss ack 2398459864], length 0
17:22:26.820684 IP 112.26.2.8.43985 > 112.26.2.1.targus-getdata1: Flags [.], seq 52837:54265, ack 0, win 4107, options [nop,nop,TS val 4294892582 ecr 148500,mptcp dss ack 2097709625 seq 2398575532 subseq 518365 len 1428 csum 0x5a15], length 1428
17:22:26.833901 IP 112.26.2.8.43985 > 112.26.2.1.targus-getdata1: Flags [.], seq 52837:54265, ack 0, win 4107, options [nop,nop,TS val 4294892582 ecr 148500,mptcp dss ack 2097709625 seq 2398575532 subseq 518365 len 1428 csum 0x5a15], length 1428
17:22:26.835261 IP 112.26.2.1.targus-getdata1 > 112.26.2.8.43985: Flags [.], ack 54265, win 23909, options [nop,nop,TS val 149546 ecr 4294892347,mptcp dss ack 2398459864], length 0
17:22:26.851925 IP 112.26.2.1.targus-getdata1 > 112.26.2.8.43985: Flags [.], ack 54265, win 23909, options [nop,nop,TS val 149546 ecr 4294892347,mptcp dss ack 2398459864], length 0
17:22:26.912931 IP 112.26.2.8.43985 > 112.26.2.1.targus-getdata1: Flags [.], seq 54265:55693, ack 0, win 4107, options [nop,nop,TS val 4294892740 ecr 148614,mptcp dss ack 2097709625 seq 2398579816 subseq 519793 len 1428 csum 0x2c3], length 1428
17:22:26.917077 IP 112.26.2.8.43985 > 112.26.2.1.targus-getdata1: Flags [.], seq 54265:55693, ack 0, win 4107, options [nop,nop,TS val 4294892740 ecr 148614,mptcp dss ack 2097709625 seq 2398579816 subseq 519793 len 1428 csum 0x2c3], length 1428
17:22:26.950364 IP 112.26.2.1.targus-getdata1 > 112.26.2.8.43985: Flags [.], ack 48553, win 23909, options [nop,nop,TS val 149171 ecr 4294892148,mptcp dss ack 2398459864], length 0
17:22:27.008200 IP 112.26.2.8.43985 > 112.26.2.1.targus-getdata1: Flags [.], seq 55693:57121, ack 0, win 4107, options [nop,nop,TS val 4294892831 ecr 148757,mptcp dss ack 2097709625 seq 2398582672 subseq 521221 len 1428 csum 0x1782], length 1428
17:22:27.010706 IP 112.26.2.8.43985 > 112.26.2.1.targus-getdata1: Flags [.], seq 55693:57121, ack 0, win 4107, options [nop,nop,TS val 4294892831 ecr 148757,mptcp dss ack 2097709625 seq 2398582672 subseq 521221 len 1428 csum 0x1782], length 1428
17:22:27.037996 IP 112.26.2.1.targus-getdata1 > 112.26.2.8.43985: Flags [.], ack 49981, win 23909, options [nop,nop,TS val 149328 ecr 4294892233,mptcp dss ack 2398459864], length 0
17:22:27.100121 IP 112.26.2.1.targus-getdata1 > 112.26.2.8.43985: Flags [.], ack 57121, win 23909, options [nop,nop,TS val 149808 ecr 4294892740,mptcp dss ack 2398459864], length 0
17:22:27.103840 IP 112.26.2.1.targus-getdata1 > 112.26.2.8.43985: Flags [.], ack 57121, win 23909, options [nop,nop,TS val 149808 ecr 4294892740,mptcp dss ack 2398459864], length 0
17:22:27.107396 IP 112.26.2.8.43985 > 112.26.2.1.targus-getdata1: Flags [.], seq 57121:58549, ack 0, win 4107, options [nop,nop,TS val 4294892975 ecr 148887,mptcp dss ack 2097709625 seq 2398595524 subseq 522649 len 1428 csum 0x7bae], length 1428
17:22:27.139647 IP 112.26.2.8.43985 > 112.26.2.1.targus-getdata1: Flags [.], seq 57121:58549, ack 0, win 4107, options [nop,nop,TS val 4294892975 ecr 148887,mptcp dss ack 2097709625 seq 2398595524 subseq 522649 len 1428 csum 0x7bae], length 1428
17:22:27.163416 IP 112.26.2.1.targus-getdata1 > 112.26.2.8.43985: Flags [.], ack 54265, win 23909, options [nop,nop,TS val 149546 ecr 4294892347,mptcp dss ack 2398459864], length 0
17:22:27.195866 IP 112.26.2.8.43985 > 112.26.2.1.targus-getdata1: Flags [.], seq 58549:59977, ack 0, win 4107, options [nop,nop,TS val 4294893085 ecr 148936,mptcp dss ack 2097709625 seq 2398601236 subseq 524077 len 1428 csum 0x2054], length 1428
17:22:27.211499 IP 112.26.2.8.43985 > 112.26.2.1.targus-getdata1: Flags [.], seq 58549:59977, ack 0, win 4107, options [nop,nop,TS val 4294893085 ecr 148936,mptcp dss ack 2097709625 seq 2398601236 subseq 524077 len 1428 csum 0x2054], length 1428
17:22:27.255539 IP 112.26.2.1.targus-getdata1 > 112.26.2.8.43985: Flags [.], ack 57121, win 23909, options [nop,nop,TS val 149808 ecr 4294892740,mptcp dss ack 2398459864], length 0
17:22:27.283772 IP 112.26.2.8.43985 > 112.26.2.1.targus-getdata1: Flags [.], seq 59977:61405, ack 0, win 4107, options [nop,nop,TS val 4294893085 ecr 148936,mptcp dss ack 2097709625 seq 2398602664 subseq 525505 len 1428 csum 0x5522], length 1428
17:22:27.297248 IP 112.26.2.1.targus-getdata1 > 112.26.2.8.43985: Flags [.], ack 59977, win 23909, options [nop,nop,TS val 150008 ecr 4294892975,mptcp dss ack 2398459864], length 0
17:22:27.298989 IP 112.26.2.1.targus-getdata1 > 112.26.2.8.43985: Flags [.], ack 59977, win 23909, options [nop,nop,TS val 150008 ecr 4294892975,mptcp dss ack 2398459864], length 0
17:22:27.318763 IP 112.26.2.8.43985 > 112.26.2.1.targus-getdata1: Flags [.], seq 59977:61405, ack 0, win 4107, options [nop,nop,TS val 4294893085 ecr 148936,mptcp dss ack 2097709625 seq 2398602664 subseq 525505 len 1428 csum 0x5522], length 1428
17:22:27.371707 IP 112.26.2.1.targus-getdata1 > 112.26.2.8.43985: Flags [.], ack 59977, win 23909, options [nop,nop,TS val 150008 ecr 4294892975,mptcp dss ack 2398459864], length 0
17:22:27.398318 IP 112.26.2.8.43985 > 112.26.2.1.targus-getdata1: Flags [.], seq 61405:62833, ack 0, win 4107, options [nop,nop,TS val 4294893172 ecr 149043,mptcp dss ack 2097709625 seq 2398606948 subseq 526933 len 1428 csum 0x39d2], length 1428
17:22:27.401330 IP 112.26.2.8.43985 > 112.26.2.1.targus-getdata1: Flags [.], seq 61405:62833, ack 0, win 4107, options [nop,nop,TS val 4294893172 ecr 149043,mptcp dss ack 2097709625 seq 2398606948 subseq 526933 len 1428 csum 0x39d2], length 1428
17:22:27.450822 IP 112.26.2.8.43985 > 112.26.2.1.targus-getdata1: Flags [.], seq 62833:64261, ack 0, win 4107, options [nop,nop,TS val 4294893317 ecr 149171,mptcp dss ack 2097709625 seq 2398614088 subseq 528361 len 1428 csum 0xe4e2], length 1428
17:22:27.496557 IP 112.26.2.8.43985 > 112.26.2.1.targus-getdata1: Flags [.], seq 62833:64261, ack 0, win 4107, options [nop,nop,TS val 4294893317 ecr 149171,mptcp dss ack 2097709625 seq 2398614088 subseq 528361 len 1428 csum 0xe4e2], length 1428
17:22:27.509778 IP 112.26.2.1.targus-getdata1 > 112.26.2.8.43985: Flags [.], ack 64261, win 23909, options [nop,nop,TS val 150209 ecr 4294893085,mptcp dss ack 2398459864], length 0
17:22:27.512146 IP 112.26.2.1.targus-getdata1 > 112.26.2.8.43985: Flags [.], ack 64261, win 23909, options [nop,nop,TS val 150209 ecr 4294893085,mptcp dss ack 2398459864], length 0
17:22:27.516457 IP 112.26.2.1.targus-getdata1 > 112.26.2.8.43985: Flags [.], ack 64261, win 23909, options [nop,nop,TS val 150209 ecr 4294893085,mptcp dss ack 2398459864], length 0
17:22:27.607952 IP 112.26.2.8.43985 > 112.26.2.1.targus-getdata1: Flags [.], seq 64261:65689, ack 0, win 4107, options [nop,nop,TS val 4294893405 ecr 149328,mptcp dss ack 2097709625 seq 2398615516 subseq 529789 len 1428 csum 0xaaf9], length 1428
17:22:27.610447 IP 112.26.2.8.43985 > 112.26.2.1.targus-getdata1: Flags [.], seq 64261:65689, ack 0, win 4107, options [nop,nop,TS val 4294893405 ecr 149328,mptcp dss ack 2097709625 seq 2398615516 subseq 529789 len 1428 csum 0xaaf9], length 1428
17:22:27.695303 IP 112.26.2.8.43985 > 112.26.2.1.targus-getdata1: Flags [.], seq 65689:67117, ack 0, win 4107, options [nop,nop,TS val 4294893530 ecr 149546,mptcp dss ack 2097709625 seq 2398619800 subseq 531217 len 1428 csum 0x6d21], length 1428
17:22:27.711076 IP 112.26.2.8.43985 > 112.26.2.1.targus-getdata1: Flags [.], seq 65689:67117, ack 0, win 4107, options [nop,nop,TS val 4294893530 ecr 149546,mptcp dss ack 2097709625 seq 2398619800 subseq 531217 len 1428 csum 0x6d21], length 1428
17:22:27.712565 IP 112.26.2.1.targus-getdata1 > 112.26.2.8.43985: Flags [.], ack 67117, win 24218, options [nop,nop,TS val 150423 ecr 4294893405,mptcp dss ack 2398551256], length 0
17:22:27.718560 IP 112.26.2.1.targus-getdata1 > 112.26.2.8.43985: Flags [.], ack 67117, win 24218, options [nop,nop,TS val 150423 ecr 4294893405,mptcp dss ack 2398551256], length 0
17:22:27.724114 IP 112.26.2.1.targus-getdata1 > 112.26.2.8.43985: Flags [.], ack 67117, win 24218, options [nop,nop,TS val 150423 ecr 4294893405,mptcp dss ack 2398551256], length 0
17:22:27.829048 IP 112.26.2.8.43985 > 112.26.2.1.targus-getdata1: Flags [.], seq 67117:68545, ack 0, win 4107, options [nop,nop,TS val 4294893530 ecr 149546,mptcp dss ack 2097709625 seq 2398621228 subseq 532645 len 1428 csum 0x51a3], length 1428
