17:21:41.835797 IP 112.26.2.8.51265 > 112.26.2.1.targus-getdata1: Flags [S], seq 2239226479, win 65535, options [mss 1460,sackOK,TS val 4294848074 ecr 0,nop,wscale 6,mptcp join id 4 token 0xf09729a5 nonce 0x613bd9e3], length 0
17:21:41.943882 IP 112.26.2.1.targus-getdata1 > 112.26.2.8.51265: Flags [S.], seq 3268204220, ack 2239226480, win 65535, options [mss 1460,sackOK,TS val 104616 ecr 4294848074,nop,wscale 6,mptcp join id 6 hmac 0xe36b8bbfcbac360d nonce 0x3a338135], length 0
17:21:42.026846 IP 112.26.2.1.targus-getdata1 > 112.26.2.8.51265: Flags [S.], seq 3268204220, ack 2239226480, win 65535, options [mss 1460,sackOK,TS val 104616 ecr 4294848074,nop,wscale 6,mptcp join id 6 hmac 0xe36b8bbfcbac360d nonce 0x3a338135], length 0
17:21:42.097604 IP 112.26.2.1.targus-getdata1 > 112.26.2.8.51265: Flags [S.], seq 3268204220, ack 2239226480, win 65535, options [mss 1460,sackOK,TS val 104616 ecr 4294848074,nop,wscale 6,mptcp join id 6 hmac 0xe36b8bbfcbac360d nonce 0x3a338135], length 0
17:21:42.207700 IP 112.26.2.8.51265 > 112.26.2.1.targus-getdata1: Flags [.], ack 1, win 4107, options [nop,nop,TS val 4294848464 ecr 104616,mptcp join hmac 0x30bd180ea69308b733eeaa2c441970af63beb689], length 0
17:21:42.220223 IP 112.26.2.1.targus-getdata1 > 112.26.2.8.51265: Flags [.], ack 1, win 4017, options [nop,nop,TS val 104922 ecr 4294848464,mptcp dss ack 636597620], length 0
17:21:42.311851 IP 112.26.2.1.targus-getdata1 > 112.26.2.8.51265: Flags [.], ack 1, win 4017, options [nop,nop,TS val 104922 ecr 4294848464,mptcp dss ack 636597620], length 0
17:22:23.790157 IP 112.26.2.1.targus-getdata1 > 112.26.2.8.43985: Flags [.], ack 2646186019, win 24401, options [nop,nop,TS val 146135 ecr 4294888396,nop,nop,sack 1 {1429:8569},mptcp dss ack 2398325632], length 0
17:22:23.833851 IP 112.26.2.8.43985 > 112.26.2.1.targus-getdata1: Flags [.], seq 14281:15709, ack 0, win 4107, options [nop,nop,TS val 4294889492 ecr 145486,mptcp dss ack 2097709625 seq 2398461292 subseq 479809 len 1428 csum 0x1c2d], length 1428
17:22:23.834123 IP 112.26.2.8.43985 > 112.26.2.1.targus-getdata1: Flags [.], seq 14281:15709, ack 0, win 4107, options [nop,nop,TS val 4294889492 ecr 145486,mptcp dss ack 2097709625 seq 2398461292 subseq 479809 len 1428 csum 0x1c2d], length 1428
17:22:23.849223 IP 112.26.2.1.targus-getdata1 > 112.26.2.8.43985: Flags [.], ack 1, win 24401, options [nop,nop,TS val 146551 ecr 4294888396,nop,nop,sack 2 {14281:15709}{1429:12853},mptcp dss ack 2398325632], length 0
17:22:23.906633 IP 112.26.2.8.43985 > 112.26.2.1.targus-getdata1: Flags [.], seq 15709:17137, ack 0, win 4107, options [nop,nop,TS val 4294889617 ecr 145567,mptcp dss ack 2097709625 seq 2398468432 subseq 481237 len 1428 csum 0xf526], length 1428
17:22:23.906934 IP 112.26.2.8.43985 > 112.26.2.1.targus-getdata1: Flags [.], seq 15709:17137, ack 0, win 4107, options [nop,nop,TS val 4294889617 ecr 145567,mptcp dss ack 2097709625 seq 2398468432 subseq 481237 len 1428 csum 0xf526], length 1428
17:22:23.921054 IP 112.26.2.1.targus-getdata1 > 112.26.2.8.43985: Flags [.], ack 1, win 24268, options [nop,nop,TS val 146628 ecr 4294888396,nop,nop,sack 2 {14281:17137}{1429:12853},mptcp dss ack 2398334200], length 0
17:22:23.937772 IP 112.26.2.1.targus-getdata1 > 112.26.2.8.43985: Flags [.], ack 1, win 24401, options [nop,nop,TS val 146269 ecr 4294888396,nop,nop,sack 1 {1429:9997},mptcp dss ack 2398325632], length 0
17:22:23.997784 IP 112.26.2.8.43985 > 112.26.2.1.targus-getdata1: Flags [.], seq 17137:18565, ack 0, win 4107, options [nop,nop,TS val 4294889617 ecr 145567,mptcp dss ack 2097709625 seq 2398469860 subseq 482665 len 1428 csum 0x62a7], length 1428
17:22:23.998071 IP 112.26.2.8.43985 > 112.26.2.1.targus-getdata1: Flags [.], seq 17137:18565, ack 0, win 4107, options [nop,nop,TS val 4294889617 ecr 145567,mptcp dss ack 2097709625 seq 2398469860 subseq 482665 len 1428 csum 0x62a7], length 1428
17:22:24.037218 IP 112.26.2.1.targus-getdata1 > 112.26.2.8.43985: Flags [.], ack 1, win 24401, options [nop,nop,TS val 146395 ecr 4294888396,nop,nop,sack 1 {1429:11425},mptcp dss ack 2398325632], length 0
17:22:24.042382 IP 112.26.2.1.targus-getdata1 > 112.26.2.8.43985: Flags [.], ack 1, win 24268, options [nop,nop,TS val 146744 ecr 4294888396,nop,nop,sack 2 {14281:18565}{1429:12853},mptcp dss ack 2398334200], length 0
17:22:24.066934 IP 112.26.2.8.43985 > 112.26.2.1.targus-getdata1: Flags [.], seq 18565:19993, ack 0, win 4107, options [nop,nop,TS val 4294889760 ecr 145704,mptcp dss ack 2097709625 seq 2398471288 subseq 484093 len 1428 csum 0x1430], length 1428
17:22:24.067248 IP 112.26.2.8.43985 > 112.26.2.1.targus-getdata1: Flags [.], seq 18565:19993, ack 0, win 4107, options [nop,nop,TS val 4294889760 ecr 145704,mptcp dss ack 2097709625 seq 2398471288 subseq 484093 len 1428 csum 0x1430], length 1428
17:22:24.144994 IP 112.26.2.1.targus-getdata1 > 112.26.2.8.43985: Flags [.], ack 1, win 24268, options [nop,nop,TS val 146855 ecr 4294888396,nop,nop,sack 2 {14281:19993}{1429:12853},mptcp dss ack 2398334200], length 0
17:22:24.166747 IP 112.26.2.1.targus-getdata1 > 112.26.2.8.43985: Flags [.], ack 1, win 24401, options [nop,nop,TS val 146457 ecr 4294888396,nop,nop,sack 1 {1429:12853},mptcp dss ack 2398325632], length 0
17:22:24.199306 IP 112.26.2.8.43985 > 112.26.2.1.targus-getdata1: Flags [.], seq 19993:21421, ack 0, win 4107, options [nop,nop,TS val 4294889888 ecr 145777,mptcp dss ack 2097709625 seq 2398477000 subseq 485521 len 1428 csum 0x19d7], length 1428
17:22:24.199569 IP 112.26.2.8.43985 > 112.26.2.1.targus-getdata1: Flags [.], seq 19993:21421, ack 0, win 4107, options [nop,nop,TS val 4294889888 ecr 145777,mptcp dss ack 2097709625 seq 2398477000 subseq 485521 len 1428 csum 0x19d7], length 1428
17:22:24.211581 IP 112.26.2.1.targus-getdata1 > 112.26.2.8.43985: Flags [.], ack 1, win 24268, options [nop,nop,TS val 146914 ecr 4294888396,nop,nop,sack 2 {14281:21421}{1429:12853},mptcp dss ack 2398334200], length 0
17:22:24.251759 IP 112.26.2.1.targus-getdata1 > 112.26.2.8.43985: Flags [.], ack 1, win 24401, options [nop,nop,TS val 146551 ecr 4294888396,nop,nop,sack 2 {14281:15709}{1429:12853},mptcp dss ack 2398325632], length 0
17:22:24.312882 IP 112.26.2.8.43985 > 112.26.2.1.targus-getdata1: Flags [.], seq 1:1429, ack 0, win 4107, options [nop,nop,TS val 4294889904 ecr 145870,mptcp dss ack 2097709625 seq 2398397032 subseq 465529 len 1428 csum 0x6d27], length 1428
17:22:24.313193 IP 112.26.2.8.43985 > 112.26.2.1.targus-getdata1: Flags [.], seq 1:1429, ack 0, win 4107, options [nop,nop,TS val 4294889904 ecr 145870,mptcp dss ack 2097709625 seq 2398397032 subseq 465529 len 1428 csum 0x6d27], length 1428
17:22:24.318659 IP 112.26.2.1.targus-getdata1 > 112.26.2.8.43985: Flags [.], ack 12853, win 24014, options [nop,nop,TS val 147029 ecr 4294889904,nop,nop,sack 1 {14281:21421},mptcp dss ack 2398351336], length 0
17:22:24.347623 IP 112.26.2.1.targus-getdata1 > 112.26.2.8.43985: Flags [.], ack 1, win 24268, options [nop,nop,TS val 146628 ecr 4294888396,nop,nop,sack 2 {14281:17137}{1429:12853},mptcp dss ack 2398334200], length 0
17:22:24.391364 IP 112.26.2.8.43985 > 112.26.2.1.targus-getdata1: Flags [.], seq 21421:22849, ack 0, win 4107, options [nop,nop,TS val 4294890033 ecr 146002,mptcp dss ack 2097709625 seq 2398484140 subseq 486949 len 1428 csum 0xc64], length 1428
17:22:24.391736 IP 112.26.2.8.43985 > 112.26.2.1.targus-getdata1: Flags [.], seq 21421:22849, ack 0, win 4107, options [nop,nop,TS val 4294890033 ecr 146002,mptcp dss ack 2097709625 seq 2398484140 subseq 486949 len 1428 csum 0xc64], length 1428
17:22:24.397548 IP 112.26.2.1.targus-getdata1 > 112.26.2.8.43985: Flags [.], ack 12853, win 24014, options [nop,nop,TS val 147107 ecr 4294889904,nop,nop,sack 1 {14281:22849},mptcp dss ack 2398351336], length 0
17:22:24.465005 IP 112.26.2.8.43985 > 112.26.2.1.targus-getdata1: Flags [.], seq 22849:24277, ack 0, win 4107, options [nop,nop,TS val 4294890201 ecr 146135,mptcp dss ack 2097709625 seq 2398486996 subseq 488377 len 1428 csum 0x2c6d], length 1428
17:22:24.465335 IP 112.26.2.8.43985 > 112.26.2.1.targus-getdata1: Flags [.], seq 22849:24277, ack 0, win 4107, options [nop,nop,TS val 4294890201 ecr 146135,mptcp dss ack 2097709625 seq 2398486996 subseq 488377 len 1428 csum 0x2c6d], length 1428
17:22:24.481008 IP 112.26.2.1.targus-getdata1 > 112.26.2.8.43985: Flags [.], ack 1, win 24268, options [nop,nop,TS val 146744 ecr 4294888396,nop,nop,sack 2 {14281:18565}{1429:12853},mptcp dss ack 2398334200], length 0
17:22:24.526492 IP 112.26.2.1.targus-getdata1 > 112.26.2.8.43985: Flags [.], ack 1, win 24268, options [nop,nop,TS val 146855 ecr 4294888396,nop,nop,sack 2 {14281:19993}{1429:12853},mptcp dss ack 2398334200], length 0
17:22:24.543862 IP 112.26.2.1.targus-getdata1 > 112.26.2.8.43985: Flags [.], ack 12853, win 24014, options [nop,nop,TS val 147250 ecr 4294889904,nop,nop,sack 1 {14281:24277},mptcp dss ack 2398351336], length 0
17:22:24.577785 IP 112.26.2.8.43985 > 112.26.2.1.targus-getdata1: Flags [.], seq 24277:25705, ack 0, win 4107, options [nop,nop,TS val 4294890429 ecr 146395,mptcp dss ack 2097709625 seq 2398494136 subseq 489805 len 1428 csum 0x2de9], length 1428
17:22:24.578097 IP 112.26.2.8.43985 > 112.26.2.1.targus-getdata1: Flags [.], seq 24277:25705, ack 0, win 4107, options [nop,nop,TS val 4294890429 ecr 146395,mptcp dss ack 2097709625 seq 2398494136 subseq 489805 len 1428 csum 0x2de9], length 1428
17:22:24.645201 IP 112.26.2.1.targus-getdata1 > 112.26.2.8.43985: Flags [.], ack 1, win 24268, options [nop,nop,TS val 146914 ecr 4294888396,nop,nop,sack 2 {14281:21421}{1429:12853},mptcp dss ack 2398334200], length 0
17:22:24.669561 IP 112.26.2.1.targus-getdata1 > 112.26.2.8.43985: Flags [.], ack 12853, win 24014, options [nop,nop,TS val 147336 ecr 4294889904,nop,nop,sack 1 {14281:25705},mptcp dss ack 2398351336], length 0
17:22:24.704671 IP 112.26.2.1.targus-getdata1 > 112.26.2.8.43985: Flags [.], ack 12853, win 24014, options [nop,nop,TS val 147029 ecr 4294889904,nop,nop,sack 1 {14281:21421},mptcp dss ack 2398351336], length 0
17:22:24.713997 IP 112.26.2.8.43985 > 112.26.2.1.targus-getdata1: Flags [.], seq 25705:27133, ack 0, win 4107, options [nop,nop,TS val 4294890580 ecr 146457,mptcp dss ack 2097709625 seq 2398501276 subseq 491233 len 1428 csum 0x4018], length 1428
17:22:24.714316 IP 112.26.2.8.43985 > 112.26.2.1.targus-getdata1: Flags [.], seq 25705:27133, ack 0, win 4107, options [nop,nop,TS val 4294890580 ecr 146457,mptcp dss ack 2097709625 seq 2398501276 subseq 491233 len 1428 csum 0x4018], length 1428
17:22:24.727336 IP 112.26.2.1.targus-getdata1 > 112.26.2.8.43985: Flags [.], ack 12853, win 24014, options [nop,nop,TS val 147431 ecr 4294889904,nop,nop,sack 1 {14281:27133},mptcp dss ack 2398351336], length 0
17:22:24.794037 IP 112.26.2.8.43985 > 112.26.2.1.targus-getdata1: Flags [.], seq 12853:14281, ack 0, win 4107, options [nop,nop,TS val 4294890714 ecr 146628,mptcp dss ack 2097709625 seq 2398458436 subseq 478381 len 1428 csum 0x25d2], length 1428
17:22:24.794347 IP 112.26.2.8.43985 > 112.26.2.1.targus-getdata1: Flags [.], seq 12853:14281, ack 0, win 4107, options [nop,nop,TS val 4294890714 ecr 146628,mptcp dss ack 2097709625 seq 2398458436 subseq 478381 len 1428 csum 0x25d2], length 1428
17:22:24.836159 IP 112.26.2.1.targus-getdata1 > 112.26.2.8.43985: Flags [.], ack 27133, win 24014, options [nop,nop,TS val 147520 ecr 4294890714,mptcp dss ack 2398351336], length 0
17:22:24.865189 IP 112.26.2.1.targus-getdata1 > 112.26.2.8.43985: Flags [.], ack 12853, win 24014, options [nop,nop,TS val 147250 ecr 4294889904,nop,nop,sack 1 {14281:24277},mptcp dss ack 2398351336], length 0
17:22:24.872890 IP 112.26.2.8.43985 > 112.26.2.1.targus-getdata1: Flags [.], seq 27133:28561, ack 0, win 4107, options [nop,nop,TS val 4294890887 ecr 146744,mptcp dss ack 2097709625 seq 2398511272 subseq 492661 len 1428 csum 0x13a2], length 1428
17:22:24.873166 IP 112.26.2.8.43985 > 112.26.2.1.targus-getdata1: Flags [.], seq 27133:28561, ack 0, win 4107, options [nop,nop,TS val 4294890887 ecr 146744,mptcp dss ack 2097709625 seq 2398511272 subseq 492661 len 1428 csum 0x13a2], length 1428
17:22:24.932950 IP 112.26.2.1.targus-getdata1 > 112.26.2.8.43985: Flags [.], ack 28561, win 24014, options [nop,nop,TS val 147641 ecr 4294890887,mptcp dss ack 2398351336], length 0
17:22:24.984878 IP 112.26.2.1.targus-getdata1 > 112.26.2.8.43985: Flags [.], ack 12853, win 24014, options [nop,nop,TS val 147336 ecr 4294889904,nop,nop,sack 1 {14281:25705},mptcp dss ack 2398351336], length 0
17:22:24.988854 IP 112.26.2.8.43985 > 112.26.2.1.targus-getdata1: Flags [.], seq 28561:29989, ack 0, win 4107, options [nop,nop,TS val 4294891002 ecr 146855,mptcp dss ack 2097709625 seq 2398519840 subseq 494089 len 1428 csum 0xbb29], length 1428
17:22:24.989123 IP 112.26.2.8.43985 > 112.26.2.1.targus-getdata1: Flags [.], seq 28561:29989, ack 0, win 4107, options [nop,nop,TS val 4294891002 ecr 146855,mptcp dss ack 2097709625 seq 2398519840 subseq 494089 len 1428 csum 0xbb29], length 1428
17:22:25.030914 IP 112.26.2.1.targus-getdata1 > 112.26.2.8.43985: Flags [.], ack 29989, win 24014, options [nop,nop,TS val 147741 ecr 4294891002,mptcp dss ack 2398351336], length 0
17:22:25.057405 IP 112.26.2.8.43985 > 112.26.2.1.targus-getdata1: Flags [.], seq 29989:31417, ack 0, win 4107, options [nop,nop,TS val 4294891021 ecr 146914,mptcp dss ack 2097709625 seq 2398522696 subseq 495517 len 1428 csum 0xf062], length 1428
17:22:25.057724 IP 112.26.2.8.43985 > 112.26.2.1.targus-getdata1: Flags [.], seq 29989:31417, ack 0, win 4107, options [nop,nop,TS val 4294891021 ecr 146914,mptcp dss ack 2097709625 seq 2398522696 subseq 495517 len 1428 csum 0xf062], length 1428
17:22:25.115707 IP 112.26.2.1.targus-getdata1 > 112.26.2.8.43985: Flags [.], ack 12853, win 24014, options [nop,nop,TS val 147431 ecr 4294889904,nop,nop,sack 1 {14281:27133},mptcp dss ack 2398351336], length 0
17:22:25.132384 IP 112.26.2.8.43985 > 112.26.2.1.targus-getdata1: Flags [.], seq 31417:32845, ack 0, win 4107, options [nop,nop,TS val 4294891071 ecr 147029,mptcp dss ack 2097709625 seq 2398524124 subseq 496945 len 1428 csum 0x739], length 1428
17:22:25.132726 IP 112.26.2.8.43985 > 112.26.2.1.targus-getdata1: Flags [.], seq 31417:32845, ack 0, win 4107, options [nop,nop,TS val 4294891071 ecr 147029,mptcp dss ack 2097709625 seq 2398524124 subseq 496945 len 1428 csum 0x739], length 1428
17:22:25.138251 IP 112.26.2.1.targus-getdata1 > 112.26.2.8.43985: Flags [.], ack 31417, win 24014, options [nop,nop,TS val 147848 ecr 4294891021,mptcp dss ack 2398351336], length 0
17:22:25.228413 IP 112.26.2.8.43985 > 112.26.2.1.targus-getdata1: Flags [.], seq 32845:34273, ack 0, win 4107, options [nop,nop,TS val 4294891291 ecr 147250,mptcp dss ack 2097709625 seq 2398526980 subseq 498373 len 1428 csum 0x6a9e], length 1428
17:22:25.228742 IP 112.26.2.8.43985 > 112.26.2.1.targus-getdata1: Flags [.], seq 32845:34273, ack 0, win 4107, options [nop,nop,TS val 4294891291 ecr 147250,mptcp dss ack 2097709625 seq 2398526980 subseq 498373 len 1428 csum 0x6a9e], length 1428
17:22:25.252254 IP 112.26.2.1.targus-getdata1 > 112.26.2.8.43985: Flags [.], ack 32845, win 24014, options [nop,nop,TS val 147952 ecr 4294891071,mptcp dss ack 2398351336], length 0
17:22:25.293481 IP 112.26.2.1.targus-getdata1 > 112.26.2.8.43985: Flags [.], ack 27133, win 24014, options [nop,nop,TS val 147520 ecr 4294890714,mptcp dss ack 2398351336], length 0
17:22:25.327637 IP 112.26.2.8.43985 > 112.26.2.1.targus-getdata1: Flags [.], seq 34273:35701, ack 0, win 4107, options [nop,nop,TS val 4294891291 ecr 147250,mptcp dss ack 2097709625 seq 2398528408 subseq 499801 len 1428 csum 0x6292], length 1428
17:22:25.327913 IP 112.26.2.8.43985 > 112.26.2.1.targus-getdata1: Flags [.], seq 34273:35701, ack 0, win 4107, options [nop,nop,TS val 4294891291 ecr 147250,mptcp dss ack 2097709625 seq 2398528408 subseq 499801 len 1428 csum 0x6292], length 1428
17:22:25.359727 IP 112.26.2.1.targus-getdata1 > 112.26.2.8.43985: Flags [.], ack 34273, win 24014, options [nop,nop,TS val 148051 ecr 4294891291,mptcp dss ack 2398351336], length 0
17:22:25.394638 IP 112.26.2.1.targus-getdata1 > 112.26.2.8.43985: Flags [.], ack 28561, win 24014, options [nop,nop,TS val 147641 ecr 4294890887,mptcp dss ack 2398351336], length 0
17:22:25.443970 IP 112.26.2.1.targus-getdata1 > 112.26.2.8.43985: Flags [.], ack 29989, win 24014, options [nop,nop,TS val 147741 ecr 4294891002,mptcp dss ack 2398351336], length 0
17:22:25.450866 IP 112.26.2.1.targus-getdata1 > 112.26.2.8.43985: Flags [.], ack 35701, win 24014, options [nop,nop,TS val 148162 ecr 4294891291,mptcp dss ack 2398351336], length 0
17:22:25.491044 IP 112.26.2.8.43985 > 112.26.2.1.targus-getdata1: Flags [.], seq 35701:37129, ack 0, win 4107, options [nop,nop,TS val 4294891375 ecr 147336,mptcp dss ack 2097709625 seq 2398531264 subseq 501229 len 1428 csum 0xcd6], length 1428
17:22:25.491373 IP 112.26.2.8.43985 > 112.26.2.1.targus-getdata1: Flags [.], seq 35701:37129, ack 0, win 4107, options [nop,nop,TS val 4294891375 ecr 147336,mptcp dss ack 2097709625 seq 2398531264 subseq 501229 len 1428 csum 0xcd6], length 1428
17:22:25.536328 IP 112.26.2.1.targus-getdata1 > 112.26.2.8.43985: Flags [.], ack 31417, win 24014, options [nop,nop,TS val 147848 ecr 4294891021,mptcp dss ack 2398351336], length 0
17:22:25.555750 IP 112.26.2.1.targus-getdata1 > 112.26.2.8.43985: Flags [.], ack 37129, win 24014, options [nop,nop,TS val 148265 ecr 4294891375,mptcp dss ack 2398351336], length 0
17:22:25.619122 IP 112.26.2.1.targus-getdata1 > 112.26.2.8.43985: Flags [.], ack 32845, win 24014, options [nop,nop,TS val 147952 ecr 4294891071,mptcp dss ack 2398351336], length 0
17:22:25.644261 IP 112.26.2.8.43985 > 112.26.2.1.targus-getdata1: Flags [.], seq 37129:38557, ack 0, win 4107, options [nop,nop,TS val 4294891523 ecr 147431,mptcp dss ack 2097709625 seq 2398536976 subseq 502657 len 1428 csum 0xc734], length 1428
17:22:25.644596 IP 112.26.2.8.43985 > 112.26.2.1.targus-getdata1: Flags [.], seq 37129:38557, ack 0, win 4107, options [nop,nop,TS val 4294891523 ecr 147431,mptcp dss ack 2097709625 seq 2398536976 subseq 502657 len 1428 csum 0xc734], length 1428
17:22:25.686758 IP 112.26.2.1.targus-getdata1 > 112.26.2.8.43985: Flags [.], ack 38557, win 24014, options [nop,nop,TS val 148390 ecr 4294891523,mptcp dss ack 2398351336], length 0
17:22:25.743287 IP 112.26.2.8.43985 > 112.26.2.1.targus-getdata1: Flags [.], seq 38557:39985, ack 0, win 4107, options [nop,nop,TS val 4294891659 ecr 147520,mptcp dss ack 2097709625 seq 2398539832 subseq 504085 len 1428 csum 0x82c1], length 1428
17:22:25.743522 IP 112.26.2.8.43985 > 112.26.2.1.targus-getdata1: Flags [.], seq 38557:39985, ack 0, win 4107, options [nop,nop,TS val 4294891659 ecr 147520,mptcp dss ack 2097709625 seq 2398539832 subseq 504085 len 1428 csum 0x82c1], length 1428
17:22:25.782178 IP 112.26.2.1.targus-getdata1 > 112.26.2.8.43985: Flags [.], ack 34273, win 24014, options [nop,nop,TS val 148051 ecr 4294891291,mptcp dss ack 2398351336], length 0
17:22:25.794546 IP 112.26.2.1.targus-getdata1 > 112.26.2.8.43985: Flags [.], ack 39985, win 24014, options [nop,nop,TS val 148500 ecr 4294891659,mptcp dss ack 2398351336], length 0
17:22:25.850058 IP 112.26.2.8.43985 > 112.26.2.1.targus-getdata1: Flags [.], seq 39985:41413, ack 0, win 4107, options [nop,nop,TS val 4294891761 ecr 147641,mptcp dss ack 2097709625 seq 2398544116 subseq 505513 len 1428 csum 0x31a8], length 1428
17:22:25.850376 IP 112.26.2.8.43985 > 112.26.2.1.targus-getdata1: Flags [.], seq 39985:41413, ack 0, win 4107, options [nop,nop,TS val 4294891761 ecr 147641,mptcp dss ack 2097709625 seq 2398544116 subseq 505513 len 1428 csum 0x31a8], length 1428
17:22:25.867468 IP 112.26.2.1.targus-getdata1 > 112.26.2.8.43985: Flags [.], ack 35701, win 24014, options [nop,nop,TS val 148162 ecr 4294891291,mptcp dss ack 2398351336], length 0
17:22:25.916702 IP 112.26.2.1.targus-getdata1 > 112.26.2.8.43985: Flags [.], ack 41413, win 23999, options [nop,nop,TS val 148614 ecr 4294891761,mptcp dss ack 2398439872], length 0
17:22:25.943908 IP 112.26.2.8.43985 > 112.26.2.1.targus-getdata1: Flags [.], seq 41413:42841, ack 0, win 4107, options [nop,nop,TS val 4294891810 ecr 147741,mptcp dss ack 2097709625 seq 2398545544 subseq 506941 len 1428 csum 0x5b9a], length 1428
17:22:25.944188 IP 112.26.2.8.43985 > 112.26.2.1.targus-getdata1: Flags [.], seq 41413:42841, ack 0, win 4107, options [nop,nop,TS val 4294891810 ecr 147741,mptcp dss ack 2097709625 seq 2398545544 subseq 506941 len 1428 csum 0x5b9a], length 1428
17:22:25.980771 IP 112.26.2.1.targus-getdata1 > 112.26.2.8.43985: Flags [.], ack 37129, win 24014, options [nop,nop,TS val 148265 ecr 4294891375,mptcp dss ack 2398351336], length 0
17:22:26.026898 IP 112.26.2.8.43985 > 112.26.2.1.targus-getdata1: Flags [.], seq 42841:44269, ack 0, win 4107, options [nop,nop,TS val 4294891903 ecr 147848,mptcp dss ack 2097709625 seq 2398548400 subseq 508369 len 1428 csum 0x24c3], length 1428
17:22:26.027200 IP 112.26.2.8.43985 > 112.26.2.1.targus-getdata1: Flags [.], seq 42841:44269, ack 0, win 4107, options [nop,nop,TS val 4294891903 ecr 147848,mptcp dss ack 2097709625 seq 2398548400 subseq 508369 len 1428 csum 0x24c3], length 1428
17:22:26.047711 IP 112.26.2.1.targus-getdata1 > 112.26.2.8.43985: Flags [.], ack 42841, win 23984, options [nop,nop,TS val 148757 ecr 4294891810,mptcp dss ack 2398447012], length 0
17:22:26.100961 IP 112.26.2.8.43985 > 112.26.2.1.targus-getdata1: Flags [.], seq 44269:45697, ack 0, win 4107, options [nop,nop,TS val 4294891903 ecr 147848,mptcp dss ack 2097709625 seq 2398549828 subseq 509797 len 1428 csum 0x2b4d], length 1428
17:22:26.101274 IP 112.26.2.8.43985 > 112.26.2.1.targus-getdata1: Flags [.], seq 44269:45697, ack 0, win 4107, options [nop,nop,TS val 4294891903 ecr 147848,mptcp dss ack 2097709625 seq 2398549828 subseq 509797 len 1428 csum 0x2b4d], length 1428
17:22:26.119604 IP 112.26.2.1.targus-getdata1 > 112.26.2.8.43985: Flags [.], ack 38557, win 24014, options [nop,nop,TS val 148390 ecr 4294891523,mptcp dss ack 2398351336], length 0
17:22:26.183321 IP 112.26.2.1.targus-getdata1 > 112.26.2.8.43985: Flags [.], ack 44269, win 23909, options [nop,nop,TS val 148887 ecr 4294891903,mptcp dss ack 2398459864], length 0
17:22:26.216268 IP 112.26.2.1.targus-getdata1 > 112.26.2.8.43985: Flags [.], ack 39985, win 24014, options [nop,nop,TS val 148500 ecr 4294891659,mptcp dss ack 2398351336], length 0
17:22:26.279503 IP 112.26.2.8.43985 > 112.26.2.1.targus-getdata1: Flags [.], seq 45697:47125, ack 0, win 4107, options [nop,nop,TS val 4294891985 ecr 147952,mptcp dss ack 2097709625 seq 2398554112 subseq 511225 len 1428 csum 0x6017], length 1428
17:22:26.279710 IP 112.26.2.8.43985 > 112.26.2.1.targus-getdata1: Flags [.], seq 45697:47125, ack 0, win 4107, options [nop,nop,TS val 4294891985 ecr 147952,mptcp dss ack 2097709625 seq 2398554112 subseq 511225 len 1428 csum 0x6017], length 1428
17:22:26.295547 IP 112.26.2.1.targus-getdata1 > 112.26.2.8.43985: Flags [.], ack 45697, win 23909, options [nop,nop,TS val 148936 ecr 4294891903,mptcp dss ack 2398459864], length 0
17:22:26.365791 IP 112.26.2.8.43985 > 112.26.2.1.targus-getdata1: Flags [.], seq 47125:48553, ack 0, win 4107, options [nop,nop,TS val 4294892148 ecr 148051,mptcp dss ack 2097709625 seq 2398558396 subseq 512653 len 1428 csum 0xdf99], length 1428
17:22:26.365994 IP 112.26.2.8.43985 > 112.26.2.1.targus-getdata1: Flags [.], seq 47125:48553, ack 0, win 4107, options [nop,nop,TS val 4294892148 ecr 148051,mptcp dss ack 2097709625 seq 2398558396 subseq 512653 len 1428 csum 0xdf99], length 1428
17:22:26.374065 IP 112.26.2.1.targus-getdata1 > 112.26.2.8.43985: Flags [.], ack 41413, win 23999, options [nop,nop,TS val 148614 ecr 4294891761,mptcp dss ack 2398439872], length 0
17:22:26.399828 IP 112.26.2.1.targus-getdata1 > 112.26.2.8.43985: Flags [.], ack 47125, win 23909, options [nop,nop,TS val 149043 ecr 4294891985,mptcp dss ack 2398459864], length 0
17:22:26.460452 IP 112.26.2.1.targus-getdata1 > 112.26.2.8.43985: Flags [.], ack 48553, win 23909, options [nop,nop,TS val 149171 ecr 4294892148,mptcp dss ack 2398459864], length 0
17:22:26.465192 IP 112.26.2.1.targus-getdata1 > 112.26.2.8.43985: Flags [.], ack 42841, win 23984, options [nop,nop,TS val 148757 ecr 4294891810,mptcp dss ack 2398447012], length 0
17:22:26.488432 IP 112.26.2.8.43985 > 112.26.2.1.targus-getdata1: Flags [.], seq 48553:49981, ack 0, win 4107, options [nop,nop,TS val 4294892233 ecr 148162,mptcp dss ack 2097709625 seq 2398564108 subseq 514081 len 1428 csum 0x3e38], length 1428
17:22:26.488765 IP 112.26.2.8.43985 > 112.26.2.1.targus-getdata1: Flags [.], seq 48553:49981, ack 0, win 4107, options [nop,nop,TS val 4294892233 ecr 148162,mptcp dss ack 2097709625 seq 2398564108 subseq 514081 len 1428 csum 0x3e38], length 1428
17:22:26.608783 IP 112.26.2.1.targus-getdata1 > 112.26.2.8.43985: Flags [.], ack 44269, win 23909, options [nop,nop,TS val 148887 ecr 4294891903,mptcp dss ack 2398459864], length 0
17:22:26.617790 IP 112.26.2.1.targus-getdata1 > 112.26.2.8.43985: Flags [.], ack 49981, win 23909, options [nop,nop,TS val 149328 ecr 4294892233,mptcp dss ack 2398459864], length 0
17:22:26.650879 IP 112.26.2.8.43985 > 112.26.2.1.targus-getdata1: Flags [.], seq 49981:51409, ack 0, win 4107, options [nop,nop,TS val 4294892347 ecr 148265,mptcp dss ack 2097709625 seq 2398566964 subseq 515509 len 1428 csum 0x36bb], length 1428
17:22:26.651180 IP 112.26.2.8.43985 > 112.26.2.1.targus-getdata1: Flags [.], seq 49981:51409, ack 0, win 4107, options [nop,nop,TS val 4294892347 ecr 148265,mptcp dss ack 2097709625 seq 2398566964 subseq 515509 len 1428 csum 0x36bb], length 1428
17:22:26.718482 IP 112.26.2.1.targus-getdata1 > 112.26.2.8.43985: Flags [.], ack 45697, win 23909, options [nop,nop,TS val 148936 ecr 4294891903,mptcp dss ack 2398459864], length 0
17:22:26.755065 IP 112.26.2.8.43985 > 112.26.2.1.targus-getdata1: Flags [.], seq 51409:52837, ack 0, win 4107, options [nop,nop,TS val 4294892485 ecr 148390,mptcp dss ack 2097709625 seq 2398571248 subseq 516937 len 1428 csum 0xd77b], length 1428
17:22:26.755389 IP 112.26.2.8.43985 > 112.26.2.1.targus-getdata1: Flags [.], seq 51409:52837, ack 0, win 4107, options [nop,nop,TS val 4294892485 ecr 148390,mptcp dss ack 2097709625 seq 2398571248 subseq 516937 len 1428 csum 0xd77b], length 1428
17:22:26.805411 IP 112.26.2.1.targus-getdata1 > 112.26.2.8.43985: Flags [.], ack 47125, win 23909, options [nop,nop,TS val 149043 ecr 4294891985,mptcp dss ack 2398459864], length 0
17:22:26.820447 IP 112.26.2.8.43985 > 112.26.2.1.targus-getdata1: Flags [.], seq 52837:54265, ack 0, win 4107, options [nop,nop,TS val 4294892582 ecr 148500,mptcp dss ack 2097709625 seq 2398575532 subseq 518365 len 1428 csum 0x5a15], length 1428
17:22:26.820799 IP 112.26.2.8.43985 > 112.26.2.1.targus-getdata1: Flags [.], seq 52837:54265, ack 0, win 4107, options [nop,nop,TS val 4294892582 ecr 148500,mptcp dss ack 2097709625 seq 2398575532 subseq 518365 len 1428 csum 0x5a15], length 1428
17:22:26.835374 IP 112.26.2.1.targus-getdata1 > 112.26.2.8.43985: Flags [.], ack 54265, win 23909, options [nop,nop,TS val 149546 ecr 4294892347,mptcp dss ack 2398459864], length 0
17:22:26.912698 IP 112.26.2.8.43985 > 112.26.2.1.targus-getdata1: Flags [.], seq 54265:55693, ack 0, win 4107, options [nop,nop,TS val 4294892740 ecr 148614,mptcp dss ack 2097709625 seq 2398579816 subseq 519793 len 1428 csum 0x2c3], length 1428
17:22:26.912961 IP 112.26.2.8.43985 > 112.26.2.1.targus-getdata1: Flags [.], seq 54265:55693, ack 0, win 4107, options [nop,nop,TS val 4294892740 ecr 148614,mptcp dss ack 2097709625 seq 2398579816 subseq 519793 len 1428 csum 0x2c3], length 1428
17:22:26.950823 IP 112.26.2.1.targus-getdata1 > 112.26.2.8.43985: Flags [.], ack 48553, win 23909, options [nop,nop,TS val 149171 ecr 4294892148,mptcp dss ack 2398459864], length 0
17:22:27.007973 IP 112.26.2.8.43985 > 112.26.2.1.targus-getdata1: Flags [.], seq 55693:57121, ack 0, win 4107, options [nop,nop,TS val 4294892831 ecr 148757,mptcp dss ack 2097709625 seq 2398582672 subseq 521221 len 1428 csum 0x1782], length 1428
17:22:27.008340 IP 112.26.2.8.43985 > 112.26.2.1.targus-getdata1: Flags [.], seq 55693:57121, ack 0, win 4107, options [nop,nop,TS val 4294892831 ecr 148757,mptcp dss ack 2097709625 seq 2398582672 subseq 521221 len 1428 csum 0x1782], length 1428
17:22:27.038440 IP 112.26.2.1.targus-getdata1 > 112.26.2.8.43985: Flags [.], ack 49981, win 23909, options [nop,nop,TS val 149328 ecr 4294892233,mptcp dss ack 2398459864], length 0
17:22:27.100235 IP 112.26.2.1.targus-getdata1 > 112.26.2.8.43985: Flags [.], ack 57121, win 23909, options [nop,nop,TS val 149808 ecr 4294892740,mptcp dss ack 2398459864], length 0
17:22:27.102521 IP 112.26.2.8.43985 > 112.26.2.1.targus-getdata1: Flags [.], seq 57121:58549, ack 0, win 4107, options [nop,nop,TS val 4294892975 ecr 148887,mptcp dss ack 2097709625 seq 2398595524 subseq 522649 len 1428 csum 0x7bae], length 1428
17:22:27.102836 IP 112.26.2.8.43985 > 112.26.2.1.targus-getdata1: Flags [.], seq 57121:58549, ack 0, win 4107, options [nop,nop,TS val 4294892975 ecr 148887,mptcp dss ack 2097709625 seq 2398595524 subseq 522649 len 1428 csum 0x7bae], length 1428
17:22:27.163873 IP 112.26.2.1.targus-getdata1 > 112.26.2.8.43985: Flags [.], ack 54265, win 23909, options [nop,nop,TS val 149546 ecr 4294892347,mptcp dss ack 2398459864], length 0
17:22:27.195637 IP 112.26.2.8.43985 > 112.26.2.1.targus-getdata1: Flags [.], seq 58549:59977, ack 0, win 4107, options [nop,nop,TS val 4294893085 ecr 148936,mptcp dss ack 2097709625 seq 2398601236 subseq 524077 len 1428 csum 0x2054], length 1428
17:22:27.195942 IP 112.26.2.8.43985 > 112.26.2.1.targus-getdata1: Flags [.], seq 58549:59977, ack 0, win 4107, options [nop,nop,TS val 4294893085 ecr 148936,mptcp dss ack 2097709625 seq 2398601236 subseq 524077 len 1428 csum 0x2054], length 1428
17:22:27.256003 IP 112.26.2.1.targus-getdata1 > 112.26.2.8.43985: Flags [.], ack 57121, win 23909, options [nop,nop,TS val 149808 ecr 4294892740,mptcp dss ack 2398459864], length 0
17:22:27.283511 IP 112.26.2.8.43985 > 112.26.2.1.targus-getdata1: Flags [.], seq 59977:61405, ack 0, win 4107, options [nop,nop,TS val 4294893085 ecr 148936,mptcp dss ack 2097709625 seq 2398602664 subseq 525505 len 1428 csum 0x5522], length 1428
17:22:27.283835 IP 112.26.2.8.43985 > 112.26.2.1.targus-getdata1: Flags [.], seq 59977:61405, ack 0, win 4107, options [nop,nop,TS val 4294893085 ecr 148936,mptcp dss ack 2097709625 seq 2398602664 subseq 525505 len 1428 csum 0x5522], length 1428
17:22:27.297362 IP 112.26.2.1.targus-getdata1 > 112.26.2.8.43985: Flags [.], ack 59977, win 23909, options [nop,nop,TS val 150008 ecr 4294892975,mptcp dss ack 2398459864], length 0
17:22:27.372447 IP 112.26.2.1.targus-getdata1 > 112.26.2.8.43985: Flags [.], ack 59977, win 23909, options [nop,nop,TS val 150008 ecr 4294892975,mptcp dss ack 2398459864], length 0
17:22:27.398086 IP 112.26.2.8.43985 > 112.26.2.1.targus-getdata1: Flags [.], seq 61405:62833, ack 0, win 4107, options [nop,nop,TS val 4294893172 ecr 149043,mptcp dss ack 2097709625 seq 2398606948 subseq 526933 len 1428 csum 0x39d2], length 1428
17:22:27.398525 IP 112.26.2.8.43985 > 112.26.2.1.targus-getdata1: Flags [.], seq 61405:62833, ack 0, win 4107, options [nop,nop,TS val 4294893172 ecr 149043,mptcp dss ack 2097709625 seq 2398606948 subseq 526933 len 1428 csum 0x39d2], length 1428
17:22:27.450588 IP 112.26.2.8.43985 > 112.26.2.1.targus-getdata1: Flags [.], seq 62833:64261, ack 0, win 4107, options [nop,nop,TS val 4294893317 ecr 149171,mptcp dss ack 2097709625 seq 2398614088 subseq 528361 len 1428 csum 0xe4e2], length 1428
17:22:27.450897 IP 112.26.2.8.43985 > 112.26.2.1.targus-getdata1: Flags [.], seq 62833:64261, ack 0, win 4107, options [nop,nop,TS val 4294893317 ecr 149171,mptcp dss ack 2097709625 seq 2398614088 subseq 528361 len 1428 csum 0xe4e2], length 1428
17:22:27.509889 IP 112.26.2.1.targus-getdata1 > 112.26.2.8.43985: Flags [.], ack 64261, win 23909, options [nop,nop,TS val 150209 ecr 4294893085,mptcp dss ack 2398459864], length 0
17:22:27.516916 IP 112.26.2.1.targus-getdata1 > 112.26.2.8.43985: Flags [.], ack 64261, win 23909, options [nop,nop,TS val 150209 ecr 4294893085,mptcp dss ack 2398459864], length 0
17:22:27.607724 IP 112.26.2.8.43985 > 112.26.2.1.targus-getdata1: Flags [.], seq 64261:65689, ack 0, win 4107, options [nop,nop,TS val 4294893405 ecr 149328,mptcp dss ack 2097709625 seq 2398615516 subseq 529789 len 1428 csum 0xaaf9], length 1428
17:22:27.608070 IP 112.26.2.8.43985 > 112.26.2.1.targus-getdata1: Flags [.], seq 64261:65689, ack 0, win 4107, options [nop,nop,TS val 4294893405 ecr 149328,mptcp dss ack 2097709625 seq 2398615516 subseq 529789 len 1428 csum 0xaaf9], length 1428
17:22:27.695072 IP 112.26.2.8.43985 > 112.26.2.1.targus-getdata1: Flags [.], seq 65689:67117, ack 0, win 4107, options [nop,nop,TS val 4294893530 ecr 149546,mptcp dss ack 2097709625 seq 2398619800 subseq 531217 len 1428 csum 0x6d21], length 1428
17:22:27.695387 IP 112.26.2.8.43985 > 112.26.2.1.targus-getdata1: Flags [.], seq 65689:67117, ack 0, win 4107, options [nop,nop,TS val 4294893530 ecr 149546,mptcp dss ack 2097709625 seq 2398619800 subseq 531217 len 1428 csum 0x6d21], length 1428
17:22:27.712688 IP 112.26.2.1.targus-getdata1 > 112.26.2.8.43985: Flags [.], ack 67117, win 24218, options [nop,nop,TS val 150423 ecr 4294893405,mptcp dss ack 2398551256], length 0
17:22:27.724557 IP 112.26.2.1.targus-getdata1 > 112.26.2.8.43985: Flags [.], ack 67117, win 24218, options [nop,nop,TS val 150423 ecr 4294893405,mptcp dss ack 2398551256], length 0
17:22:27.828817 IP 112.26.2.8.43985 > 112.26.2.1.targus-getdata1: Flags [.], seq 67117:68545, ack 0, win 4107, options [nop,nop,TS val 4294893530 ecr 149546,mptcp dss ack 2097709625 seq 2398621228 subseq 532645 len 1428 csum 0x51a3], length 1428
17:22:27.829129 IP 112.26.2.8.43985 > 112.26.2.1.targus-getdata1: Flags [.], seq 67117:68545, ack 0, win 4107, options [nop,nop,TS val 4294893530 ecr 149546,mptcp dss ack 2097709625 seq 2398621228 subseq 532645 len 1428 csum 0x51a3], length 1428
17:22:27.922217 IP 112.26.2.8.43985 > 112.26.2.1.targus-getdata1: Flags [.], seq 68545:69973, ack 0, win 4107, options [nop,nop,TS val 4294893530 ecr 149546,mptcp dss ack 2097709625 seq 2398622656 subseq 534073 len 1428 csum 0xa1ee], length 1428
17:22:27.922513 IP 112.26.2.8.43985 > 112.26.2.1.targus-getdata1: Flags [.], seq 68545:69973, ack 0, win 4107, options [nop,nop,TS val 4294893530 ecr 149546,mptcp dss ack 2097709625 seq 2398622656 subseq 534073 len 1428 csum 0xa1ee], length 1428
17:22:28.025981 IP 112.26.2.1.targus-getdata1 > 112.26.2.8.43985: Flags [.], ack 69973, win 24218, options [nop,nop,TS val 150736 ecr 4294893530,mptcp dss ack 2398551256], length 0
17:22:28.029838 IP 112.26.2.1.targus-getdata1 > 112.26.2.8.43985: Flags [.], ack 69973, win 24218, options [nop,nop,TS val 150736 ecr 4294893530,mptcp dss ack 2398551256], length 0
17:22:28.078848 IP 112.26.2.8.43985 > 112.26.2.1.targus-getdata1: Flags [.], seq 69973:71401, ack 0, win 4107, options [nop,nop,TS val 4294893622 ecr 149808,mptcp dss ack 2097709625 seq 2398626940 subseq 535501 len 1428 csum 0xb55b], length 1428
17:22:28.079170 IP 112.26.2.8.43985 > 112.26.2.1.targus-getdata1: Flags [.], seq 69973:71401, ack 0, win 4107, options [nop,nop,TS val 4294893622 ecr 149808,mptcp dss ack 2097709625 seq 2398626940 subseq 535501 len 1428 csum 0xb55b], length 1428
17:22:28.204831 IP 112.26.2.8.43985 > 112.26.2.1.targus-getdata1: Flags [.], seq 71401:72829, ack 0, win 4107, options [nop,nop,TS val 4294893622 ecr 149808,mptcp dss ack 2097709625 seq 2398628368 subseq 536929 len 1428 csum 0x7754], length 1428
17:22:28.205107 IP 112.26.2.8.43985 > 112.26.2.1.targus-getdata1: Flags [.], seq 71401:72829, ack 0, win 4107, options [nop,nop,TS val 4294893622 ecr 149808,mptcp dss ack 2097709625 seq 2398628368 subseq 536929 len 1428 csum 0x7754], length 1428
17:22:28.281609 IP 112.26.2.1.targus-getdata1 > 112.26.2.8.43985: Flags [.], ack 72829, win 24218, options [nop,nop,TS val 150984 ecr 4294893622,mptcp dss ack 2398551256], length 0
17:22:28.294352 IP 112.26.2.1.targus-getdata1 > 112.26.2.8.43985: Flags [.], ack 72829, win 24218, options [nop,nop,TS val 150984 ecr 4294893622,mptcp dss ack 2398551256], length 0
17:22:28.323455 IP 112.26.2.8.43985 > 112.26.2.1.targus-getdata1: Flags [.], seq 72829:74257, ack 0, win 4107, options [nop,nop,TS val 4294893738 ecr 150008,mptcp dss ack 2097709625 seq 2398629796 subseq 538357 len 1428 csum 0x4aa], length 1428
17:22:28.323759 IP 112.26.2.8.43985 > 112.26.2.1.targus-getdata1: Flags [.], seq 72829:74257, ack 0, win 4107, options [nop,nop,TS val 4294893738 ecr 150008,mptcp dss ack 2097709625 seq 2398629796 subseq 538357 len 1428 csum 0x4aa], length 1428
17:22:28.409590 IP 112.26.2.8.43985 > 112.26.2.1.targus-getdata1: Flags [.], seq 74257:75685, ack 0, win 4107, options [nop,nop,TS val 4294893738 ecr 150008,mptcp dss ack 2097709625 seq 2398631224 subseq 539785 len 1428 csum 0xdac8], length 1428
17:22:28.409903 IP 112.26.2.8.43985 > 112.26.2.1.targus-getdata1: Flags [.], seq 74257:75685, ack 0, win 4107, options [nop,nop,TS val 4294893738 ecr 150008,mptcp dss ack 2097709625 seq 2398631224 subseq 539785 len 1428 csum 0xdac8], length 1428
17:22:28.493722 IP 112.26.2.8.43985 > 112.26.2.1.targus-getdata1: Flags [.], seq 75685:77113, ack 0, win 4107, options [nop,nop,TS val 4294893883 ecr 150209,mptcp dss ack 2097709625 seq 2398634080 subseq 541213 len 1428 csum 0x996f], length 1428
17:22:28.494031 IP 112.26.2.8.43985 > 112.26.2.1.targus-getdata1: Flags [.], seq 75685:77113, ack 0, win 4107, options [nop,nop,TS val 4294893883 ecr 150209,mptcp dss ack 2097709625 seq 2398634080 subseq 541213 len 1428 csum 0x996f], length 1428
17:22:28.500322 IP 112.26.2.1.targus-getdata1 > 112.26.2.8.43985: Flags [.], ack 77113, win 24218, options [nop,nop,TS val 151210 ecr 4294893738,mptcp dss ack 2398551256], length 0
17:22:28.546111 IP 112.26.2.8.43985 > 112.26.2.1.targus-getdata1: Flags [.], seq 77113:78541, ack 0, win 4107, options [nop,nop,TS val 4294893883 ecr 150209,mptcp dss ack 2097709625 seq 2398635508 subseq 542641 len 1428 csum 0xb14a], length 1428
17:22:28.546403 IP 112.26.2.8.43985 > 112.26.2.1.targus-getdata1: Flags [.], seq 77113:78541, ack 0, win 4107, options [nop,nop,TS val 4294893883 ecr 150209,mptcp dss ack 2097709625 seq 2398635508 subseq 542641 len 1428 csum 0xb14a], length 1428
17:22:28.555187 IP 112.26.2.1.targus-getdata1 > 112.26.2.8.43985: Flags [.], ack 77113, win 24218, options [nop,nop,TS val 151210 ecr 4294893738,mptcp dss ack 2398551256], length 0
17:22:28.639418 IP 112.26.2.8.43985 > 112.26.2.1.targus-getdata1: Flags [.], seq 78541:79969, ack 0, win 4107, options [nop,nop,TS val 4294893883 ecr 150209,mptcp dss ack 2097709625 seq 2398636936 subseq 544069 len 1428 csum 0x7b37], length 1428
17:22:28.639706 IP 112.26.2.8.43985 > 112.26.2.1.targus-getdata1: Flags [.], seq 78541:79969, ack 0, win 4107, options [nop,nop,TS val 4294893883 ecr 150209,mptcp dss ack 2097709625 seq 2398636936 subseq 544069 len 1428 csum 0x7b37], length 1428
17:22:28.727769 IP 112.26.2.8.43985 > 112.26.2.1.targus-getdata1: Flags [.], seq 79969:81397, ack 0, win 4107, options [nop,nop,TS val 4294894091 ecr 150423,mptcp dss ack 2097709625 seq 2398644076 subseq 545497 len 1428 csum 0xd933], length 1428
17:22:28.728057 IP 112.26.2.8.43985 > 112.26.2.1.targus-getdata1: Flags [.], seq 79969:81397, ack 0, win 4107, options [nop,nop,TS val 4294894091 ecr 150423,mptcp dss ack 2097709625 seq 2398644076 subseq 545497 len 1428 csum 0xd933], length 1428
17:22:28.816746 IP 112.26.2.1.targus-getdata1 > 112.26.2.8.43985: Flags [.], ack 81397, win 24218, options [nop,nop,TS val 151528 ecr 4294893883,mptcp dss ack 2398551256], length 0
17:22:28.823568 IP 112.26.2.1.targus-getdata1 > 112.26.2.8.43985: Flags [.], ack 81397, win 24218, options [nop,nop,TS val 151528 ecr 4294893883,mptcp dss ack 2398551256], length 0
