20:58:56.379301 IP 112.26.0.8.57358 > 112.26.0.1.34277: Flags [S], seq 3611240214, win 65535, options [mss 1460,sackOK,TS val 2727727 ecr 0,nop,wscale 6], length 0
20:58:56.383795 IP 112.26.0.8.57358 > 112.26.0.1.34277: Flags [S], seq 3611240214, win 65535, options [mss 1460,sackOK,TS val 2727727 ecr 0,nop,wscale 6], length 0
20:58:56.384952 IP 112.26.0.8.57358 > 112.26.0.1.34277: Flags [S], seq 3611240214, win 65535, options [mss 1460,sackOK,TS val 2727727 ecr 0,nop,wscale 6], length 0
20:58:56.400900 IP 112.26.0.8.57358 > 112.26.0.1.34277: Flags [S], seq 3611240214, win 65535, options [mss 1460,sackOK,TS val 2727727 ecr 0,nop,wscale 6], length 0
20:58:56.401746 IP 112.26.0.8.57358 > 112.26.0.1.34277: Flags [S], seq 3611240214, win 65535, options [mss 1460,sackOK,TS val 2727727 ecr 0,nop,wscale 6], length 0
20:58:56.411014 IP 112.26.0.8.57358 > 112.26.0.1.34277: Flags [S], seq 3611240214, win 65535, options [mss 1460,sackOK,TS val 2727727 ecr 0,nop,wscale 6], length 0
20:58:56.416530 IP 112.26.0.8.57358 > 112.26.0.1.34277: Flags [S], seq 3611240214, win 65535, options [mss 1460,sackOK,TS val 2727727 ecr 0,nop,wscale 6], length 0
20:58:56.488652 IP 112.26.0.8.57358 > 112.26.0.1.34277: Flags [S], seq 3611240214, win 65535, options [mss 1460,sackOK,TS val 2727727 ecr 0,nop,wscale 6], length 0
20:58:56.492601 IP 112.26.0.8.57358 > 112.26.0.1.34277: Flags [S], seq 3611240214, win 65535, options [mss 1460,sackOK,TS val 2727727 ecr 0,nop,wscale 6], length 0
20:58:56.502103 IP 112.26.0.8.57358 > 112.26.0.1.34277: Flags [S], seq 3611240214, win 65535, options [mss 1460,sackOK,TS val 2727727 ecr 0,nop,wscale 6], length 0
20:58:56.502893 IP 112.26.0.8.57358 > 112.26.0.1.34277: Flags [S], seq 3611240214, win 65535, options [mss 1460,sackOK,TS val 2727727 ecr 0,nop,wscale 6], length 0
20:58:56.602017 IP 112.26.0.8.57358 > 112.26.0.1.34277: Flags [S], seq 3611240214, win 65535, options [mss 1460,sackOK,TS val 2727727 ecr 0,nop,wscale 6], length 0
20:58:56.628152 IP 112.26.0.8.57358 > 112.26.0.1.34277: Flags [S], seq 3611240214, win 65535, options [mss 1460,sackOK,TS val 2727727 ecr 0,nop,wscale 6], length 0
20:58:56.726462 IP 112.26.0.8.57358 > 112.26.0.1.34277: Flags [S], seq 3611240214, win 65535, options [mss 1460,sackOK,TS val 2727727 ecr 0,nop,wscale 6], length 0
20:58:56.825691 IP 112.26.0.8.57358 > 112.26.0.1.34277: Flags [S], seq 3611240214, win 65535, options [mss 1460,sackOK,TS val 2727727 ecr 0,nop,wscale 6], length 0
20:58:56.991590 IP 112.26.0.1.34277 > 112.26.0.8.57358: Flags [S.], seq 2503003956, ack 3611240215, win 28960, options [mss 1460,sackOK,TS val 2950043 ecr 2727727,nop,wscale 7], length 0
20:58:56.991863 IP 112.26.0.1.34277 > 112.26.0.8.57358: Flags [S.], seq 2503003956, ack 3611240215, win 28960, options [mss 1460,sackOK,TS val 2950043 ecr 2727727,nop,wscale 7], length 0
20:58:57.002786 IP 112.26.0.8.57358 > 112.26.0.1.34277: Flags [.], ack 1, win 1369, options [nop,nop,TS val 2728354 ecr 2950043], length 0
20:58:57.003521 IP 112.26.0.8.57358 > 112.26.0.1.34277: Flags [.], ack 1, win 1369, options [nop,nop,TS val 2728354 ecr 2950043], length 0
20:58:57.109307 IP 112.26.0.1.34277 > 112.26.0.8.57358: Flags [.], seq 1:1449, ack 1, win 227, options [nop,nop,TS val 2950223 ecr 2728354], length 1448
20:58:57.109529 IP 112.26.0.1.34277 > 112.26.0.8.57358: Flags [.], seq 1:1449, ack 1, win 227, options [nop,nop,TS val 2950223 ecr 2728354], length 1448
20:58:57.122199 IP 112.26.0.8.57358 > 112.26.0.1.34277: Flags [.], ack 1449, win 1414, options [nop,nop,TS val 2728479 ecr 2950223], length 0
20:58:57.126020 IP 112.26.0.8.57358 > 112.26.0.1.34277: Flags [.], ack 1449, win 1414, options [nop,nop,TS val 2728479 ecr 2950223], length 0
20:58:57.139182 IP 112.26.0.1.34277 > 112.26.0.8.57358: Flags [.], seq 1449:2897, ack 1, win 227, options [nop,nop,TS val 2950223 ecr 2728354], length 1448
20:58:57.139363 IP 112.26.0.1.34277 > 112.26.0.8.57358: Flags [.], seq 1449:2897, ack 1, win 227, options [nop,nop,TS val 2950223 ecr 2728354], length 1448
20:58:57.202296 IP 112.26.0.8.57358 > 112.26.0.1.34277: Flags [.], ack 2897, win 1460, options [nop,nop,TS val 2728562 ecr 2950223], length 0
20:58:57.288611 IP 112.26.0.8.57358 > 112.26.0.1.34277: Flags [.], ack 2897, win 1460, options [nop,nop,TS val 2728562 ecr 2950223], length 0
20:58:57.295529 IP 112.26.0.1.34277 > 112.26.0.8.57358: Flags [P.], seq 2897:4097, ack 1, win 227, options [nop,nop,TS val 2950223 ecr 2728354], length 1200
20:58:57.295768 IP 112.26.0.1.34277 > 112.26.0.8.57358: Flags [P.], seq 2897:4097, ack 1, win 227, options [nop,nop,TS val 2950223 ecr 2728354], length 1200
20:58:57.304834 IP 112.26.0.8.57358 > 112.26.0.1.34277: Flags [.], ack 4097, win 1505, options [nop,nop,TS val 2728659 ecr 2950223], length 0
20:58:57.325165 IP 112.26.0.8.57358 > 112.26.0.1.34277: Flags [.], ack 4097, win 1505, options [nop,nop,TS val 2728659 ecr 2950223], length 0
20:58:57.330073 IP 112.26.0.1.34277 > 112.26.0.8.57358: Flags [.], seq 4097:5545, ack 1, win 227, options [nop,nop,TS val 2950223 ecr 2728354], length 1448
20:58:57.330250 IP 112.26.0.1.34277 > 112.26.0.8.57358: Flags [.], seq 4097:5545, ack 1, win 227, options [nop,nop,TS val 2950223 ecr 2728354], length 1448
20:58:57.332681 IP 112.26.0.8.57358 > 112.26.0.1.34277: Flags [.], ack 5545, win 1550, options [nop,nop,TS val 2728692 ecr 2950223], length 0
20:58:57.403052 IP 112.26.0.8.57358 > 112.26.0.1.34277: Flags [.], ack 5545, win 1550, options [nop,nop,TS val 2728692 ecr 2950223], length 0
20:58:57.415657 IP 112.26.0.1.34277 > 112.26.0.8.57358: Flags [.], seq 5545:6993, ack 1, win 227, options [nop,nop,TS val 2950223 ecr 2728354], length 1448
20:58:57.418705 IP 112.26.0.1.34277 > 112.26.0.8.57358: Flags [.], seq 5545:6993, ack 1, win 227, options [nop,nop,TS val 2950223 ecr 2728354], length 1448
20:58:57.426979 IP 112.26.0.8.57358 > 112.26.0.1.34277: Flags [.], ack 6993, win 1595, options [nop,nop,TS val 2728779 ecr 2950223], length 0
20:58:57.500061 IP 112.26.0.8.57358 > 112.26.0.1.34277: Flags [.], ack 6993, win 1595, options [nop,nop,TS val 2728779 ecr 2950223], length 0
20:58:57.517144 IP 112.26.0.1.34277 > 112.26.0.8.57358: Flags [.], seq 6993:8441, ack 1, win 227, options [nop,nop,TS val 2950223 ecr 2728354], length 1448
20:58:57.519109 IP 112.26.0.1.34277 > 112.26.0.8.57358: Flags [.], seq 6993:8441, ack 1, win 227, options [nop,nop,TS val 2950223 ecr 2728354], length 1448
20:58:57.520327 IP 112.26.0.8.57358 > 112.26.0.1.34277: Flags [.], ack 8441, win 1641, options [nop,nop,TS val 2728880 ecr 2950223], length 0
20:58:57.597217 IP 112.26.0.8.57358 > 112.26.0.1.34277: Flags [.], ack 8441, win 1641, options [nop,nop,TS val 2728880 ecr 2950223], length 0
20:58:57.619298 IP 112.26.0.1.34277 > 112.26.0.8.57358: Flags [.], seq 8441:9889, ack 1, win 227, options [nop,nop,TS val 2950223 ecr 2728354], length 1448
20:58:57.627970 IP 112.26.0.1.34277 > 112.26.0.8.57358: Flags [.], seq 8441:9889, ack 1, win 227, options [nop,nop,TS val 2950223 ecr 2728354], length 1448
20:58:57.698648 IP 112.26.0.8.57358 > 112.26.0.1.34277: Flags [.], ack 9889, win 1686, options [nop,nop,TS val 2728989 ecr 2950223], length 0
20:58:57.702926 IP 112.26.0.1.34277 > 112.26.0.8.57358: Flags [.], seq 9889:11337, ack 1, win 227, options [nop,nop,TS val 2950223 ecr 2728354], length 1448
20:58:57.719521 IP 112.26.0.1.34277 > 112.26.0.8.57358: Flags [.], seq 9889:11337, ack 1, win 227, options [nop,nop,TS val 2950223 ecr 2728354], length 1448
20:58:57.727948 IP 112.26.0.8.57358 > 112.26.0.1.34277: Flags [.], ack 9889, win 1686, options [nop,nop,TS val 2728989 ecr 2950223], length 0
20:58:57.729301 IP 112.26.0.1.34277 > 112.26.0.8.57358: Flags [.], seq 11337:12785, ack 1, win 227, options [nop,nop,TS val 2950224 ecr 2728354], length 1448
20:58:57.746221 IP 112.26.0.8.57358 > 112.26.0.1.34277: Flags [.], ack 11337, win 1731, options [nop,nop,TS val 2729080 ecr 2950223], length 0
20:58:57.806881 IP 112.26.0.1.34277 > 112.26.0.8.57358: Flags [.], seq 11337:12785, ack 1, win 227, options [nop,nop,TS val 2950224 ecr 2728354], length 1448
20:58:57.812453 IP 112.26.0.1.34277 > 112.26.0.8.57358: Flags [.], seq 14233:15681, ack 1, win 227, options [nop,nop,TS val 2950346 ecr 2728479], length 1448
20:58:57.818167 IP 112.26.0.8.57358 > 112.26.0.1.34277: Flags [.], ack 12785, win 1776, options [nop,nop,TS val 2729167 ecr 2950224], length 0
20:58:57.900097 IP 112.26.0.1.34277 > 112.26.0.8.57358: Flags [.], seq 15681:17129, ack 1, win 227, options [nop,nop,TS val 2950346 ecr 2728479], length 1448
20:58:57.913256 IP 112.26.0.1.34277 > 112.26.0.8.57358: Flags [.], seq 14233:15681, ack 1, win 227, options [nop,nop,TS val 2950346 ecr 2728479], length 1448
20:58:57.916161 IP 112.26.0.8.57358 > 112.26.0.1.34277: Flags [.], ack 12785, win 1822, options [nop,nop,TS val 2729274 ecr 2950224,nop,nop,sack 1 {14233:15681}], length 0
20:58:58.014884 IP 112.26.0.1.34277 > 112.26.0.8.57358: Flags [.], seq 17129:18577, ack 1, win 227, options [nop,nop,TS val 2950505 ecr 2728562], length 1448
20:58:58.018015 IP 112.26.0.1.34277 > 112.26.0.8.57358: Flags [.], seq 15681:17129, ack 1, win 227, options [nop,nop,TS val 2950346 ecr 2728479], length 1448
20:58:58.019217 IP 112.26.0.8.57358 > 112.26.0.1.34277: Flags [.], ack 12785, win 1867, options [nop,nop,TS val 2729379 ecr 2950224,nop,nop,sack 1 {14233:17129}], length 0
20:58:58.031239 IP 112.26.0.8.57358 > 112.26.0.1.34277: Flags [.], ack 11337, win 1731, options [nop,nop,TS val 2729080 ecr 2950223], length 0
20:58:58.102916 IP 112.26.0.1.34277 > 112.26.0.8.57358: Flags [.], seq 17129:18577, ack 1, win 227, options [nop,nop,TS val 2950505 ecr 2728562], length 1448
20:58:58.106545 IP 112.26.0.8.57358 > 112.26.0.1.34277: Flags [.], ack 12785, win 1912, options [nop,nop,TS val 2729463 ecr 2950224,nop,nop,sack 1 {14233:18577}], length 0
20:58:58.113470 IP 112.26.0.1.34277 > 112.26.0.8.57358: Flags [.], seq 18577:20025, ack 1, win 227, options [nop,nop,TS val 2950505 ecr 2728562], length 1448
20:58:58.139387 IP 112.26.0.1.34277 > 112.26.0.8.57358: Flags [.], seq 18577:20025, ack 1, win 227, options [nop,nop,TS val 2950505 ecr 2728562], length 1448
20:58:58.141461 IP 112.26.0.8.57358 > 112.26.0.1.34277: Flags [.], ack 12785, win 1957, options [nop,nop,TS val 2729500 ecr 2950224,nop,nop,sack 1 {14233:20025}], length 0
20:58:58.147333 IP 112.26.0.8.57358 > 112.26.0.1.34277: Flags [.], ack 12785, win 1776, options [nop,nop,TS val 2729167 ecr 2950224], length 0
20:58:58.197977 IP 112.26.0.1.34277 > 112.26.0.8.57358: Flags [.], seq 20025:21473, ack 1, win 227, options [nop,nop,TS val 2950542 ecr 2728659], length 1448
20:58:58.212798 IP 112.26.0.1.34277 > 112.26.0.8.57358: Flags [.], seq 20025:21473, ack 1, win 227, options [nop,nop,TS val 2950542 ecr 2728659], length 1448
20:58:58.213993 IP 112.26.0.8.57358 > 112.26.0.1.34277: Flags [.], ack 12785, win 2003, options [nop,nop,TS val 2729573 ecr 2950224,nop,nop,sack 1 {14233:21473}], length 0
20:58:58.227840 IP 112.26.0.1.34277 > 112.26.0.8.57358: Flags [.], seq 21473:22921, ack 1, win 227, options [nop,nop,TS val 2950542 ecr 2728659], length 1448
20:58:58.240072 IP 112.26.0.8.57358 > 112.26.0.1.34277: Flags [.], ack 12785, win 1822, options [nop,nop,TS val 2729274 ecr 2950224,nop,nop,sack 1 {14233:15681}], length 0
20:58:58.242988 IP 112.26.0.1.34277 > 112.26.0.8.57358: Flags [.], seq 21473:22921, ack 1, win 227, options [nop,nop,TS val 2950542 ecr 2728659], length 1448
20:58:58.244199 IP 112.26.0.8.57358 > 112.26.0.1.34277: Flags [.], ack 12785, win 2048, options [nop,nop,TS val 2729603 ecr 2950224,nop,nop,sack 1 {14233:22921}], length 0
20:58:58.312842 IP 112.26.0.1.34277 > 112.26.0.8.57358: Flags [.], seq 22921:24369, ack 1, win 227, options [nop,nop,TS val 2950620 ecr 2728692], length 1448
20:58:58.314791 IP 112.26.0.1.34277 > 112.26.0.8.57358: Flags [.], seq 22921:24369, ack 1, win 227, options [nop,nop,TS val 2950620 ecr 2728692], length 1448
20:58:58.319421 IP 112.26.0.8.57358 > 112.26.0.1.34277: Flags [.], ack 12785, win 2093, options [nop,nop,TS val 2729675 ecr 2950224,nop,nop,sack 1 {14233:24369}], length 0
20:58:58.333833 IP 112.26.0.8.57358 > 112.26.0.1.34277: Flags [.], ack 12785, win 1867, options [nop,nop,TS val 2729379 ecr 2950224,nop,nop,sack 1 {14233:17129}], length 0
20:58:58.397376 IP 112.26.0.1.34277 > 112.26.0.8.57358: Flags [.], seq 24369:25817, ack 1, win 227, options [nop,nop,TS val 2950620 ecr 2728692], length 1448
20:58:58.400033 IP 112.26.0.1.34277 > 112.26.0.8.57358: Flags [.], seq 24369:25817, ack 1, win 227, options [nop,nop,TS val 2950620 ecr 2728692], length 1448
20:58:58.404006 IP 112.26.0.8.57358 > 112.26.0.1.34277: Flags [.], ack 12785, win 2138, options [nop,nop,TS val 2729760 ecr 2950224,nop,nop,sack 1 {14233:25817}], length 0
20:58:58.421410 IP 112.26.0.8.57358 > 112.26.0.1.34277: Flags [.], ack 12785, win 1912, options [nop,nop,TS val 2729463 ecr 2950224,nop,nop,sack 1 {14233:18577}], length 0
20:58:58.430552 IP 112.26.0.1.34277 > 112.26.0.8.57358: Flags [.], seq 27265:28713, ack 1, win 227, options [nop,nop,TS val 2950716 ecr 2728779], length 1448
20:58:58.437041 IP 112.26.0.1.34277 > 112.26.0.8.57358: Flags [.], seq 27265:28713, ack 1, win 227, options [nop,nop,TS val 2950716 ecr 2728779], length 1448
20:58:58.438228 IP 112.26.0.8.57358 > 112.26.0.1.34277: Flags [.], ack 12785, win 2184, options [nop,nop,TS val 2729797 ecr 2950224,nop,nop,sack 2 {27265:28713}{14233:25817}], length 0
20:58:58.509656 IP 112.26.0.8.57358 > 112.26.0.1.34277: Flags [.], ack 12785, win 1957, options [nop,nop,TS val 2729500 ecr 2950224,nop,nop,sack 1 {14233:20025}], length 0
20:58:58.519716 IP 112.26.0.1.34277 > 112.26.0.8.57358: Flags [.], seq 28713:30161, ack 1, win 227, options [nop,nop,TS val 2950745 ecr 2728880], length 1448
20:58:58.522004 IP 112.26.0.1.34277 > 112.26.0.8.57358: Flags [.], seq 28713:30161, ack 1, win 227, options [nop,nop,TS val 2950745 ecr 2728880], length 1448
20:58:58.531027 IP 112.26.0.8.57358 > 112.26.0.1.34277: Flags [.], ack 12785, win 2229, options [nop,nop,TS val 2729882 ecr 2950224,nop,nop,sack 2 {27265:30161}{14233:25817}], length 0
20:58:58.604778 IP 112.26.0.8.57358 > 112.26.0.1.34277: Flags [.], ack 12785, win 2003, options [nop,nop,TS val 2729573 ecr 2950224,nop,nop,sack 1 {14233:21473}], length 0
20:58:58.605503 IP 112.26.0.1.34277 > 112.26.0.8.57358: Flags [.], seq 31609:33057, ack 1, win 227, options [nop,nop,TS val 2950945 ecr 2728989], length 1448
20:58:58.607994 IP 112.26.0.1.34277 > 112.26.0.8.57358: Flags [.], seq 31609:33057, ack 1, win 227, options [nop,nop,TS val 2950945 ecr 2728989], length 1448
20:58:58.612629 IP 112.26.0.8.57358 > 112.26.0.1.34277: Flags [.], ack 12785, win 2274, options [nop,nop,TS val 2729969 ecr 2950224,nop,nop,sack 3 {31609:33057}{27265:30161}{14233:25817}], length 0
20:58:58.645788 IP 112.26.0.8.57358 > 112.26.0.1.34277: Flags [.], ack 12785, win 2048, options [nop,nop,TS val 2729603 ecr 2950224,nop,nop,sack 1 {14233:22921}], length 0
20:58:58.648070 IP 112.26.0.1.34277 > 112.26.0.8.57358: Flags [.], seq 34505:35953, ack 1, win 227, options [nop,nop,TS val 2951248 ecr 2729080], length 1448
20:58:58.651439 IP 112.26.0.8.57358 > 112.26.0.1.34277: Flags [.], ack 12785, win 2319, options [nop,nop,TS val 2730011 ecr 2950224,nop,nop,sack 3 {34505:35953}{31609:33057}{27265:30161}], length 0
20:58:58.654973 IP 112.26.0.1.34277 > 112.26.0.8.57358: Flags [.], seq 34505:35953, ack 1, win 227, options [nop,nop,TS val 2951248 ecr 2729080], length 1448
20:58:58.714403 IP 112.26.0.8.57358 > 112.26.0.1.34277: Flags [.], ack 12785, win 2093, options [nop,nop,TS val 2729675 ecr 2950224,nop,nop,sack 1 {14233:24369}], length 0
20:58:58.732176 IP 112.26.0.8.57358 > 112.26.0.1.34277: Flags [.], ack 12785, win 2138, options [nop,nop,TS val 2729760 ecr 2950224,nop,nop,sack 1 {14233:25817}], length 0
20:58:58.800693 IP 112.26.0.1.34277 > 112.26.0.8.57358: Flags [.], seq 37401:38849, ack 1, win 227, options [nop,nop,TS val 2951364 ecr 2729167], length 1448
20:58:58.811214 IP 112.26.0.8.57358 > 112.26.0.1.34277: Flags [.], ack 12785, win 2365, options [nop,nop,TS val 2730164 ecr 2950224,nop,nop,sack 3 {37401:38849}{34505:35953}{31609:33057}], length 0
20:58:58.812017 IP 112.26.0.1.34277 > 112.26.0.8.57358: Flags [.], seq 37401:38849, ack 1, win 227, options [nop,nop,TS val 2951364 ecr 2729167], length 1448
20:58:58.822921 IP 112.26.0.1.34277 > 112.26.0.8.57358: Flags [.], seq 38849:40297, ack 1, win 227, options [nop,nop,TS val 2951364 ecr 2729167], length 1448
20:58:58.830417 IP 112.26.0.8.57358 > 112.26.0.1.34277: Flags [.], ack 12785, win 2184, options [nop,nop,TS val 2729797 ecr 2950224,nop,nop,sack 2 {27265:28713}{14233:25817}], length 0
20:58:58.836240 IP 112.26.0.1.34277 > 112.26.0.8.57358: Flags [.], seq 38849:40297, ack 1, win 227, options [nop,nop,TS val 2951364 ecr 2729167], length 1448
20:58:58.837472 IP 112.26.0.8.57358 > 112.26.0.1.34277: Flags [.], ack 12785, win 2410, options [nop,nop,TS val 2730197 ecr 2950224,nop,nop,sack 3 {37401:40297}{34505:35953}{31609:33057}], length 0
20:58:58.912518 IP 112.26.0.1.34277 > 112.26.0.8.57358: Flags [.], seq 40297:41745, ack 1, win 227, options [nop,nop,TS val 2951457 ecr 2729274], length 1448
20:58:58.918621 IP 112.26.0.8.57358 > 112.26.0.1.34277: Flags [.], ack 12785, win 2229, options [nop,nop,TS val 2729882 ecr 2950224,nop,nop,sack 2 {27265:30161}{14233:25817}], length 0
20:58:58.930127 IP 112.26.0.1.34277 > 112.26.0.8.57358: Flags [.], seq 40297:41745, ack 1, win 227, options [nop,nop,TS val 2951457 ecr 2729274], length 1448
20:58:58.931740 IP 112.26.0.8.57358 > 112.26.0.1.34277: Flags [.], ack 12785, win 2455, options [nop,nop,TS val 2730291 ecr 2950224,nop,nop,sack 3 {37401:41745}{34505:35953}{31609:33057}], length 0
20:58:58.944852 IP 112.26.0.8.57358 > 112.26.0.1.34277: Flags [.], ack 12785, win 2274, options [nop,nop,TS val 2729969 ecr 2950224,nop,nop,sack 3 {31609:33057}{27265:30161}{14233:25817}], length 0
20:58:58.948348 IP 112.26.0.1.34277 > 112.26.0.8.57358: Flags [.], seq 41745:43193, ack 1, win 227, options [nop,nop,TS val 2951551 ecr 2729379], length 1448
20:58:59.007821 IP 112.26.0.1.34277 > 112.26.0.8.57358: Flags [.], seq 41745:43193, ack 1, win 227, options [nop,nop,TS val 2951551 ecr 2729379], length 1448
20:58:59.009027 IP 112.26.0.8.57358 > 112.26.0.1.34277: Flags [.], ack 12785, win 2500, options [nop,nop,TS val 2730369 ecr 2950224,nop,nop,sack 3 {37401:43193}{34505:35953}{31609:33057}], length 0
20:58:59.019978 IP 112.26.0.8.57358 > 112.26.0.1.34277: Flags [.], ack 12785, win 2319, options [nop,nop,TS val 2730011 ecr 2950224,nop,nop,sack 3 {34505:35953}{31609:33057}{27265:30161}], length 0
20:58:59.033040 IP 112.26.0.1.34277 > 112.26.0.8.57358: Flags [.], seq 43193:44641, ack 1, win 227, options [nop,nop,TS val 2951726 ecr 2729500], length 1448
20:58:59.036002 IP 112.26.0.8.57358 > 112.26.0.1.34277: Flags [.], ack 12785, win 2546, options [nop,nop,TS val 2730395 ecr 2950224,nop,nop,sack 3 {37401:44641}{34505:35953}{31609:33057}], length 0
20:58:59.038014 IP 112.26.0.1.34277 > 112.26.0.8.57358: Flags [.], seq 43193:44641, ack 1, win 227, options [nop,nop,TS val 2951726 ecr 2729500], length 1448
20:58:59.048163 IP 112.26.0.8.57358 > 112.26.0.1.34277: Flags [.], ack 12785, win 2365, options [nop,nop,TS val 2730164 ecr 2950224,nop,nop,sack 3 {37401:38849}{34505:35953}{31609:33057}], length 0
20:58:59.115436 IP 112.26.0.1.34277 > 112.26.0.8.57358: Flags [.], seq 44641:46089, ack 1, win 227, options [nop,nop,TS val 2951822 ecr 2729573], length 1448
20:58:59.122869 IP 112.26.0.1.34277 > 112.26.0.8.57358: Flags [.], seq 44641:46089, ack 1, win 227, options [nop,nop,TS val 2951822 ecr 2729573], length 1448
20:58:59.123748 IP 112.26.0.8.57358 > 112.26.0.1.34277: Flags [.], ack 12785, win 2591, options [nop,nop,TS val 2730478 ecr 2950224,nop,nop,sack 3 {37401:46089}{34505:35953}{31609:33057}], length 0
20:58:59.200975 IP 112.26.0.8.57358 > 112.26.0.1.34277: Flags [.], ack 12785, win 2410, options [nop,nop,TS val 2730197 ecr 2950224,nop,nop,sack 3 {37401:40297}{34505:35953}{31609:33057}], length 0
20:58:59.210729 IP 112.26.0.1.34277 > 112.26.0.8.57358: Flags [.], seq 46089:47537, ack 1, win 227, options [nop,nop,TS val 2951931 ecr 2729675], length 1448
20:58:59.215012 IP 112.26.0.8.57358 > 112.26.0.1.34277: Flags [.], ack 12785, win 2636, options [nop,nop,TS val 2730573 ecr 2950224,nop,nop,sack 3 {37401:47537}{34505:35953}{31609:33057}], length 0
20:58:59.222297 IP 112.26.0.1.34277 > 112.26.0.8.57358: Flags [.], seq 46089:47537, ack 1, win 227, options [nop,nop,TS val 2951931 ecr 2729675], length 1448
20:58:59.228953 IP 112.26.0.1.34277 > 112.26.0.8.57358: Flags [.], seq 47537:48985, ack 1, win 227, options [nop,nop,TS val 2951949 ecr 2729760], length 1448
20:58:59.238708 IP 112.26.0.8.57358 > 112.26.0.1.34277: Flags [.], ack 12785, win 2455, options [nop,nop,TS val 2730291 ecr 2950224,nop,nop,sack 3 {37401:41745}{34505:35953}{31609:33057}], length 0
20:58:59.243772 IP 112.26.0.1.34277 > 112.26.0.8.57358: Flags [.], seq 47537:48985, ack 1, win 227, options [nop,nop,TS val 2951949 ecr 2729760], length 1448
20:58:59.247153 IP 112.26.0.8.57358 > 112.26.0.1.34277: Flags [.], ack 12785, win 2681, options [nop,nop,TS val 2730604 ecr 2950224,nop,nop,sack 3 {37401:48985}{34505:35953}{31609:33057}], length 0
20:58:59.308377 IP 112.26.0.1.34277 > 112.26.0.8.57358: Flags [.], seq 25817:27265, ack 1, win 227, options [nop,nop,TS val 2952135 ecr 2729882], length 1448
20:58:59.311115 IP 112.26.0.1.34277 > 112.26.0.8.57358: Flags [.], seq 25817:27265, ack 1, win 227, options [nop,nop,TS val 2952135 ecr 2729882], length 1448
20:58:59.316495 IP 112.26.0.8.57358 > 112.26.0.1.34277: Flags [.], ack 12785, win 2500, options [nop,nop,TS val 2730369 ecr 2950224,nop,nop,sack 3 {37401:43193}{34505:35953}{31609:33057}], length 0
20:58:59.322813 IP 112.26.0.8.57358 > 112.26.0.1.34277: Flags [.], ack 12785, win 2727, options [nop,nop,TS val 2730670 ecr 2950224,nop,nop,sack 3 {25817:30161}{37401:48985}{34505:35953}], length 0
20:58:59.337567 IP 112.26.0.1.34277 > 112.26.0.8.57358: Flags [.], seq 30161:31609, ack 1, win 227, options [nop,nop,TS val 2952237 ecr 2730011], length 1448
20:58:59.340293 IP 112.26.0.1.34277 > 112.26.0.8.57358: Flags [.], seq 30161:31609, ack 1, win 227, options [nop,nop,TS val 2952237 ecr 2730011], length 1448
20:58:59.342550 IP 112.26.0.8.57358 > 112.26.0.1.34277: Flags [.], ack 12785, win 2772, options [nop,nop,TS val 2730700 ecr 2950224,nop,nop,sack 3 {25817:33057}{37401:48985}{34505:35953}], length 0
20:58:59.405928 IP 112.26.0.8.57358 > 112.26.0.1.34277: Flags [.], ack 12785, win 2546, options [nop,nop,TS val 2730395 ecr 2950224,nop,nop,sack 3 {37401:44641}{34505:35953}{31609:33057}], length 0
20:58:59.415023 IP 112.26.0.8.57358 > 112.26.0.1.34277: Flags [.], ack 12785, win 2591, options [nop,nop,TS val 2730478 ecr 2950224,nop,nop,sack 3 {37401:46089}{34505:35953}{31609:33057}], length 0
20:58:59.431884 IP 112.26.0.1.34277 > 112.26.0.8.57358: Flags [.], seq 33057:34505, ack 1, win 227, options [nop,nop,TS val 2952264 ecr 2730164], length 1448
20:58:59.433396 IP 112.26.0.1.34277 > 112.26.0.8.57358: Flags [.], seq 33057:34505, ack 1, win 227, options [nop,nop,TS val 2952264 ecr 2730164], length 1448
20:58:59.436305 IP 112.26.0.8.57358 > 112.26.0.1.34277: Flags [.], ack 12785, win 2817, options [nop,nop,TS val 2730794 ecr 2950224,nop,nop,sack 2 {25817:35953}{37401:48985}], length 0
20:58:59.503276 IP 112.26.0.8.57358 > 112.26.0.1.34277: Flags [.], ack 12785, win 2636, options [nop,nop,TS val 2730573 ecr 2950224,nop,nop,sack 3 {37401:47537}{34505:35953}{31609:33057}], length 0
20:58:59.521154 IP 112.26.0.8.57358 > 112.26.0.1.34277: Flags [.], ack 12785, win 2681, options [nop,nop,TS val 2730604 ecr 2950224,nop,nop,sack 3 {37401:48985}{34505:35953}{31609:33057}], length 0
20:58:59.609051 IP 112.26.0.1.34277 > 112.26.0.8.57358: Flags [.], seq 35953:37401, ack 1, win 227, options [nop,nop,TS val 2952417 ecr 2730197], length 1448
20:58:59.612932 IP 112.26.0.8.57358 > 112.26.0.1.34277: Flags [.], ack 12785, win 2862, options [nop,nop,TS val 2730971 ecr 2950224,nop,nop,sack 1 {25817:48985}], length 0
20:58:59.617781 IP 112.26.0.1.34277 > 112.26.0.8.57358: Flags [.], seq 35953:37401, ack 1, win 227, options [nop,nop,TS val 2952417 ecr 2730197], length 1448
20:58:59.626094 IP 112.26.0.8.57358 > 112.26.0.1.34277: Flags [.], ack 12785, win 2727, options [nop,nop,TS val 2730670 ecr 2950224,nop,nop,sack 3 {25817:30161}{37401:48985}{34505:35953}], length 0
20:58:59.631516 IP 112.26.0.1.34277 > 112.26.0.8.57358: Flags [.], seq 48985:50433, ack 1, win 227, options [nop,nop,TS val 2952455 ecr 2730291], length 1448
20:58:59.712203 IP 112.26.0.1.34277 > 112.26.0.8.57358: Flags [.], seq 48985:50433, ack 1, win 227, options [nop,nop,TS val 2952455 ecr 2730291], length 1448
20:58:59.714731 IP 112.26.0.8.57358 > 112.26.0.1.34277: Flags [.], ack 12785, win 2908, options [nop,nop,TS val 2731073 ecr 2950224,nop,nop,sack 1 {25817:50433}], length 0
20:58:59.723110 IP 112.26.0.8.57358 > 112.26.0.1.34277: Flags [.], ack 12785, win 2772, options [nop,nop,TS val 2730700 ecr 2950224,nop,nop,sack 3 {25817:33057}{37401:48985}{34505:35953}], length 0
20:58:59.725165 IP 112.26.0.1.34277 > 112.26.0.8.57358: Flags [.], seq 50433:51881, ack 1, win 227, options [nop,nop,TS val 2952533 ecr 2730369], length 1448
20:58:59.735815 IP 112.26.0.8.57358 > 112.26.0.1.34277: Flags [.], ack 12785, win 2817, options [nop,nop,TS val 2730794 ecr 2950224,nop,nop,sack 2 {25817:35953}{37401:48985}], length 0
20:58:59.742322 IP 112.26.0.1.34277 > 112.26.0.8.57358: Flags [.], seq 50433:51881, ack 1, win 227, options [nop,nop,TS val 2952533 ecr 2730369], length 1448
20:58:59.743555 IP 112.26.0.8.57358 > 112.26.0.1.34277: Flags [.], ack 12785, win 2953, options [nop,nop,TS val 2731103 ecr 2950224,nop,nop,sack 1 {25817:51881}], length 0
20:58:59.753795 IP 112.26.0.1.34277 > 112.26.0.8.57358: Flags [.], seq 12785:14233, ack 1, win 227, options [nop,nop,TS val 2952621 ecr 2730395], length 1448
20:58:59.816886 IP 112.26.0.8.57358 > 112.26.0.1.34277: Flags [.], ack 12785, win 2862, options [nop,nop,TS val 2730971 ecr 2950224,nop,nop,sack 1 {25817:48985}], length 0
20:58:59.819468 IP 112.26.0.1.34277 > 112.26.0.8.57358: Flags [.], seq 12785:14233, ack 1, win 227, options [nop,nop,TS val 2952621 ecr 2730395], length 1448
20:58:59.821841 IP 112.26.0.8.57358 > 112.26.0.1.34277: Flags [.], ack 51881, win 2998, options [nop,nop,TS val 2731180 ecr 2952621], length 0
20:58:59.828063 IP 112.26.0.1.34277 > 112.26.0.8.57358: Flags [.], seq 51881:53329, ack 1, win 227, options [nop,nop,TS val 2952631 ecr 2730478], length 1448
20:58:59.843417 IP 112.26.0.1.34277 > 112.26.0.8.57358: Flags [.], seq 51881:53329, ack 1, win 227, options [nop,nop,TS val 2952631 ecr 2730478], length 1448
20:58:59.846157 IP 112.26.0.1.34277 > 112.26.0.8.57358: Flags [P.], seq 53329:54777, ack 1, win 227, options [nop,nop,TS val 2952719 ecr 2730573], length 1448
20:58:59.850815 IP 112.26.0.8.57358 > 112.26.0.1.34277: Flags [.], ack 12785, win 2908, options [nop,nop,TS val 2731073 ecr 2950224,nop,nop,sack 1 {25817:50433}], length 0
20:58:59.854517 IP 112.26.0.8.57358 > 112.26.0.1.34277: Flags [.], ack 53329, win 3043, options [nop,nop,TS val 2731204 ecr 2952631], length 0
20:58:59.923117 IP 112.26.0.1.34277 > 112.26.0.8.57358: Flags [P.], seq 53329:54777, ack 1, win 227, options [nop,nop,TS val 2952719 ecr 2730573], length 1448
20:58:59.926455 IP 112.26.0.8.57358 > 112.26.0.1.34277: Flags [.], ack 54777, win 3089, options [nop,nop,TS val 2731284 ecr 2952719], length 0
20:58:59.931664 IP 112.26.0.8.57358 > 112.26.0.1.34277: Flags [.], ack 12785, win 2953, options [nop,nop,TS val 2731103 ecr 2950224,nop,nop,sack 1 {25817:51881}], length 0
20:59:00.012750 IP 112.26.0.8.57358 > 112.26.0.1.34277: Flags [.], ack 51881, win 2998, options [nop,nop,TS val 2731180 ecr 2952621], length 0
20:59:00.027846 IP 112.26.0.1.34277 > 112.26.0.8.57358: Flags [.], seq 54777:56225, ack 1, win 227, options [nop,nop,TS val 2953228 ecr 2731180], length 1448
20:59:00.029791 IP 112.26.0.1.34277 > 112.26.0.8.57358: Flags [.], seq 54777:56225, ack 1, win 227, options [nop,nop,TS val 2953228 ecr 2731180], length 1448
20:59:00.031013 IP 112.26.0.8.57358 > 112.26.0.1.34277: Flags [.], ack 56225, win 3134, options [nop,nop,TS val 2731390 ecr 2953228], length 0
20:59:00.046169 IP 112.26.0.8.57358 > 112.26.0.1.34277: Flags [.], ack 53329, win 3043, options [nop,nop,TS val 2731204 ecr 2952631], length 0
20:59:00.117938 IP 112.26.0.8.57358 > 112.26.0.1.34277: Flags [.], ack 54777, win 3089, options [nop,nop,TS val 2731284 ecr 2952719], length 0
20:59:00.121203 IP 112.26.0.1.34277 > 112.26.0.8.57358: Flags [P.], seq 56225:57345, ack 1, win 227, options [nop,nop,TS val 2953228 ecr 2731180], length 1120
20:59:00.125653 IP 112.26.0.8.57358 > 112.26.0.1.34277: Flags [.], ack 57345, win 3179, options [nop,nop,TS val 2731484 ecr 2953228], length 0
20:59:00.132264 IP 112.26.0.1.34277 > 112.26.0.8.57358: Flags [P.], seq 56225:57345, ack 1, win 227, options [nop,nop,TS val 2953228 ecr 2731180], length 1120
20:59:00.149111 IP 112.26.0.8.57358 > 112.26.0.1.34277: Flags [.], ack 56225, win 3134, options [nop,nop,TS val 2731390 ecr 2953228], length 0
20:59:00.154123 IP 112.26.0.1.34277 > 112.26.0.8.57358: Flags [.], seq 57345:58793, ack 1, win 227, options [nop,nop,TS val 2953228 ecr 2731180], length 1448
20:59:00.156064 IP 112.26.0.1.34277 > 112.26.0.8.57358: Flags [.], seq 57345:58793, ack 1, win 227, options [nop,nop,TS val 2953228 ecr 2731180], length 1448
20:59:00.209404 IP 112.26.0.8.57358 > 112.26.0.1.34277: Flags [.], ack 58793, win 3224, options [nop,nop,TS val 2731517 ecr 2953228], length 0
20:59:00.233185 IP 112.26.0.8.57358 > 112.26.0.1.34277: Flags [.], ack 57345, win 3179, options [nop,nop,TS val 2731484 ecr 2953228], length 0
20:59:00.239109 IP 112.26.0.1.34277 > 112.26.0.8.57358: Flags [.], seq 58793:60241, ack 1, win 227, options [nop,nop,TS val 2953228 ecr 2731180], length 1448
20:59:00.242881 IP 112.26.0.1.34277 > 112.26.0.8.57358: Flags [.], seq 58793:60241, ack 1, win 227, options [nop,nop,TS val 2953228 ecr 2731180], length 1448
20:59:00.246751 IP 112.26.0.8.57358 > 112.26.0.1.34277: Flags [.], ack 60241, win 3270, options [nop,nop,TS val 2731604 ecr 2953228], length 0
20:59:00.314747 IP 112.26.0.1.34277 > 112.26.0.8.57358: Flags [.], seq 60241:61689, ack 1, win 227, options [nop,nop,TS val 2953229 ecr 2731180], length 1448
20:59:00.322183 IP 112.26.0.1.34277 > 112.26.0.8.57358: Flags [.], seq 60241:61689, ack 1, win 227, options [nop,nop,TS val 2953229 ecr 2731180], length 1448
20:59:00.323146 IP 112.26.0.8.57358 > 112.26.0.1.34277: Flags [.], ack 61689, win 3315, options [nop,nop,TS val 2731678 ecr 2953229], length 0
20:59:00.328376 IP 112.26.0.8.57358 > 112.26.0.1.34277: Flags [.], ack 58793, win 3224, options [nop,nop,TS val 2731517 ecr 2953228], length 0
20:59:00.352213 IP 112.26.0.8.57358 > 112.26.0.1.34277: Flags [.], ack 60241, win 3270, options [nop,nop,TS val 2731604 ecr 2953228], length 0
20:59:00.352940 IP 112.26.0.1.34277 > 112.26.0.8.57358: Flags [.], seq 61689:63137, ack 1, win 227, options [nop,nop,TS val 2953229 ecr 2731180], length 1448
20:59:00.404844 IP 112.26.0.1.34277 > 112.26.0.8.57358: Flags [.], seq 61689:63137, ack 1, win 227, options [nop,nop,TS val 2953229 ecr 2731180], length 1448
20:59:00.408328 IP 112.26.0.8.57358 > 112.26.0.1.34277: Flags [.], ack 63137, win 3360, options [nop,nop,TS val 2731766 ecr 2953229], length 0
20:59:00.426182 IP 112.26.0.1.34277 > 112.26.0.8.57358: Flags [.], seq 63137:64585, ack 1, win 227, options [nop,nop,TS val 2953229 ecr 2731180], length 1448
20:59:00.437385 IP 112.26.0.8.57358 > 112.26.0.1.34277: Flags [.], ack 61689, win 3315, options [nop,nop,TS val 2731678 ecr 2953229], length 0
20:59:00.443634 IP 112.26.0.1.34277 > 112.26.0.8.57358: Flags [.], seq 63137:64585, ack 1, win 227, options [nop,nop,TS val 2953229 ecr 2731180], length 1448
20:59:00.444796 IP 112.26.0.8.57358 > 112.26.0.1.34277: Flags [.], ack 64585, win 3405, options [nop,nop,TS val 2731805 ecr 2953229], length 0
20:59:00.526709 IP 112.26.0.8.57358 > 112.26.0.1.34277: Flags [.], ack 63137, win 3360, options [nop,nop,TS val 2731766 ecr 2953229], length 0
20:59:00.532394 IP 112.26.0.1.34277 > 112.26.0.8.57358: Flags [.], seq 64585:66033, ack 1, win 227, options [nop,nop,TS val 2953229 ecr 2731180], length 1448
20:59:00.540815 IP 112.26.0.1.34277 > 112.26.0.8.57358: Flags [.], seq 64585:66033, ack 1, win 227, options [nop,nop,TS val 2953229 ecr 2731180], length 1448
20:59:00.549316 IP 112.26.0.8.57358 > 112.26.0.1.34277: Flags [.], ack 66033, win 3451, options [nop,nop,TS val 2731902 ecr 2953229], length 0
20:59:00.567221 IP 112.26.0.1.34277 > 112.26.0.8.57358: Flags [.], seq 66033:67481, ack 1, win 227, options [nop,nop,TS val 2953229 ecr 2731180], length 1448
20:59:00.614064 IP 112.26.0.8.57358 > 112.26.0.1.34277: Flags [.], ack 64585, win 3405, options [nop,nop,TS val 2731805 ecr 2953229], length 0
20:59:00.633141 IP 112.26.0.1.34277 > 112.26.0.8.57358: Flags [.], seq 66033:67481, ack 1, win 227, options [nop,nop,TS val 2953229 ecr 2731180], length 1448
20:59:00.644240 IP 112.26.0.1.34277 > 112.26.0.8.57358: Flags [.], seq 67481:68929, ack 1, win 227, options [nop,nop,TS val 2953229 ecr 2731180], length 1448
20:59:00.654165 IP 112.26.0.8.57358 > 112.26.0.1.34277: Flags [.], ack 66033, win 3451, options [nop,nop,TS val 2731902 ecr 2953229], length 0
20:59:00.670851 IP 112.26.0.1.34277 > 112.26.0.8.57358: Flags [.], seq 67481:68929, ack 1, win 227, options [nop,nop,TS val 2953229 ecr 2731180], length 1448
20:59:00.711617 IP 112.26.0.8.57358 > 112.26.0.1.34277: Flags [.], ack 67481, win 3496, options [nop,nop,TS val 2731994 ecr 2953229], length 0
20:59:00.718023 IP 112.26.0.1.34277 > 112.26.0.8.57358: Flags [.], seq 70377:71825, ack 1, win 227, options [nop,nop,TS val 2953263 ecr 2731204], length 1448
20:59:00.744711 IP 112.26.0.8.57358 > 112.26.0.1.34277: Flags [.], ack 68929, win 3541, options [nop,nop,TS val 2732032 ecr 2953229], length 0
20:59:00.822429 IP 112.26.0.1.34277 > 112.26.0.8.57358: Flags [.], seq 71825:73273, ack 1, win 227, options [nop,nop,TS val 2953334 ecr 2731284], length 1448
20:59:00.827805 IP 112.26.0.1.34277 > 112.26.0.8.57358: Flags [.], seq 70377:71825, ack 1, win 227, options [nop,nop,TS val 2953263 ecr 2731204], length 1448
20:59:00.829046 IP 112.26.0.8.57358 > 112.26.0.1.34277: Flags [.], ack 68929, win 3586, options [nop,nop,TS val 2732188 ecr 2953229,nop,nop,sack 1 {70377:71825}], length 0
20:59:00.844431 IP 112.26.0.8.57358 > 112.26.0.1.34277: Flags [.], ack 67481, win 3496, options [nop,nop,TS val 2731994 ecr 2953229], length 0
20:59:00.849862 IP 112.26.0.1.34277 > 112.26.0.8.57358: Flags [.], seq 74721:76169, ack 1, win 227, options [nop,nop,TS val 2953450 ecr 2731484], length 1448
20:59:00.856046 IP 112.26.0.1.34277 > 112.26.0.8.57358: Flags [.], seq 71825:73273, ack 1, win 227, options [nop,nop,TS val 2953334 ecr 2731284], length 1448
20:59:00.858679 IP 112.26.0.8.57358 > 112.26.0.1.34277: Flags [.], ack 68929, win 3632, options [nop,nop,TS val 2732217 ecr 2953229,nop,nop,sack 1 {70377:73273}], length 0
20:59:00.922787 IP 112.26.0.1.34277 > 112.26.0.8.57358: Flags [.], seq 76169:77617, ack 1, win 227, options [nop,nop,TS val 2953450 ecr 2731484], length 1448
20:59:00.936637 IP 112.26.0.8.57358 > 112.26.0.1.34277: Flags [.], ack 68929, win 3541, options [nop,nop,TS val 2732032 ecr 2953229], length 0
20:59:00.947537 IP 112.26.0.1.34277 > 112.26.0.8.57358: Flags [.], seq 74721:76169, ack 1, win 227, options [nop,nop,TS val 2953450 ecr 2731484], length 1448
20:59:00.963940 IP 112.26.0.1.34277 > 112.26.0.8.57358: Flags [.], seq 77617:79065, ack 1, win 227, options [nop,nop,TS val 2953545 ecr 2731517], length 1448
20:59:01.019098 IP 112.26.0.8.57358 > 112.26.0.1.34277: Flags [.], ack 68929, win 3586, options [nop,nop,TS val 2732188 ecr 2953229,nop,nop,sack 1 {70377:71825}], length 0
20:59:01.022098 IP 112.26.0.8.57358 > 112.26.0.1.34277: Flags [.], ack 68929, win 3677, options [nop,nop,TS val 2732308 ecr 2953229,nop,nop,sack 2 {74721:76169}{70377:73273}], length 0
20:59:01.031993 IP 112.26.0.1.34277 > 112.26.0.8.57358: Flags [.], seq 76169:77617, ack 1, win 227, options [nop,nop,TS val 2953450 ecr 2731484], length 1448
20:59:01.051132 IP 112.26.0.1.34277 > 112.26.0.8.57358: Flags [.], seq 79065:80513, ack 1, win 227, options [nop,nop,TS val 2953569 ecr 2731604], length 1448
20:59:01.052602 IP 112.26.0.8.57358 > 112.26.0.1.34277: Flags [.], ack 68929, win 3722, options [nop,nop,TS val 2732392 ecr 2953229,nop,nop,sack 2 {74721:77617}{70377:73273}], length 0
20:59:01.054616 IP 112.26.0.8.57358 > 112.26.0.1.34277: Flags [.], ack 68929, win 3632, options [nop,nop,TS val 2732217 ecr 2953229,nop,nop,sack 1 {70377:73273}], length 0
20:59:01.074232 IP 112.26.0.8.57358 > 112.26.0.1.34277: Flags [.], ack 68929, win 3677, options [nop,nop,TS val 2732308 ecr 2953229,nop,nop,sack 2 {74721:76169}{70377:73273}], length 0
20:59:01.126964 IP 112.26.0.1.34277 > 112.26.0.8.57358: Flags [.], seq 80513:81961, ack 1, win 227, options [nop,nop,TS val 2953654 ecr 2731678], length 1448
20:59:01.136870 IP 112.26.0.8.57358 > 112.26.0.1.34277: Flags [.], ack 68929, win 3722, options [nop,nop,TS val 2732392 ecr 2953229,nop,nop,sack 2 {74721:77617}{70377:73273}], length 0
20:59:01.142907 IP 112.26.0.1.34277 > 112.26.0.8.57358: Flags [.], seq 77617:79065, ack 1, win 227, options [nop,nop,TS val 2953545 ecr 2731517], length 1448
20:59:01.145819 IP 112.26.0.8.57358 > 112.26.0.1.34277: Flags [.], ack 68929, win 3767, options [nop,nop,TS val 2732504 ecr 2953229,nop,nop,sack 2 {74721:79065}{70377:73273}], length 0
20:59:01.156098 IP 112.26.0.1.34277 > 112.26.0.8.57358: Flags [.], seq 81961:83409, ack 1, win 227, options [nop,nop,TS val 2953654 ecr 2731678], length 1448
20:59:01.216615 IP 112.26.0.8.57358 > 112.26.0.1.34277: Flags [.], ack 68929, win 3767, options [nop,nop,TS val 2732504 ecr 2953229,nop,nop,sack 2 {74721:79065}{70377:73273}], length 0
20:59:01.228119 IP 112.26.0.1.34277 > 112.26.0.8.57358: Flags [.], seq 79065:80513, ack 1, win 227, options [nop,nop,TS val 2953569 ecr 2731604], length 1448
20:59:01.234248 IP 112.26.0.8.57358 > 112.26.0.1.34277: Flags [.], ack 68929, win 3813, options [nop,nop,TS val 2732589 ecr 2953229,nop,nop,sack 2 {74721:80513}{70377:73273}], length 0
20:59:01.248365 IP 112.26.0.1.34277 > 112.26.0.8.57358: Flags [.], seq 84857:86305, ack 1, win 227, options [nop,nop,TS val 2953830 ecr 2731805], length 1448
20:59:01.248633 IP 112.26.0.1.34277 > 112.26.0.8.57358: Flags [.], seq 84857:86305, ack 1, win 227, options [nop,nop,TS val 2953830 ecr 2731805], length 1448
20:59:01.251825 IP 112.26.0.8.57358 > 112.26.0.1.34277: Flags [.], ack 68929, win 3813, options [nop,nop,TS val 2732589 ecr 2953229,nop,nop,sack 2 {74721:80513}{70377:73273}], length 0
20:59:01.258055 IP 112.26.0.8.57358 > 112.26.0.1.34277: Flags [.], ack 68929, win 3858, options [nop,nop,TS val 2732615 ecr 2953229,nop,nop,sack 3 {84857:86305}{74721:80513}{70377:73273}], length 0
20:59:01.270562 IP 112.26.0.1.34277 > 112.26.0.8.57358: Flags [.], seq 80513:81961, ack 1, win 227, options [nop,nop,TS val 2953654 ecr 2731678], length 1448
20:59:01.325405 IP 112.26.0.8.57358 > 112.26.0.1.34277: Flags [.], ack 68929, win 3858, options [nop,nop,TS val 2732615 ecr 2953229,nop,nop,sack 3 {84857:86305}{74721:80513}{70377:73273}], length 0
20:59:01.330377 IP 112.26.0.1.34277 > 112.26.0.8.57358: Flags [.], seq 86305:87753, ack 1, win 227, options [nop,nop,TS val 2953871 ecr 2731902], length 1448
20:59:01.330670 IP 112.26.0.1.34277 > 112.26.0.8.57358: Flags [.], seq 86305:87753, ack 1, win 227, options [nop,nop,TS val 2953871 ecr 2731902], length 1448
20:59:01.332874 IP 112.26.0.8.57358 > 112.26.0.1.34277: Flags [.], ack 68929, win 3903, options [nop,nop,TS val 2732631 ecr 2953229,nop,nop,sack 3 {74721:81961}{84857:86305}{70377:73273}], length 0
