20:58:56.380516 IP 112.26.0.8.57358 > 112.26.0.1.34277: Flags [S], seq 3611240214, win 65535, options [mss 1460,sackOK,TS val 2727727 ecr 0,nop,wscale 6], length 0
20:58:56.382177 IP 112.26.0.8.57358 > 112.26.0.1.34277: Flags [S], seq 3611240214, win 65535, options [mss 1460,sackOK,TS val 2727727 ecr 0,nop,wscale 6], length 0
20:58:56.400428 IP 112.26.0.8.57358 > 112.26.0.1.34277: Flags [S], seq 3611240214, win 65535, options [mss 1460,sackOK,TS val 2727727 ecr 0,nop,wscale 6], length 0
20:58:56.410563 IP 112.26.0.8.57358 > 112.26.0.1.34277: Flags [S], seq 3611240214, win 65535, options [mss 1460,sackOK,TS val 2727727 ecr 0,nop,wscale 6], length 0
20:58:56.488056 IP 112.26.0.8.57358 > 112.26.0.1.34277: Flags [S], seq 3611240214, win 65535, options [mss 1460,sackOK,TS val 2727727 ecr 0,nop,wscale 6], length 0
20:58:56.501659 IP 112.26.0.8.57358 > 112.26.0.1.34277: Flags [S], seq 3611240214, win 65535, options [mss 1460,sackOK,TS val 2727727 ecr 0,nop,wscale 6], length 0
20:58:56.601567 IP 112.26.0.8.57358 > 112.26.0.1.34277: Flags [S], seq 3611240214, win 65535, options [mss 1460,sackOK,TS val 2727727 ecr 0,nop,wscale 6], length 0
20:58:56.726019 IP 112.26.0.8.57358 > 112.26.0.1.34277: Flags [S], seq 3611240214, win 65535, options [mss 1460,sackOK,TS val 2727727 ecr 0,nop,wscale 6], length 0
20:58:56.827076 IP 112.26.0.1.34277 > 112.26.0.8.57358: Flags [S.], seq 2503003956, ack 3611240215, win 28960, options [mss 1460,sackOK,TS val 2950043 ecr 2727727,nop,wscale 7], length 0
20:58:56.996440 IP 112.26.0.8.57358 > 112.26.0.1.34277: Flags [.], ack 1, win 1369, options [nop,nop,TS val 2728354 ecr 2950043], length 0
20:58:56.999961 IP 112.26.0.8.57358 > 112.26.0.1.34277: Flags [.], ack 1, win 1369, options [nop,nop,TS val 2728354 ecr 2950043], length 0
20:58:57.007407 IP 112.26.0.1.34277 > 112.26.0.8.57358: Flags [.], seq 1:1449, ack 1, win 227, options [nop,nop,TS val 2950223 ecr 2728354], length 1448
20:58:57.028998 IP 112.26.0.1.34277 > 112.26.0.8.57358: Flags [.], seq 1449:2897, ack 1, win 227, options [nop,nop,TS val 2950223 ecr 2728354], length 1448
20:58:57.114263 IP 112.26.0.1.34277 > 112.26.0.8.57358: Flags [P.], seq 2897:4097, ack 1, win 227, options [nop,nop,TS val 2950223 ecr 2728354], length 1200
20:58:57.123289 IP 112.26.0.8.57358 > 112.26.0.1.34277: Flags [.], ack 1449, win 1414, options [nop,nop,TS val 2728479 ecr 2950223], length 0
20:58:57.128779 IP 112.26.0.8.57358 > 112.26.0.1.34277: Flags [.], ack 1449, win 1414, options [nop,nop,TS val 2728479 ecr 2950223], length 0
20:58:57.135274 IP 112.26.0.1.34277 > 112.26.0.8.57358: Flags [.], seq 4097:5545, ack 1, win 227, options [nop,nop,TS val 2950223 ecr 2728354], length 1448
20:58:57.213844 IP 112.26.0.1.34277 > 112.26.0.8.57358: Flags [.], seq 5545:6993, ack 1, win 227, options [nop,nop,TS val 2950223 ecr 2728354], length 1448
20:58:57.218596 IP 112.26.0.8.57358 > 112.26.0.1.34277: Flags [.], ack 2897, win 1460, options [nop,nop,TS val 2728562 ecr 2950223], length 0
20:58:57.290860 IP 112.26.0.8.57358 > 112.26.0.1.34277: Flags [.], ack 2897, win 1460, options [nop,nop,TS val 2728562 ecr 2950223], length 0
20:58:57.294097 IP 112.26.0.1.34277 > 112.26.0.8.57358: Flags [.], seq 6993:8441, ack 1, win 227, options [nop,nop,TS val 2950223 ecr 2728354], length 1448
20:58:57.300348 IP 112.26.0.8.57358 > 112.26.0.1.34277: Flags [.], ack 4097, win 1505, options [nop,nop,TS val 2728659 ecr 2950223], length 0
20:58:57.321965 IP 112.26.0.1.34277 > 112.26.0.8.57358: Flags [.], seq 8441:9889, ack 1, win 227, options [nop,nop,TS val 2950223 ecr 2728354], length 1448
20:58:57.324487 IP 112.26.0.8.57358 > 112.26.0.1.34277: Flags [.], ack 4097, win 1505, options [nop,nop,TS val 2728659 ecr 2950223], length 0
20:58:57.334614 IP 112.26.0.8.57358 > 112.26.0.1.34277: Flags [.], ack 5545, win 1550, options [nop,nop,TS val 2728692 ecr 2950223], length 0
20:58:57.402368 IP 112.26.0.8.57358 > 112.26.0.1.34277: Flags [.], ack 5545, win 1550, options [nop,nop,TS val 2728692 ecr 2950223], length 0
20:58:57.408244 IP 112.26.0.1.34277 > 112.26.0.8.57358: Flags [.], seq 9889:11337, ack 1, win 227, options [nop,nop,TS val 2950223 ecr 2728354], length 1448
20:58:57.421581 IP 112.26.0.8.57358 > 112.26.0.1.34277: Flags [.], ack 6993, win 1595, options [nop,nop,TS val 2728779 ecr 2950223], length 0
20:58:57.424496 IP 112.26.0.1.34277 > 112.26.0.8.57358: Flags [.], seq 5545:6993, ack 1, win 227, options [nop,nop,TS val 2950223 ecr 2728354], length 1448
20:58:57.441554 IP 112.26.0.1.34277 > 112.26.0.8.57358: Flags [.], seq 11337:12785, ack 1, win 227, options [nop,nop,TS val 2950224 ecr 2728354], length 1448
20:58:57.499134 IP 112.26.0.8.57358 > 112.26.0.1.34277: Flags [.], ack 6993, win 1595, options [nop,nop,TS val 2728779 ecr 2950223], length 0
20:58:57.505561 IP 112.26.0.1.34277 > 112.26.0.8.57358: Flags [.], seq 14233:15681, ack 1, win 227, options [nop,nop,TS val 2950346 ecr 2728479], length 1448
20:58:57.519333 IP 112.26.0.1.34277 > 112.26.0.8.57358: Flags [.], seq 6993:8441, ack 1, win 227, options [nop,nop,TS val 2950223 ecr 2728354], length 1448
20:58:57.521891 IP 112.26.0.8.57358 > 112.26.0.1.34277: Flags [.], ack 8441, win 1641, options [nop,nop,TS val 2728880 ecr 2950223], length 0
20:58:57.527250 IP 112.26.0.8.57358 > 112.26.0.1.34277: Flags [.], ack 8441, win 1641, options [nop,nop,TS val 2728880 ecr 2950223], length 0
20:58:57.603457 IP 112.26.0.1.34277 > 112.26.0.8.57358: Flags [.], seq 15681:17129, ack 1, win 227, options [nop,nop,TS val 2950346 ecr 2728479], length 1448
20:58:57.621277 IP 112.26.0.1.34277 > 112.26.0.8.57358: Flags [.], seq 17129:18577, ack 1, win 227, options [nop,nop,TS val 2950505 ecr 2728562], length 1448
20:58:57.629144 IP 112.26.0.1.34277 > 112.26.0.8.57358: Flags [.], seq 8441:9889, ack 1, win 227, options [nop,nop,TS val 2950223 ecr 2728354], length 1448
20:58:57.707113 IP 112.26.0.1.34277 > 112.26.0.8.57358: Flags [.], seq 18577:20025, ack 1, win 227, options [nop,nop,TS val 2950505 ecr 2728562], length 1448
20:58:57.719748 IP 112.26.0.1.34277 > 112.26.0.8.57358: Flags [.], seq 9889:11337, ack 1, win 227, options [nop,nop,TS val 2950223 ecr 2728354], length 1448
20:58:57.723720 IP 112.26.0.8.57358 > 112.26.0.1.34277: Flags [.], ack 9889, win 1686, options [nop,nop,TS val 2728989 ecr 2950223], length 0
20:58:57.727281 IP 112.26.0.8.57358 > 112.26.0.1.34277: Flags [.], ack 9889, win 1686, options [nop,nop,TS val 2728989 ecr 2950223], length 0
20:58:57.740648 IP 112.26.0.1.34277 > 112.26.0.8.57358: Flags [.], seq 20025:21473, ack 1, win 227, options [nop,nop,TS val 2950542 ecr 2728659], length 1448
20:58:57.801532 IP 112.26.0.1.34277 > 112.26.0.8.57358: Flags [.], seq 21473:22921, ack 1, win 227, options [nop,nop,TS val 2950542 ecr 2728659], length 1448
20:58:57.807106 IP 112.26.0.1.34277 > 112.26.0.8.57358: Flags [.], seq 11337:12785, ack 1, win 227, options [nop,nop,TS val 2950224 ecr 2728354], length 1448
20:58:57.835839 IP 112.26.0.1.34277 > 112.26.0.8.57358: Flags [.], seq 22921:24369, ack 1, win 227, options [nop,nop,TS val 2950620 ecr 2728692], length 1448
20:58:57.844921 IP 112.26.0.8.57358 > 112.26.0.1.34277: Flags [.], ack 11337, win 1731, options [nop,nop,TS val 2729080 ecr 2950223], length 0
20:58:57.906845 IP 112.26.0.1.34277 > 112.26.0.8.57358: Flags [.], seq 24369:25817, ack 1, win 227, options [nop,nop,TS val 2950620 ecr 2728692], length 1448
20:58:57.921272 IP 112.26.0.1.34277 > 112.26.0.8.57358: Flags [.], seq 14233:15681, ack 1, win 227, options [nop,nop,TS val 2950346 ecr 2728479], length 1448
20:58:57.927471 IP 112.26.0.1.34277 > 112.26.0.8.57358: Flags [.], seq 25817:27265, ack 1, win 227, options [nop,nop,TS val 2950716 ecr 2728779], length 1448
20:58:57.940066 IP 112.26.0.8.57358 > 112.26.0.1.34277: Flags [.], ack 12785, win 1776, options [nop,nop,TS val 2729167 ecr 2950224], length 0
20:58:57.995823 IP 112.26.0.1.34277 > 112.26.0.8.57358: Flags [.], seq 27265:28713, ack 1, win 227, options [nop,nop,TS val 2950716 ecr 2728779], length 1448
20:58:58.012410 IP 112.26.0.8.57358 > 112.26.0.1.34277: Flags [.], ack 12785, win 1822, options [nop,nop,TS val 2729274 ecr 2950224,nop,nop,sack 1 {14233:15681}], length 0
20:58:58.018240 IP 112.26.0.1.34277 > 112.26.0.8.57358: Flags [.], seq 15681:17129, ack 1, win 227, options [nop,nop,TS val 2950346 ecr 2728479], length 1448
20:58:58.026816 IP 112.26.0.1.34277 > 112.26.0.8.57358: Flags [.], seq 28713:30161, ack 1, win 227, options [nop,nop,TS val 2950745 ecr 2728880], length 1448
20:58:58.030583 IP 112.26.0.8.57358 > 112.26.0.1.34277: Flags [.], ack 11337, win 1731, options [nop,nop,TS val 2729080 ecr 2950223], length 0
20:58:58.040585 IP 112.26.0.8.57358 > 112.26.0.1.34277: Flags [.], ack 12785, win 1867, options [nop,nop,TS val 2729379 ecr 2950224,nop,nop,sack 1 {14233:17129}], length 0
20:58:58.110260 IP 112.26.0.1.34277 > 112.26.0.8.57358: Flags [.], seq 17129:18577, ack 1, win 227, options [nop,nop,TS val 2950505 ecr 2728562], length 1448
20:58:58.111068 IP 112.26.0.1.34277 > 112.26.0.8.57358: Flags [.], seq 31609:33057, ack 1, win 227, options [nop,nop,TS val 2950945 ecr 2728989], length 1448
20:58:58.132455 IP 112.26.0.1.34277 > 112.26.0.8.57358: Flags [.], seq 33057:34505, ack 1, win 227, options [nop,nop,TS val 2950945 ecr 2728989], length 1448
20:58:58.133258 IP 112.26.0.8.57358 > 112.26.0.1.34277: Flags [.], ack 12785, win 1912, options [nop,nop,TS val 2729463 ecr 2950224,nop,nop,sack 1 {14233:18577}], length 0
20:58:58.140586 IP 112.26.0.1.34277 > 112.26.0.8.57358: Flags [.], seq 18577:20025, ack 1, win 227, options [nop,nop,TS val 2950505 ecr 2728562], length 1448
20:58:58.146667 IP 112.26.0.8.57358 > 112.26.0.1.34277: Flags [.], ack 12785, win 1776, options [nop,nop,TS val 2729167 ecr 2950224], length 0
20:58:58.190563 IP 112.26.0.8.57358 > 112.26.0.1.34277: Flags [.], ack 12785, win 1957, options [nop,nop,TS val 2729500 ecr 2950224,nop,nop,sack 1 {14233:20025}], length 0
20:58:58.213023 IP 112.26.0.1.34277 > 112.26.0.8.57358: Flags [.], seq 20025:21473, ack 1, win 227, options [nop,nop,TS val 2950542 ecr 2728659], length 1448
20:58:58.215288 IP 112.26.0.8.57358 > 112.26.0.1.34277: Flags [.], ack 12785, win 2003, options [nop,nop,TS val 2729573 ecr 2950224,nop,nop,sack 1 {14233:21473}], length 0
20:58:58.229469 IP 112.26.0.1.34277 > 112.26.0.8.57358: Flags [.], seq 34505:35953, ack 1, win 227, options [nop,nop,TS val 2951248 ecr 2729080], length 1448
20:58:58.239511 IP 112.26.0.8.57358 > 112.26.0.1.34277: Flags [.], ack 12785, win 1822, options [nop,nop,TS val 2729274 ecr 2950224,nop,nop,sack 1 {14233:15681}], length 0
20:58:58.290625 IP 112.26.0.8.57358 > 112.26.0.1.34277: Flags [.], ack 12785, win 2048, options [nop,nop,TS val 2729603 ecr 2950224,nop,nop,sack 1 {14233:22921}], length 0
20:58:58.292945 IP 112.26.0.1.34277 > 112.26.0.8.57358: Flags [.], seq 21473:22921, ack 1, win 227, options [nop,nop,TS val 2950542 ecr 2728659], length 1448
20:58:58.305186 IP 112.26.0.1.34277 > 112.26.0.8.57358: Flags [.], seq 35953:37401, ack 1, win 227, options [nop,nop,TS val 2951248 ecr 2729080], length 1448
20:58:58.315016 IP 112.26.0.1.34277 > 112.26.0.8.57358: Flags [.], seq 22921:24369, ack 1, win 227, options [nop,nop,TS val 2950620 ecr 2728692], length 1448
20:58:58.320483 IP 112.26.0.8.57358 > 112.26.0.1.34277: Flags [.], ack 12785, win 2093, options [nop,nop,TS val 2729675 ecr 2950224,nop,nop,sack 1 {14233:24369}], length 0
20:58:58.328685 IP 112.26.0.1.34277 > 112.26.0.8.57358: Flags [.], seq 37401:38849, ack 1, win 227, options [nop,nop,TS val 2951364 ecr 2729167], length 1448
20:58:58.333264 IP 112.26.0.8.57358 > 112.26.0.1.34277: Flags [.], ack 12785, win 1867, options [nop,nop,TS val 2729379 ecr 2950224,nop,nop,sack 1 {14233:17129}], length 0
20:58:58.400332 IP 112.26.0.1.34277 > 112.26.0.8.57358: Flags [.], seq 24369:25817, ack 1, win 227, options [nop,nop,TS val 2950620 ecr 2728692], length 1448
20:58:58.403891 IP 112.26.0.8.57358 > 112.26.0.1.34277: Flags [.], ack 12785, win 2138, options [nop,nop,TS val 2729760 ecr 2950224,nop,nop,sack 1 {14233:25817}], length 0
20:58:58.408424 IP 112.26.0.1.34277 > 112.26.0.8.57358: Flags [.], seq 38849:40297, ack 1, win 227, options [nop,nop,TS val 2951364 ecr 2729167], length 1448
20:58:58.420847 IP 112.26.0.8.57358 > 112.26.0.1.34277: Flags [.], ack 12785, win 1912, options [nop,nop,TS val 2729463 ecr 2950224,nop,nop,sack 1 {14233:18577}], length 0
20:58:58.426426 IP 112.26.0.1.34277 > 112.26.0.8.57358: Flags [.], seq 40297:41745, ack 1, win 227, options [nop,nop,TS val 2951457 ecr 2729274], length 1448
20:58:58.498705 IP 112.26.0.1.34277 > 112.26.0.8.57358: Flags [.], seq 27265:28713, ack 1, win 227, options [nop,nop,TS val 2950716 ecr 2728779], length 1448
20:58:58.502540 IP 112.26.0.1.34277 > 112.26.0.8.57358: Flags [.], seq 41745:43193, ack 1, win 227, options [nop,nop,TS val 2951551 ecr 2729379], length 1448
20:58:58.505737 IP 112.26.0.8.57358 > 112.26.0.1.34277: Flags [.], ack 12785, win 2184, options [nop,nop,TS val 2729797 ecr 2950224,nop,nop,sack 2 {27265:28713}{14233:25817}], length 0
20:58:58.509082 IP 112.26.0.8.57358 > 112.26.0.1.34277: Flags [.], ack 12785, win 1957, options [nop,nop,TS val 2729500 ecr 2950224,nop,nop,sack 1 {14233:20025}], length 0
20:58:58.515584 IP 112.26.0.1.34277 > 112.26.0.8.57358: Flags [.], seq 12785:14233, ack 1, win 227, options [nop,nop,TS val 2951638 ecr 2729463], length 1448
20:58:58.524086 IP 112.26.0.1.34277 > 112.26.0.8.57358: Flags [.], seq 28713:30161, ack 1, win 227, options [nop,nop,TS val 2950745 ecr 2728880], length 1448
20:58:58.539078 IP 112.26.0.8.57358 > 112.26.0.1.34277: Flags [.], ack 12785, win 2229, options [nop,nop,TS val 2729882 ecr 2950224,nop,nop,sack 2 {27265:30161}{14233:25817}], length 0
20:58:58.543901 IP 112.26.0.1.34277 > 112.26.0.8.57358: Flags [.], seq 43193:44641, ack 1, win 227, options [nop,nop,TS val 2951726 ecr 2729500], length 1448
20:58:58.604202 IP 112.26.0.8.57358 > 112.26.0.1.34277: Flags [.], ack 12785, win 2003, options [nop,nop,TS val 2729573 ecr 2950224,nop,nop,sack 1 {14233:21473}], length 0
20:58:58.614278 IP 112.26.0.1.34277 > 112.26.0.8.57358: Flags [.], seq 31609:33057, ack 1, win 227, options [nop,nop,TS val 2950945 ecr 2728989], length 1448
20:58:58.631515 IP 112.26.0.8.57358 > 112.26.0.1.34277: Flags [.], ack 12785, win 2274, options [nop,nop,TS val 2729969 ecr 2950224,nop,nop,sack 3 {31609:33057}{27265:30161}{14233:25817}], length 0
20:58:58.639570 IP 112.26.0.1.34277 > 112.26.0.8.57358: Flags [.], seq 44641:46089, ack 1, win 227, options [nop,nop,TS val 2951822 ecr 2729573], length 1448
20:58:58.645340 IP 112.26.0.8.57358 > 112.26.0.1.34277: Flags [.], ack 12785, win 2048, options [nop,nop,TS val 2729603 ecr 2950224,nop,nop,sack 1 {14233:22921}], length 0
20:58:58.655136 IP 112.26.0.1.34277 > 112.26.0.8.57358: Flags [.], seq 34505:35953, ack 1, win 227, options [nop,nop,TS val 2951248 ecr 2729080], length 1448
20:58:58.706066 IP 112.26.0.8.57358 > 112.26.0.1.34277: Flags [.], ack 12785, win 2319, options [nop,nop,TS val 2730011 ecr 2950224,nop,nop,sack 3 {34505:35953}{31609:33057}{27265:30161}], length 0
20:58:58.713816 IP 112.26.0.8.57358 > 112.26.0.1.34277: Flags [.], ack 12785, win 2093, options [nop,nop,TS val 2729675 ecr 2950224,nop,nop,sack 1 {14233:24369}], length 0
20:58:58.715069 IP 112.26.0.1.34277 > 112.26.0.8.57358: Flags [.], seq 46089:47537, ack 1, win 227, options [nop,nop,TS val 2951931 ecr 2729675], length 1448
20:58:58.731587 IP 112.26.0.8.57358 > 112.26.0.1.34277: Flags [.], ack 12785, win 2138, options [nop,nop,TS val 2729760 ecr 2950224,nop,nop,sack 1 {14233:25817}], length 0
20:58:58.732858 IP 112.26.0.1.34277 > 112.26.0.8.57358: Flags [.], seq 47537:48985, ack 1, win 227, options [nop,nop,TS val 2951949 ecr 2729760], length 1448
20:58:58.803129 IP 112.26.0.1.34277 > 112.26.0.8.57358: Flags [.], seq 37401:38849, ack 1, win 227, options [nop,nop,TS val 2951364 ecr 2729167], length 1448
20:58:58.807361 IP 112.26.0.8.57358 > 112.26.0.1.34277: Flags [.], ack 12785, win 2365, options [nop,nop,TS val 2730164 ecr 2950224,nop,nop,sack 3 {37401:38849}{34505:35953}{31609:33057}], length 0
20:58:58.829979 IP 112.26.0.8.57358 > 112.26.0.1.34277: Flags [.], ack 12785, win 2184, options [nop,nop,TS val 2729797 ecr 2950224,nop,nop,sack 2 {27265:28713}{14233:25817}], length 0
20:58:58.836465 IP 112.26.0.1.34277 > 112.26.0.8.57358: Flags [.], seq 38849:40297, ack 1, win 227, options [nop,nop,TS val 2951364 ecr 2729167], length 1448
20:58:58.839321 IP 112.26.0.8.57358 > 112.26.0.1.34277: Flags [.], ack 12785, win 2410, options [nop,nop,TS val 2730197 ecr 2950224,nop,nop,sack 3 {37401:40297}{34505:35953}{31609:33057}], length 0
20:58:58.918025 IP 112.26.0.8.57358 > 112.26.0.1.34277: Flags [.], ack 12785, win 2229, options [nop,nop,TS val 2729882 ecr 2950224,nop,nop,sack 2 {27265:30161}{14233:25817}], length 0
20:58:58.919285 IP 112.26.0.1.34277 > 112.26.0.8.57358: Flags [.], seq 25817:27265, ack 1, win 227, options [nop,nop,TS val 2952135 ecr 2729882], length 1448
20:58:58.930353 IP 112.26.0.1.34277 > 112.26.0.8.57358: Flags [.], seq 40297:41745, ack 1, win 227, options [nop,nop,TS val 2951457 ecr 2729274], length 1448
20:58:58.935190 IP 112.26.0.8.57358 > 112.26.0.1.34277: Flags [.], ack 12785, win 2455, options [nop,nop,TS val 2730291 ecr 2950224,nop,nop,sack 3 {37401:41745}{34505:35953}{31609:33057}], length 0
20:58:58.944402 IP 112.26.0.8.57358 > 112.26.0.1.34277: Flags [.], ack 12785, win 2274, options [nop,nop,TS val 2729969 ecr 2950224,nop,nop,sack 3 {31609:33057}{27265:30161}{14233:25817}], length 0
20:58:59.008045 IP 112.26.0.1.34277 > 112.26.0.8.57358: Flags [.], seq 41745:43193, ack 1, win 227, options [nop,nop,TS val 2951551 ecr 2729379], length 1448
20:58:59.015343 IP 112.26.0.8.57358 > 112.26.0.1.34277: Flags [.], ack 12785, win 2500, options [nop,nop,TS val 2730369 ecr 2950224,nop,nop,sack 3 {37401:43193}{34505:35953}{31609:33057}], length 0
20:58:59.019381 IP 112.26.0.8.57358 > 112.26.0.1.34277: Flags [.], ack 12785, win 2319, options [nop,nop,TS val 2730011 ecr 2950224,nop,nop,sack 3 {34505:35953}{31609:33057}{27265:30161}], length 0
20:58:59.020646 IP 112.26.0.1.34277 > 112.26.0.8.57358: Flags [.], seq 30161:31609, ack 1, win 227, options [nop,nop,TS val 2952237 ecr 2730011], length 1448
20:58:59.034806 IP 112.26.0.1.34277 > 112.26.0.8.57358: Flags [.], seq 43193:44641, ack 1, win 227, options [nop,nop,TS val 2951726 ecr 2729500], length 1448
20:58:59.046655 IP 112.26.0.8.57358 > 112.26.0.1.34277: Flags [.], ack 12785, win 2365, options [nop,nop,TS val 2730164 ecr 2950224,nop,nop,sack 3 {37401:38849}{34505:35953}{31609:33057}], length 0
20:58:59.097901 IP 112.26.0.8.57358 > 112.26.0.1.34277: Flags [.], ack 12785, win 2546, options [nop,nop,TS val 2730395 ecr 2950224,nop,nop,sack 3 {37401:44641}{34505:35953}{31609:33057}], length 0
20:58:59.108873 IP 112.26.0.1.34277 > 112.26.0.8.57358: Flags [.], seq 33057:34505, ack 1, win 227, options [nop,nop,TS val 2952264 ecr 2730164], length 1448
20:58:59.117188 IP 112.26.0.1.34277 > 112.26.0.8.57358: Flags [.], seq 44641:46089, ack 1, win 227, options [nop,nop,TS val 2951822 ecr 2729573], length 1448
20:58:59.139858 IP 112.26.0.8.57358 > 112.26.0.1.34277: Flags [.], ack 12785, win 2591, options [nop,nop,TS val 2730478 ecr 2950224,nop,nop,sack 3 {37401:46089}{34505:35953}{31609:33057}], length 0
20:58:59.200168 IP 112.26.0.8.57358 > 112.26.0.1.34277: Flags [.], ack 12785, win 2410, options [nop,nop,TS val 2730197 ecr 2950224,nop,nop,sack 3 {37401:40297}{34505:35953}{31609:33057}], length 0
20:58:59.201885 IP 112.26.0.1.34277 > 112.26.0.8.57358: Flags [.], seq 35953:37401, ack 1, win 227, options [nop,nop,TS val 2952417 ecr 2730197], length 1448
20:58:59.212508 IP 112.26.0.1.34277 > 112.26.0.8.57358: Flags [.], seq 46089:47537, ack 1, win 227, options [nop,nop,TS val 2951931 ecr 2729675], length 1448
20:58:59.218761 IP 112.26.0.8.57358 > 112.26.0.1.34277: Flags [.], ack 12785, win 2636, options [nop,nop,TS val 2730573 ecr 2950224,nop,nop,sack 3 {37401:47537}{34505:35953}{31609:33057}], length 0
20:58:59.238111 IP 112.26.0.8.57358 > 112.26.0.1.34277: Flags [.], ack 12785, win 2455, options [nop,nop,TS val 2730291 ecr 2950224,nop,nop,sack 3 {37401:41745}{34505:35953}{31609:33057}], length 0
20:58:59.239405 IP 112.26.0.1.34277 > 112.26.0.8.57358: Flags [.], seq 48985:50433, ack 1, win 227, options [nop,nop,TS val 2952455 ecr 2730291], length 1448
20:58:59.245429 IP 112.26.0.1.34277 > 112.26.0.8.57358: Flags [.], seq 47537:48985, ack 1, win 227, options [nop,nop,TS val 2951949 ecr 2729760], length 1448
20:58:59.248201 IP 112.26.0.8.57358 > 112.26.0.1.34277: Flags [.], ack 12785, win 2681, options [nop,nop,TS val 2730604 ecr 2950224,nop,nop,sack 3 {37401:48985}{34505:35953}{31609:33057}], length 0
20:58:59.310159 IP 112.26.0.1.34277 > 112.26.0.8.57358: Flags [.], seq 25817:27265, ack 1, win 227, options [nop,nop,TS val 2952135 ecr 2729882], length 1448
20:58:59.315901 IP 112.26.0.8.57358 > 112.26.0.1.34277: Flags [.], ack 12785, win 2500, options [nop,nop,TS val 2730369 ecr 2950224,nop,nop,sack 3 {37401:43193}{34505:35953}{31609:33057}], length 0
20:58:59.323400 IP 112.26.0.1.34277 > 112.26.0.8.57358: Flags [.], seq 50433:51881, ack 1, win 227, options [nop,nop,TS val 2952533 ecr 2730369], length 1448
20:58:59.324031 IP 112.26.0.8.57358 > 112.26.0.1.34277: Flags [.], ack 12785, win 2727, options [nop,nop,TS val 2730670 ecr 2950224,nop,nop,sack 3 {25817:30161}{37401:48985}{34505:35953}], length 0
20:58:59.339337 IP 112.26.0.1.34277 > 112.26.0.8.57358: Flags [.], seq 30161:31609, ack 1, win 227, options [nop,nop,TS val 2952237 ecr 2730011], length 1448
20:58:59.403550 IP 112.26.0.8.57358 > 112.26.0.1.34277: Flags [.], ack 12785, win 2546, options [nop,nop,TS val 2730395 ecr 2950224,nop,nop,sack 3 {37401:44641}{34505:35953}{31609:33057}], length 0
20:58:59.412377 IP 112.26.0.8.57358 > 112.26.0.1.34277: Flags [.], ack 12785, win 2772, options [nop,nop,TS val 2730700 ecr 2950224,nop,nop,sack 3 {25817:33057}{37401:48985}{34505:35953}], length 0
20:58:59.414446 IP 112.26.0.8.57358 > 112.26.0.1.34277: Flags [.], ack 12785, win 2591, options [nop,nop,TS val 2730478 ecr 2950224,nop,nop,sack 3 {37401:46089}{34505:35953}{31609:33057}], length 0
20:58:59.421446 IP 112.26.0.1.34277 > 112.26.0.8.57358: Flags [.], seq 12785:14233, ack 1, win 227, options [nop,nop,TS val 2952621 ecr 2730395], length 1448
20:58:59.436191 IP 112.26.0.8.57358 > 112.26.0.1.34277: Flags [.], ack 12785, win 2817, options [nop,nop,TS val 2730794 ecr 2950224,nop,nop,sack 2 {25817:35953}{37401:48985}], length 0
20:58:59.446871 IP 112.26.0.1.34277 > 112.26.0.8.57358: Flags [.], seq 33057:34505, ack 1, win 227, options [nop,nop,TS val 2952264 ecr 2730164], length 1448
20:58:59.496967 IP 112.26.0.1.34277 > 112.26.0.8.57358: Flags [.], seq 51881:53329, ack 1, win 227, options [nop,nop,TS val 2952631 ecr 2730478], length 1448
20:58:59.502406 IP 112.26.0.8.57358 > 112.26.0.1.34277: Flags [.], ack 12785, win 2636, options [nop,nop,TS val 2730573 ecr 2950224,nop,nop,sack 3 {37401:47537}{34505:35953}{31609:33057}], length 0
20:58:59.505388 IP 112.26.0.1.34277 > 112.26.0.8.57358: Flags [P.], seq 53329:54777, ack 1, win 227, options [nop,nop,TS val 2952719 ecr 2730573], length 1448
20:58:59.520717 IP 112.26.0.8.57358 > 112.26.0.1.34277: Flags [.], ack 12785, win 2681, options [nop,nop,TS val 2730604 ecr 2950224,nop,nop,sack 3 {37401:48985}{34505:35953}{31609:33057}], length 0
20:58:59.610781 IP 112.26.0.1.34277 > 112.26.0.8.57358: Flags [.], seq 35953:37401, ack 1, win 227, options [nop,nop,TS val 2952417 ecr 2730197], length 1448
20:58:59.614000 IP 112.26.0.8.57358 > 112.26.0.1.34277: Flags [.], ack 12785, win 2862, options [nop,nop,TS val 2730971 ecr 2950224,nop,nop,sack 1 {25817:48985}], length 0
20:58:59.625656 IP 112.26.0.8.57358 > 112.26.0.1.34277: Flags [.], ack 12785, win 2727, options [nop,nop,TS val 2730670 ecr 2950224,nop,nop,sack 3 {25817:30161}{37401:48985}{34505:35953}], length 0
20:58:59.703247 IP 112.26.0.8.57358 > 112.26.0.1.34277: Flags [.], ack 12785, win 2772, options [nop,nop,TS val 2730700 ecr 2950224,nop,nop,sack 3 {25817:33057}{37401:48985}{34505:35953}], length 0
20:58:59.712429 IP 112.26.0.1.34277 > 112.26.0.8.57358: Flags [.], seq 48985:50433, ack 1, win 227, options [nop,nop,TS val 2952455 ecr 2730291], length 1448
20:58:59.719706 IP 112.26.0.8.57358 > 112.26.0.1.34277: Flags [.], ack 12785, win 2908, options [nop,nop,TS val 2731073 ecr 2950224,nop,nop,sack 1 {25817:50433}], length 0
20:58:59.735366 IP 112.26.0.8.57358 > 112.26.0.1.34277: Flags [.], ack 12785, win 2817, options [nop,nop,TS val 2730794 ecr 2950224,nop,nop,sack 2 {25817:35953}{37401:48985}], length 0
20:58:59.742562 IP 112.26.0.1.34277 > 112.26.0.8.57358: Flags [.], seq 50433:51881, ack 1, win 227, options [nop,nop,TS val 2952533 ecr 2730369], length 1448
20:58:59.746015 IP 112.26.0.8.57358 > 112.26.0.1.34277: Flags [.], ack 12785, win 2953, options [nop,nop,TS val 2731103 ecr 2950224,nop,nop,sack 1 {25817:51881}], length 0
20:58:59.815515 IP 112.26.0.8.57358 > 112.26.0.1.34277: Flags [.], ack 12785, win 2862, options [nop,nop,TS val 2730971 ecr 2950224,nop,nop,sack 1 {25817:48985}], length 0
20:58:59.819702 IP 112.26.0.1.34277 > 112.26.0.8.57358: Flags [.], seq 12785:14233, ack 1, win 227, options [nop,nop,TS val 2952621 ecr 2730395], length 1448
20:58:59.823837 IP 112.26.0.8.57358 > 112.26.0.1.34277: Flags [.], ack 51881, win 2998, options [nop,nop,TS val 2731180 ecr 2952621], length 0
20:58:59.843657 IP 112.26.0.1.34277 > 112.26.0.8.57358: Flags [.], seq 51881:53329, ack 1, win 227, options [nop,nop,TS val 2952631 ecr 2730478], length 1448
20:58:59.851821 IP 112.26.0.8.57358 > 112.26.0.1.34277: Flags [.], ack 53329, win 3043, options [nop,nop,TS val 2731204 ecr 2952631], length 0
20:58:59.853464 IP 112.26.0.8.57358 > 112.26.0.1.34277: Flags [.], ack 12785, win 2908, options [nop,nop,TS val 2731073 ecr 2950224,nop,nop,sack 1 {25817:50433}], length 0
20:58:59.923344 IP 112.26.0.1.34277 > 112.26.0.8.57358: Flags [P.], seq 53329:54777, ack 1, win 227, options [nop,nop,TS val 2952719 ecr 2730573], length 1448
20:58:59.931209 IP 112.26.0.8.57358 > 112.26.0.1.34277: Flags [.], ack 12785, win 2953, options [nop,nop,TS val 2731103 ecr 2950224,nop,nop,sack 1 {25817:51881}], length 0
20:58:59.934601 IP 112.26.0.8.57358 > 112.26.0.1.34277: Flags [.], ack 54777, win 3089, options [nop,nop,TS val 2731284 ecr 2952719], length 0
20:59:00.010570 IP 112.26.0.8.57358 > 112.26.0.1.34277: Flags [.], ack 51881, win 2998, options [nop,nop,TS val 2731180 ecr 2952621], length 0
20:59:00.013645 IP 112.26.0.1.34277 > 112.26.0.8.57358: Flags [.], seq 54777:56225, ack 1, win 227, options [nop,nop,TS val 2953228 ecr 2731180], length 1448
20:59:00.030018 IP 112.26.0.1.34277 > 112.26.0.8.57358: Flags [.], seq 54777:56225, ack 1, win 227, options [nop,nop,TS val 2953228 ecr 2731180], length 1448
20:59:00.032078 IP 112.26.0.8.57358 > 112.26.0.1.34277: Flags [.], ack 56225, win 3134, options [nop,nop,TS val 2731390 ecr 2953228], length 0
20:59:00.041789 IP 112.26.0.1.34277 > 112.26.0.8.57358: Flags [P.], seq 56225:57345, ack 1, win 227, options [nop,nop,TS val 2953228 ecr 2731180], length 1120
20:59:00.045611 IP 112.26.0.8.57358 > 112.26.0.1.34277: Flags [.], ack 53329, win 3043, options [nop,nop,TS val 2731204 ecr 2952631], length 0
20:59:00.111532 IP 112.26.0.1.34277 > 112.26.0.8.57358: Flags [.], seq 57345:58793, ack 1, win 227, options [nop,nop,TS val 2953228 ecr 2731180], length 1448
20:59:00.117175 IP 112.26.0.8.57358 > 112.26.0.1.34277: Flags [.], ack 54777, win 3089, options [nop,nop,TS val 2731284 ecr 2952719], length 0
20:59:00.123013 IP 112.26.0.1.34277 > 112.26.0.8.57358: Flags [P.], seq 56225:57345, ack 1, win 227, options [nop,nop,TS val 2953228 ecr 2731180], length 1120
20:59:00.126709 IP 112.26.0.8.57358 > 112.26.0.1.34277: Flags [.], ack 57345, win 3179, options [nop,nop,TS val 2731484 ecr 2953228], length 0
20:59:00.144680 IP 112.26.0.1.34277 > 112.26.0.8.57358: Flags [.], seq 58793:60241, ack 1, win 227, options [nop,nop,TS val 2953228 ecr 2731180], length 1448
20:59:00.148543 IP 112.26.0.8.57358 > 112.26.0.1.34277: Flags [.], ack 56225, win 3134, options [nop,nop,TS val 2731390 ecr 2953228], length 0
20:59:00.156308 IP 112.26.0.1.34277 > 112.26.0.8.57358: Flags [.], seq 57345:58793, ack 1, win 227, options [nop,nop,TS val 2953228 ecr 2731180], length 1448
20:59:00.212542 IP 112.26.0.8.57358 > 112.26.0.1.34277: Flags [.], ack 58793, win 3224, options [nop,nop,TS val 2731517 ecr 2953228], length 0
20:59:00.223616 IP 112.26.0.1.34277 > 112.26.0.8.57358: Flags [.], seq 60241:61689, ack 1, win 227, options [nop,nop,TS val 2953229 ecr 2731180], length 1448
20:59:00.232529 IP 112.26.0.8.57358 > 112.26.0.1.34277: Flags [.], ack 57345, win 3179, options [nop,nop,TS val 2731484 ecr 2953228], length 0
20:59:00.245132 IP 112.26.0.8.57358 > 112.26.0.1.34277: Flags [.], ack 60241, win 3270, options [nop,nop,TS val 2731604 ecr 2953228], length 0
20:59:00.257339 IP 112.26.0.1.34277 > 112.26.0.8.57358: Flags [.], seq 61689:63137, ack 1, win 227, options [nop,nop,TS val 2953229 ecr 2731180], length 1448
20:59:00.311595 IP 112.26.0.1.34277 > 112.26.0.8.57358: Flags [.], seq 58793:60241, ack 1, win 227, options [nop,nop,TS val 2953228 ecr 2731180], length 1448
20:59:00.317034 IP 112.26.0.1.34277 > 112.26.0.8.57358: Flags [.], seq 60241:61689, ack 1, win 227, options [nop,nop,TS val 2953229 ecr 2731180], length 1448
20:59:00.323870 IP 112.26.0.1.34277 > 112.26.0.8.57358: Flags [.], seq 63137:64585, ack 1, win 227, options [nop,nop,TS val 2953229 ecr 2731180], length 1448
20:59:00.327817 IP 112.26.0.8.57358 > 112.26.0.1.34277: Flags [.], ack 58793, win 3224, options [nop,nop,TS val 2731517 ecr 2953228], length 0
20:59:00.332391 IP 112.26.0.8.57358 > 112.26.0.1.34277: Flags [.], ack 61689, win 3315, options [nop,nop,TS val 2731678 ecr 2953229], length 0
20:59:00.345227 IP 112.26.0.1.34277 > 112.26.0.8.57358: Flags [.], seq 64585:66033, ack 1, win 227, options [nop,nop,TS val 2953229 ecr 2731180], length 1448
20:59:00.351652 IP 112.26.0.8.57358 > 112.26.0.1.34277: Flags [.], ack 60241, win 3270, options [nop,nop,TS val 2731604 ecr 2953228], length 0
20:59:00.405148 IP 112.26.0.1.34277 > 112.26.0.8.57358: Flags [.], seq 61689:63137, ack 1, win 227, options [nop,nop,TS val 2953229 ecr 2731180], length 1448
20:59:00.433460 IP 112.26.0.8.57358 > 112.26.0.1.34277: Flags [.], ack 63137, win 3360, options [nop,nop,TS val 2731766 ecr 2953229], length 0
20:59:00.436730 IP 112.26.0.8.57358 > 112.26.0.1.34277: Flags [.], ack 61689, win 3315, options [nop,nop,TS val 2731678 ecr 2953229], length 0
20:59:00.451016 IP 112.26.0.1.34277 > 112.26.0.8.57358: Flags [.], seq 63137:64585, ack 1, win 227, options [nop,nop,TS val 2953229 ecr 2731180], length 1448
20:59:00.507852 IP 112.26.0.8.57358 > 112.26.0.1.34277: Flags [.], ack 64585, win 3405, options [nop,nop,TS val 2731805 ecr 2953229], length 0
20:59:00.513764 IP 112.26.0.1.34277 > 112.26.0.8.57358: Flags [.], seq 67481:68929, ack 1, win 227, options [nop,nop,TS val 2953229 ecr 2731180], length 1448
20:59:00.526116 IP 112.26.0.8.57358 > 112.26.0.1.34277: Flags [.], ack 63137, win 3360, options [nop,nop,TS val 2731766 ecr 2953229], length 0
20:59:00.544790 IP 112.26.0.1.34277 > 112.26.0.8.57358: Flags [.], seq 64585:66033, ack 1, win 227, options [nop,nop,TS val 2953229 ecr 2731180], length 1448
20:59:00.555019 IP 112.26.0.1.34277 > 112.26.0.8.57358: Flags [.], seq 70377:71825, ack 1, win 227, options [nop,nop,TS val 2953263 ecr 2731204], length 1448
20:59:00.555838 IP 112.26.0.8.57358 > 112.26.0.1.34277: Flags [.], ack 66033, win 3451, options [nop,nop,TS val 2731902 ecr 2953229], length 0
20:59:00.613257 IP 112.26.0.8.57358 > 112.26.0.1.34277: Flags [.], ack 64585, win 3405, options [nop,nop,TS val 2731805 ecr 2953229], length 0
20:59:00.619390 IP 112.26.0.1.34277 > 112.26.0.8.57358: Flags [.], seq 71825:73273, ack 1, win 227, options [nop,nop,TS val 2953334 ecr 2731284], length 1448
20:59:00.633369 IP 112.26.0.1.34277 > 112.26.0.8.57358: Flags [.], seq 66033:67481, ack 1, win 227, options [nop,nop,TS val 2953229 ecr 2731180], length 1448
20:59:00.653589 IP 112.26.0.8.57358 > 112.26.0.1.34277: Flags [.], ack 66033, win 3451, options [nop,nop,TS val 2731902 ecr 2953229], length 0
20:59:00.662111 IP 112.26.0.1.34277 > 112.26.0.8.57358: Flags [.], seq 74721:76169, ack 1, win 227, options [nop,nop,TS val 2953450 ecr 2731484], length 1448
20:59:00.673106 IP 112.26.0.1.34277 > 112.26.0.8.57358: Flags [.], seq 67481:68929, ack 1, win 227, options [nop,nop,TS val 2953229 ecr 2731180], length 1448
20:59:00.717463 IP 112.26.0.8.57358 > 112.26.0.1.34277: Flags [.], ack 67481, win 3496, options [nop,nop,TS val 2731994 ecr 2953229], length 0
20:59:00.731030 IP 112.26.0.1.34277 > 112.26.0.8.57358: Flags [.], seq 76169:77617, ack 1, win 227, options [nop,nop,TS val 2953450 ecr 2731484], length 1448
20:59:00.754650 IP 112.26.0.8.57358 > 112.26.0.1.34277: Flags [.], ack 68929, win 3541, options [nop,nop,TS val 2732032 ecr 2953229], length 0
20:59:00.770019 IP 112.26.0.1.34277 > 112.26.0.8.57358: Flags [.], seq 77617:79065, ack 1, win 227, options [nop,nop,TS val 2953545 ecr 2731517], length 1448
20:59:00.832672 IP 112.26.0.8.57358 > 112.26.0.1.34277: Flags [.], ack 68929, win 3586, options [nop,nop,TS val 2732188 ecr 2953229,nop,nop,sack 1 {70377:71825}], length 0
20:59:00.840458 IP 112.26.0.1.34277 > 112.26.0.8.57358: Flags [.], seq 79065:80513, ack 1, win 227, options [nop,nop,TS val 2953569 ecr 2731604], length 1448
20:59:00.841443 IP 112.26.0.1.34277 > 112.26.0.8.57358: Flags [.], seq 70377:71825, ack 1, win 227, options [nop,nop,TS val 2953263 ecr 2731204], length 1448
20:59:00.843866 IP 112.26.0.8.57358 > 112.26.0.1.34277: Flags [.], ack 67481, win 3496, options [nop,nop,TS val 2731994 ecr 2953229], length 0
20:59:00.861728 IP 112.26.0.1.34277 > 112.26.0.8.57358: Flags [.], seq 71825:73273, ack 1, win 227, options [nop,nop,TS val 2953334 ecr 2731284], length 1448
20:59:00.913393 IP 112.26.0.8.57358 > 112.26.0.1.34277: Flags [.], ack 68929, win 3632, options [nop,nop,TS val 2732217 ecr 2953229,nop,nop,sack 1 {70377:73273}], length 0
20:59:00.916644 IP 112.26.0.1.34277 > 112.26.0.8.57358: Flags [.], seq 80513:81961, ack 1, win 227, options [nop,nop,TS val 2953654 ecr 2731678], length 1448
20:59:00.935967 IP 112.26.0.8.57358 > 112.26.0.1.34277: Flags [.], ack 68929, win 3541, options [nop,nop,TS val 2732032 ecr 2953229], length 0
20:59:00.953562 IP 112.26.0.1.34277 > 112.26.0.8.57358: Flags [.], seq 81961:83409, ack 1, win 227, options [nop,nop,TS val 2953654 ecr 2731678], length 1448
20:59:00.960386 IP 112.26.0.1.34277 > 112.26.0.8.57358: Flags [.], seq 74721:76169, ack 1, win 227, options [nop,nop,TS val 2953450 ecr 2731484], length 1448
20:59:01.018324 IP 112.26.0.8.57358 > 112.26.0.1.34277: Flags [.], ack 68929, win 3586, options [nop,nop,TS val 2732188 ecr 2953229,nop,nop,sack 1 {70377:71825}], length 0
20:59:01.023544 IP 112.26.0.8.57358 > 112.26.0.1.34277: Flags [.], ack 68929, win 3677, options [nop,nop,TS val 2732308 ecr 2953229,nop,nop,sack 2 {74721:76169}{70377:73273}], length 0
20:59:01.032223 IP 112.26.0.1.34277 > 112.26.0.8.57358: Flags [.], seq 76169:77617, ack 1, win 227, options [nop,nop,TS val 2953450 ecr 2731484], length 1448
20:59:01.037995 IP 112.26.0.1.34277 > 112.26.0.8.57358: Flags [.], seq 84857:86305, ack 1, win 227, options [nop,nop,TS val 2953830 ecr 2731805], length 1448
20:59:01.045867 IP 112.26.0.8.57358 > 112.26.0.1.34277: Flags [.], ack 68929, win 3632, options [nop,nop,TS val 2732217 ecr 2953229,nop,nop,sack 1 {70377:73273}], length 0
20:59:01.056807 IP 112.26.0.8.57358 > 112.26.0.1.34277: Flags [.], ack 68929, win 3722, options [nop,nop,TS val 2732392 ecr 2953229,nop,nop,sack 2 {74721:77617}{70377:73273}], length 0
20:59:01.065368 IP 112.26.0.1.34277 > 112.26.0.8.57358: Flags [.], seq 86305:87753, ack 1, win 227, options [nop,nop,TS val 2953871 ecr 2731902], length 1448
20:59:01.073770 IP 112.26.0.8.57358 > 112.26.0.1.34277: Flags [.], ack 68929, win 3677, options [nop,nop,TS val 2732308 ecr 2953229,nop,nop,sack 2 {74721:76169}{70377:73273}], length 0
20:59:01.136282 IP 112.26.0.8.57358 > 112.26.0.1.34277: Flags [.], ack 68929, win 3722, options [nop,nop,TS val 2732392 ecr 2953229,nop,nop,sack 2 {74721:77617}{70377:73273}], length 0
20:59:01.147830 IP 112.26.0.8.57358 > 112.26.0.1.34277: Flags [.], ack 68929, win 3767, options [nop,nop,TS val 2732504 ecr 2953229,nop,nop,sack 2 {74721:79065}{70377:73273}], length 0
20:59:01.150691 IP 112.26.0.1.34277 > 112.26.0.8.57358: Flags [.], seq 77617:79065, ack 1, win 227, options [nop,nop,TS val 2953545 ecr 2731517], length 1448
20:59:01.158570 IP 112.26.0.1.34277 > 112.26.0.8.57358: Flags [.], seq 87753:89201, ack 1, win 227, options [nop,nop,TS val 2954061 ecr 2731994], length 1448
20:59:01.215895 IP 112.26.0.8.57358 > 112.26.0.1.34277: Flags [.], ack 68929, win 3767, options [nop,nop,TS val 2732504 ecr 2953229,nop,nop,sack 2 {74721:79065}{70377:73273}], length 0
20:59:01.224968 IP 112.26.0.1.34277 > 112.26.0.8.57358: Flags [.], seq 89201:90649, ack 1, win 227, options [nop,nop,TS val 2954153 ecr 2732032], length 1448
20:59:01.229599 IP 112.26.0.1.34277 > 112.26.0.8.57358: Flags [.], seq 79065:80513, ack 1, win 227, options [nop,nop,TS val 2953569 ecr 2731604], length 1448
20:59:01.234134 IP 112.26.0.8.57358 > 112.26.0.1.34277: Flags [.], ack 68929, win 3813, options [nop,nop,TS val 2732589 ecr 2953229,nop,nop,sack 2 {74721:80513}{70377:73273}], length 0
20:59:01.251347 IP 112.26.0.8.57358 > 112.26.0.1.34277: Flags [.], ack 68929, win 3813, options [nop,nop,TS val 2732589 ecr 2953229,nop,nop,sack 2 {74721:80513}{70377:73273}], length 0
20:59:01.261901 IP 112.26.0.8.57358 > 112.26.0.1.34277: Flags [.], ack 68929, win 3858, options [nop,nop,TS val 2732615 ecr 2953229,nop,nop,sack 3 {84857:86305}{74721:80513}{70377:73273}], length 0
20:59:01.266849 IP 112.26.0.1.34277 > 112.26.0.8.57358: Flags [.], seq 90649:92097, ack 1, win 227, options [nop,nop,TS val 2954153 ecr 2732032], length 1448
20:59:01.274764 IP 112.26.0.1.34277 > 112.26.0.8.57358: Flags [.], seq 80513:81961, ack 1, win 227, options [nop,nop,TS val 2953654 ecr 2731678], length 1448
20:59:01.324772 IP 112.26.0.8.57358 > 112.26.0.1.34277: Flags [.], ack 68929, win 3858, options [nop,nop,TS val 2732615 ecr 2953229,nop,nop,sack 3 {84857:86305}{74721:80513}{70377:73273}], length 0
20:59:01.335583 IP 112.26.0.8.57358 > 112.26.0.1.34277: Flags [.], ack 68929, win 3903, options [nop,nop,TS val 2732631 ecr 2953229,nop,nop,sack 3 {74721:81961}{84857:86305}{70377:73273}], length 0
20:59:01.347573 IP 112.26.0.1.34277 > 112.26.0.8.57358: Flags [.], seq 92097:93545, ack 1, win 227, options [nop,nop,TS val 2954236 ecr 2732188], length 1448
20:59:01.351566 IP 112.26.0.1.34277 > 112.26.0.8.57358: Flags [.], seq 81961:83409, ack 1, win 227, options [nop,nop,TS val 2953654 ecr 2731678], length 1448
20:59:01.357503 IP 112.26.0.8.57358 > 112.26.0.1.34277: Flags [.], ack 68929, win 3903, options [nop,nop,TS val 2732631 ecr 2953229,nop,nop,sack 3 {74721:81961}{84857:86305}{70377:73273}], length 0
20:59:01.367014 IP 112.26.0.1.34277 > 112.26.0.8.57358: Flags [.], seq 93545:94993, ack 1, win 227, options [nop,nop,TS val 2954263 ecr 2732217], length 1448
20:59:01.371855 IP 112.26.0.8.57358 > 112.26.0.1.34277: Flags [.], ack 68929, win 3948, options [nop,nop,TS val 2732701 ecr 2953229,nop,nop,sack 3 {84857:87753}{74721:81961}{70377:73273}], length 0
20:59:01.435912 IP 112.26.0.1.34277 > 112.26.0.8.57358: Flags [.], seq 68929:70377, ack 1, win 227, options [nop,nop,TS val 2954291 ecr 2732308], length 1448
20:59:01.444976 IP 112.26.0.8.57358 > 112.26.0.1.34277: Flags [.], ack 68929, win 3994, options [nop,nop,TS val 2732712 ecr 2953229,nop,nop,sack 3 {74721:83409}{84857:87753}{70377:73273}], length 0
