20:58:56.379030 IP 112.26.0.8.57358 > 112.26.0.1.34277: Flags [S], seq 3611240214, win 65535, options [mss 1460,sackOK,TS val 2727727 ecr 0,nop,wscale 6], length 0
20:58:56.384730 IP 112.26.0.8.57358 > 112.26.0.1.34277: Flags [S], seq 3611240214, win 65535, options [mss 1460,sackOK,TS val 2727727 ecr 0,nop,wscale 6], length 0
20:58:56.385796 IP 112.26.0.8.57358 > 112.26.0.1.34277: Flags [S], seq 3611240214, win 65535, options [mss 1460,sackOK,TS val 2727727 ecr 0,nop,wscale 6], length 0
20:58:56.390343 IP 112.26.0.8.57358 > 112.26.0.1.34277: Flags [S], seq 3611240214, win 65535, options [mss 1460,sackOK,TS val 2727727 ecr 0,nop,wscale 6], length 0
20:58:56.400681 IP 112.26.0.8.57358 > 112.26.0.1.34277: Flags [S], seq 3611240214, win 65535, options [mss 1460,sackOK,TS val 2727727 ecr 0,nop,wscale 6], length 0
20:58:56.401967 IP 112.26.0.8.57358 > 112.26.0.1.34277: Flags [S], seq 3611240214, win 65535, options [mss 1460,sackOK,TS val 2727727 ecr 0,nop,wscale 6], length 0
20:58:56.410794 IP 112.26.0.8.57358 > 112.26.0.1.34277: Flags [S], seq 3611240214, win 65535, options [mss 1460,sackOK,TS val 2727727 ecr 0,nop,wscale 6], length 0
20:58:56.416754 IP 112.26.0.8.57358 > 112.26.0.1.34277: Flags [S], seq 3611240214, win 65535, options [mss 1460,sackOK,TS val 2727727 ecr 0,nop,wscale 6], length 0
20:58:56.488358 IP 112.26.0.8.57358 > 112.26.0.1.34277: Flags [S], seq 3611240214, win 65535, options [mss 1460,sackOK,TS val 2727727 ecr 0,nop,wscale 6], length 0
20:58:56.492821 IP 112.26.0.8.57358 > 112.26.0.1.34277: Flags [S], seq 3611240214, win 65535, options [mss 1460,sackOK,TS val 2727727 ecr 0,nop,wscale 6], length 0
20:58:56.501883 IP 112.26.0.8.57358 > 112.26.0.1.34277: Flags [S], seq 3611240214, win 65535, options [mss 1460,sackOK,TS val 2727727 ecr 0,nop,wscale 6], length 0
20:58:56.503112 IP 112.26.0.8.57358 > 112.26.0.1.34277: Flags [S], seq 3611240214, win 65535, options [mss 1460,sackOK,TS val 2727727 ecr 0,nop,wscale 6], length 0
20:58:56.601796 IP 112.26.0.8.57358 > 112.26.0.1.34277: Flags [S], seq 3611240214, win 65535, options [mss 1460,sackOK,TS val 2727727 ecr 0,nop,wscale 6], length 0
20:58:56.628371 IP 112.26.0.8.57358 > 112.26.0.1.34277: Flags [S], seq 3611240214, win 65535, options [mss 1460,sackOK,TS val 2727727 ecr 0,nop,wscale 6], length 0
20:58:56.726244 IP 112.26.0.8.57358 > 112.26.0.1.34277: Flags [S], seq 3611240214, win 65535, options [mss 1460,sackOK,TS val 2727727 ecr 0,nop,wscale 6], length 0
20:58:56.825917 IP 112.26.0.8.57358 > 112.26.0.1.34277: Flags [S], seq 3611240214, win 65535, options [mss 1460,sackOK,TS val 2727727 ecr 0,nop,wscale 6], length 0
20:58:56.991889 IP 112.26.0.1.34277 > 112.26.0.8.57358: Flags [S.], seq 2503003956, ack 3611240215, win 28960, options [mss 1460,sackOK,TS val 2950043 ecr 2727727,nop,wscale 7], length 0
20:58:56.992932 IP 112.26.0.1.34277 > 112.26.0.8.57358: Flags [S.], seq 2503003956, ack 3611240215, win 28960, options [mss 1460,sackOK,TS val 2950043 ecr 2727727,nop,wscale 7], length 0
20:58:56.998493 IP 112.26.0.8.57358 > 112.26.0.1.34277: Flags [.], ack 1, win 1369, options [nop,nop,TS val 2728354 ecr 2950043], length 0
20:58:57.002564 IP 112.26.0.8.57358 > 112.26.0.1.34277: Flags [.], ack 1, win 1369, options [nop,nop,TS val 2728354 ecr 2950043], length 0
20:58:57.003341 IP 112.26.0.8.57358 > 112.26.0.1.34277: Flags [.], ack 1, win 1369, options [nop,nop,TS val 2728354 ecr 2950043], length 0
20:58:57.109543 IP 112.26.0.1.34277 > 112.26.0.8.57358: Flags [.], seq 1:1449, ack 1, win 227, options [nop,nop,TS val 2950223 ecr 2728354], length 1448
20:58:57.118379 IP 112.26.0.1.34277 > 112.26.0.8.57358: Flags [.], seq 1:1449, ack 1, win 227, options [nop,nop,TS val 2950223 ecr 2728354], length 1448
20:58:57.121969 IP 112.26.0.8.57358 > 112.26.0.1.34277: Flags [.], ack 1449, win 1414, options [nop,nop,TS val 2728479 ecr 2950223], length 0
20:58:57.124354 IP 112.26.0.8.57358 > 112.26.0.1.34277: Flags [.], ack 1449, win 1414, options [nop,nop,TS val 2728479 ecr 2950223], length 0
20:58:57.125794 IP 112.26.0.8.57358 > 112.26.0.1.34277: Flags [.], ack 1449, win 1414, options [nop,nop,TS val 2728479 ecr 2950223], length 0
20:58:57.139359 IP 112.26.0.1.34277 > 112.26.0.8.57358: Flags [.], seq 1449:2897, ack 1, win 227, options [nop,nop,TS val 2950223 ecr 2728354], length 1448
20:58:57.200776 IP 112.26.0.1.34277 > 112.26.0.8.57358: Flags [.], seq 1449:2897, ack 1, win 227, options [nop,nop,TS val 2950223 ecr 2728354], length 1448
20:58:57.202050 IP 112.26.0.8.57358 > 112.26.0.1.34277: Flags [.], ack 2897, win 1460, options [nop,nop,TS val 2728562 ecr 2950223], length 0
20:58:57.210595 IP 112.26.0.8.57358 > 112.26.0.1.34277: Flags [.], ack 2897, win 1460, options [nop,nop,TS val 2728562 ecr 2950223], length 0
20:58:57.291082 IP 112.26.0.8.57358 > 112.26.0.1.34277: Flags [.], ack 2897, win 1460, options [nop,nop,TS val 2728562 ecr 2950223], length 0
20:58:57.295834 IP 112.26.0.1.34277 > 112.26.0.8.57358: Flags [P.], seq 2897:4097, ack 1, win 227, options [nop,nop,TS val 2950223 ecr 2728354], length 1200
20:58:57.297918 IP 112.26.0.1.34277 > 112.26.0.8.57358: Flags [P.], seq 2897:4097, ack 1, win 227, options [nop,nop,TS val 2950223 ecr 2728354], length 1200
20:58:57.300461 IP 112.26.0.8.57358 > 112.26.0.1.34277: Flags [.], ack 4097, win 1505, options [nop,nop,TS val 2728659 ecr 2950223], length 0
20:58:57.304663 IP 112.26.0.8.57358 > 112.26.0.1.34277: Flags [.], ack 4097, win 1505, options [nop,nop,TS val 2728659 ecr 2950223], length 0
20:58:57.324707 IP 112.26.0.8.57358 > 112.26.0.1.34277: Flags [.], ack 4097, win 1505, options [nop,nop,TS val 2728659 ecr 2950223], length 0
20:58:57.330297 IP 112.26.0.1.34277 > 112.26.0.8.57358: Flags [.], seq 4097:5545, ack 1, win 227, options [nop,nop,TS val 2950223 ecr 2728354], length 1448
20:58:57.331145 IP 112.26.0.1.34277 > 112.26.0.8.57358: Flags [.], seq 4097:5545, ack 1, win 227, options [nop,nop,TS val 2950223 ecr 2728354], length 1448
20:58:57.332434 IP 112.26.0.8.57358 > 112.26.0.1.34277: Flags [.], ack 5545, win 1550, options [nop,nop,TS val 2728692 ecr 2950223], length 0
20:58:57.336880 IP 112.26.0.8.57358 > 112.26.0.1.34277: Flags [.], ack 5545, win 1550, options [nop,nop,TS val 2728692 ecr 2950223], length 0
20:58:57.402612 IP 112.26.0.8.57358 > 112.26.0.1.34277: Flags [.], ack 5545, win 1550, options [nop,nop,TS val 2728692 ecr 2950223], length 0
20:58:57.415877 IP 112.26.0.1.34277 > 112.26.0.8.57358: Flags [.], seq 5545:6993, ack 1, win 227, options [nop,nop,TS val 2950223 ecr 2728354], length 1448
20:58:57.416243 IP 112.26.0.1.34277 > 112.26.0.8.57358: Flags [.], seq 5545:6993, ack 1, win 227, options [nop,nop,TS val 2950223 ecr 2728354], length 1448
20:58:57.423232 IP 112.26.0.8.57358 > 112.26.0.1.34277: Flags [.], ack 6993, win 1595, options [nop,nop,TS val 2728779 ecr 2950223], length 0
20:58:57.426815 IP 112.26.0.8.57358 > 112.26.0.1.34277: Flags [.], ack 6993, win 1595, options [nop,nop,TS val 2728779 ecr 2950223], length 0
20:58:57.499431 IP 112.26.0.8.57358 > 112.26.0.1.34277: Flags [.], ack 6993, win 1595, options [nop,nop,TS val 2728779 ecr 2950223], length 0
20:58:57.517365 IP 112.26.0.1.34277 > 112.26.0.8.57358: Flags [.], seq 6993:8441, ack 1, win 227, options [nop,nop,TS val 2950223 ecr 2728354], length 1448
20:58:57.517662 IP 112.26.0.1.34277 > 112.26.0.8.57358: Flags [.], seq 6993:8441, ack 1, win 227, options [nop,nop,TS val 2950223 ecr 2728354], length 1448
20:58:57.520097 IP 112.26.0.8.57358 > 112.26.0.1.34277: Flags [.], ack 8441, win 1641, options [nop,nop,TS val 2728880 ecr 2950223], length 0
20:58:57.525745 IP 112.26.0.8.57358 > 112.26.0.1.34277: Flags [.], ack 8441, win 1641, options [nop,nop,TS val 2728880 ecr 2950223], length 0
20:58:57.596993 IP 112.26.0.8.57358 > 112.26.0.1.34277: Flags [.], ack 8441, win 1641, options [nop,nop,TS val 2728880 ecr 2950223], length 0
20:58:57.625754 IP 112.26.0.1.34277 > 112.26.0.8.57358: Flags [.], seq 8441:9889, ack 1, win 227, options [nop,nop,TS val 2950223 ecr 2728354], length 1448
20:58:57.626062 IP 112.26.0.1.34277 > 112.26.0.8.57358: Flags [.], seq 8441:9889, ack 1, win 227, options [nop,nop,TS val 2950223 ecr 2728354], length 1448
20:58:57.698320 IP 112.26.0.8.57358 > 112.26.0.1.34277: Flags [.], ack 9889, win 1686, options [nop,nop,TS val 2728989 ecr 2950223], length 0
20:58:57.703151 IP 112.26.0.1.34277 > 112.26.0.8.57358: Flags [.], seq 9889:11337, ack 1, win 227, options [nop,nop,TS val 2950223 ecr 2728354], length 1448
20:58:57.703455 IP 112.26.0.1.34277 > 112.26.0.8.57358: Flags [.], seq 9889:11337, ack 1, win 227, options [nop,nop,TS val 2950223 ecr 2728354], length 1448
20:58:57.724845 IP 112.26.0.8.57358 > 112.26.0.1.34277: Flags [.], ack 9889, win 1686, options [nop,nop,TS val 2728989 ecr 2950223], length 0
20:58:57.727511 IP 112.26.0.8.57358 > 112.26.0.1.34277: Flags [.], ack 9889, win 1686, options [nop,nop,TS val 2728989 ecr 2950223], length 0
20:58:57.729466 IP 112.26.0.1.34277 > 112.26.0.8.57358: Flags [.], seq 11337:12785, ack 1, win 227, options [nop,nop,TS val 2950224 ecr 2728354], length 1448
20:58:57.729773 IP 112.26.0.1.34277 > 112.26.0.8.57358: Flags [.], seq 11337:12785, ack 1, win 227, options [nop,nop,TS val 2950224 ecr 2728354], length 1448
20:58:57.745992 IP 112.26.0.8.57358 > 112.26.0.1.34277: Flags [.], ack 11337, win 1731, options [nop,nop,TS val 2729080 ecr 2950223], length 0
20:58:57.816695 IP 112.26.0.1.34277 > 112.26.0.8.57358: Flags [.], seq 14233:15681, ack 1, win 227, options [nop,nop,TS val 2950346 ecr 2728479], length 1448
20:58:57.816953 IP 112.26.0.1.34277 > 112.26.0.8.57358: Flags [.], seq 14233:15681, ack 1, win 227, options [nop,nop,TS val 2950346 ecr 2728479], length 1448
20:58:57.817942 IP 112.26.0.8.57358 > 112.26.0.1.34277: Flags [.], ack 12785, win 1776, options [nop,nop,TS val 2729167 ecr 2950224], length 0
20:58:57.845036 IP 112.26.0.8.57358 > 112.26.0.1.34277: Flags [.], ack 11337, win 1731, options [nop,nop,TS val 2729080 ecr 2950223], length 0
20:58:57.900319 IP 112.26.0.1.34277 > 112.26.0.8.57358: Flags [.], seq 15681:17129, ack 1, win 227, options [nop,nop,TS val 2950346 ecr 2728479], length 1448
20:58:57.900605 IP 112.26.0.1.34277 > 112.26.0.8.57358: Flags [.], seq 15681:17129, ack 1, win 227, options [nop,nop,TS val 2950346 ecr 2728479], length 1448
20:58:57.915931 IP 112.26.0.8.57358 > 112.26.0.1.34277: Flags [.], ack 12785, win 1822, options [nop,nop,TS val 2729274 ecr 2950224,nop,nop,sack 1 {14233:15681}], length 0
20:58:57.938133 IP 112.26.0.8.57358 > 112.26.0.1.34277: Flags [.], ack 12785, win 1776, options [nop,nop,TS val 2729167 ecr 2950224], length 0
20:58:58.013506 IP 112.26.0.8.57358 > 112.26.0.1.34277: Flags [.], ack 12785, win 1822, options [nop,nop,TS val 2729274 ecr 2950224,nop,nop,sack 1 {14233:15681}], length 0
20:58:58.016078 IP 112.26.0.1.34277 > 112.26.0.8.57358: Flags [.], seq 17129:18577, ack 1, win 227, options [nop,nop,TS val 2950505 ecr 2728562], length 1448
20:58:58.016316 IP 112.26.0.1.34277 > 112.26.0.8.57358: Flags [.], seq 17129:18577, ack 1, win 227, options [nop,nop,TS val 2950505 ecr 2728562], length 1448
20:58:58.018993 IP 112.26.0.8.57358 > 112.26.0.1.34277: Flags [.], ack 12785, win 1867, options [nop,nop,TS val 2729379 ecr 2950224,nop,nop,sack 1 {14233:17129}], length 0
20:58:58.030804 IP 112.26.0.8.57358 > 112.26.0.1.34277: Flags [.], ack 11337, win 1731, options [nop,nop,TS val 2729080 ecr 2950223], length 0
20:58:58.040699 IP 112.26.0.8.57358 > 112.26.0.1.34277: Flags [.], ack 12785, win 1867, options [nop,nop,TS val 2729379 ecr 2950224,nop,nop,sack 1 {14233:17129}], length 0
20:58:58.106301 IP 112.26.0.8.57358 > 112.26.0.1.34277: Flags [.], ack 12785, win 1912, options [nop,nop,TS val 2729463 ecr 2950224,nop,nop,sack 1 {14233:18577}], length 0
20:58:58.113707 IP 112.26.0.1.34277 > 112.26.0.8.57358: Flags [.], seq 18577:20025, ack 1, win 227, options [nop,nop,TS val 2950505 ecr 2728562], length 1448
20:58:58.113961 IP 112.26.0.1.34277 > 112.26.0.8.57358: Flags [.], seq 18577:20025, ack 1, win 227, options [nop,nop,TS val 2950505 ecr 2728562], length 1448
20:58:58.130765 IP 112.26.0.8.57358 > 112.26.0.1.34277: Flags [.], ack 12785, win 1912, options [nop,nop,TS val 2729463 ecr 2950224,nop,nop,sack 1 {14233:18577}], length 0
20:58:58.141236 IP 112.26.0.8.57358 > 112.26.0.1.34277: Flags [.], ack 12785, win 1957, options [nop,nop,TS val 2729500 ecr 2950224,nop,nop,sack 1 {14233:20025}], length 0
20:58:58.146899 IP 112.26.0.8.57358 > 112.26.0.1.34277: Flags [.], ack 12785, win 1776, options [nop,nop,TS val 2729167 ecr 2950224], length 0
20:58:58.190734 IP 112.26.0.8.57358 > 112.26.0.1.34277: Flags [.], ack 12785, win 1957, options [nop,nop,TS val 2729500 ecr 2950224,nop,nop,sack 1 {14233:20025}], length 0
20:58:58.199557 IP 112.26.0.1.34277 > 112.26.0.8.57358: Flags [.], seq 20025:21473, ack 1, win 227, options [nop,nop,TS val 2950542 ecr 2728659], length 1448
20:58:58.199877 IP 112.26.0.1.34277 > 112.26.0.8.57358: Flags [.], seq 20025:21473, ack 1, win 227, options [nop,nop,TS val 2950542 ecr 2728659], length 1448
20:58:58.213769 IP 112.26.0.8.57358 > 112.26.0.1.34277: Flags [.], ack 12785, win 2003, options [nop,nop,TS val 2729573 ecr 2950224,nop,nop,sack 1 {14233:21473}], length 0
20:58:58.215400 IP 112.26.0.8.57358 > 112.26.0.1.34277: Flags [.], ack 12785, win 2003, options [nop,nop,TS val 2729573 ecr 2950224,nop,nop,sack 1 {14233:21473}], length 0
20:58:58.228064 IP 112.26.0.1.34277 > 112.26.0.8.57358: Flags [.], seq 21473:22921, ack 1, win 227, options [nop,nop,TS val 2950542 ecr 2728659], length 1448
20:58:58.228348 IP 112.26.0.1.34277 > 112.26.0.8.57358: Flags [.], seq 21473:22921, ack 1, win 227, options [nop,nop,TS val 2950542 ecr 2728659], length 1448
20:58:58.239731 IP 112.26.0.8.57358 > 112.26.0.1.34277: Flags [.], ack 12785, win 1822, options [nop,nop,TS val 2729274 ecr 2950224,nop,nop,sack 1 {14233:15681}], length 0
20:58:58.243974 IP 112.26.0.8.57358 > 112.26.0.1.34277: Flags [.], ack 12785, win 2048, options [nop,nop,TS val 2729603 ecr 2950224,nop,nop,sack 1 {14233:22921}], length 0
20:58:58.290805 IP 112.26.0.8.57358 > 112.26.0.1.34277: Flags [.], ack 12785, win 2048, options [nop,nop,TS val 2729603 ecr 2950224,nop,nop,sack 1 {14233:22921}], length 0
20:58:58.313064 IP 112.26.0.1.34277 > 112.26.0.8.57358: Flags [.], seq 22921:24369, ack 1, win 227, options [nop,nop,TS val 2950620 ecr 2728692], length 1448
20:58:58.313337 IP 112.26.0.1.34277 > 112.26.0.8.57358: Flags [.], seq 22921:24369, ack 1, win 227, options [nop,nop,TS val 2950620 ecr 2728692], length 1448
20:58:58.319197 IP 112.26.0.8.57358 > 112.26.0.1.34277: Flags [.], ack 12785, win 2093, options [nop,nop,TS val 2729675 ecr 2950224,nop,nop,sack 1 {14233:24369}], length 0
20:58:58.322124 IP 112.26.0.8.57358 > 112.26.0.1.34277: Flags [.], ack 12785, win 2093, options [nop,nop,TS val 2729675 ecr 2950224,nop,nop,sack 1 {14233:24369}], length 0
20:58:58.333492 IP 112.26.0.8.57358 > 112.26.0.1.34277: Flags [.], ack 12785, win 1867, options [nop,nop,TS val 2729379 ecr 2950224,nop,nop,sack 1 {14233:17129}], length 0
20:58:58.397691 IP 112.26.0.1.34277 > 112.26.0.8.57358: Flags [.], seq 24369:25817, ack 1, win 227, options [nop,nop,TS val 2950620 ecr 2728692], length 1448
20:58:58.398009 IP 112.26.0.1.34277 > 112.26.0.8.57358: Flags [.], seq 24369:25817, ack 1, win 227, options [nop,nop,TS val 2950620 ecr 2728692], length 1448
20:58:58.405830 IP 112.26.0.8.57358 > 112.26.0.1.34277: Flags [.], ack 12785, win 2138, options [nop,nop,TS val 2729760 ecr 2950224,nop,nop,sack 1 {14233:25817}], length 0
20:58:58.408036 IP 112.26.0.8.57358 > 112.26.0.1.34277: Flags [.], ack 12785, win 2138, options [nop,nop,TS val 2729760 ecr 2950224,nop,nop,sack 1 {14233:25817}], length 0
20:58:58.421069 IP 112.26.0.8.57358 > 112.26.0.1.34277: Flags [.], ack 12785, win 1912, options [nop,nop,TS val 2729463 ecr 2950224,nop,nop,sack 1 {14233:18577}], length 0
20:58:58.430776 IP 112.26.0.1.34277 > 112.26.0.8.57358: Flags [.], seq 27265:28713, ack 1, win 227, options [nop,nop,TS val 2950716 ecr 2728779], length 1448
20:58:58.431052 IP 112.26.0.1.34277 > 112.26.0.8.57358: Flags [.], seq 27265:28713, ack 1, win 227, options [nop,nop,TS val 2950716 ecr 2728779], length 1448
20:58:58.438002 IP 112.26.0.8.57358 > 112.26.0.1.34277: Flags [.], ack 12785, win 2184, options [nop,nop,TS val 2729797 ecr 2950224,nop,nop,sack 2 {27265:28713}{14233:25817}], length 0
20:58:58.507164 IP 112.26.0.8.57358 > 112.26.0.1.34277: Flags [.], ack 12785, win 2184, options [nop,nop,TS val 2729797 ecr 2950224,nop,nop,sack 2 {27265:28713}{14233:25817}], length 0
20:58:58.509302 IP 112.26.0.8.57358 > 112.26.0.1.34277: Flags [.], ack 12785, win 1957, options [nop,nop,TS val 2729500 ecr 2950224,nop,nop,sack 1 {14233:20025}], length 0
20:58:58.519935 IP 112.26.0.1.34277 > 112.26.0.8.57358: Flags [.], seq 28713:30161, ack 1, win 227, options [nop,nop,TS val 2950745 ecr 2728880], length 1448
20:58:58.520189 IP 112.26.0.1.34277 > 112.26.0.8.57358: Flags [.], seq 28713:30161, ack 1, win 227, options [nop,nop,TS val 2950745 ecr 2728880], length 1448
20:58:58.530856 IP 112.26.0.8.57358 > 112.26.0.1.34277: Flags [.], ack 12785, win 2229, options [nop,nop,TS val 2729882 ecr 2950224,nop,nop,sack 2 {27265:30161}{14233:25817}], length 0
20:58:58.540168 IP 112.26.0.8.57358 > 112.26.0.1.34277: Flags [.], ack 12785, win 2229, options [nop,nop,TS val 2729882 ecr 2950224,nop,nop,sack 2 {27265:30161}{14233:25817}], length 0
20:58:58.604424 IP 112.26.0.8.57358 > 112.26.0.1.34277: Flags [.], ack 12785, win 2003, options [nop,nop,TS val 2729573 ecr 2950224,nop,nop,sack 1 {14233:21473}], length 0
20:58:58.605725 IP 112.26.0.1.34277 > 112.26.0.8.57358: Flags [.], seq 31609:33057, ack 1, win 227, options [nop,nop,TS val 2950945 ecr 2728989], length 1448
20:58:58.605941 IP 112.26.0.1.34277 > 112.26.0.8.57358: Flags [.], seq 31609:33057, ack 1, win 227, options [nop,nop,TS val 2950945 ecr 2728989], length 1448
20:58:58.612386 IP 112.26.0.8.57358 > 112.26.0.1.34277: Flags [.], ack 12785, win 2274, options [nop,nop,TS val 2729969 ecr 2950224,nop,nop,sack 3 {31609:33057}{27265:30161}{14233:25817}], length 0
20:58:58.631630 IP 112.26.0.8.57358 > 112.26.0.1.34277: Flags [.], ack 12785, win 2274, options [nop,nop,TS val 2729969 ecr 2950224,nop,nop,sack 3 {31609:33057}{27265:30161}{14233:25817}], length 0
20:58:58.645570 IP 112.26.0.8.57358 > 112.26.0.1.34277: Flags [.], ack 12785, win 2048, options [nop,nop,TS val 2729603 ecr 2950224,nop,nop,sack 1 {14233:22921}], length 0
20:58:58.648465 IP 112.26.0.1.34277 > 112.26.0.8.57358: Flags [.], seq 34505:35953, ack 1, win 227, options [nop,nop,TS val 2951248 ecr 2729080], length 1448
20:58:58.648653 IP 112.26.0.1.34277 > 112.26.0.8.57358: Flags [.], seq 34505:35953, ack 1, win 227, options [nop,nop,TS val 2951248 ecr 2729080], length 1448
20:58:58.655783 IP 112.26.0.8.57358 > 112.26.0.1.34277: Flags [.], ack 12785, win 2319, options [nop,nop,TS val 2730011 ecr 2950224,nop,nop,sack 3 {34505:35953}{31609:33057}{27265:30161}], length 0
20:58:58.706182 IP 112.26.0.8.57358 > 112.26.0.1.34277: Flags [.], ack 12785, win 2319, options [nop,nop,TS val 2730011 ecr 2950224,nop,nop,sack 3 {34505:35953}{31609:33057}{27265:30161}], length 0
20:58:58.714036 IP 112.26.0.8.57358 > 112.26.0.1.34277: Flags [.], ack 12785, win 2093, options [nop,nop,TS val 2729675 ecr 2950224,nop,nop,sack 1 {14233:24369}], length 0
20:58:58.731819 IP 112.26.0.8.57358 > 112.26.0.1.34277: Flags [.], ack 12785, win 2138, options [nop,nop,TS val 2729760 ecr 2950224,nop,nop,sack 1 {14233:25817}], length 0
20:58:58.800986 IP 112.26.0.1.34277 > 112.26.0.8.57358: Flags [.], seq 37401:38849, ack 1, win 227, options [nop,nop,TS val 2951364 ecr 2729167], length 1448
20:58:58.801233 IP 112.26.0.1.34277 > 112.26.0.8.57358: Flags [.], seq 37401:38849, ack 1, win 227, options [nop,nop,TS val 2951364 ecr 2729167], length 1448
20:58:58.807484 IP 112.26.0.8.57358 > 112.26.0.1.34277: Flags [.], ack 12785, win 2365, options [nop,nop,TS val 2730164 ecr 2950224,nop,nop,sack 3 {37401:38849}{34505:35953}{31609:33057}], length 0
20:58:58.811048 IP 112.26.0.8.57358 > 112.26.0.1.34277: Flags [.], ack 12785, win 2365, options [nop,nop,TS val 2730164 ecr 2950224,nop,nop,sack 3 {37401:38849}{34505:35953}{31609:33057}], length 0
20:58:58.823141 IP 112.26.0.1.34277 > 112.26.0.8.57358: Flags [.], seq 38849:40297, ack 1, win 227, options [nop,nop,TS val 2951364 ecr 2729167], length 1448
20:58:58.823330 IP 112.26.0.1.34277 > 112.26.0.8.57358: Flags [.], seq 38849:40297, ack 1, win 227, options [nop,nop,TS val 2951364 ecr 2729167], length 1448
20:58:58.830198 IP 112.26.0.8.57358 > 112.26.0.1.34277: Flags [.], ack 12785, win 2184, options [nop,nop,TS val 2729797 ecr 2950224,nop,nop,sack 2 {27265:28713}{14233:25817}], length 0
20:58:58.837244 IP 112.26.0.8.57358 > 112.26.0.1.34277: Flags [.], ack 12785, win 2410, options [nop,nop,TS val 2730197 ecr 2950224,nop,nop,sack 3 {37401:40297}{34505:35953}{31609:33057}], length 0
20:58:58.839434 IP 112.26.0.8.57358 > 112.26.0.1.34277: Flags [.], ack 12785, win 2410, options [nop,nop,TS val 2730197 ecr 2950224,nop,nop,sack 3 {37401:40297}{34505:35953}{31609:33057}], length 0
20:58:58.913558 IP 112.26.0.1.34277 > 112.26.0.8.57358: Flags [.], seq 40297:41745, ack 1, win 227, options [nop,nop,TS val 2951457 ecr 2729274], length 1448
20:58:58.913748 IP 112.26.0.1.34277 > 112.26.0.8.57358: Flags [.], seq 40297:41745, ack 1, win 227, options [nop,nop,TS val 2951457 ecr 2729274], length 1448
20:58:58.918245 IP 112.26.0.8.57358 > 112.26.0.1.34277: Flags [.], ack 12785, win 2229, options [nop,nop,TS val 2729882 ecr 2950224,nop,nop,sack 2 {27265:30161}{14233:25817}], length 0
20:58:58.931494 IP 112.26.0.8.57358 > 112.26.0.1.34277: Flags [.], ack 12785, win 2455, options [nop,nop,TS val 2730291 ecr 2950224,nop,nop,sack 3 {37401:41745}{34505:35953}{31609:33057}], length 0
20:58:58.935303 IP 112.26.0.8.57358 > 112.26.0.1.34277: Flags [.], ack 12785, win 2455, options [nop,nop,TS val 2730291 ecr 2950224,nop,nop,sack 3 {37401:41745}{34505:35953}{31609:33057}], length 0
20:58:58.944635 IP 112.26.0.8.57358 > 112.26.0.1.34277: Flags [.], ack 12785, win 2274, options [nop,nop,TS val 2729969 ecr 2950224,nop,nop,sack 3 {31609:33057}{27265:30161}{14233:25817}], length 0
20:58:58.948579 IP 112.26.0.1.34277 > 112.26.0.8.57358: Flags [.], seq 41745:43193, ack 1, win 227, options [nop,nop,TS val 2951551 ecr 2729379], length 1448
20:58:58.948735 IP 112.26.0.1.34277 > 112.26.0.8.57358: Flags [.], seq 41745:43193, ack 1, win 227, options [nop,nop,TS val 2951551 ecr 2729379], length 1448
20:58:59.008799 IP 112.26.0.8.57358 > 112.26.0.1.34277: Flags [.], ack 12785, win 2500, options [nop,nop,TS val 2730369 ecr 2950224,nop,nop,sack 3 {37401:43193}{34505:35953}{31609:33057}], length 0
20:58:59.015457 IP 112.26.0.8.57358 > 112.26.0.1.34277: Flags [.], ack 12785, win 2500, options [nop,nop,TS val 2730369 ecr 2950224,nop,nop,sack 3 {37401:43193}{34505:35953}{31609:33057}], length 0
20:58:59.019612 IP 112.26.0.8.57358 > 112.26.0.1.34277: Flags [.], ack 12785, win 2319, options [nop,nop,TS val 2730011 ecr 2950224,nop,nop,sack 3 {34505:35953}{31609:33057}{27265:30161}], length 0
20:58:59.033262 IP 112.26.0.1.34277 > 112.26.0.8.57358: Flags [.], seq 43193:44641, ack 1, win 227, options [nop,nop,TS val 2951726 ecr 2729500], length 1448
20:58:59.033449 IP 112.26.0.1.34277 > 112.26.0.8.57358: Flags [.], seq 43193:44641, ack 1, win 227, options [nop,nop,TS val 2951726 ecr 2729500], length 1448
20:58:59.036580 IP 112.26.0.8.57358 > 112.26.0.1.34277: Flags [.], ack 12785, win 2546, options [nop,nop,TS val 2730395 ecr 2950224,nop,nop,sack 3 {37401:44641}{34505:35953}{31609:33057}], length 0
20:58:59.047942 IP 112.26.0.8.57358 > 112.26.0.1.34277: Flags [.], ack 12785, win 2365, options [nop,nop,TS val 2730164 ecr 2950224,nop,nop,sack 3 {37401:38849}{34505:35953}{31609:33057}], length 0
20:58:59.098068 IP 112.26.0.8.57358 > 112.26.0.1.34277: Flags [.], ack 12785, win 2546, options [nop,nop,TS val 2730395 ecr 2950224,nop,nop,sack 3 {37401:44641}{34505:35953}{31609:33057}], length 0
20:58:59.115674 IP 112.26.0.1.34277 > 112.26.0.8.57358: Flags [.], seq 44641:46089, ack 1, win 227, options [nop,nop,TS val 2951822 ecr 2729573], length 1448
20:58:59.115829 IP 112.26.0.1.34277 > 112.26.0.8.57358: Flags [.], seq 44641:46089, ack 1, win 227, options [nop,nop,TS val 2951822 ecr 2729573], length 1448
20:58:59.123581 IP 112.26.0.8.57358 > 112.26.0.1.34277: Flags [.], ack 12785, win 2591, options [nop,nop,TS val 2730478 ecr 2950224,nop,nop,sack 3 {37401:46089}{34505:35953}{31609:33057}], length 0
20:58:59.139971 IP 112.26.0.8.57358 > 112.26.0.1.34277: Flags [.], ack 12785, win 2591, options [nop,nop,TS val 2730478 ecr 2950224,nop,nop,sack 3 {37401:46089}{34505:35953}{31609:33057}], length 0
20:58:59.200466 IP 112.26.0.8.57358 > 112.26.0.1.34277: Flags [.], ack 12785, win 2410, options [nop,nop,TS val 2730197 ecr 2950224,nop,nop,sack 3 {37401:40297}{34505:35953}{31609:33057}], length 0
20:58:59.210949 IP 112.26.0.1.34277 > 112.26.0.8.57358: Flags [.], seq 46089:47537, ack 1, win 227, options [nop,nop,TS val 2951931 ecr 2729675], length 1448
20:58:59.211137 IP 112.26.0.1.34277 > 112.26.0.8.57358: Flags [.], seq 46089:47537, ack 1, win 227, options [nop,nop,TS val 2951931 ecr 2729675], length 1448
20:58:59.214782 IP 112.26.0.8.57358 > 112.26.0.1.34277: Flags [.], ack 12785, win 2636, options [nop,nop,TS val 2730573 ecr 2950224,nop,nop,sack 3 {37401:47537}{34505:35953}{31609:33057}], length 0
20:58:59.219980 IP 112.26.0.8.57358 > 112.26.0.1.34277: Flags [.], ack 12785, win 2636, options [nop,nop,TS val 2730573 ecr 2950224,nop,nop,sack 3 {37401:47537}{34505:35953}{31609:33057}], length 0
20:58:59.230112 IP 112.26.0.1.34277 > 112.26.0.8.57358: Flags [.], seq 47537:48985, ack 1, win 227, options [nop,nop,TS val 2951949 ecr 2729760], length 1448
20:58:59.230304 IP 112.26.0.1.34277 > 112.26.0.8.57358: Flags [.], seq 47537:48985, ack 1, win 227, options [nop,nop,TS val 2951949 ecr 2729760], length 1448
20:58:59.238331 IP 112.26.0.8.57358 > 112.26.0.1.34277: Flags [.], ack 12785, win 2455, options [nop,nop,TS val 2730291 ecr 2950224,nop,nop,sack 3 {37401:41745}{34505:35953}{31609:33057}], length 0
20:58:59.246927 IP 112.26.0.8.57358 > 112.26.0.1.34277: Flags [.], ack 12785, win 2681, options [nop,nop,TS val 2730604 ecr 2950224,nop,nop,sack 3 {37401:48985}{34505:35953}{31609:33057}], length 0
20:58:59.249406 IP 112.26.0.8.57358 > 112.26.0.1.34277: Flags [.], ack 12785, win 2681, options [nop,nop,TS val 2730604 ecr 2950224,nop,nop,sack 3 {37401:48985}{34505:35953}{31609:33057}], length 0
20:58:59.308610 IP 112.26.0.1.34277 > 112.26.0.8.57358: Flags [.], seq 25817:27265, ack 1, win 227, options [nop,nop,TS val 2952135 ecr 2729882], length 1448
20:58:59.308794 IP 112.26.0.1.34277 > 112.26.0.8.57358: Flags [.], seq 25817:27265, ack 1, win 227, options [nop,nop,TS val 2952135 ecr 2729882], length 1448
20:58:59.316120 IP 112.26.0.8.57358 > 112.26.0.1.34277: Flags [.], ack 12785, win 2500, options [nop,nop,TS val 2730369 ecr 2950224,nop,nop,sack 3 {37401:43193}{34505:35953}{31609:33057}], length 0
20:58:59.322583 IP 112.26.0.8.57358 > 112.26.0.1.34277: Flags [.], ack 12785, win 2727, options [nop,nop,TS val 2730670 ecr 2950224,nop,nop,sack 3 {25817:30161}{37401:48985}{34505:35953}], length 0
20:58:59.324144 IP 112.26.0.8.57358 > 112.26.0.1.34277: Flags [.], ack 12785, win 2727, options [nop,nop,TS val 2730670 ecr 2950224,nop,nop,sack 3 {25817:30161}{37401:48985}{34505:35953}], length 0
20:58:59.337790 IP 112.26.0.1.34277 > 112.26.0.8.57358: Flags [.], seq 30161:31609, ack 1, win 227, options [nop,nop,TS val 2952237 ecr 2730011], length 1448
20:58:59.337981 IP 112.26.0.1.34277 > 112.26.0.8.57358: Flags [.], seq 30161:31609, ack 1, win 227, options [nop,nop,TS val 2952237 ecr 2730011], length 1448
20:58:59.342313 IP 112.26.0.8.57358 > 112.26.0.1.34277: Flags [.], ack 12785, win 2772, options [nop,nop,TS val 2730700 ecr 2950224,nop,nop,sack 3 {25817:33057}{37401:48985}{34505:35953}], length 0
20:58:59.405558 IP 112.26.0.8.57358 > 112.26.0.1.34277: Flags [.], ack 12785, win 2546, options [nop,nop,TS val 2730395 ecr 2950224,nop,nop,sack 3 {37401:44641}{34505:35953}{31609:33057}], length 0
20:58:59.412501 IP 112.26.0.8.57358 > 112.26.0.1.34277: Flags [.], ack 12785, win 2772, options [nop,nop,TS val 2730700 ecr 2950224,nop,nop,sack 3 {25817:33057}{37401:48985}{34505:35953}], length 0
20:58:59.414678 IP 112.26.0.8.57358 > 112.26.0.1.34277: Flags [.], ack 12785, win 2591, options [nop,nop,TS val 2730478 ecr 2950224,nop,nop,sack 3 {37401:46089}{34505:35953}{31609:33057}], length 0
20:58:59.432107 IP 112.26.0.1.34277 > 112.26.0.8.57358: Flags [.], seq 33057:34505, ack 1, win 227, options [nop,nop,TS val 2952264 ecr 2730164], length 1448
20:58:59.432285 IP 112.26.0.1.34277 > 112.26.0.8.57358: Flags [.], seq 33057:34505, ack 1, win 227, options [nop,nop,TS val 2952264 ecr 2730164], length 1448
20:58:59.437299 IP 112.26.0.8.57358 > 112.26.0.1.34277: Flags [.], ack 12785, win 2817, options [nop,nop,TS val 2730794 ecr 2950224,nop,nop,sack 2 {25817:35953}{37401:48985}], length 0
20:58:59.442716 IP 112.26.0.8.57358 > 112.26.0.1.34277: Flags [.], ack 12785, win 2817, options [nop,nop,TS val 2730794 ecr 2950224,nop,nop,sack 2 {25817:35953}{37401:48985}], length 0
20:58:59.502714 IP 112.26.0.8.57358 > 112.26.0.1.34277: Flags [.], ack 12785, win 2636, options [nop,nop,TS val 2730573 ecr 2950224,nop,nop,sack 3 {37401:47537}{34505:35953}{31609:33057}], length 0
20:58:59.520937 IP 112.26.0.8.57358 > 112.26.0.1.34277: Flags [.], ack 12785, win 2681, options [nop,nop,TS val 2730604 ecr 2950224,nop,nop,sack 3 {37401:48985}{34505:35953}{31609:33057}], length 0
20:58:59.609219 IP 112.26.0.1.34277 > 112.26.0.8.57358: Flags [.], seq 35953:37401, ack 1, win 227, options [nop,nop,TS val 2952417 ecr 2730197], length 1448
20:58:59.609436 IP 112.26.0.1.34277 > 112.26.0.8.57358: Flags [.], seq 35953:37401, ack 1, win 227, options [nop,nop,TS val 2952417 ecr 2730197], length 1448
20:58:59.612706 IP 112.26.0.8.57358 > 112.26.0.1.34277: Flags [.], ack 12785, win 2862, options [nop,nop,TS val 2730971 ecr 2950224,nop,nop,sack 1 {25817:48985}], length 0
20:58:59.615550 IP 112.26.0.8.57358 > 112.26.0.1.34277: Flags [.], ack 12785, win 2862, options [nop,nop,TS val 2730971 ecr 2950224,nop,nop,sack 1 {25817:48985}], length 0
20:58:59.625875 IP 112.26.0.8.57358 > 112.26.0.1.34277: Flags [.], ack 12785, win 2727, options [nop,nop,TS val 2730670 ecr 2950224,nop,nop,sack 3 {25817:30161}{37401:48985}{34505:35953}], length 0
20:58:59.631741 IP 112.26.0.1.34277 > 112.26.0.8.57358: Flags [.], seq 48985:50433, ack 1, win 227, options [nop,nop,TS val 2952455 ecr 2730291], length 1448
20:58:59.631923 IP 112.26.0.1.34277 > 112.26.0.8.57358: Flags [.], seq 48985:50433, ack 1, win 227, options [nop,nop,TS val 2952455 ecr 2730291], length 1448
20:58:59.714504 IP 112.26.0.8.57358 > 112.26.0.1.34277: Flags [.], ack 12785, win 2908, options [nop,nop,TS val 2731073 ecr 2950224,nop,nop,sack 1 {25817:50433}], length 0
20:58:59.719819 IP 112.26.0.8.57358 > 112.26.0.1.34277: Flags [.], ack 12785, win 2908, options [nop,nop,TS val 2731073 ecr 2950224,nop,nop,sack 1 {25817:50433}], length 0
20:58:59.722890 IP 112.26.0.8.57358 > 112.26.0.1.34277: Flags [.], ack 12785, win 2772, options [nop,nop,TS val 2730700 ecr 2950224,nop,nop,sack 3 {25817:33057}{37401:48985}{34505:35953}], length 0
20:58:59.728022 IP 112.26.0.1.34277 > 112.26.0.8.57358: Flags [.], seq 50433:51881, ack 1, win 227, options [nop,nop,TS val 2952533 ecr 2730369], length 1448
20:58:59.728234 IP 112.26.0.1.34277 > 112.26.0.8.57358: Flags [.], seq 50433:51881, ack 1, win 227, options [nop,nop,TS val 2952533 ecr 2730369], length 1448
20:58:59.735596 IP 112.26.0.8.57358 > 112.26.0.1.34277: Flags [.], ack 12785, win 2817, options [nop,nop,TS val 2730794 ecr 2950224,nop,nop,sack 2 {25817:35953}{37401:48985}], length 0
20:58:59.743315 IP 112.26.0.8.57358 > 112.26.0.1.34277: Flags [.], ack 12785, win 2953, options [nop,nop,TS val 2731103 ecr 2950224,nop,nop,sack 1 {25817:51881}], length 0
20:58:59.746129 IP 112.26.0.8.57358 > 112.26.0.1.34277: Flags [.], ack 12785, win 2953, options [nop,nop,TS val 2731103 ecr 2950224,nop,nop,sack 1 {25817:51881}], length 0
20:58:59.753961 IP 112.26.0.1.34277 > 112.26.0.8.57358: Flags [.], seq 12785:14233, ack 1, win 227, options [nop,nop,TS val 2952621 ecr 2730395], length 1448
20:58:59.754148 IP 112.26.0.1.34277 > 112.26.0.8.57358: Flags [.], seq 12785:14233, ack 1, win 227, options [nop,nop,TS val 2952621 ecr 2730395], length 1448
20:58:59.816663 IP 112.26.0.8.57358 > 112.26.0.1.34277: Flags [.], ack 12785, win 2862, options [nop,nop,TS val 2730971 ecr 2950224,nop,nop,sack 1 {25817:48985}], length 0
20:58:59.821615 IP 112.26.0.8.57358 > 112.26.0.1.34277: Flags [.], ack 51881, win 2998, options [nop,nop,TS val 2731180 ecr 2952621], length 0
20:58:59.823949 IP 112.26.0.8.57358 > 112.26.0.1.34277: Flags [.], ack 51881, win 2998, options [nop,nop,TS val 2731180 ecr 2952621], length 0
20:58:59.828227 IP 112.26.0.1.34277 > 112.26.0.8.57358: Flags [.], seq 51881:53329, ack 1, win 227, options [nop,nop,TS val 2952631 ecr 2730478], length 1448
20:58:59.828400 IP 112.26.0.1.34277 > 112.26.0.8.57358: Flags [.], seq 51881:53329, ack 1, win 227, options [nop,nop,TS val 2952631 ecr 2730478], length 1448
20:58:59.846378 IP 112.26.0.1.34277 > 112.26.0.8.57358: Flags [P.], seq 53329:54777, ack 1, win 227, options [nop,nop,TS val 2952719 ecr 2730573], length 1448
20:58:59.846715 IP 112.26.0.1.34277 > 112.26.0.8.57358: Flags [P.], seq 53329:54777, ack 1, win 227, options [nop,nop,TS val 2952719 ecr 2730573], length 1448
20:58:59.853641 IP 112.26.0.8.57358 > 112.26.0.1.34277: Flags [.], ack 12785, win 2908, options [nop,nop,TS val 2731073 ecr 2950224,nop,nop,sack 1 {25817:50433}], length 0
20:58:59.854342 IP 112.26.0.8.57358 > 112.26.0.1.34277: Flags [.], ack 53329, win 3043, options [nop,nop,TS val 2731204 ecr 2952631], length 0
20:58:59.855148 IP 112.26.0.8.57358 > 112.26.0.1.34277: Flags [.], ack 53329, win 3043, options [nop,nop,TS val 2731204 ecr 2952631], length 0
20:58:59.925720 IP 112.26.0.8.57358 > 112.26.0.1.34277: Flags [.], ack 54777, win 3089, options [nop,nop,TS val 2731284 ecr 2952719], length 0
20:58:59.931428 IP 112.26.0.8.57358 > 112.26.0.1.34277: Flags [.], ack 12785, win 2953, options [nop,nop,TS val 2731103 ecr 2950224,nop,nop,sack 1 {25817:51881}], length 0
20:58:59.934714 IP 112.26.0.8.57358 > 112.26.0.1.34277: Flags [.], ack 54777, win 3089, options [nop,nop,TS val 2731284 ecr 2952719], length 0
20:59:00.010866 IP 112.26.0.8.57358 > 112.26.0.1.34277: Flags [.], ack 51881, win 2998, options [nop,nop,TS val 2731180 ecr 2952621], length 0
20:59:00.028068 IP 112.26.0.1.34277 > 112.26.0.8.57358: Flags [.], seq 54777:56225, ack 1, win 227, options [nop,nop,TS val 2953228 ecr 2731180], length 1448
20:59:00.028366 IP 112.26.0.1.34277 > 112.26.0.8.57358: Flags [.], seq 54777:56225, ack 1, win 227, options [nop,nop,TS val 2953228 ecr 2731180], length 1448
20:59:00.030789 IP 112.26.0.8.57358 > 112.26.0.1.34277: Flags [.], ack 56225, win 3134, options [nop,nop,TS val 2731390 ecr 2953228], length 0
20:59:00.037385 IP 112.26.0.8.57358 > 112.26.0.1.34277: Flags [.], ack 56225, win 3134, options [nop,nop,TS val 2731390 ecr 2953228], length 0
20:59:00.045840 IP 112.26.0.8.57358 > 112.26.0.1.34277: Flags [.], ack 53329, win 3043, options [nop,nop,TS val 2731204 ecr 2952631], length 0
20:59:00.117468 IP 112.26.0.8.57358 > 112.26.0.1.34277: Flags [.], ack 54777, win 3089, options [nop,nop,TS val 2731284 ecr 2952719], length 0
20:59:00.121424 IP 112.26.0.1.34277 > 112.26.0.8.57358: Flags [P.], seq 56225:57345, ack 1, win 227, options [nop,nop,TS val 2953228 ecr 2731180], length 1120
20:59:00.121676 IP 112.26.0.1.34277 > 112.26.0.8.57358: Flags [P.], seq 56225:57345, ack 1, win 227, options [nop,nop,TS val 2953228 ecr 2731180], length 1120
20:59:00.125416 IP 112.26.0.8.57358 > 112.26.0.1.34277: Flags [.], ack 57345, win 3179, options [nop,nop,TS val 2731484 ecr 2953228], length 0
20:59:00.129840 IP 112.26.0.8.57358 > 112.26.0.1.34277: Flags [.], ack 57345, win 3179, options [nop,nop,TS val 2731484 ecr 2953228], length 0
20:59:00.148772 IP 112.26.0.8.57358 > 112.26.0.1.34277: Flags [.], ack 56225, win 3134, options [nop,nop,TS val 2731390 ecr 2953228], length 0
20:59:00.154344 IP 112.26.0.1.34277 > 112.26.0.8.57358: Flags [.], seq 57345:58793, ack 1, win 227, options [nop,nop,TS val 2953228 ecr 2731180], length 1448
20:59:00.154627 IP 112.26.0.1.34277 > 112.26.0.8.57358: Flags [.], seq 57345:58793, ack 1, win 227, options [nop,nop,TS val 2953228 ecr 2731180], length 1448
20:59:00.209091 IP 112.26.0.8.57358 > 112.26.0.1.34277: Flags [.], ack 58793, win 3224, options [nop,nop,TS val 2731517 ecr 2953228], length 0
20:59:00.214738 IP 112.26.0.8.57358 > 112.26.0.1.34277: Flags [.], ack 58793, win 3224, options [nop,nop,TS val 2731517 ecr 2953228], length 0
20:59:00.232750 IP 112.26.0.8.57358 > 112.26.0.1.34277: Flags [.], ack 57345, win 3179, options [nop,nop,TS val 2731484 ecr 2953228], length 0
20:59:00.239330 IP 112.26.0.1.34277 > 112.26.0.8.57358: Flags [.], seq 58793:60241, ack 1, win 227, options [nop,nop,TS val 2953228 ecr 2731180], length 1448
20:59:00.239644 IP 112.26.0.1.34277 > 112.26.0.8.57358: Flags [.], seq 58793:60241, ack 1, win 227, options [nop,nop,TS val 2953228 ecr 2731180], length 1448
20:59:00.246584 IP 112.26.0.8.57358 > 112.26.0.1.34277: Flags [.], ack 60241, win 3270, options [nop,nop,TS val 2731604 ecr 2953228], length 0
20:59:00.249237 IP 112.26.0.8.57358 > 112.26.0.1.34277: Flags [.], ack 60241, win 3270, options [nop,nop,TS val 2731604 ecr 2953228], length 0
20:59:00.315042 IP 112.26.0.1.34277 > 112.26.0.8.57358: Flags [.], seq 60241:61689, ack 1, win 227, options [nop,nop,TS val 2953229 ecr 2731180], length 1448
20:59:00.315342 IP 112.26.0.1.34277 > 112.26.0.8.57358: Flags [.], seq 60241:61689, ack 1, win 227, options [nop,nop,TS val 2953229 ecr 2731180], length 1448
20:59:00.322980 IP 112.26.0.8.57358 > 112.26.0.1.34277: Flags [.], ack 61689, win 3315, options [nop,nop,TS val 2731678 ecr 2953229], length 0
20:59:00.328036 IP 112.26.0.8.57358 > 112.26.0.1.34277: Flags [.], ack 58793, win 3224, options [nop,nop,TS val 2731517 ecr 2953228], length 0
20:59:00.332514 IP 112.26.0.8.57358 > 112.26.0.1.34277: Flags [.], ack 61689, win 3315, options [nop,nop,TS val 2731678 ecr 2953229], length 0
20:59:00.351874 IP 112.26.0.8.57358 > 112.26.0.1.34277: Flags [.], ack 60241, win 3270, options [nop,nop,TS val 2731604 ecr 2953228], length 0
20:59:00.353161 IP 112.26.0.1.34277 > 112.26.0.8.57358: Flags [.], seq 61689:63137, ack 1, win 227, options [nop,nop,TS val 2953229 ecr 2731180], length 1448
20:59:00.353433 IP 112.26.0.1.34277 > 112.26.0.8.57358: Flags [.], seq 61689:63137, ack 1, win 227, options [nop,nop,TS val 2953229 ecr 2731180], length 1448
20:59:00.408026 IP 112.26.0.8.57358 > 112.26.0.1.34277: Flags [.], ack 63137, win 3360, options [nop,nop,TS val 2731766 ecr 2953229], length 0
20:59:00.426404 IP 112.26.0.1.34277 > 112.26.0.8.57358: Flags [.], seq 63137:64585, ack 1, win 227, options [nop,nop,TS val 2953229 ecr 2731180], length 1448
20:59:00.426684 IP 112.26.0.1.34277 > 112.26.0.8.57358: Flags [.], seq 63137:64585, ack 1, win 227, options [nop,nop,TS val 2953229 ecr 2731180], length 1448
20:59:00.433585 IP 112.26.0.8.57358 > 112.26.0.1.34277: Flags [.], ack 63137, win 3360, options [nop,nop,TS val 2731766 ecr 2953229], length 0
20:59:00.436950 IP 112.26.0.8.57358 > 112.26.0.1.34277: Flags [.], ack 61689, win 3315, options [nop,nop,TS val 2731678 ecr 2953229], length 0
20:59:00.444571 IP 112.26.0.8.57358 > 112.26.0.1.34277: Flags [.], ack 64585, win 3405, options [nop,nop,TS val 2731805 ecr 2953229], length 0
20:59:00.508008 IP 112.26.0.8.57358 > 112.26.0.1.34277: Flags [.], ack 64585, win 3405, options [nop,nop,TS val 2731805 ecr 2953229], length 0
