20:58:56.366968 IP 112.26.0.8.57358 > 112.26.0.1.34277: Flags [S], seq 3611240214, win 65535, options [mss 1460,sackOK,TS val 2727727 ecr 0,nop,wscale 6], length 0
20:58:56.383681 IP 112.26.0.8.57358 > 112.26.0.1.34277: Flags [S], seq 3611240214, win 65535, options [mss 1460,sackOK,TS val 2727727 ecr 0,nop,wscale 6], length 0
20:58:56.993257 IP 112.26.0.1.34277 > 112.26.0.8.57358: Flags [S.], seq 2503003956, ack 3611240215, win 28960, options [mss 1460,sackOK,TS val 2950043 ecr 2727727,nop,wscale 7], length 0
20:58:56.993618 IP 112.26.0.8.57358 > 112.26.0.1.34277: Flags [.], ack 1, win 1369, options [nop,nop,TS val 2728354 ecr 2950043], length 0
20:58:56.996734 IP 112.26.0.8.57358 > 112.26.0.1.34277: Flags [.], ack 1, win 1369, options [nop,nop,TS val 2728354 ecr 2950043], length 0
20:58:57.118511 IP 112.26.0.1.34277 > 112.26.0.8.57358: Flags [.], seq 1:1449, ack 1, win 227, options [nop,nop,TS val 2950223 ecr 2728354], length 1448
20:58:57.118791 IP 112.26.0.8.57358 > 112.26.0.1.34277: Flags [.], ack 1449, win 1414, options [nop,nop,TS val 2728479 ecr 2950223], length 0
20:58:57.123487 IP 112.26.0.8.57358 > 112.26.0.1.34277: Flags [.], ack 1449, win 1414, options [nop,nop,TS val 2728479 ecr 2950223], length 0
20:58:57.200996 IP 112.26.0.1.34277 > 112.26.0.8.57358: Flags [.], seq 1449:2897, ack 1, win 227, options [nop,nop,TS val 2950223 ecr 2728354], length 1448
20:58:57.201183 IP 112.26.0.8.57358 > 112.26.0.1.34277: Flags [.], ack 2897, win 1460, options [nop,nop,TS val 2728562 ecr 2950223], length 0
20:58:57.210786 IP 112.26.0.8.57358 > 112.26.0.1.34277: Flags [.], ack 2897, win 1460, options [nop,nop,TS val 2728562 ecr 2950223], length 0
20:58:57.298119 IP 112.26.0.1.34277 > 112.26.0.8.57358: Flags [P.], seq 2897:4097, ack 1, win 227, options [nop,nop,TS val 2950223 ecr 2728354], length 1200
20:58:57.298268 IP 112.26.0.8.57358 > 112.26.0.1.34277: Flags [.], ack 4097, win 1505, options [nop,nop,TS val 2728659 ecr 2950223], length 0
20:58:57.300721 IP 112.26.0.8.57358 > 112.26.0.1.34277: Flags [.], ack 4097, win 1505, options [nop,nop,TS val 2728659 ecr 2950223], length 0
20:58:57.331367 IP 112.26.0.1.34277 > 112.26.0.8.57358: Flags [.], seq 4097:5545, ack 1, win 227, options [nop,nop,TS val 2950223 ecr 2728354], length 1448
20:58:57.331526 IP 112.26.0.8.57358 > 112.26.0.1.34277: Flags [.], ack 5545, win 1550, options [nop,nop,TS val 2728692 ecr 2950223], length 0
20:58:57.337129 IP 112.26.0.8.57358 > 112.26.0.1.34277: Flags [.], ack 5545, win 1550, options [nop,nop,TS val 2728692 ecr 2950223], length 0
20:58:57.418823 IP 112.26.0.1.34277 > 112.26.0.8.57358: Flags [.], seq 5545:6993, ack 1, win 227, options [nop,nop,TS val 2950223 ecr 2728354], length 1448
20:58:57.419032 IP 112.26.0.8.57358 > 112.26.0.1.34277: Flags [.], ack 6993, win 1595, options [nop,nop,TS val 2728779 ecr 2950223], length 0
20:58:57.421695 IP 112.26.0.8.57358 > 112.26.0.1.34277: Flags [.], ack 6993, win 1595, options [nop,nop,TS val 2728779 ecr 2950223], length 0
20:58:57.519218 IP 112.26.0.1.34277 > 112.26.0.8.57358: Flags [.], seq 6993:8441, ack 1, win 227, options [nop,nop,TS val 2950223 ecr 2728354], length 1448
20:58:57.519404 IP 112.26.0.8.57358 > 112.26.0.1.34277: Flags [.], ack 8441, win 1641, options [nop,nop,TS val 2728880 ecr 2950223], length 0
20:58:57.525970 IP 112.26.0.8.57358 > 112.26.0.1.34277: Flags [.], ack 8441, win 1641, options [nop,nop,TS val 2728880 ecr 2950223], length 0
20:58:57.628089 IP 112.26.0.1.34277 > 112.26.0.8.57358: Flags [.], seq 8441:9889, ack 1, win 227, options [nop,nop,TS val 2950223 ecr 2728354], length 1448
20:58:57.628280 IP 112.26.0.8.57358 > 112.26.0.1.34277: Flags [.], ack 9889, win 1686, options [nop,nop,TS val 2728989 ecr 2950223], length 0
20:58:57.719632 IP 112.26.0.1.34277 > 112.26.0.8.57358: Flags [.], seq 9889:11337, ack 1, win 227, options [nop,nop,TS val 2950223 ecr 2728354], length 1448
20:58:57.719788 IP 112.26.0.8.57358 > 112.26.0.1.34277: Flags [.], ack 11337, win 1731, options [nop,nop,TS val 2729080 ecr 2950223], length 0
20:58:57.723979 IP 112.26.0.8.57358 > 112.26.0.1.34277: Flags [.], ack 9889, win 1686, options [nop,nop,TS val 2728989 ecr 2950223], length 0
20:58:57.806991 IP 112.26.0.1.34277 > 112.26.0.8.57358: Flags [.], seq 11337:12785, ack 1, win 227, options [nop,nop,TS val 2950224 ecr 2728354], length 1448
20:58:57.807192 IP 112.26.0.8.57358 > 112.26.0.1.34277: Flags [.], ack 12785, win 1776, options [nop,nop,TS val 2729167 ecr 2950224], length 0
20:58:57.845258 IP 112.26.0.8.57358 > 112.26.0.1.34277: Flags [.], ack 11337, win 1731, options [nop,nop,TS val 2729080 ecr 2950223], length 0
20:58:57.913373 IP 112.26.0.1.34277 > 112.26.0.8.57358: Flags [.], seq 14233:15681, ack 1, win 227, options [nop,nop,TS val 2950346 ecr 2728479], length 1448
20:58:57.913580 IP 112.26.0.8.57358 > 112.26.0.1.34277: Flags [.], ack 12785, win 1822, options [nop,nop,TS val 2729274 ecr 2950224,nop,nop,sack 1 {14233:15681}], length 0
20:58:57.938251 IP 112.26.0.8.57358 > 112.26.0.1.34277: Flags [.], ack 12785, win 1776, options [nop,nop,TS val 2729167 ecr 2950224], length 0
20:58:58.012687 IP 112.26.0.8.57358 > 112.26.0.1.34277: Flags [.], ack 12785, win 1822, options [nop,nop,TS val 2729274 ecr 2950224,nop,nop,sack 1 {14233:15681}], length 0
20:58:58.018126 IP 112.26.0.1.34277 > 112.26.0.8.57358: Flags [.], seq 15681:17129, ack 1, win 227, options [nop,nop,TS val 2950346 ecr 2728479], length 1448
20:58:58.018312 IP 112.26.0.8.57358 > 112.26.0.1.34277: Flags [.], ack 12785, win 1867, options [nop,nop,TS val 2729379 ecr 2950224,nop,nop,sack 1 {14233:17129}], length 0
20:58:58.040921 IP 112.26.0.8.57358 > 112.26.0.1.34277: Flags [.], ack 12785, win 1867, options [nop,nop,TS val 2729379 ecr 2950224,nop,nop,sack 1 {14233:17129}], length 0
20:58:58.103073 IP 112.26.0.1.34277 > 112.26.0.8.57358: Flags [.], seq 17129:18577, ack 1, win 227, options [nop,nop,TS val 2950505 ecr 2728562], length 1448
20:58:58.103317 IP 112.26.0.8.57358 > 112.26.0.1.34277: Flags [.], ack 12785, win 1912, options [nop,nop,TS val 2729463 ecr 2950224,nop,nop,sack 1 {14233:18577}], length 0
20:58:58.130876 IP 112.26.0.8.57358 > 112.26.0.1.34277: Flags [.], ack 12785, win 1912, options [nop,nop,TS val 2729463 ecr 2950224,nop,nop,sack 1 {14233:18577}], length 0
20:58:58.139516 IP 112.26.0.1.34277 > 112.26.0.8.57358: Flags [.], seq 18577:20025, ack 1, win 227, options [nop,nop,TS val 2950505 ecr 2728562], length 1448
20:58:58.139708 IP 112.26.0.8.57358 > 112.26.0.1.34277: Flags [.], ack 12785, win 1957, options [nop,nop,TS val 2729500 ecr 2950224,nop,nop,sack 1 {14233:20025}], length 0
20:58:58.191099 IP 112.26.0.8.57358 > 112.26.0.1.34277: Flags [.], ack 12785, win 1957, options [nop,nop,TS val 2729500 ecr 2950224,nop,nop,sack 1 {14233:20025}], length 0
20:58:58.212909 IP 112.26.0.1.34277 > 112.26.0.8.57358: Flags [.], seq 20025:21473, ack 1, win 227, options [nop,nop,TS val 2950542 ecr 2728659], length 1448
20:58:58.213096 IP 112.26.0.8.57358 > 112.26.0.1.34277: Flags [.], ack 12785, win 2003, options [nop,nop,TS val 2729573 ecr 2950224,nop,nop,sack 1 {14233:21473}], length 0
20:58:58.215632 IP 112.26.0.8.57358 > 112.26.0.1.34277: Flags [.], ack 12785, win 2003, options [nop,nop,TS val 2729573 ecr 2950224,nop,nop,sack 1 {14233:21473}], length 0
20:58:58.243106 IP 112.26.0.1.34277 > 112.26.0.8.57358: Flags [.], seq 21473:22921, ack 1, win 227, options [nop,nop,TS val 2950542 ecr 2728659], length 1448
20:58:58.243293 IP 112.26.0.8.57358 > 112.26.0.1.34277: Flags [.], ack 12785, win 2048, options [nop,nop,TS val 2729603 ecr 2950224,nop,nop,sack 1 {14233:22921}], length 0
20:58:58.291150 IP 112.26.0.8.57358 > 112.26.0.1.34277: Flags [.], ack 12785, win 2048, options [nop,nop,TS val 2729603 ecr 2950224,nop,nop,sack 1 {14233:22921}], length 0
20:58:58.314901 IP 112.26.0.1.34277 > 112.26.0.8.57358: Flags [.], seq 22921:24369, ack 1, win 227, options [nop,nop,TS val 2950620 ecr 2728692], length 1448
20:58:58.315088 IP 112.26.0.8.57358 > 112.26.0.1.34277: Flags [.], ack 12785, win 2093, options [nop,nop,TS val 2729675 ecr 2950224,nop,nop,sack 1 {14233:24369}], length 0
20:58:58.320677 IP 112.26.0.8.57358 > 112.26.0.1.34277: Flags [.], ack 12785, win 2093, options [nop,nop,TS val 2729675 ecr 2950224,nop,nop,sack 1 {14233:24369}], length 0
20:58:58.400181 IP 112.26.0.1.34277 > 112.26.0.8.57358: Flags [.], seq 24369:25817, ack 1, win 227, options [nop,nop,TS val 2950620 ecr 2728692], length 1448
20:58:58.400386 IP 112.26.0.8.57358 > 112.26.0.1.34277: Flags [.], ack 12785, win 2138, options [nop,nop,TS val 2729760 ecr 2950224,nop,nop,sack 1 {14233:25817}], length 0
20:58:58.405940 IP 112.26.0.8.57358 > 112.26.0.1.34277: Flags [.], ack 12785, win 2138, options [nop,nop,TS val 2729760 ecr 2950224,nop,nop,sack 1 {14233:25817}], length 0
20:58:58.437159 IP 112.26.0.1.34277 > 112.26.0.8.57358: Flags [.], seq 27265:28713, ack 1, win 227, options [nop,nop,TS val 2950716 ecr 2728779], length 1448
20:58:58.437344 IP 112.26.0.8.57358 > 112.26.0.1.34277: Flags [.], ack 12785, win 2184, options [nop,nop,TS val 2729797 ecr 2950224,nop,nop,sack 2 {27265:28713}{14233:25817}], length 0
20:58:58.506108 IP 112.26.0.8.57358 > 112.26.0.1.34277: Flags [.], ack 12785, win 2184, options [nop,nop,TS val 2729797 ecr 2950224,nop,nop,sack 2 {27265:28713}{14233:25817}], length 0
20:58:58.522123 IP 112.26.0.1.34277 > 112.26.0.8.57358: Flags [.], seq 28713:30161, ack 1, win 227, options [nop,nop,TS val 2950745 ecr 2728880], length 1448
20:58:58.522289 IP 112.26.0.8.57358 > 112.26.0.1.34277: Flags [.], ack 12785, win 2229, options [nop,nop,TS val 2729882 ecr 2950224,nop,nop,sack 2 {27265:30161}{14233:25817}], length 0
20:58:58.539191 IP 112.26.0.8.57358 > 112.26.0.1.34277: Flags [.], ack 12785, win 2229, options [nop,nop,TS val 2729882 ecr 2950224,nop,nop,sack 2 {27265:30161}{14233:25817}], length 0
20:58:58.608111 IP 112.26.0.1.34277 > 112.26.0.8.57358: Flags [.], seq 31609:33057, ack 1, win 227, options [nop,nop,TS val 2950945 ecr 2728989], length 1448
20:58:58.608299 IP 112.26.0.8.57358 > 112.26.0.1.34277: Flags [.], ack 12785, win 2274, options [nop,nop,TS val 2729969 ecr 2950224,nop,nop,sack 3 {31609:33057}{27265:30161}{14233:25817}], length 0
20:58:58.631853 IP 112.26.0.8.57358 > 112.26.0.1.34277: Flags [.], ack 12785, win 2274, options [nop,nop,TS val 2729969 ecr 2950224,nop,nop,sack 3 {31609:33057}{27265:30161}{14233:25817}], length 0
20:58:58.650431 IP 112.26.0.1.34277 > 112.26.0.8.57358: Flags [.], seq 34505:35953, ack 1, win 227, options [nop,nop,TS val 2951248 ecr 2729080], length 1448
20:58:58.650656 IP 112.26.0.8.57358 > 112.26.0.1.34277: Flags [.], ack 12785, win 2319, options [nop,nop,TS val 2730011 ecr 2950224,nop,nop,sack 3 {34505:35953}{31609:33057}{27265:30161}], length 0
20:58:58.706407 IP 112.26.0.8.57358 > 112.26.0.1.34277: Flags [.], ack 12785, win 2319, options [nop,nop,TS val 2730011 ecr 2950224,nop,nop,sack 3 {34505:35953}{31609:33057}{27265:30161}], length 0
20:58:58.802964 IP 112.26.0.1.34277 > 112.26.0.8.57358: Flags [.], seq 37401:38849, ack 1, win 227, options [nop,nop,TS val 2951364 ecr 2729167], length 1448
20:58:58.803246 IP 112.26.0.8.57358 > 112.26.0.1.34277: Flags [.], ack 12785, win 2365, options [nop,nop,TS val 2730164 ecr 2950224,nop,nop,sack 3 {37401:38849}{34505:35953}{31609:33057}], length 0
20:58:58.807713 IP 112.26.0.8.57358 > 112.26.0.1.34277: Flags [.], ack 12785, win 2365, options [nop,nop,TS val 2730164 ecr 2950224,nop,nop,sack 3 {37401:38849}{34505:35953}{31609:33057}], length 0
20:58:58.836351 IP 112.26.0.1.34277 > 112.26.0.8.57358: Flags [.], seq 38849:40297, ack 1, win 227, options [nop,nop,TS val 2951364 ecr 2729167], length 1448
20:58:58.836549 IP 112.26.0.8.57358 > 112.26.0.1.34277: Flags [.], ack 12785, win 2410, options [nop,nop,TS val 2730197 ecr 2950224,nop,nop,sack 3 {37401:40297}{34505:35953}{31609:33057}], length 0
20:58:58.839673 IP 112.26.0.8.57358 > 112.26.0.1.34277: Flags [.], ack 12785, win 2410, options [nop,nop,TS val 2730197 ecr 2950224,nop,nop,sack 3 {37401:40297}{34505:35953}{31609:33057}], length 0
20:58:58.930238 IP 112.26.0.1.34277 > 112.26.0.8.57358: Flags [.], seq 40297:41745, ack 1, win 227, options [nop,nop,TS val 2951457 ecr 2729274], length 1448
20:58:58.930424 IP 112.26.0.8.57358 > 112.26.0.1.34277: Flags [.], ack 12785, win 2455, options [nop,nop,TS val 2730291 ecr 2950224,nop,nop,sack 3 {37401:41745}{34505:35953}{31609:33057}], length 0
20:58:58.935537 IP 112.26.0.8.57358 > 112.26.0.1.34277: Flags [.], ack 12785, win 2455, options [nop,nop,TS val 2730291 ecr 2950224,nop,nop,sack 3 {37401:41745}{34505:35953}{31609:33057}], length 0
20:58:59.007931 IP 112.26.0.1.34277 > 112.26.0.8.57358: Flags [.], seq 41745:43193, ack 1, win 227, options [nop,nop,TS val 2951551 ecr 2729379], length 1448
20:58:59.008098 IP 112.26.0.8.57358 > 112.26.0.1.34277: Flags [.], ack 12785, win 2500, options [nop,nop,TS val 2730369 ecr 2950224,nop,nop,sack 3 {37401:43193}{34505:35953}{31609:33057}], length 0
20:58:59.015692 IP 112.26.0.8.57358 > 112.26.0.1.34277: Flags [.], ack 12785, win 2500, options [nop,nop,TS val 2730369 ecr 2950224,nop,nop,sack 3 {37401:43193}{34505:35953}{31609:33057}], length 0
20:58:59.034633 IP 112.26.0.1.34277 > 112.26.0.8.57358: Flags [.], seq 43193:44641, ack 1, win 227, options [nop,nop,TS val 2951726 ecr 2729500], length 1448
20:58:59.034835 IP 112.26.0.8.57358 > 112.26.0.1.34277: Flags [.], ack 12785, win 2546, options [nop,nop,TS val 2730395 ecr 2950224,nop,nop,sack 3 {37401:44641}{34505:35953}{31609:33057}], length 0
20:58:59.098391 IP 112.26.0.8.57358 > 112.26.0.1.34277: Flags [.], ack 12785, win 2546, options [nop,nop,TS val 2730395 ecr 2950224,nop,nop,sack 3 {37401:44641}{34505:35953}{31609:33057}], length 0
20:58:59.117016 IP 112.26.0.1.34277 > 112.26.0.8.57358: Flags [.], seq 44641:46089, ack 1, win 227, options [nop,nop,TS val 2951822 ecr 2729573], length 1448
20:58:59.117235 IP 112.26.0.8.57358 > 112.26.0.1.34277: Flags [.], ack 12785, win 2591, options [nop,nop,TS val 2730478 ecr 2950224,nop,nop,sack 3 {37401:46089}{34505:35953}{31609:33057}], length 0
20:58:59.140194 IP 112.26.0.8.57358 > 112.26.0.1.34277: Flags [.], ack 12785, win 2591, options [nop,nop,TS val 2730478 ecr 2950224,nop,nop,sack 3 {37401:46089}{34505:35953}{31609:33057}], length 0
20:58:59.212328 IP 112.26.0.1.34277 > 112.26.0.8.57358: Flags [.], seq 46089:47537, ack 1, win 227, options [nop,nop,TS val 2951931 ecr 2729675], length 1448
20:58:59.212533 IP 112.26.0.8.57358 > 112.26.0.1.34277: Flags [.], ack 12785, win 2636, options [nop,nop,TS val 2730573 ecr 2950224,nop,nop,sack 3 {37401:47537}{34505:35953}{31609:33057}], length 0
20:58:59.218874 IP 112.26.0.8.57358 > 112.26.0.1.34277: Flags [.], ack 12785, win 2636, options [nop,nop,TS val 2730573 ecr 2950224,nop,nop,sack 3 {37401:47537}{34505:35953}{31609:33057}], length 0
20:58:59.243890 IP 112.26.0.1.34277 > 112.26.0.8.57358: Flags [.], seq 47537:48985, ack 1, win 227, options [nop,nop,TS val 2951949 ecr 2729760], length 1448
20:58:59.244060 IP 112.26.0.8.57358 > 112.26.0.1.34277: Flags [.], ack 12785, win 2681, options [nop,nop,TS val 2730604 ecr 2950224,nop,nop,sack 3 {37401:48985}{34505:35953}{31609:33057}], length 0
20:58:59.249532 IP 112.26.0.8.57358 > 112.26.0.1.34277: Flags [.], ack 12785, win 2681, options [nop,nop,TS val 2730604 ecr 2950224,nop,nop,sack 3 {37401:48985}{34505:35953}{31609:33057}], length 0
20:58:59.309988 IP 112.26.0.1.34277 > 112.26.0.8.57358: Flags [.], seq 25817:27265, ack 1, win 227, options [nop,nop,TS val 2952135 ecr 2729882], length 1448
20:58:59.310171 IP 112.26.0.8.57358 > 112.26.0.1.34277: Flags [.], ack 12785, win 2727, options [nop,nop,TS val 2730670 ecr 2950224,nop,nop,sack 3 {25817:30161}{37401:48985}{34505:35953}], length 0
20:58:59.324369 IP 112.26.0.8.57358 > 112.26.0.1.34277: Flags [.], ack 12785, win 2727, options [nop,nop,TS val 2730670 ecr 2950224,nop,nop,sack 3 {25817:30161}{37401:48985}{34505:35953}], length 0
20:58:59.339213 IP 112.26.0.1.34277 > 112.26.0.8.57358: Flags [.], seq 30161:31609, ack 1, win 227, options [nop,nop,TS val 2952237 ecr 2730011], length 1448
20:58:59.339401 IP 112.26.0.8.57358 > 112.26.0.1.34277: Flags [.], ack 12785, win 2772, options [nop,nop,TS val 2730700 ecr 2950224,nop,nop,sack 3 {25817:33057}{37401:48985}{34505:35953}], length 0
20:58:59.412728 IP 112.26.0.8.57358 > 112.26.0.1.34277: Flags [.], ack 12785, win 2772, options [nop,nop,TS val 2730700 ecr 2950224,nop,nop,sack 3 {25817:33057}{37401:48985}{34505:35953}], length 0
20:58:59.433520 IP 112.26.0.1.34277 > 112.26.0.8.57358: Flags [.], seq 33057:34505, ack 1, win 227, options [nop,nop,TS val 2952264 ecr 2730164], length 1448
20:58:59.433687 IP 112.26.0.8.57358 > 112.26.0.1.34277: Flags [.], ack 12785, win 2817, options [nop,nop,TS val 2730794 ecr 2950224,nop,nop,sack 2 {25817:35953}{37401:48985}], length 0
20:58:59.437412 IP 112.26.0.8.57358 > 112.26.0.1.34277: Flags [.], ack 12785, win 2817, options [nop,nop,TS val 2730794 ecr 2950224,nop,nop,sack 2 {25817:35953}{37401:48985}], length 0
20:58:59.610660 IP 112.26.0.1.34277 > 112.26.0.8.57358: Flags [.], seq 35953:37401, ack 1, win 227, options [nop,nop,TS val 2952417 ecr 2730197], length 1448
20:58:59.610844 IP 112.26.0.8.57358 > 112.26.0.1.34277: Flags [.], ack 12785, win 2862, options [nop,nop,TS val 2730971 ecr 2950224,nop,nop,sack 1 {25817:48985}], length 0
20:58:59.615716 IP 112.26.0.8.57358 > 112.26.0.1.34277: Flags [.], ack 12785, win 2862, options [nop,nop,TS val 2730971 ecr 2950224,nop,nop,sack 1 {25817:48985}], length 0
20:58:59.712314 IP 112.26.0.1.34277 > 112.26.0.8.57358: Flags [.], seq 48985:50433, ack 1, win 227, options [nop,nop,TS val 2952455 ecr 2730291], length 1448
20:58:59.712482 IP 112.26.0.8.57358 > 112.26.0.1.34277: Flags [.], ack 12785, win 2908, options [nop,nop,TS val 2731073 ecr 2950224,nop,nop,sack 1 {25817:50433}], length 0
20:58:59.720045 IP 112.26.0.8.57358 > 112.26.0.1.34277: Flags [.], ack 12785, win 2908, options [nop,nop,TS val 2731073 ecr 2950224,nop,nop,sack 1 {25817:50433}], length 0
20:58:59.742434 IP 112.26.0.1.34277 > 112.26.0.8.57358: Flags [.], seq 50433:51881, ack 1, win 227, options [nop,nop,TS val 2952533 ecr 2730369], length 1448
20:58:59.742601 IP 112.26.0.8.57358 > 112.26.0.1.34277: Flags [.], ack 12785, win 2953, options [nop,nop,TS val 2731103 ecr 2950224,nop,nop,sack 1 {25817:51881}], length 0
20:58:59.746354 IP 112.26.0.8.57358 > 112.26.0.1.34277: Flags [.], ack 12785, win 2953, options [nop,nop,TS val 2731103 ecr 2950224,nop,nop,sack 1 {25817:51881}], length 0
20:58:59.819588 IP 112.26.0.1.34277 > 112.26.0.8.57358: Flags [.], seq 12785:14233, ack 1, win 227, options [nop,nop,TS val 2952621 ecr 2730395], length 1448
20:58:59.819813 IP 112.26.0.8.57358 > 112.26.0.1.34277: Flags [.], ack 51881, win 2998, options [nop,nop,TS val 2731180 ecr 2952621], length 0
20:58:59.822887 IP 112.26.0.8.57358 > 112.26.0.1.34277: Flags [.], ack 51881, win 2998, options [nop,nop,TS val 2731180 ecr 2952621], length 0
20:58:59.843541 IP 112.26.0.1.34277 > 112.26.0.8.57358: Flags [.], seq 51881:53329, ack 1, win 227, options [nop,nop,TS val 2952631 ecr 2730478], length 1448
20:58:59.843725 IP 112.26.0.8.57358 > 112.26.0.1.34277: Flags [.], ack 53329, win 3043, options [nop,nop,TS val 2731204 ecr 2952631], length 0
20:58:59.850280 IP 112.26.0.8.57358 > 112.26.0.1.34277: Flags [.], ack 53329, win 3043, options [nop,nop,TS val 2731204 ecr 2952631], length 0
20:58:59.923228 IP 112.26.0.1.34277 > 112.26.0.8.57358: Flags [P.], seq 53329:54777, ack 1, win 227, options [nop,nop,TS val 2952719 ecr 2730573], length 1448
20:58:59.923447 IP 112.26.0.8.57358 > 112.26.0.1.34277: Flags [.], ack 54777, win 3089, options [nop,nop,TS val 2731284 ecr 2952719], length 0
20:58:59.934938 IP 112.26.0.8.57358 > 112.26.0.1.34277: Flags [.], ack 54777, win 3089, options [nop,nop,TS val 2731284 ecr 2952719], length 0
20:59:00.029902 IP 112.26.0.1.34277 > 112.26.0.8.57358: Flags [.], seq 54777:56225, ack 1, win 227, options [nop,nop,TS val 2953228 ecr 2731180], length 1448
20:59:00.030063 IP 112.26.0.8.57358 > 112.26.0.1.34277: Flags [.], ack 56225, win 3134, options [nop,nop,TS val 2731390 ecr 2953228], length 0
20:59:00.032270 IP 112.26.0.8.57358 > 112.26.0.1.34277: Flags [.], ack 56225, win 3134, options [nop,nop,TS val 2731390 ecr 2953228], length 0
20:59:00.122888 IP 112.26.0.1.34277 > 112.26.0.8.57358: Flags [P.], seq 56225:57345, ack 1, win 227, options [nop,nop,TS val 2953228 ecr 2731180], length 1120
20:59:00.123114 IP 112.26.0.8.57358 > 112.26.0.1.34277: Flags [.], ack 57345, win 3179, options [nop,nop,TS val 2731484 ecr 2953228], length 0
20:59:00.126826 IP 112.26.0.8.57358 > 112.26.0.1.34277: Flags [.], ack 57345, win 3179, options [nop,nop,TS val 2731484 ecr 2953228], length 0
20:59:00.156174 IP 112.26.0.1.34277 > 112.26.0.8.57358: Flags [.], seq 57345:58793, ack 1, win 227, options [nop,nop,TS val 2953228 ecr 2731180], length 1448
20:59:00.156358 IP 112.26.0.8.57358 > 112.26.0.1.34277: Flags [.], ack 58793, win 3224, options [nop,nop,TS val 2731517 ecr 2953228], length 0
20:59:00.212694 IP 112.26.0.8.57358 > 112.26.0.1.34277: Flags [.], ack 58793, win 3224, options [nop,nop,TS val 2731517 ecr 2953228], length 0
20:59:00.242999 IP 112.26.0.1.34277 > 112.26.0.8.57358: Flags [.], seq 58793:60241, ack 1, win 227, options [nop,nop,TS val 2953228 ecr 2731180], length 1448
20:59:00.243187 IP 112.26.0.8.57358 > 112.26.0.1.34277: Flags [.], ack 60241, win 3270, options [nop,nop,TS val 2731604 ecr 2953228], length 0
20:59:00.249463 IP 112.26.0.8.57358 > 112.26.0.1.34277: Flags [.], ack 60241, win 3270, options [nop,nop,TS val 2731604 ecr 2953228], length 0
20:59:00.316910 IP 112.26.0.1.34277 > 112.26.0.8.57358: Flags [.], seq 60241:61689, ack 1, win 227, options [nop,nop,TS val 2953229 ecr 2731180], length 1448
20:59:00.317128 IP 112.26.0.8.57358 > 112.26.0.1.34277: Flags [.], ack 61689, win 3315, options [nop,nop,TS val 2731678 ecr 2953229], length 0
20:59:00.332739 IP 112.26.0.8.57358 > 112.26.0.1.34277: Flags [.], ack 61689, win 3315, options [nop,nop,TS val 2731678 ecr 2953229], length 0
20:59:00.404992 IP 112.26.0.1.34277 > 112.26.0.8.57358: Flags [.], seq 61689:63137, ack 1, win 227, options [nop,nop,TS val 2953229 ecr 2731180], length 1448
20:59:00.405247 IP 112.26.0.8.57358 > 112.26.0.1.34277: Flags [.], ack 63137, win 3360, options [nop,nop,TS val 2731766 ecr 2953229], length 0
20:59:00.433808 IP 112.26.0.8.57358 > 112.26.0.1.34277: Flags [.], ack 63137, win 3360, options [nop,nop,TS val 2731766 ecr 2953229], length 0
20:59:00.443746 IP 112.26.0.1.34277 > 112.26.0.8.57358: Flags [.], seq 63137:64585, ack 1, win 227, options [nop,nop,TS val 2953229 ecr 2731180], length 1448
20:59:00.443901 IP 112.26.0.8.57358 > 112.26.0.1.34277: Flags [.], ack 64585, win 3405, options [nop,nop,TS val 2731805 ecr 2953229], length 0
20:59:00.508349 IP 112.26.0.8.57358 > 112.26.0.1.34277: Flags [.], ack 64585, win 3405, options [nop,nop,TS val 2731805 ecr 2953229], length 0
20:59:00.540933 IP 112.26.0.1.34277 > 112.26.0.8.57358: Flags [.], seq 64585:66033, ack 1, win 227, options [nop,nop,TS val 2953229 ecr 2731180], length 1448
20:59:00.541081 IP 112.26.0.8.57358 > 112.26.0.1.34277: Flags [.], ack 66033, win 3451, options [nop,nop,TS val 2731902 ecr 2953229], length 0
20:59:00.559017 IP 112.26.0.8.57358 > 112.26.0.1.34277: Flags [.], ack 66033, win 3451, options [nop,nop,TS val 2731902 ecr 2953229], length 0
20:59:00.633251 IP 112.26.0.1.34277 > 112.26.0.8.57358: Flags [.], seq 66033:67481, ack 1, win 227, options [nop,nop,TS val 2953229 ecr 2731180], length 1448
20:59:00.633445 IP 112.26.0.8.57358 > 112.26.0.1.34277: Flags [.], ack 67481, win 3496, options [nop,nop,TS val 2731994 ecr 2953229], length 0
20:59:00.670968 IP 112.26.0.1.34277 > 112.26.0.8.57358: Flags [.], seq 67481:68929, ack 1, win 227, options [nop,nop,TS val 2953229 ecr 2731180], length 1448
20:59:00.671163 IP 112.26.0.8.57358 > 112.26.0.1.34277: Flags [.], ack 68929, win 3541, options [nop,nop,TS val 2732032 ecr 2953229], length 0
20:59:00.717637 IP 112.26.0.8.57358 > 112.26.0.1.34277: Flags [.], ack 67481, win 3496, options [nop,nop,TS val 2731994 ecr 2953229], length 0
20:59:00.754985 IP 112.26.0.8.57358 > 112.26.0.1.34277: Flags [.], ack 68929, win 3541, options [nop,nop,TS val 2732032 ecr 2953229], length 0
20:59:00.827922 IP 112.26.0.1.34277 > 112.26.0.8.57358: Flags [.], seq 70377:71825, ack 1, win 227, options [nop,nop,TS val 2953263 ecr 2731204], length 1448
20:59:00.828119 IP 112.26.0.8.57358 > 112.26.0.1.34277: Flags [.], ack 68929, win 3586, options [nop,nop,TS val 2732188 ecr 2953229,nop,nop,sack 1 {70377:71825}], length 0
20:59:00.831713 IP 112.26.0.8.57358 > 112.26.0.1.34277: Flags [.], ack 68929, win 3586, options [nop,nop,TS val 2732188 ecr 2953229,nop,nop,sack 1 {70377:71825}], length 0
20:59:00.856164 IP 112.26.0.1.34277 > 112.26.0.8.57358: Flags [.], seq 71825:73273, ack 1, win 227, options [nop,nop,TS val 2953334 ecr 2731284], length 1448
20:59:00.856361 IP 112.26.0.8.57358 > 112.26.0.1.34277: Flags [.], ack 68929, win 3632, options [nop,nop,TS val 2732217 ecr 2953229,nop,nop,sack 1 {70377:73273}], length 0
20:59:00.913864 IP 112.26.0.8.57358 > 112.26.0.1.34277: Flags [.], ack 68929, win 3632, options [nop,nop,TS val 2732217 ecr 2953229,nop,nop,sack 1 {70377:73273}], length 0
20:59:00.947656 IP 112.26.0.1.34277 > 112.26.0.8.57358: Flags [.], seq 74721:76169, ack 1, win 227, options [nop,nop,TS val 2953450 ecr 2731484], length 1448
20:59:00.947886 IP 112.26.0.8.57358 > 112.26.0.1.34277: Flags [.], ack 68929, win 3677, options [nop,nop,TS val 2732308 ecr 2953229,nop,nop,sack 2 {74721:76169}{70377:73273}], length 0
20:59:01.026136 IP 112.26.0.8.57358 > 112.26.0.1.34277: Flags [.], ack 68929, win 3677, options [nop,nop,TS val 2732308 ecr 2953229,nop,nop,sack 2 {74721:76169}{70377:73273}], length 0
20:59:01.032105 IP 112.26.0.1.34277 > 112.26.0.8.57358: Flags [.], seq 76169:77617, ack 1, win 227, options [nop,nop,TS val 2953450 ecr 2731484], length 1448
20:59:01.032288 IP 112.26.0.8.57358 > 112.26.0.1.34277: Flags [.], ack 68929, win 3722, options [nop,nop,TS val 2732392 ecr 2953229,nop,nop,sack 2 {74721:77617}{70377:73273}], length 0
20:59:01.057151 IP 112.26.0.8.57358 > 112.26.0.1.34277: Flags [.], ack 68929, win 3722, options [nop,nop,TS val 2732392 ecr 2953229,nop,nop,sack 2 {74721:77617}{70377:73273}], length 0
20:59:01.143026 IP 112.26.0.1.34277 > 112.26.0.8.57358: Flags [.], seq 77617:79065, ack 1, win 227, options [nop,nop,TS val 2953545 ecr 2731517], length 1448
20:59:01.143395 IP 112.26.0.8.57358 > 112.26.0.1.34277: Flags [.], ack 68929, win 3767, options [nop,nop,TS val 2732504 ecr 2953229,nop,nop,sack 2 {74721:79065}{70377:73273}], length 0
20:59:01.148183 IP 112.26.0.8.57358 > 112.26.0.1.34277: Flags [.], ack 68929, win 3767, options [nop,nop,TS val 2732504 ecr 2953229,nop,nop,sack 2 {74721:79065}{70377:73273}], length 0
20:59:01.228245 IP 112.26.0.1.34277 > 112.26.0.8.57358: Flags [.], seq 79065:80513, ack 1, win 227, options [nop,nop,TS val 2953569 ecr 2731604], length 1448
20:59:01.228587 IP 112.26.0.8.57358 > 112.26.0.1.34277: Flags [.], ack 68929, win 3813, options [nop,nop,TS val 2732589 ecr 2953229,nop,nop,sack 2 {74721:80513}{70377:73273}], length 0
20:59:01.235315 IP 112.26.0.8.57358 > 112.26.0.1.34277: Flags [.], ack 68929, win 3813, options [nop,nop,TS val 2732589 ecr 2953229,nop,nop,sack 2 {74721:80513}{70377:73273}], length 0
20:59:01.254166 IP 112.26.0.1.34277 > 112.26.0.8.57358: Flags [.], seq 84857:86305, ack 1, win 227, options [nop,nop,TS val 2953830 ecr 2731805], length 1448
20:59:01.254390 IP 112.26.0.8.57358 > 112.26.0.1.34277: Flags [.], ack 68929, win 3858, options [nop,nop,TS val 2732615 ecr 2953229,nop,nop,sack 3 {84857:86305}{74721:80513}{70377:73273}], length 0
20:59:01.262253 IP 112.26.0.8.57358 > 112.26.0.1.34277: Flags [.], ack 68929, win 3858, options [nop,nop,TS val 2732615 ecr 2953229,nop,nop,sack 3 {84857:86305}{74721:80513}{70377:73273}], length 0
20:59:01.270683 IP 112.26.0.1.34277 > 112.26.0.8.57358: Flags [.], seq 80513:81961, ack 1, win 227, options [nop,nop,TS val 2953654 ecr 2731678], length 1448
20:59:01.270881 IP 112.26.0.8.57358 > 112.26.0.1.34277: Flags [.], ack 68929, win 3903, options [nop,nop,TS val 2732631 ecr 2953229,nop,nop,sack 3 {74721:81961}{84857:86305}{70377:73273}], length 0
20:59:01.334121 IP 112.26.0.8.57358 > 112.26.0.1.34277: Flags [.], ack 68929, win 3903, options [nop,nop,TS val 2732631 ecr 2953229,nop,nop,sack 3 {74721:81961}{84857:86305}{70377:73273}], length 0
20:59:01.340340 IP 112.26.0.1.34277 > 112.26.0.8.57358: Flags [.], seq 86305:87753, ack 1, win 227, options [nop,nop,TS val 2953871 ecr 2731902], length 1448
20:59:01.340663 IP 112.26.0.8.57358 > 112.26.0.1.34277: Flags [.], ack 68929, win 3948, options [nop,nop,TS val 2732701 ecr 2953229,nop,nop,sack 3 {84857:87753}{74721:81961}{70377:73273}], length 0
20:59:01.351432 IP 112.26.0.1.34277 > 112.26.0.8.57358: Flags [.], seq 81961:83409, ack 1, win 227, options [nop,nop,TS val 2953654 ecr 2731678], length 1448
20:59:01.351617 IP 112.26.0.8.57358 > 112.26.0.1.34277: Flags [.], ack 68929, win 3994, options [nop,nop,TS val 2732712 ecr 2953229,nop,nop,sack 3 {74721:83409}{84857:87753}{70377:73273}], length 0
20:59:01.372045 IP 112.26.0.8.57358 > 112.26.0.1.34277: Flags [.], ack 68929, win 3948, options [nop,nop,TS val 2732701 ecr 2953229,nop,nop,sack 3 {84857:87753}{74721:81961}{70377:73273}], length 0
20:59:01.426999 IP 112.26.0.1.34277 > 112.26.0.8.57358: Flags [.], seq 87753:89201, ack 1, win 227, options [nop,nop,TS val 2954061 ecr 2731994], length 1448
20:59:01.427219 IP 112.26.0.8.57358 > 112.26.0.1.34277: Flags [.], ack 68929, win 4039, options [nop,nop,TS val 2732788 ecr 2953229,nop,nop,sack 3 {84857:89201}{74721:83409}{70377:73273}], length 0
20:59:01.443080 IP 112.26.0.8.57358 > 112.26.0.1.34277: Flags [.], ack 68929, win 3994, options [nop,nop,TS val 2732712 ecr 2953229,nop,nop,sack 3 {74721:83409}{84857:87753}{70377:73273}], length 0
20:59:01.459718 IP 112.26.0.1.34277 > 112.26.0.8.57358: Flags [.], seq 89201:90649, ack 1, win 227, options [nop,nop,TS val 2954153 ecr 2732032], length 1448
20:59:01.459906 IP 112.26.0.8.57358 > 112.26.0.1.34277: Flags [.], ack 68929, win 4084, options [nop,nop,TS val 2732821 ecr 2953229,nop,nop,sack 3 {84857:90649}{74721:83409}{70377:73273}], length 0
20:59:01.514541 IP 112.26.0.8.57358 > 112.26.0.1.34277: Flags [.], ack 68929, win 4039, options [nop,nop,TS val 2732788 ecr 2953229,nop,nop,sack 3 {84857:89201}{74721:83409}{70377:73273}], length 0
20:59:01.543425 IP 112.26.0.1.34277 > 112.26.0.8.57358: Flags [.], seq 90649:92097, ack 1, win 227, options [nop,nop,TS val 2954153 ecr 2732032], length 1448
20:59:01.543662 IP 112.26.0.8.57358 > 112.26.0.1.34277: Flags [.], ack 68929, win 4129, options [nop,nop,TS val 2732904 ecr 2953229,nop,nop,sack 3 {84857:92097}{74721:83409}{70377:73273}], length 0
20:59:01.550075 IP 112.26.0.8.57358 > 112.26.0.1.34277: Flags [.], ack 68929, win 4084, options [nop,nop,TS val 2732821 ecr 2953229,nop,nop,sack 3 {84857:90649}{74721:83409}{70377:73273}], length 0
20:59:01.627028 IP 112.26.0.8.57358 > 112.26.0.1.34277: Flags [.], ack 68929, win 4129, options [nop,nop,TS val 2732904 ecr 2953229,nop,nop,sack 3 {84857:92097}{74721:83409}{70377:73273}], length 0
20:59:01.630716 IP 112.26.0.1.34277 > 112.26.0.8.57358: Flags [.], seq 92097:93545, ack 1, win 227, options [nop,nop,TS val 2954236 ecr 2732188], length 1448
20:59:01.630874 IP 112.26.0.8.57358 > 112.26.0.1.34277: Flags [.], ack 68929, win 4175, options [nop,nop,TS val 2732992 ecr 2953229,nop,nop,sack 3 {84857:93545}{74721:83409}{70377:73273}], length 0
20:59:01.651152 IP 112.26.0.8.57358 > 112.26.0.1.34277: Flags [.], ack 68929, win 4175, options [nop,nop,TS val 2732992 ecr 2953229,nop,nop,sack 3 {84857:93545}{74721:83409}{70377:73273}], length 0
20:59:01.656123 IP 112.26.0.1.34277 > 112.26.0.8.57358: Flags [.], seq 93545:94993, ack 1, win 227, options [nop,nop,TS val 2954263 ecr 2732217], length 1448
20:59:01.656318 IP 112.26.0.8.57358 > 112.26.0.1.34277: Flags [.], ack 68929, win 4220, options [nop,nop,TS val 2733017 ecr 2953229,nop,nop,sack 3 {84857:94993}{74721:83409}{70377:73273}], length 0
20:59:01.726936 IP 112.26.0.8.57358 > 112.26.0.1.34277: Flags [.], ack 68929, win 4220, options [nop,nop,TS val 2733017 ecr 2953229,nop,nop,sack 3 {84857:94993}{74721:83409}{70377:73273}], length 0
20:59:01.741783 IP 112.26.0.1.34277 > 112.26.0.8.57358: Flags [.], seq 68929:70377, ack 1, win 227, options [nop,nop,TS val 2954291 ecr 2732308], length 1448
20:59:01.742024 IP 112.26.0.8.57358 > 112.26.0.1.34277: Flags [.], ack 73273, win 4265, options [nop,nop,TS val 2733102 ecr 2954291,nop,nop,sack 2 {84857:94993}{74721:83409}], length 0
20:59:01.820713 IP 112.26.0.1.34277 > 112.26.0.8.57358: Flags [.], seq 73273:74721, ack 1, win 227, options [nop,nop,TS val 2954354 ecr 2732392], length 1448
20:59:01.821044 IP 112.26.0.8.57358 > 112.26.0.1.34277: Flags [.], ack 83409, win 4310, options [nop,nop,TS val 2733181 ecr 2954354,nop,nop,sack 1 {84857:94993}], length 0
20:59:01.831399 IP 112.26.0.8.57358 > 112.26.0.1.34277: Flags [.], ack 73273, win 4265, options [nop,nop,TS val 2733102 ecr 2954291,nop,nop,sack 2 {84857:94993}{74721:83409}], length 0
20:59:01.848114 IP 112.26.0.8.57358 > 112.26.0.1.34277: Flags [.], ack 83409, win 4310, options [nop,nop,TS val 2733181 ecr 2954354,nop,nop,sack 1 {84857:94993}], length 0
20:59:01.860017 IP 112.26.0.1.34277 > 112.26.0.8.57358: Flags [.], seq 94993:96441, ack 1, win 227, options [nop,nop,TS val 2954433 ecr 2732504], length 1448
20:59:01.860243 IP 112.26.0.8.57358 > 112.26.0.1.34277: Flags [.], ack 83409, win 4356, options [nop,nop,TS val 2733220 ecr 2954354,nop,nop,sack 1 {84857:96441}], length 0
20:59:01.863268 IP 112.26.0.8.57358 > 112.26.0.1.34277: Flags [.], ack 83409, win 4356, options [nop,nop,TS val 2733220 ecr 2954354,nop,nop,sack 1 {84857:96441}], length 0
20:59:02.072162 IP 112.26.0.1.34277 > 112.26.0.8.57358: Flags [.], seq 80513:81961, ack 1, win 227, options [nop,nop,TS val 2954542 ecr 2732615], length 1448
20:59:02.072395 IP 112.26.0.8.57358 > 112.26.0.1.34277: Flags [.], ack 83409, win 4356, options [nop,nop,TS val 2733433 ecr 2954354,nop,nop,sack 2 {80513:81961}{84857:96441}], length 0
20:59:02.074658 IP 112.26.0.8.57358 > 112.26.0.1.34277: Flags [.], ack 83409, win 4356, options [nop,nop,TS val 2733433 ecr 2954354,nop,nop,sack 2 {80513:81961}{84857:96441}], length 0
20:59:02.147610 IP 112.26.0.1.34277 > 112.26.0.8.57358: Flags [.], seq 81961:83409, ack 1, win 227, options [nop,nop,TS val 2954575 ecr 2732631], length 1448
20:59:02.147841 IP 112.26.0.8.57358 > 112.26.0.1.34277: Flags [.], ack 83409, win 4356, options [nop,nop,TS val 2733509 ecr 2954575,nop,nop,sack 2 {81961:83409}{84857:96441}], length 0
20:59:02.153668 IP 112.26.0.8.57358 > 112.26.0.1.34277: Flags [.], ack 83409, win 4356, options [nop,nop,TS val 2733509 ecr 2954575,nop,nop,sack 2 {81961:83409}{84857:96441}], length 0
20:59:02.226017 IP 112.26.0.1.34277 > 112.26.0.8.57358: Flags [.], seq 83409:84857, ack 1, win 227, options [nop,nop,TS val 2954667 ecr 2732701], length 1448
20:59:02.226304 IP 112.26.0.8.57358 > 112.26.0.1.34277: Flags [.], ack 96441, win 4401, options [nop,nop,TS val 2733587 ecr 2954667], length 0
20:59:02.229758 IP 112.26.0.8.57358 > 112.26.0.1.34277: Flags [.], ack 96441, win 4401, options [nop,nop,TS val 2733587 ecr 2954667], length 0
20:59:02.254612 IP 112.26.0.1.34277 > 112.26.0.8.57358: Flags [.], seq 73273:74721, ack 1, win 227, options [nop,nop,TS val 2954950 ecr 2732788], length 1448
20:59:02.254824 IP 112.26.0.8.57358 > 112.26.0.1.34277: Flags [.], ack 96441, win 4401, options [nop,nop,TS val 2733616 ecr 2954667,nop,nop,sack 1 {73273:74721}], length 0
20:59:02.259216 IP 112.26.0.8.57358 > 112.26.0.1.34277: Flags [.], ack 96441, win 4401, options [nop,nop,TS val 2733616 ecr 2954667,nop,nop,sack 1 {73273:74721}], length 0
20:59:02.341229 IP 112.26.0.1.34277 > 112.26.0.8.57358: Flags [.], seq 90649:92097, ack 1, win 227, options [nop,nop,TS val 2955059 ecr 2732821], length 1448
20:59:02.341408 IP 112.26.0.8.57358 > 112.26.0.1.34277: Flags [.], ack 96441, win 4401, options [nop,nop,TS val 2733702 ecr 2954667,nop,nop,sack 1 {90649:92097}], length 0
20:59:02.345125 IP 112.26.0.8.57358 > 112.26.0.1.34277: Flags [.], ack 96441, win 4401, options [nop,nop,TS val 2733702 ecr 2954667,nop,nop,sack 1 {90649:92097}], length 0
20:59:02.454075 IP 112.26.0.1.34277 > 112.26.0.8.57358: Flags [.], seq 68929:70377, ack 1, win 227, options [nop,nop,TS val 2955191 ecr 2732904], length 1448
20:59:02.454256 IP 112.26.0.8.57358 > 112.26.0.1.34277: Flags [.], ack 96441, win 4401, options [nop,nop,TS val 2733815 ecr 2954667,nop,nop,sack 1 {68929:70377}], length 0
20:59:02.523213 IP 112.26.0.8.57358 > 112.26.0.1.34277: Flags [.], ack 96441, win 4401, options [nop,nop,TS val 2733815 ecr 2954667,nop,nop,sack 1 {68929:70377}], length 0
20:59:02.554179 IP 112.26.0.1.34277 > 112.26.0.8.57358: Flags [.], seq 73273:74721, ack 1, win 227, options [nop,nop,TS val 2955253 ecr 2732992], length 1448
20:59:02.554389 IP 112.26.0.8.57358 > 112.26.0.1.34277: Flags [.], ack 96441, win 4401, options [nop,nop,TS val 2733915 ecr 2954667,nop,nop,sack 1 {73273:74721}], length 0
20:59:02.561814 IP 112.26.0.8.57358 > 112.26.0.1.34277: Flags [.], ack 96441, win 4401, options [nop,nop,TS val 2733915 ecr 2954667,nop,nop,sack 1 {73273:74721}], length 0
20:59:02.634812 IP 112.26.0.1.34277 > 112.26.0.8.57358: Flags [.], seq 83409:84857, ack 1, win 227, options [nop,nop,TS val 2955280 ecr 2733017], length 1448
20:59:02.635001 IP 112.26.0.8.57358 > 112.26.0.1.34277: Flags [.], ack 96441, win 4401, options [nop,nop,TS val 2733996 ecr 2954667,nop,nop,sack 1 {83409:84857}], length 0
20:59:02.637041 IP 112.26.0.8.57358 > 112.26.0.1.34277: Flags [.], ack 96441, win 4401, options [nop,nop,TS val 2733996 ecr 2954667,nop,nop,sack 1 {83409:84857}], length 0
20:59:02.667688 IP 112.26.0.1.34277 > 112.26.0.8.57358: Flags [.], seq 94993:96441, ack 1, win 227, options [nop,nop,TS val 2955453 ecr 2733102], length 1448
20:59:02.667867 IP 112.26.0.8.57358 > 112.26.0.1.34277: Flags [.], ack 96441, win 4401, options [nop,nop,TS val 2734029 ecr 2955453,nop,nop,sack 1 {94993:96441}], length 0
20:59:02.675154 IP 112.26.0.8.57358 > 112.26.0.1.34277: Flags [.], ack 96441, win 4401, options [nop,nop,TS val 2734029 ecr 2955453,nop,nop,sack 1 {94993:96441}], length 0
20:59:02.771880 IP 112.26.0.1.34277 > 112.26.0.8.57358: Flags [.], seq 96441:97889, ack 1, win 227, options [nop,nop,TS val 2955453 ecr 2733102], length 1448
20:59:02.772096 IP 112.26.0.8.57358 > 112.26.0.1.34277: Flags [.], ack 97889, win 4446, options [nop,nop,TS val 2734133 ecr 2955453], length 0
20:59:02.850195 IP 112.26.0.8.57358 > 112.26.0.1.34277: Flags [.], ack 97889, win 4446, options [nop,nop,TS val 2734133 ecr 2955453], length 0
20:59:02.864853 IP 112.26.0.1.34277 > 112.26.0.8.57358: Flags [.], seq 99337:100785, ack 1, win 227, options [nop,nop,TS val 2955545 ecr 2733181], length 1448
20:59:02.865075 IP 112.26.0.8.57358 > 112.26.0.1.34277: Flags [.], ack 97889, win 4491, options [nop,nop,TS val 2734226 ecr 2955453,nop,nop,sack 1 {99337:100785}], length 0
20:59:02.876736 IP 112.26.0.8.57358 > 112.26.0.1.34277: Flags [.], ack 97889, win 4491, options [nop,nop,TS val 2734226 ecr 2955453,nop,nop,sack 1 {99337:100785}], length 0
20:59:02.938977 IP 112.26.0.1.34277 > 112.26.0.8.57358: Flags [.], seq 83409:84857, ack 1, win 227, options [nop,nop,TS val 2955753 ecr 2733433], length 1448
20:59:02.939193 IP 112.26.0.8.57358 > 112.26.0.1.34277: Flags [.], ack 97889, win 4491, options [nop,nop,TS val 2734300 ecr 2955453,nop,nop,sack 2 {83409:84857}{99337:100785}], length 0
20:59:02.953687 IP 112.26.0.8.57358 > 112.26.0.1.34277: Flags [.], ack 97889, win 4491, options [nop,nop,TS val 2734300 ecr 2955453,nop,nop,sack 2 {83409:84857}{99337:100785}], length 0
