16:50:02.716630 IP 112.26.3.8.38285 > 112.26.3.1.targus-getdata1: Flags [S], seq 3557256018, win 65535, options [mss 1460,sackOK,TS val 4294899301 ecr 0,nop,wscale 6,mptcp join id 6 token 0x92d88ed4 nonce 0x3d63e07a], length 0
16:50:02.844098 IP 112.26.3.1.targus-getdata1 > 112.26.3.8.38285: Flags [S.], seq 1336565991, ack 3557256019, win 65535, options [mss 1460,sackOK,TS val 158413 ecr 4294899301,nop,wscale 6,mptcp join id 5 hmac 0x36c4045e39644d1d nonce 0xe22e8b0d], length 0
16:50:02.954335 IP 112.26.3.1.targus-getdata1 > 112.26.3.8.38285: Flags [S.], seq 1336565991, ack 3557256019, win 65535, options [mss 1460,sackOK,TS val 158413 ecr 4294899301,nop,wscale 6,mptcp join id 5 hmac 0x36c4045e39644d1d nonce 0xe22e8b0d], length 0
16:50:03.141586 IP 112.26.3.8.38285 > 112.26.3.1.targus-getdata1: Flags [.], ack 1, win 4107, options [nop,nop,TS val 4294899703 ecr 158413,mptcp join hmac 0xa08a6a9dc53f6f879b9c580133fe53443383777a], length 0
16:50:03.148657 IP 112.26.3.1.targus-getdata1 > 112.26.3.8.38285: Flags [.], ack 1, win 4017, options [nop,nop,TS val 158784 ecr 4294899703,mptcp dss ack 1760099986], length 0
16:50:03.150707 IP 112.26.3.1.targus-getdata1 > 112.26.3.8.38285: Flags [.], ack 1, win 4017, options [nop,nop,TS val 158784 ecr 4294899703,mptcp dss ack 1760099986], length 0
16:50:03.476129 IP 112.26.3.8.58109 > 112.26.3.1.targus-getdata1: Flags [S], seq 944507533, win 65535, options [mss 1460,sackOK,TS val 4294900134 ecr 0,nop,wscale 6,mptcp join id 6 token 0x35a0a174 nonce 0x3f2f9181], length 0
16:50:47.493912 IP 112.26.3.1.targus-getdata1 > 112.26.3.8.58109: Flags [.], ack 945232958, win 24429, options [nop,nop,TS val 203134 ecr 4294943428,mptcp dss ack 1402219831], length 0
16:50:47.536755 IP 112.26.3.1.targus-getdata1 > 112.26.3.8.58109: Flags [.], ack 4294963013, win 24429, options [nop,nop,TS val 202817 ecr 4294943099,mptcp dss ack 1402219831], length 0
16:50:47.538017 IP 112.26.3.1.targus-getdata1 > 112.26.3.8.58109: Flags [.], ack 4294963013, win 24429, options [nop,nop,TS val 202817 ecr 4294943099,mptcp dss ack 1402219831], length 0
16:50:47.558657 IP 112.26.3.8.58109 > 112.26.3.1.targus-getdata1: Flags [.], seq 1:1429, ack 0, win 4107, options [nop,nop,TS val 4294943428 ecr 202138,mptcp dss ack 1818309187 seq 1402284091 subseq 725425 len 1428 csum 0xc887], length 1428
16:50:47.582850 IP 112.26.3.1.targus-getdata1 > 112.26.3.8.58109: Flags [.], ack 4294957301, win 24429, options [nop,nop,TS val 202412 ecr 4294942797,mptcp dss ack 1402219831], length 0
16:50:47.605485 IP 112.26.3.8.58109 > 112.26.3.1.targus-getdata1: Flags [.], seq 1429:2857, ack 0, win 4107, options [nop,nop,TS val 4294943502 ecr 202230,mptcp dss ack 1818309187 seq 1402286947 subseq 726853 len 1428 csum 0x13e4], length 1428
16:50:47.629444 IP 112.26.3.1.targus-getdata1 > 112.26.3.8.58109: Flags [.], ack 4294958729, win 24429, options [nop,nop,TS val 202500 ecr 4294942923,mptcp dss ack 1402219831], length 0
16:50:47.642553 IP 112.26.3.1.targus-getdata1 > 112.26.3.8.58109: Flags [.], ack 2857, win 24429, options [nop,nop,TS val 203280 ecr 4294943428,mptcp dss ack 1402219831], length 0
16:50:47.649741 IP 112.26.3.1.targus-getdata1 > 112.26.3.8.58109: Flags [.], ack 4294957301, win 24429, options [nop,nop,TS val 202412 ecr 4294942797,mptcp dss ack 1402219831], length 0
16:50:47.683443 IP 112.26.3.1.targus-getdata1 > 112.26.3.8.58109: Flags [.], ack 4294958729, win 24429, options [nop,nop,TS val 202500 ecr 4294942923,mptcp dss ack 1402219831], length 0
16:50:47.701855 IP 112.26.3.8.58109 > 112.26.3.1.targus-getdata1: Flags [.], seq 2857:4285, ack 0, win 4107, options [nop,nop,TS val 4294943547 ecr 202316,mptcp dss ack 1818309187 seq 1402288375 subseq 728281 len 1428 csum 0xa82c], length 1428
16:50:47.732168 IP 112.26.3.1.targus-getdata1 > 112.26.3.8.58109: Flags [.], ack 4294964441, win 24429, options [nop,nop,TS val 202910 ecr 4294943225,mptcp dss ack 1402219831], length 0
16:50:47.756391 IP 112.26.3.8.58109 > 112.26.3.1.targus-getdata1: Flags [.], seq 2857:4285, ack 0, win 4107, options [nop,nop,TS val 4294943856 ecr 202316,mptcp dss ack 1818309187 seq 1402288375 subseq 728281 len 1428 csum 0xa82c], length 1428
16:50:47.757615 IP 112.26.3.1.targus-getdata1 > 112.26.3.8.58109: Flags [.], ack 4285, win 24429, options [nop,nop,TS val 203397 ecr 4294943856,nop,nop,sack 1 {2857:4285},mptcp dss ack 1402219831], length 0
16:50:47.842928 IP 112.26.3.1.targus-getdata1 > 112.26.3.8.58109: Flags [.], ack 4294961585, win 24429, options [nop,nop,TS val 202707 ecr 4294943099,mptcp dss ack 1402219831], length 0
16:50:47.886446 IP 112.26.3.1.targus-getdata1 > 112.26.3.8.58109: Flags [.], ack 4294965869, win 24429, options [nop,nop,TS val 202996 ecr 4294943308,mptcp dss ack 1402219831], length 0
16:50:47.949147 IP 112.26.3.1.targus-getdata1 > 112.26.3.8.58109: Flags [.], ack 4294960157, win 24429, options [nop,nop,TS val 202599 ecr 4294942993,mptcp dss ack 1402219831], length 0
16:50:47.975805 IP 112.26.3.1.targus-getdata1 > 112.26.3.8.58109: Flags [.], ack 1, win 24429, options [nop,nop,TS val 203134 ecr 4294943428,mptcp dss ack 1402219831], length 0
16:50:48.010601 IP 112.26.3.1.targus-getdata1 > 112.26.3.8.58109: Flags [.], ack 4294963013, win 24429, options [nop,nop,TS val 202817 ecr 4294943099,mptcp dss ack 1402219831], length 0
16:50:48.027499 IP 112.26.3.1.targus-getdata1 > 112.26.3.8.58109: Flags [.], ack 2857, win 24429, options [nop,nop,TS val 203280 ecr 4294943428,mptcp dss ack 1402219831], length 0
16:50:48.081016 IP 112.26.3.1.targus-getdata1 > 112.26.3.8.58109: Flags [.], ack 4294957301, win 24429, options [nop,nop,TS val 202412 ecr 4294942797,mptcp dss ack 1402219831], length 0
16:50:48.136684 IP 112.26.3.1.targus-getdata1 > 112.26.3.8.58109: Flags [.], ack 4294958729, win 24429, options [nop,nop,TS val 202500 ecr 4294942923,mptcp dss ack 1402219831], length 0
16:50:48.177388 IP 112.26.3.1.targus-getdata1 > 112.26.3.8.58109: Flags [.], ack 4285, win 24429, options [nop,nop,TS val 203397 ecr 4294943856,nop,nop,sack 1 {2857:4285},mptcp dss ack 1402219831], length 0
16:50:48.234443 IP 112.26.3.1.targus-getdata1 > 112.26.3.8.58109: Flags [.], ack 4294964441, win 24429, options [nop,nop,TS val 202910 ecr 4294943225,mptcp dss ack 1402219831], length 0
16:50:48.334418 IP 112.26.3.8.58109 > 112.26.3.1.targus-getdata1: Flags [.], seq 4294955873:4294957301, ack 0, win 4107, options [nop,nop,TS val 4294944960 ecr 202316,mptcp dss ack 1818309187 seq 1402266955 subseq 714001 len 1428 csum 0xfd97], length 1428
16:50:50.495843 IP 112.26.3.8.58109 > 112.26.3.1.targus-getdata1: Flags [.], seq 4294955873:4294957301, ack 0, win 4107, options [nop,nop,TS val 4294947072 ecr 202316,mptcp dss ack 1818309187 seq 1402266955 subseq 714001 len 1428 csum 0xfd97], length 1428
16:50:54.764028 IP 112.26.3.8.58109 > 112.26.3.1.targus-getdata1: Flags [.], seq 4294955873:4294957301, ack 0, win 4107, options [nop,nop,TS val 4294951424 ecr 202316,mptcp dss ack 1818309187 seq 1402266955 subseq 714001 len 1428 csum 0xfd97], length 1428
16:50:54.765229 IP 112.26.3.1.targus-getdata1 > 112.26.3.8.58109: Flags [.], ack 4285, win 24401, options [nop,nop,TS val 210404 ecr 4294943856,nop,nop,sack 1 {4294955873:4294957301},mptcp dss ack 1402291231], length 0
16:50:54.770629 IP 112.26.3.1.targus-getdata1 > 112.26.3.8.58109: Flags [.], ack 4285, win 24401, options [nop,nop,TS val 210404 ecr 4294943856,nop,nop,sack 1 {4294955873:4294957301},mptcp dss ack 1402291231], length 0
16:50:54.850805 IP 112.26.3.8.58109 > 112.26.3.1.targus-getdata1: Flags [.], seq 4285:5713, ack 0, win 4107, options [nop,nop,TS val 4294951436 ecr 210404,mptcp dss ack 1818309187 seq 1402299799 subseq 729709 len 1428 csum 0x1109], length 1428
16:50:54.852348 IP 112.26.3.1.targus-getdata1 > 112.26.3.8.58109: Flags [.], ack 5713, win 24401, options [nop,nop,TS val 210492 ecr 4294951436,mptcp dss ack 1402291231], length 0
16:50:54.870854 IP 112.26.3.1.targus-getdata1 > 112.26.3.8.58109: Flags [.], ack 5713, win 24401, options [nop,nop,TS val 210492 ecr 4294951436,mptcp dss ack 1402291231], length 0
16:50:54.934322 IP 112.26.3.8.58109 > 112.26.3.1.targus-getdata1: Flags [.], seq 5713:7141, ack 0, win 4107, options [nop,nop,TS val 4294951436 ecr 210404,mptcp dss ack 1818309187 seq 1402301227 subseq 731137 len 1428 csum 0x8af6], length 1428
16:50:54.935526 IP 112.26.3.1.targus-getdata1 > 112.26.3.8.58109: Flags [.], ack 7141, win 24401, options [nop,nop,TS val 210575 ecr 4294951436,mptcp dss ack 1402291231], length 0
16:50:54.973006 IP 112.26.3.1.targus-getdata1 > 112.26.3.8.58109: Flags [.], ack 7141, win 24401, options [nop,nop,TS val 210575 ecr 4294951436,mptcp dss ack 1402291231], length 0
16:50:54.988503 IP 112.26.3.8.58109 > 112.26.3.1.targus-getdata1: Flags [.], seq 7141:8569, ack 0, win 4107, options [nop,nop,TS val 4294951436 ecr 210404,mptcp dss ack 1818309187 seq 1402302655 subseq 732565 len 1428 csum 0x4557], length 1428
16:50:54.993237 IP 112.26.3.1.targus-getdata1 > 112.26.3.8.58109: Flags [.], ack 8569, win 24401, options [nop,nop,TS val 210629 ecr 4294951436,mptcp dss ack 1402291231], length 0
16:50:55.062812 IP 112.26.3.8.58109 > 112.26.3.1.targus-getdata1: Flags [.], seq 8569:9997, ack 0, win 4107, options [nop,nop,TS val 4294951436 ecr 210404,mptcp dss ack 1818309187 seq 1402304083 subseq 733993 len 1428 csum 0xb441], length 1428
16:50:55.064189 IP 112.26.3.1.targus-getdata1 > 112.26.3.8.58109: Flags [.], ack 9997, win 24401, options [nop,nop,TS val 210704 ecr 4294951436,mptcp dss ack 1402291231], length 0
16:50:55.082433 IP 112.26.3.1.targus-getdata1 > 112.26.3.8.58109: Flags [.], ack 8569, win 24401, options [nop,nop,TS val 210629 ecr 4294951436,mptcp dss ack 1402291231], length 0
16:50:55.123244 IP 112.26.3.1.targus-getdata1 > 112.26.3.8.58109: Flags [.], ack 9997, win 24401, options [nop,nop,TS val 210704 ecr 4294951436,mptcp dss ack 1402291231], length 0
16:50:55.137145 IP 112.26.3.1.targus-getdata1 > 112.26.3.8.58109: Flags [.], ack 11425, win 24401, options [nop,nop,TS val 210777 ecr 4294951436,mptcp dss ack 1402291231], length 0
16:50:55.139177 IP 112.26.3.8.58109 > 112.26.3.1.targus-getdata1: Flags [.], seq 9997:11425, ack 0, win 4107, options [nop,nop,TS val 4294951436 ecr 210404,mptcp dss ack 1818309187 seq 1402305511 subseq 735421 len 1428 csum 0x4327], length 1428
16:50:55.177228 IP 112.26.3.1.targus-getdata1 > 112.26.3.8.58109: Flags [.], ack 11425, win 24401, options [nop,nop,TS val 210777 ecr 4294951436,mptcp dss ack 1402291231], length 0
16:50:55.185606 IP 112.26.3.8.58109 > 112.26.3.1.targus-getdata1: Flags [.], seq 11425:12853, ack 0, win 4107, options [nop,nop,TS val 4294951436 ecr 210404,mptcp dss ack 1818309187 seq 1402306939 subseq 736849 len 1428 csum 0x62d1], length 1428
16:50:55.188839 IP 112.26.3.1.targus-getdata1 > 112.26.3.8.58109: Flags [.], ack 12853, win 24401, options [nop,nop,TS val 210826 ecr 4294951436,mptcp dss ack 1402292659], length 0
16:50:55.248243 IP 112.26.3.1.targus-getdata1 > 112.26.3.8.58109: Flags [.], ack 12853, win 24401, options [nop,nop,TS val 210826 ecr 4294951436,mptcp dss ack 1402292659], length 0
16:50:55.265615 IP 112.26.3.8.58109 > 112.26.3.1.targus-getdata1: Flags [.], seq 12853:14281, ack 0, win 4107, options [nop,nop,TS val 4294951436 ecr 210404,mptcp dss ack 1818309187 seq 1402308367 subseq 738277 len 1428 csum 0xc7aa], length 1428
16:50:55.267008 IP 112.26.3.1.targus-getdata1 > 112.26.3.8.58109: Flags [.], ack 14281, win 24450, options [nop,nop,TS val 210907 ecr 4294951436,mptcp dss ack 1402298371], length 0
16:50:55.279113 IP 112.26.3.1.targus-getdata1 > 112.26.3.8.58109: Flags [.], ack 14281, win 24450, options [nop,nop,TS val 210907 ecr 4294951436,mptcp dss ack 1402298371], length 0
16:50:55.346261 IP 112.26.3.8.58109 > 112.26.3.1.targus-getdata1: Flags [.], seq 14281:15709, ack 0, win 4107, options [nop,nop,TS val 4294951436 ecr 210404,mptcp dss ack 1818309187 seq 1402309795 subseq 739705 len 1428 csum 0xe827], length 1428
16:50:55.349614 IP 112.26.3.1.targus-getdata1 > 112.26.3.8.58109: Flags [.], ack 15709, win 24576, options [nop,nop,TS val 210987 ecr 4294951436,mptcp dss ack 1402311223], length 0
16:50:55.363040 IP 112.26.3.1.targus-getdata1 > 112.26.3.8.58109: Flags [.], ack 15709, win 24576, options [nop,nop,TS val 210987 ecr 4294951436,mptcp dss ack 1402311223], length 0
16:50:55.401976 IP 112.26.3.8.58109 > 112.26.3.1.targus-getdata1: Flags [.], seq 19993:21421, ack 0, win 4107, options [nop,nop,TS val 4294951535 ecr 210492,mptcp dss ack 1818309187 seq 1402316935 subseq 745417 len 1428 csum 0x4fac], length 1428
16:50:55.403130 IP 112.26.3.1.targus-getdata1 > 112.26.3.8.58109: Flags [.], ack 15709, win 24576, options [nop,nop,TS val 211043 ecr 4294951436,nop,nop,sack 1 {19993:21421},mptcp dss ack 1402311223], length 0
16:50:55.428104 IP 112.26.3.1.targus-getdata1 > 112.26.3.8.58109: Flags [.], ack 15709, win 24576, options [nop,nop,TS val 211043 ecr 4294951436,nop,nop,sack 1 {19993:21421},mptcp dss ack 1402311223], length 0
16:50:55.455282 IP 112.26.3.8.58109 > 112.26.3.1.targus-getdata1: Flags [.], seq 21421:22849, ack 0, win 4107, options [nop,nop,TS val 4294951638 ecr 210575,mptcp dss ack 1818309187 seq 1402319791 subseq 746845 len 1428 csum 0xe54a], length 1428
16:50:55.456986 IP 112.26.3.1.targus-getdata1 > 112.26.3.8.58109: Flags [.], ack 15709, win 24576, options [nop,nop,TS val 211096 ecr 4294951436,nop,nop,sack 1 {19993:22849},mptcp dss ack 1402311223], length 0
16:50:55.486135 IP 112.26.3.1.targus-getdata1 > 112.26.3.8.58109: Flags [.], ack 15709, win 24576, options [nop,nop,TS val 211096 ecr 4294951436,nop,nop,sack 1 {19993:22849},mptcp dss ack 1402311223], length 0
16:50:55.540522 IP 112.26.3.8.58109 > 112.26.3.1.targus-getdata1: Flags [.], seq 22849:24277, ack 0, win 4107, options [nop,nop,TS val 4294951747 ecr 210629,mptcp dss ack 1818309187 seq 1402321219 subseq 748273 len 1428 csum 0x2650], length 1428
16:50:55.542364 IP 112.26.3.1.targus-getdata1 > 112.26.3.8.58109: Flags [.], ack 15709, win 24576, options [nop,nop,TS val 211181 ecr 4294951436,nop,nop,sack 1 {19993:24277},mptcp dss ack 1402311223], length 0
16:50:55.553375 IP 112.26.3.1.targus-getdata1 > 112.26.3.8.58109: Flags [.], ack 15709, win 24576, options [nop,nop,TS val 211181 ecr 4294951436,nop,nop,sack 1 {19993:24277},mptcp dss ack 1402311223], length 0
16:50:55.582829 IP 112.26.3.8.58109 > 112.26.3.1.targus-getdata1: Flags [.], seq 24277:25705, ack 0, win 4107, options [nop,nop,TS val 4294951788 ecr 210704,mptcp dss ack 1818309187 seq 1402322647 subseq 749701 len 1428 csum 0x64bb], length 1428
16:50:55.585451 IP 112.26.3.1.targus-getdata1 > 112.26.3.8.58109: Flags [.], ack 15709, win 24576, options [nop,nop,TS val 211224 ecr 4294951436,nop,nop,sack 1 {19993:25705},mptcp dss ack 1402311223], length 0
16:50:55.639285 IP 112.26.3.1.targus-getdata1 > 112.26.3.8.58109: Flags [.], ack 15709, win 24576, options [nop,nop,TS val 211224 ecr 4294951436,nop,nop,sack 1 {19993:25705},mptcp dss ack 1402311223], length 0
16:50:55.668804 IP 112.26.3.8.58109 > 112.26.3.1.targus-getdata1: Flags [.], seq 25705:27133, ack 0, win 4107, options [nop,nop,TS val 4294951842 ecr 210777,mptcp dss ack 1818309187 seq 1402324075 subseq 751129 len 1428 csum 0x9ff6], length 1428
16:50:55.671249 IP 112.26.3.1.targus-getdata1 > 112.26.3.8.58109: Flags [.], ack 15709, win 24576, options [nop,nop,TS val 211309 ecr 4294951436,nop,nop,sack 1 {19993:27133},mptcp dss ack 1402311223], length 0
16:50:55.730717 IP 112.26.3.1.targus-getdata1 > 112.26.3.8.58109: Flags [.], ack 15709, win 24576, options [nop,nop,TS val 211309 ecr 4294951436,nop,nop,sack 1 {19993:27133},mptcp dss ack 1402311223], length 0
16:50:55.757883 IP 112.26.3.8.58109 > 112.26.3.1.targus-getdata1: Flags [.], seq 27133:28561, ack 0, win 4107, options [nop,nop,TS val 4294951914 ecr 210826,mptcp dss ack 1818309187 seq 1402325503 subseq 752557 len 1428 csum 0xecf3], length 1428
16:50:55.759107 IP 112.26.3.1.targus-getdata1 > 112.26.3.8.58109: Flags [.], ack 15709, win 24576, options [nop,nop,TS val 211399 ecr 4294951436,nop,nop,sack 1 {19993:28561},mptcp dss ack 1402311223], length 0
16:50:55.789518 IP 112.26.3.1.targus-getdata1 > 112.26.3.8.58109: Flags [.], ack 15709, win 24576, options [nop,nop,TS val 211399 ecr 4294951436,nop,nop,sack 1 {19993:28561},mptcp dss ack 1402311223], length 0
16:50:55.836091 IP 112.26.3.8.58109 > 112.26.3.1.targus-getdata1: Flags [.], seq 28561:29989, ack 0, win 4107, options [nop,nop,TS val 4294951944 ecr 210907,mptcp dss ack 1818309187 seq 1402326931 subseq 753985 len 1428 csum 0x2e0e], length 1428
16:50:55.838375 IP 112.26.3.1.targus-getdata1 > 112.26.3.8.58109: Flags [.], ack 15709, win 24576, options [nop,nop,TS val 211477 ecr 4294951436,nop,nop,sack 1 {19993:29989},mptcp dss ack 1402311223], length 0
16:50:55.866316 IP 112.26.3.1.targus-getdata1 > 112.26.3.8.58109: Flags [.], ack 15709, win 24576, options [nop,nop,TS val 211477 ecr 4294951436,nop,nop,sack 1 {19993:29989},mptcp dss ack 1402311223], length 0
16:50:55.891311 IP 112.26.3.8.58109 > 112.26.3.1.targus-getdata1: Flags [.], seq 29989:31417, ack 0, win 4107, options [nop,nop,TS val 4294952028 ecr 210987,mptcp dss ack 1818309187 seq 1402331215 subseq 755413 len 1428 csum 0x1f5a], length 1428
16:50:55.892346 IP 112.26.3.1.targus-getdata1 > 112.26.3.8.58109: Flags [.], ack 15709, win 24576, options [nop,nop,TS val 211532 ecr 4294951436,nop,nop,sack 1 {19993:31417},mptcp dss ack 1402311223], length 0
16:50:55.941671 IP 112.26.3.1.targus-getdata1 > 112.26.3.8.58109: Flags [.], ack 15709, win 24576, options [nop,nop,TS val 211532 ecr 4294951436,nop,nop,sack 1 {19993:31417},mptcp dss ack 1402311223], length 0
16:50:55.987022 IP 112.26.3.8.58109 > 112.26.3.1.targus-getdata1: Flags [.], seq 31417:32845, ack 0, win 4107, options [nop,nop,TS val 4294952151 ecr 211043,mptcp dss ack 1818309187 seq 1402332643 subseq 756841 len 1428 csum 0x2234], length 1428
16:50:55.988222 IP 112.26.3.1.targus-getdata1 > 112.26.3.8.58109: Flags [.], ack 15709, win 24576, options [nop,nop,TS val 211628 ecr 4294951436,nop,nop,sack 1 {19993:32845},mptcp dss ack 1402311223], length 0
16:50:55.991731 IP 112.26.3.1.targus-getdata1 > 112.26.3.8.58109: Flags [.], ack 15709, win 24576, options [nop,nop,TS val 211628 ecr 4294951436,nop,nop,sack 1 {19993:32845},mptcp dss ack 1402311223], length 0
16:50:56.076338 IP 112.26.3.8.58109 > 112.26.3.1.targus-getdata1: Flags [.], seq 32845:34273, ack 0, win 4107, options [nop,nop,TS val 4294952199 ecr 211096,mptcp dss ack 1818309187 seq 1402334071 subseq 758269 len 1428 csum 0x8856], length 1428
16:50:56.077968 IP 112.26.3.1.targus-getdata1 > 112.26.3.8.58109: Flags [.], ack 15709, win 24576, options [nop,nop,TS val 211717 ecr 4294951436,nop,nop,sack 1 {19993:34273},mptcp dss ack 1402311223], length 0
16:50:56.082666 IP 112.26.3.1.targus-getdata1 > 112.26.3.8.58109: Flags [.], ack 15709, win 24576, options [nop,nop,TS val 211717 ecr 4294951436,nop,nop,sack 1 {19993:34273},mptcp dss ack 1402311223], length 0
16:50:56.158802 IP 112.26.3.8.58109 > 112.26.3.1.targus-getdata1: Flags [.], seq 15709:17137, ack 0, win 4107, options [nop,nop,TS val 4294952219 ecr 211181,mptcp dss ack 1818309187 seq 1402311223 subseq 741133 len 1428 csum 0x5378], length 1428
16:50:56.160879 IP 112.26.3.1.targus-getdata1 > 112.26.3.8.58109: Flags [.], ack 17137, win 24554, options [nop,nop,TS val 211799 ecr 4294952219,nop,nop,sack 1 {19993:34273},mptcp dss ack 1402312651], length 0
16:50:56.177432 IP 112.26.3.1.targus-getdata1 > 112.26.3.8.58109: Flags [.], ack 17137, win 24554, options [nop,nop,TS val 211799 ecr 4294952219,nop,nop,sack 1 {19993:34273},mptcp dss ack 1402312651], length 0
16:50:56.250500 IP 112.26.3.8.58109 > 112.26.3.1.targus-getdata1: Flags [.], seq 17137:18565, ack 0, win 4107, options [nop,nop,TS val 4294952396 ecr 211309,mptcp dss ack 1818309187 seq 1402312651 subseq 742561 len 1428 csum 0xa51d], length 1428
16:50:56.251923 IP 112.26.3.1.targus-getdata1 > 112.26.3.8.58109: Flags [.], ack 18565, win 24532, options [nop,nop,TS val 211891 ecr 4294952396,nop,nop,sack 1 {19993:34273},mptcp dss ack 1402314079], length 0
16:50:56.261695 IP 112.26.3.1.targus-getdata1 > 112.26.3.8.58109: Flags [.], ack 18565, win 24532, options [nop,nop,TS val 211891 ecr 4294952396,nop,nop,sack 1 {19993:34273},mptcp dss ack 1402314079], length 0
16:50:56.298006 IP 112.26.3.8.58109 > 112.26.3.1.targus-getdata1: Flags [.], seq 18565:19993, ack 0, win 4107, options [nop,nop,TS val 4294952454 ecr 211399,mptcp dss ack 1818309187 seq 1402314079 subseq 743989 len 1428 csum 0x1b17], length 1428
16:50:56.300700 IP 112.26.3.1.targus-getdata1 > 112.26.3.8.58109: Flags [.], ack 34273, win 24295, options [nop,nop,TS val 211938 ecr 4294952454,mptcp dss ack 1402339783], length 0
16:50:56.308848 IP 112.26.3.1.targus-getdata1 > 112.26.3.8.58109: Flags [.], ack 34273, win 24295, options [nop,nop,TS val 211938 ecr 4294952454,mptcp dss ack 1402339783], length 0
16:50:56.400561 IP 112.26.3.8.58109 > 112.26.3.1.targus-getdata1: Flags [.], seq 34273:35701, ack 0, win 4107, options [nop,nop,TS val 4294952548 ecr 211477,mptcp dss ack 1818309187 seq 1402344067 subseq 759697 len 1428 csum 0xefec], length 1428
16:50:56.407608 IP 112.26.3.1.targus-getdata1 > 112.26.3.8.58109: Flags [.], ack 35701, win 24576, options [nop,nop,TS val 212041 ecr 4294952548,mptcp dss ack 1402339783], length 0
16:50:56.419638 IP 112.26.3.1.targus-getdata1 > 112.26.3.8.58109: Flags [.], ack 35701, win 24576, options [nop,nop,TS val 212041 ecr 4294952548,mptcp dss ack 1402339783], length 0
16:50:56.488112 IP 112.26.3.8.58109 > 112.26.3.1.targus-getdata1: Flags [.], seq 35701:37129, ack 0, win 4107, options [nop,nop,TS val 4294952657 ecr 211532,mptcp dss ack 1818309187 seq 1402348351 subseq 761125 len 1428 csum 0xda], length 1428
16:50:56.490527 IP 112.26.3.1.targus-getdata1 > 112.26.3.8.58109: Flags [.], ack 37129, win 24576, options [nop,nop,TS val 212129 ecr 4294952657,mptcp dss ack 1402339783], length 0
16:50:56.510897 IP 112.26.3.1.targus-getdata1 > 112.26.3.8.58109: Flags [.], ack 37129, win 24576, options [nop,nop,TS val 212129 ecr 4294952657,mptcp dss ack 1402339783], length 0
16:50:56.574680 IP 112.26.3.8.58109 > 112.26.3.1.targus-getdata1: Flags [.], seq 37129:38557, ack 0, win 4107, options [nop,nop,TS val 4294952748 ecr 211628,mptcp dss ack 1818309187 seq 1402349779 subseq 762553 len 1428 csum 0xb84f], length 1428
16:50:56.576520 IP 112.26.3.1.targus-getdata1 > 112.26.3.8.58109: Flags [.], ack 38557, win 24576, options [nop,nop,TS val 212215 ecr 4294952748,mptcp dss ack 1402339783], length 0
16:50:56.635198 IP 112.26.3.1.targus-getdata1 > 112.26.3.8.58109: Flags [.], ack 38557, win 24576, options [nop,nop,TS val 212215 ecr 4294952748,mptcp dss ack 1402339783], length 0
16:50:56.676379 IP 112.26.3.8.58109 > 112.26.3.1.targus-getdata1: Flags [.], seq 38557:39985, ack 0, win 4107, options [nop,nop,TS val 4294952796 ecr 211717,mptcp dss ack 1818309187 seq 1402351207 subseq 763981 len 1428 csum 0xfd21], length 1428
16:50:56.678363 IP 112.26.3.1.targus-getdata1 > 112.26.3.8.58109: Flags [.], ack 39985, win 24576, options [nop,nop,TS val 212317 ecr 4294952796,mptcp dss ack 1402339783], length 0
16:50:56.718195 IP 112.26.3.1.targus-getdata1 > 112.26.3.8.58109: Flags [.], ack 39985, win 24576, options [nop,nop,TS val 212317 ecr 4294952796,mptcp dss ack 1402339783], length 0
16:50:56.783217 IP 112.26.3.8.58109 > 112.26.3.1.targus-getdata1: Flags [.], seq 39985:41413, ack 0, win 4107, options [nop,nop,TS val 4294952843 ecr 211799,mptcp dss ack 1818309187 seq 1402354063 subseq 765409 len 1428 csum 0xaaf9], length 1428
16:50:56.786222 IP 112.26.3.1.targus-getdata1 > 112.26.3.8.58109: Flags [.], ack 41413, win 24576, options [nop,nop,TS val 212424 ecr 4294952843,mptcp dss ack 1402339783], length 0
16:50:56.801323 IP 112.26.3.1.targus-getdata1 > 112.26.3.8.58109: Flags [.], ack 41413, win 24576, options [nop,nop,TS val 212424 ecr 4294952843,mptcp dss ack 1402339783], length 0
16:50:56.852383 IP 112.26.3.8.58109 > 112.26.3.1.targus-getdata1: Flags [.], seq 41413:42841, ack 0, win 4107, options [nop,nop,TS val 4294952922 ecr 211891,mptcp dss ack 1818309187 seq 1402356919 subseq 766837 len 1428 csum 0x593c], length 1428
16:50:56.854946 IP 112.26.3.1.targus-getdata1 > 112.26.3.8.58109: Flags [.], ack 42841, win 24576, options [nop,nop,TS val 212493 ecr 4294952922,mptcp dss ack 1402339783], length 0
16:50:56.914503 IP 112.26.3.1.targus-getdata1 > 112.26.3.8.58109: Flags [.], ack 42841, win 24576, options [nop,nop,TS val 212493 ecr 4294952922,mptcp dss ack 1402339783], length 0
16:50:56.976347 IP 112.26.3.8.58109 > 112.26.3.1.targus-getdata1: Flags [.], seq 42841:44269, ack 0, win 4107, options [nop,nop,TS val 4294952974 ecr 211938,mptcp dss ack 1818309187 seq 1402358347 subseq 768265 len 1428 csum 0xc1bb], length 1428
16:50:56.979462 IP 112.26.3.1.targus-getdata1 > 112.26.3.8.58109: Flags [.], ack 44269, win 24576, options [nop,nop,TS val 212617 ecr 4294952974,mptcp dss ack 1402339783], length 0
16:50:56.992621 IP 112.26.3.1.targus-getdata1 > 112.26.3.8.58109: Flags [.], ack 44269, win 24576, options [nop,nop,TS val 212617 ecr 4294952974,mptcp dss ack 1402339783], length 0
16:50:57.067702 IP 112.26.3.8.58109 > 112.26.3.1.targus-getdata1: Flags [.], seq 44269:45697, ack 0, win 4107, options [nop,nop,TS val 4294953085 ecr 212041,mptcp dss ack 1818309187 seq 1402359775 subseq 769693 len 1428 csum 0x9430], length 1428
16:50:57.070288 IP 112.26.3.1.targus-getdata1 > 112.26.3.8.58109: Flags [.], ack 45697, win 24576, options [nop,nop,TS val 212708 ecr 4294953085,mptcp dss ack 1402339783], length 0
16:50:57.131029 IP 112.26.3.1.targus-getdata1 > 112.26.3.8.58109: Flags [.], ack 45697, win 24576, options [nop,nop,TS val 212708 ecr 4294953085,mptcp dss ack 1402339783], length 0
16:50:57.183059 IP 112.26.3.8.58109 > 112.26.3.1.targus-getdata1: Flags [.], seq 45697:47125, ack 0, win 4107, options [nop,nop,TS val 4294953085 ecr 212041,mptcp dss ack 1818309187 seq 1402361203 subseq 771121 len 1428 csum 0xd013], length 1428
16:50:57.184430 IP 112.26.3.1.targus-getdata1 > 112.26.3.8.58109: Flags [.], ack 47125, win 24576, options [nop,nop,TS val 212824 ecr 4294953085,mptcp dss ack 1402339783], length 0
16:50:57.245611 IP 112.26.3.1.targus-getdata1 > 112.26.3.8.58109: Flags [.], ack 47125, win 24576, options [nop,nop,TS val 212824 ecr 4294953085,mptcp dss ack 1402339783], length 0
16:50:57.257515 IP 112.26.3.8.58109 > 112.26.3.1.targus-getdata1: Flags [.], seq 47125:48553, ack 0, win 4107, options [nop,nop,TS val 4294953176 ecr 212129,mptcp dss ack 1818309187 seq 1402382623 subseq 772549 len 1428 csum 0x54d4], length 1428
16:50:57.258783 IP 112.26.3.1.targus-getdata1 > 112.26.3.8.58109: Flags [.], ack 48553, win 24576, options [nop,nop,TS val 212899 ecr 4294953176,mptcp dss ack 1402339783], length 0
16:50:57.308550 IP 112.26.3.1.targus-getdata1 > 112.26.3.8.58109: Flags [.], ack 48553, win 24576, options [nop,nop,TS val 212899 ecr 4294953176,mptcp dss ack 1402339783], length 0
16:50:57.326536 IP 112.26.3.8.58109 > 112.26.3.1.targus-getdata1: Flags [.], seq 48553:49981, ack 0, win 4107, options [nop,nop,TS val 4294953301 ecr 212215,mptcp dss ack 1818309187 seq 1402388335 subseq 773977 len 1428 csum 0xcb7f], length 1428
16:50:57.328931 IP 112.26.3.1.targus-getdata1 > 112.26.3.8.58109: Flags [.], ack 49981, win 24576, options [nop,nop,TS val 212968 ecr 4294953301,mptcp dss ack 1402339783], length 0
16:50:57.410923 IP 112.26.3.8.58109 > 112.26.3.1.targus-getdata1: Flags [.], seq 49981:51409, ack 0, win 4107, options [nop,nop,TS val 4294953301 ecr 212215,mptcp dss ack 1818309187 seq 1402389763 subseq 775405 len 1428 csum 0x61], length 1428
16:50:57.412301 IP 112.26.3.1.targus-getdata1 > 112.26.3.8.58109: Flags [.], ack 51409, win 24576, options [nop,nop,TS val 213052 ecr 4294953301,mptcp dss ack 1402339783], length 0
16:50:57.453276 IP 112.26.3.1.targus-getdata1 > 112.26.3.8.58109: Flags [.], ack 49981, win 24576, options [nop,nop,TS val 212968 ecr 4294953301,mptcp dss ack 1402339783], length 0
16:50:57.509747 IP 112.26.3.1.targus-getdata1 > 112.26.3.8.58109: Flags [.], ack 51409, win 24576, options [nop,nop,TS val 213052 ecr 4294953301,mptcp dss ack 1402339783], length 0
16:50:57.514028 IP 112.26.3.8.58109 > 112.26.3.1.targus-getdata1: Flags [.], seq 52837:54265, ack 0, win 4107, options [nop,nop,TS val 4294953466 ecr 212424,mptcp dss ack 1818309187 seq 1402396903 subseq 778261 len 1428 csum 0xa136], length 1428
16:50:57.515625 IP 112.26.3.1.targus-getdata1 > 112.26.3.8.58109: Flags [.], ack 51409, win 24576, options [nop,nop,TS val 213154 ecr 4294953301,nop,nop,sack 1 {52837:54265},mptcp dss ack 1402339783], length 0
16:50:57.578121 IP 112.26.3.1.targus-getdata1 > 112.26.3.8.58109: Flags [.], ack 51409, win 24576, options [nop,nop,TS val 213154 ecr 4294953301,nop,nop,sack 1 {52837:54265},mptcp dss ack 1402339783], length 0
16:50:57.613941 IP 112.26.3.8.58109 > 112.26.3.1.targus-getdata1: Flags [.], seq 54265:55693, ack 0, win 4107, options [nop,nop,TS val 4294953579 ecr 212493,mptcp dss ack 1818309187 seq 1402401187 subseq 779689 len 1428 csum 0xcd32], length 1428
16:50:57.615535 IP 112.26.3.1.targus-getdata1 > 112.26.3.8.58109: Flags [.], ack 51409, win 24576, options [nop,nop,TS val 213255 ecr 4294953301,nop,nop,sack 1 {52837:55693},mptcp dss ack 1402339783], length 0
16:50:57.631749 IP 112.26.3.1.targus-getdata1 > 112.26.3.8.58109: Flags [.], ack 51409, win 24576, options [nop,nop,TS val 213255 ecr 4294953301,nop,nop,sack 1 {52837:55693},mptcp dss ack 1402339783], length 0
16:50:57.705795 IP 112.26.3.8.58109 > 112.26.3.1.targus-getdata1: Flags [.], seq 55693:57121, ack 0, win 4107, options [nop,nop,TS val 4294953655 ecr 212617,mptcp dss ack 1818309187 seq 1402404043 subseq 781117 len 1428 csum 0xc84d], length 1428
16:50:57.707202 IP 112.26.3.1.targus-getdata1 > 112.26.3.8.58109: Flags [.], ack 51409, win 24576, options [nop,nop,TS val 213347 ecr 4294953301,nop,nop,sack 1 {52837:57121},mptcp dss ack 1402339783], length 0
16:50:57.737794 IP 112.26.3.1.targus-getdata1 > 112.26.3.8.58109: Flags [.], ack 51409, win 24576, options [nop,nop,TS val 213347 ecr 4294953301,nop,nop,sack 1 {52837:57121},mptcp dss ack 1402339783], length 0
16:50:57.770218 IP 112.26.3.8.58109 > 112.26.3.1.targus-getdata1: Flags [.], seq 57121:58549, ack 0, win 4107, options [nop,nop,TS val 4294953655 ecr 212617,mptcp dss ack 1818309187 seq 1402405471 subseq 782545 len 1428 csum 0x4700], length 1428
16:50:57.771545 IP 112.26.3.1.targus-getdata1 > 112.26.3.8.58109: Flags [.], ack 51409, win 24419, options [nop,nop,TS val 213411 ecr 4294953301,nop,nop,sack 1 {52837:58549},mptcp dss ack 1402375483], length 0
16:50:57.841433 IP 112.26.3.1.targus-getdata1 > 112.26.3.8.58109: Flags [.], ack 51409, win 24419, options [nop,nop,TS val 213411 ecr 4294953301,nop,nop,sack 1 {52837:58549},mptcp dss ack 1402375483], length 0
16:50:57.880217 IP 112.26.3.8.58109 > 112.26.3.1.targus-getdata1: Flags [.], seq 59977:61405, ack 0, win 4107, options [nop,nop,TS val 4294953911 ecr 212824,mptcp dss ack 1818309187 seq 1402414039 subseq 785401 len 1428 csum 0x4b21], length 1428
16:50:57.881292 IP 112.26.3.1.targus-getdata1 > 112.26.3.8.58109: Flags [.], ack 51409, win 24419, options [nop,nop,TS val 213521 ecr 4294953301,nop,nop,sack 2 {59977:61405}{52837:58549},mptcp dss ack 1402375483], length 0
16:50:57.947665 IP 112.26.3.1.targus-getdata1 > 112.26.3.8.58109: Flags [.], ack 51409, win 24419, options [nop,nop,TS val 213521 ecr 4294953301,nop,nop,sack 2 {59977:61405}{52837:58549},mptcp dss ack 1402375483], length 0
16:50:57.978079 IP 112.26.3.8.58109 > 112.26.3.1.targus-getdata1: Flags [.], seq 61405:62833, ack 0, win 4107, options [nop,nop,TS val 4294953974 ecr 212899,mptcp dss ack 1818309187 seq 1402418323 subseq 786829 len 1428 csum 0x34f], length 1428
16:50:57.984965 IP 112.26.3.1.targus-getdata1 > 112.26.3.8.58109: Flags [.], ack 51409, win 24419, options [nop,nop,TS val 213619 ecr 4294953301,nop,nop,sack 2 {59977:62833}{52837:58549},mptcp dss ack 1402375483], length 0
16:50:58.016808 IP 112.26.3.1.targus-getdata1 > 112.26.3.8.58109: Flags [.], ack 51409, win 24419, options [nop,nop,TS val 213619 ecr 4294953301,nop,nop,sack 2 {59977:62833}{52837:58549},mptcp dss ack 1402375483], length 0
16:50:58.063240 IP 112.26.3.8.58109 > 112.26.3.1.targus-getdata1: Flags [.], seq 62833:64261, ack 0, win 4107, options [nop,nop,TS val 4294954119 ecr 212968,mptcp dss ack 1818309187 seq 1402426891 subseq 788257 len 1428 csum 0x8961], length 1428
16:50:58.066161 IP 112.26.3.1.targus-getdata1 > 112.26.3.8.58109: Flags [.], ack 51409, win 24419, options [nop,nop,TS val 213704 ecr 4294953301,nop,nop,sack 2 {59977:64261}{52837:58549},mptcp dss ack 1402375483], length 0
16:50:58.089081 IP 112.26.3.1.targus-getdata1 > 112.26.3.8.58109: Flags [.], ack 51409, win 24419, options [nop,nop,TS val 213704 ecr 4294953301,nop,nop,sack 2 {59977:64261}{52837:58549},mptcp dss ack 1402375483], length 0
16:50:58.135122 IP 112.26.3.8.58109 > 112.26.3.1.targus-getdata1: Flags [.], seq 64261:65689, ack 0, win 4107, options [nop,nop,TS val 4294954175 ecr 213052,mptcp dss ack 1818309187 seq 1402428319 subseq 789685 len 1428 csum 0x5328], length 1428
16:50:58.139883 IP 112.26.3.1.targus-getdata1 > 112.26.3.8.58109: Flags [.], ack 51409, win 24419, options [nop,nop,TS val 213775 ecr 4294953301,nop,nop,sack 2 {59977:65689}{52837:58549},mptcp dss ack 1402375483], length 0
16:50:58.161196 IP 112.26.3.1.targus-getdata1 > 112.26.3.8.58109: Flags [.], ack 51409, win 24419, options [nop,nop,TS val 213775 ecr 4294953301,nop,nop,sack 2 {59977:65689}{52837:58549},mptcp dss ack 1402375483], length 0
16:50:58.215567 IP 112.26.3.8.58109 > 112.26.3.1.targus-getdata1: Flags [.], seq 65689:67117, ack 0, win 4107, options [nop,nop,TS val 4294954297 ecr 213154,mptcp dss ack 1818309187 seq 1402429747 subseq 791113 len 1428 csum 0xe595], length 1428
16:50:58.218103 IP 112.26.3.1.targus-getdata1 > 112.26.3.8.58109: Flags [.], ack 51409, win 24419, options [nop,nop,TS val 213856 ecr 4294953301,nop,nop,sack 2 {59977:67117}{52837:58549},mptcp dss ack 1402375483], length 0
16:50:58.255779 IP 112.26.3.1.targus-getdata1 > 112.26.3.8.58109: Flags [.], ack 51409, win 24419, options [nop,nop,TS val 213856 ecr 4294953301,nop,nop,sack 2 {59977:67117}{52837:58549},mptcp dss ack 1402375483], length 0
16:50:58.273637 IP 112.26.3.8.58109 > 112.26.3.1.targus-getdata1: Flags [.], seq 67117:68545, ack 0, win 4107, options [nop,nop,TS val 4294954332 ecr 213255,mptcp dss ack 1818309187 seq 1402431175 subseq 792541 len 1428 csum 0xd122], length 1428
16:50:58.276958 IP 112.26.3.1.targus-getdata1 > 112.26.3.8.58109: Flags [.], ack 51409, win 24419, options [nop,nop,TS val 213914 ecr 4294953301,nop,nop,sack 2 {59977:68545}{52837:58549},mptcp dss ack 1402375483], length 0
16:50:58.349127 IP 112.26.3.1.targus-getdata1 > 112.26.3.8.58109: Flags [.], ack 51409, win 24419, options [nop,nop,TS val 213914 ecr 4294953301,nop,nop,sack 2 {59977:68545}{52837:58549},mptcp dss ack 1402375483], length 0
16:50:58.371515 IP 112.26.3.8.58109 > 112.26.3.1.targus-getdata1: Flags [.], seq 51409:52837, ack 0, win 4107, options [nop,nop,TS val 4294954403 ecr 213347,mptcp dss ack 1818309187 seq 1402392619 subseq 776833 len 1428 csum 0xa5a1], length 1428
16:50:58.377520 IP 112.26.3.1.targus-getdata1 > 112.26.3.8.58109: Flags [.], ack 58549, win 24419, options [nop,nop,TS val 214013 ecr 4294954403,nop,nop,sack 1 {59977:68545},mptcp dss ack 1402375483], length 0
16:50:58.478315 IP 112.26.3.1.targus-getdata1 > 112.26.3.8.58109: Flags [.], ack 58549, win 24419, options [nop,nop,TS val 214013 ecr 4294954403,nop,nop,sack 1 {59977:68545},mptcp dss ack 1402375483], length 0
16:50:58.497808 IP 112.26.3.8.58109 > 112.26.3.1.targus-getdata1: Flags [.], seq 58549:59977, ack 0, win 4107, options [nop,nop,TS val 4294954675 ecr 213619,mptcp dss ack 1818309187 seq 1402411183 subseq 783973 len 1428 csum 0xfa82], length 1428
16:50:58.499920 IP 112.26.3.1.targus-getdata1 > 112.26.3.8.58109: Flags [.], ack 68545, win 24419, options [nop,nop,TS val 214139 ecr 4294954675,mptcp dss ack 1402375483], length 0
16:50:58.538046 IP 112.26.3.1.targus-getdata1 > 112.26.3.8.58109: Flags [.], ack 68545, win 24419, options [nop,nop,TS val 214139 ecr 4294954675,mptcp dss ack 1402375483], length 0
16:50:58.599533 IP 112.26.3.8.58109 > 112.26.3.1.targus-getdata1: Flags [.], seq 69973:71401, ack 0, win 4107, options [nop,nop,TS val 4294954780 ecr 213704,mptcp dss ack 1818309187 seq 1402439743 subseq 795397 len 1428 csum 0x4f22], length 1428
16:50:58.601107 IP 112.26.3.1.targus-getdata1 > 112.26.3.8.58109: Flags [.], ack 68545, win 24419, options [nop,nop,TS val 214240 ecr 4294954675,nop,nop,sack 1 {69973:71401},mptcp dss ack 1402375483], length 0
16:50:58.641414 IP 112.26.3.1.targus-getdata1 > 112.26.3.8.58109: Flags [.], ack 68545, win 24419, options [nop,nop,TS val 214240 ecr 4294954675,nop,nop,sack 1 {69973:71401},mptcp dss ack 1402375483], length 0
16:50:58.700934 IP 112.26.3.8.58109 > 112.26.3.1.targus-getdata1: Flags [.], seq 71401:72829, ack 0, win 4107, options [nop,nop,TS val 4294954862 ecr 213775,mptcp dss ack 1818309187 seq 1402444027 subseq 796825 len 1428 csum 0x7095], length 1428
16:50:58.704372 IP 112.26.3.1.targus-getdata1 > 112.26.3.8.58109: Flags [.], ack 68545, win 24419, options [nop,nop,TS val 214342 ecr 4294954675,nop,nop,sack 1 {69973:72829},mptcp dss ack 1402375483], length 0
16:50:58.777305 IP 112.26.3.1.targus-getdata1 > 112.26.3.8.58109: Flags [.], ack 68545, win 24419, options [nop,nop,TS val 214342 ecr 4294954675,nop,nop,sack 1 {69973:72829},mptcp dss ack 1402375483], length 0
16:50:58.810931 IP 112.26.3.8.58109 > 112.26.3.1.targus-getdata1: Flags [.], seq 72829:74257, ack 0, win 4107, options [nop,nop,TS val 4294955010 ecr 213856,mptcp dss ack 1818309187 seq 1402448311 subseq 798253 len 1428 csum 0xf2b1], length 1428
16:50:58.815541 IP 112.26.3.1.targus-getdata1 > 112.26.3.8.58109: Flags [.], ack 68545, win 24419, options [nop,nop,TS val 214452 ecr 4294954675,nop,nop,sack 1 {69973:74257},mptcp dss ack 1402375483], length 0
16:50:58.882124 IP 112.26.3.1.targus-getdata1 > 112.26.3.8.58109: Flags [.], ack 68545, win 24419, options [nop,nop,TS val 214452 ecr 4294954675,nop,nop,sack 1 {69973:74257},mptcp dss ack 1402375483], length 0
16:50:58.908250 IP 112.26.3.8.58109 > 112.26.3.1.targus-getdata1: Flags [.], seq 74257:75685, ack 0, win 4107, options [nop,nop,TS val 4294955070 ecr 213914,mptcp dss ack 1818309187 seq 1402451167 subseq 799681 len 1428 csum 0x8a04], length 1428
16:50:58.910646 IP 112.26.3.1.targus-getdata1 > 112.26.3.8.58109: Flags [.], ack 68545, win 24419, options [nop,nop,TS val 214549 ecr 4294954675,nop,nop,sack 1 {69973:75685},mptcp dss ack 1402375483], length 0
16:50:58.968798 IP 112.26.3.8.58109 > 112.26.3.1.targus-getdata1: Flags [.], seq 75685:77113, ack 0, win 4107, options [nop,nop,TS val 4294955144 ecr 214013,mptcp dss ack 1818309187 seq 1402452595 subseq 801109 len 1428 csum 0x2d57], length 1428
16:50:58.976731 IP 112.26.3.1.targus-getdata1 > 112.26.3.8.58109: Flags [.], ack 68545, win 24419, options [nop,nop,TS val 214609 ecr 4294954675,nop,nop,sack 1 {69973:77113},mptcp dss ack 1402375483], length 0
16:50:59.003063 IP 112.26.3.1.targus-getdata1 > 112.26.3.8.58109: Flags [.], ack 68545, win 24419, options [nop,nop,TS val 214549 ecr 4294954675,nop,nop,sack 1 {69973:75685},mptcp dss ack 1402375483], length 0
16:50:59.064792 IP 112.26.3.8.58109 > 112.26.3.1.targus-getdata1: Flags [.], seq 77113:78541, ack 0, win 4107, options [nop,nop,TS val 4294955203 ecr 214139,mptcp dss ack 1818309187 seq 1402454023 subseq 802537 len 1428 csum 0x53cd], length 1428
16:50:59.068613 IP 112.26.3.1.targus-getdata1 > 112.26.3.8.58109: Flags [.], ack 68545, win 24419, options [nop,nop,TS val 214705 ecr 4294954675,nop,nop,sack 1 {69973:78541},mptcp dss ack 1402375483], length 0
