16:50:02.716501 IP 112.26.3.8.38285 > 112.26.3.1.targus-getdata1: Flags [S], seq 3557256018, win 65535, options [mss 1460,sackOK,TS val 4294899301 ecr 0,nop,wscale 6,mptcp join id 6 token 0x92d88ed4 nonce 0x3d63e07a], length 0
16:50:02.770105 IP 112.26.3.8.38285 > 112.26.3.1.targus-getdata1: Flags [S], seq 3557256018, win 65535, options [mss 1460,sackOK,TS val 4294899301 ecr 0,nop,wscale 6,mptcp join id 6 token 0x92d88ed4 nonce 0x3d63e07a], length 0
16:50:02.843957 IP 112.26.3.1.targus-getdata1 > 112.26.3.8.38285: Flags [S.], seq 1336565991, ack 3557256019, win 65535, options [mss 1460,sackOK,TS val 158413 ecr 4294899301,nop,wscale 6,mptcp join id 5 hmac 0x36c4045e39644d1d nonce 0xe22e8b0d], length 0
16:50:02.954230 IP 112.26.3.1.targus-getdata1 > 112.26.3.8.38285: Flags [S.], seq 1336565991, ack 3557256019, win 65535, options [mss 1460,sackOK,TS val 158413 ecr 4294899301,nop,wscale 6,mptcp join id 5 hmac 0x36c4045e39644d1d nonce 0xe22e8b0d], length 0
16:50:03.037730 IP 112.26.3.1.targus-getdata1 > 112.26.3.8.38285: Flags [S.], seq 1336565991, ack 3557256019, win 65535, options [mss 1460,sackOK,TS val 158413 ecr 4294899301,nop,wscale 6,mptcp join id 5 hmac 0x36c4045e39644d1d nonce 0xe22e8b0d], length 0
16:50:03.141422 IP 112.26.3.8.38285 > 112.26.3.1.targus-getdata1: Flags [.], ack 1, win 4107, options [nop,nop,TS val 4294899703 ecr 158413,mptcp join hmac 0xa08a6a9dc53f6f879b9c580133fe53443383777a], length 0
16:50:03.141753 IP 112.26.3.8.38285 > 112.26.3.1.targus-getdata1: Flags [.], ack 1, win 4107, options [nop,nop,TS val 4294899703 ecr 158413,mptcp join hmac 0xa08a6a9dc53f6f879b9c580133fe53443383777a], length 0
16:50:47.465946 IP 112.26.3.8.58109 > 112.26.3.1.targus-getdata1: Flags [.], seq 945235814:945237242, ack 3752693042, win 4107, options [nop,nop,TS val 4294943856 ecr 202316,mptcp dss ack 1818309187 seq 1402288375 subseq 728281 len 1428 csum 0xa82c], length 1428
16:50:47.493796 IP 112.26.3.1.targus-getdata1 > 112.26.3.8.58109: Flags [.], ack 4294964440, win 24429, options [nop,nop,TS val 203134 ecr 4294943428,mptcp dss ack 1402219831], length 0
16:50:47.494054 IP 112.26.3.1.targus-getdata1 > 112.26.3.8.58109: Flags [.], ack 4294964440, win 24429, options [nop,nop,TS val 203134 ecr 4294943428,mptcp dss ack 1402219831], length 0
16:50:47.536629 IP 112.26.3.1.targus-getdata1 > 112.26.3.8.58109: Flags [.], ack 4294960156, win 24429, options [nop,nop,TS val 202817 ecr 4294943099,mptcp dss ack 1402219831], length 0
16:50:47.558535 IP 112.26.3.8.58109 > 112.26.3.1.targus-getdata1: Flags [.], seq 4294964440:4294965868, ack 1, win 4107, options [nop,nop,TS val 4294943428 ecr 202138,mptcp dss ack 1818309187 seq 1402284091 subseq 725425 len 1428 csum 0xc887], length 1428
16:50:47.582741 IP 112.26.3.1.targus-getdata1 > 112.26.3.8.58109: Flags [.], ack 4294954444, win 24429, options [nop,nop,TS val 202412 ecr 4294942797,mptcp dss ack 1402219831], length 0
16:50:47.605373 IP 112.26.3.8.58109 > 112.26.3.1.targus-getdata1: Flags [.], seq 4294965868:0, ack 1, win 4107, options [nop,nop,TS val 4294943502 ecr 202230,mptcp dss ack 1818309187 seq 1402286947 subseq 726853 len 1428 csum 0x13e4], length 1428
16:50:47.629330 IP 112.26.3.1.targus-getdata1 > 112.26.3.8.58109: Flags [.], ack 4294955872, win 24429, options [nop,nop,TS val 202500 ecr 4294942923,mptcp dss ack 1402219831], length 0
16:50:47.642432 IP 112.26.3.1.targus-getdata1 > 112.26.3.8.58109: Flags [.], ack 0, win 24429, options [nop,nop,TS val 203280 ecr 4294943428,mptcp dss ack 1402219831], length 0
16:50:47.642766 IP 112.26.3.1.targus-getdata1 > 112.26.3.8.58109: Flags [.], ack 0, win 24429, options [nop,nop,TS val 203280 ecr 4294943428,mptcp dss ack 1402219831], length 0
16:50:47.701743 IP 112.26.3.8.58109 > 112.26.3.1.targus-getdata1: Flags [.], seq 0:1428, ack 1, win 4107, options [nop,nop,TS val 4294943547 ecr 202316,mptcp dss ack 1818309187 seq 1402288375 subseq 728281 len 1428 csum 0xa82c], length 1428
16:50:47.734783 IP 112.26.3.1.targus-getdata1 > 112.26.3.8.58109: Flags [.], ack 4294961584, win 24429, options [nop,nop,TS val 202910 ecr 4294943225,mptcp dss ack 1402219831], length 0
16:50:47.756278 IP 112.26.3.8.58109 > 112.26.3.1.targus-getdata1: Flags [.], seq 0:1428, ack 1, win 4107, options [nop,nop,TS val 4294943856 ecr 202316,mptcp dss ack 1818309187 seq 1402288375 subseq 728281 len 1428 csum 0xa82c], length 1428
16:50:47.757490 IP 112.26.3.1.targus-getdata1 > 112.26.3.8.58109: Flags [.], ack 1428, win 24429, options [nop,nop,TS val 203397 ecr 4294943856,nop,nop,sack 1 {0:1428},mptcp dss ack 1402219831], length 0
16:50:47.757729 IP 112.26.3.1.targus-getdata1 > 112.26.3.8.58109: Flags [.], ack 1428, win 24429, options [nop,nop,TS val 203397 ecr 4294943856,nop,nop,sack 1 {0:1428},mptcp dss ack 1402219831], length 0
16:50:47.782717 IP 112.26.3.1.targus-getdata1 > 112.26.3.8.58109: Flags [.], ack 4294961584, win 24429, options [nop,nop,TS val 202910 ecr 4294943225,mptcp dss ack 1402219831], length 0
16:50:47.842806 IP 112.26.3.1.targus-getdata1 > 112.26.3.8.58109: Flags [.], ack 4294958728, win 24429, options [nop,nop,TS val 202707 ecr 4294943099,mptcp dss ack 1402219831], length 0
16:50:47.843590 IP 112.26.3.1.targus-getdata1 > 112.26.3.8.58109: Flags [.], ack 4294958728, win 24429, options [nop,nop,TS val 202707 ecr 4294943099,mptcp dss ack 1402219831], length 0
16:50:47.886333 IP 112.26.3.1.targus-getdata1 > 112.26.3.8.58109: Flags [.], ack 4294963012, win 24429, options [nop,nop,TS val 202996 ecr 4294943308,mptcp dss ack 1402219831], length 0
16:50:47.893106 IP 112.26.3.1.targus-getdata1 > 112.26.3.8.58109: Flags [.], ack 4294963012, win 24429, options [nop,nop,TS val 202996 ecr 4294943308,mptcp dss ack 1402219831], length 0
16:50:47.949025 IP 112.26.3.1.targus-getdata1 > 112.26.3.8.58109: Flags [.], ack 4294957300, win 24429, options [nop,nop,TS val 202599 ecr 4294942993,mptcp dss ack 1402219831], length 0
16:50:47.950679 IP 112.26.3.1.targus-getdata1 > 112.26.3.8.58109: Flags [.], ack 4294957300, win 24429, options [nop,nop,TS val 202599 ecr 4294942993,mptcp dss ack 1402219831], length 0
16:50:47.975684 IP 112.26.3.1.targus-getdata1 > 112.26.3.8.58109: Flags [.], ack 4294964440, win 24429, options [nop,nop,TS val 203134 ecr 4294943428,mptcp dss ack 1402219831], length 0
16:50:47.978765 IP 112.26.3.1.targus-getdata1 > 112.26.3.8.58109: Flags [.], ack 4294964440, win 24429, options [nop,nop,TS val 203134 ecr 4294943428,mptcp dss ack 1402219831], length 0
16:50:48.010472 IP 112.26.3.1.targus-getdata1 > 112.26.3.8.58109: Flags [.], ack 4294960156, win 24429, options [nop,nop,TS val 202817 ecr 4294943099,mptcp dss ack 1402219831], length 0
16:50:48.027378 IP 112.26.3.1.targus-getdata1 > 112.26.3.8.58109: Flags [.], ack 0, win 24429, options [nop,nop,TS val 203280 ecr 4294943428,mptcp dss ack 1402219831], length 0
16:50:48.028606 IP 112.26.3.1.targus-getdata1 > 112.26.3.8.58109: Flags [.], ack 4294960156, win 24429, options [nop,nop,TS val 202817 ecr 4294943099,mptcp dss ack 1402219831], length 0
16:50:48.080893 IP 112.26.3.1.targus-getdata1 > 112.26.3.8.58109: Flags [.], ack 4294954444, win 24429, options [nop,nop,TS val 202412 ecr 4294942797,mptcp dss ack 1402219831], length 0
16:50:48.103051 IP 112.26.3.1.targus-getdata1 > 112.26.3.8.58109: Flags [.], ack 0, win 24429, options [nop,nop,TS val 203280 ecr 4294943428,mptcp dss ack 1402219831], length 0
16:50:48.136550 IP 112.26.3.1.targus-getdata1 > 112.26.3.8.58109: Flags [.], ack 4294955872, win 24429, options [nop,nop,TS val 202500 ecr 4294942923,mptcp dss ack 1402219831], length 0
16:50:48.143899 IP 112.26.3.1.targus-getdata1 > 112.26.3.8.58109: Flags [.], ack 4294954444, win 24429, options [nop,nop,TS val 202412 ecr 4294942797,mptcp dss ack 1402219831], length 0
16:50:48.177256 IP 112.26.3.1.targus-getdata1 > 112.26.3.8.58109: Flags [.], ack 1428, win 24429, options [nop,nop,TS val 203397 ecr 4294943856,nop,nop,sack 1 {0:1428},mptcp dss ack 1402219831], length 0
16:50:48.185912 IP 112.26.3.1.targus-getdata1 > 112.26.3.8.58109: Flags [.], ack 4294955872, win 24429, options [nop,nop,TS val 202500 ecr 4294942923,mptcp dss ack 1402219831], length 0
16:50:48.225413 IP 112.26.3.1.targus-getdata1 > 112.26.3.8.58109: Flags [.], ack 1428, win 24429, options [nop,nop,TS val 203397 ecr 4294943856,nop,nop,sack 1 {0:1428},mptcp dss ack 1402219831], length 0
16:50:48.234322 IP 112.26.3.1.targus-getdata1 > 112.26.3.8.58109: Flags [.], ack 4294961584, win 24429, options [nop,nop,TS val 202910 ecr 4294943225,mptcp dss ack 1402219831], length 0
16:50:48.284197 IP 112.26.3.1.targus-getdata1 > 112.26.3.8.58109: Flags [.], ack 4294961584, win 24429, options [nop,nop,TS val 202910 ecr 4294943225,mptcp dss ack 1402219831], length 0
16:50:48.332494 IP 112.26.3.8.58109 > 112.26.3.1.targus-getdata1: Flags [.], seq 4294953016:4294954444, ack 1, win 4107, options [nop,nop,TS val 4294944960 ecr 202316,mptcp dss ack 1818309187 seq 1402266955 subseq 714001 len 1428 csum 0xfd97], length 1428
16:50:48.334307 IP 112.26.3.8.58109 > 112.26.3.1.targus-getdata1: Flags [.], seq 4294953016:4294954444, ack 1, win 4107, options [nop,nop,TS val 4294944960 ecr 202316,mptcp dss ack 1818309187 seq 1402266955 subseq 714001 len 1428 csum 0xfd97], length 1428
16:50:50.493136 IP 112.26.3.8.58109 > 112.26.3.1.targus-getdata1: Flags [.], seq 4294953016:4294954444, ack 1, win 4107, options [nop,nop,TS val 4294947072 ecr 202316,mptcp dss ack 1818309187 seq 1402266955 subseq 714001 len 1428 csum 0xfd97], length 1428
16:50:50.497956 IP 112.26.3.8.58109 > 112.26.3.1.targus-getdata1: Flags [.], seq 4294953016:4294954444, ack 1, win 4107, options [nop,nop,TS val 4294947072 ecr 202316,mptcp dss ack 1818309187 seq 1402266955 subseq 714001 len 1428 csum 0xfd97], length 1428
16:50:54.761917 IP 112.26.3.8.58109 > 112.26.3.1.targus-getdata1: Flags [.], seq 4294953016:4294954444, ack 1, win 4107, options [nop,nop,TS val 4294951424 ecr 202316,mptcp dss ack 1818309187 seq 1402266955 subseq 714001 len 1428 csum 0xfd97], length 1428
16:50:54.763907 IP 112.26.3.8.58109 > 112.26.3.1.targus-getdata1: Flags [.], seq 4294953016:4294954444, ack 1, win 4107, options [nop,nop,TS val 4294951424 ecr 202316,mptcp dss ack 1818309187 seq 1402266955 subseq 714001 len 1428 csum 0xfd97], length 1428
16:50:54.765114 IP 112.26.3.1.targus-getdata1 > 112.26.3.8.58109: Flags [.], ack 1428, win 24401, options [nop,nop,TS val 210404 ecr 4294943856,nop,nop,sack 1 {4294953016:4294954444},mptcp dss ack 1402291231], length 0
16:50:54.765396 IP 112.26.3.1.targus-getdata1 > 112.26.3.8.58109: Flags [.], ack 1428, win 24401, options [nop,nop,TS val 210404 ecr 4294943856,nop,nop,sack 1 {4294953016:4294954444},mptcp dss ack 1402291231], length 0
16:50:54.770505 IP 112.26.3.1.targus-getdata1 > 112.26.3.8.58109: Flags [.], ack 1428, win 24401, options [nop,nop,TS val 210404 ecr 4294943856,nop,nop,sack 1 {4294953016:4294954444},mptcp dss ack 1402291231], length 0
16:50:54.848848 IP 112.26.3.8.58109 > 112.26.3.1.targus-getdata1: Flags [.], seq 1428:2856, ack 1, win 4107, options [nop,nop,TS val 4294951436 ecr 210404,mptcp dss ack 1818309187 seq 1402299799 subseq 729709 len 1428 csum 0x1109], length 1428
16:50:54.850690 IP 112.26.3.8.58109 > 112.26.3.1.targus-getdata1: Flags [.], seq 1428:2856, ack 1, win 4107, options [nop,nop,TS val 4294951436 ecr 210404,mptcp dss ack 1818309187 seq 1402299799 subseq 729709 len 1428 csum 0x1109], length 1428
16:50:54.862113 IP 112.26.3.1.targus-getdata1 > 112.26.3.8.58109: Flags [.], ack 2856, win 24401, options [nop,nop,TS val 210492 ecr 4294951436,mptcp dss ack 1402291231], length 0
16:50:54.862404 IP 112.26.3.1.targus-getdata1 > 112.26.3.8.58109: Flags [.], ack 2856, win 24401, options [nop,nop,TS val 210492 ecr 4294951436,mptcp dss ack 1402291231], length 0
16:50:54.870741 IP 112.26.3.1.targus-getdata1 > 112.26.3.8.58109: Flags [.], ack 2856, win 24401, options [nop,nop,TS val 210492 ecr 4294951436,mptcp dss ack 1402291231], length 0
16:50:54.923562 IP 112.26.3.8.58109 > 112.26.3.1.targus-getdata1: Flags [.], seq 2856:4284, ack 1, win 4107, options [nop,nop,TS val 4294951436 ecr 210404,mptcp dss ack 1818309187 seq 1402301227 subseq 731137 len 1428 csum 0x8af6], length 1428
16:50:54.934211 IP 112.26.3.8.58109 > 112.26.3.1.targus-getdata1: Flags [.], seq 2856:4284, ack 1, win 4107, options [nop,nop,TS val 4294951436 ecr 210404,mptcp dss ack 1818309187 seq 1402301227 subseq 731137 len 1428 csum 0x8af6], length 1428
16:50:54.935411 IP 112.26.3.1.targus-getdata1 > 112.26.3.8.58109: Flags [.], ack 4284, win 24401, options [nop,nop,TS val 210575 ecr 4294951436,mptcp dss ack 1402291231], length 0
16:50:54.935732 IP 112.26.3.1.targus-getdata1 > 112.26.3.8.58109: Flags [.], ack 4284, win 24401, options [nop,nop,TS val 210575 ecr 4294951436,mptcp dss ack 1402291231], length 0
16:50:54.972893 IP 112.26.3.1.targus-getdata1 > 112.26.3.8.58109: Flags [.], ack 4284, win 24401, options [nop,nop,TS val 210575 ecr 4294951436,mptcp dss ack 1402291231], length 0
16:50:54.985992 IP 112.26.3.8.58109 > 112.26.3.1.targus-getdata1: Flags [.], seq 4284:5712, ack 1, win 4107, options [nop,nop,TS val 4294951436 ecr 210404,mptcp dss ack 1818309187 seq 1402302655 subseq 732565 len 1428 csum 0x4557], length 1428
16:50:54.988375 IP 112.26.3.8.58109 > 112.26.3.1.targus-getdata1: Flags [.], seq 4284:5712, ack 1, win 4107, options [nop,nop,TS val 4294951436 ecr 210404,mptcp dss ack 1818309187 seq 1402302655 subseq 732565 len 1428 csum 0x4557], length 1428
16:50:55.023290 IP 112.26.3.1.targus-getdata1 > 112.26.3.8.58109: Flags [.], ack 5712, win 24401, options [nop,nop,TS val 210629 ecr 4294951436,mptcp dss ack 1402291231], length 0
16:50:55.023622 IP 112.26.3.1.targus-getdata1 > 112.26.3.8.58109: Flags [.], ack 5712, win 24401, options [nop,nop,TS val 210629 ecr 4294951436,mptcp dss ack 1402291231], length 0
16:50:55.060553 IP 112.26.3.8.58109 > 112.26.3.1.targus-getdata1: Flags [.], seq 5712:7140, ack 1, win 4107, options [nop,nop,TS val 4294951436 ecr 210404,mptcp dss ack 1818309187 seq 1402304083 subseq 733993 len 1428 csum 0xb441], length 1428
16:50:55.064076 IP 112.26.3.1.targus-getdata1 > 112.26.3.8.58109: Flags [.], ack 7140, win 24401, options [nop,nop,TS val 210704 ecr 4294951436,mptcp dss ack 1402291231], length 0
16:50:55.064365 IP 112.26.3.1.targus-getdata1 > 112.26.3.8.58109: Flags [.], ack 7140, win 24401, options [nop,nop,TS val 210704 ecr 4294951436,mptcp dss ack 1402291231], length 0
16:50:55.066251 IP 112.26.3.8.58109 > 112.26.3.1.targus-getdata1: Flags [.], seq 5712:7140, ack 1, win 4107, options [nop,nop,TS val 4294951436 ecr 210404,mptcp dss ack 1818309187 seq 1402304083 subseq 733993 len 1428 csum 0xb441], length 1428
16:50:55.082323 IP 112.26.3.1.targus-getdata1 > 112.26.3.8.58109: Flags [.], ack 5712, win 24401, options [nop,nop,TS val 210629 ecr 4294951436,mptcp dss ack 1402291231], length 0
16:50:55.123104 IP 112.26.3.1.targus-getdata1 > 112.26.3.8.58109: Flags [.], ack 7140, win 24401, options [nop,nop,TS val 210704 ecr 4294951436,mptcp dss ack 1402291231], length 0
16:50:55.134079 IP 112.26.3.8.58109 > 112.26.3.1.targus-getdata1: Flags [.], seq 7140:8568, ack 1, win 4107, options [nop,nop,TS val 4294951436 ecr 210404,mptcp dss ack 1818309187 seq 1402305511 subseq 735421 len 1428 csum 0x4327], length 1428
16:50:55.138150 IP 112.26.3.1.targus-getdata1 > 112.26.3.8.58109: Flags [.], ack 8568, win 24401, options [nop,nop,TS val 210777 ecr 4294951436,mptcp dss ack 1402291231], length 0
16:50:55.138410 IP 112.26.3.1.targus-getdata1 > 112.26.3.8.58109: Flags [.], ack 8568, win 24401, options [nop,nop,TS val 210777 ecr 4294951436,mptcp dss ack 1402291231], length 0
16:50:55.139062 IP 112.26.3.8.58109 > 112.26.3.1.targus-getdata1: Flags [.], seq 7140:8568, ack 1, win 4107, options [nop,nop,TS val 4294951436 ecr 210404,mptcp dss ack 1818309187 seq 1402305511 subseq 735421 len 1428 csum 0x4327], length 1428
16:50:55.171435 IP 112.26.3.8.58109 > 112.26.3.1.targus-getdata1: Flags [.], seq 8568:9996, ack 1, win 4107, options [nop,nop,TS val 4294951436 ecr 210404,mptcp dss ack 1818309187 seq 1402306939 subseq 736849 len 1428 csum 0x62d1], length 1428
16:50:55.177118 IP 112.26.3.1.targus-getdata1 > 112.26.3.8.58109: Flags [.], ack 8568, win 24401, options [nop,nop,TS val 210777 ecr 4294951436,mptcp dss ack 1402291231], length 0
16:50:55.185479 IP 112.26.3.8.58109 > 112.26.3.1.targus-getdata1: Flags [.], seq 8568:9996, ack 1, win 4107, options [nop,nop,TS val 4294951436 ecr 210404,mptcp dss ack 1818309187 seq 1402306939 subseq 736849 len 1428 csum 0x62d1], length 1428
16:50:55.188725 IP 112.26.3.1.targus-getdata1 > 112.26.3.8.58109: Flags [.], ack 9996, win 24401, options [nop,nop,TS val 210826 ecr 4294951436,mptcp dss ack 1402292659], length 0
16:50:55.189028 IP 112.26.3.1.targus-getdata1 > 112.26.3.8.58109: Flags [.], ack 9996, win 24401, options [nop,nop,TS val 210826 ecr 4294951436,mptcp dss ack 1402292659], length 0
16:50:55.248130 IP 112.26.3.1.targus-getdata1 > 112.26.3.8.58109: Flags [.], ack 9996, win 24401, options [nop,nop,TS val 210826 ecr 4294951436,mptcp dss ack 1402292659], length 0
16:50:55.263391 IP 112.26.3.8.58109 > 112.26.3.1.targus-getdata1: Flags [.], seq 9996:11424, ack 1, win 4107, options [nop,nop,TS val 4294951436 ecr 210404,mptcp dss ack 1818309187 seq 1402308367 subseq 738277 len 1428 csum 0xc7aa], length 1428
16:50:55.266894 IP 112.26.3.1.targus-getdata1 > 112.26.3.8.58109: Flags [.], ack 11424, win 24450, options [nop,nop,TS val 210907 ecr 4294951436,mptcp dss ack 1402298371], length 0
16:50:55.267168 IP 112.26.3.1.targus-getdata1 > 112.26.3.8.58109: Flags [.], ack 11424, win 24450, options [nop,nop,TS val 210907 ecr 4294951436,mptcp dss ack 1402298371], length 0
16:50:55.271316 IP 112.26.3.8.58109 > 112.26.3.1.targus-getdata1: Flags [.], seq 9996:11424, ack 1, win 4107, options [nop,nop,TS val 4294951436 ecr 210404,mptcp dss ack 1818309187 seq 1402308367 subseq 738277 len 1428 csum 0xc7aa], length 1428
16:50:55.279004 IP 112.26.3.1.targus-getdata1 > 112.26.3.8.58109: Flags [.], ack 11424, win 24450, options [nop,nop,TS val 210907 ecr 4294951436,mptcp dss ack 1402298371], length 0
16:50:55.337930 IP 112.26.3.8.58109 > 112.26.3.1.targus-getdata1: Flags [.], seq 11424:12852, ack 1, win 4107, options [nop,nop,TS val 4294951436 ecr 210404,mptcp dss ack 1818309187 seq 1402309795 subseq 739705 len 1428 csum 0xe827], length 1428
16:50:55.346149 IP 112.26.3.8.58109 > 112.26.3.1.targus-getdata1: Flags [.], seq 11424:12852, ack 1, win 4107, options [nop,nop,TS val 4294951436 ecr 210404,mptcp dss ack 1818309187 seq 1402309795 subseq 739705 len 1428 csum 0xe827], length 1428
16:50:55.349488 IP 112.26.3.1.targus-getdata1 > 112.26.3.8.58109: Flags [.], ack 12852, win 24576, options [nop,nop,TS val 210987 ecr 4294951436,mptcp dss ack 1402311223], length 0
16:50:55.349850 IP 112.26.3.1.targus-getdata1 > 112.26.3.8.58109: Flags [.], ack 12852, win 24576, options [nop,nop,TS val 210987 ecr 4294951436,mptcp dss ack 1402311223], length 0
16:50:55.362928 IP 112.26.3.1.targus-getdata1 > 112.26.3.8.58109: Flags [.], ack 12852, win 24576, options [nop,nop,TS val 210987 ecr 4294951436,mptcp dss ack 1402311223], length 0
16:50:55.391146 IP 112.26.3.8.58109 > 112.26.3.1.targus-getdata1: Flags [.], seq 17136:18564, ack 1, win 4107, options [nop,nop,TS val 4294951535 ecr 210492,mptcp dss ack 1818309187 seq 1402316935 subseq 745417 len 1428 csum 0x4fac], length 1428
16:50:55.401858 IP 112.26.3.8.58109 > 112.26.3.1.targus-getdata1: Flags [.], seq 17136:18564, ack 1, win 4107, options [nop,nop,TS val 4294951535 ecr 210492,mptcp dss ack 1818309187 seq 1402316935 subseq 745417 len 1428 csum 0x4fac], length 1428
16:50:55.403015 IP 112.26.3.1.targus-getdata1 > 112.26.3.8.58109: Flags [.], ack 12852, win 24576, options [nop,nop,TS val 211043 ecr 4294951436,nop,nop,sack 1 {17136:18564},mptcp dss ack 1402311223], length 0
16:50:55.403321 IP 112.26.3.1.targus-getdata1 > 112.26.3.8.58109: Flags [.], ack 12852, win 24576, options [nop,nop,TS val 211043 ecr 4294951436,nop,nop,sack 1 {17136:18564},mptcp dss ack 1402311223], length 0
16:50:55.427972 IP 112.26.3.1.targus-getdata1 > 112.26.3.8.58109: Flags [.], ack 12852, win 24576, options [nop,nop,TS val 211043 ecr 4294951436,nop,nop,sack 1 {17136:18564},mptcp dss ack 1402311223], length 0
16:50:55.445389 IP 112.26.3.8.58109 > 112.26.3.1.targus-getdata1: Flags [.], seq 18564:19992, ack 1, win 4107, options [nop,nop,TS val 4294951638 ecr 210575,mptcp dss ack 1818309187 seq 1402319791 subseq 746845 len 1428 csum 0xe54a], length 1428
16:50:55.455163 IP 112.26.3.8.58109 > 112.26.3.1.targus-getdata1: Flags [.], seq 18564:19992, ack 1, win 4107, options [nop,nop,TS val 4294951638 ecr 210575,mptcp dss ack 1818309187 seq 1402319791 subseq 746845 len 1428 csum 0xe54a], length 1428
16:50:55.456862 IP 112.26.3.1.targus-getdata1 > 112.26.3.8.58109: Flags [.], ack 12852, win 24576, options [nop,nop,TS val 211096 ecr 4294951436,nop,nop,sack 1 {17136:19992},mptcp dss ack 1402311223], length 0
16:50:55.457076 IP 112.26.3.1.targus-getdata1 > 112.26.3.8.58109: Flags [.], ack 12852, win 24576, options [nop,nop,TS val 211096 ecr 4294951436,nop,nop,sack 1 {17136:19992},mptcp dss ack 1402311223], length 0
16:50:55.486023 IP 112.26.3.1.targus-getdata1 > 112.26.3.8.58109: Flags [.], ack 12852, win 24576, options [nop,nop,TS val 211096 ecr 4294951436,nop,nop,sack 1 {17136:19992},mptcp dss ack 1402311223], length 0
16:50:55.538735 IP 112.26.3.8.58109 > 112.26.3.1.targus-getdata1: Flags [.], seq 19992:21420, ack 1, win 4107, options [nop,nop,TS val 4294951747 ecr 210629,mptcp dss ack 1818309187 seq 1402321219 subseq 748273 len 1428 csum 0x2650], length 1428
16:50:55.540408 IP 112.26.3.8.58109 > 112.26.3.1.targus-getdata1: Flags [.], seq 19992:21420, ack 1, win 4107, options [nop,nop,TS val 4294951747 ecr 210629,mptcp dss ack 1818309187 seq 1402321219 subseq 748273 len 1428 csum 0x2650], length 1428
16:50:55.542250 IP 112.26.3.1.targus-getdata1 > 112.26.3.8.58109: Flags [.], ack 12852, win 24576, options [nop,nop,TS val 211181 ecr 4294951436,nop,nop,sack 1 {17136:21420},mptcp dss ack 1402311223], length 0
16:50:55.542592 IP 112.26.3.1.targus-getdata1 > 112.26.3.8.58109: Flags [.], ack 12852, win 24576, options [nop,nop,TS val 211181 ecr 4294951436,nop,nop,sack 1 {17136:21420},mptcp dss ack 1402311223], length 0
16:50:55.553263 IP 112.26.3.1.targus-getdata1 > 112.26.3.8.58109: Flags [.], ack 12852, win 24576, options [nop,nop,TS val 211181 ecr 4294951436,nop,nop,sack 1 {17136:21420},mptcp dss ack 1402311223], length 0
16:50:55.581005 IP 112.26.3.8.58109 > 112.26.3.1.targus-getdata1: Flags [.], seq 21420:22848, ack 1, win 4107, options [nop,nop,TS val 4294951788 ecr 210704,mptcp dss ack 1818309187 seq 1402322647 subseq 749701 len 1428 csum 0x64bb], length 1428
16:50:55.585336 IP 112.26.3.1.targus-getdata1 > 112.26.3.8.58109: Flags [.], ack 12852, win 24576, options [nop,nop,TS val 211224 ecr 4294951436,nop,nop,sack 1 {17136:22848},mptcp dss ack 1402311223], length 0
16:50:55.585676 IP 112.26.3.1.targus-getdata1 > 112.26.3.8.58109: Flags [.], ack 12852, win 24576, options [nop,nop,TS val 211224 ecr 4294951436,nop,nop,sack 1 {17136:22848},mptcp dss ack 1402311223], length 0
16:50:55.588454 IP 112.26.3.8.58109 > 112.26.3.1.targus-getdata1: Flags [.], seq 21420:22848, ack 1, win 4107, options [nop,nop,TS val 4294951788 ecr 210704,mptcp dss ack 1818309187 seq 1402322647 subseq 749701 len 1428 csum 0x64bb], length 1428
16:50:55.639169 IP 112.26.3.1.targus-getdata1 > 112.26.3.8.58109: Flags [.], ack 12852, win 24576, options [nop,nop,TS val 211224 ecr 4294951436,nop,nop,sack 1 {17136:22848},mptcp dss ack 1402311223], length 0
16:50:55.666783 IP 112.26.3.8.58109 > 112.26.3.1.targus-getdata1: Flags [.], seq 22848:24276, ack 1, win 4107, options [nop,nop,TS val 4294951842 ecr 210777,mptcp dss ack 1818309187 seq 1402324075 subseq 751129 len 1428 csum 0x9ff6], length 1428
16:50:55.668685 IP 112.26.3.8.58109 > 112.26.3.1.targus-getdata1: Flags [.], seq 22848:24276, ack 1, win 4107, options [nop,nop,TS val 4294951842 ecr 210777,mptcp dss ack 1818309187 seq 1402324075 subseq 751129 len 1428 csum 0x9ff6], length 1428
16:50:55.676235 IP 112.26.3.1.targus-getdata1 > 112.26.3.8.58109: Flags [.], ack 12852, win 24576, options [nop,nop,TS val 211309 ecr 4294951436,nop,nop,sack 1 {17136:24276},mptcp dss ack 1402311223], length 0
16:50:55.676524 IP 112.26.3.1.targus-getdata1 > 112.26.3.8.58109: Flags [.], ack 12852, win 24576, options [nop,nop,TS val 211309 ecr 4294951436,nop,nop,sack 1 {17136:24276},mptcp dss ack 1402311223], length 0
16:50:55.730551 IP 112.26.3.1.targus-getdata1 > 112.26.3.8.58109: Flags [.], ack 12852, win 24576, options [nop,nop,TS val 211309 ecr 4294951436,nop,nop,sack 1 {17136:24276},mptcp dss ack 1402311223], length 0
16:50:55.756096 IP 112.26.3.8.58109 > 112.26.3.1.targus-getdata1: Flags [.], seq 24276:25704, ack 1, win 4107, options [nop,nop,TS val 4294951914 ecr 210826,mptcp dss ack 1818309187 seq 1402325503 subseq 752557 len 1428 csum 0xecf3], length 1428
16:50:55.759981 IP 112.26.3.1.targus-getdata1 > 112.26.3.8.58109: Flags [.], ack 12852, win 24576, options [nop,nop,TS val 211399 ecr 4294951436,nop,nop,sack 1 {17136:25704},mptcp dss ack 1402311223], length 0
16:50:55.760299 IP 112.26.3.1.targus-getdata1 > 112.26.3.8.58109: Flags [.], ack 12852, win 24576, options [nop,nop,TS val 211399 ecr 4294951436,nop,nop,sack 1 {17136:25704},mptcp dss ack 1402311223], length 0
16:50:55.760976 IP 112.26.3.8.58109 > 112.26.3.1.targus-getdata1: Flags [.], seq 24276:25704, ack 1, win 4107, options [nop,nop,TS val 4294951914 ecr 210826,mptcp dss ack 1818309187 seq 1402325503 subseq 752557 len 1428 csum 0xecf3], length 1428
16:50:55.789407 IP 112.26.3.1.targus-getdata1 > 112.26.3.8.58109: Flags [.], ack 12852, win 24576, options [nop,nop,TS val 211399 ecr 4294951436,nop,nop,sack 1 {17136:25704},mptcp dss ack 1402311223], length 0
16:50:55.833930 IP 112.26.3.8.58109 > 112.26.3.1.targus-getdata1: Flags [.], seq 25704:27132, ack 1, win 4107, options [nop,nop,TS val 4294951944 ecr 210907,mptcp dss ack 1818309187 seq 1402326931 subseq 753985 len 1428 csum 0x2e0e], length 1428
16:50:55.838260 IP 112.26.3.1.targus-getdata1 > 112.26.3.8.58109: Flags [.], ack 12852, win 24576, options [nop,nop,TS val 211477 ecr 4294951436,nop,nop,sack 1 {17136:27132},mptcp dss ack 1402311223], length 0
16:50:55.838530 IP 112.26.3.1.targus-getdata1 > 112.26.3.8.58109: Flags [.], ack 12852, win 24576, options [nop,nop,TS val 211477 ecr 4294951436,nop,nop,sack 1 {17136:27132},mptcp dss ack 1402311223], length 0
16:50:55.844610 IP 112.26.3.8.58109 > 112.26.3.1.targus-getdata1: Flags [.], seq 25704:27132, ack 1, win 4107, options [nop,nop,TS val 4294951944 ecr 210907,mptcp dss ack 1818309187 seq 1402326931 subseq 753985 len 1428 csum 0x2e0e], length 1428
16:50:55.866206 IP 112.26.3.1.targus-getdata1 > 112.26.3.8.58109: Flags [.], ack 12852, win 24576, options [nop,nop,TS val 211477 ecr 4294951436,nop,nop,sack 1 {17136:27132},mptcp dss ack 1402311223], length 0
16:50:55.878657 IP 112.26.3.8.58109 > 112.26.3.1.targus-getdata1: Flags [.], seq 27132:28560, ack 1, win 4107, options [nop,nop,TS val 4294952028 ecr 210987,mptcp dss ack 1818309187 seq 1402331215 subseq 755413 len 1428 csum 0x1f5a], length 1428
16:50:55.891199 IP 112.26.3.8.58109 > 112.26.3.1.targus-getdata1: Flags [.], seq 27132:28560, ack 1, win 4107, options [nop,nop,TS val 4294952028 ecr 210987,mptcp dss ack 1818309187 seq 1402331215 subseq 755413 len 1428 csum 0x1f5a], length 1428
16:50:55.892231 IP 112.26.3.1.targus-getdata1 > 112.26.3.8.58109: Flags [.], ack 12852, win 24576, options [nop,nop,TS val 211532 ecr 4294951436,nop,nop,sack 1 {17136:28560},mptcp dss ack 1402311223], length 0
16:50:55.892455 IP 112.26.3.1.targus-getdata1 > 112.26.3.8.58109: Flags [.], ack 12852, win 24576, options [nop,nop,TS val 211532 ecr 4294951436,nop,nop,sack 1 {17136:28560},mptcp dss ack 1402311223], length 0
16:50:55.941523 IP 112.26.3.1.targus-getdata1 > 112.26.3.8.58109: Flags [.], ack 12852, win 24576, options [nop,nop,TS val 211532 ecr 4294951436,nop,nop,sack 1 {17136:28560},mptcp dss ack 1402311223], length 0
16:50:55.963055 IP 112.26.3.8.58109 > 112.26.3.1.targus-getdata1: Flags [.], seq 28560:29988, ack 1, win 4107, options [nop,nop,TS val 4294952151 ecr 211043,mptcp dss ack 1818309187 seq 1402332643 subseq 756841 len 1428 csum 0x2234], length 1428
16:50:55.986911 IP 112.26.3.8.58109 > 112.26.3.1.targus-getdata1: Flags [.], seq 28560:29988, ack 1, win 4107, options [nop,nop,TS val 4294952151 ecr 211043,mptcp dss ack 1818309187 seq 1402332643 subseq 756841 len 1428 csum 0x2234], length 1428
16:50:55.988106 IP 112.26.3.1.targus-getdata1 > 112.26.3.8.58109: Flags [.], ack 12852, win 24576, options [nop,nop,TS val 211628 ecr 4294951436,nop,nop,sack 1 {17136:29988},mptcp dss ack 1402311223], length 0
16:50:55.988329 IP 112.26.3.1.targus-getdata1 > 112.26.3.8.58109: Flags [.], ack 12852, win 24576, options [nop,nop,TS val 211628 ecr 4294951436,nop,nop,sack 1 {17136:29988},mptcp dss ack 1402311223], length 0
16:50:55.991613 IP 112.26.3.1.targus-getdata1 > 112.26.3.8.58109: Flags [.], ack 12852, win 24576, options [nop,nop,TS val 211628 ecr 4294951436,nop,nop,sack 1 {17136:29988},mptcp dss ack 1402311223], length 0
16:50:56.038775 IP 112.26.3.8.58109 > 112.26.3.1.targus-getdata1: Flags [.], seq 29988:31416, ack 1, win 4107, options [nop,nop,TS val 4294952199 ecr 211096,mptcp dss ack 1818309187 seq 1402334071 subseq 758269 len 1428 csum 0x8856], length 1428
16:50:56.072850 IP 112.26.3.8.58109 > 112.26.3.1.targus-getdata1: Flags [.], seq 12852:14280, ack 1, win 4107, options [nop,nop,TS val 4294952219 ecr 211181,mptcp dss ack 1818309187 seq 1402311223 subseq 741133 len 1428 csum 0x5378], length 1428
16:50:56.076226 IP 112.26.3.8.58109 > 112.26.3.1.targus-getdata1: Flags [.], seq 29988:31416, ack 1, win 4107, options [nop,nop,TS val 4294952199 ecr 211096,mptcp dss ack 1818309187 seq 1402334071 subseq 758269 len 1428 csum 0x8856], length 1428
16:50:56.077853 IP 112.26.3.1.targus-getdata1 > 112.26.3.8.58109: Flags [.], ack 12852, win 24576, options [nop,nop,TS val 211717 ecr 4294951436,nop,nop,sack 1 {17136:31416},mptcp dss ack 1402311223], length 0
16:50:56.078086 IP 112.26.3.1.targus-getdata1 > 112.26.3.8.58109: Flags [.], ack 12852, win 24576, options [nop,nop,TS val 211717 ecr 4294951436,nop,nop,sack 1 {17136:31416},mptcp dss ack 1402311223], length 0
16:50:56.082520 IP 112.26.3.1.targus-getdata1 > 112.26.3.8.58109: Flags [.], ack 12852, win 24576, options [nop,nop,TS val 211717 ecr 4294951436,nop,nop,sack 1 {17136:31416},mptcp dss ack 1402311223], length 0
16:50:56.149115 IP 112.26.3.8.58109 > 112.26.3.1.targus-getdata1: Flags [.], seq 14280:15708, ack 1, win 4107, options [nop,nop,TS val 4294952396 ecr 211309,mptcp dss ack 1818309187 seq 1402312651 subseq 742561 len 1428 csum 0xa51d], length 1428
16:50:56.158682 IP 112.26.3.8.58109 > 112.26.3.1.targus-getdata1: Flags [.], seq 12852:14280, ack 1, win 4107, options [nop,nop,TS val 4294952219 ecr 211181,mptcp dss ack 1818309187 seq 1402311223 subseq 741133 len 1428 csum 0x5378], length 1428
16:50:56.160764 IP 112.26.3.1.targus-getdata1 > 112.26.3.8.58109: Flags [.], ack 14280, win 24554, options [nop,nop,TS val 211799 ecr 4294952219,nop,nop,sack 1 {17136:31416},mptcp dss ack 1402312651], length 0
16:50:56.161036 IP 112.26.3.1.targus-getdata1 > 112.26.3.8.58109: Flags [.], ack 14280, win 24554, options [nop,nop,TS val 211799 ecr 4294952219,nop,nop,sack 1 {17136:31416},mptcp dss ack 1402312651], length 0
16:50:56.177320 IP 112.26.3.1.targus-getdata1 > 112.26.3.8.58109: Flags [.], ack 14280, win 24554, options [nop,nop,TS val 211799 ecr 4294952219,nop,nop,sack 1 {17136:31416},mptcp dss ack 1402312651], length 0
16:50:56.233408 IP 112.26.3.8.58109 > 112.26.3.1.targus-getdata1: Flags [.], seq 15708:17136, ack 1, win 4107, options [nop,nop,TS val 4294952454 ecr 211399,mptcp dss ack 1818309187 seq 1402314079 subseq 743989 len 1428 csum 0x1b17], length 1428
16:50:56.250388 IP 112.26.3.8.58109 > 112.26.3.1.targus-getdata1: Flags [.], seq 14280:15708, ack 1, win 4107, options [nop,nop,TS val 4294952396 ecr 211309,mptcp dss ack 1818309187 seq 1402312651 subseq 742561 len 1428 csum 0xa51d], length 1428
16:50:56.251808 IP 112.26.3.1.targus-getdata1 > 112.26.3.8.58109: Flags [.], ack 15708, win 24532, options [nop,nop,TS val 211891 ecr 4294952396,nop,nop,sack 1 {17136:31416},mptcp dss ack 1402314079], length 0
16:50:56.252113 IP 112.26.3.1.targus-getdata1 > 112.26.3.8.58109: Flags [.], ack 15708, win 24532, options [nop,nop,TS val 211891 ecr 4294952396,nop,nop,sack 1 {17136:31416},mptcp dss ack 1402314079], length 0
16:50:56.261563 IP 112.26.3.1.targus-getdata1 > 112.26.3.8.58109: Flags [.], ack 15708, win 24532, options [nop,nop,TS val 211891 ecr 4294952396,nop,nop,sack 1 {17136:31416},mptcp dss ack 1402314079], length 0
16:50:56.297888 IP 112.26.3.8.58109 > 112.26.3.1.targus-getdata1: Flags [.], seq 15708:17136, ack 1, win 4107, options [nop,nop,TS val 4294952454 ecr 211399,mptcp dss ack 1818309187 seq 1402314079 subseq 743989 len 1428 csum 0x1b17], length 1428
16:50:56.300585 IP 112.26.3.1.targus-getdata1 > 112.26.3.8.58109: Flags [.], ack 31416, win 24295, options [nop,nop,TS val 211938 ecr 4294952454,mptcp dss ack 1402339783], length 0
16:50:56.300806 IP 112.26.3.1.targus-getdata1 > 112.26.3.8.58109: Flags [.], ack 31416, win 24295, options [nop,nop,TS val 211938 ecr 4294952454,mptcp dss ack 1402339783], length 0
16:50:56.308736 IP 112.26.3.1.targus-getdata1 > 112.26.3.8.58109: Flags [.], ack 31416, win 24295, options [nop,nop,TS val 211938 ecr 4294952454,mptcp dss ack 1402339783], length 0
16:50:56.346592 IP 112.26.3.8.58109 > 112.26.3.1.targus-getdata1: Flags [.], seq 31416:32844, ack 1, win 4107, options [nop,nop,TS val 4294952548 ecr 211477,mptcp dss ack 1818309187 seq 1402344067 subseq 759697 len 1428 csum 0xefec], length 1428
16:50:56.400440 IP 112.26.3.8.58109 > 112.26.3.1.targus-getdata1: Flags [.], seq 31416:32844, ack 1, win 4107, options [nop,nop,TS val 4294952548 ecr 211477,mptcp dss ack 1818309187 seq 1402344067 subseq 759697 len 1428 csum 0xefec], length 1428
16:50:56.407483 IP 112.26.3.1.targus-getdata1 > 112.26.3.8.58109: Flags [.], ack 32844, win 24576, options [nop,nop,TS val 212041 ecr 4294952548,mptcp dss ack 1402339783], length 0
16:50:56.407814 IP 112.26.3.1.targus-getdata1 > 112.26.3.8.58109: Flags [.], ack 32844, win 24576, options [nop,nop,TS val 212041 ecr 4294952548,mptcp dss ack 1402339783], length 0
16:50:56.419502 IP 112.26.3.1.targus-getdata1 > 112.26.3.8.58109: Flags [.], ack 32844, win 24576, options [nop,nop,TS val 212041 ecr 4294952548,mptcp dss ack 1402339783], length 0
16:50:56.437989 IP 112.26.3.8.58109 > 112.26.3.1.targus-getdata1: Flags [.], seq 32844:34272, ack 1, win 4107, options [nop,nop,TS val 4294952657 ecr 211532,mptcp dss ack 1818309187 seq 1402348351 subseq 761125 len 1428 csum 0xda], length 1428
16:50:56.487993 IP 112.26.3.8.58109 > 112.26.3.1.targus-getdata1: Flags [.], seq 32844:34272, ack 1, win 4107, options [nop,nop,TS val 4294952657 ecr 211532,mptcp dss ack 1818309187 seq 1402348351 subseq 761125 len 1428 csum 0xda], length 1428
16:50:56.490412 IP 112.26.3.1.targus-getdata1 > 112.26.3.8.58109: Flags [.], ack 34272, win 24576, options [nop,nop,TS val 212129 ecr 4294952657,mptcp dss ack 1402339783], length 0
16:50:56.490666 IP 112.26.3.1.targus-getdata1 > 112.26.3.8.58109: Flags [.], ack 34272, win 24576, options [nop,nop,TS val 212129 ecr 4294952657,mptcp dss ack 1402339783], length 0
16:50:56.510784 IP 112.26.3.1.targus-getdata1 > 112.26.3.8.58109: Flags [.], ack 34272, win 24576, options [nop,nop,TS val 212129 ecr 4294952657,mptcp dss ack 1402339783], length 0
16:50:56.572491 IP 112.26.3.8.58109 > 112.26.3.1.targus-getdata1: Flags [.], seq 34272:35700, ack 1, win 4107, options [nop,nop,TS val 4294952748 ecr 211628,mptcp dss ack 1818309187 seq 1402349779 subseq 762553 len 1428 csum 0xb84f], length 1428
16:50:56.574552 IP 112.26.3.8.58109 > 112.26.3.1.targus-getdata1: Flags [.], seq 34272:35700, ack 1, win 4107, options [nop,nop,TS val 4294952748 ecr 211628,mptcp dss ack 1818309187 seq 1402349779 subseq 762553 len 1428 csum 0xb84f], length 1428
16:50:56.576404 IP 112.26.3.1.targus-getdata1 > 112.26.3.8.58109: Flags [.], ack 35700, win 24576, options [nop,nop,TS val 212215 ecr 4294952748,mptcp dss ack 1402339783], length 0
16:50:56.576727 IP 112.26.3.1.targus-getdata1 > 112.26.3.8.58109: Flags [.], ack 35700, win 24576, options [nop,nop,TS val 212215 ecr 4294952748,mptcp dss ack 1402339783], length 0
16:50:56.625962 IP 112.26.3.8.58109 > 112.26.3.1.targus-getdata1: Flags [.], seq 35700:37128, ack 1, win 4107, options [nop,nop,TS val 4294952796 ecr 211717,mptcp dss ack 1818309187 seq 1402351207 subseq 763981 len 1428 csum 0xfd21], length 1428
16:50:56.635084 IP 112.26.3.1.targus-getdata1 > 112.26.3.8.58109: Flags [.], ack 35700, win 24576, options [nop,nop,TS val 212215 ecr 4294952748,mptcp dss ack 1402339783], length 0
16:50:56.676257 IP 112.26.3.8.58109 > 112.26.3.1.targus-getdata1: Flags [.], seq 35700:37128, ack 1, win 4107, options [nop,nop,TS val 4294952796 ecr 211717,mptcp dss ack 1818309187 seq 1402351207 subseq 763981 len 1428 csum 0xfd21], length 1428
16:50:56.678248 IP 112.26.3.1.targus-getdata1 > 112.26.3.8.58109: Flags [.], ack 37128, win 24576, options [nop,nop,TS val 212317 ecr 4294952796,mptcp dss ack 1402339783], length 0
16:50:56.678603 IP 112.26.3.1.targus-getdata1 > 112.26.3.8.58109: Flags [.], ack 37128, win 24576, options [nop,nop,TS val 212317 ecr 4294952796,mptcp dss ack 1402339783], length 0
16:50:56.715781 IP 112.26.3.8.58109 > 112.26.3.1.targus-getdata1: Flags [.], seq 37128:38556, ack 1, win 4107, options [nop,nop,TS val 4294952843 ecr 211799,mptcp dss ack 1818309187 seq 1402354063 subseq 765409 len 1428 csum 0xaaf9], length 1428
16:50:56.718085 IP 112.26.3.1.targus-getdata1 > 112.26.3.8.58109: Flags [.], ack 37128, win 24576, options [nop,nop,TS val 212317 ecr 4294952796,mptcp dss ack 1402339783], length 0
16:50:56.783104 IP 112.26.3.8.58109 > 112.26.3.1.targus-getdata1: Flags [.], seq 37128:38556, ack 1, win 4107, options [nop,nop,TS val 4294952843 ecr 211799,mptcp dss ack 1818309187 seq 1402354063 subseq 765409 len 1428 csum 0xaaf9], length 1428
16:50:56.794069 IP 112.26.3.1.targus-getdata1 > 112.26.3.8.58109: Flags [.], ack 38556, win 24576, options [nop,nop,TS val 212424 ecr 4294952843,mptcp dss ack 1402339783], length 0
16:50:56.794296 IP 112.26.3.1.targus-getdata1 > 112.26.3.8.58109: Flags [.], ack 38556, win 24576, options [nop,nop,TS val 212424 ecr 4294952843,mptcp dss ack 1402339783], length 0
16:50:56.801211 IP 112.26.3.1.targus-getdata1 > 112.26.3.8.58109: Flags [.], ack 38556, win 24576, options [nop,nop,TS val 212424 ecr 4294952843,mptcp dss ack 1402339783], length 0
16:50:56.806607 IP 112.26.3.8.58109 > 112.26.3.1.targus-getdata1: Flags [.], seq 38556:39984, ack 1, win 4107, options [nop,nop,TS val 4294952922 ecr 211891,mptcp dss ack 1818309187 seq 1402356919 subseq 766837 len 1428 csum 0x593c], length 1428
16:50:56.852272 IP 112.26.3.8.58109 > 112.26.3.1.targus-getdata1: Flags [.], seq 38556:39984, ack 1, win 4107, options [nop,nop,TS val 4294952922 ecr 211891,mptcp dss ack 1818309187 seq 1402356919 subseq 766837 len 1428 csum 0x593c], length 1428
16:50:56.854832 IP 112.26.3.1.targus-getdata1 > 112.26.3.8.58109: Flags [.], ack 39984, win 24576, options [nop,nop,TS val 212493 ecr 4294952922,mptcp dss ack 1402339783], length 0
16:50:56.855149 IP 112.26.3.1.targus-getdata1 > 112.26.3.8.58109: Flags [.], ack 39984, win 24576, options [nop,nop,TS val 212493 ecr 4294952922,mptcp dss ack 1402339783], length 0
16:50:56.914391 IP 112.26.3.1.targus-getdata1 > 112.26.3.8.58109: Flags [.], ack 39984, win 24576, options [nop,nop,TS val 212493 ecr 4294952922,mptcp dss ack 1402339783], length 0
