16:50:00.184235 IP 112.26.0.8.45702 > 112.26.0.1.targus-getdata1: Flags [S], seq 1292207928, win 65535, options [mss 1460,sackOK,TS val 4294896768 ecr 0,nop,wscale 6,mptcp capable csum {0x107f01c1446bf991}], length 0
16:50:00.206282 IP 112.26.0.8.45702 > 112.26.0.1.targus-getdata1: Flags [S], seq 1292207928, win 65535, options [mss 1460,sackOK,TS val 4294896768 ecr 0,nop,wscale 6,mptcp capable csum {0x107f01c1446bf991}], length 0
16:50:00.220249 IP 112.26.0.8.45702 > 112.26.0.1.targus-getdata1: Flags [S], seq 1292207928, win 65535, options [mss 1460,sackOK,TS val 4294896768 ecr 0,nop,wscale 6,mptcp capable csum {0x107f01c1446bf991}], length 0
16:50:00.620464 IP 112.26.0.1.targus-getdata1 > 112.26.0.8.45702: Flags [S.], seq 2466069190, ack 1292207929, win 65535, options [mss 1460,sackOK,TS val 155939 ecr 4294896768,nop,wscale 6,mptcp capable csum {0x62458052d89ef63b}], length 0
16:50:00.620731 IP 112.26.0.8.45702 > 112.26.0.1.targus-getdata1: Flags [R], seq 1292207929, win 0, length 0
16:50:00.707125 IP 112.26.0.8.45702 > 112.26.0.1.targus-getdata1: Flags [R], seq 1292207929, win 0, length 0
16:50:00.797312 IP 112.26.0.8.45702 > 112.26.0.1.targus-getdata1: Flags [R], seq 1292207929, win 0, length 0
16:50:37.509183 IP 112.26.0.8.45706 > 112.26.0.1.targus-getdata1: Flags [.], seq 2148306011:2148307439, ack 1846513222, win 4107, options [nop,nop,TS val 4294933775 ecr 192150,mptcp dss ack 1818309187 seq 1401821419 subseq 361322 len 1428 csum 0xacf4], length 1428
16:50:37.563921 IP 112.26.0.8.45706 > 112.26.0.1.targus-getdata1: Flags [.], seq 1428:2856, ack 1, win 4107, options [nop,nop,TS val 4294933775 ecr 192150,mptcp dss ack 1818309187 seq 1401822847 subseq 362750 len 1428 csum 0x89d1], length 1428
16:50:37.660037 IP 112.26.0.1.targus-getdata1 > 112.26.0.8.45706: Flags [.], ack 0, win 24514, options [nop,nop,TS val 192848 ecr 4294933345,nop,nop,sack 1 {2856:12852},mptcp dss ack 1401731455], length 0
16:50:37.660368 IP 112.26.0.8.45706 > 112.26.0.1.targus-getdata1: Flags [.], seq 12852:14280, ack 1, win 4107, options [nop,nop,TS val 4294934326 ecr 192848,mptcp dss ack 1818309187 seq 1401848551 subseq 374174 len 1428 csum 0x920c], length 1428
16:50:37.660425 IP 112.26.0.8.45706 > 112.26.0.1.targus-getdata1: Flags [.], seq 24276:25704, ack 1, win 4107, options [nop,nop,TS val 4294934326 ecr 192848,mptcp dss ack 1818309187 seq 1401891391 subseq 385598 len 1428 csum 0x63a], length 1428
16:50:37.705858 IP 112.26.0.1.targus-getdata1 > 112.26.0.8.45706: Flags [.], ack 0, win 24514, options [nop,nop,TS val 192939 ecr 4294933345,nop,nop,sack 2 {14280:15708}{2856:12852},mptcp dss ack 1401731455], length 0
16:50:37.725938 IP 112.26.0.8.45706 > 112.26.0.1.targus-getdata1: Flags [.], seq 25704:27132, ack 1, win 4107, options [nop,nop,TS val 4294934391 ecr 192939,mptcp dss ack 1818309187 seq 1401894247 subseq 387026 len 1428 csum 0x3acf], length 1428
16:50:37.753748 IP 112.26.0.8.45706 > 112.26.0.1.targus-getdata1: Flags [.], seq 17136:18564, ack 1, win 4107, options [nop,nop,TS val 4294933979 ecr 192335,mptcp dss ack 1818309187 seq 1401872827 subseq 378458 len 1428 csum 0x2a47], length 1428
16:50:37.821174 IP 112.26.0.8.45706 > 112.26.0.1.targus-getdata1: Flags [.], seq 18564:19992, ack 1, win 4107, options [nop,nop,TS val 4294934047 ecr 192543,mptcp dss ack 1818309187 seq 1401877111 subseq 379886 len 1428 csum 0xdab3], length 1428
16:50:37.932201 IP 112.26.0.8.45706 > 112.26.0.1.targus-getdata1: Flags [.], seq 19992:21420, ack 1, win 4107, options [nop,nop,TS val 4294934047 ecr 192543,mptcp dss ack 1818309187 seq 1401878539 subseq 381314 len 1428 csum 0x54a1], length 1428
16:50:37.976845 IP 112.26.0.8.45706 > 112.26.0.1.targus-getdata1: Flags [.], seq 21420:22848, ack 1, win 4107, options [nop,nop,TS val 4294934108 ecr 192630,mptcp dss ack 1818309187 seq 1401882823 subseq 382742 len 1428 csum 0x17fa], length 1428
16:50:38.019929 IP 112.26.0.1.targus-getdata1 > 112.26.0.8.45706: Flags [.], ack 1428, win 24514, options [nop,nop,TS val 193152 ecr 4294933775,nop,nop,sack 2 {14280:15708}{2856:12852},mptcp dss ack 1401731455], length 0
16:50:38.020394 IP 112.26.0.8.45706 > 112.26.0.1.targus-getdata1: Flags [.], seq 15708:17136, ack 1, win 4107, options [nop,nop,TS val 4294934686 ecr 193152,mptcp dss ack 1818309187 seq 1401857119 subseq 377030 len 1428 csum 0x70ad], length 1428
16:50:38.020461 IP 112.26.0.8.45706 > 112.26.0.1.targus-getdata1: Flags [.], seq 27132:28560, ack 1, win 4107, options [nop,nop,TS val 4294934686 ecr 193152,mptcp dss ack 1818309187 seq 1401901387 subseq 388454 len 1428 csum 0x9bd5], length 1428
16:50:38.060025 IP 112.26.0.8.45706 > 112.26.0.1.targus-getdata1: Flags [.], seq 22848:24276, ack 1, win 4107, options [nop,nop,TS val 4294934120 ecr 192698,mptcp dss ack 1818309187 seq 1401884251 subseq 384170 len 1428 csum 0x37a4], length 1428
16:50:38.122166 IP 112.26.0.1.targus-getdata1 > 112.26.0.8.45706: Flags [.], ack 12852, win 24514, options [nop,nop,TS val 193237 ecr 4294933775,nop,nop,sack 1 {14280:15708},mptcp dss ack 1401731455], length 0
16:50:38.122717 IP 112.26.0.8.45706 > 112.26.0.1.targus-getdata1: Flags [.], seq 28560:29988, ack 1, win 4107, options [nop,nop,TS val 4294934787 ecr 193237,mptcp dss ack 1818309187 seq 1401904243 subseq 389882 len 1428 csum 0x2f81], length 1428
16:50:38.189485 IP 112.26.0.8.45706 > 112.26.0.1.targus-getdata1: Flags [.], seq 12852:14280, ack 1, win 4107, options [nop,nop,TS val 4294934326 ecr 192848,mptcp dss ack 1818309187 seq 1401848551 subseq 374174 len 1428 csum 0x920c], length 1428
16:50:38.275416 IP 112.26.0.8.45706 > 112.26.0.1.targus-getdata1: Flags [.], seq 24276:25704, ack 1, win 4107, options [nop,nop,TS val 4294934326 ecr 192848,mptcp dss ack 1818309187 seq 1401891391 subseq 385598 len 1428 csum 0x63a], length 1428
16:50:38.314108 IP 112.26.0.1.targus-getdata1 > 112.26.0.8.45706: Flags [.], ack 12852, win 24514, options [nop,nop,TS val 193397 ecr 4294933775,nop,nop,sack 2 {17136:18564}{14280:15708},mptcp dss ack 1401731455], length 0
16:50:38.341491 IP 112.26.0.8.45706 > 112.26.0.1.targus-getdata1: Flags [.], seq 29988:31416, ack 1, win 4107, options [nop,nop,TS val 4294935006 ecr 193397,mptcp dss ack 1818309187 seq 1401909955 subseq 391310 len 1428 csum 0x293b], length 1428
16:50:38.387993 IP 112.26.0.1.targus-getdata1 > 112.26.0.8.45706: Flags [.], ack 12852, win 24174, options [nop,nop,TS val 193487 ecr 4294933775,nop,nop,sack 2 {17136:19992}{14280:15708},mptcp dss ack 1401808567], length 0
16:50:38.422392 IP 112.26.0.8.45706 > 112.26.0.1.targus-getdata1: Flags [.], seq 31416:32844, ack 1, win 4107, options [nop,nop,TS val 4294935087 ecr 193487,mptcp dss ack 1818309187 seq 1401912811 subseq 392738 len 1428 csum 0xa530], length 1428
16:50:38.443751 IP 112.26.0.1.targus-getdata1 > 112.26.0.8.45706: Flags [.], ack 12852, win 24174, options [nop,nop,TS val 193642 ecr 4294933775,nop,nop,sack 2 {17136:21420}{14280:15708},mptcp dss ack 1401808567], length 0
16:50:38.479050 IP 112.26.0.8.45706 > 112.26.0.1.targus-getdata1: Flags [.], seq 32844:34272, ack 1, win 4107, options [nop,nop,TS val 4294935144 ecr 193642,mptcp dss ack 1818309187 seq 1401915667 subseq 394166 len 1428 csum 0x243f], length 1428
16:50:38.503472 IP 112.26.0.8.45706 > 112.26.0.1.targus-getdata1: Flags [.], seq 15708:17136, ack 1, win 4107, options [nop,nop,TS val 4294934686 ecr 193152,mptcp dss ack 1818309187 seq 1401857119 subseq 377030 len 1428 csum 0x70ad], length 1428
16:50:38.578457 IP 112.26.0.1.targus-getdata1 > 112.26.0.8.45706: Flags [.], ack 12852, win 24174, options [nop,nop,TS val 193730 ecr 4294933775,nop,nop,sack 2 {17136:22848}{14280:15708},mptcp dss ack 1401808567], length 0
16:50:38.591639 IP 112.26.0.8.45706 > 112.26.0.1.targus-getdata1: Flags [.], seq 34272:35700, ack 1, win 4107, options [nop,nop,TS val 4294935257 ecr 193730,mptcp dss ack 1818309187 seq 1401919951 subseq 395594 len 1428 csum 0x4eba], length 1428
16:50:38.642166 IP 112.26.0.8.45706 > 112.26.0.1.targus-getdata1: Flags [.], seq 27132:28560, ack 1, win 4107, options [nop,nop,TS val 4294934686 ecr 193152,mptcp dss ack 1818309187 seq 1401901387 subseq 388454 len 1428 csum 0x9bd5], length 1428
16:50:38.733761 IP 112.26.0.1.targus-getdata1 > 112.26.0.8.45706: Flags [.], ack 12852, win 24174, options [nop,nop,TS val 193805 ecr 4294933775,nop,nop,sack 2 {17136:24276}{14280:15708},mptcp dss ack 1401808567], length 0
16:50:38.737954 IP 112.26.0.8.45706 > 112.26.0.1.targus-getdata1: Flags [.], seq 35700:37128, ack 1, win 4107, options [nop,nop,TS val 4294935403 ecr 193805,mptcp dss ack 1818309187 seq 1401927091 subseq 397022 len 1428 csum 0xbf56], length 1428
16:50:38.774229 IP 112.26.0.1.targus-getdata1 > 112.26.0.8.45706: Flags [.], ack 15708, win 24174, options [nop,nop,TS val 193878 ecr 4294934326,nop,nop,sack 1 {17136:24276},mptcp dss ack 1401808567], length 0
16:50:38.774624 IP 112.26.0.8.45706 > 112.26.0.1.targus-getdata1: Flags [.], seq 37128:38556, ack 1, win 4107, options [nop,nop,TS val 4294935440 ecr 193878,mptcp dss ack 1818309187 seq 1401929947 subseq 398450 len 1428 csum 0x4ac2], length 1428
16:50:38.839355 IP 112.26.0.1.targus-getdata1 > 112.26.0.8.45706: Flags [.], ack 15708, win 24174, options [nop,nop,TS val 193944 ecr 4294934326,nop,nop,sack 1 {17136:25704},mptcp dss ack 1401808567], length 0
16:50:38.865963 IP 112.26.0.8.45706 > 112.26.0.1.targus-getdata1: Flags [.], seq 29988:31416, ack 1, win 4107, options [nop,nop,TS val 4294935006 ecr 193397,mptcp dss ack 1818309187 seq 1401909955 subseq 391310 len 1428 csum 0x293b], length 1428
16:50:38.891165 IP 112.26.0.8.45706 > 112.26.0.1.targus-getdata1: Flags [.], seq 38556:39984, ack 1, win 4107, options [nop,nop,TS val 4294935556 ecr 193944,mptcp dss ack 1818309187 seq 1401934231 subseq 399878 len 1428 csum 0x65d7], length 1428
16:50:38.962455 IP 112.26.0.8.45706 > 112.26.0.1.targus-getdata1: Flags [.], seq 31416:32844, ack 1, win 4107, options [nop,nop,TS val 4294935087 ecr 193487,mptcp dss ack 1818309187 seq 1401912811 subseq 392738 len 1428 csum 0xa530], length 1428
16:50:39.047069 IP 112.26.0.8.45706 > 112.26.0.1.targus-getdata1: Flags [.], seq 32844:34272, ack 1, win 4107, options [nop,nop,TS val 4294935144 ecr 193642,mptcp dss ack 1818309187 seq 1401915667 subseq 394166 len 1428 csum 0x243f], length 1428
16:50:39.114414 IP 112.26.0.8.45706 > 112.26.0.1.targus-getdata1: Flags [.], seq 34272:35700, ack 1, win 4107, options [nop,nop,TS val 4294935257 ecr 193730,mptcp dss ack 1818309187 seq 1401919951 subseq 395594 len 1428 csum 0x4eba], length 1428
16:50:39.172237 IP 112.26.0.1.targus-getdata1 > 112.26.0.8.45706: Flags [.], ack 25704, win 24174, options [nop,nop,TS val 194284 ecr 4294934686,nop,nop,sack 1 {27132:28560},mptcp dss ack 1401808567], length 0
16:50:39.172560 IP 112.26.0.8.45706 > 112.26.0.1.targus-getdata1: Flags [.], seq 25704:27132, ack 1, win 4107, options [nop,nop,TS val 4294935837 ecr 194284,mptcp dss ack 1818309187 seq 1401894247 subseq 387026 len 1428 csum 0x3acf], length 1428
16:50:39.217966 IP 112.26.0.8.45706 > 112.26.0.1.targus-getdata1: Flags [.], seq 35700:37128, ack 1, win 4107, options [nop,nop,TS val 4294935403 ecr 193805,mptcp dss ack 1818309187 seq 1401927091 subseq 397022 len 1428 csum 0xbf56], length 1428
16:50:39.292644 IP 112.26.0.8.45706 > 112.26.0.1.targus-getdata1: Flags [.], seq 37128:38556, ack 1, win 4107, options [nop,nop,TS val 4294935440 ecr 193878,mptcp dss ack 1818309187 seq 1401929947 subseq 398450 len 1428 csum 0x4ac2], length 1428
16:50:39.343503 IP 112.26.0.1.targus-getdata1 > 112.26.0.8.45706: Flags [.], ack 25704, win 24236, options [nop,nop,TS val 194508 ecr 4294934686,nop,nop,sack 2 {29988:31416}{27132:28560},mptcp dss ack 1401869971], length 0
16:50:39.390672 IP 112.26.0.8.45706 > 112.26.0.1.targus-getdata1: Flags [.], seq 38556:39984, ack 1, win 4107, options [nop,nop,TS val 4294935556 ecr 193944,mptcp dss ack 1818309187 seq 1401934231 subseq 399878 len 1428 csum 0x65d7], length 1428
16:50:39.435863 IP 112.26.0.1.targus-getdata1 > 112.26.0.8.45706: Flags [.], ack 25704, win 24370, options [nop,nop,TS val 194604 ecr 4294934686,nop,nop,sack 2 {29988:32844}{27132:28560},mptcp dss ack 1401894247], length 0
16:50:39.436298 IP 112.26.0.8.45706 > 112.26.0.1.targus-getdata1: Flags [.], seq 28560:29988, ack 1, win 4107, options [nop,nop,TS val 4294936102 ecr 194604,mptcp dss ack 1818309187 seq 1401904243 subseq 389882 len 1428 csum 0x2f81], length 1428
16:50:39.499960 IP 112.26.0.1.targus-getdata1 > 112.26.0.8.45706: Flags [.], ack 25704, win 24370, options [nop,nop,TS val 194689 ecr 4294934686,nop,nop,sack 2 {29988:34272}{27132:28560},mptcp dss ack 1401894247], length 0
16:50:39.507090 IP 112.26.0.8.45706 > 112.26.0.1.targus-getdata1: Flags [.], seq 39984:41412, ack 1, win 4107, options [nop,nop,TS val 4294936173 ecr 194689,mptcp dss ack 1818309187 seq 1401955651 subseq 401306 len 1428 csum 0x1f8], length 1428
16:50:39.540221 IP 112.26.0.1.targus-getdata1 > 112.26.0.8.45706: Flags [.], ack 25704, win 24370, options [nop,nop,TS val 194757 ecr 4294934686,nop,nop,sack 2 {29988:35700}{27132:28560},mptcp dss ack 1401894247], length 0
16:50:39.581810 IP 112.26.0.8.45706 > 112.26.0.1.targus-getdata1: Flags [.], seq 25704:27132, ack 1, win 4107, options [nop,nop,TS val 4294935837 ecr 194284,mptcp dss ack 1818309187 seq 1401894247 subseq 387026 len 1428 csum 0x3acf], length 1428
16:50:39.624328 IP 112.26.0.8.45706 > 112.26.0.1.targus-getdata1: Flags [.], seq 41412:42840, ack 1, win 4107, options [nop,nop,TS val 4294936290 ecr 194757,mptcp dss ack 1818309187 seq 1401958507 subseq 402734 len 1428 csum 0xe4d4], length 1428
16:50:39.650925 IP 112.26.0.1.targus-getdata1 > 112.26.0.8.45706: Flags [.], ack 25704, win 24370, options [nop,nop,TS val 194860 ecr 4294934686,nop,nop,sack 2 {29988:37128}{27132:28560},mptcp dss ack 1401894247], length 0
16:50:39.669613 IP 112.26.0.8.45706 > 112.26.0.1.targus-getdata1: Flags [.], seq 42840:44268, ack 1, win 4107, options [nop,nop,TS val 4294936335 ecr 194860,mptcp dss ack 1818309187 seq 1401961363 subseq 404162 len 1428 csum 0x9bdd], length 1428
16:50:39.688767 IP 112.26.0.1.targus-getdata1 > 112.26.0.8.45706: Flags [.], ack 25704, win 24370, options [nop,nop,TS val 194935 ecr 4294934686,nop,nop,sack 2 {29988:38556}{27132:28560},mptcp dss ack 1401894247], length 0
16:50:39.715454 IP 112.26.0.8.45706 > 112.26.0.1.targus-getdata1: Flags [.], seq 44268:45696, ack 1, win 4107, options [nop,nop,TS val 4294936380 ecr 194935,mptcp dss ack 1818309187 seq 1401964219 subseq 405590 len 1428 csum 0xedd8], length 1428
16:50:39.737462 IP 112.26.0.1.targus-getdata1 > 112.26.0.8.45706: Flags [.], ack 25704, win 24370, options [nop,nop,TS val 195034 ecr 4294934686,nop,nop,sack 2 {29988:39984}{27132:28560},mptcp dss ack 1401894247], length 0
16:50:39.778668 IP 112.26.0.8.45706 > 112.26.0.1.targus-getdata1: Flags [.], seq 28560:29988, ack 1, win 4107, options [nop,nop,TS val 4294936102 ecr 194604,mptcp dss ack 1818309187 seq 1401904243 subseq 389882 len 1428 csum 0x2f81], length 1428
16:50:39.785823 IP 112.26.0.8.45706 > 112.26.0.1.targus-getdata1: Flags [.], seq 45696:47124, ack 1, win 4107, options [nop,nop,TS val 4294936451 ecr 195034,mptcp dss ack 1818309187 seq 1401967075 subseq 407018 len 1428 csum 0x1290], length 1428
16:50:39.857687 IP 112.26.0.8.45706 > 112.26.0.1.targus-getdata1: Flags [.], seq 39984:41412, ack 1, win 4107, options [nop,nop,TS val 4294936173 ecr 194689,mptcp dss ack 1818309187 seq 1401955651 subseq 401306 len 1428 csum 0x1f8], length 1428
16:50:39.929453 IP 112.26.0.1.targus-getdata1 > 112.26.0.8.45706: Flags [.], ack 28560, win 24244, options [nop,nop,TS val 195225 ecr 4294935837,nop,nop,sack 1 {29988:39984},mptcp dss ack 1401904243], length 0
16:50:39.929928 IP 112.26.0.8.45706 > 112.26.0.1.targus-getdata1: Flags [.], seq 47124:48552, ack 1, win 4107, options [nop,nop,TS val 4294936595 ecr 195225,mptcp dss ack 1818309187 seq 1401972787 subseq 408446 len 1428 csum 0x4bed], length 1428
16:50:39.960673 IP 112.26.0.8.45706 > 112.26.0.1.targus-getdata1: Flags [.], seq 41412:42840, ack 1, win 4107, options [nop,nop,TS val 4294936290 ecr 194757,mptcp dss ack 1818309187 seq 1401958507 subseq 402734 len 1428 csum 0xe4d4], length 1428
16:50:40.022363 IP 112.26.0.8.45706 > 112.26.0.1.targus-getdata1: Flags [.], seq 42840:44268, ack 1, win 4107, options [nop,nop,TS val 4294936335 ecr 194860,mptcp dss ack 1818309187 seq 1401961363 subseq 404162 len 1428 csum 0x9bdd], length 1428
16:50:40.062807 IP 112.26.0.8.45706 > 112.26.0.1.targus-getdata1: Flags [.], seq 44268:45696, ack 1, win 4107, options [nop,nop,TS val 4294936380 ecr 194935,mptcp dss ack 1818309187 seq 1401964219 subseq 405590 len 1428 csum 0xedd8], length 1428
16:50:40.132104 IP 112.26.0.1.targus-getdata1 > 112.26.0.8.45706: Flags [.], ack 39984, win 24205, options [nop,nop,TS val 195422 ecr 4294936102,mptcp dss ack 1401928519], length 0
16:50:40.132468 IP 112.26.0.8.45706 > 112.26.0.1.targus-getdata1: Flags [.], seq 48552:49980, ack 1, win 4107, options [nop,nop,TS val 4294936797 ecr 195422,mptcp dss ack 1818309187 seq 1401981355 subseq 409874 len 1428 csum 0xe5a4], length 1428
16:50:40.206796 IP 112.26.0.8.45706 > 112.26.0.1.targus-getdata1: Flags [.], seq 45696:47124, ack 1, win 4107, options [nop,nop,TS val 4294936451 ecr 195034,mptcp dss ack 1818309187 seq 1401967075 subseq 407018 len 1428 csum 0x1290], length 1428
16:50:40.256327 IP 112.26.0.1.targus-getdata1 > 112.26.0.8.45706: Flags [.], ack 41412, win 24455, options [nop,nop,TS val 195505 ecr 4294936173,mptcp dss ack 1401928519], length 0
16:50:40.256681 IP 112.26.0.8.45706 > 112.26.0.1.targus-getdata1: Flags [.], seq 49980:51408, ack 1, win 4107, options [nop,nop,TS val 4294936921 ecr 195505,mptcp dss ack 1818309187 seq 1401985639 subseq 411302 len 1428 csum 0x400d], length 1428
16:50:40.314510 IP 112.26.0.8.45706 > 112.26.0.1.targus-getdata1: Flags [.], seq 47124:48552, ack 1, win 4107, options [nop,nop,TS val 4294936595 ecr 195225,mptcp dss ack 1818309187 seq 1401972787 subseq 408446 len 1428 csum 0x4bed], length 1428
16:50:40.395687 IP 112.26.0.1.targus-getdata1 > 112.26.0.8.45706: Flags [.], ack 42840, win 24522, options [nop,nop,TS val 195604 ecr 4294936290,mptcp dss ack 1401952795], length 0
16:50:40.395976 IP 112.26.0.8.45706 > 112.26.0.1.targus-getdata1: Flags [.], seq 51408:52836, ack 1, win 4107, options [nop,nop,TS val 4294937061 ecr 195604,mptcp dss ack 1818309187 seq 1401991351 subseq 412730 len 1428 csum 0x6e0c], length 1428
16:50:40.396054 IP 112.26.0.8.45706 > 112.26.0.1.targus-getdata1: Flags [.], seq 52836:54264, ack 1, win 4107, options [nop,nop,TS val 4294937061 ecr 195604,mptcp dss ack 1818309187 seq 1401992779 subseq 414158 len 1428 csum 0xa648], length 1428
16:50:40.467284 IP 112.26.0.1.targus-getdata1 > 112.26.0.8.45706: Flags [.], ack 44268, win 24543, options [nop,nop,TS val 195717 ecr 4294936335,mptcp dss ack 1401957079], length 0
16:50:40.467561 IP 112.26.0.8.45706 > 112.26.0.1.targus-getdata1: Flags [.], seq 54264:55692, ack 1, win 4107, options [nop,nop,TS val 4294937133 ecr 195717,mptcp dss ack 1818309187 seq 1401997063 subseq 415586 len 1428 csum 0xe07e], length 1428
16:50:40.512205 IP 112.26.0.8.45706 > 112.26.0.1.targus-getdata1: Flags [.], seq 48552:49980, ack 1, win 4107, options [nop,nop,TS val 4294936797 ecr 195422,mptcp dss ack 1818309187 seq 1401981355 subseq 409874 len 1428 csum 0xe5a4], length 1428
16:50:40.597580 IP 112.26.0.1.targus-getdata1 > 112.26.0.8.45706: Flags [.], ack 45696, win 24558, options [nop,nop,TS val 195783 ecr 4294936380,mptcp dss ack 1401962791], length 0
16:50:40.597870 IP 112.26.0.8.45706 > 112.26.0.1.targus-getdata1: Flags [.], seq 55692:57120, ack 1, win 4107, options [nop,nop,TS val 4294937263 ecr 195783,mptcp dss ack 1818309187 seq 1402002775 subseq 417014 len 1428 csum 0xf612], length 1428
16:50:40.650748 IP 112.26.0.1.targus-getdata1 > 112.26.0.8.45706: Flags [.], ack 47124, win 24522, options [nop,nop,TS val 195863 ecr 4294936451,mptcp dss ack 1401965647], length 0
16:50:40.651102 IP 112.26.0.8.45706 > 112.26.0.1.targus-getdata1: Flags [.], seq 57120:58548, ack 1, win 4107, options [nop,nop,TS val 4294937317 ecr 195863,mptcp dss ack 1818309187 seq 1402005631 subseq 418442 len 1428 csum 0x707f], length 1428
16:50:40.715793 IP 112.26.0.8.45706 > 112.26.0.1.targus-getdata1: Flags [.], seq 49980:51408, ack 1, win 4107, options [nop,nop,TS val 4294936921 ecr 195505,mptcp dss ack 1818309187 seq 1401985639 subseq 411302 len 1428 csum 0x400d], length 1428
16:50:40.800466 IP 112.26.0.1.targus-getdata1 > 112.26.0.8.45706: Flags [.], ack 48552, win 24522, options [nop,nop,TS val 195957 ecr 4294936595,mptcp dss ack 1401965647], length 0
16:50:40.800815 IP 112.26.0.8.45706 > 112.26.0.1.targus-getdata1: Flags [.], seq 58548:59976, ack 1, win 4107, options [nop,nop,TS val 4294937466 ecr 195957,mptcp dss ack 1818309187 seq 1402014199 subseq 419870 len 1428 csum 0x9f92], length 1428
16:50:40.840253 IP 112.26.0.8.45706 > 112.26.0.1.targus-getdata1: Flags [.], seq 51408:52836, ack 1, win 4107, options [nop,nop,TS val 4294937061 ecr 195604,mptcp dss ack 1818309187 seq 1401991351 subseq 412730 len 1428 csum 0x6e0c], length 1428
16:50:40.910526 IP 112.26.0.8.45706 > 112.26.0.1.targus-getdata1: Flags [.], seq 52836:54264, ack 1, win 4107, options [nop,nop,TS val 4294937061 ecr 195604,mptcp dss ack 1818309187 seq 1401992779 subseq 414158 len 1428 csum 0xa648], length 1428
16:50:40.960060 IP 112.26.0.8.45706 > 112.26.0.1.targus-getdata1: Flags [.], seq 54264:55692, ack 1, win 4107, options [nop,nop,TS val 4294937133 ecr 195717,mptcp dss ack 1818309187 seq 1401997063 subseq 415586 len 1428 csum 0xe07e], length 1428
16:50:40.998517 IP 112.26.0.1.targus-getdata1 > 112.26.0.8.45706: Flags [.], ack 49980, win 24543, options [nop,nop,TS val 196157 ecr 4294936797,mptcp dss ack 1401975643], length 0
16:50:40.998875 IP 112.26.0.8.45706 > 112.26.0.1.targus-getdata1: Flags [.], seq 59976:61404, ack 1, win 4107, options [nop,nop,TS val 4294937664 ecr 196157,mptcp dss ack 1818309187 seq 1402021339 subseq 421298 len 1428 csum 0x9ea8], length 1428
16:50:41.061332 IP 112.26.0.8.45706 > 112.26.0.1.targus-getdata1: Flags [.], seq 55692:57120, ack 1, win 4107, options [nop,nop,TS val 4294937263 ecr 195783,mptcp dss ack 1818309187 seq 1402002775 subseq 417014 len 1428 csum 0xf612], length 1428
16:50:41.127633 IP 112.26.0.8.45706 > 112.26.0.1.targus-getdata1: Flags [.], seq 57120:58548, ack 1, win 4107, options [nop,nop,TS val 4294937317 ecr 195863,mptcp dss ack 1818309187 seq 1402005631 subseq 418442 len 1428 csum 0x707f], length 1428
16:50:41.201003 IP 112.26.0.1.targus-getdata1 > 112.26.0.8.45706: Flags [.], ack 51408, win 24525, options [nop,nop,TS val 196359 ecr 4294936921,mptcp dss ack 1401987067], length 0
16:50:41.201332 IP 112.26.0.8.45706 > 112.26.0.1.targus-getdata1: Flags [.], seq 61404:62832, ack 1, win 4107, options [nop,nop,TS val 4294937866 ecr 196359,mptcp dss ack 1818309187 seq 1402028479 subseq 422726 len 1428 csum 0xbdab], length 1428
16:50:41.251456 IP 112.26.0.8.45706 > 112.26.0.1.targus-getdata1: Flags [.], seq 58548:59976, ack 1, win 4107, options [nop,nop,TS val 4294937466 ecr 195957,mptcp dss ack 1818309187 seq 1402014199 subseq 419870 len 1428 csum 0x9f92], length 1428
16:50:41.335797 IP 112.26.0.1.targus-getdata1 > 112.26.0.8.45706: Flags [.], ack 52836, win 24558, options [nop,nop,TS val 196483 ecr 4294937061,mptcp dss ack 1401992779], length 0
16:50:41.336146 IP 112.26.0.8.45706 > 112.26.0.1.targus-getdata1: Flags [.], seq 62832:64260, ack 1, win 4107, options [nop,nop,TS val 4294938001 ecr 196483,mptcp dss ack 1818309187 seq 1402032763 subseq 424154 len 1428 csum 0x79b2], length 1428
16:50:41.385206 IP 112.26.0.1.targus-getdata1 > 112.26.0.8.45706: Flags [.], ack 54264, win 24540, options [nop,nop,TS val 196553 ecr 4294937061,mptcp dss ack 1401994207], length 0
16:50:41.385546 IP 112.26.0.8.45706 > 112.26.0.1.targus-getdata1: Flags [.], seq 64260:65688, ack 1, win 4107, options [nop,nop,TS val 4294938051 ecr 196553,mptcp dss ack 1818309187 seq 1402034191 subseq 425582 len 1428 csum 0x2716], length 1428
16:50:41.385649 IP 112.26.0.8.45706 > 112.26.0.1.targus-getdata1: Flags [.], seq 65688:67116, ack 1, win 4107, options [nop,nop,TS val 4294938051 ecr 196553,mptcp dss ack 1818309187 seq 1402035619 subseq 427010 len 1428 csum 0x9be1], length 1428
16:50:41.449159 IP 112.26.0.8.45706 > 112.26.0.1.targus-getdata1: Flags [.], seq 59976:61404, ack 1, win 4107, options [nop,nop,TS val 4294937664 ecr 196157,mptcp dss ack 1818309187 seq 1402021339 subseq 421298 len 1428 csum 0x9ea8], length 1428
16:50:41.496755 IP 112.26.0.1.targus-getdata1 > 112.26.0.8.45706: Flags [.], ack 55692, win 24536, options [nop,nop,TS val 196649 ecr 4294937133,mptcp dss ack 1401998491], length 0
16:50:41.496990 IP 112.26.0.8.45706 > 112.26.0.1.targus-getdata1: Flags [.], seq 67116:68544, ack 1, win 4107, options [nop,nop,TS val 4294938162 ecr 196649,mptcp dss ack 1818309187 seq 1402042759 subseq 428438 len 1428 csum 0xa55a], length 1428
16:50:41.562612 IP 112.26.0.1.targus-getdata1 > 112.26.0.8.45706: Flags [.], ack 57120, win 24540, options [nop,nop,TS val 196739 ecr 4294937263,mptcp dss ack 1401999919], length 0
16:50:41.562965 IP 112.26.0.8.45706 > 112.26.0.1.targus-getdata1: Flags [.], seq 68544:69972, ack 1, win 4107, options [nop,nop,TS val 4294938228 ecr 196739,mptcp dss ack 1818309187 seq 1402049899 subseq 429866 len 1428 csum 0xfd1c], length 1428
16:50:41.590709 IP 112.26.0.1.targus-getdata1 > 112.26.0.8.45706: Flags [.], ack 58548, win 24525, options [nop,nop,TS val 196820 ecr 4294937317,mptcp dss ack 1402008487], length 0
16:50:41.591047 IP 112.26.0.8.45706 > 112.26.0.1.targus-getdata1: Flags [.], seq 69972:71400, ack 1, win 4107, options [nop,nop,TS val 4294938256 ecr 196820,mptcp dss ack 1818309187 seq 1402051327 subseq 431294 len 1428 csum 0xfa01], length 1428
16:50:41.650354 IP 112.26.0.8.45706 > 112.26.0.1.targus-getdata1: Flags [.], seq 61404:62832, ack 1, win 4107, options [nop,nop,TS val 4294937866 ecr 196359,mptcp dss ack 1818309187 seq 1402028479 subseq 422726 len 1428 csum 0xbdab], length 1428
16:50:41.689367 IP 112.26.0.1.targus-getdata1 > 112.26.0.8.45706: Flags [.], ack 59976, win 24558, options [nop,nop,TS val 196899 ecr 4294937466,mptcp dss ack 1402012771], length 0
16:50:41.689693 IP 112.26.0.8.45706 > 112.26.0.1.targus-getdata1: Flags [.], seq 71400:72828, ack 1, win 4107, options [nop,nop,TS val 4294938355 ecr 196899,mptcp dss ack 1818309187 seq 1402055611 subseq 432722 len 1428 csum 0xd4ee], length 1428
16:50:41.758863 IP 112.26.0.8.45706 > 112.26.0.1.targus-getdata1: Flags [.], seq 62832:64260, ack 1, win 4107, options [nop,nop,TS val 4294938001 ecr 196483,mptcp dss ack 1818309187 seq 1402032763 subseq 424154 len 1428 csum 0x79b2], length 1428
16:50:41.799820 IP 112.26.0.8.45706 > 112.26.0.1.targus-getdata1: Flags [.], seq 64260:65688, ack 1, win 4107, options [nop,nop,TS val 4294938051 ecr 196553,mptcp dss ack 1818309187 seq 1402034191 subseq 425582 len 1428 csum 0x2716], length 1428
16:50:41.885934 IP 112.26.0.8.45706 > 112.26.0.1.targus-getdata1: Flags [.], seq 65688:67116, ack 1, win 4107, options [nop,nop,TS val 4294938051 ecr 196553,mptcp dss ack 1818309187 seq 1402035619 subseq 427010 len 1428 csum 0x9be1], length 1428
16:50:41.952802 IP 112.26.0.8.45706 > 112.26.0.1.targus-getdata1: Flags [.], seq 67116:68544, ack 1, win 4107, options [nop,nop,TS val 4294938162 ecr 196649,mptcp dss ack 1818309187 seq 1402042759 subseq 428438 len 1428 csum 0xa55a], length 1428
16:50:42.025061 IP 112.26.0.1.targus-getdata1 > 112.26.0.8.45706: Flags [.], ack 61404, win 24576, options [nop,nop,TS val 197138 ecr 4294937664,mptcp dss ack 1402024195], length 0
16:50:42.025295 IP 112.26.0.8.45706 > 112.26.0.1.targus-getdata1: Flags [.], seq 72828:74256, ack 1, win 4107, options [nop,nop,TS val 4294938691 ecr 197138,mptcp dss ack 1818309187 seq 1402072747 subseq 434150 len 1428 csum 0xa5db], length 1428
16:50:42.101997 IP 112.26.0.8.45706 > 112.26.0.1.targus-getdata1: Flags [.], seq 68544:69972, ack 1, win 4107, options [nop,nop,TS val 4294938228 ecr 196739,mptcp dss ack 1818309187 seq 1402049899 subseq 429866 len 1428 csum 0xfd1c], length 1428
16:50:42.129385 IP 112.26.0.8.45706 > 112.26.0.1.targus-getdata1: Flags [.], seq 69972:71400, ack 1, win 4107, options [nop,nop,TS val 4294938256 ecr 196820,mptcp dss ack 1818309187 seq 1402051327 subseq 431294 len 1428 csum 0xfa01], length 1428
16:50:42.218683 IP 112.26.0.8.45706 > 112.26.0.1.targus-getdata1: Flags [.], seq 71400:72828, ack 1, win 4107, options [nop,nop,TS val 4294938355 ecr 196899,mptcp dss ack 1818309187 seq 1402055611 subseq 432722 len 1428 csum 0xd4ee], length 1428
16:50:42.263506 IP 112.26.0.1.targus-getdata1 > 112.26.0.8.45706: Flags [.], ack 62832, win 24558, options [nop,nop,TS val 197376 ecr 4294937866,mptcp dss ack 1402032763], length 0
16:50:42.263715 IP 112.26.0.8.45706 > 112.26.0.1.targus-getdata1: Flags [.], seq 74256:75684, ack 1, win 4107, options [nop,nop,TS val 4294938929 ecr 197376,mptcp dss ack 1818309187 seq 1402082743 subseq 435578 len 1428 csum 0xb598], length 1428
16:50:42.332290 IP 112.26.0.1.targus-getdata1 > 112.26.0.8.45706: Flags [.], ack 65688, win 24525, options [nop,nop,TS val 197456 ecr 4294938001,mptcp dss ack 1402035619], length 0
16:50:42.332487 IP 112.26.0.8.45706 > 112.26.0.1.targus-getdata1: Flags [.], seq 75684:77112, ack 1, win 4107, options [nop,nop,TS val 4294938998 ecr 197456,mptcp dss ack 1818309187 seq 1402087027 subseq 437006 len 1428 csum 0x54cb], length 1428
16:50:42.332534 IP 112.26.0.8.45706 > 112.26.0.1.targus-getdata1: Flags [.], seq 77112:78540, ack 1, win 4107, options [nop,nop,TS val 4294938998 ecr 197456,mptcp dss ack 1818309187 seq 1402088455 subseq 438434 len 1428 csum 0xc1ff], length 1428
16:50:42.371633 IP 112.26.0.1.targus-getdata1 > 112.26.0.8.45706: Flags [.], ack 68544, win 24525, options [nop,nop,TS val 197595 ecr 4294938051,mptcp dss ack 1402045615], length 0
16:50:42.371831 IP 112.26.0.8.45706 > 112.26.0.1.targus-getdata1: Flags [.], seq 78540:79968, ack 1, win 4107, options [nop,nop,TS val 4294939037 ecr 197595,mptcp dss ack 1818309187 seq 1402089883 subseq 439862 len 1428 csum 0xfa2b], length 1428
16:50:42.371878 IP 112.26.0.8.45706 > 112.26.0.1.targus-getdata1: Flags [.], seq 79968:81396, ack 1, win 4107, options [nop,nop,TS val 4294939037 ecr 197595,mptcp dss ack 1818309187 seq 1402091311 subseq 441290 len 1428 csum 0x6f4b], length 1428
16:50:42.426336 IP 112.26.0.8.45706 > 112.26.0.1.targus-getdata1: Flags [.], seq 72828:74256, ack 1, win 4107, options [nop,nop,TS val 4294938691 ecr 197138,mptcp dss ack 1818309187 seq 1402072747 subseq 434150 len 1428 csum 0xa5db], length 1428
16:50:42.503774 IP 112.26.0.1.targus-getdata1 > 112.26.0.8.45706: Flags [.], ack 71400, win 24525, options [nop,nop,TS val 197823 ecr 4294938228,mptcp dss ack 1402055611], length 0
16:50:42.504025 IP 112.26.0.8.45706 > 112.26.0.1.targus-getdata1: Flags [.], seq 81396:82824, ack 1, win 4107, options [nop,nop,TS val 4294939169 ecr 197823,mptcp dss ack 1818309187 seq 1402098451 subseq 442718 len 1428 csum 0x93fd], length 1428
16:50:42.504074 IP 112.26.0.8.45706 > 112.26.0.1.targus-getdata1: Flags [.], seq 82824:84252, ack 1, win 4107, options [nop,nop,TS val 4294939169 ecr 197823,mptcp dss ack 1818309187 seq 1402099879 subseq 444146 len 1428 csum 0x5d3b], length 1428
16:50:42.545507 IP 112.26.0.8.45706 > 112.26.0.1.targus-getdata1: Flags [.], seq 74256:75684, ack 1, win 4107, options [nop,nop,TS val 4294938929 ecr 197376,mptcp dss ack 1818309187 seq 1402082743 subseq 435578 len 1428 csum 0xb598], length 1428
16:50:42.605610 IP 112.26.0.8.45706 > 112.26.0.1.targus-getdata1: Flags [.], seq 75684:77112, ack 1, win 4107, options [nop,nop,TS val 4294938998 ecr 197456,mptcp dss ack 1818309187 seq 1402087027 subseq 437006 len 1428 csum 0x54cb], length 1428
16:50:42.660896 IP 112.26.0.8.45706 > 112.26.0.1.targus-getdata1: Flags [.], seq 77112:78540, ack 1, win 4107, options [nop,nop,TS val 4294938998 ecr 197456,mptcp dss ack 1818309187 seq 1402088455 subseq 438434 len 1428 csum 0xc1ff], length 1428
16:50:42.722308 IP 112.26.0.1.targus-getdata1 > 112.26.0.8.45706: Flags [.], ack 72828, win 24543, options [nop,nop,TS val 198040 ecr 4294938355,mptcp dss ack 1402065607], length 0
16:50:42.722658 IP 112.26.0.8.45706 > 112.26.0.1.targus-getdata1: Flags [.], seq 84252:85680, ack 1, win 4107, options [nop,nop,TS val 4294939388 ecr 198040,mptcp dss ack 1818309187 seq 1402107019 subseq 445574 len 1428 csum 0xd81b], length 1428
16:50:42.778580 IP 112.26.0.8.45706 > 112.26.0.1.targus-getdata1: Flags [.], seq 78540:79968, ack 1, win 4107, options [nop,nop,TS val 4294939037 ecr 197595,mptcp dss ack 1818309187 seq 1402089883 subseq 439862 len 1428 csum 0xfa2b], length 1428
16:50:42.846927 IP 112.26.0.8.45706 > 112.26.0.1.targus-getdata1: Flags [.], seq 79968:81396, ack 1, win 4107, options [nop,nop,TS val 4294939037 ecr 197595,mptcp dss ack 1818309187 seq 1402091311 subseq 441290 len 1428 csum 0x6f4b], length 1428
16:50:42.910393 IP 112.26.0.8.45706 > 112.26.0.1.targus-getdata1: Flags [.], seq 81396:82824, ack 1, win 4107, options [nop,nop,TS val 4294939169 ecr 197823,mptcp dss ack 1818309187 seq 1402098451 subseq 442718 len 1428 csum 0x93fd], length 1428
16:50:42.977940 IP 112.26.0.1.targus-getdata1 > 112.26.0.8.45706: Flags [.], ack 75684, win 24543, options [nop,nop,TS val 198188 ecr 4294938691,mptcp dss ack 1402071319], length 0
16:50:42.978250 IP 112.26.0.8.45706 > 112.26.0.1.targus-getdata1: Flags [.], seq 85680:87108, ack 1, win 4107, options [nop,nop,TS val 4294939643 ecr 198188,mptcp dss ack 1818309187 seq 1402119871 subseq 447002 len 1428 csum 0xf2c5], length 1428
16:50:42.978299 IP 112.26.0.8.45706 > 112.26.0.1.targus-getdata1: Flags [.], seq 87108:88536, ack 1, win 4107, options [nop,nop,TS val 4294939643 ecr 198188,mptcp dss ack 1818309187 seq 1402121299 subseq 448430 len 1428 csum 0x8fc9], length 1428
16:50:42.978400 IP 112.26.0.8.45706 > 112.26.0.1.targus-getdata1: Flags [.], seq 88536:89964, ack 1, win 4107, options [nop,nop,TS val 4294939643 ecr 198188,mptcp dss ack 1818309187 seq 1402122727 subseq 449858 len 1428 csum 0xa21d], length 1428
16:50:43.021817 IP 112.26.0.8.45706 > 112.26.0.1.targus-getdata1: Flags [.], seq 82824:84252, ack 1, win 4107, options [nop,nop,TS val 4294939169 ecr 197823,mptcp dss ack 1818309187 seq 1402099879 subseq 444146 len 1428 csum 0x5d3b], length 1428
16:50:43.109059 IP 112.26.0.8.45706 > 112.26.0.1.targus-getdata1: Flags [.], seq 84252:85680, ack 1, win 4107, options [nop,nop,TS val 4294939388 ecr 198040,mptcp dss ack 1818309187 seq 1402107019 subseq 445574 len 1428 csum 0xd81b], length 1428
16:50:43.172969 IP 112.26.0.1.targus-getdata1 > 112.26.0.8.45706: Flags [.], ack 78540, win 24543, options [nop,nop,TS val 198375 ecr 4294938998,mptcp dss ack 1402084171], length 0
16:50:43.173200 IP 112.26.0.8.45706 > 112.26.0.1.targus-getdata1: Flags [.], seq 89964:91392, ack 1, win 4107, options [nop,nop,TS val 4294939838 ecr 198375,mptcp dss ack 1818309187 seq 1402132723 subseq 451286 len 1428 csum 0xd5c3], length 1428
16:50:43.173249 IP 112.26.0.8.45706 > 112.26.0.1.targus-getdata1: Flags [.], seq 91392:92820, ack 1, win 4107, options [nop,nop,TS val 4294939838 ecr 198375,mptcp dss ack 1818309187 seq 1402134151 subseq 452714 len 1428 csum 0x2d43], length 1428
16:50:43.309260 IP 112.26.0.1.targus-getdata1 > 112.26.0.8.45706: Flags [.], ack 81396, win 24558, options [nop,nop,TS val 198511 ecr 4294939037,mptcp dss ack 1402092739], length 0
16:50:43.309544 IP 112.26.0.8.45706 > 112.26.0.1.targus-getdata1: Flags [.], seq 92820:94248, ack 1, win 4107, options [nop,nop,TS val 4294939975 ecr 198511,mptcp dss ack 1818309187 seq 1402138435 subseq 454142 len 1428 csum 0x3256], length 1428
16:50:43.309621 IP 112.26.0.8.45706 > 112.26.0.1.targus-getdata1: Flags [.], seq 94248:95676, ack 1, win 4107, options [nop,nop,TS val 4294939975 ecr 198511,mptcp dss ack 1818309187 seq 1402139863 subseq 455570 len 1428 csum 0x3a3e], length 1428
16:50:43.384176 IP 112.26.0.8.45706 > 112.26.0.1.targus-getdata1: Flags [.], seq 85680:87108, ack 1, win 4107, options [nop,nop,TS val 4294939643 ecr 198188,mptcp dss ack 1818309187 seq 1402119871 subseq 447002 len 1428 csum 0xf2c5], length 1428
16:50:43.433004 IP 112.26.0.8.45706 > 112.26.0.1.targus-getdata1: Flags [.], seq 87108:88536, ack 1, win 4107, options [nop,nop,TS val 4294939643 ecr 198188,mptcp dss ack 1818309187 seq 1402121299 subseq 448430 len 1428 csum 0x8fc9], length 1428
16:50:43.483513 IP 112.26.0.1.targus-getdata1 > 112.26.0.8.45706: Flags [.], ack 84252, win 24558, options [nop,nop,TS val 198666 ecr 4294939169,mptcp dss ack 1402101307], length 0
16:50:43.483803 IP 112.26.0.8.45706 > 112.26.0.1.targus-getdata1: Flags [.], seq 95676:97104, ack 1, win 4107, options [nop,nop,TS val 4294940149 ecr 198666,mptcp dss ack 1818309187 seq 1402149859 subseq 456998 len 1428 csum 0x2cfa], length 1428
16:50:43.483878 IP 112.26.0.8.45706 > 112.26.0.1.targus-getdata1: Flags [.], seq 97104:98532, ack 1, win 4107, options [nop,nop,TS val 4294940149 ecr 198666,mptcp dss ack 1818309187 seq 1402151287 subseq 458426 len 1428 csum 0xe1fb], length 1428
16:50:43.483992 IP 112.26.0.8.45706 > 112.26.0.1.targus-getdata1: Flags [.], seq 98532:99960, ack 1, win 4107, options [nop,nop,TS val 4294940149 ecr 198666,mptcp dss ack 1818309187 seq 1402152715 subseq 459854 len 1428 csum 0xe3ff], length 1428
16:50:43.541406 IP 112.26.0.8.45706 > 112.26.0.1.targus-getdata1: Flags [.], seq 88536:89964, ack 1, win 4107, options [nop,nop,TS val 4294939643 ecr 198188,mptcp dss ack 1818309187 seq 1402122727 subseq 449858 len 1428 csum 0xa21d], length 1428
16:50:43.605640 IP 112.26.0.8.45706 > 112.26.0.1.targus-getdata1: Flags [.], seq 89964:91392, ack 1, win 4107, options [nop,nop,TS val 4294939838 ecr 198375,mptcp dss ack 1818309187 seq 1402132723 subseq 451286 len 1428 csum 0xd5c3], length 1428
16:50:43.676775 IP 112.26.0.8.45706 > 112.26.0.1.targus-getdata1: Flags [.], seq 91392:92820, ack 1, win 4107, options [nop,nop,TS val 4294939838 ecr 198375,mptcp dss ack 1818309187 seq 1402134151 subseq 452714 len 1428 csum 0x2d43], length 1428
16:50:43.766841 IP 112.26.0.1.targus-getdata1 > 112.26.0.8.45706: Flags [.], ack 85680, win 24558, options [nop,nop,TS val 198896 ecr 4294939388,mptcp dss ack 1402109875], length 0
16:50:43.767075 IP 112.26.0.8.45706 > 112.26.0.1.targus-getdata1: Flags [.], seq 99960:101388, ack 1, win 4107, options [nop,nop,TS val 4294940432 ecr 198896,mptcp dss ack 1818309187 seq 1402165567 subseq 461282 len 1428 csum 0xaedd], length 1428
16:50:43.808564 IP 112.26.0.8.45706 > 112.26.0.1.targus-getdata1: Flags [.], seq 92820:94248, ack 1, win 4107, options [nop,nop,TS val 4294939975 ecr 198511,mptcp dss ack 1818309187 seq 1402138435 subseq 454142 len 1428 csum 0x3256], length 1428
16:50:43.884307 IP 112.26.0.8.45706 > 112.26.0.1.targus-getdata1: Flags [.], seq 94248:95676, ack 1, win 4107, options [nop,nop,TS val 4294939975 ecr 198511,mptcp dss ack 1818309187 seq 1402139863 subseq 455570 len 1428 csum 0x3a3e], length 1428
16:50:43.920410 IP 112.26.0.1.targus-getdata1 > 112.26.0.8.45706: Flags [.], ack 88536, win 24576, options [nop,nop,TS val 199091 ecr 4294939643,mptcp dss ack 1402122727], length 0
16:50:43.920629 IP 112.26.0.8.45706 > 112.26.0.1.targus-getdata1: Flags [.], seq 101388:102816, ack 1, win 4107, options [nop,nop,TS val 4294940586 ecr 199091,mptcp dss ack 1818309187 seq 1402174135 subseq 462710 len 1428 csum 0xe73a], length 1428
16:50:43.920673 IP 112.26.0.8.45706 > 112.26.0.1.targus-getdata1: Flags [.], seq 102816:104244, ack 1, win 4107, options [nop,nop,TS val 4294940586 ecr 199091,mptcp dss ack 1818309187 seq 1402175563 subseq 464138 len 1428 csum 0x5f40], length 1428
