16:50:02.739807 IP 112.26.1.8.55191 > 112.26.1.1.targus-getdata1: Flags [S], seq 2901888254, win 65535, options [mss 1460,sackOK,TS val 4294899300 ecr 0,nop,wscale 6,mptcp join id 3 token 0x92d88ed4 nonce 0x68d3a430], length 0
16:50:02.805240 IP 112.26.1.8.55191 > 112.26.1.1.targus-getdata1: Flags [S], seq 2901888254, win 65535, options [mss 1460,sackOK,TS val 4294899300 ecr 0,nop,wscale 6,mptcp join id 3 token 0x92d88ed4 nonce 0x68d3a430], length 0
16:50:02.860651 IP 112.26.1.1.targus-getdata1 > 112.26.1.8.55191: Flags [S.], seq 1788441470, ack 2901888255, win 65535, options [mss 1460,sackOK,TS val 158446 ecr 4294899300,nop,wscale 6,mptcp join id 3 hmac 0xb87af290a2f9ebc nonce 0x9e7bba42], length 0
16:50:02.916231 IP 112.26.1.1.targus-getdata1 > 112.26.1.8.55191: Flags [S.], seq 1788441470, ack 2901888255, win 65535, options [mss 1460,sackOK,TS val 158446 ecr 4294899300,nop,wscale 6,mptcp join id 3 hmac 0xb87af290a2f9ebc nonce 0x9e7bba42], length 0
16:50:03.068460 IP 112.26.1.8.55191 > 112.26.1.1.targus-getdata1: Flags [.], ack 1, win 4107, options [nop,nop,TS val 4294899618 ecr 158446,mptcp join hmac 0xa5ddd1a659969cc82eee92f570562fd348ba605a], length 0
16:50:03.069317 IP 112.26.1.8.55191 > 112.26.1.1.targus-getdata1: Flags [.], ack 1, win 4107, options [nop,nop,TS val 4294899618 ecr 158446,mptcp join hmac 0xa5ddd1a659969cc82eee92f570562fd348ba605a], length 0
16:50:03.071810 IP 112.26.1.1.targus-getdata1 > 112.26.1.8.55191: Flags [.], ack 1, win 4017, options [nop,nop,TS val 158710 ecr 4294899618,mptcp dss ack 1760099986], length 0
16:50:41.373360 IP 112.26.1.8.56443 > 112.26.1.1.targus-getdata1: Flags [.], seq 1767720831:1767722259, ack 3323357634, win 4107, options [nop,nop,TS val 4294937516 ecr 195976,mptcp dss ack 1818309187 seq 1402017055 subseq 456961 len 1428 csum 0xec51], length 1428
16:50:41.374895 IP 112.26.1.1.targus-getdata1 > 112.26.1.8.56443: Flags [.], ack 1428, win 24543, options [nop,nop,TS val 197014 ecr 4294937419,mptcp dss ack 1402019911], length 0
16:50:41.441746 IP 112.26.1.1.targus-getdata1 > 112.26.1.8.56443: Flags [.], ack 1428, win 24543, options [nop,nop,TS val 197014 ecr 4294937419,mptcp dss ack 1402019911], length 0
16:50:41.479508 IP 112.26.1.8.56443 > 112.26.1.1.targus-getdata1: Flags [.], seq 1428:2856, ack 1, win 4107, options [nop,nop,TS val 4294937648 ecr 196060,mptcp dss ack 1818309187 seq 1402019911 subseq 458389 len 1428 csum 0x65a8], length 1428
16:50:41.598968 IP 112.26.1.8.56443 > 112.26.1.1.targus-getdata1: Flags [.], seq 2856:4284, ack 1, win 4107, options [nop,nop,TS val 4294937807 ecr 196234,mptcp dss ack 1818309187 seq 1402025623 subseq 459817 len 1428 csum 0x8fe1], length 1428
16:50:41.600181 IP 112.26.1.1.targus-getdata1 > 112.26.1.8.56443: Flags [.], ack 4284, win 24543, options [nop,nop,TS val 197240 ecr 4294937648,mptcp dss ack 1402028479], length 0
16:50:41.669762 IP 112.26.1.1.targus-getdata1 > 112.26.1.8.56443: Flags [.], ack 4284, win 24543, options [nop,nop,TS val 197240 ecr 4294937648,mptcp dss ack 1402028479], length 0
16:50:41.704690 IP 112.26.1.8.56443 > 112.26.1.1.targus-getdata1: Flags [.], seq 4284:5712, ack 1, win 4107, options [nop,nop,TS val 4294937918 ecr 196371,mptcp dss ack 1818309187 seq 1402029907 subseq 461245 len 1428 csum 0xd01a], length 1428
16:50:41.780557 IP 112.26.1.8.56443 > 112.26.1.1.targus-getdata1: Flags [.], seq 5712:7140, ack 1, win 4107, options [nop,nop,TS val 4294938084 ecr 196512,mptcp dss ack 1818309187 seq 1402038475 subseq 462673 len 1428 csum 0xc456], length 1428
16:50:41.816685 IP 112.26.1.1.targus-getdata1 > 112.26.1.8.56443: Flags [.], ack 7140, win 24525, options [nop,nop,TS val 197456 ecr 4294937918,mptcp dss ack 1402035619], length 0
16:50:41.825018 IP 112.26.1.1.targus-getdata1 > 112.26.1.8.56443: Flags [.], ack 7140, win 24525, options [nop,nop,TS val 197456 ecr 4294937918,mptcp dss ack 1402035619], length 0
16:50:41.899678 IP 112.26.1.8.56443 > 112.26.1.1.targus-getdata1: Flags [.], seq 7140:8568, ack 1, win 4107, options [nop,nop,TS val 4294938210 ecr 196674,mptcp dss ack 1818309187 seq 1402047043 subseq 464101 len 1428 csum 0x75d0], length 1428
16:50:41.987470 IP 112.26.1.8.56443 > 112.26.1.1.targus-getdata1: Flags [.], seq 8568:9996, ack 1, win 4107, options [nop,nop,TS val 4294938210 ecr 196674,mptcp dss ack 1818309187 seq 1402048471 subseq 465529 len 1428 csum 0x6a9f], length 1428
16:50:41.989395 IP 112.26.1.1.targus-getdata1 > 112.26.1.8.56443: Flags [.], ack 9996, win 24558, options [nop,nop,TS val 197628 ecr 4294938210,mptcp dss ack 1402049899], length 0
16:50:42.040342 IP 112.26.1.1.targus-getdata1 > 112.26.1.8.56443: Flags [.], ack 9996, win 24558, options [nop,nop,TS val 197628 ecr 4294938210,mptcp dss ack 1402049899], length 0
16:50:42.085133 IP 112.26.1.8.56443 > 112.26.1.1.targus-getdata1: Flags [.], seq 9996:11424, ack 1, win 4107, options [nop,nop,TS val 4294938383 ecr 196847,mptcp dss ack 1818309187 seq 1402057039 subseq 466957 len 1428 csum 0x8c8d], length 1428
16:50:42.137642 IP 112.26.1.8.56443 > 112.26.1.1.targus-getdata1: Flags [.], seq 11424:12852, ack 1, win 4107, options [nop,nop,TS val 4294938383 ecr 196847,mptcp dss ack 1818309187 seq 1402058467 subseq 468385 len 1428 csum 0x1a34], length 1428
16:50:42.191878 IP 112.26.1.1.targus-getdata1 > 112.26.1.8.56443: Flags [.], ack 12852, win 24525, options [nop,nop,TS val 197823 ecr 4294938383,mptcp dss ack 1402055611], length 0
16:50:42.195214 IP 112.26.1.8.56443 > 112.26.1.1.targus-getdata1: Flags [.], seq 12852:14280, ack 1, win 4107, options [nop,nop,TS val 4294938383 ecr 196847,mptcp dss ack 1818309187 seq 1402059895 subseq 469813 len 1428 csum 0x23], length 1428
16:50:42.255191 IP 112.26.1.1.targus-getdata1 > 112.26.1.8.56443: Flags [.], ack 12852, win 24525, options [nop,nop,TS val 197823 ecr 4294938383,mptcp dss ack 1402055611], length 0
16:50:42.307057 IP 112.26.1.8.56443 > 112.26.1.1.targus-getdata1: Flags [.], seq 14280:15708, ack 1, win 4107, options [nop,nop,TS val 4294938526 ecr 197014,mptcp dss ack 1818309187 seq 1402064179 subseq 471241 len 1428 csum 0x53f5], length 1428
16:50:42.309632 IP 112.26.1.1.targus-getdata1 > 112.26.1.8.56443: Flags [.], ack 15708, win 24540, options [nop,nop,TS val 197948 ecr 4294938383,mptcp dss ack 1402065607], length 0
16:50:42.364504 IP 112.26.1.1.targus-getdata1 > 112.26.1.8.56443: Flags [.], ack 15708, win 24540, options [nop,nop,TS val 197948 ecr 4294938383,mptcp dss ack 1402065607], length 0
16:50:42.400555 IP 112.26.1.8.56443 > 112.26.1.1.targus-getdata1: Flags [.], seq 15708:17136, ack 1, win 4107, options [nop,nop,TS val 4294938526 ecr 197014,mptcp dss ack 1818309187 seq 1402065607 subseq 472669 len 1428 csum 0x1374], length 1428
16:50:42.444509 IP 112.26.1.8.56443 > 112.26.1.1.targus-getdata1: Flags [.], seq 17136:18564, ack 1, win 4107, options [nop,nop,TS val 4294938686 ecr 197240,mptcp dss ack 1818309187 seq 1402069891 subseq 474097 len 1428 csum 0x87a0], length 1428
16:50:42.446927 IP 112.26.1.1.targus-getdata1 > 112.26.1.8.56443: Flags [.], ack 18564, win 24543, options [nop,nop,TS val 198085 ecr 4294938526,mptcp dss ack 1402071319], length 0
16:50:42.499126 IP 112.26.1.1.targus-getdata1 > 112.26.1.8.56443: Flags [.], ack 18564, win 24543, options [nop,nop,TS val 198085 ecr 4294938526,mptcp dss ack 1402071319], length 0
16:50:42.549154 IP 112.26.1.8.56443 > 112.26.1.1.targus-getdata1: Flags [.], seq 18564:19992, ack 1, win 4107, options [nop,nop,TS val 4294938686 ecr 197240,mptcp dss ack 1818309187 seq 1402071319 subseq 475525 len 1428 csum 0x2aa6], length 1428
16:50:42.627774 IP 112.26.1.8.56443 > 112.26.1.1.targus-getdata1: Flags [.], seq 19992:21420, ack 1, win 4107, options [nop,nop,TS val 4294938905 ecr 197456,mptcp dss ack 1818309187 seq 1402079887 subseq 476953 len 1428 csum 0xff2a], length 1428
16:50:42.672211 IP 112.26.1.1.targus-getdata1 > 112.26.1.8.56443: Flags [.], ack 21420, win 24540, options [nop,nop,TS val 198312 ecr 4294938686,mptcp dss ack 1402081315], length 0
16:50:42.678827 IP 112.26.1.1.targus-getdata1 > 112.26.1.8.56443: Flags [.], ack 21420, win 24540, options [nop,nop,TS val 198312 ecr 4294938686,mptcp dss ack 1402081315], length 0
16:50:42.734087 IP 112.26.1.8.56443 > 112.26.1.1.targus-getdata1: Flags [.], seq 21420:22848, ack 1, win 4107, options [nop,nop,TS val 4294938905 ecr 197456,mptcp dss ack 1818309187 seq 1402081315 subseq 478381 len 1428 csum 0xc5da], length 1428
16:50:42.853215 IP 112.26.1.8.56443 > 112.26.1.1.targus-getdata1: Flags [.], seq 22848:24276, ack 1, win 4107, options [nop,nop,TS val 4294939142 ecr 197628,mptcp dss ack 1818309187 seq 1402095595 subseq 479809 len 1428 csum 0x1675], length 1428
16:50:42.854848 IP 112.26.1.1.targus-getdata1 > 112.26.1.8.56443: Flags [.], ack 24276, win 24558, options [nop,nop,TS val 198494 ecr 4294938905,mptcp dss ack 1402091311], length 0
16:50:42.929022 IP 112.26.1.1.targus-getdata1 > 112.26.1.8.56443: Flags [.], ack 24276, win 24558, options [nop,nop,TS val 198494 ecr 4294938905,mptcp dss ack 1402091311], length 0
16:50:42.991452 IP 112.26.1.8.56443 > 112.26.1.1.targus-getdata1: Flags [.], seq 24276:25704, ack 1, win 4107, options [nop,nop,TS val 4294939142 ecr 197628,mptcp dss ack 1818309187 seq 1402097023 subseq 481237 len 1428 csum 0xf840], length 1428
16:50:43.042394 IP 112.26.1.8.56443 > 112.26.1.1.targus-getdata1: Flags [.], seq 25704:27132, ack 1, win 4107, options [nop,nop,TS val 4294939313 ecr 197823,mptcp dss ack 1818309187 seq 1402104163 subseq 482665 len 1428 csum 0xc78], length 1428
16:50:43.044253 IP 112.26.1.1.targus-getdata1 > 112.26.1.8.56443: Flags [.], ack 27132, win 24558, options [nop,nop,TS val 198683 ecr 4294939142,mptcp dss ack 1402101307], length 0
16:50:43.092106 IP 112.26.1.1.targus-getdata1 > 112.26.1.8.56443: Flags [.], ack 27132, win 24558, options [nop,nop,TS val 198683 ecr 4294939142,mptcp dss ack 1402101307], length 0
16:50:43.145151 IP 112.26.1.8.56443 > 112.26.1.1.targus-getdata1: Flags [.], seq 27132:28560, ack 1, win 4107, options [nop,nop,TS val 4294939313 ecr 197823,mptcp dss ack 1818309187 seq 1402105591 subseq 484093 len 1428 csum 0xbd1c], length 1428
16:50:43.195387 IP 112.26.1.8.56443 > 112.26.1.1.targus-getdata1: Flags [.], seq 28560:29988, ack 1, win 4107, options [nop,nop,TS val 4294939459 ecr 197948,mptcp dss ack 1818309187 seq 1402111303 subseq 485521 len 1428 csum 0x1388], length 1428
16:50:43.196456 IP 112.26.1.1.targus-getdata1 > 112.26.1.8.56443: Flags [.], ack 29988, win 24558, options [nop,nop,TS val 198836 ecr 4294939313,mptcp dss ack 1402108447], length 0
16:50:43.240264 IP 112.26.1.1.targus-getdata1 > 112.26.1.8.56443: Flags [.], ack 29988, win 24558, options [nop,nop,TS val 198836 ecr 4294939313,mptcp dss ack 1402108447], length 0
16:50:43.313893 IP 112.26.1.8.56443 > 112.26.1.1.targus-getdata1: Flags [.], seq 29988:31416, ack 1, win 4107, options [nop,nop,TS val 4294939459 ecr 197948,mptcp dss ack 1818309187 seq 1402112731 subseq 486949 len 1428 csum 0xbf41], length 1428
16:50:43.373871 IP 112.26.1.8.56443 > 112.26.1.1.targus-getdata1: Flags [.], seq 31416:32844, ack 1, win 4107, options [nop,nop,TS val 4294939565 ecr 198085,mptcp dss ack 1818309187 seq 1402114159 subseq 488377 len 1428 csum 0x1f15], length 1428
16:50:43.376099 IP 112.26.1.1.targus-getdata1 > 112.26.1.8.56443: Flags [.], ack 32844, win 24558, options [nop,nop,TS val 199015 ecr 4294939459,mptcp dss ack 1402115587], length 0
16:50:43.411208 IP 112.26.1.1.targus-getdata1 > 112.26.1.8.56443: Flags [.], ack 32844, win 24558, options [nop,nop,TS val 199015 ecr 4294939459,mptcp dss ack 1402115587], length 0
16:50:43.450891 IP 112.26.1.8.56443 > 112.26.1.1.targus-getdata1: Flags [.], seq 32844:34272, ack 1, win 4107, options [nop,nop,TS val 4294939565 ecr 198085,mptcp dss ack 1818309187 seq 1402115587 subseq 489805 len 1428 csum 0x75a2], length 1428
16:50:43.512297 IP 112.26.1.8.56443 > 112.26.1.1.targus-getdata1: Flags [.], seq 34272:35700, ack 1, win 4107, options [nop,nop,TS val 4294939756 ecr 198312,mptcp dss ack 1818309187 seq 1402128439 subseq 491233 len 1428 csum 0x97b2], length 1428
16:50:43.545075 IP 112.26.1.1.targus-getdata1 > 112.26.1.8.56443: Flags [.], ack 35700, win 24558, options [nop,nop,TS val 199185 ecr 4294939565,mptcp dss ack 1402125583], length 0
16:50:43.583664 IP 112.26.1.1.targus-getdata1 > 112.26.1.8.56443: Flags [.], ack 35700, win 24558, options [nop,nop,TS val 199185 ecr 4294939565,mptcp dss ack 1402125583], length 0
16:50:43.616671 IP 112.26.1.8.56443 > 112.26.1.1.targus-getdata1: Flags [.], seq 35700:37128, ack 1, win 4107, options [nop,nop,TS val 4294939756 ecr 198312,mptcp dss ack 1818309187 seq 1402129867 subseq 492661 len 1428 csum 0x1613], length 1428
16:50:43.683547 IP 112.26.1.8.56443 > 112.26.1.1.targus-getdata1: Flags [.], seq 37128:38556, ack 1, win 4107, options [nop,nop,TS val 4294939756 ecr 198312,mptcp dss ack 1818309187 seq 1402131295 subseq 494089 len 1428 csum 0x1575], length 1428
16:50:43.688098 IP 112.26.1.1.targus-getdata1 > 112.26.1.8.56443: Flags [.], ack 38556, win 24576, options [nop,nop,TS val 199324 ecr 4294939756,mptcp dss ack 1402134151], length 0
16:50:43.757653 IP 112.26.1.1.targus-getdata1 > 112.26.1.8.56443: Flags [.], ack 38556, win 24576, options [nop,nop,TS val 199324 ecr 4294939756,mptcp dss ack 1402134151], length 0
16:50:43.819729 IP 112.26.1.8.56443 > 112.26.1.1.targus-getdata1: Flags [.], seq 38556:39984, ack 1, win 4107, options [nop,nop,TS val 4294940003 ecr 198494,mptcp dss ack 1818309187 seq 1402141291 subseq 495517 len 1428 csum 0x5381], length 1428
16:50:43.915849 IP 112.26.1.8.56443 > 112.26.1.1.targus-getdata1: Flags [.], seq 39984:41412, ack 1, win 4107, options [nop,nop,TS val 4294940003 ecr 198494,mptcp dss ack 1818309187 seq 1402142719 subseq 496945 len 1428 csum 0x92be], length 1428
16:50:43.917834 IP 112.26.1.1.targus-getdata1 > 112.26.1.8.56443: Flags [.], ack 41412, win 24576, options [nop,nop,TS val 199557 ecr 4294940003,mptcp dss ack 1402145575], length 0
16:50:43.975639 IP 112.26.1.1.targus-getdata1 > 112.26.1.8.56443: Flags [.], ack 41412, win 24576, options [nop,nop,TS val 199557 ecr 4294940003,mptcp dss ack 1402145575], length 0
16:50:44.040861 IP 112.26.1.8.56443 > 112.26.1.1.targus-getdata1: Flags [.], seq 41412:42840, ack 1, win 4107, options [nop,nop,TS val 4294940137 ecr 198683,mptcp dss ack 1818309187 seq 1402147003 subseq 498373 len 1428 csum 0xbc33], length 1428
16:50:44.091920 IP 112.26.1.8.56443 > 112.26.1.1.targus-getdata1: Flags [.], seq 42840:44268, ack 1, win 4107, options [nop,nop,TS val 4294940137 ecr 198683,mptcp dss ack 1818309187 seq 1402148431 subseq 499801 len 1428 csum 0xa225], length 1428
16:50:44.093613 IP 112.26.1.1.targus-getdata1 > 112.26.1.8.56443: Flags [.], ack 44268, win 24558, options [nop,nop,TS val 199733 ecr 4294940137,mptcp dss ack 1402152715], length 0
16:50:44.171778 IP 112.26.1.1.targus-getdata1 > 112.26.1.8.56443: Flags [.], ack 44268, win 24558, options [nop,nop,TS val 199733 ecr 4294940137,mptcp dss ack 1402152715], length 0
16:50:44.210451 IP 112.26.1.8.56443 > 112.26.1.1.targus-getdata1: Flags [.], seq 44268:45696, ack 1, win 4107, options [nop,nop,TS val 4294940398 ecr 198836,mptcp dss ack 1818309187 seq 1402161283 subseq 501229 len 1428 csum 0x49ce], length 1428
16:50:44.276098 IP 112.26.1.8.56443 > 112.26.1.1.targus-getdata1: Flags [.], seq 45696:47124, ack 1, win 4107, options [nop,nop,TS val 4294940398 ecr 198836,mptcp dss ack 1818309187 seq 1402162711 subseq 502657 len 1428 csum 0x7b6f], length 1428
16:50:44.331155 IP 112.26.1.8.56443 > 112.26.1.1.targus-getdata1: Flags [.], seq 47124:48552, ack 1, win 4107, options [nop,nop,TS val 4294940398 ecr 198836,mptcp dss ack 1818309187 seq 1402164139 subseq 504085 len 1428 csum 0x75be], length 1428
16:50:44.397008 IP 112.26.1.8.56443 > 112.26.1.1.targus-getdata1: Flags [.], seq 48552:49980, ack 1, win 4107, options [nop,nop,TS val 4294940533 ecr 199015,mptcp dss ack 1818309187 seq 1402171279 subseq 505513 len 1428 csum 0x274a], length 1428
16:50:44.398257 IP 112.26.1.1.targus-getdata1 > 112.26.1.8.56443: Flags [.], ack 49980, win 24540, options [nop,nop,TS val 200038 ecr 4294940398,mptcp dss ack 1402159855], length 0
16:50:44.455536 IP 112.26.1.1.targus-getdata1 > 112.26.1.8.56443: Flags [.], ack 49980, win 24540, options [nop,nop,TS val 200038 ecr 4294940398,mptcp dss ack 1402159855], length 0
16:50:44.519834 IP 112.26.1.8.56443 > 112.26.1.1.targus-getdata1: Flags [.], seq 49980:51408, ack 1, win 4107, options [nop,nop,TS val 4294940533 ecr 199015,mptcp dss ack 1818309187 seq 1402172707 subseq 506941 len 1428 csum 0x7d04], length 1428
16:50:44.578615 IP 112.26.1.8.56443 > 112.26.1.1.targus-getdata1: Flags [.], seq 51408:52836, ack 1, win 4107, options [nop,nop,TS val 4294940697 ecr 199185,mptcp dss ack 1818309187 seq 1402181275 subseq 508369 len 1428 csum 0xddad], length 1428
16:50:44.641892 IP 112.26.1.8.56443 > 112.26.1.1.targus-getdata1: Flags [.], seq 52836:54264, ack 1, win 4107, options [nop,nop,TS val 4294940697 ecr 199185,mptcp dss ack 1818309187 seq 1402182703 subseq 509797 len 1428 csum 0xdced], length 1428
16:50:44.712169 IP 112.26.1.1.targus-getdata1 > 112.26.1.8.56443: Flags [.], ack 54264, win 24540, options [nop,nop,TS val 200352 ecr 4294940533,mptcp dss ack 1402159855], length 0
16:50:44.725928 IP 112.26.1.1.targus-getdata1 > 112.26.1.8.56443: Flags [.], ack 54264, win 24540, options [nop,nop,TS val 200352 ecr 4294940533,mptcp dss ack 1402159855], length 0
16:50:44.767975 IP 112.26.1.8.56443 > 112.26.1.1.targus-getdata1: Flags [.], seq 54264:55692, ack 1, win 4107, options [nop,nop,TS val 4294940697 ecr 199185,mptcp dss ack 1818309187 seq 1402184131 subseq 511225 len 1428 csum 0x811a], length 1428
16:50:44.836832 IP 112.26.1.8.56443 > 112.26.1.1.targus-getdata1: Flags [.], seq 55692:57120, ack 1, win 4107, options [nop,nop,TS val 4294940870 ecr 199324,mptcp dss ack 1818309187 seq 1402194127 subseq 512653 len 1428 csum 0x3919], length 1428
16:50:44.885627 IP 112.26.1.8.56443 > 112.26.1.1.targus-getdata1: Flags [.], seq 57120:58548, ack 1, win 4107, options [nop,nop,TS val 4294940870 ecr 199324,mptcp dss ack 1818309187 seq 1402195555 subseq 514081 len 1428 csum 0x4402], length 1428
16:50:44.960066 IP 112.26.1.8.56443 > 112.26.1.1.targus-getdata1: Flags [.], seq 58548:59976, ack 1, win 4107, options [nop,nop,TS val 4294940870 ecr 199324,mptcp dss ack 1818309187 seq 1402196983 subseq 515509 len 1428 csum 0xed82], length 1428
16:50:45.004179 IP 112.26.1.8.56443 > 112.26.1.1.targus-getdata1: Flags [.], seq 59976:61404, ack 1, win 4107, options [nop,nop,TS val 4294941099 ecr 199557,mptcp dss ack 1818309187 seq 1402206979 subseq 516937 len 1428 csum 0x5044], length 1428
16:50:45.006625 IP 112.26.1.1.targus-getdata1 > 112.26.1.8.56443: Flags [.], ack 61404, win 24540, options [nop,nop,TS val 200645 ecr 4294940697,mptcp dss ack 1402159855], length 0
16:50:45.073470 IP 112.26.1.1.targus-getdata1 > 112.26.1.8.56443: Flags [.], ack 61404, win 24540, options [nop,nop,TS val 200645 ecr 4294940697,mptcp dss ack 1402159855], length 0
16:50:45.105910 IP 112.26.1.8.56443 > 112.26.1.1.targus-getdata1: Flags [.], seq 61404:62832, ack 1, win 4107, options [nop,nop,TS val 4294941099 ecr 199557,mptcp dss ack 1818309187 seq 1402208407 subseq 518365 len 1428 csum 0x1ead], length 1428
16:50:45.160762 IP 112.26.1.8.56443 > 112.26.1.1.targus-getdata1: Flags [.], seq 62832:64260, ack 1, win 4107, options [nop,nop,TS val 4294941323 ecr 199733,mptcp dss ack 1818309187 seq 1402159855 subseq 519793 len 1428 csum 0x3b6c], length 1428
16:50:45.162026 IP 112.26.1.1.targus-getdata1 > 112.26.1.8.56443: Flags [.], ack 64260, win 24429, options [nop,nop,TS val 200802 ecr 4294941099,mptcp dss ack 1402166995], length 0
16:50:45.218389 IP 112.26.1.1.targus-getdata1 > 112.26.1.8.56443: Flags [.], ack 64260, win 24429, options [nop,nop,TS val 200802 ecr 4294941099,mptcp dss ack 1402166995], length 0
16:50:45.278341 IP 112.26.1.8.56443 > 112.26.1.1.targus-getdata1: Flags [.], seq 64260:65688, ack 1, win 4107, options [nop,nop,TS val 4294941323 ecr 199733,mptcp dss ack 1818309187 seq 1402166995 subseq 521221 len 1428 csum 0x7aee], length 1428
16:50:45.363513 IP 112.26.1.8.56443 > 112.26.1.1.targus-getdata1: Flags [.], seq 65688:67116, ack 1, win 4107, options [nop,nop,TS val 4294941323 ecr 199733,mptcp dss ack 1818309187 seq 1402168423 subseq 522649 len 1428 csum 0x99bd], length 1428
16:50:45.427968 IP 112.26.1.8.56443 > 112.26.1.1.targus-getdata1: Flags [.], seq 67116:68544, ack 1, win 4107, options [nop,nop,TS val 4294941660 ecr 200038,mptcp dss ack 1818309187 seq 1402185559 subseq 524077 len 1428 csum 0x2582], length 1428
16:50:45.433578 IP 112.26.1.1.targus-getdata1 > 112.26.1.8.56443: Flags [.], ack 68544, win 24385, options [nop,nop,TS val 201069 ecr 4294941323,mptcp dss ack 1402169851], length 0
16:50:45.473849 IP 112.26.1.1.targus-getdata1 > 112.26.1.8.56443: Flags [.], ack 68544, win 24385, options [nop,nop,TS val 201069 ecr 4294941323,mptcp dss ack 1402169851], length 0
16:50:45.533860 IP 112.26.1.8.56443 > 112.26.1.1.targus-getdata1: Flags [.], seq 68544:69972, ack 1, win 4107, options [nop,nop,TS val 4294941660 ecr 200038,mptcp dss ack 1818309187 seq 1402186987 subseq 525505 len 1428 csum 0xaab3], length 1428
16:50:45.720460 IP 112.26.1.1.targus-getdata1 > 112.26.1.8.56443: Flags [.], ack 69972, win 24385, options [nop,nop,TS val 201360 ecr 4294941660,mptcp dss ack 1402169851], length 0
16:50:45.723930 IP 112.26.1.1.targus-getdata1 > 112.26.1.8.56443: Flags [.], ack 69972, win 24385, options [nop,nop,TS val 201360 ecr 4294941660,mptcp dss ack 1402169851], length 0
16:50:45.805177 IP 112.26.1.8.56443 > 112.26.1.1.targus-getdata1: Flags [.], seq 71400:72828, ack 1, win 4107, options [nop,nop,TS val 4294941660 ecr 200038,mptcp dss ack 1818309187 seq 1402198411 subseq 528361 len 1428 csum 0x4461], length 1428
16:50:45.806458 IP 112.26.1.1.targus-getdata1 > 112.26.1.8.56443: Flags [.], ack 69972, win 24385, options [nop,nop,TS val 201446 ecr 4294941660,nop,nop,sack 1 {71400:72828},mptcp dss ack 1402169851], length 0
16:50:45.885708 IP 112.26.1.1.targus-getdata1 > 112.26.1.8.56443: Flags [.], ack 69972, win 24385, options [nop,nop,TS val 201446 ecr 4294941660,nop,nop,sack 1 {71400:72828},mptcp dss ack 1402169851], length 0
16:50:45.931098 IP 112.26.1.8.56443 > 112.26.1.1.targus-getdata1: Flags [.], seq 74256:75684, ack 1, win 4107, options [nop,nop,TS val 4294941660 ecr 200038,mptcp dss ack 1818309187 seq 1402204123 subseq 531217 len 1428 csum 0x75ce], length 1428
16:50:45.932931 IP 112.26.1.1.targus-getdata1 > 112.26.1.8.56443: Flags [.], ack 69972, win 24385, options [nop,nop,TS val 201571 ecr 4294941660,nop,nop,sack 2 {74256:75684}{71400:72828},mptcp dss ack 1402169851], length 0
16:50:46.011653 IP 112.26.1.8.56443 > 112.26.1.1.targus-getdata1: Flags [.], seq 75684:77112, ack 1, win 4107, options [nop,nop,TS val 4294941852 ecr 200352,mptcp dss ack 1818309187 seq 1402214119 subseq 532645 len 1428 csum 0x6e1d], length 1428
16:50:46.013366 IP 112.26.1.1.targus-getdata1 > 112.26.1.8.56443: Flags [.], ack 69972, win 24543, options [nop,nop,TS val 201652 ecr 4294941660,nop,nop,sack 2 {74256:77112}{71400:72828},mptcp dss ack 1402209835], length 0
16:50:46.091004 IP 112.26.1.1.targus-getdata1 > 112.26.1.8.56443: Flags [.], ack 69972, win 24385, options [nop,nop,TS val 201571 ecr 4294941660,nop,nop,sack 2 {74256:75684}{71400:72828},mptcp dss ack 1402169851], length 0
16:50:46.159002 IP 112.26.1.1.targus-getdata1 > 112.26.1.8.56443: Flags [.], ack 69972, win 24543, options [nop,nop,TS val 201652 ecr 4294941660,nop,nop,sack 2 {74256:77112}{71400:72828},mptcp dss ack 1402209835], length 0
16:50:46.193321 IP 112.26.1.8.56443 > 112.26.1.1.targus-getdata1: Flags [.], seq 78540:79968, ack 1, win 4107, options [nop,nop,TS val 4294941852 ecr 200352,mptcp dss ack 1818309187 seq 1402216975 subseq 535501 len 1428 csum 0x249], length 1428
16:50:46.194524 IP 112.26.1.1.targus-getdata1 > 112.26.1.8.56443: Flags [.], ack 69972, win 24543, options [nop,nop,TS val 201834 ecr 4294941660,nop,nop,sack 2 {78540:79968}{74256:77112},mptcp dss ack 1402209835], length 0
16:50:46.246657 IP 112.26.1.8.56443 > 112.26.1.1.targus-getdata1: Flags [.], seq 79968:81396, ack 1, win 4107, options [nop,nop,TS val 4294941852 ecr 200352,mptcp dss ack 1818309187 seq 1402222687 subseq 536929 len 1428 csum 0x819b], length 1428
16:50:46.248622 IP 112.26.1.1.targus-getdata1 > 112.26.1.8.56443: Flags [.], ack 69972, win 24543, options [nop,nop,TS val 201888 ecr 4294941660,nop,nop,sack 2 {78540:81396}{74256:77112},mptcp dss ack 1402209835], length 0
16:50:46.315076 IP 112.26.1.8.56443 > 112.26.1.1.targus-getdata1: Flags [.], seq 81396:82824, ack 1, win 4107, options [nop,nop,TS val 4294942228 ecr 200645,mptcp dss ack 1818309187 seq 1402245535 subseq 538357 len 1428 csum 0xac3f], length 1428
16:50:46.317723 IP 112.26.1.1.targus-getdata1 > 112.26.1.8.56443: Flags [.], ack 69972, win 24543, options [nop,nop,TS val 201956 ecr 4294941660,nop,nop,sack 2 {78540:82824}{74256:77112},mptcp dss ack 1402209835], length 0
16:50:46.381450 IP 112.26.1.1.targus-getdata1 > 112.26.1.8.56443: Flags [.], ack 69972, win 24543, options [nop,nop,TS val 201834 ecr 4294941660,nop,nop,sack 2 {78540:79968}{74256:77112},mptcp dss ack 1402209835], length 0
16:50:46.429843 IP 112.26.1.8.56443 > 112.26.1.1.targus-getdata1: Flags [.], seq 82824:84252, ack 1, win 4107, options [nop,nop,TS val 4294942228 ecr 200645,mptcp dss ack 1818309187 seq 1402246963 subseq 539785 len 1428 csum 0xf70b], length 1428
16:50:46.432175 IP 112.26.1.1.targus-getdata1 > 112.26.1.8.56443: Flags [.], ack 69972, win 24543, options [nop,nop,TS val 202071 ecr 4294941660,nop,nop,sack 2 {78540:84252}{74256:77112},mptcp dss ack 1402209835], length 0
16:50:46.483909 IP 112.26.1.1.targus-getdata1 > 112.26.1.8.56443: Flags [.], ack 69972, win 24543, options [nop,nop,TS val 201888 ecr 4294941660,nop,nop,sack 2 {78540:81396}{74256:77112},mptcp dss ack 1402209835], length 0
16:50:46.546679 IP 112.26.1.8.56443 > 112.26.1.1.targus-getdata1: Flags [.], seq 85680:87108, ack 1, win 4107, options [nop,nop,TS val 4294942228 ecr 200645,mptcp dss ack 1818309187 seq 1402249819 subseq 542641 len 1428 csum 0x9d6f], length 1428
16:50:46.549386 IP 112.26.1.1.targus-getdata1 > 112.26.1.8.56443: Flags [.], ack 69972, win 24429, options [nop,nop,TS val 202187 ecr 4294941660,nop,nop,sack 2 {85680:87108}{78540:84252},mptcp dss ack 1402219831], length 0
16:50:46.578532 IP 112.26.1.1.targus-getdata1 > 112.26.1.8.56443: Flags [.], ack 69972, win 24543, options [nop,nop,TS val 201956 ecr 4294941660,nop,nop,sack 2 {78540:82824}{74256:77112},mptcp dss ack 1402209835], length 0
16:50:46.621297 IP 112.26.1.8.56443 > 112.26.1.1.targus-getdata1: Flags [.], seq 87108:88536, ack 1, win 4107, options [nop,nop,TS val 4294942228 ecr 200645,mptcp dss ack 1818309187 seq 1402251247 subseq 544069 len 1428 csum 0x7a02], length 1428
16:50:46.623090 IP 112.26.1.1.targus-getdata1 > 112.26.1.8.56443: Flags [.], ack 69972, win 24429, options [nop,nop,TS val 202262 ecr 4294941660,nop,nop,sack 2 {85680:88536}{78540:84252},mptcp dss ack 1402219831], length 0
16:50:46.686136 IP 112.26.1.8.56443 > 112.26.1.1.targus-getdata1: Flags [P.], seq 88536:89964, ack 1, win 4107, options [nop,nop,TS val 4294942228 ecr 200645,mptcp dss ack 1818309187 seq 1402252675 subseq 545497 len 1428 csum 0x3f5b], length 1428
16:50:46.687369 IP 112.26.1.1.targus-getdata1 > 112.26.1.8.56443: Flags [.], ack 69972, win 24429, options [nop,nop,TS val 202327 ecr 4294941660,nop,nop,sack 2 {85680:89964}{78540:84252},mptcp dss ack 1402219831], length 0
16:50:46.732290 IP 112.26.1.1.targus-getdata1 > 112.26.1.8.56443: Flags [.], ack 69972, win 24543, options [nop,nop,TS val 202071 ecr 4294941660,nop,nop,sack 2 {78540:84252}{74256:77112},mptcp dss ack 1402209835], length 0
16:50:46.803214 IP 112.26.1.8.56443 > 112.26.1.1.targus-getdata1: Flags [.], seq 89964:91392, ack 1, win 4107, options [nop,nop,TS val 4294942228 ecr 200645,mptcp dss ack 1818309187 seq 1402254103 subseq 546925 len 1428 csum 0x4d73], length 1428
16:50:46.804978 IP 112.26.1.1.targus-getdata1 > 112.26.1.8.56443: Flags [.], ack 69972, win 24429, options [nop,nop,TS val 202444 ecr 4294941660,nop,nop,sack 2 {85680:91392}{78540:84252},mptcp dss ack 1402219831], length 0
16:50:46.846917 IP 112.26.1.8.56443 > 112.26.1.1.targus-getdata1: Flags [.], seq 91392:92820, ack 1, win 4107, options [nop,nop,TS val 4294942228 ecr 200645,mptcp dss ack 1818309187 seq 1402255531 subseq 548353 len 1428 csum 0x3664], length 1428
16:50:46.848412 IP 112.26.1.1.targus-getdata1 > 112.26.1.8.56443: Flags [.], ack 69972, win 24429, options [nop,nop,TS val 202487 ecr 4294941660,nop,nop,sack 2 {85680:92820}{78540:84252},mptcp dss ack 1402219831], length 0
16:50:46.912248 IP 112.26.1.1.targus-getdata1 > 112.26.1.8.56443: Flags [.], ack 69972, win 24429, options [nop,nop,TS val 202187 ecr 4294941660,nop,nop,sack 2 {85680:87108}{78540:84252},mptcp dss ack 1402219831], length 0
16:50:46.945488 IP 112.26.1.1.targus-getdata1 > 112.26.1.8.56443: Flags [.], ack 69972, win 24429, options [nop,nop,TS val 202262 ecr 4294941660,nop,nop,sack 2 {85680:88536}{78540:84252},mptcp dss ack 1402219831], length 0
16:50:47.041174 IP 112.26.1.1.targus-getdata1 > 112.26.1.8.56443: Flags [.], ack 69972, win 24429, options [nop,nop,TS val 202327 ecr 4294941660,nop,nop,sack 2 {85680:89964}{78540:84252},mptcp dss ack 1402219831], length 0
16:50:47.092944 IP 112.26.1.8.56443 > 112.26.1.1.targus-getdata1: Flags [.], seq 91392:92820, ack 1, win 4107, options [nop,nop,TS val 4294943040 ecr 200645,mptcp dss ack 1818309187 seq 1402255531 subseq 548353 len 1428 csum 0x3664], length 1428
16:50:47.094693 IP 112.26.1.1.targus-getdata1 > 112.26.1.8.56443: Flags [.], ack 69972, win 24429, options [nop,nop,TS val 202733 ecr 4294941660,nop,nop,sack 2 {91392:92820}{85680:92820},mptcp dss ack 1402219831], length 0
16:50:47.144862 IP 112.26.1.1.targus-getdata1 > 112.26.1.8.56443: Flags [.], ack 69972, win 24429, options [nop,nop,TS val 202444 ecr 4294941660,nop,nop,sack 2 {85680:91392}{78540:84252},mptcp dss ack 1402219831], length 0
16:50:47.201644 IP 112.26.1.1.targus-getdata1 > 112.26.1.8.56443: Flags [.], ack 69972, win 24429, options [nop,nop,TS val 202487 ecr 4294941660,nop,nop,sack 2 {85680:92820}{78540:84252},mptcp dss ack 1402219831], length 0
16:50:47.279466 IP 112.26.1.8.56443 > 112.26.1.1.targus-getdata1: Flags [.], seq 69972:71400, ack 1, win 4107, options [nop,nop,TS val 4294943260 ecr 201571,mptcp dss ack 1818309187 seq 1402188415 subseq 526933 len 1428 csum 0xfcbb], length 1428
16:50:47.282324 IP 112.26.1.1.targus-getdata1 > 112.26.1.8.56443: Flags [.], ack 72828, win 24429, options [nop,nop,TS val 202920 ecr 4294943260,nop,nop,sack 2 {85680:92820}{78540:84252},mptcp dss ack 1402219831], length 0
16:50:47.360897 IP 112.26.1.8.56443 > 112.26.1.1.targus-getdata1: Flags [.], seq 72828:74256, ack 1, win 4107, options [nop,nop,TS val 4294943260 ecr 201571,mptcp dss ack 1818309187 seq 1402199839 subseq 529789 len 1428 csum 0xfc77], length 1428
16:50:47.363479 IP 112.26.1.1.targus-getdata1 > 112.26.1.8.56443: Flags [.], ack 77112, win 24429, options [nop,nop,TS val 203001 ecr 4294943260,nop,nop,sack 2 {85680:92820}{78540:84252},mptcp dss ack 1402219831], length 0
16:50:47.426582 IP 112.26.1.8.56443 > 112.26.1.1.targus-getdata1: Flags [.], seq 92820:94248, ack 1, win 4107, options [nop,nop,TS val 4294943373 ecr 201652,mptcp dss ack 1818309187 seq 1402279807 subseq 549781 len 1428 csum 0x5ab5], length 1428
16:50:47.435826 IP 112.26.1.1.targus-getdata1 > 112.26.1.8.56443: Flags [.], ack 77112, win 24429, options [nop,nop,TS val 203067 ecr 4294943260,nop,nop,sack 2 {85680:94248}{78540:84252},mptcp dss ack 1402219831], length 0
16:50:47.470771 IP 112.26.1.1.targus-getdata1 > 112.26.1.8.56443: Flags [.], ack 69972, win 24429, options [nop,nop,TS val 202187 ecr 4294941660,nop,nop,sack 2 {85680:87108}{78540:84252},mptcp dss ack 1402219831], length 0
16:50:47.487057 IP 112.26.1.1.targus-getdata1 > 112.26.1.8.56443: Flags [.], ack 69972, win 24429, options [nop,nop,TS val 202733 ecr 4294941660,nop,nop,sack 2 {91392:92820}{85680:92820},mptcp dss ack 1402219831], length 0
16:50:47.525451 IP 112.26.1.8.56443 > 112.26.1.1.targus-getdata1: Flags [.], seq 77112:78540, ack 1, win 4107, options [nop,nop,TS val 4294943495 ecr 201834,mptcp dss ack 1818309187 seq 1402215547 subseq 534073 len 1428 csum 0xfe2d], length 1428
16:50:47.528636 IP 112.26.1.1.targus-getdata1 > 112.26.1.8.56443: Flags [.], ack 84252, win 24429, options [nop,nop,TS val 203166 ecr 4294943495,nop,nop,sack 1 {85680:94248},mptcp dss ack 1402219831], length 0
16:50:47.571188 IP 112.26.1.1.targus-getdata1 > 112.26.1.8.56443: Flags [.], ack 69972, win 24429, options [nop,nop,TS val 202262 ecr 4294941660,nop,nop,sack 2 {85680:88536}{78540:84252},mptcp dss ack 1402219831], length 0
16:50:47.589296 IP 112.26.1.1.targus-getdata1 > 112.26.1.8.56443: Flags [.], ack 72828, win 24429, options [nop,nop,TS val 202920 ecr 4294943260,nop,nop,sack 2 {85680:92820}{78540:84252},mptcp dss ack 1402219831], length 0
16:50:47.611835 IP 112.26.1.1.targus-getdata1 > 112.26.1.8.56443: Flags [.], ack 69972, win 24429, options [nop,nop,TS val 202327 ecr 4294941660,nop,nop,sack 2 {85680:89964}{78540:84252},mptcp dss ack 1402219831], length 0
16:50:47.665323 IP 112.26.1.8.56443 > 112.26.1.1.targus-getdata1: Flags [.], seq 94248:95676, ack 1, win 4107, options [nop,nop,TS val 4294943583 ecr 201888,mptcp dss ack 1818309187 seq 1402291231 subseq 551209 len 1428 csum 0xae49], length 1428
16:50:47.667203 IP 112.26.1.1.targus-getdata1 > 112.26.1.8.56443: Flags [.], ack 84252, win 24429, options [nop,nop,TS val 203306 ecr 4294943495,nop,nop,sack 1 {85680:95676},mptcp dss ack 1402219831], length 0
16:50:47.699285 IP 112.26.1.1.targus-getdata1 > 112.26.1.8.56443: Flags [.], ack 69972, win 24429, options [nop,nop,TS val 202444 ecr 4294941660,nop,nop,sack 2 {85680:91392}{78540:84252},mptcp dss ack 1402219831], length 0
16:50:47.725939 IP 112.26.1.1.targus-getdata1 > 112.26.1.8.56443: Flags [.], ack 69972, win 24429, options [nop,nop,TS val 202487 ecr 4294941660,nop,nop,sack 2 {85680:92820}{78540:84252},mptcp dss ack 1402219831], length 0
16:50:47.749915 IP 112.26.1.8.56443 > 112.26.1.1.targus-getdata1: Flags [.], seq 95676:97104, ack 1, win 4107, options [nop,nop,TS val 4294943599 ecr 201956,mptcp dss ack 1818309187 seq 1402292659 subseq 552637 len 1428 csum 0x878c], length 1428
16:50:47.751155 IP 112.26.1.1.targus-getdata1 > 112.26.1.8.56443: Flags [.], ack 84252, win 24429, options [nop,nop,TS val 203391 ecr 4294943495,nop,nop,sack 1 {85680:97104},mptcp dss ack 1402219831], length 0
16:50:47.825299 IP 112.26.1.1.targus-getdata1 > 112.26.1.8.56443: Flags [.], ack 77112, win 24429, options [nop,nop,TS val 203001 ecr 4294943260,nop,nop,sack 2 {85680:92820}{78540:84252},mptcp dss ack 1402219831], length 0
16:50:47.859107 IP 112.26.1.8.56443 > 112.26.1.1.targus-getdata1: Flags [.], seq 97104:98532, ack 1, win 4107, options [nop,nop,TS val 4294943921 ecr 202071,mptcp dss ack 1818309187 seq 1402298371 subseq 554065 len 1428 csum 0x6591], length 1428
16:50:47.860985 IP 112.26.1.1.targus-getdata1 > 112.26.1.8.56443: Flags [.], ack 84252, win 24429, options [nop,nop,TS val 203500 ecr 4294943495,nop,nop,sack 1 {85680:98532},mptcp dss ack 1402219831], length 0
16:50:47.927535 IP 112.26.1.1.targus-getdata1 > 112.26.1.8.56443: Flags [.], ack 77112, win 24429, options [nop,nop,TS val 203067 ecr 4294943260,nop,nop,sack 2 {85680:94248}{78540:84252},mptcp dss ack 1402219831], length 0
16:50:47.980406 IP 112.26.1.1.targus-getdata1 > 112.26.1.8.56443: Flags [.], ack 84252, win 24429, options [nop,nop,TS val 203166 ecr 4294943495,nop,nop,sack 1 {85680:94248},mptcp dss ack 1402219831], length 0
16:50:48.058561 IP 112.26.1.1.targus-getdata1 > 112.26.1.8.56443: Flags [.], ack 84252, win 24429, options [nop,nop,TS val 203306 ecr 4294943495,nop,nop,sack 1 {85680:95676},mptcp dss ack 1402219831], length 0
16:50:48.116055 IP 112.26.1.1.targus-getdata1 > 112.26.1.8.56443: Flags [.], ack 84252, win 24429, options [nop,nop,TS val 203391 ecr 4294943495,nop,nop,sack 1 {85680:97104},mptcp dss ack 1402219831], length 0
16:50:48.199442 IP 112.26.1.1.targus-getdata1 > 112.26.1.8.56443: Flags [.], ack 84252, win 24429, options [nop,nop,TS val 203500 ecr 4294943495,nop,nop,sack 1 {85680:98532},mptcp dss ack 1402219831], length 0
16:50:50.192511 IP 112.26.1.8.56443 > 112.26.1.1.targus-getdata1: Flags [.], seq 69972:71400, ack 1, win 4107, options [nop,nop,TS val 4294946816 ecr 202071,mptcp dss ack 1818309187 seq 1402188415 subseq 526933 len 1428 csum 0xfcbb], length 1428
16:50:56.305069 IP 112.26.1.8.56443 > 112.26.1.1.targus-getdata1: Flags [.], seq 69972:71400, ack 1, win 4107, options [nop,nop,TS val 4294952960 ecr 202071,mptcp dss ack 1818309187 seq 1402188415 subseq 526933 len 1428 csum 0xfcbb], length 1428
16:50:56.319924 IP 112.26.1.1.targus-getdata1 > 112.26.1.8.56443: Flags [.], ack 84252, win 24576, options [nop,nop,TS val 211945 ecr 4294943495,nop,nop,sack 2 {69972:71400}{85680:98532},mptcp dss ack 1402339783], length 0
16:50:56.442844 IP 112.26.1.1.targus-getdata1 > 112.26.1.8.56443: Flags [.], ack 84252, win 24576, options [nop,nop,TS val 211945 ecr 4294943495,nop,nop,sack 2 {69972:71400}{85680:98532},mptcp dss ack 1402339783], length 0
16:50:56.451768 IP 112.26.1.8.56443 > 112.26.1.1.targus-getdata1: Flags [.], seq 84252:85680, ack 1, win 4107, options [nop,nop,TS val 4294953108 ecr 211945,mptcp dss ack 1818309187 seq 1402248391 subseq 541213 len 1428 csum 0x4f45], length 1428
16:50:56.457019 IP 112.26.1.1.targus-getdata1 > 112.26.1.8.56443: Flags [.], ack 98532, win 24576, options [nop,nop,TS val 212092 ecr 4294953108,mptcp dss ack 1402339783], length 0
16:50:56.552472 IP 112.26.1.8.56443 > 112.26.1.1.targus-getdata1: Flags [.], seq 98532:99960, ack 1, win 4107, options [nop,nop,TS val 4294953108 ecr 211945,mptcp dss ack 1818309187 seq 1402362631 subseq 555493 len 1428 csum 0xe90f], length 1428
16:50:56.554145 IP 112.26.1.1.targus-getdata1 > 112.26.1.8.56443: Flags [.], ack 99960, win 24576, options [nop,nop,TS val 212193 ecr 4294953108,mptcp dss ack 1402339783], length 0
16:50:56.587378 IP 112.26.1.1.targus-getdata1 > 112.26.1.8.56443: Flags [.], ack 98532, win 24576, options [nop,nop,TS val 212092 ecr 4294953108,mptcp dss ack 1402339783], length 0
16:50:56.671676 IP 112.26.1.8.56443 > 112.26.1.1.targus-getdata1: Flags [.], seq 99960:101388, ack 1, win 4107, options [nop,nop,TS val 4294953108 ecr 211945,mptcp dss ack 1818309187 seq 1402364059 subseq 556921 len 1428 csum 0xeb69], length 1428
16:50:56.674387 IP 112.26.1.1.targus-getdata1 > 112.26.1.8.56443: Flags [.], ack 101388, win 24576, options [nop,nop,TS val 212312 ecr 4294953108,mptcp dss ack 1402339783], length 0
16:50:56.763463 IP 112.26.1.1.targus-getdata1 > 112.26.1.8.56443: Flags [.], ack 99960, win 24576, options [nop,nop,TS val 212193 ecr 4294953108,mptcp dss ack 1402339783], length 0
16:50:56.775760 IP 112.26.1.8.56443 > 112.26.1.1.targus-getdata1: Flags [.], seq 101388:102816, ack 1, win 4107, options [nop,nop,TS val 4294953108 ecr 211945,mptcp dss ack 1818309187 seq 1402365487 subseq 558349 len 1428 csum 0xe872], length 1428
16:50:56.784454 IP 112.26.1.1.targus-getdata1 > 112.26.1.8.56443: Flags [.], ack 102816, win 24576, options [nop,nop,TS val 212416 ecr 4294953108,mptcp dss ack 1402339783], length 0
16:50:56.847104 IP 112.26.1.8.56443 > 112.26.1.1.targus-getdata1: Flags [.], seq 102816:104244, ack 1, win 4107, options [nop,nop,TS val 4294953108 ecr 211945,mptcp dss ack 1818309187 seq 1402366915 subseq 559777 len 1428 csum 0xbd8c], length 1428
16:50:56.858829 IP 112.26.1.1.targus-getdata1 > 112.26.1.8.56443: Flags [.], ack 104244, win 24576, options [nop,nop,TS val 212488 ecr 4294953108,mptcp dss ack 1402339783], length 0
