16:50:02.658539 IP 112.26.3.8.38285 > 112.26.3.1.targus-getdata1: Flags [S], seq 3557256018, win 65535, options [mss 1460,sackOK,TS val 4294899301 ecr 0,nop,wscale 6,mptcp join id 6 token 0x92d88ed4 nonce 0x3d63e07a], length 0
16:50:02.715248 IP 112.26.3.8.38285 > 112.26.3.1.targus-getdata1: Flags [S], seq 3557256018, win 65535, options [mss 1460,sackOK,TS val 4294899301 ecr 0,nop,wscale 6,mptcp join id 6 token 0x92d88ed4 nonce 0x3d63e07a], length 0
16:50:02.771798 IP 112.26.3.8.38285 > 112.26.3.1.targus-getdata1: Flags [S], seq 3557256018, win 65535, options [mss 1460,sackOK,TS val 4294899301 ecr 0,nop,wscale 6,mptcp join id 6 token 0x92d88ed4 nonce 0x3d63e07a], length 0
16:50:02.954439 IP 112.26.3.1.targus-getdata1 > 112.26.3.8.38285: Flags [S.], seq 1336565991, ack 3557256019, win 65535, options [mss 1460,sackOK,TS val 158413 ecr 4294899301,nop,wscale 6,mptcp join id 5 hmac 0x36c4045e39644d1d nonce 0xe22e8b0d], length 0
16:50:03.037838 IP 112.26.3.1.targus-getdata1 > 112.26.3.8.38285: Flags [S.], seq 1336565991, ack 3557256019, win 65535, options [mss 1460,sackOK,TS val 158413 ecr 4294899301,nop,wscale 6,mptcp join id 5 hmac 0x36c4045e39644d1d nonce 0xe22e8b0d], length 0
16:50:03.085123 IP 112.26.3.8.38285 > 112.26.3.1.targus-getdata1: Flags [.], ack 1, win 4107, options [nop,nop,TS val 4294899703 ecr 158413,mptcp join hmac 0xa08a6a9dc53f6f879b9c580133fe53443383777a], length 0
16:50:03.085538 IP 112.26.3.8.38285 > 112.26.3.1.targus-getdata1: Flags [.], ack 1, win 4107, options [nop,nop,TS val 4294899703 ecr 158413,mptcp join hmac 0xa08a6a9dc53f6f879b9c580133fe53443383777a], length 0
16:50:47.466061 IP 112.26.3.8.58109 > 112.26.3.1.targus-getdata1: Flags [.], seq 945235814:945237242, ack 3752693042, win 4107, options [nop,nop,TS val 4294943856 ecr 202316,mptcp dss ack 1818309187 seq 1402288375 subseq 728281 len 1428 csum 0xa82c], length 1428
16:50:47.505972 IP 112.26.3.1.targus-getdata1 > 112.26.3.8.58109: Flags [.], ack 4294964440, win 24429, options [nop,nop,TS val 203134 ecr 4294943428,mptcp dss ack 1402219831], length 0
16:50:47.538131 IP 112.26.3.1.targus-getdata1 > 112.26.3.8.58109: Flags [.], ack 4294960156, win 24429, options [nop,nop,TS val 202817 ecr 4294943099,mptcp dss ack 1402219831], length 0
16:50:47.558769 IP 112.26.3.8.58109 > 112.26.3.1.targus-getdata1: Flags [.], seq 4294964440:4294965868, ack 1, win 4107, options [nop,nop,TS val 4294943428 ecr 202138,mptcp dss ack 1818309187 seq 1402284091 subseq 725425 len 1428 csum 0xc887], length 1428
16:50:47.605607 IP 112.26.3.8.58109 > 112.26.3.1.targus-getdata1: Flags [.], seq 4294965868:0, ack 1, win 4107, options [nop,nop,TS val 4294943502 ecr 202230,mptcp dss ack 1818309187 seq 1402286947 subseq 726853 len 1428 csum 0x13e4], length 1428
16:50:47.644904 IP 112.26.3.1.targus-getdata1 > 112.26.3.8.58109: Flags [.], ack 0, win 24429, options [nop,nop,TS val 203280 ecr 4294943428,mptcp dss ack 1402219831], length 0
16:50:47.649854 IP 112.26.3.1.targus-getdata1 > 112.26.3.8.58109: Flags [.], ack 4294954444, win 24429, options [nop,nop,TS val 202412 ecr 4294942797,mptcp dss ack 1402219831], length 0
16:50:47.683566 IP 112.26.3.1.targus-getdata1 > 112.26.3.8.58109: Flags [.], ack 4294955872, win 24429, options [nop,nop,TS val 202500 ecr 4294942923,mptcp dss ack 1402219831], length 0
16:50:47.701966 IP 112.26.3.8.58109 > 112.26.3.1.targus-getdata1: Flags [.], seq 0:1428, ack 1, win 4107, options [nop,nop,TS val 4294943547 ecr 202316,mptcp dss ack 1818309187 seq 1402288375 subseq 728281 len 1428 csum 0xa82c], length 1428
16:50:47.730212 IP 112.26.3.1.targus-getdata1 > 112.26.3.8.58109: Flags [.], ack 4294961584, win 24429, options [nop,nop,TS val 202910 ecr 4294943225,mptcp dss ack 1402219831], length 0
16:50:47.730264 IP 112.26.3.1.targus-getdata1 > 112.26.3.8.58109: Flags [.], ack 4294958728, win 24429, options [nop,nop,TS val 202707 ecr 4294943099,mptcp dss ack 1402219831], length 0
16:50:47.730284 IP 112.26.3.1.targus-getdata1 > 112.26.3.8.58109: Flags [.], ack 4294963012, win 24429, options [nop,nop,TS val 202996 ecr 4294943308,mptcp dss ack 1402219831], length 0
16:50:47.730304 IP 112.26.3.1.targus-getdata1 > 112.26.3.8.58109: Flags [.], ack 4294957300, win 24429, options [nop,nop,TS val 202599 ecr 4294942993,mptcp dss ack 1402219831], length 0
16:50:47.730323 IP 112.26.3.1.targus-getdata1 > 112.26.3.8.58109: Flags [.], ack 4294964440, win 24429, options [nop,nop,TS val 203134 ecr 4294943428,mptcp dss ack 1402219831], length 0
16:50:47.730342 IP 112.26.3.1.targus-getdata1 > 112.26.3.8.58109: Flags [.], ack 4294960156, win 24429, options [nop,nop,TS val 202817 ecr 4294943099,mptcp dss ack 1402219831], length 0
16:50:47.730361 IP 112.26.3.1.targus-getdata1 > 112.26.3.8.58109: Flags [.], ack 0, win 24429, options [nop,nop,TS val 203280 ecr 4294943428,mptcp dss ack 1402219831], length 0
16:50:47.730380 IP 112.26.3.1.targus-getdata1 > 112.26.3.8.58109: Flags [.], ack 4294954444, win 24429, options [nop,nop,TS val 202412 ecr 4294942797,mptcp dss ack 1402219831], length 0
16:50:47.730398 IP 112.26.3.1.targus-getdata1 > 112.26.3.8.58109: Flags [.], ack 4294955872, win 24429, options [nop,nop,TS val 202500 ecr 4294942923,mptcp dss ack 1402219831], length 0
16:50:47.756502 IP 112.26.3.8.58109 > 112.26.3.1.targus-getdata1: Flags [.], seq 0:1428, ack 1, win 4107, options [nop,nop,TS val 4294943856 ecr 202316,mptcp dss ack 1818309187 seq 1402288375 subseq 728281 len 1428 csum 0xa82c], length 1428
16:50:47.761172 IP 112.26.3.1.targus-getdata1 > 112.26.3.8.58109: Flags [.], ack 1428, win 24429, options [nop,nop,TS val 203397 ecr 4294943856,nop,nop,sack 1 {0:1428},mptcp dss ack 1402219831], length 0
16:50:47.761488 IP 112.26.3.1.targus-getdata1 > 112.26.3.8.58109: Flags [.], ack 1428, win 24429, options [nop,nop,TS val 203397 ecr 4294943856,nop,nop,sack 1 {0:1428},mptcp dss ack 1402219831], length 0
16:50:47.782833 IP 112.26.3.1.targus-getdata1 > 112.26.3.8.58109: Flags [.], ack 4294961584, win 24429, options [nop,nop,TS val 202910 ecr 4294943225,mptcp dss ack 1402219831], length 0
16:50:47.783171 IP 112.26.3.1.targus-getdata1 > 112.26.3.8.58109: Flags [.], ack 4294961584, win 24429, options [nop,nop,TS val 202910 ecr 4294943225,mptcp dss ack 1402219831], length 0
16:50:47.843705 IP 112.26.3.1.targus-getdata1 > 112.26.3.8.58109: Flags [.], ack 4294958728, win 24429, options [nop,nop,TS val 202707 ecr 4294943099,mptcp dss ack 1402219831], length 0
16:50:47.893220 IP 112.26.3.1.targus-getdata1 > 112.26.3.8.58109: Flags [.], ack 4294963012, win 24429, options [nop,nop,TS val 202996 ecr 4294943308,mptcp dss ack 1402219831], length 0
16:50:47.950793 IP 112.26.3.1.targus-getdata1 > 112.26.3.8.58109: Flags [.], ack 4294957300, win 24429, options [nop,nop,TS val 202599 ecr 4294942993,mptcp dss ack 1402219831], length 0
16:50:47.978877 IP 112.26.3.1.targus-getdata1 > 112.26.3.8.58109: Flags [.], ack 4294964440, win 24429, options [nop,nop,TS val 203134 ecr 4294943428,mptcp dss ack 1402219831], length 0
16:50:48.028720 IP 112.26.3.1.targus-getdata1 > 112.26.3.8.58109: Flags [.], ack 4294960156, win 24429, options [nop,nop,TS val 202817 ecr 4294943099,mptcp dss ack 1402219831], length 0
16:50:48.103166 IP 112.26.3.1.targus-getdata1 > 112.26.3.8.58109: Flags [.], ack 0, win 24429, options [nop,nop,TS val 203280 ecr 4294943428,mptcp dss ack 1402219831], length 0
16:50:48.144012 IP 112.26.3.1.targus-getdata1 > 112.26.3.8.58109: Flags [.], ack 4294954444, win 24429, options [nop,nop,TS val 202412 ecr 4294942797,mptcp dss ack 1402219831], length 0
16:50:48.186025 IP 112.26.3.1.targus-getdata1 > 112.26.3.8.58109: Flags [.], ack 4294955872, win 24429, options [nop,nop,TS val 202500 ecr 4294942923,mptcp dss ack 1402219831], length 0
16:50:48.225528 IP 112.26.3.1.targus-getdata1 > 112.26.3.8.58109: Flags [.], ack 1428, win 24429, options [nop,nop,TS val 203397 ecr 4294943856,nop,nop,sack 1 {0:1428},mptcp dss ack 1402219831], length 0
16:50:48.284350 IP 112.26.3.1.targus-getdata1 > 112.26.3.8.58109: Flags [.], ack 4294961584, win 24429, options [nop,nop,TS val 202910 ecr 4294943225,mptcp dss ack 1402219831], length 0
16:50:48.304524 IP 112.26.3.8.58109 > 112.26.3.1.targus-getdata1: Flags [.], seq 4294953016:4294954444, ack 1, win 4107, options [nop,nop,TS val 4294944960 ecr 202316,mptcp dss ack 1818309187 seq 1402266955 subseq 714001 len 1428 csum 0xfd97], length 1428
16:50:48.332619 IP 112.26.3.8.58109 > 112.26.3.1.targus-getdata1: Flags [.], seq 4294953016:4294954444, ack 1, win 4107, options [nop,nop,TS val 4294944960 ecr 202316,mptcp dss ack 1818309187 seq 1402266955 subseq 714001 len 1428 csum 0xfd97], length 1428
16:50:48.334529 IP 112.26.3.8.58109 > 112.26.3.1.targus-getdata1: Flags [.], seq 4294953016:4294954444, ack 1, win 4107, options [nop,nop,TS val 4294944960 ecr 202316,mptcp dss ack 1818309187 seq 1402266955 subseq 714001 len 1428 csum 0xfd97], length 1428
16:50:50.491028 IP 112.26.3.8.58109 > 112.26.3.1.targus-getdata1: Flags [.], seq 4294953016:4294954444, ack 1, win 4107, options [nop,nop,TS val 4294947072 ecr 202316,mptcp dss ack 1818309187 seq 1402266955 subseq 714001 len 1428 csum 0xfd97], length 1428
16:50:50.498829 IP 112.26.3.8.58109 > 112.26.3.1.targus-getdata1: Flags [.], seq 4294953016:4294954444, ack 1, win 4107, options [nop,nop,TS val 4294947072 ecr 202316,mptcp dss ack 1818309187 seq 1402266955 subseq 714001 len 1428 csum 0xfd97], length 1428
16:50:50.499651 IP 112.26.3.8.58109 > 112.26.3.1.targus-getdata1: Flags [.], seq 4294953016:4294954444, ack 1, win 4107, options [nop,nop,TS val 4294947072 ecr 202316,mptcp dss ack 1818309187 seq 1402266955 subseq 714001 len 1428 csum 0xfd97], length 1428
16:50:54.759603 IP 112.26.3.8.58109 > 112.26.3.1.targus-getdata1: Flags [.], seq 4294953016:4294954444, ack 1, win 4107, options [nop,nop,TS val 4294951424 ecr 202316,mptcp dss ack 1818309187 seq 1402266955 subseq 714001 len 1428 csum 0xfd97], length 1428
16:50:54.767642 IP 112.26.3.8.58109 > 112.26.3.1.targus-getdata1: Flags [.], seq 4294953016:4294954444, ack 1, win 4107, options [nop,nop,TS val 4294951424 ecr 202316,mptcp dss ack 1818309187 seq 1402266955 subseq 714001 len 1428 csum 0xfd97], length 1428
16:50:54.768909 IP 112.26.3.1.targus-getdata1 > 112.26.3.8.58109: Flags [.], ack 1428, win 24401, options [nop,nop,TS val 210404 ecr 4294943856,nop,nop,sack 1 {4294953016:4294954444},mptcp dss ack 1402291231], length 0
16:50:54.769248 IP 112.26.3.1.targus-getdata1 > 112.26.3.8.58109: Flags [.], ack 1428, win 24401, options [nop,nop,TS val 210404 ecr 4294943856,nop,nop,sack 1 {4294953016:4294954444},mptcp dss ack 1402291231], length 0
16:50:54.774568 IP 112.26.3.8.58109 > 112.26.3.1.targus-getdata1: Flags [.], seq 4294953016:4294954444, ack 1, win 4107, options [nop,nop,TS val 4294951424 ecr 202316,mptcp dss ack 1818309187 seq 1402266955 subseq 714001 len 1428 csum 0xfd97], length 1428
16:50:54.845818 IP 112.26.3.8.58109 > 112.26.3.1.targus-getdata1: Flags [.], seq 1428:2856, ack 1, win 4107, options [nop,nop,TS val 4294951436 ecr 210404,mptcp dss ack 1818309187 seq 1402299799 subseq 729709 len 1428 csum 0x1109], length 1428
16:50:54.848963 IP 112.26.3.8.58109 > 112.26.3.1.targus-getdata1: Flags [.], seq 1428:2856, ack 1, win 4107, options [nop,nop,TS val 4294951436 ecr 210404,mptcp dss ack 1818309187 seq 1402299799 subseq 729709 len 1428 csum 0x1109], length 1428
16:50:54.859022 IP 112.26.3.8.58109 > 112.26.3.1.targus-getdata1: Flags [.], seq 1428:2856, ack 1, win 4107, options [nop,nop,TS val 4294951436 ecr 210404,mptcp dss ack 1818309187 seq 1402299799 subseq 729709 len 1428 csum 0x1109], length 1428
16:50:54.865124 IP 112.26.3.1.targus-getdata1 > 112.26.3.8.58109: Flags [.], ack 2856, win 24401, options [nop,nop,TS val 210492 ecr 4294951436,mptcp dss ack 1402291231], length 0
16:50:54.865423 IP 112.26.3.1.targus-getdata1 > 112.26.3.8.58109: Flags [.], ack 2856, win 24401, options [nop,nop,TS val 210492 ecr 4294951436,mptcp dss ack 1402291231], length 0
16:50:54.919846 IP 112.26.3.8.58109 > 112.26.3.1.targus-getdata1: Flags [.], seq 2856:4284, ack 1, win 4107, options [nop,nop,TS val 4294951436 ecr 210404,mptcp dss ack 1818309187 seq 1402301227 subseq 731137 len 1428 csum 0x8af6], length 1428
16:50:54.923736 IP 112.26.3.8.58109 > 112.26.3.1.targus-getdata1: Flags [.], seq 2856:4284, ack 1, win 4107, options [nop,nop,TS val 4294951436 ecr 210404,mptcp dss ack 1818309187 seq 1402301227 subseq 731137 len 1428 csum 0x8af6], length 1428
16:50:54.934434 IP 112.26.3.8.58109 > 112.26.3.1.targus-getdata1: Flags [.], seq 2856:4284, ack 1, win 4107, options [nop,nop,TS val 4294951436 ecr 210404,mptcp dss ack 1818309187 seq 1402301227 subseq 731137 len 1428 csum 0x8af6], length 1428
16:50:54.936814 IP 112.26.3.1.targus-getdata1 > 112.26.3.8.58109: Flags [.], ack 4284, win 24401, options [nop,nop,TS val 210575 ecr 4294951436,mptcp dss ack 1402291231], length 0
16:50:54.937116 IP 112.26.3.1.targus-getdata1 > 112.26.3.8.58109: Flags [.], ack 4284, win 24401, options [nop,nop,TS val 210575 ecr 4294951436,mptcp dss ack 1402291231], length 0
16:50:54.968226 IP 112.26.3.8.58109 > 112.26.3.1.targus-getdata1: Flags [.], seq 4284:5712, ack 1, win 4107, options [nop,nop,TS val 4294951436 ecr 210404,mptcp dss ack 1818309187 seq 1402302655 subseq 732565 len 1428 csum 0x4557], length 1428
16:50:54.986105 IP 112.26.3.8.58109 > 112.26.3.1.targus-getdata1: Flags [.], seq 4284:5712, ack 1, win 4107, options [nop,nop,TS val 4294951436 ecr 210404,mptcp dss ack 1818309187 seq 1402302655 subseq 732565 len 1428 csum 0x4557], length 1428
16:50:54.990250 IP 112.26.3.8.58109 > 112.26.3.1.targus-getdata1: Flags [.], seq 4284:5712, ack 1, win 4107, options [nop,nop,TS val 4294951436 ecr 210404,mptcp dss ack 1818309187 seq 1402302655 subseq 732565 len 1428 csum 0x4557], length 1428
16:50:55.028250 IP 112.26.3.1.targus-getdata1 > 112.26.3.8.58109: Flags [.], ack 5712, win 24401, options [nop,nop,TS val 210629 ecr 4294951436,mptcp dss ack 1402291231], length 0
16:50:55.028556 IP 112.26.3.1.targus-getdata1 > 112.26.3.8.58109: Flags [.], ack 5712, win 24401, options [nop,nop,TS val 210629 ecr 4294951436,mptcp dss ack 1402291231], length 0
16:50:55.029745 IP 112.26.3.8.58109 > 112.26.3.1.targus-getdata1: Flags [.], seq 5712:7140, ack 1, win 4107, options [nop,nop,TS val 4294951436 ecr 210404,mptcp dss ack 1818309187 seq 1402304083 subseq 733993 len 1428 csum 0xb441], length 1428
16:50:55.060678 IP 112.26.3.8.58109 > 112.26.3.1.targus-getdata1: Flags [.], seq 5712:7140, ack 1, win 4107, options [nop,nop,TS val 4294951436 ecr 210404,mptcp dss ack 1818309187 seq 1402304083 subseq 733993 len 1428 csum 0xb441], length 1428
16:50:55.066418 IP 112.26.3.8.58109 > 112.26.3.1.targus-getdata1: Flags [.], seq 5712:7140, ack 1, win 4107, options [nop,nop,TS val 4294951436 ecr 210404,mptcp dss ack 1818309187 seq 1402304083 subseq 733993 len 1428 csum 0xb441], length 1428
16:50:55.067546 IP 112.26.3.1.targus-getdata1 > 112.26.3.8.58109: Flags [.], ack 7140, win 24401, options [nop,nop,TS val 210704 ecr 4294951436,mptcp dss ack 1402291231], length 0
16:50:55.067852 IP 112.26.3.1.targus-getdata1 > 112.26.3.8.58109: Flags [.], ack 7140, win 24401, options [nop,nop,TS val 210704 ecr 4294951436,mptcp dss ack 1402291231], length 0
16:50:55.084553 IP 112.26.3.8.58109 > 112.26.3.1.targus-getdata1: Flags [.], seq 7140:8568, ack 1, win 4107, options [nop,nop,TS val 4294951436 ecr 210404,mptcp dss ack 1818309187 seq 1402305511 subseq 735421 len 1428 csum 0x4327], length 1428
16:50:55.134254 IP 112.26.3.8.58109 > 112.26.3.1.targus-getdata1: Flags [.], seq 7140:8568, ack 1, win 4107, options [nop,nop,TS val 4294951436 ecr 210404,mptcp dss ack 1818309187 seq 1402305511 subseq 735421 len 1428 csum 0x4327], length 1428
16:50:55.139288 IP 112.26.3.8.58109 > 112.26.3.1.targus-getdata1: Flags [.], seq 7140:8568, ack 1, win 4107, options [nop,nop,TS val 4294951436 ecr 210404,mptcp dss ack 1818309187 seq 1402305511 subseq 735421 len 1428 csum 0x4327], length 1428
16:50:55.140452 IP 112.26.3.1.targus-getdata1 > 112.26.3.8.58109: Flags [.], ack 8568, win 24401, options [nop,nop,TS val 210777 ecr 4294951436,mptcp dss ack 1402291231], length 0
16:50:55.140770 IP 112.26.3.1.targus-getdata1 > 112.26.3.8.58109: Flags [.], ack 8568, win 24401, options [nop,nop,TS val 210777 ecr 4294951436,mptcp dss ack 1402291231], length 0
16:50:55.165612 IP 112.26.3.8.58109 > 112.26.3.1.targus-getdata1: Flags [.], seq 8568:9996, ack 1, win 4107, options [nop,nop,TS val 4294951436 ecr 210404,mptcp dss ack 1818309187 seq 1402306939 subseq 736849 len 1428 csum 0x62d1], length 1428
16:50:55.171549 IP 112.26.3.8.58109 > 112.26.3.1.targus-getdata1: Flags [.], seq 8568:9996, ack 1, win 4107, options [nop,nop,TS val 4294951436 ecr 210404,mptcp dss ack 1818309187 seq 1402306939 subseq 736849 len 1428 csum 0x62d1], length 1428
16:50:55.190197 IP 112.26.3.8.58109 > 112.26.3.1.targus-getdata1: Flags [.], seq 8568:9996, ack 1, win 4107, options [nop,nop,TS val 4294951436 ecr 210404,mptcp dss ack 1818309187 seq 1402306939 subseq 736849 len 1428 csum 0x62d1], length 1428
16:50:55.191594 IP 112.26.3.1.targus-getdata1 > 112.26.3.8.58109: Flags [.], ack 9996, win 24401, options [nop,nop,TS val 210826 ecr 4294951436,mptcp dss ack 1402292659], length 0
16:50:55.191910 IP 112.26.3.1.targus-getdata1 > 112.26.3.8.58109: Flags [.], ack 9996, win 24401, options [nop,nop,TS val 210826 ecr 4294951436,mptcp dss ack 1402292659], length 0
16:50:55.227672 IP 112.26.3.8.58109 > 112.26.3.1.targus-getdata1: Flags [.], seq 9996:11424, ack 1, win 4107, options [nop,nop,TS val 4294951436 ecr 210404,mptcp dss ack 1818309187 seq 1402308367 subseq 738277 len 1428 csum 0xc7aa], length 1428
16:50:55.263505 IP 112.26.3.8.58109 > 112.26.3.1.targus-getdata1: Flags [.], seq 9996:11424, ack 1, win 4107, options [nop,nop,TS val 4294951436 ecr 210404,mptcp dss ack 1818309187 seq 1402308367 subseq 738277 len 1428 csum 0xc7aa], length 1428
16:50:55.268598 IP 112.26.3.1.targus-getdata1 > 112.26.3.8.58109: Flags [.], ack 11424, win 24450, options [nop,nop,TS val 210907 ecr 4294951436,mptcp dss ack 1402298371], length 0
16:50:55.268912 IP 112.26.3.1.targus-getdata1 > 112.26.3.8.58109: Flags [.], ack 11424, win 24450, options [nop,nop,TS val 210907 ecr 4294951436,mptcp dss ack 1402298371], length 0
16:50:55.271484 IP 112.26.3.8.58109 > 112.26.3.1.targus-getdata1: Flags [.], seq 9996:11424, ack 1, win 4107, options [nop,nop,TS val 4294951436 ecr 210404,mptcp dss ack 1818309187 seq 1402308367 subseq 738277 len 1428 csum 0xc7aa], length 1428
16:50:55.284804 IP 112.26.3.8.58109 > 112.26.3.1.targus-getdata1: Flags [.], seq 11424:12852, ack 1, win 4107, options [nop,nop,TS val 4294951436 ecr 210404,mptcp dss ack 1818309187 seq 1402309795 subseq 739705 len 1428 csum 0xe827], length 1428
16:50:55.323536 IP 112.26.3.8.58109 > 112.26.3.1.targus-getdata1: Flags [.], seq 17136:18564, ack 1, win 4107, options [nop,nop,TS val 4294951535 ecr 210492,mptcp dss ack 1818309187 seq 1402316935 subseq 745417 len 1428 csum 0x4fac], length 1428
16:50:55.338043 IP 112.26.3.8.58109 > 112.26.3.1.targus-getdata1: Flags [.], seq 11424:12852, ack 1, win 4107, options [nop,nop,TS val 4294951436 ecr 210404,mptcp dss ack 1818309187 seq 1402309795 subseq 739705 len 1428 csum 0xe827], length 1428
16:50:55.346372 IP 112.26.3.8.58109 > 112.26.3.1.targus-getdata1: Flags [.], seq 11424:12852, ack 1, win 4107, options [nop,nop,TS val 4294951436 ecr 210404,mptcp dss ack 1818309187 seq 1402309795 subseq 739705 len 1428 csum 0xe827], length 1428
16:50:55.359581 IP 112.26.3.1.targus-getdata1 > 112.26.3.8.58109: Flags [.], ack 12852, win 24576, options [nop,nop,TS val 210987 ecr 4294951436,mptcp dss ack 1402311223], length 0
16:50:55.359894 IP 112.26.3.1.targus-getdata1 > 112.26.3.8.58109: Flags [.], ack 12852, win 24576, options [nop,nop,TS val 210987 ecr 4294951436,mptcp dss ack 1402311223], length 0
16:50:55.391260 IP 112.26.3.8.58109 > 112.26.3.1.targus-getdata1: Flags [.], seq 17136:18564, ack 1, win 4107, options [nop,nop,TS val 4294951535 ecr 210492,mptcp dss ack 1818309187 seq 1402316935 subseq 745417 len 1428 csum 0x4fac], length 1428
16:50:55.414080 IP 112.26.3.8.58109 > 112.26.3.1.targus-getdata1: Flags [.], seq 18564:19992, ack 1, win 4107, options [nop,nop,TS val 4294951638 ecr 210575,mptcp dss ack 1818309187 seq 1402319791 subseq 746845 len 1428 csum 0xe54a], length 1428
16:50:55.421697 IP 112.26.3.8.58109 > 112.26.3.1.targus-getdata1: Flags [.], seq 17136:18564, ack 1, win 4107, options [nop,nop,TS val 4294951535 ecr 210492,mptcp dss ack 1818309187 seq 1402316935 subseq 745417 len 1428 csum 0x4fac], length 1428
16:50:55.425950 IP 112.26.3.1.targus-getdata1 > 112.26.3.8.58109: Flags [.], ack 12852, win 24576, options [nop,nop,TS val 211043 ecr 4294951436,nop,nop,sack 1 {17136:18564},mptcp dss ack 1402311223], length 0
16:50:55.426213 IP 112.26.3.1.targus-getdata1 > 112.26.3.8.58109: Flags [.], ack 12852, win 24576, options [nop,nop,TS val 211043 ecr 4294951436,nop,nop,sack 1 {17136:18564},mptcp dss ack 1402311223], length 0
16:50:55.445504 IP 112.26.3.8.58109 > 112.26.3.1.targus-getdata1: Flags [.], seq 18564:19992, ack 1, win 4107, options [nop,nop,TS val 4294951638 ecr 210575,mptcp dss ack 1818309187 seq 1402319791 subseq 746845 len 1428 csum 0xe54a], length 1428
16:50:55.466735 IP 112.26.3.8.58109 > 112.26.3.1.targus-getdata1: Flags [.], seq 18564:19992, ack 1, win 4107, options [nop,nop,TS val 4294951638 ecr 210575,mptcp dss ack 1818309187 seq 1402319791 subseq 746845 len 1428 csum 0xe54a], length 1428
16:50:55.471031 IP 112.26.3.8.58109 > 112.26.3.1.targus-getdata1: Flags [.], seq 19992:21420, ack 1, win 4107, options [nop,nop,TS val 4294951747 ecr 210629,mptcp dss ack 1818309187 seq 1402321219 subseq 748273 len 1428 csum 0x2650], length 1428
16:50:55.481788 IP 112.26.3.1.targus-getdata1 > 112.26.3.8.58109: Flags [.], ack 12852, win 24576, options [nop,nop,TS val 211096 ecr 4294951436,nop,nop,sack 1 {17136:19992},mptcp dss ack 1402311223], length 0
16:50:55.482195 IP 112.26.3.1.targus-getdata1 > 112.26.3.8.58109: Flags [.], ack 12852, win 24576, options [nop,nop,TS val 211096 ecr 4294951436,nop,nop,sack 1 {17136:19992},mptcp dss ack 1402311223], length 0
16:50:55.527119 IP 112.26.3.8.58109 > 112.26.3.1.targus-getdata1: Flags [.], seq 21420:22848, ack 1, win 4107, options [nop,nop,TS val 4294951788 ecr 210704,mptcp dss ack 1818309187 seq 1402322647 subseq 749701 len 1428 csum 0x64bb], length 1428
16:50:55.538849 IP 112.26.3.8.58109 > 112.26.3.1.targus-getdata1: Flags [.], seq 19992:21420, ack 1, win 4107, options [nop,nop,TS val 4294951747 ecr 210629,mptcp dss ack 1818309187 seq 1402321219 subseq 748273 len 1428 csum 0x2650], length 1428
16:50:55.540668 IP 112.26.3.8.58109 > 112.26.3.1.targus-getdata1: Flags [.], seq 19992:21420, ack 1, win 4107, options [nop,nop,TS val 4294951747 ecr 210629,mptcp dss ack 1818309187 seq 1402321219 subseq 748273 len 1428 csum 0x2650], length 1428
16:50:55.546316 IP 112.26.3.1.targus-getdata1 > 112.26.3.8.58109: Flags [.], ack 12852, win 24576, options [nop,nop,TS val 211181 ecr 4294951436,nop,nop,sack 1 {17136:21420},mptcp dss ack 1402311223], length 0
16:50:55.546650 IP 112.26.3.1.targus-getdata1 > 112.26.3.8.58109: Flags [.], ack 12852, win 24576, options [nop,nop,TS val 211181 ecr 4294951436,nop,nop,sack 1 {17136:21420},mptcp dss ack 1402311223], length 0
16:50:55.576092 IP 112.26.3.8.58109 > 112.26.3.1.targus-getdata1: Flags [.], seq 22848:24276, ack 1, win 4107, options [nop,nop,TS val 4294951842 ecr 210777,mptcp dss ack 1818309187 seq 1402324075 subseq 751129 len 1428 csum 0x9ff6], length 1428
16:50:55.581121 IP 112.26.3.8.58109 > 112.26.3.1.targus-getdata1: Flags [.], seq 21420:22848, ack 1, win 4107, options [nop,nop,TS val 4294951788 ecr 210704,mptcp dss ack 1818309187 seq 1402322647 subseq 749701 len 1428 csum 0x64bb], length 1428
16:50:55.584140 IP 112.26.3.8.58109 > 112.26.3.1.targus-getdata1: Flags [.], seq 21420:22848, ack 1, win 4107, options [nop,nop,TS val 4294951788 ecr 210704,mptcp dss ack 1818309187 seq 1402322647 subseq 749701 len 1428 csum 0x64bb], length 1428
16:50:55.635597 IP 112.26.3.1.targus-getdata1 > 112.26.3.8.58109: Flags [.], ack 12852, win 24576, options [nop,nop,TS val 211224 ecr 4294951436,nop,nop,sack 1 {17136:22848},mptcp dss ack 1402311223], length 0
16:50:55.635849 IP 112.26.3.1.targus-getdata1 > 112.26.3.8.58109: Flags [.], ack 12852, win 24576, options [nop,nop,TS val 211224 ecr 4294951436,nop,nop,sack 1 {17136:22848},mptcp dss ack 1402311223], length 0
16:50:55.636695 IP 112.26.3.8.58109 > 112.26.3.1.targus-getdata1: Flags [.], seq 24276:25704, ack 1, win 4107, options [nop,nop,TS val 4294951914 ecr 210826,mptcp dss ack 1818309187 seq 1402325503 subseq 752557 len 1428 csum 0xecf3], length 1428
16:50:55.653872 IP 112.26.3.8.58109 > 112.26.3.1.targus-getdata1: Flags [.], seq 25704:27132, ack 1, win 4107, options [nop,nop,TS val 4294951944 ecr 210907,mptcp dss ack 1818309187 seq 1402326931 subseq 753985 len 1428 csum 0x2e0e], length 1428
16:50:55.666905 IP 112.26.3.8.58109 > 112.26.3.1.targus-getdata1: Flags [.], seq 22848:24276, ack 1, win 4107, options [nop,nop,TS val 4294951842 ecr 210777,mptcp dss ack 1818309187 seq 1402324075 subseq 751129 len 1428 csum 0x9ff6], length 1428
16:50:55.668915 IP 112.26.3.8.58109 > 112.26.3.1.targus-getdata1: Flags [.], seq 22848:24276, ack 1, win 4107, options [nop,nop,TS val 4294951842 ecr 210777,mptcp dss ack 1818309187 seq 1402324075 subseq 751129 len 1428 csum 0x9ff6], length 1428
16:50:55.680287 IP 112.26.3.1.targus-getdata1 > 112.26.3.8.58109: Flags [.], ack 12852, win 24576, options [nop,nop,TS val 211309 ecr 4294951436,nop,nop,sack 1 {17136:24276},mptcp dss ack 1402311223], length 0
16:50:55.680626 IP 112.26.3.1.targus-getdata1 > 112.26.3.8.58109: Flags [.], ack 12852, win 24576, options [nop,nop,TS val 211309 ecr 4294951436,nop,nop,sack 1 {17136:24276},mptcp dss ack 1402311223], length 0
16:50:55.736538 IP 112.26.3.8.58109 > 112.26.3.1.targus-getdata1: Flags [.], seq 27132:28560, ack 1, win 4107, options [nop,nop,TS val 4294952028 ecr 210987,mptcp dss ack 1818309187 seq 1402331215 subseq 755413 len 1428 csum 0x1f5a], length 1428
16:50:55.756210 IP 112.26.3.8.58109 > 112.26.3.1.targus-getdata1: Flags [.], seq 24276:25704, ack 1, win 4107, options [nop,nop,TS val 4294951914 ecr 210826,mptcp dss ack 1818309187 seq 1402325503 subseq 752557 len 1428 csum 0xecf3], length 1428
16:50:55.761155 IP 112.26.3.8.58109 > 112.26.3.1.targus-getdata1: Flags [.], seq 24276:25704, ack 1, win 4107, options [nop,nop,TS val 4294951914 ecr 210826,mptcp dss ack 1818309187 seq 1402325503 subseq 752557 len 1428 csum 0xecf3], length 1428
16:50:55.762240 IP 112.26.3.1.targus-getdata1 > 112.26.3.8.58109: Flags [.], ack 12852, win 24576, options [nop,nop,TS val 211399 ecr 4294951436,nop,nop,sack 1 {17136:25704},mptcp dss ack 1402311223], length 0
16:50:55.762546 IP 112.26.3.1.targus-getdata1 > 112.26.3.8.58109: Flags [.], ack 12852, win 24576, options [nop,nop,TS val 211399 ecr 4294951436,nop,nop,sack 1 {17136:25704},mptcp dss ack 1402311223], length 0
16:50:55.777504 IP 112.26.3.8.58109 > 112.26.3.1.targus-getdata1: Flags [.], seq 28560:29988, ack 1, win 4107, options [nop,nop,TS val 4294952151 ecr 211043,mptcp dss ack 1818309187 seq 1402332643 subseq 756841 len 1428 csum 0x2234], length 1428
16:50:55.834090 IP 112.26.3.8.58109 > 112.26.3.1.targus-getdata1: Flags [.], seq 25704:27132, ack 1, win 4107, options [nop,nop,TS val 4294951944 ecr 210907,mptcp dss ack 1818309187 seq 1402326931 subseq 753985 len 1428 csum 0x2e0e], length 1428
16:50:55.840690 IP 112.26.3.1.targus-getdata1 > 112.26.3.8.58109: Flags [.], ack 12852, win 24576, options [nop,nop,TS val 211477 ecr 4294951436,nop,nop,sack 1 {17136:27132},mptcp dss ack 1402311223], length 0
16:50:55.841036 IP 112.26.3.1.targus-getdata1 > 112.26.3.8.58109: Flags [.], ack 12852, win 24576, options [nop,nop,TS val 211477 ecr 4294951436,nop,nop,sack 1 {17136:27132},mptcp dss ack 1402311223], length 0
16:50:55.844780 IP 112.26.3.8.58109 > 112.26.3.1.targus-getdata1: Flags [.], seq 25704:27132, ack 1, win 4107, options [nop,nop,TS val 4294951944 ecr 210907,mptcp dss ack 1818309187 seq 1402326931 subseq 753985 len 1428 csum 0x2e0e], length 1428
16:50:55.851923 IP 112.26.3.8.58109 > 112.26.3.1.targus-getdata1: Flags [.], seq 29988:31416, ack 1, win 4107, options [nop,nop,TS val 4294952199 ecr 211096,mptcp dss ack 1818309187 seq 1402334071 subseq 758269 len 1428 csum 0x8856], length 1428
16:50:55.878771 IP 112.26.3.8.58109 > 112.26.3.1.targus-getdata1: Flags [.], seq 27132:28560, ack 1, win 4107, options [nop,nop,TS val 4294952028 ecr 210987,mptcp dss ack 1818309187 seq 1402331215 subseq 755413 len 1428 csum 0x1f5a], length 1428
16:50:55.885468 IP 112.26.3.8.58109 > 112.26.3.1.targus-getdata1: Flags [.], seq 12852:14280, ack 1, win 4107, options [nop,nop,TS val 4294952219 ecr 211181,mptcp dss ack 1818309187 seq 1402311223 subseq 741133 len 1428 csum 0x5378], length 1428
16:50:55.893801 IP 112.26.3.1.targus-getdata1 > 112.26.3.8.58109: Flags [.], ack 12852, win 24576, options [nop,nop,TS val 211532 ecr 4294951436,nop,nop,sack 1 {17136:28560},mptcp dss ack 1402311223], length 0
16:50:55.894142 IP 112.26.3.1.targus-getdata1 > 112.26.3.8.58109: Flags [.], ack 12852, win 24576, options [nop,nop,TS val 211532 ecr 4294951436,nop,nop,sack 1 {17136:28560},mptcp dss ack 1402311223], length 0
16:50:55.933715 IP 112.26.3.8.58109 > 112.26.3.1.targus-getdata1: Flags [.], seq 27132:28560, ack 1, win 4107, options [nop,nop,TS val 4294952028 ecr 210987,mptcp dss ack 1818309187 seq 1402331215 subseq 755413 len 1428 csum 0x1f5a], length 1428
16:50:55.952425 IP 112.26.3.8.58109 > 112.26.3.1.targus-getdata1: Flags [.], seq 14280:15708, ack 1, win 4107, options [nop,nop,TS val 4294952396 ecr 211309,mptcp dss ack 1818309187 seq 1402312651 subseq 742561 len 1428 csum 0xa51d], length 1428
16:50:55.963168 IP 112.26.3.8.58109 > 112.26.3.1.targus-getdata1: Flags [.], seq 28560:29988, ack 1, win 4107, options [nop,nop,TS val 4294952151 ecr 211043,mptcp dss ack 1818309187 seq 1402332643 subseq 756841 len 1428 csum 0x2234], length 1428
16:50:55.987132 IP 112.26.3.8.58109 > 112.26.3.1.targus-getdata1: Flags [.], seq 28560:29988, ack 1, win 4107, options [nop,nop,TS val 4294952151 ecr 211043,mptcp dss ack 1818309187 seq 1402332643 subseq 756841 len 1428 csum 0x2234], length 1428
16:50:55.989470 IP 112.26.3.1.targus-getdata1 > 112.26.3.8.58109: Flags [.], ack 12852, win 24576, options [nop,nop,TS val 211628 ecr 4294951436,nop,nop,sack 1 {17136:29988},mptcp dss ack 1402311223], length 0
16:50:55.989799 IP 112.26.3.1.targus-getdata1 > 112.26.3.8.58109: Flags [.], ack 12852, win 24576, options [nop,nop,TS val 211628 ecr 4294951436,nop,nop,sack 1 {17136:29988},mptcp dss ack 1402311223], length 0
16:50:56.005324 IP 112.26.3.8.58109 > 112.26.3.1.targus-getdata1: Flags [.], seq 15708:17136, ack 1, win 4107, options [nop,nop,TS val 4294952454 ecr 211399,mptcp dss ack 1818309187 seq 1402314079 subseq 743989 len 1428 csum 0x1b17], length 1428
16:50:56.038888 IP 112.26.3.8.58109 > 112.26.3.1.targus-getdata1: Flags [.], seq 29988:31416, ack 1, win 4107, options [nop,nop,TS val 4294952199 ecr 211096,mptcp dss ack 1818309187 seq 1402334071 subseq 758269 len 1428 csum 0x8856], length 1428
16:50:56.058447 IP 112.26.3.8.58109 > 112.26.3.1.targus-getdata1: Flags [.], seq 31416:32844, ack 1, win 4107, options [nop,nop,TS val 4294952548 ecr 211477,mptcp dss ack 1818309187 seq 1402344067 subseq 759697 len 1428 csum 0xefec], length 1428
16:50:56.072964 IP 112.26.3.8.58109 > 112.26.3.1.targus-getdata1: Flags [.], seq 12852:14280, ack 1, win 4107, options [nop,nop,TS val 4294952219 ecr 211181,mptcp dss ack 1818309187 seq 1402311223 subseq 741133 len 1428 csum 0x5378], length 1428
16:50:56.076449 IP 112.26.3.8.58109 > 112.26.3.1.targus-getdata1: Flags [.], seq 29988:31416, ack 1, win 4107, options [nop,nop,TS val 4294952199 ecr 211096,mptcp dss ack 1818309187 seq 1402334071 subseq 758269 len 1428 csum 0x8856], length 1428
16:50:56.080857 IP 112.26.3.1.targus-getdata1 > 112.26.3.8.58109: Flags [.], ack 12852, win 24576, options [nop,nop,TS val 211717 ecr 4294951436,nop,nop,sack 1 {17136:31416},mptcp dss ack 1402311223], length 0
16:50:56.081180 IP 112.26.3.1.targus-getdata1 > 112.26.3.8.58109: Flags [.], ack 12852, win 24576, options [nop,nop,TS val 211717 ecr 4294951436,nop,nop,sack 1 {17136:31416},mptcp dss ack 1402311223], length 0
16:50:56.108506 IP 112.26.3.8.58109 > 112.26.3.1.targus-getdata1: Flags [.], seq 32844:34272, ack 1, win 4107, options [nop,nop,TS val 4294952657 ecr 211532,mptcp dss ack 1818309187 seq 1402348351 subseq 761125 len 1428 csum 0xda], length 1428
16:50:56.149231 IP 112.26.3.8.58109 > 112.26.3.1.targus-getdata1: Flags [.], seq 14280:15708, ack 1, win 4107, options [nop,nop,TS val 4294952396 ecr 211309,mptcp dss ack 1818309187 seq 1402312651 subseq 742561 len 1428 csum 0xa51d], length 1428
16:50:56.166139 IP 112.26.3.1.targus-getdata1 > 112.26.3.8.58109: Flags [.], ack 14280, win 24554, options [nop,nop,TS val 211799 ecr 4294952219,nop,nop,sack 1 {17136:31416},mptcp dss ack 1402312651], length 0
16:50:56.166457 IP 112.26.3.1.targus-getdata1 > 112.26.3.8.58109: Flags [.], ack 14280, win 24554, options [nop,nop,TS val 211799 ecr 4294952219,nop,nop,sack 1 {17136:31416},mptcp dss ack 1402312651], length 0
16:50:56.173353 IP 112.26.3.8.58109 > 112.26.3.1.targus-getdata1: Flags [.], seq 12852:14280, ack 1, win 4107, options [nop,nop,TS val 4294952219 ecr 211181,mptcp dss ack 1818309187 seq 1402311223 subseq 741133 len 1428 csum 0x5378], length 1428
16:50:56.182185 IP 112.26.3.8.58109 > 112.26.3.1.targus-getdata1: Flags [.], seq 34272:35700, ack 1, win 4107, options [nop,nop,TS val 4294952748 ecr 211628,mptcp dss ack 1818309187 seq 1402349779 subseq 762553 len 1428 csum 0xb84f], length 1428
16:50:56.189974 IP 112.26.3.8.58109 > 112.26.3.1.targus-getdata1: Flags [.], seq 35700:37128, ack 1, win 4107, options [nop,nop,TS val 4294952796 ecr 211717,mptcp dss ack 1818309187 seq 1402351207 subseq 763981 len 1428 csum 0xfd21], length 1428
16:50:56.233558 IP 112.26.3.8.58109 > 112.26.3.1.targus-getdata1: Flags [.], seq 15708:17136, ack 1, win 4107, options [nop,nop,TS val 4294952454 ecr 211399,mptcp dss ack 1818309187 seq 1402314079 subseq 743989 len 1428 csum 0x1b17], length 1428
16:50:56.250621 IP 112.26.3.8.58109 > 112.26.3.1.targus-getdata1: Flags [.], seq 14280:15708, ack 1, win 4107, options [nop,nop,TS val 4294952396 ecr 211309,mptcp dss ack 1818309187 seq 1402312651 subseq 742561 len 1428 csum 0xa51d], length 1428
16:50:56.253472 IP 112.26.3.1.targus-getdata1 > 112.26.3.8.58109: Flags [.], ack 15708, win 24532, options [nop,nop,TS val 211891 ecr 4294952396,nop,nop,sack 1 {17136:31416},mptcp dss ack 1402314079], length 0
16:50:56.253759 IP 112.26.3.1.targus-getdata1 > 112.26.3.8.58109: Flags [.], ack 15708, win 24532, options [nop,nop,TS val 211891 ecr 4294952396,nop,nop,sack 1 {17136:31416},mptcp dss ack 1402314079], length 0
16:50:56.272000 IP 112.26.3.8.58109 > 112.26.3.1.targus-getdata1: Flags [.], seq 37128:38556, ack 1, win 4107, options [nop,nop,TS val 4294952843 ecr 211799,mptcp dss ack 1818309187 seq 1402354063 subseq 765409 len 1428 csum 0xaaf9], length 1428
16:50:56.306397 IP 112.26.3.1.targus-getdata1 > 112.26.3.8.58109: Flags [.], ack 31416, win 24295, options [nop,nop,TS val 211938 ecr 4294952454,mptcp dss ack 1402339783], length 0
16:50:56.306677 IP 112.26.3.1.targus-getdata1 > 112.26.3.8.58109: Flags [.], ack 31416, win 24295, options [nop,nop,TS val 211938 ecr 4294952454,mptcp dss ack 1402339783], length 0
16:50:56.346754 IP 112.26.3.8.58109 > 112.26.3.1.targus-getdata1: Flags [.], seq 31416:32844, ack 1, win 4107, options [nop,nop,TS val 4294952548 ecr 211477,mptcp dss ack 1818309187 seq 1402344067 subseq 759697 len 1428 csum 0xefec], length 1428
16:50:56.349282 IP 112.26.3.8.58109 > 112.26.3.1.targus-getdata1: Flags [.], seq 38556:39984, ack 1, win 4107, options [nop,nop,TS val 4294952922 ecr 211891,mptcp dss ack 1818309187 seq 1402356919 subseq 766837 len 1428 csum 0x593c], length 1428
16:50:56.362274 IP 112.26.3.8.58109 > 112.26.3.1.targus-getdata1: Flags [.], seq 15708:17136, ack 1, win 4107, options [nop,nop,TS val 4294952454 ecr 211399,mptcp dss ack 1818309187 seq 1402314079 subseq 743989 len 1428 csum 0x1b17], length 1428
16:50:56.381656 IP 112.26.3.8.58109 > 112.26.3.1.targus-getdata1: Flags [.], seq 39984:41412, ack 1, win 4107, options [nop,nop,TS val 4294952974 ecr 211938,mptcp dss ack 1818309187 seq 1402358347 subseq 768265 len 1428 csum 0xc1bb], length 1428
16:50:56.404457 IP 112.26.3.8.58109 > 112.26.3.1.targus-getdata1: Flags [.], seq 31416:32844, ack 1, win 4107, options [nop,nop,TS val 4294952548 ecr 211477,mptcp dss ack 1818309187 seq 1402344067 subseq 759697 len 1428 csum 0xefec], length 1428
16:50:56.409439 IP 112.26.3.1.targus-getdata1 > 112.26.3.8.58109: Flags [.], ack 32844, win 24576, options [nop,nop,TS val 212041 ecr 4294952548,mptcp dss ack 1402339783], length 0
16:50:56.409707 IP 112.26.3.1.targus-getdata1 > 112.26.3.8.58109: Flags [.], ack 32844, win 24576, options [nop,nop,TS val 212041 ecr 4294952548,mptcp dss ack 1402339783], length 0
16:50:56.436488 IP 112.26.3.8.58109 > 112.26.3.1.targus-getdata1: Flags [.], seq 32844:34272, ack 1, win 4107, options [nop,nop,TS val 4294952657 ecr 211532,mptcp dss ack 1818309187 seq 1402348351 subseq 761125 len 1428 csum 0xda], length 1428
16:50:56.478244 IP 112.26.3.8.58109 > 112.26.3.1.targus-getdata1: Flags [.], seq 41412:42840, ack 1, win 4107, options [nop,nop,TS val 4294953085 ecr 212041,mptcp dss ack 1818309187 seq 1402359775 subseq 769693 len 1428 csum 0x9430], length 1428
16:50:56.496107 IP 112.26.3.8.58109 > 112.26.3.1.targus-getdata1: Flags [.], seq 32844:34272, ack 1, win 4107, options [nop,nop,TS val 4294952657 ecr 211532,mptcp dss ack 1818309187 seq 1402348351 subseq 761125 len 1428 csum 0xda], length 1428
16:50:56.508826 IP 112.26.3.1.targus-getdata1 > 112.26.3.8.58109: Flags [.], ack 34272, win 24576, options [nop,nop,TS val 212129 ecr 4294952657,mptcp dss ack 1402339783], length 0
16:50:56.509204 IP 112.26.3.1.targus-getdata1 > 112.26.3.8.58109: Flags [.], ack 34272, win 24576, options [nop,nop,TS val 212129 ecr 4294952657,mptcp dss ack 1402339783], length 0
16:50:56.529082 IP 112.26.3.8.58109 > 112.26.3.1.targus-getdata1: Flags [.], seq 42840:44268, ack 1, win 4107, options [nop,nop,TS val 4294953085 ecr 212041,mptcp dss ack 1818309187 seq 1402361203 subseq 771121 len 1428 csum 0xd013], length 1428
16:50:56.559345 IP 112.26.3.8.58109 > 112.26.3.1.targus-getdata1: Flags [.], seq 44268:45696, ack 1, win 4107, options [nop,nop,TS val 4294953176 ecr 212129,mptcp dss ack 1818309187 seq 1402382623 subseq 772549 len 1428 csum 0x54d4], length 1428
16:50:56.572616 IP 112.26.3.8.58109 > 112.26.3.1.targus-getdata1: Flags [.], seq 34272:35700, ack 1, win 4107, options [nop,nop,TS val 4294952748 ecr 211628,mptcp dss ack 1818309187 seq 1402349779 subseq 762553 len 1428 csum 0xb84f], length 1428
16:50:56.574792 IP 112.26.3.8.58109 > 112.26.3.1.targus-getdata1: Flags [.], seq 34272:35700, ack 1, win 4107, options [nop,nop,TS val 4294952748 ecr 211628,mptcp dss ack 1818309187 seq 1402349779 subseq 762553 len 1428 csum 0xb84f], length 1428
16:50:56.586467 IP 112.26.3.1.targus-getdata1 > 112.26.3.8.58109: Flags [.], ack 35700, win 24576, options [nop,nop,TS val 212215 ecr 4294952748,mptcp dss ack 1402339783], length 0
16:50:56.586778 IP 112.26.3.1.targus-getdata1 > 112.26.3.8.58109: Flags [.], ack 35700, win 24576, options [nop,nop,TS val 212215 ecr 4294952748,mptcp dss ack 1402339783], length 0
16:50:56.626082 IP 112.26.3.8.58109 > 112.26.3.1.targus-getdata1: Flags [.], seq 35700:37128, ack 1, win 4107, options [nop,nop,TS val 4294952796 ecr 211717,mptcp dss ack 1818309187 seq 1402351207 subseq 763981 len 1428 csum 0xfd21], length 1428
