16:50:02.663351 IP 112.26.1.8.55191 > 112.26.1.1.targus-getdata1: Flags [S], seq 2901888254, win 65535, options [mss 1460,sackOK,TS val 4294899300 ecr 0,nop,wscale 6,mptcp join id 3 token 0x92d88ed4 nonce 0x68d3a430], length 0
16:50:02.739371 IP 112.26.1.8.55191 > 112.26.1.1.targus-getdata1: Flags [S], seq 2901888254, win 65535, options [mss 1460,sackOK,TS val 4294899300 ecr 0,nop,wscale 6,mptcp join id 3 token 0x92d88ed4 nonce 0x68d3a430], length 0
16:50:02.805565 IP 112.26.1.8.55191 > 112.26.1.1.targus-getdata1: Flags [S], seq 2901888254, win 65535, options [mss 1460,sackOK,TS val 4294899300 ecr 0,nop,wscale 6,mptcp join id 3 token 0x92d88ed4 nonce 0x68d3a430], length 0
16:50:02.916555 IP 112.26.1.1.targus-getdata1 > 112.26.1.8.55191: Flags [S.], seq 1788441470, ack 2901888255, win 65535, options [mss 1460,sackOK,TS val 158446 ecr 4294899300,nop,wscale 6,mptcp join id 3 hmac 0xb87af290a2f9ebc nonce 0x9e7bba42], length 0
16:50:03.013428 IP 112.26.1.8.55191 > 112.26.1.1.targus-getdata1: Flags [.], ack 1, win 4107, options [nop,nop,TS val 4294899618 ecr 158446,mptcp join hmac 0xa5ddd1a659969cc82eee92f570562fd348ba605a], length 0
16:50:03.068014 IP 112.26.1.8.55191 > 112.26.1.1.targus-getdata1: Flags [.], ack 1, win 4107, options [nop,nop,TS val 4294899618 ecr 158446,mptcp join hmac 0xa5ddd1a659969cc82eee92f570562fd348ba605a], length 0
16:50:03.069656 IP 112.26.1.8.55191 > 112.26.1.1.targus-getdata1: Flags [.], ack 1, win 4107, options [nop,nop,TS val 4294899618 ecr 158446,mptcp join hmac 0xa5ddd1a659969cc82eee92f570562fd348ba605a], length 0
16:50:41.373832 IP 112.26.1.8.56443 > 112.26.1.1.targus-getdata1: Flags [.], seq 1767720831:1767722259, ack 3323357634, win 4107, options [nop,nop,TS val 4294937516 ecr 195976,mptcp dss ack 1818309187 seq 1402017055 subseq 456961 len 1428 csum 0xec51], length 1428
16:50:41.427742 IP 112.26.1.8.56443 > 112.26.1.1.targus-getdata1: Flags [.], seq 5712:7140, ack 1, win 4107, options [nop,nop,TS val 4294938084 ecr 196512,mptcp dss ack 1818309187 seq 1402038475 subseq 462673 len 1428 csum 0xc456], length 1428
16:50:41.442086 IP 112.26.1.1.targus-getdata1 > 112.26.1.8.56443: Flags [.], ack 1428, win 24543, options [nop,nop,TS val 197014 ecr 4294937419,mptcp dss ack 1402019911], length 0
16:50:41.479856 IP 112.26.1.8.56443 > 112.26.1.1.targus-getdata1: Flags [.], seq 1428:2856, ack 1, win 4107, options [nop,nop,TS val 4294937648 ecr 196060,mptcp dss ack 1818309187 seq 1402019911 subseq 458389 len 1428 csum 0x65a8], length 1428
16:50:41.547737 IP 112.26.1.8.56443 > 112.26.1.1.targus-getdata1: Flags [.], seq 7140:8568, ack 1, win 4107, options [nop,nop,TS val 4294938210 ecr 196674,mptcp dss ack 1818309187 seq 1402047043 subseq 464101 len 1428 csum 0x75d0], length 1428
16:50:41.581503 IP 112.26.1.8.56443 > 112.26.1.1.targus-getdata1: Flags [.], seq 8568:9996, ack 1, win 4107, options [nop,nop,TS val 4294938210 ecr 196674,mptcp dss ack 1818309187 seq 1402048471 subseq 465529 len 1428 csum 0x6a9f], length 1428
16:50:41.601984 IP 112.26.1.8.56443 > 112.26.1.1.targus-getdata1: Flags [.], seq 2856:4284, ack 1, win 4107, options [nop,nop,TS val 4294937807 ecr 196234,mptcp dss ack 1818309187 seq 1402025623 subseq 459817 len 1428 csum 0x8fe1], length 1428
16:50:41.670109 IP 112.26.1.1.targus-getdata1 > 112.26.1.8.56443: Flags [.], ack 4284, win 24543, options [nop,nop,TS val 197240 ecr 4294937648,mptcp dss ack 1402028479], length 0
16:50:41.705025 IP 112.26.1.8.56443 > 112.26.1.1.targus-getdata1: Flags [.], seq 4284:5712, ack 1, win 4107, options [nop,nop,TS val 4294937918 ecr 196371,mptcp dss ack 1818309187 seq 1402029907 subseq 461245 len 1428 csum 0xd01a], length 1428
16:50:41.720189 IP 112.26.1.8.56443 > 112.26.1.1.targus-getdata1: Flags [.], seq 9996:11424, ack 1, win 4107, options [nop,nop,TS val 4294938383 ecr 196847,mptcp dss ack 1818309187 seq 1402057039 subseq 466957 len 1428 csum 0x8c8d], length 1428
16:50:41.769088 IP 112.26.1.8.56443 > 112.26.1.1.targus-getdata1: Flags [.], seq 11424:12852, ack 1, win 4107, options [nop,nop,TS val 4294938383 ecr 196847,mptcp dss ack 1818309187 seq 1402058467 subseq 468385 len 1428 csum 0x1a34], length 1428
16:50:41.780688 IP 112.26.1.8.56443 > 112.26.1.1.targus-getdata1: Flags [.], seq 5712:7140, ack 1, win 4107, options [nop,nop,TS val 4294938084 ecr 196512,mptcp dss ack 1818309187 seq 1402038475 subseq 462673 len 1428 csum 0xc456], length 1428
16:50:41.803007 IP 112.26.1.8.56443 > 112.26.1.1.targus-getdata1: Flags [.], seq 12852:14280, ack 1, win 4107, options [nop,nop,TS val 4294938383 ecr 196847,mptcp dss ack 1818309187 seq 1402059895 subseq 469813 len 1428 csum 0x23], length 1428
16:50:41.825355 IP 112.26.1.1.targus-getdata1 > 112.26.1.8.56443: Flags [.], ack 7140, win 24525, options [nop,nop,TS val 197456 ecr 4294937918,mptcp dss ack 1402035619], length 0
16:50:41.873122 IP 112.26.1.8.56443 > 112.26.1.1.targus-getdata1: Flags [.], seq 14280:15708, ack 1, win 4107, options [nop,nop,TS val 4294938526 ecr 197014,mptcp dss ack 1818309187 seq 1402064179 subseq 471241 len 1428 csum 0x53f5], length 1428
16:50:41.900014 IP 112.26.1.8.56443 > 112.26.1.1.targus-getdata1: Flags [.], seq 7140:8568, ack 1, win 4107, options [nop,nop,TS val 4294938210 ecr 196674,mptcp dss ack 1818309187 seq 1402047043 subseq 464101 len 1428 csum 0x75d0], length 1428
16:50:41.937582 IP 112.26.1.8.56443 > 112.26.1.1.targus-getdata1: Flags [.], seq 15708:17136, ack 1, win 4107, options [nop,nop,TS val 4294938526 ecr 197014,mptcp dss ack 1818309187 seq 1402065607 subseq 472669 len 1428 csum 0x1374], length 1428
16:50:41.987947 IP 112.26.1.8.56443 > 112.26.1.1.targus-getdata1: Flags [.], seq 8568:9996, ack 1, win 4107, options [nop,nop,TS val 4294938210 ecr 196674,mptcp dss ack 1818309187 seq 1402048471 subseq 465529 len 1428 csum 0x6a9f], length 1428
16:50:42.022206 IP 112.26.1.8.56443 > 112.26.1.1.targus-getdata1: Flags [.], seq 17136:18564, ack 1, win 4107, options [nop,nop,TS val 4294938686 ecr 197240,mptcp dss ack 1818309187 seq 1402069891 subseq 474097 len 1428 csum 0x87a0], length 1428
16:50:42.040688 IP 112.26.1.1.targus-getdata1 > 112.26.1.8.56443: Flags [.], ack 9996, win 24558, options [nop,nop,TS val 197628 ecr 4294938210,mptcp dss ack 1402049899], length 0
16:50:42.085467 IP 112.26.1.8.56443 > 112.26.1.1.targus-getdata1: Flags [.], seq 9996:11424, ack 1, win 4107, options [nop,nop,TS val 4294938383 ecr 196847,mptcp dss ack 1818309187 seq 1402057039 subseq 466957 len 1428 csum 0x8c8d], length 1428
16:50:42.092059 IP 112.26.1.8.56443 > 112.26.1.1.targus-getdata1: Flags [.], seq 18564:19992, ack 1, win 4107, options [nop,nop,TS val 4294938686 ecr 197240,mptcp dss ack 1818309187 seq 1402071319 subseq 475525 len 1428 csum 0x2aa6], length 1428
16:50:42.139646 IP 112.26.1.8.56443 > 112.26.1.1.targus-getdata1: Flags [.], seq 11424:12852, ack 1, win 4107, options [nop,nop,TS val 4294938383 ecr 196847,mptcp dss ack 1818309187 seq 1402058467 subseq 468385 len 1428 csum 0x1a34], length 1428
16:50:42.195548 IP 112.26.1.8.56443 > 112.26.1.1.targus-getdata1: Flags [.], seq 12852:14280, ack 1, win 4107, options [nop,nop,TS val 4294938383 ecr 196847,mptcp dss ack 1818309187 seq 1402059895 subseq 469813 len 1428 csum 0x23], length 1428
16:50:42.243310 IP 112.26.1.8.56443 > 112.26.1.1.targus-getdata1: Flags [.], seq 19992:21420, ack 1, win 4107, options [nop,nop,TS val 4294938905 ecr 197456,mptcp dss ack 1818309187 seq 1402079887 subseq 476953 len 1428 csum 0xff2a], length 1428
16:50:42.255529 IP 112.26.1.1.targus-getdata1 > 112.26.1.8.56443: Flags [.], ack 12852, win 24525, options [nop,nop,TS val 197823 ecr 4294938383,mptcp dss ack 1402055611], length 0
16:50:42.281943 IP 112.26.1.8.56443 > 112.26.1.1.targus-getdata1: Flags [.], seq 21420:22848, ack 1, win 4107, options [nop,nop,TS val 4294938905 ecr 197456,mptcp dss ack 1818309187 seq 1402081315 subseq 478381 len 1428 csum 0xc5da], length 1428
16:50:42.307521 IP 112.26.1.8.56443 > 112.26.1.1.targus-getdata1: Flags [.], seq 14280:15708, ack 1, win 4107, options [nop,nop,TS val 4294938526 ecr 197014,mptcp dss ack 1818309187 seq 1402064179 subseq 471241 len 1428 csum 0x53f5], length 1428
16:50:42.364854 IP 112.26.1.1.targus-getdata1 > 112.26.1.8.56443: Flags [.], ack 15708, win 24540, options [nop,nop,TS val 197948 ecr 4294938383,mptcp dss ack 1402065607], length 0
16:50:42.401106 IP 112.26.1.8.56443 > 112.26.1.1.targus-getdata1: Flags [.], seq 15708:17136, ack 1, win 4107, options [nop,nop,TS val 4294938526 ecr 197014,mptcp dss ack 1818309187 seq 1402065607 subseq 472669 len 1428 csum 0x1374], length 1428
16:50:42.444860 IP 112.26.1.8.56443 > 112.26.1.1.targus-getdata1: Flags [.], seq 17136:18564, ack 1, win 4107, options [nop,nop,TS val 4294938686 ecr 197240,mptcp dss ack 1818309187 seq 1402069891 subseq 474097 len 1428 csum 0x87a0], length 1428
16:50:42.480641 IP 112.26.1.8.56443 > 112.26.1.1.targus-getdata1: Flags [.], seq 22848:24276, ack 1, win 4107, options [nop,nop,TS val 4294939142 ecr 197628,mptcp dss ack 1818309187 seq 1402095595 subseq 479809 len 1428 csum 0x1675], length 1428
16:50:42.504569 IP 112.26.1.1.targus-getdata1 > 112.26.1.8.56443: Flags [.], ack 18564, win 24543, options [nop,nop,TS val 198085 ecr 4294938526,mptcp dss ack 1402071319], length 0
16:50:42.549496 IP 112.26.1.8.56443 > 112.26.1.1.targus-getdata1: Flags [.], seq 18564:19992, ack 1, win 4107, options [nop,nop,TS val 4294938686 ecr 197240,mptcp dss ack 1818309187 seq 1402071319 subseq 475525 len 1428 csum 0x2aa6], length 1428
16:50:42.554616 IP 112.26.1.8.56443 > 112.26.1.1.targus-getdata1: Flags [.], seq 24276:25704, ack 1, win 4107, options [nop,nop,TS val 4294939142 ecr 197628,mptcp dss ack 1818309187 seq 1402097023 subseq 481237 len 1428 csum 0xf840], length 1428
16:50:42.628126 IP 112.26.1.8.56443 > 112.26.1.1.targus-getdata1: Flags [.], seq 19992:21420, ack 1, win 4107, options [nop,nop,TS val 4294938905 ecr 197456,mptcp dss ack 1818309187 seq 1402079887 subseq 476953 len 1428 csum 0xff2a], length 1428
16:50:42.650037 IP 112.26.1.8.56443 > 112.26.1.1.targus-getdata1: Flags [.], seq 25704:27132, ack 1, win 4107, options [nop,nop,TS val 4294939313 ecr 197823,mptcp dss ack 1818309187 seq 1402104163 subseq 482665 len 1428 csum 0xc78], length 1428
16:50:42.673688 IP 112.26.1.1.targus-getdata1 > 112.26.1.8.56443: Flags [.], ack 21420, win 24540, options [nop,nop,TS val 198312 ecr 4294938686,mptcp dss ack 1402081315], length 0
16:50:42.689479 IP 112.26.1.8.56443 > 112.26.1.1.targus-getdata1: Flags [.], seq 27132:28560, ack 1, win 4107, options [nop,nop,TS val 4294939313 ecr 197823,mptcp dss ack 1818309187 seq 1402105591 subseq 484093 len 1428 csum 0xbd1c], length 1428
16:50:42.734441 IP 112.26.1.8.56443 > 112.26.1.1.targus-getdata1: Flags [.], seq 21420:22848, ack 1, win 4107, options [nop,nop,TS val 4294938905 ecr 197456,mptcp dss ack 1818309187 seq 1402081315 subseq 478381 len 1428 csum 0xc5da], length 1428
16:50:42.797211 IP 112.26.1.8.56443 > 112.26.1.1.targus-getdata1: Flags [.], seq 28560:29988, ack 1, win 4107, options [nop,nop,TS val 4294939459 ecr 197948,mptcp dss ack 1818309187 seq 1402111303 subseq 485521 len 1428 csum 0x1388], length 1428
16:50:42.853691 IP 112.26.1.8.56443 > 112.26.1.1.targus-getdata1: Flags [.], seq 22848:24276, ack 1, win 4107, options [nop,nop,TS val 4294939142 ecr 197628,mptcp dss ack 1818309187 seq 1402095595 subseq 479809 len 1428 csum 0x1675], length 1428
16:50:42.876903 IP 112.26.1.8.56443 > 112.26.1.1.targus-getdata1: Flags [.], seq 29988:31416, ack 1, win 4107, options [nop,nop,TS val 4294939459 ecr 197948,mptcp dss ack 1818309187 seq 1402112731 subseq 486949 len 1428 csum 0xbf41], length 1428
16:50:42.920491 IP 112.26.1.8.56443 > 112.26.1.1.targus-getdata1: Flags [.], seq 31416:32844, ack 1, win 4107, options [nop,nop,TS val 4294939565 ecr 198085,mptcp dss ack 1818309187 seq 1402114159 subseq 488377 len 1428 csum 0x1f15], length 1428
16:50:42.929364 IP 112.26.1.1.targus-getdata1 > 112.26.1.8.56443: Flags [.], ack 24276, win 24558, options [nop,nop,TS val 198494 ecr 4294938905,mptcp dss ack 1402091311], length 0
16:50:42.991803 IP 112.26.1.8.56443 > 112.26.1.1.targus-getdata1: Flags [.], seq 24276:25704, ack 1, win 4107, options [nop,nop,TS val 4294939142 ecr 197628,mptcp dss ack 1818309187 seq 1402097023 subseq 481237 len 1428 csum 0xf840], length 1428
16:50:43.001789 IP 112.26.1.8.56443 > 112.26.1.1.targus-getdata1: Flags [.], seq 32844:34272, ack 1, win 4107, options [nop,nop,TS val 4294939565 ecr 198085,mptcp dss ack 1818309187 seq 1402115587 subseq 489805 len 1428 csum 0x75a2], length 1428
16:50:43.042866 IP 112.26.1.8.56443 > 112.26.1.1.targus-getdata1: Flags [.], seq 25704:27132, ack 1, win 4107, options [nop,nop,TS val 4294939313 ecr 197823,mptcp dss ack 1818309187 seq 1402104163 subseq 482665 len 1428 csum 0xc78], length 1428
16:50:43.095403 IP 112.26.1.1.targus-getdata1 > 112.26.1.8.56443: Flags [.], ack 27132, win 24558, options [nop,nop,TS val 198683 ecr 4294939142,mptcp dss ack 1402101307], length 0
16:50:43.102066 IP 112.26.1.8.56443 > 112.26.1.1.targus-getdata1: Flags [.], seq 34272:35700, ack 1, win 4107, options [nop,nop,TS val 4294939756 ecr 198312,mptcp dss ack 1818309187 seq 1402128439 subseq 491233 len 1428 csum 0x97b2], length 1428
16:50:43.127510 IP 112.26.1.8.56443 > 112.26.1.1.targus-getdata1: Flags [.], seq 35700:37128, ack 1, win 4107, options [nop,nop,TS val 4294939756 ecr 198312,mptcp dss ack 1818309187 seq 1402129867 subseq 492661 len 1428 csum 0x1613], length 1428
16:50:43.163270 IP 112.26.1.8.56443 > 112.26.1.1.targus-getdata1: Flags [.], seq 27132:28560, ack 1, win 4107, options [nop,nop,TS val 4294939313 ecr 197823,mptcp dss ack 1818309187 seq 1402105591 subseq 484093 len 1428 csum 0xbd1c], length 1428
16:50:43.166756 IP 112.26.1.8.56443 > 112.26.1.1.targus-getdata1: Flags [.], seq 37128:38556, ack 1, win 4107, options [nop,nop,TS val 4294939756 ecr 198312,mptcp dss ack 1818309187 seq 1402131295 subseq 494089 len 1428 csum 0x1575], length 1428
16:50:43.195557 IP 112.26.1.8.56443 > 112.26.1.1.targus-getdata1: Flags [.], seq 28560:29988, ack 1, win 4107, options [nop,nop,TS val 4294939459 ecr 197948,mptcp dss ack 1818309187 seq 1402111303 subseq 485521 len 1428 csum 0x1388], length 1428
16:50:43.240612 IP 112.26.1.1.targus-getdata1 > 112.26.1.8.56443: Flags [.], ack 29988, win 24558, options [nop,nop,TS val 198836 ecr 4294939313,mptcp dss ack 1402108447], length 0
16:50:43.314349 IP 112.26.1.8.56443 > 112.26.1.1.targus-getdata1: Flags [.], seq 29988:31416, ack 1, win 4107, options [nop,nop,TS val 4294939459 ecr 197948,mptcp dss ack 1818309187 seq 1402112731 subseq 486949 len 1428 csum 0xbf41], length 1428
16:50:43.340052 IP 112.26.1.8.56443 > 112.26.1.1.targus-getdata1: Flags [.], seq 38556:39984, ack 1, win 4107, options [nop,nop,TS val 4294940003 ecr 198494,mptcp dss ack 1818309187 seq 1402141291 subseq 495517 len 1428 csum 0x5381], length 1428
16:50:43.374517 IP 112.26.1.8.56443 > 112.26.1.1.targus-getdata1: Flags [.], seq 31416:32844, ack 1, win 4107, options [nop,nop,TS val 4294939565 ecr 198085,mptcp dss ack 1818309187 seq 1402114159 subseq 488377 len 1428 csum 0x1f15], length 1428
16:50:43.411546 IP 112.26.1.1.targus-getdata1 > 112.26.1.8.56443: Flags [.], ack 32844, win 24558, options [nop,nop,TS val 199015 ecr 4294939459,mptcp dss ack 1402115587], length 0
16:50:43.430397 IP 112.26.1.8.56443 > 112.26.1.1.targus-getdata1: Flags [.], seq 39984:41412, ack 1, win 4107, options [nop,nop,TS val 4294940003 ecr 198494,mptcp dss ack 1818309187 seq 1402142719 subseq 496945 len 1428 csum 0x92be], length 1428
16:50:43.451242 IP 112.26.1.8.56443 > 112.26.1.1.targus-getdata1: Flags [.], seq 32844:34272, ack 1, win 4107, options [nop,nop,TS val 4294939565 ecr 198085,mptcp dss ack 1818309187 seq 1402115587 subseq 489805 len 1428 csum 0x75a2], length 1428
16:50:43.495190 IP 112.26.1.8.56443 > 112.26.1.1.targus-getdata1: Flags [.], seq 41412:42840, ack 1, win 4107, options [nop,nop,TS val 4294940137 ecr 198683,mptcp dss ack 1818309187 seq 1402147003 subseq 498373 len 1428 csum 0xbc33], length 1428
16:50:43.512647 IP 112.26.1.8.56443 > 112.26.1.1.targus-getdata1: Flags [.], seq 34272:35700, ack 1, win 4107, options [nop,nop,TS val 4294939756 ecr 198312,mptcp dss ack 1818309187 seq 1402128439 subseq 491233 len 1428 csum 0x97b2], length 1428
16:50:43.584026 IP 112.26.1.1.targus-getdata1 > 112.26.1.8.56443: Flags [.], ack 35700, win 24558, options [nop,nop,TS val 199185 ecr 4294939565,mptcp dss ack 1402125583], length 0
16:50:43.597235 IP 112.26.1.8.56443 > 112.26.1.1.targus-getdata1: Flags [.], seq 42840:44268, ack 1, win 4107, options [nop,nop,TS val 4294940137 ecr 198683,mptcp dss ack 1818309187 seq 1402148431 subseq 499801 len 1428 csum 0xa225], length 1428
16:50:43.617020 IP 112.26.1.8.56443 > 112.26.1.1.targus-getdata1: Flags [.], seq 35700:37128, ack 1, win 4107, options [nop,nop,TS val 4294939756 ecr 198312,mptcp dss ack 1818309187 seq 1402129867 subseq 492661 len 1428 csum 0x1613], length 1428
16:50:43.684036 IP 112.26.1.8.56443 > 112.26.1.1.targus-getdata1: Flags [.], seq 37128:38556, ack 1, win 4107, options [nop,nop,TS val 4294939756 ecr 198312,mptcp dss ack 1818309187 seq 1402131295 subseq 494089 len 1428 csum 0x1575], length 1428
16:50:43.736026 IP 112.26.1.8.56443 > 112.26.1.1.targus-getdata1: Flags [.], seq 44268:45696, ack 1, win 4107, options [nop,nop,TS val 4294940398 ecr 198836,mptcp dss ack 1818309187 seq 1402161283 subseq 501229 len 1428 csum 0x49ce], length 1428
16:50:43.757994 IP 112.26.1.1.targus-getdata1 > 112.26.1.8.56443: Flags [.], ack 38556, win 24576, options [nop,nop,TS val 199324 ecr 4294939756,mptcp dss ack 1402134151], length 0
16:50:43.800868 IP 112.26.1.8.56443 > 112.26.1.1.targus-getdata1: Flags [.], seq 45696:47124, ack 1, win 4107, options [nop,nop,TS val 4294940398 ecr 198836,mptcp dss ack 1818309187 seq 1402162711 subseq 502657 len 1428 csum 0x7b6f], length 1428
16:50:43.827346 IP 112.26.1.8.56443 > 112.26.1.1.targus-getdata1: Flags [.], seq 38556:39984, ack 1, win 4107, options [nop,nop,TS val 4294940003 ecr 198494,mptcp dss ack 1818309187 seq 1402141291 subseq 495517 len 1428 csum 0x5381], length 1428
16:50:43.885197 IP 112.26.1.8.56443 > 112.26.1.1.targus-getdata1: Flags [.], seq 47124:48552, ack 1, win 4107, options [nop,nop,TS val 4294940398 ecr 198836,mptcp dss ack 1818309187 seq 1402164139 subseq 504085 len 1428 csum 0x75be], length 1428
16:50:43.916315 IP 112.26.1.8.56443 > 112.26.1.1.targus-getdata1: Flags [.], seq 39984:41412, ack 1, win 4107, options [nop,nop,TS val 4294940003 ecr 198494,mptcp dss ack 1818309187 seq 1402142719 subseq 496945 len 1428 csum 0x92be], length 1428
16:50:43.940063 IP 112.26.1.8.56443 > 112.26.1.1.targus-getdata1: Flags [.], seq 48552:49980, ack 1, win 4107, options [nop,nop,TS val 4294940533 ecr 199015,mptcp dss ack 1818309187 seq 1402171279 subseq 505513 len 1428 csum 0x274a], length 1428
16:50:43.975980 IP 112.26.1.1.targus-getdata1 > 112.26.1.8.56443: Flags [.], ack 41412, win 24576, options [nop,nop,TS val 199557 ecr 4294940003,mptcp dss ack 1402145575], length 0
16:50:43.993212 IP 112.26.1.8.56443 > 112.26.1.1.targus-getdata1: Flags [.], seq 49980:51408, ack 1, win 4107, options [nop,nop,TS val 4294940533 ecr 199015,mptcp dss ack 1818309187 seq 1402172707 subseq 506941 len 1428 csum 0x7d04], length 1428
16:50:44.041196 IP 112.26.1.8.56443 > 112.26.1.1.targus-getdata1: Flags [.], seq 41412:42840, ack 1, win 4107, options [nop,nop,TS val 4294940137 ecr 198683,mptcp dss ack 1818309187 seq 1402147003 subseq 498373 len 1428 csum 0xbc33], length 1428
16:50:44.069795 IP 112.26.1.8.56443 > 112.26.1.1.targus-getdata1: Flags [.], seq 51408:52836, ack 1, win 4107, options [nop,nop,TS val 4294940697 ecr 199185,mptcp dss ack 1818309187 seq 1402181275 subseq 508369 len 1428 csum 0xddad], length 1428
16:50:44.092257 IP 112.26.1.8.56443 > 112.26.1.1.targus-getdata1: Flags [.], seq 42840:44268, ack 1, win 4107, options [nop,nop,TS val 4294940137 ecr 198683,mptcp dss ack 1818309187 seq 1402148431 subseq 499801 len 1428 csum 0xa225], length 1428
16:50:44.125354 IP 112.26.1.8.56443 > 112.26.1.1.targus-getdata1: Flags [.], seq 52836:54264, ack 1, win 4107, options [nop,nop,TS val 4294940697 ecr 199185,mptcp dss ack 1818309187 seq 1402182703 subseq 509797 len 1428 csum 0xdced], length 1428
16:50:44.172227 IP 112.26.1.1.targus-getdata1 > 112.26.1.8.56443: Flags [.], ack 44268, win 24558, options [nop,nop,TS val 199733 ecr 4294940137,mptcp dss ack 1402152715], length 0
16:50:44.199775 IP 112.26.1.8.56443 > 112.26.1.1.targus-getdata1: Flags [.], seq 54264:55692, ack 1, win 4107, options [nop,nop,TS val 4294940697 ecr 199185,mptcp dss ack 1818309187 seq 1402184131 subseq 511225 len 1428 csum 0x811a], length 1428
16:50:44.210796 IP 112.26.1.8.56443 > 112.26.1.1.targus-getdata1: Flags [.], seq 44268:45696, ack 1, win 4107, options [nop,nop,TS val 4294940398 ecr 198836,mptcp dss ack 1818309187 seq 1402161283 subseq 501229 len 1428 csum 0x49ce], length 1428
16:50:44.238445 IP 112.26.1.8.56443 > 112.26.1.1.targus-getdata1: Flags [.], seq 55692:57120, ack 1, win 4107, options [nop,nop,TS val 4294940870 ecr 199324,mptcp dss ack 1818309187 seq 1402194127 subseq 512653 len 1428 csum 0x3919], length 1428
16:50:44.276435 IP 112.26.1.8.56443 > 112.26.1.1.targus-getdata1: Flags [.], seq 45696:47124, ack 1, win 4107, options [nop,nop,TS val 4294940398 ecr 198836,mptcp dss ack 1818309187 seq 1402162711 subseq 502657 len 1428 csum 0x7b6f], length 1428
16:50:44.308225 IP 112.26.1.8.56443 > 112.26.1.1.targus-getdata1: Flags [.], seq 57120:58548, ack 1, win 4107, options [nop,nop,TS val 4294940870 ecr 199324,mptcp dss ack 1818309187 seq 1402195555 subseq 514081 len 1428 csum 0x4402], length 1428
16:50:44.331489 IP 112.26.1.8.56443 > 112.26.1.1.targus-getdata1: Flags [.], seq 47124:48552, ack 1, win 4107, options [nop,nop,TS val 4294940398 ecr 198836,mptcp dss ack 1818309187 seq 1402164139 subseq 504085 len 1428 csum 0x75be], length 1428
16:50:44.358597 IP 112.26.1.8.56443 > 112.26.1.1.targus-getdata1: Flags [.], seq 58548:59976, ack 1, win 4107, options [nop,nop,TS val 4294940870 ecr 199324,mptcp dss ack 1818309187 seq 1402196983 subseq 515509 len 1428 csum 0xed82], length 1428
16:50:44.397345 IP 112.26.1.8.56443 > 112.26.1.1.targus-getdata1: Flags [.], seq 48552:49980, ack 1, win 4107, options [nop,nop,TS val 4294940533 ecr 199015,mptcp dss ack 1818309187 seq 1402171279 subseq 505513 len 1428 csum 0x274a], length 1428
16:50:44.436116 IP 112.26.1.8.56443 > 112.26.1.1.targus-getdata1: Flags [.], seq 59976:61404, ack 1, win 4107, options [nop,nop,TS val 4294941099 ecr 199557,mptcp dss ack 1818309187 seq 1402206979 subseq 516937 len 1428 csum 0x5044], length 1428
16:50:44.455880 IP 112.26.1.1.targus-getdata1 > 112.26.1.8.56443: Flags [.], ack 49980, win 24540, options [nop,nop,TS val 200038 ecr 4294940398,mptcp dss ack 1402159855], length 0
16:50:44.525425 IP 112.26.1.8.56443 > 112.26.1.1.targus-getdata1: Flags [.], seq 61404:62832, ack 1, win 4107, options [nop,nop,TS val 4294941099 ecr 199557,mptcp dss ack 1818309187 seq 1402208407 subseq 518365 len 1428 csum 0x1ead], length 1428
16:50:44.536515 IP 112.26.1.8.56443 > 112.26.1.1.targus-getdata1: Flags [.], seq 49980:51408, ack 1, win 4107, options [nop,nop,TS val 4294940533 ecr 199015,mptcp dss ack 1818309187 seq 1402172707 subseq 506941 len 1428 csum 0x7d04], length 1428
16:50:44.578947 IP 112.26.1.8.56443 > 112.26.1.1.targus-getdata1: Flags [.], seq 51408:52836, ack 1, win 4107, options [nop,nop,TS val 4294940697 ecr 199185,mptcp dss ack 1818309187 seq 1402181275 subseq 508369 len 1428 csum 0xddad], length 1428
16:50:44.642238 IP 112.26.1.8.56443 > 112.26.1.1.targus-getdata1: Flags [.], seq 52836:54264, ack 1, win 4107, options [nop,nop,TS val 4294940697 ecr 199185,mptcp dss ack 1818309187 seq 1402182703 subseq 509797 len 1428 csum 0xdced], length 1428
16:50:44.666557 IP 112.26.1.8.56443 > 112.26.1.1.targus-getdata1: Flags [.], seq 62832:64260, ack 1, win 4107, options [nop,nop,TS val 4294941323 ecr 199733,mptcp dss ack 1818309187 seq 1402159855 subseq 519793 len 1428 csum 0x3b6c], length 1428
16:50:44.726270 IP 112.26.1.1.targus-getdata1 > 112.26.1.8.56443: Flags [.], ack 54264, win 24540, options [nop,nop,TS val 200352 ecr 4294940533,mptcp dss ack 1402159855], length 0
16:50:44.739330 IP 112.26.1.8.56443 > 112.26.1.1.targus-getdata1: Flags [.], seq 64260:65688, ack 1, win 4107, options [nop,nop,TS val 4294941323 ecr 199733,mptcp dss ack 1818309187 seq 1402166995 subseq 521221 len 1428 csum 0x7aee], length 1428
16:50:44.768310 IP 112.26.1.8.56443 > 112.26.1.1.targus-getdata1: Flags [.], seq 54264:55692, ack 1, win 4107, options [nop,nop,TS val 4294940697 ecr 199185,mptcp dss ack 1818309187 seq 1402184131 subseq 511225 len 1428 csum 0x811a], length 1428
16:50:44.799865 IP 112.26.1.8.56443 > 112.26.1.1.targus-getdata1: Flags [.], seq 65688:67116, ack 1, win 4107, options [nop,nop,TS val 4294941323 ecr 199733,mptcp dss ack 1818309187 seq 1402168423 subseq 522649 len 1428 csum 0x99bd], length 1428
16:50:44.837169 IP 112.26.1.8.56443 > 112.26.1.1.targus-getdata1: Flags [.], seq 55692:57120, ack 1, win 4107, options [nop,nop,TS val 4294940870 ecr 199324,mptcp dss ack 1818309187 seq 1402194127 subseq 512653 len 1428 csum 0x3919], length 1428
16:50:44.885958 IP 112.26.1.8.56443 > 112.26.1.1.targus-getdata1: Flags [.], seq 57120:58548, ack 1, win 4107, options [nop,nop,TS val 4294940870 ecr 199324,mptcp dss ack 1818309187 seq 1402195555 subseq 514081 len 1428 csum 0x4402], length 1428
16:50:44.960398 IP 112.26.1.8.56443 > 112.26.1.1.targus-getdata1: Flags [.], seq 58548:59976, ack 1, win 4107, options [nop,nop,TS val 4294940870 ecr 199324,mptcp dss ack 1818309187 seq 1402196983 subseq 515509 len 1428 csum 0xed82], length 1428
16:50:44.998191 IP 112.26.1.8.56443 > 112.26.1.1.targus-getdata1: Flags [.], seq 67116:68544, ack 1, win 4107, options [nop,nop,TS val 4294941660 ecr 200038,mptcp dss ack 1818309187 seq 1402185559 subseq 524077 len 1428 csum 0x2582], length 1428
16:50:45.004525 IP 112.26.1.8.56443 > 112.26.1.1.targus-getdata1: Flags [.], seq 59976:61404, ack 1, win 4107, options [nop,nop,TS val 4294941099 ecr 199557,mptcp dss ack 1818309187 seq 1402206979 subseq 516937 len 1428 csum 0x5044], length 1428
16:50:45.045757 IP 112.26.1.8.56443 > 112.26.1.1.targus-getdata1: Flags [.], seq 68544:69972, ack 1, win 4107, options [nop,nop,TS val 4294941660 ecr 200038,mptcp dss ack 1818309187 seq 1402186987 subseq 525505 len 1428 csum 0xaab3], length 1428
16:50:45.073817 IP 112.26.1.1.targus-getdata1 > 112.26.1.8.56443: Flags [.], ack 61404, win 24540, options [nop,nop,TS val 200645 ecr 4294940697,mptcp dss ack 1402159855], length 0
16:50:45.099164 IP 112.26.1.8.56443 > 112.26.1.1.targus-getdata1: Flags [.], seq 69972:71400, ack 1, win 4107, options [nop,nop,TS val 4294941660 ecr 200038,mptcp dss ack 1818309187 seq 1402188415 subseq 526933 len 1428 csum 0xfcbb], length 1428
16:50:45.107525 IP 112.26.1.8.56443 > 112.26.1.1.targus-getdata1: Flags [.], seq 61404:62832, ack 1, win 4107, options [nop,nop,TS val 4294941099 ecr 199557,mptcp dss ack 1818309187 seq 1402208407 subseq 518365 len 1428 csum 0x1ead], length 1428
16:50:45.172410 IP 112.26.1.8.56443 > 112.26.1.1.targus-getdata1: Flags [.], seq 62832:64260, ack 1, win 4107, options [nop,nop,TS val 4294941323 ecr 199733,mptcp dss ack 1818309187 seq 1402159855 subseq 519793 len 1428 csum 0x3b6c], length 1428
16:50:45.179109 IP 112.26.1.8.56443 > 112.26.1.1.targus-getdata1: Flags [.], seq 71400:72828, ack 1, win 4107, options [nop,nop,TS val 4294941660 ecr 200038,mptcp dss ack 1818309187 seq 1402198411 subseq 528361 len 1428 csum 0x4461], length 1428
16:50:45.203987 IP 112.26.1.8.56443 > 112.26.1.1.targus-getdata1: Flags [.], seq 72828:74256, ack 1, win 4107, options [nop,nop,TS val 4294941660 ecr 200038,mptcp dss ack 1818309187 seq 1402199839 subseq 529789 len 1428 csum 0xfc77], length 1428
16:50:45.218739 IP 112.26.1.1.targus-getdata1 > 112.26.1.8.56443: Flags [.], ack 64260, win 24429, options [nop,nop,TS val 200802 ecr 4294941099,mptcp dss ack 1402166995], length 0
16:50:45.255837 IP 112.26.1.8.56443 > 112.26.1.1.targus-getdata1: Flags [.], seq 74256:75684, ack 1, win 4107, options [nop,nop,TS val 4294941660 ecr 200038,mptcp dss ack 1818309187 seq 1402204123 subseq 531217 len 1428 csum 0x75ce], length 1428
16:50:45.283385 IP 112.26.1.8.56443 > 112.26.1.1.targus-getdata1: Flags [.], seq 64260:65688, ack 1, win 4107, options [nop,nop,TS val 4294941323 ecr 199733,mptcp dss ack 1818309187 seq 1402166995 subseq 521221 len 1428 csum 0x7aee], length 1428
16:50:45.317723 IP 112.26.1.8.56443 > 112.26.1.1.targus-getdata1: Flags [.], seq 75684:77112, ack 1, win 4107, options [nop,nop,TS val 4294941852 ecr 200352,mptcp dss ack 1818309187 seq 1402214119 subseq 532645 len 1428 csum 0x6e1d], length 1428
16:50:45.363857 IP 112.26.1.8.56443 > 112.26.1.1.targus-getdata1: Flags [.], seq 65688:67116, ack 1, win 4107, options [nop,nop,TS val 4294941323 ecr 199733,mptcp dss ack 1818309187 seq 1402168423 subseq 522649 len 1428 csum 0x99bd], length 1428
16:50:45.380816 IP 112.26.1.8.56443 > 112.26.1.1.targus-getdata1: Flags [.], seq 77112:78540, ack 1, win 4107, options [nop,nop,TS val 4294941852 ecr 200352,mptcp dss ack 1818309187 seq 1402215547 subseq 534073 len 1428 csum 0xfe2d], length 1428
16:50:45.431659 IP 112.26.1.8.56443 > 112.26.1.1.targus-getdata1: Flags [.], seq 67116:68544, ack 1, win 4107, options [nop,nop,TS val 4294941660 ecr 200038,mptcp dss ack 1818309187 seq 1402185559 subseq 524077 len 1428 csum 0x2582], length 1428
16:50:45.451069 IP 112.26.1.8.56443 > 112.26.1.1.targus-getdata1: Flags [.], seq 78540:79968, ack 1, win 4107, options [nop,nop,TS val 4294941852 ecr 200352,mptcp dss ack 1818309187 seq 1402216975 subseq 535501 len 1428 csum 0x249], length 1428
16:50:45.477400 IP 112.26.1.1.targus-getdata1 > 112.26.1.8.56443: Flags [.], ack 68544, win 24385, options [nop,nop,TS val 201069 ecr 4294941323,mptcp dss ack 1402169851], length 0
16:50:45.526785 IP 112.26.1.8.56443 > 112.26.1.1.targus-getdata1: Flags [.], seq 79968:81396, ack 1, win 4107, options [nop,nop,TS val 4294941852 ecr 200352,mptcp dss ack 1818309187 seq 1402222687 subseq 536929 len 1428 csum 0x819b], length 1428
16:50:45.540282 IP 112.26.1.8.56443 > 112.26.1.1.targus-getdata1: Flags [.], seq 68544:69972, ack 1, win 4107, options [nop,nop,TS val 4294941660 ecr 200038,mptcp dss ack 1818309187 seq 1402186987 subseq 525505 len 1428 csum 0xaab3], length 1428
16:50:45.570310 IP 112.26.1.8.56443 > 112.26.1.1.targus-getdata1: Flags [.], seq 81396:82824, ack 1, win 4107, options [nop,nop,TS val 4294942228 ecr 200645,mptcp dss ack 1818309187 seq 1402245535 subseq 538357 len 1428 csum 0xac3f], length 1428
16:50:45.612669 IP 112.26.1.8.56443 > 112.26.1.1.targus-getdata1: Flags [.], seq 82824:84252, ack 1, win 4107, options [nop,nop,TS val 4294942228 ecr 200645,mptcp dss ack 1818309187 seq 1402246963 subseq 539785 len 1428 csum 0xf70b], length 1428
16:50:45.653394 IP 112.26.1.8.56443 > 112.26.1.1.targus-getdata1: Flags [.], seq 84252:85680, ack 1, win 4107, options [nop,nop,TS val 4294942228 ecr 200645,mptcp dss ack 1818309187 seq 1402248391 subseq 541213 len 1428 csum 0x4f45], length 1428
16:50:45.690165 IP 112.26.1.8.56443 > 112.26.1.1.targus-getdata1: Flags [.], seq 85680:87108, ack 1, win 4107, options [nop,nop,TS val 4294942228 ecr 200645,mptcp dss ack 1818309187 seq 1402249819 subseq 542641 len 1428 csum 0x9d6f], length 1428
16:50:45.722445 IP 112.26.1.8.56443 > 112.26.1.1.targus-getdata1: Flags [.], seq 87108:88536, ack 1, win 4107, options [nop,nop,TS val 4294942228 ecr 200645,mptcp dss ack 1818309187 seq 1402251247 subseq 544069 len 1428 csum 0x7a02], length 1428
16:50:45.724264 IP 112.26.1.1.targus-getdata1 > 112.26.1.8.56443: Flags [.], ack 69972, win 24385, options [nop,nop,TS val 201360 ecr 4294941660,mptcp dss ack 1402169851], length 0
16:50:45.788610 IP 112.26.1.8.56443 > 112.26.1.1.targus-getdata1: Flags [P.], seq 88536:89964, ack 1, win 4107, options [nop,nop,TS val 4294942228 ecr 200645,mptcp dss ack 1818309187 seq 1402252675 subseq 545497 len 1428 csum 0x3f5b], length 1428
16:50:45.805524 IP 112.26.1.8.56443 > 112.26.1.1.targus-getdata1: Flags [.], seq 71400:72828, ack 1, win 4107, options [nop,nop,TS val 4294941660 ecr 200038,mptcp dss ack 1818309187 seq 1402198411 subseq 528361 len 1428 csum 0x4461], length 1428
16:50:45.867264 IP 112.26.1.8.56443 > 112.26.1.1.targus-getdata1: Flags [.], seq 89964:91392, ack 1, win 4107, options [nop,nop,TS val 4294942228 ecr 200645,mptcp dss ack 1818309187 seq 1402254103 subseq 546925 len 1428 csum 0x4d73], length 1428
16:50:45.886044 IP 112.26.1.1.targus-getdata1 > 112.26.1.8.56443: Flags [.], ack 69972, win 24385, options [nop,nop,TS val 201446 ecr 4294941660,nop,nop,sack 1 {71400:72828},mptcp dss ack 1402169851], length 0
16:50:45.931448 IP 112.26.1.8.56443 > 112.26.1.1.targus-getdata1: Flags [.], seq 74256:75684, ack 1, win 4107, options [nop,nop,TS val 4294941660 ecr 200038,mptcp dss ack 1818309187 seq 1402204123 subseq 531217 len 1428 csum 0x75ce], length 1428
16:50:45.947183 IP 112.26.1.8.56443 > 112.26.1.1.targus-getdata1: Flags [.], seq 91392:92820, ack 1, win 4107, options [nop,nop,TS val 4294942228 ecr 200645,mptcp dss ack 1818309187 seq 1402255531 subseq 548353 len 1428 csum 0x3664], length 1428
16:50:46.022390 IP 112.26.1.8.56443 > 112.26.1.1.targus-getdata1: Flags [.], seq 75684:77112, ack 1, win 4107, options [nop,nop,TS val 4294941852 ecr 200352,mptcp dss ack 1818309187 seq 1402214119 subseq 532645 len 1428 csum 0x6e1d], length 1428
16:50:46.091338 IP 112.26.1.1.targus-getdata1 > 112.26.1.8.56443: Flags [.], ack 69972, win 24385, options [nop,nop,TS val 201571 ecr 4294941660,nop,nop,sack 2 {74256:75684}{71400:72828},mptcp dss ack 1402169851], length 0
16:50:46.159338 IP 112.26.1.1.targus-getdata1 > 112.26.1.8.56443: Flags [.], ack 69972, win 24543, options [nop,nop,TS val 201652 ecr 4294941660,nop,nop,sack 2 {74256:77112}{71400:72828},mptcp dss ack 1402209835], length 0
16:50:46.193679 IP 112.26.1.8.56443 > 112.26.1.1.targus-getdata1: Flags [.], seq 78540:79968, ack 1, win 4107, options [nop,nop,TS val 4294941852 ecr 200352,mptcp dss ack 1818309187 seq 1402216975 subseq 535501 len 1428 csum 0x249], length 1428
16:50:46.247001 IP 112.26.1.8.56443 > 112.26.1.1.targus-getdata1: Flags [.], seq 79968:81396, ack 1, win 4107, options [nop,nop,TS val 4294941852 ecr 200352,mptcp dss ack 1818309187 seq 1402222687 subseq 536929 len 1428 csum 0x819b], length 1428
16:50:46.315423 IP 112.26.1.8.56443 > 112.26.1.1.targus-getdata1: Flags [.], seq 81396:82824, ack 1, win 4107, options [nop,nop,TS val 4294942228 ecr 200645,mptcp dss ack 1818309187 seq 1402245535 subseq 538357 len 1428 csum 0xac3f], length 1428
16:50:46.376619 IP 112.26.1.8.56443 > 112.26.1.1.targus-getdata1: Flags [.], seq 91392:92820, ack 1, win 4107, options [nop,nop,TS val 4294943040 ecr 200645,mptcp dss ack 1818309187 seq 1402255531 subseq 548353 len 1428 csum 0x3664], length 1428
16:50:46.381834 IP 112.26.1.1.targus-getdata1 > 112.26.1.8.56443: Flags [.], ack 69972, win 24543, options [nop,nop,TS val 201834 ecr 4294941660,nop,nop,sack 2 {78540:79968}{74256:77112},mptcp dss ack 1402209835], length 0
16:50:46.435300 IP 112.26.1.8.56443 > 112.26.1.1.targus-getdata1: Flags [.], seq 82824:84252, ack 1, win 4107, options [nop,nop,TS val 4294942228 ecr 200645,mptcp dss ack 1818309187 seq 1402246963 subseq 539785 len 1428 csum 0xf70b], length 1428
16:50:46.484247 IP 112.26.1.1.targus-getdata1 > 112.26.1.8.56443: Flags [.], ack 69972, win 24543, options [nop,nop,TS val 201888 ecr 4294941660,nop,nop,sack 2 {78540:81396}{74256:77112},mptcp dss ack 1402209835], length 0
16:50:46.547036 IP 112.26.1.8.56443 > 112.26.1.1.targus-getdata1: Flags [.], seq 85680:87108, ack 1, win 4107, options [nop,nop,TS val 4294942228 ecr 200645,mptcp dss ack 1818309187 seq 1402249819 subseq 542641 len 1428 csum 0x9d6f], length 1428
16:50:46.578877 IP 112.26.1.1.targus-getdata1 > 112.26.1.8.56443: Flags [.], ack 69972, win 24543, options [nop,nop,TS val 201956 ecr 4294941660,nop,nop,sack 2 {78540:82824}{74256:77112},mptcp dss ack 1402209835], length 0
16:50:46.602910 IP 112.26.1.8.56443 > 112.26.1.1.targus-getdata1: Flags [.], seq 69972:71400, ack 1, win 4107, options [nop,nop,TS val 4294943260 ecr 201571,mptcp dss ack 1818309187 seq 1402188415 subseq 526933 len 1428 csum 0xfcbb], length 1428
16:50:46.621665 IP 112.26.1.8.56443 > 112.26.1.1.targus-getdata1: Flags [.], seq 87108:88536, ack 1, win 4107, options [nop,nop,TS val 4294942228 ecr 200645,mptcp dss ack 1818309187 seq 1402251247 subseq 544069 len 1428 csum 0x7a02], length 1428
16:50:46.671040 IP 112.26.1.8.56443 > 112.26.1.1.targus-getdata1: Flags [.], seq 72828:74256, ack 1, win 4107, options [nop,nop,TS val 4294943260 ecr 201571,mptcp dss ack 1818309187 seq 1402199839 subseq 529789 len 1428 csum 0xfc77], length 1428
16:50:46.686483 IP 112.26.1.8.56443 > 112.26.1.1.targus-getdata1: Flags [P.], seq 88536:89964, ack 1, win 4107, options [nop,nop,TS val 4294942228 ecr 200645,mptcp dss ack 1818309187 seq 1402252675 subseq 545497 len 1428 csum 0x3f5b], length 1428
16:50:46.716436 IP 112.26.1.8.56443 > 112.26.1.1.targus-getdata1: Flags [.], seq 92820:94248, ack 1, win 4107, options [nop,nop,TS val 4294943373 ecr 201652,mptcp dss ack 1818309187 seq 1402279807 subseq 549781 len 1428 csum 0x5ab5], length 1428
16:50:46.732639 IP 112.26.1.1.targus-getdata1 > 112.26.1.8.56443: Flags [.], ack 69972, win 24543, options [nop,nop,TS val 202071 ecr 4294941660,nop,nop,sack 2 {78540:84252}{74256:77112},mptcp dss ack 1402209835], length 0
16:50:46.803565 IP 112.26.1.8.56443 > 112.26.1.1.targus-getdata1: Flags [.], seq 89964:91392, ack 1, win 4107, options [nop,nop,TS val 4294942228 ecr 200645,mptcp dss ack 1818309187 seq 1402254103 subseq 546925 len 1428 csum 0x4d73], length 1428
16:50:46.832543 IP 112.26.1.8.56443 > 112.26.1.1.targus-getdata1: Flags [.], seq 77112:78540, ack 1, win 4107, options [nop,nop,TS val 4294943495 ecr 201834,mptcp dss ack 1818309187 seq 1402215547 subseq 534073 len 1428 csum 0xfe2d], length 1428
16:50:46.849596 IP 112.26.1.8.56443 > 112.26.1.1.targus-getdata1: Flags [.], seq 91392:92820, ack 1, win 4107, options [nop,nop,TS val 4294942228 ecr 200645,mptcp dss ack 1818309187 seq 1402255531 subseq 548353 len 1428 csum 0x3664], length 1428
16:50:46.912601 IP 112.26.1.1.targus-getdata1 > 112.26.1.8.56443: Flags [.], ack 69972, win 24429, options [nop,nop,TS val 202187 ecr 4294941660,nop,nop,sack 2 {85680:87108}{78540:84252},mptcp dss ack 1402219831], length 0
16:50:46.921899 IP 112.26.1.8.56443 > 112.26.1.1.targus-getdata1: Flags [.], seq 94248:95676, ack 1, win 4107, options [nop,nop,TS val 4294943583 ecr 201888,mptcp dss ack 1818309187 seq 1402291231 subseq 551209 len 1428 csum 0xae49], length 1428
16:50:46.945838 IP 112.26.1.1.targus-getdata1 > 112.26.1.8.56443: Flags [.], ack 69972, win 24429, options [nop,nop,TS val 202262 ecr 4294941660,nop,nop,sack 2 {85680:88536}{78540:84252},mptcp dss ack 1402219831], length 0
16:50:46.979187 IP 112.26.1.8.56443 > 112.26.1.1.targus-getdata1: Flags [.], seq 95676:97104, ack 1, win 4107, options [nop,nop,TS val 4294943599 ecr 201956,mptcp dss ack 1818309187 seq 1402292659 subseq 552637 len 1428 csum 0x878c], length 1428
16:50:47.041513 IP 112.26.1.1.targus-getdata1 > 112.26.1.8.56443: Flags [.], ack 69972, win 24429, options [nop,nop,TS val 202327 ecr 4294941660,nop,nop,sack 2 {85680:89964}{78540:84252},mptcp dss ack 1402219831], length 0
16:50:47.093406 IP 112.26.1.8.56443 > 112.26.1.1.targus-getdata1: Flags [.], seq 91392:92820, ack 1, win 4107, options [nop,nop,TS val 4294943040 ecr 200645,mptcp dss ack 1818309187 seq 1402255531 subseq 548353 len 1428 csum 0x3664], length 1428
16:50:47.145199 IP 112.26.1.1.targus-getdata1 > 112.26.1.8.56443: Flags [.], ack 69972, win 24429, options [nop,nop,TS val 202444 ecr 4294941660,nop,nop,sack 2 {85680:91392}{78540:84252},mptcp dss ack 1402219831], length 0
