16:50:00.185194 IP 112.26.0.8.45702 > 112.26.0.1.targus-getdata1: Flags [S], seq 1292207928, win 65535, options [mss 1460,sackOK,TS val 4294896768 ecr 0,nop,wscale 6,mptcp capable csum {0x107f01c1446bf991}], length 0
16:50:00.205118 IP 112.26.0.8.45702 > 112.26.0.1.targus-getdata1: Flags [S], seq 1292207928, win 65535, options [mss 1460,sackOK,TS val 4294896768 ecr 0,nop,wscale 6,mptcp capable csum {0x107f01c1446bf991}], length 0
16:50:00.220134 IP 112.26.0.8.45702 > 112.26.0.1.targus-getdata1: Flags [S], seq 1292207928, win 65535, options [mss 1460,sackOK,TS val 4294896768 ecr 0,nop,wscale 6,mptcp capable csum {0x107f01c1446bf991}], length 0
16:50:00.617027 IP 112.26.0.1.targus-getdata1 > 112.26.0.8.45702: Flags [S.], seq 2466069190, ack 1292207929, win 65535, options [mss 1460,sackOK,TS val 155939 ecr 4294896768,nop,wscale 6,mptcp capable csum {0x62458052d89ef63b}], length 0
16:50:00.620357 IP 112.26.0.1.targus-getdata1 > 112.26.0.8.45702: Flags [S.], seq 2466069190, ack 1292207929, win 65535, options [mss 1460,sackOK,TS val 155939 ecr 4294896768,nop,wscale 6,mptcp capable csum {0x62458052d89ef63b}], length 0
16:50:00.696082 IP 112.26.0.8.45702 > 112.26.0.1.targus-getdata1: Flags [R], seq 1292207929, win 0, length 0
16:50:00.696300 IP 112.26.0.8.45702 > 112.26.0.1.targus-getdata1: Flags [R], seq 1292207929, win 0, length 0
16:50:37.474519 IP 112.26.0.8.45706 > 112.26.0.1.targus-getdata1: Flags [.], seq 2148327431:2148328859, ack 1846513222, win 4107, options [nop,nop,TS val 4294934108 ecr 192630,mptcp dss ack 1818309187 seq 1401882823 subseq 382742 len 1428 csum 0x17fa], length 1428
16:50:37.511654 IP 112.26.0.8.45706 > 112.26.0.1.targus-getdata1: Flags [.], seq 4294945876:4294947304, ack 1, win 4107, options [nop,nop,TS val 4294933775 ecr 192150,mptcp dss ack 1818309187 seq 1401821419 subseq 361322 len 1428 csum 0xacf4], length 1428
16:50:37.585164 IP 112.26.0.8.45706 > 112.26.0.1.targus-getdata1: Flags [.], seq 1428:2856, ack 1, win 4107, options [nop,nop,TS val 4294934120 ecr 192698,mptcp dss ack 1818309187 seq 1401884251 subseq 384170 len 1428 csum 0x37a4], length 1428
16:50:37.598457 IP 112.26.0.8.45706 > 112.26.0.1.targus-getdata1: Flags [.], seq 4294947304:4294948732, ack 1, win 4107, options [nop,nop,TS val 4294933775 ecr 192150,mptcp dss ack 1818309187 seq 1401822847 subseq 362750 len 1428 csum 0x89d1], length 1428
16:50:37.664070 IP 112.26.0.8.45706 > 112.26.0.1.targus-getdata1: Flags [.], seq 4294958728:4294960156, ack 1, win 4107, options [nop,nop,TS val 4294934326 ecr 192848,mptcp dss ack 1818309187 seq 1401848551 subseq 374174 len 1428 csum 0x920c], length 1428
16:50:37.697251 IP 112.26.0.8.45706 > 112.26.0.1.targus-getdata1: Flags [.], seq 2856:4284, ack 1, win 4107, options [nop,nop,TS val 4294934326 ecr 192848,mptcp dss ack 1818309187 seq 1401891391 subseq 385598 len 1428 csum 0x63a], length 1428
16:50:37.764710 IP 112.26.0.8.45706 > 112.26.0.1.targus-getdata1: Flags [.], seq 4284:5712, ack 1, win 4107, options [nop,nop,TS val 4294934391 ecr 192939,mptcp dss ack 1818309187 seq 1401894247 subseq 387026 len 1428 csum 0x3acf], length 1428
16:50:37.770301 IP 112.26.0.8.45706 > 112.26.0.1.targus-getdata1: Flags [.], seq 4294963012:4294964440, ack 1, win 4107, options [nop,nop,TS val 4294933979 ecr 192335,mptcp dss ack 1818309187 seq 1401872827 subseq 378458 len 1428 csum 0x2a47], length 1428
16:50:37.846868 IP 112.26.0.8.45706 > 112.26.0.1.targus-getdata1: Flags [.], seq 4294964440:4294965868, ack 1, win 4107, options [nop,nop,TS val 4294934047 ecr 192543,mptcp dss ack 1818309187 seq 1401877111 subseq 379886 len 1428 csum 0xdab3], length 1428
16:50:38.001481 IP 112.26.0.8.45706 > 112.26.0.1.targus-getdata1: Flags [.], seq 4294965868:0, ack 1, win 4107, options [nop,nop,TS val 4294934047 ecr 192543,mptcp dss ack 1818309187 seq 1401878539 subseq 381314 len 1428 csum 0x54a1], length 1428
16:50:38.028698 IP 112.26.0.8.45706 > 112.26.0.1.targus-getdata1: Flags [.], seq 4294961584:4294963012, ack 1, win 4107, options [nop,nop,TS val 4294934686 ecr 193152,mptcp dss ack 1818309187 seq 1401857119 subseq 377030 len 1428 csum 0x70ad], length 1428
16:50:38.094888 IP 112.26.0.8.45706 > 112.26.0.1.targus-getdata1: Flags [.], seq 5712:7140, ack 1, win 4107, options [nop,nop,TS val 4294934686 ecr 193152,mptcp dss ack 1818309187 seq 1401901387 subseq 388454 len 1428 csum 0x9bd5], length 1428
16:50:38.103646 IP 112.26.0.8.45706 > 112.26.0.1.targus-getdata1: Flags [.], seq 0:1428, ack 1, win 4107, options [nop,nop,TS val 4294934108 ecr 192630,mptcp dss ack 1818309187 seq 1401882823 subseq 382742 len 1428 csum 0x17fa], length 1428
16:50:38.138148 IP 112.26.0.8.45706 > 112.26.0.1.targus-getdata1: Flags [.], seq 7140:8568, ack 1, win 4107, options [nop,nop,TS val 4294934787 ecr 193237,mptcp dss ack 1818309187 seq 1401904243 subseq 389882 len 1428 csum 0x2f81], length 1428
16:50:38.165155 IP 112.26.0.8.45706 > 112.26.0.1.targus-getdata1: Flags [.], seq 1428:2856, ack 1, win 4107, options [nop,nop,TS val 4294934120 ecr 192698,mptcp dss ack 1818309187 seq 1401884251 subseq 384170 len 1428 csum 0x37a4], length 1428
16:50:38.238010 IP 112.26.0.8.45706 > 112.26.0.1.targus-getdata1: Flags [.], seq 4294958728:4294960156, ack 1, win 4107, options [nop,nop,TS val 4294934326 ecr 192848,mptcp dss ack 1818309187 seq 1401848551 subseq 374174 len 1428 csum 0x920c], length 1428
16:50:38.303615 IP 112.26.0.8.45706 > 112.26.0.1.targus-getdata1: Flags [.], seq 2856:4284, ack 1, win 4107, options [nop,nop,TS val 4294934326 ecr 192848,mptcp dss ack 1818309187 seq 1401891391 subseq 385598 len 1428 csum 0x63a], length 1428
16:50:38.344485 IP 112.26.0.8.45706 > 112.26.0.1.targus-getdata1: Flags [.], seq 8568:9996, ack 1, win 4107, options [nop,nop,TS val 4294935006 ecr 193397,mptcp dss ack 1818309187 seq 1401909955 subseq 391310 len 1428 csum 0x293b], length 1428
16:50:38.425694 IP 112.26.0.8.45706 > 112.26.0.1.targus-getdata1: Flags [.], seq 9996:11424, ack 1, win 4107, options [nop,nop,TS val 4294935087 ecr 193487,mptcp dss ack 1818309187 seq 1401912811 subseq 392738 len 1428 csum 0xa530], length 1428
16:50:38.481365 IP 112.26.0.8.45706 > 112.26.0.1.targus-getdata1: Flags [.], seq 11424:12852, ack 1, win 4107, options [nop,nop,TS val 4294935144 ecr 193642,mptcp dss ack 1818309187 seq 1401915667 subseq 394166 len 1428 csum 0x243f], length 1428
16:50:38.506730 IP 112.26.0.8.45706 > 112.26.0.1.targus-getdata1: Flags [.], seq 4294961584:4294963012, ack 1, win 4107, options [nop,nop,TS val 4294934686 ecr 193152,mptcp dss ack 1818309187 seq 1401857119 subseq 377030 len 1428 csum 0x70ad], length 1428
16:50:38.594066 IP 112.26.0.8.45706 > 112.26.0.1.targus-getdata1: Flags [.], seq 12852:14280, ack 1, win 4107, options [nop,nop,TS val 4294935257 ecr 193730,mptcp dss ack 1818309187 seq 1401919951 subseq 395594 len 1428 csum 0x4eba], length 1428
16:50:38.644114 IP 112.26.0.8.45706 > 112.26.0.1.targus-getdata1: Flags [.], seq 5712:7140, ack 1, win 4107, options [nop,nop,TS val 4294934686 ecr 193152,mptcp dss ack 1818309187 seq 1401901387 subseq 388454 len 1428 csum 0x9bd5], length 1428
16:50:38.740071 IP 112.26.0.8.45706 > 112.26.0.1.targus-getdata1: Flags [.], seq 14280:15708, ack 1, win 4107, options [nop,nop,TS val 4294935403 ecr 193805,mptcp dss ack 1818309187 seq 1401927091 subseq 397022 len 1428 csum 0xbf56], length 1428
16:50:38.786414 IP 112.26.0.8.45706 > 112.26.0.1.targus-getdata1: Flags [.], seq 15708:17136, ack 1, win 4107, options [nop,nop,TS val 4294935440 ecr 193878,mptcp dss ack 1818309187 seq 1401929947 subseq 398450 len 1428 csum 0x4ac2], length 1428
16:50:38.867790 IP 112.26.0.8.45706 > 112.26.0.1.targus-getdata1: Flags [.], seq 8568:9996, ack 1, win 4107, options [nop,nop,TS val 4294935006 ecr 193397,mptcp dss ack 1818309187 seq 1401909955 subseq 391310 len 1428 csum 0x293b], length 1428
16:50:38.901969 IP 112.26.0.8.45706 > 112.26.0.1.targus-getdata1: Flags [.], seq 17136:18564, ack 1, win 4107, options [nop,nop,TS val 4294935556 ecr 193944,mptcp dss ack 1818309187 seq 1401934231 subseq 399878 len 1428 csum 0x65d7], length 1428
16:50:38.964014 IP 112.26.0.8.45706 > 112.26.0.1.targus-getdata1: Flags [.], seq 9996:11424, ack 1, win 4107, options [nop,nop,TS val 4294935087 ecr 193487,mptcp dss ack 1818309187 seq 1401912811 subseq 392738 len 1428 csum 0xa530], length 1428
16:50:39.049029 IP 112.26.0.8.45706 > 112.26.0.1.targus-getdata1: Flags [.], seq 11424:12852, ack 1, win 4107, options [nop,nop,TS val 4294935144 ecr 193642,mptcp dss ack 1818309187 seq 1401915667 subseq 394166 len 1428 csum 0x243f], length 1428
16:50:39.116884 IP 112.26.0.8.45706 > 112.26.0.1.targus-getdata1: Flags [.], seq 12852:14280, ack 1, win 4107, options [nop,nop,TS val 4294935257 ecr 193730,mptcp dss ack 1818309187 seq 1401919951 subseq 395594 len 1428 csum 0x4eba], length 1428
16:50:39.174664 IP 112.26.0.8.45706 > 112.26.0.1.targus-getdata1: Flags [.], seq 4284:5712, ack 1, win 4107, options [nop,nop,TS val 4294935837 ecr 194284,mptcp dss ack 1818309187 seq 1401894247 subseq 387026 len 1428 csum 0x3acf], length 1428
16:50:39.220091 IP 112.26.0.8.45706 > 112.26.0.1.targus-getdata1: Flags [.], seq 14280:15708, ack 1, win 4107, options [nop,nop,TS val 4294935403 ecr 193805,mptcp dss ack 1818309187 seq 1401927091 subseq 397022 len 1428 csum 0xbf56], length 1428
16:50:39.294830 IP 112.26.0.8.45706 > 112.26.0.1.targus-getdata1: Flags [.], seq 15708:17136, ack 1, win 4107, options [nop,nop,TS val 4294935440 ecr 193878,mptcp dss ack 1818309187 seq 1401929947 subseq 398450 len 1428 csum 0x4ac2], length 1428
16:50:39.393868 IP 112.26.0.8.45706 > 112.26.0.1.targus-getdata1: Flags [.], seq 17136:18564, ack 1, win 4107, options [nop,nop,TS val 4294935556 ecr 193944,mptcp dss ack 1818309187 seq 1401934231 subseq 399878 len 1428 csum 0x65d7], length 1428
16:50:39.438567 IP 112.26.0.8.45706 > 112.26.0.1.targus-getdata1: Flags [.], seq 7140:8568, ack 1, win 4107, options [nop,nop,TS val 4294936102 ecr 194604,mptcp dss ack 1818309187 seq 1401904243 subseq 389882 len 1428 csum 0x2f81], length 1428
16:50:39.510138 IP 112.26.0.8.45706 > 112.26.0.1.targus-getdata1: Flags [.], seq 18564:19992, ack 1, win 4107, options [nop,nop,TS val 4294936173 ecr 194689,mptcp dss ack 1818309187 seq 1401955651 subseq 401306 len 1428 csum 0x1f8], length 1428
16:50:39.585384 IP 112.26.0.8.45706 > 112.26.0.1.targus-getdata1: Flags [.], seq 4284:5712, ack 1, win 4107, options [nop,nop,TS val 4294935837 ecr 194284,mptcp dss ack 1818309187 seq 1401894247 subseq 387026 len 1428 csum 0x3acf], length 1428
16:50:39.626276 IP 112.26.0.8.45706 > 112.26.0.1.targus-getdata1: Flags [.], seq 19992:21420, ack 1, win 4107, options [nop,nop,TS val 4294936290 ecr 194757,mptcp dss ack 1818309187 seq 1401958507 subseq 402734 len 1428 csum 0xe4d4], length 1428
16:50:39.676363 IP 112.26.0.8.45706 > 112.26.0.1.targus-getdata1: Flags [.], seq 21420:22848, ack 1, win 4107, options [nop,nop,TS val 4294936335 ecr 194860,mptcp dss ack 1818309187 seq 1401961363 subseq 404162 len 1428 csum 0x9bdd], length 1428
16:50:39.724964 IP 112.26.0.8.45706 > 112.26.0.1.targus-getdata1: Flags [.], seq 22848:24276, ack 1, win 4107, options [nop,nop,TS val 4294936380 ecr 194935,mptcp dss ack 1818309187 seq 1401964219 subseq 405590 len 1428 csum 0xedd8], length 1428
16:50:39.781362 IP 112.26.0.8.45706 > 112.26.0.1.targus-getdata1: Flags [.], seq 7140:8568, ack 1, win 4107, options [nop,nop,TS val 4294936102 ecr 194604,mptcp dss ack 1818309187 seq 1401904243 subseq 389882 len 1428 csum 0x2f81], length 1428
16:50:39.789154 IP 112.26.0.8.45706 > 112.26.0.1.targus-getdata1: Flags [.], seq 24276:25704, ack 1, win 4107, options [nop,nop,TS val 4294936451 ecr 195034,mptcp dss ack 1818309187 seq 1401967075 subseq 407018 len 1428 csum 0x1290], length 1428
16:50:39.864432 IP 112.26.0.8.45706 > 112.26.0.1.targus-getdata1: Flags [.], seq 18564:19992, ack 1, win 4107, options [nop,nop,TS val 4294936173 ecr 194689,mptcp dss ack 1818309187 seq 1401955651 subseq 401306 len 1428 csum 0x1f8], length 1428
16:50:39.933250 IP 112.26.0.8.45706 > 112.26.0.1.targus-getdata1: Flags [.], seq 25704:27132, ack 1, win 4107, options [nop,nop,TS val 4294936595 ecr 195225,mptcp dss ack 1818309187 seq 1401972787 subseq 408446 len 1428 csum 0x4bed], length 1428
16:50:39.963617 IP 112.26.0.8.45706 > 112.26.0.1.targus-getdata1: Flags [.], seq 19992:21420, ack 1, win 4107, options [nop,nop,TS val 4294936290 ecr 194757,mptcp dss ack 1818309187 seq 1401958507 subseq 402734 len 1428 csum 0xe4d4], length 1428
16:50:40.076982 IP 112.26.0.8.45706 > 112.26.0.1.targus-getdata1: Flags [.], seq 21420:22848, ack 1, win 4107, options [nop,nop,TS val 4294936335 ecr 194860,mptcp dss ack 1818309187 seq 1401961363 subseq 404162 len 1428 csum 0x9bdd], length 1428
16:50:40.134521 IP 112.26.0.8.45706 > 112.26.0.1.targus-getdata1: Flags [.], seq 27132:28560, ack 1, win 4107, options [nop,nop,TS val 4294936797 ecr 195422,mptcp dss ack 1818309187 seq 1401981355 subseq 409874 len 1428 csum 0xe5a4], length 1428
16:50:40.149871 IP 112.26.0.8.45706 > 112.26.0.1.targus-getdata1: Flags [.], seq 22848:24276, ack 1, win 4107, options [nop,nop,TS val 4294936380 ecr 194935,mptcp dss ack 1818309187 seq 1401964219 subseq 405590 len 1428 csum 0xedd8], length 1428
16:50:40.222907 IP 112.26.0.8.45706 > 112.26.0.1.targus-getdata1: Flags [.], seq 24276:25704, ack 1, win 4107, options [nop,nop,TS val 4294936451 ecr 195034,mptcp dss ack 1818309187 seq 1401967075 subseq 407018 len 1428 csum 0x1290], length 1428
16:50:40.258980 IP 112.26.0.8.45706 > 112.26.0.1.targus-getdata1: Flags [.], seq 28560:29988, ack 1, win 4107, options [nop,nop,TS val 4294936921 ecr 195505,mptcp dss ack 1818309187 seq 1401985639 subseq 411302 len 1428 csum 0x400d], length 1428
16:50:40.316673 IP 112.26.0.8.45706 > 112.26.0.1.targus-getdata1: Flags [.], seq 25704:27132, ack 1, win 4107, options [nop,nop,TS val 4294936595 ecr 195225,mptcp dss ack 1818309187 seq 1401972787 subseq 408446 len 1428 csum 0x4bed], length 1428
16:50:40.397846 IP 112.26.0.8.45706 > 112.26.0.1.targus-getdata1: Flags [.], seq 29988:31416, ack 1, win 4107, options [nop,nop,TS val 4294937061 ecr 195604,mptcp dss ack 1818309187 seq 1401991351 subseq 412730 len 1428 csum 0x6e0c], length 1428
16:50:40.427418 IP 112.26.0.8.45706 > 112.26.0.1.targus-getdata1: Flags [.], seq 31416:32844, ack 1, win 4107, options [nop,nop,TS val 4294937061 ecr 195604,mptcp dss ack 1818309187 seq 1401992779 subseq 414158 len 1428 csum 0xa648], length 1428
16:50:40.471120 IP 112.26.0.8.45706 > 112.26.0.1.targus-getdata1: Flags [.], seq 32844:34272, ack 1, win 4107, options [nop,nop,TS val 4294937133 ecr 195717,mptcp dss ack 1818309187 seq 1401997063 subseq 415586 len 1428 csum 0xe07e], length 1428
16:50:40.516732 IP 112.26.0.8.45706 > 112.26.0.1.targus-getdata1: Flags [.], seq 27132:28560, ack 1, win 4107, options [nop,nop,TS val 4294936797 ecr 195422,mptcp dss ack 1818309187 seq 1401981355 subseq 409874 len 1428 csum 0xe5a4], length 1428
16:50:40.601448 IP 112.26.0.8.45706 > 112.26.0.1.targus-getdata1: Flags [.], seq 34272:35700, ack 1, win 4107, options [nop,nop,TS val 4294937263 ecr 195783,mptcp dss ack 1818309187 seq 1402002775 subseq 417014 len 1428 csum 0xf612], length 1428
16:50:40.653436 IP 112.26.0.8.45706 > 112.26.0.1.targus-getdata1: Flags [.], seq 35700:37128, ack 1, win 4107, options [nop,nop,TS val 4294937317 ecr 195863,mptcp dss ack 1818309187 seq 1402005631 subseq 418442 len 1428 csum 0x707f], length 1428
16:50:40.718397 IP 112.26.0.8.45706 > 112.26.0.1.targus-getdata1: Flags [.], seq 28560:29988, ack 1, win 4107, options [nop,nop,TS val 4294936921 ecr 195505,mptcp dss ack 1818309187 seq 1401985639 subseq 411302 len 1428 csum 0x400d], length 1428
16:50:40.803556 IP 112.26.0.8.45706 > 112.26.0.1.targus-getdata1: Flags [.], seq 37128:38556, ack 1, win 4107, options [nop,nop,TS val 4294937466 ecr 195957,mptcp dss ack 1818309187 seq 1402014199 subseq 419870 len 1428 csum 0x9f92], length 1428
16:50:40.842265 IP 112.26.0.8.45706 > 112.26.0.1.targus-getdata1: Flags [.], seq 29988:31416, ack 1, win 4107, options [nop,nop,TS val 4294937061 ecr 195604,mptcp dss ack 1818309187 seq 1401991351 subseq 412730 len 1428 csum 0x6e0c], length 1428
16:50:40.912750 IP 112.26.0.8.45706 > 112.26.0.1.targus-getdata1: Flags [.], seq 31416:32844, ack 1, win 4107, options [nop,nop,TS val 4294937061 ecr 195604,mptcp dss ack 1818309187 seq 1401992779 subseq 414158 len 1428 csum 0xa648], length 1428
16:50:41.001713 IP 112.26.0.8.45706 > 112.26.0.1.targus-getdata1: Flags [.], seq 38556:39984, ack 1, win 4107, options [nop,nop,TS val 4294937664 ecr 196157,mptcp dss ack 1818309187 seq 1402021339 subseq 421298 len 1428 csum 0x9ea8], length 1428
16:50:41.008340 IP 112.26.0.8.45706 > 112.26.0.1.targus-getdata1: Flags [.], seq 32844:34272, ack 1, win 4107, options [nop,nop,TS val 4294937133 ecr 195717,mptcp dss ack 1818309187 seq 1401997063 subseq 415586 len 1428 csum 0xe07e], length 1428
16:50:41.098821 IP 112.26.0.8.45706 > 112.26.0.1.targus-getdata1: Flags [.], seq 34272:35700, ack 1, win 4107, options [nop,nop,TS val 4294937263 ecr 195783,mptcp dss ack 1818309187 seq 1402002775 subseq 417014 len 1428 csum 0xf612], length 1428
16:50:41.180235 IP 112.26.0.8.45706 > 112.26.0.1.targus-getdata1: Flags [.], seq 35700:37128, ack 1, win 4107, options [nop,nop,TS val 4294937317 ecr 195863,mptcp dss ack 1818309187 seq 1402005631 subseq 418442 len 1428 csum 0x707f], length 1428
16:50:41.209781 IP 112.26.0.8.45706 > 112.26.0.1.targus-getdata1: Flags [.], seq 39984:41412, ack 1, win 4107, options [nop,nop,TS val 4294937866 ecr 196359,mptcp dss ack 1818309187 seq 1402028479 subseq 422726 len 1428 csum 0xbdab], length 1428
16:50:41.258836 IP 112.26.0.8.45706 > 112.26.0.1.targus-getdata1: Flags [.], seq 37128:38556, ack 1, win 4107, options [nop,nop,TS val 4294937466 ecr 195957,mptcp dss ack 1818309187 seq 1402014199 subseq 419870 len 1428 csum 0x9f92], length 1428
16:50:41.346333 IP 112.26.0.8.45706 > 112.26.0.1.targus-getdata1: Flags [.], seq 41412:42840, ack 1, win 4107, options [nop,nop,TS val 4294938001 ecr 196483,mptcp dss ack 1818309187 seq 1402032763 subseq 424154 len 1428 csum 0x79b2], length 1428
16:50:41.389981 IP 112.26.0.8.45706 > 112.26.0.1.targus-getdata1: Flags [.], seq 42840:44268, ack 1, win 4107, options [nop,nop,TS val 4294938051 ecr 196553,mptcp dss ack 1818309187 seq 1402034191 subseq 425582 len 1428 csum 0x2716], length 1428
16:50:41.434190 IP 112.26.0.8.45706 > 112.26.0.1.targus-getdata1: Flags [.], seq 44268:45696, ack 1, win 4107, options [nop,nop,TS val 4294938051 ecr 196553,mptcp dss ack 1818309187 seq 1402035619 subseq 427010 len 1428 csum 0x9be1], length 1428
16:50:41.461557 IP 112.26.0.8.45706 > 112.26.0.1.targus-getdata1: Flags [.], seq 38556:39984, ack 1, win 4107, options [nop,nop,TS val 4294937664 ecr 196157,mptcp dss ack 1818309187 seq 1402021339 subseq 421298 len 1428 csum 0x9ea8], length 1428
16:50:41.501191 IP 112.26.0.8.45706 > 112.26.0.1.targus-getdata1: Flags [.], seq 45696:47124, ack 1, win 4107, options [nop,nop,TS val 4294938162 ecr 196649,mptcp dss ack 1818309187 seq 1402042759 subseq 428438 len 1428 csum 0xa55a], length 1428
16:50:41.568773 IP 112.26.0.8.45706 > 112.26.0.1.targus-getdata1: Flags [.], seq 47124:48552, ack 1, win 4107, options [nop,nop,TS val 4294938228 ecr 196739,mptcp dss ack 1818309187 seq 1402049899 subseq 429866 len 1428 csum 0xfd1c], length 1428
16:50:41.606849 IP 112.26.0.8.45706 > 112.26.0.1.targus-getdata1: Flags [.], seq 48552:49980, ack 1, win 4107, options [nop,nop,TS val 4294938256 ecr 196820,mptcp dss ack 1818309187 seq 1402051327 subseq 431294 len 1428 csum 0xfa01], length 1428
16:50:41.654345 IP 112.26.0.8.45706 > 112.26.0.1.targus-getdata1: Flags [.], seq 39984:41412, ack 1, win 4107, options [nop,nop,TS val 4294937866 ecr 196359,mptcp dss ack 1818309187 seq 1402028479 subseq 422726 len 1428 csum 0xbdab], length 1428
16:50:41.691381 IP 112.26.0.8.45706 > 112.26.0.1.targus-getdata1: Flags [.], seq 49980:51408, ack 1, win 4107, options [nop,nop,TS val 4294938355 ecr 196899,mptcp dss ack 1818309187 seq 1402055611 subseq 432722 len 1428 csum 0xd4ee], length 1428
16:50:41.762002 IP 112.26.0.8.45706 > 112.26.0.1.targus-getdata1: Flags [.], seq 41412:42840, ack 1, win 4107, options [nop,nop,TS val 4294938001 ecr 196483,mptcp dss ack 1818309187 seq 1402032763 subseq 424154 len 1428 csum 0x79b2], length 1428
16:50:41.815591 IP 112.26.0.8.45706 > 112.26.0.1.targus-getdata1: Flags [.], seq 42840:44268, ack 1, win 4107, options [nop,nop,TS val 4294938051 ecr 196553,mptcp dss ack 1818309187 seq 1402034191 subseq 425582 len 1428 csum 0x2716], length 1428
16:50:41.887951 IP 112.26.0.8.45706 > 112.26.0.1.targus-getdata1: Flags [.], seq 44268:45696, ack 1, win 4107, options [nop,nop,TS val 4294938051 ecr 196553,mptcp dss ack 1818309187 seq 1402035619 subseq 427010 len 1428 csum 0x9be1], length 1428
16:50:41.954547 IP 112.26.0.8.45706 > 112.26.0.1.targus-getdata1: Flags [.], seq 45696:47124, ack 1, win 4107, options [nop,nop,TS val 4294938162 ecr 196649,mptcp dss ack 1818309187 seq 1402042759 subseq 428438 len 1428 csum 0xa55a], length 1428
16:50:42.028874 IP 112.26.0.8.45706 > 112.26.0.1.targus-getdata1: Flags [.], seq 51408:52836, ack 1, win 4107, options [nop,nop,TS val 4294938691 ecr 197138,mptcp dss ack 1818309187 seq 1402072747 subseq 434150 len 1428 csum 0xa5db], length 1428
16:50:42.105246 IP 112.26.0.8.45706 > 112.26.0.1.targus-getdata1: Flags [.], seq 47124:48552, ack 1, win 4107, options [nop,nop,TS val 4294938228 ecr 196739,mptcp dss ack 1818309187 seq 1402049899 subseq 429866 len 1428 csum 0xfd1c], length 1428
16:50:42.182819 IP 112.26.0.8.45706 > 112.26.0.1.targus-getdata1: Flags [.], seq 48552:49980, ack 1, win 4107, options [nop,nop,TS val 4294938256 ecr 196820,mptcp dss ack 1818309187 seq 1402051327 subseq 431294 len 1428 csum 0xfa01], length 1428
16:50:42.265728 IP 112.26.0.8.45706 > 112.26.0.1.targus-getdata1: Flags [.], seq 52836:54264, ack 1, win 4107, options [nop,nop,TS val 4294938929 ecr 197376,mptcp dss ack 1818309187 seq 1402082743 subseq 435578 len 1428 csum 0xb598], length 1428
16:50:42.271211 IP 112.26.0.8.45706 > 112.26.0.1.targus-getdata1: Flags [.], seq 49980:51408, ack 1, win 4107, options [nop,nop,TS val 4294938355 ecr 196899,mptcp dss ack 1818309187 seq 1402055611 subseq 432722 len 1428 csum 0xd4ee], length 1428
16:50:42.333669 IP 112.26.0.8.45706 > 112.26.0.1.targus-getdata1: Flags [.], seq 54264:55692, ack 1, win 4107, options [nop,nop,TS val 4294938998 ecr 197456,mptcp dss ack 1818309187 seq 1402087027 subseq 437006 len 1428 csum 0x54cb], length 1428
16:50:42.379242 IP 112.26.0.8.45706 > 112.26.0.1.targus-getdata1: Flags [.], seq 55692:57120, ack 1, win 4107, options [nop,nop,TS val 4294938998 ecr 197456,mptcp dss ack 1818309187 seq 1402088455 subseq 438434 len 1428 csum 0xc1ff], length 1428
16:50:42.438486 IP 112.26.0.8.45706 > 112.26.0.1.targus-getdata1: Flags [.], seq 57120:58548, ack 1, win 4107, options [nop,nop,TS val 4294939037 ecr 197595,mptcp dss ack 1818309187 seq 1402089883 subseq 439862 len 1428 csum 0xfa2b], length 1428
16:50:42.484198 IP 112.26.0.8.45706 > 112.26.0.1.targus-getdata1: Flags [.], seq 58548:59976, ack 1, win 4107, options [nop,nop,TS val 4294939037 ecr 197595,mptcp dss ack 1818309187 seq 1402091311 subseq 441290 len 1428 csum 0x6f4b], length 1428
16:50:42.528781 IP 112.26.0.8.45706 > 112.26.0.1.targus-getdata1: Flags [.], seq 59976:61404, ack 1, win 4107, options [nop,nop,TS val 4294939169 ecr 197823,mptcp dss ack 1818309187 seq 1402098451 subseq 442718 len 1428 csum 0x93fd], length 1428
16:50:42.547865 IP 112.26.0.8.45706 > 112.26.0.1.targus-getdata1: Flags [.], seq 52836:54264, ack 1, win 4107, options [nop,nop,TS val 4294938929 ecr 197376,mptcp dss ack 1818309187 seq 1402082743 subseq 435578 len 1428 csum 0xb598], length 1428
16:50:42.576816 IP 112.26.0.8.45706 > 112.26.0.1.targus-getdata1: Flags [.], seq 61404:62832, ack 1, win 4107, options [nop,nop,TS val 4294939169 ecr 197823,mptcp dss ack 1818309187 seq 1402099879 subseq 444146 len 1428 csum 0x5d3b], length 1428
16:50:42.630561 IP 112.26.0.8.45706 > 112.26.0.1.targus-getdata1: Flags [.], seq 54264:55692, ack 1, win 4107, options [nop,nop,TS val 4294938998 ecr 197456,mptcp dss ack 1818309187 seq 1402087027 subseq 437006 len 1428 csum 0x54cb], length 1428
16:50:42.680112 IP 112.26.0.8.45706 > 112.26.0.1.targus-getdata1: Flags [.], seq 55692:57120, ack 1, win 4107, options [nop,nop,TS val 4294938998 ecr 197456,mptcp dss ack 1818309187 seq 1402088455 subseq 438434 len 1428 csum 0xc1ff], length 1428
16:50:42.724948 IP 112.26.0.8.45706 > 112.26.0.1.targus-getdata1: Flags [.], seq 62832:64260, ack 1, win 4107, options [nop,nop,TS val 4294939388 ecr 198040,mptcp dss ack 1818309187 seq 1402107019 subseq 445574 len 1428 csum 0xd81b], length 1428
16:50:42.782713 IP 112.26.0.8.45706 > 112.26.0.1.targus-getdata1: Flags [.], seq 57120:58548, ack 1, win 4107, options [nop,nop,TS val 4294939037 ecr 197595,mptcp dss ack 1818309187 seq 1402089883 subseq 439862 len 1428 csum 0xfa2b], length 1428
16:50:42.870675 IP 112.26.0.8.45706 > 112.26.0.1.targus-getdata1: Flags [.], seq 58548:59976, ack 1, win 4107, options [nop,nop,TS val 4294939037 ecr 197595,mptcp dss ack 1818309187 seq 1402091311 subseq 441290 len 1428 csum 0x6f4b], length 1428
16:50:42.962288 IP 112.26.0.8.45706 > 112.26.0.1.targus-getdata1: Flags [.], seq 59976:61404, ack 1, win 4107, options [nop,nop,TS val 4294939169 ecr 197823,mptcp dss ack 1818309187 seq 1402098451 subseq 442718 len 1428 csum 0x93fd], length 1428
16:50:42.980281 IP 112.26.0.8.45706 > 112.26.0.1.targus-getdata1: Flags [.], seq 64260:65688, ack 1, win 4107, options [nop,nop,TS val 4294939643 ecr 198188,mptcp dss ack 1818309187 seq 1402119871 subseq 447002 len 1428 csum 0xf2c5], length 1428
16:50:43.032064 IP 112.26.0.8.45706 > 112.26.0.1.targus-getdata1: Flags [.], seq 65688:67116, ack 1, win 4107, options [nop,nop,TS val 4294939643 ecr 198188,mptcp dss ack 1818309187 seq 1402121299 subseq 448430 len 1428 csum 0x8fc9], length 1428
16:50:43.042024 IP 112.26.0.8.45706 > 112.26.0.1.targus-getdata1: Flags [.], seq 61404:62832, ack 1, win 4107, options [nop,nop,TS val 4294939169 ecr 197823,mptcp dss ack 1818309187 seq 1402099879 subseq 444146 len 1428 csum 0x5d3b], length 1428
16:50:43.091629 IP 112.26.0.8.45706 > 112.26.0.1.targus-getdata1: Flags [.], seq 67116:68544, ack 1, win 4107, options [nop,nop,TS val 4294939643 ecr 198188,mptcp dss ack 1818309187 seq 1402122727 subseq 449858 len 1428 csum 0xa21d], length 1428
16:50:43.125453 IP 112.26.0.8.45706 > 112.26.0.1.targus-getdata1: Flags [.], seq 62832:64260, ack 1, win 4107, options [nop,nop,TS val 4294939388 ecr 198040,mptcp dss ack 1818309187 seq 1402107019 subseq 445574 len 1428 csum 0xd81b], length 1428
16:50:43.175979 IP 112.26.0.8.45706 > 112.26.0.1.targus-getdata1: Flags [.], seq 68544:69972, ack 1, win 4107, options [nop,nop,TS val 4294939838 ecr 198375,mptcp dss ack 1818309187 seq 1402132723 subseq 451286 len 1428 csum 0xd5c3], length 1428
16:50:43.215048 IP 112.26.0.8.45706 > 112.26.0.1.targus-getdata1: Flags [.], seq 69972:71400, ack 1, win 4107, options [nop,nop,TS val 4294939838 ecr 198375,mptcp dss ack 1818309187 seq 1402134151 subseq 452714 len 1428 csum 0x2d43], length 1428
16:50:43.313456 IP 112.26.0.8.45706 > 112.26.0.1.targus-getdata1: Flags [.], seq 71400:72828, ack 1, win 4107, options [nop,nop,TS val 4294939975 ecr 198511,mptcp dss ack 1818309187 seq 1402138435 subseq 454142 len 1428 csum 0x3256], length 1428
16:50:43.328892 IP 112.26.0.8.45706 > 112.26.0.1.targus-getdata1: Flags [.], seq 72828:74256, ack 1, win 4107, options [nop,nop,TS val 4294939975 ecr 198511,mptcp dss ack 1818309187 seq 1402139863 subseq 455570 len 1428 csum 0x3a3e], length 1428
16:50:43.387017 IP 112.26.0.8.45706 > 112.26.0.1.targus-getdata1: Flags [.], seq 64260:65688, ack 1, win 4107, options [nop,nop,TS val 4294939643 ecr 198188,mptcp dss ack 1818309187 seq 1402119871 subseq 447002 len 1428 csum 0xf2c5], length 1428
16:50:43.435385 IP 112.26.0.8.45706 > 112.26.0.1.targus-getdata1: Flags [.], seq 65688:67116, ack 1, win 4107, options [nop,nop,TS val 4294939643 ecr 198188,mptcp dss ack 1818309187 seq 1402121299 subseq 448430 len 1428 csum 0x8fc9], length 1428
16:50:43.485793 IP 112.26.0.8.45706 > 112.26.0.1.targus-getdata1: Flags [.], seq 74256:75684, ack 1, win 4107, options [nop,nop,TS val 4294940149 ecr 198666,mptcp dss ack 1818309187 seq 1402149859 subseq 456998 len 1428 csum 0x2cfa], length 1428
16:50:43.519003 IP 112.26.0.8.45706 > 112.26.0.1.targus-getdata1: Flags [.], seq 75684:77112, ack 1, win 4107, options [nop,nop,TS val 4294940149 ecr 198666,mptcp dss ack 1818309187 seq 1402151287 subseq 458426 len 1428 csum 0xe1fb], length 1428
16:50:43.544480 IP 112.26.0.8.45706 > 112.26.0.1.targus-getdata1: Flags [.], seq 67116:68544, ack 1, win 4107, options [nop,nop,TS val 4294939643 ecr 198188,mptcp dss ack 1818309187 seq 1402122727 subseq 449858 len 1428 csum 0xa21d], length 1428
16:50:43.619001 IP 112.26.0.8.45706 > 112.26.0.1.targus-getdata1: Flags [.], seq 77112:78540, ack 1, win 4107, options [nop,nop,TS val 4294940149 ecr 198666,mptcp dss ack 1818309187 seq 1402152715 subseq 459854 len 1428 csum 0xe3ff], length 1428
16:50:43.629406 IP 112.26.0.8.45706 > 112.26.0.1.targus-getdata1: Flags [.], seq 68544:69972, ack 1, win 4107, options [nop,nop,TS val 4294939838 ecr 198375,mptcp dss ack 1818309187 seq 1402132723 subseq 451286 len 1428 csum 0xd5c3], length 1428
16:50:43.733669 IP 112.26.0.8.45706 > 112.26.0.1.targus-getdata1: Flags [.], seq 69972:71400, ack 1, win 4107, options [nop,nop,TS val 4294939838 ecr 198375,mptcp dss ack 1818309187 seq 1402134151 subseq 452714 len 1428 csum 0x2d43], length 1428
16:50:43.775036 IP 112.26.0.8.45706 > 112.26.0.1.targus-getdata1: Flags [.], seq 78540:79968, ack 1, win 4107, options [nop,nop,TS val 4294940432 ecr 198896,mptcp dss ack 1818309187 seq 1402165567 subseq 461282 len 1428 csum 0xaedd], length 1428
16:50:43.811177 IP 112.26.0.8.45706 > 112.26.0.1.targus-getdata1: Flags [.], seq 71400:72828, ack 1, win 4107, options [nop,nop,TS val 4294939975 ecr 198511,mptcp dss ack 1818309187 seq 1402138435 subseq 454142 len 1428 csum 0x3256], length 1428
16:50:43.895534 IP 112.26.0.8.45706 > 112.26.0.1.targus-getdata1: Flags [.], seq 72828:74256, ack 1, win 4107, options [nop,nop,TS val 4294939975 ecr 198511,mptcp dss ack 1818309187 seq 1402139863 subseq 455570 len 1428 csum 0x3a3e], length 1428
16:50:43.929043 IP 112.26.0.8.45706 > 112.26.0.1.targus-getdata1: Flags [.], seq 79968:81396, ack 1, win 4107, options [nop,nop,TS val 4294940586 ecr 199091,mptcp dss ack 1818309187 seq 1402174135 subseq 462710 len 1428 csum 0xe73a], length 1428
16:50:43.967791 IP 112.26.0.8.45706 > 112.26.0.1.targus-getdata1: Flags [.], seq 74256:75684, ack 1, win 4107, options [nop,nop,TS val 4294940149 ecr 198666,mptcp dss ack 1818309187 seq 1402149859 subseq 456998 len 1428 csum 0x2cfa], length 1428
16:50:43.975223 IP 112.26.0.8.45706 > 112.26.0.1.targus-getdata1: Flags [.], seq 81396:82824, ack 1, win 4107, options [nop,nop,TS val 4294940586 ecr 199091,mptcp dss ack 1818309187 seq 1402175563 subseq 464138 len 1428 csum 0x5f40], length 1428
16:50:44.077656 IP 112.26.0.8.45706 > 112.26.0.1.targus-getdata1: Flags [.], seq 75684:77112, ack 1, win 4107, options [nop,nop,TS val 4294940149 ecr 198666,mptcp dss ack 1818309187 seq 1402151287 subseq 458426 len 1428 csum 0xe1fb], length 1428
16:50:44.085759 IP 112.26.0.8.45706 > 112.26.0.1.targus-getdata1: Flags [.], seq 82824:84252, ack 1, win 4107, options [nop,nop,TS val 4294940586 ecr 199091,mptcp dss ack 1818309187 seq 1402176991 subseq 465566 len 1428 csum 0x5d19], length 1428
16:50:44.104487 IP 112.26.0.8.45706 > 112.26.0.1.targus-getdata1: Flags [.], seq 77112:78540, ack 1, win 4107, options [nop,nop,TS val 4294940149 ecr 198666,mptcp dss ack 1818309187 seq 1402152715 subseq 459854 len 1428 csum 0xe3ff], length 1428
16:50:44.167941 IP 112.26.0.8.45706 > 112.26.0.1.targus-getdata1: Flags [.], seq 84252:85680, ack 1, win 4107, options [nop,nop,TS val 4294940829 ecr 199299,mptcp dss ack 1818309187 seq 1402189843 subseq 466994 len 1428 csum 0x8105], length 1428
16:50:44.211161 IP 112.26.0.8.45706 > 112.26.0.1.targus-getdata1: Flags [.], seq 85680:87108, ack 1, win 4107, options [nop,nop,TS val 4294940829 ecr 199299,mptcp dss ack 1818309187 seq 1402191271 subseq 468422 len 1428 csum 0x6865], length 1428
16:50:44.235971 IP 112.26.0.8.45706 > 112.26.0.1.targus-getdata1: Flags [.], seq 78540:79968, ack 1, win 4107, options [nop,nop,TS val 4294940432 ecr 198896,mptcp dss ack 1818309187 seq 1402165567 subseq 461282 len 1428 csum 0xaedd], length 1428
16:50:44.278034 IP 112.26.0.8.45706 > 112.26.0.1.targus-getdata1: Flags [.], seq 87108:88536, ack 1, win 4107, options [nop,nop,TS val 4294940829 ecr 199299,mptcp dss ack 1818309187 seq 1402192699 subseq 469850 len 1428 csum 0xe5cf], length 1428
16:50:44.315711 IP 112.26.0.8.45706 > 112.26.0.1.targus-getdata1: Flags [.], seq 88536:89964, ack 1, win 4107, options [nop,nop,TS val 4294940965 ecr 199451,mptcp dss ack 1818309187 seq 1402201267 subseq 471278 len 1428 csum 0xad9d], length 1428
16:50:44.353725 IP 112.26.0.8.45706 > 112.26.0.1.targus-getdata1: Flags [.], seq 79968:81396, ack 1, win 4107, options [nop,nop,TS val 4294940586 ecr 199091,mptcp dss ack 1818309187 seq 1402174135 subseq 462710 len 1428 csum 0xe73a], length 1428
16:50:44.381304 IP 112.26.0.8.45706 > 112.26.0.1.targus-getdata1: Flags [.], seq 89964:91392, ack 1, win 4107, options [nop,nop,TS val 4294940965 ecr 199451,mptcp dss ack 1818309187 seq 1402202695 subseq 472706 len 1428 csum 0x7faf], length 1428
16:50:44.443844 IP 112.26.0.8.45706 > 112.26.0.1.targus-getdata1: Flags [.], seq 91392:92820, ack 1, win 4107, options [nop,nop,TS val 4294941103 ecr 199608,mptcp dss ack 1818309187 seq 1402209835 subseq 474134 len 1428 csum 0x2778], length 1428
16:50:44.474285 IP 112.26.0.8.45706 > 112.26.0.1.targus-getdata1: Flags [.], seq 92820:94248, ack 1, win 4107, options [nop,nop,TS val 4294941103 ecr 199608,mptcp dss ack 1818309187 seq 1402211263 subseq 475562 len 1428 csum 0x3844], length 1428
16:50:44.501450 IP 112.26.0.8.45706 > 112.26.0.1.targus-getdata1: Flags [.], seq 81396:82824, ack 1, win 4107, options [nop,nop,TS val 4294940586 ecr 199091,mptcp dss ack 1818309187 seq 1402175563 subseq 464138 len 1428 csum 0x5f40], length 1428
16:50:44.555616 IP 112.26.0.8.45706 > 112.26.0.1.targus-getdata1: Flags [.], seq 94248:95676, ack 1, win 4107, options [nop,nop,TS val 4294941103 ecr 199608,mptcp dss ack 1818309187 seq 1402212691 subseq 476990 len 1428 csum 0x5e3a], length 1428
16:50:44.572811 IP 112.26.0.8.45706 > 112.26.0.1.targus-getdata1: Flags [.], seq 82824:84252, ack 1, win 4107, options [nop,nop,TS val 4294940586 ecr 199091,mptcp dss ack 1818309187 seq 1402176991 subseq 465566 len 1428 csum 0x5d19], length 1428
16:50:44.599151 IP 112.26.0.8.45706 > 112.26.0.1.targus-getdata1: Flags [.], seq 95676:97104, ack 1, win 4107, options [nop,nop,TS val 4294941241 ecr 199745,mptcp dss ack 1818309187 seq 1402218403 subseq 478418 len 1428 csum 0x40f9], length 1428
16:50:44.647748 IP 112.26.0.8.45706 > 112.26.0.1.targus-getdata1: Flags [.], seq 97104:98532, ack 1, win 4107, options [nop,nop,TS val 4294941241 ecr 199745,mptcp dss ack 1818309187 seq 1402219831 subseq 479846 len 1428 csum 0xf624], length 1428
16:50:44.669545 IP 112.26.0.8.45706 > 112.26.0.1.targus-getdata1: Flags [.], seq 84252:85680, ack 1, win 4107, options [nop,nop,TS val 4294940829 ecr 199299,mptcp dss ack 1818309187 seq 1402189843 subseq 466994 len 1428 csum 0x8105], length 1428
16:50:44.678793 IP 112.26.0.8.45706 > 112.26.0.1.targus-getdata1: Flags [.], seq 98532:99960, ack 1, win 4107, options [nop,nop,TS val 4294941241 ecr 199745,mptcp dss ack 1818309187 seq 1402221259 subseq 481274 len 1428 csum 0xb2cd], length 1428
16:50:44.752759 IP 112.26.0.8.45706 > 112.26.0.1.targus-getdata1: Flags [.], seq 85680:87108, ack 1, win 4107, options [nop,nop,TS val 4294940829 ecr 199299,mptcp dss ack 1818309187 seq 1402191271 subseq 468422 len 1428 csum 0x6865], length 1428
16:50:44.835862 IP 112.26.0.8.45706 > 112.26.0.1.targus-getdata1: Flags [.], seq 87108:88536, ack 1, win 4107, options [nop,nop,TS val 4294940829 ecr 199299,mptcp dss ack 1818309187 seq 1402192699 subseq 469850 len 1428 csum 0xe5cf], length 1428
16:50:44.881655 IP 112.26.0.8.45706 > 112.26.0.1.targus-getdata1: Flags [.], seq 88536:89964, ack 1, win 4107, options [nop,nop,TS val 4294940965 ecr 199451,mptcp dss ack 1818309187 seq 1402201267 subseq 471278 len 1428 csum 0xad9d], length 1428
16:50:44.898503 IP 112.26.0.8.45706 > 112.26.0.1.targus-getdata1: Flags [.], seq 99960:101388, ack 1, win 4107, options [nop,nop,TS val 4294941560 ecr 199994,mptcp dss ack 1818309187 seq 1402169851 subseq 482702 len 1428 csum 0xb1ba], length 1428
16:50:44.944914 IP 112.26.0.8.45706 > 112.26.0.1.targus-getdata1: Flags [.], seq 101388:102816, ack 1, win 4107, options [nop,nop,TS val 4294941560 ecr 199994,mptcp dss ack 1818309187 seq 1402178419 subseq 484130 len 1428 csum 0xc62], length 1428
16:50:44.962160 IP 112.26.0.8.45706 > 112.26.0.1.targus-getdata1: Flags [.], seq 89964:91392, ack 1, win 4107, options [nop,nop,TS val 4294940965 ecr 199451,mptcp dss ack 1818309187 seq 1402202695 subseq 472706 len 1428 csum 0x7faf], length 1428
16:50:45.043283 IP 112.26.0.8.45706 > 112.26.0.1.targus-getdata1: Flags [.], seq 92820:94248, ack 1, win 4107, options [nop,nop,TS val 4294941103 ecr 199608,mptcp dss ack 1818309187 seq 1402211263 subseq 475562 len 1428 csum 0x3844], length 1428
16:50:45.113793 IP 112.26.0.8.45706 > 112.26.0.1.targus-getdata1: Flags [.], seq 94248:95676, ack 1, win 4107, options [nop,nop,TS val 4294941103 ecr 199608,mptcp dss ack 1818309187 seq 1402212691 subseq 476990 len 1428 csum 0x5e3a], length 1428
16:50:45.196553 IP 112.26.0.8.45706 > 112.26.0.1.targus-getdata1: Flags [.], seq 95676:97104, ack 1, win 4107, options [nop,nop,TS val 4294941241 ecr 199745,mptcp dss ack 1818309187 seq 1402218403 subseq 478418 len 1428 csum 0x40f9], length 1428
16:50:45.220762 IP 112.26.0.8.45706 > 112.26.0.1.targus-getdata1: Flags [.], seq 102816:104244, ack 1, win 4107, options [nop,nop,TS val 4294941881 ecr 200272,mptcp dss ack 1818309187 seq 1402224115 subseq 485558 len 1428 csum 0x87e2], length 1428
16:50:45.284148 IP 112.26.0.8.45706 > 112.26.0.1.targus-getdata1: Flags [.], seq 104244:105672, ack 1, win 4107, options [nop,nop,TS val 4294941881 ecr 200272,mptcp dss ack 1818309187 seq 1402225543 subseq 486986 len 1428 csum 0x92e2], length 1428
16:50:45.322303 IP 112.26.0.8.45706 > 112.26.0.1.targus-getdata1: Flags [.], seq 99960:101388, ack 1, win 4107, options [nop,nop,TS val 4294941560 ecr 199994,mptcp dss ack 1818309187 seq 1402169851 subseq 482702 len 1428 csum 0xb1ba], length 1428
16:50:45.343441 IP 112.26.0.8.45706 > 112.26.0.1.targus-getdata1: Flags [.], seq 105672:107100, ack 1, win 4107, options [nop,nop,TS val 4294941881 ecr 200272,mptcp dss ack 1818309187 seq 1402226971 subseq 488414 len 1428 csum 0xf090], length 1428
16:50:45.407267 IP 112.26.0.8.45706 > 112.26.0.1.targus-getdata1: Flags [.], seq 107100:108528, ack 1, win 4107, options [nop,nop,TS val 4294941937 ecr 200432,mptcp dss ack 1818309187 seq 1402229827 subseq 489842 len 1428 csum 0x49c8], length 1428
16:50:45.453745 IP 112.26.0.8.45706 > 112.26.0.1.targus-getdata1: Flags [.], seq 101388:102816, ack 1, win 4107, options [nop,nop,TS val 4294941560 ecr 199994,mptcp dss ack 1818309187 seq 1402178419 subseq 484130 len 1428 csum 0xc62], length 1428
16:50:45.485375 IP 112.26.0.8.45706 > 112.26.0.1.targus-getdata1: Flags [.], seq 108528:109956, ack 1, win 4107, options [nop,nop,TS val 4294941937 ecr 200432,mptcp dss ack 1818309187 seq 1402231255 subseq 491270 len 1428 csum 0x9739], length 1428
