16:50:00.185080 IP 112.26.0.8.45702 > 112.26.0.1.targus-getdata1: Flags [S], seq 1292207928, win 65535, options [mss 1460,sackOK,TS val 4294896768 ecr 0,nop,wscale 6,mptcp capable csum {0x107f01c1446bf991}], length 0
16:50:00.221114 IP 112.26.0.8.45702 > 112.26.0.1.targus-getdata1: Flags [S], seq 1292207928, win 65535, options [mss 1460,sackOK,TS val 4294896768 ecr 0,nop,wscale 6,mptcp capable csum {0x107f01c1446bf991}], length 0
16:50:00.297845 IP 112.26.0.8.45702 > 112.26.0.1.targus-getdata1: Flags [S], seq 1292207928, win 65535, options [mss 1460,sackOK,TS val 4294896768 ecr 0,nop,wscale 6,mptcp capable csum {0x107f01c1446bf991}], length 0
16:50:00.616921 IP 112.26.0.1.targus-getdata1 > 112.26.0.8.45702: Flags [S.], seq 2466069190, ack 1292207929, win 65535, options [mss 1460,sackOK,TS val 155939 ecr 4294896768,nop,wscale 6,mptcp capable csum {0x62458052d89ef63b}], length 0
16:50:00.620251 IP 112.26.0.1.targus-getdata1 > 112.26.0.8.45702: Flags [S.], seq 2466069190, ack 1292207929, win 65535, options [mss 1460,sackOK,TS val 155939 ecr 4294896768,nop,wscale 6,mptcp capable csum {0x62458052d89ef63b}], length 0
16:50:00.695976 IP 112.26.0.8.45702 > 112.26.0.1.targus-getdata1: Flags [R], seq 1292207929, win 0, length 0
16:50:00.797197 IP 112.26.0.8.45702 > 112.26.0.1.targus-getdata1: Flags [R], seq 1292207929, win 0, length 0
16:50:37.474402 IP 112.26.0.8.45706 > 112.26.0.1.targus-getdata1: Flags [.], seq 2148327431:2148328859, ack 1846513222, win 4107, options [nop,nop,TS val 4294934108 ecr 192630,mptcp dss ack 1818309187 seq 1401882823 subseq 382742 len 1428 csum 0x17fa], length 1428
16:50:37.474683 IP 112.26.0.8.45706 > 112.26.0.1.targus-getdata1: Flags [.], seq 0:1428, ack 1, win 4107, options [nop,nop,TS val 4294934108 ecr 192630,mptcp dss ack 1818309187 seq 1401882823 subseq 382742 len 1428 csum 0x17fa], length 1428
16:50:37.513650 IP 112.26.0.8.45706 > 112.26.0.1.targus-getdata1: Flags [.], seq 4294945876:4294947304, ack 1, win 4107, options [nop,nop,TS val 4294933775 ecr 192150,mptcp dss ack 1818309187 seq 1401821419 subseq 361322 len 1428 csum 0xacf4], length 1428
16:50:37.517747 IP 112.26.0.1.targus-getdata1 > 112.26.0.8.45706: Flags [.], ack 4294947304, win 24514, options [nop,nop,TS val 193152 ecr 4294933775,nop,nop,sack 2 {4294960156:4294961584}{4294948732:4294958728},mptcp dss ack 1401731455], length 0
16:50:37.518076 IP 112.26.0.1.targus-getdata1 > 112.26.0.8.45706: Flags [.], ack 4294947304, win 24514, options [nop,nop,TS val 193152 ecr 4294933775,nop,nop,sack 2 {4294960156:4294961584}{4294948732:4294958728},mptcp dss ack 1401731455], length 0
16:50:37.585039 IP 112.26.0.8.45706 > 112.26.0.1.targus-getdata1: Flags [.], seq 1428:2856, ack 1, win 4107, options [nop,nop,TS val 4294934120 ecr 192698,mptcp dss ack 1818309187 seq 1401884251 subseq 384170 len 1428 csum 0x37a4], length 1428
16:50:37.585370 IP 112.26.0.8.45706 > 112.26.0.1.targus-getdata1: Flags [.], seq 1428:2856, ack 1, win 4107, options [nop,nop,TS val 4294934120 ecr 192698,mptcp dss ack 1818309187 seq 1401884251 subseq 384170 len 1428 csum 0x37a4], length 1428
16:50:37.598344 IP 112.26.0.8.45706 > 112.26.0.1.targus-getdata1: Flags [.], seq 4294947304:4294948732, ack 1, win 4107, options [nop,nop,TS val 4294933775 ecr 192150,mptcp dss ack 1818309187 seq 1401822847 subseq 362750 len 1428 csum 0x89d1], length 1428
16:50:37.613160 IP 112.26.0.1.targus-getdata1 > 112.26.0.8.45706: Flags [.], ack 4294958728, win 24514, options [nop,nop,TS val 193237 ecr 4294933775,nop,nop,sack 1 {4294960156:4294961584},mptcp dss ack 1401731455], length 0
16:50:37.613312 IP 112.26.0.1.targus-getdata1 > 112.26.0.8.45706: Flags [.], ack 4294958728, win 24514, options [nop,nop,TS val 193237 ecr 4294933775,nop,nop,sack 1 {4294960156:4294961584},mptcp dss ack 1401731455], length 0
16:50:37.663935 IP 112.26.0.8.45706 > 112.26.0.1.targus-getdata1: Flags [.], seq 4294958728:4294960156, ack 1, win 4107, options [nop,nop,TS val 4294934326 ecr 192848,mptcp dss ack 1818309187 seq 1401848551 subseq 374174 len 1428 csum 0x920c], length 1428
16:50:37.664172 IP 112.26.0.8.45706 > 112.26.0.1.targus-getdata1: Flags [.], seq 4294958728:4294960156, ack 1, win 4107, options [nop,nop,TS val 4294934326 ecr 192848,mptcp dss ack 1818309187 seq 1401848551 subseq 374174 len 1428 csum 0x920c], length 1428
16:50:37.697133 IP 112.26.0.8.45706 > 112.26.0.1.targus-getdata1: Flags [.], seq 2856:4284, ack 1, win 4107, options [nop,nop,TS val 4294934326 ecr 192848,mptcp dss ack 1818309187 seq 1401891391 subseq 385598 len 1428 csum 0x63a], length 1428
16:50:37.697456 IP 112.26.0.8.45706 > 112.26.0.1.targus-getdata1: Flags [.], seq 2856:4284, ack 1, win 4107, options [nop,nop,TS val 4294934326 ecr 192848,mptcp dss ack 1818309187 seq 1401891391 subseq 385598 len 1428 csum 0x63a], length 1428
16:50:37.766383 IP 112.26.0.1.targus-getdata1 > 112.26.0.8.45706: Flags [.], ack 4294958728, win 24514, options [nop,nop,TS val 193397 ecr 4294933775,nop,nop,sack 2 {4294963012:4294964440}{4294960156:4294961584},mptcp dss ack 1401731455], length 0
16:50:37.766767 IP 112.26.0.1.targus-getdata1 > 112.26.0.8.45706: Flags [.], ack 4294958728, win 24514, options [nop,nop,TS val 193397 ecr 4294933775,nop,nop,sack 2 {4294963012:4294964440}{4294960156:4294961584},mptcp dss ack 1401731455], length 0
16:50:37.768121 IP 112.26.0.8.45706 > 112.26.0.1.targus-getdata1: Flags [.], seq 4284:5712, ack 1, win 4107, options [nop,nop,TS val 4294934391 ecr 192939,mptcp dss ack 1818309187 seq 1401894247 subseq 387026 len 1428 csum 0x3acf], length 1428
16:50:37.768409 IP 112.26.0.8.45706 > 112.26.0.1.targus-getdata1: Flags [.], seq 4284:5712, ack 1, win 4107, options [nop,nop,TS val 4294934391 ecr 192939,mptcp dss ack 1818309187 seq 1401894247 subseq 387026 len 1428 csum 0x3acf], length 1428
16:50:37.770188 IP 112.26.0.8.45706 > 112.26.0.1.targus-getdata1: Flags [.], seq 4294963012:4294964440, ack 1, win 4107, options [nop,nop,TS val 4294933979 ecr 192335,mptcp dss ack 1818309187 seq 1401872827 subseq 378458 len 1428 csum 0x2a47], length 1428
16:50:37.846747 IP 112.26.0.8.45706 > 112.26.0.1.targus-getdata1: Flags [.], seq 4294964440:4294965868, ack 1, win 4107, options [nop,nop,TS val 4294934047 ecr 192543,mptcp dss ack 1818309187 seq 1401877111 subseq 379886 len 1428 csum 0xdab3], length 1428
16:50:37.862431 IP 112.26.0.1.targus-getdata1 > 112.26.0.8.45706: Flags [.], ack 4294958728, win 24174, options [nop,nop,TS val 193487 ecr 4294933775,nop,nop,sack 2 {4294963012:4294965868}{4294960156:4294961584},mptcp dss ack 1401808567], length 0
16:50:37.862756 IP 112.26.0.1.targus-getdata1 > 112.26.0.8.45706: Flags [.], ack 4294958728, win 24174, options [nop,nop,TS val 193487 ecr 4294933775,nop,nop,sack 2 {4294963012:4294965868}{4294960156:4294961584},mptcp dss ack 1401808567], length 0
16:50:38.001356 IP 112.26.0.8.45706 > 112.26.0.1.targus-getdata1: Flags [.], seq 4294965868:0, ack 1, win 4107, options [nop,nop,TS val 4294934047 ecr 192543,mptcp dss ack 1818309187 seq 1401878539 subseq 381314 len 1428 csum 0x54a1], length 1428
16:50:38.007642 IP 112.26.0.1.targus-getdata1 > 112.26.0.8.45706: Flags [.], ack 4294958728, win 24174, options [nop,nop,TS val 193642 ecr 4294933775,nop,nop,sack 2 {4294963012:0}{4294960156:4294961584},mptcp dss ack 1401808567], length 0
16:50:38.007948 IP 112.26.0.1.targus-getdata1 > 112.26.0.8.45706: Flags [.], ack 4294958728, win 24174, options [nop,nop,TS val 193642 ecr 4294933775,nop,nop,sack 2 {4294963012:0}{4294960156:4294961584},mptcp dss ack 1401808567], length 0
16:50:38.033467 IP 112.26.0.8.45706 > 112.26.0.1.targus-getdata1: Flags [.], seq 4294961584:4294963012, ack 1, win 4107, options [nop,nop,TS val 4294934686 ecr 193152,mptcp dss ack 1818309187 seq 1401857119 subseq 377030 len 1428 csum 0x70ad], length 1428
16:50:38.033823 IP 112.26.0.8.45706 > 112.26.0.1.targus-getdata1: Flags [.], seq 4294961584:4294963012, ack 1, win 4107, options [nop,nop,TS val 4294934686 ecr 193152,mptcp dss ack 1818309187 seq 1401857119 subseq 377030 len 1428 csum 0x70ad], length 1428
16:50:38.100045 IP 112.26.0.1.targus-getdata1 > 112.26.0.8.45706: Flags [.], ack 4294958728, win 24174, options [nop,nop,TS val 193730 ecr 4294933775,nop,nop,sack 2 {4294963012:1428}{4294960156:4294961584},mptcp dss ack 1401808567], length 0
16:50:38.100373 IP 112.26.0.1.targus-getdata1 > 112.26.0.8.45706: Flags [.], ack 4294958728, win 24174, options [nop,nop,TS val 193730 ecr 4294933775,nop,nop,sack 2 {4294963012:1428}{4294960156:4294961584},mptcp dss ack 1401808567], length 0
16:50:38.101670 IP 112.26.0.8.45706 > 112.26.0.1.targus-getdata1: Flags [.], seq 5712:7140, ack 1, win 4107, options [nop,nop,TS val 4294934686 ecr 193152,mptcp dss ack 1818309187 seq 1401901387 subseq 388454 len 1428 csum 0x9bd5], length 1428
16:50:38.101991 IP 112.26.0.8.45706 > 112.26.0.1.targus-getdata1: Flags [.], seq 5712:7140, ack 1, win 4107, options [nop,nop,TS val 4294934686 ecr 193152,mptcp dss ack 1818309187 seq 1401901387 subseq 388454 len 1428 csum 0x9bd5], length 1428
16:50:38.103523 IP 112.26.0.8.45706 > 112.26.0.1.targus-getdata1: Flags [.], seq 0:1428, ack 1, win 4107, options [nop,nop,TS val 4294934108 ecr 192630,mptcp dss ack 1818309187 seq 1401882823 subseq 382742 len 1428 csum 0x17fa], length 1428
16:50:38.138033 IP 112.26.0.8.45706 > 112.26.0.1.targus-getdata1: Flags [.], seq 7140:8568, ack 1, win 4107, options [nop,nop,TS val 4294934787 ecr 193237,mptcp dss ack 1818309187 seq 1401904243 subseq 389882 len 1428 csum 0x2f81], length 1428
16:50:38.138372 IP 112.26.0.8.45706 > 112.26.0.1.targus-getdata1: Flags [.], seq 7140:8568, ack 1, win 4107, options [nop,nop,TS val 4294934787 ecr 193237,mptcp dss ack 1818309187 seq 1401904243 subseq 389882 len 1428 csum 0x2f81], length 1428
16:50:38.165030 IP 112.26.0.8.45706 > 112.26.0.1.targus-getdata1: Flags [.], seq 1428:2856, ack 1, win 4107, options [nop,nop,TS val 4294934120 ecr 192698,mptcp dss ack 1818309187 seq 1401884251 subseq 384170 len 1428 csum 0x37a4], length 1428
16:50:38.173332 IP 112.26.0.1.targus-getdata1 > 112.26.0.8.45706: Flags [.], ack 4294958728, win 24174, options [nop,nop,TS val 193805 ecr 4294933775,nop,nop,sack 2 {4294963012:2856}{4294960156:4294961584},mptcp dss ack 1401808567], length 0
16:50:38.173661 IP 112.26.0.1.targus-getdata1 > 112.26.0.8.45706: Flags [.], ack 4294958728, win 24174, options [nop,nop,TS val 193805 ecr 4294933775,nop,nop,sack 2 {4294963012:2856}{4294960156:4294961584},mptcp dss ack 1401808567], length 0
16:50:38.237893 IP 112.26.0.8.45706 > 112.26.0.1.targus-getdata1: Flags [.], seq 4294958728:4294960156, ack 1, win 4107, options [nop,nop,TS val 4294934326 ecr 192848,mptcp dss ack 1818309187 seq 1401848551 subseq 374174 len 1428 csum 0x920c], length 1428
16:50:38.256619 IP 112.26.0.1.targus-getdata1 > 112.26.0.8.45706: Flags [.], ack 4294961584, win 24174, options [nop,nop,TS val 193878 ecr 4294934326,nop,nop,sack 1 {4294963012:2856},mptcp dss ack 1401808567], length 0
16:50:38.256896 IP 112.26.0.1.targus-getdata1 > 112.26.0.8.45706: Flags [.], ack 4294961584, win 24174, options [nop,nop,TS val 193878 ecr 4294934326,nop,nop,sack 1 {4294963012:2856},mptcp dss ack 1401808567], length 0
16:50:38.303481 IP 112.26.0.8.45706 > 112.26.0.1.targus-getdata1: Flags [.], seq 2856:4284, ack 1, win 4107, options [nop,nop,TS val 4294934326 ecr 192848,mptcp dss ack 1818309187 seq 1401891391 subseq 385598 len 1428 csum 0x63a], length 1428
16:50:38.350615 IP 112.26.0.1.targus-getdata1 > 112.26.0.8.45706: Flags [.], ack 4294961584, win 24174, options [nop,nop,TS val 193944 ecr 4294934326,nop,nop,sack 1 {4294963012:4284},mptcp dss ack 1401808567], length 0
16:50:38.350941 IP 112.26.0.1.targus-getdata1 > 112.26.0.8.45706: Flags [.], ack 4294961584, win 24174, options [nop,nop,TS val 193944 ecr 4294934326,nop,nop,sack 1 {4294963012:4284},mptcp dss ack 1401808567], length 0
16:50:38.360840 IP 112.26.0.8.45706 > 112.26.0.1.targus-getdata1: Flags [.], seq 8568:9996, ack 1, win 4107, options [nop,nop,TS val 4294935006 ecr 193397,mptcp dss ack 1818309187 seq 1401909955 subseq 391310 len 1428 csum 0x293b], length 1428
16:50:38.361167 IP 112.26.0.8.45706 > 112.26.0.1.targus-getdata1: Flags [.], seq 8568:9996, ack 1, win 4107, options [nop,nop,TS val 4294935006 ecr 193397,mptcp dss ack 1818309187 seq 1401909955 subseq 391310 len 1428 csum 0x293b], length 1428
16:50:38.425566 IP 112.26.0.8.45706 > 112.26.0.1.targus-getdata1: Flags [.], seq 9996:11424, ack 1, win 4107, options [nop,nop,TS val 4294935087 ecr 193487,mptcp dss ack 1818309187 seq 1401912811 subseq 392738 len 1428 csum 0xa530], length 1428
16:50:38.425901 IP 112.26.0.8.45706 > 112.26.0.1.targus-getdata1: Flags [.], seq 9996:11424, ack 1, win 4107, options [nop,nop,TS val 4294935087 ecr 193487,mptcp dss ack 1818309187 seq 1401912811 subseq 392738 len 1428 csum 0xa530], length 1428
16:50:38.481241 IP 112.26.0.8.45706 > 112.26.0.1.targus-getdata1: Flags [.], seq 11424:12852, ack 1, win 4107, options [nop,nop,TS val 4294935144 ecr 193642,mptcp dss ack 1818309187 seq 1401915667 subseq 394166 len 1428 csum 0x243f], length 1428
16:50:38.481612 IP 112.26.0.8.45706 > 112.26.0.1.targus-getdata1: Flags [.], seq 11424:12852, ack 1, win 4107, options [nop,nop,TS val 4294935144 ecr 193642,mptcp dss ack 1818309187 seq 1401915667 subseq 394166 len 1428 csum 0x243f], length 1428
16:50:38.506604 IP 112.26.0.8.45706 > 112.26.0.1.targus-getdata1: Flags [.], seq 4294961584:4294963012, ack 1, win 4107, options [nop,nop,TS val 4294934686 ecr 193152,mptcp dss ack 1818309187 seq 1401857119 subseq 377030 len 1428 csum 0x70ad], length 1428
16:50:38.521306 IP 112.26.0.1.targus-getdata1 > 112.26.0.8.45706: Flags [.], ack 4284, win 24174, options [nop,nop,TS val 194147 ecr 4294934686,mptcp dss ack 1401808567], length 0
16:50:38.521644 IP 112.26.0.1.targus-getdata1 > 112.26.0.8.45706: Flags [.], ack 4284, win 24174, options [nop,nop,TS val 194147 ecr 4294934686,mptcp dss ack 1401808567], length 0
16:50:38.593947 IP 112.26.0.8.45706 > 112.26.0.1.targus-getdata1: Flags [.], seq 12852:14280, ack 1, win 4107, options [nop,nop,TS val 4294935257 ecr 193730,mptcp dss ack 1818309187 seq 1401919951 subseq 395594 len 1428 csum 0x4eba], length 1428
16:50:38.594273 IP 112.26.0.8.45706 > 112.26.0.1.targus-getdata1: Flags [.], seq 12852:14280, ack 1, win 4107, options [nop,nop,TS val 4294935257 ecr 193730,mptcp dss ack 1818309187 seq 1401919951 subseq 395594 len 1428 csum 0x4eba], length 1428
16:50:38.643991 IP 112.26.0.8.45706 > 112.26.0.1.targus-getdata1: Flags [.], seq 5712:7140, ack 1, win 4107, options [nop,nop,TS val 4294934686 ecr 193152,mptcp dss ack 1818309187 seq 1401901387 subseq 388454 len 1428 csum 0x9bd5], length 1428
16:50:38.649581 IP 112.26.0.1.targus-getdata1 > 112.26.0.8.45706: Flags [.], ack 4284, win 24174, options [nop,nop,TS val 194284 ecr 4294934686,nop,nop,sack 1 {5712:7140},mptcp dss ack 1401808567], length 0
16:50:38.649855 IP 112.26.0.1.targus-getdata1 > 112.26.0.8.45706: Flags [.], ack 4284, win 24174, options [nop,nop,TS val 194284 ecr 4294934686,nop,nop,sack 1 {5712:7140},mptcp dss ack 1401808567], length 0
16:50:38.739951 IP 112.26.0.8.45706 > 112.26.0.1.targus-getdata1: Flags [.], seq 14280:15708, ack 1, win 4107, options [nop,nop,TS val 4294935403 ecr 193805,mptcp dss ack 1818309187 seq 1401927091 subseq 397022 len 1428 csum 0xbf56], length 1428
16:50:38.740250 IP 112.26.0.8.45706 > 112.26.0.1.targus-getdata1: Flags [.], seq 14280:15708, ack 1, win 4107, options [nop,nop,TS val 4294935403 ecr 193805,mptcp dss ack 1818309187 seq 1401927091 subseq 397022 len 1428 csum 0xbf56], length 1428
16:50:38.786265 IP 112.26.0.8.45706 > 112.26.0.1.targus-getdata1: Flags [.], seq 15708:17136, ack 1, win 4107, options [nop,nop,TS val 4294935440 ecr 193878,mptcp dss ack 1818309187 seq 1401929947 subseq 398450 len 1428 csum 0x4ac2], length 1428
16:50:38.786645 IP 112.26.0.8.45706 > 112.26.0.1.targus-getdata1: Flags [.], seq 15708:17136, ack 1, win 4107, options [nop,nop,TS val 4294935440 ecr 193878,mptcp dss ack 1818309187 seq 1401929947 subseq 398450 len 1428 csum 0x4ac2], length 1428
16:50:38.867674 IP 112.26.0.8.45706 > 112.26.0.1.targus-getdata1: Flags [.], seq 8568:9996, ack 1, win 4107, options [nop,nop,TS val 4294935006 ecr 193397,mptcp dss ack 1818309187 seq 1401909955 subseq 391310 len 1428 csum 0x293b], length 1428
16:50:38.875660 IP 112.26.0.1.targus-getdata1 > 112.26.0.8.45706: Flags [.], ack 4284, win 24236, options [nop,nop,TS val 194508 ecr 4294934686,nop,nop,sack 2 {8568:9996}{5712:7140},mptcp dss ack 1401869971], length 0
16:50:38.875967 IP 112.26.0.1.targus-getdata1 > 112.26.0.8.45706: Flags [.], ack 4284, win 24236, options [nop,nop,TS val 194508 ecr 4294934686,nop,nop,sack 2 {8568:9996}{5712:7140},mptcp dss ack 1401869971], length 0
16:50:38.908220 IP 112.26.0.8.45706 > 112.26.0.1.targus-getdata1: Flags [.], seq 17136:18564, ack 1, win 4107, options [nop,nop,TS val 4294935556 ecr 193944,mptcp dss ack 1818309187 seq 1401934231 subseq 399878 len 1428 csum 0x65d7], length 1428
16:50:38.908491 IP 112.26.0.8.45706 > 112.26.0.1.targus-getdata1: Flags [.], seq 17136:18564, ack 1, win 4107, options [nop,nop,TS val 4294935556 ecr 193944,mptcp dss ack 1818309187 seq 1401934231 subseq 399878 len 1428 csum 0x65d7], length 1428
16:50:38.965349 IP 112.26.0.8.45706 > 112.26.0.1.targus-getdata1: Flags [.], seq 9996:11424, ack 1, win 4107, options [nop,nop,TS val 4294935087 ecr 193487,mptcp dss ack 1818309187 seq 1401912811 subseq 392738 len 1428 csum 0xa530], length 1428
16:50:38.969960 IP 112.26.0.1.targus-getdata1 > 112.26.0.8.45706: Flags [.], ack 4284, win 24370, options [nop,nop,TS val 194604 ecr 4294934686,nop,nop,sack 2 {8568:11424}{5712:7140},mptcp dss ack 1401894247], length 0
16:50:38.970144 IP 112.26.0.1.targus-getdata1 > 112.26.0.8.45706: Flags [.], ack 4284, win 24370, options [nop,nop,TS val 194604 ecr 4294934686,nop,nop,sack 2 {8568:11424}{5712:7140},mptcp dss ack 1401894247], length 0
16:50:39.048904 IP 112.26.0.8.45706 > 112.26.0.1.targus-getdata1: Flags [.], seq 11424:12852, ack 1, win 4107, options [nop,nop,TS val 4294935144 ecr 193642,mptcp dss ack 1818309187 seq 1401915667 subseq 394166 len 1428 csum 0x243f], length 1428
16:50:39.054167 IP 112.26.0.1.targus-getdata1 > 112.26.0.8.45706: Flags [.], ack 4284, win 24370, options [nop,nop,TS val 194689 ecr 4294934686,nop,nop,sack 2 {8568:12852}{5712:7140},mptcp dss ack 1401894247], length 0
16:50:39.054396 IP 112.26.0.1.targus-getdata1 > 112.26.0.8.45706: Flags [.], ack 4284, win 24370, options [nop,nop,TS val 194689 ecr 4294934686,nop,nop,sack 2 {8568:12852}{5712:7140},mptcp dss ack 1401894247], length 0
16:50:39.116767 IP 112.26.0.8.45706 > 112.26.0.1.targus-getdata1: Flags [.], seq 12852:14280, ack 1, win 4107, options [nop,nop,TS val 4294935257 ecr 193730,mptcp dss ack 1818309187 seq 1401919951 subseq 395594 len 1428 csum 0x4eba], length 1428
16:50:39.152509 IP 112.26.0.1.targus-getdata1 > 112.26.0.8.45706: Flags [.], ack 4284, win 24370, options [nop,nop,TS val 194757 ecr 4294934686,nop,nop,sack 2 {8568:14280}{5712:7140},mptcp dss ack 1401894247], length 0
16:50:39.152810 IP 112.26.0.1.targus-getdata1 > 112.26.0.8.45706: Flags [.], ack 4284, win 24370, options [nop,nop,TS val 194757 ecr 4294934686,nop,nop,sack 2 {8568:14280}{5712:7140},mptcp dss ack 1401894247], length 0
16:50:39.174534 IP 112.26.0.8.45706 > 112.26.0.1.targus-getdata1: Flags [.], seq 4284:5712, ack 1, win 4107, options [nop,nop,TS val 4294935837 ecr 194284,mptcp dss ack 1818309187 seq 1401894247 subseq 387026 len 1428 csum 0x3acf], length 1428
16:50:39.174832 IP 112.26.0.8.45706 > 112.26.0.1.targus-getdata1: Flags [.], seq 4284:5712, ack 1, win 4107, options [nop,nop,TS val 4294935837 ecr 194284,mptcp dss ack 1818309187 seq 1401894247 subseq 387026 len 1428 csum 0x3acf], length 1428
16:50:39.219967 IP 112.26.0.8.45706 > 112.26.0.1.targus-getdata1: Flags [.], seq 14280:15708, ack 1, win 4107, options [nop,nop,TS val 4294935403 ecr 193805,mptcp dss ack 1818309187 seq 1401927091 subseq 397022 len 1428 csum 0xbf56], length 1428
16:50:39.230562 IP 112.26.0.1.targus-getdata1 > 112.26.0.8.45706: Flags [.], ack 4284, win 24370, options [nop,nop,TS val 194860 ecr 4294934686,nop,nop,sack 2 {8568:15708}{5712:7140},mptcp dss ack 1401894247], length 0
16:50:39.230845 IP 112.26.0.1.targus-getdata1 > 112.26.0.8.45706: Flags [.], ack 4284, win 24370, options [nop,nop,TS val 194860 ecr 4294934686,nop,nop,sack 2 {8568:15708}{5712:7140},mptcp dss ack 1401894247], length 0
16:50:39.294713 IP 112.26.0.8.45706 > 112.26.0.1.targus-getdata1: Flags [.], seq 15708:17136, ack 1, win 4107, options [nop,nop,TS val 4294935440 ecr 193878,mptcp dss ack 1818309187 seq 1401929947 subseq 398450 len 1428 csum 0x4ac2], length 1428
16:50:39.307071 IP 112.26.0.1.targus-getdata1 > 112.26.0.8.45706: Flags [.], ack 4284, win 24370, options [nop,nop,TS val 194935 ecr 4294934686,nop,nop,sack 2 {8568:17136}{5712:7140},mptcp dss ack 1401894247], length 0
16:50:39.307298 IP 112.26.0.1.targus-getdata1 > 112.26.0.8.45706: Flags [.], ack 4284, win 24370, options [nop,nop,TS val 194935 ecr 4294934686,nop,nop,sack 2 {8568:17136}{5712:7140},mptcp dss ack 1401894247], length 0
16:50:39.393745 IP 112.26.0.8.45706 > 112.26.0.1.targus-getdata1: Flags [.], seq 17136:18564, ack 1, win 4107, options [nop,nop,TS val 4294935556 ecr 193944,mptcp dss ack 1818309187 seq 1401934231 subseq 399878 len 1428 csum 0x65d7], length 1428
16:50:39.396908 IP 112.26.0.1.targus-getdata1 > 112.26.0.8.45706: Flags [.], ack 4284, win 24370, options [nop,nop,TS val 195034 ecr 4294934686,nop,nop,sack 2 {8568:18564}{5712:7140},mptcp dss ack 1401894247], length 0
16:50:39.397142 IP 112.26.0.1.targus-getdata1 > 112.26.0.8.45706: Flags [.], ack 4284, win 24370, options [nop,nop,TS val 195034 ecr 4294934686,nop,nop,sack 2 {8568:18564}{5712:7140},mptcp dss ack 1401894247], length 0
16:50:39.438447 IP 112.26.0.8.45706 > 112.26.0.1.targus-getdata1: Flags [.], seq 7140:8568, ack 1, win 4107, options [nop,nop,TS val 4294936102 ecr 194604,mptcp dss ack 1818309187 seq 1401904243 subseq 389882 len 1428 csum 0x2f81], length 1428
16:50:39.438699 IP 112.26.0.8.45706 > 112.26.0.1.targus-getdata1: Flags [.], seq 7140:8568, ack 1, win 4107, options [nop,nop,TS val 4294936102 ecr 194604,mptcp dss ack 1818309187 seq 1401904243 subseq 389882 len 1428 csum 0x2f81], length 1428
16:50:39.510004 IP 112.26.0.8.45706 > 112.26.0.1.targus-getdata1: Flags [.], seq 18564:19992, ack 1, win 4107, options [nop,nop,TS val 4294936173 ecr 194689,mptcp dss ack 1818309187 seq 1401955651 subseq 401306 len 1428 csum 0x1f8], length 1428
16:50:39.510234 IP 112.26.0.8.45706 > 112.26.0.1.targus-getdata1: Flags [.], seq 18564:19992, ack 1, win 4107, options [nop,nop,TS val 4294936173 ecr 194689,mptcp dss ack 1818309187 seq 1401955651 subseq 401306 len 1428 csum 0x1f8], length 1428
16:50:39.585229 IP 112.26.0.8.45706 > 112.26.0.1.targus-getdata1: Flags [.], seq 4284:5712, ack 1, win 4107, options [nop,nop,TS val 4294935837 ecr 194284,mptcp dss ack 1818309187 seq 1401894247 subseq 387026 len 1428 csum 0x3acf], length 1428
16:50:39.595298 IP 112.26.0.1.targus-getdata1 > 112.26.0.8.45706: Flags [.], ack 7140, win 24244, options [nop,nop,TS val 195225 ecr 4294935837,nop,nop,sack 1 {8568:18564},mptcp dss ack 1401904243], length 0
16:50:39.595548 IP 112.26.0.1.targus-getdata1 > 112.26.0.8.45706: Flags [.], ack 7140, win 24244, options [nop,nop,TS val 195225 ecr 4294935837,nop,nop,sack 1 {8568:18564},mptcp dss ack 1401904243], length 0
16:50:39.626152 IP 112.26.0.8.45706 > 112.26.0.1.targus-getdata1: Flags [.], seq 19992:21420, ack 1, win 4107, options [nop,nop,TS val 4294936290 ecr 194757,mptcp dss ack 1818309187 seq 1401958507 subseq 402734 len 1428 csum 0xe4d4], length 1428
16:50:39.626395 IP 112.26.0.8.45706 > 112.26.0.1.targus-getdata1: Flags [.], seq 19992:21420, ack 1, win 4107, options [nop,nop,TS val 4294936290 ecr 194757,mptcp dss ack 1818309187 seq 1401958507 subseq 402734 len 1428 csum 0xe4d4], length 1428
16:50:39.676237 IP 112.26.0.8.45706 > 112.26.0.1.targus-getdata1: Flags [.], seq 21420:22848, ack 1, win 4107, options [nop,nop,TS val 4294936335 ecr 194860,mptcp dss ack 1818309187 seq 1401961363 subseq 404162 len 1428 csum 0x9bdd], length 1428
16:50:39.676551 IP 112.26.0.8.45706 > 112.26.0.1.targus-getdata1: Flags [.], seq 21420:22848, ack 1, win 4107, options [nop,nop,TS val 4294936335 ecr 194860,mptcp dss ack 1818309187 seq 1401961363 subseq 404162 len 1428 csum 0x9bdd], length 1428
16:50:39.724843 IP 112.26.0.8.45706 > 112.26.0.1.targus-getdata1: Flags [.], seq 22848:24276, ack 1, win 4107, options [nop,nop,TS val 4294936380 ecr 194935,mptcp dss ack 1818309187 seq 1401964219 subseq 405590 len 1428 csum 0xedd8], length 1428
16:50:39.725182 IP 112.26.0.8.45706 > 112.26.0.1.targus-getdata1: Flags [.], seq 22848:24276, ack 1, win 4107, options [nop,nop,TS val 4294936380 ecr 194935,mptcp dss ack 1818309187 seq 1401964219 subseq 405590 len 1428 csum 0xedd8], length 1428
16:50:39.781240 IP 112.26.0.8.45706 > 112.26.0.1.targus-getdata1: Flags [.], seq 7140:8568, ack 1, win 4107, options [nop,nop,TS val 4294936102 ecr 194604,mptcp dss ack 1818309187 seq 1401904243 subseq 389882 len 1428 csum 0x2f81], length 1428
16:50:39.791519 IP 112.26.0.1.targus-getdata1 > 112.26.0.8.45706: Flags [.], ack 18564, win 24205, options [nop,nop,TS val 195422 ecr 4294936102,mptcp dss ack 1401928519], length 0
16:50:39.791854 IP 112.26.0.1.targus-getdata1 > 112.26.0.8.45706: Flags [.], ack 18564, win 24205, options [nop,nop,TS val 195422 ecr 4294936102,mptcp dss ack 1401928519], length 0
16:50:39.794989 IP 112.26.0.8.45706 > 112.26.0.1.targus-getdata1: Flags [.], seq 24276:25704, ack 1, win 4107, options [nop,nop,TS val 4294936451 ecr 195034,mptcp dss ack 1818309187 seq 1401967075 subseq 407018 len 1428 csum 0x1290], length 1428
16:50:39.795311 IP 112.26.0.8.45706 > 112.26.0.1.targus-getdata1: Flags [.], seq 24276:25704, ack 1, win 4107, options [nop,nop,TS val 4294936451 ecr 195034,mptcp dss ack 1818309187 seq 1401967075 subseq 407018 len 1428 csum 0x1290], length 1428
16:50:39.864316 IP 112.26.0.8.45706 > 112.26.0.1.targus-getdata1: Flags [.], seq 18564:19992, ack 1, win 4107, options [nop,nop,TS val 4294936173 ecr 194689,mptcp dss ack 1818309187 seq 1401955651 subseq 401306 len 1428 csum 0x1f8], length 1428
16:50:39.869052 IP 112.26.0.1.targus-getdata1 > 112.26.0.8.45706: Flags [.], ack 19992, win 24455, options [nop,nop,TS val 195505 ecr 4294936173,mptcp dss ack 1401928519], length 0
16:50:39.869362 IP 112.26.0.1.targus-getdata1 > 112.26.0.8.45706: Flags [.], ack 19992, win 24455, options [nop,nop,TS val 195505 ecr 4294936173,mptcp dss ack 1401928519], length 0
16:50:39.933126 IP 112.26.0.8.45706 > 112.26.0.1.targus-getdata1: Flags [.], seq 25704:27132, ack 1, win 4107, options [nop,nop,TS val 4294936595 ecr 195225,mptcp dss ack 1818309187 seq 1401972787 subseq 408446 len 1428 csum 0x4bed], length 1428
16:50:39.933457 IP 112.26.0.8.45706 > 112.26.0.1.targus-getdata1: Flags [.], seq 25704:27132, ack 1, win 4107, options [nop,nop,TS val 4294936595 ecr 195225,mptcp dss ack 1818309187 seq 1401972787 subseq 408446 len 1428 csum 0x4bed], length 1428
16:50:39.963492 IP 112.26.0.8.45706 > 112.26.0.1.targus-getdata1: Flags [.], seq 19992:21420, ack 1, win 4107, options [nop,nop,TS val 4294936290 ecr 194757,mptcp dss ack 1818309187 seq 1401958507 subseq 402734 len 1428 csum 0xe4d4], length 1428
16:50:39.978641 IP 112.26.0.1.targus-getdata1 > 112.26.0.8.45706: Flags [.], ack 21420, win 24522, options [nop,nop,TS val 195604 ecr 4294936290,mptcp dss ack 1401952795], length 0
16:50:39.978866 IP 112.26.0.1.targus-getdata1 > 112.26.0.8.45706: Flags [.], ack 21420, win 24522, options [nop,nop,TS val 195604 ecr 4294936290,mptcp dss ack 1401952795], length 0
16:50:40.076858 IP 112.26.0.8.45706 > 112.26.0.1.targus-getdata1: Flags [.], seq 21420:22848, ack 1, win 4107, options [nop,nop,TS val 4294936335 ecr 194860,mptcp dss ack 1818309187 seq 1401961363 subseq 404162 len 1428 csum 0x9bdd], length 1428
16:50:40.080483 IP 112.26.0.1.targus-getdata1 > 112.26.0.8.45706: Flags [.], ack 22848, win 24543, options [nop,nop,TS val 195717 ecr 4294936335,mptcp dss ack 1401957079], length 0
16:50:40.080752 IP 112.26.0.1.targus-getdata1 > 112.26.0.8.45706: Flags [.], ack 22848, win 24543, options [nop,nop,TS val 195717 ecr 4294936335,mptcp dss ack 1401957079], length 0
16:50:40.149757 IP 112.26.0.8.45706 > 112.26.0.1.targus-getdata1: Flags [.], seq 22848:24276, ack 1, win 4107, options [nop,nop,TS val 4294936380 ecr 194935,mptcp dss ack 1818309187 seq 1401964219 subseq 405590 len 1428 csum 0xedd8], length 1428
16:50:40.156111 IP 112.26.0.8.45706 > 112.26.0.1.targus-getdata1: Flags [.], seq 27132:28560, ack 1, win 4107, options [nop,nop,TS val 4294936797 ecr 195422,mptcp dss ack 1818309187 seq 1401981355 subseq 409874 len 1428 csum 0xe5a4], length 1428
16:50:40.156402 IP 112.26.0.8.45706 > 112.26.0.1.targus-getdata1: Flags [.], seq 27132:28560, ack 1, win 4107, options [nop,nop,TS val 4294936797 ecr 195422,mptcp dss ack 1818309187 seq 1401981355 subseq 409874 len 1428 csum 0xe5a4], length 1428
16:50:40.173210 IP 112.26.0.1.targus-getdata1 > 112.26.0.8.45706: Flags [.], ack 24276, win 24558, options [nop,nop,TS val 195783 ecr 4294936380,mptcp dss ack 1401962791], length 0
16:50:40.173529 IP 112.26.0.1.targus-getdata1 > 112.26.0.8.45706: Flags [.], ack 24276, win 24558, options [nop,nop,TS val 195783 ecr 4294936380,mptcp dss ack 1401962791], length 0
16:50:40.222790 IP 112.26.0.8.45706 > 112.26.0.1.targus-getdata1: Flags [.], seq 24276:25704, ack 1, win 4107, options [nop,nop,TS val 4294936451 ecr 195034,mptcp dss ack 1818309187 seq 1401967075 subseq 407018 len 1428 csum 0x1290], length 1428
16:50:40.240638 IP 112.26.0.1.targus-getdata1 > 112.26.0.8.45706: Flags [.], ack 25704, win 24522, options [nop,nop,TS val 195863 ecr 4294936451,mptcp dss ack 1401965647], length 0
16:50:40.240888 IP 112.26.0.1.targus-getdata1 > 112.26.0.8.45706: Flags [.], ack 25704, win 24522, options [nop,nop,TS val 195863 ecr 4294936451,mptcp dss ack 1401965647], length 0
16:50:40.262285 IP 112.26.0.8.45706 > 112.26.0.1.targus-getdata1: Flags [.], seq 28560:29988, ack 1, win 4107, options [nop,nop,TS val 4294936921 ecr 195505,mptcp dss ack 1818309187 seq 1401985639 subseq 411302 len 1428 csum 0x400d], length 1428
16:50:40.262565 IP 112.26.0.8.45706 > 112.26.0.1.targus-getdata1: Flags [.], seq 28560:29988, ack 1, win 4107, options [nop,nop,TS val 4294936921 ecr 195505,mptcp dss ack 1818309187 seq 1401985639 subseq 411302 len 1428 csum 0x400d], length 1428
16:50:40.316548 IP 112.26.0.8.45706 > 112.26.0.1.targus-getdata1: Flags [.], seq 25704:27132, ack 1, win 4107, options [nop,nop,TS val 4294936595 ecr 195225,mptcp dss ack 1818309187 seq 1401972787 subseq 408446 len 1428 csum 0x4bed], length 1428
16:50:40.323680 IP 112.26.0.1.targus-getdata1 > 112.26.0.8.45706: Flags [.], ack 27132, win 24522, options [nop,nop,TS val 195957 ecr 4294936595,mptcp dss ack 1401965647], length 0
16:50:40.323948 IP 112.26.0.1.targus-getdata1 > 112.26.0.8.45706: Flags [.], ack 27132, win 24522, options [nop,nop,TS val 195957 ecr 4294936595,mptcp dss ack 1401965647], length 0
16:50:40.397712 IP 112.26.0.8.45706 > 112.26.0.1.targus-getdata1: Flags [.], seq 29988:31416, ack 1, win 4107, options [nop,nop,TS val 4294937061 ecr 195604,mptcp dss ack 1818309187 seq 1401991351 subseq 412730 len 1428 csum 0x6e0c], length 1428
16:50:40.397975 IP 112.26.0.8.45706 > 112.26.0.1.targus-getdata1: Flags [.], seq 29988:31416, ack 1, win 4107, options [nop,nop,TS val 4294937061 ecr 195604,mptcp dss ack 1818309187 seq 1401991351 subseq 412730 len 1428 csum 0x6e0c], length 1428
16:50:40.427298 IP 112.26.0.8.45706 > 112.26.0.1.targus-getdata1: Flags [.], seq 31416:32844, ack 1, win 4107, options [nop,nop,TS val 4294937061 ecr 195604,mptcp dss ack 1818309187 seq 1401992779 subseq 414158 len 1428 csum 0xa648], length 1428
16:50:40.427643 IP 112.26.0.8.45706 > 112.26.0.1.targus-getdata1: Flags [.], seq 31416:32844, ack 1, win 4107, options [nop,nop,TS val 4294937061 ecr 195604,mptcp dss ack 1818309187 seq 1401992779 subseq 414158 len 1428 csum 0xa648], length 1428
16:50:40.471000 IP 112.26.0.8.45706 > 112.26.0.1.targus-getdata1: Flags [.], seq 32844:34272, ack 1, win 4107, options [nop,nop,TS val 4294937133 ecr 195717,mptcp dss ack 1818309187 seq 1401997063 subseq 415586 len 1428 csum 0xe07e], length 1428
16:50:40.471233 IP 112.26.0.8.45706 > 112.26.0.1.targus-getdata1: Flags [.], seq 32844:34272, ack 1, win 4107, options [nop,nop,TS val 4294937133 ecr 195717,mptcp dss ack 1818309187 seq 1401997063 subseq 415586 len 1428 csum 0xe07e], length 1428
16:50:40.516613 IP 112.26.0.8.45706 > 112.26.0.1.targus-getdata1: Flags [.], seq 27132:28560, ack 1, win 4107, options [nop,nop,TS val 4294936797 ecr 195422,mptcp dss ack 1818309187 seq 1401981355 subseq 409874 len 1428 csum 0xe5a4], length 1428
16:50:40.529617 IP 112.26.0.1.targus-getdata1 > 112.26.0.8.45706: Flags [.], ack 28560, win 24543, options [nop,nop,TS val 196157 ecr 4294936797,mptcp dss ack 1401975643], length 0
16:50:40.529877 IP 112.26.0.1.targus-getdata1 > 112.26.0.8.45706: Flags [.], ack 28560, win 24543, options [nop,nop,TS val 196157 ecr 4294936797,mptcp dss ack 1401975643], length 0
16:50:40.606663 IP 112.26.0.8.45706 > 112.26.0.1.targus-getdata1: Flags [.], seq 34272:35700, ack 1, win 4107, options [nop,nop,TS val 4294937263 ecr 195783,mptcp dss ack 1818309187 seq 1402002775 subseq 417014 len 1428 csum 0xf612], length 1428
16:50:40.606941 IP 112.26.0.8.45706 > 112.26.0.1.targus-getdata1: Flags [.], seq 34272:35700, ack 1, win 4107, options [nop,nop,TS val 4294937263 ecr 195783,mptcp dss ack 1818309187 seq 1402002775 subseq 417014 len 1428 csum 0xf612], length 1428
16:50:40.661512 IP 112.26.0.8.45706 > 112.26.0.1.targus-getdata1: Flags [.], seq 35700:37128, ack 1, win 4107, options [nop,nop,TS val 4294937317 ecr 195863,mptcp dss ack 1818309187 seq 1402005631 subseq 418442 len 1428 csum 0x707f], length 1428
16:50:40.661852 IP 112.26.0.8.45706 > 112.26.0.1.targus-getdata1: Flags [.], seq 35700:37128, ack 1, win 4107, options [nop,nop,TS val 4294937317 ecr 195863,mptcp dss ack 1818309187 seq 1402005631 subseq 418442 len 1428 csum 0x707f], length 1428
16:50:40.718282 IP 112.26.0.8.45706 > 112.26.0.1.targus-getdata1: Flags [.], seq 28560:29988, ack 1, win 4107, options [nop,nop,TS val 4294936921 ecr 195505,mptcp dss ack 1818309187 seq 1401985639 subseq 411302 len 1428 csum 0x400d], length 1428
16:50:40.743913 IP 112.26.0.1.targus-getdata1 > 112.26.0.8.45706: Flags [.], ack 29988, win 24525, options [nop,nop,TS val 196359 ecr 4294936921,mptcp dss ack 1401987067], length 0
16:50:40.744182 IP 112.26.0.1.targus-getdata1 > 112.26.0.8.45706: Flags [.], ack 29988, win 24525, options [nop,nop,TS val 196359 ecr 4294936921,mptcp dss ack 1401987067], length 0
16:50:40.803435 IP 112.26.0.8.45706 > 112.26.0.1.targus-getdata1: Flags [.], seq 37128:38556, ack 1, win 4107, options [nop,nop,TS val 4294937466 ecr 195957,mptcp dss ack 1818309187 seq 1402014199 subseq 419870 len 1428 csum 0x9f92], length 1428
16:50:40.803771 IP 112.26.0.8.45706 > 112.26.0.1.targus-getdata1: Flags [.], seq 37128:38556, ack 1, win 4107, options [nop,nop,TS val 4294937466 ecr 195957,mptcp dss ack 1818309187 seq 1402014199 subseq 419870 len 1428 csum 0x9f92], length 1428
16:50:40.848035 IP 112.26.0.1.targus-getdata1 > 112.26.0.8.45706: Flags [.], ack 31416, win 24558, options [nop,nop,TS val 196483 ecr 4294937061,mptcp dss ack 1401992779], length 0
16:50:40.848337 IP 112.26.0.1.targus-getdata1 > 112.26.0.8.45706: Flags [.], ack 31416, win 24558, options [nop,nop,TS val 196483 ecr 4294937061,mptcp dss ack 1401992779], length 0
16:50:40.880581 IP 112.26.0.8.45706 > 112.26.0.1.targus-getdata1: Flags [.], seq 29988:31416, ack 1, win 4107, options [nop,nop,TS val 4294937061 ecr 195604,mptcp dss ack 1818309187 seq 1401991351 subseq 412730 len 1428 csum 0x6e0c], length 1428
16:50:40.912629 IP 112.26.0.8.45706 > 112.26.0.1.targus-getdata1: Flags [.], seq 31416:32844, ack 1, win 4107, options [nop,nop,TS val 4294937061 ecr 195604,mptcp dss ack 1818309187 seq 1401992779 subseq 414158 len 1428 csum 0xa648], length 1428
16:50:40.945216 IP 112.26.0.1.targus-getdata1 > 112.26.0.8.45706: Flags [.], ack 32844, win 24540, options [nop,nop,TS val 196553 ecr 4294937061,mptcp dss ack 1401994207], length 0
16:50:40.945494 IP 112.26.0.1.targus-getdata1 > 112.26.0.8.45706: Flags [.], ack 32844, win 24540, options [nop,nop,TS val 196553 ecr 4294937061,mptcp dss ack 1401994207], length 0
16:50:41.001591 IP 112.26.0.8.45706 > 112.26.0.1.targus-getdata1: Flags [.], seq 38556:39984, ack 1, win 4107, options [nop,nop,TS val 4294937664 ecr 196157,mptcp dss ack 1818309187 seq 1402021339 subseq 421298 len 1428 csum 0x9ea8], length 1428
16:50:41.001928 IP 112.26.0.8.45706 > 112.26.0.1.targus-getdata1: Flags [.], seq 38556:39984, ack 1, win 4107, options [nop,nop,TS val 4294937664 ecr 196157,mptcp dss ack 1818309187 seq 1402021339 subseq 421298 len 1428 csum 0x9ea8], length 1428
16:50:41.008226 IP 112.26.0.8.45706 > 112.26.0.1.targus-getdata1: Flags [.], seq 32844:34272, ack 1, win 4107, options [nop,nop,TS val 4294937133 ecr 195717,mptcp dss ack 1818309187 seq 1401997063 subseq 415586 len 1428 csum 0xe07e], length 1428
16:50:41.017795 IP 112.26.0.1.targus-getdata1 > 112.26.0.8.45706: Flags [.], ack 34272, win 24536, options [nop,nop,TS val 196649 ecr 4294937133,mptcp dss ack 1401998491], length 0
16:50:41.018116 IP 112.26.0.1.targus-getdata1 > 112.26.0.8.45706: Flags [.], ack 34272, win 24536, options [nop,nop,TS val 196649 ecr 4294937133,mptcp dss ack 1401998491], length 0
16:50:41.098697 IP 112.26.0.8.45706 > 112.26.0.1.targus-getdata1: Flags [.], seq 34272:35700, ack 1, win 4107, options [nop,nop,TS val 4294937263 ecr 195783,mptcp dss ack 1818309187 seq 1402002775 subseq 417014 len 1428 csum 0xf612], length 1428
16:50:41.101630 IP 112.26.0.1.targus-getdata1 > 112.26.0.8.45706: Flags [.], ack 35700, win 24540, options [nop,nop,TS val 196739 ecr 4294937263,mptcp dss ack 1401999919], length 0
16:50:41.101945 IP 112.26.0.1.targus-getdata1 > 112.26.0.8.45706: Flags [.], ack 35700, win 24540, options [nop,nop,TS val 196739 ecr 4294937263,mptcp dss ack 1401999919], length 0
16:50:41.180121 IP 112.26.0.8.45706 > 112.26.0.1.targus-getdata1: Flags [.], seq 35700:37128, ack 1, win 4107, options [nop,nop,TS val 4294937317 ecr 195863,mptcp dss ack 1818309187 seq 1402005631 subseq 418442 len 1428 csum 0x707f], length 1428
16:50:41.183339 IP 112.26.0.1.targus-getdata1 > 112.26.0.8.45706: Flags [.], ack 37128, win 24525, options [nop,nop,TS val 196820 ecr 4294937317,mptcp dss ack 1402008487], length 0
16:50:41.183678 IP 112.26.0.1.targus-getdata1 > 112.26.0.8.45706: Flags [.], ack 37128, win 24525, options [nop,nop,TS val 196820 ecr 4294937317,mptcp dss ack 1402008487], length 0
16:50:41.209663 IP 112.26.0.8.45706 > 112.26.0.1.targus-getdata1: Flags [.], seq 39984:41412, ack 1, win 4107, options [nop,nop,TS val 4294937866 ecr 196359,mptcp dss ack 1818309187 seq 1402028479 subseq 422726 len 1428 csum 0xbdab], length 1428
16:50:41.209977 IP 112.26.0.8.45706 > 112.26.0.1.targus-getdata1: Flags [.], seq 39984:41412, ack 1, win 4107, options [nop,nop,TS val 4294937866 ecr 196359,mptcp dss ack 1818309187 seq 1402028479 subseq 422726 len 1428 csum 0xbdab], length 1428
16:50:41.258720 IP 112.26.0.8.45706 > 112.26.0.1.targus-getdata1: Flags [.], seq 37128:38556, ack 1, win 4107, options [nop,nop,TS val 4294937466 ecr 195957,mptcp dss ack 1818309187 seq 1402014199 subseq 419870 len 1428 csum 0x9f92], length 1428
16:50:41.284287 IP 112.26.0.1.targus-getdata1 > 112.26.0.8.45706: Flags [.], ack 38556, win 24558, options [nop,nop,TS val 196899 ecr 4294937466,mptcp dss ack 1402012771], length 0
16:50:41.284655 IP 112.26.0.1.targus-getdata1 > 112.26.0.8.45706: Flags [.], ack 38556, win 24558, options [nop,nop,TS val 196899 ecr 4294937466,mptcp dss ack 1402012771], length 0
