10:13:44.416151 IP 112.26.1.8.35463 > 112.26.1.1.32867: Flags [S], seq 1316907403, win 65535, options [mss 1460,sackOK,TS val 199134 ecr 0,nop,wscale 6,mptcp join id 6 token 0x4639d496 nonce 0x289c799f], length 0
10:13:44.444815 IP 112.26.1.8.35463 > 112.26.1.1.32867: Flags [S], seq 1316907403, win 65535, options [mss 1460,sackOK,TS val 199134 ecr 0,nop,wscale 6,mptcp join id 6 token 0x4639d496 nonce 0x289c799f], length 0
10:13:44.474333 IP 112.26.1.1.32867 > 112.26.1.8.35463: Flags [S.], seq 469891316, ack 1316907404, win 65535, options [mss 1460,sackOK,TS val 415586 ecr 199134,nop,wscale 6,mptcp join id 3 hmac 0xa3647829e6530655 nonce 0xc1af9f50], length 0
10:13:44.474649 IP 112.26.1.1.32867 > 112.26.1.8.35463: Flags [S.], seq 469891316, ack 1316907404, win 65535, options [mss 1460,sackOK,TS val 415586 ecr 199134,nop,wscale 6,mptcp join id 3 hmac 0xa3647829e6530655 nonce 0xc1af9f50], length 0
10:13:44.535453 IP 112.26.1.1.32867 > 112.26.1.8.35463: Flags [S.], seq 469891316, ack 1316907404, win 65535, options [mss 1460,sackOK,TS val 415586 ecr 199134,nop,wscale 6,mptcp join id 3 hmac 0xa3647829e6530655 nonce 0xc1af9f50], length 0
10:13:44.621191 IP 112.26.1.8.35463 > 112.26.1.1.32867: Flags [.], ack 1, win 5612, options [nop,nop,TS val 199332 ecr 415586,mptcp join hmac 0x049b77d78eacb1900005fad305fba33941a2c050], length 0
10:13:44.621445 IP 112.26.1.8.35463 > 112.26.1.1.32867: Flags [.], ack 1, win 5612, options [nop,nop,TS val 199332 ecr 415586,mptcp join hmac 0x049b77d78eacb1900005fad305fba33941a2c050], length 0
10:13:44.626787 IP 112.26.1.1.32867 > 112.26.1.8.35463: Flags [.], ack 1, win 2678, options [nop,nop,TS val 415762 ecr 199332,mptcp dss ack 2629537759], length 0
10:13:44.627028 IP 112.26.1.1.32867 > 112.26.1.8.35463: Flags [.], ack 1, win 2678, options [nop,nop,TS val 415762 ecr 199332,mptcp dss ack 2629537759], length 0
10:13:44.668945 IP 112.26.1.1.32867 > 112.26.1.8.35463: Flags [.], seq 1:1429, ack 1, win 2678, options [nop,nop,TS val 415763 ecr 199332,mptcp dss ack 2629537759 seq 2512616029 subseq 1 len 1428 csum 0x69c6], length 1428
10:13:44.669205 IP 112.26.1.1.32867 > 112.26.1.8.35463: Flags [.], seq 1:1429, ack 1, win 2678, options [nop,nop,TS val 415763 ecr 199332,mptcp dss ack 2629537759 seq 2512616029 subseq 1 len 1428 csum 0x69c6], length 1428
10:13:44.707821 IP 112.26.1.1.32867 > 112.26.1.8.35463: Flags [.], ack 1, win 2678, options [nop,nop,TS val 415762 ecr 199332,mptcp dss ack 2629537759], length 0
10:13:44.722915 IP 112.26.1.1.32867 > 112.26.1.8.35463: Flags [.], seq 1429:2857, ack 1, win 2678, options [nop,nop,TS val 415763 ecr 199332,mptcp dss ack 2629537759 seq 2512617457 subseq 1429 len 1428 csum 0x1d23], length 1428
10:13:44.723166 IP 112.26.1.1.32867 > 112.26.1.8.35463: Flags [.], seq 1429:2857, ack 1, win 2678, options [nop,nop,TS val 415763 ecr 199332,mptcp dss ack 2629537759 seq 2512617457 subseq 1429 len 1428 csum 0x1d23], length 1428
10:13:44.746358 IP 112.26.1.1.32867 > 112.26.1.8.35463: Flags [.], seq 2857:4285, ack 1, win 2678, options [nop,nop,TS val 415763 ecr 199332,mptcp dss ack 2629537759 seq 2512618885 subseq 2857 len 1428 csum 0x9083], length 1428
10:13:44.746638 IP 112.26.1.1.32867 > 112.26.1.8.35463: Flags [.], seq 2857:4285, ack 1, win 2678, options [nop,nop,TS val 415763 ecr 199332,mptcp dss ack 2629537759 seq 2512618885 subseq 2857 len 1428 csum 0x9083], length 1428
10:13:44.763051 IP 112.26.1.1.32867 > 112.26.1.8.35463: Flags [.], seq 1:1429, ack 1, win 2678, options [nop,nop,TS val 415763 ecr 199332,mptcp dss ack 2629537759 seq 2512616029 subseq 1 len 1428 csum 0x69c6], length 1428
10:13:44.814629 IP 112.26.1.1.32867 > 112.26.1.8.35463: Flags [.], seq 4285:5713, ack 1, win 2678, options [nop,nop,TS val 415763 ecr 199332,mptcp dss ack 2629537759 seq 2512620313 subseq 4285 len 1428 csum 0x9dfd], length 1428
10:13:44.814852 IP 112.26.1.1.32867 > 112.26.1.8.35463: Flags [.], seq 4285:5713, ack 1, win 2678, options [nop,nop,TS val 415763 ecr 199332,mptcp dss ack 2629537759 seq 2512620313 subseq 4285 len 1428 csum 0x9dfd], length 1428
10:13:44.853138 IP 112.26.1.1.32867 > 112.26.1.8.35463: Flags [.], seq 5713:7141, ack 1, win 2678, options [nop,nop,TS val 415763 ecr 199332,mptcp dss ack 2629537759 seq 2512621741 subseq 5713 len 1428 csum 0x95a0], length 1428
10:13:44.853408 IP 112.26.1.1.32867 > 112.26.1.8.35463: Flags [.], seq 5713:7141, ack 1, win 2678, options [nop,nop,TS val 415763 ecr 199332,mptcp dss ack 2629537759 seq 2512621741 subseq 5713 len 1428 csum 0x95a0], length 1428
10:13:44.863179 IP 112.26.1.8.35463 > 112.26.1.1.32867: Flags [.], ack 1429, win 5840, options [nop,nop,TS val 199556 ecr 415763,mptcp dss ack 2512613173], length 0
10:13:44.863430 IP 112.26.1.8.35463 > 112.26.1.1.32867: Flags [.], ack 1429, win 5840, options [nop,nop,TS val 199556 ecr 415763,mptcp dss ack 2512613173], length 0
10:13:44.908959 IP 112.26.1.1.32867 > 112.26.1.8.35463: Flags [.], seq 7141:8569, ack 1, win 2678, options [nop,nop,TS val 415763 ecr 199332,mptcp dss ack 2629537759 seq 2512623169 subseq 7141 len 1428 csum 0xa051], length 1428
10:13:44.909306 IP 112.26.1.1.32867 > 112.26.1.8.35463: Flags [.], seq 7141:8569, ack 1, win 2678, options [nop,nop,TS val 415763 ecr 199332,mptcp dss ack 2629537759 seq 2512623169 subseq 7141 len 1428 csum 0xa051], length 1428
10:13:44.946368 IP 112.26.1.1.32867 > 112.26.1.8.35463: Flags [.], seq 8569:9997, ack 1, win 2678, options [nop,nop,TS val 415763 ecr 199332,mptcp dss ack 2629537759 seq 2512624597 subseq 8569 len 1428 csum 0xf978], length 1428
10:13:44.946637 IP 112.26.1.1.32867 > 112.26.1.8.35463: Flags [.], seq 8569:9997, ack 1, win 2678, options [nop,nop,TS val 415763 ecr 199332,mptcp dss ack 2629537759 seq 2512624597 subseq 8569 len 1428 csum 0xf978], length 1428
10:13:44.966729 IP 112.26.1.1.32867 > 112.26.1.8.35463: Flags [.], seq 1429:2857, ack 1, win 2678, options [nop,nop,TS val 415763 ecr 199332,mptcp dss ack 2629537759 seq 2512617457 subseq 1429 len 1428 csum 0x1d23], length 1428
10:13:45.051611 IP 112.26.1.1.32867 > 112.26.1.8.35463: Flags [.], seq 9997:11425, ack 1, win 2678, options [nop,nop,TS val 415764 ecr 199332,mptcp dss ack 2629537759 seq 2512626025 subseq 9997 len 1428 csum 0x7eac], length 1428
10:13:45.051877 IP 112.26.1.1.32867 > 112.26.1.8.35463: Flags [.], seq 9997:11425, ack 1, win 2678, options [nop,nop,TS val 415764 ecr 199332,mptcp dss ack 2629537759 seq 2512626025 subseq 9997 len 1428 csum 0x7eac], length 1428
10:13:45.067646 IP 112.26.1.8.35463 > 112.26.1.1.32867: Flags [.], ack 2857, win 5977, options [nop,nop,TS val 199761 ecr 415763,mptcp dss ack 2512618885], length 0
10:13:45.067857 IP 112.26.1.8.35463 > 112.26.1.1.32867: Flags [.], ack 2857, win 5977, options [nop,nop,TS val 199761 ecr 415763,mptcp dss ack 2512618885], length 0
10:13:45.111141 IP 112.26.1.1.32867 > 112.26.1.8.35463: Flags [.], seq 11425:12853, ack 1, win 2678, options [nop,nop,TS val 415764 ecr 199332,mptcp dss ack 2629537759 seq 2512627453 subseq 11425 len 1428 csum 0xa26d], length 1428
10:13:45.111453 IP 112.26.1.1.32867 > 112.26.1.8.35463: Flags [.], seq 11425:12853, ack 1, win 2678, options [nop,nop,TS val 415764 ecr 199332,mptcp dss ack 2629537759 seq 2512627453 subseq 11425 len 1428 csum 0xa26d], length 1428
10:13:45.127907 IP 112.26.1.1.32867 > 112.26.1.8.35463: Flags [.], seq 2857:4285, ack 1, win 2678, options [nop,nop,TS val 415763 ecr 199332,mptcp dss ack 2629537759 seq 2512618885 subseq 2857 len 1428 csum 0x9083], length 1428
10:13:45.154630 IP 112.26.1.1.32867 > 112.26.1.8.35463: Flags [.], seq 12853:14281, ack 1, win 2678, options [nop,nop,TS val 416120 ecr 199332,mptcp dss ack 2629537759 seq 2512628881 subseq 12853 len 1428 csum 0xd0e8], length 1428
10:13:45.154875 IP 112.26.1.1.32867 > 112.26.1.8.35463: Flags [.], seq 12853:14281, ack 1, win 2678, options [nop,nop,TS val 416120 ecr 199332,mptcp dss ack 2629537759 seq 2512628881 subseq 12853 len 1428 csum 0xd0e8], length 1428
10:13:45.164847 IP 112.26.1.8.35463 > 112.26.1.1.32867: Flags [.], ack 4285, win 6114, options [nop,nop,TS val 199919 ecr 415763,mptcp dss ack 2512620313], length 0
10:13:45.165051 IP 112.26.1.8.35463 > 112.26.1.1.32867: Flags [.], ack 4285, win 6114, options [nop,nop,TS val 199919 ecr 415763,mptcp dss ack 2512620313], length 0
10:13:45.231724 IP 112.26.1.1.32867 > 112.26.1.8.35463: Flags [.], seq 4285:5713, ack 1, win 2678, options [nop,nop,TS val 415763 ecr 199332,mptcp dss ack 2629537759 seq 2512620313 subseq 4285 len 1428 csum 0x9dfd], length 1428
10:13:45.262448 IP 112.26.1.8.35463 > 112.26.1.1.32867: Flags [.], ack 5713, win 6205, options [nop,nop,TS val 200027 ecr 415763,mptcp dss ack 2512621741], length 0
10:13:45.262702 IP 112.26.1.8.35463 > 112.26.1.1.32867: Flags [.], ack 5713, win 6205, options [nop,nop,TS val 200027 ecr 415763,mptcp dss ack 2512621741], length 0
10:13:45.322532 IP 112.26.1.1.32867 > 112.26.1.8.35463: Flags [.], seq 14281:15709, ack 1, win 2678, options [nop,nop,TS val 416458 ecr 199556,mptcp dss ack 2629537759 seq 2512644589 subseq 14281 len 1428 csum 0xc3e0], length 1428
10:13:45.323068 IP 112.26.1.1.32867 > 112.26.1.8.35463: Flags [.], seq 14281:15709, ack 1, win 2678, options [nop,nop,TS val 416458 ecr 199556,mptcp dss ack 2629537759 seq 2512644589 subseq 14281 len 1428 csum 0xc3e0], length 1428
10:13:45.333847 IP 112.26.1.1.32867 > 112.26.1.8.35463: Flags [.], seq 5713:7141, ack 1, win 2678, options [nop,nop,TS val 415763 ecr 199332,mptcp dss ack 2629537759 seq 2512621741 subseq 5713 len 1428 csum 0x95a0], length 1428
10:13:45.359606 IP 112.26.1.1.32867 > 112.26.1.8.35463: Flags [.], seq 15709:17137, ack 1, win 2678, options [nop,nop,TS val 416458 ecr 199556,mptcp dss ack 2629537759 seq 2512646017 subseq 15709 len 1428 csum 0x7d5b], length 1428
10:13:45.359941 IP 112.26.1.1.32867 > 112.26.1.8.35463: Flags [.], seq 15709:17137, ack 1, win 2678, options [nop,nop,TS val 416458 ecr 199556,mptcp dss ack 2629537759 seq 2512646017 subseq 15709 len 1428 csum 0x7d5b], length 1428
10:13:45.421650 IP 112.26.1.8.35463 > 112.26.1.1.32867: Flags [.], ack 7141, win 6297, options [nop,nop,TS val 200130 ecr 415763,mptcp dss ack 2512623169], length 0
10:13:45.421980 IP 112.26.1.8.35463 > 112.26.1.1.32867: Flags [.], ack 7141, win 6297, options [nop,nop,TS val 200130 ecr 415763,mptcp dss ack 2512623169], length 0
10:13:45.456944 IP 112.26.1.1.32867 > 112.26.1.8.35463: Flags [.], seq 8569:9997, ack 1, win 2678, options [nop,nop,TS val 415763 ecr 199332,mptcp dss ack 2629537759 seq 2512624597 subseq 8569 len 1428 csum 0xf978], length 1428
10:13:45.551046 IP 112.26.1.8.35463 > 112.26.1.1.32867: Flags [.], ack 7141, win 6434, options [nop,nop,TS val 200244 ecr 415763,nop,nop,sack 1 {8569:9997},mptcp dss ack 2512623169], length 0
10:13:45.551307 IP 112.26.1.8.35463 > 112.26.1.1.32867: Flags [.], ack 7141, win 6434, options [nop,nop,TS val 200244 ecr 415763,nop,nop,sack 1 {8569:9997},mptcp dss ack 2512623169], length 0
10:13:45.558814 IP 112.26.1.1.32867 > 112.26.1.8.35463: Flags [.], seq 17137:18565, ack 1, win 2678, options [nop,nop,TS val 416679 ecr 199761,mptcp dss ack 2629537759 seq 2512651729 subseq 17137 len 1428 csum 0x98a0], length 1428
10:13:45.559180 IP 112.26.1.1.32867 > 112.26.1.8.35463: Flags [.], seq 17137:18565, ack 1, win 2678, options [nop,nop,TS val 416679 ecr 199761,mptcp dss ack 2629537759 seq 2512651729 subseq 17137 len 1428 csum 0x98a0], length 1428
10:13:45.568805 IP 112.26.1.1.32867 > 112.26.1.8.35463: Flags [.], seq 9997:11425, ack 1, win 2678, options [nop,nop,TS val 415764 ecr 199332,mptcp dss ack 2629537759 seq 2512626025 subseq 9997 len 1428 csum 0x7eac], length 1428
10:13:45.610892 IP 112.26.1.1.32867 > 112.26.1.8.35463: Flags [.], seq 18565:19993, ack 1, win 2678, options [nop,nop,TS val 416679 ecr 199761,mptcp dss ack 2629537759 seq 2512653157 subseq 18565 len 1428 csum 0xfe51], length 1428
10:13:45.611246 IP 112.26.1.1.32867 > 112.26.1.8.35463: Flags [.], seq 18565:19993, ack 1, win 2678, options [nop,nop,TS val 416679 ecr 199761,mptcp dss ack 2629537759 seq 2512653157 subseq 18565 len 1428 csum 0xfe51], length 1428
10:13:45.644389 IP 112.26.1.8.35463 > 112.26.1.1.32867: Flags [.], ack 7141, win 6570, options [nop,nop,TS val 200365 ecr 415763,nop,nop,sack 1 {8569:11425},mptcp dss ack 2512623169], length 0
10:13:45.644724 IP 112.26.1.8.35463 > 112.26.1.1.32867: Flags [.], ack 7141, win 6570, options [nop,nop,TS val 200365 ecr 415763,nop,nop,sack 1 {8569:11425},mptcp dss ack 2512623169], length 0
10:13:45.709194 IP 112.26.1.1.32867 > 112.26.1.8.35463: Flags [.], seq 12853:14281, ack 1, win 2678, options [nop,nop,TS val 416120 ecr 199332,mptcp dss ack 2629537759 seq 2512628881 subseq 12853 len 1428 csum 0xd0e8], length 1428
10:13:45.741257 IP 112.26.1.1.32867 > 112.26.1.8.35463: Flags [.], seq 19993:21421, ack 1, win 2678, options [nop,nop,TS val 416876 ecr 200027,mptcp dss ack 2629537759 seq 2512658869 subseq 19993 len 1428 csum 0x3c02], length 1428
10:13:45.741504 IP 112.26.1.1.32867 > 112.26.1.8.35463: Flags [.], seq 19993:21421, ack 1, win 2678, options [nop,nop,TS val 416876 ecr 200027,mptcp dss ack 2629537759 seq 2512658869 subseq 19993 len 1428 csum 0x3c02], length 1428
10:13:45.754982 IP 112.26.1.8.35463 > 112.26.1.1.32867: Flags [.], ack 7141, win 6707, options [nop,nop,TS val 200506 ecr 415763,nop,nop,sack 2 {12853:14281}{8569:11425},mptcp dss ack 2512623169], length 0
10:13:45.755218 IP 112.26.1.8.35463 > 112.26.1.1.32867: Flags [.], ack 7141, win 6707, options [nop,nop,TS val 200506 ecr 415763,nop,nop,sack 2 {12853:14281}{8569:11425},mptcp dss ack 2512623169], length 0
10:13:45.781915 IP 112.26.1.1.32867 > 112.26.1.8.35463: Flags [.], seq 21421:22849, ack 1, win 2678, options [nop,nop,TS val 416876 ecr 200027,mptcp dss ack 2629537759 seq 2512660297 subseq 21421 len 1428 csum 0xbc4b], length 1428
10:13:45.782166 IP 112.26.1.1.32867 > 112.26.1.8.35463: Flags [.], seq 21421:22849, ack 1, win 2678, options [nop,nop,TS val 416876 ecr 200027,mptcp dss ack 2629537759 seq 2512660297 subseq 21421 len 1428 csum 0xbc4b], length 1428
10:13:45.904498 IP 112.26.1.1.32867 > 112.26.1.8.35463: Flags [.], seq 22849:24277, ack 1, win 2678, options [nop,nop,TS val 416876 ecr 200027,mptcp dss ack 2629537759 seq 2512661725 subseq 22849 len 1428 csum 0x9e80], length 1428
10:13:45.904853 IP 112.26.1.1.32867 > 112.26.1.8.35463: Flags [.], seq 22849:24277, ack 1, win 2678, options [nop,nop,TS val 416876 ecr 200027,mptcp dss ack 2629537759 seq 2512661725 subseq 22849 len 1428 csum 0x9e80], length 1428
10:13:45.917307 IP 112.26.1.1.32867 > 112.26.1.8.35463: Flags [.], seq 15709:17137, ack 1, win 2678, options [nop,nop,TS val 416458 ecr 199556,mptcp dss ack 2629537759 seq 2512646017 subseq 15709 len 1428 csum 0x7d5b], length 1428
10:13:45.929504 IP 112.26.1.8.35463 > 112.26.1.1.32867: Flags [.], ack 7141, win 6844, options [nop,nop,TS val 200639 ecr 415763,nop,nop,sack 2 {15709:17137}{12853:14281},mptcp dss ack 2512623169], length 0
10:13:45.929822 IP 112.26.1.8.35463 > 112.26.1.1.32867: Flags [.], ack 7141, win 6844, options [nop,nop,TS val 200639 ecr 415763,nop,nop,sack 2 {15709:17137}{12853:14281},mptcp dss ack 2512623169], length 0
10:13:45.935365 IP 112.26.1.1.32867 > 112.26.1.8.35463: Flags [.], seq 24277:25705, ack 1, win 2678, options [nop,nop,TS val 416876 ecr 200027,mptcp dss ack 2629537759 seq 2512663153 subseq 24277 len 1428 csum 0x7e5f], length 1428
10:13:45.935717 IP 112.26.1.1.32867 > 112.26.1.8.35463: Flags [.], seq 24277:25705, ack 1, win 2678, options [nop,nop,TS val 416876 ecr 200027,mptcp dss ack 2629537759 seq 2512663153 subseq 24277 len 1428 csum 0x7e5f], length 1428
10:13:45.969856 IP 112.26.1.1.32867 > 112.26.1.8.35463: Flags [.], seq 25705:27133, ack 1, win 2678, options [nop,nop,TS val 417051 ecr 200130,mptcp dss ack 2629537759 seq 2512667437 subseq 25705 len 1428 csum 0x614a], length 1428
10:13:45.970268 IP 112.26.1.1.32867 > 112.26.1.8.35463: Flags [.], seq 25705:27133, ack 1, win 2678, options [nop,nop,TS val 417051 ecr 200130,mptcp dss ack 2629537759 seq 2512667437 subseq 25705 len 1428 csum 0x614a], length 1428
10:13:46.023069 IP 112.26.1.1.32867 > 112.26.1.8.35463: Flags [.], seq 17137:18565, ack 1, win 2678, options [nop,nop,TS val 416679 ecr 199761,mptcp dss ack 2629537759 seq 2512651729 subseq 17137 len 1428 csum 0x98a0], length 1428
10:13:46.049726 IP 112.26.1.1.32867 > 112.26.1.8.35463: Flags [.], seq 27133:28561, ack 1, win 2678, options [nop,nop,TS val 417051 ecr 200130,mptcp dss ack 2629537759 seq 2512668865 subseq 27133 len 1428 csum 0xb2e7], length 1428
10:13:46.050063 IP 112.26.1.1.32867 > 112.26.1.8.35463: Flags [.], seq 27133:28561, ack 1, win 2678, options [nop,nop,TS val 417051 ecr 200130,mptcp dss ack 2629537759 seq 2512668865 subseq 27133 len 1428 csum 0xb2e7], length 1428
10:13:46.126640 IP 112.26.1.1.32867 > 112.26.1.8.35463: Flags [.], seq 28561:29989, ack 1, win 2678, options [nop,nop,TS val 417114 ecr 200244,mptcp dss ack 2629537759 seq 2512671721 subseq 28561 len 1428 csum 0x47e2], length 1428
10:13:46.126989 IP 112.26.1.1.32867 > 112.26.1.8.35463: Flags [.], seq 28561:29989, ack 1, win 2678, options [nop,nop,TS val 417114 ecr 200244,mptcp dss ack 2629537759 seq 2512671721 subseq 28561 len 1428 csum 0x47e2], length 1428
10:13:46.131889 IP 112.26.1.8.35463 > 112.26.1.1.32867: Flags [.], ack 7141, win 7027, options [nop,nop,TS val 200820 ecr 415763,nop,nop,sack 2 {15709:18565}{12853:14281},mptcp dss ack 2512623169], length 0
10:13:46.132191 IP 112.26.1.8.35463 > 112.26.1.1.32867: Flags [.], ack 7141, win 7027, options [nop,nop,TS val 200820 ecr 415763,nop,nop,sack 2 {15709:18565}{12853:14281},mptcp dss ack 2512623169], length 0
10:13:46.174665 IP 112.26.1.1.32867 > 112.26.1.8.35463: Flags [.], seq 18565:19993, ack 1, win 2678, options [nop,nop,TS val 416679 ecr 199761,mptcp dss ack 2629537759 seq 2512653157 subseq 18565 len 1428 csum 0xfe51], length 1428
10:13:46.231251 IP 112.26.1.1.32867 > 112.26.1.8.35463: Flags [.], seq 7141:8569, ack 1, win 2678, options [nop,nop,TS val 417367 ecr 200506,mptcp dss ack 2629537759 seq 2512623169 subseq 7141 len 1428 csum 0xa051], length 1428
10:13:46.231568 IP 112.26.1.1.32867 > 112.26.1.8.35463: Flags [.], seq 7141:8569, ack 1, win 2678, options [nop,nop,TS val 417367 ecr 200506,mptcp dss ack 2629537759 seq 2512623169 subseq 7141 len 1428 csum 0xa051], length 1428
10:13:46.266718 IP 112.26.1.1.32867 > 112.26.1.8.35463: Flags [.], seq 11425:12853, ack 1, win 2678, options [nop,nop,TS val 417367 ecr 200506,mptcp dss ack 2629537759 seq 2512627453 subseq 11425 len 1428 csum 0xa26d], length 1428
10:13:46.267051 IP 112.26.1.1.32867 > 112.26.1.8.35463: Flags [.], seq 11425:12853, ack 1, win 2678, options [nop,nop,TS val 417367 ecr 200506,mptcp dss ack 2629537759 seq 2512627453 subseq 11425 len 1428 csum 0xa26d], length 1428
10:13:46.327422 IP 112.26.1.1.32867 > 112.26.1.8.35463: Flags [.], seq 19993:21421, ack 1, win 2678, options [nop,nop,TS val 416876 ecr 200027,mptcp dss ack 2629537759 seq 2512658869 subseq 19993 len 1428 csum 0x3c02], length 1428
10:13:46.329462 IP 112.26.1.8.35463 > 112.26.1.1.32867: Flags [.], ack 7141, win 7164, options [nop,nop,TS val 200971 ecr 415763,nop,nop,sack 2 {15709:19993}{12853:14281},mptcp dss ack 2512623169], length 0
10:13:46.329783 IP 112.26.1.8.35463 > 112.26.1.1.32867: Flags [.], ack 7141, win 7164, options [nop,nop,TS val 200971 ecr 415763,nop,nop,sack 2 {15709:19993}{12853:14281},mptcp dss ack 2512623169], length 0
10:13:46.350660 IP 112.26.1.8.35463 > 112.26.1.1.32867: Flags [.], ack 7141, win 7255, options [nop,nop,TS val 201053 ecr 415763,nop,nop,sack 2 {15709:21421}{12853:14281},mptcp dss ack 2512623169], length 0
10:13:46.350977 IP 112.26.1.8.35463 > 112.26.1.1.32867: Flags [.], ack 7141, win 7255, options [nop,nop,TS val 201053 ecr 415763,nop,nop,sack 2 {15709:21421}{12853:14281},mptcp dss ack 2512623169], length 0
10:13:46.432029 IP 112.26.1.1.32867 > 112.26.1.8.35463: Flags [.], seq 21421:22849, ack 1, win 2678, options [nop,nop,TS val 416876 ecr 200027,mptcp dss ack 2629537759 seq 2512660297 subseq 21421 len 1428 csum 0xbc4b], length 1428
10:13:46.470614 IP 112.26.1.1.32867 > 112.26.1.8.35463: Flags [.], seq 22849:24277, ack 1, win 2678, options [nop,nop,TS val 416876 ecr 200027,mptcp dss ack 2629537759 seq 2512661725 subseq 22849 len 1428 csum 0x9e80], length 1428
10:13:46.555598 IP 112.26.1.8.35463 > 112.26.1.1.32867: Flags [.], ack 7141, win 7437, options [nop,nop,TS val 201229 ecr 415763,nop,nop,sack 2 {15709:22849}{12853:14281},mptcp dss ack 2512623169], length 0
10:13:46.555803 IP 112.26.1.8.35463 > 112.26.1.1.32867: Flags [.], ack 7141, win 7437, options [nop,nop,TS val 201229 ecr 415763,nop,nop,sack 2 {15709:22849}{12853:14281},mptcp dss ack 2512623169], length 0
10:13:46.635217 IP 112.26.1.8.35463 > 112.26.1.1.32867: Flags [.], ack 7141, win 7529, options [nop,nop,TS val 201267 ecr 415763,nop,nop,sack 2 {15709:24277}{12853:14281},mptcp dss ack 2512623169], length 0
10:13:46.635539 IP 112.26.1.8.35463 > 112.26.1.1.32867: Flags [.], ack 7141, win 7529, options [nop,nop,TS val 201267 ecr 415763,nop,nop,sack 2 {15709:24277}{12853:14281},mptcp dss ack 2512623169], length 0
10:13:46.676596 IP 112.26.1.1.32867 > 112.26.1.8.35463: Flags [.], seq 27133:28561, ack 1, win 2678, options [nop,nop,TS val 417051 ecr 200130,mptcp dss ack 2629537759 seq 2512668865 subseq 27133 len 1428 csum 0xb2e7], length 1428
10:13:46.752148 IP 112.26.1.1.32867 > 112.26.1.8.35463: Flags [.], seq 28561:29989, ack 1, win 2678, options [nop,nop,TS val 417114 ecr 200244,mptcp dss ack 2629537759 seq 2512671721 subseq 28561 len 1428 csum 0x47e2], length 1428
10:13:46.770290 IP 112.26.1.1.32867 > 112.26.1.8.35463: Flags [.], seq 14281:15709, ack 1, win 2678, options [nop,nop,TS val 417907 ecr 200971,mptcp dss ack 2629537759 seq 2512644589 subseq 14281 len 1428 csum 0xc3e0], length 1428
10:13:46.770611 IP 112.26.1.1.32867 > 112.26.1.8.35463: Flags [.], seq 14281:15709, ack 1, win 2678, options [nop,nop,TS val 417907 ecr 200971,mptcp dss ack 2629537759 seq 2512644589 subseq 14281 len 1428 csum 0xc3e0], length 1428
10:13:46.849258 IP 112.26.1.1.32867 > 112.26.1.8.35463: Flags [.], seq 7141:8569, ack 1, win 2678, options [nop,nop,TS val 417367 ecr 200506,mptcp dss ack 2629537759 seq 2512623169 subseq 7141 len 1428 csum 0xa051], length 1428
10:13:46.885982 IP 112.26.1.1.32867 > 112.26.1.8.35463: Flags [.], seq 29989:31417, ack 1, win 2678, options [nop,nop,TS val 418019 ecr 201053,mptcp dss ack 2629537759 seq 2512694569 subseq 29989 len 1428 csum 0x9f3f], length 1428
10:13:46.886271 IP 112.26.1.1.32867 > 112.26.1.8.35463: Flags [.], seq 29989:31417, ack 1, win 2678, options [nop,nop,TS val 418019 ecr 201053,mptcp dss ack 2629537759 seq 2512694569 subseq 29989 len 1428 csum 0x9f3f], length 1428
10:13:46.923012 IP 112.26.1.8.35463 > 112.26.1.1.32867: Flags [.], ack 7141, win 7711, options [nop,nop,TS val 201473 ecr 415763,nop,nop,sack 2 {27133:28561}{15709:24277},mptcp dss ack 2512623169], length 0
10:13:46.923324 IP 112.26.1.8.35463 > 112.26.1.1.32867: Flags [.], ack 7141, win 7711, options [nop,nop,TS val 201473 ecr 415763,nop,nop,sack 2 {27133:28561}{15709:24277},mptcp dss ack 2512623169], length 0
10:13:46.975773 IP 112.26.1.1.32867 > 112.26.1.8.35463: Flags [.], seq 31417:32845, ack 1, win 2678, options [nop,nop,TS val 418051 ecr 201229,mptcp dss ack 2629537759 seq 2512695997 subseq 31417 len 1428 csum 0xc6f5], length 1428
10:13:46.976060 IP 112.26.1.1.32867 > 112.26.1.8.35463: Flags [.], seq 31417:32845, ack 1, win 2678, options [nop,nop,TS val 418051 ecr 201229,mptcp dss ack 2629537759 seq 2512695997 subseq 31417 len 1428 csum 0xc6f5], length 1428
10:13:46.987300 IP 112.26.1.1.32867 > 112.26.1.8.35463: Flags [.], seq 32845:34273, ack 1, win 2678, options [nop,nop,TS val 418116 ecr 201267,mptcp dss ack 2629537759 seq 2512698853 subseq 32845 len 1428 csum 0xc02b], length 1428
10:13:46.987650 IP 112.26.1.1.32867 > 112.26.1.8.35463: Flags [.], seq 32845:34273, ack 1, win 2678, options [nop,nop,TS val 418116 ecr 201267,mptcp dss ack 2629537759 seq 2512698853 subseq 32845 len 1428 csum 0xc02b], length 1428
10:13:47.024961 IP 112.26.1.8.35463 > 112.26.1.1.32867: Flags [.], ack 7141, win 7802, options [nop,nop,TS val 201549 ecr 415763,nop,nop,sack 2 {27133:29989}{15709:24277},mptcp dss ack 2512623169], length 0
10:13:47.025223 IP 112.26.1.8.35463 > 112.26.1.1.32867: Flags [.], ack 7141, win 7802, options [nop,nop,TS val 201549 ecr 415763,nop,nop,sack 2 {27133:29989}{15709:24277},mptcp dss ack 2512623169], length 0
10:13:47.050292 IP 112.26.1.8.35463 > 112.26.1.1.32867: Flags [.], ack 11425, win 7894, options [nop,nop,TS val 201636 ecr 417367,nop,nop,sack 2 {27133:29989}{15709:24277},mptcp dss ack 2512627453], length 0
10:13:47.050641 IP 112.26.1.8.35463 > 112.26.1.1.32867: Flags [.], ack 11425, win 7894, options [nop,nop,TS val 201636 ecr 417367,nop,nop,sack 2 {27133:29989}{15709:24277},mptcp dss ack 2512627453], length 0
10:13:47.121960 IP 112.26.1.8.35463 > 112.26.1.1.32867: Flags [.], ack 14281, win 8030, options [nop,nop,TS val 201753 ecr 417367,nop,nop,sack 2 {27133:29989}{15709:24277},mptcp dss ack 2512644589], length 0
10:13:47.122282 IP 112.26.1.8.35463 > 112.26.1.1.32867: Flags [.], ack 14281, win 8030, options [nop,nop,TS val 201753 ecr 417367,nop,nop,sack 2 {27133:29989}{15709:24277},mptcp dss ack 2512644589], length 0
10:13:47.139045 IP 112.26.1.1.32867 > 112.26.1.8.35463: Flags [.], seq 24277:25705, ack 1, win 2678, options [nop,nop,TS val 418269 ecr 201473,mptcp dss ack 2629537759 seq 2512663153 subseq 24277 len 1428 csum 0x7e5f], length 1428
10:13:47.139374 IP 112.26.1.1.32867 > 112.26.1.8.35463: Flags [.], seq 24277:25705, ack 1, win 2678, options [nop,nop,TS val 418269 ecr 201473,mptcp dss ack 2629537759 seq 2512663153 subseq 24277 len 1428 csum 0x7e5f], length 1428
10:13:47.160168 IP 112.26.1.1.32867 > 112.26.1.8.35463: Flags [.], seq 14281:15709, ack 1, win 2678, options [nop,nop,TS val 417907 ecr 200971,mptcp dss ack 2629537759 seq 2512644589 subseq 14281 len 1428 csum 0xc3e0], length 1428
10:13:47.220268 IP 112.26.1.1.32867 > 112.26.1.8.35463: Flags [.], seq 29989:31417, ack 1, win 2678, options [nop,nop,TS val 418019 ecr 201053,mptcp dss ack 2629537759 seq 2512694569 subseq 29989 len 1428 csum 0x9f3f], length 1428
10:13:47.261917 IP 112.26.1.8.35463 > 112.26.1.1.32867: Flags [.], ack 24277, win 8213, options [nop,nop,TS val 201951 ecr 417907,nop,nop,sack 1 {27133:29989},mptcp dss ack 2512663153], length 0
10:13:47.262242 IP 112.26.1.8.35463 > 112.26.1.1.32867: Flags [.], ack 24277, win 8213, options [nop,nop,TS val 201951 ecr 417907,nop,nop,sack 1 {27133:29989},mptcp dss ack 2512663153], length 0
10:13:47.323827 IP 112.26.1.8.35463 > 112.26.1.1.32867: Flags [.], ack 24277, win 8259, options [nop,nop,TS val 202016 ecr 417907,nop,nop,sack 1 {27133:31417},mptcp dss ack 2512663153], length 0
10:13:47.324160 IP 112.26.1.8.35463 > 112.26.1.1.32867: Flags [.], ack 24277, win 8259, options [nop,nop,TS val 202016 ecr 417907,nop,nop,sack 1 {27133:31417},mptcp dss ack 2512663153], length 0
10:13:47.345888 IP 112.26.1.1.32867 > 112.26.1.8.35463: Flags [.], seq 25705:27133, ack 1, win 2678, options [nop,nop,TS val 418481 ecr 201549,mptcp dss ack 2629537759 seq 2512667437 subseq 25705 len 1428 csum 0x614a], length 1428
10:13:47.346306 IP 112.26.1.1.32867 > 112.26.1.8.35463: Flags [.], seq 25705:27133, ack 1, win 2678, options [nop,nop,TS val 418481 ecr 201549,mptcp dss ack 2629537759 seq 2512667437 subseq 25705 len 1428 csum 0x614a], length 1428
10:13:47.361970 IP 112.26.1.1.32867 > 112.26.1.8.35463: Flags [.], seq 31417:32845, ack 1, win 2678, options [nop,nop,TS val 418051 ecr 201229,mptcp dss ack 2629537759 seq 2512695997 subseq 31417 len 1428 csum 0xc6f5], length 1428
10:13:47.421988 IP 112.26.1.1.32867 > 112.26.1.8.35463: Flags [.], seq 34273:35701, ack 1, win 2678, options [nop,nop,TS val 418522 ecr 201636,mptcp dss ack 2629537759 seq 2512710277 subseq 34273 len 1428 csum 0xa9ec], length 1428
10:13:47.422342 IP 112.26.1.1.32867 > 112.26.1.8.35463: Flags [.], seq 34273:35701, ack 1, win 2678, options [nop,nop,TS val 418522 ecr 201636,mptcp dss ack 2629537759 seq 2512710277 subseq 34273 len 1428 csum 0xa9ec], length 1428
10:13:47.435367 IP 112.26.1.1.32867 > 112.26.1.8.35463: Flags [.], seq 32845:34273, ack 1, win 2678, options [nop,nop,TS val 418116 ecr 201267,mptcp dss ack 2629537759 seq 2512698853 subseq 32845 len 1428 csum 0xc02b], length 1428
10:13:47.464263 IP 112.26.1.1.32867 > 112.26.1.8.35463: Flags [.], seq 35701:37129, ack 1, win 2678, options [nop,nop,TS val 418522 ecr 201636,mptcp dss ack 2629537759 seq 2512711705 subseq 35701 len 1428 csum 0x3488], length 1428
10:13:47.464607 IP 112.26.1.1.32867 > 112.26.1.8.35463: Flags [.], seq 35701:37129, ack 1, win 2678, options [nop,nop,TS val 418522 ecr 201636,mptcp dss ack 2629537759 seq 2512711705 subseq 35701 len 1428 csum 0x3488], length 1428
10:13:47.499256 IP 112.26.1.8.35463 > 112.26.1.1.32867: Flags [.], ack 24277, win 8441, options [nop,nop,TS val 202151 ecr 417907,nop,nop,sack 1 {27133:32845},mptcp dss ack 2512663153], length 0
10:13:47.499536 IP 112.26.1.8.35463 > 112.26.1.1.32867: Flags [.], ack 24277, win 8441, options [nop,nop,TS val 202151 ecr 417907,nop,nop,sack 1 {27133:32845},mptcp dss ack 2512663153], length 0
10:13:47.505456 IP 112.26.1.1.32867 > 112.26.1.8.35463: Flags [.], seq 37129:38557, ack 1, win 2678, options [nop,nop,TS val 418522 ecr 201636,mptcp dss ack 2629537759 seq 2512713133 subseq 37129 len 1428 csum 0x126e], length 1428
10:13:47.505759 IP 112.26.1.1.32867 > 112.26.1.8.35463: Flags [.], seq 37129:38557, ack 1, win 2678, options [nop,nop,TS val 418522 ecr 201636,mptcp dss ack 2629537759 seq 2512713133 subseq 37129 len 1428 csum 0x126e], length 1428
10:13:47.529816 IP 112.26.1.8.35463 > 112.26.1.1.32867: Flags [.], ack 24277, win 8532, options [nop,nop,TS val 202225 ecr 417907,nop,nop,sack 1 {27133:34273},mptcp dss ack 2512663153], length 0
10:13:47.530078 IP 112.26.1.8.35463 > 112.26.1.1.32867: Flags [.], ack 24277, win 8532, options [nop,nop,TS val 202225 ecr 417907,nop,nop,sack 1 {27133:34273},mptcp dss ack 2512663153], length 0
10:13:47.559418 IP 112.26.1.1.32867 > 112.26.1.8.35463: Flags [.], seq 38557:39985, ack 1, win 2678, options [nop,nop,TS val 418592 ecr 201753,mptcp dss ack 2629537759 seq 2512714561 subseq 38557 len 1428 csum 0x6335], length 1428
10:13:47.559691 IP 112.26.1.1.32867 > 112.26.1.8.35463: Flags [.], seq 38557:39985, ack 1, win 2678, options [nop,nop,TS val 418592 ecr 201753,mptcp dss ack 2629537759 seq 2512714561 subseq 38557 len 1428 csum 0x6335], length 1428
10:13:47.573222 IP 112.26.1.1.32867 > 112.26.1.8.35463: Flags [.], seq 24277:25705, ack 1, win 2678, options [nop,nop,TS val 418269 ecr 201473,mptcp dss ack 2629537759 seq 2512663153 subseq 24277 len 1428 csum 0x7e5f], length 1428
10:13:47.627405 IP 112.26.1.8.35463 > 112.26.1.1.32867: Flags [.], ack 25705, win 8669, options [nop,nop,TS val 202361 ecr 418269,nop,nop,sack 1 {27133:34273},mptcp dss ack 2512667437], length 0
10:13:47.627685 IP 112.26.1.8.35463 > 112.26.1.1.32867: Flags [.], ack 25705, win 8669, options [nop,nop,TS val 202361 ecr 418269,nop,nop,sack 1 {27133:34273},mptcp dss ack 2512667437], length 0
10:13:47.650201 IP 112.26.1.1.32867 > 112.26.1.8.35463: Flags [.], seq 39985:41413, ack 1, win 2678, options [nop,nop,TS val 418769 ecr 201951,mptcp dss ack 2629537759 seq 2512721701 subseq 39985 len 1428 csum 0xe482], length 1428
10:13:47.650465 IP 112.26.1.1.32867 > 112.26.1.8.35463: Flags [.], seq 39985:41413, ack 1, win 2678, options [nop,nop,TS val 418769 ecr 201951,mptcp dss ack 2629537759 seq 2512721701 subseq 39985 len 1428 csum 0xe482], length 1428
10:13:47.741471 IP 112.26.1.1.32867 > 112.26.1.8.35463: Flags [.], seq 41413:42841, ack 1, win 2678, options [nop,nop,TS val 418878 ecr 202016,mptcp dss ack 2629537759 seq 2512723129 subseq 41413 len 1428 csum 0x80d8], length 1428
10:13:47.741822 IP 112.26.1.1.32867 > 112.26.1.8.35463: Flags [.], seq 41413:42841, ack 1, win 2678, options [nop,nop,TS val 418878 ecr 202016,mptcp dss ack 2629537759 seq 2512723129 subseq 41413 len 1428 csum 0x80d8], length 1428
10:13:47.784333 IP 112.26.1.1.32867 > 112.26.1.8.35463: Flags [.], seq 25705:27133, ack 1, win 2678, options [nop,nop,TS val 418481 ecr 201549,mptcp dss ack 2629537759 seq 2512667437 subseq 25705 len 1428 csum 0x614a], length 1428
10:13:47.871540 IP 112.26.1.8.35463 > 112.26.1.1.32867: Flags [.], ack 34273, win 8852, options [nop,nop,TS val 202581 ecr 418481,mptcp dss ack 2512708849], length 0
10:13:47.871875 IP 112.26.1.8.35463 > 112.26.1.1.32867: Flags [.], ack 34273, win 8852, options [nop,nop,TS val 202581 ecr 418481,mptcp dss ack 2512708849], length 0
10:13:47.945162 IP 112.26.1.1.32867 > 112.26.1.8.35463: Flags [.], seq 34273:35701, ack 1, win 2678, options [nop,nop,TS val 418522 ecr 201636,mptcp dss ack 2629537759 seq 2512710277 subseq 34273 len 1428 csum 0xa9ec], length 1428
10:13:48.026085 IP 112.26.1.1.32867 > 112.26.1.8.35463: Flags [.], seq 35701:37129, ack 1, win 2678, options [nop,nop,TS val 418522 ecr 201636,mptcp dss ack 2629537759 seq 2512711705 subseq 35701 len 1428 csum 0x3488], length 1428
10:13:48.059388 IP 112.26.1.1.32867 > 112.26.1.8.35463: Flags [.], seq 42841:44269, ack 1, win 2678, options [nop,nop,TS val 419185 ecr 202151,mptcp dss ack 2629537759 seq 2512731697 subseq 42841 len 1428 csum 0x72be], length 1428
10:13:48.059754 IP 112.26.1.1.32867 > 112.26.1.8.35463: Flags [.], seq 42841:44269, ack 1, win 2678, options [nop,nop,TS val 419185 ecr 202151,mptcp dss ack 2629537759 seq 2512731697 subseq 42841 len 1428 csum 0x72be], length 1428
10:13:48.081949 IP 112.26.1.8.35463 > 112.26.1.1.32867: Flags [.], ack 35701, win 8989, options [nop,nop,TS val 202742 ecr 418522,mptcp dss ack 2512711705], length 0
10:13:48.082256 IP 112.26.1.8.35463 > 112.26.1.1.32867: Flags [.], ack 35701, win 8989, options [nop,nop,TS val 202742 ecr 418522,mptcp dss ack 2512711705], length 0
10:13:48.131872 IP 112.26.1.1.32867 > 112.26.1.8.35463: Flags [.], seq 44269:45697, ack 1, win 2678, options [nop,nop,TS val 419241 ecr 202361,mptcp dss ack 2629537759 seq 2512737409 subseq 44269 len 1428 csum 0xbe55], length 1428
10:13:48.132222 IP 112.26.1.1.32867 > 112.26.1.8.35463: Flags [.], seq 44269:45697, ack 1, win 2678, options [nop,nop,TS val 419241 ecr 202361,mptcp dss ack 2629537759 seq 2512737409 subseq 44269 len 1428 csum 0xbe55], length 1428
10:13:48.141058 IP 112.26.1.8.35463 > 112.26.1.1.32867: Flags [.], ack 37129, win 9080, options [nop,nop,TS val 202822 ecr 418522,mptcp dss ack 2512713133], length 0
10:13:48.141380 IP 112.26.1.8.35463 > 112.26.1.1.32867: Flags [.], ack 37129, win 9080, options [nop,nop,TS val 202822 ecr 418522,mptcp dss ack 2512713133], length 0
10:13:48.171331 IP 112.26.1.1.32867 > 112.26.1.8.35463: Flags [.], seq 45697:47125, ack 1, win 2678, options [nop,nop,TS val 419241 ecr 202361,mptcp dss ack 2629537759 seq 2512738837 subseq 45697 len 1428 csum 0x4384], length 1428
10:13:48.171695 IP 112.26.1.1.32867 > 112.26.1.8.35463: Flags [.], seq 45697:47125, ack 1, win 2678, options [nop,nop,TS val 419241 ecr 202361,mptcp dss ack 2629537759 seq 2512738837 subseq 45697 len 1428 csum 0x4384], length 1428
10:13:48.190773 IP 112.26.1.1.32867 > 112.26.1.8.35463: Flags [.], seq 38557:39985, ack 1, win 2678, options [nop,nop,TS val 418592 ecr 201753,mptcp dss ack 2629537759 seq 2512714561 subseq 38557 len 1428 csum 0x6335], length 1428
10:13:48.236562 IP 112.26.1.8.35463 > 112.26.1.1.32867: Flags [.], ack 37129, win 9262, options [nop,nop,TS val 202965 ecr 418522,nop,nop,sack 1 {38557:39985},mptcp dss ack 2512713133], length 0
10:13:48.236872 IP 112.26.1.8.35463 > 112.26.1.1.32867: Flags [.], ack 37129, win 9262, options [nop,nop,TS val 202965 ecr 418522,nop,nop,sack 1 {38557:39985},mptcp dss ack 2512713133], length 0
10:13:48.265742 IP 112.26.1.1.32867 > 112.26.1.8.35463: Flags [.], seq 47125:48553, ack 1, win 2678, options [nop,nop,TS val 419394 ecr 202581,mptcp dss ack 2629537759 seq 2512744549 subseq 47125 len 1428 csum 0x4538], length 1428
10:13:48.265997 IP 112.26.1.1.32867 > 112.26.1.8.35463: Flags [.], seq 47125:48553, ack 1, win 2678, options [nop,nop,TS val 419394 ecr 202581,mptcp dss ack 2629537759 seq 2512744549 subseq 47125 len 1428 csum 0x4538], length 1428
10:13:48.279533 IP 112.26.1.1.32867 > 112.26.1.8.35463: Flags [.], seq 41413:42841, ack 1, win 2678, options [nop,nop,TS val 418878 ecr 202016,mptcp dss ack 2629537759 seq 2512723129 subseq 41413 len 1428 csum 0x80d8], length 1428
10:13:48.339213 IP 112.26.1.8.35463 > 112.26.1.1.32867: Flags [.], ack 37129, win 9354, options [nop,nop,TS val 203076 ecr 418522,nop,nop,sack 2 {41413:42841}{38557:39985},mptcp dss ack 2512713133], length 0
10:13:48.339558 IP 112.26.1.8.35463 > 112.26.1.1.32867: Flags [.], ack 37129, win 9354, options [nop,nop,TS val 203076 ecr 418522,nop,nop,sack 2 {41413:42841}{38557:39985},mptcp dss ack 2512713133], length 0
10:13:48.365900 IP 112.26.1.1.32867 > 112.26.1.8.35463: Flags [.], seq 48553:49981, ack 1, win 2678, options [nop,nop,TS val 419500 ecr 202742,mptcp dss ack 2629537759 seq 2512747405 subseq 48553 len 1428 csum 0x5b9d], length 1428
10:13:48.366236 IP 112.26.1.1.32867 > 112.26.1.8.35463: Flags [.], seq 48553:49981, ack 1, win 2678, options [nop,nop,TS val 419500 ecr 202742,mptcp dss ack 2629537759 seq 2512747405 subseq 48553 len 1428 csum 0x5b9d], length 1428
10:13:48.378034 IP 112.26.1.1.32867 > 112.26.1.8.35463: Flags [.], seq 42841:44269, ack 1, win 2678, options [nop,nop,TS val 419185 ecr 202151,mptcp dss ack 2629537759 seq 2512731697 subseq 42841 len 1428 csum 0x72be], length 1428
10:13:48.446412 IP 112.26.1.1.32867 > 112.26.1.8.35463: Flags [.], seq 49981:51409, ack 1, win 2678, options [nop,nop,TS val 419500 ecr 202742,mptcp dss ack 2629537759 seq 2512748833 subseq 49981 len 1428 csum 0x99c1], length 1428
10:13:48.446771 IP 112.26.1.1.32867 > 112.26.1.8.35463: Flags [.], seq 49981:51409, ack 1, win 2678, options [nop,nop,TS val 419500 ecr 202742,mptcp dss ack 2629537759 seq 2512748833 subseq 49981 len 1428 csum 0x99c1], length 1428
10:13:48.469636 IP 112.26.1.8.35463 > 112.26.1.1.32867: Flags [.], ack 37129, win 9490, options [nop,nop,TS val 203174 ecr 418522,nop,nop,sack 2 {41413:44269}{38557:39985},mptcp dss ack 2512713133], length 0
10:13:48.469970 IP 112.26.1.8.35463 > 112.26.1.1.32867: Flags [.], ack 37129, win 9490, options [nop,nop,TS val 203174 ecr 418522,nop,nop,sack 2 {41413:44269}{38557:39985},mptcp dss ack 2512713133], length 0
10:13:48.501188 IP 112.26.1.1.32867 > 112.26.1.8.35463: Flags [.], seq 51409:52837, ack 1, win 2678, options [nop,nop,TS val 419615 ecr 202822,mptcp dss ack 2629537759 seq 2512757401 subseq 51409 len 1428 csum 0xff8], length 1428
10:13:48.501434 IP 112.26.1.1.32867 > 112.26.1.8.35463: Flags [.], seq 51409:52837, ack 1, win 2678, options [nop,nop,TS val 419615 ecr 202822,mptcp dss ack 2629537759 seq 2512757401 subseq 51409 len 1428 csum 0xff8], length 1428
10:13:48.548198 IP 112.26.1.1.32867 > 112.26.1.8.35463: Flags [.], seq 44269:45697, ack 1, win 2678, options [nop,nop,TS val 419241 ecr 202361,mptcp dss ack 2629537759 seq 2512737409 subseq 44269 len 1428 csum 0xbe55], length 1428
10:13:48.629173 IP 112.26.1.8.35463 > 112.26.1.1.32867: Flags [.], ack 37129, win 9627, options [nop,nop,TS val 203338 ecr 418522,nop,nop,sack 2 {41413:45697}{38557:39985},mptcp dss ack 2512713133], length 0
10:13:48.629538 IP 112.26.1.8.35463 > 112.26.1.1.32867: Flags [.], ack 37129, win 9627, options [nop,nop,TS val 203338 ecr 418522,nop,nop,sack 2 {41413:45697}{38557:39985},mptcp dss ack 2512713133], length 0
10:13:48.665280 IP 112.26.1.1.32867 > 112.26.1.8.35463: Flags [.], seq 52837:54265, ack 1, win 2678, options [nop,nop,TS val 419799 ecr 202965,mptcp dss ack 2629537759 seq 2512763113 subseq 52837 len 1428 csum 0x8c37], length 1428
