10:13:38.104242 IP 112.26.0.8.55628 > 112.26.0.1.32867: Flags [S], seq 2658481551, win 65535, options [mss 1460,sackOK,TS val 192900 ecr 0,nop,wscale 6,mptcp capable csum {0xdc727f1fb0e9a5a5}], length 0
10:13:38.161027 IP 112.26.0.8.55628 > 112.26.0.1.32867: Flags [S], seq 2658481551, win 65535, options [mss 1460,sackOK,TS val 192900 ecr 0,nop,wscale 6,mptcp capable csum {0xdc727f1fb0e9a5a5}], length 0
10:13:39.123610 IP 112.26.0.8.55628 > 112.26.0.1.32867: Flags [S], seq 2658481551, win 65535, options [mss 1460,sackOK,TS val 193920 ecr 0,nop,wscale 6,mptcp capable csum {0xdc727f1fb0e9a5a5}], length 0
10:13:39.182719 IP 112.26.0.8.55628 > 112.26.0.1.32867: Flags [S], seq 2658481551, win 65535, options [mss 1460,sackOK,TS val 193920 ecr 0,nop,wscale 6,mptcp capable csum {0xdc727f1fb0e9a5a5}], length 0
10:13:39.381671 IP 112.26.0.1.32867 > 112.26.0.8.55628: Flags [S.], seq 4257355291, ack 2658481552, win 65535, options [mss 1460,sackOK,TS val 409321 ecr 192900,nop,wscale 6,mptcp capable csum {0x582fbc62dbc049b6}], length 0
10:13:39.382152 IP 112.26.0.8.55628 > 112.26.0.1.32867: Flags [.], ack 1, win 1369, options [nop,nop,TS val 194178 ecr 409321,mptcp capable csum {0xdc727f1fb0e9a5a5,0x582fbc62dbc049b6},mptcp dss ack 2512517685], length 0
10:13:39.382399 IP 112.26.0.8.55628 > 112.26.0.1.32867: Flags [.], ack 1, win 1369, options [nop,nop,TS val 194179 ecr 409321,mptcp add-addr id 4 112.26.2.8,mptcp dss ack 2512517685], length 0
10:13:39.382451 IP 112.26.0.8.55628 > 112.26.0.1.32867: Flags [.], ack 1, win 1369, options [nop,nop,TS val 194179 ecr 409321,mptcp add-addr id 5 112.26.3.8,mptcp dss ack 2512517685], length 0
10:13:39.382513 IP 112.26.0.8.55628 > 112.26.0.1.32867: Flags [.], ack 1, win 1369, options [nop,nop,TS val 194179 ecr 409321,mptcp add-addr id 6 112.26.1.8,mptcp dss ack 2512517685], length 0
10:13:39.396033 IP 112.26.0.1.32867 > 112.26.0.8.55628: Flags [S.], seq 4257355291, ack 2658481552, win 65535, options [mss 1460,sackOK,TS val 410323 ecr 192900,nop,wscale 6,mptcp capable csum {0x582fbc62dbc049b6}], length 0
10:13:39.396442 IP 112.26.0.8.55628 > 112.26.0.1.32867: Flags [.], ack 1, win 1369, options [nop,nop,TS val 194193 ecr 409321,mptcp dss ack 2512517685], length 0
10:13:39.478406 IP 112.26.0.8.55628 > 112.26.0.1.32867: Flags [.], ack 1, win 1369, options [nop,nop,TS val 194178 ecr 409321,mptcp capable csum {0xdc727f1fb0e9a5a5,0x582fbc62dbc049b6},mptcp dss ack 2512517685], length 0
10:13:39.486667 IP 112.26.0.1.32867 > 112.26.0.8.55628: Flags [.], ack 1, win 1339, options [nop,nop,TS val 410619 ecr 194178,mptcp add-addr id 3 112.26.1.1,mptcp dss ack 2629537759], length 0
10:13:39.506165 IP 112.26.0.8.55628 > 112.26.0.1.32867: Flags [.], ack 1, win 1369, options [nop,nop,TS val 194179 ecr 409321,mptcp add-addr id 4 112.26.2.8,mptcp dss ack 2512517685], length 0
10:13:39.527165 IP 112.26.0.1.32867 > 112.26.0.8.55628: Flags [.], ack 1, win 1339, options [nop,nop,TS val 410619 ecr 194178,mptcp add-addr id 5 112.26.3.1,mptcp dss ack 2629537759], length 0
10:13:39.532110 IP 112.26.0.8.55628 > 112.26.0.1.32867: Flags [.], ack 1, win 1369, options [nop,nop,TS val 194179 ecr 409321,mptcp add-addr id 5 112.26.3.8,mptcp dss ack 2512517685], length 0
10:13:39.590685 IP 112.26.0.8.55628 > 112.26.0.1.32867: Flags [.], ack 1, win 1369, options [nop,nop,TS val 194179 ecr 409321,mptcp add-addr id 6 112.26.1.8,mptcp dss ack 2512517685], length 0
10:13:39.609915 IP 112.26.0.1.32867 > 112.26.0.8.55628: Flags [.], ack 1, win 1339, options [nop,nop,TS val 410619 ecr 194178,mptcp add-addr id 6 112.26.2.1,mptcp dss ack 2629537759], length 0
10:13:39.674723 IP 112.26.0.8.55628 > 112.26.0.1.32867: Flags [.], ack 1, win 1369, options [nop,nop,TS val 194193 ecr 409321,mptcp dss ack 2512517685], length 0
10:13:39.685605 IP 112.26.0.1.32867 > 112.26.0.8.55628: Flags [.], seq 1:1429, ack 1, win 1339, options [nop,nop,TS val 410629 ecr 194178,mptcp dss ack 2629537759 seq 2512517685 subseq 1 len 1428 csum 0xd56d], length 1428
10:13:39.686047 IP 112.26.0.8.55628 > 112.26.0.1.32867: Flags [.], ack 1429, win 1415, options [nop,nop,TS val 194482 ecr 410629,mptcp dss ack 2512519113], length 0
10:13:39.701141 IP 112.26.0.8.55628 > 112.26.0.1.32867: Flags [.], ack 1429, win 1415, options [nop,nop,TS val 194482 ecr 410629,mptcp dss ack 2512519113], length 0
10:13:39.719090 IP 112.26.0.1.32867 > 112.26.0.8.55628: Flags [.], seq 1429:2857, ack 1, win 1339, options [nop,nop,TS val 410629 ecr 194178,mptcp dss ack 2629537759 seq 2512519113 subseq 1429 len 1428 csum 0xf4bb], length 1428
10:13:39.719457 IP 112.26.0.8.55628 > 112.26.0.1.32867: Flags [.], ack 2857, win 1460, options [nop,nop,TS val 194516 ecr 410629,mptcp dss ack 2512520541], length 0
10:13:39.770296 IP 112.26.0.8.55628 > 112.26.0.1.32867: Flags [.], ack 2857, win 1460, options [nop,nop,TS val 194516 ecr 410629,mptcp dss ack 2512520541], length 0
10:13:39.875921 IP 112.26.0.1.32867 > 112.26.0.8.55628: Flags [P.], seq 2857:4097, ack 1, win 1339, options [nop,nop,TS val 410629 ecr 194178,mptcp dss ack 2629537759 seq 2512520541 subseq 2857 len 1240 csum 0x358e], length 1240
10:13:39.876365 IP 112.26.0.8.55628 > 112.26.0.1.32867: Flags [.], ack 4097, win 1506, options [nop,nop,TS val 194672 ecr 410629,mptcp dss ack 2512521781], length 0
10:13:39.893109 IP 112.26.0.8.55628 > 112.26.0.1.32867: Flags [.], ack 4097, win 1506, options [nop,nop,TS val 194672 ecr 410629,mptcp dss ack 2512521781], length 0
10:13:39.911744 IP 112.26.0.1.32867 > 112.26.0.8.55628: Flags [.], seq 4097:5525, ack 1, win 1339, options [nop,nop,TS val 410629 ecr 194178,mptcp dss ack 2629537759 seq 2512521781 subseq 4097 len 1428 csum 0x29c7], length 1428
10:13:39.912126 IP 112.26.0.8.55628 > 112.26.0.1.32867: Flags [.], ack 5525, win 1552, options [nop,nop,TS val 194708 ecr 410629,mptcp dss ack 2512523209], length 0
10:13:39.987317 IP 112.26.0.8.55628 > 112.26.0.1.32867: Flags [.], ack 5525, win 1552, options [nop,nop,TS val 194708 ecr 410629,mptcp dss ack 2512523209], length 0
10:13:40.011543 IP 112.26.0.1.32867 > 112.26.0.8.55628: Flags [.], seq 5525:6953, ack 1, win 1339, options [nop,nop,TS val 410629 ecr 194178,mptcp dss ack 2629537759 seq 2512523209 subseq 5525 len 1428 csum 0x863c], length 1428
10:13:40.011882 IP 112.26.0.8.55628 > 112.26.0.1.32867: Flags [.], ack 6953, win 1597, options [nop,nop,TS val 194808 ecr 410629,mptcp dss ack 2512524637], length 0
10:13:40.015308 IP 112.26.0.8.55628 > 112.26.0.1.32867: Flags [.], ack 6953, win 1597, options [nop,nop,TS val 194808 ecr 410629,mptcp dss ack 2512524637], length 0
10:13:40.093325 IP 112.26.0.1.32867 > 112.26.0.8.55628: Flags [.], seq 6953:8381, ack 1, win 1339, options [nop,nop,TS val 410629 ecr 194178,mptcp dss ack 2629537759 seq 2512524637 subseq 6953 len 1428 csum 0x2009], length 1428
10:13:40.093678 IP 112.26.0.8.55628 > 112.26.0.1.32867: Flags [.], ack 8381, win 1643, options [nop,nop,TS val 194890 ecr 410629,mptcp dss ack 2512526065], length 0
10:13:40.097371 IP 112.26.0.8.55628 > 112.26.0.1.32867: Flags [.], ack 8381, win 1643, options [nop,nop,TS val 194890 ecr 410629,mptcp dss ack 2512526065], length 0
10:13:40.196098 IP 112.26.0.1.32867 > 112.26.0.8.55628: Flags [.], seq 8381:9809, ack 1, win 1339, options [nop,nop,TS val 410630 ecr 194178,mptcp dss ack 2629537759 seq 2512526065 subseq 8381 len 1428 csum 0xef9a], length 1428
10:13:40.196471 IP 112.26.0.8.55628 > 112.26.0.1.32867: Flags [.], ack 9809, win 1689, options [nop,nop,TS val 194992 ecr 410630,mptcp dss ack 2512527493], length 0
10:13:40.200739 IP 112.26.0.8.55628 > 112.26.0.1.32867: Flags [.], ack 9809, win 1689, options [nop,nop,TS val 194992 ecr 410630,mptcp dss ack 2512527493], length 0
10:13:40.222313 IP 112.26.0.1.32867 > 112.26.0.8.55628: Flags [.], seq 9809:11237, ack 1, win 1339, options [nop,nop,TS val 410630 ecr 194178,mptcp dss ack 2629537759 seq 2512527493 subseq 9809 len 1428 csum 0xe806], length 1428
10:13:40.222709 IP 112.26.0.8.55628 > 112.26.0.1.32867: Flags [.], ack 11237, win 1734, options [nop,nop,TS val 195019 ecr 410630,mptcp dss ack 2512528921], length 0
10:13:40.225696 IP 112.26.0.8.55628 > 112.26.0.1.32867: Flags [.], ack 11237, win 1734, options [nop,nop,TS val 195019 ecr 410630,mptcp dss ack 2512528921], length 0
10:13:40.301491 IP 112.26.0.1.32867 > 112.26.0.8.55628: Flags [.], seq 14093:15521, ack 1, win 1339, options [nop,nop,TS val 410934 ecr 194482,mptcp dss ack 2629537759 seq 2512531777 subseq 14093 len 1428 csum 0xac23], length 1428
10:13:40.301825 IP 112.26.0.8.55628 > 112.26.0.1.32867: Flags [.], ack 11237, win 1780, options [nop,nop,TS val 195098 ecr 410630,nop,nop,sack 1 {14093:15521},mptcp dss ack 2512528921], length 0
10:13:40.315904 IP 112.26.0.8.55628 > 112.26.0.1.32867: Flags [.], ack 11237, win 1780, options [nop,nop,TS val 195098 ecr 410630,nop,nop,sack 1 {14093:15521},mptcp dss ack 2512528921], length 0
10:13:40.394226 IP 112.26.0.1.32867 > 112.26.0.8.55628: Flags [.], seq 15521:16949, ack 1, win 1339, options [nop,nop,TS val 410934 ecr 194482,mptcp dss ack 2629537759 seq 2512533205 subseq 15521 len 1428 csum 0x177f], length 1428
10:13:40.394585 IP 112.26.0.8.55628 > 112.26.0.1.32867: Flags [.], ack 11237, win 1825, options [nop,nop,TS val 195190 ecr 410630,nop,nop,sack 1 {14093:16949},mptcp dss ack 2512528921], length 0
10:13:40.398682 IP 112.26.0.8.55628 > 112.26.0.1.32867: Flags [.], ack 11237, win 1825, options [nop,nop,TS val 195190 ecr 410630,nop,nop,sack 1 {14093:16949},mptcp dss ack 2512528921], length 0
10:13:40.476238 IP 112.26.0.1.32867 > 112.26.0.8.55628: Flags [.], seq 16949:18377, ack 1, win 1339, options [nop,nop,TS val 411016 ecr 194516,mptcp dss ack 2629537759 seq 2512534633 subseq 16949 len 1428 csum 0xd3], length 1428
10:13:40.476567 IP 112.26.0.8.55628 > 112.26.0.1.32867: Flags [.], ack 11237, win 1871, options [nop,nop,TS val 195272 ecr 410630,nop,nop,sack 1 {14093:18377},mptcp dss ack 2512528921], length 0
10:13:40.483237 IP 112.26.0.8.55628 > 112.26.0.1.32867: Flags [.], ack 11237, win 1871, options [nop,nop,TS val 195272 ecr 410630,nop,nop,sack 1 {14093:18377},mptcp dss ack 2512528921], length 0
10:13:40.508657 IP 112.26.0.1.32867 > 112.26.0.8.55628: Flags [.], seq 18377:19805, ack 1, win 1339, options [nop,nop,TS val 411016 ecr 194516,mptcp dss ack 2629537759 seq 2512536061 subseq 18377 len 1428 csum 0xa1f], length 1428
10:13:40.508945 IP 112.26.0.8.55628 > 112.26.0.1.32867: Flags [.], ack 11237, win 1917, options [nop,nop,TS val 195305 ecr 410630,nop,nop,sack 1 {14093:19805},mptcp dss ack 2512528921], length 0
10:13:40.513083 IP 112.26.0.8.55628 > 112.26.0.1.32867: Flags [.], ack 11237, win 1917, options [nop,nop,TS val 195305 ecr 410630,nop,nop,sack 1 {14093:19805},mptcp dss ack 2512528921], length 0
10:13:40.591502 IP 112.26.0.1.32867 > 112.26.0.8.55628: Flags [.], seq 19805:21233, ack 1, win 1339, options [nop,nop,TS val 411113 ecr 194672,mptcp dss ack 2629537759 seq 2512537489 subseq 19805 len 1428 csum 0xc9c0], length 1428
10:13:40.591766 IP 112.26.0.8.55628 > 112.26.0.1.32867: Flags [.], ack 11237, win 1962, options [nop,nop,TS val 195387 ecr 410630,nop,nop,sack 1 {14093:21233},mptcp dss ack 2512528921], length 0
10:13:40.676587 IP 112.26.0.8.55628 > 112.26.0.1.32867: Flags [.], ack 11237, win 1962, options [nop,nop,TS val 195387 ecr 410630,nop,nop,sack 1 {14093:21233},mptcp dss ack 2512528921], length 0
10:13:40.690751 IP 112.26.0.1.32867 > 112.26.0.8.55628: Flags [.], seq 21233:22661, ack 1, win 1339, options [nop,nop,TS val 411113 ecr 194672,mptcp dss ack 2629537759 seq 2512538917 subseq 21233 len 1428 csum 0x12c1], length 1428
10:13:40.691084 IP 112.26.0.8.55628 > 112.26.0.1.32867: Flags [.], ack 11237, win 2008, options [nop,nop,TS val 195487 ecr 410630,nop,nop,sack 1 {14093:22661},mptcp dss ack 2512528921], length 0
10:13:40.707796 IP 112.26.0.8.55628 > 112.26.0.1.32867: Flags [.], ack 11237, win 2008, options [nop,nop,TS val 195487 ecr 410630,nop,nop,sack 1 {14093:22661},mptcp dss ack 2512528921], length 0
10:13:40.783649 IP 112.26.0.1.32867 > 112.26.0.8.55628: Flags [.], seq 22661:24089, ack 1, win 1339, options [nop,nop,TS val 411209 ecr 194708,mptcp dss ack 2629537759 seq 2512540345 subseq 22661 len 1428 csum 0x6f5b], length 1428
10:13:40.783926 IP 112.26.0.8.55628 > 112.26.0.1.32867: Flags [.], ack 11237, win 2054, options [nop,nop,TS val 195580 ecr 410630,nop,nop,sack 1 {14093:24089},mptcp dss ack 2512528921], length 0
10:13:40.813620 IP 112.26.0.8.55628 > 112.26.0.1.32867: Flags [.], ack 11237, win 2054, options [nop,nop,TS val 195580 ecr 410630,nop,nop,sack 1 {14093:24089},mptcp dss ack 2512528921], length 0
10:13:40.881044 IP 112.26.0.1.32867 > 112.26.0.8.55628: Flags [.], seq 24089:25517, ack 1, win 1339, options [nop,nop,TS val 411209 ecr 194708,mptcp dss ack 2629537759 seq 2512541773 subseq 24089 len 1428 csum 0x72a], length 1428
10:13:40.881378 IP 112.26.0.8.55628 > 112.26.0.1.32867: Flags [.], ack 11237, win 2099, options [nop,nop,TS val 195678 ecr 410630,nop,nop,sack 1 {14093:25517},mptcp dss ack 2512528921], length 0
10:13:40.887905 IP 112.26.0.8.55628 > 112.26.0.1.32867: Flags [.], ack 11237, win 2099, options [nop,nop,TS val 195678 ecr 410630,nop,nop,sack 1 {14093:25517},mptcp dss ack 2512528921], length 0
10:13:40.916068 IP 112.26.0.1.32867 > 112.26.0.8.55628: Flags [.], seq 25517:26945, ack 1, win 1339, options [nop,nop,TS val 411252 ecr 194808,mptcp dss ack 2629537759 seq 2512543201 subseq 25517 len 1428 csum 0x2128], length 1428
10:13:40.916425 IP 112.26.0.8.55628 > 112.26.0.1.32867: Flags [.], ack 11237, win 2145, options [nop,nop,TS val 195713 ecr 410630,nop,nop,sack 1 {14093:26945},mptcp dss ack 2512528921], length 0
10:13:40.920336 IP 112.26.0.8.55628 > 112.26.0.1.32867: Flags [.], ack 11237, win 2145, options [nop,nop,TS val 195713 ecr 410630,nop,nop,sack 1 {14093:26945},mptcp dss ack 2512528921], length 0
10:13:41.001608 IP 112.26.0.1.32867 > 112.26.0.8.55628: Flags [.], seq 26945:28373, ack 1, win 1339, options [nop,nop,TS val 411252 ecr 194808,mptcp dss ack 2629537759 seq 2512544629 subseq 26945 len 1428 csum 0xa724], length 1428
10:13:41.001875 IP 112.26.0.8.55628 > 112.26.0.1.32867: Flags [.], ack 11237, win 2190, options [nop,nop,TS val 195798 ecr 410630,nop,nop,sack 1 {14093:28373},mptcp dss ack 2512528921], length 0
10:13:41.009658 IP 112.26.0.8.55628 > 112.26.0.1.32867: Flags [.], ack 11237, win 2190, options [nop,nop,TS val 195798 ecr 410630,nop,nop,sack 1 {14093:28373},mptcp dss ack 2512528921], length 0
10:13:41.096744 IP 112.26.0.1.32867 > 112.26.0.8.55628: Flags [.], seq 28373:29801, ack 1, win 1339, options [nop,nop,TS val 411322 ecr 194890,mptcp dss ack 2629537759 seq 2512546057 subseq 28373 len 1428 csum 0xb381], length 1428
10:13:41.097034 IP 112.26.0.8.55628 > 112.26.0.1.32867: Flags [.], ack 11237, win 2236, options [nop,nop,TS val 195893 ecr 410630,nop,nop,sack 1 {14093:29801},mptcp dss ack 2512528921], length 0
10:13:41.100446 IP 112.26.0.8.55628 > 112.26.0.1.32867: Flags [.], ack 11237, win 2236, options [nop,nop,TS val 195893 ecr 410630,nop,nop,sack 1 {14093:29801},mptcp dss ack 2512528921], length 0
10:13:41.191333 IP 112.26.0.1.32867 > 112.26.0.8.55628: Flags [.], seq 29801:31229, ack 1, win 1339, options [nop,nop,TS val 411322 ecr 194890,mptcp dss ack 2629537759 seq 2512547485 subseq 29801 len 1428 csum 0xd922], length 1428
10:13:41.191700 IP 112.26.0.8.55628 > 112.26.0.1.32867: Flags [.], ack 11237, win 2282, options [nop,nop,TS val 195988 ecr 410630,nop,nop,sack 1 {14093:31229},mptcp dss ack 2512528921], length 0
10:13:41.195865 IP 112.26.0.8.55628 > 112.26.0.1.32867: Flags [.], ack 11237, win 2282, options [nop,nop,TS val 195988 ecr 410630,nop,nop,sack 1 {14093:31229},mptcp dss ack 2512528921], length 0
10:13:41.225800 IP 112.26.0.1.32867 > 112.26.0.8.55628: Flags [.], seq 34085:35513, ack 1, win 1339, options [nop,nop,TS val 411453 ecr 195019,mptcp dss ack 2629537759 seq 2512551769 subseq 34085 len 1428 csum 0x68fe], length 1428
10:13:41.226017 IP 112.26.0.8.55628 > 112.26.0.1.32867: Flags [.], ack 11237, win 2327, options [nop,nop,TS val 196022 ecr 410630,nop,nop,sack 2 {34085:35513}{14093:31229},mptcp dss ack 2512528921], length 0
10:13:41.285593 IP 112.26.0.8.55628 > 112.26.0.1.32867: Flags [.], ack 11237, win 2327, options [nop,nop,TS val 196022 ecr 410630,nop,nop,sack 2 {34085:35513}{14093:31229},mptcp dss ack 2512528921], length 0
10:13:41.312023 IP 112.26.0.1.32867 > 112.26.0.8.55628: Flags [.], seq 36941:38369, ack 1, win 1339, options [nop,nop,TS val 411716 ecr 195098,mptcp dss ack 2629537759 seq 2512554625 subseq 36941 len 1428 csum 0xae16], length 1428
10:13:41.312316 IP 112.26.0.8.55628 > 112.26.0.1.32867: Flags [.], ack 11237, win 2373, options [nop,nop,TS val 196108 ecr 410630,nop,nop,sack 2 {36941:38369}{34085:35513},mptcp dss ack 2512528921], length 0
10:13:41.314404 IP 112.26.0.8.55628 > 112.26.0.1.32867: Flags [.], ack 11237, win 2373, options [nop,nop,TS val 196108 ecr 410630,nop,nop,sack 2 {36941:38369}{34085:35513},mptcp dss ack 2512528921], length 0
10:13:41.394286 IP 112.26.0.1.32867 > 112.26.0.8.55628: Flags [.], seq 11237:12665, ack 1, win 1339, options [nop,nop,TS val 411716 ecr 195190,mptcp dss ack 2629537759 seq 2512528921 subseq 11237 len 1428 csum 0x178d], length 1428
10:13:41.394637 IP 112.26.0.8.55628 > 112.26.0.1.32867: Flags [.], ack 12665, win 2419, options [nop,nop,TS val 196190 ecr 411716,nop,nop,sack 2 {36941:38369}{34085:35513},mptcp dss ack 2512530349], length 0
10:13:41.397895 IP 112.26.0.8.55628 > 112.26.0.1.32867: Flags [.], ack 12665, win 2419, options [nop,nop,TS val 196190 ecr 411716,nop,nop,sack 2 {36941:38369}{34085:35513},mptcp dss ack 2512530349], length 0
10:13:41.489544 IP 112.26.0.1.32867 > 112.26.0.8.55628: Flags [.], seq 38369:39797, ack 1, win 1339, options [nop,nop,TS val 411936 ecr 195387,mptcp dss ack 2629537759 seq 2512556053 subseq 38369 len 1428 csum 0x341c], length 1428
10:13:41.489820 IP 112.26.0.8.55628 > 112.26.0.1.32867: Flags [.], ack 12665, win 2464, options [nop,nop,TS val 196286 ecr 411716,nop,nop,sack 2 {36941:39797}{34085:35513},mptcp dss ack 2512530349], length 0
10:13:41.495372 IP 112.26.0.8.55628 > 112.26.0.1.32867: Flags [.], ack 12665, win 2464, options [nop,nop,TS val 196286 ecr 411716,nop,nop,sack 2 {36941:39797}{34085:35513},mptcp dss ack 2512530349], length 0
10:13:41.579600 IP 112.26.0.1.32867 > 112.26.0.8.55628: Flags [.], seq 39797:41225, ack 1, win 1339, options [nop,nop,TS val 412032 ecr 195487,mptcp dss ack 2629537759 seq 2512557481 subseq 39797 len 1428 csum 0x7f], length 1428
10:13:41.579943 IP 112.26.0.8.55628 > 112.26.0.1.32867: Flags [.], ack 12665, win 2510, options [nop,nop,TS val 196376 ecr 411716,nop,nop,sack 2 {36941:41225}{34085:35513},mptcp dss ack 2512530349], length 0
10:13:41.585361 IP 112.26.0.8.55628 > 112.26.0.1.32867: Flags [.], ack 12665, win 2510, options [nop,nop,TS val 196376 ecr 411716,nop,nop,sack 2 {36941:41225}{34085:35513},mptcp dss ack 2512530349], length 0
10:13:41.614313 IP 112.26.0.1.32867 > 112.26.0.8.55628: Flags [.], seq 41225:42653, ack 1, win 1339, options [nop,nop,TS val 412222 ecr 195678,mptcp dss ack 2629537759 seq 2512558909 subseq 41225 len 1428 csum 0xf9b7], length 1428
10:13:41.614607 IP 112.26.0.8.55628 > 112.26.0.1.32867: Flags [.], ack 12665, win 2555, options [nop,nop,TS val 196410 ecr 411716,nop,nop,sack 2 {36941:42653}{34085:35513},mptcp dss ack 2512530349], length 0
10:13:41.620273 IP 112.26.0.8.55628 > 112.26.0.1.32867: Flags [.], ack 12665, win 2555, options [nop,nop,TS val 196410 ecr 411716,nop,nop,sack 2 {36941:42653}{34085:35513},mptcp dss ack 2512530349], length 0
10:13:41.697666 IP 112.26.0.1.32867 > 112.26.0.8.55628: Flags [.], seq 42653:44081, ack 1, win 1339, options [nop,nop,TS val 412324 ecr 195713,mptcp dss ack 2629537759 seq 2512560337 subseq 42653 len 1428 csum 0x1956], length 1428
10:13:41.697936 IP 112.26.0.8.55628 > 112.26.0.1.32867: Flags [.], ack 12665, win 2601, options [nop,nop,TS val 196494 ecr 411716,nop,nop,sack 2 {36941:44081}{34085:35513},mptcp dss ack 2512530349], length 0
10:13:41.701326 IP 112.26.0.8.55628 > 112.26.0.1.32867: Flags [.], ack 12665, win 2601, options [nop,nop,TS val 196494 ecr 411716,nop,nop,sack 2 {36941:44081}{34085:35513},mptcp dss ack 2512530349], length 0
10:13:41.785269 IP 112.26.0.1.32867 > 112.26.0.8.55628: Flags [.], seq 44081:45509, ack 1, win 1339, options [nop,nop,TS val 412460 ecr 195988,mptcp dss ack 2629537759 seq 2512561765 subseq 44081 len 1428 csum 0x9fc], length 1428
10:13:41.785590 IP 112.26.0.8.55628 > 112.26.0.1.32867: Flags [.], ack 12665, win 2647, options [nop,nop,TS val 196581 ecr 411716,nop,nop,sack 2 {36941:45509}{34085:35513},mptcp dss ack 2512530349], length 0
10:13:41.792389 IP 112.26.0.8.55628 > 112.26.0.1.32867: Flags [.], ack 12665, win 2647, options [nop,nop,TS val 196581 ecr 411716,nop,nop,sack 2 {36941:45509}{34085:35513},mptcp dss ack 2512530349], length 0
10:13:41.811525 IP 112.26.0.1.32867 > 112.26.0.8.55628: Flags [.], seq 31229:32657, ack 1, win 1339, options [nop,nop,TS val 412460 ecr 196022,mptcp dss ack 2629537759 seq 2512548913 subseq 31229 len 1428 csum 0xcc62], length 1428
10:13:41.811791 IP 112.26.0.8.55628 > 112.26.0.1.32867: Flags [.], ack 12665, win 2692, options [nop,nop,TS val 196607 ecr 411716,nop,nop,sack 2 {14093:32657}{36941:45509},mptcp dss ack 2512530349], length 0
10:13:41.817492 IP 112.26.0.8.55628 > 112.26.0.1.32867: Flags [.], ack 12665, win 2692, options [nop,nop,TS val 196607 ecr 411716,nop,nop,sack 2 {14093:32657}{36941:45509},mptcp dss ack 2512530349], length 0
10:13:41.893719 IP 112.26.0.1.32867 > 112.26.0.8.55628: Flags [.], seq 32657:34085, ack 1, win 1339, options [nop,nop,TS val 412547 ecr 196108,mptcp dss ack 2629537759 seq 2512550341 subseq 32657 len 1428 csum 0x480d], length 1428
10:13:41.894063 IP 112.26.0.8.55628 > 112.26.0.1.32867: Flags [.], ack 12665, win 2738, options [nop,nop,TS val 196690 ecr 411716,nop,nop,sack 2 {14093:35513}{36941:45509},mptcp dss ack 2512530349], length 0
10:13:41.921691 IP 112.26.0.8.55628 > 112.26.0.1.32867: Flags [.], ack 12665, win 2738, options [nop,nop,TS val 196690 ecr 411716,nop,nop,sack 2 {14093:35513}{36941:45509},mptcp dss ack 2512530349], length 0
10:13:41.997334 IP 112.26.0.1.32867 > 112.26.0.8.55628: Flags [.], seq 35513:36941, ack 1, win 1339, options [nop,nop,TS val 412620 ecr 196190,mptcp dss ack 2629537759 seq 2512553197 subseq 35513 len 1428 csum 0x55a3], length 1428
10:13:41.997676 IP 112.26.0.8.55628 > 112.26.0.1.32867: Flags [.], ack 12665, win 2784, options [nop,nop,TS val 196793 ecr 411716,nop,nop,sack 1 {14093:45509},mptcp dss ack 2512530349], length 0
10:13:42.003224 IP 112.26.0.8.55628 > 112.26.0.1.32867: Flags [.], ack 12665, win 2784, options [nop,nop,TS val 196793 ecr 411716,nop,nop,sack 1 {14093:45509},mptcp dss ack 2512530349], length 0
10:13:42.027995 IP 112.26.0.1.32867 > 112.26.0.8.55628: Flags [.], seq 45509:46937, ack 1, win 1339, options [nop,nop,TS val 412620 ecr 196190,mptcp dss ack 2629537759 seq 2512563193 subseq 45509 len 1428 csum 0x97a1], length 1428
10:13:42.028390 IP 112.26.0.8.55628 > 112.26.0.1.32867: Flags [.], ack 12665, win 2829, options [nop,nop,TS val 196825 ecr 411716,nop,nop,sack 1 {14093:46937},mptcp dss ack 2512530349], length 0
10:13:42.090441 IP 112.26.0.8.55628 > 112.26.0.1.32867: Flags [.], ack 12665, win 2829, options [nop,nop,TS val 196825 ecr 411716,nop,nop,sack 1 {14093:46937},mptcp dss ack 2512530349], length 0
10:13:42.111848 IP 112.26.0.1.32867 > 112.26.0.8.55628: Flags [.], seq 48365:49793, ack 1, win 1339, options [nop,nop,TS val 412620 ecr 196190,mptcp dss ack 2629537759 seq 2512566049 subseq 48365 len 1428 csum 0x7841], length 1428
10:13:42.112187 IP 112.26.0.8.55628 > 112.26.0.1.32867: Flags [.], ack 12665, win 2875, options [nop,nop,TS val 196909 ecr 411716,nop,nop,sack 2 {48365:49793}{14093:46937},mptcp dss ack 2512530349], length 0
10:13:42.116255 IP 112.26.0.8.55628 > 112.26.0.1.32867: Flags [.], ack 12665, win 2875, options [nop,nop,TS val 196909 ecr 411716,nop,nop,sack 2 {48365:49793}{14093:46937},mptcp dss ack 2512530349], length 0
10:13:42.200159 IP 112.26.0.1.32867 > 112.26.0.8.55628: Flags [.], seq 12665:14093, ack 1, win 1339, options [nop,nop,TS val 412651 ecr 196286,mptcp dss ack 2629537759 seq 2512530349 subseq 12665 len 1428 csum 0x598a], length 1428
10:13:42.200599 IP 112.26.0.8.55628 > 112.26.0.1.32867: Flags [.], ack 46937, win 2920, options [nop,nop,TS val 196997 ecr 412651,nop,nop,sack 1 {48365:49793},mptcp dss ack 2512564621], length 0
10:13:42.208534 IP 112.26.0.8.55628 > 112.26.0.1.32867: Flags [.], ack 46937, win 2920, options [nop,nop,TS val 196997 ecr 412651,nop,nop,sack 1 {48365:49793},mptcp dss ack 2512564621], length 0
10:13:42.291075 IP 112.26.0.1.32867 > 112.26.0.8.55628: Flags [.], seq 49793:51221, ack 1, win 1339, options [nop,nop,TS val 412825 ecr 196376,mptcp dss ack 2629537759 seq 2512567477 subseq 49793 len 1428 csum 0x33f2], length 1428
10:13:42.291430 IP 112.26.0.8.55628 > 112.26.0.1.32867: Flags [.], ack 46937, win 2966, options [nop,nop,TS val 197088 ecr 412651,nop,nop,sack 1 {48365:51221},mptcp dss ack 2512564621], length 0
10:13:42.295999 IP 112.26.0.8.55628 > 112.26.0.1.32867: Flags [.], ack 46937, win 2966, options [nop,nop,TS val 197088 ecr 412651,nop,nop,sack 1 {48365:51221},mptcp dss ack 2512564621], length 0
10:13:42.332684 IP 112.26.0.1.32867 > 112.26.0.8.55628: Flags [.], seq 52649:54077, ack 1, win 1339, options [nop,nop,TS val 412964 ecr 196494,mptcp dss ack 2629537759 seq 2512570333 subseq 52649 len 1428 csum 0x3eeb], length 1428
10:13:42.332996 IP 112.26.0.8.55628 > 112.26.0.1.32867: Flags [.], ack 46937, win 3012, options [nop,nop,TS val 197129 ecr 412651,nop,nop,sack 2 {52649:54077}{48365:51221},mptcp dss ack 2512564621], length 0
10:13:42.336603 IP 112.26.0.8.55628 > 112.26.0.1.32867: Flags [.], ack 46937, win 3012, options [nop,nop,TS val 197129 ecr 412651,nop,nop,sack 2 {52649:54077}{48365:51221},mptcp dss ack 2512564621], length 0
10:13:42.418062 IP 112.26.0.1.32867 > 112.26.0.8.55628: Flags [.], seq 54077:55505, ack 1, win 1339, options [nop,nop,TS val 413048 ecr 196581,mptcp dss ack 2629537759 seq 2512571761 subseq 54077 len 1428 csum 0x3bf7], length 1428
10:13:42.418401 IP 112.26.0.8.55628 > 112.26.0.1.32867: Flags [.], ack 46937, win 3057, options [nop,nop,TS val 197215 ecr 412651,nop,nop,sack 2 {52649:55505}{48365:51221},mptcp dss ack 2512564621], length 0
10:13:42.428315 IP 112.26.0.8.55628 > 112.26.0.1.32867: Flags [.], ack 46937, win 3057, options [nop,nop,TS val 197215 ecr 412651,nop,nop,sack 2 {52649:55505}{48365:51221},mptcp dss ack 2512564621], length 0
10:13:42.609640 IP 112.26.0.1.32867 > 112.26.0.8.55628: Flags [.], seq 55505:56933, ack 1, win 1339, options [nop,nop,TS val 413259 ecr 196607,mptcp dss ack 2629537759 seq 2512573189 subseq 55505 len 1428 csum 0x73f1], length 1428
10:13:42.610002 IP 112.26.0.8.55628 > 112.26.0.1.32867: Flags [.], ack 46937, win 3103, options [nop,nop,TS val 197406 ecr 412651,nop,nop,sack 2 {52649:56933}{48365:51221},mptcp dss ack 2512564621], length 0
10:13:42.615332 IP 112.26.0.8.55628 > 112.26.0.1.32867: Flags [.], ack 46937, win 3103, options [nop,nop,TS val 197406 ecr 412651,nop,nop,sack 2 {52649:56933}{48365:51221},mptcp dss ack 2512564621], length 0
10:13:42.703127 IP 112.26.0.1.32867 > 112.26.0.8.55628: Flags [.], seq 56933:58361, ack 1, win 1339, options [nop,nop,TS val 413356 ecr 196690,mptcp dss ack 2629537759 seq 2512574617 subseq 56933 len 1428 csum 0x897b], length 1428
10:13:42.703451 IP 112.26.0.8.55628 > 112.26.0.1.32867: Flags [.], ack 46937, win 3149, options [nop,nop,TS val 197500 ecr 412651,nop,nop,sack 2 {52649:58361}{48365:51221},mptcp dss ack 2512564621], length 0
10:13:42.708385 IP 112.26.0.8.55628 > 112.26.0.1.32867: Flags [.], ack 46937, win 3149, options [nop,nop,TS val 197500 ecr 412651,nop,nop,sack 2 {52649:58361}{48365:51221},mptcp dss ack 2512564621], length 0
10:13:42.791767 IP 112.26.0.1.32867 > 112.26.0.8.55628: Flags [.], seq 58361:59789, ack 1, win 1339, options [nop,nop,TS val 413435 ecr 196793,mptcp dss ack 2629537759 seq 2512576045 subseq 58361 len 1428 csum 0xf788], length 1428
10:13:42.792122 IP 112.26.0.8.55628 > 112.26.0.1.32867: Flags [.], ack 46937, win 3194, options [nop,nop,TS val 197588 ecr 412651,nop,nop,sack 2 {52649:59789}{48365:51221},mptcp dss ack 2512564621], length 0
10:13:42.798457 IP 112.26.0.8.55628 > 112.26.0.1.32867: Flags [.], ack 46937, win 3194, options [nop,nop,TS val 197588 ecr 412651,nop,nop,sack 2 {52649:59789}{48365:51221},mptcp dss ack 2512564621], length 0
10:13:42.820433 IP 112.26.0.1.32867 > 112.26.0.8.55628: Flags [.], seq 59789:61217, ack 1, win 1339, options [nop,nop,TS val 413465 ecr 196825,mptcp dss ack 2629537759 seq 2512577473 subseq 59789 len 1428 csum 0x846e], length 1428
10:13:42.820727 IP 112.26.0.8.55628 > 112.26.0.1.32867: Flags [.], ack 46937, win 3240, options [nop,nop,TS val 197617 ecr 412651,nop,nop,sack 2 {52649:61217}{48365:51221},mptcp dss ack 2512564621], length 0
10:13:42.828085 IP 112.26.0.8.55628 > 112.26.0.1.32867: Flags [.], ack 46937, win 3240, options [nop,nop,TS val 197617 ecr 412651,nop,nop,sack 2 {52649:61217}{48365:51221},mptcp dss ack 2512564621], length 0
10:13:42.908403 IP 112.26.0.1.32867 > 112.26.0.8.55628: Flags [.], seq 46937:48365, ack 1, win 1339, options [nop,nop,TS val 413465 ecr 196909,mptcp dss ack 2629537759 seq 2512564621 subseq 46937 len 1428 csum 0xe63a], length 1428
10:13:42.908794 IP 112.26.0.8.55628 > 112.26.0.1.32867: Flags [.], ack 51221, win 3285, options [nop,nop,TS val 197705 ecr 413465,nop,nop,sack 1 {52649:61217},mptcp dss ack 2512568905], length 0
10:13:42.912543 IP 112.26.0.8.55628 > 112.26.0.1.32867: Flags [.], ack 51221, win 3285, options [nop,nop,TS val 197705 ecr 413465,nop,nop,sack 1 {52649:61217},mptcp dss ack 2512568905], length 0
10:13:42.999957 IP 112.26.0.1.32867 > 112.26.0.8.55628: Flags [.], seq 61217:62645, ack 1, win 1339, options [nop,nop,TS val 413547 ecr 196997,mptcp dss ack 2629537759 seq 2512578901 subseq 61217 len 1428 csum 0x12a7], length 1428
10:13:43.000236 IP 112.26.0.8.55628 > 112.26.0.1.32867: Flags [.], ack 51221, win 3331, options [nop,nop,TS val 197796 ecr 413465,nop,nop,sack 1 {52649:62645},mptcp dss ack 2512568905], length 0
10:13:43.005313 IP 112.26.0.8.55628 > 112.26.0.1.32867: Flags [.], ack 51221, win 3331, options [nop,nop,TS val 197796 ecr 413465,nop,nop,sack 1 {52649:62645},mptcp dss ack 2512568905], length 0
10:13:43.103527 IP 112.26.0.1.32867 > 112.26.0.8.55628: Flags [.], seq 64073:65501, ack 1, win 1339, options [nop,nop,TS val 413649 ecr 197088,mptcp dss ack 2629537759 seq 2512581757 subseq 64073 len 1428 csum 0x3ead], length 1428
10:13:43.103821 IP 112.26.0.8.55628 > 112.26.0.1.32867: Flags [.], ack 51221, win 3377, options [nop,nop,TS val 197900 ecr 413465,nop,nop,sack 2 {64073:65501}{52649:62645},mptcp dss ack 2512568905], length 0
10:13:43.107283 IP 112.26.0.8.55628 > 112.26.0.1.32867: Flags [.], ack 51221, win 3377, options [nop,nop,TS val 197900 ecr 413465,nop,nop,sack 2 {64073:65501}{52649:62645},mptcp dss ack 2512568905], length 0
10:13:43.202610 IP 112.26.0.1.32867 > 112.26.0.8.55628: Flags [.], seq 65501:66929, ack 1, win 1339, options [nop,nop,TS val 413763 ecr 197215,mptcp dss ack 2629537759 seq 2512583185 subseq 65501 len 1428 csum 0x1fc2], length 1428
10:13:43.202930 IP 112.26.0.8.55628 > 112.26.0.1.32867: Flags [.], ack 51221, win 3422, options [nop,nop,TS val 197999 ecr 413465,nop,nop,sack 2 {64073:66929}{52649:62645},mptcp dss ack 2512568905], length 0
10:13:43.206203 IP 112.26.0.8.55628 > 112.26.0.1.32867: Flags [.], ack 51221, win 3422, options [nop,nop,TS val 197999 ecr 413465,nop,nop,sack 2 {64073:66929}{52649:62645},mptcp dss ack 2512568905], length 0
10:13:43.238443 IP 112.26.0.1.32867 > 112.26.0.8.55628: Flags [.], seq 66929:68357, ack 1, win 1339, options [nop,nop,TS val 414027 ecr 197588,mptcp dss ack 2629537759 seq 2512584613 subseq 66929 len 1428 csum 0xa71e], length 1428
10:13:43.238801 IP 112.26.0.8.55628 > 112.26.0.1.32867: Flags [.], ack 51221, win 3468, options [nop,nop,TS val 198035 ecr 413465,nop,nop,sack 2 {64073:68357}{52649:62645},mptcp dss ack 2512568905], length 0
10:13:43.241846 IP 112.26.0.8.55628 > 112.26.0.1.32867: Flags [.], ack 51221, win 3468, options [nop,nop,TS val 198035 ecr 413465,nop,nop,sack 2 {64073:68357}{52649:62645},mptcp dss ack 2512568905], length 0
10:13:43.323079 IP 112.26.0.1.32867 > 112.26.0.8.55628: Flags [.], seq 68357:69785, ack 1, win 1339, options [nop,nop,TS val 414067 ecr 197617,mptcp dss ack 2629537759 seq 2512586041 subseq 68357 len 1428 csum 0xec16], length 1428
10:13:43.323357 IP 112.26.0.8.55628 > 112.26.0.1.32867: Flags [.], ack 51221, win 3514, options [nop,nop,TS val 198119 ecr 413465,nop,nop,sack 2 {64073:69785}{52649:62645},mptcp dss ack 2512568905], length 0
10:13:43.337493 IP 112.26.0.8.55628 > 112.26.0.1.32867: Flags [.], ack 51221, win 3514, options [nop,nop,TS val 198119 ecr 413465,nop,nop,sack 2 {64073:69785}{52649:62645},mptcp dss ack 2512568905], length 0
10:13:43.408216 IP 112.26.0.1.32867 > 112.26.0.8.55628: Flags [.], seq 69785:71213, ack 1, win 1339, options [nop,nop,TS val 414067 ecr 197705,mptcp dss ack 2629537759 seq 2512587469 subseq 69785 len 1428 csum 0xb5c5], length 1428
10:13:43.408577 IP 112.26.0.8.55628 > 112.26.0.1.32867: Flags [.], ack 51221, win 3559, options [nop,nop,TS val 198205 ecr 413465,nop,nop,sack 2 {64073:71213}{52649:62645},mptcp dss ack 2512568905], length 0
10:13:43.416508 IP 112.26.0.8.55628 > 112.26.0.1.32867: Flags [.], ack 51221, win 3559, options [nop,nop,TS val 198205 ecr 413465,nop,nop,sack 2 {64073:71213}{52649:62645},mptcp dss ack 2512568905], length 0
10:13:43.435555 IP 112.26.0.1.32867 > 112.26.0.8.55628: Flags [.], seq 71213:72641, ack 1, win 1339, options [nop,nop,TS val 414331 ecr 197796,mptcp dss ack 2629537759 seq 2512588897 subseq 71213 len 1428 csum 0xf072], length 1428
10:13:43.435873 IP 112.26.0.8.55628 > 112.26.0.1.32867: Flags [.], ack 51221, win 3605, options [nop,nop,TS val 198232 ecr 413465,nop,nop,sack 2 {64073:72641}{52649:62645},mptcp dss ack 2512568905], length 0
10:13:43.493130 IP 112.26.0.8.55628 > 112.26.0.1.32867: Flags [.], ack 51221, win 3605, options [nop,nop,TS val 198232 ecr 413465,nop,nop,sack 2 {64073:72641}{52649:62645},mptcp dss ack 2512568905], length 0
10:13:43.519396 IP 112.26.0.1.32867 > 112.26.0.8.55628: Flags [.], seq 62645:64073, ack 1, win 1339, options [nop,nop,TS val 414331 ecr 197900,mptcp dss ack 2629537759 seq 2512580329 subseq 62645 len 1428 csum 0x642d], length 1428
10:13:43.519619 IP 112.26.0.8.55628 > 112.26.0.1.32867: Flags [.], ack 51221, win 3650, options [nop,nop,TS val 198316 ecr 413465,nop,nop,sack 1 {52649:72641},mptcp dss ack 2512568905], length 0
10:13:43.521533 IP 112.26.0.8.55628 > 112.26.0.1.32867: Flags [.], ack 51221, win 3650, options [nop,nop,TS val 198316 ecr 413465,nop,nop,sack 1 {52649:72641},mptcp dss ack 2512568905], length 0
10:13:43.608588 IP 112.26.0.1.32867 > 112.26.0.8.55628: Flags [.], seq 51221:52649, ack 1, win 1339, options [nop,nop,TS val 414449 ecr 197999,mptcp dss ack 2629537759 seq 2512568905 subseq 51221 len 1428 csum 0x277], length 1428
10:13:43.608930 IP 112.26.0.8.55628 > 112.26.0.1.32867: Flags [.], ack 72641, win 3696, options [nop,nop,TS val 198405 ecr 414449,mptcp dss ack 2512590325], length 0
10:13:43.611166 IP 112.26.0.8.55628 > 112.26.0.1.32867: Flags [.], ack 72641, win 3696, options [nop,nop,TS val 198405 ecr 414449,mptcp dss ack 2512590325], length 0
10:13:43.691958 IP 112.26.0.1.32867 > 112.26.0.8.55628: Flags [.], seq 72641:74069, ack 1, win 1339, options [nop,nop,TS val 414638 ecr 198035,mptcp dss ack 2629537759 seq 2512590325 subseq 72641 len 1428 csum 0x2120], length 1428
10:13:43.692366 IP 112.26.0.8.55628 > 112.26.0.1.32867: Flags [.], ack 74069, win 3742, options [nop,nop,TS val 198489 ecr 414638,mptcp dss ack 2512591753], length 0
10:13:43.699665 IP 112.26.0.8.55628 > 112.26.0.1.32867: Flags [.], ack 74069, win 3742, options [nop,nop,TS val 198489 ecr 414638,mptcp dss ack 2512591753], length 0
10:13:43.729579 IP 112.26.0.1.32867 > 112.26.0.8.55628: Flags [.], seq 74069:75497, ack 1, win 1339, options [nop,nop,TS val 414771 ecr 198119,mptcp dss ack 2629537759 seq 2512591753 subseq 74069 len 1428 csum 0xc080], length 1428
10:13:43.729951 IP 112.26.0.8.55628 > 112.26.0.1.32867: Flags [.], ack 75497, win 3787, options [nop,nop,TS val 198526 ecr 414771,mptcp dss ack 2512593181], length 0
10:13:43.734888 IP 112.26.0.8.55628 > 112.26.0.1.32867: Flags [.], ack 75497, win 3787, options [nop,nop,TS val 198526 ecr 414771,mptcp dss ack 2512593181], length 0
10:13:43.810290 IP 112.26.0.1.32867 > 112.26.0.8.55628: Flags [.], seq 75497:76925, ack 1, win 1339, options [nop,nop,TS val 414854 ecr 198205,mptcp dss ack 2629537759 seq 2512593181 subseq 75497 len 1428 csum 0x2b68], length 1428
10:13:43.810681 IP 112.26.0.8.55628 > 112.26.0.1.32867: Flags [.], ack 76925, win 3833, options [nop,nop,TS val 198607 ecr 414854,mptcp dss ack 2512594609], length 0
10:13:43.814263 IP 112.26.0.8.55628 > 112.26.0.1.32867: Flags [.], ack 76925, win 3833, options [nop,nop,TS val 198607 ecr 414854,mptcp dss ack 2512594609], length 0
10:13:43.836385 IP 112.26.0.1.32867 > 112.26.0.8.55628: Flags [.], seq 76925:78353, ack 1, win 1339, options [nop,nop,TS val 414936 ecr 198232,mptcp dss ack 2629537759 seq 2512594609 subseq 76925 len 1428 csum 0xc0f2], length 1428
10:13:43.836705 IP 112.26.0.8.55628 > 112.26.0.1.32867: Flags [.], ack 78353, win 3879, options [nop,nop,TS val 198633 ecr 414936,mptcp dss ack 2512596037], length 0
10:13:43.893919 IP 112.26.0.8.55628 > 112.26.0.1.32867: Flags [.], ack 78353, win 3879, options [nop,nop,TS val 198633 ecr 414936,mptcp dss ack 2512596037], length 0
10:13:43.930591 IP 112.26.0.1.32867 > 112.26.0.8.55628: Flags [.], seq 78353:79781, ack 1, win 1339, options [nop,nop,TS val 414966 ecr 198316,mptcp dss ack 2629537759 seq 2512596037 subseq 78353 len 1428 csum 0xfc4e], length 1428
10:13:43.930905 IP 112.26.0.8.55628 > 112.26.0.1.32867: Flags [.], ack 79781, win 3924, options [nop,nop,TS val 198727 ecr 414966,mptcp dss ack 2512597465], length 0
10:13:43.933139 IP 112.26.0.8.55628 > 112.26.0.1.32867: Flags [.], ack 79781, win 3924, options [nop,nop,TS val 198727 ecr 414966,mptcp dss ack 2512597465], length 0
10:13:44.008630 IP 112.26.0.1.32867 > 112.26.0.8.55628: Flags [.], seq 79781:81209, ack 1, win 1339, options [nop,nop,TS val 414966 ecr 198405,mptcp dss ack 2629537759 seq 2512597465 subseq 79781 len 1428 csum 0x3c22], length 1428
10:13:44.008999 IP 112.26.0.8.55628 > 112.26.0.1.32867: Flags [.], ack 81209, win 3970, options [nop,nop,TS val 198805 ecr 414966,mptcp dss ack 2512598893], length 0
10:13:44.034621 IP 112.26.0.1.32867 > 112.26.0.8.55628: Flags [.], seq 81209:82637, ack 1, win 1339, options [nop,nop,TS val 414966 ecr 198405,mptcp dss ack 2629537759 seq 2512598893 subseq 81209 len 1428 csum 0xdba], length 1428
10:13:44.035010 IP 112.26.0.8.55628 > 112.26.0.1.32867: Flags [.], ack 82637, win 4015, options [nop,nop,TS val 198831 ecr 414966,mptcp dss ack 2512600321], length 0
10:13:44.051675 IP 112.26.0.8.55628 > 112.26.0.1.32867: Flags [.], ack 81209, win 3970, options [nop,nop,TS val 198805 ecr 414966,mptcp dss ack 2512598893], length 0
10:13:44.100149 IP 112.26.0.8.55628 > 112.26.0.1.32867: Flags [.], ack 82637, win 4015, options [nop,nop,TS val 198831 ecr 414966,mptcp dss ack 2512600321], length 0
10:13:44.132025 IP 112.26.0.1.32867 > 112.26.0.8.55628: Flags [.], seq 82637:84065, ack 1, win 1339, options [nop,nop,TS val 414966 ecr 198405,mptcp dss ack 2629537759 seq 2512600321 subseq 82637 len 1428 csum 0x8ae9], length 1428
10:13:44.132397 IP 112.26.0.8.55628 > 112.26.0.1.32867: Flags [.], ack 84065, win 4061, options [nop,nop,TS val 198928 ecr 414966,mptcp dss ack 2512601749], length 0
10:13:44.136655 IP 112.26.0.8.55628 > 112.26.0.1.32867: Flags [.], ack 84065, win 4061, options [nop,nop,TS val 198928 ecr 414966,mptcp dss ack 2512601749], length 0
