10:13:38.182803 IP 112.26.0.8.55628 > 112.26.0.1.32867: Flags [S], seq 2658481551, win 65535, options [mss 1460,sackOK,TS val 192900 ecr 0,nop,wscale 6,mptcp capable csum {0xdc727f1fb0e9a5a5}], length 0
10:13:39.184040 IP 112.26.0.8.55628 > 112.26.0.1.32867: Flags [S], seq 2658481551, win 65535, options [mss 1460,sackOK,TS val 193920 ecr 0,nop,wscale 6,mptcp capable csum {0xdc727f1fb0e9a5a5}], length 0
10:13:39.273913 IP 112.26.0.1.32867 > 112.26.0.8.55628: Flags [S.], seq 4257355291, ack 2658481552, win 65535, options [mss 1460,sackOK,TS val 409321 ecr 192900,nop,wscale 6,mptcp capable csum {0x582fbc62dbc049b6}], length 0
10:13:39.282983 IP 112.26.0.1.32867 > 112.26.0.8.55628: Flags [S.], seq 4257355291, ack 2658481552, win 65535, options [mss 1460,sackOK,TS val 410323 ecr 192900,nop,wscale 6,mptcp capable csum {0x582fbc62dbc049b6}], length 0
10:13:39.293521 IP 112.26.0.1.32867 > 112.26.0.8.55628: Flags [S.], seq 4257355291, ack 2658481552, win 65535, options [mss 1460,sackOK,TS val 409321 ecr 192900,nop,wscale 6,mptcp capable csum {0x582fbc62dbc049b6}], length 0
10:13:39.293548 IP 112.26.0.1.32867 > 112.26.0.8.55628: Flags [S.], seq 4257355291, ack 2658481552, win 65535, options [mss 1460,sackOK,TS val 410323 ecr 192900,nop,wscale 6,mptcp capable csum {0x582fbc62dbc049b6}], length 0
10:13:39.381787 IP 112.26.0.1.32867 > 112.26.0.8.55628: Flags [S.], seq 4257355291, ack 2658481552, win 65535, options [mss 1460,sackOK,TS val 409321 ecr 192900,nop,wscale 6,mptcp capable csum {0x582fbc62dbc049b6}], length 0
10:13:39.396149 IP 112.26.0.1.32867 > 112.26.0.8.55628: Flags [S.], seq 4257355291, ack 2658481552, win 65535, options [mss 1460,sackOK,TS val 410323 ecr 192900,nop,wscale 6,mptcp capable csum {0x582fbc62dbc049b6}], length 0
10:13:39.479782 IP 112.26.0.8.55628 > 112.26.0.1.32867: Flags [.], ack 1, win 1369, options [nop,nop,TS val 194178 ecr 409321,mptcp capable csum {0xdc727f1fb0e9a5a5,0x582fbc62dbc049b6},mptcp dss ack 2512517685], length 0
10:13:39.482567 IP 112.26.0.1.32867 > 112.26.0.8.55628: Flags [.], ack 1, win 1339, options [nop,nop,TS val 410619 ecr 194178,mptcp add-addr id 3 112.26.1.1,mptcp dss ack 2629537759], length 0
10:13:39.482804 IP 112.26.0.1.32867 > 112.26.0.8.55628: Flags [.], ack 1, win 1339, options [nop,nop,TS val 410619 ecr 194178,mptcp add-addr id 3 112.26.1.1,mptcp dss ack 2629537759], length 0
10:13:39.489071 IP 112.26.0.1.32867 > 112.26.0.8.55628: Flags [.], ack 1, win 1339, options [nop,nop,TS val 410619 ecr 194178,mptcp add-addr id 3 112.26.1.1,mptcp dss ack 2629537759], length 0
10:13:39.508168 IP 112.26.0.1.32867 > 112.26.0.8.55628: Flags [.], ack 1, win 1339, options [nop,nop,TS val 410619 ecr 194178,mptcp add-addr id 5 112.26.3.1,mptcp dss ack 2629537759], length 0
10:13:39.508307 IP 112.26.0.1.32867 > 112.26.0.8.55628: Flags [.], ack 1, win 1339, options [nop,nop,TS val 410619 ecr 194178,mptcp add-addr id 5 112.26.3.1,mptcp dss ack 2629537759], length 0
10:13:39.522679 IP 112.26.0.8.55628 > 112.26.0.1.32867: Flags [.], ack 1, win 1369, options [nop,nop,TS val 194179 ecr 409321,mptcp add-addr id 4 112.26.2.8,mptcp dss ack 2512517685], length 0
10:13:39.527278 IP 112.26.0.1.32867 > 112.26.0.8.55628: Flags [.], ack 1, win 1339, options [nop,nop,TS val 410619 ecr 194178,mptcp add-addr id 5 112.26.3.1,mptcp dss ack 2629537759], length 0
10:13:39.578360 IP 112.26.0.1.32867 > 112.26.0.8.55628: Flags [.], ack 1, win 1339, options [nop,nop,TS val 410619 ecr 194178,mptcp add-addr id 6 112.26.2.1,mptcp dss ack 2629537759], length 0
10:13:39.578557 IP 112.26.0.1.32867 > 112.26.0.8.55628: Flags [.], ack 1, win 1339, options [nop,nop,TS val 410619 ecr 194178,mptcp add-addr id 6 112.26.2.1,mptcp dss ack 2629537759], length 0
10:13:39.596038 IP 112.26.0.1.32867 > 112.26.0.8.55628: Flags [.], seq 1:1429, ack 1, win 1339, options [nop,nop,TS val 410629 ecr 194178,mptcp dss ack 2629537759 seq 2512517685 subseq 1 len 1428 csum 0xd56d], length 1428
10:13:39.596194 IP 112.26.0.1.32867 > 112.26.0.8.55628: Flags [.], seq 1:1429, ack 1, win 1339, options [nop,nop,TS val 410629 ecr 194178,mptcp dss ack 2629537759 seq 2512517685 subseq 1 len 1428 csum 0xd56d], length 1428
10:13:39.600412 IP 112.26.0.8.55628 > 112.26.0.1.32867: Flags [.], ack 1, win 1369, options [nop,nop,TS val 194179 ecr 409321,mptcp add-addr id 5 112.26.3.8,mptcp dss ack 2512517685], length 0
10:13:39.607589 IP 112.26.0.1.32867 > 112.26.0.8.55628: Flags [.], ack 1, win 1339, options [nop,nop,TS val 410619 ecr 194178,mptcp add-addr id 6 112.26.2.1,mptcp dss ack 2629537759], length 0
10:13:39.677292 IP 112.26.0.8.55628 > 112.26.0.1.32867: Flags [.], ack 1, win 1369, options [nop,nop,TS val 194179 ecr 409321,mptcp add-addr id 6 112.26.1.8,mptcp dss ack 2512517685], length 0
10:13:39.681575 IP 112.26.0.1.32867 > 112.26.0.8.55628: Flags [.], seq 1429:2857, ack 1, win 1339, options [nop,nop,TS val 410629 ecr 194178,mptcp dss ack 2629537759 seq 2512519113 subseq 1429 len 1428 csum 0xf4bb], length 1428
10:13:39.681758 IP 112.26.0.1.32867 > 112.26.0.8.55628: Flags [.], seq 1429:2857, ack 1, win 1339, options [nop,nop,TS val 410629 ecr 194178,mptcp dss ack 2629537759 seq 2512519113 subseq 1429 len 1428 csum 0xf4bb], length 1428
10:13:39.685719 IP 112.26.0.1.32867 > 112.26.0.8.55628: Flags [.], seq 1:1429, ack 1, win 1339, options [nop,nop,TS val 410629 ecr 194178,mptcp dss ack 2629537759 seq 2512517685 subseq 1 len 1428 csum 0xd56d], length 1428
10:13:39.703532 IP 112.26.0.8.55628 > 112.26.0.1.32867: Flags [.], ack 1, win 1369, options [nop,nop,TS val 194193 ecr 409321,mptcp dss ack 2512517685], length 0
10:13:39.774740 IP 112.26.0.1.32867 > 112.26.0.8.55628: Flags [P.], seq 2857:4097, ack 1, win 1339, options [nop,nop,TS val 410629 ecr 194178,mptcp dss ack 2629537759 seq 2512520541 subseq 2857 len 1240 csum 0x358e], length 1240
10:13:39.775045 IP 112.26.0.1.32867 > 112.26.0.8.55628: Flags [P.], seq 2857:4097, ack 1, win 1339, options [nop,nop,TS val 410629 ecr 194178,mptcp dss ack 2629537759 seq 2512520541 subseq 2857 len 1240 csum 0x358e], length 1240
10:13:39.785100 IP 112.26.0.1.32867 > 112.26.0.8.55628: Flags [.], seq 1429:2857, ack 1, win 1339, options [nop,nop,TS val 410629 ecr 194178,mptcp dss ack 2629537759 seq 2512519113 subseq 1429 len 1428 csum 0xf4bb], length 1428
10:13:39.795578 IP 112.26.0.8.55628 > 112.26.0.1.32867: Flags [.], ack 1429, win 1415, options [nop,nop,TS val 194482 ecr 410629,mptcp dss ack 2512519113], length 0
10:13:39.798072 IP 112.26.0.1.32867 > 112.26.0.8.55628: Flags [.], seq 4097:5525, ack 1, win 1339, options [nop,nop,TS val 410629 ecr 194178,mptcp dss ack 2629537759 seq 2512521781 subseq 4097 len 1428 csum 0x29c7], length 1428
10:13:39.798266 IP 112.26.0.1.32867 > 112.26.0.8.55628: Flags [.], seq 4097:5525, ack 1, win 1339, options [nop,nop,TS val 410629 ecr 194178,mptcp dss ack 2629537759 seq 2512521781 subseq 4097 len 1428 csum 0x29c7], length 1428
10:13:39.807349 IP 112.26.0.1.32867 > 112.26.0.8.55628: Flags [.], seq 5525:6953, ack 1, win 1339, options [nop,nop,TS val 410629 ecr 194178,mptcp dss ack 2629537759 seq 2512523209 subseq 5525 len 1428 csum 0x863c], length 1428
10:13:39.807544 IP 112.26.0.1.32867 > 112.26.0.8.55628: Flags [.], seq 5525:6953, ack 1, win 1339, options [nop,nop,TS val 410629 ecr 194178,mptcp dss ack 2629537759 seq 2512523209 subseq 5525 len 1428 csum 0x863c], length 1428
10:13:39.877775 IP 112.26.0.8.55628 > 112.26.0.1.32867: Flags [.], ack 2857, win 1460, options [nop,nop,TS val 194516 ecr 410629,mptcp dss ack 2512520541], length 0
10:13:39.883437 IP 112.26.0.1.32867 > 112.26.0.8.55628: Flags [P.], seq 2857:4097, ack 1, win 1339, options [nop,nop,TS val 410629 ecr 194178,mptcp dss ack 2629537759 seq 2512520541 subseq 2857 len 1240 csum 0x358e], length 1240
10:13:39.896787 IP 112.26.0.1.32867 > 112.26.0.8.55628: Flags [.], seq 6953:8381, ack 1, win 1339, options [nop,nop,TS val 410629 ecr 194178,mptcp dss ack 2629537759 seq 2512524637 subseq 6953 len 1428 csum 0x2009], length 1428
10:13:39.896978 IP 112.26.0.1.32867 > 112.26.0.8.55628: Flags [.], seq 6953:8381, ack 1, win 1339, options [nop,nop,TS val 410629 ecr 194178,mptcp dss ack 2629537759 seq 2512524637 subseq 6953 len 1428 csum 0x2009], length 1428
10:13:39.907767 IP 112.26.0.1.32867 > 112.26.0.8.55628: Flags [.], seq 8381:9809, ack 1, win 1339, options [nop,nop,TS val 410630 ecr 194178,mptcp dss ack 2629537759 seq 2512526065 subseq 8381 len 1428 csum 0xef9a], length 1428
10:13:39.907952 IP 112.26.0.1.32867 > 112.26.0.8.55628: Flags [.], seq 8381:9809, ack 1, win 1339, options [nop,nop,TS val 410630 ecr 194178,mptcp dss ack 2629537759 seq 2512526065 subseq 8381 len 1428 csum 0xef9a], length 1428
10:13:39.920362 IP 112.26.0.1.32867 > 112.26.0.8.55628: Flags [.], seq 4097:5525, ack 1, win 1339, options [nop,nop,TS val 410629 ecr 194178,mptcp dss ack 2629537759 seq 2512521781 subseq 4097 len 1428 csum 0x29c7], length 1428
10:13:39.974563 IP 112.26.0.8.55628 > 112.26.0.1.32867: Flags [.], ack 4097, win 1506, options [nop,nop,TS val 194672 ecr 410629,mptcp dss ack 2512521781], length 0
10:13:39.985403 IP 112.26.0.1.32867 > 112.26.0.8.55628: Flags [.], seq 9809:11237, ack 1, win 1339, options [nop,nop,TS val 410630 ecr 194178,mptcp dss ack 2629537759 seq 2512527493 subseq 9809 len 1428 csum 0xe806], length 1428
10:13:39.985592 IP 112.26.0.1.32867 > 112.26.0.8.55628: Flags [.], seq 9809:11237, ack 1, win 1339, options [nop,nop,TS val 410630 ecr 194178,mptcp dss ack 2629537759 seq 2512527493 subseq 9809 len 1428 csum 0xe806], length 1428
10:13:40.015592 IP 112.26.0.1.32867 > 112.26.0.8.55628: Flags [.], seq 14093:15521, ack 1, win 1339, options [nop,nop,TS val 410934 ecr 194482,mptcp dss ack 2629537759 seq 2512531777 subseq 14093 len 1428 csum 0xac23], length 1428
10:13:40.015810 IP 112.26.0.1.32867 > 112.26.0.8.55628: Flags [.], seq 14093:15521, ack 1, win 1339, options [nop,nop,TS val 410934 ecr 194482,mptcp dss ack 2629537759 seq 2512531777 subseq 14093 len 1428 csum 0xac23], length 1428
10:13:40.070214 IP 112.26.0.8.55628 > 112.26.0.1.32867: Flags [.], ack 5525, win 1552, options [nop,nop,TS val 194708 ecr 410629,mptcp dss ack 2512523209], length 0
10:13:40.072986 IP 112.26.0.1.32867 > 112.26.0.8.55628: Flags [.], seq 5525:6953, ack 1, win 1339, options [nop,nop,TS val 410629 ecr 194178,mptcp dss ack 2629537759 seq 2512523209 subseq 5525 len 1428 csum 0x863c], length 1428
10:13:40.099186 IP 112.26.0.1.32867 > 112.26.0.8.55628: Flags [.], seq 6953:8381, ack 1, win 1339, options [nop,nop,TS val 410629 ecr 194178,mptcp dss ack 2629537759 seq 2512524637 subseq 6953 len 1428 csum 0x2009], length 1428
10:13:40.102581 IP 112.26.0.1.32867 > 112.26.0.8.55628: Flags [.], seq 15521:16949, ack 1, win 1339, options [nop,nop,TS val 410934 ecr 194482,mptcp dss ack 2629537759 seq 2512533205 subseq 15521 len 1428 csum 0x177f], length 1428
10:13:40.102824 IP 112.26.0.1.32867 > 112.26.0.8.55628: Flags [.], seq 15521:16949, ack 1, win 1339, options [nop,nop,TS val 410934 ecr 194482,mptcp dss ack 2629537759 seq 2512533205 subseq 15521 len 1428 csum 0x177f], length 1428
10:13:40.113323 IP 112.26.0.8.55628 > 112.26.0.1.32867: Flags [.], ack 6953, win 1597, options [nop,nop,TS val 194808 ecr 410629,mptcp dss ack 2512524637], length 0
10:13:40.174181 IP 112.26.0.1.32867 > 112.26.0.8.55628: Flags [.], seq 16949:18377, ack 1, win 1339, options [nop,nop,TS val 411016 ecr 194516,mptcp dss ack 2629537759 seq 2512534633 subseq 16949 len 1428 csum 0xd3], length 1428
10:13:40.174460 IP 112.26.0.1.32867 > 112.26.0.8.55628: Flags [.], seq 16949:18377, ack 1, win 1339, options [nop,nop,TS val 411016 ecr 194516,mptcp dss ack 2629537759 seq 2512534633 subseq 16949 len 1428 csum 0xd3], length 1428
10:13:40.183837 IP 112.26.0.8.55628 > 112.26.0.1.32867: Flags [.], ack 8381, win 1643, options [nop,nop,TS val 194890 ecr 410629,mptcp dss ack 2512526065], length 0
10:13:40.196212 IP 112.26.0.1.32867 > 112.26.0.8.55628: Flags [.], seq 8381:9809, ack 1, win 1339, options [nop,nop,TS val 410630 ecr 194178,mptcp dss ack 2629537759 seq 2512526065 subseq 8381 len 1428 csum 0xef9a], length 1428
10:13:40.207131 IP 112.26.0.8.55628 > 112.26.0.1.32867: Flags [.], ack 9809, win 1689, options [nop,nop,TS val 194992 ecr 410630,mptcp dss ack 2512527493], length 0
10:13:40.215905 IP 112.26.0.1.32867 > 112.26.0.8.55628: Flags [.], seq 18377:19805, ack 1, win 1339, options [nop,nop,TS val 411016 ecr 194516,mptcp dss ack 2629537759 seq 2512536061 subseq 18377 len 1428 csum 0xa1f], length 1428
10:13:40.216112 IP 112.26.0.1.32867 > 112.26.0.8.55628: Flags [.], seq 18377:19805, ack 1, win 1339, options [nop,nop,TS val 411016 ecr 194516,mptcp dss ack 2629537759 seq 2512536061 subseq 18377 len 1428 csum 0xa1f], length 1428
10:13:40.226731 IP 112.26.0.1.32867 > 112.26.0.8.55628: Flags [.], seq 9809:11237, ack 1, win 1339, options [nop,nop,TS val 410630 ecr 194178,mptcp dss ack 2629537759 seq 2512527493 subseq 9809 len 1428 csum 0xe806], length 1428
10:13:40.278141 IP 112.26.0.1.32867 > 112.26.0.8.55628: Flags [.], seq 19805:21233, ack 1, win 1339, options [nop,nop,TS val 411113 ecr 194672,mptcp dss ack 2629537759 seq 2512537489 subseq 19805 len 1428 csum 0xc9c0], length 1428
10:13:40.278352 IP 112.26.0.1.32867 > 112.26.0.8.55628: Flags [.], seq 19805:21233, ack 1, win 1339, options [nop,nop,TS val 411113 ecr 194672,mptcp dss ack 2629537759 seq 2512537489 subseq 19805 len 1428 csum 0xc9c0], length 1428
10:13:40.298328 IP 112.26.0.1.32867 > 112.26.0.8.55628: Flags [.], seq 21233:22661, ack 1, win 1339, options [nop,nop,TS val 411113 ecr 194672,mptcp dss ack 2629537759 seq 2512538917 subseq 21233 len 1428 csum 0x12c1], length 1428
10:13:40.298521 IP 112.26.0.1.32867 > 112.26.0.8.55628: Flags [.], seq 21233:22661, ack 1, win 1339, options [nop,nop,TS val 411113 ecr 194672,mptcp dss ack 2629537759 seq 2512538917 subseq 21233 len 1428 csum 0x12c1], length 1428
10:13:40.301608 IP 112.26.0.1.32867 > 112.26.0.8.55628: Flags [.], seq 14093:15521, ack 1, win 1339, options [nop,nop,TS val 410934 ecr 194482,mptcp dss ack 2629537759 seq 2512531777 subseq 14093 len 1428 csum 0xac23], length 1428
10:13:40.314312 IP 112.26.0.8.55628 > 112.26.0.1.32867: Flags [.], ack 11237, win 1734, options [nop,nop,TS val 195019 ecr 410630,mptcp dss ack 2512528921], length 0
10:13:40.380999 IP 112.26.0.1.32867 > 112.26.0.8.55628: Flags [.], seq 22661:24089, ack 1, win 1339, options [nop,nop,TS val 411209 ecr 194708,mptcp dss ack 2629537759 seq 2512540345 subseq 22661 len 1428 csum 0x6f5b], length 1428
10:13:40.381236 IP 112.26.0.1.32867 > 112.26.0.8.55628: Flags [.], seq 22661:24089, ack 1, win 1339, options [nop,nop,TS val 411209 ecr 194708,mptcp dss ack 2629537759 seq 2512540345 subseq 22661 len 1428 csum 0x6f5b], length 1428
10:13:40.395458 IP 112.26.0.1.32867 > 112.26.0.8.55628: Flags [.], seq 15521:16949, ack 1, win 1339, options [nop,nop,TS val 410934 ecr 194482,mptcp dss ack 2629537759 seq 2512533205 subseq 15521 len 1428 csum 0x177f], length 1428
10:13:40.409202 IP 112.26.0.1.32867 > 112.26.0.8.55628: Flags [.], seq 24089:25517, ack 1, win 1339, options [nop,nop,TS val 411209 ecr 194708,mptcp dss ack 2629537759 seq 2512541773 subseq 24089 len 1428 csum 0x72a], length 1428
10:13:40.409362 IP 112.26.0.1.32867 > 112.26.0.8.55628: Flags [.], seq 24089:25517, ack 1, win 1339, options [nop,nop,TS val 411209 ecr 194708,mptcp dss ack 2629537759 seq 2512541773 subseq 24089 len 1428 csum 0x72a], length 1428
10:13:40.417592 IP 112.26.0.8.55628 > 112.26.0.1.32867: Flags [.], ack 11237, win 1780, options [nop,nop,TS val 195098 ecr 410630,nop,nop,sack 1 {14093:15521},mptcp dss ack 2512528921], length 0
10:13:40.486337 IP 112.26.0.1.32867 > 112.26.0.8.55628: Flags [.], seq 16949:18377, ack 1, win 1339, options [nop,nop,TS val 411016 ecr 194516,mptcp dss ack 2629537759 seq 2512534633 subseq 16949 len 1428 csum 0xd3], length 1428
10:13:40.496622 IP 112.26.0.1.32867 > 112.26.0.8.55628: Flags [.], seq 25517:26945, ack 1, win 1339, options [nop,nop,TS val 411252 ecr 194808,mptcp dss ack 2629537759 seq 2512543201 subseq 25517 len 1428 csum 0x2128], length 1428
10:13:40.496794 IP 112.26.0.1.32867 > 112.26.0.8.55628: Flags [.], seq 25517:26945, ack 1, win 1339, options [nop,nop,TS val 411252 ecr 194808,mptcp dss ack 2629537759 seq 2512543201 subseq 25517 len 1428 csum 0x2128], length 1428
10:13:40.510122 IP 112.26.0.1.32867 > 112.26.0.8.55628: Flags [.], seq 18377:19805, ack 1, win 1339, options [nop,nop,TS val 411016 ecr 194516,mptcp dss ack 2629537759 seq 2512536061 subseq 18377 len 1428 csum 0xa1f], length 1428
10:13:40.517526 IP 112.26.0.1.32867 > 112.26.0.8.55628: Flags [.], seq 26945:28373, ack 1, win 1339, options [nop,nop,TS val 411252 ecr 194808,mptcp dss ack 2629537759 seq 2512544629 subseq 26945 len 1428 csum 0xa724], length 1428
10:13:40.517745 IP 112.26.0.1.32867 > 112.26.0.8.55628: Flags [.], seq 26945:28373, ack 1, win 1339, options [nop,nop,TS val 411252 ecr 194808,mptcp dss ack 2629537759 seq 2512544629 subseq 26945 len 1428 csum 0xa724], length 1428
10:13:40.576670 IP 112.26.0.8.55628 > 112.26.0.1.32867: Flags [.], ack 11237, win 1825, options [nop,nop,TS val 195190 ecr 410630,nop,nop,sack 1 {14093:16949},mptcp dss ack 2512528921], length 0
10:13:40.591619 IP 112.26.0.1.32867 > 112.26.0.8.55628: Flags [.], seq 19805:21233, ack 1, win 1339, options [nop,nop,TS val 411113 ecr 194672,mptcp dss ack 2629537759 seq 2512537489 subseq 19805 len 1428 csum 0xc9c0], length 1428
10:13:40.595493 IP 112.26.0.8.55628 > 112.26.0.1.32867: Flags [.], ack 11237, win 1871, options [nop,nop,TS val 195272 ecr 410630,nop,nop,sack 1 {14093:18377},mptcp dss ack 2512528921], length 0
10:13:40.608067 IP 112.26.0.1.32867 > 112.26.0.8.55628: Flags [.], seq 28373:29801, ack 1, win 1339, options [nop,nop,TS val 411322 ecr 194890,mptcp dss ack 2629537759 seq 2512546057 subseq 28373 len 1428 csum 0xb381], length 1428
10:13:40.608272 IP 112.26.0.1.32867 > 112.26.0.8.55628: Flags [.], seq 28373:29801, ack 1, win 1339, options [nop,nop,TS val 411322 ecr 194890,mptcp dss ack 2629537759 seq 2512546057 subseq 28373 len 1428 csum 0xb381], length 1428
10:13:40.680935 IP 112.26.0.1.32867 > 112.26.0.8.55628: Flags [.], seq 29801:31229, ack 1, win 1339, options [nop,nop,TS val 411322 ecr 194890,mptcp dss ack 2629537759 seq 2512547485 subseq 29801 len 1428 csum 0xd922], length 1428
10:13:40.681193 IP 112.26.0.1.32867 > 112.26.0.8.55628: Flags [.], seq 29801:31229, ack 1, win 1339, options [nop,nop,TS val 411322 ecr 194890,mptcp dss ack 2629537759 seq 2512547485 subseq 29801 len 1428 csum 0xd922], length 1428
10:13:40.684963 IP 112.26.0.8.55628 > 112.26.0.1.32867: Flags [.], ack 11237, win 1917, options [nop,nop,TS val 195305 ecr 410630,nop,nop,sack 1 {14093:19805},mptcp dss ack 2512528921], length 0
10:13:40.690866 IP 112.26.0.1.32867 > 112.26.0.8.55628: Flags [.], seq 21233:22661, ack 1, win 1339, options [nop,nop,TS val 411113 ecr 194672,mptcp dss ack 2629537759 seq 2512538917 subseq 21233 len 1428 csum 0x12c1], length 1428
10:13:40.714728 IP 112.26.0.1.32867 > 112.26.0.8.55628: Flags [.], seq 34085:35513, ack 1, win 1339, options [nop,nop,TS val 411453 ecr 195019,mptcp dss ack 2629537759 seq 2512551769 subseq 34085 len 1428 csum 0x68fe], length 1428
10:13:40.714884 IP 112.26.0.1.32867 > 112.26.0.8.55628: Flags [.], seq 34085:35513, ack 1, win 1339, options [nop,nop,TS val 411453 ecr 195019,mptcp dss ack 2629537759 seq 2512551769 subseq 34085 len 1428 csum 0x68fe], length 1428
10:13:40.722954 IP 112.26.0.8.55628 > 112.26.0.1.32867: Flags [.], ack 11237, win 1962, options [nop,nop,TS val 195387 ecr 410630,nop,nop,sack 1 {14093:21233},mptcp dss ack 2512528921], length 0
10:13:40.783764 IP 112.26.0.1.32867 > 112.26.0.8.55628: Flags [.], seq 22661:24089, ack 1, win 1339, options [nop,nop,TS val 411209 ecr 194708,mptcp dss ack 2629537759 seq 2512540345 subseq 22661 len 1428 csum 0x6f5b], length 1428
10:13:40.794162 IP 112.26.0.1.32867 > 112.26.0.8.55628: Flags [.], seq 35513:36941, ack 1, win 1339, options [nop,nop,TS val 411453 ecr 195019,mptcp dss ack 2629537759 seq 2512553197 subseq 35513 len 1428 csum 0x55a3], length 1428
10:13:40.794387 IP 112.26.0.1.32867 > 112.26.0.8.55628: Flags [.], seq 35513:36941, ack 1, win 1339, options [nop,nop,TS val 411453 ecr 195019,mptcp dss ack 2629537759 seq 2512553197 subseq 35513 len 1428 csum 0x55a3], length 1428
10:13:40.797315 IP 112.26.0.8.55628 > 112.26.0.1.32867: Flags [.], ack 11237, win 2008, options [nop,nop,TS val 195487 ecr 410630,nop,nop,sack 1 {14093:22661},mptcp dss ack 2512528921], length 0
10:13:40.819001 IP 112.26.0.1.32867 > 112.26.0.8.55628: Flags [.], seq 36941:38369, ack 1, win 1339, options [nop,nop,TS val 411716 ecr 195098,mptcp dss ack 2629537759 seq 2512554625 subseq 36941 len 1428 csum 0xae16], length 1428
10:13:40.819183 IP 112.26.0.1.32867 > 112.26.0.8.55628: Flags [.], seq 36941:38369, ack 1, win 1339, options [nop,nop,TS val 411716 ecr 195098,mptcp dss ack 2629537759 seq 2512554625 subseq 36941 len 1428 csum 0xae16], length 1428
10:13:40.885400 IP 112.26.0.1.32867 > 112.26.0.8.55628: Flags [.], seq 24089:25517, ack 1, win 1339, options [nop,nop,TS val 411209 ecr 194708,mptcp dss ack 2629537759 seq 2512541773 subseq 24089 len 1428 csum 0x72a], length 1428
10:13:40.893631 IP 112.26.0.8.55628 > 112.26.0.1.32867: Flags [.], ack 11237, win 2054, options [nop,nop,TS val 195580 ecr 410630,nop,nop,sack 1 {14093:24089},mptcp dss ack 2512528921], length 0
10:13:40.901390 IP 112.26.0.1.32867 > 112.26.0.8.55628: Flags [.], seq 11237:12665, ack 1, win 1339, options [nop,nop,TS val 411716 ecr 195190,mptcp dss ack 2629537759 seq 2512528921 subseq 11237 len 1428 csum 0x178d], length 1428
10:13:40.901580 IP 112.26.0.1.32867 > 112.26.0.8.55628: Flags [.], seq 11237:12665, ack 1, win 1339, options [nop,nop,TS val 411716 ecr 195190,mptcp dss ack 2629537759 seq 2512528921 subseq 11237 len 1428 csum 0x178d], length 1428
10:13:40.916183 IP 112.26.0.1.32867 > 112.26.0.8.55628: Flags [.], seq 25517:26945, ack 1, win 1339, options [nop,nop,TS val 411252 ecr 194808,mptcp dss ack 2629537759 seq 2512543201 subseq 25517 len 1428 csum 0x2128], length 1428
10:13:40.983142 IP 112.26.0.1.32867 > 112.26.0.8.55628: Flags [.], seq 12665:14093, ack 1, win 1339, options [nop,nop,TS val 411734 ecr 195272,mptcp dss ack 2629537759 seq 2512530349 subseq 12665 len 1428 csum 0x598a], length 1428
10:13:40.983349 IP 112.26.0.1.32867 > 112.26.0.8.55628: Flags [.], seq 12665:14093, ack 1, win 1339, options [nop,nop,TS val 411734 ecr 195272,mptcp dss ack 2629537759 seq 2512530349 subseq 12665 len 1428 csum 0x598a], length 1428
10:13:40.993489 IP 112.26.0.8.55628 > 112.26.0.1.32867: Flags [.], ack 11237, win 2099, options [nop,nop,TS val 195678 ecr 410630,nop,nop,sack 1 {14093:25517},mptcp dss ack 2512528921], length 0
10:13:41.002870 IP 112.26.0.1.32867 > 112.26.0.8.55628: Flags [.], seq 26945:28373, ack 1, win 1339, options [nop,nop,TS val 411252 ecr 194808,mptcp dss ack 2629537759 seq 2512544629 subseq 26945 len 1428 csum 0xa724], length 1428
10:13:41.008125 IP 112.26.0.1.32867 > 112.26.0.8.55628: Flags [.], seq 38369:39797, ack 1, win 1339, options [nop,nop,TS val 411936 ecr 195387,mptcp dss ack 2629537759 seq 2512556053 subseq 38369 len 1428 csum 0x341c], length 1428
10:13:41.008306 IP 112.26.0.1.32867 > 112.26.0.8.55628: Flags [.], seq 38369:39797, ack 1, win 1339, options [nop,nop,TS val 411936 ecr 195387,mptcp dss ack 2629537759 seq 2512556053 subseq 38369 len 1428 csum 0x341c], length 1428
10:13:41.083553 IP 112.26.0.8.55628 > 112.26.0.1.32867: Flags [.], ack 11237, win 2145, options [nop,nop,TS val 195713 ecr 410630,nop,nop,sack 1 {14093:26945},mptcp dss ack 2512528921], length 0
10:13:41.086542 IP 112.26.0.1.32867 > 112.26.0.8.55628: Flags [.], seq 39797:41225, ack 1, win 1339, options [nop,nop,TS val 412032 ecr 195487,mptcp dss ack 2629537759 seq 2512557481 subseq 39797 len 1428 csum 0x7f], length 1428
10:13:41.086712 IP 112.26.0.1.32867 > 112.26.0.8.55628: Flags [.], seq 39797:41225, ack 1, win 1339, options [nop,nop,TS val 412032 ecr 195487,mptcp dss ack 2629537759 seq 2512557481 subseq 39797 len 1428 csum 0x7f], length 1428
10:13:41.098016 IP 112.26.0.1.32867 > 112.26.0.8.55628: Flags [.], seq 28373:29801, ack 1, win 1339, options [nop,nop,TS val 411322 ecr 194890,mptcp dss ack 2629537759 seq 2512546057 subseq 28373 len 1428 csum 0xb381], length 1428
10:13:41.108862 IP 112.26.0.1.32867 > 112.26.0.8.55628: Flags [.], seq 41225:42653, ack 1, win 1339, options [nop,nop,TS val 412222 ecr 195678,mptcp dss ack 2629537759 seq 2512558909 subseq 41225 len 1428 csum 0xf9b7], length 1428
10:13:41.109071 IP 112.26.0.1.32867 > 112.26.0.8.55628: Flags [.], seq 41225:42653, ack 1, win 1339, options [nop,nop,TS val 412222 ecr 195678,mptcp dss ack 2629537759 seq 2512558909 subseq 41225 len 1428 csum 0xf9b7], length 1428
10:13:41.186020 IP 112.26.0.8.55628 > 112.26.0.1.32867: Flags [.], ack 11237, win 2190, options [nop,nop,TS val 195798 ecr 410630,nop,nop,sack 1 {14093:28373},mptcp dss ack 2512528921], length 0
10:13:41.191450 IP 112.26.0.1.32867 > 112.26.0.8.55628: Flags [.], seq 29801:31229, ack 1, win 1339, options [nop,nop,TS val 411322 ecr 194890,mptcp dss ack 2629537759 seq 2512547485 subseq 29801 len 1428 csum 0xd922], length 1428
10:13:41.199635 IP 112.26.0.1.32867 > 112.26.0.8.55628: Flags [.], seq 42653:44081, ack 1, win 1339, options [nop,nop,TS val 412324 ecr 195713,mptcp dss ack 2629537759 seq 2512560337 subseq 42653 len 1428 csum 0x1956], length 1428
10:13:41.199811 IP 112.26.0.1.32867 > 112.26.0.8.55628: Flags [.], seq 42653:44081, ack 1, win 1339, options [nop,nop,TS val 412324 ecr 195713,mptcp dss ack 2629537759 seq 2512560337 subseq 42653 len 1428 csum 0x1956], length 1428
10:13:41.217392 IP 112.26.0.8.55628 > 112.26.0.1.32867: Flags [.], ack 11237, win 2236, options [nop,nop,TS val 195893 ecr 410630,nop,nop,sack 1 {14093:29801},mptcp dss ack 2512528921], length 0
10:13:41.225914 IP 112.26.0.1.32867 > 112.26.0.8.55628: Flags [.], seq 34085:35513, ack 1, win 1339, options [nop,nop,TS val 411453 ecr 195019,mptcp dss ack 2629537759 seq 2512551769 subseq 34085 len 1428 csum 0x68fe], length 1428
10:13:41.303351 IP 112.26.0.8.55628 > 112.26.0.1.32867: Flags [.], ack 11237, win 2282, options [nop,nop,TS val 195988 ecr 410630,nop,nop,sack 1 {14093:31229},mptcp dss ack 2512528921], length 0
10:13:41.318268 IP 112.26.0.1.32867 > 112.26.0.8.55628: Flags [.], seq 36941:38369, ack 1, win 1339, options [nop,nop,TS val 411716 ecr 195098,mptcp dss ack 2629537759 seq 2512554625 subseq 36941 len 1428 csum 0xae16], length 1428
10:13:41.321329 IP 112.26.0.8.55628 > 112.26.0.1.32867: Flags [.], ack 11237, win 2327, options [nop,nop,TS val 196022 ecr 410630,nop,nop,sack 2 {34085:35513}{14093:31229},mptcp dss ack 2512528921], length 0
10:13:41.326983 IP 112.26.0.1.32867 > 112.26.0.8.55628: Flags [.], seq 44081:45509, ack 1, win 1339, options [nop,nop,TS val 412460 ecr 195988,mptcp dss ack 2629537759 seq 2512561765 subseq 44081 len 1428 csum 0x9fc], length 1428
10:13:41.327163 IP 112.26.0.1.32867 > 112.26.0.8.55628: Flags [.], seq 44081:45509, ack 1, win 1339, options [nop,nop,TS val 412460 ecr 195988,mptcp dss ack 2629537759 seq 2512561765 subseq 44081 len 1428 csum 0x9fc], length 1428
10:13:41.402336 IP 112.26.0.1.32867 > 112.26.0.8.55628: Flags [.], seq 11237:12665, ack 1, win 1339, options [nop,nop,TS val 411716 ecr 195190,mptcp dss ack 2629537759 seq 2512528921 subseq 11237 len 1428 csum 0x178d], length 1428
10:13:41.407686 IP 112.26.0.8.55628 > 112.26.0.1.32867: Flags [.], ack 11237, win 2373, options [nop,nop,TS val 196108 ecr 410630,nop,nop,sack 2 {36941:38369}{34085:35513},mptcp dss ack 2512528921], length 0
10:13:41.411758 IP 112.26.0.1.32867 > 112.26.0.8.55628: Flags [.], seq 31229:32657, ack 1, win 1339, options [nop,nop,TS val 412460 ecr 196022,mptcp dss ack 2629537759 seq 2512548913 subseq 31229 len 1428 csum 0xcc62], length 1428
10:13:41.411928 IP 112.26.0.1.32867 > 112.26.0.8.55628: Flags [.], seq 31229:32657, ack 1, win 1339, options [nop,nop,TS val 412460 ecr 196022,mptcp dss ack 2629537759 seq 2512548913 subseq 31229 len 1428 csum 0xcc62], length 1428
10:13:41.424100 IP 112.26.0.1.32867 > 112.26.0.8.55628: Flags [.], seq 32657:34085, ack 1, win 1339, options [nop,nop,TS val 412547 ecr 196108,mptcp dss ack 2629537759 seq 2512550341 subseq 32657 len 1428 csum 0x480d], length 1428
10:13:41.424277 IP 112.26.0.1.32867 > 112.26.0.8.55628: Flags [.], seq 32657:34085, ack 1, win 1339, options [nop,nop,TS val 412547 ecr 196108,mptcp dss ack 2629537759 seq 2512550341 subseq 32657 len 1428 csum 0x480d], length 1428
10:13:41.480814 IP 112.26.0.8.55628 > 112.26.0.1.32867: Flags [.], ack 12665, win 2419, options [nop,nop,TS val 196190 ecr 411716,nop,nop,sack 2 {36941:38369}{34085:35513},mptcp dss ack 2512530349], length 0
10:13:41.491075 IP 112.26.0.1.32867 > 112.26.0.8.55628: Flags [.], seq 38369:39797, ack 1, win 1339, options [nop,nop,TS val 411936 ecr 195387,mptcp dss ack 2629537759 seq 2512556053 subseq 38369 len 1428 csum 0x341c], length 1428
10:13:41.504065 IP 112.26.0.1.32867 > 112.26.0.8.55628: Flags [.], seq 35513:36941, ack 1, win 1339, options [nop,nop,TS val 412620 ecr 196190,mptcp dss ack 2629537759 seq 2512553197 subseq 35513 len 1428 csum 0x55a3], length 1428
10:13:41.504245 IP 112.26.0.1.32867 > 112.26.0.8.55628: Flags [.], seq 35513:36941, ack 1, win 1339, options [nop,nop,TS val 412620 ecr 196190,mptcp dss ack 2629537759 seq 2512553197 subseq 35513 len 1428 csum 0x55a3], length 1428
10:13:41.512164 IP 112.26.0.8.55628 > 112.26.0.1.32867: Flags [.], ack 12665, win 2464, options [nop,nop,TS val 196286 ecr 411716,nop,nop,sack 2 {36941:39797}{34085:35513},mptcp dss ack 2512530349], length 0
10:13:41.517236 IP 112.26.0.1.32867 > 112.26.0.8.55628: Flags [.], seq 45509:46937, ack 1, win 1339, options [nop,nop,TS val 412620 ecr 196190,mptcp dss ack 2629537759 seq 2512563193 subseq 45509 len 1428 csum 0x97a1], length 1428
10:13:41.517415 IP 112.26.0.1.32867 > 112.26.0.8.55628: Flags [.], seq 45509:46937, ack 1, win 1339, options [nop,nop,TS val 412620 ecr 196190,mptcp dss ack 2629537759 seq 2512563193 subseq 45509 len 1428 csum 0x97a1], length 1428
10:13:41.589603 IP 112.26.0.1.32867 > 112.26.0.8.55628: Flags [.], seq 39797:41225, ack 1, win 1339, options [nop,nop,TS val 412032 ecr 195487,mptcp dss ack 2629537759 seq 2512557481 subseq 39797 len 1428 csum 0x7f], length 1428
10:13:41.595206 IP 112.26.0.1.32867 > 112.26.0.8.55628: Flags [.], seq 46937:48365, ack 1, win 1339, options [nop,nop,TS val 412620 ecr 196190,mptcp dss ack 2629537759 seq 2512564621 subseq 46937 len 1428 csum 0xe63a], length 1428
10:13:41.595387 IP 112.26.0.1.32867 > 112.26.0.8.55628: Flags [.], seq 46937:48365, ack 1, win 1339, options [nop,nop,TS val 412620 ecr 196190,mptcp dss ack 2629537759 seq 2512564621 subseq 46937 len 1428 csum 0xe63a], length 1428
10:13:41.603174 IP 112.26.0.8.55628 > 112.26.0.1.32867: Flags [.], ack 12665, win 2510, options [nop,nop,TS val 196376 ecr 411716,nop,nop,sack 2 {36941:41225}{34085:35513},mptcp dss ack 2512530349], length 0
10:13:41.614427 IP 112.26.0.1.32867 > 112.26.0.8.55628: Flags [.], seq 41225:42653, ack 1, win 1339, options [nop,nop,TS val 412222 ecr 195678,mptcp dss ack 2629537759 seq 2512558909 subseq 41225 len 1428 csum 0xf9b7], length 1428
10:13:41.620556 IP 112.26.0.1.32867 > 112.26.0.8.55628: Flags [.], seq 48365:49793, ack 1, win 1339, options [nop,nop,TS val 412620 ecr 196190,mptcp dss ack 2629537759 seq 2512566049 subseq 48365 len 1428 csum 0x7841], length 1428
10:13:41.620765 IP 112.26.0.1.32867 > 112.26.0.8.55628: Flags [.], seq 48365:49793, ack 1, win 1339, options [nop,nop,TS val 412620 ecr 196190,mptcp dss ack 2629537759 seq 2512566049 subseq 48365 len 1428 csum 0x7841], length 1428
10:13:41.686529 IP 112.26.0.8.55628 > 112.26.0.1.32867: Flags [.], ack 12665, win 2555, options [nop,nop,TS val 196410 ecr 411716,nop,nop,sack 2 {36941:42653}{34085:35513},mptcp dss ack 2512530349], length 0
10:13:41.693039 IP 112.26.0.1.32867 > 112.26.0.8.55628: Flags [.], seq 12665:14093, ack 1, win 1339, options [nop,nop,TS val 412651 ecr 196286,mptcp dss ack 2629537759 seq 2512530349 subseq 12665 len 1428 csum 0x598a], length 1428
10:13:41.693230 IP 112.26.0.1.32867 > 112.26.0.8.55628: Flags [.], seq 12665:14093, ack 1, win 1339, options [nop,nop,TS val 412651 ecr 196286,mptcp dss ack 2629537759 seq 2512530349 subseq 12665 len 1428 csum 0x598a], length 1428
10:13:41.697781 IP 112.26.0.1.32867 > 112.26.0.8.55628: Flags [.], seq 42653:44081, ack 1, win 1339, options [nop,nop,TS val 412324 ecr 195713,mptcp dss ack 2629537759 seq 2512560337 subseq 42653 len 1428 csum 0x1956], length 1428
10:13:41.718026 IP 112.26.0.1.32867 > 112.26.0.8.55628: Flags [.], seq 49793:51221, ack 1, win 1339, options [nop,nop,TS val 412825 ecr 196376,mptcp dss ack 2629537759 seq 2512567477 subseq 49793 len 1428 csum 0x33f2], length 1428
10:13:41.718202 IP 112.26.0.1.32867 > 112.26.0.8.55628: Flags [.], seq 49793:51221, ack 1, win 1339, options [nop,nop,TS val 412825 ecr 196376,mptcp dss ack 2629537759 seq 2512567477 subseq 49793 len 1428 csum 0x33f2], length 1428
10:13:41.779377 IP 112.26.0.8.55628 > 112.26.0.1.32867: Flags [.], ack 12665, win 2601, options [nop,nop,TS val 196494 ecr 411716,nop,nop,sack 2 {36941:44081}{34085:35513},mptcp dss ack 2512530349], length 0
10:13:41.785383 IP 112.26.0.1.32867 > 112.26.0.8.55628: Flags [.], seq 44081:45509, ack 1, win 1339, options [nop,nop,TS val 412460 ecr 195988,mptcp dss ack 2629537759 seq 2512561765 subseq 44081 len 1428 csum 0x9fc], length 1428
10:13:41.794414 IP 112.26.0.1.32867 > 112.26.0.8.55628: Flags [.], seq 51221:52649, ack 1, win 1339, options [nop,nop,TS val 412918 ecr 196410,mptcp dss ack 2629537759 seq 2512568905 subseq 51221 len 1428 csum 0x277], length 1428
10:13:41.794622 IP 112.26.0.1.32867 > 112.26.0.8.55628: Flags [.], seq 51221:52649, ack 1, win 1339, options [nop,nop,TS val 412918 ecr 196410,mptcp dss ack 2629537759 seq 2512568905 subseq 51221 len 1428 csum 0x277], length 1428
10:13:41.815792 IP 112.26.0.1.32867 > 112.26.0.8.55628: Flags [.], seq 31229:32657, ack 1, win 1339, options [nop,nop,TS val 412460 ecr 196022,mptcp dss ack 2629537759 seq 2512548913 subseq 31229 len 1428 csum 0xcc62], length 1428
10:13:41.825408 IP 112.26.0.8.55628 > 112.26.0.1.32867: Flags [.], ack 12665, win 2647, options [nop,nop,TS val 196581 ecr 411716,nop,nop,sack 2 {36941:45509}{34085:35513},mptcp dss ack 2512530349], length 0
10:13:41.877182 IP 112.26.0.1.32867 > 112.26.0.8.55628: Flags [.], seq 52649:54077, ack 1, win 1339, options [nop,nop,TS val 412964 ecr 196494,mptcp dss ack 2629537759 seq 2512570333 subseq 52649 len 1428 csum 0x3eeb], length 1428
10:13:41.877421 IP 112.26.0.1.32867 > 112.26.0.8.55628: Flags [.], seq 52649:54077, ack 1, win 1339, options [nop,nop,TS val 412964 ecr 196494,mptcp dss ack 2629537759 seq 2512570333 subseq 52649 len 1428 csum 0x3eeb], length 1428
10:13:41.894957 IP 112.26.0.1.32867 > 112.26.0.8.55628: Flags [.], seq 32657:34085, ack 1, win 1339, options [nop,nop,TS val 412547 ecr 196108,mptcp dss ack 2629537759 seq 2512550341 subseq 32657 len 1428 csum 0x480d], length 1428
10:13:41.908861 IP 112.26.0.8.55628 > 112.26.0.1.32867: Flags [.], ack 12665, win 2692, options [nop,nop,TS val 196607 ecr 411716,nop,nop,sack 2 {14093:32657}{36941:45509},mptcp dss ack 2512530349], length 0
10:13:41.910108 IP 112.26.0.1.32867 > 112.26.0.8.55628: Flags [.], seq 54077:55505, ack 1, win 1339, options [nop,nop,TS val 413048 ecr 196581,mptcp dss ack 2629537759 seq 2512571761 subseq 54077 len 1428 csum 0x3bf7], length 1428
10:13:41.910294 IP 112.26.0.1.32867 > 112.26.0.8.55628: Flags [.], seq 54077:55505, ack 1, win 1339, options [nop,nop,TS val 413048 ecr 196581,mptcp dss ack 2629537759 seq 2512571761 subseq 54077 len 1428 csum 0x3bf7], length 1428
10:13:41.997450 IP 112.26.0.1.32867 > 112.26.0.8.55628: Flags [.], seq 35513:36941, ack 1, win 1339, options [nop,nop,TS val 412620 ecr 196190,mptcp dss ack 2629537759 seq 2512553197 subseq 35513 len 1428 csum 0x55a3], length 1428
10:13:42.028109 IP 112.26.0.1.32867 > 112.26.0.8.55628: Flags [.], seq 45509:46937, ack 1, win 1339, options [nop,nop,TS val 412620 ecr 196190,mptcp dss ack 2629537759 seq 2512563193 subseq 45509 len 1428 csum 0x97a1], length 1428
10:13:42.111963 IP 112.26.0.1.32867 > 112.26.0.8.55628: Flags [.], seq 48365:49793, ack 1, win 1339, options [nop,nop,TS val 412620 ecr 196190,mptcp dss ack 2629537759 seq 2512566049 subseq 48365 len 1428 csum 0x7841], length 1428
10:13:42.120653 IP 112.26.0.8.55628 > 112.26.0.1.32867: Flags [.], ack 12665, win 2738, options [nop,nop,TS val 196690 ecr 411716,nop,nop,sack 2 {14093:35513}{36941:45509},mptcp dss ack 2512530349], length 0
10:13:42.122251 IP 112.26.0.1.32867 > 112.26.0.8.55628: Flags [.], seq 55505:56933, ack 1, win 1339, options [nop,nop,TS val 413259 ecr 196607,mptcp dss ack 2629537759 seq 2512573189 subseq 55505 len 1428 csum 0x73f1], length 1428
10:13:42.122489 IP 112.26.0.1.32867 > 112.26.0.8.55628: Flags [.], seq 55505:56933, ack 1, win 1339, options [nop,nop,TS val 413259 ecr 196607,mptcp dss ack 2629537759 seq 2512573189 subseq 55505 len 1428 csum 0x73f1], length 1428
10:13:42.200273 IP 112.26.0.1.32867 > 112.26.0.8.55628: Flags [.], seq 12665:14093, ack 1, win 1339, options [nop,nop,TS val 412651 ecr 196286,mptcp dss ack 2629537759 seq 2512530349 subseq 12665 len 1428 csum 0x598a], length 1428
10:13:42.217659 IP 112.26.0.8.55628 > 112.26.0.1.32867: Flags [.], ack 12665, win 2784, options [nop,nop,TS val 196793 ecr 411716,nop,nop,sack 1 {14093:45509},mptcp dss ack 2512530349], length 0
10:13:42.218912 IP 112.26.0.1.32867 > 112.26.0.8.55628: Flags [.], seq 56933:58361, ack 1, win 1339, options [nop,nop,TS val 413356 ecr 196690,mptcp dss ack 2629537759 seq 2512574617 subseq 56933 len 1428 csum 0x897b], length 1428
10:13:42.219092 IP 112.26.0.1.32867 > 112.26.0.8.55628: Flags [.], seq 56933:58361, ack 1, win 1339, options [nop,nop,TS val 413356 ecr 196690,mptcp dss ack 2629537759 seq 2512574617 subseq 56933 len 1428 csum 0x897b], length 1428
10:13:42.291231 IP 112.26.0.1.32867 > 112.26.0.8.55628: Flags [.], seq 49793:51221, ack 1, win 1339, options [nop,nop,TS val 412825 ecr 196376,mptcp dss ack 2629537759 seq 2512567477 subseq 49793 len 1428 csum 0x33f2], length 1428
10:13:42.296824 IP 112.26.0.8.55628 > 112.26.0.1.32867: Flags [.], ack 12665, win 2829, options [nop,nop,TS val 196825 ecr 411716,nop,nop,sack 1 {14093:46937},mptcp dss ack 2512530349], length 0
10:13:42.313355 IP 112.26.0.1.32867 > 112.26.0.8.55628: Flags [.], seq 58361:59789, ack 1, win 1339, options [nop,nop,TS val 413435 ecr 196793,mptcp dss ack 2629537759 seq 2512576045 subseq 58361 len 1428 csum 0xf788], length 1428
10:13:42.313550 IP 112.26.0.1.32867 > 112.26.0.8.55628: Flags [.], seq 58361:59789, ack 1, win 1339, options [nop,nop,TS val 413435 ecr 196793,mptcp dss ack 2629537759 seq 2512576045 subseq 58361 len 1428 csum 0xf788], length 1428
10:13:42.326345 IP 112.26.0.8.55628 > 112.26.0.1.32867: Flags [.], ack 12665, win 2875, options [nop,nop,TS val 196909 ecr 411716,nop,nop,sack 2 {48365:49793}{14093:46937},mptcp dss ack 2512530349], length 0
10:13:42.327721 IP 112.26.0.1.32867 > 112.26.0.8.55628: Flags [.], seq 59789:61217, ack 1, win 1339, options [nop,nop,TS val 413465 ecr 196825,mptcp dss ack 2629537759 seq 2512577473 subseq 59789 len 1428 csum 0x846e], length 1428
10:13:42.327904 IP 112.26.0.1.32867 > 112.26.0.8.55628: Flags [.], seq 59789:61217, ack 1, win 1339, options [nop,nop,TS val 413465 ecr 196825,mptcp dss ack 2629537759 seq 2512577473 subseq 59789 len 1428 csum 0x846e], length 1428
10:13:42.332800 IP 112.26.0.1.32867 > 112.26.0.8.55628: Flags [.], seq 52649:54077, ack 1, win 1339, options [nop,nop,TS val 412964 ecr 196494,mptcp dss ack 2629537759 seq 2512570333 subseq 52649 len 1428 csum 0x3eeb], length 1428
10:13:42.408655 IP 112.26.0.8.55628 > 112.26.0.1.32867: Flags [.], ack 46937, win 2920, options [nop,nop,TS val 196997 ecr 412651,nop,nop,sack 1 {48365:49793},mptcp dss ack 2512564621], length 0
