10:13:44.343442 IP 112.26.1.8.35463 > 112.26.1.1.32867: Flags [S], seq 1316907403, win 65535, options [mss 1460,sackOK,TS val 199134 ecr 0,nop,wscale 6,mptcp join id 6 token 0x4639d496 nonce 0x289c799f], length 0
10:13:44.447825 IP 112.26.1.8.35463 > 112.26.1.1.32867: Flags [S], seq 1316907403, win 65535, options [mss 1460,sackOK,TS val 199134 ecr 0,nop,wscale 6,mptcp join id 6 token 0x4639d496 nonce 0x289c799f], length 0
10:13:44.533287 IP 112.26.1.1.32867 > 112.26.1.8.35463: Flags [S.], seq 469891316, ack 1316907404, win 65535, options [mss 1460,sackOK,TS val 415586 ecr 199134,nop,wscale 6,mptcp join id 3 hmac 0xa3647829e6530655 nonce 0xc1af9f50], length 0
10:13:44.540897 IP 112.26.1.8.35463 > 112.26.1.1.32867: Flags [.], ack 1, win 5612, options [nop,nop,TS val 199332 ecr 415586,mptcp join hmac 0x049b77d78eacb1900005fad305fba33941a2c050], length 0
10:13:44.623872 IP 112.26.1.8.35463 > 112.26.1.1.32867: Flags [.], ack 1, win 5612, options [nop,nop,TS val 199332 ecr 415586,mptcp join hmac 0x049b77d78eacb1900005fad305fba33941a2c050], length 0
10:13:44.706467 IP 112.26.1.1.32867 > 112.26.1.8.35463: Flags [.], ack 1, win 2678, options [nop,nop,TS val 415762 ecr 199332,mptcp dss ack 2629537759], length 0
10:13:44.754856 IP 112.26.1.1.32867 > 112.26.1.8.35463: Flags [.], seq 1:1429, ack 1, win 2678, options [nop,nop,TS val 415763 ecr 199332,mptcp dss ack 2629537759 seq 2512616029 subseq 1 len 1428 csum 0x69c6], length 1428
10:13:44.760530 IP 112.26.1.8.35463 > 112.26.1.1.32867: Flags [.], ack 1429, win 5840, options [nop,nop,TS val 199556 ecr 415763,mptcp dss ack 2512613173], length 0
10:13:44.961957 IP 112.26.1.1.32867 > 112.26.1.8.35463: Flags [.], seq 1429:2857, ack 1, win 2678, options [nop,nop,TS val 415763 ecr 199332,mptcp dss ack 2629537759 seq 2512617457 subseq 1429 len 1428 csum 0x1d23], length 1428
10:13:44.967446 IP 112.26.1.8.35463 > 112.26.1.1.32867: Flags [.], ack 2857, win 5977, options [nop,nop,TS val 199761 ecr 415763,mptcp dss ack 2512618885], length 0
10:13:45.059874 IP 112.26.1.1.32867 > 112.26.1.8.35463: Flags [.], seq 2857:4285, ack 1, win 2678, options [nop,nop,TS val 415763 ecr 199332,mptcp dss ack 2629537759 seq 2512618885 subseq 2857 len 1428 csum 0x9083], length 1428
10:13:45.123652 IP 112.26.1.8.35463 > 112.26.1.1.32867: Flags [.], ack 4285, win 6114, options [nop,nop,TS val 199919 ecr 415763,mptcp dss ack 2512620313], length 0
10:13:45.171772 IP 112.26.1.1.32867 > 112.26.1.8.35463: Flags [.], seq 4285:5713, ack 1, win 2678, options [nop,nop,TS val 415763 ecr 199332,mptcp dss ack 2629537759 seq 2512620313 subseq 4285 len 1428 csum 0x9dfd], length 1428
10:13:45.233670 IP 112.26.1.8.35463 > 112.26.1.1.32867: Flags [.], ack 5713, win 6205, options [nop,nop,TS val 200027 ecr 415763,mptcp dss ack 2512621741], length 0
10:13:45.255381 IP 112.26.1.1.32867 > 112.26.1.8.35463: Flags [.], seq 5713:7141, ack 1, win 2678, options [nop,nop,TS val 415763 ecr 199332,mptcp dss ack 2629537759 seq 2512621741 subseq 5713 len 1428 csum 0x95a0], length 1428
10:13:45.319336 IP 112.26.1.8.35463 > 112.26.1.1.32867: Flags [.], ack 1429, win 5840, options [nop,nop,TS val 199556 ecr 415763,mptcp dss ack 2512613173], length 0
10:13:45.335968 IP 112.26.1.8.35463 > 112.26.1.1.32867: Flags [.], ack 7141, win 6297, options [nop,nop,TS val 200130 ecr 415763,mptcp dss ack 2512623169], length 0
10:13:45.446215 IP 112.26.1.1.32867 > 112.26.1.8.35463: Flags [.], seq 8569:9997, ack 1, win 2678, options [nop,nop,TS val 415763 ecr 199332,mptcp dss ack 2629537759 seq 2512624597 subseq 8569 len 1428 csum 0xf978], length 1428
10:13:45.452315 IP 112.26.1.8.35463 > 112.26.1.1.32867: Flags [.], ack 7141, win 6434, options [nop,nop,TS val 200244 ecr 415763,nop,nop,sack 1 {8569:9997},mptcp dss ack 2512623169], length 0
10:13:45.473720 IP 112.26.1.1.32867 > 112.26.1.8.35463: Flags [.], seq 9997:11425, ack 1, win 2678, options [nop,nop,TS val 415764 ecr 199332,mptcp dss ack 2629537759 seq 2512626025 subseq 9997 len 1428 csum 0x7eac], length 1428
10:13:45.540978 IP 112.26.1.8.35463 > 112.26.1.1.32867: Flags [.], ack 2857, win 5977, options [nop,nop,TS val 199761 ecr 415763,mptcp dss ack 2512618885], length 0
10:13:45.570467 IP 112.26.1.8.35463 > 112.26.1.1.32867: Flags [.], ack 7141, win 6570, options [nop,nop,TS val 200365 ecr 415763,nop,nop,sack 1 {8569:11425},mptcp dss ack 2512623169], length 0
10:13:45.650641 IP 112.26.1.1.32867 > 112.26.1.8.35463: Flags [.], seq 12853:14281, ack 1, win 2678, options [nop,nop,TS val 416120 ecr 199332,mptcp dss ack 2629537759 seq 2512628881 subseq 12853 len 1428 csum 0xd0e8], length 1428
10:13:45.711006 IP 112.26.1.8.35463 > 112.26.1.1.32867: Flags [.], ack 7141, win 6707, options [nop,nop,TS val 200506 ecr 415763,nop,nop,sack 2 {12853:14281}{8569:11425},mptcp dss ack 2512623169], length 0
10:13:45.743176 IP 112.26.1.8.35463 > 112.26.1.1.32867: Flags [.], ack 5713, win 6205, options [nop,nop,TS val 200027 ecr 415763,mptcp dss ack 2512621741], length 0
10:13:45.840678 IP 112.26.1.1.32867 > 112.26.1.8.35463: Flags [.], seq 15709:17137, ack 1, win 2678, options [nop,nop,TS val 416458 ecr 199556,mptcp dss ack 2629537759 seq 2512646017 subseq 15709 len 1428 csum 0x7d5b], length 1428
10:13:45.843494 IP 112.26.1.8.35463 > 112.26.1.1.32867: Flags [.], ack 7141, win 6844, options [nop,nop,TS val 200639 ecr 415763,nop,nop,sack 2 {15709:17137}{12853:14281},mptcp dss ack 2512623169], length 0
10:13:45.913126 IP 112.26.1.8.35463 > 112.26.1.1.32867: Flags [.], ack 7141, win 6297, options [nop,nop,TS val 200130 ecr 415763,mptcp dss ack 2512623169], length 0
10:13:45.955706 IP 112.26.1.8.35463 > 112.26.1.1.32867: Flags [.], ack 7141, win 6434, options [nop,nop,TS val 200244 ecr 415763,nop,nop,sack 1 {8569:9997},mptcp dss ack 2512623169], length 0
10:13:46.020772 IP 112.26.1.1.32867 > 112.26.1.8.35463: Flags [.], seq 17137:18565, ack 1, win 2678, options [nop,nop,TS val 416679 ecr 199761,mptcp dss ack 2629537759 seq 2512651729 subseq 17137 len 1428 csum 0x98a0], length 1428
10:13:46.031931 IP 112.26.1.8.35463 > 112.26.1.1.32867: Flags [.], ack 7141, win 7027, options [nop,nop,TS val 200820 ecr 415763,nop,nop,sack 2 {15709:18565}{12853:14281},mptcp dss ack 2512623169], length 0
10:13:46.107208 IP 112.26.1.1.32867 > 112.26.1.8.35463: Flags [.], seq 18565:19993, ack 1, win 2678, options [nop,nop,TS val 416679 ecr 199761,mptcp dss ack 2629537759 seq 2512653157 subseq 18565 len 1428 csum 0xfe51], length 1428
10:13:46.156250 IP 112.26.1.1.32867 > 112.26.1.8.35463: Flags [.], seq 19993:21421, ack 1, win 2678, options [nop,nop,TS val 416876 ecr 200027,mptcp dss ack 2629537759 seq 2512658869 subseq 19993 len 1428 csum 0x3c02], length 1428
10:13:46.212384 IP 112.26.1.8.35463 > 112.26.1.1.32867: Flags [.], ack 7141, win 7164, options [nop,nop,TS val 200971 ecr 415763,nop,nop,sack 2 {15709:19993}{12853:14281},mptcp dss ack 2512623169], length 0
10:13:46.227695 IP 112.26.1.8.35463 > 112.26.1.1.32867: Flags [.], ack 7141, win 6707, options [nop,nop,TS val 200506 ecr 415763,nop,nop,sack 2 {12853:14281}{8569:11425},mptcp dss ack 2512623169], length 0
10:13:46.257436 IP 112.26.1.8.35463 > 112.26.1.1.32867: Flags [.], ack 7141, win 7255, options [nop,nop,TS val 201053 ecr 415763,nop,nop,sack 2 {15709:21421}{12853:14281},mptcp dss ack 2512623169], length 0
10:13:46.276936 IP 112.26.1.1.32867 > 112.26.1.8.35463: Flags [.], seq 21421:22849, ack 1, win 2678, options [nop,nop,TS val 416876 ecr 200027,mptcp dss ack 2629537759 seq 2512660297 subseq 21421 len 1428 csum 0xbc4b], length 1428
10:13:46.360353 IP 112.26.1.1.32867 > 112.26.1.8.35463: Flags [.], seq 22849:24277, ack 1, win 2678, options [nop,nop,TS val 416876 ecr 200027,mptcp dss ack 2629537759 seq 2512661725 subseq 22849 len 1428 csum 0x9e80], length 1428
10:13:46.433704 IP 112.26.1.8.35463 > 112.26.1.1.32867: Flags [.], ack 7141, win 7437, options [nop,nop,TS val 201229 ecr 415763,nop,nop,sack 2 {15709:22849}{12853:14281},mptcp dss ack 2512623169], length 0
10:13:46.443095 IP 112.26.1.8.35463 > 112.26.1.1.32867: Flags [.], ack 7141, win 6844, options [nop,nop,TS val 200639 ecr 415763,nop,nop,sack 2 {15709:17137}{12853:14281},mptcp dss ack 2512623169], length 0
10:13:46.471850 IP 112.26.1.8.35463 > 112.26.1.1.32867: Flags [.], ack 7141, win 7529, options [nop,nop,TS val 201267 ecr 415763,nop,nop,sack 2 {15709:24277}{12853:14281},mptcp dss ack 2512623169], length 0
10:13:46.515568 IP 112.26.1.1.32867 > 112.26.1.8.35463: Flags [.], seq 27133:28561, ack 1, win 2678, options [nop,nop,TS val 417051 ecr 200130,mptcp dss ack 2629537759 seq 2512668865 subseq 27133 len 1428 csum 0xb2e7], length 1428
10:13:46.548011 IP 112.26.1.1.32867 > 112.26.1.8.35463: Flags [.], seq 28561:29989, ack 1, win 2678, options [nop,nop,TS val 417114 ecr 200244,mptcp dss ack 2629537759 seq 2512671721 subseq 28561 len 1428 csum 0x47e2], length 1428
10:13:46.615869 IP 112.26.1.8.35463 > 112.26.1.1.32867: Flags [.], ack 7141, win 7027, options [nop,nop,TS val 200820 ecr 415763,nop,nop,sack 2 {15709:18565}{12853:14281},mptcp dss ack 2512623169], length 0
10:13:46.647250 IP 112.26.1.1.32867 > 112.26.1.8.35463: Flags [.], seq 7141:8569, ack 1, win 2678, options [nop,nop,TS val 417367 ecr 200506,mptcp dss ack 2629537759 seq 2512623169 subseq 7141 len 1428 csum 0xa051], length 1428
10:13:46.678430 IP 112.26.1.8.35463 > 112.26.1.1.32867: Flags [.], ack 7141, win 7711, options [nop,nop,TS val 201473 ecr 415763,nop,nop,sack 2 {27133:28561}{15709:24277},mptcp dss ack 2512623169], length 0
10:13:46.718928 IP 112.26.1.1.32867 > 112.26.1.8.35463: Flags [.], seq 11425:12853, ack 1, win 2678, options [nop,nop,TS val 417367 ecr 200506,mptcp dss ack 2629537759 seq 2512627453 subseq 11425 len 1428 csum 0xa26d], length 1428
10:13:46.755933 IP 112.26.1.8.35463 > 112.26.1.1.32867: Flags [.], ack 7141, win 7802, options [nop,nop,TS val 201549 ecr 415763,nop,nop,sack 2 {27133:29989}{15709:24277},mptcp dss ack 2512623169], length 0
10:13:46.767864 IP 112.26.1.8.35463 > 112.26.1.1.32867: Flags [.], ack 7141, win 7164, options [nop,nop,TS val 200971 ecr 415763,nop,nop,sack 2 {15709:19993}{12853:14281},mptcp dss ack 2512623169], length 0
10:13:46.843829 IP 112.26.1.8.35463 > 112.26.1.1.32867: Flags [.], ack 7141, win 7255, options [nop,nop,TS val 201053 ecr 415763,nop,nop,sack 2 {15709:21421}{12853:14281},mptcp dss ack 2512623169], length 0
10:13:46.844589 IP 112.26.1.8.35463 > 112.26.1.1.32867: Flags [.], ack 11425, win 7894, options [nop,nop,TS val 201636 ecr 417367,nop,nop,sack 2 {27133:29989}{15709:24277},mptcp dss ack 2512627453], length 0
10:13:46.884121 IP 112.26.1.8.35463 > 112.26.1.1.32867: Flags [.], ack 7141, win 7437, options [nop,nop,TS val 201229 ecr 415763,nop,nop,sack 2 {15709:22849}{12853:14281},mptcp dss ack 2512623169], length 0
10:13:46.947024 IP 112.26.1.8.35463 > 112.26.1.1.32867: Flags [.], ack 7141, win 7529, options [nop,nop,TS val 201267 ecr 415763,nop,nop,sack 2 {15709:24277}{12853:14281},mptcp dss ack 2512623169], length 0
10:13:46.958699 IP 112.26.1.8.35463 > 112.26.1.1.32867: Flags [.], ack 14281, win 8030, options [nop,nop,TS val 201753 ecr 417367,nop,nop,sack 2 {27133:29989}{15709:24277},mptcp dss ack 2512644589], length 0
10:13:47.028866 IP 112.26.1.1.32867 > 112.26.1.8.35463: Flags [.], seq 14281:15709, ack 1, win 2678, options [nop,nop,TS val 417907 ecr 200971,mptcp dss ack 2629537759 seq 2512644589 subseq 14281 len 1428 csum 0xc3e0], length 1428
10:13:47.072815 IP 112.26.1.1.32867 > 112.26.1.8.35463: Flags [.], seq 29989:31417, ack 1, win 2678, options [nop,nop,TS val 418019 ecr 201053,mptcp dss ack 2629537759 seq 2512694569 subseq 29989 len 1428 csum 0x9f3f], length 1428
10:13:47.131068 IP 112.26.1.8.35463 > 112.26.1.1.32867: Flags [.], ack 7141, win 7711, options [nop,nop,TS val 201473 ecr 415763,nop,nop,sack 2 {27133:28561}{15709:24277},mptcp dss ack 2512623169], length 0
10:13:47.156668 IP 112.26.1.8.35463 > 112.26.1.1.32867: Flags [.], ack 24277, win 8213, options [nop,nop,TS val 201951 ecr 417907,nop,nop,sack 1 {27133:29989},mptcp dss ack 2512663153], length 0
10:13:47.224021 IP 112.26.1.8.35463 > 112.26.1.1.32867: Flags [.], ack 24277, win 8259, options [nop,nop,TS val 202016 ecr 417907,nop,nop,sack 1 {27133:31417},mptcp dss ack 2512663153], length 0
10:13:47.247090 IP 112.26.1.1.32867 > 112.26.1.8.35463: Flags [.], seq 31417:32845, ack 1, win 2678, options [nop,nop,TS val 418051 ecr 201229,mptcp dss ack 2629537759 seq 2512695997 subseq 31417 len 1428 csum 0xc6f5], length 1428
10:13:47.280901 IP 112.26.1.1.32867 > 112.26.1.8.35463: Flags [.], seq 32845:34273, ack 1, win 2678, options [nop,nop,TS val 418116 ecr 201267,mptcp dss ack 2629537759 seq 2512698853 subseq 32845 len 1428 csum 0xc02b], length 1428
10:13:47.342936 IP 112.26.1.8.35463 > 112.26.1.1.32867: Flags [.], ack 7141, win 7802, options [nop,nop,TS val 201549 ecr 415763,nop,nop,sack 2 {27133:29989}{15709:24277},mptcp dss ack 2512623169], length 0
10:13:47.356506 IP 112.26.1.8.35463 > 112.26.1.1.32867: Flags [.], ack 24277, win 8441, options [nop,nop,TS val 202151 ecr 417907,nop,nop,sack 1 {27133:32845},mptcp dss ack 2512663153], length 0
10:13:47.383753 IP 112.26.1.8.35463 > 112.26.1.1.32867: Flags [.], ack 11425, win 7894, options [nop,nop,TS val 201636 ecr 417367,nop,nop,sack 2 {27133:29989}{15709:24277},mptcp dss ack 2512627453], length 0
10:13:47.430647 IP 112.26.1.8.35463 > 112.26.1.1.32867: Flags [.], ack 24277, win 8532, options [nop,nop,TS val 202225 ecr 417907,nop,nop,sack 1 {27133:34273},mptcp dss ack 2512663153], length 0
10:13:47.453920 IP 112.26.1.8.35463 > 112.26.1.1.32867: Flags [.], ack 14281, win 8030, options [nop,nop,TS val 201753 ecr 417367,nop,nop,sack 2 {27133:29989}{15709:24277},mptcp dss ack 2512644589], length 0
10:13:47.540386 IP 112.26.1.1.32867 > 112.26.1.8.35463: Flags [.], seq 24277:25705, ack 1, win 2678, options [nop,nop,TS val 418269 ecr 201473,mptcp dss ack 2629537759 seq 2512663153 subseq 24277 len 1428 csum 0x7e5f], length 1428
10:13:47.566726 IP 112.26.1.8.35463 > 112.26.1.1.32867: Flags [.], ack 25705, win 8669, options [nop,nop,TS val 202361 ecr 418269,nop,nop,sack 1 {27133:34273},mptcp dss ack 2512667437], length 0
10:13:47.629910 IP 112.26.1.8.35463 > 112.26.1.1.32867: Flags [.], ack 24277, win 8213, options [nop,nop,TS val 201951 ecr 417907,nop,nop,sack 1 {27133:29989},mptcp dss ack 2512663153], length 0
10:13:47.691107 IP 112.26.1.8.35463 > 112.26.1.1.32867: Flags [.], ack 24277, win 8259, options [nop,nop,TS val 202016 ecr 417907,nop,nop,sack 1 {27133:31417},mptcp dss ack 2512663153], length 0
10:13:47.781684 IP 112.26.1.1.32867 > 112.26.1.8.35463: Flags [.], seq 25705:27133, ack 1, win 2678, options [nop,nop,TS val 418481 ecr 201549,mptcp dss ack 2629537759 seq 2512667437 subseq 25705 len 1428 csum 0x614a], length 1428
10:13:47.790919 IP 112.26.1.8.35463 > 112.26.1.1.32867: Flags [.], ack 34273, win 8852, options [nop,nop,TS val 202581 ecr 418481,mptcp dss ack 2512708849], length 0
10:13:47.862221 IP 112.26.1.1.32867 > 112.26.1.8.35463: Flags [.], seq 34273:35701, ack 1, win 2678, options [nop,nop,TS val 418522 ecr 201636,mptcp dss ack 2629537759 seq 2512710277 subseq 34273 len 1428 csum 0xa9ec], length 1428
10:13:47.893137 IP 112.26.1.1.32867 > 112.26.1.8.35463: Flags [.], seq 35701:37129, ack 1, win 2678, options [nop,nop,TS val 418522 ecr 201636,mptcp dss ack 2629537759 seq 2512711705 subseq 35701 len 1428 csum 0x3488], length 1428
10:13:47.947333 IP 112.26.1.8.35463 > 112.26.1.1.32867: Flags [.], ack 35701, win 8989, options [nop,nop,TS val 202742 ecr 418522,mptcp dss ack 2512711705], length 0
10:13:47.970882 IP 112.26.1.8.35463 > 112.26.1.1.32867: Flags [.], ack 24277, win 8441, options [nop,nop,TS val 202151 ecr 417907,nop,nop,sack 1 {27133:32845},mptcp dss ack 2512663153], length 0
10:13:48.029940 IP 112.26.1.8.35463 > 112.26.1.1.32867: Flags [.], ack 37129, win 9080, options [nop,nop,TS val 202822 ecr 418522,mptcp dss ack 2512713133], length 0
10:13:48.043104 IP 112.26.1.1.32867 > 112.26.1.8.35463: Flags [.], seq 38557:39985, ack 1, win 2678, options [nop,nop,TS val 418592 ecr 201753,mptcp dss ack 2629537759 seq 2512714561 subseq 38557 len 1428 csum 0x6335], length 1428
10:13:48.101947 IP 112.26.1.8.35463 > 112.26.1.1.32867: Flags [.], ack 25705, win 8669, options [nop,nop,TS val 202361 ecr 418269,nop,nop,sack 1 {27133:34273},mptcp dss ack 2512667437], length 0
10:13:48.170137 IP 112.26.1.8.35463 > 112.26.1.1.32867: Flags [.], ack 37129, win 9262, options [nop,nop,TS val 202965 ecr 418522,nop,nop,sack 1 {38557:39985},mptcp dss ack 2512713133], length 0
10:13:48.188018 IP 112.26.1.1.32867 > 112.26.1.8.35463: Flags [.], seq 41413:42841, ack 1, win 2678, options [nop,nop,TS val 418878 ecr 202016,mptcp dss ack 2629537759 seq 2512723129 subseq 41413 len 1428 csum 0x80d8], length 1428
10:13:48.255046 IP 112.26.1.8.35463 > 112.26.1.1.32867: Flags [.], ack 34273, win 8852, options [nop,nop,TS val 202581 ecr 418481,mptcp dss ack 2512708849], length 0
10:13:48.282496 IP 112.26.1.8.35463 > 112.26.1.1.32867: Flags [.], ack 37129, win 9354, options [nop,nop,TS val 203076 ecr 418522,nop,nop,sack 2 {41413:42841}{38557:39985},mptcp dss ack 2512713133], length 0
10:13:48.309063 IP 112.26.1.1.32867 > 112.26.1.8.35463: Flags [.], seq 42841:44269, ack 1, win 2678, options [nop,nop,TS val 419185 ecr 202151,mptcp dss ack 2629537759 seq 2512731697 subseq 42841 len 1428 csum 0x72be], length 1428
10:13:48.361784 IP 112.26.1.8.35463 > 112.26.1.1.32867: Flags [.], ack 35701, win 8989, options [nop,nop,TS val 202742 ecr 418522,mptcp dss ack 2512711705], length 0
10:13:48.379818 IP 112.26.1.8.35463 > 112.26.1.1.32867: Flags [.], ack 37129, win 9490, options [nop,nop,TS val 203174 ecr 418522,nop,nop,sack 2 {41413:44269}{38557:39985},mptcp dss ack 2512713133], length 0
10:13:48.437688 IP 112.26.1.1.32867 > 112.26.1.8.35463: Flags [.], seq 44269:45697, ack 1, win 2678, options [nop,nop,TS val 419241 ecr 202361,mptcp dss ack 2629537759 seq 2512737409 subseq 44269 len 1428 csum 0xbe55], length 1428
10:13:48.476429 IP 112.26.1.8.35463 > 112.26.1.1.32867: Flags [.], ack 37129, win 9080, options [nop,nop,TS val 202822 ecr 418522,mptcp dss ack 2512713133], length 0
10:13:48.542699 IP 112.26.1.8.35463 > 112.26.1.1.32867: Flags [.], ack 37129, win 9627, options [nop,nop,TS val 203338 ecr 418522,nop,nop,sack 2 {41413:45697}{38557:39985},mptcp dss ack 2512713133], length 0
10:13:48.574037 IP 112.26.1.1.32867 > 112.26.1.8.35463: Flags [.], seq 45697:47125, ack 1, win 2678, options [nop,nop,TS val 419241 ecr 202361,mptcp dss ack 2629537759 seq 2512738837 subseq 45697 len 1428 csum 0x4384], length 1428
10:13:48.640277 IP 112.26.1.8.35463 > 112.26.1.1.32867: Flags [.], ack 37129, win 9262, options [nop,nop,TS val 202965 ecr 418522,nop,nop,sack 1 {38557:39985},mptcp dss ack 2512713133], length 0
10:13:48.675729 IP 112.26.1.1.32867 > 112.26.1.8.35463: Flags [.], seq 47125:48553, ack 1, win 2678, options [nop,nop,TS val 419394 ecr 202581,mptcp dss ack 2629537759 seq 2512744549 subseq 47125 len 1428 csum 0x4538], length 1428
10:13:48.682624 IP 112.26.1.8.35463 > 112.26.1.1.32867: Flags [.], ack 37129, win 9764, options [nop,nop,TS val 203478 ecr 418522,nop,nop,sack 2 {41413:47125}{38557:39985},mptcp dss ack 2512713133], length 0
10:13:48.735462 IP 112.26.1.8.35463 > 112.26.1.1.32867: Flags [.], ack 37129, win 9354, options [nop,nop,TS val 203076 ecr 418522,nop,nop,sack 2 {41413:42841}{38557:39985},mptcp dss ack 2512713133], length 0
10:13:48.768414 IP 112.26.1.8.35463 > 112.26.1.1.32867: Flags [.], ack 37129, win 9855, options [nop,nop,TS val 203560 ecr 418522,nop,nop,sack 2 {41413:48553}{38557:39985},mptcp dss ack 2512713133], length 0
10:13:48.787397 IP 112.26.1.1.32867 > 112.26.1.8.35463: Flags [.], seq 48553:49981, ack 1, win 2678, options [nop,nop,TS val 419500 ecr 202742,mptcp dss ack 2629537759 seq 2512747405 subseq 48553 len 1428 csum 0x5b9d], length 1428
10:13:48.868085 IP 112.26.1.1.32867 > 112.26.1.8.35463: Flags [.], seq 49981:51409, ack 1, win 2678, options [nop,nop,TS val 419500 ecr 202742,mptcp dss ack 2629537759 seq 2512748833 subseq 49981 len 1428 csum 0x99c1], length 1428
10:13:48.937233 IP 112.26.1.8.35463 > 112.26.1.1.32867: Flags [.], ack 37129, win 9490, options [nop,nop,TS val 203174 ecr 418522,nop,nop,sack 2 {41413:44269}{38557:39985},mptcp dss ack 2512713133], length 0
10:13:48.958793 IP 112.26.1.8.35463 > 112.26.1.1.32867: Flags [.], ack 37129, win 9992, options [nop,nop,TS val 203752 ecr 418522,nop,nop,sack 2 {41413:49981}{38557:39985},mptcp dss ack 2512713133], length 0
10:13:48.994655 IP 112.26.1.1.32867 > 112.26.1.8.35463: Flags [.], seq 51409:52837, ack 1, win 2678, options [nop,nop,TS val 419615 ecr 202822,mptcp dss ack 2629537759 seq 2512757401 subseq 51409 len 1428 csum 0xff8], length 1428
10:13:49.047400 IP 112.26.1.8.35463 > 112.26.1.1.32867: Flags [.], ack 37129, win 10084, options [nop,nop,TS val 203842 ecr 418522,nop,nop,sack 2 {41413:51409}{38557:39985},mptcp dss ack 2512713133], length 0
10:13:49.069856 IP 112.26.1.8.35463 > 112.26.1.1.32867: Flags [.], ack 37129, win 9627, options [nop,nop,TS val 203338 ecr 418522,nop,nop,sack 2 {41413:45697}{38557:39985},mptcp dss ack 2512713133], length 0
10:13:49.100109 IP 112.26.1.1.32867 > 112.26.1.8.35463: Flags [.], seq 52837:54265, ack 1, win 2678, options [nop,nop,TS val 419799 ecr 202965,mptcp dss ack 2629537759 seq 2512763113 subseq 52837 len 1428 csum 0x8c37], length 1428
10:13:49.143947 IP 112.26.1.8.35463 > 112.26.1.1.32867: Flags [.], ack 37129, win 10220, options [nop,nop,TS val 203939 ecr 418522,nop,nop,sack 2 {41413:52837}{38557:39985},mptcp dss ack 2512713133], length 0
10:13:49.169299 IP 112.26.1.1.32867 > 112.26.1.8.35463: Flags [.], seq 37129:38557, ack 1, win 2678, options [nop,nop,TS val 419874 ecr 203076,mptcp dss ack 2629537759 seq 2512713133 subseq 37129 len 1428 csum 0x126e], length 1428
10:13:49.248372 IP 112.26.1.8.35463 > 112.26.1.1.32867: Flags [.], ack 37129, win 10312, options [nop,nop,TS val 204043 ecr 418522,nop,nop,sack 2 {41413:54265}{38557:39985},mptcp dss ack 2512713133], length 0
10:13:49.263112 IP 112.26.1.8.35463 > 112.26.1.1.32867: Flags [.], ack 37129, win 9764, options [nop,nop,TS val 203478 ecr 418522,nop,nop,sack 2 {41413:47125}{38557:39985},mptcp dss ack 2512713133], length 0
10:13:49.297663 IP 112.26.1.8.35463 > 112.26.1.1.32867: Flags [.], ack 37129, win 9855, options [nop,nop,TS val 203560 ecr 418522,nop,nop,sack 2 {41413:48553}{38557:39985},mptcp dss ack 2512713133], length 0
10:13:49.338850 IP 112.26.1.8.35463 > 112.26.1.1.32867: Flags [.], ack 39985, win 10403, options [nop,nop,TS val 204134 ecr 419874,nop,nop,sack 1 {41413:54265},mptcp dss ack 2512721701], length 0
10:13:49.357490 IP 112.26.1.1.32867 > 112.26.1.8.35463: Flags [.], seq 39985:41413, ack 1, win 2678, options [nop,nop,TS val 420076 ecr 203174,mptcp dss ack 2629537759 seq 2512721701 subseq 39985 len 1428 csum 0xe482], length 1428
10:13:49.402170 IP 112.26.1.8.35463 > 112.26.1.1.32867: Flags [.], ack 37129, win 9992, options [nop,nop,TS val 203752 ecr 418522,nop,nop,sack 2 {41413:49981}{38557:39985},mptcp dss ack 2512713133], length 0
10:13:49.465508 IP 112.26.1.8.35463 > 112.26.1.1.32867: Flags [.], ack 54265, win 10540, options [nop,nop,TS val 204260 ecr 420076,mptcp dss ack 2512745977], length 0
10:13:49.495915 IP 112.26.1.8.35463 > 112.26.1.1.32867: Flags [.], ack 37129, win 10084, options [nop,nop,TS val 203842 ecr 418522,nop,nop,sack 2 {41413:51409}{38557:39985},mptcp dss ack 2512713133], length 0
10:13:49.544762 IP 112.26.1.8.35463 > 112.26.1.1.32867: Flags [.], ack 37129, win 10220, options [nop,nop,TS val 203939 ecr 418522,nop,nop,sack 2 {41413:52837}{38557:39985},mptcp dss ack 2512713133], length 0
10:13:49.602121 IP 112.26.1.8.35463 > 112.26.1.1.32867: Flags [.], ack 37129, win 10312, options [nop,nop,TS val 204043 ecr 418522,nop,nop,sack 2 {41413:54265}{38557:39985},mptcp dss ack 2512713133], length 0
10:13:49.654977 IP 112.26.1.1.32867 > 112.26.1.8.35463: Flags [.], seq 54265:55693, ack 1, win 2678, options [nop,nop,TS val 420541 ecr 203560,mptcp dss ack 2629537759 seq 2512785961 subseq 54265 len 1428 csum 0xaa7d], length 1428
10:13:49.661224 IP 112.26.1.8.35463 > 112.26.1.1.32867: Flags [.], ack 55693, win 10722, options [nop,nop,TS val 204456 ecr 420541,mptcp dss ack 2512745977], length 0
10:13:49.758786 IP 112.26.1.8.35463 > 112.26.1.1.32867: Flags [.], ack 39985, win 10403, options [nop,nop,TS val 204134 ecr 419874,nop,nop,sack 1 {41413:54265},mptcp dss ack 2512721701], length 0
10:13:49.798429 IP 112.26.1.1.32867 > 112.26.1.8.35463: Flags [.], seq 55693:57121, ack 1, win 2678, options [nop,nop,TS val 420552 ecr 203752,mptcp dss ack 2629537759 seq 2512787389 subseq 55693 len 1428 csum 0x9e5d], length 1428
10:13:49.801603 IP 112.26.1.8.35463 > 112.26.1.1.32867: Flags [.], ack 57121, win 10859, options [nop,nop,TS val 204597 ecr 420552,mptcp dss ack 2512745977], length 0
10:13:49.888355 IP 112.26.1.8.35463 > 112.26.1.1.32867: Flags [.], ack 54265, win 10540, options [nop,nop,TS val 204260 ecr 420076,mptcp dss ack 2512745977], length 0
10:13:49.973770 IP 112.26.1.1.32867 > 112.26.1.8.35463: Flags [.], seq 57121:58549, ack 1, win 2678, options [nop,nop,TS val 420684 ecr 203842,mptcp dss ack 2629537759 seq 2512791673 subseq 57121 len 1428 csum 0xb8d9], length 1428
10:13:50.003136 IP 112.26.1.1.32867 > 112.26.1.8.35463: Flags [.], seq 58549:59977, ack 1, win 2678, options [nop,nop,TS val 420690 ecr 203939,mptcp dss ack 2629537759 seq 2512793101 subseq 58549 len 1428 csum 0xf96c], length 1428
10:13:50.053737 IP 112.26.1.8.35463 > 112.26.1.1.32867: Flags [.], ack 58549, win 11087, options [nop,nop,TS val 204847 ecr 420684,mptcp dss ack 2512745977], length 0
10:13:50.072417 IP 112.26.1.1.32867 > 112.26.1.8.35463: Flags [.], seq 59977:61405, ack 1, win 2678, options [nop,nop,TS val 420798 ecr 204043,mptcp dss ack 2629537759 seq 2512794529 subseq 59977 len 1428 csum 0x9d1], length 1428
10:13:50.100571 IP 112.26.1.8.35463 > 112.26.1.1.32867: Flags [.], ack 59977, win 11179, options [nop,nop,TS val 204895 ecr 420690,mptcp dss ack 2512745977], length 0
10:13:50.161389 IP 112.26.1.8.35463 > 112.26.1.1.32867: Flags [.], ack 55693, win 10722, options [nop,nop,TS val 204456 ecr 420541,mptcp dss ack 2512745977], length 0
10:13:50.248625 IP 112.26.1.1.32867 > 112.26.1.8.35463: Flags [.], seq 61405:62833, ack 1, win 2678, options [nop,nop,TS val 420898 ecr 204134,mptcp dss ack 2629537759 seq 2512795957 subseq 61405 len 1428 csum 0x15cb], length 1428
10:13:50.276327 IP 112.26.1.8.35463 > 112.26.1.1.32867: Flags [.], ack 61405, win 11361, options [nop,nop,TS val 205071 ecr 420798,mptcp dss ack 2512745977], length 0
10:13:50.293423 IP 112.26.1.8.35463 > 112.26.1.1.32867: Flags [.], ack 57121, win 10859, options [nop,nop,TS val 204597 ecr 420552,mptcp dss ack 2512745977], length 0
10:13:50.360384 IP 112.26.1.8.35463 > 112.26.1.1.32867: Flags [.], ack 62833, win 11407, options [nop,nop,TS val 205155 ecr 420898,mptcp dss ack 2512745977], length 0
10:13:50.397054 IP 112.26.1.1.32867 > 112.26.1.8.35463: Flags [.], seq 62833:64261, ack 1, win 2678, options [nop,nop,TS val 421027 ecr 204260,mptcp dss ack 2629537759 seq 2512798813 subseq 62833 len 1428 csum 0x7bbc], length 1428
10:13:50.491226 IP 112.26.1.8.35463 > 112.26.1.1.32867: Flags [.], ack 64261, win 11544, options [nop,nop,TS val 205286 ecr 421027,mptcp dss ack 2512745977], length 0
10:13:50.500375 IP 112.26.1.1.32867 > 112.26.1.8.35463: Flags [.], seq 64261:65689, ack 1, win 2678, options [nop,nop,TS val 421300 ecr 204456,mptcp dss ack 2629537759 seq 2512801669 subseq 64261 len 1428 csum 0xb050], length 1428
10:13:50.571640 IP 112.26.1.8.35463 > 112.26.1.1.32867: Flags [.], ack 58549, win 11087, options [nop,nop,TS val 204847 ecr 420684,mptcp dss ack 2512745977], length 0
10:13:50.612282 IP 112.26.1.8.35463 > 112.26.1.1.32867: Flags [.], ack 65689, win 11680, options [nop,nop,TS val 205407 ecr 421300,mptcp dss ack 2512745977], length 0
10:13:50.662997 IP 112.26.1.1.32867 > 112.26.1.8.35463: Flags [.], seq 65689:67117, ack 1, win 2678, options [nop,nop,TS val 421432 ecr 204597,mptcp dss ack 2629537759 seq 2512803097 subseq 65689 len 1428 csum 0xb409], length 1428
10:13:50.691472 IP 112.26.1.8.35463 > 112.26.1.1.32867: Flags [.], ack 59977, win 11179, options [nop,nop,TS val 204895 ecr 420690,mptcp dss ack 2512745977], length 0
10:13:50.742433 IP 112.26.1.8.35463 > 112.26.1.1.32867: Flags [.], ack 61405, win 11361, options [nop,nop,TS val 205071 ecr 420798,mptcp dss ack 2512745977], length 0
10:13:50.758486 IP 112.26.1.8.35463 > 112.26.1.1.32867: Flags [.], ack 67117, win 11817, options [nop,nop,TS val 205553 ecr 421432,mptcp dss ack 2512745977], length 0
10:13:50.805287 IP 112.26.1.1.32867 > 112.26.1.8.35463: Flags [.], seq 67117:68545, ack 1, win 2678, options [nop,nop,TS val 421432 ecr 204597,mptcp dss ack 2629537759 seq 2512804525 subseq 67117 len 1428 csum 0x5314], length 1428
10:13:50.852682 IP 112.26.1.8.35463 > 112.26.1.1.32867: Flags [.], ack 68545, win 11954, options [nop,nop,TS val 205646 ecr 421432,mptcp dss ack 2512745977], length 0
10:13:50.884854 IP 112.26.1.8.35463 > 112.26.1.1.32867: Flags [.], ack 62833, win 11407, options [nop,nop,TS val 205155 ecr 420898,mptcp dss ack 2512745977], length 0
10:13:50.916242 IP 112.26.1.8.35463 > 112.26.1.1.32867: Flags [.], ack 64261, win 11544, options [nop,nop,TS val 205286 ecr 421027,mptcp dss ack 2512745977], length 0
10:13:50.976138 IP 112.26.1.1.32867 > 112.26.1.8.35463: Flags [.], seq 68545:69973, ack 1, win 2678, options [nop,nop,TS val 421711 ecr 204847,mptcp dss ack 2629537759 seq 2512813093 subseq 68545 len 1428 csum 0x3e7c], length 1428
10:13:50.979645 IP 112.26.1.8.35463 > 112.26.1.1.32867: Flags [.], ack 69973, win 12045, options [nop,nop,TS val 205774 ecr 421711,mptcp dss ack 2512745977], length 0
10:13:51.065714 IP 112.26.1.1.32867 > 112.26.1.8.35463: Flags [.], seq 69973:71401, ack 1, win 2678, options [nop,nop,TS val 421831 ecr 204895,mptcp dss ack 2629537759 seq 2512815949 subseq 69973 len 1428 csum 0x46cd], length 1428
10:13:51.087129 IP 112.26.1.8.35463 > 112.26.1.1.32867: Flags [.], ack 71401, win 12137, options [nop,nop,TS val 205882 ecr 421831,mptcp dss ack 2512745977], length 0
10:13:51.105800 IP 112.26.1.8.35463 > 112.26.1.1.32867: Flags [.], ack 65689, win 11680, options [nop,nop,TS val 205407 ecr 421300,mptcp dss ack 2512745977], length 0
10:13:51.168983 IP 112.26.1.1.32867 > 112.26.1.8.35463: Flags [.], seq 71401:72829, ack 1, win 2678, options [nop,nop,TS val 421881 ecr 205071,mptcp dss ack 2629537759 seq 2512818805 subseq 71401 len 1428 csum 0x594d], length 1428
10:13:51.190902 IP 112.26.1.8.35463 > 112.26.1.1.32867: Flags [.], ack 72829, win 12274, options [nop,nop,TS val 205985 ecr 421881,mptcp dss ack 2512745977], length 0
10:13:51.263792 IP 112.26.1.8.35463 > 112.26.1.1.32867: Flags [.], ack 67117, win 11817, options [nop,nop,TS val 205553 ecr 421432,mptcp dss ack 2512745977], length 0
10:13:51.293978 IP 112.26.1.8.35463 > 112.26.1.1.32867: Flags [.], ack 68545, win 11954, options [nop,nop,TS val 205646 ecr 421432,mptcp dss ack 2512745977], length 0
10:13:51.382986 IP 112.26.1.1.32867 > 112.26.1.8.35463: Flags [.], seq 72829:74257, ack 1, win 2678, options [nop,nop,TS val 422024 ecr 205155,mptcp dss ack 2629537759 seq 2512821661 subseq 72829 len 1428 csum 0x67d8], length 1428
10:13:51.387962 IP 112.26.1.8.35463 > 112.26.1.1.32867: Flags [.], ack 74257, win 12502, options [nop,nop,TS val 206183 ecr 422024,mptcp dss ack 2512823089], length 0
10:13:51.482140 IP 112.26.1.8.35463 > 112.26.1.1.32867: Flags [.], ack 69973, win 12045, options [nop,nop,TS val 205774 ecr 421711,mptcp dss ack 2512745977], length 0
10:13:51.504413 IP 112.26.1.1.32867 > 112.26.1.8.35463: Flags [.], seq 75685:77113, ack 1, win 2678, options [nop,nop,TS val 422245 ecr 205407,mptcp dss ack 2629537759 seq 2512828801 subseq 75685 len 1428 csum 0x59b], length 1428
10:13:51.515337 IP 112.26.1.8.35463 > 112.26.1.1.32867: Flags [.], ack 74257, win 12639, options [nop,nop,TS val 206306 ecr 422024,nop,nop,sack 1 {75685:77113},mptcp dss ack 2512823089], length 0
10:13:51.578558 IP 112.26.1.8.35463 > 112.26.1.1.32867: Flags [.], ack 71401, win 12137, options [nop,nop,TS val 205882 ecr 421831,mptcp dss ack 2512745977], length 0
10:13:51.664342 IP 112.26.1.8.35463 > 112.26.1.1.32867: Flags [.], ack 72829, win 12274, options [nop,nop,TS val 205985 ecr 421881,mptcp dss ack 2512745977], length 0
10:13:51.693436 IP 112.26.1.1.32867 > 112.26.1.8.35463: Flags [.], seq 77113:78541, ack 1, win 2678, options [nop,nop,TS val 422403 ecr 205553,mptcp dss ack 2629537759 seq 2512833085 subseq 77113 len 1428 csum 0xa86e], length 1428
10:13:51.707239 IP 112.26.1.8.35463 > 112.26.1.1.32867: Flags [.], ack 74257, win 12775, options [nop,nop,TS val 206492 ecr 422024,nop,nop,sack 1 {75685:78541},mptcp dss ack 2512823089], length 0
10:13:51.768909 IP 112.26.1.1.32867 > 112.26.1.8.35463: Flags [.], seq 78541:79969, ack 1, win 2678, options [nop,nop,TS val 422433 ecr 205646,mptcp dss ack 2629537759 seq 2512834513 subseq 78541 len 1428 csum 0x3026], length 1428
10:13:51.802579 IP 112.26.1.1.32867 > 112.26.1.8.35463: Flags [.], seq 79969:81397, ack 1, win 2678, options [nop,nop,TS val 422433 ecr 205646,mptcp dss ack 2629537759 seq 2512835941 subseq 79969 len 1428 csum 0xd822], length 1428
10:13:51.862494 IP 112.26.1.8.35463 > 112.26.1.1.32867: Flags [.], ack 74257, win 12958, options [nop,nop,TS val 206656 ecr 422024,nop,nop,sack 1 {75685:79969},mptcp dss ack 2512823089], length 0
10:13:51.887187 IP 112.26.1.8.35463 > 112.26.1.1.32867: Flags [.], ack 74257, win 12502, options [nop,nop,TS val 206183 ecr 422024,mptcp dss ack 2512823089], length 0
10:13:51.895884 IP 112.26.1.8.35463 > 112.26.1.1.32867: Flags [.], ack 74257, win 13004, options [nop,nop,TS val 206691 ecr 422024,nop,nop,sack 1 {75685:81397},mptcp dss ack 2512823089], length 0
10:13:51.961196 IP 112.26.1.1.32867 > 112.26.1.8.35463: Flags [.], seq 81397:82825, ack 1, win 2678, options [nop,nop,TS val 422621 ecr 205774,mptcp dss ack 2629537759 seq 2512841653 subseq 81397 len 1428 csum 0x7a60], length 1428
10:13:52.000826 IP 112.26.1.8.35463 > 112.26.1.1.32867: Flags [.], ack 74257, win 12639, options [nop,nop,TS val 206306 ecr 422024,nop,nop,sack 1 {75685:77113},mptcp dss ack 2512823089], length 0
10:13:52.057442 IP 112.26.1.1.32867 > 112.26.1.8.35463: Flags [.], seq 82825:84253, ack 1, win 2678, options [nop,nop,TS val 422717 ecr 205882,mptcp dss ack 2629537759 seq 2512844509 subseq 82825 len 1428 csum 0xbfd], length 1428
10:13:52.089862 IP 112.26.1.8.35463 > 112.26.1.1.32867: Flags [.], ack 74257, win 13186, options [nop,nop,TS val 206874 ecr 422024,nop,nop,sack 1 {75685:82825},mptcp dss ack 2512823089], length 0
10:13:52.126799 IP 112.26.1.8.35463 > 112.26.1.1.32867: Flags [.], ack 74257, win 13277, options [nop,nop,TS val 206912 ecr 422024,nop,nop,sack 1 {75685:84253},mptcp dss ack 2512823089], length 0
10:13:52.156043 IP 112.26.1.1.32867 > 112.26.1.8.35463: Flags [.], seq 84253:85681, ack 1, win 2678, options [nop,nop,TS val 422803 ecr 205985,mptcp dss ack 2629537759 seq 2512847365 subseq 84253 len 1428 csum 0x6fc2], length 1428
10:13:52.182613 IP 112.26.1.8.35463 > 112.26.1.1.32867: Flags [.], ack 74257, win 12775, options [nop,nop,TS val 206492 ecr 422024,nop,nop,sack 1 {75685:78541},mptcp dss ack 2512823089], length 0
10:13:52.267585 IP 112.26.1.8.35463 > 112.26.1.1.32867: Flags [.], ack 74257, win 13414, options [nop,nop,TS val 207062 ecr 422024,nop,nop,sack 1 {75685:85681},mptcp dss ack 2512823089], length 0
10:13:52.286606 IP 112.26.1.1.32867 > 112.26.1.8.35463: Flags [.], seq 85681:87109, ack 1, win 2678, options [nop,nop,TS val 423026 ecr 206183,mptcp dss ack 2629537759 seq 2512853077 subseq 85681 len 1428 csum 0x4592], length 1428
10:13:52.310846 IP 112.26.1.8.35463 > 112.26.1.1.32867: Flags [.], ack 74257, win 12958, options [nop,nop,TS val 206656 ecr 422024,nop,nop,sack 1 {75685:79969},mptcp dss ack 2512823089], length 0
10:13:52.396794 IP 112.26.1.8.35463 > 112.26.1.1.32867: Flags [.], ack 74257, win 13551, options [nop,nop,TS val 207191 ecr 422024,nop,nop,sack 1 {75685:87109},mptcp dss ack 2512823089], length 0
10:13:52.399488 IP 112.26.1.8.35463 > 112.26.1.1.32867: Flags [.], ack 74257, win 13004, options [nop,nop,TS val 206691 ecr 422024,nop,nop,sack 1 {75685:81397},mptcp dss ack 2512823089], length 0
10:13:52.480549 IP 112.26.1.1.32867 > 112.26.1.8.35463: Flags [.], seq 87109:88537, ack 1, win 2678, options [nop,nop,TS val 423205 ecr 206306,mptcp dss ack 2629537759 seq 2512854505 subseq 87109 len 1428 csum 0xe4a1], length 1428
10:13:52.507304 IP 112.26.1.8.35463 > 112.26.1.1.32867: Flags [.], ack 74257, win 13688, options [nop,nop,TS val 207300 ecr 422024,nop,nop,sack 1 {75685:88537},mptcp dss ack 2512823089], length 0
10:13:52.526116 IP 112.26.1.1.32867 > 112.26.1.8.35463: Flags [.], seq 88537:89965, ack 1, win 2678, options [nop,nop,TS val 423327 ecr 206492,mptcp dss ack 2629537759 seq 2512858789 subseq 88537 len 1428 csum 0x1985], length 1428
10:13:52.584412 IP 112.26.1.8.35463 > 112.26.1.1.32867: Flags [.], ack 74257, win 13186, options [nop,nop,TS val 206874 ecr 422024,nop,nop,sack 1 {75685:82825},mptcp dss ack 2512823089], length 0
10:13:52.614219 IP 112.26.1.8.35463 > 112.26.1.1.32867: Flags [.], ack 74257, win 13277, options [nop,nop,TS val 206912 ecr 422024,nop,nop,sack 1 {75685:84253},mptcp dss ack 2512823089], length 0
10:13:52.664415 IP 112.26.1.8.35463 > 112.26.1.1.32867: Flags [.], ack 74257, win 13825, options [nop,nop,TS val 207455 ecr 422024,nop,nop,sack 1 {75685:89965},mptcp dss ack 2512823089], length 0
10:13:52.707244 IP 112.26.1.1.32867 > 112.26.1.8.35463: Flags [.], seq 74257:75685, ack 1, win 2678, options [nop,nop,TS val 423450 ecr 206656,mptcp dss ack 2629537759 seq 2512823089 subseq 74257 len 1428 csum 0x44f2], length 1428
10:13:52.762041 IP 112.26.1.8.35463 > 112.26.1.1.32867: Flags [.], ack 89965, win 13916, options [nop,nop,TS val 207555 ecr 423450,mptcp dss ack 2512864501], length 0
10:13:52.791236 IP 112.26.1.8.35463 > 112.26.1.1.32867: Flags [.], ack 74257, win 13414, options [nop,nop,TS val 207062 ecr 422024,nop,nop,sack 1 {75685:85681},mptcp dss ack 2512823089], length 0
10:13:52.820772 IP 112.26.1.1.32867 > 112.26.1.8.35463: Flags [.], seq 89965:91393, ack 1, win 2678, options [nop,nop,TS val 423597 ecr 206691,mptcp dss ack 2629537759 seq 2512864501 subseq 89965 len 1428 csum 0x2e43], length 1428
10:13:52.827902 IP 112.26.1.8.35463 > 112.26.1.1.32867: Flags [.], ack 91393, win 14053, options [nop,nop,TS val 207623 ecr 423597,mptcp dss ack 2512871641], length 0
10:13:52.906258 IP 112.26.1.8.35463 > 112.26.1.1.32867: Flags [.], ack 74257, win 13551, options [nop,nop,TS val 207191 ecr 422024,nop,nop,sack 1 {75685:87109},mptcp dss ack 2512823089], length 0
10:13:52.959974 IP 112.26.1.8.35463 > 112.26.1.1.32867: Flags [.], ack 74257, win 13688, options [nop,nop,TS val 207300 ecr 422024,nop,nop,sack 1 {75685:88537},mptcp dss ack 2512823089], length 0
10:13:53.003462 IP 112.26.1.8.35463 > 112.26.1.1.32867: Flags [.], ack 74257, win 13825, options [nop,nop,TS val 207455 ecr 422024,nop,nop,sack 1 {75685:89965},mptcp dss ack 2512823089], length 0
10:13:53.078594 IP 112.26.1.8.35463 > 112.26.1.1.32867: Flags [.], ack 89965, win 13916, options [nop,nop,TS val 207555 ecr 423450,mptcp dss ack 2512864501], length 0
10:13:53.119961 IP 112.26.1.1.32867 > 112.26.1.8.35463: Flags [.], seq 91393:92821, ack 1, win 2678, options [nop,nop,TS val 423963 ecr 207062,mptcp dss ack 2629537759 seq 2512877353 subseq 91393 len 1428 csum 0xe416], length 1428
10:13:53.123410 IP 112.26.1.8.35463 > 112.26.1.1.32867: Flags [.], ack 92821, win 14281, options [nop,nop,TS val 207918 ecr 423963,mptcp dss ack 2512878781], length 0
10:13:53.221777 IP 112.26.1.8.35463 > 112.26.1.1.32867: Flags [.], ack 91393, win 14053, options [nop,nop,TS val 207623 ecr 423597,mptcp dss ack 2512871641], length 0
