10:13:39.685605 IP 112.26.0.1.32867 > 112.26.0.8.55628: Flags [.], seq 1:1429, ack 1, win 1339, options [nop,nop,TS val 410629 ecr 194178,mptcp dss ack 2629537759 seq 2512517685 subseq 1 len 1428 csum 0xd56d], length 1428
10:13:39.719090 IP 112.26.0.1.32867 > 112.26.0.8.55628: Flags [.], seq 1429:2857, ack 1, win 1339, options [nop,nop,TS val 410629 ecr 194178,mptcp dss ack 2629537759 seq 2512519113 subseq 1429 len 1428 csum 0xf4bb], length 1428
10:13:39.911744 IP 112.26.0.1.32867 > 112.26.0.8.55628: Flags [.], seq 4097:5525, ack 1, win 1339, options [nop,nop,TS val 410629 ecr 194178,mptcp dss ack 2629537759 seq 2512521781 subseq 4097 len 1428 csum 0x29c7], length 1428
10:13:40.011543 IP 112.26.0.1.32867 > 112.26.0.8.55628: Flags [.], seq 5525:6953, ack 1, win 1339, options [nop,nop,TS val 410629 ecr 194178,mptcp dss ack 2629537759 seq 2512523209 subseq 5525 len 1428 csum 0x863c], length 1428
10:13:40.093325 IP 112.26.0.1.32867 > 112.26.0.8.55628: Flags [.], seq 6953:8381, ack 1, win 1339, options [nop,nop,TS val 410629 ecr 194178,mptcp dss ack 2629537759 seq 2512524637 subseq 6953 len 1428 csum 0x2009], length 1428
10:13:40.196098 IP 112.26.0.1.32867 > 112.26.0.8.55628: Flags [.], seq 8381:9809, ack 1, win 1339, options [nop,nop,TS val 410630 ecr 194178,mptcp dss ack 2629537759 seq 2512526065 subseq 8381 len 1428 csum 0xef9a], length 1428
10:13:40.222313 IP 112.26.0.1.32867 > 112.26.0.8.55628: Flags [.], seq 9809:11237, ack 1, win 1339, options [nop,nop,TS val 410630 ecr 194178,mptcp dss ack 2629537759 seq 2512527493 subseq 9809 len 1428 csum 0xe806], length 1428
10:13:40.301491 IP 112.26.0.1.32867 > 112.26.0.8.55628: Flags [.], seq 14093:15521, ack 1, win 1339, options [nop,nop,TS val 410934 ecr 194482,mptcp dss ack 2629537759 seq 2512531777 subseq 14093 len 1428 csum 0xac23], length 1428
10:13:40.394226 IP 112.26.0.1.32867 > 112.26.0.8.55628: Flags [.], seq 15521:16949, ack 1, win 1339, options [nop,nop,TS val 410934 ecr 194482,mptcp dss ack 2629537759 seq 2512533205 subseq 15521 len 1428 csum 0x177f], length 1428
10:13:40.476238 IP 112.26.0.1.32867 > 112.26.0.8.55628: Flags [.], seq 16949:18377, ack 1, win 1339, options [nop,nop,TS val 411016 ecr 194516,mptcp dss ack 2629537759 seq 2512534633 subseq 16949 len 1428 csum 0xd3], length 1428
10:13:40.508657 IP 112.26.0.1.32867 > 112.26.0.8.55628: Flags [.], seq 18377:19805, ack 1, win 1339, options [nop,nop,TS val 411016 ecr 194516,mptcp dss ack 2629537759 seq 2512536061 subseq 18377 len 1428 csum 0xa1f], length 1428
10:13:40.591502 IP 112.26.0.1.32867 > 112.26.0.8.55628: Flags [.], seq 19805:21233, ack 1, win 1339, options [nop,nop,TS val 411113 ecr 194672,mptcp dss ack 2629537759 seq 2512537489 subseq 19805 len 1428 csum 0xc9c0], length 1428
10:13:40.690751 IP 112.26.0.1.32867 > 112.26.0.8.55628: Flags [.], seq 21233:22661, ack 1, win 1339, options [nop,nop,TS val 411113 ecr 194672,mptcp dss ack 2629537759 seq 2512538917 subseq 21233 len 1428 csum 0x12c1], length 1428
10:13:40.783649 IP 112.26.0.1.32867 > 112.26.0.8.55628: Flags [.], seq 22661:24089, ack 1, win 1339, options [nop,nop,TS val 411209 ecr 194708,mptcp dss ack 2629537759 seq 2512540345 subseq 22661 len 1428 csum 0x6f5b], length 1428
10:13:40.881044 IP 112.26.0.1.32867 > 112.26.0.8.55628: Flags [.], seq 24089:25517, ack 1, win 1339, options [nop,nop,TS val 411209 ecr 194708,mptcp dss ack 2629537759 seq 2512541773 subseq 24089 len 1428 csum 0x72a], length 1428
10:13:40.916068 IP 112.26.0.1.32867 > 112.26.0.8.55628: Flags [.], seq 25517:26945, ack 1, win 1339, options [nop,nop,TS val 411252 ecr 194808,mptcp dss ack 2629537759 seq 2512543201 subseq 25517 len 1428 csum 0x2128], length 1428
10:13:41.001608 IP 112.26.0.1.32867 > 112.26.0.8.55628: Flags [.], seq 26945:28373, ack 1, win 1339, options [nop,nop,TS val 411252 ecr 194808,mptcp dss ack 2629537759 seq 2512544629 subseq 26945 len 1428 csum 0xa724], length 1428
10:13:41.096744 IP 112.26.0.1.32867 > 112.26.0.8.55628: Flags [.], seq 28373:29801, ack 1, win 1339, options [nop,nop,TS val 411322 ecr 194890,mptcp dss ack 2629537759 seq 2512546057 subseq 28373 len 1428 csum 0xb381], length 1428
10:13:41.191333 IP 112.26.0.1.32867 > 112.26.0.8.55628: Flags [.], seq 29801:31229, ack 1, win 1339, options [nop,nop,TS val 411322 ecr 194890,mptcp dss ack 2629537759 seq 2512547485 subseq 29801 len 1428 csum 0xd922], length 1428
10:13:41.225800 IP 112.26.0.1.32867 > 112.26.0.8.55628: Flags [.], seq 34085:35513, ack 1, win 1339, options [nop,nop,TS val 411453 ecr 195019,mptcp dss ack 2629537759 seq 2512551769 subseq 34085 len 1428 csum 0x68fe], length 1428
10:13:41.312023 IP 112.26.0.1.32867 > 112.26.0.8.55628: Flags [.], seq 36941:38369, ack 1, win 1339, options [nop,nop,TS val 411716 ecr 195098,mptcp dss ack 2629537759 seq 2512554625 subseq 36941 len 1428 csum 0xae16], length 1428
10:13:41.394286 IP 112.26.0.1.32867 > 112.26.0.8.55628: Flags [.], seq 11237:12665, ack 1, win 1339, options [nop,nop,TS val 411716 ecr 195190,mptcp dss ack 2629537759 seq 2512528921 subseq 11237 len 1428 csum 0x178d], length 1428
10:13:41.489544 IP 112.26.0.1.32867 > 112.26.0.8.55628: Flags [.], seq 38369:39797, ack 1, win 1339, options [nop,nop,TS val 411936 ecr 195387,mptcp dss ack 2629537759 seq 2512556053 subseq 38369 len 1428 csum 0x341c], length 1428
10:13:41.579600 IP 112.26.0.1.32867 > 112.26.0.8.55628: Flags [.], seq 39797:41225, ack 1, win 1339, options [nop,nop,TS val 412032 ecr 195487,mptcp dss ack 2629537759 seq 2512557481 subseq 39797 len 1428 csum 0x7f], length 1428
10:13:41.614313 IP 112.26.0.1.32867 > 112.26.0.8.55628: Flags [.], seq 41225:42653, ack 1, win 1339, options [nop,nop,TS val 412222 ecr 195678,mptcp dss ack 2629537759 seq 2512558909 subseq 41225 len 1428 csum 0xf9b7], length 1428
10:13:41.697666 IP 112.26.0.1.32867 > 112.26.0.8.55628: Flags [.], seq 42653:44081, ack 1, win 1339, options [nop,nop,TS val 412324 ecr 195713,mptcp dss ack 2629537759 seq 2512560337 subseq 42653 len 1428 csum 0x1956], length 1428
10:13:41.785269 IP 112.26.0.1.32867 > 112.26.0.8.55628: Flags [.], seq 44081:45509, ack 1, win 1339, options [nop,nop,TS val 412460 ecr 195988,mptcp dss ack 2629537759 seq 2512561765 subseq 44081 len 1428 csum 0x9fc], length 1428
10:13:41.811525 IP 112.26.0.1.32867 > 112.26.0.8.55628: Flags [.], seq 31229:32657, ack 1, win 1339, options [nop,nop,TS val 412460 ecr 196022,mptcp dss ack 2629537759 seq 2512548913 subseq 31229 len 1428 csum 0xcc62], length 1428
10:13:41.893719 IP 112.26.0.1.32867 > 112.26.0.8.55628: Flags [.], seq 32657:34085, ack 1, win 1339, options [nop,nop,TS val 412547 ecr 196108,mptcp dss ack 2629537759 seq 2512550341 subseq 32657 len 1428 csum 0x480d], length 1428
10:13:41.997334 IP 112.26.0.1.32867 > 112.26.0.8.55628: Flags [.], seq 35513:36941, ack 1, win 1339, options [nop,nop,TS val 412620 ecr 196190,mptcp dss ack 2629537759 seq 2512553197 subseq 35513 len 1428 csum 0x55a3], length 1428
10:13:42.027995 IP 112.26.0.1.32867 > 112.26.0.8.55628: Flags [.], seq 45509:46937, ack 1, win 1339, options [nop,nop,TS val 412620 ecr 196190,mptcp dss ack 2629537759 seq 2512563193 subseq 45509 len 1428 csum 0x97a1], length 1428
10:13:42.111848 IP 112.26.0.1.32867 > 112.26.0.8.55628: Flags [.], seq 48365:49793, ack 1, win 1339, options [nop,nop,TS val 412620 ecr 196190,mptcp dss ack 2629537759 seq 2512566049 subseq 48365 len 1428 csum 0x7841], length 1428
10:13:42.200159 IP 112.26.0.1.32867 > 112.26.0.8.55628: Flags [.], seq 12665:14093, ack 1, win 1339, options [nop,nop,TS val 412651 ecr 196286,mptcp dss ack 2629537759 seq 2512530349 subseq 12665 len 1428 csum 0x598a], length 1428
10:13:42.291075 IP 112.26.0.1.32867 > 112.26.0.8.55628: Flags [.], seq 49793:51221, ack 1, win 1339, options [nop,nop,TS val 412825 ecr 196376,mptcp dss ack 2629537759 seq 2512567477 subseq 49793 len 1428 csum 0x33f2], length 1428
10:13:42.332684 IP 112.26.0.1.32867 > 112.26.0.8.55628: Flags [.], seq 52649:54077, ack 1, win 1339, options [nop,nop,TS val 412964 ecr 196494,mptcp dss ack 2629537759 seq 2512570333 subseq 52649 len 1428 csum 0x3eeb], length 1428
10:13:42.418062 IP 112.26.0.1.32867 > 112.26.0.8.55628: Flags [.], seq 54077:55505, ack 1, win 1339, options [nop,nop,TS val 413048 ecr 196581,mptcp dss ack 2629537759 seq 2512571761 subseq 54077 len 1428 csum 0x3bf7], length 1428
10:13:42.609640 IP 112.26.0.1.32867 > 112.26.0.8.55628: Flags [.], seq 55505:56933, ack 1, win 1339, options [nop,nop,TS val 413259 ecr 196607,mptcp dss ack 2629537759 seq 2512573189 subseq 55505 len 1428 csum 0x73f1], length 1428
10:13:42.703127 IP 112.26.0.1.32867 > 112.26.0.8.55628: Flags [.], seq 56933:58361, ack 1, win 1339, options [nop,nop,TS val 413356 ecr 196690,mptcp dss ack 2629537759 seq 2512574617 subseq 56933 len 1428 csum 0x897b], length 1428
10:13:42.791767 IP 112.26.0.1.32867 > 112.26.0.8.55628: Flags [.], seq 58361:59789, ack 1, win 1339, options [nop,nop,TS val 413435 ecr 196793,mptcp dss ack 2629537759 seq 2512576045 subseq 58361 len 1428 csum 0xf788], length 1428
10:13:42.820433 IP 112.26.0.1.32867 > 112.26.0.8.55628: Flags [.], seq 59789:61217, ack 1, win 1339, options [nop,nop,TS val 413465 ecr 196825,mptcp dss ack 2629537759 seq 2512577473 subseq 59789 len 1428 csum 0x846e], length 1428
10:13:42.908403 IP 112.26.0.1.32867 > 112.26.0.8.55628: Flags [.], seq 46937:48365, ack 1, win 1339, options [nop,nop,TS val 413465 ecr 196909,mptcp dss ack 2629537759 seq 2512564621 subseq 46937 len 1428 csum 0xe63a], length 1428
10:13:42.999957 IP 112.26.0.1.32867 > 112.26.0.8.55628: Flags [.], seq 61217:62645, ack 1, win 1339, options [nop,nop,TS val 413547 ecr 196997,mptcp dss ack 2629537759 seq 2512578901 subseq 61217 len 1428 csum 0x12a7], length 1428
10:13:43.103527 IP 112.26.0.1.32867 > 112.26.0.8.55628: Flags [.], seq 64073:65501, ack 1, win 1339, options [nop,nop,TS val 413649 ecr 197088,mptcp dss ack 2629537759 seq 2512581757 subseq 64073 len 1428 csum 0x3ead], length 1428
10:13:43.202610 IP 112.26.0.1.32867 > 112.26.0.8.55628: Flags [.], seq 65501:66929, ack 1, win 1339, options [nop,nop,TS val 413763 ecr 197215,mptcp dss ack 2629537759 seq 2512583185 subseq 65501 len 1428 csum 0x1fc2], length 1428
10:13:43.238443 IP 112.26.0.1.32867 > 112.26.0.8.55628: Flags [.], seq 66929:68357, ack 1, win 1339, options [nop,nop,TS val 414027 ecr 197588,mptcp dss ack 2629537759 seq 2512584613 subseq 66929 len 1428 csum 0xa71e], length 1428
10:13:43.323079 IP 112.26.0.1.32867 > 112.26.0.8.55628: Flags [.], seq 68357:69785, ack 1, win 1339, options [nop,nop,TS val 414067 ecr 197617,mptcp dss ack 2629537759 seq 2512586041 subseq 68357 len 1428 csum 0xec16], length 1428
10:13:43.408216 IP 112.26.0.1.32867 > 112.26.0.8.55628: Flags [.], seq 69785:71213, ack 1, win 1339, options [nop,nop,TS val 414067 ecr 197705,mptcp dss ack 2629537759 seq 2512587469 subseq 69785 len 1428 csum 0xb5c5], length 1428
10:13:43.435555 IP 112.26.0.1.32867 > 112.26.0.8.55628: Flags [.], seq 71213:72641, ack 1, win 1339, options [nop,nop,TS val 414331 ecr 197796,mptcp dss ack 2629537759 seq 2512588897 subseq 71213 len 1428 csum 0xf072], length 1428
10:13:43.519396 IP 112.26.0.1.32867 > 112.26.0.8.55628: Flags [.], seq 62645:64073, ack 1, win 1339, options [nop,nop,TS val 414331 ecr 197900,mptcp dss ack 2629537759 seq 2512580329 subseq 62645 len 1428 csum 0x642d], length 1428
10:13:43.608588 IP 112.26.0.1.32867 > 112.26.0.8.55628: Flags [.], seq 51221:52649, ack 1, win 1339, options [nop,nop,TS val 414449 ecr 197999,mptcp dss ack 2629537759 seq 2512568905 subseq 51221 len 1428 csum 0x277], length 1428
10:13:43.691958 IP 112.26.0.1.32867 > 112.26.0.8.55628: Flags [.], seq 72641:74069, ack 1, win 1339, options [nop,nop,TS val 414638 ecr 198035,mptcp dss ack 2629537759 seq 2512590325 subseq 72641 len 1428 csum 0x2120], length 1428
10:13:43.729579 IP 112.26.0.1.32867 > 112.26.0.8.55628: Flags [.], seq 74069:75497, ack 1, win 1339, options [nop,nop,TS val 414771 ecr 198119,mptcp dss ack 2629537759 seq 2512591753 subseq 74069 len 1428 csum 0xc080], length 1428
10:13:43.810290 IP 112.26.0.1.32867 > 112.26.0.8.55628: Flags [.], seq 75497:76925, ack 1, win 1339, options [nop,nop,TS val 414854 ecr 198205,mptcp dss ack 2629537759 seq 2512593181 subseq 75497 len 1428 csum 0x2b68], length 1428
10:13:43.836385 IP 112.26.0.1.32867 > 112.26.0.8.55628: Flags [.], seq 76925:78353, ack 1, win 1339, options [nop,nop,TS val 414936 ecr 198232,mptcp dss ack 2629537759 seq 2512594609 subseq 76925 len 1428 csum 0xc0f2], length 1428
10:13:43.930591 IP 112.26.0.1.32867 > 112.26.0.8.55628: Flags [.], seq 78353:79781, ack 1, win 1339, options [nop,nop,TS val 414966 ecr 198316,mptcp dss ack 2629537759 seq 2512596037 subseq 78353 len 1428 csum 0xfc4e], length 1428
10:13:44.008630 IP 112.26.0.1.32867 > 112.26.0.8.55628: Flags [.], seq 79781:81209, ack 1, win 1339, options [nop,nop,TS val 414966 ecr 198405,mptcp dss ack 2629537759 seq 2512597465 subseq 79781 len 1428 csum 0x3c22], length 1428
10:13:44.034621 IP 112.26.0.1.32867 > 112.26.0.8.55628: Flags [.], seq 81209:82637, ack 1, win 1339, options [nop,nop,TS val 414966 ecr 198405,mptcp dss ack 2629537759 seq 2512598893 subseq 81209 len 1428 csum 0xdba], length 1428
10:13:44.132025 IP 112.26.0.1.32867 > 112.26.0.8.55628: Flags [.], seq 82637:84065, ack 1, win 1339, options [nop,nop,TS val 414966 ecr 198405,mptcp dss ack 2629537759 seq 2512600321 subseq 82637 len 1428 csum 0x8ae9], length 1428
10:13:44.215624 IP 112.26.0.1.32867 > 112.26.0.8.55628: Flags [.], seq 84065:85493, ack 1, win 1339, options [nop,nop,TS val 415057 ecr 198489,mptcp dss ack 2629537759 seq 2512601749 subseq 84065 len 1428 csum 0xd08d], length 1428
10:13:44.247141 IP 112.26.0.1.32867 > 112.26.0.8.55628: Flags [.], seq 85493:86921, ack 1, win 1339, options [nop,nop,TS val 415141 ecr 198526,mptcp dss ack 2629537759 seq 2512603177 subseq 85493 len 1428 csum 0x8989], length 1428
10:13:44.336939 IP 112.26.0.1.32867 > 112.26.0.8.55628: Flags [.], seq 86921:88349, ack 1, win 1339, options [nop,nop,TS val 415180 ecr 198607,mptcp dss ack 2629537759 seq 2512604605 subseq 86921 len 1428 csum 0xd3a1], length 1428
10:13:44.480249 IP 112.26.0.1.32867 > 112.26.0.8.55628: Flags [.], seq 88349:89777, ack 1, win 1339, options [nop,nop,TS val 415180 ecr 198607,mptcp dss ack 2629537759 seq 2512606033 subseq 88349 len 1428 csum 0xd88b], length 1428
10:13:44.549596 IP 112.26.0.1.32867 > 112.26.0.8.55628: Flags [.], seq 89777:91205, ack 1, win 1339, options [nop,nop,TS val 415256 ecr 198633,mptcp dss ack 2629537759 seq 2512607461 subseq 89777 len 1428 csum 0xa3c6], length 1428
10:13:44.621723 IP 112.26.0.1.32867 > 112.26.0.8.55628: Flags [.], seq 91205:92633, ack 1, win 1339, options [nop,nop,TS val 415341 ecr 198727,mptcp dss ack 2629537759 seq 2512608889 subseq 91205 len 1428 csum 0xcb52], length 1428
10:13:44.677048 IP 112.26.0.1.32867 > 112.26.0.8.55628: Flags [.], seq 92633:94061, ack 1, win 1339, options [nop,nop,TS val 415493 ecr 198805,mptcp dss ack 2629537759 seq 2512610317 subseq 92633 len 1428 csum 0x5f25], length 1428
10:13:44.753947 IP 112.26.0.1.32867 > 112.26.0.8.55628: Flags [.], seq 94061:95489, ack 1, win 1339, options [nop,nop,TS val 415592 ecr 198831,mptcp dss ack 2629537759 seq 2512611745 subseq 94061 len 1428 csum 0xe807], length 1428
10:13:44.841366 IP 112.26.0.1.32867 > 112.26.0.8.55628: Flags [.], seq 95489:96917, ack 1, win 1339, options [nop,nop,TS val 415662 ecr 198928,mptcp dss ack 2629537759 seq 2512613173 subseq 95489 len 1428 csum 0x978], length 1428
10:13:44.929492 IP 112.26.0.1.32867 > 112.26.0.8.55628: Flags [.], seq 96917:98345, ack 1, win 1339, options [nop,nop,TS val 415750 ecr 199012,mptcp dss ack 2629537759 seq 2512614601 subseq 96917 len 1428 csum 0x9b94], length 1428
10:13:45.009032 IP 112.26.0.1.32867 > 112.26.0.8.55628: Flags [.], seq 98345:99773, ack 1, win 2678, options [nop,nop,TS val 415807 ecr 199043,mptcp dss ack 2629537759 seq 2512630309 subseq 98345 len 1428 csum 0x3b10], length 1428
10:13:45.115644 IP 112.26.0.1.32867 > 112.26.0.8.55628: Flags [.], seq 99773:101201, ack 1, win 2678, options [nop,nop,TS val 415871 ecr 199133,mptcp dss ack 2629537759 seq 2512631737 subseq 99773 len 1428 csum 0x2917], length 1428
10:13:45.221833 IP 112.26.0.1.32867 > 112.26.0.8.55628: Flags [.], seq 101201:102629, ack 1, win 2678, options [nop,nop,TS val 415978 ecr 199276,mptcp dss ack 2629537759 seq 2512633165 subseq 101201 len 1428 csum 0xd7df], length 1428
10:13:45.264848 IP 112.26.0.1.32867 > 112.26.0.8.55628: Flags [.], seq 102629:104057, ack 1, win 2678, options [nop,nop,TS val 415978 ecr 199276,mptcp dss ack 2629537759 seq 2512634593 subseq 102629 len 1428 csum 0x50ce], length 1428
10:13:45.358659 IP 112.26.0.1.32867 > 112.26.0.8.55628: Flags [.], seq 104057:105485, ack 1, win 2678, options [nop,nop,TS val 416081 ecr 199346,mptcp dss ack 2629537759 seq 2512636021 subseq 104057 len 1428 csum 0x473c], length 1428
10:13:45.434645 IP 112.26.0.1.32867 > 112.26.0.8.55628: Flags [.], seq 105485:106913, ack 1, win 2678, options [nop,nop,TS val 416163 ecr 199418,mptcp dss ack 2629537759 seq 2512637449 subseq 105485 len 1428 csum 0x4be5], length 1428
10:13:45.468180 IP 112.26.0.1.32867 > 112.26.0.8.55628: Flags [.], seq 106913:108341, ack 1, win 2678, options [nop,nop,TS val 416196 ecr 199474,mptcp dss ack 2629537759 seq 2512638877 subseq 106913 len 1428 csum 0x8eab], length 1428
10:13:45.532182 IP 112.26.0.1.32867 > 112.26.0.8.55628: Flags [.], seq 108341:109769, ack 1, win 2678, options [nop,nop,TS val 416279 ecr 199551,mptcp dss ack 2629537759 seq 2512640305 subseq 108341 len 1428 csum 0x7f1e], length 1428
10:13:45.577600 IP 112.26.0.1.32867 > 112.26.0.8.55628: Flags [.], seq 109769:111197, ack 1, win 2678, options [nop,nop,TS val 416346 ecr 199638,mptcp dss ack 2629537759 seq 2512641733 subseq 109769 len 1428 csum 0xec6], length 1428
10:13:45.635227 IP 112.26.0.1.32867 > 112.26.0.8.55628: Flags [.], seq 111197:112625, ack 1, win 2678, options [nop,nop,TS val 416415 ecr 199726,mptcp dss ack 2629537759 seq 2512643161 subseq 111197 len 1428 csum 0xc9ed], length 1428
10:13:45.716303 IP 112.26.0.1.32867 > 112.26.0.8.55628: Flags [.], seq 112625:114053, ack 1, win 2678, options [nop,nop,TS val 416480 ecr 199805,mptcp dss ack 2629537759 seq 2512647445 subseq 112625 len 1428 csum 0x6947], length 1428
10:13:45.810007 IP 112.26.0.1.32867 > 112.26.0.8.55628: Flags [.], seq 114053:115481, ack 1, win 2678, options [nop,nop,TS val 416543 ecr 199912,mptcp dss ack 2629537759 seq 2512648873 subseq 114053 len 1428 csum 0xfb54], length 1428
10:13:45.859300 IP 112.26.0.1.32867 > 112.26.0.8.55628: Flags [.], seq 115481:116909, ack 1, win 2678, options [nop,nop,TS val 416651 ecr 200018,mptcp dss ack 2629537759 seq 2512650301 subseq 115481 len 1428 csum 0x932d], length 1428
10:13:45.939926 IP 112.26.0.1.32867 > 112.26.0.8.55628: Flags [.], seq 116909:118337, ack 1, win 2678, options [nop,nop,TS val 416711 ecr 200061,mptcp dss ack 2629537759 seq 2512654585 subseq 116909 len 1428 csum 0x7098], length 1428
10:13:46.014486 IP 112.26.0.1.32867 > 112.26.0.8.55628: Flags [.], seq 118337:119765, ack 1, win 2678, options [nop,nop,TS val 416792 ecr 200155,mptcp dss ack 2629537759 seq 2512656013 subseq 118337 len 1428 csum 0x20b3], length 1428
10:13:46.066837 IP 112.26.0.1.32867 > 112.26.0.8.55628: Flags [.], seq 119765:121193, ack 1, win 2678, options [nop,nop,TS val 416874 ecr 200231,mptcp dss ack 2629537759 seq 2512657441 subseq 119765 len 1428 csum 0x9f91], length 1428
10:13:46.139067 IP 112.26.0.1.32867 > 112.26.0.8.55628: Flags [.], seq 121193:122621, ack 1, win 2678, options [nop,nop,TS val 416904 ecr 200264,mptcp dss ack 2629537759 seq 2512664581 subseq 121193 len 1428 csum 0xfa7b], length 1428
10:13:46.223129 IP 112.26.0.1.32867 > 112.26.0.8.55628: Flags [.], seq 122621:124049, ack 1, win 2678, options [nop,nop,TS val 416986 ecr 200328,mptcp dss ack 2629537759 seq 2512666009 subseq 122621 len 1428 csum 0x3ae9], length 1428
10:13:46.283789 IP 112.26.0.1.32867 > 112.26.0.8.55628: Flags [.], seq 124049:125477, ack 1, win 2678, options [nop,nop,TS val 417062 ecr 200374,mptcp dss ack 2629537759 seq 2512670293 subseq 124049 len 1428 csum 0x2266], length 1428
10:13:46.359283 IP 112.26.0.1.32867 > 112.26.0.8.55628: Flags [.], seq 125477:126905, ack 1, win 2678, options [nop,nop,TS val 417114 ecr 200431,mptcp dss ack 2629537759 seq 2512673149 subseq 125477 len 1428 csum 0x71c3], length 1428
10:13:46.421120 IP 112.26.0.1.32867 > 112.26.0.8.55628: Flags [.], seq 126905:128333, ack 1, win 2678, options [nop,nop,TS val 417190 ecr 200513,mptcp dss ack 2629537759 seq 2512674577 subseq 126905 len 1428 csum 0x856d], length 1428
10:13:46.469087 IP 112.26.0.1.32867 > 112.26.0.8.55628: Flags [.], seq 128333:129761, ack 1, win 2678, options [nop,nop,TS val 417256 ecr 200607,mptcp dss ack 2629537759 seq 2512676005 subseq 128333 len 1428 csum 0x557c], length 1428
10:13:46.528763 IP 112.26.0.1.32867 > 112.26.0.8.55628: Flags [.], seq 129761:131189, ack 1, win 2678, options [nop,nop,TS val 417308 ecr 200656,mptcp dss ack 2629537759 seq 2512677433 subseq 129761 len 1428 csum 0xcecc], length 1428
10:13:46.573504 IP 112.26.0.1.32867 > 112.26.0.8.55628: Flags [.], seq 131189:132617, ack 1, win 2678, options [nop,nop,TS val 417391 ecr 200736,mptcp dss ack 2629537759 seq 2512678861 subseq 131189 len 1428 csum 0xcf96], length 1428
10:13:46.657100 IP 112.26.0.1.32867 > 112.26.0.8.55628: Flags [.], seq 132617:134045, ack 1, win 2678, options [nop,nop,TS val 417473 ecr 200811,mptcp dss ack 2629537759 seq 2512680289 subseq 132617 len 1428 csum 0xf368], length 1428
10:13:46.733000 IP 112.26.0.1.32867 > 112.26.0.8.55628: Flags [.], seq 134045:135473, ack 1, win 2678, options [nop,nop,TS val 417551 ecr 200863,mptcp dss ack 2629537759 seq 2512681717 subseq 134045 len 1428 csum 0xba80], length 1428
10:13:46.823328 IP 112.26.0.1.32867 > 112.26.0.8.55628: Flags [.], seq 135473:136901, ack 1, win 2678, options [nop,nop,TS val 417626 ecr 200936,mptcp dss ack 2629537759 seq 2512683145 subseq 135473 len 1428 csum 0xd381], length 1428
10:13:46.866680 IP 112.26.0.1.32867 > 112.26.0.8.55628: Flags [.], seq 136901:138329, ack 1, win 2678, options [nop,nop,TS val 417701 ecr 201020,mptcp dss ack 2629537759 seq 2512684573 subseq 136901 len 1428 csum 0xd165], length 1428
10:13:46.936381 IP 112.26.0.1.32867 > 112.26.0.8.55628: Flags [.], seq 138329:139757, ack 1, win 2678, options [nop,nop,TS val 417767 ecr 201080,mptcp dss ack 2629537759 seq 2512686001 subseq 138329 len 1428 csum 0x8196], length 1428
10:13:46.991262 IP 112.26.0.1.32867 > 112.26.0.8.55628: Flags [.], seq 139757:141185, ack 1, win 2678, options [nop,nop,TS val 417767 ecr 201080,mptcp dss ack 2629537759 seq 2512687429 subseq 139757 len 1428 csum 0x45b7], length 1428
10:13:47.055465 IP 112.26.0.1.32867 > 112.26.0.8.55628: Flags [.], seq 141185:142613, ack 1, win 2678, options [nop,nop,TS val 417789 ecr 201156,mptcp dss ack 2629537759 seq 2512688857 subseq 141185 len 1428 csum 0x1484], length 1428
10:13:47.129962 IP 112.26.0.1.32867 > 112.26.0.8.55628: Flags [.], seq 142613:144041, ack 1, win 2678, options [nop,nop,TS val 417821 ecr 201218,mptcp dss ack 2629537759 seq 2512690285 subseq 142613 len 1428 csum 0xde20], length 1428
10:13:47.235181 IP 112.26.0.1.32867 > 112.26.0.8.55628: Flags [.], seq 144041:145469, ack 1, win 2678, options [nop,nop,TS val 417881 ecr 201265,mptcp dss ack 2629537759 seq 2512691713 subseq 144041 len 1428 csum 0xbaf0], length 1428
10:13:47.269449 IP 112.26.0.1.32867 > 112.26.0.8.55628: Flags [.], seq 145469:146897, ack 1, win 2678, options [nop,nop,TS val 417976 ecr 201325,mptcp dss ack 2629537759 seq 2512693141 subseq 145469 len 1428 csum 0x3aa9], length 1428
10:13:47.337816 IP 112.26.0.1.32867 > 112.26.0.8.55628: Flags [.], seq 146897:148325, ack 1, win 2678, options [nop,nop,TS val 418051 ecr 201370,mptcp dss ack 2629537759 seq 2512697425 subseq 146897 len 1428 csum 0x945b], length 1428
10:13:47.397235 IP 112.26.0.1.32867 > 112.26.0.8.55628: Flags [.], seq 148325:149753, ack 1, win 2678, options [nop,nop,TS val 418116 ecr 201453,mptcp dss ack 2629537759 seq 2512700281 subseq 148325 len 1428 csum 0x33a3], length 1428
10:13:47.481510 IP 112.26.0.1.32867 > 112.26.0.8.55628: Flags [.], seq 149753:151181, ack 1, win 2678, options [nop,nop,TS val 418202 ecr 201529,mptcp dss ack 2629537759 seq 2512701709 subseq 149753 len 1428 csum 0x334b], length 1428
10:13:47.551306 IP 112.26.0.1.32867 > 112.26.0.8.55628: Flags [.], seq 151181:152609, ack 1, win 2678, options [nop,nop,TS val 418283 ecr 201620,mptcp dss ack 2629537759 seq 2512703137 subseq 151181 len 1428 csum 0xbc41], length 1428
10:13:47.637956 IP 112.26.0.1.32867 > 112.26.0.8.55628: Flags [.], seq 152609:154037, ack 1, win 2678, options [nop,nop,TS val 418369 ecr 201663,mptcp dss ack 2629537759 seq 2512704565 subseq 152609 len 1428 csum 0x5805], length 1428
10:13:47.684514 IP 112.26.0.1.32867 > 112.26.0.8.55628: Flags [.], seq 154037:155465, ack 1, win 2678, options [nop,nop,TS val 418369 ecr 201663,mptcp dss ack 2629537759 seq 2512705993 subseq 154037 len 1428 csum 0xfd], length 1428
10:13:47.754058 IP 112.26.0.1.32867 > 112.26.0.8.55628: Flags [.], seq 155465:156893, ack 1, win 2678, options [nop,nop,TS val 418459 ecr 201733,mptcp dss ack 2629537759 seq 2512707421 subseq 155465 len 1428 csum 0x93ae], length 1428
10:13:47.833736 IP 112.26.0.1.32867 > 112.26.0.8.55628: Flags [.], seq 156893:158321, ack 1, win 2678, options [nop,nop,TS val 418516 ecr 201787,mptcp dss ack 2629537759 seq 2512708849 subseq 156893 len 1428 csum 0xaed], length 1428
10:13:47.875769 IP 112.26.0.1.32867 > 112.26.0.8.55628: Flags [.], seq 158321:159749, ack 1, win 2678, options [nop,nop,TS val 418602 ecr 201852,mptcp dss ack 2629537759 seq 2512715989 subseq 158321 len 1428 csum 0xbd00], length 1428
10:13:47.951893 IP 112.26.0.1.32867 > 112.26.0.8.55628: Flags [.], seq 159749:161177, ack 1, win 2678, options [nop,nop,TS val 418644 ecr 201926,mptcp dss ack 2629537759 seq 2512717417 subseq 159749 len 1428 csum 0x80c6], length 1428
10:13:48.032321 IP 112.26.0.1.32867 > 112.26.0.8.55628: Flags [.], seq 161177:162605, ack 1, win 2678, options [nop,nop,TS val 418715 ecr 202031,mptcp dss ack 2629537759 seq 2512718845 subseq 161177 len 1428 csum 0x5e11], length 1428
10:13:48.086467 IP 112.26.0.1.32867 > 112.26.0.8.55628: Flags [.], seq 162605:164033, ack 1, win 2678, options [nop,nop,TS val 418715 ecr 202031,mptcp dss ack 2629537759 seq 2512720273 subseq 162605 len 1428 csum 0xffee], length 1428
10:13:48.155845 IP 112.26.0.1.32867 > 112.26.0.8.55628: Flags [.], seq 164033:165461, ack 1, win 2678, options [nop,nop,TS val 418878 ecr 202065,mptcp dss ack 2629537759 seq 2512724557 subseq 164033 len 1428 csum 0x821e], length 1428
10:13:48.241236 IP 112.26.0.1.32867 > 112.26.0.8.55628: Flags [.], seq 165461:166889, ack 1, win 2678, options [nop,nop,TS val 418905 ecr 202134,mptcp dss ack 2629537759 seq 2512725985 subseq 165461 len 1428 csum 0x8611], length 1428
10:13:48.293930 IP 112.26.0.1.32867 > 112.26.0.8.55628: Flags [.], seq 166889:168317, ack 1, win 2678, options [nop,nop,TS val 418996 ecr 202193,mptcp dss ack 2629537759 seq 2512727413 subseq 166889 len 1428 csum 0xd188], length 1428
10:13:48.357249 IP 112.26.0.1.32867 > 112.26.0.8.55628: Flags [.], seq 168317:169745, ack 1, win 2678, options [nop,nop,TS val 418996 ecr 202193,mptcp dss ack 2629537759 seq 2512728841 subseq 168317 len 1428 csum 0xcf27], length 1428
10:13:48.443841 IP 112.26.0.1.32867 > 112.26.0.8.55628: Flags [.], seq 169745:171173, ack 1, win 2678, options [nop,nop,TS val 419102 ecr 202278,mptcp dss ack 2629537759 seq 2512730269 subseq 169745 len 1428 csum 0x286e], length 1428
10:13:48.500048 IP 112.26.0.1.32867 > 112.26.0.8.55628: Flags [.], seq 171173:172601, ack 1, win 2678, options [nop,nop,TS val 419185 ecr 202347,mptcp dss ack 2629537759 seq 2512733125 subseq 171173 len 1428 csum 0xe4b8], length 1428
10:13:48.563000 IP 112.26.0.1.32867 > 112.26.0.8.55628: Flags [.], seq 172601:174029, ack 1, win 2678, options [nop,nop,TS val 419185 ecr 202347,mptcp dss ack 2629537759 seq 2512734553 subseq 172601 len 1428 csum 0x9144], length 1428
10:13:48.638496 IP 112.26.0.1.32867 > 112.26.0.8.55628: Flags [.], seq 174029:175457, ack 1, win 2678, options [nop,nop,TS val 419219 ecr 202435,mptcp dss ack 2629537759 seq 2512735981 subseq 174029 len 1428 csum 0xb560], length 1428
10:13:48.683840 IP 112.26.0.1.32867 > 112.26.0.8.55628: Flags [.], seq 175457:176885, ack 1, win 2678, options [nop,nop,TS val 419316 ecr 202481,mptcp dss ack 2629537759 seq 2512740265 subseq 175457 len 1428 csum 0x22e0], length 1428
10:13:48.791183 IP 112.26.0.1.32867 > 112.26.0.8.55628: Flags [.], seq 176885:178313, ack 1, win 2678, options [nop,nop,TS val 419389 ecr 202551,mptcp dss ack 2629537759 seq 2512741693 subseq 176885 len 1428 csum 0x7ca6], length 1428
10:13:48.866710 IP 112.26.0.1.32867 > 112.26.0.8.55628: Flags [.], seq 178313:179741, ack 1, win 2678, options [nop,nop,TS val 419389 ecr 202551,mptcp dss ack 2629537759 seq 2512743121 subseq 178313 len 1428 csum 0xfd31], length 1428
10:13:48.959377 IP 112.26.0.1.32867 > 112.26.0.8.55628: Flags [.], seq 181169:182597, ack 1, win 2678, options [nop,nop,TS val 419526 ecr 202672,mptcp dss ack 2629537759 seq 2512750261 subseq 181169 len 1428 csum 0x94e1], length 1428
10:13:49.046152 IP 112.26.0.1.32867 > 112.26.0.8.55628: Flags [.], seq 182597:184025, ack 1, win 2678, options [nop,nop,TS val 419526 ecr 202672,mptcp dss ack 2629537759 seq 2512751689 subseq 182597 len 1428 csum 0xb93], length 1428
10:13:49.100734 IP 112.26.0.1.32867 > 112.26.0.8.55628: Flags [.], seq 184025:185453, ack 1, win 2678, options [nop,nop,TS val 419604 ecr 202828,mptcp dss ack 2629537759 seq 2512753117 subseq 184025 len 1428 csum 0x56], length 1428
10:13:49.181277 IP 112.26.0.1.32867 > 112.26.0.8.55628: Flags [.], seq 186881:188309, ack 1, win 2678, options [nop,nop,TS val 419604 ecr 202828,mptcp dss ack 2629537759 seq 2512755973 subseq 186881 len 1428 csum 0xd055], length 1428
10:13:49.272759 IP 112.26.0.1.32867 > 112.26.0.8.55628: Flags [.], seq 188309:189737, ack 1, win 2678, options [nop,nop,TS val 419631 ecr 202882,mptcp dss ack 2629537759 seq 2512758829 subseq 188309 len 1428 csum 0x9801], length 1428
10:13:49.341648 IP 112.26.0.1.32867 > 112.26.0.8.55628: Flags [.], seq 191165:192593, ack 1, win 2678, options [nop,nop,TS val 419730 ecr 202952,mptcp dss ack 2629537759 seq 2512761685 subseq 191165 len 1428 csum 0xc5f7], length 1428
10:13:49.390034 IP 112.26.0.1.32867 > 112.26.0.8.55628: Flags [.], seq 192593:194021, ack 1, win 2678, options [nop,nop,TS val 419799 ecr 203037,mptcp dss ack 2629537759 seq 2512764541 subseq 192593 len 1428 csum 0xa5ef], length 1428
10:13:49.467299 IP 112.26.0.1.32867 > 112.26.0.8.55628: Flags [.], seq 195449:196877, ack 1, win 2678, options [nop,nop,TS val 419872 ecr 203090,mptcp dss ack 2629537759 seq 2512767397 subseq 195449 len 1428 csum 0xba1f], length 1428
10:13:49.558922 IP 112.26.0.1.32867 > 112.26.0.8.55628: Flags [.], seq 196877:198305, ack 1, win 2678, options [nop,nop,TS val 419905 ecr 203153,mptcp dss ack 2629537759 seq 2512768825 subseq 196877 len 1428 csum 0x262f], length 1428
10:13:49.605845 IP 112.26.0.1.32867 > 112.26.0.8.55628: Flags [.], seq 198305:199733, ack 1, win 2678, options [nop,nop,TS val 419905 ecr 203153,mptcp dss ack 2629537759 seq 2512770253 subseq 198305 len 1428 csum 0xca51], length 1428
10:13:49.682945 IP 112.26.0.1.32867 > 112.26.0.8.55628: Flags [.], seq 201161:202589, ack 1, win 2678, options [nop,nop,TS val 420117 ecr 203296,mptcp dss ack 2629537759 seq 2512773109 subseq 201161 len 1428 csum 0x4889], length 1428
10:13:49.763279 IP 112.26.0.1.32867 > 112.26.0.8.55628: Flags [.], seq 202589:204017, ack 1, win 2678, options [nop,nop,TS val 420117 ecr 203296,mptcp dss ack 2629537759 seq 2512774537 subseq 202589 len 1428 csum 0x1ce9], length 1428
10:13:49.816495 IP 112.26.0.1.32867 > 112.26.0.8.55628: Flags [.], seq 205445:206873, ack 1, win 2678, options [nop,nop,TS val 420215 ecr 203435,mptcp dss ack 2629537759 seq 2512777393 subseq 205445 len 1428 csum 0xce79], length 1428
10:13:49.894896 IP 112.26.0.1.32867 > 112.26.0.8.55628: Flags [.], seq 206873:208301, ack 1, win 2678, options [nop,nop,TS val 420215 ecr 203435,mptcp dss ack 2629537759 seq 2512778821 subseq 206873 len 1428 csum 0x693b], length 1428
10:13:49.953657 IP 112.26.0.1.32867 > 112.26.0.8.55628: Flags [.], seq 208301:209729, ack 1, win 2678, options [nop,nop,TS val 420296 ecr 203480,mptcp dss ack 2629537759 seq 2512780249 subseq 208301 len 1428 csum 0x45e3], length 1428
10:13:50.037900 IP 112.26.0.1.32867 > 112.26.0.8.55628: Flags [.], seq 209729:211157, ack 1, win 2678, options [nop,nop,TS val 420383 ecr 203588,mptcp dss ack 2629537759 seq 2512781677 subseq 209729 len 1428 csum 0xeb0d], length 1428
10:13:50.086753 IP 112.26.0.1.32867 > 112.26.0.8.55628: Flags [.], seq 211157:212585, ack 1, win 2678, options [nop,nop,TS val 420383 ecr 203588,mptcp dss ack 2629537759 seq 2512783105 subseq 211157 len 1428 csum 0x2e69], length 1428
10:13:50.151455 IP 112.26.0.1.32867 > 112.26.0.8.55628: Flags [.], seq 212585:214013, ack 1, win 2678, options [nop,nop,TS val 420430 ecr 203663,mptcp dss ack 2629537759 seq 2512784533 subseq 212585 len 1428 csum 0x8c1f], length 1428
10:13:50.201934 IP 112.26.0.1.32867 > 112.26.0.8.55628: Flags [.], seq 214013:215441, ack 1, win 2678, options [nop,nop,TS val 420604 ecr 203756,mptcp dss ack 2629537759 seq 2512788817 subseq 214013 len 1428 csum 0xd79f], length 1428
10:13:50.272250 IP 112.26.0.1.32867 > 112.26.0.8.55628: Flags [.], seq 215441:216869, ack 1, win 2678, options [nop,nop,TS val 420635 ecr 203842,mptcp dss ack 2629537759 seq 2512790245 subseq 215441 len 1428 csum 0xd7b], length 1428
10:13:50.372060 IP 112.26.0.1.32867 > 112.26.0.8.55628: Flags [.], seq 185453:186881, ack 1, win 2678, options [nop,nop,TS val 420724 ecr 203977,mptcp dss ack 2629537759 seq 2512754545 subseq 185453 len 1428 csum 0xe9a1], length 1428
10:13:50.448742 IP 112.26.0.1.32867 > 112.26.0.8.55628: Flags [.], seq 189737:191165, ack 1, win 2678, options [nop,nop,TS val 420894 ecr 204138,mptcp dss ack 2629537759 seq 2512760257 subseq 189737 len 1428 csum 0xbedd], length 1428
10:13:50.504931 IP 112.26.0.1.32867 > 112.26.0.8.55628: Flags [.], seq 194021:195449, ack 1, win 2678, options [nop,nop,TS val 421095 ecr 204355,mptcp dss ack 2629537759 seq 2512765969 subseq 194021 len 1428 csum 0x78b1], length 1428
10:13:50.590564 IP 112.26.0.1.32867 > 112.26.0.8.55628: Flags [.], seq 218297:219725, ack 1, win 2678, options [nop,nop,TS val 421280 ecr 204402,mptcp dss ack 2629537759 seq 2512800241 subseq 218297 len 1428 csum 0x3682], length 1428
10:13:50.646245 IP 112.26.0.1.32867 > 112.26.0.8.55628: Flags [.], seq 199733:201161, ack 1, win 2678, options [nop,nop,TS val 421331 ecr 204560,mptcp dss ack 2629537759 seq 2512771681 subseq 199733 len 1428 csum 0x2f4e], length 1428
10:13:50.689698 IP 112.26.0.1.32867 > 112.26.0.8.55628: Flags [.], seq 204017:205445, ack 1, win 2678, options [nop,nop,TS val 421391 ecr 204613,mptcp dss ack 2629537759 seq 2512775965 subseq 204017 len 1428 csum 0x9727], length 1428
10:13:50.761780 IP 112.26.0.1.32867 > 112.26.0.8.55628: Flags [.], seq 219725:221153, ack 1, win 2678, options [nop,nop,TS val 421489 ecr 204691,mptcp dss ack 2629537759 seq 2512805953 subseq 219725 len 1428 csum 0x60a2], length 1428
10:13:50.849407 IP 112.26.0.1.32867 > 112.26.0.8.55628: Flags [.], seq 221153:222581, ack 1, win 2678, options [nop,nop,TS val 421540 ecr 204750,mptcp dss ack 2629537759 seq 2512807381 subseq 221153 len 1428 csum 0x344], length 1428
10:13:50.906544 IP 112.26.0.1.32867 > 112.26.0.8.55628: Flags [.], seq 222581:224009, ack 1, win 2678, options [nop,nop,TS val 421606 ecr 204834,mptcp dss ack 2629537759 seq 2512808809 subseq 222581 len 1428 csum 0x2190], length 1428
10:13:51.006816 IP 112.26.0.1.32867 > 112.26.0.8.55628: Flags [.], seq 224009:225437, ack 1, win 2678, options [nop,nop,TS val 421681 ecr 204883,mptcp dss ack 2629537759 seq 2512810237 subseq 224009 len 1428 csum 0xcba], length 1428
10:13:51.093898 IP 112.26.0.1.32867 > 112.26.0.8.55628: Flags [.], seq 225437:226865, ack 1, win 2678, options [nop,nop,TS val 421711 ecr 204948,mptcp dss ack 2629537759 seq 2512811665 subseq 225437 len 1428 csum 0x158f], length 1428
10:13:51.162414 IP 112.26.0.1.32867 > 112.26.0.8.55628: Flags [.], seq 226865:228293, ack 1, win 2678, options [nop,nop,TS val 421831 ecr 204998,mptcp dss ack 2629537759 seq 2512814521 subseq 226865 len 1428 csum 0x6b0f], length 1428
10:13:51.211706 IP 112.26.0.1.32867 > 112.26.0.8.55628: Flags [.], seq 228293:229721, ack 1, win 2678, options [nop,nop,TS val 421881 ecr 205068,mptcp dss ack 2629537759 seq 2512817377 subseq 228293 len 1428 csum 0x3d04], length 1428
10:13:51.289599 IP 112.26.0.1.32867 > 112.26.0.8.55628: Flags [.], seq 179741:181169, ack 1, win 2678, options [nop,nop,TS val 421924 ecr 205168,mptcp dss ack 2629537759 seq 2512745977 subseq 179741 len 1428 csum 0x1c5b], length 1428
10:13:51.347801 IP 112.26.0.1.32867 > 112.26.0.8.55628: Flags [.], seq 229721:231149, ack 1, win 2678, options [nop,nop,TS val 422024 ecr 205245,mptcp dss ack 2629537759 seq 2512820233 subseq 229721 len 1428 csum 0xcd0a], length 1428
10:13:51.380998 IP 112.26.0.1.32867 > 112.26.0.8.55628: Flags [.], seq 216869:218297, ack 1, win 2678, options [nop,nop,TS val 422034 ecr 205302,mptcp dss ack 2629537759 seq 2512797385 subseq 216869 len 1428 csum 0xd517], length 1428
10:13:51.459350 IP 112.26.0.1.32867 > 112.26.0.8.55628: Flags [.], seq 231149:232577, ack 1, win 2678, options [nop,nop,TS val 422130 ecr 205387,mptcp dss ack 2629537759 seq 2512824517 subseq 231149 len 1428 csum 0x6434], length 1428
10:13:51.501213 IP 112.26.0.1.32867 > 112.26.0.8.55628: Flags [.], seq 232577:234005, ack 1, win 2678, options [nop,nop,TS val 422221 ecr 205443,mptcp dss ack 2629537759 seq 2512825945 subseq 232577 len 1428 csum 0xf171], length 1428
10:13:51.579244 IP 112.26.0.1.32867 > 112.26.0.8.55628: Flags [.], seq 234005:235433, ack 1, win 2678, options [nop,nop,TS val 422245 ecr 205486,mptcp dss ack 2629537759 seq 2512827373 subseq 234005 len 1428 csum 0xe685], length 1428
10:13:51.654397 IP 112.26.0.1.32867 > 112.26.0.8.55628: Flags [.], seq 235433:236861, ack 1, win 2678, options [nop,nop,TS val 422393 ecr 205558,mptcp dss ack 2629537759 seq 2512830229 subseq 235433 len 1428 csum 0x2114], length 1428
10:13:51.701083 IP 112.26.0.1.32867 > 112.26.0.8.55628: Flags [.], seq 236861:238289, ack 1, win 2678, options [nop,nop,TS val 422403 ecr 205646,mptcp dss ack 2629537759 seq 2512831657 subseq 236861 len 1428 csum 0xefad], length 1428
10:13:51.769495 IP 112.26.0.1.32867 > 112.26.0.8.55628: Flags [.], seq 238289:239717, ack 1, win 2678, options [nop,nop,TS val 422530 ecr 205703,mptcp dss ack 2629537759 seq 2512837369 subseq 238289 len 1428 csum 0x9200], length 1428
10:13:51.809599 IP 112.26.0.1.32867 > 112.26.0.8.55628: Flags [.], seq 239717:241145, ack 1, win 2678, options [nop,nop,TS val 422608 ecr 205803,mptcp dss ack 2629537759 seq 2512838797 subseq 239717 len 1428 csum 0x8d82], length 1428
10:13:51.898724 IP 112.26.0.1.32867 > 112.26.0.8.55628: Flags [.], seq 241145:242573, ack 1, win 2678, options [nop,nop,TS val 422621 ecr 205890,mptcp dss ack 2629537759 seq 2512840225 subseq 241145 len 1428 csum 0x98de], length 1428
10:13:51.977122 IP 112.26.0.1.32867 > 112.26.0.8.55628: Flags [.], seq 242573:244001, ack 1, win 2678, options [nop,nop,TS val 422717 ecr 205958,mptcp dss ack 2629537759 seq 2512843081 subseq 242573 len 1428 csum 0x35cd], length 1428
10:13:52.051038 IP 112.26.0.1.32867 > 112.26.0.8.55628: Flags [.], seq 244001:245429, ack 1, win 2678, options [nop,nop,TS val 422803 ecr 206008,mptcp dss ack 2629537759 seq 2512845937 subseq 244001 len 1428 csum 0xc8a9], length 1428
10:13:52.098266 IP 112.26.0.1.32867 > 112.26.0.8.55628: Flags [.], seq 245429:246857, ack 1, win 2678, options [nop,nop,TS val 422825 ecr 206086,mptcp dss ack 2629537759 seq 2512848793 subseq 245429 len 1428 csum 0x3f14], length 1428
