20:50:00.360432 IP 112.26.3.8.33947 > 112.26.3.1.36395: Flags [S], seq 2463331454, win 65535, options [mss 1460,sackOK,TS val 4294885457 ecr 0,nop,wscale 6,mptcp join id 5 token 0xca9948a6 nonce 0xec7dd10], length 0
20:50:00.680123 IP 112.26.3.1.36395 > 112.26.3.8.33947: Flags [S.], seq 310309458, ack 2463331455, win 65535, options [mss 1460,sackOK,TS val 143592 ecr 4294885457,nop,wscale 6,mptcp join id 5 hmac 0x9eb58b092dfcf0e2 nonce 0xc8f67f4c], length 0
20:50:00.765109 IP 112.26.3.1.36395 > 112.26.3.8.33947: Flags [S.], seq 310309458, ack 2463331455, win 65535, options [mss 1460,sackOK,TS val 143592 ecr 4294885457,nop,wscale 6,mptcp join id 5 hmac 0x9eb58b092dfcf0e2 nonce 0xc8f67f4c], length 0
20:50:00.818035 IP 112.26.3.8.33947 > 112.26.3.1.36395: Flags [.], ack 1, win 7118, options [nop,nop,TS val 4294885883 ecr 143592,mptcp join hmac 0x5efdd3d036bf276001ac85c3f316b80903abd5ce], length 0
20:50:00.818313 IP 112.26.3.8.33947 > 112.26.3.1.36395: Flags [.], ack 1, win 7118, options [nop,nop,TS val 4294885883 ecr 143592,mptcp join hmac 0x5efdd3d036bf276001ac85c3f316b80903abd5ce], length 0
20:50:00.837730 IP 112.26.3.8.33947 > 112.26.3.1.36395: Flags [.], ack 1, win 7118, options [nop,nop,TS val 4294885883 ecr 143592,mptcp join hmac 0x5efdd3d036bf276001ac85c3f316b80903abd5ce], length 0
20:50:01.001881 IP 112.26.3.1.36395 > 112.26.3.8.33947: Flags [.], ack 1, win 4017, options [nop,nop,TS val 143940 ecr 4294885883,mptcp dss ack 3836451400], length 0
20:50:01.002111 IP 112.26.3.1.36395 > 112.26.3.8.33947: Flags [.], ack 1, win 4017, options [nop,nop,TS val 143940 ecr 4294885883,mptcp dss ack 3836451400], length 0
20:50:01.203762 IP 112.26.3.1.36395 > 112.26.3.8.33947: Flags [.], seq 1:1429, ack 1, win 4017, options [nop,nop,TS val 143941 ecr 4294885883,mptcp dss ack 3836451400 seq 1998756289 subseq 1 len 1428 csum 0x28b3], length 1428
20:50:01.204054 IP 112.26.3.1.36395 > 112.26.3.8.33947: Flags [.], seq 1:1429, ack 1, win 4017, options [nop,nop,TS val 143941 ecr 4294885883,mptcp dss ack 3836451400 seq 1998756289 subseq 1 len 1428 csum 0x28b3], length 1428
20:50:01.210509 IP 112.26.3.8.33947 > 112.26.3.1.36395: Flags [.], ack 1429, win 7437, options [nop,nop,TS val 4294886322 ecr 143941,mptcp dss ack 1998720589], length 0
20:50:01.210803 IP 112.26.3.8.33947 > 112.26.3.1.36395: Flags [.], ack 1429, win 7437, options [nop,nop,TS val 4294886322 ecr 143941,mptcp dss ack 1998720589], length 0
20:50:01.366831 IP 112.26.3.1.36395 > 112.26.3.8.33947: Flags [.], seq 1429:2857, ack 1, win 4017, options [nop,nop,TS val 143941 ecr 4294885883,mptcp dss ack 3836451400 seq 1998757717 subseq 1429 len 1428 csum 0xe3da], length 1428
20:50:01.367040 IP 112.26.3.1.36395 > 112.26.3.8.33947: Flags [.], seq 1429:2857, ack 1, win 4017, options [nop,nop,TS val 143941 ecr 4294885883,mptcp dss ack 3836451400 seq 1998757717 subseq 1429 len 1428 csum 0xe3da], length 1428
20:50:01.517601 IP 112.26.3.8.33947 > 112.26.3.1.36395: Flags [.], ack 2857, win 7757, options [nop,nop,TS val 4294886627 ecr 143941,mptcp dss ack 1998720589], length 0
20:50:01.517850 IP 112.26.3.8.33947 > 112.26.3.1.36395: Flags [.], ack 2857, win 7757, options [nop,nop,TS val 4294886627 ecr 143941,mptcp dss ack 1998720589], length 0
20:50:01.569618 IP 112.26.3.1.36395 > 112.26.3.8.33947: Flags [.], seq 2857:4285, ack 1, win 4017, options [nop,nop,TS val 143941 ecr 4294885883,mptcp dss ack 3836451400 seq 1998759145 subseq 2857 len 1428 csum 0x5da4], length 1428
20:50:01.570008 IP 112.26.3.1.36395 > 112.26.3.8.33947: Flags [.], seq 2857:4285, ack 1, win 4017, options [nop,nop,TS val 143941 ecr 4294885883,mptcp dss ack 3836451400 seq 1998759145 subseq 2857 len 1428 csum 0x5da4], length 1428
20:50:01.679824 IP 112.26.3.1.36395 > 112.26.3.8.33947: Flags [.], seq 4285:5713, ack 1, win 4017, options [nop,nop,TS val 143941 ecr 4294885883,mptcp dss ack 3836451400 seq 1998760573 subseq 4285 len 1428 csum 0x171f], length 1428
20:50:01.680108 IP 112.26.3.1.36395 > 112.26.3.8.33947: Flags [.], seq 4285:5713, ack 1, win 4017, options [nop,nop,TS val 143941 ecr 4294885883,mptcp dss ack 3836451400 seq 1998760573 subseq 4285 len 1428 csum 0x171f], length 1428
20:50:01.829694 IP 112.26.3.1.36395 > 112.26.3.8.33947: Flags [.], seq 5713:7141, ack 1, win 4017, options [nop,nop,TS val 143941 ecr 4294885883,mptcp dss ack 3836451400 seq 1998762001 subseq 5713 len 1428 csum 0x780c], length 1428
20:50:01.829928 IP 112.26.3.1.36395 > 112.26.3.8.33947: Flags [.], seq 5713:7141, ack 1, win 4017, options [nop,nop,TS val 143941 ecr 4294885883,mptcp dss ack 3836451400 seq 1998762001 subseq 5713 len 1428 csum 0x780c], length 1428
20:50:01.877124 IP 112.26.3.8.33947 > 112.26.3.1.36395: Flags [.], ack 4285, win 8076, options [nop,nop,TS val 4294886990 ecr 143941,mptcp dss ack 1998743437], length 0
20:50:01.877464 IP 112.26.3.8.33947 > 112.26.3.1.36395: Flags [.], ack 4285, win 8076, options [nop,nop,TS val 4294886990 ecr 143941,mptcp dss ack 1998743437], length 0
20:50:01.947645 IP 112.26.3.8.33947 > 112.26.3.1.36395: Flags [.], ack 5713, win 8122, options [nop,nop,TS val 4294887061 ecr 143941,mptcp dss ack 1998743437], length 0
20:50:01.947939 IP 112.26.3.8.33947 > 112.26.3.1.36395: Flags [.], ack 5713, win 8122, options [nop,nop,TS val 4294887061 ecr 143941,mptcp dss ack 1998743437], length 0
20:50:01.982670 IP 112.26.3.1.36395 > 112.26.3.8.33947: Flags [.], seq 7141:8569, ack 1, win 4017, options [nop,nop,TS val 143941 ecr 4294885883,mptcp dss ack 3836451400 seq 1998763429 subseq 7141 len 1428 csum 0xa1a], length 1428
20:50:01.982921 IP 112.26.3.1.36395 > 112.26.3.8.33947: Flags [.], seq 7141:8569, ack 1, win 4017, options [nop,nop,TS val 143941 ecr 4294885883,mptcp dss ack 3836451400 seq 1998763429 subseq 7141 len 1428 csum 0xa1a], length 1428
20:50:02.077641 IP 112.26.3.8.33947 > 112.26.3.1.36395: Flags [.], ack 7141, win 8304, options [nop,nop,TS val 4294887191 ecr 143941,mptcp dss ack 1998744865], length 0
20:50:02.077882 IP 112.26.3.8.33947 > 112.26.3.1.36395: Flags [.], ack 7141, win 8304, options [nop,nop,TS val 4294887191 ecr 143941,mptcp dss ack 1998744865], length 0
20:50:02.113734 IP 112.26.3.8.33947 > 112.26.3.1.36395: Flags [.], ack 1429, win 7437, options [nop,nop,TS val 4294886322 ecr 143941,mptcp dss ack 1998720589], length 0
20:50:02.317423 IP 112.26.3.1.36395 > 112.26.3.8.33947: Flags [.], seq 8569:9997, ack 1, win 4017, options [nop,nop,TS val 143941 ecr 4294885883,mptcp dss ack 3836451400 seq 1998764857 subseq 8569 len 1428 csum 0xa1f2], length 1428
20:50:02.317682 IP 112.26.3.1.36395 > 112.26.3.8.33947: Flags [.], seq 8569:9997, ack 1, win 4017, options [nop,nop,TS val 143941 ecr 4294885883,mptcp dss ack 3836451400 seq 1998764857 subseq 8569 len 1428 csum 0xa1f2], length 1428
20:50:02.366960 IP 112.26.3.8.33947 > 112.26.3.1.36395: Flags [.], ack 8569, win 8715, options [nop,nop,TS val 4294887480 ecr 143941,mptcp dss ack 1998747721], length 0
20:50:02.367227 IP 112.26.3.8.33947 > 112.26.3.1.36395: Flags [.], ack 8569, win 8715, options [nop,nop,TS val 4294887480 ecr 143941,mptcp dss ack 1998747721], length 0
20:50:02.404720 IP 112.26.3.1.36395 > 112.26.3.8.33947: Flags [.], seq 9997:11425, ack 1, win 4017, options [nop,nop,TS val 143942 ecr 4294885883,mptcp dss ack 3836451400 seq 1998766285 subseq 9997 len 1428 csum 0x21a8], length 1428
20:50:02.404974 IP 112.26.3.1.36395 > 112.26.3.8.33947: Flags [.], seq 9997:11425, ack 1, win 4017, options [nop,nop,TS val 143942 ecr 4294885883,mptcp dss ack 3836451400 seq 1998766285 subseq 9997 len 1428 csum 0x21a8], length 1428
20:50:02.505117 IP 112.26.3.1.36395 > 112.26.3.8.33947: Flags [.], seq 11425:12853, ack 1, win 4017, options [nop,nop,TS val 143942 ecr 4294885883,mptcp dss ack 3836451400 seq 1998767713 subseq 11425 len 1428 csum 0x8759], length 1428
20:50:02.505378 IP 112.26.3.1.36395 > 112.26.3.8.33947: Flags [.], seq 11425:12853, ack 1, win 4017, options [nop,nop,TS val 143942 ecr 4294885883,mptcp dss ack 3836451400 seq 1998767713 subseq 11425 len 1428 csum 0x8759], length 1428
20:50:02.568875 IP 112.26.3.8.33947 > 112.26.3.1.36395: Flags [.], ack 2857, win 7757, options [nop,nop,TS val 4294886627 ecr 143941,mptcp dss ack 1998720589], length 0
20:50:02.653350 IP 112.26.3.8.33947 > 112.26.3.1.36395: Flags [.], ack 9997, win 8943, options [nop,nop,TS val 4294887764 ecr 143941,mptcp dss ack 1998766285], length 0
20:50:02.653598 IP 112.26.3.8.33947 > 112.26.3.1.36395: Flags [.], ack 9997, win 8943, options [nop,nop,TS val 4294887764 ecr 143941,mptcp dss ack 1998766285], length 0
20:50:02.671899 IP 112.26.3.1.36395 > 112.26.3.8.33947: Flags [.], seq 12853:14281, ack 1, win 4017, options [nop,nop,TS val 143942 ecr 4294885883,mptcp dss ack 3836451400 seq 1998769141 subseq 12853 len 1428 csum 0x7435], length 1428
20:50:02.672172 IP 112.26.3.1.36395 > 112.26.3.8.33947: Flags [.], seq 12853:14281, ack 1, win 4017, options [nop,nop,TS val 143942 ecr 4294885883,mptcp dss ack 3836451400 seq 1998769141 subseq 12853 len 1428 csum 0x7435], length 1428
20:50:02.699054 IP 112.26.3.1.36395 > 112.26.3.8.33947: Flags [.], seq 17137:18565, ack 1, win 4017, options [nop,nop,TS val 145679 ecr 4294886627,mptcp dss ack 3836451400 seq 1998847681 subseq 17137 len 1428 csum 0xab92], length 1428
20:50:02.761311 IP 112.26.3.1.36395 > 112.26.3.8.33947: Flags [.], seq 12853:14281, ack 1, win 4017, options [nop,nop,TS val 144704 ecr 4294885883,mptcp dss ack 3836451400 seq 1998769141 subseq 12853 len 1428 csum 0x7435], length 1428
20:50:02.761581 IP 112.26.3.1.36395 > 112.26.3.8.33947: Flags [.], seq 12853:14281, ack 1, win 4017, options [nop,nop,TS val 144704 ecr 4294885883,mptcp dss ack 3836451400 seq 1998769141 subseq 12853 len 1428 csum 0x7435], length 1428
20:50:02.788394 IP 112.26.3.1.36395 > 112.26.3.8.33947: Flags [.], seq 17137:18565, ack 1, win 4017, options [nop,nop,TS val 145679 ecr 4294886627,mptcp dss ack 3836451400 seq 1998847681 subseq 17137 len 1428 csum 0xab92], length 1428
20:50:02.884639 IP 112.26.3.8.33947 > 112.26.3.1.36395: Flags [.], ack 9997, win 9080, options [nop,nop,TS val 4294887904 ecr 143941,nop,nop,sack 1 {17137:18565},mptcp dss ack 1998766285], length 0
20:50:02.884885 IP 112.26.3.8.33947 > 112.26.3.1.36395: Flags [.], ack 9997, win 9080, options [nop,nop,TS val 4294887904 ecr 143941,nop,nop,sack 1 {17137:18565},mptcp dss ack 1998766285], length 0
20:50:02.957975 IP 112.26.3.1.36395 > 112.26.3.8.33947: Flags [.], seq 18565:19993, ack 1, win 4017, options [nop,nop,TS val 145679 ecr 4294886627,mptcp dss ack 3836451400 seq 1998849109 subseq 18565 len 1428 csum 0x581e], length 1428
20:50:02.961205 IP 112.26.3.1.36395 > 112.26.3.8.33947: Flags [.], seq 18565:19993, ack 1, win 4017, options [nop,nop,TS val 145679 ecr 4294886627,mptcp dss ack 3836451400 seq 1998849109 subseq 18565 len 1428 csum 0x581e], length 1428
20:50:02.963549 IP 112.26.3.8.33947 > 112.26.3.1.36395: Flags [.], ack 9997, win 9262, options [nop,nop,TS val 4294888077 ecr 143941,nop,nop,sack 1 {17137:19993},mptcp dss ack 1998766285], length 0
20:50:02.963742 IP 112.26.3.8.33947 > 112.26.3.1.36395: Flags [.], ack 9997, win 9262, options [nop,nop,TS val 4294888077 ecr 143941,nop,nop,sack 1 {17137:19993},mptcp dss ack 1998766285], length 0
20:50:02.987275 IP 112.26.3.1.36395 > 112.26.3.8.33947: Flags [.], seq 14281:15709, ack 1, win 4017, options [nop,nop,TS val 145223 ecr 4294886322,mptcp dss ack 3836451400 seq 1998826261 subseq 14281 len 1428 csum 0xf557], length 1428
20:50:02.987490 IP 112.26.3.1.36395 > 112.26.3.8.33947: Flags [.], seq 14281:15709, ack 1, win 4017, options [nop,nop,TS val 145223 ecr 4294886322,mptcp dss ack 3836451400 seq 1998826261 subseq 14281 len 1428 csum 0xf557], length 1428
20:50:03.055960 IP 112.26.3.8.33947 > 112.26.3.1.36395: Flags [.], ack 11425, win 9399, options [nop,nop,TS val 4294888169 ecr 143942,nop,nop,sack 1 {17137:19993},mptcp dss ack 1998767713], length 0
20:50:03.056214 IP 112.26.3.8.33947 > 112.26.3.1.36395: Flags [.], ack 11425, win 9399, options [nop,nop,TS val 4294888169 ecr 143942,nop,nop,sack 1 {17137:19993},mptcp dss ack 1998767713], length 0
20:50:03.123500 IP 112.26.3.1.36395 > 112.26.3.8.33947: Flags [.], seq 15709:17137, ack 1, win 4017, options [nop,nop,TS val 145223 ecr 4294886322,mptcp dss ack 3836451400 seq 1998827689 subseq 15709 len 1428 csum 0xd33d], length 1428
20:50:03.123751 IP 112.26.3.1.36395 > 112.26.3.8.33947: Flags [.], seq 15709:17137, ack 1, win 4017, options [nop,nop,TS val 145223 ecr 4294886322,mptcp dss ack 3836451400 seq 1998827689 subseq 15709 len 1428 csum 0xd33d], length 1428
20:50:03.169869 IP 112.26.3.8.33947 > 112.26.3.1.36395: Flags [.], ack 12853, win 9582, options [nop,nop,TS val 4294888283 ecr 143942,nop,nop,sack 1 {17137:19993},mptcp dss ack 1998769141], length 0
20:50:03.170119 IP 112.26.3.8.33947 > 112.26.3.1.36395: Flags [.], ack 12853, win 9582, options [nop,nop,TS val 4294888283 ecr 143942,nop,nop,sack 1 {17137:19993},mptcp dss ack 1998769141], length 0
20:50:03.326325 IP 112.26.3.8.33947 > 112.26.3.1.36395: Flags [.], ack 5713, win 8122, options [nop,nop,TS val 4294887061 ecr 143941,mptcp dss ack 1998743437], length 0
20:50:03.398996 IP 112.26.3.8.33947 > 112.26.3.1.36395: Flags [.], ack 14281, win 9719, options [nop,nop,TS val 4294888511 ecr 143942,nop,nop,sack 1 {17137:19993},mptcp dss ack 1998780565], length 0
20:50:03.399258 IP 112.26.3.8.33947 > 112.26.3.1.36395: Flags [.], ack 14281, win 9719, options [nop,nop,TS val 4294888511 ecr 143942,nop,nop,sack 1 {17137:19993},mptcp dss ack 1998780565], length 0
20:50:03.448659 IP 112.26.3.8.33947 > 112.26.3.1.36395: Flags [.], ack 7141, win 8304, options [nop,nop,TS val 4294887191 ecr 143941,mptcp dss ack 1998744865], length 0
20:50:03.520412 IP 112.26.3.8.33947 > 112.26.3.1.36395: Flags [.], ack 14281, win 9810, options [nop,nop,TS val 4294888577 ecr 144704,nop,nop,sack 2 {12853:14281}{17137:19993},mptcp dss ack 1998780565], length 0
20:50:03.520632 IP 112.26.3.8.33947 > 112.26.3.1.36395: Flags [.], ack 14281, win 9810, options [nop,nop,TS val 4294888577 ecr 144704,nop,nop,sack 2 {12853:14281}{17137:19993},mptcp dss ack 1998780565], length 0
20:50:03.539939 IP 112.26.3.1.36395 > 112.26.3.8.33947: Flags [.], seq 19993:21421, ack 1, win 4017, options [nop,nop,TS val 146436 ecr 4294887061,mptcp dss ack 3836451400 seq 1998870529 subseq 19993 len 1428 csum 0xc963], length 1428
20:50:03.551633 IP 112.26.3.1.36395 > 112.26.3.8.33947: Flags [.], seq 19993:21421, ack 1, win 4017, options [nop,nop,TS val 146436 ecr 4294887061,mptcp dss ack 3836451400 seq 1998870529 subseq 19993 len 1428 csum 0xc963], length 1428
20:50:03.612547 IP 112.26.3.8.33947 > 112.26.3.1.36395: Flags [.], ack 8569, win 8715, options [nop,nop,TS val 4294887480 ecr 143941,mptcp dss ack 1998747721], length 0
20:50:03.626331 IP 112.26.3.8.33947 > 112.26.3.1.36395: Flags [.], ack 14281, win 9901, options [nop,nop,TS val 4294888667 ecr 144704,nop,nop,sack 1 {17137:21421},mptcp dss ack 1998780565], length 0
20:50:03.626590 IP 112.26.3.8.33947 > 112.26.3.1.36395: Flags [.], ack 14281, win 9901, options [nop,nop,TS val 4294888667 ecr 144704,nop,nop,sack 1 {17137:21421},mptcp dss ack 1998780565], length 0
20:50:03.717327 IP 112.26.3.1.36395 > 112.26.3.8.33947: Flags [.], seq 21421:22849, ack 1, win 4017, options [nop,nop,TS val 146436 ecr 4294887061,mptcp dss ack 3836451400 seq 1998871957 subseq 21421 len 1428 csum 0xf23f], length 1428
20:50:03.720577 IP 112.26.3.1.36395 > 112.26.3.8.33947: Flags [.], seq 21421:22849, ack 1, win 4017, options [nop,nop,TS val 146436 ecr 4294887061,mptcp dss ack 3836451400 seq 1998871957 subseq 21421 len 1428 csum 0xf23f], length 1428
20:50:03.761870 IP 112.26.3.8.33947 > 112.26.3.1.36395: Flags [.], ack 9997, win 8943, options [nop,nop,TS val 4294887764 ecr 143941,mptcp dss ack 1998766285], length 0
20:50:03.775177 IP 112.26.3.8.33947 > 112.26.3.1.36395: Flags [.], ack 14281, win 10129, options [nop,nop,TS val 4294888836 ecr 144704,nop,nop,sack 1 {17137:22849},mptcp dss ack 1998790561], length 0
20:50:03.775429 IP 112.26.3.8.33947 > 112.26.3.1.36395: Flags [.], ack 14281, win 10129, options [nop,nop,TS val 4294888836 ecr 144704,nop,nop,sack 1 {17137:22849},mptcp dss ack 1998790561], length 0
20:50:03.858364 IP 112.26.3.8.33947 > 112.26.3.1.36395: Flags [.], ack 15709, win 10266, options [nop,nop,TS val 4294888913 ecr 145223,nop,nop,sack 1 {17137:22849},mptcp dss ack 1998790561], length 0
20:50:03.858578 IP 112.26.3.8.33947 > 112.26.3.1.36395: Flags [.], ack 15709, win 10266, options [nop,nop,TS val 4294888913 ecr 145223,nop,nop,sack 1 {17137:22849},mptcp dss ack 1998790561], length 0
20:50:03.879569 IP 112.26.3.8.33947 > 112.26.3.1.36395: Flags [.], ack 9997, win 9080, options [nop,nop,TS val 4294887904 ecr 143941,nop,nop,sack 1 {17137:18565},mptcp dss ack 1998766285], length 0
20:50:03.934590 IP 112.26.3.8.33947 > 112.26.3.1.36395: Flags [.], ack 9997, win 9262, options [nop,nop,TS val 4294888077 ecr 143941,nop,nop,sack 1 {17137:19993},mptcp dss ack 1998766285], length 0
20:50:03.963018 IP 112.26.3.1.36395 > 112.26.3.8.33947: Flags [.], seq 22849:24277, ack 1, win 4017, options [nop,nop,TS val 146436 ecr 4294887061,mptcp dss ack 3836451400 seq 1998873385 subseq 22849 len 1428 csum 0x8b7b], length 1428
20:50:03.966386 IP 112.26.3.1.36395 > 112.26.3.8.33947: Flags [.], seq 22849:24277, ack 1, win 4017, options [nop,nop,TS val 146436 ecr 4294887061,mptcp dss ack 3836451400 seq 1998873385 subseq 22849 len 1428 csum 0x8b7b], length 1428
20:50:03.995610 IP 112.26.3.8.33947 > 112.26.3.1.36395: Flags [.], ack 15709, win 10449, options [nop,nop,TS val 4294889082 ecr 145223,nop,nop,sack 1 {17137:24277},mptcp dss ack 1998790561], length 0
20:50:03.995817 IP 112.26.3.8.33947 > 112.26.3.1.36395: Flags [.], ack 15709, win 10449, options [nop,nop,TS val 4294889082 ecr 145223,nop,nop,sack 1 {17137:24277},mptcp dss ack 1998790561], length 0
20:50:04.003724 IP 112.26.3.8.33947 > 112.26.3.1.36395: Flags [.], ack 11425, win 9399, options [nop,nop,TS val 4294888169 ecr 143942,nop,nop,sack 1 {17137:19993},mptcp dss ack 1998767713], length 0
20:50:04.076577 IP 112.26.3.8.33947 > 112.26.3.1.36395: Flags [.], ack 24277, win 10585, options [nop,nop,TS val 4294889184 ecr 145223,mptcp dss ack 1998790561], length 0
20:50:04.076781 IP 112.26.3.8.33947 > 112.26.3.1.36395: Flags [.], ack 24277, win 10585, options [nop,nop,TS val 4294889184 ecr 145223,mptcp dss ack 1998790561], length 0
20:50:04.123524 IP 112.26.3.1.36395 > 112.26.3.8.33947: Flags [.], seq 24277:25705, ack 1, win 4017, options [nop,nop,TS val 146436 ecr 4294887061,mptcp dss ack 3836451400 seq 1998874813 subseq 24277 len 1428 csum 0xb257], length 1428
20:50:04.127612 IP 112.26.3.1.36395 > 112.26.3.8.33947: Flags [.], seq 24277:25705, ack 1, win 4017, options [nop,nop,TS val 146436 ecr 4294887061,mptcp dss ack 3836451400 seq 1998874813 subseq 24277 len 1428 csum 0xb257], length 1428
20:50:04.173160 IP 112.26.3.8.33947 > 112.26.3.1.36395: Flags [.], ack 25705, win 10677, options [nop,nop,TS val 4294889243 ecr 146436,mptcp dss ack 1998790561], length 0
20:50:04.173341 IP 112.26.3.8.33947 > 112.26.3.1.36395: Flags [.], ack 25705, win 10677, options [nop,nop,TS val 4294889243 ecr 146436,mptcp dss ack 1998790561], length 0
20:50:04.194295 IP 112.26.3.8.33947 > 112.26.3.1.36395: Flags [.], ack 12853, win 9582, options [nop,nop,TS val 4294888283 ecr 143942,nop,nop,sack 1 {17137:19993},mptcp dss ack 1998769141], length 0
20:50:04.212370 IP 112.26.3.1.36395 > 112.26.3.8.33947: Flags [.], seq 25705:27133, ack 1, win 4017, options [nop,nop,TS val 146559 ecr 4294887191,mptcp dss ack 3836451400 seq 1998879097 subseq 25705 len 1428 csum 0x9efd], length 1428
20:50:04.254354 IP 112.26.3.1.36395 > 112.26.3.8.33947: Flags [.], seq 25705:27133, ack 1, win 4017, options [nop,nop,TS val 146559 ecr 4294887191,mptcp dss ack 3836451400 seq 1998879097 subseq 25705 len 1428 csum 0x9efd], length 1428
20:50:04.256684 IP 112.26.3.8.33947 > 112.26.3.1.36395: Flags [.], ack 27133, win 10814, options [nop,nop,TS val 4294889369 ecr 146559,mptcp dss ack 1998790561], length 0
20:50:04.256887 IP 112.26.3.8.33947 > 112.26.3.1.36395: Flags [.], ack 27133, win 10814, options [nop,nop,TS val 4294889369 ecr 146559,mptcp dss ack 1998790561], length 0
20:50:04.327891 IP 112.26.3.8.33947 > 112.26.3.1.36395: Flags [.], ack 14281, win 9719, options [nop,nop,TS val 4294888511 ecr 143942,nop,nop,sack 1 {17137:19993},mptcp dss ack 1998780565], length 0
20:50:04.414433 IP 112.26.3.8.33947 > 112.26.3.1.36395: Flags [.], ack 14281, win 9810, options [nop,nop,TS val 4294888577 ecr 144704,nop,nop,sack 2 {12853:14281}{17137:19993},mptcp dss ack 1998780565], length 0
20:50:04.500469 IP 112.26.3.1.36395 > 112.26.3.8.33947: Flags [.], seq 27133:28561, ack 1, win 4017, options [nop,nop,TS val 146559 ecr 4294887191,mptcp dss ack 3836451400 seq 1998880525 subseq 27133 len 1428 csum 0x71bf], length 1428
20:50:04.504919 IP 112.26.3.8.33947 > 112.26.3.1.36395: Flags [.], ack 28561, win 11042, options [nop,nop,TS val 4294889619 ecr 146559,mptcp dss ack 1998790561], length 0
20:50:04.505145 IP 112.26.3.8.33947 > 112.26.3.1.36395: Flags [.], ack 28561, win 11042, options [nop,nop,TS val 4294889619 ecr 146559,mptcp dss ack 1998790561], length 0
20:50:04.511741 IP 112.26.3.1.36395 > 112.26.3.8.33947: Flags [.], seq 27133:28561, ack 1, win 4017, options [nop,nop,TS val 146559 ecr 4294887191,mptcp dss ack 3836451400 seq 1998880525 subseq 27133 len 1428 csum 0x71bf], length 1428
20:50:04.604770 IP 112.26.3.8.33947 > 112.26.3.1.36395: Flags [.], ack 14281, win 9901, options [nop,nop,TS val 4294888667 ecr 144704,nop,nop,sack 1 {17137:21421},mptcp dss ack 1998780565], length 0
20:50:04.640546 IP 112.26.3.1.36395 > 112.26.3.8.33947: Flags [.], seq 28561:29989, ack 1, win 4017, options [nop,nop,TS val 146723 ecr 4294887480,mptcp dss ack 3836451400 seq 1998883381 subseq 28561 len 1428 csum 0x24d1], length 1428
20:50:04.645112 IP 112.26.3.1.36395 > 112.26.3.8.33947: Flags [.], seq 28561:29989, ack 1, win 4017, options [nop,nop,TS val 146723 ecr 4294887480,mptcp dss ack 3836451400 seq 1998883381 subseq 28561 len 1428 csum 0x24d1], length 1428
20:50:04.651387 IP 112.26.3.8.33947 > 112.26.3.1.36395: Flags [.], ack 29989, win 11224, options [nop,nop,TS val 4294889761 ecr 146723,mptcp dss ack 1998790561], length 0
20:50:04.651561 IP 112.26.3.8.33947 > 112.26.3.1.36395: Flags [.], ack 29989, win 11224, options [nop,nop,TS val 4294889761 ecr 146723,mptcp dss ack 1998790561], length 0
20:50:04.735426 IP 112.26.3.8.33947 > 112.26.3.1.36395: Flags [.], ack 14281, win 10129, options [nop,nop,TS val 4294888836 ecr 144704,nop,nop,sack 1 {17137:22849},mptcp dss ack 1998790561], length 0
20:50:04.767984 IP 112.26.3.1.36395 > 112.26.3.8.33947: Flags [.], seq 29989:31417, ack 1, win 4017, options [nop,nop,TS val 146723 ecr 4294887480,mptcp dss ack 3836451400 seq 1998884809 subseq 29989 len 1428 csum 0xc8f3], length 1428
20:50:04.771881 IP 112.26.3.1.36395 > 112.26.3.8.33947: Flags [.], seq 29989:31417, ack 1, win 4017, options [nop,nop,TS val 146723 ecr 4294887480,mptcp dss ack 3836451400 seq 1998884809 subseq 29989 len 1428 csum 0xc8f3], length 1428
20:50:04.780673 IP 112.26.3.8.33947 > 112.26.3.1.36395: Flags [.], ack 31417, win 11361, options [nop,nop,TS val 4294889887 ecr 146723,mptcp dss ack 1998790561], length 0
20:50:04.780897 IP 112.26.3.8.33947 > 112.26.3.1.36395: Flags [.], ack 31417, win 11361, options [nop,nop,TS val 4294889887 ecr 146723,mptcp dss ack 1998790561], length 0
20:50:04.875799 IP 112.26.3.8.33947 > 112.26.3.1.36395: Flags [.], ack 15709, win 10266, options [nop,nop,TS val 4294888913 ecr 145223,nop,nop,sack 1 {17137:22849},mptcp dss ack 1998790561], length 0
20:50:04.920574 IP 112.26.3.8.33947 > 112.26.3.1.36395: Flags [.], ack 15709, win 10449, options [nop,nop,TS val 4294889082 ecr 145223,nop,nop,sack 1 {17137:24277},mptcp dss ack 1998790561], length 0
20:50:04.946679 IP 112.26.3.1.36395 > 112.26.3.8.33947: Flags [.], seq 31417:32845, ack 1, win 4017, options [nop,nop,TS val 146869 ecr 4294887764,mptcp dss ack 3836451400 seq 1998887665 subseq 31417 len 1428 csum 0x4cbf], length 1428
20:50:04.951167 IP 112.26.3.1.36395 > 112.26.3.8.33947: Flags [.], seq 31417:32845, ack 1, win 4017, options [nop,nop,TS val 146869 ecr 4294887764,mptcp dss ack 3836451400 seq 1998887665 subseq 31417 len 1428 csum 0x4cbf], length 1428
20:50:04.952595 IP 112.26.3.8.33947 > 112.26.3.1.36395: Flags [.], ack 32845, win 11544, options [nop,nop,TS val 4294890067 ecr 146869,mptcp dss ack 1998790561], length 0
20:50:04.952805 IP 112.26.3.8.33947 > 112.26.3.1.36395: Flags [.], ack 32845, win 11544, options [nop,nop,TS val 4294890067 ecr 146869,mptcp dss ack 1998790561], length 0
20:50:05.047688 IP 112.26.3.8.33947 > 112.26.3.1.36395: Flags [.], ack 24277, win 10585, options [nop,nop,TS val 4294889184 ecr 145223,mptcp dss ack 1998790561], length 0
20:50:05.091484 IP 112.26.3.1.36395 > 112.26.3.8.33947: Flags [.], seq 32845:34273, ack 1, win 4017, options [nop,nop,TS val 146869 ecr 4294887764,mptcp dss ack 3836451400 seq 1998889093 subseq 32845 len 1428 csum 0x211f], length 1428
20:50:05.098496 IP 112.26.3.8.33947 > 112.26.3.1.36395: Flags [.], ack 34273, win 11726, options [nop,nop,TS val 4294890210 ecr 146869,mptcp dss ack 1998790561], length 0
20:50:05.098715 IP 112.26.3.8.33947 > 112.26.3.1.36395: Flags [.], ack 34273, win 11726, options [nop,nop,TS val 4294890210 ecr 146869,mptcp dss ack 1998790561], length 0
20:50:05.105735 IP 112.26.3.1.36395 > 112.26.3.8.33947: Flags [.], seq 32845:34273, ack 1, win 4017, options [nop,nop,TS val 146869 ecr 4294887764,mptcp dss ack 3836451400 seq 1998889093 subseq 32845 len 1428 csum 0x211f], length 1428
20:50:05.121009 IP 112.26.3.8.33947 > 112.26.3.1.36395: Flags [.], ack 25705, win 10677, options [nop,nop,TS val 4294889243 ecr 146436,mptcp dss ack 1998790561], length 0
20:50:05.193906 IP 112.26.3.1.36395 > 112.26.3.8.33947: Flags [.], seq 9997:11425, ack 1, win 4017, options [nop,nop,TS val 146990 ecr 4294887904,mptcp dss ack 3836451400 seq 1998766285 subseq 9997 len 1428 csum 0x21a8], length 1428
20:50:05.216882 IP 112.26.3.1.36395 > 112.26.3.8.33947: Flags [.], seq 9997:11425, ack 1, win 4017, options [nop,nop,TS val 146990 ecr 4294887904,mptcp dss ack 3836451400 seq 1998766285 subseq 9997 len 1428 csum 0x21a8], length 1428
20:50:05.222019 IP 112.26.3.8.33947 > 112.26.3.1.36395: Flags [.], ack 34273, win 11863, options [nop,nop,TS val 4294890332 ecr 146869,nop,nop,sack 1 {9997:11425},mptcp dss ack 1998790561], length 0
20:50:05.222264 IP 112.26.3.8.33947 > 112.26.3.1.36395: Flags [.], ack 34273, win 11863, options [nop,nop,TS val 4294890332 ecr 146869,nop,nop,sack 1 {9997:11425},mptcp dss ack 1998790561], length 0
20:50:05.244560 IP 112.26.3.8.33947 > 112.26.3.1.36395: Flags [.], ack 27133, win 10814, options [nop,nop,TS val 4294889369 ecr 146559,mptcp dss ack 1998790561], length 0
20:50:05.299937 IP 112.26.3.8.33947 > 112.26.3.1.36395: Flags [.], ack 28561, win 11042, options [nop,nop,TS val 4294889619 ecr 146559,mptcp dss ack 1998790561], length 0
20:50:05.353596 IP 112.26.3.1.36395 > 112.26.3.8.33947: Flags [.], seq 35701:37129, ack 1, win 4017, options [nop,nop,TS val 147113 ecr 4294888169,mptcp dss ack 3836451400 seq 1998899089 subseq 35701 len 1428 csum 0xac39], length 1428
20:50:05.356859 IP 112.26.3.1.36395 > 112.26.3.8.33947: Flags [.], seq 35701:37129, ack 1, win 4017, options [nop,nop,TS val 147113 ecr 4294888169,mptcp dss ack 3836451400 seq 1998899089 subseq 35701 len 1428 csum 0xac39], length 1428
20:50:05.359514 IP 112.26.3.8.33947 > 112.26.3.1.36395: Flags [.], ack 34273, win 12045, options [nop,nop,TS val 4294890472 ecr 146869,nop,nop,sack 1 {35701:37129},mptcp dss ack 1998806269], length 0
20:50:05.359706 IP 112.26.3.8.33947 > 112.26.3.1.36395: Flags [.], ack 34273, win 12045, options [nop,nop,TS val 4294890472 ecr 146869,nop,nop,sack 1 {35701:37129},mptcp dss ack 1998806269], length 0
20:50:05.434462 IP 112.26.3.8.33947 > 112.26.3.1.36395: Flags [.], ack 29989, win 11224, options [nop,nop,TS val 4294889761 ecr 146723,mptcp dss ack 1998790561], length 0
20:50:05.567144 IP 112.26.3.8.33947 > 112.26.3.1.36395: Flags [.], ack 31417, win 11361, options [nop,nop,TS val 4294889887 ecr 146723,mptcp dss ack 1998790561], length 0
20:50:05.575224 IP 112.26.3.1.36395 > 112.26.3.8.33947: Flags [.], seq 38557:39985, ack 1, win 4017, options [nop,nop,TS val 147113 ecr 4294888169,mptcp dss ack 3836451400 seq 1998901945 subseq 38557 len 1428 csum 0x4e71], length 1428
20:50:05.578914 IP 112.26.3.1.36395 > 112.26.3.8.33947: Flags [.], seq 38557:39985, ack 1, win 4017, options [nop,nop,TS val 147113 ecr 4294888169,mptcp dss ack 3836451400 seq 1998901945 subseq 38557 len 1428 csum 0x4e71], length 1428
20:50:05.586599 IP 112.26.3.8.33947 > 112.26.3.1.36395: Flags [.], ack 34273, win 12274, options [nop,nop,TS val 4294890694 ecr 146869,nop,nop,sack 2 {38557:39985}{35701:37129},mptcp dss ack 1998806269], length 0
20:50:05.586803 IP 112.26.3.8.33947 > 112.26.3.1.36395: Flags [.], ack 34273, win 12274, options [nop,nop,TS val 4294890694 ecr 146869,nop,nop,sack 2 {38557:39985}{35701:37129},mptcp dss ack 1998806269], length 0
20:50:05.690656 IP 112.26.3.8.33947 > 112.26.3.1.36395: Flags [.], ack 32845, win 11544, options [nop,nop,TS val 4294890067 ecr 146869,mptcp dss ack 1998790561], length 0
20:50:05.747389 IP 112.26.3.1.36395 > 112.26.3.8.33947: Flags [.], seq 41413:42841, ack 1, win 4017, options [nop,nop,TS val 147304 ecr 4294888283,mptcp dss ack 3836451400 seq 1998906229 subseq 41413 len 1428 csum 0x6359], length 1428
20:50:05.750386 IP 112.26.3.1.36395 > 112.26.3.8.33947: Flags [.], seq 41413:42841, ack 1, win 4017, options [nop,nop,TS val 147304 ecr 4294888283,mptcp dss ack 3836451400 seq 1998906229 subseq 41413 len 1428 csum 0x6359], length 1428
20:50:05.754962 IP 112.26.3.8.33947 > 112.26.3.1.36395: Flags [.], ack 34273, win 12410, options [nop,nop,TS val 4294890866 ecr 146869,nop,nop,sack 2 {41413:42841}{38557:39985},mptcp dss ack 1998806269], length 0
20:50:05.755177 IP 112.26.3.8.33947 > 112.26.3.1.36395: Flags [.], ack 34273, win 12410, options [nop,nop,TS val 4294890866 ecr 146869,nop,nop,sack 2 {41413:42841}{38557:39985},mptcp dss ack 1998806269], length 0
20:50:05.813114 IP 112.26.3.8.33947 > 112.26.3.1.36395: Flags [.], ack 34273, win 11726, options [nop,nop,TS val 4294890210 ecr 146869,mptcp dss ack 1998790561], length 0
20:50:05.891212 IP 112.26.3.1.36395 > 112.26.3.8.33947: Flags [.], seq 44269:45697, ack 1, win 4017, options [nop,nop,TS val 147438 ecr 4294888511,mptcp dss ack 3836451400 seq 1998910513 subseq 44269 len 1428 csum 0xc5de], length 1428
20:50:05.895445 IP 112.26.3.1.36395 > 112.26.3.8.33947: Flags [.], seq 44269:45697, ack 1, win 4017, options [nop,nop,TS val 147438 ecr 4294888511,mptcp dss ack 3836451400 seq 1998910513 subseq 44269 len 1428 csum 0xc5de], length 1428
20:50:05.922331 IP 112.26.3.8.33947 > 112.26.3.1.36395: Flags [.], ack 34273, win 11863, options [nop,nop,TS val 4294890332 ecr 146869,nop,nop,sack 1 {9997:11425},mptcp dss ack 1998790561], length 0
20:50:05.948325 IP 112.26.3.8.33947 > 112.26.3.1.36395: Flags [.], ack 34273, win 12593, options [nop,nop,TS val 4294891011 ecr 146869,nop,nop,sack 2 {44269:45697}{41413:42841},mptcp dss ack 1998806269], length 0
20:50:05.948499 IP 112.26.3.8.33947 > 112.26.3.1.36395: Flags [.], ack 34273, win 12593, options [nop,nop,TS val 4294891011 ecr 146869,nop,nop,sack 2 {44269:45697}{41413:42841},mptcp dss ack 1998806269], length 0
20:50:05.986087 IP 112.26.3.1.36395 > 112.26.3.8.33947: Flags [.], seq 45697:47125, ack 1, win 4017, options [nop,nop,TS val 147777 ecr 4294888667,mptcp dss ack 3836451400 seq 1998917653 subseq 45697 len 1428 csum 0x6f45], length 1428
20:50:06.017158 IP 112.26.3.1.36395 > 112.26.3.8.33947: Flags [.], seq 45697:47125, ack 1, win 4017, options [nop,nop,TS val 147777 ecr 4294888667,mptcp dss ack 3836451400 seq 1998917653 subseq 45697 len 1428 csum 0x6f45], length 1428
20:50:06.041954 IP 112.26.3.8.33947 > 112.26.3.1.36395: Flags [.], ack 34273, win 12045, options [nop,nop,TS val 4294890472 ecr 146869,nop,nop,sack 1 {35701:37129},mptcp dss ack 1998806269], length 0
20:50:06.043760 IP 112.26.3.8.33947 > 112.26.3.1.36395: Flags [.], ack 34273, win 12730, options [nop,nop,TS val 4294891133 ecr 146869,nop,nop,sack 2 {44269:47125}{41413:42841},mptcp dss ack 1998806269], length 0
20:50:06.043962 IP 112.26.3.8.33947 > 112.26.3.1.36395: Flags [.], ack 34273, win 12730, options [nop,nop,TS val 4294891133 ecr 146869,nop,nop,sack 2 {44269:47125}{41413:42841},mptcp dss ack 1998806269], length 0
20:50:06.143735 IP 112.26.3.8.33947 > 112.26.3.1.36395: Flags [.], ack 34273, win 12274, options [nop,nop,TS val 4294890694 ecr 146869,nop,nop,sack 2 {38557:39985}{35701:37129},mptcp dss ack 1998806269], length 0
20:50:06.155555 IP 112.26.3.1.36395 > 112.26.3.8.33947: Flags [.], seq 47125:48553, ack 1, win 4017, options [nop,nop,TS val 147777 ecr 4294888667,mptcp dss ack 3836451400 seq 1998919081 subseq 47125 len 1428 csum 0xe50], length 1428
20:50:06.160797 IP 112.26.3.1.36395 > 112.26.3.8.33947: Flags [.], seq 47125:48553, ack 1, win 4017, options [nop,nop,TS val 147777 ecr 4294888667,mptcp dss ack 3836451400 seq 1998919081 subseq 47125 len 1428 csum 0xe50], length 1428
20:50:06.174403 IP 112.26.3.8.33947 > 112.26.3.1.36395: Flags [.], ack 34273, win 12821, options [nop,nop,TS val 4294891276 ecr 146869,nop,nop,sack 2 {44269:48553}{41413:42841},mptcp dss ack 1998806269], length 0
20:50:06.174605 IP 112.26.3.8.33947 > 112.26.3.1.36395: Flags [.], ack 34273, win 12821, options [nop,nop,TS val 4294891276 ecr 146869,nop,nop,sack 2 {44269:48553}{41413:42841},mptcp dss ack 1998806269], length 0
20:50:06.214758 IP 112.26.3.1.36395 > 112.26.3.8.33947: Flags [.], seq 48553:49981, ack 1, win 4017, options [nop,nop,TS val 147851 ecr 4294888836,mptcp dss ack 3836451400 seq 1998921937 subseq 48553 len 1428 csum 0x12a2], length 1428
20:50:06.326676 IP 112.26.3.1.36395 > 112.26.3.8.33947: Flags [.], seq 48553:49981, ack 1, win 4017, options [nop,nop,TS val 147851 ecr 4294888836,mptcp dss ack 3836451400 seq 1998921937 subseq 48553 len 1428 csum 0x12a2], length 1428
20:50:06.328885 IP 112.26.3.8.33947 > 112.26.3.1.36395: Flags [.], ack 34273, win 12958, options [nop,nop,TS val 4294891442 ecr 146869,nop,nop,sack 2 {44269:49981}{41413:42841},mptcp dss ack 1998806269], length 0
20:50:06.329129 IP 112.26.3.8.33947 > 112.26.3.1.36395: Flags [.], ack 34273, win 12958, options [nop,nop,TS val 4294891442 ecr 146869,nop,nop,sack 2 {44269:49981}{41413:42841},mptcp dss ack 1998806269], length 0
20:50:06.364968 IP 112.26.3.1.36395 > 112.26.3.8.33947: Flags [.], seq 49981:51409, ack 1, win 4017, options [nop,nop,TS val 147851 ecr 4294888836,mptcp dss ack 3836451400 seq 1998923365 subseq 49981 len 1428 csum 0x30ee], length 1428
20:50:06.377699 IP 112.26.3.8.33947 > 112.26.3.1.36395: Flags [.], ack 34273, win 12410, options [nop,nop,TS val 4294890866 ecr 146869,nop,nop,sack 2 {41413:42841}{38557:39985},mptcp dss ack 1998806269], length 0
20:50:06.421955 IP 112.26.3.1.36395 > 112.26.3.8.33947: Flags [.], seq 49981:51409, ack 1, win 4017, options [nop,nop,TS val 147851 ecr 4294888836,mptcp dss ack 3836451400 seq 1998923365 subseq 49981 len 1428 csum 0x30ee], length 1428
20:50:06.446468 IP 112.26.3.8.33947 > 112.26.3.1.36395: Flags [.], ack 34273, win 13004, options [nop,nop,TS val 4294891537 ecr 146869,nop,nop,sack 2 {44269:51409}{41413:42841},mptcp dss ack 1998806269], length 0
20:50:06.446674 IP 112.26.3.8.33947 > 112.26.3.1.36395: Flags [.], ack 34273, win 13004, options [nop,nop,TS val 4294891537 ecr 146869,nop,nop,sack 2 {44269:51409}{41413:42841},mptcp dss ack 1998806269], length 0
20:50:06.456588 IP 112.26.3.1.36395 > 112.26.3.8.33947: Flags [.], seq 51409:52837, ack 1, win 4017, options [nop,nop,TS val 147986 ecr 4294888913,mptcp dss ack 3836451400 seq 1998927649 subseq 51409 len 1428 csum 0xee8f], length 1428
20:50:06.518564 IP 112.26.3.1.36395 > 112.26.3.8.33947: Flags [.], seq 52837:54265, ack 1, win 4017, options [nop,nop,TS val 147986 ecr 4294888913,mptcp dss ack 3836451400 seq 1998929077 subseq 52837 len 1428 csum 0x8001], length 1428
20:50:06.551955 IP 112.26.3.1.36395 > 112.26.3.8.33947: Flags [.], seq 51409:52837, ack 1, win 4017, options [nop,nop,TS val 147986 ecr 4294888913,mptcp dss ack 3836451400 seq 1998927649 subseq 51409 len 1428 csum 0xee8f], length 1428
20:50:06.559543 IP 112.26.3.8.33947 > 112.26.3.1.36395: Flags [.], ack 34273, win 13232, options [nop,nop,TS val 4294891667 ecr 146869,nop,nop,sack 2 {44269:52837}{41413:42841},mptcp dss ack 1998806269], length 0
20:50:06.559771 IP 112.26.3.8.33947 > 112.26.3.1.36395: Flags [.], ack 34273, win 13232, options [nop,nop,TS val 4294891667 ecr 146869,nop,nop,sack 2 {44269:52837}{41413:42841},mptcp dss ack 1998806269], length 0
20:50:06.634729 IP 112.26.3.8.33947 > 112.26.3.1.36395: Flags [.], ack 34273, win 12593, options [nop,nop,TS val 4294891011 ecr 146869,nop,nop,sack 2 {44269:45697}{41413:42841},mptcp dss ack 1998806269], length 0
20:50:06.652417 IP 112.26.3.1.36395 > 112.26.3.8.33947: Flags [.], seq 52837:54265, ack 1, win 4017, options [nop,nop,TS val 147986 ecr 4294888913,mptcp dss ack 3836451400 seq 1998929077 subseq 52837 len 1428 csum 0x8001], length 1428
20:50:06.654696 IP 112.26.3.8.33947 > 112.26.3.1.36395: Flags [.], ack 34273, win 13323, options [nop,nop,TS val 4294891768 ecr 146869,nop,nop,sack 2 {44269:54265}{41413:42841},mptcp dss ack 1998806269], length 0
20:50:06.654939 IP 112.26.3.8.33947 > 112.26.3.1.36395: Flags [.], ack 34273, win 13323, options [nop,nop,TS val 4294891768 ecr 146869,nop,nop,sack 2 {44269:54265}{41413:42841},mptcp dss ack 1998806269], length 0
20:50:06.695809 IP 112.26.3.1.36395 > 112.26.3.8.33947: Flags [.], seq 55693:57121, ack 1, win 4017, options [nop,nop,TS val 148136 ecr 4294889082,mptcp dss ack 3836451400 seq 1998931933 subseq 55693 len 1428 csum 0x4c62], length 1428
20:50:06.752474 IP 112.26.3.1.36395 > 112.26.3.8.33947: Flags [.], seq 55693:57121, ack 1, win 4017, options [nop,nop,TS val 148136 ecr 4294889082,mptcp dss ack 3836451400 seq 1998931933 subseq 55693 len 1428 csum 0x4c62], length 1428
20:50:06.777276 IP 112.26.3.8.33947 > 112.26.3.1.36395: Flags [.], ack 34273, win 12730, options [nop,nop,TS val 4294891133 ecr 146869,nop,nop,sack 2 {44269:47125}{41413:42841},mptcp dss ack 1998806269], length 0
20:50:06.780009 IP 112.26.3.8.33947 > 112.26.3.1.36395: Flags [.], ack 34273, win 13505, options [nop,nop,TS val 4294891868 ecr 146869,nop,nop,sack 2 {55693:57121}{44269:54265},mptcp dss ack 1998806269], length 0
20:50:06.780301 IP 112.26.3.8.33947 > 112.26.3.1.36395: Flags [.], ack 34273, win 13505, options [nop,nop,TS val 4294891868 ecr 146869,nop,nop,sack 2 {55693:57121}{44269:54265},mptcp dss ack 1998806269], length 0
20:50:06.934759 IP 112.26.3.1.36395 > 112.26.3.8.33947: Flags [.], seq 62833:64261, ack 1, win 4017, options [nop,nop,TS val 148355 ecr 4294889369,mptcp dss ack 3836451400 seq 1998951925 subseq 62833 len 1428 csum 0xac86], length 1428
20:50:06.940340 IP 112.26.3.1.36395 > 112.26.3.8.33947: Flags [.], seq 62833:64261, ack 1, win 4017, options [nop,nop,TS val 148355 ecr 4294889369,mptcp dss ack 3836451400 seq 1998951925 subseq 62833 len 1428 csum 0xac86], length 1428
20:50:06.942878 IP 112.26.3.8.33947 > 112.26.3.1.36395: Flags [.], ack 34273, win 13734, options [nop,nop,TS val 4294892056 ecr 146869,nop,nop,sack 2 {62833:64261}{55693:57121},mptcp dss ack 1998806269], length 0
20:50:06.943134 IP 112.26.3.8.33947 > 112.26.3.1.36395: Flags [.], ack 34273, win 13734, options [nop,nop,TS val 4294892056 ecr 146869,nop,nop,sack 2 {62833:64261}{55693:57121},mptcp dss ack 1998806269], length 0
20:50:06.997026 IP 112.26.3.8.33947 > 112.26.3.1.36395: Flags [.], ack 34273, win 12821, options [nop,nop,TS val 4294891276 ecr 146869,nop,nop,sack 2 {44269:48553}{41413:42841},mptcp dss ack 1998806269], length 0
