20:49:55.283769 IP 112.26.0.8.47050 > 112.26.0.1.36395: Flags [S], seq 3888113954, win 65535, options [mss 1460,sackOK,TS val 4294878138 ecr 0,nop,wscale 6,mptcp capable csum {0x58de4f15359c9e63}], length 0
20:49:55.287474 IP 112.26.0.8.47050 > 112.26.0.1.36395: Flags [S], seq 3888113954, win 65535, options [mss 1460,sackOK,TS val 4294878138 ecr 0,nop,wscale 6,mptcp capable csum {0x58de4f15359c9e63}], length 0
20:49:55.370602 IP 112.26.0.1.36395 > 112.26.0.8.47050: Flags [S.], seq 757391606, ack 3888113955, win 65535, options [mss 1460,sackOK,TS val 138398 ecr 4294878138,nop,wscale 6,mptcp capable csum {0xf419b506df61ca0b}], length 0
20:49:55.594781 IP 112.26.0.8.47050 > 112.26.0.1.36395: Flags [.], ack 1, win 1369, options [nop,nop,TS val 4294880693 ecr 138398,mptcp capable csum {0x58de4f15359c9e63,0xf419b506df61ca0b},mptcp dss ack 1998632241], length 0
20:49:55.597621 IP 112.26.0.8.47050 > 112.26.0.1.36395: Flags [.], ack 1, win 1369, options [nop,nop,TS val 4294880693 ecr 138398,mptcp capable csum {0x58de4f15359c9e63,0xf419b506df61ca0b},mptcp dss ack 1998632241], length 0
20:49:55.598611 IP 112.26.0.1.36395 > 112.26.0.8.47050: Flags [.], ack 1, win 1339, options [nop,nop,TS val 138707 ecr 4294880693,mptcp add-addr id 3 112.26.1.1,mptcp dss ack 3836451400], length 0
20:49:55.680800 IP 112.26.0.8.47050 > 112.26.0.1.36395: Flags [.], ack 1, win 1369, options [nop,nop,TS val 4294880693 ecr 138398,mptcp add-addr id 3 112.26.1.8,mptcp dss ack 1998632241], length 0
20:49:55.685717 IP 112.26.0.8.47050 > 112.26.0.1.36395: Flags [.], ack 1, win 1369, options [nop,nop,TS val 4294880693 ecr 138398,mptcp add-addr id 3 112.26.1.8,mptcp dss ack 1998632241], length 0
20:49:55.694313 IP 112.26.0.1.36395 > 112.26.0.8.47050: Flags [.], ack 1, win 1339, options [nop,nop,TS val 138707 ecr 4294880693,mptcp add-addr id 5 112.26.3.1,mptcp dss ack 3836451400], length 0
20:49:55.712420 IP 112.26.0.1.36395 > 112.26.0.8.47050: Flags [.], ack 1, win 1339, options [nop,nop,TS val 138707 ecr 4294880693,mptcp add-addr id 6 112.26.2.1,mptcp dss ack 3836451400], length 0
20:49:55.773796 IP 112.26.0.8.47050 > 112.26.0.1.36395: Flags [.], ack 1, win 1369, options [nop,nop,TS val 4294880693 ecr 138398,mptcp add-addr id 4 112.26.2.8,mptcp dss ack 1998632241], length 0
20:49:55.778026 IP 112.26.0.8.47050 > 112.26.0.1.36395: Flags [.], ack 1, win 1369, options [nop,nop,TS val 4294880693 ecr 138398,mptcp add-addr id 4 112.26.2.8,mptcp dss ack 1998632241], length 0
20:49:55.791201 IP 112.26.0.1.36395 > 112.26.0.8.47050: Flags [.], seq 1:1429, ack 1, win 1339, options [nop,nop,TS val 138713 ecr 4294880693,mptcp dss ack 3836451400 seq 1998632241 subseq 1 len 1428 csum 0x4291], length 1428
20:49:55.809191 IP 112.26.0.8.47050 > 112.26.0.1.36395: Flags [.], ack 1, win 1369, options [nop,nop,TS val 4294880693 ecr 138398,mptcp add-addr id 5 112.26.3.8,mptcp dss ack 1998632241], length 0
20:49:55.811748 IP 112.26.0.8.47050 > 112.26.0.1.36395: Flags [.], ack 1, win 1369, options [nop,nop,TS val 4294880693 ecr 138398,mptcp add-addr id 5 112.26.3.8,mptcp dss ack 1998632241], length 0
20:49:55.824638 IP 112.26.0.1.36395 > 112.26.0.8.47050: Flags [.], seq 1429:2857, ack 1, win 1339, options [nop,nop,TS val 138713 ecr 4294880693,mptcp dss ack 3836451400 seq 1998633669 subseq 1429 len 1428 csum 0x61df], length 1428
20:49:55.877654 IP 112.26.0.8.47050 > 112.26.0.1.36395: Flags [.], ack 1429, win 1415, options [nop,nop,TS val 4294880935 ecr 138713,mptcp dss ack 1998633669], length 0
20:49:55.887199 IP 112.26.0.8.47050 > 112.26.0.1.36395: Flags [.], ack 1429, win 1415, options [nop,nop,TS val 4294880935 ecr 138713,mptcp dss ack 1998633669], length 0
20:49:55.896204 IP 112.26.0.1.36395 > 112.26.0.8.47050: Flags [P.], seq 2857:4097, ack 1, win 1339, options [nop,nop,TS val 138713 ecr 4294880693,mptcp dss ack 3836451400 seq 1998635097 subseq 2857 len 1240 csum 0xa2b1], length 1240
20:49:55.973497 IP 112.26.0.1.36395 > 112.26.0.8.47050: Flags [.], seq 4097:5525, ack 1, win 1339, options [nop,nop,TS val 138713 ecr 4294880693,mptcp dss ack 3836451400 seq 1998636337 subseq 4097 len 1428 csum 0x96ea], length 1428
20:49:55.983069 IP 112.26.0.8.47050 > 112.26.0.1.36395: Flags [.], ack 2857, win 1460, options [nop,nop,TS val 4294881011 ecr 138713,mptcp dss ack 1998635097], length 0
20:49:55.987236 IP 112.26.0.8.47050 > 112.26.0.1.36395: Flags [.], ack 2857, win 1460, options [nop,nop,TS val 4294881011 ecr 138713,mptcp dss ack 1998635097], length 0
20:49:55.999531 IP 112.26.0.1.36395 > 112.26.0.8.47050: Flags [.], seq 5525:6953, ack 1, win 1339, options [nop,nop,TS val 138713 ecr 4294880693,mptcp dss ack 3836451400 seq 1998637765 subseq 5525 len 1428 csum 0xf35f], length 1428
20:49:56.010837 IP 112.26.0.8.47050 > 112.26.0.1.36395: Flags [.], ack 4097, win 1506, options [nop,nop,TS val 4294881108 ecr 138713,mptcp dss ack 1998636337], length 0
20:49:56.071961 IP 112.26.0.8.47050 > 112.26.0.1.36395: Flags [.], ack 4097, win 1506, options [nop,nop,TS val 4294881108 ecr 138713,mptcp dss ack 1998636337], length 0
20:49:56.095998 IP 112.26.0.8.47050 > 112.26.0.1.36395: Flags [.], ack 5525, win 1552, options [nop,nop,TS val 4294881199 ecr 138713,mptcp dss ack 1998637765], length 0
20:49:56.097090 IP 112.26.0.1.36395 > 112.26.0.8.47050: Flags [.], seq 6953:8381, ack 1, win 1339, options [nop,nop,TS val 138714 ecr 4294880693,mptcp dss ack 3836451400 seq 1998639193 subseq 6953 len 1428 csum 0x8d2c], length 1428
20:49:56.107527 IP 112.26.0.8.47050 > 112.26.0.1.36395: Flags [.], ack 5525, win 1552, options [nop,nop,TS val 4294881199 ecr 138713,mptcp dss ack 1998637765], length 0
20:49:56.114990 IP 112.26.0.1.36395 > 112.26.0.8.47050: Flags [.], seq 8381:9809, ack 1, win 1339, options [nop,nop,TS val 138714 ecr 4294880693,mptcp dss ack 3836451400 seq 1998640621 subseq 8381 len 1428 csum 0x5cbe], length 1428
20:49:56.179400 IP 112.26.0.8.47050 > 112.26.0.1.36395: Flags [.], ack 6953, win 1597, options [nop,nop,TS val 4294881289 ecr 138713,mptcp dss ack 1998639193], length 0
20:49:56.185550 IP 112.26.0.1.36395 > 112.26.0.8.47050: Flags [.], seq 14093:15521, ack 1, win 1339, options [nop,nop,TS val 138998 ecr 4294880935,mptcp dss ack 3836451400 seq 1998646333 subseq 14093 len 1428 csum 0x1947], length 1428
20:49:56.202591 IP 112.26.0.1.36395 > 112.26.0.8.47050: Flags [.], seq 15521:16949, ack 1, win 1339, options [nop,nop,TS val 138998 ecr 4294880935,mptcp dss ack 3836451400 seq 1998647761 subseq 15521 len 1428 csum 0x84a2], length 1428
20:49:56.285207 IP 112.26.0.1.36395 > 112.26.0.8.47050: Flags [.], seq 16949:18377, ack 1, win 1339, options [nop,nop,TS val 139096 ecr 4294881011,mptcp dss ack 3836451400 seq 1998649189 subseq 16949 len 1428 csum 0x6df6], length 1428
20:49:56.292725 IP 112.26.0.8.47050 > 112.26.0.1.36395: Flags [.], ack 6953, win 1597, options [nop,nop,TS val 4294881289 ecr 138713,mptcp dss ack 1998639193], length 0
20:49:56.302293 IP 112.26.0.8.47050 > 112.26.0.1.36395: Flags [.], ack 8381, win 1643, options [nop,nop,TS val 4294881387 ecr 138714,mptcp dss ack 1998640621], length 0
20:49:56.308278 IP 112.26.0.1.36395 > 112.26.0.8.47050: Flags [.], seq 18377:19805, ack 1, win 1339, options [nop,nop,TS val 139096 ecr 4294881011,mptcp dss ack 3836451400 seq 1998650617 subseq 18377 len 1428 csum 0x7742], length 1428
20:49:56.388676 IP 112.26.0.8.47050 > 112.26.0.1.36395: Flags [.], ack 8381, win 1643, options [nop,nop,TS val 4294881387 ecr 138714,mptcp dss ack 1998640621], length 0
20:49:56.415237 IP 112.26.0.1.36395 > 112.26.0.8.47050: Flags [.], seq 19805:21233, ack 1, win 1339, options [nop,nop,TS val 139182 ecr 4294881108,mptcp dss ack 3836451400 seq 1998652045 subseq 19805 len 1428 csum 0x36e4], length 1428
20:49:56.420314 IP 112.26.0.8.47050 > 112.26.0.1.36395: Flags [.], ack 9809, win 1689, options [nop,nop,TS val 4294881427 ecr 138714,mptcp dss ack 1998642049], length 0
20:49:56.483290 IP 112.26.0.8.47050 > 112.26.0.1.36395: Flags [.], ack 9809, win 1734, options [nop,nop,TS val 4294881517 ecr 138714,nop,nop,sack 1 {14093:15521},mptcp dss ack 1998642049], length 0
20:49:56.487790 IP 112.26.0.1.36395 > 112.26.0.8.47050: Flags [.], seq 21233:22661, ack 1, win 1339, options [nop,nop,TS val 139182 ecr 4294881108,mptcp dss ack 3836451400 seq 1998653473 subseq 21233 len 1428 csum 0x7fe4], length 1428
20:49:56.500888 IP 112.26.0.8.47050 > 112.26.0.1.36395: Flags [.], ack 9809, win 1689, options [nop,nop,TS val 4294881427 ecr 138714,mptcp dss ack 1998642049], length 0
20:49:56.519261 IP 112.26.0.8.47050 > 112.26.0.1.36395: Flags [.], ack 9809, win 1780, options [nop,nop,TS val 4294881545 ecr 138714,nop,nop,sack 1 {14093:16949},mptcp dss ack 1998642049], length 0
20:49:56.530225 IP 112.26.0.1.36395 > 112.26.0.8.47050: Flags [.], seq 22661:24089, ack 1, win 1339, options [nop,nop,TS val 139218 ecr 4294881199,mptcp dss ack 3836451400 seq 1998654901 subseq 22661 len 1428 csum 0xdc7e], length 1428
20:49:56.537730 IP 112.26.0.8.47050 > 112.26.0.1.36395: Flags [.], ack 9809, win 1734, options [nop,nop,TS val 4294881517 ecr 138714,nop,nop,sack 1 {14093:15521},mptcp dss ack 1998642049], length 0
20:49:56.586004 IP 112.26.0.1.36395 > 112.26.0.8.47050: Flags [.], seq 24089:25517, ack 1, win 1339, options [nop,nop,TS val 139218 ecr 4294881199,mptcp dss ack 3836451400 seq 1998656329 subseq 24089 len 1428 csum 0x744d], length 1428
20:49:56.594387 IP 112.26.0.8.47050 > 112.26.0.1.36395: Flags [.], ack 9809, win 1825, options [nop,nop,TS val 4294881707 ecr 138714,nop,nop,sack 1 {14093:18377},mptcp dss ack 1998642049], length 0
20:49:56.599476 IP 112.26.0.8.47050 > 112.26.0.1.36395: Flags [.], ack 9809, win 1780, options [nop,nop,TS val 4294881545 ecr 138714,nop,nop,sack 1 {14093:16949},mptcp dss ack 1998642049], length 0
20:49:56.613245 IP 112.26.0.1.36395 > 112.26.0.8.47050: Flags [.], seq 25517:26945, ack 1, win 1339, options [nop,nop,TS val 139403 ecr 4294881289,mptcp dss ack 3836451400 seq 1998657757 subseq 25517 len 1428 csum 0x8e4b], length 1428
20:49:56.689000 IP 112.26.0.1.36395 > 112.26.0.8.47050: Flags [.], seq 26945:28373, ack 1, win 1339, options [nop,nop,TS val 139403 ecr 4294881289,mptcp dss ack 3836451400 seq 1998659185 subseq 26945 len 1428 csum 0x1448], length 1428
20:49:56.709035 IP 112.26.0.8.47050 > 112.26.0.1.36395: Flags [.], ack 9809, win 1871, options [nop,nop,TS val 4294881820 ecr 138714,nop,nop,sack 1 {14093:19805},mptcp dss ack 1998642049], length 0
20:49:56.781373 IP 112.26.0.8.47050 > 112.26.0.1.36395: Flags [.], ack 9809, win 1825, options [nop,nop,TS val 4294881707 ecr 138714,nop,nop,sack 1 {14093:18377},mptcp dss ack 1998642049], length 0
20:49:56.793682 IP 112.26.0.1.36395 > 112.26.0.8.47050: Flags [.], seq 28373:29801, ack 1, win 1339, options [nop,nop,TS val 139499 ecr 4294881387,mptcp dss ack 3836451400 seq 1998660613 subseq 28373 len 1428 csum 0x20a5], length 1428
20:49:56.798708 IP 112.26.0.8.47050 > 112.26.0.1.36395: Flags [.], ack 9809, win 1917, options [nop,nop,TS val 4294881911 ecr 138714,nop,nop,sack 1 {14093:21233},mptcp dss ack 1998642049], length 0
20:49:56.822441 IP 112.26.0.1.36395 > 112.26.0.8.47050: Flags [.], seq 29801:31229, ack 1, win 1339, options [nop,nop,TS val 139499 ecr 4294881387,mptcp dss ack 3836451400 seq 1998662041 subseq 29801 len 1428 csum 0x4646], length 1428
20:49:56.884341 IP 112.26.0.8.47050 > 112.26.0.1.36395: Flags [.], ack 9809, win 1962, options [nop,nop,TS val 4294881996 ecr 138714,nop,nop,sack 1 {14093:22661},mptcp dss ack 1998642049], length 0
20:49:56.893710 IP 112.26.0.8.47050 > 112.26.0.1.36395: Flags [.], ack 9809, win 1871, options [nop,nop,TS val 4294881820 ecr 138714,nop,nop,sack 1 {14093:19805},mptcp dss ack 1998642049], length 0
20:49:56.897623 IP 112.26.0.1.36395 > 112.26.0.8.47050: Flags [.], seq 31229:32657, ack 1, win 1339, options [nop,nop,TS val 139611 ecr 4294881427,mptcp dss ack 3836451400 seq 1998663469 subseq 31229 len 1428 csum 0x3986], length 1428
20:49:56.911283 IP 112.26.0.8.47050 > 112.26.0.1.36395: Flags [.], ack 9809, win 1917, options [nop,nop,TS val 4294881911 ecr 138714,nop,nop,sack 1 {14093:21233},mptcp dss ack 1998642049], length 0
20:49:56.927584 IP 112.26.0.1.36395 > 112.26.0.8.47050: Flags [.], seq 32657:34085, ack 1, win 1339, options [nop,nop,TS val 139611 ecr 4294881427,mptcp dss ack 3836451400 seq 1998664897 subseq 32657 len 1428 csum 0xb530], length 1428
20:49:56.989823 IP 112.26.0.1.36395 > 112.26.0.8.47050: Flags [.], seq 9809:11237, ack 1, win 1339, options [nop,nop,TS val 139649 ecr 4294881517,mptcp dss ack 3836451400 seq 1998642049 subseq 9809 len 1428 csum 0x552a], length 1428
20:49:56.993474 IP 112.26.0.8.47050 > 112.26.0.1.36395: Flags [.], ack 9809, win 2008, options [nop,nop,TS val 4294882033 ecr 138714,nop,nop,sack 1 {14093:24089},mptcp dss ack 1998642049], length 0
20:49:57.014019 IP 112.26.0.8.47050 > 112.26.0.1.36395: Flags [.], ack 9809, win 2054, options [nop,nop,TS val 4294882115 ecr 138714,nop,nop,sack 1 {14093:25517},mptcp dss ack 1998642049], length 0
20:49:57.017961 IP 112.26.0.8.47050 > 112.26.0.1.36395: Flags [.], ack 9809, win 1962, options [nop,nop,TS val 4294881996 ecr 138714,nop,nop,sack 1 {14093:22661},mptcp dss ack 1998642049], length 0
20:49:57.084311 IP 112.26.0.1.36395 > 112.26.0.8.47050: Flags [.], seq 11237:12665, ack 1, win 1339, options [nop,nop,TS val 139710 ecr 4294881545,mptcp dss ack 3836451400 seq 1998643477 subseq 11237 len 1428 csum 0x84b0], length 1428
20:49:57.089864 IP 112.26.0.8.47050 > 112.26.0.1.36395: Flags [.], ack 9809, win 2099, options [nop,nop,TS val 4294882203 ecr 138714,nop,nop,sack 1 {14093:26945},mptcp dss ack 1998642049], length 0
20:49:57.108481 IP 112.26.0.8.47050 > 112.26.0.1.36395: Flags [.], ack 9809, win 2008, options [nop,nop,TS val 4294882033 ecr 138714,nop,nop,sack 1 {14093:24089},mptcp dss ack 1998642049], length 0
20:49:57.121429 IP 112.26.0.8.47050 > 112.26.0.1.36395: Flags [.], ack 9809, win 2145, options [nop,nop,TS val 4294882234 ecr 138714,nop,nop,sack 1 {14093:28373},mptcp dss ack 1998642049], length 0
20:49:57.127990 IP 112.26.0.1.36395 > 112.26.0.8.47050: Flags [.], seq 12665:14093, ack 1, win 1339, options [nop,nop,TS val 140004 ecr 4294881820,mptcp dss ack 3836451400 seq 1998644905 subseq 12665 len 1428 csum 0xc6ad], length 1428
20:49:57.187616 IP 112.26.0.8.47050 > 112.26.0.1.36395: Flags [.], ack 9809, win 2054, options [nop,nop,TS val 4294882115 ecr 138714,nop,nop,sack 1 {14093:25517},mptcp dss ack 1998642049], length 0
20:49:57.197286 IP 112.26.0.8.47050 > 112.26.0.1.36395: Flags [.], ack 9809, win 2190, options [nop,nop,TS val 4294882305 ecr 138714,nop,nop,sack 1 {14093:29801},mptcp dss ack 1998642049], length 0
20:49:57.210120 IP 112.26.0.1.36395 > 112.26.0.8.47050: Flags [.], seq 34085:35513, ack 1, win 1339, options [nop,nop,TS val 140128 ecr 4294881911,mptcp dss ack 3836451400 seq 1998666325 subseq 34085 len 1428 csum 0xd621], length 1428
20:49:57.222184 IP 112.26.0.8.47050 > 112.26.0.1.36395: Flags [.], ack 9809, win 2236, options [nop,nop,TS val 4294882336 ecr 138714,nop,nop,sack 1 {14093:31229},mptcp dss ack 1998642049], length 0
20:49:57.283588 IP 112.26.0.8.47050 > 112.26.0.1.36395: Flags [.], ack 9809, win 2099, options [nop,nop,TS val 4294882203 ecr 138714,nop,nop,sack 1 {14093:26945},mptcp dss ack 1998642049], length 0
20:49:57.293159 IP 112.26.0.1.36395 > 112.26.0.8.47050: Flags [.], seq 35513:36941, ack 1, win 1339, options [nop,nop,TS val 140394 ecr 4294882115,mptcp dss ack 3836451400 seq 1998667753 subseq 35513 len 1428 csum 0xc2c6], length 1428
20:49:57.308329 IP 112.26.0.8.47050 > 112.26.0.1.36395: Flags [.], ack 9809, win 2282, options [nop,nop,TS val 4294882416 ecr 138714,nop,nop,sack 1 {14093:32657},mptcp dss ack 1998642049], length 0
20:49:57.383717 IP 112.26.0.8.47050 > 112.26.0.1.36395: Flags [.], ack 9809, win 2145, options [nop,nop,TS val 4294882234 ecr 138714,nop,nop,sack 1 {14093:28373},mptcp dss ack 1998642049], length 0
20:49:57.385914 IP 112.26.0.1.36395 > 112.26.0.8.47050: Flags [.], seq 36941:38369, ack 1, win 1339, options [nop,nop,TS val 140495 ecr 4294882203,mptcp dss ack 3836451400 seq 1998669181 subseq 36941 len 1428 csum 0x1b3a], length 1428
20:49:57.396527 IP 112.26.0.8.47050 > 112.26.0.1.36395: Flags [.], ack 9809, win 2327, options [nop,nop,TS val 4294882494 ecr 138714,nop,nop,sack 1 {14093:34085},mptcp dss ack 1998642049], length 0
20:49:57.413962 IP 112.26.0.8.47050 > 112.26.0.1.36395: Flags [.], ack 9809, win 2190, options [nop,nop,TS val 4294882305 ecr 138714,nop,nop,sack 1 {14093:29801},mptcp dss ack 1998642049], length 0
20:49:57.415262 IP 112.26.0.1.36395 > 112.26.0.8.47050: Flags [.], seq 38369:39797, ack 1, win 1339, options [nop,nop,TS val 140525 ecr 4294882234,mptcp dss ack 3836451400 seq 1998670609 subseq 38369 len 1428 csum 0xa13f], length 1428
20:49:57.488380 IP 112.26.0.8.47050 > 112.26.0.1.36395: Flags [.], ack 11237, win 2373, options [nop,nop,TS val 4294882600 ecr 139649,nop,nop,sack 1 {14093:34085},mptcp dss ack 1998643477], length 0
20:49:57.512366 IP 112.26.0.8.47050 > 112.26.0.1.36395: Flags [.], ack 9809, win 2236, options [nop,nop,TS val 4294882336 ecr 138714,nop,nop,sack 1 {14093:31229},mptcp dss ack 1998642049], length 0
20:49:57.513646 IP 112.26.0.1.36395 > 112.26.0.8.47050: Flags [.], seq 39797:41225, ack 1, win 1339, options [nop,nop,TS val 140623 ecr 4294882305,mptcp dss ack 3836451400 seq 1998672037 subseq 39797 len 1428 csum 0x6da2], length 1428
20:49:57.521894 IP 112.26.0.8.47050 > 112.26.0.1.36395: Flags [.], ack 12665, win 2419, options [nop,nop,TS val 4294882633 ecr 139710,nop,nop,sack 1 {14093:34085},mptcp dss ack 1998644905], length 0
20:49:57.598115 IP 112.26.0.8.47050 > 112.26.0.1.36395: Flags [.], ack 34085, win 2464, options [nop,nop,TS val 4294882711 ecr 140004,mptcp dss ack 1998666325], length 0
20:49:57.612021 IP 112.26.0.8.47050 > 112.26.0.1.36395: Flags [.], ack 9809, win 2282, options [nop,nop,TS val 4294882416 ecr 138714,nop,nop,sack 1 {14093:32657},mptcp dss ack 1998642049], length 0
20:49:57.613321 IP 112.26.0.1.36395 > 112.26.0.8.47050: Flags [.], seq 41225:42653, ack 1, win 1339, options [nop,nop,TS val 140723 ecr 4294882336,mptcp dss ack 3836451400 seq 1998673465 subseq 41225 len 1428 csum 0x66db], length 1428
20:49:57.627946 IP 112.26.0.8.47050 > 112.26.0.1.36395: Flags [.], ack 35513, win 2510, options [nop,nop,TS val 4294882738 ecr 140128,mptcp dss ack 1998667753], length 0
20:49:57.697513 IP 112.26.0.8.47050 > 112.26.0.1.36395: Flags [.], ack 9809, win 2327, options [nop,nop,TS val 4294882494 ecr 138714,nop,nop,sack 1 {14093:34085},mptcp dss ack 1998642049], length 0
20:49:57.698800 IP 112.26.0.1.36395 > 112.26.0.8.47050: Flags [.], seq 42653:44081, ack 1, win 1339, options [nop,nop,TS val 140808 ecr 4294882416,mptcp dss ack 3836451400 seq 1998674893 subseq 42653 len 1428 csum 0x8679], length 1428
20:49:57.708151 IP 112.26.0.8.47050 > 112.26.0.1.36395: Flags [.], ack 36941, win 2555, options [nop,nop,TS val 4294882821 ecr 140394,mptcp dss ack 1998669181], length 0
20:49:57.720739 IP 112.26.0.8.47050 > 112.26.0.1.36395: Flags [.], ack 11237, win 2373, options [nop,nop,TS val 4294882600 ecr 139649,nop,nop,sack 1 {14093:34085},mptcp dss ack 1998643477], length 0
20:49:57.727102 IP 112.26.0.1.36395 > 112.26.0.8.47050: Flags [.], seq 44081:45509, ack 1, win 1339, options [nop,nop,TS val 140832 ecr 4294882494,mptcp dss ack 3836451400 seq 1998676321 subseq 44081 len 1428 csum 0x771f], length 1428
20:49:57.791425 IP 112.26.0.8.47050 > 112.26.0.1.36395: Flags [.], ack 38369, win 2601, options [nop,nop,TS val 4294882904 ecr 140495,mptcp dss ack 1998670609], length 0
20:49:57.801818 IP 112.26.0.1.36395 > 112.26.0.8.47050: Flags [.], seq 45509:46937, ack 1, win 1339, options [nop,nop,TS val 140832 ecr 4294882600,mptcp dss ack 3836451400 seq 1998677749 subseq 45509 len 1428 csum 0x4c5], length 1428
20:49:57.807137 IP 112.26.0.8.47050 > 112.26.0.1.36395: Flags [.], ack 12665, win 2419, options [nop,nop,TS val 4294882633 ecr 139710,nop,nop,sack 1 {14093:34085},mptcp dss ack 1998644905], length 0
20:49:57.821491 IP 112.26.0.8.47050 > 112.26.0.1.36395: Flags [.], ack 39797, win 2647, options [nop,nop,TS val 4294882935 ecr 140525,mptcp dss ack 1998672037], length 0
20:49:57.830411 IP 112.26.0.1.36395 > 112.26.0.8.47050: Flags [.], seq 46937:48365, ack 1, win 1339, options [nop,nop,TS val 140918 ecr 4294882633,mptcp dss ack 3836451400 seq 1998679177 subseq 46937 len 1428 csum 0x535e], length 1428
20:49:57.893881 IP 112.26.0.8.47050 > 112.26.0.1.36395: Flags [.], ack 34085, win 2464, options [nop,nop,TS val 4294882711 ecr 140004,mptcp dss ack 1998666325], length 0
20:49:57.895157 IP 112.26.0.1.36395 > 112.26.0.8.47050: Flags [.], seq 48365:49793, ack 1, win 1339, options [nop,nop,TS val 141005 ecr 4294882711,mptcp dss ack 3836451400 seq 1998680605 subseq 48365 len 1428 csum 0xe564], length 1428
20:49:57.905956 IP 112.26.0.8.47050 > 112.26.0.1.36395: Flags [.], ack 41225, win 2692, options [nop,nop,TS val 4294883019 ecr 140623,mptcp dss ack 1998673465], length 0
20:49:57.921376 IP 112.26.0.8.47050 > 112.26.0.1.36395: Flags [.], ack 35513, win 2510, options [nop,nop,TS val 4294882738 ecr 140128,mptcp dss ack 1998667753], length 0
20:49:57.924880 IP 112.26.0.1.36395 > 112.26.0.8.47050: Flags [.], seq 49793:51221, ack 1, win 1339, options [nop,nop,TS val 141032 ecr 4294882738,mptcp dss ack 3836451400 seq 1998682033 subseq 49793 len 1428 csum 0xa115], length 1428
20:49:57.992197 IP 112.26.0.8.47050 > 112.26.0.1.36395: Flags [.], ack 42653, win 2738, options [nop,nop,TS val 4294883105 ecr 140723,mptcp dss ack 1998674893], length 0
20:49:58.013839 IP 112.26.0.8.47050 > 112.26.0.1.36395: Flags [.], ack 36941, win 2555, options [nop,nop,TS val 4294882821 ecr 140394,mptcp dss ack 1998669181], length 0
20:49:58.021924 IP 112.26.0.1.36395 > 112.26.0.8.47050: Flags [.], seq 51221:52649, ack 1, win 1339, options [nop,nop,TS val 141125 ecr 4294882821,mptcp dss ack 3836451400 seq 1998683461 subseq 51221 len 1428 csum 0x6f9a], length 1428
20:49:58.026406 IP 112.26.0.8.47050 > 112.26.0.1.36395: Flags [.], ack 44081, win 2784, options [nop,nop,TS val 4294883127 ecr 140808,mptcp dss ack 1998676321], length 0
20:49:58.092136 IP 112.26.0.1.36395 > 112.26.0.8.47050: Flags [.], seq 52649:54077, ack 1, win 1339, options [nop,nop,TS val 141125 ecr 4294882821,mptcp dss ack 3836451400 seq 1998684889 subseq 52649 len 1428 csum 0xac0e], length 1428
20:49:58.104906 IP 112.26.0.8.47050 > 112.26.0.1.36395: Flags [.], ack 45509, win 2829, options [nop,nop,TS val 4294883218 ecr 140832,mptcp dss ack 1998677749], length 0
20:49:58.114966 IP 112.26.0.8.47050 > 112.26.0.1.36395: Flags [.], ack 38369, win 2601, options [nop,nop,TS val 4294882904 ecr 140495,mptcp dss ack 1998670609], length 0
20:49:58.120082 IP 112.26.0.1.36395 > 112.26.0.8.47050: Flags [.], seq 54077:55505, ack 1, win 1339, options [nop,nop,TS val 141226 ecr 4294882904,mptcp dss ack 3836451400 seq 1998686317 subseq 54077 len 1428 csum 0xa91a], length 1428
20:49:58.130373 IP 112.26.0.8.47050 > 112.26.0.1.36395: Flags [.], ack 39797, win 2647, options [nop,nop,TS val 4294882935 ecr 140525,mptcp dss ack 1998672037], length 0
20:49:58.133699 IP 112.26.0.1.36395 > 112.26.0.8.47050: Flags [.], seq 55505:56933, ack 1, win 1339, options [nop,nop,TS val 141241 ecr 4294882935,mptcp dss ack 3836451400 seq 1998687745 subseq 55505 len 1428 csum 0xe114], length 1428
20:49:58.192690 IP 112.26.0.8.47050 > 112.26.0.1.36395: Flags [.], ack 46937, win 2875, options [nop,nop,TS val 4294883306 ecr 140832,mptcp dss ack 1998679177], length 0
20:49:58.215847 IP 112.26.0.8.47050 > 112.26.0.1.36395: Flags [.], ack 41225, win 2692, options [nop,nop,TS val 4294883019 ecr 140623,mptcp dss ack 1998673465], length 0
20:49:58.297225 IP 112.26.0.1.36395 > 112.26.0.8.47050: Flags [.], seq 56933:58361, ack 1, win 1339, options [nop,nop,TS val 141326 ecr 4294883019,mptcp dss ack 3836451400 seq 1998689173 subseq 56933 len 1428 csum 0xf69e], length 1428
20:49:58.304330 IP 112.26.0.8.47050 > 112.26.0.1.36395: Flags [.], ack 48365, win 2920, options [nop,nop,TS val 4294883399 ecr 140918,mptcp dss ack 1998680605], length 0
20:49:58.324236 IP 112.26.0.8.47050 > 112.26.0.1.36395: Flags [.], ack 42653, win 2738, options [nop,nop,TS val 4294883105 ecr 140723,mptcp dss ack 1998674893], length 0
20:49:58.325945 IP 112.26.0.1.36395 > 112.26.0.8.47050: Flags [.], seq 58361:59789, ack 1, win 1339, options [nop,nop,TS val 141435 ecr 4294883105,mptcp dss ack 3836451400 seq 1998690601 subseq 58361 len 1428 csum 0x64ac], length 1428
20:49:58.332103 IP 112.26.0.8.47050 > 112.26.0.1.36395: Flags [.], ack 49793, win 2966, options [nop,nop,TS val 4294883427 ecr 141005,mptcp dss ack 1998682033], length 0
20:49:58.390405 IP 112.26.0.1.36395 > 112.26.0.8.47050: Flags [.], seq 59789:61217, ack 1, win 1339, options [nop,nop,TS val 141435 ecr 4294883105,mptcp dss ack 3836451400 seq 1998692029 subseq 59789 len 1428 csum 0xf191], length 1428
20:49:58.400142 IP 112.26.0.8.47050 > 112.26.0.1.36395: Flags [.], ack 51221, win 3012, options [nop,nop,TS val 4294883511 ecr 141032,mptcp dss ack 1998683461], length 0
20:49:58.417036 IP 112.26.0.8.47050 > 112.26.0.1.36395: Flags [.], ack 44081, win 2784, options [nop,nop,TS val 4294883127 ecr 140808,mptcp dss ack 1998676321], length 0
20:49:58.420593 IP 112.26.0.1.36395 > 112.26.0.8.47050: Flags [.], seq 61217:62645, ack 1, win 1339, options [nop,nop,TS val 141528 ecr 4294883127,mptcp dss ack 3836451400 seq 1998693457 subseq 61217 len 1428 csum 0x7fca], length 1428
20:49:58.485308 IP 112.26.0.8.47050 > 112.26.0.1.36395: Flags [.], ack 52649, win 3057, options [nop,nop,TS val 4294883540 ecr 141125,mptcp dss ack 1998684889], length 0
20:49:58.510070 IP 112.26.0.8.47050 > 112.26.0.1.36395: Flags [.], ack 54077, win 3103, options [nop,nop,TS val 4294883619 ecr 141125,mptcp dss ack 1998686317], length 0
20:49:58.521483 IP 112.26.0.8.47050 > 112.26.0.1.36395: Flags [.], ack 45509, win 2829, options [nop,nop,TS val 4294883218 ecr 140832,mptcp dss ack 1998677749], length 0
20:49:58.522743 IP 112.26.0.1.36395 > 112.26.0.8.47050: Flags [.], seq 62645:64073, ack 1, win 1339, options [nop,nop,TS val 141632 ecr 4294883218,mptcp dss ack 3836451400 seq 1998694885 subseq 62645 len 1428 csum 0xd150], length 1428
20:49:58.584391 IP 112.26.0.8.47050 > 112.26.0.1.36395: Flags [.], ack 55505, win 3149, options [nop,nop,TS val 4294883645 ecr 141226,mptcp dss ack 1998687745], length 0
20:49:58.604002 IP 112.26.0.8.47050 > 112.26.0.1.36395: Flags [.], ack 46937, win 2875, options [nop,nop,TS val 4294883306 ecr 140832,mptcp dss ack 1998679177], length 0
20:49:58.605987 IP 112.26.0.1.36395 > 112.26.0.8.47050: Flags [.], seq 64073:65501, ack 1, win 1339, options [nop,nop,TS val 141715 ecr 4294883306,mptcp dss ack 3836451400 seq 1998696313 subseq 64073 len 1428 csum 0xabd0], length 1428
20:49:58.615192 IP 112.26.0.8.47050 > 112.26.0.1.36395: Flags [.], ack 56933, win 3194, options [nop,nop,TS val 4294883728 ecr 141241,mptcp dss ack 1998689173], length 0
20:49:58.638367 IP 112.26.0.8.47050 > 112.26.0.1.36395: Flags [.], ack 48365, win 2920, options [nop,nop,TS val 4294883399 ecr 140918,mptcp dss ack 1998680605], length 0
20:49:58.640141 IP 112.26.0.1.36395 > 112.26.0.8.47050: Flags [.], seq 65501:66929, ack 1, win 1339, options [nop,nop,TS val 141749 ecr 4294883399,mptcp dss ack 3836451400 seq 1998697741 subseq 65501 len 1428 csum 0x8ce5], length 1428
20:49:58.703073 IP 112.26.0.1.36395 > 112.26.0.8.47050: Flags [.], seq 66929:68357, ack 1, win 1339, options [nop,nop,TS val 141749 ecr 4294883399,mptcp dss ack 3836451400 seq 1998699169 subseq 66929 len 1428 csum 0x1442], length 1428
20:49:58.709928 IP 112.26.0.8.47050 > 112.26.0.1.36395: Flags [.], ack 49793, win 2966, options [nop,nop,TS val 4294883427 ecr 141005,mptcp dss ack 1998682033], length 0
20:49:58.720435 IP 112.26.0.8.47050 > 112.26.0.1.36395: Flags [.], ack 58361, win 3240, options [nop,nop,TS val 4294883831 ecr 141326,mptcp dss ack 1998690601], length 0
20:49:58.784896 IP 112.26.0.1.36395 > 112.26.0.8.47050: Flags [.], seq 68357:69785, ack 1, win 1339, options [nop,nop,TS val 141820 ecr 4294883427,mptcp dss ack 3836451400 seq 1998700597 subseq 68357 len 1428 csum 0x593a], length 1428
20:49:58.802823 IP 112.26.0.8.47050 > 112.26.0.1.36395: Flags [.], ack 51221, win 3012, options [nop,nop,TS val 4294883511 ecr 141032,mptcp dss ack 1998683461], length 0
20:49:58.804822 IP 112.26.0.1.36395 > 112.26.0.8.47050: Flags [.], seq 69785:71213, ack 1, win 1339, options [nop,nop,TS val 141913 ecr 4294883511,mptcp dss ack 3836451400 seq 1998702025 subseq 69785 len 1428 csum 0x22e9], length 1428
20:49:58.810189 IP 112.26.0.8.47050 > 112.26.0.1.36395: Flags [.], ack 59789, win 3285, options [nop,nop,TS val 4294883923 ecr 141435,mptcp dss ack 1998692029], length 0
20:49:58.827428 IP 112.26.0.8.47050 > 112.26.0.1.36395: Flags [.], ack 52649, win 3057, options [nop,nop,TS val 4294883540 ecr 141125,mptcp dss ack 1998684889], length 0
20:49:58.897294 IP 112.26.0.1.36395 > 112.26.0.8.47050: Flags [.], seq 71213:72641, ack 1, win 1339, options [nop,nop,TS val 141938 ecr 4294883540,mptcp dss ack 3836451400 seq 1998703453 subseq 71213 len 1428 csum 0x5d96], length 1428
20:49:58.903279 IP 112.26.0.8.47050 > 112.26.0.1.36395: Flags [.], ack 61217, win 3331, options [nop,nop,TS val 4294884015 ecr 141435,mptcp dss ack 1998693457], length 0
20:49:58.921165 IP 112.26.0.8.47050 > 112.26.0.1.36395: Flags [.], ack 54077, win 3103, options [nop,nop,TS val 4294883619 ecr 141125,mptcp dss ack 1998686317], length 0
20:49:58.987086 IP 112.26.0.1.36395 > 112.26.0.8.47050: Flags [.], seq 72641:74069, ack 1, win 1339, options [nop,nop,TS val 142031 ecr 4294883619,mptcp dss ack 3836451400 seq 1998704881 subseq 72641 len 1428 csum 0x8e43], length 1428
20:49:58.998896 IP 112.26.0.8.47050 > 112.26.0.1.36395: Flags [.], ack 62645, win 3377, options [nop,nop,TS val 4294884109 ecr 141528,mptcp dss ack 1998694885], length 0
20:49:59.010110 IP 112.26.0.8.47050 > 112.26.0.1.36395: Flags [.], ack 55505, win 3149, options [nop,nop,TS val 4294883645 ecr 141226,mptcp dss ack 1998687745], length 0
20:49:59.019566 IP 112.26.0.1.36395 > 112.26.0.8.47050: Flags [.], seq 74069:75497, ack 1, win 1339, options [nop,nop,TS val 142031 ecr 4294883619,mptcp dss ack 3836451400 seq 1998706309 subseq 74069 len 1428 csum 0x2da4], length 1428
20:49:59.024277 IP 112.26.0.8.47050 > 112.26.0.1.36395: Flags [.], ack 64073, win 3422, options [nop,nop,TS val 4294884137 ecr 141632,mptcp dss ack 1998696313], length 0
20:49:59.094470 IP 112.26.0.8.47050 > 112.26.0.1.36395: Flags [.], ack 56933, win 3194, options [nop,nop,TS val 4294883728 ecr 141241,mptcp dss ack 1998689173], length 0
20:49:59.103318 IP 112.26.0.1.36395 > 112.26.0.8.47050: Flags [.], seq 75497:76925, ack 1, win 1339, options [nop,nop,TS val 142120 ecr 4294883645,mptcp dss ack 3836451400 seq 1998707737 subseq 75497 len 1428 csum 0x988b], length 1428
20:49:59.109399 IP 112.26.0.8.47050 > 112.26.0.1.36395: Flags [.], ack 65501, win 3468, options [nop,nop,TS val 4294884215 ecr 141715,mptcp dss ack 1998697741], length 0
20:49:59.121788 IP 112.26.0.8.47050 > 112.26.0.1.36395: Flags [.], ack 58361, win 3240, options [nop,nop,TS val 4294883831 ecr 141326,mptcp dss ack 1998690601], length 0
20:49:59.127175 IP 112.26.0.1.36395 > 112.26.0.8.47050: Flags [.], seq 76925:78353, ack 1, win 1339, options [nop,nop,TS val 142205 ecr 4294883728,mptcp dss ack 3836451400 seq 1998709165 subseq 76925 len 1428 csum 0x2e16], length 1428
20:49:59.135124 IP 112.26.0.8.47050 > 112.26.0.1.36395: Flags [.], ack 66929, win 3514, options [nop,nop,TS val 4294884247 ecr 141749,mptcp dss ack 1998699169], length 0
20:49:59.197321 IP 112.26.0.1.36395 > 112.26.0.8.47050: Flags [.], seq 78353:79781, ack 1, win 1339, options [nop,nop,TS val 142232 ecr 4294883831,mptcp dss ack 3836451400 seq 1998710593 subseq 78353 len 1428 csum 0x6972], length 1428
20:49:59.203192 IP 112.26.0.8.47050 > 112.26.0.1.36395: Flags [.], ack 59789, win 3285, options [nop,nop,TS val 4294883923 ecr 141435,mptcp dss ack 1998692029], length 0
20:49:59.211425 IP 112.26.0.8.47050 > 112.26.0.1.36395: Flags [.], ack 68357, win 3559, options [nop,nop,TS val 4294884322 ecr 141749,mptcp dss ack 1998700597], length 0
20:49:59.224284 IP 112.26.0.1.36395 > 112.26.0.8.47050: Flags [.], seq 79781:81209, ack 1, win 1339, options [nop,nop,TS val 142314 ecr 4294883923,mptcp dss ack 3836451400 seq 1998712021 subseq 79781 len 1428 csum 0xa945], length 1428
20:49:59.298308 IP 112.26.0.8.47050 > 112.26.0.1.36395: Flags [.], ack 68357, win 3605, options [nop,nop,TS val 4294884411 ecr 141749,nop,nop,sack 1 {69785:71213},mptcp dss ack 1998700597], length 0
20:49:59.315412 IP 112.26.0.8.47050 > 112.26.0.1.36395: Flags [.], ack 61217, win 3331, options [nop,nop,TS val 4294884015 ecr 141435,mptcp dss ack 1998693457], length 0
20:49:59.317123 IP 112.26.0.1.36395 > 112.26.0.8.47050: Flags [.], seq 81209:82637, ack 1, win 1339, options [nop,nop,TS val 142426 ecr 4294884015,mptcp dss ack 3836451400 seq 1998713449 subseq 81209 len 1428 csum 0x7add], length 1428
20:49:59.332757 IP 112.26.0.8.47050 > 112.26.0.1.36395: Flags [.], ack 68357, win 3650, options [nop,nop,TS val 4294884444 ecr 141749,nop,nop,sack 1 {69785:72641},mptcp dss ack 1998700597], length 0
20:49:59.410251 IP 112.26.0.8.47050 > 112.26.0.1.36395: Flags [.], ack 62645, win 3377, options [nop,nop,TS val 4294884109 ecr 141528,mptcp dss ack 1998694885], length 0
20:49:59.411532 IP 112.26.0.1.36395 > 112.26.0.8.47050: Flags [.], seq 82637:84065, ack 1, win 1339, options [nop,nop,TS val 142521 ecr 4294884109,mptcp dss ack 3836451400 seq 1998714877 subseq 82637 len 1428 csum 0xf80c], length 1428
20:49:59.428588 IP 112.26.0.8.47050 > 112.26.0.1.36395: Flags [.], ack 68357, win 3696, options [nop,nop,TS val 4294884539 ecr 141749,nop,nop,sack 1 {69785:74069},mptcp dss ack 1998700597], length 0
20:49:59.440045 IP 112.26.0.8.47050 > 112.26.0.1.36395: Flags [.], ack 64073, win 3422, options [nop,nop,TS val 4294884137 ecr 141632,mptcp dss ack 1998696313], length 0
20:49:59.494467 IP 112.26.0.1.36395 > 112.26.0.8.47050: Flags [.], seq 84065:85493, ack 1, win 1339, options [nop,nop,TS val 142551 ecr 4294884137,mptcp dss ack 3836451400 seq 1998716305 subseq 84065 len 1428 csum 0x3db1], length 1428
20:49:59.507763 IP 112.26.0.8.47050 > 112.26.0.1.36395: Flags [.], ack 68357, win 3742, options [nop,nop,TS val 4294884620 ecr 141749,nop,nop,sack 1 {69785:75497},mptcp dss ack 1998700597], length 0
20:49:59.516930 IP 112.26.0.1.36395 > 112.26.0.8.47050: Flags [.], seq 85493:86921, ack 1, win 1339, options [nop,nop,TS val 142551 ecr 4294884137,mptcp dss ack 3836451400 seq 1998717733 subseq 85493 len 1428 csum 0xf6ac], length 1428
20:49:59.535336 IP 112.26.0.8.47050 > 112.26.0.1.36395: Flags [.], ack 65501, win 3468, options [nop,nop,TS val 4294884215 ecr 141715,mptcp dss ack 1998697741], length 0
20:49:59.600869 IP 112.26.0.8.47050 > 112.26.0.1.36395: Flags [.], ack 68357, win 3787, options [nop,nop,TS val 4294884645 ecr 141749,nop,nop,sack 1 {69785:76925},mptcp dss ack 1998700597], length 0
20:49:59.609476 IP 112.26.0.1.36395 > 112.26.0.8.47050: Flags [.], seq 86921:88349, ack 1, win 1339, options [nop,nop,TS val 142646 ecr 4294884215,mptcp dss ack 3836451400 seq 1998719161 subseq 86921 len 1428 csum 0x40c5], length 1428
20:49:59.617376 IP 112.26.0.8.47050 > 112.26.0.1.36395: Flags [.], ack 66929, win 3514, options [nop,nop,TS val 4294884247 ecr 141749,mptcp dss ack 1998699169], length 0
20:49:59.629141 IP 112.26.0.1.36395 > 112.26.0.8.47050: Flags [.], seq 88349:89777, ack 1, win 1339, options [nop,nop,TS val 142728 ecr 4294884247,mptcp dss ack 3836451400 seq 1998720589 subseq 88349 len 1428 csum 0x45af], length 1428
20:49:59.640863 IP 112.26.0.8.47050 > 112.26.0.1.36395: Flags [.], ack 68357, win 3833, options [nop,nop,TS val 4294884739 ecr 141749,nop,nop,sack 1 {69785:78353},mptcp dss ack 1998700597], length 0
20:49:59.717496 IP 112.26.0.8.47050 > 112.26.0.1.36395: Flags [.], ack 68357, win 3559, options [nop,nop,TS val 4294884322 ecr 141749,mptcp dss ack 1998700597], length 0
20:49:59.718779 IP 112.26.0.1.36395 > 112.26.0.8.47050: Flags [.], seq 89777:91205, ack 1, win 1339, options [nop,nop,TS val 142828 ecr 4294884322,mptcp dss ack 3836451400 seq 1998722017 subseq 89777 len 1428 csum 0x10ea], length 1428
20:49:59.733846 IP 112.26.0.8.47050 > 112.26.0.1.36395: Flags [.], ack 68357, win 3879, options [nop,nop,TS val 4294884821 ecr 141749,nop,nop,sack 1 {69785:79781},mptcp dss ack 1998700597], length 0
20:49:59.798247 IP 112.26.0.8.47050 > 112.26.0.1.36395: Flags [.], ack 68357, win 3924, options [nop,nop,TS val 4294884859 ecr 141749,nop,nop,sack 1 {69785:81209},mptcp dss ack 1998700597], length 0
20:49:59.805576 IP 112.26.0.8.47050 > 112.26.0.1.36395: Flags [.], ack 68357, win 3650, options [nop,nop,TS val 4294884444 ecr 141749,nop,nop,sack 1 {69785:72641},mptcp dss ack 1998700597], length 0
20:49:59.825580 IP 112.26.0.8.47050 > 112.26.0.1.36395: Flags [.], ack 68357, win 3970, options [nop,nop,TS val 4294884929 ecr 141749,nop,nop,sack 1 {69785:82637},mptcp dss ack 1998700597], length 0
20:49:59.829545 IP 112.26.0.8.47050 > 112.26.0.1.36395: Flags [.], ack 68357, win 3696, options [nop,nop,TS val 4294884539 ecr 141749,nop,nop,sack 1 {69785:74069},mptcp dss ack 1998700597], length 0
20:49:59.836716 IP 112.26.0.1.36395 > 112.26.0.8.47050: Flags [.], seq 91205:92633, ack 1, win 1339, options [nop,nop,TS val 142940 ecr 4294884444,mptcp dss ack 3836451400 seq 1998723445 subseq 91205 len 1428 csum 0x3876], length 1428
20:49:59.914296 IP 112.26.0.1.36395 > 112.26.0.8.47050: Flags [.], seq 92633:94061, ack 1, win 1339, options [nop,nop,TS val 142940 ecr 4294884444,mptcp dss ack 3836451400 seq 1998724873 subseq 92633 len 1428 csum 0xcc48], length 1428
20:49:59.918252 IP 112.26.0.8.47050 > 112.26.0.1.36395: Flags [.], ack 68357, win 4015, options [nop,nop,TS val 4294885021 ecr 141749,nop,nop,sack 1 {69785:84065},mptcp dss ack 1998700597], length 0
20:49:59.933149 IP 112.26.0.8.47050 > 112.26.0.1.36395: Flags [.], ack 68357, win 3742, options [nop,nop,TS val 4294884620 ecr 141749,nop,nop,sack 1 {69785:75497},mptcp dss ack 1998700597], length 0
20:49:59.945263 IP 112.26.0.1.36395 > 112.26.0.8.47050: Flags [.], seq 68357:69785, ack 1, win 1339, options [nop,nop,TS val 142940 ecr 4294884539,mptcp dss ack 3836451400 seq 1998700597 subseq 68357 len 1428 csum 0x593a], length 1428
20:50:00.022492 IP 112.26.0.8.47050 > 112.26.0.1.36395: Flags [.], ack 68357, win 4061, options [nop,nop,TS val 4294885126 ecr 141749,nop,nop,sack 1 {69785:85493},mptcp dss ack 1998700597], length 0
20:50:00.038413 IP 112.26.0.8.47050 > 112.26.0.1.36395: Flags [.], ack 68357, win 3787, options [nop,nop,TS val 4294884645 ecr 141749,nop,nop,sack 1 {69785:76925},mptcp dss ack 1998700597], length 0
20:50:00.040940 IP 112.26.0.1.36395 > 112.26.0.8.47050: Flags [.], seq 94061:95489, ack 1, win 1339, options [nop,nop,TS val 143149 ecr 4294884620,mptcp dss ack 3836451400 seq 1998726301 subseq 94061 len 1428 csum 0x552b], length 1428
20:50:00.107452 IP 112.26.0.8.47050 > 112.26.0.1.36395: Flags [.], ack 68357, win 4107, options [nop,nop,TS val 4294885167 ecr 141749,nop,nop,sack 1 {69785:86921},mptcp dss ack 1998700597], length 0
20:50:00.130684 IP 112.26.0.8.47050 > 112.26.0.1.36395: Flags [.], ack 68357, win 3833, options [nop,nop,TS val 4294884739 ecr 141749,nop,nop,sack 1 {69785:78353},mptcp dss ack 1998700597], length 0
20:50:00.131951 IP 112.26.0.1.36395 > 112.26.0.8.47050: Flags [.], seq 95489:96917, ack 1, win 1339, options [nop,nop,TS val 143241 ecr 4294884645,mptcp dss ack 3836451400 seq 1998727729 subseq 95489 len 1428 csum 0x769b], length 1428
20:50:00.136955 IP 112.26.0.8.47050 > 112.26.0.1.36395: Flags [.], ack 68357, win 4152, options [nop,nop,TS val 4294885231 ecr 141749,nop,nop,sack 1 {69785:88349},mptcp dss ack 1998700597], length 0
