20:50:00.349735 IP 112.26.1.8.37309 > 112.26.1.1.36395: Flags [S], seq 3631728029, win 65535, options [mss 1460,sackOK,TS val 4294885456 ecr 0,nop,wscale 6,mptcp join id 3 token 0xca9948a6 nonce 0x9628a24a], length 0
20:50:00.412398 IP 112.26.1.8.37309 > 112.26.1.1.36395: Flags [S], seq 3631728029, win 65535, options [mss 1460,sackOK,TS val 4294885456 ecr 0,nop,wscale 6,mptcp join id 3 token 0xca9948a6 nonce 0x9628a24a], length 0
20:50:00.649215 IP 112.26.1.1.36395 > 112.26.1.8.37309: Flags [S.], seq 4239519382, ack 3631728030, win 65535, options [mss 1460,sackOK,TS val 143584 ecr 4294885456,nop,wscale 6,mptcp join id 3 hmac 0x420f70e2718e0e25 nonce 0x1ef4c91c], length 0
20:50:00.649557 IP 112.26.1.8.37309 > 112.26.1.1.36395: Flags [.], ack 1, win 7118, options [nop,nop,TS val 4294885765 ecr 143584,mptcp join hmac 0x019757062a4f6cff608d92f8ab877b4267b827bf], length 0
20:50:00.746589 IP 112.26.1.8.37309 > 112.26.1.1.36395: Flags [.], ack 1, win 7118, options [nop,nop,TS val 4294885765 ecr 143584,mptcp join hmac 0x019757062a4f6cff608d92f8ab877b4267b827bf], length 0
20:50:00.757411 IP 112.26.1.1.36395 > 112.26.1.8.37309: Flags [.], ack 1, win 2678, options [nop,nop,TS val 143859 ecr 4294885765,mptcp dss ack 3836451400], length 0
20:50:00.842038 IP 112.26.1.1.36395 > 112.26.1.8.37309: Flags [.], seq 1:1429, ack 1, win 2678, options [nop,nop,TS val 143859 ecr 4294885765,mptcp dss ack 3836451400 seq 1998734869 subseq 1 len 1428 csum 0x1bdd], length 1428
20:50:00.842384 IP 112.26.1.8.37309 > 112.26.1.1.36395: Flags [.], ack 1429, win 7164, options [nop,nop,TS val 4294885958 ecr 143859,mptcp dss ack 1998720589], length 0
20:50:00.915881 IP 112.26.1.8.37309 > 112.26.1.1.36395: Flags [.], ack 1429, win 7164, options [nop,nop,TS val 4294885958 ecr 143859,mptcp dss ack 1998720589], length 0
20:50:01.101308 IP 112.26.1.1.36395 > 112.26.1.8.37309: Flags [.], seq 1429:2857, ack 1, win 2678, options [nop,nop,TS val 143859 ecr 4294885765,mptcp dss ack 3836451400 seq 1998736297 subseq 1429 len 1428 csum 0x1380], length 1428
20:50:01.101597 IP 112.26.1.8.37309 > 112.26.1.1.36395: Flags [.], ack 2857, win 7346, options [nop,nop,TS val 4294886217 ecr 143859,mptcp dss ack 1998720589], length 0
20:50:01.182957 IP 112.26.1.8.37309 > 112.26.1.1.36395: Flags [.], ack 2857, win 7346, options [nop,nop,TS val 4294886217 ecr 143859,mptcp dss ack 1998720589], length 0
20:50:01.285569 IP 112.26.1.1.36395 > 112.26.1.8.37309: Flags [.], seq 2857:4285, ack 1, win 2678, options [nop,nop,TS val 143860 ecr 4294885765,mptcp dss ack 3836451400 seq 1998737725 subseq 2857 len 1428 csum 0x1e31], length 1428
20:50:01.285929 IP 112.26.1.8.37309 > 112.26.1.1.36395: Flags [.], ack 4285, win 7574, options [nop,nop,TS val 4294886400 ecr 143860,mptcp dss ack 1998720589], length 0
20:50:01.296970 IP 112.26.1.8.37309 > 112.26.1.1.36395: Flags [.], ack 4285, win 7574, options [nop,nop,TS val 4294886400 ecr 143860,mptcp dss ack 1998720589], length 0
20:50:01.393754 IP 112.26.1.1.36395 > 112.26.1.8.37309: Flags [.], seq 4285:5713, ack 1, win 2678, options [nop,nop,TS val 143860 ecr 4294885765,mptcp dss ack 3836451400 seq 1998739153 subseq 4285 len 1428 csum 0x7758], length 1428
20:50:01.394124 IP 112.26.1.8.37309 > 112.26.1.1.36395: Flags [.], ack 5713, win 7620, options [nop,nop,TS val 4294886509 ecr 143860,mptcp dss ack 1998720589], length 0
20:50:01.556687 IP 112.26.1.8.37309 > 112.26.1.1.36395: Flags [.], ack 5713, win 7620, options [nop,nop,TS val 4294886509 ecr 143860,mptcp dss ack 1998720589], length 0
20:50:01.672369 IP 112.26.1.1.36395 > 112.26.1.8.37309: Flags [.], seq 5713:7141, ack 1, win 2678, options [nop,nop,TS val 143860 ecr 4294885765,mptcp dss ack 3836451400 seq 1998740581 subseq 5713 len 1428 csum 0xfc8b], length 1428
20:50:01.672737 IP 112.26.1.8.37309 > 112.26.1.1.36395: Flags [.], ack 7141, win 7894, options [nop,nop,TS val 4294886788 ecr 143860,mptcp dss ack 1998742009], length 0
20:50:01.676795 IP 112.26.1.8.37309 > 112.26.1.1.36395: Flags [.], ack 7141, win 7894, options [nop,nop,TS val 4294886788 ecr 143860,mptcp dss ack 1998742009], length 0
20:50:01.802976 IP 112.26.1.1.36395 > 112.26.1.8.37309: Flags [.], seq 7141:8569, ack 1, win 2678, options [nop,nop,TS val 143860 ecr 4294885765,mptcp dss ack 3836451400 seq 1998742009 subseq 7141 len 1428 csum 0x204d], length 1428
20:50:01.803370 IP 112.26.1.8.37309 > 112.26.1.1.36395: Flags [.], ack 8569, win 7985, options [nop,nop,TS val 4294886918 ecr 143860,mptcp dss ack 1998743437], length 0
20:50:01.806848 IP 112.26.1.8.37309 > 112.26.1.1.36395: Flags [.], ack 8569, win 7985, options [nop,nop,TS val 4294886918 ecr 143860,mptcp dss ack 1998743437], length 0
20:50:01.968251 IP 112.26.1.1.36395 > 112.26.1.8.37309: Flags [.], seq 8569:9997, ack 1, win 2678, options [nop,nop,TS val 143861 ecr 4294885765,mptcp dss ack 3836451400 seq 1998743437 subseq 8569 len 1428 csum 0x4ec8], length 1428
20:50:01.968501 IP 112.26.1.8.37309 > 112.26.1.1.36395: Flags [.], ack 9997, win 8213, options [nop,nop,TS val 4294887083 ecr 143861,mptcp dss ack 1998744865], length 0
20:50:02.001466 IP 112.26.1.8.37309 > 112.26.1.1.36395: Flags [.], ack 9997, win 8213, options [nop,nop,TS val 4294887083 ecr 143861,mptcp dss ack 1998744865], length 0
20:50:02.179677 IP 112.26.1.1.36395 > 112.26.1.8.37309: Flags [.], seq 9997:11425, ack 1, win 2678, options [nop,nop,TS val 143861 ecr 4294885765,mptcp dss ack 3836451400 seq 1998744865 subseq 9997 len 1428 csum 0x151], length 1428
20:50:02.180012 IP 112.26.1.8.37309 > 112.26.1.1.36395: Flags [.], ack 11425, win 8487, options [nop,nop,TS val 4294887295 ecr 143861,mptcp dss ack 1998746293], length 0
20:50:02.278940 IP 112.26.1.8.37309 > 112.26.1.1.36395: Flags [.], ack 11425, win 8487, options [nop,nop,TS val 4294887295 ecr 143861,mptcp dss ack 1998746293], length 0
20:50:02.343216 IP 112.26.1.1.36395 > 112.26.1.8.37309: Flags [.], seq 11425:12853, ack 1, win 2678, options [nop,nop,TS val 143861 ecr 4294885765,mptcp dss ack 3836451400 seq 1998746293 subseq 11425 len 1428 csum 0xef57], length 1428
20:50:02.343579 IP 112.26.1.8.37309 > 112.26.1.1.36395: Flags [.], ack 12853, win 8669, options [nop,nop,TS val 4294887458 ecr 143861,mptcp dss ack 1998747721], length 0
20:50:02.346187 IP 112.26.1.8.37309 > 112.26.1.1.36395: Flags [.], ack 12853, win 8669, options [nop,nop,TS val 4294887458 ecr 143861,mptcp dss ack 1998747721], length 0
20:50:02.506127 IP 112.26.1.1.36395 > 112.26.1.8.37309: Flags [.], seq 12853:14281, ack 1, win 2678, options [nop,nop,TS val 143861 ecr 4294885765,mptcp dss ack 3836451400 seq 1998747721 subseq 12853 len 1428 csum 0x9e20], length 1428
20:50:02.506449 IP 112.26.1.8.37309 > 112.26.1.1.36395: Flags [.], ack 14281, win 8806, options [nop,nop,TS val 4294887622 ecr 143861,mptcp dss ack 1998764857], length 0
20:50:02.515176 IP 112.26.1.8.37309 > 112.26.1.1.36395: Flags [.], ack 14281, win 8806, options [nop,nop,TS val 4294887622 ecr 143861,mptcp dss ack 1998764857], length 0
20:50:02.737954 IP 112.26.1.1.36395 > 112.26.1.8.37309: Flags [.], seq 14281:15709, ack 1, win 4017, options [nop,nop,TS val 144035 ecr 4294885958,mptcp dss ack 3836451400 seq 1998771997 subseq 14281 len 1428 csum 0xa8c2], length 1428
20:50:02.738258 IP 112.26.1.8.37309 > 112.26.1.1.36395: Flags [.], ack 15709, win 8989, options [nop,nop,TS val 4294887853 ecr 144035,mptcp dss ack 1998766285], length 0
20:50:02.833759 IP 112.26.1.8.37309 > 112.26.1.1.36395: Flags [.], ack 15709, win 8989, options [nop,nop,TS val 4294887853 ecr 144035,mptcp dss ack 1998766285], length 0
20:50:02.919918 IP 112.26.1.1.36395 > 112.26.1.8.37309: Flags [.], seq 15709:17137, ack 1, win 4017, options [nop,nop,TS val 144035 ecr 4294885958,mptcp dss ack 3836451400 seq 1998773425 subseq 15709 len 1428 csum 0xb9e1], length 1428
20:50:02.920218 IP 112.26.1.8.37309 > 112.26.1.1.36395: Flags [.], ack 17137, win 9217, options [nop,nop,TS val 4294888035 ecr 144035,mptcp dss ack 1998766285], length 0
20:50:03.039546 IP 112.26.1.8.37309 > 112.26.1.1.36395: Flags [.], ack 17137, win 9217, options [nop,nop,TS val 4294888035 ecr 144035,mptcp dss ack 1998766285], length 0
20:50:03.078788 IP 112.26.1.1.36395 > 112.26.1.8.37309: Flags [.], seq 17137:18565, ack 1, win 4017, options [nop,nop,TS val 144295 ecr 4294886217,mptcp dss ack 3836451400 seq 1998779137 subseq 17137 len 1428 csum 0xfe18], length 1428
20:50:03.079020 IP 112.26.1.8.37309 > 112.26.1.1.36395: Flags [.], ack 18565, win 9445, options [nop,nop,TS val 4294888194 ecr 144295,mptcp dss ack 1998767713], length 0
20:50:03.311410 IP 112.26.1.8.37309 > 112.26.1.1.36395: Flags [.], ack 18565, win 9445, options [nop,nop,TS val 4294888194 ecr 144295,mptcp dss ack 1998767713], length 0
20:50:03.458169 IP 112.26.1.1.36395 > 112.26.1.8.37309: Flags [.], seq 34273:35701, ack 1, win 4017, options [nop,nop,TS val 145392 ecr 4294887295,mptcp dss ack 3836451400 seq 1998831973 subseq 34273 len 1428 csum 0xd80f], length 1428
20:50:03.458401 IP 112.26.1.8.37309 > 112.26.1.1.36395: Flags [.], ack 18565, win 9810, options [nop,nop,TS val 4294888573 ecr 144295,nop,nop,sack 1 {34273:35701},mptcp dss ack 1998780565], length 0
20:50:03.563399 IP 112.26.1.1.36395 > 112.26.1.8.37309: Flags [.], seq 18565:19993, ack 1, win 4017, options [nop,nop,TS val 144295 ecr 4294886217,mptcp dss ack 3836451400 seq 1998780565 subseq 18565 len 1428 csum 0x3e86], length 1428
20:50:03.563617 IP 112.26.1.8.37309 > 112.26.1.1.36395: Flags [.], ack 19993, win 9947, options [nop,nop,TS val 4294888679 ecr 144295,nop,nop,sack 1 {34273:35701},mptcp dss ack 1998790561], length 0
20:50:03.626867 IP 112.26.1.1.36395 > 112.26.1.8.37309: Flags [.], seq 19993:21421, ack 1, win 4017, options [nop,nop,TS val 144490 ecr 4294886400,mptcp dss ack 3836451400 seq 1998793417 subseq 19993 len 1428 csum 0xef17], length 1428
20:50:03.627157 IP 112.26.1.8.37309 > 112.26.1.1.36395: Flags [.], ack 21421, win 10038, options [nop,nop,TS val 4294888742 ecr 144490,nop,nop,sack 1 {34273:35701},mptcp dss ack 1998790561], length 0
20:50:03.730963 IP 112.26.1.1.36395 > 112.26.1.8.37309: Flags [.], seq 21421:22849, ack 1, win 4017, options [nop,nop,TS val 144490 ecr 4294886400,mptcp dss ack 3836451400 seq 1998794845 subseq 21421 len 1428 csum 0x12ea], length 1428
20:50:03.731173 IP 112.26.1.8.37309 > 112.26.1.1.36395: Flags [.], ack 22849, win 10175, options [nop,nop,TS val 4294888846 ecr 144490,nop,nop,sack 1 {34273:35701},mptcp dss ack 1998790561], length 0
20:50:03.936843 IP 112.26.1.8.37309 > 112.26.1.1.36395: Flags [.], ack 18565, win 9810, options [nop,nop,TS val 4294888573 ecr 144295,nop,nop,sack 1 {34273:35701},mptcp dss ack 1998780565], length 0
20:50:04.068008 IP 112.26.1.1.36395 > 112.26.1.8.37309: Flags [.], seq 22849:24277, ack 1, win 4017, options [nop,nop,TS val 144688 ecr 4294886509,mptcp dss ack 3836451400 seq 1998800557 subseq 22849 len 1428 csum 0xb1d3], length 1428
20:50:04.068226 IP 112.26.1.8.37309 > 112.26.1.1.36395: Flags [.], ack 24277, win 10540, options [nop,nop,TS val 4294889183 ecr 144688,nop,nop,sack 1 {34273:35701},mptcp dss ack 1998790561], length 0
20:50:04.174115 IP 112.26.1.8.37309 > 112.26.1.1.36395: Flags [.], ack 19993, win 9947, options [nop,nop,TS val 4294888679 ecr 144295,nop,nop,sack 1 {34273:35701},mptcp dss ack 1998790561], length 0
20:50:04.289316 IP 112.26.1.1.36395 > 112.26.1.8.37309: Flags [.], seq 24277:25705, ack 1, win 4017, options [nop,nop,TS val 144688 ecr 4294886509,mptcp dss ack 3836451400 seq 1998801985 subseq 24277 len 1428 csum 0x75f4], length 1428
20:50:04.289587 IP 112.26.1.8.37309 > 112.26.1.1.36395: Flags [.], ack 25705, win 10859, options [nop,nop,TS val 4294889404 ecr 144688,nop,nop,sack 1 {34273:35701},mptcp dss ack 1998790561], length 0
20:50:04.362764 IP 112.26.1.8.37309 > 112.26.1.1.36395: Flags [.], ack 21421, win 10038, options [nop,nop,TS val 4294888742 ecr 144490,nop,nop,sack 1 {34273:35701},mptcp dss ack 1998790561], length 0
20:50:04.510001 IP 112.26.1.1.36395 > 112.26.1.8.37309: Flags [.], seq 35701:37129, ack 1, win 4017, options [nop,nop,TS val 145392 ecr 4294887295,mptcp dss ack 3836451400 seq 1998833401 subseq 35701 len 1428 csum 0xb55a], length 1428
20:50:04.510216 IP 112.26.1.8.37309 > 112.26.1.1.36395: Flags [.], ack 25705, win 11087, options [nop,nop,TS val 4294889625 ecr 144688,nop,nop,sack 1 {34273:37129},mptcp dss ack 1998790561], length 0
20:50:04.638901 IP 112.26.1.8.37309 > 112.26.1.1.36395: Flags [.], ack 22849, win 10175, options [nop,nop,TS val 4294888846 ecr 144490,nop,nop,sack 1 {34273:35701},mptcp dss ack 1998790561], length 0
20:50:04.702694 IP 112.26.1.1.36395 > 112.26.1.8.37309: Flags [.], seq 28561:29989, ack 1, win 4017, options [nop,nop,TS val 144986 ecr 4294886918,mptcp dss ack 3836451400 seq 1998813409 subseq 28561 len 1428 csum 0x3e0b], length 1428
20:50:04.702883 IP 112.26.1.8.37309 > 112.26.1.1.36395: Flags [.], ack 25705, win 11270, options [nop,nop,TS val 4294889818 ecr 144688,nop,nop,sack 2 {28561:29989}{34273:37129},mptcp dss ack 1998790561], length 0
20:50:04.782574 IP 112.26.1.1.36395 > 112.26.1.8.37309: Flags [.], seq 31417:32845, ack 1, win 4017, options [nop,nop,TS val 145165 ecr 4294887083,mptcp dss ack 3836451400 seq 1998821977 subseq 31417 len 1428 csum 0xe563], length 1428
20:50:04.782780 IP 112.26.1.8.37309 > 112.26.1.1.36395: Flags [.], ack 25705, win 11407, options [nop,nop,TS val 4294889898 ecr 144688,nop,nop,sack 2 {31417:32845}{28561:29989},mptcp dss ack 1998790561], length 0
20:50:04.913535 IP 112.26.1.8.37309 > 112.26.1.1.36395: Flags [.], ack 24277, win 10540, options [nop,nop,TS val 4294889183 ecr 144688,nop,nop,sack 1 {34273:35701},mptcp dss ack 1998790561], length 0
20:50:05.005876 IP 112.26.1.1.36395 > 112.26.1.8.37309: Flags [.], seq 39985:41413, ack 1, win 4017, options [nop,nop,TS val 145657 ecr 4294887622,mptcp dss ack 3836451400 seq 1998844825 subseq 39985 len 1428 csum 0x9073], length 1428
20:50:05.006118 IP 112.26.1.8.37309 > 112.26.1.1.36395: Flags [.], ack 25705, win 11635, options [nop,nop,TS val 4294890121 ecr 144688,nop,nop,sack 2 {39985:41413}{31417:32845},mptcp dss ack 1998790561], length 0
20:50:05.086341 IP 112.26.1.8.37309 > 112.26.1.1.36395: Flags [.], ack 25705, win 10859, options [nop,nop,TS val 4294889404 ecr 144688,nop,nop,sack 1 {34273:35701},mptcp dss ack 1998790561], length 0
20:50:05.129610 IP 112.26.1.1.36395 > 112.26.1.8.37309: Flags [.], seq 41413:42841, ack 1, win 4017, options [nop,nop,TS val 145657 ecr 4294887622,mptcp dss ack 3836451400 seq 1998846253 subseq 41413 len 1428 csum 0xe575], length 1428
20:50:05.129819 IP 112.26.1.8.37309 > 112.26.1.1.36395: Flags [.], ack 25705, win 11772, options [nop,nop,TS val 4294890245 ecr 144688,nop,nop,sack 2 {39985:42841}{31417:32845},mptcp dss ack 1998790561], length 0
20:50:05.218147 IP 112.26.1.1.36395 > 112.26.1.8.37309: Flags [.], seq 42841:44269, ack 1, win 4017, options [nop,nop,TS val 145946 ecr 4294887853,mptcp dss ack 3836451400 seq 1998859105 subseq 42841 len 1428 csum 0xc317], length 1428
20:50:05.218355 IP 112.26.1.8.37309 > 112.26.1.1.36395: Flags [.], ack 25705, win 11909, options [nop,nop,TS val 4294890333 ecr 144688,nop,nop,sack 2 {39985:44269}{31417:32845},mptcp dss ack 1998790561], length 0
20:50:05.338468 IP 112.26.1.8.37309 > 112.26.1.1.36395: Flags [.], ack 25705, win 11087, options [nop,nop,TS val 4294889625 ecr 144688,nop,nop,sack 1 {34273:37129},mptcp dss ack 1998790561], length 0
20:50:05.423143 IP 112.26.1.1.36395 > 112.26.1.8.37309: Flags [.], seq 44269:45697, ack 1, win 4017, options [nop,nop,TS val 145946 ecr 4294887853,mptcp dss ack 3836451400 seq 1998860533 subseq 44269 len 1428 csum 0x9ab0], length 1428
20:50:05.423348 IP 112.26.1.8.37309 > 112.26.1.1.36395: Flags [.], ack 25705, win 12137, options [nop,nop,TS val 4294890538 ecr 144688,nop,nop,sack 2 {39985:45697}{31417:32845},mptcp dss ack 1998806269], length 0
20:50:05.467483 IP 112.26.1.1.36395 > 112.26.1.8.37309: Flags [.], seq 45697:47125, ack 1, win 4017, options [nop,nop,TS val 146539 ecr 4294888035,mptcp dss ack 3836451400 seq 1998876241 subseq 45697 len 1428 csum 0x6b59], length 1428
20:50:05.467685 IP 112.26.1.8.37309 > 112.26.1.1.36395: Flags [.], ack 25705, win 12182, options [nop,nop,TS val 4294890583 ecr 144688,nop,nop,sack 2 {39985:47125}{31417:32845},mptcp dss ack 1998806269], length 0
20:50:05.568334 IP 112.26.1.8.37309 > 112.26.1.1.36395: Flags [.], ack 25705, win 11270, options [nop,nop,TS val 4294889818 ecr 144688,nop,nop,sack 2 {28561:29989}{34273:37129},mptcp dss ack 1998790561], length 0
20:50:05.628372 IP 112.26.1.8.37309 > 112.26.1.1.36395: Flags [.], ack 25705, win 11407, options [nop,nop,TS val 4294889898 ecr 144688,nop,nop,sack 2 {31417:32845}{28561:29989},mptcp dss ack 1998790561], length 0
20:50:05.699977 IP 112.26.1.1.36395 > 112.26.1.8.37309: Flags [.], seq 47125:48553, ack 1, win 4017, options [nop,nop,TS val 146539 ecr 4294888035,mptcp dss ack 3836451400 seq 1998877669 subseq 47125 len 1428 csum 0xfab], length 1428
20:50:05.700190 IP 112.26.1.8.37309 > 112.26.1.1.36395: Flags [.], ack 25705, win 12319, options [nop,nop,TS val 4294890815 ecr 144688,nop,nop,sack 2 {39985:48553}{31417:32845},mptcp dss ack 1998806269], length 0
20:50:05.797131 IP 112.26.1.1.36395 > 112.26.1.8.37309: Flags [.], seq 48553:49981, ack 1, win 4017, options [nop,nop,TS val 147056 ecr 4294888194,mptcp dss ack 3836451400 seq 1998894805 subseq 48553 len 1428 csum 0x230d], length 1428
20:50:05.797331 IP 112.26.1.8.37309 > 112.26.1.1.36395: Flags [.], ack 25705, win 12456, options [nop,nop,TS val 4294890912 ecr 144688,nop,nop,sack 2 {39985:49981}{31417:32845},mptcp dss ack 1998806269], length 0
20:50:05.904128 IP 112.26.1.8.37309 > 112.26.1.1.36395: Flags [.], ack 25705, win 11772, options [nop,nop,TS val 4294890245 ecr 144688,nop,nop,sack 2 {39985:42841}{31417:32845},mptcp dss ack 1998790561], length 0
20:50:05.959553 IP 112.26.1.8.37309 > 112.26.1.1.36395: Flags [.], ack 25705, win 11909, options [nop,nop,TS val 4294890333 ecr 144688,nop,nop,sack 2 {39985:44269}{31417:32845},mptcp dss ack 1998790561], length 0
20:50:06.025799 IP 112.26.1.8.37309 > 112.26.1.1.36395: Flags [.], ack 25705, win 12137, options [nop,nop,TS val 4294890538 ecr 144688,nop,nop,sack 2 {39985:45697}{31417:32845},mptcp dss ack 1998806269], length 0
20:50:06.131964 IP 112.26.1.8.37309 > 112.26.1.1.36395: Flags [.], ack 25705, win 12182, options [nop,nop,TS val 4294890583 ecr 144688,nop,nop,sack 2 {39985:47125}{31417:32845},mptcp dss ack 1998806269], length 0
20:50:06.192116 IP 112.26.1.1.36395 > 112.26.1.8.37309: Flags [.], seq 18565:19993, ack 1, win 4017, options [nop,nop,TS val 147851 ecr 4294888573,mptcp dss ack 3836451400 seq 1998780565 subseq 18565 len 1428 csum 0x3e86], length 1428
20:50:06.192302 IP 112.26.1.8.37309 > 112.26.1.1.36395: Flags [.], ack 25705, win 12821, options [nop,nop,TS val 4294891307 ecr 144688,nop,nop,sack 2 {18565:19993}{39985:49981},mptcp dss ack 1998806269], length 0
20:50:06.302120 IP 112.26.1.8.37309 > 112.26.1.1.36395: Flags [.], ack 25705, win 12319, options [nop,nop,TS val 4294890815 ecr 144688,nop,nop,sack 2 {39985:48553}{31417:32845},mptcp dss ack 1998806269], length 0
20:50:06.357504 IP 112.26.1.8.37309 > 112.26.1.1.36395: Flags [.], ack 25705, win 12456, options [nop,nop,TS val 4294890912 ecr 144688,nop,nop,sack 2 {39985:49981}{31417:32845},mptcp dss ack 1998806269], length 0
20:50:06.435244 IP 112.26.1.1.36395 > 112.26.1.8.37309: Flags [.], seq 51409:52837, ack 1, win 4017, options [nop,nop,TS val 148173 ecr 4294888679,mptcp dss ack 3836451400 seq 1998937645 subseq 51409 len 1428 csum 0xb56], length 1428
20:50:06.435441 IP 112.26.1.8.37309 > 112.26.1.1.36395: Flags [.], ack 25705, win 13049, options [nop,nop,TS val 4294891551 ecr 144688,nop,nop,sack 2 {51409:52837}{39985:49981},mptcp dss ack 1998806269], length 0
20:50:06.490914 IP 112.26.1.1.36395 > 112.26.1.8.37309: Flags [.], seq 52837:54265, ack 1, win 4017, options [nop,nop,TS val 148173 ecr 4294888679,mptcp dss ack 3836451400 seq 1998939073 subseq 52837 len 1428 csum 0x89e2], length 1428
20:50:06.491132 IP 112.26.1.8.37309 > 112.26.1.1.36395: Flags [.], ack 25705, win 13186, options [nop,nop,TS val 4294891606 ecr 144688,nop,nop,sack 2 {51409:54265}{39985:49981},mptcp dss ack 1998806269], length 0
20:50:06.702989 IP 112.26.1.1.36395 > 112.26.1.8.37309: Flags [.], seq 54265:55693, ack 1, win 4017, options [nop,nop,TS val 148173 ecr 4294888679,mptcp dss ack 3836451400 seq 1998940501 subseq 54265 len 1428 csum 0x1720], length 1428
20:50:06.703220 IP 112.26.1.8.37309 > 112.26.1.1.36395: Flags [.], ack 25705, win 13414, options [nop,nop,TS val 4294891818 ecr 144688,nop,nop,sack 2 {51409:55693}{39985:49981},mptcp dss ack 1998806269], length 0
20:50:06.858738 IP 112.26.1.8.37309 > 112.26.1.1.36395: Flags [.], ack 25705, win 12821, options [nop,nop,TS val 4294891307 ecr 144688,nop,nop,sack 2 {18565:19993}{39985:49981},mptcp dss ack 1998806269], length 0
20:50:06.911947 IP 112.26.1.1.36395 > 112.26.1.8.37309: Flags [.], seq 57121:58549, ack 1, win 4017, options [nop,nop,TS val 148274 ecr 4294888742,mptcp dss ack 3836451400 seq 1998947641 subseq 57121 len 1428 csum 0x63aa], length 1428
20:50:06.912187 IP 112.26.1.8.37309 > 112.26.1.1.36395: Flags [.], ack 25705, win 13642, options [nop,nop,TS val 4294892027 ecr 144688,nop,nop,sack 2 {57121:58549}{51409:55693},mptcp dss ack 1998806269], length 0
20:50:06.984444 IP 112.26.1.8.37309 > 112.26.1.1.36395: Flags [.], ack 25705, win 13049, options [nop,nop,TS val 4294891551 ecr 144688,nop,nop,sack 2 {51409:52837}{39985:49981},mptcp dss ack 1998806269], length 0
20:50:07.055584 IP 112.26.1.8.37309 > 112.26.1.1.36395: Flags [.], ack 25705, win 13186, options [nop,nop,TS val 4294891606 ecr 144688,nop,nop,sack 2 {51409:54265}{39985:49981},mptcp dss ack 1998806269], length 0
20:50:07.114784 IP 112.26.1.1.36395 > 112.26.1.8.37309: Flags [.], seq 61405:62833, ack 1, win 4017, options [nop,nop,TS val 148774 ecr 4294889183,mptcp dss ack 3836451400 seq 1998973345 subseq 61405 len 1428 csum 0xf0a4], length 1428
20:50:07.114995 IP 112.26.1.8.37309 > 112.26.1.1.36395: Flags [.], ack 25705, win 13870, options [nop,nop,TS val 4294892230 ecr 144688,nop,nop,sack 2 {61405:62833}{57121:58549},mptcp dss ack 1998806269], length 0
20:50:07.199668 IP 112.26.1.1.36395 > 112.26.1.8.37309: Flags [.], seq 62833:64261, ack 1, win 4017, options [nop,nop,TS val 148774 ecr 4294889183,mptcp dss ack 3836451400 seq 1998974773 subseq 62833 len 1428 csum 0x2222], length 1428
20:50:07.199900 IP 112.26.1.8.37309 > 112.26.1.1.36395: Flags [.], ack 25705, win 14007, options [nop,nop,TS val 4294892315 ecr 144688,nop,nop,sack 2 {61405:64261}{57121:58549},mptcp dss ack 1998806269], length 0
20:50:07.284413 IP 112.26.1.8.37309 > 112.26.1.1.36395: Flags [.], ack 25705, win 13414, options [nop,nop,TS val 4294891818 ecr 144688,nop,nop,sack 2 {51409:55693}{39985:49981},mptcp dss ack 1998806269], length 0
20:50:07.385316 IP 112.26.1.8.37309 > 112.26.1.1.36395: Flags [.], ack 25705, win 13642, options [nop,nop,TS val 4294892027 ecr 144688,nop,nop,sack 2 {57121:58549}{51409:55693},mptcp dss ack 1998806269], length 0
20:50:07.442122 IP 112.26.1.8.37309 > 112.26.1.1.36395: Flags [.], ack 25705, win 13870, options [nop,nop,TS val 4294892230 ecr 144688,nop,nop,sack 2 {61405:62833}{57121:58549},mptcp dss ack 1998806269], length 0
20:50:07.519450 IP 112.26.1.8.37309 > 112.26.1.1.36395: Flags [.], ack 25705, win 14007, options [nop,nop,TS val 4294892315 ecr 144688,nop,nop,sack 2 {61405:64261}{57121:58549},mptcp dss ack 1998806269], length 0
20:50:07.549175 IP 112.26.1.1.36395 > 112.26.1.8.37309: Flags [.], seq 67117:68545, ack 1, win 4017, options [nop,nop,TS val 149488 ecr 4294889625,mptcp dss ack 3836451400 seq 1999000477 subseq 67117 len 1428 csum 0xa3a4], length 1428
20:50:07.549384 IP 112.26.1.8.37309 > 112.26.1.1.36395: Flags [.], ack 25705, win 14372, options [nop,nop,TS val 4294892664 ecr 144688,nop,nop,sack 2 {67117:68545}{61405:64261},mptcp dss ack 1998806269], length 0
20:50:07.639222 IP 112.26.1.1.36395 > 112.26.1.8.37309: Flags [.], seq 69973:71401, ack 1, win 4017, options [nop,nop,TS val 149627 ecr 4294889818,mptcp dss ack 3836451400 seq 1999009045 subseq 69973 len 1428 csum 0x510d], length 1428
20:50:07.639446 IP 112.26.1.8.37309 > 112.26.1.1.36395: Flags [.], ack 25705, win 14555, options [nop,nop,TS val 4294892754 ecr 144688,nop,nop,sack 2 {69973:71401}{67117:68545},mptcp dss ack 1998806269], length 0
20:50:07.721392 IP 112.26.1.1.36395 > 112.26.1.8.37309: Flags [.], seq 71401:72829, ack 1, win 4017, options [nop,nop,TS val 149886 ecr 4294890245,mptcp dss ack 3836451400 seq 1999014757 subseq 71401 len 1428 csum 0xc745], length 1428
20:50:07.721633 IP 112.26.1.8.37309 > 112.26.1.1.36395: Flags [.], ack 25705, win 14692, options [nop,nop,TS val 4294892836 ecr 144688,nop,nop,sack 2 {69973:72829}{67117:68545},mptcp dss ack 1998806269], length 0
20:50:07.779675 IP 112.26.1.8.37309 > 112.26.1.1.36395: Flags [.], ack 25705, win 14372, options [nop,nop,TS val 4294892664 ecr 144688,nop,nop,sack 2 {67117:68545}{61405:64261},mptcp dss ack 1998806269], length 0
20:50:07.818888 IP 112.26.1.1.36395 > 112.26.1.8.37309: Flags [.], seq 72829:74257, ack 1, win 4017, options [nop,nop,TS val 149886 ecr 4294890245,mptcp dss ack 3836451400 seq 1999016185 subseq 72829 len 1428 csum 0xb610], length 1428
20:50:07.819204 IP 112.26.1.8.37309 > 112.26.1.1.36395: Flags [.], ack 25705, win 14783, options [nop,nop,TS val 4294892934 ecr 144688,nop,nop,sack 2 {69973:74257}{67117:68545},mptcp dss ack 1998806269], length 0
20:50:07.923746 IP 112.26.1.1.36395 > 112.26.1.8.37309: Flags [.], seq 74257:75685, ack 1, win 4017, options [nop,nop,TS val 149886 ecr 4294890245,mptcp dss ack 3836451400 seq 1999017613 subseq 74257 len 1428 csum 0x7b2b], length 1428
20:50:07.923957 IP 112.26.1.8.37309 > 112.26.1.1.36395: Flags [.], ack 25705, win 14920, options [nop,nop,TS val 4294893039 ecr 144688,nop,nop,sack 2 {69973:75685}{67117:68545},mptcp dss ack 1998806269], length 0
20:50:08.029317 IP 112.26.1.8.37309 > 112.26.1.1.36395: Flags [.], ack 25705, win 14555, options [nop,nop,TS val 4294892754 ecr 144688,nop,nop,sack 2 {69973:71401}{67117:68545},mptcp dss ack 1998806269], length 0
20:50:08.068541 IP 112.26.1.8.37309 > 112.26.1.1.36395: Flags [.], ack 25705, win 14692, options [nop,nop,TS val 4294892836 ecr 144688,nop,nop,sack 2 {69973:72829}{67117:68545},mptcp dss ack 1998806269], length 0
20:50:08.180342 IP 112.26.1.8.37309 > 112.26.1.1.36395: Flags [.], ack 25705, win 14783, options [nop,nop,TS val 4294892934 ecr 144688,nop,nop,sack 2 {69973:74257}{67117:68545},mptcp dss ack 1998806269], length 0
20:50:08.252683 IP 112.26.1.1.36395 > 112.26.1.8.37309: Flags [.], seq 75685:77113, ack 1, win 4017, options [nop,nop,TS val 149997 ecr 4294890333,mptcp dss ack 3836451400 seq 1999020469 subseq 75685 len 1428 csum 0x91e5], length 1428
20:50:08.252878 IP 112.26.1.8.37309 > 112.26.1.1.36395: Flags [.], ack 25705, win 15330, options [nop,nop,TS val 4294893368 ecr 144688,nop,nop,sack 2 {69973:77113}{67117:68545},mptcp dss ack 1998806269], length 0
20:50:08.338466 IP 112.26.1.8.37309 > 112.26.1.1.36395: Flags [.], ack 25705, win 14920, options [nop,nop,TS val 4294893039 ecr 144688,nop,nop,sack 2 {69973:75685}{67117:68545},mptcp dss ack 1998806269], length 0
20:50:08.397633 IP 112.26.1.1.36395 > 112.26.1.8.37309: Flags [.], seq 79969:81397, ack 1, win 4017, options [nop,nop,TS val 150253 ecr 4294890815,mptcp dss ack 3836451400 seq 1999031893 subseq 79969 len 1428 csum 0x2541], length 1428
20:50:08.397848 IP 112.26.1.8.37309 > 112.26.1.1.36395: Flags [.], ack 25705, win 15513, options [nop,nop,TS val 4294893513 ecr 144688,nop,nop,sack 2 {79969:81397}{69973:77113},mptcp dss ack 1998806269], length 0
20:50:08.486798 IP 112.26.1.1.36395 > 112.26.1.8.37309: Flags [.], seq 81397:82825, ack 1, win 4017, options [nop,nop,TS val 150299 ecr 4294890912,mptcp dss ack 3836451400 seq 1999033321 subseq 81397 len 1428 csum 0x1cfd], length 1428
20:50:08.486996 IP 112.26.1.8.37309 > 112.26.1.1.36395: Flags [.], ack 25705, win 15559, options [nop,nop,TS val 4294893602 ecr 144688,nop,nop,sack 2 {79969:82825}{69973:77113},mptcp dss ack 1998806269], length 0
20:50:08.569670 IP 112.26.1.8.37309 > 112.26.1.1.36395: Flags [.], ack 25705, win 15330, options [nop,nop,TS val 4294893368 ecr 144688,nop,nop,sack 2 {69973:77113}{67117:68545},mptcp dss ack 1998806269], length 0
20:50:08.614192 IP 112.26.1.8.37309 > 112.26.1.1.36395: Flags [.], ack 25705, win 15513, options [nop,nop,TS val 4294893513 ecr 144688,nop,nop,sack 2 {79969:81397}{69973:77113},mptcp dss ack 1998806269], length 0
20:50:08.702030 IP 112.26.1.1.36395 > 112.26.1.8.37309: Flags [.], seq 25705:27133, ack 1, win 4017, options [nop,nop,TS val 150852 ecr 4294891551,mptcp dss ack 3836451400 seq 1998806269 subseq 25705 len 1428 csum 0xf655], length 1428
20:50:08.702269 IP 112.26.1.8.37309 > 112.26.1.1.36395: Flags [.], ack 27133, win 15832, options [nop,nop,TS val 4294893817 ecr 150852,nop,nop,sack 2 {79969:82825}{69973:77113},mptcp dss ack 1998807697], length 0
20:50:08.777912 IP 112.26.1.8.37309 > 112.26.1.1.36395: Flags [.], ack 25705, win 15559, options [nop,nop,TS val 4294893602 ecr 144688,nop,nop,sack 2 {79969:82825}{69973:77113},mptcp dss ack 1998806269], length 0
20:50:08.802024 IP 112.26.1.1.36395 > 112.26.1.8.37309: Flags [.], seq 27133:28561, ack 1, win 4017, options [nop,nop,TS val 151012 ecr 4294891606,mptcp dss ack 3836451400 seq 1998807697 subseq 27133 len 1428 csum 0x760e], length 1428
20:50:08.802235 IP 112.26.1.8.37309 > 112.26.1.1.36395: Flags [.], ack 29989, win 16015, options [nop,nop,TS val 4294893917 ecr 151012,nop,nop,sack 2 {79969:82825}{69973:77113},mptcp dss ack 1998814837], length 0
20:50:08.900688 IP 112.26.1.8.37309 > 112.26.1.1.36395: Flags [.], ack 27133, win 15832, options [nop,nop,TS val 4294893817 ecr 150852,nop,nop,sack 2 {79969:82825}{69973:77113},mptcp dss ack 1998807697], length 0
20:50:08.950475 IP 112.26.1.8.37309 > 112.26.1.1.36395: Flags [.], ack 29989, win 16015, options [nop,nop,TS val 4294893917 ecr 151012,nop,nop,sack 2 {79969:82825}{69973:77113},mptcp dss ack 1998814837], length 0
20:50:09.053017 IP 112.26.1.1.36395 > 112.26.1.8.37309: Flags [.], seq 29989:31417, ack 1, win 4017, options [nop,nop,TS val 151312 ecr 4294892230,mptcp dss ack 3836451400 seq 1998814837 subseq 29989 len 1428 csum 0x6f08], length 1428
20:50:09.053234 IP 112.26.1.8.37309 > 112.26.1.1.36395: Flags [.], ack 32845, win 16289, options [nop,nop,TS val 4294894168 ecr 151312,nop,nop,sack 2 {79969:82825}{69973:77113},mptcp dss ack 1998823405], length 0
20:50:09.134479 IP 112.26.1.8.37309 > 112.26.1.1.36395: Flags [.], ack 32845, win 16289, options [nop,nop,TS val 4294894168 ecr 151312,nop,nop,sack 2 {79969:82825}{69973:77113},mptcp dss ack 1998823405], length 0
20:50:09.215328 IP 112.26.1.1.36395 > 112.26.1.8.37309: Flags [.], seq 32845:34273, ack 1, win 4017, options [nop,nop,TS val 151353 ecr 4294892315,mptcp dss ack 3836451400 seq 1998823405 subseq 32845 len 1428 csum 0x5ca2], length 1428
20:50:09.215569 IP 112.26.1.8.37309 > 112.26.1.1.36395: Flags [.], ack 37129, win 16517, options [nop,nop,TS val 4294894330 ecr 151353,nop,nop,sack 2 {79969:82825}{69973:77113},mptcp dss ack 1998839113], length 0
20:50:09.280237 IP 112.26.1.8.37309 > 112.26.1.1.36395: Flags [.], ack 37129, win 16517, options [nop,nop,TS val 4294894330 ecr 151353,nop,nop,sack 2 {79969:82825}{69973:77113},mptcp dss ack 1998839113], length 0
20:50:09.434302 IP 112.26.1.1.36395 > 112.26.1.8.37309: Flags [.], seq 37129:38557, ack 1, win 4017, options [nop,nop,TS val 151616 ecr 4294892664,mptcp dss ack 3836451400 seq 1998839113 subseq 37129 len 1428 csum 0xdefb], length 1428
20:50:09.434495 IP 112.26.1.8.37309 > 112.26.1.1.36395: Flags [.], ack 38557, win 16790, options [nop,nop,TS val 4294894549 ecr 151616,nop,nop,sack 2 {79969:82825}{69973:77113},mptcp dss ack 1998840541], length 0
20:50:09.538833 IP 112.26.1.8.37309 > 112.26.1.1.36395: Flags [.], ack 38557, win 16790, options [nop,nop,TS val 4294894549 ecr 151616,nop,nop,sack 2 {79969:82825}{69973:77113},mptcp dss ack 1998840541], length 0
20:50:09.612119 IP 112.26.1.1.36395 > 112.26.1.8.37309: Flags [.], seq 38557:39985, ack 1, win 4017, options [nop,nop,TS val 151853 ecr 4294892754,mptcp dss ack 3836451400 seq 1998840541 subseq 38557 len 1428 csum 0xe2ee], length 1428
20:50:09.612368 IP 112.26.1.8.37309 > 112.26.1.1.36395: Flags [.], ack 49981, win 16973, options [nop,nop,TS val 4294894727 ecr 151853,nop,nop,sack 2 {79969:82825}{69973:77113},mptcp dss ack 1998896233], length 0
20:50:09.718433 IP 112.26.1.8.37309 > 112.26.1.1.36395: Flags [.], ack 49981, win 16973, options [nop,nop,TS val 4294894727 ecr 151853,nop,nop,sack 2 {79969:82825}{69973:77113},mptcp dss ack 1998896233], length 0
20:50:09.783614 IP 112.26.1.1.36395 > 112.26.1.8.37309: Flags [.], seq 49981:51409, ack 1, win 4017, options [nop,nop,TS val 151947 ecr 4294892836,mptcp dss ack 3836451400 seq 1998896233 subseq 49981 len 1428 csum 0xc837], length 1428
20:50:09.783831 IP 112.26.1.8.37309 > 112.26.1.1.36395: Flags [.], ack 55693, win 17201, options [nop,nop,TS val 4294894898 ecr 151947,nop,nop,sack 2 {79969:82825}{69973:77113},mptcp dss ack 1998909085], length 0
20:50:09.862512 IP 112.26.1.8.37309 > 112.26.1.1.36395: Flags [.], ack 55693, win 17201, options [nop,nop,TS val 4294894898 ecr 151947,nop,nop,sack 2 {79969:82825}{69973:77113},mptcp dss ack 1998909085], length 0
20:50:09.925610 IP 112.26.1.1.36395 > 112.26.1.8.37309: Flags [.], seq 55693:57121, ack 1, win 4017, options [nop,nop,TS val 152079 ecr 4294892934,mptcp dss ack 3836451400 seq 1998946213 subseq 55693 len 1428 csum 0x2084], length 1428
20:50:09.925808 IP 112.26.1.8.37309 > 112.26.1.1.36395: Flags [.], ack 58549, win 17384, options [nop,nop,TS val 4294895040 ecr 152079,nop,nop,sack 2 {79969:82825}{69973:77113},mptcp dss ack 1998909085], length 0
20:50:10.000467 IP 112.26.1.8.37309 > 112.26.1.1.36395: Flags [.], ack 58549, win 17384, options [nop,nop,TS val 4294895040 ecr 152079,nop,nop,sack 2 {79969:82825}{69973:77113},mptcp dss ack 1998909085], length 0
20:50:10.119333 IP 112.26.1.1.36395 > 112.26.1.8.37309: Flags [.], seq 58549:59977, ack 1, win 4017, options [nop,nop,TS val 152488 ecr 4294893368,mptcp dss ack 3836451400 seq 1998949069 subseq 58549 len 1428 csum 0xeb61], length 1428
20:50:10.119568 IP 112.26.1.8.37309 > 112.26.1.1.36395: Flags [.], ack 59977, win 17612, options [nop,nop,TS val 4294895234 ecr 152488,nop,nop,sack 2 {79969:82825}{69973:77113},mptcp dss ack 1998909085], length 0
20:50:10.178940 IP 112.26.1.8.37309 > 112.26.1.1.36395: Flags [.], ack 59977, win 17612, options [nop,nop,TS val 4294895234 ecr 152488,nop,nop,sack 2 {79969:82825}{69973:77113},mptcp dss ack 1998909085], length 0
20:50:10.248560 IP 112.26.1.1.36395 > 112.26.1.8.37309: Flags [.], seq 59977:61405, ack 1, win 4017, options [nop,nop,TS val 152488 ecr 4294893368,mptcp dss ack 3836451400 seq 1998950497 subseq 59977 len 1428 csum 0x935e], length 1428
20:50:10.248802 IP 112.26.1.8.37309 > 112.26.1.1.36395: Flags [.], ack 64261, win 17794, options [nop,nop,TS val 4294895364 ecr 152488,nop,nop,sack 2 {79969:82825}{69973:77113},mptcp dss ack 1998909085], length 0
20:50:10.324675 IP 112.26.1.8.37309 > 112.26.1.1.36395: Flags [.], ack 64261, win 17794, options [nop,nop,TS val 4294895364 ecr 152488,nop,nop,sack 2 {79969:82825}{69973:77113},mptcp dss ack 1998909085], length 0
20:50:10.504663 IP 112.26.1.1.36395 > 112.26.1.8.37309: Flags [.], seq 64261:65689, ack 1, win 4017, options [nop,nop,TS val 152856 ecr 4294893917,mptcp dss ack 3836451400 seq 1998983341 subseq 64261 len 1428 csum 0x8559], length 1428
20:50:10.504892 IP 112.26.1.8.37309 > 112.26.1.1.36395: Flags [.], ack 65689, win 18114, options [nop,nop,TS val 4294895620 ecr 152856,nop,nop,sack 2 {79969:82825}{69973:77113},mptcp dss ack 1998934789], length 0
20:50:10.603163 IP 112.26.1.8.37309 > 112.26.1.1.36395: Flags [.], ack 65689, win 18114, options [nop,nop,TS val 4294895620 ecr 152856,nop,nop,sack 2 {79969:82825}{69973:77113},mptcp dss ack 1998934789], length 0
20:50:10.656628 IP 112.26.1.1.36395 > 112.26.1.8.37309: Flags [.], seq 65689:67117, ack 1, win 4017, options [nop,nop,TS val 152856 ecr 4294893917,mptcp dss ack 3836451400 seq 1998984769 subseq 65689 len 1428 csum 0x52b6], length 1428
20:50:10.656834 IP 112.26.1.8.37309 > 112.26.1.1.36395: Flags [.], ack 68545, win 18342, options [nop,nop,TS val 4294895772 ecr 152856,nop,nop,sack 2 {79969:82825}{69973:77113},mptcp dss ack 1998934789], length 0
20:50:10.715264 IP 112.26.1.8.37309 > 112.26.1.1.36395: Flags [.], ack 68545, win 18342, options [nop,nop,TS val 4294895772 ecr 152856,nop,nop,sack 2 {79969:82825}{69973:77113},mptcp dss ack 1998934789], length 0
20:50:10.793089 IP 112.26.1.1.36395 > 112.26.1.8.37309: Flags [.], seq 68545:69973, ack 1, win 4017, options [nop,nop,TS val 152856 ecr 4294893917,mptcp dss ack 3836451400 seq 1999001905 subseq 68545 len 1428 csum 0x11ad], length 1428
20:50:10.793294 IP 112.26.1.8.37309 > 112.26.1.1.36395: Flags [.], ack 77113, win 18524, options [nop,nop,TS val 4294895908 ecr 152856,nop,nop,sack 1 {79969:82825},mptcp dss ack 1998934789], length 0
20:50:10.945756 IP 112.26.1.8.37309 > 112.26.1.1.36395: Flags [.], ack 77113, win 18524, options [nop,nop,TS val 4294895908 ecr 152856,nop,nop,sack 1 {79969:82825},mptcp dss ack 1998934789], length 0
20:50:11.009482 IP 112.26.1.1.36395 > 112.26.1.8.37309: Flags [.], seq 77113:78541, ack 1, win 4017, options [nop,nop,TS val 152856 ecr 4294893917,mptcp dss ack 3836451400 seq 1999026181 subseq 77113 len 1428 csum 0x87b3], length 1428
20:50:11.009710 IP 112.26.1.8.37309 > 112.26.1.1.36395: Flags [.], ack 78541, win 18798, options [nop,nop,TS val 4294896125 ecr 152856,nop,nop,sack 1 {79969:82825},mptcp dss ack 1998934789], length 0
20:50:11.109720 IP 112.26.1.1.36395 > 112.26.1.8.37309: Flags [.], seq 78541:79969, ack 1, win 4017, options [nop,nop,TS val 152856 ecr 4294893917,mptcp dss ack 3836451400 seq 1999027609 subseq 78541 len 1428 csum 0x29a9], length 1428
20:50:11.109985 IP 112.26.1.8.37309 > 112.26.1.1.36395: Flags [.], ack 82825, win 18844, options [nop,nop,TS val 4294896225 ecr 152856,mptcp dss ack 1998934789], length 0
20:50:11.198297 IP 112.26.1.8.37309 > 112.26.1.1.36395: Flags [.], ack 78541, win 18798, options [nop,nop,TS val 4294896125 ecr 152856,nop,nop,sack 1 {79969:82825},mptcp dss ack 1998934789], length 0
20:50:11.296750 IP 112.26.1.1.36395 > 112.26.1.8.37309: Flags [.], seq 82825:84253, ack 1, win 4017, options [nop,nop,TS val 152856 ecr 4294893917,mptcp dss ack 3836451400 seq 1999089013 subseq 82825 len 1428 csum 0xa6b2], length 1428
20:50:11.297115 IP 112.26.1.8.37309 > 112.26.1.1.36395: Flags [.], ack 84253, win 19117, options [nop,nop,TS val 4294896412 ecr 152856,mptcp dss ack 1998934789], length 0
20:50:11.387463 IP 112.26.1.8.37309 > 112.26.1.1.36395: Flags [.], ack 82825, win 18844, options [nop,nop,TS val 4294896225 ecr 152856,mptcp dss ack 1998934789], length 0
20:50:11.467779 IP 112.26.1.1.36395 > 112.26.1.8.37309: Flags [.], seq 87109:88537, ack 1, win 4017, options [nop,nop,TS val 153065 ecr 4294894168,mptcp dss ack 3836451400 seq 1999097581 subseq 87109 len 1428 csum 0x54f4], length 1428
20:50:11.468167 IP 112.26.1.8.37309 > 112.26.1.1.36395: Flags [.], ack 84253, win 19300, options [nop,nop,TS val 4294896583 ecr 152856,nop,nop,sack 1 {87109:88537},mptcp dss ack 1998934789], length 0
20:50:11.568903 IP 112.26.1.8.37309 > 112.26.1.1.36395: Flags [.], ack 84253, win 19117, options [nop,nop,TS val 4294896412 ecr 152856,mptcp dss ack 1998934789], length 0
20:50:11.643511 IP 112.26.1.1.36395 > 112.26.1.8.37309: Flags [.], seq 88537:89965, ack 1, win 4017, options [nop,nop,TS val 153173 ecr 4294894330,mptcp dss ack 3836451400 seq 1999101865 subseq 88537 len 1428 csum 0x467], length 1428
20:50:11.643812 IP 112.26.1.8.37309 > 112.26.1.1.36395: Flags [.], ack 84253, win 19574, options [nop,nop,TS val 4294896759 ecr 152856,nop,nop,sack 1 {87109:89965},mptcp dss ack 1998934789], length 0
