20:49:55.182336 IP 112.26.0.8.47050 > 112.26.0.1.36395: Flags [S], seq 3888113954, win 65535, options [mss 1460,sackOK,TS val 4294878138 ecr 0,nop,wscale 6,mptcp capable csum {0x58de4f15359c9e63}], length 0
20:49:55.274378 IP 112.26.0.8.47050 > 112.26.0.1.36395: Flags [S], seq 3888113954, win 65535, options [mss 1460,sackOK,TS val 4294878138 ecr 0,nop,wscale 6,mptcp capable csum {0x58de4f15359c9e63}], length 0
20:49:55.287903 IP 112.26.0.8.47050 > 112.26.0.1.36395: Flags [S], seq 3888113954, win 65535, options [mss 1460,sackOK,TS val 4294878138 ecr 0,nop,wscale 6,mptcp capable csum {0x58de4f15359c9e63}], length 0
20:49:55.586350 IP 112.26.0.8.47050 > 112.26.0.1.36395: Flags [.], ack 757391607, win 1369, options [nop,nop,TS val 4294880693 ecr 138398,mptcp capable csum {0x58de4f15359c9e63,0xf419b506df61ca0b},mptcp dss ack 1998632241], length 0
20:49:55.586611 IP 112.26.0.8.47050 > 112.26.0.1.36395: Flags [.], ack 1, win 1369, options [nop,nop,TS val 4294880693 ecr 138398,mptcp capable csum {0x58de4f15359c9e63,0xf419b506df61ca0b},mptcp dss ack 1998632241], length 0
20:49:55.597893 IP 112.26.0.8.47050 > 112.26.0.1.36395: Flags [.], ack 1, win 1369, options [nop,nop,TS val 4294880693 ecr 138398,mptcp capable csum {0x58de4f15359c9e63,0xf419b506df61ca0b},mptcp dss ack 1998632241], length 0
20:49:55.608209 IP 112.26.0.8.47050 > 112.26.0.1.36395: Flags [.], ack 1, win 1369, options [nop,nop,TS val 4294880693 ecr 138398,mptcp add-addr id 3 112.26.1.8,mptcp dss ack 1998632241], length 0
20:49:55.608407 IP 112.26.0.8.47050 > 112.26.0.1.36395: Flags [.], ack 1, win 1369, options [nop,nop,TS val 4294880693 ecr 138398,mptcp add-addr id 3 112.26.1.8,mptcp dss ack 1998632241], length 0
20:49:55.686042 IP 112.26.0.8.47050 > 112.26.0.1.36395: Flags [.], ack 1, win 1369, options [nop,nop,TS val 4294880693 ecr 138398,mptcp add-addr id 3 112.26.1.8,mptcp dss ack 1998632241], length 0
20:49:55.698618 IP 112.26.0.8.47050 > 112.26.0.1.36395: Flags [.], ack 1, win 1369, options [nop,nop,TS val 4294880693 ecr 138398,mptcp add-addr id 4 112.26.2.8,mptcp dss ack 1998632241], length 0
20:49:55.698853 IP 112.26.0.8.47050 > 112.26.0.1.36395: Flags [.], ack 1, win 1369, options [nop,nop,TS val 4294880693 ecr 138398,mptcp add-addr id 4 112.26.2.8,mptcp dss ack 1998632241], length 0
20:49:55.778496 IP 112.26.0.8.47050 > 112.26.0.1.36395: Flags [.], ack 1, win 1369, options [nop,nop,TS val 4294880693 ecr 138398,mptcp add-addr id 4 112.26.2.8,mptcp dss ack 1998632241], length 0
20:49:55.784871 IP 112.26.0.8.47050 > 112.26.0.1.36395: Flags [.], ack 1, win 1369, options [nop,nop,TS val 4294880693 ecr 138398,mptcp add-addr id 5 112.26.3.8,mptcp dss ack 1998632241], length 0
20:49:55.785106 IP 112.26.0.8.47050 > 112.26.0.1.36395: Flags [.], ack 1, win 1369, options [nop,nop,TS val 4294880693 ecr 138398,mptcp add-addr id 5 112.26.3.8,mptcp dss ack 1998632241], length 0
20:49:55.812034 IP 112.26.0.8.47050 > 112.26.0.1.36395: Flags [.], ack 1, win 1369, options [nop,nop,TS val 4294880693 ecr 138398,mptcp add-addr id 5 112.26.3.8,mptcp dss ack 1998632241], length 0
20:49:55.821128 IP 112.26.0.8.47050 > 112.26.0.1.36395: Flags [.], ack 1429, win 1415, options [nop,nop,TS val 4294880935 ecr 138713,mptcp dss ack 1998633669], length 0
20:49:55.821365 IP 112.26.0.8.47050 > 112.26.0.1.36395: Flags [.], ack 1429, win 1415, options [nop,nop,TS val 4294880935 ecr 138713,mptcp dss ack 1998633669], length 0
20:49:55.887774 IP 112.26.0.8.47050 > 112.26.0.1.36395: Flags [.], ack 1429, win 1415, options [nop,nop,TS val 4294880935 ecr 138713,mptcp dss ack 1998633669], length 0
20:49:55.897212 IP 112.26.0.8.47050 > 112.26.0.1.36395: Flags [.], ack 2857, win 1460, options [nop,nop,TS val 4294881011 ecr 138713,mptcp dss ack 1998635097], length 0
20:49:55.897456 IP 112.26.0.8.47050 > 112.26.0.1.36395: Flags [.], ack 2857, win 1460, options [nop,nop,TS val 4294881011 ecr 138713,mptcp dss ack 1998635097], length 0
20:49:55.987507 IP 112.26.0.8.47050 > 112.26.0.1.36395: Flags [.], ack 2857, win 1460, options [nop,nop,TS val 4294881011 ecr 138713,mptcp dss ack 1998635097], length 0
20:49:55.994221 IP 112.26.0.8.47050 > 112.26.0.1.36395: Flags [.], ack 4097, win 1506, options [nop,nop,TS val 4294881108 ecr 138713,mptcp dss ack 1998636337], length 0
20:49:55.994482 IP 112.26.0.8.47050 > 112.26.0.1.36395: Flags [.], ack 4097, win 1506, options [nop,nop,TS val 4294881108 ecr 138713,mptcp dss ack 1998636337], length 0
20:49:56.072843 IP 112.26.0.8.47050 > 112.26.0.1.36395: Flags [.], ack 4097, win 1506, options [nop,nop,TS val 4294881108 ecr 138713,mptcp dss ack 1998636337], length 0
20:49:56.085540 IP 112.26.0.8.47050 > 112.26.0.1.36395: Flags [.], ack 5525, win 1552, options [nop,nop,TS val 4294881199 ecr 138713,mptcp dss ack 1998637765], length 0
20:49:56.085746 IP 112.26.0.8.47050 > 112.26.0.1.36395: Flags [.], ack 5525, win 1552, options [nop,nop,TS val 4294881199 ecr 138713,mptcp dss ack 1998637765], length 0
20:49:56.108115 IP 112.26.0.8.47050 > 112.26.0.1.36395: Flags [.], ack 5525, win 1552, options [nop,nop,TS val 4294881199 ecr 138713,mptcp dss ack 1998637765], length 0
20:49:56.177229 IP 112.26.0.8.47050 > 112.26.0.1.36395: Flags [.], ack 6953, win 1597, options [nop,nop,TS val 4294881289 ecr 138713,mptcp dss ack 1998639193], length 0
20:49:56.177568 IP 112.26.0.8.47050 > 112.26.0.1.36395: Flags [.], ack 6953, win 1597, options [nop,nop,TS val 4294881289 ecr 138713,mptcp dss ack 1998639193], length 0
20:49:56.274769 IP 112.26.0.8.47050 > 112.26.0.1.36395: Flags [.], ack 8381, win 1643, options [nop,nop,TS val 4294881387 ecr 138714,mptcp dss ack 1998640621], length 0
20:49:56.275257 IP 112.26.0.8.47050 > 112.26.0.1.36395: Flags [.], ack 8381, win 1643, options [nop,nop,TS val 4294881387 ecr 138714,mptcp dss ack 1998640621], length 0
20:49:56.293324 IP 112.26.0.8.47050 > 112.26.0.1.36395: Flags [.], ack 6953, win 1597, options [nop,nop,TS val 4294881289 ecr 138713,mptcp dss ack 1998639193], length 0
20:49:56.313362 IP 112.26.0.8.47050 > 112.26.0.1.36395: Flags [.], ack 9809, win 1689, options [nop,nop,TS val 4294881427 ecr 138714,mptcp dss ack 1998642049], length 0
20:49:56.313637 IP 112.26.0.8.47050 > 112.26.0.1.36395: Flags [.], ack 9809, win 1689, options [nop,nop,TS val 4294881427 ecr 138714,mptcp dss ack 1998642049], length 0
20:49:56.389268 IP 112.26.0.8.47050 > 112.26.0.1.36395: Flags [.], ack 8381, win 1643, options [nop,nop,TS val 4294881387 ecr 138714,mptcp dss ack 1998640621], length 0
20:49:56.402502 IP 112.26.0.8.47050 > 112.26.0.1.36395: Flags [.], ack 9809, win 1734, options [nop,nop,TS val 4294881517 ecr 138714,nop,nop,sack 1 {14093:15521},mptcp dss ack 1998642049], length 0
20:49:56.402800 IP 112.26.0.8.47050 > 112.26.0.1.36395: Flags [.], ack 9809, win 1734, options [nop,nop,TS val 4294881517 ecr 138714,nop,nop,sack 1 {14093:15521},mptcp dss ack 1998642049], length 0
20:49:56.430742 IP 112.26.0.8.47050 > 112.26.0.1.36395: Flags [.], ack 9809, win 1780, options [nop,nop,TS val 4294881545 ecr 138714,nop,nop,sack 1 {14093:16949},mptcp dss ack 1998642049], length 0
20:49:56.431003 IP 112.26.0.8.47050 > 112.26.0.1.36395: Flags [.], ack 9809, win 1780, options [nop,nop,TS val 4294881545 ecr 138714,nop,nop,sack 1 {14093:16949},mptcp dss ack 1998642049], length 0
20:49:56.501483 IP 112.26.0.8.47050 > 112.26.0.1.36395: Flags [.], ack 9809, win 1689, options [nop,nop,TS val 4294881427 ecr 138714,mptcp dss ack 1998642049], length 0
20:49:56.538217 IP 112.26.0.8.47050 > 112.26.0.1.36395: Flags [.], ack 9809, win 1734, options [nop,nop,TS val 4294881517 ecr 138714,nop,nop,sack 1 {14093:15521},mptcp dss ack 1998642049], length 0
20:49:56.593034 IP 112.26.0.8.47050 > 112.26.0.1.36395: Flags [.], ack 9809, win 1825, options [nop,nop,TS val 4294881707 ecr 138714,nop,nop,sack 1 {14093:18377},mptcp dss ack 1998642049], length 0
20:49:56.593325 IP 112.26.0.8.47050 > 112.26.0.1.36395: Flags [.], ack 9809, win 1825, options [nop,nop,TS val 4294881707 ecr 138714,nop,nop,sack 1 {14093:18377},mptcp dss ack 1998642049], length 0
20:49:56.599937 IP 112.26.0.8.47050 > 112.26.0.1.36395: Flags [.], ack 9809, win 1780, options [nop,nop,TS val 4294881545 ecr 138714,nop,nop,sack 1 {14093:16949},mptcp dss ack 1998642049], length 0
20:49:56.705858 IP 112.26.0.8.47050 > 112.26.0.1.36395: Flags [.], ack 9809, win 1871, options [nop,nop,TS val 4294881820 ecr 138714,nop,nop,sack 1 {14093:19805},mptcp dss ack 1998642049], length 0
20:49:56.706214 IP 112.26.0.8.47050 > 112.26.0.1.36395: Flags [.], ack 9809, win 1871, options [nop,nop,TS val 4294881820 ecr 138714,nop,nop,sack 1 {14093:19805},mptcp dss ack 1998642049], length 0
20:49:56.781890 IP 112.26.0.8.47050 > 112.26.0.1.36395: Flags [.], ack 9809, win 1825, options [nop,nop,TS val 4294881707 ecr 138714,nop,nop,sack 1 {14093:18377},mptcp dss ack 1998642049], length 0
20:49:56.797305 IP 112.26.0.8.47050 > 112.26.0.1.36395: Flags [.], ack 9809, win 1917, options [nop,nop,TS val 4294881911 ecr 138714,nop,nop,sack 1 {14093:21233},mptcp dss ack 1998642049], length 0
20:49:56.797618 IP 112.26.0.8.47050 > 112.26.0.1.36395: Flags [.], ack 9809, win 1917, options [nop,nop,TS val 4294881911 ecr 138714,nop,nop,sack 1 {14093:21233},mptcp dss ack 1998642049], length 0
20:49:56.882627 IP 112.26.0.8.47050 > 112.26.0.1.36395: Flags [.], ack 9809, win 1962, options [nop,nop,TS val 4294881996 ecr 138714,nop,nop,sack 1 {14093:22661},mptcp dss ack 1998642049], length 0
20:49:56.882931 IP 112.26.0.8.47050 > 112.26.0.1.36395: Flags [.], ack 9809, win 1962, options [nop,nop,TS val 4294881996 ecr 138714,nop,nop,sack 1 {14093:22661},mptcp dss ack 1998642049], length 0
20:49:56.894186 IP 112.26.0.8.47050 > 112.26.0.1.36395: Flags [.], ack 9809, win 1871, options [nop,nop,TS val 4294881820 ecr 138714,nop,nop,sack 1 {14093:19805},mptcp dss ack 1998642049], length 0
20:49:56.913001 IP 112.26.0.8.47050 > 112.26.0.1.36395: Flags [.], ack 9809, win 1917, options [nop,nop,TS val 4294881911 ecr 138714,nop,nop,sack 1 {14093:21233},mptcp dss ack 1998642049], length 0
20:49:56.919075 IP 112.26.0.8.47050 > 112.26.0.1.36395: Flags [.], ack 9809, win 2008, options [nop,nop,TS val 4294882033 ecr 138714,nop,nop,sack 1 {14093:24089},mptcp dss ack 1998642049], length 0
20:49:56.919543 IP 112.26.0.8.47050 > 112.26.0.1.36395: Flags [.], ack 9809, win 2008, options [nop,nop,TS val 4294882033 ecr 138714,nop,nop,sack 1 {14093:24089},mptcp dss ack 1998642049], length 0
20:49:57.000949 IP 112.26.0.8.47050 > 112.26.0.1.36395: Flags [.], ack 9809, win 2054, options [nop,nop,TS val 4294882115 ecr 138714,nop,nop,sack 1 {14093:25517},mptcp dss ack 1998642049], length 0
20:49:57.001257 IP 112.26.0.8.47050 > 112.26.0.1.36395: Flags [.], ack 9809, win 2054, options [nop,nop,TS val 4294882115 ecr 138714,nop,nop,sack 1 {14093:25517},mptcp dss ack 1998642049], length 0
20:49:57.018432 IP 112.26.0.8.47050 > 112.26.0.1.36395: Flags [.], ack 9809, win 1962, options [nop,nop,TS val 4294881996 ecr 138714,nop,nop,sack 1 {14093:22661},mptcp dss ack 1998642049], length 0
20:49:57.088861 IP 112.26.0.8.47050 > 112.26.0.1.36395: Flags [.], ack 9809, win 2099, options [nop,nop,TS val 4294882203 ecr 138714,nop,nop,sack 1 {14093:26945},mptcp dss ack 1998642049], length 0
20:49:57.089156 IP 112.26.0.8.47050 > 112.26.0.1.36395: Flags [.], ack 9809, win 2099, options [nop,nop,TS val 4294882203 ecr 138714,nop,nop,sack 1 {14093:26945},mptcp dss ack 1998642049], length 0
20:49:57.108809 IP 112.26.0.8.47050 > 112.26.0.1.36395: Flags [.], ack 9809, win 2008, options [nop,nop,TS val 4294882033 ecr 138714,nop,nop,sack 1 {14093:24089},mptcp dss ack 1998642049], length 0
20:49:57.120388 IP 112.26.0.8.47050 > 112.26.0.1.36395: Flags [.], ack 9809, win 2145, options [nop,nop,TS val 4294882234 ecr 138714,nop,nop,sack 1 {14093:28373},mptcp dss ack 1998642049], length 0
20:49:57.120705 IP 112.26.0.8.47050 > 112.26.0.1.36395: Flags [.], ack 9809, win 2145, options [nop,nop,TS val 4294882234 ecr 138714,nop,nop,sack 1 {14093:28373},mptcp dss ack 1998642049], length 0
20:49:57.187947 IP 112.26.0.8.47050 > 112.26.0.1.36395: Flags [.], ack 9809, win 2054, options [nop,nop,TS val 4294882115 ecr 138714,nop,nop,sack 1 {14093:25517},mptcp dss ack 1998642049], length 0
20:49:57.195997 IP 112.26.0.8.47050 > 112.26.0.1.36395: Flags [.], ack 9809, win 2190, options [nop,nop,TS val 4294882305 ecr 138714,nop,nop,sack 1 {14093:29801},mptcp dss ack 1998642049], length 0
20:49:57.196335 IP 112.26.0.8.47050 > 112.26.0.1.36395: Flags [.], ack 9809, win 2190, options [nop,nop,TS val 4294882305 ecr 138714,nop,nop,sack 1 {14093:29801},mptcp dss ack 1998642049], length 0
20:49:57.221166 IP 112.26.0.8.47050 > 112.26.0.1.36395: Flags [.], ack 9809, win 2236, options [nop,nop,TS val 4294882336 ecr 138714,nop,nop,sack 1 {14093:31229},mptcp dss ack 1998642049], length 0
20:49:57.221447 IP 112.26.0.8.47050 > 112.26.0.1.36395: Flags [.], ack 9809, win 2236, options [nop,nop,TS val 4294882336 ecr 138714,nop,nop,sack 1 {14093:31229},mptcp dss ack 1998642049], length 0
20:49:57.284227 IP 112.26.0.8.47050 > 112.26.0.1.36395: Flags [.], ack 9809, win 2099, options [nop,nop,TS val 4294882203 ecr 138714,nop,nop,sack 1 {14093:26945},mptcp dss ack 1998642049], length 0
20:49:57.304402 IP 112.26.0.8.47050 > 112.26.0.1.36395: Flags [.], ack 9809, win 2282, options [nop,nop,TS val 4294882416 ecr 138714,nop,nop,sack 1 {14093:32657},mptcp dss ack 1998642049], length 0
20:49:57.304680 IP 112.26.0.8.47050 > 112.26.0.1.36395: Flags [.], ack 9809, win 2282, options [nop,nop,TS val 4294882416 ecr 138714,nop,nop,sack 1 {14093:32657},mptcp dss ack 1998642049], length 0
20:49:57.384398 IP 112.26.0.8.47050 > 112.26.0.1.36395: Flags [.], ack 9809, win 2145, options [nop,nop,TS val 4294882234 ecr 138714,nop,nop,sack 1 {14093:28373},mptcp dss ack 1998642049], length 0
20:49:57.395479 IP 112.26.0.8.47050 > 112.26.0.1.36395: Flags [.], ack 9809, win 2327, options [nop,nop,TS val 4294882494 ecr 138714,nop,nop,sack 1 {14093:34085},mptcp dss ack 1998642049], length 0
20:49:57.395760 IP 112.26.0.8.47050 > 112.26.0.1.36395: Flags [.], ack 9809, win 2327, options [nop,nop,TS val 4294882494 ecr 138714,nop,nop,sack 1 {14093:34085},mptcp dss ack 1998642049], length 0
20:49:57.414478 IP 112.26.0.8.47050 > 112.26.0.1.36395: Flags [.], ack 9809, win 2190, options [nop,nop,TS val 4294882305 ecr 138714,nop,nop,sack 1 {14093:29801},mptcp dss ack 1998642049], length 0
20:49:57.486655 IP 112.26.0.8.47050 > 112.26.0.1.36395: Flags [.], ack 11237, win 2373, options [nop,nop,TS val 4294882600 ecr 139649,nop,nop,sack 1 {14093:34085},mptcp dss ack 1998643477], length 0
20:49:57.487002 IP 112.26.0.8.47050 > 112.26.0.1.36395: Flags [.], ack 11237, win 2373, options [nop,nop,TS val 4294882600 ecr 139649,nop,nop,sack 1 {14093:34085},mptcp dss ack 1998643477], length 0
20:49:57.512863 IP 112.26.0.8.47050 > 112.26.0.1.36395: Flags [.], ack 9809, win 2236, options [nop,nop,TS val 4294882336 ecr 138714,nop,nop,sack 1 {14093:31229},mptcp dss ack 1998642049], length 0
20:49:57.520126 IP 112.26.0.8.47050 > 112.26.0.1.36395: Flags [.], ack 12665, win 2419, options [nop,nop,TS val 4294882633 ecr 139710,nop,nop,sack 1 {14093:34085},mptcp dss ack 1998644905], length 0
20:49:57.520312 IP 112.26.0.8.47050 > 112.26.0.1.36395: Flags [.], ack 12665, win 2419, options [nop,nop,TS val 4294882633 ecr 139710,nop,nop,sack 1 {14093:34085},mptcp dss ack 1998644905], length 0
20:49:57.597220 IP 112.26.0.8.47050 > 112.26.0.1.36395: Flags [.], ack 34085, win 2464, options [nop,nop,TS val 4294882711 ecr 140004,mptcp dss ack 1998666325], length 0
20:49:57.597391 IP 112.26.0.8.47050 > 112.26.0.1.36395: Flags [.], ack 34085, win 2464, options [nop,nop,TS val 4294882711 ecr 140004,mptcp dss ack 1998666325], length 0
20:49:57.612534 IP 112.26.0.8.47050 > 112.26.0.1.36395: Flags [.], ack 9809, win 2282, options [nop,nop,TS val 4294882416 ecr 138714,nop,nop,sack 1 {14093:32657},mptcp dss ack 1998642049], length 0
20:49:57.625332 IP 112.26.0.8.47050 > 112.26.0.1.36395: Flags [.], ack 35513, win 2510, options [nop,nop,TS val 4294882738 ecr 140128,mptcp dss ack 1998667753], length 0
20:49:57.625556 IP 112.26.0.8.47050 > 112.26.0.1.36395: Flags [.], ack 35513, win 2510, options [nop,nop,TS val 4294882738 ecr 140128,mptcp dss ack 1998667753], length 0
20:49:57.698009 IP 112.26.0.8.47050 > 112.26.0.1.36395: Flags [.], ack 9809, win 2327, options [nop,nop,TS val 4294882494 ecr 138714,nop,nop,sack 1 {14093:34085},mptcp dss ack 1998642049], length 0
20:49:57.707230 IP 112.26.0.8.47050 > 112.26.0.1.36395: Flags [.], ack 36941, win 2555, options [nop,nop,TS val 4294882821 ecr 140394,mptcp dss ack 1998669181], length 0
20:49:57.707433 IP 112.26.0.8.47050 > 112.26.0.1.36395: Flags [.], ack 36941, win 2555, options [nop,nop,TS val 4294882821 ecr 140394,mptcp dss ack 1998669181], length 0
20:49:57.721320 IP 112.26.0.8.47050 > 112.26.0.1.36395: Flags [.], ack 11237, win 2373, options [nop,nop,TS val 4294882600 ecr 139649,nop,nop,sack 1 {14093:34085},mptcp dss ack 1998643477], length 0
20:49:57.790102 IP 112.26.0.8.47050 > 112.26.0.1.36395: Flags [.], ack 38369, win 2601, options [nop,nop,TS val 4294882904 ecr 140495,mptcp dss ack 1998670609], length 0
20:49:57.790387 IP 112.26.0.8.47050 > 112.26.0.1.36395: Flags [.], ack 38369, win 2601, options [nop,nop,TS val 4294882904 ecr 140495,mptcp dss ack 1998670609], length 0
20:49:57.807600 IP 112.26.0.8.47050 > 112.26.0.1.36395: Flags [.], ack 12665, win 2419, options [nop,nop,TS val 4294882633 ecr 139710,nop,nop,sack 1 {14093:34085},mptcp dss ack 1998644905], length 0
20:49:57.820470 IP 112.26.0.8.47050 > 112.26.0.1.36395: Flags [.], ack 39797, win 2647, options [nop,nop,TS val 4294882935 ecr 140525,mptcp dss ack 1998672037], length 0
20:49:57.820680 IP 112.26.0.8.47050 > 112.26.0.1.36395: Flags [.], ack 39797, win 2647, options [nop,nop,TS val 4294882935 ecr 140525,mptcp dss ack 1998672037], length 0
20:49:57.894380 IP 112.26.0.8.47050 > 112.26.0.1.36395: Flags [.], ack 34085, win 2464, options [nop,nop,TS val 4294882711 ecr 140004,mptcp dss ack 1998666325], length 0
20:49:57.904656 IP 112.26.0.8.47050 > 112.26.0.1.36395: Flags [.], ack 41225, win 2692, options [nop,nop,TS val 4294883019 ecr 140623,mptcp dss ack 1998673465], length 0
20:49:57.904906 IP 112.26.0.8.47050 > 112.26.0.1.36395: Flags [.], ack 41225, win 2692, options [nop,nop,TS val 4294883019 ecr 140623,mptcp dss ack 1998673465], length 0
20:49:57.921871 IP 112.26.0.8.47050 > 112.26.0.1.36395: Flags [.], ack 35513, win 2510, options [nop,nop,TS val 4294882738 ecr 140128,mptcp dss ack 1998667753], length 0
20:49:57.991262 IP 112.26.0.8.47050 > 112.26.0.1.36395: Flags [.], ack 42653, win 2738, options [nop,nop,TS val 4294883105 ecr 140723,mptcp dss ack 1998674893], length 0
20:49:57.991503 IP 112.26.0.8.47050 > 112.26.0.1.36395: Flags [.], ack 42653, win 2738, options [nop,nop,TS val 4294883105 ecr 140723,mptcp dss ack 1998674893], length 0
20:49:58.014447 IP 112.26.0.8.47050 > 112.26.0.1.36395: Flags [.], ack 36941, win 2555, options [nop,nop,TS val 4294882821 ecr 140394,mptcp dss ack 1998669181], length 0
20:49:58.025244 IP 112.26.0.8.47050 > 112.26.0.1.36395: Flags [.], ack 44081, win 2784, options [nop,nop,TS val 4294883127 ecr 140808,mptcp dss ack 1998676321], length 0
20:49:58.025502 IP 112.26.0.8.47050 > 112.26.0.1.36395: Flags [.], ack 44081, win 2784, options [nop,nop,TS val 4294883127 ecr 140808,mptcp dss ack 1998676321], length 0
20:49:58.103823 IP 112.26.0.8.47050 > 112.26.0.1.36395: Flags [.], ack 45509, win 2829, options [nop,nop,TS val 4294883218 ecr 140832,mptcp dss ack 1998677749], length 0
20:49:58.104030 IP 112.26.0.8.47050 > 112.26.0.1.36395: Flags [.], ack 45509, win 2829, options [nop,nop,TS val 4294883218 ecr 140832,mptcp dss ack 1998677749], length 0
20:49:58.115458 IP 112.26.0.8.47050 > 112.26.0.1.36395: Flags [.], ack 38369, win 2601, options [nop,nop,TS val 4294882904 ecr 140495,mptcp dss ack 1998670609], length 0
20:49:58.130832 IP 112.26.0.8.47050 > 112.26.0.1.36395: Flags [.], ack 39797, win 2647, options [nop,nop,TS val 4294882935 ecr 140525,mptcp dss ack 1998672037], length 0
20:49:58.191769 IP 112.26.0.8.47050 > 112.26.0.1.36395: Flags [.], ack 46937, win 2875, options [nop,nop,TS val 4294883306 ecr 140832,mptcp dss ack 1998679177], length 0
20:49:58.191978 IP 112.26.0.8.47050 > 112.26.0.1.36395: Flags [.], ack 46937, win 2875, options [nop,nop,TS val 4294883306 ecr 140832,mptcp dss ack 1998679177], length 0
20:49:58.216333 IP 112.26.0.8.47050 > 112.26.0.1.36395: Flags [.], ack 41225, win 2692, options [nop,nop,TS val 4294883019 ecr 140623,mptcp dss ack 1998673465], length 0
20:49:58.284992 IP 112.26.0.8.47050 > 112.26.0.1.36395: Flags [.], ack 48365, win 2920, options [nop,nop,TS val 4294883399 ecr 140918,mptcp dss ack 1998680605], length 0
20:49:58.285471 IP 112.26.0.8.47050 > 112.26.0.1.36395: Flags [.], ack 48365, win 2920, options [nop,nop,TS val 4294883399 ecr 140918,mptcp dss ack 1998680605], length 0
20:49:58.312962 IP 112.26.0.8.47050 > 112.26.0.1.36395: Flags [.], ack 49793, win 2966, options [nop,nop,TS val 4294883427 ecr 141005,mptcp dss ack 1998682033], length 0
20:49:58.313231 IP 112.26.0.8.47050 > 112.26.0.1.36395: Flags [.], ack 49793, win 2966, options [nop,nop,TS val 4294883427 ecr 141005,mptcp dss ack 1998682033], length 0
20:49:58.328590 IP 112.26.0.8.47050 > 112.26.0.1.36395: Flags [.], ack 42653, win 2738, options [nop,nop,TS val 4294883105 ecr 140723,mptcp dss ack 1998674893], length 0
20:49:58.396889 IP 112.26.0.8.47050 > 112.26.0.1.36395: Flags [.], ack 51221, win 3012, options [nop,nop,TS val 4294883511 ecr 141032,mptcp dss ack 1998683461], length 0
20:49:58.397127 IP 112.26.0.8.47050 > 112.26.0.1.36395: Flags [.], ack 51221, win 3012, options [nop,nop,TS val 4294883511 ecr 141032,mptcp dss ack 1998683461], length 0
20:49:58.417523 IP 112.26.0.8.47050 > 112.26.0.1.36395: Flags [.], ack 44081, win 2784, options [nop,nop,TS val 4294883127 ecr 140808,mptcp dss ack 1998676321], length 0
20:49:58.427770 IP 112.26.0.8.47050 > 112.26.0.1.36395: Flags [.], ack 52649, win 3057, options [nop,nop,TS val 4294883540 ecr 141125,mptcp dss ack 1998684889], length 0
20:49:58.428006 IP 112.26.0.8.47050 > 112.26.0.1.36395: Flags [.], ack 52649, win 3057, options [nop,nop,TS val 4294883540 ecr 141125,mptcp dss ack 1998684889], length 0
20:49:58.508911 IP 112.26.0.8.47050 > 112.26.0.1.36395: Flags [.], ack 54077, win 3103, options [nop,nop,TS val 4294883619 ecr 141125,mptcp dss ack 1998686317], length 0
20:49:58.509106 IP 112.26.0.8.47050 > 112.26.0.1.36395: Flags [.], ack 54077, win 3103, options [nop,nop,TS val 4294883619 ecr 141125,mptcp dss ack 1998686317], length 0
20:49:58.521968 IP 112.26.0.8.47050 > 112.26.0.1.36395: Flags [.], ack 45509, win 2829, options [nop,nop,TS val 4294883218 ecr 140832,mptcp dss ack 1998677749], length 0
20:49:58.532172 IP 112.26.0.8.47050 > 112.26.0.1.36395: Flags [.], ack 55505, win 3149, options [nop,nop,TS val 4294883645 ecr 141226,mptcp dss ack 1998687745], length 0
20:49:58.532500 IP 112.26.0.8.47050 > 112.26.0.1.36395: Flags [.], ack 55505, win 3149, options [nop,nop,TS val 4294883645 ecr 141226,mptcp dss ack 1998687745], length 0
20:49:58.604499 IP 112.26.0.8.47050 > 112.26.0.1.36395: Flags [.], ack 46937, win 2875, options [nop,nop,TS val 4294883306 ecr 140832,mptcp dss ack 1998679177], length 0
20:49:58.613755 IP 112.26.0.8.47050 > 112.26.0.1.36395: Flags [.], ack 56933, win 3194, options [nop,nop,TS val 4294883728 ecr 141241,mptcp dss ack 1998689173], length 0
20:49:58.614124 IP 112.26.0.8.47050 > 112.26.0.1.36395: Flags [.], ack 56933, win 3194, options [nop,nop,TS val 4294883728 ecr 141241,mptcp dss ack 1998689173], length 0
20:49:58.638970 IP 112.26.0.8.47050 > 112.26.0.1.36395: Flags [.], ack 48365, win 2920, options [nop,nop,TS val 4294883399 ecr 140918,mptcp dss ack 1998680605], length 0
20:49:58.710398 IP 112.26.0.8.47050 > 112.26.0.1.36395: Flags [.], ack 49793, win 2966, options [nop,nop,TS val 4294883427 ecr 141005,mptcp dss ack 1998682033], length 0
20:49:58.716849 IP 112.26.0.8.47050 > 112.26.0.1.36395: Flags [.], ack 58361, win 3240, options [nop,nop,TS val 4294883831 ecr 141326,mptcp dss ack 1998690601], length 0
20:49:58.717166 IP 112.26.0.8.47050 > 112.26.0.1.36395: Flags [.], ack 58361, win 3240, options [nop,nop,TS val 4294883831 ecr 141326,mptcp dss ack 1998690601], length 0
20:49:58.803329 IP 112.26.0.8.47050 > 112.26.0.1.36395: Flags [.], ack 51221, win 3012, options [nop,nop,TS val 4294883511 ecr 141032,mptcp dss ack 1998683461], length 0
20:49:58.809051 IP 112.26.0.8.47050 > 112.26.0.1.36395: Flags [.], ack 59789, win 3285, options [nop,nop,TS val 4294883923 ecr 141435,mptcp dss ack 1998692029], length 0
20:49:58.809444 IP 112.26.0.8.47050 > 112.26.0.1.36395: Flags [.], ack 59789, win 3285, options [nop,nop,TS val 4294883923 ecr 141435,mptcp dss ack 1998692029], length 0
20:49:58.827893 IP 112.26.0.8.47050 > 112.26.0.1.36395: Flags [.], ack 52649, win 3057, options [nop,nop,TS val 4294883540 ecr 141125,mptcp dss ack 1998684889], length 0
20:49:58.901981 IP 112.26.0.8.47050 > 112.26.0.1.36395: Flags [.], ack 61217, win 3331, options [nop,nop,TS val 4294884015 ecr 141435,mptcp dss ack 1998693457], length 0
20:49:58.902263 IP 112.26.0.8.47050 > 112.26.0.1.36395: Flags [.], ack 61217, win 3331, options [nop,nop,TS val 4294884015 ecr 141435,mptcp dss ack 1998693457], length 0
20:49:58.921736 IP 112.26.0.8.47050 > 112.26.0.1.36395: Flags [.], ack 54077, win 3103, options [nop,nop,TS val 4294883619 ecr 141125,mptcp dss ack 1998686317], length 0
20:49:58.996648 IP 112.26.0.8.47050 > 112.26.0.1.36395: Flags [.], ack 62645, win 3377, options [nop,nop,TS val 4294884109 ecr 141528,mptcp dss ack 1998694885], length 0
20:49:58.996981 IP 112.26.0.8.47050 > 112.26.0.1.36395: Flags [.], ack 62645, win 3377, options [nop,nop,TS val 4294884109 ecr 141528,mptcp dss ack 1998694885], length 0
20:49:59.010582 IP 112.26.0.8.47050 > 112.26.0.1.36395: Flags [.], ack 55505, win 3149, options [nop,nop,TS val 4294883645 ecr 141226,mptcp dss ack 1998687745], length 0
20:49:59.022916 IP 112.26.0.8.47050 > 112.26.0.1.36395: Flags [.], ack 64073, win 3422, options [nop,nop,TS val 4294884137 ecr 141632,mptcp dss ack 1998696313], length 0
20:49:59.023237 IP 112.26.0.8.47050 > 112.26.0.1.36395: Flags [.], ack 64073, win 3422, options [nop,nop,TS val 4294884137 ecr 141632,mptcp dss ack 1998696313], length 0
20:49:59.095111 IP 112.26.0.8.47050 > 112.26.0.1.36395: Flags [.], ack 56933, win 3194, options [nop,nop,TS val 4294883728 ecr 141241,mptcp dss ack 1998689173], length 0
20:49:59.106703 IP 112.26.0.8.47050 > 112.26.0.1.36395: Flags [.], ack 65501, win 3468, options [nop,nop,TS val 4294884215 ecr 141715,mptcp dss ack 1998697741], length 0
20:49:59.107044 IP 112.26.0.8.47050 > 112.26.0.1.36395: Flags [.], ack 65501, win 3468, options [nop,nop,TS val 4294884215 ecr 141715,mptcp dss ack 1998697741], length 0
20:49:59.122259 IP 112.26.0.8.47050 > 112.26.0.1.36395: Flags [.], ack 58361, win 3240, options [nop,nop,TS val 4294883831 ecr 141326,mptcp dss ack 1998690601], length 0
20:49:59.133861 IP 112.26.0.8.47050 > 112.26.0.1.36395: Flags [.], ack 66929, win 3514, options [nop,nop,TS val 4294884247 ecr 141749,mptcp dss ack 1998699169], length 0
20:49:59.134188 IP 112.26.0.8.47050 > 112.26.0.1.36395: Flags [.], ack 66929, win 3514, options [nop,nop,TS val 4294884247 ecr 141749,mptcp dss ack 1998699169], length 0
20:49:59.203664 IP 112.26.0.8.47050 > 112.26.0.1.36395: Flags [.], ack 59789, win 3285, options [nop,nop,TS val 4294883923 ecr 141435,mptcp dss ack 1998692029], length 0
20:49:59.210236 IP 112.26.0.8.47050 > 112.26.0.1.36395: Flags [.], ack 68357, win 3559, options [nop,nop,TS val 4294884322 ecr 141749,mptcp dss ack 1998700597], length 0
20:49:59.210569 IP 112.26.0.8.47050 > 112.26.0.1.36395: Flags [.], ack 68357, win 3559, options [nop,nop,TS val 4294884322 ecr 141749,mptcp dss ack 1998700597], length 0
20:49:59.297121 IP 112.26.0.8.47050 > 112.26.0.1.36395: Flags [.], ack 68357, win 3605, options [nop,nop,TS val 4294884411 ecr 141749,nop,nop,sack 1 {69785:71213},mptcp dss ack 1998700597], length 0
20:49:59.297420 IP 112.26.0.8.47050 > 112.26.0.1.36395: Flags [.], ack 68357, win 3605, options [nop,nop,TS val 4294884411 ecr 141749,nop,nop,sack 1 {69785:71213},mptcp dss ack 1998700597], length 0
20:49:59.315908 IP 112.26.0.8.47050 > 112.26.0.1.36395: Flags [.], ack 61217, win 3331, options [nop,nop,TS val 4294884015 ecr 141435,mptcp dss ack 1998693457], length 0
20:49:59.330469 IP 112.26.0.8.47050 > 112.26.0.1.36395: Flags [.], ack 68357, win 3650, options [nop,nop,TS val 4294884444 ecr 141749,nop,nop,sack 1 {69785:72641},mptcp dss ack 1998700597], length 0
20:49:59.330738 IP 112.26.0.8.47050 > 112.26.0.1.36395: Flags [.], ack 68357, win 3650, options [nop,nop,TS val 4294884444 ecr 141749,nop,nop,sack 1 {69785:72641},mptcp dss ack 1998700597], length 0
20:49:59.410748 IP 112.26.0.8.47050 > 112.26.0.1.36395: Flags [.], ack 62645, win 3377, options [nop,nop,TS val 4294884109 ecr 141528,mptcp dss ack 1998694885], length 0
20:49:59.425702 IP 112.26.0.8.47050 > 112.26.0.1.36395: Flags [.], ack 68357, win 3696, options [nop,nop,TS val 4294884539 ecr 141749,nop,nop,sack 1 {69785:74069},mptcp dss ack 1998700597], length 0
20:49:59.425916 IP 112.26.0.8.47050 > 112.26.0.1.36395: Flags [.], ack 68357, win 3696, options [nop,nop,TS val 4294884539 ecr 141749,nop,nop,sack 1 {69785:74069},mptcp dss ack 1998700597], length 0
20:49:59.440637 IP 112.26.0.8.47050 > 112.26.0.1.36395: Flags [.], ack 64073, win 3422, options [nop,nop,TS val 4294884137 ecr 141632,mptcp dss ack 1998696313], length 0
20:49:59.506356 IP 112.26.0.8.47050 > 112.26.0.1.36395: Flags [.], ack 68357, win 3742, options [nop,nop,TS val 4294884620 ecr 141749,nop,nop,sack 1 {69785:75497},mptcp dss ack 1998700597], length 0
20:49:59.506650 IP 112.26.0.8.47050 > 112.26.0.1.36395: Flags [.], ack 68357, win 3742, options [nop,nop,TS val 4294884620 ecr 141749,nop,nop,sack 1 {69785:75497},mptcp dss ack 1998700597], length 0
20:49:59.535807 IP 112.26.0.8.47050 > 112.26.0.1.36395: Flags [.], ack 65501, win 3468, options [nop,nop,TS val 4294884215 ecr 141715,mptcp dss ack 1998697741], length 0
20:49:59.599304 IP 112.26.0.8.47050 > 112.26.0.1.36395: Flags [.], ack 68357, win 3787, options [nop,nop,TS val 4294884645 ecr 141749,nop,nop,sack 1 {69785:76925},mptcp dss ack 1998700597], length 0
20:49:59.599500 IP 112.26.0.8.47050 > 112.26.0.1.36395: Flags [.], ack 68357, win 3787, options [nop,nop,TS val 4294884645 ecr 141749,nop,nop,sack 1 {69785:76925},mptcp dss ack 1998700597], length 0
20:49:59.632126 IP 112.26.0.8.47050 > 112.26.0.1.36395: Flags [.], ack 66929, win 3514, options [nop,nop,TS val 4294884247 ecr 141749,mptcp dss ack 1998699169], length 0
20:49:59.639809 IP 112.26.0.8.47050 > 112.26.0.1.36395: Flags [.], ack 68357, win 3833, options [nop,nop,TS val 4294884739 ecr 141749,nop,nop,sack 1 {69785:78353},mptcp dss ack 1998700597], length 0
20:49:59.640141 IP 112.26.0.8.47050 > 112.26.0.1.36395: Flags [.], ack 68357, win 3833, options [nop,nop,TS val 4294884739 ecr 141749,nop,nop,sack 1 {69785:78353},mptcp dss ack 1998700597], length 0
20:49:59.717981 IP 112.26.0.8.47050 > 112.26.0.1.36395: Flags [.], ack 68357, win 3559, options [nop,nop,TS val 4294884322 ecr 141749,mptcp dss ack 1998700597], length 0
20:49:59.727524 IP 112.26.0.8.47050 > 112.26.0.1.36395: Flags [.], ack 68357, win 3879, options [nop,nop,TS val 4294884821 ecr 141749,nop,nop,sack 1 {69785:79781},mptcp dss ack 1998700597], length 0
20:49:59.727849 IP 112.26.0.8.47050 > 112.26.0.1.36395: Flags [.], ack 68357, win 3879, options [nop,nop,TS val 4294884821 ecr 141749,nop,nop,sack 1 {69785:79781},mptcp dss ack 1998700597], length 0
20:49:59.796668 IP 112.26.0.8.47050 > 112.26.0.1.36395: Flags [.], ack 68357, win 3924, options [nop,nop,TS val 4294884859 ecr 141749,nop,nop,sack 1 {69785:81209},mptcp dss ack 1998700597], length 0
20:49:59.796950 IP 112.26.0.8.47050 > 112.26.0.1.36395: Flags [.], ack 68357, win 3924, options [nop,nop,TS val 4294884859 ecr 141749,nop,nop,sack 1 {69785:81209},mptcp dss ack 1998700597], length 0
20:49:59.805903 IP 112.26.0.8.47050 > 112.26.0.1.36395: Flags [.], ack 68357, win 3650, options [nop,nop,TS val 4294884444 ecr 141749,nop,nop,sack 1 {69785:72641},mptcp dss ack 1998700597], length 0
20:49:59.824173 IP 112.26.0.8.47050 > 112.26.0.1.36395: Flags [.], ack 68357, win 3970, options [nop,nop,TS val 4294884929 ecr 141749,nop,nop,sack 1 {69785:82637},mptcp dss ack 1998700597], length 0
20:49:59.824481 IP 112.26.0.8.47050 > 112.26.0.1.36395: Flags [.], ack 68357, win 3970, options [nop,nop,TS val 4294884929 ecr 141749,nop,nop,sack 1 {69785:82637},mptcp dss ack 1998700597], length 0
20:49:59.830267 IP 112.26.0.8.47050 > 112.26.0.1.36395: Flags [.], ack 68357, win 3696, options [nop,nop,TS val 4294884539 ecr 141749,nop,nop,sack 1 {69785:74069},mptcp dss ack 1998700597], length 0
20:49:59.907594 IP 112.26.0.8.47050 > 112.26.0.1.36395: Flags [.], ack 68357, win 4015, options [nop,nop,TS val 4294885021 ecr 141749,nop,nop,sack 1 {69785:84065},mptcp dss ack 1998700597], length 0
20:49:59.907854 IP 112.26.0.8.47050 > 112.26.0.1.36395: Flags [.], ack 68357, win 4015, options [nop,nop,TS val 4294885021 ecr 141749,nop,nop,sack 1 {69785:84065},mptcp dss ack 1998700597], length 0
20:49:59.933481 IP 112.26.0.8.47050 > 112.26.0.1.36395: Flags [.], ack 68357, win 3742, options [nop,nop,TS val 4294884620 ecr 141749,nop,nop,sack 1 {69785:75497},mptcp dss ack 1998700597], length 0
20:50:00.013562 IP 112.26.0.8.47050 > 112.26.0.1.36395: Flags [.], ack 68357, win 4061, options [nop,nop,TS val 4294885126 ecr 141749,nop,nop,sack 1 {69785:85493},mptcp dss ack 1998700597], length 0
20:50:00.013893 IP 112.26.0.8.47050 > 112.26.0.1.36395: Flags [.], ack 68357, win 4061, options [nop,nop,TS val 4294885126 ecr 141749,nop,nop,sack 1 {69785:85493},mptcp dss ack 1998700597], length 0
20:50:00.038907 IP 112.26.0.8.47050 > 112.26.0.1.36395: Flags [.], ack 68357, win 3787, options [nop,nop,TS val 4294884645 ecr 141749,nop,nop,sack 1 {69785:76925},mptcp dss ack 1998700597], length 0
20:50:00.053734 IP 112.26.0.8.47050 > 112.26.0.1.36395: Flags [.], ack 68357, win 4107, options [nop,nop,TS val 4294885167 ecr 141749,nop,nop,sack 1 {69785:86921},mptcp dss ack 1998700597], length 0
20:50:00.053989 IP 112.26.0.8.47050 > 112.26.0.1.36395: Flags [.], ack 68357, win 4107, options [nop,nop,TS val 4294885167 ecr 141749,nop,nop,sack 1 {69785:86921},mptcp dss ack 1998700597], length 0
20:50:00.122401 IP 112.26.0.8.47050 > 112.26.0.1.36395: Flags [.], ack 68357, win 4152, options [nop,nop,TS val 4294885231 ecr 141749,nop,nop,sack 1 {69785:88349},mptcp dss ack 1998700597], length 0
20:50:00.122743 IP 112.26.0.8.47050 > 112.26.0.1.36395: Flags [.], ack 68357, win 4152, options [nop,nop,TS val 4294885231 ecr 141749,nop,nop,sack 1 {69785:88349},mptcp dss ack 1998700597], length 0
20:50:00.131188 IP 112.26.0.8.47050 > 112.26.0.1.36395: Flags [.], ack 68357, win 3833, options [nop,nop,TS val 4294884739 ecr 141749,nop,nop,sack 1 {69785:78353},mptcp dss ack 1998700597], length 0
20:50:00.148959 IP 112.26.0.8.47050 > 112.26.0.1.36395: Flags [.], ack 68357, win 4198, options [nop,nop,TS val 4294885263 ecr 141749,nop,nop,sack 2 {89777:91205}{69785:88349},mptcp dss ack 1998700597], length 0
20:50:00.149273 IP 112.26.0.8.47050 > 112.26.0.1.36395: Flags [.], ack 68357, win 4198, options [nop,nop,TS val 4294885263 ecr 141749,nop,nop,sack 2 {89777:91205}{69785:88349},mptcp dss ack 1998700597], length 0
20:50:00.216718 IP 112.26.0.8.47050 > 112.26.0.1.36395: Flags [.], ack 68357, win 3879, options [nop,nop,TS val 4294884821 ecr 141749,nop,nop,sack 1 {69785:79781},mptcp dss ack 1998700597], length 0
20:50:00.222714 IP 112.26.0.8.47050 > 112.26.0.1.36395: Flags [.], ack 68357, win 4244, options [nop,nop,TS val 4294885337 ecr 141749,nop,nop,sack 2 {89777:92633}{69785:88349},mptcp dss ack 1998700597], length 0
20:50:00.223050 IP 112.26.0.8.47050 > 112.26.0.1.36395: Flags [.], ack 68357, win 4244, options [nop,nop,TS val 4294885337 ecr 141749,nop,nop,sack 2 {89777:92633}{69785:88349},mptcp dss ack 1998700597], length 0
20:50:00.300307 IP 112.26.0.8.47050 > 112.26.0.1.36395: Flags [.], ack 68357, win 3924, options [nop,nop,TS val 4294884859 ecr 141749,nop,nop,sack 1 {69785:81209},mptcp dss ack 1998700597], length 0
20:50:00.311106 IP 112.26.0.8.47050 > 112.26.0.1.36395: Flags [.], ack 68357, win 4289, options [nop,nop,TS val 4294885424 ecr 141749,nop,nop,sack 2 {89777:94061}{69785:88349},mptcp dss ack 1998700597], length 0
20:50:00.311424 IP 112.26.0.8.47050 > 112.26.0.1.36395: Flags [.], ack 68357, win 4289, options [nop,nop,TS val 4294885424 ecr 141749,nop,nop,sack 2 {89777:94061}{69785:88349},mptcp dss ack 1998700597], length 0
20:50:00.327676 IP 112.26.0.8.47050 > 112.26.0.1.36395: Flags [.], ack 68357, win 3970, options [nop,nop,TS val 4294884929 ecr 141749,nop,nop,sack 1 {69785:82637},mptcp dss ack 1998700597], length 0
20:50:00.360686 IP 112.26.0.8.47050 > 112.26.0.1.36395: Flags [.], ack 88349, win 4335, options [nop,nop,TS val 4294885455 ecr 142940,nop,nop,sack 1 {89777:94061},mptcp dss ack 1998720589], length 0
20:50:00.360857 IP 112.26.0.8.47050 > 112.26.0.1.36395: Flags [.], ack 88349, win 4335, options [nop,nop,TS val 4294885455 ecr 142940,nop,nop,sack 1 {89777:94061},mptcp dss ack 1998720589], length 0
20:50:00.453932 IP 112.26.0.8.47050 > 112.26.0.1.36395: Flags [.], ack 68357, win 4015, options [nop,nop,TS val 4294885021 ecr 141749,nop,nop,sack 1 {69785:84065},mptcp dss ack 1998700597], length 0
20:50:00.559418 IP 112.26.0.8.47050 > 112.26.0.1.36395: Flags [.], ack 68357, win 4061, options [nop,nop,TS val 4294885126 ecr 141749,nop,nop,sack 1 {69785:85493},mptcp dss ack 1998700597], length 0
20:50:00.613017 IP 112.26.0.8.47050 > 112.26.0.1.36395: Flags [.], ack 88349, win 4380, options [nop,nop,TS val 4294885726 ecr 142940,nop,nop,sack 1 {89777:95489},mptcp dss ack 1998720589], length 0
20:50:00.613358 IP 112.26.0.8.47050 > 112.26.0.1.36395: Flags [.], ack 88349, win 4380, options [nop,nop,TS val 4294885726 ecr 142940,nop,nop,sack 1 {89777:95489},mptcp dss ack 1998720589], length 0
20:50:00.626708 IP 112.26.0.8.47050 > 112.26.0.1.36395: Flags [.], ack 68357, win 4107, options [nop,nop,TS val 4294885167 ecr 141749,nop,nop,sack 1 {69785:86921},mptcp dss ack 1998700597], length 0
20:50:00.722751 IP 112.26.0.8.47050 > 112.26.0.1.36395: Flags [.], ack 68357, win 4152, options [nop,nop,TS val 4294885231 ecr 141749,nop,nop,sack 1 {69785:88349},mptcp dss ack 1998700597], length 0
20:50:00.807857 IP 112.26.0.8.47050 > 112.26.0.1.36395: Flags [.], ack 68357, win 4198, options [nop,nop,TS val 4294885263 ecr 141749,nop,nop,sack 2 {89777:91205}{69785:88349},mptcp dss ack 1998700597], length 0
20:50:00.906304 IP 112.26.0.8.47050 > 112.26.0.1.36395: Flags [.], ack 68357, win 4244, options [nop,nop,TS val 4294885337 ecr 141749,nop,nop,sack 2 {89777:92633}{69785:88349},mptcp dss ack 1998700597], length 0
20:50:00.930748 IP 112.26.0.8.47050 > 112.26.0.1.36395: Flags [.], ack 88349, win 7209, options [nop,nop,TS val 4294886043 ecr 142940,nop,nop,sack 1 {89777:96917},mptcp dss ack 1998720589], length 0
20:50:00.931097 IP 112.26.0.8.47050 > 112.26.0.1.36395: Flags [.], ack 88349, win 7209, options [nop,nop,TS val 4294886043 ecr 142940,nop,nop,sack 1 {89777:96917},mptcp dss ack 1998720589], length 0
20:50:00.974508 IP 112.26.0.8.47050 > 112.26.0.1.36395: Flags [.], ack 68357, win 4289, options [nop,nop,TS val 4294885424 ecr 141749,nop,nop,sack 2 {89777:94061}{69785:88349},mptcp dss ack 1998700597], length 0
20:50:01.029620 IP 112.26.0.8.47050 > 112.26.0.1.36395: Flags [.], ack 88349, win 7255, options [nop,nop,TS val 4294886144 ecr 142940,nop,nop,sack 1 {89777:98345},mptcp dss ack 1998720589], length 0
20:50:01.029928 IP 112.26.0.8.47050 > 112.26.0.1.36395: Flags [.], ack 88349, win 7255, options [nop,nop,TS val 4294886144 ecr 142940,nop,nop,sack 1 {89777:98345},mptcp dss ack 1998720589], length 0
