20:50:00.362612 IP 112.26.1.8.37309 > 112.26.1.1.36395: Flags [S], seq 3631728029, win 65535, options [mss 1460,sackOK,TS val 4294885456 ecr 0,nop,wscale 6,mptcp join id 3 token 0xca9948a6 nonce 0x9628a24a], length 0
20:50:00.600637 IP 112.26.1.1.36395 > 112.26.1.8.37309: Flags [S.], seq 4239519382, ack 3631728030, win 65535, options [mss 1460,sackOK,TS val 143584 ecr 4294885456,nop,wscale 6,mptcp join id 3 hmac 0x420f70e2718e0e25 nonce 0x1ef4c91c], length 0
20:50:00.645251 IP 112.26.1.1.36395 > 112.26.1.8.37309: Flags [S.], seq 4239519382, ack 3631728030, win 65535, options [mss 1460,sackOK,TS val 143584 ecr 4294885456,nop,wscale 6,mptcp join id 3 hmac 0x420f70e2718e0e25 nonce 0x1ef4c91c], length 0
20:50:00.717131 IP 112.26.1.8.37309 > 112.26.1.1.36395: Flags [.], ack 1, win 7118, options [nop,nop,TS val 4294885765 ecr 143584,mptcp join hmac 0x019757062a4f6cff608d92f8ab877b4267b827bf], length 0
20:50:00.753910 IP 112.26.1.1.36395 > 112.26.1.8.37309: Flags [.], ack 1, win 2678, options [nop,nop,TS val 143859 ecr 4294885765,mptcp dss ack 3836451400], length 0
20:50:00.754143 IP 112.26.1.1.36395 > 112.26.1.8.37309: Flags [.], ack 1, win 2678, options [nop,nop,TS val 143859 ecr 4294885765,mptcp dss ack 3836451400], length 0
20:50:00.836455 IP 112.26.1.1.36395 > 112.26.1.8.37309: Flags [.], seq 1:1429, ack 1, win 2678, options [nop,nop,TS val 143859 ecr 4294885765,mptcp dss ack 3836451400 seq 1998734869 subseq 1 len 1428 csum 0x1bdd], length 1428
20:50:00.836719 IP 112.26.1.1.36395 > 112.26.1.8.37309: Flags [.], seq 1:1429, ack 1, win 2678, options [nop,nop,TS val 143859 ecr 4294885765,mptcp dss ack 3836451400 seq 1998734869 subseq 1 len 1428 csum 0x1bdd], length 1428
20:50:00.846722 IP 112.26.1.8.37309 > 112.26.1.1.36395: Flags [.], ack 1429, win 7164, options [nop,nop,TS val 4294885958 ecr 143859,mptcp dss ack 1998720589], length 0
20:50:01.096774 IP 112.26.1.1.36395 > 112.26.1.8.37309: Flags [.], seq 1429:2857, ack 1, win 2678, options [nop,nop,TS val 143859 ecr 4294885765,mptcp dss ack 3836451400 seq 1998736297 subseq 1429 len 1428 csum 0x1380], length 1428
20:50:01.097034 IP 112.26.1.1.36395 > 112.26.1.8.37309: Flags [.], seq 1429:2857, ack 1, win 2678, options [nop,nop,TS val 143859 ecr 4294885765,mptcp dss ack 3836451400 seq 1998736297 subseq 1429 len 1428 csum 0x1380], length 1428
20:50:01.113006 IP 112.26.1.8.37309 > 112.26.1.1.36395: Flags [.], ack 2857, win 7346, options [nop,nop,TS val 4294886217 ecr 143859,mptcp dss ack 1998720589], length 0
20:50:01.282644 IP 112.26.1.1.36395 > 112.26.1.8.37309: Flags [.], seq 2857:4285, ack 1, win 2678, options [nop,nop,TS val 143860 ecr 4294885765,mptcp dss ack 3836451400 seq 1998737725 subseq 2857 len 1428 csum 0x1e31], length 1428
20:50:01.282952 IP 112.26.1.1.36395 > 112.26.1.8.37309: Flags [.], seq 2857:4285, ack 1, win 2678, options [nop,nop,TS val 143860 ecr 4294885765,mptcp dss ack 3836451400 seq 1998737725 subseq 2857 len 1428 csum 0x1e31], length 1428
20:50:01.287537 IP 112.26.1.8.37309 > 112.26.1.1.36395: Flags [.], ack 4285, win 7574, options [nop,nop,TS val 4294886400 ecr 143860,mptcp dss ack 1998720589], length 0
20:50:01.389321 IP 112.26.1.1.36395 > 112.26.1.8.37309: Flags [.], seq 4285:5713, ack 1, win 2678, options [nop,nop,TS val 143860 ecr 4294885765,mptcp dss ack 3836451400 seq 1998739153 subseq 4285 len 1428 csum 0x7758], length 1428
20:50:01.389536 IP 112.26.1.1.36395 > 112.26.1.8.37309: Flags [.], seq 4285:5713, ack 1, win 2678, options [nop,nop,TS val 143860 ecr 4294885765,mptcp dss ack 3836451400 seq 1998739153 subseq 4285 len 1428 csum 0x7758], length 1428
20:50:01.449192 IP 112.26.1.8.37309 > 112.26.1.1.36395: Flags [.], ack 5713, win 7620, options [nop,nop,TS val 4294886509 ecr 143860,mptcp dss ack 1998720589], length 0
20:50:01.669329 IP 112.26.1.1.36395 > 112.26.1.8.37309: Flags [.], seq 5713:7141, ack 1, win 2678, options [nop,nop,TS val 143860 ecr 4294885765,mptcp dss ack 3836451400 seq 1998740581 subseq 5713 len 1428 csum 0xfc8b], length 1428
20:50:01.669622 IP 112.26.1.1.36395 > 112.26.1.8.37309: Flags [.], seq 5713:7141, ack 1, win 2678, options [nop,nop,TS val 143860 ecr 4294885765,mptcp dss ack 3836451400 seq 1998740581 subseq 5713 len 1428 csum 0xfc8b], length 1428
20:50:01.674328 IP 112.26.1.8.37309 > 112.26.1.1.36395: Flags [.], ack 7141, win 7894, options [nop,nop,TS val 4294886788 ecr 143860,mptcp dss ack 1998742009], length 0
20:50:01.800289 IP 112.26.1.1.36395 > 112.26.1.8.37309: Flags [.], seq 7141:8569, ack 1, win 2678, options [nop,nop,TS val 143860 ecr 4294885765,mptcp dss ack 3836451400 seq 1998742009 subseq 7141 len 1428 csum 0x204d], length 1428
20:50:01.800522 IP 112.26.1.1.36395 > 112.26.1.8.37309: Flags [.], seq 7141:8569, ack 1, win 2678, options [nop,nop,TS val 143860 ecr 4294885765,mptcp dss ack 3836451400 seq 1998742009 subseq 7141 len 1428 csum 0x204d], length 1428
20:50:01.804927 IP 112.26.1.8.37309 > 112.26.1.1.36395: Flags [.], ack 8569, win 7985, options [nop,nop,TS val 4294886918 ecr 143860,mptcp dss ack 1998743437], length 0
20:50:01.965393 IP 112.26.1.1.36395 > 112.26.1.8.37309: Flags [.], seq 8569:9997, ack 1, win 2678, options [nop,nop,TS val 143861 ecr 4294885765,mptcp dss ack 3836451400 seq 1998743437 subseq 8569 len 1428 csum 0x4ec8], length 1428
20:50:01.965664 IP 112.26.1.1.36395 > 112.26.1.8.37309: Flags [.], seq 8569:9997, ack 1, win 2678, options [nop,nop,TS val 143861 ecr 4294885765,mptcp dss ack 3836451400 seq 1998743437 subseq 8569 len 1428 csum 0x4ec8], length 1428
20:50:01.989660 IP 112.26.1.8.37309 > 112.26.1.1.36395: Flags [.], ack 9997, win 8213, options [nop,nop,TS val 4294887083 ecr 143861,mptcp dss ack 1998744865], length 0
20:50:02.175930 IP 112.26.1.1.36395 > 112.26.1.8.37309: Flags [.], seq 9997:11425, ack 1, win 2678, options [nop,nop,TS val 143861 ecr 4294885765,mptcp dss ack 3836451400 seq 1998744865 subseq 9997 len 1428 csum 0x151], length 1428
20:50:02.176195 IP 112.26.1.1.36395 > 112.26.1.8.37309: Flags [.], seq 9997:11425, ack 1, win 2678, options [nop,nop,TS val 143861 ecr 4294885765,mptcp dss ack 3836451400 seq 1998744865 subseq 9997 len 1428 csum 0x151], length 1428
20:50:02.181093 IP 112.26.1.8.37309 > 112.26.1.1.36395: Flags [.], ack 11425, win 8487, options [nop,nop,TS val 4294887295 ecr 143861,mptcp dss ack 1998746293], length 0
20:50:02.338387 IP 112.26.1.1.36395 > 112.26.1.8.37309: Flags [.], seq 11425:12853, ack 1, win 2678, options [nop,nop,TS val 143861 ecr 4294885765,mptcp dss ack 3836451400 seq 1998746293 subseq 11425 len 1428 csum 0xef57], length 1428
20:50:02.338645 IP 112.26.1.1.36395 > 112.26.1.8.37309: Flags [.], seq 11425:12853, ack 1, win 2678, options [nop,nop,TS val 143861 ecr 4294885765,mptcp dss ack 3836451400 seq 1998746293 subseq 11425 len 1428 csum 0xef57], length 1428
20:50:02.344777 IP 112.26.1.8.37309 > 112.26.1.1.36395: Flags [.], ack 12853, win 8669, options [nop,nop,TS val 4294887458 ecr 143861,mptcp dss ack 1998747721], length 0
20:50:02.502633 IP 112.26.1.1.36395 > 112.26.1.8.37309: Flags [.], seq 12853:14281, ack 1, win 2678, options [nop,nop,TS val 143861 ecr 4294885765,mptcp dss ack 3836451400 seq 1998747721 subseq 12853 len 1428 csum 0x9e20], length 1428
20:50:02.502886 IP 112.26.1.1.36395 > 112.26.1.8.37309: Flags [.], seq 12853:14281, ack 1, win 2678, options [nop,nop,TS val 143861 ecr 4294885765,mptcp dss ack 3836451400 seq 1998747721 subseq 12853 len 1428 csum 0x9e20], length 1428
20:50:02.510007 IP 112.26.1.8.37309 > 112.26.1.1.36395: Flags [.], ack 14281, win 8806, options [nop,nop,TS val 4294887622 ecr 143861,mptcp dss ack 1998764857], length 0
20:50:02.735574 IP 112.26.1.1.36395 > 112.26.1.8.37309: Flags [.], seq 14281:15709, ack 1, win 4017, options [nop,nop,TS val 144035 ecr 4294885958,mptcp dss ack 3836451400 seq 1998771997 subseq 14281 len 1428 csum 0xa8c2], length 1428
20:50:02.739856 IP 112.26.1.8.37309 > 112.26.1.1.36395: Flags [.], ack 15709, win 8989, options [nop,nop,TS val 4294887853 ecr 144035,mptcp dss ack 1998766285], length 0
20:50:02.853782 IP 112.26.1.1.36395 > 112.26.1.8.37309: Flags [.], seq 15709:17137, ack 1, win 4017, options [nop,nop,TS val 144035 ecr 4294885958,mptcp dss ack 3836451400 seq 1998773425 subseq 15709 len 1428 csum 0xb9e1], length 1428
20:50:02.922556 IP 112.26.1.8.37309 > 112.26.1.1.36395: Flags [.], ack 17137, win 9217, options [nop,nop,TS val 4294888035 ecr 144035,mptcp dss ack 1998766285], length 0
20:50:02.982106 IP 112.26.1.1.36395 > 112.26.1.8.37309: Flags [.], seq 17137:18565, ack 1, win 4017, options [nop,nop,TS val 144295 ecr 4294886217,mptcp dss ack 3836451400 seq 1998779137 subseq 17137 len 1428 csum 0xfe18], length 1428
20:50:03.080369 IP 112.26.1.8.37309 > 112.26.1.1.36395: Flags [.], ack 18565, win 9445, options [nop,nop,TS val 4294888194 ecr 144295,mptcp dss ack 1998767713], length 0
20:50:03.142855 IP 112.26.1.1.36395 > 112.26.1.8.37309: Flags [.], seq 18565:19993, ack 1, win 4017, options [nop,nop,TS val 144295 ecr 4294886217,mptcp dss ack 3836451400 seq 1998780565 subseq 18565 len 1428 csum 0x3e86], length 1428
20:50:03.355419 IP 112.26.1.1.36395 > 112.26.1.8.37309: Flags [.], seq 19993:21421, ack 1, win 4017, options [nop,nop,TS val 144490 ecr 4294886400,mptcp dss ack 3836451400 seq 1998793417 subseq 19993 len 1428 csum 0xef17], length 1428
20:50:03.421912 IP 112.26.1.1.36395 > 112.26.1.8.37309: Flags [.], seq 21421:22849, ack 1, win 4017, options [nop,nop,TS val 144490 ecr 4294886400,mptcp dss ack 3836451400 seq 1998794845 subseq 21421 len 1428 csum 0x12ea], length 1428
20:50:03.464358 IP 112.26.1.8.37309 > 112.26.1.1.36395: Flags [.], ack 18565, win 9810, options [nop,nop,TS val 4294888573 ecr 144295,nop,nop,sack 1 {34273:35701},mptcp dss ack 1998780565], length 0
20:50:03.537929 IP 112.26.1.1.36395 > 112.26.1.8.37309: Flags [.], seq 22849:24277, ack 1, win 4017, options [nop,nop,TS val 144688 ecr 4294886509,mptcp dss ack 3836451400 seq 1998800557 subseq 22849 len 1428 csum 0xb1d3], length 1428
20:50:03.565514 IP 112.26.1.8.37309 > 112.26.1.1.36395: Flags [.], ack 19993, win 9947, options [nop,nop,TS val 4294888679 ecr 144295,nop,nop,sack 1 {34273:35701},mptcp dss ack 1998790561], length 0
20:50:03.635835 IP 112.26.1.1.36395 > 112.26.1.8.37309: Flags [.], seq 24277:25705, ack 1, win 4017, options [nop,nop,TS val 144688 ecr 4294886509,mptcp dss ack 3836451400 seq 1998801985 subseq 24277 len 1428 csum 0x75f4], length 1428
20:50:03.701970 IP 112.26.1.8.37309 > 112.26.1.1.36395: Flags [.], ack 21421, win 10038, options [nop,nop,TS val 4294888742 ecr 144490,nop,nop,sack 1 {34273:35701},mptcp dss ack 1998790561], length 0
20:50:03.806364 IP 112.26.1.8.37309 > 112.26.1.1.36395: Flags [.], ack 22849, win 10175, options [nop,nop,TS val 4294888846 ecr 144490,nop,nop,sack 1 {34273:35701},mptcp dss ack 1998790561], length 0
20:50:03.813477 IP 112.26.1.1.36395 > 112.26.1.8.37309: Flags [.], seq 28561:29989, ack 1, win 4017, options [nop,nop,TS val 144986 ecr 4294886918,mptcp dss ack 3836451400 seq 1998813409 subseq 28561 len 1428 csum 0x3e0b], length 1428
20:50:03.933801 IP 112.26.1.1.36395 > 112.26.1.8.37309: Flags [.], seq 31417:32845, ack 1, win 4017, options [nop,nop,TS val 145165 ecr 4294887083,mptcp dss ack 3836451400 seq 1998821977 subseq 31417 len 1428 csum 0xe563], length 1428
20:50:04.069568 IP 112.26.1.8.37309 > 112.26.1.1.36395: Flags [.], ack 24277, win 10540, options [nop,nop,TS val 4294889183 ecr 144688,nop,nop,sack 1 {34273:35701},mptcp dss ack 1998790561], length 0
20:50:04.292149 IP 112.26.1.8.37309 > 112.26.1.1.36395: Flags [.], ack 25705, win 10859, options [nop,nop,TS val 4294889404 ecr 144688,nop,nop,sack 1 {34273:35701},mptcp dss ack 1998790561], length 0
20:50:04.513877 IP 112.26.1.8.37309 > 112.26.1.1.36395: Flags [.], ack 25705, win 11087, options [nop,nop,TS val 4294889625 ecr 144688,nop,nop,sack 1 {34273:37129},mptcp dss ack 1998790561], length 0
20:50:04.707833 IP 112.26.1.8.37309 > 112.26.1.1.36395: Flags [.], ack 25705, win 11270, options [nop,nop,TS val 4294889818 ecr 144688,nop,nop,sack 2 {28561:29989}{34273:37129},mptcp dss ack 1998790561], length 0
20:50:04.784333 IP 112.26.1.8.37309 > 112.26.1.1.36395: Flags [.], ack 25705, win 11407, options [nop,nop,TS val 4294889898 ecr 144688,nop,nop,sack 2 {31417:32845}{28561:29989},mptcp dss ack 1998790561], length 0
20:50:05.011134 IP 112.26.1.8.37309 > 112.26.1.1.36395: Flags [.], ack 25705, win 11635, options [nop,nop,TS val 4294890121 ecr 144688,nop,nop,sack 2 {39985:41413}{31417:32845},mptcp dss ack 1998790561], length 0
20:50:05.131908 IP 112.26.1.8.37309 > 112.26.1.1.36395: Flags [.], ack 25705, win 11772, options [nop,nop,TS val 4294890245 ecr 144688,nop,nop,sack 2 {39985:42841}{31417:32845},mptcp dss ack 1998790561], length 0
20:50:05.220379 IP 112.26.1.8.37309 > 112.26.1.1.36395: Flags [.], ack 25705, win 11909, options [nop,nop,TS val 4294890333 ecr 144688,nop,nop,sack 2 {39985:44269}{31417:32845},mptcp dss ack 1998790561], length 0
20:50:05.425929 IP 112.26.1.8.37309 > 112.26.1.1.36395: Flags [.], ack 25705, win 12137, options [nop,nop,TS val 4294890538 ecr 144688,nop,nop,sack 2 {39985:45697}{31417:32845},mptcp dss ack 1998806269], length 0
20:50:05.525526 IP 112.26.1.8.37309 > 112.26.1.1.36395: Flags [.], ack 25705, win 12182, options [nop,nop,TS val 4294890583 ecr 144688,nop,nop,sack 2 {39985:47125}{31417:32845},mptcp dss ack 1998806269], length 0
20:50:05.701538 IP 112.26.1.8.37309 > 112.26.1.1.36395: Flags [.], ack 25705, win 12319, options [nop,nop,TS val 4294890815 ecr 144688,nop,nop,sack 2 {39985:48553}{31417:32845},mptcp dss ack 1998806269], length 0
20:50:05.798452 IP 112.26.1.8.37309 > 112.26.1.1.36395: Flags [.], ack 25705, win 12456, options [nop,nop,TS val 4294890912 ecr 144688,nop,nop,sack 2 {39985:49981}{31417:32845},mptcp dss ack 1998806269], length 0
20:50:06.193352 IP 112.26.1.8.37309 > 112.26.1.1.36395: Flags [.], ack 25705, win 12821, options [nop,nop,TS val 4294891307 ecr 144688,nop,nop,sack 2 {18565:19993}{39985:49981},mptcp dss ack 1998806269], length 0
20:50:06.436538 IP 112.26.1.8.37309 > 112.26.1.1.36395: Flags [.], ack 25705, win 13049, options [nop,nop,TS val 4294891551 ecr 144688,nop,nop,sack 2 {51409:52837}{39985:49981},mptcp dss ack 1998806269], length 0
20:50:06.529419 IP 112.26.1.8.37309 > 112.26.1.1.36395: Flags [.], ack 25705, win 13186, options [nop,nop,TS val 4294891606 ecr 144688,nop,nop,sack 2 {51409:54265}{39985:49981},mptcp dss ack 1998806269], length 0
20:50:06.704927 IP 112.26.1.8.37309 > 112.26.1.1.36395: Flags [.], ack 25705, win 13414, options [nop,nop,TS val 4294891818 ecr 144688,nop,nop,sack 2 {51409:55693}{39985:49981},mptcp dss ack 1998806269], length 0
20:50:06.913941 IP 112.26.1.8.37309 > 112.26.1.1.36395: Flags [.], ack 25705, win 13642, options [nop,nop,TS val 4294892027 ecr 144688,nop,nop,sack 2 {57121:58549}{51409:55693},mptcp dss ack 1998806269], length 0
20:50:07.117147 IP 112.26.1.8.37309 > 112.26.1.1.36395: Flags [.], ack 25705, win 13870, options [nop,nop,TS val 4294892230 ecr 144688,nop,nop,sack 2 {61405:62833}{57121:58549},mptcp dss ack 1998806269], length 0
20:50:07.226775 IP 112.26.1.8.37309 > 112.26.1.1.36395: Flags [.], ack 25705, win 14007, options [nop,nop,TS val 4294892315 ecr 144688,nop,nop,sack 2 {61405:64261}{57121:58549},mptcp dss ack 1998806269], length 0
20:50:07.552217 IP 112.26.1.8.37309 > 112.26.1.1.36395: Flags [.], ack 25705, win 14372, options [nop,nop,TS val 4294892664 ecr 144688,nop,nop,sack 2 {67117:68545}{61405:64261},mptcp dss ack 1998806269], length 0
20:50:07.640497 IP 112.26.1.8.37309 > 112.26.1.1.36395: Flags [.], ack 25705, win 14555, options [nop,nop,TS val 4294892754 ecr 144688,nop,nop,sack 2 {69973:71401}{67117:68545},mptcp dss ack 1998806269], length 0
20:50:07.722902 IP 112.26.1.8.37309 > 112.26.1.1.36395: Flags [.], ack 25705, win 14692, options [nop,nop,TS val 4294892836 ecr 144688,nop,nop,sack 2 {69973:72829}{67117:68545},mptcp dss ack 1998806269], length 0
20:50:07.820523 IP 112.26.1.8.37309 > 112.26.1.1.36395: Flags [.], ack 25705, win 14783, options [nop,nop,TS val 4294892934 ecr 144688,nop,nop,sack 2 {69973:74257}{67117:68545},mptcp dss ack 1998806269], length 0
20:50:07.925764 IP 112.26.1.8.37309 > 112.26.1.1.36395: Flags [.], ack 25705, win 14920, options [nop,nop,TS val 4294893039 ecr 144688,nop,nop,sack 2 {69973:75685}{67117:68545},mptcp dss ack 1998806269], length 0
20:50:08.254931 IP 112.26.1.8.37309 > 112.26.1.1.36395: Flags [.], ack 25705, win 15330, options [nop,nop,TS val 4294893368 ecr 144688,nop,nop,sack 2 {69973:77113}{67117:68545},mptcp dss ack 1998806269], length 0
20:50:08.399457 IP 112.26.1.8.37309 > 112.26.1.1.36395: Flags [.], ack 25705, win 15513, options [nop,nop,TS val 4294893513 ecr 144688,nop,nop,sack 2 {79969:81397}{69973:77113},mptcp dss ack 1998806269], length 0
20:50:08.489592 IP 112.26.1.8.37309 > 112.26.1.1.36395: Flags [.], ack 25705, win 15559, options [nop,nop,TS val 4294893602 ecr 144688,nop,nop,sack 2 {79969:82825}{69973:77113},mptcp dss ack 1998806269], length 0
20:50:08.704853 IP 112.26.1.8.37309 > 112.26.1.1.36395: Flags [.], ack 27133, win 15832, options [nop,nop,TS val 4294893817 ecr 150852,nop,nop,sack 2 {79969:82825}{69973:77113},mptcp dss ack 1998807697], length 0
20:50:08.804503 IP 112.26.1.8.37309 > 112.26.1.1.36395: Flags [.], ack 29989, win 16015, options [nop,nop,TS val 4294893917 ecr 151012,nop,nop,sack 2 {79969:82825}{69973:77113},mptcp dss ack 1998814837], length 0
20:50:09.057287 IP 112.26.1.8.37309 > 112.26.1.1.36395: Flags [.], ack 32845, win 16289, options [nop,nop,TS val 4294894168 ecr 151312,nop,nop,sack 2 {79969:82825}{69973:77113},mptcp dss ack 1998823405], length 0
20:50:09.217565 IP 112.26.1.8.37309 > 112.26.1.1.36395: Flags [.], ack 37129, win 16517, options [nop,nop,TS val 4294894330 ecr 151353,nop,nop,sack 2 {79969:82825}{69973:77113},mptcp dss ack 1998839113], length 0
20:50:09.436524 IP 112.26.1.8.37309 > 112.26.1.1.36395: Flags [.], ack 38557, win 16790, options [nop,nop,TS val 4294894549 ecr 151616,nop,nop,sack 2 {79969:82825}{69973:77113},mptcp dss ack 1998840541], length 0
20:50:09.614052 IP 112.26.1.8.37309 > 112.26.1.1.36395: Flags [.], ack 49981, win 16973, options [nop,nop,TS val 4294894727 ecr 151853,nop,nop,sack 2 {79969:82825}{69973:77113},mptcp dss ack 1998896233], length 0
20:50:09.785551 IP 112.26.1.8.37309 > 112.26.1.1.36395: Flags [.], ack 55693, win 17201, options [nop,nop,TS val 4294894898 ecr 151947,nop,nop,sack 2 {79969:82825}{69973:77113},mptcp dss ack 1998909085], length 0
20:50:09.927542 IP 112.26.1.8.37309 > 112.26.1.1.36395: Flags [.], ack 58549, win 17384, options [nop,nop,TS val 4294895040 ecr 152079,nop,nop,sack 2 {79969:82825}{69973:77113},mptcp dss ack 1998909085], length 0
20:50:10.120739 IP 112.26.1.8.37309 > 112.26.1.1.36395: Flags [.], ack 59977, win 17612, options [nop,nop,TS val 4294895234 ecr 152488,nop,nop,sack 2 {79969:82825}{69973:77113},mptcp dss ack 1998909085], length 0
20:50:10.250104 IP 112.26.1.8.37309 > 112.26.1.1.36395: Flags [.], ack 64261, win 17794, options [nop,nop,TS val 4294895364 ecr 152488,nop,nop,sack 2 {79969:82825}{69973:77113},mptcp dss ack 1998909085], length 0
20:50:10.507067 IP 112.26.1.8.37309 > 112.26.1.1.36395: Flags [.], ack 65689, win 18114, options [nop,nop,TS val 4294895620 ecr 152856,nop,nop,sack 2 {79969:82825}{69973:77113},mptcp dss ack 1998934789], length 0
20:50:10.658258 IP 112.26.1.8.37309 > 112.26.1.1.36395: Flags [.], ack 68545, win 18342, options [nop,nop,TS val 4294895772 ecr 152856,nop,nop,sack 2 {79969:82825}{69973:77113},mptcp dss ack 1998934789], length 0
20:50:10.795093 IP 112.26.1.8.37309 > 112.26.1.1.36395: Flags [.], ack 77113, win 18524, options [nop,nop,TS val 4294895908 ecr 152856,nop,nop,sack 1 {79969:82825},mptcp dss ack 1998934789], length 0
20:50:11.012467 IP 112.26.1.8.37309 > 112.26.1.1.36395: Flags [.], ack 78541, win 18798, options [nop,nop,TS val 4294896125 ecr 152856,nop,nop,sack 1 {79969:82825},mptcp dss ack 1998934789], length 0
20:50:11.111790 IP 112.26.1.8.37309 > 112.26.1.1.36395: Flags [.], ack 82825, win 18844, options [nop,nop,TS val 4294896225 ecr 152856,mptcp dss ack 1998934789], length 0
20:50:11.300979 IP 112.26.1.8.37309 > 112.26.1.1.36395: Flags [.], ack 84253, win 19117, options [nop,nop,TS val 4294896412 ecr 152856,mptcp dss ack 1998934789], length 0
20:50:11.469135 IP 112.26.1.8.37309 > 112.26.1.1.36395: Flags [.], ack 84253, win 19300, options [nop,nop,TS val 4294896583 ecr 152856,nop,nop,sack 1 {87109:88537},mptcp dss ack 1998934789], length 0
20:50:11.645604 IP 112.26.1.8.37309 > 112.26.1.1.36395: Flags [.], ack 84253, win 19574, options [nop,nop,TS val 4294896759 ecr 152856,nop,nop,sack 1 {87109:89965},mptcp dss ack 1998934789], length 0
20:50:11.893685 IP 112.26.1.8.37309 > 112.26.1.1.36395: Flags [.], ack 84253, win 19893, options [nop,nop,TS val 4294897007 ecr 152856,nop,nop,sack 2 {91393:92821}{87109:89965},mptcp dss ack 1998934789], length 0
20:50:12.039152 IP 112.26.1.8.37309 > 112.26.1.1.36395: Flags [.], ack 84253, win 20121, options [nop,nop,TS val 4294897153 ecr 152856,nop,nop,sack 2 {91393:94249}{87109:89965},mptcp dss ack 1999084729], length 0
20:50:12.135331 IP 112.26.1.8.37309 > 112.26.1.1.36395: Flags [.], ack 84253, win 20258, options [nop,nop,TS val 4294897247 ecr 152856,nop,nop,sack 2 {95677:97105}{91393:94249},mptcp dss ack 1999084729], length 0
20:50:12.318396 IP 112.26.1.8.37309 > 112.26.1.1.36395: Flags [.], ack 84253, win 20532, options [nop,nop,TS val 4294897432 ecr 152856,nop,nop,sack 2 {95677:98533}{91393:94249},mptcp dss ack 1999090441], length 0
20:50:12.438281 IP 112.26.1.8.37309 > 112.26.1.1.36395: Flags [.], ack 84253, win 20577, options [nop,nop,TS val 4294897551 ecr 152856,nop,nop,sack 2 {101389:102817}{95677:98533},mptcp dss ack 1999090441], length 0
20:50:12.607481 IP 112.26.1.8.37309 > 112.26.1.1.36395: Flags [.], ack 84253, win 20851, options [nop,nop,TS val 4294897720 ecr 152856,nop,nop,sack 2 {101389:104245}{95677:98533},mptcp dss ack 1999090441], length 0
20:50:12.786753 IP 112.26.1.8.37309 > 112.26.1.1.36395: Flags [.], ack 84253, win 21034, options [nop,nop,TS val 4294897900 ecr 152856,nop,nop,sack 2 {101389:105673}{95677:98533},mptcp dss ack 1999090441], length 0
20:50:12.929786 IP 112.26.1.8.37309 > 112.26.1.1.36395: Flags [.], ack 84253, win 21262, options [nop,nop,TS val 4294898043 ecr 152856,nop,nop,sack 2 {107101:108529}{101389:105673},mptcp dss ack 1999090441], length 0
20:50:13.073429 IP 112.26.1.8.37309 > 112.26.1.1.36395: Flags [.], ack 84253, win 21444, options [nop,nop,TS val 4294898187 ecr 152856,nop,nop,sack 2 {107101:109957}{101389:105673},mptcp dss ack 1999090441], length 0
20:50:13.253547 IP 112.26.1.8.37309 > 112.26.1.1.36395: Flags [.], ack 84253, win 21627, options [nop,nop,TS val 4294898367 ecr 152856,nop,nop,sack 2 {107101:111385}{101389:105673},mptcp dss ack 1999090441], length 0
20:50:13.356194 IP 112.26.1.8.37309 > 112.26.1.1.36395: Flags [.], ack 84253, win 21809, options [nop,nop,TS val 4294898452 ecr 152856,nop,nop,sack 2 {107101:112813}{101389:105673},mptcp dss ack 1999090441], length 0
20:50:13.581987 IP 112.26.1.8.37309 > 112.26.1.1.36395: Flags [.], ack 84253, win 22083, options [nop,nop,TS val 4294898693 ecr 152856,nop,nop,sack 2 {107101:114241}{101389:105673},mptcp dss ack 1999090441], length 0
20:50:13.719159 IP 112.26.1.8.37309 > 112.26.1.1.36395: Flags [.], ack 84253, win 22220, options [nop,nop,TS val 4294898833 ecr 152856,nop,nop,sack 2 {107101:115669}{101389:105673},mptcp dss ack 1999090441], length 0
20:50:13.791755 IP 112.26.1.8.37309 > 112.26.1.1.36395: Flags [.], ack 84253, win 22357, options [nop,nop,TS val 4294898892 ecr 152856,nop,nop,sack 2 {107101:117097}{101389:105673},mptcp dss ack 1999090441], length 0
20:50:14.019690 IP 112.26.1.8.37309 > 112.26.1.1.36395: Flags [.], ack 84253, win 22585, options [nop,nop,TS val 4294899134 ecr 152856,nop,nop,sack 2 {118525:119953}{107101:117097},mptcp dss ack 1999090441], length 0
20:50:14.219009 IP 112.26.1.8.37309 > 112.26.1.1.36395: Flags [.], ack 84253, win 22904, options [nop,nop,TS val 4294899331 ecr 152856,nop,nop,sack 2 {121381:122809}{118525:119953},mptcp dss ack 1999090441], length 0
20:50:14.459328 IP 112.26.1.8.37309 > 112.26.1.1.36395: Flags [.], ack 84253, win 23132, options [nop,nop,TS val 4294899572 ecr 152856,nop,nop,sack 2 {124237:125665}{121381:122809},mptcp dss ack 1999090441], length 0
20:50:14.592955 IP 112.26.1.8.37309 > 112.26.1.1.36395: Flags [.], ack 84253, win 23315, options [nop,nop,TS val 4294899703 ecr 152856,nop,nop,sack 2 {124237:127093}{121381:122809},mptcp dss ack 1999090441], length 0
20:50:14.758575 IP 112.26.1.8.37309 > 112.26.1.1.36395: Flags [.], ack 84253, win 23406, options [nop,nop,TS val 4294899871 ecr 152856,nop,nop,sack 2 {128521:129949}{124237:127093},mptcp dss ack 1999090441], length 0
20:50:14.918163 IP 112.26.1.8.37309 > 112.26.1.1.36395: Flags [.], ack 84253, win 23406, options [nop,nop,TS val 4294900032 ecr 152856,nop,nop,sack 2 {128521:131377}{124237:127093},mptcp dss ack 1999090441], length 0
20:50:15.107559 IP 112.26.1.8.37309 > 112.26.1.1.36395: Flags [.], ack 84253, win 23406, options [nop,nop,TS val 4294900221 ecr 152856,nop,nop,sack 2 {128521:132805}{124237:127093},mptcp dss ack 1999090441], length 0
20:50:15.259925 IP 112.26.1.8.37309 > 112.26.1.1.36395: Flags [.], ack 84253, win 23406, options [nop,nop,TS val 4294900373 ecr 152856,nop,nop,sack 2 {128521:134233}{124237:127093},mptcp dss ack 1999090441], length 0
20:50:15.402460 IP 112.26.1.8.37309 > 112.26.1.1.36395: Flags [.], ack 85681, win 23317, options [nop,nop,TS val 4294900516 ecr 157448,nop,nop,sack 2 {128521:134233}{124237:127093},mptcp dss ack 1999096153], length 0
20:50:15.563117 IP 112.26.1.8.37309 > 112.26.1.1.36395: Flags [.], ack 89965, win 23206, options [nop,nop,TS val 4294900675 ecr 157781,nop,nop,sack 2 {128521:134233}{124237:127093},mptcp dss ack 1999103293], length 0
20:50:15.792096 IP 112.26.1.8.37309 > 112.26.1.1.36395: Flags [.], ack 94249, win 23028, options [nop,nop,TS val 4294900905 ecr 158038,nop,nop,sack 2 {128521:134233}{124237:127093},mptcp dss ack 1999114717], length 0
20:50:15.886251 IP 112.26.1.8.37309 > 112.26.1.1.36395: Flags [.], ack 98533, win 23066, options [nop,nop,TS val 4294901000 ecr 158038,nop,nop,sack 2 {128521:134233}{124237:127093},mptcp dss ack 1999140421], length 0
20:50:16.088956 IP 112.26.1.8.37309 > 112.26.1.1.36395: Flags [.], ack 99961, win 23308, options [nop,nop,TS val 4294901202 ecr 158038,nop,nop,sack 2 {128521:134233}{124237:127093},mptcp dss ack 1999141849], length 0
20:50:16.203279 IP 112.26.1.8.37309 > 112.26.1.1.36395: Flags [.], ack 105673, win 23231, options [nop,nop,TS val 4294901317 ecr 158242,nop,nop,sack 2 {128521:134233}{124237:127093},mptcp dss ack 1999166125], length 0
20:50:16.396810 IP 112.26.1.8.37309 > 112.26.1.1.36395: Flags [.], ack 117097, win 23088, options [nop,nop,TS val 4294901508 ecr 158505,nop,nop,sack 2 {128521:134233}{124237:127093},mptcp dss ack 1999214677], length 0
20:50:16.539319 IP 112.26.1.8.37309 > 112.26.1.1.36395: Flags [.], ack 119953, win 23545, options [nop,nop,TS val 4294901653 ecr 158505,nop,nop,sack 2 {128521:134233}{124237:127093},mptcp dss ack 1999227529], length 0
20:50:16.717474 IP 112.26.1.8.37309 > 112.26.1.1.36395: Flags [.], ack 122809, win 23579, options [nop,nop,TS val 4294901829 ecr 158658,nop,nop,sack 2 {128521:134233}{124237:127093},mptcp dss ack 1999237525], length 0
20:50:16.847386 IP 112.26.1.8.37309 > 112.26.1.1.36395: Flags [.], ack 127093, win 23602, options [nop,nop,TS val 4294901958 ecr 158880,nop,nop,sack 1 {128521:134233},mptcp dss ack 1999253233], length 0
20:50:17.127118 IP 112.26.1.8.37309 > 112.26.1.1.36395: Flags [.], ack 134233, win 23655, options [nop,nop,TS val 4294902240 ecr 159216,mptcp dss ack 1999323205], length 0
20:50:17.212945 IP 112.26.1.8.37309 > 112.26.1.1.36395: Flags [.], ack 135661, win 23908, options [nop,nop,TS val 4294902313 ecr 159222,mptcp dss ack 1999323205], length 0
20:50:17.484967 IP 112.26.1.8.37309 > 112.26.1.1.36395: Flags [.], ack 135661, win 24275, options [nop,nop,TS val 4294902596 ecr 159222,nop,nop,sack 1 {138517:139945},mptcp dss ack 1999323205], length 0
20:50:17.600870 IP 112.26.1.8.37309 > 112.26.1.1.36395: Flags [.], ack 135661, win 24275, options [nop,nop,TS val 4294902714 ecr 159222,nop,nop,sack 1 {138517:141373},mptcp dss ack 1999323205], length 0
20:50:17.808756 IP 112.26.1.8.37309 > 112.26.1.1.36395: Flags [.], ack 135661, win 24275, options [nop,nop,TS val 4294902923 ecr 159222,nop,nop,sack 2 {142801:144229}{138517:141373},mptcp dss ack 1999323205], length 0
20:50:17.928455 IP 112.26.1.8.37309 > 112.26.1.1.36395: Flags [.], ack 135661, win 24275, options [nop,nop,TS val 4294902981 ecr 159222,nop,nop,sack 2 {142801:145657}{138517:141373},mptcp dss ack 1999323205], length 0
20:50:18.170080 IP 112.26.1.8.37309 > 112.26.1.1.36395: Flags [.], ack 135661, win 24275, options [nop,nop,TS val 4294903282 ecr 159222,nop,nop,sack 2 {148513:149941}{142801:145657},mptcp dss ack 1999323205], length 0
20:50:18.350964 IP 112.26.1.8.37309 > 112.26.1.1.36395: Flags [.], ack 135661, win 24275, options [nop,nop,TS val 4294903464 ecr 159222,nop,nop,sack 2 {148513:151369}{142801:145657},mptcp dss ack 1999323205], length 0
20:50:18.504002 IP 112.26.1.8.37309 > 112.26.1.1.36395: Flags [.], ack 135661, win 24275, options [nop,nop,TS val 4294903617 ecr 159222,nop,nop,sack 2 {148513:152797}{142801:145657},mptcp dss ack 1999323205], length 0
20:50:18.675065 IP 112.26.1.8.37309 > 112.26.1.1.36395: Flags [.], ack 135661, win 24275, options [nop,nop,TS val 4294903789 ecr 159222,nop,nop,sack 2 {148513:154225}{142801:145657},mptcp dss ack 1999323205], length 0
20:50:18.821102 IP 112.26.1.8.37309 > 112.26.1.1.36395: Flags [.], ack 135661, win 24275, options [nop,nop,TS val 4294903935 ecr 159222,nop,nop,sack 2 {148513:155653}{142801:145657},mptcp dss ack 1999323205], length 0
20:50:18.923390 IP 112.26.1.8.37309 > 112.26.1.1.36395: Flags [.], ack 135661, win 24142, options [nop,nop,TS val 4294904038 ecr 159222,nop,nop,sack 2 {148513:157081}{142801:145657},mptcp dss ack 1999331773], length 0
20:50:19.063809 IP 112.26.1.8.37309 > 112.26.1.1.36395: Flags [.], ack 135661, win 24053, options [nop,nop,TS val 4294904177 ecr 159222,nop,nop,sack 2 {148513:158509}{142801:145657},mptcp dss ack 1999337485], length 0
20:50:19.239756 IP 112.26.1.8.37309 > 112.26.1.1.36395: Flags [.], ack 135661, win 24053, options [nop,nop,TS val 4294904354 ecr 159222,nop,nop,sack 2 {148513:159937}{142801:145657},mptcp dss ack 1999337485], length 0
20:50:19.399979 IP 112.26.1.8.37309 > 112.26.1.1.36395: Flags [.], ack 135661, win 24053, options [nop,nop,TS val 4294904514 ecr 159222,nop,nop,sack 2 {148513:161365}{142801:145657},mptcp dss ack 1999337485], length 0
20:50:19.528618 IP 112.26.1.8.37309 > 112.26.1.1.36395: Flags [.], ack 135661, win 24053, options [nop,nop,TS val 4294904642 ecr 159222,nop,nop,sack 2 {148513:162793}{142801:145657},mptcp dss ack 1999337485], length 0
20:50:19.723163 IP 112.26.1.8.37309 > 112.26.1.1.36395: Flags [.], ack 135661, win 24053, options [nop,nop,TS val 4294904835 ecr 159222,nop,nop,sack 2 {148513:164221}{142801:145657},mptcp dss ack 1999337485], length 0
20:50:19.814248 IP 112.26.1.8.37309 > 112.26.1.1.36395: Flags [.], ack 135661, win 24053, options [nop,nop,TS val 4294904891 ecr 159222,nop,nop,sack 2 {148513:165649}{142801:145657},mptcp dss ack 1999337485], length 0
20:50:20.020293 IP 112.26.1.8.37309 > 112.26.1.1.36395: Flags [.], ack 135661, win 24053, options [nop,nop,TS val 4294905133 ecr 159222,nop,nop,sack 2 {148513:167077}{142801:145657},mptcp dss ack 1999337485], length 0
20:50:20.115890 IP 112.26.1.8.37309 > 112.26.1.1.36395: Flags [.], ack 135661, win 24053, options [nop,nop,TS val 4294905229 ecr 159222,nop,nop,sack 2 {148513:168505}{142801:145657},mptcp dss ack 1999337485], length 0
20:50:20.330597 IP 112.26.1.8.37309 > 112.26.1.1.36395: Flags [.], ack 135661, win 24053, options [nop,nop,TS val 4294905443 ecr 159222,nop,nop,sack 2 {148513:169933}{142801:145657},mptcp dss ack 1999337485], length 0
20:50:20.570801 IP 112.26.1.8.37309 > 112.26.1.1.36395: Flags [.], ack 135661, win 24053, options [nop,nop,TS val 4294905685 ecr 159222,nop,nop,sack 2 {148513:171361}{142801:145657},mptcp dss ack 1999337485], length 0
20:50:20.737394 IP 112.26.1.8.37309 > 112.26.1.1.36395: Flags [.], ack 135661, win 24053, options [nop,nop,TS val 4294905851 ecr 159222,nop,nop,sack 2 {148513:172789}{142801:145657},mptcp dss ack 1999337485], length 0
20:50:20.911001 IP 112.26.1.8.37309 > 112.26.1.1.36395: Flags [.], ack 135661, win 24053, options [nop,nop,TS val 4294906025 ecr 159222,nop,nop,sack 2 {148513:174217}{142801:145657},mptcp dss ack 1999337485], length 0
20:50:21.133739 IP 112.26.1.8.37309 > 112.26.1.1.36395: Flags [.], ack 135661, win 24053, options [nop,nop,TS val 4294906247 ecr 159222,nop,nop,sack 2 {137089:141373}{148513:174217},mptcp dss ack 1999337485], length 0
20:50:21.319330 IP 112.26.1.8.37309 > 112.26.1.1.36395: Flags [.], ack 135661, win 24053, options [nop,nop,TS val 4294906430 ecr 159222,nop,nop,sack 2 {137089:145657}{148513:174217},mptcp dss ack 1999337485], length 0
20:50:21.497197 IP 112.26.1.8.37309 > 112.26.1.1.36395: Flags [.], ack 135661, win 24053, options [nop,nop,TS val 4294906609 ecr 159222,nop,nop,sack 2 {137089:147085}{148513:174217},mptcp dss ack 1999337485], length 0
20:50:21.675014 IP 112.26.1.8.37309 > 112.26.1.1.36395: Flags [.], ack 135661, win 24053, options [nop,nop,TS val 4294906788 ecr 159222,nop,nop,sack 1 {137089:174217},mptcp dss ack 1999337485], length 0
20:50:21.868119 IP 112.26.1.8.37309 > 112.26.1.1.36395: Flags [.], ack 135661, win 24053, options [nop,nop,TS val 4294906981 ecr 159222,nop,nop,sack 1 {137089:175645},mptcp dss ack 1999337485], length 0
20:50:21.991616 IP 112.26.1.8.37309 > 112.26.1.1.36395: Flags [.], ack 135661, win 24053, options [nop,nop,TS val 4294907105 ecr 159222,nop,nop,sack 1 {137089:177073},mptcp dss ack 1999337485], length 0
20:50:22.158812 IP 112.26.1.8.37309 > 112.26.1.1.36395: Flags [.], ack 135661, win 24053, options [nop,nop,TS val 4294907272 ecr 159222,nop,nop,sack 1 {137089:178501},mptcp dss ack 1999337485], length 0
20:50:22.360884 IP 112.26.1.8.37309 > 112.26.1.1.36395: Flags [.], ack 135661, win 24053, options [nop,nop,TS val 4294907444 ecr 159222,nop,nop,sack 1 {137089:179929},mptcp dss ack 1999337485], length 0
20:50:22.558755 IP 112.26.1.8.37309 > 112.26.1.1.36395: Flags [.], ack 135661, win 24053, options [nop,nop,TS val 4294907671 ecr 159222,nop,nop,sack 1 {137089:181357},mptcp dss ack 1999337485], length 0
20:50:22.684543 IP 112.26.1.8.37309 > 112.26.1.1.36395: Flags [.], ack 135661, win 24053, options [nop,nop,TS val 4294907797 ecr 159222,nop,nop,sack 1 {137089:182785},mptcp dss ack 1999337485], length 0
20:50:22.838906 IP 112.26.1.8.37309 > 112.26.1.1.36395: Flags [.], ack 182785, win 22358, options [nop,nop,TS val 4294907952 ecr 165150,mptcp dss ack 1999446013], length 0
20:50:23.000660 IP 112.26.1.8.37309 > 112.26.1.1.36395: Flags [.], ack 184213, win 23409, options [nop,nop,TS val 4294908114 ecr 165321,mptcp dss ack 1999446013], length 0
20:50:23.191125 IP 112.26.1.8.37309 > 112.26.1.1.36395: Flags [.], ack 185641, win 23458, options [nop,nop,TS val 4294908304 ecr 165486,mptcp dss ack 1999473145], length 0
20:50:23.392735 IP 112.26.1.8.37309 > 112.26.1.1.36395: Flags [.], ack 187069, win 23458, options [nop,nop,TS val 4294908506 ecr 165701,mptcp dss ack 1999473145], length 0
20:50:23.556973 IP 112.26.1.8.37309 > 112.26.1.1.36395: Flags [.], ack 188497, win 23458, options [nop,nop,TS val 4294908670 ecr 165844,mptcp dss ack 1999473145], length 0
20:50:23.704537 IP 112.26.1.8.37309 > 112.26.1.1.36395: Flags [.], ack 189925, win 23458, options [nop,nop,TS val 4294908816 ecr 166027,mptcp dss ack 1999473145], length 0
20:50:23.901981 IP 112.26.1.8.37309 > 112.26.1.1.36395: Flags [.], ack 191353, win 24473, options [nop,nop,TS val 4294909015 ecr 166241,mptcp dss ack 1999604521], length 0
20:50:24.112073 IP 112.26.1.8.37309 > 112.26.1.1.36395: Flags [.], ack 192781, win 24473, options [nop,nop,TS val 4294909226 ecr 166447,mptcp dss ack 1999604521], length 0
20:50:24.275553 IP 112.26.1.8.37309 > 112.26.1.1.36395: Flags [.], ack 194209, win 24473, options [nop,nop,TS val 4294909389 ecr 166569,mptcp dss ack 1999604521], length 0
20:50:24.496353 IP 112.26.1.8.37309 > 112.26.1.1.36395: Flags [.], ack 195637, win 24473, options [nop,nop,TS val 4294909610 ecr 166736,mptcp dss ack 1999604521], length 0
20:50:24.637375 IP 112.26.1.8.37309 > 112.26.1.1.36395: Flags [.], ack 197065, win 24473, options [nop,nop,TS val 4294909747 ecr 166918,mptcp dss ack 1999604521], length 0
20:50:24.820397 IP 112.26.1.8.37309 > 112.26.1.1.36395: Flags [.], ack 198493, win 24473, options [nop,nop,TS val 4294909933 ecr 166918,mptcp dss ack 1999604521], length 0
20:50:24.910337 IP 112.26.1.8.37309 > 112.26.1.1.36395: Flags [.], ack 199921, win 24473, options [nop,nop,TS val 4294910009 ecr 166918,mptcp dss ack 1999604521], length 0
20:50:25.080572 IP 112.26.1.8.37309 > 112.26.1.1.36395: Flags [.], ack 201349, win 24241, options [nop,nop,TS val 4294910193 ecr 167150,mptcp dss ack 1999634509], length 0
20:50:25.228248 IP 112.26.1.8.37309 > 112.26.1.1.36395: Flags [.], ack 202777, win 24241, options [nop,nop,TS val 4294910341 ecr 167426,mptcp dss ack 1999634509], length 0
20:50:25.358848 IP 112.26.1.8.37309 > 112.26.1.1.36395: Flags [.], ack 202777, win 24241, options [nop,nop,TS val 4294910471 ecr 167426,nop,nop,sack 1 {204205:205633},mptcp dss ack 1999634509], length 0
20:50:25.511175 IP 112.26.1.8.37309 > 112.26.1.1.36395: Flags [.], ack 202777, win 24241, options [nop,nop,TS val 4294910624 ecr 167426,nop,nop,sack 1 {204205:207061},mptcp dss ack 1999634509], length 0
20:50:25.673511 IP 112.26.1.8.37309 > 112.26.1.1.36395: Flags [.], ack 202777, win 24241, options [nop,nop,TS val 4294910784 ecr 167426,nop,nop,sack 1 {204205:208489},mptcp dss ack 1999634509], length 0
20:50:25.876248 IP 112.26.1.8.37309 > 112.26.1.1.36395: Flags [.], ack 202777, win 24241, options [nop,nop,TS val 4294910987 ecr 167426,nop,nop,sack 1 {204205:209917},mptcp dss ack 1999634509], length 0
20:50:26.055052 IP 112.26.1.8.37309 > 112.26.1.1.36395: Flags [.], ack 202777, win 24241, options [nop,nop,TS val 4294911169 ecr 167426,nop,nop,sack 1 {204205:211345},mptcp dss ack 1999634509], length 0
20:50:26.255144 IP 112.26.1.8.37309 > 112.26.1.1.36395: Flags [.], ack 202777, win 24241, options [nop,nop,TS val 4294911369 ecr 167426,nop,nop,sack 1 {204205:212773},mptcp dss ack 1999634509], length 0
20:50:26.399543 IP 112.26.1.8.37309 > 112.26.1.1.36395: Flags [.], ack 202777, win 24241, options [nop,nop,TS val 4294911513 ecr 167426,nop,nop,sack 1 {204205:214201},mptcp dss ack 1999634509], length 0
20:50:26.522084 IP 112.26.1.8.37309 > 112.26.1.1.36395: Flags [.], ack 202777, win 24241, options [nop,nop,TS val 4294911635 ecr 167426,nop,nop,sack 1 {204205:215629},mptcp dss ack 1999634509], length 0
20:50:26.710820 IP 112.26.1.8.37309 > 112.26.1.1.36395: Flags [.], ack 202777, win 24241, options [nop,nop,TS val 4294911823 ecr 167426,nop,nop,sack 1 {204205:217057},mptcp dss ack 1999634509], length 0
20:50:26.867665 IP 112.26.1.8.37309 > 112.26.1.1.36395: Flags [.], ack 202777, win 24241, options [nop,nop,TS val 4294911981 ecr 167426,nop,nop,sack 1 {204205:218485},mptcp dss ack 1999634509], length 0
20:50:27.198322 IP 112.26.1.8.37309 > 112.26.1.1.36395: Flags [.], ack 202777, win 24012, options [nop,nop,TS val 4294912311 ecr 167426,nop,nop,sack 2 {221341:222769}{204205:218485},mptcp dss ack 1999674493], length 0
20:50:27.339144 IP 112.26.1.8.37309 > 112.26.1.1.36395: Flags [.], ack 202777, win 24012, options [nop,nop,TS val 4294912453 ecr 167426,nop,nop,sack 2 {221341:224197}{204205:218485},mptcp dss ack 1999674493], length 0
