20:50:00.362364 IP 112.26.1.8.37309 > 112.26.1.1.36395: Flags [S], seq 3631728029, win 65535, options [mss 1460,sackOK,TS val 4294885456 ecr 0,nop,wscale 6,mptcp join id 3 token 0xca9948a6 nonce 0x9628a24a], length 0
20:50:00.412053 IP 112.26.1.8.37309 > 112.26.1.1.36395: Flags [S], seq 3631728029, win 65535, options [mss 1460,sackOK,TS val 4294885456 ecr 0,nop,wscale 6,mptcp join id 3 token 0xca9948a6 nonce 0x9628a24a], length 0
20:50:00.472793 IP 112.26.1.8.37309 > 112.26.1.1.36395: Flags [S], seq 3631728029, win 65535, options [mss 1460,sackOK,TS val 4294885456 ecr 0,nop,wscale 6,mptcp join id 3 token 0xca9948a6 nonce 0x9628a24a], length 0
20:50:00.600318 IP 112.26.1.1.36395 > 112.26.1.8.37309: Flags [S.], seq 4239519382, ack 3631728030, win 65535, options [mss 1460,sackOK,TS val 143584 ecr 4294885456,nop,wscale 6,mptcp join id 3 hmac 0x420f70e2718e0e25 nonce 0x1ef4c91c], length 0
20:50:00.648982 IP 112.26.1.1.36395 > 112.26.1.8.37309: Flags [S.], seq 4239519382, ack 3631728030, win 65535, options [mss 1460,sackOK,TS val 143584 ecr 4294885456,nop,wscale 6,mptcp join id 3 hmac 0x420f70e2718e0e25 nonce 0x1ef4c91c], length 0
20:50:00.716893 IP 112.26.1.8.37309 > 112.26.1.1.36395: Flags [.], ack 1, win 7118, options [nop,nop,TS val 4294885765 ecr 143584,mptcp join hmac 0x019757062a4f6cff608d92f8ab877b4267b827bf], length 0
20:50:00.746368 IP 112.26.1.8.37309 > 112.26.1.1.36395: Flags [.], ack 1, win 7118, options [nop,nop,TS val 4294885765 ecr 143584,mptcp join hmac 0x019757062a4f6cff608d92f8ab877b4267b827bf], length 0
20:50:00.753694 IP 112.26.1.1.36395 > 112.26.1.8.37309: Flags [.], ack 1, win 2678, options [nop,nop,TS val 143859 ecr 4294885765,mptcp dss ack 3836451400], length 0
20:50:00.757191 IP 112.26.1.1.36395 > 112.26.1.8.37309: Flags [.], ack 1, win 2678, options [nop,nop,TS val 143859 ecr 4294885765,mptcp dss ack 3836451400], length 0
20:50:00.758196 IP 112.26.1.8.37309 > 112.26.1.1.36395: Flags [.], ack 1, win 7118, options [nop,nop,TS val 4294885765 ecr 143584,mptcp join hmac 0x019757062a4f6cff608d92f8ab877b4267b827bf], length 0
20:50:00.836224 IP 112.26.1.1.36395 > 112.26.1.8.37309: Flags [.], seq 1:1429, ack 1, win 2678, options [nop,nop,TS val 143859 ecr 4294885765,mptcp dss ack 3836451400 seq 1998734869 subseq 1 len 1428 csum 0x1bdd], length 1428
20:50:00.841819 IP 112.26.1.1.36395 > 112.26.1.8.37309: Flags [.], seq 1:1429, ack 1, win 2678, options [nop,nop,TS val 143859 ecr 4294885765,mptcp dss ack 3836451400 seq 1998734869 subseq 1 len 1428 csum 0x1bdd], length 1428
20:50:00.846497 IP 112.26.1.8.37309 > 112.26.1.1.36395: Flags [.], ack 1429, win 7164, options [nop,nop,TS val 4294885958 ecr 143859,mptcp dss ack 1998720589], length 0
20:50:00.915756 IP 112.26.1.8.37309 > 112.26.1.1.36395: Flags [.], ack 1429, win 7164, options [nop,nop,TS val 4294885958 ecr 143859,mptcp dss ack 1998720589], length 0
20:50:00.928523 IP 112.26.1.8.37309 > 112.26.1.1.36395: Flags [.], ack 1429, win 7164, options [nop,nop,TS val 4294885958 ecr 143859,mptcp dss ack 1998720589], length 0
20:50:01.096556 IP 112.26.1.1.36395 > 112.26.1.8.37309: Flags [.], seq 1429:2857, ack 1, win 2678, options [nop,nop,TS val 143859 ecr 4294885765,mptcp dss ack 3836451400 seq 1998736297 subseq 1429 len 1428 csum 0x1380], length 1428
20:50:01.101085 IP 112.26.1.1.36395 > 112.26.1.8.37309: Flags [.], seq 1429:2857, ack 1, win 2678, options [nop,nop,TS val 143859 ecr 4294885765,mptcp dss ack 3836451400 seq 1998736297 subseq 1429 len 1428 csum 0x1380], length 1428
20:50:01.112781 IP 112.26.1.8.37309 > 112.26.1.1.36395: Flags [.], ack 2857, win 7346, options [nop,nop,TS val 4294886217 ecr 143859,mptcp dss ack 1998720589], length 0
20:50:01.182729 IP 112.26.1.8.37309 > 112.26.1.1.36395: Flags [.], ack 2857, win 7346, options [nop,nop,TS val 4294886217 ecr 143859,mptcp dss ack 1998720589], length 0
20:50:01.190153 IP 112.26.1.8.37309 > 112.26.1.1.36395: Flags [.], ack 2857, win 7346, options [nop,nop,TS val 4294886217 ecr 143859,mptcp dss ack 1998720589], length 0
20:50:01.282412 IP 112.26.1.1.36395 > 112.26.1.8.37309: Flags [.], seq 2857:4285, ack 1, win 2678, options [nop,nop,TS val 143860 ecr 4294885765,mptcp dss ack 3836451400 seq 1998737725 subseq 2857 len 1428 csum 0x1e31], length 1428
20:50:01.285244 IP 112.26.1.1.36395 > 112.26.1.8.37309: Flags [.], seq 2857:4285, ack 1, win 2678, options [nop,nop,TS val 143860 ecr 4294885765,mptcp dss ack 3836451400 seq 1998737725 subseq 2857 len 1428 csum 0x1e31], length 1428
20:50:01.287310 IP 112.26.1.8.37309 > 112.26.1.1.36395: Flags [.], ack 4285, win 7574, options [nop,nop,TS val 4294886400 ecr 143860,mptcp dss ack 1998720589], length 0
20:50:01.296781 IP 112.26.1.8.37309 > 112.26.1.1.36395: Flags [.], ack 4285, win 7574, options [nop,nop,TS val 4294886400 ecr 143860,mptcp dss ack 1998720589], length 0
20:50:01.381460 IP 112.26.1.8.37309 > 112.26.1.1.36395: Flags [.], ack 4285, win 7574, options [nop,nop,TS val 4294886400 ecr 143860,mptcp dss ack 1998720589], length 0
20:50:01.389090 IP 112.26.1.1.36395 > 112.26.1.8.37309: Flags [.], seq 4285:5713, ack 1, win 2678, options [nop,nop,TS val 143860 ecr 4294885765,mptcp dss ack 3836451400 seq 1998739153 subseq 4285 len 1428 csum 0x7758], length 1428
20:50:01.396713 IP 112.26.1.1.36395 > 112.26.1.8.37309: Flags [.], seq 4285:5713, ack 1, win 2678, options [nop,nop,TS val 143860 ecr 4294885765,mptcp dss ack 3836451400 seq 1998739153 subseq 4285 len 1428 csum 0x7758], length 1428
20:50:01.448873 IP 112.26.1.8.37309 > 112.26.1.1.36395: Flags [.], ack 5713, win 7620, options [nop,nop,TS val 4294886509 ecr 143860,mptcp dss ack 1998720589], length 0
20:50:01.556568 IP 112.26.1.8.37309 > 112.26.1.1.36395: Flags [.], ack 5713, win 7620, options [nop,nop,TS val 4294886509 ecr 143860,mptcp dss ack 1998720589], length 0
20:50:01.577165 IP 112.26.1.8.37309 > 112.26.1.1.36395: Flags [.], ack 5713, win 7620, options [nop,nop,TS val 4294886509 ecr 143860,mptcp dss ack 1998720589], length 0
20:50:01.669087 IP 112.26.1.1.36395 > 112.26.1.8.37309: Flags [.], seq 5713:7141, ack 1, win 2678, options [nop,nop,TS val 143860 ecr 4294885765,mptcp dss ack 3836451400 seq 1998740581 subseq 5713 len 1428 csum 0xfc8b], length 1428
20:50:01.674101 IP 112.26.1.8.37309 > 112.26.1.1.36395: Flags [.], ack 7141, win 7894, options [nop,nop,TS val 4294886788 ecr 143860,mptcp dss ack 1998742009], length 0
20:50:01.676578 IP 112.26.1.8.37309 > 112.26.1.1.36395: Flags [.], ack 7141, win 7894, options [nop,nop,TS val 4294886788 ecr 143860,mptcp dss ack 1998742009], length 0
20:50:01.692376 IP 112.26.1.1.36395 > 112.26.1.8.37309: Flags [.], seq 5713:7141, ack 1, win 2678, options [nop,nop,TS val 143860 ecr 4294885765,mptcp dss ack 3836451400 seq 1998740581 subseq 5713 len 1428 csum 0xfc8b], length 1428
20:50:01.726215 IP 112.26.1.8.37309 > 112.26.1.1.36395: Flags [.], ack 7141, win 7894, options [nop,nop,TS val 4294886788 ecr 143860,mptcp dss ack 1998742009], length 0
20:50:01.800065 IP 112.26.1.1.36395 > 112.26.1.8.37309: Flags [.], seq 7141:8569, ack 1, win 2678, options [nop,nop,TS val 143860 ecr 4294885765,mptcp dss ack 3836451400 seq 1998742009 subseq 7141 len 1428 csum 0x204d], length 1428
20:50:01.802759 IP 112.26.1.1.36395 > 112.26.1.8.37309: Flags [.], seq 7141:8569, ack 1, win 2678, options [nop,nop,TS val 143860 ecr 4294885765,mptcp dss ack 3836451400 seq 1998742009 subseq 7141 len 1428 csum 0x204d], length 1428
20:50:01.804703 IP 112.26.1.8.37309 > 112.26.1.1.36395: Flags [.], ack 8569, win 7985, options [nop,nop,TS val 4294886918 ecr 143860,mptcp dss ack 1998743437], length 0
20:50:01.806614 IP 112.26.1.8.37309 > 112.26.1.1.36395: Flags [.], ack 8569, win 7985, options [nop,nop,TS val 4294886918 ecr 143860,mptcp dss ack 1998743437], length 0
20:50:01.875908 IP 112.26.1.8.37309 > 112.26.1.1.36395: Flags [.], ack 8569, win 7985, options [nop,nop,TS val 4294886918 ecr 143860,mptcp dss ack 1998743437], length 0
20:50:01.965161 IP 112.26.1.1.36395 > 112.26.1.8.37309: Flags [.], seq 8569:9997, ack 1, win 2678, options [nop,nop,TS val 143861 ecr 4294885765,mptcp dss ack 3836451400 seq 1998743437 subseq 8569 len 1428 csum 0x4ec8], length 1428
20:50:01.968014 IP 112.26.1.1.36395 > 112.26.1.8.37309: Flags [.], seq 8569:9997, ack 1, win 2678, options [nop,nop,TS val 143861 ecr 4294885765,mptcp dss ack 3836451400 seq 1998743437 subseq 8569 len 1428 csum 0x4ec8], length 1428
20:50:01.989432 IP 112.26.1.8.37309 > 112.26.1.1.36395: Flags [.], ack 9997, win 8213, options [nop,nop,TS val 4294887083 ecr 143861,mptcp dss ack 1998744865], length 0
20:50:02.001250 IP 112.26.1.8.37309 > 112.26.1.1.36395: Flags [.], ack 9997, win 8213, options [nop,nop,TS val 4294887083 ecr 143861,mptcp dss ack 1998744865], length 0
20:50:02.055219 IP 112.26.1.8.37309 > 112.26.1.1.36395: Flags [.], ack 9997, win 8213, options [nop,nop,TS val 4294887083 ecr 143861,mptcp dss ack 1998744865], length 0
20:50:02.175701 IP 112.26.1.1.36395 > 112.26.1.8.37309: Flags [.], seq 9997:11425, ack 1, win 2678, options [nop,nop,TS val 143861 ecr 4294885765,mptcp dss ack 3836451400 seq 1998744865 subseq 9997 len 1428 csum 0x151], length 1428
20:50:02.179342 IP 112.26.1.1.36395 > 112.26.1.8.37309: Flags [.], seq 9997:11425, ack 1, win 2678, options [nop,nop,TS val 143861 ecr 4294885765,mptcp dss ack 3836451400 seq 1998744865 subseq 9997 len 1428 csum 0x151], length 1428
20:50:02.180853 IP 112.26.1.8.37309 > 112.26.1.1.36395: Flags [.], ack 11425, win 8487, options [nop,nop,TS val 4294887295 ecr 143861,mptcp dss ack 1998746293], length 0
20:50:02.278702 IP 112.26.1.8.37309 > 112.26.1.1.36395: Flags [.], ack 11425, win 8487, options [nop,nop,TS val 4294887295 ecr 143861,mptcp dss ack 1998746293], length 0
20:50:02.281563 IP 112.26.1.8.37309 > 112.26.1.1.36395: Flags [.], ack 11425, win 8487, options [nop,nop,TS val 4294887295 ecr 143861,mptcp dss ack 1998746293], length 0
20:50:02.338169 IP 112.26.1.1.36395 > 112.26.1.8.37309: Flags [.], seq 11425:12853, ack 1, win 2678, options [nop,nop,TS val 143861 ecr 4294885765,mptcp dss ack 3836451400 seq 1998746293 subseq 11425 len 1428 csum 0xef57], length 1428
20:50:02.342984 IP 112.26.1.1.36395 > 112.26.1.8.37309: Flags [.], seq 11425:12853, ack 1, win 2678, options [nop,nop,TS val 143861 ecr 4294885765,mptcp dss ack 3836451400 seq 1998746293 subseq 11425 len 1428 csum 0xef57], length 1428
20:50:02.344553 IP 112.26.1.8.37309 > 112.26.1.1.36395: Flags [.], ack 12853, win 8669, options [nop,nop,TS val 4294887458 ecr 143861,mptcp dss ack 1998747721], length 0
20:50:02.375764 IP 112.26.1.8.37309 > 112.26.1.1.36395: Flags [.], ack 12853, win 8669, options [nop,nop,TS val 4294887458 ecr 143861,mptcp dss ack 1998747721], length 0
20:50:02.402050 IP 112.26.1.8.37309 > 112.26.1.1.36395: Flags [.], ack 12853, win 8669, options [nop,nop,TS val 4294887458 ecr 143861,mptcp dss ack 1998747721], length 0
20:50:02.502417 IP 112.26.1.1.36395 > 112.26.1.8.37309: Flags [.], seq 12853:14281, ack 1, win 2678, options [nop,nop,TS val 143861 ecr 4294885765,mptcp dss ack 3836451400 seq 1998747721 subseq 12853 len 1428 csum 0x9e20], length 1428
20:50:02.505914 IP 112.26.1.1.36395 > 112.26.1.8.37309: Flags [.], seq 12853:14281, ack 1, win 2678, options [nop,nop,TS val 143861 ecr 4294885765,mptcp dss ack 3836451400 seq 1998747721 subseq 12853 len 1428 csum 0x9e20], length 1428
20:50:02.509783 IP 112.26.1.8.37309 > 112.26.1.1.36395: Flags [.], ack 14281, win 8806, options [nop,nop,TS val 4294887622 ecr 143861,mptcp dss ack 1998764857], length 0
20:50:02.514929 IP 112.26.1.8.37309 > 112.26.1.1.36395: Flags [.], ack 14281, win 8806, options [nop,nop,TS val 4294887622 ecr 143861,mptcp dss ack 1998764857], length 0
20:50:02.546596 IP 112.26.1.8.37309 > 112.26.1.1.36395: Flags [.], ack 14281, win 8806, options [nop,nop,TS val 4294887622 ecr 143861,mptcp dss ack 1998764857], length 0
20:50:02.735349 IP 112.26.1.1.36395 > 112.26.1.8.37309: Flags [.], seq 14281:15709, ack 1, win 4017, options [nop,nop,TS val 144035 ecr 4294885958,mptcp dss ack 3836451400 seq 1998771997 subseq 14281 len 1428 csum 0xa8c2], length 1428
20:50:02.739529 IP 112.26.1.8.37309 > 112.26.1.1.36395: Flags [.], ack 15709, win 8989, options [nop,nop,TS val 4294887853 ecr 144035,mptcp dss ack 1998766285], length 0
20:50:02.748257 IP 112.26.1.1.36395 > 112.26.1.8.37309: Flags [.], seq 14281:15709, ack 1, win 4017, options [nop,nop,TS val 144035 ecr 4294885958,mptcp dss ack 3836451400 seq 1998771997 subseq 14281 len 1428 csum 0xa8c2], length 1428
20:50:02.833518 IP 112.26.1.8.37309 > 112.26.1.1.36395: Flags [.], ack 15709, win 8989, options [nop,nop,TS val 4294887853 ecr 144035,mptcp dss ack 1998766285], length 0
20:50:02.835977 IP 112.26.1.8.37309 > 112.26.1.1.36395: Flags [.], ack 15709, win 8989, options [nop,nop,TS val 4294887853 ecr 144035,mptcp dss ack 1998766285], length 0
20:50:02.853555 IP 112.26.1.1.36395 > 112.26.1.8.37309: Flags [.], seq 15709:17137, ack 1, win 4017, options [nop,nop,TS val 144035 ecr 4294885958,mptcp dss ack 3836451400 seq 1998773425 subseq 15709 len 1428 csum 0xb9e1], length 1428
20:50:02.919791 IP 112.26.1.1.36395 > 112.26.1.8.37309: Flags [.], seq 15709:17137, ack 1, win 4017, options [nop,nop,TS val 144035 ecr 4294885958,mptcp dss ack 3836451400 seq 1998773425 subseq 15709 len 1428 csum 0xb9e1], length 1428
20:50:02.922329 IP 112.26.1.8.37309 > 112.26.1.1.36395: Flags [.], ack 17137, win 9217, options [nop,nop,TS val 4294888035 ecr 144035,mptcp dss ack 1998766285], length 0
20:50:02.981856 IP 112.26.1.1.36395 > 112.26.1.8.37309: Flags [.], seq 17137:18565, ack 1, win 4017, options [nop,nop,TS val 144295 ecr 4294886217,mptcp dss ack 3836451400 seq 1998779137 subseq 17137 len 1428 csum 0xfe18], length 1428
20:50:03.039328 IP 112.26.1.8.37309 > 112.26.1.1.36395: Flags [.], ack 17137, win 9217, options [nop,nop,TS val 4294888035 ecr 144035,mptcp dss ack 1998766285], length 0
20:50:03.078564 IP 112.26.1.1.36395 > 112.26.1.8.37309: Flags [.], seq 17137:18565, ack 1, win 4017, options [nop,nop,TS val 144295 ecr 4294886217,mptcp dss ack 3836451400 seq 1998779137 subseq 17137 len 1428 csum 0xfe18], length 1428
20:50:03.080143 IP 112.26.1.8.37309 > 112.26.1.1.36395: Flags [.], ack 18565, win 9445, options [nop,nop,TS val 4294888194 ecr 144295,mptcp dss ack 1998767713], length 0
20:50:03.128595 IP 112.26.1.1.36395 > 112.26.1.8.37309: Flags [.], seq 34273:35701, ack 1, win 4017, options [nop,nop,TS val 145392 ecr 4294887295,mptcp dss ack 3836451400 seq 1998831973 subseq 34273 len 1428 csum 0xd80f], length 1428
20:50:03.142629 IP 112.26.1.1.36395 > 112.26.1.8.37309: Flags [.], seq 18565:19993, ack 1, win 4017, options [nop,nop,TS val 144295 ecr 4294886217,mptcp dss ack 3836451400 seq 1998780565 subseq 18565 len 1428 csum 0x3e86], length 1428
20:50:03.311191 IP 112.26.1.8.37309 > 112.26.1.1.36395: Flags [.], ack 18565, win 9445, options [nop,nop,TS val 4294888194 ecr 144295,mptcp dss ack 1998767713], length 0
20:50:03.355193 IP 112.26.1.1.36395 > 112.26.1.8.37309: Flags [.], seq 19993:21421, ack 1, win 4017, options [nop,nop,TS val 144490 ecr 4294886400,mptcp dss ack 3836451400 seq 1998793417 subseq 19993 len 1428 csum 0xef17], length 1428
20:50:03.421689 IP 112.26.1.1.36395 > 112.26.1.8.37309: Flags [.], seq 21421:22849, ack 1, win 4017, options [nop,nop,TS val 144490 ecr 4294886400,mptcp dss ack 3836451400 seq 1998794845 subseq 21421 len 1428 csum 0x12ea], length 1428
20:50:03.427932 IP 112.26.1.8.37309 > 112.26.1.1.36395: Flags [.], ack 17137, win 9217, options [nop,nop,TS val 4294888035 ecr 144035,mptcp dss ack 1998766285], length 0
20:50:03.457938 IP 112.26.1.1.36395 > 112.26.1.8.37309: Flags [.], seq 34273:35701, ack 1, win 4017, options [nop,nop,TS val 145392 ecr 4294887295,mptcp dss ack 3836451400 seq 1998831973 subseq 34273 len 1428 csum 0xd80f], length 1428
20:50:03.464133 IP 112.26.1.8.37309 > 112.26.1.1.36395: Flags [.], ack 18565, win 9810, options [nop,nop,TS val 4294888573 ecr 144295,nop,nop,sack 1 {34273:35701},mptcp dss ack 1998780565], length 0
20:50:03.537585 IP 112.26.1.1.36395 > 112.26.1.8.37309: Flags [.], seq 22849:24277, ack 1, win 4017, options [nop,nop,TS val 144688 ecr 4294886509,mptcp dss ack 3836451400 seq 1998800557 subseq 22849 len 1428 csum 0xb1d3], length 1428
20:50:03.563163 IP 112.26.1.1.36395 > 112.26.1.8.37309: Flags [.], seq 18565:19993, ack 1, win 4017, options [nop,nop,TS val 144295 ecr 4294886217,mptcp dss ack 3836451400 seq 1998780565 subseq 18565 len 1428 csum 0x3e86], length 1428
20:50:03.565290 IP 112.26.1.8.37309 > 112.26.1.1.36395: Flags [.], ack 19993, win 9947, options [nop,nop,TS val 4294888679 ecr 144295,nop,nop,sack 1 {34273:35701},mptcp dss ack 1998790561], length 0
20:50:03.626636 IP 112.26.1.1.36395 > 112.26.1.8.37309: Flags [.], seq 19993:21421, ack 1, win 4017, options [nop,nop,TS val 144490 ecr 4294886400,mptcp dss ack 3836451400 seq 1998793417 subseq 19993 len 1428 csum 0xef17], length 1428
20:50:03.635609 IP 112.26.1.1.36395 > 112.26.1.8.37309: Flags [.], seq 24277:25705, ack 1, win 4017, options [nop,nop,TS val 144688 ecr 4294886509,mptcp dss ack 3836451400 seq 1998801985 subseq 24277 len 1428 csum 0x75f4], length 1428
20:50:03.701645 IP 112.26.1.8.37309 > 112.26.1.1.36395: Flags [.], ack 21421, win 10038, options [nop,nop,TS val 4294888742 ecr 144490,nop,nop,sack 1 {34273:35701},mptcp dss ack 1998790561], length 0
20:50:03.730761 IP 112.26.1.1.36395 > 112.26.1.8.37309: Flags [.], seq 21421:22849, ack 1, win 4017, options [nop,nop,TS val 144490 ecr 4294886400,mptcp dss ack 3836451400 seq 1998794845 subseq 21421 len 1428 csum 0x12ea], length 1428
20:50:03.764901 IP 112.26.1.1.36395 > 112.26.1.8.37309: Flags [.], seq 35701:37129, ack 1, win 4017, options [nop,nop,TS val 145392 ecr 4294887295,mptcp dss ack 3836451400 seq 1998833401 subseq 35701 len 1428 csum 0xb55a], length 1428
20:50:03.806138 IP 112.26.1.8.37309 > 112.26.1.1.36395: Flags [.], ack 22849, win 10175, options [nop,nop,TS val 4294888846 ecr 144490,nop,nop,sack 1 {34273:35701},mptcp dss ack 1998790561], length 0
20:50:03.813249 IP 112.26.1.1.36395 > 112.26.1.8.37309: Flags [.], seq 28561:29989, ack 1, win 4017, options [nop,nop,TS val 144986 ecr 4294886918,mptcp dss ack 3836451400 seq 1998813409 subseq 28561 len 1428 csum 0x3e0b], length 1428
20:50:03.933575 IP 112.26.1.1.36395 > 112.26.1.8.37309: Flags [.], seq 31417:32845, ack 1, win 4017, options [nop,nop,TS val 145165 ecr 4294887083,mptcp dss ack 3836451400 seq 1998821977 subseq 31417 len 1428 csum 0xe563], length 1428
20:50:03.936625 IP 112.26.1.8.37309 > 112.26.1.1.36395: Flags [.], ack 18565, win 9810, options [nop,nop,TS val 4294888573 ecr 144295,nop,nop,sack 1 {34273:35701},mptcp dss ack 1998780565], length 0
20:50:03.945517 IP 112.26.1.8.37309 > 112.26.1.1.36395: Flags [.], ack 18565, win 9445, options [nop,nop,TS val 4294888194 ecr 144295,mptcp dss ack 1998767713], length 0
20:50:04.067789 IP 112.26.1.1.36395 > 112.26.1.8.37309: Flags [.], seq 22849:24277, ack 1, win 4017, options [nop,nop,TS val 144688 ecr 4294886509,mptcp dss ack 3836451400 seq 1998800557 subseq 22849 len 1428 csum 0xb1d3], length 1428
20:50:04.069343 IP 112.26.1.8.37309 > 112.26.1.1.36395: Flags [.], ack 24277, win 10540, options [nop,nop,TS val 4294889183 ecr 144688,nop,nop,sack 1 {34273:35701},mptcp dss ack 1998790561], length 0
20:50:04.109473 IP 112.26.1.1.36395 > 112.26.1.8.37309: Flags [.], seq 37129:38557, ack 1, win 4017, options [nop,nop,TS val 145512 ecr 4294887458,mptcp dss ack 3836451400 seq 1998839113 subseq 37129 len 1428 csum 0xdefb], length 1428
20:50:04.173917 IP 112.26.1.8.37309 > 112.26.1.1.36395: Flags [.], ack 19993, win 9947, options [nop,nop,TS val 4294888679 ecr 144295,nop,nop,sack 1 {34273:35701},mptcp dss ack 1998790561], length 0
20:50:04.188762 IP 112.26.1.1.36395 > 112.26.1.8.37309: Flags [.], seq 39985:41413, ack 1, win 4017, options [nop,nop,TS val 145657 ecr 4294887622,mptcp dss ack 3836451400 seq 1998844825 subseq 39985 len 1428 csum 0x9073], length 1428
20:50:04.289136 IP 112.26.1.1.36395 > 112.26.1.8.37309: Flags [.], seq 24277:25705, ack 1, win 4017, options [nop,nop,TS val 144688 ecr 4294886509,mptcp dss ack 3836451400 seq 1998801985 subseq 24277 len 1428 csum 0x75f4], length 1428
20:50:04.291803 IP 112.26.1.8.37309 > 112.26.1.1.36395: Flags [.], ack 25705, win 10859, options [nop,nop,TS val 4294889404 ecr 144688,nop,nop,sack 1 {34273:35701},mptcp dss ack 1998790561], length 0
20:50:04.362546 IP 112.26.1.8.37309 > 112.26.1.1.36395: Flags [.], ack 21421, win 10038, options [nop,nop,TS val 4294888742 ecr 144490,nop,nop,sack 1 {34273:35701},mptcp dss ack 1998790561], length 0
20:50:04.373789 IP 112.26.1.1.36395 > 112.26.1.8.37309: Flags [.], seq 41413:42841, ack 1, win 4017, options [nop,nop,TS val 145657 ecr 4294887622,mptcp dss ack 3836451400 seq 1998846253 subseq 41413 len 1428 csum 0xe575], length 1428
20:50:04.459682 IP 112.26.1.1.36395 > 112.26.1.8.37309: Flags [.], seq 42841:44269, ack 1, win 4017, options [nop,nop,TS val 145946 ecr 4294887853,mptcp dss ack 3836451400 seq 1998859105 subseq 42841 len 1428 csum 0xc317], length 1428
20:50:04.509762 IP 112.26.1.1.36395 > 112.26.1.8.37309: Flags [.], seq 35701:37129, ack 1, win 4017, options [nop,nop,TS val 145392 ecr 4294887295,mptcp dss ack 3836451400 seq 1998833401 subseq 35701 len 1428 csum 0xb55a], length 1428
20:50:04.513653 IP 112.26.1.8.37309 > 112.26.1.1.36395: Flags [.], ack 25705, win 11087, options [nop,nop,TS val 4294889625 ecr 144688,nop,nop,sack 1 {34273:37129},mptcp dss ack 1998790561], length 0
20:50:04.562880 IP 112.26.1.1.36395 > 112.26.1.8.37309: Flags [.], seq 44269:45697, ack 1, win 4017, options [nop,nop,TS val 145946 ecr 4294887853,mptcp dss ack 3836451400 seq 1998860533 subseq 44269 len 1428 csum 0x9ab0], length 1428
20:50:04.638586 IP 112.26.1.8.37309 > 112.26.1.1.36395: Flags [.], ack 22849, win 10175, options [nop,nop,TS val 4294888846 ecr 144490,nop,nop,sack 1 {34273:35701},mptcp dss ack 1998790561], length 0
20:50:04.659709 IP 112.26.1.1.36395 > 112.26.1.8.37309: Flags [.], seq 45697:47125, ack 1, win 4017, options [nop,nop,TS val 146539 ecr 4294888035,mptcp dss ack 3836451400 seq 1998876241 subseq 45697 len 1428 csum 0x6b59], length 1428
20:50:04.702468 IP 112.26.1.1.36395 > 112.26.1.8.37309: Flags [.], seq 28561:29989, ack 1, win 4017, options [nop,nop,TS val 144986 ecr 4294886918,mptcp dss ack 3836451400 seq 1998813409 subseq 28561 len 1428 csum 0x3e0b], length 1428
20:50:04.707607 IP 112.26.1.8.37309 > 112.26.1.1.36395: Flags [.], ack 25705, win 11270, options [nop,nop,TS val 4294889818 ecr 144688,nop,nop,sack 2 {28561:29989}{34273:37129},mptcp dss ack 1998790561], length 0
20:50:04.742769 IP 112.26.1.8.37309 > 112.26.1.1.36395: Flags [.], ack 18565, win 9810, options [nop,nop,TS val 4294888573 ecr 144295,nop,nop,sack 1 {34273:35701},mptcp dss ack 1998780565], length 0
20:50:04.782352 IP 112.26.1.1.36395 > 112.26.1.8.37309: Flags [.], seq 31417:32845, ack 1, win 4017, options [nop,nop,TS val 145165 ecr 4294887083,mptcp dss ack 3836451400 seq 1998821977 subseq 31417 len 1428 csum 0xe563], length 1428
20:50:04.791834 IP 112.26.1.8.37309 > 112.26.1.1.36395: Flags [.], ack 25705, win 11407, options [nop,nop,TS val 4294889898 ecr 144688,nop,nop,sack 2 {31417:32845}{28561:29989},mptcp dss ack 1998790561], length 0
20:50:04.902628 IP 112.26.1.1.36395 > 112.26.1.8.37309: Flags [.], seq 47125:48553, ack 1, win 4017, options [nop,nop,TS val 146539 ecr 4294888035,mptcp dss ack 3836451400 seq 1998877669 subseq 47125 len 1428 csum 0xfab], length 1428
20:50:04.913301 IP 112.26.1.8.37309 > 112.26.1.1.36395: Flags [.], ack 24277, win 10540, options [nop,nop,TS val 4294889183 ecr 144688,nop,nop,sack 1 {34273:35701},mptcp dss ack 1998790561], length 0
20:50:04.994134 IP 112.26.1.1.36395 > 112.26.1.8.37309: Flags [.], seq 48553:49981, ack 1, win 4017, options [nop,nop,TS val 147056 ecr 4294888194,mptcp dss ack 3836451400 seq 1998894805 subseq 48553 len 1428 csum 0x230d], length 1428
20:50:05.005653 IP 112.26.1.1.36395 > 112.26.1.8.37309: Flags [.], seq 39985:41413, ack 1, win 4017, options [nop,nop,TS val 145657 ecr 4294887622,mptcp dss ack 3836451400 seq 1998844825 subseq 39985 len 1428 csum 0x9073], length 1428
20:50:05.010897 IP 112.26.1.8.37309 > 112.26.1.1.36395: Flags [.], ack 25705, win 11635, options [nop,nop,TS val 4294890121 ecr 144688,nop,nop,sack 2 {39985:41413}{31417:32845},mptcp dss ack 1998790561], length 0
20:50:05.062372 IP 112.26.1.8.37309 > 112.26.1.1.36395: Flags [.], ack 19993, win 9947, options [nop,nop,TS val 4294888679 ecr 144295,nop,nop,sack 1 {34273:35701},mptcp dss ack 1998790561], length 0
20:50:05.086119 IP 112.26.1.8.37309 > 112.26.1.1.36395: Flags [.], ack 25705, win 10859, options [nop,nop,TS val 4294889404 ecr 144688,nop,nop,sack 1 {34273:35701},mptcp dss ack 1998790561], length 0
20:50:05.129409 IP 112.26.1.1.36395 > 112.26.1.8.37309: Flags [.], seq 41413:42841, ack 1, win 4017, options [nop,nop,TS val 145657 ecr 4294887622,mptcp dss ack 3836451400 seq 1998846253 subseq 41413 len 1428 csum 0xe575], length 1428
20:50:05.131684 IP 112.26.1.8.37309 > 112.26.1.1.36395: Flags [.], ack 25705, win 11772, options [nop,nop,TS val 4294890245 ecr 144688,nop,nop,sack 2 {39985:42841}{31417:32845},mptcp dss ack 1998790561], length 0
20:50:05.163011 IP 112.26.1.8.37309 > 112.26.1.1.36395: Flags [.], ack 21421, win 10038, options [nop,nop,TS val 4294888742 ecr 144490,nop,nop,sack 1 {34273:35701},mptcp dss ack 1998790561], length 0
20:50:05.217931 IP 112.26.1.1.36395 > 112.26.1.8.37309: Flags [.], seq 42841:44269, ack 1, win 4017, options [nop,nop,TS val 145946 ecr 4294887853,mptcp dss ack 3836451400 seq 1998859105 subseq 42841 len 1428 csum 0xc317], length 1428
20:50:05.220146 IP 112.26.1.8.37309 > 112.26.1.1.36395: Flags [.], ack 25705, win 11909, options [nop,nop,TS val 4294890333 ecr 144688,nop,nop,sack 2 {39985:44269}{31417:32845},mptcp dss ack 1998790561], length 0
20:50:05.226745 IP 112.26.1.8.37309 > 112.26.1.1.36395: Flags [.], ack 22849, win 10175, options [nop,nop,TS val 4294888846 ecr 144490,nop,nop,sack 1 {34273:35701},mptcp dss ack 1998790561], length 0
20:50:05.338248 IP 112.26.1.8.37309 > 112.26.1.1.36395: Flags [.], ack 25705, win 11087, options [nop,nop,TS val 4294889625 ecr 144688,nop,nop,sack 1 {34273:37129},mptcp dss ack 1998790561], length 0
20:50:05.422910 IP 112.26.1.1.36395 > 112.26.1.8.37309: Flags [.], seq 44269:45697, ack 1, win 4017, options [nop,nop,TS val 145946 ecr 4294887853,mptcp dss ack 3836451400 seq 1998860533 subseq 44269 len 1428 csum 0x9ab0], length 1428
20:50:05.425707 IP 112.26.1.8.37309 > 112.26.1.1.36395: Flags [.], ack 25705, win 12137, options [nop,nop,TS val 4294890538 ecr 144688,nop,nop,sack 2 {39985:45697}{31417:32845},mptcp dss ack 1998806269], length 0
20:50:05.467262 IP 112.26.1.1.36395 > 112.26.1.8.37309: Flags [.], seq 45697:47125, ack 1, win 4017, options [nop,nop,TS val 146539 ecr 4294888035,mptcp dss ack 3836451400 seq 1998876241 subseq 45697 len 1428 csum 0x6b59], length 1428
20:50:05.525222 IP 112.26.1.8.37309 > 112.26.1.1.36395: Flags [.], ack 25705, win 12182, options [nop,nop,TS val 4294890583 ecr 144688,nop,nop,sack 2 {39985:47125}{31417:32845},mptcp dss ack 1998806269], length 0
20:50:05.558192 IP 112.26.1.1.36395 > 112.26.1.8.37309: Flags [.], seq 18565:19993, ack 1, win 4017, options [nop,nop,TS val 147851 ecr 4294888573,mptcp dss ack 3836451400 seq 1998780565 subseq 18565 len 1428 csum 0x3e86], length 1428
20:50:05.568114 IP 112.26.1.8.37309 > 112.26.1.1.36395: Flags [.], ack 25705, win 11270, options [nop,nop,TS val 4294889818 ecr 144688,nop,nop,sack 2 {28561:29989}{34273:37129},mptcp dss ack 1998790561], length 0
20:50:05.628150 IP 112.26.1.8.37309 > 112.26.1.1.36395: Flags [.], ack 25705, win 11407, options [nop,nop,TS val 4294889898 ecr 144688,nop,nop,sack 2 {31417:32845}{28561:29989},mptcp dss ack 1998790561], length 0
20:50:05.663579 IP 112.26.1.8.37309 > 112.26.1.1.36395: Flags [.], ack 24277, win 10540, options [nop,nop,TS val 4294889183 ecr 144688,nop,nop,sack 1 {34273:35701},mptcp dss ack 1998790561], length 0
20:50:05.699775 IP 112.26.1.1.36395 > 112.26.1.8.37309: Flags [.], seq 47125:48553, ack 1, win 4017, options [nop,nop,TS val 146539 ecr 4294888035,mptcp dss ack 3836451400 seq 1998877669 subseq 47125 len 1428 csum 0xfab], length 1428
20:50:05.701312 IP 112.26.1.8.37309 > 112.26.1.1.36395: Flags [.], ack 25705, win 12319, options [nop,nop,TS val 4294890815 ecr 144688,nop,nop,sack 2 {39985:48553}{31417:32845},mptcp dss ack 1998806269], length 0
20:50:05.796900 IP 112.26.1.1.36395 > 112.26.1.8.37309: Flags [.], seq 48553:49981, ack 1, win 4017, options [nop,nop,TS val 147056 ecr 4294888194,mptcp dss ack 3836451400 seq 1998894805 subseq 48553 len 1428 csum 0x230d], length 1428
20:50:05.798226 IP 112.26.1.8.37309 > 112.26.1.1.36395: Flags [.], ack 25705, win 12456, options [nop,nop,TS val 4294890912 ecr 144688,nop,nop,sack 2 {39985:49981}{31417:32845},mptcp dss ack 1998806269], length 0
20:50:05.819184 IP 112.26.1.1.36395 > 112.26.1.8.37309: Flags [.], seq 51409:52837, ack 1, win 4017, options [nop,nop,TS val 148173 ecr 4294888679,mptcp dss ack 3836451400 seq 1998937645 subseq 51409 len 1428 csum 0xb56], length 1428
20:50:05.903898 IP 112.26.1.8.37309 > 112.26.1.1.36395: Flags [.], ack 25705, win 11772, options [nop,nop,TS val 4294890245 ecr 144688,nop,nop,sack 2 {39985:42841}{31417:32845},mptcp dss ack 1998790561], length 0
20:50:05.923258 IP 112.26.1.8.37309 > 112.26.1.1.36395: Flags [.], ack 25705, win 10859, options [nop,nop,TS val 4294889404 ecr 144688,nop,nop,sack 1 {34273:35701},mptcp dss ack 1998790561], length 0
20:50:05.959334 IP 112.26.1.8.37309 > 112.26.1.1.36395: Flags [.], ack 25705, win 11909, options [nop,nop,TS val 4294890333 ecr 144688,nop,nop,sack 2 {39985:44269}{31417:32845},mptcp dss ack 1998790561], length 0
20:50:05.992002 IP 112.26.1.1.36395 > 112.26.1.8.37309: Flags [.], seq 52837:54265, ack 1, win 4017, options [nop,nop,TS val 148173 ecr 4294888679,mptcp dss ack 3836451400 seq 1998939073 subseq 52837 len 1428 csum 0x89e2], length 1428
20:50:06.025610 IP 112.26.1.8.37309 > 112.26.1.1.36395: Flags [.], ack 25705, win 12137, options [nop,nop,TS val 4294890538 ecr 144688,nop,nop,sack 2 {39985:45697}{31417:32845},mptcp dss ack 1998806269], length 0
20:50:06.124377 IP 112.26.1.1.36395 > 112.26.1.8.37309: Flags [.], seq 54265:55693, ack 1, win 4017, options [nop,nop,TS val 148173 ecr 4294888679,mptcp dss ack 3836451400 seq 1998940501 subseq 54265 len 1428 csum 0x1720], length 1428
20:50:06.131743 IP 112.26.1.8.37309 > 112.26.1.1.36395: Flags [.], ack 25705, win 12182, options [nop,nop,TS val 4294890583 ecr 144688,nop,nop,sack 2 {39985:47125}{31417:32845},mptcp dss ack 1998806269], length 0
20:50:06.191884 IP 112.26.1.1.36395 > 112.26.1.8.37309: Flags [.], seq 18565:19993, ack 1, win 4017, options [nop,nop,TS val 147851 ecr 4294888573,mptcp dss ack 3836451400 seq 1998780565 subseq 18565 len 1428 csum 0x3e86], length 1428
20:50:06.193126 IP 112.26.1.8.37309 > 112.26.1.1.36395: Flags [.], ack 25705, win 12821, options [nop,nop,TS val 4294891307 ecr 144688,nop,nop,sack 2 {18565:19993}{39985:49981},mptcp dss ack 1998806269], length 0
20:50:06.252542 IP 112.26.1.8.37309 > 112.26.1.1.36395: Flags [.], ack 25705, win 11087, options [nop,nop,TS val 4294889625 ecr 144688,nop,nop,sack 1 {34273:37129},mptcp dss ack 1998790561], length 0
20:50:06.301892 IP 112.26.1.8.37309 > 112.26.1.1.36395: Flags [.], ack 25705, win 12319, options [nop,nop,TS val 4294890815 ecr 144688,nop,nop,sack 2 {39985:48553}{31417:32845},mptcp dss ack 1998806269], length 0
20:50:06.316949 IP 112.26.1.1.36395 > 112.26.1.8.37309: Flags [.], seq 57121:58549, ack 1, win 4017, options [nop,nop,TS val 148274 ecr 4294888742,mptcp dss ack 3836451400 seq 1998947641 subseq 57121 len 1428 csum 0x63aa], length 1428
20:50:06.357287 IP 112.26.1.8.37309 > 112.26.1.1.36395: Flags [.], ack 25705, win 12456, options [nop,nop,TS val 4294890912 ecr 144688,nop,nop,sack 2 {39985:49981}{31417:32845},mptcp dss ack 1998806269], length 0
20:50:06.401962 IP 112.26.1.8.37309 > 112.26.1.1.36395: Flags [.], ack 25705, win 11270, options [nop,nop,TS val 4294889818 ecr 144688,nop,nop,sack 2 {28561:29989}{34273:37129},mptcp dss ack 1998790561], length 0
20:50:06.435013 IP 112.26.1.1.36395 > 112.26.1.8.37309: Flags [.], seq 51409:52837, ack 1, win 4017, options [nop,nop,TS val 148173 ecr 4294888679,mptcp dss ack 3836451400 seq 1998937645 subseq 51409 len 1428 csum 0xb56], length 1428
20:50:06.436310 IP 112.26.1.8.37309 > 112.26.1.1.36395: Flags [.], ack 25705, win 13049, options [nop,nop,TS val 4294891551 ecr 144688,nop,nop,sack 2 {51409:52837}{39985:49981},mptcp dss ack 1998806269], length 0
20:50:06.490692 IP 112.26.1.1.36395 > 112.26.1.8.37309: Flags [.], seq 52837:54265, ack 1, win 4017, options [nop,nop,TS val 148173 ecr 4294888679,mptcp dss ack 3836451400 seq 1998939073 subseq 52837 len 1428 csum 0x89e2], length 1428
20:50:06.529193 IP 112.26.1.8.37309 > 112.26.1.1.36395: Flags [.], ack 25705, win 13186, options [nop,nop,TS val 4294891606 ecr 144688,nop,nop,sack 2 {51409:54265}{39985:49981},mptcp dss ack 1998806269], length 0
20:50:06.549814 IP 112.26.1.1.36395 > 112.26.1.8.37309: Flags [.], seq 61405:62833, ack 1, win 4017, options [nop,nop,TS val 148774 ecr 4294889183,mptcp dss ack 3836451400 seq 1998973345 subseq 61405 len 1428 csum 0xf0a4], length 1428
20:50:06.653334 IP 112.26.1.1.36395 > 112.26.1.8.37309: Flags [.], seq 62833:64261, ack 1, win 4017, options [nop,nop,TS val 148774 ecr 4294889183,mptcp dss ack 3836451400 seq 1998974773 subseq 62833 len 1428 csum 0x2222], length 1428
20:50:06.702770 IP 112.26.1.1.36395 > 112.26.1.8.37309: Flags [.], seq 54265:55693, ack 1, win 4017, options [nop,nop,TS val 148173 ecr 4294888679,mptcp dss ack 3836451400 seq 1998940501 subseq 54265 len 1428 csum 0x1720], length 1428
20:50:06.704703 IP 112.26.1.8.37309 > 112.26.1.1.36395: Flags [.], ack 25705, win 13414, options [nop,nop,TS val 4294891818 ecr 144688,nop,nop,sack 2 {51409:55693}{39985:49981},mptcp dss ack 1998806269], length 0
20:50:06.732499 IP 112.26.1.8.37309 > 112.26.1.1.36395: Flags [.], ack 25705, win 11772, options [nop,nop,TS val 4294890245 ecr 144688,nop,nop,sack 2 {39985:42841}{31417:32845},mptcp dss ack 1998790561], length 0
20:50:06.845648 IP 112.26.1.8.37309 > 112.26.1.1.36395: Flags [.], ack 25705, win 11909, options [nop,nop,TS val 4294890333 ecr 144688,nop,nop,sack 2 {39985:44269}{31417:32845},mptcp dss ack 1998790561], length 0
20:50:06.858626 IP 112.26.1.8.37309 > 112.26.1.1.36395: Flags [.], ack 25705, win 12821, options [nop,nop,TS val 4294891307 ecr 144688,nop,nop,sack 2 {18565:19993}{39985:49981},mptcp dss ack 1998806269], length 0
20:50:06.911623 IP 112.26.1.1.36395 > 112.26.1.8.37309: Flags [.], seq 57121:58549, ack 1, win 4017, options [nop,nop,TS val 148274 ecr 4294888742,mptcp dss ack 3836451400 seq 1998947641 subseq 57121 len 1428 csum 0x63aa], length 1428
20:50:06.913715 IP 112.26.1.8.37309 > 112.26.1.1.36395: Flags [.], ack 25705, win 13642, options [nop,nop,TS val 4294892027 ecr 144688,nop,nop,sack 2 {57121:58549}{51409:55693},mptcp dss ack 1998806269], length 0
20:50:06.976747 IP 112.26.1.8.37309 > 112.26.1.1.36395: Flags [.], ack 25705, win 12182, options [nop,nop,TS val 4294890583 ecr 144688,nop,nop,sack 2 {39985:47125}{31417:32845},mptcp dss ack 1998806269], length 0
20:50:06.984226 IP 112.26.1.8.37309 > 112.26.1.1.36395: Flags [.], ack 25705, win 13049, options [nop,nop,TS val 4294891551 ecr 144688,nop,nop,sack 2 {51409:52837}{39985:49981},mptcp dss ack 1998806269], length 0
20:50:07.049871 IP 112.26.1.8.37309 > 112.26.1.1.36395: Flags [.], ack 25705, win 12319, options [nop,nop,TS val 4294890815 ecr 144688,nop,nop,sack 2 {39985:48553}{31417:32845},mptcp dss ack 1998806269], length 0
20:50:07.055367 IP 112.26.1.8.37309 > 112.26.1.1.36395: Flags [.], ack 25705, win 13186, options [nop,nop,TS val 4294891606 ecr 144688,nop,nop,sack 2 {51409:54265}{39985:49981},mptcp dss ack 1998806269], length 0
20:50:07.114566 IP 112.26.1.1.36395 > 112.26.1.8.37309: Flags [.], seq 61405:62833, ack 1, win 4017, options [nop,nop,TS val 148774 ecr 4294889183,mptcp dss ack 3836451400 seq 1998973345 subseq 61405 len 1428 csum 0xf0a4], length 1428
20:50:07.116909 IP 112.26.1.8.37309 > 112.26.1.1.36395: Flags [.], ack 25705, win 13870, options [nop,nop,TS val 4294892230 ecr 144688,nop,nop,sack 2 {61405:62833}{57121:58549},mptcp dss ack 1998806269], length 0
20:50:07.150346 IP 112.26.1.8.37309 > 112.26.1.1.36395: Flags [.], ack 25705, win 12456, options [nop,nop,TS val 4294890912 ecr 144688,nop,nop,sack 2 {39985:49981}{31417:32845},mptcp dss ack 1998806269], length 0
20:50:07.199447 IP 112.26.1.1.36395 > 112.26.1.8.37309: Flags [.], seq 62833:64261, ack 1, win 4017, options [nop,nop,TS val 148774 ecr 4294889183,mptcp dss ack 3836451400 seq 1998974773 subseq 62833 len 1428 csum 0x2222], length 1428
20:50:07.226546 IP 112.26.1.8.37309 > 112.26.1.1.36395: Flags [.], ack 25705, win 14007, options [nop,nop,TS val 4294892315 ecr 144688,nop,nop,sack 2 {61405:64261}{57121:58549},mptcp dss ack 1998806269], length 0
20:50:07.266885 IP 112.26.1.1.36395 > 112.26.1.8.37309: Flags [.], seq 67117:68545, ack 1, win 4017, options [nop,nop,TS val 149488 ecr 4294889625,mptcp dss ack 3836451400 seq 1999000477 subseq 67117 len 1428 csum 0xa3a4], length 1428
20:50:07.284195 IP 112.26.1.8.37309 > 112.26.1.1.36395: Flags [.], ack 25705, win 13414, options [nop,nop,TS val 4294891818 ecr 144688,nop,nop,sack 2 {51409:55693}{39985:49981},mptcp dss ack 1998806269], length 0
20:50:07.356135 IP 112.26.1.1.36395 > 112.26.1.8.37309: Flags [.], seq 69973:71401, ack 1, win 4017, options [nop,nop,TS val 149627 ecr 4294889818,mptcp dss ack 3836451400 seq 1999009045 subseq 69973 len 1428 csum 0x510d], length 1428
20:50:07.385096 IP 112.26.1.8.37309 > 112.26.1.1.36395: Flags [.], ack 25705, win 13642, options [nop,nop,TS val 4294892027 ecr 144688,nop,nop,sack 2 {57121:58549}{51409:55693},mptcp dss ack 1998806269], length 0
20:50:07.421533 IP 112.26.1.1.36395 > 112.26.1.8.37309: Flags [.], seq 71401:72829, ack 1, win 4017, options [nop,nop,TS val 149886 ecr 4294890245,mptcp dss ack 3836451400 seq 1999014757 subseq 71401 len 1428 csum 0xc745], length 1428
20:50:07.441948 IP 112.26.1.8.37309 > 112.26.1.1.36395: Flags [.], ack 25705, win 13870, options [nop,nop,TS val 4294892230 ecr 144688,nop,nop,sack 2 {61405:62833}{57121:58549},mptcp dss ack 1998806269], length 0
20:50:07.502520 IP 112.26.1.8.37309 > 112.26.1.1.36395: Flags [.], ack 25705, win 12821, options [nop,nop,TS val 4294891307 ecr 144688,nop,nop,sack 2 {18565:19993}{39985:49981},mptcp dss ack 1998806269], length 0
20:50:07.519232 IP 112.26.1.8.37309 > 112.26.1.1.36395: Flags [.], ack 25705, win 14007, options [nop,nop,TS val 4294892315 ecr 144688,nop,nop,sack 2 {61405:64261}{57121:58549},mptcp dss ack 1998806269], length 0
20:50:07.548943 IP 112.26.1.1.36395 > 112.26.1.8.37309: Flags [.], seq 67117:68545, ack 1, win 4017, options [nop,nop,TS val 149488 ecr 4294889625,mptcp dss ack 3836451400 seq 1999000477 subseq 67117 len 1428 csum 0xa3a4], length 1428
20:50:07.551872 IP 112.26.1.8.37309 > 112.26.1.1.36395: Flags [.], ack 25705, win 14372, options [nop,nop,TS val 4294892664 ecr 144688,nop,nop,sack 2 {67117:68545}{61405:64261},mptcp dss ack 1998806269], length 0
20:50:07.577942 IP 112.26.1.1.36395 > 112.26.1.8.37309: Flags [.], seq 72829:74257, ack 1, win 4017, options [nop,nop,TS val 149886 ecr 4294890245,mptcp dss ack 3836451400 seq 1999016185 subseq 72829 len 1428 csum 0xb610], length 1428
20:50:07.629601 IP 112.26.1.1.36395 > 112.26.1.8.37309: Flags [.], seq 74257:75685, ack 1, win 4017, options [nop,nop,TS val 149886 ecr 4294890245,mptcp dss ack 3836451400 seq 1999017613 subseq 74257 len 1428 csum 0x7b2b], length 1428
20:50:07.638991 IP 112.26.1.1.36395 > 112.26.1.8.37309: Flags [.], seq 69973:71401, ack 1, win 4017, options [nop,nop,TS val 149627 ecr 4294889818,mptcp dss ack 3836451400 seq 1999009045 subseq 69973 len 1428 csum 0x510d], length 1428
