17:10:28.387133 IP 112.26.0.8.50154 > 112.26.0.1.targus-getdata1: Flags [S], seq 3862265769, win 65535, options [mss 1460,sackOK,TS val 4294759456 ecr 0,nop,wscale 6,mptcp capable csum {0xf18a364a29c98962}], length 0
17:10:28.401356 IP 112.26.0.8.50154 > 112.26.0.1.targus-getdata1: Flags [S], seq 3862265769, win 65535, options [mss 1460,sackOK,TS val 4294759456 ecr 0,nop,wscale 6,mptcp capable csum {0xf18a364a29c98962}], length 0
17:10:28.414483 IP 112.26.0.8.50154 > 112.26.0.1.targus-getdata1: Flags [S], seq 3862265769, win 65535, options [mss 1460,sackOK,TS val 4294759456 ecr 0,nop,wscale 6,mptcp capable csum {0xf18a364a29c98962}], length 0
17:10:28.686456 IP 112.26.0.1.targus-getdata1 > 112.26.0.8.50154: Flags [S.], seq 3747177684, ack 3862265770, win 28560, options [mss 1460,sackOK,TS val 20829 ecr 4294759456,nop,wscale 7,mptcp capable csum {0x514aa99cf55cf33b}], length 0
17:10:28.686777 IP 112.26.0.1.targus-getdata1 > 112.26.0.8.50154: Flags [S.], seq 3747177684, ack 3862265770, win 28560, options [mss 1460,sackOK,TS val 20829 ecr 4294759456,nop,wscale 7,mptcp capable csum {0x514aa99cf55cf33b}], length 0
17:10:28.702063 IP 112.26.0.8.50154 > 112.26.0.1.targus-getdata1: Flags [.], ack 1, win 1369, options [nop,nop,TS val 4294759812 ecr 20829,mptcp capable csum {0xf18a364a29c98962,0x514aa99cf55cf33b},mptcp dss ack 2233144299], length 0
17:10:28.702293 IP 112.26.0.8.50154 > 112.26.0.1.targus-getdata1: Flags [.], ack 1, win 1369, options [nop,nop,TS val 4294759812 ecr 20829,mptcp capable csum {0xf18a364a29c98962,0x514aa99cf55cf33b},mptcp dss ack 2233144299], length 0
17:11:06.094269 IP 112.26.0.8.50156 > 112.26.0.1.targus-getdata1: Flags [.], seq 1612183091:1612184519, ack 3373602204, win 4107, options [nop,nop,TS val 4294796705 ecr 57160,mptcp dss ack 569926353 seq 2858357283 subseq 388454 len 1428 csum 0x334c], length 1428
17:11:06.157552 IP 112.26.0.8.50156 > 112.26.0.1.targus-getdata1: Flags [.], seq 1428:2856, ack 1, win 4107, options [nop,nop,TS val 4294796832 ecr 57298,mptcp dss ack 569926353 seq 2858365851 subseq 389882 len 1428 csum 0x1341], length 1428
17:11:06.180665 IP 112.26.0.8.50156 > 112.26.0.1.targus-getdata1: Flags [.], seq 7140:8568, ack 1, win 4107, options [nop,nop,TS val 4294797282 ecr 57806,mptcp dss ack 569926353 seq 2858384415 subseq 395594 len 1428 csum 0x3c52], length 1428
17:11:06.185318 IP 112.26.0.1.targus-getdata1 > 112.26.0.8.50156: Flags [.], ack 4294965868, win 7639, options [nop,nop,TS val 58343 ecr 4294796424,mptcp dss ack 2858287311], length 0
17:11:06.185727 IP 112.26.0.1.targus-getdata1 > 112.26.0.8.50156: Flags [.], ack 4294965868, win 7639, options [nop,nop,TS val 58343 ecr 4294796424,mptcp dss ack 2858287311], length 0
17:11:06.209142 IP 112.26.0.8.50156 > 112.26.0.1.targus-getdata1: Flags [.], seq 1428:2856, ack 1, win 4107, options [nop,nop,TS val 4294796832 ecr 57298,mptcp dss ack 569926353 seq 2858365851 subseq 389882 len 1428 csum 0x1341], length 1428
17:11:06.280388 IP 112.26.0.8.50156 > 112.26.0.1.targus-getdata1: Flags [.], seq 2856:4284, ack 1, win 4107, options [nop,nop,TS val 4294796883 ecr 57420,mptcp dss ack 569926353 seq 2858368707 subseq 391310 len 1428 csum 0x3115], length 1428
17:11:06.288035 IP 112.26.0.8.50156 > 112.26.0.1.targus-getdata1: Flags [.], seq 2856:4284, ack 1, win 4107, options [nop,nop,TS val 4294796883 ecr 57420,mptcp dss ack 569926353 seq 2858368707 subseq 391310 len 1428 csum 0x3115], length 1428
17:11:06.302722 IP 112.26.0.1.targus-getdata1 > 112.26.0.8.50156: Flags [.], ack 0, win 7639, options [nop,nop,TS val 58488 ecr 4294796570,mptcp dss ack 2858287311], length 0
17:11:06.303058 IP 112.26.0.1.targus-getdata1 > 112.26.0.8.50156: Flags [.], ack 0, win 7639, options [nop,nop,TS val 58488 ecr 4294796570,mptcp dss ack 2858287311], length 0
17:11:06.367872 IP 112.26.0.1.targus-getdata1 > 112.26.0.8.50156: Flags [.], ack 2856, win 7639, options [nop,nop,TS val 58623 ecr 4294796705,mptcp dss ack 2858287311], length 0
17:11:06.368154 IP 112.26.0.1.targus-getdata1 > 112.26.0.8.50156: Flags [.], ack 2856, win 7639, options [nop,nop,TS val 58623 ecr 4294796705,mptcp dss ack 2858287311], length 0
17:11:06.386865 IP 112.26.0.8.50156 > 112.26.0.1.targus-getdata1: Flags [.], seq 4284:5712, ack 1, win 4107, options [nop,nop,TS val 4294796990 ecr 57554,mptcp dss ack 569926353 seq 2858371563 subseq 392738 len 1428 csum 0x53e6], length 1428
17:11:06.395405 IP 112.26.0.8.50156 > 112.26.0.1.targus-getdata1: Flags [.], seq 4284:5712, ack 1, win 4107, options [nop,nop,TS val 4294796990 ecr 57554,mptcp dss ack 569926353 seq 2858371563 subseq 392738 len 1428 csum 0x53e6], length 1428
17:11:06.427947 IP 112.26.0.8.50156 > 112.26.0.1.targus-getdata1: Flags [.], seq 9996:11424, ack 1, win 4107, options [nop,nop,TS val 4294797478 ecr 58052,mptcp dss ack 569926353 seq 2858387271 subseq 398450 len 1428 csum 0x29cc], length 1428
17:11:06.464093 IP 112.26.0.8.50156 > 112.26.0.1.targus-getdata1: Flags [.], seq 5712:7140, ack 1, win 4107, options [nop,nop,TS val 4294797129 ecr 57700,mptcp dss ack 569926353 seq 2858380131 subseq 394166 len 1428 csum 0x6329], length 1428
17:11:06.481529 IP 112.26.0.1.targus-getdata1 > 112.26.0.8.50156: Flags [.], ack 5712, win 7639, options [nop,nop,TS val 58810 ecr 4294796883,mptcp dss ack 2858287311], length 0
17:11:06.481836 IP 112.26.0.1.targus-getdata1 > 112.26.0.8.50156: Flags [.], ack 5712, win 7639, options [nop,nop,TS val 58810 ecr 4294796883,mptcp dss ack 2858287311], length 0
17:11:06.488727 IP 112.26.0.8.50156 > 112.26.0.1.targus-getdata1: Flags [.], seq 11424:12852, ack 1, win 4107, options [nop,nop,TS val 4294797478 ecr 58052,mptcp dss ack 569926353 seq 2858388699 subseq 399878 len 1428 csum 0x2f0c], length 1428
17:11:06.501035 IP 112.26.0.8.50156 > 112.26.0.1.targus-getdata1: Flags [.], seq 5712:7140, ack 1, win 4107, options [nop,nop,TS val 4294797129 ecr 57700,mptcp dss ack 569926353 seq 2858380131 subseq 394166 len 1428 csum 0x6329], length 1428
17:11:06.545222 IP 112.26.0.8.50156 > 112.26.0.1.targus-getdata1: Flags [.], seq 12852:14280, ack 1, win 4107, options [nop,nop,TS val 4294797623 ecr 58200,mptcp dss ack 569926353 seq 2858394411 subseq 401306 len 1428 csum 0xea81], length 1428
17:11:06.577840 IP 112.26.0.8.50156 > 112.26.0.1.targus-getdata1: Flags [.], seq 7140:8568, ack 1, win 4107, options [nop,nop,TS val 4294797282 ecr 57806,mptcp dss ack 569926353 seq 2858384415 subseq 395594 len 1428 csum 0x3c52], length 1428
17:11:06.615609 IP 112.26.0.8.50156 > 112.26.0.1.targus-getdata1: Flags [.], seq 7140:8568, ack 1, win 4107, options [nop,nop,TS val 4294797282 ecr 57806,mptcp dss ack 569926353 seq 2858384415 subseq 395594 len 1428 csum 0x3c52], length 1428
17:11:06.619453 IP 112.26.0.1.targus-getdata1 > 112.26.0.8.50156: Flags [.], ack 8568, win 7639, options [nop,nop,TS val 59029 ecr 4294797129,mptcp dss ack 2858287311], length 0
17:11:06.619707 IP 112.26.0.1.targus-getdata1 > 112.26.0.8.50156: Flags [.], ack 8568, win 7639, options [nop,nop,TS val 59029 ecr 4294797129,mptcp dss ack 2858287311], length 0
17:11:06.649534 IP 112.26.0.8.50156 > 112.26.0.1.targus-getdata1: Flags [.], seq 14280:15708, ack 1, win 4107, options [nop,nop,TS val 4294797751 ecr 58343,mptcp dss ack 569926353 seq 2858404407 subseq 402734 len 1428 csum 0x7809], length 1428
17:11:06.666193 IP 112.26.0.8.50156 > 112.26.0.1.targus-getdata1: Flags [.], seq 9996:11424, ack 1, win 4107, options [nop,nop,TS val 4294797478 ecr 58052,mptcp dss ack 569926353 seq 2858387271 subseq 398450 len 1428 csum 0x29cc], length 1428
17:11:06.713792 IP 112.26.0.8.50156 > 112.26.0.1.targus-getdata1: Flags [.], seq 9996:11424, ack 1, win 4107, options [nop,nop,TS val 4294797478 ecr 58052,mptcp dss ack 569926353 seq 2858387271 subseq 398450 len 1428 csum 0x29cc], length 1428
17:11:06.741427 IP 112.26.0.1.targus-getdata1 > 112.26.0.8.50156: Flags [.], ack 8568, win 7576, options [nop,nop,TS val 59128 ecr 4294797129,nop,nop,sack 1 {9996:11424},mptcp dss ack 2858307303], length 0
17:11:06.741747 IP 112.26.0.1.targus-getdata1 > 112.26.0.8.50156: Flags [.], ack 8568, win 7576, options [nop,nop,TS val 59128 ecr 4294797129,nop,nop,sack 1 {9996:11424},mptcp dss ack 2858307303], length 0
17:11:06.748879 IP 112.26.0.8.50156 > 112.26.0.1.targus-getdata1: Flags [.], seq 15708:17136, ack 1, win 4107, options [nop,nop,TS val 4294797844 ecr 58488,mptcp dss ack 569926353 seq 2858405835 subseq 404162 len 1428 csum 0xe4be], length 1428
17:11:06.805438 IP 112.26.0.8.50156 > 112.26.0.1.targus-getdata1: Flags [.], seq 11424:12852, ack 1, win 4107, options [nop,nop,TS val 4294797478 ecr 58052,mptcp dss ack 569926353 seq 2858388699 subseq 399878 len 1428 csum 0x2f0c], length 1428
17:11:06.813980 IP 112.26.0.8.50156 > 112.26.0.1.targus-getdata1: Flags [.], seq 11424:12852, ack 1, win 4107, options [nop,nop,TS val 4294797478 ecr 58052,mptcp dss ack 569926353 seq 2858388699 subseq 399878 len 1428 csum 0x2f0c], length 1428
17:11:06.815178 IP 112.26.0.1.targus-getdata1 > 112.26.0.8.50156: Flags [.], ack 8568, win 7576, options [nop,nop,TS val 59223 ecr 4294797129,nop,nop,sack 1 {9996:12852},mptcp dss ack 2858307303], length 0
17:11:06.815431 IP 112.26.0.1.targus-getdata1 > 112.26.0.8.50156: Flags [.], ack 8568, win 7576, options [nop,nop,TS val 59223 ecr 4294797129,nop,nop,sack 1 {9996:12852},mptcp dss ack 2858307303], length 0
17:11:06.850963 IP 112.26.0.8.50156 > 112.26.0.1.targus-getdata1: Flags [.], seq 17136:18564, ack 1, win 4107, options [nop,nop,TS val 4294797916 ecr 58623,mptcp dss ack 569926353 seq 2858411547 subseq 405590 len 1428 csum 0x56f9], length 1428
17:11:06.878025 IP 112.26.0.8.50156 > 112.26.0.1.targus-getdata1: Flags [.], seq 12852:14280, ack 1, win 4107, options [nop,nop,TS val 4294797623 ecr 58200,mptcp dss ack 569926353 seq 2858394411 subseq 401306 len 1428 csum 0xea81], length 1428
17:11:06.902145 IP 112.26.0.8.50156 > 112.26.0.1.targus-getdata1: Flags [.], seq 12852:14280, ack 1, win 4107, options [nop,nop,TS val 4294797623 ecr 58200,mptcp dss ack 569926353 seq 2858394411 subseq 401306 len 1428 csum 0xea81], length 1428
17:11:06.925000 IP 112.26.0.8.50156 > 112.26.0.1.targus-getdata1: Flags [.], seq 18564:19992, ack 1, win 4107, options [nop,nop,TS val 4294797916 ecr 58623,mptcp dss ack 569926353 seq 2858412975 subseq 407018 len 1428 csum 0x6b98], length 1428
17:11:06.929730 IP 112.26.0.1.targus-getdata1 > 112.26.0.8.50156: Flags [.], ack 8568, win 7639, options [nop,nop,TS val 59316 ecr 4294797129,nop,nop,sack 1 {9996:14280},mptcp dss ack 2858361567], length 0
17:11:06.930013 IP 112.26.0.1.targus-getdata1 > 112.26.0.8.50156: Flags [.], ack 8568, win 7639, options [nop,nop,TS val 59316 ecr 4294797129,nop,nop,sack 1 {9996:14280},mptcp dss ack 2858361567], length 0
17:11:06.972105 IP 112.26.0.8.50156 > 112.26.0.1.targus-getdata1: Flags [.], seq 14280:15708, ack 1, win 4107, options [nop,nop,TS val 4294797751 ecr 58343,mptcp dss ack 569926353 seq 2858404407 subseq 402734 len 1428 csum 0x7809], length 1428
17:11:07.004934 IP 112.26.0.8.50156 > 112.26.0.1.targus-getdata1: Flags [.], seq 14280:15708, ack 1, win 4107, options [nop,nop,TS val 4294797751 ecr 58343,mptcp dss ack 569926353 seq 2858404407 subseq 402734 len 1428 csum 0x7809], length 1428
17:11:07.019337 IP 112.26.0.8.50156 > 112.26.0.1.targus-getdata1: Flags [.], seq 19992:21420, ack 1, win 4107, options [nop,nop,TS val 4294798077 ecr 58810,mptcp dss ack 569926353 seq 2858432967 subseq 408446 len 1428 csum 0x64ac], length 1428
17:11:07.040295 IP 112.26.0.8.50156 > 112.26.0.1.targus-getdata1: Flags [.], seq 15708:17136, ack 1, win 4107, options [nop,nop,TS val 4294797844 ecr 58488,mptcp dss ack 569926353 seq 2858405835 subseq 404162 len 1428 csum 0xe4be], length 1428
17:11:07.062454 IP 112.26.0.1.targus-getdata1 > 112.26.0.8.50156: Flags [.], ack 8568, win 7639, options [nop,nop,TS val 59419 ecr 4294797129,nop,nop,sack 1 {9996:15708},mptcp dss ack 2858361567], length 0
17:11:07.062657 IP 112.26.0.1.targus-getdata1 > 112.26.0.8.50156: Flags [.], ack 8568, win 7639, options [nop,nop,TS val 59419 ecr 4294797129,nop,nop,sack 1 {9996:15708},mptcp dss ack 2858361567], length 0
17:11:07.094525 IP 112.26.0.8.50156 > 112.26.0.1.targus-getdata1: Flags [.], seq 21420:22848, ack 1, win 4107, options [nop,nop,TS val 4294798077 ecr 58810,mptcp dss ack 569926353 seq 2858434395 subseq 409874 len 1428 csum 0x67e8], length 1428
17:11:07.104594 IP 112.26.0.8.50156 > 112.26.0.1.targus-getdata1: Flags [.], seq 15708:17136, ack 1, win 4107, options [nop,nop,TS val 4294797844 ecr 58488,mptcp dss ack 569926353 seq 2858405835 subseq 404162 len 1428 csum 0xe4be], length 1428
17:11:07.167943 IP 112.26.0.8.50156 > 112.26.0.1.targus-getdata1: Flags [.], seq 17136:18564, ack 1, win 4107, options [nop,nop,TS val 4294797916 ecr 58623,mptcp dss ack 569926353 seq 2858411547 subseq 405590 len 1428 csum 0x56f9], length 1428
17:11:07.204715 IP 112.26.0.1.targus-getdata1 > 112.26.0.8.50156: Flags [.], ack 8568, win 7639, options [nop,nop,TS val 59519 ecr 4294797129,nop,nop,sack 1 {9996:17136},mptcp dss ack 2858361567], length 0
17:11:07.205019 IP 112.26.0.1.targus-getdata1 > 112.26.0.8.50156: Flags [.], ack 8568, win 7639, options [nop,nop,TS val 59519 ecr 4294797129,nop,nop,sack 1 {9996:17136},mptcp dss ack 2858361567], length 0
17:11:07.227807 IP 112.26.0.8.50156 > 112.26.0.1.targus-getdata1: Flags [.], seq 17136:18564, ack 1, win 4107, options [nop,nop,TS val 4294797916 ecr 58623,mptcp dss ack 569926353 seq 2858411547 subseq 405590 len 1428 csum 0x56f9], length 1428
17:11:07.229327 IP 112.26.0.8.50156 > 112.26.0.1.targus-getdata1: Flags [.], seq 22848:24276, ack 1, win 4107, options [nop,nop,TS val 4294798201 ecr 59029,mptcp dss ack 569926353 seq 2858440107 subseq 411302 len 1428 csum 0x651f], length 1428
17:11:07.237124 IP 112.26.0.8.50156 > 112.26.0.1.targus-getdata1: Flags [.], seq 24276:25704, ack 1, win 4107, options [nop,nop,TS val 4294798201 ecr 59029,mptcp dss ack 569926353 seq 2858441535 subseq 412730 len 1428 csum 0x6f70], length 1428
17:11:07.258101 IP 112.26.0.1.targus-getdata1 > 112.26.0.8.50156: Flags [.], ack 8568, win 7639, options [nop,nop,TS val 59608 ecr 4294797129,nop,nop,sack 1 {9996:18564},mptcp dss ack 2858361567], length 0
17:11:07.258419 IP 112.26.0.1.targus-getdata1 > 112.26.0.8.50156: Flags [.], ack 8568, win 7639, options [nop,nop,TS val 59608 ecr 4294797129,nop,nop,sack 1 {9996:18564},mptcp dss ack 2858361567], length 0
17:11:07.267754 IP 112.26.0.8.50156 > 112.26.0.1.targus-getdata1: Flags [.], seq 18564:19992, ack 1, win 4107, options [nop,nop,TS val 4294797916 ecr 58623,mptcp dss ack 569926353 seq 2858412975 subseq 407018 len 1428 csum 0x6b98], length 1428
17:11:07.272018 IP 112.26.0.8.50156 > 112.26.0.1.targus-getdata1: Flags [.], seq 18564:19992, ack 1, win 4107, options [nop,nop,TS val 4294797916 ecr 58623,mptcp dss ack 569926353 seq 2858412975 subseq 407018 len 1428 csum 0x6b98], length 1428
17:11:07.319978 IP 112.26.0.8.50156 > 112.26.0.1.targus-getdata1: Flags [.], seq 25704:27132, ack 1, win 4107, options [nop,nop,TS val 4294798338 ecr 59128,mptcp dss ack 569926353 seq 2858442963 subseq 414158 len 1428 csum 0x6112], length 1428
17:11:07.372250 IP 112.26.0.8.50156 > 112.26.0.1.targus-getdata1: Flags [.], seq 19992:21420, ack 1, win 4107, options [nop,nop,TS val 4294798077 ecr 58810,mptcp dss ack 569926353 seq 2858432967 subseq 408446 len 1428 csum 0x64ac], length 1428
17:11:07.381317 IP 112.26.0.1.targus-getdata1 > 112.26.0.8.50156: Flags [.], ack 8568, win 7639, options [nop,nop,TS val 59686 ecr 4294797129,nop,nop,sack 1 {9996:19992},mptcp dss ack 2858361567], length 0
17:11:07.381620 IP 112.26.0.1.targus-getdata1 > 112.26.0.8.50156: Flags [.], ack 8568, win 7639, options [nop,nop,TS val 59686 ecr 4294797129,nop,nop,sack 1 {9996:19992},mptcp dss ack 2858361567], length 0
17:11:07.400498 IP 112.26.0.8.50156 > 112.26.0.1.targus-getdata1: Flags [.], seq 19992:21420, ack 1, win 4107, options [nop,nop,TS val 4294798077 ecr 58810,mptcp dss ack 569926353 seq 2858432967 subseq 408446 len 1428 csum 0x64ac], length 1428
17:11:07.402946 IP 112.26.0.8.50156 > 112.26.0.1.targus-getdata1: Flags [.], seq 27132:28560, ack 1, win 4107, options [nop,nop,TS val 4294798451 ecr 59223,mptcp dss ack 569926353 seq 2858450103 subseq 415586 len 1428 csum 0xd48c], length 1428
17:11:07.443280 IP 112.26.0.1.targus-getdata1 > 112.26.0.8.50156: Flags [.], ack 8568, win 7639, options [nop,nop,TS val 59805 ecr 4294797129,nop,nop,sack 1 {9996:21420},mptcp dss ack 2858361567], length 0
17:11:07.443657 IP 112.26.0.1.targus-getdata1 > 112.26.0.8.50156: Flags [.], ack 8568, win 7639, options [nop,nop,TS val 59805 ecr 4294797129,nop,nop,sack 1 {9996:21420},mptcp dss ack 2858361567], length 0
17:11:07.489706 IP 112.26.0.8.50156 > 112.26.0.1.targus-getdata1: Flags [.], seq 28560:29988, ack 1, win 4107, options [nop,nop,TS val 4294798522 ecr 59316,mptcp dss ack 569926353 seq 2858461527 subseq 417014 len 1428 csum 0x7bbe], length 1428
17:11:07.504808 IP 112.26.0.8.50156 > 112.26.0.1.targus-getdata1: Flags [.], seq 21420:22848, ack 1, win 4107, options [nop,nop,TS val 4294798077 ecr 58810,mptcp dss ack 569926353 seq 2858434395 subseq 409874 len 1428 csum 0x67e8], length 1428
17:11:07.509129 IP 112.26.0.8.50156 > 112.26.0.1.targus-getdata1: Flags [.], seq 21420:22848, ack 1, win 4107, options [nop,nop,TS val 4294798077 ecr 58810,mptcp dss ack 569926353 seq 2858434395 subseq 409874 len 1428 csum 0x67e8], length 1428
17:11:07.569884 IP 112.26.0.8.50156 > 112.26.0.1.targus-getdata1: Flags [.], seq 29988:31416, ack 1, win 4107, options [nop,nop,TS val 4294798522 ecr 59316,mptcp dss ack 569926353 seq 2858462955 subseq 418442 len 1428 csum 0xbd19], length 1428
17:11:07.651473 IP 112.26.0.8.50156 > 112.26.0.1.targus-getdata1: Flags [.], seq 8568:9996, ack 1, win 4107, options [nop,nop,TS val 4294798643 ecr 59419,mptcp dss ack 569926353 seq 2858385843 subseq 397022 len 1428 csum 0x1b74], length 1428
17:11:07.663494 IP 112.26.0.8.50156 > 112.26.0.1.targus-getdata1: Flags [.], seq 22848:24276, ack 1, win 4107, options [nop,nop,TS val 4294798201 ecr 59029,mptcp dss ack 569926353 seq 2858440107 subseq 411302 len 1428 csum 0x651f], length 1428
17:11:07.671386 IP 112.26.0.8.50156 > 112.26.0.1.targus-getdata1: Flags [.], seq 22848:24276, ack 1, win 4107, options [nop,nop,TS val 4294798201 ecr 59029,mptcp dss ack 569926353 seq 2858440107 subseq 411302 len 1428 csum 0x651f], length 1428
17:11:07.722345 IP 112.26.0.1.targus-getdata1 > 112.26.0.8.50156: Flags [.], ack 8568, win 7639, options [nop,nop,TS val 59923 ecr 4294797129,nop,nop,sack 1 {9996:22848},mptcp dss ack 2858361567], length 0
17:11:07.722714 IP 112.26.0.1.targus-getdata1 > 112.26.0.8.50156: Flags [.], ack 8568, win 7639, options [nop,nop,TS val 59923 ecr 4294797129,nop,nop,sack 1 {9996:22848},mptcp dss ack 2858361567], length 0
17:11:07.733590 IP 112.26.0.8.50156 > 112.26.0.1.targus-getdata1: Flags [.], seq 24276:25704, ack 1, win 4107, options [nop,nop,TS val 4294798201 ecr 59029,mptcp dss ack 569926353 seq 2858441535 subseq 412730 len 1428 csum 0x6f70], length 1428
17:11:07.736171 IP 112.26.0.8.50156 > 112.26.0.1.targus-getdata1: Flags [.], seq 24276:25704, ack 1, win 4107, options [nop,nop,TS val 4294798201 ecr 59029,mptcp dss ack 569926353 seq 2858441535 subseq 412730 len 1428 csum 0x6f70], length 1428
17:11:07.775483 IP 112.26.0.8.50156 > 112.26.0.1.targus-getdata1: Flags [.], seq 31416:32844, ack 1, win 4107, options [nop,nop,TS val 4294798876 ecr 59519,mptcp dss ack 569926353 seq 2858467239 subseq 419870 len 1428 csum 0x8e64], length 1428
17:11:07.847008 IP 112.26.0.1.targus-getdata1 > 112.26.0.8.50156: Flags [.], ack 8568, win 7639, options [nop,nop,TS val 60079 ecr 4294797129,nop,nop,sack 1 {9996:24276},mptcp dss ack 2858361567], length 0
17:11:07.847281 IP 112.26.0.1.targus-getdata1 > 112.26.0.8.50156: Flags [.], ack 8568, win 7639, options [nop,nop,TS val 60079 ecr 4294797129,nop,nop,sack 1 {9996:24276},mptcp dss ack 2858361567], length 0
17:11:07.855332 IP 112.26.0.8.50156 > 112.26.0.1.targus-getdata1: Flags [.], seq 25704:27132, ack 1, win 4107, options [nop,nop,TS val 4294798338 ecr 59128,mptcp dss ack 569926353 seq 2858442963 subseq 414158 len 1428 csum 0x6112], length 1428
17:11:07.861838 IP 112.26.0.8.50156 > 112.26.0.1.targus-getdata1: Flags [.], seq 25704:27132, ack 1, win 4107, options [nop,nop,TS val 4294798338 ecr 59128,mptcp dss ack 569926353 seq 2858442963 subseq 414158 len 1428 csum 0x6112], length 1428
17:11:07.897440 IP 112.26.0.8.50156 > 112.26.0.1.targus-getdata1: Flags [.], seq 32844:34272, ack 1, win 4107, options [nop,nop,TS val 4294798954 ecr 59608,mptcp dss ack 569926353 seq 2858470095 subseq 421298 len 1428 csum 0x36eb], length 1428
17:11:07.960399 IP 112.26.0.8.50156 > 112.26.0.1.targus-getdata1: Flags [.], seq 27132:28560, ack 1, win 4107, options [nop,nop,TS val 4294798451 ecr 59223,mptcp dss ack 569926353 seq 2858450103 subseq 415586 len 1428 csum 0xd48c], length 1428
17:11:07.975145 IP 112.26.0.8.50156 > 112.26.0.1.targus-getdata1: Flags [.], seq 27132:28560, ack 1, win 4107, options [nop,nop,TS val 4294798451 ecr 59223,mptcp dss ack 569926353 seq 2858450103 subseq 415586 len 1428 csum 0xd48c], length 1428
17:11:08.007607 IP 112.26.0.8.50156 > 112.26.0.1.targus-getdata1: Flags [.], seq 34272:35700, ack 1, win 4107, options [nop,nop,TS val 4294799117 ecr 59805,mptcp dss ack 569926353 seq 2858472951 subseq 422726 len 1428 csum 0xa3f7], length 1428
17:11:08.015351 IP 112.26.0.1.targus-getdata1 > 112.26.0.8.50156: Flags [.], ack 8568, win 7639, options [nop,nop,TS val 60150 ecr 4294797129,nop,nop,sack 1 {9996:25704},mptcp dss ack 2858361567], length 0
17:11:08.015642 IP 112.26.0.1.targus-getdata1 > 112.26.0.8.50156: Flags [.], ack 8568, win 7639, options [nop,nop,TS val 60150 ecr 4294797129,nop,nop,sack 1 {9996:25704},mptcp dss ack 2858361567], length 0
17:11:08.054861 IP 112.26.0.8.50156 > 112.26.0.1.targus-getdata1: Flags [.], seq 28560:29988, ack 1, win 4107, options [nop,nop,TS val 4294798522 ecr 59316,mptcp dss ack 569926353 seq 2858461527 subseq 417014 len 1428 csum 0x7bbe], length 1428
17:11:08.080820 IP 112.26.0.1.targus-getdata1 > 112.26.0.8.50156: Flags [.], ack 8568, win 7639, options [nop,nop,TS val 60275 ecr 4294797129,nop,nop,sack 1 {9996:27132},mptcp dss ack 2858361567], length 0
17:11:08.081074 IP 112.26.0.1.targus-getdata1 > 112.26.0.8.50156: Flags [.], ack 8568, win 7639, options [nop,nop,TS val 60275 ecr 4294797129,nop,nop,sack 1 {9996:27132},mptcp dss ack 2858361567], length 0
17:11:08.106891 IP 112.26.0.8.50156 > 112.26.0.1.targus-getdata1: Flags [.], seq 28560:29988, ack 1, win 4107, options [nop,nop,TS val 4294798522 ecr 59316,mptcp dss ack 569926353 seq 2858461527 subseq 417014 len 1428 csum 0x7bbe], length 1428
17:11:08.116087 IP 112.26.0.8.50156 > 112.26.0.1.targus-getdata1: Flags [.], seq 35700:37128, ack 1, win 4107, options [nop,nop,TS val 4294799204 ecr 59923,mptcp dss ack 569926353 seq 2858478663 subseq 424154 len 1428 csum 0x7e39], length 1428
17:11:08.149578 IP 112.26.0.1.targus-getdata1 > 112.26.0.8.50156: Flags [.], ack 8568, win 7639, options [nop,nop,TS val 60389 ecr 4294797129,nop,nop,sack 1 {9996:28560},mptcp dss ack 2858361567], length 0
17:11:08.149911 IP 112.26.0.1.targus-getdata1 > 112.26.0.8.50156: Flags [.], ack 8568, win 7639, options [nop,nop,TS val 60389 ecr 4294797129,nop,nop,sack 1 {9996:28560},mptcp dss ack 2858361567], length 0
17:11:08.163214 IP 112.26.0.8.50156 > 112.26.0.1.targus-getdata1: Flags [.], seq 29988:31416, ack 1, win 4107, options [nop,nop,TS val 4294798522 ecr 59316,mptcp dss ack 569926353 seq 2858462955 subseq 418442 len 1428 csum 0xbd19], length 1428
17:11:08.192866 IP 112.26.0.8.50156 > 112.26.0.1.targus-getdata1: Flags [.], seq 29988:31416, ack 1, win 4107, options [nop,nop,TS val 4294798522 ecr 59316,mptcp dss ack 569926353 seq 2858462955 subseq 418442 len 1428 csum 0xbd19], length 1428
17:11:08.249677 IP 112.26.0.8.50156 > 112.26.0.1.targus-getdata1: Flags [.], seq 8568:9996, ack 1, win 4107, options [nop,nop,TS val 4294798643 ecr 59419,mptcp dss ack 569926353 seq 2858385843 subseq 397022 len 1428 csum 0x1b74], length 1428
17:11:08.272150 IP 112.26.0.1.targus-getdata1 > 112.26.0.8.50156: Flags [.], ack 8568, win 7639, options [nop,nop,TS val 60521 ecr 4294797129,nop,nop,sack 1 {9996:29988},mptcp dss ack 2858361567], length 0
17:11:08.272471 IP 112.26.0.1.targus-getdata1 > 112.26.0.8.50156: Flags [.], ack 8568, win 7639, options [nop,nop,TS val 60521 ecr 4294797129,nop,nop,sack 1 {9996:29988},mptcp dss ack 2858361567], length 0
17:11:08.291682 IP 112.26.0.8.50156 > 112.26.0.1.targus-getdata1: Flags [.], seq 8568:9996, ack 1, win 4107, options [nop,nop,TS val 4294798643 ecr 59419,mptcp dss ack 569926353 seq 2858385843 subseq 397022 len 1428 csum 0x1b74], length 1428
17:11:08.336548 IP 112.26.0.8.50156 > 112.26.0.1.targus-getdata1: Flags [.], seq 31416:32844, ack 1, win 4107, options [nop,nop,TS val 4294798876 ecr 59519,mptcp dss ack 569926353 seq 2858467239 subseq 419870 len 1428 csum 0x8e64], length 1428
17:11:08.404553 IP 112.26.0.8.50156 > 112.26.0.1.targus-getdata1: Flags [.], seq 32844:34272, ack 1, win 4107, options [nop,nop,TS val 4294798954 ecr 59608,mptcp dss ack 569926353 seq 2858470095 subseq 421298 len 1428 csum 0x36eb], length 1428
17:11:08.421285 IP 112.26.0.1.targus-getdata1 > 112.26.0.8.50156: Flags [.], ack 8568, win 7639, options [nop,nop,TS val 60607 ecr 4294797129,nop,nop,sack 1 {9996:31416},mptcp dss ack 2858361567], length 0
17:11:08.421636 IP 112.26.0.1.targus-getdata1 > 112.26.0.8.50156: Flags [.], ack 8568, win 7639, options [nop,nop,TS val 60607 ecr 4294797129,nop,nop,sack 1 {9996:31416},mptcp dss ack 2858361567], length 0
17:11:08.498466 IP 112.26.0.8.50156 > 112.26.0.1.targus-getdata1: Flags [.], seq 34272:35700, ack 1, win 4107, options [nop,nop,TS val 4294799117 ecr 59805,mptcp dss ack 569926353 seq 2858472951 subseq 422726 len 1428 csum 0xa3f7], length 1428
17:11:08.520861 IP 112.26.0.8.50156 > 112.26.0.1.targus-getdata1: Flags [.], seq 37128:38556, ack 1, win 4107, options [nop,nop,TS val 4294799599 ecr 60275,mptcp dss ack 569926353 seq 2858494371 subseq 425582 len 1428 csum 0x7493], length 1428
17:11:08.560970 IP 112.26.0.8.50156 > 112.26.0.1.targus-getdata1: Flags [.], seq 31416:32844, ack 1, win 4107, options [nop,nop,TS val 4294798876 ecr 59519,mptcp dss ack 569926353 seq 2858467239 subseq 419870 len 1428 csum 0x8e64], length 1428
17:11:08.591880 IP 112.26.0.8.50156 > 112.26.0.1.targus-getdata1: Flags [.], seq 38556:39984, ack 1, win 4107, options [nop,nop,TS val 4294799656 ecr 60389,mptcp dss ack 569926353 seq 2858498655 subseq 427010 len 1428 csum 0x81e], length 1428
17:11:08.605004 IP 112.26.0.1.targus-getdata1 > 112.26.0.8.50156: Flags [.], ack 31416, win 7639, options [nop,nop,TS val 60706 ecr 4294798643,mptcp dss ack 2858361567], length 0
17:11:08.605279 IP 112.26.0.1.targus-getdata1 > 112.26.0.8.50156: Flags [.], ack 31416, win 7639, options [nop,nop,TS val 60706 ecr 4294798643,mptcp dss ack 2858361567], length 0
17:11:08.630170 IP 112.26.0.8.50156 > 112.26.0.1.targus-getdata1: Flags [.], seq 35700:37128, ack 1, win 4107, options [nop,nop,TS val 4294799204 ecr 59923,mptcp dss ack 569926353 seq 2858478663 subseq 424154 len 1428 csum 0x7e39], length 1428
17:11:08.688509 IP 112.26.0.8.50156 > 112.26.0.1.targus-getdata1: Flags [.], seq 37128:38556, ack 1, win 4107, options [nop,nop,TS val 4294799599 ecr 60275,mptcp dss ack 569926353 seq 2858494371 subseq 425582 len 1428 csum 0x7493], length 1428
17:11:08.706833 IP 112.26.0.1.targus-getdata1 > 112.26.0.8.50156: Flags [.], ack 32844, win 7639, options [nop,nop,TS val 60975 ecr 4294798876,mptcp dss ack 2858361567], length 0
17:11:08.707134 IP 112.26.0.1.targus-getdata1 > 112.26.0.8.50156: Flags [.], ack 32844, win 7639, options [nop,nop,TS val 60975 ecr 4294798876,mptcp dss ack 2858361567], length 0
17:11:08.727557 IP 112.26.0.8.50156 > 112.26.0.1.targus-getdata1: Flags [.], seq 39984:41412, ack 1, win 4107, options [nop,nop,TS val 4294799760 ecr 60521,mptcp dss ack 569926353 seq 2858512935 subseq 428438 len 1428 csum 0x3b01], length 1428
17:11:08.769710 IP 112.26.0.8.50156 > 112.26.0.1.targus-getdata1: Flags [.], seq 38556:39984, ack 1, win 4107, options [nop,nop,TS val 4294799656 ecr 60389,mptcp dss ack 569926353 seq 2858498655 subseq 427010 len 1428 csum 0x81e], length 1428
17:11:08.848808 IP 112.26.0.8.50156 > 112.26.0.1.targus-getdata1: Flags [.], seq 39984:41412, ack 1, win 4107, options [nop,nop,TS val 4294799760 ecr 60521,mptcp dss ack 569926353 seq 2858512935 subseq 428438 len 1428 csum 0x3b01], length 1428
17:11:08.919804 IP 112.26.0.8.50156 > 112.26.0.1.targus-getdata1: Flags [.], seq 32844:34272, ack 1, win 4107, options [nop,nop,TS val 4294798954 ecr 59608,mptcp dss ack 569926353 seq 2858470095 subseq 421298 len 1428 csum 0x36eb], length 1428
17:11:08.974732 IP 112.26.0.1.targus-getdata1 > 112.26.0.8.50156: Flags [.], ack 34272, win 7639, options [nop,nop,TS val 61333 ecr 4294798954,mptcp dss ack 2858361567], length 0
17:11:08.974967 IP 112.26.0.1.targus-getdata1 > 112.26.0.8.50156: Flags [.], ack 34272, win 7639, options [nop,nop,TS val 61333 ecr 4294798954,mptcp dss ack 2858361567], length 0
17:11:08.977772 IP 112.26.0.8.50156 > 112.26.0.1.targus-getdata1: Flags [.], seq 41412:42840, ack 1, win 4107, options [nop,nop,TS val 4294800080 ecr 60607,mptcp dss ack 569926353 seq 2858515791 subseq 429866 len 1428 csum 0x63a6], length 1428
17:11:09.013683 IP 112.26.0.8.50156 > 112.26.0.1.targus-getdata1: Flags [.], seq 34272:35700, ack 1, win 4107, options [nop,nop,TS val 4294799117 ecr 59805,mptcp dss ack 569926353 seq 2858472951 subseq 422726 len 1428 csum 0xa3f7], length 1428
17:11:09.064278 IP 112.26.0.1.targus-getdata1 > 112.26.0.8.50156: Flags [.], ack 35700, win 7639, options [nop,nop,TS val 61427 ecr 4294799117,mptcp dss ack 2858361567], length 0
17:11:09.064481 IP 112.26.0.1.targus-getdata1 > 112.26.0.8.50156: Flags [.], ack 35700, win 7639, options [nop,nop,TS val 61427 ecr 4294799117,mptcp dss ack 2858361567], length 0
17:11:09.091031 IP 112.26.0.8.50156 > 112.26.0.1.targus-getdata1: Flags [.], seq 42840:44268, ack 1, win 4107, options [nop,nop,TS val 4294800110 ecr 60706,mptcp dss ack 569926353 seq 2858521503 subseq 431294 len 1428 csum 0x1f58], length 1428
17:11:09.112405 IP 112.26.0.8.50156 > 112.26.0.1.targus-getdata1: Flags [.], seq 41412:42840, ack 1, win 4107, options [nop,nop,TS val 4294800080 ecr 60607,mptcp dss ack 569926353 seq 2858515791 subseq 429866 len 1428 csum 0x63a6], length 1428
17:11:09.201882 IP 112.26.0.8.50156 > 112.26.0.1.targus-getdata1: Flags [.], seq 44268:45696, ack 1, win 4107, options [nop,nop,TS val 4294800211 ecr 60975,mptcp dss ack 569926353 seq 2858525787 subseq 432722 len 1428 csum 0xca14], length 1428
17:11:09.226601 IP 112.26.0.8.50156 > 112.26.0.1.targus-getdata1: Flags [.], seq 42840:44268, ack 1, win 4107, options [nop,nop,TS val 4294800110 ecr 60706,mptcp dss ack 569926353 seq 2858521503 subseq 431294 len 1428 csum 0x1f58], length 1428
17:11:09.229462 IP 112.26.0.8.50156 > 112.26.0.1.targus-getdata1: Flags [.], seq 35700:37128, ack 1, win 4107, options [nop,nop,TS val 4294799204 ecr 59923,mptcp dss ack 569926353 seq 2858478663 subseq 424154 len 1428 csum 0x7e39], length 1428
17:11:09.289209 IP 112.26.0.8.50156 > 112.26.0.1.targus-getdata1: Flags [.], seq 44268:45696, ack 1, win 4107, options [nop,nop,TS val 4294800211 ecr 60975,mptcp dss ack 569926353 seq 2858525787 subseq 432722 len 1428 csum 0xca14], length 1428
17:11:09.303405 IP 112.26.0.1.targus-getdata1 > 112.26.0.8.50156: Flags [.], ack 37128, win 7639, options [nop,nop,TS val 61643 ecr 4294799204,mptcp dss ack 2858361567], length 0
17:11:09.303725 IP 112.26.0.1.targus-getdata1 > 112.26.0.8.50156: Flags [.], ack 37128, win 7639, options [nop,nop,TS val 61643 ecr 4294799204,mptcp dss ack 2858361567], length 0
17:11:09.335421 IP 112.26.0.8.50156 > 112.26.0.1.targus-getdata1: Flags [.], seq 37128:38556, ack 1, win 4107, options [nop,nop,TS val 4294799599 ecr 60275,mptcp dss ack 569926353 seq 2858494371 subseq 425582 len 1428 csum 0x7493], length 1428
17:11:09.462850 IP 112.26.0.1.targus-getdata1 > 112.26.0.8.50156: Flags [.], ack 38556, win 7639, options [nop,nop,TS val 61750 ecr 4294799599,mptcp dss ack 2858361567], length 0
17:11:09.463224 IP 112.26.0.1.targus-getdata1 > 112.26.0.8.50156: Flags [.], ack 38556, win 7639, options [nop,nop,TS val 61750 ecr 4294799599,mptcp dss ack 2858361567], length 0
17:11:09.470499 IP 112.26.0.8.50156 > 112.26.0.1.targus-getdata1: Flags [.], seq 45696:47124, ack 1, win 4107, options [nop,nop,TS val 4294800566 ecr 61333,mptcp dss ack 569926353 seq 2858534355 subseq 434150 len 1428 csum 0xdcf2], length 1428
17:11:09.474197 IP 112.26.0.8.50156 > 112.26.0.1.targus-getdata1: Flags [.], seq 45696:47124, ack 1, win 4107, options [nop,nop,TS val 4294800566 ecr 61333,mptcp dss ack 569926353 seq 2858534355 subseq 434150 len 1428 csum 0xdcf2], length 1428
17:11:09.525643 IP 112.26.0.8.50156 > 112.26.0.1.targus-getdata1: Flags [.], seq 47124:48552, ack 1, win 4107, options [nop,nop,TS val 4294800566 ecr 61333,mptcp dss ack 569926353 seq 2858535783 subseq 435578 len 1428 csum 0x42ba], length 1428
17:11:09.533861 IP 112.26.0.8.50156 > 112.26.0.1.targus-getdata1: Flags [.], seq 47124:48552, ack 1, win 4107, options [nop,nop,TS val 4294800566 ecr 61333,mptcp dss ack 569926353 seq 2858535783 subseq 435578 len 1428 csum 0x42ba], length 1428
17:11:09.545971 IP 112.26.0.1.targus-getdata1 > 112.26.0.8.50156: Flags [.], ack 39984, win 7639, options [nop,nop,TS val 61955 ecr 4294799656,mptcp dss ack 2858361567], length 0
17:11:09.546286 IP 112.26.0.1.targus-getdata1 > 112.26.0.8.50156: Flags [.], ack 39984, win 7639, options [nop,nop,TS val 61955 ecr 4294799656,mptcp dss ack 2858361567], length 0
17:11:09.550093 IP 112.26.0.8.50156 > 112.26.0.1.targus-getdata1: Flags [.], seq 38556:39984, ack 1, win 4107, options [nop,nop,TS val 4294799656 ecr 60389,mptcp dss ack 569926353 seq 2858498655 subseq 427010 len 1428 csum 0x81e], length 1428
17:11:09.622007 IP 112.26.0.8.50156 > 112.26.0.1.targus-getdata1: Flags [.], seq 48552:49980, ack 1, win 4107, options [nop,nop,TS val 4294800713 ecr 61427,mptcp dss ack 569926353 seq 2858540067 subseq 437006 len 1428 csum 0x2714], length 1428
17:11:09.624837 IP 112.26.0.8.50156 > 112.26.0.1.targus-getdata1: Flags [.], seq 48552:49980, ack 1, win 4107, options [nop,nop,TS val 4294800713 ecr 61427,mptcp dss ack 569926353 seq 2858540067 subseq 437006 len 1428 csum 0x2714], length 1428
17:11:09.720965 IP 112.26.0.8.50156 > 112.26.0.1.targus-getdata1: Flags [.], seq 49980:51408, ack 1, win 4107, options [nop,nop,TS val 4294800830 ecr 61643,mptcp dss ack 569926353 seq 2858547207 subseq 438434 len 1428 csum 0xb60d], length 1428
17:11:09.758366 IP 112.26.0.8.50156 > 112.26.0.1.targus-getdata1: Flags [.], seq 49980:51408, ack 1, win 4107, options [nop,nop,TS val 4294800830 ecr 61643,mptcp dss ack 569926353 seq 2858547207 subseq 438434 len 1428 csum 0xb60d], length 1428
17:11:09.787373 IP 112.26.0.8.50156 > 112.26.0.1.targus-getdata1: Flags [.], seq 41412:42840, ack 1, win 4107, options [nop,nop,TS val 4294800080 ecr 60607,mptcp dss ack 569926353 seq 2858515791 subseq 429866 len 1428 csum 0x63a6], length 1428
17:11:09.797344 IP 112.26.0.1.targus-getdata1 > 112.26.0.8.50156: Flags [.], ack 39984, win 7606, options [nop,nop,TS val 62201 ecr 4294799656,nop,nop,sack 1 {41412:42840},mptcp dss ack 2858445819], length 0
17:11:09.797673 IP 112.26.0.1.targus-getdata1 > 112.26.0.8.50156: Flags [.], ack 39984, win 7606, options [nop,nop,TS val 62201 ecr 4294799656,nop,nop,sack 1 {41412:42840},mptcp dss ack 2858445819], length 0
17:11:09.903035 IP 112.26.0.8.50156 > 112.26.0.1.targus-getdata1: Flags [.], seq 42840:44268, ack 1, win 4107, options [nop,nop,TS val 4294800110 ecr 60706,mptcp dss ack 569926353 seq 2858521503 subseq 431294 len 1428 csum 0x1f58], length 1428
17:11:09.911535 IP 112.26.0.1.targus-getdata1 > 112.26.0.8.50156: Flags [.], ack 39984, win 7606, options [nop,nop,TS val 62317 ecr 4294799656,nop,nop,sack 1 {41412:44268},mptcp dss ack 2858445819], length 0
17:11:09.911821 IP 112.26.0.1.targus-getdata1 > 112.26.0.8.50156: Flags [.], ack 39984, win 7606, options [nop,nop,TS val 62317 ecr 4294799656,nop,nop,sack 1 {41412:44268},mptcp dss ack 2858445819], length 0
17:11:09.964833 IP 112.26.0.8.50156 > 112.26.0.1.targus-getdata1: Flags [.], seq 44268:45696, ack 1, win 4107, options [nop,nop,TS val 4294800211 ecr 60975,mptcp dss ack 569926353 seq 2858525787 subseq 432722 len 1428 csum 0xca14], length 1428
17:11:09.993298 IP 112.26.0.1.targus-getdata1 > 112.26.0.8.50156: Flags [.], ack 39984, win 7606, options [nop,nop,TS val 62379 ecr 4294799656,nop,nop,sack 1 {41412:45696},mptcp dss ack 2858445819], length 0
17:11:09.993547 IP 112.26.0.1.targus-getdata1 > 112.26.0.8.50156: Flags [.], ack 39984, win 7606, options [nop,nop,TS val 62379 ecr 4294799656,nop,nop,sack 1 {41412:45696},mptcp dss ack 2858445819], length 0
17:11:10.112259 IP 112.26.0.8.50156 > 112.26.0.1.targus-getdata1: Flags [.], seq 51408:52836, ack 1, win 4107, options [nop,nop,TS val 4294801223 ecr 61750,mptcp dss ack 569926353 seq 2858561487 subseq 439862 len 1428 csum 0x3410], length 1428
17:11:10.129103 IP 112.26.0.8.50156 > 112.26.0.1.targus-getdata1: Flags [.], seq 51408:52836, ack 1, win 4107, options [nop,nop,TS val 4294801223 ecr 61750,mptcp dss ack 569926353 seq 2858561487 subseq 439862 len 1428 csum 0x3410], length 1428
17:11:10.133062 IP 112.26.0.1.targus-getdata1 > 112.26.0.8.50156: Flags [.], ack 39984, win 7606, options [nop,nop,TS val 62536 ecr 4294799656,nop,nop,sack 1 {41412:47124},mptcp dss ack 2858445819], length 0
17:11:10.133465 IP 112.26.0.1.targus-getdata1 > 112.26.0.8.50156: Flags [.], ack 39984, win 7606, options [nop,nop,TS val 62536 ecr 4294799656,nop,nop,sack 1 {41412:47124},mptcp dss ack 2858445819], length 0
17:11:10.139538 IP 112.26.0.8.50156 > 112.26.0.1.targus-getdata1: Flags [.], seq 45696:47124, ack 1, win 4107, options [nop,nop,TS val 4294800566 ecr 61333,mptcp dss ack 569926353 seq 2858534355 subseq 434150 len 1428 csum 0xdcf2], length 1428
17:11:10.171924 IP 112.26.0.8.50156 > 112.26.0.1.targus-getdata1: Flags [.], seq 47124:48552, ack 1, win 4107, options [nop,nop,TS val 4294800566 ecr 61333,mptcp dss ack 569926353 seq 2858535783 subseq 435578 len 1428 csum 0x42ba], length 1428
17:11:10.204019 IP 112.26.0.8.50156 > 112.26.0.1.targus-getdata1: Flags [.], seq 52836:54264, ack 1, win 4107, options [nop,nop,TS val 4294801223 ecr 61750,mptcp dss ack 569926353 seq 2858562915 subseq 441290 len 1428 csum 0x7dd4], length 1428
17:11:10.213110 IP 112.26.0.8.50156 > 112.26.0.1.targus-getdata1: Flags [.], seq 48552:49980, ack 1, win 4107, options [nop,nop,TS val 4294800713 ecr 61427,mptcp dss ack 569926353 seq 2858540067 subseq 437006 len 1428 csum 0x2714], length 1428
17:11:10.224302 IP 112.26.0.1.targus-getdata1 > 112.26.0.8.50156: Flags [.], ack 39984, win 7606, options [nop,nop,TS val 62586 ecr 4294799656,nop,nop,sack 1 {41412:48552},mptcp dss ack 2858445819], length 0
17:11:10.224592 IP 112.26.0.1.targus-getdata1 > 112.26.0.8.50156: Flags [.], ack 39984, win 7606, options [nop,nop,TS val 62586 ecr 4294799656,nop,nop,sack 1 {41412:48552},mptcp dss ack 2858445819], length 0
17:11:10.239936 IP 112.26.0.8.50156 > 112.26.0.1.targus-getdata1: Flags [.], seq 52836:54264, ack 1, win 4107, options [nop,nop,TS val 4294801223 ecr 61750,mptcp dss ack 569926353 seq 2858562915 subseq 441290 len 1428 csum 0x7dd4], length 1428
17:11:10.267221 IP 112.26.0.8.50156 > 112.26.0.1.targus-getdata1: Flags [.], seq 54264:55692, ack 1, win 4107, options [nop,nop,TS val 4294801372 ecr 61955,mptcp dss ack 569926353 seq 2858570055 subseq 442718 len 1428 csum 0xd7a4], length 1428
17:11:10.305103 IP 112.26.0.1.targus-getdata1 > 112.26.0.8.50156: Flags [.], ack 39984, win 7606, options [nop,nop,TS val 62627 ecr 4294799656,nop,nop,sack 1 {41412:49980},mptcp dss ack 2858445819], length 0
