17:10:29.137023 IP 112.26.3.8.33985 > 112.26.3.1.targus-getdata1: Flags [S], seq 1637107685, win 65535, options [mss 1460,sackOK,TS val 4294760233 ecr 0,nop,wscale 6,mptcp join id 6 token 0x8f8bf6e7 nonce 0xa6f8b058], length 0
17:10:29.192417 IP 112.26.3.8.33985 > 112.26.3.1.targus-getdata1: Flags [S], seq 1637107685, win 65535, options [mss 1460,sackOK,TS val 4294760233 ecr 0,nop,wscale 6,mptcp join id 6 token 0x8f8bf6e7 nonce 0xa6f8b058], length 0
17:10:29.438044 IP 112.26.3.1.targus-getdata1 > 112.26.3.8.33985: Flags [S.], seq 1411636188, ack 1637107686, win 28560, options [mss 1460,sackOK,TS val 21656 ecr 4294760233,nop,wscale 7,mptcp join id 5 hmac 0xe30687eeef19bd0f nonce 0x4bf5792b], length 0
17:10:29.438289 IP 112.26.3.8.33985 > 112.26.3.1.targus-getdata1: Flags [.], ack 1, win 2738, options [nop,nop,TS val 4294760551 ecr 21656,mptcp join hmac 0xf96a51dec3d50b921612a50ec1aefe21c13033a5], length 0
17:10:29.561288 IP 112.26.3.8.33985 > 112.26.3.1.targus-getdata1: Flags [.], ack 1, win 2738, options [nop,nop,TS val 4294760551 ecr 21656,mptcp join hmac 0xf96a51dec3d50b921612a50ec1aefe21c13033a5], length 0
17:10:29.576323 IP 112.26.3.1.targus-getdata1 > 112.26.3.8.33985: Flags [.], ack 1, win 447, options [nop,nop,TS val 21978 ecr 4294760551,mptcp dss ack 616805850], length 0
17:10:30.139448 IP 112.26.3.8.39939 > 112.26.3.1.targus-getdata1: Flags [S], seq 3809475384, win 65535, options [mss 1460,sackOK,TS val 4294761252 ecr 0,nop,wscale 6,mptcp join id 6 token 0x38f92c7e nonce 0x63b4e294], length 0
17:11:06.589125 IP 112.26.3.1.targus-getdata1 > 112.26.3.8.39939: Flags [.], ack 3809840953, win 7639, options [nop,nop,TS val 58274 ecr 4294795179,nop,nop,sack 2 {4285:9997}{1429:2857},mptcp dss ack 2858287311], length 0
17:11:06.614688 IP 112.26.3.1.targus-getdata1 > 112.26.3.8.39939: Flags [.], ack 1, win 7639, options [nop,nop,TS val 58358 ecr 4294795179,nop,nop,sack 2 {4285:11425}{1429:2857},mptcp dss ack 2858287311], length 0
17:11:06.639023 IP 112.26.3.8.39939 > 112.26.3.1.targus-getdata1: Flags [.], seq 18565:19993, ack 0, win 4107, options [nop,nop,TS val 4294797751 ecr 58358,mptcp dss ack 569926353 seq 2858402979 subseq 384133 len 1428 csum 0x5650], length 1428
17:11:06.671525 IP 112.26.3.8.39939 > 112.26.3.1.targus-getdata1: Flags [.], seq 1:1429, ack 0, win 4107, options [nop,nop,TS val 4294797146 ecr 57749,mptcp dss ack 569926353 seq 2858287311 subseq 365569 len 1428 csum 0xaa], length 1428
17:11:06.771302 IP 112.26.3.1.targus-getdata1 > 112.26.3.8.39939: Flags [.], ack 1, win 7639, options [nop,nop,TS val 58503 ecr 4294795179,nop,nop,sack 2 {4285:12853}{1429:2857},mptcp dss ack 2858287311], length 0
17:11:06.788959 IP 112.26.3.8.39939 > 112.26.3.1.targus-getdata1: Flags [.], seq 19993:21421, ack 0, win 4107, options [nop,nop,TS val 4294797901 ecr 58503,mptcp dss ack 569926353 seq 2858407263 subseq 385561 len 1428 csum 0x6fbb], length 1428
17:11:06.846118 IP 112.26.3.1.targus-getdata1 > 112.26.3.8.39939: Flags [.], ack 1, win 7639, options [nop,nop,TS val 58620 ecr 4294795179,nop,nop,sack 2 {4285:14281}{1429:2857},mptcp dss ack 2858287311], length 0
17:11:06.860990 IP 112.26.3.8.39939 > 112.26.3.1.targus-getdata1: Flags [.], seq 21421:22849, ack 0, win 4107, options [nop,nop,TS val 4294797973 ecr 58620,mptcp dss ack 569926353 seq 2858414403 subseq 386989 len 1428 csum 0x988d], length 1428
17:11:06.887319 IP 112.26.3.8.39939 > 112.26.3.1.targus-getdata1: Flags [.], seq 2857:4285, ack 0, win 4107, options [nop,nop,TS val 4294797351 ecr 57982,mptcp dss ack 569926353 seq 2858307303 subseq 368425 len 1428 csum 0xdfe6], length 1428
17:11:06.947404 IP 112.26.3.1.targus-getdata1 > 112.26.3.8.39939: Flags [.], ack 1, win 7639, options [nop,nop,TS val 58740 ecr 4294795179,nop,nop,sack 2 {4285:15709}{1429:2857},mptcp dss ack 2858287311], length 0
17:11:06.964408 IP 112.26.3.8.39939 > 112.26.3.1.targus-getdata1: Flags [.], seq 22849:24277, ack 0, win 4107, options [nop,nop,TS val 4294798077 ecr 58740,mptcp dss ack 569926353 seq 2858431539 subseq 388417 len 1428 csum 0x1d21], length 1428
17:11:07.002736 IP 112.26.3.1.targus-getdata1 > 112.26.3.8.39939: Flags [.], ack 1, win 7639, options [nop,nop,TS val 58859 ecr 4294795179,nop,nop,sack 2 {4285:17137}{1429:2857},mptcp dss ack 2858287311], length 0
17:11:07.013243 IP 112.26.3.8.39939 > 112.26.3.1.targus-getdata1: Flags [.], seq 24277:25705, ack 0, win 4107, options [nop,nop,TS val 4294798125 ecr 58859,mptcp dss ack 569926353 seq 2858435823 subseq 389845 len 1428 csum 0x20eb], length 1428
17:11:07.056824 IP 112.26.3.1.targus-getdata1 > 112.26.3.8.39939: Flags [.], ack 1, win 7639, options [nop,nop,TS val 58948 ecr 4294795179,nop,nop,sack 2 {4285:18565}{1429:2857},mptcp dss ack 2858287311], length 0
17:11:07.088800 IP 112.26.3.8.39939 > 112.26.3.1.targus-getdata1: Flags [.], seq 25705:27133, ack 0, win 4107, options [nop,nop,TS val 4294798201 ecr 58948,mptcp dss ack 569926353 seq 2858438679 subseq 391273 len 1428 csum 0x24b3], length 1428
17:11:07.153338 IP 112.26.3.8.39939 > 112.26.3.1.targus-getdata1: Flags [.], seq 18565:19993, ack 0, win 4107, options [nop,nop,TS val 4294797751 ecr 58358,mptcp dss ack 569926353 seq 2858402979 subseq 384133 len 1428 csum 0x5650], length 1428
17:11:07.238410 IP 112.26.3.1.targus-getdata1 > 112.26.3.8.39939: Flags [.], ack 2857, win 7483, options [nop,nop,TS val 59088 ecr 4294797146,nop,nop,sack 1 {4285:18565},mptcp dss ack 2858307303], length 0
17:11:07.238778 IP 112.26.3.8.39939 > 112.26.3.1.targus-getdata1: Flags [.], seq 27133:28561, ack 0, win 4107, options [nop,nop,TS val 4294798351 ecr 59088,mptcp dss ack 569926353 seq 2858448675 subseq 392701 len 1428 csum 0xc892], length 1428
17:11:07.303293 IP 112.26.3.8.39939 > 112.26.3.1.targus-getdata1: Flags [.], seq 19993:21421, ack 0, win 4107, options [nop,nop,TS val 4294797901 ecr 58503,mptcp dss ack 569926353 seq 2858407263 subseq 385561 len 1428 csum 0x6fbb], length 1428
17:11:07.388483 IP 112.26.3.8.39939 > 112.26.3.1.targus-getdata1: Flags [.], seq 21421:22849, ack 0, win 4107, options [nop,nop,TS val 4294797973 ecr 58620,mptcp dss ack 569926353 seq 2858414403 subseq 386989 len 1428 csum 0x988d], length 1428
17:11:07.502050 IP 112.26.3.1.targus-getdata1 > 112.26.3.8.39939: Flags [.], ack 18565, win 7490, options [nop,nop,TS val 59303 ecr 4294797351,mptcp dss ack 2858361567], length 0
17:11:07.502527 IP 112.26.3.8.39939 > 112.26.3.1.targus-getdata1: Flags [.], seq 28561:29989, ack 0, win 4107, options [nop,nop,TS val 4294798614 ecr 59303,mptcp dss ack 569926353 seq 2858465811 subseq 394129 len 1428 csum 0x1a2e], length 1428
17:11:07.570566 IP 112.26.3.8.39939 > 112.26.3.1.targus-getdata1: Flags [.], seq 22849:24277, ack 0, win 4107, options [nop,nop,TS val 4294798077 ecr 58740,mptcp dss ack 569926353 seq 2858431539 subseq 388417 len 1428 csum 0x1d21], length 1428
17:11:07.673756 IP 112.26.3.8.39939 > 112.26.3.1.targus-getdata1: Flags [.], seq 24277:25705, ack 0, win 4107, options [nop,nop,TS val 4294798125 ecr 58859,mptcp dss ack 569926353 seq 2858435823 subseq 389845 len 1428 csum 0x20eb], length 1428
17:11:07.735489 IP 112.26.3.8.39939 > 112.26.3.1.targus-getdata1: Flags [.], seq 25705:27133, ack 0, win 4107, options [nop,nop,TS val 4294798201 ecr 58948,mptcp dss ack 569926353 seq 2858438679 subseq 391273 len 1428 csum 0x24b3], length 1428
17:11:07.841951 IP 112.26.3.1.targus-getdata1 > 112.26.3.8.39939: Flags [.], ack 19993, win 7639, options [nop,nop,TS val 59571 ecr 4294797751,mptcp dss ack 2858361567], length 0
17:11:07.842411 IP 112.26.3.8.39939 > 112.26.3.1.targus-getdata1: Flags [.], seq 29989:31417, ack 0, win 4107, options [nop,nop,TS val 4294798954 ecr 59571,mptcp dss ack 569926353 seq 2858471523 subseq 395557 len 1428 csum 0x236d], length 1428
17:11:07.923061 IP 112.26.3.8.39939 > 112.26.3.1.targus-getdata1: Flags [.], seq 27133:28561, ack 0, win 4107, options [nop,nop,TS val 4294798351 ecr 59088,mptcp dss ack 569926353 seq 2858448675 subseq 392701 len 1428 csum 0xc892], length 1428
17:11:08.004665 IP 112.26.3.1.targus-getdata1 > 112.26.3.8.39939: Flags [.], ack 21421, win 7639, options [nop,nop,TS val 59721 ecr 4294797901,mptcp dss ack 2858361567], length 0
17:11:08.005123 IP 112.26.3.8.39939 > 112.26.3.1.targus-getdata1: Flags [.], seq 31417:32845, ack 0, win 4107, options [nop,nop,TS val 4294799117 ecr 59721,mptcp dss ack 569926353 seq 2858474379 subseq 396985 len 1428 csum 0xc2f0], length 1428
17:11:08.063268 IP 112.26.3.1.targus-getdata1 > 112.26.3.8.39939: Flags [.], ack 22849, win 7639, options [nop,nop,TS val 59805 ecr 4294797973,mptcp dss ack 2858361567], length 0
17:11:08.063538 IP 112.26.3.8.39939 > 112.26.3.1.targus-getdata1: Flags [.], seq 32845:34273, ack 0, win 4107, options [nop,nop,TS val 4294799176 ecr 59805,mptcp dss ack 569926353 seq 2858475807 subseq 398413 len 1428 csum 0x4abb], length 1428
17:11:08.063601 IP 112.26.3.8.39939 > 112.26.3.1.targus-getdata1: Flags [.], seq 34273:35701, ack 0, win 4107, options [nop,nop,TS val 4294799176 ecr 59805,mptcp dss ack 569926353 seq 2858477235 subseq 399841 len 1428 csum 0x4ff7], length 1428
17:11:08.144636 IP 112.26.3.8.39939 > 112.26.3.1.targus-getdata1: Flags [.], seq 28561:29989, ack 0, win 4107, options [nop,nop,TS val 4294798614 ecr 59303,mptcp dss ack 569926353 seq 2858465811 subseq 394129 len 1428 csum 0x1a2e], length 1428
17:11:08.250762 IP 112.26.3.1.targus-getdata1 > 112.26.3.8.39939: Flags [.], ack 24277, win 7639, options [nop,nop,TS val 59986 ecr 4294798077,mptcp dss ack 2858361567], length 0
17:11:08.251147 IP 112.26.3.8.39939 > 112.26.3.1.targus-getdata1: Flags [.], seq 35701:37129, ack 0, win 4107, options [nop,nop,TS val 4294799363 ecr 59986,mptcp dss ack 569926353 seq 2858488659 subseq 401269 len 1428 csum 0xb903], length 1428
17:11:08.307487 IP 112.26.3.1.targus-getdata1 > 112.26.3.8.39939: Flags [.], ack 25705, win 7639, options [nop,nop,TS val 60090 ecr 4294798125,mptcp dss ack 2858361567], length 0
17:11:08.307815 IP 112.26.3.8.39939 > 112.26.3.1.targus-getdata1: Flags [.], seq 37129:38557, ack 0, win 4107, options [nop,nop,TS val 4294799420 ecr 60090,mptcp dss ack 569926353 seq 2858490087 subseq 402697 len 1428 csum 0xe2c6], length 1428
17:11:08.361291 IP 112.26.3.1.targus-getdata1 > 112.26.3.8.39939: Flags [.], ack 27133, win 7639, options [nop,nop,TS val 60217 ecr 4294798201,mptcp dss ack 2858361567], length 0
17:11:08.361508 IP 112.26.3.8.39939 > 112.26.3.1.targus-getdata1: Flags [.], seq 38557:39985, ack 0, win 4107, options [nop,nop,TS val 4294799474 ecr 60217,mptcp dss ack 569926353 seq 2858491515 subseq 404125 len 1428 csum 0xc661], length 1428
17:11:08.423234 IP 112.26.3.8.39939 > 112.26.3.1.targus-getdata1: Flags [.], seq 29989:31417, ack 0, win 4107, options [nop,nop,TS val 4294798954 ecr 59571,mptcp dss ack 569926353 seq 2858471523 subseq 395557 len 1428 csum 0x236d], length 1428
17:11:08.486321 IP 112.26.3.1.targus-getdata1 > 112.26.3.8.39939: Flags [.], ack 28561, win 7639, options [nop,nop,TS val 60339 ecr 4294798351,mptcp dss ack 2858361567], length 0
17:11:08.486840 IP 112.26.3.8.39939 > 112.26.3.1.targus-getdata1: Flags [.], seq 39985:41413, ack 0, win 4107, options [nop,nop,TS val 4294799599 ecr 60339,mptcp dss ack 569926353 seq 2858495799 subseq 405553 len 1428 csum 0x51f4], length 1428
17:11:08.566327 IP 112.26.3.8.39939 > 112.26.3.1.targus-getdata1: Flags [.], seq 31417:32845, ack 0, win 4107, options [nop,nop,TS val 4294799117 ecr 59721,mptcp dss ack 569926353 seq 2858474379 subseq 396985 len 1428 csum 0xc2f0], length 1428
17:11:08.665275 IP 112.26.3.8.39939 > 112.26.3.1.targus-getdata1: Flags [.], seq 32845:34273, ack 0, win 4107, options [nop,nop,TS val 4294799176 ecr 59805,mptcp dss ack 569926353 seq 2858475807 subseq 398413 len 1428 csum 0x4abb], length 1428
17:11:08.749868 IP 112.26.3.1.targus-getdata1 > 112.26.3.8.39939: Flags [.], ack 29989, win 7639, options [nop,nop,TS val 60561 ecr 4294798614,mptcp dss ack 2858361567], length 0
17:11:08.750198 IP 112.26.3.8.39939 > 112.26.3.1.targus-getdata1: Flags [.], seq 41413:42841, ack 0, win 4107, options [nop,nop,TS val 4294799863 ecr 60561,mptcp dss ack 569926353 seq 2858514363 subseq 406981 len 1428 csum 0x52e9], length 1428
17:11:08.812252 IP 112.26.3.8.39939 > 112.26.3.1.targus-getdata1: Flags [.], seq 34273:35701, ack 0, win 4107, options [nop,nop,TS val 4294799176 ecr 59805,mptcp dss ack 569926353 seq 2858477235 subseq 399841 len 1428 csum 0x4ff7], length 1428
17:11:08.907678 IP 112.26.3.8.39939 > 112.26.3.1.targus-getdata1: Flags [.], seq 35701:37129, ack 0, win 4107, options [nop,nop,TS val 4294799363 ecr 59986,mptcp dss ack 569926353 seq 2858488659 subseq 401269 len 1428 csum 0xb903], length 1428
17:11:08.994540 IP 112.26.3.8.39939 > 112.26.3.1.targus-getdata1: Flags [.], seq 37129:38557, ack 0, win 4107, options [nop,nop,TS val 4294799420 ecr 60090,mptcp dss ack 569926353 seq 2858490087 subseq 402697 len 1428 csum 0xe2c6], length 1428
17:11:09.091728 IP 112.26.3.8.39939 > 112.26.3.1.targus-getdata1: Flags [.], seq 38557:39985, ack 0, win 4107, options [nop,nop,TS val 4294799474 ecr 60217,mptcp dss ack 569926353 seq 2858491515 subseq 404125 len 1428 csum 0xc661], length 1428
17:11:09.200934 IP 112.26.3.1.targus-getdata1 > 112.26.3.8.39939: Flags [.], ack 31417, win 7639, options [nop,nop,TS val 60842 ecr 4294798954,mptcp dss ack 2858361567], length 0
17:11:09.201271 IP 112.26.3.8.39939 > 112.26.3.1.targus-getdata1: Flags [.], seq 42841:44269, ack 0, win 4107, options [nop,nop,TS val 4294800313 ecr 60842,mptcp dss ack 569926353 seq 2858527215 subseq 408409 len 1428 csum 0x3526], length 1428
17:11:09.260125 IP 112.26.3.8.39939 > 112.26.3.1.targus-getdata1: Flags [.], seq 39985:41413, ack 0, win 4107, options [nop,nop,TS val 4294799599 ecr 60339,mptcp dss ack 569926353 seq 2858495799 subseq 405553 len 1428 csum 0x51f4], length 1428
17:11:09.339020 IP 112.26.3.1.targus-getdata1 > 112.26.3.8.39939: Flags [.], ack 32845, win 7639, options [nop,nop,TS val 60987 ecr 4294799117,mptcp dss ack 2858361567], length 0
17:11:09.339384 IP 112.26.3.8.39939 > 112.26.3.1.targus-getdata1: Flags [.], seq 44269:45697, ack 0, win 4107, options [nop,nop,TS val 4294800451 ecr 60987,mptcp dss ack 569926353 seq 2858530071 subseq 409837 len 1428 csum 0xcec1], length 1428
17:11:09.412309 IP 112.26.3.1.targus-getdata1 > 112.26.3.8.39939: Flags [.], ack 34273, win 7639, options [nop,nop,TS val 61082 ecr 4294799176,mptcp dss ack 2858361567], length 0
17:11:09.412815 IP 112.26.3.8.39939 > 112.26.3.1.targus-getdata1: Flags [.], seq 45697:47125, ack 0, win 4107, options [nop,nop,TS val 4294800525 ecr 61082,mptcp dss ack 569926353 seq 2858532927 subseq 411265 len 1428 csum 0xb342], length 1428
17:11:09.483477 IP 112.26.3.8.39939 > 112.26.3.1.targus-getdata1: Flags [.], seq 41413:42841, ack 0, win 4107, options [nop,nop,TS val 4294799863 ecr 60561,mptcp dss ack 569926353 seq 2858514363 subseq 406981 len 1428 csum 0x52e9], length 1428
17:11:09.531419 IP 112.26.3.1.targus-getdata1 > 112.26.3.8.39939: Flags [.], ack 35701, win 7639, options [nop,nop,TS val 61230 ecr 4294799176,mptcp dss ack 2858361567], length 0
17:11:09.531774 IP 112.26.3.8.39939 > 112.26.3.1.targus-getdata1: Flags [.], seq 47125:48553, ack 0, win 4107, options [nop,nop,TS val 4294800644 ecr 61230,mptcp dss ack 569926353 seq 2858537211 subseq 412693 len 1428 csum 0x2da9], length 1428
17:11:09.531855 IP 112.26.3.8.39939 > 112.26.3.1.targus-getdata1: Flags [.], seq 48553:49981, ack 0, win 4107, options [nop,nop,TS val 4294800644 ecr 61230,mptcp dss ack 569926353 seq 2858538639 subseq 414121 len 1428 csum 0x840d], length 1428
17:11:09.627938 IP 112.26.3.1.targus-getdata1 > 112.26.3.8.39939: Flags [.], ack 37129, win 7639, options [nop,nop,TS val 61324 ecr 4294799363,mptcp dss ack 2858361567], length 0
17:11:09.628358 IP 112.26.3.8.39939 > 112.26.3.1.targus-getdata1: Flags [.], seq 49981:51409, ack 0, win 4107, options [nop,nop,TS val 4294800740 ecr 61324,mptcp dss ack 569926353 seq 2858542923 subseq 415549 len 1428 csum 0x78ea], length 1428
17:11:09.667428 IP 112.26.3.1.targus-getdata1 > 112.26.3.8.39939: Flags [.], ack 38557, win 7639, options [nop,nop,TS val 61413 ecr 4294799420,mptcp dss ack 2858361567], length 0
17:11:09.667773 IP 112.26.3.8.39939 > 112.26.3.1.targus-getdata1: Flags [.], seq 51409:52837, ack 0, win 4107, options [nop,nop,TS val 4294800780 ecr 61413,mptcp dss ack 569926353 seq 2858544351 subseq 416977 len 1428 csum 0xc7ab], length 1428
17:11:09.701427 IP 112.26.3.1.targus-getdata1 > 112.26.3.8.39939: Flags [.], ack 39985, win 7639, options [nop,nop,TS val 61550 ecr 4294799474,mptcp dss ack 2858361567], length 0
17:11:09.701733 IP 112.26.3.8.39939 > 112.26.3.1.targus-getdata1: Flags [.], seq 52837:54265, ack 0, win 4107, options [nop,nop,TS val 4294800814 ecr 61550,mptcp dss ack 569926353 seq 2858545779 subseq 418405 len 1428 csum 0x8afd], length 1428
17:11:09.794720 IP 112.26.3.8.39939 > 112.26.3.1.targus-getdata1: Flags [.], seq 42841:44269, ack 0, win 4107, options [nop,nop,TS val 4294800313 ecr 60842,mptcp dss ack 569926353 seq 2858527215 subseq 408409 len 1428 csum 0x3526], length 1428
17:11:09.929929 IP 112.26.3.8.39939 > 112.26.3.1.targus-getdata1: Flags [.], seq 44269:45697, ack 0, win 4107, options [nop,nop,TS val 4294800451 ecr 60987,mptcp dss ack 569926353 seq 2858530071 subseq 409837 len 1428 csum 0xcec1], length 1428
17:11:10.014343 IP 112.26.3.1.targus-getdata1 > 112.26.3.8.39939: Flags [.], ack 41413, win 7639, options [nop,nop,TS val 61760 ecr 4294799599,mptcp dss ack 2858361567], length 0
17:11:10.014733 IP 112.26.3.8.39939 > 112.26.3.1.targus-getdata1: Flags [.], seq 54265:55693, ack 0, win 4107, options [nop,nop,TS val 4294801127 ecr 61760,mptcp dss ack 569926353 seq 2858560059 subseq 419833 len 1428 csum 0x11e9], length 1428
17:11:10.073288 IP 112.26.3.8.39939 > 112.26.3.1.targus-getdata1: Flags [.], seq 45697:47125, ack 0, win 4107, options [nop,nop,TS val 4294800525 ecr 61082,mptcp dss ack 569926353 seq 2858532927 subseq 411265 len 1428 csum 0xb342], length 1428
17:11:10.170954 IP 112.26.3.8.39939 > 112.26.3.1.targus-getdata1: Flags [.], seq 47125:48553, ack 0, win 4107, options [nop,nop,TS val 4294800644 ecr 61230,mptcp dss ack 569926353 seq 2858537211 subseq 412693 len 1428 csum 0x2da9], length 1428
17:11:10.235881 IP 112.26.3.8.39939 > 112.26.3.1.targus-getdata1: Flags [.], seq 48553:49981, ack 0, win 4107, options [nop,nop,TS val 4294800644 ecr 61230,mptcp dss ack 569926353 seq 2858538639 subseq 414121 len 1428 csum 0x840d], length 1428
17:11:10.285958 IP 112.26.3.8.39939 > 112.26.3.1.targus-getdata1: Flags [.], seq 49981:51409, ack 0, win 4107, options [nop,nop,TS val 4294800740 ecr 61324,mptcp dss ack 569926353 seq 2858542923 subseq 415549 len 1428 csum 0x78ea], length 1428
17:11:10.383547 IP 112.26.3.8.39939 > 112.26.3.1.targus-getdata1: Flags [.], seq 51409:52837, ack 0, win 4107, options [nop,nop,TS val 4294800780 ecr 61413,mptcp dss ack 569926353 seq 2858544351 subseq 416977 len 1428 csum 0xc7ab], length 1428
17:11:10.473535 IP 112.26.3.8.39939 > 112.26.3.1.targus-getdata1: Flags [.], seq 52837:54265, ack 0, win 4107, options [nop,nop,TS val 4294800814 ecr 61550,mptcp dss ack 569926353 seq 2858545779 subseq 418405 len 1428 csum 0x8afd], length 1428
17:11:10.541053 IP 112.26.3.1.targus-getdata1 > 112.26.3.8.39939: Flags [.], ack 45697, win 7606, options [nop,nop,TS val 62346 ecr 4294800313,mptcp dss ack 2858445819], length 0
17:11:10.541465 IP 112.26.3.8.39939 > 112.26.3.1.targus-getdata1: Flags [.], seq 55693:57121, ack 0, win 4107, options [nop,nop,TS val 4294801654 ecr 62346,mptcp dss ack 569926353 seq 2858581479 subseq 421261 len 1428 csum 0xcef1], length 1428
17:11:10.541533 IP 112.26.3.8.39939 > 112.26.3.1.targus-getdata1: Flags [.], seq 57121:58549, ack 0, win 4107, options [nop,nop,TS val 4294801654 ecr 62346,mptcp dss ack 569926353 seq 2858582907 subseq 422689 len 1428 csum 0xb855], length 1428
17:11:10.541730 IP 112.26.3.8.39939 > 112.26.3.1.targus-getdata1: Flags [.], seq 58549:59977, ack 0, win 4107, options [nop,nop,TS val 4294801654 ecr 62346,mptcp dss ack 569926353 seq 2858584335 subseq 424117 len 1428 csum 0x7ed4], length 1428
17:11:10.644304 IP 112.26.3.8.39939 > 112.26.3.1.targus-getdata1: Flags [.], seq 54265:55693, ack 0, win 4107, options [nop,nop,TS val 4294801127 ecr 61760,mptcp dss ack 569926353 seq 2858560059 subseq 419833 len 1428 csum 0x11e9], length 1428
17:11:10.748752 IP 112.26.3.1.targus-getdata1 > 112.26.3.8.39939: Flags [.], ack 51409, win 7606, options [nop,nop,TS val 62749 ecr 4294800525,mptcp dss ack 2858445819], length 0
17:11:10.749114 IP 112.26.3.8.39939 > 112.26.3.1.targus-getdata1: Flags [.], seq 59977:61405, ack 0, win 4107, options [nop,nop,TS val 4294801861 ecr 62749,mptcp dss ack 569926353 seq 2858588619 subseq 425545 len 1428 csum 0x349a], length 1428
17:11:10.749190 IP 112.26.3.8.39939 > 112.26.3.1.targus-getdata1: Flags [.], seq 61405:62833, ack 0, win 4107, options [nop,nop,TS val 4294801861 ecr 62749,mptcp dss ack 569926353 seq 2858590047 subseq 426973 len 1428 csum 0x7794], length 1428
17:11:10.749383 IP 112.26.3.8.39939 > 112.26.3.1.targus-getdata1: Flags [.], seq 62833:64261, ack 0, win 4107, options [nop,nop,TS val 4294801861 ecr 62749,mptcp dss ack 569926353 seq 2858591475 subseq 428401 len 1428 csum 0x6b8c], length 1428
17:11:10.749489 IP 112.26.3.8.39939 > 112.26.3.1.targus-getdata1: Flags [.], seq 64261:65689, ack 0, win 4107, options [nop,nop,TS val 4294801861 ecr 62749,mptcp dss ack 569926353 seq 2858592903 subseq 429829 len 1428 csum 0xf733], length 1428
17:11:10.749662 IP 112.26.3.8.39939 > 112.26.3.1.targus-getdata1: Flags [P.], seq 65689:67117, ack 0, win 4107, options [nop,nop,TS val 4294801861 ecr 62749,mptcp dss ack 569926353 seq 2858594331 subseq 431257 len 1428 csum 0xd35a], length 1428
17:11:10.834947 IP 112.26.3.8.39939 > 112.26.3.1.targus-getdata1: Flags [.], seq 55693:57121, ack 0, win 4107, options [nop,nop,TS val 4294801654 ecr 62346,mptcp dss ack 569926353 seq 2858581479 subseq 421261 len 1428 csum 0xcef1], length 1428
17:11:10.924532 IP 112.26.3.8.39939 > 112.26.3.1.targus-getdata1: Flags [.], seq 57121:58549, ack 0, win 4107, options [nop,nop,TS val 4294801654 ecr 62346,mptcp dss ack 569926353 seq 2858582907 subseq 422689 len 1428 csum 0xb855], length 1428
17:11:11.057235 IP 112.26.3.1.targus-getdata1 > 112.26.3.8.39939: Flags [.], ack 54265, win 7606, options [nop,nop,TS val 63056 ecr 4294800780,mptcp dss ack 2858445819], length 0
17:11:11.057639 IP 112.26.3.8.39939 > 112.26.3.1.targus-getdata1: Flags [.], seq 67117:68545, ack 0, win 4107, options [nop,nop,TS val 4294802169 ecr 63056,mptcp dss ack 569926353 seq 2858600043 subseq 432685 len 1428 csum 0x1b56], length 1428
17:11:11.057707 IP 112.26.3.8.39939 > 112.26.3.1.targus-getdata1: Flags [.], seq 68545:69973, ack 0, win 4107, options [nop,nop,TS val 4294802169 ecr 63056,mptcp dss ack 569926353 seq 2858601471 subseq 434113 len 1428 csum 0x64c], length 1428
17:11:11.119633 IP 112.26.3.8.39939 > 112.26.3.1.targus-getdata1: Flags [.], seq 58549:59977, ack 0, win 4107, options [nop,nop,TS val 4294801654 ecr 62346,mptcp dss ack 569926353 seq 2858584335 subseq 424117 len 1428 csum 0x7ed4], length 1428
17:11:11.226776 IP 112.26.3.8.39939 > 112.26.3.1.targus-getdata1: Flags [.], seq 59977:61405, ack 0, win 4107, options [nop,nop,TS val 4294801861 ecr 62749,mptcp dss ack 569926353 seq 2858588619 subseq 425545 len 1428 csum 0x349a], length 1428
17:11:11.288365 IP 112.26.3.8.39939 > 112.26.3.1.targus-getdata1: Flags [.], seq 61405:62833, ack 0, win 4107, options [nop,nop,TS val 4294801861 ecr 62749,mptcp dss ack 569926353 seq 2858590047 subseq 426973 len 1428 csum 0x7794], length 1428
17:11:11.361253 IP 112.26.3.8.39939 > 112.26.3.1.targus-getdata1: Flags [.], seq 62833:64261, ack 0, win 4107, options [nop,nop,TS val 4294801861 ecr 62749,mptcp dss ack 569926353 seq 2858591475 subseq 428401 len 1428 csum 0x6b8c], length 1428
17:11:11.441525 IP 112.26.3.1.targus-getdata1 > 112.26.3.8.39939: Flags [.], ack 57121, win 7595, options [nop,nop,TS val 63326 ecr 4294801127,mptcp dss ack 2858447247], length 0
17:11:11.441835 IP 112.26.3.8.39939 > 112.26.3.1.targus-getdata1: Flags [.], seq 69973:71401, ack 0, win 4107, options [nop,nop,TS val 4294802554 ecr 63326,mptcp dss ack 569926353 seq 2858610039 subseq 435541 len 1428 csum 0x4d38], length 1428
17:11:11.441917 IP 112.26.3.8.39939 > 112.26.3.1.targus-getdata1: Flags [.], seq 71401:72829, ack 0, win 4107, options [nop,nop,TS val 4294802554 ecr 63326,mptcp dss ack 569926353 seq 2858611467 subseq 436969 len 1428 csum 0x3705], length 1428
17:11:11.442030 IP 112.26.3.8.39939 > 112.26.3.1.targus-getdata1: Flags [.], seq 72829:74257, ack 0, win 4107, options [nop,nop,TS val 4294802554 ecr 63326,mptcp dss ack 569926353 seq 2858612895 subseq 438397 len 1428 csum 0xe06b], length 1428
17:11:11.528815 IP 112.26.3.8.39939 > 112.26.3.1.targus-getdata1: Flags [.], seq 64261:65689, ack 0, win 4107, options [nop,nop,TS val 4294801861 ecr 62749,mptcp dss ack 569926353 seq 2858592903 subseq 429829 len 1428 csum 0xf733], length 1428
17:11:11.643955 IP 112.26.3.8.39939 > 112.26.3.1.targus-getdata1: Flags [P.], seq 65689:67117, ack 0, win 4107, options [nop,nop,TS val 4294801861 ecr 62749,mptcp dss ack 569926353 seq 2858594331 subseq 431257 len 1428 csum 0xd35a], length 1428
17:11:11.709241 IP 112.26.3.8.39939 > 112.26.3.1.targus-getdata1: Flags [.], seq 67117:68545, ack 0, win 4107, options [nop,nop,TS val 4294802169 ecr 63056,mptcp dss ack 569926353 seq 2858600043 subseq 432685 len 1428 csum 0x1b56], length 1428
17:11:11.781849 IP 112.26.3.1.targus-getdata1 > 112.26.3.8.39939: Flags [.], ack 59977, win 7639, options [nop,nop,TS val 63545 ecr 4294801654,mptcp dss ack 2858497227], length 0
17:11:11.782280 IP 112.26.3.8.39939 > 112.26.3.1.targus-getdata1: Flags [.], seq 74257:75685, ack 0, win 4107, options [nop,nop,TS val 4294802895 ecr 63545,mptcp dss ack 569926353 seq 2858628603 subseq 439825 len 1428 csum 0xf59], length 1428
17:11:11.782345 IP 112.26.3.8.39939 > 112.26.3.1.targus-getdata1: Flags [.], seq 75685:77113, ack 0, win 4107, options [nop,nop,TS val 4294802895 ecr 63545,mptcp dss ack 569926353 seq 2858630031 subseq 441253 len 1428 csum 0x617c], length 1428
17:11:11.782520 IP 112.26.3.8.39939 > 112.26.3.1.targus-getdata1: Flags [.], seq 77113:78541, ack 0, win 4107, options [nop,nop,TS val 4294802895 ecr 63545,mptcp dss ack 569926353 seq 2858631459 subseq 442681 len 1428 csum 0xd05d], length 1428
17:11:11.842677 IP 112.26.3.8.39939 > 112.26.3.1.targus-getdata1: Flags [.], seq 68545:69973, ack 0, win 4107, options [nop,nop,TS val 4294802169 ecr 63056,mptcp dss ack 569926353 seq 2858601471 subseq 434113 len 1428 csum 0x64c], length 1428
17:11:12.019777 IP 112.26.3.8.39939 > 112.26.3.1.targus-getdata1: Flags [.], seq 69973:71401, ack 0, win 4107, options [nop,nop,TS val 4294802554 ecr 63326,mptcp dss ack 569926353 seq 2858610039 subseq 435541 len 1428 csum 0x4d38], length 1428
17:11:12.106825 IP 112.26.3.1.targus-getdata1 > 112.26.3.8.39939: Flags [.], ack 64261, win 7639, options [nop,nop,TS val 63912 ecr 4294801861,mptcp dss ack 2858497227], length 0
17:11:12.107154 IP 112.26.3.8.39939 > 112.26.3.1.targus-getdata1: Flags [.], seq 78541:79969, ack 0, win 4107, options [nop,nop,TS val 4294803219 ecr 63912,mptcp dss ack 569926353 seq 2858641455 subseq 444109 len 1428 csum 0xcb3b], length 1428
17:11:12.107240 IP 112.26.3.8.39939 > 112.26.3.1.targus-getdata1: Flags [.], seq 79969:81397, ack 0, win 4107, options [nop,nop,TS val 4294803219 ecr 63912,mptcp dss ack 569926353 seq 2858642883 subseq 445537 len 1428 csum 0xa1a6], length 1428
17:11:12.107345 IP 112.26.3.8.39939 > 112.26.3.1.targus-getdata1: Flags [.], seq 81397:82825, ack 0, win 4107, options [nop,nop,TS val 4294803219 ecr 63912,mptcp dss ack 569926353 seq 2858644311 subseq 446965 len 1428 csum 0xd9ea], length 1428
17:11:12.171412 IP 112.26.3.8.39939 > 112.26.3.1.targus-getdata1: Flags [.], seq 71401:72829, ack 0, win 4107, options [nop,nop,TS val 4294802554 ecr 63326,mptcp dss ack 569926353 seq 2858611467 subseq 436969 len 1428 csum 0x3705], length 1428
17:11:12.268962 IP 112.26.3.8.39939 > 112.26.3.1.targus-getdata1: Flags [.], seq 72829:74257, ack 0, win 4107, options [nop,nop,TS val 4294802554 ecr 63326,mptcp dss ack 569926353 seq 2858612895 subseq 438397 len 1428 csum 0xe06b], length 1428
17:11:12.363511 IP 112.26.3.8.39939 > 112.26.3.1.targus-getdata1: Flags [.], seq 74257:75685, ack 0, win 4107, options [nop,nop,TS val 4294802895 ecr 63545,mptcp dss ack 569926353 seq 2858628603 subseq 439825 len 1428 csum 0xf59], length 1428
17:11:12.458015 IP 112.26.3.1.targus-getdata1 > 112.26.3.8.39939: Flags [.], ack 68545, win 7639, options [nop,nop,TS val 64232 ecr 4294801861,mptcp dss ack 2858497227], length 0
17:11:12.458516 IP 112.26.3.8.39939 > 112.26.3.1.targus-getdata1: Flags [.], seq 82825:84253, ack 0, win 4107, options [nop,nop,TS val 4294803571 ecr 64232,mptcp dss ack 569926353 seq 2858652879 subseq 448393 len 1428 csum 0x60e4], length 1428
17:11:12.458605 IP 112.26.3.8.39939 > 112.26.3.1.targus-getdata1: Flags [.], seq 84253:85681, ack 0, win 4107, options [nop,nop,TS val 4294803571 ecr 64232,mptcp dss ack 569926353 seq 2858654307 subseq 449821 len 1428 csum 0xa129], length 1428
17:11:12.458783 IP 112.26.3.8.39939 > 112.26.3.1.targus-getdata1: Flags [.], seq 85681:87109, ack 0, win 4107, options [nop,nop,TS val 4294803571 ecr 64232,mptcp dss ack 569926353 seq 2858655735 subseq 451249 len 1428 csum 0x1e70], length 1428
17:11:12.559114 IP 112.26.3.8.39939 > 112.26.3.1.targus-getdata1: Flags [.], seq 75685:77113, ack 0, win 4107, options [nop,nop,TS val 4294802895 ecr 63545,mptcp dss ack 569926353 seq 2858630031 subseq 441253 len 1428 csum 0x617c], length 1428
17:11:12.663336 IP 112.26.3.8.39939 > 112.26.3.1.targus-getdata1: Flags [.], seq 77113:78541, ack 0, win 4107, options [nop,nop,TS val 4294802895 ecr 63545,mptcp dss ack 569926353 seq 2858631459 subseq 442681 len 1428 csum 0xd05d], length 1428
17:11:12.746964 IP 112.26.3.8.39939 > 112.26.3.1.targus-getdata1: Flags [.], seq 78541:79969, ack 0, win 4107, options [nop,nop,TS val 4294803219 ecr 63912,mptcp dss ack 569926353 seq 2858641455 subseq 444109 len 1428 csum 0xcb3b], length 1428
17:11:12.827540 IP 112.26.3.1.targus-getdata1 > 112.26.3.8.39939: Flags [.], ack 71401, win 7639, options [nop,nop,TS val 64552 ecr 4294802169,mptcp dss ack 2858497227], length 0
17:11:12.827985 IP 112.26.3.8.39939 > 112.26.3.1.targus-getdata1: Flags [.], seq 87109:88537, ack 0, win 4107, options [nop,nop,TS val 4294803940 ecr 64552,mptcp dss ack 569926353 seq 2858664303 subseq 452677 len 1428 csum 0x1288], length 1428
17:11:12.828047 IP 112.26.3.8.39939 > 112.26.3.1.targus-getdata1: Flags [.], seq 88537:89965, ack 0, win 4107, options [nop,nop,TS val 4294803940 ecr 64552,mptcp dss ack 569926353 seq 2858665731 subseq 454105 len 1428 csum 0x5640], length 1428
17:11:12.889050 IP 112.26.3.8.39939 > 112.26.3.1.targus-getdata1: Flags [.], seq 79969:81397, ack 0, win 4107, options [nop,nop,TS val 4294803219 ecr 63912,mptcp dss ack 569926353 seq 2858642883 subseq 445537 len 1428 csum 0xa1a6], length 1428
17:11:12.980001 IP 112.26.3.8.39939 > 112.26.3.1.targus-getdata1: Flags [.], seq 81397:82825, ack 0, win 4107, options [nop,nop,TS val 4294803219 ecr 63912,mptcp dss ack 569926353 seq 2858644311 subseq 446965 len 1428 csum 0xd9ea], length 1428
17:11:13.038794 IP 112.26.3.8.39939 > 112.26.3.1.targus-getdata1: Flags [.], seq 82825:84253, ack 0, win 4107, options [nop,nop,TS val 4294803571 ecr 64232,mptcp dss ack 569926353 seq 2858652879 subseq 448393 len 1428 csum 0x60e4], length 1428
17:11:13.105815 IP 112.26.3.1.targus-getdata1 > 112.26.3.8.39939: Flags [.], ack 75685, win 7606, options [nop,nop,TS val 64880 ecr 4294802554,mptcp dss ack 2858501511], length 0
17:11:13.106352 IP 112.26.3.8.39939 > 112.26.3.1.targus-getdata1: Flags [.], seq 89965:91393, ack 0, win 4107, options [nop,nop,TS val 4294804218 ecr 64880,mptcp dss ack 569926353 seq 2858678583 subseq 455533 len 1428 csum 0xcf2], length 1428
17:11:13.106428 IP 112.26.3.8.39939 > 112.26.3.1.targus-getdata1: Flags [.], seq 91393:92821, ack 0, win 4107, options [nop,nop,TS val 4294804218 ecr 64880,mptcp dss ack 569926353 seq 2858680011 subseq 456961 len 1428 csum 0x11e4], length 1428
17:11:13.106588 IP 112.26.3.8.39939 > 112.26.3.1.targus-getdata1: Flags [.], seq 92821:94249, ack 0, win 4107, options [nop,nop,TS val 4294804218 ecr 64880,mptcp dss ack 569926353 seq 2858681439 subseq 458389 len 1428 csum 0x42a7], length 1428
17:11:13.106682 IP 112.26.3.8.39939 > 112.26.3.1.targus-getdata1: Flags [.], seq 94249:95677, ack 0, win 4107, options [nop,nop,TS val 4294804218 ecr 64880,mptcp dss ack 569926353 seq 2858682867 subseq 459817 len 1428 csum 0x7692], length 1428
17:11:13.106806 IP 112.26.3.8.39939 > 112.26.3.1.targus-getdata1: Flags [.], seq 95677:97105, ack 0, win 4107, options [nop,nop,TS val 4294804218 ecr 64880,mptcp dss ack 569926353 seq 2858684295 subseq 461245 len 1428 csum 0xa88c], length 1428
17:11:13.171627 IP 112.26.3.8.39939 > 112.26.3.1.targus-getdata1: Flags [.], seq 84253:85681, ack 0, win 4107, options [nop,nop,TS val 4294803571 ecr 64232,mptcp dss ack 569926353 seq 2858654307 subseq 449821 len 1428 csum 0xa129], length 1428
17:11:13.264127 IP 112.26.3.1.targus-getdata1 > 112.26.3.8.39939: Flags [.], ack 78541, win 7551, options [nop,nop,TS val 65134 ecr 4294802895,mptcp dss ack 2858508651], length 0
17:11:13.264477 IP 112.26.3.8.39939 > 112.26.3.1.targus-getdata1: Flags [.], seq 97105:98533, ack 0, win 4107, options [nop,nop,TS val 4294804376 ecr 65134,mptcp dss ack 569926353 seq 2858690007 subseq 462673 len 1428 csum 0xc3d9], length 1428
17:11:13.264552 IP 112.26.3.8.39939 > 112.26.3.1.targus-getdata1: Flags [.], seq 98533:99961, ack 0, win 4107, options [nop,nop,TS val 4294804376 ecr 65134,mptcp dss ack 569926353 seq 2858691435 subseq 464101 len 1428 csum 0xd950], length 1428
17:11:13.316779 IP 112.26.3.8.39939 > 112.26.3.1.targus-getdata1: Flags [.], seq 87109:88537, ack 0, win 4107, options [nop,nop,TS val 4294803940 ecr 64552,mptcp dss ack 569926353 seq 2858664303 subseq 452677 len 1428 csum 0x1288], length 1428
17:11:13.474856 IP 112.26.3.8.39939 > 112.26.3.1.targus-getdata1: Flags [.], seq 88537:89965, ack 0, win 4107, options [nop,nop,TS val 4294803940 ecr 64552,mptcp dss ack 569926353 seq 2858665731 subseq 454105 len 1428 csum 0x5640], length 1428
17:11:13.550932 IP 112.26.3.1.targus-getdata1 > 112.26.3.8.39939: Flags [.], ack 82825, win 7551, options [nop,nop,TS val 65397 ecr 4294803219,mptcp dss ack 2858508651], length 0
17:11:13.551247 IP 112.26.3.8.39939 > 112.26.3.1.targus-getdata1: Flags [.], seq 99961:101389, ack 0, win 4107, options [nop,nop,TS val 4294804664 ecr 65397,mptcp dss ack 569926353 seq 2858708571 subseq 465529 len 1428 csum 0x3d75], length 1428
17:11:13.551327 IP 112.26.3.8.39939 > 112.26.3.1.targus-getdata1: Flags [.], seq 101389:102817, ack 0, win 4107, options [nop,nop,TS val 4294804664 ecr 65397,mptcp dss ack 569926353 seq 2858709999 subseq 466957 len 1428 csum 0x7f20], length 1428
17:11:13.551482 IP 112.26.3.8.39939 > 112.26.3.1.targus-getdata1: Flags [.], seq 102817:104245, ack 0, win 4107, options [nop,nop,TS val 4294804664 ecr 65397,mptcp dss ack 569926353 seq 2858711427 subseq 468385 len 1428 csum 0x17f], length 1428
17:11:13.551616 IP 112.26.3.8.39939 > 112.26.3.1.targus-getdata1: Flags [.], seq 104245:105673, ack 0, win 4107, options [nop,nop,TS val 4294804664 ecr 65397,mptcp dss ack 569926353 seq 2858712855 subseq 469813 len 1428 csum 0x7ba6], length 1428
17:11:13.613937 IP 112.26.3.8.39939 > 112.26.3.1.targus-getdata1: Flags [.], seq 89965:91393, ack 0, win 4107, options [nop,nop,TS val 4294804218 ecr 64880,mptcp dss ack 569926353 seq 2858678583 subseq 455533 len 1428 csum 0xcf2], length 1428
17:11:13.734552 IP 112.26.3.8.39939 > 112.26.3.1.targus-getdata1: Flags [.], seq 91393:92821, ack 0, win 4107, options [nop,nop,TS val 4294804218 ecr 64880,mptcp dss ack 569926353 seq 2858680011 subseq 456961 len 1428 csum 0x11e4], length 1428
17:11:13.848126 IP 112.26.3.1.targus-getdata1 > 112.26.3.8.39939: Flags [.], ack 85681, win 7401, options [nop,nop,TS val 65587 ecr 4294803571,mptcp dss ack 2858568627], length 0
17:11:13.848466 IP 112.26.3.8.39939 > 112.26.3.1.targus-getdata1: Flags [.], seq 105673:107101, ack 0, win 4107, options [nop,nop,TS val 4294804961 ecr 65587,mptcp dss ack 569926353 seq 2858724279 subseq 471241 len 1428 csum 0x5f79], length 1428
17:11:13.848545 IP 112.26.3.8.39939 > 112.26.3.1.targus-getdata1: Flags [.], seq 107101:108529, ack 0, win 4107, options [nop,nop,TS val 4294804961 ecr 65587,mptcp dss ack 569926353 seq 2858725707 subseq 472669 len 1428 csum 0x6b14], length 1428
17:11:13.848728 IP 112.26.3.8.39939 > 112.26.3.1.targus-getdata1: Flags [.], seq 108529:109957, ack 0, win 4107, options [nop,nop,TS val 4294804961 ecr 65587,mptcp dss ack 569926353 seq 2858727135 subseq 474097 len 1428 csum 0x8873], length 1428
17:11:13.895986 IP 112.26.3.8.39939 > 112.26.3.1.targus-getdata1: Flags [.], seq 92821:94249, ack 0, win 4107, options [nop,nop,TS val 4294804218 ecr 64880,mptcp dss ack 569926353 seq 2858681439 subseq 458389 len 1428 csum 0x42a7], length 1428
17:11:14.017047 IP 112.26.3.8.39939 > 112.26.3.1.targus-getdata1: Flags [.], seq 94249:95677, ack 0, win 4107, options [nop,nop,TS val 4294804218 ecr 64880,mptcp dss ack 569926353 seq 2858682867 subseq 459817 len 1428 csum 0x7692], length 1428
17:11:14.143310 IP 112.26.3.8.39939 > 112.26.3.1.targus-getdata1: Flags [.], seq 95677:97105, ack 0, win 4107, options [nop,nop,TS val 4294804218 ecr 64880,mptcp dss ack 569926353 seq 2858684295 subseq 461245 len 1428 csum 0xa88c], length 1428
17:11:14.235169 IP 112.26.3.1.targus-getdata1 > 112.26.3.8.39939: Flags [.], ack 85681, win 7639, options [nop,nop,TS val 65891 ecr 4294803571,nop,nop,sack 1 {87109:89965},mptcp dss ack 2858655735], length 0
17:11:14.238596 IP 112.26.3.8.39939 > 112.26.3.1.targus-getdata1: Flags [.], seq 109957:111385, ack 0, win 4107, options [nop,nop,TS val 4294805351 ecr 65891,mptcp dss ack 569926353 seq 2858741415 subseq 475525 len 1428 csum 0x24b8], length 1428
17:11:14.238741 IP 112.26.3.8.39939 > 112.26.3.1.targus-getdata1: Flags [.], seq 111385:112813, ack 0, win 4107, options [nop,nop,TS val 4294805351 ecr 65891,mptcp dss ack 569926353 seq 2858742843 subseq 476953 len 1428 csum 0x9e9b], length 1428
17:11:14.303431 IP 112.26.3.8.39939 > 112.26.3.1.targus-getdata1: Flags [.], seq 98533:99961, ack 0, win 4107, options [nop,nop,TS val 4294804376 ecr 65134,mptcp dss ack 569926353 seq 2858691435 subseq 464101 len 1428 csum 0xd950], length 1428
17:11:14.422107 IP 112.26.3.1.targus-getdata1 > 112.26.3.8.39939: Flags [.], ack 85681, win 7639, options [nop,nop,TS val 66157 ecr 4294803571,nop,nop,sack 1 {87109:92821},mptcp dss ack 2858655735], length 0
17:11:14.422517 IP 112.26.3.8.39939 > 112.26.3.1.targus-getdata1: Flags [.], seq 85681:87109, ack 0, win 4107, options [nop,nop,TS val 4294805535 ecr 66157,mptcp dss ack 569926353 seq 2858655735 subseq 451249 len 1428 csum 0x1e70], length 1428
17:11:14.432317 IP 112.26.3.8.39939 > 112.26.3.1.targus-getdata1: Flags [.], seq 112813:114241, ack 0, win 4107, options [nop,nop,TS val 4294805545 ecr 66157,mptcp dss ack 569926353 seq 2858754267 subseq 478381 len 1428 csum 0x6a6d], length 1428
17:11:14.486128 IP 112.26.3.8.39939 > 112.26.3.1.targus-getdata1: Flags [.], seq 101389:102817, ack 0, win 4107, options [nop,nop,TS val 4294804664 ecr 65397,mptcp dss ack 569926353 seq 2858709999 subseq 466957 len 1428 csum 0x7f20], length 1428
17:11:14.573629 IP 112.26.3.8.39939 > 112.26.3.1.targus-getdata1: Flags [.], seq 102817:104245, ack 0, win 4107, options [nop,nop,TS val 4294804664 ecr 65397,mptcp dss ack 569926353 seq 2858711427 subseq 468385 len 1428 csum 0x17f], length 1428
