17:10:29.192878 IP 112.26.3.8.33985 > 112.26.3.1.targus-getdata1: Flags [S], seq 1637107685, win 65535, options [mss 1460,sackOK,TS val 4294760233 ecr 0,nop,wscale 6,mptcp join id 6 token 0x8f8bf6e7 nonce 0xa6f8b058], length 0
17:10:29.241752 IP 112.26.3.8.33985 > 112.26.3.1.targus-getdata1: Flags [S], seq 1637107685, win 65535, options [mss 1460,sackOK,TS val 4294760233 ecr 0,nop,wscale 6,mptcp join id 6 token 0x8f8bf6e7 nonce 0xa6f8b058], length 0
17:10:29.292948 IP 112.26.3.1.targus-getdata1 > 112.26.3.8.33985: Flags [S.], seq 1411636188, ack 1637107686, win 28560, options [mss 1460,sackOK,TS val 21656 ecr 4294760233,nop,wscale 7,mptcp join id 5 hmac 0xe30687eeef19bd0f nonce 0x4bf5792b], length 0
17:10:29.561731 IP 112.26.3.8.33985 > 112.26.3.1.targus-getdata1: Flags [.], ack 1, win 2738, options [nop,nop,TS val 4294760551 ecr 21656,mptcp join hmac 0xf96a51dec3d50b921612a50ec1aefe21c13033a5], length 0
17:10:29.563646 IP 112.26.3.8.33985 > 112.26.3.1.targus-getdata1: Flags [.], ack 1, win 2738, options [nop,nop,TS val 4294760551 ecr 21656,mptcp join hmac 0xf96a51dec3d50b921612a50ec1aefe21c13033a5], length 0
17:10:29.567791 IP 112.26.3.1.targus-getdata1 > 112.26.3.8.33985: Flags [.], ack 1, win 447, options [nop,nop,TS val 21978 ecr 4294760551,mptcp dss ack 616805850], length 0
17:10:30.146579 IP 112.26.3.8.39939 > 112.26.3.1.targus-getdata1: Flags [S], seq 3809475384, win 65535, options [mss 1460,sackOK,TS val 4294761252 ecr 0,nop,wscale 6,mptcp join id 6 token 0x38f92c7e nonce 0x63b4e294], length 0
17:11:06.533784 IP 112.26.3.8.39939 > 112.26.3.1.targus-getdata1: Flags [.], seq 3809858089:3809859517, ack 2583660863, win 4107, options [nop,nop,TS val 4294796883 ecr 57503,mptcp dss ack 569926353 seq 2858367279 subseq 382705 len 1428 csum 0xc991], length 1428
17:11:06.538486 IP 112.26.3.1.targus-getdata1 > 112.26.3.8.39939: Flags [.], ack 4294950160, win 7639, options [nop,nop,TS val 58948 ecr 4294795179,nop,nop,sack 2 {4294954444:1428}{4294951588:4294953016},mptcp dss ack 2858287311], length 0
17:11:06.538820 IP 112.26.3.1.targus-getdata1 > 112.26.3.8.39939: Flags [.], ack 4294950160, win 7639, options [nop,nop,TS val 58948 ecr 4294795179,nop,nop,sack 2 {4294954444:1428}{4294951588:4294953016},mptcp dss ack 2858287311], length 0
17:11:06.588780 IP 112.26.3.1.targus-getdata1 > 112.26.3.8.39939: Flags [.], ack 4294950160, win 7639, options [nop,nop,TS val 58274 ecr 4294795179,nop,nop,sack 2 {4294954444:4294960156}{4294951588:4294953016},mptcp dss ack 2858287311], length 0
17:11:06.614342 IP 112.26.3.1.targus-getdata1 > 112.26.3.8.39939: Flags [.], ack 4294950160, win 7639, options [nop,nop,TS val 58358 ecr 4294795179,nop,nop,sack 2 {4294954444:4294961584}{4294951588:4294953016},mptcp dss ack 2858287311], length 0
17:11:06.671181 IP 112.26.3.8.39939 > 112.26.3.1.targus-getdata1: Flags [.], seq 4294950160:4294951588, ack 1, win 4107, options [nop,nop,TS val 4294797146 ecr 57749,mptcp dss ack 569926353 seq 2858287311 subseq 365569 len 1428 csum 0xaa], length 1428
17:11:06.674678 IP 112.26.3.8.39939 > 112.26.3.1.targus-getdata1: Flags [.], seq 4294950160:4294951588, ack 1, win 4107, options [nop,nop,TS val 4294797146 ecr 57749,mptcp dss ack 569926353 seq 2858287311 subseq 365569 len 1428 csum 0xaa], length 1428
17:11:06.680209 IP 112.26.3.1.targus-getdata1 > 112.26.3.8.39939: Flags [.], ack 4294953016, win 7483, options [nop,nop,TS val 59088 ecr 4294797146,nop,nop,sack 1 {4294954444:1428},mptcp dss ack 2858307303], length 0
17:11:06.680523 IP 112.26.3.1.targus-getdata1 > 112.26.3.8.39939: Flags [.], ack 4294953016, win 7483, options [nop,nop,TS val 59088 ecr 4294797146,nop,nop,sack 1 {4294954444:1428},mptcp dss ack 2858307303], length 0
17:11:06.770965 IP 112.26.3.1.targus-getdata1 > 112.26.3.8.39939: Flags [.], ack 4294950160, win 7639, options [nop,nop,TS val 58503 ecr 4294795179,nop,nop,sack 2 {4294954444:4294963012}{4294951588:4294953016},mptcp dss ack 2858287311], length 0
17:11:06.845779 IP 112.26.3.1.targus-getdata1 > 112.26.3.8.39939: Flags [.], ack 4294950160, win 7639, options [nop,nop,TS val 58620 ecr 4294795179,nop,nop,sack 2 {4294954444:4294964440}{4294951588:4294953016},mptcp dss ack 2858287311], length 0
17:11:06.886976 IP 112.26.3.8.39939 > 112.26.3.1.targus-getdata1: Flags [.], seq 4294953016:4294954444, ack 1, win 4107, options [nop,nop,TS val 4294797351 ecr 57982,mptcp dss ack 569926353 seq 2858307303 subseq 368425 len 1428 csum 0xdfe6], length 1428
17:11:06.889751 IP 112.26.3.8.39939 > 112.26.3.1.targus-getdata1: Flags [.], seq 4294953016:4294954444, ack 1, win 4107, options [nop,nop,TS val 4294797351 ecr 57982,mptcp dss ack 569926353 seq 2858307303 subseq 368425 len 1428 csum 0xdfe6], length 1428
17:11:06.897508 IP 112.26.3.1.targus-getdata1 > 112.26.3.8.39939: Flags [.], ack 1428, win 7490, options [nop,nop,TS val 59303 ecr 4294797351,mptcp dss ack 2858361567], length 0
17:11:06.897768 IP 112.26.3.1.targus-getdata1 > 112.26.3.8.39939: Flags [.], ack 1428, win 7490, options [nop,nop,TS val 59303 ecr 4294797351,mptcp dss ack 2858361567], length 0
17:11:06.947068 IP 112.26.3.1.targus-getdata1 > 112.26.3.8.39939: Flags [.], ack 4294950160, win 7639, options [nop,nop,TS val 58740 ecr 4294795179,nop,nop,sack 2 {4294954444:4294965868}{4294951588:4294953016},mptcp dss ack 2858287311], length 0
17:11:07.002389 IP 112.26.3.1.targus-getdata1 > 112.26.3.8.39939: Flags [.], ack 4294950160, win 7639, options [nop,nop,TS val 58859 ecr 4294795179,nop,nop,sack 2 {4294954444:0}{4294951588:4294953016},mptcp dss ack 2858287311], length 0
17:11:07.056481 IP 112.26.3.1.targus-getdata1 > 112.26.3.8.39939: Flags [.], ack 4294950160, win 7639, options [nop,nop,TS val 58948 ecr 4294795179,nop,nop,sack 2 {4294954444:1428}{4294951588:4294953016},mptcp dss ack 2858287311], length 0
17:11:07.152858 IP 112.26.3.8.39939 > 112.26.3.1.targus-getdata1: Flags [.], seq 1428:2856, ack 1, win 4107, options [nop,nop,TS val 4294797751 ecr 58358,mptcp dss ack 569926353 seq 2858402979 subseq 384133 len 1428 csum 0x5650], length 1428
17:11:07.156699 IP 112.26.3.8.39939 > 112.26.3.1.targus-getdata1: Flags [.], seq 1428:2856, ack 1, win 4107, options [nop,nop,TS val 4294797751 ecr 58358,mptcp dss ack 569926353 seq 2858402979 subseq 384133 len 1428 csum 0x5650], length 1428
17:11:07.158756 IP 112.26.3.1.targus-getdata1 > 112.26.3.8.39939: Flags [.], ack 2856, win 7639, options [nop,nop,TS val 59571 ecr 4294797751,mptcp dss ack 2858361567], length 0
17:11:07.159076 IP 112.26.3.1.targus-getdata1 > 112.26.3.8.39939: Flags [.], ack 2856, win 7639, options [nop,nop,TS val 59571 ecr 4294797751,mptcp dss ack 2858361567], length 0
17:11:07.238071 IP 112.26.3.1.targus-getdata1 > 112.26.3.8.39939: Flags [.], ack 4294953016, win 7483, options [nop,nop,TS val 59088 ecr 4294797146,nop,nop,sack 1 {4294954444:1428},mptcp dss ack 2858307303], length 0
17:11:07.302839 IP 112.26.3.8.39939 > 112.26.3.1.targus-getdata1: Flags [.], seq 2856:4284, ack 1, win 4107, options [nop,nop,TS val 4294797901 ecr 58503,mptcp dss ack 569926353 seq 2858407263 subseq 385561 len 1428 csum 0x6fbb], length 1428
17:11:07.307317 IP 112.26.3.8.39939 > 112.26.3.1.targus-getdata1: Flags [.], seq 2856:4284, ack 1, win 4107, options [nop,nop,TS val 4294797901 ecr 58503,mptcp dss ack 569926353 seq 2858407263 subseq 385561 len 1428 csum 0x6fbb], length 1428
17:11:07.313902 IP 112.26.3.1.targus-getdata1 > 112.26.3.8.39939: Flags [.], ack 4284, win 7639, options [nop,nop,TS val 59721 ecr 4294797901,mptcp dss ack 2858361567], length 0
17:11:07.314218 IP 112.26.3.1.targus-getdata1 > 112.26.3.8.39939: Flags [.], ack 4284, win 7639, options [nop,nop,TS val 59721 ecr 4294797901,mptcp dss ack 2858361567], length 0
17:11:07.388140 IP 112.26.3.8.39939 > 112.26.3.1.targus-getdata1: Flags [.], seq 4284:5712, ack 1, win 4107, options [nop,nop,TS val 4294797973 ecr 58620,mptcp dss ack 569926353 seq 2858414403 subseq 386989 len 1428 csum 0x988d], length 1428
17:11:07.391454 IP 112.26.3.8.39939 > 112.26.3.1.targus-getdata1: Flags [.], seq 4284:5712, ack 1, win 4107, options [nop,nop,TS val 4294797973 ecr 58620,mptcp dss ack 569926353 seq 2858414403 subseq 386989 len 1428 csum 0x988d], length 1428
17:11:07.398306 IP 112.26.3.1.targus-getdata1 > 112.26.3.8.39939: Flags [.], ack 5712, win 7639, options [nop,nop,TS val 59805 ecr 4294797973,mptcp dss ack 2858361567], length 0
17:11:07.398646 IP 112.26.3.1.targus-getdata1 > 112.26.3.8.39939: Flags [.], ack 5712, win 7639, options [nop,nop,TS val 59805 ecr 4294797973,mptcp dss ack 2858361567], length 0
17:11:07.501694 IP 112.26.3.1.targus-getdata1 > 112.26.3.8.39939: Flags [.], ack 1428, win 7490, options [nop,nop,TS val 59303 ecr 4294797351,mptcp dss ack 2858361567], length 0
17:11:07.570214 IP 112.26.3.8.39939 > 112.26.3.1.targus-getdata1: Flags [.], seq 5712:7140, ack 1, win 4107, options [nop,nop,TS val 4294798077 ecr 58740,mptcp dss ack 569926353 seq 2858431539 subseq 388417 len 1428 csum 0x1d21], length 1428
17:11:07.572607 IP 112.26.3.8.39939 > 112.26.3.1.targus-getdata1: Flags [.], seq 5712:7140, ack 1, win 4107, options [nop,nop,TS val 4294798077 ecr 58740,mptcp dss ack 569926353 seq 2858431539 subseq 388417 len 1428 csum 0x1d21], length 1428
17:11:07.585832 IP 112.26.3.1.targus-getdata1 > 112.26.3.8.39939: Flags [.], ack 7140, win 7639, options [nop,nop,TS val 59986 ecr 4294798077,mptcp dss ack 2858361567], length 0
17:11:07.586153 IP 112.26.3.1.targus-getdata1 > 112.26.3.8.39939: Flags [.], ack 7140, win 7639, options [nop,nop,TS val 59986 ecr 4294798077,mptcp dss ack 2858361567], length 0
17:11:07.673395 IP 112.26.3.8.39939 > 112.26.3.1.targus-getdata1: Flags [.], seq 7140:8568, ack 1, win 4107, options [nop,nop,TS val 4294798125 ecr 58859,mptcp dss ack 569926353 seq 2858435823 subseq 389845 len 1428 csum 0x20eb], length 1428
17:11:07.677910 IP 112.26.3.1.targus-getdata1 > 112.26.3.8.39939: Flags [.], ack 8568, win 7639, options [nop,nop,TS val 60090 ecr 4294798125,mptcp dss ack 2858361567], length 0
17:11:07.678177 IP 112.26.3.1.targus-getdata1 > 112.26.3.8.39939: Flags [.], ack 8568, win 7639, options [nop,nop,TS val 60090 ecr 4294798125,mptcp dss ack 2858361567], length 0
17:11:07.682376 IP 112.26.3.8.39939 > 112.26.3.1.targus-getdata1: Flags [.], seq 7140:8568, ack 1, win 4107, options [nop,nop,TS val 4294798125 ecr 58859,mptcp dss ack 569926353 seq 2858435823 subseq 389845 len 1428 csum 0x20eb], length 1428
17:11:07.735149 IP 112.26.3.8.39939 > 112.26.3.1.targus-getdata1: Flags [.], seq 8568:9996, ack 1, win 4107, options [nop,nop,TS val 4294798201 ecr 58948,mptcp dss ack 569926353 seq 2858438679 subseq 391273 len 1428 csum 0x24b3], length 1428
17:11:07.803180 IP 112.26.3.8.39939 > 112.26.3.1.targus-getdata1: Flags [.], seq 8568:9996, ack 1, win 4107, options [nop,nop,TS val 4294798201 ecr 58948,mptcp dss ack 569926353 seq 2858438679 subseq 391273 len 1428 csum 0x24b3], length 1428
17:11:07.804536 IP 112.26.3.1.targus-getdata1 > 112.26.3.8.39939: Flags [.], ack 9996, win 7639, options [nop,nop,TS val 60217 ecr 4294798201,mptcp dss ack 2858361567], length 0
17:11:07.804819 IP 112.26.3.1.targus-getdata1 > 112.26.3.8.39939: Flags [.], ack 9996, win 7639, options [nop,nop,TS val 60217 ecr 4294798201,mptcp dss ack 2858361567], length 0
17:11:07.841613 IP 112.26.3.1.targus-getdata1 > 112.26.3.8.39939: Flags [.], ack 2856, win 7639, options [nop,nop,TS val 59571 ecr 4294797751,mptcp dss ack 2858361567], length 0
17:11:07.922714 IP 112.26.3.8.39939 > 112.26.3.1.targus-getdata1: Flags [.], seq 9996:11424, ack 1, win 4107, options [nop,nop,TS val 4294798351 ecr 59088,mptcp dss ack 569926353 seq 2858448675 subseq 392701 len 1428 csum 0xc892], length 1428
17:11:07.925936 IP 112.26.3.8.39939 > 112.26.3.1.targus-getdata1: Flags [.], seq 9996:11424, ack 1, win 4107, options [nop,nop,TS val 4294798351 ecr 59088,mptcp dss ack 569926353 seq 2858448675 subseq 392701 len 1428 csum 0xc892], length 1428
17:11:07.930789 IP 112.26.3.1.targus-getdata1 > 112.26.3.8.39939: Flags [.], ack 11424, win 7639, options [nop,nop,TS val 60339 ecr 4294798351,mptcp dss ack 2858361567], length 0
17:11:07.931079 IP 112.26.3.1.targus-getdata1 > 112.26.3.8.39939: Flags [.], ack 11424, win 7639, options [nop,nop,TS val 60339 ecr 4294798351,mptcp dss ack 2858361567], length 0
17:11:08.004319 IP 112.26.3.1.targus-getdata1 > 112.26.3.8.39939: Flags [.], ack 4284, win 7639, options [nop,nop,TS val 59721 ecr 4294797901,mptcp dss ack 2858361567], length 0
17:11:08.062934 IP 112.26.3.1.targus-getdata1 > 112.26.3.8.39939: Flags [.], ack 5712, win 7639, options [nop,nop,TS val 59805 ecr 4294797973,mptcp dss ack 2858361567], length 0
17:11:08.144269 IP 112.26.3.8.39939 > 112.26.3.1.targus-getdata1: Flags [.], seq 11424:12852, ack 1, win 4107, options [nop,nop,TS val 4294798614 ecr 59303,mptcp dss ack 569926353 seq 2858465811 subseq 394129 len 1428 csum 0x1a2e], length 1428
17:11:08.150177 IP 112.26.3.1.targus-getdata1 > 112.26.3.8.39939: Flags [.], ack 12852, win 7639, options [nop,nop,TS val 60561 ecr 4294798614,mptcp dss ack 2858361567], length 0
17:11:08.150477 IP 112.26.3.1.targus-getdata1 > 112.26.3.8.39939: Flags [.], ack 12852, win 7639, options [nop,nop,TS val 60561 ecr 4294798614,mptcp dss ack 2858361567], length 0
17:11:08.159778 IP 112.26.3.8.39939 > 112.26.3.1.targus-getdata1: Flags [.], seq 11424:12852, ack 1, win 4107, options [nop,nop,TS val 4294798614 ecr 59303,mptcp dss ack 569926353 seq 2858465811 subseq 394129 len 1428 csum 0x1a2e], length 1428
17:11:08.250411 IP 112.26.3.1.targus-getdata1 > 112.26.3.8.39939: Flags [.], ack 7140, win 7639, options [nop,nop,TS val 59986 ecr 4294798077,mptcp dss ack 2858361567], length 0
17:11:08.307153 IP 112.26.3.1.targus-getdata1 > 112.26.3.8.39939: Flags [.], ack 8568, win 7639, options [nop,nop,TS val 60090 ecr 4294798125,mptcp dss ack 2858361567], length 0
17:11:08.360948 IP 112.26.3.1.targus-getdata1 > 112.26.3.8.39939: Flags [.], ack 9996, win 7639, options [nop,nop,TS val 60217 ecr 4294798201,mptcp dss ack 2858361567], length 0
17:11:08.422869 IP 112.26.3.8.39939 > 112.26.3.1.targus-getdata1: Flags [.], seq 12852:14280, ack 1, win 4107, options [nop,nop,TS val 4294798954 ecr 59571,mptcp dss ack 569926353 seq 2858471523 subseq 395557 len 1428 csum 0x236d], length 1428
17:11:08.428045 IP 112.26.3.8.39939 > 112.26.3.1.targus-getdata1: Flags [.], seq 12852:14280, ack 1, win 4107, options [nop,nop,TS val 4294798954 ecr 59571,mptcp dss ack 569926353 seq 2858471523 subseq 395557 len 1428 csum 0x236d], length 1428
17:11:08.430170 IP 112.26.3.1.targus-getdata1 > 112.26.3.8.39939: Flags [.], ack 14280, win 7639, options [nop,nop,TS val 60842 ecr 4294798954,mptcp dss ack 2858361567], length 0
17:11:08.430411 IP 112.26.3.1.targus-getdata1 > 112.26.3.8.39939: Flags [.], ack 14280, win 7639, options [nop,nop,TS val 60842 ecr 4294798954,mptcp dss ack 2858361567], length 0
17:11:08.485984 IP 112.26.3.1.targus-getdata1 > 112.26.3.8.39939: Flags [.], ack 11424, win 7639, options [nop,nop,TS val 60339 ecr 4294798351,mptcp dss ack 2858361567], length 0
17:11:08.565978 IP 112.26.3.8.39939 > 112.26.3.1.targus-getdata1: Flags [.], seq 14280:15708, ack 1, win 4107, options [nop,nop,TS val 4294799117 ecr 59721,mptcp dss ack 569926353 seq 2858474379 subseq 396985 len 1428 csum 0xc2f0], length 1428
17:11:08.573226 IP 112.26.3.8.39939 > 112.26.3.1.targus-getdata1: Flags [.], seq 14280:15708, ack 1, win 4107, options [nop,nop,TS val 4294799117 ecr 59721,mptcp dss ack 569926353 seq 2858474379 subseq 396985 len 1428 csum 0xc2f0], length 1428
17:11:08.577931 IP 112.26.3.1.targus-getdata1 > 112.26.3.8.39939: Flags [.], ack 15708, win 7639, options [nop,nop,TS val 60987 ecr 4294799117,mptcp dss ack 2858361567], length 0
17:11:08.578234 IP 112.26.3.1.targus-getdata1 > 112.26.3.8.39939: Flags [.], ack 15708, win 7639, options [nop,nop,TS val 60987 ecr 4294799117,mptcp dss ack 2858361567], length 0
17:11:08.664839 IP 112.26.3.8.39939 > 112.26.3.1.targus-getdata1: Flags [.], seq 15708:17136, ack 1, win 4107, options [nop,nop,TS val 4294799176 ecr 59805,mptcp dss ack 569926353 seq 2858475807 subseq 398413 len 1428 csum 0x4abb], length 1428
17:11:08.668032 IP 112.26.3.8.39939 > 112.26.3.1.targus-getdata1: Flags [.], seq 15708:17136, ack 1, win 4107, options [nop,nop,TS val 4294799176 ecr 59805,mptcp dss ack 569926353 seq 2858475807 subseq 398413 len 1428 csum 0x4abb], length 1428
17:11:08.670637 IP 112.26.3.1.targus-getdata1 > 112.26.3.8.39939: Flags [.], ack 17136, win 7639, options [nop,nop,TS val 61082 ecr 4294799176,mptcp dss ack 2858361567], length 0
17:11:08.670936 IP 112.26.3.1.targus-getdata1 > 112.26.3.8.39939: Flags [.], ack 17136, win 7639, options [nop,nop,TS val 61082 ecr 4294799176,mptcp dss ack 2858361567], length 0
17:11:08.749518 IP 112.26.3.1.targus-getdata1 > 112.26.3.8.39939: Flags [.], ack 12852, win 7639, options [nop,nop,TS val 60561 ecr 4294798614,mptcp dss ack 2858361567], length 0
17:11:08.811785 IP 112.26.3.8.39939 > 112.26.3.1.targus-getdata1: Flags [.], seq 17136:18564, ack 1, win 4107, options [nop,nop,TS val 4294799176 ecr 59805,mptcp dss ack 569926353 seq 2858477235 subseq 399841 len 1428 csum 0x4ff7], length 1428
17:11:08.816116 IP 112.26.3.8.39939 > 112.26.3.1.targus-getdata1: Flags [.], seq 17136:18564, ack 1, win 4107, options [nop,nop,TS val 4294799176 ecr 59805,mptcp dss ack 569926353 seq 2858477235 subseq 399841 len 1428 csum 0x4ff7], length 1428
17:11:08.822237 IP 112.26.3.1.targus-getdata1 > 112.26.3.8.39939: Flags [.], ack 18564, win 7639, options [nop,nop,TS val 61230 ecr 4294799176,mptcp dss ack 2858361567], length 0
17:11:08.822562 IP 112.26.3.1.targus-getdata1 > 112.26.3.8.39939: Flags [.], ack 18564, win 7639, options [nop,nop,TS val 61230 ecr 4294799176,mptcp dss ack 2858361567], length 0
17:11:08.907324 IP 112.26.3.8.39939 > 112.26.3.1.targus-getdata1: Flags [.], seq 18564:19992, ack 1, win 4107, options [nop,nop,TS val 4294799363 ecr 59986,mptcp dss ack 569926353 seq 2858488659 subseq 401269 len 1428 csum 0xb903], length 1428
17:11:08.911031 IP 112.26.3.8.39939 > 112.26.3.1.targus-getdata1: Flags [.], seq 18564:19992, ack 1, win 4107, options [nop,nop,TS val 4294799363 ecr 59986,mptcp dss ack 569926353 seq 2858488659 subseq 401269 len 1428 csum 0xb903], length 1428
17:11:08.925139 IP 112.26.3.1.targus-getdata1 > 112.26.3.8.39939: Flags [.], ack 19992, win 7639, options [nop,nop,TS val 61324 ecr 4294799363,mptcp dss ack 2858361567], length 0
17:11:08.925443 IP 112.26.3.1.targus-getdata1 > 112.26.3.8.39939: Flags [.], ack 19992, win 7639, options [nop,nop,TS val 61324 ecr 4294799363,mptcp dss ack 2858361567], length 0
17:11:08.994189 IP 112.26.3.8.39939 > 112.26.3.1.targus-getdata1: Flags [.], seq 19992:21420, ack 1, win 4107, options [nop,nop,TS val 4294799420 ecr 60090,mptcp dss ack 569926353 seq 2858490087 subseq 402697 len 1428 csum 0xe2c6], length 1428
17:11:09.000146 IP 112.26.3.8.39939 > 112.26.3.1.targus-getdata1: Flags [.], seq 19992:21420, ack 1, win 4107, options [nop,nop,TS val 4294799420 ecr 60090,mptcp dss ack 569926353 seq 2858490087 subseq 402697 len 1428 csum 0xe2c6], length 1428
17:11:09.009387 IP 112.26.3.1.targus-getdata1 > 112.26.3.8.39939: Flags [.], ack 21420, win 7639, options [nop,nop,TS val 61413 ecr 4294799420,mptcp dss ack 2858361567], length 0
17:11:09.009642 IP 112.26.3.1.targus-getdata1 > 112.26.3.8.39939: Flags [.], ack 21420, win 7639, options [nop,nop,TS val 61413 ecr 4294799420,mptcp dss ack 2858361567], length 0
17:11:09.091367 IP 112.26.3.8.39939 > 112.26.3.1.targus-getdata1: Flags [.], seq 21420:22848, ack 1, win 4107, options [nop,nop,TS val 4294799474 ecr 60217,mptcp dss ack 569926353 seq 2858491515 subseq 404125 len 1428 csum 0xc661], length 1428
17:11:09.095762 IP 112.26.3.8.39939 > 112.26.3.1.targus-getdata1: Flags [.], seq 21420:22848, ack 1, win 4107, options [nop,nop,TS val 4294799474 ecr 60217,mptcp dss ack 569926353 seq 2858491515 subseq 404125 len 1428 csum 0xc661], length 1428
17:11:09.146152 IP 112.26.3.1.targus-getdata1 > 112.26.3.8.39939: Flags [.], ack 22848, win 7639, options [nop,nop,TS val 61550 ecr 4294799474,mptcp dss ack 2858361567], length 0
17:11:09.146449 IP 112.26.3.1.targus-getdata1 > 112.26.3.8.39939: Flags [.], ack 22848, win 7639, options [nop,nop,TS val 61550 ecr 4294799474,mptcp dss ack 2858361567], length 0
17:11:09.200595 IP 112.26.3.1.targus-getdata1 > 112.26.3.8.39939: Flags [.], ack 14280, win 7639, options [nop,nop,TS val 60842 ecr 4294798954,mptcp dss ack 2858361567], length 0
17:11:09.259782 IP 112.26.3.8.39939 > 112.26.3.1.targus-getdata1: Flags [.], seq 22848:24276, ack 1, win 4107, options [nop,nop,TS val 4294799599 ecr 60339,mptcp dss ack 569926353 seq 2858495799 subseq 405553 len 1428 csum 0x51f4], length 1428
17:11:09.262568 IP 112.26.3.8.39939 > 112.26.3.1.targus-getdata1: Flags [.], seq 22848:24276, ack 1, win 4107, options [nop,nop,TS val 4294799599 ecr 60339,mptcp dss ack 569926353 seq 2858495799 subseq 405553 len 1428 csum 0x51f4], length 1428
17:11:09.338681 IP 112.26.3.1.targus-getdata1 > 112.26.3.8.39939: Flags [.], ack 15708, win 7639, options [nop,nop,TS val 60987 ecr 4294799117,mptcp dss ack 2858361567], length 0
17:11:09.347420 IP 112.26.3.1.targus-getdata1 > 112.26.3.8.39939: Flags [.], ack 24276, win 7639, options [nop,nop,TS val 61760 ecr 4294799599,mptcp dss ack 2858361567], length 0
17:11:09.347690 IP 112.26.3.1.targus-getdata1 > 112.26.3.8.39939: Flags [.], ack 24276, win 7639, options [nop,nop,TS val 61760 ecr 4294799599,mptcp dss ack 2858361567], length 0
17:11:09.411956 IP 112.26.3.1.targus-getdata1 > 112.26.3.8.39939: Flags [.], ack 17136, win 7639, options [nop,nop,TS val 61082 ecr 4294799176,mptcp dss ack 2858361567], length 0
17:11:09.483128 IP 112.26.3.8.39939 > 112.26.3.1.targus-getdata1: Flags [.], seq 24276:25704, ack 1, win 4107, options [nop,nop,TS val 4294799863 ecr 60561,mptcp dss ack 569926353 seq 2858514363 subseq 406981 len 1428 csum 0x52e9], length 1428
17:11:09.487925 IP 112.26.3.8.39939 > 112.26.3.1.targus-getdata1: Flags [.], seq 24276:25704, ack 1, win 4107, options [nop,nop,TS val 4294799863 ecr 60561,mptcp dss ack 569926353 seq 2858514363 subseq 406981 len 1428 csum 0x52e9], length 1428
17:11:09.531082 IP 112.26.3.1.targus-getdata1 > 112.26.3.8.39939: Flags [.], ack 18564, win 7639, options [nop,nop,TS val 61230 ecr 4294799176,mptcp dss ack 2858361567], length 0
17:11:09.627600 IP 112.26.3.1.targus-getdata1 > 112.26.3.8.39939: Flags [.], ack 19992, win 7639, options [nop,nop,TS val 61324 ecr 4294799363,mptcp dss ack 2858361567], length 0
17:11:09.651197 IP 112.26.3.1.targus-getdata1 > 112.26.3.8.39939: Flags [.], ack 25704, win 7506, options [nop,nop,TS val 62064 ecr 4294799863,mptcp dss ack 2858378703], length 0
17:11:09.651470 IP 112.26.3.1.targus-getdata1 > 112.26.3.8.39939: Flags [.], ack 25704, win 7506, options [nop,nop,TS val 62064 ecr 4294799863,mptcp dss ack 2858378703], length 0
17:11:09.667096 IP 112.26.3.1.targus-getdata1 > 112.26.3.8.39939: Flags [.], ack 21420, win 7639, options [nop,nop,TS val 61413 ecr 4294799420,mptcp dss ack 2858361567], length 0
17:11:09.701094 IP 112.26.3.1.targus-getdata1 > 112.26.3.8.39939: Flags [.], ack 22848, win 7639, options [nop,nop,TS val 61550 ecr 4294799474,mptcp dss ack 2858361567], length 0
17:11:09.794361 IP 112.26.3.8.39939 > 112.26.3.1.targus-getdata1: Flags [.], seq 25704:27132, ack 1, win 4107, options [nop,nop,TS val 4294800313 ecr 60842,mptcp dss ack 569926353 seq 2858527215 subseq 408409 len 1428 csum 0x3526], length 1428
17:11:09.799119 IP 112.26.3.8.39939 > 112.26.3.1.targus-getdata1: Flags [.], seq 25704:27132, ack 1, win 4107, options [nop,nop,TS val 4294800313 ecr 60842,mptcp dss ack 569926353 seq 2858527215 subseq 408409 len 1428 csum 0x3526], length 1428
17:11:09.929578 IP 112.26.3.8.39939 > 112.26.3.1.targus-getdata1: Flags [.], seq 27132:28560, ack 1, win 4107, options [nop,nop,TS val 4294800451 ecr 60987,mptcp dss ack 569926353 seq 2858530071 subseq 409837 len 1428 csum 0xcec1], length 1428
17:11:09.931787 IP 112.26.3.8.39939 > 112.26.3.1.targus-getdata1: Flags [.], seq 27132:28560, ack 1, win 4107, options [nop,nop,TS val 4294800451 ecr 60987,mptcp dss ack 569926353 seq 2858530071 subseq 409837 len 1428 csum 0xcec1], length 1428
17:11:09.933659 IP 112.26.3.1.targus-getdata1 > 112.26.3.8.39939: Flags [.], ack 28560, win 7606, options [nop,nop,TS val 62346 ecr 4294800313,mptcp dss ack 2858445819], length 0
17:11:09.933979 IP 112.26.3.1.targus-getdata1 > 112.26.3.8.39939: Flags [.], ack 28560, win 7606, options [nop,nop,TS val 62346 ecr 4294800313,mptcp dss ack 2858445819], length 0
17:11:10.014007 IP 112.26.3.1.targus-getdata1 > 112.26.3.8.39939: Flags [.], ack 24276, win 7639, options [nop,nop,TS val 61760 ecr 4294799599,mptcp dss ack 2858361567], length 0
17:11:10.072942 IP 112.26.3.8.39939 > 112.26.3.1.targus-getdata1: Flags [.], seq 28560:29988, ack 1, win 4107, options [nop,nop,TS val 4294800525 ecr 61082,mptcp dss ack 569926353 seq 2858532927 subseq 411265 len 1428 csum 0xb342], length 1428
17:11:10.075706 IP 112.26.3.8.39939 > 112.26.3.1.targus-getdata1: Flags [.], seq 28560:29988, ack 1, win 4107, options [nop,nop,TS val 4294800525 ecr 61082,mptcp dss ack 569926353 seq 2858532927 subseq 411265 len 1428 csum 0xb342], length 1428
17:11:10.170501 IP 112.26.3.8.39939 > 112.26.3.1.targus-getdata1: Flags [.], seq 29988:31416, ack 1, win 4107, options [nop,nop,TS val 4294800644 ecr 61230,mptcp dss ack 569926353 seq 2858537211 subseq 412693 len 1428 csum 0x2da9], length 1428
17:11:10.174315 IP 112.26.3.8.39939 > 112.26.3.1.targus-getdata1: Flags [.], seq 29988:31416, ack 1, win 4107, options [nop,nop,TS val 4294800644 ecr 61230,mptcp dss ack 569926353 seq 2858537211 subseq 412693 len 1428 csum 0x2da9], length 1428
17:11:10.235519 IP 112.26.3.8.39939 > 112.26.3.1.targus-getdata1: Flags [.], seq 31416:32844, ack 1, win 4107, options [nop,nop,TS val 4294800644 ecr 61230,mptcp dss ack 569926353 seq 2858538639 subseq 414121 len 1428 csum 0x840d], length 1428
17:11:10.238827 IP 112.26.3.8.39939 > 112.26.3.1.targus-getdata1: Flags [.], seq 31416:32844, ack 1, win 4107, options [nop,nop,TS val 4294800644 ecr 61230,mptcp dss ack 569926353 seq 2858538639 subseq 414121 len 1428 csum 0x840d], length 1428
17:11:10.285614 IP 112.26.3.8.39939 > 112.26.3.1.targus-getdata1: Flags [.], seq 32844:34272, ack 1, win 4107, options [nop,nop,TS val 4294800740 ecr 61324,mptcp dss ack 569926353 seq 2858542923 subseq 415549 len 1428 csum 0x78ea], length 1428
17:11:10.334867 IP 112.26.3.8.39939 > 112.26.3.1.targus-getdata1: Flags [.], seq 32844:34272, ack 1, win 4107, options [nop,nop,TS val 4294800740 ecr 61324,mptcp dss ack 569926353 seq 2858542923 subseq 415549 len 1428 csum 0x78ea], length 1428
17:11:10.336432 IP 112.26.3.1.targus-getdata1 > 112.26.3.8.39939: Flags [.], ack 34272, win 7606, options [nop,nop,TS val 62749 ecr 4294800525,mptcp dss ack 2858445819], length 0
17:11:10.336747 IP 112.26.3.1.targus-getdata1 > 112.26.3.8.39939: Flags [.], ack 34272, win 7606, options [nop,nop,TS val 62749 ecr 4294800525,mptcp dss ack 2858445819], length 0
17:11:10.383103 IP 112.26.3.8.39939 > 112.26.3.1.targus-getdata1: Flags [.], seq 34272:35700, ack 1, win 4107, options [nop,nop,TS val 4294800780 ecr 61413,mptcp dss ack 569926353 seq 2858544351 subseq 416977 len 1428 csum 0xc7ab], length 1428
17:11:10.438127 IP 112.26.3.8.39939 > 112.26.3.1.targus-getdata1: Flags [.], seq 34272:35700, ack 1, win 4107, options [nop,nop,TS val 4294800780 ecr 61413,mptcp dss ack 569926353 seq 2858544351 subseq 416977 len 1428 csum 0xc7ab], length 1428
17:11:10.473167 IP 112.26.3.8.39939 > 112.26.3.1.targus-getdata1: Flags [.], seq 35700:37128, ack 1, win 4107, options [nop,nop,TS val 4294800814 ecr 61550,mptcp dss ack 569926353 seq 2858545779 subseq 418405 len 1428 csum 0x8afd], length 1428
17:11:10.503790 IP 112.26.3.8.39939 > 112.26.3.1.targus-getdata1: Flags [.], seq 35700:37128, ack 1, win 4107, options [nop,nop,TS val 4294800814 ecr 61550,mptcp dss ack 569926353 seq 2858545779 subseq 418405 len 1428 csum 0x8afd], length 1428
17:11:10.540713 IP 112.26.3.1.targus-getdata1 > 112.26.3.8.39939: Flags [.], ack 28560, win 7606, options [nop,nop,TS val 62346 ecr 4294800313,mptcp dss ack 2858445819], length 0
17:11:10.649086 IP 112.26.3.1.targus-getdata1 > 112.26.3.8.39939: Flags [.], ack 37128, win 7606, options [nop,nop,TS val 63056 ecr 4294800780,mptcp dss ack 2858445819], length 0
17:11:10.649369 IP 112.26.3.1.targus-getdata1 > 112.26.3.8.39939: Flags [.], ack 37128, win 7606, options [nop,nop,TS val 63056 ecr 4294800780,mptcp dss ack 2858445819], length 0
17:11:10.654486 IP 112.26.3.8.39939 > 112.26.3.1.targus-getdata1: Flags [.], seq 37128:38556, ack 1, win 4107, options [nop,nop,TS val 4294801127 ecr 61760,mptcp dss ack 569926353 seq 2858560059 subseq 419833 len 1428 csum 0x11e9], length 1428
17:11:10.657232 IP 112.26.3.8.39939 > 112.26.3.1.targus-getdata1: Flags [.], seq 37128:38556, ack 1, win 4107, options [nop,nop,TS val 4294801127 ecr 61760,mptcp dss ack 569926353 seq 2858560059 subseq 419833 len 1428 csum 0x11e9], length 1428
17:11:10.748400 IP 112.26.3.1.targus-getdata1 > 112.26.3.8.39939: Flags [.], ack 34272, win 7606, options [nop,nop,TS val 62749 ecr 4294800525,mptcp dss ack 2858445819], length 0
17:11:10.834605 IP 112.26.3.8.39939 > 112.26.3.1.targus-getdata1: Flags [.], seq 38556:39984, ack 1, win 4107, options [nop,nop,TS val 4294801654 ecr 62346,mptcp dss ack 569926353 seq 2858581479 subseq 421261 len 1428 csum 0xcef1], length 1428
17:11:10.855286 IP 112.26.3.8.39939 > 112.26.3.1.targus-getdata1: Flags [.], seq 38556:39984, ack 1, win 4107, options [nop,nop,TS val 4294801654 ecr 62346,mptcp dss ack 569926353 seq 2858581479 subseq 421261 len 1428 csum 0xcef1], length 1428
17:11:10.913428 IP 112.26.3.1.targus-getdata1 > 112.26.3.8.39939: Flags [.], ack 39984, win 7595, options [nop,nop,TS val 63326 ecr 4294801127,mptcp dss ack 2858447247], length 0
17:11:10.913757 IP 112.26.3.1.targus-getdata1 > 112.26.3.8.39939: Flags [.], ack 39984, win 7595, options [nop,nop,TS val 63326 ecr 4294801127,mptcp dss ack 2858447247], length 0
17:11:10.945446 IP 112.26.3.8.39939 > 112.26.3.1.targus-getdata1: Flags [.], seq 39984:41412, ack 1, win 4107, options [nop,nop,TS val 4294801654 ecr 62346,mptcp dss ack 569926353 seq 2858582907 subseq 422689 len 1428 csum 0xb855], length 1428
17:11:10.948978 IP 112.26.3.8.39939 > 112.26.3.1.targus-getdata1: Flags [.], seq 39984:41412, ack 1, win 4107, options [nop,nop,TS val 4294801654 ecr 62346,mptcp dss ack 569926353 seq 2858582907 subseq 422689 len 1428 csum 0xb855], length 1428
17:11:11.056898 IP 112.26.3.1.targus-getdata1 > 112.26.3.8.39939: Flags [.], ack 37128, win 7606, options [nop,nop,TS val 63056 ecr 4294800780,mptcp dss ack 2858445819], length 0
17:11:11.119275 IP 112.26.3.8.39939 > 112.26.3.1.targus-getdata1: Flags [.], seq 41412:42840, ack 1, win 4107, options [nop,nop,TS val 4294801654 ecr 62346,mptcp dss ack 569926353 seq 2858584335 subseq 424117 len 1428 csum 0x7ed4], length 1428
17:11:11.122550 IP 112.26.3.8.39939 > 112.26.3.1.targus-getdata1: Flags [.], seq 41412:42840, ack 1, win 4107, options [nop,nop,TS val 4294801654 ecr 62346,mptcp dss ack 569926353 seq 2858584335 subseq 424117 len 1428 csum 0x7ed4], length 1428
17:11:11.135307 IP 112.26.3.1.targus-getdata1 > 112.26.3.8.39939: Flags [.], ack 42840, win 7639, options [nop,nop,TS val 63545 ecr 4294801654,mptcp dss ack 2858497227], length 0
17:11:11.135675 IP 112.26.3.1.targus-getdata1 > 112.26.3.8.39939: Flags [.], ack 42840, win 7639, options [nop,nop,TS val 63545 ecr 4294801654,mptcp dss ack 2858497227], length 0
17:11:11.226408 IP 112.26.3.8.39939 > 112.26.3.1.targus-getdata1: Flags [.], seq 42840:44268, ack 1, win 4107, options [nop,nop,TS val 4294801861 ecr 62749,mptcp dss ack 569926353 seq 2858588619 subseq 425545 len 1428 csum 0x349a], length 1428
17:11:11.229861 IP 112.26.3.8.39939 > 112.26.3.1.targus-getdata1: Flags [.], seq 42840:44268, ack 1, win 4107, options [nop,nop,TS val 4294801861 ecr 62749,mptcp dss ack 569926353 seq 2858588619 subseq 425545 len 1428 csum 0x349a], length 1428
17:11:11.288022 IP 112.26.3.8.39939 > 112.26.3.1.targus-getdata1: Flags [.], seq 44268:45696, ack 1, win 4107, options [nop,nop,TS val 4294801861 ecr 62749,mptcp dss ack 569926353 seq 2858590047 subseq 426973 len 1428 csum 0x7794], length 1428
17:11:11.326034 IP 112.26.3.8.39939 > 112.26.3.1.targus-getdata1: Flags [.], seq 44268:45696, ack 1, win 4107, options [nop,nop,TS val 4294801861 ecr 62749,mptcp dss ack 569926353 seq 2858590047 subseq 426973 len 1428 csum 0x7794], length 1428
17:11:11.360905 IP 112.26.3.8.39939 > 112.26.3.1.targus-getdata1: Flags [.], seq 45696:47124, ack 1, win 4107, options [nop,nop,TS val 4294801861 ecr 62749,mptcp dss ack 569926353 seq 2858591475 subseq 428401 len 1428 csum 0x6b8c], length 1428
17:11:11.406100 IP 112.26.3.8.39939 > 112.26.3.1.targus-getdata1: Flags [.], seq 45696:47124, ack 1, win 4107, options [nop,nop,TS val 4294801861 ecr 62749,mptcp dss ack 569926353 seq 2858591475 subseq 428401 len 1428 csum 0x6b8c], length 1428
17:11:11.441174 IP 112.26.3.1.targus-getdata1 > 112.26.3.8.39939: Flags [.], ack 39984, win 7595, options [nop,nop,TS val 63326 ecr 4294801127,mptcp dss ack 2858447247], length 0
17:11:11.499440 IP 112.26.3.1.targus-getdata1 > 112.26.3.8.39939: Flags [.], ack 47124, win 7639, options [nop,nop,TS val 63912 ecr 4294801861,mptcp dss ack 2858497227], length 0
17:11:11.499728 IP 112.26.3.1.targus-getdata1 > 112.26.3.8.39939: Flags [.], ack 47124, win 7639, options [nop,nop,TS val 63912 ecr 4294801861,mptcp dss ack 2858497227], length 0
17:11:11.528454 IP 112.26.3.8.39939 > 112.26.3.1.targus-getdata1: Flags [.], seq 47124:48552, ack 1, win 4107, options [nop,nop,TS val 4294801861 ecr 62749,mptcp dss ack 569926353 seq 2858592903 subseq 429829 len 1428 csum 0xf733], length 1428
17:11:11.531703 IP 112.26.3.8.39939 > 112.26.3.1.targus-getdata1: Flags [.], seq 47124:48552, ack 1, win 4107, options [nop,nop,TS val 4294801861 ecr 62749,mptcp dss ack 569926353 seq 2858592903 subseq 429829 len 1428 csum 0xf733], length 1428
17:11:11.643602 IP 112.26.3.8.39939 > 112.26.3.1.targus-getdata1: Flags [P.], seq 48552:49980, ack 1, win 4107, options [nop,nop,TS val 4294801861 ecr 62749,mptcp dss ack 569926353 seq 2858594331 subseq 431257 len 1428 csum 0xd35a], length 1428
17:11:11.647929 IP 112.26.3.8.39939 > 112.26.3.1.targus-getdata1: Flags [P.], seq 48552:49980, ack 1, win 4107, options [nop,nop,TS val 4294801861 ecr 62749,mptcp dss ack 569926353 seq 2858594331 subseq 431257 len 1428 csum 0xd35a], length 1428
17:11:11.708901 IP 112.26.3.8.39939 > 112.26.3.1.targus-getdata1: Flags [.], seq 49980:51408, ack 1, win 4107, options [nop,nop,TS val 4294802169 ecr 63056,mptcp dss ack 569926353 seq 2858600043 subseq 432685 len 1428 csum 0x1b56], length 1428
17:11:11.736518 IP 112.26.3.8.39939 > 112.26.3.1.targus-getdata1: Flags [.], seq 49980:51408, ack 1, win 4107, options [nop,nop,TS val 4294802169 ecr 63056,mptcp dss ack 569926353 seq 2858600043 subseq 432685 len 1428 csum 0x1b56], length 1428
17:11:11.781503 IP 112.26.3.1.targus-getdata1 > 112.26.3.8.39939: Flags [.], ack 42840, win 7639, options [nop,nop,TS val 63545 ecr 4294801654,mptcp dss ack 2858497227], length 0
17:11:11.818877 IP 112.26.3.1.targus-getdata1 > 112.26.3.8.39939: Flags [.], ack 51408, win 7639, options [nop,nop,TS val 64232 ecr 4294801861,mptcp dss ack 2858497227], length 0
17:11:11.819099 IP 112.26.3.1.targus-getdata1 > 112.26.3.8.39939: Flags [.], ack 51408, win 7639, options [nop,nop,TS val 64232 ecr 4294801861,mptcp dss ack 2858497227], length 0
17:11:11.845001 IP 112.26.3.8.39939 > 112.26.3.1.targus-getdata1: Flags [.], seq 51408:52836, ack 1, win 4107, options [nop,nop,TS val 4294802169 ecr 63056,mptcp dss ack 569926353 seq 2858601471 subseq 434113 len 1428 csum 0x64c], length 1428
17:11:11.850605 IP 112.26.3.8.39939 > 112.26.3.1.targus-getdata1: Flags [.], seq 51408:52836, ack 1, win 4107, options [nop,nop,TS val 4294802169 ecr 63056,mptcp dss ack 569926353 seq 2858601471 subseq 434113 len 1428 csum 0x64c], length 1428
17:11:12.019425 IP 112.26.3.8.39939 > 112.26.3.1.targus-getdata1: Flags [.], seq 52836:54264, ack 1, win 4107, options [nop,nop,TS val 4294802554 ecr 63326,mptcp dss ack 569926353 seq 2858610039 subseq 435541 len 1428 csum 0x4d38], length 1428
17:11:12.022527 IP 112.26.3.8.39939 > 112.26.3.1.targus-getdata1: Flags [.], seq 52836:54264, ack 1, win 4107, options [nop,nop,TS val 4294802554 ecr 63326,mptcp dss ack 569926353 seq 2858610039 subseq 435541 len 1428 csum 0x4d38], length 1428
17:11:12.106475 IP 112.26.3.1.targus-getdata1 > 112.26.3.8.39939: Flags [.], ack 47124, win 7639, options [nop,nop,TS val 63912 ecr 4294801861,mptcp dss ack 2858497227], length 0
17:11:12.139809 IP 112.26.3.1.targus-getdata1 > 112.26.3.8.39939: Flags [.], ack 54264, win 7639, options [nop,nop,TS val 64552 ecr 4294802169,mptcp dss ack 2858497227], length 0
17:11:12.140167 IP 112.26.3.1.targus-getdata1 > 112.26.3.8.39939: Flags [.], ack 54264, win 7639, options [nop,nop,TS val 64552 ecr 4294802169,mptcp dss ack 2858497227], length 0
17:11:12.171064 IP 112.26.3.8.39939 > 112.26.3.1.targus-getdata1: Flags [.], seq 54264:55692, ack 1, win 4107, options [nop,nop,TS val 4294802554 ecr 63326,mptcp dss ack 569926353 seq 2858611467 subseq 436969 len 1428 csum 0x3705], length 1428
17:11:12.174415 IP 112.26.3.8.39939 > 112.26.3.1.targus-getdata1: Flags [.], seq 54264:55692, ack 1, win 4107, options [nop,nop,TS val 4294802554 ecr 63326,mptcp dss ack 569926353 seq 2858611467 subseq 436969 len 1428 csum 0x3705], length 1428
17:11:12.268610 IP 112.26.3.8.39939 > 112.26.3.1.targus-getdata1: Flags [.], seq 55692:57120, ack 1, win 4107, options [nop,nop,TS val 4294802554 ecr 63326,mptcp dss ack 569926353 seq 2858612895 subseq 438397 len 1428 csum 0xe06b], length 1428
17:11:12.284829 IP 112.26.3.8.39939 > 112.26.3.1.targus-getdata1: Flags [.], seq 55692:57120, ack 1, win 4107, options [nop,nop,TS val 4294802554 ecr 63326,mptcp dss ack 569926353 seq 2858612895 subseq 438397 len 1428 csum 0xe06b], length 1428
17:11:12.363172 IP 112.26.3.8.39939 > 112.26.3.1.targus-getdata1: Flags [.], seq 57120:58548, ack 1, win 4107, options [nop,nop,TS val 4294802895 ecr 63545,mptcp dss ack 569926353 seq 2858628603 subseq 439825 len 1428 csum 0xf59], length 1428
17:11:12.378426 IP 112.26.3.8.39939 > 112.26.3.1.targus-getdata1: Flags [.], seq 57120:58548, ack 1, win 4107, options [nop,nop,TS val 4294802895 ecr 63545,mptcp dss ack 569926353 seq 2858628603 subseq 439825 len 1428 csum 0xf59], length 1428
17:11:12.457664 IP 112.26.3.1.targus-getdata1 > 112.26.3.8.39939: Flags [.], ack 51408, win 7639, options [nop,nop,TS val 64232 ecr 4294801861,mptcp dss ack 2858497227], length 0
17:11:12.467659 IP 112.26.3.1.targus-getdata1 > 112.26.3.8.39939: Flags [.], ack 58548, win 7606, options [nop,nop,TS val 64880 ecr 4294802554,mptcp dss ack 2858501511], length 0
17:11:12.467937 IP 112.26.3.1.targus-getdata1 > 112.26.3.8.39939: Flags [.], ack 58548, win 7606, options [nop,nop,TS val 64880 ecr 4294802554,mptcp dss ack 2858501511], length 0
17:11:12.558759 IP 112.26.3.8.39939 > 112.26.3.1.targus-getdata1: Flags [.], seq 58548:59976, ack 1, win 4107, options [nop,nop,TS val 4294802895 ecr 63545,mptcp dss ack 569926353 seq 2858630031 subseq 441253 len 1428 csum 0x617c], length 1428
17:11:12.564739 IP 112.26.3.8.39939 > 112.26.3.1.targus-getdata1: Flags [.], seq 58548:59976, ack 1, win 4107, options [nop,nop,TS val 4294802895 ecr 63545,mptcp dss ack 569926353 seq 2858630031 subseq 441253 len 1428 csum 0x617c], length 1428
17:11:12.662994 IP 112.26.3.8.39939 > 112.26.3.1.targus-getdata1: Flags [.], seq 59976:61404, ack 1, win 4107, options [nop,nop,TS val 4294802895 ecr 63545,mptcp dss ack 569926353 seq 2858631459 subseq 442681 len 1428 csum 0xd05d], length 1428
