17:10:28.387317 IP 112.26.0.8.50154 > 112.26.0.1.targus-getdata1: Flags [S], seq 3862265769, win 65535, options [mss 1460,sackOK,TS val 4294759456 ecr 0,nop,wscale 6,mptcp capable csum {0xf18a364a29c98962}], length 0
17:10:28.402481 IP 112.26.0.8.50154 > 112.26.0.1.targus-getdata1: Flags [S], seq 3862265769, win 65535, options [mss 1460,sackOK,TS val 4294759456 ecr 0,nop,wscale 6,mptcp capable csum {0xf18a364a29c98962}], length 0
17:10:28.686102 IP 112.26.0.1.targus-getdata1 > 112.26.0.8.50154: Flags [S.], seq 3747177684, ack 3862265770, win 28560, options [mss 1460,sackOK,TS val 20829 ecr 4294759456,nop,wscale 7,mptcp capable csum {0x514aa99cf55cf33b}], length 0
17:10:28.699455 IP 112.26.0.1.targus-getdata1 > 112.26.0.8.50154: Flags [S.], seq 3747177684, ack 3862265770, win 28560, options [mss 1460,sackOK,TS val 20829 ecr 4294759456,nop,wscale 7,mptcp capable csum {0x514aa99cf55cf33b}], length 0
17:10:28.702180 IP 112.26.0.8.50154 > 112.26.0.1.targus-getdata1: Flags [.], ack 1, win 1369, options [nop,nop,TS val 4294759812 ecr 20829,mptcp capable csum {0xf18a364a29c98962,0x514aa99cf55cf33b},mptcp dss ack 2233144299], length 0
17:10:28.715930 IP 112.26.0.8.50154 > 112.26.0.1.targus-getdata1: Flags [.], ack 1, win 1369, options [nop,nop,TS val 4294759812 ecr 20829,mptcp capable csum {0xf18a364a29c98962,0x514aa99cf55cf33b},mptcp dss ack 2233144299], length 0
17:10:28.723477 IP 112.26.0.8.50154 > 112.26.0.1.targus-getdata1: Flags [.], ack 1, win 1369, options [nop,nop,TS val 4294759812 ecr 20829,mptcp add-addr id 3 112.26.1.8,mptcp dss ack 2233144299], length 0
17:11:06.094049 IP 112.26.0.8.50156 > 112.26.0.1.targus-getdata1: Flags [.], seq 1612183091:1612184519, ack 3373602204, win 4107, options [nop,nop,TS val 4294796705 ecr 57160,mptcp dss ack 569926353 seq 2858357283 subseq 388454 len 1428 csum 0x334c], length 1428
17:11:06.169164 IP 112.26.0.1.targus-getdata1 > 112.26.0.8.50156: Flags [.], ack 4294960156, win 7639, options [nop,nop,TS val 57806 ecr 4294795950,mptcp dss ack 2858287311], length 0
17:11:06.180780 IP 112.26.0.8.50156 > 112.26.0.1.targus-getdata1: Flags [.], seq 7140:8568, ack 1, win 4107, options [nop,nop,TS val 4294797282 ecr 57806,mptcp dss ack 569926353 seq 2858384415 subseq 395594 len 1428 csum 0x3c52], length 1428
17:11:06.181090 IP 112.26.0.8.50156 > 112.26.0.1.targus-getdata1: Flags [.], seq 7140:8568, ack 1, win 4107, options [nop,nop,TS val 4294797282 ecr 57806,mptcp dss ack 569926353 seq 2858384415 subseq 395594 len 1428 csum 0x3c52], length 1428
17:11:06.185435 IP 112.26.0.1.targus-getdata1 > 112.26.0.8.50156: Flags [.], ack 4294965868, win 7639, options [nop,nop,TS val 58343 ecr 4294796424,mptcp dss ack 2858287311], length 0
17:11:06.208922 IP 112.26.0.8.50156 > 112.26.0.1.targus-getdata1: Flags [.], seq 1428:2856, ack 1, win 4107, options [nop,nop,TS val 4294796832 ecr 57298,mptcp dss ack 569926353 seq 2858365851 subseq 389882 len 1428 csum 0x1341], length 1428
17:11:26.237591 IP 112.26.0.8.50156 > 112.26.0.1.targus-getdata1: Flags [.], seq 265608:267036, ack 1, win 4107, options [nop,nop,TS val 4294816301 ecr 77538,mptcp dss ack 569926353 seq 2859236931 subseq 654062 len 1428 csum 0xb1b3], length 1428
17:11:26.247851 IP 112.26.0.1.targus-getdata1 > 112.26.0.8.50156: Flags [.], ack 267036, win 7639, options [nop,nop,TS val 78652 ecr 4294816301,mptcp dss ack 2859191235], length 0
17:11:26.298409 IP 112.26.0.1.targus-getdata1 > 112.26.0.8.50156: Flags [.], ack 265608, win 7639, options [nop,nop,TS val 78534 ecr 4294816263,mptcp dss ack 2859191235], length 0
17:11:26.326062 IP 112.26.0.8.50156 > 112.26.0.1.targus-getdata1: Flags [.], seq 267036:268464, ack 1, win 4107, options [nop,nop,TS val 4294816488 ecr 77644,mptcp dss ack 569926353 seq 2859252639 subseq 655490 len 1428 csum 0xbddf], length 1428
17:11:26.331471 IP 112.26.0.8.50156 > 112.26.0.1.targus-getdata1: Flags [.], seq 278460:279888, ack 1, win 4107, options [nop,nop,TS val 4294817224 ecr 78446,mptcp dss ack 569926353 seq 2859284055 subseq 666914 len 1428 csum 0x1b90], length 1428
17:11:26.331778 IP 112.26.0.8.50156 > 112.26.0.1.targus-getdata1: Flags [.], seq 278460:279888, ack 1, win 4107, options [nop,nop,TS val 4294817224 ecr 78446,mptcp dss ack 569926353 seq 2859284055 subseq 666914 len 1428 csum 0x1b90], length 1428
17:11:26.374650 IP 112.26.0.8.50156 > 112.26.0.1.targus-getdata1: Flags [.], seq 279888:281316, ack 1, win 4107, options [nop,nop,TS val 4294817411 ecr 78534,mptcp dss ack 569926353 seq 2859286911 subseq 668342 len 1428 csum 0x656a], length 1428
17:11:26.374837 IP 112.26.0.8.50156 > 112.26.0.1.targus-getdata1: Flags [.], seq 279888:281316, ack 1, win 4107, options [nop,nop,TS val 4294817411 ecr 78534,mptcp dss ack 569926353 seq 2859286911 subseq 668342 len 1428 csum 0x656a], length 1428
17:11:26.390296 IP 112.26.0.1.targus-getdata1 > 112.26.0.8.50156: Flags [.], ack 268464, win 7639, options [nop,nop,TS val 78735 ecr 4294816488,mptcp dss ack 2859191235], length 0
17:11:26.412433 IP 112.26.0.1.targus-getdata1 > 112.26.0.8.50156: Flags [.], ack 267036, win 7639, options [nop,nop,TS val 78652 ecr 4294816301,mptcp dss ack 2859191235], length 0
17:11:26.424613 IP 112.26.0.8.50156 > 112.26.0.1.targus-getdata1: Flags [.], seq 268464:269892, ack 1, win 4107, options [nop,nop,TS val 4294816495 ecr 77768,mptcp dss ack 569926353 seq 2859254067 subseq 656918 len 1428 csum 0xdc3a], length 1428
17:11:26.452034 IP 112.26.0.8.50156 > 112.26.0.1.targus-getdata1: Flags [.], seq 281316:282744, ack 1, win 4107, options [nop,nop,TS val 4294817411 ecr 78534,mptcp dss ack 569926353 seq 2859288339 subseq 669770 len 1428 csum 0xe8f6], length 1428
17:11:26.452346 IP 112.26.0.8.50156 > 112.26.0.1.targus-getdata1: Flags [.], seq 281316:282744, ack 1, win 4107, options [nop,nop,TS val 4294817411 ecr 78534,mptcp dss ack 569926353 seq 2859288339 subseq 669770 len 1428 csum 0xe8f6], length 1428
17:11:26.539717 IP 112.26.0.8.50156 > 112.26.0.1.targus-getdata1: Flags [.], seq 282744:284172, ack 1, win 4107, options [nop,nop,TS val 4294817525 ecr 78652,mptcp dss ack 569926353 seq 2859296907 subseq 671198 len 1428 csum 0x497e], length 1428
17:11:26.540035 IP 112.26.0.8.50156 > 112.26.0.1.targus-getdata1: Flags [.], seq 282744:284172, ack 1, win 4107, options [nop,nop,TS val 4294817525 ecr 78652,mptcp dss ack 569926353 seq 2859296907 subseq 671198 len 1428 csum 0x497e], length 1428
17:11:26.556811 IP 112.26.0.8.50156 > 112.26.0.1.targus-getdata1: Flags [.], seq 269892:271320, ack 1, win 4107, options [nop,nop,TS val 4294816600 ecr 77895,mptcp dss ack 569926353 seq 2859259779 subseq 658346 len 1428 csum 0xed70], length 1428
17:11:26.631906 IP 112.26.0.1.targus-getdata1 > 112.26.0.8.50156: Flags [.], ack 269892, win 7639, options [nop,nop,TS val 78838 ecr 4294816495,mptcp dss ack 2859191235], length 0
17:11:26.638019 IP 112.26.0.8.50156 > 112.26.0.1.targus-getdata1: Flags [.], seq 271320:272748, ack 1, win 4107, options [nop,nop,TS val 4294816759 ecr 77970,mptcp dss ack 569926353 seq 2859264063 subseq 659774 len 1428 csum 0x9116], length 1428
17:11:26.671169 IP 112.26.0.1.targus-getdata1 > 112.26.0.8.50156: Flags [.], ack 268464, win 7639, options [nop,nop,TS val 78735 ecr 4294816488,mptcp dss ack 2859191235], length 0
17:11:26.684052 IP 112.26.0.8.50156 > 112.26.0.1.targus-getdata1: Flags [.], seq 284172:285600, ack 1, win 4107, options [nop,nop,TS val 4294817784 ecr 78735,mptcp dss ack 569926353 seq 2859304047 subseq 672626 len 1428 csum 0xf9c7], length 1428
17:11:26.684390 IP 112.26.0.8.50156 > 112.26.0.1.targus-getdata1: Flags [.], seq 284172:285600, ack 1, win 4107, options [nop,nop,TS val 4294817784 ecr 78735,mptcp dss ack 569926353 seq 2859304047 subseq 672626 len 1428 csum 0xf9c7], length 1428
17:11:26.691421 IP 112.26.0.8.50156 > 112.26.0.1.targus-getdata1: Flags [.], seq 272748:274176, ack 1, win 4107, options [nop,nop,TS val 4294816958 ecr 78100,mptcp dss ack 569926353 seq 2859268347 subseq 661202 len 1428 csum 0xffb5], length 1428
17:11:26.707859 IP 112.26.0.1.targus-getdata1 > 112.26.0.8.50156: Flags [.], ack 271320, win 7639, options [nop,nop,TS val 78963 ecr 4294816600,mptcp dss ack 2859191235], length 0
17:11:26.741010 IP 112.26.0.1.targus-getdata1 > 112.26.0.8.50156: Flags [.], ack 269892, win 7639, options [nop,nop,TS val 78838 ecr 4294816495,mptcp dss ack 2859191235], length 0
17:11:26.772285 IP 112.26.0.8.50156 > 112.26.0.1.targus-getdata1: Flags [.], seq 285600:287028, ack 1, win 4107, options [nop,nop,TS val 4294817784 ecr 78735,mptcp dss ack 569926353 seq 2859305475 subseq 674054 len 1428 csum 0xd8e9], length 1428
17:11:26.772628 IP 112.26.0.8.50156 > 112.26.0.1.targus-getdata1: Flags [.], seq 285600:287028, ack 1, win 4107, options [nop,nop,TS val 4294817784 ecr 78735,mptcp dss ack 569926353 seq 2859305475 subseq 674054 len 1428 csum 0xd8e9], length 1428
17:11:26.796329 IP 112.26.0.8.50156 > 112.26.0.1.targus-getdata1: Flags [.], seq 274176:275604, ack 1, win 4107, options [nop,nop,TS val 4294817004 ecr 78198,mptcp dss ack 569926353 seq 2859271203 subseq 662630 len 1428 csum 0x55f4], length 1428
17:11:26.821959 IP 112.26.0.1.targus-getdata1 > 112.26.0.8.50156: Flags [.], ack 271320, win 7639, options [nop,nop,TS val 78963 ecr 4294816600,mptcp dss ack 2859191235], length 0
17:11:26.852579 IP 112.26.0.1.targus-getdata1 > 112.26.0.8.50156: Flags [.], ack 272748, win 7639, options [nop,nop,TS val 79052 ecr 4294816759,mptcp dss ack 2859191235], length 0
17:11:26.868774 IP 112.26.0.8.50156 > 112.26.0.1.targus-getdata1: Flags [.], seq 287028:288456, ack 1, win 4107, options [nop,nop,TS val 4294817854 ecr 78838,mptcp dss ack 569926353 seq 2859311187 subseq 675482 len 1428 csum 0xb55c], length 1428
17:11:26.869056 IP 112.26.0.8.50156 > 112.26.0.1.targus-getdata1: Flags [.], seq 287028:288456, ack 1, win 4107, options [nop,nop,TS val 4294817854 ecr 78838,mptcp dss ack 569926353 seq 2859311187 subseq 675482 len 1428 csum 0xb55c], length 1428
17:11:26.885495 IP 112.26.0.8.50156 > 112.26.0.1.targus-getdata1: Flags [.], seq 275604:277032, ack 1, win 4107, options [nop,nop,TS val 4294817083 ecr 78338,mptcp dss ack 569926353 seq 2859281199 subseq 664058 len 1428 csum 0xe3b5], length 1428
17:11:26.971485 IP 112.26.0.1.targus-getdata1 > 112.26.0.8.50156: Flags [.], ack 274176, win 7639, options [nop,nop,TS val 79106 ecr 4294816958,mptcp dss ack 2859191235], length 0
17:11:26.981379 IP 112.26.0.8.50156 > 112.26.0.1.targus-getdata1: Flags [.], seq 288456:289884, ack 1, win 4107, options [nop,nop,TS val 4294817935 ecr 78963,mptcp dss ack 569926353 seq 2859312615 subseq 676910 len 1428 csum 0xcec3], length 1428
17:11:26.981719 IP 112.26.0.8.50156 > 112.26.0.1.targus-getdata1: Flags [.], seq 288456:289884, ack 1, win 4107, options [nop,nop,TS val 4294817935 ecr 78963,mptcp dss ack 569926353 seq 2859312615 subseq 676910 len 1428 csum 0xcec3], length 1428
17:11:27.040171 IP 112.26.0.8.50156 > 112.26.0.1.targus-getdata1: Flags [.], seq 278460:279888, ack 1, win 4107, options [nop,nop,TS val 4294817224 ecr 78446,mptcp dss ack 569926353 seq 2859284055 subseq 666914 len 1428 csum 0x1b90], length 1428
17:11:27.072246 IP 112.26.0.1.targus-getdata1 > 112.26.0.8.50156: Flags [.], ack 272748, win 7639, options [nop,nop,TS val 79052 ecr 4294816759,mptcp dss ack 2859191235], length 0
17:11:27.076553 IP 112.26.0.8.50156 > 112.26.0.1.targus-getdata1: Flags [.], seq 289884:291312, ack 1, win 4107, options [nop,nop,TS val 4294818185 ecr 79052,mptcp dss ack 569926353 seq 2859315471 subseq 678338 len 1428 csum 0x4ba1], length 1428
17:11:27.076870 IP 112.26.0.8.50156 > 112.26.0.1.targus-getdata1: Flags [.], seq 289884:291312, ack 1, win 4107, options [nop,nop,TS val 4294818185 ecr 79052,mptcp dss ack 569926353 seq 2859315471 subseq 678338 len 1428 csum 0x4ba1], length 1428
17:11:27.099859 IP 112.26.0.1.targus-getdata1 > 112.26.0.8.50156: Flags [.], ack 275604, win 7639, options [nop,nop,TS val 79211 ecr 4294817004,mptcp dss ack 2859191235], length 0
17:11:27.149180 IP 112.26.0.8.50156 > 112.26.0.1.targus-getdata1: Flags [.], seq 291312:292740, ack 1, win 4107, options [nop,nop,TS val 4294818185 ecr 79052,mptcp dss ack 569926353 seq 2859316899 subseq 679766 len 1428 csum 0x4fee], length 1428
17:11:27.149514 IP 112.26.0.8.50156 > 112.26.0.1.targus-getdata1: Flags [.], seq 291312:292740, ack 1, win 4107, options [nop,nop,TS val 4294818185 ecr 79052,mptcp dss ack 569926353 seq 2859316899 subseq 679766 len 1428 csum 0x4fee], length 1428
17:11:27.157377 IP 112.26.0.8.50156 > 112.26.0.1.targus-getdata1: Flags [.], seq 279888:281316, ack 1, win 4107, options [nop,nop,TS val 4294817411 ecr 78534,mptcp dss ack 569926353 seq 2859286911 subseq 668342 len 1428 csum 0x656a], length 1428
17:11:27.185068 IP 112.26.0.1.targus-getdata1 > 112.26.0.8.50156: Flags [.], ack 274176, win 7639, options [nop,nop,TS val 79106 ecr 4294816958,mptcp dss ack 2859191235], length 0
17:11:27.206501 IP 112.26.0.8.50156 > 112.26.0.1.targus-getdata1: Flags [.], seq 292740:294168, ack 1, win 4107, options [nop,nop,TS val 4294818298 ecr 79106,mptcp dss ack 569926353 seq 2859318327 subseq 681194 len 1428 csum 0x530b], length 1428
17:11:27.206842 IP 112.26.0.8.50156 > 112.26.0.1.targus-getdata1: Flags [.], seq 292740:294168, ack 1, win 4107, options [nop,nop,TS val 4294818298 ecr 79106,mptcp dss ack 569926353 seq 2859318327 subseq 681194 len 1428 csum 0x530b], length 1428
17:11:27.219999 IP 112.26.0.1.targus-getdata1 > 112.26.0.8.50156: Flags [.], ack 277032, win 7639, options [nop,nop,TS val 79300 ecr 4294817083,mptcp dss ack 2859191235], length 0
17:11:27.257214 IP 112.26.0.8.50156 > 112.26.0.1.targus-getdata1: Flags [.], seq 281316:282744, ack 1, win 4107, options [nop,nop,TS val 4294817411 ecr 78534,mptcp dss ack 569926353 seq 2859288339 subseq 669770 len 1428 csum 0xe8f6], length 1428
17:11:27.281932 IP 112.26.0.1.targus-getdata1 > 112.26.0.8.50156: Flags [.], ack 275604, win 7639, options [nop,nop,TS val 79211 ecr 4294817004,mptcp dss ack 2859191235], length 0
17:11:27.285794 IP 112.26.0.8.50156 > 112.26.0.1.targus-getdata1: Flags [.], seq 294168:295596, ack 1, win 4107, options [nop,nop,TS val 4294818395 ecr 79211,mptcp dss ack 569926353 seq 2859321183 subseq 682622 len 1428 csum 0xa43f], length 1428
17:11:27.286088 IP 112.26.0.8.50156 > 112.26.0.1.targus-getdata1: Flags [.], seq 294168:295596, ack 1, win 4107, options [nop,nop,TS val 4294818395 ecr 79211,mptcp dss ack 569926353 seq 2859321183 subseq 682622 len 1428 csum 0xa43f], length 1428
17:11:27.348633 IP 112.26.0.1.targus-getdata1 > 112.26.0.8.50156: Flags [.], ack 277032, win 7639, options [nop,nop,TS val 79300 ecr 4294817083,mptcp dss ack 2859191235], length 0
17:11:27.376391 IP 112.26.0.8.50156 > 112.26.0.1.targus-getdata1: Flags [.], seq 284172:285600, ack 1, win 4107, options [nop,nop,TS val 4294817784 ecr 78735,mptcp dss ack 569926353 seq 2859304047 subseq 672626 len 1428 csum 0xf9c7], length 1428
17:11:27.417720 IP 112.26.0.8.50156 > 112.26.0.1.targus-getdata1: Flags [.], seq 295596:297024, ack 1, win 4107, options [nop,nop,TS val 4294818462 ecr 79300,mptcp dss ack 569926353 seq 2859325467 subseq 684050 len 1428 csum 0x970c], length 1428
17:11:27.417982 IP 112.26.0.8.50156 > 112.26.0.1.targus-getdata1: Flags [.], seq 295596:297024, ack 1, win 4107, options [nop,nop,TS val 4294818462 ecr 79300,mptcp dss ack 569926353 seq 2859325467 subseq 684050 len 1428 csum 0x970c], length 1428
17:11:27.448417 IP 112.26.0.1.targus-getdata1 > 112.26.0.8.50156: Flags [.], ack 277032, win 7605, options [nop,nop,TS val 79447 ecr 4294817083,nop,nop,sack 1 {278460:279888},mptcp dss ack 2859201231], length 0
17:11:27.477303 IP 112.26.0.1.targus-getdata1 > 112.26.0.8.50156: Flags [.], ack 277032, win 7605, options [nop,nop,TS val 79447 ecr 4294817083,nop,nop,sack 1 {278460:279888},mptcp dss ack 2859201231], length 0
17:11:27.489324 IP 112.26.0.8.50156 > 112.26.0.1.targus-getdata1: Flags [.], seq 285600:287028, ack 1, win 4107, options [nop,nop,TS val 4294817784 ecr 78735,mptcp dss ack 569926353 seq 2859305475 subseq 674054 len 1428 csum 0xd8e9], length 1428
17:11:27.500443 IP 112.26.0.8.50156 > 112.26.0.1.targus-getdata1: Flags [.], seq 297024:298452, ack 1, win 4107, options [nop,nop,TS val 4294818607 ecr 79447,mptcp dss ack 569926353 seq 2859326895 subseq 685478 len 1428 csum 0xd3cb], length 1428
17:11:27.500758 IP 112.26.0.8.50156 > 112.26.0.1.targus-getdata1: Flags [.], seq 297024:298452, ack 1, win 4107, options [nop,nop,TS val 4294818607 ecr 79447,mptcp dss ack 569926353 seq 2859326895 subseq 685478 len 1428 csum 0xd3cb], length 1428
17:11:27.550705 IP 112.26.0.1.targus-getdata1 > 112.26.0.8.50156: Flags [.], ack 277032, win 7605, options [nop,nop,TS val 79571 ecr 4294817083,nop,nop,sack 1 {278460:281316},mptcp dss ack 2859201231], length 0
17:11:27.558446 IP 112.26.0.8.50156 > 112.26.0.1.targus-getdata1: Flags [.], seq 298452:299880, ack 1, win 4107, options [nop,nop,TS val 4294818607 ecr 79447,mptcp dss ack 569926353 seq 2859328323 subseq 686906 len 1428 csum 0x6ee], length 1428
17:11:27.558776 IP 112.26.0.8.50156 > 112.26.0.1.targus-getdata1: Flags [.], seq 298452:299880, ack 1, win 4107, options [nop,nop,TS val 4294818607 ecr 79447,mptcp dss ack 569926353 seq 2859328323 subseq 686906 len 1428 csum 0x6ee], length 1428
17:11:27.595786 IP 112.26.0.8.50156 > 112.26.0.1.targus-getdata1: Flags [.], seq 287028:288456, ack 1, win 4107, options [nop,nop,TS val 4294817854 ecr 78838,mptcp dss ack 569926353 seq 2859311187 subseq 675482 len 1428 csum 0xb55c], length 1428
17:11:27.641719 IP 112.26.0.1.targus-getdata1 > 112.26.0.8.50156: Flags [.], ack 277032, win 7605, options [nop,nop,TS val 79661 ecr 4294817083,nop,nop,sack 1 {278460:282744},mptcp dss ack 2859201231], length 0
17:11:27.650114 IP 112.26.0.1.targus-getdata1 > 112.26.0.8.50156: Flags [.], ack 277032, win 7605, options [nop,nop,TS val 79571 ecr 4294817083,nop,nop,sack 1 {278460:281316},mptcp dss ack 2859201231], length 0
17:11:27.657550 IP 112.26.0.8.50156 > 112.26.0.1.targus-getdata1: Flags [.], seq 299880:301308, ack 1, win 4107, options [nop,nop,TS val 4294818763 ecr 79571,mptcp dss ack 569926353 seq 2859332607 subseq 688334 len 1428 csum 0x1852], length 1428
17:11:27.657877 IP 112.26.0.8.50156 > 112.26.0.1.targus-getdata1: Flags [.], seq 299880:301308, ack 1, win 4107, options [nop,nop,TS val 4294818763 ecr 79571,mptcp dss ack 569926353 seq 2859332607 subseq 688334 len 1428 csum 0x1852], length 1428
17:11:27.727865 IP 112.26.0.1.targus-getdata1 > 112.26.0.8.50156: Flags [.], ack 277032, win 7605, options [nop,nop,TS val 79661 ecr 4294817083,nop,nop,sack 1 {278460:282744},mptcp dss ack 2859201231], length 0
17:11:27.742978 IP 112.26.0.8.50156 > 112.26.0.1.targus-getdata1: Flags [.], seq 288456:289884, ack 1, win 4107, options [nop,nop,TS val 4294817935 ecr 78963,mptcp dss ack 569926353 seq 2859312615 subseq 676910 len 1428 csum 0xcec3], length 1428
17:11:27.784994 IP 112.26.0.8.50156 > 112.26.0.1.targus-getdata1: Flags [.], seq 301308:302736, ack 1, win 4107, options [nop,nop,TS val 4294818863 ecr 79661,mptcp dss ack 569926353 seq 2859336891 subseq 689762 len 1428 csum 0xc6dd], length 1428
17:11:27.785279 IP 112.26.0.8.50156 > 112.26.0.1.targus-getdata1: Flags [.], seq 301308:302736, ack 1, win 4107, options [nop,nop,TS val 4294818863 ecr 79661,mptcp dss ack 569926353 seq 2859336891 subseq 689762 len 1428 csum 0xc6dd], length 1428
17:11:27.830615 IP 112.26.0.8.50156 > 112.26.0.1.targus-getdata1: Flags [.], seq 289884:291312, ack 1, win 4107, options [nop,nop,TS val 4294818185 ecr 79052,mptcp dss ack 569926353 seq 2859315471 subseq 678338 len 1428 csum 0x4ba1], length 1428
17:11:27.835070 IP 112.26.0.1.targus-getdata1 > 112.26.0.8.50156: Flags [.], ack 277032, win 7639, options [nop,nop,TS val 79790 ecr 4294817083,nop,nop,sack 2 {284172:285600}{278460:282744},mptcp dss ack 2859222651], length 0
17:11:27.908031 IP 112.26.0.1.targus-getdata1 > 112.26.0.8.50156: Flags [.], ack 277032, win 7639, options [nop,nop,TS val 79904 ecr 4294817083,nop,nop,sack 2 {284172:287028}{278460:282744},mptcp dss ack 2859224079], length 0
17:11:27.932766 IP 112.26.0.8.50156 > 112.26.0.1.targus-getdata1: Flags [.], seq 292740:294168, ack 1, win 4107, options [nop,nop,TS val 4294818298 ecr 79106,mptcp dss ack 569926353 seq 2859318327 subseq 681194 len 1428 csum 0x530b], length 1428
17:11:27.963769 IP 112.26.0.1.targus-getdata1 > 112.26.0.8.50156: Flags [.], ack 277032, win 7639, options [nop,nop,TS val 80003 ecr 4294817083,nop,nop,sack 2 {284172:288456}{278460:282744},mptcp dss ack 2859224079], length 0
17:11:27.970278 IP 112.26.0.1.targus-getdata1 > 112.26.0.8.50156: Flags [.], ack 277032, win 7639, options [nop,nop,TS val 79790 ecr 4294817083,nop,nop,sack 2 {284172:285600}{278460:282744},mptcp dss ack 2859222651], length 0
17:11:27.978176 IP 112.26.0.8.50156 > 112.26.0.1.targus-getdata1: Flags [.], seq 277032:278460, ack 1, win 4107, options [nop,nop,TS val 4294819083 ecr 79790,mptcp dss ack 569926353 seq 2859282627 subseq 665486 len 1428 csum 0x18e4], length 1428
17:11:27.978505 IP 112.26.0.8.50156 > 112.26.0.1.targus-getdata1: Flags [.], seq 277032:278460, ack 1, win 4107, options [nop,nop,TS val 4294819083 ecr 79790,mptcp dss ack 569926353 seq 2859282627 subseq 665486 len 1428 csum 0x18e4], length 1428
17:11:28.025340 IP 112.26.0.8.50156 > 112.26.0.1.targus-getdata1: Flags [.], seq 294168:295596, ack 1, win 4107, options [nop,nop,TS val 4294818395 ecr 79211,mptcp dss ack 569926353 seq 2859321183 subseq 682622 len 1428 csum 0xa43f], length 1428
17:11:28.062538 IP 112.26.0.1.targus-getdata1 > 112.26.0.8.50156: Flags [.], ack 277032, win 7639, options [nop,nop,TS val 79904 ecr 4294817083,nop,nop,sack 2 {284172:287028}{278460:282744},mptcp dss ack 2859224079], length 0
17:11:28.072310 IP 112.26.0.8.50156 > 112.26.0.1.targus-getdata1: Flags [.], seq 282744:284172, ack 1, win 4107, options [nop,nop,TS val 4294819176 ecr 79904,mptcp dss ack 569926353 seq 2859296907 subseq 671198 len 1428 csum 0x497e], length 1428
17:11:28.072668 IP 112.26.0.8.50156 > 112.26.0.1.targus-getdata1: Flags [.], seq 282744:284172, ack 1, win 4107, options [nop,nop,TS val 4294819176 ecr 79904,mptcp dss ack 569926353 seq 2859296907 subseq 671198 len 1428 csum 0x497e], length 1428
17:11:28.158594 IP 112.26.0.8.50156 > 112.26.0.1.targus-getdata1: Flags [.], seq 297024:298452, ack 1, win 4107, options [nop,nop,TS val 4294818607 ecr 79447,mptcp dss ack 569926353 seq 2859326895 subseq 685478 len 1428 csum 0xd3cb], length 1428
17:11:28.169843 IP 112.26.0.1.targus-getdata1 > 112.26.0.8.50156: Flags [.], ack 277032, win 7639, options [nop,nop,TS val 80003 ecr 4294817083,nop,nop,sack 2 {284172:288456}{278460:282744},mptcp dss ack 2859224079], length 0
17:11:28.241132 IP 112.26.0.8.50156 > 112.26.0.1.targus-getdata1: Flags [.], seq 298452:299880, ack 1, win 4107, options [nop,nop,TS val 4294818607 ecr 79447,mptcp dss ack 569926353 seq 2859328323 subseq 686906 len 1428 csum 0x6ee], length 1428
17:11:28.246366 IP 112.26.0.1.targus-getdata1 > 112.26.0.8.50156: Flags [.], ack 277032, win 7639, options [nop,nop,TS val 80139 ecr 4294817083,nop,nop,sack 2 {284172:289884}{278460:282744},mptcp dss ack 2859229791], length 0
17:11:28.309329 IP 112.26.0.1.targus-getdata1 > 112.26.0.8.50156: Flags [.], ack 277032, win 7639, options [nop,nop,TS val 80139 ecr 4294817083,nop,nop,sack 2 {284172:289884}{278460:282744},mptcp dss ack 2859229791], length 0
17:11:28.353070 IP 112.26.0.8.50156 > 112.26.0.1.targus-getdata1: Flags [.], seq 302736:304164, ack 1, win 4107, options [nop,nop,TS val 4294819462 ecr 80139,mptcp dss ack 569926353 seq 2859356883 subseq 691190 len 1428 csum 0x18a7], length 1428
17:11:28.353439 IP 112.26.0.8.50156 > 112.26.0.1.targus-getdata1: Flags [.], seq 302736:304164, ack 1, win 4107, options [nop,nop,TS val 4294819462 ecr 80139,mptcp dss ack 569926353 seq 2859356883 subseq 691190 len 1428 csum 0x18a7], length 1428
17:11:28.384058 IP 112.26.0.1.targus-getdata1 > 112.26.0.8.50156: Flags [.], ack 277032, win 7639, options [nop,nop,TS val 80245 ecr 4294817083,nop,nop,sack 2 {284172:291312}{278460:282744},mptcp dss ack 2859229791], length 0
17:11:28.386899 IP 112.26.0.1.targus-getdata1 > 112.26.0.8.50156: Flags [.], ack 277032, win 7639, options [nop,nop,TS val 80245 ecr 4294817083,nop,nop,sack 2 {284172:291312}{278460:282744},mptcp dss ack 2859229791], length 0
17:11:28.389843 IP 112.26.0.8.50156 > 112.26.0.1.targus-getdata1: Flags [.], seq 299880:301308, ack 1, win 4107, options [nop,nop,TS val 4294818763 ecr 79571,mptcp dss ack 569926353 seq 2859332607 subseq 688334 len 1428 csum 0x1852], length 1428
17:11:28.484815 IP 112.26.0.8.50156 > 112.26.0.1.targus-getdata1: Flags [.], seq 304164:305592, ack 1, win 4107, options [nop,nop,TS val 4294819594 ecr 80245,mptcp dss ack 569926353 seq 2859362595 subseq 692618 len 1428 csum 0x18f4], length 1428
17:11:28.485180 IP 112.26.0.8.50156 > 112.26.0.1.targus-getdata1: Flags [.], seq 304164:305592, ack 1, win 4107, options [nop,nop,TS val 4294819594 ecr 80245,mptcp dss ack 569926353 seq 2859362595 subseq 692618 len 1428 csum 0x18f4], length 1428
17:11:28.504413 IP 112.26.0.1.targus-getdata1 > 112.26.0.8.50156: Flags [.], ack 277032, win 7639, options [nop,nop,TS val 80347 ecr 4294817083,nop,nop,sack 2 {292740:294168}{284172:291312},mptcp dss ack 2859229791], length 0
17:11:28.509319 IP 112.26.0.1.targus-getdata1 > 112.26.0.8.50156: Flags [.], ack 277032, win 7639, options [nop,nop,TS val 80347 ecr 4294817083,nop,nop,sack 2 {292740:294168}{284172:291312},mptcp dss ack 2859229791], length 0
17:11:28.540670 IP 112.26.0.8.50156 > 112.26.0.1.targus-getdata1: Flags [.], seq 301308:302736, ack 1, win 4107, options [nop,nop,TS val 4294818863 ecr 79661,mptcp dss ack 569926353 seq 2859336891 subseq 689762 len 1428 csum 0xc6dd], length 1428
17:11:28.581330 IP 112.26.0.1.targus-getdata1 > 112.26.0.8.50156: Flags [.], ack 277032, win 7639, options [nop,nop,TS val 80440 ecr 4294817083,nop,nop,sack 2 {292740:295596}{284172:291312},mptcp dss ack 2859229791], length 0
17:11:28.632655 IP 112.26.0.8.50156 > 112.26.0.1.targus-getdata1: Flags [.], seq 277032:278460, ack 1, win 4107, options [nop,nop,TS val 4294819083 ecr 79790,mptcp dss ack 569926353 seq 2859282627 subseq 665486 len 1428 csum 0x18e4], length 1428
17:11:28.645108 IP 112.26.0.1.targus-getdata1 > 112.26.0.8.50156: Flags [.], ack 277032, win 7639, options [nop,nop,TS val 80440 ecr 4294817083,nop,nop,sack 2 {292740:295596}{284172:291312},mptcp dss ack 2859229791], length 0
17:11:28.648087 IP 112.26.0.8.50156 > 112.26.0.1.targus-getdata1: Flags [.], seq 291312:292740, ack 1, win 4107, options [nop,nop,TS val 4294819758 ecr 80440,mptcp dss ack 569926353 seq 2859316899 subseq 679766 len 1428 csum 0x4fee], length 1428
17:11:28.648424 IP 112.26.0.8.50156 > 112.26.0.1.targus-getdata1: Flags [.], seq 291312:292740, ack 1, win 4107, options [nop,nop,TS val 4294819758 ecr 80440,mptcp dss ack 569926353 seq 2859316899 subseq 679766 len 1428 csum 0x4fee], length 1428
17:11:28.680298 IP 112.26.0.1.targus-getdata1 > 112.26.0.8.50156: Flags [.], ack 277032, win 7639, options [nop,nop,TS val 80572 ecr 4294817083,nop,nop,sack 2 {297024:298452}{292740:295596},mptcp dss ack 2859229791], length 0
17:11:28.702035 IP 112.26.0.8.50156 > 112.26.0.1.targus-getdata1: Flags [.], seq 282744:284172, ack 1, win 4107, options [nop,nop,TS val 4294819176 ecr 79904,mptcp dss ack 569926353 seq 2859296907 subseq 671198 len 1428 csum 0x497e], length 1428
17:11:28.718657 IP 112.26.0.1.targus-getdata1 > 112.26.0.8.50156: Flags [.], ack 277032, win 7639, options [nop,nop,TS val 80572 ecr 4294817083,nop,nop,sack 2 {297024:298452}{292740:295596},mptcp dss ack 2859229791], length 0
17:11:28.772644 IP 112.26.0.1.targus-getdata1 > 112.26.0.8.50156: Flags [.], ack 277032, win 7639, options [nop,nop,TS val 80655 ecr 4294817083,nop,nop,sack 2 {297024:299880}{292740:295596},mptcp dss ack 2859229791], length 0
17:11:28.776031 IP 112.26.0.8.50156 > 112.26.0.1.targus-getdata1: Flags [.], seq 295596:297024, ack 1, win 4107, options [nop,nop,TS val 4294819832 ecr 80572,mptcp dss ack 569926353 seq 2859325467 subseq 684050 len 1428 csum 0x970c], length 1428
17:11:28.776327 IP 112.26.0.8.50156 > 112.26.0.1.targus-getdata1: Flags [.], seq 295596:297024, ack 1, win 4107, options [nop,nop,TS val 4294819832 ecr 80572,mptcp dss ack 569926353 seq 2859325467 subseq 684050 len 1428 csum 0x970c], length 1428
17:11:28.813506 IP 112.26.0.8.50156 > 112.26.0.1.targus-getdata1: Flags [.], seq 302736:304164, ack 1, win 4107, options [nop,nop,TS val 4294819462 ecr 80139,mptcp dss ack 569926353 seq 2859356883 subseq 691190 len 1428 csum 0x18a7], length 1428
17:11:28.832523 IP 112.26.0.1.targus-getdata1 > 112.26.0.8.50156: Flags [.], ack 277032, win 7639, options [nop,nop,TS val 80655 ecr 4294817083,nop,nop,sack 2 {297024:299880}{292740:295596},mptcp dss ack 2859229791], length 0
17:11:28.900252 IP 112.26.0.1.targus-getdata1 > 112.26.0.8.50156: Flags [.], ack 277032, win 7639, options [nop,nop,TS val 80804 ecr 4294817083,nop,nop,sack 2 {297024:301308}{292740:295596},mptcp dss ack 2859229791], length 0
17:11:28.937015 IP 112.26.0.8.50156 > 112.26.0.1.targus-getdata1: Flags [.], seq 305592:307020, ack 1, win 4107, options [nop,nop,TS val 4294820047 ecr 80655,mptcp dss ack 569926353 seq 2859372591 subseq 694046 len 1428 csum 0xea1f], length 1428
17:11:28.937360 IP 112.26.0.8.50156 > 112.26.0.1.targus-getdata1: Flags [.], seq 305592:307020, ack 1, win 4107, options [nop,nop,TS val 4294820047 ecr 80655,mptcp dss ack 569926353 seq 2859372591 subseq 694046 len 1428 csum 0xea1f], length 1428
17:11:28.960673 IP 112.26.0.1.targus-getdata1 > 112.26.0.8.50156: Flags [.], ack 277032, win 7639, options [nop,nop,TS val 80954 ecr 4294817083,nop,nop,sack 2 {297024:302736}{292740:295596},mptcp dss ack 2859229791], length 0
17:11:28.972564 IP 112.26.0.1.targus-getdata1 > 112.26.0.8.50156: Flags [.], ack 277032, win 7639, options [nop,nop,TS val 80804 ecr 4294817083,nop,nop,sack 2 {297024:301308}{292740:295596},mptcp dss ack 2859229791], length 0
17:11:28.988109 IP 112.26.0.8.50156 > 112.26.0.1.targus-getdata1: Flags [.], seq 304164:305592, ack 1, win 4107, options [nop,nop,TS val 4294819594 ecr 80245,mptcp dss ack 569926353 seq 2859362595 subseq 692618 len 1428 csum 0x18f4], length 1428
17:11:29.015135 IP 112.26.0.1.targus-getdata1 > 112.26.0.8.50156: Flags [.], ack 282744, win 7639, options [nop,nop,TS val 81046 ecr 4294819083,nop,nop,sack 2 {297024:302736}{292740:295596},mptcp dss ack 2859229791], length 0
17:11:29.023848 IP 112.26.0.8.50156 > 112.26.0.1.targus-getdata1: Flags [.], seq 307020:308448, ack 1, win 4107, options [nop,nop,TS val 4294820095 ecr 80804,mptcp dss ack 569926353 seq 2859375447 subseq 695474 len 1428 csum 0xcbc9], length 1428
17:11:29.024234 IP 112.26.0.8.50156 > 112.26.0.1.targus-getdata1: Flags [.], seq 307020:308448, ack 1, win 4107, options [nop,nop,TS val 4294820095 ecr 80804,mptcp dss ack 569926353 seq 2859375447 subseq 695474 len 1428 csum 0xcbc9], length 1428
17:11:29.087811 IP 112.26.0.8.50156 > 112.26.0.1.targus-getdata1: Flags [.], seq 291312:292740, ack 1, win 4107, options [nop,nop,TS val 4294819758 ecr 80440,mptcp dss ack 569926353 seq 2859316899 subseq 679766 len 1428 csum 0x4fee], length 1428
17:11:29.114647 IP 112.26.0.1.targus-getdata1 > 112.26.0.8.50156: Flags [.], ack 277032, win 7639, options [nop,nop,TS val 80954 ecr 4294817083,nop,nop,sack 2 {297024:302736}{292740:295596},mptcp dss ack 2859229791], length 0
17:11:29.144953 IP 112.26.0.8.50156 > 112.26.0.1.targus-getdata1: Flags [.], seq 295596:297024, ack 1, win 4107, options [nop,nop,TS val 4294819832 ecr 80572,mptcp dss ack 569926353 seq 2859325467 subseq 684050 len 1428 csum 0x970c], length 1428
17:11:29.152280 IP 112.26.0.1.targus-getdata1 > 112.26.0.8.50156: Flags [.], ack 291312, win 7639, options [nop,nop,TS val 81116 ecr 4294819176,nop,nop,sack 2 {297024:302736}{292740:295596},mptcp dss ack 2859229791], length 0
17:11:29.162552 IP 112.26.0.8.50156 > 112.26.0.1.targus-getdata1: Flags [.], seq 308448:309876, ack 1, win 4107, options [nop,nop,TS val 4294820268 ecr 80954,mptcp dss ack 569926353 seq 2859381159 subseq 696902 len 1428 csum 0x2e0c], length 1428
17:11:29.162933 IP 112.26.0.8.50156 > 112.26.0.1.targus-getdata1: Flags [.], seq 308448:309876, ack 1, win 4107, options [nop,nop,TS val 4294820268 ecr 80954,mptcp dss ack 569926353 seq 2859381159 subseq 696902 len 1428 csum 0x2e0c], length 1428
17:11:29.229371 IP 112.26.0.1.targus-getdata1 > 112.26.0.8.50156: Flags [.], ack 291312, win 7639, options [nop,nop,TS val 81225 ecr 4294819176,nop,nop,sack 2 {297024:304164}{292740:295596},mptcp dss ack 2859229791], length 0
17:11:29.242901 IP 112.26.0.8.50156 > 112.26.0.1.targus-getdata1: Flags [.], seq 305592:307020, ack 1, win 4107, options [nop,nop,TS val 4294820047 ecr 80655,mptcp dss ack 569926353 seq 2859372591 subseq 694046 len 1428 csum 0xea1f], length 1428
17:11:29.253746 IP 112.26.0.1.targus-getdata1 > 112.26.0.8.50156: Flags [.], ack 282744, win 7639, options [nop,nop,TS val 81046 ecr 4294819083,nop,nop,sack 2 {297024:302736}{292740:295596},mptcp dss ack 2859229791], length 0
17:11:29.262462 IP 112.26.0.8.50156 > 112.26.0.1.targus-getdata1: Flags [.], seq 309876:311304, ack 1, win 4107, options [nop,nop,TS val 4294820366 ecr 81046,mptcp dss ack 569926353 seq 2859388299 subseq 698330 len 1428 csum 0x8dd], length 1428
17:11:29.262808 IP 112.26.0.8.50156 > 112.26.0.1.targus-getdata1: Flags [.], seq 309876:311304, ack 1, win 4107, options [nop,nop,TS val 4294820366 ecr 81046,mptcp dss ack 569926353 seq 2859388299 subseq 698330 len 1428 csum 0x8dd], length 1428
17:11:29.323999 IP 112.26.0.1.targus-getdata1 > 112.26.0.8.50156: Flags [.], ack 291312, win 7639, options [nop,nop,TS val 81402 ecr 4294819176,nop,nop,sack 2 {297024:305592}{292740:295596},mptcp dss ack 2859229791], length 0
17:11:29.334478 IP 112.26.0.8.50156 > 112.26.0.1.targus-getdata1: Flags [.], seq 311304:312732, ack 1, win 4107, options [nop,nop,TS val 4294820366 ecr 81046,mptcp dss ack 569926353 seq 2859389727 subseq 699758 len 1428 csum 0xeecc], length 1428
17:11:29.334796 IP 112.26.0.8.50156 > 112.26.0.1.targus-getdata1: Flags [.], seq 311304:312732, ack 1, win 4107, options [nop,nop,TS val 4294820366 ecr 81046,mptcp dss ack 569926353 seq 2859389727 subseq 699758 len 1428 csum 0xeecc], length 1428
17:11:29.383972 IP 112.26.0.8.50156 > 112.26.0.1.targus-getdata1: Flags [.], seq 307020:308448, ack 1, win 4107, options [nop,nop,TS val 4294820095 ecr 80804,mptcp dss ack 569926353 seq 2859375447 subseq 695474 len 1428 csum 0xcbc9], length 1428
17:11:29.405362 IP 112.26.0.1.targus-getdata1 > 112.26.0.8.50156: Flags [.], ack 291312, win 7639, options [nop,nop,TS val 81116 ecr 4294819176,nop,nop,sack 2 {297024:302736}{292740:295596},mptcp dss ack 2859229791], length 0
17:11:29.438444 IP 112.26.0.1.targus-getdata1 > 112.26.0.8.50156: Flags [.], ack 295596, win 7639, options [nop,nop,TS val 81502 ecr 4294819758,nop,nop,sack 1 {297024:305592},mptcp dss ack 2859229791], length 0
17:11:29.446671 IP 112.26.0.8.50156 > 112.26.0.1.targus-getdata1: Flags [.], seq 312732:314160, ack 1, win 4107, options [nop,nop,TS val 4294820518 ecr 81116,mptcp dss ack 569926353 seq 2859399723 subseq 701186 len 1428 csum 0x48a4], length 1428
17:11:29.447015 IP 112.26.0.8.50156 > 112.26.0.1.targus-getdata1: Flags [.], seq 312732:314160, ack 1, win 4107, options [nop,nop,TS val 4294820518 ecr 81116,mptcp dss ack 569926353 seq 2859399723 subseq 701186 len 1428 csum 0x48a4], length 1428
17:11:29.472804 IP 112.26.0.8.50156 > 112.26.0.1.targus-getdata1: Flags [.], seq 308448:309876, ack 1, win 4107, options [nop,nop,TS val 4294820268 ecr 80954,mptcp dss ack 569926353 seq 2859381159 subseq 696902 len 1428 csum 0x2e0c], length 1428
17:11:29.496713 IP 112.26.0.1.targus-getdata1 > 112.26.0.8.50156: Flags [.], ack 291312, win 7639, options [nop,nop,TS val 81225 ecr 4294819176,nop,nop,sack 2 {297024:304164}{292740:295596},mptcp dss ack 2859229791], length 0
17:11:29.548563 IP 112.26.0.8.50156 > 112.26.0.1.targus-getdata1: Flags [.], seq 309876:311304, ack 1, win 4107, options [nop,nop,TS val 4294820366 ecr 81046,mptcp dss ack 569926353 seq 2859388299 subseq 698330 len 1428 csum 0x8dd], length 1428
17:11:29.557514 IP 112.26.0.1.targus-getdata1 > 112.26.0.8.50156: Flags [.], ack 305592, win 7639, options [nop,nop,TS val 81559 ecr 4294819832,mptcp dss ack 2859344031], length 0
17:11:29.577783 IP 112.26.0.1.targus-getdata1 > 112.26.0.8.50156: Flags [.], ack 291312, win 7639, options [nop,nop,TS val 81402 ecr 4294819176,nop,nop,sack 2 {297024:305592}{292740:295596},mptcp dss ack 2859229791], length 0
17:11:29.604484 IP 112.26.0.1.targus-getdata1 > 112.26.0.8.50156: Flags [.], ack 307020, win 7639, options [nop,nop,TS val 81657 ecr 4294820047,mptcp dss ack 2859344031], length 0
17:11:29.617974 IP 112.26.0.8.50156 > 112.26.0.1.targus-getdata1: Flags [.], seq 314160:315588, ack 1, win 4107, options [nop,nop,TS val 4294820691 ecr 81225,mptcp dss ack 569926353 seq 2859404007 subseq 702614 len 1428 csum 0x1c64], length 1428
17:11:29.618233 IP 112.26.0.8.50156 > 112.26.0.1.targus-getdata1: Flags [.], seq 314160:315588, ack 1, win 4107, options [nop,nop,TS val 4294820691 ecr 81225,mptcp dss ack 569926353 seq 2859404007 subseq 702614 len 1428 csum 0x1c64], length 1428
17:11:29.634282 IP 112.26.0.8.50156 > 112.26.0.1.targus-getdata1: Flags [.], seq 311304:312732, ack 1, win 4107, options [nop,nop,TS val 4294820366 ecr 81046,mptcp dss ack 569926353 seq 2859389727 subseq 699758 len 1428 csum 0xeecc], length 1428
17:11:29.641908 IP 112.26.0.1.targus-getdata1 > 112.26.0.8.50156: Flags [.], ack 295596, win 7639, options [nop,nop,TS val 81502 ecr 4294819758,nop,nop,sack 1 {297024:305592},mptcp dss ack 2859229791], length 0
17:11:29.675948 IP 112.26.0.8.50156 > 112.26.0.1.targus-getdata1: Flags [.], seq 315588:317016, ack 1, win 4107, options [nop,nop,TS val 4294820697 ecr 81402,mptcp dss ack 569926353 seq 2859405435 subseq 704042 len 1428 csum 0xad68], length 1428
17:11:29.676286 IP 112.26.0.8.50156 > 112.26.0.1.targus-getdata1: Flags [.], seq 315588:317016, ack 1, win 4107, options [nop,nop,TS val 4294820697 ecr 81402,mptcp dss ack 569926353 seq 2859405435 subseq 704042 len 1428 csum 0xad68], length 1428
17:11:29.707643 IP 112.26.0.1.targus-getdata1 > 112.26.0.8.50156: Flags [.], ack 308448, win 7639, options [nop,nop,TS val 81798 ecr 4294820095,mptcp dss ack 2859344031], length 0
17:11:29.722656 IP 112.26.0.1.targus-getdata1 > 112.26.0.8.50156: Flags [.], ack 305592, win 7639, options [nop,nop,TS val 81559 ecr 4294819832,mptcp dss ack 2859344031], length 0
17:11:29.760322 IP 112.26.0.1.targus-getdata1 > 112.26.0.8.50156: Flags [.], ack 309876, win 7639, options [nop,nop,TS val 81887 ecr 4294820268,mptcp dss ack 2859344031], length 0
17:11:29.784162 IP 112.26.0.8.50156 > 112.26.0.1.targus-getdata1: Flags [.], seq 312732:314160, ack 1, win 4107, options [nop,nop,TS val 4294820518 ecr 81116,mptcp dss ack 569926353 seq 2859399723 subseq 701186 len 1428 csum 0x48a4], length 1428
17:11:29.794252 IP 112.26.0.8.50156 > 112.26.0.1.targus-getdata1: Flags [.], seq 317016:318444, ack 1, win 4107, options [nop,nop,TS val 4294820755 ecr 81502,mptcp dss ack 569926353 seq 2859408291 subseq 705470 len 1428 csum 0xc58], length 1428
17:11:29.794589 IP 112.26.0.8.50156 > 112.26.0.1.targus-getdata1: Flags [.], seq 317016:318444, ack 1, win 4107, options [nop,nop,TS val 4294820755 ecr 81502,mptcp dss ack 569926353 seq 2859408291 subseq 705470 len 1428 csum 0xc58], length 1428
17:11:29.834710 IP 112.26.0.8.50156 > 112.26.0.1.targus-getdata1: Flags [.], seq 318444:319872, ack 1, win 4107, options [nop,nop,TS val 4294820836 ecr 81559,mptcp dss ack 569926353 seq 2859411147 subseq 706898 len 1428 csum 0x1f4a], length 1428
17:11:29.835030 IP 112.26.0.8.50156 > 112.26.0.1.targus-getdata1: Flags [.], seq 318444:319872, ack 1, win 4107, options [nop,nop,TS val 4294820836 ecr 81559,mptcp dss ack 569926353 seq 2859411147 subseq 706898 len 1428 csum 0x1f4a], length 1428
