17:10:29.146807 IP 112.26.1.8.36421 > 112.26.1.1.targus-getdata1: Flags [S], seq 2338953355, win 65535, options [mss 1460,sackOK,TS val 4294760232 ecr 0,nop,wscale 6,mptcp join id 3 token 0x8f8bf6e7 nonce 0x509e72d8], length 0
17:10:29.221652 IP 112.26.1.8.36421 > 112.26.1.1.targus-getdata1: Flags [S], seq 2338953355, win 65535, options [mss 1460,sackOK,TS val 4294760232 ecr 0,nop,wscale 6,mptcp join id 3 token 0x8f8bf6e7 nonce 0x509e72d8], length 0
17:10:29.266715 IP 112.26.1.8.36421 > 112.26.1.1.targus-getdata1: Flags [S], seq 2338953355, win 65535, options [mss 1460,sackOK,TS val 4294760232 ecr 0,nop,wscale 6,mptcp join id 3 token 0x8f8bf6e7 nonce 0x509e72d8], length 0
17:10:29.381560 IP 112.26.1.1.targus-getdata1 > 112.26.1.8.36421: Flags [S.], seq 546551861, ack 2338953356, win 28560, options [mss 1460,sackOK,TS val 21681 ecr 4294760232,nop,wscale 7,mptcp join id 3 hmac 0xdea6d7f0c13682f2 nonce 0xe2506a83], length 0
17:10:29.440158 IP 112.26.1.1.targus-getdata1 > 112.26.1.8.36421: Flags [S.], seq 546551861, ack 2338953356, win 28560, options [mss 1460,sackOK,TS val 21681 ecr 4294760232,nop,wscale 7,mptcp join id 3 hmac 0xdea6d7f0c13682f2 nonce 0xe2506a83], length 0
17:10:29.485440 IP 112.26.1.8.36421 > 112.26.1.1.targus-getdata1: Flags [.], ack 1, win 4107, options [nop,nop,TS val 4294760555 ecr 21681,mptcp join hmac 0x3a111e66838a028df5a58c10ae7fe863a47adac9], length 0
17:10:29.569982 IP 112.26.1.8.36421 > 112.26.1.1.targus-getdata1: Flags [.], ack 1, win 4107, options [nop,nop,TS val 4294760555 ecr 21681,mptcp join hmac 0x3a111e66838a028df5a58c10ae7fe863a47adac9], length 0
17:11:08.770335 IP 112.26.1.8.57531 > 112.26.1.1.targus-getdata1: Flags [.], seq 3554814599:3554816027, ack 1794727479, win 4107, options [nop,nop,TS val 4294799656 ecr 60239,mptcp dss ack 569926353 seq 2858504367 subseq 411265 len 1428 csum 0x9d50], length 1428
17:11:08.770669 IP 112.26.1.8.57531 > 112.26.1.1.targus-getdata1: Flags [.], seq 0:1428, ack 1, win 4107, options [nop,nop,TS val 4294799656 ecr 60239,mptcp dss ack 569926353 seq 2858504367 subseq 411265 len 1428 csum 0x9d50], length 1428
17:11:08.777201 IP 112.26.1.8.57531 > 112.26.1.1.targus-getdata1: Flags [.], seq 4294955872:4294957300, ack 1, win 4107, options [nop,nop,TS val 4294799204 ecr 59821,mptcp dss ack 569926353 seq 2858481519 subseq 399841 len 1428 csum 0x676e], length 1428
17:11:08.792091 IP 112.26.1.1.targus-getdata1 > 112.26.1.8.57531: Flags [.], ack 4294957300, win 7639, options [nop,nop,TS val 61200 ecr 4294799204,mptcp dss ack 2858361567], length 0
17:11:08.792409 IP 112.26.1.1.targus-getdata1 > 112.26.1.8.57531: Flags [.], ack 4294957300, win 7639, options [nop,nop,TS val 61200 ecr 4294799204,mptcp dss ack 2858361567], length 0
17:11:08.844173 IP 112.26.1.8.57531 > 112.26.1.1.targus-getdata1: Flags [.], seq 4294957300:4294958728, ack 1, win 4107, options [nop,nop,TS val 4294799204 ecr 59821,mptcp dss ack 569926353 seq 2858482947 subseq 401269 len 1428 csum 0x2c70], length 1428
17:11:08.864039 IP 112.26.1.8.57531 > 112.26.1.1.targus-getdata1: Flags [.], seq 1428:2856, ack 1, win 4107, options [nop,nop,TS val 4294799656 ecr 60239,mptcp dss ack 569926353 seq 2858505795 subseq 412693 len 1428 csum 0x30f9], length 1428
17:11:08.864348 IP 112.26.1.8.57531 > 112.26.1.1.targus-getdata1: Flags [.], seq 1428:2856, ack 1, win 4107, options [nop,nop,TS val 4294799656 ecr 60239,mptcp dss ack 569926353 seq 2858505795 subseq 412693 len 1428 csum 0x30f9], length 1428
17:11:08.923020 IP 112.26.1.8.57531 > 112.26.1.1.targus-getdata1: Flags [.], seq 2856:4284, ack 1, win 4107, options [nop,nop,TS val 4294799656 ecr 60239,mptcp dss ack 569926353 seq 2858507223 subseq 414121 len 1428 csum 0x4b42], length 1428
17:11:08.923353 IP 112.26.1.8.57531 > 112.26.1.1.targus-getdata1: Flags [.], seq 2856:4284, ack 1, win 4107, options [nop,nop,TS val 4294799656 ecr 60239,mptcp dss ack 569926353 seq 2858507223 subseq 414121 len 1428 csum 0x4b42], length 1428
17:11:08.990898 IP 112.26.1.1.targus-getdata1 > 112.26.1.8.57531: Flags [.], ack 4294958728, win 7639, options [nop,nop,TS val 61400 ecr 4294799204,mptcp dss ack 2858361567], length 0
17:11:08.991189 IP 112.26.1.1.targus-getdata1 > 112.26.1.8.57531: Flags [.], ack 4294958728, win 7639, options [nop,nop,TS val 61400 ecr 4294799204,mptcp dss ack 2858361567], length 0
17:11:09.001127 IP 112.26.1.8.57531 > 112.26.1.1.targus-getdata1: Flags [.], seq 4284:5712, ack 1, win 4107, options [nop,nop,TS val 4294799710 ecr 60480,mptcp dss ack 569926353 seq 2858508651 subseq 415549 len 1428 csum 0x9428], length 1428
17:11:09.001437 IP 112.26.1.8.57531 > 112.26.1.1.targus-getdata1: Flags [.], seq 4284:5712, ack 1, win 4107, options [nop,nop,TS val 4294799710 ecr 60480,mptcp dss ack 569926353 seq 2858508651 subseq 415549 len 1428 csum 0x9428], length 1428
17:11:09.042894 IP 112.26.1.8.57531 > 112.26.1.1.targus-getdata1: Flags [.], seq 4294958728:4294960156, ack 1, win 4107, options [nop,nop,TS val 4294799204 ecr 59821,mptcp dss ack 569926353 seq 2858484375 subseq 402697 len 1428 csum 0xb853], length 1428
17:11:09.055728 IP 112.26.1.8.57531 > 112.26.1.1.targus-getdata1: Flags [.], seq 5712:7140, ack 1, win 4107, options [nop,nop,TS val 4294799710 ecr 60480,mptcp dss ack 569926353 seq 2858510079 subseq 416977 len 1428 csum 0x47ab], length 1428
17:11:09.055997 IP 112.26.1.8.57531 > 112.26.1.1.targus-getdata1: Flags [.], seq 5712:7140, ack 1, win 4107, options [nop,nop,TS val 4294799710 ecr 60480,mptcp dss ack 569926353 seq 2858510079 subseq 416977 len 1428 csum 0x47ab], length 1428
17:11:09.113433 IP 112.26.1.8.57531 > 112.26.1.1.targus-getdata1: Flags [.], seq 7140:8568, ack 1, win 4107, options [nop,nop,TS val 4294799710 ecr 60480,mptcp dss ack 569926353 seq 2858511507 subseq 418405 len 1428 csum 0x149f], length 1428
17:11:09.113752 IP 112.26.1.8.57531 > 112.26.1.1.targus-getdata1: Flags [.], seq 7140:8568, ack 1, win 4107, options [nop,nop,TS val 4294799710 ecr 60480,mptcp dss ack 569926353 seq 2858511507 subseq 418405 len 1428 csum 0x149f], length 1428
17:11:09.148498 IP 112.26.1.8.57531 > 112.26.1.1.targus-getdata1: Flags [.], seq 4294960156:4294961584, ack 1, win 4107, options [nop,nop,TS val 4294799204 ecr 59821,mptcp dss ack 569926353 seq 2858485803 subseq 404125 len 1428 csum 0x4958], length 1428
17:11:09.165890 IP 112.26.1.1.targus-getdata1 > 112.26.1.8.57531: Flags [.], ack 4294961584, win 7639, options [nop,nop,TS val 61557 ecr 4294799204,mptcp dss ack 2858361567], length 0
17:11:09.166188 IP 112.26.1.1.targus-getdata1 > 112.26.1.8.57531: Flags [.], ack 4294961584, win 7639, options [nop,nop,TS val 61557 ecr 4294799204,mptcp dss ack 2858361567], length 0
17:11:09.216375 IP 112.26.1.8.57531 > 112.26.1.1.targus-getdata1: Flags [.], seq 8568:9996, ack 1, win 4107, options [nop,nop,TS val 4294800080 ecr 60688,mptcp dss ack 569926353 seq 2858517219 subseq 419833 len 1428 csum 0xab97], length 1428
17:11:09.216718 IP 112.26.1.8.57531 > 112.26.1.1.targus-getdata1: Flags [.], seq 8568:9996, ack 1, win 4107, options [nop,nop,TS val 4294800080 ecr 60688,mptcp dss ack 569926353 seq 2858517219 subseq 419833 len 1428 csum 0xab97], length 1428
17:11:09.242477 IP 112.26.1.8.57531 > 112.26.1.1.targus-getdata1: Flags [.], seq 4294961584:4294963012, ack 1, win 4107, options [nop,nop,TS val 4294799204 ecr 59821,mptcp dss ack 569926353 seq 2858487231 subseq 405553 len 1428 csum 0xca3], length 1428
17:11:09.269512 IP 112.26.1.8.57531 > 112.26.1.1.targus-getdata1: Flags [.], seq 9996:11424, ack 1, win 4107, options [nop,nop,TS val 4294800080 ecr 60688,mptcp dss ack 569926353 seq 2858518647 subseq 421261 len 1428 csum 0xc293], length 1428
17:11:09.269887 IP 112.26.1.8.57531 > 112.26.1.1.targus-getdata1: Flags [.], seq 9996:11424, ack 1, win 4107, options [nop,nop,TS val 4294800080 ecr 60688,mptcp dss ack 569926353 seq 2858518647 subseq 421261 len 1428 csum 0xc293], length 1428
17:11:09.325877 IP 112.26.1.8.57531 > 112.26.1.1.targus-getdata1: Flags [.], seq 4294963012:4294964440, ack 1, win 4107, options [nop,nop,TS val 4294799656 ecr 60239,mptcp dss ack 569926353 seq 2858500083 subseq 406981 len 1428 csum 0x1be2], length 1428
17:11:09.371905 IP 112.26.1.8.57531 > 112.26.1.1.targus-getdata1: Flags [.], seq 11424:12852, ack 1, win 4107, options [nop,nop,TS val 4294800080 ecr 60688,mptcp dss ack 569926353 seq 2858520075 subseq 422689 len 1428 csum 0xff49], length 1428
17:11:09.372138 IP 112.26.1.8.57531 > 112.26.1.1.targus-getdata1: Flags [.], seq 11424:12852, ack 1, win 4107, options [nop,nop,TS val 4294800080 ecr 60688,mptcp dss ack 569926353 seq 2858520075 subseq 422689 len 1428 csum 0xff49], length 1428
17:11:09.387691 IP 112.26.1.1.targus-getdata1 > 112.26.1.8.57531: Flags [.], ack 4294964440, win 7639, options [nop,nop,TS val 61800 ecr 4294799204,mptcp dss ack 2858361567], length 0
17:11:09.387909 IP 112.26.1.1.targus-getdata1 > 112.26.1.8.57531: Flags [.], ack 4294964440, win 7639, options [nop,nop,TS val 61800 ecr 4294799204,mptcp dss ack 2858361567], length 0
17:11:09.471873 IP 112.26.1.8.57531 > 112.26.1.1.targus-getdata1: Flags [.], seq 4294965868:0, ack 1, win 4107, options [nop,nop,TS val 4294799656 ecr 60239,mptcp dss ack 569926353 seq 2858502939 subseq 409837 len 1428 csum 0x986f], length 1428
17:11:09.486428 IP 112.26.1.1.targus-getdata1 > 112.26.1.8.57531: Flags [.], ack 4294964440, win 7639, options [nop,nop,TS val 61885 ecr 4294799204,nop,nop,sack 1 {4294965868:0},mptcp dss ack 2858361567], length 0
17:11:09.486727 IP 112.26.1.1.targus-getdata1 > 112.26.1.8.57531: Flags [.], ack 4294964440, win 7639, options [nop,nop,TS val 61885 ecr 4294799204,nop,nop,sack 1 {4294965868:0},mptcp dss ack 2858361567], length 0
17:11:09.569227 IP 112.26.1.8.57531 > 112.26.1.1.targus-getdata1: Flags [.], seq 0:1428, ack 1, win 4107, options [nop,nop,TS val 4294799656 ecr 60239,mptcp dss ack 569926353 seq 2858504367 subseq 411265 len 1428 csum 0x9d50], length 1428
17:11:09.572243 IP 112.26.1.1.targus-getdata1 > 112.26.1.8.57531: Flags [.], ack 4294964440, win 7506, options [nop,nop,TS val 61983 ecr 4294799204,nop,nop,sack 1 {4294965868:1428},mptcp dss ack 2858378703], length 0
17:11:09.572466 IP 112.26.1.1.targus-getdata1 > 112.26.1.8.57531: Flags [.], ack 4294964440, win 7506, options [nop,nop,TS val 61983 ecr 4294799204,nop,nop,sack 1 {4294965868:1428},mptcp dss ack 2858378703], length 0
17:11:09.645809 IP 112.26.1.8.57531 > 112.26.1.1.targus-getdata1: Flags [.], seq 1428:2856, ack 1, win 4107, options [nop,nop,TS val 4294799656 ecr 60239,mptcp dss ack 569926353 seq 2858505795 subseq 412693 len 1428 csum 0x30f9], length 1428
17:11:09.668961 IP 112.26.1.1.targus-getdata1 > 112.26.1.8.57531: Flags [.], ack 4294964440, win 7506, options [nop,nop,TS val 62059 ecr 4294799204,nop,nop,sack 1 {4294965868:2856},mptcp dss ack 2858378703], length 0
17:11:09.669272 IP 112.26.1.1.targus-getdata1 > 112.26.1.8.57531: Flags [.], ack 4294964440, win 7506, options [nop,nop,TS val 62059 ecr 4294799204,nop,nop,sack 1 {4294965868:2856},mptcp dss ack 2858378703], length 0
17:11:09.742000 IP 112.26.1.8.57531 > 112.26.1.1.targus-getdata1: Flags [.], seq 2856:4284, ack 1, win 4107, options [nop,nop,TS val 4294799656 ecr 60239,mptcp dss ack 569926353 seq 2858507223 subseq 414121 len 1428 csum 0x4b42], length 1428
17:11:09.746470 IP 112.26.1.8.57531 > 112.26.1.1.targus-getdata1: Flags [.], seq 11424:12852, ack 1, win 4107, options [nop,nop,TS val 4294800832 ecr 60688,mptcp dss ack 569926353 seq 2858520075 subseq 422689 len 1428 csum 0xff49], length 1428
17:11:09.746818 IP 112.26.1.8.57531 > 112.26.1.1.targus-getdata1: Flags [.], seq 11424:12852, ack 1, win 4107, options [nop,nop,TS val 4294800832 ecr 60688,mptcp dss ack 569926353 seq 2858520075 subseq 422689 len 1428 csum 0xff49], length 1428
17:11:09.768844 IP 112.26.1.1.targus-getdata1 > 112.26.1.8.57531: Flags [.], ack 4294964440, win 7506, options [nop,nop,TS val 62134 ecr 4294799204,nop,nop,sack 1 {4294965868:4284},mptcp dss ack 2858378703], length 0
17:11:09.769169 IP 112.26.1.1.targus-getdata1 > 112.26.1.8.57531: Flags [.], ack 4294964440, win 7506, options [nop,nop,TS val 62134 ecr 4294799204,nop,nop,sack 1 {4294965868:4284},mptcp dss ack 2858378703], length 0
17:11:09.825423 IP 112.26.1.8.57531 > 112.26.1.1.targus-getdata1: Flags [.], seq 5712:7140, ack 1, win 4107, options [nop,nop,TS val 4294799710 ecr 60480,mptcp dss ack 569926353 seq 2858510079 subseq 416977 len 1428 csum 0x47ab], length 1428
17:11:09.846717 IP 112.26.1.1.targus-getdata1 > 112.26.1.8.57531: Flags [.], ack 4294964440, win 7606, options [nop,nop,TS val 62235 ecr 4294799204,nop,nop,sack 2 {5712:7140}{4294965868:4284},mptcp dss ack 2858445819], length 0
17:11:09.846997 IP 112.26.1.1.targus-getdata1 > 112.26.1.8.57531: Flags [.], ack 4294964440, win 7606, options [nop,nop,TS val 62235 ecr 4294799204,nop,nop,sack 2 {5712:7140}{4294965868:4284},mptcp dss ack 2858445819], length 0
17:11:09.895490 IP 112.26.1.8.57531 > 112.26.1.1.targus-getdata1: Flags [.], seq 12852:14280, ack 1, win 4107, options [nop,nop,TS val 4294801004 ecr 61557,mptcp dss ack 569926353 seq 2858550063 subseq 424117 len 1428 csum 0xf592], length 1428
17:11:09.895784 IP 112.26.1.8.57531 > 112.26.1.1.targus-getdata1: Flags [.], seq 12852:14280, ack 1, win 4107, options [nop,nop,TS val 4294801004 ecr 61557,mptcp dss ack 569926353 seq 2858550063 subseq 424117 len 1428 csum 0xf592], length 1428
17:11:09.954958 IP 112.26.1.8.57531 > 112.26.1.1.targus-getdata1: Flags [.], seq 14280:15708, ack 1, win 4107, options [nop,nop,TS val 4294801004 ecr 61557,mptcp dss ack 569926353 seq 2858551491 subseq 425545 len 1428 csum 0x7745], length 1428
17:11:09.955247 IP 112.26.1.8.57531 > 112.26.1.1.targus-getdata1: Flags [.], seq 14280:15708, ack 1, win 4107, options [nop,nop,TS val 4294801004 ecr 61557,mptcp dss ack 569926353 seq 2858551491 subseq 425545 len 1428 csum 0x7745], length 1428
17:11:09.984720 IP 112.26.1.8.57531 > 112.26.1.1.targus-getdata1: Flags [.], seq 9996:11424, ack 1, win 4107, options [nop,nop,TS val 4294800080 ecr 60688,mptcp dss ack 569926353 seq 2858518647 subseq 421261 len 1428 csum 0xc293], length 1428
17:11:09.989989 IP 112.26.1.1.targus-getdata1 > 112.26.1.8.57531: Flags [.], ack 4294964440, win 7606, options [nop,nop,TS val 62399 ecr 4294799204,nop,nop,sack 2 {9996:11424}{5712:7140},mptcp dss ack 2858445819], length 0
17:11:09.990295 IP 112.26.1.1.targus-getdata1 > 112.26.1.8.57531: Flags [.], ack 4294964440, win 7606, options [nop,nop,TS val 62399 ecr 4294799204,nop,nop,sack 2 {9996:11424}{5712:7140},mptcp dss ack 2858445819], length 0
17:11:10.052112 IP 112.26.1.8.57531 > 112.26.1.1.targus-getdata1: Flags [.], seq 15708:17136, ack 1, win 4107, options [nop,nop,TS val 4294801004 ecr 61557,mptcp dss ack 569926353 seq 2858552919 subseq 426973 len 1428 csum 0x5949], length 1428
17:11:10.052391 IP 112.26.1.8.57531 > 112.26.1.1.targus-getdata1: Flags [.], seq 15708:17136, ack 1, win 4107, options [nop,nop,TS val 4294801004 ecr 61557,mptcp dss ack 569926353 seq 2858552919 subseq 426973 len 1428 csum 0x5949], length 1428
17:11:10.082389 IP 112.26.1.8.57531 > 112.26.1.1.targus-getdata1: Flags [.], seq 11424:12852, ack 1, win 4107, options [nop,nop,TS val 4294800080 ecr 60688,mptcp dss ack 569926353 seq 2858520075 subseq 422689 len 1428 csum 0xff49], length 1428
17:11:10.103991 IP 112.26.1.1.targus-getdata1 > 112.26.1.8.57531: Flags [.], ack 4294964440, win 7606, options [nop,nop,TS val 62496 ecr 4294799204,nop,nop,sack 2 {9996:12852}{5712:7140},mptcp dss ack 2858445819], length 0
17:11:10.104238 IP 112.26.1.1.targus-getdata1 > 112.26.1.8.57531: Flags [.], ack 4294964440, win 7606, options [nop,nop,TS val 62496 ecr 4294799204,nop,nop,sack 2 {9996:12852}{5712:7140},mptcp dss ack 2858445819], length 0
17:11:10.130607 IP 112.26.1.8.57531 > 112.26.1.1.targus-getdata1: Flags [.], seq 17136:18564, ack 1, win 4107, options [nop,nop,TS val 4294801004 ecr 61557,mptcp dss ack 569926353 seq 2858554347 subseq 428401 len 1428 csum 0xa094], length 1428
17:11:10.130873 IP 112.26.1.8.57531 > 112.26.1.1.targus-getdata1: Flags [.], seq 17136:18564, ack 1, win 4107, options [nop,nop,TS val 4294801004 ecr 61557,mptcp dss ack 569926353 seq 2858554347 subseq 428401 len 1428 csum 0xa094], length 1428
17:11:10.197848 IP 112.26.1.8.57531 > 112.26.1.1.targus-getdata1: Flags [.], seq 18564:19992, ack 1, win 4107, options [nop,nop,TS val 4294801004 ecr 61557,mptcp dss ack 569926353 seq 2858555775 subseq 429829 len 1428 csum 0x964e], length 1428
17:11:10.198178 IP 112.26.1.8.57531 > 112.26.1.1.targus-getdata1: Flags [.], seq 18564:19992, ack 1, win 4107, options [nop,nop,TS val 4294801004 ecr 61557,mptcp dss ack 569926353 seq 2858555775 subseq 429829 len 1428 csum 0x964e], length 1428
17:11:10.250202 IP 112.26.1.8.57531 > 112.26.1.1.targus-getdata1: Flags [.], seq 19992:21420, ack 1, win 4107, options [nop,nop,TS val 4294801004 ecr 61557,mptcp dss ack 569926353 seq 2858557203 subseq 431257 len 1428 csum 0x88a3], length 1428
17:11:10.250541 IP 112.26.1.8.57531 > 112.26.1.1.targus-getdata1: Flags [.], seq 19992:21420, ack 1, win 4107, options [nop,nop,TS val 4294801004 ecr 61557,mptcp dss ack 569926353 seq 2858557203 subseq 431257 len 1428 csum 0x88a3], length 1428
17:11:10.316624 IP 112.26.1.8.57531 > 112.26.1.1.targus-getdata1: Flags [.], seq 21420:22848, ack 1, win 4107, options [nop,nop,TS val 4294801004 ecr 61557,mptcp dss ack 569926353 seq 2858558631 subseq 432685 len 1428 csum 0xf750], length 1428
17:11:10.316902 IP 112.26.1.8.57531 > 112.26.1.1.targus-getdata1: Flags [.], seq 21420:22848, ack 1, win 4107, options [nop,nop,TS val 4294801004 ecr 61557,mptcp dss ack 569926353 seq 2858558631 subseq 432685 len 1428 csum 0xf750], length 1428
17:11:10.412995 IP 112.26.1.1.targus-getdata1 > 112.26.1.8.57531: Flags [.], ack 4294964440, win 7606, options [nop,nop,TS val 62806 ecr 4294799204,nop,nop,sack 2 {11424:12852}{9996:12852},mptcp dss ack 2858445819], length 0
17:11:10.413323 IP 112.26.1.1.targus-getdata1 > 112.26.1.8.57531: Flags [.], ack 4294964440, win 7606, options [nop,nop,TS val 62806 ecr 4294799204,nop,nop,sack 2 {11424:12852}{9996:12852},mptcp dss ack 2858445819], length 0
17:11:10.417102 IP 112.26.1.8.57531 > 112.26.1.1.targus-getdata1: Flags [.], seq 11424:12852, ack 1, win 4107, options [nop,nop,TS val 4294800832 ecr 60688,mptcp dss ack 569926353 seq 2858520075 subseq 422689 len 1428 csum 0xff49], length 1428
17:11:10.427429 IP 112.26.1.8.57531 > 112.26.1.1.targus-getdata1: Flags [.], seq 22848:24276, ack 1, win 4107, options [nop,nop,TS val 4294801296 ecr 61885,mptcp dss ack 569926353 seq 2858564343 subseq 434113 len 1428 csum 0x9a2e], length 1428
17:11:10.427657 IP 112.26.1.8.57531 > 112.26.1.1.targus-getdata1: Flags [.], seq 22848:24276, ack 1, win 4107, options [nop,nop,TS val 4294801296 ecr 61885,mptcp dss ack 569926353 seq 2858564343 subseq 434113 len 1428 csum 0x9a2e], length 1428
17:11:10.472332 IP 112.26.1.8.57531 > 112.26.1.1.targus-getdata1: Flags [.], seq 24276:25704, ack 1, win 4107, options [nop,nop,TS val 4294801296 ecr 61885,mptcp dss ack 569926353 seq 2858565771 subseq 435541 len 1428 csum 0x3d3b], length 1428
17:11:10.472675 IP 112.26.1.8.57531 > 112.26.1.1.targus-getdata1: Flags [.], seq 24276:25704, ack 1, win 4107, options [nop,nop,TS val 4294801296 ecr 61885,mptcp dss ack 569926353 seq 2858565771 subseq 435541 len 1428 csum 0x3d3b], length 1428
17:11:10.523404 IP 112.26.1.8.57531 > 112.26.1.1.targus-getdata1: Flags [.], seq 25704:27132, ack 1, win 4107, options [nop,nop,TS val 4294801296 ecr 61885,mptcp dss ack 569926353 seq 2858567199 subseq 436969 len 1428 csum 0xbeb6], length 1428
17:11:10.523757 IP 112.26.1.8.57531 > 112.26.1.1.targus-getdata1: Flags [.], seq 25704:27132, ack 1, win 4107, options [nop,nop,TS val 4294801296 ecr 61885,mptcp dss ack 569926353 seq 2858567199 subseq 436969 len 1428 csum 0xbeb6], length 1428
17:11:10.565597 IP 112.26.1.8.57531 > 112.26.1.1.targus-getdata1: Flags [.], seq 27132:28560, ack 1, win 4107, options [nop,nop,TS val 4294801363 ecr 61983,mptcp dss ack 569926353 seq 2858568627 subseq 438397 len 1428 csum 0x90fb], length 1428
17:11:10.565918 IP 112.26.1.8.57531 > 112.26.1.1.targus-getdata1: Flags [.], seq 27132:28560, ack 1, win 4107, options [nop,nop,TS val 4294801363 ecr 61983,mptcp dss ack 569926353 seq 2858568627 subseq 438397 len 1428 csum 0x90fb], length 1428
17:11:10.616518 IP 112.26.1.8.57531 > 112.26.1.1.targus-getdata1: Flags [.], seq 14280:15708, ack 1, win 4107, options [nop,nop,TS val 4294801004 ecr 61557,mptcp dss ack 569926353 seq 2858551491 subseq 425545 len 1428 csum 0x7745], length 1428
17:11:10.623202 IP 112.26.1.1.targus-getdata1 > 112.26.1.8.57531: Flags [.], ack 4294964440, win 7606, options [nop,nop,TS val 63027 ecr 4294799204,nop,nop,sack 2 {14280:15708}{9996:12852},mptcp dss ack 2858445819], length 0
17:11:10.623531 IP 112.26.1.1.targus-getdata1 > 112.26.1.8.57531: Flags [.], ack 4294964440, win 7606, options [nop,nop,TS val 63027 ecr 4294799204,nop,nop,sack 2 {14280:15708}{9996:12852},mptcp dss ack 2858445819], length 0
17:11:10.633693 IP 112.26.1.8.57531 > 112.26.1.1.targus-getdata1: Flags [.], seq 4294964440:4294965868, ack 1, win 4107, options [nop,nop,TS val 4294801466 ecr 62059,mptcp dss ack 569926353 seq 2858501511 subseq 408409 len 1428 csum 0xc43f], length 1428
17:11:10.634021 IP 112.26.1.8.57531 > 112.26.1.1.targus-getdata1: Flags [.], seq 4294964440:4294965868, ack 1, win 4107, options [nop,nop,TS val 4294801466 ecr 62059,mptcp dss ack 569926353 seq 2858501511 subseq 408409 len 1428 csum 0xc43f], length 1428
17:11:10.718613 IP 112.26.1.8.57531 > 112.26.1.1.targus-getdata1: Flags [.], seq 15708:17136, ack 1, win 4107, options [nop,nop,TS val 4294801004 ecr 61557,mptcp dss ack 569926353 seq 2858552919 subseq 426973 len 1428 csum 0x5949], length 1428
17:11:10.732475 IP 112.26.1.1.targus-getdata1 > 112.26.1.8.57531: Flags [.], ack 4294964440, win 7606, options [nop,nop,TS val 63132 ecr 4294799204,nop,nop,sack 2 {14280:17136}{9996:12852},mptcp dss ack 2858445819], length 0
17:11:10.732850 IP 112.26.1.1.targus-getdata1 > 112.26.1.8.57531: Flags [.], ack 4294964440, win 7606, options [nop,nop,TS val 63132 ecr 4294799204,nop,nop,sack 2 {14280:17136}{9996:12852},mptcp dss ack 2858445819], length 0
17:11:10.740740 IP 112.26.1.8.57531 > 112.26.1.1.targus-getdata1: Flags [.], seq 4284:5712, ack 1, win 4107, options [nop,nop,TS val 4294801615 ecr 62235,mptcp dss ack 569926353 seq 2858508651 subseq 415549 len 1428 csum 0x9428], length 1428
17:11:10.741012 IP 112.26.1.8.57531 > 112.26.1.1.targus-getdata1: Flags [.], seq 4284:5712, ack 1, win 4107, options [nop,nop,TS val 4294801615 ecr 62235,mptcp dss ack 569926353 seq 2858508651 subseq 415549 len 1428 csum 0x9428], length 1428
17:11:10.796183 IP 112.26.1.8.57531 > 112.26.1.1.targus-getdata1: Flags [.], seq 28560:29988, ack 1, win 4107, options [nop,nop,TS val 4294801654 ecr 62235,mptcp dss ack 569926353 seq 2858580051 subseq 439825 len 1428 csum 0x50a5], length 1428
17:11:10.796505 IP 112.26.1.8.57531 > 112.26.1.1.targus-getdata1: Flags [.], seq 28560:29988, ack 1, win 4107, options [nop,nop,TS val 4294801654 ecr 62235,mptcp dss ack 569926353 seq 2858580051 subseq 439825 len 1428 csum 0x50a5], length 1428
17:11:10.818960 IP 112.26.1.1.targus-getdata1 > 112.26.1.8.57531: Flags [.], ack 4294964440, win 7606, options [nop,nop,TS val 63227 ecr 4294799204,nop,nop,sack 2 {14280:18564}{9996:12852},mptcp dss ack 2858445819], length 0
17:11:10.819254 IP 112.26.1.1.targus-getdata1 > 112.26.1.8.57531: Flags [.], ack 4294964440, win 7606, options [nop,nop,TS val 63227 ecr 4294799204,nop,nop,sack 2 {14280:18564}{9996:12852},mptcp dss ack 2858445819], length 0
17:11:10.827716 IP 112.26.1.8.57531 > 112.26.1.1.targus-getdata1: Flags [.], seq 17136:18564, ack 1, win 4107, options [nop,nop,TS val 4294801004 ecr 61557,mptcp dss ack 569926353 seq 2858554347 subseq 428401 len 1428 csum 0xa094], length 1428
17:11:10.899365 IP 112.26.1.8.57531 > 112.26.1.1.targus-getdata1: Flags [.], seq 18564:19992, ack 1, win 4107, options [nop,nop,TS val 4294801004 ecr 61557,mptcp dss ack 569926353 seq 2858555775 subseq 429829 len 1428 csum 0x964e], length 1428
17:11:10.938920 IP 112.26.1.1.targus-getdata1 > 112.26.1.8.57531: Flags [.], ack 4294964440, win 7606, options [nop,nop,TS val 63313 ecr 4294799204,nop,nop,sack 2 {14280:19992}{9996:12852},mptcp dss ack 2858445819], length 0
17:11:10.939144 IP 112.26.1.1.targus-getdata1 > 112.26.1.8.57531: Flags [.], ack 4294964440, win 7606, options [nop,nop,TS val 63313 ecr 4294799204,nop,nop,sack 2 {14280:19992}{9996:12852},mptcp dss ack 2858445819], length 0
17:11:10.995461 IP 112.26.1.8.57531 > 112.26.1.1.targus-getdata1: Flags [.], seq 21420:22848, ack 1, win 4107, options [nop,nop,TS val 4294801004 ecr 61557,mptcp dss ack 569926353 seq 2858558631 subseq 432685 len 1428 csum 0xf750], length 1428
17:11:11.003414 IP 112.26.1.1.targus-getdata1 > 112.26.1.8.57531: Flags [.], ack 4294964440, win 7595, options [nop,nop,TS val 63409 ecr 4294799204,nop,nop,sack 2 {21420:22848}{14280:19992},mptcp dss ack 2858447247], length 0
17:11:11.003751 IP 112.26.1.1.targus-getdata1 > 112.26.1.8.57531: Flags [.], ack 4294964440, win 7595, options [nop,nop,TS val 63409 ecr 4294799204,nop,nop,sack 2 {21420:22848}{14280:19992},mptcp dss ack 2858447247], length 0
17:11:11.155374 IP 112.26.1.8.57531 > 112.26.1.1.targus-getdata1: Flags [.], seq 22848:24276, ack 1, win 4107, options [nop,nop,TS val 4294801296 ecr 61885,mptcp dss ack 569926353 seq 2858564343 subseq 434113 len 1428 csum 0x9a2e], length 1428
17:11:11.167352 IP 112.26.1.1.targus-getdata1 > 112.26.1.8.57531: Flags [.], ack 4294964440, win 7639, options [nop,nop,TS val 63568 ecr 4294799204,nop,nop,sack 2 {21420:24276}{14280:19992},mptcp dss ack 2858497227], length 0
17:11:11.167743 IP 112.26.1.1.targus-getdata1 > 112.26.1.8.57531: Flags [.], ack 4294964440, win 7639, options [nop,nop,TS val 63568 ecr 4294799204,nop,nop,sack 2 {21420:24276}{14280:19992},mptcp dss ack 2858497227], length 0
17:11:11.260998 IP 112.26.1.8.57531 > 112.26.1.1.targus-getdata1: Flags [.], seq 25704:27132, ack 1, win 4107, options [nop,nop,TS val 4294801296 ecr 61885,mptcp dss ack 569926353 seq 2858567199 subseq 436969 len 1428 csum 0xbeb6], length 1428
17:11:11.265059 IP 112.26.1.1.targus-getdata1 > 112.26.1.8.57531: Flags [.], ack 4294964440, win 7639, options [nop,nop,TS val 63675 ecr 4294799204,nop,nop,sack 2 {25704:27132}{21420:24276},mptcp dss ack 2858497227], length 0
17:11:11.265281 IP 112.26.1.1.targus-getdata1 > 112.26.1.8.57531: Flags [.], ack 4294964440, win 7639, options [nop,nop,TS val 63675 ecr 4294799204,nop,nop,sack 2 {25704:27132}{21420:24276},mptcp dss ack 2858497227], length 0
17:11:11.355176 IP 112.26.1.8.57531 > 112.26.1.1.targus-getdata1: Flags [.], seq 7140:8568, ack 1, win 4107, options [nop,nop,TS val 4294802464 ecr 63027,mptcp dss ack 569926353 seq 2858511507 subseq 418405 len 1428 csum 0x149f], length 1428
17:11:11.355361 IP 112.26.1.8.57531 > 112.26.1.1.targus-getdata1: Flags [.], seq 7140:8568, ack 1, win 4107, options [nop,nop,TS val 4294802464 ecr 63027,mptcp dss ack 569926353 seq 2858511507 subseq 418405 len 1428 csum 0x149f], length 1428
17:11:11.414961 IP 112.26.1.8.57531 > 112.26.1.1.targus-getdata1: Flags [.], seq 8568:9996, ack 1, win 4107, options [nop,nop,TS val 4294802523 ecr 63132,mptcp dss ack 569926353 seq 2858517219 subseq 419833 len 1428 csum 0xab97], length 1428
17:11:11.415265 IP 112.26.1.8.57531 > 112.26.1.1.targus-getdata1: Flags [.], seq 8568:9996, ack 1, win 4107, options [nop,nop,TS val 4294802523 ecr 63132,mptcp dss ack 569926353 seq 2858517219 subseq 419833 len 1428 csum 0xab97], length 1428
17:11:11.493237 IP 112.26.1.8.57531 > 112.26.1.1.targus-getdata1: Flags [.], seq 28560:29988, ack 1, win 4107, options [nop,nop,TS val 4294801654 ecr 62235,mptcp dss ack 569926353 seq 2858580051 subseq 439825 len 1428 csum 0x50a5], length 1428
17:11:11.506673 IP 112.26.1.1.targus-getdata1 > 112.26.1.8.57531: Flags [.], ack 4294964440, win 7639, options [nop,nop,TS val 63907 ecr 4294799204,nop,nop,sack 2 {28560:29988}{25704:27132},mptcp dss ack 2858497227], length 0
17:11:11.506925 IP 112.26.1.1.targus-getdata1 > 112.26.1.8.57531: Flags [.], ack 4294964440, win 7639, options [nop,nop,TS val 63907 ecr 4294799204,nop,nop,sack 2 {28560:29988}{25704:27132},mptcp dss ack 2858497227], length 0
17:11:11.599243 IP 112.26.1.8.57531 > 112.26.1.1.targus-getdata1: Flags [.], seq 12852:14280, ack 1, win 4107, options [nop,nop,TS val 4294802699 ecr 63313,mptcp dss ack 569926353 seq 2858550063 subseq 424117 len 1428 csum 0xf592], length 1428
17:11:11.599569 IP 112.26.1.8.57531 > 112.26.1.1.targus-getdata1: Flags [.], seq 12852:14280, ack 1, win 4107, options [nop,nop,TS val 4294802699 ecr 63313,mptcp dss ack 569926353 seq 2858550063 subseq 424117 len 1428 csum 0xf592], length 1428
17:11:11.681920 IP 112.26.1.8.57531 > 112.26.1.1.targus-getdata1: Flags [.], seq 29988:31416, ack 1, win 4107, options [nop,nop,TS val 4294802735 ecr 63313,mptcp dss ack 569926353 seq 2858618607 subseq 441253 len 1428 csum 0x53a4], length 1428
17:11:11.682156 IP 112.26.1.8.57531 > 112.26.1.1.targus-getdata1: Flags [.], seq 29988:31416, ack 1, win 4107, options [nop,nop,TS val 4294802735 ecr 63313,mptcp dss ack 569926353 seq 2858618607 subseq 441253 len 1428 csum 0x53a4], length 1428
17:11:11.728997 IP 112.26.1.8.57531 > 112.26.1.1.targus-getdata1: Flags [.], seq 19992:21420, ack 1, win 4107, options [nop,nop,TS val 4294802775 ecr 63409,mptcp dss ack 569926353 seq 2858557203 subseq 431257 len 1428 csum 0x88a3], length 1428
17:11:11.729326 IP 112.26.1.8.57531 > 112.26.1.1.targus-getdata1: Flags [.], seq 19992:21420, ack 1, win 4107, options [nop,nop,TS val 4294802775 ecr 63409,mptcp dss ack 569926353 seq 2858557203 subseq 431257 len 1428 csum 0x88a3], length 1428
17:11:11.808172 IP 112.26.1.8.57531 > 112.26.1.1.targus-getdata1: Flags [.], seq 31416:32844, ack 1, win 4107, options [nop,nop,TS val 4294802895 ecr 63568,mptcp dss ack 569926353 seq 2858627175 subseq 442681 len 1428 csum 0xfff5], length 1428
17:11:11.808494 IP 112.26.1.8.57531 > 112.26.1.1.targus-getdata1: Flags [.], seq 31416:32844, ack 1, win 4107, options [nop,nop,TS val 4294802895 ecr 63568,mptcp dss ack 569926353 seq 2858627175 subseq 442681 len 1428 csum 0xfff5], length 1428
17:11:11.867745 IP 112.26.1.8.57531 > 112.26.1.1.targus-getdata1: Flags [.], seq 7140:8568, ack 1, win 4107, options [nop,nop,TS val 4294802464 ecr 63027,mptcp dss ack 569926353 seq 2858511507 subseq 418405 len 1428 csum 0x149f], length 1428
17:11:11.891925 IP 112.26.1.1.targus-getdata1 > 112.26.1.8.57531: Flags [.], ack 4294964440, win 7639, options [nop,nop,TS val 64281 ecr 4294799204,nop,nop,sack 2 {7140:8568}{28560:29988},mptcp dss ack 2858497227], length 0
17:11:11.892217 IP 112.26.1.1.targus-getdata1 > 112.26.1.8.57531: Flags [.], ack 4294964440, win 7639, options [nop,nop,TS val 64281 ecr 4294799204,nop,nop,sack 2 {7140:8568}{28560:29988},mptcp dss ack 2858497227], length 0
17:11:11.896046 IP 112.26.1.8.57531 > 112.26.1.1.targus-getdata1: Flags [.], seq 24276:25704, ack 1, win 4107, options [nop,nop,TS val 4294802908 ecr 63675,mptcp dss ack 569926353 seq 2858565771 subseq 435541 len 1428 csum 0x3d3b], length 1428
17:11:11.896343 IP 112.26.1.8.57531 > 112.26.1.1.targus-getdata1: Flags [.], seq 24276:25704, ack 1, win 4107, options [nop,nop,TS val 4294802908 ecr 63675,mptcp dss ack 569926353 seq 2858565771 subseq 435541 len 1428 csum 0x3d3b], length 1428
17:11:11.987214 IP 112.26.1.8.57531 > 112.26.1.1.targus-getdata1: Flags [.], seq 8568:9996, ack 1, win 4107, options [nop,nop,TS val 4294802523 ecr 63132,mptcp dss ack 569926353 seq 2858517219 subseq 419833 len 1428 csum 0xab97], length 1428
17:11:11.991690 IP 112.26.1.1.targus-getdata1 > 112.26.1.8.57531: Flags [.], ack 4294964440, win 7639, options [nop,nop,TS val 64401 ecr 4294799204,nop,nop,sack 2 {7140:9996}{28560:29988},mptcp dss ack 2858497227], length 0
17:11:11.991961 IP 112.26.1.1.targus-getdata1 > 112.26.1.8.57531: Flags [.], ack 4294964440, win 7639, options [nop,nop,TS val 64401 ecr 4294799204,nop,nop,sack 2 {7140:9996}{28560:29988},mptcp dss ack 2858497227], length 0
17:11:12.054870 IP 112.26.1.8.57531 > 112.26.1.1.targus-getdata1: Flags [.], seq 4294964440:4294965868, ack 1, win 4107, options [nop,nop,TS val 4294803165 ecr 63907,mptcp dss ack 569926353 seq 2858501511 subseq 408409 len 1428 csum 0xc43f], length 1428
17:11:12.055117 IP 112.26.1.8.57531 > 112.26.1.1.targus-getdata1: Flags [.], seq 4294964440:4294965868, ack 1, win 4107, options [nop,nop,TS val 4294803165 ecr 63907,mptcp dss ack 569926353 seq 2858501511 subseq 408409 len 1428 csum 0xc43f], length 1428
17:11:12.115519 IP 112.26.1.8.57531 > 112.26.1.1.targus-getdata1: Flags [.], seq 12852:14280, ack 1, win 4107, options [nop,nop,TS val 4294802699 ecr 63313,mptcp dss ack 569926353 seq 2858550063 subseq 424117 len 1428 csum 0xf592], length 1428
17:11:12.118956 IP 112.26.1.1.targus-getdata1 > 112.26.1.8.57531: Flags [.], ack 4294964440, win 7639, options [nop,nop,TS val 64529 ecr 4294799204,nop,nop,sack 2 {12852:14280}{7140:9996},mptcp dss ack 2858497227], length 0
17:11:12.119301 IP 112.26.1.1.targus-getdata1 > 112.26.1.8.57531: Flags [.], ack 4294964440, win 7639, options [nop,nop,TS val 64529 ecr 4294799204,nop,nop,sack 2 {12852:14280}{7140:9996},mptcp dss ack 2858497227], length 0
17:11:12.200850 IP 112.26.1.8.57531 > 112.26.1.1.targus-getdata1: Flags [.], seq 29988:31416, ack 1, win 4107, options [nop,nop,TS val 4294802735 ecr 63313,mptcp dss ack 569926353 seq 2858618607 subseq 441253 len 1428 csum 0x53a4], length 1428
17:11:12.238691 IP 112.26.1.1.targus-getdata1 > 112.26.1.8.57531: Flags [.], ack 4294964440, win 7639, options [nop,nop,TS val 64614 ecr 4294799204,nop,nop,sack 2 {28560:31416}{12852:14280},mptcp dss ack 2858497227], length 0
17:11:12.238954 IP 112.26.1.1.targus-getdata1 > 112.26.1.8.57531: Flags [.], ack 4294964440, win 7639, options [nop,nop,TS val 64614 ecr 4294799204,nop,nop,sack 2 {28560:31416}{12852:14280},mptcp dss ack 2858497227], length 0
17:11:12.311237 IP 112.26.1.8.57531 > 112.26.1.1.targus-getdata1: Flags [.], seq 19992:21420, ack 1, win 4107, options [nop,nop,TS val 4294802775 ecr 63409,mptcp dss ack 569926353 seq 2858557203 subseq 431257 len 1428 csum 0x88a3], length 1428
17:11:12.318363 IP 112.26.1.1.targus-getdata1 > 112.26.1.8.57531: Flags [.], ack 4294964440, win 7606, options [nop,nop,TS val 64725 ecr 4294799204,nop,nop,sack 2 {19992:21420}{28560:31416},mptcp dss ack 2858501511], length 0
17:11:12.318650 IP 112.26.1.1.targus-getdata1 > 112.26.1.8.57531: Flags [.], ack 4294964440, win 7606, options [nop,nop,TS val 64725 ecr 4294799204,nop,nop,sack 2 {19992:21420}{28560:31416},mptcp dss ack 2858501511], length 0
17:11:12.405692 IP 112.26.1.8.57531 > 112.26.1.1.targus-getdata1: Flags [.], seq 31416:32844, ack 1, win 4107, options [nop,nop,TS val 4294802895 ecr 63568,mptcp dss ack 569926353 seq 2858627175 subseq 442681 len 1428 csum 0xfff5], length 1428
17:11:12.426616 IP 112.26.1.1.targus-getdata1 > 112.26.1.8.57531: Flags [.], ack 4294964440, win 7606, options [nop,nop,TS val 64819 ecr 4294799204,nop,nop,sack 2 {28560:32844}{19992:21420},mptcp dss ack 2858501511], length 0
17:11:12.426942 IP 112.26.1.1.targus-getdata1 > 112.26.1.8.57531: Flags [.], ack 4294964440, win 7606, options [nop,nop,TS val 64819 ecr 4294799204,nop,nop,sack 2 {28560:32844}{19992:21420},mptcp dss ack 2858501511], length 0
17:11:12.478648 IP 112.26.1.8.57531 > 112.26.1.1.targus-getdata1: Flags [.], seq 4284:5712, ack 1, win 4107, options [nop,nop,TS val 4294803585 ecr 64281,mptcp dss ack 569926353 seq 2858508651 subseq 415549 len 1428 csum 0x9428], length 1428
17:11:12.478970 IP 112.26.1.8.57531 > 112.26.1.1.targus-getdata1: Flags [.], seq 4284:5712, ack 1, win 4107, options [nop,nop,TS val 4294803585 ecr 64281,mptcp dss ack 569926353 seq 2858508651 subseq 415549 len 1428 csum 0x9428], length 1428
17:11:12.560385 IP 112.26.1.8.57531 > 112.26.1.1.targus-getdata1: Flags [.], seq 24276:25704, ack 1, win 4107, options [nop,nop,TS val 4294802908 ecr 63675,mptcp dss ack 569926353 seq 2858565771 subseq 435541 len 1428 csum 0x3d3b], length 1428
17:11:12.589775 IP 112.26.1.1.targus-getdata1 > 112.26.1.8.57531: Flags [.], ack 4294964440, win 7606, options [nop,nop,TS val 64974 ecr 4294799204,nop,nop,sack 2 {24276:25704}{28560:32844},mptcp dss ack 2858501511], length 0
17:11:12.590072 IP 112.26.1.1.targus-getdata1 > 112.26.1.8.57531: Flags [.], ack 4294964440, win 7606, options [nop,nop,TS val 64974 ecr 4294799204,nop,nop,sack 2 {24276:25704}{28560:32844},mptcp dss ack 2858501511], length 0
17:11:12.641614 IP 112.26.1.8.57531 > 112.26.1.1.targus-getdata1: Flags [.], seq 27132:28560, ack 1, win 4107, options [nop,nop,TS val 4294803750 ecr 64401,mptcp dss ack 569926353 seq 2858568627 subseq 438397 len 1428 csum 0x90fb], length 1428
17:11:12.641898 IP 112.26.1.8.57531 > 112.26.1.1.targus-getdata1: Flags [.], seq 27132:28560, ack 1, win 4107, options [nop,nop,TS val 4294803750 ecr 64401,mptcp dss ack 569926353 seq 2858568627 subseq 438397 len 1428 csum 0x90fb], length 1428
17:11:12.720137 IP 112.26.1.8.57531 > 112.26.1.1.targus-getdata1: Flags [.], seq 4294964440:4294965868, ack 1, win 4107, options [nop,nop,TS val 4294803165 ecr 63907,mptcp dss ack 569926353 seq 2858501511 subseq 408409 len 1428 csum 0xc43f], length 1428
17:11:12.731207 IP 112.26.1.1.targus-getdata1 > 112.26.1.8.57531: Flags [.], ack 4284, win 7551, options [nop,nop,TS val 65133 ecr 4294803165,nop,nop,sack 2 {24276:25704}{28560:32844},mptcp dss ack 2858508651], length 0
17:11:12.731508 IP 112.26.1.1.targus-getdata1 > 112.26.1.8.57531: Flags [.], ack 4284, win 7551, options [nop,nop,TS val 65133 ecr 4294803165,nop,nop,sack 2 {24276:25704}{28560:32844},mptcp dss ack 2858508651], length 0
17:11:12.832286 IP 112.26.1.8.57531 > 112.26.1.1.targus-getdata1: Flags [.], seq 32844:34272, ack 1, win 4107, options [nop,nop,TS val 4294803940 ecr 64529,mptcp dss ack 569926353 seq 2858662875 subseq 444109 len 1428 csum 0x7320], length 1428
17:11:12.832542 IP 112.26.1.8.57531 > 112.26.1.1.targus-getdata1: Flags [.], seq 32844:34272, ack 1, win 4107, options [nop,nop,TS val 4294803940 ecr 64529,mptcp dss ack 569926353 seq 2858662875 subseq 444109 len 1428 csum 0x7320], length 1428
17:11:12.892983 IP 112.26.1.8.57531 > 112.26.1.1.targus-getdata1: Flags [.], seq 34272:35700, ack 1, win 4107, options [nop,nop,TS val 4294803996 ecr 64614,mptcp dss ack 569926353 seq 2858668587 subseq 445537 len 1428 csum 0x810], length 1428
17:11:12.893305 IP 112.26.1.8.57531 > 112.26.1.1.targus-getdata1: Flags [.], seq 34272:35700, ack 1, win 4107, options [nop,nop,TS val 4294803996 ecr 64614,mptcp dss ack 569926353 seq 2858668587 subseq 445537 len 1428 csum 0x810], length 1428
17:11:12.959124 IP 112.26.1.8.57531 > 112.26.1.1.targus-getdata1: Flags [.], seq 35700:37128, ack 1, win 4107, options [nop,nop,TS val 4294804069 ecr 64725,mptcp dss ack 569926353 seq 2858671443 subseq 446965 len 1428 csum 0xd236], length 1428
17:11:12.959465 IP 112.26.1.8.57531 > 112.26.1.1.targus-getdata1: Flags [.], seq 35700:37128, ack 1, win 4107, options [nop,nop,TS val 4294804069 ecr 64725,mptcp dss ack 569926353 seq 2858671443 subseq 446965 len 1428 csum 0xd236], length 1428
17:11:12.988541 IP 112.26.1.8.57531 > 112.26.1.1.targus-getdata1: Flags [.], seq 37128:38556, ack 1, win 4107, options [nop,nop,TS val 4294804079 ecr 64819,mptcp dss ack 569926353 seq 2858672871 subseq 448393 len 1428 csum 0xecf0], length 1428
17:11:12.988829 IP 112.26.1.8.57531 > 112.26.1.1.targus-getdata1: Flags [.], seq 37128:38556, ack 1, win 4107, options [nop,nop,TS val 4294804079 ecr 64819,mptcp dss ack 569926353 seq 2858672871 subseq 448393 len 1428 csum 0xecf0], length 1428
17:11:13.053032 IP 112.26.1.8.57531 > 112.26.1.1.targus-getdata1: Flags [.], seq 4284:5712, ack 1, win 4107, options [nop,nop,TS val 4294803585 ecr 64281,mptcp dss ack 569926353 seq 2858508651 subseq 415549 len 1428 csum 0x9428], length 1428
