17:10:29.132005 IP 112.26.1.8.36421 > 112.26.1.1.targus-getdata1: Flags [S], seq 2338953355, win 65535, options [mss 1460,sackOK,TS val 4294760232 ecr 0,nop,wscale 6,mptcp join id 3 token 0x8f8bf6e7 nonce 0x509e72d8], length 0
17:10:29.221865 IP 112.26.1.8.36421 > 112.26.1.1.targus-getdata1: Flags [S], seq 2338953355, win 65535, options [mss 1460,sackOK,TS val 4294760232 ecr 0,nop,wscale 6,mptcp join id 3 token 0x8f8bf6e7 nonce 0x509e72d8], length 0
17:10:29.442065 IP 112.26.1.1.targus-getdata1 > 112.26.1.8.36421: Flags [S.], seq 546551861, ack 2338953356, win 28560, options [mss 1460,sackOK,TS val 21681 ecr 4294760232,nop,wscale 7,mptcp join id 3 hmac 0xdea6d7f0c13682f2 nonce 0xe2506a83], length 0
17:10:29.442242 IP 112.26.1.8.36421 > 112.26.1.1.targus-getdata1: Flags [.], ack 1, win 4107, options [nop,nop,TS val 4294760555 ecr 21681,mptcp join hmac 0x3a111e66838a028df5a58c10ae7fe863a47adac9], length 0
17:10:29.570218 IP 112.26.1.8.36421 > 112.26.1.1.targus-getdata1: Flags [.], ack 1, win 4107, options [nop,nop,TS val 4294760555 ecr 21681,mptcp join hmac 0x3a111e66838a028df5a58c10ae7fe863a47adac9], length 0
17:10:29.585385 IP 112.26.1.1.targus-getdata1 > 112.26.1.8.36421: Flags [.], ack 1, win 670, options [nop,nop,TS val 21987 ecr 4294760555,mptcp dss ack 616805850], length 0
17:10:30.139096 IP 112.26.1.8.57531 > 112.26.1.1.targus-getdata1: Flags [S], seq 3554403334, win 65535, options [mss 1460,sackOK,TS val 4294761251 ecr 0,nop,wscale 6,mptcp join id 3 token 0x38f92c7e nonce 0x3c35ef06], length 0
17:11:08.839318 IP 112.26.1.8.57531 > 112.26.1.1.targus-getdata1: Flags [.], seq 3554804603:3554806031, ack 1794727479, win 4107, options [nop,nop,TS val 4294799204 ecr 59821,mptcp dss ack 569926353 seq 2858482947 subseq 401269 len 1428 csum 0x2c70], length 1428
17:11:08.967402 IP 112.26.1.1.targus-getdata1 > 112.26.1.8.57531: Flags [.], ack 4294961584, win 7639, options [nop,nop,TS val 60688 ecr 4294798461,mptcp dss ack 2858361567], length 0
17:11:08.967867 IP 112.26.1.8.57531 > 112.26.1.1.targus-getdata1: Flags [.], seq 18564:19992, ack 1, win 4107, options [nop,nop,TS val 4294800080 ecr 60688,mptcp dss ack 569926353 seq 2858517219 subseq 419833 len 1428 csum 0xab97], length 1428
17:11:08.967935 IP 112.26.1.8.57531 > 112.26.1.1.targus-getdata1: Flags [.], seq 19992:21420, ack 1, win 4107, options [nop,nop,TS val 4294800080 ecr 60688,mptcp dss ack 569926353 seq 2858518647 subseq 421261 len 1428 csum 0xc293], length 1428
17:11:08.968148 IP 112.26.1.8.57531 > 112.26.1.1.targus-getdata1: Flags [.], seq 21420:22848, ack 1, win 4107, options [nop,nop,TS val 4294800080 ecr 60688,mptcp dss ack 569926353 seq 2858520075 subseq 422689 len 1428 csum 0xff49], length 1428
17:11:09.023912 IP 112.26.1.8.57531 > 112.26.1.1.targus-getdata1: Flags [.], seq 1428:2856, ack 1, win 4107, options [nop,nop,TS val 4294799204 ecr 59821,mptcp dss ack 569926353 seq 2858484375 subseq 402697 len 1428 csum 0xb853], length 1428
17:11:09.139702 IP 112.26.1.8.57531 > 112.26.1.1.targus-getdata1: Flags [.], seq 2856:4284, ack 1, win 4107, options [nop,nop,TS val 4294799204 ecr 59821,mptcp dss ack 569926353 seq 2858485803 subseq 404125 len 1428 csum 0x4958], length 1428
17:11:09.238735 IP 112.26.1.8.57531 > 112.26.1.1.targus-getdata1: Flags [.], seq 4284:5712, ack 1, win 4107, options [nop,nop,TS val 4294799204 ecr 59821,mptcp dss ack 569926353 seq 2858487231 subseq 405553 len 1428 csum 0xca3], length 1428
17:11:09.321251 IP 112.26.1.8.57531 > 112.26.1.1.targus-getdata1: Flags [.], seq 5712:7140, ack 1, win 4107, options [nop,nop,TS val 4294799656 ecr 60239,mptcp dss ack 569926353 seq 2858500083 subseq 406981 len 1428 csum 0x1be2], length 1428
17:11:09.469300 IP 112.26.1.8.57531 > 112.26.1.1.targus-getdata1: Flags [.], seq 8568:9996, ack 1, win 4107, options [nop,nop,TS val 4294799656 ecr 60239,mptcp dss ack 569926353 seq 2858502939 subseq 409837 len 1428 csum 0x986f], length 1428
17:11:09.544548 IP 112.26.1.8.57531 > 112.26.1.1.targus-getdata1: Flags [.], seq 9996:11424, ack 1, win 4107, options [nop,nop,TS val 4294799656 ecr 60239,mptcp dss ack 569926353 seq 2858504367 subseq 411265 len 1428 csum 0x9d50], length 1428
17:11:09.613088 IP 112.26.1.8.57531 > 112.26.1.1.targus-getdata1: Flags [.], seq 11424:12852, ack 1, win 4107, options [nop,nop,TS val 4294799656 ecr 60239,mptcp dss ack 569926353 seq 2858505795 subseq 412693 len 1428 csum 0x30f9], length 1428
17:11:09.684681 IP 112.26.1.8.57531 > 112.26.1.1.targus-getdata1: Flags [.], seq 12852:14280, ack 1, win 4107, options [nop,nop,TS val 4294799656 ecr 60239,mptcp dss ack 569926353 seq 2858507223 subseq 414121 len 1428 csum 0x4b42], length 1428
17:11:09.719419 IP 112.26.1.8.57531 > 112.26.1.1.targus-getdata1: Flags [.], seq 21420:22848, ack 1, win 4107, options [nop,nop,TS val 4294800832 ecr 60688,mptcp dss ack 569926353 seq 2858520075 subseq 422689 len 1428 csum 0xff49], length 1428
17:11:09.786591 IP 112.26.1.8.57531 > 112.26.1.1.targus-getdata1: Flags [.], seq 15708:17136, ack 1, win 4107, options [nop,nop,TS val 4294799710 ecr 60480,mptcp dss ack 569926353 seq 2858510079 subseq 416977 len 1428 csum 0x47ab], length 1428
17:11:09.892021 IP 112.26.1.1.targus-getdata1 > 112.26.1.8.57531: Flags [.], ack 4284, win 7639, options [nop,nop,TS val 61557 ecr 4294799204,mptcp dss ack 2858361567], length 0
17:11:09.892448 IP 112.26.1.8.57531 > 112.26.1.1.targus-getdata1: Flags [.], seq 22848:24276, ack 1, win 4107, options [nop,nop,TS val 4294801004 ecr 61557,mptcp dss ack 569926353 seq 2858550063 subseq 424117 len 1428 csum 0xf592], length 1428
17:11:09.892541 IP 112.26.1.8.57531 > 112.26.1.1.targus-getdata1: Flags [.], seq 24276:25704, ack 1, win 4107, options [nop,nop,TS val 4294801004 ecr 61557,mptcp dss ack 569926353 seq 2858551491 subseq 425545 len 1428 csum 0x7745], length 1428
17:11:09.892751 IP 112.26.1.8.57531 > 112.26.1.1.targus-getdata1: Flags [.], seq 25704:27132, ack 1, win 4107, options [nop,nop,TS val 4294801004 ecr 61557,mptcp dss ack 569926353 seq 2858552919 subseq 426973 len 1428 csum 0x5949], length 1428
17:11:09.892859 IP 112.26.1.8.57531 > 112.26.1.1.targus-getdata1: Flags [.], seq 27132:28560, ack 1, win 4107, options [nop,nop,TS val 4294801004 ecr 61557,mptcp dss ack 569926353 seq 2858554347 subseq 428401 len 1428 csum 0xa094], length 1428
17:11:09.893008 IP 112.26.1.8.57531 > 112.26.1.1.targus-getdata1: Flags [.], seq 28560:29988, ack 1, win 4107, options [nop,nop,TS val 4294801004 ecr 61557,mptcp dss ack 569926353 seq 2858555775 subseq 429829 len 1428 csum 0x964e], length 1428
17:11:09.893112 IP 112.26.1.8.57531 > 112.26.1.1.targus-getdata1: Flags [.], seq 29988:31416, ack 1, win 4107, options [nop,nop,TS val 4294801004 ecr 61557,mptcp dss ack 569926353 seq 2858557203 subseq 431257 len 1428 csum 0x88a3], length 1428
17:11:09.893301 IP 112.26.1.8.57531 > 112.26.1.1.targus-getdata1: Flags [.], seq 31416:32844, ack 1, win 4107, options [nop,nop,TS val 4294801004 ecr 61557,mptcp dss ack 569926353 seq 2858558631 subseq 432685 len 1428 csum 0xf750], length 1428
17:11:09.982392 IP 112.26.1.8.57531 > 112.26.1.1.targus-getdata1: Flags [.], seq 19992:21420, ack 1, win 4107, options [nop,nop,TS val 4294800080 ecr 60688,mptcp dss ack 569926353 seq 2858518647 subseq 421261 len 1428 csum 0xc293], length 1428
17:11:10.078519 IP 112.26.1.8.57531 > 112.26.1.1.targus-getdata1: Flags [.], seq 21420:22848, ack 1, win 4107, options [nop,nop,TS val 4294800080 ecr 60688,mptcp dss ack 569926353 seq 2858520075 subseq 422689 len 1428 csum 0xff49], length 1428
17:11:10.183200 IP 112.26.1.1.targus-getdata1 > 112.26.1.8.57531: Flags [.], ack 7140, win 7639, options [nop,nop,TS val 61885 ecr 4294799204,nop,nop,sack 1 {8568:9996},mptcp dss ack 2858361567], length 0
17:11:10.183511 IP 112.26.1.8.57531 > 112.26.1.1.targus-getdata1: Flags [.], seq 32844:34272, ack 1, win 4107, options [nop,nop,TS val 4294801296 ecr 61885,mptcp dss ack 569926353 seq 2858564343 subseq 434113 len 1428 csum 0x9a2e], length 1428
17:11:10.183628 IP 112.26.1.8.57531 > 112.26.1.1.targus-getdata1: Flags [.], seq 34272:35700, ack 1, win 4107, options [nop,nop,TS val 4294801296 ecr 61885,mptcp dss ack 569926353 seq 2858565771 subseq 435541 len 1428 csum 0x3d3b], length 1428
17:11:10.183777 IP 112.26.1.8.57531 > 112.26.1.1.targus-getdata1: Flags [.], seq 35700:37128, ack 1, win 4107, options [nop,nop,TS val 4294801296 ecr 61885,mptcp dss ack 569926353 seq 2858567199 subseq 436969 len 1428 csum 0xbeb6], length 1428
17:11:10.246296 IP 112.26.1.1.targus-getdata1 > 112.26.1.8.57531: Flags [.], ack 7140, win 7506, options [nop,nop,TS val 61983 ecr 4294799204,nop,nop,sack 1 {8568:11424},mptcp dss ack 2858378703], length 0
17:11:10.251074 IP 112.26.1.8.57531 > 112.26.1.1.targus-getdata1: Flags [.], seq 37128:38556, ack 1, win 4107, options [nop,nop,TS val 4294801363 ecr 61983,mptcp dss ack 569926353 seq 2858568627 subseq 438397 len 1428 csum 0x90fb], length 1428
17:11:10.353735 IP 112.26.1.1.targus-getdata1 > 112.26.1.8.57531: Flags [.], ack 7140, win 7506, options [nop,nop,TS val 62059 ecr 4294799204,nop,nop,sack 1 {8568:12852},mptcp dss ack 2858378703], length 0
17:11:10.353974 IP 112.26.1.8.57531 > 112.26.1.1.targus-getdata1: Flags [.], seq 7140:8568, ack 1, win 4107, options [nop,nop,TS val 4294801466 ecr 62059,mptcp dss ack 569926353 seq 2858501511 subseq 408409 len 1428 csum 0xc43f], length 1428
17:11:10.387190 IP 112.26.1.8.57531 > 112.26.1.1.targus-getdata1: Flags [.], seq 21420:22848, ack 1, win 4107, options [nop,nop,TS val 4294800832 ecr 60688,mptcp dss ack 569926353 seq 2858520075 subseq 422689 len 1428 csum 0xff49], length 1428
17:11:10.502351 IP 112.26.1.1.targus-getdata1 > 112.26.1.8.57531: Flags [.], ack 7140, win 7606, options [nop,nop,TS val 62235 ecr 4294799204,nop,nop,sack 2 {15708:17136}{8568:14280},mptcp dss ack 2858445819], length 0
17:11:10.502847 IP 112.26.1.8.57531 > 112.26.1.1.targus-getdata1: Flags [.], seq 14280:15708, ack 1, win 4107, options [nop,nop,TS val 4294801615 ecr 62235,mptcp dss ack 569926353 seq 2858508651 subseq 415549 len 1428 csum 0x9428], length 1428
17:11:10.541305 IP 112.26.1.8.57531 > 112.26.1.1.targus-getdata1: Flags [.], seq 38556:39984, ack 1, win 4107, options [nop,nop,TS val 4294801654 ecr 62235,mptcp dss ack 569926353 seq 2858580051 subseq 439825 len 1428 csum 0x50a5], length 1428
17:11:10.609778 IP 112.26.1.8.57531 > 112.26.1.1.targus-getdata1: Flags [.], seq 24276:25704, ack 1, win 4107, options [nop,nop,TS val 4294801004 ecr 61557,mptcp dss ack 569926353 seq 2858551491 subseq 425545 len 1428 csum 0x7745], length 1428
17:11:10.716683 IP 112.26.1.8.57531 > 112.26.1.1.targus-getdata1: Flags [.], seq 25704:27132, ack 1, win 4107, options [nop,nop,TS val 4294801004 ecr 61557,mptcp dss ack 569926353 seq 2858552919 subseq 426973 len 1428 csum 0x5949], length 1428
17:11:10.811067 IP 112.26.1.8.57531 > 112.26.1.1.targus-getdata1: Flags [.], seq 27132:28560, ack 1, win 4107, options [nop,nop,TS val 4294801004 ecr 61557,mptcp dss ack 569926353 seq 2858554347 subseq 428401 len 1428 csum 0xa094], length 1428
17:11:10.896441 IP 112.26.1.8.57531 > 112.26.1.1.targus-getdata1: Flags [.], seq 28560:29988, ack 1, win 4107, options [nop,nop,TS val 4294801004 ecr 61557,mptcp dss ack 569926353 seq 2858555775 subseq 429829 len 1428 csum 0x964e], length 1428
17:11:10.984524 IP 112.26.1.8.57531 > 112.26.1.1.targus-getdata1: Flags [.], seq 31416:32844, ack 1, win 4107, options [nop,nop,TS val 4294801004 ecr 61557,mptcp dss ack 569926353 seq 2858558631 subseq 432685 len 1428 csum 0xf750], length 1428
17:11:11.088845 IP 112.26.1.1.targus-getdata1 > 112.26.1.8.57531: Flags [.], ack 7140, win 7606, options [nop,nop,TS val 62806 ecr 4294799204,nop,nop,sack 2 {21420:22848}{19992:22848},mptcp dss ack 2858445819], length 0
17:11:11.150774 IP 112.26.1.8.57531 > 112.26.1.1.targus-getdata1: Flags [.], seq 32844:34272, ack 1, win 4107, options [nop,nop,TS val 4294801296 ecr 61885,mptcp dss ack 569926353 seq 2858564343 subseq 434113 len 1428 csum 0x9a2e], length 1428
17:11:11.239401 IP 112.26.1.8.57531 > 112.26.1.1.targus-getdata1: Flags [.], seq 35700:37128, ack 1, win 4107, options [nop,nop,TS val 4294801296 ecr 61885,mptcp dss ack 569926353 seq 2858567199 subseq 436969 len 1428 csum 0xbeb6], length 1428
17:11:11.351318 IP 112.26.1.1.targus-getdata1 > 112.26.1.8.57531: Flags [.], ack 7140, win 7606, options [nop,nop,TS val 63027 ecr 4294799204,nop,nop,sack 2 {24276:25704}{19992:22848},mptcp dss ack 2858445819], length 0
17:11:11.351797 IP 112.26.1.8.57531 > 112.26.1.1.targus-getdata1: Flags [.], seq 17136:18564, ack 1, win 4107, options [nop,nop,TS val 4294802464 ecr 63027,mptcp dss ack 569926353 seq 2858511507 subseq 418405 len 1428 csum 0x149f], length 1428
17:11:11.411012 IP 112.26.1.1.targus-getdata1 > 112.26.1.8.57531: Flags [.], ack 7140, win 7606, options [nop,nop,TS val 63132 ecr 4294799204,nop,nop,sack 2 {24276:27132}{19992:22848},mptcp dss ack 2858445819], length 0
17:11:11.411514 IP 112.26.1.8.57531 > 112.26.1.1.targus-getdata1: Flags [.], seq 18564:19992, ack 1, win 4107, options [nop,nop,TS val 4294802523 ecr 63132,mptcp dss ack 569926353 seq 2858517219 subseq 419833 len 1428 csum 0xab97], length 1428
17:11:11.490241 IP 112.26.1.8.57531 > 112.26.1.1.targus-getdata1: Flags [.], seq 38556:39984, ack 1, win 4107, options [nop,nop,TS val 4294801654 ecr 62235,mptcp dss ack 569926353 seq 2858580051 subseq 439825 len 1428 csum 0x50a5], length 1428
17:11:11.585775 IP 112.26.1.1.targus-getdata1 > 112.26.1.8.57531: Flags [.], ack 7140, win 7606, options [nop,nop,TS val 63313 ecr 4294799204,nop,nop,sack 2 {24276:29988}{19992:22848},mptcp dss ack 2858445819], length 0
17:11:11.586076 IP 112.26.1.8.57531 > 112.26.1.1.targus-getdata1: Flags [.], seq 22848:24276, ack 1, win 4107, options [nop,nop,TS val 4294802699 ecr 63313,mptcp dss ack 569926353 seq 2858550063 subseq 424117 len 1428 csum 0xf592], length 1428
17:11:11.622932 IP 112.26.1.8.57531 > 112.26.1.1.targus-getdata1: Flags [.], seq 39984:41412, ack 1, win 4107, options [nop,nop,TS val 4294802735 ecr 63313,mptcp dss ack 569926353 seq 2858618607 subseq 441253 len 1428 csum 0x53a4], length 1428
17:11:11.662308 IP 112.26.1.1.targus-getdata1 > 112.26.1.8.57531: Flags [.], ack 7140, win 7595, options [nop,nop,TS val 63409 ecr 4294799204,nop,nop,sack 2 {31416:32844}{24276:29988},mptcp dss ack 2858447247], length 0
17:11:11.662673 IP 112.26.1.8.57531 > 112.26.1.1.targus-getdata1: Flags [.], seq 29988:31416, ack 1, win 4107, options [nop,nop,TS val 4294802775 ecr 63409,mptcp dss ack 569926353 seq 2858557203 subseq 431257 len 1428 csum 0x88a3], length 1428
17:11:11.744591 IP 112.26.1.1.targus-getdata1 > 112.26.1.8.57531: Flags [.], ack 7140, win 7639, options [nop,nop,TS val 63568 ecr 4294799204,nop,nop,sack 2 {31416:34272}{24276:29988},mptcp dss ack 2858497227], length 0
17:11:11.782123 IP 112.26.1.8.57531 > 112.26.1.1.targus-getdata1: Flags [.], seq 41412:42840, ack 1, win 4107, options [nop,nop,TS val 4294802895 ecr 63568,mptcp dss ack 569926353 seq 2858627175 subseq 442681 len 1428 csum 0xfff5], length 1428
17:11:11.795547 IP 112.26.1.1.targus-getdata1 > 112.26.1.8.57531: Flags [.], ack 7140, win 7639, options [nop,nop,TS val 63675 ecr 4294799204,nop,nop,sack 2 {35700:37128}{31416:34272},mptcp dss ack 2858497227], length 0
17:11:11.795865 IP 112.26.1.8.57531 > 112.26.1.1.targus-getdata1: Flags [.], seq 34272:35700, ack 1, win 4107, options [nop,nop,TS val 4294802908 ecr 63675,mptcp dss ack 569926353 seq 2858565771 subseq 435541 len 1428 csum 0x3d3b], length 1428
17:11:11.862342 IP 112.26.1.8.57531 > 112.26.1.1.targus-getdata1: Flags [.], seq 17136:18564, ack 1, win 4107, options [nop,nop,TS val 4294802464 ecr 63027,mptcp dss ack 569926353 seq 2858511507 subseq 418405 len 1428 csum 0x149f], length 1428
17:11:11.950210 IP 112.26.1.8.57531 > 112.26.1.1.targus-getdata1: Flags [.], seq 18564:19992, ack 1, win 4107, options [nop,nop,TS val 4294802523 ecr 63132,mptcp dss ack 569926353 seq 2858517219 subseq 419833 len 1428 csum 0xab97], length 1428
17:11:12.052119 IP 112.26.1.1.targus-getdata1 > 112.26.1.8.57531: Flags [.], ack 7140, win 7639, options [nop,nop,TS val 63907 ecr 4294799204,nop,nop,sack 2 {38556:39984}{35700:37128},mptcp dss ack 2858497227], length 0
17:11:12.052425 IP 112.26.1.8.57531 > 112.26.1.1.targus-getdata1: Flags [.], seq 7140:8568, ack 1, win 4107, options [nop,nop,TS val 4294803165 ecr 63907,mptcp dss ack 569926353 seq 2858501511 subseq 408409 len 1428 csum 0xc43f], length 1428
17:11:12.108073 IP 112.26.1.8.57531 > 112.26.1.1.targus-getdata1: Flags [.], seq 22848:24276, ack 1, win 4107, options [nop,nop,TS val 4294802699 ecr 63313,mptcp dss ack 569926353 seq 2858550063 subseq 424117 len 1428 csum 0xf592], length 1428
17:11:12.197724 IP 112.26.1.8.57531 > 112.26.1.1.targus-getdata1: Flags [.], seq 39984:41412, ack 1, win 4107, options [nop,nop,TS val 4294802735 ecr 63313,mptcp dss ack 569926353 seq 2858618607 subseq 441253 len 1428 csum 0x53a4], length 1428
17:11:12.307607 IP 112.26.1.8.57531 > 112.26.1.1.targus-getdata1: Flags [.], seq 29988:31416, ack 1, win 4107, options [nop,nop,TS val 4294802775 ecr 63409,mptcp dss ack 569926353 seq 2858557203 subseq 431257 len 1428 csum 0x88a3], length 1428
17:11:12.402957 IP 112.26.1.8.57531 > 112.26.1.1.targus-getdata1: Flags [.], seq 41412:42840, ack 1, win 4107, options [nop,nop,TS val 4294802895 ecr 63568,mptcp dss ack 569926353 seq 2858627175 subseq 442681 len 1428 csum 0xfff5], length 1428
17:11:12.472080 IP 112.26.1.1.targus-getdata1 > 112.26.1.8.57531: Flags [.], ack 7140, win 7639, options [nop,nop,TS val 64281 ecr 4294799204,nop,nop,sack 2 {17136:18564}{38556:39984},mptcp dss ack 2858497227], length 0
17:11:12.472407 IP 112.26.1.8.57531 > 112.26.1.1.targus-getdata1: Flags [.], seq 14280:15708, ack 1, win 4107, options [nop,nop,TS val 4294803585 ecr 64281,mptcp dss ack 569926353 seq 2858508651 subseq 415549 len 1428 csum 0x9428], length 1428
17:11:12.556363 IP 112.26.1.8.57531 > 112.26.1.1.targus-getdata1: Flags [.], seq 34272:35700, ack 1, win 4107, options [nop,nop,TS val 4294802908 ecr 63675,mptcp dss ack 569926353 seq 2858565771 subseq 435541 len 1428 csum 0x3d3b], length 1428
17:11:12.637672 IP 112.26.1.1.targus-getdata1 > 112.26.1.8.57531: Flags [.], ack 7140, win 7639, options [nop,nop,TS val 64401 ecr 4294799204,nop,nop,sack 2 {17136:19992}{38556:39984},mptcp dss ack 2858497227], length 0
17:11:12.638107 IP 112.26.1.8.57531 > 112.26.1.1.targus-getdata1: Flags [.], seq 37128:38556, ack 1, win 4107, options [nop,nop,TS val 4294803750 ecr 64401,mptcp dss ack 569926353 seq 2858568627 subseq 438397 len 1428 csum 0x90fb], length 1428
17:11:12.717161 IP 112.26.1.8.57531 > 112.26.1.1.targus-getdata1: Flags [.], seq 7140:8568, ack 1, win 4107, options [nop,nop,TS val 4294803165 ecr 63907,mptcp dss ack 569926353 seq 2858501511 subseq 408409 len 1428 csum 0xc43f], length 1428
17:11:12.793201 IP 112.26.1.1.targus-getdata1 > 112.26.1.8.57531: Flags [.], ack 7140, win 7639, options [nop,nop,TS val 64529 ecr 4294799204,nop,nop,sack 2 {22848:24276}{17136:19992},mptcp dss ack 2858497227], length 0
17:11:12.827830 IP 112.26.1.8.57531 > 112.26.1.1.targus-getdata1: Flags [.], seq 42840:44268, ack 1, win 4107, options [nop,nop,TS val 4294803940 ecr 64529,mptcp dss ack 569926353 seq 2858662875 subseq 444109 len 1428 csum 0x7320], length 1428
17:11:12.854746 IP 112.26.1.1.targus-getdata1 > 112.26.1.8.57531: Flags [.], ack 7140, win 7639, options [nop,nop,TS val 64614 ecr 4294799204,nop,nop,sack 2 {38556:41412}{22848:24276},mptcp dss ack 2858497227], length 0
17:11:12.884044 IP 112.26.1.8.57531 > 112.26.1.1.targus-getdata1: Flags [.], seq 44268:45696, ack 1, win 4107, options [nop,nop,TS val 4294803996 ecr 64614,mptcp dss ack 569926353 seq 2858668587 subseq 445537 len 1428 csum 0x810], length 1428
17:11:12.917901 IP 112.26.1.1.targus-getdata1 > 112.26.1.8.57531: Flags [.], ack 7140, win 7606, options [nop,nop,TS val 64725 ecr 4294799204,nop,nop,sack 2 {29988:31416}{38556:41412},mptcp dss ack 2858501511], length 0
17:11:12.956813 IP 112.26.1.1.targus-getdata1 > 112.26.1.8.57531: Flags [.], ack 7140, win 7606, options [nop,nop,TS val 64819 ecr 4294799204,nop,nop,sack 2 {38556:42840}{29988:31416},mptcp dss ack 2858501511], length 0
17:11:12.957097 IP 112.26.1.8.57531 > 112.26.1.1.targus-getdata1: Flags [.], seq 45696:47124, ack 1, win 4107, options [nop,nop,TS val 4294804069 ecr 64725,mptcp dss ack 569926353 seq 2858671443 subseq 446965 len 1428 csum 0xd236], length 1428
17:11:12.967304 IP 112.26.1.8.57531 > 112.26.1.1.targus-getdata1: Flags [.], seq 47124:48552, ack 1, win 4107, options [nop,nop,TS val 4294804079 ecr 64819,mptcp dss ack 569926353 seq 2858672871 subseq 448393 len 1428 csum 0xecf0], length 1428
17:11:13.050214 IP 112.26.1.8.57531 > 112.26.1.1.targus-getdata1: Flags [.], seq 14280:15708, ack 1, win 4107, options [nop,nop,TS val 4294803585 ecr 64281,mptcp dss ack 569926353 seq 2858508651 subseq 415549 len 1428 csum 0x9428], length 1428
17:11:13.186324 IP 112.26.1.1.targus-getdata1 > 112.26.1.8.57531: Flags [.], ack 7140, win 7606, options [nop,nop,TS val 64974 ecr 4294799204,nop,nop,sack 2 {34272:35700}{38556:42840},mptcp dss ack 2858501511], length 0
17:11:13.208485 IP 112.26.1.8.57531 > 112.26.1.1.targus-getdata1: Flags [.], seq 48552:49980, ack 1, win 4107, options [nop,nop,TS val 4294804320 ecr 64974,mptcp dss ack 569926353 seq 2858687151 subseq 449821 len 1428 csum 0x33ab], length 1428
17:11:13.241791 IP 112.26.1.8.57531 > 112.26.1.1.targus-getdata1: Flags [.], seq 37128:38556, ack 1, win 4107, options [nop,nop,TS val 4294803750 ecr 64401,mptcp dss ack 569926353 seq 2858568627 subseq 438397 len 1428 csum 0x90fb], length 1428
17:11:13.320618 IP 112.26.1.1.targus-getdata1 > 112.26.1.8.57531: Flags [.], ack 14280, win 7551, options [nop,nop,TS val 65133 ecr 4294803165,nop,nop,sack 2 {34272:35700}{38556:42840},mptcp dss ack 2858508651], length 0
17:11:13.320921 IP 112.26.1.8.57531 > 112.26.1.1.targus-getdata1: Flags [.], seq 49980:51408, ack 1, win 4107, options [nop,nop,TS val 4294804433 ecr 65133,mptcp dss ack 569926353 seq 2858694291 subseq 451249 len 1428 csum 0x4515], length 1428
17:11:13.320996 IP 112.26.1.8.57531 > 112.26.1.1.targus-getdata1: Flags [.], seq 51408:52836, ack 1, win 4107, options [nop,nop,TS val 4294804433 ecr 65133,mptcp dss ack 569926353 seq 2858695719 subseq 452677 len 1428 csum 0xa0fa], length 1428
17:11:13.321150 IP 112.26.1.8.57531 > 112.26.1.1.targus-getdata1: Flags [.], seq 52836:54264, ack 1, win 4107, options [nop,nop,TS val 4294804433 ecr 65133,mptcp dss ack 569926353 seq 2858697147 subseq 454105 len 1428 csum 0x9a1b], length 1428
17:11:13.321258 IP 112.26.1.8.57531 > 112.26.1.1.targus-getdata1: Flags [.], seq 54264:55692, ack 1, win 4107, options [nop,nop,TS val 4294804433 ecr 65133,mptcp dss ack 569926353 seq 2858698575 subseq 455533 len 1428 csum 0x1d6a], length 1428
17:11:13.321407 IP 112.26.1.8.57531 > 112.26.1.1.targus-getdata1: Flags [.], seq 55692:57120, ack 1, win 4107, options [nop,nop,TS val 4294804433 ecr 65133,mptcp dss ack 569926353 seq 2858700003 subseq 456961 len 1428 csum 0x5fe6], length 1428
17:11:13.402201 IP 112.26.1.8.57531 > 112.26.1.1.targus-getdata1: Flags [.], seq 42840:44268, ack 1, win 4107, options [nop,nop,TS val 4294803940 ecr 64529,mptcp dss ack 569926353 seq 2858662875 subseq 444109 len 1428 csum 0x7320], length 1428
17:11:13.532196 IP 112.26.1.8.57531 > 112.26.1.1.targus-getdata1: Flags [.], seq 44268:45696, ack 1, win 4107, options [nop,nop,TS val 4294803996 ecr 64614,mptcp dss ack 569926353 seq 2858668587 subseq 445537 len 1428 csum 0x810], length 1428
17:11:13.616534 IP 112.26.1.8.57531 > 112.26.1.1.targus-getdata1: Flags [.], seq 45696:47124, ack 1, win 4107, options [nop,nop,TS val 4294804069 ecr 64725,mptcp dss ack 569926353 seq 2858671443 subseq 446965 len 1428 csum 0xd236], length 1428
17:11:13.732261 IP 112.26.1.1.targus-getdata1 > 112.26.1.8.57531: Flags [.], ack 37128, win 7089, options [nop,nop,TS val 65467 ecr 4294803585,nop,nop,sack 1 {38556:42840},mptcp dss ack 2858568627], length 0
17:11:13.732634 IP 112.26.1.8.57531 > 112.26.1.1.targus-getdata1: Flags [.], seq 57120:58548, ack 1, win 4107, options [nop,nop,TS val 4294804845 ecr 65467,mptcp dss ack 569926353 seq 2858719995 subseq 458389 len 1428 csum 0x4756], length 1428
17:11:13.732717 IP 112.26.1.8.57531 > 112.26.1.1.targus-getdata1: Flags [.], seq 58548:59976, ack 1, win 4107, options [nop,nop,TS val 4294804845 ecr 65467,mptcp dss ack 569926353 seq 2858721423 subseq 459817 len 1428 csum 0x202b], length 1428
17:11:13.771499 IP 112.26.1.8.57531 > 112.26.1.1.targus-getdata1: Flags [.], seq 48552:49980, ack 1, win 4107, options [nop,nop,TS val 4294804320 ecr 64974,mptcp dss ack 569926353 seq 2858687151 subseq 449821 len 1428 csum 0x33ab], length 1428
17:11:13.872126 IP 112.26.1.1.targus-getdata1 > 112.26.1.8.57531: Flags [.], ack 42840, win 7363, options [nop,nop,TS val 65658 ecr 4294803750,mptcp dss ack 2858647167], length 0
17:11:13.872396 IP 112.26.1.8.57531 > 112.26.1.1.targus-getdata1: Flags [.], seq 59976:61404, ack 1, win 4107, options [nop,nop,TS val 4294804985 ecr 65658,mptcp dss ack 569926353 seq 2858728563 subseq 461245 len 1428 csum 0xe0a8], length 1428
17:11:13.872473 IP 112.26.1.8.57531 > 112.26.1.1.targus-getdata1: Flags [.], seq 61404:62832, ack 1, win 4107, options [nop,nop,TS val 4294804985 ecr 65658,mptcp dss ack 569926353 seq 2858729991 subseq 462673 len 1428 csum 0x5e6c], length 1428
17:11:13.939602 IP 112.26.1.8.57531 > 112.26.1.1.targus-getdata1: Flags [.], seq 49980:51408, ack 1, win 4107, options [nop,nop,TS val 4294804433 ecr 65133,mptcp dss ack 569926353 seq 2858694291 subseq 451249 len 1428 csum 0x4515], length 1428
17:11:14.031626 IP 112.26.1.1.targus-getdata1 > 112.26.1.8.57531: Flags [.], ack 44268, win 7639, options [nop,nop,TS val 65819 ecr 4294803940,mptcp dss ack 2858651451], length 0
17:11:14.031971 IP 112.26.1.8.57531 > 112.26.1.1.targus-getdata1: Flags [.], seq 62832:64260, ack 1, win 4107, options [nop,nop,TS val 4294805144 ecr 65819,mptcp dss ack 569926353 seq 2858732847 subseq 464101 len 1428 csum 0xc47c], length 1428
17:11:14.099707 IP 112.26.1.8.57531 > 112.26.1.1.targus-getdata1: Flags [.], seq 51408:52836, ack 1, win 4107, options [nop,nop,TS val 4294804433 ecr 65133,mptcp dss ack 569926353 seq 2858695719 subseq 452677 len 1428 csum 0xa0fa], length 1428
17:11:14.198636 IP 112.26.1.8.57531 > 112.26.1.1.targus-getdata1: Flags [.], seq 52836:54264, ack 1, win 4107, options [nop,nop,TS val 4294804433 ecr 65133,mptcp dss ack 569926353 seq 2858697147 subseq 454105 len 1428 csum 0x9a1b], length 1428
17:11:14.291930 IP 112.26.1.1.targus-getdata1 > 112.26.1.8.57531: Flags [.], ack 45696, win 7639, options [nop,nop,TS val 65948 ecr 4294803996,mptcp dss ack 2858655735], length 0
17:11:14.292299 IP 112.26.1.8.57531 > 112.26.1.1.targus-getdata1: Flags [.], seq 64260:65688, ack 1, win 4107, options [nop,nop,TS val 4294805405 ecr 65948,mptcp dss ack 569926353 seq 2858748555 subseq 465529 len 1428 csum 0xcd8a], length 1428
17:11:14.292382 IP 112.26.1.8.57531 > 112.26.1.1.targus-getdata1: Flags [.], seq 65688:67116, ack 1, win 4107, options [nop,nop,TS val 4294805405 ecr 65948,mptcp dss ack 569926353 seq 2858749983 subseq 466957 len 1428 csum 0x20d9], length 1428
17:11:14.357155 IP 112.26.1.1.targus-getdata1 > 112.26.1.8.57531: Flags [.], ack 47124, win 7639, options [nop,nop,TS val 66049 ecr 4294804069,mptcp dss ack 2858655735], length 0
17:11:14.357407 IP 112.26.1.8.57531 > 112.26.1.1.targus-getdata1: Flags [.], seq 67116:68544, ack 1, win 4107, options [nop,nop,TS val 4294805470 ecr 66049,mptcp dss ack 569926353 seq 2858752839 subseq 468385 len 1428 csum 0x35a3], length 1428
17:11:14.429526 IP 112.26.1.8.57531 > 112.26.1.1.targus-getdata1: Flags [.], seq 57120:58548, ack 1, win 4107, options [nop,nop,TS val 4294804845 ecr 65467,mptcp dss ack 569926353 seq 2858719995 subseq 458389 len 1428 csum 0x4756], length 1428
17:11:14.524229 IP 112.26.1.8.57531 > 112.26.1.1.targus-getdata1: Flags [.], seq 58548:59976, ack 1, win 4107, options [nop,nop,TS val 4294804845 ecr 65467,mptcp dss ack 569926353 seq 2858721423 subseq 459817 len 1428 csum 0x202b], length 1428
17:11:14.593586 IP 112.26.1.8.57531 > 112.26.1.1.targus-getdata1: Flags [.], seq 59976:61404, ack 1, win 4107, options [nop,nop,TS val 4294804985 ecr 65658,mptcp dss ack 569926353 seq 2858728563 subseq 461245 len 1428 csum 0xe0a8], length 1428
17:11:14.673449 IP 112.26.1.1.targus-getdata1 > 112.26.1.8.57531: Flags [.], ack 47124, win 7639, options [nop,nop,TS val 66356 ecr 4294804069,nop,nop,sack 1 {48552:51408},mptcp dss ack 2858655735], length 0
17:11:14.705374 IP 112.26.1.8.57531 > 112.26.1.1.targus-getdata1: Flags [.], seq 68544:69972, ack 1, win 4107, options [nop,nop,TS val 4294805818 ecr 66356,mptcp dss ack 569926353 seq 2858768547 subseq 469813 len 1428 csum 0x97f7], length 1428
17:11:14.705519 IP 112.26.1.8.57531 > 112.26.1.1.targus-getdata1: Flags [.], seq 69972:71400, ack 1, win 4107, options [nop,nop,TS val 4294805818 ecr 66356,mptcp dss ack 569926353 seq 2858769975 subseq 471241 len 1428 csum 0xbd7c], length 1428
17:11:14.735037 IP 112.26.1.8.57531 > 112.26.1.1.targus-getdata1: Flags [.], seq 62832:64260, ack 1, win 4107, options [nop,nop,TS val 4294805144 ecr 65819,mptcp dss ack 569926353 seq 2858732847 subseq 464101 len 1428 csum 0xc47c], length 1428
17:11:14.825982 IP 112.26.1.1.targus-getdata1 > 112.26.1.8.57531: Flags [.], ack 47124, win 7639, options [nop,nop,TS val 66516 ecr 4294804069,nop,nop,sack 1 {48552:52836},mptcp dss ack 2858655735], length 0
17:11:14.826318 IP 112.26.1.8.57531 > 112.26.1.1.targus-getdata1: Flags [.], seq 47124:48552, ack 1, win 4107, options [nop,nop,TS val 4294805939 ecr 66516,mptcp dss ack 569926353 seq 2858672871 subseq 448393 len 1428 csum 0xecf0], length 1428
17:11:14.905812 IP 112.26.1.1.targus-getdata1 > 112.26.1.8.57531: Flags [.], ack 47124, win 7639, options [nop,nop,TS val 66615 ecr 4294804069,nop,nop,sack 1 {48552:54264},mptcp dss ack 2858655735], length 0
17:11:14.935083 IP 112.26.1.8.57531 > 112.26.1.1.targus-getdata1: Flags [.], seq 71400:72828, ack 1, win 4107, options [nop,nop,TS val 4294806047 ecr 66615,mptcp dss ack 569926353 seq 2858778543 subseq 472669 len 1428 csum 0x17e2], length 1428
17:11:14.961076 IP 112.26.1.8.57531 > 112.26.1.1.targus-getdata1: Flags [.], seq 64260:65688, ack 1, win 4107, options [nop,nop,TS val 4294805405 ecr 65948,mptcp dss ack 569926353 seq 2858748555 subseq 465529 len 1428 csum 0xcd8a], length 1428
17:11:15.049903 IP 112.26.1.8.57531 > 112.26.1.1.targus-getdata1: Flags [.], seq 65688:67116, ack 1, win 4107, options [nop,nop,TS val 4294805405 ecr 65948,mptcp dss ack 569926353 seq 2858749983 subseq 466957 len 1428 csum 0x20d9], length 1428
17:11:15.134118 IP 112.26.1.8.57531 > 112.26.1.1.targus-getdata1: Flags [.], seq 67116:68544, ack 1, win 4107, options [nop,nop,TS val 4294805470 ecr 66049,mptcp dss ack 569926353 seq 2858752839 subseq 468385 len 1428 csum 0x35a3], length 1428
17:11:15.227227 IP 112.26.1.1.targus-getdata1 > 112.26.1.8.57531: Flags [.], ack 47124, win 7639, options [nop,nop,TS val 66941 ecr 4294804069,nop,nop,sack 2 {57120:59976}{48552:54264},mptcp dss ack 2858655735], length 0
17:11:15.273707 IP 112.26.1.1.targus-getdata1 > 112.26.1.8.57531: Flags [.], ack 47124, win 7639, options [nop,nop,TS val 67026 ecr 4294804069,nop,nop,sack 2 {57120:61404}{48552:54264},mptcp dss ack 2858655735], length 0
17:11:15.274037 IP 112.26.1.8.57531 > 112.26.1.1.targus-getdata1: Flags [.], seq 54264:55692, ack 1, win 4107, options [nop,nop,TS val 4294806386 ecr 67026,mptcp dss ack 569926353 seq 2858698575 subseq 455533 len 1428 csum 0x1d6a], length 1428
17:11:15.327256 IP 112.26.1.8.57531 > 112.26.1.1.targus-getdata1: Flags [.], seq 68544:69972, ack 1, win 4107, options [nop,nop,TS val 4294805818 ecr 66356,mptcp dss ack 569926353 seq 2858768547 subseq 469813 len 1428 csum 0x97f7], length 1428
17:11:15.392362 IP 112.26.1.1.targus-getdata1 > 112.26.1.8.57531: Flags [.], ack 47124, win 7639, options [nop,nop,TS val 67152 ecr 4294804069,nop,nop,sack 2 {62832:64260}{57120:61404},mptcp dss ack 2858655735], length 0
17:11:15.392725 IP 112.26.1.8.57531 > 112.26.1.1.targus-getdata1: Flags [.], seq 55692:57120, ack 1, win 4107, options [nop,nop,TS val 4294806505 ecr 67152,mptcp dss ack 569926353 seq 2858700003 subseq 456961 len 1428 csum 0x5fe6], length 1428
17:11:15.447121 IP 112.26.1.8.57531 > 112.26.1.1.targus-getdata1: Flags [.], seq 69972:71400, ack 1, win 4107, options [nop,nop,TS val 4294805818 ecr 66356,mptcp dss ack 569926353 seq 2858769975 subseq 471241 len 1428 csum 0xbd7c], length 1428
17:11:15.523318 IP 112.26.1.8.57531 > 112.26.1.1.targus-getdata1: Flags [.], seq 47124:48552, ack 1, win 4107, options [nop,nop,TS val 4294805939 ecr 66516,mptcp dss ack 569926353 seq 2858672871 subseq 448393 len 1428 csum 0xecf0], length 1428
17:11:15.608421 IP 112.26.1.8.57531 > 112.26.1.1.targus-getdata1: Flags [.], seq 71400:72828, ack 1, win 4107, options [nop,nop,TS val 4294806047 ecr 66615,mptcp dss ack 569926353 seq 2858778543 subseq 472669 len 1428 csum 0x17e2], length 1428
17:11:15.683381 IP 112.26.1.1.targus-getdata1 > 112.26.1.8.57531: Flags [.], ack 47124, win 7639, options [nop,nop,TS val 67504 ecr 4294804069,nop,nop,sack 2 {62832:67116}{57120:61404},mptcp dss ack 2858655735], length 0
17:11:15.683964 IP 112.26.1.8.57531 > 112.26.1.1.targus-getdata1: Flags [.], seq 61404:62832, ack 1, win 4107, options [nop,nop,TS val 4294806796 ecr 67504,mptcp dss ack 569926353 seq 2858729991 subseq 462673 len 1428 csum 0x5e6c], length 1428
17:11:15.762557 IP 112.26.1.8.57531 > 112.26.1.1.targus-getdata1: Flags [.], seq 72828:74256, ack 1, win 4107, options [nop,nop,TS val 4294806874 ecr 67504,mptcp dss ack 569926353 seq 2858812815 subseq 474097 len 1428 csum 0x6124], length 1428
17:11:15.766617 IP 112.26.1.1.targus-getdata1 > 112.26.1.8.57531: Flags [.], ack 47124, win 7596, options [nop,nop,TS val 67615 ecr 4294804069,nop,nop,sack 2 {62832:68544}{57120:61404},mptcp dss ack 2858672871], length 0
17:11:15.793913 IP 112.26.1.8.57531 > 112.26.1.1.targus-getdata1: Flags [.], seq 74256:75684, ack 1, win 4107, options [nop,nop,TS val 4294806906 ecr 67615,mptcp dss ack 569926353 seq 2858815671 subseq 475525 len 1428 csum 0x3861], length 1428
17:11:15.829549 IP 112.26.1.8.57531 > 112.26.1.1.targus-getdata1: Flags [.], seq 54264:55692, ack 1, win 4107, options [nop,nop,TS val 4294806386 ecr 67026,mptcp dss ack 569926353 seq 2858698575 subseq 455533 len 1428 csum 0x1d6a], length 1428
17:11:15.934673 IP 112.26.1.1.targus-getdata1 > 112.26.1.8.57531: Flags [.], ack 47124, win 7596, options [nop,nop,TS val 67743 ecr 4294804069,nop,nop,sack 2 {62832:69972}{57120:61404},mptcp dss ack 2858672871], length 0
17:11:15.975845 IP 112.26.1.8.57531 > 112.26.1.1.targus-getdata1: Flags [.], seq 55692:57120, ack 1, win 4107, options [nop,nop,TS val 4294806505 ecr 67152,mptcp dss ack 569926353 seq 2858700003 subseq 456961 len 1428 csum 0x5fe6], length 1428
17:11:16.051222 IP 112.26.1.1.targus-getdata1 > 112.26.1.8.57531: Flags [.], ack 47124, win 7596, options [nop,nop,TS val 67865 ecr 4294804069,nop,nop,sack 2 {62832:71400}{57120:61404},mptcp dss ack 2858672871], length 0
17:11:16.051528 IP 112.26.1.8.57531 > 112.26.1.1.targus-getdata1: Flags [.], seq 75684:77112, ack 1, win 4107, options [nop,nop,TS val 4294807163 ecr 67743,mptcp dss ack 569926353 seq 2858827095 subseq 476953 len 1428 csum 0xf50d], length 1428
17:11:16.093175 IP 112.26.1.1.targus-getdata1 > 112.26.1.8.57531: Flags [.], ack 54264, win 7503, options [nop,nop,TS val 67961 ecr 4294805939,nop,nop,sack 2 {62832:71400}{57120:61404},mptcp dss ack 2858690007], length 0
17:11:16.093548 IP 112.26.1.8.57531 > 112.26.1.1.targus-getdata1: Flags [.], seq 77112:78540, ack 1, win 4107, options [nop,nop,TS val 4294807205 ecr 67865,mptcp dss ack 569926353 seq 2858828523 subseq 478381 len 1428 csum 0xa334], length 1428
17:11:16.093667 IP 112.26.1.8.57531 > 112.26.1.1.targus-getdata1: Flags [.], seq 78540:79968, ack 1, win 4107, options [nop,nop,TS val 4294807205 ecr 67961,mptcp dss ack 569926353 seq 2858829951 subseq 479809 len 1428 csum 0xa529], length 1428
17:11:16.093815 IP 112.26.1.8.57531 > 112.26.1.1.targus-getdata1: Flags [.], seq 79968:81396, ack 1, win 4107, options [nop,nop,TS val 4294807205 ecr 67961,mptcp dss ack 569926353 seq 2858831379 subseq 481237 len 1428 csum 0xc5f3], length 1428
17:11:16.192092 IP 112.26.1.1.targus-getdata1 > 112.26.1.8.57531: Flags [.], ack 54264, win 7597, options [nop,nop,TS val 68025 ecr 4294805939,nop,nop,sack 2 {62832:72828}{57120:61404},mptcp dss ack 2858690007], length 0
17:11:16.195773 IP 112.26.1.8.57531 > 112.26.1.1.targus-getdata1: Flags [.], seq 81396:82824, ack 1, win 4107, options [nop,nop,TS val 4294807308 ecr 68025,mptcp dss ack 569926353 seq 2858834235 subseq 482665 len 1428 csum 0xba9a], length 1428
17:11:16.241816 IP 112.26.1.8.57531 > 112.26.1.1.targus-getdata1: Flags [.], seq 61404:62832, ack 1, win 4107, options [nop,nop,TS val 4294806796 ecr 67504,mptcp dss ack 569926353 seq 2858729991 subseq 462673 len 1428 csum 0x5e6c], length 1428
17:11:16.330199 IP 112.26.1.8.57531 > 112.26.1.1.targus-getdata1: Flags [.], seq 72828:74256, ack 1, win 4107, options [nop,nop,TS val 4294806874 ecr 67504,mptcp dss ack 569926353 seq 2858812815 subseq 474097 len 1428 csum 0x6124], length 1428
17:11:16.423272 IP 112.26.1.8.57531 > 112.26.1.1.targus-getdata1: Flags [.], seq 74256:75684, ack 1, win 4107, options [nop,nop,TS val 4294806906 ecr 67615,mptcp dss ack 569926353 seq 2858815671 subseq 475525 len 1428 csum 0x3861], length 1428
17:11:16.487661 IP 112.26.1.1.targus-getdata1 > 112.26.1.8.57531: Flags [.], ack 55692, win 7597, options [nop,nop,TS val 68246 ecr 4294806386,nop,nop,sack 2 {62832:72828}{57120:61404},mptcp dss ack 2858690007], length 0
17:11:16.488075 IP 112.26.1.8.57531 > 112.26.1.1.targus-getdata1: Flags [.], seq 82824:84252, ack 1, win 4107, options [nop,nop,TS val 4294807600 ecr 68246,mptcp dss ack 569926353 seq 2858839947 subseq 484093 len 1428 csum 0x95d5], length 1428
17:11:16.549082 IP 112.26.1.1.targus-getdata1 > 112.26.1.8.57531: Flags [.], ack 61404, win 7564, options [nop,nop,TS val 68391 ecr 4294806505,nop,nop,sack 1 {62832:72828},mptcp dss ack 2858708571], length 0
17:11:16.549518 IP 112.26.1.8.57531 > 112.26.1.1.targus-getdata1: Flags [.], seq 84252:85680, ack 1, win 4107, options [nop,nop,TS val 4294807661 ecr 68391,mptcp dss ack 569926353 seq 2858848515 subseq 485521 len 1428 csum 0xf65c], length 1428
17:11:16.639162 IP 112.26.1.8.57531 > 112.26.1.1.targus-getdata1: Flags [.], seq 75684:77112, ack 1, win 4107, options [nop,nop,TS val 4294807163 ecr 67743,mptcp dss ack 569926353 seq 2858827095 subseq 476953 len 1428 csum 0xf50d], length 1428
17:11:16.716851 IP 112.26.1.8.57531 > 112.26.1.1.targus-getdata1: Flags [.], seq 77112:78540, ack 1, win 4107, options [nop,nop,TS val 4294807205 ecr 67865,mptcp dss ack 569926353 seq 2858828523 subseq 478381 len 1428 csum 0xa334], length 1428
17:11:16.796098 IP 112.26.1.8.57531 > 112.26.1.1.targus-getdata1: Flags [.], seq 78540:79968, ack 1, win 4107, options [nop,nop,TS val 4294807205 ecr 67961,mptcp dss ack 569926353 seq 2858829951 subseq 479809 len 1428 csum 0xa529], length 1428
17:11:16.897982 IP 112.26.1.8.57531 > 112.26.1.1.targus-getdata1: Flags [.], seq 79968:81396, ack 1, win 4107, options [nop,nop,TS val 4294807205 ecr 67961,mptcp dss ack 569926353 seq 2858831379 subseq 481237 len 1428 csum 0xc5f3], length 1428
17:11:16.952286 IP 112.26.1.1.targus-getdata1 > 112.26.1.8.57531: Flags [.], ack 72828, win 7611, options [nop,nop,TS val 68659 ecr 4294806796,mptcp dss ack 2858708571], length 0
17:11:16.952806 IP 112.26.1.8.57531 > 112.26.1.1.targus-getdata1: Flags [.], seq 85680:87108, ack 1, win 4107, options [nop,nop,TS val 4294808065 ecr 68659,mptcp dss ack 569926353 seq 2858861367 subseq 486949 len 1428 csum 0xb0f], length 1428
