17:10:28.415226 IP 112.26.0.8.50154 > 112.26.0.1.targus-getdata1: Flags [S], seq 3862265769, win 65535, options [mss 1460,sackOK,TS val 4294759456 ecr 0,nop,wscale 6,mptcp capable csum {0xf18a364a29c98962}], length 0
17:10:28.581784 IP 112.26.0.1.targus-getdata1 > 112.26.0.8.50154: Flags [S.], seq 3747177684, ack 3862265770, win 28560, options [mss 1460,sackOK,TS val 20829 ecr 4294759456,nop,wscale 7,mptcp capable csum {0x514aa99cf55cf33b}], length 0
17:10:28.686280 IP 112.26.0.1.targus-getdata1 > 112.26.0.8.50154: Flags [S.], seq 3747177684, ack 3862265770, win 28560, options [mss 1460,sackOK,TS val 20829 ecr 4294759456,nop,wscale 7,mptcp capable csum {0x514aa99cf55cf33b}], length 0
17:10:28.717765 IP 112.26.0.8.50154 > 112.26.0.1.targus-getdata1: Flags [.], ack 1, win 1369, options [nop,nop,TS val 4294759812 ecr 20829,mptcp capable csum {0xf18a364a29c98962,0x514aa99cf55cf33b},mptcp dss ack 2233144299], length 0
17:10:28.718210 IP 112.26.0.1.targus-getdata1 > 112.26.0.8.50154: Flags [.], ack 1, win 224, options [nop,nop,TS val 21132 ecr 4294759812,mptcp add-addr id 3 112.26.1.1,mptcp dss ack 616805726], length 0
17:10:28.718270 IP 112.26.0.1.targus-getdata1 > 112.26.0.8.50154: Flags [.], ack 1, win 224, options [nop,nop,TS val 21132 ecr 4294759812,mptcp add-addr id 5 112.26.3.1,mptcp dss ack 616805726], length 0
17:10:28.718304 IP 112.26.0.1.targus-getdata1 > 112.26.0.8.50154: Flags [.], ack 1, win 224, options [nop,nop,TS val 21132 ecr 4294759812,mptcp add-addr id 6 112.26.2.1,mptcp dss ack 616805726], length 0
17:11:06.094155 IP 112.26.0.8.50156 > 112.26.0.1.targus-getdata1: Flags [.], seq 1612183091:1612184519, ack 3373602204, win 4107, options [nop,nop,TS val 4294796705 ecr 57160,mptcp dss ack 569926353 seq 2858357283 subseq 388454 len 1428 csum 0x334c], length 1428
17:11:06.183488 IP 112.26.0.1.targus-getdata1 > 112.26.0.8.50156: Flags [.], ack 4294965868, win 7639, options [nop,nop,TS val 58343 ecr 4294796424,mptcp dss ack 2858287311], length 0
17:11:06.209028 IP 112.26.0.8.50156 > 112.26.0.1.targus-getdata1: Flags [.], seq 1428:2856, ack 1, win 4107, options [nop,nop,TS val 4294796832 ecr 57298,mptcp dss ack 569926353 seq 2858365851 subseq 389882 len 1428 csum 0x1341], length 1428
17:11:06.209337 IP 112.26.0.1.targus-getdata1 > 112.26.0.8.50156: Flags [.], ack 2856, win 7639, options [nop,nop,TS val 58623 ecr 4294796705,mptcp dss ack 2858287311], length 0
17:11:23.390682 IP 112.26.0.8.50156 > 112.26.0.1.targus-getdata1: Flags [.], seq 231336:232764, ack 1, win 4107, options [nop,nop,TS val 4294813548 ecr 74834,mptcp dss ack 569926353 seq 2859111267 subseq 619790 len 1428 csum 0xed4d], length 1428
17:11:44.753588 IP 112.26.0.1.targus-getdata1 > 112.26.0.8.50156: Flags [.], ack 514080, win 7639, options [nop,nop,TS val 97081 ecr 4294835367,mptcp dss ack 2859959499], length 0
17:12:02.060119 IP 112.26.0.8.50156 > 112.26.0.1.targus-getdata1: Flags [.], seq 756840:758268, ack 1, win 4107, options [nop,nop,TS val 4294852638 ecr 113926,mptcp dss ack 569926353 seq 2860782027 subseq 1145294 len 1428 csum 0x145a], length 1428
17:12:02.060346 IP 112.26.0.1.targus-getdata1 > 112.26.0.8.50156: Flags [.], ack 758268, win 7584, options [nop,nop,TS val 114474 ecr 4294852403,mptcp dss ack 2860634943], length 0
17:12:02.066864 IP 112.26.0.1.targus-getdata1 > 112.26.0.8.50156: Flags [.], ack 758268, win 7584, options [nop,nop,TS val 114474 ecr 4294852403,mptcp dss ack 2860634943], length 0
17:12:02.150000 IP 112.26.0.8.50156 > 112.26.0.1.targus-getdata1: Flags [.], seq 758268:759696, ack 1, win 4107, options [nop,nop,TS val 4294852638 ecr 113926,mptcp dss ack 569926353 seq 2860783455 subseq 1146722 len 1428 csum 0x1de], length 1428
17:12:02.265695 IP 112.26.0.1.targus-getdata1 > 112.26.0.8.50156: Flags [.], ack 759696, win 7584, options [nop,nop,TS val 114680 ecr 4294852638,mptcp dss ack 2860634943], length 0
17:12:02.268386 IP 112.26.0.1.targus-getdata1 > 112.26.0.8.50156: Flags [.], ack 759696, win 7584, options [nop,nop,TS val 114680 ecr 4294852638,mptcp dss ack 2860634943], length 0
17:12:02.280689 IP 112.26.0.8.50156 > 112.26.0.1.targus-getdata1: Flags [.], seq 761124:762552, ack 1, win 4107, options [nop,nop,TS val 4294852854 ecr 114144,mptcp dss ack 569926353 seq 2860794879 subseq 1149578 len 1428 csum 0x7e5c], length 1428
17:12:02.281033 IP 112.26.0.1.targus-getdata1 > 112.26.0.8.50156: Flags [.], ack 759696, win 7584, options [nop,nop,TS val 114695 ecr 4294852638,nop,nop,sack 1 {761124:762552},mptcp dss ack 2860634943], length 0
17:12:02.388505 IP 112.26.0.8.50156 > 112.26.0.1.targus-getdata1: Flags [.], seq 762552:763980, ack 1, win 4107, options [nop,nop,TS val 4294852979 ecr 114272,mptcp dss ack 569926353 seq 2860797735 subseq 1151006 len 1428 csum 0xe780], length 1428
17:12:02.388807 IP 112.26.0.1.targus-getdata1 > 112.26.0.8.50156: Flags [.], ack 759696, win 7584, options [nop,nop,TS val 114803 ecr 4294852638,nop,nop,sack 1 {761124:763980},mptcp dss ack 2860634943], length 0
17:12:02.473591 IP 112.26.0.1.targus-getdata1 > 112.26.0.8.50156: Flags [.], ack 759696, win 7584, options [nop,nop,TS val 114695 ecr 4294852638,nop,nop,sack 1 {761124:762552},mptcp dss ack 2860634943], length 0
17:12:02.483734 IP 112.26.0.8.50156 > 112.26.0.1.targus-getdata1: Flags [.], seq 763980:765408, ack 1, win 4107, options [nop,nop,TS val 4294852979 ecr 114272,mptcp dss ack 569926353 seq 2860799163 subseq 1152434 len 1428 csum 0x93ef], length 1428
17:12:02.484065 IP 112.26.0.1.targus-getdata1 > 112.26.0.8.50156: Flags [.], ack 759696, win 7623, options [nop,nop,TS val 114898 ecr 4294852638,nop,nop,sack 1 {761124:765408},mptcp dss ack 2860733475], length 0
17:12:02.573327 IP 112.26.0.1.targus-getdata1 > 112.26.0.8.50156: Flags [.], ack 759696, win 7584, options [nop,nop,TS val 114803 ecr 4294852638,nop,nop,sack 1 {761124:763980},mptcp dss ack 2860634943], length 0
17:12:02.577970 IP 112.26.0.8.50156 > 112.26.0.1.targus-getdata1: Flags [.], seq 765408:766836, ack 1, win 4107, options [nop,nop,TS val 4294853183 ecr 114474,mptcp dss ack 569926353 seq 2860813443 subseq 1153862 len 1428 csum 0x85bc], length 1428
17:12:02.578245 IP 112.26.0.1.targus-getdata1 > 112.26.0.8.50156: Flags [.], ack 759696, win 7623, options [nop,nop,TS val 114992 ecr 4294852638,nop,nop,sack 1 {761124:766836},mptcp dss ack 2860733475], length 0
17:12:02.652858 IP 112.26.0.1.targus-getdata1 > 112.26.0.8.50156: Flags [.], ack 759696, win 7623, options [nop,nop,TS val 114898 ecr 4294852638,nop,nop,sack 1 {761124:765408},mptcp dss ack 2860733475], length 0
17:12:02.660510 IP 112.26.0.8.50156 > 112.26.0.1.targus-getdata1: Flags [.], seq 766836:768264, ack 1, win 4107, options [nop,nop,TS val 4294853183 ecr 114474,mptcp dss ack 569926353 seq 2860814871 subseq 1155290 len 1428 csum 0x676], length 1428
17:12:02.660890 IP 112.26.0.1.targus-getdata1 > 112.26.0.8.50156: Flags [.], ack 759696, win 7623, options [nop,nop,TS val 115074 ecr 4294852638,nop,nop,sack 1 {761124:768264},mptcp dss ack 2860733475], length 0
17:12:02.726503 IP 112.26.0.1.targus-getdata1 > 112.26.0.8.50156: Flags [.], ack 759696, win 7623, options [nop,nop,TS val 114992 ecr 4294852638,nop,nop,sack 1 {761124:766836},mptcp dss ack 2860733475], length 0
17:12:02.787886 IP 112.26.0.8.50156 > 112.26.0.1.targus-getdata1: Flags [.], seq 768264:769692, ack 1, win 4107, options [nop,nop,TS val 4294853384 ecr 114680,mptcp dss ack 569926353 seq 2860822011 subseq 1156718 len 1428 csum 0xcaa1], length 1428
17:12:02.788209 IP 112.26.0.1.targus-getdata1 > 112.26.0.8.50156: Flags [.], ack 759696, win 7623, options [nop,nop,TS val 115202 ecr 4294852638,nop,nop,sack 1 {761124:769692},mptcp dss ack 2860733475], length 0
17:12:02.820324 IP 112.26.0.1.targus-getdata1 > 112.26.0.8.50156: Flags [.], ack 759696, win 7623, options [nop,nop,TS val 115074 ecr 4294852638,nop,nop,sack 1 {761124:768264},mptcp dss ack 2860733475], length 0
17:12:02.873828 IP 112.26.0.8.50156 > 112.26.0.1.targus-getdata1: Flags [.], seq 769692:771120, ack 1, win 4107, options [nop,nop,TS val 4294853384 ecr 114680,mptcp dss ack 569926353 seq 2860823439 subseq 1158146 len 1428 csum 0x8df4], length 1428
17:12:02.874139 IP 112.26.0.1.targus-getdata1 > 112.26.0.8.50156: Flags [.], ack 759696, win 7623, options [nop,nop,TS val 115288 ecr 4294852638,nop,nop,sack 1 {761124:771120},mptcp dss ack 2860733475], length 0
17:12:02.895963 IP 112.26.0.1.targus-getdata1 > 112.26.0.8.50156: Flags [.], ack 759696, win 7623, options [nop,nop,TS val 115202 ecr 4294852638,nop,nop,sack 1 {761124:769692},mptcp dss ack 2860733475], length 0
17:12:02.968352 IP 112.26.0.1.targus-getdata1 > 112.26.0.8.50156: Flags [.], ack 759696, win 7623, options [nop,nop,TS val 115288 ecr 4294852638,nop,nop,sack 1 {761124:771120},mptcp dss ack 2860733475], length 0
17:12:02.975604 IP 112.26.0.8.50156 > 112.26.0.1.targus-getdata1: Flags [.], seq 771120:772548, ack 1, win 4107, options [nop,nop,TS val 4294853636 ecr 114695,mptcp dss ack 569926353 seq 2860830579 subseq 1159574 len 1428 csum 0x4c07], length 1428
17:12:02.975907 IP 112.26.0.1.targus-getdata1 > 112.26.0.8.50156: Flags [.], ack 759696, win 7623, options [nop,nop,TS val 115389 ecr 4294852638,nop,nop,sack 1 {761124:772548},mptcp dss ack 2860733475], length 0
17:12:03.045095 IP 112.26.0.1.targus-getdata1 > 112.26.0.8.50156: Flags [.], ack 759696, win 7623, options [nop,nop,TS val 115389 ecr 4294852638,nop,nop,sack 1 {761124:772548},mptcp dss ack 2860733475], length 0
17:12:03.079662 IP 112.26.0.8.50156 > 112.26.0.1.targus-getdata1: Flags [.], seq 773976:775404, ack 1, win 4107, options [nop,nop,TS val 4294853834 ecr 114898,mptcp dss ack 569926353 seq 2860839147 subseq 1162430 len 1428 csum 0xdf97], length 1428
17:12:03.079901 IP 112.26.0.1.targus-getdata1 > 112.26.0.8.50156: Flags [.], ack 759696, win 7623, options [nop,nop,TS val 115494 ecr 4294852638,nop,nop,sack 2 {773976:775404}{761124:772548},mptcp dss ack 2860733475], length 0
17:12:03.142861 IP 112.26.0.1.targus-getdata1 > 112.26.0.8.50156: Flags [.], ack 759696, win 7623, options [nop,nop,TS val 115494 ecr 4294852638,nop,nop,sack 2 {773976:775404}{761124:772548},mptcp dss ack 2860733475], length 0
17:12:03.174462 IP 112.26.0.8.50156 > 112.26.0.1.targus-getdata1: Flags [.], seq 759696:761124, ack 1, win 4107, options [nop,nop,TS val 4294853956 ecr 114992,mptcp dss ack 569926353 seq 2860793451 subseq 1148150 len 1428 csum 0x28dc], length 1428
17:12:03.174829 IP 112.26.0.1.targus-getdata1 > 112.26.0.8.50156: Flags [.], ack 772548, win 7639, options [nop,nop,TS val 115588 ecr 4294853956,nop,nop,sack 1 {773976:775404},mptcp dss ack 2860770603], length 0
17:12:03.212221 IP 112.26.0.1.targus-getdata1 > 112.26.0.8.50156: Flags [.], ack 772548, win 7639, options [nop,nop,TS val 115588 ecr 4294853956,nop,nop,sack 1 {773976:775404},mptcp dss ack 2860770603], length 0
17:12:03.268831 IP 112.26.0.8.50156 > 112.26.0.1.targus-getdata1: Flags [.], seq 775404:776832, ack 1, win 4107, options [nop,nop,TS val 4294854025 ecr 115074,mptcp dss ack 569926353 seq 2860844859 subseq 1163858 len 1428 csum 0x8c94], length 1428
17:12:03.269116 IP 112.26.0.1.targus-getdata1 > 112.26.0.8.50156: Flags [.], ack 772548, win 7639, options [nop,nop,TS val 115683 ecr 4294853956,nop,nop,sack 1 {773976:776832},mptcp dss ack 2860770603], length 0
17:12:03.271534 IP 112.26.0.1.targus-getdata1 > 112.26.0.8.50156: Flags [.], ack 772548, win 7639, options [nop,nop,TS val 115683 ecr 4294853956,nop,nop,sack 1 {773976:776832},mptcp dss ack 2860770603], length 0
17:12:03.388762 IP 112.26.0.8.50156 > 112.26.0.1.targus-getdata1: Flags [.], seq 776832:778260, ack 1, win 4107, options [nop,nop,TS val 4294854398 ecr 115389,mptcp dss ack 569926353 seq 2860857711 subseq 1165286 len 1428 csum 0x82f], length 1428
17:12:03.389103 IP 112.26.0.1.targus-getdata1 > 112.26.0.8.50156: Flags [.], ack 772548, win 7639, options [nop,nop,TS val 115803 ecr 4294853956,nop,nop,sack 1 {773976:778260},mptcp dss ack 2860770603], length 0
17:12:03.397669 IP 112.26.0.1.targus-getdata1 > 112.26.0.8.50156: Flags [.], ack 772548, win 7639, options [nop,nop,TS val 115803 ecr 4294853956,nop,nop,sack 1 {773976:778260},mptcp dss ack 2860770603], length 0
17:12:03.529246 IP 112.26.0.8.50156 > 112.26.0.1.targus-getdata1: Flags [.], seq 772548:773976, ack 1, win 4107, options [nop,nop,TS val 4294854398 ecr 115494,mptcp dss ack 569926353 seq 2860836291 subseq 1161002 len 1428 csum 0x9c24], length 1428
17:12:03.529569 IP 112.26.0.1.targus-getdata1 > 112.26.0.8.50156: Flags [.], ack 778260, win 7639, options [nop,nop,TS val 115943 ecr 4294854398,mptcp dss ack 2860770603], length 0
17:12:03.532195 IP 112.26.0.1.targus-getdata1 > 112.26.0.8.50156: Flags [.], ack 778260, win 7639, options [nop,nop,TS val 115943 ecr 4294854398,mptcp dss ack 2860770603], length 0
17:12:03.637148 IP 112.26.0.8.50156 > 112.26.0.1.targus-getdata1: Flags [.], seq 778260:779688, ack 1, win 4107, options [nop,nop,TS val 4294854556 ecr 115588,mptcp dss ack 569926353 seq 2860860567 subseq 1166714 len 1428 csum 0x7271], length 1428
17:12:03.637460 IP 112.26.0.1.targus-getdata1 > 112.26.0.8.50156: Flags [.], ack 779688, win 7595, options [nop,nop,TS val 116051 ecr 4294854556,mptcp dss ack 2860776315], length 0
17:12:03.683049 IP 112.26.0.1.targus-getdata1 > 112.26.0.8.50156: Flags [.], ack 779688, win 7595, options [nop,nop,TS val 116051 ecr 4294854556,mptcp dss ack 2860776315], length 0
17:12:03.720044 IP 112.26.0.8.50156 > 112.26.0.1.targus-getdata1: Flags [.], seq 779688:781116, ack 1, win 4107, options [nop,nop,TS val 4294854556 ecr 115588,mptcp dss ack 569926353 seq 2860861995 subseq 1168142 len 1428 csum 0xa46b], length 1428
17:12:03.720377 IP 112.26.0.1.targus-getdata1 > 112.26.0.8.50156: Flags [.], ack 781116, win 7595, options [nop,nop,TS val 116134 ecr 4294854556,mptcp dss ack 2860776315], length 0
17:12:03.740888 IP 112.26.0.1.targus-getdata1 > 112.26.0.8.50156: Flags [.], ack 781116, win 7595, options [nop,nop,TS val 116134 ecr 4294854556,mptcp dss ack 2860776315], length 0
17:12:03.820082 IP 112.26.0.8.50156 > 112.26.0.1.targus-getdata1: Flags [.], seq 781116:782544, ack 1, win 4107, options [nop,nop,TS val 4294854717 ecr 115683,mptcp dss ack 569926353 seq 2860869135 subseq 1169570 len 1428 csum 0xdac3], length 1428
17:12:03.820406 IP 112.26.0.1.targus-getdata1 > 112.26.0.8.50156: Flags [.], ack 782544, win 7595, options [nop,nop,TS val 116234 ecr 4294854717,mptcp dss ack 2860776315], length 0
17:12:03.842402 IP 112.26.0.1.targus-getdata1 > 112.26.0.8.50156: Flags [.], ack 782544, win 7595, options [nop,nop,TS val 116234 ecr 4294854717,mptcp dss ack 2860776315], length 0
17:12:03.904759 IP 112.26.0.8.50156 > 112.26.0.1.targus-getdata1: Flags [.], seq 782544:783972, ack 1, win 4107, options [nop,nop,TS val 4294854762 ecr 115803,mptcp dss ack 569926353 seq 2860870563 subseq 1170998 len 1428 csum 0x7e66], length 1428
17:12:03.905054 IP 112.26.0.1.targus-getdata1 > 112.26.0.8.50156: Flags [.], ack 783972, win 7595, options [nop,nop,TS val 116319 ecr 4294854762,mptcp dss ack 2860776315], length 0
17:12:03.954255 IP 112.26.0.1.targus-getdata1 > 112.26.0.8.50156: Flags [.], ack 783972, win 7595, options [nop,nop,TS val 116319 ecr 4294854762,mptcp dss ack 2860776315], length 0
17:12:03.978967 IP 112.26.0.8.50156 > 112.26.0.1.targus-getdata1: Flags [.], seq 783972:785400, ack 1, win 4107, options [nop,nop,TS val 4294854775 ecr 115943,mptcp dss ack 569926353 seq 2860873419 subseq 1172426 len 1428 csum 0x6aa5], length 1428
17:12:03.979289 IP 112.26.0.1.targus-getdata1 > 112.26.0.8.50156: Flags [.], ack 785400, win 7595, options [nop,nop,TS val 116393 ecr 4294854775,mptcp dss ack 2860776315], length 0
17:12:04.035777 IP 112.26.0.1.targus-getdata1 > 112.26.0.8.50156: Flags [.], ack 785400, win 7595, options [nop,nop,TS val 116393 ecr 4294854775,mptcp dss ack 2860776315], length 0
17:12:04.085437 IP 112.26.0.8.50156 > 112.26.0.1.targus-getdata1: Flags [.], seq 785400:786828, ack 1, win 4107, options [nop,nop,TS val 4294854888 ecr 116051,mptcp dss ack 569926353 seq 2860876275 subseq 1173854 len 1428 csum 0xeca8], length 1428
17:12:04.094312 IP 112.26.0.1.targus-getdata1 > 112.26.0.8.50156: Flags [.], ack 786828, win 7595, options [nop,nop,TS val 116508 ecr 4294854888,mptcp dss ack 2860776315], length 0
17:12:04.124606 IP 112.26.0.1.targus-getdata1 > 112.26.0.8.50156: Flags [.], ack 786828, win 7595, options [nop,nop,TS val 116508 ecr 4294854888,mptcp dss ack 2860776315], length 0
17:12:04.161889 IP 112.26.0.8.50156 > 112.26.0.1.targus-getdata1: Flags [.], seq 786828:788256, ack 1, win 4107, options [nop,nop,TS val 4294854888 ecr 116051,mptcp dss ack 569926353 seq 2860877703 subseq 1175282 len 1428 csum 0x2f25], length 1428
17:12:04.162222 IP 112.26.0.1.targus-getdata1 > 112.26.0.8.50156: Flags [.], ack 788256, win 7561, options [nop,nop,TS val 116576 ecr 4294854888,mptcp dss ack 2860806303], length 0
17:12:04.260169 IP 112.26.0.1.targus-getdata1 > 112.26.0.8.50156: Flags [.], ack 788256, win 7561, options [nop,nop,TS val 116576 ecr 4294854888,mptcp dss ack 2860806303], length 0
17:12:04.294590 IP 112.26.0.8.50156 > 112.26.0.1.targus-getdata1: Flags [.], seq 788256:789684, ack 1, win 4107, options [nop,nop,TS val 4294854988 ecr 116134,mptcp dss ack 569926353 seq 2860884843 subseq 1176710 len 1428 csum 0x4da9], length 1428
17:12:04.294871 IP 112.26.0.1.targus-getdata1 > 112.26.0.8.50156: Flags [.], ack 789684, win 7561, options [nop,nop,TS val 116708 ecr 4294854988,mptcp dss ack 2860806303], length 0
17:12:04.297669 IP 112.26.0.1.targus-getdata1 > 112.26.0.8.50156: Flags [.], ack 789684, win 7561, options [nop,nop,TS val 116708 ecr 4294854988,mptcp dss ack 2860806303], length 0
17:12:04.390903 IP 112.26.0.8.50156 > 112.26.0.1.targus-getdata1: Flags [.], seq 789684:791112, ack 1, win 4107, options [nop,nop,TS val 4294855074 ecr 116234,mptcp dss ack 569926353 seq 2860887699 subseq 1178138 len 1428 csum 0x6a43], length 1428
17:12:04.391141 IP 112.26.0.1.targus-getdata1 > 112.26.0.8.50156: Flags [.], ack 791112, win 7561, options [nop,nop,TS val 116805 ecr 4294855074,mptcp dss ack 2860806303], length 0
17:12:04.398123 IP 112.26.0.1.targus-getdata1 > 112.26.0.8.50156: Flags [.], ack 791112, win 7561, options [nop,nop,TS val 116805 ecr 4294855074,mptcp dss ack 2860806303], length 0
17:12:04.464685 IP 112.26.0.8.50156 > 112.26.0.1.targus-getdata1: Flags [.], seq 791112:792540, ack 1, win 4107, options [nop,nop,TS val 4294855144 ecr 116319,mptcp dss ack 569926353 seq 2860893411 subseq 1179566 len 1428 csum 0x31f9], length 1428
17:12:04.464945 IP 112.26.0.1.targus-getdata1 > 112.26.0.8.50156: Flags [.], ack 792540, win 7561, options [nop,nop,TS val 116878 ecr 4294855144,mptcp dss ack 2860806303], length 0
17:12:04.521675 IP 112.26.0.1.targus-getdata1 > 112.26.0.8.50156: Flags [.], ack 792540, win 7561, options [nop,nop,TS val 116878 ecr 4294855144,mptcp dss ack 2860806303], length 0
17:12:04.592179 IP 112.26.0.8.50156 > 112.26.0.1.targus-getdata1: Flags [.], seq 792540:793968, ack 1, win 4107, options [nop,nop,TS val 4294855144 ecr 116319,mptcp dss ack 569926353 seq 2860894839 subseq 1180994 len 1428 csum 0x4abf], length 1428
17:12:04.592428 IP 112.26.0.1.targus-getdata1 > 112.26.0.8.50156: Flags [.], ack 793968, win 7561, options [nop,nop,TS val 117006 ecr 4294855144,mptcp dss ack 2860806303], length 0
17:12:04.595024 IP 112.26.0.1.targus-getdata1 > 112.26.0.8.50156: Flags [.], ack 793968, win 7561, options [nop,nop,TS val 117006 ecr 4294855144,mptcp dss ack 2860806303], length 0
17:12:04.704013 IP 112.26.0.8.50156 > 112.26.0.1.targus-getdata1: Flags [.], seq 793968:795396, ack 1, win 4107, options [nop,nop,TS val 4294855281 ecr 116393,mptcp dss ack 569926353 seq 2860903407 subseq 1182422 len 1428 csum 0x5bcb], length 1428
17:12:04.704344 IP 112.26.0.1.targus-getdata1 > 112.26.0.8.50156: Flags [.], ack 795396, win 7561, options [nop,nop,TS val 117118 ecr 4294855281,mptcp dss ack 2860806303], length 0
17:12:04.711651 IP 112.26.0.1.targus-getdata1 > 112.26.0.8.50156: Flags [.], ack 795396, win 7561, options [nop,nop,TS val 117118 ecr 4294855281,mptcp dss ack 2860806303], length 0
17:12:04.825502 IP 112.26.0.8.50156 > 112.26.0.1.targus-getdata1: Flags [.], seq 795396:796824, ack 1, win 4107, options [nop,nop,TS val 4294855399 ecr 116508,mptcp dss ack 569926353 seq 2860907691 subseq 1183850 len 1428 csum 0x2283], length 1428
17:12:04.825850 IP 112.26.0.1.targus-getdata1 > 112.26.0.8.50156: Flags [.], ack 796824, win 7561, options [nop,nop,TS val 117239 ecr 4294855399,mptcp dss ack 2860806303], length 0
17:12:04.829796 IP 112.26.0.1.targus-getdata1 > 112.26.0.8.50156: Flags [.], ack 796824, win 7561, options [nop,nop,TS val 117239 ecr 4294855399,mptcp dss ack 2860806303], length 0
17:12:04.951156 IP 112.26.0.8.50156 > 112.26.0.1.targus-getdata1: Flags [.], seq 796824:798252, ack 1, win 4107, options [nop,nop,TS val 4294855525 ecr 116576,mptcp dss ack 569926353 seq 2860911975 subseq 1185278 len 1428 csum 0xe6c8], length 1428
17:12:04.951528 IP 112.26.0.1.targus-getdata1 > 112.26.0.8.50156: Flags [.], ack 798252, win 7561, options [nop,nop,TS val 117365 ecr 4294855525,mptcp dss ack 2860806303], length 0
17:12:04.954206 IP 112.26.0.1.targus-getdata1 > 112.26.0.8.50156: Flags [.], ack 798252, win 7561, options [nop,nop,TS val 117365 ecr 4294855525,mptcp dss ack 2860806303], length 0
17:12:05.025280 IP 112.26.0.8.50156 > 112.26.0.1.targus-getdata1: Flags [.], seq 798252:799680, ack 1, win 4107, options [nop,nop,TS val 4294855605 ecr 116708,mptcp dss ack 569926353 seq 2860919115 subseq 1186706 len 1428 csum 0xfdb], length 1428
17:12:05.025659 IP 112.26.0.1.targus-getdata1 > 112.26.0.8.50156: Flags [.], ack 799680, win 7561, options [nop,nop,TS val 117439 ecr 4294855605,mptcp dss ack 2860806303], length 0
17:12:05.029814 IP 112.26.0.1.targus-getdata1 > 112.26.0.8.50156: Flags [.], ack 799680, win 7561, options [nop,nop,TS val 117439 ecr 4294855605,mptcp dss ack 2860806303], length 0
17:12:05.077765 IP 112.26.0.8.50156 > 112.26.0.1.targus-getdata1: Flags [.], seq 799680:801108, ack 1, win 4107, options [nop,nop,TS val 4294855714 ecr 116805,mptcp dss ack 569926353 seq 2860920543 subseq 1188134 len 1428 csum 0x89be], length 1428
17:12:05.119144 IP 112.26.0.1.targus-getdata1 > 112.26.0.8.50156: Flags [.], ack 801108, win 7561, options [nop,nop,TS val 117533 ecr 4294855714,mptcp dss ack 2860806303], length 0
17:12:05.138956 IP 112.26.0.1.targus-getdata1 > 112.26.0.8.50156: Flags [.], ack 801108, win 7561, options [nop,nop,TS val 117533 ecr 4294855714,mptcp dss ack 2860806303], length 0
17:12:05.176004 IP 112.26.0.8.50156 > 112.26.0.1.targus-getdata1: Flags [.], seq 801108:802536, ack 1, win 4107, options [nop,nop,TS val 4294855836 ecr 116878,mptcp dss ack 569926353 seq 2860923399 subseq 1189562 len 1428 csum 0x8d2], length 1428
17:12:05.258360 IP 112.26.0.1.targus-getdata1 > 112.26.0.8.50156: Flags [.], ack 802536, win 7561, options [nop,nop,TS val 117672 ecr 4294855836,mptcp dss ack 2860806303], length 0
17:12:05.261361 IP 112.26.0.1.targus-getdata1 > 112.26.0.8.50156: Flags [.], ack 802536, win 7561, options [nop,nop,TS val 117672 ecr 4294855836,mptcp dss ack 2860806303], length 0
17:12:05.294940 IP 112.26.0.8.50156 > 112.26.0.1.targus-getdata1: Flags [.], seq 802536:803964, ack 1, win 4107, options [nop,nop,TS val 4294855921 ecr 117006,mptcp dss ack 569926353 seq 2860929111 subseq 1190990 len 1428 csum 0x811b], length 1428
17:12:05.376026 IP 112.26.0.8.50156 > 112.26.0.1.targus-getdata1: Flags [.], seq 803964:805392, ack 1, win 4107, options [nop,nop,TS val 4294855921 ecr 117006,mptcp dss ack 569926353 seq 2860930539 subseq 1192418 len 1428 csum 0xee91], length 1428
17:12:05.409737 IP 112.26.0.1.targus-getdata1 > 112.26.0.8.50156: Flags [.], ack 805392, win 7561, options [nop,nop,TS val 117824 ecr 4294855921,mptcp dss ack 2860806303], length 0
17:12:05.411672 IP 112.26.0.1.targus-getdata1 > 112.26.0.8.50156: Flags [.], ack 805392, win 7561, options [nop,nop,TS val 117824 ecr 4294855921,mptcp dss ack 2860806303], length 0
17:12:05.473182 IP 112.26.0.8.50156 > 112.26.0.1.targus-getdata1: Flags [.], seq 805392:806820, ack 1, win 4107, options [nop,nop,TS val 4294856039 ecr 117118,mptcp dss ack 569926353 seq 2860936251 subseq 1193846 len 1428 csum 0xf193], length 1428
17:12:05.557582 IP 112.26.0.8.50156 > 112.26.0.1.targus-getdata1: Flags [.], seq 806820:808248, ack 1, win 4107, options [nop,nop,TS val 4294856155 ecr 117239,mptcp dss ack 569926353 seq 2860940535 subseq 1195274 len 1428 csum 0x6011], length 1428
17:12:05.557926 IP 112.26.0.1.targus-getdata1 > 112.26.0.8.50156: Flags [.], ack 808248, win 7561, options [nop,nop,TS val 117972 ecr 4294856039,mptcp dss ack 2860806303], length 0
17:12:05.564087 IP 112.26.0.1.targus-getdata1 > 112.26.0.8.50156: Flags [.], ack 808248, win 7561, options [nop,nop,TS val 117972 ecr 4294856039,mptcp dss ack 2860806303], length 0
17:12:05.653299 IP 112.26.0.8.50156 > 112.26.0.1.targus-getdata1: Flags [.], seq 808248:809676, ack 1, win 4107, options [nop,nop,TS val 4294856247 ecr 117365,mptcp dss ack 569926353 seq 2860946247 subseq 1196702 len 1428 csum 0x45be], length 1428
17:12:05.705438 IP 112.26.0.8.50156 > 112.26.0.1.targus-getdata1: Flags [.], seq 809676:811104, ack 1, win 4107, options [nop,nop,TS val 4294856330 ecr 117439,mptcp dss ack 569926353 seq 2860949103 subseq 1198130 len 1428 csum 0x369b], length 1428
17:12:05.770057 IP 112.26.0.1.targus-getdata1 > 112.26.0.8.50156: Flags [.], ack 811104, win 7561, options [nop,nop,TS val 118184 ecr 4294856247,mptcp dss ack 2860806303], length 0
17:12:05.772517 IP 112.26.0.1.targus-getdata1 > 112.26.0.8.50156: Flags [.], ack 811104, win 7561, options [nop,nop,TS val 118184 ecr 4294856247,mptcp dss ack 2860806303], length 0
17:12:05.805682 IP 112.26.0.8.50156 > 112.26.0.1.targus-getdata1: Flags [.], seq 811104:812532, ack 1, win 4107, options [nop,nop,TS val 4294856378 ecr 117533,mptcp dss ack 569926353 seq 2860953387 subseq 1199558 len 1428 csum 0xd13a], length 1428
17:12:05.894538 IP 112.26.0.8.50156 > 112.26.0.1.targus-getdata1: Flags [.], seq 812532:813960, ack 1, win 4107, options [nop,nop,TS val 4294856479 ecr 117672,mptcp dss ack 569926353 seq 2860960527 subseq 1200986 len 1428 csum 0x6a23], length 1428
17:12:05.894866 IP 112.26.0.1.targus-getdata1 > 112.26.0.8.50156: Flags [.], ack 813960, win 7604, options [nop,nop,TS val 118308 ecr 4294856378,mptcp dss ack 2860890555], length 0
17:12:05.901160 IP 112.26.0.1.targus-getdata1 > 112.26.0.8.50156: Flags [.], ack 813960, win 7604, options [nop,nop,TS val 118308 ecr 4294856378,mptcp dss ack 2860890555], length 0
17:12:06.028216 IP 112.26.0.8.50156 > 112.26.0.1.targus-getdata1: Flags [.], seq 813960:815388, ack 1, win 4107, options [nop,nop,TS val 4294856528 ecr 117824,mptcp dss ack 569926353 seq 2860969095 subseq 1202414 len 1428 csum 0xcea1], length 1428
17:12:06.095998 IP 112.26.0.8.50156 > 112.26.0.1.targus-getdata1: Flags [.], seq 815388:816816, ack 1, win 4107, options [nop,nop,TS val 4294856528 ecr 117824,mptcp dss ack 569926353 seq 2860970523 subseq 1203842 len 1428 csum 0x3b9], length 1428
17:12:06.131135 IP 112.26.0.1.targus-getdata1 > 112.26.0.8.50156: Flags [.], ack 816816, win 7611, options [nop,nop,TS val 118545 ecr 4294856528,mptcp dss ack 2860904835], length 0
17:12:06.135220 IP 112.26.0.1.targus-getdata1 > 112.26.0.8.50156: Flags [.], ack 816816, win 7611, options [nop,nop,TS val 118545 ecr 4294856528,mptcp dss ack 2860904835], length 0
17:12:06.175485 IP 112.26.0.8.50156 > 112.26.0.1.targus-getdata1: Flags [.], seq 816816:818244, ack 1, win 4107, options [nop,nop,TS val 4294856679 ecr 117972,mptcp dss ack 569926353 seq 2860974807 subseq 1205270 len 1428 csum 0xb863], length 1428
17:12:06.262837 IP 112.26.0.8.50156 > 112.26.0.1.targus-getdata1: Flags [.], seq 818244:819672, ack 1, win 4107, options [nop,nop,TS val 4294856679 ecr 117972,mptcp dss ack 569926353 seq 2860976235 subseq 1206698 len 1428 csum 0x7c03], length 1428
17:12:06.263127 IP 112.26.0.1.targus-getdata1 > 112.26.0.8.50156: Flags [.], ack 819672, win 7611, options [nop,nop,TS val 118677 ecr 4294856679,mptcp dss ack 2860904835], length 0
17:12:06.265751 IP 112.26.0.1.targus-getdata1 > 112.26.0.8.50156: Flags [.], ack 819672, win 7611, options [nop,nop,TS val 118677 ecr 4294856679,mptcp dss ack 2860904835], length 0
17:12:06.373264 IP 112.26.0.8.50156 > 112.26.0.1.targus-getdata1: Flags [.], seq 819672:821100, ack 1, win 4107, options [nop,nop,TS val 4294856888 ecr 118184,mptcp dss ack 569926353 seq 2860984803 subseq 1208126 len 1428 csum 0x7cff], length 1428
17:12:06.441754 IP 112.26.0.8.50156 > 112.26.0.1.targus-getdata1: Flags [.], seq 821100:822528, ack 1, win 4107, options [nop,nop,TS val 4294856888 ecr 118184,mptcp dss ack 569926353 seq 2860986231 subseq 1209554 len 1428 csum 0xe4d0], length 1428
17:12:06.442154 IP 112.26.0.1.targus-getdata1 > 112.26.0.8.50156: Flags [.], ack 822528, win 7639, options [nop,nop,TS val 118856 ecr 4294856888,mptcp dss ack 2860931967], length 0
17:12:06.447837 IP 112.26.0.1.targus-getdata1 > 112.26.0.8.50156: Flags [.], ack 822528, win 7639, options [nop,nop,TS val 118856 ecr 4294856888,mptcp dss ack 2860931967], length 0
17:12:06.544256 IP 112.26.0.8.50156 > 112.26.0.1.targus-getdata1: Flags [.], seq 822528:823956, ack 1, win 4107, options [nop,nop,TS val 4294857017 ecr 118308,mptcp dss ack 569926353 seq 2860991943 subseq 1210982 len 1428 csum 0xc966], length 1428
17:12:06.598017 IP 112.26.0.8.50156 > 112.26.0.1.targus-getdata1: Flags [.], seq 823956:825384, ack 1, win 4107, options [nop,nop,TS val 4294857017 ecr 118308,mptcp dss ack 569926353 seq 2860993371 subseq 1212410 len 1428 csum 0xbf1b], length 1428
17:12:06.598310 IP 112.26.0.1.targus-getdata1 > 112.26.0.8.50156: Flags [.], ack 825384, win 7639, options [nop,nop,TS val 119012 ecr 4294857017,mptcp dss ack 2860931967], length 0
17:12:06.600440 IP 112.26.0.1.targus-getdata1 > 112.26.0.8.50156: Flags [.], ack 825384, win 7639, options [nop,nop,TS val 119012 ecr 4294857017,mptcp dss ack 2860931967], length 0
17:12:06.721437 IP 112.26.0.8.50156 > 112.26.0.1.targus-getdata1: Flags [.], seq 825384:826812, ack 1, win 4107, options [nop,nop,TS val 4294857250 ecr 118545,mptcp dss ack 569926353 seq 2860999083 subseq 1213838 len 1428 csum 0xb7d1], length 1428
17:12:06.795729 IP 112.26.0.8.50156 > 112.26.0.1.targus-getdata1: Flags [.], seq 826812:828240, ack 1, win 4107, options [nop,nop,TS val 4294857250 ecr 118545,mptcp dss ack 569926353 seq 2861000511 subseq 1215266 len 1428 csum 0x83f9], length 1428
17:12:06.834162 IP 112.26.0.1.targus-getdata1 > 112.26.0.8.50156: Flags [.], ack 828240, win 7639, options [nop,nop,TS val 119248 ecr 4294857250,mptcp dss ack 2860931967], length 0
17:12:06.839382 IP 112.26.0.1.targus-getdata1 > 112.26.0.8.50156: Flags [.], ack 828240, win 7639, options [nop,nop,TS val 119248 ecr 4294857250,mptcp dss ack 2860931967], length 0
17:12:06.914126 IP 112.26.0.8.50156 > 112.26.0.1.targus-getdata1: Flags [.], seq 828240:829668, ack 1, win 4107, options [nop,nop,TS val 4294857381 ecr 118677,mptcp dss ack 569926353 seq 2861010507 subseq 1216694 len 1428 csum 0x11bb], length 1428
17:12:07.005362 IP 112.26.0.8.50156 > 112.26.0.1.targus-getdata1: Flags [.], seq 829668:831096, ack 1, win 4107, options [nop,nop,TS val 4294857381 ecr 118677,mptcp dss ack 569926353 seq 2861011935 subseq 1218122 len 1428 csum 0x46e9], length 1428
17:12:07.005711 IP 112.26.0.1.targus-getdata1 > 112.26.0.8.50156: Flags [.], ack 831096, win 7639, options [nop,nop,TS val 119420 ecr 4294857381,mptcp dss ack 2860931967], length 0
17:12:07.007881 IP 112.26.0.1.targus-getdata1 > 112.26.0.8.50156: Flags [.], ack 831096, win 7639, options [nop,nop,TS val 119420 ecr 4294857381,mptcp dss ack 2860931967], length 0
17:12:07.115544 IP 112.26.0.8.50156 > 112.26.0.1.targus-getdata1: Flags [.], seq 831096:832524, ack 1, win 4107, options [nop,nop,TS val 4294857564 ecr 118856,mptcp dss ack 569926353 seq 2861023359 subseq 1219550 len 1428 csum 0xa267], length 1428
17:12:07.178154 IP 112.26.0.8.50156 > 112.26.0.1.targus-getdata1: Flags [.], seq 832524:833952, ack 1, win 4107, options [nop,nop,TS val 4294857564 ecr 118856,mptcp dss ack 569926353 seq 2861024787 subseq 1220978 len 1428 csum 0x3baa], length 1428
17:12:07.233999 IP 112.26.0.1.targus-getdata1 > 112.26.0.8.50156: Flags [.], ack 833952, win 7639, options [nop,nop,TS val 119648 ecr 4294857564,mptcp dss ack 2860931967], length 0
17:12:07.236358 IP 112.26.0.1.targus-getdata1 > 112.26.0.8.50156: Flags [.], ack 833952, win 7639, options [nop,nop,TS val 119648 ecr 4294857564,mptcp dss ack 2860931967], length 0
17:12:07.263516 IP 112.26.0.8.50156 > 112.26.0.1.targus-getdata1: Flags [.], seq 833952:835380, ack 1, win 4107, options [nop,nop,TS val 4294857715 ecr 119012,mptcp dss ack 569926353 seq 2861036211 subseq 1222406 len 1428 csum 0x2b97], length 1428
17:12:07.378217 IP 112.26.0.1.targus-getdata1 > 112.26.0.8.50156: Flags [.], ack 835380, win 7639, options [nop,nop,TS val 119792 ecr 4294857715,mptcp dss ack 2860980519], length 0
17:12:07.388222 IP 112.26.0.1.targus-getdata1 > 112.26.0.8.50156: Flags [.], ack 835380, win 7639, options [nop,nop,TS val 119792 ecr 4294857715,mptcp dss ack 2860980519], length 0
17:12:07.446143 IP 112.26.0.8.50156 > 112.26.0.1.targus-getdata1: Flags [.], seq 835380:836808, ack 1, win 4107, options [nop,nop,TS val 4294857715 ecr 119012,mptcp dss ack 569926353 seq 2861037639 subseq 1223834 len 1428 csum 0x30d7], length 1428
17:12:07.501839 IP 112.26.0.8.50156 > 112.26.0.1.targus-getdata1: Flags [.], seq 836808:838236, ack 1, win 4107, options [nop,nop,TS val 4294857954 ecr 119248,mptcp dss ack 569926353 seq 2861047635 subseq 1225262 len 1428 csum 0xa288], length 1428
17:12:07.502156 IP 112.26.0.1.targus-getdata1 > 112.26.0.8.50156: Flags [.], ack 838236, win 7639, options [nop,nop,TS val 119915 ecr 4294857715,mptcp dss ack 2860980519], length 0
17:12:07.523584 IP 112.26.0.1.targus-getdata1 > 112.26.0.8.50156: Flags [.], ack 838236, win 7639, options [nop,nop,TS val 119915 ecr 4294857715,mptcp dss ack 2860980519], length 0
17:12:07.603951 IP 112.26.0.8.50156 > 112.26.0.1.targus-getdata1: Flags [.], seq 838236:839664, ack 1, win 4107, options [nop,nop,TS val 4294857954 ecr 119248,mptcp dss ack 569926353 seq 2861049063 subseq 1226690 len 1428 csum 0x2bfe], length 1428
17:12:07.684050 IP 112.26.0.8.50156 > 112.26.0.1.targus-getdata1: Flags [.], seq 839664:841092, ack 1, win 4107, options [nop,nop,TS val 4294857954 ecr 119248,mptcp dss ack 569926353 seq 2861050491 subseq 1228118 len 1428 csum 0xee28], length 1428
17:12:07.684381 IP 112.26.0.1.targus-getdata1 > 112.26.0.8.50156: Flags [.], ack 841092, win 7639, options [nop,nop,TS val 120098 ecr 4294857954,mptcp dss ack 2860980519], length 0
17:12:07.691021 IP 112.26.0.1.targus-getdata1 > 112.26.0.8.50156: Flags [.], ack 841092, win 7639, options [nop,nop,TS val 120098 ecr 4294857954,mptcp dss ack 2860980519], length 0
17:12:07.785854 IP 112.26.0.8.50156 > 112.26.0.1.targus-getdata1: Flags [.], seq 841092:842520, ack 1, win 4107, options [nop,nop,TS val 4294858128 ecr 119420,mptcp dss ack 569926353 seq 2861053347 subseq 1229546 len 1428 csum 0x6eac], length 1428
17:12:07.850792 IP 112.26.0.8.50156 > 112.26.0.1.targus-getdata1: Flags [.], seq 843948:845376, ack 1, win 4107, options [nop,nop,TS val 4294858351 ecr 119648,mptcp dss ack 569926353 seq 2861061915 subseq 1232402 len 1428 csum 0x67cf], length 1428
17:12:07.851060 IP 112.26.0.1.targus-getdata1 > 112.26.0.8.50156: Flags [.], ack 842520, win 7639, options [nop,nop,TS val 120265 ecr 4294858128,nop,nop,sack 1 {843948:845376},mptcp dss ack 2860980519], length 0
17:12:07.853152 IP 112.26.0.1.targus-getdata1 > 112.26.0.8.50156: Flags [.], ack 842520, win 7639, options [nop,nop,TS val 120265 ecr 4294858128,nop,nop,sack 1 {843948:845376},mptcp dss ack 2860980519], length 0
17:12:07.949466 IP 112.26.0.8.50156 > 112.26.0.1.targus-getdata1: Flags [.], seq 845376:846804, ack 1, win 4107, options [nop,nop,TS val 4294858351 ecr 119648,mptcp dss ack 569926353 seq 2861063343 subseq 1233830 len 1428 csum 0x40f3], length 1428
17:12:07.949816 IP 112.26.0.1.targus-getdata1 > 112.26.0.8.50156: Flags [.], ack 842520, win 7639, options [nop,nop,TS val 120364 ecr 4294858128,nop,nop,sack 1 {843948:846804},mptcp dss ack 2860980519], length 0
17:12:07.957924 IP 112.26.0.1.targus-getdata1 > 112.26.0.8.50156: Flags [.], ack 842520, win 7639, options [nop,nop,TS val 120364 ecr 4294858128,nop,nop,sack 1 {843948:846804},mptcp dss ack 2860980519], length 0
17:12:08.039291 IP 112.26.0.8.50156 > 112.26.0.1.targus-getdata1: Flags [.], seq 846804:848232, ack 1, win 4107, options [nop,nop,TS val 4294858504 ecr 119792,mptcp dss ack 569926353 seq 2861067627 subseq 1235258 len 1428 csum 0xe6a3], length 1428
17:12:08.039707 IP 112.26.0.1.targus-getdata1 > 112.26.0.8.50156: Flags [.], ack 842520, win 7639, options [nop,nop,TS val 120453 ecr 4294858128,nop,nop,sack 1 {843948:848232},mptcp dss ack 2860980519], length 0
17:12:08.047499 IP 112.26.0.1.targus-getdata1 > 112.26.0.8.50156: Flags [.], ack 842520, win 7639, options [nop,nop,TS val 120453 ecr 4294858128,nop,nop,sack 1 {843948:848232},mptcp dss ack 2860980519], length 0
17:12:08.160109 IP 112.26.0.8.50156 > 112.26.0.1.targus-getdata1: Flags [.], seq 849660:851088, ack 1, win 4107, options [nop,nop,TS val 4294858661 ecr 119915,mptcp dss ack 569926353 seq 2861071911 subseq 1238114 len 1428 csum 0x9c2c], length 1428
17:12:08.160364 IP 112.26.0.1.targus-getdata1 > 112.26.0.8.50156: Flags [.], ack 842520, win 7639, options [nop,nop,TS val 120574 ecr 4294858128,nop,nop,sack 2 {849660:851088}{843948:848232},mptcp dss ack 2860980519], length 0
17:12:08.164704 IP 112.26.0.1.targus-getdata1 > 112.26.0.8.50156: Flags [.], ack 842520, win 7639, options [nop,nop,TS val 120574 ecr 4294858128,nop,nop,sack 2 {849660:851088}{843948:848232},mptcp dss ack 2860980519], length 0
17:12:08.258158 IP 112.26.0.8.50156 > 112.26.0.1.targus-getdata1: Flags [.], seq 851088:852516, ack 1, win 4107, options [nop,nop,TS val 4294858661 ecr 119915,mptcp dss ack 569926353 seq 2861073339 subseq 1239542 len 1428 csum 0x2936], length 1428
17:12:08.258477 IP 112.26.0.1.targus-getdata1 > 112.26.0.8.50156: Flags [.], ack 842520, win 7628, options [nop,nop,TS val 120672 ecr 4294858128,nop,nop,sack 2 {849660:852516}{843948:848232},mptcp dss ack 2860981947], length 0
17:12:08.261282 IP 112.26.0.1.targus-getdata1 > 112.26.0.8.50156: Flags [.], ack 842520, win 7628, options [nop,nop,TS val 120672 ecr 4294858128,nop,nop,sack 2 {849660:852516}{843948:848232},mptcp dss ack 2860981947], length 0
17:12:08.348953 IP 112.26.0.8.50156 > 112.26.0.1.targus-getdata1: Flags [.], seq 852516:853944, ack 1, win 4107, options [nop,nop,TS val 4294858806 ecr 120098,mptcp dss ack 569926353 seq 2861079051 subseq 1240970 len 1428 csum 0xc4d3], length 1428
17:12:08.349194 IP 112.26.0.1.targus-getdata1 > 112.26.0.8.50156: Flags [.], ack 842520, win 7628, options [nop,nop,TS val 120763 ecr 4294858128,nop,nop,sack 2 {849660:853944}{843948:848232},mptcp dss ack 2860981947], length 0
17:12:08.356175 IP 112.26.0.1.targus-getdata1 > 112.26.0.8.50156: Flags [.], ack 842520, win 7628, options [nop,nop,TS val 120763 ecr 4294858128,nop,nop,sack 2 {849660:853944}{843948:848232},mptcp dss ack 2860981947], length 0
17:12:08.492283 IP 112.26.0.8.50156 > 112.26.0.1.targus-getdata1: Flags [.], seq 853944:855372, ack 1, win 4107, options [nop,nop,TS val 4294858806 ecr 120098,mptcp dss ack 569926353 seq 2861080479 subseq 1242398 len 1428 csum 0xa9a2], length 1428
17:12:08.492617 IP 112.26.0.1.targus-getdata1 > 112.26.0.8.50156: Flags [.], ack 842520, win 7628, options [nop,nop,TS val 120906 ecr 4294858128,nop,nop,sack 2 {849660:855372}{843948:848232},mptcp dss ack 2860981947], length 0
17:12:08.494947 IP 112.26.0.1.targus-getdata1 > 112.26.0.8.50156: Flags [.], ack 842520, win 7628, options [nop,nop,TS val 120906 ecr 4294858128,nop,nop,sack 2 {849660:855372}{843948:848232},mptcp dss ack 2860981947], length 0
