17:10:29.337285 IP 112.26.2.1.targus-getdata1 > 112.26.2.8.52831: Flags [S.], seq 872496003, ack 3403009084, win 28560, options [mss 1460,sackOK,TS val 21687 ecr 4294760233,nop,wscale 7,mptcp join id 6 hmac 0x88d142d84470f381 nonce 0xe98ad74e], length 0
17:10:29.428800 IP 112.26.2.1.targus-getdata1 > 112.26.2.8.52831: Flags [S.], seq 872496003, ack 3403009084, win 28560, options [mss 1460,sackOK,TS val 21687 ecr 4294760233,nop,wscale 7,mptcp join id 6 hmac 0x88d142d84470f381 nonce 0xe98ad74e], length 0
17:10:29.623431 IP 112.26.2.1.targus-getdata1 > 112.26.2.8.52831: Flags [.], ack 1, win 893, options [nop,nop,TS val 22036 ecr 4294760597,mptcp dss ack 616805850], length 0
17:10:29.624779 IP 112.26.2.1.targus-getdata1 > 112.26.2.8.52831: Flags [.], ack 1, win 893, options [nop,nop,TS val 22036 ecr 4294760597,mptcp dss ack 616805850], length 0
17:10:30.155434 IP 112.26.2.1.targus-getdata1 > 112.26.2.8.42819: Flags [S.], seq 3003601552, ack 2677099191, win 28560, options [mss 1460,sackOK,TS val 22564 ecr 4294761252,nop,wscale 7,mptcp join id 6 hmac 0xd26f71da68fa8446 nonce 0x2f9cc3a5], length 0
17:10:30.250715 IP 112.26.2.1.targus-getdata1 > 112.26.2.8.42819: Flags [S.], seq 3003601552, ack 2677099191, win 28560, options [mss 1460,sackOK,TS val 22564 ecr 4294761252,nop,wscale 7,mptcp join id 6 hmac 0xd26f71da68fa8446 nonce 0x2f9cc3a5], length 0
17:10:30.334849 IP 112.26.2.1.targus-getdata1 > 112.26.2.8.42819: Flags [.], ack 1, win 670, options [nop,nop,TS val 22747 ecr 4294761387,mptcp dss ack 2856859311], length 0
17:11:16.422423 IP 112.26.2.1.targus-getdata1 > 112.26.2.8.42819: Flags [.], ack 472669, win 7611, options [nop,nop,TS val 68824 ecr 4294806752,mptcp dss ack 2858708571], length 0
17:11:16.675187 IP 112.26.2.1.targus-getdata1 > 112.26.2.8.42819: Flags [.], ack 475525, win 7611, options [nop,nop,TS val 69088 ecr 4294806976,mptcp dss ack 2858708571], length 0
17:11:16.867099 IP 112.26.2.1.targus-getdata1 > 112.26.2.8.42819: Flags [.], ack 478381, win 7611, options [nop,nop,TS val 69280 ecr 4294806976,mptcp dss ack 2858708571], length 0
17:11:17.050378 IP 112.26.2.1.targus-getdata1 > 112.26.2.8.42819: Flags [.], ack 482665, win 7611, options [nop,nop,TS val 69463 ecr 4294807308,mptcp dss ack 2858708571], length 0
17:11:17.346697 IP 112.26.2.1.targus-getdata1 > 112.26.2.8.42819: Flags [.], ack 486949, win 7611, options [nop,nop,TS val 69757 ecr 4294807636,mptcp dss ack 2858708571], length 0
17:11:17.571544 IP 112.26.2.1.targus-getdata1 > 112.26.2.8.42819: Flags [.], ack 489805, win 7639, options [nop,nop,TS val 69984 ecr 4294807984,mptcp dss ack 2858825667], length 0
17:11:17.828264 IP 112.26.2.1.targus-getdata1 > 112.26.2.8.42819: Flags [.], ack 492661, win 7639, options [nop,nop,TS val 70240 ecr 4294808311,mptcp dss ack 2858839947], length 0
17:11:18.052515 IP 112.26.2.1.targus-getdata1 > 112.26.2.8.42819: Flags [.], ack 495517, win 7639, options [nop,nop,TS val 70465 ecr 4294808385,mptcp dss ack 2858839947], length 0
17:11:18.272014 IP 112.26.2.1.targus-getdata1 > 112.26.2.8.42819: Flags [.], ack 498373, win 7639, options [nop,nop,TS val 70683 ecr 4294808385,mptcp dss ack 2858839947], length 0
17:11:18.612250 IP 112.26.2.1.targus-getdata1 > 112.26.2.8.42819: Flags [.], ack 502657, win 7639, options [nop,nop,TS val 71025 ecr 4294808721,mptcp dss ack 2858839947], length 0
17:11:18.947081 IP 112.26.2.1.targus-getdata1 > 112.26.2.8.42819: Flags [.], ack 506941, win 7639, options [nop,nop,TS val 71360 ecr 4294808874,mptcp dss ack 2858839947], length 0
17:11:19.127873 IP 112.26.2.1.targus-getdata1 > 112.26.2.8.42819: Flags [.], ack 508369, win 7639, options [nop,nop,TS val 71540 ecr 4294809078,nop,nop,sack 1 {509797:511225},mptcp dss ack 2858912775], length 0
17:11:19.322472 IP 112.26.2.1.targus-getdata1 > 112.26.2.8.42819: Flags [.], ack 508369, win 7639, options [nop,nop,TS val 71735 ecr 4294809078,nop,nop,sack 2 {512653:514081}{509797:511225},mptcp dss ack 2858912775], length 0
17:11:19.513834 IP 112.26.2.1.targus-getdata1 > 112.26.2.8.42819: Flags [.], ack 508369, win 7639, options [nop,nop,TS val 71927 ecr 4294809078,nop,nop,sack 2 {512653:515509}{509797:511225},mptcp dss ack 2858912775], length 0
17:11:19.637919 IP 112.26.2.1.targus-getdata1 > 112.26.2.8.42819: Flags [.], ack 508369, win 7639, options [nop,nop,TS val 72051 ecr 4294809078,nop,nop,sack 2 {512653:516937}{509797:511225},mptcp dss ack 2858912775], length 0
17:11:19.761978 IP 112.26.2.1.targus-getdata1 > 112.26.2.8.42819: Flags [.], ack 508369, win 7639, options [nop,nop,TS val 72174 ecr 4294809078,nop,nop,sack 2 {512653:518365}{509797:511225},mptcp dss ack 2858912775], length 0
17:11:19.863633 IP 112.26.2.1.targus-getdata1 > 112.26.2.8.42819: Flags [.], ack 508369, win 7639, options [nop,nop,TS val 72276 ecr 4294809078,nop,nop,sack 2 {512653:519793}{509797:511225},mptcp dss ack 2858912775], length 0
17:11:19.995305 IP 112.26.2.1.targus-getdata1 > 112.26.2.8.42819: Flags [.], ack 508369, win 7639, options [nop,nop,TS val 72407 ecr 4294809078,nop,nop,sack 2 {512653:521221}{509797:511225},mptcp dss ack 2858912775], length 0
17:11:20.157898 IP 112.26.2.1.targus-getdata1 > 112.26.2.8.42819: Flags [.], ack 508369, win 7639, options [nop,nop,TS val 72570 ecr 4294809078,nop,nop,sack 2 {512653:522649}{509797:511225},mptcp dss ack 2858912775], length 0
17:11:20.299199 IP 112.26.2.1.targus-getdata1 > 112.26.2.8.42819: Flags [.], ack 508369, win 7639, options [nop,nop,TS val 72711 ecr 4294809078,nop,nop,sack 2 {512653:524077}{509797:511225},mptcp dss ack 2858912775], length 0
17:11:20.494776 IP 112.26.2.1.targus-getdata1 > 112.26.2.8.42819: Flags [.], ack 508369, win 7639, options [nop,nop,TS val 72906 ecr 4294809078,nop,nop,sack 2 {512653:525505}{509797:511225},mptcp dss ack 2858912775], length 0
17:11:20.687980 IP 112.26.2.1.targus-getdata1 > 112.26.2.8.42819: Flags [.], ack 508369, win 7639, options [nop,nop,TS val 73101 ecr 4294809078,nop,nop,sack 2 {512653:526933}{509797:511225},mptcp dss ack 2858912775], length 0
17:11:20.772976 IP 112.26.2.1.targus-getdata1 > 112.26.2.8.42819: Flags [.], ack 508369, win 7639, options [nop,nop,TS val 73132 ecr 4294809078,nop,nop,sack 2 {512653:528361}{509797:511225},mptcp dss ack 2858912775], length 0
17:11:20.880232 IP 112.26.2.1.targus-getdata1 > 112.26.2.8.42819: Flags [.], ack 508369, win 7639, options [nop,nop,TS val 73293 ecr 4294809078,nop,nop,sack 2 {529789:531217}{512653:528361},mptcp dss ack 2858912775], length 0
17:11:21.005669 IP 112.26.2.1.targus-getdata1 > 112.26.2.8.42819: Flags [.], ack 508369, win 7639, options [nop,nop,TS val 73418 ecr 4294809078,nop,nop,sack 2 {529789:532645}{512653:528361},mptcp dss ack 2858912775], length 0
17:11:21.126404 IP 112.26.2.1.targus-getdata1 > 112.26.2.8.42819: Flags [.], ack 508369, win 7639, options [nop,nop,TS val 73535 ecr 4294809078,nop,nop,sack 2 {534073:535501}{529789:532645},mptcp dss ack 2858912775], length 0
17:11:21.235768 IP 112.26.2.1.targus-getdata1 > 112.26.2.8.42819: Flags [.], ack 511225, win 7506, options [nop,nop,TS val 73648 ecr 4294810986,nop,nop,sack 2 {534073:535501}{529789:532645},mptcp dss ack 2858929911], length 0
17:11:21.377122 IP 112.26.2.1.targus-getdata1 > 112.26.2.8.42819: Flags [.], ack 528361, win 7414, options [nop,nop,TS val 73789 ecr 4294811327,nop,nop,sack 2 {534073:535501}{529789:532645},mptcp dss ack 2858962755], length 0
17:11:21.534083 IP 112.26.2.1.targus-getdata1 > 112.26.2.8.42819: Flags [.], ack 528361, win 7593, options [nop,nop,TS val 73947 ecr 4294811327,nop,nop,sack 2 {536929:538357}{534073:535501},mptcp dss ack 2858971323], length 0
17:11:21.627080 IP 112.26.2.1.targus-getdata1 > 112.26.2.8.42819: Flags [.], ack 528361, win 7593, options [nop,nop,TS val 74040 ecr 4294811327,nop,nop,sack 2 {536929:539785}{534073:535501},mptcp dss ack 2858971323], length 0
17:11:21.779087 IP 112.26.2.1.targus-getdata1 > 112.26.2.8.42819: Flags [.], ack 528361, win 7593, options [nop,nop,TS val 74191 ecr 4294811327,nop,nop,sack 2 {536929:541213}{534073:535501},mptcp dss ack 2858971323], length 0
17:11:22.016983 IP 112.26.2.1.targus-getdata1 > 112.26.2.8.42819: Flags [.], ack 528361, win 7593, options [nop,nop,TS val 74428 ecr 4294811327,nop,nop,sack 2 {536929:542641}{534073:535501},mptcp dss ack 2858971323], length 0
17:11:22.126429 IP 112.26.2.1.targus-getdata1 > 112.26.2.8.42819: Flags [.], ack 528361, win 7593, options [nop,nop,TS val 74539 ecr 4294811327,nop,nop,sack 2 {536929:544069}{534073:535501},mptcp dss ack 2858971323], length 0
17:11:22.292561 IP 112.26.2.1.targus-getdata1 > 112.26.2.8.42819: Flags [.], ack 532645, win 7504, options [nop,nop,TS val 74705 ecr 4294812753,nop,nop,sack 2 {536929:544069}{534073:535501},mptcp dss ack 2858982747], length 0
17:11:22.461261 IP 112.26.2.1.targus-getdata1 > 112.26.2.8.42819: Flags [.], ack 532645, win 7504, options [nop,nop,TS val 74874 ecr 4294812753,nop,nop,sack 2 {536929:545497}{534073:535501},mptcp dss ack 2858982747], length 0
17:11:22.588490 IP 112.26.2.1.targus-getdata1 > 112.26.2.8.42819: Flags [.], ack 535501, win 7449, options [nop,nop,TS val 74998 ecr 4294812952,nop,nop,sack 1 {536929:545497},mptcp dss ack 2858989887], length 0
17:11:22.736067 IP 112.26.2.1.targus-getdata1 > 112.26.2.8.42819: Flags [.], ack 545497, win 7353, options [nop,nop,TS val 75148 ecr 4294813067,mptcp dss ack 2859079851], length 0
17:11:22.953672 IP 112.26.2.1.targus-getdata1 > 112.26.2.8.42819: Flags [.], ack 546925, win 7639, options [nop,nop,TS val 75366 ecr 4294813067,mptcp dss ack 2859084135], length 0
17:11:23.031721 IP 112.26.2.1.targus-getdata1 > 112.26.2.8.42819: Flags [.], ack 548353, win 7639, options [nop,nop,TS val 75423 ecr 4294813067,mptcp dss ack 2859085563], length 0
17:11:23.110030 IP 112.26.2.1.targus-getdata1 > 112.26.2.8.42819: Flags [.], ack 549781, win 7639, options [nop,nop,TS val 75523 ecr 4294813067,mptcp dss ack 2859095559], length 0
17:11:23.248165 IP 112.26.2.1.targus-getdata1 > 112.26.2.8.42819: Flags [.], ack 551209, win 7639, options [nop,nop,TS val 75660 ecr 4294813255,mptcp dss ack 2859098415], length 0
17:11:23.415098 IP 112.26.2.1.targus-getdata1 > 112.26.2.8.42819: Flags [.], ack 552637, win 7639, options [nop,nop,TS val 75825 ecr 4294813391,mptcp dss ack 2859098415], length 0
17:11:23.544686 IP 112.26.2.1.targus-getdata1 > 112.26.2.8.42819: Flags [.], ack 554065, win 7639, options [nop,nop,TS val 75957 ecr 4294813548,mptcp dss ack 2859098415], length 0
17:11:23.696039 IP 112.26.2.1.targus-getdata1 > 112.26.2.8.42819: Flags [.], ack 555493, win 7639, options [nop,nop,TS val 76108 ecr 4294813785,mptcp dss ack 2859098415], length 0
17:11:23.810952 IP 112.26.2.1.targus-getdata1 > 112.26.2.8.42819: Flags [.], ack 556921, win 7639, options [nop,nop,TS val 76223 ecr 4294814074,mptcp dss ack 2859098415], length 0
17:11:24.009481 IP 112.26.2.1.targus-getdata1 > 112.26.2.8.42819: Flags [.], ack 558349, win 7639, options [nop,nop,TS val 76422 ecr 4294814337,mptcp dss ack 2859098415], length 0
17:11:24.144313 IP 112.26.2.1.targus-getdata1 > 112.26.2.8.42819: Flags [.], ack 559777, win 7639, options [nop,nop,TS val 76556 ecr 4294814337,mptcp dss ack 2859098415], length 0
17:11:24.200355 IP 112.26.2.1.targus-getdata1 > 112.26.2.8.42819: Flags [.], ack 561205, win 7639, options [nop,nop,TS val 76613 ecr 4294814481,mptcp dss ack 2859098415], length 0
17:11:24.345166 IP 112.26.2.1.targus-getdata1 > 112.26.2.8.42819: Flags [.], ack 562633, win 7639, options [nop,nop,TS val 76758 ecr 4294814515,mptcp dss ack 2859098415], length 0
17:11:24.484360 IP 112.26.2.1.targus-getdata1 > 112.26.2.8.42819: Flags [.], ack 564061, win 7639, options [nop,nop,TS val 76896 ecr 4294814573,mptcp dss ack 2859098415], length 0
17:11:24.663957 IP 112.26.2.1.targus-getdata1 > 112.26.2.8.42819: Flags [.], ack 565489, win 7639, options [nop,nop,TS val 77076 ecr 4294814727,mptcp dss ack 2859124119], length 0
17:11:24.815534 IP 112.26.2.1.targus-getdata1 > 112.26.2.8.42819: Flags [.], ack 566917, win 7639, options [nop,nop,TS val 77224 ecr 4294814727,mptcp dss ack 2859124119], length 0
17:11:25.006278 IP 112.26.2.1.targus-getdata1 > 112.26.2.8.42819: Flags [.], ack 569773, win 7639, options [nop,nop,TS val 77418 ecr 4294814996,mptcp dss ack 2859124119], length 0
17:11:25.175099 IP 112.26.2.1.targus-getdata1 > 112.26.2.8.42819: Flags [.], ack 569773, win 7639, options [nop,nop,TS val 77588 ecr 4294814996,nop,nop,sack 1 {571201:572629},mptcp dss ack 2859124119], length 0
17:11:25.293773 IP 112.26.2.1.targus-getdata1 > 112.26.2.8.42819: Flags [.], ack 569773, win 7639, options [nop,nop,TS val 77706 ecr 4294814996,nop,nop,sack 1 {571201:574057},mptcp dss ack 2859124119], length 0
17:11:25.537206 IP 112.26.2.1.targus-getdata1 > 112.26.2.8.42819: Flags [.], ack 569773, win 7639, options [nop,nop,TS val 77949 ecr 4294814996,nop,nop,sack 1 {571201:575485},mptcp dss ack 2859124119], length 0
17:11:25.631896 IP 112.26.2.1.targus-getdata1 > 112.26.2.8.42819: Flags [.], ack 569773, win 7639, options [nop,nop,TS val 77999 ecr 4294814996,nop,nop,sack 1 {571201:576913},mptcp dss ack 2859124119], length 0
17:11:25.731299 IP 112.26.2.1.targus-getdata1 > 112.26.2.8.42819: Flags [.], ack 569773, win 7639, options [nop,nop,TS val 78143 ecr 4294814996,nop,nop,sack 1 {571201:578341},mptcp dss ack 2859124119], length 0
17:11:26.013892 IP 112.26.2.1.targus-getdata1 > 112.26.2.8.42819: Flags [.], ack 569773, win 7639, options [nop,nop,TS val 78426 ecr 4294814996,nop,nop,sack 1 {571201:579769},mptcp dss ack 2859191235], length 0
17:11:26.076198 IP 112.26.2.1.targus-getdata1 > 112.26.2.8.42819: Flags [.], ack 569773, win 7639, options [nop,nop,TS val 78486 ecr 4294814996,nop,nop,sack 2 {581197:582625}{571201:579769},mptcp dss ack 2859191235], length 0
17:11:26.257482 IP 112.26.2.1.targus-getdata1 > 112.26.2.8.42819: Flags [.], ack 569773, win 7639, options [nop,nop,TS val 78670 ecr 4294814996,nop,nop,sack 2 {584053:585481}{581197:582625},mptcp dss ack 2859191235], length 0
17:11:26.335400 IP 112.26.2.1.targus-getdata1 > 112.26.2.8.42819: Flags [.], ack 569773, win 7639, options [nop,nop,TS val 78748 ecr 4294814996,nop,nop,sack 2 {584053:586909}{581197:582625},mptcp dss ack 2859191235], length 0
17:11:26.451356 IP 112.26.2.1.targus-getdata1 > 112.26.2.8.42819: Flags [.], ack 569773, win 7639, options [nop,nop,TS val 78850 ecr 4294814996,nop,nop,sack 2 {584053:588337}{581197:582625},mptcp dss ack 2859191235], length 0
17:11:26.662017 IP 112.26.2.1.targus-getdata1 > 112.26.2.8.42819: Flags [.], ack 569773, win 7639, options [nop,nop,TS val 79074 ecr 4294814996,nop,nop,sack 2 {589765:591193}{584053:588337},mptcp dss ack 2859191235], length 0
17:11:26.816263 IP 112.26.2.1.targus-getdata1 > 112.26.2.8.42819: Flags [.], ack 569773, win 7639, options [nop,nop,TS val 79227 ecr 4294814996,nop,nop,sack 2 {592621:594049}{589765:591193},mptcp dss ack 2859191235], length 0
17:11:26.958646 IP 112.26.2.1.targus-getdata1 > 112.26.2.8.42819: Flags [.], ack 579769, win 7561, options [nop,nop,TS val 79370 ecr 4294817489,nop,nop,sack 2 {592621:594049}{589765:591193},mptcp dss ack 2859201231], length 0
17:11:27.126596 IP 112.26.2.1.targus-getdata1 > 112.26.2.8.42819: Flags [.], ack 579769, win 7605, options [nop,nop,TS val 79536 ecr 4294817489,nop,nop,sack 2 {592621:595477}{589765:591193},mptcp dss ack 2859201231], length 0
17:11:27.384841 IP 112.26.2.1.targus-getdata1 > 112.26.2.8.42819: Flags [.], ack 579769, win 7639, options [nop,nop,TS val 79796 ecr 4294817489,nop,nop,sack 2 {592621:596905}{589765:591193},mptcp dss ack 2859222651], length 0
17:11:27.561977 IP 112.26.2.1.targus-getdata1 > 112.26.2.8.42819: Flags [.], ack 579769, win 7639, options [nop,nop,TS val 79974 ecr 4294817489,nop,nop,sack 2 {592621:598333}{589765:591193},mptcp dss ack 2859224079], length 0
17:11:27.795276 IP 112.26.2.1.targus-getdata1 > 112.26.2.8.42819: Flags [.], ack 579769, win 7639, options [nop,nop,TS val 80208 ecr 4294817489,nop,nop,sack 2 {581197:588337}{592621:598333},mptcp dss ack 2859229791], length 0
17:11:27.950991 IP 112.26.2.1.targus-getdata1 > 112.26.2.8.42819: Flags [.], ack 579769, win 7639, options [nop,nop,TS val 80363 ecr 4294817489,nop,nop,sack 2 {592621:599761}{581197:588337},mptcp dss ack 2859229791], length 0
17:11:28.147901 IP 112.26.2.1.targus-getdata1 > 112.26.2.8.42819: Flags [.], ack 579769, win 7639, options [nop,nop,TS val 80560 ecr 4294817489,nop,nop,sack 2 {581197:591193}{592621:599761},mptcp dss ack 2859229791], length 0
17:11:28.301545 IP 112.26.2.1.targus-getdata1 > 112.26.2.8.42819: Flags [.], ack 579769, win 7639, options [nop,nop,TS val 80713 ecr 4294817489,nop,nop,sack 1 {581197:599761},mptcp dss ack 2859229791], length 0
17:11:28.361112 IP 112.26.2.1.targus-getdata1 > 112.26.2.8.42819: Flags [.], ack 579769, win 7639, options [nop,nop,TS val 80747 ecr 4294817489,nop,nop,sack 1 {581197:601189},mptcp dss ack 2859229791], length 0
17:11:28.560458 IP 112.26.2.1.targus-getdata1 > 112.26.2.8.42819: Flags [.], ack 579769, win 7639, options [nop,nop,TS val 80970 ecr 4294817489,nop,nop,sack 1 {581197:602617},mptcp dss ack 2859229791], length 0
17:11:28.647650 IP 112.26.2.1.targus-getdata1 > 112.26.2.8.42819: Flags [.], ack 579769, win 7639, options [nop,nop,TS val 81040 ecr 4294817489,nop,nop,sack 1 {581197:604045},mptcp dss ack 2859229791], length 0
17:11:28.850083 IP 112.26.2.1.targus-getdata1 > 112.26.2.8.42819: Flags [.], ack 579769, win 7639, options [nop,nop,TS val 81263 ecr 4294817489,nop,nop,sack 1 {581197:605473},mptcp dss ack 2859229791], length 0
17:11:28.951812 IP 112.26.2.1.targus-getdata1 > 112.26.2.8.42819: Flags [.], ack 579769, win 7639, options [nop,nop,TS val 81365 ecr 4294817489,nop,nop,sack 1 {581197:606901},mptcp dss ack 2859229791], length 0
17:11:29.114287 IP 112.26.2.1.targus-getdata1 > 112.26.2.8.42819: Flags [.], ack 606901, win 7246, options [nop,nop,TS val 81527 ecr 4294819594,mptcp dss ack 2859325467], length 0
17:11:29.289289 IP 112.26.2.1.targus-getdata1 > 112.26.2.8.42819: Flags [.], ack 608329, win 7639, options [nop,nop,TS val 81700 ecr 4294819832,mptcp dss ack 2859344031], length 0
17:11:29.537923 IP 112.26.2.1.targus-getdata1 > 112.26.2.8.42819: Flags [.], ack 609757, win 7639, options [nop,nop,TS val 81945 ecr 4294819931,mptcp dss ack 2859344031], length 0
17:11:29.697547 IP 112.26.2.1.targus-getdata1 > 112.26.2.8.42819: Flags [.], ack 611185, win 7639, options [nop,nop,TS val 82107 ecr 4294820100,mptcp dss ack 2859344031], length 0
17:11:29.801289 IP 112.26.2.1.targus-getdata1 > 112.26.2.8.42819: Flags [.], ack 612613, win 7639, options [nop,nop,TS val 82214 ecr 4294820227,mptcp dss ack 2859344031], length 0
17:11:29.936565 IP 112.26.2.1.targus-getdata1 > 112.26.2.8.42819: Flags [.], ack 614041, win 7639, options [nop,nop,TS val 82344 ecr 4294820366,mptcp dss ack 2859344031], length 0
17:11:30.099717 IP 112.26.2.1.targus-getdata1 > 112.26.2.8.42819: Flags [.], ack 615469, win 7639, options [nop,nop,TS val 82511 ecr 4294820489,mptcp dss ack 2859344031], length 0
17:11:30.217303 IP 112.26.2.1.targus-getdata1 > 112.26.2.8.42819: Flags [.], ack 616897, win 7639, options [nop,nop,TS val 82629 ecr 4294820609,mptcp dss ack 2859344031], length 0
17:11:30.428129 IP 112.26.2.1.targus-getdata1 > 112.26.2.8.42819: Flags [.], ack 618325, win 7639, options [nop,nop,TS val 82839 ecr 4294820836,mptcp dss ack 2859348315], length 0
17:11:30.568342 IP 112.26.2.1.targus-getdata1 > 112.26.2.8.42819: Flags [.], ack 619753, win 7639, options [nop,nop,TS val 82980 ecr 4294820954,mptcp dss ack 2859351171], length 0
17:11:30.709647 IP 112.26.2.1.targus-getdata1 > 112.26.2.8.42819: Flags [.], ack 621181, win 7639, options [nop,nop,TS val 83122 ecr 4294820954,mptcp dss ack 2859351171], length 0
17:11:30.870607 IP 112.26.2.1.targus-getdata1 > 112.26.2.8.42819: Flags [.], ack 621181, win 7639, options [nop,nop,TS val 83283 ecr 4294820954,nop,nop,sack 1 {622609:624037},mptcp dss ack 2859406863], length 0
17:11:31.148816 IP 112.26.2.1.targus-getdata1 > 112.26.2.8.42819: Flags [.], ack 621181, win 7639, options [nop,nop,TS val 83562 ecr 4294820954,nop,nop,sack 2 {625465:626893}{622609:624037},mptcp dss ack 2859406863], length 0
17:11:31.317115 IP 112.26.2.1.targus-getdata1 > 112.26.2.8.42819: Flags [.], ack 621181, win 7639, options [nop,nop,TS val 83730 ecr 4294820954,nop,nop,sack 2 {625465:628321}{622609:624037},mptcp dss ack 2859406863], length 0
17:11:31.474351 IP 112.26.2.1.targus-getdata1 > 112.26.2.8.42819: Flags [.], ack 621181, win 7639, options [nop,nop,TS val 83886 ecr 4294820954,nop,nop,sack 2 {625465:629749}{622609:624037},mptcp dss ack 2859406863], length 0
17:11:31.591698 IP 112.26.2.1.targus-getdata1 > 112.26.2.8.42819: Flags [.], ack 621181, win 7639, options [nop,nop,TS val 84004 ecr 4294820954,nop,nop,sack 2 {631177:632605}{625465:629749},mptcp dss ack 2859406863], length 0
17:11:31.810926 IP 112.26.2.1.targus-getdata1 > 112.26.2.8.42819: Flags [.], ack 621181, win 7639, options [nop,nop,TS val 84223 ecr 4294820954,nop,nop,sack 2 {634033:635461}{631177:632605},mptcp dss ack 2859415431], length 0
17:11:31.958590 IP 112.26.2.1.targus-getdata1 > 112.26.2.8.42819: Flags [.], ack 621181, win 7639, options [nop,nop,TS val 84371 ecr 4294820954,nop,nop,sack 2 {634033:636889}{631177:632605},mptcp dss ack 2859415431], length 0
17:11:32.083421 IP 112.26.2.1.targus-getdata1 > 112.26.2.8.42819: Flags [.], ack 621181, win 7639, options [nop,nop,TS val 84496 ecr 4294820954,nop,nop,sack 2 {634033:638317}{631177:632605},mptcp dss ack 2859415431], length 0
17:11:32.216686 IP 112.26.2.1.targus-getdata1 > 112.26.2.8.42819: Flags [.], ack 621181, win 7639, options [nop,nop,TS val 84629 ecr 4294820954,nop,nop,sack 2 {634033:639745}{631177:632605},mptcp dss ack 2859415431], length 0
17:11:32.387727 IP 112.26.2.1.targus-getdata1 > 112.26.2.8.42819: Flags [.], ack 621181, win 7639, options [nop,nop,TS val 84800 ecr 4294820954,nop,nop,sack 2 {634033:641173}{631177:632605},mptcp dss ack 2859415431], length 0
17:11:32.527407 IP 112.26.2.1.targus-getdata1 > 112.26.2.8.42819: Flags [.], ack 624037, win 7506, options [nop,nop,TS val 84940 ecr 4294822855,nop,nop,sack 2 {634033:641173}{631177:632605},mptcp dss ack 2859432567], length 0
17:11:32.738379 IP 112.26.2.1.targus-getdata1 > 112.26.2.8.42819: Flags [.], ack 629749, win 7557, options [nop,nop,TS val 85150 ecr 4294823220,nop,nop,sack 2 {634033:641173}{631177:632605},mptcp dss ack 2859451131], length 0
17:11:32.960109 IP 112.26.2.1.targus-getdata1 > 112.26.2.8.42819: Flags [.], ack 629749, win 7639, options [nop,nop,TS val 85373 ecr 4294823220,nop,nop,sack 2 {634033:642601}{631177:632605},mptcp dss ack 2859451131], length 0
17:11:33.120465 IP 112.26.2.1.targus-getdata1 > 112.26.2.8.42819: Flags [.], ack 632605, win 7579, options [nop,nop,TS val 85527 ecr 4294823695,nop,nop,sack 1 {634033:642601},mptcp dss ack 2859462555], length 0
17:11:33.294021 IP 112.26.2.1.targus-getdata1 > 112.26.2.8.42819: Flags [.], ack 642601, win 7571, options [nop,nop,TS val 85707 ecr 4294823776,mptcp dss ack 2859488259], length 0
17:11:33.460479 IP 112.26.2.1.targus-getdata1 > 112.26.2.8.42819: Flags [.], ack 644029, win 7639, options [nop,nop,TS val 85873 ecr 4294823932,mptcp dss ack 2859488259], length 0
17:11:33.592870 IP 112.26.2.1.targus-getdata1 > 112.26.2.8.42819: Flags [.], ack 645457, win 7639, options [nop,nop,TS val 86005 ecr 4294824023,mptcp dss ack 2859488259], length 0
17:11:33.736711 IP 112.26.2.1.targus-getdata1 > 112.26.2.8.42819: Flags [.], ack 646885, win 7639, options [nop,nop,TS val 86148 ecr 4294824196,mptcp dss ack 2859508251], length 0
17:11:33.826289 IP 112.26.2.1.targus-getdata1 > 112.26.2.8.42819: Flags [.], ack 648313, win 7639, options [nop,nop,TS val 86238 ecr 4294824279,mptcp dss ack 2859508251], length 0
17:11:34.007114 IP 112.26.2.1.targus-getdata1 > 112.26.2.8.42819: Flags [.], ack 649741, win 7639, options [nop,nop,TS val 86419 ecr 4294824279,mptcp dss ack 2859508251], length 0
17:11:34.084887 IP 112.26.2.1.targus-getdata1 > 112.26.2.8.42819: Flags [.], ack 651169, win 7639, options [nop,nop,TS val 86496 ecr 4294824492,mptcp dss ack 2859533955], length 0
17:11:34.289371 IP 112.26.2.1.targus-getdata1 > 112.26.2.8.42819: Flags [.], ack 652597, win 7639, options [nop,nop,TS val 86702 ecr 4294824713,mptcp dss ack 2859533955], length 0
17:11:34.451634 IP 112.26.2.1.targus-getdata1 > 112.26.2.8.42819: Flags [.], ack 654025, win 7639, options [nop,nop,TS val 86864 ecr 4294824877,mptcp dss ack 2859541095], length 0
17:11:34.607709 IP 112.26.2.1.targus-getdata1 > 112.26.2.8.42819: Flags [.], ack 655453, win 7639, options [nop,nop,TS val 87019 ecr 4294825045,mptcp dss ack 2859541095], length 0
17:11:34.750495 IP 112.26.2.1.targus-getdata1 > 112.26.2.8.42819: Flags [.], ack 656881, win 7639, options [nop,nop,TS val 87163 ecr 4294825175,mptcp dss ack 2859592503], length 0
17:11:34.912953 IP 112.26.2.1.targus-getdata1 > 112.26.2.8.42819: Flags [.], ack 658309, win 7639, options [nop,nop,TS val 87326 ecr 4294825320,mptcp dss ack 2859598215], length 0
17:11:35.063677 IP 112.26.2.1.targus-getdata1 > 112.26.2.8.42819: Flags [.], ack 659737, win 7639, options [nop,nop,TS val 87473 ecr 4294825470,mptcp dss ack 2859601071], length 0
17:11:35.256837 IP 112.26.2.1.targus-getdata1 > 112.26.2.8.42819: Flags [.], ack 661165, win 7639, options [nop,nop,TS val 87670 ecr 4294825470,mptcp dss ack 2859606783], length 0
17:11:35.366896 IP 112.26.2.1.targus-getdata1 > 112.26.2.8.42819: Flags [.], ack 662593, win 7639, options [nop,nop,TS val 87779 ecr 4294825668,mptcp dss ack 2859608211], length 0
17:11:35.605854 IP 112.26.2.1.targus-getdata1 > 112.26.2.8.42819: Flags [.], ack 665449, win 7639, options [nop,nop,TS val 88018 ecr 4294825835,mptcp dss ack 2859616779], length 0
17:11:35.890960 IP 112.26.2.1.targus-getdata1 > 112.26.2.8.42819: Flags [.], ack 666877, win 7639, options [nop,nop,TS val 88304 ecr 4294826126,mptcp dss ack 2859629631], length 0
17:11:36.094113 IP 112.26.2.1.targus-getdata1 > 112.26.2.8.42819: Flags [.], ack 669733, win 7639, options [nop,nop,TS val 88505 ecr 4294826308,mptcp dss ack 2859629631], length 0
17:11:36.332516 IP 112.26.2.1.targus-getdata1 > 112.26.2.8.42819: Flags [.], ack 672589, win 7639, options [nop,nop,TS val 88745 ecr 4294826622,mptcp dss ack 2859629631], length 0
17:11:36.667515 IP 112.26.2.1.targus-getdata1 > 112.26.2.8.42819: Flags [.], ack 674017, win 7639, options [nop,nop,TS val 89080 ecr 4294826934,mptcp dss ack 2859629631], length 0
17:11:36.832787 IP 112.26.2.1.targus-getdata1 > 112.26.2.8.42819: Flags [.], ack 676873, win 7639, options [nop,nop,TS val 89245 ecr 4294827172,mptcp dss ack 2859629631], length 0
17:11:37.169662 IP 112.26.2.1.targus-getdata1 > 112.26.2.8.42819: Flags [.], ack 679729, win 7639, options [nop,nop,TS val 89581 ecr 4294827233,mptcp dss ack 2859629631], length 0
17:11:37.429980 IP 112.26.2.1.targus-getdata1 > 112.26.2.8.42819: Flags [.], ack 682585, win 7639, options [nop,nop,TS val 89840 ecr 4294827531,mptcp dss ack 2859629631], length 0
17:11:37.638988 IP 112.26.2.1.targus-getdata1 > 112.26.2.8.42819: Flags [.], ack 685441, win 7639, options [nop,nop,TS val 90052 ecr 4294827988,mptcp dss ack 2859629631], length 0
17:11:37.852541 IP 112.26.2.1.targus-getdata1 > 112.26.2.8.42819: Flags [.], ack 686869, win 7639, options [nop,nop,TS val 90264 ecr 4294827988,nop,nop,sack 1 {688297:689725},mptcp dss ack 2859645339], length 0
17:11:38.011379 IP 112.26.2.1.targus-getdata1 > 112.26.2.8.42819: Flags [.], ack 686869, win 7639, options [nop,nop,TS val 90423 ecr 4294827988,nop,nop,sack 1 {688297:691153},mptcp dss ack 2859683895], length 0
17:11:38.160407 IP 112.26.2.1.targus-getdata1 > 112.26.2.8.42819: Flags [.], ack 686869, win 7639, options [nop,nop,TS val 90572 ecr 4294827988,nop,nop,sack 1 {688297:692581},mptcp dss ack 2859683895], length 0
17:11:38.302243 IP 112.26.2.1.targus-getdata1 > 112.26.2.8.42819: Flags [.], ack 686869, win 7639, options [nop,nop,TS val 90715 ecr 4294827988,nop,nop,sack 1 {688297:694009},mptcp dss ack 2859705315], length 0
17:11:38.405194 IP 112.26.2.1.targus-getdata1 > 112.26.2.8.42819: Flags [.], ack 686869, win 7639, options [nop,nop,TS val 90816 ecr 4294827988,nop,nop,sack 1 {688297:695437},mptcp dss ack 2859705315], length 0
17:11:38.558300 IP 112.26.2.1.targus-getdata1 > 112.26.2.8.42819: Flags [.], ack 686869, win 7639, options [nop,nop,TS val 90971 ecr 4294827988,nop,nop,sack 1 {688297:696865},mptcp dss ack 2859705315], length 0
17:11:38.725148 IP 112.26.2.1.targus-getdata1 > 112.26.2.8.42819: Flags [.], ack 686869, win 7639, options [nop,nop,TS val 91138 ecr 4294827988,nop,nop,sack 1 {688297:698293},mptcp dss ack 2859705315], length 0
17:11:38.870031 IP 112.26.2.1.targus-getdata1 > 112.26.2.8.42819: Flags [.], ack 686869, win 7639, options [nop,nop,TS val 91283 ecr 4294827988,nop,nop,sack 1 {688297:699721},mptcp dss ack 2859721023], length 0
17:11:38.948039 IP 112.26.2.1.targus-getdata1 > 112.26.2.8.42819: Flags [.], ack 686869, win 7639, options [nop,nop,TS val 91361 ecr 4294827988,nop,nop,sack 1 {688297:701149},mptcp dss ack 2859725307], length 0
17:11:39.063426 IP 112.26.2.1.targus-getdata1 > 112.26.2.8.42819: Flags [.], ack 686869, win 7639, options [nop,nop,TS val 91476 ecr 4294827988,nop,nop,sack 1 {688297:702577},mptcp dss ack 2859726735], length 0
17:11:39.187547 IP 112.26.2.1.targus-getdata1 > 112.26.2.8.42819: Flags [.], ack 686869, win 7639, options [nop,nop,TS val 91597 ecr 4294827988,nop,nop,sack 1 {688297:704005},mptcp dss ack 2859738159], length 0
17:11:39.347998 IP 112.26.2.1.targus-getdata1 > 112.26.2.8.42819: Flags [.], ack 686869, win 7639, options [nop,nop,TS val 91760 ecr 4294827988,nop,nop,sack 1 {688297:705433},mptcp dss ack 2859738159], length 0
17:11:39.569095 IP 112.26.2.1.targus-getdata1 > 112.26.2.8.42819: Flags [.], ack 686869, win 7639, options [nop,nop,TS val 91980 ecr 4294827988,nop,nop,sack 1 {688297:706861},mptcp dss ack 2859738159], length 0
17:11:39.653954 IP 112.26.2.1.targus-getdata1 > 112.26.2.8.42819: Flags [.], ack 686869, win 7639, options [nop,nop,TS val 92062 ecr 4294827988,nop,nop,sack 1 {688297:708289},mptcp dss ack 2859738159], length 0
17:11:39.763833 IP 112.26.2.1.targus-getdata1 > 112.26.2.8.42819: Flags [.], ack 686869, win 7639, options [nop,nop,TS val 92177 ecr 4294827988,nop,nop,sack 1 {688297:709717},mptcp dss ack 2859738159], length 0
17:11:39.848497 IP 112.26.2.1.targus-getdata1 > 112.26.2.8.42819: Flags [.], ack 686869, win 7639, options [nop,nop,TS val 92208 ecr 4294827988,nop,nop,sack 1 {688297:711145},mptcp dss ack 2859738159], length 0
17:11:39.969074 IP 112.26.2.1.targus-getdata1 > 112.26.2.8.42819: Flags [.], ack 686869, win 7639, options [nop,nop,TS val 92381 ecr 4294827988,nop,nop,sack 1 {688297:712573},mptcp dss ack 2859738159], length 0
17:11:40.106291 IP 112.26.2.1.targus-getdata1 > 112.26.2.8.42819: Flags [.], ack 712573, win 7423, options [nop,nop,TS val 92519 ecr 4294830205,mptcp dss ack 2859786711], length 0
17:11:40.315292 IP 112.26.2.1.targus-getdata1 > 112.26.2.8.42819: Flags [.], ack 714001, win 7639, options [nop,nop,TS val 92728 ecr 4294830212,mptcp dss ack 2859786711], length 0
17:11:40.416864 IP 112.26.2.1.targus-getdata1 > 112.26.2.8.42819: Flags [.], ack 715429, win 7639, options [nop,nop,TS val 92829 ecr 4294830521,mptcp dss ack 2859786711], length 0
17:11:40.662956 IP 112.26.2.1.targus-getdata1 > 112.26.2.8.42819: Flags [.], ack 716857, win 7639, options [nop,nop,TS val 93073 ecr 4294830802,mptcp dss ack 2859786711], length 0
17:11:40.746945 IP 112.26.2.1.targus-getdata1 > 112.26.2.8.42819: Flags [.], ack 718285, win 7639, options [nop,nop,TS val 93140 ecr 4294830921,mptcp dss ack 2859786711], length 0
17:11:40.864960 IP 112.26.2.1.targus-getdata1 > 112.26.2.8.42819: Flags [.], ack 719713, win 7639, options [nop,nop,TS val 93276 ecr 4294831069,mptcp dss ack 2859786711], length 0
17:11:40.982556 IP 112.26.2.1.targus-getdata1 > 112.26.2.8.42819: Flags [.], ack 721141, win 7639, options [nop,nop,TS val 93395 ecr 4294831307,mptcp dss ack 2859786711], length 0
17:11:41.147515 IP 112.26.2.1.targus-getdata1 > 112.26.2.8.42819: Flags [.], ack 722569, win 7574, options [nop,nop,TS val 93560 ecr 4294831386,mptcp dss ack 2859799563], length 0
17:11:41.401627 IP 112.26.2.1.targus-getdata1 > 112.26.2.8.42819: Flags [.], ack 723997, win 7639, options [nop,nop,TS val 93814 ecr 4294831885,mptcp dss ack 2859850971], length 0
17:11:41.488790 IP 112.26.2.1.targus-getdata1 > 112.26.2.8.42819: Flags [.], ack 725425, win 7639, options [nop,nop,TS val 93900 ecr 4294831963,mptcp dss ack 2859850971], length 0
17:11:41.662086 IP 112.26.2.1.targus-getdata1 > 112.26.2.8.42819: Flags [.], ack 726853, win 7639, options [nop,nop,TS val 94074 ecr 4294832101,mptcp dss ack 2859850971], length 0
17:11:41.714942 IP 112.26.2.1.targus-getdata1 > 112.26.2.8.42819: Flags [.], ack 728281, win 7639, options [nop,nop,TS val 94126 ecr 4294832155,mptcp dss ack 2859850971], length 0
17:11:41.922058 IP 112.26.2.1.targus-getdata1 > 112.26.2.8.42819: Flags [.], ack 729709, win 7639, options [nop,nop,TS val 94334 ecr 4294832235,mptcp dss ack 2859850971], length 0
17:11:42.122893 IP 112.26.2.1.targus-getdata1 > 112.26.2.8.42819: Flags [.], ack 729709, win 7639, options [nop,nop,TS val 94536 ecr 4294832235,nop,nop,sack 1 {732565:733993},mptcp dss ack 2859850971], length 0
17:11:42.243491 IP 112.26.2.1.targus-getdata1 > 112.26.2.8.42819: Flags [.], ack 729709, win 7639, options [nop,nop,TS val 94656 ecr 4294832235,nop,nop,sack 1 {732565:735421},mptcp dss ack 2859862395], length 0
17:11:42.389606 IP 112.26.2.1.targus-getdata1 > 112.26.2.8.42819: Flags [.], ack 729709, win 7639, options [nop,nop,TS val 94800 ecr 4294832235,nop,nop,sack 1 {732565:736849},mptcp dss ack 2859862395], length 0
17:11:42.500028 IP 112.26.2.1.targus-getdata1 > 112.26.2.8.42819: Flags [.], ack 729709, win 7639, options [nop,nop,TS val 94913 ecr 4294832235,nop,nop,sack 1 {732565:738277},mptcp dss ack 2859862395], length 0
17:11:42.679697 IP 112.26.2.1.targus-getdata1 > 112.26.2.8.42819: Flags [.], ack 729709, win 7639, options [nop,nop,TS val 95089 ecr 4294832235,nop,nop,sack 1 {732565:739705},mptcp dss ack 2859900951], length 0
17:11:42.827250 IP 112.26.2.1.targus-getdata1 > 112.26.2.8.42819: Flags [.], ack 729709, win 7639, options [nop,nop,TS val 95239 ecr 4294832235,nop,nop,sack 1 {732565:741133},mptcp dss ack 2859900951], length 0
17:11:42.900156 IP 112.26.2.1.targus-getdata1 > 112.26.2.8.42819: Flags [.], ack 729709, win 7639, options [nop,nop,TS val 95312 ecr 4294832235,nop,nop,sack 1 {732565:742561},mptcp dss ack 2859900951], length 0
17:11:43.140686 IP 112.26.2.1.targus-getdata1 > 112.26.2.8.42819: Flags [.], ack 729709, win 7639, options [nop,nop,TS val 95552 ecr 4294832235,nop,nop,sack 1 {732565:743989},mptcp dss ack 2859900951], length 0
17:11:43.233233 IP 112.26.2.1.targus-getdata1 > 112.26.2.8.42819: Flags [.], ack 729709, win 7639, options [nop,nop,TS val 95627 ecr 4294832235,nop,nop,sack 1 {732565:745417},mptcp dss ack 2859900951], length 0
17:11:43.397453 IP 112.26.2.1.targus-getdata1 > 112.26.2.8.42819: Flags [.], ack 729709, win 7639, options [nop,nop,TS val 95807 ecr 4294832235,nop,nop,sack 1 {732565:746845},mptcp dss ack 2859900951], length 0
17:11:43.537138 IP 112.26.2.1.targus-getdata1 > 112.26.2.8.42819: Flags [.], ack 729709, win 7639, options [nop,nop,TS val 95949 ecr 4294832235,nop,nop,sack 2 {748273:749701}{732565:746845},mptcp dss ack 2859900951], length 0
17:11:43.672755 IP 112.26.2.1.targus-getdata1 > 112.26.2.8.42819: Flags [.], ack 729709, win 7639, options [nop,nop,TS val 96085 ecr 4294832235,nop,nop,sack 2 {748273:751129}{732565:746845},mptcp dss ack 2859900951], length 0
17:11:43.799918 IP 112.26.2.1.targus-getdata1 > 112.26.2.8.42819: Flags [.], ack 729709, win 7639, options [nop,nop,TS val 96212 ecr 4294832235,nop,nop,sack 2 {748273:752557}{732565:746845},mptcp dss ack 2859900951], length 0
17:11:43.924994 IP 112.26.2.1.targus-getdata1 > 112.26.2.8.42819: Flags [.], ack 731137, win 7561, options [nop,nop,TS val 96337 ecr 4294834105,nop,nop,sack 2 {748273:752557}{732565:746845},mptcp dss ack 2859910947], length 0
17:11:44.071405 IP 112.26.2.1.targus-getdata1 > 112.26.2.8.42819: Flags [.], ack 746845, win 7472, options [nop,nop,TS val 96484 ecr 4294834220,nop,nop,sack 1 {748273:752557},mptcp dss ack 2859959499], length 0
17:11:44.211869 IP 112.26.2.1.targus-getdata1 > 112.26.2.8.42819: Flags [.], ack 746845, win 7639, options [nop,nop,TS val 96623 ecr 4294834220,nop,nop,sack 1 {748273:753985},mptcp dss ack 2859959499], length 0
17:11:44.365526 IP 112.26.2.1.targus-getdata1 > 112.26.2.8.42819: Flags [.], ack 746845, win 7639, options [nop,nop,TS val 96778 ecr 4294834220,nop,nop,sack 1 {748273:755413},mptcp dss ack 2859959499], length 0
17:11:44.593163 IP 112.26.2.1.targus-getdata1 > 112.26.2.8.42819: Flags [.], ack 746845, win 7639, options [nop,nop,TS val 97006 ecr 4294834220,nop,nop,sack 1 {748273:756841},mptcp dss ack 2859959499], length 0
17:11:44.755834 IP 112.26.2.1.targus-getdata1 > 112.26.2.8.42819: Flags [.], ack 746845, win 7639, options [nop,nop,TS val 97167 ecr 4294834220,nop,nop,sack 1 {748273:758269},mptcp dss ack 2859959499], length 0
17:11:44.845397 IP 112.26.2.1.targus-getdata1 > 112.26.2.8.42819: Flags [.], ack 758269, win 7512, options [nop,nop,TS val 97257 ecr 4294835384,mptcp dss ack 2859992343], length 0
17:11:44.989292 IP 112.26.2.1.targus-getdata1 > 112.26.2.8.42819: Flags [.], ack 759697, win 7639, options [nop,nop,TS val 97401 ecr 4294835498,mptcp dss ack 2859992343], length 0
17:11:45.131380 IP 112.26.2.1.targus-getdata1 > 112.26.2.8.42819: Flags [.], ack 761125, win 7639, options [nop,nop,TS val 97544 ecr 4294835541,mptcp dss ack 2859992343], length 0
17:11:45.329903 IP 112.26.2.1.targus-getdata1 > 112.26.2.8.42819: Flags [.], ack 762553, win 7639, options [nop,nop,TS val 97740 ecr 4294835646,mptcp dss ack 2859992343], length 0
17:11:45.403753 IP 112.26.2.1.targus-getdata1 > 112.26.2.8.42819: Flags [.], ack 763981, win 7639, options [nop,nop,TS val 97805 ecr 4294835646,mptcp dss ack 2859992343], length 0
17:11:45.612464 IP 112.26.2.1.targus-getdata1 > 112.26.2.8.42819: Flags [.], ack 765409, win 7639, options [nop,nop,TS val 98024 ecr 4294835900,mptcp dss ack 2859992343], length 0
17:11:45.765359 IP 112.26.2.1.targus-getdata1 > 112.26.2.8.42819: Flags [.], ack 766837, win 7639, options [nop,nop,TS val 98176 ecr 4294836174,mptcp dss ack 2859992343], length 0
17:11:45.845822 IP 112.26.2.1.targus-getdata1 > 112.26.2.8.42819: Flags [.], ack 768265, win 7639, options [nop,nop,TS val 98254 ecr 4294836245,mptcp dss ack 2860068027], length 0
17:11:46.035817 IP 112.26.2.1.targus-getdata1 > 112.26.2.8.42819: Flags [.], ack 769693, win 7639, options [nop,nop,TS val 98448 ecr 4294836515,mptcp dss ack 2860072311], length 0
17:11:46.199241 IP 112.26.2.1.targus-getdata1 > 112.26.2.8.42819: Flags [.], ack 771121, win 7639, options [nop,nop,TS val 98611 ecr 4294836668,mptcp dss ack 2860075167], length 0
17:11:46.354702 IP 112.26.2.1.targus-getdata1 > 112.26.2.8.42819: Flags [.], ack 772549, win 7639, options [nop,nop,TS val 98767 ecr 4294836680,mptcp dss ack 2860088019], length 0
17:11:46.514626 IP 112.26.2.1.targus-getdata1 > 112.26.2.8.42819: Flags [.], ack 773977, win 7639, options [nop,nop,TS val 98927 ecr 4294836908,mptcp dss ack 2860093731], length 0
17:11:46.622988 IP 112.26.2.1.targus-getdata1 > 112.26.2.8.42819: Flags [.], ack 775405, win 7639, options [nop,nop,TS val 99036 ecr 4294837001,mptcp dss ack 2860099443], length 0
17:11:46.817263 IP 112.26.2.1.targus-getdata1 > 112.26.2.8.42819: Flags [.], ack 776833, win 7639, options [nop,nop,TS val 99229 ecr 4294837122,mptcp dss ack 2860108011], length 0
17:11:46.893349 IP 112.26.2.1.targus-getdata1 > 112.26.2.8.42819: Flags [.], ack 778261, win 7639, options [nop,nop,TS val 99302 ecr 4294837229,mptcp dss ack 2860109439], length 0
