17:10:29.145133 IP 112.26.3.8.33985 > 112.26.3.1.targus-getdata1: Flags [S], seq 1637107685, win 65535, options [mss 1460,sackOK,TS val 4294760233 ecr 0,nop,wscale 6,mptcp join id 6 token 0x8f8bf6e7 nonce 0xa6f8b058], length 0
17:10:29.192276 IP 112.26.3.8.33985 > 112.26.3.1.targus-getdata1: Flags [S], seq 1637107685, win 65535, options [mss 1460,sackOK,TS val 4294760233 ecr 0,nop,wscale 6,mptcp join id 6 token 0x8f8bf6e7 nonce 0xa6f8b058], length 0
17:10:29.242069 IP 112.26.3.8.33985 > 112.26.3.1.targus-getdata1: Flags [S], seq 1637107685, win 65535, options [mss 1460,sackOK,TS val 4294760233 ecr 0,nop,wscale 6,mptcp join id 6 token 0x8f8bf6e7 nonce 0xa6f8b058], length 0
17:10:29.498086 IP 112.26.3.8.33985 > 112.26.3.1.targus-getdata1: Flags [.], ack 1411636189, win 2738, options [nop,nop,TS val 4294760551 ecr 21656,mptcp join hmac 0xf96a51dec3d50b921612a50ec1aefe21c13033a5], length 0
17:10:29.561155 IP 112.26.3.8.33985 > 112.26.3.1.targus-getdata1: Flags [.], ack 1, win 2738, options [nop,nop,TS val 4294760551 ecr 21656,mptcp join hmac 0xf96a51dec3d50b921612a50ec1aefe21c13033a5], length 0
17:10:29.564039 IP 112.26.3.8.33985 > 112.26.3.1.targus-getdata1: Flags [.], ack 1, win 2738, options [nop,nop,TS val 4294760551 ecr 21656,mptcp join hmac 0xf96a51dec3d50b921612a50ec1aefe21c13033a5], length 0
17:10:30.141869 IP 112.26.3.8.39939 > 112.26.3.1.targus-getdata1: Flags [S], seq 3809475384, win 65535, options [mss 1460,sackOK,TS val 4294761252 ecr 0,nop,wscale 6,mptcp join id 6 token 0x38f92c7e nonce 0x63b4e294], length 0
17:11:06.534131 IP 112.26.3.8.39939 > 112.26.3.1.targus-getdata1: Flags [.], seq 3809858089:3809859517, ack 2583660863, win 4107, options [nop,nop,TS val 4294796883 ecr 57503,mptcp dss ack 569926353 seq 2858367279 subseq 382705 len 1428 csum 0xc991], length 1428
17:11:06.540167 IP 112.26.3.1.targus-getdata1 > 112.26.3.8.39939: Flags [.], ack 4294950160, win 7639, options [nop,nop,TS val 58948 ecr 4294795179,nop,nop,sack 2 {4294954444:1428}{4294951588:4294953016},mptcp dss ack 2858287311], length 0
17:11:06.540459 IP 112.26.3.1.targus-getdata1 > 112.26.3.8.39939: Flags [.], ack 4294950160, win 7639, options [nop,nop,TS val 58948 ecr 4294795179,nop,nop,sack 2 {4294954444:1428}{4294951588:4294953016},mptcp dss ack 2858287311], length 0
17:11:06.641509 IP 112.26.3.8.39939 > 112.26.3.1.targus-getdata1: Flags [.], seq 1428:2856, ack 1, win 4107, options [nop,nop,TS val 4294797751 ecr 58358,mptcp dss ack 569926353 seq 2858402979 subseq 384133 len 1428 csum 0x5650], length 1428
17:11:06.641858 IP 112.26.3.8.39939 > 112.26.3.1.targus-getdata1: Flags [.], seq 1428:2856, ack 1, win 4107, options [nop,nop,TS val 4294797751 ecr 58358,mptcp dss ack 569926353 seq 2858402979 subseq 384133 len 1428 csum 0x5650], length 1428
17:11:06.675011 IP 112.26.3.8.39939 > 112.26.3.1.targus-getdata1: Flags [.], seq 4294950160:4294951588, ack 1, win 4107, options [nop,nop,TS val 4294797146 ecr 57749,mptcp dss ack 569926353 seq 2858287311 subseq 365569 len 1428 csum 0xaa], length 1428
17:11:06.687099 IP 112.26.3.1.targus-getdata1 > 112.26.3.8.39939: Flags [.], ack 4294953016, win 7483, options [nop,nop,TS val 59088 ecr 4294797146,nop,nop,sack 1 {4294954444:1428},mptcp dss ack 2858307303], length 0
17:11:06.687420 IP 112.26.3.1.targus-getdata1 > 112.26.3.8.39939: Flags [.], ack 4294953016, win 7483, options [nop,nop,TS val 59088 ecr 4294797146,nop,nop,sack 1 {4294954444:1428},mptcp dss ack 2858307303], length 0
17:11:06.792159 IP 112.26.3.8.39939 > 112.26.3.1.targus-getdata1: Flags [.], seq 2856:4284, ack 1, win 4107, options [nop,nop,TS val 4294797901 ecr 58503,mptcp dss ack 569926353 seq 2858407263 subseq 385561 len 1428 csum 0x6fbb], length 1428
17:11:06.792425 IP 112.26.3.8.39939 > 112.26.3.1.targus-getdata1: Flags [.], seq 2856:4284, ack 1, win 4107, options [nop,nop,TS val 4294797901 ecr 58503,mptcp dss ack 569926353 seq 2858407263 subseq 385561 len 1428 csum 0x6fbb], length 1428
17:11:06.862952 IP 112.26.3.8.39939 > 112.26.3.1.targus-getdata1: Flags [.], seq 4284:5712, ack 1, win 4107, options [nop,nop,TS val 4294797973 ecr 58620,mptcp dss ack 569926353 seq 2858414403 subseq 386989 len 1428 csum 0x988d], length 1428
17:11:06.863243 IP 112.26.3.8.39939 > 112.26.3.1.targus-getdata1: Flags [.], seq 4284:5712, ack 1, win 4107, options [nop,nop,TS val 4294797973 ecr 58620,mptcp dss ack 569926353 seq 2858414403 subseq 386989 len 1428 csum 0x988d], length 1428
17:11:06.890237 IP 112.26.3.8.39939 > 112.26.3.1.targus-getdata1: Flags [.], seq 4294953016:4294954444, ack 1, win 4107, options [nop,nop,TS val 4294797351 ecr 57982,mptcp dss ack 569926353 seq 2858307303 subseq 368425 len 1428 csum 0xdfe6], length 1428
17:11:06.900310 IP 112.26.3.1.targus-getdata1 > 112.26.3.8.39939: Flags [.], ack 1428, win 7490, options [nop,nop,TS val 59303 ecr 4294797351,mptcp dss ack 2858361567], length 0
17:11:06.900608 IP 112.26.3.1.targus-getdata1 > 112.26.3.8.39939: Flags [.], ack 1428, win 7490, options [nop,nop,TS val 59303 ecr 4294797351,mptcp dss ack 2858361567], length 0
17:11:06.971038 IP 112.26.3.8.39939 > 112.26.3.1.targus-getdata1: Flags [.], seq 5712:7140, ack 1, win 4107, options [nop,nop,TS val 4294798077 ecr 58740,mptcp dss ack 569926353 seq 2858431539 subseq 388417 len 1428 csum 0x1d21], length 1428
17:11:06.971305 IP 112.26.3.8.39939 > 112.26.3.1.targus-getdata1: Flags [.], seq 5712:7140, ack 1, win 4107, options [nop,nop,TS val 4294798077 ecr 58740,mptcp dss ack 569926353 seq 2858431539 subseq 388417 len 1428 csum 0x1d21], length 1428
17:11:07.038451 IP 112.26.3.8.39939 > 112.26.3.1.targus-getdata1: Flags [.], seq 7140:8568, ack 1, win 4107, options [nop,nop,TS val 4294798125 ecr 58859,mptcp dss ack 569926353 seq 2858435823 subseq 389845 len 1428 csum 0x20eb], length 1428
17:11:07.038774 IP 112.26.3.8.39939 > 112.26.3.1.targus-getdata1: Flags [.], seq 7140:8568, ack 1, win 4107, options [nop,nop,TS val 4294798125 ecr 58859,mptcp dss ack 569926353 seq 2858435823 subseq 389845 len 1428 csum 0x20eb], length 1428
17:11:07.128794 IP 112.26.3.8.39939 > 112.26.3.1.targus-getdata1: Flags [.], seq 8568:9996, ack 1, win 4107, options [nop,nop,TS val 4294798201 ecr 58948,mptcp dss ack 569926353 seq 2858438679 subseq 391273 len 1428 csum 0x24b3], length 1428
17:11:07.129141 IP 112.26.3.8.39939 > 112.26.3.1.targus-getdata1: Flags [.], seq 8568:9996, ack 1, win 4107, options [nop,nop,TS val 4294798201 ecr 58948,mptcp dss ack 569926353 seq 2858438679 subseq 391273 len 1428 csum 0x24b3], length 1428
17:11:07.157043 IP 112.26.3.8.39939 > 112.26.3.1.targus-getdata1: Flags [.], seq 1428:2856, ack 1, win 4107, options [nop,nop,TS val 4294797751 ecr 58358,mptcp dss ack 569926353 seq 2858402979 subseq 384133 len 1428 csum 0x5650], length 1428
17:11:07.192036 IP 112.26.3.1.targus-getdata1 > 112.26.3.8.39939: Flags [.], ack 2856, win 7639, options [nop,nop,TS val 59571 ecr 4294797751,mptcp dss ack 2858361567], length 0
17:11:07.192377 IP 112.26.3.1.targus-getdata1 > 112.26.3.8.39939: Flags [.], ack 2856, win 7639, options [nop,nop,TS val 59571 ecr 4294797751,mptcp dss ack 2858361567], length 0
17:11:07.247605 IP 112.26.3.8.39939 > 112.26.3.1.targus-getdata1: Flags [.], seq 9996:11424, ack 1, win 4107, options [nop,nop,TS val 4294798351 ecr 59088,mptcp dss ack 569926353 seq 2858448675 subseq 392701 len 1428 csum 0xc892], length 1428
17:11:07.247888 IP 112.26.3.8.39939 > 112.26.3.1.targus-getdata1: Flags [.], seq 9996:11424, ack 1, win 4107, options [nop,nop,TS val 4294798351 ecr 59088,mptcp dss ack 569926353 seq 2858448675 subseq 392701 len 1428 csum 0xc892], length 1428
17:11:07.307706 IP 112.26.3.8.39939 > 112.26.3.1.targus-getdata1: Flags [.], seq 2856:4284, ack 1, win 4107, options [nop,nop,TS val 4294797901 ecr 58503,mptcp dss ack 569926353 seq 2858407263 subseq 385561 len 1428 csum 0x6fbb], length 1428
17:11:07.317556 IP 112.26.3.1.targus-getdata1 > 112.26.3.8.39939: Flags [.], ack 4284, win 7639, options [nop,nop,TS val 59721 ecr 4294797901,mptcp dss ack 2858361567], length 0
17:11:07.317866 IP 112.26.3.1.targus-getdata1 > 112.26.3.8.39939: Flags [.], ack 4284, win 7639, options [nop,nop,TS val 59721 ecr 4294797901,mptcp dss ack 2858361567], length 0
17:11:07.392212 IP 112.26.3.8.39939 > 112.26.3.1.targus-getdata1: Flags [.], seq 4284:5712, ack 1, win 4107, options [nop,nop,TS val 4294797973 ecr 58620,mptcp dss ack 569926353 seq 2858414403 subseq 386989 len 1428 csum 0x988d], length 1428
17:11:07.399851 IP 112.26.3.1.targus-getdata1 > 112.26.3.8.39939: Flags [.], ack 5712, win 7639, options [nop,nop,TS val 59805 ecr 4294797973,mptcp dss ack 2858361567], length 0
17:11:07.400111 IP 112.26.3.1.targus-getdata1 > 112.26.3.8.39939: Flags [.], ack 5712, win 7639, options [nop,nop,TS val 59805 ecr 4294797973,mptcp dss ack 2858361567], length 0
17:11:07.505522 IP 112.26.3.8.39939 > 112.26.3.1.targus-getdata1: Flags [.], seq 11424:12852, ack 1, win 4107, options [nop,nop,TS val 4294798614 ecr 59303,mptcp dss ack 569926353 seq 2858465811 subseq 394129 len 1428 csum 0x1a2e], length 1428
17:11:07.505883 IP 112.26.3.8.39939 > 112.26.3.1.targus-getdata1: Flags [.], seq 11424:12852, ack 1, win 4107, options [nop,nop,TS val 4294798614 ecr 59303,mptcp dss ack 569926353 seq 2858465811 subseq 394129 len 1428 csum 0x1a2e], length 1428
17:11:07.572951 IP 112.26.3.8.39939 > 112.26.3.1.targus-getdata1: Flags [.], seq 5712:7140, ack 1, win 4107, options [nop,nop,TS val 4294798077 ecr 58740,mptcp dss ack 569926353 seq 2858431539 subseq 388417 len 1428 csum 0x1d21], length 1428
17:11:07.589350 IP 112.26.3.1.targus-getdata1 > 112.26.3.8.39939: Flags [.], ack 7140, win 7639, options [nop,nop,TS val 59986 ecr 4294798077,mptcp dss ack 2858361567], length 0
17:11:07.589675 IP 112.26.3.1.targus-getdata1 > 112.26.3.8.39939: Flags [.], ack 7140, win 7639, options [nop,nop,TS val 59986 ecr 4294798077,mptcp dss ack 2858361567], length 0
17:11:07.679406 IP 112.26.3.1.targus-getdata1 > 112.26.3.8.39939: Flags [.], ack 8568, win 7639, options [nop,nop,TS val 60090 ecr 4294798125,mptcp dss ack 2858361567], length 0
17:11:07.679736 IP 112.26.3.1.targus-getdata1 > 112.26.3.8.39939: Flags [.], ack 8568, win 7639, options [nop,nop,TS val 60090 ecr 4294798125,mptcp dss ack 2858361567], length 0
17:11:07.682667 IP 112.26.3.8.39939 > 112.26.3.1.targus-getdata1: Flags [.], seq 7140:8568, ack 1, win 4107, options [nop,nop,TS val 4294798125 ecr 58859,mptcp dss ack 569926353 seq 2858435823 subseq 389845 len 1428 csum 0x20eb], length 1428
17:11:07.803529 IP 112.26.3.8.39939 > 112.26.3.1.targus-getdata1: Flags [.], seq 8568:9996, ack 1, win 4107, options [nop,nop,TS val 4294798201 ecr 58948,mptcp dss ack 569926353 seq 2858438679 subseq 391273 len 1428 csum 0x24b3], length 1428
17:11:07.807657 IP 112.26.3.1.targus-getdata1 > 112.26.3.8.39939: Flags [.], ack 9996, win 7639, options [nop,nop,TS val 60217 ecr 4294798201,mptcp dss ack 2858361567], length 0
17:11:07.807915 IP 112.26.3.1.targus-getdata1 > 112.26.3.8.39939: Flags [.], ack 9996, win 7639, options [nop,nop,TS val 60217 ecr 4294798201,mptcp dss ack 2858361567], length 0
17:11:07.848623 IP 112.26.3.8.39939 > 112.26.3.1.targus-getdata1: Flags [.], seq 12852:14280, ack 1, win 4107, options [nop,nop,TS val 4294798954 ecr 59571,mptcp dss ack 569926353 seq 2858471523 subseq 395557 len 1428 csum 0x236d], length 1428
17:11:07.848938 IP 112.26.3.8.39939 > 112.26.3.1.targus-getdata1: Flags [.], seq 12852:14280, ack 1, win 4107, options [nop,nop,TS val 4294798954 ecr 59571,mptcp dss ack 569926353 seq 2858471523 subseq 395557 len 1428 csum 0x236d], length 1428
17:11:07.926279 IP 112.26.3.8.39939 > 112.26.3.1.targus-getdata1: Flags [.], seq 9996:11424, ack 1, win 4107, options [nop,nop,TS val 4294798351 ecr 59088,mptcp dss ack 569926353 seq 2858448675 subseq 392701 len 1428 csum 0xc892], length 1428
17:11:07.932227 IP 112.26.3.1.targus-getdata1 > 112.26.3.8.39939: Flags [.], ack 11424, win 7639, options [nop,nop,TS val 60339 ecr 4294798351,mptcp dss ack 2858361567], length 0
17:11:07.932482 IP 112.26.3.1.targus-getdata1 > 112.26.3.8.39939: Flags [.], ack 11424, win 7639, options [nop,nop,TS val 60339 ecr 4294798351,mptcp dss ack 2858361567], length 0
17:11:08.008183 IP 112.26.3.8.39939 > 112.26.3.1.targus-getdata1: Flags [.], seq 14280:15708, ack 1, win 4107, options [nop,nop,TS val 4294799117 ecr 59721,mptcp dss ack 569926353 seq 2858474379 subseq 396985 len 1428 csum 0xc2f0], length 1428
17:11:08.008494 IP 112.26.3.8.39939 > 112.26.3.1.targus-getdata1: Flags [.], seq 14280:15708, ack 1, win 4107, options [nop,nop,TS val 4294799117 ecr 59721,mptcp dss ack 569926353 seq 2858474379 subseq 396985 len 1428 csum 0xc2f0], length 1428
17:11:08.123192 IP 112.26.3.8.39939 > 112.26.3.1.targus-getdata1: Flags [.], seq 15708:17136, ack 1, win 4107, options [nop,nop,TS val 4294799176 ecr 59805,mptcp dss ack 569926353 seq 2858475807 subseq 398413 len 1428 csum 0x4abb], length 1428
17:11:08.123540 IP 112.26.3.8.39939 > 112.26.3.1.targus-getdata1: Flags [.], seq 15708:17136, ack 1, win 4107, options [nop,nop,TS val 4294799176 ecr 59805,mptcp dss ack 569926353 seq 2858475807 subseq 398413 len 1428 csum 0x4abb], length 1428
17:11:08.151798 IP 112.26.3.1.targus-getdata1 > 112.26.3.8.39939: Flags [.], ack 12852, win 7639, options [nop,nop,TS val 60561 ecr 4294798614,mptcp dss ack 2858361567], length 0
17:11:08.152043 IP 112.26.3.1.targus-getdata1 > 112.26.3.8.39939: Flags [.], ack 12852, win 7639, options [nop,nop,TS val 60561 ecr 4294798614,mptcp dss ack 2858361567], length 0
17:11:08.160056 IP 112.26.3.8.39939 > 112.26.3.1.targus-getdata1: Flags [.], seq 11424:12852, ack 1, win 4107, options [nop,nop,TS val 4294798614 ecr 59303,mptcp dss ack 569926353 seq 2858465811 subseq 394129 len 1428 csum 0x1a2e], length 1428
17:11:08.220099 IP 112.26.3.8.39939 > 112.26.3.1.targus-getdata1: Flags [.], seq 17136:18564, ack 1, win 4107, options [nop,nop,TS val 4294799176 ecr 59805,mptcp dss ack 569926353 seq 2858477235 subseq 399841 len 1428 csum 0x4ff7], length 1428
17:11:08.220333 IP 112.26.3.8.39939 > 112.26.3.1.targus-getdata1: Flags [.], seq 17136:18564, ack 1, win 4107, options [nop,nop,TS val 4294799176 ecr 59805,mptcp dss ack 569926353 seq 2858477235 subseq 399841 len 1428 csum 0x4ff7], length 1428
17:11:08.280249 IP 112.26.3.8.39939 > 112.26.3.1.targus-getdata1: Flags [.], seq 18564:19992, ack 1, win 4107, options [nop,nop,TS val 4294799363 ecr 59986,mptcp dss ack 569926353 seq 2858488659 subseq 401269 len 1428 csum 0xb903], length 1428
17:11:08.280610 IP 112.26.3.8.39939 > 112.26.3.1.targus-getdata1: Flags [.], seq 18564:19992, ack 1, win 4107, options [nop,nop,TS val 4294799363 ecr 59986,mptcp dss ack 569926353 seq 2858488659 subseq 401269 len 1428 csum 0xb903], length 1428
17:11:08.327722 IP 112.26.3.8.39939 > 112.26.3.1.targus-getdata1: Flags [.], seq 19992:21420, ack 1, win 4107, options [nop,nop,TS val 4294799420 ecr 60090,mptcp dss ack 569926353 seq 2858490087 subseq 402697 len 1428 csum 0xe2c6], length 1428
17:11:08.328015 IP 112.26.3.8.39939 > 112.26.3.1.targus-getdata1: Flags [.], seq 19992:21420, ack 1, win 4107, options [nop,nop,TS val 4294799420 ecr 60090,mptcp dss ack 569926353 seq 2858490087 subseq 402697 len 1428 csum 0xe2c6], length 1428
17:11:08.390009 IP 112.26.3.8.39939 > 112.26.3.1.targus-getdata1: Flags [.], seq 21420:22848, ack 1, win 4107, options [nop,nop,TS val 4294799474 ecr 60217,mptcp dss ack 569926353 seq 2858491515 subseq 404125 len 1428 csum 0xc661], length 1428
17:11:08.390220 IP 112.26.3.8.39939 > 112.26.3.1.targus-getdata1: Flags [.], seq 21420:22848, ack 1, win 4107, options [nop,nop,TS val 4294799474 ecr 60217,mptcp dss ack 569926353 seq 2858491515 subseq 404125 len 1428 csum 0xc661], length 1428
17:11:08.428395 IP 112.26.3.8.39939 > 112.26.3.1.targus-getdata1: Flags [.], seq 12852:14280, ack 1, win 4107, options [nop,nop,TS val 4294798954 ecr 59571,mptcp dss ack 569926353 seq 2858471523 subseq 395557 len 1428 csum 0x236d], length 1428
17:11:08.431939 IP 112.26.3.1.targus-getdata1 > 112.26.3.8.39939: Flags [.], ack 14280, win 7639, options [nop,nop,TS val 60842 ecr 4294798954,mptcp dss ack 2858361567], length 0
17:11:08.432291 IP 112.26.3.1.targus-getdata1 > 112.26.3.8.39939: Flags [.], ack 14280, win 7639, options [nop,nop,TS val 60842 ecr 4294798954,mptcp dss ack 2858361567], length 0
17:11:08.490694 IP 112.26.3.8.39939 > 112.26.3.1.targus-getdata1: Flags [.], seq 22848:24276, ack 1, win 4107, options [nop,nop,TS val 4294799599 ecr 60339,mptcp dss ack 569926353 seq 2858495799 subseq 405553 len 1428 csum 0x51f4], length 1428
17:11:08.490960 IP 112.26.3.8.39939 > 112.26.3.1.targus-getdata1: Flags [.], seq 22848:24276, ack 1, win 4107, options [nop,nop,TS val 4294799599 ecr 60339,mptcp dss ack 569926353 seq 2858495799 subseq 405553 len 1428 csum 0x51f4], length 1428
17:11:08.573578 IP 112.26.3.8.39939 > 112.26.3.1.targus-getdata1: Flags [.], seq 14280:15708, ack 1, win 4107, options [nop,nop,TS val 4294799117 ecr 59721,mptcp dss ack 569926353 seq 2858474379 subseq 396985 len 1428 csum 0xc2f0], length 1428
17:11:08.584615 IP 112.26.3.1.targus-getdata1 > 112.26.3.8.39939: Flags [.], ack 15708, win 7639, options [nop,nop,TS val 60987 ecr 4294799117,mptcp dss ack 2858361567], length 0
17:11:08.584802 IP 112.26.3.1.targus-getdata1 > 112.26.3.8.39939: Flags [.], ack 15708, win 7639, options [nop,nop,TS val 60987 ecr 4294799117,mptcp dss ack 2858361567], length 0
17:11:08.668620 IP 112.26.3.8.39939 > 112.26.3.1.targus-getdata1: Flags [.], seq 15708:17136, ack 1, win 4107, options [nop,nop,TS val 4294799176 ecr 59805,mptcp dss ack 569926353 seq 2858475807 subseq 398413 len 1428 csum 0x4abb], length 1428
17:11:08.711685 IP 112.26.3.1.targus-getdata1 > 112.26.3.8.39939: Flags [.], ack 17136, win 7639, options [nop,nop,TS val 61082 ecr 4294799176,mptcp dss ack 2858361567], length 0
17:11:08.711923 IP 112.26.3.1.targus-getdata1 > 112.26.3.8.39939: Flags [.], ack 17136, win 7639, options [nop,nop,TS val 61082 ecr 4294799176,mptcp dss ack 2858361567], length 0
17:11:08.752121 IP 112.26.3.8.39939 > 112.26.3.1.targus-getdata1: Flags [.], seq 24276:25704, ack 1, win 4107, options [nop,nop,TS val 4294799863 ecr 60561,mptcp dss ack 569926353 seq 2858514363 subseq 406981 len 1428 csum 0x52e9], length 1428
17:11:08.752391 IP 112.26.3.8.39939 > 112.26.3.1.targus-getdata1: Flags [.], seq 24276:25704, ack 1, win 4107, options [nop,nop,TS val 4294799863 ecr 60561,mptcp dss ack 569926353 seq 2858514363 subseq 406981 len 1428 csum 0x52e9], length 1428
17:11:08.816631 IP 112.26.3.8.39939 > 112.26.3.1.targus-getdata1: Flags [.], seq 17136:18564, ack 1, win 4107, options [nop,nop,TS val 4294799176 ecr 59805,mptcp dss ack 569926353 seq 2858477235 subseq 399841 len 1428 csum 0x4ff7], length 1428
17:11:08.827772 IP 112.26.3.1.targus-getdata1 > 112.26.3.8.39939: Flags [.], ack 18564, win 7639, options [nop,nop,TS val 61230 ecr 4294799176,mptcp dss ack 2858361567], length 0
17:11:08.828033 IP 112.26.3.1.targus-getdata1 > 112.26.3.8.39939: Flags [.], ack 18564, win 7639, options [nop,nop,TS val 61230 ecr 4294799176,mptcp dss ack 2858361567], length 0
17:11:08.911374 IP 112.26.3.8.39939 > 112.26.3.1.targus-getdata1: Flags [.], seq 18564:19992, ack 1, win 4107, options [nop,nop,TS val 4294799363 ecr 59986,mptcp dss ack 569926353 seq 2858488659 subseq 401269 len 1428 csum 0xb903], length 1428
17:11:08.926790 IP 112.26.3.1.targus-getdata1 > 112.26.3.8.39939: Flags [.], ack 19992, win 7639, options [nop,nop,TS val 61324 ecr 4294799363,mptcp dss ack 2858361567], length 0
17:11:08.927005 IP 112.26.3.1.targus-getdata1 > 112.26.3.8.39939: Flags [.], ack 19992, win 7639, options [nop,nop,TS val 61324 ecr 4294799363,mptcp dss ack 2858361567], length 0
17:11:09.000496 IP 112.26.3.8.39939 > 112.26.3.1.targus-getdata1: Flags [.], seq 19992:21420, ack 1, win 4107, options [nop,nop,TS val 4294799420 ecr 60090,mptcp dss ack 569926353 seq 2858490087 subseq 402697 len 1428 csum 0xe2c6], length 1428
17:11:09.031726 IP 112.26.3.1.targus-getdata1 > 112.26.3.8.39939: Flags [.], ack 21420, win 7639, options [nop,nop,TS val 61413 ecr 4294799420,mptcp dss ack 2858361567], length 0
17:11:09.031980 IP 112.26.3.1.targus-getdata1 > 112.26.3.8.39939: Flags [.], ack 21420, win 7639, options [nop,nop,TS val 61413 ecr 4294799420,mptcp dss ack 2858361567], length 0
17:11:09.096092 IP 112.26.3.8.39939 > 112.26.3.1.targus-getdata1: Flags [.], seq 21420:22848, ack 1, win 4107, options [nop,nop,TS val 4294799474 ecr 60217,mptcp dss ack 569926353 seq 2858491515 subseq 404125 len 1428 csum 0xc661], length 1428
17:11:09.147551 IP 112.26.3.1.targus-getdata1 > 112.26.3.8.39939: Flags [.], ack 22848, win 7639, options [nop,nop,TS val 61550 ecr 4294799474,mptcp dss ack 2858361567], length 0
17:11:09.147802 IP 112.26.3.1.targus-getdata1 > 112.26.3.8.39939: Flags [.], ack 22848, win 7639, options [nop,nop,TS val 61550 ecr 4294799474,mptcp dss ack 2858361567], length 0
17:11:09.208069 IP 112.26.3.8.39939 > 112.26.3.1.targus-getdata1: Flags [.], seq 25704:27132, ack 1, win 4107, options [nop,nop,TS val 4294800313 ecr 60842,mptcp dss ack 569926353 seq 2858527215 subseq 408409 len 1428 csum 0x3526], length 1428
17:11:09.208299 IP 112.26.3.8.39939 > 112.26.3.1.targus-getdata1: Flags [.], seq 25704:27132, ack 1, win 4107, options [nop,nop,TS val 4294800313 ecr 60842,mptcp dss ack 569926353 seq 2858527215 subseq 408409 len 1428 csum 0x3526], length 1428
17:11:09.262910 IP 112.26.3.8.39939 > 112.26.3.1.targus-getdata1: Flags [.], seq 22848:24276, ack 1, win 4107, options [nop,nop,TS val 4294799599 ecr 60339,mptcp dss ack 569926353 seq 2858495799 subseq 405553 len 1428 csum 0x51f4], length 1428
17:11:09.342310 IP 112.26.3.8.39939 > 112.26.3.1.targus-getdata1: Flags [.], seq 27132:28560, ack 1, win 4107, options [nop,nop,TS val 4294800451 ecr 60987,mptcp dss ack 569926353 seq 2858530071 subseq 409837 len 1428 csum 0xcec1], length 1428
17:11:09.342515 IP 112.26.3.8.39939 > 112.26.3.1.targus-getdata1: Flags [.], seq 27132:28560, ack 1, win 4107, options [nop,nop,TS val 4294800451 ecr 60987,mptcp dss ack 569926353 seq 2858530071 subseq 409837 len 1428 csum 0xcec1], length 1428
17:11:09.379231 IP 112.26.3.1.targus-getdata1 > 112.26.3.8.39939: Flags [.], ack 24276, win 7639, options [nop,nop,TS val 61760 ecr 4294799599,mptcp dss ack 2858361567], length 0
17:11:09.379415 IP 112.26.3.1.targus-getdata1 > 112.26.3.8.39939: Flags [.], ack 24276, win 7639, options [nop,nop,TS val 61760 ecr 4294799599,mptcp dss ack 2858361567], length 0
17:11:09.415578 IP 112.26.3.8.39939 > 112.26.3.1.targus-getdata1: Flags [.], seq 28560:29988, ack 1, win 4107, options [nop,nop,TS val 4294800525 ecr 61082,mptcp dss ack 569926353 seq 2858532927 subseq 411265 len 1428 csum 0xb342], length 1428
17:11:09.415878 IP 112.26.3.8.39939 > 112.26.3.1.targus-getdata1: Flags [.], seq 28560:29988, ack 1, win 4107, options [nop,nop,TS val 4294800525 ecr 61082,mptcp dss ack 569926353 seq 2858532927 subseq 411265 len 1428 csum 0xb342], length 1428
17:11:09.488263 IP 112.26.3.8.39939 > 112.26.3.1.targus-getdata1: Flags [.], seq 24276:25704, ack 1, win 4107, options [nop,nop,TS val 4294799863 ecr 60561,mptcp dss ack 569926353 seq 2858514363 subseq 406981 len 1428 csum 0x52e9], length 1428
17:11:09.534586 IP 112.26.3.8.39939 > 112.26.3.1.targus-getdata1: Flags [.], seq 29988:31416, ack 1, win 4107, options [nop,nop,TS val 4294800644 ecr 61230,mptcp dss ack 569926353 seq 2858537211 subseq 412693 len 1428 csum 0x2da9], length 1428
17:11:09.534852 IP 112.26.3.8.39939 > 112.26.3.1.targus-getdata1: Flags [.], seq 29988:31416, ack 1, win 4107, options [nop,nop,TS val 4294800644 ecr 61230,mptcp dss ack 569926353 seq 2858537211 subseq 412693 len 1428 csum 0x2da9], length 1428
17:11:09.589865 IP 112.26.3.8.39939 > 112.26.3.1.targus-getdata1: Flags [.], seq 31416:32844, ack 1, win 4107, options [nop,nop,TS val 4294800644 ecr 61230,mptcp dss ack 569926353 seq 2858538639 subseq 414121 len 1428 csum 0x840d], length 1428
17:11:09.590142 IP 112.26.3.8.39939 > 112.26.3.1.targus-getdata1: Flags [.], seq 31416:32844, ack 1, win 4107, options [nop,nop,TS val 4294800644 ecr 61230,mptcp dss ack 569926353 seq 2858538639 subseq 414121 len 1428 csum 0x840d], length 1428
17:11:09.631190 IP 112.26.3.8.39939 > 112.26.3.1.targus-getdata1: Flags [.], seq 32844:34272, ack 1, win 4107, options [nop,nop,TS val 4294800740 ecr 61324,mptcp dss ack 569926353 seq 2858542923 subseq 415549 len 1428 csum 0x78ea], length 1428
17:11:09.631465 IP 112.26.3.8.39939 > 112.26.3.1.targus-getdata1: Flags [.], seq 32844:34272, ack 1, win 4107, options [nop,nop,TS val 4294800740 ecr 61324,mptcp dss ack 569926353 seq 2858542923 subseq 415549 len 1428 csum 0x78ea], length 1428
17:11:09.657715 IP 112.26.3.1.targus-getdata1 > 112.26.3.8.39939: Flags [.], ack 25704, win 7506, options [nop,nop,TS val 62064 ecr 4294799863,mptcp dss ack 2858378703], length 0
17:11:09.657935 IP 112.26.3.1.targus-getdata1 > 112.26.3.8.39939: Flags [.], ack 25704, win 7506, options [nop,nop,TS val 62064 ecr 4294799863,mptcp dss ack 2858378703], length 0
17:11:09.711672 IP 112.26.3.8.39939 > 112.26.3.1.targus-getdata1: Flags [.], seq 34272:35700, ack 1, win 4107, options [nop,nop,TS val 4294800780 ecr 61413,mptcp dss ack 569926353 seq 2858544351 subseq 416977 len 1428 csum 0xc7ab], length 1428
17:11:09.711922 IP 112.26.3.8.39939 > 112.26.3.1.targus-getdata1: Flags [.], seq 34272:35700, ack 1, win 4107, options [nop,nop,TS val 4294800780 ecr 61413,mptcp dss ack 569926353 seq 2858544351 subseq 416977 len 1428 csum 0xc7ab], length 1428
17:11:09.777061 IP 112.26.3.8.39939 > 112.26.3.1.targus-getdata1: Flags [.], seq 35700:37128, ack 1, win 4107, options [nop,nop,TS val 4294800814 ecr 61550,mptcp dss ack 569926353 seq 2858545779 subseq 418405 len 1428 csum 0x8afd], length 1428
17:11:09.777338 IP 112.26.3.8.39939 > 112.26.3.1.targus-getdata1: Flags [.], seq 35700:37128, ack 1, win 4107, options [nop,nop,TS val 4294800814 ecr 61550,mptcp dss ack 569926353 seq 2858545779 subseq 418405 len 1428 csum 0x8afd], length 1428
17:11:09.799449 IP 112.26.3.8.39939 > 112.26.3.1.targus-getdata1: Flags [.], seq 25704:27132, ack 1, win 4107, options [nop,nop,TS val 4294800313 ecr 60842,mptcp dss ack 569926353 seq 2858527215 subseq 408409 len 1428 csum 0x3526], length 1428
17:11:09.932134 IP 112.26.3.8.39939 > 112.26.3.1.targus-getdata1: Flags [.], seq 27132:28560, ack 1, win 4107, options [nop,nop,TS val 4294800451 ecr 60987,mptcp dss ack 569926353 seq 2858530071 subseq 409837 len 1428 csum 0xcec1], length 1428
17:11:09.938828 IP 112.26.3.1.targus-getdata1 > 112.26.3.8.39939: Flags [.], ack 28560, win 7606, options [nop,nop,TS val 62346 ecr 4294800313,mptcp dss ack 2858445819], length 0
17:11:09.939086 IP 112.26.3.1.targus-getdata1 > 112.26.3.8.39939: Flags [.], ack 28560, win 7606, options [nop,nop,TS val 62346 ecr 4294800313,mptcp dss ack 2858445819], length 0
17:11:10.022593 IP 112.26.3.8.39939 > 112.26.3.1.targus-getdata1: Flags [.], seq 37128:38556, ack 1, win 4107, options [nop,nop,TS val 4294801127 ecr 61760,mptcp dss ack 569926353 seq 2858560059 subseq 419833 len 1428 csum 0x11e9], length 1428
17:11:10.022826 IP 112.26.3.8.39939 > 112.26.3.1.targus-getdata1: Flags [.], seq 37128:38556, ack 1, win 4107, options [nop,nop,TS val 4294801127 ecr 61760,mptcp dss ack 569926353 seq 2858560059 subseq 419833 len 1428 csum 0x11e9], length 1428
17:11:10.079356 IP 112.26.3.8.39939 > 112.26.3.1.targus-getdata1: Flags [.], seq 28560:29988, ack 1, win 4107, options [nop,nop,TS val 4294800525 ecr 61082,mptcp dss ack 569926353 seq 2858532927 subseq 411265 len 1428 csum 0xb342], length 1428
17:11:10.174727 IP 112.26.3.8.39939 > 112.26.3.1.targus-getdata1: Flags [.], seq 29988:31416, ack 1, win 4107, options [nop,nop,TS val 4294800644 ecr 61230,mptcp dss ack 569926353 seq 2858537211 subseq 412693 len 1428 csum 0x2da9], length 1428
17:11:10.239166 IP 112.26.3.8.39939 > 112.26.3.1.targus-getdata1: Flags [.], seq 31416:32844, ack 1, win 4107, options [nop,nop,TS val 4294800644 ecr 61230,mptcp dss ack 569926353 seq 2858538639 subseq 414121 len 1428 csum 0x840d], length 1428
17:11:10.335218 IP 112.26.3.8.39939 > 112.26.3.1.targus-getdata1: Flags [.], seq 32844:34272, ack 1, win 4107, options [nop,nop,TS val 4294800740 ecr 61324,mptcp dss ack 569926353 seq 2858542923 subseq 415549 len 1428 csum 0x78ea], length 1428
17:11:10.341180 IP 112.26.3.1.targus-getdata1 > 112.26.3.8.39939: Flags [.], ack 34272, win 7606, options [nop,nop,TS val 62749 ecr 4294800525,mptcp dss ack 2858445819], length 0
17:11:10.341397 IP 112.26.3.1.targus-getdata1 > 112.26.3.8.39939: Flags [.], ack 34272, win 7606, options [nop,nop,TS val 62749 ecr 4294800525,mptcp dss ack 2858445819], length 0
17:11:10.438485 IP 112.26.3.8.39939 > 112.26.3.1.targus-getdata1: Flags [.], seq 34272:35700, ack 1, win 4107, options [nop,nop,TS val 4294800780 ecr 61413,mptcp dss ack 569926353 seq 2858544351 subseq 416977 len 1428 csum 0xc7ab], length 1428
17:11:10.504135 IP 112.26.3.8.39939 > 112.26.3.1.targus-getdata1: Flags [.], seq 35700:37128, ack 1, win 4107, options [nop,nop,TS val 4294800814 ecr 61550,mptcp dss ack 569926353 seq 2858545779 subseq 418405 len 1428 csum 0x8afd], length 1428
17:11:10.544026 IP 112.26.3.8.39939 > 112.26.3.1.targus-getdata1: Flags [.], seq 38556:39984, ack 1, win 4107, options [nop,nop,TS val 4294801654 ecr 62346,mptcp dss ack 569926353 seq 2858581479 subseq 421261 len 1428 csum 0xcef1], length 1428
17:11:10.544261 IP 112.26.3.8.39939 > 112.26.3.1.targus-getdata1: Flags [.], seq 38556:39984, ack 1, win 4107, options [nop,nop,TS val 4294801654 ecr 62346,mptcp dss ack 569926353 seq 2858581479 subseq 421261 len 1428 csum 0xcef1], length 1428
17:11:10.612311 IP 112.26.3.8.39939 > 112.26.3.1.targus-getdata1: Flags [.], seq 39984:41412, ack 1, win 4107, options [nop,nop,TS val 4294801654 ecr 62346,mptcp dss ack 569926353 seq 2858582907 subseq 422689 len 1428 csum 0xb855], length 1428
17:11:10.612547 IP 112.26.3.8.39939 > 112.26.3.1.targus-getdata1: Flags [.], seq 39984:41412, ack 1, win 4107, options [nop,nop,TS val 4294801654 ecr 62346,mptcp dss ack 569926353 seq 2858582907 subseq 422689 len 1428 csum 0xb855], length 1428
17:11:10.651517 IP 112.26.3.1.targus-getdata1 > 112.26.3.8.39939: Flags [.], ack 37128, win 7606, options [nop,nop,TS val 63056 ecr 4294800780,mptcp dss ack 2858445819], length 0
17:11:10.651761 IP 112.26.3.1.targus-getdata1 > 112.26.3.8.39939: Flags [.], ack 37128, win 7606, options [nop,nop,TS val 63056 ecr 4294800780,mptcp dss ack 2858445819], length 0
17:11:10.662244 IP 112.26.3.8.39939 > 112.26.3.1.targus-getdata1: Flags [.], seq 37128:38556, ack 1, win 4107, options [nop,nop,TS val 4294801127 ecr 61760,mptcp dss ack 569926353 seq 2858560059 subseq 419833 len 1428 csum 0x11e9], length 1428
17:11:10.693975 IP 112.26.3.8.39939 > 112.26.3.1.targus-getdata1: Flags [.], seq 41412:42840, ack 1, win 4107, options [nop,nop,TS val 4294801654 ecr 62346,mptcp dss ack 569926353 seq 2858584335 subseq 424117 len 1428 csum 0x7ed4], length 1428
17:11:10.694188 IP 112.26.3.8.39939 > 112.26.3.1.targus-getdata1: Flags [.], seq 41412:42840, ack 1, win 4107, options [nop,nop,TS val 4294801654 ecr 62346,mptcp dss ack 569926353 seq 2858584335 subseq 424117 len 1428 csum 0x7ed4], length 1428
17:11:10.781346 IP 112.26.3.8.39939 > 112.26.3.1.targus-getdata1: Flags [.], seq 42840:44268, ack 1, win 4107, options [nop,nop,TS val 4294801861 ecr 62749,mptcp dss ack 569926353 seq 2858588619 subseq 425545 len 1428 csum 0x349a], length 1428
17:11:10.781644 IP 112.26.3.8.39939 > 112.26.3.1.targus-getdata1: Flags [.], seq 42840:44268, ack 1, win 4107, options [nop,nop,TS val 4294801861 ecr 62749,mptcp dss ack 569926353 seq 2858588619 subseq 425545 len 1428 csum 0x349a], length 1428
17:11:10.824737 IP 112.26.3.8.39939 > 112.26.3.1.targus-getdata1: Flags [.], seq 44268:45696, ack 1, win 4107, options [nop,nop,TS val 4294801861 ecr 62749,mptcp dss ack 569926353 seq 2858590047 subseq 426973 len 1428 csum 0x7794], length 1428
17:11:10.824953 IP 112.26.3.8.39939 > 112.26.3.1.targus-getdata1: Flags [.], seq 44268:45696, ack 1, win 4107, options [nop,nop,TS val 4294801861 ecr 62749,mptcp dss ack 569926353 seq 2858590047 subseq 426973 len 1428 csum 0x7794], length 1428
17:11:10.855626 IP 112.26.3.8.39939 > 112.26.3.1.targus-getdata1: Flags [.], seq 38556:39984, ack 1, win 4107, options [nop,nop,TS val 4294801654 ecr 62346,mptcp dss ack 569926353 seq 2858581479 subseq 421261 len 1428 csum 0xcef1], length 1428
17:11:10.902654 IP 112.26.3.8.39939 > 112.26.3.1.targus-getdata1: Flags [.], seq 45696:47124, ack 1, win 4107, options [nop,nop,TS val 4294801861 ecr 62749,mptcp dss ack 569926353 seq 2858591475 subseq 428401 len 1428 csum 0x6b8c], length 1428
17:11:10.902864 IP 112.26.3.8.39939 > 112.26.3.1.targus-getdata1: Flags [.], seq 45696:47124, ack 1, win 4107, options [nop,nop,TS val 4294801861 ecr 62749,mptcp dss ack 569926353 seq 2858591475 subseq 428401 len 1428 csum 0x6b8c], length 1428
17:11:10.916418 IP 112.26.3.1.targus-getdata1 > 112.26.3.8.39939: Flags [.], ack 39984, win 7595, options [nop,nop,TS val 63326 ecr 4294801127,mptcp dss ack 2858447247], length 0
17:11:10.916630 IP 112.26.3.1.targus-getdata1 > 112.26.3.8.39939: Flags [.], ack 39984, win 7595, options [nop,nop,TS val 63326 ecr 4294801127,mptcp dss ack 2858447247], length 0
17:11:10.953739 IP 112.26.3.8.39939 > 112.26.3.1.targus-getdata1: Flags [.], seq 39984:41412, ack 1, win 4107, options [nop,nop,TS val 4294801654 ecr 62346,mptcp dss ack 569926353 seq 2858582907 subseq 422689 len 1428 csum 0xb855], length 1428
17:11:10.977882 IP 112.26.3.8.39939 > 112.26.3.1.targus-getdata1: Flags [.], seq 47124:48552, ack 1, win 4107, options [nop,nop,TS val 4294801861 ecr 62749,mptcp dss ack 569926353 seq 2858592903 subseq 429829 len 1428 csum 0xf733], length 1428
17:11:10.978144 IP 112.26.3.8.39939 > 112.26.3.1.targus-getdata1: Flags [.], seq 47124:48552, ack 1, win 4107, options [nop,nop,TS val 4294801861 ecr 62749,mptcp dss ack 569926353 seq 2858592903 subseq 429829 len 1428 csum 0xf733], length 1428
17:11:11.043046 IP 112.26.3.8.39939 > 112.26.3.1.targus-getdata1: Flags [P.], seq 48552:49980, ack 1, win 4107, options [nop,nop,TS val 4294801861 ecr 62749,mptcp dss ack 569926353 seq 2858594331 subseq 431257 len 1428 csum 0xd35a], length 1428
17:11:11.043273 IP 112.26.3.8.39939 > 112.26.3.1.targus-getdata1: Flags [P.], seq 48552:49980, ack 1, win 4107, options [nop,nop,TS val 4294801861 ecr 62749,mptcp dss ack 569926353 seq 2858594331 subseq 431257 len 1428 csum 0xd35a], length 1428
17:11:11.079125 IP 112.26.3.8.39939 > 112.26.3.1.targus-getdata1: Flags [.], seq 49980:51408, ack 1, win 4107, options [nop,nop,TS val 4294802169 ecr 63056,mptcp dss ack 569926353 seq 2858600043 subseq 432685 len 1428 csum 0x1b56], length 1428
17:11:11.079355 IP 112.26.3.8.39939 > 112.26.3.1.targus-getdata1: Flags [.], seq 49980:51408, ack 1, win 4107, options [nop,nop,TS val 4294802169 ecr 63056,mptcp dss ack 569926353 seq 2858600043 subseq 432685 len 1428 csum 0x1b56], length 1428
17:11:11.122899 IP 112.26.3.8.39939 > 112.26.3.1.targus-getdata1: Flags [.], seq 41412:42840, ack 1, win 4107, options [nop,nop,TS val 4294801654 ecr 62346,mptcp dss ack 569926353 seq 2858584335 subseq 424117 len 1428 csum 0x7ed4], length 1428
17:11:11.136728 IP 112.26.3.1.targus-getdata1 > 112.26.3.8.39939: Flags [.], ack 42840, win 7639, options [nop,nop,TS val 63545 ecr 4294801654,mptcp dss ack 2858497227], length 0
17:11:11.136951 IP 112.26.3.1.targus-getdata1 > 112.26.3.8.39939: Flags [.], ack 42840, win 7639, options [nop,nop,TS val 63545 ecr 4294801654,mptcp dss ack 2858497227], length 0
17:11:11.147732 IP 112.26.3.8.39939 > 112.26.3.1.targus-getdata1: Flags [.], seq 51408:52836, ack 1, win 4107, options [nop,nop,TS val 4294802169 ecr 63056,mptcp dss ack 569926353 seq 2858601471 subseq 434113 len 1428 csum 0x64c], length 1428
17:11:11.147992 IP 112.26.3.8.39939 > 112.26.3.1.targus-getdata1: Flags [.], seq 51408:52836, ack 1, win 4107, options [nop,nop,TS val 4294802169 ecr 63056,mptcp dss ack 569926353 seq 2858601471 subseq 434113 len 1428 csum 0x64c], length 1428
17:11:11.230199 IP 112.26.3.8.39939 > 112.26.3.1.targus-getdata1: Flags [.], seq 42840:44268, ack 1, win 4107, options [nop,nop,TS val 4294801861 ecr 62749,mptcp dss ack 569926353 seq 2858588619 subseq 425545 len 1428 csum 0x349a], length 1428
17:11:11.326430 IP 112.26.3.8.39939 > 112.26.3.1.targus-getdata1: Flags [.], seq 44268:45696, ack 1, win 4107, options [nop,nop,TS val 4294801861 ecr 62749,mptcp dss ack 569926353 seq 2858590047 subseq 426973 len 1428 csum 0x7794], length 1428
17:11:11.406440 IP 112.26.3.8.39939 > 112.26.3.1.targus-getdata1: Flags [.], seq 45696:47124, ack 1, win 4107, options [nop,nop,TS val 4294801861 ecr 62749,mptcp dss ack 569926353 seq 2858591475 subseq 428401 len 1428 csum 0x6b8c], length 1428
17:11:11.445258 IP 112.26.3.8.39939 > 112.26.3.1.targus-getdata1: Flags [.], seq 52836:54264, ack 1, win 4107, options [nop,nop,TS val 4294802554 ecr 63326,mptcp dss ack 569926353 seq 2858610039 subseq 435541 len 1428 csum 0x4d38], length 1428
17:11:11.445529 IP 112.26.3.8.39939 > 112.26.3.1.targus-getdata1: Flags [.], seq 52836:54264, ack 1, win 4107, options [nop,nop,TS val 4294802554 ecr 63326,mptcp dss ack 569926353 seq 2858610039 subseq 435541 len 1428 csum 0x4d38], length 1428
17:11:11.501488 IP 112.26.3.1.targus-getdata1 > 112.26.3.8.39939: Flags [.], ack 47124, win 7639, options [nop,nop,TS val 63912 ecr 4294801861,mptcp dss ack 2858497227], length 0
17:11:11.501786 IP 112.26.3.1.targus-getdata1 > 112.26.3.8.39939: Flags [.], ack 47124, win 7639, options [nop,nop,TS val 63912 ecr 4294801861,mptcp dss ack 2858497227], length 0
17:11:11.541306 IP 112.26.3.8.39939 > 112.26.3.1.targus-getdata1: Flags [.], seq 47124:48552, ack 1, win 4107, options [nop,nop,TS val 4294801861 ecr 62749,mptcp dss ack 569926353 seq 2858592903 subseq 429829 len 1428 csum 0xf733], length 1428
17:11:11.548056 IP 112.26.3.8.39939 > 112.26.3.1.targus-getdata1: Flags [.], seq 54264:55692, ack 1, win 4107, options [nop,nop,TS val 4294802554 ecr 63326,mptcp dss ack 569926353 seq 2858611467 subseq 436969 len 1428 csum 0x3705], length 1428
17:11:11.548320 IP 112.26.3.8.39939 > 112.26.3.1.targus-getdata1: Flags [.], seq 54264:55692, ack 1, win 4107, options [nop,nop,TS val 4294802554 ecr 63326,mptcp dss ack 569926353 seq 2858611467 subseq 436969 len 1428 csum 0x3705], length 1428
17:11:11.564265 IP 112.26.3.8.39939 > 112.26.3.1.targus-getdata1: Flags [.], seq 55692:57120, ack 1, win 4107, options [nop,nop,TS val 4294802554 ecr 63326,mptcp dss ack 569926353 seq 2858612895 subseq 438397 len 1428 csum 0xe06b], length 1428
17:11:11.564528 IP 112.26.3.8.39939 > 112.26.3.1.targus-getdata1: Flags [.], seq 55692:57120, ack 1, win 4107, options [nop,nop,TS val 4294802554 ecr 63326,mptcp dss ack 569926353 seq 2858612895 subseq 438397 len 1428 csum 0xe06b], length 1428
17:11:11.648263 IP 112.26.3.8.39939 > 112.26.3.1.targus-getdata1: Flags [P.], seq 48552:49980, ack 1, win 4107, options [nop,nop,TS val 4294801861 ecr 62749,mptcp dss ack 569926353 seq 2858594331 subseq 431257 len 1428 csum 0xd35a], length 1428
17:11:11.736859 IP 112.26.3.8.39939 > 112.26.3.1.targus-getdata1: Flags [.], seq 49980:51408, ack 1, win 4107, options [nop,nop,TS val 4294802169 ecr 63056,mptcp dss ack 569926353 seq 2858600043 subseq 432685 len 1428 csum 0x1b56], length 1428
17:11:11.785265 IP 112.26.3.8.39939 > 112.26.3.1.targus-getdata1: Flags [.], seq 57120:58548, ack 1, win 4107, options [nop,nop,TS val 4294802895 ecr 63545,mptcp dss ack 569926353 seq 2858628603 subseq 439825 len 1428 csum 0xf59], length 1428
17:11:11.785532 IP 112.26.3.8.39939 > 112.26.3.1.targus-getdata1: Flags [.], seq 57120:58548, ack 1, win 4107, options [nop,nop,TS val 4294802895 ecr 63545,mptcp dss ack 569926353 seq 2858628603 subseq 439825 len 1428 csum 0xf59], length 1428
