17:10:29.141748 IP 112.26.2.8.52831 > 112.26.2.1.targus-getdata1: Flags [S], seq 3403009083, win 65535, options [mss 1460,sackOK,TS val 4294760233 ecr 0,nop,wscale 6,mptcp join id 4 token 0x8f8bf6e7 nonce 0xb7013d7f], length 0
17:10:29.212848 IP 112.26.2.8.52831 > 112.26.2.1.targus-getdata1: Flags [S], seq 3403009083, win 65535, options [mss 1460,sackOK,TS val 4294760233 ecr 0,nop,wscale 6,mptcp join id 4 token 0x8f8bf6e7 nonce 0xb7013d7f], length 0
17:10:29.483923 IP 112.26.2.1.targus-getdata1 > 112.26.2.8.52831: Flags [S.], seq 872496003, ack 3403009084, win 28560, options [mss 1460,sackOK,TS val 21687 ecr 4294760233,nop,wscale 7,mptcp join id 6 hmac 0x88d142d84470f381 nonce 0xe98ad74e], length 0
17:10:29.484161 IP 112.26.2.8.52831 > 112.26.2.1.targus-getdata1: Flags [.], ack 1, win 4107, options [nop,nop,TS val 4294760597 ecr 21687,mptcp join hmac 0xfbd939460a2d3bdcec7384b16a13209912590df6], length 0
17:10:29.620135 IP 112.26.2.8.52831 > 112.26.2.1.targus-getdata1: Flags [.], ack 1, win 4107, options [nop,nop,TS val 4294760597 ecr 21687,mptcp join hmac 0xfbd939460a2d3bdcec7384b16a13209912590df6], length 0
17:10:29.680650 IP 112.26.2.1.targus-getdata1 > 112.26.2.8.52831: Flags [.], ack 1, win 893, options [nop,nop,TS val 22036 ecr 4294760597,mptcp dss ack 616805850], length 0
17:10:30.139632 IP 112.26.2.8.42819 > 112.26.2.1.targus-getdata1: Flags [S], seq 2677099190, win 65535, options [mss 1460,sackOK,TS val 4294761252 ecr 0,nop,wscale 6,mptcp join id 4 token 0x38f92c7e nonce 0x3e6fc99], length 0
17:10:59.045850 IP 112.26.2.8.42819 > 112.26.2.1.targus-getdata1: Flags [.], seq 2677389075:2677390503, ack 3003601553, win 4107, options [nop,nop,TS val 4294789659 ecr 50349,mptcp dss ack 569926353 seq 2858054547 subseq 289885 len 1428 csum 0x70], length 1428
17:10:59.110348 IP 112.26.2.8.42819 > 112.26.2.1.targus-getdata1: Flags [.], seq 1428:2856, ack 1, win 4107, options [nop,nop,TS val 4294789659 ecr 50349,mptcp dss ack 569926353 seq 2858055975 subseq 291313 len 1428 csum 0xfe75], length 1428
17:10:59.187124 IP 112.26.2.1.targus-getdata1 > 112.26.2.8.42819: Flags [.], ack 4294961584, win 7639, options [nop,nop,TS val 51037 ecr 4294788995,nop,nop,sack 1 {4294963012:4294964440},mptcp dss ack 2857927455], length 0
17:10:59.209342 IP 112.26.2.8.42819 > 112.26.2.1.targus-getdata1: Flags [.], seq 8568:9996, ack 1, win 4107, options [nop,nop,TS val 4294790322 ecr 51037,mptcp dss ack 569926353 seq 2858085963 subseq 298453 len 1428 csum 0x13ff], length 1428
17:10:59.249517 IP 112.26.2.1.targus-getdata1 > 112.26.2.8.42819: Flags [.], ack 4294961584, win 7639, options [nop,nop,TS val 51108 ecr 4294788995,nop,nop,sack 1 {4294963012:4294965868},mptcp dss ack 2857927455], length 0
17:10:59.255025 IP 112.26.2.8.42819 > 112.26.2.1.targus-getdata1: Flags [.], seq 9996:11424, ack 1, win 4107, options [nop,nop,TS val 4294790368 ecr 51108,mptcp dss ack 569926353 seq 2858088819 subseq 299881 len 1428 csum 0x4b5c], length 1428
17:10:59.313275 IP 112.26.2.8.42819 > 112.26.2.1.targus-getdata1: Flags [.], seq 2856:4284, ack 1, win 4107, options [nop,nop,TS val 4294789873 ecr 50553,mptcp dss ack 569926353 seq 2858067399 subseq 292741 len 1428 csum 0x6203], length 1428
17:10:59.378755 IP 112.26.2.8.42819 > 112.26.2.1.targus-getdata1: Flags [.], seq 4284:5712, ack 1, win 4107, options [nop,nop,TS val 4294789926 ecr 50663,mptcp dss ack 569926353 seq 2858070255 subseq 294169 len 1428 csum 0xff1a], length 1428
17:10:59.457715 IP 112.26.2.1.targus-getdata1 > 112.26.2.8.42819: Flags [.], ack 4294961584, win 7639, options [nop,nop,TS val 51274 ecr 4294788995,nop,nop,sack 1 {4294963012:0},mptcp dss ack 2857927455], length 0
17:10:59.457947 IP 112.26.2.8.42819 > 112.26.2.1.targus-getdata1: Flags [.], seq 4294961584:4294963012, ack 1, win 4107, options [nop,nop,TS val 4294790571 ecr 51274,mptcp dss ack 569926353 seq 2858031699 subseq 284173 len 1428 csum 0x3c9b], length 1428
17:10:59.500126 IP 112.26.2.8.42819 > 112.26.2.1.targus-getdata1: Flags [.], seq 5712:7140, ack 1, win 4107, options [nop,nop,TS val 4294790037 ecr 50804,mptcp dss ack 569926353 seq 2858073111 subseq 295597 len 1428 csum 0x3ca7], length 1428
17:10:59.575888 IP 112.26.2.8.42819 > 112.26.2.1.targus-getdata1: Flags [.], seq 7140:8568, ack 1, win 4107, options [nop,nop,TS val 4294790098 ecr 50865,mptcp dss ack 569926353 seq 2858075967 subseq 297025 len 1428 csum 0x2078], length 1428
17:10:59.651897 IP 112.26.2.1.targus-getdata1 > 112.26.2.8.42819: Flags [.], ack 4294961584, win 7528, options [nop,nop,TS val 51463 ecr 4294788995,nop,nop,sack 1 {4294963012:1428},mptcp dss ack 2857953159], length 0
17:10:59.695923 IP 112.26.2.1.targus-getdata1 > 112.26.2.8.42819: Flags [.], ack 4294961584, win 7553, options [nop,nop,TS val 51560 ecr 4294788995,nop,nop,sack 1 {4294963012:2856},mptcp dss ack 2857963155], length 0
17:10:59.696204 IP 112.26.2.8.42819 > 112.26.2.1.targus-getdata1: Flags [.], seq 11424:12852, ack 1, win 4107, options [nop,nop,TS val 4294790809 ecr 51463,mptcp dss ack 569926353 seq 2858107383 subseq 301309 len 1428 csum 0x8e66], length 1428
17:10:59.706317 IP 112.26.2.8.42819 > 112.26.2.1.targus-getdata1: Flags [.], seq 12852:14280, ack 1, win 4107, options [nop,nop,TS val 4294790819 ecr 51560,mptcp dss ack 569926353 seq 2858108811 subseq 302737 len 1428 csum 0x50ac], length 1428
17:10:59.787369 IP 112.26.2.8.42819 > 112.26.2.1.targus-getdata1: Flags [.], seq 8568:9996, ack 1, win 4107, options [nop,nop,TS val 4294790322 ecr 51037,mptcp dss ack 569926353 seq 2858085963 subseq 298453 len 1428 csum 0x13ff], length 1428
17:10:59.870885 IP 112.26.2.8.42819 > 112.26.2.1.targus-getdata1: Flags [.], seq 9996:11424, ack 1, win 4107, options [nop,nop,TS val 4294790368 ecr 51108,mptcp dss ack 569926353 seq 2858088819 subseq 299881 len 1428 csum 0x4b5c], length 1428
17:10:59.933359 IP 112.26.2.1.targus-getdata1 > 112.26.2.8.42819: Flags [.], ack 4294961584, win 7553, options [nop,nop,TS val 51729 ecr 4294788995,nop,nop,sack 1 {4294963012:4284},mptcp dss ack 2857963155], length 0
17:11:00.027416 IP 112.26.2.1.targus-getdata1 > 112.26.2.8.42819: Flags [.], ack 4294961584, win 7553, options [nop,nop,TS val 51825 ecr 4294788995,nop,nop,sack 1 {4294963012:5712},mptcp dss ack 2857963155], length 0
17:11:00.066950 IP 112.26.2.8.42819 > 112.26.2.1.targus-getdata1: Flags [.], seq 4294961584:4294963012, ack 1, win 4107, options [nop,nop,TS val 4294790571 ecr 51274,mptcp dss ack 569926353 seq 2858031699 subseq 284173 len 1428 csum 0x3c9b], length 1428
17:11:00.162084 IP 112.26.2.1.targus-getdata1 > 112.26.2.8.42819: Flags [.], ack 4294961584, win 7553, options [nop,nop,TS val 51916 ecr 4294788995,nop,nop,sack 1 {4294963012:7140},mptcp dss ack 2857963155], length 0
17:11:00.162609 IP 112.26.2.8.42819 > 112.26.2.1.targus-getdata1: Flags [.], seq 14280:15708, ack 1, win 4107, options [nop,nop,TS val 4294791275 ecr 51916,mptcp dss ack 569926353 seq 2858127375 subseq 304165 len 1428 csum 0x7514], length 1428
17:11:00.199388 IP 112.26.2.1.targus-getdata1 > 112.26.2.8.42819: Flags [.], ack 4294961584, win 7553, options [nop,nop,TS val 52001 ecr 4294788995,nop,nop,sack 1 {4294963012:8568},mptcp dss ack 2857963155], length 0
17:11:00.280034 IP 112.26.2.8.42819 > 112.26.2.1.targus-getdata1: Flags [.], seq 11424:12852, ack 1, win 4107, options [nop,nop,TS val 4294790809 ecr 51463,mptcp dss ack 569926353 seq 2858107383 subseq 301309 len 1428 csum 0x8e66], length 1428
17:11:00.301872 IP 112.26.2.8.42819 > 112.26.2.1.targus-getdata1: Flags [.], seq 15708:17136, ack 1, win 4107, options [nop,nop,TS val 4294791414 ecr 52001,mptcp dss ack 569926353 seq 2858128803 subseq 305593 len 1428 csum 0x3c9b], length 1428
17:11:00.355603 IP 112.26.2.8.42819 > 112.26.2.1.targus-getdata1: Flags [.], seq 12852:14280, ack 1, win 4107, options [nop,nop,TS val 4294790819 ecr 51560,mptcp dss ack 569926353 seq 2858108811 subseq 302737 len 1428 csum 0x50ac], length 1428
17:11:00.460589 IP 112.26.2.1.targus-getdata1 > 112.26.2.8.42819: Flags [.], ack 4294961584, win 7553, options [nop,nop,TS val 52208 ecr 4294788995,nop,nop,sack 1 {4294963012:9996},mptcp dss ack 2857963155], length 0
17:11:00.496826 IP 112.26.2.1.targus-getdata1 > 112.26.2.8.42819: Flags [.], ack 4294961584, win 7553, options [nop,nop,TS val 52287 ecr 4294788995,nop,nop,sack 1 {4294963012:11424},mptcp dss ack 2857963155], length 0
17:11:00.497078 IP 112.26.2.8.42819 > 112.26.2.1.targus-getdata1: Flags [.], seq 17136:18564, ack 1, win 4107, options [nop,nop,TS val 4294791609 ecr 52208,mptcp dss ack 569926353 seq 2858140227 subseq 307021 len 1428 csum 0x6372], length 1428
17:11:00.582473 IP 112.26.2.8.42819 > 112.26.2.1.targus-getdata1: Flags [.], seq 18564:19992, ack 1, win 4107, options [nop,nop,TS val 4294791695 ecr 52287,mptcp dss ack 569926353 seq 2858141655 subseq 308449 len 1428 csum 0xcd9], length 1428
17:11:00.633203 IP 112.26.2.1.targus-getdata1 > 112.26.2.8.42819: Flags [.], ack 11424, win 7553, options [nop,nop,TS val 52483 ecr 4294790571,mptcp dss ack 2857963155], length 0
17:11:00.633468 IP 112.26.2.8.42819 > 112.26.2.1.targus-getdata1: Flags [.], seq 19992:21420, ack 1, win 4107, options [nop,nop,TS val 4294791746 ecr 52483,mptcp dss ack 569926353 seq 2858145939 subseq 309877 len 1428 csum 0xba12], length 1428
17:11:00.687146 IP 112.26.2.8.42819 > 112.26.2.1.targus-getdata1: Flags [.], seq 14280:15708, ack 1, win 4107, options [nop,nop,TS val 4294791275 ecr 51916,mptcp dss ack 569926353 seq 2858127375 subseq 304165 len 1428 csum 0x7514], length 1428
17:11:00.788097 IP 112.26.2.1.targus-getdata1 > 112.26.2.8.42819: Flags [.], ack 12852, win 7553, options [nop,nop,TS val 52697 ecr 4294790809,mptcp dss ack 2857963155], length 0
17:11:00.788358 IP 112.26.2.8.42819 > 112.26.2.1.targus-getdata1: Flags [.], seq 21420:22848, ack 1, win 4107, options [nop,nop,TS val 4294791901 ecr 52697,mptcp dss ack 569926353 seq 2858157363 subseq 311305 len 1428 csum 0x3632], length 1428
17:11:00.846550 IP 112.26.2.8.42819 > 112.26.2.1.targus-getdata1: Flags [.], seq 15708:17136, ack 1, win 4107, options [nop,nop,TS val 4294791414 ecr 52001,mptcp dss ack 569926353 seq 2858128803 subseq 305593 len 1428 csum 0x3c9b], length 1428
17:11:00.897936 IP 112.26.2.1.targus-getdata1 > 112.26.2.8.42819: Flags [.], ack 14280, win 7553, options [nop,nop,TS val 52777 ecr 4294790819,mptcp dss ack 2857963155], length 0
17:11:00.898277 IP 112.26.2.8.42819 > 112.26.2.1.targus-getdata1: Flags [.], seq 22848:24276, ack 1, win 4107, options [nop,nop,TS val 4294792011 ecr 52777,mptcp dss ack 569926353 seq 2858158791 subseq 312733 len 1428 csum 0x8855], length 1428
17:11:00.974710 IP 112.26.2.8.42819 > 112.26.2.1.targus-getdata1: Flags [.], seq 17136:18564, ack 1, win 4107, options [nop,nop,TS val 4294791609 ecr 52208,mptcp dss ack 569926353 seq 2858140227 subseq 307021 len 1428 csum 0x6372], length 1428
17:11:01.056533 IP 112.26.2.8.42819 > 112.26.2.1.targus-getdata1: Flags [.], seq 18564:19992, ack 1, win 4107, options [nop,nop,TS val 4294791695 ecr 52287,mptcp dss ack 569926353 seq 2858141655 subseq 308449 len 1428 csum 0xcd9], length 1428
17:11:01.145147 IP 112.26.2.1.targus-getdata1 > 112.26.2.8.42819: Flags [.], ack 15708, win 7553, options [nop,nop,TS val 53104 ecr 4294791275,mptcp dss ack 2857963155], length 0
17:11:01.145548 IP 112.26.2.8.42819 > 112.26.2.1.targus-getdata1: Flags [.], seq 24276:25704, ack 1, win 4107, options [nop,nop,TS val 4294792258 ecr 53104,mptcp dss ack 569926353 seq 2858171643 subseq 314161 len 1428 csum 0xd3a7], length 1428
17:11:01.217034 IP 112.26.2.8.42819 > 112.26.2.1.targus-getdata1: Flags [.], seq 19992:21420, ack 1, win 4107, options [nop,nop,TS val 4294791746 ecr 52483,mptcp dss ack 569926353 seq 2858145939 subseq 309877 len 1428 csum 0xba12], length 1428
17:11:01.298675 IP 112.26.2.8.42819 > 112.26.2.1.targus-getdata1: Flags [.], seq 21420:22848, ack 1, win 4107, options [nop,nop,TS val 4294791901 ecr 52697,mptcp dss ack 569926353 seq 2858157363 subseq 311305 len 1428 csum 0x3632], length 1428
17:11:01.375415 IP 112.26.2.1.targus-getdata1 > 112.26.2.8.42819: Flags [.], ack 17136, win 7553, options [nop,nop,TS val 53263 ecr 4294791414,mptcp dss ack 2857963155], length 0
17:11:01.375643 IP 112.26.2.8.42819 > 112.26.2.1.targus-getdata1: Flags [.], seq 25704:27132, ack 1, win 4107, options [nop,nop,TS val 4294792488 ecr 53263,mptcp dss ack 569926353 seq 2858185923 subseq 315589 len 1428 csum 0x4d24], length 1428
17:11:01.441488 IP 112.26.2.8.42819 > 112.26.2.1.targus-getdata1: Flags [.], seq 22848:24276, ack 1, win 4107, options [nop,nop,TS val 4294792011 ecr 52777,mptcp dss ack 569926353 seq 2858158791 subseq 312733 len 1428 csum 0x8855], length 1428
17:11:01.526791 IP 112.26.2.1.targus-getdata1 > 112.26.2.8.42819: Flags [.], ack 18564, win 7639, options [nop,nop,TS val 53394 ecr 4294791609,mptcp dss ack 2858123091], length 0
17:11:01.527191 IP 112.26.2.8.42819 > 112.26.2.1.targus-getdata1: Flags [.], seq 27132:28560, ack 1, win 4107, options [nop,nop,TS val 4294792639 ecr 53394,mptcp dss ack 569926353 seq 2858188779 subseq 317017 len 1428 csum 0x72dd], length 1428
17:11:01.575719 IP 112.26.2.1.targus-getdata1 > 112.26.2.8.42819: Flags [.], ack 19992, win 7639, options [nop,nop,TS val 53475 ecr 4294791695,mptcp dss ack 2858123091], length 0
17:11:01.575951 IP 112.26.2.8.42819 > 112.26.2.1.targus-getdata1: Flags [.], seq 28560:29988, ack 1, win 4107, options [nop,nop,TS val 4294792688 ecr 53475,mptcp dss ack 569926353 seq 2858191635 subseq 318445 len 1428 csum 0x8ed1], length 1428
17:11:01.576013 IP 112.26.2.8.42819 > 112.26.2.1.targus-getdata1: Flags [.], seq 29988:31416, ack 1, win 4107, options [nop,nop,TS val 4294792688 ecr 53475,mptcp dss ack 569926353 seq 2858193063 subseq 319873 len 1428 csum 0x4a1d], length 1428
17:11:01.631474 IP 112.26.2.8.42819 > 112.26.2.1.targus-getdata1: Flags [.], seq 24276:25704, ack 1, win 4107, options [nop,nop,TS val 4294792258 ecr 53104,mptcp dss ack 569926353 seq 2858171643 subseq 314161 len 1428 csum 0xd3a7], length 1428
17:11:01.723937 IP 112.26.2.1.targus-getdata1 > 112.26.2.8.42819: Flags [.], ack 21420, win 7639, options [nop,nop,TS val 53634 ecr 4294791746,mptcp dss ack 2858123091], length 0
17:11:01.724250 IP 112.26.2.8.42819 > 112.26.2.1.targus-getdata1: Flags [.], seq 31416:32844, ack 1, win 4107, options [nop,nop,TS val 4294792837 ecr 53634,mptcp dss ack 569926353 seq 2858205915 subseq 321301 len 1428 csum 0x5bf5], length 1428
17:11:01.790059 IP 112.26.2.1.targus-getdata1 > 112.26.2.8.42819: Flags [.], ack 22848, win 7639, options [nop,nop,TS val 53744 ecr 4294791901,mptcp dss ack 2858123091], length 0
17:11:01.790302 IP 112.26.2.8.42819 > 112.26.2.1.targus-getdata1: Flags [.], seq 32844:34272, ack 1, win 4107, options [nop,nop,TS val 4294792903 ecr 53744,mptcp dss ack 569926353 seq 2858207343 subseq 322729 len 1428 csum 0x4487], length 1428
17:11:01.828927 IP 112.26.2.8.42819 > 112.26.2.1.targus-getdata1: Flags [.], seq 25704:27132, ack 1, win 4107, options [nop,nop,TS val 4294792488 ecr 53263,mptcp dss ack 569926353 seq 2858185923 subseq 315589 len 1428 csum 0x4d24], length 1428
17:11:01.928120 IP 112.26.2.1.targus-getdata1 > 112.26.2.8.42819: Flags [.], ack 24276, win 7639, options [nop,nop,TS val 53860 ecr 4294792011,mptcp dss ack 2858123091], length 0
17:11:01.928477 IP 112.26.2.8.42819 > 112.26.2.1.targus-getdata1: Flags [.], seq 34272:35700, ack 1, win 4107, options [nop,nop,TS val 4294793041 ecr 53860,mptcp dss ack 569926353 seq 2858214483 subseq 324157 len 1428 csum 0xc859], length 1428
17:11:01.979839 IP 112.26.2.8.42819 > 112.26.2.1.targus-getdata1: Flags [.], seq 27132:28560, ack 1, win 4107, options [nop,nop,TS val 4294792639 ecr 53394,mptcp dss ack 569926353 seq 2858188779 subseq 317017 len 1428 csum 0x72dd], length 1428
17:11:02.184417 IP 112.26.2.8.42819 > 112.26.2.1.targus-getdata1: Flags [.], seq 28560:29988, ack 1, win 4107, options [nop,nop,TS val 4294792688 ecr 53475,mptcp dss ack 569926353 seq 2858191635 subseq 318445 len 1428 csum 0x8ed1], length 1428
17:11:02.243301 IP 112.26.2.8.42819 > 112.26.2.1.targus-getdata1: Flags [.], seq 29988:31416, ack 1, win 4107, options [nop,nop,TS val 4294792688 ecr 53475,mptcp dss ack 569926353 seq 2858193063 subseq 319873 len 1428 csum 0x4a1d], length 1428
17:11:02.336494 IP 112.26.2.1.targus-getdata1 > 112.26.2.8.42819: Flags [.], ack 25704, win 7639, options [nop,nop,TS val 54047 ecr 4294792258,mptcp dss ack 2858123091], length 0
17:11:02.336771 IP 112.26.2.8.42819 > 112.26.2.1.targus-getdata1: Flags [.], seq 35700:37128, ack 1, win 4107, options [nop,nop,TS val 4294793449 ecr 54047,mptcp dss ack 569926353 seq 2858225907 subseq 325585 len 1428 csum 0xc0f4], length 1428
17:11:02.390623 IP 112.26.2.8.42819 > 112.26.2.1.targus-getdata1: Flags [.], seq 31416:32844, ack 1, win 4107, options [nop,nop,TS val 4294792837 ecr 53634,mptcp dss ack 569926353 seq 2858205915 subseq 321301 len 1428 csum 0x5bf5], length 1428
17:11:02.467266 IP 112.26.2.8.42819 > 112.26.2.1.targus-getdata1: Flags [.], seq 32844:34272, ack 1, win 4107, options [nop,nop,TS val 4294792903 ecr 53744,mptcp dss ack 569926353 seq 2858207343 subseq 322729 len 1428 csum 0x4487], length 1428
17:11:02.543565 IP 112.26.2.1.targus-getdata1 > 112.26.2.8.42819: Flags [.], ack 27132, win 7639, options [nop,nop,TS val 54246 ecr 4294792488,mptcp dss ack 2858123091], length 0
17:11:02.543848 IP 112.26.2.8.42819 > 112.26.2.1.targus-getdata1: Flags [.], seq 37128:38556, ack 1, win 4107, options [nop,nop,TS val 4294793656 ecr 54246,mptcp dss ack 569926353 seq 2858231619 subseq 327013 len 1428 csum 0x7953], length 1428
17:11:02.636775 IP 112.26.2.8.42819 > 112.26.2.1.targus-getdata1: Flags [.], seq 34272:35700, ack 1, win 4107, options [nop,nop,TS val 4294793041 ecr 53860,mptcp dss ack 569926353 seq 2858214483 subseq 324157 len 1428 csum 0xc859], length 1428
17:11:02.690343 IP 112.26.2.1.targus-getdata1 > 112.26.2.8.42819: Flags [.], ack 28560, win 7639, options [nop,nop,TS val 54398 ecr 4294792639,mptcp dss ack 2858123091], length 0
17:11:02.690620 IP 112.26.2.8.42819 > 112.26.2.1.targus-getdata1: Flags [.], seq 38556:39984, ack 1, win 4107, options [nop,nop,TS val 4294793803 ecr 54398,mptcp dss ack 569926353 seq 2858234475 subseq 328441 len 1428 csum 0xb7f9], length 1428
17:11:02.763346 IP 112.26.2.1.targus-getdata1 > 112.26.2.8.42819: Flags [.], ack 29988, win 7639, options [nop,nop,TS val 54612 ecr 4294792688,mptcp dss ack 2858123091], length 0
17:11:02.763748 IP 112.26.2.8.42819 > 112.26.2.1.targus-getdata1: Flags [.], seq 39984:41412, ack 1, win 4107, options [nop,nop,TS val 4294793876 ecr 54612,mptcp dss ack 569926353 seq 2858240187 subseq 329869 len 1428 csum 0x4f64], length 1428
17:11:02.839224 IP 112.26.2.1.targus-getdata1 > 112.26.2.8.42819: Flags [.], ack 31416, win 7639, options [nop,nop,TS val 54682 ecr 4294792688,mptcp dss ack 2858123091], length 0
17:11:02.839619 IP 112.26.2.8.42819 > 112.26.2.1.targus-getdata1: Flags [.], seq 41412:42840, ack 1, win 4107, options [nop,nop,TS val 4294793952 ecr 54682,mptcp dss ack 569926353 seq 2858243043 subseq 331297 len 1428 csum 0xf6ce], length 1428
17:11:02.839662 IP 112.26.2.8.42819 > 112.26.2.1.targus-getdata1: Flags [.], seq 42840:44268, ack 1, win 4107, options [nop,nop,TS val 4294793952 ecr 54682,mptcp dss ack 569926353 seq 2858244471 subseq 332725 len 1428 csum 0x8993], length 1428
17:11:02.954768 IP 112.26.2.8.42819 > 112.26.2.1.targus-getdata1: Flags [.], seq 35700:37128, ack 1, win 4107, options [nop,nop,TS val 4294793449 ecr 54047,mptcp dss ack 569926353 seq 2858225907 subseq 325585 len 1428 csum 0xc0f4], length 1428
17:11:03.021944 IP 112.26.2.1.targus-getdata1 > 112.26.2.8.42819: Flags [.], ack 32844, win 7639, options [nop,nop,TS val 54808 ecr 4294792837,mptcp dss ack 2858123091], length 0
17:11:03.022332 IP 112.26.2.8.42819 > 112.26.2.1.targus-getdata1: Flags [.], seq 44268:45696, ack 1, win 4107, options [nop,nop,TS val 4294794134 ecr 54808,mptcp dss ack 569926353 seq 2858250183 subseq 334153 len 1428 csum 0x3bdc], length 1428
17:11:03.051931 IP 112.26.2.8.42819 > 112.26.2.1.targus-getdata1: Flags [.], seq 37128:38556, ack 1, win 4107, options [nop,nop,TS val 4294793656 ecr 54246,mptcp dss ack 569926353 seq 2858231619 subseq 327013 len 1428 csum 0x7953], length 1428
17:11:03.116940 IP 112.26.2.1.targus-getdata1 > 112.26.2.8.42819: Flags [.], ack 34272, win 7639, options [nop,nop,TS val 54965 ecr 4294792903,mptcp dss ack 2858123091], length 0
17:11:03.117324 IP 112.26.2.8.42819 > 112.26.2.1.targus-getdata1: Flags [.], seq 45696:47124, ack 1, win 4107, options [nop,nop,TS val 4294794229 ecr 54965,mptcp dss ack 569926353 seq 2858253039 subseq 335581 len 1428 csum 0xa236], length 1428
17:11:03.179406 IP 112.26.2.8.42819 > 112.26.2.1.targus-getdata1: Flags [.], seq 38556:39984, ack 1, win 4107, options [nop,nop,TS val 4294793803 ecr 54398,mptcp dss ack 569926353 seq 2858234475 subseq 328441 len 1428 csum 0xb7f9], length 1428
17:11:03.227796 IP 112.26.2.8.42819 > 112.26.2.1.targus-getdata1: Flags [.], seq 39984:41412, ack 1, win 4107, options [nop,nop,TS val 4294793876 ecr 54612,mptcp dss ack 569926353 seq 2858240187 subseq 329869 len 1428 csum 0x4f64], length 1428
17:11:03.324857 IP 112.26.2.1.targus-getdata1 > 112.26.2.8.42819: Flags [.], ack 35700, win 7639, options [nop,nop,TS val 55176 ecr 4294793041,mptcp dss ack 2858123091], length 0
17:11:03.325162 IP 112.26.2.8.42819 > 112.26.2.1.targus-getdata1: Flags [.], seq 47124:48552, ack 1, win 4107, options [nop,nop,TS val 4294794438 ecr 55176,mptcp dss ack 569926353 seq 2858257323 subseq 337009 len 1428 csum 0xf6c5], length 1428
17:11:03.325206 IP 112.26.2.8.42819 > 112.26.2.1.targus-getdata1: Flags [.], seq 48552:49980, ack 1, win 4107, options [nop,nop,TS val 4294794438 ecr 55176,mptcp dss ack 569926353 seq 2858258751 subseq 338437 len 1428 csum 0x7489], length 1428
17:11:03.437125 IP 112.26.2.8.42819 > 112.26.2.1.targus-getdata1: Flags [.], seq 41412:42840, ack 1, win 4107, options [nop,nop,TS val 4294793952 ecr 54682,mptcp dss ack 569926353 seq 2858243043 subseq 331297 len 1428 csum 0xf6ce], length 1428
17:11:03.503336 IP 112.26.2.8.42819 > 112.26.2.1.targus-getdata1: Flags [.], seq 42840:44268, ack 1, win 4107, options [nop,nop,TS val 4294793952 ecr 54682,mptcp dss ack 569926353 seq 2858244471 subseq 332725 len 1428 csum 0x8993], length 1428
17:11:03.569802 IP 112.26.2.8.42819 > 112.26.2.1.targus-getdata1: Flags [.], seq 44268:45696, ack 1, win 4107, options [nop,nop,TS val 4294794134 ecr 54808,mptcp dss ack 569926353 seq 2858250183 subseq 334153 len 1428 csum 0x3bdc], length 1428
17:11:03.619244 IP 112.26.2.8.42819 > 112.26.2.1.targus-getdata1: Flags [.], seq 45696:47124, ack 1, win 4107, options [nop,nop,TS val 4294794229 ecr 54965,mptcp dss ack 569926353 seq 2858253039 subseq 335581 len 1428 csum 0xa236], length 1428
17:11:03.661485 IP 112.26.2.1.targus-getdata1 > 112.26.2.8.42819: Flags [.], ack 38556, win 7639, options [nop,nop,TS val 55536 ecr 4294793449,mptcp dss ack 2858123091], length 0
17:11:03.661772 IP 112.26.2.8.42819 > 112.26.2.1.targus-getdata1: Flags [.], seq 49980:51408, ack 1, win 4107, options [nop,nop,TS val 4294794774 ecr 55536,mptcp dss ack 569926353 seq 2858261607 subseq 339865 len 1428 csum 0xda99], length 1428
17:11:03.661819 IP 112.26.2.8.42819 > 112.26.2.1.targus-getdata1: Flags [.], seq 51408:52836, ack 1, win 4107, options [nop,nop,TS val 4294794774 ecr 55536,mptcp dss ack 569926353 seq 2858263035 subseq 341293 len 1428 csum 0x333b], length 1428
17:11:03.661914 IP 112.26.2.8.42819 > 112.26.2.1.targus-getdata1: Flags [.], seq 52836:54264, ack 1, win 4107, options [nop,nop,TS val 4294794774 ecr 55536,mptcp dss ack 569926353 seq 2858264463 subseq 342721 len 1428 csum 0xf0dc], length 1428
17:11:03.787444 IP 112.26.2.8.42819 > 112.26.2.1.targus-getdata1: Flags [.], seq 47124:48552, ack 1, win 4107, options [nop,nop,TS val 4294794438 ecr 55176,mptcp dss ack 569926353 seq 2858257323 subseq 337009 len 1428 csum 0xf6c5], length 1428
17:11:03.904444 IP 112.26.2.8.42819 > 112.26.2.1.targus-getdata1: Flags [.], seq 48552:49980, ack 1, win 4107, options [nop,nop,TS val 4294794438 ecr 55176,mptcp dss ack 569926353 seq 2858258751 subseq 338437 len 1428 csum 0x7489], length 1428
17:11:03.949506 IP 112.26.2.1.targus-getdata1 > 112.26.2.8.42819: Flags [.], ack 42840, win 7639, options [nop,nop,TS val 55853 ecr 4294793803,mptcp dss ack 2858163075], length 0
17:11:03.949806 IP 112.26.2.8.42819 > 112.26.2.1.targus-getdata1: Flags [.], seq 54264:55692, ack 1, win 4107, options [nop,nop,TS val 4294795062 ecr 55853,mptcp dss ack 569926353 seq 2858273031 subseq 344149 len 1428 csum 0x9395], length 1428
17:11:03.949883 IP 112.26.2.8.42819 > 112.26.2.1.targus-getdata1: Flags [.], seq 55692:57120, ack 1, win 4107, options [nop,nop,TS val 4294795062 ecr 55853,mptcp dss ack 569926353 seq 2858274459 subseq 345577 len 1428 csum 0x5544], length 1428
17:11:03.950041 IP 112.26.2.8.42819 > 112.26.2.1.targus-getdata1: Flags [.], seq 57120:58548, ack 1, win 4107, options [nop,nop,TS val 4294795062 ecr 55853,mptcp dss ack 569926353 seq 2858275887 subseq 347005 len 1428 csum 0xd23c], length 1428
17:11:03.950146 IP 112.26.2.8.42819 > 112.26.2.1.targus-getdata1: Flags [.], seq 58548:59976, ack 1, win 4107, options [nop,nop,TS val 4294795062 ecr 55853,mptcp dss ack 569926353 seq 2858277315 subseq 348433 len 1428 csum 0xc7c3], length 1428
17:11:03.950294 IP 112.26.2.8.42819 > 112.26.2.1.targus-getdata1: Flags [.], seq 59976:61404, ack 1, win 4107, options [nop,nop,TS val 4294795062 ecr 55853,mptcp dss ack 569926353 seq 2858278743 subseq 349861 len 1428 csum 0x1b12], length 1428
17:11:04.087342 IP 112.26.2.8.42819 > 112.26.2.1.targus-getdata1: Flags [.], seq 49980:51408, ack 1, win 4107, options [nop,nop,TS val 4294794774 ecr 55536,mptcp dss ack 569926353 seq 2858261607 subseq 339865 len 1428 csum 0xda99], length 1428
17:11:04.183869 IP 112.26.2.8.42819 > 112.26.2.1.targus-getdata1: Flags [.], seq 51408:52836, ack 1, win 4107, options [nop,nop,TS val 4294794774 ecr 55536,mptcp dss ack 569926353 seq 2858263035 subseq 341293 len 1428 csum 0x333b], length 1428
17:11:04.260757 IP 112.26.2.8.42819 > 112.26.2.1.targus-getdata1: Flags [.], seq 52836:54264, ack 1, win 4107, options [nop,nop,TS val 4294794774 ecr 55536,mptcp dss ack 569926353 seq 2858264463 subseq 342721 len 1428 csum 0xf0dc], length 1428
17:11:04.366891 IP 112.26.2.1.targus-getdata1 > 112.26.2.8.42819: Flags [.], ack 45696, win 7639, options [nop,nop,TS val 56157 ecr 4294793952,mptcp dss ack 2858195919], length 0
17:11:04.367225 IP 112.26.2.8.42819 > 112.26.2.1.targus-getdata1: Flags [.], seq 61404:62832, ack 1, win 4107, options [nop,nop,TS val 4294795480 ecr 56157,mptcp dss ack 569926353 seq 2858300163 subseq 351289 len 1428 csum 0x8e35], length 1428
17:11:04.367288 IP 112.26.2.8.42819 > 112.26.2.1.targus-getdata1: Flags [.], seq 62832:64260, ack 1, win 4107, options [nop,nop,TS val 4294795480 ecr 56157,mptcp dss ack 569926353 seq 2858301591 subseq 352717 len 1428 csum 0x6b0d], length 1428
17:11:04.479708 IP 112.26.2.8.42819 > 112.26.2.1.targus-getdata1: Flags [.], seq 54264:55692, ack 1, win 4107, options [nop,nop,TS val 4294795062 ecr 55853,mptcp dss ack 569926353 seq 2858273031 subseq 344149 len 1428 csum 0x9395], length 1428
17:11:04.518884 IP 112.26.2.8.42819 > 112.26.2.1.targus-getdata1: Flags [.], seq 55692:57120, ack 1, win 4107, options [nop,nop,TS val 4294795062 ecr 55853,mptcp dss ack 569926353 seq 2858274459 subseq 345577 len 1428 csum 0x5544], length 1428
17:11:04.564540 IP 112.26.2.8.42819 > 112.26.2.1.targus-getdata1: Flags [.], seq 57120:58548, ack 1, win 4107, options [nop,nop,TS val 4294795062 ecr 55853,mptcp dss ack 569926353 seq 2858275887 subseq 347005 len 1428 csum 0xd23c], length 1428
17:11:04.644183 IP 112.26.2.1.targus-getdata1 > 112.26.2.8.42819: Flags [.], ack 48552, win 7628, options [nop,nop,TS val 56373 ecr 4294794229,mptcp dss ack 2858197347], length 0
17:11:04.644759 IP 112.26.2.8.42819 > 112.26.2.1.targus-getdata1: Flags [.], seq 64260:65688, ack 1, win 4107, options [nop,nop,TS val 4294795757 ecr 56373,mptcp dss ack 569926353 seq 2858313015 subseq 354145 len 1428 csum 0xe6c8], length 1428
17:11:04.644822 IP 112.26.2.8.42819 > 112.26.2.1.targus-getdata1: Flags [.], seq 65688:67116, ack 1, win 4107, options [nop,nop,TS val 4294795757 ecr 56373,mptcp dss ack 569926353 seq 2858314443 subseq 355573 len 1428 csum 0x19ca], length 1428
17:11:04.645168 IP 112.26.2.8.42819 > 112.26.2.1.targus-getdata1: Flags [.], seq 67116:68544, ack 1, win 4107, options [nop,nop,TS val 4294795757 ecr 56373,mptcp dss ack 569926353 seq 2858315871 subseq 357001 len 1428 csum 0x55a6], length 1428
17:11:04.706024 IP 112.26.2.8.42819 > 112.26.2.1.targus-getdata1: Flags [.], seq 58548:59976, ack 1, win 4107, options [nop,nop,TS val 4294795062 ecr 55853,mptcp dss ack 569926353 seq 2858277315 subseq 348433 len 1428 csum 0xc7c3], length 1428
17:11:04.826677 IP 112.26.2.8.42819 > 112.26.2.1.targus-getdata1: Flags [.], seq 59976:61404, ack 1, win 4107, options [nop,nop,TS val 4294795062 ecr 55853,mptcp dss ack 569926353 seq 2858278743 subseq 349861 len 1428 csum 0x1b12], length 1428
17:11:04.893358 IP 112.26.2.8.42819 > 112.26.2.1.targus-getdata1: Flags [.], seq 61404:62832, ack 1, win 4107, options [nop,nop,TS val 4294795480 ecr 56157,mptcp dss ack 569926353 seq 2858300163 subseq 351289 len 1428 csum 0x8e35], length 1428
17:11:04.991241 IP 112.26.2.1.targus-getdata1 > 112.26.2.8.42819: Flags [.], ack 49980, win 7637, options [nop,nop,TS val 56608 ecr 4294794438,mptcp dss ack 2858210199], length 0
17:11:04.991594 IP 112.26.2.8.42819 > 112.26.2.1.targus-getdata1: Flags [.], seq 68544:69972, ack 1, win 4107, options [nop,nop,TS val 4294796104 ecr 56608,mptcp dss ack 569926353 seq 2858317299 subseq 358429 len 1428 csum 0x3ce7], length 1428
17:11:05.072473 IP 112.26.2.8.42819 > 112.26.2.1.targus-getdata1: Flags [.], seq 62832:64260, ack 1, win 4107, options [nop,nop,TS val 4294795480 ecr 56157,mptcp dss ack 569926353 seq 2858301591 subseq 352717 len 1428 csum 0x6b0d], length 1428
17:11:05.133307 IP 112.26.2.1.targus-getdata1 > 112.26.2.8.42819: Flags [.], ack 52836, win 7639, options [nop,nop,TS val 56722 ecr 4294794774,mptcp dss ack 2858230191], length 0
17:11:05.133638 IP 112.26.2.8.42819 > 112.26.2.1.targus-getdata1: Flags [.], seq 69972:71400, ack 1, win 4107, options [nop,nop,TS val 4294796246 ecr 56722,mptcp dss ack 569926353 seq 2858330151 subseq 359857 len 1428 csum 0x6c4c], length 1428
17:11:05.133714 IP 112.26.2.8.42819 > 112.26.2.1.targus-getdata1: Flags [.], seq 71400:72828, ack 1, win 4107, options [nop,nop,TS val 4294796246 ecr 56722,mptcp dss ack 569926353 seq 2858331579 subseq 361285 len 1428 csum 0x4f39], length 1428
17:11:05.133870 IP 112.26.2.8.42819 > 112.26.2.1.targus-getdata1: Flags [.], seq 72828:74256, ack 1, win 4107, options [nop,nop,TS val 4294796246 ecr 56722,mptcp dss ack 569926353 seq 2858333007 subseq 362713 len 1428 csum 0x3deb], length 1428
17:11:05.272033 IP 112.26.2.8.42819 > 112.26.2.1.targus-getdata1: Flags [.], seq 64260:65688, ack 1, win 4107, options [nop,nop,TS val 4294795757 ecr 56373,mptcp dss ack 569926353 seq 2858313015 subseq 354145 len 1428 csum 0xe6c8], length 1428
17:11:05.342195 IP 112.26.2.8.42819 > 112.26.2.1.targus-getdata1: Flags [.], seq 65688:67116, ack 1, win 4107, options [nop,nop,TS val 4294795757 ecr 56373,mptcp dss ack 569926353 seq 2858314443 subseq 355573 len 1428 csum 0x19ca], length 1428
17:11:05.411147 IP 112.26.2.8.42819 > 112.26.2.1.targus-getdata1: Flags [.], seq 67116:68544, ack 1, win 4107, options [nop,nop,TS val 4294795757 ecr 56373,mptcp dss ack 569926353 seq 2858315871 subseq 357001 len 1428 csum 0x55a6], length 1428
17:11:05.470864 IP 112.26.2.1.targus-getdata1 > 112.26.2.8.42819: Flags [.], ack 55692, win 7639, options [nop,nop,TS val 57006 ecr 4294794774,mptcp dss ack 2858274459], length 0
17:11:05.471205 IP 112.26.2.8.42819 > 112.26.2.1.targus-getdata1: Flags [.], seq 74256:75684, ack 1, win 4107, options [nop,nop,TS val 4294796584 ecr 57006,mptcp dss ack 569926353 seq 2858351571 subseq 364141 len 1428 csum 0xec4f], length 1428
17:11:05.471286 IP 112.26.2.8.42819 > 112.26.2.1.targus-getdata1: Flags [.], seq 75684:77112, ack 1, win 4107, options [nop,nop,TS val 4294796584 ecr 57006,mptcp dss ack 569926353 seq 2858352999 subseq 365569 len 1428 csum 0x96a8], length 1428
17:11:05.471440 IP 112.26.2.8.42819 > 112.26.2.1.targus-getdata1: Flags [.], seq 77112:78540, ack 1, win 4107, options [nop,nop,TS val 4294796584 ecr 57006,mptcp dss ack 569926353 seq 2858354427 subseq 366997 len 1428 csum 0x57d9], length 1428
17:11:05.535195 IP 112.26.2.8.42819 > 112.26.2.1.targus-getdata1: Flags [.], seq 68544:69972, ack 1, win 4107, options [nop,nop,TS val 4294796104 ecr 56608,mptcp dss ack 569926353 seq 2858317299 subseq 358429 len 1428 csum 0x3ce7], length 1428
17:11:05.651813 IP 112.26.2.1.targus-getdata1 > 112.26.2.8.42819: Flags [.], ack 58548, win 7639, options [nop,nop,TS val 57209 ecr 4294795062,mptcp dss ack 2858277315], length 0
17:11:05.652155 IP 112.26.2.8.42819 > 112.26.2.1.targus-getdata1: Flags [.], seq 78540:79968, ack 1, win 4107, options [nop,nop,TS val 4294796765 ecr 57209,mptcp dss ack 569926353 seq 2858361567 subseq 368425 len 1428 csum 0x6ee9], length 1428
17:11:05.652263 IP 112.26.2.8.42819 > 112.26.2.1.targus-getdata1: Flags [.], seq 79968:81396, ack 1, win 4107, options [nop,nop,TS val 4294796765 ecr 57209,mptcp dss ack 569926353 seq 2858362995 subseq 369853 len 1428 csum 0xa417], length 1428
17:11:05.719001 IP 112.26.2.8.42819 > 112.26.2.1.targus-getdata1: Flags [.], seq 69972:71400, ack 1, win 4107, options [nop,nop,TS val 4294796246 ecr 56722,mptcp dss ack 569926353 seq 2858330151 subseq 359857 len 1428 csum 0x6c4c], length 1428
17:11:05.796568 IP 112.26.2.8.42819 > 112.26.2.1.targus-getdata1: Flags [.], seq 71400:72828, ack 1, win 4107, options [nop,nop,TS val 4294796246 ecr 56722,mptcp dss ack 569926353 seq 2858331579 subseq 361285 len 1428 csum 0x4f39], length 1428
17:11:05.898048 IP 112.26.2.8.42819 > 112.26.2.1.targus-getdata1: Flags [.], seq 72828:74256, ack 1, win 4107, options [nop,nop,TS val 4294796246 ecr 56722,mptcp dss ack 569926353 seq 2858333007 subseq 362713 len 1428 csum 0x3deb], length 1428
17:11:05.947989 IP 112.26.2.1.targus-getdata1 > 112.26.2.8.42819: Flags [.], ack 59976, win 7639, options [nop,nop,TS val 57504 ecr 4294795062,mptcp dss ack 2858278743], length 0
17:11:05.948275 IP 112.26.2.8.42819 > 112.26.2.1.targus-getdata1: Flags [.], seq 81396:82824, ack 1, win 4107, options [nop,nop,TS val 4294797061 ecr 57504,mptcp dss ack 569926353 seq 2858372991 subseq 371281 len 1428 csum 0x3ad9], length 1428
17:11:05.948351 IP 112.26.2.8.42819 > 112.26.2.1.targus-getdata1: Flags [.], seq 82824:84252, ack 1, win 4107, options [nop,nop,TS val 4294797061 ecr 57504,mptcp dss ack 569926353 seq 2858374419 subseq 372709 len 1428 csum 0xfa01], length 1428
17:11:06.004625 IP 112.26.2.1.targus-getdata1 > 112.26.2.8.42819: Flags [.], ack 62832, win 7639, options [nop,nop,TS val 57617 ecr 4294795062,mptcp dss ack 2858287311], length 0
17:11:06.004981 IP 112.26.2.8.42819 > 112.26.2.1.targus-getdata1: Flags [.], seq 84252:85680, ack 1, win 4107, options [nop,nop,TS val 4294797117 ecr 57617,mptcp dss ack 569926353 seq 2858375847 subseq 374137 len 1428 csum 0x9344], length 1428
17:11:06.005058 IP 112.26.2.8.42819 > 112.26.2.1.targus-getdata1: Flags [.], seq 85680:87108, ack 1, win 4107, options [nop,nop,TS val 4294797117 ecr 57617,mptcp dss ack 569926353 seq 2858377275 subseq 375565 len 1428 csum 0xd4b1], length 1428
17:11:06.005211 IP 112.26.2.8.42819 > 112.26.2.1.targus-getdata1: Flags [.], seq 87108:88536, ack 1, win 4107, options [nop,nop,TS val 4294797117 ecr 57617,mptcp dss ack 569926353 seq 2858378703 subseq 376993 len 1428 csum 0xc56c], length 1428
17:11:06.063489 IP 112.26.2.8.42819 > 112.26.2.1.targus-getdata1: Flags [.], seq 74256:75684, ack 1, win 4107, options [nop,nop,TS val 4294796584 ecr 57006,mptcp dss ack 569926353 seq 2858351571 subseq 364141 len 1428 csum 0xec4f], length 1428
17:11:06.236427 IP 112.26.2.8.42819 > 112.26.2.1.targus-getdata1: Flags [.], seq 75684:77112, ack 1, win 4107, options [nop,nop,TS val 4294796584 ecr 57006,mptcp dss ack 569926353 seq 2858352999 subseq 365569 len 1428 csum 0x96a8], length 1428
17:11:06.324096 IP 112.26.2.8.42819 > 112.26.2.1.targus-getdata1: Flags [.], seq 77112:78540, ack 1, win 4107, options [nop,nop,TS val 4294796584 ecr 57006,mptcp dss ack 569926353 seq 2858354427 subseq 366997 len 1428 csum 0x57d9], length 1428
17:11:06.384028 IP 112.26.2.8.42819 > 112.26.2.1.targus-getdata1: Flags [.], seq 79968:81396, ack 1, win 4107, options [nop,nop,TS val 4294796765 ecr 57209,mptcp dss ack 569926353 seq 2858362995 subseq 369853 len 1428 csum 0xa417], length 1428
17:11:06.460292 IP 112.26.2.1.targus-getdata1 > 112.26.2.8.42819: Flags [.], ack 64260, win 7639, options [nop,nop,TS val 57904 ecr 4294795480,mptcp dss ack 2858287311], length 0
17:11:06.460690 IP 112.26.2.8.42819 > 112.26.2.1.targus-getdata1: Flags [.], seq 88536:89964, ack 1, win 4107, options [nop,nop,TS val 4294797573 ecr 57904,mptcp dss ack 569926353 seq 2858390127 subseq 378421 len 1428 csum 0xe3cf], length 1428
17:11:06.515840 IP 112.26.2.1.targus-getdata1 > 112.26.2.8.42819: Flags [.], ack 67116, win 7639, options [nop,nop,TS val 58021 ecr 4294795757,mptcp dss ack 2858287311], length 0
17:11:06.516175 IP 112.26.2.8.42819 > 112.26.2.1.targus-getdata1: Flags [.], seq 89964:91392, ack 1, win 4107, options [nop,nop,TS val 4294797629 ecr 58021,mptcp dss ack 569926353 seq 2858395839 subseq 379849 len 1428 csum 0xe1fc], length 1428
17:11:06.516289 IP 112.26.2.8.42819 > 112.26.2.1.targus-getdata1: Flags [.], seq 91392:92820, ack 1, win 4107, options [nop,nop,TS val 4294797629 ecr 58021,mptcp dss ack 569926353 seq 2858397267 subseq 381277 len 1428 csum 0xe649], length 1428
17:11:06.516436 IP 112.26.2.8.42819 > 112.26.2.1.targus-getdata1: Flags [.], seq 92820:94248, ack 1, win 4107, options [nop,nop,TS val 4294797629 ecr 58021,mptcp dss ack 569926353 seq 2858398695 subseq 382705 len 1428 csum 0xe966], length 1428
17:11:06.624368 IP 112.26.2.8.42819 > 112.26.2.1.targus-getdata1: Flags [.], seq 81396:82824, ack 1, win 4107, options [nop,nop,TS val 4294797061 ecr 57504,mptcp dss ack 569926353 seq 2858372991 subseq 371281 len 1428 csum 0x3ad9], length 1428
17:11:06.689916 IP 112.26.2.8.42819 > 112.26.2.1.targus-getdata1: Flags [.], seq 82824:84252, ack 1, win 4107, options [nop,nop,TS val 4294797061 ecr 57504,mptcp dss ack 569926353 seq 2858374419 subseq 372709 len 1428 csum 0xfa01], length 1428
17:11:06.777972 IP 112.26.2.8.42819 > 112.26.2.1.targus-getdata1: Flags [.], seq 84252:85680, ack 1, win 4107, options [nop,nop,TS val 4294797117 ecr 57617,mptcp dss ack 569926353 seq 2858375847 subseq 374137 len 1428 csum 0x9344], length 1428
17:11:06.854331 IP 112.26.2.8.42819 > 112.26.2.1.targus-getdata1: Flags [.], seq 85680:87108, ack 1, win 4107, options [nop,nop,TS val 4294797117 ecr 57617,mptcp dss ack 569926353 seq 2858377275 subseq 375565 len 1428 csum 0xd4b1], length 1428
17:11:06.933629 IP 112.26.2.1.targus-getdata1 > 112.26.2.8.42819: Flags [.], ack 74256, win 7639, options [nop,nop,TS val 58576 ecr 4294796246,mptcp dss ack 2858287311], length 0
17:11:06.933922 IP 112.26.2.8.42819 > 112.26.2.1.targus-getdata1: Flags [.], seq 94248:95676, ack 1, win 4107, options [nop,nop,TS val 4294798046 ecr 58576,mptcp dss ack 569926353 seq 2858420115 subseq 384133 len 1428 csum 0x17d1], length 1428
17:11:06.933996 IP 112.26.2.8.42819 > 112.26.2.1.targus-getdata1: Flags [.], seq 95676:97104, ack 1, win 4107, options [nop,nop,TS val 4294798046 ecr 58576,mptcp dss ack 569926353 seq 2858421543 subseq 385561 len 1428 csum 0x8552], length 1428
17:11:06.934150 IP 112.26.2.8.42819 > 112.26.2.1.targus-getdata1: Flags [.], seq 97104:98532, ack 1, win 4107, options [nop,nop,TS val 4294798046 ecr 58576,mptcp dss ack 569926353 seq 2858422971 subseq 386989 len 1428 csum 0x483], length 1428
