17:10:29.221520 IP 112.26.1.8.36421 > 112.26.1.1.targus-getdata1: Flags [S], seq 2338953355, win 65535, options [mss 1460,sackOK,TS val 4294760232 ecr 0,nop,wscale 6,mptcp join id 3 token 0x8f8bf6e7 nonce 0x509e72d8], length 0
17:10:29.263882 IP 112.26.1.8.36421 > 112.26.1.1.targus-getdata1: Flags [S], seq 2338953355, win 65535, options [mss 1460,sackOK,TS val 4294760232 ecr 0,nop,wscale 6,mptcp join id 3 token 0x8f8bf6e7 nonce 0x509e72d8], length 0
17:10:29.304661 IP 112.26.1.1.targus-getdata1 > 112.26.1.8.36421: Flags [S.], seq 546551861, ack 2338953356, win 28560, options [mss 1460,sackOK,TS val 21681 ecr 4294760232,nop,wscale 7,mptcp join id 3 hmac 0xdea6d7f0c13682f2 nonce 0xe2506a83], length 0
17:10:29.381451 IP 112.26.1.1.targus-getdata1 > 112.26.1.8.36421: Flags [S.], seq 546551861, ack 2338953356, win 28560, options [mss 1460,sackOK,TS val 21681 ecr 4294760232,nop,wscale 7,mptcp join id 3 hmac 0xdea6d7f0c13682f2 nonce 0xe2506a83], length 0
17:10:29.441949 IP 112.26.1.1.targus-getdata1 > 112.26.1.8.36421: Flags [S.], seq 546551861, ack 2338953356, win 28560, options [mss 1460,sackOK,TS val 21681 ecr 4294760232,nop,wscale 7,mptcp join id 3 hmac 0xdea6d7f0c13682f2 nonce 0xe2506a83], length 0
17:10:29.569860 IP 112.26.1.8.36421 > 112.26.1.1.targus-getdata1: Flags [.], ack 1, win 4107, options [nop,nop,TS val 4294760555 ecr 21681,mptcp join hmac 0x3a111e66838a028df5a58c10ae7fe863a47adac9], length 0
17:10:29.570093 IP 112.26.1.8.36421 > 112.26.1.1.targus-getdata1: Flags [.], ack 1, win 4107, options [nop,nop,TS val 4294760555 ecr 21681,mptcp join hmac 0x3a111e66838a028df5a58c10ae7fe863a47adac9], length 0
17:11:08.790813 IP 112.26.1.1.targus-getdata1 > 112.26.1.8.57531: Flags [.], ack 3554804603, win 7639, options [nop,nop,TS val 61200 ecr 4294799204,mptcp dss ack 2858361567], length 0
17:11:08.791978 IP 112.26.1.1.targus-getdata1 > 112.26.1.8.57531: Flags [.], ack 1, win 7639, options [nop,nop,TS val 61200 ecr 4294799204,mptcp dss ack 2858361567], length 0
17:11:08.839198 IP 112.26.1.8.57531 > 112.26.1.1.targus-getdata1: Flags [.], seq 1:1429, ack 0, win 4107, options [nop,nop,TS val 4294799204 ecr 59821,mptcp dss ack 569926353 seq 2858482947 subseq 401269 len 1428 csum 0x2c70], length 1428
17:11:08.839426 IP 112.26.1.8.57531 > 112.26.1.1.targus-getdata1: Flags [.], seq 1:1429, ack 0, win 4107, options [nop,nop,TS val 4294799204 ecr 59821,mptcp dss ack 569926353 seq 2858482947 subseq 401269 len 1428 csum 0x2c70], length 1428
17:11:08.967261 IP 112.26.1.1.targus-getdata1 > 112.26.1.8.57531: Flags [.], ack 4294961585, win 7639, options [nop,nop,TS val 60688 ecr 4294798461,mptcp dss ack 2858361567], length 0
17:11:08.986930 IP 112.26.1.1.targus-getdata1 > 112.26.1.8.57531: Flags [.], ack 1429, win 7639, options [nop,nop,TS val 61400 ecr 4294799204,mptcp dss ack 2858361567], length 0
17:11:08.988586 IP 112.26.1.1.targus-getdata1 > 112.26.1.8.57531: Flags [.], ack 1429, win 7639, options [nop,nop,TS val 61400 ecr 4294799204,mptcp dss ack 2858361567], length 0
17:11:09.023793 IP 112.26.1.8.57531 > 112.26.1.1.targus-getdata1: Flags [.], seq 1429:2857, ack 0, win 4107, options [nop,nop,TS val 4294799204 ecr 59821,mptcp dss ack 569926353 seq 2858484375 subseq 402697 len 1428 csum 0xb853], length 1428
17:11:09.024023 IP 112.26.1.8.57531 > 112.26.1.1.targus-getdata1: Flags [.], seq 1429:2857, ack 0, win 4107, options [nop,nop,TS val 4294799204 ecr 59821,mptcp dss ack 569926353 seq 2858484375 subseq 402697 len 1428 csum 0xb853], length 1428
17:11:09.139568 IP 112.26.1.8.57531 > 112.26.1.1.targus-getdata1: Flags [.], seq 2857:4285, ack 0, win 4107, options [nop,nop,TS val 4294799204 ecr 59821,mptcp dss ack 569926353 seq 2858485803 subseq 404125 len 1428 csum 0x4958], length 1428
17:11:09.139899 IP 112.26.1.8.57531 > 112.26.1.1.targus-getdata1: Flags [.], seq 2857:4285, ack 0, win 4107, options [nop,nop,TS val 4294799204 ecr 59821,mptcp dss ack 569926353 seq 2858485803 subseq 404125 len 1428 csum 0x4958], length 1428
17:11:09.157542 IP 112.26.1.1.targus-getdata1 > 112.26.1.8.57531: Flags [.], ack 4285, win 7639, options [nop,nop,TS val 61557 ecr 4294799204,mptcp dss ack 2858361567], length 0
17:11:09.165780 IP 112.26.1.1.targus-getdata1 > 112.26.1.8.57531: Flags [.], ack 4285, win 7639, options [nop,nop,TS val 61557 ecr 4294799204,mptcp dss ack 2858361567], length 0
17:11:09.238616 IP 112.26.1.8.57531 > 112.26.1.1.targus-getdata1: Flags [.], seq 4285:5713, ack 0, win 4107, options [nop,nop,TS val 4294799204 ecr 59821,mptcp dss ack 569926353 seq 2858487231 subseq 405553 len 1428 csum 0xca3], length 1428
17:11:09.238927 IP 112.26.1.8.57531 > 112.26.1.1.targus-getdata1: Flags [.], seq 4285:5713, ack 0, win 4107, options [nop,nop,TS val 4294799204 ecr 59821,mptcp dss ack 569926353 seq 2858487231 subseq 405553 len 1428 csum 0xca3], length 1428
17:11:09.321130 IP 112.26.1.8.57531 > 112.26.1.1.targus-getdata1: Flags [.], seq 5713:7141, ack 0, win 4107, options [nop,nop,TS val 4294799656 ecr 60239,mptcp dss ack 569926353 seq 2858500083 subseq 406981 len 1428 csum 0x1be2], length 1428
17:11:09.321446 IP 112.26.1.8.57531 > 112.26.1.1.targus-getdata1: Flags [.], seq 5713:7141, ack 0, win 4107, options [nop,nop,TS val 4294799656 ecr 60239,mptcp dss ack 569926353 seq 2858500083 subseq 406981 len 1428 csum 0x1be2], length 1428
17:11:09.386257 IP 112.26.1.1.targus-getdata1 > 112.26.1.8.57531: Flags [.], ack 7141, win 7639, options [nop,nop,TS val 61800 ecr 4294799204,mptcp dss ack 2858361567], length 0
17:11:09.387567 IP 112.26.1.1.targus-getdata1 > 112.26.1.8.57531: Flags [.], ack 7141, win 7639, options [nop,nop,TS val 61800 ecr 4294799204,mptcp dss ack 2858361567], length 0
17:11:09.469177 IP 112.26.1.8.57531 > 112.26.1.1.targus-getdata1: Flags [.], seq 8569:9997, ack 0, win 4107, options [nop,nop,TS val 4294799656 ecr 60239,mptcp dss ack 569926353 seq 2858502939 subseq 409837 len 1428 csum 0x986f], length 1428
17:11:09.469527 IP 112.26.1.8.57531 > 112.26.1.1.targus-getdata1: Flags [.], seq 8569:9997, ack 0, win 4107, options [nop,nop,TS val 4294799656 ecr 60239,mptcp dss ack 569926353 seq 2858502939 subseq 409837 len 1428 csum 0x986f], length 1428
17:11:09.472816 IP 112.26.1.1.targus-getdata1 > 112.26.1.8.57531: Flags [.], ack 7141, win 7639, options [nop,nop,TS val 61885 ecr 4294799204,nop,nop,sack 1 {8569:9997},mptcp dss ack 2858361567], length 0
17:11:09.486315 IP 112.26.1.1.targus-getdata1 > 112.26.1.8.57531: Flags [.], ack 7141, win 7639, options [nop,nop,TS val 61885 ecr 4294799204,nop,nop,sack 1 {8569:9997},mptcp dss ack 2858361567], length 0
17:11:09.544431 IP 112.26.1.8.57531 > 112.26.1.1.targus-getdata1: Flags [.], seq 9997:11425, ack 0, win 4107, options [nop,nop,TS val 4294799656 ecr 60239,mptcp dss ack 569926353 seq 2858504367 subseq 411265 len 1428 csum 0x9d50], length 1428
17:11:09.544753 IP 112.26.1.8.57531 > 112.26.1.1.targus-getdata1: Flags [.], seq 9997:11425, ack 0, win 4107, options [nop,nop,TS val 4294799656 ecr 60239,mptcp dss ack 569926353 seq 2858504367 subseq 411265 len 1428 csum 0x9d50], length 1428
17:11:09.570829 IP 112.26.1.1.targus-getdata1 > 112.26.1.8.57531: Flags [.], ack 7141, win 7506, options [nop,nop,TS val 61983 ecr 4294799204,nop,nop,sack 1 {8569:11425},mptcp dss ack 2858378703], length 0
17:11:09.572130 IP 112.26.1.1.targus-getdata1 > 112.26.1.8.57531: Flags [.], ack 7141, win 7506, options [nop,nop,TS val 61983 ecr 4294799204,nop,nop,sack 1 {8569:11425},mptcp dss ack 2858378703], length 0
17:11:09.619134 IP 112.26.1.8.57531 > 112.26.1.1.targus-getdata1: Flags [.], seq 11425:12853, ack 0, win 4107, options [nop,nop,TS val 4294799656 ecr 60239,mptcp dss ack 569926353 seq 2858505795 subseq 412693 len 1428 csum 0x30f9], length 1428
17:11:09.619406 IP 112.26.1.8.57531 > 112.26.1.1.targus-getdata1: Flags [.], seq 11425:12853, ack 0, win 4107, options [nop,nop,TS val 4294799656 ecr 60239,mptcp dss ack 569926353 seq 2858505795 subseq 412693 len 1428 csum 0x30f9], length 1428
17:11:09.647114 IP 112.26.1.1.targus-getdata1 > 112.26.1.8.57531: Flags [.], ack 7141, win 7506, options [nop,nop,TS val 62059 ecr 4294799204,nop,nop,sack 1 {8569:12853},mptcp dss ack 2858378703], length 0
17:11:09.668848 IP 112.26.1.1.targus-getdata1 > 112.26.1.8.57531: Flags [.], ack 7141, win 7506, options [nop,nop,TS val 62059 ecr 4294799204,nop,nop,sack 1 {8569:12853},mptcp dss ack 2858378703], length 0
17:11:09.686787 IP 112.26.1.8.57531 > 112.26.1.1.targus-getdata1: Flags [.], seq 12853:14281, ack 0, win 4107, options [nop,nop,TS val 4294799656 ecr 60239,mptcp dss ack 569926353 seq 2858507223 subseq 414121 len 1428 csum 0x4b42], length 1428
17:11:09.687102 IP 112.26.1.8.57531 > 112.26.1.1.targus-getdata1: Flags [.], seq 12853:14281, ack 0, win 4107, options [nop,nop,TS val 4294799656 ecr 60239,mptcp dss ack 569926353 seq 2858507223 subseq 414121 len 1428 csum 0x4b42], length 1428
17:11:09.767369 IP 112.26.1.1.targus-getdata1 > 112.26.1.8.57531: Flags [.], ack 7141, win 7506, options [nop,nop,TS val 62134 ecr 4294799204,nop,nop,sack 1 {8569:14281},mptcp dss ack 2858378703], length 0
17:11:09.768730 IP 112.26.1.1.targus-getdata1 > 112.26.1.8.57531: Flags [.], ack 7141, win 7506, options [nop,nop,TS val 62134 ecr 4294799204,nop,nop,sack 1 {8569:14281},mptcp dss ack 2858378703], length 0
17:11:09.786462 IP 112.26.1.8.57531 > 112.26.1.1.targus-getdata1: Flags [.], seq 15709:17137, ack 0, win 4107, options [nop,nop,TS val 4294799710 ecr 60480,mptcp dss ack 569926353 seq 2858510079 subseq 416977 len 1428 csum 0x47ab], length 1428
17:11:09.786728 IP 112.26.1.8.57531 > 112.26.1.1.targus-getdata1: Flags [.], seq 15709:17137, ack 0, win 4107, options [nop,nop,TS val 4294799710 ecr 60480,mptcp dss ack 569926353 seq 2858510079 subseq 416977 len 1428 csum 0x47ab], length 1428
17:11:09.845069 IP 112.26.1.1.targus-getdata1 > 112.26.1.8.57531: Flags [.], ack 7141, win 7606, options [nop,nop,TS val 62235 ecr 4294799204,nop,nop,sack 2 {15709:17137}{8569:14281},mptcp dss ack 2858445819], length 0
17:11:09.846603 IP 112.26.1.1.targus-getdata1 > 112.26.1.8.57531: Flags [.], ack 7141, win 7606, options [nop,nop,TS val 62235 ecr 4294799204,nop,nop,sack 2 {15709:17137}{8569:14281},mptcp dss ack 2858445819], length 0
17:11:09.891898 IP 112.26.1.1.targus-getdata1 > 112.26.1.8.57531: Flags [.], ack 4285, win 7639, options [nop,nop,TS val 61557 ecr 4294799204,mptcp dss ack 2858361567], length 0
17:11:09.982273 IP 112.26.1.8.57531 > 112.26.1.1.targus-getdata1: Flags [.], seq 19993:21421, ack 0, win 4107, options [nop,nop,TS val 4294800080 ecr 60688,mptcp dss ack 569926353 seq 2858518647 subseq 421261 len 1428 csum 0xc293], length 1428
17:11:09.982528 IP 112.26.1.8.57531 > 112.26.1.1.targus-getdata1: Flags [.], seq 19993:21421, ack 0, win 4107, options [nop,nop,TS val 4294800080 ecr 60688,mptcp dss ack 569926353 seq 2858518647 subseq 421261 len 1428 csum 0xc293], length 1428
17:11:09.985709 IP 112.26.1.1.targus-getdata1 > 112.26.1.8.57531: Flags [.], ack 7141, win 7606, options [nop,nop,TS val 62399 ecr 4294799204,nop,nop,sack 2 {19993:21421}{15709:17137},mptcp dss ack 2858445819], length 0
17:11:09.989876 IP 112.26.1.1.targus-getdata1 > 112.26.1.8.57531: Flags [.], ack 7141, win 7606, options [nop,nop,TS val 62399 ecr 4294799204,nop,nop,sack 2 {19993:21421}{15709:17137},mptcp dss ack 2858445819], length 0
17:11:10.078396 IP 112.26.1.8.57531 > 112.26.1.1.targus-getdata1: Flags [.], seq 21421:22849, ack 0, win 4107, options [nop,nop,TS val 4294800080 ecr 60688,mptcp dss ack 569926353 seq 2858520075 subseq 422689 len 1428 csum 0xff49], length 1428
17:11:10.078695 IP 112.26.1.8.57531 > 112.26.1.1.targus-getdata1: Flags [.], seq 21421:22849, ack 0, win 4107, options [nop,nop,TS val 4294800080 ecr 60688,mptcp dss ack 569926353 seq 2858520075 subseq 422689 len 1428 csum 0xff49], length 1428
17:11:10.084223 IP 112.26.1.1.targus-getdata1 > 112.26.1.8.57531: Flags [.], ack 7141, win 7606, options [nop,nop,TS val 62496 ecr 4294799204,nop,nop,sack 2 {19993:22849}{15709:17137},mptcp dss ack 2858445819], length 0
17:11:10.103879 IP 112.26.1.1.targus-getdata1 > 112.26.1.8.57531: Flags [.], ack 7141, win 7606, options [nop,nop,TS val 62496 ecr 4294799204,nop,nop,sack 2 {19993:22849}{15709:17137},mptcp dss ack 2858445819], length 0
17:11:10.183084 IP 112.26.1.1.targus-getdata1 > 112.26.1.8.57531: Flags [.], ack 7141, win 7639, options [nop,nop,TS val 61885 ecr 4294799204,nop,nop,sack 1 {8569:9997},mptcp dss ack 2858361567], length 0
17:11:10.246184 IP 112.26.1.1.targus-getdata1 > 112.26.1.8.57531: Flags [.], ack 7141, win 7506, options [nop,nop,TS val 61983 ecr 4294799204,nop,nop,sack 1 {8569:11425},mptcp dss ack 2858378703], length 0
17:11:10.353622 IP 112.26.1.1.targus-getdata1 > 112.26.1.8.57531: Flags [.], ack 7141, win 7506, options [nop,nop,TS val 62059 ecr 4294799204,nop,nop,sack 1 {8569:12853},mptcp dss ack 2858378703], length 0
17:11:10.387058 IP 112.26.1.8.57531 > 112.26.1.1.targus-getdata1: Flags [.], seq 21421:22849, ack 0, win 4107, options [nop,nop,TS val 4294800832 ecr 60688,mptcp dss ack 569926353 seq 2858520075 subseq 422689 len 1428 csum 0xff49], length 1428
17:11:10.387326 IP 112.26.1.8.57531 > 112.26.1.1.targus-getdata1: Flags [.], seq 21421:22849, ack 0, win 4107, options [nop,nop,TS val 4294800832 ecr 60688,mptcp dss ack 569926353 seq 2858520075 subseq 422689 len 1428 csum 0xff49], length 1428
17:11:10.396109 IP 112.26.1.1.targus-getdata1 > 112.26.1.8.57531: Flags [.], ack 7141, win 7606, options [nop,nop,TS val 62806 ecr 4294799204,nop,nop,sack 2 {21421:22849}{19993:22849},mptcp dss ack 2858445819], length 0
17:11:10.397830 IP 112.26.1.1.targus-getdata1 > 112.26.1.8.57531: Flags [.], ack 7141, win 7606, options [nop,nop,TS val 62806 ecr 4294799204,nop,nop,sack 2 {21421:22849}{19993:22849},mptcp dss ack 2858445819], length 0
17:11:10.502235 IP 112.26.1.1.targus-getdata1 > 112.26.1.8.57531: Flags [.], ack 7141, win 7606, options [nop,nop,TS val 62235 ecr 4294799204,nop,nop,sack 2 {15709:17137}{8569:14281},mptcp dss ack 2858445819], length 0
17:11:10.609656 IP 112.26.1.8.57531 > 112.26.1.1.targus-getdata1: Flags [.], seq 24277:25705, ack 0, win 4107, options [nop,nop,TS val 4294801004 ecr 61557,mptcp dss ack 569926353 seq 2858551491 subseq 425545 len 1428 csum 0x7745], length 1428
17:11:10.609973 IP 112.26.1.8.57531 > 112.26.1.1.targus-getdata1: Flags [.], seq 24277:25705, ack 0, win 4107, options [nop,nop,TS val 4294801004 ecr 61557,mptcp dss ack 569926353 seq 2858551491 subseq 425545 len 1428 csum 0x7745], length 1428
17:11:10.621808 IP 112.26.1.1.targus-getdata1 > 112.26.1.8.57531: Flags [.], ack 7141, win 7606, options [nop,nop,TS val 63027 ecr 4294799204,nop,nop,sack 2 {24277:25705}{19993:22849},mptcp dss ack 2858445819], length 0
17:11:10.623090 IP 112.26.1.1.targus-getdata1 > 112.26.1.8.57531: Flags [.], ack 7141, win 7606, options [nop,nop,TS val 63027 ecr 4294799204,nop,nop,sack 2 {24277:25705}{19993:22849},mptcp dss ack 2858445819], length 0
17:11:10.716558 IP 112.26.1.8.57531 > 112.26.1.1.targus-getdata1: Flags [.], seq 25705:27133, ack 0, win 4107, options [nop,nop,TS val 4294801004 ecr 61557,mptcp dss ack 569926353 seq 2858552919 subseq 426973 len 1428 csum 0x5949], length 1428
17:11:10.716872 IP 112.26.1.8.57531 > 112.26.1.1.targus-getdata1: Flags [.], seq 25705:27133, ack 0, win 4107, options [nop,nop,TS val 4294801004 ecr 61557,mptcp dss ack 569926353 seq 2858552919 subseq 426973 len 1428 csum 0x5949], length 1428
17:11:10.719594 IP 112.26.1.1.targus-getdata1 > 112.26.1.8.57531: Flags [.], ack 7141, win 7606, options [nop,nop,TS val 63132 ecr 4294799204,nop,nop,sack 2 {24277:27133}{19993:22849},mptcp dss ack 2858445819], length 0
17:11:10.732318 IP 112.26.1.1.targus-getdata1 > 112.26.1.8.57531: Flags [.], ack 7141, win 7606, options [nop,nop,TS val 63132 ecr 4294799204,nop,nop,sack 2 {24277:27133}{19993:22849},mptcp dss ack 2858445819], length 0
17:11:10.810949 IP 112.26.1.8.57531 > 112.26.1.1.targus-getdata1: Flags [.], seq 27133:28561, ack 0, win 4107, options [nop,nop,TS val 4294801004 ecr 61557,mptcp dss ack 569926353 seq 2858554347 subseq 428401 len 1428 csum 0xa094], length 1428
17:11:10.811272 IP 112.26.1.8.57531 > 112.26.1.1.targus-getdata1: Flags [.], seq 27133:28561, ack 0, win 4107, options [nop,nop,TS val 4294801004 ecr 61557,mptcp dss ack 569926353 seq 2858554347 subseq 428401 len 1428 csum 0xa094], length 1428
17:11:10.814450 IP 112.26.1.1.targus-getdata1 > 112.26.1.8.57531: Flags [.], ack 7141, win 7606, options [nop,nop,TS val 63227 ecr 4294799204,nop,nop,sack 2 {24277:28561}{19993:22849},mptcp dss ack 2858445819], length 0
17:11:10.818847 IP 112.26.1.1.targus-getdata1 > 112.26.1.8.57531: Flags [.], ack 7141, win 7606, options [nop,nop,TS val 63227 ecr 4294799204,nop,nop,sack 2 {24277:28561}{19993:22849},mptcp dss ack 2858445819], length 0
17:11:10.896323 IP 112.26.1.8.57531 > 112.26.1.1.targus-getdata1: Flags [.], seq 28561:29989, ack 0, win 4107, options [nop,nop,TS val 4294801004 ecr 61557,mptcp dss ack 569926353 seq 2858555775 subseq 429829 len 1428 csum 0x964e], length 1428
17:11:10.896651 IP 112.26.1.8.57531 > 112.26.1.1.targus-getdata1: Flags [.], seq 28561:29989, ack 0, win 4107, options [nop,nop,TS val 4294801004 ecr 61557,mptcp dss ack 569926353 seq 2858555775 subseq 429829 len 1428 csum 0x964e], length 1428
17:11:10.904520 IP 112.26.1.1.targus-getdata1 > 112.26.1.8.57531: Flags [.], ack 7141, win 7606, options [nop,nop,TS val 63313 ecr 4294799204,nop,nop,sack 2 {24277:29989}{19993:22849},mptcp dss ack 2858445819], length 0
17:11:10.938806 IP 112.26.1.1.targus-getdata1 > 112.26.1.8.57531: Flags [.], ack 7141, win 7606, options [nop,nop,TS val 63313 ecr 4294799204,nop,nop,sack 2 {24277:29989}{19993:22849},mptcp dss ack 2858445819], length 0
17:11:10.984409 IP 112.26.1.8.57531 > 112.26.1.1.targus-getdata1: Flags [.], seq 31417:32845, ack 0, win 4107, options [nop,nop,TS val 4294801004 ecr 61557,mptcp dss ack 569926353 seq 2858558631 subseq 432685 len 1428 csum 0xf750], length 1428
17:11:10.984734 IP 112.26.1.8.57531 > 112.26.1.1.targus-getdata1: Flags [.], seq 31417:32845, ack 0, win 4107, options [nop,nop,TS val 4294801004 ecr 61557,mptcp dss ack 569926353 seq 2858558631 subseq 432685 len 1428 csum 0xf750], length 1428
17:11:10.997589 IP 112.26.1.1.targus-getdata1 > 112.26.1.8.57531: Flags [.], ack 7141, win 7595, options [nop,nop,TS val 63409 ecr 4294799204,nop,nop,sack 2 {31417:32845}{24277:29989},mptcp dss ack 2858447247], length 0
17:11:11.003300 IP 112.26.1.1.targus-getdata1 > 112.26.1.8.57531: Flags [.], ack 7141, win 7595, options [nop,nop,TS val 63409 ecr 4294799204,nop,nop,sack 2 {31417:32845}{24277:29989},mptcp dss ack 2858447247], length 0
17:11:11.088734 IP 112.26.1.1.targus-getdata1 > 112.26.1.8.57531: Flags [.], ack 7141, win 7606, options [nop,nop,TS val 62806 ecr 4294799204,nop,nop,sack 2 {21421:22849}{19993:22849},mptcp dss ack 2858445819], length 0
17:11:11.150652 IP 112.26.1.8.57531 > 112.26.1.1.targus-getdata1: Flags [.], seq 32845:34273, ack 0, win 4107, options [nop,nop,TS val 4294801296 ecr 61885,mptcp dss ack 569926353 seq 2858564343 subseq 434113 len 1428 csum 0x9a2e], length 1428
17:11:11.150948 IP 112.26.1.8.57531 > 112.26.1.1.targus-getdata1: Flags [.], seq 32845:34273, ack 0, win 4107, options [nop,nop,TS val 4294801296 ecr 61885,mptcp dss ack 569926353 seq 2858564343 subseq 434113 len 1428 csum 0x9a2e], length 1428
17:11:11.157104 IP 112.26.1.1.targus-getdata1 > 112.26.1.8.57531: Flags [.], ack 7141, win 7639, options [nop,nop,TS val 63568 ecr 4294799204,nop,nop,sack 2 {31417:34273}{24277:29989},mptcp dss ack 2858497227], length 0
17:11:11.183590 IP 112.26.1.1.targus-getdata1 > 112.26.1.8.57531: Flags [.], ack 7141, win 7639, options [nop,nop,TS val 63568 ecr 4294799204,nop,nop,sack 2 {31417:34273}{24277:29989},mptcp dss ack 2858497227], length 0
17:11:11.239280 IP 112.26.1.8.57531 > 112.26.1.1.targus-getdata1: Flags [.], seq 35701:37129, ack 0, win 4107, options [nop,nop,TS val 4294801296 ecr 61885,mptcp dss ack 569926353 seq 2858567199 subseq 436969 len 1428 csum 0xbeb6], length 1428
17:11:11.239596 IP 112.26.1.8.57531 > 112.26.1.1.targus-getdata1: Flags [.], seq 35701:37129, ack 0, win 4107, options [nop,nop,TS val 4294801296 ecr 61885,mptcp dss ack 569926353 seq 2858567199 subseq 436969 len 1428 csum 0xbeb6], length 1428
17:11:11.263499 IP 112.26.1.1.targus-getdata1 > 112.26.1.8.57531: Flags [.], ack 7141, win 7639, options [nop,nop,TS val 63675 ecr 4294799204,nop,nop,sack 2 {35701:37129}{31417:34273},mptcp dss ack 2858497227], length 0
17:11:11.264946 IP 112.26.1.1.targus-getdata1 > 112.26.1.8.57531: Flags [.], ack 7141, win 7639, options [nop,nop,TS val 63675 ecr 4294799204,nop,nop,sack 2 {35701:37129}{31417:34273},mptcp dss ack 2858497227], length 0
17:11:11.351207 IP 112.26.1.1.targus-getdata1 > 112.26.1.8.57531: Flags [.], ack 7141, win 7606, options [nop,nop,TS val 63027 ecr 4294799204,nop,nop,sack 2 {24277:25705}{19993:22849},mptcp dss ack 2858445819], length 0
17:11:11.410897 IP 112.26.1.1.targus-getdata1 > 112.26.1.8.57531: Flags [.], ack 7141, win 7606, options [nop,nop,TS val 63132 ecr 4294799204,nop,nop,sack 2 {24277:27133}{19993:22849},mptcp dss ack 2858445819], length 0
17:11:11.490119 IP 112.26.1.8.57531 > 112.26.1.1.targus-getdata1: Flags [.], seq 38557:39985, ack 0, win 4107, options [nop,nop,TS val 4294801654 ecr 62235,mptcp dss ack 569926353 seq 2858580051 subseq 439825 len 1428 csum 0x50a5], length 1428
17:11:11.490341 IP 112.26.1.8.57531 > 112.26.1.1.targus-getdata1: Flags [.], seq 38557:39985, ack 0, win 4107, options [nop,nop,TS val 4294801654 ecr 62235,mptcp dss ack 569926353 seq 2858580051 subseq 439825 len 1428 csum 0x50a5], length 1428
17:11:11.494392 IP 112.26.1.1.targus-getdata1 > 112.26.1.8.57531: Flags [.], ack 7141, win 7639, options [nop,nop,TS val 63907 ecr 4294799204,nop,nop,sack 2 {38557:39985}{35701:37129},mptcp dss ack 2858497227], length 0
17:11:11.506550 IP 112.26.1.1.targus-getdata1 > 112.26.1.8.57531: Flags [.], ack 7141, win 7639, options [nop,nop,TS val 63907 ecr 4294799204,nop,nop,sack 2 {38557:39985}{35701:37129},mptcp dss ack 2858497227], length 0
17:11:11.585664 IP 112.26.1.1.targus-getdata1 > 112.26.1.8.57531: Flags [.], ack 7141, win 7606, options [nop,nop,TS val 63313 ecr 4294799204,nop,nop,sack 2 {24277:29989}{19993:22849},mptcp dss ack 2858445819], length 0
17:11:11.662196 IP 112.26.1.1.targus-getdata1 > 112.26.1.8.57531: Flags [.], ack 7141, win 7595, options [nop,nop,TS val 63409 ecr 4294799204,nop,nop,sack 2 {31417:32845}{24277:29989},mptcp dss ack 2858447247], length 0
17:11:11.744470 IP 112.26.1.1.targus-getdata1 > 112.26.1.8.57531: Flags [.], ack 7141, win 7639, options [nop,nop,TS val 63568 ecr 4294799204,nop,nop,sack 2 {31417:34273}{24277:29989},mptcp dss ack 2858497227], length 0
17:11:11.795436 IP 112.26.1.1.targus-getdata1 > 112.26.1.8.57531: Flags [.], ack 7141, win 7639, options [nop,nop,TS val 63675 ecr 4294799204,nop,nop,sack 2 {35701:37129}{31417:34273},mptcp dss ack 2858497227], length 0
17:11:11.862225 IP 112.26.1.8.57531 > 112.26.1.1.targus-getdata1: Flags [.], seq 17137:18565, ack 0, win 4107, options [nop,nop,TS val 4294802464 ecr 63027,mptcp dss ack 569926353 seq 2858511507 subseq 418405 len 1428 csum 0x149f], length 1428
17:11:11.862445 IP 112.26.1.8.57531 > 112.26.1.1.targus-getdata1: Flags [.], seq 17137:18565, ack 0, win 4107, options [nop,nop,TS val 4294802464 ecr 63027,mptcp dss ack 569926353 seq 2858511507 subseq 418405 len 1428 csum 0x149f], length 1428
17:11:11.877371 IP 112.26.1.1.targus-getdata1 > 112.26.1.8.57531: Flags [.], ack 7141, win 7639, options [nop,nop,TS val 64281 ecr 4294799204,nop,nop,sack 2 {17137:18565}{38557:39985},mptcp dss ack 2858497227], length 0
17:11:11.879703 IP 112.26.1.1.targus-getdata1 > 112.26.1.8.57531: Flags [.], ack 7141, win 7639, options [nop,nop,TS val 64281 ecr 4294799204,nop,nop,sack 2 {17137:18565}{38557:39985},mptcp dss ack 2858497227], length 0
17:11:11.950092 IP 112.26.1.8.57531 > 112.26.1.1.targus-getdata1: Flags [.], seq 18565:19993, ack 0, win 4107, options [nop,nop,TS val 4294802523 ecr 63132,mptcp dss ack 569926353 seq 2858517219 subseq 419833 len 1428 csum 0xab97], length 1428
17:11:11.950312 IP 112.26.1.8.57531 > 112.26.1.1.targus-getdata1: Flags [.], seq 18565:19993, ack 0, win 4107, options [nop,nop,TS val 4294802523 ecr 63132,mptcp dss ack 569926353 seq 2858517219 subseq 419833 len 1428 csum 0xab97], length 1428
17:11:11.988382 IP 112.26.1.1.targus-getdata1 > 112.26.1.8.57531: Flags [.], ack 7141, win 7639, options [nop,nop,TS val 64401 ecr 4294799204,nop,nop,sack 2 {17137:19993}{38557:39985},mptcp dss ack 2858497227], length 0
17:11:11.991568 IP 112.26.1.1.targus-getdata1 > 112.26.1.8.57531: Flags [.], ack 7141, win 7639, options [nop,nop,TS val 64401 ecr 4294799204,nop,nop,sack 2 {17137:19993}{38557:39985},mptcp dss ack 2858497227], length 0
17:11:12.051998 IP 112.26.1.1.targus-getdata1 > 112.26.1.8.57531: Flags [.], ack 7141, win 7639, options [nop,nop,TS val 63907 ecr 4294799204,nop,nop,sack 2 {38557:39985}{35701:37129},mptcp dss ack 2858497227], length 0
17:11:12.107950 IP 112.26.1.8.57531 > 112.26.1.1.targus-getdata1: Flags [.], seq 22849:24277, ack 0, win 4107, options [nop,nop,TS val 4294802699 ecr 63313,mptcp dss ack 569926353 seq 2858550063 subseq 424117 len 1428 csum 0xf592], length 1428
17:11:12.108171 IP 112.26.1.8.57531 > 112.26.1.1.targus-getdata1: Flags [.], seq 22849:24277, ack 0, win 4107, options [nop,nop,TS val 4294802699 ecr 63313,mptcp dss ack 569926353 seq 2858550063 subseq 424117 len 1428 csum 0xf592], length 1428
17:11:12.116796 IP 112.26.1.1.targus-getdata1 > 112.26.1.8.57531: Flags [.], ack 7141, win 7639, options [nop,nop,TS val 64529 ecr 4294799204,nop,nop,sack 2 {22849:24277}{17137:19993},mptcp dss ack 2858497227], length 0
17:11:12.118844 IP 112.26.1.1.targus-getdata1 > 112.26.1.8.57531: Flags [.], ack 7141, win 7639, options [nop,nop,TS val 64529 ecr 4294799204,nop,nop,sack 2 {22849:24277}{17137:19993},mptcp dss ack 2858497227], length 0
17:11:12.197602 IP 112.26.1.8.57531 > 112.26.1.1.targus-getdata1: Flags [.], seq 39985:41413, ack 0, win 4107, options [nop,nop,TS val 4294802735 ecr 63313,mptcp dss ack 569926353 seq 2858618607 subseq 441253 len 1428 csum 0x53a4], length 1428
17:11:12.197804 IP 112.26.1.8.57531 > 112.26.1.1.targus-getdata1: Flags [.], seq 39985:41413, ack 0, win 4107, options [nop,nop,TS val 4294802735 ecr 63313,mptcp dss ack 569926353 seq 2858618607 subseq 441253 len 1428 csum 0x53a4], length 1428
17:11:12.235290 IP 112.26.1.1.targus-getdata1 > 112.26.1.8.57531: Flags [.], ack 7141, win 7639, options [nop,nop,TS val 64614 ecr 4294799204,nop,nop,sack 2 {38557:41413}{22849:24277},mptcp dss ack 2858497227], length 0
17:11:12.238568 IP 112.26.1.1.targus-getdata1 > 112.26.1.8.57531: Flags [.], ack 7141, win 7639, options [nop,nop,TS val 64614 ecr 4294799204,nop,nop,sack 2 {38557:41413}{22849:24277},mptcp dss ack 2858497227], length 0
17:11:12.307474 IP 112.26.1.8.57531 > 112.26.1.1.targus-getdata1: Flags [.], seq 29989:31417, ack 0, win 4107, options [nop,nop,TS val 4294802775 ecr 63409,mptcp dss ack 569926353 seq 2858557203 subseq 431257 len 1428 csum 0x88a3], length 1428
17:11:12.307712 IP 112.26.1.8.57531 > 112.26.1.1.targus-getdata1: Flags [.], seq 29989:31417, ack 0, win 4107, options [nop,nop,TS val 4294802775 ecr 63409,mptcp dss ack 569926353 seq 2858557203 subseq 431257 len 1428 csum 0x88a3], length 1428
17:11:12.313265 IP 112.26.1.1.targus-getdata1 > 112.26.1.8.57531: Flags [.], ack 7141, win 7606, options [nop,nop,TS val 64725 ecr 4294799204,nop,nop,sack 2 {29989:31417}{38557:41413},mptcp dss ack 2858501511], length 0
17:11:12.318250 IP 112.26.1.1.targus-getdata1 > 112.26.1.8.57531: Flags [.], ack 7141, win 7606, options [nop,nop,TS val 64725 ecr 4294799204,nop,nop,sack 2 {29989:31417}{38557:41413},mptcp dss ack 2858501511], length 0
17:11:12.402832 IP 112.26.1.8.57531 > 112.26.1.1.targus-getdata1: Flags [.], seq 41413:42841, ack 0, win 4107, options [nop,nop,TS val 4294802895 ecr 63568,mptcp dss ack 569926353 seq 2858627175 subseq 442681 len 1428 csum 0xfff5], length 1428
17:11:12.403181 IP 112.26.1.8.57531 > 112.26.1.1.targus-getdata1: Flags [.], seq 41413:42841, ack 0, win 4107, options [nop,nop,TS val 4294802895 ecr 63568,mptcp dss ack 569926353 seq 2858627175 subseq 442681 len 1428 csum 0xfff5], length 1428
17:11:12.409585 IP 112.26.1.1.targus-getdata1 > 112.26.1.8.57531: Flags [.], ack 7141, win 7606, options [nop,nop,TS val 64819 ecr 4294799204,nop,nop,sack 2 {38557:42841}{29989:31417},mptcp dss ack 2858501511], length 0
17:11:12.426491 IP 112.26.1.1.targus-getdata1 > 112.26.1.8.57531: Flags [.], ack 7141, win 7606, options [nop,nop,TS val 64819 ecr 4294799204,nop,nop,sack 2 {38557:42841}{29989:31417},mptcp dss ack 2858501511], length 0
17:11:12.471970 IP 112.26.1.1.targus-getdata1 > 112.26.1.8.57531: Flags [.], ack 7141, win 7639, options [nop,nop,TS val 64281 ecr 4294799204,nop,nop,sack 2 {17137:18565}{38557:39985},mptcp dss ack 2858497227], length 0
17:11:12.556240 IP 112.26.1.8.57531 > 112.26.1.1.targus-getdata1: Flags [.], seq 34273:35701, ack 0, win 4107, options [nop,nop,TS val 4294802908 ecr 63675,mptcp dss ack 569926353 seq 2858565771 subseq 435541 len 1428 csum 0x3d3b], length 1428
17:11:12.556453 IP 112.26.1.8.57531 > 112.26.1.1.targus-getdata1: Flags [.], seq 34273:35701, ack 0, win 4107, options [nop,nop,TS val 4294802908 ecr 63675,mptcp dss ack 569926353 seq 2858565771 subseq 435541 len 1428 csum 0x3d3b], length 1428
17:11:12.565386 IP 112.26.1.1.targus-getdata1 > 112.26.1.8.57531: Flags [.], ack 7141, win 7606, options [nop,nop,TS val 64974 ecr 4294799204,nop,nop,sack 2 {34273:35701}{38557:42841},mptcp dss ack 2858501511], length 0
17:11:12.589661 IP 112.26.1.1.targus-getdata1 > 112.26.1.8.57531: Flags [.], ack 7141, win 7606, options [nop,nop,TS val 64974 ecr 4294799204,nop,nop,sack 2 {34273:35701}{38557:42841},mptcp dss ack 2858501511], length 0
17:11:12.637551 IP 112.26.1.1.targus-getdata1 > 112.26.1.8.57531: Flags [.], ack 7141, win 7639, options [nop,nop,TS val 64401 ecr 4294799204,nop,nop,sack 2 {17137:19993}{38557:39985},mptcp dss ack 2858497227], length 0
17:11:12.717043 IP 112.26.1.8.57531 > 112.26.1.1.targus-getdata1: Flags [.], seq 7141:8569, ack 0, win 4107, options [nop,nop,TS val 4294803165 ecr 63907,mptcp dss ack 569926353 seq 2858501511 subseq 408409 len 1428 csum 0xc43f], length 1428
17:11:12.717266 IP 112.26.1.8.57531 > 112.26.1.1.targus-getdata1: Flags [.], seq 7141:8569, ack 0, win 4107, options [nop,nop,TS val 4294803165 ecr 63907,mptcp dss ack 569926353 seq 2858501511 subseq 408409 len 1428 csum 0xc43f], length 1428
17:11:12.724183 IP 112.26.1.1.targus-getdata1 > 112.26.1.8.57531: Flags [.], ack 14281, win 7551, options [nop,nop,TS val 65133 ecr 4294803165,nop,nop,sack 2 {34273:35701}{38557:42841},mptcp dss ack 2858508651], length 0
17:11:12.731093 IP 112.26.1.1.targus-getdata1 > 112.26.1.8.57531: Flags [.], ack 14281, win 7551, options [nop,nop,TS val 65133 ecr 4294803165,nop,nop,sack 2 {34273:35701}{38557:42841},mptcp dss ack 2858508651], length 0
17:11:12.793091 IP 112.26.1.1.targus-getdata1 > 112.26.1.8.57531: Flags [.], ack 7141, win 7639, options [nop,nop,TS val 64529 ecr 4294799204,nop,nop,sack 2 {22849:24277}{17137:19993},mptcp dss ack 2858497227], length 0
17:11:12.854633 IP 112.26.1.1.targus-getdata1 > 112.26.1.8.57531: Flags [.], ack 7141, win 7639, options [nop,nop,TS val 64614 ecr 4294799204,nop,nop,sack 2 {38557:41413}{22849:24277},mptcp dss ack 2858497227], length 0
17:11:12.917790 IP 112.26.1.1.targus-getdata1 > 112.26.1.8.57531: Flags [.], ack 7141, win 7606, options [nop,nop,TS val 64725 ecr 4294799204,nop,nop,sack 2 {29989:31417}{38557:41413},mptcp dss ack 2858501511], length 0
17:11:12.956702 IP 112.26.1.1.targus-getdata1 > 112.26.1.8.57531: Flags [.], ack 7141, win 7606, options [nop,nop,TS val 64819 ecr 4294799204,nop,nop,sack 2 {38557:42841}{29989:31417},mptcp dss ack 2858501511], length 0
17:11:13.050098 IP 112.26.1.8.57531 > 112.26.1.1.targus-getdata1: Flags [.], seq 14281:15709, ack 0, win 4107, options [nop,nop,TS val 4294803585 ecr 64281,mptcp dss ack 569926353 seq 2858508651 subseq 415549 len 1428 csum 0x9428], length 1428
17:11:13.050328 IP 112.26.1.8.57531 > 112.26.1.1.targus-getdata1: Flags [.], seq 14281:15709, ack 0, win 4107, options [nop,nop,TS val 4294803585 ecr 64281,mptcp dss ack 569926353 seq 2858508651 subseq 415549 len 1428 csum 0x9428], length 1428
17:11:13.054494 IP 112.26.1.1.targus-getdata1 > 112.26.1.8.57531: Flags [.], ack 37129, win 7089, options [nop,nop,TS val 65467 ecr 4294803585,nop,nop,sack 1 {38557:42841},mptcp dss ack 2858568627], length 0
17:11:13.072395 IP 112.26.1.1.targus-getdata1 > 112.26.1.8.57531: Flags [.], ack 37129, win 7089, options [nop,nop,TS val 65467 ecr 4294803585,nop,nop,sack 1 {38557:42841},mptcp dss ack 2858568627], length 0
17:11:13.186214 IP 112.26.1.1.targus-getdata1 > 112.26.1.8.57531: Flags [.], ack 7141, win 7606, options [nop,nop,TS val 64974 ecr 4294799204,nop,nop,sack 2 {34273:35701}{38557:42841},mptcp dss ack 2858501511], length 0
17:11:13.241670 IP 112.26.1.8.57531 > 112.26.1.1.targus-getdata1: Flags [.], seq 37129:38557, ack 0, win 4107, options [nop,nop,TS val 4294803750 ecr 64401,mptcp dss ack 569926353 seq 2858568627 subseq 438397 len 1428 csum 0x90fb], length 1428
17:11:13.241950 IP 112.26.1.8.57531 > 112.26.1.1.targus-getdata1: Flags [.], seq 37129:38557, ack 0, win 4107, options [nop,nop,TS val 4294803750 ecr 64401,mptcp dss ack 569926353 seq 2858568627 subseq 438397 len 1428 csum 0x90fb], length 1428
17:11:13.248307 IP 112.26.1.1.targus-getdata1 > 112.26.1.8.57531: Flags [.], ack 42841, win 7363, options [nop,nop,TS val 65658 ecr 4294803750,mptcp dss ack 2858647167], length 0
17:11:13.249591 IP 112.26.1.1.targus-getdata1 > 112.26.1.8.57531: Flags [.], ack 42841, win 7363, options [nop,nop,TS val 65658 ecr 4294803750,mptcp dss ack 2858647167], length 0
17:11:13.320497 IP 112.26.1.1.targus-getdata1 > 112.26.1.8.57531: Flags [.], ack 14281, win 7551, options [nop,nop,TS val 65133 ecr 4294803165,nop,nop,sack 2 {34273:35701}{38557:42841},mptcp dss ack 2858508651], length 0
17:11:13.402079 IP 112.26.1.8.57531 > 112.26.1.1.targus-getdata1: Flags [.], seq 42841:44269, ack 0, win 4107, options [nop,nop,TS val 4294803940 ecr 64529,mptcp dss ack 569926353 seq 2858662875 subseq 444109 len 1428 csum 0x7320], length 1428
17:11:13.402316 IP 112.26.1.8.57531 > 112.26.1.1.targus-getdata1: Flags [.], seq 42841:44269, ack 0, win 4107, options [nop,nop,TS val 4294803940 ecr 64529,mptcp dss ack 569926353 seq 2858662875 subseq 444109 len 1428 csum 0x7320], length 1428
17:11:13.406961 IP 112.26.1.1.targus-getdata1 > 112.26.1.8.57531: Flags [.], ack 44269, win 7639, options [nop,nop,TS val 65819 ecr 4294803940,mptcp dss ack 2858651451], length 0
17:11:13.412159 IP 112.26.1.1.targus-getdata1 > 112.26.1.8.57531: Flags [.], ack 44269, win 7639, options [nop,nop,TS val 65819 ecr 4294803940,mptcp dss ack 2858651451], length 0
17:11:13.532076 IP 112.26.1.8.57531 > 112.26.1.1.targus-getdata1: Flags [.], seq 44269:45697, ack 0, win 4107, options [nop,nop,TS val 4294803996 ecr 64614,mptcp dss ack 569926353 seq 2858668587 subseq 445537 len 1428 csum 0x810], length 1428
17:11:13.532305 IP 112.26.1.8.57531 > 112.26.1.1.targus-getdata1: Flags [.], seq 44269:45697, ack 0, win 4107, options [nop,nop,TS val 4294803996 ecr 64614,mptcp dss ack 569926353 seq 2858668587 subseq 445537 len 1428 csum 0x810], length 1428
17:11:13.540232 IP 112.26.1.1.targus-getdata1 > 112.26.1.8.57531: Flags [.], ack 45697, win 7639, options [nop,nop,TS val 65948 ecr 4294803996,mptcp dss ack 2858655735], length 0
17:11:13.542430 IP 112.26.1.1.targus-getdata1 > 112.26.1.8.57531: Flags [.], ack 45697, win 7639, options [nop,nop,TS val 65948 ecr 4294803996,mptcp dss ack 2858655735], length 0
17:11:13.616418 IP 112.26.1.8.57531 > 112.26.1.1.targus-getdata1: Flags [.], seq 45697:47125, ack 0, win 4107, options [nop,nop,TS val 4294804069 ecr 64725,mptcp dss ack 569926353 seq 2858671443 subseq 446965 len 1428 csum 0xd236], length 1428
17:11:13.616547 IP 112.26.1.8.57531 > 112.26.1.1.targus-getdata1: Flags [.], seq 45697:47125, ack 0, win 4107, options [nop,nop,TS val 4294804069 ecr 64725,mptcp dss ack 569926353 seq 2858671443 subseq 446965 len 1428 csum 0xd236], length 1428
17:11:13.636342 IP 112.26.1.1.targus-getdata1 > 112.26.1.8.57531: Flags [.], ack 47125, win 7639, options [nop,nop,TS val 66049 ecr 4294804069,mptcp dss ack 2858655735], length 0
17:11:13.648309 IP 112.26.1.1.targus-getdata1 > 112.26.1.8.57531: Flags [.], ack 47125, win 7639, options [nop,nop,TS val 66049 ecr 4294804069,mptcp dss ack 2858655735], length 0
17:11:13.732149 IP 112.26.1.1.targus-getdata1 > 112.26.1.8.57531: Flags [.], ack 37129, win 7089, options [nop,nop,TS val 65467 ecr 4294803585,nop,nop,sack 1 {38557:42841},mptcp dss ack 2858568627], length 0
17:11:13.771382 IP 112.26.1.8.57531 > 112.26.1.1.targus-getdata1: Flags [.], seq 48553:49981, ack 0, win 4107, options [nop,nop,TS val 4294804320 ecr 64974,mptcp dss ack 569926353 seq 2858687151 subseq 449821 len 1428 csum 0x33ab], length 1428
17:11:13.771613 IP 112.26.1.8.57531 > 112.26.1.1.targus-getdata1: Flags [.], seq 48553:49981, ack 0, win 4107, options [nop,nop,TS val 4294804320 ecr 64974,mptcp dss ack 569926353 seq 2858687151 subseq 449821 len 1428 csum 0x33ab], length 1428
17:11:13.780324 IP 112.26.1.1.targus-getdata1 > 112.26.1.8.57531: Flags [.], ack 47125, win 7639, options [nop,nop,TS val 66188 ecr 4294804069,nop,nop,sack 1 {48553:49981},mptcp dss ack 2858655735], length 0
17:11:13.785505 IP 112.26.1.1.targus-getdata1 > 112.26.1.8.57531: Flags [.], ack 47125, win 7639, options [nop,nop,TS val 66188 ecr 4294804069,nop,nop,sack 1 {48553:49981},mptcp dss ack 2858655735], length 0
17:11:13.872014 IP 112.26.1.1.targus-getdata1 > 112.26.1.8.57531: Flags [.], ack 42841, win 7363, options [nop,nop,TS val 65658 ecr 4294803750,mptcp dss ack 2858647167], length 0
17:11:13.939475 IP 112.26.1.8.57531 > 112.26.1.1.targus-getdata1: Flags [.], seq 49981:51409, ack 0, win 4107, options [nop,nop,TS val 4294804433 ecr 65133,mptcp dss ack 569926353 seq 2858694291 subseq 451249 len 1428 csum 0x4515], length 1428
17:11:13.939687 IP 112.26.1.8.57531 > 112.26.1.1.targus-getdata1: Flags [.], seq 49981:51409, ack 0, win 4107, options [nop,nop,TS val 4294804433 ecr 65133,mptcp dss ack 569926353 seq 2858694291 subseq 451249 len 1428 csum 0x4515], length 1428
17:11:13.946782 IP 112.26.1.1.targus-getdata1 > 112.26.1.8.57531: Flags [.], ack 47125, win 7639, options [nop,nop,TS val 66356 ecr 4294804069,nop,nop,sack 1 {48553:51409},mptcp dss ack 2858655735], length 0
17:11:13.948192 IP 112.26.1.1.targus-getdata1 > 112.26.1.8.57531: Flags [.], ack 47125, win 7639, options [nop,nop,TS val 66356 ecr 4294804069,nop,nop,sack 1 {48553:51409},mptcp dss ack 2858655735], length 0
17:11:14.031506 IP 112.26.1.1.targus-getdata1 > 112.26.1.8.57531: Flags [.], ack 44269, win 7639, options [nop,nop,TS val 65819 ecr 4294803940,mptcp dss ack 2858651451], length 0
17:11:14.099590 IP 112.26.1.8.57531 > 112.26.1.1.targus-getdata1: Flags [.], seq 51409:52837, ack 0, win 4107, options [nop,nop,TS val 4294804433 ecr 65133,mptcp dss ack 569926353 seq 2858695719 subseq 452677 len 1428 csum 0xa0fa], length 1428
17:11:14.099812 IP 112.26.1.8.57531 > 112.26.1.1.targus-getdata1: Flags [.], seq 51409:52837, ack 0, win 4107, options [nop,nop,TS val 4294804433 ecr 65133,mptcp dss ack 569926353 seq 2858695719 subseq 452677 len 1428 csum 0xa0fa], length 1428
17:11:14.147225 IP 112.26.1.1.targus-getdata1 > 112.26.1.8.57531: Flags [.], ack 47125, win 7639, options [nop,nop,TS val 66516 ecr 4294804069,nop,nop,sack 1 {48553:52837},mptcp dss ack 2858655735], length 0
17:11:14.148904 IP 112.26.1.1.targus-getdata1 > 112.26.1.8.57531: Flags [.], ack 47125, win 7639, options [nop,nop,TS val 66516 ecr 4294804069,nop,nop,sack 1 {48553:52837},mptcp dss ack 2858655735], length 0
