20:00:07.477395 IP 112.26.0.8.35128 > 112.26.0.1.34747: Flags [S], seq 2611020501, win 29200, options [mss 1460,sackOK,TS val 4294904234 ecr 0,nop,wscale 7], length 0
20:00:07.493520 IP 112.26.0.8.35128 > 112.26.0.1.34747: Flags [S], seq 2611020501, win 29200, options [mss 1460,sackOK,TS val 4294904234 ecr 0,nop,wscale 7], length 0
20:00:07.554243 IP 112.26.0.1.34747 > 112.26.0.8.35128: Flags [S.], seq 2195574532, ack 2611020502, win 65535, options [mss 1460,sackOK,TS val 164054 ecr 4294904234,nop,wscale 6], length 0
20:00:07.670445 IP 112.26.0.1.34747 > 112.26.0.8.35128: Flags [S.], seq 2195574532, ack 2611020502, win 65535, options [mss 1460,sackOK,TS val 164054 ecr 4294904234,nop,wscale 6], length 0
20:00:07.856484 IP 112.26.0.1.34747 > 112.26.0.8.35128: Flags [.], seq 1:1449, ack 1, win 1358, options [nop,nop,TS val 164324 ecr 4294904544], length 1448
20:00:07.864756 IP 112.26.0.1.34747 > 112.26.0.8.35128: Flags [.], seq 1449:2897, ack 1, win 1358, options [nop,nop,TS val 164324 ecr 4294904544], length 1448
20:00:07.870692 IP 112.26.0.1.34747 > 112.26.0.8.35128: Flags [.], seq 1:1449, ack 1, win 1358, options [nop,nop,TS val 164324 ecr 4294904544], length 1448
20:00:07.962693 IP 112.26.0.1.34747 > 112.26.0.8.35128: Flags [.], seq 2897:4345, ack 1, win 1358, options [nop,nop,TS val 164324 ecr 4294904544], length 1448
20:00:07.985217 IP 112.26.0.1.34747 > 112.26.0.8.35128: Flags [.], seq 4345:5793, ack 1, win 1358, options [nop,nop,TS val 164325 ecr 4294904544], length 1448
20:00:07.986491 IP 112.26.0.1.34747 > 112.26.0.8.35128: Flags [.], seq 1449:2897, ack 1, win 1358, options [nop,nop,TS val 164324 ecr 4294904544], length 1448
20:00:08.057624 IP 112.26.0.1.34747 > 112.26.0.8.35128: Flags [.], seq 5793:7241, ack 1, win 1358, options [nop,nop,TS val 164325 ecr 4294904544], length 1448
20:00:08.065986 IP 112.26.0.1.34747 > 112.26.0.8.35128: Flags [.], seq 7241:8689, ack 1, win 1358, options [nop,nop,TS val 164325 ecr 4294904544], length 1448
20:00:08.077567 IP 112.26.0.1.34747 > 112.26.0.8.35128: Flags [.], seq 2897:4345, ack 1, win 1358, options [nop,nop,TS val 164324 ecr 4294904544], length 1448
20:00:08.092077 IP 112.26.0.1.34747 > 112.26.0.8.35128: Flags [.], seq 8689:10137, ack 1, win 1358, options [nop,nop,TS val 164325 ecr 4294904544], length 1448
20:00:08.176185 IP 112.26.0.1.34747 > 112.26.0.8.35128: Flags [.], seq 10137:11585, ack 1, win 1358, options [nop,nop,TS val 164325 ecr 4294904544], length 1448
20:00:08.187657 IP 112.26.0.1.34747 > 112.26.0.8.35128: Flags [.], seq 4345:5793, ack 1, win 1358, options [nop,nop,TS val 164325 ecr 4294904544], length 1448
20:00:08.267608 IP 112.26.0.1.34747 > 112.26.0.8.35128: Flags [.], seq 11585:13033, ack 1, win 1358, options [nop,nop,TS val 164325 ecr 4294904544], length 1448
20:00:08.278050 IP 112.26.0.1.34747 > 112.26.0.8.35128: Flags [.], seq 5793:7241, ack 1, win 1358, options [nop,nop,TS val 164325 ecr 4294904544], length 1448
20:00:08.289353 IP 112.26.0.1.34747 > 112.26.0.8.35128: Flags [.], seq 13033:14481, ack 1, win 1358, options [nop,nop,TS val 164325 ecr 4294904544], length 1448
20:00:08.364022 IP 112.26.0.1.34747 > 112.26.0.8.35128: Flags [.], seq 14481:15929, ack 1, win 1358, options [nop,nop,TS val 164721 ecr 4294904745], length 1448
20:00:08.385014 IP 112.26.0.1.34747 > 112.26.0.8.35128: Flags [.], seq 15929:17377, ack 1, win 1358, options [nop,nop,TS val 164721 ecr 4294904745], length 1448
20:00:08.457763 IP 112.26.0.1.34747 > 112.26.0.8.35128: Flags [.], seq 17377:18825, ack 1, win 1358, options [nop,nop,TS val 164958 ecr 4294904851], length 1448
20:00:08.470354 IP 112.26.0.1.34747 > 112.26.0.8.35128: Flags [.], seq 7241:8689, ack 1, win 1358, options [nop,nop,TS val 164325 ecr 4294904544], length 1448
20:00:08.485539 IP 112.26.0.1.34747 > 112.26.0.8.35128: Flags [.], seq 18825:20273, ack 1, win 1358, options [nop,nop,TS val 164958 ecr 4294904851], length 1448
20:00:08.499315 IP 112.26.0.1.34747 > 112.26.0.8.35128: Flags [.], seq 8689:10137, ack 1, win 1358, options [nop,nop,TS val 164325 ecr 4294904544], length 1448
20:00:08.573473 IP 112.26.0.1.34747 > 112.26.0.8.35128: Flags [.], seq 20273:21721, ack 1, win 1358, options [nop,nop,TS val 165130 ecr 4294904951], length 1448
20:00:08.584813 IP 112.26.0.1.34747 > 112.26.0.8.35128: Flags [.], seq 21721:23169, ack 1, win 1358, options [nop,nop,TS val 165130 ecr 4294904951], length 1448
20:00:08.668628 IP 112.26.0.1.34747 > 112.26.0.8.35128: Flags [.], seq 10137:11585, ack 1, win 1358, options [nop,nop,TS val 164325 ecr 4294904544], length 1448
20:00:08.771632 IP 112.26.0.1.34747 > 112.26.0.8.35128: Flags [.], seq 23169:24617, ack 1, win 1358, options [nop,nop,TS val 165328 ecr 4294905061], length 1448
20:00:08.787505 IP 112.26.0.1.34747 > 112.26.0.8.35128: Flags [.], seq 24617:26065, ack 1, win 1358, options [nop,nop,TS val 165328 ecr 4294905061], length 1448
20:00:08.858782 IP 112.26.0.1.34747 > 112.26.0.8.35128: Flags [.], seq 14481:15929, ack 1, win 1358, options [nop,nop,TS val 164721 ecr 4294904745], length 1448
20:00:08.868801 IP 112.26.0.1.34747 > 112.26.0.8.35128: Flags [.], seq 26065:27513, ack 1, win 1358, options [nop,nop,TS val 165342 ecr 4294905150], length 1448
20:00:08.881274 IP 112.26.0.1.34747 > 112.26.0.8.35128: Flags [.], seq 27513:28961, ack 1, win 1358, options [nop,nop,TS val 165342 ecr 4294905150], length 1448
20:00:08.890149 IP 112.26.0.1.34747 > 112.26.0.8.35128: Flags [.], seq 15929:17377, ack 1, win 1358, options [nop,nop,TS val 164721 ecr 4294904745], length 1448
20:00:08.966941 IP 112.26.0.1.34747 > 112.26.0.8.35128: Flags [.], seq 18825:20273, ack 1, win 1358, options [nop,nop,TS val 164958 ecr 4294904851], length 1448
20:00:09.065768 IP 112.26.0.1.34747 > 112.26.0.8.35128: Flags [.], seq 21721:23169, ack 1, win 1358, options [nop,nop,TS val 165130 ecr 4294904951], length 1448
20:00:09.169994 IP 112.26.0.1.34747 > 112.26.0.8.35128: Flags [.], seq 28961:30409, ack 1, win 1358, options [nop,nop,TS val 165727 ecr 4294905540], length 1448
20:00:09.179348 IP 112.26.0.1.34747 > 112.26.0.8.35128: Flags [.], seq 23169:24617, ack 1, win 1358, options [nop,nop,TS val 165328 ecr 4294905061], length 1448
20:00:09.187237 IP 112.26.0.1.34747 > 112.26.0.8.35128: Flags [.], seq 30409:31857, ack 1, win 1358, options [nop,nop,TS val 165727 ecr 4294905540], length 1448
20:00:09.272366 IP 112.26.0.1.34747 > 112.26.0.8.35128: Flags [.], seq 24617:26065, ack 1, win 1358, options [nop,nop,TS val 165328 ecr 4294905061], length 1448
20:00:09.276674 IP 112.26.0.1.34747 > 112.26.0.8.35128: Flags [.], seq 31857:33305, ack 1, win 1358, options [nop,nop,TS val 165727 ecr 4294905540], length 1448
20:00:09.295542 IP 112.26.0.1.34747 > 112.26.0.8.35128: Flags [.], seq 33305:34753, ack 1, win 1358, options [nop,nop,TS val 165727 ecr 4294905540], length 1448
20:00:09.365156 IP 112.26.0.1.34747 > 112.26.0.8.35128: Flags [.], seq 26065:27513, ack 1, win 1358, options [nop,nop,TS val 165342 ecr 4294905150], length 1448
20:00:09.378535 IP 112.26.0.1.34747 > 112.26.0.8.35128: Flags [.], seq 34753:36201, ack 1, win 1358, options [nop,nop,TS val 165727 ecr 4294905540], length 1448
20:00:09.397142 IP 112.26.0.1.34747 > 112.26.0.8.35128: Flags [.], seq 36201:37649, ack 1, win 1358, options [nop,nop,TS val 165727 ecr 4294905540], length 1448
20:00:09.468591 IP 112.26.0.1.34747 > 112.26.0.8.35128: Flags [.], seq 11585:13033, ack 1, win 1358, options [nop,nop,TS val 165951 ecr 4294905764], length 1448
20:00:09.479264 IP 112.26.0.1.34747 > 112.26.0.8.35128: Flags [.], seq 37649:39097, ack 1, win 1358, options [nop,nop,TS val 165951 ecr 4294905764], length 1448
20:00:09.570239 IP 112.26.0.1.34747 > 112.26.0.8.35128: Flags [.], seq 28961:30409, ack 1, win 1358, options [nop,nop,TS val 165727 ecr 4294905540], length 1448
20:00:09.581131 IP 112.26.0.1.34747 > 112.26.0.8.35128: Flags [.], seq 13033:14481, ack 1, win 1358, options [nop,nop,TS val 166034 ecr 4294905940], length 1448
20:00:09.667390 IP 112.26.0.1.34747 > 112.26.0.8.35128: Flags [.], seq 30409:31857, ack 1, win 1358, options [nop,nop,TS val 165727 ecr 4294905540], length 1448
20:00:09.765952 IP 112.26.0.1.34747 > 112.26.0.8.35128: Flags [.], seq 31857:33305, ack 1, win 1358, options [nop,nop,TS val 165727 ecr 4294905540], length 1448
20:00:09.869797 IP 112.26.0.1.34747 > 112.26.0.8.35128: Flags [.], seq 33305:34753, ack 1, win 1358, options [nop,nop,TS val 165727 ecr 4294905540], length 1448
20:00:09.885344 IP 112.26.0.1.34747 > 112.26.0.8.35128: Flags [.], seq 34753:36201, ack 1, win 1358, options [nop,nop,TS val 165727 ecr 4294905540], length 1448
20:00:09.971987 IP 112.26.0.1.34747 > 112.26.0.8.35128: Flags [.], seq 11585:13033, ack 1, win 1358, options [nop,nop,TS val 165951 ecr 4294905764], length 1448
20:00:10.004812 IP 112.26.0.1.34747 > 112.26.0.8.35128: Flags [.], seq 17377:18825, ack 1, win 1358, options [nop,nop,TS val 166561 ecr 4294906444], length 1448
20:00:10.072439 IP 112.26.0.1.34747 > 112.26.0.8.35128: Flags [.], seq 37649:39097, ack 1, win 1358, options [nop,nop,TS val 165951 ecr 4294905764], length 1448
20:00:10.081289 IP 112.26.0.1.34747 > 112.26.0.8.35128: Flags [.], seq 20273:21721, ack 1, win 1358, options [nop,nop,TS val 166561 ecr 4294906444], length 1448
20:00:10.097246 IP 112.26.0.1.34747 > 112.26.0.8.35128: Flags [.], seq 27513:28961, ack 1, win 1358, options [nop,nop,TS val 166561 ecr 4294906444], length 1448
20:00:10.170253 IP 112.26.0.1.34747 > 112.26.0.8.35128: Flags [.], seq 39097:40545, ack 1, win 1358, options [nop,nop,TS val 166650 ecr 4294906541], length 1448
20:00:10.178521 IP 112.26.0.1.34747 > 112.26.0.8.35128: Flags [.], seq 40545:41993, ack 1, win 1358, options [nop,nop,TS val 166721 ecr 4294906640], length 1448
20:00:10.278186 IP 112.26.0.1.34747 > 112.26.0.8.35128: Flags [.], seq 41993:43441, ack 1, win 1358, options [nop,nop,TS val 166734 ecr 4294906744], length 1448
20:00:10.321283 IP 112.26.0.1.34747 > 112.26.0.8.35128: Flags [.], seq 43441:44889, ack 1, win 1358, options [nop,nop,TS val 166879 ecr 4294906759], length 1448
20:00:10.410616 IP 112.26.0.1.34747 > 112.26.0.8.35128: Flags [.], seq 36201:37649, ack 1, win 1358, options [nop,nop,TS val 166964 ecr 4294906846], length 1448
20:00:10.467756 IP 112.26.0.1.34747 > 112.26.0.8.35128: Flags [.], seq 44889:46337, ack 1, win 1358, options [nop,nop,TS val 166964 ecr 4294906846], length 1448
20:00:10.493637 IP 112.26.0.1.34747 > 112.26.0.8.35128: Flags [.], seq 17377:18825, ack 1, win 1358, options [nop,nop,TS val 166561 ecr 4294906444], length 1448
20:00:10.499181 IP 112.26.0.1.34747 > 112.26.0.8.35128: Flags [.], seq 46337:47785, ack 1, win 1358, options [nop,nop,TS val 166964 ecr 4294906846], length 1448
20:00:10.600146 IP 112.26.0.1.34747 > 112.26.0.8.35128: Flags [.], seq 27513:28961, ack 1, win 1358, options [nop,nop,TS val 166561 ecr 4294906444], length 1448
20:00:10.605928 IP 112.26.0.1.34747 > 112.26.0.8.35128: Flags [.], seq 47785:49233, ack 1, win 1358, options [nop,nop,TS val 167075 ecr 4294906946], length 1448
20:00:10.691929 IP 112.26.0.1.34747 > 112.26.0.8.35128: Flags [.], seq 39097:40545, ack 1, win 1358, options [nop,nop,TS val 166650 ecr 4294906541], length 1448
20:00:10.784886 IP 112.26.0.1.34747 > 112.26.0.8.35128: Flags [.], seq 40545:41993, ack 1, win 1358, options [nop,nop,TS val 166721 ecr 4294906640], length 1448
20:00:10.814205 IP 112.26.0.1.34747 > 112.26.0.8.35128: Flags [.], seq 41993:43441, ack 1, win 1358, options [nop,nop,TS val 166734 ecr 4294906744], length 1448
20:00:10.976558 IP 112.26.0.1.34747 > 112.26.0.8.35128: Flags [.], seq 43441:44889, ack 1, win 1358, options [nop,nop,TS val 166879 ecr 4294906759], length 1448
20:00:10.988657 IP 112.26.0.1.34747 > 112.26.0.8.35128: Flags [.], seq 13033:14481, ack 1, win 1358, options [nop,nop,TS val 167546 ecr 4294907368], length 1448
20:00:10.998352 IP 112.26.0.1.34747 > 112.26.0.8.35128: Flags [.], seq 36201:37649, ack 1, win 1358, options [nop,nop,TS val 166964 ecr 4294906846], length 1448
20:00:11.071268 IP 112.26.0.1.34747 > 112.26.0.8.35128: Flags [.], seq 44889:46337, ack 1, win 1358, options [nop,nop,TS val 166964 ecr 4294906846], length 1448
20:00:11.083196 IP 112.26.0.1.34747 > 112.26.0.8.35128: Flags [.], seq 49233:50681, ack 1, win 1358, options [nop,nop,TS val 167637 ecr 4294907469], length 1448
20:00:11.100227 IP 112.26.0.1.34747 > 112.26.0.8.35128: Flags [.], seq 20273:21721, ack 1, win 1358, options [nop,nop,TS val 167658 ecr 4294907550], length 1448
20:00:11.170814 IP 112.26.0.1.34747 > 112.26.0.8.35128: Flags [.], seq 50681:52129, ack 1, win 1358, options [nop,nop,TS val 167728 ecr 4294907659], length 1448
20:00:11.182711 IP 112.26.0.1.34747 > 112.26.0.8.35128: Flags [.], seq 52129:53577, ack 1, win 1358, options [nop,nop,TS val 167740 ecr 4294907688], length 1448
20:00:11.272233 IP 112.26.0.1.34747 > 112.26.0.8.35128: Flags [.], seq 53577:55025, ack 1, win 1358, options [nop,nop,TS val 167750 ecr 4294907849], length 1448
20:00:11.283156 IP 112.26.0.1.34747 > 112.26.0.8.35128: Flags [.], seq 13033:14481, ack 1, win 1358, options [nop,nop,TS val 167546 ecr 4294907368], length 1448
20:00:11.374947 IP 112.26.0.1.34747 > 112.26.0.8.35128: Flags [.], seq 55025:56473, ack 1, win 1358, options [nop,nop,TS val 167932 ecr 4294907872], length 1448
20:00:11.387671 IP 112.26.0.1.34747 > 112.26.0.8.35128: Flags [.], seq 56473:57921, ack 1, win 1358, options [nop,nop,TS val 167942 ecr 4294907945], length 1448
20:00:11.394038 IP 112.26.0.1.34747 > 112.26.0.8.35128: Flags [.], seq 49233:50681, ack 1, win 1358, options [nop,nop,TS val 167637 ecr 4294907469], length 1448
20:00:11.486287 IP 112.26.0.1.34747 > 112.26.0.8.35128: Flags [.], seq 20273:21721, ack 1, win 1358, options [nop,nop,TS val 167658 ecr 4294907550], length 1448
20:00:11.584841 IP 112.26.0.1.34747 > 112.26.0.8.35128: Flags [.], seq 50681:52129, ack 1, win 1358, options [nop,nop,TS val 167728 ecr 4294907659], length 1448
20:00:11.607037 IP 112.26.0.1.34747 > 112.26.0.8.35128: Flags [.], seq 52129:53577, ack 1, win 1358, options [nop,nop,TS val 167740 ecr 4294907688], length 1448
20:00:11.682460 IP 112.26.0.1.34747 > 112.26.0.8.35128: Flags [.], seq 53577:55025, ack 1, win 1358, options [nop,nop,TS val 167750 ecr 4294907849], length 1448
20:00:11.698680 IP 112.26.0.1.34747 > 112.26.0.8.35128: Flags [.], seq 46337:47785, ack 1, win 1358, options [nop,nop,TS val 168255 ecr 4294908157], length 1448
20:00:11.774609 IP 112.26.0.1.34747 > 112.26.0.8.35128: Flags [.], seq 47785:49233, ack 1, win 1358, options [nop,nop,TS val 168255 ecr 4294908157], length 1448
20:00:11.783870 IP 112.26.0.1.34747 > 112.26.0.8.35128: Flags [.], seq 55025:56473, ack 1, win 1358, options [nop,nop,TS val 167932 ecr 4294907872], length 1448
20:00:11.803795 IP 112.26.0.1.34747 > 112.26.0.8.35128: Flags [.], seq 56473:57921, ack 1, win 1358, options [nop,nop,TS val 167942 ecr 4294907945], length 1448
20:00:11.894443 IP 112.26.0.1.34747 > 112.26.0.8.35128: Flags [.], seq 57921:59369, ack 1, win 1358, options [nop,nop,TS val 168450 ecr 4294908268], length 1448
20:00:11.972376 IP 112.26.0.1.34747 > 112.26.0.8.35128: Flags [.], seq 59369:60817, ack 1, win 1358, options [nop,nop,TS val 168464 ecr 4294908360], length 1448
20:00:11.988979 IP 112.26.0.1.34747 > 112.26.0.8.35128: Flags [.], seq 60817:62265, ack 1, win 1358, options [nop,nop,TS val 168546 ecr 4294908481], length 1448
20:00:12.080052 IP 112.26.0.1.34747 > 112.26.0.8.35128: Flags [.], seq 62265:63713, ack 1, win 1358, options [nop,nop,TS val 168635 ecr 4294908557], length 1448
20:00:12.089586 IP 112.26.0.1.34747 > 112.26.0.8.35128: Flags [.], seq 46337:47785, ack 1, win 1358, options [nop,nop,TS val 168255 ecr 4294908157], length 1448
20:00:12.192496 IP 112.26.0.1.34747 > 112.26.0.8.35128: Flags [.], seq 47785:49233, ack 1, win 1358, options [nop,nop,TS val 168255 ecr 4294908157], length 1448
20:00:12.284016 IP 112.26.0.1.34747 > 112.26.0.8.35128: Flags [.], seq 63713:65161, ack 1, win 1358, options [nop,nop,TS val 168841 ecr 4294908654], length 1448
20:00:12.299114 IP 112.26.0.1.34747 > 112.26.0.8.35128: Flags [.], seq 57921:59369, ack 1, win 1358, options [nop,nop,TS val 168450 ecr 4294908268], length 1448
20:00:12.373850 IP 112.26.0.1.34747 > 112.26.0.8.35128: Flags [.], seq 65161:66609, ack 1, win 1358, options [nop,nop,TS val 168850 ecr 4294908678], length 1448
20:00:12.398318 IP 112.26.0.1.34747 > 112.26.0.8.35128: Flags [.], seq 59369:60817, ack 1, win 1358, options [nop,nop,TS val 168464 ecr 4294908360], length 1448
20:00:12.495979 IP 112.26.0.1.34747 > 112.26.0.8.35128: Flags [.], seq 60817:62265, ack 1, win 1358, options [nop,nop,TS val 168546 ecr 4294908481], length 1448
20:00:12.574986 IP 112.26.0.1.34747 > 112.26.0.8.35128: Flags [.], seq 62265:63713, ack 1, win 1358, options [nop,nop,TS val 168635 ecr 4294908557], length 1448
20:00:12.594740 IP 112.26.0.1.34747 > 112.26.0.8.35128: Flags [.], seq 66609:68057, ack 1, win 1358, options [nop,nop,TS val 169145 ecr 4294908963], length 1448
20:00:12.613972 IP 112.26.0.1.34747 > 112.26.0.8.35128: Flags [.], seq 68057:69505, ack 1, win 1358, options [nop,nop,TS val 169171 ecr 4294909066], length 1448
20:00:12.678492 IP 112.26.0.1.34747 > 112.26.0.8.35128: Flags [.], seq 63713:65161, ack 1, win 1358, options [nop,nop,TS val 168841 ecr 4294908654], length 1448
20:00:12.701688 IP 112.26.0.1.34747 > 112.26.0.8.35128: Flags [.], seq 69505:70953, ack 1, win 1358, options [nop,nop,TS val 169259 ecr 4294909173], length 1448
20:00:12.783527 IP 112.26.0.1.34747 > 112.26.0.8.35128: Flags [.], seq 65161:66609, ack 1, win 1358, options [nop,nop,TS val 168850 ecr 4294908678], length 1448
20:00:12.808078 IP 112.26.0.8.35128 > 112.26.0.1.34747: Flags [.], ack 66609, win 1269, options [nop,nop,TS val 4294909653 ecr 168850], length 0
20:00:12.813673 IP 112.26.0.1.34747 > 112.26.0.8.35128: Flags [.], seq 70953:72401, ack 1, win 1358, options [nop,nop,TS val 169371 ecr 4294909273], length 1448
20:00:12.905726 IP 112.26.0.8.35128 > 112.26.0.1.34747: Flags [.], ack 66609, win 1269, options [nop,nop,TS val 4294909653 ecr 168850], length 0
20:00:12.916720 IP 112.26.0.1.34747 > 112.26.0.8.35128: Flags [.], seq 72401:73849, ack 1, win 1358, options [nop,nop,TS val 169464 ecr 4294909653], length 1448
20:00:12.998327 IP 112.26.0.1.34747 > 112.26.0.8.35128: Flags [.], seq 73849:75297, ack 1, win 1358, options [nop,nop,TS val 169464 ecr 4294909653], length 1448
20:00:13.010992 IP 112.26.0.1.34747 > 112.26.0.8.35128: Flags [.], seq 66609:68057, ack 1, win 1358, options [nop,nop,TS val 169145 ecr 4294908963], length 1448
20:00:13.021031 IP 112.26.0.1.34747 > 112.26.0.8.35128: Flags [.], seq 75297:76745, ack 1, win 1358, options [nop,nop,TS val 169465 ecr 4294909653], length 1448
20:00:13.091242 IP 112.26.0.8.35128 > 112.26.0.1.34747: Flags [.], ack 68057, win 1292, options [nop,nop,TS val 4294909885 ecr 169145], length 0
20:00:13.092119 IP 112.26.0.8.35128 > 112.26.0.1.34747: Flags [.], ack 68057, win 1292, options [nop,nop,TS val 4294909885 ecr 169145], length 0
20:00:13.100225 IP 112.26.0.1.34747 > 112.26.0.8.35128: Flags [.], seq 76745:78193, ack 1, win 1358, options [nop,nop,TS val 169465 ecr 4294909653], length 1448
20:00:13.113633 IP 112.26.0.1.34747 > 112.26.0.8.35128: Flags [.], seq 68057:69505, ack 1, win 1358, options [nop,nop,TS val 169171 ecr 4294909066], length 1448
20:00:13.124140 IP 112.26.0.1.34747 > 112.26.0.8.35128: Flags [.], seq 78193:79641, ack 1, win 1358, options [nop,nop,TS val 169465 ecr 4294909653], length 1448
20:00:13.195026 IP 112.26.0.1.34747 > 112.26.0.8.35128: Flags [.], ack 1, win 1358, options [nop,nop,TS val 169473 ecr 4294909653], length 0
20:00:13.197827 IP 112.26.0.8.35128 > 112.26.0.1.34747: Flags [.], ack 69505, win 1315, options [nop,nop,TS val 4294909988 ecr 169171], length 0
20:00:13.199398 IP 112.26.0.8.35128 > 112.26.0.1.34747: Flags [.], ack 69505, win 1315, options [nop,nop,TS val 4294909988 ecr 169171], length 0
20:00:13.284880 IP 112.26.0.1.34747 > 112.26.0.8.35128: Flags [.], seq 79641:81089, ack 1, win 1358, options [nop,nop,TS val 169651 ecr 4294909885], length 1448
20:00:13.290903 IP 112.26.0.1.34747 > 112.26.0.8.35128: Flags [.], seq 69505:70953, ack 1, win 1358, options [nop,nop,TS val 169259 ecr 4294909173], length 1448
20:00:13.305199 IP 112.26.0.1.34747 > 112.26.0.8.35128: Flags [.], seq 81089:82537, ack 1, win 1358, options [nop,nop,TS val 169758 ecr 4294909988], length 1448
20:00:13.389161 IP 112.26.0.8.35128 > 112.26.0.1.34747: Flags [.], ack 70953, win 1337, options [nop,nop,TS val 4294910165 ecr 169259], length 0
20:00:13.400468 IP 112.26.0.8.35128 > 112.26.0.1.34747: Flags [.], ack 70953, win 1337, options [nop,nop,TS val 4294910165 ecr 169259], length 0
20:00:13.405627 IP 112.26.0.1.34747 > 112.26.0.8.35128: Flags [.], seq 82537:83985, ack 1, win 1358, options [nop,nop,TS val 169959 ecr 4294910165], length 1448
20:00:13.406857 IP 112.26.0.1.34747 > 112.26.0.8.35128: Flags [.], seq 70953:72401, ack 1, win 1358, options [nop,nop,TS val 169371 ecr 4294909273], length 1448
20:00:13.495844 IP 112.26.0.1.34747 > 112.26.0.8.35128: Flags [.], seq 72401:73849, ack 1, win 1358, options [nop,nop,TS val 169464 ecr 4294909653], length 1448
20:00:13.518922 IP 112.26.0.1.34747 > 112.26.0.8.35128: Flags [.], seq 73849:75297, ack 1, win 1358, options [nop,nop,TS val 169464 ecr 4294909653], length 1448
20:00:13.595871 IP 112.26.0.8.35128 > 112.26.0.1.34747: Flags [.], ack 72401, win 1360, options [nop,nop,TS val 4294910277 ecr 169371], length 0
20:00:13.596738 IP 112.26.0.8.35128 > 112.26.0.1.34747: Flags [.], ack 72401, win 1360, options [nop,nop,TS val 4294910277 ecr 169371], length 0
20:00:13.600969 IP 112.26.0.1.34747 > 112.26.0.8.35128: Flags [.], seq 83985:85433, ack 1, win 1358, options [nop,nop,TS val 170155 ecr 4294910277], length 1448
20:00:13.688156 IP 112.26.0.8.35128 > 112.26.0.1.34747: Flags [.], ack 73849, win 1382, options [nop,nop,TS val 4294910370 ecr 169464], length 0
20:00:13.690605 IP 112.26.0.8.35128 > 112.26.0.1.34747: Flags [.], ack 73849, win 1382, options [nop,nop,TS val 4294910370 ecr 169464], length 0
20:00:13.694556 IP 112.26.0.1.34747 > 112.26.0.8.35128: Flags [.], seq 85433:86881, ack 1, win 1358, options [nop,nop,TS val 170249 ecr 4294910370], length 1448
20:00:13.711135 IP 112.26.0.1.34747 > 112.26.0.8.35128: Flags [.], seq 75297:76745, ack 1, win 1358, options [nop,nop,TS val 169465 ecr 4294909653], length 1448
20:00:13.725893 IP 112.26.0.8.35128 > 112.26.0.1.34747: Flags [.], ack 75297, win 1405, options [nop,nop,TS val 4294910393 ecr 169464], length 0
20:00:13.726860 IP 112.26.0.8.35128 > 112.26.0.1.34747: Flags [.], ack 75297, win 1405, options [nop,nop,TS val 4294910393 ecr 169464], length 0
20:00:13.786811 IP 112.26.0.1.34747 > 112.26.0.8.35128: Flags [.], seq 86881:88329, ack 1, win 1358, options [nop,nop,TS val 170285 ecr 4294910393], length 1448
20:00:13.799652 IP 112.26.0.1.34747 > 112.26.0.8.35128: Flags [.], seq 76745:78193, ack 1, win 1358, options [nop,nop,TS val 169465 ecr 4294909653], length 1448
20:00:13.814943 IP 112.26.0.1.34747 > 112.26.0.8.35128: Flags [.], seq 78193:79641, ack 1, win 1358, options [nop,nop,TS val 169465 ecr 4294909653], length 1448
20:00:13.909402 IP 112.26.0.8.35128 > 112.26.0.1.34747: Flags [.], ack 76745, win 1424, options [nop,nop,TS val 4294910585 ecr 169465], length 0
20:00:13.910379 IP 112.26.0.8.35128 > 112.26.0.1.34747: Flags [.], ack 76745, win 1424, options [nop,nop,TS val 4294910585 ecr 169465], length 0
20:00:13.915201 IP 112.26.0.1.34747 > 112.26.0.8.35128: Flags [.], seq 88329:89777, ack 1, win 1358, options [nop,nop,TS val 170469 ecr 4294910585], length 1448
20:00:13.994454 IP 112.26.0.1.34747 > 112.26.0.8.35128: Flags [.], seq 89777:91225, ack 1, win 1358, options [nop,nop,TS val 170469 ecr 4294910585], length 1448
20:00:14.003636 IP 112.26.0.1.34747 > 112.26.0.8.35128: Flags [.], seq 79641:81089, ack 1, win 1358, options [nop,nop,TS val 169651 ecr 4294909885], length 1448
20:00:14.085962 IP 112.26.0.8.35128 > 112.26.0.1.34747: Flags [.], ack 78193, win 1424, options [nop,nop,TS val 4294910673 ecr 169465], length 0
20:00:14.087359 IP 112.26.0.8.35128 > 112.26.0.1.34747: Flags [.], ack 78193, win 1424, options [nop,nop,TS val 4294910673 ecr 169465], length 0
20:00:14.097202 IP 112.26.0.1.34747 > 112.26.0.8.35128: Flags [.], seq 91225:92673, ack 1, win 1358, options [nop,nop,TS val 170646 ecr 4294910673], length 1448
20:00:14.109411 IP 112.26.0.8.35128 > 112.26.0.1.34747: Flags [.], ack 79641, win 1424, options [nop,nop,TS val 4294910689 ecr 169465], length 0
20:00:14.110390 IP 112.26.0.8.35128 > 112.26.0.1.34747: Flags [.], ack 79641, win 1424, options [nop,nop,TS val 4294910689 ecr 169465], length 0
20:00:14.114528 IP 112.26.0.1.34747 > 112.26.0.8.35128: Flags [.], seq 92673:94121, ack 1, win 1358, options [nop,nop,TS val 170669 ecr 4294910689], length 1448
20:00:14.197447 IP 112.26.0.1.34747 > 112.26.0.8.35128: Flags [.], seq 82537:83985, ack 1, win 1358, options [nop,nop,TS val 169959 ecr 4294910165], length 1448
20:00:14.211751 IP 112.26.0.1.34747 > 112.26.0.8.35128: Flags [.], seq 83985:85433, ack 1, win 1358, options [nop,nop,TS val 170155 ecr 4294910277], length 1448
20:00:14.308757 IP 112.26.0.1.34747 > 112.26.0.8.35128: Flags [.], seq 85433:86881, ack 1, win 1358, options [nop,nop,TS val 170249 ecr 4294910370], length 1448
20:00:14.396882 IP 112.26.0.8.35128 > 112.26.0.1.34747: Flags [.], ack 81089, win 1424, options [nop,nop,TS val 4294910876 ecr 169651], length 0
20:00:14.398198 IP 112.26.0.8.35128 > 112.26.0.1.34747: Flags [.], ack 81089, win 1424, options [nop,nop,TS val 4294910876 ecr 169651], length 0
20:00:14.406322 IP 112.26.0.1.34747 > 112.26.0.8.35128: Flags [.], seq 94121:95569, ack 1, win 1358, options [nop,nop,TS val 170958 ecr 4294910876], length 1448
20:00:14.414496 IP 112.26.0.1.34747 > 112.26.0.8.35128: Flags [.], seq 86881:88329, ack 1, win 1358, options [nop,nop,TS val 170285 ecr 4294910393], length 1448
20:00:14.499971 IP 112.26.0.1.34747 > 112.26.0.8.35128: Flags [.], seq 88329:89777, ack 1, win 1358, options [nop,nop,TS val 170469 ecr 4294910585], length 1448
20:00:14.510286 IP 112.26.0.1.34747 > 112.26.0.8.35128: Flags [.], seq 89777:91225, ack 1, win 1358, options [nop,nop,TS val 170469 ecr 4294910585], length 1448
20:00:14.601399 IP 112.26.0.8.35128 > 112.26.0.1.34747: Flags [.], ack 81089, win 1424, options [nop,nop,TS val 4294911067 ecr 169651,nop,nop,sack 1 {82537:83985}], length 0
20:00:14.602261 IP 112.26.0.8.35128 > 112.26.0.1.34747: Flags [.], ack 81089, win 1424, options [nop,nop,TS val 4294911067 ecr 169651,nop,nop,sack 1 {82537:83985}], length 0
20:00:14.607656 IP 112.26.0.1.34747 > 112.26.0.8.35128: Flags [.], seq 95569:97017, ack 1, win 1358, options [nop,nop,TS val 171161 ecr 4294911067], length 1448
20:00:14.702267 IP 112.26.0.8.35128 > 112.26.0.1.34747: Flags [.], ack 81089, win 1424, options [nop,nop,TS val 4294911085 ecr 169651,nop,nop,sack 1 {82537:85433}], length 0
20:00:14.704095 IP 112.26.0.8.35128 > 112.26.0.1.34747: Flags [.], ack 81089, win 1424, options [nop,nop,TS val 4294911085 ecr 169651,nop,nop,sack 1 {82537:85433}], length 0
20:00:14.706624 IP 112.26.0.1.34747 > 112.26.0.8.35128: Flags [.], seq 97017:98465, ack 1, win 1358, options [nop,nop,TS val 171263 ecr 4294911085], length 1448
20:00:14.718515 IP 112.26.0.1.34747 > 112.26.0.8.35128: Flags [.], seq 91225:92673, ack 1, win 1358, options [nop,nop,TS val 170646 ecr 4294910673], length 1448
20:00:14.800049 IP 112.26.0.1.34747 > 112.26.0.8.35128: Flags [.], seq 92673:94121, ack 1, win 1358, options [nop,nop,TS val 170669 ecr 4294910689], length 1448
20:00:14.810015 IP 112.26.0.8.35128 > 112.26.0.1.34747: Flags [.], ack 81089, win 1424, options [nop,nop,TS val 4294911182 ecr 169651,nop,nop,sack 1 {82537:86881}], length 0
20:00:14.810881 IP 112.26.0.8.35128 > 112.26.0.1.34747: Flags [.], ack 81089, win 1424, options [nop,nop,TS val 4294911182 ecr 169651,nop,nop,sack 1 {82537:86881}], length 0
20:00:14.815500 IP 112.26.0.1.34747 > 112.26.0.8.35128: Flags [.], seq 81089:82537, ack 1, win 1358, options [nop,nop,TS val 171370 ecr 4294911182], length 1448
20:00:14.903965 IP 112.26.0.1.34747 > 112.26.0.8.35128: Flags [.], seq 94121:95569, ack 1, win 1358, options [nop,nop,TS val 170958 ecr 4294910876], length 1448
20:00:14.993289 IP 112.26.0.8.35128 > 112.26.0.1.34747: Flags [.], ack 81089, win 1424, options [nop,nop,TS val 4294911374 ecr 169651,nop,nop,sack 1 {82537:89777}], length 0
20:00:14.995241 IP 112.26.0.8.35128 > 112.26.0.1.34747: Flags [.], ack 81089, win 1424, options [nop,nop,TS val 4294911374 ecr 169651,nop,nop,sack 1 {82537:89777}], length 0
20:00:15.010133 IP 112.26.0.8.35128 > 112.26.0.1.34747: Flags [.], ack 81089, win 1424, options [nop,nop,TS val 4294911384 ecr 169651,nop,nop,sack 1 {82537:91225}], length 0
20:00:15.011014 IP 112.26.0.8.35128 > 112.26.0.1.34747: Flags [.], ack 81089, win 1424, options [nop,nop,TS val 4294911384 ecr 169651,nop,nop,sack 1 {82537:91225}], length 0
20:00:15.015185 IP 112.26.0.1.34747 > 112.26.0.8.35128: Flags [.], seq 98465:99913, ack 1, win 1358, options [nop,nop,TS val 171570 ecr 4294911384], length 1448
20:00:15.028476 IP 112.26.0.1.34747 > 112.26.0.8.35128: Flags [.], seq 95569:97017, ack 1, win 1358, options [nop,nop,TS val 171161 ecr 4294911067], length 1448
20:00:15.111516 IP 112.26.0.1.34747 > 112.26.0.8.35128: Flags [.], seq 97017:98465, ack 1, win 1358, options [nop,nop,TS val 171263 ecr 4294911085], length 1448
20:00:15.206762 IP 112.26.0.8.35128 > 112.26.0.1.34747: Flags [.], ack 81089, win 1424, options [nop,nop,TS val 4294911593 ecr 169651,nop,nop,sack 1 {82537:92673}], length 0
20:00:15.225046 IP 112.26.0.8.35128 > 112.26.0.1.34747: Flags [.], ack 81089, win 1424, options [nop,nop,TS val 4294911674 ecr 169651,nop,nop,sack 1 {82537:94121}], length 0
20:00:15.231645 IP 112.26.0.8.35128 > 112.26.0.1.34747: Flags [.], ack 81089, win 1424, options [nop,nop,TS val 4294911593 ecr 169651,nop,nop,sack 1 {82537:92673}], length 0
20:00:15.235831 IP 112.26.0.1.34747 > 112.26.0.8.35128: Flags [.], seq 99913:101361, ack 1, win 1358, options [nop,nop,TS val 171790 ecr 4294911593], length 1448
20:00:15.247883 IP 112.26.0.1.34747 > 112.26.0.8.35128: Flags [.], seq 81089:82537, ack 1, win 1358, options [nop,nop,TS val 171370 ecr 4294911182], length 1448
20:00:15.320722 IP 112.26.0.8.35128 > 112.26.0.1.34747: Flags [.], ack 81089, win 1424, options [nop,nop,TS val 4294911778 ecr 169651,nop,nop,sack 1 {82537:95569}], length 0
20:00:15.327272 IP 112.26.0.8.35128 > 112.26.0.1.34747: Flags [.], ack 81089, win 1424, options [nop,nop,TS val 4294911674 ecr 169651,nop,nop,sack 1 {82537:94121}], length 0
20:00:15.328503 IP 112.26.0.1.34747 > 112.26.0.8.35128: Flags [.], seq 101361:102809, ack 1, win 1358, options [nop,nop,TS val 171886 ecr 4294911674], length 1448
20:00:15.412631 IP 112.26.0.1.34747 > 112.26.0.8.35128: Flags [.], seq 98465:99913, ack 1, win 1358, options [nop,nop,TS val 171570 ecr 4294911384], length 1448
20:00:15.425341 IP 112.26.0.8.35128 > 112.26.0.1.34747: Flags [.], ack 81089, win 1424, options [nop,nop,TS val 4294911902 ecr 169651,nop,nop,sack 1 {82537:97017}], length 0
20:00:15.500742 IP 112.26.0.8.35128 > 112.26.0.1.34747: Flags [.], ack 81089, win 1424, options [nop,nop,TS val 4294911778 ecr 169651,nop,nop,sack 1 {82537:95569}], length 0
20:00:15.502414 IP 112.26.0.1.34747 > 112.26.0.8.35128: Flags [.], seq 102809:104257, ack 1, win 1358, options [nop,nop,TS val 172059 ecr 4294911778], length 1448
20:00:15.520338 IP 112.26.0.8.35128 > 112.26.0.1.34747: Flags [.], ack 81089, win 1424, options [nop,nop,TS val 4294911985 ecr 169651,nop,nop,sack 1 {82537:98465}], length 0
20:00:15.632894 IP 112.26.0.1.34747 > 112.26.0.8.35128: Flags [.], seq 99913:101361, ack 1, win 1358, options [nop,nop,TS val 171790 ecr 4294911593], length 1448
20:00:15.639424 IP 112.26.0.8.35128 > 112.26.0.1.34747: Flags [.], ack 81089, win 1424, options [nop,nop,TS val 4294911902 ecr 169651,nop,nop,sack 1 {82537:97017}], length 0
20:00:15.641234 IP 112.26.0.1.34747 > 112.26.0.8.35128: Flags [.], seq 104257:105705, ack 1, win 1358, options [nop,nop,TS val 172198 ecr 4294911902], length 1448
20:00:15.699297 IP 112.26.0.8.35128 > 112.26.0.1.34747: Flags [.], ack 98465, win 1341, options [nop,nop,TS val 4294912122 ecr 171370], length 0
20:00:15.718204 IP 112.26.0.8.35128 > 112.26.0.1.34747: Flags [.], ack 81089, win 1424, options [nop,nop,TS val 4294911985 ecr 169651,nop,nop,sack 1 {82537:98465}], length 0
20:00:15.722189 IP 112.26.0.1.34747 > 112.26.0.8.35128: Flags [.], seq 105705:107153, ack 1, win 1358, options [nop,nop,TS val 172276 ecr 4294911985], length 1448
20:00:15.733005 IP 112.26.0.1.34747 > 112.26.0.8.35128: Flags [.], seq 101361:102809, ack 1, win 1358, options [nop,nop,TS val 171886 ecr 4294911674], length 1448
20:00:15.820156 IP 112.26.0.8.35128 > 112.26.0.1.34747: Flags [.], ack 98465, win 1341, options [nop,nop,TS val 4294912122 ecr 171370], length 0
20:00:15.821415 IP 112.26.0.1.34747 > 112.26.0.8.35128: Flags [.], seq 107153:108601, ack 1, win 1358, options [nop,nop,TS val 172378 ecr 4294912122], length 1448
20:00:15.900694 IP 112.26.0.8.35128 > 112.26.0.1.34747: Flags [.], ack 99913, win 1424, options [nop,nop,TS val 4294912282 ecr 171570], length 0
20:00:15.908065 IP 112.26.0.8.35128 > 112.26.0.1.34747: Flags [.], ack 99913, win 1424, options [nop,nop,TS val 4294912282 ecr 171570], length 0
20:00:15.909300 IP 112.26.0.1.34747 > 112.26.0.8.35128: Flags [.], seq 108601:110049, ack 1, win 1358, options [nop,nop,TS val 172466 ecr 4294912282], length 1448
20:00:15.918725 IP 112.26.0.1.34747 > 112.26.0.8.35128: Flags [.], seq 102809:104257, ack 1, win 1358, options [nop,nop,TS val 172059 ecr 4294911778], length 1448
20:00:16.005816 IP 112.26.0.8.35128 > 112.26.0.1.34747: Flags [.], ack 101361, win 1424, options [nop,nop,TS val 4294912507 ecr 171790], length 0
20:00:16.006797 IP 112.26.0.8.35128 > 112.26.0.1.34747: Flags [.], ack 101361, win 1424, options [nop,nop,TS val 4294912507 ecr 171790], length 0
20:00:16.011239 IP 112.26.0.1.34747 > 112.26.0.8.35128: Flags [.], seq 110049:111497, ack 1, win 1358, options [nop,nop,TS val 172565 ecr 4294912507], length 1448
20:00:16.106640 IP 112.26.0.1.34747 > 112.26.0.8.35128: Flags [.], seq 104257:105705, ack 1, win 1358, options [nop,nop,TS val 172198 ecr 4294911902], length 1448
20:00:16.107402 IP 112.26.0.1.34747 > 112.26.0.8.35128: Flags [.], seq 111497:112945, ack 1, win 1358, options [nop,nop,TS val 172565 ecr 4294912507], length 1448
20:00:16.119398 IP 112.26.0.1.34747 > 112.26.0.8.35128: Flags [.], seq 105705:107153, ack 1, win 1358, options [nop,nop,TS val 172276 ecr 4294911985], length 1448
20:00:16.212709 IP 112.26.0.8.35128 > 112.26.0.1.34747: Flags [.], ack 102809, win 1424, options [nop,nop,TS val 4294912607 ecr 171886], length 0
20:00:16.213574 IP 112.26.0.8.35128 > 112.26.0.1.34747: Flags [.], ack 102809, win 1424, options [nop,nop,TS val 4294912607 ecr 171886], length 0
20:00:16.218209 IP 112.26.0.1.34747 > 112.26.0.8.35128: Flags [.], seq 112945:114393, ack 1, win 1358, options [nop,nop,TS val 172772 ecr 4294912607], length 1448
20:00:16.303413 IP 112.26.0.1.34747 > 112.26.0.8.35128: Flags [.], seq 107153:108601, ack 1, win 1358, options [nop,nop,TS val 172378 ecr 4294912122], length 1448
20:00:16.313243 IP 112.26.0.8.35128 > 112.26.0.1.34747: Flags [.], ack 104257, win 1424, options [nop,nop,TS val 4294912793 ecr 172059], length 0
20:00:16.314221 IP 112.26.0.8.35128 > 112.26.0.1.34747: Flags [.], ack 104257, win 1424, options [nop,nop,TS val 4294912793 ecr 172059], length 0
20:00:16.319718 IP 112.26.0.1.34747 > 112.26.0.8.35128: Flags [.], seq 114393:115841, ack 1, win 1358, options [nop,nop,TS val 172873 ecr 4294912793], length 1448
20:00:16.331982 IP 112.26.0.1.34747 > 112.26.0.8.35128: Flags [.], seq 108601:110049, ack 1, win 1358, options [nop,nop,TS val 172466 ecr 4294912282], length 1448
20:00:16.407165 IP 112.26.0.1.34747 > 112.26.0.8.35128: Flags [.], seq 110049:111497, ack 1, win 1358, options [nop,nop,TS val 172565 ecr 4294912507], length 1448
20:00:16.416392 IP 112.26.0.8.35128 > 112.26.0.1.34747: Flags [.], ack 105705, win 1424, options [nop,nop,TS val 4294912974 ecr 172198], length 0
20:00:16.417370 IP 112.26.0.8.35128 > 112.26.0.1.34747: Flags [.], ack 105705, win 1424, options [nop,nop,TS val 4294912974 ecr 172198], length 0
20:00:16.421998 IP 112.26.0.1.34747 > 112.26.0.8.35128: Flags [.], seq 115841:117289, ack 1, win 1358, options [nop,nop,TS val 172976 ecr 4294912974], length 1448
20:00:16.510391 IP 112.26.0.8.35128 > 112.26.0.1.34747: Flags [.], ack 107153, win 1424, options [nop,nop,TS val 4294912994 ecr 172276], length 0
20:00:16.525784 IP 112.26.0.8.35128 > 112.26.0.1.34747: Flags [.], ack 107153, win 1424, options [nop,nop,TS val 4294912994 ecr 172276], length 0
20:00:16.532589 IP 112.26.0.1.34747 > 112.26.0.8.35128: Flags [.], seq 111497:112945, ack 1, win 1358, options [nop,nop,TS val 172565 ecr 4294912507], length 1448
20:00:16.603854 IP 112.26.0.1.34747 > 112.26.0.8.35128: Flags [.], seq 112945:114393, ack 1, win 1358, options [nop,nop,TS val 172772 ecr 4294912607], length 1448
20:00:16.614915 IP 112.26.0.1.34747 > 112.26.0.8.35128: Flags [.], seq 117289:118737, ack 1, win 1358, options [nop,nop,TS val 173084 ecr 4294912994], length 1448
20:00:16.625123 IP 112.26.0.8.35128 > 112.26.0.1.34747: Flags [.], ack 108601, win 1424, options [nop,nop,TS val 4294913176 ecr 172378], length 0
20:00:16.629047 IP 112.26.0.8.35128 > 112.26.0.1.34747: Flags [.], ack 108601, win 1424, options [nop,nop,TS val 4294913176 ecr 172378], length 0
20:00:16.633965 IP 112.26.0.1.34747 > 112.26.0.8.35128: Flags [.], seq 118737:120185, ack 1, win 1358, options [nop,nop,TS val 173084 ecr 4294912994], length 1448
20:00:16.716297 IP 112.26.0.1.34747 > 112.26.0.8.35128: Flags [.], seq 114393:115841, ack 1, win 1358, options [nop,nop,TS val 172873 ecr 4294912793], length 1448
20:00:16.734959 IP 112.26.0.8.35128 > 112.26.0.1.34747: Flags [.], ack 110049, win 1424, options [nop,nop,TS val 4294913205 ecr 172466], length 0
20:00:16.735931 IP 112.26.0.8.35128 > 112.26.0.1.34747: Flags [.], ack 110049, win 1424, options [nop,nop,TS val 4294913205 ecr 172466], length 0
20:00:16.743941 IP 112.26.0.1.34747 > 112.26.0.8.35128: Flags [.], seq 120185:121633, ack 1, win 1358, options [nop,nop,TS val 173187 ecr 4294913176], length 1448
20:00:16.813197 IP 112.26.0.8.35128 > 112.26.0.1.34747: Flags [.], ack 111497, win 1424, options [nop,nop,TS val 4294913281 ecr 172565], length 0
20:00:16.814911 IP 112.26.0.8.35128 > 112.26.0.1.34747: Flags [.], ack 111497, win 1424, options [nop,nop,TS val 4294913281 ecr 172565], length 0
20:00:16.818468 IP 112.26.0.1.34747 > 112.26.0.8.35128: Flags [.], seq 121633:123081, ack 1, win 1358, options [nop,nop,TS val 173295 ecr 4294913205], length 1448
20:00:16.831606 IP 112.26.0.1.34747 > 112.26.0.8.35128: Flags [.], seq 115841:117289, ack 1, win 1358, options [nop,nop,TS val 172976 ecr 4294912974], length 1448
20:00:16.907673 IP 112.26.0.1.34747 > 112.26.0.8.35128: Flags [.], seq 123081:124529, ack 1, win 1358, options [nop,nop,TS val 173374 ecr 4294913281], length 1448
20:00:16.914241 IP 112.26.0.8.35128 > 112.26.0.1.34747: Flags [.], ack 112945, win 1424, options [nop,nop,TS val 4294913405 ecr 172565], length 0
20:00:16.921711 IP 112.26.0.8.35128 > 112.26.0.1.34747: Flags [.], ack 112945, win 1424, options [nop,nop,TS val 4294913405 ecr 172565], length 0
20:00:16.930888 IP 112.26.0.8.35128 > 112.26.0.1.34747: Flags [.], ack 114393, win 1424, options [nop,nop,TS val 4294913478 ecr 172772], length 0
20:00:16.937417 IP 112.26.0.8.35128 > 112.26.0.1.34747: Flags [.], ack 114393, win 1424, options [nop,nop,TS val 4294913478 ecr 172772], length 0
20:00:16.940903 IP 112.26.0.1.34747 > 112.26.0.8.35128: Flags [.], seq 124529:125977, ack 1, win 1358, options [nop,nop,TS val 173480 ecr 4294913405], length 1448
