20:00:07.378117 IP 112.26.0.8.35128 > 112.26.0.1.34747: Flags [S], seq 2611020501, win 29200, options [mss 1460,sackOK,TS val 4294904234 ecr 0,nop,wscale 7], length 0
20:00:07.477049 IP 112.26.0.8.35128 > 112.26.0.1.34747: Flags [S], seq 2611020501, win 29200, options [mss 1460,sackOK,TS val 4294904234 ecr 0,nop,wscale 7], length 0
20:00:07.494478 IP 112.26.0.8.35128 > 112.26.0.1.34747: Flags [S], seq 2611020501, win 29200, options [mss 1460,sackOK,TS val 4294904234 ecr 0,nop,wscale 7], length 0
20:00:07.670094 IP 112.26.0.1.34747 > 112.26.0.8.35128: Flags [S.], seq 2195574532, ack 2611020502, win 65535, options [mss 1460,sackOK,TS val 164054 ecr 4294904234,nop,wscale 6], length 0
20:00:07.676608 IP 112.26.0.8.35128 > 112.26.0.1.34747: Flags [.], ack 1, win 229, options [nop,nop,TS val 4294904544 ecr 164054], length 0
20:00:07.870432 IP 112.26.0.1.34747 > 112.26.0.8.35128: Flags [.], seq 1:1449, ack 1, win 1358, options [nop,nop,TS val 164324 ecr 4294904544], length 1448
20:00:07.871726 IP 112.26.0.8.35128 > 112.26.0.1.34747: Flags [.], ack 1449, win 251, options [nop,nop,TS val 4294904745 ecr 164324], length 0
20:00:07.976874 IP 112.26.0.1.34747 > 112.26.0.8.35128: Flags [.], seq 1449:2897, ack 1, win 1358, options [nop,nop,TS val 164324 ecr 4294904544], length 1448
20:00:07.978314 IP 112.26.0.8.35128 > 112.26.0.1.34747: Flags [.], ack 2897, win 274, options [nop,nop,TS val 4294904851 ecr 164324], length 0
20:00:08.077228 IP 112.26.0.1.34747 > 112.26.0.8.35128: Flags [.], seq 2897:4345, ack 1, win 1358, options [nop,nop,TS val 164324 ecr 4294904544], length 1448
20:00:08.078785 IP 112.26.0.8.35128 > 112.26.0.1.34747: Flags [.], ack 4345, win 296, options [nop,nop,TS val 4294904951 ecr 164324], length 0
20:00:08.187315 IP 112.26.0.1.34747 > 112.26.0.8.35128: Flags [.], seq 4345:5793, ack 1, win 1358, options [nop,nop,TS val 164325 ecr 4294904544], length 1448
20:00:08.189700 IP 112.26.0.8.35128 > 112.26.0.1.34747: Flags [.], ack 5793, win 319, options [nop,nop,TS val 4294905061 ecr 164325], length 0
20:00:08.276239 IP 112.26.0.1.34747 > 112.26.0.8.35128: Flags [.], seq 5793:7241, ack 1, win 1358, options [nop,nop,TS val 164325 ecr 4294904544], length 1448
20:00:08.278824 IP 112.26.0.8.35128 > 112.26.0.1.34747: Flags [.], ack 7241, win 342, options [nop,nop,TS val 4294905150 ecr 164325], length 0
20:00:08.469871 IP 112.26.0.1.34747 > 112.26.0.8.35128: Flags [.], seq 7241:8689, ack 1, win 1358, options [nop,nop,TS val 164325 ecr 4294904544], length 1448
20:00:08.471365 IP 112.26.0.8.35128 > 112.26.0.1.34747: Flags [.], ack 8689, win 364, options [nop,nop,TS val 4294905344 ecr 164325], length 0
20:00:08.498967 IP 112.26.0.1.34747 > 112.26.0.8.35128: Flags [.], seq 8689:10137, ack 1, win 1358, options [nop,nop,TS val 164325 ecr 4294904544], length 1448
20:00:08.501320 IP 112.26.0.8.35128 > 112.26.0.1.34747: Flags [.], ack 10137, win 387, options [nop,nop,TS val 4294905373 ecr 164325], length 0
20:00:08.665162 IP 112.26.0.1.34747 > 112.26.0.8.35128: Flags [.], seq 10137:11585, ack 1, win 1358, options [nop,nop,TS val 164325 ecr 4294904544], length 1448
20:00:08.666412 IP 112.26.0.8.35128 > 112.26.0.1.34747: Flags [.], ack 11585, win 410, options [nop,nop,TS val 4294905540 ecr 164325], length 0
20:00:08.858414 IP 112.26.0.1.34747 > 112.26.0.8.35128: Flags [.], seq 14481:15929, ack 1, win 1358, options [nop,nop,TS val 164721 ecr 4294904745], length 1448
20:00:08.860493 IP 112.26.0.8.35128 > 112.26.0.1.34747: Flags [.], ack 11585, win 432, options [nop,nop,TS val 4294905733 ecr 164325,nop,nop,sack 1 {14481:15929}], length 0
20:00:08.889802 IP 112.26.0.1.34747 > 112.26.0.8.35128: Flags [.], seq 15929:17377, ack 1, win 1358, options [nop,nop,TS val 164721 ecr 4294904745], length 1448
20:00:08.892157 IP 112.26.0.8.35128 > 112.26.0.1.34747: Flags [.], ack 11585, win 455, options [nop,nop,TS val 4294905764 ecr 164325,nop,nop,sack 1 {14481:17377}], length 0
20:00:08.966603 IP 112.26.0.1.34747 > 112.26.0.8.35128: Flags [.], seq 18825:20273, ack 1, win 1358, options [nop,nop,TS val 164958 ecr 4294904851], length 1448
20:00:08.968964 IP 112.26.0.8.35128 > 112.26.0.1.34747: Flags [.], ack 11585, win 477, options [nop,nop,TS val 4294905841 ecr 164325,nop,nop,sack 2 {18825:20273}{14481:17377}], length 0
20:00:09.065526 IP 112.26.0.1.34747 > 112.26.0.8.35128: Flags [.], seq 21721:23169, ack 1, win 1358, options [nop,nop,TS val 165130 ecr 4294904951], length 1448
20:00:09.067875 IP 112.26.0.8.35128 > 112.26.0.1.34747: Flags [.], ack 11585, win 500, options [nop,nop,TS val 4294905940 ecr 164325,nop,nop,sack 3 {21721:23169}{18825:20273}{14481:17377}], length 0
20:00:09.178999 IP 112.26.0.1.34747 > 112.26.0.8.35128: Flags [.], seq 23169:24617, ack 1, win 1358, options [nop,nop,TS val 165328 ecr 4294905061], length 1448
20:00:09.181339 IP 112.26.0.8.35128 > 112.26.0.1.34747: Flags [.], ack 11585, win 523, options [nop,nop,TS val 4294906053 ecr 164325,nop,nop,sack 3 {21721:24617}{18825:20273}{14481:17377}], length 0
20:00:09.272014 IP 112.26.0.1.34747 > 112.26.0.8.35128: Flags [.], seq 24617:26065, ack 1, win 1358, options [nop,nop,TS val 165328 ecr 4294905061], length 1448
20:00:09.276234 IP 112.26.0.8.35128 > 112.26.0.1.34747: Flags [.], ack 11585, win 545, options [nop,nop,TS val 4294906146 ecr 164325,nop,nop,sack 3 {21721:26065}{18825:20273}{14481:17377}], length 0
20:00:09.364691 IP 112.26.0.1.34747 > 112.26.0.8.35128: Flags [.], seq 26065:27513, ack 1, win 1358, options [nop,nop,TS val 165342 ecr 4294905150], length 1448
20:00:09.367847 IP 112.26.0.8.35128 > 112.26.0.1.34747: Flags [.], ack 11585, win 568, options [nop,nop,TS val 4294906239 ecr 164325,nop,nop,sack 3 {21721:27513}{18825:20273}{14481:17377}], length 0
20:00:09.569900 IP 112.26.0.1.34747 > 112.26.0.8.35128: Flags [.], seq 28961:30409, ack 1, win 1358, options [nop,nop,TS val 165727 ecr 4294905540], length 1448
20:00:09.572079 IP 112.26.0.8.35128 > 112.26.0.1.34747: Flags [.], ack 11585, win 591, options [nop,nop,TS val 4294906444 ecr 164325,nop,nop,sack 3 {28961:30409}{21721:27513}{18825:20273}], length 0
20:00:09.666923 IP 112.26.0.1.34747 > 112.26.0.8.35128: Flags [.], seq 30409:31857, ack 1, win 1358, options [nop,nop,TS val 165727 ecr 4294905540], length 1448
20:00:09.670082 IP 112.26.0.8.35128 > 112.26.0.1.34747: Flags [.], ack 11585, win 613, options [nop,nop,TS val 4294906541 ecr 164325,nop,nop,sack 3 {28961:31857}{21721:27513}{18825:20273}], length 0
20:00:09.765631 IP 112.26.0.1.34747 > 112.26.0.8.35128: Flags [.], seq 31857:33305, ack 1, win 1358, options [nop,nop,TS val 165727 ecr 4294905540], length 1448
20:00:09.769174 IP 112.26.0.8.35128 > 112.26.0.1.34747: Flags [.], ack 11585, win 636, options [nop,nop,TS val 4294906640 ecr 164325,nop,nop,sack 3 {28961:33305}{21721:27513}{18825:20273}], length 0
20:00:09.869345 IP 112.26.0.1.34747 > 112.26.0.8.35128: Flags [.], seq 33305:34753, ack 1, win 1358, options [nop,nop,TS val 165727 ecr 4294905540], length 1448
20:00:09.871345 IP 112.26.0.8.35128 > 112.26.0.1.34747: Flags [.], ack 11585, win 658, options [nop,nop,TS val 4294906744 ecr 164325,nop,nop,sack 3 {28961:34753}{21721:27513}{18825:20273}], length 0
20:00:09.884995 IP 112.26.0.1.34747 > 112.26.0.8.35128: Flags [.], seq 34753:36201, ack 1, win 1358, options [nop,nop,TS val 165727 ecr 4294905540], length 1448
20:00:09.894443 IP 112.26.0.8.35128 > 112.26.0.1.34747: Flags [.], ack 11585, win 681, options [nop,nop,TS val 4294906759 ecr 164325,nop,nop,sack 3 {28961:36201}{21721:27513}{18825:20273}], length 0
20:00:09.971649 IP 112.26.0.1.34747 > 112.26.0.8.35128: Flags [.], seq 11585:13033, ack 1, win 1358, options [nop,nop,TS val 165951 ecr 4294905764], length 1448
20:00:09.978651 IP 112.26.0.8.35128 > 112.26.0.1.34747: Flags [.], ack 13033, win 704, options [nop,nop,TS val 4294906846 ecr 165951,nop,nop,sack 3 {28961:36201}{21721:27513}{18825:20273}], length 0
20:00:10.072093 IP 112.26.0.1.34747 > 112.26.0.8.35128: Flags [.], seq 37649:39097, ack 1, win 1358, options [nop,nop,TS val 165951 ecr 4294905764], length 1448
20:00:10.074433 IP 112.26.0.8.35128 > 112.26.0.1.34747: Flags [.], ack 13033, win 726, options [nop,nop,TS val 4294906946 ecr 165951,nop,nop,sack 3 {37649:39097}{28961:36201}{21721:27513}], length 0
20:00:10.493299 IP 112.26.0.1.34747 > 112.26.0.8.35128: Flags [.], seq 17377:18825, ack 1, win 1358, options [nop,nop,TS val 166561 ecr 4294906444], length 1448
20:00:10.495629 IP 112.26.0.8.35128 > 112.26.0.1.34747: Flags [.], ack 13033, win 749, options [nop,nop,TS val 4294907368 ecr 165951,nop,nop,sack 3 {17377:20273}{37649:39097}{28961:36201}], length 0
20:00:10.594291 IP 112.26.0.1.34747 > 112.26.0.8.35128: Flags [.], seq 27513:28961, ack 1, win 1358, options [nop,nop,TS val 166561 ecr 4294906444], length 1448
20:00:10.595870 IP 112.26.0.8.35128 > 112.26.0.1.34747: Flags [.], ack 13033, win 772, options [nop,nop,TS val 4294907469 ecr 165951,nop,nop,sack 3 {21721:36201}{17377:20273}{37649:39097}], length 0
20:00:10.675206 IP 112.26.0.1.34747 > 112.26.0.8.35128: Flags [.], seq 39097:40545, ack 1, win 1358, options [nop,nop,TS val 166650 ecr 4294906541], length 1448
20:00:10.677457 IP 112.26.0.8.35128 > 112.26.0.1.34747: Flags [.], ack 13033, win 794, options [nop,nop,TS val 4294907550 ecr 165951,nop,nop,sack 3 {37649:40545}{21721:36201}{17377:20273}], length 0
20:00:10.784550 IP 112.26.0.1.34747 > 112.26.0.8.35128: Flags [.], seq 40545:41993, ack 1, win 1358, options [nop,nop,TS val 166721 ecr 4294906640], length 1448
20:00:10.788340 IP 112.26.0.8.35128 > 112.26.0.1.34747: Flags [.], ack 13033, win 817, options [nop,nop,TS val 4294907659 ecr 165951,nop,nop,sack 3 {37649:41993}{21721:36201}{17377:20273}], length 0
20:00:10.813859 IP 112.26.0.1.34747 > 112.26.0.8.35128: Flags [.], seq 41993:43441, ack 1, win 1358, options [nop,nop,TS val 166734 ecr 4294906744], length 1448
20:00:10.815412 IP 112.26.0.8.35128 > 112.26.0.1.34747: Flags [.], ack 13033, win 839, options [nop,nop,TS val 4294907688 ecr 165951,nop,nop,sack 3 {37649:43441}{21721:36201}{17377:20273}], length 0
20:00:10.974358 IP 112.26.0.1.34747 > 112.26.0.8.35128: Flags [.], seq 43441:44889, ack 1, win 1358, options [nop,nop,TS val 166879 ecr 4294906759], length 1448
20:00:10.977320 IP 112.26.0.8.35128 > 112.26.0.1.34747: Flags [.], ack 13033, win 862, options [nop,nop,TS val 4294907849 ecr 165951,nop,nop,sack 3 {37649:44889}{21721:36201}{17377:20273}], length 0
20:00:10.998002 IP 112.26.0.1.34747 > 112.26.0.8.35128: Flags [.], seq 36201:37649, ack 1, win 1358, options [nop,nop,TS val 166964 ecr 4294906846], length 1448
20:00:10.999588 IP 112.26.0.8.35128 > 112.26.0.1.34747: Flags [.], ack 13033, win 885, options [nop,nop,TS val 4294907872 ecr 165951,nop,nop,sack 2 {21721:44889}{17377:20273}], length 0
20:00:11.070777 IP 112.26.0.1.34747 > 112.26.0.8.35128: Flags [.], seq 44889:46337, ack 1, win 1358, options [nop,nop,TS val 166964 ecr 4294906846], length 1448
20:00:11.075656 IP 112.26.0.8.35128 > 112.26.0.1.34747: Flags [.], ack 13033, win 907, options [nop,nop,TS val 4294907945 ecr 165951,nop,nop,sack 2 {21721:46337}{17377:20273}], length 0
20:00:11.282808 IP 112.26.0.1.34747 > 112.26.0.8.35128: Flags [.], seq 13033:14481, ack 1, win 1358, options [nop,nop,TS val 167546 ecr 4294907368], length 1448
20:00:11.285172 IP 112.26.0.8.35128 > 112.26.0.1.34747: Flags [.], ack 20273, win 930, options [nop,nop,TS val 4294908157 ecr 167546,nop,nop,sack 1 {21721:46337}], length 0
20:00:11.393703 IP 112.26.0.1.34747 > 112.26.0.8.35128: Flags [.], seq 49233:50681, ack 1, win 1358, options [nop,nop,TS val 167637 ecr 4294907469], length 1448
20:00:11.395344 IP 112.26.0.8.35128 > 112.26.0.1.34747: Flags [.], ack 20273, win 953, options [nop,nop,TS val 4294908268 ecr 167546,nop,nop,sack 2 {49233:50681}{21721:46337}], length 0
20:00:11.485935 IP 112.26.0.1.34747 > 112.26.0.8.35128: Flags [.], seq 20273:21721, ack 1, win 1358, options [nop,nop,TS val 167658 ecr 4294907550], length 1448
20:00:11.488287 IP 112.26.0.8.35128 > 112.26.0.1.34747: Flags [.], ack 46337, win 975, options [nop,nop,TS val 4294908360 ecr 167658,nop,nop,sack 1 {49233:50681}], length 0
20:00:11.584502 IP 112.26.0.1.34747 > 112.26.0.8.35128: Flags [.], seq 50681:52129, ack 1, win 1358, options [nop,nop,TS val 167728 ecr 4294907659], length 1448
20:00:11.588821 IP 112.26.0.8.35128 > 112.26.0.1.34747: Flags [.], ack 46337, win 998, options [nop,nop,TS val 4294908459 ecr 167658,nop,nop,sack 1 {49233:52129}], length 0
20:00:11.606700 IP 112.26.0.1.34747 > 112.26.0.8.35128: Flags [.], seq 52129:53577, ack 1, win 1358, options [nop,nop,TS val 167740 ecr 4294907688], length 1448
20:00:11.609039 IP 112.26.0.8.35128 > 112.26.0.1.34747: Flags [.], ack 46337, win 1020, options [nop,nop,TS val 4294908481 ecr 167658,nop,nop,sack 1 {49233:53577}], length 0
20:00:11.682120 IP 112.26.0.1.34747 > 112.26.0.8.35128: Flags [.], seq 53577:55025, ack 1, win 1358, options [nop,nop,TS val 167750 ecr 4294907849], length 1448
20:00:11.686447 IP 112.26.0.8.35128 > 112.26.0.1.34747: Flags [.], ack 46337, win 1043, options [nop,nop,TS val 4294908557 ecr 167658,nop,nop,sack 1 {49233:55025}], length 0
20:00:11.780034 IP 112.26.0.1.34747 > 112.26.0.8.35128: Flags [.], seq 55025:56473, ack 1, win 1358, options [nop,nop,TS val 167932 ecr 4294907872], length 1448
20:00:11.781650 IP 112.26.0.8.35128 > 112.26.0.1.34747: Flags [.], ack 46337, win 1066, options [nop,nop,TS val 4294908654 ecr 167658,nop,nop,sack 1 {49233:56473}], length 0
20:00:11.803460 IP 112.26.0.1.34747 > 112.26.0.8.35128: Flags [.], seq 56473:57921, ack 1, win 1358, options [nop,nop,TS val 167942 ecr 4294907945], length 1448
20:00:11.804975 IP 112.26.0.8.35128 > 112.26.0.1.34747: Flags [.], ack 46337, win 1088, options [nop,nop,TS val 4294908678 ecr 167658,nop,nop,sack 1 {49233:57921}], length 0
20:00:12.089217 IP 112.26.0.1.34747 > 112.26.0.8.35128: Flags [.], seq 46337:47785, ack 1, win 1358, options [nop,nop,TS val 168255 ecr 4294908157], length 1448
20:00:12.091995 IP 112.26.0.8.35128 > 112.26.0.1.34747: Flags [.], ack 47785, win 1111, options [nop,nop,TS val 4294908963 ecr 168255,nop,nop,sack 1 {49233:57921}], length 0
20:00:12.192155 IP 112.26.0.1.34747 > 112.26.0.8.35128: Flags [.], seq 47785:49233, ack 1, win 1358, options [nop,nop,TS val 168255 ecr 4294908157], length 1448
20:00:12.194259 IP 112.26.0.8.35128 > 112.26.0.1.34747: Flags [.], ack 57921, win 1134, options [nop,nop,TS val 4294909066 ecr 168255], length 0
20:00:12.298760 IP 112.26.0.1.34747 > 112.26.0.8.35128: Flags [.], seq 57921:59369, ack 1, win 1358, options [nop,nop,TS val 168450 ecr 4294908268], length 1448
20:00:12.301531 IP 112.26.0.8.35128 > 112.26.0.1.34747: Flags [.], ack 59369, win 1156, options [nop,nop,TS val 4294909173 ecr 168450], length 0
20:00:12.397969 IP 112.26.0.1.34747 > 112.26.0.8.35128: Flags [.], seq 59369:60817, ack 1, win 1358, options [nop,nop,TS val 168464 ecr 4294908360], length 1448
20:00:12.399448 IP 112.26.0.8.35128 > 112.26.0.1.34747: Flags [.], ack 60817, win 1179, options [nop,nop,TS val 4294909273 ecr 168464], length 0
20:00:12.495637 IP 112.26.0.1.34747 > 112.26.0.8.35128: Flags [.], seq 60817:62265, ack 1, win 1358, options [nop,nop,TS val 168546 ecr 4294908481], length 1448
20:00:12.511730 IP 112.26.0.8.35128 > 112.26.0.1.34747: Flags [.], ack 62265, win 1201, options [nop,nop,TS val 4294909370 ecr 168546], length 0
20:00:12.574560 IP 112.26.0.1.34747 > 112.26.0.8.35128: Flags [.], seq 62265:63713, ack 1, win 1358, options [nop,nop,TS val 168635 ecr 4294908557], length 1448
20:00:12.584622 IP 112.26.0.8.35128 > 112.26.0.1.34747: Flags [.], ack 63713, win 1224, options [nop,nop,TS val 4294909449 ecr 168635], length 0
20:00:12.678189 IP 112.26.0.1.34747 > 112.26.0.8.35128: Flags [.], seq 63713:65161, ack 1, win 1358, options [nop,nop,TS val 168841 ecr 4294908654], length 1448
20:00:12.681508 IP 112.26.0.8.35128 > 112.26.0.1.34747: Flags [.], ack 65161, win 1247, options [nop,nop,TS val 4294909552 ecr 168841], length 0
20:00:12.779265 IP 112.26.0.1.34747 > 112.26.0.8.35128: Flags [.], seq 65161:66609, ack 1, win 1358, options [nop,nop,TS val 168850 ecr 4294908678], length 1448
20:00:12.781131 IP 112.26.0.8.35128 > 112.26.0.1.34747: Flags [.], ack 66609, win 1269, options [nop,nop,TS val 4294909653 ecr 168850], length 0
20:00:12.807793 IP 112.26.0.8.35128 > 112.26.0.1.34747: Flags [.], ack 66609, win 1269, options [nop,nop,TS val 4294909653 ecr 168850], length 0
20:00:12.904249 IP 112.26.0.8.35128 > 112.26.0.1.34747: Flags [.], ack 66609, win 1269, options [nop,nop,TS val 4294909653 ecr 168850], length 0
20:00:13.010648 IP 112.26.0.1.34747 > 112.26.0.8.35128: Flags [.], seq 66609:68057, ack 1, win 1358, options [nop,nop,TS val 169145 ecr 4294908963], length 1448
20:00:13.024380 IP 112.26.0.8.35128 > 112.26.0.1.34747: Flags [.], ack 68057, win 1292, options [nop,nop,TS val 4294909885 ecr 169145], length 0
20:00:13.090758 IP 112.26.0.8.35128 > 112.26.0.1.34747: Flags [.], ack 68057, win 1292, options [nop,nop,TS val 4294909885 ecr 169145], length 0
20:00:13.092450 IP 112.26.0.8.35128 > 112.26.0.1.34747: Flags [.], ack 68057, win 1292, options [nop,nop,TS val 4294909885 ecr 169145], length 0
20:00:13.113294 IP 112.26.0.1.34747 > 112.26.0.8.35128: Flags [.], seq 68057:69505, ack 1, win 1358, options [nop,nop,TS val 169171 ecr 4294909066], length 1448
20:00:13.115643 IP 112.26.0.8.35128 > 112.26.0.1.34747: Flags [.], ack 69505, win 1315, options [nop,nop,TS val 4294909988 ecr 169171], length 0
20:00:13.197494 IP 112.26.0.8.35128 > 112.26.0.1.34747: Flags [.], ack 69505, win 1315, options [nop,nop,TS val 4294909988 ecr 169171], length 0
20:00:13.199725 IP 112.26.0.8.35128 > 112.26.0.1.34747: Flags [.], ack 69505, win 1315, options [nop,nop,TS val 4294909988 ecr 169171], length 0
20:00:13.290558 IP 112.26.0.1.34747 > 112.26.0.8.35128: Flags [.], seq 69505:70953, ack 1, win 1358, options [nop,nop,TS val 169259 ecr 4294909173], length 1448
20:00:13.292123 IP 112.26.0.8.35128 > 112.26.0.1.34747: Flags [.], ack 70953, win 1337, options [nop,nop,TS val 4294910165 ecr 169259], length 0
20:00:13.388704 IP 112.26.0.8.35128 > 112.26.0.1.34747: Flags [.], ack 70953, win 1337, options [nop,nop,TS val 4294910165 ecr 169259], length 0
20:00:13.400798 IP 112.26.0.8.35128 > 112.26.0.1.34747: Flags [.], ack 70953, win 1337, options [nop,nop,TS val 4294910165 ecr 169259], length 0
20:00:13.403102 IP 112.26.0.1.34747 > 112.26.0.8.35128: Flags [.], seq 70953:72401, ack 1, win 1358, options [nop,nop,TS val 169371 ecr 4294909273], length 1448
20:00:13.404510 IP 112.26.0.8.35128 > 112.26.0.1.34747: Flags [.], ack 72401, win 1360, options [nop,nop,TS val 4294910277 ecr 169371], length 0
20:00:13.495452 IP 112.26.0.1.34747 > 112.26.0.8.35128: Flags [.], seq 72401:73849, ack 1, win 1358, options [nop,nop,TS val 169464 ecr 4294909653], length 1448
20:00:13.497570 IP 112.26.0.8.35128 > 112.26.0.1.34747: Flags [.], ack 73849, win 1382, options [nop,nop,TS val 4294910370 ecr 169464], length 0
20:00:13.518581 IP 112.26.0.1.34747 > 112.26.0.8.35128: Flags [.], seq 73849:75297, ack 1, win 1358, options [nop,nop,TS val 169464 ecr 4294909653], length 1448
20:00:13.520974 IP 112.26.0.8.35128 > 112.26.0.1.34747: Flags [.], ack 75297, win 1405, options [nop,nop,TS val 4294910393 ecr 169464], length 0
20:00:13.595374 IP 112.26.0.8.35128 > 112.26.0.1.34747: Flags [.], ack 72401, win 1360, options [nop,nop,TS val 4294910277 ecr 169371], length 0
20:00:13.597080 IP 112.26.0.8.35128 > 112.26.0.1.34747: Flags [.], ack 72401, win 1360, options [nop,nop,TS val 4294910277 ecr 169371], length 0
20:00:13.687531 IP 112.26.0.8.35128 > 112.26.0.1.34747: Flags [.], ack 73849, win 1382, options [nop,nop,TS val 4294910370 ecr 169464], length 0
20:00:13.691283 IP 112.26.0.8.35128 > 112.26.0.1.34747: Flags [.], ack 73849, win 1382, options [nop,nop,TS val 4294910370 ecr 169464], length 0
20:00:13.710784 IP 112.26.0.1.34747 > 112.26.0.8.35128: Flags [.], seq 75297:76745, ack 1, win 1358, options [nop,nop,TS val 169465 ecr 4294909653], length 1448
20:00:13.713160 IP 112.26.0.8.35128 > 112.26.0.1.34747: Flags [.], ack 76745, win 1424, options [nop,nop,TS val 4294910585 ecr 169465], length 0
20:00:13.725561 IP 112.26.0.8.35128 > 112.26.0.1.34747: Flags [.], ack 75297, win 1405, options [nop,nop,TS val 4294910393 ecr 169464], length 0
20:00:13.727201 IP 112.26.0.8.35128 > 112.26.0.1.34747: Flags [.], ack 75297, win 1405, options [nop,nop,TS val 4294910393 ecr 169464], length 0
20:00:13.799312 IP 112.26.0.1.34747 > 112.26.0.8.35128: Flags [.], seq 76745:78193, ack 1, win 1358, options [nop,nop,TS val 169465 ecr 4294909653], length 1448
20:00:13.800909 IP 112.26.0.8.35128 > 112.26.0.1.34747: Flags [.], ack 78193, win 1424, options [nop,nop,TS val 4294910673 ecr 169465], length 0
20:00:13.814604 IP 112.26.0.1.34747 > 112.26.0.8.35128: Flags [.], seq 78193:79641, ack 1, win 1358, options [nop,nop,TS val 169465 ecr 4294909653], length 1448
20:00:13.883887 IP 112.26.0.8.35128 > 112.26.0.1.34747: Flags [.], ack 79641, win 1424, options [nop,nop,TS val 4294910689 ecr 169465], length 0
20:00:13.909055 IP 112.26.0.8.35128 > 112.26.0.1.34747: Flags [.], ack 76745, win 1424, options [nop,nop,TS val 4294910585 ecr 169465], length 0
20:00:13.910710 IP 112.26.0.8.35128 > 112.26.0.1.34747: Flags [.], ack 76745, win 1424, options [nop,nop,TS val 4294910585 ecr 169465], length 0
20:00:14.002118 IP 112.26.0.1.34747 > 112.26.0.8.35128: Flags [.], seq 79641:81089, ack 1, win 1358, options [nop,nop,TS val 169651 ecr 4294909885], length 1448
20:00:14.004419 IP 112.26.0.8.35128 > 112.26.0.1.34747: Flags [.], ack 81089, win 1424, options [nop,nop,TS val 4294910876 ecr 169651], length 0
20:00:14.085274 IP 112.26.0.8.35128 > 112.26.0.1.34747: Flags [.], ack 78193, win 1424, options [nop,nop,TS val 4294910673 ecr 169465], length 0
20:00:14.088078 IP 112.26.0.8.35128 > 112.26.0.1.34747: Flags [.], ack 78193, win 1424, options [nop,nop,TS val 4294910673 ecr 169465], length 0
20:00:14.109079 IP 112.26.0.8.35128 > 112.26.0.1.34747: Flags [.], ack 79641, win 1424, options [nop,nop,TS val 4294910689 ecr 169465], length 0
20:00:14.110717 IP 112.26.0.8.35128 > 112.26.0.1.34747: Flags [.], ack 79641, win 1424, options [nop,nop,TS val 4294910689 ecr 169465], length 0
20:00:14.193511 IP 112.26.0.1.34747 > 112.26.0.8.35128: Flags [.], seq 82537:83985, ack 1, win 1358, options [nop,nop,TS val 169959 ecr 4294910165], length 1448
20:00:14.195704 IP 112.26.0.8.35128 > 112.26.0.1.34747: Flags [.], ack 81089, win 1424, options [nop,nop,TS val 4294911067 ecr 169651,nop,nop,sack 1 {82537:83985}], length 0
20:00:14.211409 IP 112.26.0.1.34747 > 112.26.0.8.35128: Flags [.], seq 83985:85433, ack 1, win 1358, options [nop,nop,TS val 170155 ecr 4294910277], length 1448
20:00:14.213262 IP 112.26.0.8.35128 > 112.26.0.1.34747: Flags [.], ack 81089, win 1424, options [nop,nop,TS val 4294911085 ecr 169651,nop,nop,sack 1 {82537:85433}], length 0
20:00:14.308416 IP 112.26.0.1.34747 > 112.26.0.8.35128: Flags [.], seq 85433:86881, ack 1, win 1358, options [nop,nop,TS val 170249 ecr 4294910370], length 1448
20:00:14.310793 IP 112.26.0.8.35128 > 112.26.0.1.34747: Flags [.], ack 81089, win 1424, options [nop,nop,TS val 4294911182 ecr 169651,nop,nop,sack 1 {82537:86881}], length 0
20:00:14.396545 IP 112.26.0.8.35128 > 112.26.0.1.34747: Flags [.], ack 81089, win 1424, options [nop,nop,TS val 4294910876 ecr 169651], length 0
20:00:14.398387 IP 112.26.0.8.35128 > 112.26.0.1.34747: Flags [.], ack 81089, win 1424, options [nop,nop,TS val 4294910876 ecr 169651], length 0
20:00:14.412767 IP 112.26.0.1.34747 > 112.26.0.8.35128: Flags [.], seq 86881:88329, ack 1, win 1358, options [nop,nop,TS val 170285 ecr 4294910393], length 1448
20:00:14.416088 IP 112.26.0.8.35128 > 112.26.0.1.34747: Flags [.], ack 81089, win 1424, options [nop,nop,TS val 4294911287 ecr 169651,nop,nop,sack 1 {82537:88329}], length 0
20:00:14.499628 IP 112.26.0.1.34747 > 112.26.0.8.35128: Flags [.], seq 88329:89777, ack 1, win 1358, options [nop,nop,TS val 170469 ecr 4294910585], length 1448
20:00:14.501991 IP 112.26.0.8.35128 > 112.26.0.1.34747: Flags [.], ack 81089, win 1424, options [nop,nop,TS val 4294911374 ecr 169651,nop,nop,sack 1 {82537:89777}], length 0
20:00:14.509934 IP 112.26.0.1.34747 > 112.26.0.8.35128: Flags [.], seq 89777:91225, ack 1, win 1358, options [nop,nop,TS val 170469 ecr 4294910585], length 1448
20:00:14.512281 IP 112.26.0.8.35128 > 112.26.0.1.34747: Flags [.], ack 81089, win 1424, options [nop,nop,TS val 4294911384 ecr 169651,nop,nop,sack 1 {82537:91225}], length 0
20:00:14.600923 IP 112.26.0.8.35128 > 112.26.0.1.34747: Flags [.], ack 81089, win 1424, options [nop,nop,TS val 4294911067 ecr 169651,nop,nop,sack 1 {82537:83985}], length 0
20:00:14.602589 IP 112.26.0.8.35128 > 112.26.0.1.34747: Flags [.], ack 81089, win 1424, options [nop,nop,TS val 4294911067 ecr 169651,nop,nop,sack 1 {82537:83985}], length 0
20:00:14.701921 IP 112.26.0.8.35128 > 112.26.0.1.34747: Flags [.], ack 81089, win 1424, options [nop,nop,TS val 4294911085 ecr 169651,nop,nop,sack 1 {82537:85433}], length 0
20:00:14.704426 IP 112.26.0.8.35128 > 112.26.0.1.34747: Flags [.], ack 81089, win 1424, options [nop,nop,TS val 4294911085 ecr 169651,nop,nop,sack 1 {82537:85433}], length 0
20:00:14.718176 IP 112.26.0.1.34747 > 112.26.0.8.35128: Flags [.], seq 91225:92673, ack 1, win 1358, options [nop,nop,TS val 170646 ecr 4294910673], length 1448
20:00:14.720914 IP 112.26.0.8.35128 > 112.26.0.1.34747: Flags [.], ack 81089, win 1424, options [nop,nop,TS val 4294911593 ecr 169651,nop,nop,sack 1 {82537:92673}], length 0
20:00:14.799594 IP 112.26.0.1.34747 > 112.26.0.8.35128: Flags [.], seq 92673:94121, ack 1, win 1358, options [nop,nop,TS val 170669 ecr 4294910689], length 1448
20:00:14.802088 IP 112.26.0.8.35128 > 112.26.0.1.34747: Flags [.], ack 81089, win 1424, options [nop,nop,TS val 4294911674 ecr 169651,nop,nop,sack 1 {82537:94121}], length 0
20:00:14.809558 IP 112.26.0.8.35128 > 112.26.0.1.34747: Flags [.], ack 81089, win 1424, options [nop,nop,TS val 4294911182 ecr 169651,nop,nop,sack 1 {82537:86881}], length 0
20:00:14.811222 IP 112.26.0.8.35128 > 112.26.0.1.34747: Flags [.], ack 81089, win 1424, options [nop,nop,TS val 4294911182 ecr 169651,nop,nop,sack 1 {82537:86881}], length 0
20:00:14.903622 IP 112.26.0.1.34747 > 112.26.0.8.35128: Flags [.], seq 94121:95569, ack 1, win 1358, options [nop,nop,TS val 170958 ecr 4294910876], length 1448
20:00:14.907257 IP 112.26.0.8.35128 > 112.26.0.1.34747: Flags [.], ack 81089, win 1424, options [nop,nop,TS val 4294911778 ecr 169651,nop,nop,sack 1 {82537:95569}], length 0
20:00:14.992639 IP 112.26.0.8.35128 > 112.26.0.1.34747: Flags [.], ack 81089, win 1424, options [nop,nop,TS val 4294911374 ecr 169651,nop,nop,sack 1 {82537:89777}], length 0
20:00:14.995711 IP 112.26.0.8.35128 > 112.26.0.1.34747: Flags [.], ack 81089, win 1424, options [nop,nop,TS val 4294911374 ecr 169651,nop,nop,sack 1 {82537:89777}], length 0
20:00:15.009665 IP 112.26.0.8.35128 > 112.26.0.1.34747: Flags [.], ack 81089, win 1424, options [nop,nop,TS val 4294911384 ecr 169651,nop,nop,sack 1 {82537:91225}], length 0
20:00:15.011356 IP 112.26.0.8.35128 > 112.26.0.1.34747: Flags [.], ack 81089, win 1424, options [nop,nop,TS val 4294911384 ecr 169651,nop,nop,sack 1 {82537:91225}], length 0
20:00:15.028138 IP 112.26.0.1.34747 > 112.26.0.8.35128: Flags [.], seq 95569:97017, ack 1, win 1358, options [nop,nop,TS val 171161 ecr 4294911067], length 1448
20:00:15.032189 IP 112.26.0.8.35128 > 112.26.0.1.34747: Flags [.], ack 81089, win 1424, options [nop,nop,TS val 4294911902 ecr 169651,nop,nop,sack 1 {82537:97017}], length 0
20:00:15.111173 IP 112.26.0.1.34747 > 112.26.0.8.35128: Flags [.], seq 97017:98465, ack 1, win 1358, options [nop,nop,TS val 171263 ecr 4294911085], length 1448
20:00:15.114066 IP 112.26.0.8.35128 > 112.26.0.1.34747: Flags [.], ack 81089, win 1424, options [nop,nop,TS val 4294911985 ecr 169651,nop,nop,sack 1 {82537:98465}], length 0
20:00:15.206426 IP 112.26.0.8.35128 > 112.26.0.1.34747: Flags [.], ack 81089, win 1424, options [nop,nop,TS val 4294911593 ecr 169651,nop,nop,sack 1 {82537:92673}], length 0
20:00:15.224614 IP 112.26.0.8.35128 > 112.26.0.1.34747: Flags [.], ack 81089, win 1424, options [nop,nop,TS val 4294911674 ecr 169651,nop,nop,sack 1 {82537:94121}], length 0
20:00:15.231974 IP 112.26.0.8.35128 > 112.26.0.1.34747: Flags [.], ack 81089, win 1424, options [nop,nop,TS val 4294911593 ecr 169651,nop,nop,sack 1 {82537:92673}], length 0
20:00:15.247546 IP 112.26.0.1.34747 > 112.26.0.8.35128: Flags [.], seq 81089:82537, ack 1, win 1358, options [nop,nop,TS val 171370 ecr 4294911182], length 1448
20:00:15.292357 IP 112.26.0.8.35128 > 112.26.0.1.34747: Flags [.], ack 98465, win 1341, options [nop,nop,TS val 4294912122 ecr 171370], length 0
20:00:15.320387 IP 112.26.0.8.35128 > 112.26.0.1.34747: Flags [.], ack 81089, win 1424, options [nop,nop,TS val 4294911778 ecr 169651,nop,nop,sack 1 {82537:95569}], length 0
20:00:15.327599 IP 112.26.0.8.35128 > 112.26.0.1.34747: Flags [.], ack 81089, win 1424, options [nop,nop,TS val 4294911674 ecr 169651,nop,nop,sack 1 {82537:94121}], length 0
20:00:15.408234 IP 112.26.0.1.34747 > 112.26.0.8.35128: Flags [.], seq 98465:99913, ack 1, win 1358, options [nop,nop,TS val 171570 ecr 4294911384], length 1448
20:00:15.409832 IP 112.26.0.8.35128 > 112.26.0.1.34747: Flags [.], ack 99913, win 1424, options [nop,nop,TS val 4294912282 ecr 171570], length 0
20:00:15.424621 IP 112.26.0.8.35128 > 112.26.0.1.34747: Flags [.], ack 81089, win 1424, options [nop,nop,TS val 4294911902 ecr 169651,nop,nop,sack 1 {82537:97017}], length 0
20:00:15.501391 IP 112.26.0.8.35128 > 112.26.0.1.34747: Flags [.], ack 81089, win 1424, options [nop,nop,TS val 4294911778 ecr 169651,nop,nop,sack 1 {82537:95569}], length 0
20:00:15.517337 IP 112.26.0.8.35128 > 112.26.0.1.34747: Flags [.], ack 81089, win 1424, options [nop,nop,TS val 4294911985 ecr 169651,nop,nop,sack 1 {82537:98465}], length 0
20:00:15.632553 IP 112.26.0.1.34747 > 112.26.0.8.35128: Flags [.], seq 99913:101361, ack 1, win 1358, options [nop,nop,TS val 171790 ecr 4294911593], length 1448
20:00:15.634620 IP 112.26.0.8.35128 > 112.26.0.1.34747: Flags [.], ack 101361, win 1424, options [nop,nop,TS val 4294912507 ecr 171790], length 0
20:00:15.639751 IP 112.26.0.8.35128 > 112.26.0.1.34747: Flags [.], ack 81089, win 1424, options [nop,nop,TS val 4294911902 ecr 169651,nop,nop,sack 1 {82537:97017}], length 0
20:00:15.698694 IP 112.26.0.8.35128 > 112.26.0.1.34747: Flags [.], ack 98465, win 1341, options [nop,nop,TS val 4294912122 ecr 171370], length 0
20:00:15.718656 IP 112.26.0.8.35128 > 112.26.0.1.34747: Flags [.], ack 81089, win 1424, options [nop,nop,TS val 4294911985 ecr 169651,nop,nop,sack 1 {82537:98465}], length 0
20:00:15.732666 IP 112.26.0.1.34747 > 112.26.0.8.35128: Flags [.], seq 101361:102809, ack 1, win 1358, options [nop,nop,TS val 171886 ecr 4294911674], length 1448
20:00:15.735374 IP 112.26.0.8.35128 > 112.26.0.1.34747: Flags [.], ack 102809, win 1424, options [nop,nop,TS val 4294912607 ecr 171886], length 0
20:00:15.820485 IP 112.26.0.8.35128 > 112.26.0.1.34747: Flags [.], ack 98465, win 1341, options [nop,nop,TS val 4294912122 ecr 171370], length 0
20:00:15.900088 IP 112.26.0.8.35128 > 112.26.0.1.34747: Flags [.], ack 99913, win 1424, options [nop,nop,TS val 4294912282 ecr 171570], length 0
20:00:15.908394 IP 112.26.0.8.35128 > 112.26.0.1.34747: Flags [.], ack 99913, win 1424, options [nop,nop,TS val 4294912282 ecr 171570], length 0
20:00:15.918386 IP 112.26.0.1.34747 > 112.26.0.8.35128: Flags [.], seq 102809:104257, ack 1, win 1358, options [nop,nop,TS val 172059 ecr 4294911778], length 1448
20:00:15.920762 IP 112.26.0.8.35128 > 112.26.0.1.34747: Flags [.], ack 104257, win 1424, options [nop,nop,TS val 4294912793 ecr 172059], length 0
20:00:16.005480 IP 112.26.0.8.35128 > 112.26.0.1.34747: Flags [.], ack 101361, win 1424, options [nop,nop,TS val 4294912507 ecr 171790], length 0
20:00:16.007137 IP 112.26.0.8.35128 > 112.26.0.1.34747: Flags [.], ack 101361, win 1424, options [nop,nop,TS val 4294912507 ecr 171790], length 0
20:00:16.099109 IP 112.26.0.1.34747 > 112.26.0.8.35128: Flags [.], seq 104257:105705, ack 1, win 1358, options [nop,nop,TS val 172198 ecr 4294911902], length 1448
20:00:16.101920 IP 112.26.0.8.35128 > 112.26.0.1.34747: Flags [.], ack 105705, win 1424, options [nop,nop,TS val 4294912974 ecr 172198], length 0
20:00:16.119047 IP 112.26.0.1.34747 > 112.26.0.8.35128: Flags [.], seq 105705:107153, ack 1, win 1358, options [nop,nop,TS val 172276 ecr 4294911985], length 1448
20:00:16.122266 IP 112.26.0.8.35128 > 112.26.0.1.34747: Flags [.], ack 107153, win 1424, options [nop,nop,TS val 4294912994 ecr 172276], length 0
20:00:16.212249 IP 112.26.0.8.35128 > 112.26.0.1.34747: Flags [.], ack 102809, win 1424, options [nop,nop,TS val 4294912607 ecr 171886], length 0
20:00:16.213907 IP 112.26.0.8.35128 > 112.26.0.1.34747: Flags [.], ack 102809, win 1424, options [nop,nop,TS val 4294912607 ecr 171886], length 0
20:00:16.301080 IP 112.26.0.1.34747 > 112.26.0.8.35128: Flags [.], seq 107153:108601, ack 1, win 1358, options [nop,nop,TS val 172378 ecr 4294912122], length 1448
20:00:16.304446 IP 112.26.0.8.35128 > 112.26.0.1.34747: Flags [.], ack 108601, win 1424, options [nop,nop,TS val 4294913176 ecr 172378], length 0
20:00:16.312898 IP 112.26.0.8.35128 > 112.26.0.1.34747: Flags [.], ack 104257, win 1424, options [nop,nop,TS val 4294912793 ecr 172059], length 0
20:00:16.314554 IP 112.26.0.8.35128 > 112.26.0.1.34747: Flags [.], ack 104257, win 1424, options [nop,nop,TS val 4294912793 ecr 172059], length 0
20:00:16.330682 IP 112.26.0.1.34747 > 112.26.0.8.35128: Flags [.], seq 108601:110049, ack 1, win 1358, options [nop,nop,TS val 172466 ecr 4294912282], length 1448
20:00:16.332764 IP 112.26.0.8.35128 > 112.26.0.1.34747: Flags [.], ack 110049, win 1424, options [nop,nop,TS val 4294913205 ecr 172466], length 0
20:00:16.406690 IP 112.26.0.1.34747 > 112.26.0.8.35128: Flags [.], seq 110049:111497, ack 1, win 1358, options [nop,nop,TS val 172565 ecr 4294912507], length 1448
20:00:16.409172 IP 112.26.0.8.35128 > 112.26.0.1.34747: Flags [.], ack 111497, win 1424, options [nop,nop,TS val 4294913281 ecr 172565], length 0
20:00:16.416046 IP 112.26.0.8.35128 > 112.26.0.1.34747: Flags [.], ack 105705, win 1424, options [nop,nop,TS val 4294912974 ecr 172198], length 0
20:00:16.417702 IP 112.26.0.8.35128 > 112.26.0.1.34747: Flags [.], ack 105705, win 1424, options [nop,nop,TS val 4294912974 ecr 172198], length 0
20:00:16.509750 IP 112.26.0.8.35128 > 112.26.0.1.34747: Flags [.], ack 107153, win 1424, options [nop,nop,TS val 4294912994 ecr 172276], length 0
20:00:16.526129 IP 112.26.0.8.35128 > 112.26.0.1.34747: Flags [.], ack 107153, win 1424, options [nop,nop,TS val 4294912994 ecr 172276], length 0
20:00:16.530820 IP 112.26.0.1.34747 > 112.26.0.8.35128: Flags [.], seq 111497:112945, ack 1, win 1358, options [nop,nop,TS val 172565 ecr 4294912507], length 1448
20:00:16.533379 IP 112.26.0.8.35128 > 112.26.0.1.34747: Flags [.], ack 112945, win 1424, options [nop,nop,TS val 4294913405 ecr 172565], length 0
20:00:16.603399 IP 112.26.0.1.34747 > 112.26.0.8.35128: Flags [.], seq 112945:114393, ack 1, win 1358, options [nop,nop,TS val 172772 ecr 4294912607], length 1448
20:00:16.607853 IP 112.26.0.8.35128 > 112.26.0.1.34747: Flags [.], ack 114393, win 1424, options [nop,nop,TS val 4294913478 ecr 172772], length 0
20:00:16.624779 IP 112.26.0.8.35128 > 112.26.0.1.34747: Flags [.], ack 108601, win 1424, options [nop,nop,TS val 4294913176 ecr 172378], length 0
20:00:16.629392 IP 112.26.0.8.35128 > 112.26.0.1.34747: Flags [.], ack 108601, win 1424, options [nop,nop,TS val 4294913176 ecr 172378], length 0
20:00:16.704835 IP 112.26.0.1.34747 > 112.26.0.8.35128: Flags [.], seq 114393:115841, ack 1, win 1358, options [nop,nop,TS val 172873 ecr 4294912793], length 1448
20:00:16.707344 IP 112.26.0.8.35128 > 112.26.0.1.34747: Flags [.], ack 115841, win 1424, options [nop,nop,TS val 4294913579 ecr 172873], length 0
20:00:16.734625 IP 112.26.0.8.35128 > 112.26.0.1.34747: Flags [.], ack 110049, win 1424, options [nop,nop,TS val 4294913205 ecr 172466], length 0
20:00:16.736273 IP 112.26.0.8.35128 > 112.26.0.1.34747: Flags [.], ack 110049, win 1424, options [nop,nop,TS val 4294913205 ecr 172466], length 0
20:00:16.812724 IP 112.26.0.8.35128 > 112.26.0.1.34747: Flags [.], ack 111497, win 1424, options [nop,nop,TS val 4294913281 ecr 172565], length 0
20:00:16.815256 IP 112.26.0.8.35128 > 112.26.0.1.34747: Flags [.], ack 111497, win 1424, options [nop,nop,TS val 4294913281 ecr 172565], length 0
20:00:16.831268 IP 112.26.0.1.34747 > 112.26.0.8.35128: Flags [.], seq 115841:117289, ack 1, win 1358, options [nop,nop,TS val 172976 ecr 4294912974], length 1448
20:00:16.833602 IP 112.26.0.8.35128 > 112.26.0.1.34747: Flags [.], ack 117289, win 1424, options [nop,nop,TS val 4294913705 ecr 172976], length 0
20:00:16.913891 IP 112.26.0.8.35128 > 112.26.0.1.34747: Flags [.], ack 112945, win 1424, options [nop,nop,TS val 4294913405 ecr 172565], length 0
20:00:16.922044 IP 112.26.0.8.35128 > 112.26.0.1.34747: Flags [.], ack 112945, win 1424, options [nop,nop,TS val 4294913405 ecr 172565], length 0
20:00:16.930558 IP 112.26.0.8.35128 > 112.26.0.1.34747: Flags [.], ack 114393, win 1424, options [nop,nop,TS val 4294913478 ecr 172772], length 0
20:00:16.937869 IP 112.26.0.8.35128 > 112.26.0.1.34747: Flags [.], ack 114393, win 1424, options [nop,nop,TS val 4294913478 ecr 172772], length 0
20:00:16.947737 IP 112.26.0.1.34747 > 112.26.0.8.35128: Flags [.], seq 117289:118737, ack 1, win 1358, options [nop,nop,TS val 173084 ecr 4294912994], length 1448
20:00:16.950971 IP 112.26.0.8.35128 > 112.26.0.1.34747: Flags [.], ack 118737, win 1424, options [nop,nop,TS val 4294913822 ecr 173084], length 0
20:00:17.023932 IP 112.26.0.8.35128 > 112.26.0.1.34747: Flags [.], ack 115841, win 1424, options [nop,nop,TS val 4294913579 ecr 172873], length 0
20:00:17.025584 IP 112.26.0.8.35128 > 112.26.0.1.34747: Flags [.], ack 115841, win 1424, options [nop,nop,TS val 4294913579 ecr 172873], length 0
20:00:17.104094 IP 112.26.0.1.34747 > 112.26.0.8.35128: Flags [.], seq 118737:120185, ack 1, win 1358, options [nop,nop,TS val 173084 ecr 4294912994], length 1448
20:00:17.107911 IP 112.26.0.8.35128 > 112.26.0.1.34747: Flags [.], ack 120185, win 1424, options [nop,nop,TS val 4294913978 ecr 173084], length 0
20:00:17.122508 IP 112.26.0.1.34747 > 112.26.0.8.35128: Flags [.], seq 120185:121633, ack 1, win 1358, options [nop,nop,TS val 173187 ecr 4294913176], length 1448
20:00:17.204936 IP 112.26.0.8.35128 > 112.26.0.1.34747: Flags [.], ack 121633, win 1424, options [nop,nop,TS val 4294914038 ecr 173187], length 0
20:00:17.219594 IP 112.26.0.1.34747 > 112.26.0.8.35128: Flags [.], seq 121633:123081, ack 1, win 1358, options [nop,nop,TS val 173295 ecr 4294913205], length 1448
20:00:17.305695 IP 112.26.0.8.35128 > 112.26.0.1.34747: Flags [.], ack 123081, win 1424, options [nop,nop,TS val 4294914176 ecr 173295], length 0
20:00:17.309049 IP 112.26.0.8.35128 > 112.26.0.1.34747: Flags [.], ack 117289, win 1424, options [nop,nop,TS val 4294913705 ecr 172976], length 0
20:00:17.311975 IP 112.26.0.8.35128 > 112.26.0.1.34747: Flags [.], ack 117289, win 1424, options [nop,nop,TS val 4294913705 ecr 172976], length 0
20:00:17.333052 IP 112.26.0.1.34747 > 112.26.0.8.35128: Flags [.], seq 123081:124529, ack 1, win 1358, options [nop,nop,TS val 173374 ecr 4294913281], length 1448
20:00:17.342839 IP 112.26.0.1.34747 > 112.26.0.8.35128: Flags [.], seq 124529:125977, ack 1, win 1358, options [nop,nop,TS val 173480 ecr 4294913405], length 1448
20:00:17.345175 IP 112.26.0.8.35128 > 112.26.0.1.34747: Flags [.], ack 125977, win 1424, options [nop,nop,TS val 4294914217 ecr 173374], length 0
20:00:17.409504 IP 112.26.0.8.35128 > 112.26.0.1.34747: Flags [.], ack 118737, win 1424, options [nop,nop,TS val 4294913822 ecr 173084], length 0
