20:00:07.377300 IP 112.26.0.8.35128 > 112.26.0.1.34747: Flags [S], seq 2611020501, win 29200, options [mss 1460,sackOK,TS val 4294904234 ecr 0,nop,wscale 7], length 0
20:00:07.477283 IP 112.26.0.8.35128 > 112.26.0.1.34747: Flags [S], seq 2611020501, win 29200, options [mss 1460,sackOK,TS val 4294904234 ecr 0,nop,wscale 7], length 0
20:00:07.670330 IP 112.26.0.1.34747 > 112.26.0.8.35128: Flags [S.], seq 2195574532, ack 2611020502, win 65535, options [mss 1460,sackOK,TS val 164054 ecr 4294904234,nop,wscale 6], length 0
20:00:07.675350 IP 112.26.0.8.35128 > 112.26.0.1.34747: Flags [.], ack 1, win 229, options [nop,nop,TS val 4294904544 ecr 164054], length 0
20:00:07.688513 IP 112.26.0.8.35128 > 112.26.0.1.34747: Flags [.], ack 1, win 229, options [nop,nop,TS val 4294904544 ecr 164054], length 0
20:00:07.870564 IP 112.26.0.1.34747 > 112.26.0.8.35128: Flags [.], seq 1:1449, ack 1, win 1358, options [nop,nop,TS val 164324 ecr 4294904544], length 1448
20:00:07.870933 IP 112.26.0.8.35128 > 112.26.0.1.34747: Flags [.], ack 1449, win 251, options [nop,nop,TS val 4294904745 ecr 164324], length 0
20:00:07.977128 IP 112.26.0.1.34747 > 112.26.0.8.35128: Flags [.], seq 1449:2897, ack 1, win 1358, options [nop,nop,TS val 164324 ecr 4294904544], length 1448
20:00:07.977455 IP 112.26.0.8.35128 > 112.26.0.1.34747: Flags [.], ack 2897, win 274, options [nop,nop,TS val 4294904851 ecr 164324], length 0
20:00:07.984517 IP 112.26.0.8.35128 > 112.26.0.1.34747: Flags [.], ack 1449, win 251, options [nop,nop,TS val 4294904745 ecr 164324], length 0
20:00:08.069788 IP 112.26.0.8.35128 > 112.26.0.1.34747: Flags [.], ack 2897, win 274, options [nop,nop,TS val 4294904851 ecr 164324], length 0
20:00:08.077452 IP 112.26.0.1.34747 > 112.26.0.8.35128: Flags [.], seq 2897:4345, ack 1, win 1358, options [nop,nop,TS val 164324 ecr 4294904544], length 1448
20:00:08.077807 IP 112.26.0.8.35128 > 112.26.0.1.34747: Flags [.], ack 4345, win 296, options [nop,nop,TS val 4294904951 ecr 164324], length 0
20:00:08.156043 IP 112.26.0.8.35128 > 112.26.0.1.34747: Flags [.], ack 4345, win 296, options [nop,nop,TS val 4294904951 ecr 164324], length 0
20:00:08.187542 IP 112.26.0.1.34747 > 112.26.0.8.35128: Flags [.], seq 4345:5793, ack 1, win 1358, options [nop,nop,TS val 164325 ecr 4294904544], length 1448
20:00:08.187847 IP 112.26.0.8.35128 > 112.26.0.1.34747: Flags [.], ack 5793, win 319, options [nop,nop,TS val 4294905061 ecr 164325], length 0
20:00:08.267336 IP 112.26.0.8.35128 > 112.26.0.1.34747: Flags [.], ack 5793, win 319, options [nop,nop,TS val 4294905061 ecr 164325], length 0
20:00:08.276479 IP 112.26.0.1.34747 > 112.26.0.8.35128: Flags [.], seq 5793:7241, ack 1, win 1358, options [nop,nop,TS val 164325 ecr 4294904544], length 1448
20:00:08.276823 IP 112.26.0.8.35128 > 112.26.0.1.34747: Flags [.], ack 7241, win 342, options [nop,nop,TS val 4294905150 ecr 164325], length 0
20:00:08.299300 IP 112.26.0.8.35128 > 112.26.0.1.34747: Flags [.], ack 7241, win 342, options [nop,nop,TS val 4294905150 ecr 164325], length 0
20:00:08.470122 IP 112.26.0.1.34747 > 112.26.0.8.35128: Flags [.], seq 7241:8689, ack 1, win 1358, options [nop,nop,TS val 164325 ecr 4294904544], length 1448
20:00:08.470497 IP 112.26.0.8.35128 > 112.26.0.1.34747: Flags [.], ack 8689, win 364, options [nop,nop,TS val 4294905344 ecr 164325], length 0
20:00:08.479078 IP 112.26.0.8.35128 > 112.26.0.1.34747: Flags [.], ack 8689, win 364, options [nop,nop,TS val 4294905344 ecr 164325], length 0
20:00:08.499200 IP 112.26.0.1.34747 > 112.26.0.8.35128: Flags [.], seq 8689:10137, ack 1, win 1358, options [nop,nop,TS val 164325 ecr 4294904544], length 1448
20:00:08.499556 IP 112.26.0.8.35128 > 112.26.0.1.34747: Flags [.], ack 10137, win 387, options [nop,nop,TS val 4294905373 ecr 164325], length 0
20:00:08.504646 IP 112.26.0.8.35128 > 112.26.0.1.34747: Flags [.], ack 10137, win 387, options [nop,nop,TS val 4294905373 ecr 164325], length 0
20:00:08.665394 IP 112.26.0.1.34747 > 112.26.0.8.35128: Flags [.], seq 10137:11585, ack 1, win 1358, options [nop,nop,TS val 164325 ecr 4294904544], length 1448
20:00:08.665724 IP 112.26.0.8.35128 > 112.26.0.1.34747: Flags [.], ack 11585, win 410, options [nop,nop,TS val 4294905540 ecr 164325], length 0
20:00:08.766527 IP 112.26.0.8.35128 > 112.26.0.1.34747: Flags [.], ack 11585, win 410, options [nop,nop,TS val 4294905540 ecr 164325], length 0
20:00:08.858591 IP 112.26.0.1.34747 > 112.26.0.8.35128: Flags [.], seq 14481:15929, ack 1, win 1358, options [nop,nop,TS val 164721 ecr 4294904745], length 1448
20:00:08.858935 IP 112.26.0.8.35128 > 112.26.0.1.34747: Flags [.], ack 11585, win 432, options [nop,nop,TS val 4294905733 ecr 164325,nop,nop,sack 1 {14481:15929}], length 0
20:00:08.866486 IP 112.26.0.8.35128 > 112.26.0.1.34747: Flags [.], ack 11585, win 432, options [nop,nop,TS val 4294905733 ecr 164325,nop,nop,sack 1 {14481:15929}], length 0
20:00:08.890022 IP 112.26.0.1.34747 > 112.26.0.8.35128: Flags [.], seq 15929:17377, ack 1, win 1358, options [nop,nop,TS val 164721 ecr 4294904745], length 1448
20:00:08.890325 IP 112.26.0.8.35128 > 112.26.0.1.34747: Flags [.], ack 11585, win 455, options [nop,nop,TS val 4294905764 ecr 164325,nop,nop,sack 1 {14481:17377}], length 0
20:00:08.894514 IP 112.26.0.8.35128 > 112.26.0.1.34747: Flags [.], ack 11585, win 455, options [nop,nop,TS val 4294905764 ecr 164325,nop,nop,sack 1 {14481:17377}], length 0
20:00:08.966824 IP 112.26.0.1.34747 > 112.26.0.8.35128: Flags [.], seq 18825:20273, ack 1, win 1358, options [nop,nop,TS val 164958 ecr 4294904851], length 1448
20:00:08.967177 IP 112.26.0.8.35128 > 112.26.0.1.34747: Flags [.], ack 11585, win 477, options [nop,nop,TS val 4294905841 ecr 164325,nop,nop,sack 2 {18825:20273}{14481:17377}], length 0
20:00:08.971294 IP 112.26.0.8.35128 > 112.26.0.1.34747: Flags [.], ack 11585, win 477, options [nop,nop,TS val 4294905841 ecr 164325,nop,nop,sack 2 {18825:20273}{14481:17377}], length 0
20:00:09.065642 IP 112.26.0.1.34747 > 112.26.0.8.35128: Flags [.], seq 21721:23169, ack 1, win 1358, options [nop,nop,TS val 165130 ecr 4294904951], length 1448
20:00:09.066021 IP 112.26.0.8.35128 > 112.26.0.1.34747: Flags [.], ack 11585, win 500, options [nop,nop,TS val 4294905940 ecr 164325,nop,nop,sack 3 {21721:23169}{18825:20273}{14481:17377}], length 0
20:00:09.070832 IP 112.26.0.8.35128 > 112.26.0.1.34747: Flags [.], ack 11585, win 500, options [nop,nop,TS val 4294905940 ecr 164325,nop,nop,sack 3 {21721:23169}{18825:20273}{14481:17377}], length 0
20:00:09.179232 IP 112.26.0.1.34747 > 112.26.0.8.35128: Flags [.], seq 23169:24617, ack 1, win 1358, options [nop,nop,TS val 165328 ecr 4294905061], length 1448
20:00:09.179555 IP 112.26.0.8.35128 > 112.26.0.1.34747: Flags [.], ack 11585, win 523, options [nop,nop,TS val 4294906053 ecr 164325,nop,nop,sack 3 {21721:24617}{18825:20273}{14481:17377}], length 0
20:00:09.182575 IP 112.26.0.8.35128 > 112.26.0.1.34747: Flags [.], ack 11585, win 523, options [nop,nop,TS val 4294906053 ecr 164325,nop,nop,sack 3 {21721:24617}{18825:20273}{14481:17377}], length 0
20:00:09.272248 IP 112.26.0.1.34747 > 112.26.0.8.35128: Flags [.], seq 24617:26065, ack 1, win 1358, options [nop,nop,TS val 165328 ecr 4294905061], length 1448
20:00:09.272508 IP 112.26.0.8.35128 > 112.26.0.1.34747: Flags [.], ack 11585, win 545, options [nop,nop,TS val 4294906146 ecr 164325,nop,nop,sack 3 {21721:26065}{18825:20273}{14481:17377}], length 0
20:00:09.287139 IP 112.26.0.8.35128 > 112.26.0.1.34747: Flags [.], ack 11585, win 545, options [nop,nop,TS val 4294906146 ecr 164325,nop,nop,sack 3 {21721:26065}{18825:20273}{14481:17377}], length 0
20:00:09.364986 IP 112.26.0.1.34747 > 112.26.0.8.35128: Flags [.], seq 26065:27513, ack 1, win 1358, options [nop,nop,TS val 165342 ecr 4294905150], length 1448
20:00:09.365330 IP 112.26.0.8.35128 > 112.26.0.1.34747: Flags [.], ack 11585, win 568, options [nop,nop,TS val 4294906239 ecr 164325,nop,nop,sack 3 {21721:27513}{18825:20273}{14481:17377}], length 0
20:00:09.386084 IP 112.26.0.8.35128 > 112.26.0.1.34747: Flags [.], ack 11585, win 568, options [nop,nop,TS val 4294906239 ecr 164325,nop,nop,sack 3 {21721:27513}{18825:20273}{14481:17377}], length 0
20:00:09.570108 IP 112.26.0.1.34747 > 112.26.0.8.35128: Flags [.], seq 28961:30409, ack 1, win 1358, options [nop,nop,TS val 165727 ecr 4294905540], length 1448
20:00:09.570448 IP 112.26.0.8.35128 > 112.26.0.1.34747: Flags [.], ack 11585, win 591, options [nop,nop,TS val 4294906444 ecr 164325,nop,nop,sack 3 {28961:30409}{21721:27513}{18825:20273}], length 0
20:00:09.574431 IP 112.26.0.8.35128 > 112.26.0.1.34747: Flags [.], ack 11585, win 591, options [nop,nop,TS val 4294906444 ecr 164325,nop,nop,sack 3 {28961:30409}{21721:27513}{18825:20273}], length 0
20:00:09.667235 IP 112.26.0.1.34747 > 112.26.0.8.35128: Flags [.], seq 30409:31857, ack 1, win 1358, options [nop,nop,TS val 165727 ecr 4294905540], length 1448
20:00:09.667589 IP 112.26.0.8.35128 > 112.26.0.1.34747: Flags [.], ack 11585, win 613, options [nop,nop,TS val 4294906541 ecr 164325,nop,nop,sack 3 {28961:31857}{21721:27513}{18825:20273}], length 0
20:00:09.672455 IP 112.26.0.8.35128 > 112.26.0.1.34747: Flags [.], ack 11585, win 613, options [nop,nop,TS val 4294906541 ecr 164325,nop,nop,sack 3 {28961:31857}{21721:27513}{18825:20273}], length 0
20:00:09.765785 IP 112.26.0.1.34747 > 112.26.0.8.35128: Flags [.], seq 31857:33305, ack 1, win 1358, options [nop,nop,TS val 165727 ecr 4294905540], length 1448
20:00:09.766165 IP 112.26.0.8.35128 > 112.26.0.1.34747: Flags [.], ack 11585, win 636, options [nop,nop,TS val 4294906640 ecr 164325,nop,nop,sack 3 {28961:33305}{21721:27513}{18825:20273}], length 0
20:00:09.776870 IP 112.26.0.8.35128 > 112.26.0.1.34747: Flags [.], ack 11585, win 636, options [nop,nop,TS val 4294906640 ecr 164325,nop,nop,sack 3 {28961:33305}{21721:27513}{18825:20273}], length 0
20:00:09.869642 IP 112.26.0.1.34747 > 112.26.0.8.35128: Flags [.], seq 33305:34753, ack 1, win 1358, options [nop,nop,TS val 165727 ecr 4294905540], length 1448
20:00:09.870053 IP 112.26.0.8.35128 > 112.26.0.1.34747: Flags [.], ack 11585, win 658, options [nop,nop,TS val 4294906744 ecr 164325,nop,nop,sack 3 {28961:34753}{21721:27513}{18825:20273}], length 0
20:00:09.874228 IP 112.26.0.8.35128 > 112.26.0.1.34747: Flags [.], ack 11585, win 658, options [nop,nop,TS val 4294906744 ecr 164325,nop,nop,sack 3 {28961:34753}{21721:27513}{18825:20273}], length 0
20:00:09.885229 IP 112.26.0.1.34747 > 112.26.0.8.35128: Flags [.], seq 34753:36201, ack 1, win 1358, options [nop,nop,TS val 165727 ecr 4294905540], length 1448
20:00:09.885579 IP 112.26.0.8.35128 > 112.26.0.1.34747: Flags [.], ack 11585, win 681, options [nop,nop,TS val 4294906759 ecr 164325,nop,nop,sack 3 {28961:36201}{21721:27513}{18825:20273}], length 0
20:00:09.962222 IP 112.26.0.8.35128 > 112.26.0.1.34747: Flags [.], ack 11585, win 681, options [nop,nop,TS val 4294906759 ecr 164325,nop,nop,sack 3 {28961:36201}{21721:27513}{18825:20273}], length 0
20:00:09.971871 IP 112.26.0.1.34747 > 112.26.0.8.35128: Flags [.], seq 11585:13033, ack 1, win 1358, options [nop,nop,TS val 165951 ecr 4294905764], length 1448
20:00:09.972250 IP 112.26.0.8.35128 > 112.26.0.1.34747: Flags [.], ack 13033, win 704, options [nop,nop,TS val 4294906846 ecr 165951,nop,nop,sack 3 {28961:36201}{21721:27513}{18825:20273}], length 0
20:00:09.981510 IP 112.26.0.8.35128 > 112.26.0.1.34747: Flags [.], ack 13033, win 704, options [nop,nop,TS val 4294906846 ecr 165951,nop,nop,sack 3 {28961:36201}{21721:27513}{18825:20273}], length 0
20:00:10.072323 IP 112.26.0.1.34747 > 112.26.0.8.35128: Flags [.], seq 37649:39097, ack 1, win 1358, options [nop,nop,TS val 165951 ecr 4294905764], length 1448
20:00:10.072638 IP 112.26.0.8.35128 > 112.26.0.1.34747: Flags [.], ack 13033, win 726, options [nop,nop,TS val 4294906946 ecr 165951,nop,nop,sack 3 {37649:39097}{28961:36201}{21721:27513}], length 0
20:00:10.076845 IP 112.26.0.8.35128 > 112.26.0.1.34747: Flags [.], ack 13033, win 726, options [nop,nop,TS val 4294906946 ecr 165951,nop,nop,sack 3 {37649:39097}{28961:36201}{21721:27513}], length 0
20:00:10.493522 IP 112.26.0.1.34747 > 112.26.0.8.35128: Flags [.], seq 17377:18825, ack 1, win 1358, options [nop,nop,TS val 166561 ecr 4294906444], length 1448
20:00:10.493837 IP 112.26.0.8.35128 > 112.26.0.1.34747: Flags [.], ack 13033, win 749, options [nop,nop,TS val 4294907368 ecr 165951,nop,nop,sack 3 {17377:20273}{37649:39097}{28961:36201}], length 0
20:00:10.496986 IP 112.26.0.8.35128 > 112.26.0.1.34747: Flags [.], ack 13033, win 749, options [nop,nop,TS val 4294907368 ecr 165951,nop,nop,sack 3 {17377:20273}{37649:39097}{28961:36201}], length 0
20:00:10.594531 IP 112.26.0.1.34747 > 112.26.0.8.35128: Flags [.], seq 27513:28961, ack 1, win 1358, options [nop,nop,TS val 166561 ecr 4294906444], length 1448
20:00:10.594878 IP 112.26.0.8.35128 > 112.26.0.1.34747: Flags [.], ack 13033, win 772, options [nop,nop,TS val 4294907469 ecr 165951,nop,nop,sack 3 {21721:36201}{17377:20273}{37649:39097}], length 0
20:00:10.597447 IP 112.26.0.8.35128 > 112.26.0.1.34747: Flags [.], ack 13033, win 772, options [nop,nop,TS val 4294907469 ecr 165951,nop,nop,sack 3 {21721:36201}{17377:20273}{37649:39097}], length 0
20:00:10.675578 IP 112.26.0.1.34747 > 112.26.0.8.35128: Flags [.], seq 39097:40545, ack 1, win 1358, options [nop,nop,TS val 166650 ecr 4294906541], length 1448
20:00:10.675925 IP 112.26.0.8.35128 > 112.26.0.1.34747: Flags [.], ack 13033, win 794, options [nop,nop,TS val 4294907550 ecr 165951,nop,nop,sack 3 {37649:40545}{21721:36201}{17377:20273}], length 0
20:00:10.703042 IP 112.26.0.8.35128 > 112.26.0.1.34747: Flags [.], ack 13033, win 794, options [nop,nop,TS val 4294907550 ecr 165951,nop,nop,sack 3 {37649:40545}{21721:36201}{17377:20273}], length 0
20:00:10.784773 IP 112.26.0.1.34747 > 112.26.0.8.35128: Flags [.], seq 40545:41993, ack 1, win 1358, options [nop,nop,TS val 166721 ecr 4294906640], length 1448
20:00:10.785137 IP 112.26.0.8.35128 > 112.26.0.1.34747: Flags [.], ack 13033, win 817, options [nop,nop,TS val 4294907659 ecr 165951,nop,nop,sack 3 {37649:41993}{21721:36201}{17377:20273}], length 0
20:00:10.804706 IP 112.26.0.8.35128 > 112.26.0.1.34747: Flags [.], ack 13033, win 817, options [nop,nop,TS val 4294907659 ecr 165951,nop,nop,sack 3 {37649:41993}{21721:36201}{17377:20273}], length 0
20:00:10.814091 IP 112.26.0.1.34747 > 112.26.0.8.35128: Flags [.], seq 41993:43441, ack 1, win 1358, options [nop,nop,TS val 166734 ecr 4294906744], length 1448
20:00:10.814431 IP 112.26.0.8.35128 > 112.26.0.1.34747: Flags [.], ack 13033, win 839, options [nop,nop,TS val 4294907688 ecr 165951,nop,nop,sack 3 {37649:43441}{21721:36201}{17377:20273}], length 0
20:00:10.879124 IP 112.26.0.8.35128 > 112.26.0.1.34747: Flags [.], ack 13033, win 839, options [nop,nop,TS val 4294907688 ecr 165951,nop,nop,sack 3 {37649:43441}{21721:36201}{17377:20273}], length 0
20:00:10.974681 IP 112.26.0.1.34747 > 112.26.0.8.35128: Flags [.], seq 43441:44889, ack 1, win 1358, options [nop,nop,TS val 166879 ecr 4294906759], length 1448
20:00:10.975027 IP 112.26.0.8.35128 > 112.26.0.1.34747: Flags [.], ack 13033, win 862, options [nop,nop,TS val 4294907849 ecr 165951,nop,nop,sack 3 {37649:44889}{21721:36201}{17377:20273}], length 0
20:00:10.979358 IP 112.26.0.8.35128 > 112.26.0.1.34747: Flags [.], ack 13033, win 862, options [nop,nop,TS val 4294907849 ecr 165951,nop,nop,sack 3 {37649:44889}{21721:36201}{17377:20273}], length 0
20:00:10.998238 IP 112.26.0.1.34747 > 112.26.0.8.35128: Flags [.], seq 36201:37649, ack 1, win 1358, options [nop,nop,TS val 166964 ecr 4294906846], length 1448
20:00:10.998519 IP 112.26.0.8.35128 > 112.26.0.1.34747: Flags [.], ack 13033, win 885, options [nop,nop,TS val 4294907872 ecr 165951,nop,nop,sack 2 {21721:44889}{17377:20273}], length 0
20:00:11.004214 IP 112.26.0.8.35128 > 112.26.0.1.34747: Flags [.], ack 13033, win 885, options [nop,nop,TS val 4294907872 ecr 165951,nop,nop,sack 2 {21721:44889}{17377:20273}], length 0
20:00:11.071101 IP 112.26.0.1.34747 > 112.26.0.8.35128: Flags [.], seq 44889:46337, ack 1, win 1358, options [nop,nop,TS val 166964 ecr 4294906846], length 1448
20:00:11.071470 IP 112.26.0.8.35128 > 112.26.0.1.34747: Flags [.], ack 13033, win 907, options [nop,nop,TS val 4294907945 ecr 165951,nop,nop,sack 2 {21721:46337}{17377:20273}], length 0
20:00:11.079840 IP 112.26.0.8.35128 > 112.26.0.1.34747: Flags [.], ack 13033, win 907, options [nop,nop,TS val 4294907945 ecr 165951,nop,nop,sack 2 {21721:46337}{17377:20273}], length 0
20:00:11.283032 IP 112.26.0.1.34747 > 112.26.0.8.35128: Flags [.], seq 13033:14481, ack 1, win 1358, options [nop,nop,TS val 167546 ecr 4294907368], length 1448
20:00:11.283425 IP 112.26.0.8.35128 > 112.26.0.1.34747: Flags [.], ack 20273, win 930, options [nop,nop,TS val 4294908157 ecr 167546,nop,nop,sack 1 {21721:46337}], length 0
20:00:11.286479 IP 112.26.0.8.35128 > 112.26.0.1.34747: Flags [.], ack 20273, win 930, options [nop,nop,TS val 4294908157 ecr 167546,nop,nop,sack 1 {21721:46337}], length 0
20:00:11.393925 IP 112.26.0.1.34747 > 112.26.0.8.35128: Flags [.], seq 49233:50681, ack 1, win 1358, options [nop,nop,TS val 167637 ecr 4294907469], length 1448
20:00:11.394269 IP 112.26.0.8.35128 > 112.26.0.1.34747: Flags [.], ack 20273, win 953, options [nop,nop,TS val 4294908268 ecr 167546,nop,nop,sack 2 {49233:50681}{21721:46337}], length 0
20:00:11.398735 IP 112.26.0.8.35128 > 112.26.0.1.34747: Flags [.], ack 20273, win 953, options [nop,nop,TS val 4294908268 ecr 167546,nop,nop,sack 2 {49233:50681}{21721:46337}], length 0
20:00:11.486171 IP 112.26.0.1.34747 > 112.26.0.8.35128: Flags [.], seq 20273:21721, ack 1, win 1358, options [nop,nop,TS val 167658 ecr 4294907550], length 1448
20:00:11.486517 IP 112.26.0.8.35128 > 112.26.0.1.34747: Flags [.], ack 46337, win 975, options [nop,nop,TS val 4294908360 ecr 167658,nop,nop,sack 1 {49233:50681}], length 0
20:00:11.491205 IP 112.26.0.8.35128 > 112.26.0.1.34747: Flags [.], ack 46337, win 975, options [nop,nop,TS val 4294908360 ecr 167658,nop,nop,sack 1 {49233:50681}], length 0
20:00:11.584727 IP 112.26.0.1.34747 > 112.26.0.8.35128: Flags [.], seq 50681:52129, ack 1, win 1358, options [nop,nop,TS val 167728 ecr 4294907659], length 1448
20:00:11.585049 IP 112.26.0.8.35128 > 112.26.0.1.34747: Flags [.], ack 46337, win 998, options [nop,nop,TS val 4294908459 ecr 167658,nop,nop,sack 1 {49233:52129}], length 0
20:00:11.591110 IP 112.26.0.8.35128 > 112.26.0.1.34747: Flags [.], ack 46337, win 998, options [nop,nop,TS val 4294908459 ecr 167658,nop,nop,sack 1 {49233:52129}], length 0
20:00:11.606924 IP 112.26.0.1.34747 > 112.26.0.8.35128: Flags [.], seq 52129:53577, ack 1, win 1358, options [nop,nop,TS val 167740 ecr 4294907688], length 1448
20:00:11.607271 IP 112.26.0.8.35128 > 112.26.0.1.34747: Flags [.], ack 46337, win 1020, options [nop,nop,TS val 4294908481 ecr 167658,nop,nop,sack 1 {49233:53577}], length 0
20:00:11.675138 IP 112.26.0.8.35128 > 112.26.0.1.34747: Flags [.], ack 46337, win 1020, options [nop,nop,TS val 4294908481 ecr 167658,nop,nop,sack 1 {49233:53577}], length 0
20:00:11.682346 IP 112.26.0.1.34747 > 112.26.0.8.35128: Flags [.], seq 53577:55025, ack 1, win 1358, options [nop,nop,TS val 167750 ecr 4294907849], length 1448
20:00:11.682680 IP 112.26.0.8.35128 > 112.26.0.1.34747: Flags [.], ack 46337, win 1043, options [nop,nop,TS val 4294908557 ecr 167658,nop,nop,sack 1 {49233:55025}], length 0
20:00:11.694224 IP 112.26.0.8.35128 > 112.26.0.1.34747: Flags [.], ack 46337, win 1043, options [nop,nop,TS val 4294908557 ecr 167658,nop,nop,sack 1 {49233:55025}], length 0
20:00:11.780345 IP 112.26.0.1.34747 > 112.26.0.8.35128: Flags [.], seq 55025:56473, ack 1, win 1358, options [nop,nop,TS val 167932 ecr 4294907872], length 1448
20:00:11.780678 IP 112.26.0.8.35128 > 112.26.0.1.34747: Flags [.], ack 46337, win 1066, options [nop,nop,TS val 4294908654 ecr 167658,nop,nop,sack 1 {49233:56473}], length 0
20:00:11.784918 IP 112.26.0.8.35128 > 112.26.0.1.34747: Flags [.], ack 46337, win 1066, options [nop,nop,TS val 4294908654 ecr 167658,nop,nop,sack 1 {49233:56473}], length 0
20:00:11.803681 IP 112.26.0.1.34747 > 112.26.0.8.35128: Flags [.], seq 56473:57921, ack 1, win 1358, options [nop,nop,TS val 167942 ecr 4294907945], length 1448
20:00:11.804024 IP 112.26.0.8.35128 > 112.26.0.1.34747: Flags [.], ack 46337, win 1088, options [nop,nop,TS val 4294908678 ecr 167658,nop,nop,sack 1 {49233:57921}], length 0
20:00:11.880865 IP 112.26.0.8.35128 > 112.26.0.1.34747: Flags [.], ack 46337, win 1088, options [nop,nop,TS val 4294908678 ecr 167658,nop,nop,sack 1 {49233:57921}], length 0
20:00:12.089445 IP 112.26.0.1.34747 > 112.26.0.8.35128: Flags [.], seq 46337:47785, ack 1, win 1358, options [nop,nop,TS val 168255 ecr 4294908157], length 1448
20:00:12.089880 IP 112.26.0.8.35128 > 112.26.0.1.34747: Flags [.], ack 47785, win 1111, options [nop,nop,TS val 4294908963 ecr 168255,nop,nop,sack 1 {49233:57921}], length 0
20:00:12.175305 IP 112.26.0.8.35128 > 112.26.0.1.34747: Flags [.], ack 47785, win 1111, options [nop,nop,TS val 4294908963 ecr 168255,nop,nop,sack 1 {49233:57921}], length 0
20:00:12.192380 IP 112.26.0.1.34747 > 112.26.0.8.35128: Flags [.], seq 47785:49233, ack 1, win 1358, options [nop,nop,TS val 168255 ecr 4294908157], length 1448
20:00:12.192776 IP 112.26.0.8.35128 > 112.26.0.1.34747: Flags [.], ack 57921, win 1134, options [nop,nop,TS val 4294909066 ecr 168255], length 0
20:00:12.195453 IP 112.26.0.8.35128 > 112.26.0.1.34747: Flags [.], ack 57921, win 1134, options [nop,nop,TS val 4294909066 ecr 168255], length 0
20:00:12.298984 IP 112.26.0.1.34747 > 112.26.0.8.35128: Flags [.], seq 57921:59369, ack 1, win 1358, options [nop,nop,TS val 168450 ecr 4294908268], length 1448
20:00:12.299239 IP 112.26.0.8.35128 > 112.26.0.1.34747: Flags [.], ack 59369, win 1156, options [nop,nop,TS val 4294909173 ecr 168450], length 0
20:00:12.375361 IP 112.26.0.8.35128 > 112.26.0.1.34747: Flags [.], ack 59369, win 1156, options [nop,nop,TS val 4294909173 ecr 168450], length 0
20:00:12.398203 IP 112.26.0.1.34747 > 112.26.0.8.35128: Flags [.], seq 59369:60817, ack 1, win 1358, options [nop,nop,TS val 168464 ecr 4294908360], length 1448
20:00:12.398541 IP 112.26.0.8.35128 > 112.26.0.1.34747: Flags [.], ack 60817, win 1179, options [nop,nop,TS val 4294909273 ecr 168464], length 0
20:00:12.402686 IP 112.26.0.8.35128 > 112.26.0.1.34747: Flags [.], ack 60817, win 1179, options [nop,nop,TS val 4294909273 ecr 168464], length 0
20:00:12.495861 IP 112.26.0.1.34747 > 112.26.0.8.35128: Flags [.], seq 60817:62265, ack 1, win 1358, options [nop,nop,TS val 168546 ecr 4294908481], length 1448
20:00:12.496148 IP 112.26.0.8.35128 > 112.26.0.1.34747: Flags [.], ack 62265, win 1201, options [nop,nop,TS val 4294909370 ecr 168546], length 0
20:00:12.514056 IP 112.26.0.8.35128 > 112.26.0.1.34747: Flags [.], ack 62265, win 1201, options [nop,nop,TS val 4294909370 ecr 168546], length 0
20:00:12.574840 IP 112.26.0.1.34747 > 112.26.0.8.35128: Flags [.], seq 62265:63713, ack 1, win 1358, options [nop,nop,TS val 168635 ecr 4294908557], length 1448
20:00:12.575145 IP 112.26.0.8.35128 > 112.26.0.1.34747: Flags [.], ack 63713, win 1224, options [nop,nop,TS val 4294909449 ecr 168635], length 0
20:00:12.601571 IP 112.26.0.8.35128 > 112.26.0.1.34747: Flags [.], ack 63713, win 1224, options [nop,nop,TS val 4294909449 ecr 168635], length 0
20:00:12.678334 IP 112.26.0.1.34747 > 112.26.0.8.35128: Flags [.], seq 63713:65161, ack 1, win 1358, options [nop,nop,TS val 168841 ecr 4294908654], length 1448
20:00:12.678580 IP 112.26.0.8.35128 > 112.26.0.1.34747: Flags [.], ack 65161, win 1247, options [nop,nop,TS val 4294909552 ecr 168841], length 0
20:00:12.685883 IP 112.26.0.8.35128 > 112.26.0.1.34747: Flags [.], ack 65161, win 1247, options [nop,nop,TS val 4294909552 ecr 168841], length 0
20:00:12.779582 IP 112.26.0.1.34747 > 112.26.0.8.35128: Flags [.], seq 65161:66609, ack 1, win 1358, options [nop,nop,TS val 168850 ecr 4294908678], length 1448
20:00:12.779909 IP 112.26.0.8.35128 > 112.26.0.1.34747: Flags [.], ack 66609, win 1269, options [nop,nop,TS val 4294909653 ecr 168850], length 0
20:00:12.807010 IP 112.26.0.8.35128 > 112.26.0.1.34747: Flags [.], ack 66609, win 1269, options [nop,nop,TS val 4294909653 ecr 168850], length 0
20:00:13.010873 IP 112.26.0.1.34747 > 112.26.0.8.35128: Flags [.], seq 66609:68057, ack 1, win 1358, options [nop,nop,TS val 169145 ecr 4294908963], length 1448
20:00:13.011182 IP 112.26.0.8.35128 > 112.26.0.1.34747: Flags [.], ack 68057, win 1292, options [nop,nop,TS val 4294909885 ecr 169145], length 0
20:00:13.090985 IP 112.26.0.8.35128 > 112.26.0.1.34747: Flags [.], ack 68057, win 1292, options [nop,nop,TS val 4294909885 ecr 169145], length 0
20:00:13.113516 IP 112.26.0.1.34747 > 112.26.0.8.35128: Flags [.], seq 68057:69505, ack 1, win 1358, options [nop,nop,TS val 169171 ecr 4294909066], length 1448
20:00:13.113869 IP 112.26.0.8.35128 > 112.26.0.1.34747: Flags [.], ack 69505, win 1315, options [nop,nop,TS val 4294909988 ecr 169171], length 0
20:00:13.197715 IP 112.26.0.8.35128 > 112.26.0.1.34747: Flags [.], ack 69505, win 1315, options [nop,nop,TS val 4294909988 ecr 169171], length 0
20:00:13.290785 IP 112.26.0.1.34747 > 112.26.0.8.35128: Flags [.], seq 69505:70953, ack 1, win 1358, options [nop,nop,TS val 169259 ecr 4294909173], length 1448
20:00:13.291099 IP 112.26.0.8.35128 > 112.26.0.1.34747: Flags [.], ack 70953, win 1337, options [nop,nop,TS val 4294910165 ecr 169259], length 0
20:00:13.388930 IP 112.26.0.8.35128 > 112.26.0.1.34747: Flags [.], ack 70953, win 1337, options [nop,nop,TS val 4294910165 ecr 169259], length 0
20:00:13.403331 IP 112.26.0.1.34747 > 112.26.0.8.35128: Flags [.], seq 70953:72401, ack 1, win 1358, options [nop,nop,TS val 169371 ecr 4294909273], length 1448
20:00:13.403665 IP 112.26.0.8.35128 > 112.26.0.1.34747: Flags [.], ack 72401, win 1360, options [nop,nop,TS val 4294910277 ecr 169371], length 0
20:00:13.495721 IP 112.26.0.1.34747 > 112.26.0.8.35128: Flags [.], seq 72401:73849, ack 1, win 1358, options [nop,nop,TS val 169464 ecr 4294909653], length 1448
20:00:13.496073 IP 112.26.0.8.35128 > 112.26.0.1.34747: Flags [.], ack 73849, win 1382, options [nop,nop,TS val 4294910370 ecr 169464], length 0
20:00:13.518804 IP 112.26.0.1.34747 > 112.26.0.8.35128: Flags [.], seq 73849:75297, ack 1, win 1358, options [nop,nop,TS val 169464 ecr 4294909653], length 1448
20:00:13.519168 IP 112.26.0.8.35128 > 112.26.0.1.34747: Flags [.], ack 75297, win 1405, options [nop,nop,TS val 4294910393 ecr 169464], length 0
20:00:13.595629 IP 112.26.0.8.35128 > 112.26.0.1.34747: Flags [.], ack 72401, win 1360, options [nop,nop,TS val 4294910277 ecr 169371], length 0
20:00:13.687824 IP 112.26.0.8.35128 > 112.26.0.1.34747: Flags [.], ack 73849, win 1382, options [nop,nop,TS val 4294910370 ecr 169464], length 0
20:00:13.711007 IP 112.26.0.1.34747 > 112.26.0.8.35128: Flags [.], seq 75297:76745, ack 1, win 1358, options [nop,nop,TS val 169465 ecr 4294909653], length 1448
20:00:13.711364 IP 112.26.0.8.35128 > 112.26.0.1.34747: Flags [.], ack 76745, win 1424, options [nop,nop,TS val 4294910585 ecr 169465], length 0
20:00:13.725781 IP 112.26.0.8.35128 > 112.26.0.1.34747: Flags [.], ack 75297, win 1405, options [nop,nop,TS val 4294910393 ecr 169464], length 0
20:00:13.799535 IP 112.26.0.1.34747 > 112.26.0.8.35128: Flags [.], seq 76745:78193, ack 1, win 1358, options [nop,nop,TS val 169465 ecr 4294909653], length 1448
20:00:13.799873 IP 112.26.0.8.35128 > 112.26.0.1.34747: Flags [.], ack 78193, win 1424, options [nop,nop,TS val 4294910673 ecr 169465], length 0
20:00:13.814827 IP 112.26.0.1.34747 > 112.26.0.8.35128: Flags [.], seq 78193:79641, ack 1, win 1358, options [nop,nop,TS val 169465 ecr 4294909653], length 1448
20:00:13.815195 IP 112.26.0.8.35128 > 112.26.0.1.34747: Flags [.], ack 79641, win 1424, options [nop,nop,TS val 4294910689 ecr 169465], length 0
20:00:13.909289 IP 112.26.0.8.35128 > 112.26.0.1.34747: Flags [.], ack 76745, win 1424, options [nop,nop,TS val 4294910585 ecr 169465], length 0
20:00:14.002362 IP 112.26.0.1.34747 > 112.26.0.8.35128: Flags [.], seq 79641:81089, ack 1, win 1358, options [nop,nop,TS val 169651 ecr 4294909885], length 1448
20:00:14.002720 IP 112.26.0.8.35128 > 112.26.0.1.34747: Flags [.], ack 81089, win 1424, options [nop,nop,TS val 4294910876 ecr 169651], length 0
20:00:14.085580 IP 112.26.0.8.35128 > 112.26.0.1.34747: Flags [.], ack 78193, win 1424, options [nop,nop,TS val 4294910673 ecr 169465], length 0
20:00:14.109301 IP 112.26.0.8.35128 > 112.26.0.1.34747: Flags [.], ack 79641, win 1424, options [nop,nop,TS val 4294910689 ecr 169465], length 0
20:00:14.193753 IP 112.26.0.1.34747 > 112.26.0.8.35128: Flags [.], seq 82537:83985, ack 1, win 1358, options [nop,nop,TS val 169959 ecr 4294910165], length 1448
20:00:14.194112 IP 112.26.0.8.35128 > 112.26.0.1.34747: Flags [.], ack 81089, win 1424, options [nop,nop,TS val 4294911067 ecr 169651,nop,nop,sack 1 {82537:83985}], length 0
20:00:14.211633 IP 112.26.0.1.34747 > 112.26.0.8.35128: Flags [.], seq 83985:85433, ack 1, win 1358, options [nop,nop,TS val 170155 ecr 4294910277], length 1448
20:00:14.211996 IP 112.26.0.8.35128 > 112.26.0.1.34747: Flags [.], ack 81089, win 1424, options [nop,nop,TS val 4294911085 ecr 169651,nop,nop,sack 1 {82537:85433}], length 0
20:00:14.308639 IP 112.26.0.1.34747 > 112.26.0.8.35128: Flags [.], seq 85433:86881, ack 1, win 1358, options [nop,nop,TS val 170249 ecr 4294910370], length 1448
20:00:14.308955 IP 112.26.0.8.35128 > 112.26.0.1.34747: Flags [.], ack 81089, win 1424, options [nop,nop,TS val 4294911182 ecr 169651,nop,nop,sack 1 {82537:86881}], length 0
20:00:14.396768 IP 112.26.0.8.35128 > 112.26.0.1.34747: Flags [.], ack 81089, win 1424, options [nop,nop,TS val 4294910876 ecr 169651], length 0
20:00:14.412994 IP 112.26.0.1.34747 > 112.26.0.8.35128: Flags [.], seq 86881:88329, ack 1, win 1358, options [nop,nop,TS val 170285 ecr 4294910393], length 1448
20:00:14.413271 IP 112.26.0.8.35128 > 112.26.0.1.34747: Flags [.], ack 81089, win 1424, options [nop,nop,TS val 4294911287 ecr 169651,nop,nop,sack 1 {82537:88329}], length 0
20:00:14.499853 IP 112.26.0.1.34747 > 112.26.0.8.35128: Flags [.], seq 88329:89777, ack 1, win 1358, options [nop,nop,TS val 170469 ecr 4294910585], length 1448
20:00:14.500215 IP 112.26.0.8.35128 > 112.26.0.1.34747: Flags [.], ack 81089, win 1424, options [nop,nop,TS val 4294911374 ecr 169651,nop,nop,sack 1 {82537:89777}], length 0
20:00:14.510168 IP 112.26.0.1.34747 > 112.26.0.8.35128: Flags [.], seq 89777:91225, ack 1, win 1358, options [nop,nop,TS val 170469 ecr 4294910585], length 1448
20:00:14.510476 IP 112.26.0.8.35128 > 112.26.0.1.34747: Flags [.], ack 81089, win 1424, options [nop,nop,TS val 4294911384 ecr 169651,nop,nop,sack 1 {82537:91225}], length 0
20:00:14.601159 IP 112.26.0.8.35128 > 112.26.0.1.34747: Flags [.], ack 81089, win 1424, options [nop,nop,TS val 4294911067 ecr 169651,nop,nop,sack 1 {82537:83985}], length 0
20:00:14.702155 IP 112.26.0.8.35128 > 112.26.0.1.34747: Flags [.], ack 81089, win 1424, options [nop,nop,TS val 4294911085 ecr 169651,nop,nop,sack 1 {82537:85433}], length 0
20:00:14.718399 IP 112.26.0.1.34747 > 112.26.0.8.35128: Flags [.], seq 91225:92673, ack 1, win 1358, options [nop,nop,TS val 170646 ecr 4294910673], length 1448
20:00:14.718695 IP 112.26.0.8.35128 > 112.26.0.1.34747: Flags [.], ack 81089, win 1424, options [nop,nop,TS val 4294911593 ecr 169651,nop,nop,sack 1 {82537:92673}], length 0
20:00:14.799891 IP 112.26.0.1.34747 > 112.26.0.8.35128: Flags [.], seq 92673:94121, ack 1, win 1358, options [nop,nop,TS val 170669 ecr 4294910689], length 1448
20:00:14.800263 IP 112.26.0.8.35128 > 112.26.0.1.34747: Flags [.], ack 81089, win 1424, options [nop,nop,TS val 4294911674 ecr 169651,nop,nop,sack 1 {82537:94121}], length 0
20:00:14.809778 IP 112.26.0.8.35128 > 112.26.0.1.34747: Flags [.], ack 81089, win 1424, options [nop,nop,TS val 4294911182 ecr 169651,nop,nop,sack 1 {82537:86881}], length 0
20:00:14.903846 IP 112.26.0.1.34747 > 112.26.0.8.35128: Flags [.], seq 94121:95569, ack 1, win 1358, options [nop,nop,TS val 170958 ecr 4294910876], length 1448
20:00:14.904207 IP 112.26.0.8.35128 > 112.26.0.1.34747: Flags [.], ack 81089, win 1424, options [nop,nop,TS val 4294911778 ecr 169651,nop,nop,sack 1 {82537:95569}], length 0
20:00:14.992936 IP 112.26.0.8.35128 > 112.26.0.1.34747: Flags [.], ack 81089, win 1424, options [nop,nop,TS val 4294911374 ecr 169651,nop,nop,sack 1 {82537:89777}], length 0
20:00:15.009885 IP 112.26.0.8.35128 > 112.26.0.1.34747: Flags [.], ack 81089, win 1424, options [nop,nop,TS val 4294911384 ecr 169651,nop,nop,sack 1 {82537:91225}], length 0
20:00:15.028361 IP 112.26.0.1.34747 > 112.26.0.8.35128: Flags [.], seq 95569:97017, ack 1, win 1358, options [nop,nop,TS val 171161 ecr 4294911067], length 1448
20:00:15.028660 IP 112.26.0.8.35128 > 112.26.0.1.34747: Flags [.], ack 81089, win 1424, options [nop,nop,TS val 4294911902 ecr 169651,nop,nop,sack 1 {82537:97017}], length 0
20:00:15.111398 IP 112.26.0.1.34747 > 112.26.0.8.35128: Flags [.], seq 97017:98465, ack 1, win 1358, options [nop,nop,TS val 171263 ecr 4294911085], length 1448
20:00:15.111694 IP 112.26.0.8.35128 > 112.26.0.1.34747: Flags [.], ack 81089, win 1424, options [nop,nop,TS val 4294911985 ecr 169651,nop,nop,sack 1 {82537:98465}], length 0
20:00:15.206650 IP 112.26.0.8.35128 > 112.26.0.1.34747: Flags [.], ack 81089, win 1424, options [nop,nop,TS val 4294911593 ecr 169651,nop,nop,sack 1 {82537:92673}], length 0
20:00:15.224835 IP 112.26.0.8.35128 > 112.26.0.1.34747: Flags [.], ack 81089, win 1424, options [nop,nop,TS val 4294911674 ecr 169651,nop,nop,sack 1 {82537:94121}], length 0
20:00:15.247768 IP 112.26.0.1.34747 > 112.26.0.8.35128: Flags [.], seq 81089:82537, ack 1, win 1358, options [nop,nop,TS val 171370 ecr 4294911182], length 1448
20:00:15.248181 IP 112.26.0.8.35128 > 112.26.0.1.34747: Flags [.], ack 98465, win 1341, options [nop,nop,TS val 4294912122 ecr 171370], length 0
20:00:15.320609 IP 112.26.0.8.35128 > 112.26.0.1.34747: Flags [.], ack 81089, win 1424, options [nop,nop,TS val 4294911778 ecr 169651,nop,nop,sack 1 {82537:95569}], length 0
20:00:15.408478 IP 112.26.0.1.34747 > 112.26.0.8.35128: Flags [.], seq 98465:99913, ack 1, win 1358, options [nop,nop,TS val 171570 ecr 4294911384], length 1448
20:00:15.408768 IP 112.26.0.8.35128 > 112.26.0.1.34747: Flags [.], ack 99913, win 1424, options [nop,nop,TS val 4294912282 ecr 171570], length 0
20:00:15.424843 IP 112.26.0.8.35128 > 112.26.0.1.34747: Flags [.], ack 81089, win 1424, options [nop,nop,TS val 4294911902 ecr 169651,nop,nop,sack 1 {82537:97017}], length 0
20:00:15.517560 IP 112.26.0.8.35128 > 112.26.0.1.34747: Flags [.], ack 81089, win 1424, options [nop,nop,TS val 4294911985 ecr 169651,nop,nop,sack 1 {82537:98465}], length 0
20:00:15.632778 IP 112.26.0.1.34747 > 112.26.0.8.35128: Flags [.], seq 99913:101361, ack 1, win 1358, options [nop,nop,TS val 171790 ecr 4294911593], length 1448
20:00:15.633150 IP 112.26.0.8.35128 > 112.26.0.1.34747: Flags [.], ack 101361, win 1424, options [nop,nop,TS val 4294912507 ecr 171790], length 0
20:00:15.698994 IP 112.26.0.8.35128 > 112.26.0.1.34747: Flags [.], ack 98465, win 1341, options [nop,nop,TS val 4294912122 ecr 171370], length 0
20:00:15.732889 IP 112.26.0.1.34747 > 112.26.0.8.35128: Flags [.], seq 101361:102809, ack 1, win 1358, options [nop,nop,TS val 171886 ecr 4294911674], length 1448
20:00:15.733221 IP 112.26.0.8.35128 > 112.26.0.1.34747: Flags [.], ack 102809, win 1424, options [nop,nop,TS val 4294912607 ecr 171886], length 0
20:00:15.900392 IP 112.26.0.8.35128 > 112.26.0.1.34747: Flags [.], ack 99913, win 1424, options [nop,nop,TS val 4294912282 ecr 171570], length 0
20:00:15.918609 IP 112.26.0.1.34747 > 112.26.0.8.35128: Flags [.], seq 102809:104257, ack 1, win 1358, options [nop,nop,TS val 172059 ecr 4294911778], length 1448
20:00:15.918976 IP 112.26.0.8.35128 > 112.26.0.1.34747: Flags [.], ack 104257, win 1424, options [nop,nop,TS val 4294912793 ecr 172059], length 0
20:00:16.005702 IP 112.26.0.8.35128 > 112.26.0.1.34747: Flags [.], ack 101361, win 1424, options [nop,nop,TS val 4294912507 ecr 171790], length 0
20:00:16.099441 IP 112.26.0.1.34747 > 112.26.0.8.35128: Flags [.], seq 104257:105705, ack 1, win 1358, options [nop,nop,TS val 172198 ecr 4294911902], length 1448
20:00:16.099822 IP 112.26.0.8.35128 > 112.26.0.1.34747: Flags [.], ack 105705, win 1424, options [nop,nop,TS val 4294912974 ecr 172198], length 0
20:00:16.119281 IP 112.26.0.1.34747 > 112.26.0.8.35128: Flags [.], seq 105705:107153, ack 1, win 1358, options [nop,nop,TS val 172276 ecr 4294911985], length 1448
20:00:16.119631 IP 112.26.0.8.35128 > 112.26.0.1.34747: Flags [.], ack 107153, win 1424, options [nop,nop,TS val 4294912994 ecr 172276], length 0
20:00:16.212471 IP 112.26.0.8.35128 > 112.26.0.1.34747: Flags [.], ack 102809, win 1424, options [nop,nop,TS val 4294912607 ecr 171886], length 0
20:00:16.301408 IP 112.26.0.1.34747 > 112.26.0.8.35128: Flags [.], seq 107153:108601, ack 1, win 1358, options [nop,nop,TS val 172378 ecr 4294912122], length 1448
20:00:16.301766 IP 112.26.0.8.35128 > 112.26.0.1.34747: Flags [.], ack 108601, win 1424, options [nop,nop,TS val 4294913176 ecr 172378], length 0
20:00:16.313129 IP 112.26.0.8.35128 > 112.26.0.1.34747: Flags [.], ack 104257, win 1424, options [nop,nop,TS val 4294912793 ecr 172059], length 0
20:00:16.330922 IP 112.26.0.1.34747 > 112.26.0.8.35128: Flags [.], seq 108601:110049, ack 1, win 1358, options [nop,nop,TS val 172466 ecr 4294912282], length 1448
20:00:16.331255 IP 112.26.0.8.35128 > 112.26.0.1.34747: Flags [.], ack 110049, win 1424, options [nop,nop,TS val 4294913205 ecr 172466], length 0
20:00:16.406991 IP 112.26.0.1.34747 > 112.26.0.8.35128: Flags [.], seq 110049:111497, ack 1, win 1358, options [nop,nop,TS val 172565 ecr 4294912507], length 1448
20:00:16.407357 IP 112.26.0.8.35128 > 112.26.0.1.34747: Flags [.], ack 111497, win 1424, options [nop,nop,TS val 4294913281 ecr 172565], length 0
20:00:16.416280 IP 112.26.0.8.35128 > 112.26.0.1.34747: Flags [.], ack 105705, win 1424, options [nop,nop,TS val 4294912974 ecr 172198], length 0
20:00:16.510081 IP 112.26.0.8.35128 > 112.26.0.1.34747: Flags [.], ack 107153, win 1424, options [nop,nop,TS val 4294912994 ecr 172276], length 0
20:00:16.531069 IP 112.26.0.1.34747 > 112.26.0.8.35128: Flags [.], seq 111497:112945, ack 1, win 1358, options [nop,nop,TS val 172565 ecr 4294912507], length 1448
20:00:16.531316 IP 112.26.0.8.35128 > 112.26.0.1.34747: Flags [.], ack 112945, win 1424, options [nop,nop,TS val 4294913405 ecr 172565], length 0
20:00:16.603697 IP 112.26.0.1.34747 > 112.26.0.8.35128: Flags [.], seq 112945:114393, ack 1, win 1358, options [nop,nop,TS val 172772 ecr 4294912607], length 1448
20:00:16.604049 IP 112.26.0.8.35128 > 112.26.0.1.34747: Flags [.], ack 114393, win 1424, options [nop,nop,TS val 4294913478 ecr 172772], length 0
20:00:16.625000 IP 112.26.0.8.35128 > 112.26.0.1.34747: Flags [.], ack 108601, win 1424, options [nop,nop,TS val 4294913176 ecr 172378], length 0
20:00:16.705211 IP 112.26.0.1.34747 > 112.26.0.8.35128: Flags [.], seq 114393:115841, ack 1, win 1358, options [nop,nop,TS val 172873 ecr 4294912793], length 1448
20:00:16.705560 IP 112.26.0.8.35128 > 112.26.0.1.34747: Flags [.], ack 115841, win 1424, options [nop,nop,TS val 4294913579 ecr 172873], length 0
20:00:16.734846 IP 112.26.0.8.35128 > 112.26.0.1.34747: Flags [.], ack 110049, win 1424, options [nop,nop,TS val 4294913205 ecr 172466], length 0
20:00:16.812947 IP 112.26.0.8.35128 > 112.26.0.1.34747: Flags [.], ack 111497, win 1424, options [nop,nop,TS val 4294913281 ecr 172565], length 0
20:00:16.831490 IP 112.26.0.1.34747 > 112.26.0.8.35128: Flags [.], seq 115841:117289, ack 1, win 1358, options [nop,nop,TS val 172976 ecr 4294912974], length 1448
20:00:16.831789 IP 112.26.0.8.35128 > 112.26.0.1.34747: Flags [.], ack 117289, win 1424, options [nop,nop,TS val 4294913705 ecr 172976], length 0
