17:16:35.756629 IP 112.26.0.8.57542 > 112.26.0.1.36177: Flags [S], seq 3938161819, win 65535, options [mss 1460,sackOK,TS val 3060063 ecr 0,nop,wscale 6,mptcp capable csum {0x3ec122e68ac9ec11}], length 0
17:16:35.757068 IP 112.26.0.1.36177 > 112.26.0.8.57542: Flags [S.], seq 1781188362, ack 3938161820, win 65535, options [mss 1460,sackOK,TS val 3280156 ecr 3060063,nop,wscale 6,mptcp capable csum {0x5d07cc395fa8dd93}], length 0
17:16:35.779305 IP 112.26.0.1.36177 > 112.26.0.8.57542: Flags [S.], seq 1781188362, ack 3938161820, win 65535, options [mss 1460,sackOK,TS val 3280156 ecr 3060063,nop,wscale 6,mptcp capable csum {0x5d07cc395fa8dd93}], length 0
17:16:35.786925 IP 112.26.0.8.57542 > 112.26.0.1.36177: Flags [.], ack 1, win 1369, options [nop,nop,TS val 3060180 ecr 3280156,mptcp capable csum {0x3ec122e68ac9ec11,0x5d07cc395fa8dd93},mptcp dss ack 1489178716], length 0
17:16:35.787211 IP 112.26.0.1.36177 > 112.26.0.8.57542: Flags [.], ack 1, win 1339, options [nop,nop,TS val 3280187 ecr 3060180,mptcp add-addr id 3 112.26.1.1,mptcp dss ack 4086075562], length 0
17:16:35.787248 IP 112.26.0.1.36177 > 112.26.0.8.57542: Flags [.], ack 1, win 1339, options [nop,nop,TS val 3280187 ecr 3060180,mptcp add-addr id 5 112.26.3.1,mptcp dss ack 4086075562], length 0
17:16:35.787273 IP 112.26.0.1.36177 > 112.26.0.8.57542: Flags [.], ack 1, win 1339, options [nop,nop,TS val 3280187 ecr 3060180,mptcp add-addr id 6 112.26.2.1,mptcp dss ack 4086075562], length 0
17:16:35.793394 IP 112.26.0.1.36177 > 112.26.0.8.57542: Flags [.], seq 1:1429, ack 1, win 1339, options [nop,nop,TS val 3280193 ecr 3060180,mptcp dss ack 4086075562 seq 1489178716 subseq 1 len 1428 csum 0x3694], length 1428
17:16:35.793510 IP 112.26.0.1.36177 > 112.26.0.8.57542: Flags [.], seq 1429:2857, ack 1, win 1339, options [nop,nop,TS val 3280193 ecr 3060180,mptcp dss ack 4086075562 seq 1489180144 subseq 1429 len 1428 csum 0x55e2], length 1428
17:16:35.793646 IP 112.26.0.1.36177 > 112.26.0.8.57542: Flags [P.], seq 2857:4097, ack 1, win 1339, options [nop,nop,TS val 3280194 ecr 3060180,mptcp dss ack 4086075562 seq 1489181572 subseq 2857 len 1240 csum 0x96b4], length 1240
17:16:35.793742 IP 112.26.0.1.36177 > 112.26.0.8.57542: Flags [.], seq 4097:5525, ack 1, win 1339, options [nop,nop,TS val 3280194 ecr 3060180,mptcp dss ack 4086075562 seq 1489182812 subseq 4097 len 1428 csum 0x8aed], length 1428
17:16:35.793822 IP 112.26.0.1.36177 > 112.26.0.8.57542: Flags [.], seq 5525:6953, ack 1, win 1339, options [nop,nop,TS val 3280194 ecr 3060180,mptcp dss ack 4086075562 seq 1489184240 subseq 5525 len 1428 csum 0xe762], length 1428
17:16:35.793911 IP 112.26.0.1.36177 > 112.26.0.8.57542: Flags [.], seq 6953:8381, ack 1, win 1339, options [nop,nop,TS val 3280194 ecr 3060180,mptcp dss ack 4086075562 seq 1489185668 subseq 6953 len 1428 csum 0x812f], length 1428
17:16:35.793993 IP 112.26.0.1.36177 > 112.26.0.8.57542: Flags [.], seq 8381:9809, ack 1, win 1339, options [nop,nop,TS val 3280194 ecr 3060180,mptcp dss ack 4086075562 seq 1489187096 subseq 8381 len 1428 csum 0x50c1], length 1428
17:16:35.794074 IP 112.26.0.1.36177 > 112.26.0.8.57542: Flags [.], seq 9809:11237, ack 1, win 1339, options [nop,nop,TS val 3280194 ecr 3060180,mptcp dss ack 4086075562 seq 1489188524 subseq 9809 len 1428 csum 0x492d], length 1428
17:16:35.794165 IP 112.26.0.1.36177 > 112.26.0.8.57542: Flags [.], seq 11237:12665, ack 1, win 1339, options [nop,nop,TS val 3280194 ecr 3060180,mptcp dss ack 4086075562 seq 1489189952 subseq 11237 len 1428 csum 0x78b3], length 1428
17:16:35.794246 IP 112.26.0.1.36177 > 112.26.0.8.57542: Flags [.], seq 12665:14093, ack 1, win 1339, options [nop,nop,TS val 3280194 ecr 3060180,mptcp dss ack 4086075562 seq 1489191380 subseq 12665 len 1428 csum 0xbab0], length 1428
17:16:35.820194 IP 112.26.0.1.36177 > 112.26.0.8.57542: Flags [.], ack 1, win 1339, options [nop,nop,TS val 3280187 ecr 3060180,mptcp add-addr id 3 112.26.1.1,mptcp dss ack 4086075562], length 0
17:16:35.856831 IP 112.26.0.1.36177 > 112.26.0.8.57542: Flags [.], seq 12665:14093, ack 1, win 1339, options [nop,nop,TS val 3280257 ecr 3060180,mptcp dss ack 4086075562 seq 1489191380 subseq 12665 len 1428 csum 0xbab0], length 1428
17:16:35.870697 IP 112.26.0.8.57542 > 112.26.0.1.36177: Flags [.], ack 1, win 1369, options [nop,nop,TS val 3060180 ecr 3280156,mptcp add-addr id 3 112.26.1.8,mptcp dss ack 1489178716], length 0
17:16:35.904856 IP 112.26.0.8.57542 > 112.26.0.1.36177: Flags [.], ack 1, win 1369, options [nop,nop,TS val 3060180 ecr 3280156,mptcp add-addr id 4 112.26.2.8,mptcp dss ack 1489178716], length 0
17:16:35.966599 IP 112.26.0.1.36177 > 112.26.0.8.57542: Flags [.], ack 1, win 1339, options [nop,nop,TS val 3280187 ecr 3060180,mptcp add-addr id 5 112.26.3.1,mptcp dss ack 4086075562], length 0
17:16:35.997144 IP 112.26.0.8.57542 > 112.26.0.1.36177: Flags [.], ack 1, win 1369, options [nop,nop,TS val 3060180 ecr 3280156,mptcp add-addr id 6 112.26.3.8,mptcp dss ack 1489178716], length 0
17:16:36.074020 IP 112.26.0.1.36177 > 112.26.0.8.57542: Flags [.], ack 1, win 1339, options [nop,nop,TS val 3280187 ecr 3060180,mptcp add-addr id 6 112.26.2.1,mptcp dss ack 4086075562], length 0
17:16:36.256792 IP 112.26.0.1.36177 > 112.26.0.8.57542: Flags [.], seq 1:1429, ack 1, win 1339, options [nop,nop,TS val 3280193 ecr 3060180,mptcp dss ack 4086075562 seq 1489178716 subseq 1 len 1428 csum 0x3694], length 1428
17:16:36.283785 IP 112.26.0.8.57542 > 112.26.0.1.36177: Flags [.], ack 1429, win 1415, options [nop,nop,TS val 3060658 ecr 3280193,mptcp dss ack 1489180144], length 0
17:16:36.284080 IP 112.26.0.1.36177 > 112.26.0.8.57542: Flags [.], seq 14093:15521, ack 1, win 1339, options [nop,nop,TS val 3280684 ecr 3060658,mptcp dss ack 4086075562 seq 1489192808 subseq 14093 len 1428 csum 0xd4a], length 1428
17:16:36.293783 IP 112.26.0.1.36177 > 112.26.0.8.57542: Flags [.], seq 1429:2857, ack 1, win 1339, options [nop,nop,TS val 3280193 ecr 3060180,mptcp dss ack 4086075562 seq 1489180144 subseq 1429 len 1428 csum 0x55e2], length 1428
17:16:36.362758 IP 112.26.0.8.57542 > 112.26.0.1.36177: Flags [.], ack 2857, win 1460, options [nop,nop,TS val 3060701 ecr 3280193,mptcp dss ack 1489181572], length 0
17:16:36.363085 IP 112.26.0.1.36177 > 112.26.0.8.57542: Flags [.], seq 15521:16949, ack 1, win 1339, options [nop,nop,TS val 3280763 ecr 3060701,mptcp dss ack 4086075562 seq 1489194236 subseq 15521 len 1428 csum 0x78a5], length 1428
17:16:36.374023 IP 112.26.0.1.36177 > 112.26.0.8.57542: Flags [P.], seq 2857:4097, ack 1, win 1339, options [nop,nop,TS val 3280194 ecr 3060180,mptcp dss ack 4086075562 seq 1489181572 subseq 2857 len 1240 csum 0x96b4], length 1240
17:16:36.399363 IP 112.26.0.8.57542 > 112.26.0.1.36177: Flags [.], ack 4097, win 1506, options [nop,nop,TS val 3060778 ecr 3280194,mptcp dss ack 1489182812], length 0
17:16:36.399602 IP 112.26.0.1.36177 > 112.26.0.8.57542: Flags [.], seq 16949:18377, ack 1, win 1339, options [nop,nop,TS val 3280799 ecr 3060778,mptcp dss ack 4086075562 seq 1489195664 subseq 16949 len 1428 csum 0x61f9], length 1428
17:16:36.462157 IP 112.26.0.1.36177 > 112.26.0.8.57542: Flags [.], seq 4097:5525, ack 1, win 1339, options [nop,nop,TS val 3280194 ecr 3060180,mptcp dss ack 4086075562 seq 1489182812 subseq 4097 len 1428 csum 0x8aed], length 1428
17:16:36.477388 IP 112.26.0.8.57542 > 112.26.0.1.36177: Flags [.], ack 5525, win 1552, options [nop,nop,TS val 3060864 ecr 3280194,mptcp dss ack 1489184240], length 0
17:16:36.477618 IP 112.26.0.1.36177 > 112.26.0.8.57542: Flags [.], seq 18377:19805, ack 1, win 1339, options [nop,nop,TS val 3280877 ecr 3060864,mptcp dss ack 4086075562 seq 1489197092 subseq 18377 len 1428 csum 0x6b45], length 1428
17:16:36.494882 IP 112.26.0.1.36177 > 112.26.0.8.57542: Flags [.], seq 5525:6953, ack 1, win 1339, options [nop,nop,TS val 3280194 ecr 3060180,mptcp dss ack 4086075562 seq 1489184240 subseq 5525 len 1428 csum 0xe762], length 1428
17:16:36.570196 IP 112.26.0.8.57542 > 112.26.0.1.36177: Flags [.], ack 6953, win 1597, options [nop,nop,TS val 3060897 ecr 3280194,mptcp dss ack 1489185668], length 0
17:16:36.570446 IP 112.26.0.1.36177 > 112.26.0.8.57542: Flags [.], seq 19805:21233, ack 1, win 1339, options [nop,nop,TS val 3280970 ecr 3060897,mptcp dss ack 4086075562 seq 1489198520 subseq 19805 len 1428 csum 0x2ae7], length 1428
17:16:36.664788 IP 112.26.0.1.36177 > 112.26.0.8.57542: Flags [.], seq 8381:9809, ack 1, win 1339, options [nop,nop,TS val 3280194 ecr 3060180,mptcp dss ack 4086075562 seq 1489187096 subseq 8381 len 1428 csum 0x50c1], length 1428
17:16:36.685213 IP 112.26.0.1.36177 > 112.26.0.8.57542: Flags [.], seq 9809:11237, ack 1, win 1339, options [nop,nop,TS val 3280194 ecr 3060180,mptcp dss ack 4086075562 seq 1489188524 subseq 9809 len 1428 csum 0x492d], length 1428
17:16:36.772286 IP 112.26.0.8.57542 > 112.26.0.1.36177: Flags [.], ack 6953, win 1643, options [nop,nop,TS val 3061065 ecr 3280194,nop,nop,sack 1 {8381:9809},mptcp dss ack 1489185668], length 0
17:16:36.782619 IP 112.26.0.1.36177 > 112.26.0.8.57542: Flags [.], seq 12665:14093, ack 1, win 1339, options [nop,nop,TS val 3280257 ecr 3060180,mptcp dss ack 4086075562 seq 1489191380 subseq 12665 len 1428 csum 0xbab0], length 1428
17:16:36.793375 IP 112.26.0.8.57542 > 112.26.0.1.36177: Flags [.], ack 6953, win 1689, options [nop,nop,TS val 3061085 ecr 3280194,nop,nop,sack 1 {8381:11237},mptcp dss ack 1489185668], length 0
17:16:36.793607 IP 112.26.0.1.36177 > 112.26.0.8.57542: Flags [.], seq 21233:22661, ack 1, win 1339, options [nop,nop,TS val 3281193 ecr 3061065,mptcp dss ack 4086075562 seq 1489199948 subseq 21233 len 1428 csum 0x73e7], length 1428
17:16:36.871348 IP 112.26.0.1.36177 > 112.26.0.8.57542: Flags [.], seq 14093:15521, ack 1, win 1339, options [nop,nop,TS val 3280684 ecr 3060658,mptcp dss ack 4086075562 seq 1489192808 subseq 14093 len 1428 csum 0xd4a], length 1428
17:16:36.900388 IP 112.26.0.8.57542 > 112.26.0.1.36177: Flags [.], ack 6953, win 1734, options [nop,nop,TS val 3061199 ecr 3280194,nop,nop,sack 2 {12665:14093}{8381:11237},mptcp dss ack 1489185668], length 0
17:16:36.900624 IP 112.26.0.1.36177 > 112.26.0.8.57542: Flags [.], seq 22661:24089, ack 1, win 1339, options [nop,nop,TS val 3281300 ecr 3061085,mptcp dss ack 4086075562 seq 1489201376 subseq 22661 len 1428 csum 0xd081], length 1428
17:16:36.900695 IP 112.26.0.1.36177 > 112.26.0.8.57542: Flags [.], seq 6953:8381, ack 1, win 1339, options [nop,nop,TS val 3281300 ecr 3061199,mptcp dss ack 4086075562 seq 1489185668 subseq 6953 len 1428 csum 0x812f], length 1428
17:16:36.989117 IP 112.26.0.8.57542 > 112.26.0.1.36177: Flags [.], ack 6953, win 1780, options [nop,nop,TS val 3061273 ecr 3280194,nop,nop,sack 2 {12665:15521}{8381:11237},mptcp dss ack 1489185668], length 0
17:16:36.996920 IP 112.26.0.1.36177 > 112.26.0.8.57542: Flags [.], seq 18377:19805, ack 1, win 1339, options [nop,nop,TS val 3280877 ecr 3060864,mptcp dss ack 4086075562 seq 1489197092 subseq 18377 len 1428 csum 0x6b45], length 1428
17:16:37.071330 IP 112.26.0.1.36177 > 112.26.0.8.57542: Flags [.], seq 19805:21233, ack 1, win 1339, options [nop,nop,TS val 3280970 ecr 3060897,mptcp dss ack 4086075562 seq 1489198520 subseq 19805 len 1428 csum 0x2ae7], length 1428
17:16:37.093147 IP 112.26.0.8.57542 > 112.26.0.1.36177: Flags [.], ack 6953, win 1825, options [nop,nop,TS val 3061397 ecr 3280194,nop,nop,sack 2 {18377:19805}{12665:15521},mptcp dss ack 1489185668], length 0
17:16:37.093374 IP 112.26.0.1.36177 > 112.26.0.8.57542: Flags [.], seq 11237:12665, ack 1, win 1339, options [nop,nop,TS val 3281493 ecr 3061397,mptcp dss ack 4086075562 seq 1489189952 subseq 11237 len 1428 csum 0x78b3], length 1428
17:16:37.099140 IP 112.26.0.1.36177 > 112.26.0.8.57542: Flags [.], seq 21233:22661, ack 1, win 1339, options [nop,nop,TS val 3281193 ecr 3061065,mptcp dss ack 4086075562 seq 1489199948 subseq 21233 len 1428 csum 0x73e7], length 1428
17:16:37.183616 IP 112.26.0.1.36177 > 112.26.0.8.57542: Flags [.], seq 22661:24089, ack 1, win 1339, options [nop,nop,TS val 3281300 ecr 3061085,mptcp dss ack 4086075562 seq 1489201376 subseq 22661 len 1428 csum 0xd081], length 1428
17:16:37.273001 IP 112.26.0.8.57542 > 112.26.0.1.36177: Flags [.], ack 6953, win 1871, options [nop,nop,TS val 3061569 ecr 3280194,nop,nop,sack 2 {18377:21233}{12665:15521},mptcp dss ack 1489185668], length 0
17:16:37.273395 IP 112.26.0.1.36177 > 112.26.0.8.57542: Flags [.], seq 15521:16949, ack 1, win 1339, options [nop,nop,TS val 3281673 ecr 3061569,mptcp dss ack 4086075562 seq 1489194236 subseq 15521 len 1428 csum 0x78a5], length 1428
17:16:37.288948 IP 112.26.0.1.36177 > 112.26.0.8.57542: Flags [.], seq 6953:8381, ack 1, win 1339, options [nop,nop,TS val 3281300 ecr 3061199,mptcp dss ack 4086075562 seq 1489185668 subseq 6953 len 1428 csum 0x812f], length 1428
17:16:37.307966 IP 112.26.0.1.36177 > 112.26.0.8.57542: Flags [.], seq 11237:12665, ack 1, win 1339, options [nop,nop,TS val 3281493 ecr 3061397,mptcp dss ack 4086075562 seq 1489189952 subseq 11237 len 1428 csum 0x78b3], length 1428
17:16:37.373834 IP 112.26.0.8.57542 > 112.26.0.1.36177: Flags [.], ack 6953, win 1917, options [nop,nop,TS val 3061693 ecr 3280194,nop,nop,sack 2 {18377:22661}{12665:15521},mptcp dss ack 1489185668], length 0
17:16:37.374135 IP 112.26.0.1.36177 > 112.26.0.8.57542: Flags [.], seq 16949:18377, ack 1, win 1339, options [nop,nop,TS val 3281774 ecr 3061693,mptcp dss ack 4086075562 seq 1489195664 subseq 16949 len 1428 csum 0x61f9], length 1428
17:16:37.468467 IP 112.26.0.1.36177 > 112.26.0.8.57542: Flags [.], seq 15521:16949, ack 1, win 1339, options [nop,nop,TS val 3281673 ecr 3061569,mptcp dss ack 4086075562 seq 1489194236 subseq 15521 len 1428 csum 0x78a5], length 1428
17:16:37.477318 IP 112.26.0.8.57542 > 112.26.0.1.36177: Flags [.], ack 6953, win 1962, options [nop,nop,TS val 3061780 ecr 3280194,nop,nop,sack 2 {18377:24089}{12665:15521},mptcp dss ack 1489185668], length 0
17:16:37.500043 IP 112.26.0.8.57542 > 112.26.0.1.36177: Flags [.], ack 11237, win 2008, options [nop,nop,TS val 3061813 ecr 3281300,nop,nop,sack 2 {18377:24089}{12665:15521},mptcp dss ack 1489189952], length 0
17:16:37.500266 IP 112.26.0.1.36177 > 112.26.0.8.57542: Flags [.], seq 24089:25517, ack 1, win 1339, options [nop,nop,TS val 3281900 ecr 3061780,mptcp dss ack 4086075562 seq 1489202804 subseq 24089 len 1428 csum 0x6850], length 1428
17:16:37.500329 IP 112.26.0.1.36177 > 112.26.0.8.57542: Flags [.], seq 25517:26945, ack 1, win 1339, options [nop,nop,TS val 3281900 ecr 3061813,mptcp dss ack 4086075562 seq 1489204232 subseq 25517 len 1428 csum 0x824e], length 1428
17:16:37.500428 IP 112.26.0.1.36177 > 112.26.0.8.57542: Flags [.], seq 26945:28373, ack 1, win 1339, options [nop,nop,TS val 3281900 ecr 3061813,mptcp dss ack 4086075562 seq 1489205660 subseq 26945 len 1428 csum 0x84b], length 1428
17:16:37.500505 IP 112.26.0.1.36177 > 112.26.0.8.57542: Flags [.], seq 28373:29801, ack 1, win 1339, options [nop,nop,TS val 3281900 ecr 3061813,mptcp dss ack 4086075562 seq 1489207088 subseq 28373 len 1428 csum 0x14a8], length 1428
17:16:37.585740 IP 112.26.0.1.36177 > 112.26.0.8.57542: Flags [.], seq 16949:18377, ack 1, win 1339, options [nop,nop,TS val 3281774 ecr 3061693,mptcp dss ack 4086075562 seq 1489195664 subseq 16949 len 1428 csum 0x61f9], length 1428
17:16:37.591734 IP 112.26.0.8.57542 > 112.26.0.1.36177: Flags [.], ack 15521, win 2054, options [nop,nop,TS val 3061889 ecr 3281493,nop,nop,sack 1 {18377:24089},mptcp dss ack 1489194236], length 0
17:16:37.591925 IP 112.26.0.1.36177 > 112.26.0.8.57542: Flags [.], seq 29801:31229, ack 1, win 1339, options [nop,nop,TS val 3281992 ecr 3061889,mptcp dss ack 4086075562 seq 1489208516 subseq 29801 len 1428 csum 0x3a49], length 1428
17:16:37.609351 IP 112.26.0.8.57542 > 112.26.0.1.36177: Flags [.], ack 16949, win 2099, options [nop,nop,TS val 3061966 ecr 3281673,nop,nop,sack 1 {18377:24089},mptcp dss ack 1489195664], length 0
17:16:37.609536 IP 112.26.0.1.36177 > 112.26.0.8.57542: Flags [.], seq 31229:32657, ack 1, win 1339, options [nop,nop,TS val 3282009 ecr 3061966,mptcp dss ack 4086075562 seq 1489209944 subseq 31229 len 1428 csum 0x2d89], length 1428
17:16:37.684354 IP 112.26.0.1.36177 > 112.26.0.8.57542: Flags [.], seq 24089:25517, ack 1, win 1339, options [nop,nop,TS val 3281900 ecr 3061780,mptcp dss ack 4086075562 seq 1489202804 subseq 24089 len 1428 csum 0x6850], length 1428
17:16:37.698951 IP 112.26.0.8.57542 > 112.26.0.1.36177: Flags [.], ack 24089, win 2145, options [nop,nop,TS val 3062066 ecr 3281774,mptcp dss ack 1489202804], length 0
17:16:37.699200 IP 112.26.0.1.36177 > 112.26.0.8.57542: Flags [.], seq 32657:34085, ack 1, win 1339, options [nop,nop,TS val 3282099 ecr 3062066,mptcp dss ack 4086075562 seq 1489211372 subseq 32657 len 1428 csum 0xa933], length 1428
17:16:37.771088 IP 112.26.0.1.36177 > 112.26.0.8.57542: Flags [.], seq 25517:26945, ack 1, win 1339, options [nop,nop,TS val 3281900 ecr 3061813,mptcp dss ack 4086075562 seq 1489204232 subseq 25517 len 1428 csum 0x824e], length 1428
17:16:37.776102 IP 112.26.0.8.57542 > 112.26.0.1.36177: Flags [.], ack 25517, win 2190, options [nop,nop,TS val 3062104 ecr 3281900,mptcp dss ack 1489204232], length 0
17:16:37.776310 IP 112.26.0.1.36177 > 112.26.0.8.57542: Flags [.], seq 34085:35513, ack 1, win 1339, options [nop,nop,TS val 3282176 ecr 3062104,mptcp dss ack 4086075562 seq 1489212800 subseq 34085 len 1428 csum 0xca24], length 1428
17:16:37.804505 IP 112.26.0.8.57542 > 112.26.0.1.36177: Flags [.], ack 26945, win 2236, options [nop,nop,TS val 3062197 ecr 3281900,mptcp dss ack 1489205660], length 0
17:16:37.804732 IP 112.26.0.1.36177 > 112.26.0.8.57542: Flags [.], seq 35513:36941, ack 1, win 1339, options [nop,nop,TS val 3282204 ecr 3062197,mptcp dss ack 4086075562 seq 1489214228 subseq 35513 len 1428 csum 0xb6c9], length 1428
17:16:37.804777 IP 112.26.0.1.36177 > 112.26.0.8.57542: Flags [.], seq 36941:38369, ack 1, win 1339, options [nop,nop,TS val 3282204 ecr 3062197,mptcp dss ack 4086075562 seq 1489215656 subseq 36941 len 1428 csum 0xf3d], length 1428
17:16:37.807129 IP 112.26.0.1.36177 > 112.26.0.8.57542: Flags [.], seq 26945:28373, ack 1, win 1339, options [nop,nop,TS val 3281900 ecr 3061813,mptcp dss ack 4086075562 seq 1489205660 subseq 26945 len 1428 csum 0x84b], length 1428
17:16:37.895270 IP 112.26.0.8.57542 > 112.26.0.1.36177: Flags [.], ack 28373, win 2282, options [nop,nop,TS val 3062287 ecr 3281900,mptcp dss ack 1489207088], length 0
17:16:37.895519 IP 112.26.0.1.36177 > 112.26.0.8.57542: Flags [.], seq 38369:39797, ack 1, win 1339, options [nop,nop,TS val 3282295 ecr 3062287,mptcp dss ack 4086075562 seq 1489217084 subseq 38369 len 1428 csum 0x9542], length 1428
17:16:37.900681 IP 112.26.0.1.36177 > 112.26.0.8.57542: Flags [.], seq 28373:29801, ack 1, win 1339, options [nop,nop,TS val 3281900 ecr 3061813,mptcp dss ack 4086075562 seq 1489207088 subseq 28373 len 1428 csum 0x14a8], length 1428
17:16:37.986423 IP 112.26.0.8.57542 > 112.26.0.1.36177: Flags [.], ack 29801, win 2327, options [nop,nop,TS val 3062375 ecr 3281900,mptcp dss ack 1489208516], length 0
17:16:37.986660 IP 112.26.0.1.36177 > 112.26.0.8.57542: Flags [.], seq 39797:41225, ack 1, win 1339, options [nop,nop,TS val 3282386 ecr 3062375,mptcp dss ack 4086075562 seq 1489218512 subseq 39797 len 1428 csum 0x61a5], length 1428
17:16:37.990039 IP 112.26.0.1.36177 > 112.26.0.8.57542: Flags [.], seq 29801:31229, ack 1, win 1339, options [nop,nop,TS val 3281992 ecr 3061889,mptcp dss ack 4086075562 seq 1489208516 subseq 29801 len 1428 csum 0x3a49], length 1428
17:16:38.081628 IP 112.26.0.8.57542 > 112.26.0.1.36177: Flags [.], ack 31229, win 2373, options [nop,nop,TS val 3062415 ecr 3281992,mptcp dss ack 1489209944], length 0
17:16:38.081872 IP 112.26.0.1.36177 > 112.26.0.8.57542: Flags [.], seq 41225:42653, ack 1, win 1339, options [nop,nop,TS val 3282482 ecr 3062415,mptcp dss ack 4086075562 seq 1489219940 subseq 41225 len 1428 csum 0x5ade], length 1428
17:16:38.091131 IP 112.26.0.1.36177 > 112.26.0.8.57542: Flags [.], seq 31229:32657, ack 1, win 1339, options [nop,nop,TS val 3282009 ecr 3061966,mptcp dss ack 4086075562 seq 1489209944 subseq 31229 len 1428 csum 0x2d89], length 1428
17:16:38.183931 IP 112.26.0.1.36177 > 112.26.0.8.57542: Flags [.], seq 32657:34085, ack 1, win 1339, options [nop,nop,TS val 3282099 ecr 3062066,mptcp dss ack 4086075562 seq 1489211372 subseq 32657 len 1428 csum 0xa933], length 1428
17:16:38.208313 IP 112.26.0.1.36177 > 112.26.0.8.57542: Flags [.], seq 38369:39797, ack 1, win 1339, options [nop,nop,TS val 3282295 ecr 3062287,mptcp dss ack 4086075562 seq 1489217084 subseq 38369 len 1428 csum 0x9542], length 1428
17:16:38.294737 IP 112.26.0.1.36177 > 112.26.0.8.57542: Flags [.], seq 34085:35513, ack 1, win 1339, options [nop,nop,TS val 3282176 ecr 3062104,mptcp dss ack 4086075562 seq 1489212800 subseq 34085 len 1428 csum 0xca24], length 1428
17:16:38.299749 IP 112.26.0.8.57542 > 112.26.0.1.36177: Flags [.], ack 32657, win 2419, options [nop,nop,TS val 3062596 ecr 3282009,mptcp dss ack 1489211372], length 0
17:16:38.300041 IP 112.26.0.1.36177 > 112.26.0.8.57542: Flags [.], seq 42653:44081, ack 1, win 1339, options [nop,nop,TS val 3282700 ecr 3062596,mptcp dss ack 4086075562 seq 1489221368 subseq 42653 len 1428 csum 0x7a7c], length 1428
17:16:38.300088 IP 112.26.0.1.36177 > 112.26.0.8.57542: Flags [.], seq 44081:45509, ack 1, win 1339, options [nop,nop,TS val 3282700 ecr 3062596,mptcp dss ack 4086075562 seq 1489222796 subseq 44081 len 1428 csum 0x6b22], length 1428
17:16:38.392158 IP 112.26.0.1.36177 > 112.26.0.8.57542: Flags [.], seq 35513:36941, ack 1, win 1339, options [nop,nop,TS val 3282204 ecr 3062197,mptcp dss ack 4086075562 seq 1489214228 subseq 35513 len 1428 csum 0xb6c9], length 1428
17:16:38.395228 IP 112.26.0.8.57542 > 112.26.0.1.36177: Flags [.], ack 34085, win 2464, options [nop,nop,TS val 3062678 ecr 3282099,mptcp dss ack 1489212800], length 0
17:16:38.395481 IP 112.26.0.1.36177 > 112.26.0.8.57542: Flags [.], seq 45509:46937, ack 1, win 1339, options [nop,nop,TS val 3282795 ecr 3062678,mptcp dss ack 4086075562 seq 1489224224 subseq 45509 len 1428 csum 0xf8c7], length 1428
17:16:38.500998 IP 112.26.0.1.36177 > 112.26.0.8.57542: Flags [.], seq 39797:41225, ack 1, win 1339, options [nop,nop,TS val 3282386 ecr 3062375,mptcp dss ack 4086075562 seq 1489218512 subseq 39797 len 1428 csum 0x61a5], length 1428
17:16:38.572068 IP 112.26.0.1.36177 > 112.26.0.8.57542: Flags [.], seq 36941:38369, ack 1, win 1339, options [nop,nop,TS val 3282204 ecr 3062197,mptcp dss ack 4086075562 seq 1489215656 subseq 36941 len 1428 csum 0xf3d], length 1428
17:16:38.592803 IP 112.26.0.1.36177 > 112.26.0.8.57542: Flags [.], seq 41225:42653, ack 1, win 1339, options [nop,nop,TS val 3282482 ecr 3062415,mptcp dss ack 4086075562 seq 1489219940 subseq 41225 len 1428 csum 0x5ade], length 1428
17:16:38.615276 IP 112.26.0.8.57542 > 112.26.0.1.36177: Flags [.], ack 34085, win 2510, options [nop,nop,TS val 3062708 ecr 3282099,nop,nop,sack 1 {38369:39797},mptcp dss ack 1489212800], length 0
17:16:38.615514 IP 112.26.0.1.36177 > 112.26.0.8.57542: Flags [.], seq 34085:35513, ack 1, win 1339, options [nop,nop,TS val 3283015 ecr 3062708,mptcp dss ack 4086075562 seq 1489212800 subseq 34085 len 1428 csum 0xca24], length 1428
17:16:38.696867 IP 112.26.0.1.36177 > 112.26.0.8.57542: Flags [.], seq 42653:44081, ack 1, win 1339, options [nop,nop,TS val 3282700 ecr 3062596,mptcp dss ack 4086075562 seq 1489221368 subseq 42653 len 1428 csum 0x7a7c], length 1428
17:16:38.782589 IP 112.26.0.8.57542 > 112.26.0.1.36177: Flags [.], ack 35513, win 2555, options [nop,nop,TS val 3062778 ecr 3282176,nop,nop,sack 1 {38369:39797},mptcp dss ack 1489214228], length 0
17:16:38.782886 IP 112.26.0.1.36177 > 112.26.0.8.57542: Flags [.], seq 46937:48365, ack 1, win 1339, options [nop,nop,TS val 3283182 ecr 3062778,mptcp dss ack 4086075562 seq 1489225652 subseq 46937 len 1428 csum 0x4761], length 1428
17:16:38.782931 IP 112.26.0.1.36177 > 112.26.0.8.57542: Flags [.], seq 48365:49793, ack 1, win 1339, options [nop,nop,TS val 3283182 ecr 3062778,mptcp dss ack 4086075562 seq 1489227080 subseq 48365 len 1428 csum 0xd967], length 1428
17:16:38.880340 IP 112.26.0.1.36177 > 112.26.0.8.57542: Flags [.], seq 44081:45509, ack 1, win 1339, options [nop,nop,TS val 3282700 ecr 3062596,mptcp dss ack 4086075562 seq 1489222796 subseq 44081 len 1428 csum 0x6b22], length 1428
17:16:38.900237 IP 112.26.0.1.36177 > 112.26.0.8.57542: Flags [.], seq 45509:46937, ack 1, win 1339, options [nop,nop,TS val 3282795 ecr 3062678,mptcp dss ack 4086075562 seq 1489224224 subseq 45509 len 1428 csum 0xf8c7], length 1428
17:16:38.994459 IP 112.26.0.8.57542 > 112.26.0.1.36177: Flags [.], ack 36941, win 2647, options [nop,nop,TS val 3062900 ecr 3282204,nop,nop,sack 1 {38369:41225},mptcp dss ack 1489215656], length 0
17:16:38.994728 IP 112.26.0.1.36177 > 112.26.0.8.57542: Flags [.], seq 49793:51221, ack 1, win 1339, options [nop,nop,TS val 3283394 ecr 3062900,mptcp dss ack 4086075562 seq 1489228508 subseq 49793 len 1428 csum 0x9518], length 1428
17:16:38.994775 IP 112.26.0.1.36177 > 112.26.0.8.57542: Flags [.], seq 51221:52649, ack 1, win 1339, options [nop,nop,TS val 3283394 ecr 3062900,mptcp dss ack 4086075562 seq 1489229936 subseq 51221 len 1428 csum 0x639d], length 1428
17:16:39.010633 IP 112.26.0.8.57542 > 112.26.0.1.36177: Flags [.], ack 41225, win 2692, options [nop,nop,TS val 3062984 ecr 3282204,mptcp dss ack 1489219940], length 0
17:16:39.010864 IP 112.26.0.1.36177 > 112.26.0.8.57542: Flags [.], seq 52649:54077, ack 1, win 1339, options [nop,nop,TS val 3283410 ecr 3062984,mptcp dss ack 4086075562 seq 1489231364 subseq 52649 len 1428 csum 0xa011], length 1428
17:16:39.083538 IP 112.26.0.1.36177 > 112.26.0.8.57542: Flags [.], seq 34085:35513, ack 1, win 1339, options [nop,nop,TS val 3283015 ecr 3062708,mptcp dss ack 4086075562 seq 1489212800 subseq 34085 len 1428 csum 0xca24], length 1428
17:16:39.107818 IP 112.26.0.8.57542 > 112.26.0.1.36177: Flags [.], ack 42653, win 2738, options [nop,nop,TS val 3063079 ecr 3282482,mptcp dss ack 1489221368], length 0
17:16:39.108063 IP 112.26.0.1.36177 > 112.26.0.8.57542: Flags [.], seq 54077:55505, ack 1, win 1339, options [nop,nop,TS val 3283507 ecr 3063079,mptcp dss ack 4086075562 seq 1489232792 subseq 54077 len 1428 csum 0x9d1d], length 1428
17:16:39.188217 IP 112.26.0.8.57542 > 112.26.0.1.36177: Flags [.], ack 44081, win 2784, options [nop,nop,TS val 3063113 ecr 3282700,mptcp dss ack 1489222796], length 0
17:16:39.188449 IP 112.26.0.1.36177 > 112.26.0.8.57542: Flags [.], seq 55505:56933, ack 1, win 1339, options [nop,nop,TS val 3283588 ecr 3063113,mptcp dss ack 4086075562 seq 1489234220 subseq 55505 len 1428 csum 0xd517], length 1428
17:16:39.284398 IP 112.26.0.1.36177 > 112.26.0.8.57542: Flags [.], seq 48365:49793, ack 1, win 1339, options [nop,nop,TS val 3283182 ecr 3062778,mptcp dss ack 4086075562 seq 1489227080 subseq 48365 len 1428 csum 0xd967], length 1428
17:16:39.300992 IP 112.26.0.8.57542 > 112.26.0.1.36177: Flags [.], ack 45509, win 2829, options [nop,nop,TS val 3063281 ecr 3282700,mptcp dss ack 1489224224], length 0
17:16:39.301235 IP 112.26.0.1.36177 > 112.26.0.8.57542: Flags [.], seq 56933:58361, ack 1, win 1339, options [nop,nop,TS val 3283701 ecr 3063281,mptcp dss ack 4086075562 seq 1489235648 subseq 56933 len 1428 csum 0xeaa1], length 1428
17:16:39.383652 IP 112.26.0.8.57542 > 112.26.0.1.36177: Flags [.], ack 46937, win 2875, options [nop,nop,TS val 3063300 ecr 3282795,mptcp dss ack 1489225652], length 0
17:16:39.383961 IP 112.26.0.1.36177 > 112.26.0.8.57542: Flags [.], seq 58361:59789, ack 1, win 1339, options [nop,nop,TS val 3283784 ecr 3063300,mptcp dss ack 4086075562 seq 1489237076 subseq 58361 len 1428 csum 0x58af], length 1428
17:16:39.393815 IP 112.26.0.1.36177 > 112.26.0.8.57542: Flags [.], seq 49793:51221, ack 1, win 1339, options [nop,nop,TS val 3283394 ecr 3062900,mptcp dss ack 4086075562 seq 1489228508 subseq 49793 len 1428 csum 0x9518], length 1428
17:16:39.484716 IP 112.26.0.1.36177 > 112.26.0.8.57542: Flags [.], seq 51221:52649, ack 1, win 1339, options [nop,nop,TS val 3283394 ecr 3062900,mptcp dss ack 4086075562 seq 1489229936 subseq 51221 len 1428 csum 0x639d], length 1428
17:16:39.502739 IP 112.26.0.8.57542 > 112.26.0.1.36177: Flags [.], ack 46937, win 2875, options [nop,nop,TS val 3063484 ecr 3282795,nop,nop,sack 1 {34085:35513},mptcp dss ack 1489225652], length 0
17:16:39.584058 IP 112.26.0.1.36177 > 112.26.0.8.57542: Flags [.], seq 52649:54077, ack 1, win 1339, options [nop,nop,TS val 3283410 ecr 3062984,mptcp dss ack 4086075562 seq 1489231364 subseq 52649 len 1428 csum 0xa011], length 1428
17:16:39.605167 IP 112.26.0.1.36177 > 112.26.0.8.57542: Flags [.], seq 54077:55505, ack 1, win 1339, options [nop,nop,TS val 3283507 ecr 3063079,mptcp dss ack 4086075562 seq 1489232792 subseq 54077 len 1428 csum 0x9d1d], length 1428
17:16:39.692507 IP 112.26.0.1.36177 > 112.26.0.8.57542: Flags [.], seq 55505:56933, ack 1, win 1339, options [nop,nop,TS val 3283588 ecr 3063113,mptcp dss ack 4086075562 seq 1489234220 subseq 55505 len 1428 csum 0xd517], length 1428
17:16:39.779285 IP 112.26.0.1.36177 > 112.26.0.8.57542: Flags [.], seq 56933:58361, ack 1, win 1339, options [nop,nop,TS val 3283701 ecr 3063281,mptcp dss ack 4086075562 seq 1489235648 subseq 56933 len 1428 csum 0xeaa1], length 1428
17:16:39.790137 IP 112.26.0.8.57542 > 112.26.0.1.36177: Flags [.], ack 46937, win 2920, options [nop,nop,TS val 3063685 ecr 3282795,nop,nop,sack 1 {48365:49793},mptcp dss ack 1489225652], length 0
17:16:39.795668 IP 112.26.0.1.36177 > 112.26.0.8.57542: Flags [.], seq 58361:59789, ack 1, win 1339, options [nop,nop,TS val 3283784 ecr 3063300,mptcp dss ack 4086075562 seq 1489237076 subseq 58361 len 1428 csum 0x58af], length 1428
17:16:39.806827 IP 112.26.0.8.57542 > 112.26.0.1.36177: Flags [.], ack 46937, win 2966, options [nop,nop,TS val 3063794 ecr 3282795,nop,nop,sack 1 {48365:51221},mptcp dss ack 1489225652], length 0
17:16:39.807058 IP 112.26.0.1.36177 > 112.26.0.8.57542: Flags [.], seq 59789:61217, ack 1, win 1339, options [nop,nop,TS val 3284207 ecr 3063685,mptcp dss ack 4086075562 seq 1489238504 subseq 59789 len 1428 csum 0xe594], length 1428
17:16:39.807104 IP 112.26.0.1.36177 > 112.26.0.8.57542: Flags [.], seq 61217:62645, ack 1, win 1339, options [nop,nop,TS val 3284207 ecr 3063685,mptcp dss ack 4086075562 seq 1489239932 subseq 61217 len 1428 csum 0x73cd], length 1428
17:16:39.895569 IP 112.26.0.8.57542 > 112.26.0.1.36177: Flags [.], ack 46937, win 3012, options [nop,nop,TS val 3063884 ecr 3282795,nop,nop,sack 1 {48365:52649},mptcp dss ack 1489225652], length 0
17:16:39.895771 IP 112.26.0.1.36177 > 112.26.0.8.57542: Flags [.], seq 62645:64073, ack 1, win 1339, options [nop,nop,TS val 3284295 ecr 3063794,mptcp dss ack 4086075562 seq 1489241360 subseq 62645 len 1428 csum 0xc553], length 1428
17:16:39.991092 IP 112.26.0.8.57542 > 112.26.0.1.36177: Flags [.], ack 46937, win 3057, options [nop,nop,TS val 3063984 ecr 3282795,nop,nop,sack 1 {48365:54077},mptcp dss ack 1489225652], length 0
17:16:39.991314 IP 112.26.0.1.36177 > 112.26.0.8.57542: Flags [.], seq 64073:65501, ack 1, win 1339, options [nop,nop,TS val 3284391 ecr 3063884,mptcp dss ack 4086075562 seq 1489242788 subseq 64073 len 1428 csum 0x9fd3], length 1428
17:16:39.991374 IP 112.26.0.1.36177 > 112.26.0.8.57542: Flags [.], seq 46937:48365, ack 1, win 1339, options [nop,nop,TS val 3284391 ecr 3063984,mptcp dss ack 4086075562 seq 1489225652 subseq 46937 len 1428 csum 0x4761], length 1428
17:16:40.015195 IP 112.26.0.8.57542 > 112.26.0.1.36177: Flags [.], ack 46937, win 3103, options [nop,nop,TS val 3064095 ecr 3282795,nop,nop,sack 1 {48365:55505},mptcp dss ack 1489225652], length 0
17:16:40.094737 IP 112.26.0.8.57542 > 112.26.0.1.36177: Flags [.], ack 46937, win 3149, options [nop,nop,TS val 3064107 ecr 3282795,nop,nop,sack 1 {48365:56933},mptcp dss ack 1489225652], length 0
17:16:40.094905 IP 112.26.0.1.36177 > 112.26.0.8.57542: Flags [.], seq 65501:66929, ack 1, win 1339, options [nop,nop,TS val 3284495 ecr 3064095,mptcp dss ack 4086075562 seq 1489244216 subseq 65501 len 1428 csum 0x80e8], length 1428
17:16:40.182134 IP 112.26.0.1.36177 > 112.26.0.8.57542: Flags [.], seq 59789:61217, ack 1, win 1339, options [nop,nop,TS val 3284207 ecr 3063685,mptcp dss ack 4086075562 seq 1489238504 subseq 59789 len 1428 csum 0xe594], length 1428
17:16:40.200421 IP 112.26.0.1.36177 > 112.26.0.8.57542: Flags [.], seq 61217:62645, ack 1, win 1339, options [nop,nop,TS val 3284207 ecr 3063685,mptcp dss ack 4086075562 seq 1489239932 subseq 61217 len 1428 csum 0x73cd], length 1428
17:16:40.219196 IP 112.26.0.1.36177 > 112.26.0.8.57542: Flags [.], seq 62645:64073, ack 1, win 1339, options [nop,nop,TS val 3284295 ecr 3063794,mptcp dss ack 4086075562 seq 1489241360 subseq 62645 len 1428 csum 0xc553], length 1428
17:16:40.300935 IP 112.26.0.8.57542 > 112.26.0.1.36177: Flags [.], ack 46937, win 3194, options [nop,nop,TS val 3064302 ecr 3282795,nop,nop,sack 1 {48365:58361},mptcp dss ack 1489225652], length 0
17:16:40.301161 IP 112.26.0.1.36177 > 112.26.0.8.57542: Flags [.], seq 66929:68357, ack 1, win 1339, options [nop,nop,TS val 3284701 ecr 3064107,mptcp dss ack 4086075562 seq 1489245644 subseq 66929 len 1428 csum 0x845], length 1428
17:16:40.388098 IP 112.26.0.1.36177 > 112.26.0.8.57542: Flags [.], seq 64073:65501, ack 1, win 1339, options [nop,nop,TS val 3284391 ecr 3063884,mptcp dss ack 4086075562 seq 1489242788 subseq 64073 len 1428 csum 0x9fd3], length 1428
17:16:40.399276 IP 112.26.0.8.57542 > 112.26.0.1.36177: Flags [.], ack 46937, win 3240, options [nop,nop,TS val 3064313 ecr 3282795,nop,nop,sack 1 {48365:59789},mptcp dss ack 1489225652], length 0
17:16:40.492950 IP 112.26.0.1.36177 > 112.26.0.8.57542: Flags [.], seq 46937:48365, ack 1, win 1339, options [nop,nop,TS val 3284391 ecr 3063984,mptcp dss ack 4086075562 seq 1489225652 subseq 46937 len 1428 csum 0x4761], length 1428
17:16:40.503111 IP 112.26.0.1.36177 > 112.26.0.8.57542: Flags [.], seq 65501:66929, ack 1, win 1339, options [nop,nop,TS val 3284495 ecr 3064095,mptcp dss ack 4086075562 seq 1489244216 subseq 65501 len 1428 csum 0x80e8], length 1428
17:16:40.590729 IP 112.26.0.8.57542 > 112.26.0.1.36177: Flags [.], ack 46937, win 3285, options [nop,nop,TS val 3064585 ecr 3282795,nop,nop,sack 1 {48365:61217},mptcp dss ack 1489225652], length 0
17:16:40.607998 IP 112.26.0.8.57542 > 112.26.0.1.36177: Flags [.], ack 46937, win 3331, options [nop,nop,TS val 3064610 ecr 3282795,nop,nop,sack 1 {48365:62645},mptcp dss ack 1489225652], length 0
17:16:40.608191 IP 112.26.0.1.36177 > 112.26.0.8.57542: Flags [.], seq 68357:69785, ack 1, win 1339, options [nop,nop,TS val 3285008 ecr 3064585,mptcp dss ack 4086075562 seq 1489247072 subseq 68357 len 1428 csum 0x4d3d], length 1428
17:16:40.702822 IP 112.26.0.1.36177 > 112.26.0.8.57542: Flags [.], seq 66929:68357, ack 1, win 1339, options [nop,nop,TS val 3284701 ecr 3064107,mptcp dss ack 4086075562 seq 1489245644 subseq 66929 len 1428 csum 0x845], length 1428
17:16:40.783993 IP 112.26.0.8.57542 > 112.26.0.1.36177: Flags [.], ack 46937, win 3377, options [nop,nop,TS val 3064710 ecr 3282795,nop,nop,sack 1 {48365:64073},mptcp dss ack 1489225652], length 0
17:16:40.784377 IP 112.26.0.1.36177 > 112.26.0.8.57542: Flags [.], seq 69785:71213, ack 1, win 1339, options [nop,nop,TS val 3285184 ecr 3064610,mptcp dss ack 4086075562 seq 1489248500 subseq 69785 len 1428 csum 0x16ec], length 1428
17:16:40.803689 IP 112.26.0.8.57542 > 112.26.0.1.36177: Flags [.], ack 46937, win 3422, options [nop,nop,TS val 3064803 ecr 3282795,nop,nop,sack 1 {48365:65501},mptcp dss ack 1489225652], length 0
17:16:40.803908 IP 112.26.0.1.36177 > 112.26.0.8.57542: Flags [.], seq 71213:72641, ack 1, win 1339, options [nop,nop,TS val 3285203 ecr 3064710,mptcp dss ack 4086075562 seq 1489249928 subseq 71213 len 1428 csum 0x5199], length 1428
17:16:40.901111 IP 112.26.0.1.36177 > 112.26.0.8.57542: Flags [.], seq 68357:69785, ack 1, win 1339, options [nop,nop,TS val 3285008 ecr 3064585,mptcp dss ack 4086075562 seq 1489247072 subseq 68357 len 1428 csum 0x4d3d], length 1428
17:16:40.925431 IP 112.26.0.8.57542 > 112.26.0.1.36177: Flags [.], ack 65501, win 3468, options [nop,nop,TS val 3064983 ecr 3284391,mptcp dss ack 1489244216], length 0
17:16:40.925680 IP 112.26.0.1.36177 > 112.26.0.8.57542: Flags [.], seq 72641:74069, ack 1, win 1339, options [nop,nop,TS val 3285325 ecr 3064803,mptcp dss ack 4086075562 seq 1489251356 subseq 72641 len 1428 csum 0x8246], length 1428
17:16:40.925756 IP 112.26.0.1.36177 > 112.26.0.8.57542: Flags [.], seq 74069:75497, ack 1, win 1339, options [nop,nop,TS val 3285325 ecr 3064983,mptcp dss ack 4086075562 seq 1489252784 subseq 74069 len 1428 csum 0x21a7], length 1428
17:16:40.995970 IP 112.26.0.8.57542 > 112.26.0.1.36177: Flags [.], ack 66929, win 3514, options [nop,nop,TS val 3065002 ecr 3284495,mptcp dss ack 1489245644], length 0
17:16:40.996199 IP 112.26.0.1.36177 > 112.26.0.8.57542: Flags [.], seq 75497:76925, ack 1, win 1339, options [nop,nop,TS val 3285396 ecr 3065002,mptcp dss ack 4086075562 seq 1489254212 subseq 75497 len 1428 csum 0x8c8e], length 1428
17:16:41.030835 IP 112.26.0.1.36177 > 112.26.0.8.57542: Flags [.], seq 69785:71213, ack 1, win 1339, options [nop,nop,TS val 3285184 ecr 3064610,mptcp dss ack 4086075562 seq 1489248500 subseq 69785 len 1428 csum 0x16ec], length 1428
17:16:41.187298 IP 112.26.0.1.36177 > 112.26.0.8.57542: Flags [.], seq 71213:72641, ack 1, win 1339, options [nop,nop,TS val 3285203 ecr 3064710,mptcp dss ack 4086075562 seq 1489249928 subseq 71213 len 1428 csum 0x5199], length 1428
17:16:41.219500 IP 112.26.0.8.57542 > 112.26.0.1.36177: Flags [.], ack 68357, win 3559, options [nop,nop,TS val 3065190 ecr 3284701,mptcp dss ack 1489247072], length 0
17:16:41.219745 IP 112.26.0.1.36177 > 112.26.0.8.57542: Flags [.], seq 76925:78353, ack 1, win 1339, options [nop,nop,TS val 3285620 ecr 3065190,mptcp dss ack 4086075562 seq 1489255640 subseq 76925 len 1428 csum 0x2219], length 1428
17:16:41.219794 IP 112.26.0.1.36177 > 112.26.0.8.57542: Flags [.], seq 78353:79781, ack 1, win 1339, options [nop,nop,TS val 3285620 ecr 3065190,mptcp dss ack 4086075562 seq 1489257068 subseq 78353 len 1428 csum 0x5d75], length 1428
17:16:41.293155 IP 112.26.0.1.36177 > 112.26.0.8.57542: Flags [.], seq 72641:74069, ack 1, win 1339, options [nop,nop,TS val 3285325 ecr 3064803,mptcp dss ack 4086075562 seq 1489251356 subseq 72641 len 1428 csum 0x8246], length 1428
17:16:41.313988 IP 112.26.0.1.36177 > 112.26.0.8.57542: Flags [.], seq 74069:75497, ack 1, win 1339, options [nop,nop,TS val 3285325 ecr 3064983,mptcp dss ack 4086075562 seq 1489252784 subseq 74069 len 1428 csum 0x21a7], length 1428
17:16:41.402466 IP 112.26.0.8.57542 > 112.26.0.1.36177: Flags [.], ack 69785, win 3605, options [nop,nop,TS val 3065308 ecr 3285008,mptcp dss ack 1489248500], length 0
17:16:41.402731 IP 112.26.0.1.36177 > 112.26.0.8.57542: Flags [.], seq 79781:81209, ack 1, win 1339, options [nop,nop,TS val 3285802 ecr 3065308,mptcp dss ack 4086075562 seq 1489258496 subseq 79781 len 1428 csum 0x9d48], length 1428
17:16:41.416308 IP 112.26.0.1.36177 > 112.26.0.8.57542: Flags [.], seq 75497:76925, ack 1, win 1339, options [nop,nop,TS val 3285396 ecr 3065002,mptcp dss ack 4086075562 seq 1489254212 subseq 75497 len 1428 csum 0x8c8e], length 1428
17:16:41.513498 IP 112.26.0.8.57542 > 112.26.0.1.36177: Flags [.], ack 71213, win 3650, options [nop,nop,TS val 3065524 ecr 3285184,mptcp dss ack 1489249928], length 0
17:16:41.513743 IP 112.26.0.1.36177 > 112.26.0.8.57542: Flags [.], seq 81209:82637, ack 1, win 1339, options [nop,nop,TS val 3285914 ecr 3065524,mptcp dss ack 4086075562 seq 1489259924 subseq 81209 len 1428 csum 0x6ee0], length 1428
