17:16:35.754252 IP 112.26.0.8.57542 > 112.26.0.1.36177: Flags [S], seq 3938161819, win 65535, options [mss 1460,sackOK,TS val 3060063 ecr 0,nop,wscale 6,mptcp capable csum {0x3ec122e68ac9ec11}], length 0
17:16:35.762519 IP 112.26.0.8.57542 > 112.26.0.1.36177: Flags [S], seq 3938161819, win 65535, options [mss 1460,sackOK,TS val 3060063 ecr 0,nop,wscale 6,mptcp capable csum {0x3ec122e68ac9ec11}], length 0
17:16:35.763044 IP 112.26.0.8.57542 > 112.26.0.1.36177: Flags [S], seq 3938161819, win 65535, options [mss 1460,sackOK,TS val 3060063 ecr 0,nop,wscale 6,mptcp capable csum {0x3ec122e68ac9ec11}], length 0
17:16:35.779648 IP 112.26.0.1.36177 > 112.26.0.8.57542: Flags [S.], seq 1781188362, ack 3938161820, win 65535, options [mss 1460,sackOK,TS val 3280156 ecr 3060063,nop,wscale 6,mptcp capable csum {0x5d07cc395fa8dd93}], length 0
17:16:35.779959 IP 112.26.0.1.36177 > 112.26.0.8.57542: Flags [S.], seq 1781188362, ack 3938161820, win 65535, options [mss 1460,sackOK,TS val 3280156 ecr 3060063,nop,wscale 6,mptcp capable csum {0x5d07cc395fa8dd93}], length 0
17:16:35.783363 IP 112.26.0.8.57542 > 112.26.0.1.36177: Flags [.], ack 1, win 1369, options [nop,nop,TS val 3060180 ecr 3280156,mptcp capable csum {0x3ec122e68ac9ec11,0x5d07cc395fa8dd93},mptcp dss ack 1489178716], length 0
17:16:35.785514 IP 112.26.0.8.57542 > 112.26.0.1.36177: Flags [.], ack 1, win 1369, options [nop,nop,TS val 3060180 ecr 3280156,mptcp capable csum {0x3ec122e68ac9ec11,0x5d07cc395fa8dd93},mptcp dss ack 1489178716], length 0
17:16:35.788591 IP 112.26.0.8.57542 > 112.26.0.1.36177: Flags [.], ack 1, win 1369, options [nop,nop,TS val 3060180 ecr 3280156,mptcp capable csum {0x3ec122e68ac9ec11,0x5d07cc395fa8dd93},mptcp dss ack 1489178716], length 0
17:16:35.809119 IP 112.26.0.8.57542 > 112.26.0.1.36177: Flags [.], ack 1, win 1369, options [nop,nop,TS val 3060180 ecr 3280156,mptcp add-addr id 3 112.26.1.8,mptcp dss ack 1489178716], length 0
17:16:35.821275 IP 112.26.0.1.36177 > 112.26.0.8.57542: Flags [.], ack 1, win 1339, options [nop,nop,TS val 3280187 ecr 3060180,mptcp add-addr id 3 112.26.1.1,mptcp dss ack 4086075562], length 0
17:16:35.821558 IP 112.26.0.1.36177 > 112.26.0.8.57542: Flags [.], ack 1, win 1339, options [nop,nop,TS val 3280187 ecr 3060180,mptcp add-addr id 3 112.26.1.1,mptcp dss ack 4086075562], length 0
17:16:35.853033 IP 112.26.0.8.57542 > 112.26.0.1.36177: Flags [.], ack 1, win 1369, options [nop,nop,TS val 3060180 ecr 3280156,mptcp add-addr id 4 112.26.2.8,mptcp dss ack 1489178716], length 0
17:16:35.868892 IP 112.26.0.8.57542 > 112.26.0.1.36177: Flags [.], ack 1, win 1369, options [nop,nop,TS val 3060180 ecr 3280156,mptcp add-addr id 3 112.26.1.8,mptcp dss ack 1489178716], length 0
17:16:35.870811 IP 112.26.0.8.57542 > 112.26.0.1.36177: Flags [.], ack 1, win 1369, options [nop,nop,TS val 3060180 ecr 3280156,mptcp add-addr id 3 112.26.1.8,mptcp dss ack 1489178716], length 0
17:16:35.893939 IP 112.26.0.8.57542 > 112.26.0.1.36177: Flags [.], ack 1, win 1369, options [nop,nop,TS val 3060180 ecr 3280156,mptcp add-addr id 6 112.26.3.8,mptcp dss ack 1489178716], length 0
17:16:35.903725 IP 112.26.0.8.57542 > 112.26.0.1.36177: Flags [.], ack 1, win 1369, options [nop,nop,TS val 3060180 ecr 3280156,mptcp add-addr id 4 112.26.2.8,mptcp dss ack 1489178716], length 0
17:16:35.904970 IP 112.26.0.8.57542 > 112.26.0.1.36177: Flags [.], ack 1, win 1369, options [nop,nop,TS val 3060180 ecr 3280156,mptcp add-addr id 4 112.26.2.8,mptcp dss ack 1489178716], length 0
17:16:35.966932 IP 112.26.0.1.36177 > 112.26.0.8.57542: Flags [.], ack 1, win 1339, options [nop,nop,TS val 3280187 ecr 3060180,mptcp add-addr id 5 112.26.3.1,mptcp dss ack 4086075562], length 0
17:16:35.967139 IP 112.26.0.1.36177 > 112.26.0.8.57542: Flags [.], ack 1, win 1339, options [nop,nop,TS val 3280187 ecr 3060180,mptcp add-addr id 5 112.26.3.1,mptcp dss ack 4086075562], length 0
17:16:35.993961 IP 112.26.0.8.57542 > 112.26.0.1.36177: Flags [.], ack 1, win 1369, options [nop,nop,TS val 3060180 ecr 3280156,mptcp add-addr id 6 112.26.3.8,mptcp dss ack 1489178716], length 0
17:16:35.997972 IP 112.26.0.8.57542 > 112.26.0.1.36177: Flags [.], ack 1, win 1369, options [nop,nop,TS val 3060180 ecr 3280156,mptcp add-addr id 6 112.26.3.8,mptcp dss ack 1489178716], length 0
17:16:36.074354 IP 112.26.0.1.36177 > 112.26.0.8.57542: Flags [.], ack 1, win 1339, options [nop,nop,TS val 3280187 ecr 3060180,mptcp add-addr id 6 112.26.2.1,mptcp dss ack 4086075562], length 0
17:16:36.074573 IP 112.26.0.1.36177 > 112.26.0.8.57542: Flags [.], ack 1, win 1339, options [nop,nop,TS val 3280187 ecr 3060180,mptcp add-addr id 6 112.26.2.1,mptcp dss ack 4086075562], length 0
17:16:36.257352 IP 112.26.0.1.36177 > 112.26.0.8.57542: Flags [.], seq 1:1429, ack 1, win 1339, options [nop,nop,TS val 3280193 ecr 3060180,mptcp dss ack 4086075562 seq 1489178716 subseq 1 len 1428 csum 0x3694], length 1428
17:16:36.257705 IP 112.26.0.1.36177 > 112.26.0.8.57542: Flags [.], seq 1:1429, ack 1, win 1339, options [nop,nop,TS val 3280193 ecr 3060180,mptcp dss ack 4086075562 seq 1489178716 subseq 1 len 1428 csum 0x3694], length 1428
17:16:36.262303 IP 112.26.0.8.57542 > 112.26.0.1.36177: Flags [.], ack 1429, win 1415, options [nop,nop,TS val 3060658 ecr 3280193,mptcp dss ack 1489180144], length 0
17:16:36.281307 IP 112.26.0.8.57542 > 112.26.0.1.36177: Flags [.], ack 1429, win 1415, options [nop,nop,TS val 3060658 ecr 3280193,mptcp dss ack 1489180144], length 0
17:16:36.283900 IP 112.26.0.8.57542 > 112.26.0.1.36177: Flags [.], ack 1429, win 1415, options [nop,nop,TS val 3060658 ecr 3280193,mptcp dss ack 1489180144], length 0
17:16:36.294117 IP 112.26.0.1.36177 > 112.26.0.8.57542: Flags [.], seq 1429:2857, ack 1, win 1339, options [nop,nop,TS val 3280193 ecr 3060180,mptcp dss ack 4086075562 seq 1489180144 subseq 1429 len 1428 csum 0x55e2], length 1428
17:16:36.294326 IP 112.26.0.1.36177 > 112.26.0.8.57542: Flags [.], seq 1429:2857, ack 1, win 1339, options [nop,nop,TS val 3280193 ecr 3060180,mptcp dss ack 4086075562 seq 1489180144 subseq 1429 len 1428 csum 0x55e2], length 1428
17:16:36.304752 IP 112.26.0.8.57542 > 112.26.0.1.36177: Flags [.], ack 2857, win 1460, options [nop,nop,TS val 3060701 ecr 3280193,mptcp dss ack 1489181572], length 0
17:16:36.361239 IP 112.26.0.8.57542 > 112.26.0.1.36177: Flags [.], ack 2857, win 1460, options [nop,nop,TS val 3060701 ecr 3280193,mptcp dss ack 1489181572], length 0
17:16:36.362918 IP 112.26.0.8.57542 > 112.26.0.1.36177: Flags [.], ack 2857, win 1460, options [nop,nop,TS val 3060701 ecr 3280193,mptcp dss ack 1489181572], length 0
17:16:36.374358 IP 112.26.0.1.36177 > 112.26.0.8.57542: Flags [P.], seq 2857:4097, ack 1, win 1339, options [nop,nop,TS val 3280194 ecr 3060180,mptcp dss ack 4086075562 seq 1489181572 subseq 2857 len 1240 csum 0x96b4], length 1240
17:16:36.374575 IP 112.26.0.1.36177 > 112.26.0.8.57542: Flags [P.], seq 2857:4097, ack 1, win 1339, options [nop,nop,TS val 3280194 ecr 3060180,mptcp dss ack 4086075562 seq 1489181572 subseq 2857 len 1240 csum 0x96b4], length 1240
17:16:36.381900 IP 112.26.0.8.57542 > 112.26.0.1.36177: Flags [.], ack 4097, win 1506, options [nop,nop,TS val 3060778 ecr 3280194,mptcp dss ack 1489182812], length 0
17:16:36.391219 IP 112.26.0.8.57542 > 112.26.0.1.36177: Flags [.], ack 4097, win 1506, options [nop,nop,TS val 3060778 ecr 3280194,mptcp dss ack 1489182812], length 0
17:16:36.399484 IP 112.26.0.8.57542 > 112.26.0.1.36177: Flags [.], ack 4097, win 1506, options [nop,nop,TS val 3060778 ecr 3280194,mptcp dss ack 1489182812], length 0
17:16:36.462618 IP 112.26.0.1.36177 > 112.26.0.8.57542: Flags [.], seq 4097:5525, ack 1, win 1339, options [nop,nop,TS val 3280194 ecr 3060180,mptcp dss ack 4086075562 seq 1489182812 subseq 4097 len 1428 csum 0x8aed], length 1428
17:16:36.462856 IP 112.26.0.1.36177 > 112.26.0.8.57542: Flags [.], seq 4097:5525, ack 1, win 1339, options [nop,nop,TS val 3280194 ecr 3060180,mptcp dss ack 4086075562 seq 1489182812 subseq 4097 len 1428 csum 0x8aed], length 1428
17:16:36.469858 IP 112.26.0.8.57542 > 112.26.0.1.36177: Flags [.], ack 5525, win 1552, options [nop,nop,TS val 3060864 ecr 3280194,mptcp dss ack 1489184240], length 0
17:16:36.472013 IP 112.26.0.8.57542 > 112.26.0.1.36177: Flags [.], ack 5525, win 1552, options [nop,nop,TS val 3060864 ecr 3280194,mptcp dss ack 1489184240], length 0
17:16:36.477515 IP 112.26.0.8.57542 > 112.26.0.1.36177: Flags [.], ack 5525, win 1552, options [nop,nop,TS val 3060864 ecr 3280194,mptcp dss ack 1489184240], length 0
17:16:36.495216 IP 112.26.0.1.36177 > 112.26.0.8.57542: Flags [.], seq 5525:6953, ack 1, win 1339, options [nop,nop,TS val 3280194 ecr 3060180,mptcp dss ack 4086075562 seq 1489184240 subseq 5525 len 1428 csum 0xe762], length 1428
17:16:36.495428 IP 112.26.0.1.36177 > 112.26.0.8.57542: Flags [.], seq 5525:6953, ack 1, win 1339, options [nop,nop,TS val 3280194 ecr 3060180,mptcp dss ack 4086075562 seq 1489184240 subseq 5525 len 1428 csum 0xe762], length 1428
17:16:36.501851 IP 112.26.0.8.57542 > 112.26.0.1.36177: Flags [.], ack 6953, win 1597, options [nop,nop,TS val 3060897 ecr 3280194,mptcp dss ack 1489185668], length 0
17:16:36.504206 IP 112.26.0.8.57542 > 112.26.0.1.36177: Flags [.], ack 6953, win 1597, options [nop,nop,TS val 3060897 ecr 3280194,mptcp dss ack 1489185668], length 0
17:16:36.570312 IP 112.26.0.8.57542 > 112.26.0.1.36177: Flags [.], ack 6953, win 1597, options [nop,nop,TS val 3060897 ecr 3280194,mptcp dss ack 1489185668], length 0
17:16:36.665126 IP 112.26.0.1.36177 > 112.26.0.8.57542: Flags [.], seq 8381:9809, ack 1, win 1339, options [nop,nop,TS val 3280194 ecr 3060180,mptcp dss ack 4086075562 seq 1489187096 subseq 8381 len 1428 csum 0x50c1], length 1428
17:16:36.665335 IP 112.26.0.1.36177 > 112.26.0.8.57542: Flags [.], seq 8381:9809, ack 1, win 1339, options [nop,nop,TS val 3280194 ecr 3060180,mptcp dss ack 4086075562 seq 1489187096 subseq 8381 len 1428 csum 0x50c1], length 1428
17:16:36.668658 IP 112.26.0.8.57542 > 112.26.0.1.36177: Flags [.], ack 6953, win 1643, options [nop,nop,TS val 3061065 ecr 3280194,nop,nop,sack 1 {8381:9809},mptcp dss ack 1489185668], length 0
17:16:36.685562 IP 112.26.0.1.36177 > 112.26.0.8.57542: Flags [.], seq 9809:11237, ack 1, win 1339, options [nop,nop,TS val 3280194 ecr 3060180,mptcp dss ack 4086075562 seq 1489188524 subseq 9809 len 1428 csum 0x492d], length 1428
17:16:36.685746 IP 112.26.0.1.36177 > 112.26.0.8.57542: Flags [.], seq 9809:11237, ack 1, win 1339, options [nop,nop,TS val 3280194 ecr 3060180,mptcp dss ack 4086075562 seq 1489188524 subseq 9809 len 1428 csum 0x492d], length 1428
17:16:36.761843 IP 112.26.0.8.57542 > 112.26.0.1.36177: Flags [.], ack 6953, win 1689, options [nop,nop,TS val 3061085 ecr 3280194,nop,nop,sack 1 {8381:11237},mptcp dss ack 1489185668], length 0
17:16:36.769596 IP 112.26.0.8.57542 > 112.26.0.1.36177: Flags [.], ack 6953, win 1643, options [nop,nop,TS val 3061065 ecr 3280194,nop,nop,sack 1 {8381:9809},mptcp dss ack 1489185668], length 0
17:16:36.772399 IP 112.26.0.8.57542 > 112.26.0.1.36177: Flags [.], ack 6953, win 1643, options [nop,nop,TS val 3061065 ecr 3280194,nop,nop,sack 1 {8381:9809},mptcp dss ack 1489185668], length 0
17:16:36.785871 IP 112.26.0.1.36177 > 112.26.0.8.57542: Flags [.], seq 12665:14093, ack 1, win 1339, options [nop,nop,TS val 3280257 ecr 3060180,mptcp dss ack 4086075562 seq 1489191380 subseq 12665 len 1428 csum 0xbab0], length 1428
17:16:36.786038 IP 112.26.0.1.36177 > 112.26.0.8.57542: Flags [.], seq 12665:14093, ack 1, win 1339, options [nop,nop,TS val 3280257 ecr 3060180,mptcp dss ack 4086075562 seq 1489191380 subseq 12665 len 1428 csum 0xbab0], length 1428
17:16:36.791363 IP 112.26.0.8.57542 > 112.26.0.1.36177: Flags [.], ack 6953, win 1689, options [nop,nop,TS val 3061085 ecr 3280194,nop,nop,sack 1 {8381:11237},mptcp dss ack 1489185668], length 0
17:16:36.793497 IP 112.26.0.8.57542 > 112.26.0.1.36177: Flags [.], ack 6953, win 1689, options [nop,nop,TS val 3061085 ecr 3280194,nop,nop,sack 1 {8381:11237},mptcp dss ack 1489185668], length 0
17:16:36.859281 IP 112.26.0.8.57542 > 112.26.0.1.36177: Flags [.], ack 6953, win 1734, options [nop,nop,TS val 3061199 ecr 3280194,nop,nop,sack 2 {12665:14093}{8381:11237},mptcp dss ack 1489185668], length 0
17:16:36.871699 IP 112.26.0.1.36177 > 112.26.0.8.57542: Flags [.], seq 14093:15521, ack 1, win 1339, options [nop,nop,TS val 3280684 ecr 3060658,mptcp dss ack 4086075562 seq 1489192808 subseq 14093 len 1428 csum 0xd4a], length 1428
17:16:36.871906 IP 112.26.0.1.36177 > 112.26.0.8.57542: Flags [.], seq 14093:15521, ack 1, win 1339, options [nop,nop,TS val 3280684 ecr 3060658,mptcp dss ack 4086075562 seq 1489192808 subseq 14093 len 1428 csum 0xd4a], length 1428
17:16:36.880896 IP 112.26.0.8.57542 > 112.26.0.1.36177: Flags [.], ack 6953, win 1780, options [nop,nop,TS val 3061273 ecr 3280194,nop,nop,sack 2 {12665:15521}{8381:11237},mptcp dss ack 1489185668], length 0
17:16:36.894611 IP 112.26.0.8.57542 > 112.26.0.1.36177: Flags [.], ack 6953, win 1734, options [nop,nop,TS val 3061199 ecr 3280194,nop,nop,sack 2 {12665:14093}{8381:11237},mptcp dss ack 1489185668], length 0
17:16:36.900512 IP 112.26.0.8.57542 > 112.26.0.1.36177: Flags [.], ack 6953, win 1734, options [nop,nop,TS val 3061199 ecr 3280194,nop,nop,sack 2 {12665:14093}{8381:11237},mptcp dss ack 1489185668], length 0
17:16:36.964133 IP 112.26.0.8.57542 > 112.26.0.1.36177: Flags [.], ack 6953, win 1780, options [nop,nop,TS val 3061273 ecr 3280194,nop,nop,sack 2 {12665:15521}{8381:11237},mptcp dss ack 1489185668], length 0
17:16:36.989231 IP 112.26.0.8.57542 > 112.26.0.1.36177: Flags [.], ack 6953, win 1780, options [nop,nop,TS val 3061273 ecr 3280194,nop,nop,sack 2 {12665:15521}{8381:11237},mptcp dss ack 1489185668], length 0
17:16:36.997256 IP 112.26.0.1.36177 > 112.26.0.8.57542: Flags [.], seq 18377:19805, ack 1, win 1339, options [nop,nop,TS val 3280877 ecr 3060864,mptcp dss ack 4086075562 seq 1489197092 subseq 18377 len 1428 csum 0x6b45], length 1428
17:16:36.997467 IP 112.26.0.1.36177 > 112.26.0.8.57542: Flags [.], seq 18377:19805, ack 1, win 1339, options [nop,nop,TS val 3280877 ecr 3060864,mptcp dss ack 4086075562 seq 1489197092 subseq 18377 len 1428 csum 0x6b45], length 1428
17:16:37.001127 IP 112.26.0.8.57542 > 112.26.0.1.36177: Flags [.], ack 6953, win 1825, options [nop,nop,TS val 3061397 ecr 3280194,nop,nop,sack 2 {18377:19805}{12665:15521},mptcp dss ack 1489185668], length 0
17:16:37.071796 IP 112.26.0.1.36177 > 112.26.0.8.57542: Flags [.], seq 19805:21233, ack 1, win 1339, options [nop,nop,TS val 3280970 ecr 3060897,mptcp dss ack 4086075562 seq 1489198520 subseq 19805 len 1428 csum 0x2ae7], length 1428
17:16:37.072063 IP 112.26.0.1.36177 > 112.26.0.8.57542: Flags [.], seq 19805:21233, ack 1, win 1339, options [nop,nop,TS val 3280970 ecr 3060897,mptcp dss ack 4086075562 seq 1489198520 subseq 19805 len 1428 csum 0x2ae7], length 1428
17:16:37.092026 IP 112.26.0.8.57542 > 112.26.0.1.36177: Flags [.], ack 6953, win 1825, options [nop,nop,TS val 3061397 ecr 3280194,nop,nop,sack 2 {18377:19805}{12665:15521},mptcp dss ack 1489185668], length 0
17:16:37.093259 IP 112.26.0.8.57542 > 112.26.0.1.36177: Flags [.], ack 6953, win 1825, options [nop,nop,TS val 3061397 ecr 3280194,nop,nop,sack 2 {18377:19805}{12665:15521},mptcp dss ack 1489185668], length 0
17:16:37.099504 IP 112.26.0.1.36177 > 112.26.0.8.57542: Flags [.], seq 21233:22661, ack 1, win 1339, options [nop,nop,TS val 3281193 ecr 3061065,mptcp dss ack 4086075562 seq 1489199948 subseq 21233 len 1428 csum 0x73e7], length 1428
17:16:37.099693 IP 112.26.0.1.36177 > 112.26.0.8.57542: Flags [.], seq 21233:22661, ack 1, win 1339, options [nop,nop,TS val 3281193 ecr 3061065,mptcp dss ack 4086075562 seq 1489199948 subseq 21233 len 1428 csum 0x73e7], length 1428
17:16:37.173617 IP 112.26.0.8.57542 > 112.26.0.1.36177: Flags [.], ack 6953, win 1871, options [nop,nop,TS val 3061569 ecr 3280194,nop,nop,sack 2 {18377:21233}{12665:15521},mptcp dss ack 1489185668], length 0
17:16:37.183952 IP 112.26.0.1.36177 > 112.26.0.8.57542: Flags [.], seq 22661:24089, ack 1, win 1339, options [nop,nop,TS val 3281300 ecr 3061085,mptcp dss ack 4086075562 seq 1489201376 subseq 22661 len 1428 csum 0xd081], length 1428
17:16:37.184156 IP 112.26.0.1.36177 > 112.26.0.8.57542: Flags [.], seq 22661:24089, ack 1, win 1339, options [nop,nop,TS val 3281300 ecr 3061085,mptcp dss ack 4086075562 seq 1489201376 subseq 22661 len 1428 csum 0xd081], length 1428
17:16:37.270202 IP 112.26.0.8.57542 > 112.26.0.1.36177: Flags [.], ack 6953, win 1871, options [nop,nop,TS val 3061569 ecr 3280194,nop,nop,sack 2 {18377:21233}{12665:15521},mptcp dss ack 1489185668], length 0
17:16:37.273178 IP 112.26.0.8.57542 > 112.26.0.1.36177: Flags [.], ack 6953, win 1871, options [nop,nop,TS val 3061569 ecr 3280194,nop,nop,sack 2 {18377:21233}{12665:15521},mptcp dss ack 1489185668], length 0
17:16:37.289282 IP 112.26.0.1.36177 > 112.26.0.8.57542: Flags [.], seq 6953:8381, ack 1, win 1339, options [nop,nop,TS val 3281300 ecr 3061199,mptcp dss ack 4086075562 seq 1489185668 subseq 6953 len 1428 csum 0x812f], length 1428
17:16:37.289502 IP 112.26.0.1.36177 > 112.26.0.8.57542: Flags [.], seq 6953:8381, ack 1, win 1339, options [nop,nop,TS val 3281300 ecr 3061199,mptcp dss ack 4086075562 seq 1489185668 subseq 6953 len 1428 csum 0x812f], length 1428
17:16:37.297968 IP 112.26.0.8.57542 > 112.26.0.1.36177: Flags [.], ack 6953, win 1917, options [nop,nop,TS val 3061693 ecr 3280194,nop,nop,sack 2 {18377:22661}{12665:15521},mptcp dss ack 1489185668], length 0
17:16:37.308302 IP 112.26.0.1.36177 > 112.26.0.8.57542: Flags [.], seq 11237:12665, ack 1, win 1339, options [nop,nop,TS val 3281493 ecr 3061397,mptcp dss ack 4086075562 seq 1489189952 subseq 11237 len 1428 csum 0x78b3], length 1428
17:16:37.308536 IP 112.26.0.1.36177 > 112.26.0.8.57542: Flags [.], seq 11237:12665, ack 1, win 1339, options [nop,nop,TS val 3281493 ecr 3061397,mptcp dss ack 4086075562 seq 1489189952 subseq 11237 len 1428 csum 0x78b3], length 1428
17:16:37.373951 IP 112.26.0.8.57542 > 112.26.0.1.36177: Flags [.], ack 6953, win 1917, options [nop,nop,TS val 3061693 ecr 3280194,nop,nop,sack 2 {18377:22661}{12665:15521},mptcp dss ack 1489185668], length 0
17:16:37.375634 IP 112.26.0.8.57542 > 112.26.0.1.36177: Flags [.], ack 6953, win 1917, options [nop,nop,TS val 3061693 ecr 3280194,nop,nop,sack 2 {18377:22661}{12665:15521},mptcp dss ack 1489185668], length 0
17:16:37.385111 IP 112.26.0.8.57542 > 112.26.0.1.36177: Flags [.], ack 6953, win 1962, options [nop,nop,TS val 3061780 ecr 3280194,nop,nop,sack 2 {18377:24089}{12665:15521},mptcp dss ack 1489185668], length 0
17:16:37.417090 IP 112.26.0.8.57542 > 112.26.0.1.36177: Flags [.], ack 11237, win 2008, options [nop,nop,TS val 3061813 ecr 3281300,nop,nop,sack 2 {18377:24089}{12665:15521},mptcp dss ack 1489189952], length 0
17:16:37.468951 IP 112.26.0.1.36177 > 112.26.0.8.57542: Flags [.], seq 15521:16949, ack 1, win 1339, options [nop,nop,TS val 3281673 ecr 3061569,mptcp dss ack 4086075562 seq 1489194236 subseq 15521 len 1428 csum 0x78a5], length 1428
17:16:37.469239 IP 112.26.0.1.36177 > 112.26.0.8.57542: Flags [.], seq 15521:16949, ack 1, win 1339, options [nop,nop,TS val 3281673 ecr 3061569,mptcp dss ack 4086075562 seq 1489194236 subseq 15521 len 1428 csum 0x78a5], length 1428
17:16:37.475514 IP 112.26.0.8.57542 > 112.26.0.1.36177: Flags [.], ack 6953, win 1962, options [nop,nop,TS val 3061780 ecr 3280194,nop,nop,sack 2 {18377:24089}{12665:15521},mptcp dss ack 1489185668], length 0
17:16:37.477432 IP 112.26.0.8.57542 > 112.26.0.1.36177: Flags [.], ack 6953, win 1962, options [nop,nop,TS val 3061780 ecr 3280194,nop,nop,sack 2 {18377:24089}{12665:15521},mptcp dss ack 1489185668], length 0
17:16:37.494633 IP 112.26.0.8.57542 > 112.26.0.1.36177: Flags [.], ack 15521, win 2054, options [nop,nop,TS val 3061889 ecr 3281493,nop,nop,sack 1 {18377:24089},mptcp dss ack 1489194236], length 0
17:16:37.495659 IP 112.26.0.8.57542 > 112.26.0.1.36177: Flags [.], ack 11237, win 2008, options [nop,nop,TS val 3061813 ecr 3281300,nop,nop,sack 2 {18377:24089}{12665:15521},mptcp dss ack 1489189952], length 0
17:16:37.504216 IP 112.26.0.8.57542 > 112.26.0.1.36177: Flags [.], ack 11237, win 2008, options [nop,nop,TS val 3061813 ecr 3281300,nop,nop,sack 2 {18377:24089}{12665:15521},mptcp dss ack 1489189952], length 0
17:16:37.571484 IP 112.26.0.8.57542 > 112.26.0.1.36177: Flags [.], ack 15521, win 2054, options [nop,nop,TS val 3061889 ecr 3281493,nop,nop,sack 1 {18377:24089},mptcp dss ack 1489194236], length 0
17:16:37.575352 IP 112.26.0.8.57542 > 112.26.0.1.36177: Flags [.], ack 16949, win 2099, options [nop,nop,TS val 3061966 ecr 3281673,nop,nop,sack 1 {18377:24089},mptcp dss ack 1489195664], length 0
17:16:37.586075 IP 112.26.0.1.36177 > 112.26.0.8.57542: Flags [.], seq 16949:18377, ack 1, win 1339, options [nop,nop,TS val 3281774 ecr 3061693,mptcp dss ack 4086075562 seq 1489195664 subseq 16949 len 1428 csum 0x61f9], length 1428
17:16:37.586295 IP 112.26.0.1.36177 > 112.26.0.8.57542: Flags [.], seq 16949:18377, ack 1, win 1339, options [nop,nop,TS val 3281774 ecr 3061693,mptcp dss ack 4086075562 seq 1489195664 subseq 16949 len 1428 csum 0x61f9], length 1428
17:16:37.591848 IP 112.26.0.8.57542 > 112.26.0.1.36177: Flags [.], ack 15521, win 2054, options [nop,nop,TS val 3061889 ecr 3281493,nop,nop,sack 1 {18377:24089},mptcp dss ack 1489194236], length 0
17:16:37.602539 IP 112.26.0.8.57542 > 112.26.0.1.36177: Flags [.], ack 16949, win 2099, options [nop,nop,TS val 3061966 ecr 3281673,nop,nop,sack 1 {18377:24089},mptcp dss ack 1489195664], length 0
17:16:37.609464 IP 112.26.0.8.57542 > 112.26.0.1.36177: Flags [.], ack 16949, win 2099, options [nop,nop,TS val 3061966 ecr 3281673,nop,nop,sack 1 {18377:24089},mptcp dss ack 1489195664], length 0
17:16:37.669121 IP 112.26.0.8.57542 > 112.26.0.1.36177: Flags [.], ack 24089, win 2145, options [nop,nop,TS val 3062066 ecr 3281774,mptcp dss ack 1489202804], length 0
17:16:37.677739 IP 112.26.0.8.57542 > 112.26.0.1.36177: Flags [.], ack 24089, win 2145, options [nop,nop,TS val 3062066 ecr 3281774,mptcp dss ack 1489202804], length 0
17:16:37.684701 IP 112.26.0.1.36177 > 112.26.0.8.57542: Flags [.], seq 24089:25517, ack 1, win 1339, options [nop,nop,TS val 3281900 ecr 3061780,mptcp dss ack 4086075562 seq 1489202804 subseq 24089 len 1428 csum 0x6850], length 1428
17:16:37.684953 IP 112.26.0.1.36177 > 112.26.0.8.57542: Flags [.], seq 24089:25517, ack 1, win 1339, options [nop,nop,TS val 3281900 ecr 3061780,mptcp dss ack 4086075562 seq 1489202804 subseq 24089 len 1428 csum 0x6850], length 1428
17:16:37.699066 IP 112.26.0.8.57542 > 112.26.0.1.36177: Flags [.], ack 24089, win 2145, options [nop,nop,TS val 3062066 ecr 3281774,mptcp dss ack 1489202804], length 0
17:16:37.710068 IP 112.26.0.8.57542 > 112.26.0.1.36177: Flags [.], ack 25517, win 2190, options [nop,nop,TS val 3062104 ecr 3281900,mptcp dss ack 1489204232], length 0
17:16:37.711341 IP 112.26.0.8.57542 > 112.26.0.1.36177: Flags [.], ack 25517, win 2190, options [nop,nop,TS val 3062104 ecr 3281900,mptcp dss ack 1489204232], length 0
17:16:37.771551 IP 112.26.0.1.36177 > 112.26.0.8.57542: Flags [.], seq 25517:26945, ack 1, win 1339, options [nop,nop,TS val 3281900 ecr 3061813,mptcp dss ack 4086075562 seq 1489204232 subseq 25517 len 1428 csum 0x824e], length 1428
17:16:37.771810 IP 112.26.0.1.36177 > 112.26.0.8.57542: Flags [.], seq 25517:26945, ack 1, win 1339, options [nop,nop,TS val 3281900 ecr 3061813,mptcp dss ack 4086075562 seq 1489204232 subseq 25517 len 1428 csum 0x824e], length 1428
17:16:37.776216 IP 112.26.0.8.57542 > 112.26.0.1.36177: Flags [.], ack 25517, win 2190, options [nop,nop,TS val 3062104 ecr 3281900,mptcp dss ack 1489204232], length 0
17:16:37.800670 IP 112.26.0.8.57542 > 112.26.0.1.36177: Flags [.], ack 26945, win 2236, options [nop,nop,TS val 3062197 ecr 3281900,mptcp dss ack 1489205660], length 0
17:16:37.802880 IP 112.26.0.8.57542 > 112.26.0.1.36177: Flags [.], ack 26945, win 2236, options [nop,nop,TS val 3062197 ecr 3281900,mptcp dss ack 1489205660], length 0
17:16:37.806433 IP 112.26.0.8.57542 > 112.26.0.1.36177: Flags [.], ack 26945, win 2236, options [nop,nop,TS val 3062197 ecr 3281900,mptcp dss ack 1489205660], length 0
17:16:37.807463 IP 112.26.0.1.36177 > 112.26.0.8.57542: Flags [.], seq 26945:28373, ack 1, win 1339, options [nop,nop,TS val 3281900 ecr 3061813,mptcp dss ack 4086075562 seq 1489205660 subseq 26945 len 1428 csum 0x84b], length 1428
17:16:37.807626 IP 112.26.0.1.36177 > 112.26.0.8.57542: Flags [.], seq 26945:28373, ack 1, win 1339, options [nop,nop,TS val 3281900 ecr 3061813,mptcp dss ack 4086075562 seq 1489205660 subseq 26945 len 1428 csum 0x84b], length 1428
17:16:37.890355 IP 112.26.0.8.57542 > 112.26.0.1.36177: Flags [.], ack 28373, win 2282, options [nop,nop,TS val 3062287 ecr 3281900,mptcp dss ack 1489207088], length 0
17:16:37.893409 IP 112.26.0.8.57542 > 112.26.0.1.36177: Flags [.], ack 28373, win 2282, options [nop,nop,TS val 3062287 ecr 3281900,mptcp dss ack 1489207088], length 0
17:16:37.895383 IP 112.26.0.8.57542 > 112.26.0.1.36177: Flags [.], ack 28373, win 2282, options [nop,nop,TS val 3062287 ecr 3281900,mptcp dss ack 1489207088], length 0
17:16:37.901019 IP 112.26.0.1.36177 > 112.26.0.8.57542: Flags [.], seq 28373:29801, ack 1, win 1339, options [nop,nop,TS val 3281900 ecr 3061813,mptcp dss ack 4086075562 seq 1489207088 subseq 28373 len 1428 csum 0x14a8], length 1428
17:16:37.901193 IP 112.26.0.1.36177 > 112.26.0.8.57542: Flags [.], seq 28373:29801, ack 1, win 1339, options [nop,nop,TS val 3281900 ecr 3061813,mptcp dss ack 4086075562 seq 1489207088 subseq 28373 len 1428 csum 0x14a8], length 1428
17:16:37.978314 IP 112.26.0.8.57542 > 112.26.0.1.36177: Flags [.], ack 29801, win 2327, options [nop,nop,TS val 3062375 ecr 3281900,mptcp dss ack 1489208516], length 0
17:16:37.981738 IP 112.26.0.8.57542 > 112.26.0.1.36177: Flags [.], ack 29801, win 2327, options [nop,nop,TS val 3062375 ecr 3281900,mptcp dss ack 1489208516], length 0
17:16:37.986548 IP 112.26.0.8.57542 > 112.26.0.1.36177: Flags [.], ack 29801, win 2327, options [nop,nop,TS val 3062375 ecr 3281900,mptcp dss ack 1489208516], length 0
17:16:37.990374 IP 112.26.0.1.36177 > 112.26.0.8.57542: Flags [.], seq 29801:31229, ack 1, win 1339, options [nop,nop,TS val 3281992 ecr 3061889,mptcp dss ack 4086075562 seq 1489208516 subseq 29801 len 1428 csum 0x3a49], length 1428
17:16:37.990597 IP 112.26.0.1.36177 > 112.26.0.8.57542: Flags [.], seq 29801:31229, ack 1, win 1339, options [nop,nop,TS val 3281992 ecr 3061889,mptcp dss ack 4086075562 seq 1489208516 subseq 29801 len 1428 csum 0x3a49], length 1428
17:16:38.068799 IP 112.26.0.8.57542 > 112.26.0.1.36177: Flags [.], ack 31229, win 2373, options [nop,nop,TS val 3062415 ecr 3281992,mptcp dss ack 1489209944], length 0
17:16:38.072239 IP 112.26.0.8.57542 > 112.26.0.1.36177: Flags [.], ack 31229, win 2373, options [nop,nop,TS val 3062415 ecr 3281992,mptcp dss ack 1489209944], length 0
17:16:38.081743 IP 112.26.0.8.57542 > 112.26.0.1.36177: Flags [.], ack 31229, win 2373, options [nop,nop,TS val 3062415 ecr 3281992,mptcp dss ack 1489209944], length 0
17:16:38.091465 IP 112.26.0.1.36177 > 112.26.0.8.57542: Flags [.], seq 31229:32657, ack 1, win 1339, options [nop,nop,TS val 3282009 ecr 3061966,mptcp dss ack 4086075562 seq 1489209944 subseq 31229 len 1428 csum 0x2d89], length 1428
17:16:38.091671 IP 112.26.0.1.36177 > 112.26.0.8.57542: Flags [.], seq 31229:32657, ack 1, win 1339, options [nop,nop,TS val 3282009 ecr 3061966,mptcp dss ack 4086075562 seq 1489209944 subseq 31229 len 1428 csum 0x2d89], length 1428
17:16:38.184271 IP 112.26.0.1.36177 > 112.26.0.8.57542: Flags [.], seq 32657:34085, ack 1, win 1339, options [nop,nop,TS val 3282099 ecr 3062066,mptcp dss ack 4086075562 seq 1489211372 subseq 32657 len 1428 csum 0xa933], length 1428
17:16:38.184462 IP 112.26.0.1.36177 > 112.26.0.8.57542: Flags [.], seq 32657:34085, ack 1, win 1339, options [nop,nop,TS val 3282099 ecr 3062066,mptcp dss ack 4086075562 seq 1489211372 subseq 32657 len 1428 csum 0xa933], length 1428
17:16:38.200531 IP 112.26.0.8.57542 > 112.26.0.1.36177: Flags [.], ack 32657, win 2419, options [nop,nop,TS val 3062596 ecr 3282009,mptcp dss ack 1489211372], length 0
17:16:38.201804 IP 112.26.0.8.57542 > 112.26.0.1.36177: Flags [.], ack 32657, win 2419, options [nop,nop,TS val 3062596 ecr 3282009,mptcp dss ack 1489211372], length 0
17:16:38.208424 IP 112.26.0.1.36177 > 112.26.0.8.57542: Flags [.], seq 38369:39797, ack 1, win 1339, options [nop,nop,TS val 3282295 ecr 3062287,mptcp dss ack 4086075562 seq 1489217084 subseq 38369 len 1428 csum 0x9542], length 1428
17:16:38.208625 IP 112.26.0.1.36177 > 112.26.0.8.57542: Flags [.], seq 38369:39797, ack 1, win 1339, options [nop,nop,TS val 3282295 ecr 3062287,mptcp dss ack 4086075562 seq 1489217084 subseq 38369 len 1428 csum 0x9542], length 1428
17:16:38.282267 IP 112.26.0.8.57542 > 112.26.0.1.36177: Flags [.], ack 34085, win 2464, options [nop,nop,TS val 3062678 ecr 3282099,mptcp dss ack 1489212800], length 0
17:16:38.288215 IP 112.26.0.8.57542 > 112.26.0.1.36177: Flags [.], ack 34085, win 2464, options [nop,nop,TS val 3062678 ecr 3282099,mptcp dss ack 1489212800], length 0
17:16:38.295072 IP 112.26.0.1.36177 > 112.26.0.8.57542: Flags [.], seq 34085:35513, ack 1, win 1339, options [nop,nop,TS val 3282176 ecr 3062104,mptcp dss ack 4086075562 seq 1489212800 subseq 34085 len 1428 csum 0xca24], length 1428
17:16:38.295280 IP 112.26.0.1.36177 > 112.26.0.8.57542: Flags [.], seq 34085:35513, ack 1, win 1339, options [nop,nop,TS val 3282176 ecr 3062104,mptcp dss ack 4086075562 seq 1489212800 subseq 34085 len 1428 csum 0xca24], length 1428
17:16:38.299864 IP 112.26.0.8.57542 > 112.26.0.1.36177: Flags [.], ack 32657, win 2419, options [nop,nop,TS val 3062596 ecr 3282009,mptcp dss ack 1489211372], length 0
17:16:38.312711 IP 112.26.0.8.57542 > 112.26.0.1.36177: Flags [.], ack 34085, win 2510, options [nop,nop,TS val 3062708 ecr 3282099,nop,nop,sack 1 {38369:39797},mptcp dss ack 1489212800], length 0
17:16:38.319225 IP 112.26.0.8.57542 > 112.26.0.1.36177: Flags [.], ack 34085, win 2510, options [nop,nop,TS val 3062708 ecr 3282099,nop,nop,sack 1 {38369:39797},mptcp dss ack 1489212800], length 0
17:16:38.392505 IP 112.26.0.1.36177 > 112.26.0.8.57542: Flags [.], seq 35513:36941, ack 1, win 1339, options [nop,nop,TS val 3282204 ecr 3062197,mptcp dss ack 4086075562 seq 1489214228 subseq 35513 len 1428 csum 0xb6c9], length 1428
17:16:38.392727 IP 112.26.0.1.36177 > 112.26.0.8.57542: Flags [.], seq 35513:36941, ack 1, win 1339, options [nop,nop,TS val 3282204 ecr 3062197,mptcp dss ack 4086075562 seq 1489214228 subseq 35513 len 1428 csum 0xb6c9], length 1428
17:16:38.395342 IP 112.26.0.8.57542 > 112.26.0.1.36177: Flags [.], ack 34085, win 2464, options [nop,nop,TS val 3062678 ecr 3282099,mptcp dss ack 1489212800], length 0
17:16:38.398175 IP 112.26.0.8.57542 > 112.26.0.1.36177: Flags [.], ack 35513, win 2555, options [nop,nop,TS val 3062778 ecr 3282176,nop,nop,sack 1 {38369:39797},mptcp dss ack 1489214228], length 0
17:16:38.405259 IP 112.26.0.8.57542 > 112.26.0.1.36177: Flags [.], ack 35513, win 2555, options [nop,nop,TS val 3062778 ecr 3282176,nop,nop,sack 1 {38369:39797},mptcp dss ack 1489214228], length 0
17:16:38.485694 IP 112.26.0.8.57542 > 112.26.0.1.36177: Flags [.], ack 36941, win 2601, options [nop,nop,TS val 3062808 ecr 3282204,nop,nop,sack 1 {38369:39797},mptcp dss ack 1489215656], length 0
17:16:38.487817 IP 112.26.0.8.57542 > 112.26.0.1.36177: Flags [.], ack 36941, win 2601, options [nop,nop,TS val 3062808 ecr 3282204,nop,nop,sack 1 {38369:39797},mptcp dss ack 1489215656], length 0
17:16:38.501111 IP 112.26.0.1.36177 > 112.26.0.8.57542: Flags [.], seq 39797:41225, ack 1, win 1339, options [nop,nop,TS val 3282386 ecr 3062375,mptcp dss ack 4086075562 seq 1489218512 subseq 39797 len 1428 csum 0x61a5], length 1428
17:16:38.501333 IP 112.26.0.1.36177 > 112.26.0.8.57542: Flags [.], seq 39797:41225, ack 1, win 1339, options [nop,nop,TS val 3282386 ecr 3062375,mptcp dss ack 4086075562 seq 1489218512 subseq 39797 len 1428 csum 0x61a5], length 1428
17:16:38.508141 IP 112.26.0.8.57542 > 112.26.0.1.36177: Flags [.], ack 36941, win 2647, options [nop,nop,TS val 3062900 ecr 3282204,nop,nop,sack 1 {38369:41225},mptcp dss ack 1489215656], length 0
17:16:38.572539 IP 112.26.0.1.36177 > 112.26.0.8.57542: Flags [.], seq 36941:38369, ack 1, win 1339, options [nop,nop,TS val 3282204 ecr 3062197,mptcp dss ack 4086075562 seq 1489215656 subseq 36941 len 1428 csum 0xf3d], length 1428
17:16:38.572821 IP 112.26.0.1.36177 > 112.26.0.8.57542: Flags [.], seq 36941:38369, ack 1, win 1339, options [nop,nop,TS val 3282204 ecr 3062197,mptcp dss ack 4086075562 seq 1489215656 subseq 36941 len 1428 csum 0xf3d], length 1428
17:16:38.573960 IP 112.26.0.8.57542 > 112.26.0.1.36177: Flags [.], ack 36941, win 2647, options [nop,nop,TS val 3062900 ecr 3282204,nop,nop,sack 1 {38369:41225},mptcp dss ack 1489215656], length 0
17:16:38.587520 IP 112.26.0.8.57542 > 112.26.0.1.36177: Flags [.], ack 41225, win 2692, options [nop,nop,TS val 3062984 ecr 3282204,mptcp dss ack 1489219940], length 0
17:16:38.592913 IP 112.26.0.1.36177 > 112.26.0.8.57542: Flags [.], seq 41225:42653, ack 1, win 1339, options [nop,nop,TS val 3282482 ecr 3062415,mptcp dss ack 4086075562 seq 1489219940 subseq 41225 len 1428 csum 0x5ade], length 1428
17:16:38.593144 IP 112.26.0.1.36177 > 112.26.0.8.57542: Flags [.], seq 41225:42653, ack 1, win 1339, options [nop,nop,TS val 3282482 ecr 3062415,mptcp dss ack 4086075562 seq 1489219940 subseq 41225 len 1428 csum 0x5ade], length 1428
17:16:38.607002 IP 112.26.0.8.57542 > 112.26.0.1.36177: Flags [.], ack 41225, win 2692, options [nop,nop,TS val 3062984 ecr 3282204,mptcp dss ack 1489219940], length 0
17:16:38.615390 IP 112.26.0.8.57542 > 112.26.0.1.36177: Flags [.], ack 34085, win 2510, options [nop,nop,TS val 3062708 ecr 3282099,nop,nop,sack 1 {38369:39797},mptcp dss ack 1489212800], length 0
17:16:38.682965 IP 112.26.0.8.57542 > 112.26.0.1.36177: Flags [.], ack 42653, win 2738, options [nop,nop,TS val 3063079 ecr 3282482,mptcp dss ack 1489221368], length 0
17:16:38.697680 IP 112.26.0.1.36177 > 112.26.0.8.57542: Flags [.], seq 42653:44081, ack 1, win 1339, options [nop,nop,TS val 3282700 ecr 3062596,mptcp dss ack 4086075562 seq 1489221368 subseq 42653 len 1428 csum 0x7a7c], length 1428
17:16:38.697911 IP 112.26.0.1.36177 > 112.26.0.8.57542: Flags [.], seq 42653:44081, ack 1, win 1339, options [nop,nop,TS val 3282700 ecr 3062596,mptcp dss ack 4086075562 seq 1489221368 subseq 42653 len 1428 csum 0x7a7c], length 1428
17:16:38.706410 IP 112.26.0.8.57542 > 112.26.0.1.36177: Flags [.], ack 42653, win 2738, options [nop,nop,TS val 3063079 ecr 3282482,mptcp dss ack 1489221368], length 0
17:16:38.719851 IP 112.26.0.8.57542 > 112.26.0.1.36177: Flags [.], ack 44081, win 2784, options [nop,nop,TS val 3063113 ecr 3282700,mptcp dss ack 1489222796], length 0
17:16:38.778659 IP 112.26.0.8.57542 > 112.26.0.1.36177: Flags [.], ack 44081, win 2784, options [nop,nop,TS val 3063113 ecr 3282700,mptcp dss ack 1489222796], length 0
17:16:38.782703 IP 112.26.0.8.57542 > 112.26.0.1.36177: Flags [.], ack 35513, win 2555, options [nop,nop,TS val 3062778 ecr 3282176,nop,nop,sack 1 {38369:39797},mptcp dss ack 1489214228], length 0
17:16:38.880501 IP 112.26.0.1.36177 > 112.26.0.8.57542: Flags [.], seq 44081:45509, ack 1, win 1339, options [nop,nop,TS val 3282700 ecr 3062596,mptcp dss ack 4086075562 seq 1489222796 subseq 44081 len 1428 csum 0x6b22], length 1428
17:16:38.880767 IP 112.26.0.1.36177 > 112.26.0.8.57542: Flags [.], seq 44081:45509, ack 1, win 1339, options [nop,nop,TS val 3282700 ecr 3062596,mptcp dss ack 4086075562 seq 1489222796 subseq 44081 len 1428 csum 0x6b22], length 1428
17:16:38.885905 IP 112.26.0.8.57542 > 112.26.0.1.36177: Flags [.], ack 45509, win 2829, options [nop,nop,TS val 3063281 ecr 3282700,mptcp dss ack 1489224224], length 0
17:16:38.888848 IP 112.26.0.8.57542 > 112.26.0.1.36177: Flags [.], ack 45509, win 2829, options [nop,nop,TS val 3063281 ecr 3282700,mptcp dss ack 1489224224], length 0
17:16:38.900348 IP 112.26.0.1.36177 > 112.26.0.8.57542: Flags [.], seq 45509:46937, ack 1, win 1339, options [nop,nop,TS val 3282795 ecr 3062678,mptcp dss ack 4086075562 seq 1489224224 subseq 45509 len 1428 csum 0xf8c7], length 1428
17:16:38.900543 IP 112.26.0.1.36177 > 112.26.0.8.57542: Flags [.], seq 45509:46937, ack 1, win 1339, options [nop,nop,TS val 3282795 ecr 3062678,mptcp dss ack 4086075562 seq 1489224224 subseq 45509 len 1428 csum 0xf8c7], length 1428
17:16:38.982961 IP 112.26.0.8.57542 > 112.26.0.1.36177: Flags [.], ack 46937, win 2875, options [nop,nop,TS val 3063300 ecr 3282795,mptcp dss ack 1489225652], length 0
17:16:38.987166 IP 112.26.0.8.57542 > 112.26.0.1.36177: Flags [.], ack 46937, win 2875, options [nop,nop,TS val 3063300 ecr 3282795,mptcp dss ack 1489225652], length 0
17:16:38.994586 IP 112.26.0.8.57542 > 112.26.0.1.36177: Flags [.], ack 36941, win 2647, options [nop,nop,TS val 3062900 ecr 3282204,nop,nop,sack 1 {38369:41225},mptcp dss ack 1489215656], length 0
17:16:39.010746 IP 112.26.0.8.57542 > 112.26.0.1.36177: Flags [.], ack 41225, win 2692, options [nop,nop,TS val 3062984 ecr 3282204,mptcp dss ack 1489219940], length 0
17:16:39.083697 IP 112.26.0.1.36177 > 112.26.0.8.57542: Flags [.], seq 34085:35513, ack 1, win 1339, options [nop,nop,TS val 3283015 ecr 3062708,mptcp dss ack 4086075562 seq 1489212800 subseq 34085 len 1428 csum 0xca24], length 1428
17:16:39.084009 IP 112.26.0.1.36177 > 112.26.0.8.57542: Flags [.], seq 34085:35513, ack 1, win 1339, options [nop,nop,TS val 3283015 ecr 3062708,mptcp dss ack 4086075562 seq 1489212800 subseq 34085 len 1428 csum 0xca24], length 1428
17:16:39.088539 IP 112.26.0.8.57542 > 112.26.0.1.36177: Flags [.], ack 46937, win 2875, options [nop,nop,TS val 3063484 ecr 3282795,nop,nop,sack 1 {34085:35513},mptcp dss ack 1489225652], length 0
17:16:39.091912 IP 112.26.0.8.57542 > 112.26.0.1.36177: Flags [.], ack 46937, win 2875, options [nop,nop,TS val 3063484 ecr 3282795,nop,nop,sack 1 {34085:35513},mptcp dss ack 1489225652], length 0
17:16:39.107933 IP 112.26.0.8.57542 > 112.26.0.1.36177: Flags [.], ack 42653, win 2738, options [nop,nop,TS val 3063079 ecr 3282482,mptcp dss ack 1489221368], length 0
17:16:39.188331 IP 112.26.0.8.57542 > 112.26.0.1.36177: Flags [.], ack 44081, win 2784, options [nop,nop,TS val 3063113 ecr 3282700,mptcp dss ack 1489222796], length 0
17:16:39.284586 IP 112.26.0.1.36177 > 112.26.0.8.57542: Flags [.], seq 48365:49793, ack 1, win 1339, options [nop,nop,TS val 3283182 ecr 3062778,mptcp dss ack 4086075562 seq 1489227080 subseq 48365 len 1428 csum 0xd967], length 1428
17:16:39.285867 IP 112.26.0.1.36177 > 112.26.0.8.57542: Flags [.], seq 48365:49793, ack 1, win 1339, options [nop,nop,TS val 3283182 ecr 3062778,mptcp dss ack 4086075562 seq 1489227080 subseq 48365 len 1428 csum 0xd967], length 1428
17:16:39.291049 IP 112.26.0.8.57542 > 112.26.0.1.36177: Flags [.], ack 46937, win 2920, options [nop,nop,TS val 3063685 ecr 3282795,nop,nop,sack 1 {48365:49793},mptcp dss ack 1489225652], length 0
17:16:39.301104 IP 112.26.0.8.57542 > 112.26.0.1.36177: Flags [.], ack 45509, win 2829, options [nop,nop,TS val 3063281 ecr 3282700,mptcp dss ack 1489224224], length 0
17:16:39.306401 IP 112.26.0.8.57542 > 112.26.0.1.36177: Flags [.], ack 46937, win 2920, options [nop,nop,TS val 3063685 ecr 3282795,nop,nop,sack 1 {48365:49793},mptcp dss ack 1489225652], length 0
17:16:39.383805 IP 112.26.0.8.57542 > 112.26.0.1.36177: Flags [.], ack 46937, win 2875, options [nop,nop,TS val 3063300 ecr 3282795,mptcp dss ack 1489225652], length 0
17:16:39.393925 IP 112.26.0.1.36177 > 112.26.0.8.57542: Flags [.], seq 49793:51221, ack 1, win 1339, options [nop,nop,TS val 3283394 ecr 3062900,mptcp dss ack 4086075562 seq 1489228508 subseq 49793 len 1428 csum 0x9518], length 1428
