17:16:35.758881 IP 112.26.0.1.36177 > 112.26.0.8.57542: Flags [S.], seq 1781188362, ack 3938161820, win 65535, options [mss 1460,sackOK,TS val 3280156 ecr 3060063,nop,wscale 6,mptcp capable csum {0x5d07cc395fa8dd93}], length 0
17:16:35.779537 IP 112.26.0.1.36177 > 112.26.0.8.57542: Flags [S.], seq 1781188362, ack 3938161820, win 65535, options [mss 1460,sackOK,TS val 3280156 ecr 3060063,nop,wscale 6,mptcp capable csum {0x5d07cc395fa8dd93}], length 0
17:16:35.782843 IP 112.26.0.1.36177 > 112.26.0.8.57542: Flags [S.], seq 1781188362, ack 3938161820, win 65535, options [mss 1460,sackOK,TS val 3280156 ecr 3060063,nop,wscale 6,mptcp capable csum {0x5d07cc395fa8dd93}], length 0
17:16:35.788261 IP 112.26.0.1.36177 > 112.26.0.8.57542: Flags [.], ack 1, win 1339, options [nop,nop,TS val 3280187 ecr 3060180,mptcp add-addr id 3 112.26.1.1,mptcp dss ack 4086075562], length 0
17:16:35.814364 IP 112.26.0.1.36177 > 112.26.0.8.57542: Flags [.], ack 1, win 1339, options [nop,nop,TS val 3280187 ecr 3060180,mptcp add-addr id 5 112.26.3.1,mptcp dss ack 4086075562], length 0
17:16:35.820451 IP 112.26.0.1.36177 > 112.26.0.8.57542: Flags [.], ack 1, win 1339, options [nop,nop,TS val 3280187 ecr 3060180,mptcp add-addr id 3 112.26.1.1,mptcp dss ack 4086075562], length 0
17:16:35.858781 IP 112.26.0.1.36177 > 112.26.0.8.57542: Flags [.], ack 1, win 1339, options [nop,nop,TS val 3280187 ecr 3060180,mptcp add-addr id 3 112.26.1.1,mptcp dss ack 4086075562], length 0
17:16:35.876924 IP 112.26.0.1.36177 > 112.26.0.8.57542: Flags [.], ack 1, win 1339, options [nop,nop,TS val 3280187 ecr 3060180,mptcp add-addr id 6 112.26.2.1,mptcp dss ack 4086075562], length 0
17:16:35.964851 IP 112.26.0.1.36177 > 112.26.0.8.57542: Flags [.], seq 1:1429, ack 1, win 1339, options [nop,nop,TS val 3280193 ecr 3060180,mptcp dss ack 4086075562 seq 1489178716 subseq 1 len 1428 csum 0x3694], length 1428
17:16:35.966821 IP 112.26.0.1.36177 > 112.26.0.8.57542: Flags [.], ack 1, win 1339, options [nop,nop,TS val 3280187 ecr 3060180,mptcp add-addr id 5 112.26.3.1,mptcp dss ack 4086075562], length 0
17:16:35.976695 IP 112.26.0.1.36177 > 112.26.0.8.57542: Flags [.], seq 1429:2857, ack 1, win 1339, options [nop,nop,TS val 3280193 ecr 3060180,mptcp dss ack 4086075562 seq 1489180144 subseq 1429 len 1428 csum 0x55e2], length 1428
17:16:36.000424 IP 112.26.0.1.36177 > 112.26.0.8.57542: Flags [.], ack 1, win 1339, options [nop,nop,TS val 3280187 ecr 3060180,mptcp add-addr id 5 112.26.3.1,mptcp dss ack 4086075562], length 0
17:16:36.011670 IP 112.26.0.1.36177 > 112.26.0.8.57542: Flags [P.], seq 2857:4097, ack 1, win 1339, options [nop,nop,TS val 3280194 ecr 3060180,mptcp dss ack 4086075562 seq 1489181572 subseq 2857 len 1240 csum 0x96b4], length 1240
17:16:36.074244 IP 112.26.0.1.36177 > 112.26.0.8.57542: Flags [.], ack 1, win 1339, options [nop,nop,TS val 3280187 ecr 3060180,mptcp add-addr id 6 112.26.2.1,mptcp dss ack 4086075562], length 0
17:16:36.076909 IP 112.26.0.1.36177 > 112.26.0.8.57542: Flags [.], seq 4097:5525, ack 1, win 1339, options [nop,nop,TS val 3280194 ecr 3060180,mptcp dss ack 4086075562 seq 1489182812 subseq 4097 len 1428 csum 0x8aed], length 1428
17:16:36.081774 IP 112.26.0.1.36177 > 112.26.0.8.57542: Flags [.], ack 1, win 1339, options [nop,nop,TS val 3280187 ecr 3060180,mptcp add-addr id 6 112.26.2.1,mptcp dss ack 4086075562], length 0
17:16:36.092723 IP 112.26.0.1.36177 > 112.26.0.8.57542: Flags [.], seq 5525:6953, ack 1, win 1339, options [nop,nop,TS val 3280194 ecr 3060180,mptcp dss ack 4086075562 seq 1489184240 subseq 5525 len 1428 csum 0xe762], length 1428
17:16:36.167781 IP 112.26.0.1.36177 > 112.26.0.8.57542: Flags [.], seq 6953:8381, ack 1, win 1339, options [nop,nop,TS val 3280194 ecr 3060180,mptcp dss ack 4086075562 seq 1489185668 subseq 6953 len 1428 csum 0x812f], length 1428
17:16:36.173005 IP 112.26.0.1.36177 > 112.26.0.8.57542: Flags [.], seq 8381:9809, ack 1, win 1339, options [nop,nop,TS val 3280194 ecr 3060180,mptcp dss ack 4086075562 seq 1489187096 subseq 8381 len 1428 csum 0x50c1], length 1428
17:16:36.257177 IP 112.26.0.1.36177 > 112.26.0.8.57542: Flags [.], seq 1:1429, ack 1, win 1339, options [nop,nop,TS val 3280193 ecr 3060180,mptcp dss ack 4086075562 seq 1489178716 subseq 1 len 1428 csum 0x3694], length 1428
17:16:36.259460 IP 112.26.0.1.36177 > 112.26.0.8.57542: Flags [.], seq 1:1429, ack 1, win 1339, options [nop,nop,TS val 3280193 ecr 3060180,mptcp dss ack 4086075562 seq 1489178716 subseq 1 len 1428 csum 0x3694], length 1428
17:16:36.274355 IP 112.26.0.1.36177 > 112.26.0.8.57542: Flags [.], seq 9809:11237, ack 1, win 1339, options [nop,nop,TS val 3280194 ecr 3060180,mptcp dss ack 4086075562 seq 1489188524 subseq 9809 len 1428 csum 0x492d], length 1428
17:16:36.294006 IP 112.26.0.1.36177 > 112.26.0.8.57542: Flags [.], seq 1429:2857, ack 1, win 1339, options [nop,nop,TS val 3280193 ecr 3060180,mptcp dss ack 4086075562 seq 1489180144 subseq 1429 len 1428 csum 0x55e2], length 1428
17:16:36.297551 IP 112.26.0.1.36177 > 112.26.0.8.57542: Flags [.], seq 12665:14093, ack 1, win 1339, options [nop,nop,TS val 3280257 ecr 3060180,mptcp dss ack 4086075562 seq 1489191380 subseq 12665 len 1428 csum 0xbab0], length 1428
17:16:36.302781 IP 112.26.0.1.36177 > 112.26.0.8.57542: Flags [.], seq 1429:2857, ack 1, win 1339, options [nop,nop,TS val 3280193 ecr 3060180,mptcp dss ack 4086075562 seq 1489180144 subseq 1429 len 1428 csum 0x55e2], length 1428
17:16:36.374247 IP 112.26.0.1.36177 > 112.26.0.8.57542: Flags [P.], seq 2857:4097, ack 1, win 1339, options [nop,nop,TS val 3280194 ecr 3060180,mptcp dss ack 4086075562 seq 1489181572 subseq 2857 len 1240 csum 0x96b4], length 1240
17:16:36.389305 IP 112.26.0.1.36177 > 112.26.0.8.57542: Flags [P.], seq 2857:4097, ack 1, win 1339, options [nop,nop,TS val 3280194 ecr 3060180,mptcp dss ack 4086075562 seq 1489181572 subseq 2857 len 1240 csum 0x96b4], length 1240
17:16:36.390381 IP 112.26.0.1.36177 > 112.26.0.8.57542: Flags [.], seq 14093:15521, ack 1, win 1339, options [nop,nop,TS val 3280684 ecr 3060658,mptcp dss ack 4086075562 seq 1489192808 subseq 14093 len 1428 csum 0xd4a], length 1428
17:16:36.457390 IP 112.26.0.1.36177 > 112.26.0.8.57542: Flags [.], seq 15521:16949, ack 1, win 1339, options [nop,nop,TS val 3280763 ecr 3060701,mptcp dss ack 4086075562 seq 1489194236 subseq 15521 len 1428 csum 0x78a5], length 1428
17:16:36.462466 IP 112.26.0.1.36177 > 112.26.0.8.57542: Flags [.], seq 4097:5525, ack 1, win 1339, options [nop,nop,TS val 3280194 ecr 3060180,mptcp dss ack 4086075562 seq 1489182812 subseq 4097 len 1428 csum 0x8aed], length 1428
17:16:36.466789 IP 112.26.0.1.36177 > 112.26.0.8.57542: Flags [.], seq 4097:5525, ack 1, win 1339, options [nop,nop,TS val 3280194 ecr 3060180,mptcp dss ack 4086075562 seq 1489182812 subseq 4097 len 1428 csum 0x8aed], length 1428
17:16:36.489324 IP 112.26.0.1.36177 > 112.26.0.8.57542: Flags [.], seq 16949:18377, ack 1, win 1339, options [nop,nop,TS val 3280799 ecr 3060778,mptcp dss ack 4086075562 seq 1489195664 subseq 16949 len 1428 csum 0x61f9], length 1428
17:16:36.495105 IP 112.26.0.1.36177 > 112.26.0.8.57542: Flags [.], seq 5525:6953, ack 1, win 1339, options [nop,nop,TS val 3280194 ecr 3060180,mptcp dss ack 4086075562 seq 1489184240 subseq 5525 len 1428 csum 0xe762], length 1428
17:16:36.499403 IP 112.26.0.1.36177 > 112.26.0.8.57542: Flags [.], seq 5525:6953, ack 1, win 1339, options [nop,nop,TS val 3280194 ecr 3060180,mptcp dss ack 4086075562 seq 1489184240 subseq 5525 len 1428 csum 0xe762], length 1428
17:16:36.555548 IP 112.26.0.1.36177 > 112.26.0.8.57542: Flags [.], seq 18377:19805, ack 1, win 1339, options [nop,nop,TS val 3280877 ecr 3060864,mptcp dss ack 4086075562 seq 1489197092 subseq 18377 len 1428 csum 0x6b45], length 1428
17:16:36.578163 IP 112.26.0.1.36177 > 112.26.0.8.57542: Flags [.], seq 19805:21233, ack 1, win 1339, options [nop,nop,TS val 3280970 ecr 3060897,mptcp dss ack 4086075562 seq 1489198520 subseq 19805 len 1428 csum 0x2ae7], length 1428
17:16:36.665014 IP 112.26.0.1.36177 > 112.26.0.8.57542: Flags [.], seq 8381:9809, ack 1, win 1339, options [nop,nop,TS val 3280194 ecr 3060180,mptcp dss ack 4086075562 seq 1489187096 subseq 8381 len 1428 csum 0x50c1], length 1428
17:16:36.668091 IP 112.26.0.1.36177 > 112.26.0.8.57542: Flags [.], seq 8381:9809, ack 1, win 1339, options [nop,nop,TS val 3280194 ecr 3060180,mptcp dss ack 4086075562 seq 1489187096 subseq 8381 len 1428 csum 0x50c1], length 1428
17:16:36.685439 IP 112.26.0.1.36177 > 112.26.0.8.57542: Flags [.], seq 9809:11237, ack 1, win 1339, options [nop,nop,TS val 3280194 ecr 3060180,mptcp dss ack 4086075562 seq 1489188524 subseq 9809 len 1428 csum 0x492d], length 1428
17:16:36.687131 IP 112.26.0.1.36177 > 112.26.0.8.57542: Flags [.], seq 9809:11237, ack 1, win 1339, options [nop,nop,TS val 3280194 ecr 3060180,mptcp dss ack 4086075562 seq 1489188524 subseq 9809 len 1428 csum 0x492d], length 1428
17:16:36.782860 IP 112.26.0.1.36177 > 112.26.0.8.57542: Flags [.], seq 12665:14093, ack 1, win 1339, options [nop,nop,TS val 3280257 ecr 3060180,mptcp dss ack 4086075562 seq 1489191380 subseq 12665 len 1428 csum 0xbab0], length 1428
17:16:36.794863 IP 112.26.0.1.36177 > 112.26.0.8.57542: Flags [.], seq 21233:22661, ack 1, win 1339, options [nop,nop,TS val 3281193 ecr 3061065,mptcp dss ack 4086075562 seq 1489199948 subseq 21233 len 1428 csum 0x73e7], length 1428
17:16:36.801686 IP 112.26.0.1.36177 > 112.26.0.8.57542: Flags [.], seq 12665:14093, ack 1, win 1339, options [nop,nop,TS val 3280257 ecr 3060180,mptcp dss ack 4086075562 seq 1489191380 subseq 12665 len 1428 csum 0xbab0], length 1428
17:16:36.871587 IP 112.26.0.1.36177 > 112.26.0.8.57542: Flags [.], seq 14093:15521, ack 1, win 1339, options [nop,nop,TS val 3280684 ecr 3060658,mptcp dss ack 4086075562 seq 1489192808 subseq 14093 len 1428 csum 0xd4a], length 1428
17:16:36.874575 IP 112.26.0.1.36177 > 112.26.0.8.57542: Flags [.], seq 14093:15521, ack 1, win 1339, options [nop,nop,TS val 3280684 ecr 3060658,mptcp dss ack 4086075562 seq 1489192808 subseq 14093 len 1428 csum 0xd4a], length 1428
17:16:36.901862 IP 112.26.0.1.36177 > 112.26.0.8.57542: Flags [.], seq 22661:24089, ack 1, win 1339, options [nop,nop,TS val 3281300 ecr 3061085,mptcp dss ack 4086075562 seq 1489201376 subseq 22661 len 1428 csum 0xd081], length 1428
17:16:36.968899 IP 112.26.0.1.36177 > 112.26.0.8.57542: Flags [.], seq 6953:8381, ack 1, win 1339, options [nop,nop,TS val 3281300 ecr 3061199,mptcp dss ack 4086075562 seq 1489185668 subseq 6953 len 1428 csum 0x812f], length 1428
17:16:36.997145 IP 112.26.0.1.36177 > 112.26.0.8.57542: Flags [.], seq 18377:19805, ack 1, win 1339, options [nop,nop,TS val 3280877 ecr 3060864,mptcp dss ack 4086075562 seq 1489197092 subseq 18377 len 1428 csum 0x6b45], length 1428
17:16:36.999174 IP 112.26.0.1.36177 > 112.26.0.8.57542: Flags [.], seq 18377:19805, ack 1, win 1339, options [nop,nop,TS val 3280877 ecr 3060864,mptcp dss ack 4086075562 seq 1489197092 subseq 18377 len 1428 csum 0x6b45], length 1428
17:16:37.071646 IP 112.26.0.1.36177 > 112.26.0.8.57542: Flags [.], seq 19805:21233, ack 1, win 1339, options [nop,nop,TS val 3280970 ecr 3060897,mptcp dss ack 4086075562 seq 1489198520 subseq 19805 len 1428 csum 0x2ae7], length 1428
17:16:37.095223 IP 112.26.0.1.36177 > 112.26.0.8.57542: Flags [.], seq 11237:12665, ack 1, win 1339, options [nop,nop,TS val 3281493 ecr 3061397,mptcp dss ack 4086075562 seq 1489189952 subseq 11237 len 1428 csum 0x78b3], length 1428
17:16:37.099382 IP 112.26.0.1.36177 > 112.26.0.8.57542: Flags [.], seq 21233:22661, ack 1, win 1339, options [nop,nop,TS val 3281193 ecr 3061065,mptcp dss ack 4086075562 seq 1489199948 subseq 21233 len 1428 csum 0x73e7], length 1428
17:16:37.170540 IP 112.26.0.1.36177 > 112.26.0.8.57542: Flags [.], seq 19805:21233, ack 1, win 1339, options [nop,nop,TS val 3280970 ecr 3060897,mptcp dss ack 4086075562 seq 1489198520 subseq 19805 len 1428 csum 0x2ae7], length 1428
17:16:37.183841 IP 112.26.0.1.36177 > 112.26.0.8.57542: Flags [.], seq 22661:24089, ack 1, win 1339, options [nop,nop,TS val 3281300 ecr 3061085,mptcp dss ack 4086075562 seq 1489201376 subseq 22661 len 1428 csum 0xd081], length 1428
17:16:37.274549 IP 112.26.0.1.36177 > 112.26.0.8.57542: Flags [.], seq 15521:16949, ack 1, win 1339, options [nop,nop,TS val 3281673 ecr 3061569,mptcp dss ack 4086075562 seq 1489194236 subseq 15521 len 1428 csum 0x78a5], length 1428
17:16:37.289172 IP 112.26.0.1.36177 > 112.26.0.8.57542: Flags [.], seq 6953:8381, ack 1, win 1339, options [nop,nop,TS val 3281300 ecr 3061199,mptcp dss ack 4086075562 seq 1489185668 subseq 6953 len 1428 csum 0x812f], length 1428
17:16:37.294106 IP 112.26.0.1.36177 > 112.26.0.8.57542: Flags [.], seq 21233:22661, ack 1, win 1339, options [nop,nop,TS val 3281193 ecr 3061065,mptcp dss ack 4086075562 seq 1489199948 subseq 21233 len 1428 csum 0x73e7], length 1428
17:16:37.308192 IP 112.26.0.1.36177 > 112.26.0.8.57542: Flags [.], seq 11237:12665, ack 1, win 1339, options [nop,nop,TS val 3281493 ecr 3061397,mptcp dss ack 4086075562 seq 1489189952 subseq 11237 len 1428 csum 0x78b3], length 1428
17:16:37.384165 IP 112.26.0.1.36177 > 112.26.0.8.57542: Flags [.], seq 22661:24089, ack 1, win 1339, options [nop,nop,TS val 3281300 ecr 3061085,mptcp dss ack 4086075562 seq 1489201376 subseq 22661 len 1428 csum 0xd081], length 1428
17:16:37.386310 IP 112.26.0.1.36177 > 112.26.0.8.57542: Flags [.], seq 16949:18377, ack 1, win 1339, options [nop,nop,TS val 3281774 ecr 3061693,mptcp dss ack 4086075562 seq 1489195664 subseq 16949 len 1428 csum 0x61f9], length 1428
17:16:37.414661 IP 112.26.0.1.36177 > 112.26.0.8.57542: Flags [.], seq 6953:8381, ack 1, win 1339, options [nop,nop,TS val 3281300 ecr 3061199,mptcp dss ack 4086075562 seq 1489185668 subseq 6953 len 1428 csum 0x812f], length 1428
17:16:37.468802 IP 112.26.0.1.36177 > 112.26.0.8.57542: Flags [.], seq 15521:16949, ack 1, win 1339, options [nop,nop,TS val 3281673 ecr 3061569,mptcp dss ack 4086075562 seq 1489194236 subseq 15521 len 1428 csum 0x78a5], length 1428
17:16:37.490844 IP 112.26.0.1.36177 > 112.26.0.8.57542: Flags [.], seq 11237:12665, ack 1, win 1339, options [nop,nop,TS val 3281493 ecr 3061397,mptcp dss ack 4086075562 seq 1489189952 subseq 11237 len 1428 csum 0x78b3], length 1428
17:16:37.503267 IP 112.26.0.1.36177 > 112.26.0.8.57542: Flags [.], seq 24089:25517, ack 1, win 1339, options [nop,nop,TS val 3281900 ecr 3061780,mptcp dss ack 4086075562 seq 1489202804 subseq 24089 len 1428 csum 0x6850], length 1428
17:16:37.567927 IP 112.26.0.1.36177 > 112.26.0.8.57542: Flags [.], seq 15521:16949, ack 1, win 1339, options [nop,nop,TS val 3281673 ecr 3061569,mptcp dss ack 4086075562 seq 1489194236 subseq 15521 len 1428 csum 0x78a5], length 1428
17:16:37.576418 IP 112.26.0.1.36177 > 112.26.0.8.57542: Flags [.], seq 25517:26945, ack 1, win 1339, options [nop,nop,TS val 3281900 ecr 3061813,mptcp dss ack 4086075562 seq 1489204232 subseq 25517 len 1428 csum 0x824e], length 1428
17:16:37.585964 IP 112.26.0.1.36177 > 112.26.0.8.57542: Flags [.], seq 16949:18377, ack 1, win 1339, options [nop,nop,TS val 3281774 ecr 3061693,mptcp dss ack 4086075562 seq 1489195664 subseq 16949 len 1428 csum 0x61f9], length 1428
17:16:37.605208 IP 112.26.0.1.36177 > 112.26.0.8.57542: Flags [.], seq 26945:28373, ack 1, win 1339, options [nop,nop,TS val 3281900 ecr 3061813,mptcp dss ack 4086075562 seq 1489205660 subseq 26945 len 1428 csum 0x84b], length 1428
17:16:37.668131 IP 112.26.0.1.36177 > 112.26.0.8.57542: Flags [.], seq 16949:18377, ack 1, win 1339, options [nop,nop,TS val 3281774 ecr 3061693,mptcp dss ack 4086075562 seq 1489195664 subseq 16949 len 1428 csum 0x61f9], length 1428
17:16:37.684589 IP 112.26.0.1.36177 > 112.26.0.8.57542: Flags [.], seq 24089:25517, ack 1, win 1339, options [nop,nop,TS val 3281900 ecr 3061780,mptcp dss ack 4086075562 seq 1489202804 subseq 24089 len 1428 csum 0x6850], length 1428
17:16:37.691430 IP 112.26.0.1.36177 > 112.26.0.8.57542: Flags [.], seq 28373:29801, ack 1, win 1339, options [nop,nop,TS val 3281900 ecr 3061813,mptcp dss ack 4086075562 seq 1489207088 subseq 28373 len 1428 csum 0x14a8], length 1428
17:16:37.706203 IP 112.26.0.1.36177 > 112.26.0.8.57542: Flags [.], seq 24089:25517, ack 1, win 1339, options [nop,nop,TS val 3281900 ecr 3061780,mptcp dss ack 4086075562 seq 1489202804 subseq 24089 len 1428 csum 0x6850], length 1428
17:16:37.713556 IP 112.26.0.1.36177 > 112.26.0.8.57542: Flags [.], seq 29801:31229, ack 1, win 1339, options [nop,nop,TS val 3281992 ecr 3061889,mptcp dss ack 4086075562 seq 1489208516 subseq 29801 len 1428 csum 0x3a49], length 1428
17:16:37.771388 IP 112.26.0.1.36177 > 112.26.0.8.57542: Flags [.], seq 25517:26945, ack 1, win 1339, options [nop,nop,TS val 3281900 ecr 3061813,mptcp dss ack 4086075562 seq 1489204232 subseq 25517 len 1428 csum 0x824e], length 1428
17:16:37.789816 IP 112.26.0.1.36177 > 112.26.0.8.57542: Flags [.], seq 31229:32657, ack 1, win 1339, options [nop,nop,TS val 3282009 ecr 3061966,mptcp dss ack 4086075562 seq 1489209944 subseq 31229 len 1428 csum 0x2d89], length 1428
17:16:37.798879 IP 112.26.0.1.36177 > 112.26.0.8.57542: Flags [.], seq 25517:26945, ack 1, win 1339, options [nop,nop,TS val 3281900 ecr 3061813,mptcp dss ack 4086075562 seq 1489204232 subseq 25517 len 1428 csum 0x824e], length 1428
17:16:37.807353 IP 112.26.0.1.36177 > 112.26.0.8.57542: Flags [.], seq 26945:28373, ack 1, win 1339, options [nop,nop,TS val 3281900 ecr 3061813,mptcp dss ack 4086075562 seq 1489205660 subseq 26945 len 1428 csum 0x84b], length 1428
17:16:37.900908 IP 112.26.0.1.36177 > 112.26.0.8.57542: Flags [.], seq 28373:29801, ack 1, win 1339, options [nop,nop,TS val 3281900 ecr 3061813,mptcp dss ack 4086075562 seq 1489207088 subseq 28373 len 1428 csum 0x14a8], length 1428
17:16:37.902429 IP 112.26.0.1.36177 > 112.26.0.8.57542: Flags [.], seq 26945:28373, ack 1, win 1339, options [nop,nop,TS val 3281900 ecr 3061813,mptcp dss ack 4086075562 seq 1489205660 subseq 26945 len 1428 csum 0x84b], length 1428
17:16:37.982186 IP 112.26.0.1.36177 > 112.26.0.8.57542: Flags [.], seq 32657:34085, ack 1, win 1339, options [nop,nop,TS val 3282099 ecr 3062066,mptcp dss ack 4086075562 seq 1489211372 subseq 32657 len 1428 csum 0xa933], length 1428
17:16:37.984845 IP 112.26.0.1.36177 > 112.26.0.8.57542: Flags [.], seq 28373:29801, ack 1, win 1339, options [nop,nop,TS val 3281900 ecr 3061813,mptcp dss ack 4086075562 seq 1489207088 subseq 28373 len 1428 csum 0x14a8], length 1428
17:16:37.990263 IP 112.26.0.1.36177 > 112.26.0.8.57542: Flags [.], seq 29801:31229, ack 1, win 1339, options [nop,nop,TS val 3281992 ecr 3061889,mptcp dss ack 4086075562 seq 1489208516 subseq 29801 len 1428 csum 0x3a49], length 1428
17:16:38.075662 IP 112.26.0.1.36177 > 112.26.0.8.57542: Flags [.], seq 34085:35513, ack 1, win 1339, options [nop,nop,TS val 3282176 ecr 3062104,mptcp dss ack 4086075562 seq 1489212800 subseq 34085 len 1428 csum 0xca24], length 1428
17:16:38.077431 IP 112.26.0.1.36177 > 112.26.0.8.57542: Flags [.], seq 29801:31229, ack 1, win 1339, options [nop,nop,TS val 3281992 ecr 3061889,mptcp dss ack 4086075562 seq 1489208516 subseq 29801 len 1428 csum 0x3a49], length 1428
17:16:38.091355 IP 112.26.0.1.36177 > 112.26.0.8.57542: Flags [.], seq 31229:32657, ack 1, win 1339, options [nop,nop,TS val 3282009 ecr 3061966,mptcp dss ack 4086075562 seq 1489209944 subseq 31229 len 1428 csum 0x2d89], length 1428
17:16:38.093213 IP 112.26.0.1.36177 > 112.26.0.8.57542: Flags [.], seq 35513:36941, ack 1, win 1339, options [nop,nop,TS val 3282204 ecr 3062197,mptcp dss ack 4086075562 seq 1489214228 subseq 35513 len 1428 csum 0xb6c9], length 1428
17:16:38.112587 IP 112.26.0.1.36177 > 112.26.0.8.57542: Flags [.], seq 36941:38369, ack 1, win 1339, options [nop,nop,TS val 3282204 ecr 3062197,mptcp dss ack 4086075562 seq 1489215656 subseq 36941 len 1428 csum 0xf3d], length 1428
17:16:38.184159 IP 112.26.0.1.36177 > 112.26.0.8.57542: Flags [.], seq 32657:34085, ack 1, win 1339, options [nop,nop,TS val 3282099 ecr 3062066,mptcp dss ack 4086075562 seq 1489211372 subseq 32657 len 1428 csum 0xa933], length 1428
17:16:38.187655 IP 112.26.0.1.36177 > 112.26.0.8.57542: Flags [.], seq 38369:39797, ack 1, win 1339, options [nop,nop,TS val 3282295 ecr 3062287,mptcp dss ack 4086075562 seq 1489217084 subseq 38369 len 1428 csum 0x9542], length 1428
17:16:38.199604 IP 112.26.0.1.36177 > 112.26.0.8.57542: Flags [.], seq 31229:32657, ack 1, win 1339, options [nop,nop,TS val 3282009 ecr 3061966,mptcp dss ack 4086075562 seq 1489209944 subseq 31229 len 1428 csum 0x2d89], length 1428
17:16:38.292159 IP 112.26.0.1.36177 > 112.26.0.8.57542: Flags [.], seq 32657:34085, ack 1, win 1339, options [nop,nop,TS val 3282099 ecr 3062066,mptcp dss ack 4086075562 seq 1489211372 subseq 32657 len 1428 csum 0xa933], length 1428
17:16:38.294960 IP 112.26.0.1.36177 > 112.26.0.8.57542: Flags [.], seq 34085:35513, ack 1, win 1339, options [nop,nop,TS val 3282176 ecr 3062104,mptcp dss ack 4086075562 seq 1489212800 subseq 34085 len 1428 csum 0xca24], length 1428
17:16:38.306553 IP 112.26.0.1.36177 > 112.26.0.8.57542: Flags [.], seq 39797:41225, ack 1, win 1339, options [nop,nop,TS val 3282386 ecr 3062375,mptcp dss ack 4086075562 seq 1489218512 subseq 39797 len 1428 csum 0x61a5], length 1428
17:16:38.310322 IP 112.26.0.1.36177 > 112.26.0.8.57542: Flags [.], seq 38369:39797, ack 1, win 1339, options [nop,nop,TS val 3282295 ecr 3062287,mptcp dss ack 4086075562 seq 1489217084 subseq 38369 len 1428 csum 0x9542], length 1428
17:16:38.313447 IP 112.26.0.1.36177 > 112.26.0.8.57542: Flags [.], seq 41225:42653, ack 1, win 1339, options [nop,nop,TS val 3282482 ecr 3062415,mptcp dss ack 4086075562 seq 1489219940 subseq 41225 len 1428 csum 0x5ade], length 1428
17:16:38.380397 IP 112.26.0.1.36177 > 112.26.0.8.57542: Flags [.], seq 34085:35513, ack 1, win 1339, options [nop,nop,TS val 3282176 ecr 3062104,mptcp dss ack 4086075562 seq 1489212800 subseq 34085 len 1428 csum 0xca24], length 1428
17:16:38.384499 IP 112.26.0.1.36177 > 112.26.0.8.57542: Flags [.], seq 42653:44081, ack 1, win 1339, options [nop,nop,TS val 3282700 ecr 3062596,mptcp dss ack 4086075562 seq 1489221368 subseq 42653 len 1428 csum 0x7a7c], length 1428
17:16:38.392383 IP 112.26.0.1.36177 > 112.26.0.8.57542: Flags [.], seq 35513:36941, ack 1, win 1339, options [nop,nop,TS val 3282204 ecr 3062197,mptcp dss ack 4086075562 seq 1489214228 subseq 35513 len 1428 csum 0xb6c9], length 1428
17:16:38.403322 IP 112.26.0.1.36177 > 112.26.0.8.57542: Flags [.], seq 44081:45509, ack 1, win 1339, options [nop,nop,TS val 3282700 ecr 3062596,mptcp dss ack 4086075562 seq 1489222796 subseq 44081 len 1428 csum 0x6b22], length 1428
17:16:38.410531 IP 112.26.0.1.36177 > 112.26.0.8.57542: Flags [.], seq 35513:36941, ack 1, win 1339, options [nop,nop,TS val 3282204 ecr 3062197,mptcp dss ack 4086075562 seq 1489214228 subseq 35513 len 1428 csum 0xb6c9], length 1428
17:16:38.480805 IP 112.26.0.1.36177 > 112.26.0.8.57542: Flags [.], seq 45509:46937, ack 1, win 1339, options [nop,nop,TS val 3282795 ecr 3062678,mptcp dss ack 4086075562 seq 1489224224 subseq 45509 len 1428 csum 0xf8c7], length 1428
17:16:38.502674 IP 112.26.0.1.36177 > 112.26.0.8.57542: Flags [.], seq 39797:41225, ack 1, win 1339, options [nop,nop,TS val 3282386 ecr 3062375,mptcp dss ack 4086075562 seq 1489218512 subseq 39797 len 1428 csum 0x61a5], length 1428
17:16:38.572375 IP 112.26.0.1.36177 > 112.26.0.8.57542: Flags [.], seq 36941:38369, ack 1, win 1339, options [nop,nop,TS val 3282204 ecr 3062197,mptcp dss ack 4086075562 seq 1489215656 subseq 36941 len 1428 csum 0xf3d], length 1428
17:16:38.585701 IP 112.26.0.1.36177 > 112.26.0.8.57542: Flags [.], seq 36941:38369, ack 1, win 1339, options [nop,nop,TS val 3282204 ecr 3062197,mptcp dss ack 4086075562 seq 1489215656 subseq 36941 len 1428 csum 0xf3d], length 1428
17:16:38.619245 IP 112.26.0.1.36177 > 112.26.0.8.57542: Flags [.], seq 34085:35513, ack 1, win 1339, options [nop,nop,TS val 3283015 ecr 3062708,mptcp dss ack 4086075562 seq 1489212800 subseq 34085 len 1428 csum 0xca24], length 1428
17:16:38.680971 IP 112.26.0.1.36177 > 112.26.0.8.57542: Flags [.], seq 41225:42653, ack 1, win 1339, options [nop,nop,TS val 3282482 ecr 3062415,mptcp dss ack 4086075562 seq 1489219940 subseq 41225 len 1428 csum 0x5ade], length 1428
17:16:38.715397 IP 112.26.0.1.36177 > 112.26.0.8.57542: Flags [.], seq 42653:44081, ack 1, win 1339, options [nop,nop,TS val 3282700 ecr 3062596,mptcp dss ack 4086075562 seq 1489221368 subseq 42653 len 1428 csum 0x7a7c], length 1428
17:16:38.784042 IP 112.26.0.1.36177 > 112.26.0.8.57542: Flags [.], seq 46937:48365, ack 1, win 1339, options [nop,nop,TS val 3283182 ecr 3062778,mptcp dss ack 4086075562 seq 1489225652 subseq 46937 len 1428 csum 0x4761], length 1428
17:16:38.796244 IP 112.26.0.1.36177 > 112.26.0.8.57542: Flags [.], seq 48365:49793, ack 1, win 1339, options [nop,nop,TS val 3283182 ecr 3062778,mptcp dss ack 4086075562 seq 1489227080 subseq 48365 len 1428 csum 0xd967], length 1428
17:16:38.882652 IP 112.26.0.1.36177 > 112.26.0.8.57542: Flags [.], seq 44081:45509, ack 1, win 1339, options [nop,nop,TS val 3282700 ecr 3062596,mptcp dss ack 4086075562 seq 1489222796 subseq 44081 len 1428 csum 0x6b22], length 1428
17:16:38.901982 IP 112.26.0.1.36177 > 112.26.0.8.57542: Flags [.], seq 45509:46937, ack 1, win 1339, options [nop,nop,TS val 3282795 ecr 3062678,mptcp dss ack 4086075562 seq 1489224224 subseq 45509 len 1428 csum 0xf8c7], length 1428
17:16:38.996774 IP 112.26.0.1.36177 > 112.26.0.8.57542: Flags [.], seq 49793:51221, ack 1, win 1339, options [nop,nop,TS val 3283394 ecr 3062900,mptcp dss ack 4086075562 seq 1489228508 subseq 49793 len 1428 csum 0x9518], length 1428
17:16:39.009016 IP 112.26.0.1.36177 > 112.26.0.8.57542: Flags [.], seq 51221:52649, ack 1, win 1339, options [nop,nop,TS val 3283394 ecr 3062900,mptcp dss ack 4086075562 seq 1489229936 subseq 51221 len 1428 csum 0x639d], length 1428
17:16:39.085527 IP 112.26.0.1.36177 > 112.26.0.8.57542: Flags [.], seq 34085:35513, ack 1, win 1339, options [nop,nop,TS val 3283015 ecr 3062708,mptcp dss ack 4086075562 seq 1489212800 subseq 34085 len 1428 csum 0xca24], length 1428
17:16:39.099711 IP 112.26.0.1.36177 > 112.26.0.8.57542: Flags [.], seq 52649:54077, ack 1, win 1339, options [nop,nop,TS val 3283410 ecr 3062984,mptcp dss ack 4086075562 seq 1489231364 subseq 52649 len 1428 csum 0xa011], length 1428
17:16:39.176212 IP 112.26.0.1.36177 > 112.26.0.8.57542: Flags [.], seq 54077:55505, ack 1, win 1339, options [nop,nop,TS val 3283507 ecr 3063079,mptcp dss ack 4086075562 seq 1489232792 subseq 54077 len 1428 csum 0x9d1d], length 1428
17:16:39.189558 IP 112.26.0.1.36177 > 112.26.0.8.57542: Flags [.], seq 55505:56933, ack 1, win 1339, options [nop,nop,TS val 3283588 ecr 3063113,mptcp dss ack 4086075562 seq 1489234220 subseq 55505 len 1428 csum 0xd517], length 1428
17:16:39.302318 IP 112.26.0.1.36177 > 112.26.0.8.57542: Flags [.], seq 56933:58361, ack 1, win 1339, options [nop,nop,TS val 3283701 ecr 3063281,mptcp dss ack 4086075562 seq 1489235648 subseq 56933 len 1428 csum 0xeaa1], length 1428
17:16:39.387362 IP 112.26.0.1.36177 > 112.26.0.8.57542: Flags [.], seq 58361:59789, ack 1, win 1339, options [nop,nop,TS val 3283784 ecr 3063300,mptcp dss ack 4086075562 seq 1489237076 subseq 58361 len 1428 csum 0x58af], length 1428
17:16:39.883880 IP 112.26.0.1.36177 > 112.26.0.8.57542: Flags [.], seq 59789:61217, ack 1, win 1339, options [nop,nop,TS val 3284207 ecr 3063685,mptcp dss ack 4086075562 seq 1489238504 subseq 59789 len 1428 csum 0xe594], length 1428
17:16:39.902133 IP 112.26.0.1.36177 > 112.26.0.8.57542: Flags [.], seq 61217:62645, ack 1, win 1339, options [nop,nop,TS val 3284207 ecr 3063685,mptcp dss ack 4086075562 seq 1489239932 subseq 61217 len 1428 csum 0x73cd], length 1428
17:16:39.922424 IP 112.26.0.1.36177 > 112.26.0.8.57542: Flags [.], seq 62645:64073, ack 1, win 1339, options [nop,nop,TS val 3284295 ecr 3063794,mptcp dss ack 4086075562 seq 1489241360 subseq 62645 len 1428 csum 0xc553], length 1428
17:16:40.004519 IP 112.26.0.1.36177 > 112.26.0.8.57542: Flags [.], seq 64073:65501, ack 1, win 1339, options [nop,nop,TS val 3284391 ecr 3063884,mptcp dss ack 4086075562 seq 1489242788 subseq 64073 len 1428 csum 0x9fd3], length 1428
17:16:40.091875 IP 112.26.0.1.36177 > 112.26.0.8.57542: Flags [.], seq 46937:48365, ack 1, win 1339, options [nop,nop,TS val 3284391 ecr 3063984,mptcp dss ack 4086075562 seq 1489225652 subseq 46937 len 1428 csum 0x4761], length 1428
17:16:40.099723 IP 112.26.0.1.36177 > 112.26.0.8.57542: Flags [.], seq 65501:66929, ack 1, win 1339, options [nop,nop,TS val 3284495 ecr 3064095,mptcp dss ack 4086075562 seq 1489244216 subseq 65501 len 1428 csum 0x80e8], length 1428
17:16:40.302402 IP 112.26.0.1.36177 > 112.26.0.8.57542: Flags [.], seq 66929:68357, ack 1, win 1339, options [nop,nop,TS val 3284701 ecr 3064107,mptcp dss ack 4086075562 seq 1489245644 subseq 66929 len 1428 csum 0x845], length 1428
17:16:40.610595 IP 112.26.0.1.36177 > 112.26.0.8.57542: Flags [.], seq 68357:69785, ack 1, win 1339, options [nop,nop,TS val 3285008 ecr 3064585,mptcp dss ack 4086075562 seq 1489247072 subseq 68357 len 1428 csum 0x4d3d], length 1428
17:16:40.785815 IP 112.26.0.1.36177 > 112.26.0.8.57542: Flags [.], seq 69785:71213, ack 1, win 1339, options [nop,nop,TS val 3285184 ecr 3064610,mptcp dss ack 4086075562 seq 1489248500 subseq 69785 len 1428 csum 0x16ec], length 1428
17:16:40.805035 IP 112.26.0.1.36177 > 112.26.0.8.57542: Flags [.], seq 71213:72641, ack 1, win 1339, options [nop,nop,TS val 3285203 ecr 3064710,mptcp dss ack 4086075562 seq 1489249928 subseq 71213 len 1428 csum 0x5199], length 1428
17:16:40.927221 IP 112.26.0.1.36177 > 112.26.0.8.57542: Flags [.], seq 72641:74069, ack 1, win 1339, options [nop,nop,TS val 3285325 ecr 3064803,mptcp dss ack 4086075562 seq 1489251356 subseq 72641 len 1428 csum 0x8246], length 1428
17:16:41.002871 IP 112.26.0.1.36177 > 112.26.0.8.57542: Flags [.], seq 74069:75497, ack 1, win 1339, options [nop,nop,TS val 3285325 ecr 3064983,mptcp dss ack 4086075562 seq 1489252784 subseq 74069 len 1428 csum 0x21a7], length 1428
17:16:41.023692 IP 112.26.0.1.36177 > 112.26.0.8.57542: Flags [.], seq 75497:76925, ack 1, win 1339, options [nop,nop,TS val 3285396 ecr 3065002,mptcp dss ack 4086075562 seq 1489254212 subseq 75497 len 1428 csum 0x8c8e], length 1428
17:16:41.220949 IP 112.26.0.1.36177 > 112.26.0.8.57542: Flags [.], seq 76925:78353, ack 1, win 1339, options [nop,nop,TS val 3285620 ecr 3065190,mptcp dss ack 4086075562 seq 1489255640 subseq 76925 len 1428 csum 0x2219], length 1428
17:16:41.239826 IP 112.26.0.1.36177 > 112.26.0.8.57542: Flags [.], seq 78353:79781, ack 1, win 1339, options [nop,nop,TS val 3285620 ecr 3065190,mptcp dss ack 4086075562 seq 1489257068 subseq 78353 len 1428 csum 0x5d75], length 1428
17:16:41.404429 IP 112.26.0.1.36177 > 112.26.0.8.57542: Flags [.], seq 79781:81209, ack 1, win 1339, options [nop,nop,TS val 3285802 ecr 3065308,mptcp dss ack 4086075562 seq 1489258496 subseq 79781 len 1428 csum 0x9d48], length 1428
17:16:41.515408 IP 112.26.0.1.36177 > 112.26.0.8.57542: Flags [.], seq 81209:82637, ack 1, win 1339, options [nop,nop,TS val 3285914 ecr 3065524,mptcp dss ack 4086075562 seq 1489259924 subseq 81209 len 1428 csum 0x6ee0], length 1428
17:16:41.696002 IP 112.26.0.1.36177 > 112.26.0.8.57542: Flags [.], seq 82637:84065, ack 1, win 1339, options [nop,nop,TS val 3286094 ecr 3065631,mptcp dss ack 4086075562 seq 1489261352 subseq 82637 len 1428 csum 0xec0f], length 1428
17:16:41.715467 IP 112.26.0.1.36177 > 112.26.0.8.57542: Flags [.], seq 84065:85493, ack 1, win 1339, options [nop,nop,TS val 3286094 ecr 3065631,mptcp dss ack 4086075562 seq 1489262780 subseq 84065 len 1428 csum 0x31b4], length 1428
17:16:41.795604 IP 112.26.0.1.36177 > 112.26.0.8.57542: Flags [.], seq 85493:86921, ack 1, win 1339, options [nop,nop,TS val 3286193 ecr 3065719,mptcp dss ack 4086075562 seq 1489264208 subseq 85493 len 1428 csum 0xeaaf], length 1428
17:16:41.907846 IP 112.26.0.1.36177 > 112.26.0.8.57542: Flags [.], seq 86921:88349, ack 1, win 1339, options [nop,nop,TS val 3286306 ecr 3065811,mptcp dss ack 4086075562 seq 1489265636 subseq 86921 len 1428 csum 0x34c8], length 1428
17:16:42.010092 IP 112.26.0.1.36177 > 112.26.0.8.57542: Flags [.], seq 88349:89777, ack 1, win 1339, options [nop,nop,TS val 3286321 ecr 3065925,mptcp dss ack 4086075562 seq 1489267064 subseq 88349 len 1428 csum 0x39b2], length 1428
17:16:42.131764 IP 112.26.0.1.36177 > 112.26.0.8.57542: Flags [.], seq 89777:91205, ack 1, win 1339, options [nop,nop,TS val 3286525 ecr 3066101,mptcp dss ack 4086075562 seq 1489268492 subseq 89777 len 1428 csum 0x4ed], length 1428
17:16:42.228449 IP 112.26.0.1.36177 > 112.26.0.8.57542: Flags [.], seq 91205:92633, ack 1, win 1339, options [nop,nop,TS val 3286623 ecr 3066125,mptcp dss ack 4086075562 seq 1489269920 subseq 91205 len 1428 csum 0x2c79], length 1428
17:16:42.311162 IP 112.26.0.1.36177 > 112.26.0.8.57542: Flags [.], seq 92633:94061, ack 1, win 1339, options [nop,nop,TS val 3286710 ecr 3066210,mptcp dss ack 4086075562 seq 1489271348 subseq 92633 len 1428 csum 0xc04b], length 1428
17:16:42.423939 IP 112.26.0.1.36177 > 112.26.0.8.57542: Flags [.], seq 94061:95489, ack 1, win 1339, options [nop,nop,TS val 3286822 ecr 3066409,mptcp dss ack 4086075562 seq 1489272776 subseq 94061 len 1428 csum 0x492e], length 1428
17:16:42.506372 IP 112.26.0.1.36177 > 112.26.0.8.57542: Flags [.], seq 95489:96917, ack 1, win 1339, options [nop,nop,TS val 3286904 ecr 3066502,mptcp dss ack 4086075562 seq 1489274204 subseq 95489 len 1428 csum 0x6a9e], length 1428
17:16:42.608469 IP 112.26.0.1.36177 > 112.26.0.8.57542: Flags [.], seq 96917:98345, ack 1, win 1339, options [nop,nop,TS val 3287003 ecr 3066594,mptcp dss ack 4086075562 seq 1489275632 subseq 96917 len 1428 csum 0xfcba], length 1428
17:16:42.634006 IP 112.26.0.8.33715 > 112.26.3.1.36177: Flags [S], seq 1319618645, win 65535, options [mss 1460,sackOK,TS val 3066800 ecr 0,nop,wscale 6,mptcp join id 2 token 0xee51874d nonce 0xf2b4c1bf], length 0
17:16:42.639031 IP 112.26.0.1.36177 > 112.26.0.8.57542: Flags [.], seq 98345:99773, ack 1, win 1339, options [nop,nop,TS val 3287003 ecr 3066594,mptcp dss ack 4086075562 seq 1489277060 subseq 98345 len 1428 csum 0x4ac3], length 1428
17:16:42.727711 IP 112.26.3.1.36177 > 112.26.0.8.33715: Flags [S.], seq 1575276162, ack 1319618646, win 65535, options [mss 1460,sackOK,TS val 3287034 ecr 3066800,nop,wscale 6,mptcp join id 5 hmac 0x8e51ae8bd63143c7 nonce 0xc47dbaa2], length 0
17:16:42.914758 IP 112.26.0.1.36177 > 112.26.0.8.57542: Flags [.], seq 99773:101201, ack 1, win 1339, options [nop,nop,TS val 3287110 ecr 3066637,mptcp dss ack 4086075562 seq 1489278488 subseq 99773 len 1428 csum 0xfe1f], length 1428
17:16:42.937471 IP 112.26.0.1.36177 > 112.26.0.8.57542: Flags [.], seq 101201:102629, ack 1, win 1339, options [nop,nop,TS val 3287209 ecr 3066799,mptcp dss ack 4086075562 seq 1489279916 subseq 101201 len 1428 csum 0x7180], length 1428
17:16:43.021912 IP 112.26.1.1.36177 > 112.26.0.8.36999: Flags [S.], seq 327071983, ack 2400029542, win 65535, options [mss 1460,sackOK,TS val 3287333 ecr 3066800,nop,wscale 6,mptcp join id 3 hmac 0x9fc5c9de2eb6c3ab nonce 0xc9ee55fb], length 0
17:16:43.112322 IP 112.26.1.1.36177 > 112.26.0.8.36999: Flags [S.], seq 327071983, ack 2400029542, win 65535, options [mss 1460,sackOK,TS val 3287333 ecr 3066800,nop,wscale 6,mptcp join id 3 hmac 0x9fc5c9de2eb6c3ab nonce 0xc9ee55fb], length 0
17:16:43.123463 IP 112.26.2.1.36177 > 112.26.0.8.40673: Flags [S.], seq 2785565331, ack 110740505, win 65535, options [mss 1460,sackOK,TS val 3287522 ecr 3066800,nop,wscale 6,mptcp join id 6 hmac 0x6e86aad871e32af nonce 0x7b2f80c8], length 0
17:16:43.123742 IP 112.26.2.1.36177 > 112.26.0.8.40673: Flags [S.], seq 2785565331, ack 110740505, win 65535, options [mss 1460,sackOK,TS val 3287522 ecr 3066800,nop,wscale 6,mptcp join id 6 hmac 0x6e86aad871e32af nonce 0x7b2f80c8], length 0
17:16:43.144977 IP 112.26.2.1.36177 > 112.26.0.8.40673: Flags [S.], seq 2785565331, ack 110740505, win 65535, options [mss 1460,sackOK,TS val 3287522 ecr 3066800,nop,wscale 6,mptcp join id 6 hmac 0x6e86aad871e32af nonce 0x7b2f80c8], length 0
17:16:43.234432 IP 112.26.0.1.36177 > 112.26.0.8.57542: Flags [.], seq 102629:104057, ack 1, win 1339, options [nop,nop,TS val 3287632 ecr 3066826,mptcp dss ack 4086075562 seq 1489281344 subseq 102629 len 1428 csum 0x7efa], length 1428
17:16:43.316619 IP 112.26.0.1.36177 > 112.26.0.8.57542: Flags [.], seq 104057:105485, ack 1, win 1339, options [nop,nop,TS val 3287715 ecr 3066918,mptcp dss ack 4086075562 seq 1489282772 subseq 104057 len 1428 csum 0x769d], length 1428
17:16:43.336022 IP 112.26.0.1.36177 > 112.26.0.8.57542: Flags [.], seq 105485:106913, ack 1, win 1339, options [nop,nop,TS val 3287735 ecr 3067101,mptcp dss ack 4086075562 seq 1489284200 subseq 105485 len 1428 csum 0x814e], length 1428
17:16:43.523197 IP 112.26.0.1.36177 > 112.26.0.8.57542: Flags [.], seq 106913:108341, ack 1, win 1339, options [nop,nop,TS val 3287922 ecr 3067295,mptcp dss ack 4086075562 seq 1489285628 subseq 106913 len 1428 csum 0xda75], length 1428
17:16:43.601550 IP 112.26.0.8.33715 > 112.26.3.1.36177: Flags [.], ack 1, win 7300, options [nop,nop,TS val 3067819 ecr 3287034,mptcp join hmac 0x60b8d2ddce1cffdb92863bfc3780fb9bcc3c9e3b], length 0
17:16:43.604949 IP 112.26.0.1.36177 > 112.26.0.8.57542: Flags [.], seq 108341:109769, ack 1, win 1339, options [nop,nop,TS val 3288003 ecr 3067325,mptcp dss ack 4086075562 seq 1489287056 subseq 108341 len 1428 csum 0x5fa9], length 1428
17:16:43.625645 IP 112.26.3.1.36177 > 112.26.0.8.33715: Flags [.], ack 1, win 2678, options [nop,nop,TS val 3288008 ecr 3067819,mptcp dss ack 4086075562], length 0
17:16:43.644240 IP 112.26.3.1.36177 > 112.26.0.8.33715: Flags [.], seq 1:1429, ack 1, win 2678, options [nop,nop,TS val 3288008 ecr 3067819,mptcp dss ack 4086075562 seq 1489288484 subseq 1 len 1428 csum 0x3034], length 1428
17:16:43.713952 IP 112.26.3.1.36177 > 112.26.0.8.33715: Flags [.], seq 1429:2857, ack 1, win 2678, options [nop,nop,TS val 3288008 ecr 3067819,mptcp dss ack 4086075562 seq 1489289912 subseq 1429 len 1428 csum 0x5eaf], length 1428
17:16:43.802818 IP 112.26.3.1.36177 > 112.26.0.8.33715: Flags [.], seq 2857:4285, ack 1, win 2678, options [nop,nop,TS val 3288009 ecr 3067819,mptcp dss ack 4086075562 seq 1489291340 subseq 2857 len 1428 csum 0x1138], length 1428
17:16:43.822246 IP 112.26.3.1.36177 > 112.26.0.8.33715: Flags [.], seq 4285:5713, ack 1, win 2678, options [nop,nop,TS val 3288010 ecr 3067819,mptcp dss ack 4086075562 seq 1489292768 subseq 4285 len 1428 csum 0xff3e], length 1428
17:16:43.903218 IP 112.26.3.1.36177 > 112.26.0.8.33715: Flags [.], seq 5713:7141, ack 1, win 2678, options [nop,nop,TS val 3288010 ecr 3067819,mptcp dss ack 4086075562 seq 1489294196 subseq 5713 len 1428 csum 0xae07], length 1428
17:16:43.925081 IP 112.26.3.1.36177 > 112.26.0.8.33715: Flags [.], seq 7141:8569, ack 1, win 2678, options [nop,nop,TS val 3288010 ecr 3067819,mptcp dss ack 4086075562 seq 1489295624 subseq 7141 len 1428 csum 0x26f6], length 1428
17:16:44.020931 IP 112.26.3.1.36177 > 112.26.0.8.33715: Flags [.], seq 8569:9997, ack 1, win 2678, options [nop,nop,TS val 3288010 ecr 3067819,mptcp dss ack 4086075562 seq 1489297052 subseq 8569 len 1428 csum 0x1d64], length 1428
17:16:44.045185 IP 112.26.3.1.36177 > 112.26.0.8.33715: Flags [.], seq 9997:11425, ack 1, win 2678, options [nop,nop,TS val 3288010 ecr 3067819,mptcp dss ack 4086075562 seq 1489298480 subseq 9997 len 1428 csum 0x220d], length 1428
17:16:44.117101 IP 112.26.3.1.36177 > 112.26.0.8.33715: Flags [.], seq 11425:12853, ack 1, win 2678, options [nop,nop,TS val 3288010 ecr 3067819,mptcp dss ack 4086075562 seq 1489299908 subseq 11425 len 1428 csum 0x64d3], length 1428
