16:15:09.914097 IP 112.26.0.8.35772 > 112.26.0.1.targus-getdata1: Flags [S], seq 501555758, win 65535, options [mss 1460,sackOK,TS val 247491 ecr 0,nop,wscale 6], length 0
16:15:11.026321 IP 112.26.0.8.35772 > 112.26.0.1.targus-getdata1: Flags [S], seq 501555758, win 65535, options [mss 1460,sackOK,TS val 248512 ecr 0,nop,wscale 6], length 0
16:15:11.050884 IP 112.26.0.8.35772 > 112.26.0.1.targus-getdata1: Flags [S], seq 501555758, win 65535, options [mss 1460,sackOK,TS val 248512 ecr 0,nop,wscale 6], length 0
16:15:11.243912 IP 112.26.0.8.35772 > 112.26.0.1.targus-getdata1: Flags [.], ack 851580857, win 1369, options [nop,nop,TS val 248894 ecr 492822], length 0
16:15:11.325217 IP 112.26.0.8.35772 > 112.26.0.1.targus-getdata1: Flags [P.], seq 0:37, ack 1, win 1369, options [nop,nop,TS val 248895 ecr 492822], length 37
16:15:11.344290 IP 112.26.0.8.35772 > 112.26.0.1.targus-getdata1: Flags [.], ack 1, win 1369, options [nop,nop,TS val 248894 ecr 492822], length 0
16:15:11.429942 IP 112.26.0.8.35772 > 112.26.0.1.targus-getdata1: Flags [P.], seq 0:37, ack 1, win 1369, options [nop,nop,TS val 248895 ecr 492822], length 37
16:15:47.656638 IP 112.26.0.8.35774 > 112.26.0.1.targus-getdata1: Flags [.], seq 1925573980:1925575428, ack 2111650953, win 1369, options [nop,nop,TS val 284617 ecr 528420], length 1448
16:15:47.665594 IP 112.26.0.8.35774 > 112.26.0.1.targus-getdata1: Flags [.], seq 0:1448, ack 1, win 1369, options [nop,nop,TS val 284617 ecr 528420], length 1448
16:15:48.249574 IP 112.26.0.8.35774 > 112.26.0.1.targus-getdata1: Flags [.], seq 1448:2896, ack 1, win 1369, options [nop,nop,TS val 285824 ecr 528420], length 1448
16:15:48.251156 IP 112.26.0.8.35774 > 112.26.0.1.targus-getdata1: Flags [.], seq 1448:2896, ack 1, win 1369, options [nop,nop,TS val 285824 ecr 528420], length 1448
16:15:48.255975 IP 112.26.0.8.35774 > 112.26.0.1.targus-getdata1: Flags [.], seq 1448:2896, ack 1, win 1369, options [nop,nop,TS val 285824 ecr 528420], length 1448
16:15:49.353011 IP 112.26.0.8.35774 > 112.26.0.1.targus-getdata1: Flags [.], seq 4294957160:4294958608, ack 1, win 1369, options [nop,nop,TS val 286976 ecr 528420], length 1448
16:15:49.354398 IP 112.26.0.8.35774 > 112.26.0.1.targus-getdata1: Flags [.], seq 4294957160:4294958608, ack 1, win 1369, options [nop,nop,TS val 286976 ecr 528420], length 1448
16:15:49.358540 IP 112.26.0.8.35774 > 112.26.0.1.targus-getdata1: Flags [.], seq 4294957160:4294958608, ack 1, win 1369, options [nop,nop,TS val 286976 ecr 528420], length 1448
16:15:51.665128 IP 112.26.0.8.35774 > 112.26.0.1.targus-getdata1: Flags [.], seq 4294957160:4294958608, ack 1, win 1369, options [nop,nop,TS val 289280 ecr 528420], length 1448
16:15:51.678239 IP 112.26.0.8.35774 > 112.26.0.1.targus-getdata1: Flags [.], seq 4294957160:4294958608, ack 1, win 1369, options [nop,nop,TS val 289280 ecr 528420], length 1448
16:15:51.689425 IP 112.26.0.8.35774 > 112.26.0.1.targus-getdata1: Flags [.], seq 4294957160:4294958608, ack 1, win 1369, options [nop,nop,TS val 289280 ecr 528420], length 1448
16:15:56.299138 IP 112.26.0.8.35774 > 112.26.0.1.targus-getdata1: Flags [.], seq 4294957160:4294958608, ack 1, win 1369, options [nop,nop,TS val 293888 ecr 528420], length 1448
16:15:56.405466 IP 112.26.0.8.35774 > 112.26.0.1.targus-getdata1: Flags [.], seq 4294957160:4294958608, ack 1, win 1369, options [nop,nop,TS val 293888 ecr 528420], length 1448
16:15:56.410661 IP 112.26.0.8.35774 > 112.26.0.1.targus-getdata1: Flags [.], seq 4294957160:4294958608, ack 1, win 1369, options [nop,nop,TS val 293888 ecr 528420], length 1448
16:16:05.458260 IP 112.26.0.8.35774 > 112.26.0.1.targus-getdata1: Flags [.], seq 4294957160:4294958608, ack 1, win 1369, options [nop,nop,TS val 303104 ecr 528420], length 1448
16:16:05.458688 IP 112.26.0.8.35774 > 112.26.0.1.targus-getdata1: Flags [.], seq 4294957160:4294958608, ack 1, win 1369, options [nop,nop,TS val 303104 ecr 528420], length 1448
16:16:05.470415 IP 112.26.0.8.35774 > 112.26.0.1.targus-getdata1: Flags [.], seq 4294957160:4294958608, ack 1, win 1369, options [nop,nop,TS val 303104 ecr 528420], length 1448
16:16:05.486314 IP 112.26.0.1.targus-getdata1 > 112.26.0.8.35774: Flags [.], ack 2896, win 1432, options [nop,nop,TS val 547241 ecr 285824,nop,nop,sack 1 {4294957160:4294958608}], length 0
16:16:05.486506 IP 112.26.0.1.targus-getdata1 > 112.26.0.8.35774: Flags [.], ack 2896, win 1432, options [nop,nop,TS val 547241 ecr 285824,nop,nop,sack 1 {4294957160:4294958608}], length 0
16:16:05.568218 IP 112.26.0.8.35774 > 112.26.0.1.targus-getdata1: Flags [.], seq 2896:4344, ack 1, win 1369, options [nop,nop,TS val 303219 ecr 547241], length 1448
16:16:05.568533 IP 112.26.0.8.35774 > 112.26.0.1.targus-getdata1: Flags [.], seq 2896:4344, ack 1, win 1369, options [nop,nop,TS val 303219 ecr 547241], length 1448
16:16:05.586716 IP 112.26.0.8.35774 > 112.26.0.1.targus-getdata1: Flags [.], seq 4344:5792, ack 1, win 1369, options [nop,nop,TS val 303219 ecr 547241], length 1448
16:16:05.586908 IP 112.26.0.8.35774 > 112.26.0.1.targus-getdata1: Flags [.], seq 4344:5792, ack 1, win 1369, options [nop,nop,TS val 303219 ecr 547241], length 1448
16:16:05.660389 IP 112.26.0.8.35774 > 112.26.0.1.targus-getdata1: Flags [.], seq 2896:4344, ack 1, win 1369, options [nop,nop,TS val 303219 ecr 547241], length 1448
16:16:05.672611 IP 112.26.0.8.35774 > 112.26.0.1.targus-getdata1: Flags [.], seq 5792:7240, ack 1, win 1369, options [nop,nop,TS val 303220 ecr 547241], length 1448
16:16:05.672895 IP 112.26.0.8.35774 > 112.26.0.1.targus-getdata1: Flags [.], seq 5792:7240, ack 1, win 1369, options [nop,nop,TS val 303220 ecr 547241], length 1448
16:16:05.678900 IP 112.26.0.1.targus-getdata1 > 112.26.0.8.35774: Flags [.], ack 4344, win 1432, options [nop,nop,TS val 547431 ecr 303219], length 0
16:16:05.679071 IP 112.26.0.1.targus-getdata1 > 112.26.0.8.35774: Flags [.], ack 4344, win 1432, options [nop,nop,TS val 547431 ecr 303219], length 0
16:16:05.693228 IP 112.26.0.8.35774 > 112.26.0.1.targus-getdata1: Flags [.], seq 7240:8688, ack 1, win 1369, options [nop,nop,TS val 303220 ecr 547241], length 1448
16:16:05.693408 IP 112.26.0.8.35774 > 112.26.0.1.targus-getdata1: Flags [.], seq 7240:8688, ack 1, win 1369, options [nop,nop,TS val 303220 ecr 547241], length 1448
16:16:05.759927 IP 112.26.0.8.35774 > 112.26.0.1.targus-getdata1: Flags [.], seq 4344:5792, ack 1, win 1369, options [nop,nop,TS val 303219 ecr 547241], length 1448
16:16:05.773785 IP 112.26.0.8.35774 > 112.26.0.1.targus-getdata1: Flags [.], seq 8688:10136, ack 1, win 1369, options [nop,nop,TS val 303220 ecr 547241], length 1448
16:16:05.774001 IP 112.26.0.8.35774 > 112.26.0.1.targus-getdata1: Flags [.], seq 8688:10136, ack 1, win 1369, options [nop,nop,TS val 303220 ecr 547241], length 1448
16:16:05.783286 IP 112.26.0.1.targus-getdata1 > 112.26.0.8.35774: Flags [.], ack 5792, win 1432, options [nop,nop,TS val 547531 ecr 303219], length 0
16:16:05.783456 IP 112.26.0.1.targus-getdata1 > 112.26.0.8.35774: Flags [.], ack 5792, win 1432, options [nop,nop,TS val 547531 ecr 303219], length 0
16:16:05.789445 IP 112.26.0.8.35774 > 112.26.0.1.targus-getdata1: Flags [.], seq 10136:11584, ack 1, win 1369, options [nop,nop,TS val 303220 ecr 547241], length 1448
16:16:05.789633 IP 112.26.0.8.35774 > 112.26.0.1.targus-getdata1: Flags [.], seq 10136:11584, ack 1, win 1369, options [nop,nop,TS val 303220 ecr 547241], length 1448
16:16:05.863353 IP 112.26.0.8.35774 > 112.26.0.1.targus-getdata1: Flags [.], seq 5792:7240, ack 1, win 1369, options [nop,nop,TS val 303220 ecr 547241], length 1448
16:16:05.875062 IP 112.26.0.8.35774 > 112.26.0.1.targus-getdata1: Flags [.], seq 11584:13032, ack 1, win 1369, options [nop,nop,TS val 303220 ecr 547241], length 1448
16:16:05.875354 IP 112.26.0.8.35774 > 112.26.0.1.targus-getdata1: Flags [.], seq 11584:13032, ack 1, win 1369, options [nop,nop,TS val 303220 ecr 547241], length 1448
16:16:05.879556 IP 112.26.0.1.targus-getdata1 > 112.26.0.8.35774: Flags [.], ack 7240, win 1432, options [nop,nop,TS val 547632 ecr 303220], length 0
16:16:05.879753 IP 112.26.0.1.targus-getdata1 > 112.26.0.8.35774: Flags [.], ack 7240, win 1432, options [nop,nop,TS val 547632 ecr 303220], length 0
16:16:05.895471 IP 112.26.0.8.35774 > 112.26.0.1.targus-getdata1: Flags [.], seq 13032:14480, ack 1, win 1369, options [nop,nop,TS val 303220 ecr 547241], length 1448
16:16:05.895676 IP 112.26.0.8.35774 > 112.26.0.1.targus-getdata1: Flags [.], seq 13032:14480, ack 1, win 1369, options [nop,nop,TS val 303220 ecr 547241], length 1448
16:16:05.962187 IP 112.26.0.8.35774 > 112.26.0.1.targus-getdata1: Flags [.], seq 14480:15928, ack 1, win 1369, options [nop,nop,TS val 303536 ecr 547431], length 1448
16:16:05.962526 IP 112.26.0.8.35774 > 112.26.0.1.targus-getdata1: Flags [.], seq 14480:15928, ack 1, win 1369, options [nop,nop,TS val 303536 ecr 547431], length 1448
16:16:05.968141 IP 112.26.0.8.35774 > 112.26.0.1.targus-getdata1: Flags [.], seq 7240:8688, ack 1, win 1369, options [nop,nop,TS val 303220 ecr 547241], length 1448
16:16:05.986628 IP 112.26.0.1.targus-getdata1 > 112.26.0.8.35774: Flags [.], ack 8688, win 1432, options [nop,nop,TS val 547739 ecr 303220], length 0
16:16:05.986833 IP 112.26.0.1.targus-getdata1 > 112.26.0.8.35774: Flags [.], ack 8688, win 1432, options [nop,nop,TS val 547739 ecr 303220], length 0
16:16:06.063981 IP 112.26.0.8.35774 > 112.26.0.1.targus-getdata1: Flags [.], seq 8688:10136, ack 1, win 1369, options [nop,nop,TS val 303220 ecr 547241], length 1448
16:16:06.077457 IP 112.26.0.8.35774 > 112.26.0.1.targus-getdata1: Flags [.], seq 15928:17376, ack 1, win 1369, options [nop,nop,TS val 303727 ecr 547531], length 1448
16:16:06.077703 IP 112.26.0.8.35774 > 112.26.0.1.targus-getdata1: Flags [.], seq 15928:17376, ack 1, win 1369, options [nop,nop,TS val 303727 ecr 547531], length 1448
16:16:06.083307 IP 112.26.0.1.targus-getdata1 > 112.26.0.8.35774: Flags [.], ack 10136, win 1432, options [nop,nop,TS val 547835 ecr 303220], length 0
16:16:06.083481 IP 112.26.0.1.targus-getdata1 > 112.26.0.8.35774: Flags [.], ack 10136, win 1432, options [nop,nop,TS val 547835 ecr 303220], length 0
16:16:06.162987 IP 112.26.0.8.35774 > 112.26.0.1.targus-getdata1: Flags [.], seq 10136:11584, ack 1, win 1369, options [nop,nop,TS val 303220 ecr 547241], length 1448
16:16:06.183515 IP 112.26.0.1.targus-getdata1 > 112.26.0.8.35774: Flags [.], ack 11584, win 1432, options [nop,nop,TS val 547935 ecr 303220], length 0
16:16:06.183760 IP 112.26.0.1.targus-getdata1 > 112.26.0.8.35774: Flags [.], ack 11584, win 1432, options [nop,nop,TS val 547935 ecr 303220], length 0
16:16:06.271009 IP 112.26.0.8.35774 > 112.26.0.1.targus-getdata1: Flags [.], seq 11584:13032, ack 1, win 1369, options [nop,nop,TS val 303220 ecr 547241], length 1448
16:16:06.287165 IP 112.26.0.1.targus-getdata1 > 112.26.0.8.35774: Flags [.], ack 13032, win 1432, options [nop,nop,TS val 548042 ecr 303220], length 0
16:16:06.287436 IP 112.26.0.1.targus-getdata1 > 112.26.0.8.35774: Flags [.], ack 13032, win 1432, options [nop,nop,TS val 548042 ecr 303220], length 0
16:16:06.291933 IP 112.26.0.8.35774 > 112.26.0.1.targus-getdata1: Flags [.], seq 17376:18824, ack 1, win 1369, options [nop,nop,TS val 303944 ecr 547632], length 1448
16:16:06.292205 IP 112.26.0.8.35774 > 112.26.0.1.targus-getdata1: Flags [.], seq 17376:18824, ack 1, win 1369, options [nop,nop,TS val 303944 ecr 547632], length 1448
16:16:06.473430 IP 112.26.0.8.35774 > 112.26.0.1.targus-getdata1: Flags [.], seq 13032:14480, ack 1, win 1369, options [nop,nop,TS val 303220 ecr 547241], length 1448
16:16:06.487598 IP 112.26.0.8.35774 > 112.26.0.1.targus-getdata1: Flags [.], seq 18824:20272, ack 1, win 1369, options [nop,nop,TS val 304139 ecr 547739], length 1448
16:16:06.487851 IP 112.26.0.8.35774 > 112.26.0.1.targus-getdata1: Flags [.], seq 18824:20272, ack 1, win 1369, options [nop,nop,TS val 304139 ecr 547739], length 1448
16:16:06.585383 IP 112.26.0.8.35774 > 112.26.0.1.targus-getdata1: Flags [.], seq 20272:21720, ack 1, win 1369, options [nop,nop,TS val 304232 ecr 547835], length 1448
16:16:06.585651 IP 112.26.0.8.35774 > 112.26.0.1.targus-getdata1: Flags [.], seq 20272:21720, ack 1, win 1369, options [nop,nop,TS val 304232 ecr 547835], length 1448
16:16:06.593755 IP 112.26.0.1.targus-getdata1 > 112.26.0.8.35774: Flags [.], ack 14480, win 1432, options [nop,nop,TS val 548245 ecr 303220], length 0
16:16:06.593932 IP 112.26.0.1.targus-getdata1 > 112.26.0.8.35774: Flags [.], ack 14480, win 1432, options [nop,nop,TS val 548245 ecr 303220], length 0
16:16:06.670376 IP 112.26.0.8.35774 > 112.26.0.1.targus-getdata1: Flags [.], seq 21720:23168, ack 1, win 1369, options [nop,nop,TS val 304232 ecr 547835], length 1448
16:16:06.670650 IP 112.26.0.8.35774 > 112.26.0.1.targus-getdata1: Flags [.], seq 21720:23168, ack 1, win 1369, options [nop,nop,TS val 304232 ecr 547835], length 1448
16:16:06.676465 IP 112.26.0.8.35774 > 112.26.0.1.targus-getdata1: Flags [.], seq 14480:15928, ack 1, win 1369, options [nop,nop,TS val 303536 ecr 547431], length 1448
16:16:06.694287 IP 112.26.0.8.35774 > 112.26.0.1.targus-getdata1: Flags [.], seq 14480:15928, ack 1, win 1369, options [nop,nop,TS val 303536 ecr 547431], length 1448
16:16:06.695688 IP 112.26.0.8.35774 > 112.26.0.1.targus-getdata1: Flags [.], seq 23168:24616, ack 1, win 1369, options [nop,nop,TS val 304335 ecr 547935], length 1448
16:16:06.695908 IP 112.26.0.8.35774 > 112.26.0.1.targus-getdata1: Flags [.], seq 23168:24616, ack 1, win 1369, options [nop,nop,TS val 304335 ecr 547935], length 1448
16:16:06.705903 IP 112.26.0.8.35774 > 112.26.0.1.targus-getdata1: Flags [.], seq 15928:17376, ack 1, win 1369, options [nop,nop,TS val 303727 ecr 547531], length 1448
16:16:06.770160 IP 112.26.0.8.35774 > 112.26.0.1.targus-getdata1: Flags [.], seq 24616:26064, ack 1, win 1369, options [nop,nop,TS val 304351 ecr 548042], length 1448
16:16:06.770491 IP 112.26.0.8.35774 > 112.26.0.1.targus-getdata1: Flags [.], seq 24616:26064, ack 1, win 1369, options [nop,nop,TS val 304351 ecr 548042], length 1448
16:16:06.779465 IP 112.26.0.1.targus-getdata1 > 112.26.0.8.35774: Flags [.], ack 15928, win 1432, options [nop,nop,TS val 548460 ecr 303536], length 0
16:16:06.789558 IP 112.26.0.8.35774 > 112.26.0.1.targus-getdata1: Flags [.], seq 26064:27512, ack 1, win 1369, options [nop,nop,TS val 304435 ecr 548460], length 1448
16:16:06.789742 IP 112.26.0.8.35774 > 112.26.0.1.targus-getdata1: Flags [.], seq 26064:27512, ack 1, win 1369, options [nop,nop,TS val 304435 ecr 548460], length 1448
16:16:06.798267 IP 112.26.0.8.35774 > 112.26.0.1.targus-getdata1: Flags [.], seq 15928:17376, ack 1, win 1369, options [nop,nop,TS val 303727 ecr 547531], length 1448
16:16:06.808875 IP 112.26.0.8.35774 > 112.26.0.1.targus-getdata1: Flags [.], seq 18824:20272, ack 1, win 1369, options [nop,nop,TS val 304139 ecr 547739], length 1448
16:16:06.866354 IP 112.26.0.8.35774 > 112.26.0.1.targus-getdata1: Flags [.], seq 27512:28960, ack 1, win 1369, options [nop,nop,TS val 304435 ecr 548460], length 1448
16:16:06.866667 IP 112.26.0.8.35774 > 112.26.0.1.targus-getdata1: Flags [.], seq 27512:28960, ack 1, win 1369, options [nop,nop,TS val 304435 ecr 548460], length 1448
16:16:06.882569 IP 112.26.0.8.35774 > 112.26.0.1.targus-getdata1: Flags [.], seq 28960:30408, ack 1, win 1369, options [nop,nop,TS val 304435 ecr 548460], length 1448
16:16:06.882776 IP 112.26.0.8.35774 > 112.26.0.1.targus-getdata1: Flags [.], seq 28960:30408, ack 1, win 1369, options [nop,nop,TS val 304435 ecr 548460], length 1448
16:16:06.890569 IP 112.26.0.8.35774 > 112.26.0.1.targus-getdata1: Flags [.], seq 20272:21720, ack 1, win 1369, options [nop,nop,TS val 304232 ecr 547835], length 1448
16:16:06.893383 IP 112.26.0.1.targus-getdata1 > 112.26.0.8.35774: Flags [.], ack 17376, win 1432, options [nop,nop,TS val 548569 ecr 303727], length 0
16:16:06.963019 IP 112.26.0.8.35774 > 112.26.0.1.targus-getdata1: Flags [.], seq 30408:31856, ack 1, win 1369, options [nop,nop,TS val 304548 ecr 548569], length 1448
16:16:06.963323 IP 112.26.0.8.35774 > 112.26.0.1.targus-getdata1: Flags [.], seq 30408:31856, ack 1, win 1369, options [nop,nop,TS val 304548 ecr 548569], length 1448
16:16:06.977599 IP 112.26.0.8.35774 > 112.26.0.1.targus-getdata1: Flags [.], seq 18824:20272, ack 1, win 1369, options [nop,nop,TS val 304139 ecr 547739], length 1448
16:16:06.987079 IP 112.26.0.8.35774 > 112.26.0.1.targus-getdata1: Flags [.], ack 1, win 1369, options [nop,nop,TS val 304625 ecr 548569], length 0
16:16:06.987222 IP 112.26.0.8.35774 > 112.26.0.1.targus-getdata1: Flags [.], ack 1, win 1369, options [nop,nop,TS val 304625 ecr 548569], length 0
16:16:07.005663 IP 112.26.0.8.35774 > 112.26.0.1.targus-getdata1: Flags [.], seq 20272:21720, ack 1, win 1369, options [nop,nop,TS val 304232 ecr 547835], length 1448
16:16:07.063520 IP 112.26.0.8.35774 > 112.26.0.1.targus-getdata1: Flags [.], seq 21720:23168, ack 1, win 1369, options [nop,nop,TS val 304232 ecr 547835], length 1448
16:16:07.083414 IP 112.26.0.8.35774 > 112.26.0.1.targus-getdata1: Flags [.], seq 23168:24616, ack 1, win 1369, options [nop,nop,TS val 304335 ecr 547935], length 1448
16:16:07.174488 IP 112.26.0.8.35774 > 112.26.0.1.targus-getdata1: Flags [.], seq 24616:26064, ack 1, win 1369, options [nop,nop,TS val 304351 ecr 548042], length 1448
16:16:07.176661 IP 112.26.0.1.targus-getdata1 > 112.26.0.8.35774: Flags [.], ack 17376, win 1432, options [nop,nop,TS val 548748 ecr 303727,nop,nop,sack 1 {18824:20272}], length 0
16:16:07.185299 IP 112.26.0.8.35774 > 112.26.0.1.targus-getdata1: Flags [.], seq 31856:33304, ack 1, win 1369, options [nop,nop,TS val 304832 ecr 548748], length 1448
16:16:07.185571 IP 112.26.0.8.35774 > 112.26.0.1.targus-getdata1: Flags [.], seq 31856:33304, ack 1, win 1369, options [nop,nop,TS val 304832 ecr 548748], length 1448
16:16:07.196502 IP 112.26.0.8.35774 > 112.26.0.1.targus-getdata1: Flags [.], seq 26064:27512, ack 1, win 1369, options [nop,nop,TS val 304435 ecr 548460], length 1448
16:16:07.268777 IP 112.26.0.8.35774 > 112.26.0.1.targus-getdata1: Flags [.], seq 21720:23168, ack 1, win 1369, options [nop,nop,TS val 304232 ecr 547835], length 1448
16:16:07.282291 IP 112.26.0.8.35774 > 112.26.0.1.targus-getdata1: Flags [.], seq 27512:28960, ack 1, win 1369, options [nop,nop,TS val 304435 ecr 548460], length 1448
16:16:07.292556 IP 112.26.0.1.targus-getdata1 > 112.26.0.8.35774: Flags [.], ack 17376, win 1432, options [nop,nop,TS val 548776 ecr 303727,nop,nop,sack 1 {18824:21720}], length 0
16:16:07.301539 IP 112.26.0.8.35774 > 112.26.0.1.targus-getdata1: Flags [.], seq 33304:34752, ack 1, win 1369, options [nop,nop,TS val 304952 ecr 548776], length 1448
16:16:07.301801 IP 112.26.0.8.35774 > 112.26.0.1.targus-getdata1: Flags [.], seq 33304:34752, ack 1, win 1369, options [nop,nop,TS val 304952 ecr 548776], length 1448
16:16:07.377331 IP 112.26.0.8.35774 > 112.26.0.1.targus-getdata1: Flags [.], seq 28960:30408, ack 1, win 1369, options [nop,nop,TS val 304435 ecr 548460], length 1448
16:16:07.388746 IP 112.26.0.8.35774 > 112.26.0.1.targus-getdata1: Flags [.], seq 23168:24616, ack 1, win 1369, options [nop,nop,TS val 304335 ecr 547935], length 1448
16:16:07.404193 IP 112.26.0.8.35774 > 112.26.0.1.targus-getdata1: Flags [.], seq 24616:26064, ack 1, win 1369, options [nop,nop,TS val 304351 ecr 548042], length 1448
16:16:07.493418 IP 112.26.0.8.35774 > 112.26.0.1.targus-getdata1: Flags [.], seq 26064:27512, ack 1, win 1369, options [nop,nop,TS val 304435 ecr 548460], length 1448
16:16:07.501245 IP 112.26.0.8.35774 > 112.26.0.1.targus-getdata1: Flags [.], ack 1, win 1369, options [nop,nop,TS val 304625 ecr 548569], length 0
16:16:07.583103 IP 112.26.0.1.targus-getdata1 > 112.26.0.8.35774: Flags [.], ack 17376, win 1432, options [nop,nop,TS val 549040 ecr 303727,nop,nop,sack 1 {18824:23168}], length 0
16:16:07.591354 IP 112.26.0.8.35774 > 112.26.0.1.targus-getdata1: Flags [.], seq 17376:18824, ack 1, win 1369, options [nop,nop,TS val 305239 ecr 549040], length 1448
16:16:07.591632 IP 112.26.0.8.35774 > 112.26.0.1.targus-getdata1: Flags [.], seq 17376:18824, ack 1, win 1369, options [nop,nop,TS val 305239 ecr 549040], length 1448
16:16:07.592793 IP 112.26.0.8.35774 > 112.26.0.1.targus-getdata1: Flags [.], seq 31856:33304, ack 1, win 1369, options [nop,nop,TS val 304832 ecr 548748], length 1448
16:16:07.678088 IP 112.26.0.8.35774 > 112.26.0.1.targus-getdata1: Flags [.], seq 27512:28960, ack 1, win 1369, options [nop,nop,TS val 304435 ecr 548460], length 1448
16:16:07.687746 IP 112.26.0.8.35774 > 112.26.0.1.targus-getdata1: Flags [.], seq 28960:30408, ack 1, win 1369, options [nop,nop,TS val 304435 ecr 548460], length 1448
16:16:07.774523 IP 112.26.0.8.35774 > 112.26.0.1.targus-getdata1: Flags [.], seq 33304:34752, ack 1, win 1369, options [nop,nop,TS val 304952 ecr 548776], length 1448
16:16:07.782400 IP 112.26.0.1.targus-getdata1 > 112.26.0.8.35774: Flags [.], ack 17376, win 1432, options [nop,nop,TS val 549159 ecr 303727,nop,nop,sack 1 {18824:24616}], length 0
16:16:07.788470 IP 112.26.0.8.35774 > 112.26.0.1.targus-getdata1: Flags [.], seq 34752:36200, ack 1, win 1369, options [nop,nop,TS val 305438 ecr 549159], length 1448
16:16:07.788745 IP 112.26.0.8.35774 > 112.26.0.1.targus-getdata1: Flags [.], seq 34752:36200, ack 1, win 1369, options [nop,nop,TS val 305438 ecr 549159], length 1448
16:16:07.809869 IP 112.26.0.1.targus-getdata1 > 112.26.0.8.35774: Flags [.], ack 17376, win 1432, options [nop,nop,TS val 549175 ecr 303727,nop,nop,sack 1 {18824:26064}], length 0
16:16:07.820822 IP 112.26.0.8.35774 > 112.26.0.1.targus-getdata1: Flags [.], seq 17376:18824, ack 1, win 1369, options [nop,nop,TS val 305239 ecr 549040], length 1448
16:16:07.879620 IP 112.26.0.1.targus-getdata1 > 112.26.0.8.35774: Flags [.], ack 17376, win 1432, options [nop,nop,TS val 549446 ecr 303727,nop,nop,sack 1 {18824:28960}], length 0
16:16:07.879885 IP 112.26.0.1.targus-getdata1 > 112.26.0.8.35774: Flags [.], ack 17376, win 1432, options [nop,nop,TS val 549446 ecr 303727,nop,nop,sack 1 {18824:28960}], length 0
16:16:07.893061 IP 112.26.0.8.35774 > 112.26.0.1.targus-getdata1: Flags [.], ack 1, win 1369, options [nop,nop,TS val 304625 ecr 548569], length 0
16:16:07.901085 IP 112.26.0.1.targus-getdata1 > 112.26.0.8.35774: Flags [.], ack 17376, win 1432, options [nop,nop,TS val 549458 ecr 303727,nop,nop,sack 1 {18824:30408}], length 0
16:16:07.901286 IP 112.26.0.1.targus-getdata1 > 112.26.0.8.35774: Flags [.], ack 17376, win 1432, options [nop,nop,TS val 549458 ecr 303727,nop,nop,sack 1 {18824:30408}], length 0
16:16:07.908872 IP 112.26.0.8.35774 > 112.26.0.1.targus-getdata1: Flags [.], seq 37648:39096, ack 1, win 1369, options [nop,nop,TS val 305556 ecr 549458], length 1448
16:16:07.909058 IP 112.26.0.8.35774 > 112.26.0.1.targus-getdata1: Flags [.], seq 37648:39096, ack 1, win 1369, options [nop,nop,TS val 305556 ecr 549458], length 1448
16:16:07.971214 IP 112.26.0.8.35774 > 112.26.0.1.targus-getdata1: Flags [.], seq 31856:33304, ack 1, win 1369, options [nop,nop,TS val 304832 ecr 548748], length 1448
16:16:07.988200 IP 112.26.0.8.35774 > 112.26.0.1.targus-getdata1: Flags [.], seq 34752:36200, ack 1, win 1369, options [nop,nop,TS val 305438 ecr 549159], length 1448
16:16:08.003724 IP 112.26.0.1.targus-getdata1 > 112.26.0.8.35774: Flags [.], ack 17376, win 1432, options [nop,nop,TS val 549264 ecr 303727,nop,nop,sack 1 {18824:27512}], length 0
16:16:08.083220 IP 112.26.0.8.35774 > 112.26.0.1.targus-getdata1: Flags [.], ack 1, win 1369, options [nop,nop,TS val 304625 ecr 548569], length 0
16:16:08.096657 IP 112.26.0.8.35774 > 112.26.0.1.targus-getdata1: Flags [.], seq 31856:33304, ack 1, win 1369, options [nop,nop,TS val 304832 ecr 548748], length 1448
16:16:08.106996 IP 112.26.0.8.35774 > 112.26.0.1.targus-getdata1: Flags [.], seq 37648:39096, ack 1, win 1369, options [nop,nop,TS val 305556 ecr 549458], length 1448
16:16:08.203007 IP 112.26.0.8.35774 > 112.26.0.1.targus-getdata1: Flags [.], seq 33304:34752, ack 1, win 1369, options [nop,nop,TS val 304952 ecr 548776], length 1448
16:16:08.276078 IP 112.26.0.8.35774 > 112.26.0.1.targus-getdata1: Flags [.], seq 33304:34752, ack 1, win 1369, options [nop,nop,TS val 304952 ecr 548776], length 1448
16:16:08.283599 IP 112.26.0.8.35774 > 112.26.0.1.targus-getdata1: Flags [.], seq 17376:18824, ack 1, win 1369, options [nop,nop,TS val 305239 ecr 549040], length 1448
16:16:08.292323 IP 112.26.0.8.35774 > 112.26.0.1.targus-getdata1: Flags [.], seq 34752:36200, ack 1, win 1369, options [nop,nop,TS val 305438 ecr 549159], length 1448
16:16:08.296746 IP 112.26.0.8.35774 > 112.26.0.1.targus-getdata1: Flags [.], seq 17376:18824, ack 1, win 1369, options [nop,nop,TS val 305239 ecr 549040], length 1448
16:16:08.383542 IP 112.26.0.8.35774 > 112.26.0.1.targus-getdata1: Flags [.], ack 1, win 1369, options [nop,nop,TS val 304625 ecr 548569], length 0
16:16:08.390383 IP 112.26.0.1.targus-getdata1 > 112.26.0.8.35774: Flags [.], ack 17376, win 1432, options [nop,nop,TS val 550063 ecr 303727,nop,nop,sack 2 {34752:36200}{18824:30408}], length 0
16:16:08.390600 IP 112.26.0.1.targus-getdata1 > 112.26.0.8.35774: Flags [.], ack 17376, win 1432, options [nop,nop,TS val 550063 ecr 303727,nop,nop,sack 2 {34752:36200}{18824:30408}], length 0
16:16:08.397391 IP 112.26.0.8.35774 > 112.26.0.1.targus-getdata1: Flags [.], seq 17376:18824, ack 1, win 1369, options [nop,nop,TS val 306045 ecr 550063], length 1448
16:16:08.400502 IP 112.26.0.8.35774 > 112.26.0.1.targus-getdata1: Flags [.], seq 17376:18824, ack 1, win 1369, options [nop,nop,TS val 306045 ecr 550063], length 1448
16:16:08.409836 IP 112.26.0.8.35774 > 112.26.0.1.targus-getdata1: Flags [.], seq 31856:33304, ack 1, win 1369, options [nop,nop,TS val 304832 ecr 548748], length 1448
16:16:08.424498 IP 112.26.0.1.targus-getdata1 > 112.26.0.8.35774: Flags [.], ack 30408, win 1363, options [nop,nop,TS val 550068 ecr 305239,nop,nop,sack 1 {34752:36200}], length 0
16:16:08.424679 IP 112.26.0.1.targus-getdata1 > 112.26.0.8.35774: Flags [.], ack 30408, win 1363, options [nop,nop,TS val 550068 ecr 305239,nop,nop,sack 1 {34752:36200}], length 0
16:16:08.488483 IP 112.26.0.8.35774 > 112.26.0.1.targus-getdata1: Flags [.], seq 37648:39096, ack 1, win 1369, options [nop,nop,TS val 305556 ecr 549458], length 1448
16:16:08.493015 IP 112.26.0.8.35774 > 112.26.0.1.targus-getdata1: Flags [.], seq 30408:31856, ack 1, win 1369, options [nop,nop,TS val 306079 ecr 550068], length 1448
16:16:08.494680 IP 112.26.0.8.35774 > 112.26.0.1.targus-getdata1: Flags [.], seq 30408:31856, ack 1, win 1369, options [nop,nop,TS val 306079 ecr 550068], length 1448
16:16:08.504374 IP 112.26.0.1.targus-getdata1 > 112.26.0.8.35774: Flags [.], ack 30408, win 1432, options [nop,nop,TS val 550154 ecr 305239,nop,nop,sack 1 {34752:36200}], length 0
16:16:08.504600 IP 112.26.0.1.targus-getdata1 > 112.26.0.8.35774: Flags [.], ack 30408, win 1432, options [nop,nop,TS val 550154 ecr 305239,nop,nop,sack 1 {34752:36200}], length 0
16:16:08.510359 IP 112.26.0.8.35774 > 112.26.0.1.targus-getdata1: Flags [.], seq 31856:33304, ack 1, win 1369, options [nop,nop,TS val 306079 ecr 550068], length 1448
16:16:08.528498 IP 112.26.0.8.35774 > 112.26.0.1.targus-getdata1: Flags [.], seq 33304:34752, ack 1, win 1369, options [nop,nop,TS val 306079 ecr 550068], length 1448
16:16:08.579001 IP 112.26.0.1.targus-getdata1 > 112.26.0.8.35774: Flags [.], ack 30408, win 1432, options [nop,nop,TS val 550180 ecr 305239,nop,nop,sack 1 {34752:36200}], length 0
16:16:08.579264 IP 112.26.0.1.targus-getdata1 > 112.26.0.8.35774: Flags [.], ack 30408, win 1432, options [nop,nop,TS val 550180 ecr 305239,nop,nop,sack 1 {34752:36200}], length 0
16:16:08.593625 IP 112.26.0.8.35774 > 112.26.0.1.targus-getdata1: Flags [.], seq 39096:40544, ack 1, win 1369, options [nop,nop,TS val 306079 ecr 550068], length 1448
16:16:08.595570 IP 112.26.0.8.35774 > 112.26.0.1.targus-getdata1: Flags [.], seq 31856:33304, ack 1, win 1369, options [nop,nop,TS val 306079 ecr 550068], length 1448
16:16:08.612793 IP 112.26.0.1.targus-getdata1 > 112.26.0.8.35774: Flags [.], ack 30408, win 1432, options [nop,nop,TS val 550259 ecr 305239,nop,nop,sack 2 {37648:39096}{34752:36200}], length 0
16:16:08.613006 IP 112.26.0.1.targus-getdata1 > 112.26.0.8.35774: Flags [.], ack 30408, win 1432, options [nop,nop,TS val 550259 ecr 305239,nop,nop,sack 2 {37648:39096}{34752:36200}], length 0
16:16:08.631918 IP 112.26.0.8.35774 > 112.26.0.1.targus-getdata1: Flags [.], seq 33304:34752, ack 1, win 1369, options [nop,nop,TS val 306079 ecr 550068], length 1448
16:16:08.680573 IP 112.26.0.1.targus-getdata1 > 112.26.0.8.35774: Flags [.], ack 31856, win 1421, options [nop,nop,TS val 550268 ecr 306079,nop,nop,sack 2 {37648:39096}{34752:36200}], length 0
16:16:08.680858 IP 112.26.0.1.targus-getdata1 > 112.26.0.8.35774: Flags [.], ack 31856, win 1421, options [nop,nop,TS val 550268 ecr 306079,nop,nop,sack 2 {37648:39096}{34752:36200}], length 0
16:16:08.687156 IP 112.26.0.8.35774 > 112.26.0.1.targus-getdata1: Flags [.], seq 33304:34752, ack 1, win 1369, options [nop,nop,TS val 304952 ecr 548776], length 1448
16:16:08.701744 IP 112.26.0.1.targus-getdata1 > 112.26.0.8.35774: Flags [.], ack 33304, win 1417, options [nop,nop,TS val 550377 ecr 306079,nop,nop,sack 2 {37648:39096}{34752:36200}], length 0
16:16:08.701911 IP 112.26.0.1.targus-getdata1 > 112.26.0.8.35774: Flags [.], ack 33304, win 1417, options [nop,nop,TS val 550377 ecr 306079,nop,nop,sack 2 {37648:39096}{34752:36200}], length 0
16:16:08.707772 IP 112.26.0.8.35774 > 112.26.0.1.targus-getdata1: Flags [.], seq 36200:37648, ack 1, win 1369, options [nop,nop,TS val 306350 ecr 550259], length 1448
16:16:08.730380 IP 112.26.0.1.targus-getdata1 > 112.26.0.8.35774: Flags [.], ack 33304, win 1425, options [nop,nop,TS val 550455 ecr 306079,nop,nop,sack 2 {37648:39096}{34752:36200}], length 0
16:16:08.730549 IP 112.26.0.1.targus-getdata1 > 112.26.0.8.35774: Flags [.], ack 33304, win 1425, options [nop,nop,TS val 550455 ecr 306079,nop,nop,sack 2 {37648:39096}{34752:36200}], length 0
16:16:08.781771 IP 112.26.0.8.35774 > 112.26.0.1.targus-getdata1: Flags [.], seq 17376:18824, ack 1, win 1369, options [nop,nop,TS val 306045 ecr 550063], length 1448
16:16:08.789231 IP 112.26.0.8.35774 > 112.26.0.1.targus-getdata1: Flags [.], seq 40544:41992, ack 1, win 1369, options [nop,nop,TS val 306368 ecr 550268], length 1448
16:16:08.804528 IP 112.26.0.8.35774 > 112.26.0.1.targus-getdata1: Flags [.], seq 41992:43440, ack 1, win 1369, options [nop,nop,TS val 306368 ecr 550268], length 1448
16:16:08.817698 IP 112.26.0.1.targus-getdata1 > 112.26.0.8.35774: Flags [.], ack 36200, win 1418, options [nop,nop,TS val 550463 ecr 306079,nop,nop,sack 1 {37648:39096}], length 0
16:16:08.817939 IP 112.26.0.1.targus-getdata1 > 112.26.0.8.35774: Flags [.], ack 36200, win 1418, options [nop,nop,TS val 550463 ecr 306079,nop,nop,sack 1 {37648:39096}], length 0
16:16:08.820365 IP 112.26.0.8.35774 > 112.26.0.1.targus-getdata1: Flags [.], seq 39096:40544, ack 1, win 1369, options [nop,nop,TS val 306079 ecr 550068], length 1448
16:16:08.829760 IP 112.26.0.8.35774 > 112.26.0.1.targus-getdata1: Flags [.], seq 43440:44888, ack 1, win 1369, options [nop,nop,TS val 306447 ecr 550377], length 1448
16:16:08.881230 IP 112.26.0.1.targus-getdata1 > 112.26.0.8.35774: Flags [.], ack 36200, win 1432, options [nop,nop,TS val 550552 ecr 306079,nop,nop,sack 2 {17376:18824}{37648:39096}], length 0
16:16:08.881424 IP 112.26.0.1.targus-getdata1 > 112.26.0.8.35774: Flags [.], ack 36200, win 1432, options [nop,nop,TS val 550552 ecr 306079,nop,nop,sack 2 {17376:18824}{37648:39096}], length 0
16:16:08.898553 IP 112.26.0.8.35774 > 112.26.0.1.targus-getdata1: Flags [.], seq 44888:46336, ack 1, win 1369, options [nop,nop,TS val 306447 ecr 550377], length 1448
16:16:08.904217 IP 112.26.0.1.targus-getdata1 > 112.26.0.8.35774: Flags [.], ack 36200, win 1432, options [nop,nop,TS val 550595 ecr 306079,nop,nop,sack 1 {37648:40544}], length 0
16:16:08.904429 IP 112.26.0.1.targus-getdata1 > 112.26.0.8.35774: Flags [.], ack 36200, win 1432, options [nop,nop,TS val 550595 ecr 306079,nop,nop,sack 1 {37648:40544}], length 0
16:16:08.908532 IP 112.26.0.8.35774 > 112.26.0.1.targus-getdata1: Flags [.], seq 36200:37648, ack 1, win 1369, options [nop,nop,TS val 306350 ecr 550259], length 1448
16:16:08.924543 IP 112.26.0.1.targus-getdata1 > 112.26.0.8.35774: Flags [.], ack 40544, win 1419, options [nop,nop,TS val 550682 ecr 306350], length 0
16:16:08.924684 IP 112.26.0.1.targus-getdata1 > 112.26.0.8.35774: Flags [.], ack 40544, win 1419, options [nop,nop,TS val 550682 ecr 306350], length 0
16:16:08.978453 IP 112.26.0.8.35774 > 112.26.0.1.targus-getdata1: Flags [.], seq 46336:47784, ack 1, win 1369, options [nop,nop,TS val 306542 ecr 550463], length 1448
16:16:08.987842 IP 112.26.0.8.35774 > 112.26.0.1.targus-getdata1: Flags [.], seq 40544:41992, ack 1, win 1369, options [nop,nop,TS val 306368 ecr 550268], length 1448
16:16:08.997284 IP 112.26.0.1.targus-getdata1 > 112.26.0.8.35774: Flags [.], ack 41992, win 1432, options [nop,nop,TS val 550761 ecr 306368], length 0
16:16:08.997512 IP 112.26.0.1.targus-getdata1 > 112.26.0.8.35774: Flags [.], ack 41992, win 1432, options [nop,nop,TS val 550761 ecr 306368], length 0
16:16:09.009531 IP 112.26.0.8.35774 > 112.26.0.1.targus-getdata1: Flags [.], seq 47784:49232, ack 1, win 1369, options [nop,nop,TS val 306572 ecr 550552], length 1448
16:16:09.019510 IP 112.26.0.8.35774 > 112.26.0.1.targus-getdata1: Flags [.], seq 41992:43440, ack 1, win 1369, options [nop,nop,TS val 306368 ecr 550268], length 1448
16:16:09.079445 IP 112.26.0.1.targus-getdata1 > 112.26.0.8.35774: Flags [.], ack 43440, win 1432, options [nop,nop,TS val 550846 ecr 306368], length 0
16:16:09.079702 IP 112.26.0.1.targus-getdata1 > 112.26.0.8.35774: Flags [.], ack 43440, win 1432, options [nop,nop,TS val 550846 ecr 306368], length 0
16:16:09.095555 IP 112.26.0.8.35774 > 112.26.0.1.targus-getdata1: Flags [.], seq 49232:50680, ack 1, win 1369, options [nop,nop,TS val 306664 ecr 550682], length 1448
16:16:09.096549 IP 112.26.0.8.35774 > 112.26.0.1.targus-getdata1: Flags [.], seq 43440:44888, ack 1, win 1369, options [nop,nop,TS val 306447 ecr 550377], length 1448
16:16:09.113455 IP 112.26.0.1.targus-getdata1 > 112.26.0.8.35774: Flags [.], ack 44888, win 1432, options [nop,nop,TS val 550878 ecr 306447], length 0
16:16:09.113714 IP 112.26.0.1.targus-getdata1 > 112.26.0.8.35774: Flags [.], ack 44888, win 1432, options [nop,nop,TS val 550878 ecr 306447], length 0
16:16:09.124852 IP 112.26.0.8.35774 > 112.26.0.1.targus-getdata1: Flags [.], seq 44888:46336, ack 1, win 1369, options [nop,nop,TS val 306447 ecr 550377], length 1448
16:16:09.188349 IP 112.26.0.1.targus-getdata1 > 112.26.0.8.35774: Flags [.], ack 46336, win 1432, options [nop,nop,TS val 550953 ecr 306447], length 0
16:16:09.188636 IP 112.26.0.1.targus-getdata1 > 112.26.0.8.35774: Flags [.], ack 46336, win 1432, options [nop,nop,TS val 550953 ecr 306447], length 0
16:16:09.196360 IP 112.26.0.8.35774 > 112.26.0.1.targus-getdata1: Flags [.], seq 50680:52128, ack 1, win 1369, options [nop,nop,TS val 306838 ecr 550846], length 1448
16:16:09.207268 IP 112.26.0.8.35774 > 112.26.0.1.targus-getdata1: Flags [.], seq 46336:47784, ack 1, win 1369, options [nop,nop,TS val 306542 ecr 550463], length 1448
16:16:09.216473 IP 112.26.0.1.targus-getdata1 > 112.26.0.8.35774: Flags [.], ack 47784, win 1432, options [nop,nop,TS val 550985 ecr 306542], length 0
16:16:09.216662 IP 112.26.0.1.targus-getdata1 > 112.26.0.8.35774: Flags [.], ack 47784, win 1432, options [nop,nop,TS val 550985 ecr 306542], length 0
16:16:09.292199 IP 112.26.0.8.35774 > 112.26.0.1.targus-getdata1: Flags [.], seq 47784:49232, ack 1, win 1369, options [nop,nop,TS val 306572 ecr 550552], length 1448
16:16:09.296891 IP 112.26.0.1.targus-getdata1 > 112.26.0.8.35774: Flags [.], ack 49232, win 1432, options [nop,nop,TS val 551065 ecr 306572], length 0
16:16:09.297113 IP 112.26.0.1.targus-getdata1 > 112.26.0.8.35774: Flags [.], ack 49232, win 1432, options [nop,nop,TS val 551065 ecr 306572], length 0
16:16:09.314145 IP 112.26.0.8.35774 > 112.26.0.1.targus-getdata1: Flags [.], seq 52128:53576, ack 1, win 1369, options [nop,nop,TS val 306965 ecr 550985], length 1448
16:16:09.318792 IP 112.26.0.8.35774 > 112.26.0.1.targus-getdata1: Flags [.], seq 49232:50680, ack 1, win 1369, options [nop,nop,TS val 306664 ecr 550682], length 1448
16:16:09.384595 IP 112.26.0.1.targus-getdata1 > 112.26.0.8.35774: Flags [.], ack 50680, win 1432, options [nop,nop,TS val 551091 ecr 306664], length 0
16:16:09.384900 IP 112.26.0.1.targus-getdata1 > 112.26.0.8.35774: Flags [.], ack 50680, win 1432, options [nop,nop,TS val 551091 ecr 306664], length 0
16:16:09.399876 IP 112.26.0.8.35774 > 112.26.0.1.targus-getdata1: Flags [.], seq 53576:55024, ack 1, win 1369, options [nop,nop,TS val 307052 ecr 551065], length 1448
16:16:09.405540 IP 112.26.0.8.35774 > 112.26.0.1.targus-getdata1: Flags [.], seq 50680:52128, ack 1, win 1369, options [nop,nop,TS val 306838 ecr 550846], length 1448
16:16:09.414601 IP 112.26.0.1.targus-getdata1 > 112.26.0.8.35774: Flags [.], ack 52128, win 1432, options [nop,nop,TS val 551178 ecr 306838], length 0
16:16:09.414798 IP 112.26.0.1.targus-getdata1 > 112.26.0.8.35774: Flags [.], ack 52128, win 1432, options [nop,nop,TS val 551178 ecr 306838], length 0
16:16:09.487948 IP 112.26.0.8.35774 > 112.26.0.1.targus-getdata1: Flags [.], seq 55024:56472, ack 1, win 1369, options [nop,nop,TS val 307137 ecr 551091], length 1448
16:16:09.496417 IP 112.26.0.8.35774 > 112.26.0.1.targus-getdata1: Flags [.], seq 52128:53576, ack 1, win 1369, options [nop,nop,TS val 306965 ecr 550985], length 1448
16:16:09.500469 IP 112.26.0.1.targus-getdata1 > 112.26.0.8.35774: Flags [.], ack 53576, win 1432, options [nop,nop,TS val 551269 ecr 306965], length 0
16:16:09.500671 IP 112.26.0.1.targus-getdata1 > 112.26.0.8.35774: Flags [.], ack 53576, win 1432, options [nop,nop,TS val 551269 ecr 306965], length 0
16:16:09.521216 IP 112.26.0.8.35774 > 112.26.0.1.targus-getdata1: Flags [.], seq 56472:57920, ack 1, win 1369, options [nop,nop,TS val 307137 ecr 551091], length 1448
16:16:09.590271 IP 112.26.0.8.35774 > 112.26.0.1.targus-getdata1: Flags [.], seq 53576:55024, ack 1, win 1369, options [nop,nop,TS val 307052 ecr 551065], length 1448
16:16:09.598263 IP 112.26.0.1.targus-getdata1 > 112.26.0.8.35774: Flags [.], ack 55024, win 1432, options [nop,nop,TS val 551363 ecr 307052], length 0
16:16:09.598477 IP 112.26.0.1.targus-getdata1 > 112.26.0.8.35774: Flags [.], ack 55024, win 1432, options [nop,nop,TS val 551363 ecr 307052], length 0
16:16:09.610403 IP 112.26.0.8.35774 > 112.26.0.1.targus-getdata1: Flags [.], seq 57920:59368, ack 1, win 1369, options [nop,nop,TS val 307164 ecr 551178], length 1448
16:16:09.622527 IP 112.26.0.8.35774 > 112.26.0.1.targus-getdata1: Flags [.], seq 55024:56472, ack 1, win 1369, options [nop,nop,TS val 307137 ecr 551091], length 1448
16:16:09.683119 IP 112.26.0.1.targus-getdata1 > 112.26.0.8.35774: Flags [.], ack 56472, win 1432, options [nop,nop,TS val 551395 ecr 307137], length 0
16:16:09.683356 IP 112.26.0.1.targus-getdata1 > 112.26.0.8.35774: Flags [.], ack 56472, win 1432, options [nop,nop,TS val 551395 ecr 307137], length 0
16:16:09.689014 IP 112.26.0.8.35774 > 112.26.0.1.targus-getdata1: Flags [.], seq 59368:60816, ack 1, win 1369, options [nop,nop,TS val 307234 ecr 551269], length 1448
16:16:09.707852 IP 112.26.0.8.35774 > 112.26.0.1.targus-getdata1: Flags [.], seq 60816:62264, ack 1, win 1369, options [nop,nop,TS val 307354 ecr 551363], length 1448
16:16:09.712013 IP 112.26.0.8.35774 > 112.26.0.1.targus-getdata1: Flags [.], seq 56472:57920, ack 1, win 1369, options [nop,nop,TS val 307137 ecr 551091], length 1448
16:16:09.716004 IP 112.26.0.1.targus-getdata1 > 112.26.0.8.35774: Flags [.], ack 57920, win 1432, options [nop,nop,TS val 551485 ecr 307137], length 0
