16:15:11.038927 IP 112.26.0.8.35772 > 112.26.0.1.targus-getdata1: Flags [S], seq 501555758, win 65535, options [mss 1460,sackOK,TS val 248512 ecr 0,nop,wscale 6], length 0
16:15:11.049627 IP 112.26.0.8.35772 > 112.26.0.1.targus-getdata1: Flags [S], seq 501555758, win 65535, options [mss 1460,sackOK,TS val 248512 ecr 0,nop,wscale 6], length 0
16:15:11.127851 IP 112.26.0.1.targus-getdata1 > 112.26.0.8.35772: Flags [S.], seq 851580856, ack 501555759, win 28960, options [mss 1460,sackOK,TS val 492822 ecr 248512,nop,wscale 7], length 0
16:15:11.147688 IP 112.26.0.1.targus-getdata1 > 112.26.0.8.35772: Flags [S.], seq 851580856, ack 501555759, win 28960, options [mss 1460,sackOK,TS val 492822 ecr 248512,nop,wscale 7], length 0
16:15:11.243196 IP 112.26.0.1.targus-getdata1 > 112.26.0.8.35772: Flags [S.], seq 851580856, ack 501555759, win 28960, options [mss 1460,sackOK,TS val 492822 ecr 248512,nop,wscale 7], length 0
16:15:11.342686 IP 112.26.0.8.35772 > 112.26.0.1.targus-getdata1: Flags [.], ack 1, win 1369, options [nop,nop,TS val 248894 ecr 492822], length 0
16:15:11.342915 IP 112.26.0.8.35772 > 112.26.0.1.targus-getdata1: Flags [.], ack 1, win 1369, options [nop,nop,TS val 248894 ecr 492822], length 0
16:15:47.656517 IP 112.26.0.8.35774 > 112.26.0.1.targus-getdata1: Flags [.], seq 1925573980:1925575428, ack 2111650953, win 1369, options [nop,nop,TS val 284617 ecr 528420], length 1448
16:15:47.656729 IP 112.26.0.8.35774 > 112.26.0.1.targus-getdata1: Flags [.], seq 0:1448, ack 1, win 1369, options [nop,nop,TS val 284617 ecr 528420], length 1448
16:15:48.250971 IP 112.26.0.8.35774 > 112.26.0.1.targus-getdata1: Flags [.], seq 1448:2896, ack 1, win 1369, options [nop,nop,TS val 285824 ecr 528420], length 1448
16:15:48.251385 IP 112.26.0.8.35774 > 112.26.0.1.targus-getdata1: Flags [.], seq 1448:2896, ack 1, win 1369, options [nop,nop,TS val 285824 ecr 528420], length 1448
16:15:49.354209 IP 112.26.0.8.35774 > 112.26.0.1.targus-getdata1: Flags [.], seq 4294957160:4294958608, ack 1, win 1369, options [nop,nop,TS val 286976 ecr 528420], length 1448
16:15:49.354527 IP 112.26.0.8.35774 > 112.26.0.1.targus-getdata1: Flags [.], seq 4294957160:4294958608, ack 1, win 1369, options [nop,nop,TS val 286976 ecr 528420], length 1448
16:15:51.678067 IP 112.26.0.8.35774 > 112.26.0.1.targus-getdata1: Flags [.], seq 4294957160:4294958608, ack 1, win 1369, options [nop,nop,TS val 289280 ecr 528420], length 1448
16:15:51.678444 IP 112.26.0.8.35774 > 112.26.0.1.targus-getdata1: Flags [.], seq 4294957160:4294958608, ack 1, win 1369, options [nop,nop,TS val 289280 ecr 528420], length 1448
16:15:56.405346 IP 112.26.0.8.35774 > 112.26.0.1.targus-getdata1: Flags [.], seq 4294957160:4294958608, ack 1, win 1369, options [nop,nop,TS val 293888 ecr 528420], length 1448
16:15:56.414986 IP 112.26.0.8.35774 > 112.26.0.1.targus-getdata1: Flags [.], seq 4294957160:4294958608, ack 1, win 1369, options [nop,nop,TS val 293888 ecr 528420], length 1448
16:16:05.469474 IP 112.26.0.8.35774 > 112.26.0.1.targus-getdata1: Flags [.], seq 4294957160:4294958608, ack 1, win 1369, options [nop,nop,TS val 303104 ecr 528420], length 1448
16:16:05.470299 IP 112.26.0.8.35774 > 112.26.0.1.targus-getdata1: Flags [.], seq 4294957160:4294958608, ack 1, win 1369, options [nop,nop,TS val 303104 ecr 528420], length 1448
16:16:05.472973 IP 112.26.0.1.targus-getdata1 > 112.26.0.8.35774: Flags [.], ack 2896, win 1432, options [nop,nop,TS val 547241 ecr 285824,nop,nop,sack 1 {4294957160:4294958608}], length 0
16:16:05.486200 IP 112.26.0.1.targus-getdata1 > 112.26.0.8.35774: Flags [.], ack 2896, win 1432, options [nop,nop,TS val 547241 ecr 285824,nop,nop,sack 1 {4294957160:4294958608}], length 0
16:16:05.565794 IP 112.26.0.1.targus-getdata1 > 112.26.0.8.35774: Flags [.], ack 2896, win 1432, options [nop,nop,TS val 547241 ecr 285824,nop,nop,sack 1 {4294957160:4294958608}], length 0
16:16:05.659005 IP 112.26.0.8.35774 > 112.26.0.1.targus-getdata1: Flags [.], seq 2896:4344, ack 1, win 1369, options [nop,nop,TS val 303219 ecr 547241], length 1448
16:16:05.660234 IP 112.26.0.8.35774 > 112.26.0.1.targus-getdata1: Flags [.], seq 2896:4344, ack 1, win 1369, options [nop,nop,TS val 303219 ecr 547241], length 1448
16:16:05.674662 IP 112.26.0.1.targus-getdata1 > 112.26.0.8.35774: Flags [.], ack 4344, win 1432, options [nop,nop,TS val 547431 ecr 303219], length 0
16:16:05.678774 IP 112.26.0.1.targus-getdata1 > 112.26.0.8.35774: Flags [.], ack 4344, win 1432, options [nop,nop,TS val 547431 ecr 303219], length 0
16:16:05.687988 IP 112.26.0.8.35774 > 112.26.0.1.targus-getdata1: Flags [.], seq 4344:5792, ack 1, win 1369, options [nop,nop,TS val 303219 ecr 547241], length 1448
16:16:05.759755 IP 112.26.0.8.35774 > 112.26.0.1.targus-getdata1: Flags [.], seq 4344:5792, ack 1, win 1369, options [nop,nop,TS val 303219 ecr 547241], length 1448
16:16:05.763272 IP 112.26.0.1.targus-getdata1 > 112.26.0.8.35774: Flags [.], ack 5792, win 1432, options [nop,nop,TS val 547531 ecr 303219], length 0
16:16:05.783172 IP 112.26.0.1.targus-getdata1 > 112.26.0.8.35774: Flags [.], ack 5792, win 1432, options [nop,nop,TS val 547531 ecr 303219], length 0
16:16:05.793000 IP 112.26.0.8.35774 > 112.26.0.1.targus-getdata1: Flags [.], seq 5792:7240, ack 1, win 1369, options [nop,nop,TS val 303220 ecr 547241], length 1448
16:16:05.861149 IP 112.26.0.8.35774 > 112.26.0.1.targus-getdata1: Flags [.], seq 5792:7240, ack 1, win 1369, options [nop,nop,TS val 303220 ecr 547241], length 1448
16:16:05.865825 IP 112.26.0.1.targus-getdata1 > 112.26.0.8.35774: Flags [.], ack 7240, win 1432, options [nop,nop,TS val 547632 ecr 303220], length 0
16:16:05.879442 IP 112.26.0.1.targus-getdata1 > 112.26.0.8.35774: Flags [.], ack 7240, win 1432, options [nop,nop,TS val 547632 ecr 303220], length 0
16:16:05.882703 IP 112.26.0.1.targus-getdata1 > 112.26.0.8.35774: Flags [.], ack 4344, win 1432, options [nop,nop,TS val 547431 ecr 303219], length 0
16:16:05.966918 IP 112.26.0.8.35774 > 112.26.0.1.targus-getdata1: Flags [.], seq 7240:8688, ack 1, win 1369, options [nop,nop,TS val 303220 ecr 547241], length 1448
16:16:05.968026 IP 112.26.0.8.35774 > 112.26.0.1.targus-getdata1: Flags [.], seq 7240:8688, ack 1, win 1369, options [nop,nop,TS val 303220 ecr 547241], length 1448
16:16:05.969419 IP 112.26.0.1.targus-getdata1 > 112.26.0.8.35774: Flags [.], ack 8688, win 1432, options [nop,nop,TS val 547739 ecr 303220], length 0
16:16:05.985012 IP 112.26.0.8.35774 > 112.26.0.1.targus-getdata1: Flags [.], seq 8688:10136, ack 1, win 1369, options [nop,nop,TS val 303220 ecr 547241], length 1448
16:16:05.986515 IP 112.26.0.1.targus-getdata1 > 112.26.0.8.35774: Flags [.], ack 8688, win 1432, options [nop,nop,TS val 547739 ecr 303220], length 0
16:16:06.063780 IP 112.26.0.8.35774 > 112.26.0.1.targus-getdata1: Flags [.], seq 8688:10136, ack 1, win 1369, options [nop,nop,TS val 303220 ecr 547241], length 1448
16:16:06.069651 IP 112.26.0.1.targus-getdata1 > 112.26.0.8.35774: Flags [.], ack 10136, win 1432, options [nop,nop,TS val 547835 ecr 303220], length 0
16:16:06.073279 IP 112.26.0.1.targus-getdata1 > 112.26.0.8.35774: Flags [.], ack 5792, win 1432, options [nop,nop,TS val 547531 ecr 303219], length 0
16:16:06.083192 IP 112.26.0.1.targus-getdata1 > 112.26.0.8.35774: Flags [.], ack 10136, win 1432, options [nop,nop,TS val 547835 ecr 303220], length 0
16:16:06.161732 IP 112.26.0.8.35774 > 112.26.0.1.targus-getdata1: Flags [.], seq 10136:11584, ack 1, win 1369, options [nop,nop,TS val 303220 ecr 547241], length 1448
16:16:06.162800 IP 112.26.0.8.35774 > 112.26.0.1.targus-getdata1: Flags [.], seq 10136:11584, ack 1, win 1369, options [nop,nop,TS val 303220 ecr 547241], length 1448
16:16:06.169587 IP 112.26.0.1.targus-getdata1 > 112.26.0.8.35774: Flags [.], ack 11584, win 1432, options [nop,nop,TS val 547935 ecr 303220], length 0
16:16:06.183401 IP 112.26.0.1.targus-getdata1 > 112.26.0.8.35774: Flags [.], ack 11584, win 1432, options [nop,nop,TS val 547935 ecr 303220], length 0
16:16:06.265868 IP 112.26.0.8.35774 > 112.26.0.1.targus-getdata1: Flags [.], seq 11584:13032, ack 1, win 1369, options [nop,nop,TS val 303220 ecr 547241], length 1448
16:16:06.270891 IP 112.26.0.8.35774 > 112.26.0.1.targus-getdata1: Flags [.], seq 11584:13032, ack 1, win 1369, options [nop,nop,TS val 303220 ecr 547241], length 1448
16:16:06.284208 IP 112.26.0.1.targus-getdata1 > 112.26.0.8.35774: Flags [.], ack 13032, win 1432, options [nop,nop,TS val 548042 ecr 303220], length 0
16:16:06.287051 IP 112.26.0.1.targus-getdata1 > 112.26.0.8.35774: Flags [.], ack 13032, win 1432, options [nop,nop,TS val 548042 ecr 303220], length 0
16:16:06.290294 IP 112.26.0.1.targus-getdata1 > 112.26.0.8.35774: Flags [.], ack 7240, win 1432, options [nop,nop,TS val 547632 ecr 303220], length 0
16:16:06.379559 IP 112.26.0.8.35774 > 112.26.0.1.targus-getdata1: Flags [.], seq 13032:14480, ack 1, win 1369, options [nop,nop,TS val 303220 ecr 547241], length 1448
16:16:06.466460 IP 112.26.0.8.35774 > 112.26.0.1.targus-getdata1: Flags [.], seq 14480:15928, ack 1, win 1369, options [nop,nop,TS val 303536 ecr 547431], length 1448
16:16:06.473313 IP 112.26.0.8.35774 > 112.26.0.1.targus-getdata1: Flags [.], seq 13032:14480, ack 1, win 1369, options [nop,nop,TS val 303220 ecr 547241], length 1448
16:16:06.476172 IP 112.26.0.1.targus-getdata1 > 112.26.0.8.35774: Flags [.], ack 14480, win 1432, options [nop,nop,TS val 548245 ecr 303220], length 0
16:16:06.485993 IP 112.26.0.1.targus-getdata1 > 112.26.0.8.35774: Flags [.], ack 8688, win 1432, options [nop,nop,TS val 547739 ecr 303220], length 0
16:16:06.569730 IP 112.26.0.8.35774 > 112.26.0.1.targus-getdata1: Flags [.], seq 15928:17376, ack 1, win 1369, options [nop,nop,TS val 303727 ecr 547531], length 1448
16:16:06.578900 IP 112.26.0.1.targus-getdata1 > 112.26.0.8.35774: Flags [.], ack 10136, win 1432, options [nop,nop,TS val 547835 ecr 303220], length 0
16:16:06.593641 IP 112.26.0.1.targus-getdata1 > 112.26.0.8.35774: Flags [.], ack 14480, win 1432, options [nop,nop,TS val 548245 ecr 303220], length 0
16:16:06.676345 IP 112.26.0.8.35774 > 112.26.0.1.targus-getdata1: Flags [.], seq 14480:15928, ack 1, win 1369, options [nop,nop,TS val 303536 ecr 547431], length 1448
16:16:06.676610 IP 112.26.0.8.35774 > 112.26.0.1.targus-getdata1: Flags [.], seq 14480:15928, ack 1, win 1369, options [nop,nop,TS val 303536 ecr 547431], length 1448
16:16:06.681746 IP 112.26.0.1.targus-getdata1 > 112.26.0.8.35774: Flags [.], ack 11584, win 1432, options [nop,nop,TS val 547935 ecr 303220], length 0
16:16:06.692936 IP 112.26.0.1.targus-getdata1 > 112.26.0.8.35774: Flags [.], ack 15928, win 1432, options [nop,nop,TS val 548460 ecr 303536], length 0
16:16:06.693255 IP 112.26.0.1.targus-getdata1 > 112.26.0.8.35774: Flags [.], ack 15928, win 1432, options [nop,nop,TS val 548460 ecr 303536], length 0
16:16:06.697421 IP 112.26.0.1.targus-getdata1 > 112.26.0.8.35774: Flags [.], ack 13032, win 1432, options [nop,nop,TS val 548042 ecr 303220], length 0
16:16:06.705770 IP 112.26.0.8.35774 > 112.26.0.1.targus-getdata1: Flags [.], seq 15928:17376, ack 1, win 1369, options [nop,nop,TS val 303727 ecr 547531], length 1448
16:16:06.706050 IP 112.26.0.8.35774 > 112.26.0.1.targus-getdata1: Flags [.], seq 15928:17376, ack 1, win 1369, options [nop,nop,TS val 303727 ecr 547531], length 1448
16:16:06.783091 IP 112.26.0.1.targus-getdata1 > 112.26.0.8.35774: Flags [.], ack 15928, win 1432, options [nop,nop,TS val 548460 ecr 303536], length 0
16:16:06.799414 IP 112.26.0.1.targus-getdata1 > 112.26.0.8.35774: Flags [.], ack 17376, win 1432, options [nop,nop,TS val 548569 ecr 303727], length 0
16:16:06.799760 IP 112.26.0.1.targus-getdata1 > 112.26.0.8.35774: Flags [.], ack 17376, win 1432, options [nop,nop,TS val 548569 ecr 303727], length 0
16:16:06.806835 IP 112.26.0.8.35774 > 112.26.0.1.targus-getdata1: Flags [.], seq 18824:20272, ack 1, win 1369, options [nop,nop,TS val 304139 ecr 547739], length 1448
16:16:06.808744 IP 112.26.0.8.35774 > 112.26.0.1.targus-getdata1: Flags [.], seq 18824:20272, ack 1, win 1369, options [nop,nop,TS val 304139 ecr 547739], length 1448
16:16:06.808952 IP 112.26.0.8.35774 > 112.26.0.1.targus-getdata1: Flags [.], seq 18824:20272, ack 1, win 1369, options [nop,nop,TS val 304139 ecr 547739], length 1448
16:16:06.888147 IP 112.26.0.8.35774 > 112.26.0.1.targus-getdata1: Flags [.], seq 20272:21720, ack 1, win 1369, options [nop,nop,TS val 304232 ecr 547835], length 1448
16:16:06.889365 IP 112.26.0.8.35774 > 112.26.0.1.targus-getdata1: Flags [.], seq 20272:21720, ack 1, win 1369, options [nop,nop,TS val 304232 ecr 547835], length 1448
16:16:06.889628 IP 112.26.0.8.35774 > 112.26.0.1.targus-getdata1: Flags [.], seq 20272:21720, ack 1, win 1369, options [nop,nop,TS val 304232 ecr 547835], length 1448
16:16:06.895903 IP 112.26.0.1.targus-getdata1 > 112.26.0.8.35774: Flags [.], ack 17376, win 1432, options [nop,nop,TS val 548569 ecr 303727], length 0
16:16:06.971614 IP 112.26.0.1.targus-getdata1 > 112.26.0.8.35774: Flags [.], ack 14480, win 1432, options [nop,nop,TS val 548245 ecr 303220], length 0
16:16:06.978356 IP 112.26.0.1.targus-getdata1 > 112.26.0.8.35774: Flags [.], ack 17376, win 1432, options [nop,nop,TS val 548748 ecr 303727,nop,nop,sack 1 {18824:20272}], length 0
16:16:06.978640 IP 112.26.0.1.targus-getdata1 > 112.26.0.8.35774: Flags [.], ack 17376, win 1432, options [nop,nop,TS val 548748 ecr 303727,nop,nop,sack 1 {18824:20272}], length 0
16:16:06.999470 IP 112.26.0.8.35774 > 112.26.0.1.targus-getdata1: Flags [.], seq 21720:23168, ack 1, win 1369, options [nop,nop,TS val 304232 ecr 547835], length 1448
16:16:07.004128 IP 112.26.0.8.35774 > 112.26.0.1.targus-getdata1: Flags [.], seq 21720:23168, ack 1, win 1369, options [nop,nop,TS val 304232 ecr 547835], length 1448
16:16:07.004354 IP 112.26.0.8.35774 > 112.26.0.1.targus-getdata1: Flags [.], seq 21720:23168, ack 1, win 1369, options [nop,nop,TS val 304232 ecr 547835], length 1448
16:16:07.007571 IP 112.26.0.1.targus-getdata1 > 112.26.0.8.35774: Flags [.], ack 17376, win 1432, options [nop,nop,TS val 548776 ecr 303727,nop,nop,sack 1 {18824:21720}], length 0
16:16:07.007765 IP 112.26.0.1.targus-getdata1 > 112.26.0.8.35774: Flags [.], ack 17376, win 1432, options [nop,nop,TS val 548776 ecr 303727,nop,nop,sack 1 {18824:21720}], length 0
16:16:07.077680 IP 112.26.0.8.35774 > 112.26.0.1.targus-getdata1: Flags [.], seq 23168:24616, ack 1, win 1369, options [nop,nop,TS val 304335 ecr 547935], length 1448
16:16:07.083293 IP 112.26.0.8.35774 > 112.26.0.1.targus-getdata1: Flags [.], seq 23168:24616, ack 1, win 1369, options [nop,nop,TS val 304335 ecr 547935], length 1448
16:16:07.083565 IP 112.26.0.8.35774 > 112.26.0.1.targus-getdata1: Flags [.], seq 23168:24616, ack 1, win 1369, options [nop,nop,TS val 304335 ecr 547935], length 1448
16:16:07.169651 IP 112.26.0.8.35774 > 112.26.0.1.targus-getdata1: Flags [.], seq 24616:26064, ack 1, win 1369, options [nop,nop,TS val 304351 ecr 548042], length 1448
16:16:07.174366 IP 112.26.0.8.35774 > 112.26.0.1.targus-getdata1: Flags [.], seq 24616:26064, ack 1, win 1369, options [nop,nop,TS val 304351 ecr 548042], length 1448
16:16:07.174626 IP 112.26.0.8.35774 > 112.26.0.1.targus-getdata1: Flags [.], seq 24616:26064, ack 1, win 1369, options [nop,nop,TS val 304351 ecr 548042], length 1448
16:16:07.181130 IP 112.26.0.1.targus-getdata1 > 112.26.0.8.35774: Flags [.], ack 17376, win 1432, options [nop,nop,TS val 548748 ecr 303727,nop,nop,sack 1 {18824:20272}], length 0
16:16:07.195538 IP 112.26.0.8.35774 > 112.26.0.1.targus-getdata1: Flags [.], seq 26064:27512, ack 1, win 1369, options [nop,nop,TS val 304435 ecr 548460], length 1448
16:16:07.196384 IP 112.26.0.8.35774 > 112.26.0.1.targus-getdata1: Flags [.], seq 26064:27512, ack 1, win 1369, options [nop,nop,TS val 304435 ecr 548460], length 1448
16:16:07.196596 IP 112.26.0.8.35774 > 112.26.0.1.targus-getdata1: Flags [.], seq 26064:27512, ack 1, win 1369, options [nop,nop,TS val 304435 ecr 548460], length 1448
16:16:07.269841 IP 112.26.0.1.targus-getdata1 > 112.26.0.8.35774: Flags [.], ack 17376, win 1432, options [nop,nop,TS val 549040 ecr 303727,nop,nop,sack 1 {18824:23168}], length 0
16:16:07.270248 IP 112.26.0.1.targus-getdata1 > 112.26.0.8.35774: Flags [.], ack 17376, win 1432, options [nop,nop,TS val 549040 ecr 303727,nop,nop,sack 1 {18824:23168}], length 0
16:16:07.280683 IP 112.26.0.8.35774 > 112.26.0.1.targus-getdata1: Flags [.], seq 27512:28960, ack 1, win 1369, options [nop,nop,TS val 304435 ecr 548460], length 1448
16:16:07.282164 IP 112.26.0.8.35774 > 112.26.0.1.targus-getdata1: Flags [.], seq 27512:28960, ack 1, win 1369, options [nop,nop,TS val 304435 ecr 548460], length 1448
16:16:07.282464 IP 112.26.0.8.35774 > 112.26.0.1.targus-getdata1: Flags [.], seq 27512:28960, ack 1, win 1369, options [nop,nop,TS val 304435 ecr 548460], length 1448
16:16:07.299293 IP 112.26.0.1.targus-getdata1 > 112.26.0.8.35774: Flags [.], ack 17376, win 1432, options [nop,nop,TS val 548776 ecr 303727,nop,nop,sack 1 {18824:21720}], length 0
16:16:07.375750 IP 112.26.0.8.35774 > 112.26.0.1.targus-getdata1: Flags [.], seq 28960:30408, ack 1, win 1369, options [nop,nop,TS val 304435 ecr 548460], length 1448
16:16:07.377206 IP 112.26.0.8.35774 > 112.26.0.1.targus-getdata1: Flags [.], seq 28960:30408, ack 1, win 1369, options [nop,nop,TS val 304435 ecr 548460], length 1448
16:16:07.377500 IP 112.26.0.8.35774 > 112.26.0.1.targus-getdata1: Flags [.], seq 28960:30408, ack 1, win 1369, options [nop,nop,TS val 304435 ecr 548460], length 1448
16:16:07.390281 IP 112.26.0.1.targus-getdata1 > 112.26.0.8.35774: Flags [.], ack 17376, win 1432, options [nop,nop,TS val 549159 ecr 303727,nop,nop,sack 1 {18824:24616}], length 0
16:16:07.390499 IP 112.26.0.1.targus-getdata1 > 112.26.0.8.35774: Flags [.], ack 17376, win 1432, options [nop,nop,TS val 549159 ecr 303727,nop,nop,sack 1 {18824:24616}], length 0
16:16:07.406068 IP 112.26.0.1.targus-getdata1 > 112.26.0.8.35774: Flags [.], ack 17376, win 1432, options [nop,nop,TS val 549175 ecr 303727,nop,nop,sack 1 {18824:26064}], length 0
16:16:07.406304 IP 112.26.0.1.targus-getdata1 > 112.26.0.8.35774: Flags [.], ack 17376, win 1432, options [nop,nop,TS val 549175 ecr 303727,nop,nop,sack 1 {18824:26064}], length 0
16:16:07.473851 IP 112.26.0.8.35774 > 112.26.0.1.targus-getdata1: Flags [.], ack 1, win 1369, options [nop,nop,TS val 304625 ecr 548569], length 0
16:16:07.501109 IP 112.26.0.8.35774 > 112.26.0.1.targus-getdata1: Flags [.], ack 1, win 1369, options [nop,nop,TS val 304625 ecr 548569], length 0
16:16:07.501370 IP 112.26.0.8.35774 > 112.26.0.1.targus-getdata1: Flags [.], ack 1, win 1369, options [nop,nop,TS val 304625 ecr 548569], length 0
16:16:07.512974 IP 112.26.0.8.35774 > 112.26.0.1.targus-getdata1: Flags [.], seq 31856:33304, ack 1, win 1369, options [nop,nop,TS val 304832 ecr 548748], length 1448
16:16:07.579109 IP 112.26.0.8.35774 > 112.26.0.1.targus-getdata1: Flags [.], seq 33304:34752, ack 1, win 1369, options [nop,nop,TS val 304952 ecr 548776], length 1448
16:16:07.585018 IP 112.26.0.1.targus-getdata1 > 112.26.0.8.35774: Flags [.], ack 17376, win 1432, options [nop,nop,TS val 549040 ecr 303727,nop,nop,sack 1 {18824:23168}], length 0
16:16:07.589801 IP 112.26.0.8.35774 > 112.26.0.1.targus-getdata1: Flags [.], seq 31856:33304, ack 1, win 1369, options [nop,nop,TS val 304832 ecr 548748], length 1448
16:16:07.590167 IP 112.26.0.8.35774 > 112.26.0.1.targus-getdata1: Flags [.], seq 31856:33304, ack 1, win 1369, options [nop,nop,TS val 304832 ecr 548748], length 1448
16:16:07.600295 IP 112.26.0.1.targus-getdata1 > 112.26.0.8.35774: Flags [.], ack 17376, win 1432, options [nop,nop,TS val 549264 ecr 303727,nop,nop,sack 1 {18824:27512}], length 0
16:16:07.600614 IP 112.26.0.1.targus-getdata1 > 112.26.0.8.35774: Flags [.], ack 17376, win 1432, options [nop,nop,TS val 549264 ecr 303727,nop,nop,sack 1 {18824:27512}], length 0
16:16:07.610066 IP 112.26.0.8.35774 > 112.26.0.1.targus-getdata1: Flags [.], seq 17376:18824, ack 1, win 1369, options [nop,nop,TS val 305239 ecr 549040], length 1448
16:16:07.697936 IP 112.26.0.1.targus-getdata1 > 112.26.0.8.35774: Flags [.], ack 17376, win 1432, options [nop,nop,TS val 549446 ecr 303727,nop,nop,sack 1 {18824:28960}], length 0
16:16:07.774365 IP 112.26.0.8.35774 > 112.26.0.1.targus-getdata1: Flags [.], seq 33304:34752, ack 1, win 1369, options [nop,nop,TS val 304952 ecr 548776], length 1448
16:16:07.774730 IP 112.26.0.8.35774 > 112.26.0.1.targus-getdata1: Flags [.], seq 33304:34752, ack 1, win 1369, options [nop,nop,TS val 304952 ecr 548776], length 1448
16:16:07.777841 IP 112.26.0.1.targus-getdata1 > 112.26.0.8.35774: Flags [.], ack 17376, win 1432, options [nop,nop,TS val 549458 ecr 303727,nop,nop,sack 1 {18824:30408}], length 0
16:16:07.787145 IP 112.26.0.1.targus-getdata1 > 112.26.0.8.35774: Flags [.], ack 17376, win 1432, options [nop,nop,TS val 549159 ecr 303727,nop,nop,sack 1 {18824:24616}], length 0
16:16:07.798289 IP 112.26.0.8.35774 > 112.26.0.1.targus-getdata1: Flags [.], seq 34752:36200, ack 1, win 1369, options [nop,nop,TS val 305438 ecr 549159], length 1448
16:16:07.812328 IP 112.26.0.1.targus-getdata1 > 112.26.0.8.35774: Flags [.], ack 17376, win 1432, options [nop,nop,TS val 549175 ecr 303727,nop,nop,sack 1 {18824:26064}], length 0
16:16:07.818006 IP 112.26.0.8.35774 > 112.26.0.1.targus-getdata1: Flags [.], seq 17376:18824, ack 1, win 1369, options [nop,nop,TS val 305239 ecr 549040], length 1448
16:16:07.818292 IP 112.26.0.8.35774 > 112.26.0.1.targus-getdata1: Flags [.], seq 17376:18824, ack 1, win 1369, options [nop,nop,TS val 305239 ecr 549040], length 1448
16:16:07.881108 IP 112.26.0.1.targus-getdata1 > 112.26.0.8.35774: Flags [.], ack 17376, win 1432, options [nop,nop,TS val 549446 ecr 303727,nop,nop,sack 1 {18824:28960}], length 0
16:16:07.881800 IP 112.26.0.1.targus-getdata1 > 112.26.0.8.35774: Flags [.], ack 17376, win 1432, options [nop,nop,TS val 549446 ecr 303727,nop,nop,sack 1 {18824:28960}], length 0
16:16:07.900970 IP 112.26.0.1.targus-getdata1 > 112.26.0.8.35774: Flags [.], ack 17376, win 1432, options [nop,nop,TS val 549458 ecr 303727,nop,nop,sack 1 {18824:30408}], length 0
16:16:07.902904 IP 112.26.0.1.targus-getdata1 > 112.26.0.8.35774: Flags [.], ack 17376, win 1432, options [nop,nop,TS val 549458 ecr 303727,nop,nop,sack 1 {18824:30408}], length 0
16:16:07.981411 IP 112.26.0.8.35774 > 112.26.0.1.targus-getdata1: Flags [.], seq 37648:39096, ack 1, win 1369, options [nop,nop,TS val 305556 ecr 549458], length 1448
16:16:07.988080 IP 112.26.0.8.35774 > 112.26.0.1.targus-getdata1: Flags [.], seq 34752:36200, ack 1, win 1369, options [nop,nop,TS val 305438 ecr 549159], length 1448
16:16:07.988341 IP 112.26.0.8.35774 > 112.26.0.1.targus-getdata1: Flags [.], seq 34752:36200, ack 1, win 1369, options [nop,nop,TS val 305438 ecr 549159], length 1448
16:16:08.005630 IP 112.26.0.1.targus-getdata1 > 112.26.0.8.35774: Flags [.], ack 17376, win 1432, options [nop,nop,TS val 549264 ecr 303727,nop,nop,sack 1 {18824:27512}], length 0
16:16:08.083095 IP 112.26.0.8.35774 > 112.26.0.1.targus-getdata1: Flags [.], ack 1, win 1369, options [nop,nop,TS val 304625 ecr 548569], length 0
16:16:08.083349 IP 112.26.0.8.35774 > 112.26.0.1.targus-getdata1: Flags [.], ack 1, win 1369, options [nop,nop,TS val 304625 ecr 548569], length 0
16:16:08.096535 IP 112.26.0.8.35774 > 112.26.0.1.targus-getdata1: Flags [.], seq 31856:33304, ack 1, win 1369, options [nop,nop,TS val 304832 ecr 548748], length 1448
16:16:08.096884 IP 112.26.0.8.35774 > 112.26.0.1.targus-getdata1: Flags [.], seq 31856:33304, ack 1, win 1369, options [nop,nop,TS val 304832 ecr 548748], length 1448
16:16:08.106874 IP 112.26.0.8.35774 > 112.26.0.1.targus-getdata1: Flags [.], seq 37648:39096, ack 1, win 1369, options [nop,nop,TS val 305556 ecr 549458], length 1448
16:16:08.107160 IP 112.26.0.8.35774 > 112.26.0.1.targus-getdata1: Flags [.], seq 37648:39096, ack 1, win 1369, options [nop,nop,TS val 305556 ecr 549458], length 1448
16:16:08.275906 IP 112.26.0.8.35774 > 112.26.0.1.targus-getdata1: Flags [.], seq 33304:34752, ack 1, win 1369, options [nop,nop,TS val 304952 ecr 548776], length 1448
16:16:08.276329 IP 112.26.0.8.35774 > 112.26.0.1.targus-getdata1: Flags [.], seq 33304:34752, ack 1, win 1369, options [nop,nop,TS val 304952 ecr 548776], length 1448
16:16:08.292994 IP 112.26.0.1.targus-getdata1 > 112.26.0.8.35774: Flags [.], ack 17376, win 1432, options [nop,nop,TS val 550063 ecr 303727,nop,nop,sack 2 {34752:36200}{18824:30408}], length 0
16:16:08.296629 IP 112.26.0.8.35774 > 112.26.0.1.targus-getdata1: Flags [.], seq 17376:18824, ack 1, win 1369, options [nop,nop,TS val 305239 ecr 549040], length 1448
16:16:08.387251 IP 112.26.0.1.targus-getdata1 > 112.26.0.8.35774: Flags [.], ack 30408, win 1363, options [nop,nop,TS val 550068 ecr 305239,nop,nop,sack 1 {34752:36200}], length 0
16:16:08.390270 IP 112.26.0.1.targus-getdata1 > 112.26.0.8.35774: Flags [.], ack 17376, win 1432, options [nop,nop,TS val 550063 ecr 303727,nop,nop,sack 2 {34752:36200}{18824:30408}], length 0
16:16:08.391519 IP 112.26.0.1.targus-getdata1 > 112.26.0.8.35774: Flags [.], ack 17376, win 1432, options [nop,nop,TS val 550063 ecr 303727,nop,nop,sack 2 {34752:36200}{18824:30408}], length 0
16:16:08.400383 IP 112.26.0.8.35774 > 112.26.0.1.targus-getdata1: Flags [.], seq 17376:18824, ack 1, win 1369, options [nop,nop,TS val 306045 ecr 550063], length 1448
16:16:08.400665 IP 112.26.0.8.35774 > 112.26.0.1.targus-getdata1: Flags [.], seq 17376:18824, ack 1, win 1369, options [nop,nop,TS val 306045 ecr 550063], length 1448
16:16:08.414054 IP 112.26.0.1.targus-getdata1 > 112.26.0.8.35774: Flags [.], ack 30408, win 1432, options [nop,nop,TS val 550154 ecr 305239,nop,nop,sack 1 {34752:36200}], length 0
16:16:08.424384 IP 112.26.0.1.targus-getdata1 > 112.26.0.8.35774: Flags [.], ack 30408, win 1363, options [nop,nop,TS val 550068 ecr 305239,nop,nop,sack 1 {34752:36200}], length 0
16:16:08.425625 IP 112.26.0.1.targus-getdata1 > 112.26.0.8.35774: Flags [.], ack 30408, win 1363, options [nop,nop,TS val 550068 ecr 305239,nop,nop,sack 1 {34752:36200}], length 0
16:16:08.478386 IP 112.26.0.1.targus-getdata1 > 112.26.0.8.35774: Flags [.], ack 30408, win 1432, options [nop,nop,TS val 550180 ecr 305239,nop,nop,sack 1 {34752:36200}], length 0
16:16:08.494565 IP 112.26.0.8.35774 > 112.26.0.1.targus-getdata1: Flags [.], seq 30408:31856, ack 1, win 1369, options [nop,nop,TS val 306079 ecr 550068], length 1448
16:16:08.497325 IP 112.26.0.8.35774 > 112.26.0.1.targus-getdata1: Flags [.], seq 30408:31856, ack 1, win 1369, options [nop,nop,TS val 306079 ecr 550068], length 1448
16:16:08.504260 IP 112.26.0.1.targus-getdata1 > 112.26.0.8.35774: Flags [.], ack 30408, win 1432, options [nop,nop,TS val 550154 ecr 305239,nop,nop,sack 1 {34752:36200}], length 0
16:16:08.508187 IP 112.26.0.1.targus-getdata1 > 112.26.0.8.35774: Flags [.], ack 30408, win 1432, options [nop,nop,TS val 550154 ecr 305239,nop,nop,sack 1 {34752:36200}], length 0
16:16:08.533665 IP 112.26.0.1.targus-getdata1 > 112.26.0.8.35774: Flags [.], ack 30408, win 1432, options [nop,nop,TS val 550259 ecr 305239,nop,nop,sack 2 {37648:39096}{34752:36200}], length 0
16:16:08.578839 IP 112.26.0.1.targus-getdata1 > 112.26.0.8.35774: Flags [.], ack 30408, win 1432, options [nop,nop,TS val 550180 ecr 305239,nop,nop,sack 1 {34752:36200}], length 0
16:16:08.580533 IP 112.26.0.1.targus-getdata1 > 112.26.0.8.35774: Flags [.], ack 30408, win 1432, options [nop,nop,TS val 550180 ecr 305239,nop,nop,sack 1 {34752:36200}], length 0
16:16:08.595998 IP 112.26.0.1.targus-getdata1 > 112.26.0.8.35774: Flags [.], ack 31856, win 1421, options [nop,nop,TS val 550268 ecr 306079,nop,nop,sack 2 {37648:39096}{34752:36200}], length 0
16:16:08.602415 IP 112.26.0.8.35774 > 112.26.0.1.targus-getdata1: Flags [.], seq 31856:33304, ack 1, win 1369, options [nop,nop,TS val 306079 ecr 550068], length 1448
16:16:08.606360 IP 112.26.0.8.35774 > 112.26.0.1.targus-getdata1: Flags [.], seq 31856:33304, ack 1, win 1369, options [nop,nop,TS val 306079 ecr 550068], length 1448
16:16:08.612679 IP 112.26.0.1.targus-getdata1 > 112.26.0.8.35774: Flags [.], ack 30408, win 1432, options [nop,nop,TS val 550259 ecr 305239,nop,nop,sack 2 {37648:39096}{34752:36200}], length 0
16:16:08.624191 IP 112.26.0.1.targus-getdata1 > 112.26.0.8.35774: Flags [.], ack 33304, win 1417, options [nop,nop,TS val 550377 ecr 306079,nop,nop,sack 2 {37648:39096}{34752:36200}], length 0
16:16:08.631792 IP 112.26.0.8.35774 > 112.26.0.1.targus-getdata1: Flags [.], seq 33304:34752, ack 1, win 1369, options [nop,nop,TS val 306079 ecr 550068], length 1448
16:16:08.680405 IP 112.26.0.1.targus-getdata1 > 112.26.0.8.35774: Flags [.], ack 31856, win 1421, options [nop,nop,TS val 550268 ecr 306079,nop,nop,sack 2 {37648:39096}{34752:36200}], length 0
16:16:08.692422 IP 112.26.0.8.35774 > 112.26.0.1.targus-getdata1: Flags [.], seq 33304:34752, ack 1, win 1369, options [nop,nop,TS val 306079 ecr 550068], length 1448
16:16:08.696897 IP 112.26.0.1.targus-getdata1 > 112.26.0.8.35774: Flags [.], ack 30408, win 1432, options [nop,nop,TS val 550259 ecr 305239,nop,nop,sack 2 {37648:39096}{34752:36200}], length 0
16:16:08.701630 IP 112.26.0.1.targus-getdata1 > 112.26.0.8.35774: Flags [.], ack 33304, win 1417, options [nop,nop,TS val 550377 ecr 306079,nop,nop,sack 2 {37648:39096}{34752:36200}], length 0
16:16:08.711342 IP 112.26.0.1.targus-getdata1 > 112.26.0.8.35774: Flags [.], ack 33304, win 1425, options [nop,nop,TS val 550455 ecr 306079,nop,nop,sack 2 {37648:39096}{34752:36200}], length 0
16:16:08.716182 IP 112.26.0.1.targus-getdata1 > 112.26.0.8.35774: Flags [.], ack 31856, win 1421, options [nop,nop,TS val 550268 ecr 306079,nop,nop,sack 2 {37648:39096}{34752:36200}], length 0
16:16:08.730267 IP 112.26.0.1.targus-getdata1 > 112.26.0.8.35774: Flags [.], ack 33304, win 1425, options [nop,nop,TS val 550455 ecr 306079,nop,nop,sack 2 {37648:39096}{34752:36200}], length 0
16:16:08.787543 IP 112.26.0.1.targus-getdata1 > 112.26.0.8.35774: Flags [.], ack 36200, win 1418, options [nop,nop,TS val 550463 ecr 306079,nop,nop,sack 1 {37648:39096}], length 0
16:16:08.795013 IP 112.26.0.1.targus-getdata1 > 112.26.0.8.35774: Flags [.], ack 33304, win 1417, options [nop,nop,TS val 550377 ecr 306079,nop,nop,sack 2 {37648:39096}{34752:36200}], length 0
16:16:08.806841 IP 112.26.0.1.targus-getdata1 > 112.26.0.8.35774: Flags [.], ack 36200, win 1432, options [nop,nop,TS val 550552 ecr 306079,nop,nop,sack 2 {17376:18824}{37648:39096}], length 0
16:16:08.814906 IP 112.26.0.1.targus-getdata1 > 112.26.0.8.35774: Flags [.], ack 33304, win 1425, options [nop,nop,TS val 550455 ecr 306079,nop,nop,sack 2 {37648:39096}{34752:36200}], length 0
16:16:08.817584 IP 112.26.0.1.targus-getdata1 > 112.26.0.8.35774: Flags [.], ack 36200, win 1418, options [nop,nop,TS val 550463 ecr 306079,nop,nop,sack 1 {37648:39096}], length 0
16:16:08.820251 IP 112.26.0.8.35774 > 112.26.0.1.targus-getdata1: Flags [.], seq 39096:40544, ack 1, win 1369, options [nop,nop,TS val 306079 ecr 550068], length 1448
16:16:08.823549 IP 112.26.0.8.35774 > 112.26.0.1.targus-getdata1: Flags [.], seq 39096:40544, ack 1, win 1369, options [nop,nop,TS val 306079 ecr 550068], length 1448
16:16:08.881074 IP 112.26.0.1.targus-getdata1 > 112.26.0.8.35774: Flags [.], ack 36200, win 1432, options [nop,nop,TS val 550552 ecr 306079,nop,nop,sack 2 {17376:18824}{37648:39096}], length 0
16:16:08.882285 IP 112.26.0.1.targus-getdata1 > 112.26.0.8.35774: Flags [.], ack 36200, win 1432, options [nop,nop,TS val 550595 ecr 306079,nop,nop,sack 1 {37648:40544}], length 0
16:16:08.889084 IP 112.26.0.1.targus-getdata1 > 112.26.0.8.35774: Flags [.], ack 36200, win 1418, options [nop,nop,TS val 550463 ecr 306079,nop,nop,sack 1 {37648:39096}], length 0
16:16:08.900433 IP 112.26.0.1.targus-getdata1 > 112.26.0.8.35774: Flags [.], ack 36200, win 1432, options [nop,nop,TS val 550595 ecr 306079,nop,nop,sack 1 {37648:40544}], length 0
16:16:08.908417 IP 112.26.0.8.35774 > 112.26.0.1.targus-getdata1: Flags [.], seq 36200:37648, ack 1, win 1369, options [nop,nop,TS val 306350 ecr 550259], length 1448
16:16:08.912441 IP 112.26.0.1.targus-getdata1 > 112.26.0.8.35774: Flags [.], ack 40544, win 1419, options [nop,nop,TS val 550682 ecr 306350], length 0
16:16:08.916056 IP 112.26.0.8.35774 > 112.26.0.1.targus-getdata1: Flags [.], seq 36200:37648, ack 1, win 1369, options [nop,nop,TS val 306350 ecr 550259], length 1448
16:16:08.918342 IP 112.26.0.1.targus-getdata1 > 112.26.0.8.35774: Flags [.], ack 36200, win 1432, options [nop,nop,TS val 550552 ecr 306079,nop,nop,sack 2 {17376:18824}{37648:39096}], length 0
16:16:08.924429 IP 112.26.0.1.targus-getdata1 > 112.26.0.8.35774: Flags [.], ack 40544, win 1419, options [nop,nop,TS val 550682 ecr 306350], length 0
16:16:08.977378 IP 112.26.0.1.targus-getdata1 > 112.26.0.8.35774: Flags [.], ack 36200, win 1432, options [nop,nop,TS val 550595 ecr 306079,nop,nop,sack 1 {37648:40544}], length 0
16:16:08.987718 IP 112.26.0.8.35774 > 112.26.0.1.targus-getdata1: Flags [.], seq 40544:41992, ack 1, win 1369, options [nop,nop,TS val 306368 ecr 550268], length 1448
16:16:08.992994 IP 112.26.0.8.35774 > 112.26.0.1.targus-getdata1: Flags [.], seq 40544:41992, ack 1, win 1369, options [nop,nop,TS val 306368 ecr 550268], length 1448
16:16:08.993834 IP 112.26.0.1.targus-getdata1 > 112.26.0.8.35774: Flags [.], ack 41992, win 1432, options [nop,nop,TS val 550761 ecr 306368], length 0
16:16:08.996285 IP 112.26.0.1.targus-getdata1 > 112.26.0.8.35774: Flags [.], ack 41992, win 1432, options [nop,nop,TS val 550761 ecr 306368], length 0
16:16:09.010529 IP 112.26.0.1.targus-getdata1 > 112.26.0.8.35774: Flags [.], ack 40544, win 1419, options [nop,nop,TS val 550682 ecr 306350], length 0
16:16:09.019395 IP 112.26.0.8.35774 > 112.26.0.1.targus-getdata1: Flags [.], seq 41992:43440, ack 1, win 1369, options [nop,nop,TS val 306368 ecr 550268], length 1448
16:16:09.076223 IP 112.26.0.1.targus-getdata1 > 112.26.0.8.35774: Flags [.], ack 43440, win 1432, options [nop,nop,TS val 550846 ecr 306368], length 0
16:16:09.083268 IP 112.26.0.1.targus-getdata1 > 112.26.0.8.35774: Flags [.], ack 43440, win 1432, options [nop,nop,TS val 550846 ecr 306368], length 0
16:16:09.084333 IP 112.26.0.8.35774 > 112.26.0.1.targus-getdata1: Flags [.], seq 41992:43440, ack 1, win 1369, options [nop,nop,TS val 306368 ecr 550268], length 1448
16:16:09.096434 IP 112.26.0.8.35774 > 112.26.0.1.targus-getdata1: Flags [.], seq 43440:44888, ack 1, win 1369, options [nop,nop,TS val 306447 ecr 550377], length 1448
16:16:09.099508 IP 112.26.0.1.targus-getdata1 > 112.26.0.8.35774: Flags [.], ack 41992, win 1432, options [nop,nop,TS val 550761 ecr 306368], length 0
16:16:09.108742 IP 112.26.0.8.35774 > 112.26.0.1.targus-getdata1: Flags [.], seq 43440:44888, ack 1, win 1369, options [nop,nop,TS val 306447 ecr 550377], length 1448
16:16:09.112133 IP 112.26.0.1.targus-getdata1 > 112.26.0.8.35774: Flags [.], ack 44888, win 1432, options [nop,nop,TS val 550878 ecr 306447], length 0
16:16:09.114271 IP 112.26.0.1.targus-getdata1 > 112.26.0.8.35774: Flags [.], ack 44888, win 1432, options [nop,nop,TS val 550878 ecr 306447], length 0
16:16:09.124724 IP 112.26.0.8.35774 > 112.26.0.1.targus-getdata1: Flags [.], seq 44888:46336, ack 1, win 1369, options [nop,nop,TS val 306447 ecr 550377], length 1448
16:16:09.185685 IP 112.26.0.1.targus-getdata1 > 112.26.0.8.35774: Flags [.], ack 46336, win 1432, options [nop,nop,TS val 550953 ecr 306447], length 0
16:16:09.190777 IP 112.26.0.1.targus-getdata1 > 112.26.0.8.35774: Flags [.], ack 46336, win 1432, options [nop,nop,TS val 550953 ecr 306447], length 0
16:16:09.194111 IP 112.26.0.1.targus-getdata1 > 112.26.0.8.35774: Flags [.], ack 43440, win 1432, options [nop,nop,TS val 550846 ecr 306368], length 0
16:16:09.196563 IP 112.26.0.8.35774 > 112.26.0.1.targus-getdata1: Flags [.], seq 44888:46336, ack 1, win 1369, options [nop,nop,TS val 306447 ecr 550377], length 1448
16:16:09.207152 IP 112.26.0.8.35774 > 112.26.0.1.targus-getdata1: Flags [.], seq 46336:47784, ack 1, win 1369, options [nop,nop,TS val 306542 ecr 550463], length 1448
16:16:09.208675 IP 112.26.0.1.targus-getdata1 > 112.26.0.8.35774: Flags [.], ack 44888, win 1432, options [nop,nop,TS val 550878 ecr 306447], length 0
16:16:09.216359 IP 112.26.0.1.targus-getdata1 > 112.26.0.8.35774: Flags [.], ack 47784, win 1432, options [nop,nop,TS val 550985 ecr 306542], length 0
16:16:09.217383 IP 112.26.0.1.targus-getdata1 > 112.26.0.8.35774: Flags [.], ack 47784, win 1432, options [nop,nop,TS val 550985 ecr 306542], length 0
16:16:09.222556 IP 112.26.0.8.35774 > 112.26.0.1.targus-getdata1: Flags [.], seq 46336:47784, ack 1, win 1369, options [nop,nop,TS val 306542 ecr 550463], length 1448
16:16:09.281675 IP 112.26.0.1.targus-getdata1 > 112.26.0.8.35774: Flags [.], ack 46336, win 1432, options [nop,nop,TS val 550953 ecr 306447], length 0
16:16:09.292080 IP 112.26.0.8.35774 > 112.26.0.1.targus-getdata1: Flags [.], seq 47784:49232, ack 1, win 1369, options [nop,nop,TS val 306572 ecr 550552], length 1448
16:16:09.294805 IP 112.26.0.8.35774 > 112.26.0.1.targus-getdata1: Flags [.], seq 47784:49232, ack 1, win 1369, options [nop,nop,TS val 306572 ecr 550552], length 1448
16:16:09.295647 IP 112.26.0.1.targus-getdata1 > 112.26.0.8.35774: Flags [.], ack 49232, win 1432, options [nop,nop,TS val 551065 ecr 306572], length 0
16:16:09.297941 IP 112.26.0.1.targus-getdata1 > 112.26.0.8.35774: Flags [.], ack 49232, win 1432, options [nop,nop,TS val 551065 ecr 306572], length 0
16:16:09.311394 IP 112.26.0.1.targus-getdata1 > 112.26.0.8.35774: Flags [.], ack 47784, win 1432, options [nop,nop,TS val 550985 ecr 306542], length 0
16:16:09.318677 IP 112.26.0.8.35774 > 112.26.0.1.targus-getdata1: Flags [.], seq 49232:50680, ack 1, win 1369, options [nop,nop,TS val 306664 ecr 550682], length 1448
16:16:09.374971 IP 112.26.0.8.35774 > 112.26.0.1.targus-getdata1: Flags [.], seq 49232:50680, ack 1, win 1369, options [nop,nop,TS val 306664 ecr 550682], length 1448
16:16:09.379504 IP 112.26.0.1.targus-getdata1 > 112.26.0.8.35774: Flags [.], ack 50680, win 1432, options [nop,nop,TS val 551091 ecr 306664], length 0
16:16:09.382968 IP 112.26.0.1.targus-getdata1 > 112.26.0.8.35774: Flags [.], ack 50680, win 1432, options [nop,nop,TS val 551091 ecr 306664], length 0
16:16:09.398280 IP 112.26.0.1.targus-getdata1 > 112.26.0.8.35774: Flags [.], ack 49232, win 1432, options [nop,nop,TS val 551065 ecr 306572], length 0
16:16:09.405424 IP 112.26.0.8.35774 > 112.26.0.1.targus-getdata1: Flags [.], seq 50680:52128, ack 1, win 1369, options [nop,nop,TS val 306838 ecr 550846], length 1448
16:16:09.407301 IP 112.26.0.8.35774 > 112.26.0.1.targus-getdata1: Flags [.], seq 50680:52128, ack 1, win 1369, options [nop,nop,TS val 306838 ecr 550846], length 1448
16:16:09.412302 IP 112.26.0.1.targus-getdata1 > 112.26.0.8.35774: Flags [.], ack 52128, win 1432, options [nop,nop,TS val 551178 ecr 306838], length 0
16:16:09.414488 IP 112.26.0.1.targus-getdata1 > 112.26.0.8.35774: Flags [.], ack 52128, win 1432, options [nop,nop,TS val 551178 ecr 306838], length 0
16:16:09.483657 IP 112.26.0.1.targus-getdata1 > 112.26.0.8.35774: Flags [.], ack 50680, win 1432, options [nop,nop,TS val 551091 ecr 306664], length 0
16:16:09.496303 IP 112.26.0.8.35774 > 112.26.0.1.targus-getdata1: Flags [.], seq 52128:53576, ack 1, win 1369, options [nop,nop,TS val 306965 ecr 550985], length 1448
16:16:09.500356 IP 112.26.0.1.targus-getdata1 > 112.26.0.8.35774: Flags [.], ack 53576, win 1432, options [nop,nop,TS val 551269 ecr 306965], length 0
16:16:09.506471 IP 112.26.0.1.targus-getdata1 > 112.26.0.8.35774: Flags [.], ack 53576, win 1432, options [nop,nop,TS val 551269 ecr 306965], length 0
16:16:09.510163 IP 112.26.0.1.targus-getdata1 > 112.26.0.8.35774: Flags [.], ack 52128, win 1432, options [nop,nop,TS val 551178 ecr 306838], length 0
