16:15:11.050396 IP 112.26.0.8.35772 > 112.26.0.1.targus-getdata1: Flags [S], seq 501555758, win 65535, options [mss 1460,sackOK,TS val 248512 ecr 0,nop,wscale 6], length 0
16:15:11.121568 IP 112.26.0.1.targus-getdata1 > 112.26.0.8.35772: Flags [S.], seq 851580856, ack 501555759, win 28960, options [mss 1460,sackOK,TS val 492822 ecr 248512,nop,wscale 7], length 0
16:15:11.148220 IP 112.26.0.1.targus-getdata1 > 112.26.0.8.35772: Flags [S.], seq 851580856, ack 501555759, win 28960, options [mss 1460,sackOK,TS val 492822 ecr 248512,nop,wscale 7], length 0
16:15:11.344014 IP 112.26.0.8.35772 > 112.26.0.1.targus-getdata1: Flags [.], ack 1, win 1369, options [nop,nop,TS val 248894 ecr 492822], length 0
16:15:11.429650 IP 112.26.0.8.35772 > 112.26.0.1.targus-getdata1: Flags [P.], seq 1:38, ack 1, win 1369, options [nop,nop,TS val 248895 ecr 492822], length 37
16:15:11.430266 IP 112.26.0.1.targus-getdata1 > 112.26.0.8.35772: Flags [.], ack 38, win 227, options [nop,nop,TS val 493201 ecr 248895], length 0
16:15:11.430437 IP 112.26.0.1.targus-getdata1 > 112.26.0.8.35772: Flags [P.], seq 1:2, ack 38, win 227, options [nop,nop,TS val 493202 ecr 248895], length 1
16:15:47.665143 IP 112.26.0.8.35774 > 112.26.0.1.targus-getdata1: Flags [.], seq 1925573980:1925575428, ack 2111650953, win 1369, options [nop,nop,TS val 284617 ecr 528420], length 1448
16:15:48.253562 IP 112.26.0.8.35774 > 112.26.0.1.targus-getdata1: Flags [.], seq 1448:2896, ack 1, win 1369, options [nop,nop,TS val 285824 ecr 528420], length 1448
16:15:49.356551 IP 112.26.0.8.35774 > 112.26.0.1.targus-getdata1: Flags [.], seq 4294957160:4294958608, ack 1, win 1369, options [nop,nop,TS val 286976 ecr 528420], length 1448
16:15:51.688976 IP 112.26.0.8.35774 > 112.26.0.1.targus-getdata1: Flags [.], seq 4294957160:4294958608, ack 1, win 1369, options [nop,nop,TS val 289280 ecr 528420], length 1448
16:15:56.415155 IP 112.26.0.8.35774 > 112.26.0.1.targus-getdata1: Flags [.], seq 4294957160:4294958608, ack 1, win 1369, options [nop,nop,TS val 293888 ecr 528420], length 1448
16:16:05.470529 IP 112.26.0.8.35774 > 112.26.0.1.targus-getdata1: Flags [.], seq 4294957160:4294958608, ack 1, win 1369, options [nop,nop,TS val 303104 ecr 528420], length 1448
16:16:05.470891 IP 112.26.0.1.targus-getdata1 > 112.26.0.8.35774: Flags [.], ack 2896, win 1432, options [nop,nop,TS val 547241 ecr 285824,nop,nop,sack 1 {4294957160:4294958608}], length 0
16:16:05.486428 IP 112.26.0.1.targus-getdata1 > 112.26.0.8.35774: Flags [.], ack 2896, win 1432, options [nop,nop,TS val 547241 ecr 285824,nop,nop,sack 1 {4294957160:4294958608}], length 0
16:16:05.660540 IP 112.26.0.8.35774 > 112.26.0.1.targus-getdata1: Flags [.], seq 2896:4344, ack 1, win 1369, options [nop,nop,TS val 303219 ecr 547241], length 1448
16:16:05.660952 IP 112.26.0.1.targus-getdata1 > 112.26.0.8.35774: Flags [.], ack 4344, win 1432, options [nop,nop,TS val 547431 ecr 303219], length 0
16:16:05.679031 IP 112.26.0.1.targus-getdata1 > 112.26.0.8.35774: Flags [.], ack 4344, win 1432, options [nop,nop,TS val 547431 ecr 303219], length 0
16:16:05.760078 IP 112.26.0.8.35774 > 112.26.0.1.targus-getdata1: Flags [.], seq 4344:5792, ack 1, win 1369, options [nop,nop,TS val 303219 ecr 547241], length 1448
16:16:05.760376 IP 112.26.0.1.targus-getdata1 > 112.26.0.8.35774: Flags [.], ack 5792, win 1432, options [nop,nop,TS val 547531 ecr 303219], length 0
16:16:05.783401 IP 112.26.0.1.targus-getdata1 > 112.26.0.8.35774: Flags [.], ack 5792, win 1432, options [nop,nop,TS val 547531 ecr 303219], length 0
16:16:05.861436 IP 112.26.0.8.35774 > 112.26.0.1.targus-getdata1: Flags [.], seq 5792:7240, ack 1, win 1369, options [nop,nop,TS val 303220 ecr 547241], length 1448
16:16:05.861805 IP 112.26.0.1.targus-getdata1 > 112.26.0.8.35774: Flags [.], ack 7240, win 1432, options [nop,nop,TS val 547632 ecr 303220], length 0
16:16:05.879671 IP 112.26.0.1.targus-getdata1 > 112.26.0.8.35774: Flags [.], ack 7240, win 1432, options [nop,nop,TS val 547632 ecr 303220], length 0
16:16:05.968255 IP 112.26.0.8.35774 > 112.26.0.1.targus-getdata1: Flags [.], seq 7240:8688, ack 1, win 1369, options [nop,nop,TS val 303220 ecr 547241], length 1448
16:16:05.968564 IP 112.26.0.1.targus-getdata1 > 112.26.0.8.35774: Flags [.], ack 8688, win 1432, options [nop,nop,TS val 547739 ecr 303220], length 0
16:16:05.986743 IP 112.26.0.1.targus-getdata1 > 112.26.0.8.35774: Flags [.], ack 8688, win 1432, options [nop,nop,TS val 547739 ecr 303220], length 0
16:16:06.064163 IP 112.26.0.8.35774 > 112.26.0.1.targus-getdata1: Flags [.], seq 8688:10136, ack 1, win 1369, options [nop,nop,TS val 303220 ecr 547241], length 1448
16:16:06.064559 IP 112.26.0.1.targus-getdata1 > 112.26.0.8.35774: Flags [.], ack 10136, win 1432, options [nop,nop,TS val 547835 ecr 303220], length 0
16:16:06.083422 IP 112.26.0.1.targus-getdata1 > 112.26.0.8.35774: Flags [.], ack 10136, win 1432, options [nop,nop,TS val 547835 ecr 303220], length 0
16:16:06.163143 IP 112.26.0.8.35774 > 112.26.0.1.targus-getdata1: Flags [.], seq 10136:11584, ack 1, win 1369, options [nop,nop,TS val 303220 ecr 547241], length 1448
16:16:06.163548 IP 112.26.0.1.targus-getdata1 > 112.26.0.8.35774: Flags [.], ack 11584, win 1432, options [nop,nop,TS val 547935 ecr 303220], length 0
16:16:06.183631 IP 112.26.0.1.targus-getdata1 > 112.26.0.8.35774: Flags [.], ack 11584, win 1432, options [nop,nop,TS val 547935 ecr 303220], length 0
16:16:06.271123 IP 112.26.0.8.35774 > 112.26.0.1.targus-getdata1: Flags [.], seq 11584:13032, ack 1, win 1369, options [nop,nop,TS val 303220 ecr 547241], length 1448
16:16:06.271459 IP 112.26.0.1.targus-getdata1 > 112.26.0.8.35774: Flags [.], ack 13032, win 1432, options [nop,nop,TS val 548042 ecr 303220], length 0
16:16:06.287280 IP 112.26.0.1.targus-getdata1 > 112.26.0.8.35774: Flags [.], ack 13032, win 1432, options [nop,nop,TS val 548042 ecr 303220], length 0
16:16:06.473543 IP 112.26.0.8.35774 > 112.26.0.1.targus-getdata1: Flags [.], seq 13032:14480, ack 1, win 1369, options [nop,nop,TS val 303220 ecr 547241], length 1448
16:16:06.473844 IP 112.26.0.1.targus-getdata1 > 112.26.0.8.35774: Flags [.], ack 14480, win 1432, options [nop,nop,TS val 548245 ecr 303220], length 0
16:16:06.593883 IP 112.26.0.1.targus-getdata1 > 112.26.0.8.35774: Flags [.], ack 14480, win 1432, options [nop,nop,TS val 548245 ecr 303220], length 0
16:16:06.676578 IP 112.26.0.8.35774 > 112.26.0.1.targus-getdata1: Flags [.], seq 14480:15928, ack 1, win 1369, options [nop,nop,TS val 303536 ecr 547431], length 1448
16:16:06.689198 IP 112.26.0.8.35774 > 112.26.0.1.targus-getdata1: Flags [.], seq 14480:15928, ack 1, win 1369, options [nop,nop,TS val 303536 ecr 547431], length 1448
16:16:06.689526 IP 112.26.0.1.targus-getdata1 > 112.26.0.8.35774: Flags [.], ack 15928, win 1432, options [nop,nop,TS val 548460 ecr 303536], length 0
16:16:06.706015 IP 112.26.0.8.35774 > 112.26.0.1.targus-getdata1: Flags [.], seq 15928:17376, ack 1, win 1369, options [nop,nop,TS val 303727 ecr 547531], length 1448
16:16:06.778281 IP 112.26.0.1.targus-getdata1 > 112.26.0.8.35774: Flags [.], ack 15928, win 1432, options [nop,nop,TS val 548460 ecr 303536], length 0
16:16:06.797800 IP 112.26.0.8.35774 > 112.26.0.1.targus-getdata1: Flags [.], seq 15928:17376, ack 1, win 1369, options [nop,nop,TS val 303727 ecr 547531], length 1448
16:16:06.798139 IP 112.26.0.1.targus-getdata1 > 112.26.0.8.35774: Flags [.], ack 17376, win 1432, options [nop,nop,TS val 548569 ecr 303727], length 0
16:16:06.808140 IP 112.26.0.8.35774 > 112.26.0.1.targus-getdata1: Flags [.], seq 18824:20272, ack 1, win 1369, options [nop,nop,TS val 304139 ecr 547739], length 1448
16:16:06.889573 IP 112.26.0.8.35774 > 112.26.0.1.targus-getdata1: Flags [.], seq 20272:21720, ack 1, win 1369, options [nop,nop,TS val 304232 ecr 547835], length 1448
16:16:06.892937 IP 112.26.0.1.targus-getdata1 > 112.26.0.8.35774: Flags [.], ack 17376, win 1432, options [nop,nop,TS val 548569 ecr 303727], length 0
16:16:06.977142 IP 112.26.0.8.35774 > 112.26.0.1.targus-getdata1: Flags [.], seq 18824:20272, ack 1, win 1369, options [nop,nop,TS val 304139 ecr 547739], length 1448
16:16:06.977459 IP 112.26.0.1.targus-getdata1 > 112.26.0.8.35774: Flags [.], ack 17376, win 1432, options [nop,nop,TS val 548748 ecr 303727,nop,nop,sack 1 {18824:20272}], length 0
16:16:07.004248 IP 112.26.0.8.35774 > 112.26.0.1.targus-getdata1: Flags [.], seq 21720:23168, ack 1, win 1369, options [nop,nop,TS val 304232 ecr 547835], length 1448
16:16:07.005085 IP 112.26.0.8.35774 > 112.26.0.1.targus-getdata1: Flags [.], seq 20272:21720, ack 1, win 1369, options [nop,nop,TS val 304232 ecr 547835], length 1448
16:16:07.005282 IP 112.26.0.1.targus-getdata1 > 112.26.0.8.35774: Flags [.], ack 17376, win 1432, options [nop,nop,TS val 548776 ecr 303727,nop,nop,sack 1 {18824:21720}], length 0
16:16:07.083528 IP 112.26.0.8.35774 > 112.26.0.1.targus-getdata1: Flags [.], seq 23168:24616, ack 1, win 1369, options [nop,nop,TS val 304335 ecr 547935], length 1448
16:16:07.174603 IP 112.26.0.8.35774 > 112.26.0.1.targus-getdata1: Flags [.], seq 24616:26064, ack 1, win 1369, options [nop,nop,TS val 304351 ecr 548042], length 1448
16:16:07.176212 IP 112.26.0.1.targus-getdata1 > 112.26.0.8.35774: Flags [.], ack 17376, win 1432, options [nop,nop,TS val 548748 ecr 303727,nop,nop,sack 1 {18824:20272}], length 0
16:16:07.196616 IP 112.26.0.8.35774 > 112.26.0.1.targus-getdata1: Flags [.], seq 26064:27512, ack 1, win 1369, options [nop,nop,TS val 304435 ecr 548460], length 1448
16:16:07.268158 IP 112.26.0.8.35774 > 112.26.0.1.targus-getdata1: Flags [.], seq 21720:23168, ack 1, win 1369, options [nop,nop,TS val 304232 ecr 547835], length 1448
16:16:07.268606 IP 112.26.0.1.targus-getdata1 > 112.26.0.8.35774: Flags [.], ack 17376, win 1432, options [nop,nop,TS val 549040 ecr 303727,nop,nop,sack 1 {18824:23168}], length 0
16:16:07.282422 IP 112.26.0.8.35774 > 112.26.0.1.targus-getdata1: Flags [.], seq 27512:28960, ack 1, win 1369, options [nop,nop,TS val 304435 ecr 548460], length 1448
16:16:07.291091 IP 112.26.0.1.targus-getdata1 > 112.26.0.8.35774: Flags [.], ack 17376, win 1432, options [nop,nop,TS val 548776 ecr 303727,nop,nop,sack 1 {18824:21720}], length 0
16:16:07.377445 IP 112.26.0.8.35774 > 112.26.0.1.targus-getdata1: Flags [.], seq 28960:30408, ack 1, win 1369, options [nop,nop,TS val 304435 ecr 548460], length 1448
16:16:07.388165 IP 112.26.0.8.35774 > 112.26.0.1.targus-getdata1: Flags [.], seq 23168:24616, ack 1, win 1369, options [nop,nop,TS val 304335 ecr 547935], length 1448
16:16:07.388432 IP 112.26.0.1.targus-getdata1 > 112.26.0.8.35774: Flags [.], ack 17376, win 1432, options [nop,nop,TS val 549159 ecr 303727,nop,nop,sack 1 {18824:24616}], length 0
16:16:07.403625 IP 112.26.0.8.35774 > 112.26.0.1.targus-getdata1: Flags [.], seq 24616:26064, ack 1, win 1369, options [nop,nop,TS val 304351 ecr 548042], length 1448
16:16:07.403878 IP 112.26.0.1.targus-getdata1 > 112.26.0.8.35774: Flags [.], ack 17376, win 1432, options [nop,nop,TS val 549175 ecr 303727,nop,nop,sack 1 {18824:26064}], length 0
16:16:07.492827 IP 112.26.0.8.35774 > 112.26.0.1.targus-getdata1: Flags [.], seq 26064:27512, ack 1, win 1369, options [nop,nop,TS val 304435 ecr 548460], length 1448
16:16:07.493097 IP 112.26.0.1.targus-getdata1 > 112.26.0.8.35774: Flags [.], ack 17376, win 1432, options [nop,nop,TS val 549264 ecr 303727,nop,nop,sack 1 {18824:27512}], length 0
16:16:07.501360 IP 112.26.0.8.35774 > 112.26.0.1.targus-getdata1: Flags [.], ack 1, win 1369, options [nop,nop,TS val 304625 ecr 548569], length 0
16:16:07.582643 IP 112.26.0.1.targus-getdata1 > 112.26.0.8.35774: Flags [.], ack 17376, win 1432, options [nop,nop,TS val 549040 ecr 303727,nop,nop,sack 1 {18824:23168}], length 0
16:16:07.589939 IP 112.26.0.8.35774 > 112.26.0.1.targus-getdata1: Flags [.], seq 31856:33304, ack 1, win 1369, options [nop,nop,TS val 304832 ecr 548748], length 1448
16:16:07.674713 IP 112.26.0.8.35774 > 112.26.0.1.targus-getdata1: Flags [.], seq 27512:28960, ack 1, win 1369, options [nop,nop,TS val 304435 ecr 548460], length 1448
16:16:07.675173 IP 112.26.0.1.targus-getdata1 > 112.26.0.8.35774: Flags [.], ack 17376, win 1432, options [nop,nop,TS val 549446 ecr 303727,nop,nop,sack 1 {18824:28960}], length 0
16:16:07.687076 IP 112.26.0.8.35774 > 112.26.0.1.targus-getdata1: Flags [.], seq 28960:30408, ack 1, win 1369, options [nop,nop,TS val 304435 ecr 548460], length 1448
16:16:07.687329 IP 112.26.0.1.targus-getdata1 > 112.26.0.8.35774: Flags [.], ack 17376, win 1432, options [nop,nop,TS val 549458 ecr 303727,nop,nop,sack 1 {18824:30408}], length 0
16:16:07.774638 IP 112.26.0.8.35774 > 112.26.0.1.targus-getdata1: Flags [.], seq 33304:34752, ack 1, win 1369, options [nop,nop,TS val 304952 ecr 548776], length 1448
16:16:07.781953 IP 112.26.0.1.targus-getdata1 > 112.26.0.8.35774: Flags [.], ack 17376, win 1432, options [nop,nop,TS val 549159 ecr 303727,nop,nop,sack 1 {18824:24616}], length 0
16:16:07.809412 IP 112.26.0.1.targus-getdata1 > 112.26.0.8.35774: Flags [.], ack 17376, win 1432, options [nop,nop,TS val 549175 ecr 303727,nop,nop,sack 1 {18824:26064}], length 0
16:16:07.817139 IP 112.26.0.8.35774 > 112.26.0.1.targus-getdata1: Flags [.], seq 17376:18824, ack 1, win 1369, options [nop,nop,TS val 305239 ecr 549040], length 1448
16:16:07.879785 IP 112.26.0.1.targus-getdata1 > 112.26.0.8.35774: Flags [.], ack 17376, win 1432, options [nop,nop,TS val 549446 ecr 303727,nop,nop,sack 1 {18824:28960}], length 0
16:16:07.892598 IP 112.26.0.8.35774 > 112.26.0.1.targus-getdata1: Flags [.], ack 1, win 1369, options [nop,nop,TS val 304625 ecr 548569], length 0
16:16:07.901199 IP 112.26.0.1.targus-getdata1 > 112.26.0.8.35774: Flags [.], ack 17376, win 1432, options [nop,nop,TS val 549458 ecr 303727,nop,nop,sack 1 {18824:30408}], length 0
16:16:07.913168 IP 112.26.0.8.35774 > 112.26.0.1.targus-getdata1: Flags [.], seq 31856:33304, ack 1, win 1369, options [nop,nop,TS val 304832 ecr 548748], length 1448
16:16:07.988313 IP 112.26.0.8.35774 > 112.26.0.1.targus-getdata1: Flags [.], seq 34752:36200, ack 1, win 1369, options [nop,nop,TS val 305438 ecr 549159], length 1448
16:16:08.003279 IP 112.26.0.1.targus-getdata1 > 112.26.0.8.35774: Flags [.], ack 17376, win 1432, options [nop,nop,TS val 549264 ecr 303727,nop,nop,sack 1 {18824:27512}], length 0
16:16:08.083335 IP 112.26.0.8.35774 > 112.26.0.1.targus-getdata1: Flags [.], ack 1, win 1369, options [nop,nop,TS val 304625 ecr 548569], length 0
16:16:08.096771 IP 112.26.0.8.35774 > 112.26.0.1.targus-getdata1: Flags [.], seq 31856:33304, ack 1, win 1369, options [nop,nop,TS val 304832 ecr 548748], length 1448
16:16:08.107108 IP 112.26.0.8.35774 > 112.26.0.1.targus-getdata1: Flags [.], seq 37648:39096, ack 1, win 1369, options [nop,nop,TS val 305556 ecr 549458], length 1448
16:16:08.202524 IP 112.26.0.8.35774 > 112.26.0.1.targus-getdata1: Flags [.], seq 33304:34752, ack 1, win 1369, options [nop,nop,TS val 304952 ecr 548776], length 1448
16:16:08.276241 IP 112.26.0.8.35774 > 112.26.0.1.targus-getdata1: Flags [.], seq 33304:34752, ack 1, win 1369, options [nop,nop,TS val 304952 ecr 548776], length 1448
16:16:08.283136 IP 112.26.0.8.35774 > 112.26.0.1.targus-getdata1: Flags [.], seq 17376:18824, ack 1, win 1369, options [nop,nop,TS val 305239 ecr 549040], length 1448
16:16:08.291728 IP 112.26.0.8.35774 > 112.26.0.1.targus-getdata1: Flags [.], seq 34752:36200, ack 1, win 1369, options [nop,nop,TS val 305438 ecr 549159], length 1448
16:16:08.291971 IP 112.26.0.1.targus-getdata1 > 112.26.0.8.35774: Flags [.], ack 17376, win 1432, options [nop,nop,TS val 550063 ecr 303727,nop,nop,sack 2 {34752:36200}{18824:30408}], length 0
16:16:08.296870 IP 112.26.0.8.35774 > 112.26.0.1.targus-getdata1: Flags [.], seq 17376:18824, ack 1, win 1369, options [nop,nop,TS val 305239 ecr 549040], length 1448
16:16:08.297133 IP 112.26.0.1.targus-getdata1 > 112.26.0.8.35774: Flags [.], ack 30408, win 1363, options [nop,nop,TS val 550068 ecr 305239,nop,nop,sack 1 {34752:36200}], length 0
16:16:08.382978 IP 112.26.0.8.35774 > 112.26.0.1.targus-getdata1: Flags [.], ack 1, win 1369, options [nop,nop,TS val 304625 ecr 548569], length 0
16:16:08.383251 IP 112.26.0.1.targus-getdata1 > 112.26.0.8.35774: Flags [.], ack 30408, win 1432, options [nop,nop,TS val 550154 ecr 305239,nop,nop,sack 1 {34752:36200}], length 0
16:16:08.390498 IP 112.26.0.1.targus-getdata1 > 112.26.0.8.35774: Flags [.], ack 17376, win 1432, options [nop,nop,TS val 550063 ecr 303727,nop,nop,sack 2 {34752:36200}{18824:30408}], length 0
16:16:08.409270 IP 112.26.0.8.35774 > 112.26.0.1.targus-getdata1: Flags [.], seq 31856:33304, ack 1, win 1369, options [nop,nop,TS val 304832 ecr 548748], length 1448
16:16:08.409508 IP 112.26.0.1.targus-getdata1 > 112.26.0.8.35774: Flags [.], ack 30408, win 1432, options [nop,nop,TS val 550180 ecr 305239,nop,nop,sack 1 {34752:36200}], length 0
16:16:08.424612 IP 112.26.0.1.targus-getdata1 > 112.26.0.8.35774: Flags [.], ack 30408, win 1363, options [nop,nop,TS val 550068 ecr 305239,nop,nop,sack 1 {34752:36200}], length 0
16:16:08.487924 IP 112.26.0.8.35774 > 112.26.0.1.targus-getdata1: Flags [.], seq 37648:39096, ack 1, win 1369, options [nop,nop,TS val 305556 ecr 549458], length 1448
16:16:08.488182 IP 112.26.0.1.targus-getdata1 > 112.26.0.8.35774: Flags [.], ack 30408, win 1432, options [nop,nop,TS val 550259 ecr 305239,nop,nop,sack 2 {37648:39096}{34752:36200}], length 0
16:16:08.497527 IP 112.26.0.8.35774 > 112.26.0.1.targus-getdata1: Flags [.], seq 30408:31856, ack 1, win 1369, options [nop,nop,TS val 306079 ecr 550068], length 1448
16:16:08.497788 IP 112.26.0.1.targus-getdata1 > 112.26.0.8.35774: Flags [.], ack 31856, win 1421, options [nop,nop,TS val 550268 ecr 306079,nop,nop,sack 2 {37648:39096}{34752:36200}], length 0
16:16:08.504488 IP 112.26.0.1.targus-getdata1 > 112.26.0.8.35774: Flags [.], ack 30408, win 1432, options [nop,nop,TS val 550154 ecr 305239,nop,nop,sack 1 {34752:36200}], length 0
16:16:08.579158 IP 112.26.0.1.targus-getdata1 > 112.26.0.8.35774: Flags [.], ack 30408, win 1432, options [nop,nop,TS val 550180 ecr 305239,nop,nop,sack 1 {34752:36200}], length 0
16:16:08.606481 IP 112.26.0.8.35774 > 112.26.0.1.targus-getdata1: Flags [.], seq 31856:33304, ack 1, win 1369, options [nop,nop,TS val 306079 ecr 550068], length 1448
16:16:08.606778 IP 112.26.0.1.targus-getdata1 > 112.26.0.8.35774: Flags [.], ack 33304, win 1417, options [nop,nop,TS val 550377 ecr 306079,nop,nop,sack 2 {37648:39096}{34752:36200}], length 0
16:16:08.612919 IP 112.26.0.1.targus-getdata1 > 112.26.0.8.35774: Flags [.], ack 30408, win 1432, options [nop,nop,TS val 550259 ecr 305239,nop,nop,sack 2 {37648:39096}{34752:36200}], length 0
16:16:08.680717 IP 112.26.0.1.targus-getdata1 > 112.26.0.8.35774: Flags [.], ack 31856, win 1421, options [nop,nop,TS val 550268 ecr 306079,nop,nop,sack 2 {37648:39096}{34752:36200}], length 0
16:16:08.684659 IP 112.26.0.8.35774 > 112.26.0.1.targus-getdata1: Flags [.], seq 33304:34752, ack 1, win 1369, options [nop,nop,TS val 304952 ecr 548776], length 1448
16:16:08.684966 IP 112.26.0.1.targus-getdata1 > 112.26.0.8.35774: Flags [.], ack 33304, win 1425, options [nop,nop,TS val 550455 ecr 306079,nop,nop,sack 2 {37648:39096}{34752:36200}], length 0
16:16:08.692648 IP 112.26.0.8.35774 > 112.26.0.1.targus-getdata1: Flags [.], seq 33304:34752, ack 1, win 1369, options [nop,nop,TS val 306079 ecr 550068], length 1448
16:16:08.692944 IP 112.26.0.1.targus-getdata1 > 112.26.0.8.35774: Flags [.], ack 36200, win 1418, options [nop,nop,TS val 550463 ecr 306079,nop,nop,sack 1 {37648:39096}], length 0
16:16:08.701869 IP 112.26.0.1.targus-getdata1 > 112.26.0.8.35774: Flags [.], ack 33304, win 1417, options [nop,nop,TS val 550377 ecr 306079,nop,nop,sack 2 {37648:39096}{34752:36200}], length 0
16:16:08.730495 IP 112.26.0.1.targus-getdata1 > 112.26.0.8.35774: Flags [.], ack 33304, win 1425, options [nop,nop,TS val 550455 ecr 306079,nop,nop,sack 2 {37648:39096}{34752:36200}], length 0
16:16:08.780994 IP 112.26.0.8.35774 > 112.26.0.1.targus-getdata1: Flags [.], seq 17376:18824, ack 1, win 1369, options [nop,nop,TS val 306045 ecr 550063], length 1448
16:16:08.781370 IP 112.26.0.1.targus-getdata1 > 112.26.0.8.35774: Flags [.], ack 36200, win 1432, options [nop,nop,TS val 550552 ecr 306079,nop,nop,sack 2 {17376:18824}{37648:39096}], length 0
16:16:08.817823 IP 112.26.0.1.targus-getdata1 > 112.26.0.8.35774: Flags [.], ack 36200, win 1418, options [nop,nop,TS val 550463 ecr 306079,nop,nop,sack 1 {37648:39096}], length 0
16:16:08.823717 IP 112.26.0.8.35774 > 112.26.0.1.targus-getdata1: Flags [.], seq 39096:40544, ack 1, win 1369, options [nop,nop,TS val 306079 ecr 550068], length 1448
16:16:08.824002 IP 112.26.0.1.targus-getdata1 > 112.26.0.8.35774: Flags [.], ack 36200, win 1432, options [nop,nop,TS val 550595 ecr 306079,nop,nop,sack 1 {37648:40544}], length 0
16:16:08.881354 IP 112.26.0.1.targus-getdata1 > 112.26.0.8.35774: Flags [.], ack 36200, win 1432, options [nop,nop,TS val 550552 ecr 306079,nop,nop,sack 2 {17376:18824}{37648:39096}], length 0
16:16:08.900636 IP 112.26.0.1.targus-getdata1 > 112.26.0.8.35774: Flags [.], ack 36200, win 1432, options [nop,nop,TS val 550595 ecr 306079,nop,nop,sack 1 {37648:40544}], length 0
16:16:08.910423 IP 112.26.0.8.35774 > 112.26.0.1.targus-getdata1: Flags [.], seq 36200:37648, ack 1, win 1369, options [nop,nop,TS val 306350 ecr 550259], length 1448
16:16:08.910693 IP 112.26.0.1.targus-getdata1 > 112.26.0.8.35774: Flags [.], ack 40544, win 1419, options [nop,nop,TS val 550682 ecr 306350], length 0
16:16:08.924658 IP 112.26.0.1.targus-getdata1 > 112.26.0.8.35774: Flags [.], ack 40544, win 1419, options [nop,nop,TS val 550682 ecr 306350], length 0
16:16:08.989742 IP 112.26.0.8.35774 > 112.26.0.1.targus-getdata1: Flags [.], seq 40544:41992, ack 1, win 1369, options [nop,nop,TS val 306368 ecr 550268], length 1448
16:16:08.990016 IP 112.26.0.1.targus-getdata1 > 112.26.0.8.35774: Flags [.], ack 41992, win 1432, options [nop,nop,TS val 550761 ecr 306368], length 0
16:16:08.996398 IP 112.26.0.1.targus-getdata1 > 112.26.0.8.35774: Flags [.], ack 41992, win 1432, options [nop,nop,TS val 550761 ecr 306368], length 0
16:16:09.074942 IP 112.26.0.8.35774 > 112.26.0.1.targus-getdata1: Flags [.], seq 41992:43440, ack 1, win 1369, options [nop,nop,TS val 306368 ecr 550268], length 1448
16:16:09.075243 IP 112.26.0.1.targus-getdata1 > 112.26.0.8.35774: Flags [.], ack 43440, win 1432, options [nop,nop,TS val 550846 ecr 306368], length 0
16:16:09.083492 IP 112.26.0.1.targus-getdata1 > 112.26.0.8.35774: Flags [.], ack 43440, win 1432, options [nop,nop,TS val 550846 ecr 306368], length 0
16:16:09.106629 IP 112.26.0.8.35774 > 112.26.0.1.targus-getdata1: Flags [.], seq 43440:44888, ack 1, win 1369, options [nop,nop,TS val 306447 ecr 550377], length 1448
16:16:09.106957 IP 112.26.0.1.targus-getdata1 > 112.26.0.8.35774: Flags [.], ack 44888, win 1432, options [nop,nop,TS val 550878 ecr 306447], length 0
16:16:09.114436 IP 112.26.0.1.targus-getdata1 > 112.26.0.8.35774: Flags [.], ack 44888, win 1432, options [nop,nop,TS val 550878 ecr 306447], length 0
16:16:09.181842 IP 112.26.0.8.35774 > 112.26.0.1.targus-getdata1: Flags [.], seq 44888:46336, ack 1, win 1369, options [nop,nop,TS val 306447 ecr 550377], length 1448
16:16:09.182257 IP 112.26.0.1.targus-getdata1 > 112.26.0.8.35774: Flags [.], ack 46336, win 1432, options [nop,nop,TS val 550953 ecr 306447], length 0
16:16:09.190902 IP 112.26.0.1.targus-getdata1 > 112.26.0.8.35774: Flags [.], ack 46336, win 1432, options [nop,nop,TS val 550953 ecr 306447], length 0
16:16:09.214329 IP 112.26.0.8.35774 > 112.26.0.1.targus-getdata1: Flags [.], seq 46336:47784, ack 1, win 1369, options [nop,nop,TS val 306542 ecr 550463], length 1448
16:16:09.214588 IP 112.26.0.1.targus-getdata1 > 112.26.0.8.35774: Flags [.], ack 47784, win 1432, options [nop,nop,TS val 550985 ecr 306542], length 0
16:16:09.216587 IP 112.26.0.1.targus-getdata1 > 112.26.0.8.35774: Flags [.], ack 47784, win 1432, options [nop,nop,TS val 550985 ecr 306542], length 0
16:16:09.294092 IP 112.26.0.8.35774 > 112.26.0.1.targus-getdata1: Flags [.], seq 47784:49232, ack 1, win 1369, options [nop,nop,TS val 306572 ecr 550552], length 1448
16:16:09.294382 IP 112.26.0.1.targus-getdata1 > 112.26.0.8.35774: Flags [.], ack 49232, win 1432, options [nop,nop,TS val 551065 ecr 306572], length 0
16:16:09.298108 IP 112.26.0.1.targus-getdata1 > 112.26.0.8.35774: Flags [.], ack 49232, win 1432, options [nop,nop,TS val 551065 ecr 306572], length 0
16:16:09.320676 IP 112.26.0.8.35774 > 112.26.0.1.targus-getdata1: Flags [.], seq 49232:50680, ack 1, win 1369, options [nop,nop,TS val 306664 ecr 550682], length 1448
16:16:09.320931 IP 112.26.0.1.targus-getdata1 > 112.26.0.8.35774: Flags [.], ack 50680, win 1432, options [nop,nop,TS val 551091 ecr 306664], length 0
16:16:09.381175 IP 112.26.0.1.targus-getdata1 > 112.26.0.8.35774: Flags [.], ack 50680, win 1432, options [nop,nop,TS val 551091 ecr 306664], length 0
16:16:09.407417 IP 112.26.0.8.35774 > 112.26.0.1.targus-getdata1: Flags [.], seq 50680:52128, ack 1, win 1369, options [nop,nop,TS val 306838 ecr 550846], length 1448
16:16:09.407733 IP 112.26.0.1.targus-getdata1 > 112.26.0.8.35774: Flags [.], ack 52128, win 1432, options [nop,nop,TS val 551178 ecr 306838], length 0
16:16:09.413559 IP 112.26.0.1.targus-getdata1 > 112.26.0.8.35774: Flags [.], ack 52128, win 1432, options [nop,nop,TS val 551178 ecr 306838], length 0
16:16:09.498307 IP 112.26.0.8.35774 > 112.26.0.1.targus-getdata1: Flags [.], seq 52128:53576, ack 1, win 1369, options [nop,nop,TS val 306965 ecr 550985], length 1448
16:16:09.498563 IP 112.26.0.1.targus-getdata1 > 112.26.0.8.35774: Flags [.], ack 53576, win 1432, options [nop,nop,TS val 551269 ecr 306965], length 0
16:16:09.500584 IP 112.26.0.1.targus-getdata1 > 112.26.0.8.35774: Flags [.], ack 53576, win 1432, options [nop,nop,TS val 551269 ecr 306965], length 0
16:16:09.592135 IP 112.26.0.8.35774 > 112.26.0.1.targus-getdata1: Flags [.], seq 53576:55024, ack 1, win 1369, options [nop,nop,TS val 307052 ecr 551065], length 1448
16:16:09.592397 IP 112.26.0.1.targus-getdata1 > 112.26.0.8.35774: Flags [.], ack 55024, win 1432, options [nop,nop,TS val 551363 ecr 307052], length 0
16:16:09.597357 IP 112.26.0.1.targus-getdata1 > 112.26.0.8.35774: Flags [.], ack 55024, win 1432, options [nop,nop,TS val 551363 ecr 307052], length 0
16:16:09.624396 IP 112.26.0.8.35774 > 112.26.0.1.targus-getdata1: Flags [.], seq 55024:56472, ack 1, win 1369, options [nop,nop,TS val 307137 ecr 551091], length 1448
16:16:09.624586 IP 112.26.0.1.targus-getdata1 > 112.26.0.8.35774: Flags [.], ack 56472, win 1432, options [nop,nop,TS val 551395 ecr 307137], length 0
16:16:09.685940 IP 112.26.0.1.targus-getdata1 > 112.26.0.8.35774: Flags [.], ack 56472, win 1432, options [nop,nop,TS val 551395 ecr 307137], length 0
16:16:09.713874 IP 112.26.0.8.35774 > 112.26.0.1.targus-getdata1: Flags [.], seq 56472:57920, ack 1, win 1369, options [nop,nop,TS val 307137 ecr 551091], length 1448
16:16:09.714151 IP 112.26.0.1.targus-getdata1 > 112.26.0.8.35774: Flags [.], ack 57920, win 1432, options [nop,nop,TS val 551485 ecr 307137], length 0
16:16:09.716117 IP 112.26.0.1.targus-getdata1 > 112.26.0.8.35774: Flags [.], ack 57920, win 1432, options [nop,nop,TS val 551485 ecr 307137], length 0
16:16:09.796603 IP 112.26.0.8.35774 > 112.26.0.1.targus-getdata1: Flags [.], seq 57920:59368, ack 1, win 1369, options [nop,nop,TS val 307164 ecr 551178], length 1448
16:16:09.796929 IP 112.26.0.1.targus-getdata1 > 112.26.0.8.35774: Flags [.], ack 59368, win 1432, options [nop,nop,TS val 551568 ecr 307164], length 0
16:16:09.799946 IP 112.26.0.1.targus-getdata1 > 112.26.0.8.35774: Flags [.], ack 59368, win 1432, options [nop,nop,TS val 551568 ecr 307164], length 0
16:16:09.884940 IP 112.26.0.8.35774 > 112.26.0.1.targus-getdata1: Flags [.], seq 59368:60816, ack 1, win 1369, options [nop,nop,TS val 307234 ecr 551269], length 1448
16:16:09.885281 IP 112.26.0.1.targus-getdata1 > 112.26.0.8.35774: Flags [.], ack 60816, win 1432, options [nop,nop,TS val 551656 ecr 307234], length 0
16:16:09.893782 IP 112.26.0.1.targus-getdata1 > 112.26.0.8.35774: Flags [.], ack 60816, win 1432, options [nop,nop,TS val 551656 ecr 307234], length 0
16:16:09.916745 IP 112.26.0.8.35774 > 112.26.0.1.targus-getdata1: Flags [.], seq 60816:62264, ack 1, win 1369, options [nop,nop,TS val 307354 ecr 551363], length 1448
16:16:09.969581 IP 112.26.0.1.targus-getdata1 > 112.26.0.8.35774: Flags [.], ack 62264, win 1432, options [nop,nop,TS val 551741 ecr 307354], length 0
16:16:09.993495 IP 112.26.0.1.targus-getdata1 > 112.26.0.8.35774: Flags [.], ack 62264, win 1432, options [nop,nop,TS val 551741 ecr 307354], length 0
16:16:10.008158 IP 112.26.0.8.35774 > 112.26.0.1.targus-getdata1: Flags [.], seq 62264:63712, ack 1, win 1369, options [nop,nop,TS val 307381 ecr 551395], length 1448
16:16:10.084551 IP 112.26.0.8.35774 > 112.26.0.1.targus-getdata1: Flags [.], seq 63712:65160, ack 1, win 1369, options [nop,nop,TS val 307460 ecr 551485], length 1448
16:16:10.084847 IP 112.26.0.1.targus-getdata1 > 112.26.0.8.35774: Flags [.], ack 65160, win 1432, options [nop,nop,TS val 551856 ecr 307381], length 0
16:16:10.091576 IP 112.26.0.1.targus-getdata1 > 112.26.0.8.35774: Flags [.], ack 65160, win 1432, options [nop,nop,TS val 551856 ecr 307381], length 0
16:16:10.126035 IP 112.26.0.8.35774 > 112.26.0.1.targus-getdata1: Flags [.], seq 65160:66608, ack 1, win 1369, options [nop,nop,TS val 307556 ecr 551568], length 1448
16:16:10.189416 IP 112.26.0.8.35774 > 112.26.0.1.targus-getdata1: Flags [.], seq 66608:68056, ack 1, win 1369, options [nop,nop,TS val 307641 ecr 551656], length 1448
16:16:10.189753 IP 112.26.0.1.targus-getdata1 > 112.26.0.8.35774: Flags [.], ack 68056, win 1432, options [nop,nop,TS val 551960 ecr 307556], length 0
16:16:10.201248 IP 112.26.0.1.targus-getdata1 > 112.26.0.8.35774: Flags [.], ack 68056, win 1432, options [nop,nop,TS val 551960 ecr 307556], length 0
16:16:10.219866 IP 112.26.0.8.35774 > 112.26.0.1.targus-getdata1: Flags [.], seq 68056:69504, ack 1, win 1369, options [nop,nop,TS val 307666 ecr 551741], length 1448
16:16:10.298187 IP 112.26.0.8.35774 > 112.26.0.1.targus-getdata1: Flags [.], seq 69504:70952, ack 1, win 1369, options [nop,nop,TS val 307755 ecr 551856], length 1448
16:16:10.298437 IP 112.26.0.1.targus-getdata1 > 112.26.0.8.35774: Flags [.], ack 70952, win 1432, options [nop,nop,TS val 552070 ecr 307666], length 0
16:16:10.306204 IP 112.26.0.1.targus-getdata1 > 112.26.0.8.35774: Flags [.], ack 70952, win 1432, options [nop,nop,TS val 552070 ecr 307666], length 0
16:16:10.384336 IP 112.26.0.8.35774 > 112.26.0.1.targus-getdata1: Flags [.], seq 70952:72400, ack 1, win 1369, options [nop,nop,TS val 307755 ecr 551856], length 1448
16:16:10.404703 IP 112.26.0.8.35774 > 112.26.0.1.targus-getdata1: Flags [.], seq 72400:73848, ack 1, win 1369, options [nop,nop,TS val 307848 ecr 551960], length 1448
16:16:10.404936 IP 112.26.0.1.targus-getdata1 > 112.26.0.8.35774: Flags [.], ack 73848, win 1432, options [nop,nop,TS val 552176 ecr 307755], length 0
16:16:10.406980 IP 112.26.0.1.targus-getdata1 > 112.26.0.8.35774: Flags [.], ack 73848, win 1432, options [nop,nop,TS val 552176 ecr 307755], length 0
16:16:10.494272 IP 112.26.0.8.35774 > 112.26.0.1.targus-getdata1: Flags [.], seq 73848:75296, ack 1, win 1369, options [nop,nop,TS val 307848 ecr 551960], length 1448
16:16:10.511422 IP 112.26.0.8.35774 > 112.26.0.1.targus-getdata1: Flags [.], seq 75296:76744, ack 1, win 1369, options [nop,nop,TS val 307956 ecr 552070], length 1448
16:16:10.511654 IP 112.26.0.1.targus-getdata1 > 112.26.0.8.35774: Flags [.], ack 76744, win 1432, options [nop,nop,TS val 552282 ecr 307848], length 0
16:16:10.514850 IP 112.26.0.1.targus-getdata1 > 112.26.0.8.35774: Flags [.], ack 76744, win 1432, options [nop,nop,TS val 552282 ecr 307848], length 0
16:16:10.706900 IP 112.26.0.8.35774 > 112.26.0.1.targus-getdata1: Flags [.], seq 76744:78192, ack 1, win 1369, options [nop,nop,TS val 307956 ecr 552070], length 1448
16:16:10.739366 IP 112.26.0.8.35774 > 112.26.0.1.targus-getdata1: Flags [.], seq 78192:79640, ack 1, win 1369, options [nop,nop,TS val 308062 ecr 552176], length 1448
16:16:10.739647 IP 112.26.0.1.targus-getdata1 > 112.26.0.8.35774: Flags [.], ack 79640, win 1432, options [nop,nop,TS val 552510 ecr 307956], length 0
16:16:10.788554 IP 112.26.0.1.targus-getdata1 > 112.26.0.8.35774: Flags [.], ack 79640, win 1432, options [nop,nop,TS val 552510 ecr 307956], length 0
16:16:10.813648 IP 112.26.0.8.35774 > 112.26.0.1.targus-getdata1: Flags [P.], seq 79640:81088, ack 1, win 1369, options [nop,nop,TS val 308062 ecr 552176], length 1448
16:16:10.830573 IP 112.26.0.8.35774 > 112.26.0.1.targus-getdata1: Flags [.], seq 81088:82536, ack 1, win 1369, options [nop,nop,TS val 308062 ecr 552176], length 1448
16:16:10.830857 IP 112.26.0.1.targus-getdata1 > 112.26.0.8.35774: Flags [.], ack 82536, win 1432, options [nop,nop,TS val 552602 ecr 308062], length 0
16:16:10.900117 IP 112.26.0.1.targus-getdata1 > 112.26.0.8.35774: Flags [.], ack 82536, win 1432, options [nop,nop,TS val 552602 ecr 308062], length 0
16:16:10.919955 IP 112.26.0.8.35774 > 112.26.0.1.targus-getdata1: Flags [.], seq 82536:83984, ack 1, win 1369, options [nop,nop,TS val 308169 ecr 552282], length 1448
16:16:10.996526 IP 112.26.0.8.35774 > 112.26.0.1.targus-getdata1: Flags [.], seq 83984:85432, ack 1, win 1369, options [nop,nop,TS val 308169 ecr 552282], length 1448
16:16:10.996880 IP 112.26.0.1.targus-getdata1 > 112.26.0.8.35774: Flags [.], ack 85432, win 1432, options [nop,nop,TS val 552767 ecr 308169], length 0
16:16:10.999591 IP 112.26.0.1.targus-getdata1 > 112.26.0.8.35774: Flags [.], ack 85432, win 1432, options [nop,nop,TS val 552767 ecr 308169], length 0
16:16:11.094099 IP 112.26.0.8.35774 > 112.26.0.1.targus-getdata1: Flags [.], seq 85432:86880, ack 1, win 1369, options [nop,nop,TS val 308446 ecr 552510], length 1448
16:16:11.114260 IP 112.26.0.8.35774 > 112.26.0.1.targus-getdata1: Flags [.], seq 86880:88328, ack 1, win 1369, options [nop,nop,TS val 308446 ecr 552510], length 1448
16:16:11.114581 IP 112.26.0.1.targus-getdata1 > 112.26.0.8.35774: Flags [.], ack 88328, win 1432, options [nop,nop,TS val 552886 ecr 308446], length 0
16:16:11.117525 IP 112.26.0.1.targus-getdata1 > 112.26.0.8.35774: Flags [.], ack 88328, win 1432, options [nop,nop,TS val 552886 ecr 308446], length 0
16:16:11.214009 IP 112.26.0.8.35774 > 112.26.0.1.targus-getdata1: Flags [.], seq 88328:89776, ack 1, win 1369, options [nop,nop,TS val 308544 ecr 552602], length 1448
16:16:11.274054 IP 112.26.0.1.targus-getdata1 > 112.26.0.8.35774: Flags [.], ack 89776, win 1432, options [nop,nop,TS val 553045 ecr 308544], length 0
16:16:11.292683 IP 112.26.0.1.targus-getdata1 > 112.26.0.8.35774: Flags [.], ack 89776, win 1432, options [nop,nop,TS val 553045 ecr 308544], length 0
16:16:11.303370 IP 112.26.0.8.35774 > 112.26.0.1.targus-getdata1: Flags [.], seq 89776:91224, ack 1, win 1369, options [nop,nop,TS val 308544 ecr 552602], length 1448
16:16:11.326711 IP 112.26.0.8.35774 > 112.26.0.1.targus-getdata1: Flags [.], seq 91224:92672, ack 1, win 1369, options [nop,nop,TS val 308655 ecr 552767], length 1448
16:16:11.326986 IP 112.26.0.1.targus-getdata1 > 112.26.0.8.35774: Flags [.], ack 92672, win 1432, options [nop,nop,TS val 553098 ecr 308544], length 0
16:16:11.335128 IP 112.26.0.1.targus-getdata1 > 112.26.0.8.35774: Flags [.], ack 92672, win 1432, options [nop,nop,TS val 553098 ecr 308544], length 0
16:16:11.413747 IP 112.26.0.8.35774 > 112.26.0.1.targus-getdata1: Flags [.], seq 92672:94120, ack 1, win 1369, options [nop,nop,TS val 308655 ecr 552767], length 1448
16:16:11.495771 IP 112.26.0.8.35774 > 112.26.0.1.targus-getdata1: Flags [.], seq 94120:95568, ack 1, win 1369, options [nop,nop,TS val 308773 ecr 552886], length 1448
16:16:11.496113 IP 112.26.0.1.targus-getdata1 > 112.26.0.8.35774: Flags [.], ack 95568, win 1432, options [nop,nop,TS val 553266 ecr 308655], length 0
16:16:11.500597 IP 112.26.0.1.targus-getdata1 > 112.26.0.8.35774: Flags [.], ack 95568, win 1432, options [nop,nop,TS val 553266 ecr 308655], length 0
16:16:11.526527 IP 112.26.0.8.35774 > 112.26.0.1.targus-getdata1: Flags [.], seq 95568:97016, ack 1, win 1369, options [nop,nop,TS val 308773 ecr 552886], length 1448
16:16:11.603054 IP 112.26.0.8.35774 > 112.26.0.1.targus-getdata1: Flags [.], seq 97016:98464, ack 1, win 1369, options [nop,nop,TS val 308773 ecr 552886], length 1448
16:16:11.603337 IP 112.26.0.1.targus-getdata1 > 112.26.0.8.35774: Flags [.], ack 98464, win 1432, options [nop,nop,TS val 553374 ecr 308773], length 0
16:16:11.615426 IP 112.26.0.1.targus-getdata1 > 112.26.0.8.35774: Flags [.], ack 98464, win 1432, options [nop,nop,TS val 553374 ecr 308773], length 0
16:16:11.697518 IP 112.26.0.8.35774 > 112.26.0.1.targus-getdata1: Flags [.], seq 98464:99912, ack 1, win 1369, options [nop,nop,TS val 308975 ecr 553045], length 1448
16:16:11.731571 IP 112.26.0.8.35774 > 112.26.0.1.targus-getdata1: Flags [.], seq 99912:101360, ack 1, win 1369, options [nop,nop,TS val 309049 ecr 553098], length 1448
16:16:11.731775 IP 112.26.0.1.targus-getdata1 > 112.26.0.8.35774: Flags [.], ack 101360, win 1432, options [nop,nop,TS val 553502 ecr 308975], length 0
16:16:11.743142 IP 112.26.0.1.targus-getdata1 > 112.26.0.8.35774: Flags [.], ack 101360, win 1432, options [nop,nop,TS val 553502 ecr 308975], length 0
16:16:11.810830 IP 112.26.0.8.35774 > 112.26.0.1.targus-getdata1: Flags [.], seq 101360:102808, ack 1, win 1369, options [nop,nop,TS val 309049 ecr 553098], length 1448
16:16:11.829228 IP 112.26.0.8.35774 > 112.26.0.1.targus-getdata1: Flags [.], seq 102808:104256, ack 1, win 1369, options [nop,nop,TS val 309159 ecr 553266], length 1448
16:16:11.829499 IP 112.26.0.1.targus-getdata1 > 112.26.0.8.35774: Flags [.], ack 104256, win 1432, options [nop,nop,TS val 553600 ecr 309049], length 0
16:16:11.834377 IP 112.26.0.1.targus-getdata1 > 112.26.0.8.35774: Flags [.], ack 104256, win 1432, options [nop,nop,TS val 553600 ecr 309049], length 0
16:16:11.940620 IP 112.26.0.8.35774 > 112.26.0.1.targus-getdata1: Flags [.], seq 104256:105704, ack 1, win 1369, options [nop,nop,TS val 309159 ecr 553266], length 1448
16:16:12.007409 IP 112.26.0.8.35774 > 112.26.0.1.targus-getdata1: Flags [.], seq 105704:107152, ack 1, win 1369, options [nop,nop,TS val 309262 ecr 553374], length 1448
16:16:12.007704 IP 112.26.0.1.targus-getdata1 > 112.26.0.8.35774: Flags [.], ack 107152, win 1432, options [nop,nop,TS val 553779 ecr 309159], length 0
16:16:12.011093 IP 112.26.0.1.targus-getdata1 > 112.26.0.8.35774: Flags [.], ack 107152, win 1432, options [nop,nop,TS val 553779 ecr 309159], length 0
16:16:12.092632 IP 112.26.0.8.35774 > 112.26.0.1.targus-getdata1: Flags [.], seq 107152:108600, ack 1, win 1369, options [nop,nop,TS val 309262 ecr 553374], length 1448
16:16:12.113289 IP 112.26.0.8.35774 > 112.26.0.1.targus-getdata1: Flags [.], seq 108600:110048, ack 1, win 1369, options [nop,nop,TS val 309391 ecr 553502], length 1448
16:16:12.113534 IP 112.26.0.1.targus-getdata1 > 112.26.0.8.35774: Flags [.], ack 110048, win 1432, options [nop,nop,TS val 553884 ecr 309262], length 0
16:16:12.115568 IP 112.26.0.1.targus-getdata1 > 112.26.0.8.35774: Flags [.], ack 110048, win 1432, options [nop,nop,TS val 553884 ecr 309262], length 0
16:16:12.209251 IP 112.26.0.8.35774 > 112.26.0.1.targus-getdata1: Flags [.], seq 110048:111496, ack 1, win 1369, options [nop,nop,TS val 309391 ecr 553502], length 1448
16:16:12.301061 IP 112.26.0.1.targus-getdata1 > 112.26.0.8.35774: Flags [.], ack 111496, win 1432, options [nop,nop,TS val 554072 ecr 309391], length 0
16:16:12.303982 IP 112.26.0.8.35774 > 112.26.0.1.targus-getdata1: Flags [.], seq 111496:112944, ack 1, win 1369, options [nop,nop,TS val 309489 ecr 553600], length 1448
