16:15:09.913893 IP 112.26.0.8.35772 > 112.26.0.1.targus-getdata1: Flags [S], seq 501555758, win 65535, options [mss 1460,sackOK,TS val 247491 ecr 0,nop,wscale 6], length 0
16:15:11.026213 IP 112.26.0.8.35772 > 112.26.0.1.targus-getdata1: Flags [S], seq 501555758, win 65535, options [mss 1460,sackOK,TS val 248512 ecr 0,nop,wscale 6], length 0
16:15:11.038818 IP 112.26.0.8.35772 > 112.26.0.1.targus-getdata1: Flags [S], seq 501555758, win 65535, options [mss 1460,sackOK,TS val 248512 ecr 0,nop,wscale 6], length 0
16:15:11.050751 IP 112.26.0.8.35772 > 112.26.0.1.targus-getdata1: Flags [S], seq 501555758, win 65535, options [mss 1460,sackOK,TS val 248512 ecr 0,nop,wscale 6], length 0
16:15:11.148346 IP 112.26.0.1.targus-getdata1 > 112.26.0.8.35772: Flags [S.], seq 851580856, ack 501555759, win 28960, options [mss 1460,sackOK,TS val 492822 ecr 248512,nop,wscale 7], length 0
16:15:11.240835 IP 112.26.0.1.targus-getdata1 > 112.26.0.8.35772: Flags [S.], seq 851580856, ack 501555759, win 28960, options [mss 1460,sackOK,TS val 492822 ecr 248512,nop,wscale 7], length 0
16:15:11.243790 IP 112.26.0.8.35772 > 112.26.0.1.targus-getdata1: Flags [.], ack 1, win 1369, options [nop,nop,TS val 248894 ecr 492822], length 0
16:15:47.665483 IP 112.26.0.8.35774 > 112.26.0.1.targus-getdata1: Flags [.], seq 1925573980:1925575428, ack 2111650953, win 1369, options [nop,nop,TS val 284617 ecr 528420], length 1448
16:15:48.249384 IP 112.26.0.8.35774 > 112.26.0.1.targus-getdata1: Flags [.], seq 1448:2896, ack 1, win 1369, options [nop,nop,TS val 285824 ecr 528420], length 1448
16:15:48.249738 IP 112.26.0.8.35774 > 112.26.0.1.targus-getdata1: Flags [.], seq 1448:2896, ack 1, win 1369, options [nop,nop,TS val 285824 ecr 528420], length 1448
16:15:48.255861 IP 112.26.0.8.35774 > 112.26.0.1.targus-getdata1: Flags [.], seq 1448:2896, ack 1, win 1369, options [nop,nop,TS val 285824 ecr 528420], length 1448
16:15:49.352801 IP 112.26.0.8.35774 > 112.26.0.1.targus-getdata1: Flags [.], seq 4294957160:4294958608, ack 1, win 1369, options [nop,nop,TS val 286976 ecr 528420], length 1448
16:15:49.353140 IP 112.26.0.8.35774 > 112.26.0.1.targus-getdata1: Flags [.], seq 4294957160:4294958608, ack 1, win 1369, options [nop,nop,TS val 286976 ecr 528420], length 1448
16:15:49.358389 IP 112.26.0.8.35774 > 112.26.0.1.targus-getdata1: Flags [.], seq 4294957160:4294958608, ack 1, win 1369, options [nop,nop,TS val 286976 ecr 528420], length 1448
16:15:51.667010 IP 112.26.0.8.35774 > 112.26.0.1.targus-getdata1: Flags [.], seq 4294957160:4294958608, ack 1, win 1369, options [nop,nop,TS val 289280 ecr 528420], length 1448
16:15:51.667406 IP 112.26.0.8.35774 > 112.26.0.1.targus-getdata1: Flags [.], seq 4294957160:4294958608, ack 1, win 1369, options [nop,nop,TS val 289280 ecr 528420], length 1448
16:15:51.689315 IP 112.26.0.8.35774 > 112.26.0.1.targus-getdata1: Flags [.], seq 4294957160:4294958608, ack 1, win 1369, options [nop,nop,TS val 289280 ecr 528420], length 1448
16:15:56.298928 IP 112.26.0.8.35774 > 112.26.0.1.targus-getdata1: Flags [.], seq 4294957160:4294958608, ack 1, win 1369, options [nop,nop,TS val 293888 ecr 528420], length 1448
16:15:56.299294 IP 112.26.0.8.35774 > 112.26.0.1.targus-getdata1: Flags [.], seq 4294957160:4294958608, ack 1, win 1369, options [nop,nop,TS val 293888 ecr 528420], length 1448
16:15:56.415276 IP 112.26.0.8.35774 > 112.26.0.1.targus-getdata1: Flags [.], seq 4294957160:4294958608, ack 1, win 1369, options [nop,nop,TS val 293888 ecr 528420], length 1448
16:16:05.458079 IP 112.26.0.8.35774 > 112.26.0.1.targus-getdata1: Flags [.], seq 4294957160:4294958608, ack 1, win 1369, options [nop,nop,TS val 303104 ecr 528420], length 1448
16:16:05.469360 IP 112.26.0.8.35774 > 112.26.0.1.targus-getdata1: Flags [.], seq 4294957160:4294958608, ack 1, win 1369, options [nop,nop,TS val 303104 ecr 528420], length 1448
16:16:05.470648 IP 112.26.0.8.35774 > 112.26.0.1.targus-getdata1: Flags [.], seq 4294957160:4294958608, ack 1, win 1369, options [nop,nop,TS val 303104 ecr 528420], length 1448
16:16:05.486538 IP 112.26.0.1.targus-getdata1 > 112.26.0.8.35774: Flags [.], ack 2896, win 1432, options [nop,nop,TS val 547241 ecr 285824,nop,nop,sack 1 {4294957160:4294958608}], length 0
16:16:05.565681 IP 112.26.0.1.targus-getdata1 > 112.26.0.8.35774: Flags [.], ack 2896, win 1432, options [nop,nop,TS val 547241 ecr 285824,nop,nop,sack 1 {4294957160:4294958608}], length 0
16:16:05.568099 IP 112.26.0.8.35774 > 112.26.0.1.targus-getdata1: Flags [.], seq 2896:4344, ack 1, win 1369, options [nop,nop,TS val 303219 ecr 547241], length 1448
16:16:05.586600 IP 112.26.0.8.35774 > 112.26.0.1.targus-getdata1: Flags [.], seq 4344:5792, ack 1, win 1369, options [nop,nop,TS val 303219 ecr 547241], length 1448
16:16:05.658771 IP 112.26.0.8.35774 > 112.26.0.1.targus-getdata1: Flags [.], seq 2896:4344, ack 1, win 1369, options [nop,nop,TS val 303219 ecr 547241], length 1448
16:16:05.660696 IP 112.26.0.8.35774 > 112.26.0.1.targus-getdata1: Flags [.], seq 2896:4344, ack 1, win 1369, options [nop,nop,TS val 303219 ecr 547241], length 1448
16:16:05.672496 IP 112.26.0.8.35774 > 112.26.0.1.targus-getdata1: Flags [.], seq 5792:7240, ack 1, win 1369, options [nop,nop,TS val 303220 ecr 547241], length 1448
16:16:05.679155 IP 112.26.0.1.targus-getdata1 > 112.26.0.8.35774: Flags [.], ack 4344, win 1432, options [nop,nop,TS val 547431 ecr 303219], length 0
16:16:05.687822 IP 112.26.0.8.35774 > 112.26.0.1.targus-getdata1: Flags [.], seq 4344:5792, ack 1, win 1369, options [nop,nop,TS val 303219 ecr 547241], length 1448
16:16:05.693113 IP 112.26.0.8.35774 > 112.26.0.1.targus-getdata1: Flags [.], seq 7240:8688, ack 1, win 1369, options [nop,nop,TS val 303220 ecr 547241], length 1448
16:16:05.760234 IP 112.26.0.8.35774 > 112.26.0.1.targus-getdata1: Flags [.], seq 4344:5792, ack 1, win 1369, options [nop,nop,TS val 303219 ecr 547241], length 1448
16:16:05.773669 IP 112.26.0.8.35774 > 112.26.0.1.targus-getdata1: Flags [.], seq 8688:10136, ack 1, win 1369, options [nop,nop,TS val 303220 ecr 547241], length 1448
16:16:05.783512 IP 112.26.0.1.targus-getdata1 > 112.26.0.8.35774: Flags [.], ack 5792, win 1432, options [nop,nop,TS val 547531 ecr 303219], length 0
16:16:05.789330 IP 112.26.0.8.35774 > 112.26.0.1.targus-getdata1: Flags [.], seq 10136:11584, ack 1, win 1369, options [nop,nop,TS val 303220 ecr 547241], length 1448
16:16:05.792887 IP 112.26.0.8.35774 > 112.26.0.1.targus-getdata1: Flags [.], seq 5792:7240, ack 1, win 1369, options [nop,nop,TS val 303220 ecr 547241], length 1448
16:16:05.863514 IP 112.26.0.8.35774 > 112.26.0.1.targus-getdata1: Flags [.], seq 5792:7240, ack 1, win 1369, options [nop,nop,TS val 303220 ecr 547241], length 1448
16:16:05.874947 IP 112.26.0.8.35774 > 112.26.0.1.targus-getdata1: Flags [.], seq 11584:13032, ack 1, win 1369, options [nop,nop,TS val 303220 ecr 547241], length 1448
16:16:05.879782 IP 112.26.0.1.targus-getdata1 > 112.26.0.8.35774: Flags [.], ack 7240, win 1432, options [nop,nop,TS val 547632 ecr 303220], length 0
16:16:05.882592 IP 112.26.0.1.targus-getdata1 > 112.26.0.8.35774: Flags [.], ack 4344, win 1432, options [nop,nop,TS val 547431 ecr 303219], length 0
16:16:05.895356 IP 112.26.0.8.35774 > 112.26.0.1.targus-getdata1: Flags [.], seq 13032:14480, ack 1, win 1369, options [nop,nop,TS val 303220 ecr 547241], length 1448
16:16:05.962026 IP 112.26.0.8.35774 > 112.26.0.1.targus-getdata1: Flags [.], seq 14480:15928, ack 1, win 1369, options [nop,nop,TS val 303536 ecr 547431], length 1448
16:16:05.966750 IP 112.26.0.8.35774 > 112.26.0.1.targus-getdata1: Flags [.], seq 7240:8688, ack 1, win 1369, options [nop,nop,TS val 303220 ecr 547241], length 1448
16:16:05.968370 IP 112.26.0.8.35774 > 112.26.0.1.targus-getdata1: Flags [.], seq 7240:8688, ack 1, win 1369, options [nop,nop,TS val 303220 ecr 547241], length 1448
16:16:05.984899 IP 112.26.0.8.35774 > 112.26.0.1.targus-getdata1: Flags [.], seq 8688:10136, ack 1, win 1369, options [nop,nop,TS val 303220 ecr 547241], length 1448
16:16:05.986867 IP 112.26.0.1.targus-getdata1 > 112.26.0.8.35774: Flags [.], ack 8688, win 1432, options [nop,nop,TS val 547739 ecr 303220], length 0
16:16:06.064329 IP 112.26.0.8.35774 > 112.26.0.1.targus-getdata1: Flags [.], seq 8688:10136, ack 1, win 1369, options [nop,nop,TS val 303220 ecr 547241], length 1448
16:16:06.073167 IP 112.26.0.1.targus-getdata1 > 112.26.0.8.35774: Flags [.], ack 5792, win 1432, options [nop,nop,TS val 547531 ecr 303219], length 0
16:16:06.077330 IP 112.26.0.8.35774 > 112.26.0.1.targus-getdata1: Flags [.], seq 15928:17376, ack 1, win 1369, options [nop,nop,TS val 303727 ecr 547531], length 1448
16:16:06.083533 IP 112.26.0.1.targus-getdata1 > 112.26.0.8.35774: Flags [.], ack 10136, win 1432, options [nop,nop,TS val 547835 ecr 303220], length 0
16:16:06.161572 IP 112.26.0.8.35774 > 112.26.0.1.targus-getdata1: Flags [.], seq 10136:11584, ack 1, win 1369, options [nop,nop,TS val 303220 ecr 547241], length 1448
16:16:06.163302 IP 112.26.0.8.35774 > 112.26.0.1.targus-getdata1: Flags [.], seq 10136:11584, ack 1, win 1369, options [nop,nop,TS val 303220 ecr 547241], length 1448
16:16:06.183741 IP 112.26.0.1.targus-getdata1 > 112.26.0.8.35774: Flags [.], ack 11584, win 1432, options [nop,nop,TS val 547935 ecr 303220], length 0
16:16:06.265691 IP 112.26.0.8.35774 > 112.26.0.1.targus-getdata1: Flags [.], seq 11584:13032, ack 1, win 1369, options [nop,nop,TS val 303220 ecr 547241], length 1448
16:16:06.271239 IP 112.26.0.8.35774 > 112.26.0.1.targus-getdata1: Flags [.], seq 11584:13032, ack 1, win 1369, options [nop,nop,TS val 303220 ecr 547241], length 1448
16:16:06.287391 IP 112.26.0.1.targus-getdata1 > 112.26.0.8.35774: Flags [.], ack 13032, win 1432, options [nop,nop,TS val 548042 ecr 303220], length 0
16:16:06.290183 IP 112.26.0.1.targus-getdata1 > 112.26.0.8.35774: Flags [.], ack 7240, win 1432, options [nop,nop,TS val 547632 ecr 303220], length 0
16:16:06.291806 IP 112.26.0.8.35774 > 112.26.0.1.targus-getdata1: Flags [.], seq 17376:18824, ack 1, win 1369, options [nop,nop,TS val 303944 ecr 547632], length 1448
16:16:06.379445 IP 112.26.0.8.35774 > 112.26.0.1.targus-getdata1: Flags [.], seq 13032:14480, ack 1, win 1369, options [nop,nop,TS val 303220 ecr 547241], length 1448
16:16:06.466308 IP 112.26.0.8.35774 > 112.26.0.1.targus-getdata1: Flags [.], seq 14480:15928, ack 1, win 1369, options [nop,nop,TS val 303536 ecr 547431], length 1448
16:16:06.473659 IP 112.26.0.8.35774 > 112.26.0.1.targus-getdata1: Flags [.], seq 13032:14480, ack 1, win 1369, options [nop,nop,TS val 303220 ecr 547241], length 1448
16:16:06.485881 IP 112.26.0.1.targus-getdata1 > 112.26.0.8.35774: Flags [.], ack 8688, win 1432, options [nop,nop,TS val 547739 ecr 303220], length 0
16:16:06.487481 IP 112.26.0.8.35774 > 112.26.0.1.targus-getdata1: Flags [.], seq 18824:20272, ack 1, win 1369, options [nop,nop,TS val 304139 ecr 547739], length 1448
16:16:06.569615 IP 112.26.0.8.35774 > 112.26.0.1.targus-getdata1: Flags [.], seq 15928:17376, ack 1, win 1369, options [nop,nop,TS val 303727 ecr 547531], length 1448
16:16:06.578777 IP 112.26.0.1.targus-getdata1 > 112.26.0.8.35774: Flags [.], ack 10136, win 1432, options [nop,nop,TS val 547835 ecr 303220], length 0
16:16:06.585267 IP 112.26.0.8.35774 > 112.26.0.1.targus-getdata1: Flags [.], seq 20272:21720, ack 1, win 1369, options [nop,nop,TS val 304232 ecr 547835], length 1448
16:16:06.593994 IP 112.26.0.1.targus-getdata1 > 112.26.0.8.35774: Flags [.], ack 14480, win 1432, options [nop,nop,TS val 548245 ecr 303220], length 0
16:16:06.670218 IP 112.26.0.8.35774 > 112.26.0.1.targus-getdata1: Flags [.], seq 21720:23168, ack 1, win 1369, options [nop,nop,TS val 304232 ecr 547835], length 1448
16:16:06.676710 IP 112.26.0.8.35774 > 112.26.0.1.targus-getdata1: Flags [.], seq 14480:15928, ack 1, win 1369, options [nop,nop,TS val 303536 ecr 547431], length 1448
16:16:06.681635 IP 112.26.0.1.targus-getdata1 > 112.26.0.8.35774: Flags [.], ack 11584, win 1432, options [nop,nop,TS val 547935 ecr 303220], length 0
16:16:06.694173 IP 112.26.0.8.35774 > 112.26.0.1.targus-getdata1: Flags [.], seq 14480:15928, ack 1, win 1369, options [nop,nop,TS val 303536 ecr 547431], length 1448
16:16:06.695573 IP 112.26.0.8.35774 > 112.26.0.1.targus-getdata1: Flags [.], seq 23168:24616, ack 1, win 1369, options [nop,nop,TS val 304335 ecr 547935], length 1448
16:16:06.697309 IP 112.26.0.1.targus-getdata1 > 112.26.0.8.35774: Flags [.], ack 13032, win 1432, options [nop,nop,TS val 548042 ecr 303220], length 0
16:16:06.706144 IP 112.26.0.8.35774 > 112.26.0.1.targus-getdata1: Flags [.], seq 15928:17376, ack 1, win 1369, options [nop,nop,TS val 303727 ecr 547531], length 1448
16:16:06.770001 IP 112.26.0.8.35774 > 112.26.0.1.targus-getdata1: Flags [.], seq 24616:26064, ack 1, win 1369, options [nop,nop,TS val 304351 ecr 548042], length 1448
16:16:06.779354 IP 112.26.0.1.targus-getdata1 > 112.26.0.8.35774: Flags [.], ack 15928, win 1432, options [nop,nop,TS val 548460 ecr 303536], length 0
16:16:06.782975 IP 112.26.0.1.targus-getdata1 > 112.26.0.8.35774: Flags [.], ack 15928, win 1432, options [nop,nop,TS val 548460 ecr 303536], length 0
16:16:06.789443 IP 112.26.0.8.35774 > 112.26.0.1.targus-getdata1: Flags [.], seq 26064:27512, ack 1, win 1369, options [nop,nop,TS val 304435 ecr 548460], length 1448
16:16:06.798154 IP 112.26.0.8.35774 > 112.26.0.1.targus-getdata1: Flags [.], seq 15928:17376, ack 1, win 1369, options [nop,nop,TS val 303727 ecr 547531], length 1448
16:16:06.805895 IP 112.26.0.8.35774 > 112.26.0.1.targus-getdata1: Flags [.], seq 18824:20272, ack 1, win 1369, options [nop,nop,TS val 304139 ecr 547739], length 1448
16:16:06.809065 IP 112.26.0.8.35774 > 112.26.0.1.targus-getdata1: Flags [.], seq 18824:20272, ack 1, win 1369, options [nop,nop,TS val 304139 ecr 547739], length 1448
16:16:06.874482 IP 112.26.0.8.35774 > 112.26.0.1.targus-getdata1: Flags [.], seq 27512:28960, ack 1, win 1369, options [nop,nop,TS val 304435 ecr 548460], length 1448
16:16:06.882455 IP 112.26.0.8.35774 > 112.26.0.1.targus-getdata1: Flags [.], seq 28960:30408, ack 1, win 1369, options [nop,nop,TS val 304435 ecr 548460], length 1448
16:16:06.888035 IP 112.26.0.8.35774 > 112.26.0.1.targus-getdata1: Flags [.], seq 20272:21720, ack 1, win 1369, options [nop,nop,TS val 304232 ecr 547835], length 1448
16:16:06.890735 IP 112.26.0.8.35774 > 112.26.0.1.targus-getdata1: Flags [.], seq 20272:21720, ack 1, win 1369, options [nop,nop,TS val 304232 ecr 547835], length 1448
16:16:06.893272 IP 112.26.0.1.targus-getdata1 > 112.26.0.8.35774: Flags [.], ack 17376, win 1432, options [nop,nop,TS val 548569 ecr 303727], length 0
16:16:06.895779 IP 112.26.0.1.targus-getdata1 > 112.26.0.8.35774: Flags [.], ack 17376, win 1432, options [nop,nop,TS val 548569 ecr 303727], length 0
16:16:06.962891 IP 112.26.0.8.35774 > 112.26.0.1.targus-getdata1: Flags [.], seq 30408:31856, ack 1, win 1369, options [nop,nop,TS val 304548 ecr 548569], length 1448
16:16:06.971465 IP 112.26.0.1.targus-getdata1 > 112.26.0.8.35774: Flags [.], ack 14480, win 1432, options [nop,nop,TS val 548245 ecr 303220], length 0
16:16:06.977486 IP 112.26.0.8.35774 > 112.26.0.1.targus-getdata1: Flags [.], seq 18824:20272, ack 1, win 1369, options [nop,nop,TS val 304139 ecr 547739], length 1448
16:16:06.986964 IP 112.26.0.8.35774 > 112.26.0.1.targus-getdata1: Flags [.], ack 1, win 1369, options [nop,nop,TS val 304625 ecr 548569], length 0
16:16:06.999358 IP 112.26.0.8.35774 > 112.26.0.1.targus-getdata1: Flags [.], seq 21720:23168, ack 1, win 1369, options [nop,nop,TS val 304232 ecr 547835], length 1448
16:16:07.005438 IP 112.26.0.8.35774 > 112.26.0.1.targus-getdata1: Flags [.], seq 20272:21720, ack 1, win 1369, options [nop,nop,TS val 304232 ecr 547835], length 1448
16:16:07.063752 IP 112.26.0.8.35774 > 112.26.0.1.targus-getdata1: Flags [.], seq 21720:23168, ack 1, win 1369, options [nop,nop,TS val 304232 ecr 547835], length 1448
16:16:07.077567 IP 112.26.0.8.35774 > 112.26.0.1.targus-getdata1: Flags [.], seq 23168:24616, ack 1, win 1369, options [nop,nop,TS val 304335 ecr 547935], length 1448
16:16:07.083658 IP 112.26.0.8.35774 > 112.26.0.1.targus-getdata1: Flags [.], seq 23168:24616, ack 1, win 1369, options [nop,nop,TS val 304335 ecr 547935], length 1448
16:16:07.169492 IP 112.26.0.8.35774 > 112.26.0.1.targus-getdata1: Flags [.], seq 24616:26064, ack 1, win 1369, options [nop,nop,TS val 304351 ecr 548042], length 1448
16:16:07.174737 IP 112.26.0.8.35774 > 112.26.0.1.targus-getdata1: Flags [.], seq 24616:26064, ack 1, win 1369, options [nop,nop,TS val 304351 ecr 548042], length 1448
16:16:07.176552 IP 112.26.0.1.targus-getdata1 > 112.26.0.8.35774: Flags [.], ack 17376, win 1432, options [nop,nop,TS val 548748 ecr 303727,nop,nop,sack 1 {18824:20272}], length 0
16:16:07.181020 IP 112.26.0.1.targus-getdata1 > 112.26.0.8.35774: Flags [.], ack 17376, win 1432, options [nop,nop,TS val 548748 ecr 303727,nop,nop,sack 1 {18824:20272}], length 0
16:16:07.185185 IP 112.26.0.8.35774 > 112.26.0.1.targus-getdata1: Flags [.], seq 31856:33304, ack 1, win 1369, options [nop,nop,TS val 304832 ecr 548748], length 1448
16:16:07.195426 IP 112.26.0.8.35774 > 112.26.0.1.targus-getdata1: Flags [.], seq 26064:27512, ack 1, win 1369, options [nop,nop,TS val 304435 ecr 548460], length 1448
16:16:07.196743 IP 112.26.0.8.35774 > 112.26.0.1.targus-getdata1: Flags [.], seq 26064:27512, ack 1, win 1369, options [nop,nop,TS val 304435 ecr 548460], length 1448
16:16:07.268625 IP 112.26.0.8.35774 > 112.26.0.1.targus-getdata1: Flags [.], seq 21720:23168, ack 1, win 1369, options [nop,nop,TS val 304232 ecr 547835], length 1448
16:16:07.280570 IP 112.26.0.8.35774 > 112.26.0.1.targus-getdata1: Flags [.], seq 27512:28960, ack 1, win 1369, options [nop,nop,TS val 304435 ecr 548460], length 1448
16:16:07.282534 IP 112.26.0.8.35774 > 112.26.0.1.targus-getdata1: Flags [.], seq 27512:28960, ack 1, win 1369, options [nop,nop,TS val 304435 ecr 548460], length 1448
16:16:07.292444 IP 112.26.0.1.targus-getdata1 > 112.26.0.8.35774: Flags [.], ack 17376, win 1432, options [nop,nop,TS val 548776 ecr 303727,nop,nop,sack 1 {18824:21720}], length 0
16:16:07.299180 IP 112.26.0.1.targus-getdata1 > 112.26.0.8.35774: Flags [.], ack 17376, win 1432, options [nop,nop,TS val 548776 ecr 303727,nop,nop,sack 1 {18824:21720}], length 0
16:16:07.301422 IP 112.26.0.8.35774 > 112.26.0.1.targus-getdata1: Flags [.], seq 33304:34752, ack 1, win 1369, options [nop,nop,TS val 304952 ecr 548776], length 1448
16:16:07.374230 IP 112.26.0.8.35774 > 112.26.0.1.targus-getdata1: Flags [.], seq 28960:30408, ack 1, win 1369, options [nop,nop,TS val 304435 ecr 548460], length 1448
16:16:07.377572 IP 112.26.0.8.35774 > 112.26.0.1.targus-getdata1: Flags [.], seq 28960:30408, ack 1, win 1369, options [nop,nop,TS val 304435 ecr 548460], length 1448
16:16:07.388510 IP 112.26.0.8.35774 > 112.26.0.1.targus-getdata1: Flags [.], seq 23168:24616, ack 1, win 1369, options [nop,nop,TS val 304335 ecr 547935], length 1448
16:16:07.403981 IP 112.26.0.8.35774 > 112.26.0.1.targus-getdata1: Flags [.], seq 24616:26064, ack 1, win 1369, options [nop,nop,TS val 304351 ecr 548042], length 1448
16:16:07.473687 IP 112.26.0.8.35774 > 112.26.0.1.targus-getdata1: Flags [.], ack 1, win 1369, options [nop,nop,TS val 304625 ecr 548569], length 0
16:16:07.493192 IP 112.26.0.8.35774 > 112.26.0.1.targus-getdata1: Flags [.], seq 26064:27512, ack 1, win 1369, options [nop,nop,TS val 304435 ecr 548460], length 1448
16:16:07.501471 IP 112.26.0.8.35774 > 112.26.0.1.targus-getdata1: Flags [.], ack 1, win 1369, options [nop,nop,TS val 304625 ecr 548569], length 0
16:16:07.511991 IP 112.26.0.8.35774 > 112.26.0.1.targus-getdata1: Flags [.], seq 31856:33304, ack 1, win 1369, options [nop,nop,TS val 304832 ecr 548748], length 1448
16:16:07.577880 IP 112.26.0.8.35774 > 112.26.0.1.targus-getdata1: Flags [.], seq 33304:34752, ack 1, win 1369, options [nop,nop,TS val 304952 ecr 548776], length 1448
16:16:07.582992 IP 112.26.0.1.targus-getdata1 > 112.26.0.8.35774: Flags [.], ack 17376, win 1432, options [nop,nop,TS val 549040 ecr 303727,nop,nop,sack 1 {18824:23168}], length 0
16:16:07.584907 IP 112.26.0.1.targus-getdata1 > 112.26.0.8.35774: Flags [.], ack 17376, win 1432, options [nop,nop,TS val 549040 ecr 303727,nop,nop,sack 1 {18824:23168}], length 0
16:16:07.591232 IP 112.26.0.8.35774 > 112.26.0.1.targus-getdata1: Flags [.], seq 17376:18824, ack 1, win 1369, options [nop,nop,TS val 305239 ecr 549040], length 1448
16:16:07.596381 IP 112.26.0.8.35774 > 112.26.0.1.targus-getdata1: Flags [.], seq 31856:33304, ack 1, win 1369, options [nop,nop,TS val 304832 ecr 548748], length 1448
16:16:07.609089 IP 112.26.0.8.35774 > 112.26.0.1.targus-getdata1: Flags [.], seq 17376:18824, ack 1, win 1369, options [nop,nop,TS val 305239 ecr 549040], length 1448
16:16:07.677933 IP 112.26.0.8.35774 > 112.26.0.1.targus-getdata1: Flags [.], seq 27512:28960, ack 1, win 1369, options [nop,nop,TS val 304435 ecr 548460], length 1448
16:16:07.687432 IP 112.26.0.8.35774 > 112.26.0.1.targus-getdata1: Flags [.], seq 28960:30408, ack 1, win 1369, options [nop,nop,TS val 304435 ecr 548460], length 1448
16:16:07.774797 IP 112.26.0.8.35774 > 112.26.0.1.targus-getdata1: Flags [.], seq 33304:34752, ack 1, win 1369, options [nop,nop,TS val 304952 ecr 548776], length 1448
16:16:07.782289 IP 112.26.0.1.targus-getdata1 > 112.26.0.8.35774: Flags [.], ack 17376, win 1432, options [nop,nop,TS val 549159 ecr 303727,nop,nop,sack 1 {18824:24616}], length 0
16:16:07.784733 IP 112.26.0.1.targus-getdata1 > 112.26.0.8.35774: Flags [.], ack 17376, win 1432, options [nop,nop,TS val 549159 ecr 303727,nop,nop,sack 1 {18824:24616}], length 0
16:16:07.788343 IP 112.26.0.8.35774 > 112.26.0.1.targus-getdata1: Flags [.], seq 34752:36200, ack 1, win 1369, options [nop,nop,TS val 305438 ecr 549159], length 1448
16:16:07.791775 IP 112.26.0.8.35774 > 112.26.0.1.targus-getdata1: Flags [.], seq 34752:36200, ack 1, win 1369, options [nop,nop,TS val 305438 ecr 549159], length 1448
16:16:07.809748 IP 112.26.0.1.targus-getdata1 > 112.26.0.8.35774: Flags [.], ack 17376, win 1432, options [nop,nop,TS val 549175 ecr 303727,nop,nop,sack 1 {18824:26064}], length 0
16:16:07.812217 IP 112.26.0.1.targus-getdata1 > 112.26.0.8.35774: Flags [.], ack 17376, win 1432, options [nop,nop,TS val 549175 ecr 303727,nop,nop,sack 1 {18824:26064}], length 0
16:16:07.820991 IP 112.26.0.8.35774 > 112.26.0.1.targus-getdata1: Flags [.], seq 17376:18824, ack 1, win 1369, options [nop,nop,TS val 305239 ecr 549040], length 1448
16:16:07.880996 IP 112.26.0.1.targus-getdata1 > 112.26.0.8.35774: Flags [.], ack 17376, win 1432, options [nop,nop,TS val 549446 ecr 303727,nop,nop,sack 1 {18824:28960}], length 0
16:16:07.882026 IP 112.26.0.1.targus-getdata1 > 112.26.0.8.35774: Flags [.], ack 17376, win 1432, options [nop,nop,TS val 549446 ecr 303727,nop,nop,sack 1 {18824:28960}], length 0
16:16:07.892951 IP 112.26.0.8.35774 > 112.26.0.1.targus-getdata1: Flags [.], ack 1, win 1369, options [nop,nop,TS val 304625 ecr 548569], length 0
16:16:07.901309 IP 112.26.0.1.targus-getdata1 > 112.26.0.8.35774: Flags [.], ack 17376, win 1432, options [nop,nop,TS val 549458 ecr 303727,nop,nop,sack 1 {18824:30408}], length 0
16:16:07.902782 IP 112.26.0.1.targus-getdata1 > 112.26.0.8.35774: Flags [.], ack 17376, win 1432, options [nop,nop,TS val 549458 ecr 303727,nop,nop,sack 1 {18824:30408}], length 0
16:16:07.908746 IP 112.26.0.8.35774 > 112.26.0.1.targus-getdata1: Flags [.], seq 37648:39096, ack 1, win 1369, options [nop,nop,TS val 305556 ecr 549458], length 1448
16:16:07.971041 IP 112.26.0.8.35774 > 112.26.0.1.targus-getdata1: Flags [.], seq 31856:33304, ack 1, win 1369, options [nop,nop,TS val 304832 ecr 548748], length 1448
16:16:07.981298 IP 112.26.0.8.35774 > 112.26.0.1.targus-getdata1: Flags [.], seq 37648:39096, ack 1, win 1369, options [nop,nop,TS val 305556 ecr 549458], length 1448
16:16:07.988424 IP 112.26.0.8.35774 > 112.26.0.1.targus-getdata1: Flags [.], seq 34752:36200, ack 1, win 1369, options [nop,nop,TS val 305438 ecr 549159], length 1448
16:16:08.003614 IP 112.26.0.1.targus-getdata1 > 112.26.0.8.35774: Flags [.], ack 17376, win 1432, options [nop,nop,TS val 549264 ecr 303727,nop,nop,sack 1 {18824:27512}], length 0
16:16:08.005519 IP 112.26.0.1.targus-getdata1 > 112.26.0.8.35774: Flags [.], ack 17376, win 1432, options [nop,nop,TS val 549264 ecr 303727,nop,nop,sack 1 {18824:27512}], length 0
16:16:08.083448 IP 112.26.0.8.35774 > 112.26.0.1.targus-getdata1: Flags [.], ack 1, win 1369, options [nop,nop,TS val 304625 ecr 548569], length 0
16:16:08.096897 IP 112.26.0.8.35774 > 112.26.0.1.targus-getdata1: Flags [.], seq 31856:33304, ack 1, win 1369, options [nop,nop,TS val 304832 ecr 548748], length 1448
16:16:08.107219 IP 112.26.0.8.35774 > 112.26.0.1.targus-getdata1: Flags [.], seq 37648:39096, ack 1, win 1369, options [nop,nop,TS val 305556 ecr 549458], length 1448
16:16:08.202894 IP 112.26.0.8.35774 > 112.26.0.1.targus-getdata1: Flags [.], seq 33304:34752, ack 1, win 1369, options [nop,nop,TS val 304952 ecr 548776], length 1448
16:16:08.276402 IP 112.26.0.8.35774 > 112.26.0.1.targus-getdata1: Flags [.], seq 33304:34752, ack 1, win 1369, options [nop,nop,TS val 304952 ecr 548776], length 1448
16:16:08.283487 IP 112.26.0.8.35774 > 112.26.0.1.targus-getdata1: Flags [.], seq 17376:18824, ack 1, win 1369, options [nop,nop,TS val 305239 ecr 549040], length 1448
16:16:08.292086 IP 112.26.0.8.35774 > 112.26.0.1.targus-getdata1: Flags [.], seq 34752:36200, ack 1, win 1369, options [nop,nop,TS val 305438 ecr 549159], length 1448
16:16:08.296987 IP 112.26.0.8.35774 > 112.26.0.1.targus-getdata1: Flags [.], seq 17376:18824, ack 1, win 1369, options [nop,nop,TS val 305239 ecr 549040], length 1448
16:16:08.383329 IP 112.26.0.8.35774 > 112.26.0.1.targus-getdata1: Flags [.], ack 1, win 1369, options [nop,nop,TS val 304625 ecr 548569], length 0
16:16:08.390608 IP 112.26.0.1.targus-getdata1 > 112.26.0.8.35774: Flags [.], ack 17376, win 1432, options [nop,nop,TS val 550063 ecr 303727,nop,nop,sack 2 {34752:36200}{18824:30408}], length 0
16:16:08.391407 IP 112.26.0.1.targus-getdata1 > 112.26.0.8.35774: Flags [.], ack 17376, win 1432, options [nop,nop,TS val 550063 ecr 303727,nop,nop,sack 2 {34752:36200}{18824:30408}], length 0
16:16:08.397271 IP 112.26.0.8.35774 > 112.26.0.1.targus-getdata1: Flags [.], seq 17376:18824, ack 1, win 1369, options [nop,nop,TS val 306045 ecr 550063], length 1448
16:16:08.397664 IP 112.26.0.8.35774 > 112.26.0.1.targus-getdata1: Flags [.], seq 17376:18824, ack 1, win 1369, options [nop,nop,TS val 306045 ecr 550063], length 1448
16:16:08.409612 IP 112.26.0.8.35774 > 112.26.0.1.targus-getdata1: Flags [.], seq 31856:33304, ack 1, win 1369, options [nop,nop,TS val 304832 ecr 548748], length 1448
16:16:08.424722 IP 112.26.0.1.targus-getdata1 > 112.26.0.8.35774: Flags [.], ack 30408, win 1363, options [nop,nop,TS val 550068 ecr 305239,nop,nop,sack 1 {34752:36200}], length 0
16:16:08.425513 IP 112.26.0.1.targus-getdata1 > 112.26.0.8.35774: Flags [.], ack 30408, win 1363, options [nop,nop,TS val 550068 ecr 305239,nop,nop,sack 1 {34752:36200}], length 0
16:16:08.488269 IP 112.26.0.8.35774 > 112.26.0.1.targus-getdata1: Flags [.], seq 37648:39096, ack 1, win 1369, options [nop,nop,TS val 305556 ecr 549458], length 1448
16:16:08.492894 IP 112.26.0.8.35774 > 112.26.0.1.targus-getdata1: Flags [.], seq 30408:31856, ack 1, win 1369, options [nop,nop,TS val 306079 ecr 550068], length 1448
16:16:08.493217 IP 112.26.0.8.35774 > 112.26.0.1.targus-getdata1: Flags [.], seq 30408:31856, ack 1, win 1369, options [nop,nop,TS val 306079 ecr 550068], length 1448
16:16:08.499904 IP 112.26.0.8.35774 > 112.26.0.1.targus-getdata1: Flags [.], seq 30408:31856, ack 1, win 1369, options [nop,nop,TS val 306079 ecr 550068], length 1448
16:16:08.504599 IP 112.26.0.1.targus-getdata1 > 112.26.0.8.35774: Flags [.], ack 30408, win 1432, options [nop,nop,TS val 550154 ecr 305239,nop,nop,sack 1 {34752:36200}], length 0
16:16:08.508075 IP 112.26.0.1.targus-getdata1 > 112.26.0.8.35774: Flags [.], ack 30408, win 1432, options [nop,nop,TS val 550154 ecr 305239,nop,nop,sack 1 {34752:36200}], length 0
16:16:08.510239 IP 112.26.0.8.35774 > 112.26.0.1.targus-getdata1: Flags [.], seq 31856:33304, ack 1, win 1369, options [nop,nop,TS val 306079 ecr 550068], length 1448
16:16:08.510568 IP 112.26.0.8.35774 > 112.26.0.1.targus-getdata1: Flags [.], seq 31856:33304, ack 1, win 1369, options [nop,nop,TS val 306079 ecr 550068], length 1448
16:16:08.528376 IP 112.26.0.8.35774 > 112.26.0.1.targus-getdata1: Flags [.], seq 33304:34752, ack 1, win 1369, options [nop,nop,TS val 306079 ecr 550068], length 1448
16:16:08.528702 IP 112.26.0.8.35774 > 112.26.0.1.targus-getdata1: Flags [.], seq 33304:34752, ack 1, win 1369, options [nop,nop,TS val 306079 ecr 550068], length 1448
16:16:08.579309 IP 112.26.0.1.targus-getdata1 > 112.26.0.8.35774: Flags [.], ack 30408, win 1432, options [nop,nop,TS val 550180 ecr 305239,nop,nop,sack 1 {34752:36200}], length 0
16:16:08.580384 IP 112.26.0.1.targus-getdata1 > 112.26.0.8.35774: Flags [.], ack 30408, win 1432, options [nop,nop,TS val 550180 ecr 305239,nop,nop,sack 1 {34752:36200}], length 0
16:16:08.593492 IP 112.26.0.8.35774 > 112.26.0.1.targus-getdata1: Flags [.], seq 39096:40544, ack 1, win 1369, options [nop,nop,TS val 306079 ecr 550068], length 1448
16:16:08.593723 IP 112.26.0.8.35774 > 112.26.0.1.targus-getdata1: Flags [.], seq 39096:40544, ack 1, win 1369, options [nop,nop,TS val 306079 ecr 550068], length 1448
16:16:08.611439 IP 112.26.0.8.35774 > 112.26.0.1.targus-getdata1: Flags [.], seq 31856:33304, ack 1, win 1369, options [nop,nop,TS val 306079 ecr 550068], length 1448
16:16:08.613030 IP 112.26.0.1.targus-getdata1 > 112.26.0.8.35774: Flags [.], ack 30408, win 1432, options [nop,nop,TS val 550259 ecr 305239,nop,nop,sack 2 {37648:39096}{34752:36200}], length 0
16:16:08.680884 IP 112.26.0.1.targus-getdata1 > 112.26.0.8.35774: Flags [.], ack 31856, win 1421, options [nop,nop,TS val 550268 ecr 306079,nop,nop,sack 2 {37648:39096}{34752:36200}], length 0
16:16:08.687043 IP 112.26.0.8.35774 > 112.26.0.1.targus-getdata1: Flags [.], seq 33304:34752, ack 1, win 1369, options [nop,nop,TS val 304952 ecr 548776], length 1448
16:16:08.692764 IP 112.26.0.8.35774 > 112.26.0.1.targus-getdata1: Flags [.], seq 33304:34752, ack 1, win 1369, options [nop,nop,TS val 306079 ecr 550068], length 1448
16:16:08.696774 IP 112.26.0.1.targus-getdata1 > 112.26.0.8.35774: Flags [.], ack 30408, win 1432, options [nop,nop,TS val 550259 ecr 305239,nop,nop,sack 2 {37648:39096}{34752:36200}], length 0
16:16:08.701981 IP 112.26.0.1.targus-getdata1 > 112.26.0.8.35774: Flags [.], ack 33304, win 1417, options [nop,nop,TS val 550377 ecr 306079,nop,nop,sack 2 {37648:39096}{34752:36200}], length 0
16:16:08.707649 IP 112.26.0.8.35774 > 112.26.0.1.targus-getdata1: Flags [.], seq 36200:37648, ack 1, win 1369, options [nop,nop,TS val 306350 ecr 550259], length 1448
16:16:08.707955 IP 112.26.0.8.35774 > 112.26.0.1.targus-getdata1: Flags [.], seq 36200:37648, ack 1, win 1369, options [nop,nop,TS val 306350 ecr 550259], length 1448
16:16:08.716067 IP 112.26.0.1.targus-getdata1 > 112.26.0.8.35774: Flags [.], ack 31856, win 1421, options [nop,nop,TS val 550268 ecr 306079,nop,nop,sack 2 {37648:39096}{34752:36200}], length 0
16:16:08.730605 IP 112.26.0.1.targus-getdata1 > 112.26.0.8.35774: Flags [.], ack 33304, win 1425, options [nop,nop,TS val 550455 ecr 306079,nop,nop,sack 2 {37648:39096}{34752:36200}], length 0
16:16:08.781463 IP 112.26.0.8.35774 > 112.26.0.1.targus-getdata1: Flags [.], seq 17376:18824, ack 1, win 1369, options [nop,nop,TS val 306045 ecr 550063], length 1448
16:16:08.789109 IP 112.26.0.8.35774 > 112.26.0.1.targus-getdata1: Flags [.], seq 40544:41992, ack 1, win 1369, options [nop,nop,TS val 306368 ecr 550268], length 1448
16:16:08.789411 IP 112.26.0.8.35774 > 112.26.0.1.targus-getdata1: Flags [.], seq 40544:41992, ack 1, win 1369, options [nop,nop,TS val 306368 ecr 550268], length 1448
16:16:08.793708 IP 112.26.0.1.targus-getdata1 > 112.26.0.8.35774: Flags [.], ack 33304, win 1417, options [nop,nop,TS val 550377 ecr 306079,nop,nop,sack 2 {37648:39096}{34752:36200}], length 0
16:16:08.804408 IP 112.26.0.8.35774 > 112.26.0.1.targus-getdata1: Flags [.], seq 41992:43440, ack 1, win 1369, options [nop,nop,TS val 306368 ecr 550268], length 1448
16:16:08.804689 IP 112.26.0.8.35774 > 112.26.0.1.targus-getdata1: Flags [.], seq 41992:43440, ack 1, win 1369, options [nop,nop,TS val 306368 ecr 550268], length 1448
16:16:08.814782 IP 112.26.0.1.targus-getdata1 > 112.26.0.8.35774: Flags [.], ack 33304, win 1425, options [nop,nop,TS val 550455 ecr 306079,nop,nop,sack 2 {37648:39096}{34752:36200}], length 0
16:16:08.817935 IP 112.26.0.1.targus-getdata1 > 112.26.0.8.35774: Flags [.], ack 36200, win 1418, options [nop,nop,TS val 550463 ecr 306079,nop,nop,sack 1 {37648:39096}], length 0
16:16:08.823845 IP 112.26.0.8.35774 > 112.26.0.1.targus-getdata1: Flags [.], seq 39096:40544, ack 1, win 1369, options [nop,nop,TS val 306079 ecr 550068], length 1448
16:16:08.829641 IP 112.26.0.8.35774 > 112.26.0.1.targus-getdata1: Flags [.], seq 43440:44888, ack 1, win 1369, options [nop,nop,TS val 306447 ecr 550377], length 1448
16:16:08.829986 IP 112.26.0.8.35774 > 112.26.0.1.targus-getdata1: Flags [.], seq 43440:44888, ack 1, win 1369, options [nop,nop,TS val 306447 ecr 550377], length 1448
16:16:08.881472 IP 112.26.0.1.targus-getdata1 > 112.26.0.8.35774: Flags [.], ack 36200, win 1432, options [nop,nop,TS val 550552 ecr 306079,nop,nop,sack 2 {17376:18824}{37648:39096}], length 0
16:16:08.888974 IP 112.26.0.1.targus-getdata1 > 112.26.0.8.35774: Flags [.], ack 36200, win 1418, options [nop,nop,TS val 550463 ecr 306079,nop,nop,sack 1 {37648:39096}], length 0
16:16:08.898426 IP 112.26.0.8.35774 > 112.26.0.1.targus-getdata1: Flags [.], seq 44888:46336, ack 1, win 1369, options [nop,nop,TS val 306447 ecr 550377], length 1448
16:16:08.898775 IP 112.26.0.8.35774 > 112.26.0.1.targus-getdata1: Flags [.], seq 44888:46336, ack 1, win 1369, options [nop,nop,TS val 306447 ecr 550377], length 1448
16:16:08.904386 IP 112.26.0.1.targus-getdata1 > 112.26.0.8.35774: Flags [.], ack 36200, win 1432, options [nop,nop,TS val 550595 ecr 306079,nop,nop,sack 1 {37648:40544}], length 0
16:16:08.911797 IP 112.26.0.8.35774 > 112.26.0.1.targus-getdata1: Flags [.], seq 36200:37648, ack 1, win 1369, options [nop,nop,TS val 306350 ecr 550259], length 1448
16:16:08.918231 IP 112.26.0.1.targus-getdata1 > 112.26.0.8.35774: Flags [.], ack 36200, win 1432, options [nop,nop,TS val 550552 ecr 306079,nop,nop,sack 2 {17376:18824}{37648:39096}], length 0
16:16:08.924768 IP 112.26.0.1.targus-getdata1 > 112.26.0.8.35774: Flags [.], ack 40544, win 1419, options [nop,nop,TS val 550682 ecr 306350], length 0
16:16:08.977229 IP 112.26.0.1.targus-getdata1 > 112.26.0.8.35774: Flags [.], ack 36200, win 1432, options [nop,nop,TS val 550595 ecr 306079,nop,nop,sack 1 {37648:40544}], length 0
16:16:08.978294 IP 112.26.0.8.35774 > 112.26.0.1.targus-getdata1: Flags [.], seq 46336:47784, ack 1, win 1369, options [nop,nop,TS val 306542 ecr 550463], length 1448
16:16:08.978633 IP 112.26.0.8.35774 > 112.26.0.1.targus-getdata1: Flags [.], seq 46336:47784, ack 1, win 1369, options [nop,nop,TS val 306542 ecr 550463], length 1448
16:16:08.993274 IP 112.26.0.8.35774 > 112.26.0.1.targus-getdata1: Flags [.], seq 40544:41992, ack 1, win 1369, options [nop,nop,TS val 306368 ecr 550268], length 1448
16:16:08.997453 IP 112.26.0.1.targus-getdata1 > 112.26.0.8.35774: Flags [.], ack 41992, win 1432, options [nop,nop,TS val 550761 ecr 306368], length 0
16:16:09.009412 IP 112.26.0.8.35774 > 112.26.0.1.targus-getdata1: Flags [.], seq 47784:49232, ack 1, win 1369, options [nop,nop,TS val 306572 ecr 550552], length 1448
16:16:09.009735 IP 112.26.0.8.35774 > 112.26.0.1.targus-getdata1: Flags [.], seq 47784:49232, ack 1, win 1369, options [nop,nop,TS val 306572 ecr 550552], length 1448
16:16:09.010415 IP 112.26.0.1.targus-getdata1 > 112.26.0.8.35774: Flags [.], ack 40544, win 1419, options [nop,nop,TS val 550682 ecr 306350], length 0
16:16:09.079606 IP 112.26.0.1.targus-getdata1 > 112.26.0.8.35774: Flags [.], ack 43440, win 1432, options [nop,nop,TS val 550846 ecr 306368], length 0
16:16:09.084707 IP 112.26.0.8.35774 > 112.26.0.1.targus-getdata1: Flags [.], seq 41992:43440, ack 1, win 1369, options [nop,nop,TS val 306368 ecr 550268], length 1448
16:16:09.095428 IP 112.26.0.8.35774 > 112.26.0.1.targus-getdata1: Flags [.], seq 49232:50680, ack 1, win 1369, options [nop,nop,TS val 306664 ecr 550682], length 1448
16:16:09.095731 IP 112.26.0.8.35774 > 112.26.0.1.targus-getdata1: Flags [.], seq 49232:50680, ack 1, win 1369, options [nop,nop,TS val 306664 ecr 550682], length 1448
16:16:09.099395 IP 112.26.0.1.targus-getdata1 > 112.26.0.8.35774: Flags [.], ack 41992, win 1432, options [nop,nop,TS val 550761 ecr 306368], length 0
16:16:09.109035 IP 112.26.0.8.35774 > 112.26.0.1.targus-getdata1: Flags [.], seq 43440:44888, ack 1, win 1369, options [nop,nop,TS val 306447 ecr 550377], length 1448
16:16:09.113580 IP 112.26.0.1.targus-getdata1 > 112.26.0.8.35774: Flags [.], ack 44888, win 1432, options [nop,nop,TS val 550878 ecr 306447], length 0
16:16:09.183751 IP 112.26.0.1.targus-getdata1 > 112.26.0.8.35774: Flags [.], ack 43440, win 1432, options [nop,nop,TS val 550846 ecr 306368], length 0
16:16:09.198290 IP 112.26.0.1.targus-getdata1 > 112.26.0.8.35774: Flags [.], ack 46336, win 1432, options [nop,nop,TS val 550953 ecr 306447], length 0
16:16:09.200847 IP 112.26.0.8.35774 > 112.26.0.1.targus-getdata1: Flags [.], seq 44888:46336, ack 1, win 1369, options [nop,nop,TS val 306447 ecr 550377], length 1448
16:16:09.203330 IP 112.26.0.8.35774 > 112.26.0.1.targus-getdata1: Flags [.], seq 50680:52128, ack 1, win 1369, options [nop,nop,TS val 306838 ecr 550846], length 1448
16:16:09.203707 IP 112.26.0.8.35774 > 112.26.0.1.targus-getdata1: Flags [.], seq 50680:52128, ack 1, win 1369, options [nop,nop,TS val 306838 ecr 550846], length 1448
16:16:09.208562 IP 112.26.0.1.targus-getdata1 > 112.26.0.8.35774: Flags [.], ack 44888, win 1432, options [nop,nop,TS val 550878 ecr 306447], length 0
16:16:09.215696 IP 112.26.0.8.35774 > 112.26.0.1.targus-getdata1: Flags [.], seq 46336:47784, ack 1, win 1369, options [nop,nop,TS val 306542 ecr 550463], length 1448
16:16:09.216698 IP 112.26.0.1.targus-getdata1 > 112.26.0.8.35774: Flags [.], ack 47784, win 1432, options [nop,nop,TS val 550985 ecr 306542], length 0
16:16:09.281501 IP 112.26.0.1.targus-getdata1 > 112.26.0.8.35774: Flags [.], ack 46336, win 1432, options [nop,nop,TS val 550953 ecr 306447], length 0
16:16:09.295097 IP 112.26.0.8.35774 > 112.26.0.1.targus-getdata1: Flags [.], seq 47784:49232, ack 1, win 1369, options [nop,nop,TS val 306572 ecr 550552], length 1448
16:16:09.298220 IP 112.26.0.1.targus-getdata1 > 112.26.0.8.35774: Flags [.], ack 49232, win 1432, options [nop,nop,TS val 551065 ecr 306572], length 0
16:16:09.311283 IP 112.26.0.1.targus-getdata1 > 112.26.0.8.35774: Flags [.], ack 47784, win 1432, options [nop,nop,TS val 550985 ecr 306542], length 0
16:16:09.314026 IP 112.26.0.8.35774 > 112.26.0.1.targus-getdata1: Flags [.], seq 52128:53576, ack 1, win 1369, options [nop,nop,TS val 306965 ecr 550985], length 1448
16:16:09.314367 IP 112.26.0.8.35774 > 112.26.0.1.targus-getdata1: Flags [.], seq 52128:53576, ack 1, win 1369, options [nop,nop,TS val 306965 ecr 550985], length 1448
16:16:09.375361 IP 112.26.0.8.35774 > 112.26.0.1.targus-getdata1: Flags [.], seq 49232:50680, ack 1, win 1369, options [nop,nop,TS val 306664 ecr 550682], length 1448
16:16:09.386593 IP 112.26.0.1.targus-getdata1 > 112.26.0.8.35774: Flags [.], ack 50680, win 1432, options [nop,nop,TS val 551091 ecr 306664], length 0
16:16:09.398168 IP 112.26.0.1.targus-getdata1 > 112.26.0.8.35774: Flags [.], ack 49232, win 1432, options [nop,nop,TS val 551065 ecr 306572], length 0
