21:13:00.973413 IP 112.26.1.8.35583 > 112.26.1.1.40367: Flags [S], seq 2868810643, win 29200, options [mss 1460,sackOK,TS val 4294815180 ecr 0,nop,wscale 7,mptcp join id 3 token 0x329820ce nonce 0x35750e7f], length 0
21:13:01.033568 IP 112.26.1.8.35583 > 112.26.1.1.40367: Flags [S], seq 2868810643, win 29200, options [mss 1460,sackOK,TS val 4294815180 ecr 0,nop,wscale 7,mptcp join id 3 token 0x329820ce nonce 0x35750e7f], length 0
21:13:01.202226 IP 112.26.1.1.40367 > 112.26.1.8.35583: Flags [S.], seq 2680798708, ack 2868810644, win 65535, options [mss 1460,sackOK,TS val 61243 ecr 4294815180,nop,wscale 6,mptcp join id 3 hmac 0xe06dfaf1e4e6e1c5 nonce 0x4e95d7be], length 0
21:13:01.202581 IP 112.26.1.8.35583 > 112.26.1.1.40367: Flags [.], ack 1, win 1255, options [nop,nop,TS val 4294815421 ecr 61243,mptcp join hmac 0x74df8aa60a1bd8166a0670a7ca5bace4c3244274], length 0
21:13:01.288781 IP 112.26.1.8.35583 > 112.26.1.1.40367: Flags [.], ack 1, win 1255, options [nop,nop,TS val 4294815421 ecr 61243,mptcp join hmac 0x74df8aa60a1bd8166a0670a7ca5bace4c3244274], length 0
21:13:01.456868 IP 112.26.1.1.40367 > 112.26.1.8.35583: Flags [.], ack 1, win 2678, options [nop,nop,TS val 61436 ecr 4294815421,mptcp dss ack 3380555454], length 0
21:13:01.538570 IP 112.26.1.1.40367 > 112.26.1.8.35583: Flags [.], seq 1:1429, ack 1, win 2678, options [nop,nop,TS val 61437 ecr 4294815421,mptcp dss ack 3380555454 seq 2130016854 subseq 1 len 1428 csum 0xfe5], length 1428
21:13:01.538768 IP 112.26.1.8.35583 > 112.26.1.1.40367: Flags [.], ack 1429, win 1803, options [nop,nop,TS val 4294815758 ecr 61437,mptcp dss ack 2130011142], length 0
21:13:01.676847 IP 112.26.1.8.35583 > 112.26.1.1.40367: Flags [.], ack 1429, win 1803, options [nop,nop,TS val 4294815758 ecr 61437,mptcp dss ack 2130011142], length 0
21:13:01.771756 IP 112.26.1.1.40367 > 112.26.1.8.35583: Flags [.], seq 1429:2857, ack 1, win 2678, options [nop,nop,TS val 61437 ecr 4294815421,mptcp dss ack 3380555454 seq 2130018282 subseq 1429 len 1428 csum 0x9cca], length 1428
21:13:01.772170 IP 112.26.1.8.35583 > 112.26.1.1.40367: Flags [.], ack 2857, win 1917, options [nop,nop,TS val 4294815991 ecr 61437,mptcp dss ack 2130012570], length 0
21:13:01.939296 IP 112.26.1.8.35583 > 112.26.1.1.40367: Flags [.], ack 2857, win 1917, options [nop,nop,TS val 4294815991 ecr 61437,mptcp dss ack 2130012570], length 0
21:13:02.006801 IP 112.26.1.1.40367 > 112.26.1.8.35583: Flags [.], seq 2857:4285, ack 1, win 2678, options [nop,nop,TS val 61437 ecr 4294815421,mptcp dss ack 3380555454 seq 2130019710 subseq 2857 len 1428 csum 0x2b03], length 1428
21:13:02.007162 IP 112.26.1.8.35583 > 112.26.1.1.40367: Flags [.], ack 4285, win 2054, options [nop,nop,TS val 4294816226 ecr 61437,mptcp dss ack 2130015426], length 0
21:13:02.103914 IP 112.26.1.1.40367 > 112.26.1.8.35583: Flags [.], seq 4285:5713, ack 1, win 2678, options [nop,nop,TS val 61437 ecr 4294815421,mptcp dss ack 3380555454 seq 2130021138 subseq 4285 len 1428 csum 0x7c89], length 1428
21:13:02.104266 IP 112.26.1.8.35583 > 112.26.1.1.40367: Flags [.], ack 5713, win 2099, options [nop,nop,TS val 4294816323 ecr 61437,mptcp dss ack 2130015426], length 0
21:13:02.207864 IP 112.26.1.8.35583 > 112.26.1.1.40367: Flags [.], ack 4285, win 2054, options [nop,nop,TS val 4294816226 ecr 61437,mptcp dss ack 2130015426], length 0
21:13:02.363910 IP 112.26.1.8.35583 > 112.26.1.1.40367: Flags [.], ack 5713, win 2099, options [nop,nop,TS val 4294816323 ecr 61437,mptcp dss ack 2130015426], length 0
21:13:02.434275 IP 112.26.1.1.40367 > 112.26.1.8.35583: Flags [.], seq 5713:7141, ack 1, win 2678, options [nop,nop,TS val 61437 ecr 4294815421,mptcp dss ack 3380555454 seq 2130022566 subseq 5713 len 1428 csum 0x5709], length 1428
21:13:02.434586 IP 112.26.1.8.35583 > 112.26.1.1.40367: Flags [.], ack 7141, win 2282, options [nop,nop,TS val 4294816653 ecr 61437,mptcp dss ack 2130023994], length 0
21:13:02.511798 IP 112.26.1.1.40367 > 112.26.1.8.35583: Flags [.], seq 7141:8569, ack 1, win 2678, options [nop,nop,TS val 61438 ecr 4294815421,mptcp dss ack 3380555454 seq 2130023994 subseq 7141 len 1428 csum 0x381e], length 1428
21:13:02.512122 IP 112.26.1.8.35583 > 112.26.1.1.40367: Flags [.], ack 8569, win 2327, options [nop,nop,TS val 4294816731 ecr 61438,mptcp dss ack 2130025422], length 0
21:13:02.581141 IP 112.26.1.1.40367 > 112.26.1.8.35583: Flags [.], seq 8569:9997, ack 1, win 2678, options [nop,nop,TS val 61438 ecr 4294815421,mptcp dss ack 3380555454 seq 2130025422 subseq 8569 len 1428 csum 0xbf7a], length 1428
21:13:02.581466 IP 112.26.1.8.35583 > 112.26.1.1.40367: Flags [.], ack 9997, win 2396, options [nop,nop,TS val 4294816800 ecr 61438,mptcp dss ack 2130026850], length 0
21:13:02.672573 IP 112.26.1.8.35583 > 112.26.1.1.40367: Flags [.], ack 7141, win 2282, options [nop,nop,TS val 4294816653 ecr 61437,mptcp dss ack 2130023994], length 0
21:13:02.721267 IP 112.26.1.1.40367 > 112.26.1.8.35583: Flags [.], seq 9997:11425, ack 1, win 2678, options [nop,nop,TS val 61438 ecr 4294815421,mptcp dss ack 3380555454 seq 2130026850 subseq 9997 len 1428 csum 0x473], length 1428
21:13:02.721562 IP 112.26.1.8.35583 > 112.26.1.1.40367: Flags [.], ack 11425, win 2464, options [nop,nop,TS val 4294816940 ecr 61438,mptcp dss ack 2130028278], length 0
21:13:02.783944 IP 112.26.1.8.35583 > 112.26.1.1.40367: Flags [.], ack 8569, win 2327, options [nop,nop,TS val 4294816731 ecr 61438,mptcp dss ack 2130025422], length 0
21:13:02.814880 IP 112.26.1.1.40367 > 112.26.1.8.35583: Flags [.], seq 11425:12853, ack 1, win 2678, options [nop,nop,TS val 61438 ecr 4294815421,mptcp dss ack 3380555454 seq 2130028278 subseq 11425 len 1428 csum 0xce21], length 1428
21:13:02.815239 IP 112.26.1.8.35583 > 112.26.1.1.40367: Flags [.], ack 12853, win 2555, options [nop,nop,TS val 4294817034 ecr 61438,mptcp dss ack 2130029706], length 0
21:13:02.916342 IP 112.26.1.8.35583 > 112.26.1.1.40367: Flags [.], ack 9997, win 2396, options [nop,nop,TS val 4294816800 ecr 61438,mptcp dss ack 2130026850], length 0
21:13:03.013761 IP 112.26.1.1.40367 > 112.26.1.8.35583: Flags [.], seq 12853:14281, ack 1, win 4017, options [nop,nop,TS val 61832 ecr 4294815421,mptcp dss ack 3380555454 seq 2130029706 subseq 12853 len 1428 csum 0x8cf], length 1428
21:13:03.014135 IP 112.26.1.8.35583 > 112.26.1.1.40367: Flags [.], ack 14281, win 2647, options [nop,nop,TS val 4294817233 ecr 61832,mptcp dss ack 2130046842], length 0
21:13:03.096545 IP 112.26.1.8.35583 > 112.26.1.1.40367: Flags [.], ack 11425, win 2464, options [nop,nop,TS val 4294816940 ecr 61438,mptcp dss ack 2130028278], length 0
21:13:03.175218 IP 112.26.1.8.35583 > 112.26.1.1.40367: Flags [.], ack 12853, win 2555, options [nop,nop,TS val 4294817034 ecr 61438,mptcp dss ack 2130029706], length 0
21:13:03.234331 IP 112.26.1.1.40367 > 112.26.1.8.35583: Flags [.], seq 14281:15709, ack 1, win 4017, options [nop,nop,TS val 62442 ecr 4294815758,mptcp dss ack 3380555454 seq 2130081114 subseq 14281 len 1428 csum 0x22ef], length 1428
21:13:03.234668 IP 112.26.1.8.35583 > 112.26.1.1.40367: Flags [.], ack 15709, win 2806, options [nop,nop,TS val 4294817453 ecr 62442,mptcp dss ack 2130046842], length 0
21:13:03.319055 IP 112.26.1.1.40367 > 112.26.1.8.35583: Flags [.], seq 15709:17137, ack 1, win 4017, options [nop,nop,TS val 62442 ecr 4294815758,mptcp dss ack 3380555454 seq 2130082542 subseq 15709 len 1428 csum 0xb296], length 1428
21:13:03.319431 IP 112.26.1.8.35583 > 112.26.1.1.40367: Flags [.], ack 17137, win 2852, options [nop,nop,TS val 4294817538 ecr 62442,mptcp dss ack 2130046842], length 0
21:13:03.418944 IP 112.26.1.8.35583 > 112.26.1.1.40367: Flags [.], ack 14281, win 2647, options [nop,nop,TS val 4294817233 ecr 61832,mptcp dss ack 2130046842], length 0
21:13:03.482942 IP 112.26.1.1.40367 > 112.26.1.8.35583: Flags [.], seq 17137:18565, ack 1, win 4017, options [nop,nop,TS val 62711 ecr 4294815991,mptcp dss ack 3380555454 seq 2130092538 subseq 17137 len 1428 csum 0xcd03], length 1428
21:13:03.483259 IP 112.26.1.8.35583 > 112.26.1.1.40367: Flags [.], ack 18565, win 2943, options [nop,nop,TS val 4294817702 ecr 62711,mptcp dss ack 2130046842], length 0
21:13:03.563860 IP 112.26.1.8.35583 > 112.26.1.1.40367: Flags [.], ack 15709, win 2806, options [nop,nop,TS val 4294817453 ecr 62442,mptcp dss ack 2130046842], length 0
21:13:03.644549 IP 112.26.1.1.40367 > 112.26.1.8.35583: Flags [.], seq 18565:19993, ack 1, win 4017, options [nop,nop,TS val 62711 ecr 4294815991,mptcp dss ack 3380555454 seq 2130093966 subseq 18565 len 1428 csum 0x32b5], length 1428
21:13:03.644940 IP 112.26.1.8.35583 > 112.26.1.1.40367: Flags [.], ack 19993, win 3035, options [nop,nop,TS val 4294817863 ecr 62711,mptcp dss ack 2130046842], length 0
21:13:03.752647 IP 112.26.1.8.35583 > 112.26.1.1.40367: Flags [.], ack 17137, win 2852, options [nop,nop,TS val 4294817538 ecr 62442,mptcp dss ack 2130046842], length 0
21:13:03.839975 IP 112.26.1.1.40367 > 112.26.1.8.35583: Flags [.], seq 19993:21421, ack 1, win 4017, options [nop,nop,TS val 62900 ecr 4294816226,mptcp dss ack 3380555454 seq 2130102534 subseq 19993 len 1428 csum 0xde0b], length 1428
21:13:03.840309 IP 112.26.1.8.35583 > 112.26.1.1.40367: Flags [.], ack 21421, win 3103, options [nop,nop,TS val 4294818059 ecr 62900,mptcp dss ack 2130046842], length 0
21:13:03.876740 IP 112.26.1.8.35583 > 112.26.1.1.40367: Flags [.], ack 18565, win 2943, options [nop,nop,TS val 4294817702 ecr 62711,mptcp dss ack 2130046842], length 0
21:13:03.945442 IP 112.26.1.8.35583 > 112.26.1.1.40367: Flags [.], ack 19993, win 3035, options [nop,nop,TS val 4294817863 ecr 62711,mptcp dss ack 2130046842], length 0
21:13:04.011970 IP 112.26.1.1.40367 > 112.26.1.8.35583: Flags [.], seq 22849:24277, ack 1, win 4017, options [nop,nop,TS val 63072 ecr 4294816323,mptcp dss ack 3380555454 seq 2130108246 subseq 22849 len 1428 csum 0xa0d5], length 1428
21:13:04.012334 IP 112.26.1.8.35583 > 112.26.1.1.40367: Flags [.], ack 21421, win 3217, options [nop,nop,TS val 4294818231 ecr 62900,nop,nop,sack 1 {22849:24277},mptcp dss ack 2130046842], length 0
21:13:04.083884 IP 112.26.1.1.40367 > 112.26.1.8.35583: Flags [.], seq 24277:25705, ack 1, win 4017, options [nop,nop,TS val 63072 ecr 4294816323,mptcp dss ack 3380555454 seq 2130109674 subseq 24277 len 1428 csum 0xf272], length 1428
21:13:04.084242 IP 112.26.1.8.35583 > 112.26.1.1.40367: Flags [.], ack 21421, win 3240, options [nop,nop,TS val 4294818303 ecr 62900,nop,nop,sack 1 {22849:25705},mptcp dss ack 2130046842], length 0
21:13:04.135964 IP 112.26.1.8.35583 > 112.26.1.1.40367: Flags [.], ack 21421, win 3103, options [nop,nop,TS val 4294818059 ecr 62900,mptcp dss ack 2130046842], length 0
21:13:04.187916 IP 112.26.1.1.40367 > 112.26.1.8.35583: Flags [.], seq 25705:27133, ack 1, win 4017, options [nop,nop,TS val 63503 ecr 4294816653,mptcp dss ack 3380555454 seq 2130129666 subseq 25705 len 1428 csum 0xc01], length 1428
21:13:04.188224 IP 112.26.1.8.35583 > 112.26.1.1.40367: Flags [.], ack 21421, win 3331, options [nop,nop,TS val 4294818407 ecr 62900,nop,nop,sack 1 {22849:27133},mptcp dss ack 2130046842], length 0
21:13:04.297771 IP 112.26.1.8.35583 > 112.26.1.1.40367: Flags [.], ack 21421, win 3217, options [nop,nop,TS val 4294818231 ecr 62900,nop,nop,sack 1 {22849:24277},mptcp dss ack 2130046842], length 0
21:13:04.366697 IP 112.26.1.8.35583 > 112.26.1.1.40367: Flags [.], ack 21421, win 3240, options [nop,nop,TS val 4294818303 ecr 62900,nop,nop,sack 1 {22849:25705},mptcp dss ack 2130046842], length 0
21:13:04.512974 IP 112.26.1.8.35583 > 112.26.1.1.40367: Flags [.], ack 21421, win 3331, options [nop,nop,TS val 4294818407 ecr 62900,nop,nop,sack 1 {22849:27133},mptcp dss ack 2130046842], length 0
21:13:04.594640 IP 112.26.1.1.40367 > 112.26.1.8.35583: Flags [.], seq 28561:29989, ack 1, win 4017, options [nop,nop,TS val 63688 ecr 4294816731,mptcp dss ack 3380555454 seq 2130138234 subseq 28561 len 1428 csum 0x9700], length 1428
21:13:04.594942 IP 112.26.1.8.35583 > 112.26.1.1.40367: Flags [.], ack 21421, win 3536, options [nop,nop,TS val 4294818813 ecr 62900,nop,nop,sack 2 {28561:29989}{22849:27133},mptcp dss ack 2130069690], length 0
21:13:04.646350 IP 112.26.1.1.40367 > 112.26.1.8.35583: Flags [.], seq 29989:31417, ack 1, win 4017, options [nop,nop,TS val 63688 ecr 4294816731,mptcp dss ack 3380555454 seq 2130139662 subseq 29989 len 1428 csum 0xffb6], length 1428
21:13:04.646671 IP 112.26.1.8.35583 > 112.26.1.1.40367: Flags [.], ack 21421, win 3605, options [nop,nop,TS val 4294818865 ecr 62900,nop,nop,sack 2 {28561:31417}{22849:27133},mptcp dss ack 2130069690], length 0
21:13:04.729285 IP 112.26.1.1.40367 > 112.26.1.8.35583: Flags [.], seq 31417:32845, ack 1, win 4017, options [nop,nop,TS val 63782 ecr 4294816800,mptcp dss ack 3380555454 seq 2130143946 subseq 31417 len 1428 csum 0xc47a], length 1428
21:13:04.729626 IP 112.26.1.8.35583 > 112.26.1.1.40367: Flags [.], ack 21421, win 3673, options [nop,nop,TS val 4294818948 ecr 62900,nop,nop,sack 2 {28561:32845}{22849:27133},mptcp dss ack 2130069690], length 0
21:13:04.831925 IP 112.26.1.1.40367 > 112.26.1.8.35583: Flags [.], seq 32845:34273, ack 1, win 4017, options [nop,nop,TS val 63782 ecr 4294816800,mptcp dss ack 3380555454 seq 2130145374 subseq 32845 len 1428 csum 0x603e], length 1428
21:13:04.832234 IP 112.26.1.8.35583 > 112.26.1.1.40367: Flags [.], ack 21421, win 3696, options [nop,nop,TS val 4294819051 ecr 62900,nop,nop,sack 2 {28561:34273}{22849:27133},mptcp dss ack 2130069690], length 0
21:13:04.900764 IP 112.26.1.1.40367 > 112.26.1.8.35583: Flags [.], seq 34273:35701, ack 1, win 4017, options [nop,nop,TS val 63982 ecr 4294817034,mptcp dss ack 3380555454 seq 2130155370 subseq 34273 len 1428 csum 0xa854], length 1428
21:13:04.901107 IP 112.26.1.8.35583 > 112.26.1.1.40367: Flags [.], ack 21421, win 3787, options [nop,nop,TS val 4294819119 ecr 62900,nop,nop,sack 2 {28561:35701}{22849:27133},mptcp dss ack 2130069690], length 0
21:13:04.975562 IP 112.26.1.8.35583 > 112.26.1.1.40367: Flags [.], ack 21421, win 3536, options [nop,nop,TS val 4294818813 ecr 62900,nop,nop,sack 2 {28561:29989}{22849:27133},mptcp dss ack 2130069690], length 0
21:13:05.010235 IP 112.26.1.1.40367 > 112.26.1.8.35583: Flags [.], seq 35701:37129, ack 1, win 4017, options [nop,nop,TS val 63982 ecr 4294817034,mptcp dss ack 3380555454 seq 2130156798 subseq 35701 len 1428 csum 0xd061], length 1428
21:13:05.010511 IP 112.26.1.8.35583 > 112.26.1.1.40367: Flags [.], ack 21421, win 3856, options [nop,nop,TS val 4294819229 ecr 62900,nop,nop,sack 2 {28561:37129}{22849:27133},mptcp dss ack 2130075402], length 0
21:13:05.129779 IP 112.26.1.8.35583 > 112.26.1.1.40367: Flags [.], ack 21421, win 3605, options [nop,nop,TS val 4294818865 ecr 62900,nop,nop,sack 2 {28561:31417}{22849:27133},mptcp dss ack 2130069690], length 0
21:13:05.152572 IP 112.26.1.8.35583 > 112.26.1.1.40367: Flags [.], ack 21421, win 3673, options [nop,nop,TS val 4294818948 ecr 62900,nop,nop,sack 2 {28561:32845}{22849:27133},mptcp dss ack 2130069690], length 0
21:13:05.219727 IP 112.26.1.1.40367 > 112.26.1.8.35583: Flags [.], seq 38557:39985, ack 1, win 4017, options [nop,nop,TS val 63982 ecr 4294817034,mptcp dss ack 3380555454 seq 2130159654 subseq 38557 len 1428 csum 0x7172], length 1428
21:13:05.220019 IP 112.26.1.8.35583 > 112.26.1.1.40367: Flags [.], ack 21421, win 3970, options [nop,nop,TS val 4294819439 ecr 62900,nop,nop,sack 2 {38557:39985}{28561:37129},mptcp dss ack 2130096822], length 0
21:13:05.293018 IP 112.26.1.8.35583 > 112.26.1.1.40367: Flags [.], ack 21421, win 3696, options [nop,nop,TS val 4294819051 ecr 62900,nop,nop,sack 2 {28561:34273}{22849:27133},mptcp dss ack 2130069690], length 0
21:13:05.355420 IP 112.26.1.1.40367 > 112.26.1.8.35583: Flags [.], seq 39985:41413, ack 1, win 4017, options [nop,nop,TS val 64246 ecr 4294817233,mptcp dss ack 3380555454 seq 2130168222 subseq 39985 len 1428 csum 0xf5a5], length 1428
21:13:05.355701 IP 112.26.1.8.35583 > 112.26.1.1.40367: Flags [.], ack 21421, win 4038, options [nop,nop,TS val 4294819575 ecr 62900,nop,nop,sack 2 {38557:41413}{28561:37129},mptcp dss ack 2130099678], length 0
21:13:05.412119 IP 112.26.1.8.35583 > 112.26.1.1.40367: Flags [.], ack 21421, win 3787, options [nop,nop,TS val 4294819119 ecr 62900,nop,nop,sack 2 {28561:35701}{22849:27133},mptcp dss ack 2130069690], length 0
21:13:05.471590 IP 112.26.1.8.35583 > 112.26.1.1.40367: Flags [.], ack 21421, win 3856, options [nop,nop,TS val 4294819229 ecr 62900,nop,nop,sack 2 {28561:37129}{22849:27133},mptcp dss ack 2130075402], length 0
21:13:05.557681 IP 112.26.1.1.40367 > 112.26.1.8.35583: Flags [.], seq 42841:44269, ack 1, win 4017, options [nop,nop,TS val 64953 ecr 4294818059,mptcp dss ack 3380555454 seq 2130178218 subseq 42841 len 1428 csum 0xf84c], length 1428
21:13:05.557977 IP 112.26.1.8.35583 > 112.26.1.1.40367: Flags [.], ack 21421, win 4130, options [nop,nop,TS val 4294819777 ecr 62900,nop,nop,sack 2 {42841:44269}{38557:41413},mptcp dss ack 2130099678], length 0
21:13:05.616561 IP 112.26.1.8.35583 > 112.26.1.1.40367: Flags [.], ack 21421, win 3970, options [nop,nop,TS val 4294819439 ecr 62900,nop,nop,sack 2 {38557:39985}{28561:37129},mptcp dss ack 2130096822], length 0
21:13:05.685990 IP 112.26.1.1.40367 > 112.26.1.8.35583: Flags [.], seq 44269:45697, ack 1, win 4017, options [nop,nop,TS val 65137 ecr 4294818231,mptcp dss ack 3380555454 seq 2130182502 subseq 44269 len 1428 csum 0xb713], length 1428
21:13:05.686324 IP 112.26.1.8.35583 > 112.26.1.1.40367: Flags [.], ack 21421, win 4198, options [nop,nop,TS val 4294819905 ecr 62900,nop,nop,sack 2 {42841:45697}{38557:41413},mptcp dss ack 2130099678], length 0
21:13:05.746258 IP 112.26.1.8.35583 > 112.26.1.1.40367: Flags [.], ack 21421, win 4038, options [nop,nop,TS val 4294819575 ecr 62900,nop,nop,sack 2 {38557:41413}{28561:37129},mptcp dss ack 2130099678], length 0
21:13:05.788458 IP 112.26.1.1.40367 > 112.26.1.8.35583: Flags [.], seq 45697:47125, ack 1, win 4017, options [nop,nop,TS val 65191 ecr 4294818303,mptcp dss ack 3380555454 seq 2130185358 subseq 45697 len 1428 csum 0x7f2f], length 1428
21:13:05.788754 IP 112.26.1.8.35583 > 112.26.1.1.40367: Flags [.], ack 21421, win 4289, options [nop,nop,TS val 4294820008 ecr 62900,nop,nop,sack 2 {42841:47125}{38557:41413},mptcp dss ack 2130103962], length 0
21:13:05.883041 IP 112.26.1.1.40367 > 112.26.1.8.35583: Flags [.], seq 21421:22849, ack 1, win 4017, options [nop,nop,TS val 65255 ecr 4294818407,mptcp dss ack 3380555454 seq 2130103962 subseq 21421 len 1428 csum 0xbdea], length 1428
21:13:05.883389 IP 112.26.1.8.35583 > 112.26.1.1.40367: Flags [.], ack 27133, win 4358, options [nop,nop,TS val 4294820102 ecr 65255,nop,nop,sack 2 {42841:47125}{38557:41413},mptcp dss ack 2130118242], length 0
21:13:05.972223 IP 112.26.1.8.35583 > 112.26.1.1.40367: Flags [.], ack 21421, win 4130, options [nop,nop,TS val 4294819777 ecr 62900,nop,nop,sack 2 {42841:44269}{38557:41413},mptcp dss ack 2130099678], length 0
21:13:06.032961 IP 112.26.1.1.40367 > 112.26.1.8.35583: Flags [.], seq 27133:28561, ack 1, win 4017, options [nop,nop,TS val 65396 ecr 4294818813,mptcp dss ack 3380555454 seq 2130131094 subseq 27133 len 1428 csum 0xd59d], length 1428
21:13:06.033310 IP 112.26.1.8.35583 > 112.26.1.1.40367: Flags [.], ack 37129, win 4449, options [nop,nop,TS val 4294820252 ecr 65396,nop,nop,sack 2 {42841:47125}{38557:41413},mptcp dss ack 2130148230], length 0
21:13:06.106892 IP 112.26.1.8.35583 > 112.26.1.1.40367: Flags [.], ack 21421, win 4198, options [nop,nop,TS val 4294819905 ecr 62900,nop,nop,sack 2 {42841:45697}{38557:41413},mptcp dss ack 2130099678], length 0
21:13:06.187975 IP 112.26.1.8.35583 > 112.26.1.1.40367: Flags [.], ack 21421, win 4289, options [nop,nop,TS val 4294820008 ecr 62900,nop,nop,sack 2 {42841:47125}{38557:41413},mptcp dss ack 2130103962], length 0
21:13:06.224295 IP 112.26.1.1.40367 > 112.26.1.8.35583: Flags [.], seq 47125:48553, ack 1, win 4017, options [nop,nop,TS val 65601 ecr 4294818865,mptcp dss ack 3380555454 seq 2130198210 subseq 47125 len 1428 csum 0x5517], length 1428
21:13:06.224618 IP 112.26.1.8.35583 > 112.26.1.1.40367: Flags [.], ack 37129, win 4563, options [nop,nop,TS val 4294820443 ecr 65396,nop,nop,sack 2 {42841:48553}{38557:41413},mptcp dss ack 2130148230], length 0
21:13:06.314408 IP 112.26.1.8.35583 > 112.26.1.1.40367: Flags [.], ack 27133, win 4358, options [nop,nop,TS val 4294820102 ecr 65255,nop,nop,sack 2 {42841:47125}{38557:41413},mptcp dss ack 2130118242], length 0
21:13:06.338715 IP 112.26.1.8.35583 > 112.26.1.1.40367: Flags [.], ack 37129, win 4449, options [nop,nop,TS val 4294820252 ecr 65396,nop,nop,sack 2 {42841:47125}{38557:41413},mptcp dss ack 2130148230], length 0
21:13:06.382677 IP 112.26.1.1.40367 > 112.26.1.8.35583: Flags [.], seq 48553:49981, ack 1, win 4017, options [nop,nop,TS val 65904 ecr 4294819051,mptcp dss ack 3380555454 seq 2130213918 subseq 48553 len 1428 csum 0xd10e], length 1428
21:13:06.383003 IP 112.26.1.8.35583 > 112.26.1.1.40367: Flags [.], ack 37129, win 4677, options [nop,nop,TS val 4294820602 ecr 65396,nop,nop,sack 2 {42841:49981}{38557:41413},mptcp dss ack 2130148230], length 0
21:13:06.458420 IP 112.26.1.1.40367 > 112.26.1.8.35583: Flags [.], seq 49981:51409, ack 1, win 4017, options [nop,nop,TS val 65918 ecr 4294819119,mptcp dss ack 3380555454 seq 2130215346 subseq 49981 len 1428 csum 0xa56e], length 1428
21:13:06.458743 IP 112.26.1.8.35583 > 112.26.1.1.40367: Flags [.], ack 37129, win 4745, options [nop,nop,TS val 4294820677 ecr 65396,nop,nop,sack 2 {42841:51409}{38557:41413},mptcp dss ack 2130148230], length 0
21:13:06.517722 IP 112.26.1.8.35583 > 112.26.1.1.40367: Flags [.], ack 37129, win 4563, options [nop,nop,TS val 4294820443 ecr 65396,nop,nop,sack 2 {42841:48553}{38557:41413},mptcp dss ack 2130148230], length 0
21:13:06.544092 IP 112.26.1.1.40367 > 112.26.1.8.35583: Flags [.], seq 37129:38557, ack 1, win 4017, options [nop,nop,TS val 66160 ecr 4294819575,mptcp dss ack 3380555454 seq 2130158226 subseq 37129 len 1428 csum 0x9427], length 1428
21:13:06.544392 IP 112.26.1.8.35583 > 112.26.1.1.40367: Flags [.], ack 41413, win 4791, options [nop,nop,TS val 4294820763 ecr 66160,nop,nop,sack 1 {42841:51409},mptcp dss ack 2130148230], length 0
21:13:06.658317 IP 112.26.1.8.35583 > 112.26.1.1.40367: Flags [.], ack 37129, win 4677, options [nop,nop,TS val 4294820602 ecr 65396,nop,nop,sack 2 {42841:49981}{38557:41413},mptcp dss ack 2130148230], length 0
21:13:06.762356 IP 112.26.1.8.35583 > 112.26.1.1.40367: Flags [.], ack 37129, win 4745, options [nop,nop,TS val 4294820677 ecr 65396,nop,nop,sack 2 {42841:51409}{38557:41413},mptcp dss ack 2130148230], length 0
21:13:06.819126 IP 112.26.1.8.35583 > 112.26.1.1.40367: Flags [.], ack 41413, win 4791, options [nop,nop,TS val 4294820763 ecr 66160,nop,nop,sack 1 {42841:51409},mptcp dss ack 2130148230], length 0
21:13:06.885774 IP 112.26.1.1.40367 > 112.26.1.8.35583: Flags [.], seq 41413:42841, ack 1, win 4017, options [nop,nop,TS val 66397 ecr 4294819777,mptcp dss ack 3380555454 seq 2130169650 subseq 41413 len 1428 csum 0xf344], length 1428
21:13:06.886182 IP 112.26.1.8.35583 > 112.26.1.1.40367: Flags [.], ack 51409, win 4974, options [nop,nop,TS val 4294821104 ecr 66397,mptcp dss ack 2130148230], length 0
21:13:06.952682 IP 112.26.1.1.40367 > 112.26.1.8.35583: Flags [.], seq 51409:52837, ack 1, win 4017, options [nop,nop,TS val 66603 ecr 4294819905,mptcp dss ack 3380555454 seq 2130232482 subseq 51409 len 1428 csum 0x38d], length 1428
21:13:06.953005 IP 112.26.1.8.35583 > 112.26.1.1.40367: Flags [.], ack 52837, win 5042, options [nop,nop,TS val 4294821171 ecr 66603,mptcp dss ack 2130148230], length 0
21:13:07.055702 IP 112.26.1.8.35583 > 112.26.1.1.40367: Flags [.], ack 51409, win 4974, options [nop,nop,TS val 4294821104 ecr 66397,mptcp dss ack 2130148230], length 0
21:13:07.168846 IP 112.26.1.8.35583 > 112.26.1.1.40367: Flags [.], ack 52837, win 5042, options [nop,nop,TS val 4294821171 ecr 66603,mptcp dss ack 2130148230], length 0
21:13:07.217578 IP 112.26.1.1.40367 > 112.26.1.8.35583: Flags [.], seq 52837:54265, ack 1, win 4017, options [nop,nop,TS val 66696 ecr 4294820008,mptcp dss ack 3380555454 seq 2130236766 subseq 52837 len 1428 csum 0x6ba6], length 1428
21:13:07.217881 IP 112.26.1.8.35583 > 112.26.1.1.40367: Flags [.], ack 54265, win 5179, options [nop,nop,TS val 4294821437 ecr 66696,mptcp dss ack 2130179646], length 0
21:13:07.314313 IP 112.26.1.8.35583 > 112.26.1.1.40367: Flags [.], ack 54265, win 5179, options [nop,nop,TS val 4294821437 ecr 66696,mptcp dss ack 2130179646], length 0
21:13:07.339400 IP 112.26.1.1.40367 > 112.26.1.8.35583: Flags [.], seq 54265:55693, ack 1, win 4017, options [nop,nop,TS val 66817 ecr 4294820102,mptcp dss ack 3380555454 seq 2130242478 subseq 54265 len 1428 csum 0xbc0], length 1428
21:13:07.339726 IP 112.26.1.8.35583 > 112.26.1.1.40367: Flags [.], ack 55693, win 5247, options [nop,nop,TS val 4294821558 ecr 66817,mptcp dss ack 2130179646], length 0
21:13:07.420312 IP 112.26.1.1.40367 > 112.26.1.8.35583: Flags [.], seq 55693:57121, ack 1, win 4017, options [nop,nop,TS val 66817 ecr 4294820102,mptcp dss ack 3380555454 seq 2130243906 subseq 55693 len 1428 csum 0xf79], length 1428
21:13:07.420691 IP 112.26.1.8.35583 > 112.26.1.1.40367: Flags [.], ack 57121, win 5339, options [nop,nop,TS val 4294821640 ecr 66817,mptcp dss ack 2130179646], length 0
21:13:07.503007 IP 112.26.1.8.35583 > 112.26.1.1.40367: Flags [.], ack 55693, win 5247, options [nop,nop,TS val 4294821558 ecr 66817,mptcp dss ack 2130179646], length 0
21:13:07.521588 IP 112.26.1.8.35583 > 112.26.1.1.40367: Flags [.], ack 57121, win 5339, options [nop,nop,TS val 4294821640 ecr 66817,mptcp dss ack 2130179646], length 0
21:13:07.576874 IP 112.26.1.1.40367 > 112.26.1.8.35583: Flags [.], seq 57121:58549, ack 1, win 4017, options [nop,nop,TS val 66817 ecr 4294820102,mptcp dss ack 3380555454 seq 2130245334 subseq 57121 len 1428 csum 0xae83], length 1428
21:13:07.577189 IP 112.26.1.8.35583 > 112.26.1.1.40367: Flags [.], ack 58549, win 5407, options [nop,nop,TS val 4294821796 ecr 66817,mptcp dss ack 2130179646], length 0
21:13:07.658239 IP 112.26.1.8.35583 > 112.26.1.1.40367: Flags [.], ack 58549, win 5407, options [nop,nop,TS val 4294821796 ecr 66817,mptcp dss ack 2130179646], length 0
21:13:07.701366 IP 112.26.1.1.40367 > 112.26.1.8.35583: Flags [.], seq 59977:61405, ack 1, win 4017, options [nop,nop,TS val 67123 ecr 4294820443,mptcp dss ack 3380555454 seq 2130259614 subseq 59977 len 1428 csum 0xba50], length 1428
21:13:07.701686 IP 112.26.1.8.35583 > 112.26.1.1.40367: Flags [.], ack 58549, win 5521, options [nop,nop,TS val 4294821920 ecr 66817,nop,nop,sack 1 {59977:61405},mptcp dss ack 2130189642], length 0
21:13:07.800340 IP 112.26.1.8.35583 > 112.26.1.1.40367: Flags [.], ack 58549, win 5521, options [nop,nop,TS val 4294821920 ecr 66817,nop,nop,sack 1 {59977:61405},mptcp dss ack 2130189642], length 0
21:13:07.879224 IP 112.26.1.1.40367 > 112.26.1.8.35583: Flags [.], seq 61405:62833, ack 1, win 4017, options [nop,nop,TS val 67441 ecr 4294820602,mptcp dss ack 3380555454 seq 2130268182 subseq 61405 len 1428 csum 0xbd23], length 1428
21:13:07.879551 IP 112.26.1.8.35583 > 112.26.1.1.40367: Flags [.], ack 58549, win 5612, options [nop,nop,TS val 4294822098 ecr 66817,nop,nop,sack 1 {59977:62833},mptcp dss ack 2130189642], length 0
21:13:07.940501 IP 112.26.1.8.35583 > 112.26.1.1.40367: Flags [.], ack 58549, win 5612, options [nop,nop,TS val 4294822098 ecr 66817,nop,nop,sack 1 {59977:62833},mptcp dss ack 2130189642], length 0
21:13:07.970128 IP 112.26.1.1.40367 > 112.26.1.8.35583: Flags [.], seq 62833:64261, ack 1, win 4017, options [nop,nop,TS val 67543 ecr 4294820677,mptcp dss ack 3380555454 seq 2130271038 subseq 62833 len 1428 csum 0xf7b1], length 1428
21:13:07.970476 IP 112.26.1.8.35583 > 112.26.1.1.40367: Flags [.], ack 58549, win 5658, options [nop,nop,TS val 4294822189 ecr 66817,nop,nop,sack 1 {59977:64261},mptcp dss ack 2130189642], length 0
21:13:08.051962 IP 112.26.1.8.35583 > 112.26.1.1.40367: Flags [.], ack 58549, win 5658, options [nop,nop,TS val 4294822189 ecr 66817,nop,nop,sack 1 {59977:64261},mptcp dss ack 2130189642], length 0
21:13:08.171261 IP 112.26.1.1.40367 > 112.26.1.8.35583: Flags [.], seq 64261:65689, ack 1, win 4017, options [nop,nop,TS val 67660 ecr 4294820763,mptcp dss ack 3380555454 seq 2130275322 subseq 64261 len 1428 csum 0x9c51], length 1428
21:13:08.171565 IP 112.26.1.8.35583 > 112.26.1.1.40367: Flags [.], ack 58549, win 5656, options [nop,nop,TS val 4294822390 ecr 66817,nop,nop,sack 1 {59977:65689},mptcp dss ack 2130203922], length 0
21:13:08.224877 IP 112.26.1.8.35583 > 112.26.1.1.40367: Flags [.], ack 58549, win 5656, options [nop,nop,TS val 4294822390 ecr 66817,nop,nop,sack 1 {59977:65689},mptcp dss ack 2130203922], length 0
21:13:08.300228 IP 112.26.1.1.40367 > 112.26.1.8.35583: Flags [.], seq 65689:67117, ack 1, win 4017, options [nop,nop,TS val 67808 ecr 4294821104,mptcp dss ack 3380555454 seq 2130276750 subseq 65689 len 1428 csum 0x444e], length 1428
21:13:08.300535 IP 112.26.1.8.35583 > 112.26.1.1.40367: Flags [.], ack 58549, win 5656, options [nop,nop,TS val 4294822519 ecr 66817,nop,nop,sack 1 {59977:67117},mptcp dss ack 2130203922], length 0
21:13:08.359994 IP 112.26.1.8.35583 > 112.26.1.1.40367: Flags [.], ack 58549, win 5656, options [nop,nop,TS val 4294822519 ecr 66817,nop,nop,sack 1 {59977:67117},mptcp dss ack 2130203922], length 0
21:13:08.416187 IP 112.26.1.1.40367 > 112.26.1.8.35583: Flags [.], seq 67117:68545, ack 1, win 4017, options [nop,nop,TS val 67882 ecr 4294821171,mptcp dss ack 3380555454 seq 2130279606 subseq 67117 len 1428 csum 0x6420], length 1428
21:13:08.416493 IP 112.26.1.8.35583 > 112.26.1.1.40367: Flags [.], ack 58549, win 5653, options [nop,nop,TS val 4294822635 ecr 66817,nop,nop,sack 1 {59977:68545},mptcp dss ack 2130209634], length 0
21:13:08.478580 IP 112.26.1.8.35583 > 112.26.1.1.40367: Flags [.], ack 58549, win 5653, options [nop,nop,TS val 4294822635 ecr 66817,nop,nop,sack 1 {59977:68545},mptcp dss ack 2130209634], length 0
21:13:08.595287 IP 112.26.1.1.40367 > 112.26.1.8.35583: Flags [.], seq 69973:71401, ack 1, win 4017, options [nop,nop,TS val 68154 ecr 4294821558,mptcp dss ack 3380555454 seq 2130292458 subseq 69973 len 1428 csum 0x7c67], length 1428
21:13:08.595611 IP 112.26.1.8.35583 > 112.26.1.1.40367: Flags [.], ack 58549, win 5749, options [nop,nop,TS val 4294822814 ecr 66817,nop,nop,sack 2 {69973:71401}{59977:68545},mptcp dss ack 2130249618], length 0
21:13:08.696647 IP 112.26.1.8.35583 > 112.26.1.1.40367: Flags [.], ack 58549, win 5749, options [nop,nop,TS val 4294822814 ecr 66817,nop,nop,sack 2 {69973:71401}{59977:68545},mptcp dss ack 2130249618], length 0
21:13:08.739949 IP 112.26.1.1.40367 > 112.26.1.8.35583: Flags [.], seq 71401:72829, ack 1, win 4017, options [nop,nop,TS val 68232 ecr 4294821640,mptcp dss ack 3380555454 seq 2130293886 subseq 71401 len 1428 csum 0xb1bd], length 1428
21:13:08.740302 IP 112.26.1.8.35583 > 112.26.1.1.40367: Flags [.], ack 58549, win 5806, options [nop,nop,TS val 4294822959 ecr 66817,nop,nop,sack 2 {69973:72829}{59977:68545},mptcp dss ack 2130249618], length 0
21:13:08.775685 IP 112.26.1.8.35583 > 112.26.1.1.40367: Flags [.], ack 58549, win 5806, options [nop,nop,TS val 4294822959 ecr 66817,nop,nop,sack 2 {69973:72829}{59977:68545},mptcp dss ack 2130249618], length 0
21:13:08.849382 IP 112.26.1.1.40367 > 112.26.1.8.35583: Flags [.], seq 72829:74257, ack 1, win 4017, options [nop,nop,TS val 68232 ecr 4294821640,mptcp dss ack 3380555454 seq 2130295314 subseq 72829 len 1428 csum 0x50cd], length 1428
21:13:08.849703 IP 112.26.1.8.35583 > 112.26.1.1.40367: Flags [.], ack 58549, win 5806, options [nop,nop,TS val 4294823069 ecr 66817,nop,nop,sack 2 {69973:74257}{59977:68545},mptcp dss ack 2130249618], length 0
21:13:08.922319 IP 112.26.1.8.35583 > 112.26.1.1.40367: Flags [.], ack 58549, win 5806, options [nop,nop,TS val 4294823069 ecr 66817,nop,nop,sack 2 {69973:74257}{59977:68545},mptcp dss ack 2130249618], length 0
21:13:08.978297 IP 112.26.1.1.40367 > 112.26.1.8.35583: Flags [.], seq 74257:75685, ack 1, win 4017, options [nop,nop,TS val 68392 ecr 4294821796,mptcp dss ack 3380555454 seq 2130302454 subseq 74257 len 1428 csum 0x894f], length 1428
21:13:08.978623 IP 112.26.1.8.35583 > 112.26.1.1.40367: Flags [.], ack 58549, win 5806, options [nop,nop,TS val 4294823198 ecr 66817,nop,nop,sack 2 {69973:75685}{59977:68545},mptcp dss ack 2130249618], length 0
21:13:09.059051 IP 112.26.1.8.35583 > 112.26.1.1.40367: Flags [.], ack 58549, win 5806, options [nop,nop,TS val 4294823198 ecr 66817,nop,nop,sack 2 {69973:75685}{59977:68545},mptcp dss ack 2130249618], length 0
21:13:09.157099 IP 112.26.1.1.40367 > 112.26.1.8.35583: Flags [.], seq 75685:77113, ack 1, win 4017, options [nop,nop,TS val 68641 ecr 4294821920,mptcp dss ack 3380555454 seq 2130308166 subseq 75685 len 1428 csum 0xd9f8], length 1428
21:13:09.157431 IP 112.26.1.8.35583 > 112.26.1.1.40367: Flags [.], ack 58549, win 5806, options [nop,nop,TS val 4294823376 ecr 66817,nop,nop,sack 2 {69973:77113}{59977:68545},mptcp dss ack 2130249618], length 0
21:13:09.242380 IP 112.26.1.8.35583 > 112.26.1.1.40367: Flags [.], ack 58549, win 5806, options [nop,nop,TS val 4294823376 ecr 66817,nop,nop,sack 2 {69973:77113}{59977:68545},mptcp dss ack 2130249618], length 0
21:13:09.309463 IP 112.26.1.1.40367 > 112.26.1.8.35583: Flags [.], seq 77113:78541, ack 1, win 4017, options [nop,nop,TS val 68688 ecr 4294822098,mptcp dss ack 3380555454 seq 2130311022 subseq 77113 len 1428 csum 0xed55], length 1428
21:13:09.309792 IP 112.26.1.8.35583 > 112.26.1.1.40367: Flags [.], ack 58549, win 5806, options [nop,nop,TS val 4294823529 ecr 66817,nop,nop,sack 2 {69973:78541}{59977:68545},mptcp dss ack 2130249618], length 0
21:13:09.372546 IP 112.26.1.1.40367 > 112.26.1.8.35583: Flags [.], seq 58549:59977, ack 1, win 4017, options [nop,nop,TS val 68790 ecr 4294822189,mptcp dss ack 3380555454 seq 2130249618 subseq 58549 len 1428 csum 0xd6b5], length 1428
21:13:09.372864 IP 112.26.1.8.35583 > 112.26.1.1.40367: Flags [.], ack 68545, win 5650, options [nop,nop,TS val 4294823592 ecr 68790,nop,nop,sack 1 {69973:78541},mptcp dss ack 2130269610], length 0
21:13:09.468730 IP 112.26.1.8.35583 > 112.26.1.1.40367: Flags [.], ack 58549, win 5806, options [nop,nop,TS val 4294823529 ecr 66817,nop,nop,sack 2 {69973:78541}{59977:68545},mptcp dss ack 2130249618], length 0
21:13:09.560536 IP 112.26.1.8.35583 > 112.26.1.1.40367: Flags [.], ack 68545, win 5650, options [nop,nop,TS val 4294823592 ecr 68790,nop,nop,sack 1 {69973:78541},mptcp dss ack 2130269610], length 0
21:13:09.619677 IP 112.26.1.1.40367 > 112.26.1.8.35583: Flags [.], seq 78541:79969, ack 1, win 4017, options [nop,nop,TS val 69025 ecr 4294822390,mptcp dss ack 3380555454 seq 2130319590 subseq 78541 len 1428 csum 0x9427], length 1428
21:13:09.619984 IP 112.26.1.8.35583 > 112.26.1.1.40367: Flags [.], ack 68545, win 5723, options [nop,nop,TS val 4294823839 ecr 68790,nop,nop,sack 1 {69973:79969},mptcp dss ack 2130269610], length 0
21:13:09.662186 IP 112.26.1.8.35583 > 112.26.1.1.40367: Flags [.], ack 68545, win 5723, options [nop,nop,TS val 4294823839 ecr 68790,nop,nop,sack 1 {69973:79969},mptcp dss ack 2130269610], length 0
21:13:09.739510 IP 112.26.1.1.40367 > 112.26.1.8.35583: Flags [.], seq 79969:81397, ack 1, win 4017, options [nop,nop,TS val 69259 ecr 4294822635,mptcp dss ack 3380555454 seq 2130329586 subseq 79969 len 1428 csum 0x51ca], length 1428
21:13:09.739840 IP 112.26.1.8.35583 > 112.26.1.1.40367: Flags [.], ack 68545, win 5723, options [nop,nop,TS val 4294823959 ecr 68790,nop,nop,sack 1 {69973:81397},mptcp dss ack 2130269610], length 0
21:13:09.824098 IP 112.26.1.8.35583 > 112.26.1.1.40367: Flags [.], ack 68545, win 5723, options [nop,nop,TS val 4294823959 ecr 68790,nop,nop,sack 1 {69973:81397},mptcp dss ack 2130269610], length 0
21:13:09.890686 IP 112.26.1.1.40367 > 112.26.1.8.35583: Flags [.], seq 68545:69973, ack 1, win 4017, options [nop,nop,TS val 69534 ecr 4294822959,mptcp dss ack 3380555454 seq 2130283890 subseq 68545 len 1428 csum 0x11ff], length 1428
21:13:09.891002 IP 112.26.1.8.35583 > 112.26.1.1.40367: Flags [.], ack 81397, win 5627, options [nop,nop,TS val 4294824110 ecr 69534,mptcp dss ack 2130299598], length 0
21:13:09.967428 IP 112.26.1.8.35583 > 112.26.1.1.40367: Flags [.], ack 81397, win 5627, options [nop,nop,TS val 4294824110 ecr 69534,mptcp dss ack 2130299598], length 0
21:13:10.025314 IP 112.26.1.1.40367 > 112.26.1.8.35583: Flags [.], seq 81397:82825, ack 1, win 4017, options [nop,nop,TS val 69677 ecr 4294823069,mptcp dss ack 3380555454 seq 2130342438 subseq 81397 len 1428 csum 0x5bd8], length 1428
21:13:10.025609 IP 112.26.1.8.35583 > 112.26.1.1.40367: Flags [.], ack 82825, win 5706, options [nop,nop,TS val 4294824244 ecr 69677,mptcp dss ack 2130299598], length 0
21:13:10.114193 IP 112.26.1.8.35583 > 112.26.1.1.40367: Flags [.], ack 82825, win 5706, options [nop,nop,TS val 4294824244 ecr 69677,mptcp dss ack 2130299598], length 0
21:13:10.166476 IP 112.26.1.1.40367 > 112.26.1.8.35583: Flags [.], seq 82825:84253, ack 1, win 4017, options [nop,nop,TS val 69779 ecr 4294823198,mptcp dss ack 3380555454 seq 2130346722 subseq 82825 len 1428 csum 0x3d41], length 1428
21:13:10.166800 IP 112.26.1.8.35583 > 112.26.1.1.40367: Flags [.], ack 84253, win 5706, options [nop,nop,TS val 4294824386 ecr 69779,mptcp dss ack 2130299598], length 0
21:13:10.251781 IP 112.26.1.8.35583 > 112.26.1.1.40367: Flags [.], ack 84253, win 5706, options [nop,nop,TS val 4294824386 ecr 69779,mptcp dss ack 2130299598], length 0
21:13:10.290943 IP 112.26.1.1.40367 > 112.26.1.8.35583: Flags [.], seq 84253:85681, ack 1, win 4017, options [nop,nop,TS val 69896 ecr 4294823376,mptcp dss ack 3380555454 seq 2130349578 subseq 84253 len 1428 csum 0xfab2], length 1428
21:13:10.291274 IP 112.26.1.8.35583 > 112.26.1.1.40367: Flags [.], ack 85681, win 5706, options [nop,nop,TS val 4294824510 ecr 69896,mptcp dss ack 2130299598], length 0
21:13:10.347519 IP 112.26.1.8.35583 > 112.26.1.1.40367: Flags [.], ack 85681, win 5706, options [nop,nop,TS val 4294824510 ecr 69896,mptcp dss ack 2130299598], length 0
21:13:10.465394 IP 112.26.1.1.40367 > 112.26.1.8.35583: Flags [.], seq 85681:87109, ack 1, win 4017, options [nop,nop,TS val 70126 ecr 4294823529,mptcp dss ack 3380555454 seq 2130355290 subseq 85681 len 1428 csum 0x6dfb], length 1428
21:13:10.465761 IP 112.26.1.8.35583 > 112.26.1.1.40367: Flags [.], ack 87109, win 5722, options [nop,nop,TS val 4294824685 ecr 70126,mptcp dss ack 2130325302], length 0
21:13:10.535441 IP 112.26.1.8.35583 > 112.26.1.1.40367: Flags [.], ack 87109, win 5722, options [nop,nop,TS val 4294824685 ecr 70126,mptcp dss ack 2130325302], length 0
21:13:10.586811 IP 112.26.1.1.40367 > 112.26.1.8.35583: Flags [.], seq 87109:88537, ack 1, win 4017, options [nop,nop,TS val 70189 ecr 4294823592,mptcp dss ack 3380555454 seq 2130359574 subseq 87109 len 1428 csum 0xcdec], length 1428
21:13:10.587160 IP 112.26.1.8.35583 > 112.26.1.1.40367: Flags [.], ack 88537, win 5722, options [nop,nop,TS val 4294824806 ecr 70189,mptcp dss ack 2130325302], length 0
21:13:10.691725 IP 112.26.1.8.35583 > 112.26.1.1.40367: Flags [.], ack 88537, win 5722, options [nop,nop,TS val 4294824806 ecr 70189,mptcp dss ack 2130325302], length 0
21:13:10.771132 IP 112.26.1.1.40367 > 112.26.1.8.35583: Flags [.], seq 88537:89965, ack 1, win 4017, options [nop,nop,TS val 70439 ecr 4294823839,mptcp dss ack 3380555454 seq 2130368142 subseq 88537 len 1428 csum 0xc25], length 1428
21:13:10.771462 IP 112.26.1.8.35583 > 112.26.1.1.40367: Flags [.], ack 89965, win 5722, options [nop,nop,TS val 4294824990 ecr 70439,mptcp dss ack 2130325302], length 0
21:13:10.826703 IP 112.26.1.8.35583 > 112.26.1.1.40367: Flags [.], ack 89965, win 5722, options [nop,nop,TS val 4294824990 ecr 70439,mptcp dss ack 2130325302], length 0
