21:13:01.087597 IP 112.26.2.8.39713 > 112.26.2.1.40367: Flags [S], seq 26954512, win 29200, options [mss 1460,sackOK,TS val 4294815180 ecr 0,nop,wscale 7,mptcp join id 4 token 0x329820ce nonce 0xed9f6788], length 0
21:13:01.102121 IP 112.26.2.1.40367 > 112.26.2.8.39713: Flags [S.], seq 3510723181, ack 26954513, win 65535, options [mss 1460,sackOK,TS val 61234 ecr 4294815180,nop,wscale 6,mptcp join id 4 hmac 0xdf211948924db062 nonce 0x7ced79e9], length 0
21:13:01.182544 IP 112.26.2.1.40367 > 112.26.2.8.39713: Flags [S.], seq 3510723181, ack 26954513, win 65535, options [mss 1460,sackOK,TS val 61234 ecr 4294815180,nop,wscale 6,mptcp join id 4 hmac 0xdf211948924db062 nonce 0x7ced79e9], length 0
21:13:01.250239 IP 112.26.2.1.40367 > 112.26.2.8.39713: Flags [S.], seq 3510723181, ack 26954513, win 65535, options [mss 1460,sackOK,TS val 61234 ecr 4294815180,nop,wscale 6,mptcp join id 4 hmac 0xdf211948924db062 nonce 0x7ced79e9], length 0
21:13:01.349893 IP 112.26.2.8.39713 > 112.26.2.1.40367: Flags [.], ack 1, win 1483, options [nop,nop,TS val 4294815469 ecr 61234,mptcp join hmac 0x3e258373fcda68b422d89e478c6660763283a070], length 0
21:13:01.351613 IP 112.26.2.1.40367 > 112.26.2.8.39713: Flags [.], ack 1, win 4017, options [nop,nop,TS val 61496 ecr 4294815469,mptcp dss ack 3380555454], length 0
21:13:01.395293 IP 112.26.2.1.40367 > 112.26.2.8.39713: Flags [.], seq 1:1429, ack 1, win 4017, options [nop,nop,TS val 61509 ecr 4294815469,mptcp dss ack 3380555454 seq 2130031134 subseq 1 len 1428 csum 0x7144], length 1428
21:13:01.445164 IP 112.26.2.1.40367 > 112.26.2.8.39713: Flags [.], ack 1, win 4017, options [nop,nop,TS val 61496 ecr 4294815469,mptcp dss ack 3380555454], length 0
21:13:01.447599 IP 112.26.2.1.40367 > 112.26.2.8.39713: Flags [.], ack 1, win 4017, options [nop,nop,TS val 61496 ecr 4294815469,mptcp dss ack 3380555454], length 0
21:13:01.476856 IP 112.26.2.1.40367 > 112.26.2.8.39713: Flags [.], seq 1429:2857, ack 1, win 4017, options [nop,nop,TS val 61509 ecr 4294815469,mptcp dss ack 3380555454 seq 2130032562 subseq 1429 len 1428 csum 0x10a5], length 1428
21:13:01.505324 IP 112.26.2.1.40367 > 112.26.2.8.39713: Flags [.], seq 2857:4285, ack 1, win 4017, options [nop,nop,TS val 61510 ecr 4294815469,mptcp dss ack 3380555454 seq 2130033990 subseq 2857 len 1428 csum 0x7b8c], length 1428
21:13:01.525802 IP 112.26.2.1.40367 > 112.26.2.8.39713: Flags [.], seq 1:1429, ack 1, win 4017, options [nop,nop,TS val 61509 ecr 4294815469,mptcp dss ack 3380555454 seq 2130031134 subseq 1 len 1428 csum 0x7144], length 1428
21:13:01.530549 IP 112.26.2.1.40367 > 112.26.2.8.39713: Flags [.], seq 1:1429, ack 1, win 4017, options [nop,nop,TS val 61509 ecr 4294815469,mptcp dss ack 3380555454 seq 2130031134 subseq 1 len 1428 csum 0x7144], length 1428
21:13:01.688712 IP 112.26.2.1.40367 > 112.26.2.8.39713: Flags [.], seq 1429:2857, ack 1, win 4017, options [nop,nop,TS val 61509 ecr 4294815469,mptcp dss ack 3380555454 seq 2130032562 subseq 1429 len 1428 csum 0x10a5], length 1428
21:13:01.692615 IP 112.26.2.1.40367 > 112.26.2.8.39713: Flags [.], seq 1429:2857, ack 1, win 4017, options [nop,nop,TS val 61509 ecr 4294815469,mptcp dss ack 3380555454 seq 2130032562 subseq 1429 len 1428 csum 0x10a5], length 1428
21:13:01.765911 IP 112.26.2.1.40367 > 112.26.2.8.39713: Flags [.], seq 2857:4285, ack 1, win 4017, options [nop,nop,TS val 61510 ecr 4294815469,mptcp dss ack 3380555454 seq 2130033990 subseq 2857 len 1428 csum 0x7b8c], length 1428
21:13:01.802405 IP 112.26.2.1.40367 > 112.26.2.8.39713: Flags [.], seq 2857:4285, ack 1, win 4017, options [nop,nop,TS val 61510 ecr 4294815469,mptcp dss ack 3380555454 seq 2130033990 subseq 2857 len 1428 csum 0x7b8c], length 1428
21:13:01.840595 IP 112.26.2.8.39713 > 112.26.2.1.40367: Flags [.], ack 1429, win 1780, options [nop,nop,TS val 4294815749 ecr 61509,mptcp dss ack 2130011142], length 0
21:13:01.844646 IP 112.26.2.1.40367 > 112.26.2.8.39713: Flags [.], seq 4285:5713, ack 1, win 4017, options [nop,nop,TS val 61987 ecr 4294815469,mptcp dss ack 3380555454 seq 2130055410 subseq 4285 len 1428 csum 0x39d1], length 1428
21:13:01.922755 IP 112.26.2.8.39713 > 112.26.2.1.40367: Flags [.], ack 2857, win 1871, options [nop,nop,TS val 4294815912 ecr 61509,mptcp dss ack 2130012570], length 0
21:13:01.933980 IP 112.26.2.1.40367 > 112.26.2.8.39713: Flags [.], seq 5713:7141, ack 1, win 4017, options [nop,nop,TS val 61987 ecr 4294815469,mptcp dss ack 3380555454 seq 2130056838 subseq 5713 len 1428 csum 0x87d9], length 1428
21:13:02.041711 IP 112.26.2.1.40367 > 112.26.2.8.39713: Flags [.], seq 7141:8569, ack 1, win 4017, options [nop,nop,TS val 61987 ecr 4294815749,mptcp dss ack 3380555454 seq 2130058266 subseq 7141 len 1428 csum 0x3b36], length 1428
21:13:02.059526 IP 112.26.2.1.40367 > 112.26.2.8.39713: Flags [.], seq 4285:5713, ack 1, win 4017, options [nop,nop,TS val 61987 ecr 4294815469,mptcp dss ack 3380555454 seq 2130055410 subseq 4285 len 1428 csum 0x39d1], length 1428
21:13:02.065731 IP 112.26.2.1.40367 > 112.26.2.8.39713: Flags [.], seq 4285:5713, ack 1, win 4017, options [nop,nop,TS val 61987 ecr 4294815469,mptcp dss ack 3380555454 seq 2130055410 subseq 4285 len 1428 csum 0x39d1], length 1428
21:13:02.107835 IP 112.26.2.1.40367 > 112.26.2.8.39713: Flags [.], seq 8569:9997, ack 1, win 4017, options [nop,nop,TS val 61987 ecr 4294815749,mptcp dss ack 3380555454 seq 2130059694 subseq 8569 len 1428 csum 0xae96], length 1428
21:13:02.164993 IP 112.26.2.8.39713 > 112.26.2.1.40367: Flags [.], ack 4285, win 1940, options [nop,nop,TS val 4294816021 ecr 61510,mptcp dss ack 2130012570], length 0
21:13:02.184347 IP 112.26.2.1.40367 > 112.26.2.8.39713: Flags [.], seq 9997:11425, ack 1, win 4017, options [nop,nop,TS val 61987 ecr 4294815749,mptcp dss ack 3380555454 seq 2130061122 subseq 9997 len 1428 csum 0xbc10], length 1428
21:13:02.218254 IP 112.26.2.1.40367 > 112.26.2.8.39713: Flags [.], seq 5713:7141, ack 1, win 4017, options [nop,nop,TS val 61987 ecr 4294815469,mptcp dss ack 3380555454 seq 2130056838 subseq 5713 len 1428 csum 0x87d9], length 1428
21:13:02.221896 IP 112.26.2.1.40367 > 112.26.2.8.39713: Flags [.], seq 5713:7141, ack 1, win 4017, options [nop,nop,TS val 61987 ecr 4294815469,mptcp dss ack 3380555454 seq 2130056838 subseq 5713 len 1428 csum 0x87d9], length 1428
21:13:02.261556 IP 112.26.2.1.40367 > 112.26.2.8.39713: Flags [.], seq 11425:12853, ack 1, win 4017, options [nop,nop,TS val 61987 ecr 4294815749,mptcp dss ack 3380555454 seq 2130062550 subseq 11425 len 1428 csum 0xb3b3], length 1428
21:13:02.296583 IP 112.26.2.1.40367 > 112.26.2.8.39713: Flags [.], seq 7141:8569, ack 1, win 4017, options [nop,nop,TS val 61987 ecr 4294815749,mptcp dss ack 3380555454 seq 2130058266 subseq 7141 len 1428 csum 0x3b36], length 1428
21:13:02.337300 IP 112.26.2.1.40367 > 112.26.2.8.39713: Flags [.], seq 12853:14281, ack 1, win 4017, options [nop,nop,TS val 61987 ecr 4294815749,mptcp dss ack 3380555454 seq 2130063978 subseq 12853 len 1428 csum 0xbe64], length 1428
21:13:02.339274 IP 112.26.2.1.40367 > 112.26.2.8.39713: Flags [.], seq 7141:8569, ack 1, win 4017, options [nop,nop,TS val 61987 ecr 4294815749,mptcp dss ack 3380555454 seq 2130058266 subseq 7141 len 1428 csum 0x3b36], length 1428
21:13:02.394237 IP 112.26.2.1.40367 > 112.26.2.8.39713: Flags [.], seq 14281:15709, ack 1, win 4017, options [nop,nop,TS val 61987 ecr 4294815749,mptcp dss ack 3380555454 seq 2130065406 subseq 14281 len 1428 csum 0x178c], length 1428
21:13:02.405277 IP 112.26.2.1.40367 > 112.26.2.8.39713: Flags [.], seq 8569:9997, ack 1, win 4017, options [nop,nop,TS val 61987 ecr 4294815749,mptcp dss ack 3380555454 seq 2130059694 subseq 8569 len 1428 csum 0xae96], length 1428
21:13:02.418579 IP 112.26.2.1.40367 > 112.26.2.8.39713: Flags [.], seq 8569:9997, ack 1, win 4017, options [nop,nop,TS val 61987 ecr 4294815749,mptcp dss ack 3380555454 seq 2130059694 subseq 8569 len 1428 csum 0xae96], length 1428
21:13:02.458363 IP 112.26.2.8.39713 > 112.26.2.1.40367: Flags [.], ack 5713, win 2076, options [nop,nop,TS val 4294816282 ecr 61987,mptcp dss ack 2130015426], length 0
21:13:02.467903 IP 112.26.2.1.40367 > 112.26.2.8.39713: Flags [.], seq 15709:17137, ack 1, win 4017, options [nop,nop,TS val 62069 ecr 4294815912,mptcp dss ack 3380555454 seq 2130069690 subseq 15709 len 1428 csum 0xfa23], length 1428
21:13:02.527472 IP 112.26.2.1.40367 > 112.26.2.8.39713: Flags [.], seq 17137:18565, ack 1, win 4017, options [nop,nop,TS val 62069 ecr 4294815912,mptcp dss ack 3380555454 seq 2130071118 subseq 17137 len 1428 csum 0xacac], length 1428
21:13:02.563115 IP 112.26.2.1.40367 > 112.26.2.8.39713: Flags [.], seq 18565:19993, ack 1, win 4017, options [nop,nop,TS val 62311 ecr 4294816021,mptcp dss ack 3380555454 seq 2130075402 subseq 18565 len 1428 csum 0xcd92], length 1428
21:13:02.628762 IP 112.26.2.1.40367 > 112.26.2.8.39713: Flags [.], seq 19993:21421, ack 1, win 4017, options [nop,nop,TS val 62311 ecr 4294816021,mptcp dss ack 3380555454 seq 2130076830 subseq 19993 len 1428 csum 0xc400], length 1428
21:13:02.635727 IP 112.26.2.1.40367 > 112.26.2.8.39713: Flags [.], seq 9997:11425, ack 1, win 4017, options [nop,nop,TS val 61987 ecr 4294815749,mptcp dss ack 3380555454 seq 2130061122 subseq 9997 len 1428 csum 0xbc10], length 1428
21:13:02.641099 IP 112.26.2.1.40367 > 112.26.2.8.39713: Flags [.], seq 9997:11425, ack 1, win 4017, options [nop,nop,TS val 61987 ecr 4294815749,mptcp dss ack 3380555454 seq 2130061122 subseq 9997 len 1428 csum 0xbc10], length 1428
21:13:02.703397 IP 112.26.2.1.40367 > 112.26.2.8.39713: Flags [.], seq 21421:22849, ack 1, win 4017, options [nop,nop,TS val 62604 ecr 4294816282,mptcp dss ack 3380555454 seq 2130089682 subseq 21421 len 1428 csum 0x9991], length 1428
21:13:02.706628 IP 112.26.2.8.39713 > 112.26.2.1.40367: Flags [.], ack 7141, win 2168, options [nop,nop,TS val 4294816440 ecr 61987,mptcp dss ack 2130022566], length 0
21:13:02.760251 IP 112.26.2.1.40367 > 112.26.2.8.39713: Flags [.], seq 22849:24277, ack 1, win 4017, options [nop,nop,TS val 62604 ecr 4294816282,mptcp dss ack 3380555454 seq 2130091110 subseq 22849 len 1428 csum 0x316a], length 1428
21:13:02.785274 IP 112.26.2.1.40367 > 112.26.2.8.39713: Flags [.], seq 11425:12853, ack 1, win 4017, options [nop,nop,TS val 61987 ecr 4294815749,mptcp dss ack 3380555454 seq 2130062550 subseq 11425 len 1428 csum 0xb3b3], length 1428
21:13:02.790288 IP 112.26.2.1.40367 > 112.26.2.8.39713: Flags [.], seq 11425:12853, ack 1, win 4017, options [nop,nop,TS val 61987 ecr 4294815749,mptcp dss ack 3380555454 seq 2130062550 subseq 11425 len 1428 csum 0xb3b3], length 1428
21:13:02.830998 IP 112.26.2.1.40367 > 112.26.2.8.39713: Flags [.], seq 24277:25705, ack 1, win 4017, options [nop,nop,TS val 62852 ecr 4294816440,mptcp dss ack 3380555454 seq 2130099678 subseq 24277 len 1428 csum 0x5fa9], length 1428
21:13:02.875449 IP 112.26.2.1.40367 > 112.26.2.8.39713: Flags [.], seq 12853:14281, ack 1, win 4017, options [nop,nop,TS val 61987 ecr 4294815749,mptcp dss ack 3380555454 seq 2130063978 subseq 12853 len 1428 csum 0xbe64], length 1428
21:13:02.885737 IP 112.26.2.1.40367 > 112.26.2.8.39713: Flags [.], seq 25705:27133, ack 1, win 4017, options [nop,nop,TS val 62852 ecr 4294816440,mptcp dss ack 3380555454 seq 2130101106 subseq 25705 len 1428 csum 0xdff2], length 1428
21:13:02.904920 IP 112.26.2.1.40367 > 112.26.2.8.39713: Flags [.], seq 12853:14281, ack 1, win 4017, options [nop,nop,TS val 61987 ecr 4294815749,mptcp dss ack 3380555454 seq 2130063978 subseq 12853 len 1428 csum 0xbe64], length 1428
21:13:02.971925 IP 112.26.2.8.39713 > 112.26.2.1.40367: Flags [.], ack 8569, win 2236, options [nop,nop,TS val 4294816543 ecr 61987,mptcp dss ack 2130022566], length 0
21:13:02.977118 IP 112.26.2.1.40367 > 112.26.2.8.39713: Flags [.], seq 27133:28561, ack 1, win 4017, options [nop,nop,TS val 63118 ecr 4294816543,mptcp dss ack 3380555454 seq 2130111102 subseq 27133 len 1428 csum 0xd15e], length 1428
21:13:03.045384 IP 112.26.2.1.40367 > 112.26.2.8.39713: Flags [.], seq 28561:29989, ack 1, win 4017, options [nop,nop,TS val 63118 ecr 4294816543,mptcp dss ack 3380555454 seq 2130112530 subseq 28561 len 1428 csum 0x7c45], length 1428
21:13:03.049958 IP 112.26.2.1.40367 > 112.26.2.8.39713: Flags [.], seq 14281:15709, ack 1, win 4017, options [nop,nop,TS val 61987 ecr 4294815749,mptcp dss ack 3380555454 seq 2130065406 subseq 14281 len 1428 csum 0x178c], length 1428
21:13:03.070406 IP 112.26.2.1.40367 > 112.26.2.8.39713: Flags [.], seq 14281:15709, ack 1, win 4017, options [nop,nop,TS val 61987 ecr 4294815749,mptcp dss ack 3380555454 seq 2130065406 subseq 14281 len 1428 csum 0x178c], length 1428
21:13:03.122417 IP 112.26.2.8.39713 > 112.26.2.1.40367: Flags [.], ack 9997, win 2259, options [nop,nop,TS val 4294816628 ecr 61987,mptcp dss ack 2130022566], length 0
21:13:03.140182 IP 112.26.2.1.40367 > 112.26.2.8.39713: Flags [.], seq 29989:31417, ack 1, win 4017, options [nop,nop,TS val 63269 ecr 4294816628,mptcp dss ack 3380555454 seq 2130116814 subseq 29989 len 1428 csum 0xa09], length 1428
21:13:03.169320 IP 112.26.2.1.40367 > 112.26.2.8.39713: Flags [.], seq 31417:32845, ack 1, win 4017, options [nop,nop,TS val 63269 ecr 4294816628,mptcp dss ack 3380555454 seq 2130118242 subseq 31417 len 1428 csum 0x8359], length 1428
21:13:03.209433 IP 112.26.2.1.40367 > 112.26.2.8.39713: Flags [.], seq 17137:18565, ack 1, win 4017, options [nop,nop,TS val 62069 ecr 4294815912,mptcp dss ack 3380555454 seq 2130071118 subseq 17137 len 1428 csum 0xacac], length 1428
21:13:03.212968 IP 112.26.2.1.40367 > 112.26.2.8.39713: Flags [.], seq 17137:18565, ack 1, win 4017, options [nop,nop,TS val 62069 ecr 4294815912,mptcp dss ack 3380555454 seq 2130071118 subseq 17137 len 1428 csum 0xacac], length 1428
21:13:03.289755 IP 112.26.2.1.40367 > 112.26.2.8.39713: Flags [.], seq 19993:21421, ack 1, win 4017, options [nop,nop,TS val 62311 ecr 4294816021,mptcp dss ack 3380555454 seq 2130076830 subseq 19993 len 1428 csum 0xc400], length 1428
21:13:03.292333 IP 112.26.2.1.40367 > 112.26.2.8.39713: Flags [.], seq 19993:21421, ack 1, win 4017, options [nop,nop,TS val 62311 ecr 4294816021,mptcp dss ack 3380555454 seq 2130076830 subseq 19993 len 1428 csum 0xc400], length 1428
21:13:03.376015 IP 112.26.2.8.39713 > 112.26.2.1.40367: Flags [.], ack 11425, win 2419, options [nop,nop,TS val 4294816858 ecr 61987,mptcp dss ack 2130026850], length 0
21:13:03.380117 IP 112.26.2.1.40367 > 112.26.2.8.39713: Flags [.], seq 32845:34273, ack 1, win 4017, options [nop,nop,TS val 63522 ecr 4294816858,mptcp dss ack 3380555454 seq 2130133950 subseq 32845 len 1428 csum 0x26fe], length 1428
21:13:03.446741 IP 112.26.2.1.40367 > 112.26.2.8.39713: Flags [.], seq 22849:24277, ack 1, win 4017, options [nop,nop,TS val 62604 ecr 4294816282,mptcp dss ack 3380555454 seq 2130091110 subseq 22849 len 1428 csum 0x316a], length 1428
21:13:03.449559 IP 112.26.2.1.40367 > 112.26.2.8.39713: Flags [.], seq 22849:24277, ack 1, win 4017, options [nop,nop,TS val 62604 ecr 4294816282,mptcp dss ack 3380555454 seq 2130091110 subseq 22849 len 1428 csum 0x316a], length 1428
21:13:03.483556 IP 112.26.2.1.40367 > 112.26.2.8.39713: Flags [.], seq 34273:35701, ack 1, win 4017, options [nop,nop,TS val 63522 ecr 4294816858,mptcp dss ack 3380555454 seq 2130135378 subseq 34273 len 1428 csum 0xc2e6], length 1428
21:13:03.623835 IP 112.26.2.1.40367 > 112.26.2.8.39713: Flags [.], seq 25705:27133, ack 1, win 4017, options [nop,nop,TS val 62852 ecr 4294816440,mptcp dss ack 3380555454 seq 2130101106 subseq 25705 len 1428 csum 0xdff2], length 1428
21:13:03.628808 IP 112.26.2.1.40367 > 112.26.2.8.39713: Flags [.], seq 25705:27133, ack 1, win 4017, options [nop,nop,TS val 62852 ecr 4294816440,mptcp dss ack 3380555454 seq 2130101106 subseq 25705 len 1428 csum 0xdff2], length 1428
21:13:03.708102 IP 112.26.2.8.39713 > 112.26.2.1.40367: Flags [.], ack 14281, win 2601, options [nop,nop,TS val 4294817124 ecr 61987,mptcp dss ack 2130029706], length 0
21:13:03.711091 IP 112.26.2.1.40367 > 112.26.2.8.39713: Flags [.], seq 35701:37129, ack 1, win 4017, options [nop,nop,TS val 63854 ecr 4294817124,mptcp dss ack 3380555454 seq 2130149658 subseq 35701 len 1428 csum 0x18ba], length 1428
21:13:03.755143 IP 112.26.2.1.40367 > 112.26.2.8.39713: Flags [.], seq 28561:29989, ack 1, win 4017, options [nop,nop,TS val 63118 ecr 4294816543,mptcp dss ack 3380555454 seq 2130112530 subseq 28561 len 1428 csum 0x7c45], length 1428
21:13:03.759074 IP 112.26.2.1.40367 > 112.26.2.8.39713: Flags [.], seq 28561:29989, ack 1, win 4017, options [nop,nop,TS val 63118 ecr 4294816543,mptcp dss ack 3380555454 seq 2130112530 subseq 28561 len 1428 csum 0x7c45], length 1428
21:13:03.809733 IP 112.26.2.1.40367 > 112.26.2.8.39713: Flags [.], seq 37129:38557, ack 1, win 4017, options [nop,nop,TS val 63854 ecr 4294817124,mptcp dss ack 3380555454 seq 2130151086 subseq 37129 len 1428 csum 0xd327], length 1428
21:13:03.852516 IP 112.26.2.1.40367 > 112.26.2.8.39713: Flags [.], seq 29989:31417, ack 1, win 4017, options [nop,nop,TS val 63269 ecr 4294816628,mptcp dss ack 3380555454 seq 2130116814 subseq 29989 len 1428 csum 0xa09], length 1428
21:13:03.863609 IP 112.26.2.1.40367 > 112.26.2.8.39713: Flags [.], seq 29989:31417, ack 1, win 4017, options [nop,nop,TS val 63269 ecr 4294816628,mptcp dss ack 3380555454 seq 2130116814 subseq 29989 len 1428 csum 0xa09], length 1428
21:13:03.902749 IP 112.26.2.1.40367 > 112.26.2.8.39713: Flags [.], seq 38557:39985, ack 1, win 4017, options [nop,nop,TS val 63854 ecr 4294817124,mptcp dss ack 3380555454 seq 2130152514 subseq 38557 len 1428 csum 0x5dc3], length 1428
21:13:03.947854 IP 112.26.2.8.39713 > 112.26.2.1.40367: Flags [.], ack 15709, win 2761, options [nop,nop,TS val 4294817432 ecr 61987,nop,nop,sack 1 {17137:18565},mptcp dss ack 2130046842], length 0
21:13:03.969191 IP 112.26.2.1.40367 > 112.26.2.8.39713: Flags [.], seq 39985:41413, ack 1, win 4017, options [nop,nop,TS val 63854 ecr 4294817124,mptcp dss ack 3380555454 seq 2130153942 subseq 39985 len 1428 csum 0x3ba9], length 1428
21:13:04.006374 IP 112.26.2.1.40367 > 112.26.2.8.39713: Flags [.], seq 41413:42841, ack 1, win 4017, options [nop,nop,TS val 64094 ecr 4294817432,mptcp dss ack 3380555454 seq 2130162510 subseq 41413 len 1428 csum 0x1352], length 1428
21:13:04.024106 IP 112.26.2.8.39713 > 112.26.2.1.40367: Flags [.], ack 15709, win 2829, options [nop,nop,TS val 4294817515 ecr 61987,nop,nop,sack 2 {19993:21421}{17137:18565},mptcp dss ack 2130046842], length 0
21:13:04.057430 IP 112.26.2.1.40367 > 112.26.2.8.39713: Flags [.], seq 42841:44269, ack 1, win 4017, options [nop,nop,TS val 64094 ecr 4294817432,mptcp dss ack 3380555454 seq 2130163938 subseq 42841 len 1428 csum 0xafa7], length 1428
21:13:04.114556 IP 112.26.2.1.40367 > 112.26.2.8.39713: Flags [.], seq 32845:34273, ack 1, win 4017, options [nop,nop,TS val 63522 ecr 4294816858,mptcp dss ack 3380555454 seq 2130133950 subseq 32845 len 1428 csum 0x26fe], length 1428
21:13:04.117111 IP 112.26.2.1.40367 > 112.26.2.8.39713: Flags [.], seq 32845:34273, ack 1, win 4017, options [nop,nop,TS val 63522 ecr 4294816858,mptcp dss ack 3380555454 seq 2130133950 subseq 32845 len 1428 csum 0x26fe], length 1428
21:13:04.162628 IP 112.26.2.1.40367 > 112.26.2.8.39713: Flags [.], seq 44269:45697, ack 1, win 4017, options [nop,nop,TS val 64094 ecr 4294817432,mptcp dss ack 3380555454 seq 2130165366 subseq 44269 len 1428 csum 0x8a57], length 1428
21:13:04.235746 IP 112.26.2.1.40367 > 112.26.2.8.39713: Flags [.], seq 45697:47125, ack 1, win 4017, options [nop,nop,TS val 64094 ecr 4294817432,mptcp dss ack 3380555454 seq 2130166794 subseq 45697 len 1428 csum 0x8e4a], length 1428
21:13:04.237445 IP 112.26.2.1.40367 > 112.26.2.8.39713: Flags [.], seq 34273:35701, ack 1, win 4017, options [nop,nop,TS val 63522 ecr 4294816858,mptcp dss ack 3380555454 seq 2130135378 subseq 34273 len 1428 csum 0xc2e6], length 1428
21:13:04.254730 IP 112.26.2.1.40367 > 112.26.2.8.39713: Flags [.], seq 34273:35701, ack 1, win 4017, options [nop,nop,TS val 63522 ecr 4294816858,mptcp dss ack 3380555454 seq 2130135378 subseq 34273 len 1428 csum 0xc2e6], length 1428
21:13:04.303796 IP 112.26.2.1.40367 > 112.26.2.8.39713: Flags [.], seq 15709:17137, ack 1, win 4017, options [nop,nop,TS val 64170 ecr 4294817515,mptcp dss ack 3380555454 seq 2130069690 subseq 15709 len 1428 csum 0xfa23], length 1428
21:13:04.343207 IP 112.26.2.8.39713 > 112.26.2.1.40367: Flags [.], ack 15709, win 3012, options [nop,nop,TS val 4294817847 ecr 61987,nop,nop,sack 2 {25705:27133}{22849:24277},mptcp dss ack 2130046842], length 0
21:13:04.397705 IP 112.26.2.1.40367 > 112.26.2.8.39713: Flags [.], seq 18565:19993, ack 1, win 4017, options [nop,nop,TS val 64489 ecr 4294817847,mptcp dss ack 3380555454 seq 2130075402 subseq 18565 len 1428 csum 0xcd92], length 1428
21:13:04.404103 IP 112.26.2.1.40367 > 112.26.2.8.39713: Flags [.], seq 35701:37129, ack 1, win 4017, options [nop,nop,TS val 63854 ecr 4294817124,mptcp dss ack 3380555454 seq 2130149658 subseq 35701 len 1428 csum 0x18ba], length 1428
21:13:04.414896 IP 112.26.2.1.40367 > 112.26.2.8.39713: Flags [.], seq 35701:37129, ack 1, win 4017, options [nop,nop,TS val 63854 ecr 4294817124,mptcp dss ack 3380555454 seq 2130149658 subseq 35701 len 1428 csum 0x18ba], length 1428
21:13:04.495668 IP 112.26.2.8.39713 > 112.26.2.1.40367: Flags [.], ack 15709, win 3057, options [nop,nop,TS val 4294817978 ecr 61987,nop,nop,sack 2 {28561:29989}{25705:27133},mptcp dss ack 2130046842], length 0
21:13:04.499053 IP 112.26.2.1.40367 > 112.26.2.8.39713: Flags [.], seq 21421:22849, ack 1, win 4017, options [nop,nop,TS val 64642 ecr 4294817978,mptcp dss ack 3380555454 seq 2130089682 subseq 21421 len 1428 csum 0x9991], length 1428
21:13:04.572040 IP 112.26.2.8.39713 > 112.26.2.1.40367: Flags [.], ack 15709, win 3126, options [nop,nop,TS val 4294818082 ecr 61987,nop,nop,sack 2 {28561:31417}{25705:27133},mptcp dss ack 2130046842], length 0
21:13:04.619463 IP 112.26.2.1.40367 > 112.26.2.8.39713: Flags [.], seq 38557:39985, ack 1, win 4017, options [nop,nop,TS val 63854 ecr 4294817124,mptcp dss ack 3380555454 seq 2130152514 subseq 38557 len 1428 csum 0x5dc3], length 1428
21:13:04.622156 IP 112.26.2.1.40367 > 112.26.2.8.39713: Flags [.], seq 38557:39985, ack 1, win 4017, options [nop,nop,TS val 63854 ecr 4294817124,mptcp dss ack 3380555454 seq 2130152514 subseq 38557 len 1428 csum 0x5dc3], length 1428
21:13:04.716278 IP 112.26.2.1.40367 > 112.26.2.8.39713: Flags [.], seq 41413:42841, ack 1, win 4017, options [nop,nop,TS val 64094 ecr 4294817432,mptcp dss ack 3380555454 seq 2130162510 subseq 41413 len 1428 csum 0x1352], length 1428
21:13:04.726374 IP 112.26.2.1.40367 > 112.26.2.8.39713: Flags [.], seq 41413:42841, ack 1, win 4017, options [nop,nop,TS val 64094 ecr 4294817432,mptcp dss ack 3380555454 seq 2130162510 subseq 41413 len 1428 csum 0x1352], length 1428
21:13:04.861276 IP 112.26.2.1.40367 > 112.26.2.8.39713: Flags [.], seq 44269:45697, ack 1, win 4017, options [nop,nop,TS val 64094 ecr 4294817432,mptcp dss ack 3380555454 seq 2130165366 subseq 44269 len 1428 csum 0x8a57], length 1428
21:13:04.865632 IP 112.26.2.1.40367 > 112.26.2.8.39713: Flags [.], seq 44269:45697, ack 1, win 4017, options [nop,nop,TS val 64094 ecr 4294817432,mptcp dss ack 3380555454 seq 2130165366 subseq 44269 len 1428 csum 0x8a57], length 1428
21:13:04.962561 IP 112.26.2.1.40367 > 112.26.2.8.39713: Flags [.], seq 15709:17137, ack 1, win 4017, options [nop,nop,TS val 64170 ecr 4294817515,mptcp dss ack 3380555454 seq 2130069690 subseq 15709 len 1428 csum 0xfa23], length 1428
21:13:04.969448 IP 112.26.2.1.40367 > 112.26.2.8.39713: Flags [.], seq 15709:17137, ack 1, win 4017, options [nop,nop,TS val 64170 ecr 4294817515,mptcp dss ack 3380555454 seq 2130069690 subseq 15709 len 1428 csum 0xfa23], length 1428
21:13:05.033633 IP 112.26.2.1.40367 > 112.26.2.8.39713: Flags [.], seq 18565:19993, ack 1, win 4017, options [nop,nop,TS val 64489 ecr 4294817847,mptcp dss ack 3380555454 seq 2130075402 subseq 18565 len 1428 csum 0xcd92], length 1428
21:13:05.055621 IP 112.26.2.1.40367 > 112.26.2.8.39713: Flags [.], seq 18565:19993, ack 1, win 4017, options [nop,nop,TS val 64489 ecr 4294817847,mptcp dss ack 3380555454 seq 2130075402 subseq 18565 len 1428 csum 0xcd92], length 1428
21:13:05.146847 IP 112.26.2.1.40367 > 112.26.2.8.39713: Flags [.], seq 21421:22849, ack 1, win 4017, options [nop,nop,TS val 64642 ecr 4294817978,mptcp dss ack 3380555454 seq 2130089682 subseq 21421 len 1428 csum 0x9991], length 1428
21:13:05.159898 IP 112.26.2.1.40367 > 112.26.2.8.39713: Flags [.], seq 21421:22849, ack 1, win 4017, options [nop,nop,TS val 64642 ecr 4294817978,mptcp dss ack 3380555454 seq 2130089682 subseq 21421 len 1428 csum 0x9991], length 1428
21:13:05.257081 IP 112.26.2.8.39713 > 112.26.2.1.40367: Flags [.], ack 15709, win 3582, options [nop,nop,TS val 4294818841 ecr 61987,nop,nop,sack 2 {38557:39985}{32845:37129},mptcp dss ack 2130069690], length 0
21:13:05.261131 IP 112.26.2.1.40367 > 112.26.2.8.39713: Flags [.], seq 24277:25705, ack 1, win 4017, options [nop,nop,TS val 65403 ecr 4294818841,mptcp dss ack 3380555454 seq 2130099678 subseq 24277 len 1428 csum 0x5fa9], length 1428
21:13:05.301688 IP 112.26.2.1.40367 > 112.26.2.8.39713: Flags [.], seq 27133:28561, ack 1, win 4017, options [nop,nop,TS val 65403 ecr 4294818841,mptcp dss ack 3380555454 seq 2130111102 subseq 27133 len 1428 csum 0xd15e], length 1428
21:13:05.346332 IP 112.26.2.8.39713 > 112.26.2.1.40367: Flags [.], ack 15709, win 3628, options [nop,nop,TS val 4294818937 ecr 61987,nop,nop,sack 2 {41413:42841}{38557:39985},mptcp dss ack 2130069690], length 0
21:13:05.364030 IP 112.26.2.1.40367 > 112.26.2.8.39713: Flags [.], seq 31417:32845, ack 1, win 4017, options [nop,nop,TS val 65403 ecr 4294818841,mptcp dss ack 3380555454 seq 2130118242 subseq 31417 len 1428 csum 0x8359], length 1428
21:13:05.428891 IP 112.26.2.8.39713 > 112.26.2.1.40367: Flags [.], ack 15709, win 3742, options [nop,nop,TS val 4294819084 ecr 61987,nop,nop,sack 2 {44269:45697}{41413:42841},mptcp dss ack 2130069690], length 0
21:13:05.438289 IP 112.26.2.1.40367 > 112.26.2.8.39713: Flags [.], seq 37129:38557, ack 1, win 4017, options [nop,nop,TS val 65403 ecr 4294818841,mptcp dss ack 3380555454 seq 2130151086 subseq 37129 len 1428 csum 0xd327], length 1428
21:13:05.467356 IP 112.26.2.1.40367 > 112.26.2.8.39713: Flags [.], seq 39985:41413, ack 1, win 4017, options [nop,nop,TS val 65492 ecr 4294818937,mptcp dss ack 3380555454 seq 2130153942 subseq 39985 len 1428 csum 0x3ba9], length 1428
21:13:05.509743 IP 112.26.2.8.39713 > 112.26.2.1.40367: Flags [.], ack 18565, win 3810, options [nop,nop,TS val 4294819188 ecr 64170,nop,nop,sack 2 {44269:45697}{41413:42841},mptcp dss ack 2130075402], length 0
21:13:05.533931 IP 112.26.2.1.40367 > 112.26.2.8.39713: Flags [.], seq 42841:44269, ack 1, win 4017, options [nop,nop,TS val 65575 ecr 4294819084,mptcp dss ack 3380555454 seq 2130163938 subseq 42841 len 1428 csum 0xafa7], length 1428
21:13:05.574424 IP 112.26.2.8.39713 > 112.26.2.1.40367: Flags [.], ack 21421, win 3879, options [nop,nop,TS val 4294819274 ecr 64489,nop,nop,sack 2 {44269:45697}{41413:42841},mptcp dss ack 2130086826], length 0
21:13:05.608072 IP 112.26.2.1.40367 > 112.26.2.8.39713: Flags [.], seq 45697:47125, ack 1, win 4017, options [nop,nop,TS val 65655 ecr 4294819188,mptcp dss ack 3380555454 seq 2130166794 subseq 45697 len 1428 csum 0x8e4a], length 1428
21:13:05.631509 IP 112.26.2.8.39713 > 112.26.2.1.40367: Flags [.], ack 24277, win 3901, options [nop,nop,TS val 4294819370 ecr 64642,nop,nop,sack 2 {44269:45697}{41413:42841},mptcp dss ack 2130086826], length 0
21:13:05.672307 IP 112.26.2.1.40367 > 112.26.2.8.39713: Flags [.], seq 47125:48553, ack 1, win 4017, options [nop,nop,TS val 65655 ecr 4294819188,mptcp dss ack 3380555454 seq 2130201066 subseq 47125 len 1428 csum 0x2057], length 1428
21:13:05.705980 IP 112.26.2.1.40367 > 112.26.2.8.39713: Flags [.], seq 24277:25705, ack 1, win 4017, options [nop,nop,TS val 65403 ecr 4294818841,mptcp dss ack 3380555454 seq 2130099678 subseq 24277 len 1428 csum 0x5fa9], length 1428
21:13:05.708521 IP 112.26.2.1.40367 > 112.26.2.8.39713: Flags [.], seq 24277:25705, ack 1, win 4017, options [nop,nop,TS val 65403 ecr 4294818841,mptcp dss ack 3380555454 seq 2130099678 subseq 24277 len 1428 csum 0x5fa9], length 1428
21:13:05.732015 IP 112.26.2.1.40367 > 112.26.2.8.39713: Flags [.], seq 48553:49981, ack 1, win 4017, options [nop,nop,TS val 65655 ecr 4294819188,mptcp dss ack 3380555454 seq 2130202494 subseq 48553 len 1428 csum 0x2771], length 1428
21:13:05.785333 IP 112.26.2.1.40367 > 112.26.2.8.39713: Flags [.], seq 27133:28561, ack 1, win 4017, options [nop,nop,TS val 65403 ecr 4294818841,mptcp dss ack 3380555454 seq 2130111102 subseq 27133 len 1428 csum 0xd15e], length 1428
21:13:05.823580 IP 112.26.2.1.40367 > 112.26.2.8.39713: Flags [.], seq 27133:28561, ack 1, win 4017, options [nop,nop,TS val 65403 ecr 4294818841,mptcp dss ack 3380555454 seq 2130111102 subseq 27133 len 1428 csum 0xd15e], length 1428
21:13:05.846117 IP 112.26.2.1.40367 > 112.26.2.8.39713: Flags [.], seq 49981:51409, ack 1, win 4017, options [nop,nop,TS val 65655 ecr 4294819188,mptcp dss ack 3380555454 seq 2130203922 subseq 49981 len 1428 csum 0xcbc2], length 1428
21:13:05.909015 IP 112.26.2.1.40367 > 112.26.2.8.39713: Flags [.], seq 31417:32845, ack 1, win 4017, options [nop,nop,TS val 65403 ecr 4294818841,mptcp dss ack 3380555454 seq 2130118242 subseq 31417 len 1428 csum 0x8359], length 1428
21:13:05.921212 IP 112.26.2.1.40367 > 112.26.2.8.39713: Flags [.], seq 31417:32845, ack 1, win 4017, options [nop,nop,TS val 65403 ecr 4294818841,mptcp dss ack 3380555454 seq 2130118242 subseq 31417 len 1428 csum 0x8359], length 1428
21:13:05.943115 IP 112.26.2.1.40367 > 112.26.2.8.39713: Flags [.], seq 51409:52837, ack 1, win 4017, options [nop,nop,TS val 65720 ecr 4294819274,mptcp dss ack 3380555454 seq 2130208206 subseq 51409 len 1428 csum 0x212d], length 1428
21:13:05.993049 IP 112.26.2.1.40367 > 112.26.2.8.39713: Flags [.], seq 52837:54265, ack 1, win 4017, options [nop,nop,TS val 65720 ecr 4294819274,mptcp dss ack 3380555454 seq 2130209634 subseq 52837 len 1428 csum 0x8d3c], length 1428
21:13:06.035055 IP 112.26.2.1.40367 > 112.26.2.8.39713: Flags [.], seq 37129:38557, ack 1, win 4017, options [nop,nop,TS val 65403 ecr 4294818841,mptcp dss ack 3380555454 seq 2130151086 subseq 37129 len 1428 csum 0xd327], length 1428
21:13:06.037635 IP 112.26.2.1.40367 > 112.26.2.8.39713: Flags [.], seq 37129:38557, ack 1, win 4017, options [nop,nop,TS val 65403 ecr 4294818841,mptcp dss ack 3380555454 seq 2130151086 subseq 37129 len 1428 csum 0xd327], length 1428
21:13:06.048664 IP 112.26.2.1.40367 > 112.26.2.8.39713: Flags [.], seq 54265:55693, ack 1, win 4017, options [nop,nop,TS val 65777 ecr 4294819370,mptcp dss ack 3380555454 seq 2130212490 subseq 54265 len 1428 csum 0x9bef], length 1428
21:13:06.154345 IP 112.26.2.1.40367 > 112.26.2.8.39713: Flags [.], seq 39985:41413, ack 1, win 4017, options [nop,nop,TS val 65492 ecr 4294818937,mptcp dss ack 3380555454 seq 2130153942 subseq 39985 len 1428 csum 0x3ba9], length 1428
21:13:06.157586 IP 112.26.2.1.40367 > 112.26.2.8.39713: Flags [.], seq 39985:41413, ack 1, win 4017, options [nop,nop,TS val 65492 ecr 4294818937,mptcp dss ack 3380555454 seq 2130153942 subseq 39985 len 1428 csum 0x3ba9], length 1428
21:13:06.230035 IP 112.26.2.1.40367 > 112.26.2.8.39713: Flags [.], seq 42841:44269, ack 1, win 4017, options [nop,nop,TS val 65575 ecr 4294819084,mptcp dss ack 3380555454 seq 2130163938 subseq 42841 len 1428 csum 0xafa7], length 1428
21:13:06.235394 IP 112.26.2.1.40367 > 112.26.2.8.39713: Flags [.], seq 42841:44269, ack 1, win 4017, options [nop,nop,TS val 65575 ecr 4294819084,mptcp dss ack 3380555454 seq 2130163938 subseq 42841 len 1428 csum 0xafa7], length 1428
21:13:06.325036 IP 112.26.2.1.40367 > 112.26.2.8.39713: Flags [.], seq 45697:47125, ack 1, win 4017, options [nop,nop,TS val 65655 ecr 4294819188,mptcp dss ack 3380555454 seq 2130166794 subseq 45697 len 1428 csum 0x8e4a], length 1428
21:13:06.341671 IP 112.26.2.1.40367 > 112.26.2.8.39713: Flags [.], seq 45697:47125, ack 1, win 4017, options [nop,nop,TS val 65655 ecr 4294819188,mptcp dss ack 3380555454 seq 2130166794 subseq 45697 len 1428 csum 0x8e4a], length 1428
21:13:06.428003 IP 112.26.2.1.40367 > 112.26.2.8.39713: Flags [.], seq 47125:48553, ack 1, win 4017, options [nop,nop,TS val 65655 ecr 4294819188,mptcp dss ack 3380555454 seq 2130201066 subseq 47125 len 1428 csum 0x2057], length 1428
21:13:06.468249 IP 112.26.2.1.40367 > 112.26.2.8.39713: Flags [.], seq 47125:48553, ack 1, win 4017, options [nop,nop,TS val 65655 ecr 4294819188,mptcp dss ack 3380555454 seq 2130201066 subseq 47125 len 1428 csum 0x2057], length 1428
21:13:06.500441 IP 112.26.2.1.40367 > 112.26.2.8.39713: Flags [.], seq 48553:49981, ack 1, win 4017, options [nop,nop,TS val 65655 ecr 4294819188,mptcp dss ack 3380555454 seq 2130202494 subseq 48553 len 1428 csum 0x2771], length 1428
21:13:06.550522 IP 112.26.2.8.39713 > 112.26.2.1.40367: Flags [.], ack 31417, win 4312, options [nop,nop,TS val 4294820043 ecr 65403,nop,nop,sack 2 {44269:45697}{41413:42841},mptcp dss ack 2130103962], length 0
21:13:06.553522 IP 112.26.2.1.40367 > 112.26.2.8.39713: Flags [.], seq 55693:57121, ack 1, win 4017, options [nop,nop,TS val 66696 ecr 4294820043,mptcp dss ack 3380555454 seq 2130238194 subseq 55693 len 1428 csum 0x7f15], length 1428
21:13:06.592052 IP 112.26.2.1.40367 > 112.26.2.8.39713: Flags [.], seq 48553:49981, ack 1, win 4017, options [nop,nop,TS val 65655 ecr 4294819188,mptcp dss ack 3380555454 seq 2130202494 subseq 48553 len 1428 csum 0x2771], length 1428
21:13:06.636033 IP 112.26.2.8.39713 > 112.26.2.1.40367: Flags [.], ack 37129, win 4380, options [nop,nop,TS val 4294820130 ecr 65403,nop,nop,sack 2 {44269:45697}{41413:42841},mptcp dss ack 2130131094], length 0
21:13:06.645575 IP 112.26.2.1.40367 > 112.26.2.8.39713: Flags [.], seq 57121:58549, ack 1, win 4017, options [nop,nop,TS val 66696 ecr 4294820043,mptcp dss ack 3380555454 seq 2130239622 subseq 57121 len 1428 csum 0xc66f], length 1428
21:13:06.679496 IP 112.26.2.1.40367 > 112.26.2.8.39713: Flags [.], seq 51409:52837, ack 1, win 4017, options [nop,nop,TS val 65720 ecr 4294819274,mptcp dss ack 3380555454 seq 2130208206 subseq 51409 len 1428 csum 0x212d], length 1428
21:13:06.683288 IP 112.26.2.1.40367 > 112.26.2.8.39713: Flags [.], seq 51409:52837, ack 1, win 4017, options [nop,nop,TS val 65720 ecr 4294819274,mptcp dss ack 3380555454 seq 2130208206 subseq 51409 len 1428 csum 0x212d], length 1428
21:13:06.744423 IP 112.26.2.1.40367 > 112.26.2.8.39713: Flags [.], seq 58549:59977, ack 1, win 4017, options [nop,nop,TS val 66782 ecr 4294820130,mptcp dss ack 3380555454 seq 2130241050 subseq 58549 len 1428 csum 0xdaeb], length 1428
21:13:06.800117 IP 112.26.2.8.39713 > 112.26.2.1.40367: Flags [.], ack 39985, win 4472, options [nop,nop,TS val 4294820256 ecr 65403,nop,nop,sack 2 {44269:45697}{41413:42841},mptcp dss ack 2130148230], length 0
21:13:06.828338 IP 112.26.2.1.40367 > 112.26.2.8.39713: Flags [.], seq 59977:61405, ack 1, win 4017, options [nop,nop,TS val 66946 ecr 4294820256,mptcp dss ack 3380555454 seq 2130251046 subseq 59977 len 1428 csum 0xc1df], length 1428
21:13:06.846225 IP 112.26.2.8.39713 > 112.26.2.1.40367: Flags [.], ack 42841, win 4540, options [nop,nop,TS val 4294820376 ecr 65492,nop,nop,sack 1 {44269:45697},mptcp dss ack 2130148230], length 0
21:13:06.890999 IP 112.26.2.8.39713 > 112.26.2.1.40367: Flags [.], ack 45697, win 4586, options [nop,nop,TS val 4294820454 ecr 65575,mptcp dss ack 2130148230], length 0
21:13:06.904920 IP 112.26.2.1.40367 > 112.26.2.8.39713: Flags [.], seq 61405:62833, ack 1, win 4017, options [nop,nop,TS val 66993 ecr 4294820376,mptcp dss ack 3380555454 seq 2130252474 subseq 61405 len 1428 csum 0xcab4], length 1428
21:13:06.945135 IP 112.26.2.8.39713 > 112.26.2.1.40367: Flags [.], ack 47125, win 4654, options [nop,nop,TS val 4294820560 ecr 65655,mptcp dss ack 2130148230], length 0
21:13:06.971834 IP 112.26.2.1.40367 > 112.26.2.8.39713: Flags [.], seq 62833:64261, ack 1, win 4017, options [nop,nop,TS val 67037 ecr 4294820454,mptcp dss ack 3380555454 seq 2130255330 subseq 62833 len 1428 csum 0x2035], length 1428
21:13:06.976390 IP 112.26.2.8.39713 > 112.26.2.1.40367: Flags [.], ack 48553, win 4768, options [nop,nop,TS val 4294820687 ecr 65655,mptcp dss ack 2130148230], length 0
21:13:07.023891 IP 112.26.2.1.40367 > 112.26.2.8.39713: Flags [.], seq 64261:65689, ack 1, win 4017, options [nop,nop,TS val 67037 ecr 4294820454,mptcp dss ack 3380555454 seq 2130256758 subseq 64261 len 1428 csum 0x9180], length 1428
21:13:07.059036 IP 112.26.2.1.40367 > 112.26.2.8.39713: Flags [.], seq 55693:57121, ack 1, win 4017, options [nop,nop,TS val 66696 ecr 4294820043,mptcp dss ack 3380555454 seq 2130238194 subseq 55693 len 1428 csum 0x7f15], length 1428
21:13:07.062237 IP 112.26.2.1.40367 > 112.26.2.8.39713: Flags [.], seq 55693:57121, ack 1, win 4017, options [nop,nop,TS val 66696 ecr 4294820043,mptcp dss ack 3380555454 seq 2130238194 subseq 55693 len 1428 csum 0x7f15], length 1428
21:13:07.100955 IP 112.26.2.1.40367 > 112.26.2.8.39713: Flags [.], seq 65689:67117, ack 1, win 4017, options [nop,nop,TS val 67091 ecr 4294820560,mptcp dss ack 3380555454 seq 2130258186 subseq 65689 len 1428 csum 0xec95], length 1428
21:13:07.174418 IP 112.26.2.8.39713 > 112.26.2.1.40367: Flags [.], ack 49981, win 4814, options [nop,nop,TS val 4294820811 ecr 65655,mptcp dss ack 2130148230], length 0
21:13:07.191908 IP 112.26.2.1.40367 > 112.26.2.8.39713: Flags [.], seq 67117:68545, ack 1, win 4017, options [nop,nop,TS val 67123 ecr 4294820687,mptcp dss ack 3380555454 seq 2130261042 subseq 67117 len 1428 csum 0x7c9c], length 1428
21:13:07.225796 IP 112.26.2.1.40367 > 112.26.2.8.39713: Flags [.], seq 57121:58549, ack 1, win 4017, options [nop,nop,TS val 66696 ecr 4294820043,mptcp dss ack 3380555454 seq 2130239622 subseq 57121 len 1428 csum 0xc66f], length 1428
21:13:07.244690 IP 112.26.2.1.40367 > 112.26.2.8.39713: Flags [.], seq 57121:58549, ack 1, win 4017, options [nop,nop,TS val 66696 ecr 4294820043,mptcp dss ack 3380555454 seq 2130239622 subseq 57121 len 1428 csum 0xc66f], length 1428
21:13:07.257848 IP 112.26.2.1.40367 > 112.26.2.8.39713: Flags [.], seq 68545:69973, ack 1, win 4017, options [nop,nop,TS val 67321 ecr 4294820811,mptcp dss ack 3380555454 seq 2130265326 subseq 68545 len 1428 csum 0x13c6], length 1428
21:13:07.321269 IP 112.26.2.1.40367 > 112.26.2.8.39713: Flags [.], seq 69973:71401, ack 1, win 4017, options [nop,nop,TS val 67321 ecr 4294820811,mptcp dss ack 3380555454 seq 2130266754 subseq 69973 len 1428 csum 0xa103], length 1428
21:13:07.380722 IP 112.26.2.1.40367 > 112.26.2.8.39713: Flags [.], seq 58549:59977, ack 1, win 4017, options [nop,nop,TS val 66782 ecr 4294820130,mptcp dss ack 3380555454 seq 2130241050 subseq 58549 len 1428 csum 0xdaeb], length 1428
21:13:07.383355 IP 112.26.2.1.40367 > 112.26.2.8.39713: Flags [.], seq 58549:59977, ack 1, win 4017, options [nop,nop,TS val 66782 ecr 4294820130,mptcp dss ack 3380555454 seq 2130241050 subseq 58549 len 1428 csum 0xdaeb], length 1428
21:13:07.461878 IP 112.26.2.8.39713 > 112.26.2.1.40367: Flags [.], ack 49981, win 4882, options [nop,nop,TS val 4294820902 ecr 65655,nop,nop,sack 1 {51409:52837},mptcp dss ack 2130148230], length 0
21:13:07.518546 IP 112.26.2.1.40367 > 112.26.2.8.39713: Flags [.], seq 59977:61405, ack 1, win 4017, options [nop,nop,TS val 66946 ecr 4294820256,mptcp dss ack 3380555454 seq 2130251046 subseq 59977 len 1428 csum 0xc1df], length 1428
21:13:07.534065 IP 112.26.2.1.40367 > 112.26.2.8.39713: Flags [.], seq 71401:72829, ack 1, win 4017, options [nop,nop,TS val 67660 ecr 4294820902,mptcp dss ack 3380555454 seq 2130273894 subseq 71401 len 1428 csum 0xf321], length 1428
