21:12:56.215885 IP 112.26.0.8.52644 > 112.26.0.1.40367: Flags [S], seq 1762923967, win 29200, options [mss 1460,sackOK,TS val 4294808243 ecr 0,nop,wscale 7,mptcp capable csum {0x1f312c6106806263}], length 0
21:12:56.316242 IP 112.26.0.8.52644 > 112.26.0.1.40367: Flags [S], seq 1762923967, win 29200, options [mss 1460,sackOK,TS val 4294808243 ecr 0,nop,wscale 7,mptcp capable csum {0x1f312c6106806263}], length 0
21:12:56.331145 IP 112.26.0.8.52644 > 112.26.0.1.40367: Flags [S], seq 1762923967, win 29200, options [mss 1460,sackOK,TS val 4294808243 ecr 0,nop,wscale 7,mptcp capable csum {0x1f312c6106806263}], length 0
21:12:56.435401 IP 112.26.0.1.40367 > 112.26.0.8.52644: Flags [S.], seq 1210547265, ack 1762923968, win 65535, options [mss 1460,sackOK,TS val 56479 ecr 4294808243,nop,wscale 6,mptcp capable csum {0x182a048e31f8618d}], length 0
21:12:56.435695 IP 112.26.0.1.40367 > 112.26.0.8.52644: Flags [S.], seq 1210547265, ack 1762923968, win 65535, options [mss 1460,sackOK,TS val 56479 ecr 4294808243,nop,wscale 6,mptcp capable csum {0x182a048e31f8618d}], length 0
21:12:56.535876 IP 112.26.0.8.52644 > 112.26.0.1.40367: Flags [.], ack 1, win 229, options [nop,nop,TS val 4294810743 ecr 56479,mptcp capable csum {0x1f312c6106806263,0x182a048e31f8618d},mptcp dss ack 2129958494], length 0
21:12:56.536277 IP 112.26.0.8.52644 > 112.26.0.1.40367: Flags [.], ack 1, win 229, options [nop,nop,TS val 4294810743 ecr 56479,mptcp capable csum {0x1f312c6106806263,0x182a048e31f8618d},mptcp dss ack 2129958494], length 0
21:12:56.617122 IP 112.26.0.8.52644 > 112.26.0.1.40367: Flags [.], ack 1, win 229, options [nop,nop,TS val 4294810743 ecr 56479,mptcp add-addr id 3 112.26.1.8,mptcp dss ack 2129958494], length 0
21:12:56.617519 IP 112.26.0.8.52644 > 112.26.0.1.40367: Flags [.], ack 1, win 229, options [nop,nop,TS val 4294810743 ecr 56479,mptcp add-addr id 3 112.26.1.8,mptcp dss ack 2129958494], length 0
21:12:56.624017 IP 112.26.0.8.52644 > 112.26.0.1.40367: Flags [.], ack 1, win 229, options [nop,nop,TS val 4294810743 ecr 56479,mptcp add-addr id 4 112.26.2.8,mptcp dss ack 2129958494], length 0
21:12:56.624325 IP 112.26.0.8.52644 > 112.26.0.1.40367: Flags [.], ack 1, win 229, options [nop,nop,TS val 4294810743 ecr 56479,mptcp add-addr id 4 112.26.2.8,mptcp dss ack 2129958494], length 0
21:12:56.631876 IP 112.26.0.8.52644 > 112.26.0.1.40367: Flags [.], ack 1, win 229, options [nop,nop,TS val 4294810743 ecr 56479,mptcp add-addr id 6 112.26.3.8,mptcp dss ack 2129958494], length 0
21:12:56.632209 IP 112.26.0.8.52644 > 112.26.0.1.40367: Flags [.], ack 1, win 229, options [nop,nop,TS val 4294810743 ecr 56479,mptcp add-addr id 6 112.26.3.8,mptcp dss ack 2129958494], length 0
21:12:56.642320 IP 112.26.0.8.52644 > 112.26.0.1.40367: Flags [.], ack 1, win 229, options [nop,nop,TS val 4294810743 ecr 56479,mptcp capable csum {0x1f312c6106806263,0x182a048e31f8618d},mptcp dss ack 2129958494], length 0
21:12:56.738770 IP 112.26.0.1.40367 > 112.26.0.8.52644: Flags [.], ack 1, win 1339, options [nop,nop,TS val 56786 ecr 4294810743,mptcp add-addr id 3 112.26.1.1,mptcp dss ack 3380555454], length 0
21:12:56.739125 IP 112.26.0.1.40367 > 112.26.0.8.52644: Flags [.], ack 1, win 1339, options [nop,nop,TS val 56786 ecr 4294810743,mptcp add-addr id 3 112.26.1.1,mptcp dss ack 3380555454], length 0
21:12:56.851596 IP 112.26.0.1.40367 > 112.26.0.8.52644: Flags [.], ack 1, win 1339, options [nop,nop,TS val 56786 ecr 4294810743,mptcp add-addr id 4 112.26.2.1,mptcp dss ack 3380555454], length 0
21:12:56.851860 IP 112.26.0.1.40367 > 112.26.0.8.52644: Flags [.], ack 1, win 1339, options [nop,nop,TS val 56786 ecr 4294810743,mptcp add-addr id 4 112.26.2.1,mptcp dss ack 3380555454], length 0
21:12:56.929048 IP 112.26.0.8.52644 > 112.26.0.1.40367: Flags [.], ack 1, win 229, options [nop,nop,TS val 4294810743 ecr 56479,mptcp add-addr id 3 112.26.1.8,mptcp dss ack 2129958494], length 0
21:12:56.947700 IP 112.26.0.1.40367 > 112.26.0.8.52644: Flags [.], ack 1, win 1339, options [nop,nop,TS val 56786 ecr 4294810743,mptcp add-addr id 5 112.26.3.1,mptcp dss ack 3380555454], length 0
21:12:56.947997 IP 112.26.0.1.40367 > 112.26.0.8.52644: Flags [.], ack 1, win 1339, options [nop,nop,TS val 56786 ecr 4294810743,mptcp add-addr id 5 112.26.3.1,mptcp dss ack 3380555454], length 0
21:12:57.027739 IP 112.26.0.8.52644 > 112.26.0.1.40367: Flags [.], ack 1, win 229, options [nop,nop,TS val 4294810743 ecr 56479,mptcp add-addr id 4 112.26.2.8,mptcp dss ack 2129958494], length 0
21:12:57.123198 IP 112.26.0.1.40367 > 112.26.0.8.52644: Flags [.], seq 1:1429, ack 1, win 1339, options [nop,nop,TS val 56797 ecr 4294810743,mptcp dss ack 3380555454 seq 2129958494 subseq 1 len 1428 csum 0x9d1], length 1428
21:12:57.123546 IP 112.26.0.1.40367 > 112.26.0.8.52644: Flags [.], seq 1:1429, ack 1, win 1339, options [nop,nop,TS val 56797 ecr 4294810743,mptcp dss ack 3380555454 seq 2129958494 subseq 1 len 1428 csum 0x9d1], length 1428
21:12:57.133671 IP 112.26.0.8.52644 > 112.26.0.1.40367: Flags [.], ack 1429, win 251, options [nop,nop,TS val 4294811345 ecr 56797,mptcp dss ack 2129959922], length 0
21:12:57.133994 IP 112.26.0.8.52644 > 112.26.0.1.40367: Flags [.], ack 1429, win 251, options [nop,nop,TS val 4294811345 ecr 56797,mptcp dss ack 2129959922], length 0
21:12:57.142756 IP 112.26.0.8.52644 > 112.26.0.1.40367: Flags [.], ack 1, win 229, options [nop,nop,TS val 4294810743 ecr 56479,mptcp add-addr id 6 112.26.3.8,mptcp dss ack 2129958494], length 0
21:12:57.227682 IP 112.26.0.1.40367 > 112.26.0.8.52644: Flags [.], seq 1429:2857, ack 1, win 1339, options [nop,nop,TS val 56797 ecr 4294810743,mptcp dss ack 3380555454 seq 2129959922 subseq 1429 len 1428 csum 0x291f], length 1428
21:12:57.228000 IP 112.26.0.1.40367 > 112.26.0.8.52644: Flags [.], seq 1429:2857, ack 1, win 1339, options [nop,nop,TS val 56797 ecr 4294810743,mptcp dss ack 3380555454 seq 2129959922 subseq 1429 len 1428 csum 0x291f], length 1428
21:12:57.239249 IP 112.26.0.1.40367 > 112.26.0.8.52644: Flags [P.], seq 2857:4097, ack 1, win 1339, options [nop,nop,TS val 56798 ecr 4294810743,mptcp dss ack 3380555454 seq 2129961350 subseq 2857 len 1240 csum 0x69f1], length 1240
21:12:57.239516 IP 112.26.0.1.40367 > 112.26.0.8.52644: Flags [P.], seq 2857:4097, ack 1, win 1339, options [nop,nop,TS val 56798 ecr 4294810743,mptcp dss ack 3380555454 seq 2129961350 subseq 2857 len 1240 csum 0x69f1], length 1240
21:12:57.251748 IP 112.26.0.8.52644 > 112.26.0.1.40367: Flags [.], ack 2857, win 274, options [nop,nop,TS val 4294811470 ecr 56797,mptcp dss ack 2129961350], length 0
21:12:57.252032 IP 112.26.0.8.52644 > 112.26.0.1.40367: Flags [.], ack 2857, win 274, options [nop,nop,TS val 4294811470 ecr 56797,mptcp dss ack 2129961350], length 0
21:12:57.336663 IP 112.26.0.8.52644 > 112.26.0.1.40367: Flags [.], ack 4097, win 297, options [nop,nop,TS val 4294811546 ecr 56798,mptcp dss ack 2129962590], length 0
21:12:57.336926 IP 112.26.0.8.52644 > 112.26.0.1.40367: Flags [.], ack 4097, win 297, options [nop,nop,TS val 4294811546 ecr 56798,mptcp dss ack 2129962590], length 0
21:12:57.344702 IP 112.26.0.1.40367 > 112.26.0.8.52644: Flags [.], seq 4097:5525, ack 1, win 1339, options [nop,nop,TS val 56798 ecr 4294810743,mptcp dss ack 3380555454 seq 2129962590 subseq 4097 len 1428 csum 0x5e2a], length 1428
21:12:57.344962 IP 112.26.0.1.40367 > 112.26.0.8.52644: Flags [.], seq 4097:5525, ack 1, win 1339, options [nop,nop,TS val 56798 ecr 4294810743,mptcp dss ack 3380555454 seq 2129962590 subseq 4097 len 1428 csum 0x5e2a], length 1428
21:12:57.435530 IP 112.26.0.1.40367 > 112.26.0.8.52644: Flags [.], seq 5525:6953, ack 1, win 1339, options [nop,nop,TS val 56798 ecr 4294810743,mptcp dss ack 3380555454 seq 2129964018 subseq 5525 len 1428 csum 0xba9f], length 1428
21:12:57.435833 IP 112.26.0.1.40367 > 112.26.0.8.52644: Flags [.], seq 5525:6953, ack 1, win 1339, options [nop,nop,TS val 56798 ecr 4294810743,mptcp dss ack 3380555454 seq 2129964018 subseq 5525 len 1428 csum 0xba9f], length 1428
21:12:57.445298 IP 112.26.0.1.40367 > 112.26.0.8.52644: Flags [.], seq 6953:8381, ack 1, win 1339, options [nop,nop,TS val 56798 ecr 4294810743,mptcp dss ack 3380555454 seq 2129965446 subseq 6953 len 1428 csum 0x546c], length 1428
21:12:57.445601 IP 112.26.0.1.40367 > 112.26.0.8.52644: Flags [.], seq 6953:8381, ack 1, win 1339, options [nop,nop,TS val 56798 ecr 4294810743,mptcp dss ack 3380555454 seq 2129965446 subseq 6953 len 1428 csum 0x546c], length 1428
21:12:57.451894 IP 112.26.0.8.52644 > 112.26.0.1.40367: Flags [.], ack 5525, win 320, options [nop,nop,TS val 4294811669 ecr 56798,mptcp dss ack 2129964018], length 0
21:12:57.452209 IP 112.26.0.8.52644 > 112.26.0.1.40367: Flags [.], ack 5525, win 320, options [nop,nop,TS val 4294811669 ecr 56798,mptcp dss ack 2129964018], length 0
21:12:57.539678 IP 112.26.0.1.40367 > 112.26.0.8.52644: Flags [.], seq 8381:9809, ack 1, win 1339, options [nop,nop,TS val 56798 ecr 4294810743,mptcp dss ack 3380555454 seq 2129966874 subseq 8381 len 1428 csum 0x23fe], length 1428
21:12:57.539924 IP 112.26.0.1.40367 > 112.26.0.8.52644: Flags [.], seq 8381:9809, ack 1, win 1339, options [nop,nop,TS val 56798 ecr 4294810743,mptcp dss ack 3380555454 seq 2129966874 subseq 8381 len 1428 csum 0x23fe], length 1428
21:12:57.540595 IP 112.26.0.8.52644 > 112.26.0.1.40367: Flags [.], ack 6953, win 343, options [nop,nop,TS val 4294811751 ecr 56798,mptcp dss ack 2129965446], length 0
21:12:57.540988 IP 112.26.0.8.52644 > 112.26.0.1.40367: Flags [.], ack 6953, win 343, options [nop,nop,TS val 4294811751 ecr 56798,mptcp dss ack 2129965446], length 0
21:12:57.549274 IP 112.26.0.1.40367 > 112.26.0.8.52644: Flags [.], seq 9809:11237, ack 1, win 1339, options [nop,nop,TS val 56798 ecr 4294810743,mptcp dss ack 3380555454 seq 2129968302 subseq 9809 len 1428 csum 0x1c6a], length 1428
21:12:57.549557 IP 112.26.0.1.40367 > 112.26.0.8.52644: Flags [.], seq 9809:11237, ack 1, win 1339, options [nop,nop,TS val 56798 ecr 4294810743,mptcp dss ack 3380555454 seq 2129968302 subseq 9809 len 1428 csum 0x1c6a], length 1428
21:12:57.553225 IP 112.26.0.8.52644 > 112.26.0.1.40367: Flags [.], ack 8381, win 365, options [nop,nop,TS val 4294811770 ecr 56798,mptcp dss ack 2129966874], length 0
21:12:57.553472 IP 112.26.0.8.52644 > 112.26.0.1.40367: Flags [.], ack 8381, win 365, options [nop,nop,TS val 4294811770 ecr 56798,mptcp dss ack 2129966874], length 0
21:12:57.635600 IP 112.26.0.8.52644 > 112.26.0.1.40367: Flags [.], ack 1429, win 251, options [nop,nop,TS val 4294811345 ecr 56797,mptcp dss ack 2129959922], length 0
21:12:57.651827 IP 112.26.0.1.40367 > 112.26.0.8.52644: Flags [.], seq 11237:12665, ack 1, win 1339, options [nop,nop,TS val 56798 ecr 4294810743,mptcp dss ack 3380555454 seq 2129969730 subseq 11237 len 1428 csum 0x4bf0], length 1428
21:12:57.652116 IP 112.26.0.1.40367 > 112.26.0.8.52644: Flags [.], seq 11237:12665, ack 1, win 1339, options [nop,nop,TS val 56798 ecr 4294810743,mptcp dss ack 3380555454 seq 2129969730 subseq 11237 len 1428 csum 0x4bf0], length 1428
21:12:57.726422 IP 112.26.0.8.52644 > 112.26.0.1.40367: Flags [.], ack 9809, win 388, options [nop,nop,TS val 4294811943 ecr 56798,mptcp dss ack 2129968302], length 0
21:12:57.726755 IP 112.26.0.8.52644 > 112.26.0.1.40367: Flags [.], ack 9809, win 388, options [nop,nop,TS val 4294811943 ecr 56798,mptcp dss ack 2129968302], length 0
21:12:57.746868 IP 112.26.0.8.52644 > 112.26.0.1.40367: Flags [.], ack 2857, win 274, options [nop,nop,TS val 4294811470 ecr 56797,mptcp dss ack 2129961350], length 0
21:12:57.856411 IP 112.26.0.8.52644 > 112.26.0.1.40367: Flags [.], ack 11237, win 411, options [nop,nop,TS val 4294812074 ecr 56798,mptcp dss ack 2129969730], length 0
21:12:57.856703 IP 112.26.0.8.52644 > 112.26.0.1.40367: Flags [.], ack 11237, win 411, options [nop,nop,TS val 4294812074 ecr 56798,mptcp dss ack 2129969730], length 0
21:12:57.863750 IP 112.26.0.8.52644 > 112.26.0.1.40367: Flags [.], ack 4097, win 297, options [nop,nop,TS val 4294811546 ecr 56798,mptcp dss ack 2129962590], length 0
21:12:57.947506 IP 112.26.0.8.52644 > 112.26.0.1.40367: Flags [.], ack 12665, win 434, options [nop,nop,TS val 4294812165 ecr 56798,mptcp dss ack 2129971158], length 0
21:12:57.947759 IP 112.26.0.8.52644 > 112.26.0.1.40367: Flags [.], ack 12665, win 434, options [nop,nop,TS val 4294812165 ecr 56798,mptcp dss ack 2129971158], length 0
21:12:58.030216 IP 112.26.0.1.40367 > 112.26.0.8.52644: Flags [.], seq 12665:14093, ack 1, win 1339, options [nop,nop,TS val 57728 ecr 4294810743,mptcp dss ack 3380555454 seq 2129971158 subseq 12665 len 1428 csum 0x8ded], length 1428
21:12:58.030563 IP 112.26.0.1.40367 > 112.26.0.8.52644: Flags [.], seq 12665:14093, ack 1, win 1339, options [nop,nop,TS val 57728 ecr 4294810743,mptcp dss ack 3380555454 seq 2129971158 subseq 12665 len 1428 csum 0x8ded], length 1428
21:12:58.043547 IP 112.26.0.8.52644 > 112.26.0.1.40367: Flags [.], ack 5525, win 320, options [nop,nop,TS val 4294811669 ecr 56798,mptcp dss ack 2129964018], length 0
21:12:58.136980 IP 112.26.0.8.52644 > 112.26.0.1.40367: Flags [.], ack 14093, win 457, options [nop,nop,TS val 4294812352 ecr 57728,mptcp dss ack 2129972586], length 0
21:12:58.137273 IP 112.26.0.8.52644 > 112.26.0.1.40367: Flags [.], ack 14093, win 457, options [nop,nop,TS val 4294812352 ecr 57728,mptcp dss ack 2129972586], length 0
21:12:58.138295 IP 112.26.0.1.40367 > 112.26.0.8.52644: Flags [.], seq 14093:15521, ack 1, win 1339, options [nop,nop,TS val 57781 ecr 4294811345,mptcp dss ack 3380555454 seq 2129972586 subseq 14093 len 1428 csum 0xe086], length 1428
21:12:58.138605 IP 112.26.0.1.40367 > 112.26.0.8.52644: Flags [.], seq 14093:15521, ack 1, win 1339, options [nop,nop,TS val 57781 ecr 4294811345,mptcp dss ack 3380555454 seq 2129972586 subseq 14093 len 1428 csum 0xe086], length 1428
21:12:58.160309 IP 112.26.0.1.40367 > 112.26.0.8.52644: Flags [.], seq 15521:16949, ack 1, win 1339, options [nop,nop,TS val 57781 ecr 4294811345,mptcp dss ack 3380555454 seq 2129974014 subseq 15521 len 1428 csum 0x4be2], length 1428
21:12:58.160626 IP 112.26.0.1.40367 > 112.26.0.8.52644: Flags [.], seq 15521:16949, ack 1, win 1339, options [nop,nop,TS val 57781 ecr 4294811345,mptcp dss ack 3380555454 seq 2129974014 subseq 15521 len 1428 csum 0x4be2], length 1428
21:12:58.239049 IP 112.26.0.8.52644 > 112.26.0.1.40367: Flags [.], ack 15521, win 480, options [nop,nop,TS val 4294812456 ecr 57781,mptcp dss ack 2129974014], length 0
21:12:58.239454 IP 112.26.0.8.52644 > 112.26.0.1.40367: Flags [.], ack 15521, win 480, options [nop,nop,TS val 4294812456 ecr 57781,mptcp dss ack 2129974014], length 0
21:12:58.247440 IP 112.26.0.1.40367 > 112.26.0.8.52644: Flags [.], seq 16949:18377, ack 1, win 1339, options [nop,nop,TS val 57893 ecr 4294811470,mptcp dss ack 3380555454 seq 2129975442 subseq 16949 len 1428 csum 0x3536], length 1428
21:12:58.247738 IP 112.26.0.1.40367 > 112.26.0.8.52644: Flags [.], seq 16949:18377, ack 1, win 1339, options [nop,nop,TS val 57893 ecr 4294811470,mptcp dss ack 3380555454 seq 2129975442 subseq 16949 len 1428 csum 0x3536], length 1428
21:12:58.258843 IP 112.26.0.8.52644 > 112.26.0.1.40367: Flags [.], ack 16949, win 502, options [nop,nop,TS val 4294812476 ecr 57781,mptcp dss ack 2129975442], length 0
21:12:58.259142 IP 112.26.0.8.52644 > 112.26.0.1.40367: Flags [.], ack 16949, win 502, options [nop,nop,TS val 4294812476 ecr 57781,mptcp dss ack 2129975442], length 0
21:12:58.267050 IP 112.26.0.8.52644 > 112.26.0.1.40367: Flags [.], ack 6953, win 343, options [nop,nop,TS val 4294811751 ecr 56798,mptcp dss ack 2129965446], length 0
21:12:58.348707 IP 112.26.0.1.40367 > 112.26.0.8.52644: Flags [.], seq 19805:21233, ack 1, win 1339, options [nop,nop,TS val 58009 ecr 4294811546,mptcp dss ack 3380555454 seq 2129978298 subseq 19805 len 1428 csum 0xfe23], length 1428
21:12:58.349007 IP 112.26.0.1.40367 > 112.26.0.8.52644: Flags [.], seq 19805:21233, ack 1, win 1339, options [nop,nop,TS val 58009 ecr 4294811546,mptcp dss ack 3380555454 seq 2129978298 subseq 19805 len 1428 csum 0xfe23], length 1428
21:12:58.363665 IP 112.26.0.8.52644 > 112.26.0.1.40367: Flags [.], ack 8381, win 365, options [nop,nop,TS val 4294811770 ecr 56798,mptcp dss ack 2129966874], length 0
21:12:58.373705 IP 112.26.0.8.52644 > 112.26.0.1.40367: Flags [.], ack 18377, win 525, options [nop,nop,TS val 4294812591 ecr 57893,mptcp dss ack 2129976870], length 0
21:12:58.373960 IP 112.26.0.8.52644 > 112.26.0.1.40367: Flags [.], ack 18377, win 525, options [nop,nop,TS val 4294812591 ecr 57893,mptcp dss ack 2129976870], length 0
21:12:58.444242 IP 112.26.0.8.52644 > 112.26.0.1.40367: Flags [.], ack 9809, win 388, options [nop,nop,TS val 4294811943 ecr 56798,mptcp dss ack 2129968302], length 0
21:12:58.459754 IP 112.26.0.8.52644 > 112.26.0.1.40367: Flags [.], ack 18377, win 548, options [nop,nop,TS val 4294812677 ecr 57893,nop,nop,sack 1 {19805:21233},mptcp dss ack 2129976870], length 0
21:12:58.460044 IP 112.26.0.8.52644 > 112.26.0.1.40367: Flags [.], ack 18377, win 548, options [nop,nop,TS val 4294812677 ecr 57893,nop,nop,sack 1 {19805:21233},mptcp dss ack 2129976870], length 0
21:12:58.532492 IP 112.26.0.8.52644 > 112.26.0.1.40367: Flags [.], ack 11237, win 411, options [nop,nop,TS val 4294812074 ecr 56798,mptcp dss ack 2129969730], length 0
21:12:58.548827 IP 112.26.0.1.40367 > 112.26.0.8.52644: Flags [.], seq 22661:24089, ack 1, win 1339, options [nop,nop,TS val 58190 ecr 4294811669,mptcp dss ack 3380555454 seq 2129981154 subseq 22661 len 1428 csum 0xa3be], length 1428
21:12:58.549068 IP 112.26.0.1.40367 > 112.26.0.8.52644: Flags [.], seq 22661:24089, ack 1, win 1339, options [nop,nop,TS val 58190 ecr 4294811669,mptcp dss ack 3380555454 seq 2129981154 subseq 22661 len 1428 csum 0xa3be], length 1428
21:12:58.558320 IP 112.26.0.8.52644 > 112.26.0.1.40367: Flags [.], ack 12665, win 434, options [nop,nop,TS val 4294812165 ecr 56798,mptcp dss ack 2129971158], length 0
21:12:58.647294 IP 112.26.0.8.52644 > 112.26.0.1.40367: Flags [.], ack 14093, win 457, options [nop,nop,TS val 4294812352 ecr 57728,mptcp dss ack 2129972586], length 0
21:12:58.658473 IP 112.26.0.8.52644 > 112.26.0.1.40367: Flags [.], ack 18377, win 571, options [nop,nop,TS val 4294812876 ecr 57893,nop,nop,sack 2 {22661:24089}{19805:21233},mptcp dss ack 2129976870], length 0
21:12:58.658666 IP 112.26.0.8.52644 > 112.26.0.1.40367: Flags [.], ack 18377, win 571, options [nop,nop,TS val 4294812876 ecr 57893,nop,nop,sack 2 {22661:24089}{19805:21233},mptcp dss ack 2129976870], length 0
21:12:58.837801 IP 112.26.0.8.52644 > 112.26.0.1.40367: Flags [.], ack 15521, win 480, options [nop,nop,TS val 4294812456 ecr 57781,mptcp dss ack 2129974014], length 0
21:12:58.852712 IP 112.26.0.1.40367 > 112.26.0.8.52644: Flags [.], seq 28373:29801, ack 1, win 1339, options [nop,nop,TS val 58510 ecr 4294811770,mptcp dss ack 3380555454 seq 2129986866 subseq 28373 len 1428 csum 0xe7e4], length 1428
21:12:58.852991 IP 112.26.0.1.40367 > 112.26.0.8.52644: Flags [.], seq 28373:29801, ack 1, win 1339, options [nop,nop,TS val 58510 ecr 4294811770,mptcp dss ack 3380555454 seq 2129986866 subseq 28373 len 1428 csum 0xe7e4], length 1428
21:12:58.858661 IP 112.26.0.8.52644 > 112.26.0.1.40367: Flags [.], ack 18377, win 594, options [nop,nop,TS val 4294813073 ecr 57893,nop,nop,sack 2 {28373:29801}{22661:24089},mptcp dss ack 2129976870], length 0
21:12:58.858910 IP 112.26.0.8.52644 > 112.26.0.1.40367: Flags [.], ack 18377, win 594, options [nop,nop,TS val 4294813073 ecr 57893,nop,nop,sack 2 {28373:29801}{22661:24089},mptcp dss ack 2129976870], length 0
21:12:58.944469 IP 112.26.0.8.52644 > 112.26.0.1.40367: Flags [.], ack 16949, win 502, options [nop,nop,TS val 4294812476 ecr 57781,mptcp dss ack 2129975442], length 0
21:12:58.957376 IP 112.26.0.1.40367 > 112.26.0.8.52644: Flags [.], seq 31229:32657, ack 1, win 1339, options [nop,nop,TS val 58590 ecr 4294811943,mptcp dss ack 3380555454 seq 2129989722 subseq 31229 len 1428 csum 0xc6], length 1428
21:12:58.957693 IP 112.26.0.1.40367 > 112.26.0.8.52644: Flags [.], seq 31229:32657, ack 1, win 1339, options [nop,nop,TS val 58590 ecr 4294811943,mptcp dss ack 3380555454 seq 2129989722 subseq 31229 len 1428 csum 0xc6], length 1428
21:12:59.034706 IP 112.26.0.8.52644 > 112.26.0.1.40367: Flags [.], ack 18377, win 616, options [nop,nop,TS val 4294813250 ecr 57893,nop,nop,sack 2 {31229:32657}{28373:29801},mptcp dss ack 2129976870], length 0
21:12:59.034985 IP 112.26.0.8.52644 > 112.26.0.1.40367: Flags [.], ack 18377, win 616, options [nop,nop,TS val 4294813250 ecr 57893,nop,nop,sack 2 {31229:32657}{28373:29801},mptcp dss ack 2129976870], length 0
21:12:59.047932 IP 112.26.0.8.52644 > 112.26.0.1.40367: Flags [.], ack 18377, win 548, options [nop,nop,TS val 4294812677 ecr 57893,nop,nop,sack 1 {19805:21233},mptcp dss ack 2129976870], length 0
21:12:59.059853 IP 112.26.0.1.40367 > 112.26.0.8.52644: Flags [.], seq 34085:35513, ack 1, win 1339, options [nop,nop,TS val 58678 ecr 4294812074,mptcp dss ack 3380555454 seq 2129992578 subseq 34085 len 1428 csum 0x9d61], length 1428
21:12:59.060145 IP 112.26.0.1.40367 > 112.26.0.8.52644: Flags [.], seq 34085:35513, ack 1, win 1339, options [nop,nop,TS val 58678 ecr 4294812074,mptcp dss ack 3380555454 seq 2129992578 subseq 34085 len 1428 csum 0x9d61], length 1428
21:12:59.131558 IP 112.26.0.8.52644 > 112.26.0.1.40367: Flags [.], ack 18377, win 639, options [nop,nop,TS val 4294813280 ecr 57893,nop,nop,sack 2 {34085:35513}{31229:32657},mptcp dss ack 2129976870], length 0
21:12:59.131830 IP 112.26.0.8.52644 > 112.26.0.1.40367: Flags [.], ack 18377, win 639, options [nop,nop,TS val 4294813280 ecr 57893,nop,nop,sack 2 {34085:35513}{31229:32657},mptcp dss ack 2129976870], length 0
21:12:59.146634 IP 112.26.0.1.40367 > 112.26.0.8.52644: Flags [.], seq 35513:36941, ack 1, win 1339, options [nop,nop,TS val 58678 ecr 4294812074,mptcp dss ack 3380555454 seq 2129994006 subseq 35513 len 1428 csum 0x8a06], length 1428
21:12:59.146906 IP 112.26.0.1.40367 > 112.26.0.8.52644: Flags [.], seq 35513:36941, ack 1, win 1339, options [nop,nop,TS val 58678 ecr 4294812074,mptcp dss ack 3380555454 seq 2129994006 subseq 35513 len 1428 csum 0x8a06], length 1428
21:12:59.154531 IP 112.26.0.8.52644 > 112.26.0.1.40367: Flags [.], ack 18377, win 662, options [nop,nop,TS val 4294813372 ecr 57893,nop,nop,sack 2 {34085:36941}{31229:32657},mptcp dss ack 2129976870], length 0
21:12:59.154790 IP 112.26.0.8.52644 > 112.26.0.1.40367: Flags [.], ack 18377, win 662, options [nop,nop,TS val 4294813372 ecr 57893,nop,nop,sack 2 {34085:36941}{31229:32657},mptcp dss ack 2129976870], length 0
21:12:59.160806 IP 112.26.0.8.52644 > 112.26.0.1.40367: Flags [.], ack 18377, win 571, options [nop,nop,TS val 4294812876 ecr 57893,nop,nop,sack 2 {22661:24089}{19805:21233},mptcp dss ack 2129976870], length 0
21:12:59.252522 IP 112.26.0.1.40367 > 112.26.0.8.52644: Flags [.], seq 38369:39797, ack 1, win 1339, options [nop,nop,TS val 58704 ecr 4294812165,mptcp dss ack 3380555454 seq 2129996862 subseq 38369 len 1428 csum 0x687f], length 1428
21:12:59.252816 IP 112.26.0.1.40367 > 112.26.0.8.52644: Flags [.], seq 38369:39797, ack 1, win 1339, options [nop,nop,TS val 58704 ecr 4294812165,mptcp dss ack 3380555454 seq 2129996862 subseq 38369 len 1428 csum 0x687f], length 1428
21:12:59.271075 IP 112.26.0.8.52644 > 112.26.0.1.40367: Flags [.], ack 18377, win 594, options [nop,nop,TS val 4294813073 ecr 57893,nop,nop,sack 2 {28373:29801}{22661:24089},mptcp dss ack 2129976870], length 0
21:12:59.354535 IP 112.26.0.1.40367 > 112.26.0.8.52644: Flags [.], seq 39797:41225, ack 1, win 1339, options [nop,nop,TS val 58793 ecr 4294812352,mptcp dss ack 3380555454 seq 2129998290 subseq 39797 len 1428 csum 0x34e2], length 1428
21:12:59.354835 IP 112.26.0.1.40367 > 112.26.0.8.52644: Flags [.], seq 39797:41225, ack 1, win 1339, options [nop,nop,TS val 58793 ecr 4294812352,mptcp dss ack 3380555454 seq 2129998290 subseq 39797 len 1428 csum 0x34e2], length 1428
21:12:59.377529 IP 112.26.0.8.52644 > 112.26.0.1.40367: Flags [.], ack 18377, win 685, options [nop,nop,TS val 4294813563 ecr 57893,nop,nop,sack 2 {38369:39797}{34085:36941},mptcp dss ack 2129976870], length 0
21:12:59.377784 IP 112.26.0.8.52644 > 112.26.0.1.40367: Flags [.], ack 18377, win 685, options [nop,nop,TS val 4294813563 ecr 57893,nop,nop,sack 2 {38369:39797}{34085:36941},mptcp dss ack 2129976870], length 0
21:12:59.442654 IP 112.26.0.8.52644 > 112.26.0.1.40367: Flags [.], ack 18377, win 708, options [nop,nop,TS val 4294813586 ecr 57893,nop,nop,sack 2 {38369:41225}{34085:36941},mptcp dss ack 2129976870], length 0
21:12:59.442983 IP 112.26.0.8.52644 > 112.26.0.1.40367: Flags [.], ack 18377, win 708, options [nop,nop,TS val 4294813586 ecr 57893,nop,nop,sack 2 {38369:41225}{34085:36941},mptcp dss ack 2129976870], length 0
21:12:59.451754 IP 112.26.0.1.40367 > 112.26.0.8.52644: Flags [.], seq 41225:42653, ack 1, win 1339, options [nop,nop,TS val 58793 ecr 4294812352,mptcp dss ack 3380555454 seq 2129999718 subseq 41225 len 1428 csum 0x2e1b], length 1428
21:12:59.452051 IP 112.26.0.1.40367 > 112.26.0.8.52644: Flags [.], seq 41225:42653, ack 1, win 1339, options [nop,nop,TS val 58793 ecr 4294812352,mptcp dss ack 3380555454 seq 2129999718 subseq 41225 len 1428 csum 0x2e1b], length 1428
21:12:59.474677 IP 112.26.0.8.52644 > 112.26.0.1.40367: Flags [.], ack 18377, win 616, options [nop,nop,TS val 4294813250 ecr 57893,nop,nop,sack 2 {31229:32657}{28373:29801},mptcp dss ack 2129976870], length 0
21:12:59.543918 IP 112.26.0.8.52644 > 112.26.0.1.40367: Flags [.], ack 18377, win 639, options [nop,nop,TS val 4294813280 ecr 57893,nop,nop,sack 2 {34085:35513}{31229:32657},mptcp dss ack 2129976870], length 0
21:12:59.567182 IP 112.26.0.8.52644 > 112.26.0.1.40367: Flags [.], ack 18377, win 730, options [nop,nop,TS val 4294813775 ecr 57893,nop,nop,sack 2 {38369:42653}{34085:36941},mptcp dss ack 2129976870], length 0
21:12:59.567632 IP 112.26.0.8.52644 > 112.26.0.1.40367: Flags [.], ack 18377, win 730, options [nop,nop,TS val 4294813775 ecr 57893,nop,nop,sack 2 {38369:42653}{34085:36941},mptcp dss ack 2129976870], length 0
21:12:59.575657 IP 112.26.0.1.40367 > 112.26.0.8.52644: Flags [.], seq 18377:19805, ack 1, win 1339, options [nop,nop,TS val 59306 ecr 4294812876,mptcp dss ack 3380555454 seq 2129976870 subseq 18377 len 1428 csum 0x3e82], length 1428
21:12:59.575906 IP 112.26.0.1.40367 > 112.26.0.8.52644: Flags [.], seq 18377:19805, ack 1, win 1339, options [nop,nop,TS val 59306 ecr 4294812876,mptcp dss ack 3380555454 seq 2129976870 subseq 18377 len 1428 csum 0x3e82], length 1428
21:12:59.646384 IP 112.26.0.8.52644 > 112.26.0.1.40367: Flags [.], ack 18377, win 662, options [nop,nop,TS val 4294813372 ecr 57893,nop,nop,sack 2 {34085:36941}{31229:32657},mptcp dss ack 2129976870], length 0
21:12:59.664506 IP 112.26.0.8.52644 > 112.26.0.1.40367: Flags [.], ack 21233, win 753, options [nop,nop,TS val 4294813882 ecr 59306,nop,nop,sack 2 {38369:42653}{34085:36941},mptcp dss ack 2129979726], length 0
21:12:59.664788 IP 112.26.0.8.52644 > 112.26.0.1.40367: Flags [.], ack 21233, win 753, options [nop,nop,TS val 4294813882 ecr 59306,nop,nop,sack 2 {38369:42653}{34085:36941},mptcp dss ack 2129979726], length 0
21:12:59.757596 IP 112.26.0.8.52644 > 112.26.0.1.40367: Flags [.], ack 18377, win 685, options [nop,nop,TS val 4294813563 ecr 57893,nop,nop,sack 2 {38369:39797}{34085:36941},mptcp dss ack 2129976870], length 0
21:12:59.836245 IP 112.26.0.1.40367 > 112.26.0.8.52644: Flags [.], seq 21233:22661, ack 1, win 1339, options [nop,nop,TS val 59613 ecr 4294813250,mptcp dss ack 3380555454 seq 2129979726 subseq 21233 len 1428 csum 0x4724], length 1428
21:12:59.836603 IP 112.26.0.1.40367 > 112.26.0.8.52644: Flags [.], seq 21233:22661, ack 1, win 1339, options [nop,nop,TS val 59613 ecr 4294813250,mptcp dss ack 3380555454 seq 2129979726 subseq 21233 len 1428 csum 0x4724], length 1428
21:12:59.840249 IP 112.26.0.8.52644 > 112.26.0.1.40367: Flags [.], ack 24089, win 776, options [nop,nop,TS val 4294814057 ecr 59613,nop,nop,sack 2 {38369:42653}{34085:36941},mptcp dss ack 2129982582], length 0
21:12:59.840566 IP 112.26.0.8.52644 > 112.26.0.1.40367: Flags [.], ack 24089, win 776, options [nop,nop,TS val 4294814057 ecr 59613,nop,nop,sack 2 {38369:42653}{34085:36941},mptcp dss ack 2129982582], length 0
21:12:59.866462 IP 112.26.0.8.52644 > 112.26.0.1.40367: Flags [.], ack 18377, win 708, options [nop,nop,TS val 4294813586 ecr 57893,nop,nop,sack 2 {38369:41225}{34085:36941},mptcp dss ack 2129976870], length 0
21:13:00.040286 IP 112.26.0.1.40367 > 112.26.0.8.52644: Flags [.], seq 25517:26945, ack 1, win 1339, options [nop,nop,TS val 59792 ecr 4294813372,mptcp dss ack 3380555454 seq 2129984010 subseq 25517 len 1428 csum 0x558b], length 1428
21:13:00.040590 IP 112.26.0.1.40367 > 112.26.0.8.52644: Flags [.], seq 25517:26945, ack 1, win 1339, options [nop,nop,TS val 59792 ecr 4294813372,mptcp dss ack 3380555454 seq 2129984010 subseq 25517 len 1428 csum 0x558b], length 1428
21:13:00.044621 IP 112.26.0.8.52644 > 112.26.0.1.40367: Flags [.], ack 24089, win 799, options [nop,nop,TS val 4294814261 ecr 59613,nop,nop,sack 2 {25517:26945}{38369:42653},mptcp dss ack 2129982582], length 0
21:13:00.044924 IP 112.26.0.8.52644 > 112.26.0.1.40367: Flags [.], ack 24089, win 799, options [nop,nop,TS val 4294814261 ecr 59613,nop,nop,sack 2 {25517:26945}{38369:42653},mptcp dss ack 2129982582], length 0
21:13:00.056234 IP 112.26.0.8.52644 > 112.26.0.1.40367: Flags [.], ack 18377, win 730, options [nop,nop,TS val 4294813775 ecr 57893,nop,nop,sack 2 {38369:42653}{34085:36941},mptcp dss ack 2129976870], length 0
21:13:00.140899 IP 112.26.0.8.52644 > 112.26.0.1.40367: Flags [.], ack 21233, win 753, options [nop,nop,TS val 4294813882 ecr 59306,nop,nop,sack 2 {38369:42653}{34085:36941},mptcp dss ack 2129979726], length 0
21:13:00.157326 IP 112.26.0.1.40367 > 112.26.0.8.52644: Flags [.], seq 26945:28373, ack 1, win 1339, options [nop,nop,TS val 59903 ecr 4294813563,mptcp dss ack 3380555454 seq 2129985438 subseq 26945 len 1428 csum 0xdb87], length 1428
21:13:00.157634 IP 112.26.0.1.40367 > 112.26.0.8.52644: Flags [.], seq 26945:28373, ack 1, win 1339, options [nop,nop,TS val 59903 ecr 4294813563,mptcp dss ack 3380555454 seq 2129985438 subseq 26945 len 1428 csum 0xdb87], length 1428
21:13:00.163159 IP 112.26.0.8.52644 > 112.26.0.1.40367: Flags [.], ack 24089, win 822, options [nop,nop,TS val 4294814378 ecr 59613,nop,nop,sack 2 {25517:28373}{38369:42653},mptcp dss ack 2129982582], length 0
21:13:00.163418 IP 112.26.0.8.52644 > 112.26.0.1.40367: Flags [.], ack 24089, win 822, options [nop,nop,TS val 4294814378 ecr 59613,nop,nop,sack 2 {25517:28373}{38369:42653},mptcp dss ack 2129982582], length 0
21:13:00.270610 IP 112.26.0.8.52644 > 112.26.0.1.40367: Flags [.], ack 24089, win 776, options [nop,nop,TS val 4294814057 ecr 59613,nop,nop,sack 2 {38369:42653}{34085:36941},mptcp dss ack 2129982582], length 0
21:13:00.343605 IP 112.26.0.1.40367 > 112.26.0.8.52644: Flags [.], seq 29801:31229, ack 1, win 1339, options [nop,nop,TS val 60012 ecr 4294813586,mptcp dss ack 3380555454 seq 2129988294 subseq 29801 len 1428 csum 0xd86], length 1428
21:13:00.343905 IP 112.26.0.1.40367 > 112.26.0.8.52644: Flags [.], seq 29801:31229, ack 1, win 1339, options [nop,nop,TS val 60012 ecr 4294813586,mptcp dss ack 3380555454 seq 2129988294 subseq 29801 len 1428 csum 0xd86], length 1428
21:13:00.350714 IP 112.26.0.8.52644 > 112.26.0.1.40367: Flags [.], ack 24089, win 845, options [nop,nop,TS val 4294814565 ecr 59613,nop,nop,sack 2 {29801:32657}{25517:28373},mptcp dss ack 2129982582], length 0
21:13:00.351025 IP 112.26.0.8.52644 > 112.26.0.1.40367: Flags [.], ack 24089, win 845, options [nop,nop,TS val 4294814565 ecr 59613,nop,nop,sack 2 {29801:32657}{25517:28373},mptcp dss ack 2129982582], length 0
21:13:00.362562 IP 112.26.0.1.40367 > 112.26.0.8.52644: Flags [.], seq 32657:34085, ack 1, win 1339, options [nop,nop,TS val 60202 ecr 4294813775,mptcp dss ack 3380555454 seq 2129991150 subseq 32657 len 1428 csum 0x7c70], length 1428
21:13:00.362865 IP 112.26.0.1.40367 > 112.26.0.8.52644: Flags [.], seq 32657:34085, ack 1, win 1339, options [nop,nop,TS val 60202 ecr 4294813775,mptcp dss ack 3380555454 seq 2129991150 subseq 32657 len 1428 csum 0x7c70], length 1428
21:13:00.444507 IP 112.26.0.8.52644 > 112.26.0.1.40367: Flags [.], ack 24089, win 867, options [nop,nop,TS val 4294814661 ecr 59613,nop,nop,sack 2 {29801:36941}{25517:28373},mptcp dss ack 2129982582], length 0
21:13:00.444823 IP 112.26.0.8.52644 > 112.26.0.1.40367: Flags [.], ack 24089, win 867, options [nop,nop,TS val 4294814661 ecr 59613,nop,nop,sack 2 {29801:36941}{25517:28373},mptcp dss ack 2129982582], length 0
21:13:00.450979 IP 112.26.0.8.52644 > 112.26.0.1.40367: Flags [.], ack 24089, win 799, options [nop,nop,TS val 4294814261 ecr 59613,nop,nop,sack 2 {25517:26945}{38369:42653},mptcp dss ack 2129982582], length 0
21:13:00.468952 IP 112.26.0.1.40367 > 112.26.0.8.52644: Flags [.], seq 36941:38369, ack 1, win 1339, options [nop,nop,TS val 60286 ecr 4294813882,mptcp dss ack 3380555454 seq 2129995434 subseq 36941 len 1428 csum 0xe279], length 1428
21:13:00.469256 IP 112.26.0.1.40367 > 112.26.0.8.52644: Flags [.], seq 36941:38369, ack 1, win 1339, options [nop,nop,TS val 60286 ecr 4294813882,mptcp dss ack 3380555454 seq 2129995434 subseq 36941 len 1428 csum 0xe279], length 1428
21:13:00.553923 IP 112.26.0.8.52644 > 112.26.0.1.40367: Flags [.], ack 24089, win 890, options [nop,nop,TS val 4294814771 ecr 59613,nop,nop,sack 2 {29801:42653}{25517:28373},mptcp dss ack 2129982582], length 0
21:13:00.554260 IP 112.26.0.8.52644 > 112.26.0.1.40367: Flags [.], ack 24089, win 890, options [nop,nop,TS val 4294814771 ecr 59613,nop,nop,sack 2 {29801:42653}{25517:28373},mptcp dss ack 2129982582], length 0
21:13:00.561385 IP 112.26.0.1.40367 > 112.26.0.8.52644: Flags [.], seq 42653:44081, ack 1, win 1339, options [nop,nop,TS val 60286 ecr 4294813882,mptcp dss ack 3380555454 seq 2130001146 subseq 42653 len 1428 csum 0x4db9], length 1428
21:13:00.561653 IP 112.26.0.1.40367 > 112.26.0.8.52644: Flags [.], seq 42653:44081, ack 1, win 1339, options [nop,nop,TS val 60286 ecr 4294813882,mptcp dss ack 3380555454 seq 2130001146 subseq 42653 len 1428 csum 0x4db9], length 1428
21:13:00.643307 IP 112.26.0.1.40367 > 112.26.0.8.52644: Flags [.], seq 44081:45509, ack 1, win 1339, options [nop,nop,TS val 60286 ecr 4294813882,mptcp dss ack 3380555454 seq 2130002574 subseq 44081 len 1428 csum 0x3e5f], length 1428
21:13:00.643646 IP 112.26.0.1.40367 > 112.26.0.8.52644: Flags [.], seq 44081:45509, ack 1, win 1339, options [nop,nop,TS val 60286 ecr 4294813882,mptcp dss ack 3380555454 seq 2130002574 subseq 44081 len 1428 csum 0x3e5f], length 1428
21:13:00.651831 IP 112.26.0.8.52644 > 112.26.0.1.40367: Flags [.], ack 24089, win 822, options [nop,nop,TS val 4294814378 ecr 59613,nop,nop,sack 2 {25517:28373}{38369:42653},mptcp dss ack 2129982582], length 0
21:13:00.658153 IP 112.26.0.8.52644 > 112.26.0.1.40367: Flags [.], ack 24089, win 913, options [nop,nop,TS val 4294814875 ecr 59613,nop,nop,sack 2 {29801:44081}{25517:28373},mptcp dss ack 2129982582], length 0
21:13:00.658432 IP 112.26.0.8.52644 > 112.26.0.1.40367: Flags [.], ack 24089, win 913, options [nop,nop,TS val 4294814875 ecr 59613,nop,nop,sack 2 {29801:44081}{25517:28373},mptcp dss ack 2129982582], length 0
21:13:00.667365 IP 112.26.0.1.40367 > 112.26.0.8.52644: Flags [.], seq 45509:46937, ack 1, win 1339, options [nop,nop,TS val 60416 ecr 4294814057,mptcp dss ack 3380555454 seq 2130004002 subseq 45509 len 1428 csum 0xcc04], length 1428
21:13:00.667638 IP 112.26.0.1.40367 > 112.26.0.8.52644: Flags [.], seq 45509:46937, ack 1, win 1339, options [nop,nop,TS val 60416 ecr 4294814057,mptcp dss ack 3380555454 seq 2130004002 subseq 45509 len 1428 csum 0xcc04], length 1428
21:13:00.744582 IP 112.26.0.8.52644 > 112.26.0.1.40367: Flags [.], ack 24089, win 936, options [nop,nop,TS val 4294814960 ecr 59613,nop,nop,sack 2 {29801:45509}{25517:28373},mptcp dss ack 2129982582], length 0
21:13:00.744906 IP 112.26.0.8.52644 > 112.26.0.1.40367: Flags [.], ack 24089, win 936, options [nop,nop,TS val 4294814960 ecr 59613,nop,nop,sack 2 {29801:45509}{25517:28373},mptcp dss ack 2129982582], length 0
21:13:00.761037 IP 112.26.0.1.40367 > 112.26.0.8.52644: Flags [.], seq 46937:48365, ack 1, win 1339, options [nop,nop,TS val 60416 ecr 4294814057,mptcp dss ack 3380555454 seq 2130005430 subseq 46937 len 1428 csum 0x1a9e], length 1428
21:13:00.761342 IP 112.26.0.1.40367 > 112.26.0.8.52644: Flags [.], seq 46937:48365, ack 1, win 1339, options [nop,nop,TS val 60416 ecr 4294814057,mptcp dss ack 3380555454 seq 2130005430 subseq 46937 len 1428 csum 0x1a9e], length 1428
21:13:00.769851 IP 112.26.0.8.52644 > 112.26.0.1.40367: Flags [.], ack 24089, win 959, options [nop,nop,TS val 4294814988 ecr 59613,nop,nop,sack 2 {29801:46937}{25517:28373},mptcp dss ack 2129982582], length 0
21:13:00.770153 IP 112.26.0.8.52644 > 112.26.0.1.40367: Flags [.], ack 24089, win 959, options [nop,nop,TS val 4294814988 ecr 59613,nop,nop,sack 2 {29801:46937}{25517:28373},mptcp dss ack 2129982582], length 0
21:13:00.846896 IP 112.26.0.8.52644 > 112.26.0.1.40367: Flags [.], ack 24089, win 845, options [nop,nop,TS val 4294814565 ecr 59613,nop,nop,sack 2 {29801:32657}{25517:28373},mptcp dss ack 2129982582], length 0
21:13:00.866709 IP 112.26.0.1.40367 > 112.26.0.8.52644: Flags [.], seq 24089:25517, ack 1, win 1339, options [nop,nop,TS val 60597 ecr 4294814261,mptcp dss ack 3380555454 seq 2129982582 subseq 24089 len 1428 csum 0x3b8d], length 1428
21:13:00.866966 IP 112.26.0.1.40367 > 112.26.0.8.52644: Flags [.], seq 24089:25517, ack 1, win 1339, options [nop,nop,TS val 60597 ecr 4294814261,mptcp dss ack 3380555454 seq 2129982582 subseq 24089 len 1428 csum 0x3b8d], length 1428
21:13:00.870864 IP 112.26.0.8.52644 > 112.26.0.1.40367: Flags [.], ack 24089, win 981, options [nop,nop,TS val 4294815089 ecr 59613,nop,nop,sack 2 {29801:48365}{25517:28373},mptcp dss ack 2129982582], length 0
21:13:00.871188 IP 112.26.0.8.52644 > 112.26.0.1.40367: Flags [.], ack 24089, win 981, options [nop,nop,TS val 4294815089 ecr 59613,nop,nop,sack 2 {29801:48365}{25517:28373},mptcp dss ack 2129982582], length 0
21:13:00.949719 IP 112.26.0.8.52644 > 112.26.0.1.40367: Flags [.], ack 24089, win 867, options [nop,nop,TS val 4294814661 ecr 59613,nop,nop,sack 2 {29801:36941}{25517:28373},mptcp dss ack 2129982582], length 0
21:13:00.965158 IP 112.26.0.8.52644 > 112.26.0.1.40367: Flags [.], ack 48365, win 1004, options [nop,nop,TS val 4294815179 ecr 60597,mptcp dss ack 2130006858], length 0
21:13:00.965451 IP 112.26.0.8.52644 > 112.26.0.1.40367: Flags [.], ack 48365, win 1004, options [nop,nop,TS val 4294815179 ecr 60597,mptcp dss ack 2130006858], length 0
21:13:00.999772 IP 112.26.0.8.52644 > 112.26.0.1.40367: Flags [.], ack 24089, win 890, options [nop,nop,TS val 4294814771 ecr 59613,nop,nop,sack 2 {29801:42653}{25517:28373},mptcp dss ack 2129982582], length 0
21:13:01.073879 IP 112.26.0.8.52644 > 112.26.0.1.40367: Flags [.], ack 24089, win 913, options [nop,nop,TS val 4294814875 ecr 59613,nop,nop,sack 2 {29801:44081}{25517:28373},mptcp dss ack 2129982582], length 0
21:13:01.131315 IP 112.26.0.1.40367 > 112.26.0.8.52644: Flags [.], seq 48365:49793, ack 1, win 1339, options [nop,nop,TS val 60992 ecr 4294814378,mptcp dss ack 3380555454 seq 2130006858 subseq 48365 len 1428 csum 0xaca4], length 1428
21:13:01.131576 IP 112.26.0.1.40367 > 112.26.0.8.52644: Flags [.], seq 48365:49793, ack 1, win 1339, options [nop,nop,TS val 60992 ecr 4294814378,mptcp dss ack 3380555454 seq 2130006858 subseq 48365 len 1428 csum 0xaca4], length 1428
21:13:01.136607 IP 112.26.0.8.52644 > 112.26.0.1.40367: Flags [.], ack 49793, win 1027, options [nop,nop,TS val 4294815353 ecr 60992,mptcp dss ack 2130008286], length 0
21:13:01.136825 IP 112.26.0.8.52644 > 112.26.0.1.40367: Flags [.], ack 49793, win 1027, options [nop,nop,TS val 4294815353 ecr 60992,mptcp dss ack 2130008286], length 0
