21:13:01.065627 IP 112.26.3.8.43671 > 112.26.3.1.40367: Flags [S], seq 2189499353, win 29200, options [mss 1460,sackOK,TS val 4294815181 ecr 0,nop,wscale 7,mptcp join id 6 token 0x329820ce nonce 0x2ef04440], length 0
21:13:01.114131 IP 112.26.3.8.43671 > 112.26.3.1.40367: Flags [S], seq 2189499353, win 29200, options [mss 1460,sackOK,TS val 4294815181 ecr 0,nop,wscale 7,mptcp join id 6 token 0x329820ce nonce 0x2ef04440], length 0
21:13:01.134774 IP 112.26.3.1.40367 > 112.26.3.8.43671: Flags [S.], seq 3940776399, ack 2189499354, win 65535, options [mss 1460,sackOK,TS val 61260 ecr 4294815181,nop,wscale 6,mptcp join id 5 hmac 0xdf7330347fa89a0f nonce 0xe090ccfe], length 0
21:13:01.228877 IP 112.26.3.1.40367 > 112.26.3.8.43671: Flags [S.], seq 3940776399, ack 2189499354, win 65535, options [mss 1460,sackOK,TS val 61260 ecr 4294815181,nop,wscale 6,mptcp join id 5 hmac 0xdf7330347fa89a0f nonce 0xe090ccfe], length 0
21:13:01.361558 IP 112.26.3.8.43671 > 112.26.3.1.40367: Flags [.], ack 1, win 1711, options [nop,nop,TS val 4294815500 ecr 61260,mptcp join hmac 0xeb2c19c6edc007edfa883ce517a0260b08ee84c5], length 0
21:13:01.362980 IP 112.26.3.8.43671 > 112.26.3.1.40367: Flags [.], ack 1, win 1711, options [nop,nop,TS val 4294815500 ecr 61260,mptcp join hmac 0xeb2c19c6edc007edfa883ce517a0260b08ee84c5], length 0
21:13:01.367986 IP 112.26.3.1.40367 > 112.26.3.8.43671: Flags [.], ack 1, win 4017, options [nop,nop,TS val 61509 ecr 4294815500,mptcp dss ack 3380555454], length 0
21:13:01.433109 IP 112.26.3.1.40367 > 112.26.3.8.43671: Flags [.], seq 1:1429, ack 1, win 4017, options [nop,nop,TS val 61510 ecr 4294815500,mptcp dss ack 3380555454 seq 2130035418 subseq 1 len 1428 csum 0x21d3], length 1428
21:13:01.465812 IP 112.26.3.1.40367 > 112.26.3.8.43671: Flags [.], ack 1, win 4017, options [nop,nop,TS val 61509 ecr 4294815500,mptcp dss ack 3380555454], length 0
21:13:01.500784 IP 112.26.3.1.40367 > 112.26.3.8.43671: Flags [.], seq 1429:2857, ack 1, win 4017, options [nop,nop,TS val 61510 ecr 4294815500,mptcp dss ack 3380555454 seq 2130036846 subseq 1429 len 1428 csum 0x5d2f], length 1428
21:13:01.537083 IP 112.26.3.1.40367 > 112.26.3.8.43671: Flags [.], seq 1:1429, ack 1, win 4017, options [nop,nop,TS val 61510 ecr 4294815500,mptcp dss ack 3380555454 seq 2130035418 subseq 1 len 1428 csum 0x21d3], length 1428
21:13:01.587863 IP 112.26.3.1.40367 > 112.26.3.8.43671: Flags [.], seq 2857:4285, ack 1, win 4017, options [nop,nop,TS val 61510 ecr 4294815500,mptcp dss ack 3380555454 seq 2130038274 subseq 2857 len 1428 csum 0x9d02], length 1428
21:13:01.596513 IP 112.26.3.8.43671 > 112.26.3.1.40367: Flags [.], ack 1429, win 1825, options [nop,nop,TS val 4294815767 ecr 61510,mptcp dss ack 2130011142], length 0
21:13:01.639751 IP 112.26.3.1.40367 > 112.26.3.8.43671: Flags [.], seq 4285:5713, ack 1, win 4017, options [nop,nop,TS val 61510 ecr 4294815500,mptcp dss ack 3380555454 seq 2130039702 subseq 4285 len 1428 csum 0x6e9a], length 1428
21:13:01.695411 IP 112.26.3.1.40367 > 112.26.3.8.43671: Flags [.], seq 1429:2857, ack 1, win 4017, options [nop,nop,TS val 61510 ecr 4294815500,mptcp dss ack 3380555454 seq 2130036846 subseq 1429 len 1428 csum 0x5d2f], length 1428
21:13:01.743212 IP 112.26.3.1.40367 > 112.26.3.8.43671: Flags [.], seq 5713:7141, ack 1, win 4017, options [nop,nop,TS val 61510 ecr 4294815500,mptcp dss ack 3380555454 seq 2130041130 subseq 5713 len 1428 csum 0xebc9], length 1428
21:13:01.778197 IP 112.26.3.8.43671 > 112.26.3.1.40367: Flags [.], ack 2857, win 1894, options [nop,nop,TS val 4294815918 ecr 61510,mptcp dss ack 2130012570], length 0
21:13:01.813157 IP 112.26.3.1.40367 > 112.26.3.8.43671: Flags [.], seq 7141:8569, ack 1, win 4017, options [nop,nop,TS val 61510 ecr 4294815500,mptcp dss ack 3380555454 seq 2130042558 subseq 7141 len 1428 csum 0x316e], length 1428
21:13:01.825498 IP 112.26.3.1.40367 > 112.26.3.8.43671: Flags [.], seq 2857:4285, ack 1, win 4017, options [nop,nop,TS val 61510 ecr 4294815500,mptcp dss ack 3380555454 seq 2130038274 subseq 2857 len 1428 csum 0x9d02], length 1428
21:13:01.834948 IP 112.26.3.8.43671 > 112.26.3.1.40367: Flags [.], ack 4285, win 1962, options [nop,nop,TS val 4294816047 ecr 61510,mptcp dss ack 2130012570], length 0
21:13:01.886562 IP 112.26.3.1.40367 > 112.26.3.8.43671: Flags [.], seq 8569:9997, ack 1, win 4017, options [nop,nop,TS val 61511 ecr 4294815500,mptcp dss ack 3380555454 seq 2130043986 subseq 8569 len 1428 csum 0xea69], length 1428
21:13:01.910448 IP 112.26.3.8.43671 > 112.26.3.1.40367: Flags [.], ack 1429, win 1825, options [nop,nop,TS val 4294815767 ecr 61510,mptcp dss ack 2130011142], length 0
21:13:01.939602 IP 112.26.3.1.40367 > 112.26.3.8.43671: Flags [.], seq 9997:11425, ack 1, win 4017, options [nop,nop,TS val 61511 ecr 4294815500,mptcp dss ack 3380555454 seq 2130045414 subseq 9997 len 1428 csum 0x3482], length 1428
21:13:01.955210 IP 112.26.3.1.40367 > 112.26.3.8.43671: Flags [.], seq 4285:5713, ack 1, win 4017, options [nop,nop,TS val 61510 ecr 4294815500,mptcp dss ack 3380555454 seq 2130039702 subseq 4285 len 1428 csum 0x6e9a], length 1428
21:13:01.963198 IP 112.26.3.8.43671 > 112.26.3.1.40367: Flags [.], ack 5713, win 2008, options [nop,nop,TS val 4294816177 ecr 61510,mptcp dss ack 2130013998], length 0
21:13:01.991932 IP 112.26.3.1.40367 > 112.26.3.8.43671: Flags [.], seq 11425:12853, ack 1, win 4017, options [nop,nop,TS val 61511 ecr 4294815500,mptcp dss ack 3380555454 seq 2130046842 subseq 11425 len 1428 csum 0x396c], length 1428
21:13:02.067580 IP 112.26.3.1.40367 > 112.26.3.8.43671: Flags [.], seq 12853:14281, ack 1, win 4017, options [nop,nop,TS val 61512 ecr 4294815500,mptcp dss ack 3380555454 seq 2130048270 subseq 12853 len 1428 csum 0x4a7], length 1428
21:13:02.126480 IP 112.26.3.1.40367 > 112.26.3.8.43671: Flags [.], seq 12853:14281, ack 1, win 4017, options [nop,nop,TS val 62016 ecr 4294815500,mptcp dss ack 3380555454 seq 2130048270 subseq 12853 len 1428 csum 0x4a7], length 1428
21:13:02.133163 IP 112.26.3.1.40367 > 112.26.3.8.43671: Flags [.], seq 5713:7141, ack 1, win 4017, options [nop,nop,TS val 61510 ecr 4294815500,mptcp dss ack 3380555454 seq 2130041130 subseq 5713 len 1428 csum 0xebc9], length 1428
21:13:02.216938 IP 112.26.3.8.43671 > 112.26.3.1.40367: Flags [.], ack 2857, win 1894, options [nop,nop,TS val 4294815918 ecr 61510,mptcp dss ack 2130012570], length 0
21:13:02.227273 IP 112.26.3.8.43671 > 112.26.3.1.40367: Flags [.], ack 7141, win 2122, options [nop,nop,TS val 4294816356 ecr 61510,mptcp dss ack 2130015426], length 0
21:13:02.243414 IP 112.26.3.1.40367 > 112.26.3.8.43671: Flags [.], seq 14281:15709, ack 1, win 4017, options [nop,nop,TS val 62057 ecr 4294815767,mptcp dss ack 3380555454 seq 2130066834 subseq 14281 len 1428 csum 0xa253], length 1428
21:13:02.274048 IP 112.26.3.1.40367 > 112.26.3.8.43671: Flags [.], seq 15709:17137, ack 1, win 4017, options [nop,nop,TS val 62057 ecr 4294815767,mptcp dss ack 3380555454 seq 2130068262 subseq 15709 len 1428 csum 0xc614], length 1428
21:13:02.282272 IP 112.26.3.1.40367 > 112.26.3.8.43671: Flags [.], seq 7141:8569, ack 1, win 4017, options [nop,nop,TS val 61510 ecr 4294815500,mptcp dss ack 3380555454 seq 2130042558 subseq 7141 len 1428 csum 0x316e], length 1428
21:13:02.295506 IP 112.26.3.8.43671 > 112.26.3.1.40367: Flags [.], ack 8569, win 2213, options [nop,nop,TS val 4294816505 ecr 61510,mptcp dss ack 2130022566], length 0
21:13:02.368245 IP 112.26.3.1.40367 > 112.26.3.8.43671: Flags [.], seq 17137:18565, ack 1, win 4017, options [nop,nop,TS val 62363 ecr 4294815918,mptcp dss ack 3380555454 seq 2130078258 subseq 17137 len 1428 csum 0xd965], length 1428
21:13:02.382618 IP 112.26.3.1.40367 > 112.26.3.8.43671: Flags [.], seq 18565:19993, ack 1, win 4017, options [nop,nop,TS val 62363 ecr 4294815918,mptcp dss ack 3380555454 seq 2130079686 subseq 18565 len 1428 csum 0x1c2c], length 1428
21:13:02.399219 IP 112.26.3.8.43671 > 112.26.3.1.40367: Flags [.], ack 4285, win 1962, options [nop,nop,TS val 4294816047 ecr 61510,mptcp dss ack 2130012570], length 0
21:13:02.439620 IP 112.26.3.1.40367 > 112.26.3.8.43671: Flags [.], seq 19993:21421, ack 1, win 4017, options [nop,nop,TS val 62545 ecr 4294816047,mptcp dss ack 3380555454 seq 2130086826 subseq 19993 len 1428 csum 0xa102], length 1428
21:13:02.462234 IP 112.26.3.1.40367 > 112.26.3.8.43671: Flags [.], seq 8569:9997, ack 1, win 4017, options [nop,nop,TS val 61511 ecr 4294815500,mptcp dss ack 3380555454 seq 2130043986 subseq 8569 len 1428 csum 0xea69], length 1428
21:13:02.475648 IP 112.26.3.8.43671 > 112.26.3.1.40367: Flags [.], ack 9997, win 2305, options [nop,nop,TS val 4294816687 ecr 61511,mptcp dss ack 2130023994], length 0
21:13:02.526471 IP 112.26.3.1.40367 > 112.26.3.8.43671: Flags [.], seq 21421:22849, ack 1, win 4017, options [nop,nop,TS val 62545 ecr 4294816047,mptcp dss ack 3380555454 seq 2130088254 subseq 21421 len 1428 csum 0x1f0], length 1428
21:13:02.572891 IP 112.26.3.1.40367 > 112.26.3.8.43671: Flags [.], seq 9997:11425, ack 1, win 4017, options [nop,nop,TS val 61511 ecr 4294815500,mptcp dss ack 3380555454 seq 2130045414 subseq 9997 len 1428 csum 0x3482], length 1428
21:13:02.581850 IP 112.26.3.8.43671 > 112.26.3.1.40367: Flags [.], ack 11425, win 2373, options [nop,nop,TS val 4294816796 ecr 61511,mptcp dss ack 2130025422], length 0
21:13:02.653066 IP 112.26.3.8.43671 > 112.26.3.1.40367: Flags [.], ack 5713, win 2008, options [nop,nop,TS val 4294816177 ecr 61510,mptcp dss ack 2130013998], length 0
21:13:02.655489 IP 112.26.3.1.40367 > 112.26.3.8.43671: Flags [.], seq 22849:24277, ack 1, win 4017, options [nop,nop,TS val 62799 ecr 4294816177,mptcp dss ack 3380555454 seq 2130095394 subseq 22849 len 1428 csum 0x1469], length 1428
21:13:02.711863 IP 112.26.3.1.40367 > 112.26.3.8.43671: Flags [.], seq 24277:25705, ack 1, win 4017, options [nop,nop,TS val 62799 ecr 4294816177,mptcp dss ack 3380555454 seq 2130096822 subseq 24277 len 1428 csum 0xc483], length 1428
21:13:02.787537 IP 112.26.3.1.40367 > 112.26.3.8.43671: Flags [.], seq 12853:14281, ack 1, win 4017, options [nop,nop,TS val 62016 ecr 4294815500,mptcp dss ack 3380555454 seq 2130048270 subseq 12853 len 1428 csum 0x4a7], length 1428
21:13:02.884713 IP 112.26.3.8.43671 > 112.26.3.1.40367: Flags [.], ack 7141, win 2122, options [nop,nop,TS val 4294816356 ecr 61510,mptcp dss ack 2130015426], length 0
21:13:02.887538 IP 112.26.3.1.40367 > 112.26.3.8.43671: Flags [.], seq 25705:27133, ack 1, win 4017, options [nop,nop,TS val 63031 ecr 4294816356,mptcp dss ack 3380555454 seq 2130105390 subseq 25705 len 1428 csum 0xa3e0], length 1428
21:13:02.892351 IP 112.26.3.8.43671 > 112.26.3.1.40367: Flags [.], ack 11425, win 2533, options [nop,nop,TS val 4294817012 ecr 61511,nop,nop,sack 1 {12853:14281},mptcp dss ack 2130028278], length 0
21:13:02.944109 IP 112.26.3.1.40367 > 112.26.3.8.43671: Flags [.], seq 15709:17137, ack 1, win 4017, options [nop,nop,TS val 62057 ecr 4294815767,mptcp dss ack 3380555454 seq 2130068262 subseq 15709 len 1428 csum 0xc614], length 1428
21:13:02.955782 IP 112.26.3.8.43671 > 112.26.3.1.40367: Flags [.], ack 11425, win 2624, options [nop,nop,TS val 4294817171 ecr 61511,nop,nop,sack 2 {15709:17137}{12853:14281},mptcp dss ack 2130029706], length 0
21:13:02.967912 IP 112.26.3.1.40367 > 112.26.3.8.43671: Flags [.], seq 27133:28561, ack 1, win 4017, options [nop,nop,TS val 63031 ecr 4294816356,mptcp dss ack 3380555454 seq 2130106818 subseq 27133 len 1428 csum 0xe44d], length 1428
21:13:03.077904 IP 112.26.3.1.40367 > 112.26.3.8.43671: Flags [.], seq 17137:18565, ack 1, win 4017, options [nop,nop,TS val 62363 ecr 4294815918,mptcp dss ack 3380555454 seq 2130078258 subseq 17137 len 1428 csum 0xd965], length 1428
21:13:03.088582 IP 112.26.3.8.43671 > 112.26.3.1.40367: Flags [.], ack 11425, win 2715, options [nop,nop,TS val 4294817302 ecr 61511,nop,nop,sack 2 {15709:18565}{12853:14281},mptcp dss ack 2130046842], length 0
21:13:03.157039 IP 112.26.3.1.40367 > 112.26.3.8.43671: Flags [.], seq 21421:22849, ack 1, win 4017, options [nop,nop,TS val 62545 ecr 4294816047,mptcp dss ack 3380555454 seq 2130088254 subseq 21421 len 1428 csum 0x1f0], length 1428
21:13:03.179579 IP 112.26.3.8.43671 > 112.26.3.1.40367: Flags [.], ack 11425, win 2738, options [nop,nop,TS val 4294817388 ecr 61511,nop,nop,sack 2 {21421:22849}{15709:18565},mptcp dss ack 2130046842], length 0
21:13:03.222030 IP 112.26.3.8.43671 > 112.26.3.1.40367: Flags [.], ack 9997, win 2305, options [nop,nop,TS val 4294816687 ecr 61511,mptcp dss ack 2130023994], length 0
21:13:03.231233 IP 112.26.3.1.40367 > 112.26.3.8.43671: Flags [.], seq 28561:29989, ack 1, win 4017, options [nop,nop,TS val 63368 ecr 4294816687,mptcp dss ack 3380555454 seq 2130119670 subseq 28561 len 1428 csum 0x94df], length 1428
21:13:03.276984 IP 112.26.3.8.43671 > 112.26.3.1.40367: Flags [.], ack 11425, win 2373, options [nop,nop,TS val 4294816796 ecr 61511,mptcp dss ack 2130025422], length 0
21:13:03.279627 IP 112.26.3.1.40367 > 112.26.3.8.43671: Flags [.], seq 29989:31417, ack 1, win 4017, options [nop,nop,TS val 63368 ecr 4294816687,mptcp dss ack 3380555454 seq 2130121098 subseq 29989 len 1428 csum 0xb8b1], length 1428
21:13:03.325111 IP 112.26.3.1.40367 > 112.26.3.8.43671: Flags [.], seq 22849:24277, ack 1, win 4017, options [nop,nop,TS val 62799 ecr 4294816177,mptcp dss ack 3380555454 seq 2130095394 subseq 22849 len 1428 csum 0x1469], length 1428
21:13:03.347454 IP 112.26.3.8.43671 > 112.26.3.1.40367: Flags [.], ack 11425, win 2875, options [nop,nop,TS val 4294817549 ecr 61511,nop,nop,sack 2 {21421:24277}{15709:18565},mptcp dss ack 2130046842], length 0
21:13:03.388575 IP 112.26.3.1.40367 > 112.26.3.8.43671: Flags [.], seq 31417:32845, ack 1, win 4017, options [nop,nop,TS val 63368 ecr 4294816687,mptcp dss ack 3380555454 seq 2130122526 subseq 31417 len 1428 csum 0x7fc9], length 1428
21:13:03.438186 IP 112.26.3.1.40367 > 112.26.3.8.43671: Flags [.], seq 32845:34273, ack 1, win 4017, options [nop,nop,TS val 63368 ecr 4294816687,mptcp dss ack 3380555454 seq 2130123954 subseq 32845 len 1428 csum 0x98ca], length 1428
21:13:03.508539 IP 112.26.3.1.40367 > 112.26.3.8.43671: Flags [.], seq 34273:35701, ack 1, win 4017, options [nop,nop,TS val 63423 ecr 4294816796,mptcp dss ack 3380555454 seq 2130126810 subseq 34273 len 1428 csum 0x4c73], length 1428
21:13:03.516737 IP 112.26.3.1.40367 > 112.26.3.8.43671: Flags [.], seq 25705:27133, ack 1, win 4017, options [nop,nop,TS val 63031 ecr 4294816356,mptcp dss ack 3380555454 seq 2130105390 subseq 25705 len 1428 csum 0xa3e0], length 1428
21:13:03.533745 IP 112.26.3.8.43671 > 112.26.3.1.40367: Flags [.], ack 11425, win 2966, options [nop,nop,TS val 4294817739 ecr 61511,nop,nop,sack 2 {25705:27133}{21421:24277},mptcp dss ack 2130046842], length 0
21:13:03.586720 IP 112.26.3.1.40367 > 112.26.3.8.43671: Flags [.], seq 35701:37129, ack 1, win 4017, options [nop,nop,TS val 63423 ecr 4294816796,mptcp dss ack 3380555454 seq 2130128238 subseq 35701 len 1428 csum 0x1094], length 1428
21:13:03.598001 IP 112.26.3.8.43671 > 112.26.3.1.40367: Flags [.], ack 11425, win 2533, options [nop,nop,TS val 4294817012 ecr 61511,nop,nop,sack 1 {12853:14281},mptcp dss ack 2130028278], length 0
21:13:03.670828 IP 112.26.3.1.40367 > 112.26.3.8.43671: Flags [.], seq 37129:38557, ack 1, win 4017, options [nop,nop,TS val 63782 ecr 4294817012,mptcp dss ack 3380555454 seq 2130142518 subseq 37129 len 1428 csum 0x1fa0], length 1428
21:13:03.681225 IP 112.26.3.8.43671 > 112.26.3.1.40367: Flags [.], ack 11425, win 2624, options [nop,nop,TS val 4294817171 ecr 61511,nop,nop,sack 2 {15709:17137}{12853:14281},mptcp dss ack 2130029706], length 0
21:13:03.716500 IP 112.26.3.1.40367 > 112.26.3.8.43671: Flags [.], seq 11425:12853, ack 1, win 4017, options [nop,nop,TS val 63827 ecr 4294817171,mptcp dss ack 3380555454 seq 2130046842 subseq 11425 len 1428 csum 0x396c], length 1428
21:13:03.744136 IP 112.26.3.8.43671 > 112.26.3.1.40367: Flags [.], ack 11425, win 2715, options [nop,nop,TS val 4294817302 ecr 61511,nop,nop,sack 2 {15709:18565}{12853:14281},mptcp dss ack 2130046842], length 0
21:13:03.788018 IP 112.26.3.1.40367 > 112.26.3.8.43671: Flags [.], seq 14281:15709, ack 1, win 4017, options [nop,nop,TS val 63890 ecr 4294817302,mptcp dss ack 3380555454 seq 2130066834 subseq 14281 len 1428 csum 0xa253], length 1428
21:13:03.813037 IP 112.26.3.8.43671 > 112.26.3.1.40367: Flags [.], ack 11425, win 2738, options [nop,nop,TS val 4294817388 ecr 61511,nop,nop,sack 2 {21421:22849}{15709:18565},mptcp dss ack 2130046842], length 0
21:13:03.885728 IP 112.26.3.1.40367 > 112.26.3.8.43671: Flags [.], seq 28561:29989, ack 1, win 4017, options [nop,nop,TS val 63368 ecr 4294816687,mptcp dss ack 3380555454 seq 2130119670 subseq 28561 len 1428 csum 0x94df], length 1428
21:13:03.894807 IP 112.26.3.8.43671 > 112.26.3.1.40367: Flags [.], ack 11425, win 3149, options [nop,nop,TS val 4294818110 ecr 61511,nop,nop,sack 2 {28561:29989}{25705:27133},mptcp dss ack 2130046842], length 0
21:13:03.983020 IP 112.26.3.1.40367 > 112.26.3.8.43671: Flags [.], seq 29989:31417, ack 1, win 4017, options [nop,nop,TS val 63368 ecr 4294816687,mptcp dss ack 3380555454 seq 2130121098 subseq 29989 len 1428 csum 0xb8b1], length 1428
21:13:03.991086 IP 112.26.3.8.43671 > 112.26.3.1.40367: Flags [.], ack 11425, win 3171, options [nop,nop,TS val 4294818205 ecr 61511,nop,nop,sack 2 {28561:31417}{25705:27133},mptcp dss ack 2130046842], length 0
21:13:04.077666 IP 112.26.3.8.43671 > 112.26.3.1.40367: Flags [.], ack 11425, win 2875, options [nop,nop,TS val 4294817549 ecr 61511,nop,nop,sack 2 {21421:24277}{15709:18565},mptcp dss ack 2130046842], length 0
21:13:04.143611 IP 112.26.3.1.40367 > 112.26.3.8.43671: Flags [.], seq 32845:34273, ack 1, win 4017, options [nop,nop,TS val 63368 ecr 4294816687,mptcp dss ack 3380555454 seq 2130123954 subseq 32845 len 1428 csum 0x98ca], length 1428
21:13:04.206857 IP 112.26.3.1.40367 > 112.26.3.8.43671: Flags [.], seq 34273:35701, ack 1, win 4017, options [nop,nop,TS val 63423 ecr 4294816796,mptcp dss ack 3380555454 seq 2130126810 subseq 34273 len 1428 csum 0x4c73], length 1428
21:13:04.246523 IP 112.26.3.8.43671 > 112.26.3.1.40367: Flags [.], ack 11425, win 3308, options [nop,nop,TS val 4294818366 ecr 61511,nop,nop,sack 2 {32845:34273}{28561:31417},mptcp dss ack 2130046842], length 0
21:13:04.277843 IP 112.26.3.8.43671 > 112.26.3.1.40367: Flags [.], ack 11425, win 2966, options [nop,nop,TS val 4294817739 ecr 61511,nop,nop,sack 2 {25705:27133}{21421:24277},mptcp dss ack 2130046842], length 0
21:13:04.280626 IP 112.26.3.1.40367 > 112.26.3.8.43671: Flags [.], seq 18565:19993, ack 1, win 4017, options [nop,nop,TS val 64424 ecr 4294817739,mptcp dss ack 3380555454 seq 2130079686 subseq 18565 len 1428 csum 0x1c2c], length 1428
21:13:04.310132 IP 112.26.3.8.43671 > 112.26.3.1.40367: Flags [.], ack 11425, win 3377, options [nop,nop,TS val 4294818483 ecr 61511,nop,nop,sack 2 {32845:35701}{28561:31417},mptcp dss ack 2130046842], length 0
21:13:04.352279 IP 112.26.3.1.40367 > 112.26.3.8.43671: Flags [.], seq 35701:37129, ack 1, win 4017, options [nop,nop,TS val 63423 ecr 4294816796,mptcp dss ack 3380555454 seq 2130128238 subseq 35701 len 1428 csum 0x1094], length 1428
21:13:04.367365 IP 112.26.3.8.43671 > 112.26.3.1.40367: Flags [.], ack 11425, win 3422, options [nop,nop,TS val 4294818574 ecr 61511,nop,nop,sack 2 {32845:37129}{28561:31417},mptcp dss ack 2130046842], length 0
21:13:04.435565 IP 112.26.3.1.40367 > 112.26.3.8.43671: Flags [.], seq 11425:12853, ack 1, win 4017, options [nop,nop,TS val 63827 ecr 4294817171,mptcp dss ack 3380555454 seq 2130046842 subseq 11425 len 1428 csum 0x396c], length 1428
21:13:04.453556 IP 112.26.3.8.43671 > 112.26.3.1.40367: Flags [.], ack 14281, win 3491, options [nop,nop,TS val 4294818659 ecr 63827,nop,nop,sack 2 {32845:37129}{28561:31417},mptcp dss ack 2130066834], length 0
21:13:04.543500 IP 112.26.3.1.40367 > 112.26.3.8.43671: Flags [.], seq 14281:15709, ack 1, win 4017, options [nop,nop,TS val 63890 ecr 4294817302,mptcp dss ack 3380555454 seq 2130066834 subseq 14281 len 1428 csum 0xa253], length 1428
21:13:04.558418 IP 112.26.3.8.43671 > 112.26.3.1.40367: Flags [.], ack 18565, win 3514, options [nop,nop,TS val 4294818775 ecr 63890,nop,nop,sack 2 {32845:37129}{28561:31417},mptcp dss ack 2130069690], length 0
21:13:04.591170 IP 112.26.3.8.43671 > 112.26.3.1.40367: Flags [.], ack 11425, win 3149, options [nop,nop,TS val 4294818110 ecr 61511,nop,nop,sack 2 {28561:29989}{25705:27133},mptcp dss ack 2130046842], length 0
21:13:04.593928 IP 112.26.3.1.40367 > 112.26.3.8.43671: Flags [.], seq 19993:21421, ack 1, win 4017, options [nop,nop,TS val 64737 ecr 4294818110,mptcp dss ack 3380555454 seq 2130086826 subseq 19993 len 1428 csum 0xa102], length 1428
21:13:04.680801 IP 112.26.3.8.43671 > 112.26.3.1.40367: Flags [.], ack 11425, win 3171, options [nop,nop,TS val 4294818205 ecr 61511,nop,nop,sack 2 {28561:31417}{25705:27133},mptcp dss ack 2130046842], length 0
21:13:04.683762 IP 112.26.3.1.40367 > 112.26.3.8.43671: Flags [.], seq 24277:25705, ack 1, win 4017, options [nop,nop,TS val 64827 ecr 4294818205,mptcp dss ack 3380555454 seq 2130096822 subseq 24277 len 1428 csum 0xc483], length 1428
21:13:04.745263 IP 112.26.3.8.43671 > 112.26.3.1.40367: Flags [.], ack 11425, win 3308, options [nop,nop,TS val 4294818366 ecr 61511,nop,nop,sack 2 {32845:34273}{28561:31417},mptcp dss ack 2130046842], length 0
21:13:04.757659 IP 112.26.3.1.40367 > 112.26.3.8.43671: Flags [.], seq 27133:28561, ack 1, win 4017, options [nop,nop,TS val 64892 ecr 4294818366,mptcp dss ack 3380555454 seq 2130106818 subseq 27133 len 1428 csum 0xe44d], length 1428
21:13:04.847107 IP 112.26.3.1.40367 > 112.26.3.8.43671: Flags [.], seq 18565:19993, ack 1, win 4017, options [nop,nop,TS val 64424 ecr 4294817739,mptcp dss ack 3380555454 seq 2130079686 subseq 18565 len 1428 csum 0x1c2c], length 1428
21:13:04.852664 IP 112.26.3.8.43671 > 112.26.3.1.40367: Flags [.], ack 19993, win 3719, options [nop,nop,TS val 4294819068 ecr 64424,nop,nop,sack 2 {32845:37129}{28561:31417},mptcp dss ack 2130069690], length 0
21:13:04.914647 IP 112.26.3.8.43671 > 112.26.3.1.40367: Flags [.], ack 11425, win 3377, options [nop,nop,TS val 4294818483 ecr 61511,nop,nop,sack 2 {32845:35701}{28561:31417},mptcp dss ack 2130046842], length 0
21:13:04.917316 IP 112.26.3.1.40367 > 112.26.3.8.43671: Flags [.], seq 31417:32845, ack 1, win 4017, options [nop,nop,TS val 65061 ecr 4294818483,mptcp dss ack 3380555454 seq 2130122526 subseq 31417 len 1428 csum 0x7fc9], length 1428
21:13:04.991088 IP 112.26.3.8.43671 > 112.26.3.1.40367: Flags [.], ack 11425, win 3422, options [nop,nop,TS val 4294818574 ecr 61511,nop,nop,sack 2 {32845:37129}{28561:31417},mptcp dss ack 2130046842], length 0
21:13:05.027222 IP 112.26.3.1.40367 > 112.26.3.8.43671: Flags [.], seq 38557:39985, ack 1, win 4017, options [nop,nop,TS val 65170 ecr 4294818574,mptcp dss ack 3380555454 seq 2130183930 subseq 38557 len 1428 csum 0x5383], length 1428
21:13:05.044555 IP 112.26.3.8.43671 > 112.26.3.1.40367: Flags [.], ack 14281, win 3491, options [nop,nop,TS val 4294818659 ecr 63827,nop,nop,sack 2 {32845:37129}{28561:31417},mptcp dss ack 2130066834], length 0
21:13:05.082516 IP 112.26.3.8.43671 > 112.26.3.1.40367: Flags [.], ack 18565, win 3514, options [nop,nop,TS val 4294818775 ecr 63890,nop,nop,sack 2 {32845:37129}{28561:31417},mptcp dss ack 2130069690], length 0
21:13:05.113073 IP 112.26.3.1.40367 > 112.26.3.8.43671: Flags [.], seq 37129:38557, ack 1, win 4017, options [nop,nop,TS val 65191 ecr 4294818659,mptcp dss ack 3380555454 seq 2130142518 subseq 37129 len 1428 csum 0x1fa0], length 1428
21:13:05.170946 IP 112.26.3.1.40367 > 112.26.3.8.43671: Flags [.], seq 19993:21421, ack 1, win 4017, options [nop,nop,TS val 64737 ecr 4294818110,mptcp dss ack 3380555454 seq 2130086826 subseq 19993 len 1428 csum 0xa102], length 1428
21:13:05.182631 IP 112.26.3.8.43671 > 112.26.3.1.40367: Flags [.], ack 24277, win 3924, options [nop,nop,TS val 4294819394 ecr 64737,nop,nop,sack 2 {32845:37129}{28561:31417},mptcp dss ack 2130096822], length 0
21:13:05.190828 IP 112.26.3.1.40367 > 112.26.3.8.43671: Flags [.], seq 39985:41413, ack 1, win 4017, options [nop,nop,TS val 65191 ecr 4294818659,mptcp dss ack 3380555454 seq 2130186786 subseq 39985 len 1428 csum 0x72ac], length 1428
21:13:05.265811 IP 112.26.3.1.40367 > 112.26.3.8.43671: Flags [.], seq 41413:42841, ack 1, win 4017, options [nop,nop,TS val 65191 ecr 4294818659,mptcp dss ack 3380555454 seq 2130188214 subseq 41413 len 1428 csum 0xabe4], length 1428
21:13:05.302839 IP 112.26.3.1.40367 > 112.26.3.8.43671: Flags [.], seq 24277:25705, ack 1, win 4017, options [nop,nop,TS val 64827 ecr 4294818205,mptcp dss ack 3380555454 seq 2130096822 subseq 24277 len 1428 csum 0xc483], length 1428
21:13:05.312413 IP 112.26.3.8.43671 > 112.26.3.1.40367: Flags [.], ack 27133, win 3993, options [nop,nop,TS val 4294819525 ecr 64827,nop,nop,sack 2 {32845:37129}{28561:31417},mptcp dss ack 2130099678], length 0
21:13:05.323053 IP 112.26.3.1.40367 > 112.26.3.8.43671: Flags [.], seq 42841:44269, ack 1, win 4017, options [nop,nop,TS val 65191 ecr 4294818659,mptcp dss ack 3380555454 seq 2130189642 subseq 42841 len 1428 csum 0xea08], length 1428
21:13:05.392606 IP 112.26.3.1.40367 > 112.26.3.8.43671: Flags [.], seq 27133:28561, ack 1, win 4017, options [nop,nop,TS val 64892 ecr 4294818366,mptcp dss ack 3380555454 seq 2130106818 subseq 27133 len 1428 csum 0xe44d], length 1428
21:13:05.402878 IP 112.26.3.8.43671 > 112.26.3.1.40367: Flags [.], ack 31417, win 4061, options [nop,nop,TS val 4294819617 ecr 64892,nop,nop,sack 1 {32845:37129},mptcp dss ack 2130099678], length 0
21:13:05.432886 IP 112.26.3.1.40367 > 112.26.3.8.43671: Flags [.], seq 44269:45697, ack 1, win 4017, options [nop,nop,TS val 65228 ecr 4294818775,mptcp dss ack 3380555454 seq 2130191070 subseq 44269 len 1428 csum 0xe00a], length 1428
21:13:05.455666 IP 112.26.3.8.43671 > 112.26.3.1.40367: Flags [.], ack 19993, win 3719, options [nop,nop,TS val 4294819068 ecr 64424,nop,nop,sack 2 {32845:37129}{28561:31417},mptcp dss ack 2130069690], length 0
21:13:05.473244 IP 112.26.3.1.40367 > 112.26.3.8.43671: Flags [.], seq 45697:47125, ack 1, win 4017, options [nop,nop,TS val 65228 ecr 4294818775,mptcp dss ack 3380555454 seq 2130192498 subseq 45697 len 1428 csum 0x56bc], length 1428
21:13:05.508571 IP 112.26.3.1.40367 > 112.26.3.8.43671: Flags [.], seq 31417:32845, ack 1, win 4017, options [nop,nop,TS val 65061 ecr 4294818483,mptcp dss ack 3380555454 seq 2130122526 subseq 31417 len 1428 csum 0x7fc9], length 1428
21:13:05.521522 IP 112.26.3.8.43671 > 112.26.3.1.40367: Flags [.], ack 37129, win 4084, options [nop,nop,TS val 4294819733 ecr 65061,mptcp dss ack 2130099678], length 0
21:13:05.539187 IP 112.26.3.1.40367 > 112.26.3.8.43671: Flags [.], seq 47125:48553, ack 1, win 4017, options [nop,nop,TS val 65601 ecr 4294819068,mptcp dss ack 3380555454 seq 2130199638 subseq 47125 len 1428 csum 0xf3e6], length 1428
21:13:05.599969 IP 112.26.3.1.40367 > 112.26.3.8.43671: Flags [.], seq 38557:39985, ack 1, win 4017, options [nop,nop,TS val 65170 ecr 4294818574,mptcp dss ack 3380555454 seq 2130183930 subseq 38557 len 1428 csum 0x5383], length 1428
21:13:05.613284 IP 112.26.3.8.43671 > 112.26.3.1.40367: Flags [.], ack 37129, win 4175, options [nop,nop,TS val 4294819823 ecr 65061,nop,nop,sack 1 {38557:39985},mptcp dss ack 2130099678], length 0
21:13:05.686389 IP 112.26.3.1.40367 > 112.26.3.8.43671: Flags [.], seq 37129:38557, ack 1, win 4017, options [nop,nop,TS val 65191 ecr 4294818659,mptcp dss ack 3380555454 seq 2130142518 subseq 37129 len 1428 csum 0x1fa0], length 1428
21:13:05.698914 IP 112.26.3.8.43671 > 112.26.3.1.40367: Flags [.], ack 39985, win 4221, options [nop,nop,TS val 4294819909 ecr 65191,mptcp dss ack 2130099678], length 0
21:13:05.771500 IP 112.26.3.8.43671 > 112.26.3.1.40367: Flags [.], ack 24277, win 3924, options [nop,nop,TS val 4294819394 ecr 64737,nop,nop,sack 2 {32845:37129}{28561:31417},mptcp dss ack 2130096822], length 0
21:13:05.776081 IP 112.26.3.1.40367 > 112.26.3.8.43671: Flags [.], seq 48553:49981, ack 1, win 4017, options [nop,nop,TS val 65918 ecr 4294819394,mptcp dss ack 3380555454 seq 2130216774 subseq 48553 len 1428 csum 0x2ad5], length 1428
21:13:05.862374 IP 112.26.3.1.40367 > 112.26.3.8.43671: Flags [.], seq 39985:41413, ack 1, win 4017, options [nop,nop,TS val 65191 ecr 4294818659,mptcp dss ack 3380555454 seq 2130186786 subseq 39985 len 1428 csum 0x72ac], length 1428
21:13:05.868769 IP 112.26.3.8.43671 > 112.26.3.1.40367: Flags [.], ack 41413, win 4335, options [nop,nop,TS val 4294820084 ecr 65191,mptcp dss ack 2130103962], length 0
21:13:05.919931 IP 112.26.3.1.40367 > 112.26.3.8.43671: Flags [.], seq 41413:42841, ack 1, win 4017, options [nop,nop,TS val 65191 ecr 4294818659,mptcp dss ack 3380555454 seq 2130188214 subseq 41413 len 1428 csum 0xabe4], length 1428
21:13:05.975607 IP 112.26.3.8.43671 > 112.26.3.1.40367: Flags [.], ack 27133, win 3993, options [nop,nop,TS val 4294819525 ecr 64827,nop,nop,sack 2 {32845:37129}{28561:31417},mptcp dss ack 2130099678], length 0
21:13:05.979488 IP 112.26.3.1.40367 > 112.26.3.8.43671: Flags [.], seq 49981:51409, ack 1, win 4017, options [nop,nop,TS val 66122 ecr 4294819525,mptcp dss ack 3380555454 seq 2130222486 subseq 49981 len 1428 csum 0x8f77], length 1428
21:13:06.001090 IP 112.26.3.8.43671 > 112.26.3.1.40367: Flags [.], ack 42841, win 4426, options [nop,nop,TS val 4294820216 ecr 65191,mptcp dss ack 2130131094], length 0
21:13:06.079644 IP 112.26.3.8.43671 > 112.26.3.1.40367: Flags [.], ack 31417, win 4061, options [nop,nop,TS val 4294819617 ecr 64892,nop,nop,sack 1 {32845:37129},mptcp dss ack 2130099678], length 0
21:13:06.082849 IP 112.26.3.1.40367 > 112.26.3.8.43671: Flags [.], seq 51409:52837, ack 1, win 4017, options [nop,nop,TS val 66226 ecr 4294819617,mptcp dss ack 3380555454 seq 2130225342 subseq 51409 len 1428 csum 0x361d], length 1428
21:13:06.143455 IP 112.26.3.1.40367 > 112.26.3.8.43671: Flags [.], seq 44269:45697, ack 1, win 4017, options [nop,nop,TS val 65228 ecr 4294818775,mptcp dss ack 3380555454 seq 2130191070 subseq 44269 len 1428 csum 0xe00a], length 1428
21:13:06.151800 IP 112.26.3.8.43671 > 112.26.3.1.40367: Flags [.], ack 42841, win 4517, options [nop,nop,TS val 4294820366 ecr 65191,nop,nop,sack 1 {44269:45697},mptcp dss ack 2130148230], length 0
21:13:06.195227 IP 112.26.3.1.40367 > 112.26.3.8.43671: Flags [.], seq 45697:47125, ack 1, win 4017, options [nop,nop,TS val 65228 ecr 4294818775,mptcp dss ack 3380555454 seq 2130192498 subseq 45697 len 1428 csum 0x56bc], length 1428
21:13:06.224588 IP 112.26.3.8.43671 > 112.26.3.1.40367: Flags [.], ack 37129, win 4084, options [nop,nop,TS val 4294819733 ecr 65061,mptcp dss ack 2130099678], length 0
21:13:06.231444 IP 112.26.3.1.40367 > 112.26.3.8.43671: Flags [.], seq 52837:54265, ack 1, win 4017, options [nop,nop,TS val 66371 ecr 4294819733,mptcp dss ack 3380555454 seq 2130228198 subseq 52837 len 1428 csum 0xdde8], length 1428
21:13:06.271551 IP 112.26.3.8.43671 > 112.26.3.1.40367: Flags [.], ack 42841, win 4609, options [nop,nop,TS val 4294820472 ecr 65191,nop,nop,sack 1 {44269:47125},mptcp dss ack 2130148230], length 0
21:13:06.310506 IP 112.26.3.8.43671 > 112.26.3.1.40367: Flags [.], ack 37129, win 4175, options [nop,nop,TS val 4294819823 ecr 65061,nop,nop,sack 1 {38557:39985},mptcp dss ack 2130099678], length 0
21:13:06.355117 IP 112.26.3.8.43671 > 112.26.3.1.40367: Flags [.], ack 39985, win 4221, options [nop,nop,TS val 4294819909 ecr 65191,mptcp dss ack 2130099678], length 0
21:13:06.358861 IP 112.26.3.1.40367 > 112.26.3.8.43671: Flags [.], seq 54265:55693, ack 1, win 4017, options [nop,nop,TS val 66501 ecr 4294819823,mptcp dss ack 3380555454 seq 2130229626 subseq 54265 len 1428 csum 0x7c09], length 1428
21:13:06.419259 IP 112.26.3.1.40367 > 112.26.3.8.43671: Flags [.], seq 55693:57121, ack 1, win 4017, options [nop,nop,TS val 66501 ecr 4294819909,mptcp dss ack 3380555454 seq 2130231054 subseq 55693 len 1428 csum 0xb1e4], length 1428
21:13:06.424672 IP 112.26.3.1.40367 > 112.26.3.8.43671: Flags [.], seq 48553:49981, ack 1, win 4017, options [nop,nop,TS val 65918 ecr 4294819394,mptcp dss ack 3380555454 seq 2130216774 subseq 48553 len 1428 csum 0x2ad5], length 1428
21:13:06.480669 IP 112.26.3.8.43671 > 112.26.3.1.40367: Flags [.], ack 42841, win 4723, options [nop,nop,TS val 4294820655 ecr 65191,nop,nop,sack 2 {48553:49981}{44269:47125},mptcp dss ack 2130148230], length 0
21:13:06.496419 IP 112.26.3.8.43671 > 112.26.3.1.40367: Flags [.], ack 41413, win 4335, options [nop,nop,TS val 4294820084 ecr 65191,mptcp dss ack 2130103962], length 0
21:13:06.515844 IP 112.26.3.1.40367 > 112.26.3.8.43671: Flags [.], seq 57121:58549, ack 1, win 4017, options [nop,nop,TS val 66642 ecr 4294820084,mptcp dss ack 3380555454 seq 2130235338 subseq 57121 len 1428 csum 0x495c], length 1428
21:13:06.609205 IP 112.26.3.1.40367 > 112.26.3.8.43671: Flags [.], seq 49981:51409, ack 1, win 4017, options [nop,nop,TS val 66122 ecr 4294819525,mptcp dss ack 3380555454 seq 2130222486 subseq 49981 len 1428 csum 0x8f77], length 1428
21:13:06.617754 IP 112.26.3.8.43671 > 112.26.3.1.40367: Flags [.], ack 42841, win 4860, options [nop,nop,TS val 4294820832 ecr 65191,nop,nop,sack 2 {48553:51409}{44269:47125},mptcp dss ack 2130148230], length 0
21:13:06.693275 IP 112.26.3.8.43671 > 112.26.3.1.40367: Flags [.], ack 42841, win 4426, options [nop,nop,TS val 4294820216 ecr 65191,mptcp dss ack 2130131094], length 0
21:13:06.696577 IP 112.26.3.1.40367 > 112.26.3.8.43671: Flags [.], seq 58549:59977, ack 1, win 4017, options [nop,nop,TS val 66839 ecr 4294820216,mptcp dss ack 3380555454 seq 2130246762 subseq 58549 len 1428 csum 0xaa0], length 1428
21:13:06.752189 IP 112.26.3.1.40367 > 112.26.3.8.43671: Flags [.], seq 59977:61405, ack 1, win 4017, options [nop,nop,TS val 66839 ecr 4294820216,mptcp dss ack 3380555454 seq 2130248190 subseq 59977 len 1428 csum 0xad41], length 1428
21:13:06.773602 IP 112.26.3.1.40367 > 112.26.3.8.43671: Flags [.], seq 51409:52837, ack 1, win 4017, options [nop,nop,TS val 66226 ecr 4294819617,mptcp dss ack 3380555454 seq 2130225342 subseq 51409 len 1428 csum 0x361d], length 1428
21:13:06.842578 IP 112.26.3.8.43671 > 112.26.3.1.40367: Flags [.], ack 42841, win 4928, options [nop,nop,TS val 4294820996 ecr 65191,nop,nop,sack 2 {48553:52837}{44269:47125},mptcp dss ack 2130148230], length 0
21:13:06.883317 IP 112.26.3.8.43671 > 112.26.3.1.40367: Flags [.], ack 42841, win 4517, options [nop,nop,TS val 4294820366 ecr 65191,nop,nop,sack 1 {44269:45697},mptcp dss ack 2130148230], length 0
21:13:06.894444 IP 112.26.3.1.40367 > 112.26.3.8.43671: Flags [.], seq 61405:62833, ack 1, win 4017, options [nop,nop,TS val 67037 ecr 4294820366,mptcp dss ack 3380555454 seq 2130253902 subseq 61405 len 1428 csum 0x8ec3], length 1428
21:13:06.922383 IP 112.26.3.1.40367 > 112.26.3.8.43671: Flags [.], seq 52837:54265, ack 1, win 4017, options [nop,nop,TS val 66371 ecr 4294819733,mptcp dss ack 3380555454 seq 2130228198 subseq 52837 len 1428 csum 0xdde8], length 1428
21:13:06.928092 IP 112.26.3.8.43671 > 112.26.3.1.40367: Flags [.], ack 42841, win 4996, options [nop,nop,TS val 4294821144 ecr 65191,nop,nop,sack 2 {48553:54265}{44269:47125},mptcp dss ack 2130148230], length 0
21:13:07.002099 IP 112.26.3.8.43671 > 112.26.3.1.40367: Flags [.], ack 42841, win 4609, options [nop,nop,TS val 4294820472 ecr 65191,nop,nop,sack 1 {44269:47125},mptcp dss ack 2130148230], length 0
21:13:07.034090 IP 112.26.3.1.40367 > 112.26.3.8.43671: Flags [.], seq 62833:64261, ack 1, win 4017, options [nop,nop,TS val 67178 ecr 4294820472,mptcp dss ack 3380555454 seq 2130262470 subseq 62833 len 1428 csum 0xc347], length 1428
21:13:07.046215 IP 112.26.3.1.40367 > 112.26.3.8.43671: Flags [.], seq 54265:55693, ack 1, win 4017, options [nop,nop,TS val 66501 ecr 4294819823,mptcp dss ack 3380555454 seq 2130229626 subseq 54265 len 1428 csum 0x7c09], length 1428
21:13:07.070111 IP 112.26.3.8.43671 > 112.26.3.1.40367: Flags [.], ack 42841, win 5088, options [nop,nop,TS val 4294821270 ecr 65191,nop,nop,sack 2 {48553:55693}{44269:47125},mptcp dss ack 2130179646], length 0
21:13:07.130405 IP 112.26.3.1.40367 > 112.26.3.8.43671: Flags [.], seq 55693:57121, ack 1, win 4017, options [nop,nop,TS val 66501 ecr 4294819909,mptcp dss ack 3380555454 seq 2130231054 subseq 55693 len 1428 csum 0xb1e4], length 1428
21:13:07.175256 IP 112.26.3.8.43671 > 112.26.3.1.40367: Flags [.], ack 42841, win 5156, options [nop,nop,TS val 4294821365 ecr 65191,nop,nop,sack 2 {48553:57121}{44269:47125},mptcp dss ack 2130179646], length 0
21:13:07.230113 IP 112.26.3.1.40367 > 112.26.3.8.43671: Flags [.], seq 57121:58549, ack 1, win 4017, options [nop,nop,TS val 66642 ecr 4294820084,mptcp dss ack 3380555454 seq 2130235338 subseq 57121 len 1428 csum 0x495c], length 1428
21:13:07.241087 IP 112.26.3.8.43671 > 112.26.3.1.40367: Flags [.], ack 42841, win 5225, options [nop,nop,TS val 4294821454 ecr 65191,nop,nop,sack 2 {48553:58549}{44269:47125},mptcp dss ack 2130179646], length 0
21:13:07.347187 IP 112.26.3.1.40367 > 112.26.3.8.43671: Flags [.], seq 58549:59977, ack 1, win 4017, options [nop,nop,TS val 66839 ecr 4294820216,mptcp dss ack 3380555454 seq 2130246762 subseq 58549 len 1428 csum 0xaa0], length 1428
21:13:07.362001 IP 112.26.3.8.43671 > 112.26.3.1.40367: Flags [.], ack 42841, win 5270, options [nop,nop,TS val 4294821570 ecr 65191,nop,nop,sack 2 {48553:59977}{44269:47125},mptcp dss ack 2130179646], length 0
21:13:07.430104 IP 112.26.3.1.40367 > 112.26.3.8.43671: Flags [.], seq 59977:61405, ack 1, win 4017, options [nop,nop,TS val 66839 ecr 4294820216,mptcp dss ack 3380555454 seq 2130248190 subseq 59977 len 1428 csum 0xad41], length 1428
21:13:07.474153 IP 112.26.3.8.43671 > 112.26.3.1.40367: Flags [.], ack 42841, win 5361, options [nop,nop,TS val 4294821691 ecr 65191,nop,nop,sack 2 {48553:61405}{44269:47125},mptcp dss ack 2130179646], length 0
21:13:07.537947 IP 112.26.3.8.43671 > 112.26.3.1.40367: Flags [.], ack 42841, win 4928, options [nop,nop,TS val 4294820996 ecr 65191,nop,nop,sack 2 {48553:52837}{44269:47125},mptcp dss ack 2130148230], length 0
21:13:07.544321 IP 112.26.3.1.40367 > 112.26.3.8.43671: Flags [.], seq 42841:44269, ack 1, win 4017, options [nop,nop,TS val 67684 ecr 4294820996,mptcp dss ack 3380555454 seq 2130189642 subseq 42841 len 1428 csum 0xea08], length 1428
21:13:07.649683 IP 112.26.3.8.43671 > 112.26.3.1.40367: Flags [.], ack 42841, win 4996, options [nop,nop,TS val 4294821144 ecr 65191,nop,nop,sack 2 {48553:54265}{44269:47125},mptcp dss ack 2130148230], length 0
21:13:07.652430 IP 112.26.3.1.40367 > 112.26.3.8.43671: Flags [.], seq 47125:48553, ack 1, win 4017, options [nop,nop,TS val 67796 ecr 4294821144,mptcp dss ack 3380555454 seq 2130199638 subseq 47125 len 1428 csum 0xf3e6], length 1428
21:13:07.710513 IP 112.26.3.1.40367 > 112.26.3.8.43671: Flags [.], seq 62833:64261, ack 1, win 4017, options [nop,nop,TS val 67178 ecr 4294820472,mptcp dss ack 3380555454 seq 2130262470 subseq 62833 len 1428 csum 0xc347], length 1428
21:13:07.731913 IP 112.26.3.8.43671 > 112.26.3.1.40367: Flags [.], ack 42841, win 5544, options [nop,nop,TS val 4294821933 ecr 65191,nop,nop,sack 2 {62833:64261}{48553:61405},mptcp dss ack 2130189642], length 0
21:13:07.813501 IP 112.26.3.8.43671 > 112.26.3.1.40367: Flags [.], ack 42841, win 5156, options [nop,nop,TS val 4294821365 ecr 65191,nop,nop,sack 2 {48553:57121}{44269:47125},mptcp dss ack 2130179646], length 0
21:13:07.833041 IP 112.26.3.1.40367 > 112.26.3.8.43671: Flags [.], seq 64261:65689, ack 1, win 4017, options [nop,nop,TS val 67977 ecr 4294821365,mptcp dss ack 3380555454 seq 2130281034 subseq 64261 len 1428 csum 0x8038], length 1428
21:13:07.873450 IP 112.26.3.8.43671 > 112.26.3.1.40367: Flags [.], ack 42841, win 5225, options [nop,nop,TS val 4294821454 ecr 65191,nop,nop,sack 2 {48553:58549}{44269:47125},mptcp dss ack 2130179646], length 0
