21:12:56.216048 IP 112.26.0.8.52644 > 112.26.0.1.40367: Flags [S], seq 1762923967, win 29200, options [mss 1460,sackOK,TS val 4294808243 ecr 0,nop,wscale 7,mptcp capable csum {0x1f312c6106806263}], length 0
21:12:56.331267 IP 112.26.0.8.52644 > 112.26.0.1.40367: Flags [S], seq 1762923967, win 29200, options [mss 1460,sackOK,TS val 4294808243 ecr 0,nop,wscale 7,mptcp capable csum {0x1f312c6106806263}], length 0
21:12:56.435518 IP 112.26.0.1.40367 > 112.26.0.8.52644: Flags [S.], seq 1210547265, ack 1762923968, win 65535, options [mss 1460,sackOK,TS val 56479 ecr 4294808243,nop,wscale 6,mptcp capable csum {0x182a048e31f8618d}], length 0
21:12:56.534430 IP 112.26.0.8.52644 > 112.26.0.1.40367: Flags [.], ack 1, win 229, options [nop,nop,TS val 4294810743 ecr 56479,mptcp capable csum {0x1f312c6106806263,0x182a048e31f8618d},mptcp dss ack 2129958494], length 0
21:12:56.617289 IP 112.26.0.8.52644 > 112.26.0.1.40367: Flags [.], ack 1, win 229, options [nop,nop,TS val 4294810743 ecr 56479,mptcp add-addr id 3 112.26.1.8,mptcp dss ack 2129958494], length 0
21:12:56.624188 IP 112.26.0.8.52644 > 112.26.0.1.40367: Flags [.], ack 1, win 229, options [nop,nop,TS val 4294810743 ecr 56479,mptcp add-addr id 4 112.26.2.8,mptcp dss ack 2129958494], length 0
21:12:56.631993 IP 112.26.0.8.52644 > 112.26.0.1.40367: Flags [.], ack 1, win 229, options [nop,nop,TS val 4294810743 ecr 56479,mptcp add-addr id 6 112.26.3.8,mptcp dss ack 2129958494], length 0
21:12:56.640821 IP 112.26.0.8.52644 > 112.26.0.1.40367: Flags [.], ack 1, win 229, options [nop,nop,TS val 4294810743 ecr 56479,mptcp capable csum {0x1f312c6106806263,0x182a048e31f8618d},mptcp dss ack 2129958494], length 0
21:12:56.738889 IP 112.26.0.1.40367 > 112.26.0.8.52644: Flags [.], ack 1, win 1339, options [nop,nop,TS val 56786 ecr 4294810743,mptcp add-addr id 3 112.26.1.1,mptcp dss ack 3380555454], length 0
21:12:56.851712 IP 112.26.0.1.40367 > 112.26.0.8.52644: Flags [.], ack 1, win 1339, options [nop,nop,TS val 56786 ecr 4294810743,mptcp add-addr id 4 112.26.2.1,mptcp dss ack 3380555454], length 0
21:12:56.929173 IP 112.26.0.8.52644 > 112.26.0.1.40367: Flags [.], ack 1, win 229, options [nop,nop,TS val 4294810743 ecr 56479,mptcp add-addr id 3 112.26.1.8,mptcp dss ack 2129958494], length 0
21:12:56.947816 IP 112.26.0.1.40367 > 112.26.0.8.52644: Flags [.], ack 1, win 1339, options [nop,nop,TS val 56786 ecr 4294810743,mptcp add-addr id 5 112.26.3.1,mptcp dss ack 3380555454], length 0
21:12:57.027854 IP 112.26.0.8.52644 > 112.26.0.1.40367: Flags [.], ack 1, win 229, options [nop,nop,TS val 4294810743 ecr 56479,mptcp add-addr id 4 112.26.2.8,mptcp dss ack 2129958494], length 0
21:12:57.123379 IP 112.26.0.1.40367 > 112.26.0.8.52644: Flags [.], seq 1:1429, ack 1, win 1339, options [nop,nop,TS val 56797 ecr 4294810743,mptcp dss ack 3380555454 seq 2129958494 subseq 1 len 1428 csum 0x9d1], length 1428
21:12:57.126802 IP 112.26.0.8.52644 > 112.26.0.1.40367: Flags [.], ack 1429, win 251, options [nop,nop,TS val 4294811345 ecr 56797,mptcp dss ack 2129959922], length 0
21:12:57.142870 IP 112.26.0.8.52644 > 112.26.0.1.40367: Flags [.], ack 1, win 229, options [nop,nop,TS val 4294810743 ecr 56479,mptcp add-addr id 6 112.26.3.8,mptcp dss ack 2129958494], length 0
21:12:57.227803 IP 112.26.0.1.40367 > 112.26.0.8.52644: Flags [.], seq 1429:2857, ack 1, win 1339, options [nop,nop,TS val 56797 ecr 4294810743,mptcp dss ack 3380555454 seq 2129959922 subseq 1429 len 1428 csum 0x291f], length 1428
21:12:57.239367 IP 112.26.0.1.40367 > 112.26.0.8.52644: Flags [P.], seq 2857:4097, ack 1, win 1339, options [nop,nop,TS val 56798 ecr 4294810743,mptcp dss ack 3380555454 seq 2129961350 subseq 2857 len 1240 csum 0x69f1], length 1240
21:12:57.251866 IP 112.26.0.8.52644 > 112.26.0.1.40367: Flags [.], ack 2857, win 274, options [nop,nop,TS val 4294811470 ecr 56797,mptcp dss ack 2129961350], length 0
21:12:57.336780 IP 112.26.0.8.52644 > 112.26.0.1.40367: Flags [.], ack 4097, win 297, options [nop,nop,TS val 4294811546 ecr 56798,mptcp dss ack 2129962590], length 0
21:12:57.344822 IP 112.26.0.1.40367 > 112.26.0.8.52644: Flags [.], seq 4097:5525, ack 1, win 1339, options [nop,nop,TS val 56798 ecr 4294810743,mptcp dss ack 3380555454 seq 2129962590 subseq 4097 len 1428 csum 0x5e2a], length 1428
21:12:57.435651 IP 112.26.0.1.40367 > 112.26.0.8.52644: Flags [.], seq 5525:6953, ack 1, win 1339, options [nop,nop,TS val 56798 ecr 4294810743,mptcp dss ack 3380555454 seq 2129964018 subseq 5525 len 1428 csum 0xba9f], length 1428
21:12:57.445417 IP 112.26.0.1.40367 > 112.26.0.8.52644: Flags [.], seq 6953:8381, ack 1, win 1339, options [nop,nop,TS val 56798 ecr 4294810743,mptcp dss ack 3380555454 seq 2129965446 subseq 6953 len 1428 csum 0x546c], length 1428
21:12:57.452011 IP 112.26.0.8.52644 > 112.26.0.1.40367: Flags [.], ack 5525, win 320, options [nop,nop,TS val 4294811669 ecr 56798,mptcp dss ack 2129964018], length 0
21:12:57.539799 IP 112.26.0.1.40367 > 112.26.0.8.52644: Flags [.], seq 8381:9809, ack 1, win 1339, options [nop,nop,TS val 56798 ecr 4294810743,mptcp dss ack 3380555454 seq 2129966874 subseq 8381 len 1428 csum 0x23fe], length 1428
21:12:57.540713 IP 112.26.0.8.52644 > 112.26.0.1.40367: Flags [.], ack 6953, win 343, options [nop,nop,TS val 4294811751 ecr 56798,mptcp dss ack 2129965446], length 0
21:12:57.549393 IP 112.26.0.1.40367 > 112.26.0.8.52644: Flags [.], seq 9809:11237, ack 1, win 1339, options [nop,nop,TS val 56798 ecr 4294810743,mptcp dss ack 3380555454 seq 2129968302 subseq 9809 len 1428 csum 0x1c6a], length 1428
21:12:57.553344 IP 112.26.0.8.52644 > 112.26.0.1.40367: Flags [.], ack 8381, win 365, options [nop,nop,TS val 4294811770 ecr 56798,mptcp dss ack 2129966874], length 0
21:12:57.635728 IP 112.26.0.8.52644 > 112.26.0.1.40367: Flags [.], ack 1429, win 251, options [nop,nop,TS val 4294811345 ecr 56797,mptcp dss ack 2129959922], length 0
21:12:57.651943 IP 112.26.0.1.40367 > 112.26.0.8.52644: Flags [.], seq 11237:12665, ack 1, win 1339, options [nop,nop,TS val 56798 ecr 4294810743,mptcp dss ack 3380555454 seq 2129969730 subseq 11237 len 1428 csum 0x4bf0], length 1428
21:12:57.726582 IP 112.26.0.8.52644 > 112.26.0.1.40367: Flags [.], ack 9809, win 388, options [nop,nop,TS val 4294811943 ecr 56798,mptcp dss ack 2129968302], length 0
21:12:57.746994 IP 112.26.0.8.52644 > 112.26.0.1.40367: Flags [.], ack 2857, win 274, options [nop,nop,TS val 4294811470 ecr 56797,mptcp dss ack 2129961350], length 0
21:12:57.856533 IP 112.26.0.8.52644 > 112.26.0.1.40367: Flags [.], ack 11237, win 411, options [nop,nop,TS val 4294812074 ecr 56798,mptcp dss ack 2129969730], length 0
21:12:57.863875 IP 112.26.0.8.52644 > 112.26.0.1.40367: Flags [.], ack 4097, win 297, options [nop,nop,TS val 4294811546 ecr 56798,mptcp dss ack 2129962590], length 0
21:12:57.947624 IP 112.26.0.8.52644 > 112.26.0.1.40367: Flags [.], ack 12665, win 434, options [nop,nop,TS val 4294812165 ecr 56798,mptcp dss ack 2129971158], length 0
21:12:58.030373 IP 112.26.0.1.40367 > 112.26.0.8.52644: Flags [.], seq 12665:14093, ack 1, win 1339, options [nop,nop,TS val 57728 ecr 4294810743,mptcp dss ack 3380555454 seq 2129971158 subseq 12665 len 1428 csum 0x8ded], length 1428
21:12:58.043673 IP 112.26.0.8.52644 > 112.26.0.1.40367: Flags [.], ack 5525, win 320, options [nop,nop,TS val 4294811669 ecr 56798,mptcp dss ack 2129964018], length 0
21:12:58.134610 IP 112.26.0.8.52644 > 112.26.0.1.40367: Flags [.], ack 14093, win 457, options [nop,nop,TS val 4294812352 ecr 57728,mptcp dss ack 2129972586], length 0
21:12:58.138414 IP 112.26.0.1.40367 > 112.26.0.8.52644: Flags [.], seq 14093:15521, ack 1, win 1339, options [nop,nop,TS val 57781 ecr 4294811345,mptcp dss ack 3380555454 seq 2129972586 subseq 14093 len 1428 csum 0xe086], length 1428
21:12:58.160428 IP 112.26.0.1.40367 > 112.26.0.8.52644: Flags [.], seq 15521:16949, ack 1, win 1339, options [nop,nop,TS val 57781 ecr 4294811345,mptcp dss ack 3380555454 seq 2129974014 subseq 15521 len 1428 csum 0x4be2], length 1428
21:12:58.239212 IP 112.26.0.8.52644 > 112.26.0.1.40367: Flags [.], ack 15521, win 480, options [nop,nop,TS val 4294812456 ecr 57781,mptcp dss ack 2129974014], length 0
21:12:58.247557 IP 112.26.0.1.40367 > 112.26.0.8.52644: Flags [.], seq 16949:18377, ack 1, win 1339, options [nop,nop,TS val 57893 ecr 4294811470,mptcp dss ack 3380555454 seq 2129975442 subseq 16949 len 1428 csum 0x3536], length 1428
21:12:58.258958 IP 112.26.0.8.52644 > 112.26.0.1.40367: Flags [.], ack 16949, win 502, options [nop,nop,TS val 4294812476 ecr 57781,mptcp dss ack 2129975442], length 0
21:12:58.267182 IP 112.26.0.8.52644 > 112.26.0.1.40367: Flags [.], ack 6953, win 343, options [nop,nop,TS val 4294811751 ecr 56798,mptcp dss ack 2129965446], length 0
21:12:58.348824 IP 112.26.0.1.40367 > 112.26.0.8.52644: Flags [.], seq 19805:21233, ack 1, win 1339, options [nop,nop,TS val 58009 ecr 4294811546,mptcp dss ack 3380555454 seq 2129978298 subseq 19805 len 1428 csum 0xfe23], length 1428
21:12:58.363787 IP 112.26.0.8.52644 > 112.26.0.1.40367: Flags [.], ack 8381, win 365, options [nop,nop,TS val 4294811770 ecr 56798,mptcp dss ack 2129966874], length 0
21:12:58.373826 IP 112.26.0.8.52644 > 112.26.0.1.40367: Flags [.], ack 18377, win 525, options [nop,nop,TS val 4294812591 ecr 57893,mptcp dss ack 2129976870], length 0
21:12:58.444364 IP 112.26.0.8.52644 > 112.26.0.1.40367: Flags [.], ack 9809, win 388, options [nop,nop,TS val 4294811943 ecr 56798,mptcp dss ack 2129968302], length 0
21:12:58.459869 IP 112.26.0.8.52644 > 112.26.0.1.40367: Flags [.], ack 18377, win 548, options [nop,nop,TS val 4294812677 ecr 57893,nop,nop,sack 1 {19805:21233},mptcp dss ack 2129976870], length 0
21:12:58.532641 IP 112.26.0.8.52644 > 112.26.0.1.40367: Flags [.], ack 11237, win 411, options [nop,nop,TS val 4294812074 ecr 56798,mptcp dss ack 2129969730], length 0
21:12:58.548943 IP 112.26.0.1.40367 > 112.26.0.8.52644: Flags [.], seq 22661:24089, ack 1, win 1339, options [nop,nop,TS val 58190 ecr 4294811669,mptcp dss ack 3380555454 seq 2129981154 subseq 22661 len 1428 csum 0xa3be], length 1428
21:12:58.558442 IP 112.26.0.8.52644 > 112.26.0.1.40367: Flags [.], ack 12665, win 434, options [nop,nop,TS val 4294812165 ecr 56798,mptcp dss ack 2129971158], length 0
21:12:58.647417 IP 112.26.0.8.52644 > 112.26.0.1.40367: Flags [.], ack 14093, win 457, options [nop,nop,TS val 4294812352 ecr 57728,mptcp dss ack 2129972586], length 0
21:12:58.658590 IP 112.26.0.8.52644 > 112.26.0.1.40367: Flags [.], ack 18377, win 571, options [nop,nop,TS val 4294812876 ecr 57893,nop,nop,sack 2 {22661:24089}{19805:21233},mptcp dss ack 2129976870], length 0
21:12:58.837951 IP 112.26.0.8.52644 > 112.26.0.1.40367: Flags [.], ack 15521, win 480, options [nop,nop,TS val 4294812456 ecr 57781,mptcp dss ack 2129974014], length 0
21:12:58.852837 IP 112.26.0.1.40367 > 112.26.0.8.52644: Flags [.], seq 28373:29801, ack 1, win 1339, options [nop,nop,TS val 58510 ecr 4294811770,mptcp dss ack 3380555454 seq 2129986866 subseq 28373 len 1428 csum 0xe7e4], length 1428
21:12:58.858781 IP 112.26.0.8.52644 > 112.26.0.1.40367: Flags [.], ack 18377, win 594, options [nop,nop,TS val 4294813073 ecr 57893,nop,nop,sack 2 {28373:29801}{22661:24089},mptcp dss ack 2129976870], length 0
21:12:58.944581 IP 112.26.0.8.52644 > 112.26.0.1.40367: Flags [.], ack 16949, win 502, options [nop,nop,TS val 4294812476 ecr 57781,mptcp dss ack 2129975442], length 0
21:12:58.957497 IP 112.26.0.1.40367 > 112.26.0.8.52644: Flags [.], seq 31229:32657, ack 1, win 1339, options [nop,nop,TS val 58590 ecr 4294811943,mptcp dss ack 3380555454 seq 2129989722 subseq 31229 len 1428 csum 0xc6], length 1428
21:12:59.034866 IP 112.26.0.8.52644 > 112.26.0.1.40367: Flags [.], ack 18377, win 616, options [nop,nop,TS val 4294813250 ecr 57893,nop,nop,sack 2 {31229:32657}{28373:29801},mptcp dss ack 2129976870], length 0
21:12:59.048041 IP 112.26.0.8.52644 > 112.26.0.1.40367: Flags [.], ack 18377, win 548, options [nop,nop,TS val 4294812677 ecr 57893,nop,nop,sack 1 {19805:21233},mptcp dss ack 2129976870], length 0
21:12:59.059969 IP 112.26.0.1.40367 > 112.26.0.8.52644: Flags [.], seq 34085:35513, ack 1, win 1339, options [nop,nop,TS val 58678 ecr 4294812074,mptcp dss ack 3380555454 seq 2129992578 subseq 34085 len 1428 csum 0x9d61], length 1428
21:12:59.131678 IP 112.26.0.8.52644 > 112.26.0.1.40367: Flags [.], ack 18377, win 639, options [nop,nop,TS val 4294813280 ecr 57893,nop,nop,sack 2 {34085:35513}{31229:32657},mptcp dss ack 2129976870], length 0
21:12:59.146751 IP 112.26.0.1.40367 > 112.26.0.8.52644: Flags [.], seq 35513:36941, ack 1, win 1339, options [nop,nop,TS val 58678 ecr 4294812074,mptcp dss ack 3380555454 seq 2129994006 subseq 35513 len 1428 csum 0x8a06], length 1428
21:12:59.154646 IP 112.26.0.8.52644 > 112.26.0.1.40367: Flags [.], ack 18377, win 662, options [nop,nop,TS val 4294813372 ecr 57893,nop,nop,sack 2 {34085:36941}{31229:32657},mptcp dss ack 2129976870], length 0
21:12:59.160916 IP 112.26.0.8.52644 > 112.26.0.1.40367: Flags [.], ack 18377, win 571, options [nop,nop,TS val 4294812876 ecr 57893,nop,nop,sack 2 {22661:24089}{19805:21233},mptcp dss ack 2129976870], length 0
21:12:59.252638 IP 112.26.0.1.40367 > 112.26.0.8.52644: Flags [.], seq 38369:39797, ack 1, win 1339, options [nop,nop,TS val 58704 ecr 4294812165,mptcp dss ack 3380555454 seq 2129996862 subseq 38369 len 1428 csum 0x687f], length 1428
21:12:59.271186 IP 112.26.0.8.52644 > 112.26.0.1.40367: Flags [.], ack 18377, win 594, options [nop,nop,TS val 4294813073 ecr 57893,nop,nop,sack 2 {28373:29801}{22661:24089},mptcp dss ack 2129976870], length 0
21:12:59.354651 IP 112.26.0.1.40367 > 112.26.0.8.52644: Flags [.], seq 39797:41225, ack 1, win 1339, options [nop,nop,TS val 58793 ecr 4294812352,mptcp dss ack 3380555454 seq 2129998290 subseq 39797 len 1428 csum 0x34e2], length 1428
21:12:59.377645 IP 112.26.0.8.52644 > 112.26.0.1.40367: Flags [.], ack 18377, win 685, options [nop,nop,TS val 4294813563 ecr 57893,nop,nop,sack 2 {38369:39797}{34085:36941},mptcp dss ack 2129976870], length 0
21:12:59.442818 IP 112.26.0.8.52644 > 112.26.0.1.40367: Flags [.], ack 18377, win 708, options [nop,nop,TS val 4294813586 ecr 57893,nop,nop,sack 2 {38369:41225}{34085:36941},mptcp dss ack 2129976870], length 0
21:12:59.451874 IP 112.26.0.1.40367 > 112.26.0.8.52644: Flags [.], seq 41225:42653, ack 1, win 1339, options [nop,nop,TS val 58793 ecr 4294812352,mptcp dss ack 3380555454 seq 2129999718 subseq 41225 len 1428 csum 0x2e1b], length 1428
21:12:59.474785 IP 112.26.0.8.52644 > 112.26.0.1.40367: Flags [.], ack 18377, win 616, options [nop,nop,TS val 4294813250 ecr 57893,nop,nop,sack 2 {31229:32657}{28373:29801},mptcp dss ack 2129976870], length 0
21:12:59.544078 IP 112.26.0.8.52644 > 112.26.0.1.40367: Flags [.], ack 18377, win 639, options [nop,nop,TS val 4294813280 ecr 57893,nop,nop,sack 2 {34085:35513}{31229:32657},mptcp dss ack 2129976870], length 0
21:12:59.567297 IP 112.26.0.8.52644 > 112.26.0.1.40367: Flags [.], ack 18377, win 730, options [nop,nop,TS val 4294813775 ecr 57893,nop,nop,sack 2 {38369:42653}{34085:36941},mptcp dss ack 2129976870], length 0
21:12:59.575774 IP 112.26.0.1.40367 > 112.26.0.8.52644: Flags [.], seq 18377:19805, ack 1, win 1339, options [nop,nop,TS val 59306 ecr 4294812876,mptcp dss ack 3380555454 seq 2129976870 subseq 18377 len 1428 csum 0x3e82], length 1428
21:12:59.646494 IP 112.26.0.8.52644 > 112.26.0.1.40367: Flags [.], ack 18377, win 662, options [nop,nop,TS val 4294813372 ecr 57893,nop,nop,sack 2 {34085:36941}{31229:32657},mptcp dss ack 2129976870], length 0
21:12:59.664620 IP 112.26.0.8.52644 > 112.26.0.1.40367: Flags [.], ack 21233, win 753, options [nop,nop,TS val 4294813882 ecr 59306,nop,nop,sack 2 {38369:42653}{34085:36941},mptcp dss ack 2129979726], length 0
21:12:59.757707 IP 112.26.0.8.52644 > 112.26.0.1.40367: Flags [.], ack 18377, win 685, options [nop,nop,TS val 4294813563 ecr 57893,nop,nop,sack 2 {38369:39797}{34085:36941},mptcp dss ack 2129976870], length 0
21:12:59.836433 IP 112.26.0.1.40367 > 112.26.0.8.52644: Flags [.], seq 21233:22661, ack 1, win 1339, options [nop,nop,TS val 59613 ecr 4294813250,mptcp dss ack 3380555454 seq 2129979726 subseq 21233 len 1428 csum 0x4724], length 1428
21:12:59.853122 IP 112.26.0.8.52644 > 112.26.0.1.40367: Flags [.], ack 24089, win 776, options [nop,nop,TS val 4294814057 ecr 59613,nop,nop,sack 2 {38369:42653}{34085:36941},mptcp dss ack 2129982582], length 0
21:12:59.866574 IP 112.26.0.8.52644 > 112.26.0.1.40367: Flags [.], ack 18377, win 708, options [nop,nop,TS val 4294813586 ecr 57893,nop,nop,sack 2 {38369:41225}{34085:36941},mptcp dss ack 2129976870], length 0
21:13:00.040444 IP 112.26.0.1.40367 > 112.26.0.8.52644: Flags [.], seq 25517:26945, ack 1, win 1339, options [nop,nop,TS val 59792 ecr 4294813372,mptcp dss ack 3380555454 seq 2129984010 subseq 25517 len 1428 csum 0x558b], length 1428
21:13:00.044774 IP 112.26.0.8.52644 > 112.26.0.1.40367: Flags [.], ack 24089, win 799, options [nop,nop,TS val 4294814261 ecr 59613,nop,nop,sack 2 {25517:26945}{38369:42653},mptcp dss ack 2129982582], length 0
21:13:00.056345 IP 112.26.0.8.52644 > 112.26.0.1.40367: Flags [.], ack 18377, win 730, options [nop,nop,TS val 4294813775 ecr 57893,nop,nop,sack 2 {38369:42653}{34085:36941},mptcp dss ack 2129976870], length 0
21:13:00.141069 IP 112.26.0.8.52644 > 112.26.0.1.40367: Flags [.], ack 21233, win 753, options [nop,nop,TS val 4294813882 ecr 59306,nop,nop,sack 2 {38369:42653}{34085:36941},mptcp dss ack 2129979726], length 0
21:13:00.157443 IP 112.26.0.1.40367 > 112.26.0.8.52644: Flags [.], seq 26945:28373, ack 1, win 1339, options [nop,nop,TS val 59903 ecr 4294813563,mptcp dss ack 3380555454 seq 2129985438 subseq 26945 len 1428 csum 0xdb87], length 1428
21:13:00.163274 IP 112.26.0.8.52644 > 112.26.0.1.40367: Flags [.], ack 24089, win 822, options [nop,nop,TS val 4294814378 ecr 59613,nop,nop,sack 2 {25517:28373}{38369:42653},mptcp dss ack 2129982582], length 0
21:13:00.270721 IP 112.26.0.8.52644 > 112.26.0.1.40367: Flags [.], ack 24089, win 776, options [nop,nop,TS val 4294814057 ecr 59613,nop,nop,sack 2 {38369:42653}{34085:36941},mptcp dss ack 2129982582], length 0
21:13:00.343785 IP 112.26.0.1.40367 > 112.26.0.8.52644: Flags [.], seq 29801:31229, ack 1, win 1339, options [nop,nop,TS val 60012 ecr 4294813586,mptcp dss ack 3380555454 seq 2129988294 subseq 29801 len 1428 csum 0xd86], length 1428
21:13:00.347266 IP 112.26.0.8.52644 > 112.26.0.1.40367: Flags [.], ack 24089, win 845, options [nop,nop,TS val 4294814565 ecr 59613,nop,nop,sack 2 {29801:32657}{25517:28373},mptcp dss ack 2129982582], length 0
21:13:00.362678 IP 112.26.0.1.40367 > 112.26.0.8.52644: Flags [.], seq 32657:34085, ack 1, win 1339, options [nop,nop,TS val 60202 ecr 4294813775,mptcp dss ack 3380555454 seq 2129991150 subseq 32657 len 1428 csum 0x7c70], length 1428
21:13:00.443154 IP 112.26.0.8.52644 > 112.26.0.1.40367: Flags [.], ack 24089, win 867, options [nop,nop,TS val 4294814661 ecr 59613,nop,nop,sack 2 {29801:36941}{25517:28373},mptcp dss ack 2129982582], length 0
21:13:00.451101 IP 112.26.0.8.52644 > 112.26.0.1.40367: Flags [.], ack 24089, win 799, options [nop,nop,TS val 4294814261 ecr 59613,nop,nop,sack 2 {25517:26945}{38369:42653},mptcp dss ack 2129982582], length 0
21:13:00.469082 IP 112.26.0.1.40367 > 112.26.0.8.52644: Flags [.], seq 36941:38369, ack 1, win 1339, options [nop,nop,TS val 60286 ecr 4294813882,mptcp dss ack 3380555454 seq 2129995434 subseq 36941 len 1428 csum 0xe279], length 1428
21:13:00.554039 IP 112.26.0.8.52644 > 112.26.0.1.40367: Flags [.], ack 24089, win 890, options [nop,nop,TS val 4294814771 ecr 59613,nop,nop,sack 2 {29801:42653}{25517:28373},mptcp dss ack 2129982582], length 0
21:13:00.561501 IP 112.26.0.1.40367 > 112.26.0.8.52644: Flags [.], seq 42653:44081, ack 1, win 1339, options [nop,nop,TS val 60286 ecr 4294813882,mptcp dss ack 3380555454 seq 2130001146 subseq 42653 len 1428 csum 0x4db9], length 1428
21:13:00.643483 IP 112.26.0.1.40367 > 112.26.0.8.52644: Flags [.], seq 44081:45509, ack 1, win 1339, options [nop,nop,TS val 60286 ecr 4294813882,mptcp dss ack 3380555454 seq 2130002574 subseq 44081 len 1428 csum 0x3e5f], length 1428
21:13:00.651939 IP 112.26.0.8.52644 > 112.26.0.1.40367: Flags [.], ack 24089, win 822, options [nop,nop,TS val 4294814378 ecr 59613,nop,nop,sack 2 {25517:28373}{38369:42653},mptcp dss ack 2129982582], length 0
21:13:00.658269 IP 112.26.0.8.52644 > 112.26.0.1.40367: Flags [.], ack 24089, win 913, options [nop,nop,TS val 4294814875 ecr 59613,nop,nop,sack 2 {29801:44081}{25517:28373},mptcp dss ack 2129982582], length 0
21:13:00.667480 IP 112.26.0.1.40367 > 112.26.0.8.52644: Flags [.], seq 45509:46937, ack 1, win 1339, options [nop,nop,TS val 60416 ecr 4294814057,mptcp dss ack 3380555454 seq 2130004002 subseq 45509 len 1428 csum 0xcc04], length 1428
21:13:00.744758 IP 112.26.0.8.52644 > 112.26.0.1.40367: Flags [.], ack 24089, win 936, options [nop,nop,TS val 4294814960 ecr 59613,nop,nop,sack 2 {29801:45509}{25517:28373},mptcp dss ack 2129982582], length 0
21:13:00.761164 IP 112.26.0.1.40367 > 112.26.0.8.52644: Flags [.], seq 46937:48365, ack 1, win 1339, options [nop,nop,TS val 60416 ecr 4294814057,mptcp dss ack 3380555454 seq 2130005430 subseq 46937 len 1428 csum 0x1a9e], length 1428
21:13:00.769966 IP 112.26.0.8.52644 > 112.26.0.1.40367: Flags [.], ack 24089, win 959, options [nop,nop,TS val 4294814988 ecr 59613,nop,nop,sack 2 {29801:46937}{25517:28373},mptcp dss ack 2129982582], length 0
21:13:00.847080 IP 112.26.0.8.52644 > 112.26.0.1.40367: Flags [.], ack 24089, win 845, options [nop,nop,TS val 4294814565 ecr 59613,nop,nop,sack 2 {29801:32657}{25517:28373},mptcp dss ack 2129982582], length 0
21:13:00.866825 IP 112.26.0.1.40367 > 112.26.0.8.52644: Flags [.], seq 24089:25517, ack 1, win 1339, options [nop,nop,TS val 60597 ecr 4294814261,mptcp dss ack 3380555454 seq 2129982582 subseq 24089 len 1428 csum 0x3b8d], length 1428
21:13:00.870979 IP 112.26.0.8.52644 > 112.26.0.1.40367: Flags [.], ack 24089, win 981, options [nop,nop,TS val 4294815089 ecr 59613,nop,nop,sack 2 {29801:48365}{25517:28373},mptcp dss ack 2129982582], length 0
21:13:00.949867 IP 112.26.0.8.52644 > 112.26.0.1.40367: Flags [.], ack 24089, win 867, options [nop,nop,TS val 4294814661 ecr 59613,nop,nop,sack 2 {29801:36941}{25517:28373},mptcp dss ack 2129982582], length 0
21:13:00.965274 IP 112.26.0.8.52644 > 112.26.0.1.40367: Flags [.], ack 48365, win 1004, options [nop,nop,TS val 4294815179 ecr 60597,mptcp dss ack 2130006858], length 0
21:13:00.999882 IP 112.26.0.8.52644 > 112.26.0.1.40367: Flags [.], ack 24089, win 890, options [nop,nop,TS val 4294814771 ecr 59613,nop,nop,sack 2 {29801:42653}{25517:28373},mptcp dss ack 2129982582], length 0
21:13:01.074000 IP 112.26.0.8.52644 > 112.26.0.1.40367: Flags [.], ack 24089, win 913, options [nop,nop,TS val 4294814875 ecr 59613,nop,nop,sack 2 {29801:44081}{25517:28373},mptcp dss ack 2129982582], length 0
21:13:01.131432 IP 112.26.0.1.40367 > 112.26.0.8.52644: Flags [.], seq 48365:49793, ack 1, win 1339, options [nop,nop,TS val 60992 ecr 4294814378,mptcp dss ack 3380555454 seq 2130006858 subseq 48365 len 1428 csum 0xaca4], length 1428
21:13:01.136722 IP 112.26.0.8.52644 > 112.26.0.1.40367: Flags [.], ack 49793, win 1027, options [nop,nop,TS val 4294815353 ecr 60992,mptcp dss ack 2130008286], length 0
21:13:01.196741 IP 112.26.0.8.52644 > 112.26.0.1.40367: Flags [.], ack 24089, win 936, options [nop,nop,TS val 4294814960 ecr 59613,nop,nop,sack 2 {29801:45509}{25517:28373},mptcp dss ack 2129982582], length 0
21:13:01.241595 IP 112.26.0.8.52644 > 112.26.0.1.40367: Flags [.], ack 24089, win 959, options [nop,nop,TS val 4294814988 ecr 59613,nop,nop,sack 2 {29801:46937}{25517:28373},mptcp dss ack 2129982582], length 0
21:13:01.307285 IP 112.26.0.1.40367 > 112.26.0.8.52644: Flags [.], seq 49793:51221, ack 1, win 1339, options [nop,nop,TS val 61095 ecr 4294814565,mptcp dss ack 3380555454 seq 2130008286 subseq 49793 len 1428 csum 0x6855], length 1428
21:13:01.311913 IP 112.26.0.8.52644 > 112.26.0.1.40367: Flags [.], ack 51221, win 1734, options [nop,nop,TS val 4294815528 ecr 61095,mptcp dss ack 2130009714], length 0
21:13:01.388066 IP 112.26.0.1.40367 > 112.26.0.8.52644: Flags [.], seq 51221:52649, ack 1, win 1339, options [nop,nop,TS val 61145 ecr 4294814661,mptcp dss ack 3380555454 seq 2130009714 subseq 51221 len 1428 csum 0x36da], length 1428
21:13:01.453050 IP 112.26.0.8.52644 > 112.26.0.1.40367: Flags [.], ack 24089, win 981, options [nop,nop,TS val 4294815089 ecr 59613,nop,nop,sack 2 {29801:48365}{25517:28373},mptcp dss ack 2129982582], length 0
21:13:01.454174 IP 112.26.0.8.52644 > 112.26.0.1.40367: Flags [.], ack 52649, win 1757, options [nop,nop,TS val 4294815670 ecr 61145,mptcp dss ack 2130011142], length 0
21:13:01.509688 IP 112.26.0.8.52644 > 112.26.0.1.40367: Flags [.], ack 48365, win 1004, options [nop,nop,TS val 4294815179 ecr 60597,mptcp dss ack 2130006858], length 0
21:13:01.626487 IP 112.26.0.1.40367 > 112.26.0.8.52644: Flags [.], seq 52649:54077, ack 1, win 1339, options [nop,nop,TS val 61220 ecr 4294814771,mptcp dss ack 3380555454 seq 2130011142 subseq 52649 len 1428 csum 0x734e], length 1428
21:13:01.653134 IP 112.26.0.8.52644 > 112.26.0.1.40367: Flags [.], ack 54077, win 1848, options [nop,nop,TS val 4294815869 ecr 61220,mptcp dss ack 2130012570], length 0
21:13:01.719754 IP 112.26.0.8.52644 > 112.26.0.1.40367: Flags [.], ack 49793, win 1027, options [nop,nop,TS val 4294815353 ecr 60992,mptcp dss ack 2130008286], length 0
21:13:01.779346 IP 112.26.0.1.40367 > 112.26.0.8.52644: Flags [.], seq 54077:55505, ack 1, win 1339, options [nop,nop,TS val 61343 ecr 4294814875,mptcp dss ack 3380555454 seq 2130012570 subseq 54077 len 1428 csum 0x705a], length 1428
21:13:01.840148 IP 112.26.0.1.40367 > 112.26.0.8.52644: Flags [.], seq 55505:56933, ack 1, win 1339, options [nop,nop,TS val 61387 ecr 4294814960,mptcp dss ack 3380555454 seq 2130013998 subseq 55505 len 1428 csum 0xa854], length 1428
21:13:01.862835 IP 112.26.0.8.52644 > 112.26.0.1.40367: Flags [.], ack 55505, win 1985, options [nop,nop,TS val 4294816080 ecr 61343,mptcp dss ack 2130013998], length 0
21:13:01.925552 IP 112.26.0.1.40367 > 112.26.0.8.52644: Flags [.], seq 56933:58361, ack 1, win 1339, options [nop,nop,TS val 61436 ecr 4294814988,mptcp dss ack 3380555454 seq 2130015426 subseq 56933 len 1428 csum 0xbdde], length 1428
21:13:01.969696 IP 112.26.0.8.52644 > 112.26.0.1.40367: Flags [.], ack 51221, win 1734, options [nop,nop,TS val 4294815528 ecr 61095,mptcp dss ack 2130009714], length 0
21:13:01.992557 IP 112.26.0.8.52644 > 112.26.0.1.40367: Flags [.], ack 56933, win 2031, options [nop,nop,TS val 4294816204 ecr 61387,mptcp dss ack 2130015426], length 0
21:13:02.044484 IP 112.26.0.1.40367 > 112.26.0.8.52644: Flags [.], seq 58361:59789, ack 1, win 4017, options [nop,nop,TS val 61656 ecr 4294815089,mptcp dss ack 3380555454 seq 2130049698 subseq 58361 len 1428 csum 0x8002], length 1428
21:13:02.114660 IP 112.26.0.8.52644 > 112.26.0.1.40367: Flags [.], ack 52649, win 1757, options [nop,nop,TS val 4294815670 ecr 61145,mptcp dss ack 2130011142], length 0
21:13:02.139532 IP 112.26.0.8.52644 > 112.26.0.1.40367: Flags [.], ack 58361, win 2145, options [nop,nop,TS val 4294816357 ecr 61436,mptcp dss ack 2130022566], length 0
21:13:02.250105 IP 112.26.0.1.40367 > 112.26.0.8.52644: Flags [.], seq 59789:61217, ack 1, win 4017, options [nop,nop,TS val 61656 ecr 4294815179,mptcp dss ack 3380555454 seq 2130051126 subseq 59789 len 1428 csum 0x13d5], length 1428
21:13:02.268415 IP 112.26.0.8.52644 > 112.26.0.1.40367: Flags [.], ack 59789, win 2190, options [nop,nop,TS val 4294816485 ecr 61656,mptcp dss ack 2130022566], length 0
21:13:02.325627 IP 112.26.0.1.40367 > 112.26.0.8.52644: Flags [.], seq 61217:62645, ack 1, win 4017, options [nop,nop,TS val 61656 ecr 4294815179,mptcp dss ack 3380555454 seq 2130052554 subseq 61217 len 1428 csum 0x9cb7], length 1428
21:13:02.391092 IP 112.26.0.8.52644 > 112.26.0.1.40367: Flags [.], ack 54077, win 1848, options [nop,nop,TS val 4294815869 ecr 61220,mptcp dss ack 2130012570], length 0
21:13:02.505445 IP 112.26.0.1.40367 > 112.26.0.8.52644: Flags [.], seq 62645:64073, ack 1, win 4017, options [nop,nop,TS val 61865 ecr 4294815353,mptcp dss ack 3380555454 seq 2130053982 subseq 62645 len 1428 csum 0xbe27], length 1428
21:13:02.548720 IP 112.26.0.8.52644 > 112.26.0.1.40367: Flags [.], ack 61217, win 2350, options [nop,nop,TS val 4294816766 ecr 61656,mptcp dss ack 2130025422], length 0
21:13:02.609532 IP 112.26.0.1.40367 > 112.26.0.8.52644: Flags [.], seq 64073:65501, ack 1, win 4017, options [nop,nop,TS val 62115 ecr 4294815528,mptcp dss ack 3380555454 seq 2130072546 subseq 64073 len 1428 csum 0xe8ee], length 1428
21:13:02.667593 IP 112.26.0.8.52644 > 112.26.0.1.40367: Flags [.], ack 55505, win 1985, options [nop,nop,TS val 4294816080 ecr 61343,mptcp dss ack 2130013998], length 0
21:13:02.690602 IP 112.26.0.8.52644 > 112.26.0.1.40367: Flags [.], ack 62645, win 2441, options [nop,nop,TS val 4294816908 ecr 61656,mptcp dss ack 2130026850], length 0
21:13:02.762356 IP 112.26.0.8.52644 > 112.26.0.1.40367: Flags [.], ack 64073, win 2487, options [nop,nop,TS val 4294816971 ecr 61865,mptcp dss ack 2130028278], length 0
21:13:02.820097 IP 112.26.0.1.40367 > 112.26.0.8.52644: Flags [.], seq 65501:66929, ack 1, win 4017, options [nop,nop,TS val 62260 ecr 4294815670,mptcp dss ack 3380555454 seq 2130073974 subseq 65501 len 1428 csum 0x97b7], length 1428
21:13:02.872231 IP 112.26.0.8.52644 > 112.26.0.1.40367: Flags [.], ack 65501, win 2578, options [nop,nop,TS val 4294817090 ecr 62115,mptcp dss ack 2130029706], length 0
21:13:02.911870 IP 112.26.0.1.40367 > 112.26.0.8.52644: Flags [.], seq 66929:68357, ack 1, win 4017, options [nop,nop,TS val 62536 ecr 4294815869,mptcp dss ack 3380555454 seq 2130083970 subseq 66929 len 1428 csum 0xab3d], length 1428
21:13:03.027234 IP 112.26.0.8.52644 > 112.26.0.1.40367: Flags [.], ack 58361, win 2145, options [nop,nop,TS val 4294816357 ecr 61436,mptcp dss ack 2130022566], length 0
21:13:03.074446 IP 112.26.0.8.52644 > 112.26.0.1.40367: Flags [.], ack 66929, win 2692, options [nop,nop,TS val 4294817291 ecr 62260,mptcp dss ack 2130046842], length 0
21:13:03.132387 IP 112.26.0.1.40367 > 112.26.0.8.52644: Flags [.], seq 68357:69785, ack 1, win 4017, options [nop,nop,TS val 62536 ecr 4294815869,mptcp dss ack 3380555454 seq 2130085398 subseq 68357 len 1428 csum 0x2507], length 1428
21:13:03.225083 IP 112.26.0.8.52644 > 112.26.0.1.40367: Flags [.], ack 68357, win 2784, options [nop,nop,TS val 4294817441 ecr 62536,mptcp dss ack 2130046842], length 0
21:13:03.255237 IP 112.26.0.8.52644 > 112.26.0.1.40367: Flags [.], ack 59789, win 2190, options [nop,nop,TS val 4294816485 ecr 61656,mptcp dss ack 2130022566], length 0
21:13:03.323851 IP 112.26.0.1.40367 > 112.26.0.8.52644: Flags [.], seq 69785:71213, ack 1, win 4017, options [nop,nop,TS val 62813 ecr 4294816080,mptcp dss ack 3380555454 seq 2130098250 subseq 69785 len 1428 csum 0x9731], length 1428
21:13:03.371386 IP 112.26.0.8.52644 > 112.26.0.1.40367: Flags [.], ack 61217, win 2350, options [nop,nop,TS val 4294816766 ecr 61656,mptcp dss ack 2130025422], length 0
21:13:03.404786 IP 112.26.0.8.52644 > 112.26.0.1.40367: Flags [.], ack 62645, win 2441, options [nop,nop,TS val 4294816908 ecr 61656,mptcp dss ack 2130026850], length 0
21:13:03.421212 IP 112.26.0.8.52644 > 112.26.0.1.40367: Flags [.], ack 69785, win 2898, options [nop,nop,TS val 4294817634 ecr 62536,mptcp dss ack 2130046842], length 0
21:13:03.491655 IP 112.26.0.1.40367 > 112.26.0.8.52644: Flags [.], seq 71213:72641, ack 1, win 4017, options [nop,nop,TS val 63148 ecr 4294816357,mptcp dss ack 3380555454 seq 2130113958 subseq 71213 len 1428 csum 0x7a1f], length 1428
21:13:03.552323 IP 112.26.0.8.52644 > 112.26.0.1.40367: Flags [.], ack 64073, win 2487, options [nop,nop,TS val 4294816971 ecr 61865,mptcp dss ack 2130028278], length 0
21:13:03.573972 IP 112.26.0.8.52644 > 112.26.0.1.40367: Flags [.], ack 71213, win 2989, options [nop,nop,TS val 4294817791 ecr 62813,mptcp dss ack 2130046842], length 0
21:13:03.631223 IP 112.26.0.1.40367 > 112.26.0.8.52644: Flags [.], seq 72641:74069, ack 1, win 4017, options [nop,nop,TS val 63148 ecr 4294816357,mptcp dss ack 3380555454 seq 2130115386 subseq 72641 len 1428 csum 0x8dc9], length 1428
21:13:03.703920 IP 112.26.0.8.52644 > 112.26.0.1.40367: Flags [.], ack 65501, win 2578, options [nop,nop,TS val 4294817090 ecr 62115,mptcp dss ack 2130029706], length 0
21:13:03.799489 IP 112.26.0.1.40367 > 112.26.0.8.52644: Flags [.], seq 74069:75497, ack 1, win 4017, options [nop,nop,TS val 63401 ecr 4294816485,mptcp dss ack 3380555454 seq 2130125382 subseq 74069 len 1428 csum 0xfb39], length 1428
21:13:03.838989 IP 112.26.0.8.52644 > 112.26.0.1.40367: Flags [.], ack 72641, win 3080, options [nop,nop,TS val 4294818051 ecr 63148,mptcp dss ack 2130046842], length 0
21:13:03.879871 IP 112.26.0.8.52644 > 112.26.0.1.40367: Flags [.], ack 66929, win 2692, options [nop,nop,TS val 4294817291 ecr 62260,mptcp dss ack 2130046842], length 0
21:13:03.973522 IP 112.26.0.1.40367 > 112.26.0.8.52644: Flags [.], seq 75497:76925, ack 1, win 4017, options [nop,nop,TS val 63517 ecr 4294816766,mptcp dss ack 3380555454 seq 2130132522 subseq 75497 len 1428 csum 0xfb14], length 1428
21:13:04.002883 IP 112.26.0.8.52644 > 112.26.0.1.40367: Flags [.], ack 74069, win 3194, options [nop,nop,TS val 4294818219 ecr 63148,mptcp dss ack 2130046842], length 0
21:13:04.040857 IP 112.26.0.1.40367 > 112.26.0.8.52644: Flags [.], seq 76925:78353, ack 1, win 4017, options [nop,nop,TS val 63550 ecr 4294816908,mptcp dss ack 3380555454 seq 2130136806 subseq 76925 len 1428 csum 0x4994], length 1428
21:13:04.095988 IP 112.26.0.8.52644 > 112.26.0.1.40367: Flags [.], ack 75497, win 3263, options [nop,nop,TS val 4294818313 ecr 63401,mptcp dss ack 2130046842], length 0
21:13:04.127423 IP 112.26.0.8.52644 > 112.26.0.1.40367: Flags [.], ack 68357, win 2784, options [nop,nop,TS val 4294817441 ecr 62536,mptcp dss ack 2130046842], length 0
21:13:04.181927 IP 112.26.0.1.40367 > 112.26.0.8.52644: Flags [.], seq 78353:79781, ack 1, win 4017, options [nop,nop,TS val 63698 ecr 4294816971,mptcp dss ack 3380555454 seq 2130141090 subseq 78353 len 1428 csum 0x795b], length 1428
21:13:04.270761 IP 112.26.0.8.52644 > 112.26.0.1.40367: Flags [.], ack 76925, win 3400, options [nop,nop,TS val 4294818488 ecr 63517,mptcp dss ack 2130046842], length 0
21:13:04.327732 IP 112.26.0.1.40367 > 112.26.0.8.52644: Flags [.], seq 79781:81209, ack 1, win 4017, options [nop,nop,TS val 63849 ecr 4294817090,mptcp dss ack 3380555454 seq 2130146802 subseq 79781 len 1428 csum 0x5771], length 1428
21:13:04.413567 IP 112.26.0.8.52644 > 112.26.0.1.40367: Flags [.], ack 69785, win 2898, options [nop,nop,TS val 4294817634 ecr 62536,mptcp dss ack 2130046842], length 0
21:13:04.433234 IP 112.26.0.8.52644 > 112.26.0.1.40367: Flags [.], ack 78353, win 3468, options [nop,nop,TS val 4294818647 ecr 63550,mptcp dss ack 2130046842], length 0
21:13:04.584605 IP 112.26.0.1.40367 > 112.26.0.8.52644: Flags [.], seq 82637:84065, ack 1, win 4017, options [nop,nop,TS val 64025 ecr 4294817291,mptcp dss ack 3380555454 seq 2130161082 subseq 82637 len 1428 csum 0x6cb3], length 1428
21:13:04.653312 IP 112.26.0.8.52644 > 112.26.0.1.40367: Flags [.], ack 79781, win 3559, options [nop,nop,TS val 4294818828 ecr 63698,mptcp dss ack 2130069690], length 0
21:13:04.659998 IP 112.26.0.1.40367 > 112.26.0.8.52644: Flags [.], seq 84065:85493, ack 1, win 4017, options [nop,nop,TS val 64273 ecr 4294817441,mptcp dss ack 3380555454 seq 2130171078 subseq 84065 len 1428 csum 0xab82], length 1428
21:13:04.733027 IP 112.26.0.8.52644 > 112.26.0.1.40367: Flags [.], ack 81209, win 3650, options [nop,nop,TS val 4294818944 ecr 63849,mptcp dss ack 2130069690], length 0
21:13:04.739381 IP 112.26.0.8.52644 > 112.26.0.1.40367: Flags [.], ack 72641, win 3080, options [nop,nop,TS val 4294818051 ecr 63148,mptcp dss ack 2130046842], length 0
21:13:04.886150 IP 112.26.0.8.52644 > 112.26.0.1.40367: Flags [.], ack 81209, win 3765, options [nop,nop,TS val 4294819103 ecr 63849,nop,nop,sack 1 {82637:84065},mptcp dss ack 2130069690], length 0
21:13:04.906168 IP 112.26.0.8.52644 > 112.26.0.1.40367: Flags [.], ack 74069, win 3194, options [nop,nop,TS val 4294818219 ecr 63148,mptcp dss ack 2130046842], length 0
21:13:04.955340 IP 112.26.0.1.40367 > 112.26.0.8.52644: Flags [.], seq 85493:86921, ack 1, win 4017, options [nop,nop,TS val 64559 ecr 4294817634,mptcp dss ack 3380555454 seq 2130172506 subseq 85493 len 1428 csum 0x85], length 1428
21:13:05.006900 IP 112.26.0.8.52644 > 112.26.0.1.40367: Flags [.], ack 81209, win 3833, options [nop,nop,TS val 4294819224 ecr 63849,nop,nop,sack 1 {82637:85493},mptcp dss ack 2130075402], length 0
21:13:05.126749 IP 112.26.0.1.40367 > 112.26.0.8.52644: Flags [.], seq 86921:88349, ack 1, win 4017, options [nop,nop,TS val 64559 ecr 4294817634,mptcp dss ack 3380555454 seq 2130173934 subseq 86921 len 1428 csum 0x6239], length 1428
21:13:05.150391 IP 112.26.0.8.52644 > 112.26.0.1.40367: Flags [.], ack 75497, win 3263, options [nop,nop,TS val 4294818313 ecr 63401,mptcp dss ack 2130046842], length 0
21:13:05.202120 IP 112.26.0.8.52644 > 112.26.0.1.40367: Flags [.], ack 81209, win 3947, options [nop,nop,TS val 4294819420 ecr 63849,nop,nop,sack 1 {82637:86921},mptcp dss ack 2130096822], length 0
21:13:05.309524 IP 112.26.0.8.52644 > 112.26.0.1.40367: Flags [.], ack 81209, win 4015, options [nop,nop,TS val 4294819526 ecr 63849,nop,nop,sack 1 {82637:88349},mptcp dss ack 2130099678], length 0
21:13:05.327688 IP 112.26.0.8.52644 > 112.26.0.1.40367: Flags [.], ack 76925, win 3400, options [nop,nop,TS val 4294818488 ecr 63517,mptcp dss ack 2130046842], length 0
21:13:05.412902 IP 112.26.0.1.40367 > 112.26.0.8.52644: Flags [.], seq 88349:89777, ack 1, win 4017, options [nop,nop,TS val 64885 ecr 4294818051,mptcp dss ack 3380555454 seq 2130175362 subseq 88349 len 1428 csum 0xec5], length 1428
21:13:05.465393 IP 112.26.0.1.40367 > 112.26.0.8.52644: Flags [.], seq 89777:91205, ack 1, win 4017, options [nop,nop,TS val 64885 ecr 4294818051,mptcp dss ack 3380555454 seq 2130176790 subseq 89777 len 1428 csum 0x32e1], length 1428
21:13:05.521316 IP 112.26.0.8.52644 > 112.26.0.1.40367: Flags [.], ack 81209, win 4107, options [nop,nop,TS val 4294819738 ecr 63849,nop,nop,sack 1 {82637:89777},mptcp dss ack 2130099678], length 0
21:13:05.536678 IP 112.26.0.8.52644 > 112.26.0.1.40367: Flags [.], ack 78353, win 3468, options [nop,nop,TS val 4294818647 ecr 63550,mptcp dss ack 2130046842], length 0
21:13:05.605563 IP 112.26.0.8.52644 > 112.26.0.1.40367: Flags [.], ack 81209, win 4152, options [nop,nop,TS val 4294819804 ecr 63849,nop,nop,sack 1 {82637:91205},mptcp dss ack 2130099678], length 0
21:13:05.625943 IP 112.26.0.8.52644 > 112.26.0.1.40367: Flags [.], ack 79781, win 3559, options [nop,nop,TS val 4294818828 ecr 63698,mptcp dss ack 2130069690], length 0
21:13:05.678121 IP 112.26.0.1.40367 > 112.26.0.8.52644: Flags [.], seq 92633:94061, ack 1, win 4017, options [nop,nop,TS val 65052 ecr 4294818219,mptcp dss ack 3380555454 seq 2130181074 subseq 92633 len 1428 csum 0x9acc], length 1428
21:13:05.746699 IP 112.26.0.8.52644 > 112.26.0.1.40367: Flags [.], ack 81209, win 4266, options [nop,nop,TS val 4294819964 ecr 63849,nop,nop,sack 2 {92633:94061}{82637:91205},mptcp dss ack 2130103962], length 0
21:13:05.773756 IP 112.26.0.8.52644 > 112.26.0.1.40367: Flags [.], ack 81209, win 3765, options [nop,nop,TS val 4294819103 ecr 63849,nop,nop,sack 1 {82637:84065},mptcp dss ack 2130069690], length 0
21:13:05.900524 IP 112.26.0.1.40367 > 112.26.0.8.52644: Flags [.], seq 95489:96917, ack 1, win 4017, options [nop,nop,TS val 65296 ecr 4294818313,mptcp dss ack 3380555454 seq 2130195354 subseq 95489 len 1428 csum 0x7d72], length 1428
21:13:05.927152 IP 112.26.0.8.52644 > 112.26.0.1.40367: Flags [.], ack 81209, win 4403, options [nop,nop,TS val 4294820145 ecr 63849,nop,nop,sack 2 {95489:96917}{92633:94061},mptcp dss ack 2130131094], length 0
