21:12:56.215728 IP 112.26.0.8.52644 > 112.26.0.1.40367: Flags [S], seq 1762923967, win 29200, options [mss 1460,sackOK,TS val 4294808243 ecr 0,nop,wscale 7,mptcp capable csum {0x1f312c6106806263}], length 0
21:12:56.318932 IP 112.26.0.8.52644 > 112.26.0.1.40367: Flags [S], seq 1762923967, win 29200, options [mss 1460,sackOK,TS val 4294808243 ecr 0,nop,wscale 7,mptcp capable csum {0x1f312c6106806263}], length 0
21:12:56.331011 IP 112.26.0.8.52644 > 112.26.0.1.40367: Flags [S], seq 1762923967, win 29200, options [mss 1460,sackOK,TS val 4294808243 ecr 0,nop,wscale 7,mptcp capable csum {0x1f312c6106806263}], length 0
21:12:56.435289 IP 112.26.0.1.40367 > 112.26.0.8.52644: Flags [S.], seq 1210547265, ack 1762923968, win 65535, options [mss 1460,sackOK,TS val 56479 ecr 4294808243,nop,wscale 6,mptcp capable csum {0x182a048e31f8618d}], length 0
21:12:56.523960 IP 112.26.0.1.40367 > 112.26.0.8.52644: Flags [S.], seq 1210547265, ack 1762923968, win 65535, options [mss 1460,sackOK,TS val 56479 ecr 4294808243,nop,wscale 6,mptcp capable csum {0x182a048e31f8618d}], length 0
21:12:56.535761 IP 112.26.0.8.52644 > 112.26.0.1.40367: Flags [.], ack 1, win 229, options [nop,nop,TS val 4294810743 ecr 56479,mptcp capable csum {0x1f312c6106806263,0x182a048e31f8618d},mptcp dss ack 2129958494], length 0
21:12:56.616937 IP 112.26.0.8.52644 > 112.26.0.1.40367: Flags [.], ack 1, win 229, options [nop,nop,TS val 4294810743 ecr 56479,mptcp add-addr id 3 112.26.1.8,mptcp dss ack 2129958494], length 0
21:12:56.623865 IP 112.26.0.8.52644 > 112.26.0.1.40367: Flags [.], ack 1, win 229, options [nop,nop,TS val 4294810743 ecr 56479,mptcp add-addr id 4 112.26.2.8,mptcp dss ack 2129958494], length 0
21:12:56.631762 IP 112.26.0.8.52644 > 112.26.0.1.40367: Flags [.], ack 1, win 229, options [nop,nop,TS val 4294810743 ecr 56479,mptcp add-addr id 6 112.26.3.8,mptcp dss ack 2129958494], length 0
21:12:56.639009 IP 112.26.0.8.52644 > 112.26.0.1.40367: Flags [.], ack 1, win 229, options [nop,nop,TS val 4294810743 ecr 56479,mptcp capable csum {0x1f312c6106806263,0x182a048e31f8618d},mptcp dss ack 2129958494], length 0
21:12:56.642199 IP 112.26.0.8.52644 > 112.26.0.1.40367: Flags [.], ack 1, win 229, options [nop,nop,TS val 4294810743 ecr 56479,mptcp capable csum {0x1f312c6106806263,0x182a048e31f8618d},mptcp dss ack 2129958494], length 0
21:12:56.734448 IP 112.26.0.8.52644 > 112.26.0.1.40367: Flags [.], ack 1, win 229, options [nop,nop,TS val 4294810743 ecr 56479,mptcp add-addr id 3 112.26.1.8,mptcp dss ack 2129958494], length 0
21:12:56.738659 IP 112.26.0.1.40367 > 112.26.0.8.52644: Flags [.], ack 1, win 1339, options [nop,nop,TS val 56786 ecr 4294810743,mptcp add-addr id 3 112.26.1.1,mptcp dss ack 3380555454], length 0
21:12:56.749508 IP 112.26.0.8.52644 > 112.26.0.1.40367: Flags [.], ack 1, win 229, options [nop,nop,TS val 4294810743 ecr 56479,mptcp add-addr id 4 112.26.2.8,mptcp dss ack 2129958494], length 0
21:12:56.830775 IP 112.26.0.8.52644 > 112.26.0.1.40367: Flags [.], ack 1, win 229, options [nop,nop,TS val 4294810743 ecr 56479,mptcp add-addr id 6 112.26.3.8,mptcp dss ack 2129958494], length 0
21:12:56.851486 IP 112.26.0.1.40367 > 112.26.0.8.52644: Flags [.], ack 1, win 1339, options [nop,nop,TS val 56786 ecr 4294810743,mptcp add-addr id 4 112.26.2.1,mptcp dss ack 3380555454], length 0
21:12:56.918235 IP 112.26.0.1.40367 > 112.26.0.8.52644: Flags [.], ack 1, win 1339, options [nop,nop,TS val 56786 ecr 4294810743,mptcp add-addr id 3 112.26.1.1,mptcp dss ack 3380555454], length 0
21:12:56.928937 IP 112.26.0.8.52644 > 112.26.0.1.40367: Flags [.], ack 1, win 229, options [nop,nop,TS val 4294810743 ecr 56479,mptcp add-addr id 3 112.26.1.8,mptcp dss ack 2129958494], length 0
21:12:56.935506 IP 112.26.0.1.40367 > 112.26.0.8.52644: Flags [.], ack 1, win 1339, options [nop,nop,TS val 56786 ecr 4294810743,mptcp add-addr id 4 112.26.2.1,mptcp dss ack 3380555454], length 0
21:12:56.947589 IP 112.26.0.1.40367 > 112.26.0.8.52644: Flags [.], ack 1, win 1339, options [nop,nop,TS val 56786 ecr 4294810743,mptcp add-addr id 5 112.26.3.1,mptcp dss ack 3380555454], length 0
21:12:56.950812 IP 112.26.0.1.40367 > 112.26.0.8.52644: Flags [.], ack 1, win 1339, options [nop,nop,TS val 56786 ecr 4294810743,mptcp add-addr id 5 112.26.3.1,mptcp dss ack 3380555454], length 0
21:12:57.027626 IP 112.26.0.8.52644 > 112.26.0.1.40367: Flags [.], ack 1, win 229, options [nop,nop,TS val 4294810743 ecr 56479,mptcp add-addr id 4 112.26.2.8,mptcp dss ack 2129958494], length 0
21:12:57.123009 IP 112.26.0.1.40367 > 112.26.0.8.52644: Flags [.], seq 1:1429, ack 1, win 1339, options [nop,nop,TS val 56797 ecr 4294810743,mptcp dss ack 3380555454 seq 2129958494 subseq 1 len 1428 csum 0x9d1], length 1428
21:12:57.129321 IP 112.26.0.1.40367 > 112.26.0.8.52644: Flags [.], seq 1:1429, ack 1, win 1339, options [nop,nop,TS val 56797 ecr 4294810743,mptcp dss ack 3380555454 seq 2129958494 subseq 1 len 1428 csum 0x9d1], length 1428
21:12:57.133557 IP 112.26.0.8.52644 > 112.26.0.1.40367: Flags [.], ack 1429, win 251, options [nop,nop,TS val 4294811345 ecr 56797,mptcp dss ack 2129959922], length 0
21:12:57.142646 IP 112.26.0.8.52644 > 112.26.0.1.40367: Flags [.], ack 1, win 229, options [nop,nop,TS val 4294810743 ecr 56479,mptcp add-addr id 6 112.26.3.8,mptcp dss ack 2129958494], length 0
21:12:57.154953 IP 112.26.0.8.52644 > 112.26.0.1.40367: Flags [.], ack 1429, win 251, options [nop,nop,TS val 4294811345 ecr 56797,mptcp dss ack 2129959922], length 0
21:12:57.227569 IP 112.26.0.1.40367 > 112.26.0.8.52644: Flags [.], seq 1429:2857, ack 1, win 1339, options [nop,nop,TS val 56797 ecr 4294810743,mptcp dss ack 3380555454 seq 2129959922 subseq 1429 len 1428 csum 0x291f], length 1428
21:12:57.239137 IP 112.26.0.1.40367 > 112.26.0.8.52644: Flags [P.], seq 2857:4097, ack 1, win 1339, options [nop,nop,TS val 56798 ecr 4294810743,mptcp dss ack 3380555454 seq 2129961350 subseq 2857 len 1240 csum 0x69f1], length 1240
21:12:57.250224 IP 112.26.0.1.40367 > 112.26.0.8.52644: Flags [.], seq 1429:2857, ack 1, win 1339, options [nop,nop,TS val 56797 ecr 4294810743,mptcp dss ack 3380555454 seq 2129959922 subseq 1429 len 1428 csum 0x291f], length 1428
21:12:57.251633 IP 112.26.0.8.52644 > 112.26.0.1.40367: Flags [.], ack 2857, win 274, options [nop,nop,TS val 4294811470 ecr 56797,mptcp dss ack 2129961350], length 0
21:12:57.326772 IP 112.26.0.1.40367 > 112.26.0.8.52644: Flags [P.], seq 2857:4097, ack 1, win 1339, options [nop,nop,TS val 56798 ecr 4294810743,mptcp dss ack 3380555454 seq 2129961350 subseq 2857 len 1240 csum 0x69f1], length 1240
21:12:57.336549 IP 112.26.0.8.52644 > 112.26.0.1.40367: Flags [.], ack 4097, win 297, options [nop,nop,TS val 4294811546 ecr 56798,mptcp dss ack 2129962590], length 0
21:12:57.344587 IP 112.26.0.1.40367 > 112.26.0.8.52644: Flags [.], seq 4097:5525, ack 1, win 1339, options [nop,nop,TS val 56798 ecr 4294810743,mptcp dss ack 3380555454 seq 2129962590 subseq 4097 len 1428 csum 0x5e2a], length 1428
21:12:57.348620 IP 112.26.0.8.52644 > 112.26.0.1.40367: Flags [.], ack 2857, win 274, options [nop,nop,TS val 4294811470 ecr 56797,mptcp dss ack 2129961350], length 0
21:12:57.432521 IP 112.26.0.8.52644 > 112.26.0.1.40367: Flags [.], ack 4097, win 297, options [nop,nop,TS val 4294811546 ecr 56798,mptcp dss ack 2129962590], length 0
21:12:57.435419 IP 112.26.0.1.40367 > 112.26.0.8.52644: Flags [.], seq 5525:6953, ack 1, win 1339, options [nop,nop,TS val 56798 ecr 4294810743,mptcp dss ack 3380555454 seq 2129964018 subseq 5525 len 1428 csum 0xba9f], length 1428
21:12:57.445175 IP 112.26.0.1.40367 > 112.26.0.8.52644: Flags [.], seq 6953:8381, ack 1, win 1339, options [nop,nop,TS val 56798 ecr 4294810743,mptcp dss ack 3380555454 seq 2129965446 subseq 6953 len 1428 csum 0x546c], length 1428
21:12:57.450223 IP 112.26.0.1.40367 > 112.26.0.8.52644: Flags [.], seq 4097:5525, ack 1, win 1339, options [nop,nop,TS val 56798 ecr 4294810743,mptcp dss ack 3380555454 seq 2129962590 subseq 4097 len 1428 csum 0x5e2a], length 1428
21:12:57.451780 IP 112.26.0.8.52644 > 112.26.0.1.40367: Flags [.], ack 5525, win 320, options [nop,nop,TS val 4294811669 ecr 56798,mptcp dss ack 2129964018], length 0
21:12:57.531649 IP 112.26.0.1.40367 > 112.26.0.8.52644: Flags [.], seq 5525:6953, ack 1, win 1339, options [nop,nop,TS val 56798 ecr 4294810743,mptcp dss ack 3380555454 seq 2129964018 subseq 5525 len 1428 csum 0xba9f], length 1428
21:12:57.539563 IP 112.26.0.1.40367 > 112.26.0.8.52644: Flags [.], seq 8381:9809, ack 1, win 1339, options [nop,nop,TS val 56798 ecr 4294810743,mptcp dss ack 3380555454 seq 2129966874 subseq 8381 len 1428 csum 0x23fe], length 1428
21:12:57.540479 IP 112.26.0.8.52644 > 112.26.0.1.40367: Flags [.], ack 6953, win 343, options [nop,nop,TS val 4294811751 ecr 56798,mptcp dss ack 2129965446], length 0
21:12:57.549159 IP 112.26.0.1.40367 > 112.26.0.8.52644: Flags [.], seq 9809:11237, ack 1, win 1339, options [nop,nop,TS val 56798 ecr 4294810743,mptcp dss ack 3380555454 seq 2129968302 subseq 9809 len 1428 csum 0x1c6a], length 1428
21:12:57.550948 IP 112.26.0.1.40367 > 112.26.0.8.52644: Flags [.], seq 6953:8381, ack 1, win 1339, options [nop,nop,TS val 56798 ecr 4294810743,mptcp dss ack 3380555454 seq 2129965446 subseq 6953 len 1428 csum 0x546c], length 1428
21:12:57.553109 IP 112.26.0.8.52644 > 112.26.0.1.40367: Flags [.], ack 8381, win 365, options [nop,nop,TS val 4294811770 ecr 56798,mptcp dss ack 2129966874], length 0
21:12:57.635488 IP 112.26.0.8.52644 > 112.26.0.1.40367: Flags [.], ack 1429, win 251, options [nop,nop,TS val 4294811345 ecr 56797,mptcp dss ack 2129959922], length 0
21:12:57.640639 IP 112.26.0.8.52644 > 112.26.0.1.40367: Flags [.], ack 5525, win 320, options [nop,nop,TS val 4294811669 ecr 56798,mptcp dss ack 2129964018], length 0
21:12:57.651715 IP 112.26.0.1.40367 > 112.26.0.8.52644: Flags [.], seq 11237:12665, ack 1, win 1339, options [nop,nop,TS val 56798 ecr 4294810743,mptcp dss ack 3380555454 seq 2129969730 subseq 11237 len 1428 csum 0x4bf0], length 1428
21:12:57.724224 IP 112.26.0.1.40367 > 112.26.0.8.52644: Flags [.], seq 8381:9809, ack 1, win 1339, options [nop,nop,TS val 56798 ecr 4294810743,mptcp dss ack 3380555454 seq 2129966874 subseq 8381 len 1428 csum 0x23fe], length 1428
21:12:57.726245 IP 112.26.0.8.52644 > 112.26.0.1.40367: Flags [.], ack 9809, win 388, options [nop,nop,TS val 4294811943 ecr 56798,mptcp dss ack 2129968302], length 0
21:12:57.746758 IP 112.26.0.8.52644 > 112.26.0.1.40367: Flags [.], ack 2857, win 274, options [nop,nop,TS val 4294811470 ecr 56797,mptcp dss ack 2129961350], length 0
21:12:57.827121 IP 112.26.0.8.52644 > 112.26.0.1.40367: Flags [.], ack 6953, win 343, options [nop,nop,TS val 4294811751 ecr 56798,mptcp dss ack 2129965446], length 0
21:12:57.854730 IP 112.26.0.1.40367 > 112.26.0.8.52644: Flags [.], seq 9809:11237, ack 1, win 1339, options [nop,nop,TS val 56798 ecr 4294810743,mptcp dss ack 3380555454 seq 2129968302 subseq 9809 len 1428 csum 0x1c6a], length 1428
21:12:57.856291 IP 112.26.0.8.52644 > 112.26.0.1.40367: Flags [.], ack 11237, win 411, options [nop,nop,TS val 4294812074 ecr 56798,mptcp dss ack 2129969730], length 0
21:12:57.863638 IP 112.26.0.8.52644 > 112.26.0.1.40367: Flags [.], ack 4097, win 297, options [nop,nop,TS val 4294811546 ecr 56798,mptcp dss ack 2129962590], length 0
21:12:57.925848 IP 112.26.0.8.52644 > 112.26.0.1.40367: Flags [.], ack 8381, win 365, options [nop,nop,TS val 4294811770 ecr 56798,mptcp dss ack 2129966874], length 0
21:12:57.945767 IP 112.26.0.1.40367 > 112.26.0.8.52644: Flags [.], seq 11237:12665, ack 1, win 1339, options [nop,nop,TS val 56798 ecr 4294810743,mptcp dss ack 3380555454 seq 2129969730 subseq 11237 len 1428 csum 0x4bf0], length 1428
21:12:57.947391 IP 112.26.0.8.52644 > 112.26.0.1.40367: Flags [.], ack 12665, win 434, options [nop,nop,TS val 4294812165 ecr 56798,mptcp dss ack 2129971158], length 0
21:12:57.961133 IP 112.26.0.8.52644 > 112.26.0.1.40367: Flags [.], ack 9809, win 388, options [nop,nop,TS val 4294811943 ecr 56798,mptcp dss ack 2129968302], length 0
21:12:58.030054 IP 112.26.0.1.40367 > 112.26.0.8.52644: Flags [.], seq 12665:14093, ack 1, win 1339, options [nop,nop,TS val 57728 ecr 4294810743,mptcp dss ack 3380555454 seq 2129971158 subseq 12665 len 1428 csum 0x8ded], length 1428
21:12:58.038648 IP 112.26.0.8.52644 > 112.26.0.1.40367: Flags [.], ack 11237, win 411, options [nop,nop,TS val 4294812074 ecr 56798,mptcp dss ack 2129969730], length 0
21:12:58.043436 IP 112.26.0.8.52644 > 112.26.0.1.40367: Flags [.], ack 5525, win 320, options [nop,nop,TS val 4294811669 ecr 56798,mptcp dss ack 2129964018], length 0
21:12:58.050601 IP 112.26.0.8.52644 > 112.26.0.1.40367: Flags [.], ack 12665, win 434, options [nop,nop,TS val 4294812165 ecr 56798,mptcp dss ack 2129971158], length 0
21:12:58.132727 IP 112.26.0.1.40367 > 112.26.0.8.52644: Flags [.], seq 12665:14093, ack 1, win 1339, options [nop,nop,TS val 57728 ecr 4294810743,mptcp dss ack 3380555454 seq 2129971158 subseq 12665 len 1428 csum 0x8ded], length 1428
21:12:58.136865 IP 112.26.0.8.52644 > 112.26.0.1.40367: Flags [.], ack 14093, win 457, options [nop,nop,TS val 4294812352 ecr 57728,mptcp dss ack 2129972586], length 0
21:12:58.138184 IP 112.26.0.1.40367 > 112.26.0.8.52644: Flags [.], seq 14093:15521, ack 1, win 1339, options [nop,nop,TS val 57781 ecr 4294811345,mptcp dss ack 3380555454 seq 2129972586 subseq 14093 len 1428 csum 0xe086], length 1428
21:12:58.152711 IP 112.26.0.8.52644 > 112.26.0.1.40367: Flags [.], ack 14093, win 457, options [nop,nop,TS val 4294812352 ecr 57728,mptcp dss ack 2129972586], length 0
21:12:58.160197 IP 112.26.0.1.40367 > 112.26.0.8.52644: Flags [.], seq 15521:16949, ack 1, win 1339, options [nop,nop,TS val 57781 ecr 4294811345,mptcp dss ack 3380555454 seq 2129974014 subseq 15521 len 1428 csum 0x4be2], length 1428
21:12:58.236672 IP 112.26.0.1.40367 > 112.26.0.8.52644: Flags [.], seq 14093:15521, ack 1, win 1339, options [nop,nop,TS val 57781 ecr 4294811345,mptcp dss ack 3380555454 seq 2129972586 subseq 14093 len 1428 csum 0xe086], length 1428
21:12:58.238886 IP 112.26.0.8.52644 > 112.26.0.1.40367: Flags [.], ack 15521, win 480, options [nop,nop,TS val 4294812456 ecr 57781,mptcp dss ack 2129974014], length 0
21:12:58.247328 IP 112.26.0.1.40367 > 112.26.0.8.52644: Flags [.], seq 16949:18377, ack 1, win 1339, options [nop,nop,TS val 57893 ecr 4294811470,mptcp dss ack 3380555454 seq 2129975442 subseq 16949 len 1428 csum 0x3536], length 1428
21:12:58.256557 IP 112.26.0.1.40367 > 112.26.0.8.52644: Flags [.], seq 15521:16949, ack 1, win 1339, options [nop,nop,TS val 57781 ecr 4294811345,mptcp dss ack 3380555454 seq 2129974014 subseq 15521 len 1428 csum 0x4be2], length 1428
21:12:58.258728 IP 112.26.0.8.52644 > 112.26.0.1.40367: Flags [.], ack 16949, win 502, options [nop,nop,TS val 4294812476 ecr 57781,mptcp dss ack 2129975442], length 0
21:12:58.266940 IP 112.26.0.8.52644 > 112.26.0.1.40367: Flags [.], ack 6953, win 343, options [nop,nop,TS val 4294811751 ecr 56798,mptcp dss ack 2129965446], length 0
21:12:58.348594 IP 112.26.0.1.40367 > 112.26.0.8.52644: Flags [.], seq 19805:21233, ack 1, win 1339, options [nop,nop,TS val 58009 ecr 4294811546,mptcp dss ack 3380555454 seq 2129978298 subseq 19805 len 1428 csum 0xfe23], length 1428
21:12:58.349891 IP 112.26.0.8.52644 > 112.26.0.1.40367: Flags [.], ack 15521, win 480, options [nop,nop,TS val 4294812456 ecr 57781,mptcp dss ack 2129974014], length 0
21:12:58.363554 IP 112.26.0.8.52644 > 112.26.0.1.40367: Flags [.], ack 8381, win 365, options [nop,nop,TS val 4294811770 ecr 56798,mptcp dss ack 2129966874], length 0
21:12:58.371249 IP 112.26.0.1.40367 > 112.26.0.8.52644: Flags [.], seq 16949:18377, ack 1, win 1339, options [nop,nop,TS val 57893 ecr 4294811470,mptcp dss ack 3380555454 seq 2129975442 subseq 16949 len 1428 csum 0x3536], length 1428
21:12:58.373587 IP 112.26.0.8.52644 > 112.26.0.1.40367: Flags [.], ack 18377, win 525, options [nop,nop,TS val 4294812591 ecr 57893,mptcp dss ack 2129976870], length 0
21:12:58.444129 IP 112.26.0.8.52644 > 112.26.0.1.40367: Flags [.], ack 9809, win 388, options [nop,nop,TS val 4294811943 ecr 56798,mptcp dss ack 2129968302], length 0
21:12:58.449134 IP 112.26.0.8.52644 > 112.26.0.1.40367: Flags [.], ack 16949, win 502, options [nop,nop,TS val 4294812476 ecr 57781,mptcp dss ack 2129975442], length 0
21:12:58.458076 IP 112.26.0.1.40367 > 112.26.0.8.52644: Flags [.], seq 19805:21233, ack 1, win 1339, options [nop,nop,TS val 58009 ecr 4294811546,mptcp dss ack 3380555454 seq 2129978298 subseq 19805 len 1428 csum 0xfe23], length 1428
21:12:58.459640 IP 112.26.0.8.52644 > 112.26.0.1.40367: Flags [.], ack 18377, win 548, options [nop,nop,TS val 4294812677 ecr 57893,nop,nop,sack 1 {19805:21233},mptcp dss ack 2129976870], length 0
21:12:58.532035 IP 112.26.0.8.52644 > 112.26.0.1.40367: Flags [.], ack 11237, win 411, options [nop,nop,TS val 4294812074 ecr 56798,mptcp dss ack 2129969730], length 0
21:12:58.539014 IP 112.26.0.8.52644 > 112.26.0.1.40367: Flags [.], ack 18377, win 525, options [nop,nop,TS val 4294812591 ecr 57893,mptcp dss ack 2129976870], length 0
21:12:58.548716 IP 112.26.0.1.40367 > 112.26.0.8.52644: Flags [.], seq 22661:24089, ack 1, win 1339, options [nop,nop,TS val 58190 ecr 4294811669,mptcp dss ack 3380555454 seq 2129981154 subseq 22661 len 1428 csum 0xa3be], length 1428
21:12:58.558208 IP 112.26.0.8.52644 > 112.26.0.1.40367: Flags [.], ack 12665, win 434, options [nop,nop,TS val 4294812165 ecr 56798,mptcp dss ack 2129971158], length 0
21:12:58.561411 IP 112.26.0.8.52644 > 112.26.0.1.40367: Flags [.], ack 18377, win 548, options [nop,nop,TS val 4294812677 ecr 57893,nop,nop,sack 1 {19805:21233},mptcp dss ack 2129976870], length 0
21:12:58.647183 IP 112.26.0.8.52644 > 112.26.0.1.40367: Flags [.], ack 14093, win 457, options [nop,nop,TS val 4294812352 ecr 57728,mptcp dss ack 2129972586], length 0
21:12:58.656177 IP 112.26.0.1.40367 > 112.26.0.8.52644: Flags [.], seq 22661:24089, ack 1, win 1339, options [nop,nop,TS val 58190 ecr 4294811669,mptcp dss ack 3380555454 seq 2129981154 subseq 22661 len 1428 csum 0xa3be], length 1428
21:12:58.658359 IP 112.26.0.8.52644 > 112.26.0.1.40367: Flags [.], ack 18377, win 571, options [nop,nop,TS val 4294812876 ecr 57893,nop,nop,sack 2 {22661:24089}{19805:21233},mptcp dss ack 2129976870], length 0
21:12:58.672731 IP 112.26.0.8.52644 > 112.26.0.1.40367: Flags [.], ack 18377, win 571, options [nop,nop,TS val 4294812876 ecr 57893,nop,nop,sack 2 {22661:24089}{19805:21233},mptcp dss ack 2129976870], length 0
21:12:58.837652 IP 112.26.0.8.52644 > 112.26.0.1.40367: Flags [.], ack 15521, win 480, options [nop,nop,TS val 4294812456 ecr 57781,mptcp dss ack 2129974014], length 0
21:12:58.852595 IP 112.26.0.1.40367 > 112.26.0.8.52644: Flags [.], seq 28373:29801, ack 1, win 1339, options [nop,nop,TS val 58510 ecr 4294811770,mptcp dss ack 3380555454 seq 2129986866 subseq 28373 len 1428 csum 0xe7e4], length 1428
21:12:58.854261 IP 112.26.0.1.40367 > 112.26.0.8.52644: Flags [.], seq 28373:29801, ack 1, win 1339, options [nop,nop,TS val 58510 ecr 4294811770,mptcp dss ack 3380555454 seq 2129986866 subseq 28373 len 1428 csum 0xe7e4], length 1428
21:12:58.858545 IP 112.26.0.8.52644 > 112.26.0.1.40367: Flags [.], ack 18377, win 594, options [nop,nop,TS val 4294813073 ecr 57893,nop,nop,sack 2 {28373:29801}{22661:24089},mptcp dss ack 2129976870], length 0
21:12:58.865956 IP 112.26.0.8.52644 > 112.26.0.1.40367: Flags [.], ack 18377, win 594, options [nop,nop,TS val 4294813073 ecr 57893,nop,nop,sack 2 {28373:29801}{22661:24089},mptcp dss ack 2129976870], length 0
21:12:58.944356 IP 112.26.0.8.52644 > 112.26.0.1.40367: Flags [.], ack 16949, win 502, options [nop,nop,TS val 4294812476 ecr 57781,mptcp dss ack 2129975442], length 0
21:12:58.957261 IP 112.26.0.1.40367 > 112.26.0.8.52644: Flags [.], seq 31229:32657, ack 1, win 1339, options [nop,nop,TS val 58590 ecr 4294811943,mptcp dss ack 3380555454 seq 2129989722 subseq 31229 len 1428 csum 0xc6], length 1428
21:12:59.031403 IP 112.26.0.1.40367 > 112.26.0.8.52644: Flags [.], seq 31229:32657, ack 1, win 1339, options [nop,nop,TS val 58590 ecr 4294811943,mptcp dss ack 3380555454 seq 2129989722 subseq 31229 len 1428 csum 0xc6], length 1428
21:12:59.034549 IP 112.26.0.8.52644 > 112.26.0.1.40367: Flags [.], ack 18377, win 616, options [nop,nop,TS val 4294813250 ecr 57893,nop,nop,sack 2 {31229:32657}{28373:29801},mptcp dss ack 2129976870], length 0
21:12:59.047815 IP 112.26.0.8.52644 > 112.26.0.1.40367: Flags [.], ack 18377, win 548, options [nop,nop,TS val 4294812677 ecr 57893,nop,nop,sack 1 {19805:21233},mptcp dss ack 2129976870], length 0
21:12:59.050236 IP 112.26.0.8.52644 > 112.26.0.1.40367: Flags [.], ack 18377, win 616, options [nop,nop,TS val 4294813250 ecr 57893,nop,nop,sack 2 {31229:32657}{28373:29801},mptcp dss ack 2129976870], length 0
21:12:59.059741 IP 112.26.0.1.40367 > 112.26.0.8.52644: Flags [.], seq 34085:35513, ack 1, win 1339, options [nop,nop,TS val 58678 ecr 4294812074,mptcp dss ack 3380555454 seq 2129992578 subseq 34085 len 1428 csum 0x9d61], length 1428
21:12:59.064053 IP 112.26.0.1.40367 > 112.26.0.8.52644: Flags [.], seq 34085:35513, ack 1, win 1339, options [nop,nop,TS val 58678 ecr 4294812074,mptcp dss ack 3380555454 seq 2129992578 subseq 34085 len 1428 csum 0x9d61], length 1428
21:12:59.131432 IP 112.26.0.8.52644 > 112.26.0.1.40367: Flags [.], ack 18377, win 639, options [nop,nop,TS val 4294813280 ecr 57893,nop,nop,sack 2 {34085:35513}{31229:32657},mptcp dss ack 2129976870], length 0
21:12:59.139684 IP 112.26.0.8.52644 > 112.26.0.1.40367: Flags [.], ack 18377, win 639, options [nop,nop,TS val 4294813280 ecr 57893,nop,nop,sack 2 {34085:35513}{31229:32657},mptcp dss ack 2129976870], length 0
21:12:59.146523 IP 112.26.0.1.40367 > 112.26.0.8.52644: Flags [.], seq 35513:36941, ack 1, win 1339, options [nop,nop,TS val 58678 ecr 4294812074,mptcp dss ack 3380555454 seq 2129994006 subseq 35513 len 1428 csum 0x8a06], length 1428
21:12:59.152851 IP 112.26.0.1.40367 > 112.26.0.8.52644: Flags [.], seq 35513:36941, ack 1, win 1339, options [nop,nop,TS val 58678 ecr 4294812074,mptcp dss ack 3380555454 seq 2129994006 subseq 35513 len 1428 csum 0x8a06], length 1428
21:12:59.154417 IP 112.26.0.8.52644 > 112.26.0.1.40367: Flags [.], ack 18377, win 662, options [nop,nop,TS val 4294813372 ecr 57893,nop,nop,sack 2 {34085:36941}{31229:32657},mptcp dss ack 2129976870], length 0
21:12:59.160550 IP 112.26.0.8.52644 > 112.26.0.1.40367: Flags [.], ack 18377, win 571, options [nop,nop,TS val 4294812876 ecr 57893,nop,nop,sack 2 {22661:24089}{19805:21233},mptcp dss ack 2129976870], length 0
21:12:59.242489 IP 112.26.0.8.52644 > 112.26.0.1.40367: Flags [.], ack 18377, win 662, options [nop,nop,TS val 4294813372 ecr 57893,nop,nop,sack 2 {34085:36941}{31229:32657},mptcp dss ack 2129976870], length 0
21:12:59.252410 IP 112.26.0.1.40367 > 112.26.0.8.52644: Flags [.], seq 38369:39797, ack 1, win 1339, options [nop,nop,TS val 58704 ecr 4294812165,mptcp dss ack 3380555454 seq 2129996862 subseq 38369 len 1428 csum 0x687f], length 1428
21:12:59.270955 IP 112.26.0.8.52644 > 112.26.0.1.40367: Flags [.], ack 18377, win 594, options [nop,nop,TS val 4294813073 ecr 57893,nop,nop,sack 2 {28373:29801}{22661:24089},mptcp dss ack 2129976870], length 0
21:12:59.343741 IP 112.26.0.1.40367 > 112.26.0.8.52644: Flags [.], seq 38369:39797, ack 1, win 1339, options [nop,nop,TS val 58704 ecr 4294812165,mptcp dss ack 3380555454 seq 2129996862 subseq 38369 len 1428 csum 0x687f], length 1428
21:12:59.354424 IP 112.26.0.1.40367 > 112.26.0.8.52644: Flags [.], seq 39797:41225, ack 1, win 1339, options [nop,nop,TS val 58793 ecr 4294812352,mptcp dss ack 3380555454 seq 2129998290 subseq 39797 len 1428 csum 0x34e2], length 1428
21:12:59.366565 IP 112.26.0.1.40367 > 112.26.0.8.52644: Flags [.], seq 39797:41225, ack 1, win 1339, options [nop,nop,TS val 58793 ecr 4294812352,mptcp dss ack 3380555454 seq 2129998290 subseq 39797 len 1428 csum 0x34e2], length 1428
21:12:59.377415 IP 112.26.0.8.52644 > 112.26.0.1.40367: Flags [.], ack 18377, win 685, options [nop,nop,TS val 4294813563 ecr 57893,nop,nop,sack 2 {38369:39797}{34085:36941},mptcp dss ack 2129976870], length 0
21:12:59.442479 IP 112.26.0.8.52644 > 112.26.0.1.40367: Flags [.], ack 18377, win 708, options [nop,nop,TS val 4294813586 ecr 57893,nop,nop,sack 2 {38369:41225}{34085:36941},mptcp dss ack 2129976870], length 0
21:12:59.446479 IP 112.26.0.8.52644 > 112.26.0.1.40367: Flags [.], ack 18377, win 685, options [nop,nop,TS val 4294813563 ecr 57893,nop,nop,sack 2 {38369:39797}{34085:36941},mptcp dss ack 2129976870], length 0
21:12:59.451517 IP 112.26.0.1.40367 > 112.26.0.8.52644: Flags [.], seq 41225:42653, ack 1, win 1339, options [nop,nop,TS val 58793 ecr 4294812352,mptcp dss ack 3380555454 seq 2129999718 subseq 41225 len 1428 csum 0x2e1b], length 1428
21:12:59.473416 IP 112.26.0.8.52644 > 112.26.0.1.40367: Flags [.], ack 18377, win 708, options [nop,nop,TS val 4294813586 ecr 57893,nop,nop,sack 2 {38369:41225}{34085:36941},mptcp dss ack 2129976870], length 0
21:12:59.474565 IP 112.26.0.8.52644 > 112.26.0.1.40367: Flags [.], ack 18377, win 616, options [nop,nop,TS val 4294813250 ecr 57893,nop,nop,sack 2 {31229:32657}{28373:29801},mptcp dss ack 2129976870], length 0
21:12:59.543577 IP 112.26.0.8.52644 > 112.26.0.1.40367: Flags [.], ack 18377, win 639, options [nop,nop,TS val 4294813280 ecr 57893,nop,nop,sack 2 {34085:35513}{31229:32657},mptcp dss ack 2129976870], length 0
21:12:59.555685 IP 112.26.0.1.40367 > 112.26.0.8.52644: Flags [.], seq 41225:42653, ack 1, win 1339, options [nop,nop,TS val 58793 ecr 4294812352,mptcp dss ack 3380555454 seq 2129999718 subseq 41225 len 1428 csum 0x2e1b], length 1428
21:12:59.567055 IP 112.26.0.8.52644 > 112.26.0.1.40367: Flags [.], ack 18377, win 730, options [nop,nop,TS val 4294813775 ecr 57893,nop,nop,sack 2 {38369:42653}{34085:36941},mptcp dss ack 2129976870], length 0
21:12:59.575546 IP 112.26.0.1.40367 > 112.26.0.8.52644: Flags [.], seq 18377:19805, ack 1, win 1339, options [nop,nop,TS val 59306 ecr 4294812876,mptcp dss ack 3380555454 seq 2129976870 subseq 18377 len 1428 csum 0x3e82], length 1428
21:12:59.646128 IP 112.26.0.8.52644 > 112.26.0.1.40367: Flags [.], ack 18377, win 662, options [nop,nop,TS val 4294813372 ecr 57893,nop,nop,sack 2 {34085:36941}{31229:32657},mptcp dss ack 2129976870], length 0
21:12:59.652818 IP 112.26.0.8.52644 > 112.26.0.1.40367: Flags [.], ack 18377, win 730, options [nop,nop,TS val 4294813775 ecr 57893,nop,nop,sack 2 {38369:42653}{34085:36941},mptcp dss ack 2129976870], length 0
21:12:59.662822 IP 112.26.0.1.40367 > 112.26.0.8.52644: Flags [.], seq 18377:19805, ack 1, win 1339, options [nop,nop,TS val 59306 ecr 4294812876,mptcp dss ack 3380555454 seq 2129976870 subseq 18377 len 1428 csum 0x3e82], length 1428
21:12:59.664392 IP 112.26.0.8.52644 > 112.26.0.1.40367: Flags [.], ack 21233, win 753, options [nop,nop,TS val 4294813882 ecr 59306,nop,nop,sack 2 {38369:42653}{34085:36941},mptcp dss ack 2129979726], length 0
21:12:59.743184 IP 112.26.0.8.52644 > 112.26.0.1.40367: Flags [.], ack 21233, win 753, options [nop,nop,TS val 4294813882 ecr 59306,nop,nop,sack 2 {38369:42653}{34085:36941},mptcp dss ack 2129979726], length 0
21:12:59.757338 IP 112.26.0.8.52644 > 112.26.0.1.40367: Flags [.], ack 18377, win 685, options [nop,nop,TS val 4294813563 ecr 57893,nop,nop,sack 2 {38369:39797}{34085:36941},mptcp dss ack 2129976870], length 0
21:12:59.836043 IP 112.26.0.1.40367 > 112.26.0.8.52644: Flags [.], seq 21233:22661, ack 1, win 1339, options [nop,nop,TS val 59613 ecr 4294813250,mptcp dss ack 3380555454 seq 2129979726 subseq 21233 len 1428 csum 0x4724], length 1428
21:12:59.842271 IP 112.26.0.1.40367 > 112.26.0.8.52644: Flags [.], seq 21233:22661, ack 1, win 1339, options [nop,nop,TS val 59613 ecr 4294813250,mptcp dss ack 3380555454 seq 2129979726 subseq 21233 len 1428 csum 0x4724], length 1428
21:12:59.852941 IP 112.26.0.8.52644 > 112.26.0.1.40367: Flags [.], ack 24089, win 776, options [nop,nop,TS val 4294814057 ecr 59613,nop,nop,sack 2 {38369:42653}{34085:36941},mptcp dss ack 2129982582], length 0
21:12:59.859888 IP 112.26.0.8.52644 > 112.26.0.1.40367: Flags [.], ack 24089, win 776, options [nop,nop,TS val 4294814057 ecr 59613,nop,nop,sack 2 {38369:42653}{34085:36941},mptcp dss ack 2129982582], length 0
21:12:59.866208 IP 112.26.0.8.52644 > 112.26.0.1.40367: Flags [.], ack 18377, win 708, options [nop,nop,TS val 4294813586 ecr 57893,nop,nop,sack 2 {38369:41225}{34085:36941},mptcp dss ack 2129976870], length 0
21:13:00.040136 IP 112.26.0.1.40367 > 112.26.0.8.52644: Flags [.], seq 25517:26945, ack 1, win 1339, options [nop,nop,TS val 59792 ecr 4294813372,mptcp dss ack 3380555454 seq 2129984010 subseq 25517 len 1428 csum 0x558b], length 1428
21:13:00.043482 IP 112.26.0.1.40367 > 112.26.0.8.52644: Flags [.], seq 25517:26945, ack 1, win 1339, options [nop,nop,TS val 59792 ecr 4294813372,mptcp dss ack 3380555454 seq 2129984010 subseq 25517 len 1428 csum 0x558b], length 1428
21:13:00.044470 IP 112.26.0.8.52644 > 112.26.0.1.40367: Flags [.], ack 24089, win 799, options [nop,nop,TS val 4294814261 ecr 59613,nop,nop,sack 2 {25517:26945}{38369:42653},mptcp dss ack 2129982582], length 0
21:13:00.055965 IP 112.26.0.8.52644 > 112.26.0.1.40367: Flags [.], ack 18377, win 730, options [nop,nop,TS val 4294813775 ecr 57893,nop,nop,sack 2 {38369:42653}{34085:36941},mptcp dss ack 2129976870], length 0
21:13:00.058851 IP 112.26.0.8.52644 > 112.26.0.1.40367: Flags [.], ack 24089, win 799, options [nop,nop,TS val 4294814261 ecr 59613,nop,nop,sack 2 {25517:26945}{38369:42653},mptcp dss ack 2129982582], length 0
21:13:00.140219 IP 112.26.0.8.52644 > 112.26.0.1.40367: Flags [.], ack 21233, win 753, options [nop,nop,TS val 4294813882 ecr 59306,nop,nop,sack 2 {38369:42653}{34085:36941},mptcp dss ack 2129979726], length 0
21:13:00.157214 IP 112.26.0.1.40367 > 112.26.0.8.52644: Flags [.], seq 26945:28373, ack 1, win 1339, options [nop,nop,TS val 59903 ecr 4294813563,mptcp dss ack 3380555454 seq 2129985438 subseq 26945 len 1428 csum 0xdb87], length 1428
21:13:00.163034 IP 112.26.0.8.52644 > 112.26.0.1.40367: Flags [.], ack 24089, win 822, options [nop,nop,TS val 4294814378 ecr 59613,nop,nop,sack 2 {25517:28373}{38369:42653},mptcp dss ack 2129982582], length 0
21:13:00.164074 IP 112.26.0.1.40367 > 112.26.0.8.52644: Flags [.], seq 26945:28373, ack 1, win 1339, options [nop,nop,TS val 59903 ecr 4294813563,mptcp dss ack 3380555454 seq 2129985438 subseq 26945 len 1428 csum 0xdb87], length 1428
21:13:00.258816 IP 112.26.0.8.52644 > 112.26.0.1.40367: Flags [.], ack 24089, win 822, options [nop,nop,TS val 4294814378 ecr 59613,nop,nop,sack 2 {25517:28373}{38369:42653},mptcp dss ack 2129982582], length 0
21:13:00.270247 IP 112.26.0.8.52644 > 112.26.0.1.40367: Flags [.], ack 24089, win 776, options [nop,nop,TS val 4294814057 ecr 59613,nop,nop,sack 2 {38369:42653}{34085:36941},mptcp dss ack 2129982582], length 0
21:13:00.343433 IP 112.26.0.1.40367 > 112.26.0.8.52644: Flags [.], seq 29801:31229, ack 1, win 1339, options [nop,nop,TS val 60012 ecr 4294813586,mptcp dss ack 3380555454 seq 2129988294 subseq 29801 len 1428 csum 0xd86], length 1428
21:13:00.350599 IP 112.26.0.8.52644 > 112.26.0.1.40367: Flags [.], ack 24089, win 845, options [nop,nop,TS val 4294814565 ecr 59613,nop,nop,sack 2 {29801:32657}{25517:28373},mptcp dss ack 2129982582], length 0
21:13:00.352817 IP 112.26.0.1.40367 > 112.26.0.8.52644: Flags [.], seq 29801:31229, ack 1, win 1339, options [nop,nop,TS val 60012 ecr 4294813586,mptcp dss ack 3380555454 seq 2129988294 subseq 29801 len 1428 csum 0xd86], length 1428
21:13:00.362450 IP 112.26.0.1.40367 > 112.26.0.8.52644: Flags [.], seq 32657:34085, ack 1, win 1339, options [nop,nop,TS val 60202 ecr 4294813775,mptcp dss ack 3380555454 seq 2129991150 subseq 32657 len 1428 csum 0x7c70], length 1428
21:13:00.367106 IP 112.26.0.8.52644 > 112.26.0.1.40367: Flags [.], ack 24089, win 845, options [nop,nop,TS val 4294814565 ecr 59613,nop,nop,sack 2 {29801:32657}{25517:28373},mptcp dss ack 2129982582], length 0
21:13:00.441266 IP 112.26.0.1.40367 > 112.26.0.8.52644: Flags [.], seq 32657:34085, ack 1, win 1339, options [nop,nop,TS val 60202 ecr 4294813775,mptcp dss ack 3380555454 seq 2129991150 subseq 32657 len 1428 csum 0x7c70], length 1428
21:13:00.444343 IP 112.26.0.8.52644 > 112.26.0.1.40367: Flags [.], ack 24089, win 867, options [nop,nop,TS val 4294814661 ecr 59613,nop,nop,sack 2 {29801:36941}{25517:28373},mptcp dss ack 2129982582], length 0
21:13:00.450724 IP 112.26.0.8.52644 > 112.26.0.1.40367: Flags [.], ack 24089, win 799, options [nop,nop,TS val 4294814261 ecr 59613,nop,nop,sack 2 {25517:26945}{38369:42653},mptcp dss ack 2129982582], length 0
21:13:00.460751 IP 112.26.0.8.52644 > 112.26.0.1.40367: Flags [.], ack 24089, win 867, options [nop,nop,TS val 4294814661 ecr 59613,nop,nop,sack 2 {29801:36941}{25517:28373},mptcp dss ack 2129982582], length 0
21:13:00.468841 IP 112.26.0.1.40367 > 112.26.0.8.52644: Flags [.], seq 36941:38369, ack 1, win 1339, options [nop,nop,TS val 60286 ecr 4294813882,mptcp dss ack 3380555454 seq 2129995434 subseq 36941 len 1428 csum 0xe279], length 1428
21:13:00.551669 IP 112.26.0.1.40367 > 112.26.0.8.52644: Flags [.], seq 36941:38369, ack 1, win 1339, options [nop,nop,TS val 60286 ecr 4294813882,mptcp dss ack 3380555454 seq 2129995434 subseq 36941 len 1428 csum 0xe279], length 1428
21:13:00.553807 IP 112.26.0.8.52644 > 112.26.0.1.40367: Flags [.], ack 24089, win 890, options [nop,nop,TS val 4294814771 ecr 59613,nop,nop,sack 2 {29801:42653}{25517:28373},mptcp dss ack 2129982582], length 0
21:13:00.561272 IP 112.26.0.1.40367 > 112.26.0.8.52644: Flags [.], seq 42653:44081, ack 1, win 1339, options [nop,nop,TS val 60286 ecr 4294813882,mptcp dss ack 3380555454 seq 2130001146 subseq 42653 len 1428 csum 0x4db9], length 1428
21:13:00.571918 IP 112.26.0.8.52644 > 112.26.0.1.40367: Flags [.], ack 24089, win 890, options [nop,nop,TS val 4294814771 ecr 59613,nop,nop,sack 2 {29801:42653}{25517:28373},mptcp dss ack 2129982582], length 0
21:13:00.643135 IP 112.26.0.1.40367 > 112.26.0.8.52644: Flags [.], seq 44081:45509, ack 1, win 1339, options [nop,nop,TS val 60286 ecr 4294813882,mptcp dss ack 3380555454 seq 2130002574 subseq 44081 len 1428 csum 0x3e5f], length 1428
21:13:00.651720 IP 112.26.0.8.52644 > 112.26.0.1.40367: Flags [.], ack 24089, win 822, options [nop,nop,TS val 4294814378 ecr 59613,nop,nop,sack 2 {25517:28373}{38369:42653},mptcp dss ack 2129982582], length 0
21:13:00.655774 IP 112.26.0.1.40367 > 112.26.0.8.52644: Flags [.], seq 42653:44081, ack 1, win 1339, options [nop,nop,TS val 60286 ecr 4294813882,mptcp dss ack 3380555454 seq 2130001146 subseq 42653 len 1428 csum 0x4db9], length 1428
21:13:00.658027 IP 112.26.0.8.52644 > 112.26.0.1.40367: Flags [.], ack 24089, win 913, options [nop,nop,TS val 4294814875 ecr 59613,nop,nop,sack 2 {29801:44081}{25517:28373},mptcp dss ack 2129982582], length 0
21:13:00.667253 IP 112.26.0.1.40367 > 112.26.0.8.52644: Flags [.], seq 45509:46937, ack 1, win 1339, options [nop,nop,TS val 60416 ecr 4294814057,mptcp dss ack 3380555454 seq 2130004002 subseq 45509 len 1428 csum 0xcc04], length 1428
21:13:00.740549 IP 112.26.0.1.40367 > 112.26.0.8.52644: Flags [.], seq 44081:45509, ack 1, win 1339, options [nop,nop,TS val 60286 ecr 4294813882,mptcp dss ack 3380555454 seq 2130002574 subseq 44081 len 1428 csum 0x3e5f], length 1428
21:13:00.744405 IP 112.26.0.8.52644 > 112.26.0.1.40367: Flags [.], ack 24089, win 936, options [nop,nop,TS val 4294814960 ecr 59613,nop,nop,sack 2 {29801:45509}{25517:28373},mptcp dss ack 2129982582], length 0
21:13:00.756348 IP 112.26.0.8.52644 > 112.26.0.1.40367: Flags [.], ack 24089, win 913, options [nop,nop,TS val 4294814875 ecr 59613,nop,nop,sack 2 {29801:44081}{25517:28373},mptcp dss ack 2129982582], length 0
21:13:00.760925 IP 112.26.0.1.40367 > 112.26.0.8.52644: Flags [.], seq 46937:48365, ack 1, win 1339, options [nop,nop,TS val 60416 ecr 4294814057,mptcp dss ack 3380555454 seq 2130005430 subseq 46937 len 1428 csum 0x1a9e], length 1428
21:13:00.768188 IP 112.26.0.1.40367 > 112.26.0.8.52644: Flags [.], seq 45509:46937, ack 1, win 1339, options [nop,nop,TS val 60416 ecr 4294814057,mptcp dss ack 3380555454 seq 2130004002 subseq 45509 len 1428 csum 0xcc04], length 1428
21:13:00.769737 IP 112.26.0.8.52644 > 112.26.0.1.40367: Flags [.], ack 24089, win 959, options [nop,nop,TS val 4294814988 ecr 59613,nop,nop,sack 2 {29801:46937}{25517:28373},mptcp dss ack 2129982582], length 0
21:13:00.846520 IP 112.26.0.8.52644 > 112.26.0.1.40367: Flags [.], ack 24089, win 845, options [nop,nop,TS val 4294814565 ecr 59613,nop,nop,sack 2 {29801:32657}{25517:28373},mptcp dss ack 2129982582], length 0
21:13:00.858577 IP 112.26.0.8.52644 > 112.26.0.1.40367: Flags [.], ack 24089, win 936, options [nop,nop,TS val 4294814960 ecr 59613,nop,nop,sack 2 {29801:45509}{25517:28373},mptcp dss ack 2129982582], length 0
21:13:00.866597 IP 112.26.0.1.40367 > 112.26.0.8.52644: Flags [.], seq 24089:25517, ack 1, win 1339, options [nop,nop,TS val 60597 ecr 4294814261,mptcp dss ack 3380555454 seq 2129982582 subseq 24089 len 1428 csum 0x3b8d], length 1428
21:13:00.869179 IP 112.26.0.1.40367 > 112.26.0.8.52644: Flags [.], seq 46937:48365, ack 1, win 1339, options [nop,nop,TS val 60416 ecr 4294814057,mptcp dss ack 3380555454 seq 2130005430 subseq 46937 len 1428 csum 0x1a9e], length 1428
21:13:00.870750 IP 112.26.0.8.52644 > 112.26.0.1.40367: Flags [.], ack 24089, win 981, options [nop,nop,TS val 4294815089 ecr 59613,nop,nop,sack 2 {29801:48365}{25517:28373},mptcp dss ack 2129982582], length 0
21:13:00.943054 IP 112.26.0.8.52644 > 112.26.0.1.40367: Flags [.], ack 24089, win 959, options [nop,nop,TS val 4294814988 ecr 59613,nop,nop,sack 2 {29801:46937}{25517:28373},mptcp dss ack 2129982582], length 0
21:13:00.949377 IP 112.26.0.8.52644 > 112.26.0.1.40367: Flags [.], ack 24089, win 867, options [nop,nop,TS val 4294814661 ecr 59613,nop,nop,sack 2 {29801:36941}{25517:28373},mptcp dss ack 2129982582], length 0
21:13:00.959145 IP 112.26.0.1.40367 > 112.26.0.8.52644: Flags [.], seq 24089:25517, ack 1, win 1339, options [nop,nop,TS val 60597 ecr 4294814261,mptcp dss ack 3380555454 seq 2129982582 subseq 24089 len 1428 csum 0x3b8d], length 1428
21:13:00.965033 IP 112.26.0.8.52644 > 112.26.0.1.40367: Flags [.], ack 48365, win 1004, options [nop,nop,TS val 4294815179 ecr 60597,mptcp dss ack 2130006858], length 0
21:13:00.999518 IP 112.26.0.8.52644 > 112.26.0.1.40367: Flags [.], ack 24089, win 890, options [nop,nop,TS val 4294814771 ecr 59613,nop,nop,sack 2 {29801:42653}{25517:28373},mptcp dss ack 2129982582], length 0
21:13:01.017352 IP 112.26.0.8.52644 > 112.26.0.1.40367: Flags [.], ack 24089, win 981, options [nop,nop,TS val 4294815089 ecr 59613,nop,nop,sack 2 {29801:48365}{25517:28373},mptcp dss ack 2129982582], length 0
21:13:01.068930 IP 112.26.0.8.52644 > 112.26.0.1.40367: Flags [.], ack 48365, win 1004, options [nop,nop,TS val 4294815179 ecr 60597,mptcp dss ack 2130006858], length 0
21:13:01.073768 IP 112.26.0.8.52644 > 112.26.0.1.40367: Flags [.], ack 24089, win 913, options [nop,nop,TS val 4294814875 ecr 59613,nop,nop,sack 2 {29801:44081}{25517:28373},mptcp dss ack 2129982582], length 0
21:13:01.131202 IP 112.26.0.1.40367 > 112.26.0.8.52644: Flags [.], seq 48365:49793, ack 1, win 1339, options [nop,nop,TS val 60992 ecr 4294814378,mptcp dss ack 3380555454 seq 2130006858 subseq 48365 len 1428 csum 0xaca4], length 1428
21:13:01.134278 IP 112.26.0.1.40367 > 112.26.0.8.52644: Flags [.], seq 48365:49793, ack 1, win 1339, options [nop,nop,TS val 60992 ecr 4294814378,mptcp dss ack 3380555454 seq 2130006858 subseq 48365 len 1428 csum 0xaca4], length 1428
21:13:01.136493 IP 112.26.0.8.52644 > 112.26.0.1.40367: Flags [.], ack 49793, win 1027, options [nop,nop,TS val 4294815353 ecr 60992,mptcp dss ack 2130008286], length 0
21:13:01.187530 IP 112.26.0.8.52644 > 112.26.0.1.40367: Flags [.], ack 49793, win 1027, options [nop,nop,TS val 4294815353 ecr 60992,mptcp dss ack 2130008286], length 0
