21:13:01.044536 IP 112.26.1.8.35583 > 112.26.1.1.40367: Flags [S], seq 2868810643, win 29200, options [mss 1460,sackOK,TS val 4294815180 ecr 0,nop,wscale 7,mptcp join id 3 token 0x329820ce nonce 0x35750e7f], length 0
21:13:01.097012 IP 112.26.1.8.35583 > 112.26.1.1.40367: Flags [S], seq 2868810643, win 29200, options [mss 1460,sackOK,TS val 4294815180 ecr 0,nop,wscale 7,mptcp join id 3 token 0x329820ce nonce 0x35750e7f], length 0
21:13:01.128034 IP 112.26.1.1.40367 > 112.26.1.8.35583: Flags [S.], seq 2680798708, ack 2868810644, win 65535, options [mss 1460,sackOK,TS val 61243 ecr 4294815180,nop,wscale 6,mptcp join id 3 hmac 0xe06dfaf1e4e6e1c5 nonce 0x4e95d7be], length 0
21:13:01.199788 IP 112.26.1.1.40367 > 112.26.1.8.35583: Flags [S.], seq 2680798708, ack 2868810644, win 65535, options [mss 1460,sackOK,TS val 61243 ecr 4294815180,nop,wscale 6,mptcp join id 3 hmac 0xe06dfaf1e4e6e1c5 nonce 0x4e95d7be], length 0
21:13:01.202112 IP 112.26.1.1.40367 > 112.26.1.8.35583: Flags [S.], seq 2680798708, ack 2868810644, win 65535, options [mss 1460,sackOK,TS val 61243 ecr 4294815180,nop,wscale 6,mptcp join id 3 hmac 0xe06dfaf1e4e6e1c5 nonce 0x4e95d7be], length 0
21:13:01.288597 IP 112.26.1.8.35583 > 112.26.1.1.40367: Flags [.], ack 1, win 1255, options [nop,nop,TS val 4294815421 ecr 61243,mptcp join hmac 0x74df8aa60a1bd8166a0670a7ca5bace4c3244274], length 0
21:13:01.289579 IP 112.26.1.8.35583 > 112.26.1.1.40367: Flags [.], ack 1, win 1255, options [nop,nop,TS val 4294815421 ecr 61243,mptcp join hmac 0x74df8aa60a1bd8166a0670a7ca5bace4c3244274], length 0
21:13:01.293781 IP 112.26.1.1.40367 > 112.26.1.8.35583: Flags [.], ack 1, win 2678, options [nop,nop,TS val 61436 ecr 4294815421,mptcp dss ack 3380555454], length 0
21:13:01.331565 IP 112.26.1.1.40367 > 112.26.1.8.35583: Flags [.], seq 1:1429, ack 1, win 2678, options [nop,nop,TS val 61437 ecr 4294815421,mptcp dss ack 3380555454 seq 2130016854 subseq 1 len 1428 csum 0xfe5], length 1428
21:13:01.385987 IP 112.26.1.1.40367 > 112.26.1.8.35583: Flags [.], seq 1429:2857, ack 1, win 2678, options [nop,nop,TS val 61437 ecr 4294815421,mptcp dss ack 3380555454 seq 2130018282 subseq 1429 len 1428 csum 0x9cca], length 1428
21:13:01.434842 IP 112.26.1.1.40367 > 112.26.1.8.35583: Flags [.], seq 2857:4285, ack 1, win 2678, options [nop,nop,TS val 61437 ecr 4294815421,mptcp dss ack 3380555454 seq 2130019710 subseq 2857 len 1428 csum 0x2b03], length 1428
21:13:01.454387 IP 112.26.1.1.40367 > 112.26.1.8.35583: Flags [.], ack 1, win 2678, options [nop,nop,TS val 61436 ecr 4294815421,mptcp dss ack 3380555454], length 0
21:13:01.456754 IP 112.26.1.1.40367 > 112.26.1.8.35583: Flags [.], ack 1, win 2678, options [nop,nop,TS val 61436 ecr 4294815421,mptcp dss ack 3380555454], length 0
21:13:01.493381 IP 112.26.1.1.40367 > 112.26.1.8.35583: Flags [.], seq 4285:5713, ack 1, win 2678, options [nop,nop,TS val 61437 ecr 4294815421,mptcp dss ack 3380555454 seq 2130021138 subseq 4285 len 1428 csum 0x7c89], length 1428
21:13:01.533109 IP 112.26.1.1.40367 > 112.26.1.8.35583: Flags [.], seq 1:1429, ack 1, win 2678, options [nop,nop,TS val 61437 ecr 4294815421,mptcp dss ack 3380555454 seq 2130016854 subseq 1 len 1428 csum 0xfe5], length 1428
21:13:01.538455 IP 112.26.1.1.40367 > 112.26.1.8.35583: Flags [.], seq 1:1429, ack 1, win 2678, options [nop,nop,TS val 61437 ecr 4294815421,mptcp dss ack 3380555454 seq 2130016854 subseq 1 len 1428 csum 0xfe5], length 1428
21:13:01.597762 IP 112.26.1.1.40367 > 112.26.1.8.35583: Flags [.], seq 5713:7141, ack 1, win 2678, options [nop,nop,TS val 61437 ecr 4294815421,mptcp dss ack 3380555454 seq 2130022566 subseq 5713 len 1428 csum 0x5709], length 1428
21:13:01.648588 IP 112.26.1.1.40367 > 112.26.1.8.35583: Flags [.], seq 7141:8569, ack 1, win 2678, options [nop,nop,TS val 61438 ecr 4294815421,mptcp dss ack 3380555454 seq 2130023994 subseq 7141 len 1428 csum 0x381e], length 1428
21:13:01.676726 IP 112.26.1.8.35583 > 112.26.1.1.40367: Flags [.], ack 1429, win 1803, options [nop,nop,TS val 4294815758 ecr 61437,mptcp dss ack 2130011142], length 0
21:13:01.727990 IP 112.26.1.1.40367 > 112.26.1.8.35583: Flags [.], seq 8569:9997, ack 1, win 2678, options [nop,nop,TS val 61438 ecr 4294815421,mptcp dss ack 3380555454 seq 2130025422 subseq 8569 len 1428 csum 0xbf7a], length 1428
21:13:01.768267 IP 112.26.1.1.40367 > 112.26.1.8.35583: Flags [.], seq 1429:2857, ack 1, win 2678, options [nop,nop,TS val 61437 ecr 4294815421,mptcp dss ack 3380555454 seq 2130018282 subseq 1429 len 1428 csum 0x9cca], length 1428
21:13:01.771643 IP 112.26.1.1.40367 > 112.26.1.8.35583: Flags [.], seq 1429:2857, ack 1, win 2678, options [nop,nop,TS val 61437 ecr 4294815421,mptcp dss ack 3380555454 seq 2130018282 subseq 1429 len 1428 csum 0x9cca], length 1428
21:13:01.808974 IP 112.26.1.1.40367 > 112.26.1.8.35583: Flags [.], seq 9997:11425, ack 1, win 2678, options [nop,nop,TS val 61438 ecr 4294815421,mptcp dss ack 3380555454 seq 2130026850 subseq 9997 len 1428 csum 0x473], length 1428
21:13:01.863882 IP 112.26.1.1.40367 > 112.26.1.8.35583: Flags [.], seq 2857:4285, ack 1, win 2678, options [nop,nop,TS val 61437 ecr 4294815421,mptcp dss ack 3380555454 seq 2130019710 subseq 2857 len 1428 csum 0x2b03], length 1428
21:13:01.906888 IP 112.26.1.1.40367 > 112.26.1.8.35583: Flags [.], seq 11425:12853, ack 1, win 2678, options [nop,nop,TS val 61438 ecr 4294815421,mptcp dss ack 3380555454 seq 2130028278 subseq 11425 len 1428 csum 0xce21], length 1428
21:13:01.941041 IP 112.26.1.8.35583 > 112.26.1.1.40367: Flags [.], ack 2857, win 1917, options [nop,nop,TS val 4294815991 ecr 61437,mptcp dss ack 2130012570], length 0
21:13:01.947303 IP 112.26.1.1.40367 > 112.26.1.8.35583: Flags [.], seq 12853:14281, ack 1, win 2678, options [nop,nop,TS val 61439 ecr 4294815421,mptcp dss ack 3380555454 seq 2130029706 subseq 12853 len 1428 csum 0x8cf], length 1428
21:13:01.978522 IP 112.26.1.1.40367 > 112.26.1.8.35583: Flags [.], seq 4285:5713, ack 1, win 2678, options [nop,nop,TS val 61437 ecr 4294815421,mptcp dss ack 3380555454 seq 2130021138 subseq 4285 len 1428 csum 0x7c89], length 1428
21:13:02.006687 IP 112.26.1.1.40367 > 112.26.1.8.35583: Flags [.], seq 2857:4285, ack 1, win 2678, options [nop,nop,TS val 61437 ecr 4294815421,mptcp dss ack 3380555454 seq 2130019710 subseq 2857 len 1428 csum 0x2b03], length 1428
21:13:02.047006 IP 112.26.1.1.40367 > 112.26.1.8.35583: Flags [.], seq 12853:14281, ack 1, win 4017, options [nop,nop,TS val 61832 ecr 4294815421,mptcp dss ack 3380555454 seq 2130029706 subseq 12853 len 1428 csum 0x8cf], length 1428
21:13:02.103800 IP 112.26.1.1.40367 > 112.26.1.8.35583: Flags [.], seq 4285:5713, ack 1, win 2678, options [nop,nop,TS val 61437 ecr 4294815421,mptcp dss ack 3380555454 seq 2130021138 subseq 4285 len 1428 csum 0x7c89], length 1428
21:13:02.158784 IP 112.26.1.1.40367 > 112.26.1.8.35583: Flags [.], seq 5713:7141, ack 1, win 2678, options [nop,nop,TS val 61437 ecr 4294815421,mptcp dss ack 3380555454 seq 2130022566 subseq 5713 len 1428 csum 0x5709], length 1428
21:13:02.207752 IP 112.26.1.8.35583 > 112.26.1.1.40367: Flags [.], ack 4285, win 2054, options [nop,nop,TS val 4294816226 ecr 61437,mptcp dss ack 2130015426], length 0
21:13:02.220665 IP 112.26.1.1.40367 > 112.26.1.8.35583: Flags [.], seq 7141:8569, ack 1, win 2678, options [nop,nop,TS val 61438 ecr 4294815421,mptcp dss ack 3380555454 seq 2130023994 subseq 7141 len 1428 csum 0x381e], length 1428
21:13:02.295890 IP 112.26.1.8.35583 > 112.26.1.1.40367: Flags [.], ack 1429, win 1803, options [nop,nop,TS val 4294815758 ecr 61437,mptcp dss ack 2130011142], length 0
21:13:02.303943 IP 112.26.1.1.40367 > 112.26.1.8.35583: Flags [.], seq 14281:15709, ack 1, win 4017, options [nop,nop,TS val 62442 ecr 4294815758,mptcp dss ack 3380555454 seq 2130081114 subseq 14281 len 1428 csum 0x22ef], length 1428
21:13:02.363787 IP 112.26.1.8.35583 > 112.26.1.1.40367: Flags [.], ack 5713, win 2099, options [nop,nop,TS val 4294816323 ecr 61437,mptcp dss ack 2130015426], length 0
21:13:02.372655 IP 112.26.1.1.40367 > 112.26.1.8.35583: Flags [.], seq 8569:9997, ack 1, win 2678, options [nop,nop,TS val 61438 ecr 4294815421,mptcp dss ack 3380555454 seq 2130025422 subseq 8569 len 1428 csum 0xbf7a], length 1428
21:13:02.385245 IP 112.26.1.1.40367 > 112.26.1.8.35583: Flags [.], seq 15709:17137, ack 1, win 4017, options [nop,nop,TS val 62442 ecr 4294815758,mptcp dss ack 3380555454 seq 2130082542 subseq 15709 len 1428 csum 0xb296], length 1428
21:13:02.434163 IP 112.26.1.1.40367 > 112.26.1.8.35583: Flags [.], seq 5713:7141, ack 1, win 2678, options [nop,nop,TS val 61437 ecr 4294815421,mptcp dss ack 3380555454 seq 2130022566 subseq 5713 len 1428 csum 0x5709], length 1428
21:13:02.483015 IP 112.26.1.1.40367 > 112.26.1.8.35583: Flags [.], seq 9997:11425, ack 1, win 2678, options [nop,nop,TS val 61438 ecr 4294815421,mptcp dss ack 3380555454 seq 2130026850 subseq 9997 len 1428 csum 0x473], length 1428
21:13:02.511684 IP 112.26.1.1.40367 > 112.26.1.8.35583: Flags [.], seq 7141:8569, ack 1, win 2678, options [nop,nop,TS val 61438 ecr 4294815421,mptcp dss ack 3380555454 seq 2130023994 subseq 7141 len 1428 csum 0x381e], length 1428
21:13:02.539243 IP 112.26.1.1.40367 > 112.26.1.8.35583: Flags [.], seq 11425:12853, ack 1, win 2678, options [nop,nop,TS val 61438 ecr 4294815421,mptcp dss ack 3380555454 seq 2130028278 subseq 11425 len 1428 csum 0xce21], length 1428
21:13:02.565270 IP 112.26.1.8.35583 > 112.26.1.1.40367: Flags [.], ack 2857, win 1917, options [nop,nop,TS val 4294815991 ecr 61437,mptcp dss ack 2130012570], length 0
21:13:02.567430 IP 112.26.1.1.40367 > 112.26.1.8.35583: Flags [.], seq 17137:18565, ack 1, win 4017, options [nop,nop,TS val 62711 ecr 4294815991,mptcp dss ack 3380555454 seq 2130092538 subseq 17137 len 1428 csum 0xcd03], length 1428
21:13:02.587170 IP 112.26.1.1.40367 > 112.26.1.8.35583: Flags [.], seq 8569:9997, ack 1, win 2678, options [nop,nop,TS val 61438 ecr 4294815421,mptcp dss ack 3380555454 seq 2130025422 subseq 8569 len 1428 csum 0xbf7a], length 1428
21:13:02.625084 IP 112.26.1.1.40367 > 112.26.1.8.35583: Flags [.], seq 18565:19993, ack 1, win 4017, options [nop,nop,TS val 62711 ecr 4294815991,mptcp dss ack 3380555454 seq 2130093966 subseq 18565 len 1428 csum 0x32b5], length 1428
21:13:02.672450 IP 112.26.1.8.35583 > 112.26.1.1.40367: Flags [.], ack 7141, win 2282, options [nop,nop,TS val 4294816653 ecr 61437,mptcp dss ack 2130023994], length 0
21:13:02.692265 IP 112.26.1.1.40367 > 112.26.1.8.35583: Flags [.], seq 12853:14281, ack 1, win 4017, options [nop,nop,TS val 61832 ecr 4294815421,mptcp dss ack 3380555454 seq 2130029706 subseq 12853 len 1428 csum 0x8cf], length 1428
21:13:02.721155 IP 112.26.1.1.40367 > 112.26.1.8.35583: Flags [.], seq 9997:11425, ack 1, win 2678, options [nop,nop,TS val 61438 ecr 4294815421,mptcp dss ack 3380555454 seq 2130026850 subseq 9997 len 1428 csum 0x473], length 1428
21:13:02.754022 IP 112.26.1.8.35583 > 112.26.1.1.40367: Flags [.], ack 4285, win 2054, options [nop,nop,TS val 4294816226 ecr 61437,mptcp dss ack 2130015426], length 0
21:13:02.756842 IP 112.26.1.1.40367 > 112.26.1.8.35583: Flags [.], seq 19993:21421, ack 1, win 4017, options [nop,nop,TS val 62900 ecr 4294816226,mptcp dss ack 3380555454 seq 2130102534 subseq 19993 len 1428 csum 0xde0b], length 1428
21:13:02.783821 IP 112.26.1.8.35583 > 112.26.1.1.40367: Flags [.], ack 8569, win 2327, options [nop,nop,TS val 4294816731 ecr 61438,mptcp dss ack 2130025422], length 0
21:13:02.832546 IP 112.26.1.1.40367 > 112.26.1.8.35583: Flags [.], seq 21421:22849, ack 1, win 4017, options [nop,nop,TS val 62900 ecr 4294816226,mptcp dss ack 3380555454 seq 2130103962 subseq 21421 len 1428 csum 0xbdea], length 1428
21:13:02.840331 IP 112.26.1.1.40367 > 112.26.1.8.35583: Flags [.], seq 11425:12853, ack 1, win 2678, options [nop,nop,TS val 61438 ecr 4294815421,mptcp dss ack 3380555454 seq 2130028278 subseq 11425 len 1428 csum 0xce21], length 1428
21:13:02.854560 IP 112.26.1.1.40367 > 112.26.1.8.35583: Flags [.], seq 14281:15709, ack 1, win 4017, options [nop,nop,TS val 62442 ecr 4294815758,mptcp dss ack 3380555454 seq 2130081114 subseq 14281 len 1428 csum 0x22ef], length 1428
21:13:02.916228 IP 112.26.1.8.35583 > 112.26.1.1.40367: Flags [.], ack 9997, win 2396, options [nop,nop,TS val 4294816800 ecr 61438,mptcp dss ack 2130026850], length 0
21:13:02.924905 IP 112.26.1.8.35583 > 112.26.1.1.40367: Flags [.], ack 5713, win 2099, options [nop,nop,TS val 4294816323 ecr 61437,mptcp dss ack 2130015426], length 0
21:13:02.932620 IP 112.26.1.1.40367 > 112.26.1.8.35583: Flags [.], seq 22849:24277, ack 1, win 4017, options [nop,nop,TS val 63072 ecr 4294816323,mptcp dss ack 3380555454 seq 2130108246 subseq 22849 len 1428 csum 0xa0d5], length 1428
21:13:02.987644 IP 112.26.1.1.40367 > 112.26.1.8.35583: Flags [.], seq 15709:17137, ack 1, win 4017, options [nop,nop,TS val 62442 ecr 4294815758,mptcp dss ack 3380555454 seq 2130082542 subseq 15709 len 1428 csum 0xb296], length 1428
21:13:03.013650 IP 112.26.1.1.40367 > 112.26.1.8.35583: Flags [.], seq 12853:14281, ack 1, win 4017, options [nop,nop,TS val 61832 ecr 4294815421,mptcp dss ack 3380555454 seq 2130029706 subseq 12853 len 1428 csum 0x8cf], length 1428
21:13:03.041922 IP 112.26.1.1.40367 > 112.26.1.8.35583: Flags [.], seq 24277:25705, ack 1, win 4017, options [nop,nop,TS val 63072 ecr 4294816323,mptcp dss ack 3380555454 seq 2130109674 subseq 24277 len 1428 csum 0xf272], length 1428
21:13:03.096419 IP 112.26.1.8.35583 > 112.26.1.1.40367: Flags [.], ack 11425, win 2464, options [nop,nop,TS val 4294816940 ecr 61438,mptcp dss ack 2130028278], length 0
21:13:03.117263 IP 112.26.1.1.40367 > 112.26.1.8.35583: Flags [.], seq 17137:18565, ack 1, win 4017, options [nop,nop,TS val 62711 ecr 4294815991,mptcp dss ack 3380555454 seq 2130092538 subseq 17137 len 1428 csum 0xcd03], length 1428
21:13:03.175055 IP 112.26.1.8.35583 > 112.26.1.1.40367: Flags [.], ack 12853, win 2555, options [nop,nop,TS val 4294817034 ecr 61438,mptcp dss ack 2130029706], length 0
21:13:03.234216 IP 112.26.1.1.40367 > 112.26.1.8.35583: Flags [.], seq 14281:15709, ack 1, win 4017, options [nop,nop,TS val 62442 ecr 4294815758,mptcp dss ack 3380555454 seq 2130081114 subseq 14281 len 1428 csum 0x22ef], length 1428
21:13:03.271973 IP 112.26.1.1.40367 > 112.26.1.8.35583: Flags [.], seq 18565:19993, ack 1, win 4017, options [nop,nop,TS val 62711 ecr 4294815991,mptcp dss ack 3380555454 seq 2130093966 subseq 18565 len 1428 csum 0x32b5], length 1428
21:13:03.318941 IP 112.26.1.1.40367 > 112.26.1.8.35583: Flags [.], seq 15709:17137, ack 1, win 4017, options [nop,nop,TS val 62442 ecr 4294815758,mptcp dss ack 3380555454 seq 2130082542 subseq 15709 len 1428 csum 0xb296], length 1428
21:13:03.356921 IP 112.26.1.8.35583 > 112.26.1.1.40367: Flags [.], ack 7141, win 2282, options [nop,nop,TS val 4294816653 ecr 61437,mptcp dss ack 2130023994], length 0
21:13:03.360434 IP 112.26.1.1.40367 > 112.26.1.8.35583: Flags [.], seq 25705:27133, ack 1, win 4017, options [nop,nop,TS val 63503 ecr 4294816653,mptcp dss ack 3380555454 seq 2130129666 subseq 25705 len 1428 csum 0xc01], length 1428
21:13:03.418832 IP 112.26.1.8.35583 > 112.26.1.1.40367: Flags [.], ack 14281, win 2647, options [nop,nop,TS val 4294817233 ecr 61832,mptcp dss ack 2130046842], length 0
21:13:03.431338 IP 112.26.1.1.40367 > 112.26.1.8.35583: Flags [.], seq 27133:28561, ack 1, win 4017, options [nop,nop,TS val 63503 ecr 4294816653,mptcp dss ack 3380555454 seq 2130131094 subseq 27133 len 1428 csum 0xd59d], length 1428
21:13:03.438790 IP 112.26.1.1.40367 > 112.26.1.8.35583: Flags [.], seq 19993:21421, ack 1, win 4017, options [nop,nop,TS val 62900 ecr 4294816226,mptcp dss ack 3380555454 seq 2130102534 subseq 19993 len 1428 csum 0xde0b], length 1428
21:13:03.482810 IP 112.26.1.1.40367 > 112.26.1.8.35583: Flags [.], seq 17137:18565, ack 1, win 4017, options [nop,nop,TS val 62711 ecr 4294815991,mptcp dss ack 3380555454 seq 2130092538 subseq 17137 len 1428 csum 0xcd03], length 1428
21:13:03.541728 IP 112.26.1.8.35583 > 112.26.1.1.40367: Flags [.], ack 8569, win 2327, options [nop,nop,TS val 4294816731 ecr 61438,mptcp dss ack 2130025422], length 0
21:13:03.545629 IP 112.26.1.1.40367 > 112.26.1.8.35583: Flags [.], seq 28561:29989, ack 1, win 4017, options [nop,nop,TS val 63688 ecr 4294816731,mptcp dss ack 3380555454 seq 2130138234 subseq 28561 len 1428 csum 0x9700], length 1428
21:13:03.563738 IP 112.26.1.8.35583 > 112.26.1.1.40367: Flags [.], ack 15709, win 2806, options [nop,nop,TS val 4294817453 ecr 62442,mptcp dss ack 2130046842], length 0
21:13:03.621191 IP 112.26.1.1.40367 > 112.26.1.8.35583: Flags [.], seq 29989:31417, ack 1, win 4017, options [nop,nop,TS val 63688 ecr 4294816731,mptcp dss ack 3380555454 seq 2130139662 subseq 29989 len 1428 csum 0xffb6], length 1428
21:13:03.635745 IP 112.26.1.8.35583 > 112.26.1.1.40367: Flags [.], ack 9997, win 2396, options [nop,nop,TS val 4294816800 ecr 61438,mptcp dss ack 2130026850], length 0
21:13:03.656467 IP 112.26.1.1.40367 > 112.26.1.8.35583: Flags [.], seq 18565:19993, ack 1, win 4017, options [nop,nop,TS val 62711 ecr 4294815991,mptcp dss ack 3380555454 seq 2130093966 subseq 18565 len 1428 csum 0x32b5], length 1428
21:13:03.679963 IP 112.26.1.1.40367 > 112.26.1.8.35583: Flags [.], seq 22849:24277, ack 1, win 4017, options [nop,nop,TS val 63072 ecr 4294816323,mptcp dss ack 3380555454 seq 2130108246 subseq 22849 len 1428 csum 0xa0d5], length 1428
21:13:03.684915 IP 112.26.1.1.40367 > 112.26.1.8.35583: Flags [.], seq 31417:32845, ack 1, win 4017, options [nop,nop,TS val 63782 ecr 4294816800,mptcp dss ack 3380555454 seq 2130143946 subseq 31417 len 1428 csum 0xc47a], length 1428
21:13:03.734653 IP 112.26.1.1.40367 > 112.26.1.8.35583: Flags [.], seq 24277:25705, ack 1, win 4017, options [nop,nop,TS val 63072 ecr 4294816323,mptcp dss ack 3380555454 seq 2130109674 subseq 24277 len 1428 csum 0xf272], length 1428
21:13:03.741011 IP 112.26.1.1.40367 > 112.26.1.8.35583: Flags [.], seq 32845:34273, ack 1, win 4017, options [nop,nop,TS val 63782 ecr 4294816800,mptcp dss ack 3380555454 seq 2130145374 subseq 32845 len 1428 csum 0x603e], length 1428
21:13:03.752536 IP 112.26.1.8.35583 > 112.26.1.1.40367: Flags [.], ack 17137, win 2852, options [nop,nop,TS val 4294817538 ecr 62442,mptcp dss ack 2130046842], length 0
21:13:03.836249 IP 112.26.1.8.35583 > 112.26.1.1.40367: Flags [.], ack 12853, win 2555, options [nop,nop,TS val 4294817034 ecr 61438,mptcp dss ack 2130029706], length 0
21:13:03.846404 IP 112.26.1.1.40367 > 112.26.1.8.35583: Flags [.], seq 19993:21421, ack 1, win 4017, options [nop,nop,TS val 62900 ecr 4294816226,mptcp dss ack 3380555454 seq 2130102534 subseq 19993 len 1428 csum 0xde0b], length 1428
21:13:03.855350 IP 112.26.1.1.40367 > 112.26.1.8.35583: Flags [.], seq 34273:35701, ack 1, win 4017, options [nop,nop,TS val 63982 ecr 4294817034,mptcp dss ack 3380555454 seq 2130155370 subseq 34273 len 1428 csum 0xa854], length 1428
21:13:03.876619 IP 112.26.1.8.35583 > 112.26.1.1.40367: Flags [.], ack 18565, win 2943, options [nop,nop,TS val 4294817702 ecr 62711,mptcp dss ack 2130046842], length 0
21:13:03.899006 IP 112.26.1.1.40367 > 112.26.1.8.35583: Flags [.], seq 35701:37129, ack 1, win 4017, options [nop,nop,TS val 63982 ecr 4294817034,mptcp dss ack 3380555454 seq 2130156798 subseq 35701 len 1428 csum 0xd061], length 1428
21:13:03.945328 IP 112.26.1.8.35583 > 112.26.1.1.40367: Flags [.], ack 19993, win 3035, options [nop,nop,TS val 4294817863 ecr 62711,mptcp dss ack 2130046842], length 0
21:13:03.969819 IP 112.26.1.1.40367 > 112.26.1.8.35583: Flags [.], seq 37129:38557, ack 1, win 4017, options [nop,nop,TS val 63982 ecr 4294817034,mptcp dss ack 3380555454 seq 2130158226 subseq 37129 len 1428 csum 0x9427], length 1428
21:13:03.978351 IP 112.26.1.1.40367 > 112.26.1.8.35583: Flags [.], seq 25705:27133, ack 1, win 4017, options [nop,nop,TS val 63503 ecr 4294816653,mptcp dss ack 3380555454 seq 2130129666 subseq 25705 len 1428 csum 0xc01], length 1428
21:13:04.019845 IP 112.26.1.1.40367 > 112.26.1.8.35583: Flags [.], seq 22849:24277, ack 1, win 4017, options [nop,nop,TS val 63072 ecr 4294816323,mptcp dss ack 3380555454 seq 2130108246 subseq 22849 len 1428 csum 0xa0d5], length 1428
21:13:04.051255 IP 112.26.1.1.40367 > 112.26.1.8.35583: Flags [.], seq 38557:39985, ack 1, win 4017, options [nop,nop,TS val 63982 ecr 4294817034,mptcp dss ack 3380555454 seq 2130159654 subseq 38557 len 1428 csum 0x7172], length 1428
21:13:04.088194 IP 112.26.1.1.40367 > 112.26.1.8.35583: Flags [.], seq 24277:25705, ack 1, win 4017, options [nop,nop,TS val 63072 ecr 4294816323,mptcp dss ack 3380555454 seq 2130109674 subseq 24277 len 1428 csum 0xf272], length 1428
21:13:04.099630 IP 112.26.1.8.35583 > 112.26.1.1.40367: Flags [.], ack 14281, win 2647, options [nop,nop,TS val 4294817233 ecr 61832,mptcp dss ack 2130046842], length 0
21:13:04.139674 IP 112.26.1.8.35583 > 112.26.1.1.40367: Flags [.], ack 21421, win 3103, options [nop,nop,TS val 4294818059 ecr 62900,mptcp dss ack 2130046842], length 0
21:13:04.157452 IP 112.26.1.1.40367 > 112.26.1.8.35583: Flags [.], seq 39985:41413, ack 1, win 4017, options [nop,nop,TS val 64246 ecr 4294817233,mptcp dss ack 3380555454 seq 2130168222 subseq 39985 len 1428 csum 0xf5a5], length 1428
21:13:04.187805 IP 112.26.1.1.40367 > 112.26.1.8.35583: Flags [.], seq 25705:27133, ack 1, win 4017, options [nop,nop,TS val 63503 ecr 4294816653,mptcp dss ack 3380555454 seq 2130129666 subseq 25705 len 1428 csum 0xc01], length 1428
21:13:04.197086 IP 112.26.1.1.40367 > 112.26.1.8.35583: Flags [.], seq 41413:42841, ack 1, win 4017, options [nop,nop,TS val 64246 ecr 4294817233,mptcp dss ack 3380555454 seq 2130169650 subseq 41413 len 1428 csum 0xf344], length 1428
21:13:04.208615 IP 112.26.1.1.40367 > 112.26.1.8.35583: Flags [.], seq 28561:29989, ack 1, win 4017, options [nop,nop,TS val 63688 ecr 4294816731,mptcp dss ack 3380555454 seq 2130138234 subseq 28561 len 1428 csum 0x9700], length 1428
21:13:04.291713 IP 112.26.1.8.35583 > 112.26.1.1.40367: Flags [.], ack 15709, win 2806, options [nop,nop,TS val 4294817453 ecr 62442,mptcp dss ack 2130046842], length 0
21:13:04.297659 IP 112.26.1.8.35583 > 112.26.1.1.40367: Flags [.], ack 21421, win 3217, options [nop,nop,TS val 4294818231 ecr 62900,nop,nop,sack 1 {22849:24277},mptcp dss ack 2130046842], length 0
21:13:04.339191 IP 112.26.1.1.40367 > 112.26.1.8.35583: Flags [.], seq 29989:31417, ack 1, win 4017, options [nop,nop,TS val 63688 ecr 4294816731,mptcp dss ack 3380555454 seq 2130139662 subseq 29989 len 1428 csum 0xffb6], length 1428
21:13:04.366584 IP 112.26.1.8.35583 > 112.26.1.1.40367: Flags [.], ack 21421, win 3240, options [nop,nop,TS val 4294818303 ecr 62900,nop,nop,sack 1 {22849:25705},mptcp dss ack 2130046842], length 0
21:13:04.400939 IP 112.26.1.1.40367 > 112.26.1.8.35583: Flags [.], seq 31417:32845, ack 1, win 4017, options [nop,nop,TS val 63782 ecr 4294816800,mptcp dss ack 3380555454 seq 2130143946 subseq 31417 len 1428 csum 0xc47a], length 1428
21:13:04.490515 IP 112.26.1.1.40367 > 112.26.1.8.35583: Flags [.], seq 32845:34273, ack 1, win 4017, options [nop,nop,TS val 63782 ecr 4294816800,mptcp dss ack 3380555454 seq 2130145374 subseq 32845 len 1428 csum 0x603e], length 1428
21:13:04.512864 IP 112.26.1.8.35583 > 112.26.1.1.40367: Flags [.], ack 21421, win 3331, options [nop,nop,TS val 4294818407 ecr 62900,nop,nop,sack 1 {22849:27133},mptcp dss ack 2130046842], length 0
21:13:04.572619 IP 112.26.1.1.40367 > 112.26.1.8.35583: Flags [.], seq 34273:35701, ack 1, win 4017, options [nop,nop,TS val 63982 ecr 4294817034,mptcp dss ack 3380555454 seq 2130155370 subseq 34273 len 1428 csum 0xa854], length 1428
21:13:04.594524 IP 112.26.1.1.40367 > 112.26.1.8.35583: Flags [.], seq 28561:29989, ack 1, win 4017, options [nop,nop,TS val 63688 ecr 4294816731,mptcp dss ack 3380555454 seq 2130138234 subseq 28561 len 1428 csum 0x9700], length 1428
21:13:04.641909 IP 112.26.1.1.40367 > 112.26.1.8.35583: Flags [.], seq 35701:37129, ack 1, win 4017, options [nop,nop,TS val 63982 ecr 4294817034,mptcp dss ack 3380555454 seq 2130156798 subseq 35701 len 1428 csum 0xd061], length 1428
21:13:04.646239 IP 112.26.1.1.40367 > 112.26.1.8.35583: Flags [.], seq 29989:31417, ack 1, win 4017, options [nop,nop,TS val 63688 ecr 4294816731,mptcp dss ack 3380555454 seq 2130139662 subseq 29989 len 1428 csum 0xffb6], length 1428
21:13:04.729171 IP 112.26.1.1.40367 > 112.26.1.8.35583: Flags [.], seq 31417:32845, ack 1, win 4017, options [nop,nop,TS val 63782 ecr 4294816800,mptcp dss ack 3380555454 seq 2130143946 subseq 31417 len 1428 csum 0xc47a], length 1428
21:13:04.765241 IP 112.26.1.1.40367 > 112.26.1.8.35583: Flags [.], seq 38557:39985, ack 1, win 4017, options [nop,nop,TS val 63982 ecr 4294817034,mptcp dss ack 3380555454 seq 2130159654 subseq 38557 len 1428 csum 0x7172], length 1428
21:13:04.806618 IP 112.26.1.8.35583 > 112.26.1.1.40367: Flags [.], ack 21421, win 3103, options [nop,nop,TS val 4294818059 ecr 62900,mptcp dss ack 2130046842], length 0
21:13:04.809950 IP 112.26.1.1.40367 > 112.26.1.8.35583: Flags [.], seq 42841:44269, ack 1, win 4017, options [nop,nop,TS val 64953 ecr 4294818059,mptcp dss ack 3380555454 seq 2130178218 subseq 42841 len 1428 csum 0xf84c], length 1428
21:13:04.831812 IP 112.26.1.1.40367 > 112.26.1.8.35583: Flags [.], seq 32845:34273, ack 1, win 4017, options [nop,nop,TS val 63782 ecr 4294816800,mptcp dss ack 3380555454 seq 2130145374 subseq 32845 len 1428 csum 0x603e], length 1428
21:13:04.859736 IP 112.26.1.1.40367 > 112.26.1.8.35583: Flags [.], seq 39985:41413, ack 1, win 4017, options [nop,nop,TS val 64246 ecr 4294817233,mptcp dss ack 3380555454 seq 2130168222 subseq 39985 len 1428 csum 0xf5a5], length 1428
21:13:04.900653 IP 112.26.1.1.40367 > 112.26.1.8.35583: Flags [.], seq 34273:35701, ack 1, win 4017, options [nop,nop,TS val 63982 ecr 4294817034,mptcp dss ack 3380555454 seq 2130155370 subseq 34273 len 1428 csum 0xa854], length 1428
21:13:04.947086 IP 112.26.1.8.35583 > 112.26.1.1.40367: Flags [.], ack 21421, win 3217, options [nop,nop,TS val 4294818231 ecr 62900,nop,nop,sack 1 {22849:24277},mptcp dss ack 2130046842], length 0
21:13:04.975450 IP 112.26.1.8.35583 > 112.26.1.1.40367: Flags [.], ack 21421, win 3536, options [nop,nop,TS val 4294818813 ecr 62900,nop,nop,sack 2 {28561:29989}{22849:27133},mptcp dss ack 2130069690], length 0
21:13:04.993467 IP 112.26.1.1.40367 > 112.26.1.8.35583: Flags [.], seq 44269:45697, ack 1, win 4017, options [nop,nop,TS val 65137 ecr 4294818231,mptcp dss ack 3380555454 seq 2130182502 subseq 44269 len 1428 csum 0xb713], length 1428
21:13:05.014576 IP 112.26.1.1.40367 > 112.26.1.8.35583: Flags [.], seq 35701:37129, ack 1, win 4017, options [nop,nop,TS val 63982 ecr 4294817034,mptcp dss ack 3380555454 seq 2130156798 subseq 35701 len 1428 csum 0xd061], length 1428
21:13:05.024066 IP 112.26.1.8.35583 > 112.26.1.1.40367: Flags [.], ack 21421, win 3240, options [nop,nop,TS val 4294818303 ecr 62900,nop,nop,sack 1 {22849:25705},mptcp dss ack 2130046842], length 0
21:13:05.052636 IP 112.26.1.1.40367 > 112.26.1.8.35583: Flags [.], seq 45697:47125, ack 1, win 4017, options [nop,nop,TS val 65191 ecr 4294818303,mptcp dss ack 3380555454 seq 2130185358 subseq 45697 len 1428 csum 0x7f2f], length 1428
21:13:05.109013 IP 112.26.1.8.35583 > 112.26.1.1.40367: Flags [.], ack 21421, win 3331, options [nop,nop,TS val 4294818407 ecr 62900,nop,nop,sack 1 {22849:27133},mptcp dss ack 2130046842], length 0
21:13:05.129668 IP 112.26.1.8.35583 > 112.26.1.1.40367: Flags [.], ack 21421, win 3605, options [nop,nop,TS val 4294818865 ecr 62900,nop,nop,sack 2 {28561:31417}{22849:27133},mptcp dss ack 2130069690], length 0
21:13:05.142935 IP 112.26.1.1.40367 > 112.26.1.8.35583: Flags [.], seq 21421:22849, ack 1, win 4017, options [nop,nop,TS val 65255 ecr 4294818407,mptcp dss ack 3380555454 seq 2130103962 subseq 21421 len 1428 csum 0xbdea], length 1428
21:13:05.152461 IP 112.26.1.8.35583 > 112.26.1.1.40367: Flags [.], ack 21421, win 3673, options [nop,nop,TS val 4294818948 ecr 62900,nop,nop,sack 2 {28561:32845}{22849:27133},mptcp dss ack 2130069690], length 0
21:13:05.163631 IP 112.26.1.1.40367 > 112.26.1.8.35583: Flags [.], seq 42841:44269, ack 1, win 4017, options [nop,nop,TS val 64953 ecr 4294818059,mptcp dss ack 3380555454 seq 2130178218 subseq 42841 len 1428 csum 0xf84c], length 1428
21:13:05.225166 IP 112.26.1.1.40367 > 112.26.1.8.35583: Flags [.], seq 38557:39985, ack 1, win 4017, options [nop,nop,TS val 63982 ecr 4294817034,mptcp dss ack 3380555454 seq 2130159654 subseq 38557 len 1428 csum 0x7172], length 1428
21:13:05.249931 IP 112.26.1.8.35583 > 112.26.1.1.40367: Flags [.], ack 21421, win 3536, options [nop,nop,TS val 4294818813 ecr 62900,nop,nop,sack 2 {28561:29989}{22849:27133},mptcp dss ack 2130069690], length 0
21:13:05.261281 IP 112.26.1.1.40367 > 112.26.1.8.35583: Flags [.], seq 27133:28561, ack 1, win 4017, options [nop,nop,TS val 65396 ecr 4294818813,mptcp dss ack 3380555454 seq 2130131094 subseq 27133 len 1428 csum 0xd59d], length 1428
21:13:05.292907 IP 112.26.1.8.35583 > 112.26.1.1.40367: Flags [.], ack 21421, win 3696, options [nop,nop,TS val 4294819051 ecr 62900,nop,nop,sack 2 {28561:34273}{22849:27133},mptcp dss ack 2130069690], length 0
21:13:05.328830 IP 112.26.1.1.40367 > 112.26.1.8.35583: Flags [.], seq 44269:45697, ack 1, win 4017, options [nop,nop,TS val 65137 ecr 4294818231,mptcp dss ack 3380555454 seq 2130182502 subseq 44269 len 1428 csum 0xb713], length 1428
21:13:05.355308 IP 112.26.1.1.40367 > 112.26.1.8.35583: Flags [.], seq 39985:41413, ack 1, win 4017, options [nop,nop,TS val 64246 ecr 4294817233,mptcp dss ack 3380555454 seq 2130168222 subseq 39985 len 1428 csum 0xf5a5], length 1428
21:13:05.400247 IP 112.26.1.1.40367 > 112.26.1.8.35583: Flags [.], seq 45697:47125, ack 1, win 4017, options [nop,nop,TS val 65191 ecr 4294818303,mptcp dss ack 3380555454 seq 2130185358 subseq 45697 len 1428 csum 0x7f2f], length 1428
21:13:05.411994 IP 112.26.1.8.35583 > 112.26.1.1.40367: Flags [.], ack 21421, win 3787, options [nop,nop,TS val 4294819119 ecr 62900,nop,nop,sack 2 {28561:35701}{22849:27133},mptcp dss ack 2130069690], length 0
21:13:05.444589 IP 112.26.1.8.35583 > 112.26.1.1.40367: Flags [.], ack 21421, win 3605, options [nop,nop,TS val 4294818865 ecr 62900,nop,nop,sack 2 {28561:31417}{22849:27133},mptcp dss ack 2130069690], length 0
21:13:05.457414 IP 112.26.1.1.40367 > 112.26.1.8.35583: Flags [.], seq 47125:48553, ack 1, win 4017, options [nop,nop,TS val 65601 ecr 4294818865,mptcp dss ack 3380555454 seq 2130198210 subseq 47125 len 1428 csum 0x5517], length 1428
21:13:05.475464 IP 112.26.1.8.35583 > 112.26.1.1.40367: Flags [.], ack 21421, win 3856, options [nop,nop,TS val 4294819229 ecr 62900,nop,nop,sack 2 {28561:37129}{22849:27133},mptcp dss ack 2130075402], length 0
21:13:05.484156 IP 112.26.1.1.40367 > 112.26.1.8.35583: Flags [.], seq 21421:22849, ack 1, win 4017, options [nop,nop,TS val 65255 ecr 4294818407,mptcp dss ack 3380555454 seq 2130103962 subseq 21421 len 1428 csum 0xbdea], length 1428
21:13:05.538510 IP 112.26.1.8.35583 > 112.26.1.1.40367: Flags [.], ack 21421, win 3673, options [nop,nop,TS val 4294818948 ecr 62900,nop,nop,sack 2 {28561:32845}{22849:27133},mptcp dss ack 2130069690], length 0
21:13:05.561443 IP 112.26.1.1.40367 > 112.26.1.8.35583: Flags [.], seq 42841:44269, ack 1, win 4017, options [nop,nop,TS val 64953 ecr 4294818059,mptcp dss ack 3380555454 seq 2130178218 subseq 42841 len 1428 csum 0xf84c], length 1428
21:13:05.596667 IP 112.26.1.1.40367 > 112.26.1.8.35583: Flags [.], seq 27133:28561, ack 1, win 4017, options [nop,nop,TS val 65396 ecr 4294818813,mptcp dss ack 3380555454 seq 2130131094 subseq 27133 len 1428 csum 0xd59d], length 1428
21:13:05.616449 IP 112.26.1.8.35583 > 112.26.1.1.40367: Flags [.], ack 21421, win 3970, options [nop,nop,TS val 4294819439 ecr 62900,nop,nop,sack 2 {38557:39985}{28561:37129},mptcp dss ack 2130096822], length 0
21:13:05.673783 IP 112.26.1.8.35583 > 112.26.1.1.40367: Flags [.], ack 21421, win 3696, options [nop,nop,TS val 4294819051 ecr 62900,nop,nop,sack 2 {28561:34273}{22849:27133},mptcp dss ack 2130069690], length 0
21:13:05.685877 IP 112.26.1.1.40367 > 112.26.1.8.35583: Flags [.], seq 44269:45697, ack 1, win 4017, options [nop,nop,TS val 65137 ecr 4294818231,mptcp dss ack 3380555454 seq 2130182502 subseq 44269 len 1428 csum 0xb713], length 1428
21:13:05.746146 IP 112.26.1.8.35583 > 112.26.1.1.40367: Flags [.], ack 21421, win 4038, options [nop,nop,TS val 4294819575 ecr 62900,nop,nop,sack 2 {38557:41413}{28561:37129},mptcp dss ack 2130099678], length 0
21:13:05.756730 IP 112.26.1.8.35583 > 112.26.1.1.40367: Flags [.], ack 21421, win 3787, options [nop,nop,TS val 4294819119 ecr 62900,nop,nop,sack 2 {28561:35701}{22849:27133},mptcp dss ack 2130069690], length 0
21:13:05.762854 IP 112.26.1.1.40367 > 112.26.1.8.35583: Flags [.], seq 48553:49981, ack 1, win 4017, options [nop,nop,TS val 65904 ecr 4294819051,mptcp dss ack 3380555454 seq 2130213918 subseq 48553 len 1428 csum 0xd10e], length 1428
21:13:05.788346 IP 112.26.1.1.40367 > 112.26.1.8.35583: Flags [.], seq 45697:47125, ack 1, win 4017, options [nop,nop,TS val 65191 ecr 4294818303,mptcp dss ack 3380555454 seq 2130185358 subseq 45697 len 1428 csum 0x7f2f], length 1428
21:13:05.828639 IP 112.26.1.1.40367 > 112.26.1.8.35583: Flags [.], seq 47125:48553, ack 1, win 4017, options [nop,nop,TS val 65601 ecr 4294818865,mptcp dss ack 3380555454 seq 2130198210 subseq 47125 len 1428 csum 0x5517], length 1428
21:13:05.874404 IP 112.26.1.1.40367 > 112.26.1.8.35583: Flags [.], seq 49981:51409, ack 1, win 4017, options [nop,nop,TS val 65918 ecr 4294819119,mptcp dss ack 3380555454 seq 2130215346 subseq 49981 len 1428 csum 0xa56e], length 1428
21:13:05.885542 IP 112.26.1.1.40367 > 112.26.1.8.35583: Flags [.], seq 21421:22849, ack 1, win 4017, options [nop,nop,TS val 65255 ecr 4294818407,mptcp dss ack 3380555454 seq 2130103962 subseq 21421 len 1428 csum 0xbdea], length 1428
21:13:05.918986 IP 112.26.1.8.35583 > 112.26.1.1.40367: Flags [.], ack 21421, win 3856, options [nop,nop,TS val 4294819229 ecr 62900,nop,nop,sack 2 {28561:37129}{22849:27133},mptcp dss ack 2130075402], length 0
21:13:05.972070 IP 112.26.1.8.35583 > 112.26.1.1.40367: Flags [.], ack 21421, win 4130, options [nop,nop,TS val 4294819777 ecr 62900,nop,nop,sack 2 {42841:44269}{38557:41413},mptcp dss ack 2130099678], length 0
21:13:05.978904 IP 112.26.1.8.35583 > 112.26.1.1.40367: Flags [.], ack 21421, win 3970, options [nop,nop,TS val 4294819439 ecr 62900,nop,nop,sack 2 {38557:39985}{28561:37129},mptcp dss ack 2130096822], length 0
21:13:06.013701 IP 112.26.1.8.35583 > 112.26.1.1.40367: Flags [.], ack 21421, win 4038, options [nop,nop,TS val 4294819575 ecr 62900,nop,nop,sack 2 {38557:41413}{28561:37129},mptcp dss ack 2130099678], length 0
21:13:06.020335 IP 112.26.1.1.40367 > 112.26.1.8.35583: Flags [.], seq 37129:38557, ack 1, win 4017, options [nop,nop,TS val 66160 ecr 4294819575,mptcp dss ack 3380555454 seq 2130158226 subseq 37129 len 1428 csum 0x9427], length 1428
21:13:06.037934 IP 112.26.1.1.40367 > 112.26.1.8.35583: Flags [.], seq 27133:28561, ack 1, win 4017, options [nop,nop,TS val 65396 ecr 4294818813,mptcp dss ack 3380555454 seq 2130131094 subseq 27133 len 1428 csum 0xd59d], length 1428
21:13:06.106780 IP 112.26.1.8.35583 > 112.26.1.1.40367: Flags [.], ack 21421, win 4198, options [nop,nop,TS val 4294819905 ecr 62900,nop,nop,sack 2 {42841:45697}{38557:41413},mptcp dss ack 2130099678], length 0
21:13:06.129172 IP 112.26.1.1.40367 > 112.26.1.8.35583: Flags [.], seq 48553:49981, ack 1, win 4017, options [nop,nop,TS val 65904 ecr 4294819051,mptcp dss ack 3380555454 seq 2130213918 subseq 48553 len 1428 csum 0xd10e], length 1428
21:13:06.187862 IP 112.26.1.8.35583 > 112.26.1.1.40367: Flags [.], ack 21421, win 4289, options [nop,nop,TS val 4294820008 ecr 62900,nop,nop,sack 2 {42841:47125}{38557:41413},mptcp dss ack 2130103962], length 0
21:13:06.199427 IP 112.26.1.1.40367 > 112.26.1.8.35583: Flags [.], seq 49981:51409, ack 1, win 4017, options [nop,nop,TS val 65918 ecr 4294819119,mptcp dss ack 3380555454 seq 2130215346 subseq 49981 len 1428 csum 0xa56e], length 1428
21:13:06.224181 IP 112.26.1.1.40367 > 112.26.1.8.35583: Flags [.], seq 47125:48553, ack 1, win 4017, options [nop,nop,TS val 65601 ecr 4294818865,mptcp dss ack 3380555454 seq 2130198210 subseq 47125 len 1428 csum 0x5517], length 1428
21:13:06.251128 IP 112.26.1.8.35583 > 112.26.1.1.40367: Flags [.], ack 21421, win 4130, options [nop,nop,TS val 4294819777 ecr 62900,nop,nop,sack 2 {42841:44269}{38557:41413},mptcp dss ack 2130099678], length 0
21:13:06.254840 IP 112.26.1.1.40367 > 112.26.1.8.35583: Flags [.], seq 41413:42841, ack 1, win 4017, options [nop,nop,TS val 66397 ecr 4294819777,mptcp dss ack 3380555454 seq 2130169650 subseq 41413 len 1428 csum 0xf344], length 1428
21:13:06.314294 IP 112.26.1.8.35583 > 112.26.1.1.40367: Flags [.], ack 27133, win 4358, options [nop,nop,TS val 4294820102 ecr 65255,nop,nop,sack 2 {42841:47125}{38557:41413},mptcp dss ack 2130118242], length 0
21:13:06.338605 IP 112.26.1.8.35583 > 112.26.1.1.40367: Flags [.], ack 37129, win 4449, options [nop,nop,TS val 4294820252 ecr 65396,nop,nop,sack 2 {42841:47125}{38557:41413},mptcp dss ack 2130148230], length 0
21:13:06.352992 IP 112.26.1.1.40367 > 112.26.1.8.35583: Flags [.], seq 37129:38557, ack 1, win 4017, options [nop,nop,TS val 66160 ecr 4294819575,mptcp dss ack 3380555454 seq 2130158226 subseq 37129 len 1428 csum 0x9427], length 1428
21:13:06.382566 IP 112.26.1.1.40367 > 112.26.1.8.35583: Flags [.], seq 48553:49981, ack 1, win 4017, options [nop,nop,TS val 65904 ecr 4294819051,mptcp dss ack 3380555454 seq 2130213918 subseq 48553 len 1428 csum 0xd10e], length 1428
21:13:06.443235 IP 112.26.1.8.35583 > 112.26.1.1.40367: Flags [.], ack 21421, win 4198, options [nop,nop,TS val 4294819905 ecr 62900,nop,nop,sack 2 {42841:45697}{38557:41413},mptcp dss ack 2130099678], length 0
21:13:06.458298 IP 112.26.1.1.40367 > 112.26.1.8.35583: Flags [.], seq 49981:51409, ack 1, win 4017, options [nop,nop,TS val 65918 ecr 4294819119,mptcp dss ack 3380555454 seq 2130215346 subseq 49981 len 1428 csum 0xa56e], length 1428
21:13:06.466346 IP 112.26.1.1.40367 > 112.26.1.8.35583: Flags [.], seq 51409:52837, ack 1, win 4017, options [nop,nop,TS val 66603 ecr 4294819905,mptcp dss ack 3380555454 seq 2130232482 subseq 51409 len 1428 csum 0x38d], length 1428
21:13:06.520152 IP 112.26.1.8.35583 > 112.26.1.1.40367: Flags [.], ack 37129, win 4563, options [nop,nop,TS val 4294820443 ecr 65396,nop,nop,sack 2 {42841:48553}{38557:41413},mptcp dss ack 2130148230], length 0
21:13:06.543970 IP 112.26.1.1.40367 > 112.26.1.8.35583: Flags [.], seq 37129:38557, ack 1, win 4017, options [nop,nop,TS val 66160 ecr 4294819575,mptcp dss ack 3380555454 seq 2130158226 subseq 37129 len 1428 csum 0x9427], length 1428
21:13:06.545771 IP 112.26.1.8.35583 > 112.26.1.1.40367: Flags [.], ack 21421, win 4289, options [nop,nop,TS val 4294820008 ecr 62900,nop,nop,sack 2 {42841:47125}{38557:41413},mptcp dss ack 2130103962], length 0
21:13:06.552525 IP 112.26.1.1.40367 > 112.26.1.8.35583: Flags [.], seq 52837:54265, ack 1, win 4017, options [nop,nop,TS val 66696 ecr 4294820008,mptcp dss ack 3380555454 seq 2130236766 subseq 52837 len 1428 csum 0x6ba6], length 1428
21:13:06.639280 IP 112.26.1.1.40367 > 112.26.1.8.35583: Flags [.], seq 41413:42841, ack 1, win 4017, options [nop,nop,TS val 66397 ecr 4294819777,mptcp dss ack 3380555454 seq 2130169650 subseq 41413 len 1428 csum 0xf344], length 1428
21:13:06.658204 IP 112.26.1.8.35583 > 112.26.1.1.40367: Flags [.], ack 37129, win 4677, options [nop,nop,TS val 4294820602 ecr 65396,nop,nop,sack 2 {42841:49981}{38557:41413},mptcp dss ack 2130148230], length 0
21:13:06.670876 IP 112.26.1.8.35583 > 112.26.1.1.40367: Flags [.], ack 27133, win 4358, options [nop,nop,TS val 4294820102 ecr 65255,nop,nop,sack 2 {42841:47125}{38557:41413},mptcp dss ack 2130118242], length 0
