21:13:01.097253 IP 112.26.1.8.35583 > 112.26.1.1.40367: Flags [S], seq 2868810643, win 29200, options [mss 1460,sackOK,TS val 4294815180 ecr 0,nop,wscale 7,mptcp join id 3 token 0x329820ce nonce 0x35750e7f], length 0
21:13:01.097508 IP 112.26.1.1.40367 > 112.26.1.8.35583: Flags [S.], seq 2680798708, ack 2868810644, win 65535, options [mss 1460,sackOK,TS val 61243 ecr 4294815180,nop,wscale 6,mptcp join id 3 hmac 0xe06dfaf1e4e6e1c5 nonce 0x4e95d7be], length 0
21:13:01.200181 IP 112.26.1.1.40367 > 112.26.1.8.35583: Flags [S.], seq 2680798708, ack 2868810644, win 65535, options [mss 1460,sackOK,TS val 61243 ecr 4294815180,nop,wscale 6,mptcp join id 3 hmac 0xe06dfaf1e4e6e1c5 nonce 0x4e95d7be], length 0
21:13:01.289814 IP 112.26.1.8.35583 > 112.26.1.1.40367: Flags [.], ack 1, win 1255, options [nop,nop,TS val 4294815421 ecr 61243,mptcp join hmac 0x74df8aa60a1bd8166a0670a7ca5bace4c3244274], length 0
21:13:01.290357 IP 112.26.1.1.40367 > 112.26.1.8.35583: Flags [.], ack 1, win 2678, options [nop,nop,TS val 61436 ecr 4294815421,mptcp dss ack 3380555454], length 0
21:13:01.290602 IP 112.26.1.1.40367 > 112.26.1.8.35583: Flags [.], seq 1:1429, ack 1, win 2678, options [nop,nop,TS val 61437 ecr 4294815421,mptcp dss ack 3380555454 seq 2130016854 subseq 1 len 1428 csum 0xfe5], length 1428
21:13:01.290669 IP 112.26.1.1.40367 > 112.26.1.8.35583: Flags [.], seq 1429:2857, ack 1, win 2678, options [nop,nop,TS val 61437 ecr 4294815421,mptcp dss ack 3380555454 seq 2130018282 subseq 1429 len 1428 csum 0x9cca], length 1428
21:13:01.290827 IP 112.26.1.1.40367 > 112.26.1.8.35583: Flags [.], seq 2857:4285, ack 1, win 2678, options [nop,nop,TS val 61437 ecr 4294815421,mptcp dss ack 3380555454 seq 2130019710 subseq 2857 len 1428 csum 0x2b03], length 1428
21:13:01.290964 IP 112.26.1.1.40367 > 112.26.1.8.35583: Flags [.], seq 4285:5713, ack 1, win 2678, options [nop,nop,TS val 61437 ecr 4294815421,mptcp dss ack 3380555454 seq 2130021138 subseq 4285 len 1428 csum 0x7c89], length 1428
21:13:01.291259 IP 112.26.1.1.40367 > 112.26.1.8.35583: Flags [.], seq 5713:7141, ack 1, win 2678, options [nop,nop,TS val 61437 ecr 4294815421,mptcp dss ack 3380555454 seq 2130022566 subseq 5713 len 1428 csum 0x5709], length 1428
21:13:01.291749 IP 112.26.1.1.40367 > 112.26.1.8.35583: Flags [.], seq 7141:8569, ack 1, win 2678, options [nop,nop,TS val 61438 ecr 4294815421,mptcp dss ack 3380555454 seq 2130023994 subseq 7141 len 1428 csum 0x381e], length 1428
21:13:01.291980 IP 112.26.1.1.40367 > 112.26.1.8.35583: Flags [.], seq 8569:9997, ack 1, win 2678, options [nop,nop,TS val 61438 ecr 4294815421,mptcp dss ack 3380555454 seq 2130025422 subseq 8569 len 1428 csum 0xbf7a], length 1428
21:13:01.292136 IP 112.26.1.1.40367 > 112.26.1.8.35583: Flags [.], seq 9997:11425, ack 1, win 2678, options [nop,nop,TS val 61438 ecr 4294815421,mptcp dss ack 3380555454 seq 2130026850 subseq 9997 len 1428 csum 0x473], length 1428
21:13:01.292522 IP 112.26.1.1.40367 > 112.26.1.8.35583: Flags [.], seq 11425:12853, ack 1, win 2678, options [nop,nop,TS val 61438 ecr 4294815421,mptcp dss ack 3380555454 seq 2130028278 subseq 11425 len 1428 csum 0xce21], length 1428
21:13:01.292723 IP 112.26.1.1.40367 > 112.26.1.8.35583: Flags [.], seq 12853:14281, ack 1, win 2678, options [nop,nop,TS val 61439 ecr 4294815421,mptcp dss ack 3380555454 seq 2130029706 subseq 12853 len 1428 csum 0x8cf], length 1428
21:13:01.454741 IP 112.26.1.1.40367 > 112.26.1.8.35583: Flags [.], ack 1, win 2678, options [nop,nop,TS val 61436 ecr 4294815421,mptcp dss ack 3380555454], length 0
21:13:01.533377 IP 112.26.1.1.40367 > 112.26.1.8.35583: Flags [.], seq 1:1429, ack 1, win 2678, options [nop,nop,TS val 61437 ecr 4294815421,mptcp dss ack 3380555454 seq 2130016854 subseq 1 len 1428 csum 0xfe5], length 1428
21:13:01.685353 IP 112.26.1.1.40367 > 112.26.1.8.35583: Flags [.], seq 12853:14281, ack 1, win 4017, options [nop,nop,TS val 61832 ecr 4294815421,mptcp dss ack 3380555454 seq 2130029706 subseq 12853 len 1428 csum 0x8cf], length 1428
21:13:01.768530 IP 112.26.1.1.40367 > 112.26.1.8.35583: Flags [.], seq 1429:2857, ack 1, win 2678, options [nop,nop,TS val 61437 ecr 4294815421,mptcp dss ack 3380555454 seq 2130018282 subseq 1429 len 1428 csum 0x9cca], length 1428
21:13:01.864155 IP 112.26.1.1.40367 > 112.26.1.8.35583: Flags [.], seq 2857:4285, ack 1, win 2678, options [nop,nop,TS val 61437 ecr 4294815421,mptcp dss ack 3380555454 seq 2130019710 subseq 2857 len 1428 csum 0x2b03], length 1428
21:13:01.978791 IP 112.26.1.1.40367 > 112.26.1.8.35583: Flags [.], seq 4285:5713, ack 1, win 2678, options [nop,nop,TS val 61437 ecr 4294815421,mptcp dss ack 3380555454 seq 2130021138 subseq 4285 len 1428 csum 0x7c89], length 1428
21:13:02.158989 IP 112.26.1.1.40367 > 112.26.1.8.35583: Flags [.], seq 5713:7141, ack 1, win 2678, options [nop,nop,TS val 61437 ecr 4294815421,mptcp dss ack 3380555454 seq 2130022566 subseq 5713 len 1428 csum 0x5709], length 1428
21:13:02.220923 IP 112.26.1.1.40367 > 112.26.1.8.35583: Flags [.], seq 7141:8569, ack 1, win 2678, options [nop,nop,TS val 61438 ecr 4294815421,mptcp dss ack 3380555454 seq 2130023994 subseq 7141 len 1428 csum 0x381e], length 1428
21:13:02.296121 IP 112.26.1.8.35583 > 112.26.1.1.40367: Flags [.], ack 1429, win 1803, options [nop,nop,TS val 4294815758 ecr 61437,mptcp dss ack 2130011142], length 0
21:13:02.296389 IP 112.26.1.1.40367 > 112.26.1.8.35583: Flags [.], seq 14281:15709, ack 1, win 4017, options [nop,nop,TS val 62442 ecr 4294815758,mptcp dss ack 3380555454 seq 2130081114 subseq 14281 len 1428 csum 0x22ef], length 1428
21:13:02.296474 IP 112.26.1.1.40367 > 112.26.1.8.35583: Flags [.], seq 15709:17137, ack 1, win 4017, options [nop,nop,TS val 62442 ecr 4294815758,mptcp dss ack 3380555454 seq 2130082542 subseq 15709 len 1428 csum 0xb296], length 1428
21:13:02.372911 IP 112.26.1.1.40367 > 112.26.1.8.35583: Flags [.], seq 8569:9997, ack 1, win 2678, options [nop,nop,TS val 61438 ecr 4294815421,mptcp dss ack 3380555454 seq 2130025422 subseq 8569 len 1428 csum 0xbf7a], length 1428
21:13:02.483244 IP 112.26.1.1.40367 > 112.26.1.8.35583: Flags [.], seq 9997:11425, ack 1, win 2678, options [nop,nop,TS val 61438 ecr 4294815421,mptcp dss ack 3380555454 seq 2130026850 subseq 9997 len 1428 csum 0x473], length 1428
21:13:02.539499 IP 112.26.1.1.40367 > 112.26.1.8.35583: Flags [.], seq 11425:12853, ack 1, win 2678, options [nop,nop,TS val 61438 ecr 4294815421,mptcp dss ack 3380555454 seq 2130028278 subseq 11425 len 1428 csum 0xce21], length 1428
21:13:02.565493 IP 112.26.1.8.35583 > 112.26.1.1.40367: Flags [.], ack 2857, win 1917, options [nop,nop,TS val 4294815991 ecr 61437,mptcp dss ack 2130012570], length 0
21:13:02.565752 IP 112.26.1.1.40367 > 112.26.1.8.35583: Flags [.], seq 17137:18565, ack 1, win 4017, options [nop,nop,TS val 62711 ecr 4294815991,mptcp dss ack 3380555454 seq 2130092538 subseq 17137 len 1428 csum 0xcd03], length 1428
21:13:02.565830 IP 112.26.1.1.40367 > 112.26.1.8.35583: Flags [.], seq 18565:19993, ack 1, win 4017, options [nop,nop,TS val 62711 ecr 4294815991,mptcp dss ack 3380555454 seq 2130093966 subseq 18565 len 1428 csum 0x32b5], length 1428
21:13:02.692516 IP 112.26.1.1.40367 > 112.26.1.8.35583: Flags [.], seq 12853:14281, ack 1, win 4017, options [nop,nop,TS val 61832 ecr 4294815421,mptcp dss ack 3380555454 seq 2130029706 subseq 12853 len 1428 csum 0x8cf], length 1428
21:13:02.754256 IP 112.26.1.8.35583 > 112.26.1.1.40367: Flags [.], ack 4285, win 2054, options [nop,nop,TS val 4294816226 ecr 61437,mptcp dss ack 2130015426], length 0
21:13:02.754567 IP 112.26.1.1.40367 > 112.26.1.8.35583: Flags [.], seq 19993:21421, ack 1, win 4017, options [nop,nop,TS val 62900 ecr 4294816226,mptcp dss ack 3380555454 seq 2130102534 subseq 19993 len 1428 csum 0xde0b], length 1428
21:13:02.754639 IP 112.26.1.1.40367 > 112.26.1.8.35583: Flags [.], seq 21421:22849, ack 1, win 4017, options [nop,nop,TS val 62900 ecr 4294816226,mptcp dss ack 3380555454 seq 2130103962 subseq 21421 len 1428 csum 0xbdea], length 1428
21:13:02.854814 IP 112.26.1.1.40367 > 112.26.1.8.35583: Flags [.], seq 14281:15709, ack 1, win 4017, options [nop,nop,TS val 62442 ecr 4294815758,mptcp dss ack 3380555454 seq 2130081114 subseq 14281 len 1428 csum 0x22ef], length 1428
21:13:02.925141 IP 112.26.1.8.35583 > 112.26.1.1.40367: Flags [.], ack 5713, win 2099, options [nop,nop,TS val 4294816323 ecr 61437,mptcp dss ack 2130015426], length 0
21:13:02.925448 IP 112.26.1.1.40367 > 112.26.1.8.35583: Flags [.], seq 22849:24277, ack 1, win 4017, options [nop,nop,TS val 63072 ecr 4294816323,mptcp dss ack 3380555454 seq 2130108246 subseq 22849 len 1428 csum 0xa0d5], length 1428
21:13:02.925519 IP 112.26.1.1.40367 > 112.26.1.8.35583: Flags [.], seq 24277:25705, ack 1, win 4017, options [nop,nop,TS val 63072 ecr 4294816323,mptcp dss ack 3380555454 seq 2130109674 subseq 24277 len 1428 csum 0xf272], length 1428
21:13:02.987900 IP 112.26.1.1.40367 > 112.26.1.8.35583: Flags [.], seq 15709:17137, ack 1, win 4017, options [nop,nop,TS val 62442 ecr 4294815758,mptcp dss ack 3380555454 seq 2130082542 subseq 15709 len 1428 csum 0xb296], length 1428
21:13:03.117525 IP 112.26.1.1.40367 > 112.26.1.8.35583: Flags [.], seq 17137:18565, ack 1, win 4017, options [nop,nop,TS val 62711 ecr 4294815991,mptcp dss ack 3380555454 seq 2130092538 subseq 17137 len 1428 csum 0xcd03], length 1428
21:13:03.272236 IP 112.26.1.1.40367 > 112.26.1.8.35583: Flags [.], seq 18565:19993, ack 1, win 4017, options [nop,nop,TS val 62711 ecr 4294815991,mptcp dss ack 3380555454 seq 2130093966 subseq 18565 len 1428 csum 0x32b5], length 1428
21:13:03.357159 IP 112.26.1.8.35583 > 112.26.1.1.40367: Flags [.], ack 7141, win 2282, options [nop,nop,TS val 4294816653 ecr 61437,mptcp dss ack 2130023994], length 0
21:13:03.357419 IP 112.26.1.1.40367 > 112.26.1.8.35583: Flags [.], seq 25705:27133, ack 1, win 4017, options [nop,nop,TS val 63503 ecr 4294816653,mptcp dss ack 3380555454 seq 2130129666 subseq 25705 len 1428 csum 0xc01], length 1428
21:13:03.357497 IP 112.26.1.1.40367 > 112.26.1.8.35583: Flags [.], seq 27133:28561, ack 1, win 4017, options [nop,nop,TS val 63503 ecr 4294816653,mptcp dss ack 3380555454 seq 2130131094 subseq 27133 len 1428 csum 0xd59d], length 1428
21:13:03.439043 IP 112.26.1.1.40367 > 112.26.1.8.35583: Flags [.], seq 19993:21421, ack 1, win 4017, options [nop,nop,TS val 62900 ecr 4294816226,mptcp dss ack 3380555454 seq 2130102534 subseq 19993 len 1428 csum 0xde0b], length 1428
21:13:03.541953 IP 112.26.1.8.35583 > 112.26.1.1.40367: Flags [.], ack 8569, win 2327, options [nop,nop,TS val 4294816731 ecr 61438,mptcp dss ack 2130025422], length 0
21:13:03.542276 IP 112.26.1.1.40367 > 112.26.1.8.35583: Flags [.], seq 28561:29989, ack 1, win 4017, options [nop,nop,TS val 63688 ecr 4294816731,mptcp dss ack 3380555454 seq 2130138234 subseq 28561 len 1428 csum 0x9700], length 1428
21:13:03.542348 IP 112.26.1.1.40367 > 112.26.1.8.35583: Flags [.], seq 29989:31417, ack 1, win 4017, options [nop,nop,TS val 63688 ecr 4294816731,mptcp dss ack 3380555454 seq 2130139662 subseq 29989 len 1428 csum 0xffb6], length 1428
21:13:03.636080 IP 112.26.1.8.35583 > 112.26.1.1.40367: Flags [.], ack 9997, win 2396, options [nop,nop,TS val 4294816800 ecr 61438,mptcp dss ack 2130026850], length 0
21:13:03.636488 IP 112.26.1.1.40367 > 112.26.1.8.35583: Flags [.], seq 31417:32845, ack 1, win 4017, options [nop,nop,TS val 63782 ecr 4294816800,mptcp dss ack 3380555454 seq 2130143946 subseq 31417 len 1428 csum 0xc47a], length 1428
21:13:03.636549 IP 112.26.1.1.40367 > 112.26.1.8.35583: Flags [.], seq 32845:34273, ack 1, win 4017, options [nop,nop,TS val 63782 ecr 4294816800,mptcp dss ack 3380555454 seq 2130145374 subseq 32845 len 1428 csum 0x603e], length 1428
21:13:03.680225 IP 112.26.1.1.40367 > 112.26.1.8.35583: Flags [.], seq 22849:24277, ack 1, win 4017, options [nop,nop,TS val 63072 ecr 4294816323,mptcp dss ack 3380555454 seq 2130108246 subseq 22849 len 1428 csum 0xa0d5], length 1428
21:13:03.734906 IP 112.26.1.1.40367 > 112.26.1.8.35583: Flags [.], seq 24277:25705, ack 1, win 4017, options [nop,nop,TS val 63072 ecr 4294816323,mptcp dss ack 3380555454 seq 2130109674 subseq 24277 len 1428 csum 0xf272], length 1428
21:13:03.836475 IP 112.26.1.8.35583 > 112.26.1.1.40367: Flags [.], ack 12853, win 2555, options [nop,nop,TS val 4294817034 ecr 61438,mptcp dss ack 2130029706], length 0
21:13:03.836850 IP 112.26.1.1.40367 > 112.26.1.8.35583: Flags [.], seq 34273:35701, ack 1, win 4017, options [nop,nop,TS val 63982 ecr 4294817034,mptcp dss ack 3380555454 seq 2130155370 subseq 34273 len 1428 csum 0xa854], length 1428
21:13:03.836922 IP 112.26.1.1.40367 > 112.26.1.8.35583: Flags [.], seq 35701:37129, ack 1, win 4017, options [nop,nop,TS val 63982 ecr 4294817034,mptcp dss ack 3380555454 seq 2130156798 subseq 35701 len 1428 csum 0xd061], length 1428
21:13:03.837105 IP 112.26.1.1.40367 > 112.26.1.8.35583: Flags [.], seq 37129:38557, ack 1, win 4017, options [nop,nop,TS val 63982 ecr 4294817034,mptcp dss ack 3380555454 seq 2130158226 subseq 37129 len 1428 csum 0x9427], length 1428
21:13:03.837214 IP 112.26.1.1.40367 > 112.26.1.8.35583: Flags [.], seq 38557:39985, ack 1, win 4017, options [nop,nop,TS val 63982 ecr 4294817034,mptcp dss ack 3380555454 seq 2130159654 subseq 38557 len 1428 csum 0x7172], length 1428
21:13:03.978607 IP 112.26.1.1.40367 > 112.26.1.8.35583: Flags [.], seq 25705:27133, ack 1, win 4017, options [nop,nop,TS val 63503 ecr 4294816653,mptcp dss ack 3380555454 seq 2130129666 subseq 25705 len 1428 csum 0xc01], length 1428
21:13:04.099751 IP 112.26.1.8.35583 > 112.26.1.1.40367: Flags [.], ack 14281, win 2647, options [nop,nop,TS val 4294817233 ecr 61832,mptcp dss ack 2130046842], length 0
21:13:04.100120 IP 112.26.1.1.40367 > 112.26.1.8.35583: Flags [.], seq 39985:41413, ack 1, win 4017, options [nop,nop,TS val 64246 ecr 4294817233,mptcp dss ack 3380555454 seq 2130168222 subseq 39985 len 1428 csum 0xf5a5], length 1428
21:13:04.100193 IP 112.26.1.1.40367 > 112.26.1.8.35583: Flags [.], seq 41413:42841, ack 1, win 4017, options [nop,nop,TS val 64246 ecr 4294817233,mptcp dss ack 3380555454 seq 2130169650 subseq 41413 len 1428 csum 0xf344], length 1428
21:13:04.208869 IP 112.26.1.1.40367 > 112.26.1.8.35583: Flags [.], seq 28561:29989, ack 1, win 4017, options [nop,nop,TS val 63688 ecr 4294816731,mptcp dss ack 3380555454 seq 2130138234 subseq 28561 len 1428 csum 0x9700], length 1428
21:13:04.291942 IP 112.26.1.8.35583 > 112.26.1.1.40367: Flags [.], ack 15709, win 2806, options [nop,nop,TS val 4294817453 ecr 62442,mptcp dss ack 2130046842], length 0
21:13:04.339447 IP 112.26.1.1.40367 > 112.26.1.8.35583: Flags [.], seq 29989:31417, ack 1, win 4017, options [nop,nop,TS val 63688 ecr 4294816731,mptcp dss ack 3380555454 seq 2130139662 subseq 29989 len 1428 csum 0xffb6], length 1428
21:13:04.401216 IP 112.26.1.1.40367 > 112.26.1.8.35583: Flags [.], seq 31417:32845, ack 1, win 4017, options [nop,nop,TS val 63782 ecr 4294816800,mptcp dss ack 3380555454 seq 2130143946 subseq 31417 len 1428 csum 0xc47a], length 1428
21:13:04.490772 IP 112.26.1.1.40367 > 112.26.1.8.35583: Flags [.], seq 32845:34273, ack 1, win 4017, options [nop,nop,TS val 63782 ecr 4294816800,mptcp dss ack 3380555454 seq 2130145374 subseq 32845 len 1428 csum 0x603e], length 1428
21:13:04.572978 IP 112.26.1.1.40367 > 112.26.1.8.35583: Flags [.], seq 34273:35701, ack 1, win 4017, options [nop,nop,TS val 63982 ecr 4294817034,mptcp dss ack 3380555454 seq 2130155370 subseq 34273 len 1428 csum 0xa854], length 1428
21:13:04.642174 IP 112.26.1.1.40367 > 112.26.1.8.35583: Flags [.], seq 35701:37129, ack 1, win 4017, options [nop,nop,TS val 63982 ecr 4294817034,mptcp dss ack 3380555454 seq 2130156798 subseq 35701 len 1428 csum 0xd061], length 1428
21:13:04.765496 IP 112.26.1.1.40367 > 112.26.1.8.35583: Flags [.], seq 38557:39985, ack 1, win 4017, options [nop,nop,TS val 63982 ecr 4294817034,mptcp dss ack 3380555454 seq 2130159654 subseq 38557 len 1428 csum 0x7172], length 1428
21:13:04.806965 IP 112.26.1.8.35583 > 112.26.1.1.40367: Flags [.], ack 21421, win 3103, options [nop,nop,TS val 4294818059 ecr 62900,mptcp dss ack 2130046842], length 0
21:13:04.807303 IP 112.26.1.1.40367 > 112.26.1.8.35583: Flags [.], seq 42841:44269, ack 1, win 4017, options [nop,nop,TS val 64953 ecr 4294818059,mptcp dss ack 3380555454 seq 2130178218 subseq 42841 len 1428 csum 0xf84c], length 1428
21:13:04.859991 IP 112.26.1.1.40367 > 112.26.1.8.35583: Flags [.], seq 39985:41413, ack 1, win 4017, options [nop,nop,TS val 64246 ecr 4294817233,mptcp dss ack 3380555454 seq 2130168222 subseq 39985 len 1428 csum 0xf5a5], length 1428
21:13:04.947395 IP 112.26.1.8.35583 > 112.26.1.1.40367: Flags [.], ack 21421, win 3217, options [nop,nop,TS val 4294818231 ecr 62900,nop,nop,sack 1 {22849:24277},mptcp dss ack 2130046842], length 0
21:13:04.991286 IP 112.26.1.1.40367 > 112.26.1.8.35583: Flags [.], seq 44269:45697, ack 1, win 4017, options [nop,nop,TS val 65137 ecr 4294818231,mptcp dss ack 3380555454 seq 2130182502 subseq 44269 len 1428 csum 0xb713], length 1428
21:13:05.024415 IP 112.26.1.8.35583 > 112.26.1.1.40367: Flags [.], ack 21421, win 3240, options [nop,nop,TS val 4294818303 ecr 62900,nop,nop,sack 1 {22849:25705},mptcp dss ack 2130046842], length 0
21:13:05.044785 IP 112.26.1.1.40367 > 112.26.1.8.35583: Flags [.], seq 45697:47125, ack 1, win 4017, options [nop,nop,TS val 65191 ecr 4294818303,mptcp dss ack 3380555454 seq 2130185358 subseq 45697 len 1428 csum 0x7f2f], length 1428
21:13:05.109251 IP 112.26.1.8.35583 > 112.26.1.1.40367: Flags [.], ack 21421, win 3331, options [nop,nop,TS val 4294818407 ecr 62900,nop,nop,sack 1 {22849:27133},mptcp dss ack 2130046842], length 0
21:13:05.109547 IP 112.26.1.1.40367 > 112.26.1.8.35583: Flags [.], seq 21421:22849, ack 1, win 4017, options [nop,nop,TS val 65255 ecr 4294818407,mptcp dss ack 3380555454 seq 2130103962 subseq 21421 len 1428 csum 0xbdea], length 1428
21:13:05.163889 IP 112.26.1.1.40367 > 112.26.1.8.35583: Flags [.], seq 42841:44269, ack 1, win 4017, options [nop,nop,TS val 64953 ecr 4294818059,mptcp dss ack 3380555454 seq 2130178218 subseq 42841 len 1428 csum 0xf84c], length 1428
21:13:05.250231 IP 112.26.1.8.35583 > 112.26.1.1.40367: Flags [.], ack 21421, win 3536, options [nop,nop,TS val 4294818813 ecr 62900,nop,nop,sack 2 {28561:29989}{22849:27133},mptcp dss ack 2130069690], length 0
21:13:05.250549 IP 112.26.1.1.40367 > 112.26.1.8.35583: Flags [.], seq 27133:28561, ack 1, win 4017, options [nop,nop,TS val 65396 ecr 4294818813,mptcp dss ack 3380555454 seq 2130131094 subseq 27133 len 1428 csum 0xd59d], length 1428
21:13:05.329096 IP 112.26.1.1.40367 > 112.26.1.8.35583: Flags [.], seq 44269:45697, ack 1, win 4017, options [nop,nop,TS val 65137 ecr 4294818231,mptcp dss ack 3380555454 seq 2130182502 subseq 44269 len 1428 csum 0xb713], length 1428
21:13:05.400504 IP 112.26.1.1.40367 > 112.26.1.8.35583: Flags [.], seq 45697:47125, ack 1, win 4017, options [nop,nop,TS val 65191 ecr 4294818303,mptcp dss ack 3380555454 seq 2130185358 subseq 45697 len 1428 csum 0x7f2f], length 1428
21:13:05.444811 IP 112.26.1.8.35583 > 112.26.1.1.40367: Flags [.], ack 21421, win 3605, options [nop,nop,TS val 4294818865 ecr 62900,nop,nop,sack 2 {28561:31417}{22849:27133},mptcp dss ack 2130069690], length 0
21:13:05.455855 IP 112.26.1.1.40367 > 112.26.1.8.35583: Flags [.], seq 47125:48553, ack 1, win 4017, options [nop,nop,TS val 65601 ecr 4294818865,mptcp dss ack 3380555454 seq 2130198210 subseq 47125 len 1428 csum 0x5517], length 1428
21:13:05.484411 IP 112.26.1.1.40367 > 112.26.1.8.35583: Flags [.], seq 21421:22849, ack 1, win 4017, options [nop,nop,TS val 65255 ecr 4294818407,mptcp dss ack 3380555454 seq 2130103962 subseq 21421 len 1428 csum 0xbdea], length 1428
21:13:05.538733 IP 112.26.1.8.35583 > 112.26.1.1.40367: Flags [.], ack 21421, win 3673, options [nop,nop,TS val 4294818948 ecr 62900,nop,nop,sack 2 {28561:32845}{22849:27133},mptcp dss ack 2130069690], length 0
21:13:05.596919 IP 112.26.1.1.40367 > 112.26.1.8.35583: Flags [.], seq 27133:28561, ack 1, win 4017, options [nop,nop,TS val 65396 ecr 4294818813,mptcp dss ack 3380555454 seq 2130131094 subseq 27133 len 1428 csum 0xd59d], length 1428
21:13:05.674006 IP 112.26.1.8.35583 > 112.26.1.1.40367: Flags [.], ack 21421, win 3696, options [nop,nop,TS val 4294819051 ecr 62900,nop,nop,sack 2 {28561:34273}{22849:27133},mptcp dss ack 2130069690], length 0
21:13:05.756953 IP 112.26.1.8.35583 > 112.26.1.1.40367: Flags [.], ack 21421, win 3787, options [nop,nop,TS val 4294819119 ecr 62900,nop,nop,sack 2 {28561:35701}{22849:27133},mptcp dss ack 2130069690], length 0
21:13:05.757254 IP 112.26.1.1.40367 > 112.26.1.8.35583: Flags [.], seq 48553:49981, ack 1, win 4017, options [nop,nop,TS val 65904 ecr 4294819051,mptcp dss ack 3380555454 seq 2130213918 subseq 48553 len 1428 csum 0xd10e], length 1428
21:13:05.771645 IP 112.26.1.1.40367 > 112.26.1.8.35583: Flags [.], seq 49981:51409, ack 1, win 4017, options [nop,nop,TS val 65918 ecr 4294819119,mptcp dss ack 3380555454 seq 2130215346 subseq 49981 len 1428 csum 0xa56e], length 1428
21:13:05.828896 IP 112.26.1.1.40367 > 112.26.1.8.35583: Flags [.], seq 47125:48553, ack 1, win 4017, options [nop,nop,TS val 65601 ecr 4294818865,mptcp dss ack 3380555454 seq 2130198210 subseq 47125 len 1428 csum 0x5517], length 1428
21:13:05.919222 IP 112.26.1.8.35583 > 112.26.1.1.40367: Flags [.], ack 21421, win 3856, options [nop,nop,TS val 4294819229 ecr 62900,nop,nop,sack 2 {28561:37129}{22849:27133},mptcp dss ack 2130075402], length 0
21:13:05.979140 IP 112.26.1.8.35583 > 112.26.1.1.40367: Flags [.], ack 21421, win 3970, options [nop,nop,TS val 4294819439 ecr 62900,nop,nop,sack 2 {38557:39985}{28561:37129},mptcp dss ack 2130096822], length 0
21:13:06.013924 IP 112.26.1.8.35583 > 112.26.1.1.40367: Flags [.], ack 21421, win 4038, options [nop,nop,TS val 4294819575 ecr 62900,nop,nop,sack 2 {38557:41413}{28561:37129},mptcp dss ack 2130099678], length 0
21:13:06.014359 IP 112.26.1.1.40367 > 112.26.1.8.35583: Flags [.], seq 37129:38557, ack 1, win 4017, options [nop,nop,TS val 66160 ecr 4294819575,mptcp dss ack 3380555454 seq 2130158226 subseq 37129 len 1428 csum 0x9427], length 1428
21:13:06.129477 IP 112.26.1.1.40367 > 112.26.1.8.35583: Flags [.], seq 48553:49981, ack 1, win 4017, options [nop,nop,TS val 65904 ecr 4294819051,mptcp dss ack 3380555454 seq 2130213918 subseq 48553 len 1428 csum 0xd10e], length 1428
21:13:06.199679 IP 112.26.1.1.40367 > 112.26.1.8.35583: Flags [.], seq 49981:51409, ack 1, win 4017, options [nop,nop,TS val 65918 ecr 4294819119,mptcp dss ack 3380555454 seq 2130215346 subseq 49981 len 1428 csum 0xa56e], length 1428
21:13:06.251354 IP 112.26.1.8.35583 > 112.26.1.1.40367: Flags [.], ack 21421, win 4130, options [nop,nop,TS val 4294819777 ecr 62900,nop,nop,sack 2 {42841:44269}{38557:41413},mptcp dss ack 2130099678], length 0
21:13:06.251665 IP 112.26.1.1.40367 > 112.26.1.8.35583: Flags [.], seq 41413:42841, ack 1, win 4017, options [nop,nop,TS val 66397 ecr 4294819777,mptcp dss ack 3380555454 seq 2130169650 subseq 41413 len 1428 csum 0xf344], length 1428
21:13:06.353258 IP 112.26.1.1.40367 > 112.26.1.8.35583: Flags [.], seq 37129:38557, ack 1, win 4017, options [nop,nop,TS val 66160 ecr 4294819575,mptcp dss ack 3380555454 seq 2130158226 subseq 37129 len 1428 csum 0x9427], length 1428
21:13:06.443461 IP 112.26.1.8.35583 > 112.26.1.1.40367: Flags [.], ack 21421, win 4198, options [nop,nop,TS val 4294819905 ecr 62900,nop,nop,sack 2 {42841:45697}{38557:41413},mptcp dss ack 2130099678], length 0
21:13:06.457088 IP 112.26.1.1.40367 > 112.26.1.8.35583: Flags [.], seq 51409:52837, ack 1, win 4017, options [nop,nop,TS val 66603 ecr 4294819905,mptcp dss ack 3380555454 seq 2130232482 subseq 51409 len 1428 csum 0x38d], length 1428
21:13:06.545994 IP 112.26.1.8.35583 > 112.26.1.1.40367: Flags [.], ack 21421, win 4289, options [nop,nop,TS val 4294820008 ecr 62900,nop,nop,sack 2 {42841:47125}{38557:41413},mptcp dss ack 2130103962], length 0
21:13:06.550608 IP 112.26.1.1.40367 > 112.26.1.8.35583: Flags [.], seq 52837:54265, ack 1, win 4017, options [nop,nop,TS val 66696 ecr 4294820008,mptcp dss ack 3380555454 seq 2130236766 subseq 52837 len 1428 csum 0x6ba6], length 1428
21:13:06.639536 IP 112.26.1.1.40367 > 112.26.1.8.35583: Flags [.], seq 41413:42841, ack 1, win 4017, options [nop,nop,TS val 66397 ecr 4294819777,mptcp dss ack 3380555454 seq 2130169650 subseq 41413 len 1428 csum 0xf344], length 1428
21:13:06.671108 IP 112.26.1.8.35583 > 112.26.1.1.40367: Flags [.], ack 27133, win 4358, options [nop,nop,TS val 4294820102 ecr 65255,nop,nop,sack 2 {42841:47125}{38557:41413},mptcp dss ack 2130118242], length 0
21:13:06.671383 IP 112.26.1.1.40367 > 112.26.1.8.35583: Flags [.], seq 54265:55693, ack 1, win 4017, options [nop,nop,TS val 66817 ecr 4294820102,mptcp dss ack 3380555454 seq 2130242478 subseq 54265 len 1428 csum 0xbc0], length 1428
21:13:06.671451 IP 112.26.1.1.40367 > 112.26.1.8.35583: Flags [.], seq 55693:57121, ack 1, win 4017, options [nop,nop,TS val 66817 ecr 4294820102,mptcp dss ack 3380555454 seq 2130243906 subseq 55693 len 1428 csum 0xf79], length 1428
21:13:06.671604 IP 112.26.1.1.40367 > 112.26.1.8.35583: Flags [.], seq 57121:58549, ack 1, win 4017, options [nop,nop,TS val 66817 ecr 4294820102,mptcp dss ack 3380555454 seq 2130245334 subseq 57121 len 1428 csum 0xae83], length 1428
21:13:06.739253 IP 112.26.1.8.35583 > 112.26.1.1.40367: Flags [.], ack 37129, win 4449, options [nop,nop,TS val 4294820252 ecr 65396,nop,nop,sack 2 {42841:47125}{38557:41413},mptcp dss ack 2130148230], length 0
21:13:06.739571 IP 112.26.1.1.40367 > 112.26.1.8.35583: Flags [.], seq 58549:59977, ack 1, win 4017, options [nop,nop,TS val 66885 ecr 4294820252,mptcp dss ack 3380555454 seq 2130249618 subseq 58549 len 1428 csum 0xd6b5], length 1428
21:13:06.829860 IP 112.26.1.1.40367 > 112.26.1.8.35583: Flags [.], seq 51409:52837, ack 1, win 4017, options [nop,nop,TS val 66603 ecr 4294819905,mptcp dss ack 3380555454 seq 2130232482 subseq 51409 len 1428 csum 0x38d], length 1428
21:13:06.971392 IP 112.26.1.8.35583 > 112.26.1.1.40367: Flags [.], ack 37129, win 4563, options [nop,nop,TS val 4294820443 ecr 65396,nop,nop,sack 2 {42841:48553}{38557:41413},mptcp dss ack 2130148230], length 0
21:13:06.976427 IP 112.26.1.1.40367 > 112.26.1.8.35583: Flags [.], seq 59977:61405, ack 1, win 4017, options [nop,nop,TS val 67123 ecr 4294820443,mptcp dss ack 3380555454 seq 2130259614 subseq 59977 len 1428 csum 0xba50], length 1428
21:13:07.110388 IP 112.26.1.1.40367 > 112.26.1.8.35583: Flags [.], seq 52837:54265, ack 1, win 4017, options [nop,nop,TS val 66696 ecr 4294820008,mptcp dss ack 3380555454 seq 2130236766 subseq 52837 len 1428 csum 0x6ba6], length 1428
21:13:07.180604 IP 112.26.1.8.35583 > 112.26.1.1.40367: Flags [.], ack 37129, win 4677, options [nop,nop,TS val 4294820602 ecr 65396,nop,nop,sack 2 {42841:49981}{38557:41413},mptcp dss ack 2130148230], length 0
21:13:07.223230 IP 112.26.1.1.40367 > 112.26.1.8.35583: Flags [.], seq 54265:55693, ack 1, win 4017, options [nop,nop,TS val 66817 ecr 4294820102,mptcp dss ack 3380555454 seq 2130242478 subseq 54265 len 1428 csum 0xbc0], length 1428
21:13:07.291681 IP 112.26.1.1.40367 > 112.26.1.8.35583: Flags [.], seq 55693:57121, ack 1, win 4017, options [nop,nop,TS val 66817 ecr 4294820102,mptcp dss ack 3380555454 seq 2130243906 subseq 55693 len 1428 csum 0xf79], length 1428
21:13:07.295360 IP 112.26.1.1.40367 > 112.26.1.8.35583: Flags [.], seq 61405:62833, ack 1, win 4017, options [nop,nop,TS val 67441 ecr 4294820602,mptcp dss ack 3380555454 seq 2130268182 subseq 61405 len 1428 csum 0xbd23], length 1428
21:13:07.349485 IP 112.26.1.8.35583 > 112.26.1.1.40367: Flags [.], ack 37129, win 4745, options [nop,nop,TS val 4294820677 ecr 65396,nop,nop,sack 2 {42841:51409}{38557:41413},mptcp dss ack 2130148230], length 0
21:13:07.396862 IP 112.26.1.1.40367 > 112.26.1.8.35583: Flags [.], seq 62833:64261, ack 1, win 4017, options [nop,nop,TS val 67543 ecr 4294820677,mptcp dss ack 3380555454 seq 2130271038 subseq 62833 len 1428 csum 0xf7b1], length 1428
21:13:07.435065 IP 112.26.1.1.40367 > 112.26.1.8.35583: Flags [.], seq 57121:58549, ack 1, win 4017, options [nop,nop,TS val 66817 ecr 4294820102,mptcp dss ack 3380555454 seq 2130245334 subseq 57121 len 1428 csum 0xae83], length 1428
21:13:07.513986 IP 112.26.1.8.35583 > 112.26.1.1.40367: Flags [.], ack 41413, win 4791, options [nop,nop,TS val 4294820763 ecr 66160,nop,nop,sack 1 {42841:51409},mptcp dss ack 2130148230], length 0
21:13:07.514462 IP 112.26.1.1.40367 > 112.26.1.8.35583: Flags [.], seq 64261:65689, ack 1, win 4017, options [nop,nop,TS val 67660 ecr 4294820763,mptcp dss ack 3380555454 seq 2130275322 subseq 64261 len 1428 csum 0x9c51], length 1428
21:13:07.611850 IP 112.26.1.1.40367 > 112.26.1.8.35583: Flags [.], seq 59977:61405, ack 1, win 4017, options [nop,nop,TS val 67123 ecr 4294820443,mptcp dss ack 3380555454 seq 2130259614 subseq 59977 len 1428 csum 0xba50], length 1428
21:13:07.661475 IP 112.26.1.8.35583 > 112.26.1.1.40367: Flags [.], ack 51409, win 4974, options [nop,nop,TS val 4294821104 ecr 66397,mptcp dss ack 2130148230], length 0
21:13:07.661745 IP 112.26.1.1.40367 > 112.26.1.8.35583: Flags [.], seq 65689:67117, ack 1, win 4017, options [nop,nop,TS val 67808 ecr 4294821104,mptcp dss ack 3380555454 seq 2130276750 subseq 65689 len 1428 csum 0x444e], length 1428
21:13:07.735319 IP 112.26.1.8.35583 > 112.26.1.1.40367: Flags [.], ack 52837, win 5042, options [nop,nop,TS val 4294821171 ecr 66603,mptcp dss ack 2130148230], length 0
21:13:07.735793 IP 112.26.1.1.40367 > 112.26.1.8.35583: Flags [.], seq 67117:68545, ack 1, win 4017, options [nop,nop,TS val 67882 ecr 4294821171,mptcp dss ack 3380555454 seq 2130279606 subseq 67117 len 1428 csum 0x6420], length 1428
21:13:07.807632 IP 112.26.1.1.40367 > 112.26.1.8.35583: Flags [.], seq 61405:62833, ack 1, win 4017, options [nop,nop,TS val 67441 ecr 4294820602,mptcp dss ack 3380555454 seq 2130268182 subseq 61405 len 1428 csum 0xbd23], length 1428
21:13:07.830319 IP 112.26.1.8.35583 > 112.26.1.1.40367: Flags [.], ack 54265, win 5179, options [nop,nop,TS val 4294821437 ecr 66696,mptcp dss ack 2130179646], length 0
21:13:07.830815 IP 112.26.1.1.40367 > 112.26.1.8.35583: Flags [.], seq 68545:69973, ack 1, win 4017, options [nop,nop,TS val 67977 ecr 4294821437,mptcp dss ack 3380555454 seq 2130283890 subseq 68545 len 1428 csum 0x11ff], length 1428
21:13:07.929759 IP 112.26.1.1.40367 > 112.26.1.8.35583: Flags [.], seq 62833:64261, ack 1, win 4017, options [nop,nop,TS val 67543 ecr 4294820677,mptcp dss ack 3380555454 seq 2130271038 subseq 62833 len 1428 csum 0xf7b1], length 1428
21:13:08.008348 IP 112.26.1.8.35583 > 112.26.1.1.40367: Flags [.], ack 55693, win 5247, options [nop,nop,TS val 4294821558 ecr 66817,mptcp dss ack 2130179646], length 0
21:13:08.008791 IP 112.26.1.1.40367 > 112.26.1.8.35583: Flags [.], seq 69973:71401, ack 1, win 4017, options [nop,nop,TS val 68154 ecr 4294821558,mptcp dss ack 3380555454 seq 2130292458 subseq 69973 len 1428 csum 0x7c67], length 1428
21:13:08.085837 IP 112.26.1.8.35583 > 112.26.1.1.40367: Flags [.], ack 57121, win 5339, options [nop,nop,TS val 4294821640 ecr 66817,mptcp dss ack 2130179646], length 0
21:13:08.086188 IP 112.26.1.1.40367 > 112.26.1.8.35583: Flags [.], seq 71401:72829, ack 1, win 4017, options [nop,nop,TS val 68232 ecr 4294821640,mptcp dss ack 3380555454 seq 2130293886 subseq 71401 len 1428 csum 0xb1bd], length 1428
21:13:08.086261 IP 112.26.1.1.40367 > 112.26.1.8.35583: Flags [.], seq 72829:74257, ack 1, win 4017, options [nop,nop,TS val 68232 ecr 4294821640,mptcp dss ack 3380555454 seq 2130295314 subseq 72829 len 1428 csum 0x50cd], length 1428
21:13:08.168607 IP 112.26.1.1.40367 > 112.26.1.8.35583: Flags [.], seq 64261:65689, ack 1, win 4017, options [nop,nop,TS val 67660 ecr 4294820763,mptcp dss ack 3380555454 seq 2130275322 subseq 64261 len 1428 csum 0x9c51], length 1428
21:13:08.245196 IP 112.26.1.8.35583 > 112.26.1.1.40367: Flags [.], ack 58549, win 5407, options [nop,nop,TS val 4294821796 ecr 66817,mptcp dss ack 2130179646], length 0
21:13:08.245616 IP 112.26.1.1.40367 > 112.26.1.8.35583: Flags [.], seq 74257:75685, ack 1, win 4017, options [nop,nop,TS val 68392 ecr 4294821796,mptcp dss ack 3380555454 seq 2130302454 subseq 74257 len 1428 csum 0x894f], length 1428
21:13:08.295649 IP 112.26.1.1.40367 > 112.26.1.8.35583: Flags [.], seq 65689:67117, ack 1, win 4017, options [nop,nop,TS val 67808 ecr 4294821104,mptcp dss ack 3380555454 seq 2130276750 subseq 65689 len 1428 csum 0x444e], length 1428
21:13:08.374701 IP 112.26.1.1.40367 > 112.26.1.8.35583: Flags [.], seq 67117:68545, ack 1, win 4017, options [nop,nop,TS val 67882 ecr 4294821171,mptcp dss ack 3380555454 seq 2130279606 subseq 67117 len 1428 csum 0x6420], length 1428
21:13:08.449315 IP 112.26.1.8.35583 > 112.26.1.1.40367: Flags [.], ack 58549, win 5521, options [nop,nop,TS val 4294821920 ecr 66817,nop,nop,sack 1 {59977:61405},mptcp dss ack 2130189642], length 0
21:13:08.494748 IP 112.26.1.1.40367 > 112.26.1.8.35583: Flags [.], seq 75685:77113, ack 1, win 4017, options [nop,nop,TS val 68641 ecr 4294821920,mptcp dss ack 3380555454 seq 2130308166 subseq 75685 len 1428 csum 0xd9f8], length 1428
21:13:08.513175 IP 112.26.1.8.35583 > 112.26.1.1.40367: Flags [.], ack 58549, win 5612, options [nop,nop,TS val 4294822098 ecr 66817,nop,nop,sack 1 {59977:62833},mptcp dss ack 2130189642], length 0
21:13:08.541939 IP 112.26.1.1.40367 > 112.26.1.8.35583: Flags [.], seq 77113:78541, ack 1, win 4017, options [nop,nop,TS val 68688 ecr 4294822098,mptcp dss ack 3380555454 seq 2130311022 subseq 77113 len 1428 csum 0xed55], length 1428
21:13:08.592499 IP 112.26.1.1.40367 > 112.26.1.8.35583: Flags [.], seq 69973:71401, ack 1, win 4017, options [nop,nop,TS val 68154 ecr 4294821558,mptcp dss ack 3380555454 seq 2130292458 subseq 69973 len 1428 csum 0x7c67], length 1428
21:13:08.643107 IP 112.26.1.8.35583 > 112.26.1.1.40367: Flags [.], ack 58549, win 5658, options [nop,nop,TS val 4294822189 ecr 66817,nop,nop,sack 1 {59977:64261},mptcp dss ack 2130189642], length 0
21:13:08.643510 IP 112.26.1.1.40367 > 112.26.1.8.35583: Flags [.], seq 58549:59977, ack 1, win 4017, options [nop,nop,TS val 68790 ecr 4294822189,mptcp dss ack 3380555454 seq 2130249618 subseq 58549 len 1428 csum 0xd6b5], length 1428
21:13:08.737432 IP 112.26.1.1.40367 > 112.26.1.8.35583: Flags [.], seq 71401:72829, ack 1, win 4017, options [nop,nop,TS val 68232 ecr 4294821640,mptcp dss ack 3380555454 seq 2130293886 subseq 71401 len 1428 csum 0xb1bd], length 1428
21:13:08.781914 IP 112.26.1.1.40367 > 112.26.1.8.35583: Flags [.], seq 72829:74257, ack 1, win 4017, options [nop,nop,TS val 68232 ecr 4294821640,mptcp dss ack 3380555454 seq 2130295314 subseq 72829 len 1428 csum 0x50cd], length 1428
21:13:08.861402 IP 112.26.1.8.35583 > 112.26.1.1.40367: Flags [.], ack 58549, win 5656, options [nop,nop,TS val 4294822390 ecr 66817,nop,nop,sack 1 {59977:65689},mptcp dss ack 2130203922], length 0
21:13:08.879155 IP 112.26.1.1.40367 > 112.26.1.8.35583: Flags [.], seq 78541:79969, ack 1, win 4017, options [nop,nop,TS val 69025 ecr 4294822390,mptcp dss ack 3380555454 seq 2130319590 subseq 78541 len 1428 csum 0x9427], length 1428
21:13:08.929879 IP 112.26.1.1.40367 > 112.26.1.8.35583: Flags [.], seq 74257:75685, ack 1, win 4017, options [nop,nop,TS val 68392 ecr 4294821796,mptcp dss ack 3380555454 seq 2130302454 subseq 74257 len 1428 csum 0x894f], length 1428
21:13:09.045496 IP 112.26.1.8.35583 > 112.26.1.1.40367: Flags [.], ack 58549, win 5656, options [nop,nop,TS val 4294822519 ecr 66817,nop,nop,sack 1 {59977:67117},mptcp dss ack 2130203922], length 0
21:13:09.092515 IP 112.26.1.8.35583 > 112.26.1.1.40367: Flags [.], ack 58549, win 5653, options [nop,nop,TS val 4294822635 ecr 66817,nop,nop,sack 1 {59977:68545},mptcp dss ack 2130209634], length 0
21:13:09.113207 IP 112.26.1.1.40367 > 112.26.1.8.35583: Flags [.], seq 79969:81397, ack 1, win 4017, options [nop,nop,TS val 69259 ecr 4294822635,mptcp dss ack 3380555454 seq 2130329586 subseq 79969 len 1428 csum 0x51ca], length 1428
21:13:09.154637 IP 112.26.1.1.40367 > 112.26.1.8.35583: Flags [.], seq 75685:77113, ack 1, win 4017, options [nop,nop,TS val 68641 ecr 4294821920,mptcp dss ack 3380555454 seq 2130308166 subseq 75685 len 1428 csum 0xd9f8], length 1428
21:13:09.222506 IP 112.26.1.1.40367 > 112.26.1.8.35583: Flags [.], seq 77113:78541, ack 1, win 4017, options [nop,nop,TS val 68688 ecr 4294822098,mptcp dss ack 3380555454 seq 2130311022 subseq 77113 len 1428 csum 0xed55], length 1428
21:13:09.259471 IP 112.26.1.1.40367 > 112.26.1.8.35583: Flags [.], seq 58549:59977, ack 1, win 4017, options [nop,nop,TS val 68790 ecr 4294822189,mptcp dss ack 3380555454 seq 2130249618 subseq 58549 len 1428 csum 0xd6b5], length 1428
21:13:09.342313 IP 112.26.1.8.35583 > 112.26.1.1.40367: Flags [.], ack 58549, win 5749, options [nop,nop,TS val 4294822814 ecr 66817,nop,nop,sack 2 {69973:71401}{59977:68545},mptcp dss ack 2130249618], length 0
21:13:09.387570 IP 112.26.1.8.35583 > 112.26.1.1.40367: Flags [.], ack 58549, win 5806, options [nop,nop,TS val 4294822959 ecr 66817,nop,nop,sack 2 {69973:72829}{59977:68545},mptcp dss ack 2130249618], length 0
21:13:09.387879 IP 112.26.1.1.40367 > 112.26.1.8.35583: Flags [.], seq 68545:69973, ack 1, win 4017, options [nop,nop,TS val 69534 ecr 4294822959,mptcp dss ack 3380555454 seq 2130283890 subseq 68545 len 1428 csum 0x11ff], length 1428
21:13:09.481942 IP 112.26.1.1.40367 > 112.26.1.8.35583: Flags [.], seq 78541:79969, ack 1, win 4017, options [nop,nop,TS val 69025 ecr 4294822390,mptcp dss ack 3380555454 seq 2130319590 subseq 78541 len 1428 csum 0x9427], length 1428
21:13:09.520250 IP 112.26.1.8.35583 > 112.26.1.1.40367: Flags [.], ack 58549, win 5806, options [nop,nop,TS val 4294823069 ecr 66817,nop,nop,sack 2 {69973:74257}{59977:68545},mptcp dss ack 2130249618], length 0
21:13:09.531645 IP 112.26.1.1.40367 > 112.26.1.8.35583: Flags [.], seq 81397:82825, ack 1, win 4017, options [nop,nop,TS val 69677 ecr 4294823069,mptcp dss ack 3380555454 seq 2130342438 subseq 81397 len 1428 csum 0x5bd8], length 1428
21:13:09.607386 IP 112.26.1.8.35583 > 112.26.1.1.40367: Flags [.], ack 58549, win 5806, options [nop,nop,TS val 4294823198 ecr 66817,nop,nop,sack 2 {69973:75685}{59977:68545},mptcp dss ack 2130249618], length 0
21:13:09.633410 IP 112.26.1.1.40367 > 112.26.1.8.35583: Flags [.], seq 82825:84253, ack 1, win 4017, options [nop,nop,TS val 69779 ecr 4294823198,mptcp dss ack 3380555454 seq 2130346722 subseq 82825 len 1428 csum 0x3d41], length 1428
21:13:09.689649 IP 112.26.1.1.40367 > 112.26.1.8.35583: Flags [.], seq 79969:81397, ack 1, win 4017, options [nop,nop,TS val 69259 ecr 4294822635,mptcp dss ack 3380555454 seq 2130329586 subseq 79969 len 1428 csum 0x51ca], length 1428
21:13:09.743215 IP 112.26.1.8.35583 > 112.26.1.1.40367: Flags [.], ack 58549, win 5806, options [nop,nop,TS val 4294823376 ecr 66817,nop,nop,sack 2 {69973:77113}{59977:68545},mptcp dss ack 2130249618], length 0
21:13:09.749996 IP 112.26.1.1.40367 > 112.26.1.8.35583: Flags [.], seq 84253:85681, ack 1, win 4017, options [nop,nop,TS val 69896 ecr 4294823376,mptcp dss ack 3380555454 seq 2130349578 subseq 84253 len 1428 csum 0xfab2], length 1428
21:13:09.837791 IP 112.26.1.1.40367 > 112.26.1.8.35583: Flags [.], seq 68545:69973, ack 1, win 4017, options [nop,nop,TS val 69534 ecr 4294822959,mptcp dss ack 3380555454 seq 2130283890 subseq 68545 len 1428 csum 0x11ff], length 1428
21:13:09.917620 IP 112.26.1.8.35583 > 112.26.1.1.40367: Flags [.], ack 58549, win 5806, options [nop,nop,TS val 4294823529 ecr 66817,nop,nop,sack 2 {69973:78541}{59977:68545},mptcp dss ack 2130249618], length 0
21:13:09.980393 IP 112.26.1.1.40367 > 112.26.1.8.35583: Flags [.], seq 85681:87109, ack 1, win 4017, options [nop,nop,TS val 70126 ecr 4294823529,mptcp dss ack 3380555454 seq 2130355290 subseq 85681 len 1428 csum 0x6dfb], length 1428
