16:13:07.947445 IP 112.26.2.8.42095 > 112.26.2.1.pmcd: Flags [S], seq 1371634414, win 65535, options [mss 1460,sackOK,TS val 2988378 ecr 0,nop,wscale 6,mptcp join id 6 token 0x6673cfeb nonce 0x70cf9e5d], length 0
16:13:07.947677 IP 112.26.2.8.42095 > 112.26.2.1.pmcd: Flags [S], seq 1371634414, win 65535, options [mss 1460,sackOK,TS val 2988378 ecr 0,nop,wscale 6,mptcp join id 6 token 0x6673cfeb nonce 0x70cf9e5d], length 0
16:13:07.955151 IP 112.26.2.1.pmcd > 112.26.2.8.42095: Flags [S.], seq 2230588622, ack 1371634415, win 65535, options [mss 1460,sackOK,TS val 3209296 ecr 2988378,nop,wscale 6,mptcp join id 6 hmac 0x4f08ad8be1e0f2fd nonce 0xa3562a44], length 0
16:13:08.022960 IP 112.26.2.1.pmcd > 112.26.2.8.42095: Flags [S.], seq 2230588622, ack 1371634415, win 65535, options [mss 1460,sackOK,TS val 3209296 ecr 2988378,nop,wscale 6,mptcp join id 6 hmac 0x4f08ad8be1e0f2fd nonce 0xa3562a44], length 0
16:13:08.026350 IP 112.26.2.1.pmcd > 112.26.2.8.42095: Flags [S.], seq 2230588622, ack 1371634415, win 65535, options [mss 1460,sackOK,TS val 3209296 ecr 2988378,nop,wscale 6,mptcp join id 6 hmac 0x4f08ad8be1e0f2fd nonce 0xa3562a44], length 0
16:13:08.100648 IP 112.26.2.8.42095 > 112.26.2.1.pmcd: Flags [.], ack 1, win 6297, options [nop,nop,TS val 2988475 ecr 3209296,mptcp join hmac 0x03bf2749fcb3c673144f41b81c6dad99abe91827], length 0
16:13:08.100812 IP 112.26.2.8.42095 > 112.26.2.1.pmcd: Flags [.], ack 1, win 6297, options [nop,nop,TS val 2988475 ecr 3209296,mptcp join hmac 0x03bf2749fcb3c673144f41b81c6dad99abe91827], length 0
16:13:08.117180 IP 112.26.2.1.pmcd > 112.26.2.8.42095: Flags [.], ack 1, win 2678, options [nop,nop,TS val 3209450 ecr 2988475,mptcp dss ack 724613416], length 0
16:13:08.119864 IP 112.26.2.1.pmcd > 112.26.2.8.42095: Flags [.], ack 1, win 2678, options [nop,nop,TS val 3209450 ecr 2988475,mptcp dss ack 724613416], length 0
16:13:08.123704 IP 112.26.2.1.pmcd > 112.26.2.8.42095: Flags [.], ack 1, win 2678, options [nop,nop,TS val 3209450 ecr 2988475,mptcp dss ack 724613416], length 0
16:13:08.197892 IP 112.26.2.1.pmcd > 112.26.2.8.42095: Flags [.], seq 1:1429, ack 1, win 2678, options [nop,nop,TS val 3209451 ecr 2988475,mptcp dss ack 724613416 seq 1583758194 subseq 1 len 1428 csum 0xb712], length 1428
16:13:08.299948 IP 112.26.2.1.pmcd > 112.26.2.8.42095: Flags [.], seq 1:1429, ack 1, win 2678, options [nop,nop,TS val 3209451 ecr 2988475,mptcp dss ack 724613416 seq 1583758194 subseq 1 len 1428 csum 0xb712], length 1428
16:13:08.310516 IP 112.26.2.1.pmcd > 112.26.2.8.42095: Flags [.], seq 1:1429, ack 1, win 2678, options [nop,nop,TS val 3209451 ecr 2988475,mptcp dss ack 724613416 seq 1583758194 subseq 1 len 1428 csum 0xb712], length 1428
16:13:08.363947 IP 112.26.2.1.pmcd > 112.26.2.8.42095: Flags [.], seq 1429:2857, ack 1, win 2678, options [nop,nop,TS val 3209451 ecr 2988475,mptcp dss ack 724613416 seq 1583759622 subseq 1429 len 1428 csum 0xaeb5], length 1428
16:13:08.386434 IP 112.26.2.8.42095 > 112.26.2.1.pmcd: Flags [.], ack 1429, win 7802, options [nop,nop,TS val 2988760 ecr 3209451,mptcp dss ack 1583755338], length 0
16:13:08.386670 IP 112.26.2.8.42095 > 112.26.2.1.pmcd: Flags [.], ack 1429, win 7802, options [nop,nop,TS val 2988760 ecr 3209451,mptcp dss ack 1583755338], length 0
16:13:08.447109 IP 112.26.2.1.pmcd > 112.26.2.8.42095: Flags [.], seq 2857:4285, ack 1, win 2678, options [nop,nop,TS val 3209452 ecr 2988475,mptcp dss ack 724613416 seq 1583761050 subseq 2857 len 1428 csum 0xb966], length 1428
16:13:08.515887 IP 112.26.2.1.pmcd > 112.26.2.8.42095: Flags [.], seq 4285:5713, ack 1, win 2678, options [nop,nop,TS val 3209452 ecr 2988475,mptcp dss ack 724613416 seq 1583762478 subseq 4285 len 1428 csum 0x128e], length 1428
16:13:08.631248 IP 112.26.2.1.pmcd > 112.26.2.8.42095: Flags [.], seq 5713:7141, ack 1, win 2678, options [nop,nop,TS val 3209452 ecr 2988475,mptcp dss ack 724613416 seq 1583763906 subseq 5713 len 1428 csum 0x97c1], length 1428
16:13:08.643226 IP 112.26.2.1.pmcd > 112.26.2.8.42095: Flags [.], seq 1429:2857, ack 1, win 2678, options [nop,nop,TS val 3209451 ecr 2988475,mptcp dss ack 724613416 seq 1583759622 subseq 1429 len 1428 csum 0xaeb5], length 1428
16:13:08.718119 IP 112.26.2.1.pmcd > 112.26.2.8.42095: Flags [.], seq 1429:2857, ack 1, win 2678, options [nop,nop,TS val 3209451 ecr 2988475,mptcp dss ack 724613416 seq 1583759622 subseq 1429 len 1428 csum 0xaeb5], length 1428
16:13:08.742607 IP 112.26.2.8.42095 > 112.26.2.1.pmcd: Flags [.], ack 2857, win 8076, options [nop,nop,TS val 2989100 ecr 3209451,mptcp dss ack 1583761050], length 0
16:13:08.742795 IP 112.26.2.8.42095 > 112.26.2.1.pmcd: Flags [.], ack 2857, win 8076, options [nop,nop,TS val 2989100 ecr 3209451,mptcp dss ack 1583761050], length 0
16:13:08.775111 IP 112.26.2.1.pmcd > 112.26.2.8.42095: Flags [.], seq 14281:15709, ack 1, win 4017, options [nop,nop,TS val 3209752 ecr 2988760,mptcp dss ack 724613416 seq 1583793894 subseq 14281 len 1428 csum 0xbf85], length 1428
16:13:08.830659 IP 112.26.2.1.pmcd > 112.26.2.8.42095: Flags [.], seq 2857:4285, ack 1, win 2678, options [nop,nop,TS val 3209452 ecr 2988475,mptcp dss ack 724613416 seq 1583761050 subseq 2857 len 1428 csum 0xb966], length 1428
16:13:08.856287 IP 112.26.2.1.pmcd > 112.26.2.8.42095: Flags [.], seq 2857:4285, ack 1, win 2678, options [nop,nop,TS val 3209452 ecr 2988475,mptcp dss ack 724613416 seq 1583761050 subseq 2857 len 1428 csum 0xb966], length 1428
16:13:08.863798 IP 112.26.2.8.42095 > 112.26.2.1.pmcd: Flags [.], ack 4285, win 8213, options [nop,nop,TS val 2989287 ecr 3209452,mptcp dss ack 1583762478], length 0
16:13:08.863975 IP 112.26.2.8.42095 > 112.26.2.1.pmcd: Flags [.], ack 4285, win 8213, options [nop,nop,TS val 2989287 ecr 3209452,mptcp dss ack 1583762478], length 0
16:13:08.894522 IP 112.26.2.1.pmcd > 112.26.2.8.42095: Flags [.], seq 15709:17137, ack 1, win 4017, options [nop,nop,TS val 3209752 ecr 2988760,mptcp dss ack 724613416 seq 1583795322 subseq 15709 len 1428 csum 0x3e64], length 1428
16:13:08.974864 IP 112.26.2.1.pmcd > 112.26.2.8.42095: Flags [.], seq 4285:5713, ack 1, win 2678, options [nop,nop,TS val 3209452 ecr 2988475,mptcp dss ack 724613416 seq 1583762478 subseq 4285 len 1428 csum 0x128e], length 1428
16:13:09.049518 IP 112.26.2.1.pmcd > 112.26.2.8.42095: Flags [.], seq 4285:5713, ack 1, win 2678, options [nop,nop,TS val 3209452 ecr 2988475,mptcp dss ack 724613416 seq 1583762478 subseq 4285 len 1428 csum 0x128e], length 1428
16:13:09.064237 IP 112.26.2.1.pmcd > 112.26.2.8.42095: Flags [.], seq 15709:17137, ack 1, win 4017, options [nop,nop,TS val 3210008 ecr 2988760,mptcp dss ack 724613416 seq 1583795322 subseq 15709 len 1428 csum 0x3e64], length 1428
16:13:09.084047 IP 112.26.2.1.pmcd > 112.26.2.8.42095: Flags [.], seq 17137:18565, ack 1, win 4017, options [nop,nop,TS val 3210090 ecr 2989100,mptcp dss ack 724613416 seq 1583816742 subseq 17137 len 1428 csum 0x9575], length 1428
16:13:09.090910 IP 112.26.2.8.42095 > 112.26.2.1.pmcd: Flags [.], ack 5713, win 8304, options [nop,nop,TS val 2989426 ecr 3209452,mptcp dss ack 1583763906], length 0
16:13:09.091094 IP 112.26.2.8.42095 > 112.26.2.1.pmcd: Flags [.], ack 5713, win 8304, options [nop,nop,TS val 2989426 ecr 3209452,mptcp dss ack 1583763906], length 0
16:13:09.222093 IP 112.26.2.1.pmcd > 112.26.2.8.42095: Flags [.], seq 18565:19993, ack 1, win 4017, options [nop,nop,TS val 3210090 ecr 2989100,mptcp dss ack 724613416 seq 1583818170 subseq 18565 len 1428 csum 0xb947], length 1428
16:13:09.253074 IP 112.26.2.1.pmcd > 112.26.2.8.42095: Flags [.], seq 14281:15709, ack 1, win 4017, options [nop,nop,TS val 3209752 ecr 2988760,mptcp dss ack 724613416 seq 1583793894 subseq 14281 len 1428 csum 0xbf85], length 1428
16:13:09.267889 IP 112.26.2.1.pmcd > 112.26.2.8.42095: Flags [.], seq 14281:15709, ack 1, win 4017, options [nop,nop,TS val 3209752 ecr 2988760,mptcp dss ack 724613416 seq 1583793894 subseq 14281 len 1428 csum 0xbf85], length 1428
16:13:09.279847 IP 112.26.2.8.42095 > 112.26.2.1.pmcd: Flags [.], ack 5713, win 8624, options [nop,nop,TS val 2989717 ecr 3209452,nop,nop,sack 1 {14281:15709},mptcp dss ack 1583763906], length 0
16:13:09.280033 IP 112.26.2.8.42095 > 112.26.2.1.pmcd: Flags [.], ack 5713, win 8624, options [nop,nop,TS val 2989717 ecr 3209452,nop,nop,sack 1 {14281:15709},mptcp dss ack 1583763906], length 0
16:13:09.345219 IP 112.26.2.1.pmcd > 112.26.2.8.42095: Flags [.], seq 19993:21421, ack 1, win 4017, options [nop,nop,TS val 3210218 ecr 2989287,mptcp dss ack 724613416 seq 1583825310 subseq 19993 len 1428 csum 0x21e6], length 1428
16:13:09.429240 IP 112.26.2.1.pmcd > 112.26.2.8.42095: Flags [.], seq 22849:24277, ack 1, win 4017, options [nop,nop,TS val 3210474 ecr 2989426,mptcp dss ack 724613416 seq 1583835306 subseq 22849 len 1428 csum 0x8146], length 1428
16:13:09.454513 IP 112.26.2.1.pmcd > 112.26.2.8.42095: Flags [.], seq 15709:17137, ack 1, win 4017, options [nop,nop,TS val 3210008 ecr 2988760,mptcp dss ack 724613416 seq 1583795322 subseq 15709 len 1428 csum 0x3e64], length 1428
16:13:09.481074 IP 112.26.2.1.pmcd > 112.26.2.8.42095: Flags [.], seq 15709:17137, ack 1, win 4017, options [nop,nop,TS val 3210008 ecr 2988760,mptcp dss ack 724613416 seq 1583795322 subseq 15709 len 1428 csum 0x3e64], length 1428
16:13:09.484896 IP 112.26.2.8.42095 > 112.26.2.1.pmcd: Flags [.], ack 5713, win 8943, options [nop,nop,TS val 2989910 ecr 3209452,nop,nop,sack 1 {14281:17137},mptcp dss ack 1583763906], length 0
16:13:09.485084 IP 112.26.2.8.42095 > 112.26.2.1.pmcd: Flags [.], ack 5713, win 8943, options [nop,nop,TS val 2989910 ecr 3209452,nop,nop,sack 1 {14281:17137},mptcp dss ack 1583763906], length 0
16:13:09.587481 IP 112.26.2.1.pmcd > 112.26.2.8.42095: Flags [.], seq 24277:25705, ack 1, win 4017, options [nop,nop,TS val 3210474 ecr 2989426,mptcp dss ack 724613416 seq 1583836734 subseq 24277 len 1428 csum 0xe9fc], length 1428
16:13:09.649352 IP 112.26.2.1.pmcd > 112.26.2.8.42095: Flags [.], seq 5713:7141, ack 1, win 4017, options [nop,nop,TS val 3210634 ecr 2989717,mptcp dss ack 724613416 seq 1583763906 subseq 5713 len 1428 csum 0x97c1], length 1428
16:13:09.696628 IP 112.26.2.1.pmcd > 112.26.2.8.42095: Flags [.], seq 18565:19993, ack 1, win 4017, options [nop,nop,TS val 3210090 ecr 2989100,mptcp dss ack 724613416 seq 1583818170 subseq 18565 len 1428 csum 0xb947], length 1428
16:13:09.711089 IP 112.26.2.1.pmcd > 112.26.2.8.42095: Flags [.], seq 18565:19993, ack 1, win 4017, options [nop,nop,TS val 3210090 ecr 2989100,mptcp dss ack 724613416 seq 1583818170 subseq 18565 len 1428 csum 0xb947], length 1428
16:13:09.758949 IP 112.26.2.1.pmcd > 112.26.2.8.42095: Flags [.], seq 7141:8569, ack 1, win 4017, options [nop,nop,TS val 3210844 ecr 2989910,mptcp dss ack 724613416 seq 1583765334 subseq 7141 len 1428 csum 0xbb82], length 1428
16:13:09.824984 IP 112.26.2.8.42095 > 112.26.2.1.pmcd: Flags [.], ack 5713, win 9125, options [nop,nop,TS val 2990153 ecr 3209452,nop,nop,sack 2 {18565:19993}{14281:17137},mptcp dss ack 1583763906], length 0
16:13:09.825172 IP 112.26.2.8.42095 > 112.26.2.1.pmcd: Flags [.], ack 5713, win 9125, options [nop,nop,TS val 2990153 ecr 3209452,nop,nop,sack 2 {18565:19993}{14281:17137},mptcp dss ack 1583763906], length 0
16:13:09.866627 IP 112.26.2.1.pmcd > 112.26.2.8.42095: Flags [.], seq 8569:9997, ack 1, win 4017, options [nop,nop,TS val 3211173 ecr 2990153,mptcp dss ack 724613416 seq 1583766762 subseq 8569 len 1428 csum 0xe9fd], length 1428
16:13:09.967642 IP 112.26.2.1.pmcd > 112.26.2.8.42095: Flags [.], seq 24277:25705, ack 1, win 4017, options [nop,nop,TS val 3210474 ecr 2989426,mptcp dss ack 724613416 seq 1583836734 subseq 24277 len 1428 csum 0xe9fc], length 1428
16:13:09.996897 IP 112.26.2.1.pmcd > 112.26.2.8.42095: Flags [.], seq 24277:25705, ack 1, win 4017, options [nop,nop,TS val 3210474 ecr 2989426,mptcp dss ack 724613416 seq 1583836734 subseq 24277 len 1428 csum 0xe9fc], length 1428
16:13:10.049697 IP 112.26.2.8.42095 > 112.26.2.1.pmcd: Flags [.], ack 5713, win 9445, options [nop,nop,TS val 2990423 ecr 3209452,nop,nop,sack 2 {24277:25705}{18565:19993},mptcp dss ack 1583763906], length 0
16:13:10.049960 IP 112.26.2.8.42095 > 112.26.2.1.pmcd: Flags [.], ack 5713, win 9445, options [nop,nop,TS val 2990423 ecr 3209452,nop,nop,sack 2 {24277:25705}{18565:19993},mptcp dss ack 1583763906], length 0
16:13:10.063777 IP 112.26.2.1.pmcd > 112.26.2.8.42095: Flags [.], seq 9997:11425, ack 1, win 4017, options [nop,nop,TS val 3211399 ecr 2990423,mptcp dss ack 724613416 seq 1583768190 subseq 9997 len 1428 csum 0x9c86], length 1428
16:13:10.125344 IP 112.26.2.1.pmcd > 112.26.2.8.42095: Flags [.], seq 5713:7141, ack 1, win 4017, options [nop,nop,TS val 3210634 ecr 2989717,mptcp dss ack 724613416 seq 1583763906 subseq 5713 len 1428 csum 0x97c1], length 1428
16:13:10.135171 IP 112.26.2.8.42095 > 112.26.2.1.pmcd: Flags [.], ack 7141, win 9627, options [nop,nop,TS val 2990580 ecr 3210634,nop,nop,sack 2 {24277:25705}{18565:19993},mptcp dss ack 1583765334], length 0
16:13:10.135326 IP 112.26.2.8.42095 > 112.26.2.1.pmcd: Flags [.], ack 7141, win 9627, options [nop,nop,TS val 2990580 ecr 3210634,nop,nop,sack 2 {24277:25705}{18565:19993},mptcp dss ack 1583765334], length 0
16:13:10.178111 IP 112.26.2.1.pmcd > 112.26.2.8.42095: Flags [.], seq 5713:7141, ack 1, win 4017, options [nop,nop,TS val 3210634 ecr 2989717,mptcp dss ack 724613416 seq 1583763906 subseq 5713 len 1428 csum 0x97c1], length 1428
16:13:10.255713 IP 112.26.2.1.pmcd > 112.26.2.8.42095: Flags [.], seq 7141:8569, ack 1, win 4017, options [nop,nop,TS val 3210844 ecr 2989910,mptcp dss ack 724613416 seq 1583765334 subseq 7141 len 1428 csum 0xbb82], length 1428
16:13:10.260540 IP 112.26.2.1.pmcd > 112.26.2.8.42095: Flags [.], seq 7141:8569, ack 1, win 4017, options [nop,nop,TS val 3210844 ecr 2989910,mptcp dss ack 724613416 seq 1583765334 subseq 7141 len 1428 csum 0xbb82], length 1428
16:13:10.302877 IP 112.26.2.1.pmcd > 112.26.2.8.42095: Flags [.], seq 11425:12853, ack 1, win 4017, options [nop,nop,TS val 3211627 ecr 2990580,mptcp dss ack 724613416 seq 1583769618 subseq 11425 len 1428 csum 0x8a8d], length 1428
16:13:10.330757 IP 112.26.2.8.42095 > 112.26.2.1.pmcd: Flags [.], ack 8569, win 9810, options [nop,nop,TS val 2990709 ecr 3210844,nop,nop,sack 2 {24277:25705}{18565:19993},mptcp dss ack 1583766762], length 0
16:13:10.331059 IP 112.26.2.8.42095 > 112.26.2.1.pmcd: Flags [.], ack 8569, win 9810, options [nop,nop,TS val 2990709 ecr 3210844,nop,nop,sack 2 {24277:25705}{18565:19993},mptcp dss ack 1583766762], length 0
16:13:10.395010 IP 112.26.2.1.pmcd > 112.26.2.8.42095: Flags [.], seq 12853:14281, ack 1, win 4017, options [nop,nop,TS val 3211627 ecr 2990580,mptcp dss ack 724613416 seq 1583771046 subseq 12853 len 1428 csum 0x3956], length 1428
16:13:10.457694 IP 112.26.2.1.pmcd > 112.26.2.8.42095: Flags [.], seq 9997:11425, ack 1, win 4017, options [nop,nop,TS val 3211399 ecr 2990423,mptcp dss ack 724613416 seq 1583768190 subseq 9997 len 1428 csum 0x9c86], length 1428
16:13:10.461495 IP 112.26.2.1.pmcd > 112.26.2.8.42095: Flags [.], seq 9997:11425, ack 1, win 4017, options [nop,nop,TS val 3211399 ecr 2990423,mptcp dss ack 724613416 seq 1583768190 subseq 9997 len 1428 csum 0x9c86], length 1428
16:13:10.509016 IP 112.26.2.1.pmcd > 112.26.2.8.42095: Flags [.], seq 17137:18565, ack 1, win 4017, options [nop,nop,TS val 3211776 ecr 2990709,mptcp dss ack 724613416 seq 1583816742 subseq 17137 len 1428 csum 0x9575], length 1428
16:13:10.519097 IP 112.26.2.8.42095 > 112.26.2.1.pmcd: Flags [.], ack 8569, win 10038, options [nop,nop,TS val 2990910 ecr 3210844,nop,nop,sack 2 {9997:11425}{24277:25705},mptcp dss ack 1583766762], length 0
16:13:10.519366 IP 112.26.2.8.42095 > 112.26.2.1.pmcd: Flags [.], ack 8569, win 10038, options [nop,nop,TS val 2990910 ecr 3210844,nop,nop,sack 2 {9997:11425}{24277:25705},mptcp dss ack 1583766762], length 0
16:13:10.601626 IP 112.26.2.1.pmcd > 112.26.2.8.42095: Flags [.], seq 11425:12853, ack 1, win 4017, options [nop,nop,TS val 3211627 ecr 2990580,mptcp dss ack 724613416 seq 1583769618 subseq 11425 len 1428 csum 0x8a8d], length 1428
16:13:10.611279 IP 112.26.2.1.pmcd > 112.26.2.8.42095: Flags [.], seq 11425:12853, ack 1, win 4017, options [nop,nop,TS val 3211627 ecr 2990580,mptcp dss ack 724613416 seq 1583769618 subseq 11425 len 1428 csum 0x8a8d], length 1428
16:13:10.624671 IP 112.26.2.8.42095 > 112.26.2.1.pmcd: Flags [.], ack 8569, win 10266, options [nop,nop,TS val 2991060 ecr 3210844,nop,nop,sack 2 {9997:12853}{24277:25705},mptcp dss ack 1583766762], length 0
16:13:10.624913 IP 112.26.2.8.42095 > 112.26.2.1.pmcd: Flags [.], ack 8569, win 10266, options [nop,nop,TS val 2991060 ecr 3210844,nop,nop,sack 2 {9997:12853}{24277:25705},mptcp dss ack 1583766762], length 0
16:13:10.725842 IP 112.26.2.1.pmcd > 112.26.2.8.42095: Flags [.], seq 19993:21421, ack 1, win 4017, options [nop,nop,TS val 3211776 ecr 2990709,mptcp dss ack 724613416 seq 1583825310 subseq 19993 len 1428 csum 0x21e6], length 1428
16:13:10.731409 IP 112.26.2.1.pmcd > 112.26.2.8.42095: Flags [.], seq 8569:9997, ack 1, win 4017, options [nop,nop,TS val 3211992 ecr 2990910,mptcp dss ack 724613416 seq 1583766762 subseq 8569 len 1428 csum 0xe9fd], length 1428
16:13:10.792285 IP 112.26.2.1.pmcd > 112.26.2.8.42095: Flags [.], seq 12853:14281, ack 1, win 4017, options [nop,nop,TS val 3211627 ecr 2990580,mptcp dss ack 724613416 seq 1583771046 subseq 12853 len 1428 csum 0x3956], length 1428
16:13:10.795877 IP 112.26.2.1.pmcd > 112.26.2.8.42095: Flags [.], seq 12853:14281, ack 1, win 4017, options [nop,nop,TS val 3211627 ecr 2990580,mptcp dss ack 724613416 seq 1583771046 subseq 12853 len 1428 csum 0x3956], length 1428
16:13:10.837189 IP 112.26.2.8.42095 > 112.26.2.1.pmcd: Flags [.], ack 8569, win 10403, options [nop,nop,TS val 2991244 ecr 3210844,nop,nop,sack 2 {9997:17137}{24277:25705},mptcp dss ack 1583766762], length 0
16:13:10.837394 IP 112.26.2.8.42095 > 112.26.2.1.pmcd: Flags [.], ack 8569, win 10403, options [nop,nop,TS val 2991244 ecr 3210844,nop,nop,sack 2 {9997:17137}{24277:25705},mptcp dss ack 1583766762], length 0
16:13:10.886085 IP 112.26.2.1.pmcd > 112.26.2.8.42095: Flags [.], seq 21421:22849, ack 1, win 4017, options [nop,nop,TS val 3212227 ecr 2991060,mptcp dss ack 724613416 seq 1583826738 subseq 21421 len 1428 csum 0xf0b2], length 1428
16:13:10.926235 IP 112.26.2.1.pmcd > 112.26.2.8.42095: Flags [.], seq 17137:18565, ack 1, win 4017, options [nop,nop,TS val 3211776 ecr 2990709,mptcp dss ack 724613416 seq 1583816742 subseq 17137 len 1428 csum 0x9575], length 1428
16:13:10.965441 IP 112.26.2.1.pmcd > 112.26.2.8.42095: Flags [.], seq 17137:18565, ack 1, win 4017, options [nop,nop,TS val 3211776 ecr 2990709,mptcp dss ack 724613416 seq 1583816742 subseq 17137 len 1428 csum 0x9575], length 1428
16:13:10.969506 IP 112.26.2.8.42095 > 112.26.2.1.pmcd: Flags [.], ack 8569, win 10677, options [nop,nop,TS val 2991407 ecr 3210844,nop,nop,sack 2 {9997:19993}{24277:25705},mptcp dss ack 1583766762], length 0
16:13:10.969757 IP 112.26.2.8.42095 > 112.26.2.1.pmcd: Flags [.], ack 8569, win 10677, options [nop,nop,TS val 2991407 ecr 3210844,nop,nop,sack 2 {9997:19993}{24277:25705},mptcp dss ack 1583766762], length 0
16:13:11.024123 IP 112.26.2.1.pmcd > 112.26.2.8.42095: Flags [.], seq 22849:24277, ack 1, win 4017, options [nop,nop,TS val 3212365 ecr 2991244,mptcp dss ack 724613416 seq 1583835306 subseq 22849 len 1428 csum 0x8146], length 1428
16:13:11.173595 IP 112.26.2.1.pmcd > 112.26.2.8.42095: Flags [.], seq 19993:21421, ack 1, win 4017, options [nop,nop,TS val 3211776 ecr 2990709,mptcp dss ack 724613416 seq 1583825310 subseq 19993 len 1428 csum 0x21e6], length 1428
16:13:11.185164 IP 112.26.2.1.pmcd > 112.26.2.8.42095: Flags [.], seq 19993:21421, ack 1, win 4017, options [nop,nop,TS val 3211776 ecr 2990709,mptcp dss ack 724613416 seq 1583825310 subseq 19993 len 1428 csum 0x21e6], length 1428
16:13:11.220953 IP 112.26.2.8.42095 > 112.26.2.1.pmcd: Flags [.], ack 8569, win 10996, options [nop,nop,TS val 2991628 ecr 3210844,nop,nop,sack 2 {9997:21421}{24277:25705},mptcp dss ack 1583766762], length 0
16:13:11.221180 IP 112.26.2.8.42095 > 112.26.2.1.pmcd: Flags [.], ack 8569, win 10996, options [nop,nop,TS val 2991628 ecr 3210844,nop,nop,sack 2 {9997:21421}{24277:25705},mptcp dss ack 1583766762], length 0
16:13:11.236905 IP 112.26.2.1.pmcd > 112.26.2.8.42095: Flags [.], seq 25705:27133, ack 1, win 4017, options [nop,nop,TS val 3212540 ecr 2991407,mptcp dss ack 724613416 seq 1583892426 subseq 25705 len 1428 csum 0x6201], length 1428
16:13:11.293702 IP 112.26.2.1.pmcd > 112.26.2.8.42095: Flags [.], seq 27133:28561, ack 1, win 4017, options [nop,nop,TS val 3212619 ecr 2991628,mptcp dss ack 724613416 seq 1583895282 subseq 27133 len 1428 csum 0x7725], length 1428
16:13:11.327227 IP 112.26.2.1.pmcd > 112.26.2.8.42095: Flags [.], seq 21421:22849, ack 1, win 4017, options [nop,nop,TS val 3212227 ecr 2991060,mptcp dss ack 724613416 seq 1583826738 subseq 21421 len 1428 csum 0xf0b2], length 1428
16:13:11.368183 IP 112.26.2.1.pmcd > 112.26.2.8.42095: Flags [.], seq 21421:22849, ack 1, win 4017, options [nop,nop,TS val 3212227 ecr 2991060,mptcp dss ack 724613416 seq 1583826738 subseq 21421 len 1428 csum 0xf0b2], length 1428
16:13:11.420418 IP 112.26.2.8.42095 > 112.26.2.1.pmcd: Flags [.], ack 8569, win 11133, options [nop,nop,TS val 2991782 ecr 3210844,nop,nop,sack 2 {9997:22849}{24277:25705},mptcp dss ack 1583766762], length 0
16:13:11.420622 IP 112.26.2.8.42095 > 112.26.2.1.pmcd: Flags [.], ack 8569, win 11133, options [nop,nop,TS val 2991782 ecr 3210844,nop,nop,sack 2 {9997:22849}{24277:25705},mptcp dss ack 1583766762], length 0
16:13:11.478614 IP 112.26.2.1.pmcd > 112.26.2.8.42095: Flags [.], seq 8569:9997, ack 1, win 4017, options [nop,nop,TS val 3212778 ecr 2991782,mptcp dss ack 724613416 seq 1583766762 subseq 8569 len 1428 csum 0xe9fd], length 1428
16:13:11.508719 IP 112.26.2.1.pmcd > 112.26.2.8.42095: Flags [.], seq 22849:24277, ack 1, win 4017, options [nop,nop,TS val 3212365 ecr 2991244,mptcp dss ack 724613416 seq 1583835306 subseq 22849 len 1428 csum 0x8146], length 1428
16:13:11.521971 IP 112.26.2.8.42095 > 112.26.2.1.pmcd: Flags [.], ack 8569, win 11361, options [nop,nop,TS val 2991961 ecr 3210844,nop,nop,sack 1 {9997:25705},mptcp dss ack 1583766762], length 0
16:13:11.522157 IP 112.26.2.8.42095 > 112.26.2.1.pmcd: Flags [.], ack 8569, win 11361, options [nop,nop,TS val 2991961 ecr 3210844,nop,nop,sack 1 {9997:25705},mptcp dss ack 1583766762], length 0
16:13:11.536221 IP 112.26.2.1.pmcd > 112.26.2.8.42095: Flags [.], seq 22849:24277, ack 1, win 4017, options [nop,nop,TS val 3212365 ecr 2991244,mptcp dss ack 724613416 seq 1583835306 subseq 22849 len 1428 csum 0x8146], length 1428
16:13:11.641175 IP 112.26.2.1.pmcd > 112.26.2.8.42095: Flags [.], seq 25705:27133, ack 1, win 4017, options [nop,nop,TS val 3212540 ecr 2991407,mptcp dss ack 724613416 seq 1583892426 subseq 25705 len 1428 csum 0x6201], length 1428
16:13:11.658235 IP 112.26.2.8.42095 > 112.26.2.1.pmcd: Flags [.], ack 8569, win 11589, options [nop,nop,TS val 2992104 ecr 3210844,nop,nop,sack 1 {9997:27133},mptcp dss ack 1583766762], length 0
16:13:11.658441 IP 112.26.2.8.42095 > 112.26.2.1.pmcd: Flags [.], ack 8569, win 11589, options [nop,nop,TS val 2992104 ecr 3210844,nop,nop,sack 1 {9997:27133},mptcp dss ack 1583766762], length 0
16:13:11.730930 IP 112.26.2.1.pmcd > 112.26.2.8.42095: Flags [.], seq 25705:27133, ack 1, win 4017, options [nop,nop,TS val 3212540 ecr 2991407,mptcp dss ack 724613416 seq 1583892426 subseq 25705 len 1428 csum 0x6201], length 1428
16:13:11.742676 IP 112.26.2.1.pmcd > 112.26.2.8.42095: Flags [.], seq 28561:29989, ack 1, win 4017, options [nop,nop,TS val 3212991 ecr 2991961,mptcp dss ack 724613416 seq 1583902422 subseq 28561 len 1428 csum 0x2f0b], length 1428
16:13:11.788316 IP 112.26.2.1.pmcd > 112.26.2.8.42095: Flags [.], seq 27133:28561, ack 1, win 4017, options [nop,nop,TS val 3212619 ecr 2991628,mptcp dss ack 724613416 seq 1583895282 subseq 27133 len 1428 csum 0x7725], length 1428
16:13:11.796206 IP 112.26.2.1.pmcd > 112.26.2.8.42095: Flags [.], seq 27133:28561, ack 1, win 4017, options [nop,nop,TS val 3212619 ecr 2991628,mptcp dss ack 724613416 seq 1583895282 subseq 27133 len 1428 csum 0x7725], length 1428
16:13:11.811723 IP 112.26.2.8.42095 > 112.26.2.1.pmcd: Flags [.], ack 8569, win 11726, options [nop,nop,TS val 2992245 ecr 3210844,nop,nop,sack 1 {9997:28561},mptcp dss ack 1583766762], length 0
16:13:11.811907 IP 112.26.2.8.42095 > 112.26.2.1.pmcd: Flags [.], ack 8569, win 11726, options [nop,nop,TS val 2992245 ecr 3210844,nop,nop,sack 1 {9997:28561},mptcp dss ack 1583766762], length 0
16:13:11.907423 IP 112.26.2.1.pmcd > 112.26.2.8.42095: Flags [.], seq 8569:9997, ack 1, win 4017, options [nop,nop,TS val 3212778 ecr 2991782,mptcp dss ack 724613416 seq 1583766762 subseq 8569 len 1428 csum 0xe9fd], length 1428
16:13:11.921731 IP 112.26.2.1.pmcd > 112.26.2.8.42095: Flags [.], seq 29989:31417, ack 1, win 4017, options [nop,nop,TS val 3213262 ecr 2992104,mptcp dss ack 724613416 seq 1583918130 subseq 29989 len 1428 csum 0x6c7], length 1428
16:13:11.955408 IP 112.26.2.8.42095 > 112.26.2.1.pmcd: Flags [.], ack 28561, win 11954, options [nop,nop,TS val 2992400 ecr 3212778,mptcp dss ack 1583786754], length 0
16:13:11.955591 IP 112.26.2.8.42095 > 112.26.2.1.pmcd: Flags [.], ack 28561, win 11954, options [nop,nop,TS val 2992400 ecr 3212778,mptcp dss ack 1583786754], length 0
16:13:11.980655 IP 112.26.2.1.pmcd > 112.26.2.8.42095: Flags [.], seq 8569:9997, ack 1, win 4017, options [nop,nop,TS val 3212778 ecr 2991782,mptcp dss ack 724613416 seq 1583766762 subseq 8569 len 1428 csum 0xe9fd], length 1428
16:13:12.038199 IP 112.26.2.1.pmcd > 112.26.2.8.42095: Flags [.], seq 28561:29989, ack 1, win 4017, options [nop,nop,TS val 3212991 ecr 2991961,mptcp dss ack 724613416 seq 1583902422 subseq 28561 len 1428 csum 0x2f0b], length 1428
16:13:12.120986 IP 112.26.2.1.pmcd > 112.26.2.8.42095: Flags [.], seq 28561:29989, ack 1, win 4017, options [nop,nop,TS val 3212991 ecr 2991961,mptcp dss ack 724613416 seq 1583902422 subseq 28561 len 1428 csum 0x2f0b], length 1428
16:13:12.123961 IP 112.26.2.8.42095 > 112.26.2.1.pmcd: Flags [.], ack 29989, win 12137, options [nop,nop,TS val 2992570 ecr 3212991,mptcp dss ack 1583786754], length 0
16:13:12.124152 IP 112.26.2.8.42095 > 112.26.2.1.pmcd: Flags [.], ack 29989, win 12137, options [nop,nop,TS val 2992570 ecr 3212991,mptcp dss ack 1583786754], length 0
16:13:12.166598 IP 112.26.2.1.pmcd > 112.26.2.8.42095: Flags [.], seq 29989:31417, ack 1, win 4017, options [nop,nop,TS val 3213262 ecr 2992104,mptcp dss ack 724613416 seq 1583918130 subseq 29989 len 1428 csum 0x6c7], length 1428
16:13:12.173190 IP 112.26.2.1.pmcd > 112.26.2.8.42095: Flags [.], seq 31417:32845, ack 1, win 4017, options [nop,nop,TS val 3213511 ecr 2992245,mptcp dss ack 724613416 seq 1583926698 subseq 31417 len 1428 csum 0xa93f], length 1428
16:13:12.251876 IP 112.26.2.8.42095 > 112.26.2.1.pmcd: Flags [.], ack 31417, win 12319, options [nop,nop,TS val 2992688 ecr 3213262,mptcp dss ack 1583786754], length 0
16:13:12.252064 IP 112.26.2.8.42095 > 112.26.2.1.pmcd: Flags [.], ack 31417, win 12319, options [nop,nop,TS val 2992688 ecr 3213262,mptcp dss ack 1583786754], length 0
16:13:12.261931 IP 112.26.2.1.pmcd > 112.26.2.8.42095: Flags [.], seq 29989:31417, ack 1, win 4017, options [nop,nop,TS val 3213262 ecr 2992104,mptcp dss ack 724613416 seq 1583918130 subseq 29989 len 1428 csum 0x6c7], length 1428
16:13:12.277946 IP 112.26.2.1.pmcd > 112.26.2.8.42095: Flags [.], seq 32845:34273, ack 1, win 4017, options [nop,nop,TS val 3213569 ecr 2992400,mptcp dss ack 724613416 seq 1583929554 subseq 32845 len 1428 csum 0x2007], length 1428
16:13:12.345239 IP 112.26.2.1.pmcd > 112.26.2.8.42095: Flags [.], seq 31417:32845, ack 1, win 4017, options [nop,nop,TS val 3213511 ecr 2992245,mptcp dss ack 724613416 seq 1583926698 subseq 31417 len 1428 csum 0xa93f], length 1428
16:13:12.414990 IP 112.26.2.1.pmcd > 112.26.2.8.42095: Flags [.], seq 34273:35701, ack 1, win 4017, options [nop,nop,TS val 3213569 ecr 2992400,mptcp dss ack 724613416 seq 1583930982 subseq 34273 len 1428 csum 0x609a], length 1428
16:13:12.427780 IP 112.26.2.1.pmcd > 112.26.2.8.42095: Flags [.], seq 31417:32845, ack 1, win 4017, options [nop,nop,TS val 3213511 ecr 2992245,mptcp dss ack 724613416 seq 1583926698 subseq 31417 len 1428 csum 0xa93f], length 1428
16:13:12.433814 IP 112.26.2.8.42095 > 112.26.2.1.pmcd: Flags [.], ack 32845, win 12502, options [nop,nop,TS val 2992801 ecr 3213511,mptcp dss ack 1583786754], length 0
16:13:12.434090 IP 112.26.2.8.42095 > 112.26.2.1.pmcd: Flags [.], ack 32845, win 12502, options [nop,nop,TS val 2992801 ecr 3213511,mptcp dss ack 1583786754], length 0
16:13:12.500914 IP 112.26.2.1.pmcd > 112.26.2.8.42095: Flags [.], seq 32845:34273, ack 1, win 4017, options [nop,nop,TS val 3213569 ecr 2992400,mptcp dss ack 724613416 seq 1583929554 subseq 32845 len 1428 csum 0x2007], length 1428
16:13:12.506200 IP 112.26.2.1.pmcd > 112.26.2.8.42095: Flags [.], seq 32845:34273, ack 1, win 4017, options [nop,nop,TS val 3213569 ecr 2992400,mptcp dss ack 724613416 seq 1583929554 subseq 32845 len 1428 csum 0x2007], length 1428
16:13:12.509698 IP 112.26.2.8.42095 > 112.26.2.1.pmcd: Flags [.], ack 34273, win 12639, options [nop,nop,TS val 2992955 ecr 3213569,mptcp dss ack 1583786754], length 0
16:13:12.509969 IP 112.26.2.8.42095 > 112.26.2.1.pmcd: Flags [.], ack 34273, win 12639, options [nop,nop,TS val 2992955 ecr 3213569,mptcp dss ack 1583786754], length 0
16:13:12.626378 IP 112.26.2.1.pmcd > 112.26.2.8.42095: Flags [.], seq 35701:37129, ack 1, win 4017, options [nop,nop,TS val 3213569 ecr 2992400,mptcp dss ack 724613416 seq 1583932410 subseq 35701 len 1428 csum 0x70fe], length 1428
16:13:12.630262 IP 112.26.2.1.pmcd > 112.26.2.8.42095: Flags [.], seq 37129:38557, ack 1, win 4017, options [nop,nop,TS val 3213569 ecr 2992400,mptcp dss ack 724613416 seq 1583933838 subseq 37129 len 1428 csum 0x7cf8], length 1428
16:13:12.659498 IP 112.26.2.1.pmcd > 112.26.2.8.42095: Flags [.], seq 34273:35701, ack 1, win 4017, options [nop,nop,TS val 3213569 ecr 2992400,mptcp dss ack 724613416 seq 1583930982 subseq 34273 len 1428 csum 0x609a], length 1428
16:13:12.689573 IP 112.26.2.1.pmcd > 112.26.2.8.42095: Flags [.], seq 34273:35701, ack 1, win 4017, options [nop,nop,TS val 3213569 ecr 2992400,mptcp dss ack 724613416 seq 1583930982 subseq 34273 len 1428 csum 0x609a], length 1428
16:13:12.703372 IP 112.26.2.8.42095 > 112.26.2.1.pmcd: Flags [.], ack 35701, win 12821, options [nop,nop,TS val 2993138 ecr 3213569,mptcp dss ack 1583786754], length 0
16:13:12.703662 IP 112.26.2.8.42095 > 112.26.2.1.pmcd: Flags [.], ack 35701, win 12821, options [nop,nop,TS val 2993138 ecr 3213569,mptcp dss ack 1583786754], length 0
16:13:12.770105 IP 112.26.2.1.pmcd > 112.26.2.8.42095: Flags [.], seq 41413:42841, ack 1, win 4017, options [nop,nop,TS val 3213802 ecr 2992570,mptcp dss ack 724613416 seq 1583946690 subseq 41413 len 1428 csum 0xed9b], length 1428
16:13:12.820281 IP 112.26.2.1.pmcd > 112.26.2.8.42095: Flags [.], seq 35701:37129, ack 1, win 4017, options [nop,nop,TS val 3213569 ecr 2992400,mptcp dss ack 724613416 seq 1583932410 subseq 35701 len 1428 csum 0x70fe], length 1428
16:13:12.830969 IP 112.26.2.1.pmcd > 112.26.2.8.42095: Flags [.], seq 35701:37129, ack 1, win 4017, options [nop,nop,TS val 3213569 ecr 2992400,mptcp dss ack 724613416 seq 1583932410 subseq 35701 len 1428 csum 0x70fe], length 1428
16:13:12.836087 IP 112.26.2.8.42095 > 112.26.2.1.pmcd: Flags [.], ack 37129, win 13004, options [nop,nop,TS val 2993280 ecr 3213569,mptcp dss ack 1583786754], length 0
16:13:12.836352 IP 112.26.2.8.42095 > 112.26.2.1.pmcd: Flags [.], ack 37129, win 13004, options [nop,nop,TS val 2993280 ecr 3213569,mptcp dss ack 1583786754], length 0
16:13:12.933036 IP 112.26.2.1.pmcd > 112.26.2.8.42095: Flags [.], seq 42841:44269, ack 1, win 4017, options [nop,nop,TS val 3213924 ecr 2992688,mptcp dss ack 724613416 seq 1583949546 subseq 42841 len 1428 csum 0xe72e], length 1428
16:13:12.972215 IP 112.26.2.1.pmcd > 112.26.2.8.42095: Flags [.], seq 37129:38557, ack 1, win 4017, options [nop,nop,TS val 3213569 ecr 2992400,mptcp dss ack 724613416 seq 1583933838 subseq 37129 len 1428 csum 0x7cf8], length 1428
16:13:13.004781 IP 112.26.2.1.pmcd > 112.26.2.8.42095: Flags [.], seq 37129:38557, ack 1, win 4017, options [nop,nop,TS val 3213569 ecr 2992400,mptcp dss ack 724613416 seq 1583933838 subseq 37129 len 1428 csum 0x7cf8], length 1428
16:13:13.047119 IP 112.26.2.1.pmcd > 112.26.2.8.42095: Flags [.], seq 44269:45697, ack 1, win 4017, options [nop,nop,TS val 3213924 ecr 2992688,mptcp dss ack 724613416 seq 1583950974 subseq 44269 len 1428 csum 0xa5a9], length 1428
16:13:13.141699 IP 112.26.2.1.pmcd > 112.26.2.8.42095: Flags [.], seq 45697:47125, ack 1, win 4017, options [nop,nop,TS val 3214083 ecr 2992801,mptcp dss ack 724613416 seq 1583955258 subseq 45697 len 1428 csum 0xea4], length 1428
16:13:13.179225 IP 112.26.2.1.pmcd > 112.26.2.8.42095: Flags [.], seq 41413:42841, ack 1, win 4017, options [nop,nop,TS val 3213802 ecr 2992570,mptcp dss ack 724613416 seq 1583946690 subseq 41413 len 1428 csum 0xed9b], length 1428
16:13:13.220916 IP 112.26.2.1.pmcd > 112.26.2.8.42095: Flags [.], seq 41413:42841, ack 1, win 4017, options [nop,nop,TS val 3213802 ecr 2992570,mptcp dss ack 724613416 seq 1583946690 subseq 41413 len 1428 csum 0xed9b], length 1428
16:13:13.229671 IP 112.26.2.8.42095 > 112.26.2.1.pmcd: Flags [.], ack 38557, win 13460, options [nop,nop,TS val 2993632 ecr 3213569,nop,nop,sack 1 {41413:42841},mptcp dss ack 1583786754], length 0
16:13:13.229925 IP 112.26.2.8.42095 > 112.26.2.1.pmcd: Flags [.], ack 38557, win 13460, options [nop,nop,TS val 2993632 ecr 3213569,nop,nop,sack 1 {41413:42841},mptcp dss ack 1583786754], length 0
16:13:13.291411 IP 112.26.2.1.pmcd > 112.26.2.8.42095: Flags [.], seq 47125:48553, ack 1, win 4017, options [nop,nop,TS val 3214180 ecr 2992955,mptcp dss ack 724613416 seq 1583960970 subseq 47125 len 1428 csum 0xb747], length 1428
16:13:13.364268 IP 112.26.2.1.pmcd > 112.26.2.8.42095: Flags [.], seq 48553:49981, ack 1, win 4017, options [nop,nop,TS val 3214180 ecr 2992955,mptcp dss ack 724613416 seq 1583962398 subseq 48553 len 1428 csum 0x35d4], length 1428
16:13:13.417161 IP 112.26.2.1.pmcd > 112.26.2.8.42095: Flags [.], seq 42841:44269, ack 1, win 4017, options [nop,nop,TS val 3213924 ecr 2992688,mptcp dss ack 724613416 seq 1583949546 subseq 42841 len 1428 csum 0xe72e], length 1428
16:13:13.425769 IP 112.26.2.1.pmcd > 112.26.2.8.42095: Flags [.], seq 42841:44269, ack 1, win 4017, options [nop,nop,TS val 3213924 ecr 2992688,mptcp dss ack 724613416 seq 1583949546 subseq 42841 len 1428 csum 0xe72e], length 1428
16:13:13.496371 IP 112.26.2.8.42095 > 112.26.2.1.pmcd: Flags [.], ack 38557, win 13734, options [nop,nop,TS val 2993874 ecr 3213569,nop,nop,sack 1 {41413:44269},mptcp dss ack 1583786754], length 0
16:13:13.496655 IP 112.26.2.8.42095 > 112.26.2.1.pmcd: Flags [.], ack 38557, win 13734, options [nop,nop,TS val 2993874 ecr 3213569,nop,nop,sack 1 {41413:44269},mptcp dss ack 1583786754], length 0
16:13:13.508991 IP 112.26.2.1.pmcd > 112.26.2.8.42095: Flags [.], seq 49981:51409, ack 1, win 4017, options [nop,nop,TS val 3214419 ecr 2993138,mptcp dss ack 724613416 seq 1583969538 subseq 49981 len 1428 csum 0xd209], length 1428
16:13:13.544226 IP 112.26.2.1.pmcd > 112.26.2.8.42095: Flags [.], seq 44269:45697, ack 1, win 4017, options [nop,nop,TS val 3213924 ecr 2992688,mptcp dss ack 724613416 seq 1583950974 subseq 44269 len 1428 csum 0xa5a9], length 1428
16:13:13.619521 IP 112.26.2.1.pmcd > 112.26.2.8.42095: Flags [.], seq 51409:52837, ack 1, win 4017, options [nop,nop,TS val 3214648 ecr 2993280,mptcp dss ack 724613416 seq 1583976678 subseq 51409 len 1428 csum 0x7572], length 1428
16:13:13.664798 IP 112.26.2.8.42095 > 112.26.2.1.pmcd: Flags [.], ack 38557, win 14007, options [nop,nop,TS val 2994109 ecr 3213569,nop,nop,sack 1 {41413:45697},mptcp dss ack 1583789610], length 0
16:13:13.665081 IP 112.26.2.8.42095 > 112.26.2.1.pmcd: Flags [.], ack 38557, win 14007, options [nop,nop,TS val 2994109 ecr 3213569,nop,nop,sack 1 {41413:45697},mptcp dss ack 1583789610], length 0
16:13:13.676190 IP 112.26.2.1.pmcd > 112.26.2.8.42095: Flags [.], seq 44269:45697, ack 1, win 4017, options [nop,nop,TS val 3213924 ecr 2992688,mptcp dss ack 724613416 seq 1583950974 subseq 44269 len 1428 csum 0xa5a9], length 1428
16:13:13.738295 IP 112.26.2.1.pmcd > 112.26.2.8.42095: Flags [.], seq 47125:48553, ack 1, win 4017, options [nop,nop,TS val 3214180 ecr 2992955,mptcp dss ack 724613416 seq 1583960970 subseq 47125 len 1428 csum 0xb747], length 1428
16:13:13.804785 IP 112.26.2.1.pmcd > 112.26.2.8.42095: Flags [.], seq 47125:48553, ack 1, win 4017, options [nop,nop,TS val 3214180 ecr 2992955,mptcp dss ack 724613416 seq 1583960970 subseq 47125 len 1428 csum 0xb747], length 1428
16:13:13.835648 IP 112.26.2.1.pmcd > 112.26.2.8.42095: Flags [.], seq 52837:54265, ack 1, win 4017, options [nop,nop,TS val 3215044 ecr 2993632,mptcp dss ack 724613416 seq 1583989530 subseq 52837 len 1428 csum 0x934d], length 1428
16:13:13.886733 IP 112.26.2.8.42095 > 112.26.2.1.pmcd: Flags [.], ack 38557, win 14144, options [nop,nop,TS val 2994253 ecr 3213569,nop,nop,sack 2 {47125:48553}{41413:45697},mptcp dss ack 1583789610], length 0
16:13:13.886997 IP 112.26.2.8.42095 > 112.26.2.1.pmcd: Flags [.], ack 38557, win 14144, options [nop,nop,TS val 2994253 ecr 3213569,nop,nop,sack 2 {47125:48553}{41413:45697},mptcp dss ack 1583789610], length 0
16:13:13.966370 IP 112.26.2.1.pmcd > 112.26.2.8.42095: Flags [.], seq 54265:55693, ack 1, win 4017, options [nop,nop,TS val 3215044 ecr 2993632,mptcp dss ack 724613416 seq 1583990958 subseq 54265 len 1428 csum 0xc8a3], length 1428
16:13:14.026161 IP 112.26.2.1.pmcd > 112.26.2.8.42095: Flags [.], seq 49981:51409, ack 1, win 4017, options [nop,nop,TS val 3214419 ecr 2993138,mptcp dss ack 724613416 seq 1583969538 subseq 49981 len 1428 csum 0xd209], length 1428
16:13:14.035583 IP 112.26.2.1.pmcd > 112.26.2.8.42095: Flags [.], seq 49981:51409, ack 1, win 4017, options [nop,nop,TS val 3214419 ecr 2993138,mptcp dss ack 724613416 seq 1583969538 subseq 49981 len 1428 csum 0xd209], length 1428
16:13:14.056501 IP 112.26.2.8.42095 > 112.26.2.1.pmcd: Flags [.], ack 38557, win 14281, options [nop,nop,TS val 2994484 ecr 3213569,nop,nop,sack 2 {49981:51409}{47125:48553},mptcp dss ack 1583789610], length 0
16:13:14.056768 IP 112.26.2.8.42095 > 112.26.2.1.pmcd: Flags [.], ack 38557, win 14281, options [nop,nop,TS val 2994484 ecr 3213569,nop,nop,sack 2 {49981:51409}{47125:48553},mptcp dss ack 1583789610], length 0
16:13:14.101041 IP 112.26.2.1.pmcd > 112.26.2.8.42095: Flags [.], seq 55693:57121, ack 1, win 4017, options [nop,nop,TS val 3215044 ecr 2993632,mptcp dss ack 724613416 seq 1583992386 subseq 55693 len 1428 csum 0x67b3], length 1428
16:13:14.175018 IP 112.26.2.1.pmcd > 112.26.2.8.42095: Flags [.], seq 51409:52837, ack 1, win 4017, options [nop,nop,TS val 3214648 ecr 2993280,mptcp dss ack 724613416 seq 1583976678 subseq 51409 len 1428 csum 0x7572], length 1428
16:13:14.199138 IP 112.26.2.1.pmcd > 112.26.2.8.42095: Flags [.], seq 51409:52837, ack 1, win 4017, options [nop,nop,TS val 3214648 ecr 2993280,mptcp dss ack 724613416 seq 1583976678 subseq 51409 len 1428 csum 0x7572], length 1428
16:13:14.219941 IP 112.26.2.8.42095 > 112.26.2.1.pmcd: Flags [.], ack 38557, win 14555, options [nop,nop,TS val 2994648 ecr 3213569,nop,nop,sack 2 {49981:52837}{47125:48553},mptcp dss ack 1583858154], length 0
16:13:14.220229 IP 112.26.2.8.42095 > 112.26.2.1.pmcd: Flags [.], ack 38557, win 14555, options [nop,nop,TS val 2994648 ecr 3213569,nop,nop,sack 2 {49981:52837}{47125:48553},mptcp dss ack 1583858154], length 0
