16:13:07.929133 IP 112.26.3.8.42683 > 112.26.3.1.pmcd: Flags [S], seq 3403799646, win 65535, options [mss 1460,sackOK,TS val 2988377 ecr 0,nop,wscale 6,mptcp join id 5 token 0x6673cfeb nonce 0xa83f5246], length 0
16:13:07.946507 IP 112.26.3.8.42683 > 112.26.3.1.pmcd: Flags [S], seq 3403799646, win 65535, options [mss 1460,sackOK,TS val 2988377 ecr 0,nop,wscale 6,mptcp join id 5 token 0x6673cfeb nonce 0xa83f5246], length 0
16:13:08.115799 IP 112.26.3.1.pmcd > 112.26.3.8.42683: Flags [S.], seq 1927846746, ack 3403799647, win 65535, options [mss 1460,sackOK,TS val 3209299 ecr 2988377,nop,wscale 6,mptcp join id 5 hmac 0x57d5cf31bbbc5946 nonce 0xb27e1efe], length 0
16:13:08.116040 IP 112.26.3.8.42683 > 112.26.3.1.pmcd: Flags [.], ack 1, win 7665, options [nop,nop,TS val 2988564 ecr 3209299,mptcp join hmac 0x7f6eeba21ca3137dfcd4e1f0019ab1c7de450e57], length 0
16:13:08.208171 IP 112.26.3.8.42683 > 112.26.3.1.pmcd: Flags [.], ack 1, win 7665, options [nop,nop,TS val 2988564 ecr 3209299,mptcp join hmac 0x7f6eeba21ca3137dfcd4e1f0019ab1c7de450e57], length 0
16:13:08.420287 IP 112.26.3.1.pmcd > 112.26.3.8.42683: Flags [.], ack 1, win 4017, options [nop,nop,TS val 3209560 ecr 2988564,mptcp dss ack 724613416], length 0
16:13:08.567102 IP 112.26.3.1.pmcd > 112.26.3.8.42683: Flags [.], seq 1:1429, ack 1, win 4017, options [nop,nop,TS val 3209560 ecr 2988564,mptcp dss ack 724613416 seq 1583779614 subseq 1 len 1428 csum 0xc3e8], length 1428
16:13:08.567281 IP 112.26.3.8.42683 > 112.26.3.1.pmcd: Flags [.], ack 1429, win 7985, options [nop,nop,TS val 2989015 ecr 3209560,mptcp dss ack 1583756766], length 0
16:13:08.716044 IP 112.26.3.8.42683 > 112.26.3.1.pmcd: Flags [.], ack 1429, win 7985, options [nop,nop,TS val 2989015 ecr 3209560,mptcp dss ack 1583756766], length 0
16:13:09.184260 IP 112.26.3.1.pmcd > 112.26.3.8.42683: Flags [.], seq 4285:5713, ack 1, win 4017, options [nop,nop,TS val 3209561 ecr 2988564,mptcp dss ack 724613416 seq 1583783898 subseq 4285 len 1428 csum 0xb254], length 1428
16:13:09.184513 IP 112.26.3.8.42683 > 112.26.3.1.pmcd: Flags [.], ack 1429, win 8532, options [nop,nop,TS val 2989633 ecr 3209560,nop,nop,sack 1 {4285:5713},mptcp dss ack 1583763906], length 0
16:13:09.254365 IP 112.26.3.8.42683 > 112.26.3.1.pmcd: Flags [.], ack 1429, win 8532, options [nop,nop,TS val 2989633 ecr 3209560,nop,nop,sack 1 {4285:5713},mptcp dss ack 1583763906], length 0
16:13:09.418241 IP 112.26.3.1.pmcd > 112.26.3.8.42683: Flags [.], seq 12853:14281, ack 1, win 4017, options [nop,nop,TS val 3210112 ecr 2988564,mptcp dss ack 724613416 seq 1583792466 subseq 12853 len 1428 csum 0xf6b], length 1428
16:13:09.418562 IP 112.26.3.8.42683 > 112.26.3.1.pmcd: Flags [.], ack 1429, win 8806, options [nop,nop,TS val 2989867 ecr 3209560,nop,nop,sack 2 {12853:14281}{4285:5713},mptcp dss ack 1583763906], length 0
16:13:09.867313 IP 112.26.3.1.pmcd > 112.26.3.8.42683: Flags [.], seq 14281:15709, ack 1, win 4017, options [nop,nop,TS val 3210942 ecr 2989633,mptcp dss ack 724613416 seq 1583855298 subseq 14281 len 1428 csum 0xc15d], length 1428
16:13:09.867555 IP 112.26.3.8.42683 > 112.26.3.1.pmcd: Flags [.], ack 1429, win 9308, options [nop,nop,TS val 2990316 ecr 3209560,nop,nop,sack 2 {12853:15709}{4285:5713},mptcp dss ack 1583763906], length 0
16:13:09.903527 IP 112.26.3.8.42683 > 112.26.3.1.pmcd: Flags [.], ack 1429, win 9308, options [nop,nop,TS val 2990316 ecr 3209560,nop,nop,sack 2 {12853:15709}{4285:5713},mptcp dss ack 1583763906], length 0
16:13:10.221739 IP 112.26.3.1.pmcd > 112.26.3.8.42683: Flags [.], seq 15709:17137, ack 1, win 4017, options [nop,nop,TS val 3210942 ecr 2989633,mptcp dss ack 724613416 seq 1583856726 subseq 15709 len 1428 csum 0x9ea8], length 1428
16:13:10.221972 IP 112.26.3.8.42683 > 112.26.3.1.pmcd: Flags [.], ack 1429, win 9764, options [nop,nop,TS val 2990670 ecr 3209560,nop,nop,sack 2 {12853:17137}{4285:5713},mptcp dss ack 1583765334], length 0
16:13:10.237701 IP 112.26.3.8.42683 > 112.26.3.1.pmcd: Flags [.], ack 1429, win 9764, options [nop,nop,TS val 2990670 ecr 3209560,nop,nop,sack 2 {12853:17137}{4285:5713},mptcp dss ack 1583765334], length 0
16:13:10.553613 IP 112.26.3.1.pmcd > 112.26.3.8.42683: Flags [.], seq 18565:19993, ack 1, win 4017, options [nop,nop,TS val 3210942 ecr 2989633,mptcp dss ack 724613416 seq 1583859582 subseq 18565 len 1428 csum 0x4088], length 1428
16:13:10.553926 IP 112.26.3.8.42683 > 112.26.3.1.pmcd: Flags [.], ack 1429, win 10175, options [nop,nop,TS val 2991002 ecr 3209560,nop,nop,sack 2 {18565:19993}{12853:17137},mptcp dss ack 1583766762], length 0
16:13:10.610312 IP 112.26.3.8.42683 > 112.26.3.1.pmcd: Flags [.], ack 1429, win 10175, options [nop,nop,TS val 2991002 ecr 3209560,nop,nop,sack 2 {18565:19993}{12853:17137},mptcp dss ack 1583766762], length 0
16:13:10.863249 IP 112.26.3.1.pmcd > 112.26.3.8.42683: Flags [.], seq 1429:2857, ack 1, win 4017, options [nop,nop,TS val 3211752 ecr 2990316,mptcp dss ack 724613416 seq 1583781042 subseq 1429 len 1428 csum 0x7f10], length 1428
16:13:10.863568 IP 112.26.3.8.42683 > 112.26.3.1.pmcd: Flags [.], ack 2857, win 10540, options [nop,nop,TS val 2991311 ecr 3211752,nop,nop,sack 2 {18565:19993}{12853:17137},mptcp dss ack 1583766762], length 0
16:13:11.005045 IP 112.26.3.8.42683 > 112.26.3.1.pmcd: Flags [.], ack 2857, win 10540, options [nop,nop,TS val 2991311 ecr 3211752,nop,nop,sack 2 {18565:19993}{12853:17137},mptcp dss ack 1583766762], length 0
16:13:11.092225 IP 112.26.3.1.pmcd > 112.26.3.8.42683: Flags [.], seq 2857:4285, ack 1, win 4017, options [nop,nop,TS val 3211752 ecr 2990316,mptcp dss ack 724613416 seq 1583782470 subseq 2857 len 1428 csum 0xf8d9], length 1428
16:13:11.092429 IP 112.26.3.8.42683 > 112.26.3.1.pmcd: Flags [.], ack 5713, win 10814, options [nop,nop,TS val 2991540 ecr 3211752,nop,nop,sack 2 {18565:19993}{12853:17137},mptcp dss ack 1583766762], length 0
16:13:11.121148 IP 112.26.3.8.42683 > 112.26.3.1.pmcd: Flags [.], ack 5713, win 10814, options [nop,nop,TS val 2991540 ecr 3211752,nop,nop,sack 2 {18565:19993}{12853:17137},mptcp dss ack 1583766762], length 0
16:13:11.615697 IP 112.26.3.1.pmcd > 112.26.3.8.42683: Flags [.], seq 5713:7141, ack 1, win 4017, options [nop,nop,TS val 3212619 ecr 2991311,mptcp dss ack 724613416 seq 1583785326 subseq 5713 len 1428 csum 0x1342], length 1428
16:13:11.615947 IP 112.26.3.8.42683 > 112.26.3.1.pmcd: Flags [.], ack 7141, win 11498, options [nop,nop,TS val 2992064 ecr 3212619,nop,nop,sack 2 {18565:19993}{12853:17137},mptcp dss ack 1583766762], length 0
16:13:11.959214 IP 112.26.3.1.pmcd > 112.26.3.8.42683: Flags [.], seq 8569:9997, ack 1, win 4017, options [nop,nop,TS val 3212619 ecr 2991311,mptcp dss ack 724613416 seq 1583788182 subseq 8569 len 1428 csum 0x3d28], length 1428
16:13:11.959418 IP 112.26.3.8.42683 > 112.26.3.1.pmcd: Flags [.], ack 7141, win 12000, options [nop,nop,TS val 2992408 ecr 3212619,nop,nop,sack 2 {8569:9997}{18565:19993},mptcp dss ack 1583786754], length 0
16:13:12.061148 IP 112.26.3.8.42683 > 112.26.3.1.pmcd: Flags [.], ack 7141, win 12000, options [nop,nop,TS val 2992408 ecr 3212619,nop,nop,sack 2 {8569:9997}{18565:19993},mptcp dss ack 1583786754], length 0
16:13:12.256024 IP 112.26.3.1.pmcd > 112.26.3.8.42683: Flags [.], seq 11425:12853, ack 1, win 4017, options [nop,nop,TS val 3212745 ecr 2991540,mptcp dss ack 724613416 seq 1583791038 subseq 11425 len 1428 csum 0x228f], length 1428
16:13:12.256253 IP 112.26.3.8.42683 > 112.26.3.1.pmcd: Flags [.], ack 7141, win 12365, options [nop,nop,TS val 2992704 ecr 3212619,nop,nop,sack 2 {11425:17137}{8569:9997},mptcp dss ack 1583786754], length 0
16:13:12.335717 IP 112.26.3.8.42683 > 112.26.3.1.pmcd: Flags [.], ack 7141, win 12365, options [nop,nop,TS val 2992704 ecr 3212619,nop,nop,sack 2 {11425:17137}{8569:9997},mptcp dss ack 1583786754], length 0
16:13:12.925168 IP 112.26.3.1.pmcd > 112.26.3.8.42683: Flags [.], seq 19993:21421, ack 1, win 4017, options [nop,nop,TS val 3213798 ecr 2992408,mptcp dss ack 724613416 seq 1583942406 subseq 19993 len 1428 csum 0x1382], length 1428
16:13:12.925419 IP 112.26.3.8.42683 > 112.26.3.1.pmcd: Flags [.], ack 7141, win 13140, options [nop,nop,TS val 2993374 ecr 3212619,nop,nop,sack 2 {18565:21421}{11425:17137},mptcp dss ack 1583786754], length 0
16:13:13.156633 IP 112.26.3.1.pmcd > 112.26.3.8.42683: Flags [.], seq 21421:22849, ack 1, win 4017, options [nop,nop,TS val 3213798 ecr 2992408,mptcp dss ack 724613416 seq 1583943834 subseq 21421 len 1428 csum 0x6f9e], length 1428
16:13:13.156879 IP 112.26.3.8.42683 > 112.26.3.1.pmcd: Flags [.], ack 7141, win 13414, options [nop,nop,TS val 2993605 ecr 3212619,nop,nop,sack 2 {18565:22849}{11425:17137},mptcp dss ack 1583786754], length 0
16:13:13.181249 IP 112.26.3.8.42683 > 112.26.3.1.pmcd: Flags [.], ack 7141, win 13414, options [nop,nop,TS val 2993605 ecr 3212619,nop,nop,sack 2 {18565:22849}{11425:17137},mptcp dss ack 1583786754], length 0
16:13:13.512757 IP 112.26.3.1.pmcd > 112.26.3.8.42683: Flags [.], seq 7141:8569, ack 1, win 4017, options [nop,nop,TS val 3213902 ecr 2992704,mptcp dss ack 724613416 seq 1583786754 subseq 7141 len 1428 csum 0xa54f], length 1428
16:13:13.513002 IP 112.26.3.8.42683 > 112.26.3.1.pmcd: Flags [.], ack 9997, win 13870, options [nop,nop,TS val 2993961 ecr 3213902,nop,nop,sack 2 {18565:22849}{11425:17137},mptcp dss ack 1583789610], length 0
16:13:13.516344 IP 112.26.3.8.42683 > 112.26.3.1.pmcd: Flags [.], ack 9997, win 13870, options [nop,nop,TS val 2993961 ecr 3213902,nop,nop,sack 2 {18565:22849}{11425:17137},mptcp dss ack 1583789610], length 0
16:13:14.084386 IP 112.26.3.1.pmcd > 112.26.3.8.42683: Flags [.], seq 9997:11425, ack 1, win 4017, options [nop,nop,TS val 3215030 ecr 2993605,mptcp dss ack 724613416 seq 1583789610 subseq 9997 len 1428 csum 0xbcdd], length 1428
16:13:14.084685 IP 112.26.3.8.42683 > 112.26.3.1.pmcd: Flags [.], ack 17137, win 14372, options [nop,nop,TS val 2994533 ecr 3215030,nop,nop,sack 1 {18565:22849},mptcp dss ack 1583858154], length 0
16:13:14.104347 IP 112.26.3.8.42683 > 112.26.3.1.pmcd: Flags [.], ack 17137, win 14372, options [nop,nop,TS val 2994533 ecr 3215030,nop,nop,sack 1 {18565:22849},mptcp dss ack 1583858154], length 0
16:13:14.371127 IP 112.26.3.1.pmcd > 112.26.3.8.42683: Flags [.], seq 17137:18565, ack 1, win 4017, options [nop,nop,TS val 3215030 ecr 2993605,mptcp dss ack 724613416 seq 1583858154 subseq 17137 len 1428 csum 0x4086], length 1428
16:13:14.371370 IP 112.26.3.8.42683 > 112.26.3.1.pmcd: Flags [.], ack 22849, win 14737, options [nop,nop,TS val 2994820 ecr 3215030,mptcp dss ack 1583935266], length 0
16:13:14.885104 IP 112.26.3.1.pmcd > 112.26.3.8.42683: Flags [.], seq 25705:27133, ack 1, win 4017, options [nop,nop,TS val 3215897 ecr 2994533,mptcp dss ack 724613416 seq 1584019518 subseq 25705 len 1428 csum 0x95cc], length 1428
16:13:14.885314 IP 112.26.3.8.42683 > 112.26.3.1.pmcd: Flags [.], ack 22849, win 15376, options [nop,nop,TS val 2995333 ecr 3215030,nop,nop,sack 1 {25705:27133},mptcp dss ack 1583945262], length 0
16:13:15.159118 IP 112.26.3.1.pmcd > 112.26.3.8.42683: Flags [.], seq 27133:28561, ack 1, win 4017, options [nop,nop,TS val 3215897 ecr 2994533,mptcp dss ack 724613416 seq 1584020946 subseq 27133 len 1428 csum 0xbb18], length 1428
16:13:15.159367 IP 112.26.3.8.42683 > 112.26.3.1.pmcd: Flags [.], ack 22849, win 15787, options [nop,nop,TS val 2995608 ecr 3215030,nop,nop,sack 1 {25705:28561},mptcp dss ack 1583945262], length 0
16:13:17.907681 IP 112.26.3.1.pmcd > 112.26.3.8.42683: Flags [.], seq 17137:18565, ack 1, win 4017, options [nop,nop,TS val 3219200 ecr 2994533,mptcp dss ack 724613416 seq 1583858154 subseq 17137 len 1428 csum 0x4086], length 1428
16:13:17.907862 IP 112.26.3.8.42683 > 112.26.3.1.pmcd: Flags [.], ack 22849, win 18889, options [nop,nop,TS val 2998356 ecr 3215030,nop,nop,sack 2 {17137:18565}{25705:28561},mptcp dss ack 1583945262], length 0
16:13:17.926841 IP 112.26.3.8.42683 > 112.26.3.1.pmcd: Flags [.], ack 22849, win 18889, options [nop,nop,TS val 2998356 ecr 3215030,nop,nop,sack 2 {17137:18565}{25705:28561},mptcp dss ack 1583945262], length 0
16:13:18.225067 IP 112.26.3.1.pmcd > 112.26.3.8.42683: Flags [.], seq 22849:24277, ack 1, win 4017, options [nop,nop,TS val 3219455 ecr 2998356,mptcp dss ack 724613416 seq 1583945262 subseq 22849 len 1428 csum 0x1240], length 1428
16:13:18.225284 IP 112.26.3.8.42683 > 112.26.3.1.pmcd: Flags [.], ack 24277, win 19391, options [nop,nop,TS val 2998673 ecr 3219455,nop,nop,sack 1 {25705:28561},mptcp dss ack 1584000954], length 0
16:13:18.229836 IP 112.26.3.8.42683 > 112.26.3.1.pmcd: Flags [.], ack 24277, win 19391, options [nop,nop,TS val 2998673 ecr 3219455,nop,nop,sack 1 {25705:28561},mptcp dss ack 1584000954], length 0
16:13:18.530506 IP 112.26.3.1.pmcd > 112.26.3.8.42683: Flags [.], seq 24277:25705, ack 1, win 4017, options [nop,nop,TS val 3219455 ecr 2998356,mptcp dss ack 724613416 seq 1584000954 subseq 24277 len 1428 csum 0x261d], length 1428
16:13:18.530767 IP 112.26.3.8.42683 > 112.26.3.1.pmcd: Flags [.], ack 28561, win 19756, options [nop,nop,TS val 2998979 ecr 3219455,mptcp dss ack 1584092346], length 0
16:13:18.534336 IP 112.26.3.8.42683 > 112.26.3.1.pmcd: Flags [.], ack 28561, win 19756, options [nop,nop,TS val 2998979 ecr 3219455,mptcp dss ack 1584092346], length 0
16:13:18.939347 IP 112.26.3.1.pmcd > 112.26.3.8.42683: Flags [.], seq 28561:29989, ack 1, win 4017, options [nop,nop,TS val 3220106 ecr 2998979,mptcp dss ack 724613416 seq 1584153750 subseq 28561 len 1428 csum 0x5e84], length 1428
16:13:18.939591 IP 112.26.3.8.42683 > 112.26.3.1.pmcd: Flags [.], ack 29989, win 20075, options [nop,nop,TS val 2999387 ecr 3220106,mptcp dss ack 1584130902], length 0
16:13:18.965135 IP 112.26.3.8.42683 > 112.26.3.1.pmcd: Flags [.], ack 29989, win 20075, options [nop,nop,TS val 2999387 ecr 3220106,mptcp dss ack 1584130902], length 0
16:13:19.265085 IP 112.26.3.1.pmcd > 112.26.3.8.42683: Flags [.], seq 29989:31417, ack 1, win 4017, options [nop,nop,TS val 3220106 ecr 2998979,mptcp dss ack 724613416 seq 1584155178 subseq 29989 len 1428 csum 0x174f], length 1428
16:13:19.265327 IP 112.26.3.8.42683 > 112.26.3.1.pmcd: Flags [.], ack 31417, win 20486, options [nop,nop,TS val 2999713 ecr 3220106,mptcp dss ack 1584130902], length 0
16:13:19.309684 IP 112.26.3.8.42683 > 112.26.3.1.pmcd: Flags [.], ack 31417, win 20486, options [nop,nop,TS val 2999713 ecr 3220106,mptcp dss ack 1584130902], length 0
16:13:19.562849 IP 112.26.3.1.pmcd > 112.26.3.8.42683: Flags [.], seq 31417:32845, ack 1, win 4017, options [nop,nop,TS val 3220106 ecr 2998979,mptcp dss ack 724613416 seq 1584156606 subseq 31417 len 1428 csum 0x960b], length 1428
16:13:19.563088 IP 112.26.3.8.42683 > 112.26.3.1.pmcd: Flags [.], ack 32845, win 20760, options [nop,nop,TS val 3000011 ecr 3220106,mptcp dss ack 1584130902], length 0
16:13:19.581193 IP 112.26.3.8.42683 > 112.26.3.1.pmcd: Flags [.], ack 32845, win 20760, options [nop,nop,TS val 3000011 ecr 3220106,mptcp dss ack 1584130902], length 0
16:13:19.921357 IP 112.26.3.1.pmcd > 112.26.3.8.42683: Flags [.], seq 38557:39985, ack 1, win 4017, options [nop,nop,TS val 3220752 ecr 2999387,mptcp dss ack 724613416 seq 1584183738 subseq 38557 len 1428 csum 0xd067], length 1428
16:13:19.921563 IP 112.26.3.8.42683 > 112.26.3.1.pmcd: Flags [.], ack 32845, win 21307, options [nop,nop,TS val 3000370 ecr 3220106,nop,nop,sack 1 {38557:39985},mptcp dss ack 1584130902], length 0
16:13:20.034411 IP 112.26.3.8.42683 > 112.26.3.1.pmcd: Flags [.], ack 32845, win 21307, options [nop,nop,TS val 3000370 ecr 3220106,nop,nop,sack 1 {38557:39985},mptcp dss ack 1584130902], length 0
16:13:20.136573 IP 112.26.3.1.pmcd > 112.26.3.8.42683: Flags [.], seq 39985:41413, ack 1, win 4017, options [nop,nop,TS val 3220752 ecr 2999387,mptcp dss ack 724613416 seq 1584185166 subseq 39985 len 1428 csum 0xa8e6], length 1428
16:13:20.136763 IP 112.26.3.8.42683 > 112.26.3.1.pmcd: Flags [.], ack 32845, win 21581, options [nop,nop,TS val 3000585 ecr 3220106,nop,nop,sack 1 {38557:41413},mptcp dss ack 1584130902], length 0
16:13:20.191012 IP 112.26.3.8.42683 > 112.26.3.1.pmcd: Flags [.], ack 32845, win 21581, options [nop,nop,TS val 3000585 ecr 3220106,nop,nop,sack 1 {38557:41413},mptcp dss ack 1584130902], length 0
16:13:20.592714 IP 112.26.3.1.pmcd > 112.26.3.8.42683: Flags [.], seq 32845:34273, ack 1, win 4017, options [nop,nop,TS val 3221658 ecr 3000370,mptcp dss ack 724613416 seq 1584158034 subseq 32845 len 1428 csum 0x1a8c], length 1428
16:13:20.592944 IP 112.26.3.8.42683 > 112.26.3.1.pmcd: Flags [.], ack 34273, win 22083, options [nop,nop,TS val 3001041 ecr 3221658,nop,nop,sack 1 {38557:41413},mptcp dss ack 1584142326], length 0
16:13:20.725566 IP 112.26.3.8.42683 > 112.26.3.1.pmcd: Flags [.], ack 34273, win 22083, options [nop,nop,TS val 3001041 ecr 3221658,nop,nop,sack 1 {38557:41413},mptcp dss ack 1584142326], length 0
16:13:20.811931 IP 112.26.3.1.pmcd > 112.26.3.8.42683: Flags [.], seq 34273:35701, ack 1, win 4017, options [nop,nop,TS val 3221806 ecr 3000585,mptcp dss ack 724613416 seq 1584159462 subseq 34273 len 1428 csum 0xcf1], length 1428
16:13:20.812179 IP 112.26.3.8.42683 > 112.26.3.1.pmcd: Flags [.], ack 35701, win 22448, options [nop,nop,TS val 3001260 ecr 3221806,nop,nop,sack 1 {38557:41413},mptcp dss ack 1584160890], length 0
16:13:20.816728 IP 112.26.3.8.42683 > 112.26.3.1.pmcd: Flags [.], ack 35701, win 22448, options [nop,nop,TS val 3001260 ecr 3221806,nop,nop,sack 1 {38557:41413},mptcp dss ack 1584160890], length 0
16:13:21.324207 IP 112.26.3.1.pmcd > 112.26.3.8.42683: Flags [.], seq 35701:37129, ack 1, win 4017, options [nop,nop,TS val 3222279 ecr 3001041,mptcp dss ack 724613416 seq 1584160890 subseq 35701 len 1428 csum 0x86bb], length 1428
16:13:21.324499 IP 112.26.3.8.42683 > 112.26.3.1.pmcd: Flags [.], ack 37129, win 22950, options [nop,nop,TS val 3001772 ecr 3222279,nop,nop,sack 1 {38557:41413},mptcp dss ack 1584162318], length 0
16:13:21.389403 IP 112.26.3.8.42683 > 112.26.3.1.pmcd: Flags [.], ack 37129, win 22950, options [nop,nop,TS val 3001772 ecr 3222279,nop,nop,sack 1 {38557:41413},mptcp dss ack 1584162318], length 0
16:13:21.540450 IP 112.26.3.1.pmcd > 112.26.3.8.42683: Flags [.], seq 37129:38557, ack 1, win 4017, options [nop,nop,TS val 3222279 ecr 3001041,mptcp dss ack 724613416 seq 1584162318 subseq 37129 len 1428 csum 0x4495], length 1428
16:13:21.540721 IP 112.26.3.8.42683 > 112.26.3.1.pmcd: Flags [.], ack 41413, win 23315, options [nop,nop,TS val 3001989 ecr 3222279,mptcp dss ack 1584200874], length 0
16:13:21.615494 IP 112.26.3.8.42683 > 112.26.3.1.pmcd: Flags [.], ack 41413, win 23315, options [nop,nop,TS val 3001989 ecr 3222279,mptcp dss ack 1584200874], length 0
16:13:21.796547 IP 112.26.3.1.pmcd > 112.26.3.8.42683: Flags [.], seq 42841:44269, ack 1, win 4017, options [nop,nop,TS val 3222483 ecr 3001260,mptcp dss ack 724613416 seq 1584213726 subseq 42841 len 1428 csum 0xc0ce], length 1428
16:13:21.796756 IP 112.26.3.8.42683 > 112.26.3.1.pmcd: Flags [.], ack 41413, win 23589, options [nop,nop,TS val 3002245 ecr 3222279,nop,nop,sack 1 {42841:44269},mptcp dss ack 1584200874], length 0
16:13:21.812636 IP 112.26.3.8.42683 > 112.26.3.1.pmcd: Flags [.], ack 41413, win 23589, options [nop,nop,TS val 3002245 ecr 3222279,nop,nop,sack 1 {42841:44269},mptcp dss ack 1584200874], length 0
16:13:22.013494 IP 112.26.3.1.pmcd > 112.26.3.8.42683: Flags [.], seq 44269:45697, ack 1, win 4017, options [nop,nop,TS val 3222483 ecr 3001260,mptcp dss ack 724613416 seq 1584215154 subseq 44269 len 1428 csum 0x13a1], length 1428
16:13:22.013865 IP 112.26.3.8.42683 > 112.26.3.1.pmcd: Flags [.], ack 41413, win 23862, options [nop,nop,TS val 3002462 ecr 3222279,nop,nop,sack 1 {42841:45697},mptcp dss ack 1584200874], length 0
16:13:22.451021 IP 112.26.3.1.pmcd > 112.26.3.8.42683: Flags [.], seq 41413:42841, ack 1, win 4017, options [nop,nop,TS val 3223488 ecr 3002245,mptcp dss ack 724613416 seq 1584200874 subseq 41413 len 1428 csum 0x39ad], length 1428
16:13:22.451401 IP 112.26.3.8.42683 > 112.26.3.1.pmcd: Flags [.], ack 45697, win 24052, options [nop,nop,TS val 3002899 ecr 3223488,mptcp dss ack 1584242286], length 0
16:13:22.469198 IP 112.26.3.8.42683 > 112.26.3.1.pmcd: Flags [.], ack 45697, win 24052, options [nop,nop,TS val 3002899 ecr 3223488,mptcp dss ack 1584242286], length 0
16:13:22.718748 IP 112.26.3.1.pmcd > 112.26.3.8.42683: Flags [.], seq 45697:47125, ack 1, win 4017, options [nop,nop,TS val 3223488 ecr 3002245,mptcp dss ack 724613416 seq 1584257994 subseq 45697 len 1428 csum 0x44f7], length 1428
16:13:22.719075 IP 112.26.3.8.42683 > 112.26.3.1.pmcd: Flags [.], ack 47125, win 24445, options [nop,nop,TS val 3003167 ecr 3223488,mptcp dss ack 1584242286], length 0
16:13:22.728130 IP 112.26.3.8.42683 > 112.26.3.1.pmcd: Flags [.], ack 47125, win 24445, options [nop,nop,TS val 3003167 ecr 3223488,mptcp dss ack 1584242286], length 0
16:13:23.013391 IP 112.26.3.1.pmcd > 112.26.3.8.42683: Flags [.], seq 47125:48553, ack 1, win 4017, options [nop,nop,TS val 3223488 ecr 3002245,mptcp dss ack 724613416 seq 1584259422 subseq 47125 len 1428 csum 0x1d08], length 1428
16:13:23.013738 IP 112.26.3.8.42683 > 112.26.3.1.pmcd: Flags [.], ack 48553, win 24445, options [nop,nop,TS val 3003461 ecr 3223488,mptcp dss ack 1584242286], length 0
16:13:23.373804 IP 112.26.3.1.pmcd > 112.26.3.8.42683: Flags [P.], seq 48553:49981, ack 1, win 4017, options [nop,nop,TS val 3224302 ecr 3002899,mptcp dss ack 724613416 seq 1584286554 subseq 48553 len 1428 csum 0x7cef], length 1428
16:13:23.374094 IP 112.26.3.8.42683 > 112.26.3.1.pmcd: Flags [.], ack 49981, win 24445, options [nop,nop,TS val 3003822 ecr 3224302,mptcp dss ack 1584242286], length 0
16:13:23.377184 IP 112.26.3.8.42683 > 112.26.3.1.pmcd: Flags [.], ack 49981, win 24445, options [nop,nop,TS val 3003822 ecr 3224302,mptcp dss ack 1584242286], length 0
16:13:23.633559 IP 112.26.3.1.pmcd > 112.26.3.8.42683: Flags [.], seq 49981:51409, ack 1, win 4017, options [nop,nop,TS val 3224302 ecr 3002899,mptcp dss ack 724613416 seq 1584287982 subseq 49981 len 1428 csum 0x3f90], length 1428
16:13:23.633922 IP 112.26.3.8.42683 > 112.26.3.1.pmcd: Flags [.], ack 51409, win 24473, options [nop,nop,TS val 3004082 ecr 3224302,mptcp dss ack 1584289410], length 0
16:13:23.872685 IP 112.26.3.1.pmcd > 112.26.3.8.42683: Flags [.], seq 52837:54265, ack 1, win 4017, options [nop,nop,TS val 3224566 ecr 3003167,mptcp dss ack 724613416 seq 1584299406 subseq 52837 len 1428 csum 0x390], length 1428
16:13:23.873011 IP 112.26.3.8.42683 > 112.26.3.1.pmcd: Flags [.], ack 51409, win 24476, options [nop,nop,TS val 3004321 ecr 3224302,nop,nop,sack 1 {52837:54265},mptcp dss ack 1584289410], length 0
16:13:23.903785 IP 112.26.3.8.42683 > 112.26.3.1.pmcd: Flags [.], ack 51409, win 24476, options [nop,nop,TS val 3004321 ecr 3224302,nop,nop,sack 1 {52837:54265},mptcp dss ack 1584289410], length 0
16:13:24.301156 IP 112.26.3.1.pmcd > 112.26.3.8.42683: Flags [.], seq 54265:55693, ack 1, win 4017, options [nop,nop,TS val 3225380 ecr 3004321,mptcp dss ack 724613416 seq 1584316542 subseq 54265 len 1428 csum 0xc0f7], length 1428
16:13:24.301551 IP 112.26.3.8.42683 > 112.26.3.1.pmcd: Flags [.], ack 51409, win 24476, options [nop,nop,TS val 3004750 ecr 3224302,nop,nop,sack 1 {52837:55693},mptcp dss ack 1584289410], length 0
16:13:24.344863 IP 112.26.3.8.42683 > 112.26.3.1.pmcd: Flags [.], ack 51409, win 24476, options [nop,nop,TS val 3004750 ecr 3224302,nop,nop,sack 1 {52837:55693},mptcp dss ack 1584289410], length 0
16:13:24.625788 IP 112.26.3.1.pmcd > 112.26.3.8.42683: Flags [.], seq 55693:57121, ack 1, win 4017, options [nop,nop,TS val 3225380 ecr 3004321,mptcp dss ack 724613416 seq 1584317970 subseq 55693 len 1428 csum 0x59ce], length 1428
16:13:24.626110 IP 112.26.3.8.42683 > 112.26.3.1.pmcd: Flags [.], ack 51409, win 24476, options [nop,nop,TS val 3005074 ecr 3224302,nop,nop,sack 1 {52837:57121},mptcp dss ack 1584289410], length 0
16:13:24.630581 IP 112.26.3.8.42683 > 112.26.3.1.pmcd: Flags [.], ack 51409, win 24476, options [nop,nop,TS val 3005074 ecr 3224302,nop,nop,sack 1 {52837:57121},mptcp dss ack 1584289410], length 0
16:13:24.853834 IP 112.26.3.1.pmcd > 112.26.3.8.42683: Flags [.], seq 57121:58549, ack 1, win 4017, options [nop,nop,TS val 3225380 ecr 3004321,mptcp dss ack 724613416 seq 1584319398 subseq 57121 len 1428 csum 0x5a83], length 1428
16:13:24.854143 IP 112.26.3.8.42683 > 112.26.3.1.pmcd: Flags [.], ack 51409, win 24476, options [nop,nop,TS val 3005302 ecr 3224302,nop,nop,sack 1 {52837:58549},mptcp dss ack 1584289410], length 0
16:13:24.905563 IP 112.26.3.8.42683 > 112.26.3.1.pmcd: Flags [.], ack 51409, win 24476, options [nop,nop,TS val 3005302 ecr 3224302,nop,nop,sack 1 {52837:58549},mptcp dss ack 1584289410], length 0
16:13:25.241335 IP 112.26.3.1.pmcd > 112.26.3.8.42683: Flags [.], seq 51409:52837, ack 1, win 4017, options [nop,nop,TS val 3226392 ecr 3005074,mptcp dss ack 724613416 seq 1584289410 subseq 51409 len 1428 csum 0xd72b], length 1428
16:13:25.241780 IP 112.26.3.8.42683 > 112.26.3.1.pmcd: Flags [.], ack 58549, win 24164, options [nop,nop,TS val 3005690 ecr 3226392,mptcp dss ack 1584309402], length 0
16:13:25.259786 IP 112.26.3.8.42683 > 112.26.3.1.pmcd: Flags [.], ack 58549, win 24164, options [nop,nop,TS val 3005690 ecr 3226392,mptcp dss ack 1584309402], length 0
16:13:25.624056 IP 112.26.3.1.pmcd > 112.26.3.8.42683: Flags [.], seq 58549:59977, ack 1, win 4017, options [nop,nop,TS val 3226745 ecr 3005690,mptcp dss ack 724613416 seq 1584320826 subseq 58549 len 1428 csum 0xabec], length 1428
16:13:25.624363 IP 112.26.3.8.42683 > 112.26.3.1.pmcd: Flags [.], ack 59977, win 24259, options [nop,nop,TS val 3006072 ecr 3226745,mptcp dss ack 1584309402], length 0
16:13:25.899730 IP 112.26.3.1.pmcd > 112.26.3.8.42683: Flags [.], seq 59977:61405, ack 1, win 4017, options [nop,nop,TS val 3226745 ecr 3005690,mptcp dss ack 724613416 seq 1584322254 subseq 59977 len 1428 csum 0xa90c], length 1428
16:13:25.900064 IP 112.26.3.8.42683 > 112.26.3.1.pmcd: Flags [.], ack 61405, win 24259, options [nop,nop,TS val 3006348 ecr 3226745,mptcp dss ack 1584309402], length 0
16:13:25.905860 IP 112.26.3.8.42683 > 112.26.3.1.pmcd: Flags [.], ack 61405, win 24259, options [nop,nop,TS val 3006348 ecr 3226745,mptcp dss ack 1584309402], length 0
16:13:26.188821 IP 112.26.3.1.pmcd > 112.26.3.8.42683: Flags [.], seq 61405:62833, ack 1, win 4017, options [nop,nop,TS val 3226745 ecr 3005690,mptcp dss ack 724613416 seq 1584323682 subseq 61405 len 1428 csum 0x7b6f], length 1428
16:13:26.189195 IP 112.26.3.8.42683 > 112.26.3.1.pmcd: Flags [.], ack 62833, win 23975, options [nop,nop,TS val 3006637 ecr 3226745,mptcp dss ack 1584363666], length 0
16:13:26.522892 IP 112.26.3.1.pmcd > 112.26.3.8.42683: Flags [.], seq 64261:65689, ack 1, win 4017, options [nop,nop,TS val 3227642 ecr 3006348,mptcp dss ack 724613416 seq 1584419358 subseq 64261 len 1428 csum 0x96ab], length 1428
16:13:26.523206 IP 112.26.3.8.42683 > 112.26.3.1.pmcd: Flags [.], ack 62833, win 24491, options [nop,nop,TS val 3006971 ecr 3226745,nop,nop,sack 1 {64261:65689},mptcp dss ack 1584377946], length 0
16:13:26.527223 IP 112.26.3.8.42683 > 112.26.3.1.pmcd: Flags [.], ack 62833, win 24491, options [nop,nop,TS val 3006971 ecr 3226745,nop,nop,sack 1 {64261:65689},mptcp dss ack 1584377946], length 0
16:13:26.758078 IP 112.26.3.1.pmcd > 112.26.3.8.42683: Flags [.], seq 65689:67117, ack 1, win 4017, options [nop,nop,TS val 3227642 ecr 3006348,mptcp dss ack 724613416 seq 1584420786 subseq 65689 len 1428 csum 0xffbc], length 1428
16:13:26.758357 IP 112.26.3.8.42683 > 112.26.3.1.pmcd: Flags [.], ack 62833, win 24491, options [nop,nop,TS val 3007206 ecr 3226745,nop,nop,sack 1 {64261:67117},mptcp dss ack 1584377946], length 0
16:13:29.816518 IP 112.26.3.1.pmcd > 112.26.3.8.42683: Flags [.], seq 61405:62833, ack 1, win 4017, options [nop,nop,TS val 3231104 ecr 3006348,mptcp dss ack 724613416 seq 1584323682 subseq 61405 len 1428 csum 0x7b6f], length 1428
16:13:29.816826 IP 112.26.3.8.42683 > 112.26.3.1.pmcd: Flags [.], ack 62833, win 24358, options [nop,nop,TS val 3010265 ecr 3231104,nop,nop,sack 2 {61405:62833}{64261:67117},mptcp dss ack 1584386514], length 0
16:13:37.102274 IP 112.26.3.1.pmcd > 112.26.3.8.42683: Flags [.], seq 61405:62833, ack 1, win 4017, options [nop,nop,TS val 3238400 ecr 3006348,mptcp dss ack 724613416 seq 1584323682 subseq 61405 len 1428 csum 0x7b6f], length 1428
16:13:37.102633 IP 112.26.3.8.42683 > 112.26.3.1.pmcd: Flags [.], ack 62833, win 24558, options [nop,nop,TS val 3017551 ecr 3238400,nop,nop,sack 2 {61405:62833}{64261:67117},mptcp dss ack 1584749226], length 0
16:13:37.190607 IP 112.26.3.8.42683 > 112.26.3.1.pmcd: Flags [.], ack 62833, win 24558, options [nop,nop,TS val 3017551 ecr 3238400,nop,nop,sack 2 {61405:62833}{64261:67117},mptcp dss ack 1584749226], length 0
16:13:37.446368 IP 112.26.3.1.pmcd > 112.26.3.8.42683: Flags [.], seq 67117:68545, ack 1, win 4017, options [nop,nop,TS val 3238634 ecr 3017551,mptcp dss ack 724613416 seq 1584789210 subseq 67117 len 1428 csum 0x8575], length 1428
16:13:37.446674 IP 112.26.3.8.42683 > 112.26.3.1.pmcd: Flags [.], ack 62833, win 24558, options [nop,nop,TS val 3017895 ecr 3238400,nop,nop,sack 1 {64261:68545},mptcp dss ack 1584749226], length 0
16:13:37.451343 IP 112.26.3.8.42683 > 112.26.3.1.pmcd: Flags [.], ack 62833, win 24558, options [nop,nop,TS val 3017895 ecr 3238400,nop,nop,sack 1 {64261:68545},mptcp dss ack 1584749226], length 0
16:13:37.737152 IP 112.26.3.1.pmcd > 112.26.3.8.42683: Flags [.], seq 68545:69973, ack 1, win 4017, options [nop,nop,TS val 3238634 ecr 3017551,mptcp dss ack 724613416 seq 1584790638 subseq 68545 len 1428 csum 0x3c22], length 1428
16:13:37.737447 IP 112.26.3.8.42683 > 112.26.3.1.pmcd: Flags [.], ack 62833, win 24525, options [nop,nop,TS val 3018185 ecr 3238400,nop,nop,sack 1 {64261:69973},mptcp dss ack 1584789210], length 0
16:13:37.785814 IP 112.26.3.8.42683 > 112.26.3.1.pmcd: Flags [.], ack 62833, win 24525, options [nop,nop,TS val 3018185 ecr 3238400,nop,nop,sack 1 {64261:69973},mptcp dss ack 1584789210], length 0
16:13:38.087181 IP 112.26.3.1.pmcd > 112.26.3.8.42683: Flags [.], seq 69973:71401, ack 1, win 4017, options [nop,nop,TS val 3238634 ecr 3017551,mptcp dss ack 724613416 seq 1584792066 subseq 69973 len 1428 csum 0xce53], length 1428
16:13:38.087487 IP 112.26.3.8.42683 > 112.26.3.1.pmcd: Flags [.], ack 62833, win 24525, options [nop,nop,TS val 3018536 ecr 3238400,nop,nop,sack 1 {64261:71401},mptcp dss ack 1584789210], length 0
16:13:38.093610 IP 112.26.3.8.42683 > 112.26.3.1.pmcd: Flags [.], ack 62833, win 24525, options [nop,nop,TS val 3018536 ecr 3238400,nop,nop,sack 1 {64261:71401},mptcp dss ack 1584789210], length 0
16:13:38.227879 IP 112.26.3.1.pmcd > 112.26.3.8.42683: Flags [.], seq 62833:64261, ack 1, win 4017, options [nop,nop,TS val 3239409 ecr 3018185,mptcp dss ack 724613416 seq 1584386514 subseq 62833 len 1428 csum 0x4f00], length 1428
16:13:38.228247 IP 112.26.3.8.42683 > 112.26.3.1.pmcd: Flags [.], ack 71401, win 24459, options [nop,nop,TS val 3018676 ecr 3239409,mptcp dss ack 1584793494], length 0
16:13:38.252279 IP 112.26.3.8.42683 > 112.26.3.1.pmcd: Flags [.], ack 71401, win 24459, options [nop,nop,TS val 3018676 ecr 3239409,mptcp dss ack 1584793494], length 0
16:13:38.618412 IP 112.26.3.1.pmcd > 112.26.3.8.42683: Flags [.], seq 71401:72829, ack 1, win 4017, options [nop,nop,TS val 3239833 ecr 3018676,mptcp dss ack 724613416 seq 1584793494 subseq 71401 len 1428 csum 0x9c38], length 1428
16:13:38.618741 IP 112.26.3.8.42683 > 112.26.3.1.pmcd: Flags [.], ack 72829, win 24437, options [nop,nop,TS val 3019067 ecr 3239833,mptcp dss ack 1584794922], length 0
16:13:38.662845 IP 112.26.3.8.42683 > 112.26.3.1.pmcd: Flags [.], ack 72829, win 24437, options [nop,nop,TS val 3019067 ecr 3239833,mptcp dss ack 1584794922], length 0
16:13:39.010141 IP 112.26.3.1.pmcd > 112.26.3.8.42683: Flags [.], seq 72829:74257, ack 1, win 4017, options [nop,nop,TS val 3239833 ecr 3018676,mptcp dss ack 724613416 seq 1584794922 subseq 72829 len 1428 csum 0x9289], length 1428
16:13:39.010491 IP 112.26.3.8.42683 > 112.26.3.1.pmcd: Flags [.], ack 74257, win 24415, options [nop,nop,TS val 3019459 ecr 3239833,mptcp dss ack 1584796350], length 0
16:13:39.014791 IP 112.26.3.8.42683 > 112.26.3.1.pmcd: Flags [.], ack 74257, win 24415, options [nop,nop,TS val 3019459 ecr 3239833,mptcp dss ack 1584796350], length 0
16:13:39.306500 IP 112.26.3.1.pmcd > 112.26.3.8.42683: Flags [.], seq 74257:75685, ack 1, win 4017, options [nop,nop,TS val 3239833 ecr 3018676,mptcp dss ack 724613416 seq 1584796350 subseq 74257 len 1428 csum 0x3ea1], length 1428
16:13:39.306833 IP 112.26.3.8.42683 > 112.26.3.1.pmcd: Flags [.], ack 75685, win 24393, options [nop,nop,TS val 3019755 ecr 3239833,mptcp dss ack 1584797778], length 0
16:13:39.317290 IP 112.26.3.8.42683 > 112.26.3.1.pmcd: Flags [.], ack 75685, win 24393, options [nop,nop,TS val 3019755 ecr 3239833,mptcp dss ack 1584797778], length 0
16:13:39.731855 IP 112.26.3.1.pmcd > 112.26.3.8.42683: Flags [.], seq 77113:78541, ack 1, win 4017, options [nop,nop,TS val 3240260 ecr 3019067,mptcp dss ack 724613416 seq 1584799206 subseq 77113 len 1428 csum 0x962d], length 1428
16:13:39.732177 IP 112.26.3.8.42683 > 112.26.3.1.pmcd: Flags [.], ack 75685, win 24393, options [nop,nop,TS val 3020180 ecr 3239833,nop,nop,sack 1 {77113:78541},mptcp dss ack 1584797778], length 0
16:13:39.736825 IP 112.26.3.8.42683 > 112.26.3.1.pmcd: Flags [.], ack 75685, win 24393, options [nop,nop,TS val 3020180 ecr 3239833,nop,nop,sack 1 {77113:78541},mptcp dss ack 1584797778], length 0
16:13:40.024223 IP 112.26.3.1.pmcd > 112.26.3.8.42683: Flags [.], seq 79969:81397, ack 1, win 4017, options [nop,nop,TS val 3240841 ecr 3019459,mptcp dss ack 724613416 seq 1584889170 subseq 79969 len 1428 csum 0x6366], length 1428
16:13:40.024563 IP 112.26.3.8.42683 > 112.26.3.1.pmcd: Flags [.], ack 75685, win 24393, options [nop,nop,TS val 3020473 ecr 3239833,nop,nop,sack 2 {79969:81397}{77113:78541},mptcp dss ack 1584797778], length 0
16:13:40.044771 IP 112.26.3.8.42683 > 112.26.3.1.pmcd: Flags [.], ack 75685, win 24393, options [nop,nop,TS val 3020473 ecr 3239833,nop,nop,sack 2 {79969:81397}{77113:78541},mptcp dss ack 1584797778], length 0
16:13:40.291825 IP 112.26.3.1.pmcd > 112.26.3.8.42683: Flags [.], seq 81397:82825, ack 1, win 4017, options [nop,nop,TS val 3240841 ecr 3019459,mptcp dss ack 724613416 seq 1584890598 subseq 81397 len 1428 csum 0xb038], length 1428
16:13:40.292147 IP 112.26.3.8.42683 > 112.26.3.1.pmcd: Flags [.], ack 75685, win 24393, options [nop,nop,TS val 3020740 ecr 3239833,nop,nop,sack 2 {79969:82825}{77113:78541},mptcp dss ack 1584797778], length 0
16:13:40.296134 IP 112.26.3.8.42683 > 112.26.3.1.pmcd: Flags [.], ack 75685, win 24393, options [nop,nop,TS val 3020740 ecr 3239833,nop,nop,sack 2 {79969:82825}{77113:78541},mptcp dss ack 1584797778], length 0
16:13:40.680933 IP 112.26.3.1.pmcd > 112.26.3.8.42683: Flags [.], seq 75685:77113, ack 1, win 4017, options [nop,nop,TS val 3241743 ecr 3020473,mptcp dss ack 724613416 seq 1584797778 subseq 75685 len 1428 csum 0xd038], length 1428
16:13:40.681282 IP 112.26.3.8.42683 > 112.26.3.1.pmcd: Flags [.], ack 78541, win 23578, options [nop,nop,TS val 3021130 ecr 3241743,nop,nop,sack 1 {79969:82825},mptcp dss ack 1584857754], length 0
16:13:40.718192 IP 112.26.3.8.42683 > 112.26.3.1.pmcd: Flags [.], ack 78541, win 23578, options [nop,nop,TS val 3021130 ecr 3241743,nop,nop,sack 1 {79969:82825},mptcp dss ack 1584857754], length 0
16:13:41.004813 IP 112.26.3.1.pmcd > 112.26.3.8.42683: Flags [.], seq 78541:79969, ack 1, win 4017, options [nop,nop,TS val 3241743 ecr 3020473,mptcp dss ack 724613416 seq 1584869178 subseq 78541 len 1428 csum 0x620a], length 1428
16:13:41.005108 IP 112.26.3.8.42683 > 112.26.3.1.pmcd: Flags [.], ack 82825, win 24236, options [nop,nop,TS val 3021453 ecr 3241743,mptcp dss ack 1584857754], length 0
16:13:41.019462 IP 112.26.3.8.42683 > 112.26.3.1.pmcd: Flags [.], ack 82825, win 24236, options [nop,nop,TS val 3021453 ecr 3241743,mptcp dss ack 1584857754], length 0
16:13:41.338346 IP 112.26.3.1.pmcd > 112.26.3.8.42683: Flags [.], seq 84253:85681, ack 1, win 4017, options [nop,nop,TS val 3241906 ecr 3020740,mptcp dss ack 724613416 seq 1584924870 subseq 84253 len 1428 csum 0xe912], length 1428
16:13:41.338670 IP 112.26.3.8.42683 > 112.26.3.1.pmcd: Flags [.], ack 82825, win 24411, options [nop,nop,TS val 3021786 ecr 3241743,nop,nop,sack 1 {84253:85681},mptcp dss ack 1584916302], length 0
16:13:41.572365 IP 112.26.3.1.pmcd > 112.26.3.8.42683: Flags [.], seq 85681:87109, ack 1, win 4017, options [nop,nop,TS val 3242550 ecr 3021130,mptcp dss ack 724613416 seq 1584949146 subseq 85681 len 1428 csum 0x52ea], length 1428
16:13:41.572677 IP 112.26.3.8.42683 > 112.26.3.1.pmcd: Flags [.], ack 82825, win 24411, options [nop,nop,TS val 3022021 ecr 3241743,nop,nop,sack 1 {84253:87109},mptcp dss ack 1584916302], length 0
16:13:41.602531 IP 112.26.3.8.42683 > 112.26.3.1.pmcd: Flags [.], ack 82825, win 24411, options [nop,nop,TS val 3022021 ecr 3241743,nop,nop,sack 1 {84253:87109},mptcp dss ack 1584916302], length 0
16:13:41.905428 IP 112.26.3.1.pmcd > 112.26.3.8.42683: Flags [.], seq 82825:84253, ack 1, win 4017, options [nop,nop,TS val 3243121 ecr 3022021,mptcp dss ack 724613416 seq 1584916302 subseq 82825 len 1428 csum 0xc43c], length 1428
16:13:41.905781 IP 112.26.3.8.42683 > 112.26.3.1.pmcd: Flags [.], ack 87109, win 24231, options [nop,nop,TS val 3022354 ecr 3243121,mptcp dss ack 1584930582], length 0
16:13:41.931221 IP 112.26.3.8.42683 > 112.26.3.1.pmcd: Flags [.], ack 87109, win 24231, options [nop,nop,TS val 3022354 ecr 3243121,mptcp dss ack 1584930582], length 0
16:13:42.450885 IP 112.26.3.1.pmcd > 112.26.3.8.42683: Flags [.], seq 87109:88537, ack 1, win 4017, options [nop,nop,TS val 3243121 ecr 3022021,mptcp dss ack 724613416 seq 1584974850 subseq 87109 len 1428 csum 0xfaf4], length 1428
16:13:42.451212 IP 112.26.3.8.42683 > 112.26.3.1.pmcd: Flags [.], ack 88537, win 24388, options [nop,nop,TS val 3022899 ecr 3243121,mptcp dss ack 1584930582], length 0
16:13:42.470740 IP 112.26.3.8.42683 > 112.26.3.1.pmcd: Flags [.], ack 88537, win 24388, options [nop,nop,TS val 3022899 ecr 3243121,mptcp dss ack 1584930582], length 0
16:13:42.690062 IP 112.26.3.1.pmcd > 112.26.3.8.42683: Flags [.], seq 89965:91393, ack 1, win 4017, options [nop,nop,TS val 3243121 ecr 3022021,mptcp dss ack 724613416 seq 1584977706 subseq 89965 len 1428 csum 0xa967], length 1428
16:13:42.690406 IP 112.26.3.8.42683 > 112.26.3.1.pmcd: Flags [.], ack 88537, win 24375, options [nop,nop,TS val 3023138 ecr 3243121,nop,nop,sack 1 {89965:91393},mptcp dss ack 1584960570], length 0
16:13:42.712859 IP 112.26.3.8.42683 > 112.26.3.1.pmcd: Flags [.], ack 88537, win 24375, options [nop,nop,TS val 3023138 ecr 3243121,nop,nop,sack 1 {89965:91393},mptcp dss ack 1584960570], length 0
16:13:42.931236 IP 112.26.3.1.pmcd > 112.26.3.8.42683: Flags [.], seq 91393:92821, ack 1, win 4017, options [nop,nop,TS val 3243572 ecr 3022354,mptcp dss ack 724613416 seq 1584991986 subseq 91393 len 1428 csum 0x4d9f], length 1428
16:13:42.931549 IP 112.26.3.8.42683 > 112.26.3.1.pmcd: Flags [.], ack 88537, win 24326, options [nop,nop,TS val 3023379 ecr 3243121,nop,nop,sack 1 {89965:92821},mptcp dss ack 1584976278], length 0
16:13:42.950916 IP 112.26.3.8.42683 > 112.26.3.1.pmcd: Flags [.], ack 88537, win 24326, options [nop,nop,TS val 3023379 ecr 3243121,nop,nop,sack 1 {89965:92821},mptcp dss ack 1584976278], length 0
16:13:43.344316 IP 112.26.3.1.pmcd > 112.26.3.8.42683: Flags [.], seq 92821:94249, ack 1, win 4017, options [nop,nop,TS val 3244408 ecr 3023138,mptcp dss ack 724613416 seq 1585031970 subseq 92821 len 1428 csum 0x82c1], length 1428
16:13:43.344697 IP 112.26.3.8.42683 > 112.26.3.1.pmcd: Flags [.], ack 88537, win 24326, options [nop,nop,TS val 3023793 ecr 3243121,nop,nop,sack 1 {89965:94249},mptcp dss ack 1584976278], length 0
