16:13:07.950089 IP 112.26.2.8.42095 > 112.26.2.1.pmcd: Flags [S], seq 1371634414, win 65535, options [mss 1460,sackOK,TS val 2988378 ecr 0,nop,wscale 6,mptcp join id 6 token 0x6673cfeb nonce 0x70cf9e5d], length 0
16:13:07.955362 IP 112.26.2.1.pmcd > 112.26.2.8.42095: Flags [S.], seq 2230588622, ack 1371634415, win 65535, options [mss 1460,sackOK,TS val 3209296 ecr 2988378,nop,wscale 6,mptcp join id 6 hmac 0x4f08ad8be1e0f2fd nonce 0xa3562a44], length 0
16:13:07.955660 IP 112.26.2.1.pmcd > 112.26.2.8.42095: Flags [S.], seq 2230588622, ack 1371634415, win 65535, options [mss 1460,sackOK,TS val 3209296 ecr 2988378,nop,wscale 6,mptcp join id 6 hmac 0x4f08ad8be1e0f2fd nonce 0xa3562a44], length 0
16:13:08.026879 IP 112.26.2.1.pmcd > 112.26.2.8.42095: Flags [S.], seq 2230588622, ack 1371634415, win 65535, options [mss 1460,sackOK,TS val 3209296 ecr 2988378,nop,wscale 6,mptcp join id 6 hmac 0x4f08ad8be1e0f2fd nonce 0xa3562a44], length 0
16:13:08.103926 IP 112.26.2.8.42095 > 112.26.2.1.pmcd: Flags [.], ack 1, win 6297, options [nop,nop,TS val 2988475 ecr 3209296,mptcp join hmac 0x03bf2749fcb3c673144f41b81c6dad99abe91827], length 0
16:13:08.117441 IP 112.26.2.1.pmcd > 112.26.2.8.42095: Flags [.], ack 1, win 2678, options [nop,nop,TS val 3209450 ecr 2988475,mptcp dss ack 724613416], length 0
16:13:08.117766 IP 112.26.2.1.pmcd > 112.26.2.8.42095: Flags [.], ack 1, win 2678, options [nop,nop,TS val 3209450 ecr 2988475,mptcp dss ack 724613416], length 0
16:13:08.124366 IP 112.26.2.1.pmcd > 112.26.2.8.42095: Flags [.], ack 1, win 2678, options [nop,nop,TS val 3209450 ecr 2988475,mptcp dss ack 724613416], length 0
16:13:08.198114 IP 112.26.2.1.pmcd > 112.26.2.8.42095: Flags [.], seq 1:1429, ack 1, win 2678, options [nop,nop,TS val 3209451 ecr 2988475,mptcp dss ack 724613416 seq 1583758194 subseq 1 len 1428 csum 0xb712], length 1428
16:13:08.198384 IP 112.26.2.1.pmcd > 112.26.2.8.42095: Flags [.], seq 1:1429, ack 1, win 2678, options [nop,nop,TS val 3209451 ecr 2988475,mptcp dss ack 724613416 seq 1583758194 subseq 1 len 1428 csum 0xb712], length 1428
16:13:08.322794 IP 112.26.2.1.pmcd > 112.26.2.8.42095: Flags [.], seq 1:1429, ack 1, win 2678, options [nop,nop,TS val 3209451 ecr 2988475,mptcp dss ack 724613416 seq 1583758194 subseq 1 len 1428 csum 0xb712], length 1428
16:13:08.406113 IP 112.26.2.8.42095 > 112.26.2.1.pmcd: Flags [.], ack 1429, win 7802, options [nop,nop,TS val 2988760 ecr 3209451,mptcp dss ack 1583755338], length 0
16:13:08.414074 IP 112.26.2.1.pmcd > 112.26.2.8.42095: Flags [.], seq 1429:2857, ack 1, win 2678, options [nop,nop,TS val 3209451 ecr 2988475,mptcp dss ack 724613416 seq 1583759622 subseq 1429 len 1428 csum 0xaeb5], length 1428
16:13:08.414409 IP 112.26.2.1.pmcd > 112.26.2.8.42095: Flags [.], seq 1429:2857, ack 1, win 2678, options [nop,nop,TS val 3209451 ecr 2988475,mptcp dss ack 724613416 seq 1583759622 subseq 1429 len 1428 csum 0xaeb5], length 1428
16:13:08.447320 IP 112.26.2.1.pmcd > 112.26.2.8.42095: Flags [.], seq 2857:4285, ack 1, win 2678, options [nop,nop,TS val 3209452 ecr 2988475,mptcp dss ack 724613416 seq 1583761050 subseq 2857 len 1428 csum 0xb966], length 1428
16:13:08.447583 IP 112.26.2.1.pmcd > 112.26.2.8.42095: Flags [.], seq 2857:4285, ack 1, win 2678, options [nop,nop,TS val 3209452 ecr 2988475,mptcp dss ack 724613416 seq 1583761050 subseq 2857 len 1428 csum 0xb966], length 1428
16:13:08.516097 IP 112.26.2.1.pmcd > 112.26.2.8.42095: Flags [.], seq 4285:5713, ack 1, win 2678, options [nop,nop,TS val 3209452 ecr 2988475,mptcp dss ack 724613416 seq 1583762478 subseq 4285 len 1428 csum 0x128e], length 1428
16:13:08.516386 IP 112.26.2.1.pmcd > 112.26.2.8.42095: Flags [.], seq 4285:5713, ack 1, win 2678, options [nop,nop,TS val 3209452 ecr 2988475,mptcp dss ack 724613416 seq 1583762478 subseq 4285 len 1428 csum 0x128e], length 1428
16:13:08.631464 IP 112.26.2.1.pmcd > 112.26.2.8.42095: Flags [.], seq 5713:7141, ack 1, win 2678, options [nop,nop,TS val 3209452 ecr 2988475,mptcp dss ack 724613416 seq 1583763906 subseq 5713 len 1428 csum 0x97c1], length 1428
16:13:08.631822 IP 112.26.2.1.pmcd > 112.26.2.8.42095: Flags [.], seq 5713:7141, ack 1, win 2678, options [nop,nop,TS val 3209452 ecr 2988475,mptcp dss ack 724613416 seq 1583763906 subseq 5713 len 1428 csum 0x97c1], length 1428
16:13:08.701599 IP 112.26.2.1.pmcd > 112.26.2.8.42095: Flags [.], seq 1429:2857, ack 1, win 2678, options [nop,nop,TS val 3209451 ecr 2988475,mptcp dss ack 724613416 seq 1583759622 subseq 1429 len 1428 csum 0xaeb5], length 1428
16:13:08.744717 IP 112.26.2.8.42095 > 112.26.2.1.pmcd: Flags [.], ack 2857, win 8076, options [nop,nop,TS val 2989100 ecr 3209451,mptcp dss ack 1583761050], length 0
16:13:08.775328 IP 112.26.2.1.pmcd > 112.26.2.8.42095: Flags [.], seq 14281:15709, ack 1, win 4017, options [nop,nop,TS val 3209752 ecr 2988760,mptcp dss ack 724613416 seq 1583793894 subseq 14281 len 1428 csum 0xbf85], length 1428
16:13:08.775627 IP 112.26.2.1.pmcd > 112.26.2.8.42095: Flags [.], seq 14281:15709, ack 1, win 4017, options [nop,nop,TS val 3209752 ecr 2988760,mptcp dss ack 724613416 seq 1583793894 subseq 14281 len 1428 csum 0xbf85], length 1428
16:13:08.839268 IP 112.26.2.1.pmcd > 112.26.2.8.42095: Flags [.], seq 2857:4285, ack 1, win 2678, options [nop,nop,TS val 3209452 ecr 2988475,mptcp dss ack 724613416 seq 1583761050 subseq 2857 len 1428 csum 0xb966], length 1428
16:13:08.872154 IP 112.26.2.8.42095 > 112.26.2.1.pmcd: Flags [.], ack 4285, win 8213, options [nop,nop,TS val 2989287 ecr 3209452,mptcp dss ack 1583762478], length 0
16:13:08.930833 IP 112.26.2.1.pmcd > 112.26.2.8.42095: Flags [.], seq 15709:17137, ack 1, win 4017, options [nop,nop,TS val 3209752 ecr 2988760,mptcp dss ack 724613416 seq 1583795322 subseq 15709 len 1428 csum 0x3e64], length 1428
16:13:08.931099 IP 112.26.2.1.pmcd > 112.26.2.8.42095: Flags [.], seq 15709:17137, ack 1, win 4017, options [nop,nop,TS val 3209752 ecr 2988760,mptcp dss ack 724613416 seq 1583795322 subseq 15709 len 1428 csum 0x3e64], length 1428
16:13:08.985309 IP 112.26.2.1.pmcd > 112.26.2.8.42095: Flags [.], seq 15709:17137, ack 1, win 4017, options [nop,nop,TS val 3210008 ecr 2988760,mptcp dss ack 724613416 seq 1583795322 subseq 15709 len 1428 csum 0x3e64], length 1428
16:13:08.985537 IP 112.26.2.1.pmcd > 112.26.2.8.42095: Flags [.], seq 15709:17137, ack 1, win 4017, options [nop,nop,TS val 3210008 ecr 2988760,mptcp dss ack 724613416 seq 1583795322 subseq 15709 len 1428 csum 0x3e64], length 1428
16:13:09.084272 IP 112.26.2.1.pmcd > 112.26.2.8.42095: Flags [.], seq 17137:18565, ack 1, win 4017, options [nop,nop,TS val 3210090 ecr 2989100,mptcp dss ack 724613416 seq 1583816742 subseq 17137 len 1428 csum 0x9575], length 1428
16:13:09.084546 IP 112.26.2.1.pmcd > 112.26.2.8.42095: Flags [.], seq 17137:18565, ack 1, win 4017, options [nop,nop,TS val 3210090 ecr 2989100,mptcp dss ack 724613416 seq 1583816742 subseq 17137 len 1428 csum 0x9575], length 1428
16:13:09.127701 IP 112.26.2.8.42095 > 112.26.2.1.pmcd: Flags [.], ack 5713, win 8304, options [nop,nop,TS val 2989426 ecr 3209452,mptcp dss ack 1583763906], length 0
16:13:09.222373 IP 112.26.2.1.pmcd > 112.26.2.8.42095: Flags [.], seq 18565:19993, ack 1, win 4017, options [nop,nop,TS val 3210090 ecr 2989100,mptcp dss ack 724613416 seq 1583818170 subseq 18565 len 1428 csum 0xb947], length 1428
16:13:09.222734 IP 112.26.2.1.pmcd > 112.26.2.8.42095: Flags [.], seq 18565:19993, ack 1, win 4017, options [nop,nop,TS val 3210090 ecr 2989100,mptcp dss ack 724613416 seq 1583818170 subseq 18565 len 1428 csum 0xb947], length 1428
16:13:09.275226 IP 112.26.2.1.pmcd > 112.26.2.8.42095: Flags [.], seq 14281:15709, ack 1, win 4017, options [nop,nop,TS val 3209752 ecr 2988760,mptcp dss ack 724613416 seq 1583793894 subseq 14281 len 1428 csum 0xbf85], length 1428
16:13:09.288601 IP 112.26.2.8.42095 > 112.26.2.1.pmcd: Flags [.], ack 5713, win 8624, options [nop,nop,TS val 2989717 ecr 3209452,nop,nop,sack 1 {14281:15709},mptcp dss ack 1583763906], length 0
16:13:09.345357 IP 112.26.2.1.pmcd > 112.26.2.8.42095: Flags [.], seq 19993:21421, ack 1, win 4017, options [nop,nop,TS val 3210218 ecr 2989287,mptcp dss ack 724613416 seq 1583825310 subseq 19993 len 1428 csum 0x21e6], length 1428
16:13:09.345629 IP 112.26.2.1.pmcd > 112.26.2.8.42095: Flags [.], seq 19993:21421, ack 1, win 4017, options [nop,nop,TS val 3210218 ecr 2989287,mptcp dss ack 724613416 seq 1583825310 subseq 19993 len 1428 csum 0x21e6], length 1428
16:13:09.429452 IP 112.26.2.1.pmcd > 112.26.2.8.42095: Flags [.], seq 22849:24277, ack 1, win 4017, options [nop,nop,TS val 3210474 ecr 2989426,mptcp dss ack 724613416 seq 1583835306 subseq 22849 len 1428 csum 0x8146], length 1428
16:13:09.429803 IP 112.26.2.1.pmcd > 112.26.2.8.42095: Flags [.], seq 22849:24277, ack 1, win 4017, options [nop,nop,TS val 3210474 ecr 2989426,mptcp dss ack 724613416 seq 1583835306 subseq 22849 len 1428 csum 0x8146], length 1428
16:13:09.481411 IP 112.26.2.1.pmcd > 112.26.2.8.42095: Flags [.], seq 15709:17137, ack 1, win 4017, options [nop,nop,TS val 3210008 ecr 2988760,mptcp dss ack 724613416 seq 1583795322 subseq 15709 len 1428 csum 0x3e64], length 1428
16:13:09.498570 IP 112.26.2.8.42095 > 112.26.2.1.pmcd: Flags [.], ack 5713, win 8943, options [nop,nop,TS val 2989910 ecr 3209452,nop,nop,sack 1 {14281:17137},mptcp dss ack 1583763906], length 0
16:13:09.572663 IP 112.26.2.1.pmcd > 112.26.2.8.42095: Flags [.], seq 24277:25705, ack 1, win 4017, options [nop,nop,TS val 3210474 ecr 2989426,mptcp dss ack 724613416 seq 1583836734 subseq 24277 len 1428 csum 0xe9fc], length 1428
16:13:09.572930 IP 112.26.2.1.pmcd > 112.26.2.8.42095: Flags [.], seq 24277:25705, ack 1, win 4017, options [nop,nop,TS val 3210474 ecr 2989426,mptcp dss ack 724613416 seq 1583836734 subseq 24277 len 1428 csum 0xe9fc], length 1428
16:13:09.649576 IP 112.26.2.1.pmcd > 112.26.2.8.42095: Flags [.], seq 5713:7141, ack 1, win 4017, options [nop,nop,TS val 3210634 ecr 2989717,mptcp dss ack 724613416 seq 1583763906 subseq 5713 len 1428 csum 0x97c1], length 1428
16:13:09.649787 IP 112.26.2.1.pmcd > 112.26.2.8.42095: Flags [.], seq 5713:7141, ack 1, win 4017, options [nop,nop,TS val 3210634 ecr 2989717,mptcp dss ack 724613416 seq 1583763906 subseq 5713 len 1428 csum 0x97c1], length 1428
16:13:09.711397 IP 112.26.2.1.pmcd > 112.26.2.8.42095: Flags [.], seq 18565:19993, ack 1, win 4017, options [nop,nop,TS val 3210090 ecr 2989100,mptcp dss ack 724613416 seq 1583818170 subseq 18565 len 1428 csum 0xb947], length 1428
16:13:09.759123 IP 112.26.2.1.pmcd > 112.26.2.8.42095: Flags [.], seq 7141:8569, ack 1, win 4017, options [nop,nop,TS val 3210844 ecr 2989910,mptcp dss ack 724613416 seq 1583765334 subseq 7141 len 1428 csum 0xbb82], length 1428
16:13:09.759412 IP 112.26.2.1.pmcd > 112.26.2.8.42095: Flags [.], seq 7141:8569, ack 1, win 4017, options [nop,nop,TS val 3210844 ecr 2989910,mptcp dss ack 724613416 seq 1583765334 subseq 7141 len 1428 csum 0xbb82], length 1428
16:13:09.826559 IP 112.26.2.8.42095 > 112.26.2.1.pmcd: Flags [.], ack 5713, win 9125, options [nop,nop,TS val 2990153 ecr 3209452,nop,nop,sack 2 {18565:19993}{14281:17137},mptcp dss ack 1583763906], length 0
16:13:09.866836 IP 112.26.2.1.pmcd > 112.26.2.8.42095: Flags [.], seq 8569:9997, ack 1, win 4017, options [nop,nop,TS val 3211173 ecr 2990153,mptcp dss ack 724613416 seq 1583766762 subseq 8569 len 1428 csum 0xe9fd], length 1428
16:13:09.867124 IP 112.26.2.1.pmcd > 112.26.2.8.42095: Flags [.], seq 8569:9997, ack 1, win 4017, options [nop,nop,TS val 3211173 ecr 2990153,mptcp dss ack 724613416 seq 1583766762 subseq 8569 len 1428 csum 0xe9fd], length 1428
16:13:09.997234 IP 112.26.2.1.pmcd > 112.26.2.8.42095: Flags [.], seq 24277:25705, ack 1, win 4017, options [nop,nop,TS val 3210474 ecr 2989426,mptcp dss ack 724613416 seq 1583836734 subseq 24277 len 1428 csum 0xe9fc], length 1428
16:13:10.053433 IP 112.26.2.8.42095 > 112.26.2.1.pmcd: Flags [.], ack 5713, win 9445, options [nop,nop,TS val 2990423 ecr 3209452,nop,nop,sack 2 {24277:25705}{18565:19993},mptcp dss ack 1583763906], length 0
16:13:10.076533 IP 112.26.2.1.pmcd > 112.26.2.8.42095: Flags [.], seq 9997:11425, ack 1, win 4017, options [nop,nop,TS val 3211399 ecr 2990423,mptcp dss ack 724613416 seq 1583768190 subseq 9997 len 1428 csum 0x9c86], length 1428
16:13:10.076838 IP 112.26.2.1.pmcd > 112.26.2.8.42095: Flags [.], seq 9997:11425, ack 1, win 4017, options [nop,nop,TS val 3211399 ecr 2990423,mptcp dss ack 724613416 seq 1583768190 subseq 9997 len 1428 csum 0x9c86], length 1428
16:13:10.158116 IP 112.26.2.1.pmcd > 112.26.2.8.42095: Flags [.], seq 5713:7141, ack 1, win 4017, options [nop,nop,TS val 3210634 ecr 2989717,mptcp dss ack 724613416 seq 1583763906 subseq 5713 len 1428 csum 0x97c1], length 1428
16:13:10.261170 IP 112.26.2.1.pmcd > 112.26.2.8.42095: Flags [.], seq 7141:8569, ack 1, win 4017, options [nop,nop,TS val 3210844 ecr 2989910,mptcp dss ack 724613416 seq 1583765334 subseq 7141 len 1428 csum 0xbb82], length 1428
16:13:10.280960 IP 112.26.2.8.42095 > 112.26.2.1.pmcd: Flags [.], ack 7141, win 9627, options [nop,nop,TS val 2990580 ecr 3210634,nop,nop,sack 2 {24277:25705}{18565:19993},mptcp dss ack 1583765334], length 0
16:13:10.389470 IP 112.26.2.1.pmcd > 112.26.2.8.42095: Flags [.], seq 11425:12853, ack 1, win 4017, options [nop,nop,TS val 3211627 ecr 2990580,mptcp dss ack 724613416 seq 1583769618 subseq 11425 len 1428 csum 0x8a8d], length 1428
16:13:10.389785 IP 112.26.2.1.pmcd > 112.26.2.8.42095: Flags [.], seq 11425:12853, ack 1, win 4017, options [nop,nop,TS val 3211627 ecr 2990580,mptcp dss ack 724613416 seq 1583769618 subseq 11425 len 1428 csum 0x8a8d], length 1428
16:13:10.395214 IP 112.26.2.1.pmcd > 112.26.2.8.42095: Flags [.], seq 12853:14281, ack 1, win 4017, options [nop,nop,TS val 3211627 ecr 2990580,mptcp dss ack 724613416 seq 1583771046 subseq 12853 len 1428 csum 0x3956], length 1428
16:13:10.395428 IP 112.26.2.1.pmcd > 112.26.2.8.42095: Flags [.], seq 12853:14281, ack 1, win 4017, options [nop,nop,TS val 3211627 ecr 2990580,mptcp dss ack 724613416 seq 1583771046 subseq 12853 len 1428 csum 0x3956], length 1428
16:13:10.429883 IP 112.26.2.8.42095 > 112.26.2.1.pmcd: Flags [.], ack 8569, win 9810, options [nop,nop,TS val 2990709 ecr 3210844,nop,nop,sack 2 {24277:25705}{18565:19993},mptcp dss ack 1583766762], length 0
16:13:10.462081 IP 112.26.2.1.pmcd > 112.26.2.8.42095: Flags [.], seq 9997:11425, ack 1, win 4017, options [nop,nop,TS val 3211399 ecr 2990423,mptcp dss ack 724613416 seq 1583768190 subseq 9997 len 1428 csum 0x9c86], length 1428
16:13:10.509234 IP 112.26.2.1.pmcd > 112.26.2.8.42095: Flags [.], seq 17137:18565, ack 1, win 4017, options [nop,nop,TS val 3211776 ecr 2990709,mptcp dss ack 724613416 seq 1583816742 subseq 17137 len 1428 csum 0x9575], length 1428
16:13:10.509441 IP 112.26.2.1.pmcd > 112.26.2.8.42095: Flags [.], seq 17137:18565, ack 1, win 4017, options [nop,nop,TS val 3211776 ecr 2990709,mptcp dss ack 724613416 seq 1583816742 subseq 17137 len 1428 csum 0x9575], length 1428
16:13:10.646244 IP 112.26.2.8.42095 > 112.26.2.1.pmcd: Flags [.], ack 8569, win 10038, options [nop,nop,TS val 2990910 ecr 3210844,nop,nop,sack 2 {9997:11425}{24277:25705},mptcp dss ack 1583766762], length 0
16:13:10.725993 IP 112.26.2.1.pmcd > 112.26.2.8.42095: Flags [.], seq 19993:21421, ack 1, win 4017, options [nop,nop,TS val 3211776 ecr 2990709,mptcp dss ack 724613416 seq 1583825310 subseq 19993 len 1428 csum 0x21e6], length 1428
16:13:10.726289 IP 112.26.2.1.pmcd > 112.26.2.8.42095: Flags [.], seq 19993:21421, ack 1, win 4017, options [nop,nop,TS val 3211776 ecr 2990709,mptcp dss ack 724613416 seq 1583825310 subseq 19993 len 1428 csum 0x21e6], length 1428
16:13:10.731631 IP 112.26.2.1.pmcd > 112.26.2.8.42095: Flags [.], seq 8569:9997, ack 1, win 4017, options [nop,nop,TS val 3211992 ecr 2990910,mptcp dss ack 724613416 seq 1583766762 subseq 8569 len 1428 csum 0xe9fd], length 1428
16:13:10.731848 IP 112.26.2.1.pmcd > 112.26.2.8.42095: Flags [.], seq 8569:9997, ack 1, win 4017, options [nop,nop,TS val 3211992 ecr 2990910,mptcp dss ack 724613416 seq 1583766762 subseq 8569 len 1428 csum 0xe9fd], length 1428
16:13:10.796412 IP 112.26.2.1.pmcd > 112.26.2.8.42095: Flags [.], seq 12853:14281, ack 1, win 4017, options [nop,nop,TS val 3211627 ecr 2990580,mptcp dss ack 724613416 seq 1583771046 subseq 12853 len 1428 csum 0x3956], length 1428
16:13:10.881238 IP 112.26.2.8.42095 > 112.26.2.1.pmcd: Flags [.], ack 8569, win 10266, options [nop,nop,TS val 2991060 ecr 3210844,nop,nop,sack 2 {9997:12853}{24277:25705},mptcp dss ack 1583766762], length 0
16:13:10.886291 IP 112.26.2.1.pmcd > 112.26.2.8.42095: Flags [.], seq 21421:22849, ack 1, win 4017, options [nop,nop,TS val 3212227 ecr 2991060,mptcp dss ack 724613416 seq 1583826738 subseq 21421 len 1428 csum 0xf0b2], length 1428
16:13:10.886537 IP 112.26.2.1.pmcd > 112.26.2.8.42095: Flags [.], seq 21421:22849, ack 1, win 4017, options [nop,nop,TS val 3212227 ecr 2991060,mptcp dss ack 724613416 seq 1583826738 subseq 21421 len 1428 csum 0xf0b2], length 1428
16:13:10.965892 IP 112.26.2.1.pmcd > 112.26.2.8.42095: Flags [.], seq 17137:18565, ack 1, win 4017, options [nop,nop,TS val 3211776 ecr 2990709,mptcp dss ack 724613416 seq 1583816742 subseq 17137 len 1428 csum 0x9575], length 1428
16:13:11.019075 IP 112.26.2.8.42095 > 112.26.2.1.pmcd: Flags [.], ack 8569, win 10403, options [nop,nop,TS val 2991244 ecr 3210844,nop,nop,sack 2 {9997:17137}{24277:25705},mptcp dss ack 1583766762], length 0
16:13:11.024341 IP 112.26.2.1.pmcd > 112.26.2.8.42095: Flags [.], seq 22849:24277, ack 1, win 4017, options [nop,nop,TS val 3212365 ecr 2991244,mptcp dss ack 724613416 seq 1583835306 subseq 22849 len 1428 csum 0x8146], length 1428
16:13:11.024604 IP 112.26.2.1.pmcd > 112.26.2.8.42095: Flags [.], seq 22849:24277, ack 1, win 4017, options [nop,nop,TS val 3212365 ecr 2991244,mptcp dss ack 724613416 seq 1583835306 subseq 22849 len 1428 csum 0x8146], length 1428
16:13:11.136534 IP 112.26.2.8.42095 > 112.26.2.1.pmcd: Flags [.], ack 8569, win 10677, options [nop,nop,TS val 2991407 ecr 3210844,nop,nop,sack 2 {9997:19993}{24277:25705},mptcp dss ack 1583766762], length 0
16:13:11.185512 IP 112.26.2.1.pmcd > 112.26.2.8.42095: Flags [.], seq 19993:21421, ack 1, win 4017, options [nop,nop,TS val 3211776 ecr 2990709,mptcp dss ack 724613416 seq 1583825310 subseq 19993 len 1428 csum 0x21e6], length 1428
16:13:11.202014 IP 112.26.2.1.pmcd > 112.26.2.8.42095: Flags [.], seq 25705:27133, ack 1, win 4017, options [nop,nop,TS val 3212540 ecr 2991407,mptcp dss ack 724613416 seq 1583892426 subseq 25705 len 1428 csum 0x6201], length 1428
16:13:11.202283 IP 112.26.2.1.pmcd > 112.26.2.8.42095: Flags [.], seq 25705:27133, ack 1, win 4017, options [nop,nop,TS val 3212540 ecr 2991407,mptcp dss ack 724613416 seq 1583892426 subseq 25705 len 1428 csum 0x6201], length 1428
16:13:11.229354 IP 112.26.2.8.42095 > 112.26.2.1.pmcd: Flags [.], ack 8569, win 10996, options [nop,nop,TS val 2991628 ecr 3210844,nop,nop,sack 2 {9997:21421}{24277:25705},mptcp dss ack 1583766762], length 0
16:13:11.296202 IP 112.26.2.1.pmcd > 112.26.2.8.42095: Flags [.], seq 27133:28561, ack 1, win 4017, options [nop,nop,TS val 3212619 ecr 2991628,mptcp dss ack 724613416 seq 1583895282 subseq 27133 len 1428 csum 0x7725], length 1428
16:13:11.296512 IP 112.26.2.1.pmcd > 112.26.2.8.42095: Flags [.], seq 27133:28561, ack 1, win 4017, options [nop,nop,TS val 3212619 ecr 2991628,mptcp dss ack 724613416 seq 1583895282 subseq 27133 len 1428 csum 0x7725], length 1428
16:13:11.368646 IP 112.26.2.1.pmcd > 112.26.2.8.42095: Flags [.], seq 21421:22849, ack 1, win 4017, options [nop,nop,TS val 3212227 ecr 2991060,mptcp dss ack 724613416 seq 1583826738 subseq 21421 len 1428 csum 0xf0b2], length 1428
16:13:11.431693 IP 112.26.2.8.42095 > 112.26.2.1.pmcd: Flags [.], ack 8569, win 11133, options [nop,nop,TS val 2991782 ecr 3210844,nop,nop,sack 2 {9997:22849}{24277:25705},mptcp dss ack 1583766762], length 0
16:13:11.470212 IP 112.26.2.1.pmcd > 112.26.2.8.42095: Flags [.], seq 8569:9997, ack 1, win 4017, options [nop,nop,TS val 3212778 ecr 2991782,mptcp dss ack 724613416 seq 1583766762 subseq 8569 len 1428 csum 0xe9fd], length 1428
16:13:11.470642 IP 112.26.2.1.pmcd > 112.26.2.8.42095: Flags [.], seq 8569:9997, ack 1, win 4017, options [nop,nop,TS val 3212778 ecr 2991782,mptcp dss ack 724613416 seq 1583766762 subseq 8569 len 1428 csum 0xe9fd], length 1428
16:13:11.536509 IP 112.26.2.1.pmcd > 112.26.2.8.42095: Flags [.], seq 22849:24277, ack 1, win 4017, options [nop,nop,TS val 3212365 ecr 2991244,mptcp dss ack 724613416 seq 1583835306 subseq 22849 len 1428 csum 0x8146], length 1428
16:13:11.598884 IP 112.26.2.8.42095 > 112.26.2.1.pmcd: Flags [.], ack 8569, win 11361, options [nop,nop,TS val 2991961 ecr 3210844,nop,nop,sack 1 {9997:25705},mptcp dss ack 1583766762], length 0
16:13:11.731327 IP 112.26.2.1.pmcd > 112.26.2.8.42095: Flags [.], seq 25705:27133, ack 1, win 4017, options [nop,nop,TS val 3212540 ecr 2991407,mptcp dss ack 724613416 seq 1583892426 subseq 25705 len 1428 csum 0x6201], length 1428
16:13:11.737186 IP 112.26.2.1.pmcd > 112.26.2.8.42095: Flags [.], seq 28561:29989, ack 1, win 4017, options [nop,nop,TS val 3212991 ecr 2991961,mptcp dss ack 724613416 seq 1583902422 subseq 28561 len 1428 csum 0x2f0b], length 1428
16:13:11.737509 IP 112.26.2.1.pmcd > 112.26.2.8.42095: Flags [.], seq 28561:29989, ack 1, win 4017, options [nop,nop,TS val 3212991 ecr 2991961,mptcp dss ack 724613416 seq 1583902422 subseq 28561 len 1428 csum 0x2f0b], length 1428
16:13:11.796744 IP 112.26.2.1.pmcd > 112.26.2.8.42095: Flags [.], seq 27133:28561, ack 1, win 4017, options [nop,nop,TS val 3212619 ecr 2991628,mptcp dss ack 724613416 seq 1583895282 subseq 27133 len 1428 csum 0x7725], length 1428
16:13:11.856330 IP 112.26.2.8.42095 > 112.26.2.1.pmcd: Flags [.], ack 8569, win 11589, options [nop,nop,TS val 2992104 ecr 3210844,nop,nop,sack 1 {9997:27133},mptcp dss ack 1583766762], length 0
16:13:11.921946 IP 112.26.2.1.pmcd > 112.26.2.8.42095: Flags [.], seq 29989:31417, ack 1, win 4017, options [nop,nop,TS val 3213262 ecr 2992104,mptcp dss ack 724613416 seq 1583918130 subseq 29989 len 1428 csum 0x6c7], length 1428
16:13:11.922249 IP 112.26.2.1.pmcd > 112.26.2.8.42095: Flags [.], seq 29989:31417, ack 1, win 4017, options [nop,nop,TS val 3213262 ecr 2992104,mptcp dss ack 724613416 seq 1583918130 subseq 29989 len 1428 csum 0x6c7], length 1428
16:13:11.981148 IP 112.26.2.1.pmcd > 112.26.2.8.42095: Flags [.], seq 8569:9997, ack 1, win 4017, options [nop,nop,TS val 3212778 ecr 2991782,mptcp dss ack 724613416 seq 1583766762 subseq 8569 len 1428 csum 0xe9fd], length 1428
16:13:12.102057 IP 112.26.2.8.42095 > 112.26.2.1.pmcd: Flags [.], ack 8569, win 11726, options [nop,nop,TS val 2992245 ecr 3210844,nop,nop,sack 1 {9997:28561},mptcp dss ack 1583766762], length 0
16:13:12.121520 IP 112.26.2.1.pmcd > 112.26.2.8.42095: Flags [.], seq 28561:29989, ack 1, win 4017, options [nop,nop,TS val 3212991 ecr 2991961,mptcp dss ack 724613416 seq 1583902422 subseq 28561 len 1428 csum 0x2f0b], length 1428
16:13:12.173323 IP 112.26.2.1.pmcd > 112.26.2.8.42095: Flags [.], seq 31417:32845, ack 1, win 4017, options [nop,nop,TS val 3213511 ecr 2992245,mptcp dss ack 724613416 seq 1583926698 subseq 31417 len 1428 csum 0xa93f], length 1428
16:13:12.173595 IP 112.26.2.1.pmcd > 112.26.2.8.42095: Flags [.], seq 31417:32845, ack 1, win 4017, options [nop,nop,TS val 3213511 ecr 2992245,mptcp dss ack 724613416 seq 1583926698 subseq 31417 len 1428 csum 0xa93f], length 1428
16:13:12.223257 IP 112.26.2.8.42095 > 112.26.2.1.pmcd: Flags [.], ack 28561, win 11954, options [nop,nop,TS val 2992400 ecr 3212778,mptcp dss ack 1583786754], length 0
16:13:12.239557 IP 112.26.2.1.pmcd > 112.26.2.8.42095: Flags [.], seq 29989:31417, ack 1, win 4017, options [nop,nop,TS val 3213262 ecr 2992104,mptcp dss ack 724613416 seq 1583918130 subseq 29989 len 1428 csum 0x6c7], length 1428
16:13:12.278174 IP 112.26.2.1.pmcd > 112.26.2.8.42095: Flags [.], seq 32845:34273, ack 1, win 4017, options [nop,nop,TS val 3213569 ecr 2992400,mptcp dss ack 724613416 seq 1583929554 subseq 32845 len 1428 csum 0x2007], length 1428
16:13:12.278470 IP 112.26.2.1.pmcd > 112.26.2.8.42095: Flags [.], seq 32845:34273, ack 1, win 4017, options [nop,nop,TS val 3213569 ecr 2992400,mptcp dss ack 724613416 seq 1583929554 subseq 32845 len 1428 csum 0x2007], length 1428
16:13:12.352937 IP 112.26.2.1.pmcd > 112.26.2.8.42095: Flags [.], seq 31417:32845, ack 1, win 4017, options [nop,nop,TS val 3213511 ecr 2992245,mptcp dss ack 724613416 seq 1583926698 subseq 31417 len 1428 csum 0xa93f], length 1428
16:13:12.410798 IP 112.26.2.1.pmcd > 112.26.2.8.42095: Flags [.], seq 34273:35701, ack 1, win 4017, options [nop,nop,TS val 3213569 ecr 2992400,mptcp dss ack 724613416 seq 1583930982 subseq 34273 len 1428 csum 0x609a], length 1428
16:13:12.411055 IP 112.26.2.1.pmcd > 112.26.2.8.42095: Flags [.], seq 34273:35701, ack 1, win 4017, options [nop,nop,TS val 3213569 ecr 2992400,mptcp dss ack 724613416 seq 1583930982 subseq 34273 len 1428 csum 0x609a], length 1428
16:13:12.456033 IP 112.26.2.8.42095 > 112.26.2.1.pmcd: Flags [.], ack 29989, win 12137, options [nop,nop,TS val 2992570 ecr 3212991,mptcp dss ack 1583786754], length 0
16:13:12.506754 IP 112.26.2.1.pmcd > 112.26.2.8.42095: Flags [.], seq 32845:34273, ack 1, win 4017, options [nop,nop,TS val 3213569 ecr 2992400,mptcp dss ack 724613416 seq 1583929554 subseq 32845 len 1428 csum 0x2007], length 1428
16:13:12.578461 IP 112.26.2.8.42095 > 112.26.2.1.pmcd: Flags [.], ack 31417, win 12319, options [nop,nop,TS val 2992688 ecr 3213262,mptcp dss ack 1583786754], length 0
16:13:12.626539 IP 112.26.2.1.pmcd > 112.26.2.8.42095: Flags [.], seq 35701:37129, ack 1, win 4017, options [nop,nop,TS val 3213569 ecr 2992400,mptcp dss ack 724613416 seq 1583932410 subseq 35701 len 1428 csum 0x70fe], length 1428
16:13:12.626815 IP 112.26.2.1.pmcd > 112.26.2.8.42095: Flags [.], seq 35701:37129, ack 1, win 4017, options [nop,nop,TS val 3213569 ecr 2992400,mptcp dss ack 724613416 seq 1583932410 subseq 35701 len 1428 csum 0x70fe], length 1428
16:13:12.630488 IP 112.26.2.1.pmcd > 112.26.2.8.42095: Flags [.], seq 37129:38557, ack 1, win 4017, options [nop,nop,TS val 3213569 ecr 2992400,mptcp dss ack 724613416 seq 1583933838 subseq 37129 len 1428 csum 0x7cf8], length 1428
16:13:12.630689 IP 112.26.2.1.pmcd > 112.26.2.8.42095: Flags [.], seq 37129:38557, ack 1, win 4017, options [nop,nop,TS val 3213569 ecr 2992400,mptcp dss ack 724613416 seq 1583933838 subseq 37129 len 1428 csum 0x7cf8], length 1428
16:13:12.690263 IP 112.26.2.1.pmcd > 112.26.2.8.42095: Flags [.], seq 34273:35701, ack 1, win 4017, options [nop,nop,TS val 3213569 ecr 2992400,mptcp dss ack 724613416 seq 1583930982 subseq 34273 len 1428 csum 0x609a], length 1428
16:13:12.737057 IP 112.26.2.8.42095 > 112.26.2.1.pmcd: Flags [.], ack 32845, win 12502, options [nop,nop,TS val 2992801 ecr 3213511,mptcp dss ack 1583786754], length 0
16:13:12.770309 IP 112.26.2.1.pmcd > 112.26.2.8.42095: Flags [.], seq 41413:42841, ack 1, win 4017, options [nop,nop,TS val 3213802 ecr 2992570,mptcp dss ack 724613416 seq 1583946690 subseq 41413 len 1428 csum 0xed9b], length 1428
16:13:12.770575 IP 112.26.2.1.pmcd > 112.26.2.8.42095: Flags [.], seq 41413:42841, ack 1, win 4017, options [nop,nop,TS val 3213802 ecr 2992570,mptcp dss ack 724613416 seq 1583946690 subseq 41413 len 1428 csum 0xed9b], length 1428
16:13:12.833884 IP 112.26.2.8.42095 > 112.26.2.1.pmcd: Flags [.], ack 34273, win 12639, options [nop,nop,TS val 2992955 ecr 3213569,mptcp dss ack 1583786754], length 0
16:13:12.859714 IP 112.26.2.1.pmcd > 112.26.2.8.42095: Flags [.], seq 35701:37129, ack 1, win 4017, options [nop,nop,TS val 3213569 ecr 2992400,mptcp dss ack 724613416 seq 1583932410 subseq 35701 len 1428 csum 0x70fe], length 1428
16:13:12.923249 IP 112.26.2.1.pmcd > 112.26.2.8.42095: Flags [.], seq 42841:44269, ack 1, win 4017, options [nop,nop,TS val 3213924 ecr 2992688,mptcp dss ack 724613416 seq 1583949546 subseq 42841 len 1428 csum 0xe72e], length 1428
16:13:12.923508 IP 112.26.2.1.pmcd > 112.26.2.8.42095: Flags [.], seq 42841:44269, ack 1, win 4017, options [nop,nop,TS val 3213924 ecr 2992688,mptcp dss ack 724613416 seq 1583949546 subseq 42841 len 1428 csum 0xe72e], length 1428
16:13:13.018943 IP 112.26.2.1.pmcd > 112.26.2.8.42095: Flags [.], seq 44269:45697, ack 1, win 4017, options [nop,nop,TS val 3213924 ecr 2992688,mptcp dss ack 724613416 seq 1583950974 subseq 44269 len 1428 csum 0xa5a9], length 1428
16:13:13.019203 IP 112.26.2.1.pmcd > 112.26.2.8.42095: Flags [.], seq 44269:45697, ack 1, win 4017, options [nop,nop,TS val 3213924 ecr 2992688,mptcp dss ack 724613416 seq 1583950974 subseq 44269 len 1428 csum 0xa5a9], length 1428
16:13:13.062128 IP 112.26.2.1.pmcd > 112.26.2.8.42095: Flags [.], seq 37129:38557, ack 1, win 4017, options [nop,nop,TS val 3213569 ecr 2992400,mptcp dss ack 724613416 seq 1583933838 subseq 37129 len 1428 csum 0x7cf8], length 1428
16:13:13.072469 IP 112.26.2.8.42095 > 112.26.2.1.pmcd: Flags [.], ack 35701, win 12821, options [nop,nop,TS val 2993138 ecr 3213569,mptcp dss ack 1583786754], length 0
16:13:13.141907 IP 112.26.2.1.pmcd > 112.26.2.8.42095: Flags [.], seq 45697:47125, ack 1, win 4017, options [nop,nop,TS val 3214083 ecr 2992801,mptcp dss ack 724613416 seq 1583955258 subseq 45697 len 1428 csum 0xea4], length 1428
16:13:13.142199 IP 112.26.2.1.pmcd > 112.26.2.8.42095: Flags [.], seq 45697:47125, ack 1, win 4017, options [nop,nop,TS val 3214083 ecr 2992801,mptcp dss ack 724613416 seq 1583955258 subseq 45697 len 1428 csum 0xea4], length 1428
16:13:13.257232 IP 112.26.2.1.pmcd > 112.26.2.8.42095: Flags [.], seq 47125:48553, ack 1, win 4017, options [nop,nop,TS val 3214180 ecr 2992955,mptcp dss ack 724613416 seq 1583960970 subseq 47125 len 1428 csum 0xb747], length 1428
16:13:13.257469 IP 112.26.2.1.pmcd > 112.26.2.8.42095: Flags [.], seq 47125:48553, ack 1, win 4017, options [nop,nop,TS val 3214180 ecr 2992955,mptcp dss ack 724613416 seq 1583960970 subseq 47125 len 1428 csum 0xb747], length 1428
16:13:13.301718 IP 112.26.2.8.42095 > 112.26.2.1.pmcd: Flags [.], ack 37129, win 13004, options [nop,nop,TS val 2993280 ecr 3213569,mptcp dss ack 1583786754], length 0
16:13:13.321020 IP 112.26.2.1.pmcd > 112.26.2.8.42095: Flags [.], seq 41413:42841, ack 1, win 4017, options [nop,nop,TS val 3213802 ecr 2992570,mptcp dss ack 724613416 seq 1583946690 subseq 41413 len 1428 csum 0xed9b], length 1428
16:13:13.354404 IP 112.26.2.1.pmcd > 112.26.2.8.42095: Flags [.], seq 48553:49981, ack 1, win 4017, options [nop,nop,TS val 3214180 ecr 2992955,mptcp dss ack 724613416 seq 1583962398 subseq 48553 len 1428 csum 0x35d4], length 1428
16:13:13.354750 IP 112.26.2.1.pmcd > 112.26.2.8.42095: Flags [.], seq 48553:49981, ack 1, win 4017, options [nop,nop,TS val 3214180 ecr 2992955,mptcp dss ack 724613416 seq 1583962398 subseq 48553 len 1428 csum 0x35d4], length 1428
16:13:13.440801 IP 112.26.2.1.pmcd > 112.26.2.8.42095: Flags [.], seq 42841:44269, ack 1, win 4017, options [nop,nop,TS val 3213924 ecr 2992688,mptcp dss ack 724613416 seq 1583949546 subseq 42841 len 1428 csum 0xe72e], length 1428
16:13:13.502677 IP 112.26.2.1.pmcd > 112.26.2.8.42095: Flags [.], seq 49981:51409, ack 1, win 4017, options [nop,nop,TS val 3214419 ecr 2993138,mptcp dss ack 724613416 seq 1583969538 subseq 49981 len 1428 csum 0xd209], length 1428
16:13:13.502943 IP 112.26.2.1.pmcd > 112.26.2.8.42095: Flags [.], seq 49981:51409, ack 1, win 4017, options [nop,nop,TS val 3214419 ecr 2993138,mptcp dss ack 724613416 seq 1583969538 subseq 49981 len 1428 csum 0xd209], length 1428
16:13:13.619742 IP 112.26.2.1.pmcd > 112.26.2.8.42095: Flags [.], seq 51409:52837, ack 1, win 4017, options [nop,nop,TS val 3214648 ecr 2993280,mptcp dss ack 724613416 seq 1583976678 subseq 51409 len 1428 csum 0x7572], length 1428
16:13:13.620011 IP 112.26.2.1.pmcd > 112.26.2.8.42095: Flags [.], seq 51409:52837, ack 1, win 4017, options [nop,nop,TS val 3214648 ecr 2993280,mptcp dss ack 724613416 seq 1583976678 subseq 51409 len 1428 csum 0x7572], length 1428
16:13:13.661030 IP 112.26.2.1.pmcd > 112.26.2.8.42095: Flags [.], seq 44269:45697, ack 1, win 4017, options [nop,nop,TS val 3213924 ecr 2992688,mptcp dss ack 724613416 seq 1583950974 subseq 44269 len 1428 csum 0xa5a9], length 1428
16:13:13.698578 IP 112.26.2.8.42095 > 112.26.2.1.pmcd: Flags [.], ack 38557, win 13460, options [nop,nop,TS val 2993632 ecr 3213569,nop,nop,sack 1 {41413:42841},mptcp dss ack 1583786754], length 0
16:13:13.805320 IP 112.26.2.1.pmcd > 112.26.2.8.42095: Flags [.], seq 47125:48553, ack 1, win 4017, options [nop,nop,TS val 3214180 ecr 2992955,mptcp dss ack 724613416 seq 1583960970 subseq 47125 len 1428 csum 0xb747], length 1428
16:13:13.835786 IP 112.26.2.1.pmcd > 112.26.2.8.42095: Flags [.], seq 52837:54265, ack 1, win 4017, options [nop,nop,TS val 3215044 ecr 2993632,mptcp dss ack 724613416 seq 1583989530 subseq 52837 len 1428 csum 0x934d], length 1428
16:13:13.836054 IP 112.26.2.1.pmcd > 112.26.2.8.42095: Flags [.], seq 52837:54265, ack 1, win 4017, options [nop,nop,TS val 3215044 ecr 2993632,mptcp dss ack 724613416 seq 1583989530 subseq 52837 len 1428 csum 0x934d], length 1428
16:13:13.966588 IP 112.26.2.1.pmcd > 112.26.2.8.42095: Flags [.], seq 54265:55693, ack 1, win 4017, options [nop,nop,TS val 3215044 ecr 2993632,mptcp dss ack 724613416 seq 1583990958 subseq 54265 len 1428 csum 0xc8a3], length 1428
16:13:13.966868 IP 112.26.2.1.pmcd > 112.26.2.8.42095: Flags [.], seq 54265:55693, ack 1, win 4017, options [nop,nop,TS val 3215044 ecr 2993632,mptcp dss ack 724613416 seq 1583990958 subseq 54265 len 1428 csum 0xc8a3], length 1428
16:13:14.036128 IP 112.26.2.1.pmcd > 112.26.2.8.42095: Flags [.], seq 49981:51409, ack 1, win 4017, options [nop,nop,TS val 3214419 ecr 2993138,mptcp dss ack 724613416 seq 1583969538 subseq 49981 len 1428 csum 0xd209], length 1428
16:13:14.101256 IP 112.26.2.1.pmcd > 112.26.2.8.42095: Flags [.], seq 55693:57121, ack 1, win 4017, options [nop,nop,TS val 3215044 ecr 2993632,mptcp dss ack 724613416 seq 1583992386 subseq 55693 len 1428 csum 0x67b3], length 1428
16:13:14.101547 IP 112.26.2.1.pmcd > 112.26.2.8.42095: Flags [.], seq 55693:57121, ack 1, win 4017, options [nop,nop,TS val 3215044 ecr 2993632,mptcp dss ack 724613416 seq 1583992386 subseq 55693 len 1428 csum 0x67b3], length 1428
16:13:14.155799 IP 112.26.2.8.42095 > 112.26.2.1.pmcd: Flags [.], ack 38557, win 14007, options [nop,nop,TS val 2994109 ecr 3213569,nop,nop,sack 1 {41413:45697},mptcp dss ack 1583789610], length 0
16:13:14.199671 IP 112.26.2.1.pmcd > 112.26.2.8.42095: Flags [.], seq 51409:52837, ack 1, win 4017, options [nop,nop,TS val 3214648 ecr 2993280,mptcp dss ack 724613416 seq 1583976678 subseq 51409 len 1428 csum 0x7572], length 1428
16:13:14.264263 IP 112.26.2.1.pmcd > 112.26.2.8.42095: Flags [.], seq 38557:39985, ack 1, win 4017, options [nop,nop,TS val 3215502 ecr 2994109,mptcp dss ack 724613416 seq 1583935266 subseq 38557 len 1428 csum 0x95fb], length 1428
16:13:14.264557 IP 112.26.2.1.pmcd > 112.26.2.8.42095: Flags [.], seq 38557:39985, ack 1, win 4017, options [nop,nop,TS val 3215502 ecr 2994109,mptcp dss ack 724613416 seq 1583935266 subseq 38557 len 1428 csum 0x95fb], length 1428
16:13:14.318836 IP 112.26.2.8.42095 > 112.26.2.1.pmcd: Flags [.], ack 38557, win 14144, options [nop,nop,TS val 2994253 ecr 3213569,nop,nop,sack 2 {47125:48553}{41413:45697},mptcp dss ack 1583789610], length 0
16:13:14.389313 IP 112.26.2.1.pmcd > 112.26.2.8.42095: Flags [.], seq 39985:41413, ack 1, win 4017, options [nop,nop,TS val 3215665 ecr 2994253,mptcp dss ack 724613416 seq 1583936694 subseq 39985 len 1428 csum 0xdd55], length 1428
16:13:14.389600 IP 112.26.2.1.pmcd > 112.26.2.8.42095: Flags [.], seq 39985:41413, ack 1, win 4017, options [nop,nop,TS val 3215665 ecr 2994253,mptcp dss ack 724613416 seq 1583936694 subseq 39985 len 1428 csum 0xdd55], length 1428
16:13:14.397795 IP 112.26.2.1.pmcd > 112.26.2.8.42095: Flags [.], seq 52837:54265, ack 1, win 4017, options [nop,nop,TS val 3215044 ecr 2993632,mptcp dss ack 724613416 seq 1583989530 subseq 52837 len 1428 csum 0x934d], length 1428
16:13:14.491571 IP 112.26.2.1.pmcd > 112.26.2.8.42095: Flags [.], seq 54265:55693, ack 1, win 4017, options [nop,nop,TS val 3215044 ecr 2993632,mptcp dss ack 724613416 seq 1583990958 subseq 54265 len 1428 csum 0xc8a3], length 1428
16:13:14.587156 IP 112.26.2.8.42095 > 112.26.2.1.pmcd: Flags [.], ack 38557, win 14555, options [nop,nop,TS val 2994648 ecr 3213569,nop,nop,sack 2 {49981:52837}{47125:48553},mptcp dss ack 1583858154], length 0
16:13:14.597642 IP 112.26.2.1.pmcd > 112.26.2.8.42095: Flags [.], seq 45697:47125, ack 1, win 4017, options [nop,nop,TS val 3215933 ecr 2994648,mptcp dss ack 724613416 seq 1583955258 subseq 45697 len 1428 csum 0xea4], length 1428
16:13:14.597917 IP 112.26.2.1.pmcd > 112.26.2.8.42095: Flags [.], seq 45697:47125, ack 1, win 4017, options [nop,nop,TS val 3215933 ecr 2994648,mptcp dss ack 724613416 seq 1583955258 subseq 45697 len 1428 csum 0xea4], length 1428
16:13:14.649978 IP 112.26.2.1.pmcd > 112.26.2.8.42095: Flags [.], seq 38557:39985, ack 1, win 4017, options [nop,nop,TS val 3215502 ecr 2994109,mptcp dss ack 724613416 seq 1583935266 subseq 38557 len 1428 csum 0x95fb], length 1428
16:13:14.677186 IP 112.26.2.1.pmcd > 112.26.2.8.42095: Flags [.], seq 48553:49981, ack 1, win 4017, options [nop,nop,TS val 3215933 ecr 2994648,mptcp dss ack 724613416 seq 1583962398 subseq 48553 len 1428 csum 0x35d4], length 1428
16:13:14.677458 IP 112.26.2.1.pmcd > 112.26.2.8.42095: Flags [.], seq 48553:49981, ack 1, win 4017, options [nop,nop,TS val 3215933 ecr 2994648,mptcp dss ack 724613416 seq 1583962398 subseq 48553 len 1428 csum 0x35d4], length 1428
16:13:14.804538 IP 112.26.2.1.pmcd > 112.26.2.8.42095: Flags [.], seq 39985:41413, ack 1, win 4017, options [nop,nop,TS val 3215665 ecr 2994253,mptcp dss ack 724613416 seq 1583936694 subseq 39985 len 1428 csum 0xdd55], length 1428
16:13:14.882610 IP 112.26.2.8.42095 > 112.26.2.1.pmcd: Flags [.], ack 38557, win 14920, options [nop,nop,TS val 2994940 ecr 3213569,nop,nop,sack 2 {49981:55693}{47125:48553},mptcp dss ack 1583935266], length 0
16:13:14.960698 IP 112.26.2.1.pmcd > 112.26.2.8.42095: Flags [.], seq 45697:47125, ack 1, win 4017, options [nop,nop,TS val 3215933 ecr 2994648,mptcp dss ack 724613416 seq 1583955258 subseq 45697 len 1428 csum 0xea4], length 1428
16:13:15.049109 IP 112.26.2.8.42095 > 112.26.2.1.pmcd: Flags [.], ack 39985, win 15057, options [nop,nop,TS val 2995098 ecr 3215502,nop,nop,sack 2 {49981:55693}{47125:48553},mptcp dss ack 1583936694], length 0
16:13:15.058405 IP 112.26.2.1.pmcd > 112.26.2.8.42095: Flags [.], seq 57121:58549, ack 1, win 4017, options [nop,nop,TS val 3216305 ecr 2994940,mptcp dss ack 724613416 seq 1584023802 subseq 57121 len 1428 csum 0x65e6], length 1428
16:13:15.058720 IP 112.26.2.1.pmcd > 112.26.2.8.42095: Flags [.], seq 57121:58549, ack 1, win 4017, options [nop,nop,TS val 3216305 ecr 2994940,mptcp dss ack 724613416 seq 1584023802 subseq 57121 len 1428 csum 0x65e6], length 1428
16:13:15.091777 IP 112.26.2.1.pmcd > 112.26.2.8.42095: Flags [.], seq 58549:59977, ack 1, win 4017, options [nop,nop,TS val 3216305 ecr 2994940,mptcp dss ack 724613416 seq 1584025230 subseq 58549 len 1428 csum 0xd3ee], length 1428
16:13:15.092029 IP 112.26.2.1.pmcd > 112.26.2.8.42095: Flags [.], seq 58549:59977, ack 1, win 4017, options [nop,nop,TS val 3216305 ecr 2994940,mptcp dss ack 724613416 seq 1584025230 subseq 58549 len 1428 csum 0xd3ee], length 1428
16:13:15.155788 IP 112.26.2.1.pmcd > 112.26.2.8.42095: Flags [.], seq 48553:49981, ack 1, win 4017, options [nop,nop,TS val 3215933 ecr 2994648,mptcp dss ack 724613416 seq 1583962398 subseq 48553 len 1428 csum 0x35d4], length 1428
16:13:15.220279 IP 112.26.2.1.pmcd > 112.26.2.8.42095: Flags [.], seq 55693:57121, ack 1, win 4017, options [nop,nop,TS val 3216395 ecr 2995098,mptcp dss ack 724613416 seq 1583992386 subseq 55693 len 1428 csum 0x67b3], length 1428
