16:13:07.939584 IP 112.26.3.8.42683 > 112.26.3.1.pmcd: Flags [S], seq 3403799646, win 65535, options [mss 1460,sackOK,TS val 2988377 ecr 0,nop,wscale 6,mptcp join id 5 token 0x6673cfeb nonce 0xa83f5246], length 0
16:13:07.946283 IP 112.26.3.8.42683 > 112.26.3.1.pmcd: Flags [S], seq 3403799646, win 65535, options [mss 1460,sackOK,TS val 2988377 ecr 0,nop,wscale 6,mptcp join id 5 token 0x6673cfeb nonce 0xa83f5246], length 0
16:13:07.965688 IP 112.26.3.8.42683 > 112.26.3.1.pmcd: Flags [S], seq 3403799646, win 65535, options [mss 1460,sackOK,TS val 2988377 ecr 0,nop,wscale 6,mptcp join id 5 token 0x6673cfeb nonce 0xa83f5246], length 0
16:13:08.102147 IP 112.26.3.1.pmcd > 112.26.3.8.42683: Flags [S.], seq 1927846746, ack 3403799647, win 65535, options [mss 1460,sackOK,TS val 3209299 ecr 2988377,nop,wscale 6,mptcp join id 5 hmac 0x57d5cf31bbbc5946 nonce 0xb27e1efe], length 0
16:13:08.115364 IP 112.26.3.1.pmcd > 112.26.3.8.42683: Flags [S.], seq 1927846746, ack 3403799647, win 65535, options [mss 1460,sackOK,TS val 3209299 ecr 2988377,nop,wscale 6,mptcp join id 5 hmac 0x57d5cf31bbbc5946 nonce 0xb27e1efe], length 0
16:13:08.129100 IP 112.26.3.8.42683 > 112.26.3.1.pmcd: Flags [.], ack 1, win 7665, options [nop,nop,TS val 2988564 ecr 3209299,mptcp join hmac 0x7f6eeba21ca3137dfcd4e1f0019ab1c7de450e57], length 0
16:13:08.207963 IP 112.26.3.8.42683 > 112.26.3.1.pmcd: Flags [.], ack 1, win 7665, options [nop,nop,TS val 2988564 ecr 3209299,mptcp join hmac 0x7f6eeba21ca3137dfcd4e1f0019ab1c7de450e57], length 0
16:13:08.213835 IP 112.26.3.8.42683 > 112.26.3.1.pmcd: Flags [.], ack 1, win 7665, options [nop,nop,TS val 2988564 ecr 3209299,mptcp join hmac 0x7f6eeba21ca3137dfcd4e1f0019ab1c7de450e57], length 0
16:13:08.418801 IP 112.26.3.1.pmcd > 112.26.3.8.42683: Flags [.], ack 1, win 4017, options [nop,nop,TS val 3209560 ecr 2988564,mptcp dss ack 724613416], length 0
16:13:08.420076 IP 112.26.3.1.pmcd > 112.26.3.8.42683: Flags [.], ack 1, win 4017, options [nop,nop,TS val 3209560 ecr 2988564,mptcp dss ack 724613416], length 0
16:13:08.548741 IP 112.26.3.1.pmcd > 112.26.3.8.42683: Flags [.], seq 1:1429, ack 1, win 4017, options [nop,nop,TS val 3209560 ecr 2988564,mptcp dss ack 724613416 seq 1583779614 subseq 1 len 1428 csum 0xc3e8], length 1428
16:13:08.566874 IP 112.26.3.1.pmcd > 112.26.3.8.42683: Flags [.], seq 1:1429, ack 1, win 4017, options [nop,nop,TS val 3209560 ecr 2988564,mptcp dss ack 724613416 seq 1583779614 subseq 1 len 1428 csum 0xc3e8], length 1428
16:13:08.568734 IP 112.26.3.8.42683 > 112.26.3.1.pmcd: Flags [.], ack 1429, win 7985, options [nop,nop,TS val 2989015 ecr 3209560,mptcp dss ack 1583756766], length 0
16:13:08.715894 IP 112.26.3.8.42683 > 112.26.3.1.pmcd: Flags [.], ack 1429, win 7985, options [nop,nop,TS val 2989015 ecr 3209560,mptcp dss ack 1583756766], length 0
16:13:09.171246 IP 112.26.3.1.pmcd > 112.26.3.8.42683: Flags [.], seq 4285:5713, ack 1, win 4017, options [nop,nop,TS val 3209561 ecr 2988564,mptcp dss ack 724613416 seq 1583783898 subseq 4285 len 1428 csum 0xb254], length 1428
16:13:09.184048 IP 112.26.3.1.pmcd > 112.26.3.8.42683: Flags [.], seq 4285:5713, ack 1, win 4017, options [nop,nop,TS val 3209561 ecr 2988564,mptcp dss ack 724613416 seq 1583783898 subseq 4285 len 1428 csum 0xb254], length 1428
16:13:09.196533 IP 112.26.3.8.42683 > 112.26.3.1.pmcd: Flags [.], ack 1429, win 8532, options [nop,nop,TS val 2989633 ecr 3209560,nop,nop,sack 1 {4285:5713},mptcp dss ack 1583763906], length 0
16:13:09.254156 IP 112.26.3.8.42683 > 112.26.3.1.pmcd: Flags [.], ack 1429, win 8532, options [nop,nop,TS val 2989633 ecr 3209560,nop,nop,sack 1 {4285:5713},mptcp dss ack 1583763906], length 0
16:13:09.399361 IP 112.26.3.1.pmcd > 112.26.3.8.42683: Flags [.], seq 12853:14281, ack 1, win 4017, options [nop,nop,TS val 3210112 ecr 2988564,mptcp dss ack 724613416 seq 1583792466 subseq 12853 len 1428 csum 0xf6b], length 1428
16:13:09.417948 IP 112.26.3.1.pmcd > 112.26.3.8.42683: Flags [.], seq 12853:14281, ack 1, win 4017, options [nop,nop,TS val 3210112 ecr 2988564,mptcp dss ack 724613416 seq 1583792466 subseq 12853 len 1428 csum 0xf6b], length 1428
16:13:09.596415 IP 112.26.3.8.42683 > 112.26.3.1.pmcd: Flags [.], ack 1429, win 8532, options [nop,nop,TS val 2989633 ecr 3209560,nop,nop,sack 1 {4285:5713},mptcp dss ack 1583763906], length 0
16:13:09.856317 IP 112.26.3.1.pmcd > 112.26.3.8.42683: Flags [.], seq 14281:15709, ack 1, win 4017, options [nop,nop,TS val 3210942 ecr 2989633,mptcp dss ack 724613416 seq 1583855298 subseq 14281 len 1428 csum 0xc15d], length 1428
16:13:09.867084 IP 112.26.3.1.pmcd > 112.26.3.8.42683: Flags [.], seq 14281:15709, ack 1, win 4017, options [nop,nop,TS val 3210942 ecr 2989633,mptcp dss ack 724613416 seq 1583855298 subseq 14281 len 1428 csum 0xc15d], length 1428
16:13:09.869679 IP 112.26.3.8.42683 > 112.26.3.1.pmcd: Flags [.], ack 1429, win 9308, options [nop,nop,TS val 2990316 ecr 3209560,nop,nop,sack 2 {12853:15709}{4285:5713},mptcp dss ack 1583763906], length 0
16:13:09.903293 IP 112.26.3.8.42683 > 112.26.3.1.pmcd: Flags [.], ack 1429, win 9308, options [nop,nop,TS val 2990316 ecr 3209560,nop,nop,sack 2 {12853:15709}{4285:5713},mptcp dss ack 1583763906], length 0
16:13:10.208320 IP 112.26.3.1.pmcd > 112.26.3.8.42683: Flags [.], seq 15709:17137, ack 1, win 4017, options [nop,nop,TS val 3210942 ecr 2989633,mptcp dss ack 724613416 seq 1583856726 subseq 15709 len 1428 csum 0x9ea8], length 1428
16:13:10.221518 IP 112.26.3.1.pmcd > 112.26.3.8.42683: Flags [.], seq 15709:17137, ack 1, win 4017, options [nop,nop,TS val 3210942 ecr 2989633,mptcp dss ack 724613416 seq 1583856726 subseq 15709 len 1428 csum 0x9ea8], length 1428
16:13:10.236061 IP 112.26.3.8.42683 > 112.26.3.1.pmcd: Flags [.], ack 1429, win 9764, options [nop,nop,TS val 2990670 ecr 3209560,nop,nop,sack 2 {12853:17137}{4285:5713},mptcp dss ack 1583765334], length 0
16:13:10.237472 IP 112.26.3.8.42683 > 112.26.3.1.pmcd: Flags [.], ack 1429, win 9764, options [nop,nop,TS val 2990670 ecr 3209560,nop,nop,sack 2 {12853:17137}{4285:5713},mptcp dss ack 1583765334], length 0
16:13:10.406312 IP 112.26.3.8.42683 > 112.26.3.1.pmcd: Flags [.], ack 1429, win 9308, options [nop,nop,TS val 2990316 ecr 3209560,nop,nop,sack 2 {12853:15709}{4285:5713},mptcp dss ack 1583763906], length 0
16:13:10.530251 IP 112.26.3.1.pmcd > 112.26.3.8.42683: Flags [.], seq 18565:19993, ack 1, win 4017, options [nop,nop,TS val 3210942 ecr 2989633,mptcp dss ack 724613416 seq 1583859582 subseq 18565 len 1428 csum 0x4088], length 1428
16:13:10.568576 IP 112.26.3.1.pmcd > 112.26.3.8.42683: Flags [.], seq 18565:19993, ack 1, win 4017, options [nop,nop,TS val 3210942 ecr 2989633,mptcp dss ack 724613416 seq 1583859582 subseq 18565 len 1428 csum 0x4088], length 1428
16:13:10.570771 IP 112.26.3.8.42683 > 112.26.3.1.pmcd: Flags [.], ack 1429, win 10175, options [nop,nop,TS val 2991002 ecr 3209560,nop,nop,sack 2 {18565:19993}{12853:17137},mptcp dss ack 1583766762], length 0
16:13:10.610108 IP 112.26.3.8.42683 > 112.26.3.1.pmcd: Flags [.], ack 1429, win 10175, options [nop,nop,TS val 2991002 ecr 3209560,nop,nop,sack 2 {18565:19993}{12853:17137},mptcp dss ack 1583766762], length 0
16:13:10.842984 IP 112.26.3.1.pmcd > 112.26.3.8.42683: Flags [.], seq 1429:2857, ack 1, win 4017, options [nop,nop,TS val 3211752 ecr 2990316,mptcp dss ack 724613416 seq 1583781042 subseq 1429 len 1428 csum 0x7f10], length 1428
16:13:10.862968 IP 112.26.3.1.pmcd > 112.26.3.8.42683: Flags [.], seq 1429:2857, ack 1, win 4017, options [nop,nop,TS val 3211752 ecr 2990316,mptcp dss ack 724613416 seq 1583781042 subseq 1429 len 1428 csum 0x7f10], length 1428
16:13:10.930117 IP 112.26.3.8.42683 > 112.26.3.1.pmcd: Flags [.], ack 2857, win 10540, options [nop,nop,TS val 2991311 ecr 3211752,nop,nop,sack 2 {18565:19993}{12853:17137},mptcp dss ack 1583766762], length 0
16:13:11.004827 IP 112.26.3.8.42683 > 112.26.3.1.pmcd: Flags [.], ack 2857, win 10540, options [nop,nop,TS val 2991311 ecr 3211752,nop,nop,sack 2 {18565:19993}{12853:17137},mptcp dss ack 1583766762], length 0
16:13:11.084165 IP 112.26.3.1.pmcd > 112.26.3.8.42683: Flags [.], seq 2857:4285, ack 1, win 4017, options [nop,nop,TS val 3211752 ecr 2990316,mptcp dss ack 724613416 seq 1583782470 subseq 2857 len 1428 csum 0xf8d9], length 1428
16:13:11.092020 IP 112.26.3.1.pmcd > 112.26.3.8.42683: Flags [.], seq 2857:4285, ack 1, win 4017, options [nop,nop,TS val 3211752 ecr 2990316,mptcp dss ack 724613416 seq 1583782470 subseq 2857 len 1428 csum 0xf8d9], length 1428
16:13:11.094014 IP 112.26.3.8.42683 > 112.26.3.1.pmcd: Flags [.], ack 5713, win 10814, options [nop,nop,TS val 2991540 ecr 3211752,nop,nop,sack 2 {18565:19993}{12853:17137},mptcp dss ack 1583766762], length 0
16:13:11.120940 IP 112.26.3.8.42683 > 112.26.3.1.pmcd: Flags [.], ack 5713, win 10814, options [nop,nop,TS val 2991540 ecr 3211752,nop,nop,sack 2 {18565:19993}{12853:17137},mptcp dss ack 1583766762], length 0
16:13:11.272676 IP 112.26.3.8.42683 > 112.26.3.1.pmcd: Flags [.], ack 2857, win 10540, options [nop,nop,TS val 2991311 ecr 3211752,nop,nop,sack 2 {18565:19993}{12853:17137},mptcp dss ack 1583766762], length 0
16:13:11.398696 IP 112.26.3.8.42683 > 112.26.3.1.pmcd: Flags [.], ack 5713, win 10814, options [nop,nop,TS val 2991540 ecr 3211752,nop,nop,sack 2 {18565:19993}{12853:17137},mptcp dss ack 1583766762], length 0
16:13:11.604247 IP 112.26.3.1.pmcd > 112.26.3.8.42683: Flags [.], seq 5713:7141, ack 1, win 4017, options [nop,nop,TS val 3212619 ecr 2991311,mptcp dss ack 724613416 seq 1583785326 subseq 5713 len 1428 csum 0x1342], length 1428
16:13:11.615470 IP 112.26.3.1.pmcd > 112.26.3.8.42683: Flags [.], seq 5713:7141, ack 1, win 4017, options [nop,nop,TS val 3212619 ecr 2991311,mptcp dss ack 724613416 seq 1583785326 subseq 5713 len 1428 csum 0x1342], length 1428
16:13:11.616798 IP 112.26.3.8.42683 > 112.26.3.1.pmcd: Flags [.], ack 7141, win 11498, options [nop,nop,TS val 2992064 ecr 3212619,nop,nop,sack 2 {18565:19993}{12853:17137},mptcp dss ack 1583766762], length 0
16:13:11.944093 IP 112.26.3.1.pmcd > 112.26.3.8.42683: Flags [.], seq 8569:9997, ack 1, win 4017, options [nop,nop,TS val 3212619 ecr 2991311,mptcp dss ack 724613416 seq 1583788182 subseq 8569 len 1428 csum 0x3d28], length 1428
16:13:11.959000 IP 112.26.3.1.pmcd > 112.26.3.8.42683: Flags [.], seq 8569:9997, ack 1, win 4017, options [nop,nop,TS val 3212619 ecr 2991311,mptcp dss ack 724613416 seq 1583788182 subseq 8569 len 1428 csum 0x3d28], length 1428
16:13:12.011939 IP 112.26.3.8.42683 > 112.26.3.1.pmcd: Flags [.], ack 7141, win 12000, options [nop,nop,TS val 2992408 ecr 3212619,nop,nop,sack 2 {8569:9997}{18565:19993},mptcp dss ack 1583786754], length 0
16:13:12.060940 IP 112.26.3.8.42683 > 112.26.3.1.pmcd: Flags [.], ack 7141, win 12000, options [nop,nop,TS val 2992408 ecr 3212619,nop,nop,sack 2 {8569:9997}{18565:19993},mptcp dss ack 1583786754], length 0
16:13:12.237180 IP 112.26.3.1.pmcd > 112.26.3.8.42683: Flags [.], seq 11425:12853, ack 1, win 4017, options [nop,nop,TS val 3212745 ecr 2991540,mptcp dss ack 724613416 seq 1583791038 subseq 11425 len 1428 csum 0x228f], length 1428
16:13:12.255811 IP 112.26.3.1.pmcd > 112.26.3.8.42683: Flags [.], seq 11425:12853, ack 1, win 4017, options [nop,nop,TS val 3212745 ecr 2991540,mptcp dss ack 724613416 seq 1583791038 subseq 11425 len 1428 csum 0x228f], length 1428
16:13:12.332669 IP 112.26.3.8.42683 > 112.26.3.1.pmcd: Flags [.], ack 7141, win 12365, options [nop,nop,TS val 2992704 ecr 3212619,nop,nop,sack 2 {11425:17137}{8569:9997},mptcp dss ack 1583786754], length 0
16:13:12.335506 IP 112.26.3.8.42683 > 112.26.3.1.pmcd: Flags [.], ack 7141, win 12365, options [nop,nop,TS val 2992704 ecr 3212619,nop,nop,sack 2 {11425:17137}{8569:9997},mptcp dss ack 1583786754], length 0
16:13:12.452161 IP 112.26.3.8.42683 > 112.26.3.1.pmcd: Flags [.], ack 7141, win 12000, options [nop,nop,TS val 2992408 ecr 3212619,nop,nop,sack 2 {8569:9997}{18565:19993},mptcp dss ack 1583786754], length 0
16:13:12.556096 IP 112.26.3.8.42683 > 112.26.3.1.pmcd: Flags [.], ack 7141, win 12365, options [nop,nop,TS val 2992704 ecr 3212619,nop,nop,sack 2 {11425:17137}{8569:9997},mptcp dss ack 1583786754], length 0
16:13:12.913397 IP 112.26.3.1.pmcd > 112.26.3.8.42683: Flags [.], seq 19993:21421, ack 1, win 4017, options [nop,nop,TS val 3213798 ecr 2992408,mptcp dss ack 724613416 seq 1583942406 subseq 19993 len 1428 csum 0x1382], length 1428
16:13:12.927727 IP 112.26.3.8.42683 > 112.26.3.1.pmcd: Flags [.], ack 7141, win 13140, options [nop,nop,TS val 2993374 ecr 3212619,nop,nop,sack 2 {18565:21421}{11425:17137},mptcp dss ack 1583786754], length 0
16:13:12.942835 IP 112.26.3.1.pmcd > 112.26.3.8.42683: Flags [.], seq 19993:21421, ack 1, win 4017, options [nop,nop,TS val 3213798 ecr 2992408,mptcp dss ack 724613416 seq 1583942406 subseq 19993 len 1428 csum 0x1382], length 1428
16:13:13.111117 IP 112.26.3.1.pmcd > 112.26.3.8.42683: Flags [.], seq 21421:22849, ack 1, win 4017, options [nop,nop,TS val 3213798 ecr 2992408,mptcp dss ack 724613416 seq 1583943834 subseq 21421 len 1428 csum 0x6f9e], length 1428
16:13:13.156413 IP 112.26.3.1.pmcd > 112.26.3.8.42683: Flags [.], seq 21421:22849, ack 1, win 4017, options [nop,nop,TS val 3213798 ecr 2992408,mptcp dss ack 724613416 seq 1583943834 subseq 21421 len 1428 csum 0x6f9e], length 1428
16:13:13.158892 IP 112.26.3.8.42683 > 112.26.3.1.pmcd: Flags [.], ack 7141, win 13414, options [nop,nop,TS val 2993605 ecr 3212619,nop,nop,sack 2 {18565:22849}{11425:17137},mptcp dss ack 1583786754], length 0
16:13:13.181033 IP 112.26.3.8.42683 > 112.26.3.1.pmcd: Flags [.], ack 7141, win 13414, options [nop,nop,TS val 2993605 ecr 3212619,nop,nop,sack 2 {18565:22849}{11425:17137},mptcp dss ack 1583786754], length 0
16:13:13.338434 IP 112.26.3.1.pmcd > 112.26.3.8.42683: Flags [.], seq 7141:8569, ack 1, win 4017, options [nop,nop,TS val 3213902 ecr 2992704,mptcp dss ack 724613416 seq 1583786754 subseq 7141 len 1428 csum 0xa54f], length 1428
16:13:13.512550 IP 112.26.3.1.pmcd > 112.26.3.8.42683: Flags [.], seq 7141:8569, ack 1, win 4017, options [nop,nop,TS val 3213902 ecr 2992704,mptcp dss ack 724613416 seq 1583786754 subseq 7141 len 1428 csum 0xa54f], length 1428
16:13:13.523345 IP 112.26.3.8.42683 > 112.26.3.1.pmcd: Flags [.], ack 9997, win 13870, options [nop,nop,TS val 2993961 ecr 3213902,nop,nop,sack 2 {18565:22849}{11425:17137},mptcp dss ack 1583789610], length 0
16:13:13.524573 IP 112.26.3.8.42683 > 112.26.3.1.pmcd: Flags [.], ack 9997, win 13870, options [nop,nop,TS val 2993961 ecr 3213902,nop,nop,sack 2 {18565:22849}{11425:17137},mptcp dss ack 1583789610], length 0
16:13:13.684385 IP 112.26.3.8.42683 > 112.26.3.1.pmcd: Flags [.], ack 7141, win 13414, options [nop,nop,TS val 2993605 ecr 3212619,nop,nop,sack 2 {18565:22849}{11425:17137},mptcp dss ack 1583786754], length 0
16:13:13.936120 IP 112.26.3.8.42683 > 112.26.3.1.pmcd: Flags [.], ack 9997, win 13870, options [nop,nop,TS val 2993961 ecr 3213902,nop,nop,sack 2 {18565:22849}{11425:17137},mptcp dss ack 1583789610], length 0
16:13:14.072978 IP 112.26.3.1.pmcd > 112.26.3.8.42683: Flags [.], seq 9997:11425, ack 1, win 4017, options [nop,nop,TS val 3215030 ecr 2993605,mptcp dss ack 724613416 seq 1583789610 subseq 9997 len 1428 csum 0xbcdd], length 1428
16:13:14.098452 IP 112.26.3.1.pmcd > 112.26.3.8.42683: Flags [.], seq 9997:11425, ack 1, win 4017, options [nop,nop,TS val 3215030 ecr 2993605,mptcp dss ack 724613416 seq 1583789610 subseq 9997 len 1428 csum 0xbcdd], length 1428
16:13:14.102361 IP 112.26.3.8.42683 > 112.26.3.1.pmcd: Flags [.], ack 17137, win 14372, options [nop,nop,TS val 2994533 ecr 3215030,nop,nop,sack 1 {18565:22849},mptcp dss ack 1583858154], length 0
16:13:14.104134 IP 112.26.3.8.42683 > 112.26.3.1.pmcd: Flags [.], ack 17137, win 14372, options [nop,nop,TS val 2994533 ecr 3215030,nop,nop,sack 1 {18565:22849},mptcp dss ack 1583858154], length 0
16:13:14.359483 IP 112.26.3.1.pmcd > 112.26.3.8.42683: Flags [.], seq 17137:18565, ack 1, win 4017, options [nop,nop,TS val 3215030 ecr 2993605,mptcp dss ack 724613416 seq 1583858154 subseq 17137 len 1428 csum 0x4086], length 1428
16:13:14.392617 IP 112.26.3.1.pmcd > 112.26.3.8.42683: Flags [.], seq 17137:18565, ack 1, win 4017, options [nop,nop,TS val 3215030 ecr 2993605,mptcp dss ack 724613416 seq 1583858154 subseq 17137 len 1428 csum 0x4086], length 1428
16:13:14.550605 IP 112.26.3.8.42683 > 112.26.3.1.pmcd: Flags [.], ack 17137, win 14372, options [nop,nop,TS val 2994533 ecr 3215030,nop,nop,sack 1 {18565:22849},mptcp dss ack 1583858154], length 0
16:13:14.868064 IP 112.26.3.1.pmcd > 112.26.3.8.42683: Flags [.], seq 25705:27133, ack 1, win 4017, options [nop,nop,TS val 3215897 ecr 2994533,mptcp dss ack 724613416 seq 1584019518 subseq 25705 len 1428 csum 0x95cc], length 1428
16:13:14.884894 IP 112.26.3.1.pmcd > 112.26.3.8.42683: Flags [.], seq 25705:27133, ack 1, win 4017, options [nop,nop,TS val 3215897 ecr 2994533,mptcp dss ack 724613416 seq 1584019518 subseq 25705 len 1428 csum 0x95cc], length 1428
16:13:15.041742 IP 112.26.3.1.pmcd > 112.26.3.8.42683: Flags [.], seq 27133:28561, ack 1, win 4017, options [nop,nop,TS val 3215897 ecr 2994533,mptcp dss ack 724613416 seq 1584020946 subseq 27133 len 1428 csum 0xbb18], length 1428
16:13:15.158906 IP 112.26.3.1.pmcd > 112.26.3.8.42683: Flags [.], seq 27133:28561, ack 1, win 4017, options [nop,nop,TS val 3215897 ecr 2994533,mptcp dss ack 724613416 seq 1584020946 subseq 27133 len 1428 csum 0xbb18], length 1428
16:13:15.160506 IP 112.26.3.8.42683 > 112.26.3.1.pmcd: Flags [.], ack 22849, win 15787, options [nop,nop,TS val 2995608 ecr 3215030,nop,nop,sack 1 {25705:28561},mptcp dss ack 1583945262], length 0
16:13:17.898880 IP 112.26.3.1.pmcd > 112.26.3.8.42683: Flags [.], seq 17137:18565, ack 1, win 4017, options [nop,nop,TS val 3219200 ecr 2994533,mptcp dss ack 724613416 seq 1583858154 subseq 17137 len 1428 csum 0x4086], length 1428
16:13:17.907455 IP 112.26.3.1.pmcd > 112.26.3.8.42683: Flags [.], seq 17137:18565, ack 1, win 4017, options [nop,nop,TS val 3219200 ecr 2994533,mptcp dss ack 724613416 seq 1583858154 subseq 17137 len 1428 csum 0x4086], length 1428
16:13:17.910009 IP 112.26.3.8.42683 > 112.26.3.1.pmcd: Flags [.], ack 22849, win 18889, options [nop,nop,TS val 2998356 ecr 3215030,nop,nop,sack 2 {17137:18565}{25705:28561},mptcp dss ack 1583945262], length 0
16:13:17.926625 IP 112.26.3.8.42683 > 112.26.3.1.pmcd: Flags [.], ack 22849, win 18889, options [nop,nop,TS val 2998356 ecr 3215030,nop,nop,sack 2 {17137:18565}{25705:28561},mptcp dss ack 1583945262], length 0
16:13:18.109155 IP 112.26.3.8.42683 > 112.26.3.1.pmcd: Flags [.], ack 22849, win 18889, options [nop,nop,TS val 2998356 ecr 3215030,nop,nop,sack 2 {17137:18565}{25705:28561},mptcp dss ack 1583945262], length 0
16:13:18.217758 IP 112.26.3.1.pmcd > 112.26.3.8.42683: Flags [.], seq 22849:24277, ack 1, win 4017, options [nop,nop,TS val 3219455 ecr 2998356,mptcp dss ack 724613416 seq 1583945262 subseq 22849 len 1428 csum 0x1240], length 1428
16:13:18.224561 IP 112.26.3.1.pmcd > 112.26.3.8.42683: Flags [.], seq 22849:24277, ack 1, win 4017, options [nop,nop,TS val 3219455 ecr 2998356,mptcp dss ack 724613416 seq 1583945262 subseq 22849 len 1428 csum 0x1240], length 1428
16:13:18.227356 IP 112.26.3.8.42683 > 112.26.3.1.pmcd: Flags [.], ack 24277, win 19391, options [nop,nop,TS val 2998673 ecr 3219455,nop,nop,sack 1 {25705:28561},mptcp dss ack 1584000954], length 0
16:13:18.229619 IP 112.26.3.8.42683 > 112.26.3.1.pmcd: Flags [.], ack 24277, win 19391, options [nop,nop,TS val 2998673 ecr 3219455,nop,nop,sack 1 {25705:28561},mptcp dss ack 1584000954], length 0
16:13:18.452207 IP 112.26.3.8.42683 > 112.26.3.1.pmcd: Flags [.], ack 24277, win 19391, options [nop,nop,TS val 2998673 ecr 3219455,nop,nop,sack 1 {25705:28561},mptcp dss ack 1584000954], length 0
16:13:18.517675 IP 112.26.3.1.pmcd > 112.26.3.8.42683: Flags [.], seq 24277:25705, ack 1, win 4017, options [nop,nop,TS val 3219455 ecr 2998356,mptcp dss ack 724613416 seq 1584000954 subseq 24277 len 1428 csum 0x261d], length 1428
16:13:18.530288 IP 112.26.3.1.pmcd > 112.26.3.8.42683: Flags [.], seq 24277:25705, ack 1, win 4017, options [nop,nop,TS val 3219455 ecr 2998356,mptcp dss ack 724613416 seq 1584000954 subseq 24277 len 1428 csum 0x261d], length 1428
16:13:18.621673 IP 112.26.3.8.42683 > 112.26.3.1.pmcd: Flags [.], ack 28561, win 19756, options [nop,nop,TS val 2998979 ecr 3219455,mptcp dss ack 1584092346], length 0
16:13:18.760954 IP 112.26.3.8.42683 > 112.26.3.1.pmcd: Flags [.], ack 28561, win 19756, options [nop,nop,TS val 2998979 ecr 3219455,mptcp dss ack 1584092346], length 0
16:13:18.924921 IP 112.26.3.1.pmcd > 112.26.3.8.42683: Flags [.], seq 28561:29989, ack 1, win 4017, options [nop,nop,TS val 3220106 ecr 2998979,mptcp dss ack 724613416 seq 1584153750 subseq 28561 len 1428 csum 0x5e84], length 1428
16:13:18.939236 IP 112.26.3.1.pmcd > 112.26.3.8.42683: Flags [.], seq 28561:29989, ack 1, win 4017, options [nop,nop,TS val 3220106 ecr 2998979,mptcp dss ack 724613416 seq 1584153750 subseq 28561 len 1428 csum 0x5e84], length 1428
16:13:18.960946 IP 112.26.3.8.42683 > 112.26.3.1.pmcd: Flags [.], ack 29989, win 20075, options [nop,nop,TS val 2999387 ecr 3220106,mptcp dss ack 1584130902], length 0
16:13:18.964922 IP 112.26.3.8.42683 > 112.26.3.1.pmcd: Flags [.], ack 29989, win 20075, options [nop,nop,TS val 2999387 ecr 3220106,mptcp dss ack 1584130902], length 0
16:13:19.255902 IP 112.26.3.1.pmcd > 112.26.3.8.42683: Flags [.], seq 29989:31417, ack 1, win 4017, options [nop,nop,TS val 3220106 ecr 2998979,mptcp dss ack 724613416 seq 1584155178 subseq 29989 len 1428 csum 0x174f], length 1428
16:13:19.264570 IP 112.26.3.1.pmcd > 112.26.3.8.42683: Flags [.], seq 29989:31417, ack 1, win 4017, options [nop,nop,TS val 3220106 ecr 2998979,mptcp dss ack 724613416 seq 1584155178 subseq 29989 len 1428 csum 0x174f], length 1428
16:13:19.268126 IP 112.26.3.8.42683 > 112.26.3.1.pmcd: Flags [.], ack 31417, win 20486, options [nop,nop,TS val 2999713 ecr 3220106,mptcp dss ack 1584130902], length 0
16:13:19.309461 IP 112.26.3.8.42683 > 112.26.3.1.pmcd: Flags [.], ack 31417, win 20486, options [nop,nop,TS val 2999713 ecr 3220106,mptcp dss ack 1584130902], length 0
16:13:19.407080 IP 112.26.3.8.42683 > 112.26.3.1.pmcd: Flags [.], ack 29989, win 20075, options [nop,nop,TS val 2999387 ecr 3220106,mptcp dss ack 1584130902], length 0
16:13:19.549327 IP 112.26.3.1.pmcd > 112.26.3.8.42683: Flags [.], seq 31417:32845, ack 1, win 4017, options [nop,nop,TS val 3220106 ecr 2998979,mptcp dss ack 724613416 seq 1584156606 subseq 31417 len 1428 csum 0x960b], length 1428
16:13:19.562537 IP 112.26.3.1.pmcd > 112.26.3.8.42683: Flags [.], seq 31417:32845, ack 1, win 4017, options [nop,nop,TS val 3220106 ecr 2998979,mptcp dss ack 724613416 seq 1584156606 subseq 31417 len 1428 csum 0x960b], length 1428
16:13:19.566064 IP 112.26.3.8.42683 > 112.26.3.1.pmcd: Flags [.], ack 32845, win 20760, options [nop,nop,TS val 3000011 ecr 3220106,mptcp dss ack 1584130902], length 0
16:13:19.580978 IP 112.26.3.8.42683 > 112.26.3.1.pmcd: Flags [.], ack 32845, win 20760, options [nop,nop,TS val 3000011 ecr 3220106,mptcp dss ack 1584130902], length 0
16:13:19.780838 IP 112.26.3.8.42683 > 112.26.3.1.pmcd: Flags [.], ack 31417, win 20486, options [nop,nop,TS val 2999713 ecr 3220106,mptcp dss ack 1584130902], length 0
16:13:19.908319 IP 112.26.3.1.pmcd > 112.26.3.8.42683: Flags [.], seq 38557:39985, ack 1, win 4017, options [nop,nop,TS val 3220752 ecr 2999387,mptcp dss ack 724613416 seq 1584183738 subseq 38557 len 1428 csum 0xd067], length 1428
16:13:19.923127 IP 112.26.3.8.42683 > 112.26.3.1.pmcd: Flags [.], ack 32845, win 21307, options [nop,nop,TS val 3000370 ecr 3220106,nop,nop,sack 1 {38557:39985},mptcp dss ack 1584130902], length 0
16:13:19.978168 IP 112.26.3.1.pmcd > 112.26.3.8.42683: Flags [.], seq 38557:39985, ack 1, win 4017, options [nop,nop,TS val 3220752 ecr 2999387,mptcp dss ack 724613416 seq 1584183738 subseq 38557 len 1428 csum 0xd067], length 1428
16:13:20.034203 IP 112.26.3.8.42683 > 112.26.3.1.pmcd: Flags [.], ack 32845, win 21307, options [nop,nop,TS val 3000370 ecr 3220106,nop,nop,sack 1 {38557:39985},mptcp dss ack 1584130902], length 0
16:13:20.118572 IP 112.26.3.1.pmcd > 112.26.3.8.42683: Flags [.], seq 39985:41413, ack 1, win 4017, options [nop,nop,TS val 3220752 ecr 2999387,mptcp dss ack 724613416 seq 1584185166 subseq 39985 len 1428 csum 0xa8e6], length 1428
16:13:20.136356 IP 112.26.3.1.pmcd > 112.26.3.8.42683: Flags [.], seq 39985:41413, ack 1, win 4017, options [nop,nop,TS val 3220752 ecr 2999387,mptcp dss ack 724613416 seq 1584185166 subseq 39985 len 1428 csum 0xa8e6], length 1428
16:13:20.142100 IP 112.26.3.8.42683 > 112.26.3.1.pmcd: Flags [.], ack 32845, win 21581, options [nop,nop,TS val 3000585 ecr 3220106,nop,nop,sack 1 {38557:41413},mptcp dss ack 1584130902], length 0
16:13:20.190792 IP 112.26.3.8.42683 > 112.26.3.1.pmcd: Flags [.], ack 32845, win 21581, options [nop,nop,TS val 3000585 ecr 3220106,nop,nop,sack 1 {38557:41413},mptcp dss ack 1584130902], length 0
16:13:20.312026 IP 112.26.3.8.42683 > 112.26.3.1.pmcd: Flags [.], ack 32845, win 21307, options [nop,nop,TS val 3000370 ecr 3220106,nop,nop,sack 1 {38557:39985},mptcp dss ack 1584130902], length 0
16:13:20.460093 IP 112.26.3.8.42683 > 112.26.3.1.pmcd: Flags [.], ack 32845, win 21581, options [nop,nop,TS val 3000585 ecr 3220106,nop,nop,sack 1 {38557:41413},mptcp dss ack 1584130902], length 0
16:13:20.585955 IP 112.26.3.1.pmcd > 112.26.3.8.42683: Flags [.], seq 32845:34273, ack 1, win 4017, options [nop,nop,TS val 3221658 ecr 3000370,mptcp dss ack 724613416 seq 1584158034 subseq 32845 len 1428 csum 0x1a8c], length 1428
16:13:20.592498 IP 112.26.3.1.pmcd > 112.26.3.8.42683: Flags [.], seq 32845:34273, ack 1, win 4017, options [nop,nop,TS val 3221658 ecr 3000370,mptcp dss ack 724613416 seq 1584158034 subseq 32845 len 1428 csum 0x1a8c], length 1428
16:13:20.606759 IP 112.26.3.8.42683 > 112.26.3.1.pmcd: Flags [.], ack 34273, win 22083, options [nop,nop,TS val 3001041 ecr 3221658,nop,nop,sack 1 {38557:41413},mptcp dss ack 1584142326], length 0
16:13:20.725346 IP 112.26.3.8.42683 > 112.26.3.1.pmcd: Flags [.], ack 34273, win 22083, options [nop,nop,TS val 3001041 ecr 3221658,nop,nop,sack 1 {38557:41413},mptcp dss ack 1584142326], length 0
16:13:20.800306 IP 112.26.3.1.pmcd > 112.26.3.8.42683: Flags [.], seq 34273:35701, ack 1, win 4017, options [nop,nop,TS val 3221806 ecr 3000585,mptcp dss ack 724613416 seq 1584159462 subseq 34273 len 1428 csum 0xcf1], length 1428
16:13:20.813770 IP 112.26.3.8.42683 > 112.26.3.1.pmcd: Flags [.], ack 35701, win 22448, options [nop,nop,TS val 3001260 ecr 3221806,nop,nop,sack 1 {38557:41413},mptcp dss ack 1584160890], length 0
16:13:20.816515 IP 112.26.3.8.42683 > 112.26.3.1.pmcd: Flags [.], ack 35701, win 22448, options [nop,nop,TS val 3001260 ecr 3221806,nop,nop,sack 1 {38557:41413},mptcp dss ack 1584160890], length 0
16:13:20.892197 IP 112.26.3.1.pmcd > 112.26.3.8.42683: Flags [.], seq 34273:35701, ack 1, win 4017, options [nop,nop,TS val 3221806 ecr 3000585,mptcp dss ack 724613416 seq 1584159462 subseq 34273 len 1428 csum 0xcf1], length 1428
16:13:20.933560 IP 112.26.3.8.42683 > 112.26.3.1.pmcd: Flags [.], ack 34273, win 22083, options [nop,nop,TS val 3001041 ecr 3221658,nop,nop,sack 1 {38557:41413},mptcp dss ack 1584142326], length 0
16:13:21.137349 IP 112.26.3.8.42683 > 112.26.3.1.pmcd: Flags [.], ack 35701, win 22448, options [nop,nop,TS val 3001260 ecr 3221806,nop,nop,sack 1 {38557:41413},mptcp dss ack 1584160890], length 0
16:13:21.307277 IP 112.26.3.1.pmcd > 112.26.3.8.42683: Flags [.], seq 35701:37129, ack 1, win 4017, options [nop,nop,TS val 3222279 ecr 3001041,mptcp dss ack 724613416 seq 1584160890 subseq 35701 len 1428 csum 0x86bb], length 1428
16:13:21.323991 IP 112.26.3.1.pmcd > 112.26.3.8.42683: Flags [.], seq 35701:37129, ack 1, win 4017, options [nop,nop,TS val 3222279 ecr 3001041,mptcp dss ack 724613416 seq 1584160890 subseq 35701 len 1428 csum 0x86bb], length 1428
16:13:21.387462 IP 112.26.3.8.42683 > 112.26.3.1.pmcd: Flags [.], ack 37129, win 22950, options [nop,nop,TS val 3001772 ecr 3222279,nop,nop,sack 1 {38557:41413},mptcp dss ack 1584162318], length 0
16:13:21.425491 IP 112.26.3.8.42683 > 112.26.3.1.pmcd: Flags [.], ack 37129, win 22950, options [nop,nop,TS val 3001772 ecr 3222279,nop,nop,sack 1 {38557:41413},mptcp dss ack 1584162318], length 0
16:13:21.508122 IP 112.26.3.1.pmcd > 112.26.3.8.42683: Flags [.], seq 37129:38557, ack 1, win 4017, options [nop,nop,TS val 3222279 ecr 3001041,mptcp dss ack 724613416 seq 1584162318 subseq 37129 len 1428 csum 0x4495], length 1428
16:13:21.540226 IP 112.26.3.1.pmcd > 112.26.3.8.42683: Flags [.], seq 37129:38557, ack 1, win 4017, options [nop,nop,TS val 3222279 ecr 3001041,mptcp dss ack 724613416 seq 1584162318 subseq 37129 len 1428 csum 0x4495], length 1428
16:13:21.542412 IP 112.26.3.8.42683 > 112.26.3.1.pmcd: Flags [.], ack 41413, win 23315, options [nop,nop,TS val 3001989 ecr 3222279,mptcp dss ack 1584200874], length 0
16:13:21.615265 IP 112.26.3.8.42683 > 112.26.3.1.pmcd: Flags [.], ack 41413, win 23315, options [nop,nop,TS val 3001989 ecr 3222279,mptcp dss ack 1584200874], length 0
16:13:21.781491 IP 112.26.3.1.pmcd > 112.26.3.8.42683: Flags [.], seq 42841:44269, ack 1, win 4017, options [nop,nop,TS val 3222483 ecr 3001260,mptcp dss ack 724613416 seq 1584213726 subseq 42841 len 1428 csum 0xc0ce], length 1428
16:13:21.796322 IP 112.26.3.1.pmcd > 112.26.3.8.42683: Flags [.], seq 42841:44269, ack 1, win 4017, options [nop,nop,TS val 3222483 ecr 3001260,mptcp dss ack 724613416 seq 1584213726 subseq 42841 len 1428 csum 0xc0ce], length 1428
16:13:21.798870 IP 112.26.3.8.42683 > 112.26.3.1.pmcd: Flags [.], ack 41413, win 23589, options [nop,nop,TS val 3002245 ecr 3222279,nop,nop,sack 1 {42841:44269},mptcp dss ack 1584200874], length 0
16:13:21.812410 IP 112.26.3.8.42683 > 112.26.3.1.pmcd: Flags [.], ack 41413, win 23589, options [nop,nop,TS val 3002245 ecr 3222279,nop,nop,sack 1 {42841:44269},mptcp dss ack 1584200874], length 0
16:13:21.961721 IP 112.26.3.1.pmcd > 112.26.3.8.42683: Flags [.], seq 44269:45697, ack 1, win 4017, options [nop,nop,TS val 3222483 ecr 3001260,mptcp dss ack 724613416 seq 1584215154 subseq 44269 len 1428 csum 0x13a1], length 1428
16:13:22.013273 IP 112.26.3.1.pmcd > 112.26.3.8.42683: Flags [.], seq 44269:45697, ack 1, win 4017, options [nop,nop,TS val 3222483 ecr 3001260,mptcp dss ack 724613416 seq 1584215154 subseq 44269 len 1428 csum 0x13a1], length 1428
16:13:22.015985 IP 112.26.3.8.42683 > 112.26.3.1.pmcd: Flags [.], ack 41413, win 23862, options [nop,nop,TS val 3002462 ecr 3222279,nop,nop,sack 1 {42841:45697},mptcp dss ack 1584200874], length 0
16:13:22.141989 IP 112.26.3.8.42683 > 112.26.3.1.pmcd: Flags [.], ack 41413, win 23589, options [nop,nop,TS val 3002245 ecr 3222279,nop,nop,sack 1 {42841:44269},mptcp dss ack 1584200874], length 0
16:13:22.438066 IP 112.26.3.1.pmcd > 112.26.3.8.42683: Flags [.], seq 41413:42841, ack 1, win 4017, options [nop,nop,TS val 3223488 ecr 3002245,mptcp dss ack 724613416 seq 1584200874 subseq 41413 len 1428 csum 0x39ad], length 1428
16:13:22.450803 IP 112.26.3.1.pmcd > 112.26.3.8.42683: Flags [.], seq 41413:42841, ack 1, win 4017, options [nop,nop,TS val 3223488 ecr 3002245,mptcp dss ack 724613416 seq 1584200874 subseq 41413 len 1428 csum 0x39ad], length 1428
16:13:22.464988 IP 112.26.3.8.42683 > 112.26.3.1.pmcd: Flags [.], ack 45697, win 24052, options [nop,nop,TS val 3002899 ecr 3223488,mptcp dss ack 1584242286], length 0
16:13:22.468987 IP 112.26.3.8.42683 > 112.26.3.1.pmcd: Flags [.], ack 45697, win 24052, options [nop,nop,TS val 3002899 ecr 3223488,mptcp dss ack 1584242286], length 0
16:13:22.652197 IP 112.26.3.1.pmcd > 112.26.3.8.42683: Flags [.], seq 45697:47125, ack 1, win 4017, options [nop,nop,TS val 3223488 ecr 3002245,mptcp dss ack 724613416 seq 1584257994 subseq 45697 len 1428 csum 0x44f7], length 1428
16:13:22.718533 IP 112.26.3.1.pmcd > 112.26.3.8.42683: Flags [.], seq 45697:47125, ack 1, win 4017, options [nop,nop,TS val 3223488 ecr 3002245,mptcp dss ack 724613416 seq 1584257994 subseq 45697 len 1428 csum 0x44f7], length 1428
16:13:22.722800 IP 112.26.3.8.42683 > 112.26.3.1.pmcd: Flags [.], ack 47125, win 24445, options [nop,nop,TS val 3003167 ecr 3223488,mptcp dss ack 1584242286], length 0
16:13:22.727913 IP 112.26.3.8.42683 > 112.26.3.1.pmcd: Flags [.], ack 47125, win 24445, options [nop,nop,TS val 3003167 ecr 3223488,mptcp dss ack 1584242286], length 0
16:13:22.857961 IP 112.26.3.1.pmcd > 112.26.3.8.42683: Flags [.], seq 47125:48553, ack 1, win 4017, options [nop,nop,TS val 3223488 ecr 3002245,mptcp dss ack 724613416 seq 1584259422 subseq 47125 len 1428 csum 0x1d08], length 1428
16:13:22.956204 IP 112.26.3.8.42683 > 112.26.3.1.pmcd: Flags [.], ack 45697, win 24052, options [nop,nop,TS val 3002899 ecr 3223488,mptcp dss ack 1584242286], length 0
16:13:23.013278 IP 112.26.3.1.pmcd > 112.26.3.8.42683: Flags [.], seq 47125:48553, ack 1, win 4017, options [nop,nop,TS val 3223488 ecr 3002245,mptcp dss ack 724613416 seq 1584259422 subseq 47125 len 1428 csum 0x1d08], length 1428
16:13:23.015202 IP 112.26.3.8.42683 > 112.26.3.1.pmcd: Flags [.], ack 48553, win 24445, options [nop,nop,TS val 3003461 ecr 3223488,mptcp dss ack 1584242286], length 0
16:13:23.220434 IP 112.26.3.8.42683 > 112.26.3.1.pmcd: Flags [.], ack 47125, win 24445, options [nop,nop,TS val 3003167 ecr 3223488,mptcp dss ack 1584242286], length 0
16:13:23.364697 IP 112.26.3.1.pmcd > 112.26.3.8.42683: Flags [P.], seq 48553:49981, ack 1, win 4017, options [nop,nop,TS val 3224302 ecr 3002899,mptcp dss ack 724613416 seq 1584286554 subseq 48553 len 1428 csum 0x7cef], length 1428
16:13:23.388628 IP 112.26.3.1.pmcd > 112.26.3.8.42683: Flags [P.], seq 48553:49981, ack 1, win 4017, options [nop,nop,TS val 3224302 ecr 3002899,mptcp dss ack 724613416 seq 1584286554 subseq 48553 len 1428 csum 0x7cef], length 1428
16:13:23.411173 IP 112.26.3.8.42683 > 112.26.3.1.pmcd: Flags [.], ack 49981, win 24445, options [nop,nop,TS val 3003822 ecr 3224302,mptcp dss ack 1584242286], length 0
16:13:23.609360 IP 112.26.3.1.pmcd > 112.26.3.8.42683: Flags [.], seq 49981:51409, ack 1, win 4017, options [nop,nop,TS val 3224302 ecr 3002899,mptcp dss ack 724613416 seq 1584287982 subseq 49981 len 1428 csum 0x3f90], length 1428
16:13:23.633297 IP 112.26.3.1.pmcd > 112.26.3.8.42683: Flags [.], seq 49981:51409, ack 1, win 4017, options [nop,nop,TS val 3224302 ecr 3002899,mptcp dss ack 724613416 seq 1584287982 subseq 49981 len 1428 csum 0x3f90], length 1428
16:13:23.858951 IP 112.26.3.1.pmcd > 112.26.3.8.42683: Flags [.], seq 52837:54265, ack 1, win 4017, options [nop,nop,TS val 3224566 ecr 3003167,mptcp dss ack 724613416 seq 1584299406 subseq 52837 len 1428 csum 0x390], length 1428
16:13:23.872465 IP 112.26.3.1.pmcd > 112.26.3.8.42683: Flags [.], seq 52837:54265, ack 1, win 4017, options [nop,nop,TS val 3224566 ecr 3003167,mptcp dss ack 724613416 seq 1584299406 subseq 52837 len 1428 csum 0x390], length 1428
16:13:23.890500 IP 112.26.3.8.42683 > 112.26.3.1.pmcd: Flags [.], ack 51409, win 24476, options [nop,nop,TS val 3004321 ecr 3224302,nop,nop,sack 1 {52837:54265},mptcp dss ack 1584289410], length 0
16:13:23.903568 IP 112.26.3.8.42683 > 112.26.3.1.pmcd: Flags [.], ack 51409, win 24476, options [nop,nop,TS val 3004321 ecr 3224302,nop,nop,sack 1 {52837:54265},mptcp dss ack 1584289410], length 0
16:13:24.034288 IP 112.26.3.8.42683 > 112.26.3.1.pmcd: Flags [.], ack 51409, win 24476, options [nop,nop,TS val 3004321 ecr 3224302,nop,nop,sack 1 {52837:54265},mptcp dss ack 1584289410], length 0
16:13:24.278838 IP 112.26.3.1.pmcd > 112.26.3.8.42683: Flags [.], seq 54265:55693, ack 1, win 4017, options [nop,nop,TS val 3225380 ecr 3004321,mptcp dss ack 724613416 seq 1584316542 subseq 54265 len 1428 csum 0xc0f7], length 1428
16:13:24.300874 IP 112.26.3.1.pmcd > 112.26.3.8.42683: Flags [.], seq 54265:55693, ack 1, win 4017, options [nop,nop,TS val 3225380 ecr 3004321,mptcp dss ack 724613416 seq 1584316542 subseq 54265 len 1428 csum 0xc0f7], length 1428
16:13:24.343127 IP 112.26.3.8.42683 > 112.26.3.1.pmcd: Flags [.], ack 51409, win 24476, options [nop,nop,TS val 3004750 ecr 3224302,nop,nop,sack 1 {52837:55693},mptcp dss ack 1584289410], length 0
16:13:24.344756 IP 112.26.3.8.42683 > 112.26.3.1.pmcd: Flags [.], ack 51409, win 24476, options [nop,nop,TS val 3004750 ecr 3224302,nop,nop,sack 1 {52837:55693},mptcp dss ack 1584289410], length 0
16:13:24.612328 IP 112.26.3.1.pmcd > 112.26.3.8.42683: Flags [.], seq 55693:57121, ack 1, win 4017, options [nop,nop,TS val 3225380 ecr 3004321,mptcp dss ack 724613416 seq 1584317970 subseq 55693 len 1428 csum 0x59ce], length 1428
16:13:24.625570 IP 112.26.3.1.pmcd > 112.26.3.8.42683: Flags [.], seq 55693:57121, ack 1, win 4017, options [nop,nop,TS val 3225380 ecr 3004321,mptcp dss ack 724613416 seq 1584317970 subseq 55693 len 1428 csum 0x59ce], length 1428
16:13:24.628520 IP 112.26.3.8.42683 > 112.26.3.1.pmcd: Flags [.], ack 51409, win 24476, options [nop,nop,TS val 3005074 ecr 3224302,nop,nop,sack 1 {52837:57121},mptcp dss ack 1584289410], length 0
16:13:24.630354 IP 112.26.3.8.42683 > 112.26.3.1.pmcd: Flags [.], ack 51409, win 24476, options [nop,nop,TS val 3005074 ecr 3224302,nop,nop,sack 1 {52837:57121},mptcp dss ack 1584289410], length 0
16:13:24.840581 IP 112.26.3.1.pmcd > 112.26.3.8.42683: Flags [.], seq 57121:58549, ack 1, win 4017, options [nop,nop,TS val 3225380 ecr 3004321,mptcp dss ack 724613416 seq 1584319398 subseq 57121 len 1428 csum 0x5a83], length 1428
16:13:24.853625 IP 112.26.3.1.pmcd > 112.26.3.8.42683: Flags [.], seq 57121:58549, ack 1, win 4017, options [nop,nop,TS val 3225380 ecr 3004321,mptcp dss ack 724613416 seq 1584319398 subseq 57121 len 1428 csum 0x5a83], length 1428
16:13:24.884859 IP 112.26.3.8.42683 > 112.26.3.1.pmcd: Flags [.], ack 51409, win 24476, options [nop,nop,TS val 3005302 ecr 3224302,nop,nop,sack 1 {52837:58549},mptcp dss ack 1584289410], length 0
16:13:24.905340 IP 112.26.3.8.42683 > 112.26.3.1.pmcd: Flags [.], ack 51409, win 24476, options [nop,nop,TS val 3005302 ecr 3224302,nop,nop,sack 1 {52837:58549},mptcp dss ack 1584289410], length 0
16:13:25.045785 IP 112.26.3.8.42683 > 112.26.3.1.pmcd: Flags [.], ack 51409, win 24476, options [nop,nop,TS val 3005074 ecr 3224302,nop,nop,sack 1 {52837:57121},mptcp dss ack 1584289410], length 0
16:13:25.145951 IP 112.26.3.8.42683 > 112.26.3.1.pmcd: Flags [.], ack 51409, win 24476, options [nop,nop,TS val 3005302 ecr 3224302,nop,nop,sack 1 {52837:58549},mptcp dss ack 1584289410], length 0
16:13:25.216339 IP 112.26.3.1.pmcd > 112.26.3.8.42683: Flags [.], seq 51409:52837, ack 1, win 4017, options [nop,nop,TS val 3226392 ecr 3005074,mptcp dss ack 724613416 seq 1584289410 subseq 51409 len 1428 csum 0xd72b], length 1428
16:13:25.241056 IP 112.26.3.1.pmcd > 112.26.3.8.42683: Flags [.], seq 51409:52837, ack 1, win 4017, options [nop,nop,TS val 3226392 ecr 3005074,mptcp dss ack 724613416 seq 1584289410 subseq 51409 len 1428 csum 0xd72b], length 1428
16:13:25.244919 IP 112.26.3.8.42683 > 112.26.3.1.pmcd: Flags [.], ack 58549, win 24164, options [nop,nop,TS val 3005690 ecr 3226392,mptcp dss ack 1584309402], length 0
16:13:25.259572 IP 112.26.3.8.42683 > 112.26.3.1.pmcd: Flags [.], ack 58549, win 24164, options [nop,nop,TS val 3005690 ecr 3226392,mptcp dss ack 1584309402], length 0
16:13:25.399394 IP 112.26.3.8.42683 > 112.26.3.1.pmcd: Flags [.], ack 58549, win 24164, options [nop,nop,TS val 3005690 ecr 3226392,mptcp dss ack 1584309402], length 0
16:13:25.611315 IP 112.26.3.1.pmcd > 112.26.3.8.42683: Flags [.], seq 58549:59977, ack 1, win 4017, options [nop,nop,TS val 3226745 ecr 3005690,mptcp dss ack 724613416 seq 1584320826 subseq 58549 len 1428 csum 0xabec], length 1428
16:13:25.623842 IP 112.26.3.1.pmcd > 112.26.3.8.42683: Flags [.], seq 58549:59977, ack 1, win 4017, options [nop,nop,TS val 3226745 ecr 3005690,mptcp dss ack 724613416 seq 1584320826 subseq 58549 len 1428 csum 0xabec], length 1428
