16:13:07.946176 IP 112.26.3.8.42683 > 112.26.3.1.pmcd: Flags [S], seq 3403799646, win 65535, options [mss 1460,sackOK,TS val 2988377 ecr 0,nop,wscale 6,mptcp join id 5 token 0x6673cfeb nonce 0xa83f5246], length 0
16:13:07.952224 IP 112.26.3.8.42683 > 112.26.3.1.pmcd: Flags [S], seq 3403799646, win 65535, options [mss 1460,sackOK,TS val 2988377 ecr 0,nop,wscale 6,mptcp join id 5 token 0x6673cfeb nonce 0xa83f5246], length 0
16:13:07.957876 IP 112.26.3.1.pmcd > 112.26.3.8.42683: Flags [S.], seq 1927846746, ack 3403799647, win 65535, options [mss 1460,sackOK,TS val 3209299 ecr 2988377,nop,wscale 6,mptcp join id 5 hmac 0x57d5cf31bbbc5946 nonce 0xb27e1efe], length 0
16:13:08.101943 IP 112.26.3.1.pmcd > 112.26.3.8.42683: Flags [S.], seq 1927846746, ack 3403799647, win 65535, options [mss 1460,sackOK,TS val 3209299 ecr 2988377,nop,wscale 6,mptcp join id 5 hmac 0x57d5cf31bbbc5946 nonce 0xb27e1efe], length 0
16:13:08.207859 IP 112.26.3.8.42683 > 112.26.3.1.pmcd: Flags [.], ack 1, win 7665, options [nop,nop,TS val 2988564 ecr 3209299,mptcp join hmac 0x7f6eeba21ca3137dfcd4e1f0019ab1c7de450e57], length 0
16:13:08.213632 IP 112.26.3.8.42683 > 112.26.3.1.pmcd: Flags [.], ack 1, win 7665, options [nop,nop,TS val 2988564 ecr 3209299,mptcp join hmac 0x7f6eeba21ca3137dfcd4e1f0019ab1c7de450e57], length 0
16:13:08.218392 IP 112.26.3.1.pmcd > 112.26.3.8.42683: Flags [.], ack 1, win 4017, options [nop,nop,TS val 3209560 ecr 2988564,mptcp dss ack 724613416], length 0
16:13:08.297732 IP 112.26.3.1.pmcd > 112.26.3.8.42683: Flags [.], seq 1:1429, ack 1, win 4017, options [nop,nop,TS val 3209560 ecr 2988564,mptcp dss ack 724613416 seq 1583779614 subseq 1 len 1428 csum 0xc3e8], length 1428
16:13:08.418590 IP 112.26.3.1.pmcd > 112.26.3.8.42683: Flags [.], ack 1, win 4017, options [nop,nop,TS val 3209560 ecr 2988564,mptcp dss ack 724613416], length 0
16:13:08.458587 IP 112.26.3.1.pmcd > 112.26.3.8.42683: Flags [.], seq 1429:2857, ack 1, win 4017, options [nop,nop,TS val 3209561 ecr 2988564,mptcp dss ack 724613416 seq 1583781042 subseq 1429 len 1428 csum 0x7f10], length 1428
16:13:08.548531 IP 112.26.3.1.pmcd > 112.26.3.8.42683: Flags [.], seq 1:1429, ack 1, win 4017, options [nop,nop,TS val 3209560 ecr 2988564,mptcp dss ack 724613416 seq 1583779614 subseq 1 len 1428 csum 0xc3e8], length 1428
16:13:08.597988 IP 112.26.3.1.pmcd > 112.26.3.8.42683: Flags [.], seq 2857:4285, ack 1, win 4017, options [nop,nop,TS val 3209561 ecr 2988564,mptcp dss ack 724613416 seq 1583782470 subseq 2857 len 1428 csum 0xf8d9], length 1428
16:13:08.638906 IP 112.26.3.8.42683 > 112.26.3.1.pmcd: Flags [.], ack 1429, win 7985, options [nop,nop,TS val 2989015 ecr 3209560,mptcp dss ack 1583756766], length 0
16:13:08.783150 IP 112.26.3.1.pmcd > 112.26.3.8.42683: Flags [.], seq 4285:5713, ack 1, win 4017, options [nop,nop,TS val 3209561 ecr 2988564,mptcp dss ack 724613416 seq 1583783898 subseq 4285 len 1428 csum 0xb254], length 1428
16:13:08.922718 IP 112.26.3.1.pmcd > 112.26.3.8.42683: Flags [.], seq 12853:14281, ack 1, win 4017, options [nop,nop,TS val 3210112 ecr 2988564,mptcp dss ack 724613416 seq 1583792466 subseq 12853 len 1428 csum 0xf6b], length 1428
16:13:09.171040 IP 112.26.3.1.pmcd > 112.26.3.8.42683: Flags [.], seq 4285:5713, ack 1, win 4017, options [nop,nop,TS val 3209561 ecr 2988564,mptcp dss ack 724613416 seq 1583783898 subseq 4285 len 1428 csum 0xb254], length 1428
16:13:09.254052 IP 112.26.3.8.42683 > 112.26.3.1.pmcd: Flags [.], ack 1429, win 8532, options [nop,nop,TS val 2989633 ecr 3209560,nop,nop,sack 1 {4285:5713},mptcp dss ack 1583763906], length 0
16:13:09.399149 IP 112.26.3.1.pmcd > 112.26.3.8.42683: Flags [.], seq 12853:14281, ack 1, win 4017, options [nop,nop,TS val 3210112 ecr 2988564,mptcp dss ack 724613416 seq 1583792466 subseq 12853 len 1428 csum 0xf6b], length 1428
16:13:09.596204 IP 112.26.3.8.42683 > 112.26.3.1.pmcd: Flags [.], ack 1429, win 8532, options [nop,nop,TS val 2989633 ecr 3209560,nop,nop,sack 1 {4285:5713},mptcp dss ack 1583763906], length 0
16:13:09.605305 IP 112.26.3.1.pmcd > 112.26.3.8.42683: Flags [.], seq 14281:15709, ack 1, win 4017, options [nop,nop,TS val 3210942 ecr 2989633,mptcp dss ack 724613416 seq 1583855298 subseq 14281 len 1428 csum 0xc15d], length 1428
16:13:09.786876 IP 112.26.3.1.pmcd > 112.26.3.8.42683: Flags [.], seq 15709:17137, ack 1, win 4017, options [nop,nop,TS val 3210942 ecr 2989633,mptcp dss ack 724613416 seq 1583856726 subseq 15709 len 1428 csum 0x9ea8], length 1428
16:13:09.856106 IP 112.26.3.1.pmcd > 112.26.3.8.42683: Flags [.], seq 14281:15709, ack 1, win 4017, options [nop,nop,TS val 3210942 ecr 2989633,mptcp dss ack 724613416 seq 1583855298 subseq 14281 len 1428 csum 0xc15d], length 1428
16:13:09.907341 IP 112.26.3.8.42683 > 112.26.3.1.pmcd: Flags [.], ack 1429, win 9308, options [nop,nop,TS val 2990316 ecr 3209560,nop,nop,sack 2 {12853:15709}{4285:5713},mptcp dss ack 1583763906], length 0
16:13:09.943302 IP 112.26.3.1.pmcd > 112.26.3.8.42683: Flags [.], seq 17137:18565, ack 1, win 4017, options [nop,nop,TS val 3210942 ecr 2989633,mptcp dss ack 724613416 seq 1583858154 subseq 17137 len 1428 csum 0x4086], length 1428
16:13:10.103284 IP 112.26.3.1.pmcd > 112.26.3.8.42683: Flags [.], seq 18565:19993, ack 1, win 4017, options [nop,nop,TS val 3210942 ecr 2989633,mptcp dss ack 724613416 seq 1583859582 subseq 18565 len 1428 csum 0x4088], length 1428
16:13:10.208107 IP 112.26.3.1.pmcd > 112.26.3.8.42683: Flags [.], seq 15709:17137, ack 1, win 4017, options [nop,nop,TS val 3210942 ecr 2989633,mptcp dss ack 724613416 seq 1583856726 subseq 15709 len 1428 csum 0x9ea8], length 1428
16:13:10.254440 IP 112.26.3.8.42683 > 112.26.3.1.pmcd: Flags [.], ack 1429, win 9764, options [nop,nop,TS val 2990670 ecr 3209560,nop,nop,sack 2 {12853:17137}{4285:5713},mptcp dss ack 1583765334], length 0
16:13:10.406105 IP 112.26.3.8.42683 > 112.26.3.1.pmcd: Flags [.], ack 1429, win 9308, options [nop,nop,TS val 2990316 ecr 3209560,nop,nop,sack 2 {12853:15709}{4285:5713},mptcp dss ack 1583763906], length 0
16:13:10.419885 IP 112.26.3.1.pmcd > 112.26.3.8.42683: Flags [.], seq 1429:2857, ack 1, win 4017, options [nop,nop,TS val 3211752 ecr 2990316,mptcp dss ack 724613416 seq 1583781042 subseq 1429 len 1428 csum 0x7f10], length 1428
16:13:10.530041 IP 112.26.3.1.pmcd > 112.26.3.8.42683: Flags [.], seq 18565:19993, ack 1, win 4017, options [nop,nop,TS val 3210942 ecr 2989633,mptcp dss ack 724613416 seq 1583859582 subseq 18565 len 1428 csum 0x4088], length 1428
16:13:10.590278 IP 112.26.3.1.pmcd > 112.26.3.8.42683: Flags [.], seq 2857:4285, ack 1, win 4017, options [nop,nop,TS val 3211752 ecr 2990316,mptcp dss ack 724613416 seq 1583782470 subseq 2857 len 1428 csum 0xf8d9], length 1428
16:13:10.610003 IP 112.26.3.8.42683 > 112.26.3.1.pmcd: Flags [.], ack 1429, win 10175, options [nop,nop,TS val 2991002 ecr 3209560,nop,nop,sack 2 {18565:19993}{12853:17137},mptcp dss ack 1583766762], length 0
16:13:10.842777 IP 112.26.3.1.pmcd > 112.26.3.8.42683: Flags [.], seq 1429:2857, ack 1, win 4017, options [nop,nop,TS val 3211752 ecr 2990316,mptcp dss ack 724613416 seq 1583781042 subseq 1429 len 1428 csum 0x7f10], length 1428
16:13:10.931835 IP 112.26.3.8.42683 > 112.26.3.1.pmcd: Flags [.], ack 2857, win 10540, options [nop,nop,TS val 2991311 ecr 3211752,nop,nop,sack 2 {18565:19993}{12853:17137},mptcp dss ack 1583766762], length 0
16:13:11.083959 IP 112.26.3.1.pmcd > 112.26.3.8.42683: Flags [.], seq 2857:4285, ack 1, win 4017, options [nop,nop,TS val 3211752 ecr 2990316,mptcp dss ack 724613416 seq 1583782470 subseq 2857 len 1428 csum 0xf8d9], length 1428
16:13:11.107440 IP 112.26.3.8.42683 > 112.26.3.1.pmcd: Flags [.], ack 5713, win 10814, options [nop,nop,TS val 2991540 ecr 3211752,nop,nop,sack 2 {18565:19993}{12853:17137},mptcp dss ack 1583766762], length 0
16:13:11.272402 IP 112.26.3.8.42683 > 112.26.3.1.pmcd: Flags [.], ack 2857, win 10540, options [nop,nop,TS val 2991311 ecr 3211752,nop,nop,sack 2 {18565:19993}{12853:17137},mptcp dss ack 1583766762], length 0
16:13:11.285631 IP 112.26.3.1.pmcd > 112.26.3.8.42683: Flags [.], seq 5713:7141, ack 1, win 4017, options [nop,nop,TS val 3212619 ecr 2991311,mptcp dss ack 724613416 seq 1583785326 subseq 5713 len 1428 csum 0x1342], length 1428
16:13:11.398485 IP 112.26.3.8.42683 > 112.26.3.1.pmcd: Flags [.], ack 5713, win 10814, options [nop,nop,TS val 2991540 ecr 3211752,nop,nop,sack 2 {18565:19993}{12853:17137},mptcp dss ack 1583766762], length 0
16:13:11.422495 IP 112.26.3.1.pmcd > 112.26.3.8.42683: Flags [.], seq 7141:8569, ack 1, win 4017, options [nop,nop,TS val 3212619 ecr 2991311,mptcp dss ack 724613416 seq 1583786754 subseq 7141 len 1428 csum 0xa54f], length 1428
16:13:11.527209 IP 112.26.3.1.pmcd > 112.26.3.8.42683: Flags [.], seq 8569:9997, ack 1, win 4017, options [nop,nop,TS val 3212619 ecr 2991311,mptcp dss ack 724613416 seq 1583788182 subseq 8569 len 1428 csum 0x3d28], length 1428
16:13:11.604041 IP 112.26.3.1.pmcd > 112.26.3.8.42683: Flags [.], seq 5713:7141, ack 1, win 4017, options [nop,nop,TS val 3212619 ecr 2991311,mptcp dss ack 724613416 seq 1583785326 subseq 5713 len 1428 csum 0x1342], length 1428
16:13:11.633457 IP 112.26.3.8.42683 > 112.26.3.1.pmcd: Flags [.], ack 7141, win 11498, options [nop,nop,TS val 2992064 ecr 3212619,nop,nop,sack 2 {18565:19993}{12853:17137},mptcp dss ack 1583766762], length 0
16:13:11.704922 IP 112.26.3.1.pmcd > 112.26.3.8.42683: Flags [.], seq 9997:11425, ack 1, win 4017, options [nop,nop,TS val 3212619 ecr 2991311,mptcp dss ack 724613416 seq 1583789610 subseq 9997 len 1428 csum 0xbcdd], length 1428
16:13:11.846522 IP 112.26.3.1.pmcd > 112.26.3.8.42683: Flags [.], seq 11425:12853, ack 1, win 4017, options [nop,nop,TS val 3212745 ecr 2991540,mptcp dss ack 724613416 seq 1583791038 subseq 11425 len 1428 csum 0x228f], length 1428
16:13:11.943883 IP 112.26.3.1.pmcd > 112.26.3.8.42683: Flags [.], seq 8569:9997, ack 1, win 4017, options [nop,nop,TS val 3212619 ecr 2991311,mptcp dss ack 724613416 seq 1583788182 subseq 8569 len 1428 csum 0x3d28], length 1428
16:13:12.060837 IP 112.26.3.8.42683 > 112.26.3.1.pmcd: Flags [.], ack 7141, win 12000, options [nop,nop,TS val 2992408 ecr 3212619,nop,nop,sack 2 {8569:9997}{18565:19993},mptcp dss ack 1583786754], length 0
16:13:12.236970 IP 112.26.3.1.pmcd > 112.26.3.8.42683: Flags [.], seq 11425:12853, ack 1, win 4017, options [nop,nop,TS val 3212745 ecr 2991540,mptcp dss ack 724613416 seq 1583791038 subseq 11425 len 1428 csum 0x228f], length 1428
16:13:12.335391 IP 112.26.3.8.42683 > 112.26.3.1.pmcd: Flags [.], ack 7141, win 12365, options [nop,nop,TS val 2992704 ecr 3212619,nop,nop,sack 2 {11425:17137}{8569:9997},mptcp dss ack 1583786754], length 0
16:13:12.451955 IP 112.26.3.8.42683 > 112.26.3.1.pmcd: Flags [.], ack 7141, win 12000, options [nop,nop,TS val 2992408 ecr 3212619,nop,nop,sack 2 {8569:9997}{18565:19993},mptcp dss ack 1583786754], length 0
16:13:12.466726 IP 112.26.3.1.pmcd > 112.26.3.8.42683: Flags [.], seq 19993:21421, ack 1, win 4017, options [nop,nop,TS val 3213798 ecr 2992408,mptcp dss ack 724613416 seq 1583942406 subseq 19993 len 1428 csum 0x1382], length 1428
16:13:12.555893 IP 112.26.3.8.42683 > 112.26.3.1.pmcd: Flags [.], ack 7141, win 12365, options [nop,nop,TS val 2992704 ecr 3212619,nop,nop,sack 2 {11425:17137}{8569:9997},mptcp dss ack 1583786754], length 0
16:13:12.618642 IP 112.26.3.1.pmcd > 112.26.3.8.42683: Flags [.], seq 21421:22849, ack 1, win 4017, options [nop,nop,TS val 3213798 ecr 2992408,mptcp dss ack 724613416 seq 1583943834 subseq 21421 len 1428 csum 0x6f9e], length 1428
16:13:12.728005 IP 112.26.3.1.pmcd > 112.26.3.8.42683: Flags [.], seq 22849:24277, ack 1, win 4017, options [nop,nop,TS val 3213798 ecr 2992408,mptcp dss ack 724613416 seq 1583945262 subseq 22849 len 1428 csum 0x1240], length 1428
16:13:12.824263 IP 112.26.3.1.pmcd > 112.26.3.8.42683: Flags [.], seq 7141:8569, ack 1, win 4017, options [nop,nop,TS val 3213902 ecr 2992704,mptcp dss ack 724613416 seq 1583786754 subseq 7141 len 1428 csum 0xa54f], length 1428
16:13:12.913191 IP 112.26.3.1.pmcd > 112.26.3.8.42683: Flags [.], seq 19993:21421, ack 1, win 4017, options [nop,nop,TS val 3213798 ecr 2992408,mptcp dss ack 724613416 seq 1583942406 subseq 19993 len 1428 csum 0x1382], length 1428
16:13:12.932899 IP 112.26.3.8.42683 > 112.26.3.1.pmcd: Flags [.], ack 7141, win 13140, options [nop,nop,TS val 2993374 ecr 3212619,nop,nop,sack 2 {18565:21421}{11425:17137},mptcp dss ack 1583786754], length 0
16:13:13.110825 IP 112.26.3.1.pmcd > 112.26.3.8.42683: Flags [.], seq 21421:22849, ack 1, win 4017, options [nop,nop,TS val 3213798 ecr 2992408,mptcp dss ack 724613416 seq 1583943834 subseq 21421 len 1428 csum 0x6f9e], length 1428
16:13:13.169107 IP 112.26.3.8.42683 > 112.26.3.1.pmcd: Flags [.], ack 7141, win 13414, options [nop,nop,TS val 2993605 ecr 3212619,nop,nop,sack 2 {18565:22849}{11425:17137},mptcp dss ack 1583786754], length 0
16:13:13.338200 IP 112.26.3.1.pmcd > 112.26.3.8.42683: Flags [.], seq 7141:8569, ack 1, win 4017, options [nop,nop,TS val 3213902 ecr 2992704,mptcp dss ack 724613416 seq 1583786754 subseq 7141 len 1428 csum 0xa54f], length 1428
16:13:13.516240 IP 112.26.3.8.42683 > 112.26.3.1.pmcd: Flags [.], ack 9997, win 13870, options [nop,nop,TS val 2993961 ecr 3213902,nop,nop,sack 2 {18565:22849}{11425:17137},mptcp dss ack 1583789610], length 0
16:13:13.684182 IP 112.26.3.8.42683 > 112.26.3.1.pmcd: Flags [.], ack 7141, win 13414, options [nop,nop,TS val 2993605 ecr 3212619,nop,nop,sack 2 {18565:22849}{11425:17137},mptcp dss ack 1583786754], length 0
16:13:13.695230 IP 112.26.3.1.pmcd > 112.26.3.8.42683: Flags [.], seq 9997:11425, ack 1, win 4017, options [nop,nop,TS val 3215030 ecr 2993605,mptcp dss ack 724613416 seq 1583789610 subseq 9997 len 1428 csum 0xbcdd], length 1428
16:13:13.840445 IP 112.26.3.1.pmcd > 112.26.3.8.42683: Flags [.], seq 17137:18565, ack 1, win 4017, options [nop,nop,TS val 3215030 ecr 2993605,mptcp dss ack 724613416 seq 1583858154 subseq 17137 len 1428 csum 0x4086], length 1428
16:13:13.935909 IP 112.26.3.8.42683 > 112.26.3.1.pmcd: Flags [.], ack 9997, win 13870, options [nop,nop,TS val 2993961 ecr 3213902,nop,nop,sack 2 {18565:22849}{11425:17137},mptcp dss ack 1583789610], length 0
16:13:13.984379 IP 112.26.3.1.pmcd > 112.26.3.8.42683: Flags [.], seq 22849:24277, ack 1, win 4017, options [nop,nop,TS val 3215281 ecr 2993961,mptcp dss ack 724613416 seq 1583945262 subseq 22849 len 1428 csum 0x1240], length 1428
16:13:14.072768 IP 112.26.3.1.pmcd > 112.26.3.8.42683: Flags [.], seq 9997:11425, ack 1, win 4017, options [nop,nop,TS val 3215030 ecr 2993605,mptcp dss ack 724613416 seq 1583789610 subseq 9997 len 1428 csum 0xbcdd], length 1428
16:13:14.121112 IP 112.26.3.8.42683 > 112.26.3.1.pmcd: Flags [.], ack 17137, win 14372, options [nop,nop,TS val 2994533 ecr 3215030,nop,nop,sack 1 {18565:22849},mptcp dss ack 1583858154], length 0
16:13:14.171160 IP 112.26.3.1.pmcd > 112.26.3.8.42683: Flags [.], seq 24277:25705, ack 1, win 4017, options [nop,nop,TS val 3215281 ecr 2993961,mptcp dss ack 724613416 seq 1584000954 subseq 24277 len 1428 csum 0x261d], length 1428
16:13:14.359268 IP 112.26.3.1.pmcd > 112.26.3.8.42683: Flags [.], seq 17137:18565, ack 1, win 4017, options [nop,nop,TS val 3215030 ecr 2993605,mptcp dss ack 724613416 seq 1583858154 subseq 17137 len 1428 csum 0x4086], length 1428
16:13:14.550363 IP 112.26.3.8.42683 > 112.26.3.1.pmcd: Flags [.], ack 17137, win 14372, options [nop,nop,TS val 2994533 ecr 3215030,nop,nop,sack 1 {18565:22849},mptcp dss ack 1583858154], length 0
16:13:14.564954 IP 112.26.3.1.pmcd > 112.26.3.8.42683: Flags [.], seq 25705:27133, ack 1, win 4017, options [nop,nop,TS val 3215897 ecr 2994533,mptcp dss ack 724613416 seq 1584019518 subseq 25705 len 1428 csum 0x95cc], length 1428
16:13:14.667353 IP 112.26.3.1.pmcd > 112.26.3.8.42683: Flags [.], seq 27133:28561, ack 1, win 4017, options [nop,nop,TS val 3215897 ecr 2994533,mptcp dss ack 724613416 seq 1584020946 subseq 27133 len 1428 csum 0xbb18], length 1428
16:13:14.867843 IP 112.26.3.1.pmcd > 112.26.3.8.42683: Flags [.], seq 25705:27133, ack 1, win 4017, options [nop,nop,TS val 3215897 ecr 2994533,mptcp dss ack 724613416 seq 1584019518 subseq 25705 len 1428 csum 0x95cc], length 1428
16:13:15.041447 IP 112.26.3.1.pmcd > 112.26.3.8.42683: Flags [.], seq 27133:28561, ack 1, win 4017, options [nop,nop,TS val 3215897 ecr 2994533,mptcp dss ack 724613416 seq 1584020946 subseq 27133 len 1428 csum 0xbb18], length 1428
16:13:15.207635 IP 112.26.3.8.42683 > 112.26.3.1.pmcd: Flags [.], ack 22849, win 15787, options [nop,nop,TS val 2995608 ecr 3215030,nop,nop,sack 1 {25705:28561},mptcp dss ack 1583945262], length 0
16:13:17.883835 IP 112.26.3.1.pmcd > 112.26.3.8.42683: Flags [.], seq 17137:18565, ack 1, win 4017, options [nop,nop,TS val 3219200 ecr 2994533,mptcp dss ack 724613416 seq 1583858154 subseq 17137 len 1428 csum 0x4086], length 1428
16:13:17.898663 IP 112.26.3.1.pmcd > 112.26.3.8.42683: Flags [.], seq 17137:18565, ack 1, win 4017, options [nop,nop,TS val 3219200 ecr 2994533,mptcp dss ack 724613416 seq 1583858154 subseq 17137 len 1428 csum 0x4086], length 1428
16:13:17.926515 IP 112.26.3.8.42683 > 112.26.3.1.pmcd: Flags [.], ack 22849, win 18889, options [nop,nop,TS val 2998356 ecr 3215030,nop,nop,sack 2 {17137:18565}{25705:28561},mptcp dss ack 1583945262], length 0
16:13:18.108949 IP 112.26.3.8.42683 > 112.26.3.1.pmcd: Flags [.], ack 22849, win 18889, options [nop,nop,TS val 2998356 ecr 3215030,nop,nop,sack 2 {17137:18565}{25705:28561},mptcp dss ack 1583945262], length 0
16:13:18.117491 IP 112.26.3.1.pmcd > 112.26.3.8.42683: Flags [.], seq 22849:24277, ack 1, win 4017, options [nop,nop,TS val 3219455 ecr 2998356,mptcp dss ack 724613416 seq 1583945262 subseq 22849 len 1428 csum 0x1240], length 1428
16:13:18.217551 IP 112.26.3.1.pmcd > 112.26.3.8.42683: Flags [.], seq 22849:24277, ack 1, win 4017, options [nop,nop,TS val 3219455 ecr 2998356,mptcp dss ack 724613416 seq 1583945262 subseq 22849 len 1428 csum 0x1240], length 1428
16:13:18.235908 IP 112.26.3.8.42683 > 112.26.3.1.pmcd: Flags [.], ack 24277, win 19391, options [nop,nop,TS val 2998673 ecr 3219455,nop,nop,sack 1 {25705:28561},mptcp dss ack 1584000954], length 0
16:13:18.317757 IP 112.26.3.1.pmcd > 112.26.3.8.42683: Flags [.], seq 24277:25705, ack 1, win 4017, options [nop,nop,TS val 3219455 ecr 2998356,mptcp dss ack 724613416 seq 1584000954 subseq 24277 len 1428 csum 0x261d], length 1428
16:13:18.452001 IP 112.26.3.8.42683 > 112.26.3.1.pmcd: Flags [.], ack 24277, win 19391, options [nop,nop,TS val 2998673 ecr 3219455,nop,nop,sack 1 {25705:28561},mptcp dss ack 1584000954], length 0
16:13:18.517459 IP 112.26.3.1.pmcd > 112.26.3.8.42683: Flags [.], seq 24277:25705, ack 1, win 4017, options [nop,nop,TS val 3219455 ecr 2998356,mptcp dss ack 724613416 seq 1584000954 subseq 24277 len 1428 csum 0x261d], length 1428
16:13:18.534231 IP 112.26.3.8.42683 > 112.26.3.1.pmcd: Flags [.], ack 28561, win 19756, options [nop,nop,TS val 2998979 ecr 3219455,mptcp dss ack 1584092346], length 0
16:13:18.760745 IP 112.26.3.8.42683 > 112.26.3.1.pmcd: Flags [.], ack 28561, win 19756, options [nop,nop,TS val 2998979 ecr 3219455,mptcp dss ack 1584092346], length 0
16:13:18.772807 IP 112.26.3.1.pmcd > 112.26.3.8.42683: Flags [.], seq 28561:29989, ack 1, win 4017, options [nop,nop,TS val 3220106 ecr 2998979,mptcp dss ack 724613416 seq 1584153750 subseq 28561 len 1428 csum 0x5e84], length 1428
16:13:18.888129 IP 112.26.3.1.pmcd > 112.26.3.8.42683: Flags [.], seq 29989:31417, ack 1, win 4017, options [nop,nop,TS val 3220106 ecr 2998979,mptcp dss ack 724613416 seq 1584155178 subseq 29989 len 1428 csum 0x174f], length 1428
16:13:18.924711 IP 112.26.3.1.pmcd > 112.26.3.8.42683: Flags [.], seq 28561:29989, ack 1, win 4017, options [nop,nop,TS val 3220106 ecr 2998979,mptcp dss ack 724613416 seq 1584153750 subseq 28561 len 1428 csum 0x5e84], length 1428
16:13:18.964816 IP 112.26.3.8.42683 > 112.26.3.1.pmcd: Flags [.], ack 29989, win 20075, options [nop,nop,TS val 2999387 ecr 3220106,mptcp dss ack 1584130902], length 0
16:13:19.079994 IP 112.26.3.1.pmcd > 112.26.3.8.42683: Flags [.], seq 31417:32845, ack 1, win 4017, options [nop,nop,TS val 3220106 ecr 2998979,mptcp dss ack 724613416 seq 1584156606 subseq 31417 len 1428 csum 0x960b], length 1428
16:13:19.179595 IP 112.26.3.1.pmcd > 112.26.3.8.42683: Flags [.], seq 32845:34273, ack 1, win 4017, options [nop,nop,TS val 3220106 ecr 2998979,mptcp dss ack 724613416 seq 1584158034 subseq 32845 len 1428 csum 0x1a8c], length 1428
16:13:19.255675 IP 112.26.3.1.pmcd > 112.26.3.8.42683: Flags [.], seq 29989:31417, ack 1, win 4017, options [nop,nop,TS val 3220106 ecr 2998979,mptcp dss ack 724613416 seq 1584155178 subseq 29989 len 1428 csum 0x174f], length 1428
16:13:19.282340 IP 112.26.3.8.42683 > 112.26.3.1.pmcd: Flags [.], ack 31417, win 20486, options [nop,nop,TS val 2999713 ecr 3220106,mptcp dss ack 1584130902], length 0
16:13:19.406876 IP 112.26.3.8.42683 > 112.26.3.1.pmcd: Flags [.], ack 29989, win 20075, options [nop,nop,TS val 2999387 ecr 3220106,mptcp dss ack 1584130902], length 0
16:13:19.434747 IP 112.26.3.1.pmcd > 112.26.3.8.42683: Flags [.], seq 38557:39985, ack 1, win 4017, options [nop,nop,TS val 3220752 ecr 2999387,mptcp dss ack 724613416 seq 1584183738 subseq 38557 len 1428 csum 0xd067], length 1428
16:13:19.549122 IP 112.26.3.1.pmcd > 112.26.3.8.42683: Flags [.], seq 31417:32845, ack 1, win 4017, options [nop,nop,TS val 3220106 ecr 2998979,mptcp dss ack 724613416 seq 1584156606 subseq 31417 len 1428 csum 0x960b], length 1428
16:13:19.580869 IP 112.26.3.8.42683 > 112.26.3.1.pmcd: Flags [.], ack 32845, win 20760, options [nop,nop,TS val 3000011 ecr 3220106,mptcp dss ack 1584130902], length 0
16:13:19.627624 IP 112.26.3.1.pmcd > 112.26.3.8.42683: Flags [.], seq 39985:41413, ack 1, win 4017, options [nop,nop,TS val 3220752 ecr 2999387,mptcp dss ack 724613416 seq 1584185166 subseq 39985 len 1428 csum 0xa8e6], length 1428
16:13:19.780637 IP 112.26.3.8.42683 > 112.26.3.1.pmcd: Flags [.], ack 31417, win 20486, options [nop,nop,TS val 2999713 ecr 3220106,mptcp dss ack 1584130902], length 0
16:13:19.813019 IP 112.26.3.1.pmcd > 112.26.3.8.42683: Flags [.], seq 41413:42841, ack 1, win 4017, options [nop,nop,TS val 3221127 ecr 2999713,mptcp dss ack 724613416 seq 1584200874 subseq 41413 len 1428 csum 0x39ad], length 1428
16:13:19.908117 IP 112.26.3.1.pmcd > 112.26.3.8.42683: Flags [.], seq 38557:39985, ack 1, win 4017, options [nop,nop,TS val 3220752 ecr 2999387,mptcp dss ack 724613416 seq 1584183738 subseq 38557 len 1428 csum 0xd067], length 1428
16:13:19.968197 IP 112.26.3.8.42683 > 112.26.3.1.pmcd: Flags [.], ack 32845, win 21307, options [nop,nop,TS val 3000370 ecr 3220106,nop,nop,sack 1 {38557:39985},mptcp dss ack 1584130902], length 0
16:13:20.118358 IP 112.26.3.1.pmcd > 112.26.3.8.42683: Flags [.], seq 39985:41413, ack 1, win 4017, options [nop,nop,TS val 3220752 ecr 2999387,mptcp dss ack 724613416 seq 1584185166 subseq 39985 len 1428 csum 0xa8e6], length 1428
16:13:20.167031 IP 112.26.3.8.42683 > 112.26.3.1.pmcd: Flags [.], ack 32845, win 21581, options [nop,nop,TS val 3000585 ecr 3220106,nop,nop,sack 1 {38557:41413},mptcp dss ack 1584130902], length 0
16:13:20.311824 IP 112.26.3.8.42683 > 112.26.3.1.pmcd: Flags [.], ack 32845, win 21307, options [nop,nop,TS val 3000370 ecr 3220106,nop,nop,sack 1 {38557:39985},mptcp dss ack 1584130902], length 0
16:13:20.324142 IP 112.26.3.1.pmcd > 112.26.3.8.42683: Flags [.], seq 32845:34273, ack 1, win 4017, options [nop,nop,TS val 3221658 ecr 3000370,mptcp dss ack 724613416 seq 1584158034 subseq 32845 len 1428 csum 0x1a8c], length 1428
16:13:20.459821 IP 112.26.3.8.42683 > 112.26.3.1.pmcd: Flags [.], ack 32845, win 21581, options [nop,nop,TS val 3000585 ecr 3220106,nop,nop,sack 1 {38557:41413},mptcp dss ack 1584130902], length 0
16:13:20.474235 IP 112.26.3.1.pmcd > 112.26.3.8.42683: Flags [.], seq 34273:35701, ack 1, win 4017, options [nop,nop,TS val 3221806 ecr 3000585,mptcp dss ack 724613416 seq 1584159462 subseq 34273 len 1428 csum 0xcf1], length 1428
16:13:20.585752 IP 112.26.3.1.pmcd > 112.26.3.8.42683: Flags [.], seq 32845:34273, ack 1, win 4017, options [nop,nop,TS val 3221658 ecr 3000370,mptcp dss ack 724613416 seq 1584158034 subseq 32845 len 1428 csum 0x1a8c], length 1428
16:13:20.725242 IP 112.26.3.8.42683 > 112.26.3.1.pmcd: Flags [.], ack 34273, win 22083, options [nop,nop,TS val 3001041 ecr 3221658,nop,nop,sack 1 {38557:41413},mptcp dss ack 1584142326], length 0
16:13:20.800101 IP 112.26.3.1.pmcd > 112.26.3.8.42683: Flags [.], seq 34273:35701, ack 1, win 4017, options [nop,nop,TS val 3221806 ecr 3000585,mptcp dss ack 724613416 seq 1584159462 subseq 34273 len 1428 csum 0xcf1], length 1428
16:13:20.816396 IP 112.26.3.8.42683 > 112.26.3.1.pmcd: Flags [.], ack 35701, win 22448, options [nop,nop,TS val 3001260 ecr 3221806,nop,nop,sack 1 {38557:41413},mptcp dss ack 1584160890], length 0
16:13:20.933348 IP 112.26.3.8.42683 > 112.26.3.1.pmcd: Flags [.], ack 34273, win 22083, options [nop,nop,TS val 3001041 ecr 3221658,nop,nop,sack 1 {38557:41413},mptcp dss ack 1584142326], length 0
16:13:20.944244 IP 112.26.3.1.pmcd > 112.26.3.8.42683: Flags [.], seq 35701:37129, ack 1, win 4017, options [nop,nop,TS val 3222279 ecr 3001041,mptcp dss ack 724613416 seq 1584160890 subseq 35701 len 1428 csum 0x86bb], length 1428
16:13:21.070951 IP 112.26.3.1.pmcd > 112.26.3.8.42683: Flags [.], seq 37129:38557, ack 1, win 4017, options [nop,nop,TS val 3222279 ecr 3001041,mptcp dss ack 724613416 seq 1584162318 subseq 37129 len 1428 csum 0x4495], length 1428
16:13:21.137146 IP 112.26.3.8.42683 > 112.26.3.1.pmcd: Flags [.], ack 35701, win 22448, options [nop,nop,TS val 3001260 ecr 3221806,nop,nop,sack 1 {38557:41413},mptcp dss ack 1584160890], length 0
16:13:21.204286 IP 112.26.3.1.pmcd > 112.26.3.8.42683: Flags [.], seq 41413:42841, ack 1, win 4017, options [nop,nop,TS val 3222279 ecr 3001041,mptcp dss ack 724613416 seq 1584200874 subseq 41413 len 1428 csum 0x39ad], length 1428
16:13:21.307068 IP 112.26.3.1.pmcd > 112.26.3.8.42683: Flags [.], seq 35701:37129, ack 1, win 4017, options [nop,nop,TS val 3222279 ecr 3001041,mptcp dss ack 724613416 seq 1584160890 subseq 35701 len 1428 csum 0x86bb], length 1428
16:13:21.324624 IP 112.26.3.1.pmcd > 112.26.3.8.42683: Flags [.], seq 42841:44269, ack 1, win 4017, options [nop,nop,TS val 3222483 ecr 3001260,mptcp dss ack 724613416 seq 1584213726 subseq 42841 len 1428 csum 0xc0ce], length 1428
16:13:21.407514 IP 112.26.3.8.42683 > 112.26.3.1.pmcd: Flags [.], ack 37129, win 22950, options [nop,nop,TS val 3001772 ecr 3222279,nop,nop,sack 1 {38557:41413},mptcp dss ack 1584162318], length 0
16:13:21.507915 IP 112.26.3.1.pmcd > 112.26.3.8.42683: Flags [.], seq 37129:38557, ack 1, win 4017, options [nop,nop,TS val 3222279 ecr 3001041,mptcp dss ack 724613416 seq 1584162318 subseq 37129 len 1428 csum 0x4495], length 1428
16:13:21.543943 IP 112.26.3.1.pmcd > 112.26.3.8.42683: Flags [.], seq 44269:45697, ack 1, win 4017, options [nop,nop,TS val 3222483 ecr 3001260,mptcp dss ack 724613416 seq 1584215154 subseq 44269 len 1428 csum 0x13a1], length 1428
16:13:21.615156 IP 112.26.3.8.42683 > 112.26.3.1.pmcd: Flags [.], ack 41413, win 23315, options [nop,nop,TS val 3001989 ecr 3222279,mptcp dss ack 1584200874], length 0
16:13:21.781272 IP 112.26.3.1.pmcd > 112.26.3.8.42683: Flags [.], seq 42841:44269, ack 1, win 4017, options [nop,nop,TS val 3222483 ecr 3001260,mptcp dss ack 724613416 seq 1584213726 subseq 42841 len 1428 csum 0xc0ce], length 1428
16:13:21.812301 IP 112.26.3.8.42683 > 112.26.3.1.pmcd: Flags [.], ack 41413, win 23589, options [nop,nop,TS val 3002245 ecr 3222279,nop,nop,sack 1 {42841:44269},mptcp dss ack 1584200874], length 0
16:13:21.961511 IP 112.26.3.1.pmcd > 112.26.3.8.42683: Flags [.], seq 44269:45697, ack 1, win 4017, options [nop,nop,TS val 3222483 ecr 3001260,mptcp dss ack 724613416 seq 1584215154 subseq 44269 len 1428 csum 0x13a1], length 1428
16:13:22.029619 IP 112.26.3.8.42683 > 112.26.3.1.pmcd: Flags [.], ack 41413, win 23862, options [nop,nop,TS val 3002462 ecr 3222279,nop,nop,sack 1 {42841:45697},mptcp dss ack 1584200874], length 0
16:13:22.141783 IP 112.26.3.8.42683 > 112.26.3.1.pmcd: Flags [.], ack 41413, win 23589, options [nop,nop,TS val 3002245 ecr 3222279,nop,nop,sack 1 {42841:44269},mptcp dss ack 1584200874], length 0
16:13:22.154406 IP 112.26.3.1.pmcd > 112.26.3.8.42683: Flags [.], seq 41413:42841, ack 1, win 4017, options [nop,nop,TS val 3223488 ecr 3002245,mptcp dss ack 724613416 seq 1584200874 subseq 41413 len 1428 csum 0x39ad], length 1428
16:13:22.297973 IP 112.26.3.1.pmcd > 112.26.3.8.42683: Flags [.], seq 45697:47125, ack 1, win 4017, options [nop,nop,TS val 3223488 ecr 3002245,mptcp dss ack 724613416 seq 1584257994 subseq 45697 len 1428 csum 0x44f7], length 1428
16:13:22.393189 IP 112.26.3.1.pmcd > 112.26.3.8.42683: Flags [.], seq 47125:48553, ack 1, win 4017, options [nop,nop,TS val 3223488 ecr 3002245,mptcp dss ack 724613416 seq 1584259422 subseq 47125 len 1428 csum 0x1d08], length 1428
16:13:22.437857 IP 112.26.3.1.pmcd > 112.26.3.8.42683: Flags [.], seq 41413:42841, ack 1, win 4017, options [nop,nop,TS val 3223488 ecr 3002245,mptcp dss ack 724613416 seq 1584200874 subseq 41413 len 1428 csum 0x39ad], length 1428
16:13:22.496756 IP 112.26.3.8.42683 > 112.26.3.1.pmcd: Flags [.], ack 45697, win 24052, options [nop,nop,TS val 3002899 ecr 3223488,mptcp dss ack 1584242286], length 0
16:13:22.651990 IP 112.26.3.1.pmcd > 112.26.3.8.42683: Flags [.], seq 45697:47125, ack 1, win 4017, options [nop,nop,TS val 3223488 ecr 3002245,mptcp dss ack 724613416 seq 1584257994 subseq 45697 len 1428 csum 0x44f7], length 1428
16:13:22.727805 IP 112.26.3.8.42683 > 112.26.3.1.pmcd: Flags [.], ack 47125, win 24445, options [nop,nop,TS val 3003167 ecr 3223488,mptcp dss ack 1584242286], length 0
16:13:22.857756 IP 112.26.3.1.pmcd > 112.26.3.8.42683: Flags [.], seq 47125:48553, ack 1, win 4017, options [nop,nop,TS val 3223488 ecr 3002245,mptcp dss ack 724613416 seq 1584259422 subseq 47125 len 1428 csum 0x1d08], length 1428
16:13:22.956000 IP 112.26.3.8.42683 > 112.26.3.1.pmcd: Flags [.], ack 45697, win 24052, options [nop,nop,TS val 3002899 ecr 3223488,mptcp dss ack 1584242286], length 0
16:13:22.970958 IP 112.26.3.1.pmcd > 112.26.3.8.42683: Flags [P.], seq 48553:49981, ack 1, win 4017, options [nop,nop,TS val 3224302 ecr 3002899,mptcp dss ack 724613416 seq 1584286554 subseq 48553 len 1428 csum 0x7cef], length 1428
16:13:23.030009 IP 112.26.3.8.42683 > 112.26.3.1.pmcd: Flags [.], ack 48553, win 24445, options [nop,nop,TS val 3003461 ecr 3223488,mptcp dss ack 1584242286], length 0
16:13:23.126713 IP 112.26.3.1.pmcd > 112.26.3.8.42683: Flags [.], seq 49981:51409, ack 1, win 4017, options [nop,nop,TS val 3224302 ecr 3002899,mptcp dss ack 724613416 seq 1584287982 subseq 49981 len 1428 csum 0x3f90], length 1428
16:13:23.220231 IP 112.26.3.8.42683 > 112.26.3.1.pmcd: Flags [.], ack 47125, win 24445, options [nop,nop,TS val 3003167 ecr 3223488,mptcp dss ack 1584242286], length 0
16:13:23.246828 IP 112.26.3.1.pmcd > 112.26.3.8.42683: Flags [.], seq 51409:52837, ack 1, win 4017, options [nop,nop,TS val 3224302 ecr 3002899,mptcp dss ack 724613416 seq 1584289410 subseq 51409 len 1428 csum 0xd72b], length 1428
16:13:23.364489 IP 112.26.3.1.pmcd > 112.26.3.8.42683: Flags [P.], seq 48553:49981, ack 1, win 4017, options [nop,nop,TS val 3224302 ecr 3002899,mptcp dss ack 724613416 seq 1584286554 subseq 48553 len 1428 csum 0x7cef], length 1428
16:13:23.377080 IP 112.26.3.8.42683 > 112.26.3.1.pmcd: Flags [.], ack 49981, win 24445, options [nop,nop,TS val 3003822 ecr 3224302,mptcp dss ack 1584242286], length 0
16:13:23.425087 IP 112.26.3.1.pmcd > 112.26.3.8.42683: Flags [.], seq 52837:54265, ack 1, win 4017, options [nop,nop,TS val 3224566 ecr 3003167,mptcp dss ack 724613416 seq 1584299406 subseq 52837 len 1428 csum 0x390], length 1428
16:13:23.609152 IP 112.26.3.1.pmcd > 112.26.3.8.42683: Flags [.], seq 49981:51409, ack 1, win 4017, options [nop,nop,TS val 3224302 ecr 3002899,mptcp dss ack 724613416 seq 1584287982 subseq 49981 len 1428 csum 0x3f90], length 1428
16:13:23.858662 IP 112.26.3.1.pmcd > 112.26.3.8.42683: Flags [.], seq 52837:54265, ack 1, win 4017, options [nop,nop,TS val 3224566 ecr 3003167,mptcp dss ack 724613416 seq 1584299406 subseq 52837 len 1428 csum 0x390], length 1428
16:13:23.903449 IP 112.26.3.8.42683 > 112.26.3.1.pmcd: Flags [.], ack 51409, win 24476, options [nop,nop,TS val 3004321 ecr 3224302,nop,nop,sack 1 {52837:54265},mptcp dss ack 1584289410], length 0
16:13:24.034083 IP 112.26.3.8.42683 > 112.26.3.1.pmcd: Flags [.], ack 51409, win 24476, options [nop,nop,TS val 3004321 ecr 3224302,nop,nop,sack 1 {52837:54265},mptcp dss ack 1584289410], length 0
16:13:24.046004 IP 112.26.3.1.pmcd > 112.26.3.8.42683: Flags [.], seq 54265:55693, ack 1, win 4017, options [nop,nop,TS val 3225380 ecr 3004321,mptcp dss ack 724613416 seq 1584316542 subseq 54265 len 1428 csum 0xc0f7], length 1428
16:13:24.199938 IP 112.26.3.1.pmcd > 112.26.3.8.42683: Flags [.], seq 55693:57121, ack 1, win 4017, options [nop,nop,TS val 3225380 ecr 3004321,mptcp dss ack 724613416 seq 1584317970 subseq 55693 len 1428 csum 0x59ce], length 1428
16:13:24.278630 IP 112.26.3.1.pmcd > 112.26.3.8.42683: Flags [.], seq 54265:55693, ack 1, win 4017, options [nop,nop,TS val 3225380 ecr 3004321,mptcp dss ack 724613416 seq 1584316542 subseq 54265 len 1428 csum 0xc0f7], length 1428
16:13:24.351646 IP 112.26.3.1.pmcd > 112.26.3.8.42683: Flags [.], seq 57121:58549, ack 1, win 4017, options [nop,nop,TS val 3225380 ecr 3004321,mptcp dss ack 724613416 seq 1584319398 subseq 57121 len 1428 csum 0x5a83], length 1428
16:13:24.513693 IP 112.26.3.1.pmcd > 112.26.3.8.42683: Flags [.], seq 58549:59977, ack 1, win 4017, options [nop,nop,TS val 3225380 ecr 3004321,mptcp dss ack 724613416 seq 1584320826 subseq 58549 len 1428 csum 0xabec], length 1428
16:13:24.612051 IP 112.26.3.1.pmcd > 112.26.3.8.42683: Flags [.], seq 55693:57121, ack 1, win 4017, options [nop,nop,TS val 3225380 ecr 3004321,mptcp dss ack 724613416 seq 1584317970 subseq 55693 len 1428 csum 0x59ce], length 1428
16:13:24.630246 IP 112.26.3.8.42683 > 112.26.3.1.pmcd: Flags [.], ack 51409, win 24476, options [nop,nop,TS val 3005074 ecr 3224302,nop,nop,sack 1 {52837:57121},mptcp dss ack 1584289410], length 0
16:13:24.840363 IP 112.26.3.1.pmcd > 112.26.3.8.42683: Flags [.], seq 57121:58549, ack 1, win 4017, options [nop,nop,TS val 3225380 ecr 3004321,mptcp dss ack 724613416 seq 1584319398 subseq 57121 len 1428 csum 0x5a83], length 1428
16:13:24.905230 IP 112.26.3.8.42683 > 112.26.3.1.pmcd: Flags [.], ack 51409, win 24476, options [nop,nop,TS val 3005302 ecr 3224302,nop,nop,sack 1 {52837:58549},mptcp dss ack 1584289410], length 0
16:13:25.045581 IP 112.26.3.8.42683 > 112.26.3.1.pmcd: Flags [.], ack 51409, win 24476, options [nop,nop,TS val 3005074 ecr 3224302,nop,nop,sack 1 {52837:57121},mptcp dss ack 1584289410], length 0
16:13:25.057541 IP 112.26.3.1.pmcd > 112.26.3.8.42683: Flags [.], seq 51409:52837, ack 1, win 4017, options [nop,nop,TS val 3226392 ecr 3005074,mptcp dss ack 724613416 seq 1584289410 subseq 51409 len 1428 csum 0xd72b], length 1428
16:13:25.145740 IP 112.26.3.8.42683 > 112.26.3.1.pmcd: Flags [.], ack 51409, win 24476, options [nop,nop,TS val 3005302 ecr 3224302,nop,nop,sack 1 {52837:58549},mptcp dss ack 1584289410], length 0
16:13:25.216134 IP 112.26.3.1.pmcd > 112.26.3.8.42683: Flags [.], seq 51409:52837, ack 1, win 4017, options [nop,nop,TS val 3226392 ecr 3005074,mptcp dss ack 724613416 seq 1584289410 subseq 51409 len 1428 csum 0xd72b], length 1428
16:13:25.259452 IP 112.26.3.8.42683 > 112.26.3.1.pmcd: Flags [.], ack 58549, win 24164, options [nop,nop,TS val 3005690 ecr 3226392,mptcp dss ack 1584309402], length 0
16:13:25.399188 IP 112.26.3.8.42683 > 112.26.3.1.pmcd: Flags [.], ack 58549, win 24164, options [nop,nop,TS val 3005690 ecr 3226392,mptcp dss ack 1584309402], length 0
16:13:25.421603 IP 112.26.3.1.pmcd > 112.26.3.8.42683: Flags [.], seq 58549:59977, ack 1, win 4017, options [nop,nop,TS val 3226745 ecr 3005690,mptcp dss ack 724613416 seq 1584320826 subseq 58549 len 1428 csum 0xabec], length 1428
16:13:25.565304 IP 112.26.3.1.pmcd > 112.26.3.8.42683: Flags [.], seq 59977:61405, ack 1, win 4017, options [nop,nop,TS val 3226745 ecr 3005690,mptcp dss ack 724613416 seq 1584322254 subseq 59977 len 1428 csum 0xa90c], length 1428
16:13:25.611111 IP 112.26.3.1.pmcd > 112.26.3.8.42683: Flags [.], seq 58549:59977, ack 1, win 4017, options [nop,nop,TS val 3226745 ecr 3005690,mptcp dss ack 724613416 seq 1584320826 subseq 58549 len 1428 csum 0xabec], length 1428
16:13:25.629461 IP 112.26.3.8.42683 > 112.26.3.1.pmcd: Flags [.], ack 59977, win 24259, options [nop,nop,TS val 3006072 ecr 3226745,mptcp dss ack 1584309402], length 0
16:13:25.764419 IP 112.26.3.1.pmcd > 112.26.3.8.42683: Flags [.], seq 61405:62833, ack 1, win 4017, options [nop,nop,TS val 3226745 ecr 3005690,mptcp dss ack 724613416 seq 1584323682 subseq 61405 len 1428 csum 0x7b6f], length 1428
16:13:25.884585 IP 112.26.3.1.pmcd > 112.26.3.8.42683: Flags [.], seq 59977:61405, ack 1, win 4017, options [nop,nop,TS val 3226745 ecr 3005690,mptcp dss ack 724613416 seq 1584322254 subseq 59977 len 1428 csum 0xa90c], length 1428
16:13:25.918014 IP 112.26.3.1.pmcd > 112.26.3.8.42683: Flags [.], seq 62833:64261, ack 1, win 4017, options [nop,nop,TS val 3226745 ecr 3005690,mptcp dss ack 724613416 seq 1584386514 subseq 62833 len 1428 csum 0x4f00], length 1428
16:13:25.964942 IP 112.26.3.8.42683 > 112.26.3.1.pmcd: Flags [.], ack 61405, win 24259, options [nop,nop,TS val 3006348 ecr 3226745,mptcp dss ack 1584309402], length 0
16:13:26.093311 IP 112.26.3.1.pmcd > 112.26.3.8.42683: Flags [.], seq 61405:62833, ack 1, win 4017, options [nop,nop,TS val 3226745 ecr 3005690,mptcp dss ack 724613416 seq 1584323682 subseq 61405 len 1428 csum 0x7b6f], length 1428
16:13:26.192468 IP 112.26.3.8.42683 > 112.26.3.1.pmcd: Flags [.], ack 62833, win 23975, options [nop,nop,TS val 3006637 ecr 3226745,mptcp dss ack 1584363666], length 0
16:13:26.295545 IP 112.26.3.8.42683 > 112.26.3.1.pmcd: Flags [.], ack 61405, win 24259, options [nop,nop,TS val 3006348 ecr 3226745,mptcp dss ack 1584309402], length 0
16:13:26.305554 IP 112.26.3.1.pmcd > 112.26.3.8.42683: Flags [.], seq 64261:65689, ack 1, win 4017, options [nop,nop,TS val 3227642 ecr 3006348,mptcp dss ack 724613416 seq 1584419358 subseq 64261 len 1428 csum 0x96ab], length 1428
16:13:26.447843 IP 112.26.3.1.pmcd > 112.26.3.8.42683: Flags [.], seq 65689:67117, ack 1, win 4017, options [nop,nop,TS val 3227642 ecr 3006348,mptcp dss ack 724613416 seq 1584420786 subseq 65689 len 1428 csum 0xffbc], length 1428
16:13:26.503756 IP 112.26.3.1.pmcd > 112.26.3.8.42683: Flags [.], seq 64261:65689, ack 1, win 4017, options [nop,nop,TS val 3227642 ecr 3006348,mptcp dss ack 724613416 seq 1584419358 subseq 64261 len 1428 csum 0x96ab], length 1428
16:13:26.534215 IP 112.26.3.8.42683 > 112.26.3.1.pmcd: Flags [.], ack 62833, win 24491, options [nop,nop,TS val 3006971 ecr 3226745,nop,nop,sack 1 {64261:65689},mptcp dss ack 1584377946], length 0
16:13:26.744141 IP 112.26.3.1.pmcd > 112.26.3.8.42683: Flags [.], seq 65689:67117, ack 1, win 4017, options [nop,nop,TS val 3227642 ecr 3006348,mptcp dss ack 724613416 seq 1584420786 subseq 65689 len 1428 csum 0xffbc], length 1428
16:13:26.783699 IP 112.26.3.8.42683 > 112.26.3.1.pmcd: Flags [.], ack 62833, win 24491, options [nop,nop,TS val 3007206 ecr 3226745,nop,nop,sack 1 {64261:67117},mptcp dss ack 1584377946], length 0
16:13:29.764574 IP 112.26.3.1.pmcd > 112.26.3.8.42683: Flags [.], seq 61405:62833, ack 1, win 4017, options [nop,nop,TS val 3231104 ecr 3006348,mptcp dss ack 724613416 seq 1584323682 subseq 61405 len 1428 csum 0x7b6f], length 1428
16:13:29.776539 IP 112.26.3.1.pmcd > 112.26.3.8.42683: Flags [.], seq 61405:62833, ack 1, win 4017, options [nop,nop,TS val 3231104 ecr 3006348,mptcp dss ack 724613416 seq 1584323682 subseq 61405 len 1428 csum 0x7b6f], length 1428
