16:13:07.928813 IP 112.26.1.8.38123 > 112.26.1.1.pmcd: Flags [S], seq 1072362572, win 65535, options [mss 1460,sackOK,TS val 2988377 ecr 0,nop,wscale 6,mptcp join id 3 token 0x6673cfeb nonce 0x369cea28], length 0
16:13:07.938454 IP 112.26.1.8.38123 > 112.26.1.1.pmcd: Flags [S], seq 1072362572, win 65535, options [mss 1460,sackOK,TS val 2988377 ecr 0,nop,wscale 6,mptcp join id 3 token 0x6673cfeb nonce 0x369cea28], length 0
16:13:08.039833 IP 112.26.1.1.pmcd > 112.26.1.8.38123: Flags [S.], seq 324059165, ack 1072362573, win 65535, options [mss 1460,sackOK,TS val 3209287 ecr 2988377,nop,wscale 6,mptcp join id 3 hmac 0xd3dd4e0191341a6f nonce 0x53b6a931], length 0
16:13:08.040081 IP 112.26.1.8.38123 > 112.26.1.1.pmcd: Flags [.], ack 1, win 7665, options [nop,nop,TS val 2988488 ecr 3209287,mptcp join hmac 0x01d69c3b375552c3c050fd1b9c8493207da8daf5], length 0
16:13:08.149120 IP 112.26.1.8.38123 > 112.26.1.1.pmcd: Flags [.], ack 1, win 7665, options [nop,nop,TS val 2988488 ecr 3209287,mptcp join hmac 0x01d69c3b375552c3c050fd1b9c8493207da8daf5], length 0
16:13:08.211036 IP 112.26.1.1.pmcd > 112.26.1.8.38123: Flags [.], ack 1, win 4017, options [nop,nop,TS val 3209498 ecr 2988488,mptcp dss ack 724613416], length 0
16:13:08.287090 IP 112.26.1.1.pmcd > 112.26.1.8.38123: Flags [.], seq 1:1429, ack 1, win 4017, options [nop,nop,TS val 3209560 ecr 2988488,mptcp dss ack 724613416 seq 1583772474 subseq 1 len 1428 csum 0xea0c], length 1428
16:13:08.287295 IP 112.26.1.8.38123 > 112.26.1.1.pmcd: Flags [.], ack 1429, win 7757, options [nop,nop,TS val 2988736 ecr 3209560,mptcp dss ack 1583755338], length 0
16:13:08.439719 IP 112.26.1.8.38123 > 112.26.1.1.pmcd: Flags [.], ack 1429, win 7757, options [nop,nop,TS val 2988736 ecr 3209560,mptcp dss ack 1583755338], length 0
16:13:08.484651 IP 112.26.1.1.pmcd > 112.26.1.8.38123: Flags [.], seq 1429:2857, ack 1, win 4017, options [nop,nop,TS val 3209560 ecr 2988488,mptcp dss ack 724613416 seq 1583773902 subseq 1429 len 1428 csum 0xe07a], length 1428
16:13:08.484922 IP 112.26.1.8.38123 > 112.26.1.1.pmcd: Flags [.], ack 2857, win 7894, options [nop,nop,TS val 2988933 ecr 3209560,mptcp dss ack 1583756766], length 0
16:13:08.519920 IP 112.26.1.1.pmcd > 112.26.1.8.38123: Flags [.], seq 2857:4285, ack 1, win 4017, options [nop,nop,TS val 3209560 ecr 2988488,mptcp dss ack 724613416 seq 1583775330 subseq 2857 len 1428 csum 0xe523], length 1428
16:13:08.520141 IP 112.26.1.8.38123 > 112.26.1.1.pmcd: Flags [.], ack 4285, win 7939, options [nop,nop,TS val 2988968 ecr 3209560,mptcp dss ack 1583756766], length 0
16:13:08.625673 IP 112.26.1.8.38123 > 112.26.1.1.pmcd: Flags [.], ack 2857, win 7894, options [nop,nop,TS val 2988933 ecr 3209560,mptcp dss ack 1583756766], length 0
16:13:08.704497 IP 112.26.1.8.38123 > 112.26.1.1.pmcd: Flags [.], ack 4285, win 7939, options [nop,nop,TS val 2988968 ecr 3209560,mptcp dss ack 1583756766], length 0
16:13:08.754191 IP 112.26.1.1.pmcd > 112.26.1.8.38123: Flags [.], seq 4285:5713, ack 1, win 4017, options [nop,nop,TS val 3209560 ecr 2988488,mptcp dss ack 724613416 seq 1583776758 subseq 4285 len 1428 csum 0x27ea], length 1428
16:13:08.754459 IP 112.26.1.8.38123 > 112.26.1.1.pmcd: Flags [.], ack 5713, win 8122, options [nop,nop,TS val 2989203 ecr 3209560,mptcp dss ack 1583761050], length 0
16:13:08.826395 IP 112.26.1.1.pmcd > 112.26.1.8.38123: Flags [.], seq 5713:7141, ack 1, win 4017, options [nop,nop,TS val 3209561 ecr 2988488,mptcp dss ack 724613416 seq 1583778186 subseq 5713 len 1428 csum 0x185d], length 1428
16:13:08.826620 IP 112.26.1.8.38123 > 112.26.1.1.pmcd: Flags [.], ack 7141, win 8167, options [nop,nop,TS val 2989275 ecr 3209561,mptcp dss ack 1583761050], length 0
16:13:08.887201 IP 112.26.1.8.38123 > 112.26.1.1.pmcd: Flags [.], ack 5713, win 8122, options [nop,nop,TS val 2989203 ecr 3209560,mptcp dss ack 1583761050], length 0
16:13:08.951177 IP 112.26.1.8.38123 > 112.26.1.1.pmcd: Flags [.], ack 7141, win 8167, options [nop,nop,TS val 2989275 ecr 3209561,mptcp dss ack 1583761050], length 0
16:13:09.034550 IP 112.26.1.1.pmcd > 112.26.1.8.38123: Flags [.], seq 7141:8569, ack 1, win 4017, options [nop,nop,TS val 3209787 ecr 2988488,mptcp dss ack 724613416 seq 1583796750 subseq 7141 len 1428 csum 0x768f], length 1428
16:13:09.034773 IP 112.26.1.8.38123 > 112.26.1.1.pmcd: Flags [.], ack 8569, win 8350, options [nop,nop,TS val 2989483 ecr 3209787,mptcp dss ack 1583763906], length 0
16:13:09.100099 IP 112.26.1.1.pmcd > 112.26.1.8.38123: Flags [.], seq 8569:9997, ack 1, win 4017, options [nop,nop,TS val 3209787 ecr 2988488,mptcp dss ack 724613416 seq 1583798178 subseq 8569 len 1428 csum 0xf6d8], length 1428
16:13:09.100327 IP 112.26.1.8.38123 > 112.26.1.1.pmcd: Flags [.], ack 9997, win 8441, options [nop,nop,TS val 2989549 ecr 3209787,mptcp dss ack 1583763906], length 0
16:13:09.163600 IP 112.26.1.8.38123 > 112.26.1.1.pmcd: Flags [.], ack 8569, win 8350, options [nop,nop,TS val 2989483 ecr 3209787,mptcp dss ack 1583763906], length 0
16:13:09.228783 IP 112.26.1.1.pmcd > 112.26.1.8.38123: Flags [.], seq 9997:11425, ack 1, win 4017, options [nop,nop,TS val 3209787 ecr 2988736,mptcp dss ack 724613416 seq 1583799606 subseq 9997 len 1428 csum 0xd90d], length 1428
16:13:09.229047 IP 112.26.1.8.38123 > 112.26.1.1.pmcd: Flags [.], ack 11425, win 8578, options [nop,nop,TS val 2989677 ecr 3209787,mptcp dss ack 1583763906], length 0
16:13:09.283186 IP 112.26.1.8.38123 > 112.26.1.1.pmcd: Flags [.], ack 9997, win 8441, options [nop,nop,TS val 2989549 ecr 3209787,mptcp dss ack 1583763906], length 0
16:13:09.352394 IP 112.26.1.1.pmcd > 112.26.1.8.38123: Flags [.], seq 11425:12853, ack 1, win 4017, options [nop,nop,TS val 3209787 ecr 2988736,mptcp dss ack 724613416 seq 1583801034 subseq 11425 len 1428 csum 0xb8ec], length 1428
16:13:09.352601 IP 112.26.1.8.38123 > 112.26.1.1.pmcd: Flags [.], ack 12853, win 8760, options [nop,nop,TS val 2989801 ecr 3209787,mptcp dss ack 1583763906], length 0
16:13:09.426191 IP 112.26.1.8.38123 > 112.26.1.1.pmcd: Flags [.], ack 11425, win 8578, options [nop,nop,TS val 2989677 ecr 3209787,mptcp dss ack 1583763906], length 0
16:13:09.446995 IP 112.26.1.1.pmcd > 112.26.1.8.38123: Flags [.], seq 12853:14281, ack 1, win 4017, options [nop,nop,TS val 3209787 ecr 2988736,mptcp dss ack 724613416 seq 1583802462 subseq 12853 len 1428 csum 0xaa0a], length 1428
16:13:09.447233 IP 112.26.1.8.38123 > 112.26.1.1.pmcd: Flags [.], ack 14281, win 8897, options [nop,nop,TS val 2989895 ecr 3209787,mptcp dss ack 1583763906], length 0
16:13:09.506231 IP 112.26.1.8.38123 > 112.26.1.1.pmcd: Flags [.], ack 12853, win 8760, options [nop,nop,TS val 2989801 ecr 3209787,mptcp dss ack 1583763906], length 0
16:13:09.573529 IP 112.26.1.1.pmcd > 112.26.1.8.38123: Flags [.], seq 17137:18565, ack 1, win 4017, options [nop,nop,TS val 3209992 ecr 2988933,mptcp dss ack 724613416 seq 1583811030 subseq 17137 len 1428 csum 0x2152], length 1428
16:13:09.573745 IP 112.26.1.8.38123 > 112.26.1.1.pmcd: Flags [.], ack 14281, win 9034, options [nop,nop,TS val 2990022 ecr 3209787,nop,nop,sack 1 {17137:18565},mptcp dss ack 1583763906], length 0
16:13:09.659267 IP 112.26.1.8.38123 > 112.26.1.1.pmcd: Flags [.], ack 14281, win 8897, options [nop,nop,TS val 2989895 ecr 3209787,mptcp dss ack 1583763906], length 0
16:13:09.714514 IP 112.26.1.1.pmcd > 112.26.1.8.38123: Flags [.], seq 18565:19993, ack 1, win 4017, options [nop,nop,TS val 3209992 ecr 2988933,mptcp dss ack 724613416 seq 1583812458 subseq 18565 len 1428 csum 0x34fc], length 1428
16:13:09.714752 IP 112.26.1.8.38123 > 112.26.1.1.pmcd: Flags [.], ack 14281, win 9171, options [nop,nop,TS val 2990163 ecr 3209787,nop,nop,sack 1 {17137:19993},mptcp dss ack 1583763906], length 0
16:13:09.800463 IP 112.26.1.1.pmcd > 112.26.1.8.38123: Flags [.], seq 19993:21421, ack 1, win 4017, options [nop,nop,TS val 3210105 ecr 2988968,mptcp dss ack 724613416 seq 1583819598 subseq 19993 len 1428 csum 0x805f], length 1428
16:13:09.800704 IP 112.26.1.8.38123 > 112.26.1.1.pmcd: Flags [.], ack 14281, win 9217, options [nop,nop,TS val 2990249 ecr 3209787,nop,nop,sack 1 {17137:21421},mptcp dss ack 1583763906], length 0
16:13:09.912831 IP 112.26.1.8.38123 > 112.26.1.1.pmcd: Flags [.], ack 14281, win 9034, options [nop,nop,TS val 2990022 ecr 3209787,nop,nop,sack 1 {17137:18565},mptcp dss ack 1583763906], length 0
16:13:09.965766 IP 112.26.1.1.pmcd > 112.26.1.8.38123: Flags [.], seq 21421:22849, ack 1, win 4017, options [nop,nop,TS val 3210105 ecr 2988968,mptcp dss ack 724613416 seq 1583821026 subseq 21421 len 1428 csum 0x9960], length 1428
16:13:09.965985 IP 112.26.1.8.38123 > 112.26.1.1.pmcd: Flags [.], ack 14281, win 9399, options [nop,nop,TS val 2990414 ecr 3209787,nop,nop,sack 1 {17137:22849},mptcp dss ack 1583763906], length 0
16:13:10.032586 IP 112.26.1.1.pmcd > 112.26.1.8.38123: Flags [.], seq 22849:24277, ack 1, win 4017, options [nop,nop,TS val 3210239 ecr 2989203,mptcp dss ack 724613416 seq 1583829594 subseq 22849 len 1428 csum 0x9cb3], length 1428
16:13:10.032822 IP 112.26.1.8.38123 > 112.26.1.1.pmcd: Flags [.], ack 14281, win 9536, options [nop,nop,TS val 2990481 ecr 3209787,nop,nop,sack 1 {17137:24277},mptcp dss ack 1583763906], length 0
16:13:10.111199 IP 112.26.1.8.38123 > 112.26.1.1.pmcd: Flags [.], ack 14281, win 9171, options [nop,nop,TS val 2990163 ecr 3209787,nop,nop,sack 1 {17137:19993},mptcp dss ack 1583763906], length 0
16:13:10.161784 IP 112.26.1.8.38123 > 112.26.1.1.pmcd: Flags [.], ack 14281, win 9217, options [nop,nop,TS val 2990249 ecr 3209787,nop,nop,sack 1 {17137:21421},mptcp dss ack 1583763906], length 0
16:13:10.201614 IP 112.26.1.1.pmcd > 112.26.1.8.38123: Flags [.], seq 25705:27133, ack 1, win 4017, options [nop,nop,TS val 3210328 ecr 2989275,mptcp dss ack 724613416 seq 1583832450 subseq 25705 len 1428 csum 0xb854], length 1428
16:13:10.201881 IP 112.26.1.8.38123 > 112.26.1.1.pmcd: Flags [.], ack 14281, win 9719, options [nop,nop,TS val 2990650 ecr 3209787,nop,nop,sack 2 {25705:27133}{17137:24277},mptcp dss ack 1583765334], length 0
16:13:10.275794 IP 112.26.1.1.pmcd > 112.26.1.8.38123: Flags [.], seq 27133:28561, ack 1, win 4017, options [nop,nop,TS val 3210328 ecr 2989275,mptcp dss ack 724613416 seq 1583833878 subseq 27133 len 1428 csum 0xe00a], length 1428
16:13:10.276015 IP 112.26.1.8.38123 > 112.26.1.1.pmcd: Flags [.], ack 14281, win 9855, options [nop,nop,TS val 2990724 ecr 3209787,nop,nop,sack 2 {25705:28561}{17137:24277},mptcp dss ack 1583766762], length 0
16:13:10.337829 IP 112.26.1.1.pmcd > 112.26.1.8.38123: Flags [.], seq 28561:29989, ack 1, win 4017, options [nop,nop,TS val 3210511 ecr 2989483,mptcp dss ack 724613416 seq 1583838162 subseq 28561 len 1428 csum 0xfd2], length 1428
16:13:10.338039 IP 112.26.1.8.38123 > 112.26.1.1.pmcd: Flags [.], ack 14281, win 9947, options [nop,nop,TS val 2990786 ecr 3209787,nop,nop,sack 2 {25705:29989}{17137:24277},mptcp dss ack 1583766762], length 0
16:13:10.422830 IP 112.26.1.8.38123 > 112.26.1.1.pmcd: Flags [.], ack 14281, win 9399, options [nop,nop,TS val 2990414 ecr 3209787,nop,nop,sack 1 {17137:22849},mptcp dss ack 1583763906], length 0
16:13:10.491435 IP 112.26.1.8.38123 > 112.26.1.1.pmcd: Flags [.], ack 14281, win 9536, options [nop,nop,TS val 2990481 ecr 3209787,nop,nop,sack 1 {17137:24277},mptcp dss ack 1583763906], length 0
16:13:10.537045 IP 112.26.1.1.pmcd > 112.26.1.8.38123: Flags [.], seq 32845:34273, ack 1, win 4017, options [nop,nop,TS val 3210642 ecr 2989549,mptcp dss ack 724613416 seq 1583843874 subseq 32845 len 1428 csum 0xe2bf], length 1428
16:13:10.537263 IP 112.26.1.8.38123 > 112.26.1.1.pmcd: Flags [.], ack 14281, win 10129, options [nop,nop,TS val 2990985 ecr 3209787,nop,nop,sack 2 {32845:34273}{25705:29989},mptcp dss ack 1583766762], length 0
16:13:10.634539 IP 112.26.1.8.38123 > 112.26.1.1.pmcd: Flags [.], ack 14281, win 9719, options [nop,nop,TS val 2990650 ecr 3209787,nop,nop,sack 2 {25705:27133}{17137:24277},mptcp dss ack 1583765334], length 0
16:13:10.679492 IP 112.26.1.8.38123 > 112.26.1.1.pmcd: Flags [.], ack 14281, win 9855, options [nop,nop,TS val 2990724 ecr 3209787,nop,nop,sack 2 {25705:28561}{17137:24277},mptcp dss ack 1583766762], length 0
16:13:10.732689 IP 112.26.1.1.pmcd > 112.26.1.8.38123: Flags [.], seq 35701:37129, ack 1, win 4017, options [nop,nop,TS val 3210780 ecr 2989677,mptcp dss ack 724613416 seq 1583846730 subseq 35701 len 1428 csum 0xecaf], length 1428
16:13:10.732910 IP 112.26.1.8.38123 > 112.26.1.1.pmcd: Flags [.], ack 14281, win 10357, options [nop,nop,TS val 2991181 ecr 3209787,nop,nop,sack 2 {35701:37129}{32845:34273},mptcp dss ack 1583766762], length 0
16:13:10.813321 IP 112.26.1.1.pmcd > 112.26.1.8.38123: Flags [.], seq 37129:38557, ack 1, win 4017, options [nop,nop,TS val 3210879 ecr 2989801,mptcp dss ack 724613416 seq 1583851014 subseq 37129 len 1428 csum 0x1ac7], length 1428
16:13:10.813563 IP 112.26.1.8.38123 > 112.26.1.1.pmcd: Flags [.], ack 14281, win 10494, options [nop,nop,TS val 2991261 ecr 3209787,nop,nop,sack 2 {35701:38557}{32845:34273},mptcp dss ack 1583766762], length 0
16:13:10.891669 IP 112.26.1.1.pmcd > 112.26.1.8.38123: Flags [.], seq 38557:39985, ack 1, win 4017, options [nop,nop,TS val 3210879 ecr 2989801,mptcp dss ack 724613416 seq 1583852442 subseq 38557 len 1428 csum 0x6b8e], length 1428
16:13:10.891874 IP 112.26.1.8.38123 > 112.26.1.1.pmcd: Flags [.], ack 14281, win 10585, options [nop,nop,TS val 2991340 ecr 3209787,nop,nop,sack 2 {35701:39985}{32845:34273},mptcp dss ack 1583766762], length 0
16:13:10.998266 IP 112.26.1.1.pmcd > 112.26.1.8.38123: Flags [.], seq 41413:42841, ack 1, win 4017, options [nop,nop,TS val 3211009 ecr 2989895,mptcp dss ack 724613416 seq 1583862438 subseq 41413 len 1428 csum 0x6975], length 1428
16:13:10.998506 IP 112.26.1.8.38123 > 112.26.1.1.pmcd: Flags [.], ack 14281, win 10722, options [nop,nop,TS val 2991446 ecr 3209787,nop,nop,sack 2 {41413:42841}{35701:39985},mptcp dss ack 1583766762], length 0
16:13:11.036341 IP 112.26.1.8.38123 > 112.26.1.1.pmcd: Flags [.], ack 14281, win 10129, options [nop,nop,TS val 2990985 ecr 3209787,nop,nop,sack 2 {32845:34273}{25705:29989},mptcp dss ack 1583766762], length 0
16:13:11.116058 IP 112.26.1.1.pmcd > 112.26.1.8.38123: Flags [.], seq 14281:15709, ack 1, win 4017, options [nop,nop,TS val 3211461 ecr 2990163,mptcp dss ack 724613416 seq 1583803890 subseq 14281 len 1428 csum 0xea77], length 1428
16:13:11.116295 IP 112.26.1.8.38123 > 112.26.1.1.pmcd: Flags [.], ack 15709, win 10859, options [nop,nop,TS val 2991564 ecr 3211461,nop,nop,sack 2 {41413:42841}{35701:39985},mptcp dss ack 1583766762], length 0
16:13:11.170552 IP 112.26.1.1.pmcd > 112.26.1.8.38123: Flags [.], seq 15709:17137, ack 1, win 4017, options [nop,nop,TS val 3211533 ecr 2990249,mptcp dss ack 724613416 seq 1583805318 subseq 15709 len 1428 csum 0x90af], length 1428
16:13:11.170760 IP 112.26.1.8.38123 > 112.26.1.1.pmcd: Flags [.], ack 24277, win 10950, options [nop,nop,TS val 2991619 ecr 3211533,nop,nop,sack 2 {41413:42841}{35701:39985},mptcp dss ack 1583766762], length 0
16:13:11.214676 IP 112.26.1.8.38123 > 112.26.1.1.pmcd: Flags [.], ack 14281, win 10357, options [nop,nop,TS val 2991181 ecr 3209787,nop,nop,sack 2 {35701:37129}{32845:34273},mptcp dss ack 1583766762], length 0
16:13:11.281227 IP 112.26.1.8.38123 > 112.26.1.1.pmcd: Flags [.], ack 14281, win 10494, options [nop,nop,TS val 2991261 ecr 3209787,nop,nop,sack 2 {35701:38557}{32845:34273},mptcp dss ack 1583766762], length 0
16:13:11.309811 IP 112.26.1.1.pmcd > 112.26.1.8.38123: Flags [.], seq 44269:45697, ack 1, win 4017, options [nop,nop,TS val 3211776 ecr 2990414,mptcp dss ack 724613416 seq 1583878146 subseq 44269 len 1428 csum 0x2baf], length 1428
16:13:11.310047 IP 112.26.1.8.38123 > 112.26.1.1.pmcd: Flags [.], ack 24277, win 11087, options [nop,nop,TS val 2991758 ecr 3211533,nop,nop,sack 2 {44269:45697}{41413:42841},mptcp dss ack 1583766762], length 0
16:13:11.363442 IP 112.26.1.1.pmcd > 112.26.1.8.38123: Flags [.], seq 24277:25705, ack 1, win 4017, options [nop,nop,TS val 3211982 ecr 2990650,mptcp dss ack 724613416 seq 1583831022 subseq 24277 len 1428 csum 0x1c6c], length 1428
16:13:11.363788 IP 112.26.1.8.38123 > 112.26.1.1.pmcd: Flags [.], ack 29989, win 11179, options [nop,nop,TS val 2991812 ecr 3211982,nop,nop,sack 2 {44269:45697}{41413:42841},mptcp dss ack 1583766762], length 0
16:13:11.435238 IP 112.26.1.1.pmcd > 112.26.1.8.38123: Flags [.], seq 45697:47125, ack 1, win 4017, options [nop,nop,TS val 3212112 ecr 2990724,mptcp dss ack 724613416 seq 1583882430 subseq 45697 len 1428 csum 0x5325], length 1428
16:13:11.435482 IP 112.26.1.8.38123 > 112.26.1.1.pmcd: Flags [.], ack 29989, win 11270, options [nop,nop,TS val 2991883 ecr 3211982,nop,nop,sack 2 {44269:47125}{41413:42841},mptcp dss ack 1583766762], length 0
16:13:11.491063 IP 112.26.1.8.38123 > 112.26.1.1.pmcd: Flags [.], ack 14281, win 10722, options [nop,nop,TS val 2991446 ecr 3209787,nop,nop,sack 2 {41413:42841}{35701:39985},mptcp dss ack 1583766762], length 0
16:13:11.580395 IP 112.26.1.1.pmcd > 112.26.1.8.38123: Flags [.], seq 29989:31417, ack 1, win 4017, options [nop,nop,TS val 3212389 ecr 2990985,mptcp dss ack 724613416 seq 1583839590 subseq 29989 len 1428 csum 0xf7a], length 1428
16:13:11.580617 IP 112.26.1.8.38123 > 112.26.1.1.pmcd: Flags [.], ack 31417, win 11452, options [nop,nop,TS val 2992029 ecr 3212389,nop,nop,sack 2 {44269:47125}{41413:42841},mptcp dss ack 1583766762], length 0
16:13:11.638484 IP 112.26.1.8.38123 > 112.26.1.1.pmcd: Flags [.], ack 24277, win 10950, options [nop,nop,TS val 2991619 ecr 3211533,nop,nop,sack 2 {41413:42841}{35701:39985},mptcp dss ack 1583766762], length 0
16:13:11.693247 IP 112.26.1.1.pmcd > 112.26.1.8.38123: Flags [.], seq 31417:32845, ack 1, win 4017, options [nop,nop,TS val 3212564 ecr 2991181,mptcp dss ack 724613416 seq 1583842446 subseq 31417 len 1428 csum 0x39c8], length 1428
16:13:11.693493 IP 112.26.1.8.38123 > 112.26.1.1.pmcd: Flags [.], ack 34273, win 11635, options [nop,nop,TS val 2992142 ecr 3212564,nop,nop,sack 2 {44269:47125}{41413:42841},mptcp dss ack 1583766762], length 0
16:13:11.747555 IP 112.26.1.8.38123 > 112.26.1.1.pmcd: Flags [.], ack 24277, win 11087, options [nop,nop,TS val 2991758 ecr 3211533,nop,nop,sack 2 {44269:45697}{41413:42841},mptcp dss ack 1583766762], length 0
16:13:11.787716 IP 112.26.1.8.38123 > 112.26.1.1.pmcd: Flags [.], ack 29989, win 11179, options [nop,nop,TS val 2991812 ecr 3211982,nop,nop,sack 2 {44269:45697}{41413:42841},mptcp dss ack 1583766762], length 0
16:13:11.851904 IP 112.26.1.1.pmcd > 112.26.1.8.38123: Flags [.], seq 34273:35701, ack 1, win 4017, options [nop,nop,TS val 3212670 ecr 2991261,mptcp dss ack 724613416 seq 1583845302 subseq 34273 len 1428 csum 0x7571], length 1428
16:13:11.852126 IP 112.26.1.8.38123 > 112.26.1.1.pmcd: Flags [.], ack 39985, win 11817, options [nop,nop,TS val 2992300 ecr 3212670,nop,nop,sack 2 {44269:47125}{41413:42841},mptcp dss ack 1583766762], length 0
16:13:11.904154 IP 112.26.1.8.38123 > 112.26.1.1.pmcd: Flags [.], ack 29989, win 11270, options [nop,nop,TS val 2991883 ecr 3211982,nop,nop,sack 2 {44269:47125}{41413:42841},mptcp dss ack 1583766762], length 0
16:13:11.943388 IP 112.26.1.1.pmcd > 112.26.1.8.38123: Flags [.], seq 39985:41413, ack 1, win 4017, options [nop,nop,TS val 3212839 ecr 2991446,mptcp dss ack 724613416 seq 1583861010 subseq 39985 len 1428 csum 0x8ec5], length 1428
16:13:11.943623 IP 112.26.1.8.38123 > 112.26.1.1.pmcd: Flags [.], ack 42841, win 11909, options [nop,nop,TS val 2992392 ecr 3212839,nop,nop,sack 1 {44269:47125},mptcp dss ack 1583766762], length 0
16:13:12.022153 IP 112.26.1.8.38123 > 112.26.1.1.pmcd: Flags [.], ack 31417, win 11452, options [nop,nop,TS val 2992029 ecr 3212389,nop,nop,sack 2 {44269:47125}{41413:42841},mptcp dss ack 1583766762], length 0
16:13:12.099362 IP 112.26.1.1.pmcd > 112.26.1.8.38123: Flags [.], seq 47125:48553, ack 1, win 4017, options [nop,nop,TS val 3212887 ecr 2991446,mptcp dss ack 724613416 seq 1583899566 subseq 47125 len 1428 csum 0xfb], length 1428
16:13:12.099617 IP 112.26.1.8.38123 > 112.26.1.1.pmcd: Flags [.], ack 42841, win 12091, options [nop,nop,TS val 2992548 ecr 3212839,nop,nop,sack 1 {44269:48553},mptcp dss ack 1583786754], length 0
16:13:12.150929 IP 112.26.1.8.38123 > 112.26.1.1.pmcd: Flags [.], ack 34273, win 11635, options [nop,nop,TS val 2992142 ecr 3212564,nop,nop,sack 2 {44269:47125}{41413:42841},mptcp dss ack 1583766762], length 0
16:13:12.192025 IP 112.26.1.1.pmcd > 112.26.1.8.38123: Flags [.], seq 42841:44269, ack 1, win 4017, options [nop,nop,TS val 3212991 ecr 2991619,mptcp dss ack 724613416 seq 1583868150 subseq 42841 len 1428 csum 0x2081], length 1428
16:13:12.192260 IP 112.26.1.8.38123 > 112.26.1.1.pmcd: Flags [.], ack 48553, win 12182, options [nop,nop,TS val 2992640 ecr 3212991,mptcp dss ack 1583786754], length 0
16:13:12.232653 IP 112.26.1.1.pmcd > 112.26.1.8.38123: Flags [.], seq 48553:49981, ack 1, win 4017, options [nop,nop,TS val 3212991 ecr 2991619,mptcp dss ack 724613416 seq 1583903850 subseq 48553 len 1428 csum 0xb948], length 1428
16:13:12.232835 IP 112.26.1.8.38123 > 112.26.1.1.pmcd: Flags [.], ack 49981, win 12274, options [nop,nop,TS val 2992681 ecr 3212991,mptcp dss ack 1583786754], length 0
16:13:12.301154 IP 112.26.1.8.38123 > 112.26.1.1.pmcd: Flags [.], ack 39985, win 11817, options [nop,nop,TS val 2992300 ecr 3212670,nop,nop,sack 2 {44269:47125}{41413:42841},mptcp dss ack 1583766762], length 0
16:13:12.348217 IP 112.26.1.1.pmcd > 112.26.1.8.38123: Flags [.], seq 49981:51409, ack 1, win 4017, options [nop,nop,TS val 3212991 ecr 2991619,mptcp dss ack 724613416 seq 1583905278 subseq 49981 len 1428 csum 0xfab6], length 1428
16:13:12.348450 IP 112.26.1.8.38123 > 112.26.1.1.pmcd: Flags [.], ack 51409, win 12456, options [nop,nop,TS val 2992797 ecr 3212991,mptcp dss ack 1583786754], length 0
16:13:12.413916 IP 112.26.1.8.38123 > 112.26.1.1.pmcd: Flags [.], ack 42841, win 11909, options [nop,nop,TS val 2992392 ecr 3212839,nop,nop,sack 1 {44269:47125},mptcp dss ack 1583766762], length 0
16:13:12.457350 IP 112.26.1.1.pmcd > 112.26.1.8.38123: Flags [.], seq 51409:52837, ack 1, win 4017, options [nop,nop,TS val 3212991 ecr 2991619,mptcp dss ack 724613416 seq 1583906706 subseq 51409 len 1428 csum 0x66c6], length 1428
16:13:12.457587 IP 112.26.1.8.38123 > 112.26.1.1.pmcd: Flags [.], ack 52837, win 12547, options [nop,nop,TS val 2992906 ecr 3212991,mptcp dss ack 1583786754], length 0
16:13:12.511903 IP 112.26.1.8.38123 > 112.26.1.1.pmcd: Flags [.], ack 42841, win 12091, options [nop,nop,TS val 2992548 ecr 3212839,nop,nop,sack 1 {44269:48553},mptcp dss ack 1583786754], length 0
16:13:12.549919 IP 112.26.1.1.pmcd > 112.26.1.8.38123: Flags [.], seq 52837:54265, ack 1, win 4017, options [nop,nop,TS val 3212991 ecr 2991619,mptcp dss ack 724613416 seq 1583908134 subseq 52837 len 1428 csum 0xae9], length 1428
16:13:12.550125 IP 112.26.1.8.38123 > 112.26.1.1.pmcd: Flags [.], ack 54265, win 12684, options [nop,nop,TS val 2992998 ecr 3212991,mptcp dss ack 1583786754], length 0
16:13:12.617868 IP 112.26.1.8.38123 > 112.26.1.1.pmcd: Flags [.], ack 48553, win 12182, options [nop,nop,TS val 2992640 ecr 3212991,mptcp dss ack 1583786754], length 0
16:13:12.662716 IP 112.26.1.1.pmcd > 112.26.1.8.38123: Flags [.], seq 54265:55693, ack 1, win 4017, options [nop,nop,TS val 3213173 ecr 2991758,mptcp dss ack 724613416 seq 1583912418 subseq 54265 len 1428 csum 0x68a8], length 1428
16:13:12.662948 IP 112.26.1.8.38123 > 112.26.1.1.pmcd: Flags [.], ack 55693, win 12775, options [nop,nop,TS val 2993111 ecr 3213173,mptcp dss ack 1583786754], length 0
16:13:12.762242 IP 112.26.1.1.pmcd > 112.26.1.8.38123: Flags [.], seq 55693:57121, ack 1, win 4017, options [nop,nop,TS val 3213173 ecr 2991812,mptcp dss ack 724613416 seq 1583913846 subseq 55693 len 1428 csum 0xe2e6], length 1428
16:13:12.762437 IP 112.26.1.8.38123 > 112.26.1.1.pmcd: Flags [.], ack 57121, win 12958, options [nop,nop,TS val 2993211 ecr 3213173,mptcp dss ack 1583786754], length 0
16:13:12.829635 IP 112.26.1.8.38123 > 112.26.1.1.pmcd: Flags [.], ack 51409, win 12456, options [nop,nop,TS val 2992797 ecr 3212991,mptcp dss ack 1583786754], length 0
16:13:12.898379 IP 112.26.1.1.pmcd > 112.26.1.8.38123: Flags [.], seq 57121:58549, ack 1, win 4017, options [nop,nop,TS val 3213173 ecr 2991812,mptcp dss ack 724613416 seq 1583915274 subseq 57121 len 1428 csum 0x1a39], length 1428
16:13:12.898619 IP 112.26.1.8.38123 > 112.26.1.1.pmcd: Flags [.], ack 58549, win 13095, options [nop,nop,TS val 2993347 ecr 3213173,mptcp dss ack 1583786754], length 0
16:13:12.951927 IP 112.26.1.8.38123 > 112.26.1.1.pmcd: Flags [.], ack 52837, win 12547, options [nop,nop,TS val 2992906 ecr 3212991,mptcp dss ack 1583786754], length 0
16:13:13.017511 IP 112.26.1.1.pmcd > 112.26.1.8.38123: Flags [.], seq 58549:59977, ack 1, win 4017, options [nop,nop,TS val 3213280 ecr 2991883,mptcp dss ack 724613416 seq 1583919558 subseq 58549 len 1428 csum 0x41f5], length 1428
16:13:13.017725 IP 112.26.1.8.38123 > 112.26.1.1.pmcd: Flags [.], ack 59977, win 13277, options [nop,nop,TS val 2993466 ecr 3213280,mptcp dss ack 1583786754], length 0
16:13:13.106765 IP 112.26.1.1.pmcd > 112.26.1.8.38123: Flags [.], seq 59977:61405, ack 1, win 4017, options [nop,nop,TS val 3213370 ecr 2992029,mptcp dss ack 724613416 seq 1583925270 subseq 59977 len 1428 csum 0x95fa], length 1428
16:13:13.107011 IP 112.26.1.8.38123 > 112.26.1.1.pmcd: Flags [.], ack 61405, win 13369, options [nop,nop,TS val 2993555 ecr 3213370,mptcp dss ack 1583786754], length 0
16:13:13.164949 IP 112.26.1.8.38123 > 112.26.1.1.pmcd: Flags [.], ack 55693, win 12775, options [nop,nop,TS val 2993111 ecr 3213173,mptcp dss ack 1583786754], length 0
16:13:13.250257 IP 112.26.1.1.pmcd > 112.26.1.8.38123: Flags [.], seq 61405:62833, ack 1, win 4017, options [nop,nop,TS val 3213511 ecr 2992142,mptcp dss ack 724613416 seq 1583928126 subseq 61405 len 1428 csum 0x6f8a], length 1428
16:13:13.250507 IP 112.26.1.8.38123 > 112.26.1.1.pmcd: Flags [.], ack 62833, win 13551, options [nop,nop,TS val 2993699 ecr 3213511,mptcp dss ack 1583786754], length 0
16:13:13.339575 IP 112.26.1.1.pmcd > 112.26.1.8.38123: Flags [.], seq 62833:64261, ack 1, win 4017, options [nop,nop,TS val 3213663 ecr 2992300,mptcp dss ack 724613416 seq 1583938122 subseq 62833 len 1428 csum 0x9e25], length 1428
16:13:13.339822 IP 112.26.1.8.38123 > 112.26.1.1.pmcd: Flags [.], ack 64261, win 13642, options [nop,nop,TS val 2993788 ecr 3213663,mptcp dss ack 1583786754], length 0
16:13:13.399221 IP 112.26.1.1.pmcd > 112.26.1.8.38123: Flags [.], seq 64261:65689, ack 1, win 4017, options [nop,nop,TS val 3213767 ecr 2992392,mptcp dss ack 724613416 seq 1583940978 subseq 64261 len 1428 csum 0xc1f6], length 1428
16:13:13.399404 IP 112.26.1.8.38123 > 112.26.1.1.pmcd: Flags [.], ack 65689, win 13688, options [nop,nop,TS val 2993848 ecr 3213767,mptcp dss ack 1583786754], length 0
16:13:13.470238 IP 112.26.1.1.pmcd > 112.26.1.8.38123: Flags [.], seq 65689:67117, ack 1, win 4017, options [nop,nop,TS val 3213902 ecr 2992548,mptcp dss ack 724613416 seq 1583948118 subseq 65689 len 1428 csum 0x7f85], length 1428
16:13:13.470431 IP 112.26.1.8.38123 > 112.26.1.1.pmcd: Flags [.], ack 67117, win 13779, options [nop,nop,TS val 2993919 ecr 3213902,mptcp dss ack 1583786754], length 0
16:13:13.585748 IP 112.26.1.1.pmcd > 112.26.1.8.38123: Flags [.], seq 67117:68545, ack 1, win 4017, options [nop,nop,TS val 3213965 ecr 2992640,mptcp dss ack 724613416 seq 1583952402 subseq 67117 len 1428 csum 0xe36e], length 1428
16:13:13.585954 IP 112.26.1.8.38123 > 112.26.1.1.pmcd: Flags [.], ack 68545, win 13962, options [nop,nop,TS val 2994034 ecr 3213965,mptcp dss ack 1583789610], length 0
16:13:13.641821 IP 112.26.1.8.38123 > 112.26.1.1.pmcd: Flags [.], ack 61405, win 13369, options [nop,nop,TS val 2993555 ecr 3213370,mptcp dss ack 1583786754], length 0
16:13:13.771582 IP 112.26.1.1.pmcd > 112.26.1.8.38123: Flags [.], seq 69973:71401, ack 1, win 4017, options [nop,nop,TS val 3214177 ecr 2992797,mptcp dss ack 724613416 seq 1583959542 subseq 69973 len 1428 csum 0x7b59], length 1428
16:13:13.771774 IP 112.26.1.8.38123 > 112.26.1.1.pmcd: Flags [.], ack 68545, win 14099, options [nop,nop,TS val 2994220 ecr 3213965,nop,nop,sack 1 {69973:71401},mptcp dss ack 1583789610], length 0
16:13:13.849106 IP 112.26.1.8.38123 > 112.26.1.1.pmcd: Flags [.], ack 64261, win 13642, options [nop,nop,TS val 2993788 ecr 3213663,mptcp dss ack 1583786754], length 0
16:13:13.918064 IP 112.26.1.8.38123 > 112.26.1.1.pmcd: Flags [.], ack 65689, win 13688, options [nop,nop,TS val 2993848 ecr 3213767,mptcp dss ack 1583786754], length 0
16:13:14.062210 IP 112.26.1.1.pmcd > 112.26.1.8.38123: Flags [.], seq 72829:74257, ack 1, win 4017, options [nop,nop,TS val 3214303 ecr 2992906,mptcp dss ack 724613416 seq 1583966682 subseq 72829 len 1428 csum 0x191c], length 1428
16:13:14.062435 IP 112.26.1.8.38123 > 112.26.1.1.pmcd: Flags [.], ack 68545, win 14327, options [nop,nop,TS val 2994511 ecr 3213965,nop,nop,sack 2 {72829:74257}{69973:71401},mptcp dss ack 1583789610], length 0
16:13:14.132532 IP 112.26.1.1.pmcd > 112.26.1.8.38123: Flags [.], seq 74257:75685, ack 1, win 4017, options [nop,nop,TS val 3214512 ecr 2993111,mptcp dss ack 724613416 seq 1583970966 subseq 74257 len 1428 csum 0xbbef], length 1428
16:13:14.132778 IP 112.26.1.8.38123 > 112.26.1.1.pmcd: Flags [.], ack 68545, win 14464, options [nop,nop,TS val 2994581 ecr 3213965,nop,nop,sack 2 {72829:75685}{69973:71401},mptcp dss ack 1583858154], length 0
16:13:14.187423 IP 112.26.1.1.pmcd > 112.26.1.8.38123: Flags [.], seq 77113:78541, ack 1, win 4017, options [nop,nop,TS val 3214512 ecr 2993111,mptcp dss ack 724613416 seq 1583973822 subseq 77113 len 1428 csum 0xeba3], length 1428
16:13:14.187654 IP 112.26.1.8.38123 > 112.26.1.1.pmcd: Flags [.], ack 68545, win 14509, options [nop,nop,TS val 2994636 ecr 3213965,nop,nop,sack 2 {77113:78541}{72829:75685},mptcp dss ack 1583858154], length 0
16:13:14.280482 IP 112.26.1.8.38123 > 112.26.1.1.pmcd: Flags [.], ack 68545, win 14099, options [nop,nop,TS val 2994220 ecr 3213965,nop,nop,sack 1 {69973:71401},mptcp dss ack 1583789610], length 0
16:13:14.333271 IP 112.26.1.1.pmcd > 112.26.1.8.38123: Flags [.], seq 78541:79969, ack 1, win 4017, options [nop,nop,TS val 3214996 ecr 2993555,mptcp dss ack 724613416 seq 1583982390 subseq 78541 len 1428 csum 0x2512], length 1428
16:13:14.333579 IP 112.26.1.8.38123 > 112.26.1.1.pmcd: Flags [.], ack 68545, win 14646, options [nop,nop,TS val 2994782 ecr 3213965,nop,nop,sack 2 {77113:79969}{72829:75685},mptcp dss ack 1583858154], length 0
16:13:14.399748 IP 112.26.1.1.pmcd > 112.26.1.8.38123: Flags [.], seq 79969:81397, ack 1, win 4017, options [nop,nop,TS val 3214996 ecr 2993555,mptcp dss ack 724613416 seq 1583983818 subseq 79969 len 1428 csum 0x51c5], length 1428
16:13:14.399967 IP 112.26.1.8.38123 > 112.26.1.1.pmcd: Flags [.], ack 68545, win 14783, options [nop,nop,TS val 2994848 ecr 3213965,nop,nop,sack 2 {77113:81397}{72829:75685},mptcp dss ack 1583935266], length 0
16:13:14.490288 IP 112.26.1.8.38123 > 112.26.1.1.pmcd: Flags [.], ack 68545, win 14327, options [nop,nop,TS val 2994511 ecr 3213965,nop,nop,sack 2 {72829:74257}{69973:71401},mptcp dss ack 1583789610], length 0
16:13:14.555718 IP 112.26.1.8.38123 > 112.26.1.1.pmcd: Flags [.], ack 68545, win 14464, options [nop,nop,TS val 2994581 ecr 3213965,nop,nop,sack 2 {72829:75685}{69973:71401},mptcp dss ack 1583858154], length 0
16:13:14.633576 IP 112.26.1.1.pmcd > 112.26.1.8.38123: Flags [.], seq 81397:82825, ack 1, win 4017, options [nop,nop,TS val 3214996 ecr 2993555,mptcp dss ack 724613416 seq 1583985246 subseq 81397 len 1428 csum 0x8343], length 1428
16:13:14.633813 IP 112.26.1.8.38123 > 112.26.1.1.pmcd: Flags [.], ack 68545, win 15011, options [nop,nop,TS val 2995082 ecr 3213965,nop,nop,sack 2 {77113:82825}{72829:75685},mptcp dss ack 1583935266], length 0
16:13:14.680706 IP 112.26.1.8.38123 > 112.26.1.1.pmcd: Flags [.], ack 68545, win 14509, options [nop,nop,TS val 2994636 ecr 3213965,nop,nop,sack 2 {77113:78541}{72829:75685},mptcp dss ack 1583858154], length 0
16:13:14.777104 IP 112.26.1.1.pmcd > 112.26.1.8.38123: Flags [.], seq 84253:85681, ack 1, win 4017, options [nop,nop,TS val 3214996 ecr 2993555,mptcp dss ack 724613416 seq 1583988102 subseq 84253 len 1428 csum 0xbbd3], length 1428
16:13:14.777310 IP 112.26.1.8.38123 > 112.26.1.1.pmcd: Flags [.], ack 68545, win 15194, options [nop,nop,TS val 2995225 ecr 3213965,nop,nop,sack 2 {84253:85681}{77113:82825},mptcp dss ack 1583936694], length 0
16:13:14.861932 IP 112.26.1.1.pmcd > 112.26.1.8.38123: Flags [.], seq 85681:87109, ack 1, win 4017, options [nop,nop,TS val 3215210 ecr 2993788,mptcp dss ack 724613416 seq 1583996670 subseq 85681 len 1428 csum 0x2d06], length 1428
16:13:14.862171 IP 112.26.1.8.38123 > 112.26.1.1.pmcd: Flags [.], ack 68545, win 15330, options [nop,nop,TS val 2995310 ecr 3213965,nop,nop,sack 2 {84253:87109}{77113:82825},mptcp dss ack 1583945262], length 0
16:13:14.917999 IP 112.26.1.1.pmcd > 112.26.1.8.38123: Flags [.], seq 87109:88537, ack 1, win 4017, options [nop,nop,TS val 3215210 ecr 2993788,mptcp dss ack 724613416 seq 1583998098 subseq 87109 len 1428 csum 0x5e83], length 1428
16:13:14.918196 IP 112.26.1.8.38123 > 112.26.1.1.pmcd: Flags [.], ack 68545, win 15422, options [nop,nop,TS val 2995366 ecr 3213965,nop,nop,sack 2 {84253:88537}{77113:82825},mptcp dss ack 1583945262], length 0
16:13:14.973668 IP 112.26.1.1.pmcd > 112.26.1.8.38123: Flags [.], seq 88537:89965, ack 1, win 4017, options [nop,nop,TS val 3215276 ecr 2993848,mptcp dss ack 724613416 seq 1583999526 subseq 88537 len 1428 csum 0x257d], length 1428
16:13:14.973858 IP 112.26.1.8.38123 > 112.26.1.1.pmcd: Flags [.], ack 68545, win 15559, options [nop,nop,TS val 2995422 ecr 3213965,nop,nop,sack 2 {84253:89965}{77113:82825},mptcp dss ack 1583945262], length 0
16:13:15.005751 IP 112.26.1.1.pmcd > 112.26.1.8.38123: Flags [.], seq 89965:91393, ack 1, win 4017, options [nop,nop,TS val 3215633 ecr 2994220,mptcp dss ack 724613416 seq 1584010950 subseq 89965 len 1428 csum 0xa988], length 1428
16:13:15.005942 IP 112.26.1.8.38123 > 112.26.1.1.pmcd: Flags [.], ack 68545, win 15604, options [nop,nop,TS val 2995454 ecr 3213965,nop,nop,sack 2 {84253:91393}{77113:82825},mptcp dss ack 1583945262], length 0
16:13:15.068128 IP 112.26.1.8.38123 > 112.26.1.1.pmcd: Flags [.], ack 68545, win 15011, options [nop,nop,TS val 2995082 ecr 3213965,nop,nop,sack 2 {77113:82825}{72829:75685},mptcp dss ack 1583935266], length 0
16:13:15.103959 IP 112.26.1.1.pmcd > 112.26.1.8.38123: Flags [.], seq 91393:92821, ack 1, win 4017, options [nop,nop,TS val 3215633 ecr 2994220,mptcp dss ack 724613416 seq 1584012378 subseq 91393 len 1428 csum 0x951f], length 1428
16:13:15.104187 IP 112.26.1.8.38123 > 112.26.1.1.pmcd: Flags [.], ack 68545, win 15695, options [nop,nop,TS val 2995552 ecr 3213965,nop,nop,sack 2 {84253:92821}{77113:82825},mptcp dss ack 1583945262], length 0
16:13:15.170141 IP 112.26.1.1.pmcd > 112.26.1.8.38123: Flags [.], seq 92821:94249, ack 1, win 4017, options [nop,nop,TS val 3215633 ecr 2994220,mptcp dss ack 724613416 seq 1584013806 subseq 92821 len 1428 csum 0x28a8], length 1428
16:13:15.170363 IP 112.26.1.8.38123 > 112.26.1.1.pmcd: Flags [.], ack 68545, win 15878, options [nop,nop,TS val 2995619 ecr 3213965,nop,nop,sack 2 {84253:94249}{77113:82825},mptcp dss ack 1583945262], length 0
16:13:15.206624 IP 112.26.1.1.pmcd > 112.26.1.8.38123: Flags [.], seq 68545:69973, ack 1, win 4017, options [nop,nop,TS val 3215839 ecr 2994511,mptcp dss ack 724613416 seq 1583958114 subseq 68545 len 1428 csum 0x4afe], length 1428
16:13:15.206850 IP 112.26.1.8.38123 > 112.26.1.1.pmcd: Flags [.], ack 71401, win 15924, options [nop,nop,TS val 2995655 ecr 3215839,nop,nop,sack 2 {84253:94249}{77113:82825},mptcp dss ack 1583945262], length 0
16:13:15.265569 IP 112.26.1.8.38123 > 112.26.1.1.pmcd: Flags [.], ack 68545, win 15194, options [nop,nop,TS val 2995225 ecr 3213965,nop,nop,sack 2 {84253:85681}{77113:82825},mptcp dss ack 1583936694], length 0
16:13:15.320798 IP 112.26.1.1.pmcd > 112.26.1.8.38123: Flags [.], seq 71401:72829, ack 1, win 4017, options [nop,nop,TS val 3215929 ecr 2994581,mptcp dss ack 724613416 seq 1583965254 subseq 71401 len 1428 csum 0x6a0d], length 1428
16:13:15.321039 IP 112.26.1.8.38123 > 112.26.1.1.pmcd: Flags [.], ack 75685, win 16015, options [nop,nop,TS val 2995769 ecr 3215929,nop,nop,sack 2 {84253:94249}{77113:82825},mptcp dss ack 1583945262], length 0
16:13:15.372900 IP 112.26.1.8.38123 > 112.26.1.1.pmcd: Flags [.], ack 68545, win 15422, options [nop,nop,TS val 2995366 ecr 3213965,nop,nop,sack 2 {84253:88537}{77113:82825},mptcp dss ack 1583945262], length 0
16:13:15.397094 IP 112.26.1.8.38123 > 112.26.1.1.pmcd: Flags [.], ack 68545, win 15559, options [nop,nop,TS val 2995422 ecr 3213965,nop,nop,sack 2 {84253:89965}{77113:82825},mptcp dss ack 1583945262], length 0
16:13:15.445716 IP 112.26.1.8.38123 > 112.26.1.1.pmcd: Flags [.], ack 68545, win 15604, options [nop,nop,TS val 2995454 ecr 3213965,nop,nop,sack 2 {84253:91393}{77113:82825},mptcp dss ack 1583945262], length 0
16:13:15.466009 IP 112.26.1.1.pmcd > 112.26.1.8.38123: Flags [.], seq 75685:77113, ack 1, win 4017, options [nop,nop,TS val 3216416 ecr 2995082,mptcp dss ack 724613416 seq 1583972394 subseq 75685 len 1428 csum 0x43a7], length 1428
16:13:15.466241 IP 112.26.1.8.38123 > 112.26.1.1.pmcd: Flags [.], ack 82825, win 16152, options [nop,nop,TS val 2995914 ecr 3216416,nop,nop,sack 1 {84253:94249},mptcp dss ack 1583945262], length 0
16:13:15.500044 IP 112.26.1.8.38123 > 112.26.1.1.pmcd: Flags [.], ack 68545, win 15695, options [nop,nop,TS val 2995552 ecr 3213965,nop,nop,sack 2 {84253:92821}{77113:82825},mptcp dss ack 1583945262], length 0
16:13:15.562348 IP 112.26.1.8.38123 > 112.26.1.1.pmcd: Flags [.], ack 68545, win 15878, options [nop,nop,TS val 2995619 ecr 3213965,nop,nop,sack 2 {84253:94249}{77113:82825},mptcp dss ack 1583945262], length 0
16:13:15.590021 IP 112.26.1.8.38123 > 112.26.1.1.pmcd: Flags [.], ack 71401, win 15924, options [nop,nop,TS val 2995655 ecr 3215839,nop,nop,sack 2 {84253:94249}{77113:82825},mptcp dss ack 1583945262], length 0
16:13:15.662139 IP 112.26.1.1.pmcd > 112.26.1.8.38123: Flags [.], seq 82825:84253, ack 1, win 4017, options [nop,nop,TS val 3216613 ecr 2995225,mptcp dss ack 724613416 seq 1583986674 subseq 82825 len 1428 csum 0xc29b], length 1428
16:13:15.662371 IP 112.26.1.8.38123 > 112.26.1.1.pmcd: Flags [.], ack 94249, win 16380, options [nop,nop,TS val 2996111 ecr 3216613,mptcp dss ack 1583945262], length 0
16:13:15.765363 IP 112.26.1.8.38123 > 112.26.1.1.pmcd: Flags [.], ack 75685, win 16015, options [nop,nop,TS val 2995769 ecr 3215929,nop,nop,sack 2 {84253:94249}{77113:82825},mptcp dss ack 1583945262], length 0
16:13:15.850242 IP 112.26.1.1.pmcd > 112.26.1.8.38123: Flags [.], seq 94249:95677, ack 1, win 4017, options [nop,nop,TS val 3216738 ecr 2995366,mptcp dss ack 724613416 seq 1584039510 subseq 94249 len 1428 csum 0xfd99], length 1428
16:13:15.850574 IP 112.26.1.8.38123 > 112.26.1.1.pmcd: Flags [.], ack 95677, win 16517, options [nop,nop,TS val 2996299 ecr 3216738,mptcp dss ack 1583945262], length 0
16:13:15.952884 IP 112.26.1.8.38123 > 112.26.1.1.pmcd: Flags [.], ack 82825, win 16152, options [nop,nop,TS val 2995914 ecr 3216416,nop,nop,sack 1 {84253:94249},mptcp dss ack 1583945262], length 0
16:13:16.000129 IP 112.26.1.1.pmcd > 112.26.1.8.38123: Flags [.], seq 95677:97105, ack 1, win 4017, options [nop,nop,TS val 3216738 ecr 2995366,mptcp dss ack 724613416 seq 1584040938 subseq 95677 len 1428 csum 0xc2b4], length 1428
16:13:16.000361 IP 112.26.1.8.38123 > 112.26.1.1.pmcd: Flags [.], ack 97105, win 16699, options [nop,nop,TS val 2996449 ecr 3216738,mptcp dss ack 1583945262], length 0
16:13:16.067319 IP 112.26.1.1.pmcd > 112.26.1.8.38123: Flags [.], seq 97105:98533, ack 1, win 4017, options [nop,nop,TS val 3216761 ecr 2995422,mptcp dss ack 724613416 seq 1584043794 subseq 97105 len 1428 csum 0xd96e], length 1428
