16:13:07.935001 IP 112.26.1.8.38123 > 112.26.1.1.pmcd: Flags [S], seq 1072362572, win 65535, options [mss 1460,sackOK,TS val 2988377 ecr 0,nop,wscale 6,mptcp join id 3 token 0x6673cfeb nonce 0x369cea28], length 0
16:13:07.938222 IP 112.26.1.8.38123 > 112.26.1.1.pmcd: Flags [S], seq 1072362572, win 65535, options [mss 1460,sackOK,TS val 2988377 ecr 0,nop,wscale 6,mptcp join id 3 token 0x6673cfeb nonce 0x369cea28], length 0
16:13:07.941051 IP 112.26.1.8.38123 > 112.26.1.1.pmcd: Flags [S], seq 1072362572, win 65535, options [mss 1460,sackOK,TS val 2988377 ecr 0,nop,wscale 6,mptcp join id 3 token 0x6673cfeb nonce 0x369cea28], length 0
16:13:08.037049 IP 112.26.1.1.pmcd > 112.26.1.8.38123: Flags [S.], seq 324059165, ack 1072362573, win 65535, options [mss 1460,sackOK,TS val 3209287 ecr 2988377,nop,wscale 6,mptcp join id 3 hmac 0xd3dd4e0191341a6f nonce 0x53b6a931], length 0
16:13:08.039609 IP 112.26.1.1.pmcd > 112.26.1.8.38123: Flags [S.], seq 324059165, ack 1072362573, win 65535, options [mss 1460,sackOK,TS val 3209287 ecr 2988377,nop,wscale 6,mptcp join id 3 hmac 0xd3dd4e0191341a6f nonce 0x53b6a931], length 0
16:13:08.041159 IP 112.26.1.8.38123 > 112.26.1.1.pmcd: Flags [.], ack 1, win 7665, options [nop,nop,TS val 2988488 ecr 3209287,mptcp join hmac 0x01d69c3b375552c3c050fd1b9c8493207da8daf5], length 0
16:13:08.148897 IP 112.26.1.8.38123 > 112.26.1.1.pmcd: Flags [.], ack 1, win 7665, options [nop,nop,TS val 2988488 ecr 3209287,mptcp join hmac 0x01d69c3b375552c3c050fd1b9c8493207da8daf5], length 0
16:13:08.152443 IP 112.26.1.8.38123 > 112.26.1.1.pmcd: Flags [.], ack 1, win 7665, options [nop,nop,TS val 2988488 ecr 3209287,mptcp join hmac 0x01d69c3b375552c3c050fd1b9c8493207da8daf5], length 0
16:13:08.163420 IP 112.26.1.1.pmcd > 112.26.1.8.38123: Flags [.], ack 1, win 4017, options [nop,nop,TS val 3209498 ecr 2988488,mptcp dss ack 724613416], length 0
16:13:08.210817 IP 112.26.1.1.pmcd > 112.26.1.8.38123: Flags [.], ack 1, win 4017, options [nop,nop,TS val 3209498 ecr 2988488,mptcp dss ack 724613416], length 0
16:13:08.231412 IP 112.26.1.1.pmcd > 112.26.1.8.38123: Flags [.], seq 1:1429, ack 1, win 4017, options [nop,nop,TS val 3209560 ecr 2988488,mptcp dss ack 724613416 seq 1583772474 subseq 1 len 1428 csum 0xea0c], length 1428
16:13:08.286882 IP 112.26.1.1.pmcd > 112.26.1.8.38123: Flags [.], seq 1:1429, ack 1, win 4017, options [nop,nop,TS val 3209560 ecr 2988488,mptcp dss ack 724613416 seq 1583772474 subseq 1 len 1428 csum 0xea0c], length 1428
16:13:08.289398 IP 112.26.1.8.38123 > 112.26.1.1.pmcd: Flags [.], ack 1429, win 7757, options [nop,nop,TS val 2988736 ecr 3209560,mptcp dss ack 1583755338], length 0
16:13:08.369157 IP 112.26.1.1.pmcd > 112.26.1.8.38123: Flags [.], seq 1429:2857, ack 1, win 4017, options [nop,nop,TS val 3209560 ecr 2988488,mptcp dss ack 724613416 seq 1583773902 subseq 1429 len 1428 csum 0xe07a], length 1428
16:13:08.439490 IP 112.26.1.8.38123 > 112.26.1.1.pmcd: Flags [.], ack 1429, win 7757, options [nop,nop,TS val 2988736 ecr 3209560,mptcp dss ack 1583755338], length 0
16:13:08.440765 IP 112.26.1.8.38123 > 112.26.1.1.pmcd: Flags [.], ack 1429, win 7757, options [nop,nop,TS val 2988736 ecr 3209560,mptcp dss ack 1583755338], length 0
16:13:08.466823 IP 112.26.1.1.pmcd > 112.26.1.8.38123: Flags [.], seq 2857:4285, ack 1, win 4017, options [nop,nop,TS val 3209560 ecr 2988488,mptcp dss ack 724613416 seq 1583775330 subseq 2857 len 1428 csum 0xe523], length 1428
16:13:08.484315 IP 112.26.1.1.pmcd > 112.26.1.8.38123: Flags [.], seq 1429:2857, ack 1, win 4017, options [nop,nop,TS val 3209560 ecr 2988488,mptcp dss ack 724613416 seq 1583773902 subseq 1429 len 1428 csum 0xe07a], length 1428
16:13:08.486190 IP 112.26.1.8.38123 > 112.26.1.1.pmcd: Flags [.], ack 2857, win 7894, options [nop,nop,TS val 2988933 ecr 3209560,mptcp dss ack 1583756766], length 0
16:13:08.519695 IP 112.26.1.1.pmcd > 112.26.1.8.38123: Flags [.], seq 2857:4285, ack 1, win 4017, options [nop,nop,TS val 3209560 ecr 2988488,mptcp dss ack 724613416 seq 1583775330 subseq 2857 len 1428 csum 0xe523], length 1428
16:13:08.543918 IP 112.26.1.8.38123 > 112.26.1.1.pmcd: Flags [.], ack 4285, win 7939, options [nop,nop,TS val 2988968 ecr 3209560,mptcp dss ack 1583756766], length 0
16:13:08.625469 IP 112.26.1.8.38123 > 112.26.1.1.pmcd: Flags [.], ack 2857, win 7894, options [nop,nop,TS val 2988933 ecr 3209560,mptcp dss ack 1583756766], length 0
16:13:08.645835 IP 112.26.1.8.38123 > 112.26.1.1.pmcd: Flags [.], ack 2857, win 7894, options [nop,nop,TS val 2988933 ecr 3209560,mptcp dss ack 1583756766], length 0
16:13:08.660458 IP 112.26.1.1.pmcd > 112.26.1.8.38123: Flags [.], seq 4285:5713, ack 1, win 4017, options [nop,nop,TS val 3209560 ecr 2988488,mptcp dss ack 724613416 seq 1583776758 subseq 4285 len 1428 csum 0x27ea], length 1428
16:13:08.704213 IP 112.26.1.8.38123 > 112.26.1.1.pmcd: Flags [.], ack 4285, win 7939, options [nop,nop,TS val 2988968 ecr 3209560,mptcp dss ack 1583756766], length 0
16:13:08.748364 IP 112.26.1.1.pmcd > 112.26.1.8.38123: Flags [.], seq 5713:7141, ack 1, win 4017, options [nop,nop,TS val 3209561 ecr 2988488,mptcp dss ack 724613416 seq 1583778186 subseq 5713 len 1428 csum 0x185d], length 1428
16:13:08.753966 IP 112.26.1.1.pmcd > 112.26.1.8.38123: Flags [.], seq 4285:5713, ack 1, win 4017, options [nop,nop,TS val 3209560 ecr 2988488,mptcp dss ack 724613416 seq 1583776758 subseq 4285 len 1428 csum 0x27ea], length 1428
16:13:08.755155 IP 112.26.1.8.38123 > 112.26.1.1.pmcd: Flags [.], ack 5713, win 8122, options [nop,nop,TS val 2989203 ecr 3209560,mptcp dss ack 1583761050], length 0
16:13:08.765044 IP 112.26.1.8.38123 > 112.26.1.1.pmcd: Flags [.], ack 4285, win 7939, options [nop,nop,TS val 2988968 ecr 3209560,mptcp dss ack 1583756766], length 0
16:13:08.826170 IP 112.26.1.1.pmcd > 112.26.1.8.38123: Flags [.], seq 5713:7141, ack 1, win 4017, options [nop,nop,TS val 3209561 ecr 2988488,mptcp dss ack 724613416 seq 1583778186 subseq 5713 len 1428 csum 0x185d], length 1428
16:13:08.827511 IP 112.26.1.8.38123 > 112.26.1.1.pmcd: Flags [.], ack 7141, win 8167, options [nop,nop,TS val 2989275 ecr 3209561,mptcp dss ack 1583761050], length 0
16:13:08.860341 IP 112.26.1.1.pmcd > 112.26.1.8.38123: Flags [.], seq 7141:8569, ack 1, win 4017, options [nop,nop,TS val 3209787 ecr 2988488,mptcp dss ack 724613416 seq 1583796750 subseq 7141 len 1428 csum 0x768f], length 1428
16:13:08.887010 IP 112.26.1.8.38123 > 112.26.1.1.pmcd: Flags [.], ack 5713, win 8122, options [nop,nop,TS val 2989203 ecr 3209560,mptcp dss ack 1583761050], length 0
16:13:08.893019 IP 112.26.1.8.38123 > 112.26.1.1.pmcd: Flags [.], ack 5713, win 8122, options [nop,nop,TS val 2989203 ecr 3209560,mptcp dss ack 1583761050], length 0
16:13:08.951064 IP 112.26.1.8.38123 > 112.26.1.1.pmcd: Flags [.], ack 7141, win 8167, options [nop,nop,TS val 2989275 ecr 3209561,mptcp dss ack 1583761050], length 0
16:13:08.958405 IP 112.26.1.1.pmcd > 112.26.1.8.38123: Flags [.], seq 8569:9997, ack 1, win 4017, options [nop,nop,TS val 3209787 ecr 2988488,mptcp dss ack 724613416 seq 1583798178 subseq 8569 len 1428 csum 0xf6d8], length 1428
16:13:08.981741 IP 112.26.1.8.38123 > 112.26.1.1.pmcd: Flags [.], ack 7141, win 8167, options [nop,nop,TS val 2989275 ecr 3209561,mptcp dss ack 1583761050], length 0
16:13:09.034416 IP 112.26.1.1.pmcd > 112.26.1.8.38123: Flags [.], seq 7141:8569, ack 1, win 4017, options [nop,nop,TS val 3209787 ecr 2988488,mptcp dss ack 724613416 seq 1583796750 subseq 7141 len 1428 csum 0x768f], length 1428
16:13:09.035719 IP 112.26.1.8.38123 > 112.26.1.1.pmcd: Flags [.], ack 8569, win 8350, options [nop,nop,TS val 2989483 ecr 3209787,mptcp dss ack 1583763906], length 0
16:13:09.082534 IP 112.26.1.1.pmcd > 112.26.1.8.38123: Flags [.], seq 9997:11425, ack 1, win 4017, options [nop,nop,TS val 3209787 ecr 2988736,mptcp dss ack 724613416 seq 1583799606 subseq 9997 len 1428 csum 0xd90d], length 1428
16:13:09.099876 IP 112.26.1.1.pmcd > 112.26.1.8.38123: Flags [.], seq 8569:9997, ack 1, win 4017, options [nop,nop,TS val 3209787 ecr 2988488,mptcp dss ack 724613416 seq 1583798178 subseq 8569 len 1428 csum 0xf6d8], length 1428
16:13:09.115143 IP 112.26.1.8.38123 > 112.26.1.1.pmcd: Flags [.], ack 9997, win 8441, options [nop,nop,TS val 2989549 ecr 3209787,mptcp dss ack 1583763906], length 0
16:13:09.159020 IP 112.26.1.1.pmcd > 112.26.1.8.38123: Flags [.], seq 11425:12853, ack 1, win 4017, options [nop,nop,TS val 3209787 ecr 2988736,mptcp dss ack 724613416 seq 1583801034 subseq 11425 len 1428 csum 0xb8ec], length 1428
16:13:09.163366 IP 112.26.1.8.38123 > 112.26.1.1.pmcd: Flags [.], ack 8569, win 8350, options [nop,nop,TS val 2989483 ecr 3209787,mptcp dss ack 1583763906], length 0
16:13:09.165373 IP 112.26.1.8.38123 > 112.26.1.1.pmcd: Flags [.], ack 8569, win 8350, options [nop,nop,TS val 2989483 ecr 3209787,mptcp dss ack 1583763906], length 0
16:13:09.228575 IP 112.26.1.1.pmcd > 112.26.1.8.38123: Flags [.], seq 9997:11425, ack 1, win 4017, options [nop,nop,TS val 3209787 ecr 2988736,mptcp dss ack 724613416 seq 1583799606 subseq 9997 len 1428 csum 0xd90d], length 1428
16:13:09.230226 IP 112.26.1.8.38123 > 112.26.1.1.pmcd: Flags [.], ack 11425, win 8578, options [nop,nop,TS val 2989677 ecr 3209787,mptcp dss ack 1583763906], length 0
16:13:09.282965 IP 112.26.1.8.38123 > 112.26.1.1.pmcd: Flags [.], ack 9997, win 8441, options [nop,nop,TS val 2989549 ecr 3209787,mptcp dss ack 1583763906], length 0
16:13:09.296067 IP 112.26.1.8.38123 > 112.26.1.1.pmcd: Flags [.], ack 9997, win 8441, options [nop,nop,TS val 2989549 ecr 3209787,mptcp dss ack 1583763906], length 0
16:13:09.322852 IP 112.26.1.1.pmcd > 112.26.1.8.38123: Flags [.], seq 12853:14281, ack 1, win 4017, options [nop,nop,TS val 3209787 ecr 2988736,mptcp dss ack 724613416 seq 1583802462 subseq 12853 len 1428 csum 0xaa0a], length 1428
16:13:09.352171 IP 112.26.1.1.pmcd > 112.26.1.8.38123: Flags [.], seq 11425:12853, ack 1, win 4017, options [nop,nop,TS val 3209787 ecr 2988736,mptcp dss ack 724613416 seq 1583801034 subseq 11425 len 1428 csum 0xb8ec], length 1428
16:13:09.355870 IP 112.26.1.8.38123 > 112.26.1.1.pmcd: Flags [.], ack 12853, win 8760, options [nop,nop,TS val 2989801 ecr 3209787,mptcp dss ack 1583763906], length 0
16:13:09.381520 IP 112.26.1.1.pmcd > 112.26.1.8.38123: Flags [.], seq 17137:18565, ack 1, win 4017, options [nop,nop,TS val 3209992 ecr 2988933,mptcp dss ack 724613416 seq 1583811030 subseq 17137 len 1428 csum 0x2152], length 1428
16:13:09.426029 IP 112.26.1.8.38123 > 112.26.1.1.pmcd: Flags [.], ack 11425, win 8578, options [nop,nop,TS val 2989677 ecr 3209787,mptcp dss ack 1583763906], length 0
16:13:09.433940 IP 112.26.1.8.38123 > 112.26.1.1.pmcd: Flags [.], ack 11425, win 8578, options [nop,nop,TS val 2989677 ecr 3209787,mptcp dss ack 1583763906], length 0
16:13:09.446875 IP 112.26.1.1.pmcd > 112.26.1.8.38123: Flags [.], seq 12853:14281, ack 1, win 4017, options [nop,nop,TS val 3209787 ecr 2988736,mptcp dss ack 724613416 seq 1583802462 subseq 12853 len 1428 csum 0xaa0a], length 1428
16:13:09.448768 IP 112.26.1.8.38123 > 112.26.1.1.pmcd: Flags [.], ack 14281, win 8897, options [nop,nop,TS val 2989895 ecr 3209787,mptcp dss ack 1583763906], length 0
16:13:09.481886 IP 112.26.1.1.pmcd > 112.26.1.8.38123: Flags [.], seq 18565:19993, ack 1, win 4017, options [nop,nop,TS val 3209992 ecr 2988933,mptcp dss ack 724613416 seq 1583812458 subseq 18565 len 1428 csum 0x34fc], length 1428
16:13:09.506039 IP 112.26.1.8.38123 > 112.26.1.1.pmcd: Flags [.], ack 12853, win 8760, options [nop,nop,TS val 2989801 ecr 3209787,mptcp dss ack 1583763906], length 0
16:13:09.533072 IP 112.26.1.8.38123 > 112.26.1.1.pmcd: Flags [.], ack 12853, win 8760, options [nop,nop,TS val 2989801 ecr 3209787,mptcp dss ack 1583763906], length 0
16:13:09.558618 IP 112.26.1.1.pmcd > 112.26.1.8.38123: Flags [.], seq 19993:21421, ack 1, win 4017, options [nop,nop,TS val 3210105 ecr 2988968,mptcp dss ack 724613416 seq 1583819598 subseq 19993 len 1428 csum 0x805f], length 1428
16:13:09.573387 IP 112.26.1.1.pmcd > 112.26.1.8.38123: Flags [.], seq 17137:18565, ack 1, win 4017, options [nop,nop,TS val 3209992 ecr 2988933,mptcp dss ack 724613416 seq 1583811030 subseq 17137 len 1428 csum 0x2152], length 1428
16:13:09.578016 IP 112.26.1.8.38123 > 112.26.1.1.pmcd: Flags [.], ack 14281, win 9034, options [nop,nop,TS val 2990022 ecr 3209787,nop,nop,sack 1 {17137:18565},mptcp dss ack 1583763906], length 0
16:13:09.636671 IP 112.26.1.1.pmcd > 112.26.1.8.38123: Flags [.], seq 21421:22849, ack 1, win 4017, options [nop,nop,TS val 3210105 ecr 2988968,mptcp dss ack 724613416 seq 1583821026 subseq 21421 len 1428 csum 0x9960], length 1428
16:13:09.659151 IP 112.26.1.8.38123 > 112.26.1.1.pmcd: Flags [.], ack 14281, win 8897, options [nop,nop,TS val 2989895 ecr 3209787,mptcp dss ack 1583763906], length 0
16:13:09.662810 IP 112.26.1.8.38123 > 112.26.1.1.pmcd: Flags [.], ack 14281, win 8897, options [nop,nop,TS val 2989895 ecr 3209787,mptcp dss ack 1583763906], length 0
16:13:09.709685 IP 112.26.1.1.pmcd > 112.26.1.8.38123: Flags [.], seq 22849:24277, ack 1, win 4017, options [nop,nop,TS val 3210239 ecr 2989203,mptcp dss ack 724613416 seq 1583829594 subseq 22849 len 1428 csum 0x9cb3], length 1428
16:13:09.714377 IP 112.26.1.1.pmcd > 112.26.1.8.38123: Flags [.], seq 18565:19993, ack 1, win 4017, options [nop,nop,TS val 3209992 ecr 2988933,mptcp dss ack 724613416 seq 1583812458 subseq 18565 len 1428 csum 0x34fc], length 1428
16:13:09.729747 IP 112.26.1.8.38123 > 112.26.1.1.pmcd: Flags [.], ack 14281, win 9171, options [nop,nop,TS val 2990163 ecr 3209787,nop,nop,sack 1 {17137:19993},mptcp dss ack 1583763906], length 0
16:13:09.800339 IP 112.26.1.1.pmcd > 112.26.1.8.38123: Flags [.], seq 19993:21421, ack 1, win 4017, options [nop,nop,TS val 3210105 ecr 2988968,mptcp dss ack 724613416 seq 1583819598 subseq 19993 len 1428 csum 0x805f], length 1428
16:13:09.801586 IP 112.26.1.8.38123 > 112.26.1.1.pmcd: Flags [.], ack 14281, win 9217, options [nop,nop,TS val 2990249 ecr 3209787,nop,nop,sack 1 {17137:21421},mptcp dss ack 1583763906], length 0
16:13:09.820813 IP 112.26.1.1.pmcd > 112.26.1.8.38123: Flags [.], seq 25705:27133, ack 1, win 4017, options [nop,nop,TS val 3210328 ecr 2989275,mptcp dss ack 724613416 seq 1583832450 subseq 25705 len 1428 csum 0xb854], length 1428
16:13:09.905698 IP 112.26.1.1.pmcd > 112.26.1.8.38123: Flags [.], seq 27133:28561, ack 1, win 4017, options [nop,nop,TS val 3210328 ecr 2989275,mptcp dss ack 724613416 seq 1583833878 subseq 27133 len 1428 csum 0xe00a], length 1428
16:13:09.912717 IP 112.26.1.8.38123 > 112.26.1.1.pmcd: Flags [.], ack 14281, win 9034, options [nop,nop,TS val 2990022 ecr 3209787,nop,nop,sack 1 {17137:18565},mptcp dss ack 1583763906], length 0
16:13:09.957380 IP 112.26.1.8.38123 > 112.26.1.1.pmcd: Flags [.], ack 14281, win 9034, options [nop,nop,TS val 2990022 ecr 3209787,nop,nop,sack 1 {17137:18565},mptcp dss ack 1583763906], length 0
16:13:09.965541 IP 112.26.1.1.pmcd > 112.26.1.8.38123: Flags [.], seq 21421:22849, ack 1, win 4017, options [nop,nop,TS val 3210105 ecr 2988968,mptcp dss ack 724613416 seq 1583821026 subseq 21421 len 1428 csum 0x9960], length 1428
16:13:09.980421 IP 112.26.1.1.pmcd > 112.26.1.8.38123: Flags [.], seq 28561:29989, ack 1, win 4017, options [nop,nop,TS val 3210511 ecr 2989483,mptcp dss ack 724613416 seq 1583838162 subseq 28561 len 1428 csum 0xfd2], length 1428
16:13:09.982131 IP 112.26.1.8.38123 > 112.26.1.1.pmcd: Flags [.], ack 14281, win 9399, options [nop,nop,TS val 2990414 ecr 3209787,nop,nop,sack 1 {17137:22849},mptcp dss ack 1583763906], length 0
16:13:10.032352 IP 112.26.1.1.pmcd > 112.26.1.8.38123: Flags [.], seq 22849:24277, ack 1, win 4017, options [nop,nop,TS val 3210239 ecr 2989203,mptcp dss ack 724613416 seq 1583829594 subseq 22849 len 1428 csum 0x9cb3], length 1428
16:13:10.045820 IP 112.26.1.8.38123 > 112.26.1.1.pmcd: Flags [.], ack 14281, win 9536, options [nop,nop,TS val 2990481 ecr 3209787,nop,nop,sack 1 {17137:24277},mptcp dss ack 1583763906], length 0
16:13:10.111083 IP 112.26.1.8.38123 > 112.26.1.1.pmcd: Flags [.], ack 14281, win 9171, options [nop,nop,TS val 2990163 ecr 3209787,nop,nop,sack 1 {17137:19993},mptcp dss ack 1583763906], length 0
16:13:10.115693 IP 112.26.1.8.38123 > 112.26.1.1.pmcd: Flags [.], ack 14281, win 9171, options [nop,nop,TS val 2990163 ecr 3209787,nop,nop,sack 1 {17137:19993},mptcp dss ack 1583763906], length 0
16:13:10.161666 IP 112.26.1.8.38123 > 112.26.1.1.pmcd: Flags [.], ack 14281, win 9217, options [nop,nop,TS val 2990249 ecr 3209787,nop,nop,sack 1 {17137:21421},mptcp dss ack 1583763906], length 0
16:13:10.187077 IP 112.26.1.8.38123 > 112.26.1.1.pmcd: Flags [.], ack 14281, win 9217, options [nop,nop,TS val 2990249 ecr 3209787,nop,nop,sack 1 {17137:21421},mptcp dss ack 1583763906], length 0
16:13:10.189546 IP 112.26.1.1.pmcd > 112.26.1.8.38123: Flags [.], seq 32845:34273, ack 1, win 4017, options [nop,nop,TS val 3210642 ecr 2989549,mptcp dss ack 724613416 seq 1583843874 subseq 32845 len 1428 csum 0xe2bf], length 1428
16:13:10.201494 IP 112.26.1.1.pmcd > 112.26.1.8.38123: Flags [.], seq 25705:27133, ack 1, win 4017, options [nop,nop,TS val 3210328 ecr 2989275,mptcp dss ack 724613416 seq 1583832450 subseq 25705 len 1428 csum 0xb854], length 1428
16:13:10.206719 IP 112.26.1.8.38123 > 112.26.1.1.pmcd: Flags [.], ack 14281, win 9719, options [nop,nop,TS val 2990650 ecr 3209787,nop,nop,sack 2 {25705:27133}{17137:24277},mptcp dss ack 1583765334], length 0
16:13:10.275572 IP 112.26.1.1.pmcd > 112.26.1.8.38123: Flags [.], seq 27133:28561, ack 1, win 4017, options [nop,nop,TS val 3210328 ecr 2989275,mptcp dss ack 724613416 seq 1583833878 subseq 27133 len 1428 csum 0xe00a], length 1428
16:13:10.277347 IP 112.26.1.8.38123 > 112.26.1.1.pmcd: Flags [.], ack 14281, win 9855, options [nop,nop,TS val 2990724 ecr 3209787,nop,nop,sack 2 {25705:28561}{17137:24277},mptcp dss ack 1583766762], length 0
16:13:10.303908 IP 112.26.1.1.pmcd > 112.26.1.8.38123: Flags [.], seq 35701:37129, ack 1, win 4017, options [nop,nop,TS val 3210780 ecr 2989677,mptcp dss ack 724613416 seq 1583846730 subseq 35701 len 1428 csum 0xecaf], length 1428
16:13:10.331751 IP 112.26.1.1.pmcd > 112.26.1.8.38123: Flags [.], seq 37129:38557, ack 1, win 4017, options [nop,nop,TS val 3210879 ecr 2989801,mptcp dss ack 724613416 seq 1583851014 subseq 37129 len 1428 csum 0x1ac7], length 1428
16:13:10.337704 IP 112.26.1.1.pmcd > 112.26.1.8.38123: Flags [.], seq 28561:29989, ack 1, win 4017, options [nop,nop,TS val 3210511 ecr 2989483,mptcp dss ack 724613416 seq 1583838162 subseq 28561 len 1428 csum 0xfd2], length 1428
16:13:10.351408 IP 112.26.1.8.38123 > 112.26.1.1.pmcd: Flags [.], ack 14281, win 9947, options [nop,nop,TS val 2990786 ecr 3209787,nop,nop,sack 2 {25705:29989}{17137:24277},mptcp dss ack 1583766762], length 0
16:13:10.414385 IP 112.26.1.1.pmcd > 112.26.1.8.38123: Flags [.], seq 38557:39985, ack 1, win 4017, options [nop,nop,TS val 3210879 ecr 2989801,mptcp dss ack 724613416 seq 1583852442 subseq 38557 len 1428 csum 0x6b8e], length 1428
16:13:10.422608 IP 112.26.1.8.38123 > 112.26.1.1.pmcd: Flags [.], ack 14281, win 9399, options [nop,nop,TS val 2990414 ecr 3209787,nop,nop,sack 1 {17137:22849},mptcp dss ack 1583763906], length 0
16:13:10.426318 IP 112.26.1.8.38123 > 112.26.1.1.pmcd: Flags [.], ack 14281, win 9399, options [nop,nop,TS val 2990414 ecr 3209787,nop,nop,sack 1 {17137:22849},mptcp dss ack 1583763906], length 0
16:13:10.472105 IP 112.26.1.1.pmcd > 112.26.1.8.38123: Flags [.], seq 39985:41413, ack 1, win 4017, options [nop,nop,TS val 3211009 ecr 2989895,mptcp dss ack 724613416 seq 1583861010 subseq 39985 len 1428 csum 0x8ec5], length 1428
16:13:10.491212 IP 112.26.1.8.38123 > 112.26.1.1.pmcd: Flags [.], ack 14281, win 9536, options [nop,nop,TS val 2990481 ecr 3209787,nop,nop,sack 1 {17137:24277},mptcp dss ack 1583763906], length 0
16:13:10.516367 IP 112.26.1.8.38123 > 112.26.1.1.pmcd: Flags [.], ack 14281, win 9536, options [nop,nop,TS val 2990481 ecr 3209787,nop,nop,sack 1 {17137:24277},mptcp dss ack 1583763906], length 0
16:13:10.525972 IP 112.26.1.1.pmcd > 112.26.1.8.38123: Flags [.], seq 41413:42841, ack 1, win 4017, options [nop,nop,TS val 3211009 ecr 2989895,mptcp dss ack 724613416 seq 1583862438 subseq 41413 len 1428 csum 0x6975], length 1428
16:13:10.536822 IP 112.26.1.1.pmcd > 112.26.1.8.38123: Flags [.], seq 32845:34273, ack 1, win 4017, options [nop,nop,TS val 3210642 ecr 2989549,mptcp dss ack 724613416 seq 1583843874 subseq 32845 len 1428 csum 0xe2bf], length 1428
16:13:10.540681 IP 112.26.1.8.38123 > 112.26.1.1.pmcd: Flags [.], ack 14281, win 10129, options [nop,nop,TS val 2990985 ecr 3209787,nop,nop,sack 2 {32845:34273}{25705:29989},mptcp dss ack 1583766762], length 0
16:13:10.597385 IP 112.26.1.1.pmcd > 112.26.1.8.38123: Flags [.], seq 42841:44269, ack 1, win 4017, options [nop,nop,TS val 3211353 ecr 2990022,mptcp dss ack 724613416 seq 1583868150 subseq 42841 len 1428 csum 0x2081], length 1428
16:13:10.634305 IP 112.26.1.8.38123 > 112.26.1.1.pmcd: Flags [.], ack 14281, win 9719, options [nop,nop,TS val 2990650 ecr 3209787,nop,nop,sack 2 {25705:27133}{17137:24277},mptcp dss ack 1583765334], length 0
16:13:10.636310 IP 112.26.1.8.38123 > 112.26.1.1.pmcd: Flags [.], ack 14281, win 9719, options [nop,nop,TS val 2990650 ecr 3209787,nop,nop,sack 2 {25705:27133}{17137:24277},mptcp dss ack 1583765334], length 0
16:13:10.673129 IP 112.26.1.1.pmcd > 112.26.1.8.38123: Flags [.], seq 14281:15709, ack 1, win 4017, options [nop,nop,TS val 3211461 ecr 2990163,mptcp dss ack 724613416 seq 1583803890 subseq 14281 len 1428 csum 0xea77], length 1428
16:13:10.679258 IP 112.26.1.8.38123 > 112.26.1.1.pmcd: Flags [.], ack 14281, win 9855, options [nop,nop,TS val 2990724 ecr 3209787,nop,nop,sack 2 {25705:28561}{17137:24277},mptcp dss ack 1583766762], length 0
16:13:10.721605 IP 112.26.1.8.38123 > 112.26.1.1.pmcd: Flags [.], ack 14281, win 9855, options [nop,nop,TS val 2990724 ecr 3209787,nop,nop,sack 2 {25705:28561}{17137:24277},mptcp dss ack 1583766762], length 0
16:13:10.723034 IP 112.26.1.1.pmcd > 112.26.1.8.38123: Flags [.], seq 15709:17137, ack 1, win 4017, options [nop,nop,TS val 3211533 ecr 2990249,mptcp dss ack 724613416 seq 1583805318 subseq 15709 len 1428 csum 0x90af], length 1428
16:13:10.732453 IP 112.26.1.1.pmcd > 112.26.1.8.38123: Flags [.], seq 35701:37129, ack 1, win 4017, options [nop,nop,TS val 3210780 ecr 2989677,mptcp dss ack 724613416 seq 1583846730 subseq 35701 len 1428 csum 0xecaf], length 1428
16:13:10.736930 IP 112.26.1.8.38123 > 112.26.1.1.pmcd: Flags [.], ack 14281, win 10357, options [nop,nop,TS val 2991181 ecr 3209787,nop,nop,sack 2 {35701:37129}{32845:34273},mptcp dss ack 1583766762], length 0
16:13:10.813115 IP 112.26.1.1.pmcd > 112.26.1.8.38123: Flags [.], seq 37129:38557, ack 1, win 4017, options [nop,nop,TS val 3210879 ecr 2989801,mptcp dss ack 724613416 seq 1583851014 subseq 37129 len 1428 csum 0x1ac7], length 1428
16:13:10.820172 IP 112.26.1.8.38123 > 112.26.1.1.pmcd: Flags [.], ack 14281, win 10494, options [nop,nop,TS val 2991261 ecr 3209787,nop,nop,sack 2 {35701:38557}{32845:34273},mptcp dss ack 1583766762], length 0
16:13:10.827842 IP 112.26.1.1.pmcd > 112.26.1.8.38123: Flags [.], seq 44269:45697, ack 1, win 4017, options [nop,nop,TS val 3211776 ecr 2990414,mptcp dss ack 724613416 seq 1583878146 subseq 44269 len 1428 csum 0x2baf], length 1428
16:13:10.883302 IP 112.26.1.1.pmcd > 112.26.1.8.38123: Flags [.], seq 24277:25705, ack 1, win 4017, options [nop,nop,TS val 3211982 ecr 2990650,mptcp dss ack 724613416 seq 1583831022 subseq 24277 len 1428 csum 0x1c6c], length 1428
16:13:10.891435 IP 112.26.1.1.pmcd > 112.26.1.8.38123: Flags [.], seq 38557:39985, ack 1, win 4017, options [nop,nop,TS val 3210879 ecr 2989801,mptcp dss ack 724613416 seq 1583852442 subseq 38557 len 1428 csum 0x6b8e], length 1428
16:13:10.896902 IP 112.26.1.8.38123 > 112.26.1.1.pmcd: Flags [.], ack 14281, win 10585, options [nop,nop,TS val 2991340 ecr 3209787,nop,nop,sack 2 {35701:39985}{32845:34273},mptcp dss ack 1583766762], length 0
16:13:10.931500 IP 112.26.1.1.pmcd > 112.26.1.8.38123: Flags [.], seq 45697:47125, ack 1, win 4017, options [nop,nop,TS val 3212112 ecr 2990724,mptcp dss ack 724613416 seq 1583882430 subseq 45697 len 1428 csum 0x5325], length 1428
16:13:10.998043 IP 112.26.1.1.pmcd > 112.26.1.8.38123: Flags [.], seq 41413:42841, ack 1, win 4017, options [nop,nop,TS val 3211009 ecr 2989895,mptcp dss ack 724613416 seq 1583862438 subseq 41413 len 1428 csum 0x6975], length 1428
16:13:11.000034 IP 112.26.1.8.38123 > 112.26.1.1.pmcd: Flags [.], ack 14281, win 10722, options [nop,nop,TS val 2991446 ecr 3209787,nop,nop,sack 2 {41413:42841}{35701:39985},mptcp dss ack 1583766762], length 0
16:13:11.036120 IP 112.26.1.8.38123 > 112.26.1.1.pmcd: Flags [.], ack 14281, win 10129, options [nop,nop,TS val 2990985 ecr 3209787,nop,nop,sack 2 {32845:34273}{25705:29989},mptcp dss ack 1583766762], length 0
16:13:11.068897 IP 112.26.1.8.38123 > 112.26.1.1.pmcd: Flags [.], ack 14281, win 10129, options [nop,nop,TS val 2990985 ecr 3209787,nop,nop,sack 2 {32845:34273}{25705:29989},mptcp dss ack 1583766762], length 0
16:13:11.112949 IP 112.26.1.1.pmcd > 112.26.1.8.38123: Flags [.], seq 29989:31417, ack 1, win 4017, options [nop,nop,TS val 3212389 ecr 2990985,mptcp dss ack 724613416 seq 1583839590 subseq 29989 len 1428 csum 0xf7a], length 1428
16:13:11.115837 IP 112.26.1.1.pmcd > 112.26.1.8.38123: Flags [.], seq 14281:15709, ack 1, win 4017, options [nop,nop,TS val 3211461 ecr 2990163,mptcp dss ack 724613416 seq 1583803890 subseq 14281 len 1428 csum 0xea77], length 1428
16:13:11.123470 IP 112.26.1.8.38123 > 112.26.1.1.pmcd: Flags [.], ack 15709, win 10859, options [nop,nop,TS val 2991564 ecr 3211461,nop,nop,sack 2 {41413:42841}{35701:39985},mptcp dss ack 1583766762], length 0
16:13:11.170293 IP 112.26.1.1.pmcd > 112.26.1.8.38123: Flags [.], seq 15709:17137, ack 1, win 4017, options [nop,nop,TS val 3211533 ecr 2990249,mptcp dss ack 724613416 seq 1583805318 subseq 15709 len 1428 csum 0x90af], length 1428
16:13:11.171894 IP 112.26.1.8.38123 > 112.26.1.1.pmcd: Flags [.], ack 24277, win 10950, options [nop,nop,TS val 2991619 ecr 3211533,nop,nop,sack 2 {41413:42841}{35701:39985},mptcp dss ack 1583766762], length 0
16:13:11.214447 IP 112.26.1.8.38123 > 112.26.1.1.pmcd: Flags [.], ack 14281, win 10357, options [nop,nop,TS val 2991181 ecr 3209787,nop,nop,sack 2 {35701:37129}{32845:34273},mptcp dss ack 1583766762], length 0
16:13:11.217325 IP 112.26.1.8.38123 > 112.26.1.1.pmcd: Flags [.], ack 14281, win 10357, options [nop,nop,TS val 2991181 ecr 3209787,nop,nop,sack 2 {35701:37129}{32845:34273},mptcp dss ack 1583766762], length 0
16:13:11.230388 IP 112.26.1.1.pmcd > 112.26.1.8.38123: Flags [.], seq 31417:32845, ack 1, win 4017, options [nop,nop,TS val 3212564 ecr 2991181,mptcp dss ack 724613416 seq 1583842446 subseq 31417 len 1428 csum 0x39c8], length 1428
16:13:11.281005 IP 112.26.1.8.38123 > 112.26.1.1.pmcd: Flags [.], ack 14281, win 10494, options [nop,nop,TS val 2991261 ecr 3209787,nop,nop,sack 2 {35701:38557}{32845:34273},mptcp dss ack 1583766762], length 0
16:13:11.309587 IP 112.26.1.1.pmcd > 112.26.1.8.38123: Flags [.], seq 44269:45697, ack 1, win 4017, options [nop,nop,TS val 3211776 ecr 2990414,mptcp dss ack 724613416 seq 1583878146 subseq 44269 len 1428 csum 0x2baf], length 1428
16:13:11.312754 IP 112.26.1.8.38123 > 112.26.1.1.pmcd: Flags [.], ack 24277, win 11087, options [nop,nop,TS val 2991758 ecr 3211533,nop,nop,sack 2 {44269:45697}{41413:42841},mptcp dss ack 1583766762], length 0
16:13:11.324124 IP 112.26.1.8.38123 > 112.26.1.1.pmcd: Flags [.], ack 14281, win 10494, options [nop,nop,TS val 2991261 ecr 3209787,nop,nop,sack 2 {35701:38557}{32845:34273},mptcp dss ack 1583766762], length 0
16:13:11.363213 IP 112.26.1.1.pmcd > 112.26.1.8.38123: Flags [.], seq 24277:25705, ack 1, win 4017, options [nop,nop,TS val 3211982 ecr 2990650,mptcp dss ack 724613416 seq 1583831022 subseq 24277 len 1428 csum 0x1c6c], length 1428
16:13:11.401979 IP 112.26.1.8.38123 > 112.26.1.1.pmcd: Flags [.], ack 29989, win 11179, options [nop,nop,TS val 2991812 ecr 3211982,nop,nop,sack 2 {44269:45697}{41413:42841},mptcp dss ack 1583766762], length 0
16:13:11.405291 IP 112.26.1.1.pmcd > 112.26.1.8.38123: Flags [.], seq 34273:35701, ack 1, win 4017, options [nop,nop,TS val 3212670 ecr 2991261,mptcp dss ack 724613416 seq 1583845302 subseq 34273 len 1428 csum 0x7571], length 1428
16:13:11.435015 IP 112.26.1.1.pmcd > 112.26.1.8.38123: Flags [.], seq 45697:47125, ack 1, win 4017, options [nop,nop,TS val 3212112 ecr 2990724,mptcp dss ack 724613416 seq 1583882430 subseq 45697 len 1428 csum 0x5325], length 1428
16:13:11.445174 IP 112.26.1.8.38123 > 112.26.1.1.pmcd: Flags [.], ack 29989, win 11270, options [nop,nop,TS val 2991883 ecr 3211982,nop,nop,sack 2 {44269:47125}{41413:42841},mptcp dss ack 1583766762], length 0
16:13:11.490840 IP 112.26.1.8.38123 > 112.26.1.1.pmcd: Flags [.], ack 14281, win 10722, options [nop,nop,TS val 2991446 ecr 3209787,nop,nop,sack 2 {41413:42841}{35701:39985},mptcp dss ack 1583766762], length 0
16:13:11.499660 IP 112.26.1.8.38123 > 112.26.1.1.pmcd: Flags [.], ack 14281, win 10722, options [nop,nop,TS val 2991446 ecr 3209787,nop,nop,sack 2 {41413:42841}{35701:39985},mptcp dss ack 1583766762], length 0
16:13:11.510657 IP 112.26.1.1.pmcd > 112.26.1.8.38123: Flags [.], seq 39985:41413, ack 1, win 4017, options [nop,nop,TS val 3212839 ecr 2991446,mptcp dss ack 724613416 seq 1583861010 subseq 39985 len 1428 csum 0x8ec5], length 1428
16:13:11.580168 IP 112.26.1.1.pmcd > 112.26.1.8.38123: Flags [.], seq 29989:31417, ack 1, win 4017, options [nop,nop,TS val 3212389 ecr 2990985,mptcp dss ack 724613416 seq 1583839590 subseq 29989 len 1428 csum 0xf7a], length 1428
16:13:11.581449 IP 112.26.1.8.38123 > 112.26.1.1.pmcd: Flags [.], ack 31417, win 11452, options [nop,nop,TS val 2992029 ecr 3212389,nop,nop,sack 2 {44269:47125}{41413:42841},mptcp dss ack 1583766762], length 0
16:13:11.604790 IP 112.26.1.1.pmcd > 112.26.1.8.38123: Flags [.], seq 47125:48553, ack 1, win 4017, options [nop,nop,TS val 3212887 ecr 2991446,mptcp dss ack 724613416 seq 1583899566 subseq 47125 len 1428 csum 0xfb], length 1428
16:13:11.638254 IP 112.26.1.8.38123 > 112.26.1.1.pmcd: Flags [.], ack 24277, win 10950, options [nop,nop,TS val 2991619 ecr 3211533,nop,nop,sack 2 {41413:42841}{35701:39985},mptcp dss ack 1583766762], length 0
16:13:11.639570 IP 112.26.1.8.38123 > 112.26.1.1.pmcd: Flags [.], ack 24277, win 10950, options [nop,nop,TS val 2991619 ecr 3211533,nop,nop,sack 2 {41413:42841}{35701:39985},mptcp dss ack 1583766762], length 0
16:13:11.693024 IP 112.26.1.1.pmcd > 112.26.1.8.38123: Flags [.], seq 31417:32845, ack 1, win 4017, options [nop,nop,TS val 3212564 ecr 2991181,mptcp dss ack 724613416 seq 1583842446 subseq 31417 len 1428 csum 0x39c8], length 1428
16:13:11.697268 IP 112.26.1.8.38123 > 112.26.1.1.pmcd: Flags [.], ack 34273, win 11635, options [nop,nop,TS val 2992142 ecr 3212564,nop,nop,sack 2 {44269:47125}{41413:42841},mptcp dss ack 1583766762], length 0
16:13:11.707461 IP 112.26.1.1.pmcd > 112.26.1.8.38123: Flags [.], seq 42841:44269, ack 1, win 4017, options [nop,nop,TS val 3212991 ecr 2991619,mptcp dss ack 724613416 seq 1583868150 subseq 42841 len 1428 csum 0x2081], length 1428
16:13:11.747322 IP 112.26.1.8.38123 > 112.26.1.1.pmcd: Flags [.], ack 24277, win 11087, options [nop,nop,TS val 2991758 ecr 3211533,nop,nop,sack 2 {44269:45697}{41413:42841},mptcp dss ack 1583766762], length 0
16:13:11.748615 IP 112.26.1.8.38123 > 112.26.1.1.pmcd: Flags [.], ack 24277, win 11087, options [nop,nop,TS val 2991758 ecr 3211533,nop,nop,sack 2 {44269:45697}{41413:42841},mptcp dss ack 1583766762], length 0
16:13:11.787494 IP 112.26.1.8.38123 > 112.26.1.1.pmcd: Flags [.], ack 29989, win 11179, options [nop,nop,TS val 2991812 ecr 3211982,nop,nop,sack 2 {44269:45697}{41413:42841},mptcp dss ack 1583766762], length 0
16:13:11.813935 IP 112.26.1.1.pmcd > 112.26.1.8.38123: Flags [.], seq 48553:49981, ack 1, win 4017, options [nop,nop,TS val 3212991 ecr 2991619,mptcp dss ack 724613416 seq 1583903850 subseq 48553 len 1428 csum 0xb948], length 1428
16:13:11.827377 IP 112.26.1.8.38123 > 112.26.1.1.pmcd: Flags [.], ack 29989, win 11179, options [nop,nop,TS val 2991812 ecr 3211982,nop,nop,sack 2 {44269:45697}{41413:42841},mptcp dss ack 1583766762], length 0
16:13:11.851783 IP 112.26.1.1.pmcd > 112.26.1.8.38123: Flags [.], seq 34273:35701, ack 1, win 4017, options [nop,nop,TS val 3212670 ecr 2991261,mptcp dss ack 724613416 seq 1583845302 subseq 34273 len 1428 csum 0x7571], length 1428
16:13:11.853254 IP 112.26.1.8.38123 > 112.26.1.1.pmcd: Flags [.], ack 39985, win 11817, options [nop,nop,TS val 2992300 ecr 3212670,nop,nop,sack 2 {44269:47125}{41413:42841},mptcp dss ack 1583766762], length 0
16:13:11.903932 IP 112.26.1.8.38123 > 112.26.1.1.pmcd: Flags [.], ack 29989, win 11270, options [nop,nop,TS val 2991883 ecr 3211982,nop,nop,sack 2 {44269:47125}{41413:42841},mptcp dss ack 1583766762], length 0
16:13:11.910554 IP 112.26.1.1.pmcd > 112.26.1.8.38123: Flags [.], seq 49981:51409, ack 1, win 4017, options [nop,nop,TS val 3212991 ecr 2991619,mptcp dss ack 724613416 seq 1583905278 subseq 49981 len 1428 csum 0xfab6], length 1428
16:13:11.915936 IP 112.26.1.8.38123 > 112.26.1.1.pmcd: Flags [.], ack 29989, win 11270, options [nop,nop,TS val 2991883 ecr 3211982,nop,nop,sack 2 {44269:47125}{41413:42841},mptcp dss ack 1583766762], length 0
16:13:11.943266 IP 112.26.1.1.pmcd > 112.26.1.8.38123: Flags [.], seq 39985:41413, ack 1, win 4017, options [nop,nop,TS val 3212839 ecr 2991446,mptcp dss ack 724613416 seq 1583861010 subseq 39985 len 1428 csum 0x8ec5], length 1428
16:13:11.945008 IP 112.26.1.8.38123 > 112.26.1.1.pmcd: Flags [.], ack 42841, win 11909, options [nop,nop,TS val 2992392 ecr 3212839,nop,nop,sack 1 {44269:47125},mptcp dss ack 1583766762], length 0
16:13:12.021961 IP 112.26.1.8.38123 > 112.26.1.1.pmcd: Flags [.], ack 31417, win 11452, options [nop,nop,TS val 2992029 ecr 3212389,nop,nop,sack 2 {44269:47125}{41413:42841},mptcp dss ack 1583766762], length 0
16:13:12.024528 IP 112.26.1.8.38123 > 112.26.1.1.pmcd: Flags [.], ack 31417, win 11452, options [nop,nop,TS val 2992029 ecr 3212389,nop,nop,sack 2 {44269:47125}{41413:42841},mptcp dss ack 1583766762], length 0
16:13:12.042726 IP 112.26.1.1.pmcd > 112.26.1.8.38123: Flags [.], seq 51409:52837, ack 1, win 4017, options [nop,nop,TS val 3212991 ecr 2991619,mptcp dss ack 724613416 seq 1583906706 subseq 51409 len 1428 csum 0x66c6], length 1428
16:13:12.099155 IP 112.26.1.1.pmcd > 112.26.1.8.38123: Flags [.], seq 47125:48553, ack 1, win 4017, options [nop,nop,TS val 3212887 ecr 2991446,mptcp dss ack 724613416 seq 1583899566 subseq 47125 len 1428 csum 0xfb], length 1428
16:13:12.100976 IP 112.26.1.8.38123 > 112.26.1.1.pmcd: Flags [.], ack 42841, win 12091, options [nop,nop,TS val 2992548 ecr 3212839,nop,nop,sack 1 {44269:48553},mptcp dss ack 1583786754], length 0
16:13:12.131195 IP 112.26.1.1.pmcd > 112.26.1.8.38123: Flags [.], seq 52837:54265, ack 1, win 4017, options [nop,nop,TS val 3212991 ecr 2991619,mptcp dss ack 724613416 seq 1583908134 subseq 52837 len 1428 csum 0xae9], length 1428
16:13:12.150705 IP 112.26.1.8.38123 > 112.26.1.1.pmcd: Flags [.], ack 34273, win 11635, options [nop,nop,TS val 2992142 ecr 3212564,nop,nop,sack 2 {44269:47125}{41413:42841},mptcp dss ack 1583766762], length 0
16:13:12.165666 IP 112.26.1.8.38123 > 112.26.1.1.pmcd: Flags [.], ack 34273, win 11635, options [nop,nop,TS val 2992142 ecr 3212564,nop,nop,sack 2 {44269:47125}{41413:42841},mptcp dss ack 1583766762], length 0
16:13:12.191788 IP 112.26.1.1.pmcd > 112.26.1.8.38123: Flags [.], seq 42841:44269, ack 1, win 4017, options [nop,nop,TS val 3212991 ecr 2991619,mptcp dss ack 724613416 seq 1583868150 subseq 42841 len 1428 csum 0x2081], length 1428
16:13:12.193078 IP 112.26.1.8.38123 > 112.26.1.1.pmcd: Flags [.], ack 48553, win 12182, options [nop,nop,TS val 2992640 ecr 3212991,mptcp dss ack 1583786754], length 0
16:13:12.231331 IP 112.26.1.1.pmcd > 112.26.1.8.38123: Flags [.], seq 54265:55693, ack 1, win 4017, options [nop,nop,TS val 3213173 ecr 2991758,mptcp dss ack 724613416 seq 1583912418 subseq 54265 len 1428 csum 0x68a8], length 1428
16:13:12.232417 IP 112.26.1.1.pmcd > 112.26.1.8.38123: Flags [.], seq 48553:49981, ack 1, win 4017, options [nop,nop,TS val 3212991 ecr 2991619,mptcp dss ack 724613416 seq 1583903850 subseq 48553 len 1428 csum 0xb948], length 1428
16:13:12.242658 IP 112.26.1.8.38123 > 112.26.1.1.pmcd: Flags [.], ack 49981, win 12274, options [nop,nop,TS val 2992681 ecr 3212991,mptcp dss ack 1583786754], length 0
16:13:12.301037 IP 112.26.1.8.38123 > 112.26.1.1.pmcd: Flags [.], ack 39985, win 11817, options [nop,nop,TS val 2992300 ecr 3212670,nop,nop,sack 2 {44269:47125}{41413:42841},mptcp dss ack 1583766762], length 0
16:13:12.317309 IP 112.26.1.8.38123 > 112.26.1.1.pmcd: Flags [.], ack 39985, win 11817, options [nop,nop,TS val 2992300 ecr 3212670,nop,nop,sack 2 {44269:47125}{41413:42841},mptcp dss ack 1583766762], length 0
16:13:12.332326 IP 112.26.1.1.pmcd > 112.26.1.8.38123: Flags [.], seq 55693:57121, ack 1, win 4017, options [nop,nop,TS val 3213173 ecr 2991812,mptcp dss ack 724613416 seq 1583913846 subseq 55693 len 1428 csum 0xe2e6], length 1428
16:13:12.348011 IP 112.26.1.1.pmcd > 112.26.1.8.38123: Flags [.], seq 49981:51409, ack 1, win 4017, options [nop,nop,TS val 3212991 ecr 2991619,mptcp dss ack 724613416 seq 1583905278 subseq 49981 len 1428 csum 0xfab6], length 1428
16:13:12.349264 IP 112.26.1.8.38123 > 112.26.1.1.pmcd: Flags [.], ack 51409, win 12456, options [nop,nop,TS val 2992797 ecr 3212991,mptcp dss ack 1583786754], length 0
16:13:12.413709 IP 112.26.1.8.38123 > 112.26.1.1.pmcd: Flags [.], ack 42841, win 11909, options [nop,nop,TS val 2992392 ecr 3212839,nop,nop,sack 1 {44269:47125},mptcp dss ack 1583766762], length 0
16:13:12.421654 IP 112.26.1.8.38123 > 112.26.1.1.pmcd: Flags [.], ack 42841, win 11909, options [nop,nop,TS val 2992392 ecr 3212839,nop,nop,sack 1 {44269:47125},mptcp dss ack 1583766762], length 0
16:13:12.435872 IP 112.26.1.1.pmcd > 112.26.1.8.38123: Flags [.], seq 57121:58549, ack 1, win 4017, options [nop,nop,TS val 3213173 ecr 2991812,mptcp dss ack 724613416 seq 1583915274 subseq 57121 len 1428 csum 0x1a39], length 1428
16:13:12.457128 IP 112.26.1.1.pmcd > 112.26.1.8.38123: Flags [.], seq 51409:52837, ack 1, win 4017, options [nop,nop,TS val 3212991 ecr 2991619,mptcp dss ack 724613416 seq 1583906706 subseq 51409 len 1428 csum 0x66c6], length 1428
16:13:12.458372 IP 112.26.1.8.38123 > 112.26.1.1.pmcd: Flags [.], ack 52837, win 12547, options [nop,nop,TS val 2992906 ecr 3212991,mptcp dss ack 1583786754], length 0
16:13:12.511683 IP 112.26.1.8.38123 > 112.26.1.1.pmcd: Flags [.], ack 42841, win 12091, options [nop,nop,TS val 2992548 ecr 3212839,nop,nop,sack 1 {44269:48553},mptcp dss ack 1583786754], length 0
16:13:12.515313 IP 112.26.1.8.38123 > 112.26.1.1.pmcd: Flags [.], ack 42841, win 12091, options [nop,nop,TS val 2992548 ecr 3212839,nop,nop,sack 1 {44269:48553},mptcp dss ack 1583786754], length 0
16:13:12.534592 IP 112.26.1.1.pmcd > 112.26.1.8.38123: Flags [.], seq 58549:59977, ack 1, win 4017, options [nop,nop,TS val 3213280 ecr 2991883,mptcp dss ack 724613416 seq 1583919558 subseq 58549 len 1428 csum 0x41f5], length 1428
16:13:12.549698 IP 112.26.1.1.pmcd > 112.26.1.8.38123: Flags [.], seq 52837:54265, ack 1, win 4017, options [nop,nop,TS val 3212991 ecr 2991619,mptcp dss ack 724613416 seq 1583908134 subseq 52837 len 1428 csum 0xae9], length 1428
16:13:12.551320 IP 112.26.1.8.38123 > 112.26.1.1.pmcd: Flags [.], ack 54265, win 12684, options [nop,nop,TS val 2992998 ecr 3212991,mptcp dss ack 1583786754], length 0
16:13:12.617642 IP 112.26.1.8.38123 > 112.26.1.1.pmcd: Flags [.], ack 48553, win 12182, options [nop,nop,TS val 2992640 ecr 3212991,mptcp dss ack 1583786754], length 0
