16:13:07.944129 IP 112.26.1.1.pmcd > 112.26.1.8.38123: Flags [S.], seq 324059165, ack 1072362573, win 65535, options [mss 1460,sackOK,TS val 3209287 ecr 2988377,nop,wscale 6,mptcp join id 3 hmac 0xd3dd4e0191341a6f nonce 0x53b6a931], length 0
16:13:08.034937 IP 112.26.1.1.pmcd > 112.26.1.8.38123: Flags [S.], seq 324059165, ack 1072362573, win 65535, options [mss 1460,sackOK,TS val 3209287 ecr 2988377,nop,wscale 6,mptcp join id 3 hmac 0xd3dd4e0191341a6f nonce 0x53b6a931], length 0
16:13:08.156147 IP 112.26.1.1.pmcd > 112.26.1.8.38123: Flags [.], ack 1, win 4017, options [nop,nop,TS val 3209498 ecr 2988488,mptcp dss ack 724613416], length 0
16:13:08.163299 IP 112.26.1.1.pmcd > 112.26.1.8.38123: Flags [.], ack 1, win 4017, options [nop,nop,TS val 3209498 ecr 2988488,mptcp dss ack 724613416], length 0
16:13:08.229416 IP 112.26.1.1.pmcd > 112.26.1.8.38123: Flags [.], seq 1:1429, ack 1, win 4017, options [nop,nop,TS val 3209560 ecr 2988488,mptcp dss ack 724613416 seq 1583772474 subseq 1 len 1428 csum 0xea0c], length 1428
16:13:08.231289 IP 112.26.1.1.pmcd > 112.26.1.8.38123: Flags [.], seq 1:1429, ack 1, win 4017, options [nop,nop,TS val 3209560 ecr 2988488,mptcp dss ack 724613416 seq 1583772474 subseq 1 len 1428 csum 0xea0c], length 1428
16:13:08.310370 IP 112.26.1.1.pmcd > 112.26.1.8.38123: Flags [.], seq 1429:2857, ack 1, win 4017, options [nop,nop,TS val 3209560 ecr 2988488,mptcp dss ack 724613416 seq 1583773902 subseq 1429 len 1428 csum 0xe07a], length 1428
16:13:08.369034 IP 112.26.1.1.pmcd > 112.26.1.8.38123: Flags [.], seq 1429:2857, ack 1, win 4017, options [nop,nop,TS val 3209560 ecr 2988488,mptcp dss ack 724613416 seq 1583773902 subseq 1429 len 1428 csum 0xe07a], length 1428
16:13:08.403419 IP 112.26.1.1.pmcd > 112.26.1.8.38123: Flags [.], seq 2857:4285, ack 1, win 4017, options [nop,nop,TS val 3209560 ecr 2988488,mptcp dss ack 724613416 seq 1583775330 subseq 2857 len 1428 csum 0xe523], length 1428
16:13:08.466688 IP 112.26.1.1.pmcd > 112.26.1.8.38123: Flags [.], seq 2857:4285, ack 1, win 4017, options [nop,nop,TS val 3209560 ecr 2988488,mptcp dss ack 724613416 seq 1583775330 subseq 2857 len 1428 csum 0xe523], length 1428
16:13:08.483604 IP 112.26.1.1.pmcd > 112.26.1.8.38123: Flags [.], seq 4285:5713, ack 1, win 4017, options [nop,nop,TS val 3209560 ecr 2988488,mptcp dss ack 724613416 seq 1583776758 subseq 4285 len 1428 csum 0x27ea], length 1428
16:13:08.545699 IP 112.26.1.1.pmcd > 112.26.1.8.38123: Flags [.], seq 5713:7141, ack 1, win 4017, options [nop,nop,TS val 3209561 ecr 2988488,mptcp dss ack 724613416 seq 1583778186 subseq 5713 len 1428 csum 0x185d], length 1428
16:13:08.621271 IP 112.26.1.1.pmcd > 112.26.1.8.38123: Flags [.], seq 7141:8569, ack 1, win 4017, options [nop,nop,TS val 3209787 ecr 2988488,mptcp dss ack 724613416 seq 1583796750 subseq 7141 len 1428 csum 0x768f], length 1428
16:13:08.660335 IP 112.26.1.1.pmcd > 112.26.1.8.38123: Flags [.], seq 4285:5713, ack 1, win 4017, options [nop,nop,TS val 3209560 ecr 2988488,mptcp dss ack 724613416 seq 1583776758 subseq 4285 len 1428 csum 0x27ea], length 1428
16:13:08.711101 IP 112.26.1.1.pmcd > 112.26.1.8.38123: Flags [.], seq 8569:9997, ack 1, win 4017, options [nop,nop,TS val 3209787 ecr 2988488,mptcp dss ack 724613416 seq 1583798178 subseq 8569 len 1428 csum 0xf6d8], length 1428
16:13:08.748241 IP 112.26.1.1.pmcd > 112.26.1.8.38123: Flags [.], seq 5713:7141, ack 1, win 4017, options [nop,nop,TS val 3209561 ecr 2988488,mptcp dss ack 724613416 seq 1583778186 subseq 5713 len 1428 csum 0x185d], length 1428
16:13:08.767161 IP 112.26.1.1.pmcd > 112.26.1.8.38123: Flags [.], seq 9997:11425, ack 1, win 4017, options [nop,nop,TS val 3209787 ecr 2988736,mptcp dss ack 724613416 seq 1583799606 subseq 9997 len 1428 csum 0xd90d], length 1428
16:13:08.846068 IP 112.26.1.1.pmcd > 112.26.1.8.38123: Flags [.], seq 11425:12853, ack 1, win 4017, options [nop,nop,TS val 3209787 ecr 2988736,mptcp dss ack 724613416 seq 1583801034 subseq 11425 len 1428 csum 0xb8ec], length 1428
16:13:08.860219 IP 112.26.1.1.pmcd > 112.26.1.8.38123: Flags [.], seq 7141:8569, ack 1, win 4017, options [nop,nop,TS val 3209787 ecr 2988488,mptcp dss ack 724613416 seq 1583796750 subseq 7141 len 1428 csum 0x768f], length 1428
16:13:08.891629 IP 112.26.1.1.pmcd > 112.26.1.8.38123: Flags [.], seq 12853:14281, ack 1, win 4017, options [nop,nop,TS val 3209787 ecr 2988736,mptcp dss ack 724613416 seq 1583802462 subseq 12853 len 1428 csum 0xaa0a], length 1428
16:13:08.958282 IP 112.26.1.1.pmcd > 112.26.1.8.38123: Flags [.], seq 8569:9997, ack 1, win 4017, options [nop,nop,TS val 3209787 ecr 2988488,mptcp dss ack 724613416 seq 1583798178 subseq 8569 len 1428 csum 0xf6d8], length 1428
16:13:08.963117 IP 112.26.1.1.pmcd > 112.26.1.8.38123: Flags [.], seq 17137:18565, ack 1, win 4017, options [nop,nop,TS val 3209992 ecr 2988933,mptcp dss ack 724613416 seq 1583811030 subseq 17137 len 1428 csum 0x2152], length 1428
16:13:09.034871 IP 112.26.1.1.pmcd > 112.26.1.8.38123: Flags [.], seq 18565:19993, ack 1, win 4017, options [nop,nop,TS val 3209992 ecr 2988933,mptcp dss ack 724613416 seq 1583812458 subseq 18565 len 1428 csum 0x34fc], length 1428
16:13:09.064080 IP 112.26.1.1.pmcd > 112.26.1.8.38123: Flags [.], seq 19993:21421, ack 1, win 4017, options [nop,nop,TS val 3210105 ecr 2988968,mptcp dss ack 724613416 seq 1583819598 subseq 19993 len 1428 csum 0x805f], length 1428
16:13:09.082402 IP 112.26.1.1.pmcd > 112.26.1.8.38123: Flags [.], seq 9997:11425, ack 1, win 4017, options [nop,nop,TS val 3209787 ecr 2988736,mptcp dss ack 724613416 seq 1583799606 subseq 9997 len 1428 csum 0xd90d], length 1428
16:13:09.139468 IP 112.26.1.1.pmcd > 112.26.1.8.38123: Flags [.], seq 21421:22849, ack 1, win 4017, options [nop,nop,TS val 3210105 ecr 2988968,mptcp dss ack 724613416 seq 1583821026 subseq 21421 len 1428 csum 0x9960], length 1428
16:13:09.158898 IP 112.26.1.1.pmcd > 112.26.1.8.38123: Flags [.], seq 11425:12853, ack 1, win 4017, options [nop,nop,TS val 3209787 ecr 2988736,mptcp dss ack 724613416 seq 1583801034 subseq 11425 len 1428 csum 0xb8ec], length 1428
16:13:09.226049 IP 112.26.1.1.pmcd > 112.26.1.8.38123: Flags [.], seq 22849:24277, ack 1, win 4017, options [nop,nop,TS val 3210239 ecr 2989203,mptcp dss ack 724613416 seq 1583829594 subseq 22849 len 1428 csum 0x9cb3], length 1428
16:13:09.251876 IP 112.26.1.1.pmcd > 112.26.1.8.38123: Flags [.], seq 24277:25705, ack 1, win 4017, options [nop,nop,TS val 3210239 ecr 2989203,mptcp dss ack 724613416 seq 1583831022 subseq 24277 len 1428 csum 0x1c6c], length 1428
16:13:09.322719 IP 112.26.1.1.pmcd > 112.26.1.8.38123: Flags [.], seq 12853:14281, ack 1, win 4017, options [nop,nop,TS val 3209787 ecr 2988736,mptcp dss ack 724613416 seq 1583802462 subseq 12853 len 1428 csum 0xaa0a], length 1428
16:13:09.339734 IP 112.26.1.1.pmcd > 112.26.1.8.38123: Flags [.], seq 25705:27133, ack 1, win 4017, options [nop,nop,TS val 3210328 ecr 2989275,mptcp dss ack 724613416 seq 1583832450 subseq 25705 len 1428 csum 0xb854], length 1428
16:13:09.381388 IP 112.26.1.1.pmcd > 112.26.1.8.38123: Flags [.], seq 17137:18565, ack 1, win 4017, options [nop,nop,TS val 3209992 ecr 2988933,mptcp dss ack 724613416 seq 1583811030 subseq 17137 len 1428 csum 0x2152], length 1428
16:13:09.424003 IP 112.26.1.1.pmcd > 112.26.1.8.38123: Flags [.], seq 27133:28561, ack 1, win 4017, options [nop,nop,TS val 3210328 ecr 2989275,mptcp dss ack 724613416 seq 1583833878 subseq 27133 len 1428 csum 0xe00a], length 1428
16:13:09.474575 IP 112.26.1.1.pmcd > 112.26.1.8.38123: Flags [.], seq 28561:29989, ack 1, win 4017, options [nop,nop,TS val 3210511 ecr 2989483,mptcp dss ack 724613416 seq 1583838162 subseq 28561 len 1428 csum 0xfd2], length 1428
16:13:09.481764 IP 112.26.1.1.pmcd > 112.26.1.8.38123: Flags [.], seq 18565:19993, ack 1, win 4017, options [nop,nop,TS val 3209992 ecr 2988933,mptcp dss ack 724613416 seq 1583812458 subseq 18565 len 1428 csum 0x34fc], length 1428
16:13:09.558482 IP 112.26.1.1.pmcd > 112.26.1.8.38123: Flags [.], seq 19993:21421, ack 1, win 4017, options [nop,nop,TS val 3210105 ecr 2988968,mptcp dss ack 724613416 seq 1583819598 subseq 19993 len 1428 csum 0x805f], length 1428
16:13:09.571861 IP 112.26.1.1.pmcd > 112.26.1.8.38123: Flags [.], seq 29989:31417, ack 1, win 4017, options [nop,nop,TS val 3210511 ecr 2989483,mptcp dss ack 724613416 seq 1583839590 subseq 29989 len 1428 csum 0xf7a], length 1428
16:13:09.629167 IP 112.26.1.1.pmcd > 112.26.1.8.38123: Flags [.], seq 21421:22849, ack 1, win 4017, options [nop,nop,TS val 3210105 ecr 2988968,mptcp dss ack 724613416 seq 1583821026 subseq 21421 len 1428 csum 0x9960], length 1428
16:13:09.652846 IP 112.26.1.1.pmcd > 112.26.1.8.38123: Flags [.], seq 31417:32845, ack 1, win 4017, options [nop,nop,TS val 3210642 ecr 2989549,mptcp dss ack 724613416 seq 1583842446 subseq 31417 len 1428 csum 0x39c8], length 1428
16:13:09.709563 IP 112.26.1.1.pmcd > 112.26.1.8.38123: Flags [.], seq 22849:24277, ack 1, win 4017, options [nop,nop,TS val 3210239 ecr 2989203,mptcp dss ack 724613416 seq 1583829594 subseq 22849 len 1428 csum 0x9cb3], length 1428
16:13:09.730663 IP 112.26.1.1.pmcd > 112.26.1.8.38123: Flags [.], seq 32845:34273, ack 1, win 4017, options [nop,nop,TS val 3210642 ecr 2989549,mptcp dss ack 724613416 seq 1583843874 subseq 32845 len 1428 csum 0xe2bf], length 1428
16:13:09.784190 IP 112.26.1.1.pmcd > 112.26.1.8.38123: Flags [.], seq 34273:35701, ack 1, win 4017, options [nop,nop,TS val 3210780 ecr 2989677,mptcp dss ack 724613416 seq 1583845302 subseq 34273 len 1428 csum 0x7571], length 1428
16:13:09.818673 IP 112.26.1.1.pmcd > 112.26.1.8.38123: Flags [.], seq 25705:27133, ack 1, win 4017, options [nop,nop,TS val 3210328 ecr 2989275,mptcp dss ack 724613416 seq 1583832450 subseq 25705 len 1428 csum 0xb854], length 1428
16:13:09.859289 IP 112.26.1.1.pmcd > 112.26.1.8.38123: Flags [.], seq 35701:37129, ack 1, win 4017, options [nop,nop,TS val 3210780 ecr 2989677,mptcp dss ack 724613416 seq 1583846730 subseq 35701 len 1428 csum 0xecaf], length 1428
16:13:09.905576 IP 112.26.1.1.pmcd > 112.26.1.8.38123: Flags [.], seq 27133:28561, ack 1, win 4017, options [nop,nop,TS val 3210328 ecr 2989275,mptcp dss ack 724613416 seq 1583833878 subseq 27133 len 1428 csum 0xe00a], length 1428
16:13:09.912542 IP 112.26.1.1.pmcd > 112.26.1.8.38123: Flags [.], seq 37129:38557, ack 1, win 4017, options [nop,nop,TS val 3210879 ecr 2989801,mptcp dss ack 724613416 seq 1583851014 subseq 37129 len 1428 csum 0x1ac7], length 1428
16:13:09.970264 IP 112.26.1.1.pmcd > 112.26.1.8.38123: Flags [.], seq 28561:29989, ack 1, win 4017, options [nop,nop,TS val 3210511 ecr 2989483,mptcp dss ack 724613416 seq 1583838162 subseq 28561 len 1428 csum 0xfd2], length 1428
16:13:09.988020 IP 112.26.1.1.pmcd > 112.26.1.8.38123: Flags [.], seq 38557:39985, ack 1, win 4017, options [nop,nop,TS val 3210879 ecr 2989801,mptcp dss ack 724613416 seq 1583852442 subseq 38557 len 1428 csum 0x6b8e], length 1428
16:13:10.075329 IP 112.26.1.1.pmcd > 112.26.1.8.38123: Flags [.], seq 39985:41413, ack 1, win 4017, options [nop,nop,TS val 3211009 ecr 2989895,mptcp dss ack 724613416 seq 1583861010 subseq 39985 len 1428 csum 0x8ec5], length 1428
16:13:10.105677 IP 112.26.1.1.pmcd > 112.26.1.8.38123: Flags [.], seq 41413:42841, ack 1, win 4017, options [nop,nop,TS val 3211009 ecr 2989895,mptcp dss ack 724613416 seq 1583862438 subseq 41413 len 1428 csum 0x6975], length 1428
16:13:10.162258 IP 112.26.1.1.pmcd > 112.26.1.8.38123: Flags [.], seq 42841:44269, ack 1, win 4017, options [nop,nop,TS val 3211353 ecr 2990022,mptcp dss ack 724613416 seq 1583868150 subseq 42841 len 1428 csum 0x2081], length 1428
16:13:10.189402 IP 112.26.1.1.pmcd > 112.26.1.8.38123: Flags [.], seq 32845:34273, ack 1, win 4017, options [nop,nop,TS val 3210642 ecr 2989549,mptcp dss ack 724613416 seq 1583843874 subseq 32845 len 1428 csum 0xe2bf], length 1428
16:13:10.258121 IP 112.26.1.1.pmcd > 112.26.1.8.38123: Flags [.], seq 14281:15709, ack 1, win 4017, options [nop,nop,TS val 3211461 ecr 2990163,mptcp dss ack 724613416 seq 1583803890 subseq 14281 len 1428 csum 0xea77], length 1428
16:13:10.303787 IP 112.26.1.1.pmcd > 112.26.1.8.38123: Flags [.], seq 35701:37129, ack 1, win 4017, options [nop,nop,TS val 3210780 ecr 2989677,mptcp dss ack 724613416 seq 1583846730 subseq 35701 len 1428 csum 0xecaf], length 1428
16:13:10.331618 IP 112.26.1.1.pmcd > 112.26.1.8.38123: Flags [.], seq 37129:38557, ack 1, win 4017, options [nop,nop,TS val 3210879 ecr 2989801,mptcp dss ack 724613416 seq 1583851014 subseq 37129 len 1428 csum 0x1ac7], length 1428
16:13:10.336816 IP 112.26.1.1.pmcd > 112.26.1.8.38123: Flags [.], seq 15709:17137, ack 1, win 4017, options [nop,nop,TS val 3211533 ecr 2990249,mptcp dss ack 724613416 seq 1583805318 subseq 15709 len 1428 csum 0x90af], length 1428
16:13:10.414259 IP 112.26.1.1.pmcd > 112.26.1.8.38123: Flags [.], seq 38557:39985, ack 1, win 4017, options [nop,nop,TS val 3210879 ecr 2989801,mptcp dss ack 724613416 seq 1583852442 subseq 38557 len 1428 csum 0x6b8e], length 1428
16:13:10.434663 IP 112.26.1.1.pmcd > 112.26.1.8.38123: Flags [.], seq 44269:45697, ack 1, win 4017, options [nop,nop,TS val 3211776 ecr 2990414,mptcp dss ack 724613416 seq 1583878146 subseq 44269 len 1428 csum 0x2baf], length 1428
16:13:10.471980 IP 112.26.1.1.pmcd > 112.26.1.8.38123: Flags [.], seq 39985:41413, ack 1, win 4017, options [nop,nop,TS val 3211009 ecr 2989895,mptcp dss ack 724613416 seq 1583861010 subseq 39985 len 1428 csum 0x8ec5], length 1428
16:13:10.525838 IP 112.26.1.1.pmcd > 112.26.1.8.38123: Flags [.], seq 41413:42841, ack 1, win 4017, options [nop,nop,TS val 3211009 ecr 2989895,mptcp dss ack 724613416 seq 1583862438 subseq 41413 len 1428 csum 0x6975], length 1428
16:13:10.597259 IP 112.26.1.1.pmcd > 112.26.1.8.38123: Flags [.], seq 42841:44269, ack 1, win 4017, options [nop,nop,TS val 3211353 ecr 2990022,mptcp dss ack 724613416 seq 1583868150 subseq 42841 len 1428 csum 0x2081], length 1428
16:13:10.638671 IP 112.26.1.1.pmcd > 112.26.1.8.38123: Flags [.], seq 24277:25705, ack 1, win 4017, options [nop,nop,TS val 3211982 ecr 2990650,mptcp dss ack 724613416 seq 1583831022 subseq 24277 len 1428 csum 0x1c6c], length 1428
16:13:10.672991 IP 112.26.1.1.pmcd > 112.26.1.8.38123: Flags [.], seq 14281:15709, ack 1, win 4017, options [nop,nop,TS val 3211461 ecr 2990163,mptcp dss ack 724613416 seq 1583803890 subseq 14281 len 1428 csum 0xea77], length 1428
16:13:10.722911 IP 112.26.1.1.pmcd > 112.26.1.8.38123: Flags [.], seq 15709:17137, ack 1, win 4017, options [nop,nop,TS val 3211533 ecr 2990249,mptcp dss ack 724613416 seq 1583805318 subseq 15709 len 1428 csum 0x90af], length 1428
16:13:10.772275 IP 112.26.1.1.pmcd > 112.26.1.8.38123: Flags [.], seq 45697:47125, ack 1, win 4017, options [nop,nop,TS val 3212112 ecr 2990724,mptcp dss ack 724613416 seq 1583882430 subseq 45697 len 1428 csum 0x5325], length 1428
16:13:10.827704 IP 112.26.1.1.pmcd > 112.26.1.8.38123: Flags [.], seq 44269:45697, ack 1, win 4017, options [nop,nop,TS val 3211776 ecr 2990414,mptcp dss ack 724613416 seq 1583878146 subseq 44269 len 1428 csum 0x2baf], length 1428
16:13:10.883178 IP 112.26.1.1.pmcd > 112.26.1.8.38123: Flags [.], seq 24277:25705, ack 1, win 4017, options [nop,nop,TS val 3211982 ecr 2990650,mptcp dss ack 724613416 seq 1583831022 subseq 24277 len 1428 csum 0x1c6c], length 1428
16:13:10.928809 IP 112.26.1.1.pmcd > 112.26.1.8.38123: Flags [.], seq 45697:47125, ack 1, win 4017, options [nop,nop,TS val 3212112 ecr 2990724,mptcp dss ack 724613416 seq 1583882430 subseq 45697 len 1428 csum 0x5325], length 1428
16:13:11.049306 IP 112.26.1.1.pmcd > 112.26.1.8.38123: Flags [.], seq 29989:31417, ack 1, win 4017, options [nop,nop,TS val 3212389 ecr 2990985,mptcp dss ack 724613416 seq 1583839590 subseq 29989 len 1428 csum 0xf7a], length 1428
16:13:11.112826 IP 112.26.1.1.pmcd > 112.26.1.8.38123: Flags [.], seq 29989:31417, ack 1, win 4017, options [nop,nop,TS val 3212389 ecr 2990985,mptcp dss ack 724613416 seq 1583839590 subseq 29989 len 1428 csum 0xf7a], length 1428
16:13:11.221897 IP 112.26.1.1.pmcd > 112.26.1.8.38123: Flags [.], seq 31417:32845, ack 1, win 4017, options [nop,nop,TS val 3212564 ecr 2991181,mptcp dss ack 724613416 seq 1583842446 subseq 31417 len 1428 csum 0x39c8], length 1428
16:13:11.230266 IP 112.26.1.1.pmcd > 112.26.1.8.38123: Flags [.], seq 31417:32845, ack 1, win 4017, options [nop,nop,TS val 3212564 ecr 2991181,mptcp dss ack 724613416 seq 1583842446 subseq 31417 len 1428 csum 0x39c8], length 1428
16:13:11.327042 IP 112.26.1.1.pmcd > 112.26.1.8.38123: Flags [.], seq 34273:35701, ack 1, win 4017, options [nop,nop,TS val 3212670 ecr 2991261,mptcp dss ack 724613416 seq 1583845302 subseq 34273 len 1428 csum 0x7571], length 1428
16:13:11.395919 IP 112.26.1.1.pmcd > 112.26.1.8.38123: Flags [.], seq 34273:35701, ack 1, win 4017, options [nop,nop,TS val 3212670 ecr 2991261,mptcp dss ack 724613416 seq 1583845302 subseq 34273 len 1428 csum 0x7571], length 1428
16:13:11.496894 IP 112.26.1.1.pmcd > 112.26.1.8.38123: Flags [.], seq 39985:41413, ack 1, win 4017, options [nop,nop,TS val 3212839 ecr 2991446,mptcp dss ack 724613416 seq 1583861010 subseq 39985 len 1428 csum 0x8ec5], length 1428
16:13:11.510534 IP 112.26.1.1.pmcd > 112.26.1.8.38123: Flags [.], seq 39985:41413, ack 1, win 4017, options [nop,nop,TS val 3212839 ecr 2991446,mptcp dss ack 724613416 seq 1583861010 subseq 39985 len 1428 csum 0x8ec5], length 1428
16:13:11.588618 IP 112.26.1.1.pmcd > 112.26.1.8.38123: Flags [.], seq 47125:48553, ack 1, win 4017, options [nop,nop,TS val 3212887 ecr 2991446,mptcp dss ack 724613416 seq 1583899566 subseq 47125 len 1428 csum 0xfb], length 1428
16:13:11.593175 IP 112.26.1.1.pmcd > 112.26.1.8.38123: Flags [.], seq 47125:48553, ack 1, win 4017, options [nop,nop,TS val 3212887 ecr 2991446,mptcp dss ack 724613416 seq 1583899566 subseq 47125 len 1428 csum 0xfb], length 1428
16:13:11.656317 IP 112.26.1.1.pmcd > 112.26.1.8.38123: Flags [.], seq 42841:44269, ack 1, win 4017, options [nop,nop,TS val 3212991 ecr 2991619,mptcp dss ack 724613416 seq 1583868150 subseq 42841 len 1428 csum 0x2081], length 1428
16:13:11.707338 IP 112.26.1.1.pmcd > 112.26.1.8.38123: Flags [.], seq 42841:44269, ack 1, win 4017, options [nop,nop,TS val 3212991 ecr 2991619,mptcp dss ack 724613416 seq 1583868150 subseq 42841 len 1428 csum 0x2081], length 1428
16:13:11.718707 IP 112.26.1.1.pmcd > 112.26.1.8.38123: Flags [.], seq 48553:49981, ack 1, win 4017, options [nop,nop,TS val 3212991 ecr 2991619,mptcp dss ack 724613416 seq 1583903850 subseq 48553 len 1428 csum 0xb948], length 1428
16:13:11.781004 IP 112.26.1.1.pmcd > 112.26.1.8.38123: Flags [.], seq 49981:51409, ack 1, win 4017, options [nop,nop,TS val 3212991 ecr 2991619,mptcp dss ack 724613416 seq 1583905278 subseq 49981 len 1428 csum 0xfab6], length 1428
16:13:11.813812 IP 112.26.1.1.pmcd > 112.26.1.8.38123: Flags [.], seq 48553:49981, ack 1, win 4017, options [nop,nop,TS val 3212991 ecr 2991619,mptcp dss ack 724613416 seq 1583903850 subseq 48553 len 1428 csum 0xb948], length 1428
16:13:11.842994 IP 112.26.1.1.pmcd > 112.26.1.8.38123: Flags [.], seq 51409:52837, ack 1, win 4017, options [nop,nop,TS val 3212991 ecr 2991619,mptcp dss ack 724613416 seq 1583906706 subseq 51409 len 1428 csum 0x66c6], length 1428
16:13:11.910410 IP 112.26.1.1.pmcd > 112.26.1.8.38123: Flags [.], seq 49981:51409, ack 1, win 4017, options [nop,nop,TS val 3212991 ecr 2991619,mptcp dss ack 724613416 seq 1583905278 subseq 49981 len 1428 csum 0xfab6], length 1428
16:13:11.928995 IP 112.26.1.1.pmcd > 112.26.1.8.38123: Flags [.], seq 52837:54265, ack 1, win 4017, options [nop,nop,TS val 3212991 ecr 2991619,mptcp dss ack 724613416 seq 1583908134 subseq 52837 len 1428 csum 0xae9], length 1428
16:13:11.993450 IP 112.26.1.1.pmcd > 112.26.1.8.38123: Flags [.], seq 54265:55693, ack 1, win 4017, options [nop,nop,TS val 3213173 ecr 2991758,mptcp dss ack 724613416 seq 1583912418 subseq 54265 len 1428 csum 0x68a8], length 1428
16:13:12.042603 IP 112.26.1.1.pmcd > 112.26.1.8.38123: Flags [.], seq 51409:52837, ack 1, win 4017, options [nop,nop,TS val 3212991 ecr 2991619,mptcp dss ack 724613416 seq 1583906706 subseq 51409 len 1428 csum 0x66c6], length 1428
16:13:12.062072 IP 112.26.1.1.pmcd > 112.26.1.8.38123: Flags [.], seq 55693:57121, ack 1, win 4017, options [nop,nop,TS val 3213173 ecr 2991812,mptcp dss ack 724613416 seq 1583913846 subseq 55693 len 1428 csum 0xe2e6], length 1428
16:13:12.128699 IP 112.26.1.1.pmcd > 112.26.1.8.38123: Flags [.], seq 52837:54265, ack 1, win 4017, options [nop,nop,TS val 3212991 ecr 2991619,mptcp dss ack 724613416 seq 1583908134 subseq 52837 len 1428 csum 0xae9], length 1428
16:13:12.136613 IP 112.26.1.1.pmcd > 112.26.1.8.38123: Flags [.], seq 57121:58549, ack 1, win 4017, options [nop,nop,TS val 3213173 ecr 2991812,mptcp dss ack 724613416 seq 1583915274 subseq 57121 len 1428 csum 0x1a39], length 1428
16:13:12.199505 IP 112.26.1.1.pmcd > 112.26.1.8.38123: Flags [.], seq 58549:59977, ack 1, win 4017, options [nop,nop,TS val 3213280 ecr 2991883,mptcp dss ack 724613416 seq 1583919558 subseq 58549 len 1428 csum 0x41f5], length 1428
16:13:12.231196 IP 112.26.1.1.pmcd > 112.26.1.8.38123: Flags [.], seq 54265:55693, ack 1, win 4017, options [nop,nop,TS val 3213173 ecr 2991758,mptcp dss ack 724613416 seq 1583912418 subseq 54265 len 1428 csum 0x68a8], length 1428
16:13:12.264910 IP 112.26.1.1.pmcd > 112.26.1.8.38123: Flags [.], seq 59977:61405, ack 1, win 4017, options [nop,nop,TS val 3213370 ecr 2992029,mptcp dss ack 724613416 seq 1583925270 subseq 59977 len 1428 csum 0x95fa], length 1428
16:13:12.305061 IP 112.26.1.1.pmcd > 112.26.1.8.38123: Flags [.], seq 61405:62833, ack 1, win 4017, options [nop,nop,TS val 3213511 ecr 2992142,mptcp dss ack 724613416 seq 1583928126 subseq 61405 len 1428 csum 0x6f8a], length 1428
16:13:12.332205 IP 112.26.1.1.pmcd > 112.26.1.8.38123: Flags [.], seq 55693:57121, ack 1, win 4017, options [nop,nop,TS val 3213173 ecr 2991812,mptcp dss ack 724613416 seq 1583913846 subseq 55693 len 1428 csum 0xe2e6], length 1428
16:13:12.353274 IP 112.26.1.1.pmcd > 112.26.1.8.38123: Flags [.], seq 62833:64261, ack 1, win 4017, options [nop,nop,TS val 3213663 ecr 2992300,mptcp dss ack 724613416 seq 1583938122 subseq 62833 len 1428 csum 0x9e25], length 1428
16:13:12.424945 IP 112.26.1.1.pmcd > 112.26.1.8.38123: Flags [.], seq 64261:65689, ack 1, win 4017, options [nop,nop,TS val 3213767 ecr 2992392,mptcp dss ack 724613416 seq 1583940978 subseq 64261 len 1428 csum 0xc1f6], length 1428
16:13:12.435750 IP 112.26.1.1.pmcd > 112.26.1.8.38123: Flags [.], seq 57121:58549, ack 1, win 4017, options [nop,nop,TS val 3213173 ecr 2991812,mptcp dss ack 724613416 seq 1583915274 subseq 57121 len 1428 csum 0x1a39], length 1428
16:13:12.534457 IP 112.26.1.1.pmcd > 112.26.1.8.38123: Flags [.], seq 58549:59977, ack 1, win 4017, options [nop,nop,TS val 3213280 ecr 2991883,mptcp dss ack 724613416 seq 1583919558 subseq 58549 len 1428 csum 0x41f5], length 1428
16:13:12.560161 IP 112.26.1.1.pmcd > 112.26.1.8.38123: Flags [.], seq 65689:67117, ack 1, win 4017, options [nop,nop,TS val 3213902 ecr 2992548,mptcp dss ack 724613416 seq 1583948118 subseq 65689 len 1428 csum 0x7f85], length 1428
16:13:12.622365 IP 112.26.1.1.pmcd > 112.26.1.8.38123: Flags [.], seq 67117:68545, ack 1, win 4017, options [nop,nop,TS val 3213965 ecr 2992640,mptcp dss ack 724613416 seq 1583952402 subseq 67117 len 1428 csum 0xe36e], length 1428
16:13:12.646711 IP 112.26.1.1.pmcd > 112.26.1.8.38123: Flags [.], seq 59977:61405, ack 1, win 4017, options [nop,nop,TS val 3213370 ecr 2992029,mptcp dss ack 724613416 seq 1583925270 subseq 59977 len 1428 csum 0x95fa], length 1428
16:13:12.729052 IP 112.26.1.1.pmcd > 112.26.1.8.38123: Flags [.], seq 61405:62833, ack 1, win 4017, options [nop,nop,TS val 3213511 ecr 2992142,mptcp dss ack 724613416 seq 1583928126 subseq 61405 len 1428 csum 0x6f8a], length 1428
16:13:12.810523 IP 112.26.1.1.pmcd > 112.26.1.8.38123: Flags [.], seq 62833:64261, ack 1, win 4017, options [nop,nop,TS val 3213663 ecr 2992300,mptcp dss ack 724613416 seq 1583938122 subseq 62833 len 1428 csum 0x9e25], length 1428
16:13:12.837036 IP 112.26.1.1.pmcd > 112.26.1.8.38123: Flags [.], seq 68545:69973, ack 1, win 4017, options [nop,nop,TS val 3214177 ecr 2992797,mptcp dss ack 724613416 seq 1583958114 subseq 68545 len 1428 csum 0x4afe], length 1428
16:13:12.863632 IP 112.26.1.1.pmcd > 112.26.1.8.38123: Flags [.], seq 64261:65689, ack 1, win 4017, options [nop,nop,TS val 3213767 ecr 2992392,mptcp dss ack 724613416 seq 1583940978 subseq 64261 len 1428 csum 0xc1f6], length 1428
16:13:12.920245 IP 112.26.1.1.pmcd > 112.26.1.8.38123: Flags [.], seq 69973:71401, ack 1, win 4017, options [nop,nop,TS val 3214177 ecr 2992797,mptcp dss ack 724613416 seq 1583959542 subseq 69973 len 1428 csum 0x7b59], length 1428
16:13:12.968691 IP 112.26.1.1.pmcd > 112.26.1.8.38123: Flags [.], seq 65689:67117, ack 1, win 4017, options [nop,nop,TS val 3213902 ecr 2992548,mptcp dss ack 724613416 seq 1583948118 subseq 65689 len 1428 csum 0x7f85], length 1428
16:13:13.011377 IP 112.26.1.1.pmcd > 112.26.1.8.38123: Flags [.], seq 71401:72829, ack 1, win 4017, options [nop,nop,TS val 3214303 ecr 2992906,mptcp dss ack 724613416 seq 1583965254 subseq 71401 len 1428 csum 0x6a0d], length 1428
16:13:13.053325 IP 112.26.1.1.pmcd > 112.26.1.8.38123: Flags [.], seq 72829:74257, ack 1, win 4017, options [nop,nop,TS val 3214303 ecr 2992906,mptcp dss ack 724613416 seq 1583966682 subseq 72829 len 1428 csum 0x191c], length 1428
16:13:13.060155 IP 112.26.1.1.pmcd > 112.26.1.8.38123: Flags [.], seq 67117:68545, ack 1, win 4017, options [nop,nop,TS val 3213965 ecr 2992640,mptcp dss ack 724613416 seq 1583952402 subseq 67117 len 1428 csum 0xe36e], length 1428
16:13:13.134784 IP 112.26.1.1.pmcd > 112.26.1.8.38123: Flags [.], seq 68545:69973, ack 1, win 4017, options [nop,nop,TS val 3214177 ecr 2992797,mptcp dss ack 724613416 seq 1583958114 subseq 68545 len 1428 csum 0x4afe], length 1428
16:13:13.169456 IP 112.26.1.1.pmcd > 112.26.1.8.38123: Flags [.], seq 74257:75685, ack 1, win 4017, options [nop,nop,TS val 3214512 ecr 2993111,mptcp dss ack 724613416 seq 1583970966 subseq 74257 len 1428 csum 0xbbef], length 1428
16:13:13.209394 IP 112.26.1.1.pmcd > 112.26.1.8.38123: Flags [.], seq 69973:71401, ack 1, win 4017, options [nop,nop,TS val 3214177 ecr 2992797,mptcp dss ack 724613416 seq 1583959542 subseq 69973 len 1428 csum 0x7b59], length 1428
16:13:13.265718 IP 112.26.1.1.pmcd > 112.26.1.8.38123: Flags [.], seq 75685:77113, ack 1, win 4017, options [nop,nop,TS val 3214512 ecr 2993111,mptcp dss ack 724613416 seq 1583972394 subseq 75685 len 1428 csum 0x43a7], length 1428
16:13:13.282640 IP 112.26.1.1.pmcd > 112.26.1.8.38123: Flags [.], seq 71401:72829, ack 1, win 4017, options [nop,nop,TS val 3214303 ecr 2992906,mptcp dss ack 724613416 seq 1583965254 subseq 71401 len 1428 csum 0x6a0d], length 1428
16:13:13.350722 IP 112.26.1.1.pmcd > 112.26.1.8.38123: Flags [.], seq 77113:78541, ack 1, win 4017, options [nop,nop,TS val 3214512 ecr 2993111,mptcp dss ack 724613416 seq 1583973822 subseq 77113 len 1428 csum 0xeba3], length 1428
16:13:13.505973 IP 112.26.1.1.pmcd > 112.26.1.8.38123: Flags [.], seq 72829:74257, ack 1, win 4017, options [nop,nop,TS val 3214303 ecr 2992906,mptcp dss ack 724613416 seq 1583966682 subseq 72829 len 1428 csum 0x191c], length 1428
16:13:13.555349 IP 112.26.1.1.pmcd > 112.26.1.8.38123: Flags [.], seq 74257:75685, ack 1, win 4017, options [nop,nop,TS val 3214512 ecr 2993111,mptcp dss ack 724613416 seq 1583970966 subseq 74257 len 1428 csum 0xbbef], length 1428
16:13:13.620798 IP 112.26.1.1.pmcd > 112.26.1.8.38123: Flags [.], seq 75685:77113, ack 1, win 4017, options [nop,nop,TS val 3214512 ecr 2993111,mptcp dss ack 724613416 seq 1583972394 subseq 75685 len 1428 csum 0x43a7], length 1428
16:13:13.657141 IP 112.26.1.1.pmcd > 112.26.1.8.38123: Flags [.], seq 78541:79969, ack 1, win 4017, options [nop,nop,TS val 3214996 ecr 2993555,mptcp dss ack 724613416 seq 1583982390 subseq 78541 len 1428 csum 0x2512], length 1428
16:13:13.720865 IP 112.26.1.1.pmcd > 112.26.1.8.38123: Flags [.], seq 79969:81397, ack 1, win 4017, options [nop,nop,TS val 3214996 ecr 2993555,mptcp dss ack 724613416 seq 1583983818 subseq 79969 len 1428 csum 0x51c5], length 1428
16:13:13.746083 IP 112.26.1.1.pmcd > 112.26.1.8.38123: Flags [.], seq 77113:78541, ack 1, win 4017, options [nop,nop,TS val 3214512 ecr 2993111,mptcp dss ack 724613416 seq 1583973822 subseq 77113 len 1428 csum 0xeba3], length 1428
16:13:13.767794 IP 112.26.1.1.pmcd > 112.26.1.8.38123: Flags [.], seq 81397:82825, ack 1, win 4017, options [nop,nop,TS val 3214996 ecr 2993555,mptcp dss ack 724613416 seq 1583985246 subseq 81397 len 1428 csum 0x8343], length 1428
16:13:13.851926 IP 112.26.1.1.pmcd > 112.26.1.8.38123: Flags [.], seq 82825:84253, ack 1, win 4017, options [nop,nop,TS val 3214996 ecr 2993555,mptcp dss ack 724613416 seq 1583986674 subseq 82825 len 1428 csum 0xc29b], length 1428
16:13:13.940742 IP 112.26.1.1.pmcd > 112.26.1.8.38123: Flags [.], seq 84253:85681, ack 1, win 4017, options [nop,nop,TS val 3214996 ecr 2993555,mptcp dss ack 724613416 seq 1583988102 subseq 84253 len 1428 csum 0xbbd3], length 1428
16:13:13.947991 IP 112.26.1.1.pmcd > 112.26.1.8.38123: Flags [.], seq 78541:79969, ack 1, win 4017, options [nop,nop,TS val 3214996 ecr 2993555,mptcp dss ack 724613416 seq 1583982390 subseq 78541 len 1428 csum 0x2512], length 1428
16:13:14.023468 IP 112.26.1.1.pmcd > 112.26.1.8.38123: Flags [.], seq 79969:81397, ack 1, win 4017, options [nop,nop,TS val 3214996 ecr 2993555,mptcp dss ack 724613416 seq 1583983818 subseq 79969 len 1428 csum 0x51c5], length 1428
16:13:14.036985 IP 112.26.1.1.pmcd > 112.26.1.8.38123: Flags [.], seq 85681:87109, ack 1, win 4017, options [nop,nop,TS val 3215210 ecr 2993788,mptcp dss ack 724613416 seq 1583996670 subseq 85681 len 1428 csum 0x2d06], length 1428
16:13:14.079008 IP 112.26.1.1.pmcd > 112.26.1.8.38123: Flags [.], seq 87109:88537, ack 1, win 4017, options [nop,nop,TS val 3215210 ecr 2993788,mptcp dss ack 724613416 seq 1583998098 subseq 87109 len 1428 csum 0x5e83], length 1428
16:13:14.136238 IP 112.26.1.1.pmcd > 112.26.1.8.38123: Flags [.], seq 81397:82825, ack 1, win 4017, options [nop,nop,TS val 3214996 ecr 2993555,mptcp dss ack 724613416 seq 1583985246 subseq 81397 len 1428 csum 0x8343], length 1428
16:13:14.148045 IP 112.26.1.1.pmcd > 112.26.1.8.38123: Flags [.], seq 88537:89965, ack 1, win 4017, options [nop,nop,TS val 3215276 ecr 2993848,mptcp dss ack 724613416 seq 1583999526 subseq 88537 len 1428 csum 0x257d], length 1428
16:13:14.237084 IP 112.26.1.1.pmcd > 112.26.1.8.38123: Flags [.], seq 82825:84253, ack 1, win 4017, options [nop,nop,TS val 3214996 ecr 2993555,mptcp dss ack 724613416 seq 1583986674 subseq 82825 len 1428 csum 0xc29b], length 1428
16:13:14.276246 IP 112.26.1.1.pmcd > 112.26.1.8.38123: Flags [.], seq 84253:85681, ack 1, win 4017, options [nop,nop,TS val 3214996 ecr 2993555,mptcp dss ack 724613416 seq 1583988102 subseq 84253 len 1428 csum 0xbbd3], length 1428
16:13:14.292515 IP 112.26.1.1.pmcd > 112.26.1.8.38123: Flags [.], seq 89965:91393, ack 1, win 4017, options [nop,nop,TS val 3215633 ecr 2994220,mptcp dss ack 724613416 seq 1584010950 subseq 89965 len 1428 csum 0xa988], length 1428
16:13:14.367686 IP 112.26.1.1.pmcd > 112.26.1.8.38123: Flags [.], seq 91393:92821, ack 1, win 4017, options [nop,nop,TS val 3215633 ecr 2994220,mptcp dss ack 724613416 seq 1584012378 subseq 91393 len 1428 csum 0x951f], length 1428
16:13:14.394654 IP 112.26.1.1.pmcd > 112.26.1.8.38123: Flags [.], seq 85681:87109, ack 1, win 4017, options [nop,nop,TS val 3215210 ecr 2993788,mptcp dss ack 724613416 seq 1583996670 subseq 85681 len 1428 csum 0x2d06], length 1428
16:13:14.454913 IP 112.26.1.1.pmcd > 112.26.1.8.38123: Flags [.], seq 87109:88537, ack 1, win 4017, options [nop,nop,TS val 3215210 ecr 2993788,mptcp dss ack 724613416 seq 1583998098 subseq 87109 len 1428 csum 0x5e83], length 1428
16:13:14.466251 IP 112.26.1.1.pmcd > 112.26.1.8.38123: Flags [.], seq 92821:94249, ack 1, win 4017, options [nop,nop,TS val 3215633 ecr 2994220,mptcp dss ack 724613416 seq 1584013806 subseq 92821 len 1428 csum 0x28a8], length 1428
16:13:14.533938 IP 112.26.1.1.pmcd > 112.26.1.8.38123: Flags [.], seq 68545:69973, ack 1, win 4017, options [nop,nop,TS val 3215839 ecr 2994511,mptcp dss ack 724613416 seq 1583958114 subseq 68545 len 1428 csum 0x4afe], length 1428
16:13:14.549664 IP 112.26.1.1.pmcd > 112.26.1.8.38123: Flags [.], seq 88537:89965, ack 1, win 4017, options [nop,nop,TS val 3215276 ecr 2993848,mptcp dss ack 724613416 seq 1583999526 subseq 88537 len 1428 csum 0x257d], length 1428
16:13:14.601937 IP 112.26.1.1.pmcd > 112.26.1.8.38123: Flags [.], seq 89965:91393, ack 1, win 4017, options [nop,nop,TS val 3215633 ecr 2994220,mptcp dss ack 724613416 seq 1584010950 subseq 89965 len 1428 csum 0xa988], length 1428
16:13:14.630174 IP 112.26.1.1.pmcd > 112.26.1.8.38123: Flags [.], seq 71401:72829, ack 1, win 4017, options [nop,nop,TS val 3215929 ecr 2994581,mptcp dss ack 724613416 seq 1583965254 subseq 71401 len 1428 csum 0x6a0d], length 1428
16:13:14.679040 IP 112.26.1.1.pmcd > 112.26.1.8.38123: Flags [.], seq 91393:92821, ack 1, win 4017, options [nop,nop,TS val 3215633 ecr 2994220,mptcp dss ack 724613416 seq 1584012378 subseq 91393 len 1428 csum 0x951f], length 1428
16:13:14.747528 IP 112.26.1.1.pmcd > 112.26.1.8.38123: Flags [.], seq 92821:94249, ack 1, win 4017, options [nop,nop,TS val 3215633 ecr 2994220,mptcp dss ack 724613416 seq 1584013806 subseq 92821 len 1428 csum 0x28a8], length 1428
16:13:14.764940 IP 112.26.1.1.pmcd > 112.26.1.8.38123: Flags [.], seq 68545:69973, ack 1, win 4017, options [nop,nop,TS val 3215839 ecr 2994511,mptcp dss ack 724613416 seq 1583958114 subseq 68545 len 1428 csum 0x4afe], length 1428
16:13:14.846809 IP 112.26.1.1.pmcd > 112.26.1.8.38123: Flags [.], seq 71401:72829, ack 1, win 4017, options [nop,nop,TS val 3215929 ecr 2994581,mptcp dss ack 724613416 seq 1583965254 subseq 71401 len 1428 csum 0x6a0d], length 1428
16:13:15.077317 IP 112.26.1.1.pmcd > 112.26.1.8.38123: Flags [.], seq 75685:77113, ack 1, win 4017, options [nop,nop,TS val 3216416 ecr 2995082,mptcp dss ack 724613416 seq 1583972394 subseq 75685 len 1428 csum 0x43a7], length 1428
16:13:15.089139 IP 112.26.1.1.pmcd > 112.26.1.8.38123: Flags [.], seq 75685:77113, ack 1, win 4017, options [nop,nop,TS val 3216416 ecr 2995082,mptcp dss ack 724613416 seq 1583972394 subseq 75685 len 1428 csum 0x43a7], length 1428
16:13:15.270442 IP 112.26.1.1.pmcd > 112.26.1.8.38123: Flags [.], seq 82825:84253, ack 1, win 4017, options [nop,nop,TS val 3216613 ecr 2995225,mptcp dss ack 724613416 seq 1583986674 subseq 82825 len 1428 csum 0xc29b], length 1428
16:13:15.278291 IP 112.26.1.1.pmcd > 112.26.1.8.38123: Flags [.], seq 82825:84253, ack 1, win 4017, options [nop,nop,TS val 3216613 ecr 2995225,mptcp dss ack 724613416 seq 1583986674 subseq 82825 len 1428 csum 0xc29b], length 1428
16:13:15.397572 IP 112.26.1.1.pmcd > 112.26.1.8.38123: Flags [.], seq 94249:95677, ack 1, win 4017, options [nop,nop,TS val 3216738 ecr 2995366,mptcp dss ack 724613416 seq 1584039510 subseq 94249 len 1428 csum 0xfd99], length 1428
16:13:15.405920 IP 112.26.1.1.pmcd > 112.26.1.8.38123: Flags [.], seq 94249:95677, ack 1, win 4017, options [nop,nop,TS val 3216738 ecr 2995366,mptcp dss ack 724613416 seq 1584039510 subseq 94249 len 1428 csum 0xfd99], length 1428
16:13:15.471254 IP 112.26.1.1.pmcd > 112.26.1.8.38123: Flags [.], seq 95677:97105, ack 1, win 4017, options [nop,nop,TS val 3216738 ecr 2995366,mptcp dss ack 724613416 seq 1584040938 subseq 95677 len 1428 csum 0xc2b4], length 1428
16:13:15.492155 IP 112.26.1.1.pmcd > 112.26.1.8.38123: Flags [.], seq 95677:97105, ack 1, win 4017, options [nop,nop,TS val 3216738 ecr 2995366,mptcp dss ack 724613416 seq 1584040938 subseq 95677 len 1428 csum 0xc2b4], length 1428
16:13:15.540276 IP 112.26.1.1.pmcd > 112.26.1.8.38123: Flags [.], seq 97105:98533, ack 1, win 4017, options [nop,nop,TS val 3216761 ecr 2995422,mptcp dss ack 724613416 seq 1584043794 subseq 97105 len 1428 csum 0xd96e], length 1428
16:13:15.582773 IP 112.26.1.1.pmcd > 112.26.1.8.38123: Flags [.], seq 98533:99961, ack 1, win 4017, options [nop,nop,TS val 3216891 ecr 2995454,mptcp dss ack 724613416 seq 1584046650 subseq 98533 len 1428 csum 0x96e0], length 1428
16:13:15.605502 IP 112.26.1.1.pmcd > 112.26.1.8.38123: Flags [.], seq 97105:98533, ack 1, win 4017, options [nop,nop,TS val 3216761 ecr 2995422,mptcp dss ack 724613416 seq 1584043794 subseq 97105 len 1428 csum 0xd96e], length 1428
16:13:15.655694 IP 112.26.1.1.pmcd > 112.26.1.8.38123: Flags [.], seq 99961:101389, ack 1, win 4017, options [nop,nop,TS val 3216996 ecr 2995552,mptcp dss ack 724613416 seq 1584049506 subseq 99961 len 1428 csum 0xc9a8], length 1428
16:13:15.703557 IP 112.26.1.1.pmcd > 112.26.1.8.38123: Flags [.], seq 98533:99961, ack 1, win 4017, options [nop,nop,TS val 3216891 ecr 2995454,mptcp dss ack 724613416 seq 1584046650 subseq 98533 len 1428 csum 0x96e0], length 1428
16:13:15.762526 IP 112.26.1.1.pmcd > 112.26.1.8.38123: Flags [.], seq 101389:102817, ack 1, win 4017, options [nop,nop,TS val 3217105 ecr 2995619,mptcp dss ack 724613416 seq 1584052362 subseq 101389 len 1428 csum 0x495], length 1428
16:13:15.789904 IP 112.26.1.1.pmcd > 112.26.1.8.38123: Flags [.], seq 99961:101389, ack 1, win 4017, options [nop,nop,TS val 3216996 ecr 2995552,mptcp dss ack 724613416 seq 1584049506 subseq 99961 len 1428 csum 0xc9a8], length 1428
16:13:15.850756 IP 112.26.1.1.pmcd > 112.26.1.8.38123: Flags [.], seq 102817:104245, ack 1, win 4017, options [nop,nop,TS val 3217105 ecr 2995655,mptcp dss ack 724613416 seq 1584053790 subseq 102817 len 1428 csum 0x8c14], length 1428
16:13:15.865353 IP 112.26.1.1.pmcd > 112.26.1.8.38123: Flags [.], seq 101389:102817, ack 1, win 4017, options [nop,nop,TS val 3217105 ecr 2995619,mptcp dss ack 724613416 seq 1584052362 subseq 101389 len 1428 csum 0x495], length 1428
16:13:15.909192 IP 112.26.1.1.pmcd > 112.26.1.8.38123: Flags [.], seq 102817:104245, ack 1, win 4017, options [nop,nop,TS val 3217105 ecr 2995655,mptcp dss ack 724613416 seq 1584053790 subseq 102817 len 1428 csum 0x8c14], length 1428
16:13:15.950019 IP 112.26.1.1.pmcd > 112.26.1.8.38123: Flags [.], seq 104245:105673, ack 1, win 4017, options [nop,nop,TS val 3217105 ecr 2995655,mptcp dss ack 724613416 seq 1584055218 subseq 104245 len 1428 csum 0x61a2], length 1428
16:13:15.983438 IP 112.26.1.1.pmcd > 112.26.1.8.38123: Flags [.], seq 104245:105673, ack 1, win 4017, options [nop,nop,TS val 3217105 ecr 2995655,mptcp dss ack 724613416 seq 1584055218 subseq 104245 len 1428 csum 0x61a2], length 1428
16:13:16.013600 IP 112.26.1.1.pmcd > 112.26.1.8.38123: Flags [.], seq 105673:107101, ack 1, win 4017, options [nop,nop,TS val 3217155 ecr 2995769,mptcp dss ack 724613416 seq 1584063786 subseq 105673 len 1428 csum 0xf5e1], length 1428
16:13:16.077288 IP 112.26.1.1.pmcd > 112.26.1.8.38123: Flags [.], seq 105673:107101, ack 1, win 4017, options [nop,nop,TS val 3217155 ecr 2995769,mptcp dss ack 724613416 seq 1584063786 subseq 105673 len 1428 csum 0xf5e1], length 1428
16:13:16.086961 IP 112.26.1.1.pmcd > 112.26.1.8.38123: Flags [.], seq 107101:108529, ack 1, win 4017, options [nop,nop,TS val 3217303 ecr 2995914,mptcp dss ack 724613416 seq 1584066642 subseq 107101 len 1428 csum 0x85a5], length 1428
16:13:16.149303 IP 112.26.1.1.pmcd > 112.26.1.8.38123: Flags [.], seq 107101:108529, ack 1, win 4017, options [nop,nop,TS val 3217303 ecr 2995914,mptcp dss ack 724613416 seq 1584066642 subseq 107101 len 1428 csum 0x85a5], length 1428
16:13:16.185842 IP 112.26.1.1.pmcd > 112.26.1.8.38123: Flags [.], seq 108529:109957, ack 1, win 4017, options [nop,nop,TS val 3217508 ecr 2996111,mptcp dss ack 724613416 seq 1584072354 subseq 108529 len 1428 csum 0x2c88], length 1428
