20:39:27.537411 IP 112.26.1.8.42049 > 112.26.1.1.37653: Flags [S], seq 2263806240, win 65535, options [mss 1460,sackOK,TS val 783148 ecr 0,nop,wscale 6,mptcp join id 3 token 0xbaf08251 nonce 0x994c8d18], length 0
20:39:27.537763 IP 112.26.1.1.37653 > 112.26.1.8.42049: Flags [S.], seq 2869940820, ack 2263806241, win 65535, options [mss 1460,sackOK,TS val 1004073 ecr 783148,nop,wscale 6,mptcp join id 3 hmac 0xbf8861f17be900a7 nonce 0xbfe5d85c], length 0
20:39:27.662765 IP 112.26.1.1.37653 > 112.26.1.8.42049: Flags [S.], seq 2869940820, ack 2263806241, win 65535, options [mss 1460,sackOK,TS val 1004073 ecr 783148,nop,wscale 6,mptcp join id 3 hmac 0xbf8861f17be900a7 nonce 0xbfe5d85c], length 0
20:39:27.880191 IP 112.26.1.8.42049 > 112.26.1.1.37653: Flags [.], ack 1, win 7300, options [nop,nop,TS val 783491 ecr 1004073,mptcp join hmac 0xa3da383c27000032e8efc1c8d500fb8ad0766c38], length 0
20:39:27.880495 IP 112.26.1.1.37653 > 112.26.1.8.42049: Flags [.], ack 1, win 4017, options [nop,nop,TS val 1004415 ecr 783491,mptcp dss ack 4241485850], length 0
20:39:27.880745 IP 112.26.1.1.37653 > 112.26.1.8.42049: Flags [.], seq 1:1429, ack 1, win 4017, options [nop,nop,TS val 1004416 ecr 783491,mptcp dss ack 4241485850 seq 1969174006 subseq 1 len 1428 csum 0x409a], length 1428
20:39:27.880882 IP 112.26.1.1.37653 > 112.26.1.8.42049: Flags [.], seq 1429:2857, ack 1, win 4017, options [nop,nop,TS val 1004416 ecr 783491,mptcp dss ack 4241485850 seq 1969175434 subseq 1429 len 1428 csum 0xf0b4], length 1428
20:39:27.881006 IP 112.26.1.1.37653 > 112.26.1.8.42049: Flags [.], seq 2857:4285, ack 1, win 4017, options [nop,nop,TS val 1004416 ecr 783491,mptcp dss ack 4241485850 seq 1969176862 subseq 2857 len 1428 csum 0x6f93], length 1428
20:39:27.881151 IP 112.26.1.1.37653 > 112.26.1.8.42049: Flags [.], seq 4285:5713, ack 1, win 4017, options [nop,nop,TS val 1004416 ecr 783491,mptcp dss ack 4241485850 seq 1969178290 subseq 4285 len 1428 csum 0x80b2], length 1428
20:39:27.881278 IP 112.26.1.1.37653 > 112.26.1.8.42049: Flags [.], seq 5713:7141, ack 1, win 4017, options [nop,nop,TS val 1004416 ecr 783491,mptcp dss ack 4241485850 seq 1969179718 subseq 5713 len 1428 csum 0xfc], length 1428
20:39:27.881491 IP 112.26.1.1.37653 > 112.26.1.8.42049: Flags [.], seq 7141:8569, ack 1, win 4017, options [nop,nop,TS val 1004417 ecr 783491,mptcp dss ack 4241485850 seq 1969181146 subseq 7141 len 1428 csum 0xe330], length 1428
20:39:27.881619 IP 112.26.1.1.37653 > 112.26.1.8.42049: Flags [.], seq 8569:9997, ack 1, win 4017, options [nop,nop,TS val 1004417 ecr 783491,mptcp dss ack 4241485850 seq 1969182574 subseq 8569 len 1428 csum 0xc30f], length 1428
20:39:27.881742 IP 112.26.1.1.37653 > 112.26.1.8.42049: Flags [.], seq 9997:11425, ack 1, win 4017, options [nop,nop,TS val 1004417 ecr 783491,mptcp dss ack 4241485850 seq 1969184002 subseq 9997 len 1428 csum 0xb42d], length 1428
20:39:27.881899 IP 112.26.1.1.37653 > 112.26.1.8.42049: Flags [.], seq 11425:12853, ack 1, win 4017, options [nop,nop,TS val 1004417 ecr 783491,mptcp dss ack 4241485850 seq 1969185430 subseq 11425 len 1428 csum 0xf49a], length 1428
20:39:27.882026 IP 112.26.1.1.37653 > 112.26.1.8.42049: Flags [.], seq 12853:14281, ack 1, win 4017, options [nop,nop,TS val 1004417 ecr 783491,mptcp dss ack 4241485850 seq 1969186858 subseq 12853 len 1428 csum 0x9ad2], length 1428
20:39:27.998533 IP 112.26.1.1.37653 > 112.26.1.8.42049: Flags [.], ack 1, win 4017, options [nop,nop,TS val 1004415 ecr 783491,mptcp dss ack 4241485850], length 0
20:39:28.092586 IP 112.26.1.1.37653 > 112.26.1.8.42049: Flags [.], seq 1:1429, ack 1, win 4017, options [nop,nop,TS val 1004416 ecr 783491,mptcp dss ack 4241485850 seq 1969174006 subseq 1 len 1428 csum 0x409a], length 1428
20:39:28.162438 IP 112.26.1.8.42049 > 112.26.1.1.37653: Flags [.], ack 1429, win 7529, options [nop,nop,TS val 783874 ecr 1004416,mptcp dss ack 1969125454], length 0
20:39:28.162761 IP 112.26.1.1.37653 > 112.26.1.8.42049: Flags [.], seq 14281:15709, ack 1, win 4017, options [nop,nop,TS val 1004698 ecr 783874,mptcp dss ack 4241485850 seq 1969195426 subseq 14281 len 1428 csum 0x1a56], length 1428
20:39:28.162833 IP 112.26.1.1.37653 > 112.26.1.8.42049: Flags [.], seq 15709:17137, ack 1, win 4017, options [nop,nop,TS val 1004698 ecr 783874,mptcp dss ack 4241485850 seq 1969196854 subseq 15709 len 1428 csum 0x93a6], length 1428
20:39:28.240739 IP 112.26.1.1.37653 > 112.26.1.8.42049: Flags [.], seq 1429:2857, ack 1, win 4017, options [nop,nop,TS val 1004416 ecr 783491,mptcp dss ack 4241485850 seq 1969175434 subseq 1429 len 1428 csum 0xf0b4], length 1428
20:39:28.296037 IP 112.26.1.8.42049 > 112.26.1.1.37653: Flags [.], ack 2857, win 7711, options [nop,nop,TS val 784023 ecr 1004416,mptcp dss ack 1969126882], length 0
20:39:28.296328 IP 112.26.1.1.37653 > 112.26.1.8.42049: Flags [.], seq 17137:18565, ack 1, win 4017, options [nop,nop,TS val 1004832 ecr 784023,mptcp dss ack 4241485850 seq 1969202566 subseq 17137 len 1428 csum 0xa917], length 1428
20:39:28.296403 IP 112.26.1.1.37653 > 112.26.1.8.42049: Flags [.], seq 18565:19993, ack 1, win 4017, options [nop,nop,TS val 1004832 ecr 784023,mptcp dss ack 4241485850 seq 1969203994 subseq 18565 len 1428 csum 0xa6fb], length 1428
20:39:28.374648 IP 112.26.1.1.37653 > 112.26.1.8.42049: Flags [.], seq 2857:4285, ack 1, win 4017, options [nop,nop,TS val 1004416 ecr 783491,mptcp dss ack 4241485850 seq 1969176862 subseq 2857 len 1428 csum 0x6f93], length 1428
20:39:28.411175 IP 112.26.1.8.42049 > 112.26.1.1.37653: Flags [.], ack 4285, win 7848, options [nop,nop,TS val 784156 ecr 1004416,mptcp dss ack 1969134022], length 0
20:39:28.411462 IP 112.26.1.1.37653 > 112.26.1.8.42049: Flags [.], seq 19993:21421, ack 1, win 4017, options [nop,nop,TS val 1004947 ecr 784156,mptcp dss ack 4241485850 seq 1969213990 subseq 19993 len 1428 csum 0xcd9f], length 1428
20:39:28.411534 IP 112.26.1.1.37653 > 112.26.1.8.42049: Flags [.], seq 21421:22849, ack 1, win 4017, options [nop,nop,TS val 1004947 ecr 784156,mptcp dss ack 4241485850 seq 1969215418 subseq 21421 len 1428 csum 0xf555], length 1428
20:39:28.619869 IP 112.26.1.1.37653 > 112.26.1.8.42049: Flags [.], seq 4285:5713, ack 1, win 4017, options [nop,nop,TS val 1004416 ecr 783491,mptcp dss ack 4241485850 seq 1969178290 subseq 4285 len 1428 csum 0x80b2], length 1428
20:39:28.704467 IP 112.26.1.8.42049 > 112.26.1.1.37653: Flags [.], ack 5713, win 8076, options [nop,nop,TS val 784404 ecr 1004416,mptcp dss ack 1969136878], length 0
20:39:28.704756 IP 112.26.1.1.37653 > 112.26.1.8.42049: Flags [.], seq 22849:24277, ack 1, win 4017, options [nop,nop,TS val 1005240 ecr 784404,mptcp dss ack 4241485850 seq 1969228270 subseq 22849 len 1428 csum 0x1ddf], length 1428
20:39:28.704829 IP 112.26.1.1.37653 > 112.26.1.8.42049: Flags [.], seq 24277:25705, ack 1, win 4017, options [nop,nop,TS val 1005240 ecr 784404,mptcp dss ack 4241485850 seq 1969229698 subseq 24277 len 1428 csum 0xd84c], length 1428
20:39:28.747127 IP 112.26.1.1.37653 > 112.26.1.8.42049: Flags [.], seq 5713:7141, ack 1, win 4017, options [nop,nop,TS val 1004416 ecr 783491,mptcp dss ack 4241485850 seq 1969179718 subseq 5713 len 1428 csum 0xfc], length 1428
20:39:28.824642 IP 112.26.1.8.42049 > 112.26.1.1.37653: Flags [.], ack 7141, win 8167, options [nop,nop,TS val 784529 ecr 1004416,mptcp dss ack 1969136878], length 0
20:39:28.824990 IP 112.26.1.1.37653 > 112.26.1.8.42049: Flags [.], seq 25705:27133, ack 1, win 4017, options [nop,nop,TS val 1005360 ecr 784529,mptcp dss ack 4241485850 seq 1969236838 subseq 25705 len 1428 csum 0x93b8], length 1428
20:39:28.825089 IP 112.26.1.1.37653 > 112.26.1.8.42049: Flags [.], seq 27133:28561, ack 1, win 4017, options [nop,nop,TS val 1005360 ecr 784529,mptcp dss ack 4241485850 seq 1969238266 subseq 27133 len 1428 csum 0x7103], length 1428
20:39:28.903991 IP 112.26.1.1.37653 > 112.26.1.8.42049: Flags [.], seq 7141:8569, ack 1, win 4017, options [nop,nop,TS val 1004417 ecr 783491,mptcp dss ack 4241485850 seq 1969181146 subseq 7141 len 1428 csum 0xe330], length 1428
20:39:29.034942 IP 112.26.1.1.37653 > 112.26.1.8.42049: Flags [.], seq 8569:9997, ack 1, win 4017, options [nop,nop,TS val 1004417 ecr 783491,mptcp dss ack 4241485850 seq 1969182574 subseq 8569 len 1428 csum 0xc30f], length 1428
20:39:29.228274 IP 112.26.1.1.37653 > 112.26.1.8.42049: Flags [.], seq 9997:11425, ack 1, win 4017, options [nop,nop,TS val 1004417 ecr 783491,mptcp dss ack 4241485850 seq 1969184002 subseq 9997 len 1428 csum 0xb42d], length 1428
20:39:29.364966 IP 112.26.1.1.37653 > 112.26.1.8.42049: Flags [.], seq 11425:12853, ack 1, win 4017, options [nop,nop,TS val 1004417 ecr 783491,mptcp dss ack 4241485850 seq 1969185430 subseq 11425 len 1428 csum 0xf49a], length 1428
20:39:29.489608 IP 112.26.1.1.37653 > 112.26.1.8.42049: Flags [.], seq 14281:15709, ack 1, win 4017, options [nop,nop,TS val 1004698 ecr 783874,mptcp dss ack 4241485850 seq 1969195426 subseq 14281 len 1428 csum 0x1a56], length 1428
20:39:29.574035 IP 112.26.1.1.37653 > 112.26.1.8.42049: Flags [.], seq 15709:17137, ack 1, win 4017, options [nop,nop,TS val 1004698 ecr 783874,mptcp dss ack 4241485850 seq 1969196854 subseq 15709 len 1428 csum 0x93a6], length 1428
20:39:29.608026 IP 112.26.1.1.37653 > 112.26.1.8.42049: Flags [.], seq 27133:28561, ack 1, win 4017, options [nop,nop,TS val 1006144 ecr 784529,mptcp dss ack 4241485850 seq 1969238266 subseq 27133 len 1428 csum 0x7103], length 1428
20:39:29.685186 IP 112.26.1.1.37653 > 112.26.1.8.42049: Flags [.], seq 17137:18565, ack 1, win 4017, options [nop,nop,TS val 1004832 ecr 784023,mptcp dss ack 4241485850 seq 1969202566 subseq 17137 len 1428 csum 0xa917], length 1428
20:39:29.839421 IP 112.26.1.1.37653 > 112.26.1.8.42049: Flags [.], seq 18565:19993, ack 1, win 4017, options [nop,nop,TS val 1004832 ecr 784023,mptcp dss ack 4241485850 seq 1969203994 subseq 18565 len 1428 csum 0xa6fb], length 1428
20:39:29.875178 IP 112.26.1.8.42049 > 112.26.1.1.37653: Flags [.], ack 8569, win 8395, options [nop,nop,TS val 784690 ecr 1004417,mptcp dss ack 1969139734], length 0
20:39:29.875645 IP 112.26.1.1.37653 > 112.26.1.8.42049: Flags [.], seq 28561:29989, ack 1, win 4017, options [nop,nop,TS val 1006411 ecr 784690,mptcp dss ack 4241485850 seq 1969256830 subseq 28561 len 1428 csum 0x306], length 1428
20:39:29.875715 IP 112.26.1.1.37653 > 112.26.1.8.42049: Flags [.], seq 29989:31417, ack 1, win 4017, options [nop,nop,TS val 1006411 ecr 784690,mptcp dss ack 4241485850 seq 1969258258 subseq 29989 len 1428 csum 0x8834], length 1428
20:39:29.973192 IP 112.26.1.1.37653 > 112.26.1.8.42049: Flags [.], seq 19993:21421, ack 1, win 4017, options [nop,nop,TS val 1004947 ecr 784156,mptcp dss ack 4241485850 seq 1969213990 subseq 19993 len 1428 csum 0xcd9f], length 1428
20:39:30.020961 IP 112.26.1.8.42049 > 112.26.1.1.37653: Flags [.], ack 9997, win 8578, options [nop,nop,TS val 784817 ecr 1004417,mptcp dss ack 1969139734], length 0
20:39:30.021268 IP 112.26.1.1.37653 > 112.26.1.8.42049: Flags [.], seq 31417:32845, ack 1, win 4017, options [nop,nop,TS val 1006556 ecr 784817,mptcp dss ack 4241485850 seq 1969259686 subseq 31417 len 1428 csum 0x5cde], length 1428
20:39:30.021343 IP 112.26.1.1.37653 > 112.26.1.8.42049: Flags [.], seq 32845:34273, ack 1, win 4017, options [nop,nop,TS val 1006556 ecr 784817,mptcp dss ack 4241485850 seq 1969261114 subseq 32845 len 1428 csum 0xb6a4], length 1428
20:39:30.122296 IP 112.26.1.8.42049 > 112.26.1.1.37653: Flags [.], ack 11425, win 8760, options [nop,nop,TS val 785010 ecr 1004417,mptcp dss ack 1969139734], length 0
20:39:30.122625 IP 112.26.1.1.37653 > 112.26.1.8.42049: Flags [.], seq 34273:35701, ack 1, win 4017, options [nop,nop,TS val 1006658 ecr 785010,mptcp dss ack 4241485850 seq 1969262542 subseq 34273 len 1428 csum 0x3730], length 1428
20:39:30.122704 IP 112.26.1.1.37653 > 112.26.1.8.42049: Flags [.], seq 35701:37129, ack 1, win 4017, options [nop,nop,TS val 1006658 ecr 785010,mptcp dss ack 4241485850 seq 1969263970 subseq 35701 len 1428 csum 0x792c], length 1428
20:39:30.177146 IP 112.26.1.1.37653 > 112.26.1.8.42049: Flags [.], seq 22849:24277, ack 1, win 4017, options [nop,nop,TS val 1005240 ecr 784404,mptcp dss ack 4241485850 seq 1969228270 subseq 22849 len 1428 csum 0x1ddf], length 1428
20:39:30.218999 IP 112.26.1.8.42049 > 112.26.1.1.37653: Flags [.], ack 12853, win 8897, options [nop,nop,TS val 785145 ecr 1004417,mptcp dss ack 1969139734], length 0
20:39:30.219313 IP 112.26.1.1.37653 > 112.26.1.8.42049: Flags [.], seq 37129:38557, ack 1, win 4017, options [nop,nop,TS val 1006755 ecr 785145,mptcp dss ack 4241485850 seq 1969272538 subseq 37129 len 1428 csum 0x457c], length 1428
20:39:30.219389 IP 112.26.1.1.37653 > 112.26.1.8.42049: Flags [.], seq 38557:39985, ack 1, win 4017, options [nop,nop,TS val 1006755 ecr 785145,mptcp dss ack 4241485850 seq 1969273966 subseq 38557 len 1428 csum 0x2ec8], length 1428
20:39:30.309677 IP 112.26.1.1.37653 > 112.26.1.8.42049: Flags [.], seq 24277:25705, ack 1, win 4017, options [nop,nop,TS val 1005240 ecr 784404,mptcp dss ack 4241485850 seq 1969229698 subseq 24277 len 1428 csum 0xd84c], length 1428
20:39:30.333309 IP 112.26.1.8.42049 > 112.26.1.1.37653: Flags [.], ack 12853, win 9080, options [nop,nop,TS val 785271 ecr 1004417,nop,nop,sack 1 {14281:15709},mptcp dss ack 1969139734], length 0
20:39:30.341552 IP 112.26.1.1.37653 > 112.26.1.8.42049: Flags [.], seq 39985:41413, ack 1, win 4017, options [nop,nop,TS val 1006877 ecr 785271,mptcp dss ack 4241485850 seq 1969276822 subseq 39985 len 1428 csum 0x43ec], length 1428
20:39:30.404192 IP 112.26.1.8.42049 > 112.26.1.1.37653: Flags [.], ack 12853, win 9262, options [nop,nop,TS val 785403 ecr 1004417,nop,nop,sack 1 {14281:17137},mptcp dss ack 1969139734], length 0
20:39:30.436507 IP 112.26.1.1.37653 > 112.26.1.8.42049: Flags [.], seq 41413:42841, ack 1, win 4017, options [nop,nop,TS val 1006972 ecr 785403,mptcp dss ack 4241485850 seq 1969278250 subseq 41413 len 1428 csum 0xdd27], length 1428
20:39:30.444372 IP 112.26.1.1.37653 > 112.26.1.8.42049: Flags [.], seq 25705:27133, ack 1, win 4017, options [nop,nop,TS val 1005360 ecr 784529,mptcp dss ack 4241485850 seq 1969236838 subseq 25705 len 1428 csum 0x93b8], length 1428
20:39:30.547003 IP 112.26.1.8.42049 > 112.26.1.1.37653: Flags [.], ack 12853, win 9399, options [nop,nop,TS val 785515 ecr 1004417,nop,nop,sack 1 {14281:18565},mptcp dss ack 1969139734], length 0
20:39:30.547264 IP 112.26.1.1.37653 > 112.26.1.8.42049: Flags [.], seq 12853:14281, ack 1, win 4017, options [nop,nop,TS val 1007083 ecr 785515,mptcp dss ack 4241485850 seq 1969186858 subseq 12853 len 1428 csum 0x9ad2], length 1428
20:39:30.555671 IP 112.26.1.1.37653 > 112.26.1.8.42049: Flags [.], seq 27133:28561, ack 1, win 4017, options [nop,nop,TS val 1005360 ecr 784529,mptcp dss ack 4241485850 seq 1969238266 subseq 27133 len 1428 csum 0x7103], length 1428
20:39:30.710823 IP 112.26.1.1.37653 > 112.26.1.8.42049: Flags [.], seq 27133:28561, ack 1, win 4017, options [nop,nop,TS val 1006144 ecr 784529,mptcp dss ack 4241485850 seq 1969238266 subseq 27133 len 1428 csum 0x7103], length 1428
20:39:30.723577 IP 112.26.1.8.42049 > 112.26.1.1.37653: Flags [.], ack 12853, win 9536, options [nop,nop,TS val 785619 ecr 1004417,nop,nop,sack 1 {14281:19993},mptcp dss ack 1969139734], length 0
20:39:30.761735 IP 112.26.1.1.37653 > 112.26.1.8.42049: Flags [.], seq 42841:44269, ack 1, win 4017, options [nop,nop,TS val 1007297 ecr 785619,mptcp dss ack 4241485850 seq 1969288246 subseq 42841 len 1428 csum 0x8739], length 1428
20:39:30.801243 IP 112.26.1.1.37653 > 112.26.1.8.42049: Flags [.], seq 28561:29989, ack 1, win 4017, options [nop,nop,TS val 1006411 ecr 784690,mptcp dss ack 4241485850 seq 1969256830 subseq 28561 len 1428 csum 0x306], length 1428
20:39:30.923916 IP 112.26.1.1.37653 > 112.26.1.8.42049: Flags [.], seq 29989:31417, ack 1, win 4017, options [nop,nop,TS val 1006411 ecr 784690,mptcp dss ack 4241485850 seq 1969258258 subseq 29989 len 1428 csum 0x8834], length 1428
20:39:30.960214 IP 112.26.1.8.42049 > 112.26.1.1.37653: Flags [.], ack 12853, win 9901, options [nop,nop,TS val 785957 ecr 1004417,nop,nop,sack 2 {22849:24277}{14281:21421},mptcp dss ack 1969139734], length 0
20:39:30.960708 IP 112.26.1.1.37653 > 112.26.1.8.42049: Flags [.], seq 21421:22849, ack 1, win 4017, options [nop,nop,TS val 1007496 ecr 785957,mptcp dss ack 4241485850 seq 1969215418 subseq 21421 len 1428 csum 0xf555], length 1428
20:39:31.061182 IP 112.26.1.1.37653 > 112.26.1.8.42049: Flags [.], seq 31417:32845, ack 1, win 4017, options [nop,nop,TS val 1006556 ecr 784817,mptcp dss ack 4241485850 seq 1969259686 subseq 31417 len 1428 csum 0x5cde], length 1428
20:39:31.096072 IP 112.26.1.8.42049 > 112.26.1.1.37653: Flags [.], ack 12853, win 10266, options [nop,nop,TS val 786273 ecr 1004417,nop,nop,sack 2 {22849:27133}{14281:21421},mptcp dss ack 1969139734], length 0
20:39:31.104617 IP 112.26.1.1.37653 > 112.26.1.8.42049: Flags [.], seq 44269:45697, ack 1, win 4017, options [nop,nop,TS val 1007640 ecr 786273,mptcp dss ack 4241485850 seq 1969303954 subseq 44269 len 1428 csum 0x24f2], length 1428
20:39:31.104749 IP 112.26.1.1.37653 > 112.26.1.8.42049: Flags [.], seq 45697:47125, ack 1, win 4017, options [nop,nop,TS val 1007640 ecr 786273,mptcp dss ack 4241485850 seq 1969305382 subseq 45697 len 1428 csum 0xd349], length 1428
20:39:31.229526 IP 112.26.1.1.37653 > 112.26.1.8.42049: Flags [.], seq 32845:34273, ack 1, win 4017, options [nop,nop,TS val 1006556 ecr 784817,mptcp dss ack 4241485850 seq 1969261114 subseq 32845 len 1428 csum 0xb6a4], length 1428
20:39:31.246753 IP 112.26.1.8.42049 > 112.26.1.1.37653: Flags [.], ack 12853, win 10403, options [nop,nop,TS val 786367 ecr 1004417,nop,nop,sack 2 {22849:28561}{14281:21421},mptcp dss ack 1969139734], length 0
20:39:31.312484 IP 112.26.1.1.37653 > 112.26.1.8.42049: Flags [.], seq 34273:35701, ack 1, win 4017, options [nop,nop,TS val 1006658 ecr 785010,mptcp dss ack 4241485850 seq 1969262542 subseq 34273 len 1428 csum 0x3730], length 1428
20:39:31.365499 IP 112.26.1.8.42049 > 112.26.1.1.37653: Flags [.], ack 12853, win 10585, options [nop,nop,TS val 786495 ecr 1004417,nop,nop,sack 2 {27133:28561}{22849:28561},mptcp dss ack 1969139734], length 0
20:39:31.377620 IP 112.26.1.1.37653 > 112.26.1.8.42049: Flags [.], seq 47125:48553, ack 1, win 4017, options [nop,nop,TS val 1007913 ecr 786495,mptcp dss ack 4241485850 seq 1969313950 subseq 47125 len 1428 csum 0x4359], length 1428
20:39:31.465825 IP 112.26.1.1.37653 > 112.26.1.8.42049: Flags [.], seq 35701:37129, ack 1, win 4017, options [nop,nop,TS val 1006658 ecr 785010,mptcp dss ack 4241485850 seq 1969263970 subseq 35701 len 1428 csum 0x792c], length 1428
20:39:31.537725 IP 112.26.1.8.42049 > 112.26.1.1.37653: Flags [.], ack 12853, win 10722, options [nop,nop,TS val 786601 ecr 1004417,nop,nop,sack 2 {22849:29989}{14281:21421},mptcp dss ack 1969139734], length 0
20:39:31.566792 IP 112.26.1.1.37653 > 112.26.1.8.42049: Flags [.], seq 48553:49981, ack 1, win 4017, options [nop,nop,TS val 1008102 ecr 786601,mptcp dss ack 4241485850 seq 1969318234 subseq 48553 len 1428 csum 0xbad8], length 1428
20:39:31.617826 IP 112.26.1.1.37653 > 112.26.1.8.42049: Flags [.], seq 37129:38557, ack 1, win 4017, options [nop,nop,TS val 1006755 ecr 785145,mptcp dss ack 4241485850 seq 1969272538 subseq 37129 len 1428 csum 0x457c], length 1428
20:39:31.687951 IP 112.26.1.8.42049 > 112.26.1.1.37653: Flags [.], ack 12853, win 10859, options [nop,nop,TS val 786704 ecr 1004417,nop,nop,sack 2 {22849:31417}{14281:21421},mptcp dss ack 1969139734], length 0
20:39:31.790138 IP 112.26.1.8.42049 > 112.26.1.1.37653: Flags [.], ack 12853, win 10996, options [nop,nop,TS val 786844 ecr 1004417,nop,nop,sack 2 {22849:32845}{14281:21421},mptcp dss ack 1969139734], length 0
20:39:31.815379 IP 112.26.1.1.37653 > 112.26.1.8.42049: Flags [.], seq 49981:51409, ack 1, win 4017, options [nop,nop,TS val 1008351 ecr 786844,mptcp dss ack 4241485850 seq 1969322518 subseq 49981 len 1428 csum 0xf8b9], length 1428
20:39:31.874988 IP 112.26.1.1.37653 > 112.26.1.8.42049: Flags [.], seq 39985:41413, ack 1, win 4017, options [nop,nop,TS val 1006877 ecr 785271,mptcp dss ack 4241485850 seq 1969276822 subseq 39985 len 1428 csum 0x43ec], length 1428
20:39:31.915380 IP 112.26.1.8.42049 > 112.26.1.1.37653: Flags [.], ack 12853, win 11179, options [nop,nop,TS val 787009 ecr 1004417,nop,nop,sack 2 {22849:34273}{14281:21421},mptcp dss ack 1969141162], length 0
20:39:31.969290 IP 112.26.1.1.37653 > 112.26.1.8.42049: Flags [.], seq 51409:52837, ack 1, win 4017, options [nop,nop,TS val 1008505 ecr 787009,mptcp dss ack 4241485850 seq 1969326802 subseq 51409 len 1428 csum 0xa1aa], length 1428
20:39:32.010376 IP 112.26.1.1.37653 > 112.26.1.8.42049: Flags [.], seq 12853:14281, ack 1, win 4017, options [nop,nop,TS val 1007083 ecr 785515,mptcp dss ack 4241485850 seq 1969186858 subseq 12853 len 1428 csum 0x9ad2], length 1428
20:39:32.035821 IP 112.26.1.8.42049 > 112.26.1.1.37653: Flags [.], ack 12853, win 11361, options [nop,nop,TS val 787154 ecr 1004417,nop,nop,sack 2 {22849:35701}{14281:21421},mptcp dss ack 1969141162], length 0
20:39:32.136896 IP 112.26.1.1.37653 > 112.26.1.8.42049: Flags [.], seq 42841:44269, ack 1, win 4017, options [nop,nop,TS val 1007297 ecr 785619,mptcp dss ack 4241485850 seq 1969288246 subseq 42841 len 1428 csum 0x8739], length 1428
20:39:32.155992 IP 112.26.1.8.42049 > 112.26.1.1.37653: Flags [.], ack 12853, win 11498, options [nop,nop,TS val 787265 ecr 1004417,nop,nop,sack 2 {22849:37129}{14281:21421},mptcp dss ack 1969141162], length 0
20:39:32.251138 IP 112.26.1.1.37653 > 112.26.1.8.42049: Flags [.], seq 21421:22849, ack 1, win 4017, options [nop,nop,TS val 1007496 ecr 785957,mptcp dss ack 4241485850 seq 1969215418 subseq 21421 len 1428 csum 0xf555], length 1428
20:39:32.337899 IP 112.26.1.8.42049 > 112.26.1.1.37653: Flags [.], ack 12853, win 11680, options [nop,nop,TS val 787400 ecr 1004417,nop,nop,sack 2 {22849:38557}{14281:21421},mptcp dss ack 1969141162], length 0
20:39:32.352989 IP 112.26.1.1.37653 > 112.26.1.8.42049: Flags [.], seq 52837:54265, ack 1, win 4017, options [nop,nop,TS val 1008888 ecr 787400,mptcp dss ack 4241485850 seq 1969336798 subseq 52837 len 1428 csum 0xf1ba], length 1428
20:39:32.413114 IP 112.26.1.1.37653 > 112.26.1.8.42049: Flags [.], seq 44269:45697, ack 1, win 4017, options [nop,nop,TS val 1007640 ecr 786273,mptcp dss ack 4241485850 seq 1969303954 subseq 44269 len 1428 csum 0x24f2], length 1428
20:39:32.477156 IP 112.26.1.8.42049 > 112.26.1.1.37653: Flags [.], ack 12853, win 11909, options [nop,nop,TS val 787656 ecr 1004417,nop,nop,sack 2 {39985:41413}{22849:38557},mptcp dss ack 1969141162], length 0
20:39:32.477580 IP 112.26.1.1.37653 > 112.26.1.8.42049: Flags [.], seq 38557:39985, ack 1, win 4017, options [nop,nop,TS val 1009013 ecr 787656,mptcp dss ack 4241485850 seq 1969273966 subseq 38557 len 1428 csum 0x2ec8], length 1428
20:39:32.577502 IP 112.26.1.8.42049 > 112.26.1.1.37653: Flags [.], ack 21421, win 12091, options [nop,nop,TS val 787792 ecr 1007083,nop,nop,sack 2 {39985:41413}{22849:38557},mptcp dss ack 1969141162], length 0
20:39:32.577791 IP 112.26.1.1.37653 > 112.26.1.8.42049: Flags [.], seq 41413:42841, ack 1, win 4017, options [nop,nop,TS val 1009113 ecr 787792,mptcp dss ack 4241485850 seq 1969278250 subseq 41413 len 1428 csum 0xdd27], length 1428
20:39:32.577867 IP 112.26.1.1.37653 > 112.26.1.8.42049: Flags [.], seq 54265:55693, ack 1, win 4017, options [nop,nop,TS val 1009113 ecr 787792,mptcp dss ack 4241485850 seq 1969345366 subseq 54265 len 1428 csum 0xb150], length 1428
20:39:32.578081 IP 112.26.1.1.37653 > 112.26.1.8.42049: Flags [.], seq 55693:57121, ack 1, win 4017, options [nop,nop,TS val 1009113 ecr 787792,mptcp dss ack 4241485850 seq 1969346794 subseq 55693 len 1428 csum 0xa664], length 1428
20:39:32.607913 IP 112.26.1.1.37653 > 112.26.1.8.42049: Flags [.], seq 47125:48553, ack 1, win 4017, options [nop,nop,TS val 1007913 ecr 786495,mptcp dss ack 4241485850 seq 1969313950 subseq 47125 len 1428 csum 0x4359], length 1428
20:39:32.677456 IP 112.26.1.8.42049 > 112.26.1.1.37653: Flags [.], ack 21421, win 12274, options [nop,nop,TS val 787918 ecr 1007083,nop,nop,sack 2 {42841:44269}{39985:41413},mptcp dss ack 1969141162], length 0
20:39:32.687820 IP 112.26.1.1.37653 > 112.26.1.8.42049: Flags [.], seq 57121:58549, ack 1, win 4017, options [nop,nop,TS val 1009223 ecr 787918,mptcp dss ack 4241485850 seq 1969349650 subseq 57121 len 1428 csum 0xe0f2], length 1428
20:39:32.749605 IP 112.26.1.1.37653 > 112.26.1.8.42049: Flags [.], seq 48553:49981, ack 1, win 4017, options [nop,nop,TS val 1008102 ecr 786601,mptcp dss ack 4241485850 seq 1969318234 subseq 48553 len 1428 csum 0xbad8], length 1428
20:39:32.805608 IP 112.26.1.8.42049 > 112.26.1.1.37653: Flags [.], ack 38557, win 12456, options [nop,nop,TS val 788074 ecr 1007496,nop,nop,sack 2 {42841:44269}{39985:41413},mptcp dss ack 1969141162], length 0
20:39:32.805911 IP 112.26.1.1.37653 > 112.26.1.8.42049: Flags [.], seq 58549:59977, ack 1, win 4017, options [nop,nop,TS val 1009341 ecr 788074,mptcp dss ack 4241485850 seq 1969355362 subseq 58549 len 1428 csum 0x3323], length 1428
20:39:32.844570 IP 112.26.1.1.37653 > 112.26.1.8.42049: Flags [.], seq 49981:51409, ack 1, win 4017, options [nop,nop,TS val 1008351 ecr 786844,mptcp dss ack 4241485850 seq 1969322518 subseq 49981 len 1428 csum 0xf8b9], length 1428
20:39:32.948468 IP 112.26.1.8.42049 > 112.26.1.1.37653: Flags [.], ack 38557, win 12593, options [nop,nop,TS val 788193 ecr 1007496,nop,nop,sack 2 {42841:45697}{39985:41413},mptcp dss ack 1969141162], length 0
20:39:32.964135 IP 112.26.1.1.37653 > 112.26.1.8.42049: Flags [.], seq 51409:52837, ack 1, win 4017, options [nop,nop,TS val 1008505 ecr 787009,mptcp dss ack 4241485850 seq 1969326802 subseq 51409 len 1428 csum 0xa1aa], length 1428
20:39:33.013399 IP 112.26.1.1.37653 > 112.26.1.8.42049: Flags [.], seq 59977:61405, ack 1, win 4017, options [nop,nop,TS val 1009549 ecr 788193,mptcp dss ack 4241485850 seq 1969362502 subseq 59977 len 1428 csum 0x668], length 1428
20:39:33.099127 IP 112.26.1.1.37653 > 112.26.1.8.42049: Flags [.], seq 52837:54265, ack 1, win 4017, options [nop,nop,TS val 1008888 ecr 787400,mptcp dss ack 4241485850 seq 1969336798 subseq 52837 len 1428 csum 0xf1ba], length 1428
20:39:33.102121 IP 112.26.1.8.42049 > 112.26.1.1.37653: Flags [.], ack 38557, win 12867, options [nop,nop,TS val 788391 ecr 1007496,nop,nop,sack 2 {47125:48553}{42841:45697},mptcp dss ack 1969216846], length 0
20:39:33.102408 IP 112.26.1.1.37653 > 112.26.1.8.42049: Flags [.], seq 45697:47125, ack 1, win 4017, options [nop,nop,TS val 1009637 ecr 788391,mptcp dss ack 4241485850 seq 1969305382 subseq 45697 len 1428 csum 0xd349], length 1428
20:39:33.169540 IP 112.26.1.1.37653 > 112.26.1.8.42049: Flags [.], seq 38557:39985, ack 1, win 4017, options [nop,nop,TS val 1009013 ecr 787656,mptcp dss ack 4241485850 seq 1969273966 subseq 38557 len 1428 csum 0x2ec8], length 1428
20:39:33.193660 IP 112.26.1.8.42049 > 112.26.1.1.37653: Flags [.], ack 38557, win 13004, options [nop,nop,TS val 788530 ecr 1007496,nop,nop,sack 2 {47125:49981}{42841:45697},mptcp dss ack 1969216846], length 0
20:39:33.201369 IP 112.26.1.1.37653 > 112.26.1.8.42049: Flags [.], seq 61405:62833, ack 1, win 4017, options [nop,nop,TS val 1009736 ecr 788530,mptcp dss ack 4241485850 seq 1969369642 subseq 61405 len 1428 csum 0x140f], length 1428
20:39:33.276818 IP 112.26.1.1.37653 > 112.26.1.8.42049: Flags [.], seq 41413:42841, ack 1, win 4017, options [nop,nop,TS val 1009113 ecr 787792,mptcp dss ack 4241485850 seq 1969278250 subseq 41413 len 1428 csum 0xdd27], length 1428
20:39:33.332210 IP 112.26.1.8.42049 > 112.26.1.1.37653: Flags [.], ack 38557, win 13140, options [nop,nop,TS val 788675 ecr 1007496,nop,nop,sack 2 {47125:51409}{42841:45697},mptcp dss ack 1969216846], length 0
20:39:33.338686 IP 112.26.1.1.37653 > 112.26.1.8.42049: Flags [.], seq 62833:64261, ack 1, win 4017, options [nop,nop,TS val 1009874 ecr 788675,mptcp dss ack 4241485850 seq 1969373926 subseq 62833 len 1428 csum 0x4aca], length 1428
20:39:33.379478 IP 112.26.1.8.42049 > 112.26.1.1.37653: Flags [.], ack 38557, win 13277, options [nop,nop,TS val 788793 ecr 1007496,nop,nop,sack 2 {47125:52837}{42841:45697},mptcp dss ack 1969216846], length 0
20:39:33.457304 IP 112.26.1.1.37653 > 112.26.1.8.42049: Flags [.], seq 64261:65689, ack 1, win 4017, options [nop,nop,TS val 1009993 ecr 788793,mptcp dss ack 4241485850 seq 1969376782 subseq 64261 len 1428 csum 0x9f62], length 1428
20:39:33.489766 IP 112.26.1.1.37653 > 112.26.1.8.42049: Flags [.], seq 54265:55693, ack 1, win 4017, options [nop,nop,TS val 1009113 ecr 787792,mptcp dss ack 4241485850 seq 1969345366 subseq 54265 len 1428 csum 0xb150], length 1428
20:39:33.518116 IP 112.26.1.8.42049 > 112.26.1.1.37653: Flags [.], ack 38557, win 13414, options [nop,nop,TS val 788996 ecr 1007496,nop,nop,sack 2 {47125:54265}{42841:45697},mptcp dss ack 1969216846], length 0
20:39:33.572237 IP 112.26.1.1.37653 > 112.26.1.8.42049: Flags [.], seq 65689:67117, ack 1, win 4017, options [nop,nop,TS val 1010108 ecr 788996,mptcp dss ack 4241485850 seq 1969381066 subseq 65689 len 1428 csum 0x7db8], length 1428
20:39:33.629260 IP 112.26.1.1.37653 > 112.26.1.8.42049: Flags [.], seq 55693:57121, ack 1, win 4017, options [nop,nop,TS val 1009113 ecr 787792,mptcp dss ack 4241485850 seq 1969346794 subseq 55693 len 1428 csum 0xa664], length 1428
20:39:33.711667 IP 112.26.1.8.42049 > 112.26.1.1.37653: Flags [.], ack 41413, win 13551, options [nop,nop,TS val 789088 ecr 1009013,nop,nop,sack 2 {47125:54265}{42841:45697},mptcp dss ack 1969216846], length 0
20:39:33.712153 IP 112.26.1.1.37653 > 112.26.1.8.42049: Flags [.], seq 67117:68545, ack 1, win 4017, options [nop,nop,TS val 1010247 ecr 789088,mptcp dss ack 4241485850 seq 1969386778 subseq 67117 len 1428 csum 0xce61], length 1428
20:39:33.712251 IP 112.26.1.1.37653 > 112.26.1.8.42049: Flags [.], seq 68545:69973, ack 1, win 4017, options [nop,nop,TS val 1010247 ecr 789088,mptcp dss ack 4241485850 seq 1969388206 subseq 68545 len 1428 csum 0xece], length 1428
20:39:33.759107 IP 112.26.1.1.37653 > 112.26.1.8.42049: Flags [.], seq 57121:58549, ack 1, win 4017, options [nop,nop,TS val 1009223 ecr 787918,mptcp dss ack 4241485850 seq 1969349650 subseq 57121 len 1428 csum 0xe0f2], length 1428
20:39:33.897224 IP 112.26.1.8.42049 > 112.26.1.1.37653: Flags [.], ack 45697, win 13688, options [nop,nop,TS val 789187 ecr 1009113,nop,nop,sack 1 {47125:54265},mptcp dss ack 1969216846], length 0
20:39:33.897668 IP 112.26.1.1.37653 > 112.26.1.8.42049: Flags [.], seq 69973:71401, ack 1, win 4017, options [nop,nop,TS val 1010433 ecr 789187,mptcp dss ack 4241485850 seq 1969395346 subseq 69973 len 1428 csum 0x80e3], length 1428
20:39:33.934691 IP 112.26.1.1.37653 > 112.26.1.8.42049: Flags [.], seq 58549:59977, ack 1, win 4017, options [nop,nop,TS val 1009341 ecr 788074,mptcp dss ack 4241485850 seq 1969355362 subseq 58549 len 1428 csum 0x3323], length 1428
20:39:34.051312 IP 112.26.1.1.37653 > 112.26.1.8.42049: Flags [.], seq 59977:61405, ack 1, win 4017, options [nop,nop,TS val 1009549 ecr 788193,mptcp dss ack 4241485850 seq 1969362502 subseq 59977 len 1428 csum 0x668], length 1428
20:39:34.080778 IP 112.26.1.8.42049 > 112.26.1.1.37653: Flags [.], ack 45697, win 13825, options [nop,nop,TS val 789312 ecr 1009113,nop,nop,sack 1 {47125:55693},mptcp dss ack 1969216846], length 0
20:39:34.122963 IP 112.26.1.1.37653 > 112.26.1.8.42049: Flags [.], seq 45697:47125, ack 1, win 4017, options [nop,nop,TS val 1009637 ecr 788391,mptcp dss ack 4241485850 seq 1969305382 subseq 45697 len 1428 csum 0xd349], length 1428
20:39:34.141233 IP 112.26.1.8.42049 > 112.26.1.1.37653: Flags [.], ack 45697, win 14007, options [nop,nop,TS val 789437 ecr 1009113,nop,nop,sack 1 {47125:57121},mptcp dss ack 1969216846], length 0
20:39:34.141541 IP 112.26.1.1.37653 > 112.26.1.8.42049: Flags [.], seq 71401:72829, ack 1, win 4017, options [nop,nop,TS val 1010677 ecr 789312,mptcp dss ack 4241485850 seq 1969403914 subseq 71401 len 1428 csum 0xb0fa], length 1428
20:39:34.170476 IP 112.26.1.1.37653 > 112.26.1.8.42049: Flags [.], seq 72829:74257, ack 1, win 4017, options [nop,nop,TS val 1010706 ecr 789437,mptcp dss ack 4241485850 seq 1969405342 subseq 72829 len 1428 csum 0x2785], length 1428
20:39:34.271758 IP 112.26.1.8.42049 > 112.26.1.1.37653: Flags [.], ack 45697, win 14144, options [nop,nop,TS val 789543 ecr 1009113,nop,nop,sack 1 {47125:58549},mptcp dss ack 1969216846], length 0
20:39:34.320841 IP 112.26.1.1.37653 > 112.26.1.8.42049: Flags [.], seq 62833:64261, ack 1, win 4017, options [nop,nop,TS val 1009874 ecr 788675,mptcp dss ack 4241485850 seq 1969373926 subseq 62833 len 1428 csum 0x4aca], length 1428
20:39:34.367984 IP 112.26.1.8.42049 > 112.26.1.1.37653: Flags [.], ack 45697, win 14327, options [nop,nop,TS val 789715 ecr 1009113,nop,nop,sack 1 {47125:59977},mptcp dss ack 1969216846], length 0
20:39:34.403752 IP 112.26.1.1.37653 > 112.26.1.8.42049: Flags [.], seq 74257:75685, ack 1, win 4017, options [nop,nop,TS val 1010939 ecr 789715,mptcp dss ack 4241485850 seq 1969412482 subseq 74257 len 1428 csum 0xa074], length 1428
20:39:34.450853 IP 112.26.1.1.37653 > 112.26.1.8.42049: Flags [.], seq 65689:67117, ack 1, win 4017, options [nop,nop,TS val 1010108 ecr 788996,mptcp dss ack 4241485850 seq 1969381066 subseq 65689 len 1428 csum 0x7db8], length 1428
20:39:34.518708 IP 112.26.1.8.42049 > 112.26.1.1.37653: Flags [.], ack 45697, win 14464, options [nop,nop,TS val 789832 ecr 1009113,nop,nop,sack 1 {47125:61405},mptcp dss ack 1969216846], length 0
20:39:34.534263 IP 112.26.1.1.37653 > 112.26.1.8.42049: Flags [.], seq 67117:68545, ack 1, win 4017, options [nop,nop,TS val 1010247 ecr 789088,mptcp dss ack 4241485850 seq 1969386778 subseq 67117 len 1428 csum 0xce61], length 1428
20:39:34.616874 IP 112.26.1.1.37653 > 112.26.1.8.42049: Flags [.], seq 75685:77113, ack 1, win 4017, options [nop,nop,TS val 1011152 ecr 789832,mptcp dss ack 4241485850 seq 1969416766 subseq 75685 len 1428 csum 0x2310], length 1428
20:39:34.640682 IP 112.26.1.1.37653 > 112.26.1.8.42049: Flags [.], seq 68545:69973, ack 1, win 4017, options [nop,nop,TS val 1010247 ecr 789088,mptcp dss ack 4241485850 seq 1969388206 subseq 68545 len 1428 csum 0xece], length 1428
20:39:34.706041 IP 112.26.1.8.42049 > 112.26.1.1.37653: Flags [.], ack 61405, win 14600, options [nop,nop,TS val 789925 ecr 1009637,mptcp dss ack 1969216846], length 0
20:39:34.711290 IP 112.26.1.1.37653 > 112.26.1.8.42049: Flags [.], seq 69973:71401, ack 1, win 4017, options [nop,nop,TS val 1010433 ecr 789187,mptcp dss ack 4241485850 seq 1969395346 subseq 69973 len 1428 csum 0x80e3], length 1428
20:39:34.822346 IP 112.26.1.8.42049 > 112.26.1.1.37653: Flags [.], ack 61405, win 14737, options [nop,nop,TS val 790101 ecr 1009637,nop,nop,sack 1 {62833:64261},mptcp dss ack 1969216846], length 0
20:39:34.837751 IP 112.26.1.1.37653 > 112.26.1.8.42049: Flags [.], seq 71401:72829, ack 1, win 4017, options [nop,nop,TS val 1010677 ecr 789312,mptcp dss ack 4241485850 seq 1969403914 subseq 71401 len 1428 csum 0xb0fa], length 1428
20:39:34.978785 IP 112.26.1.1.37653 > 112.26.1.8.42049: Flags [.], seq 72829:74257, ack 1, win 4017, options [nop,nop,TS val 1010706 ecr 789437,mptcp dss ack 4241485850 seq 1969405342 subseq 72829 len 1428 csum 0x2785], length 1428
20:39:35.047478 IP 112.26.1.8.42049 > 112.26.1.1.37653: Flags [.], ack 61405, win 14920, options [nop,nop,TS val 790233 ecr 1009637,nop,nop,sack 2 {65689:67117}{62833:64261},mptcp dss ack 1969216846], length 0
20:39:35.047763 IP 112.26.1.1.37653 > 112.26.1.8.42049: Flags [.], seq 61405:62833, ack 1, win 4017, options [nop,nop,TS val 1011583 ecr 790233,mptcp dss ack 4241485850 seq 1969369642 subseq 61405 len 1428 csum 0x140f], length 1428
20:39:35.068325 IP 112.26.1.1.37653 > 112.26.1.8.42049: Flags [.], seq 74257:75685, ack 1, win 4017, options [nop,nop,TS val 1010939 ecr 789715,mptcp dss ack 4241485850 seq 1969412482 subseq 74257 len 1428 csum 0xa074], length 1428
20:39:35.137959 IP 112.26.1.8.42049 > 112.26.1.1.37653: Flags [.], ack 61405, win 15057, options [nop,nop,TS val 790341 ecr 1009637,nop,nop,sack 2 {65689:68545}{62833:64261},mptcp dss ack 1969216846], length 0
20:39:35.138286 IP 112.26.1.1.37653 > 112.26.1.8.42049: Flags [.], seq 64261:65689, ack 1, win 4017, options [nop,nop,TS val 1011674 ecr 790341,mptcp dss ack 4241485850 seq 1969376782 subseq 64261 len 1428 csum 0x9f62], length 1428
20:39:35.205103 IP 112.26.1.1.37653 > 112.26.1.8.42049: Flags [.], seq 75685:77113, ack 1, win 4017, options [nop,nop,TS val 1011152 ecr 789832,mptcp dss ack 4241485850 seq 1969416766 subseq 75685 len 1428 csum 0x2310], length 1428
20:39:35.261554 IP 112.26.1.8.42049 > 112.26.1.1.37653: Flags [.], ack 61405, win 15239, options [nop,nop,TS val 790427 ecr 1009637,nop,nop,sack 2 {65689:69973}{62833:64261},mptcp dss ack 1969216846], length 0
20:39:35.268798 IP 112.26.1.1.37653 > 112.26.1.8.42049: Flags [.], seq 77113:78541, ack 1, win 4017, options [nop,nop,TS val 1011804 ecr 790427,mptcp dss ack 4241485850 seq 1969428190 subseq 77113 len 1428 csum 0xe987], length 1428
20:39:35.294402 IP 112.26.1.1.37653 > 112.26.1.8.42049: Flags [.], seq 61405:62833, ack 1, win 4017, options [nop,nop,TS val 1011583 ecr 790233,mptcp dss ack 4241485850 seq 1969369642 subseq 61405 len 1428 csum 0x140f], length 1428
20:39:35.384240 IP 112.26.1.8.42049 > 112.26.1.1.37653: Flags [.], ack 61405, win 15376, options [nop,nop,TS val 790548 ecr 1009637,nop,nop,sack 2 {65689:71401}{62833:64261},mptcp dss ack 1969216846], length 0
20:39:35.393190 IP 112.26.1.1.37653 > 112.26.1.8.42049: Flags [.], seq 64261:65689, ack 1, win 4017, options [nop,nop,TS val 1011674 ecr 790341,mptcp dss ack 4241485850 seq 1969376782 subseq 64261 len 1428 csum 0x9f62], length 1428
20:39:35.413182 IP 112.26.1.1.37653 > 112.26.1.8.42049: Flags [.], seq 78541:79969, ack 1, win 4017, options [nop,nop,TS val 1011948 ecr 790548,mptcp dss ack 4241485850 seq 1969433902 subseq 78541 len 1428 csum 0x5cd0], length 1428
20:39:35.543130 IP 112.26.1.1.37653 > 112.26.1.8.42049: Flags [.], seq 77113:78541, ack 1, win 4017, options [nop,nop,TS val 1011804 ecr 790427,mptcp dss ack 4241485850 seq 1969428190 subseq 77113 len 1428 csum 0xe987], length 1428
20:39:35.555447 IP 112.26.1.8.42049 > 112.26.1.1.37653: Flags [.], ack 61405, win 15467, options [nop,nop,TS val 790630 ecr 1009637,nop,nop,sack 2 {65689:72829}{62833:64261},mptcp dss ack 1969216846], length 0
20:39:35.639105 IP 112.26.1.1.37653 > 112.26.1.8.42049: Flags [.], seq 78541:79969, ack 1, win 4017, options [nop,nop,TS val 1011948 ecr 790548,mptcp dss ack 4241485850 seq 1969433902 subseq 78541 len 1428 csum 0x5cd0], length 1428
20:39:35.641375 IP 112.26.1.1.37653 > 112.26.1.8.42049: Flags [.], seq 79969:81397, ack 1, win 4017, options [nop,nop,TS val 1012177 ecr 790630,mptcp dss ack 4241485850 seq 1969441042 subseq 79969 len 1428 csum 0x9ff4], length 1428
20:39:35.687889 IP 112.26.1.8.42049 > 112.26.1.1.37653: Flags [.], ack 61405, win 15695, options [nop,nop,TS val 790774 ecr 1009637,nop,nop,sack 2 {65689:74257}{62833:64261},mptcp dss ack 1969216846], length 0
20:39:35.730388 IP 112.26.1.1.37653 > 112.26.1.8.42049: Flags [.], seq 81397:82825, ack 1, win 4017, options [nop,nop,TS val 1012266 ecr 790774,mptcp dss ack 4241485850 seq 1969446754 subseq 81397 len 1428 csum 0xfaf9], length 1428
20:39:35.809573 IP 112.26.1.1.37653 > 112.26.1.8.42049: Flags [.], seq 79969:81397, ack 1, win 4017, options [nop,nop,TS val 1012177 ecr 790630,mptcp dss ack 4241485850 seq 1969441042 subseq 79969 len 1428 csum 0x9ff4], length 1428
20:39:35.810666 IP 112.26.1.8.42049 > 112.26.1.1.37653: Flags [.], ack 61405, win 15878, options [nop,nop,TS val 790880 ecr 1009637,nop,nop,sack 2 {65689:75685}{62833:64261},mptcp dss ack 1969216846], length 0
