20:39:27.395088 IP 112.26.3.8.39915 > 112.26.3.1.37653: Flags [S], seq 1165408037, win 65535, options [mss 1460,sackOK,TS val 783148 ecr 0,nop,wscale 6,mptcp join id 6 token 0xbaf08251 nonce 0xab03f7dc], length 0
20:39:27.454386 IP 112.26.3.8.39915 > 112.26.3.1.37653: Flags [S], seq 1165408037, win 65535, options [mss 1460,sackOK,TS val 783148 ecr 0,nop,wscale 6,mptcp join id 6 token 0xbaf08251 nonce 0xab03f7dc], length 0
20:39:27.456285 IP 112.26.3.1.37653 > 112.26.3.8.39915: Flags [S.], seq 807428570, ack 1165408038, win 65535, options [mss 1460,sackOK,TS val 1003990 ecr 783148,nop,wscale 6,mptcp join id 5 hmac 0x2de910f8d6290959 nonce 0x3e49ab27], length 0
20:39:27.512205 IP 112.26.3.1.37653 > 112.26.3.8.39915: Flags [S.], seq 807428570, ack 1165408038, win 65535, options [mss 1460,sackOK,TS val 1003990 ecr 783148,nop,wscale 6,mptcp join id 5 hmac 0x2de910f8d6290959 nonce 0x3e49ab27], length 0
20:39:27.549309 IP 112.26.3.1.37653 > 112.26.3.8.39915: Flags [S.], seq 807428570, ack 1165408038, win 65535, options [mss 1460,sackOK,TS val 1003990 ecr 783148,nop,wscale 6,mptcp join id 5 hmac 0x2de910f8d6290959 nonce 0x3e49ab27], length 0
20:39:27.674089 IP 112.26.3.8.39915 > 112.26.3.1.37653: Flags [.], ack 1, win 5840, options [nop,nop,TS val 783328 ecr 1003990,mptcp join hmac 0xc48361edb8e1529744f5291e0cf51b427ee0bafa], length 0
20:39:27.676454 IP 112.26.3.8.39915 > 112.26.3.1.37653: Flags [.], ack 1, win 5840, options [nop,nop,TS val 783328 ecr 1003990,mptcp join hmac 0xc48361edb8e1529744f5291e0cf51b427ee0bafa], length 0
20:39:27.681157 IP 112.26.3.1.37653 > 112.26.3.8.39915: Flags [.], ack 1, win 2678, options [nop,nop,TS val 1004212 ecr 783328,mptcp dss ack 4241485850], length 0
20:39:27.684963 IP 112.26.3.1.37653 > 112.26.3.8.39915: Flags [.], ack 1, win 2678, options [nop,nop,TS val 1004212 ecr 783328,mptcp dss ack 4241485850], length 0
20:39:27.686715 IP 112.26.3.1.37653 > 112.26.3.8.39915: Flags [.], ack 1, win 2678, options [nop,nop,TS val 1004212 ecr 783328,mptcp dss ack 4241485850], length 0
20:39:27.745815 IP 112.26.3.1.37653 > 112.26.3.8.39915: Flags [.], seq 1:1429, ack 1, win 2678, options [nop,nop,TS val 1004213 ecr 783328,mptcp dss ack 4241485850 seq 1969128310 subseq 1 len 1428 csum 0x36ec], length 1428
20:39:27.760215 IP 112.26.3.1.37653 > 112.26.3.8.39915: Flags [.], seq 1:1429, ack 1, win 2678, options [nop,nop,TS val 1004213 ecr 783328,mptcp dss ack 4241485850 seq 1969128310 subseq 1 len 1428 csum 0x36ec], length 1428
20:39:27.824730 IP 112.26.3.1.37653 > 112.26.3.8.39915: Flags [.], seq 1:1429, ack 1, win 2678, options [nop,nop,TS val 1004213 ecr 783328,mptcp dss ack 4241485850 seq 1969128310 subseq 1 len 1428 csum 0x36ec], length 1428
20:39:27.861431 IP 112.26.3.8.39915 > 112.26.3.1.37653: Flags [.], ack 1429, win 7346, options [nop,nop,TS val 783559 ecr 1004213,mptcp dss ack 1969124026], length 0
20:39:27.862685 IP 112.26.3.8.39915 > 112.26.3.1.37653: Flags [.], ack 1429, win 7346, options [nop,nop,TS val 783559 ecr 1004213,mptcp dss ack 1969124026], length 0
20:39:27.883167 IP 112.26.3.1.37653 > 112.26.3.8.39915: Flags [.], seq 1429:2857, ack 1, win 2678, options [nop,nop,TS val 1004213 ecr 783328,mptcp dss ack 4241485850 seq 1969129738 subseq 1429 len 1428 csum 0xcabe], length 1428
20:39:27.978372 IP 112.26.3.1.37653 > 112.26.3.8.39915: Flags [.], seq 1429:2857, ack 1, win 2678, options [nop,nop,TS val 1004213 ecr 783328,mptcp dss ack 4241485850 seq 1969129738 subseq 1429 len 1428 csum 0xcabe], length 1428
20:39:27.980739 IP 112.26.3.1.37653 > 112.26.3.8.39915: Flags [.], seq 1429:2857, ack 1, win 2678, options [nop,nop,TS val 1004213 ecr 783328,mptcp dss ack 4241485850 seq 1969129738 subseq 1429 len 1428 csum 0xcabe], length 1428
20:39:28.031958 IP 112.26.3.1.37653 > 112.26.3.8.39915: Flags [.], seq 2857:4285, ack 1, win 2678, options [nop,nop,TS val 1004215 ecr 783328,mptcp dss ack 4241485850 seq 1969131166 subseq 2857 len 1428 csum 0x53a1], length 1428
20:39:28.066306 IP 112.26.3.8.39915 > 112.26.3.1.37653: Flags [.], ack 2857, win 7483, options [nop,nop,TS val 783758 ecr 1004213,mptcp dss ack 1969125454], length 0
20:39:28.067502 IP 112.26.3.8.39915 > 112.26.3.1.37653: Flags [.], ack 2857, win 7483, options [nop,nop,TS val 783758 ecr 1004213,mptcp dss ack 1969125454], length 0
20:39:28.085654 IP 112.26.3.1.37653 > 112.26.3.8.39915: Flags [.], seq 4285:5713, ack 1, win 2678, options [nop,nop,TS val 1004215 ecr 783328,mptcp dss ack 4241485850 seq 1969132594 subseq 4285 len 1428 csum 0x7511], length 1428
20:39:28.120342 IP 112.26.3.1.37653 > 112.26.3.8.39915: Flags [.], seq 2857:4285, ack 1, win 2678, options [nop,nop,TS val 1004215 ecr 783328,mptcp dss ack 4241485850 seq 1969131166 subseq 2857 len 1428 csum 0x53a1], length 1428
20:39:28.130879 IP 112.26.3.1.37653 > 112.26.3.8.39915: Flags [.], seq 2857:4285, ack 1, win 2678, options [nop,nop,TS val 1004215 ecr 783328,mptcp dss ack 4241485850 seq 1969131166 subseq 2857 len 1428 csum 0x53a1], length 1428
20:39:28.194386 IP 112.26.3.8.39915 > 112.26.3.1.37653: Flags [.], ack 4285, win 7574, options [nop,nop,TS val 783898 ecr 1004215,mptcp dss ack 1969125454], length 0
20:39:28.205215 IP 112.26.3.1.37653 > 112.26.3.8.39915: Flags [.], seq 5713:7141, ack 1, win 2678, options [nop,nop,TS val 1004215 ecr 783328,mptcp dss ack 4241485850 seq 1969134022 subseq 5713 len 1428 csum 0x72e], length 1428
20:39:28.225849 IP 112.26.3.8.39915 > 112.26.3.1.37653: Flags [.], ack 4285, win 7574, options [nop,nop,TS val 783898 ecr 1004215,mptcp dss ack 1969125454], length 0
20:39:28.274110 IP 112.26.3.1.37653 > 112.26.3.8.39915: Flags [.], seq 4285:5713, ack 1, win 2678, options [nop,nop,TS val 1004215 ecr 783328,mptcp dss ack 4241485850 seq 1969132594 subseq 4285 len 1428 csum 0x7511], length 1428
20:39:28.276931 IP 112.26.3.1.37653 > 112.26.3.8.39915: Flags [.], seq 4285:5713, ack 1, win 2678, options [nop,nop,TS val 1004215 ecr 783328,mptcp dss ack 4241485850 seq 1969132594 subseq 4285 len 1428 csum 0x7511], length 1428
20:39:28.298655 IP 112.26.3.8.39915 > 112.26.3.1.37653: Flags [.], ack 5713, win 7757, options [nop,nop,TS val 784054 ecr 1004215,mptcp dss ack 1969126882], length 0
20:39:28.300465 IP 112.26.3.8.39915 > 112.26.3.1.37653: Flags [.], ack 5713, win 7757, options [nop,nop,TS val 784054 ecr 1004215,mptcp dss ack 1969126882], length 0
20:39:28.329953 IP 112.26.3.1.37653 > 112.26.3.8.39915: Flags [.], seq 7141:8569, ack 1, win 2678, options [nop,nop,TS val 1004215 ecr 783328,mptcp dss ack 4241485850 seq 1969135450 subseq 7141 len 1428 csum 0x5536], length 1428
20:39:28.413170 IP 112.26.3.1.37653 > 112.26.3.8.39915: Flags [.], seq 5713:7141, ack 1, win 2678, options [nop,nop,TS val 1004215 ecr 783328,mptcp dss ack 4241485850 seq 1969134022 subseq 5713 len 1428 csum 0x72e], length 1428
20:39:28.427316 IP 112.26.3.1.37653 > 112.26.3.8.39915: Flags [.], seq 5713:7141, ack 1, win 2678, options [nop,nop,TS val 1004215 ecr 783328,mptcp dss ack 4241485850 seq 1969134022 subseq 5713 len 1428 csum 0x72e], length 1428
20:39:28.454612 IP 112.26.3.1.37653 > 112.26.3.8.39915: Flags [.], seq 8569:9997, ack 1, win 2678, options [nop,nop,TS val 1004215 ecr 783328,mptcp dss ack 4241485850 seq 1969136878 subseq 8569 len 1428 csum 0x893], length 1428
20:39:28.510045 IP 112.26.3.8.39915 > 112.26.3.1.37653: Flags [.], ack 7141, win 7939, options [nop,nop,TS val 784205 ecr 1004215,mptcp dss ack 1969135450], length 0
20:39:28.520714 IP 112.26.3.1.37653 > 112.26.3.8.39915: Flags [.], seq 7141:8569, ack 1, win 2678, options [nop,nop,TS val 1004215 ecr 783328,mptcp dss ack 4241485850 seq 1969135450 subseq 7141 len 1428 csum 0x5536], length 1428
20:39:28.527108 IP 112.26.3.1.37653 > 112.26.3.8.39915: Flags [.], seq 9997:11425, ack 1, win 2678, options [nop,nop,TS val 1004215 ecr 783328,mptcp dss ack 4241485850 seq 1969138306 subseq 9997 len 1428 csum 0x7bf3], length 1428
20:39:28.546388 IP 112.26.3.1.37653 > 112.26.3.8.39915: Flags [.], seq 7141:8569, ack 1, win 2678, options [nop,nop,TS val 1004215 ecr 783328,mptcp dss ack 4241485850 seq 1969135450 subseq 7141 len 1428 csum 0x5536], length 1428
20:39:28.547010 IP 112.26.3.8.39915 > 112.26.3.1.37653: Flags [.], ack 7141, win 7939, options [nop,nop,TS val 784205 ecr 1004215,mptcp dss ack 1969135450], length 0
20:39:28.566312 IP 112.26.3.8.39915 > 112.26.3.1.37653: Flags [.], ack 8569, win 7985, options [nop,nop,TS val 784313 ecr 1004215,mptcp dss ack 1969136878], length 0
20:39:28.605469 IP 112.26.3.8.39915 > 112.26.3.1.37653: Flags [.], ack 8569, win 7985, options [nop,nop,TS val 784313 ecr 1004215,mptcp dss ack 1969136878], length 0
20:39:28.631629 IP 112.26.3.1.37653 > 112.26.3.8.39915: Flags [.], seq 14281:15709, ack 1, win 4017, options [nop,nop,TS val 1004398 ecr 783559,mptcp dss ack 4241485850 seq 1969171150 subseq 14281 len 1428 csum 0xab1c], length 1428
20:39:28.703852 IP 112.26.3.1.37653 > 112.26.3.8.39915: Flags [.], seq 15709:17137, ack 1, win 4017, options [nop,nop,TS val 1004398 ecr 783559,mptcp dss ack 4241485850 seq 1969172578 subseq 15709 len 1428 csum 0x10ce], length 1428
20:39:28.753444 IP 112.26.3.1.37653 > 112.26.3.8.39915: Flags [.], seq 8569:9997, ack 1, win 2678, options [nop,nop,TS val 1004215 ecr 783328,mptcp dss ack 4241485850 seq 1969136878 subseq 8569 len 1428 csum 0x893], length 1428
20:39:28.776422 IP 112.26.3.1.37653 > 112.26.3.8.39915: Flags [.], seq 8569:9997, ack 1, win 2678, options [nop,nop,TS val 1004215 ecr 783328,mptcp dss ack 4241485850 seq 1969136878 subseq 8569 len 1428 csum 0x893], length 1428
20:39:28.809772 IP 112.26.3.1.37653 > 112.26.3.8.39915: Flags [.], seq 17137:18565, ack 1, win 4017, options [nop,nop,TS val 1004604 ecr 783758,mptcp dss ack 4241485850 seq 1969192570 subseq 17137 len 1428 csum 0x204d], length 1428
20:39:28.815882 IP 112.26.3.8.39915 > 112.26.3.1.37653: Flags [.], ack 9997, win 8213, options [nop,nop,TS val 784540 ecr 1004215,mptcp dss ack 1969138306], length 0
20:39:28.818053 IP 112.26.3.8.39915 > 112.26.3.1.37653: Flags [.], ack 9997, win 8213, options [nop,nop,TS val 784540 ecr 1004215,mptcp dss ack 1969138306], length 0
20:39:28.868096 IP 112.26.3.1.37653 > 112.26.3.8.39915: Flags [.], seq 9997:11425, ack 1, win 2678, options [nop,nop,TS val 1004215 ecr 783328,mptcp dss ack 4241485850 seq 1969138306 subseq 9997 len 1428 csum 0x7bf3], length 1428
20:39:28.893381 IP 112.26.3.8.39915 > 112.26.3.1.37653: Flags [.], ack 11425, win 8304, options [nop,nop,TS val 784654 ecr 1004215,mptcp dss ack 1969139734], length 0
20:39:28.905995 IP 112.26.3.8.39915 > 112.26.3.1.37653: Flags [.], ack 11425, win 8304, options [nop,nop,TS val 784654 ecr 1004215,mptcp dss ack 1969139734], length 0
20:39:28.953465 IP 112.26.3.1.37653 > 112.26.3.8.39915: Flags [.], seq 18565:19993, ack 1, win 4017, options [nop,nop,TS val 1004604 ecr 783758,mptcp dss ack 4241485850 seq 1969193998 subseq 18565 len 1428 csum 0x33f7], length 1428
20:39:28.976023 IP 112.26.3.1.37653 > 112.26.3.8.39915: Flags [.], seq 9997:11425, ack 1, win 2678, options [nop,nop,TS val 1004215 ecr 783328,mptcp dss ack 4241485850 seq 1969138306 subseq 9997 len 1428 csum 0x7bf3], length 1428
20:39:28.999979 IP 112.26.3.1.37653 > 112.26.3.8.39915: Flags [.], seq 19993:21421, ack 1, win 4017, options [nop,nop,TS val 1004731 ecr 783898,mptcp dss ack 4241485850 seq 1969198282 subseq 19993 len 1428 csum 0x8948], length 1428
20:39:29.027634 IP 112.26.3.1.37653 > 112.26.3.8.39915: Flags [.], seq 14281:15709, ack 1, win 4017, options [nop,nop,TS val 1004398 ecr 783559,mptcp dss ack 4241485850 seq 1969171150 subseq 14281 len 1428 csum 0xab1c], length 1428
20:39:29.049337 IP 112.26.3.8.39915 > 112.26.3.1.37653: Flags [.], ack 11425, win 8532, options [nop,nop,TS val 784809 ecr 1004215,nop,nop,sack 1 {14281:15709},mptcp dss ack 1969139734], length 0
20:39:29.055293 IP 112.26.3.8.39915 > 112.26.3.1.37653: Flags [.], ack 11425, win 8532, options [nop,nop,TS val 784809 ecr 1004215,nop,nop,sack 1 {14281:15709},mptcp dss ack 1969139734], length 0
20:39:29.069523 IP 112.26.3.1.37653 > 112.26.3.8.39915: Flags [.], seq 14281:15709, ack 1, win 4017, options [nop,nop,TS val 1004398 ecr 783559,mptcp dss ack 4241485850 seq 1969171150 subseq 14281 len 1428 csum 0xab1c], length 1428
20:39:29.093600 IP 112.26.3.1.37653 > 112.26.3.8.39915: Flags [.], seq 21421:22849, ack 1, win 4017, options [nop,nop,TS val 1004731 ecr 783898,mptcp dss ack 4241485850 seq 1969199710 subseq 21421 len 1428 csum 0xad1a], length 1428
20:39:29.159180 IP 112.26.3.1.37653 > 112.26.3.8.39915: Flags [.], seq 22849:24277, ack 1, win 4017, options [nop,nop,TS val 1004835 ecr 784054,mptcp dss ack 4241485850 seq 1969205422 subseq 22849 len 1428 csum 0x4c04], length 1428
20:39:29.183735 IP 112.26.3.1.37653 > 112.26.3.8.39915: Flags [.], seq 15709:17137, ack 1, win 4017, options [nop,nop,TS val 1004398 ecr 783559,mptcp dss ack 4241485850 seq 1969172578 subseq 15709 len 1428 csum 0x10ce], length 1428
20:39:29.203665 IP 112.26.3.8.39915 > 112.26.3.1.37653: Flags [.], ack 11425, win 8715, options [nop,nop,TS val 784963 ecr 1004215,nop,nop,sack 1 {14281:17137},mptcp dss ack 1969139734], length 0
20:39:29.213883 IP 112.26.3.8.39915 > 112.26.3.1.37653: Flags [.], ack 11425, win 8715, options [nop,nop,TS val 784963 ecr 1004215,nop,nop,sack 1 {14281:17137},mptcp dss ack 1969139734], length 0
20:39:29.226919 IP 112.26.3.1.37653 > 112.26.3.8.39915: Flags [.], seq 24277:25705, ack 1, win 4017, options [nop,nop,TS val 1004835 ecr 784054,mptcp dss ack 4241485850 seq 1969206850 subseq 24277 len 1428 csum 0x1025], length 1428
20:39:29.258769 IP 112.26.3.1.37653 > 112.26.3.8.39915: Flags [.], seq 15709:17137, ack 1, win 4017, options [nop,nop,TS val 1004398 ecr 783559,mptcp dss ack 4241485850 seq 1969172578 subseq 15709 len 1428 csum 0x10ce], length 1428
20:39:29.309613 IP 112.26.3.1.37653 > 112.26.3.8.39915: Flags [.], seq 17137:18565, ack 1, win 4017, options [nop,nop,TS val 1004604 ecr 783758,mptcp dss ack 4241485850 seq 1969192570 subseq 17137 len 1428 csum 0x204d], length 1428
20:39:29.342402 IP 112.26.3.8.39915 > 112.26.3.1.37653: Flags [.], ack 11425, win 8852, options [nop,nop,TS val 785091 ecr 1004215,nop,nop,sack 1 {14281:18565},mptcp dss ack 1969139734], length 0
20:39:29.348505 IP 112.26.3.1.37653 > 112.26.3.8.39915: Flags [.], seq 25705:27133, ack 1, win 4017, options [nop,nop,TS val 1005070 ecr 784205,mptcp dss ack 4241485850 seq 1969219702 subseq 25705 len 1428 csum 0x19f5], length 1428
20:39:29.378852 IP 112.26.3.1.37653 > 112.26.3.8.39915: Flags [.], seq 17137:18565, ack 1, win 4017, options [nop,nop,TS val 1004604 ecr 783758,mptcp dss ack 4241485850 seq 1969192570 subseq 17137 len 1428 csum 0x204d], length 1428
20:39:29.386075 IP 112.26.3.8.39915 > 112.26.3.1.37653: Flags [.], ack 11425, win 8852, options [nop,nop,TS val 785091 ecr 1004215,nop,nop,sack 1 {14281:18565},mptcp dss ack 1969139734], length 0
20:39:29.429203 IP 112.26.3.1.37653 > 112.26.3.8.39915: Flags [.], seq 18565:19993, ack 1, win 4017, options [nop,nop,TS val 1004604 ecr 783758,mptcp dss ack 4241485850 seq 1969193998 subseq 18565 len 1428 csum 0x33f7], length 1428
20:39:29.440962 IP 112.26.3.1.37653 > 112.26.3.8.39915: Flags [.], seq 18565:19993, ack 1, win 4017, options [nop,nop,TS val 1004604 ecr 783758,mptcp dss ack 4241485850 seq 1969193998 subseq 18565 len 1428 csum 0x33f7], length 1428
20:39:29.452771 IP 112.26.3.1.37653 > 112.26.3.8.39915: Flags [.], seq 27133:28561, ack 1, win 4017, options [nop,nop,TS val 1005070 ecr 784205,mptcp dss ack 4241485850 seq 1969221130 subseq 27133 len 1428 csum 0x199d], length 1428
20:39:29.538760 IP 112.26.3.1.37653 > 112.26.3.8.39915: Flags [.], seq 28561:29989, ack 1, win 4017, options [nop,nop,TS val 1005142 ecr 784313,mptcp dss ack 4241485850 seq 1969222558 subseq 28561 len 1428 csum 0xa293], length 1428
20:39:29.547881 IP 112.26.3.8.39915 > 112.26.3.1.37653: Flags [.], ack 11425, win 9034, options [nop,nop,TS val 785218 ecr 1004215,nop,nop,sack 1 {14281:19993},mptcp dss ack 1969139734], length 0
20:39:29.549912 IP 112.26.3.8.39915 > 112.26.3.1.37653: Flags [.], ack 11425, win 9034, options [nop,nop,TS val 785218 ecr 1004215,nop,nop,sack 1 {14281:19993},mptcp dss ack 1969139734], length 0
20:39:29.592909 IP 112.26.3.1.37653 > 112.26.3.8.39915: Flags [.], seq 19993:21421, ack 1, win 4017, options [nop,nop,TS val 1004731 ecr 783898,mptcp dss ack 4241485850 seq 1969198282 subseq 19993 len 1428 csum 0x8948], length 1428
20:39:29.595987 IP 112.26.3.1.37653 > 112.26.3.8.39915: Flags [.], seq 19993:21421, ack 1, win 4017, options [nop,nop,TS val 1004731 ecr 783898,mptcp dss ack 4241485850 seq 1969198282 subseq 19993 len 1428 csum 0x8948], length 1428
20:39:29.618968 IP 112.26.3.1.37653 > 112.26.3.8.39915: Flags [.], seq 31417:32845, ack 1, win 4017, options [nop,nop,TS val 1005354 ecr 784540,mptcp dss ack 4241485850 seq 1969233982 subseq 31417 len 1428 csum 0x866d], length 1428
20:39:29.650428 IP 112.26.3.8.39915 > 112.26.3.1.37653: Flags [.], ack 11425, win 9217, options [nop,nop,TS val 785373 ecr 1004215,nop,nop,sack 1 {14281:21421},mptcp dss ack 1969139734], length 0
20:39:29.677656 IP 112.26.3.8.39915 > 112.26.3.1.37653: Flags [.], ack 11425, win 9217, options [nop,nop,TS val 785373 ecr 1004215,nop,nop,sack 1 {14281:21421},mptcp dss ack 1969139734], length 0
20:39:29.727095 IP 112.26.3.1.37653 > 112.26.3.8.39915: Flags [.], seq 32845:34273, ack 1, win 4017, options [nop,nop,TS val 1005354 ecr 784540,mptcp dss ack 4241485850 seq 1969235410 subseq 32845 len 1428 csum 0xae7a], length 1428
20:39:29.780622 IP 112.26.3.1.37653 > 112.26.3.8.39915: Flags [.], seq 21421:22849, ack 1, win 4017, options [nop,nop,TS val 1004731 ecr 783898,mptcp dss ack 4241485850 seq 1969199710 subseq 21421 len 1428 csum 0xad1a], length 1428
20:39:29.784488 IP 112.26.3.1.37653 > 112.26.3.8.39915: Flags [.], seq 21421:22849, ack 1, win 4017, options [nop,nop,TS val 1004731 ecr 783898,mptcp dss ack 4241485850 seq 1969199710 subseq 21421 len 1428 csum 0xad1a], length 1428
20:39:29.798204 IP 112.26.3.8.39915 > 112.26.3.1.37653: Flags [.], ack 11425, win 9445, options [nop,nop,TS val 785562 ecr 1004215,nop,nop,sack 1 {14281:22849},mptcp dss ack 1969139734], length 0
20:39:29.834359 IP 112.26.3.8.39915 > 112.26.3.1.37653: Flags [.], ack 11425, win 9445, options [nop,nop,TS val 785562 ecr 1004215,nop,nop,sack 1 {14281:22849},mptcp dss ack 1969139734], length 0
20:39:29.859862 IP 112.26.3.1.37653 > 112.26.3.8.39915: Flags [.], seq 34273:35701, ack 1, win 4017, options [nop,nop,TS val 1005442 ecr 784654,mptcp dss ack 4241485850 seq 1969239694 subseq 34273 len 1428 csum 0xfc90], length 1428
20:39:29.963537 IP 112.26.3.1.37653 > 112.26.3.8.39915: Flags [.], seq 37129:38557, ack 1, win 4017, options [nop,nop,TS val 1005609 ecr 784809,mptcp dss ack 4241485850 seq 1969246834 subseq 37129 len 1428 csum 0xd3be], length 1428
20:39:30.015891 IP 112.26.3.1.37653 > 112.26.3.8.39915: Flags [.], seq 22849:24277, ack 1, win 4017, options [nop,nop,TS val 1004835 ecr 784054,mptcp dss ack 4241485850 seq 1969205422 subseq 22849 len 1428 csum 0x4c04], length 1428
20:39:30.018710 IP 112.26.3.1.37653 > 112.26.3.8.39915: Flags [.], seq 22849:24277, ack 1, win 4017, options [nop,nop,TS val 1004835 ecr 784054,mptcp dss ack 4241485850 seq 1969205422 subseq 22849 len 1428 csum 0x4c04], length 1428
20:39:30.030216 IP 112.26.3.8.39915 > 112.26.3.1.37653: Flags [.], ack 11425, win 9764, options [nop,nop,TS val 785796 ecr 1004215,nop,nop,sack 1 {14281:24277},mptcp dss ack 1969139734], length 0
20:39:30.038652 IP 112.26.3.8.39915 > 112.26.3.1.37653: Flags [.], ack 11425, win 9764, options [nop,nop,TS val 785796 ecr 1004215,nop,nop,sack 1 {14281:24277},mptcp dss ack 1969139734], length 0
20:39:30.054838 IP 112.26.3.1.37653 > 112.26.3.8.39915: Flags [.], seq 11425:12853, ack 1, win 4017, options [nop,nop,TS val 1005737 ecr 784963,mptcp dss ack 4241485850 seq 1969139734 subseq 11425 len 1428 csum 0x896d], length 1428
20:39:30.141736 IP 112.26.3.1.37653 > 112.26.3.8.39915: Flags [.], seq 12853:14281, ack 1, win 4017, options [nop,nop,TS val 1005878 ecr 785091,mptcp dss ack 4241485850 seq 1969141162 subseq 12853 len 1428 csum 0x8110], length 1428
20:39:30.145542 IP 112.26.3.1.37653 > 112.26.3.8.39915: Flags [.], seq 24277:25705, ack 1, win 4017, options [nop,nop,TS val 1004835 ecr 784054,mptcp dss ack 4241485850 seq 1969206850 subseq 24277 len 1428 csum 0x1025], length 1428
20:39:30.154285 IP 112.26.3.8.39915 > 112.26.3.1.37653: Flags [.], ack 11425, win 9855, options [nop,nop,TS val 785928 ecr 1004215,nop,nop,sack 1 {14281:25705},mptcp dss ack 1969139734], length 0
20:39:30.159264 IP 112.26.3.8.39915 > 112.26.3.1.37653: Flags [.], ack 11425, win 9855, options [nop,nop,TS val 785928 ecr 1004215,nop,nop,sack 1 {14281:25705},mptcp dss ack 1969139734], length 0
20:39:30.195783 IP 112.26.3.1.37653 > 112.26.3.8.39915: Flags [.], seq 24277:25705, ack 1, win 4017, options [nop,nop,TS val 1004835 ecr 784054,mptcp dss ack 4241485850 seq 1969206850 subseq 24277 len 1428 csum 0x1025], length 1428
20:39:30.213259 IP 112.26.3.1.37653 > 112.26.3.8.39915: Flags [.], seq 38557:39985, ack 1, win 4017, options [nop,nop,TS val 1006334 ecr 785373,mptcp dss ack 4241485850 seq 1969253974 subseq 38557 len 1428 csum 0xa436], length 1428
20:39:30.273281 IP 112.26.3.1.37653 > 112.26.3.8.39915: Flags [.], seq 25705:27133, ack 1, win 4017, options [nop,nop,TS val 1005070 ecr 784205,mptcp dss ack 4241485850 seq 1969219702 subseq 25705 len 1428 csum 0x19f5], length 1428
20:39:30.285514 IP 112.26.3.1.37653 > 112.26.3.8.39915: Flags [.], seq 25705:27133, ack 1, win 4017, options [nop,nop,TS val 1005070 ecr 784205,mptcp dss ack 4241485850 seq 1969219702 subseq 25705 len 1428 csum 0x19f5], length 1428
20:39:30.296173 IP 112.26.3.8.39915 > 112.26.3.1.37653: Flags [.], ack 11425, win 10038, options [nop,nop,TS val 786063 ecr 1004215,nop,nop,sack 1 {14281:27133},mptcp dss ack 1969139734], length 0
20:39:30.298705 IP 112.26.3.8.39915 > 112.26.3.1.37653: Flags [.], ack 11425, win 10038, options [nop,nop,TS val 786063 ecr 1004215,nop,nop,sack 1 {14281:27133},mptcp dss ack 1969139734], length 0
20:39:30.326253 IP 112.26.3.1.37653 > 112.26.3.8.39915: Flags [.], seq 39985:41413, ack 1, win 4017, options [nop,nop,TS val 1006411 ecr 785562,mptcp dss ack 4241485850 seq 1969255402 subseq 39985 len 1428 csum 0xc852], length 1428
20:39:30.386430 IP 112.26.3.1.37653 > 112.26.3.8.39915: Flags [.], seq 27133:28561, ack 1, win 4017, options [nop,nop,TS val 1005070 ecr 784205,mptcp dss ack 4241485850 seq 1969221130 subseq 27133 len 1428 csum 0x199d], length 1428
20:39:30.441855 IP 112.26.3.8.39915 > 112.26.3.1.37653: Flags [.], ack 11425, win 10220, options [nop,nop,TS val 786200 ecr 1004215,nop,nop,sack 1 {14281:28561},mptcp dss ack 1969139734], length 0
20:39:30.445623 IP 112.26.3.1.37653 > 112.26.3.8.39915: Flags [.], seq 41413:42841, ack 1, win 4017, options [nop,nop,TS val 1006740 ecr 785928,mptcp dss ack 4241485850 seq 1969271110 subseq 41413 len 1428 csum 0x3a69], length 1428
20:39:30.470994 IP 112.26.3.1.37653 > 112.26.3.8.39915: Flags [.], seq 28561:29989, ack 1, win 4017, options [nop,nop,TS val 1005142 ecr 784313,mptcp dss ack 4241485850 seq 1969222558 subseq 28561 len 1428 csum 0xa293], length 1428
20:39:30.477939 IP 112.26.3.1.37653 > 112.26.3.8.39915: Flags [.], seq 27133:28561, ack 1, win 4017, options [nop,nop,TS val 1005070 ecr 784205,mptcp dss ack 4241485850 seq 1969221130 subseq 27133 len 1428 csum 0x199d], length 1428
20:39:30.502924 IP 112.26.3.8.39915 > 112.26.3.1.37653: Flags [.], ack 11425, win 10220, options [nop,nop,TS val 786200 ecr 1004215,nop,nop,sack 1 {14281:28561},mptcp dss ack 1969139734], length 0
20:39:30.554223 IP 112.26.3.1.37653 > 112.26.3.8.39915: Flags [.], seq 31417:32845, ack 1, win 4017, options [nop,nop,TS val 1005354 ecr 784540,mptcp dss ack 4241485850 seq 1969233982 subseq 31417 len 1428 csum 0x866d], length 1428
20:39:30.576106 IP 112.26.3.8.39915 > 112.26.3.1.37653: Flags [.], ack 11425, win 10357, options [nop,nop,TS val 786339 ecr 1004215,nop,nop,sack 1 {14281:29989},mptcp dss ack 1969139734], length 0
20:39:30.585638 IP 112.26.3.8.39915 > 112.26.3.1.37653: Flags [.], ack 11425, win 10357, options [nop,nop,TS val 786339 ecr 1004215,nop,nop,sack 1 {14281:29989},mptcp dss ack 1969139734], length 0
20:39:30.605300 IP 112.26.3.1.37653 > 112.26.3.8.39915: Flags [.], seq 28561:29989, ack 1, win 4017, options [nop,nop,TS val 1005142 ecr 784313,mptcp dss ack 4241485850 seq 1969222558 subseq 28561 len 1428 csum 0xa293], length 1428
20:39:30.648558 IP 112.26.3.1.37653 > 112.26.3.8.39915: Flags [.], seq 32845:34273, ack 1, win 4017, options [nop,nop,TS val 1005354 ecr 784540,mptcp dss ack 4241485850 seq 1969235410 subseq 32845 len 1428 csum 0xae7a], length 1428
20:39:30.688990 IP 112.26.3.1.37653 > 112.26.3.8.39915: Flags [.], seq 31417:32845, ack 1, win 4017, options [nop,nop,TS val 1005354 ecr 784540,mptcp dss ack 4241485850 seq 1969233982 subseq 31417 len 1428 csum 0x866d], length 1428
20:39:30.700220 IP 112.26.3.8.39915 > 112.26.3.1.37653: Flags [.], ack 11425, win 10585, options [nop,nop,TS val 786467 ecr 1004215,nop,nop,sack 2 {31417:32845}{14281:29989},mptcp dss ack 1969139734], length 0
20:39:30.710013 IP 112.26.3.1.37653 > 112.26.3.8.39915: Flags [.], seq 29989:31417, ack 1, win 4017, options [nop,nop,TS val 1007231 ecr 786467,mptcp dss ack 4241485850 seq 1969223986 subseq 29989 len 1428 csum 0x3e57], length 1428
20:39:30.728020 IP 112.26.3.8.39915 > 112.26.3.1.37653: Flags [.], ack 11425, win 10585, options [nop,nop,TS val 786467 ecr 1004215,nop,nop,sack 2 {31417:32845}{14281:29989},mptcp dss ack 1969139734], length 0
20:39:30.778385 IP 112.26.3.1.37653 > 112.26.3.8.39915: Flags [.], seq 34273:35701, ack 1, win 4017, options [nop,nop,TS val 1005442 ecr 784654,mptcp dss ack 4241485850 seq 1969239694 subseq 34273 len 1428 csum 0xfc90], length 1428
20:39:30.809807 IP 112.26.3.1.37653 > 112.26.3.8.39915: Flags [.], seq 32845:34273, ack 1, win 4017, options [nop,nop,TS val 1005354 ecr 784540,mptcp dss ack 4241485850 seq 1969235410 subseq 32845 len 1428 csum 0xae7a], length 1428
20:39:30.888409 IP 112.26.3.1.37653 > 112.26.3.8.39915: Flags [.], seq 37129:38557, ack 1, win 4017, options [nop,nop,TS val 1005609 ecr 784809,mptcp dss ack 4241485850 seq 1969246834 subseq 37129 len 1428 csum 0xd3be], length 1428
20:39:30.902870 IP 112.26.3.8.39915 > 112.26.3.1.37653: Flags [.], ack 11425, win 10677, options [nop,nop,TS val 786587 ecr 1004215,nop,nop,sack 2 {31417:34273}{14281:29989},mptcp dss ack 1969139734], length 0
20:39:30.905191 IP 112.26.3.8.39915 > 112.26.3.1.37653: Flags [.], ack 11425, win 10677, options [nop,nop,TS val 786587 ecr 1004215,nop,nop,sack 2 {31417:34273}{14281:29989},mptcp dss ack 1969139734], length 0
20:39:30.914404 IP 112.26.3.1.37653 > 112.26.3.8.39915: Flags [.], seq 34273:35701, ack 1, win 4017, options [nop,nop,TS val 1005442 ecr 784654,mptcp dss ack 4241485850 seq 1969239694 subseq 34273 len 1428 csum 0xfc90], length 1428
20:39:30.963424 IP 112.26.3.1.37653 > 112.26.3.8.39915: Flags [.], seq 44269:45697, ack 1, win 4017, options [nop,nop,TS val 1007496 ecr 786587,mptcp dss ack 4241485850 seq 1969299670 subseq 44269 len 1428 csum 0xcdf9], length 1428
20:39:30.985562 IP 112.26.3.8.39915 > 112.26.3.1.37653: Flags [.], ack 11425, win 10814, options [nop,nop,TS val 786692 ecr 1004215,nop,nop,sack 2 {31417:35701}{14281:29989},mptcp dss ack 1969139734], length 0
20:39:30.993168 IP 112.26.3.8.39915 > 112.26.3.1.37653: Flags [.], ack 11425, win 10814, options [nop,nop,TS val 786692 ecr 1004215,nop,nop,sack 2 {31417:35701}{14281:29989},mptcp dss ack 1969139734], length 0
20:39:31.034842 IP 112.26.3.1.37653 > 112.26.3.8.39915: Flags [.], seq 37129:38557, ack 1, win 4017, options [nop,nop,TS val 1005609 ecr 784809,mptcp dss ack 4241485850 seq 1969246834 subseq 37129 len 1428 csum 0xd3be], length 1428
20:39:31.056609 IP 112.26.3.1.37653 > 112.26.3.8.39915: Flags [.], seq 11425:12853, ack 1, win 4017, options [nop,nop,TS val 1005737 ecr 784963,mptcp dss ack 4241485850 seq 1969139734 subseq 11425 len 1428 csum 0x896d], length 1428
20:39:31.062665 IP 112.26.3.8.39915 > 112.26.3.1.37653: Flags [.], ack 11425, win 10950, options [nop,nop,TS val 786808 ecr 1004215,nop,nop,sack 2 {37129:38557}{31417:35701},mptcp dss ack 1969139734], length 0
20:39:31.083491 IP 112.26.3.8.39915 > 112.26.3.1.37653: Flags [.], ack 11425, win 10950, options [nop,nop,TS val 786808 ecr 1004215,nop,nop,sack 2 {37129:38557}{31417:35701},mptcp dss ack 1969139734], length 0
20:39:31.117243 IP 112.26.3.1.37653 > 112.26.3.8.39915: Flags [.], seq 45697:47125, ack 1, win 4017, options [nop,nop,TS val 1007529 ecr 786692,mptcp dss ack 4241485850 seq 1969301098 subseq 45697 len 1428 csum 0x7324], length 1428
20:39:31.135397 IP 112.26.3.1.37653 > 112.26.3.8.39915: Flags [.], seq 38557:39985, ack 1, win 4017, options [nop,nop,TS val 1006334 ecr 785373,mptcp dss ack 4241485850 seq 1969253974 subseq 38557 len 1428 csum 0xa436], length 1428
20:39:31.164028 IP 112.26.3.1.37653 > 112.26.3.8.39915: Flags [.], seq 11425:12853, ack 1, win 4017, options [nop,nop,TS val 1005737 ecr 784963,mptcp dss ack 4241485850 seq 1969139734 subseq 11425 len 1428 csum 0x896d], length 1428
20:39:31.175015 IP 112.26.3.8.39915 > 112.26.3.1.37653: Flags [.], ack 12853, win 11133, options [nop,nop,TS val 786941 ecr 1005737,nop,nop,sack 2 {37129:38557}{31417:35701},mptcp dss ack 1969141162], length 0
20:39:31.200883 IP 112.26.3.1.37653 > 112.26.3.8.39915: Flags [.], seq 35701:37129, ack 1, win 4017, options [nop,nop,TS val 1007619 ecr 786808,mptcp dss ack 4241485850 seq 1969241122 subseq 35701 len 1428 csum 0xfc92], length 1428
20:39:31.215992 IP 112.26.3.8.39915 > 112.26.3.1.37653: Flags [.], ack 12853, win 11133, options [nop,nop,TS val 786941 ecr 1005737,nop,nop,sack 2 {37129:38557}{31417:35701},mptcp dss ack 1969141162], length 0
20:39:31.264144 IP 112.26.3.1.37653 > 112.26.3.8.39915: Flags [.], seq 38557:39985, ack 1, win 4017, options [nop,nop,TS val 1006334 ecr 785373,mptcp dss ack 4241485850 seq 1969253974 subseq 38557 len 1428 csum 0xa436], length 1428
20:39:31.285288 IP 112.26.3.8.39915 > 112.26.3.1.37653: Flags [.], ack 12853, win 11224, options [nop,nop,TS val 787041 ecr 1005737,nop,nop,sack 2 {37129:39985}{31417:35701},mptcp dss ack 1969141162], length 0
20:39:31.316686 IP 112.26.3.1.37653 > 112.26.3.8.39915: Flags [.], seq 47125:48553, ack 1, win 4017, options [nop,nop,TS val 1007751 ecr 786941,mptcp dss ack 4241485850 seq 1969308238 subseq 47125 len 1428 csum 0x6ade], length 1428
20:39:31.333969 IP 112.26.3.1.37653 > 112.26.3.8.39915: Flags [.], seq 39985:41413, ack 1, win 4017, options [nop,nop,TS val 1006411 ecr 785562,mptcp dss ack 4241485850 seq 1969255402 subseq 39985 len 1428 csum 0xc852], length 1428
20:39:31.338932 IP 112.26.3.8.39915 > 112.26.3.1.37653: Flags [.], ack 12853, win 11224, options [nop,nop,TS val 787041 ecr 1005737,nop,nop,sack 2 {37129:39985}{31417:35701},mptcp dss ack 1969141162], length 0
20:39:31.360764 IP 112.26.3.1.37653 > 112.26.3.8.39915: Flags [.], seq 39985:41413, ack 1, win 4017, options [nop,nop,TS val 1006411 ecr 785562,mptcp dss ack 4241485850 seq 1969255402 subseq 39985 len 1428 csum 0xc852], length 1428
20:39:31.375300 IP 112.26.3.8.39915 > 112.26.3.1.37653: Flags [.], ack 12853, win 11315, options [nop,nop,TS val 787132 ecr 1005737,nop,nop,sack 2 {37129:41413}{31417:35701},mptcp dss ack 1969141162], length 0
20:39:31.377154 IP 112.26.3.8.39915 > 112.26.3.1.37653: Flags [.], ack 12853, win 11315, options [nop,nop,TS val 787132 ecr 1005737,nop,nop,sack 2 {37129:41413}{31417:35701},mptcp dss ack 1969141162], length 0
20:39:31.432352 IP 112.26.3.1.37653 > 112.26.3.8.39915: Flags [.], seq 48553:49981, ack 1, win 4017, options [nop,nop,TS val 1007751 ecr 786941,mptcp dss ack 4241485850 seq 1969309666 subseq 48553 len 1428 csum 0xa0b9], length 1428
20:39:31.489511 IP 112.26.3.1.37653 > 112.26.3.8.39915: Flags [.], seq 42841:44269, ack 1, win 4017, options [nop,nop,TS val 1006869 ecr 786063,mptcp dss ack 4241485850 seq 1969275394 subseq 42841 len 1428 csum 0xa54], length 1428
20:39:31.512136 IP 112.26.3.1.37653 > 112.26.3.8.39915: Flags [.], seq 42841:44269, ack 1, win 4017, options [nop,nop,TS val 1006869 ecr 786063,mptcp dss ack 4241485850 seq 1969275394 subseq 42841 len 1428 csum 0xa54], length 1428
20:39:31.553942 IP 112.26.3.1.37653 > 112.26.3.8.39915: Flags [.], seq 49981:51409, ack 1, win 4017, options [nop,nop,TS val 1007751 ecr 786941,mptcp dss ack 4241485850 seq 1969311094 subseq 49981 len 1428 csum 0xdc11], length 1428
20:39:31.564543 IP 112.26.3.8.39915 > 112.26.3.1.37653: Flags [.], ack 12853, win 11544, options [nop,nop,TS val 787289 ecr 1005737,nop,nop,sack 2 {42841:44269}{37129:41413},mptcp dss ack 1969141162], length 0
20:39:31.567381 IP 112.26.3.8.39915 > 112.26.3.1.37653: Flags [.], ack 12853, win 11544, options [nop,nop,TS val 787289 ecr 1005737,nop,nop,sack 2 {42841:44269}{37129:41413},mptcp dss ack 1969141162], length 0
20:39:31.623921 IP 112.26.3.1.37653 > 112.26.3.8.39915: Flags [.], seq 29989:31417, ack 1, win 4017, options [nop,nop,TS val 1007231 ecr 786467,mptcp dss ack 4241485850 seq 1969223986 subseq 29989 len 1428 csum 0x3e57], length 1428
20:39:31.629442 IP 112.26.3.1.37653 > 112.26.3.8.39915: Flags [.], seq 29989:31417, ack 1, win 4017, options [nop,nop,TS val 1007231 ecr 786467,mptcp dss ack 4241485850 seq 1969223986 subseq 29989 len 1428 csum 0x3e57], length 1428
20:39:31.650639 IP 112.26.3.8.39915 > 112.26.3.1.37653: Flags [.], ack 12853, win 11726, options [nop,nop,TS val 787407 ecr 1005737,nop,nop,sack 2 {14281:35701}{42841:44269},mptcp dss ack 1969141162], length 0
20:39:31.664902 IP 112.26.3.8.39915 > 112.26.3.1.37653: Flags [.], ack 12853, win 11726, options [nop,nop,TS val 787407 ecr 1005737,nop,nop,sack 2 {14281:35701}{42841:44269},mptcp dss ack 1969141162], length 0
20:39:31.690703 IP 112.26.3.1.37653 > 112.26.3.8.39915: Flags [.], seq 12853:14281, ack 1, win 4017, options [nop,nop,TS val 1007836 ecr 787041,mptcp dss ack 4241485850 seq 1969141162 subseq 12853 len 1428 csum 0x8110], length 1428
20:39:31.740836 IP 112.26.3.1.37653 > 112.26.3.8.39915: Flags [.], seq 44269:45697, ack 1, win 4017, options [nop,nop,TS val 1007496 ecr 786587,mptcp dss ack 4241485850 seq 1969299670 subseq 44269 len 1428 csum 0xcdf9], length 1428
20:39:31.749491 IP 112.26.3.1.37653 > 112.26.3.8.39915: Flags [.], seq 44269:45697, ack 1, win 4017, options [nop,nop,TS val 1007496 ecr 786587,mptcp dss ack 4241485850 seq 1969299670 subseq 44269 len 1428 csum 0xcdf9], length 1428
20:39:31.786726 IP 112.26.3.1.37653 > 112.26.3.8.39915: Flags [.], seq 51409:52837, ack 1, win 4017, options [nop,nop,TS val 1007919 ecr 787132,mptcp dss ack 4241485850 seq 1969315378 subseq 51409 len 1428 csum 0x442b], length 1428
20:39:31.816558 IP 112.26.3.1.37653 > 112.26.3.8.39915: Flags [.], seq 44269:45697, ack 1, win 4017, options [nop,nop,TS val 1007496 ecr 786587,mptcp dss ack 4241485850 seq 1969299670 subseq 44269 len 1428 csum 0xcdf9], length 1428
20:39:31.865791 IP 112.26.3.1.37653 > 112.26.3.8.39915: Flags [.], seq 41413:42841, ack 1, win 4017, options [nop,nop,TS val 1008056 ecr 787289,mptcp dss ack 4241485850 seq 1969271110 subseq 41413 len 1428 csum 0x3a69], length 1428
20:39:31.871943 IP 112.26.3.8.39915 > 112.26.3.1.37653: Flags [.], ack 12853, win 11863, options [nop,nop,TS val 787587 ecr 1005737,nop,nop,sack 2 {42841:45697}{14281:35701},mptcp dss ack 1969141162], length 0
20:39:31.873178 IP 112.26.3.8.39915 > 112.26.3.1.37653: Flags [.], ack 12853, win 11863, options [nop,nop,TS val 787587 ecr 1005737,nop,nop,sack 2 {42841:45697}{14281:35701},mptcp dss ack 1969141162], length 0
20:39:31.903727 IP 112.26.3.1.37653 > 112.26.3.8.39915: Flags [.], seq 45697:47125, ack 1, win 4017, options [nop,nop,TS val 1007529 ecr 786692,mptcp dss ack 4241485850 seq 1969301098 subseq 45697 len 1428 csum 0x7324], length 1428
20:39:31.914235 IP 112.26.3.1.37653 > 112.26.3.8.39915: Flags [.], seq 45697:47125, ack 1, win 4017, options [nop,nop,TS val 1007529 ecr 786692,mptcp dss ack 4241485850 seq 1969301098 subseq 45697 len 1428 csum 0x7324], length 1428
20:39:31.989870 IP 112.26.3.1.37653 > 112.26.3.8.39915: Flags [.], seq 52837:54265, ack 1, win 4017, options [nop,nop,TS val 1008224 ecr 787407,mptcp dss ack 4241485850 seq 1969321090 subseq 52837 len 1428 csum 0xe444], length 1428
20:39:31.992855 IP 112.26.3.1.37653 > 112.26.3.8.39915: Flags [.], seq 45697:47125, ack 1, win 4017, options [nop,nop,TS val 1007529 ecr 786692,mptcp dss ack 4241485850 seq 1969301098 subseq 45697 len 1428 csum 0x7324], length 1428
20:39:32.038081 IP 112.26.3.1.37653 > 112.26.3.8.39915: Flags [.], seq 35701:37129, ack 1, win 4017, options [nop,nop,TS val 1007619 ecr 786808,mptcp dss ack 4241485850 seq 1969241122 subseq 35701 len 1428 csum 0xfc92], length 1428
20:39:32.041756 IP 112.26.3.1.37653 > 112.26.3.8.39915: Flags [.], seq 35701:37129, ack 1, win 4017, options [nop,nop,TS val 1007619 ecr 786808,mptcp dss ack 4241485850 seq 1969241122 subseq 35701 len 1428 csum 0xfc92], length 1428
20:39:32.092001 IP 112.26.3.1.37653 > 112.26.3.8.39915: Flags [.], seq 54265:55693, ack 1, win 4017, options [nop,nop,TS val 1008451 ecr 787587,mptcp dss ack 4241485850 seq 1969325374 subseq 54265 len 1428 csum 0xee4c], length 1428
20:39:32.112122 IP 112.26.3.8.39915 > 112.26.3.1.37653: Flags [.], ack 12853, win 12045, options [nop,nop,TS val 787762 ecr 1005737,nop,nop,sack 2 {42841:47125}{14281:35701},mptcp dss ack 1969141162], length 0
20:39:32.121808 IP 112.26.3.8.39915 > 112.26.3.1.37653: Flags [.], ack 12853, win 12045, options [nop,nop,TS val 787762 ecr 1005737,nop,nop,sack 2 {42841:47125}{14281:35701},mptcp dss ack 1969141162], length 0
20:39:32.165410 IP 112.26.3.1.37653 > 112.26.3.8.39915: Flags [.], seq 47125:48553, ack 1, win 4017, options [nop,nop,TS val 1007751 ecr 786941,mptcp dss ack 4241485850 seq 1969308238 subseq 47125 len 1428 csum 0x6ade], length 1428
20:39:32.186744 IP 112.26.3.8.39915 > 112.26.3.1.37653: Flags [.], ack 12853, win 12137, options [nop,nop,TS val 787819 ecr 1005737,nop,nop,sack 2 {14281:41413}{42841:47125},mptcp dss ack 1969141162], length 0
20:39:32.205348 IP 112.26.3.1.37653 > 112.26.3.8.39915: Flags [.], seq 47125:48553, ack 1, win 4017, options [nop,nop,TS val 1007751 ecr 786941,mptcp dss ack 4241485850 seq 1969308238 subseq 47125 len 1428 csum 0x6ade], length 1428
20:39:32.215861 IP 112.26.3.8.39915 > 112.26.3.1.37653: Flags [.], ack 12853, win 12137, options [nop,nop,TS val 787819 ecr 1005737,nop,nop,sack 2 {14281:41413}{42841:47125},mptcp dss ack 1969141162], length 0
20:39:32.234459 IP 112.26.3.1.37653 > 112.26.3.8.39915: Flags [.], seq 48553:49981, ack 1, win 4017, options [nop,nop,TS val 1007751 ecr 786941,mptcp dss ack 4241485850 seq 1969309666 subseq 48553 len 1428 csum 0xa0b9], length 1428
20:39:32.280989 IP 112.26.3.1.37653 > 112.26.3.8.39915: Flags [.], seq 55693:57121, ack 1, win 4017, options [nop,nop,TS val 1008691 ecr 787762,mptcp dss ack 4241485850 seq 1969331086 subseq 55693 len 1428 csum 0xb3f5], length 1428
20:39:32.290092 IP 112.26.3.8.39915 > 112.26.3.1.37653: Flags [.], ack 12853, win 12319, options [nop,nop,TS val 787983 ecr 1005737,nop,nop,sack 2 {42841:48553}{14281:41413},mptcp dss ack 1969141162], length 0
20:39:32.322638 IP 112.26.3.8.39915 > 112.26.3.1.37653: Flags [.], ack 12853, win 12319, options [nop,nop,TS val 787983 ecr 1005737,nop,nop,sack 2 {42841:48553}{14281:41413},mptcp dss ack 1969141162], length 0
20:39:32.341981 IP 112.26.3.1.37653 > 112.26.3.8.39915: Flags [.], seq 48553:49981, ack 1, win 4017, options [nop,nop,TS val 1007751 ecr 786941,mptcp dss ack 4241485850 seq 1969309666 subseq 48553 len 1428 csum 0xa0b9], length 1428
20:39:32.372074 IP 112.26.3.1.37653 > 112.26.3.8.39915: Flags [.], seq 57121:58549, ack 1, win 4017, options [nop,nop,TS val 1008765 ecr 787819,mptcp dss ack 4241485850 seq 1969333942 subseq 57121 len 1428 csum 0x976], length 1428
