20:39:27.379864 IP 112.26.3.8.39915 > 112.26.3.1.37653: Flags [S], seq 1165408037, win 65535, options [mss 1460,sackOK,TS val 783148 ecr 0,nop,wscale 6,mptcp join id 6 token 0xbaf08251 nonce 0xab03f7dc], length 0
20:39:27.395203 IP 112.26.3.8.39915 > 112.26.3.1.37653: Flags [S], seq 1165408037, win 65535, options [mss 1460,sackOK,TS val 783148 ecr 0,nop,wscale 6,mptcp join id 6 token 0xbaf08251 nonce 0xab03f7dc], length 0
20:39:27.454499 IP 112.26.3.8.39915 > 112.26.3.1.37653: Flags [S], seq 1165408037, win 65535, options [mss 1460,sackOK,TS val 783148 ecr 0,nop,wscale 6,mptcp join id 6 token 0xbaf08251 nonce 0xab03f7dc], length 0
20:39:27.595104 IP 112.26.3.8.39915 > 112.26.3.1.37653: Flags [.], ack 807428571, win 5840, options [nop,nop,TS val 783328 ecr 1003990,mptcp join hmac 0xc48361edb8e1529744f5291e0cf51b427ee0bafa], length 0
20:39:27.674205 IP 112.26.3.8.39915 > 112.26.3.1.37653: Flags [.], ack 1, win 5840, options [nop,nop,TS val 783328 ecr 1003990,mptcp join hmac 0xc48361edb8e1529744f5291e0cf51b427ee0bafa], length 0
20:39:27.676567 IP 112.26.3.8.39915 > 112.26.3.1.37653: Flags [.], ack 1, win 5840, options [nop,nop,TS val 783328 ecr 1003990,mptcp join hmac 0xc48361edb8e1529744f5291e0cf51b427ee0bafa], length 0
20:39:27.796423 IP 112.26.3.8.39915 > 112.26.3.1.37653: Flags [.], ack 1429, win 7346, options [nop,nop,TS val 783559 ecr 1004213,mptcp dss ack 1969124026], length 0
20:39:27.796719 IP 112.26.3.8.39915 > 112.26.3.1.37653: Flags [.], ack 1429, win 7346, options [nop,nop,TS val 783559 ecr 1004213,mptcp dss ack 1969124026], length 0
20:39:27.862800 IP 112.26.3.8.39915 > 112.26.3.1.37653: Flags [.], ack 1429, win 7346, options [nop,nop,TS val 783559 ecr 1004213,mptcp dss ack 1969124026], length 0
20:39:27.982401 IP 112.26.3.8.39915 > 112.26.3.1.37653: Flags [.], ack 2857, win 7483, options [nop,nop,TS val 783758 ecr 1004213,mptcp dss ack 1969125454], length 0
20:39:27.982722 IP 112.26.3.8.39915 > 112.26.3.1.37653: Flags [.], ack 2857, win 7483, options [nop,nop,TS val 783758 ecr 1004213,mptcp dss ack 1969125454], length 0
20:39:28.067615 IP 112.26.3.8.39915 > 112.26.3.1.37653: Flags [.], ack 2857, win 7483, options [nop,nop,TS val 783758 ecr 1004213,mptcp dss ack 1969125454], length 0
20:39:28.123739 IP 112.26.3.8.39915 > 112.26.3.1.37653: Flags [.], ack 4285, win 7574, options [nop,nop,TS val 783898 ecr 1004215,mptcp dss ack 1969125454], length 0
20:39:28.124073 IP 112.26.3.8.39915 > 112.26.3.1.37653: Flags [.], ack 4285, win 7574, options [nop,nop,TS val 783898 ecr 1004215,mptcp dss ack 1969125454], length 0
20:39:28.194526 IP 112.26.3.8.39915 > 112.26.3.1.37653: Flags [.], ack 4285, win 7574, options [nop,nop,TS val 783898 ecr 1004215,mptcp dss ack 1969125454], length 0
20:39:28.283391 IP 112.26.3.8.39915 > 112.26.3.1.37653: Flags [.], ack 5713, win 7757, options [nop,nop,TS val 784054 ecr 1004215,mptcp dss ack 1969126882], length 0
20:39:28.283690 IP 112.26.3.8.39915 > 112.26.3.1.37653: Flags [.], ack 5713, win 7757, options [nop,nop,TS val 784054 ecr 1004215,mptcp dss ack 1969126882], length 0
20:39:28.298767 IP 112.26.3.8.39915 > 112.26.3.1.37653: Flags [.], ack 5713, win 7757, options [nop,nop,TS val 784054 ecr 1004215,mptcp dss ack 1969126882], length 0
20:39:28.429126 IP 112.26.3.8.39915 > 112.26.3.1.37653: Flags [.], ack 7141, win 7939, options [nop,nop,TS val 784205 ecr 1004215,mptcp dss ack 1969135450], length 0
20:39:28.429508 IP 112.26.3.8.39915 > 112.26.3.1.37653: Flags [.], ack 7141, win 7939, options [nop,nop,TS val 784205 ecr 1004215,mptcp dss ack 1969135450], length 0
20:39:28.511577 IP 112.26.3.8.39915 > 112.26.3.1.37653: Flags [.], ack 7141, win 7939, options [nop,nop,TS val 784205 ecr 1004215,mptcp dss ack 1969135450], length 0
20:39:28.537157 IP 112.26.3.8.39915 > 112.26.3.1.37653: Flags [.], ack 8569, win 7985, options [nop,nop,TS val 784313 ecr 1004215,mptcp dss ack 1969136878], length 0
20:39:28.537398 IP 112.26.3.8.39915 > 112.26.3.1.37653: Flags [.], ack 8569, win 7985, options [nop,nop,TS val 784313 ecr 1004215,mptcp dss ack 1969136878], length 0
20:39:28.605583 IP 112.26.3.8.39915 > 112.26.3.1.37653: Flags [.], ack 8569, win 7985, options [nop,nop,TS val 784313 ecr 1004215,mptcp dss ack 1969136878], length 0
20:39:28.764617 IP 112.26.3.8.39915 > 112.26.3.1.37653: Flags [.], ack 9997, win 8213, options [nop,nop,TS val 784540 ecr 1004215,mptcp dss ack 1969138306], length 0
20:39:28.765003 IP 112.26.3.8.39915 > 112.26.3.1.37653: Flags [.], ack 9997, win 8213, options [nop,nop,TS val 784540 ecr 1004215,mptcp dss ack 1969138306], length 0
20:39:28.818179 IP 112.26.3.8.39915 > 112.26.3.1.37653: Flags [.], ack 9997, win 8213, options [nop,nop,TS val 784540 ecr 1004215,mptcp dss ack 1969138306], length 0
20:39:28.879182 IP 112.26.3.8.39915 > 112.26.3.1.37653: Flags [.], ack 11425, win 8304, options [nop,nop,TS val 784654 ecr 1004215,mptcp dss ack 1969139734], length 0
20:39:28.879472 IP 112.26.3.8.39915 > 112.26.3.1.37653: Flags [.], ack 11425, win 8304, options [nop,nop,TS val 784654 ecr 1004215,mptcp dss ack 1969139734], length 0
20:39:28.906119 IP 112.26.3.8.39915 > 112.26.3.1.37653: Flags [.], ack 11425, win 8304, options [nop,nop,TS val 784654 ecr 1004215,mptcp dss ack 1969139734], length 0
20:39:29.033750 IP 112.26.3.8.39915 > 112.26.3.1.37653: Flags [.], ack 11425, win 8532, options [nop,nop,TS val 784809 ecr 1004215,nop,nop,sack 1 {14281:15709},mptcp dss ack 1969139734], length 0
20:39:29.034050 IP 112.26.3.8.39915 > 112.26.3.1.37653: Flags [.], ack 11425, win 8532, options [nop,nop,TS val 784809 ecr 1004215,nop,nop,sack 1 {14281:15709},mptcp dss ack 1969139734], length 0
20:39:29.038587 IP 112.26.3.8.39915 > 112.26.3.1.37653: Flags [.], ack 11425, win 8532, options [nop,nop,TS val 784809 ecr 1004215,nop,nop,sack 1 {14281:15709},mptcp dss ack 1969139734], length 0
20:39:29.187309 IP 112.26.3.8.39915 > 112.26.3.1.37653: Flags [.], ack 11425, win 8715, options [nop,nop,TS val 784963 ecr 1004215,nop,nop,sack 1 {14281:17137},mptcp dss ack 1969139734], length 0
20:39:29.187607 IP 112.26.3.8.39915 > 112.26.3.1.37653: Flags [.], ack 11425, win 8715, options [nop,nop,TS val 784963 ecr 1004215,nop,nop,sack 1 {14281:17137},mptcp dss ack 1969139734], length 0
20:39:29.196344 IP 112.26.3.8.39915 > 112.26.3.1.37653: Flags [.], ack 11425, win 8715, options [nop,nop,TS val 784963 ecr 1004215,nop,nop,sack 1 {14281:17137},mptcp dss ack 1969139734], length 0
20:39:29.315516 IP 112.26.3.8.39915 > 112.26.3.1.37653: Flags [.], ack 11425, win 8852, options [nop,nop,TS val 785091 ecr 1004215,nop,nop,sack 1 {14281:18565},mptcp dss ack 1969139734], length 0
20:39:29.315818 IP 112.26.3.8.39915 > 112.26.3.1.37653: Flags [.], ack 11425, win 8852, options [nop,nop,TS val 785091 ecr 1004215,nop,nop,sack 1 {14281:18565},mptcp dss ack 1969139734], length 0
20:39:29.330527 IP 112.26.3.8.39915 > 112.26.3.1.37653: Flags [.], ack 11425, win 8852, options [nop,nop,TS val 785091 ecr 1004215,nop,nop,sack 1 {14281:18565},mptcp dss ack 1969139734], length 0
20:39:29.458916 IP 112.26.3.8.39915 > 112.26.3.1.37653: Flags [.], ack 11425, win 9034, options [nop,nop,TS val 785218 ecr 1004215,nop,nop,sack 1 {14281:19993},mptcp dss ack 1969139734], length 0
20:39:29.459306 IP 112.26.3.8.39915 > 112.26.3.1.37653: Flags [.], ack 11425, win 9034, options [nop,nop,TS val 785218 ecr 1004215,nop,nop,sack 1 {14281:19993},mptcp dss ack 1969139734], length 0
20:39:29.550054 IP 112.26.3.8.39915 > 112.26.3.1.37653: Flags [.], ack 11425, win 9034, options [nop,nop,TS val 785218 ecr 1004215,nop,nop,sack 1 {14281:19993},mptcp dss ack 1969139734], length 0
20:39:29.600089 IP 112.26.3.8.39915 > 112.26.3.1.37653: Flags [.], ack 11425, win 9217, options [nop,nop,TS val 785373 ecr 1004215,nop,nop,sack 1 {14281:21421},mptcp dss ack 1969139734], length 0
20:39:29.600426 IP 112.26.3.8.39915 > 112.26.3.1.37653: Flags [.], ack 11425, win 9217, options [nop,nop,TS val 785373 ecr 1004215,nop,nop,sack 1 {14281:21421},mptcp dss ack 1969139734], length 0
20:39:29.677770 IP 112.26.3.8.39915 > 112.26.3.1.37653: Flags [.], ack 11425, win 9217, options [nop,nop,TS val 785373 ecr 1004215,nop,nop,sack 1 {14281:21421},mptcp dss ack 1969139734], length 0
20:39:29.789354 IP 112.26.3.8.39915 > 112.26.3.1.37653: Flags [.], ack 11425, win 9445, options [nop,nop,TS val 785562 ecr 1004215,nop,nop,sack 1 {14281:22849},mptcp dss ack 1969139734], length 0
20:39:29.789576 IP 112.26.3.8.39915 > 112.26.3.1.37653: Flags [.], ack 11425, win 9445, options [nop,nop,TS val 785562 ecr 1004215,nop,nop,sack 1 {14281:22849},mptcp dss ack 1969139734], length 0
20:39:29.794116 IP 112.26.3.8.39915 > 112.26.3.1.37653: Flags [.], ack 11425, win 9445, options [nop,nop,TS val 785562 ecr 1004215,nop,nop,sack 1 {14281:22849},mptcp dss ack 1969139734], length 0
20:39:30.024541 IP 112.26.3.8.39915 > 112.26.3.1.37653: Flags [.], ack 11425, win 9764, options [nop,nop,TS val 785796 ecr 1004215,nop,nop,sack 1 {14281:24277},mptcp dss ack 1969139734], length 0
20:39:30.024788 IP 112.26.3.8.39915 > 112.26.3.1.37653: Flags [.], ack 11425, win 9764, options [nop,nop,TS val 785796 ecr 1004215,nop,nop,sack 1 {14281:24277},mptcp dss ack 1969139734], length 0
20:39:30.030329 IP 112.26.3.8.39915 > 112.26.3.1.37653: Flags [.], ack 11425, win 9764, options [nop,nop,TS val 785796 ecr 1004215,nop,nop,sack 1 {14281:24277},mptcp dss ack 1969139734], length 0
20:39:30.152550 IP 112.26.3.8.39915 > 112.26.3.1.37653: Flags [.], ack 11425, win 9855, options [nop,nop,TS val 785928 ecr 1004215,nop,nop,sack 1 {14281:25705},mptcp dss ack 1969139734], length 0
20:39:30.152848 IP 112.26.3.8.39915 > 112.26.3.1.37653: Flags [.], ack 11425, win 9855, options [nop,nop,TS val 785928 ecr 1004215,nop,nop,sack 1 {14281:25705},mptcp dss ack 1969139734], length 0
20:39:30.156578 IP 112.26.3.8.39915 > 112.26.3.1.37653: Flags [.], ack 11425, win 9855, options [nop,nop,TS val 785928 ecr 1004215,nop,nop,sack 1 {14281:25705},mptcp dss ack 1969139734], length 0
20:39:30.287555 IP 112.26.3.8.39915 > 112.26.3.1.37653: Flags [.], ack 11425, win 10038, options [nop,nop,TS val 786063 ecr 1004215,nop,nop,sack 1 {14281:27133},mptcp dss ack 1969139734], length 0
20:39:30.287848 IP 112.26.3.8.39915 > 112.26.3.1.37653: Flags [.], ack 11425, win 10038, options [nop,nop,TS val 786063 ecr 1004215,nop,nop,sack 1 {14281:27133},mptcp dss ack 1969139734], length 0
20:39:30.291088 IP 112.26.3.8.39915 > 112.26.3.1.37653: Flags [.], ack 11425, win 10038, options [nop,nop,TS val 786063 ecr 1004215,nop,nop,sack 1 {14281:27133},mptcp dss ack 1969139734], length 0
20:39:30.425429 IP 112.26.3.8.39915 > 112.26.3.1.37653: Flags [.], ack 11425, win 10220, options [nop,nop,TS val 786200 ecr 1004215,nop,nop,sack 1 {14281:28561},mptcp dss ack 1969139734], length 0
20:39:30.425729 IP 112.26.3.8.39915 > 112.26.3.1.37653: Flags [.], ack 11425, win 10220, options [nop,nop,TS val 786200 ecr 1004215,nop,nop,sack 1 {14281:28561},mptcp dss ack 1969139734], length 0
20:39:30.436082 IP 112.26.3.8.39915 > 112.26.3.1.37653: Flags [.], ack 11425, win 10220, options [nop,nop,TS val 786200 ecr 1004215,nop,nop,sack 1 {14281:28561},mptcp dss ack 1969139734], length 0
20:39:30.564499 IP 112.26.3.8.39915 > 112.26.3.1.37653: Flags [.], ack 11425, win 10357, options [nop,nop,TS val 786339 ecr 1004215,nop,nop,sack 1 {14281:29989},mptcp dss ack 1969139734], length 0
20:39:30.564788 IP 112.26.3.8.39915 > 112.26.3.1.37653: Flags [.], ack 11425, win 10357, options [nop,nop,TS val 786339 ecr 1004215,nop,nop,sack 1 {14281:29989},mptcp dss ack 1969139734], length 0
20:39:30.568779 IP 112.26.3.8.39915 > 112.26.3.1.37653: Flags [.], ack 11425, win 10357, options [nop,nop,TS val 786339 ecr 1004215,nop,nop,sack 1 {14281:29989},mptcp dss ack 1969139734], length 0
20:39:30.691608 IP 112.26.3.8.39915 > 112.26.3.1.37653: Flags [.], ack 11425, win 10585, options [nop,nop,TS val 786467 ecr 1004215,nop,nop,sack 2 {31417:32845}{14281:29989},mptcp dss ack 1969139734], length 0
20:39:30.691840 IP 112.26.3.8.39915 > 112.26.3.1.37653: Flags [.], ack 11425, win 10585, options [nop,nop,TS val 786467 ecr 1004215,nop,nop,sack 2 {31417:32845}{14281:29989},mptcp dss ack 1969139734], length 0
20:39:30.695382 IP 112.26.3.8.39915 > 112.26.3.1.37653: Flags [.], ack 11425, win 10585, options [nop,nop,TS val 786467 ecr 1004215,nop,nop,sack 2 {31417:32845}{14281:29989},mptcp dss ack 1969139734], length 0
20:39:30.811379 IP 112.26.3.8.39915 > 112.26.3.1.37653: Flags [.], ack 11425, win 10677, options [nop,nop,TS val 786587 ecr 1004215,nop,nop,sack 2 {31417:34273}{14281:29989},mptcp dss ack 1969139734], length 0
20:39:30.811723 IP 112.26.3.8.39915 > 112.26.3.1.37653: Flags [.], ack 11425, win 10677, options [nop,nop,TS val 786587 ecr 1004215,nop,nop,sack 2 {31417:34273}{14281:29989},mptcp dss ack 1969139734], length 0
20:39:30.900862 IP 112.26.3.8.39915 > 112.26.3.1.37653: Flags [.], ack 11425, win 10677, options [nop,nop,TS val 786587 ecr 1004215,nop,nop,sack 2 {31417:34273}{14281:29989},mptcp dss ack 1969139734], length 0
20:39:30.951052 IP 112.26.3.8.39915 > 112.26.3.1.37653: Flags [.], ack 11425, win 10814, options [nop,nop,TS val 786692 ecr 1004215,nop,nop,sack 2 {31417:35701}{14281:29989},mptcp dss ack 1969139734], length 0
20:39:30.951334 IP 112.26.3.8.39915 > 112.26.3.1.37653: Flags [.], ack 11425, win 10814, options [nop,nop,TS val 786692 ecr 1004215,nop,nop,sack 2 {31417:35701}{14281:29989},mptcp dss ack 1969139734], length 0
20:39:30.987883 IP 112.26.3.8.39915 > 112.26.3.1.37653: Flags [.], ack 11425, win 10814, options [nop,nop,TS val 786692 ecr 1004215,nop,nop,sack 2 {31417:35701}{14281:29989},mptcp dss ack 1969139734], length 0
20:39:31.032111 IP 112.26.3.8.39915 > 112.26.3.1.37653: Flags [.], ack 11425, win 10950, options [nop,nop,TS val 786808 ecr 1004215,nop,nop,sack 2 {37129:38557}{31417:35701},mptcp dss ack 1969139734], length 0
20:39:31.032376 IP 112.26.3.8.39915 > 112.26.3.1.37653: Flags [.], ack 11425, win 10950, options [nop,nop,TS val 786808 ecr 1004215,nop,nop,sack 2 {37129:38557}{31417:35701},mptcp dss ack 1969139734], length 0
20:39:31.083605 IP 112.26.3.8.39915 > 112.26.3.1.37653: Flags [.], ack 11425, win 10950, options [nop,nop,TS val 786808 ecr 1004215,nop,nop,sack 2 {37129:38557}{31417:35701},mptcp dss ack 1969139734], length 0
20:39:31.165200 IP 112.26.3.8.39915 > 112.26.3.1.37653: Flags [.], ack 12853, win 11133, options [nop,nop,TS val 786941 ecr 1005737,nop,nop,sack 2 {37129:38557}{31417:35701},mptcp dss ack 1969141162], length 0
20:39:31.165459 IP 112.26.3.8.39915 > 112.26.3.1.37653: Flags [.], ack 12853, win 11133, options [nop,nop,TS val 786941 ecr 1005737,nop,nop,sack 2 {37129:38557}{31417:35701},mptcp dss ack 1969141162], length 0
20:39:31.216133 IP 112.26.3.8.39915 > 112.26.3.1.37653: Flags [.], ack 12853, win 11133, options [nop,nop,TS val 786941 ecr 1005737,nop,nop,sack 2 {37129:38557}{31417:35701},mptcp dss ack 1969141162], length 0
20:39:31.283413 IP 112.26.3.8.39915 > 112.26.3.1.37653: Flags [.], ack 12853, win 11224, options [nop,nop,TS val 787041 ecr 1005737,nop,nop,sack 2 {37129:39985}{31417:35701},mptcp dss ack 1969141162], length 0
20:39:31.283714 IP 112.26.3.8.39915 > 112.26.3.1.37653: Flags [.], ack 12853, win 11224, options [nop,nop,TS val 787041 ecr 1005737,nop,nop,sack 2 {37129:39985}{31417:35701},mptcp dss ack 1969141162], length 0
20:39:31.300930 IP 112.26.3.8.39915 > 112.26.3.1.37653: Flags [.], ack 12853, win 11224, options [nop,nop,TS val 787041 ecr 1005737,nop,nop,sack 2 {37129:39985}{31417:35701},mptcp dss ack 1969141162], length 0
20:39:31.356092 IP 112.26.3.8.39915 > 112.26.3.1.37653: Flags [.], ack 12853, win 11315, options [nop,nop,TS val 787132 ecr 1005737,nop,nop,sack 2 {37129:41413}{31417:35701},mptcp dss ack 1969141162], length 0
20:39:31.356384 IP 112.26.3.8.39915 > 112.26.3.1.37653: Flags [.], ack 12853, win 11315, options [nop,nop,TS val 787132 ecr 1005737,nop,nop,sack 2 {37129:41413}{31417:35701},mptcp dss ack 1969141162], length 0
20:39:31.377266 IP 112.26.3.8.39915 > 112.26.3.1.37653: Flags [.], ack 12853, win 11315, options [nop,nop,TS val 787132 ecr 1005737,nop,nop,sack 2 {37129:41413}{31417:35701},mptcp dss ack 1969141162], length 0
20:39:31.514160 IP 112.26.3.8.39915 > 112.26.3.1.37653: Flags [.], ack 12853, win 11544, options [nop,nop,TS val 787289 ecr 1005737,nop,nop,sack 2 {42841:44269}{37129:41413},mptcp dss ack 1969141162], length 0
20:39:31.514430 IP 112.26.3.8.39915 > 112.26.3.1.37653: Flags [.], ack 12853, win 11544, options [nop,nop,TS val 787289 ecr 1005737,nop,nop,sack 2 {42841:44269}{37129:41413},mptcp dss ack 1969141162], length 0
20:39:31.520264 IP 112.26.3.8.39915 > 112.26.3.1.37653: Flags [.], ack 12853, win 11544, options [nop,nop,TS val 787289 ecr 1005737,nop,nop,sack 2 {42841:44269}{37129:41413},mptcp dss ack 1969141162], length 0
20:39:31.632403 IP 112.26.3.8.39915 > 112.26.3.1.37653: Flags [.], ack 12853, win 11726, options [nop,nop,TS val 787407 ecr 1005737,nop,nop,sack 2 {14281:35701}{42841:44269},mptcp dss ack 1969141162], length 0
20:39:31.632700 IP 112.26.3.8.39915 > 112.26.3.1.37653: Flags [.], ack 12853, win 11726, options [nop,nop,TS val 787407 ecr 1005737,nop,nop,sack 2 {14281:35701}{42841:44269},mptcp dss ack 1969141162], length 0
20:39:31.648341 IP 112.26.3.8.39915 > 112.26.3.1.37653: Flags [.], ack 12853, win 11726, options [nop,nop,TS val 787407 ecr 1005737,nop,nop,sack 2 {14281:35701}{42841:44269},mptcp dss ack 1969141162], length 0
20:39:31.749604 IP 112.26.3.1.37653 > 112.26.3.8.39915: Flags [.], seq 44269:45697, ack 0, win 4017, options [nop,nop,TS val 1007496 ecr 786587,mptcp dss ack 4241485850 seq 1969299670 subseq 44269 len 1428 csum 0xcdf9], length 1428
20:39:31.749891 IP 112.26.3.1.37653 > 112.26.3.8.39915: Flags [.], seq 44269:45697, ack 0, win 4017, options [nop,nop,TS val 1007496 ecr 786587,mptcp dss ack 4241485850 seq 1969299670 subseq 44269 len 1428 csum 0xcdf9], length 1428
20:39:31.812143 IP 112.26.3.8.39915 > 112.26.3.1.37653: Flags [.], ack 12853, win 11863, options [nop,nop,TS val 787587 ecr 1005737,nop,nop,sack 2 {42841:45697}{14281:35701},mptcp dss ack 1969141162], length 0
20:39:31.812426 IP 112.26.3.8.39915 > 112.26.3.1.37653: Flags [.], ack 12853, win 11863, options [nop,nop,TS val 787587 ecr 1005737,nop,nop,sack 2 {42841:45697}{14281:35701},mptcp dss ack 1969141162], length 0
20:39:31.873291 IP 112.26.3.8.39915 > 112.26.3.1.37653: Flags [.], ack 12853, win 11863, options [nop,nop,TS val 787587 ecr 1005737,nop,nop,sack 2 {42841:45697}{14281:35701},mptcp dss ack 1969141162], length 0
20:39:31.906556 IP 112.26.3.1.37653 > 112.26.3.8.39915: Flags [.], seq 45697:47125, ack 0, win 4017, options [nop,nop,TS val 1007529 ecr 786692,mptcp dss ack 4241485850 seq 1969301098 subseq 45697 len 1428 csum 0x7324], length 1428
20:39:31.906828 IP 112.26.3.1.37653 > 112.26.3.8.39915: Flags [.], seq 45697:47125, ack 0, win 4017, options [nop,nop,TS val 1007529 ecr 786692,mptcp dss ack 4241485850 seq 1969301098 subseq 45697 len 1428 csum 0x7324], length 1428
20:39:31.987572 IP 112.26.3.8.39915 > 112.26.3.1.37653: Flags [.], ack 12853, win 12045, options [nop,nop,TS val 787762 ecr 1005737,nop,nop,sack 2 {42841:47125}{14281:35701},mptcp dss ack 1969141162], length 0
20:39:31.987847 IP 112.26.3.8.39915 > 112.26.3.1.37653: Flags [.], ack 12853, win 12045, options [nop,nop,TS val 787762 ecr 1005737,nop,nop,sack 2 {42841:47125}{14281:35701},mptcp dss ack 1969141162], length 0
20:39:32.041868 IP 112.26.3.1.37653 > 112.26.3.8.39915: Flags [.], seq 35701:37129, ack 0, win 4017, options [nop,nop,TS val 1007619 ecr 786808,mptcp dss ack 4241485850 seq 1969241122 subseq 35701 len 1428 csum 0xfc92], length 1428
20:39:32.060510 IP 112.26.3.8.39915 > 112.26.3.1.37653: Flags [.], ack 12853, win 12137, options [nop,nop,TS val 787819 ecr 1005737,nop,nop,sack 2 {14281:41413}{42841:47125},mptcp dss ack 1969141162], length 0
20:39:32.060811 IP 112.26.3.8.39915 > 112.26.3.1.37653: Flags [.], ack 12853, win 12137, options [nop,nop,TS val 787819 ecr 1005737,nop,nop,sack 2 {14281:41413}{42841:47125},mptcp dss ack 1969141162], length 0
20:39:32.126617 IP 112.26.3.8.39915 > 112.26.3.1.37653: Flags [.], ack 12853, win 12045, options [nop,nop,TS val 787762 ecr 1005737,nop,nop,sack 2 {42841:47125}{14281:35701},mptcp dss ack 1969141162], length 0
20:39:32.205461 IP 112.26.3.1.37653 > 112.26.3.8.39915: Flags [.], seq 47125:48553, ack 0, win 4017, options [nop,nop,TS val 1007751 ecr 786941,mptcp dss ack 4241485850 seq 1969308238 subseq 47125 len 1428 csum 0x6ade], length 1428
20:39:32.207672 IP 112.26.3.8.39915 > 112.26.3.1.37653: Flags [.], ack 12853, win 12319, options [nop,nop,TS val 787983 ecr 1005737,nop,nop,sack 2 {42841:48553}{14281:41413},mptcp dss ack 1969141162], length 0
20:39:32.207958 IP 112.26.3.8.39915 > 112.26.3.1.37653: Flags [.], ack 12853, win 12319, options [nop,nop,TS val 787983 ecr 1005737,nop,nop,sack 2 {42841:48553}{14281:41413},mptcp dss ack 1969141162], length 0
20:39:32.215973 IP 112.26.3.8.39915 > 112.26.3.1.37653: Flags [.], ack 12853, win 12137, options [nop,nop,TS val 787819 ecr 1005737,nop,nop,sack 2 {14281:41413}{42841:47125},mptcp dss ack 1969141162], length 0
20:39:32.322752 IP 112.26.3.8.39915 > 112.26.3.1.37653: Flags [.], ack 12853, win 12319, options [nop,nop,TS val 787983 ecr 1005737,nop,nop,sack 2 {42841:48553}{14281:41413},mptcp dss ack 1969141162], length 0
20:39:32.342106 IP 112.26.3.1.37653 > 112.26.3.8.39915: Flags [.], seq 48553:49981, ack 0, win 4017, options [nop,nop,TS val 1007751 ecr 786941,mptcp dss ack 4241485850 seq 1969309666 subseq 48553 len 1428 csum 0xa0b9], length 1428
20:39:32.344269 IP 112.26.3.8.39915 > 112.26.3.1.37653: Flags [.], ack 12853, win 12502, options [nop,nop,TS val 788119 ecr 1005737,nop,nop,sack 2 {42841:49981}{14281:41413},mptcp dss ack 1969141162], length 0
20:39:32.344571 IP 112.26.3.8.39915 > 112.26.3.1.37653: Flags [.], ack 12853, win 12502, options [nop,nop,TS val 788119 ecr 1005737,nop,nop,sack 2 {42841:49981}{14281:41413},mptcp dss ack 1969141162], length 0
20:39:32.457911 IP 112.26.3.1.37653 > 112.26.3.8.39915: Flags [.], seq 49981:51409, ack 0, win 4017, options [nop,nop,TS val 1007751 ecr 786941,mptcp dss ack 4241485850 seq 1969311094 subseq 49981 len 1428 csum 0xdc11], length 1428
20:39:32.472668 IP 112.26.3.8.39915 > 112.26.3.1.37653: Flags [.], ack 12853, win 12502, options [nop,nop,TS val 788119 ecr 1005737,nop,nop,sack 2 {42841:49981}{14281:41413},mptcp dss ack 1969141162], length 0
20:39:32.484289 IP 112.26.3.8.39915 > 112.26.3.1.37653: Flags [.], ack 12853, win 12684, options [nop,nop,TS val 788235 ecr 1005737,nop,nop,sack 2 {42841:51409}{14281:41413},mptcp dss ack 1969141162], length 0
20:39:32.484550 IP 112.26.3.8.39915 > 112.26.3.1.37653: Flags [.], ack 12853, win 12684, options [nop,nop,TS val 788235 ecr 1005737,nop,nop,sack 2 {42841:51409}{14281:41413},mptcp dss ack 1969141162], length 0
20:39:32.575831 IP 112.26.3.1.37653 > 112.26.3.8.39915: Flags [.], seq 12853:14281, ack 0, win 4017, options [nop,nop,TS val 1007836 ecr 787041,mptcp dss ack 4241485850 seq 1969141162 subseq 12853 len 1428 csum 0x8110], length 1428
20:39:32.587724 IP 112.26.3.8.39915 > 112.26.3.1.37653: Flags [.], ack 41413, win 12821, options [nop,nop,TS val 788353 ecr 1007836,nop,nop,sack 1 {42841:51409},mptcp dss ack 1969216846], length 0
20:39:32.587977 IP 112.26.3.8.39915 > 112.26.3.1.37653: Flags [.], ack 41413, win 12821, options [nop,nop,TS val 788353 ecr 1007836,nop,nop,sack 1 {42841:51409},mptcp dss ack 1969216846], length 0
20:39:32.709489 IP 112.26.3.8.39915 > 112.26.3.1.37653: Flags [.], ack 12853, win 12684, options [nop,nop,TS val 788235 ecr 1005737,nop,nop,sack 2 {42841:51409}{14281:41413},mptcp dss ack 1969141162], length 0
20:39:32.767524 IP 112.26.3.1.37653 > 112.26.3.8.39915: Flags [.], seq 51409:52837, ack 0, win 4017, options [nop,nop,TS val 1007919 ecr 787132,mptcp dss ack 4241485850 seq 1969315378 subseq 51409 len 1428 csum 0x442b], length 1428
20:39:32.786846 IP 112.26.3.8.39915 > 112.26.3.1.37653: Flags [.], ack 41413, win 12821, options [nop,nop,TS val 788353 ecr 1007836,nop,nop,sack 1 {42841:51409},mptcp dss ack 1969216846], length 0
20:39:32.797172 IP 112.26.3.8.39915 > 112.26.3.1.37653: Flags [.], ack 41413, win 13049, options [nop,nop,TS val 788545 ecr 1007836,nop,nop,sack 1 {42841:52837},mptcp dss ack 1969216846], length 0
20:39:32.797477 IP 112.26.3.8.39915 > 112.26.3.1.37653: Flags [.], ack 41413, win 13049, options [nop,nop,TS val 788545 ecr 1007836,nop,nop,sack 1 {42841:52837},mptcp dss ack 1969216846], length 0
20:39:32.929026 IP 112.26.3.8.39915 > 112.26.3.1.37653: Flags [.], ack 41413, win 13049, options [nop,nop,TS val 788545 ecr 1007836,nop,nop,sack 1 {42841:52837},mptcp dss ack 1969216846], length 0
20:39:33.012418 IP 112.26.3.1.37653 > 112.26.3.8.39915: Flags [.], seq 41413:42841, ack 0, win 4017, options [nop,nop,TS val 1008056 ecr 787289,mptcp dss ack 4241485850 seq 1969271110 subseq 41413 len 1428 csum 0x3a69], length 1428
20:39:33.015553 IP 112.26.3.8.39915 > 112.26.3.1.37653: Flags [.], ack 52837, win 13232, options [nop,nop,TS val 788790 ecr 1008056,mptcp dss ack 1969216846], length 0
20:39:33.015843 IP 112.26.3.8.39915 > 112.26.3.1.37653: Flags [.], ack 52837, win 13232, options [nop,nop,TS val 788790 ecr 1008056,mptcp dss ack 1969216846], length 0
20:39:33.130264 IP 112.26.3.1.37653 > 112.26.3.8.39915: Flags [.], seq 54265:55693, ack 0, win 4017, options [nop,nop,TS val 1008451 ecr 787587,mptcp dss ack 4241485850 seq 1969325374 subseq 54265 len 1428 csum 0xee4c], length 1428
20:39:33.132981 IP 112.26.3.8.39915 > 112.26.3.1.37653: Flags [.], ack 52837, win 13369, options [nop,nop,TS val 788908 ecr 1008056,nop,nop,sack 1 {54265:55693},mptcp dss ack 1969216846], length 0
20:39:33.133239 IP 112.26.3.8.39915 > 112.26.3.1.37653: Flags [.], ack 52837, win 13369, options [nop,nop,TS val 788908 ecr 1008056,nop,nop,sack 1 {54265:55693},mptcp dss ack 1969216846], length 0
20:39:33.173968 IP 112.26.3.8.39915 > 112.26.3.1.37653: Flags [.], ack 52837, win 13232, options [nop,nop,TS val 788790 ecr 1008056,mptcp dss ack 1969216846], length 0
20:39:33.234982 IP 112.26.3.8.39915 > 112.26.3.1.37653: Flags [.], ack 52837, win 13369, options [nop,nop,TS val 788908 ecr 1008056,nop,nop,sack 1 {54265:55693},mptcp dss ack 1969216846], length 0
20:39:33.260421 IP 112.26.3.1.37653 > 112.26.3.8.39915: Flags [.], seq 55693:57121, ack 0, win 4017, options [nop,nop,TS val 1008691 ecr 787762,mptcp dss ack 4241485850 seq 1969331086 subseq 55693 len 1428 csum 0xb3f5], length 1428
20:39:33.262025 IP 112.26.3.8.39915 > 112.26.3.1.37653: Flags [.], ack 52837, win 13460, options [nop,nop,TS val 789038 ecr 1008056,nop,nop,sack 1 {54265:57121},mptcp dss ack 1969216846], length 0
20:39:33.262348 IP 112.26.3.8.39915 > 112.26.3.1.37653: Flags [.], ack 52837, win 13460, options [nop,nop,TS val 789038 ecr 1008056,nop,nop,sack 1 {54265:57121},mptcp dss ack 1969216846], length 0
20:39:33.333878 IP 112.26.3.8.39915 > 112.26.3.1.37653: Flags [.], ack 52837, win 13460, options [nop,nop,TS val 789038 ecr 1008056,nop,nop,sack 1 {54265:57121},mptcp dss ack 1969216846], length 0
20:39:33.398655 IP 112.26.3.1.37653 > 112.26.3.8.39915: Flags [.], seq 57121:58549, ack 0, win 4017, options [nop,nop,TS val 1008765 ecr 787819,mptcp dss ack 4241485850 seq 1969333942 subseq 57121 len 1428 csum 0x976], length 1428
20:39:33.483808 IP 112.26.3.1.37653 > 112.26.3.8.39915: Flags [.], seq 58549:59977, ack 0, win 4017, options [nop,nop,TS val 1008873 ecr 787983,mptcp dss ack 4241485850 seq 1969335370 subseq 58549 len 1428 csum 0x7ac1], length 1428
20:39:33.514908 IP 112.26.3.8.39915 > 112.26.3.1.37653: Flags [.], ack 52837, win 13642, options [nop,nop,TS val 789176 ecr 1008056,nop,nop,sack 1 {54265:58549},mptcp dss ack 1969216846], length 0
20:39:33.515234 IP 112.26.3.8.39915 > 112.26.3.1.37653: Flags [.], ack 52837, win 13642, options [nop,nop,TS val 789176 ecr 1008056,nop,nop,sack 1 {54265:58549},mptcp dss ack 1969216846], length 0
20:39:33.564745 IP 112.26.3.8.39915 > 112.26.3.1.37653: Flags [.], ack 52837, win 13779, options [nop,nop,TS val 789261 ecr 1008056,nop,nop,sack 1 {54265:59977},mptcp dss ack 1969216846], length 0
20:39:33.565033 IP 112.26.3.8.39915 > 112.26.3.1.37653: Flags [.], ack 52837, win 13779, options [nop,nop,TS val 789261 ecr 1008056,nop,nop,sack 1 {54265:59977},mptcp dss ack 1969216846], length 0
20:39:33.577882 IP 112.26.3.1.37653 > 112.26.3.8.39915: Flags [.], seq 59977:61405, ack 0, win 4017, options [nop,nop,TS val 1009013 ecr 788119,mptcp dss ack 4241485850 seq 1969343938 subseq 59977 len 1428 csum 0x82f], length 1428
20:39:33.585842 IP 112.26.3.8.39915 > 112.26.3.1.37653: Flags [.], ack 52837, win 13642, options [nop,nop,TS val 789176 ecr 1008056,nop,nop,sack 1 {54265:58549},mptcp dss ack 1969216846], length 0
20:39:33.661382 IP 112.26.3.8.39915 > 112.26.3.1.37653: Flags [.], ack 52837, win 13870, options [nop,nop,TS val 789355 ecr 1008056,nop,nop,sack 1 {54265:61405},mptcp dss ack 1969216846], length 0
20:39:33.661698 IP 112.26.3.8.39915 > 112.26.3.1.37653: Flags [.], ack 52837, win 13870, options [nop,nop,TS val 789355 ecr 1008056,nop,nop,sack 1 {54265:61405},mptcp dss ack 1969216846], length 0
20:39:33.688260 IP 112.26.3.8.39915 > 112.26.3.1.37653: Flags [.], ack 52837, win 13779, options [nop,nop,TS val 789261 ecr 1008056,nop,nop,sack 1 {54265:59977},mptcp dss ack 1969216846], length 0
20:39:33.706367 IP 112.26.3.1.37653 > 112.26.3.8.39915: Flags [.], seq 61405:62833, ack 0, win 4017, options [nop,nop,TS val 1009323 ecr 788235,mptcp dss ack 4241485850 seq 1969352506 subseq 61405 len 1428 csum 0xed1e], length 1428
20:39:33.777584 IP 112.26.3.8.39915 > 112.26.3.1.37653: Flags [.], ack 52837, win 14053, options [nop,nop,TS val 789484 ecr 1008056,nop,nop,sack 1 {54265:62833},mptcp dss ack 1969216846], length 0
20:39:33.777826 IP 112.26.3.8.39915 > 112.26.3.1.37653: Flags [.], ack 52837, win 14053, options [nop,nop,TS val 789484 ecr 1008056,nop,nop,sack 1 {54265:62833},mptcp dss ack 1969216846], length 0
20:39:33.818478 IP 112.26.3.8.39915 > 112.26.3.1.37653: Flags [.], ack 52837, win 13870, options [nop,nop,TS val 789355 ecr 1008056,nop,nop,sack 1 {54265:61405},mptcp dss ack 1969216846], length 0
20:39:33.835388 IP 112.26.3.1.37653 > 112.26.3.8.39915: Flags [.], seq 62833:64261, ack 0, win 4017, options [nop,nop,TS val 1009323 ecr 788353,mptcp dss ack 4241485850 seq 1969353934 subseq 62833 len 1428 csum 0x74d6], length 1428
20:39:33.867739 IP 112.26.3.8.39915 > 112.26.3.1.37653: Flags [.], ack 52837, win 14190, options [nop,nop,TS val 789613 ecr 1008056,nop,nop,sack 1 {54265:64261},mptcp dss ack 1969216846], length 0
20:39:33.868031 IP 112.26.3.8.39915 > 112.26.3.1.37653: Flags [.], ack 52837, win 14190, options [nop,nop,TS val 789613 ecr 1008056,nop,nop,sack 1 {54265:64261},mptcp dss ack 1969216846], length 0
20:39:33.942262 IP 112.26.3.8.39915 > 112.26.3.1.37653: Flags [.], ack 52837, win 14053, options [nop,nop,TS val 789484 ecr 1008056,nop,nop,sack 1 {54265:62833},mptcp dss ack 1969216846], length 0
20:39:33.973492 IP 112.26.3.1.37653 > 112.26.3.8.39915: Flags [.], seq 64261:65689, ack 0, win 4017, options [nop,nop,TS val 1009484 ecr 788545,mptcp dss ack 4241485850 seq 1969361074 subseq 64261 len 1428 csum 0xc4a4], length 1428
20:39:33.976622 IP 112.26.3.8.39915 > 112.26.3.1.37653: Flags [.], ack 52837, win 14372, options [nop,nop,TS val 789751 ecr 1008056,nop,nop,sack 1 {54265:65689},mptcp dss ack 1969216846], length 0
20:39:33.976867 IP 112.26.3.8.39915 > 112.26.3.1.37653: Flags [.], ack 52837, win 14372, options [nop,nop,TS val 789751 ecr 1008056,nop,nop,sack 1 {54265:65689},mptcp dss ack 1969216846], length 0
20:39:34.067650 IP 112.26.3.8.39915 > 112.26.3.1.37653: Flags [.], ack 52837, win 14190, options [nop,nop,TS val 789613 ecr 1008056,nop,nop,sack 1 {54265:64261},mptcp dss ack 1969216846], length 0
20:39:34.102976 IP 112.26.3.1.37653 > 112.26.3.8.39915: Flags [.], seq 52837:54265, ack 0, win 4017, options [nop,nop,TS val 1009770 ecr 788908,mptcp dss ack 4241485850 seq 1969321090 subseq 52837 len 1428 csum 0xe444], length 1428
20:39:34.106702 IP 112.26.3.8.39915 > 112.26.3.1.37653: Flags [.], ack 65689, win 14509, options [nop,nop,TS val 789880 ecr 1009770,mptcp dss ack 1969216846], length 0
20:39:34.106998 IP 112.26.3.8.39915 > 112.26.3.1.37653: Flags [.], ack 65689, win 14509, options [nop,nop,TS val 789880 ecr 1009770,mptcp dss ack 1969216846], length 0
20:39:34.170076 IP 112.26.3.8.39915 > 112.26.3.1.37653: Flags [.], ack 52837, win 14372, options [nop,nop,TS val 789751 ecr 1008056,nop,nop,sack 1 {54265:65689},mptcp dss ack 1969216846], length 0
20:39:34.251976 IP 112.26.3.1.37653 > 112.26.3.8.39915: Flags [.], seq 65689:67117, ack 0, win 4017, options [nop,nop,TS val 1009915 ecr 789038,mptcp dss ack 4241485850 seq 1969375354 subseq 65689 len 1428 csum 0xd4b5], length 1428
20:39:34.258503 IP 112.26.3.8.39915 > 112.26.3.1.37653: Flags [.], ack 67117, win 14692, options [nop,nop,TS val 790029 ecr 1009915,mptcp dss ack 1969216846], length 0
20:39:34.258789 IP 112.26.3.8.39915 > 112.26.3.1.37653: Flags [.], ack 67117, win 14692, options [nop,nop,TS val 790029 ecr 1009915,mptcp dss ack 1969216846], length 0
20:39:34.264455 IP 112.26.3.8.39915 > 112.26.3.1.37653: Flags [.], ack 65689, win 14509, options [nop,nop,TS val 789880 ecr 1009770,mptcp dss ack 1969216846], length 0
20:39:34.339601 IP 112.26.3.1.37653 > 112.26.3.8.39915: Flags [.], seq 67117:68545, ack 0, win 4017, options [nop,nop,TS val 1010224 ecr 789176,mptcp dss ack 4241485850 seq 1969383922 subseq 67117 len 1428 csum 0x8ed7], length 1428
20:39:34.353709 IP 112.26.3.8.39915 > 112.26.3.1.37653: Flags [.], ack 68545, win 14783, options [nop,nop,TS val 790117 ecr 1010224,mptcp dss ack 1969216846], length 0
20:39:34.353998 IP 112.26.3.8.39915 > 112.26.3.1.37653: Flags [.], ack 68545, win 14783, options [nop,nop,TS val 790117 ecr 1010224,mptcp dss ack 1969216846], length 0
20:39:34.403323 IP 112.26.3.8.39915 > 112.26.3.1.37653: Flags [.], ack 67117, win 14692, options [nop,nop,TS val 790029 ecr 1009915,mptcp dss ack 1969216846], length 0
20:39:34.466296 IP 112.26.3.8.39915 > 112.26.3.1.37653: Flags [.], ack 68545, win 14783, options [nop,nop,TS val 790117 ecr 1010224,mptcp dss ack 1969216846], length 0
20:39:34.499326 IP 112.26.3.1.37653 > 112.26.3.8.39915: Flags [.], seq 68545:69973, ack 0, win 4017, options [nop,nop,TS val 1010247 ecr 789261,mptcp dss ack 4241485850 seq 1969385350 subseq 68545 len 1428 csum 0xc72b], length 1428
20:39:34.514367 IP 112.26.3.8.39915 > 112.26.3.1.37653: Flags [.], ack 69973, win 15011, options [nop,nop,TS val 790277 ecr 1010247,mptcp dss ack 1969216846], length 0
20:39:34.514615 IP 112.26.3.8.39915 > 112.26.3.1.37653: Flags [.], ack 69973, win 15011, options [nop,nop,TS val 790277 ecr 1010247,mptcp dss ack 1969216846], length 0
20:39:34.614397 IP 112.26.3.8.39915 > 112.26.3.1.37653: Flags [.], ack 69973, win 15011, options [nop,nop,TS val 790277 ecr 1010247,mptcp dss ack 1969216846], length 0
20:39:34.629633 IP 112.26.3.1.37653 > 112.26.3.8.39915: Flags [.], seq 69973:71401, ack 0, win 4017, options [nop,nop,TS val 1010416 ecr 789355,mptcp dss ack 4241485850 seq 1969392490 subseq 69973 len 1428 csum 0xf69b], length 1428
20:39:34.630963 IP 112.26.3.8.39915 > 112.26.3.1.37653: Flags [.], ack 71401, win 15194, options [nop,nop,TS val 790407 ecr 1010416,mptcp dss ack 1969216846], length 0
20:39:34.631293 IP 112.26.3.8.39915 > 112.26.3.1.37653: Flags [.], ack 71401, win 15194, options [nop,nop,TS val 790407 ecr 1010416,mptcp dss ack 1969216846], length 0
20:39:34.691647 IP 112.26.3.8.39915 > 112.26.3.1.37653: Flags [.], ack 71401, win 15194, options [nop,nop,TS val 790407 ecr 1010416,mptcp dss ack 1969216846], length 0
20:39:34.754587 IP 112.26.3.1.37653 > 112.26.3.8.39915: Flags [.], seq 71401:72829, ack 0, win 4017, options [nop,nop,TS val 1010499 ecr 789484,mptcp dss ack 4241485850 seq 1969396774 subseq 71401 len 1428 csum 0x3983], length 1428
20:39:34.760902 IP 112.26.3.8.39915 > 112.26.3.1.37653: Flags [.], ack 72829, win 15330, options [nop,nop,TS val 790532 ecr 1010499,mptcp dss ack 1969216846], length 0
20:39:34.761230 IP 112.26.3.8.39915 > 112.26.3.1.37653: Flags [.], ack 72829, win 15330, options [nop,nop,TS val 790532 ecr 1010499,mptcp dss ack 1969216846], length 0
20:39:34.809147 IP 112.26.3.8.39915 > 112.26.3.1.37653: Flags [.], ack 72829, win 15330, options [nop,nop,TS val 790532 ecr 1010499,mptcp dss ack 1969216846], length 0
20:39:34.906661 IP 112.26.3.1.37653 > 112.26.3.8.39915: Flags [.], seq 72829:74257, ack 0, win 4017, options [nop,nop,TS val 1010616 ecr 789613,mptcp dss ack 4241485850 seq 1969402486 subseq 72829 len 1428 csum 0x793], length 1428
20:39:34.909305 IP 112.26.3.8.39915 > 112.26.3.1.37653: Flags [.], ack 74257, win 15559, options [nop,nop,TS val 790684 ecr 1010616,mptcp dss ack 1969216846], length 0
20:39:34.909622 IP 112.26.3.8.39915 > 112.26.3.1.37653: Flags [.], ack 74257, win 15559, options [nop,nop,TS val 790684 ecr 1010616,mptcp dss ack 1969216846], length 0
20:39:34.935186 IP 112.26.3.8.39915 > 112.26.3.1.37653: Flags [.], ack 74257, win 15559, options [nop,nop,TS val 790684 ecr 1010616,mptcp dss ack 1969216846], length 0
20:39:35.025419 IP 112.26.3.1.37653 > 112.26.3.8.39915: Flags [.], seq 74257:75685, ack 0, win 4017, options [nop,nop,TS val 1010775 ecr 789751,mptcp dss ack 4241485850 seq 1969406770 subseq 74257 len 1428 csum 0x958d], length 1428
20:39:35.026982 IP 112.26.3.8.39915 > 112.26.3.1.37653: Flags [.], ack 75685, win 15787, options [nop,nop,TS val 790803 ecr 1010775,mptcp dss ack 1969216846], length 0
20:39:35.027250 IP 112.26.3.8.39915 > 112.26.3.1.37653: Flags [.], ack 75685, win 15787, options [nop,nop,TS val 790803 ecr 1010775,mptcp dss ack 1969216846], length 0
20:39:35.041675 IP 112.26.3.8.39915 > 112.26.3.1.37653: Flags [.], ack 75685, win 15787, options [nop,nop,TS val 790803 ecr 1010775,mptcp dss ack 1969216846], length 0
20:39:35.144309 IP 112.26.3.1.37653 > 112.26.3.8.39915: Flags [.], seq 75685:77113, ack 0, win 4017, options [nop,nop,TS val 1010792 ecr 789880,mptcp dss ack 4241485850 seq 1969411054 subseq 75685 len 1428 csum 0xbf8b], length 1428
20:39:35.146358 IP 112.26.3.8.39915 > 112.26.3.1.37653: Flags [.], ack 77113, win 15969, options [nop,nop,TS val 790922 ecr 1010792,mptcp dss ack 1969216846], length 0
20:39:35.146643 IP 112.26.3.8.39915 > 112.26.3.1.37653: Flags [.], ack 77113, win 15969, options [nop,nop,TS val 790922 ecr 1010792,mptcp dss ack 1969216846], length 0
20:39:35.156346 IP 112.26.3.8.39915 > 112.26.3.1.37653: Flags [.], ack 77113, win 15969, options [nop,nop,TS val 790922 ecr 1010792,mptcp dss ack 1969216846], length 0
20:39:35.249425 IP 112.26.3.1.37653 > 112.26.3.8.39915: Flags [.], seq 77113:78541, ack 0, win 4017, options [nop,nop,TS val 1010939 ecr 790029,mptcp dss ack 4241485850 seq 1969413910 subseq 77113 len 1428 csum 0xcf59], length 1428
20:39:35.256011 IP 112.26.3.8.39915 > 112.26.3.1.37653: Flags [.], ack 78541, win 16106, options [nop,nop,TS val 791027 ecr 1010939,mptcp dss ack 1969216846], length 0
20:39:35.256324 IP 112.26.3.8.39915 > 112.26.3.1.37653: Flags [.], ack 78541, win 16106, options [nop,nop,TS val 791027 ecr 1010939,mptcp dss ack 1969216846], length 0
20:39:35.308989 IP 112.26.3.8.39915 > 112.26.3.1.37653: Flags [.], ack 78541, win 16106, options [nop,nop,TS val 791027 ecr 1010939,mptcp dss ack 1969216846], length 0
20:39:35.371525 IP 112.26.3.1.37653 > 112.26.3.8.39915: Flags [.], seq 78541:79969, ack 0, win 4017, options [nop,nop,TS val 1011005 ecr 790117,mptcp dss ack 4241485850 seq 1969415338 subseq 78541 len 1428 csum 0x5db], length 1428
20:39:35.372801 IP 112.26.3.8.39915 > 112.26.3.1.37653: Flags [.], ack 79969, win 16243, options [nop,nop,TS val 791149 ecr 1011005,mptcp dss ack 1969216846], length 0
20:39:35.373158 IP 112.26.3.8.39915 > 112.26.3.1.37653: Flags [.], ack 79969, win 16243, options [nop,nop,TS val 791149 ecr 1011005,mptcp dss ack 1969216846], length 0
