20:39:27.395539 IP 112.26.3.8.39915 > 112.26.3.1.37653: Flags [S], seq 1165408037, win 65535, options [mss 1460,sackOK,TS val 783148 ecr 0,nop,wscale 6,mptcp join id 6 token 0xbaf08251 nonce 0xab03f7dc], length 0
20:39:27.395770 IP 112.26.3.8.39915 > 112.26.3.1.37653: Flags [S], seq 1165408037, win 65535, options [mss 1460,sackOK,TS val 783148 ecr 0,nop,wscale 6,mptcp join id 6 token 0xbaf08251 nonce 0xab03f7dc], length 0
20:39:27.456399 IP 112.26.3.1.37653 > 112.26.3.8.39915: Flags [S.], seq 807428570, ack 1165408038, win 65535, options [mss 1460,sackOK,TS val 1003990 ecr 783148,nop,wscale 6,mptcp join id 5 hmac 0x2de910f8d6290959 nonce 0x3e49ab27], length 0
20:39:27.674549 IP 112.26.3.8.39915 > 112.26.3.1.37653: Flags [.], ack 1, win 5840, options [nop,nop,TS val 783328 ecr 1003990,mptcp join hmac 0xc48361edb8e1529744f5291e0cf51b427ee0bafa], length 0
20:39:27.674756 IP 112.26.3.8.39915 > 112.26.3.1.37653: Flags [.], ack 1, win 5840, options [nop,nop,TS val 783328 ecr 1003990,mptcp join hmac 0xc48361edb8e1529744f5291e0cf51b427ee0bafa], length 0
20:39:27.681272 IP 112.26.3.1.37653 > 112.26.3.8.39915: Flags [.], ack 1, win 2678, options [nop,nop,TS val 1004212 ecr 783328,mptcp dss ack 4241485850], length 0
20:39:27.745936 IP 112.26.3.1.37653 > 112.26.3.8.39915: Flags [.], seq 1:1429, ack 1, win 2678, options [nop,nop,TS val 1004213 ecr 783328,mptcp dss ack 4241485850 seq 1969128310 subseq 1 len 1428 csum 0x36ec], length 1428
20:39:27.861198 IP 112.26.3.8.39915 > 112.26.3.1.37653: Flags [.], ack 1429, win 7346, options [nop,nop,TS val 783559 ecr 1004213,mptcp dss ack 1969124026], length 0
20:39:27.861402 IP 112.26.3.8.39915 > 112.26.3.1.37653: Flags [.], ack 1429, win 7346, options [nop,nop,TS val 783559 ecr 1004213,mptcp dss ack 1969124026], length 0
20:39:27.883282 IP 112.26.3.1.37653 > 112.26.3.8.39915: Flags [.], seq 1429:2857, ack 1, win 2678, options [nop,nop,TS val 1004213 ecr 783328,mptcp dss ack 4241485850 seq 1969129738 subseq 1429 len 1428 csum 0xcabe], length 1428
20:39:28.002107 IP 112.26.3.1.37653 > 112.26.3.8.39915: Flags [.], seq 2857:4285, ack 1, win 2678, options [nop,nop,TS val 1004215 ecr 783328,mptcp dss ack 4241485850 seq 1969131166 subseq 2857 len 1428 csum 0x53a1], length 1428
20:39:28.066075 IP 112.26.3.8.39915 > 112.26.3.1.37653: Flags [.], ack 2857, win 7483, options [nop,nop,TS val 783758 ecr 1004213,mptcp dss ack 1969125454], length 0
20:39:28.066281 IP 112.26.3.8.39915 > 112.26.3.1.37653: Flags [.], ack 2857, win 7483, options [nop,nop,TS val 783758 ecr 1004213,mptcp dss ack 1969125454], length 0
20:39:28.085767 IP 112.26.3.1.37653 > 112.26.3.8.39915: Flags [.], seq 4285:5713, ack 1, win 2678, options [nop,nop,TS val 1004215 ecr 783328,mptcp dss ack 4241485850 seq 1969132594 subseq 4285 len 1428 csum 0x7511], length 1428
20:39:28.190667 IP 112.26.3.8.39915 > 112.26.3.1.37653: Flags [.], ack 4285, win 7574, options [nop,nop,TS val 783898 ecr 1004215,mptcp dss ack 1969125454], length 0
20:39:28.190907 IP 112.26.3.8.39915 > 112.26.3.1.37653: Flags [.], ack 4285, win 7574, options [nop,nop,TS val 783898 ecr 1004215,mptcp dss ack 1969125454], length 0
20:39:28.205326 IP 112.26.3.1.37653 > 112.26.3.8.39915: Flags [.], seq 5713:7141, ack 1, win 2678, options [nop,nop,TS val 1004215 ecr 783328,mptcp dss ack 4241485850 seq 1969134022 subseq 5713 len 1428 csum 0x72e], length 1428
20:39:28.287799 IP 112.26.3.8.39915 > 112.26.3.1.37653: Flags [.], ack 5713, win 7757, options [nop,nop,TS val 784054 ecr 1004215,mptcp dss ack 1969126882], length 0
20:39:28.287985 IP 112.26.3.8.39915 > 112.26.3.1.37653: Flags [.], ack 5713, win 7757, options [nop,nop,TS val 784054 ecr 1004215,mptcp dss ack 1969126882], length 0
20:39:28.330091 IP 112.26.3.1.37653 > 112.26.3.8.39915: Flags [.], seq 7141:8569, ack 1, win 2678, options [nop,nop,TS val 1004215 ecr 783328,mptcp dss ack 4241485850 seq 1969135450 subseq 7141 len 1428 csum 0x5536], length 1428
20:39:28.447913 IP 112.26.3.1.37653 > 112.26.3.8.39915: Flags [.], seq 8569:9997, ack 1, win 2678, options [nop,nop,TS val 1004215 ecr 783328,mptcp dss ack 4241485850 seq 1969136878 subseq 8569 len 1428 csum 0x893], length 1428
20:39:28.509817 IP 112.26.3.8.39915 > 112.26.3.1.37653: Flags [.], ack 7141, win 7939, options [nop,nop,TS val 784205 ecr 1004215,mptcp dss ack 1969135450], length 0
20:39:28.509999 IP 112.26.3.8.39915 > 112.26.3.1.37653: Flags [.], ack 7141, win 7939, options [nop,nop,TS val 784205 ecr 1004215,mptcp dss ack 1969135450], length 0
20:39:28.527222 IP 112.26.3.1.37653 > 112.26.3.8.39915: Flags [.], seq 9997:11425, ack 1, win 2678, options [nop,nop,TS val 1004215 ecr 783328,mptcp dss ack 4241485850 seq 1969138306 subseq 9997 len 1428 csum 0x7bf3], length 1428
20:39:28.563634 IP 112.26.3.8.39915 > 112.26.3.1.37653: Flags [.], ack 8569, win 7985, options [nop,nop,TS val 784313 ecr 1004215,mptcp dss ack 1969136878], length 0
20:39:28.563816 IP 112.26.3.8.39915 > 112.26.3.1.37653: Flags [.], ack 8569, win 7985, options [nop,nop,TS val 784313 ecr 1004215,mptcp dss ack 1969136878], length 0
20:39:28.631742 IP 112.26.3.1.37653 > 112.26.3.8.39915: Flags [.], seq 14281:15709, ack 1, win 4017, options [nop,nop,TS val 1004398 ecr 783559,mptcp dss ack 4241485850 seq 1969171150 subseq 14281 len 1428 csum 0xab1c], length 1428
20:39:28.703966 IP 112.26.3.1.37653 > 112.26.3.8.39915: Flags [.], seq 15709:17137, ack 1, win 4017, options [nop,nop,TS val 1004398 ecr 783559,mptcp dss ack 4241485850 seq 1969172578 subseq 15709 len 1428 csum 0x10ce], length 1428
20:39:28.804823 IP 112.26.3.1.37653 > 112.26.3.8.39915: Flags [.], seq 17137:18565, ack 1, win 4017, options [nop,nop,TS val 1004604 ecr 783758,mptcp dss ack 4241485850 seq 1969192570 subseq 17137 len 1428 csum 0x204d], length 1428
20:39:28.815654 IP 112.26.3.8.39915 > 112.26.3.1.37653: Flags [.], ack 9997, win 8213, options [nop,nop,TS val 784540 ecr 1004215,mptcp dss ack 1969138306], length 0
20:39:28.815877 IP 112.26.3.8.39915 > 112.26.3.1.37653: Flags [.], ack 9997, win 8213, options [nop,nop,TS val 784540 ecr 1004215,mptcp dss ack 1969138306], length 0
20:39:28.875883 IP 112.26.3.1.37653 > 112.26.3.8.39915: Flags [.], seq 18565:19993, ack 1, win 4017, options [nop,nop,TS val 1004604 ecr 783758,mptcp dss ack 4241485850 seq 1969193998 subseq 18565 len 1428 csum 0x33f7], length 1428
20:39:28.893154 IP 112.26.3.8.39915 > 112.26.3.1.37653: Flags [.], ack 11425, win 8304, options [nop,nop,TS val 784654 ecr 1004215,mptcp dss ack 1969139734], length 0
20:39:28.893350 IP 112.26.3.8.39915 > 112.26.3.1.37653: Flags [.], ack 11425, win 8304, options [nop,nop,TS val 784654 ecr 1004215,mptcp dss ack 1969139734], length 0
20:39:29.000106 IP 112.26.3.1.37653 > 112.26.3.8.39915: Flags [.], seq 19993:21421, ack 1, win 4017, options [nop,nop,TS val 1004731 ecr 783898,mptcp dss ack 4241485850 seq 1969198282 subseq 19993 len 1428 csum 0x8948], length 1428
20:39:29.035857 IP 112.26.3.8.39915 > 112.26.3.1.37653: Flags [.], ack 11425, win 8532, options [nop,nop,TS val 784809 ecr 1004215,nop,nop,sack 1 {14281:15709},mptcp dss ack 1969139734], length 0
20:39:29.036135 IP 112.26.3.8.39915 > 112.26.3.1.37653: Flags [.], ack 11425, win 8532, options [nop,nop,TS val 784809 ecr 1004215,nop,nop,sack 1 {14281:15709},mptcp dss ack 1969139734], length 0
20:39:29.093729 IP 112.26.3.1.37653 > 112.26.3.8.39915: Flags [.], seq 21421:22849, ack 1, win 4017, options [nop,nop,TS val 1004731 ecr 783898,mptcp dss ack 4241485850 seq 1969199710 subseq 21421 len 1428 csum 0xad1a], length 1428
20:39:29.159295 IP 112.26.3.1.37653 > 112.26.3.8.39915: Flags [.], seq 22849:24277, ack 1, win 4017, options [nop,nop,TS val 1004835 ecr 784054,mptcp dss ack 4241485850 seq 1969205422 subseq 22849 len 1428 csum 0x4c04], length 1428
20:39:29.188500 IP 112.26.3.8.39915 > 112.26.3.1.37653: Flags [.], ack 11425, win 8715, options [nop,nop,TS val 784963 ecr 1004215,nop,nop,sack 1 {14281:17137},mptcp dss ack 1969139734], length 0
20:39:29.188715 IP 112.26.3.8.39915 > 112.26.3.1.37653: Flags [.], ack 11425, win 8715, options [nop,nop,TS val 784963 ecr 1004215,nop,nop,sack 1 {14281:17137},mptcp dss ack 1969139734], length 0
20:39:29.227038 IP 112.26.3.1.37653 > 112.26.3.8.39915: Flags [.], seq 24277:25705, ack 1, win 4017, options [nop,nop,TS val 1004835 ecr 784054,mptcp dss ack 4241485850 seq 1969206850 subseq 24277 len 1428 csum 0x1025], length 1428
20:39:29.313450 IP 112.26.3.1.37653 > 112.26.3.8.39915: Flags [.], seq 25705:27133, ack 1, win 4017, options [nop,nop,TS val 1005070 ecr 784205,mptcp dss ack 4241485850 seq 1969219702 subseq 25705 len 1428 csum 0x19f5], length 1428
20:39:29.328246 IP 112.26.3.8.39915 > 112.26.3.1.37653: Flags [.], ack 11425, win 8852, options [nop,nop,TS val 785091 ecr 1004215,nop,nop,sack 1 {14281:18565},mptcp dss ack 1969139734], length 0
20:39:29.328525 IP 112.26.3.8.39915 > 112.26.3.1.37653: Flags [.], ack 11425, win 8852, options [nop,nop,TS val 785091 ecr 1004215,nop,nop,sack 1 {14281:18565},mptcp dss ack 1969139734], length 0
20:39:29.452901 IP 112.26.3.1.37653 > 112.26.3.8.39915: Flags [.], seq 27133:28561, ack 1, win 4017, options [nop,nop,TS val 1005070 ecr 784205,mptcp dss ack 4241485850 seq 1969221130 subseq 27133 len 1428 csum 0x199d], length 1428
20:39:29.538879 IP 112.26.3.1.37653 > 112.26.3.8.39915: Flags [.], seq 28561:29989, ack 1, win 4017, options [nop,nop,TS val 1005142 ecr 784313,mptcp dss ack 4241485850 seq 1969222558 subseq 28561 len 1428 csum 0xa293], length 1428
20:39:29.547657 IP 112.26.3.8.39915 > 112.26.3.1.37653: Flags [.], ack 11425, win 9034, options [nop,nop,TS val 785218 ecr 1004215,nop,nop,sack 1 {14281:19993},mptcp dss ack 1969139734], length 0
20:39:29.547931 IP 112.26.3.8.39915 > 112.26.3.1.37653: Flags [.], ack 11425, win 9034, options [nop,nop,TS val 785218 ecr 1004215,nop,nop,sack 1 {14281:19993},mptcp dss ack 1969139734], length 0
20:39:29.619103 IP 112.26.3.1.37653 > 112.26.3.8.39915: Flags [.], seq 31417:32845, ack 1, win 4017, options [nop,nop,TS val 1005354 ecr 784540,mptcp dss ack 4241485850 seq 1969233982 subseq 31417 len 1428 csum 0x866d], length 1428
20:39:29.650198 IP 112.26.3.8.39915 > 112.26.3.1.37653: Flags [.], ack 11425, win 9217, options [nop,nop,TS val 785373 ecr 1004215,nop,nop,sack 1 {14281:21421},mptcp dss ack 1969139734], length 0
20:39:29.650385 IP 112.26.3.8.39915 > 112.26.3.1.37653: Flags [.], ack 11425, win 9217, options [nop,nop,TS val 785373 ecr 1004215,nop,nop,sack 1 {14281:21421},mptcp dss ack 1969139734], length 0
20:39:29.727213 IP 112.26.3.1.37653 > 112.26.3.8.39915: Flags [.], seq 32845:34273, ack 1, win 4017, options [nop,nop,TS val 1005354 ecr 784540,mptcp dss ack 4241485850 seq 1969235410 subseq 32845 len 1428 csum 0xae7a], length 1428
20:39:29.792253 IP 112.26.3.8.39915 > 112.26.3.1.37653: Flags [.], ack 11425, win 9445, options [nop,nop,TS val 785562 ecr 1004215,nop,nop,sack 1 {14281:22849},mptcp dss ack 1969139734], length 0
20:39:29.792421 IP 112.26.3.8.39915 > 112.26.3.1.37653: Flags [.], ack 11425, win 9445, options [nop,nop,TS val 785562 ecr 1004215,nop,nop,sack 1 {14281:22849},mptcp dss ack 1969139734], length 0
20:39:29.859978 IP 112.26.3.1.37653 > 112.26.3.8.39915: Flags [.], seq 34273:35701, ack 1, win 4017, options [nop,nop,TS val 1005442 ecr 784654,mptcp dss ack 4241485850 seq 1969239694 subseq 34273 len 1428 csum 0xfc90], length 1428
20:39:29.963655 IP 112.26.3.1.37653 > 112.26.3.8.39915: Flags [.], seq 37129:38557, ack 1, win 4017, options [nop,nop,TS val 1005609 ecr 784809,mptcp dss ack 4241485850 seq 1969246834 subseq 37129 len 1428 csum 0xd3be], length 1428
20:39:30.026367 IP 112.26.3.8.39915 > 112.26.3.1.37653: Flags [.], ack 11425, win 9764, options [nop,nop,TS val 785796 ecr 1004215,nop,nop,sack 1 {14281:24277},mptcp dss ack 1969139734], length 0
20:39:30.026578 IP 112.26.3.8.39915 > 112.26.3.1.37653: Flags [.], ack 11425, win 9764, options [nop,nop,TS val 785796 ecr 1004215,nop,nop,sack 1 {14281:24277},mptcp dss ack 1969139734], length 0
20:39:30.045932 IP 112.26.3.1.37653 > 112.26.3.8.39915: Flags [.], seq 11425:12853, ack 1, win 4017, options [nop,nop,TS val 1005737 ecr 784963,mptcp dss ack 4241485850 seq 1969139734 subseq 11425 len 1428 csum 0x896d], length 1428
20:39:30.141853 IP 112.26.3.1.37653 > 112.26.3.8.39915: Flags [.], seq 12853:14281, ack 1, win 4017, options [nop,nop,TS val 1005878 ecr 785091,mptcp dss ack 4241485850 seq 1969141162 subseq 12853 len 1428 csum 0x8110], length 1428
20:39:30.154048 IP 112.26.3.8.39915 > 112.26.3.1.37653: Flags [.], ack 11425, win 9855, options [nop,nop,TS val 785928 ecr 1004215,nop,nop,sack 1 {14281:25705},mptcp dss ack 1969139734], length 0
20:39:30.154261 IP 112.26.3.8.39915 > 112.26.3.1.37653: Flags [.], ack 11425, win 9855, options [nop,nop,TS val 785928 ecr 1004215,nop,nop,sack 1 {14281:25705},mptcp dss ack 1969139734], length 0
20:39:30.213373 IP 112.26.3.1.37653 > 112.26.3.8.39915: Flags [.], seq 38557:39985, ack 1, win 4017, options [nop,nop,TS val 1006334 ecr 785373,mptcp dss ack 4241485850 seq 1969253974 subseq 38557 len 1428 csum 0xa436], length 1428
20:39:30.289150 IP 112.26.3.8.39915 > 112.26.3.1.37653: Flags [.], ack 11425, win 10038, options [nop,nop,TS val 786063 ecr 1004215,nop,nop,sack 1 {14281:27133},mptcp dss ack 1969139734], length 0
20:39:30.289382 IP 112.26.3.8.39915 > 112.26.3.1.37653: Flags [.], ack 11425, win 10038, options [nop,nop,TS val 786063 ecr 1004215,nop,nop,sack 1 {14281:27133},mptcp dss ack 1969139734], length 0
20:39:30.326367 IP 112.26.3.1.37653 > 112.26.3.8.39915: Flags [.], seq 39985:41413, ack 1, win 4017, options [nop,nop,TS val 1006411 ecr 785562,mptcp dss ack 4241485850 seq 1969255402 subseq 39985 len 1428 csum 0xc852], length 1428
20:39:30.434333 IP 112.26.3.8.39915 > 112.26.3.1.37653: Flags [.], ack 11425, win 10220, options [nop,nop,TS val 786200 ecr 1004215,nop,nop,sack 1 {14281:28561},mptcp dss ack 1969139734], length 0
20:39:30.434498 IP 112.26.3.8.39915 > 112.26.3.1.37653: Flags [.], ack 11425, win 10220, options [nop,nop,TS val 786200 ecr 1004215,nop,nop,sack 1 {14281:28561},mptcp dss ack 1969139734], length 0
20:39:30.445737 IP 112.26.3.1.37653 > 112.26.3.8.39915: Flags [.], seq 41413:42841, ack 1, win 4017, options [nop,nop,TS val 1006740 ecr 785928,mptcp dss ack 4241485850 seq 1969271110 subseq 41413 len 1428 csum 0x3a69], length 1428
20:39:30.563838 IP 112.26.3.1.37653 > 112.26.3.8.39915: Flags [.], seq 42841:44269, ack 1, win 4017, options [nop,nop,TS val 1006869 ecr 786063,mptcp dss ack 4241485850 seq 1969275394 subseq 42841 len 1428 csum 0xa54], length 1428
20:39:30.565891 IP 112.26.3.8.39915 > 112.26.3.1.37653: Flags [.], ack 11425, win 10357, options [nop,nop,TS val 786339 ecr 1004215,nop,nop,sack 1 {14281:29989},mptcp dss ack 1969139734], length 0
20:39:30.566110 IP 112.26.3.8.39915 > 112.26.3.1.37653: Flags [.], ack 11425, win 10357, options [nop,nop,TS val 786339 ecr 1004215,nop,nop,sack 1 {14281:29989},mptcp dss ack 1969139734], length 0
20:39:30.693023 IP 112.26.3.8.39915 > 112.26.3.1.37653: Flags [.], ack 11425, win 10585, options [nop,nop,TS val 786467 ecr 1004215,nop,nop,sack 2 {31417:32845}{14281:29989},mptcp dss ack 1969139734], length 0
20:39:30.693229 IP 112.26.3.8.39915 > 112.26.3.1.37653: Flags [.], ack 11425, win 10585, options [nop,nop,TS val 786467 ecr 1004215,nop,nop,sack 2 {31417:32845}{14281:29989},mptcp dss ack 1969139734], length 0
20:39:30.710141 IP 112.26.3.1.37653 > 112.26.3.8.39915: Flags [.], seq 29989:31417, ack 1, win 4017, options [nop,nop,TS val 1007231 ecr 786467,mptcp dss ack 4241485850 seq 1969223986 subseq 29989 len 1428 csum 0x3e57], length 1428
20:39:30.898332 IP 112.26.3.8.39915 > 112.26.3.1.37653: Flags [.], ack 11425, win 10677, options [nop,nop,TS val 786587 ecr 1004215,nop,nop,sack 2 {31417:34273}{14281:29989},mptcp dss ack 1969139734], length 0
20:39:30.898528 IP 112.26.3.8.39915 > 112.26.3.1.37653: Flags [.], ack 11425, win 10677, options [nop,nop,TS val 786587 ecr 1004215,nop,nop,sack 2 {31417:34273}{14281:29989},mptcp dss ack 1969139734], length 0
20:39:30.963539 IP 112.26.3.1.37653 > 112.26.3.8.39915: Flags [.], seq 44269:45697, ack 1, win 4017, options [nop,nop,TS val 1007496 ecr 786587,mptcp dss ack 4241485850 seq 1969299670 subseq 44269 len 1428 csum 0xcdf9], length 1428
20:39:30.985336 IP 112.26.3.8.39915 > 112.26.3.1.37653: Flags [.], ack 11425, win 10814, options [nop,nop,TS val 786692 ecr 1004215,nop,nop,sack 2 {31417:35701}{14281:29989},mptcp dss ack 1969139734], length 0
20:39:30.985517 IP 112.26.3.8.39915 > 112.26.3.1.37653: Flags [.], ack 11425, win 10814, options [nop,nop,TS val 786692 ecr 1004215,nop,nop,sack 2 {31417:35701}{14281:29989},mptcp dss ack 1969139734], length 0
20:39:31.062361 IP 112.26.3.8.39915 > 112.26.3.1.37653: Flags [.], ack 11425, win 10950, options [nop,nop,TS val 786808 ecr 1004215,nop,nop,sack 2 {37129:38557}{31417:35701},mptcp dss ack 1969139734], length 0
20:39:31.062625 IP 112.26.3.8.39915 > 112.26.3.1.37653: Flags [.], ack 11425, win 10950, options [nop,nop,TS val 786808 ecr 1004215,nop,nop,sack 2 {37129:38557}{31417:35701},mptcp dss ack 1969139734], length 0
20:39:31.117364 IP 112.26.3.1.37653 > 112.26.3.8.39915: Flags [.], seq 45697:47125, ack 1, win 4017, options [nop,nop,TS val 1007529 ecr 786692,mptcp dss ack 4241485850 seq 1969301098 subseq 45697 len 1428 csum 0x7324], length 1428
20:39:31.167107 IP 112.26.3.8.39915 > 112.26.3.1.37653: Flags [.], ack 12853, win 11133, options [nop,nop,TS val 786941 ecr 1005737,nop,nop,sack 2 {37129:38557}{31417:35701},mptcp dss ack 1969141162], length 0
20:39:31.167306 IP 112.26.3.8.39915 > 112.26.3.1.37653: Flags [.], ack 12853, win 11133, options [nop,nop,TS val 786941 ecr 1005737,nop,nop,sack 2 {37129:38557}{31417:35701},mptcp dss ack 1969141162], length 0
20:39:31.200997 IP 112.26.3.1.37653 > 112.26.3.8.39915: Flags [.], seq 35701:37129, ack 1, win 4017, options [nop,nop,TS val 1007619 ecr 786808,mptcp dss ack 4241485850 seq 1969241122 subseq 35701 len 1428 csum 0xfc92], length 1428
20:39:31.285047 IP 112.26.3.8.39915 > 112.26.3.1.37653: Flags [.], ack 12853, win 11224, options [nop,nop,TS val 787041 ecr 1005737,nop,nop,sack 2 {37129:39985}{31417:35701},mptcp dss ack 1969141162], length 0
20:39:31.285285 IP 112.26.3.8.39915 > 112.26.3.1.37653: Flags [.], ack 12853, win 11224, options [nop,nop,TS val 787041 ecr 1005737,nop,nop,sack 2 {37129:39985}{31417:35701},mptcp dss ack 1969141162], length 0
20:39:31.316807 IP 112.26.3.1.37653 > 112.26.3.8.39915: Flags [.], seq 47125:48553, ack 1, win 4017, options [nop,nop,TS val 1007751 ecr 786941,mptcp dss ack 4241485850 seq 1969308238 subseq 47125 len 1428 csum 0x6ade], length 1428
20:39:31.375071 IP 112.26.3.8.39915 > 112.26.3.1.37653: Flags [.], ack 12853, win 11315, options [nop,nop,TS val 787132 ecr 1005737,nop,nop,sack 2 {37129:41413}{31417:35701},mptcp dss ack 1969141162], length 0
20:39:31.375271 IP 112.26.3.8.39915 > 112.26.3.1.37653: Flags [.], ack 12853, win 11315, options [nop,nop,TS val 787132 ecr 1005737,nop,nop,sack 2 {37129:41413}{31417:35701},mptcp dss ack 1969141162], length 0
20:39:31.432467 IP 112.26.3.1.37653 > 112.26.3.8.39915: Flags [.], seq 48553:49981, ack 1, win 4017, options [nop,nop,TS val 1007751 ecr 786941,mptcp dss ack 4241485850 seq 1969309666 subseq 48553 len 1428 csum 0xa0b9], length 1428
20:39:31.516916 IP 112.26.3.8.39915 > 112.26.3.1.37653: Flags [.], ack 12853, win 11544, options [nop,nop,TS val 787289 ecr 1005737,nop,nop,sack 2 {42841:44269}{37129:41413},mptcp dss ack 1969141162], length 0
20:39:31.517122 IP 112.26.3.8.39915 > 112.26.3.1.37653: Flags [.], ack 12853, win 11544, options [nop,nop,TS val 787289 ecr 1005737,nop,nop,sack 2 {42841:44269}{37129:41413},mptcp dss ack 1969141162], length 0
20:39:31.554056 IP 112.26.3.1.37653 > 112.26.3.8.39915: Flags [.], seq 49981:51409, ack 1, win 4017, options [nop,nop,TS val 1007751 ecr 786941,mptcp dss ack 4241485850 seq 1969311094 subseq 49981 len 1428 csum 0xdc11], length 1428
20:39:31.637912 IP 112.26.3.8.39915 > 112.26.3.1.37653: Flags [.], ack 12853, win 11726, options [nop,nop,TS val 787407 ecr 1005737,nop,nop,sack 2 {14281:35701}{42841:44269},mptcp dss ack 1969141162], length 0
20:39:31.638124 IP 112.26.3.8.39915 > 112.26.3.1.37653: Flags [.], ack 12853, win 11726, options [nop,nop,TS val 787407 ecr 1005737,nop,nop,sack 2 {14281:35701}{42841:44269},mptcp dss ack 1969141162], length 0
20:39:31.690819 IP 112.26.3.1.37653 > 112.26.3.8.39915: Flags [.], seq 12853:14281, ack 1, win 4017, options [nop,nop,TS val 1007836 ecr 787041,mptcp dss ack 4241485850 seq 1969141162 subseq 12853 len 1428 csum 0x8110], length 1428
20:39:31.749940 IP 112.26.3.1.37653 > 112.26.3.8.39915: Flags [.], seq 44269:45697, ack 1, win 4017, options [nop,nop,TS val 1007496 ecr 786587,mptcp dss ack 4241485850 seq 1969299670 subseq 44269 len 1428 csum 0xcdf9], length 1428
20:39:31.786839 IP 112.26.3.1.37653 > 112.26.3.8.39915: Flags [.], seq 51409:52837, ack 1, win 4017, options [nop,nop,TS val 1007919 ecr 787132,mptcp dss ack 4241485850 seq 1969315378 subseq 51409 len 1428 csum 0x442b], length 1428
20:39:31.816390 IP 112.26.3.1.37653 > 112.26.3.8.39915: Flags [.], seq 44269:45697, ack 1, win 4017, options [nop,nop,TS val 1007496 ecr 786587,mptcp dss ack 4241485850 seq 1969299670 subseq 44269 len 1428 csum 0xcdf9], length 1428
20:39:31.865905 IP 112.26.3.1.37653 > 112.26.3.8.39915: Flags [.], seq 41413:42841, ack 1, win 4017, options [nop,nop,TS val 1008056 ecr 787289,mptcp dss ack 4241485850 seq 1969271110 subseq 41413 len 1428 csum 0x3a69], length 1428
20:39:31.871713 IP 112.26.3.8.39915 > 112.26.3.1.37653: Flags [.], ack 12853, win 11863, options [nop,nop,TS val 787587 ecr 1005737,nop,nop,sack 2 {42841:45697}{14281:35701},mptcp dss ack 1969141162], length 0
20:39:31.871966 IP 112.26.3.8.39915 > 112.26.3.1.37653: Flags [.], ack 12853, win 11863, options [nop,nop,TS val 787587 ecr 1005737,nop,nop,sack 2 {42841:45697}{14281:35701},mptcp dss ack 1969141162], length 0
20:39:31.906843 IP 112.26.3.1.37653 > 112.26.3.8.39915: Flags [.], seq 45697:47125, ack 1, win 4017, options [nop,nop,TS val 1007529 ecr 786692,mptcp dss ack 4241485850 seq 1969301098 subseq 45697 len 1428 csum 0x7324], length 1428
20:39:31.984869 IP 112.26.3.1.37653 > 112.26.3.8.39915: Flags [.], seq 45697:47125, ack 1, win 4017, options [nop,nop,TS val 1007529 ecr 786692,mptcp dss ack 4241485850 seq 1969301098 subseq 45697 len 1428 csum 0x7324], length 1428
20:39:31.989999 IP 112.26.3.1.37653 > 112.26.3.8.39915: Flags [.], seq 52837:54265, ack 1, win 4017, options [nop,nop,TS val 1008224 ecr 787407,mptcp dss ack 4241485850 seq 1969321090 subseq 52837 len 1428 csum 0xe444], length 1428
20:39:32.042212 IP 112.26.3.1.37653 > 112.26.3.8.39915: Flags [.], seq 35701:37129, ack 1, win 4017, options [nop,nop,TS val 1007619 ecr 786808,mptcp dss ack 4241485850 seq 1969241122 subseq 35701 len 1428 csum 0xfc92], length 1428
20:39:32.092128 IP 112.26.3.1.37653 > 112.26.3.8.39915: Flags [.], seq 54265:55693, ack 1, win 4017, options [nop,nop,TS val 1008451 ecr 787587,mptcp dss ack 4241485850 seq 1969325374 subseq 54265 len 1428 csum 0xee4c], length 1428
20:39:32.111883 IP 112.26.3.8.39915 > 112.26.3.1.37653: Flags [.], ack 12853, win 12045, options [nop,nop,TS val 787762 ecr 1005737,nop,nop,sack 2 {42841:47125}{14281:35701},mptcp dss ack 1969141162], length 0
20:39:32.112041 IP 112.26.3.8.39915 > 112.26.3.1.37653: Flags [.], ack 12853, win 12045, options [nop,nop,TS val 787762 ecr 1005737,nop,nop,sack 2 {42841:47125}{14281:35701},mptcp dss ack 1969141162], length 0
20:39:32.186518 IP 112.26.3.8.39915 > 112.26.3.1.37653: Flags [.], ack 12853, win 12137, options [nop,nop,TS val 787819 ecr 1005737,nop,nop,sack 2 {14281:41413}{42841:47125},mptcp dss ack 1969141162], length 0
20:39:32.186726 IP 112.26.3.8.39915 > 112.26.3.1.37653: Flags [.], ack 12853, win 12137, options [nop,nop,TS val 787819 ecr 1005737,nop,nop,sack 2 {14281:41413}{42841:47125},mptcp dss ack 1969141162], length 0
20:39:32.205790 IP 112.26.3.1.37653 > 112.26.3.8.39915: Flags [.], seq 47125:48553, ack 1, win 4017, options [nop,nop,TS val 1007751 ecr 786941,mptcp dss ack 4241485850 seq 1969308238 subseq 47125 len 1428 csum 0x6ade], length 1428
20:39:32.281131 IP 112.26.3.1.37653 > 112.26.3.8.39915: Flags [.], seq 55693:57121, ack 1, win 4017, options [nop,nop,TS val 1008691 ecr 787762,mptcp dss ack 4241485850 seq 1969331086 subseq 55693 len 1428 csum 0xb3f5], length 1428
20:39:32.289891 IP 112.26.3.8.39915 > 112.26.3.1.37653: Flags [.], ack 12853, win 12319, options [nop,nop,TS val 787983 ecr 1005737,nop,nop,sack 2 {42841:48553}{14281:41413},mptcp dss ack 1969141162], length 0
20:39:32.290180 IP 112.26.3.8.39915 > 112.26.3.1.37653: Flags [.], ack 12853, win 12319, options [nop,nop,TS val 787983 ecr 1005737,nop,nop,sack 2 {42841:48553}{14281:41413},mptcp dss ack 1969141162], length 0
20:39:32.342445 IP 112.26.3.1.37653 > 112.26.3.8.39915: Flags [.], seq 48553:49981, ack 1, win 4017, options [nop,nop,TS val 1007751 ecr 786941,mptcp dss ack 4241485850 seq 1969309666 subseq 48553 len 1428 csum 0xa0b9], length 1428
20:39:32.372189 IP 112.26.3.1.37653 > 112.26.3.8.39915: Flags [.], seq 57121:58549, ack 1, win 4017, options [nop,nop,TS val 1008765 ecr 787819,mptcp dss ack 4241485850 seq 1969333942 subseq 57121 len 1428 csum 0x976], length 1428
20:39:32.391943 IP 112.26.3.8.39915 > 112.26.3.1.37653: Flags [.], ack 12853, win 12502, options [nop,nop,TS val 788119 ecr 1005737,nop,nop,sack 2 {42841:49981}{14281:41413},mptcp dss ack 1969141162], length 0
20:39:32.392121 IP 112.26.3.8.39915 > 112.26.3.1.37653: Flags [.], ack 12853, win 12502, options [nop,nop,TS val 788119 ecr 1005737,nop,nop,sack 2 {42841:49981}{14281:41413},mptcp dss ack 1969141162], length 0
20:39:32.435148 IP 112.26.3.1.37653 > 112.26.3.8.39915: Flags [.], seq 58549:59977, ack 1, win 4017, options [nop,nop,TS val 1008873 ecr 787983,mptcp dss ack 4241485850 seq 1969335370 subseq 58549 len 1428 csum 0x7ac1], length 1428
20:39:32.463022 IP 112.26.3.1.37653 > 112.26.3.8.39915: Flags [.], seq 49981:51409, ack 1, win 4017, options [nop,nop,TS val 1007751 ecr 786941,mptcp dss ack 4241485850 seq 1969311094 subseq 49981 len 1428 csum 0xdc11], length 1428
20:39:32.492527 IP 112.26.3.8.39915 > 112.26.3.1.37653: Flags [.], ack 12853, win 12684, options [nop,nop,TS val 788235 ecr 1005737,nop,nop,sack 2 {42841:51409}{14281:41413},mptcp dss ack 1969141162], length 0
20:39:32.492727 IP 112.26.3.8.39915 > 112.26.3.1.37653: Flags [.], ack 12853, win 12684, options [nop,nop,TS val 788235 ecr 1005737,nop,nop,sack 2 {42841:51409}{14281:41413},mptcp dss ack 1969141162], length 0
20:39:32.557587 IP 112.26.3.1.37653 > 112.26.3.8.39915: Flags [.], seq 59977:61405, ack 1, win 4017, options [nop,nop,TS val 1009013 ecr 788119,mptcp dss ack 4241485850 seq 1969343938 subseq 59977 len 1428 csum 0x82f], length 1428
20:39:32.576176 IP 112.26.3.1.37653 > 112.26.3.8.39915: Flags [.], seq 12853:14281, ack 1, win 4017, options [nop,nop,TS val 1007836 ecr 787041,mptcp dss ack 4241485850 seq 1969141162 subseq 12853 len 1428 csum 0x8110], length 1428
20:39:32.621423 IP 112.26.3.8.39915 > 112.26.3.1.37653: Flags [.], ack 41413, win 12821, options [nop,nop,TS val 788353 ecr 1007836,nop,nop,sack 1 {42841:51409},mptcp dss ack 1969216846], length 0
20:39:32.621644 IP 112.26.3.8.39915 > 112.26.3.1.37653: Flags [.], ack 41413, win 12821, options [nop,nop,TS val 788353 ecr 1007836,nop,nop,sack 1 {42841:51409},mptcp dss ack 1969216846], length 0
20:39:32.767862 IP 112.26.3.1.37653 > 112.26.3.8.39915: Flags [.], seq 51409:52837, ack 1, win 4017, options [nop,nop,TS val 1007919 ecr 787132,mptcp dss ack 4241485850 seq 1969315378 subseq 51409 len 1428 csum 0x442b], length 1428
20:39:32.795905 IP 112.26.3.1.37653 > 112.26.3.8.39915: Flags [.], seq 61405:62833, ack 1, win 4017, options [nop,nop,TS val 1009323 ecr 788235,mptcp dss ack 4241485850 seq 1969352506 subseq 61405 len 1428 csum 0xed1e], length 1428
20:39:32.798319 IP 112.26.3.8.39915 > 112.26.3.1.37653: Flags [.], ack 41413, win 13049, options [nop,nop,TS val 788545 ecr 1007836,nop,nop,sack 1 {42841:52837},mptcp dss ack 1969216846], length 0
20:39:32.798536 IP 112.26.3.8.39915 > 112.26.3.1.37653: Flags [.], ack 41413, win 13049, options [nop,nop,TS val 788545 ecr 1007836,nop,nop,sack 1 {42841:52837},mptcp dss ack 1969216846], length 0
20:39:32.909555 IP 112.26.3.1.37653 > 112.26.3.8.39915: Flags [.], seq 62833:64261, ack 1, win 4017, options [nop,nop,TS val 1009323 ecr 788353,mptcp dss ack 4241485850 seq 1969353934 subseq 62833 len 1428 csum 0x74d6], length 1428
20:39:32.993373 IP 112.26.3.1.37653 > 112.26.3.8.39915: Flags [.], seq 64261:65689, ack 1, win 4017, options [nop,nop,TS val 1009484 ecr 788545,mptcp dss ack 4241485850 seq 1969361074 subseq 64261 len 1428 csum 0xc4a4], length 1428
20:39:33.012751 IP 112.26.3.1.37653 > 112.26.3.8.39915: Flags [.], seq 41413:42841, ack 1, win 4017, options [nop,nop,TS val 1008056 ecr 787289,mptcp dss ack 4241485850 seq 1969271110 subseq 41413 len 1428 csum 0x3a69], length 1428
20:39:33.019538 IP 112.26.3.8.39915 > 112.26.3.1.37653: Flags [.], ack 52837, win 13232, options [nop,nop,TS val 788790 ecr 1008056,mptcp dss ack 1969216846], length 0
20:39:33.019692 IP 112.26.3.8.39915 > 112.26.3.1.37653: Flags [.], ack 52837, win 13232, options [nop,nop,TS val 788790 ecr 1008056,mptcp dss ack 1969216846], length 0
20:39:33.130600 IP 112.26.3.1.37653 > 112.26.3.8.39915: Flags [.], seq 54265:55693, ack 1, win 4017, options [nop,nop,TS val 1008451 ecr 787587,mptcp dss ack 4241485850 seq 1969325374 subseq 54265 len 1428 csum 0xee4c], length 1428
20:39:33.134900 IP 112.26.3.8.39915 > 112.26.3.1.37653: Flags [.], ack 52837, win 13369, options [nop,nop,TS val 788908 ecr 1008056,nop,nop,sack 1 {54265:55693},mptcp dss ack 1969216846], length 0
20:39:33.135162 IP 112.26.3.8.39915 > 112.26.3.1.37653: Flags [.], ack 52837, win 13369, options [nop,nop,TS val 788908 ecr 1008056,nop,nop,sack 1 {54265:55693},mptcp dss ack 1969216846], length 0
20:39:33.242226 IP 112.26.3.1.37653 > 112.26.3.8.39915: Flags [.], seq 52837:54265, ack 1, win 4017, options [nop,nop,TS val 1009770 ecr 788908,mptcp dss ack 4241485850 seq 1969321090 subseq 52837 len 1428 csum 0xe444], length 1428
20:39:33.260758 IP 112.26.3.1.37653 > 112.26.3.8.39915: Flags [.], seq 55693:57121, ack 1, win 4017, options [nop,nop,TS val 1008691 ecr 787762,mptcp dss ack 4241485850 seq 1969331086 subseq 55693 len 1428 csum 0xb3f5], length 1428
20:39:33.269936 IP 112.26.3.8.39915 > 112.26.3.1.37653: Flags [.], ack 52837, win 13460, options [nop,nop,TS val 789038 ecr 1008056,nop,nop,sack 1 {54265:57121},mptcp dss ack 1969216846], length 0
20:39:33.270084 IP 112.26.3.8.39915 > 112.26.3.1.37653: Flags [.], ack 52837, win 13460, options [nop,nop,TS val 789038 ecr 1008056,nop,nop,sack 1 {54265:57121},mptcp dss ack 1969216846], length 0
20:39:33.382492 IP 112.26.3.1.37653 > 112.26.3.8.39915: Flags [.], seq 65689:67117, ack 1, win 4017, options [nop,nop,TS val 1009915 ecr 789038,mptcp dss ack 4241485850 seq 1969375354 subseq 65689 len 1428 csum 0xd4b5], length 1428
20:39:33.410283 IP 112.26.3.1.37653 > 112.26.3.8.39915: Flags [.], seq 57121:58549, ack 1, win 4017, options [nop,nop,TS val 1008765 ecr 787819,mptcp dss ack 4241485850 seq 1969333942 subseq 57121 len 1428 csum 0x976], length 1428
20:39:33.484155 IP 112.26.3.1.37653 > 112.26.3.8.39915: Flags [.], seq 58549:59977, ack 1, win 4017, options [nop,nop,TS val 1008873 ecr 787983,mptcp dss ack 4241485850 seq 1969335370 subseq 58549 len 1428 csum 0x7ac1], length 1428
20:39:33.578227 IP 112.26.3.1.37653 > 112.26.3.8.39915: Flags [.], seq 59977:61405, ack 1, win 4017, options [nop,nop,TS val 1009013 ecr 788119,mptcp dss ack 4241485850 seq 1969343938 subseq 59977 len 1428 csum 0x82f], length 1428
20:39:33.584779 IP 112.26.3.8.39915 > 112.26.3.1.37653: Flags [.], ack 52837, win 13642, options [nop,nop,TS val 789176 ecr 1008056,nop,nop,sack 1 {54265:58549},mptcp dss ack 1969216846], length 0
20:39:33.584992 IP 112.26.3.8.39915 > 112.26.3.1.37653: Flags [.], ack 52837, win 13642, options [nop,nop,TS val 789176 ecr 1008056,nop,nop,sack 1 {54265:58549},mptcp dss ack 1969216846], length 0
20:39:33.686238 IP 112.26.3.8.39915 > 112.26.3.1.37653: Flags [.], ack 52837, win 13779, options [nop,nop,TS val 789261 ecr 1008056,nop,nop,sack 1 {54265:59977},mptcp dss ack 1969216846], length 0
20:39:33.686498 IP 112.26.3.8.39915 > 112.26.3.1.37653: Flags [.], ack 52837, win 13779, options [nop,nop,TS val 789261 ecr 1008056,nop,nop,sack 1 {54265:59977},mptcp dss ack 1969216846], length 0
20:39:33.713337 IP 112.26.3.1.37653 > 112.26.3.8.39915: Flags [.], seq 61405:62833, ack 1, win 4017, options [nop,nop,TS val 1009323 ecr 788235,mptcp dss ack 4241485850 seq 1969352506 subseq 61405 len 1428 csum 0xed1e], length 1428
20:39:33.784447 IP 112.26.3.1.37653 > 112.26.3.8.39915: Flags [.], seq 67117:68545, ack 1, win 4017, options [nop,nop,TS val 1010224 ecr 789176,mptcp dss ack 4241485850 seq 1969383922 subseq 67117 len 1428 csum 0x8ed7], length 1428
20:39:33.817014 IP 112.26.3.8.39915 > 112.26.3.1.37653: Flags [.], ack 52837, win 13870, options [nop,nop,TS val 789355 ecr 1008056,nop,nop,sack 1 {54265:61405},mptcp dss ack 1969216846], length 0
20:39:33.817286 IP 112.26.3.8.39915 > 112.26.3.1.37653: Flags [.], ack 52837, win 13870, options [nop,nop,TS val 789355 ecr 1008056,nop,nop,sack 1 {54265:61405},mptcp dss ack 1969216846], length 0
20:39:33.850970 IP 112.26.3.1.37653 > 112.26.3.8.39915: Flags [.], seq 62833:64261, ack 1, win 4017, options [nop,nop,TS val 1009323 ecr 788353,mptcp dss ack 4241485850 seq 1969353934 subseq 62833 len 1428 csum 0x74d6], length 1428
20:39:33.862384 IP 112.26.3.1.37653 > 112.26.3.8.39915: Flags [.], seq 68545:69973, ack 1, win 4017, options [nop,nop,TS val 1010247 ecr 789261,mptcp dss ack 4241485850 seq 1969385350 subseq 68545 len 1428 csum 0xc72b], length 1428
20:39:33.929901 IP 112.26.3.8.39915 > 112.26.3.1.37653: Flags [.], ack 52837, win 14053, options [nop,nop,TS val 789484 ecr 1008056,nop,nop,sack 1 {54265:62833},mptcp dss ack 1969216846], length 0
20:39:33.930119 IP 112.26.3.8.39915 > 112.26.3.1.37653: Flags [.], ack 52837, win 14053, options [nop,nop,TS val 789484 ecr 1008056,nop,nop,sack 1 {54265:62833},mptcp dss ack 1969216846], length 0
20:39:33.973822 IP 112.26.3.1.37653 > 112.26.3.8.39915: Flags [.], seq 64261:65689, ack 1, win 4017, options [nop,nop,TS val 1009484 ecr 788545,mptcp dss ack 4241485850 seq 1969361074 subseq 64261 len 1428 csum 0xc4a4], length 1428
20:39:34.004538 IP 112.26.3.1.37653 > 112.26.3.8.39915: Flags [.], seq 69973:71401, ack 1, win 4017, options [nop,nop,TS val 1010416 ecr 789355,mptcp dss ack 4241485850 seq 1969392490 subseq 69973 len 1428 csum 0xf69b], length 1428
20:39:34.028421 IP 112.26.3.8.39915 > 112.26.3.1.37653: Flags [.], ack 52837, win 14190, options [nop,nop,TS val 789613 ecr 1008056,nop,nop,sack 1 {54265:64261},mptcp dss ack 1969216846], length 0
20:39:34.028627 IP 112.26.3.8.39915 > 112.26.3.1.37653: Flags [.], ack 52837, win 14190, options [nop,nop,TS val 789613 ecr 1008056,nop,nop,sack 1 {54265:64261},mptcp dss ack 1969216846], length 0
20:39:34.093672 IP 112.26.3.1.37653 > 112.26.3.8.39915: Flags [.], seq 71401:72829, ack 1, win 4017, options [nop,nop,TS val 1010499 ecr 789484,mptcp dss ack 4241485850 seq 1969396774 subseq 71401 len 1428 csum 0x3983], length 1428
20:39:34.127069 IP 112.26.3.8.39915 > 112.26.3.1.37653: Flags [.], ack 52837, win 14372, options [nop,nop,TS val 789751 ecr 1008056,nop,nop,sack 1 {54265:65689},mptcp dss ack 1969216846], length 0
20:39:34.127276 IP 112.26.3.8.39915 > 112.26.3.1.37653: Flags [.], ack 52837, win 14372, options [nop,nop,TS val 789751 ecr 1008056,nop,nop,sack 1 {54265:65689},mptcp dss ack 1969216846], length 0
20:39:34.140928 IP 112.26.3.1.37653 > 112.26.3.8.39915: Flags [.], seq 52837:54265, ack 1, win 4017, options [nop,nop,TS val 1009770 ecr 788908,mptcp dss ack 4241485850 seq 1969321090 subseq 52837 len 1428 csum 0xe444], length 1428
20:39:34.202280 IP 112.26.3.8.39915 > 112.26.3.1.37653: Flags [.], ack 65689, win 14509, options [nop,nop,TS val 789880 ecr 1009770,mptcp dss ack 1969216846], length 0
20:39:34.202514 IP 112.26.3.8.39915 > 112.26.3.1.37653: Flags [.], ack 65689, win 14509, options [nop,nop,TS val 789880 ecr 1009770,mptcp dss ack 1969216846], length 0
20:39:34.226068 IP 112.26.3.1.37653 > 112.26.3.8.39915: Flags [.], seq 72829:74257, ack 1, win 4017, options [nop,nop,TS val 1010616 ecr 789613,mptcp dss ack 4241485850 seq 1969402486 subseq 72829 len 1428 csum 0x793], length 1428
20:39:34.266841 IP 112.26.3.8.39915 > 112.26.3.1.37653: Flags [.], ack 67117, win 14692, options [nop,nop,TS val 790029 ecr 1009915,mptcp dss ack 1969216846], length 0
20:39:34.267039 IP 112.26.3.8.39915 > 112.26.3.1.37653: Flags [.], ack 67117, win 14692, options [nop,nop,TS val 790029 ecr 1009915,mptcp dss ack 1969216846], length 0
20:39:34.276888 IP 112.26.3.1.37653 > 112.26.3.8.39915: Flags [.], seq 65689:67117, ack 1, win 4017, options [nop,nop,TS val 1009915 ecr 789038,mptcp dss ack 4241485850 seq 1969375354 subseq 65689 len 1428 csum 0xd4b5], length 1428
20:39:34.304898 IP 112.26.3.1.37653 > 112.26.3.8.39915: Flags [.], seq 74257:75685, ack 1, win 4017, options [nop,nop,TS val 1010775 ecr 789751,mptcp dss ack 4241485850 seq 1969406770 subseq 74257 len 1428 csum 0x958d], length 1428
20:39:34.340035 IP 112.26.3.1.37653 > 112.26.3.8.39915: Flags [.], seq 67117:68545, ack 1, win 4017, options [nop,nop,TS val 1010224 ecr 789176,mptcp dss ack 4241485850 seq 1969383922 subseq 67117 len 1428 csum 0x8ed7], length 1428
20:39:34.369757 IP 112.26.3.8.39915 > 112.26.3.1.37653: Flags [.], ack 68545, win 14783, options [nop,nop,TS val 790117 ecr 1010224,mptcp dss ack 1969216846], length 0
20:39:34.369958 IP 112.26.3.8.39915 > 112.26.3.1.37653: Flags [.], ack 68545, win 14783, options [nop,nop,TS val 790117 ecr 1010224,mptcp dss ack 1969216846], length 0
20:39:34.420982 IP 112.26.3.1.37653 > 112.26.3.8.39915: Flags [.], seq 75685:77113, ack 1, win 4017, options [nop,nop,TS val 1010792 ecr 789880,mptcp dss ack 4241485850 seq 1969411054 subseq 75685 len 1428 csum 0xbf8b], length 1428
20:39:34.499669 IP 112.26.3.1.37653 > 112.26.3.8.39915: Flags [.], seq 68545:69973, ack 1, win 4017, options [nop,nop,TS val 1010247 ecr 789261,mptcp dss ack 4241485850 seq 1969385350 subseq 68545 len 1428 csum 0xc72b], length 1428
20:39:34.510453 IP 112.26.3.1.37653 > 112.26.3.8.39915: Flags [.], seq 77113:78541, ack 1, win 4017, options [nop,nop,TS val 1010939 ecr 790029,mptcp dss ack 4241485850 seq 1969413910 subseq 77113 len 1428 csum 0xcf59], length 1428
20:39:34.523579 IP 112.26.3.8.39915 > 112.26.3.1.37653: Flags [.], ack 69973, win 15011, options [nop,nop,TS val 790277 ecr 1010247,mptcp dss ack 1969216846], length 0
20:39:34.523833 IP 112.26.3.8.39915 > 112.26.3.1.37653: Flags [.], ack 69973, win 15011, options [nop,nop,TS val 790277 ecr 1010247,mptcp dss ack 1969216846], length 0
20:39:34.592587 IP 112.26.3.1.37653 > 112.26.3.8.39915: Flags [.], seq 78541:79969, ack 1, win 4017, options [nop,nop,TS val 1011005 ecr 790117,mptcp dss ack 4241485850 seq 1969415338 subseq 78541 len 1428 csum 0x5db], length 1428
20:39:34.629967 IP 112.26.3.1.37653 > 112.26.3.8.39915: Flags [.], seq 69973:71401, ack 1, win 4017, options [nop,nop,TS val 1010416 ecr 789355,mptcp dss ack 4241485850 seq 1969392490 subseq 69973 len 1428 csum 0xf69b], length 1428
20:39:34.632897 IP 112.26.3.8.39915 > 112.26.3.1.37653: Flags [.], ack 71401, win 15194, options [nop,nop,TS val 790407 ecr 1010416,mptcp dss ack 1969216846], length 0
20:39:34.633117 IP 112.26.3.8.39915 > 112.26.3.1.37653: Flags [.], ack 71401, win 15194, options [nop,nop,TS val 790407 ecr 1010416,mptcp dss ack 1969216846], length 0
20:39:34.726929 IP 112.26.3.1.37653 > 112.26.3.8.39915: Flags [.], seq 79969:81397, ack 1, win 4017, options [nop,nop,TS val 1011152 ecr 790277,mptcp dss ack 4241485850 seq 1969418194 subseq 79969 len 1428 csum 0xc16c], length 1428
