20:39:27.393964 IP 112.26.1.8.42049 > 112.26.1.1.37653: Flags [S], seq 2263806240, win 65535, options [mss 1460,sackOK,TS val 783148 ecr 0,nop,wscale 6,mptcp join id 3 token 0xbaf08251 nonce 0x994c8d18], length 0
20:39:27.443993 IP 112.26.1.8.42049 > 112.26.1.1.37653: Flags [S], seq 2263806240, win 65535, options [mss 1460,sackOK,TS val 783148 ecr 0,nop,wscale 6,mptcp join id 3 token 0xbaf08251 nonce 0x994c8d18], length 0
20:39:27.537528 IP 112.26.1.8.42049 > 112.26.1.1.37653: Flags [S], seq 2263806240, win 65535, options [mss 1460,sackOK,TS val 783148 ecr 0,nop,wscale 6,mptcp join id 3 token 0xbaf08251 nonce 0x994c8d18], length 0
20:39:27.662875 IP 112.26.1.1.37653 > 112.26.1.8.42049: Flags [S.], seq 2869940820, ack 2263806241, win 65535, options [mss 1460,sackOK,TS val 1004073 ecr 783148,nop,wscale 6,mptcp join id 3 hmac 0xbf8861f17be900a7 nonce 0xbfe5d85c], length 0
20:39:27.713720 IP 112.26.1.1.37653 > 112.26.1.8.42049: Flags [S.], seq 2869940820, ack 2263806241, win 65535, options [mss 1460,sackOK,TS val 1004073 ecr 783148,nop,wscale 6,mptcp join id 3 hmac 0xbf8861f17be900a7 nonce 0xbfe5d85c], length 0
20:39:27.727922 IP 112.26.1.8.42049 > 112.26.1.1.37653: Flags [.], ack 1, win 7300, options [nop,nop,TS val 783491 ecr 1004073,mptcp join hmac 0xa3da383c27000032e8efc1c8d500fb8ad0766c38], length 0
20:39:27.785401 IP 112.26.1.8.42049 > 112.26.1.1.37653: Flags [.], ack 1, win 7300, options [nop,nop,TS val 783491 ecr 1004073,mptcp join hmac 0xa3da383c27000032e8efc1c8d500fb8ad0766c38], length 0
20:39:27.880307 IP 112.26.1.8.42049 > 112.26.1.1.37653: Flags [.], ack 1, win 7300, options [nop,nop,TS val 783491 ecr 1004073,mptcp join hmac 0xa3da383c27000032e8efc1c8d500fb8ad0766c38], length 0
20:39:27.998640 IP 112.26.1.1.37653 > 112.26.1.8.42049: Flags [.], ack 1, win 4017, options [nop,nop,TS val 1004415 ecr 783491,mptcp dss ack 4241485850], length 0
20:39:28.000412 IP 112.26.1.1.37653 > 112.26.1.8.42049: Flags [.], ack 1, win 4017, options [nop,nop,TS val 1004415 ecr 783491,mptcp dss ack 4241485850], length 0
20:39:28.092697 IP 112.26.1.1.37653 > 112.26.1.8.42049: Flags [.], seq 1:1429, ack 1, win 4017, options [nop,nop,TS val 1004416 ecr 783491,mptcp dss ack 4241485850 seq 1969174006 subseq 1 len 1428 csum 0x409a], length 1428
20:39:28.096607 IP 112.26.1.1.37653 > 112.26.1.8.42049: Flags [.], seq 1:1429, ack 1, win 4017, options [nop,nop,TS val 1004416 ecr 783491,mptcp dss ack 4241485850 seq 1969174006 subseq 1 len 1428 csum 0x409a], length 1428
20:39:28.098206 IP 112.26.1.8.42049 > 112.26.1.1.37653: Flags [.], ack 1429, win 7529, options [nop,nop,TS val 783874 ecr 1004416,mptcp dss ack 1969125454], length 0
20:39:28.162551 IP 112.26.1.8.42049 > 112.26.1.1.37653: Flags [.], ack 1429, win 7529, options [nop,nop,TS val 783874 ecr 1004416,mptcp dss ack 1969125454], length 0
20:39:28.198155 IP 112.26.1.8.42049 > 112.26.1.1.37653: Flags [.], ack 1429, win 7529, options [nop,nop,TS val 783874 ecr 1004416,mptcp dss ack 1969125454], length 0
20:39:28.246397 IP 112.26.1.8.42049 > 112.26.1.1.37653: Flags [.], ack 2857, win 7711, options [nop,nop,TS val 784023 ecr 1004416,mptcp dss ack 1969126882], length 0
20:39:28.268283 IP 112.26.1.1.37653 > 112.26.1.8.42049: Flags [.], seq 1429:2857, ack 1, win 4017, options [nop,nop,TS val 1004416 ecr 783491,mptcp dss ack 4241485850 seq 1969175434 subseq 1429 len 1428 csum 0xf0b4], length 1428
20:39:28.273506 IP 112.26.1.1.37653 > 112.26.1.8.42049: Flags [.], seq 1429:2857, ack 1, win 4017, options [nop,nop,TS val 1004416 ecr 783491,mptcp dss ack 4241485850 seq 1969175434 subseq 1429 len 1428 csum 0xf0b4], length 1428
20:39:28.289333 IP 112.26.1.8.42049 > 112.26.1.1.37653: Flags [.], ack 2857, win 7711, options [nop,nop,TS val 784023 ecr 1004416,mptcp dss ack 1969126882], length 0
20:39:28.296162 IP 112.26.1.8.42049 > 112.26.1.1.37653: Flags [.], ack 2857, win 7711, options [nop,nop,TS val 784023 ecr 1004416,mptcp dss ack 1969126882], length 0
20:39:28.374757 IP 112.26.1.1.37653 > 112.26.1.8.42049: Flags [.], seq 2857:4285, ack 1, win 4017, options [nop,nop,TS val 1004416 ecr 783491,mptcp dss ack 4241485850 seq 1969176862 subseq 2857 len 1428 csum 0x6f93], length 1428
20:39:28.378107 IP 112.26.1.1.37653 > 112.26.1.8.42049: Flags [.], seq 2857:4285, ack 1, win 4017, options [nop,nop,TS val 1004416 ecr 783491,mptcp dss ack 4241485850 seq 1969176862 subseq 2857 len 1428 csum 0x6f93], length 1428
20:39:28.392970 IP 112.26.1.8.42049 > 112.26.1.1.37653: Flags [.], ack 4285, win 7848, options [nop,nop,TS val 784156 ecr 1004416,mptcp dss ack 1969134022], length 0
20:39:28.407348 IP 112.26.1.8.42049 > 112.26.1.1.37653: Flags [.], ack 4285, win 7848, options [nop,nop,TS val 784156 ecr 1004416,mptcp dss ack 1969134022], length 0
20:39:28.417289 IP 112.26.1.8.42049 > 112.26.1.1.37653: Flags [.], ack 4285, win 7848, options [nop,nop,TS val 784156 ecr 1004416,mptcp dss ack 1969134022], length 0
20:39:28.619982 IP 112.26.1.1.37653 > 112.26.1.8.42049: Flags [.], seq 4285:5713, ack 1, win 4017, options [nop,nop,TS val 1004416 ecr 783491,mptcp dss ack 4241485850 seq 1969178290 subseq 4285 len 1428 csum 0x80b2], length 1428
20:39:28.626203 IP 112.26.1.1.37653 > 112.26.1.8.42049: Flags [.], seq 4285:5713, ack 1, win 4017, options [nop,nop,TS val 1004416 ecr 783491,mptcp dss ack 4241485850 seq 1969178290 subseq 4285 len 1428 csum 0x80b2], length 1428
20:39:28.628721 IP 112.26.1.8.42049 > 112.26.1.1.37653: Flags [.], ack 5713, win 8076, options [nop,nop,TS val 784404 ecr 1004416,mptcp dss ack 1969136878], length 0
20:39:28.702318 IP 112.26.1.8.42049 > 112.26.1.1.37653: Flags [.], ack 5713, win 8076, options [nop,nop,TS val 784404 ecr 1004416,mptcp dss ack 1969136878], length 0
20:39:28.704590 IP 112.26.1.8.42049 > 112.26.1.1.37653: Flags [.], ack 5713, win 8076, options [nop,nop,TS val 784404 ecr 1004416,mptcp dss ack 1969136878], length 0
20:39:28.747284 IP 112.26.1.1.37653 > 112.26.1.8.42049: Flags [.], seq 5713:7141, ack 1, win 4017, options [nop,nop,TS val 1004416 ecr 783491,mptcp dss ack 4241485850 seq 1969179718 subseq 5713 len 1428 csum 0xfc], length 1428
20:39:28.751461 IP 112.26.1.1.37653 > 112.26.1.8.42049: Flags [.], seq 5713:7141, ack 1, win 4017, options [nop,nop,TS val 1004416 ecr 783491,mptcp dss ack 4241485850 seq 1969179718 subseq 5713 len 1428 csum 0xfc], length 1428
20:39:28.755505 IP 112.26.1.8.42049 > 112.26.1.1.37653: Flags [.], ack 7141, win 8167, options [nop,nop,TS val 784529 ecr 1004416,mptcp dss ack 1969136878], length 0
20:39:28.783801 IP 112.26.1.8.42049 > 112.26.1.1.37653: Flags [.], ack 7141, win 8167, options [nop,nop,TS val 784529 ecr 1004416,mptcp dss ack 1969136878], length 0
20:39:28.824756 IP 112.26.1.8.42049 > 112.26.1.1.37653: Flags [.], ack 7141, win 8167, options [nop,nop,TS val 784529 ecr 1004416,mptcp dss ack 1969136878], length 0
20:39:28.904114 IP 112.26.1.1.37653 > 112.26.1.8.42049: Flags [.], seq 7141:8569, ack 1, win 4017, options [nop,nop,TS val 1004417 ecr 783491,mptcp dss ack 4241485850 seq 1969181146 subseq 7141 len 1428 csum 0xe330], length 1428
20:39:28.912813 IP 112.26.1.1.37653 > 112.26.1.8.42049: Flags [.], seq 7141:8569, ack 1, win 4017, options [nop,nop,TS val 1004417 ecr 783491,mptcp dss ack 4241485850 seq 1969181146 subseq 7141 len 1428 csum 0xe330], length 1428
20:39:28.915567 IP 112.26.1.8.42049 > 112.26.1.1.37653: Flags [.], ack 8569, win 8395, options [nop,nop,TS val 784690 ecr 1004417,mptcp dss ack 1969139734], length 0
20:39:28.917535 IP 112.26.1.8.42049 > 112.26.1.1.37653: Flags [.], ack 8569, win 8395, options [nop,nop,TS val 784690 ecr 1004417,mptcp dss ack 1969139734], length 0
20:39:29.035053 IP 112.26.1.1.37653 > 112.26.1.8.42049: Flags [.], seq 8569:9997, ack 1, win 4017, options [nop,nop,TS val 1004417 ecr 783491,mptcp dss ack 4241485850 seq 1969182574 subseq 8569 len 1428 csum 0xc30f], length 1428
20:39:29.039863 IP 112.26.1.1.37653 > 112.26.1.8.42049: Flags [.], seq 8569:9997, ack 1, win 4017, options [nop,nop,TS val 1004417 ecr 783491,mptcp dss ack 4241485850 seq 1969182574 subseq 8569 len 1428 csum 0xc30f], length 1428
20:39:29.041979 IP 112.26.1.8.42049 > 112.26.1.1.37653: Flags [.], ack 9997, win 8578, options [nop,nop,TS val 784817 ecr 1004417,mptcp dss ack 1969139734], length 0
20:39:29.140609 IP 112.26.1.8.42049 > 112.26.1.1.37653: Flags [.], ack 9997, win 8578, options [nop,nop,TS val 784817 ecr 1004417,mptcp dss ack 1969139734], length 0
20:39:29.228383 IP 112.26.1.1.37653 > 112.26.1.8.42049: Flags [.], seq 9997:11425, ack 1, win 4017, options [nop,nop,TS val 1004417 ecr 783491,mptcp dss ack 4241485850 seq 1969184002 subseq 9997 len 1428 csum 0xb42d], length 1428
20:39:29.232814 IP 112.26.1.1.37653 > 112.26.1.8.42049: Flags [.], seq 9997:11425, ack 1, win 4017, options [nop,nop,TS val 1004417 ecr 783491,mptcp dss ack 4241485850 seq 1969184002 subseq 9997 len 1428 csum 0xb42d], length 1428
20:39:29.234864 IP 112.26.1.8.42049 > 112.26.1.1.37653: Flags [.], ack 11425, win 8760, options [nop,nop,TS val 785010 ecr 1004417,mptcp dss ack 1969139734], length 0
20:39:29.236192 IP 112.26.1.8.42049 > 112.26.1.1.37653: Flags [.], ack 11425, win 8760, options [nop,nop,TS val 785010 ecr 1004417,mptcp dss ack 1969139734], length 0
20:39:29.365089 IP 112.26.1.1.37653 > 112.26.1.8.42049: Flags [.], seq 11425:12853, ack 1, win 4017, options [nop,nop,TS val 1004417 ecr 783491,mptcp dss ack 4241485850 seq 1969185430 subseq 11425 len 1428 csum 0xf49a], length 1428
20:39:29.367842 IP 112.26.1.1.37653 > 112.26.1.8.42049: Flags [.], seq 11425:12853, ack 1, win 4017, options [nop,nop,TS val 1004417 ecr 783491,mptcp dss ack 4241485850 seq 1969185430 subseq 11425 len 1428 csum 0xf49a], length 1428
20:39:29.369508 IP 112.26.1.8.42049 > 112.26.1.1.37653: Flags [.], ack 12853, win 8897, options [nop,nop,TS val 785145 ecr 1004417,mptcp dss ack 1969139734], length 0
20:39:29.378034 IP 112.26.1.8.42049 > 112.26.1.1.37653: Flags [.], ack 12853, win 8897, options [nop,nop,TS val 785145 ecr 1004417,mptcp dss ack 1969139734], length 0
20:39:29.489718 IP 112.26.1.1.37653 > 112.26.1.8.42049: Flags [.], seq 14281:15709, ack 1, win 4017, options [nop,nop,TS val 1004698 ecr 783874,mptcp dss ack 4241485850 seq 1969195426 subseq 14281 len 1428 csum 0x1a56], length 1428
20:39:29.493356 IP 112.26.1.1.37653 > 112.26.1.8.42049: Flags [.], seq 14281:15709, ack 1, win 4017, options [nop,nop,TS val 1004698 ecr 783874,mptcp dss ack 4241485850 seq 1969195426 subseq 14281 len 1428 csum 0x1a56], length 1428
20:39:29.498036 IP 112.26.1.8.42049 > 112.26.1.1.37653: Flags [.], ack 12853, win 9080, options [nop,nop,TS val 785271 ecr 1004417,nop,nop,sack 1 {14281:15709},mptcp dss ack 1969139734], length 0
20:39:29.525513 IP 112.26.1.8.42049 > 112.26.1.1.37653: Flags [.], ack 12853, win 9080, options [nop,nop,TS val 785271 ecr 1004417,nop,nop,sack 1 {14281:15709},mptcp dss ack 1969139734], length 0
20:39:29.574177 IP 112.26.1.1.37653 > 112.26.1.8.42049: Flags [.], seq 15709:17137, ack 1, win 4017, options [nop,nop,TS val 1004698 ecr 783874,mptcp dss ack 4241485850 seq 1969196854 subseq 15709 len 1428 csum 0x93a6], length 1428
20:39:29.625733 IP 112.26.1.1.37653 > 112.26.1.8.42049: Flags [.], seq 15709:17137, ack 1, win 4017, options [nop,nop,TS val 1004698 ecr 783874,mptcp dss ack 4241485850 seq 1969196854 subseq 15709 len 1428 csum 0x93a6], length 1428
20:39:29.627718 IP 112.26.1.8.42049 > 112.26.1.1.37653: Flags [.], ack 12853, win 9262, options [nop,nop,TS val 785403 ecr 1004417,nop,nop,sack 1 {14281:17137},mptcp dss ack 1969139734], length 0
20:39:29.630489 IP 112.26.1.8.42049 > 112.26.1.1.37653: Flags [.], ack 12853, win 9262, options [nop,nop,TS val 785403 ecr 1004417,nop,nop,sack 1 {14281:17137},mptcp dss ack 1969139734], length 0
20:39:29.689150 IP 112.26.1.1.37653 > 112.26.1.8.42049: Flags [.], seq 17137:18565, ack 1, win 4017, options [nop,nop,TS val 1004832 ecr 784023,mptcp dss ack 4241485850 seq 1969202566 subseq 17137 len 1428 csum 0xa917], length 1428
20:39:29.737590 IP 112.26.1.1.37653 > 112.26.1.8.42049: Flags [.], seq 17137:18565, ack 1, win 4017, options [nop,nop,TS val 1004832 ecr 784023,mptcp dss ack 4241485850 seq 1969202566 subseq 17137 len 1428 csum 0xa917], length 1428
20:39:29.740481 IP 112.26.1.8.42049 > 112.26.1.1.37653: Flags [.], ack 12853, win 9399, options [nop,nop,TS val 785515 ecr 1004417,nop,nop,sack 1 {14281:18565},mptcp dss ack 1969139734], length 0
20:39:29.835885 IP 112.26.1.8.42049 > 112.26.1.1.37653: Flags [.], ack 12853, win 9399, options [nop,nop,TS val 785515 ecr 1004417,nop,nop,sack 1 {14281:18565},mptcp dss ack 1969139734], length 0
20:39:29.841453 IP 112.26.1.1.37653 > 112.26.1.8.42049: Flags [.], seq 18565:19993, ack 1, win 4017, options [nop,nop,TS val 1004832 ecr 784023,mptcp dss ack 4241485850 seq 1969203994 subseq 18565 len 1428 csum 0xa6fb], length 1428
20:39:29.849076 IP 112.26.1.8.42049 > 112.26.1.1.37653: Flags [.], ack 12853, win 9536, options [nop,nop,TS val 785619 ecr 1004417,nop,nop,sack 1 {14281:19993},mptcp dss ack 1969139734], length 0
20:39:29.875521 IP 112.26.1.8.42049 > 112.26.1.1.37653: Flags [.], ack 8569, win 8395, options [nop,nop,TS val 784690 ecr 1004417,mptcp dss ack 1969139734], length 0
20:39:29.898724 IP 112.26.1.1.37653 > 112.26.1.8.42049: Flags [.], seq 18565:19993, ack 1, win 4017, options [nop,nop,TS val 1004832 ecr 784023,mptcp dss ack 4241485850 seq 1969203994 subseq 18565 len 1428 csum 0xa6fb], length 1428
20:39:29.935901 IP 112.26.1.8.42049 > 112.26.1.1.37653: Flags [.], ack 12853, win 9536, options [nop,nop,TS val 785619 ecr 1004417,nop,nop,sack 1 {14281:19993},mptcp dss ack 1969139734], length 0
20:39:29.973305 IP 112.26.1.1.37653 > 112.26.1.8.42049: Flags [.], seq 19993:21421, ack 1, win 4017, options [nop,nop,TS val 1004947 ecr 784156,mptcp dss ack 4241485850 seq 1969213990 subseq 19993 len 1428 csum 0xcd9f], length 1428
20:39:29.981310 IP 112.26.1.1.37653 > 112.26.1.8.42049: Flags [.], seq 19993:21421, ack 1, win 4017, options [nop,nop,TS val 1004947 ecr 784156,mptcp dss ack 4241485850 seq 1969213990 subseq 19993 len 1428 csum 0xcd9f], length 1428
20:39:29.982439 IP 112.26.1.8.42049 > 112.26.1.1.37653: Flags [.], ack 12853, win 9673, options [nop,nop,TS val 785758 ecr 1004417,nop,nop,sack 1 {14281:21421},mptcp dss ack 1969139734], length 0
20:39:29.983917 IP 112.26.1.8.42049 > 112.26.1.1.37653: Flags [.], ack 12853, win 9673, options [nop,nop,TS val 785758 ecr 1004417,nop,nop,sack 1 {14281:21421},mptcp dss ack 1969139734], length 0
20:39:30.021311 IP 112.26.1.8.42049 > 112.26.1.1.37653: Flags [.], ack 9997, win 8578, options [nop,nop,TS val 784817 ecr 1004417,mptcp dss ack 1969139734], length 0
20:39:30.122631 IP 112.26.1.8.42049 > 112.26.1.1.37653: Flags [.], ack 11425, win 8760, options [nop,nop,TS val 785010 ecr 1004417,mptcp dss ack 1969139734], length 0
20:39:30.177258 IP 112.26.1.1.37653 > 112.26.1.8.42049: Flags [.], seq 22849:24277, ack 1, win 4017, options [nop,nop,TS val 1005240 ecr 784404,mptcp dss ack 4241485850 seq 1969228270 subseq 22849 len 1428 csum 0x1ddf], length 1428
20:39:30.179991 IP 112.26.1.1.37653 > 112.26.1.8.42049: Flags [.], seq 22849:24277, ack 1, win 4017, options [nop,nop,TS val 1005240 ecr 784404,mptcp dss ack 4241485850 seq 1969228270 subseq 22849 len 1428 csum 0x1ddf], length 1428
20:39:30.184570 IP 112.26.1.8.42049 > 112.26.1.1.37653: Flags [.], ack 12853, win 9901, options [nop,nop,TS val 785957 ecr 1004417,nop,nop,sack 2 {22849:24277}{14281:21421},mptcp dss ack 1969139734], length 0
20:39:30.185322 IP 112.26.1.8.42049 > 112.26.1.1.37653: Flags [.], ack 12853, win 9901, options [nop,nop,TS val 785957 ecr 1004417,nop,nop,sack 2 {22849:24277}{14281:21421},mptcp dss ack 1969139734], length 0
20:39:30.219353 IP 112.26.1.8.42049 > 112.26.1.1.37653: Flags [.], ack 12853, win 8897, options [nop,nop,TS val 785145 ecr 1004417,mptcp dss ack 1969139734], length 0
20:39:30.309789 IP 112.26.1.1.37653 > 112.26.1.8.42049: Flags [.], seq 24277:25705, ack 1, win 4017, options [nop,nop,TS val 1005240 ecr 784404,mptcp dss ack 4241485850 seq 1969229698 subseq 24277 len 1428 csum 0xd84c], length 1428
20:39:30.313468 IP 112.26.1.1.37653 > 112.26.1.8.42049: Flags [.], seq 24277:25705, ack 1, win 4017, options [nop,nop,TS val 1005240 ecr 784404,mptcp dss ack 4241485850 seq 1969229698 subseq 24277 len 1428 csum 0xd84c], length 1428
20:39:30.314717 IP 112.26.1.8.42049 > 112.26.1.1.37653: Flags [.], ack 12853, win 10129, options [nop,nop,TS val 786091 ecr 1004417,nop,nop,sack 2 {22849:25705}{14281:21421},mptcp dss ack 1969139734], length 0
20:39:30.333648 IP 112.26.1.8.42049 > 112.26.1.1.37653: Flags [.], ack 12853, win 9080, options [nop,nop,TS val 785271 ecr 1004417,nop,nop,sack 1 {14281:15709},mptcp dss ack 1969139734], length 0
20:39:30.404530 IP 112.26.1.8.42049 > 112.26.1.1.37653: Flags [.], ack 12853, win 9262, options [nop,nop,TS val 785403 ecr 1004417,nop,nop,sack 1 {14281:17137},mptcp dss ack 1969139734], length 0
20:39:30.444482 IP 112.26.1.1.37653 > 112.26.1.8.42049: Flags [.], seq 25705:27133, ack 1, win 4017, options [nop,nop,TS val 1005360 ecr 784529,mptcp dss ack 4241485850 seq 1969236838 subseq 25705 len 1428 csum 0x93b8], length 1428
20:39:30.495790 IP 112.26.1.1.37653 > 112.26.1.8.42049: Flags [.], seq 25705:27133, ack 1, win 4017, options [nop,nop,TS val 1005360 ecr 784529,mptcp dss ack 4241485850 seq 1969236838 subseq 25705 len 1428 csum 0x93b8], length 1428
20:39:30.506027 IP 112.26.1.8.42049 > 112.26.1.1.37653: Flags [.], ack 12853, win 10266, options [nop,nop,TS val 786273 ecr 1004417,nop,nop,sack 2 {22849:27133}{14281:21421},mptcp dss ack 1969139734], length 0
20:39:30.513768 IP 112.26.1.8.42049 > 112.26.1.1.37653: Flags [.], ack 12853, win 10266, options [nop,nop,TS val 786273 ecr 1004417,nop,nop,sack 2 {22849:27133}{14281:21421},mptcp dss ack 1969139734], length 0
20:39:30.552164 IP 112.26.1.8.42049 > 112.26.1.1.37653: Flags [.], ack 12853, win 9399, options [nop,nop,TS val 785515 ecr 1004417,nop,nop,sack 1 {14281:18565},mptcp dss ack 1969139734], length 0
20:39:30.555779 IP 112.26.1.1.37653 > 112.26.1.8.42049: Flags [.], seq 27133:28561, ack 1, win 4017, options [nop,nop,TS val 1005360 ecr 784529,mptcp dss ack 4241485850 seq 1969238266 subseq 27133 len 1428 csum 0x7103], length 1428
20:39:30.589793 IP 112.26.1.1.37653 > 112.26.1.8.42049: Flags [.], seq 27133:28561, ack 1, win 4017, options [nop,nop,TS val 1005360 ecr 784529,mptcp dss ack 4241485850 seq 1969238266 subseq 27133 len 1428 csum 0x7103], length 1428
20:39:30.592806 IP 112.26.1.8.42049 > 112.26.1.1.37653: Flags [.], ack 12853, win 10403, options [nop,nop,TS val 786367 ecr 1004417,nop,nop,sack 2 {22849:28561}{14281:21421},mptcp dss ack 1969139734], length 0
20:39:30.614090 IP 112.26.1.8.42049 > 112.26.1.1.37653: Flags [.], ack 12853, win 10403, options [nop,nop,TS val 786367 ecr 1004417,nop,nop,sack 2 {22849:28561}{14281:21421},mptcp dss ack 1969139734], length 0
20:39:30.710933 IP 112.26.1.1.37653 > 112.26.1.8.42049: Flags [.], seq 27133:28561, ack 1, win 4017, options [nop,nop,TS val 1006144 ecr 784529,mptcp dss ack 4241485850 seq 1969238266 subseq 27133 len 1428 csum 0x7103], length 1428
20:39:30.716947 IP 112.26.1.1.37653 > 112.26.1.8.42049: Flags [.], seq 27133:28561, ack 1, win 4017, options [nop,nop,TS val 1006144 ecr 784529,mptcp dss ack 4241485850 seq 1969238266 subseq 27133 len 1428 csum 0x7103], length 1428
20:39:30.723918 IP 112.26.1.8.42049 > 112.26.1.1.37653: Flags [.], ack 12853, win 9536, options [nop,nop,TS val 785619 ecr 1004417,nop,nop,sack 1 {14281:19993},mptcp dss ack 1969139734], length 0
20:39:30.730657 IP 112.26.1.8.42049 > 112.26.1.1.37653: Flags [.], ack 12853, win 10585, options [nop,nop,TS val 786495 ecr 1004417,nop,nop,sack 2 {27133:28561}{22849:28561},mptcp dss ack 1969139734], length 0
20:39:30.736950 IP 112.26.1.8.42049 > 112.26.1.1.37653: Flags [.], ack 12853, win 10585, options [nop,nop,TS val 786495 ecr 1004417,nop,nop,sack 2 {27133:28561}{22849:28561},mptcp dss ack 1969139734], length 0
20:39:30.801353 IP 112.26.1.1.37653 > 112.26.1.8.42049: Flags [.], seq 28561:29989, ack 1, win 4017, options [nop,nop,TS val 1006411 ecr 784690,mptcp dss ack 4241485850 seq 1969256830 subseq 28561 len 1428 csum 0x306], length 1428
20:39:30.823425 IP 112.26.1.1.37653 > 112.26.1.8.42049: Flags [.], seq 28561:29989, ack 1, win 4017, options [nop,nop,TS val 1006411 ecr 784690,mptcp dss ack 4241485850 seq 1969256830 subseq 28561 len 1428 csum 0x306], length 1428
20:39:30.825637 IP 112.26.1.8.42049 > 112.26.1.1.37653: Flags [.], ack 12853, win 10722, options [nop,nop,TS val 786601 ecr 1004417,nop,nop,sack 2 {22849:29989}{14281:21421},mptcp dss ack 1969139734], length 0
20:39:30.829185 IP 112.26.1.8.42049 > 112.26.1.1.37653: Flags [.], ack 12853, win 10722, options [nop,nop,TS val 786601 ecr 1004417,nop,nop,sack 2 {22849:29989}{14281:21421},mptcp dss ack 1969139734], length 0
20:39:30.924027 IP 112.26.1.1.37653 > 112.26.1.8.42049: Flags [.], seq 29989:31417, ack 1, win 4017, options [nop,nop,TS val 1006411 ecr 784690,mptcp dss ack 4241485850 seq 1969258258 subseq 29989 len 1428 csum 0x8834], length 1428
20:39:30.926699 IP 112.26.1.1.37653 > 112.26.1.8.42049: Flags [.], seq 29989:31417, ack 1, win 4017, options [nop,nop,TS val 1006411 ecr 784690,mptcp dss ack 4241485850 seq 1969258258 subseq 29989 len 1428 csum 0x8834], length 1428
20:39:30.931920 IP 112.26.1.8.42049 > 112.26.1.1.37653: Flags [.], ack 12853, win 10859, options [nop,nop,TS val 786704 ecr 1004417,nop,nop,sack 2 {22849:31417}{14281:21421},mptcp dss ack 1969139734], length 0
20:39:30.942814 IP 112.26.1.8.42049 > 112.26.1.1.37653: Flags [.], ack 12853, win 10859, options [nop,nop,TS val 786704 ecr 1004417,nop,nop,sack 2 {22849:31417}{14281:21421},mptcp dss ack 1969139734], length 0
20:39:30.960552 IP 112.26.1.8.42049 > 112.26.1.1.37653: Flags [.], ack 12853, win 9901, options [nop,nop,TS val 785957 ecr 1004417,nop,nop,sack 2 {22849:24277}{14281:21421},mptcp dss ack 1969139734], length 0
20:39:31.061329 IP 112.26.1.1.37653 > 112.26.1.8.42049: Flags [.], seq 31417:32845, ack 1, win 4017, options [nop,nop,TS val 1006556 ecr 784817,mptcp dss ack 4241485850 seq 1969259686 subseq 31417 len 1428 csum 0x5cde], length 1428
20:39:31.066211 IP 112.26.1.1.37653 > 112.26.1.8.42049: Flags [.], seq 31417:32845, ack 1, win 4017, options [nop,nop,TS val 1006556 ecr 784817,mptcp dss ack 4241485850 seq 1969259686 subseq 31417 len 1428 csum 0x5cde], length 1428
20:39:31.088203 IP 112.26.1.8.42049 > 112.26.1.1.37653: Flags [.], ack 12853, win 10996, options [nop,nop,TS val 786844 ecr 1004417,nop,nop,sack 2 {22849:32845}{14281:21421},mptcp dss ack 1969139734], length 0
20:39:31.099496 IP 112.26.1.8.42049 > 112.26.1.1.37653: Flags [.], ack 12853, win 10266, options [nop,nop,TS val 786273 ecr 1004417,nop,nop,sack 2 {22849:27133}{14281:21421},mptcp dss ack 1969139734], length 0
20:39:31.137222 IP 112.26.1.8.42049 > 112.26.1.1.37653: Flags [.], ack 12853, win 10996, options [nop,nop,TS val 786844 ecr 1004417,nop,nop,sack 2 {22849:32845}{14281:21421},mptcp dss ack 1969139734], length 0
20:39:31.229635 IP 112.26.1.1.37653 > 112.26.1.8.42049: Flags [.], seq 32845:34273, ack 1, win 4017, options [nop,nop,TS val 1006556 ecr 784817,mptcp dss ack 4241485850 seq 1969261114 subseq 32845 len 1428 csum 0xb6a4], length 1428
20:39:31.231197 IP 112.26.1.1.37653 > 112.26.1.8.42049: Flags [.], seq 32845:34273, ack 1, win 4017, options [nop,nop,TS val 1006556 ecr 784817,mptcp dss ack 4241485850 seq 1969261114 subseq 32845 len 1428 csum 0xb6a4], length 1428
20:39:31.233604 IP 112.26.1.8.42049 > 112.26.1.1.37653: Flags [.], ack 12853, win 11179, options [nop,nop,TS val 787009 ecr 1004417,nop,nop,sack 2 {22849:34273}{14281:21421},mptcp dss ack 1969141162], length 0
20:39:31.259861 IP 112.26.1.8.42049 > 112.26.1.1.37653: Flags [.], ack 12853, win 11179, options [nop,nop,TS val 787009 ecr 1004417,nop,nop,sack 2 {22849:34273}{14281:21421},mptcp dss ack 1969141162], length 0
20:39:31.265335 IP 112.26.1.8.42049 > 112.26.1.1.37653: Flags [.], ack 12853, win 10403, options [nop,nop,TS val 786367 ecr 1004417,nop,nop,sack 2 {22849:28561}{14281:21421},mptcp dss ack 1969139734], length 0
20:39:31.312592 IP 112.26.1.1.37653 > 112.26.1.8.42049: Flags [.], seq 34273:35701, ack 1, win 4017, options [nop,nop,TS val 1006658 ecr 785010,mptcp dss ack 4241485850 seq 1969262542 subseq 34273 len 1428 csum 0x3730], length 1428
20:39:31.365832 IP 112.26.1.8.42049 > 112.26.1.1.37653: Flags [.], ack 12853, win 10585, options [nop,nop,TS val 786495 ecr 1004417,nop,nop,sack 2 {27133:28561}{22849:28561},mptcp dss ack 1969139734], length 0
20:39:31.376193 IP 112.26.1.1.37653 > 112.26.1.8.42049: Flags [.], seq 34273:35701, ack 1, win 4017, options [nop,nop,TS val 1006658 ecr 785010,mptcp dss ack 4241485850 seq 1969262542 subseq 34273 len 1428 csum 0x3730], length 1428
20:39:31.378217 IP 112.26.1.8.42049 > 112.26.1.1.37653: Flags [.], ack 12853, win 11361, options [nop,nop,TS val 787154 ecr 1004417,nop,nop,sack 2 {22849:35701}{14281:21421},mptcp dss ack 1969141162], length 0
20:39:31.387263 IP 112.26.1.8.42049 > 112.26.1.1.37653: Flags [.], ack 12853, win 11361, options [nop,nop,TS val 787154 ecr 1004417,nop,nop,sack 2 {22849:35701}{14281:21421},mptcp dss ack 1969141162], length 0
20:39:31.465935 IP 112.26.1.1.37653 > 112.26.1.8.42049: Flags [.], seq 35701:37129, ack 1, win 4017, options [nop,nop,TS val 1006658 ecr 785010,mptcp dss ack 4241485850 seq 1969263970 subseq 35701 len 1428 csum 0x792c], length 1428
20:39:31.486715 IP 112.26.1.1.37653 > 112.26.1.8.42049: Flags [.], seq 35701:37129, ack 1, win 4017, options [nop,nop,TS val 1006658 ecr 785010,mptcp dss ack 4241485850 seq 1969263970 subseq 35701 len 1428 csum 0x792c], length 1428
20:39:31.501970 IP 112.26.1.8.42049 > 112.26.1.1.37653: Flags [.], ack 12853, win 11498, options [nop,nop,TS val 787265 ecr 1004417,nop,nop,sack 2 {22849:37129}{14281:21421},mptcp dss ack 1969141162], length 0
20:39:31.511403 IP 112.26.1.8.42049 > 112.26.1.1.37653: Flags [.], ack 12853, win 11498, options [nop,nop,TS val 787265 ecr 1004417,nop,nop,sack 2 {22849:37129}{14281:21421},mptcp dss ack 1969141162], length 0
20:39:31.538073 IP 112.26.1.8.42049 > 112.26.1.1.37653: Flags [.], ack 12853, win 10722, options [nop,nop,TS val 786601 ecr 1004417,nop,nop,sack 2 {22849:29989}{14281:21421},mptcp dss ack 1969139734], length 0
20:39:31.617935 IP 112.26.1.1.37653 > 112.26.1.8.42049: Flags [.], seq 37129:38557, ack 1, win 4017, options [nop,nop,TS val 1006755 ecr 785145,mptcp dss ack 4241485850 seq 1969272538 subseq 37129 len 1428 csum 0x457c], length 1428
20:39:31.622141 IP 112.26.1.1.37653 > 112.26.1.8.42049: Flags [.], seq 37129:38557, ack 1, win 4017, options [nop,nop,TS val 1006755 ecr 785145,mptcp dss ack 4241485850 seq 1969272538 subseq 37129 len 1428 csum 0x457c], length 1428
20:39:31.627862 IP 112.26.1.8.42049 > 112.26.1.1.37653: Flags [.], ack 12853, win 11680, options [nop,nop,TS val 787400 ecr 1004417,nop,nop,sack 2 {22849:38557}{14281:21421},mptcp dss ack 1969141162], length 0
20:39:31.637410 IP 112.26.1.8.42049 > 112.26.1.1.37653: Flags [.], ack 12853, win 11680, options [nop,nop,TS val 787400 ecr 1004417,nop,nop,sack 2 {22849:38557}{14281:21421},mptcp dss ack 1969141162], length 0
20:39:31.688301 IP 112.26.1.8.42049 > 112.26.1.1.37653: Flags [.], ack 12853, win 10859, options [nop,nop,TS val 786704 ecr 1004417,nop,nop,sack 2 {22849:31417}{14281:21421},mptcp dss ack 1969139734], length 0
20:39:31.790488 IP 112.26.1.8.42049 > 112.26.1.1.37653: Flags [.], ack 12853, win 10996, options [nop,nop,TS val 786844 ecr 1004417,nop,nop,sack 2 {22849:32845}{14281:21421},mptcp dss ack 1969139734], length 0
20:39:31.875111 IP 112.26.1.1.37653 > 112.26.1.8.42049: Flags [.], seq 39985:41413, ack 1, win 4017, options [nop,nop,TS val 1006877 ecr 785271,mptcp dss ack 4241485850 seq 1969276822 subseq 39985 len 1428 csum 0x43ec], length 1428
20:39:31.878702 IP 112.26.1.1.37653 > 112.26.1.8.42049: Flags [.], seq 39985:41413, ack 1, win 4017, options [nop,nop,TS val 1006877 ecr 785271,mptcp dss ack 4241485850 seq 1969276822 subseq 39985 len 1428 csum 0x43ec], length 1428
20:39:31.881551 IP 112.26.1.8.42049 > 112.26.1.1.37653: Flags [.], ack 12853, win 11909, options [nop,nop,TS val 787656 ecr 1004417,nop,nop,sack 2 {39985:41413}{22849:38557},mptcp dss ack 1969141162], length 0
20:39:31.887213 IP 112.26.1.8.42049 > 112.26.1.1.37653: Flags [.], ack 12853, win 11909, options [nop,nop,TS val 787656 ecr 1004417,nop,nop,sack 2 {39985:41413}{22849:38557},mptcp dss ack 1969141162], length 0
20:39:31.915715 IP 112.26.1.8.42049 > 112.26.1.1.37653: Flags [.], ack 12853, win 11179, options [nop,nop,TS val 787009 ecr 1004417,nop,nop,sack 2 {22849:34273}{14281:21421},mptcp dss ack 1969141162], length 0
20:39:32.010485 IP 112.26.1.1.37653 > 112.26.1.8.42049: Flags [.], seq 12853:14281, ack 1, win 4017, options [nop,nop,TS val 1007083 ecr 785515,mptcp dss ack 4241485850 seq 1969186858 subseq 12853 len 1428 csum 0x9ad2], length 1428
20:39:32.014597 IP 112.26.1.1.37653 > 112.26.1.8.42049: Flags [.], seq 12853:14281, ack 1, win 4017, options [nop,nop,TS val 1007083 ecr 785515,mptcp dss ack 4241485850 seq 1969186858 subseq 12853 len 1428 csum 0x9ad2], length 1428
20:39:32.017554 IP 112.26.1.8.42049 > 112.26.1.1.37653: Flags [.], ack 21421, win 12091, options [nop,nop,TS val 787792 ecr 1007083,nop,nop,sack 2 {39985:41413}{22849:38557},mptcp dss ack 1969141162], length 0
20:39:32.036170 IP 112.26.1.8.42049 > 112.26.1.1.37653: Flags [.], ack 12853, win 11361, options [nop,nop,TS val 787154 ecr 1004417,nop,nop,sack 2 {22849:35701}{14281:21421},mptcp dss ack 1969141162], length 0
20:39:32.069667 IP 112.26.1.8.42049 > 112.26.1.1.37653: Flags [.], ack 21421, win 12091, options [nop,nop,TS val 787792 ecr 1007083,nop,nop,sack 2 {39985:41413}{22849:38557},mptcp dss ack 1969141162], length 0
20:39:32.137005 IP 112.26.1.1.37653 > 112.26.1.8.42049: Flags [.], seq 42841:44269, ack 1, win 4017, options [nop,nop,TS val 1007297 ecr 785619,mptcp dss ack 4241485850 seq 1969288246 subseq 42841 len 1428 csum 0x8739], length 1428
20:39:32.140903 IP 112.26.1.1.37653 > 112.26.1.8.42049: Flags [.], seq 42841:44269, ack 1, win 4017, options [nop,nop,TS val 1007297 ecr 785619,mptcp dss ack 4241485850 seq 1969288246 subseq 42841 len 1428 csum 0x8739], length 1428
20:39:32.156344 IP 112.26.1.8.42049 > 112.26.1.1.37653: Flags [.], ack 12853, win 11498, options [nop,nop,TS val 787265 ecr 1004417,nop,nop,sack 2 {22849:37129}{14281:21421},mptcp dss ack 1969141162], length 0
20:39:32.162082 IP 112.26.1.8.42049 > 112.26.1.1.37653: Flags [.], ack 21421, win 12274, options [nop,nop,TS val 787918 ecr 1007083,nop,nop,sack 2 {42841:44269}{39985:41413},mptcp dss ack 1969141162], length 0
20:39:32.176201 IP 112.26.1.8.42049 > 112.26.1.1.37653: Flags [.], ack 21421, win 12274, options [nop,nop,TS val 787918 ecr 1007083,nop,nop,sack 2 {42841:44269}{39985:41413},mptcp dss ack 1969141162], length 0
20:39:32.251248 IP 112.26.1.1.37653 > 112.26.1.8.42049: Flags [.], seq 21421:22849, ack 1, win 4017, options [nop,nop,TS val 1007496 ecr 785957,mptcp dss ack 4241485850 seq 1969215418 subseq 21421 len 1428 csum 0xf555], length 1428
20:39:32.297109 IP 112.26.1.1.37653 > 112.26.1.8.42049: Flags [.], seq 21421:22849, ack 1, win 4017, options [nop,nop,TS val 1007496 ecr 785957,mptcp dss ack 4241485850 seq 1969215418 subseq 21421 len 1428 csum 0xf555], length 1428
20:39:32.306139 IP 112.26.1.8.42049 > 112.26.1.1.37653: Flags [.], ack 38557, win 12456, options [nop,nop,TS val 788074 ecr 1007496,nop,nop,sack 2 {42841:44269}{39985:41413},mptcp dss ack 1969141162], length 0
20:39:32.309355 IP 112.26.1.8.42049 > 112.26.1.1.37653: Flags [.], ack 38557, win 12456, options [nop,nop,TS val 788074 ecr 1007496,nop,nop,sack 2 {42841:44269}{39985:41413},mptcp dss ack 1969141162], length 0
20:39:32.338248 IP 112.26.1.8.42049 > 112.26.1.1.37653: Flags [.], ack 12853, win 11680, options [nop,nop,TS val 787400 ecr 1004417,nop,nop,sack 2 {22849:38557}{14281:21421},mptcp dss ack 1969141162], length 0
20:39:32.413224 IP 112.26.1.1.37653 > 112.26.1.8.42049: Flags [.], seq 44269:45697, ack 1, win 4017, options [nop,nop,TS val 1007640 ecr 786273,mptcp dss ack 4241485850 seq 1969303954 subseq 44269 len 1428 csum 0x24f2], length 1428
20:39:32.416326 IP 112.26.1.1.37653 > 112.26.1.8.42049: Flags [.], seq 44269:45697, ack 1, win 4017, options [nop,nop,TS val 1007640 ecr 786273,mptcp dss ack 4241485850 seq 1969303954 subseq 44269 len 1428 csum 0x24f2], length 1428
20:39:32.418637 IP 112.26.1.8.42049 > 112.26.1.1.37653: Flags [.], ack 38557, win 12593, options [nop,nop,TS val 788193 ecr 1007496,nop,nop,sack 2 {42841:45697}{39985:41413},mptcp dss ack 1969141162], length 0
20:39:32.436757 IP 112.26.1.8.42049 > 112.26.1.1.37653: Flags [.], ack 38557, win 12593, options [nop,nop,TS val 788193 ecr 1007496,nop,nop,sack 2 {42841:45697}{39985:41413},mptcp dss ack 1969141162], length 0
20:39:32.477498 IP 112.26.1.8.42049 > 112.26.1.1.37653: Flags [.], ack 12853, win 11909, options [nop,nop,TS val 787656 ecr 1004417,nop,nop,sack 2 {39985:41413}{22849:38557},mptcp dss ack 1969141162], length 0
20:39:32.577845 IP 112.26.1.8.42049 > 112.26.1.1.37653: Flags [.], ack 21421, win 12091, options [nop,nop,TS val 787792 ecr 1007083,nop,nop,sack 2 {39985:41413}{22849:38557},mptcp dss ack 1969141162], length 0
20:39:32.608021 IP 112.26.1.1.37653 > 112.26.1.8.42049: Flags [.], seq 47125:48553, ack 1, win 4017, options [nop,nop,TS val 1007913 ecr 786495,mptcp dss ack 4241485850 seq 1969313950 subseq 47125 len 1428 csum 0x4359], length 1428
20:39:32.613722 IP 112.26.1.1.37653 > 112.26.1.8.42049: Flags [.], seq 47125:48553, ack 1, win 4017, options [nop,nop,TS val 1007913 ecr 786495,mptcp dss ack 4241485850 seq 1969313950 subseq 47125 len 1428 csum 0x4359], length 1428
20:39:32.620124 IP 112.26.1.8.42049 > 112.26.1.1.37653: Flags [.], ack 38557, win 12867, options [nop,nop,TS val 788391 ecr 1007496,nop,nop,sack 2 {47125:48553}{42841:45697},mptcp dss ack 1969216846], length 0
20:39:32.628640 IP 112.26.1.8.42049 > 112.26.1.1.37653: Flags [.], ack 38557, win 12867, options [nop,nop,TS val 788391 ecr 1007496,nop,nop,sack 2 {47125:48553}{42841:45697},mptcp dss ack 1969216846], length 0
20:39:32.677888 IP 112.26.1.8.42049 > 112.26.1.1.37653: Flags [.], ack 21421, win 12274, options [nop,nop,TS val 787918 ecr 1007083,nop,nop,sack 2 {42841:44269}{39985:41413},mptcp dss ack 1969141162], length 0
20:39:32.749715 IP 112.26.1.1.37653 > 112.26.1.8.42049: Flags [.], seq 48553:49981, ack 1, win 4017, options [nop,nop,TS val 1008102 ecr 786601,mptcp dss ack 4241485850 seq 1969318234 subseq 48553 len 1428 csum 0xbad8], length 1428
20:39:32.753409 IP 112.26.1.1.37653 > 112.26.1.8.42049: Flags [.], seq 48553:49981, ack 1, win 4017, options [nop,nop,TS val 1008102 ecr 786601,mptcp dss ack 4241485850 seq 1969318234 subseq 48553 len 1428 csum 0xbad8], length 1428
20:39:32.755140 IP 112.26.1.8.42049 > 112.26.1.1.37653: Flags [.], ack 38557, win 13004, options [nop,nop,TS val 788530 ecr 1007496,nop,nop,sack 2 {47125:49981}{42841:45697},mptcp dss ack 1969216846], length 0
20:39:32.766508 IP 112.26.1.8.42049 > 112.26.1.1.37653: Flags [.], ack 38557, win 13004, options [nop,nop,TS val 788530 ecr 1007496,nop,nop,sack 2 {47125:49981}{42841:45697},mptcp dss ack 1969216846], length 0
20:39:32.805943 IP 112.26.1.8.42049 > 112.26.1.1.37653: Flags [.], ack 38557, win 12456, options [nop,nop,TS val 788074 ecr 1007496,nop,nop,sack 2 {42841:44269}{39985:41413},mptcp dss ack 1969141162], length 0
20:39:32.847388 IP 112.26.1.1.37653 > 112.26.1.8.42049: Flags [.], seq 49981:51409, ack 1, win 4017, options [nop,nop,TS val 1008351 ecr 786844,mptcp dss ack 4241485850 seq 1969322518 subseq 49981 len 1428 csum 0xf8b9], length 1428
20:39:32.897461 IP 112.26.1.1.37653 > 112.26.1.8.42049: Flags [.], seq 49981:51409, ack 1, win 4017, options [nop,nop,TS val 1008351 ecr 786844,mptcp dss ack 4241485850 seq 1969322518 subseq 49981 len 1428 csum 0xf8b9], length 1428
20:39:32.900273 IP 112.26.1.8.42049 > 112.26.1.1.37653: Flags [.], ack 38557, win 13140, options [nop,nop,TS val 788675 ecr 1007496,nop,nop,sack 2 {47125:51409}{42841:45697},mptcp dss ack 1969216846], length 0
20:39:32.902399 IP 112.26.1.8.42049 > 112.26.1.1.37653: Flags [.], ack 38557, win 13140, options [nop,nop,TS val 788675 ecr 1007496,nop,nop,sack 2 {47125:51409}{42841:45697},mptcp dss ack 1969216846], length 0
20:39:32.948810 IP 112.26.1.8.42049 > 112.26.1.1.37653: Flags [.], ack 38557, win 12593, options [nop,nop,TS val 788193 ecr 1007496,nop,nop,sack 2 {42841:45697}{39985:41413},mptcp dss ack 1969141162], length 0
20:39:32.974361 IP 112.26.1.1.37653 > 112.26.1.8.42049: Flags [.], seq 51409:52837, ack 1, win 4017, options [nop,nop,TS val 1008505 ecr 787009,mptcp dss ack 4241485850 seq 1969326802 subseq 51409 len 1428 csum 0xa1aa], length 1428
20:39:33.015004 IP 112.26.1.1.37653 > 112.26.1.8.42049: Flags [.], seq 51409:52837, ack 1, win 4017, options [nop,nop,TS val 1008505 ecr 787009,mptcp dss ack 4241485850 seq 1969326802 subseq 51409 len 1428 csum 0xa1aa], length 1428
20:39:33.017074 IP 112.26.1.8.42049 > 112.26.1.1.37653: Flags [.], ack 38557, win 13277, options [nop,nop,TS val 788793 ecr 1007496,nop,nop,sack 2 {47125:52837}{42841:45697},mptcp dss ack 1969216846], length 0
20:39:33.029282 IP 112.26.1.8.42049 > 112.26.1.1.37653: Flags [.], ack 38557, win 13277, options [nop,nop,TS val 788793 ecr 1007496,nop,nop,sack 2 {47125:52837}{42841:45697},mptcp dss ack 1969216846], length 0
20:39:33.099240 IP 112.26.1.1.37653 > 112.26.1.8.42049: Flags [.], seq 52837:54265, ack 1, win 4017, options [nop,nop,TS val 1008888 ecr 787400,mptcp dss ack 4241485850 seq 1969336798 subseq 52837 len 1428 csum 0xf1ba], length 1428
20:39:33.102461 IP 112.26.1.8.42049 > 112.26.1.1.37653: Flags [.], ack 38557, win 12867, options [nop,nop,TS val 788391 ecr 1007496,nop,nop,sack 2 {47125:48553}{42841:45697},mptcp dss ack 1969216846], length 0
20:39:33.169649 IP 112.26.1.1.37653 > 112.26.1.8.42049: Flags [.], seq 38557:39985, ack 1, win 4017, options [nop,nop,TS val 1009013 ecr 787656,mptcp dss ack 4241485850 seq 1969273966 subseq 38557 len 1428 csum 0x2ec8], length 1428
20:39:33.193995 IP 112.26.1.8.42049 > 112.26.1.1.37653: Flags [.], ack 38557, win 13004, options [nop,nop,TS val 788530 ecr 1007496,nop,nop,sack 2 {47125:49981}{42841:45697},mptcp dss ack 1969216846], length 0
20:39:33.218245 IP 112.26.1.1.37653 > 112.26.1.8.42049: Flags [.], seq 52837:54265, ack 1, win 4017, options [nop,nop,TS val 1008888 ecr 787400,mptcp dss ack 4241485850 seq 1969336798 subseq 52837 len 1428 csum 0xf1ba], length 1428
20:39:33.219825 IP 112.26.1.8.42049 > 112.26.1.1.37653: Flags [.], ack 38557, win 13414, options [nop,nop,TS val 788996 ecr 1007496,nop,nop,sack 2 {47125:54265}{42841:45697},mptcp dss ack 1969216846], length 0
20:39:33.247150 IP 112.26.1.8.42049 > 112.26.1.1.37653: Flags [.], ack 38557, win 13414, options [nop,nop,TS val 788996 ecr 1007496,nop,nop,sack 2 {47125:54265}{42841:45697},mptcp dss ack 1969216846], length 0
20:39:33.291255 IP 112.26.1.1.37653 > 112.26.1.8.42049: Flags [.], seq 41413:42841, ack 1, win 4017, options [nop,nop,TS val 1009113 ecr 787792,mptcp dss ack 4241485850 seq 1969278250 subseq 41413 len 1428 csum 0xdd27], length 1428
20:39:33.310824 IP 112.26.1.1.37653 > 112.26.1.8.42049: Flags [.], seq 38557:39985, ack 1, win 4017, options [nop,nop,TS val 1009013 ecr 787656,mptcp dss ack 4241485850 seq 1969273966 subseq 38557 len 1428 csum 0x2ec8], length 1428
20:39:33.332549 IP 112.26.1.8.42049 > 112.26.1.1.37653: Flags [.], ack 38557, win 13140, options [nop,nop,TS val 788675 ecr 1007496,nop,nop,sack 2 {47125:51409}{42841:45697},mptcp dss ack 1969216846], length 0
20:39:33.368479 IP 112.26.1.8.42049 > 112.26.1.1.37653: Flags [.], ack 41413, win 13551, options [nop,nop,TS val 789088 ecr 1009013,nop,nop,sack 2 {47125:54265}{42841:45697},mptcp dss ack 1969216846], length 0
