20:39:27.396212 IP 112.26.2.8.37285 > 112.26.2.1.37653: Flags [S], seq 2148104843, win 65535, options [mss 1460,sackOK,TS val 783149 ecr 0,nop,wscale 6,mptcp join id 4 token 0xbaf08251 nonce 0x3c20d384], length 0
20:39:27.468783 IP 112.26.2.8.37285 > 112.26.2.1.37653: Flags [S], seq 2148104843, win 65535, options [mss 1460,sackOK,TS val 783149 ecr 0,nop,wscale 6,mptcp join id 4 token 0xbaf08251 nonce 0x3c20d384], length 0
20:39:27.522798 IP 112.26.2.8.37285 > 112.26.2.1.37653: Flags [S], seq 2148104843, win 65535, options [mss 1460,sackOK,TS val 783149 ecr 0,nop,wscale 6,mptcp join id 4 token 0xbaf08251 nonce 0x3c20d384], length 0
20:39:27.652044 IP 112.26.2.1.37653 > 112.26.2.8.37285: Flags [S.], seq 3200878076, ack 2148104844, win 65535, options [mss 1460,sackOK,TS val 1004059 ecr 783149,nop,wscale 6,mptcp join id 6 hmac 0x450d05b33f62c7b2 nonce 0xf10cd68], length 0
20:39:27.709166 IP 112.26.2.1.37653 > 112.26.2.8.37285: Flags [S.], seq 3200878076, ack 2148104844, win 65535, options [mss 1460,sackOK,TS val 1004059 ecr 783149,nop,wscale 6,mptcp join id 6 hmac 0x450d05b33f62c7b2 nonce 0xf10cd68], length 0
20:39:27.771947 IP 112.26.2.8.37285 > 112.26.2.1.37653: Flags [.], ack 1, win 7255, options [nop,nop,TS val 783489 ecr 1004059,mptcp join hmac 0xef5b1985bf342f402ce85f397d899e733c9b0aa7], length 0
20:39:27.788009 IP 112.26.2.1.37653 > 112.26.2.8.37285: Flags [.], ack 1, win 4017, options [nop,nop,TS val 1004313 ecr 783489,mptcp dss ack 4241485850], length 0
20:39:27.788348 IP 112.26.2.1.37653 > 112.26.2.8.37285: Flags [.], ack 1, win 4017, options [nop,nop,TS val 1004313 ecr 783489,mptcp dss ack 4241485850], length 0
20:39:27.929550 IP 112.26.2.1.37653 > 112.26.2.8.37285: Flags [.], seq 1:1429, ack 1, win 4017, options [nop,nop,TS val 1004313 ecr 783489,mptcp dss ack 4241485850 seq 1969144018 subseq 1 len 1428 csum 0x2245], length 1428
20:39:27.929875 IP 112.26.2.1.37653 > 112.26.2.8.37285: Flags [.], seq 1:1429, ack 1, win 4017, options [nop,nop,TS val 1004313 ecr 783489,mptcp dss ack 4241485850 seq 1969144018 subseq 1 len 1428 csum 0x2245], length 1428
20:39:27.934623 IP 112.26.2.8.37285 > 112.26.2.1.37653: Flags [.], ack 1429, win 7437, options [nop,nop,TS val 783710 ecr 1004313,mptcp dss ack 1969125454], length 0
20:39:28.236370 IP 112.26.2.1.37653 > 112.26.2.8.37285: Flags [.], seq 1429:2857, ack 1, win 4017, options [nop,nop,TS val 1004313 ecr 783489,mptcp dss ack 4241485850 seq 1969145446 subseq 1429 len 1428 csum 0xa778], length 1428
20:39:28.236693 IP 112.26.2.1.37653 > 112.26.2.8.37285: Flags [.], seq 1429:2857, ack 1, win 4017, options [nop,nop,TS val 1004313 ecr 783489,mptcp dss ack 4241485850 seq 1969145446 subseq 1429 len 1428 csum 0xa778], length 1428
20:39:28.243925 IP 112.26.2.8.37285 > 112.26.2.1.37653: Flags [.], ack 2857, win 7665, options [nop,nop,TS val 784020 ecr 1004313,mptcp dss ack 1969126882], length 0
20:39:28.377838 IP 112.26.2.1.37653 > 112.26.2.8.37285: Flags [.], seq 2857:4285, ack 1, win 4017, options [nop,nop,TS val 1004314 ecr 783489,mptcp dss ack 4241485850 seq 1969146874 subseq 2857 len 1428 csum 0xcb39], length 1428
20:39:28.378143 IP 112.26.2.1.37653 > 112.26.2.8.37285: Flags [.], seq 2857:4285, ack 1, win 4017, options [nop,nop,TS val 1004314 ecr 783489,mptcp dss ack 4241485850 seq 1969146874 subseq 2857 len 1428 csum 0xcb39], length 1428
20:39:28.400262 IP 112.26.2.8.37285 > 112.26.2.1.37653: Flags [.], ack 4285, win 7894, options [nop,nop,TS val 784176 ecr 1004314,mptcp dss ack 1969134022], length 0
20:39:28.608982 IP 112.26.2.1.37653 > 112.26.2.8.37285: Flags [.], seq 4285:5713, ack 1, win 4017, options [nop,nop,TS val 1004314 ecr 783489,mptcp dss ack 4241485850 seq 1969148302 subseq 4285 len 1428 csum 0xf9b4], length 1428
20:39:28.609310 IP 112.26.2.1.37653 > 112.26.2.8.37285: Flags [.], seq 4285:5713, ack 1, win 4017, options [nop,nop,TS val 1004314 ecr 783489,mptcp dss ack 4241485850 seq 1969148302 subseq 4285 len 1428 csum 0xf9b4], length 1428
20:39:28.612981 IP 112.26.2.8.37285 > 112.26.2.1.37653: Flags [.], ack 5713, win 8030, options [nop,nop,TS val 784389 ecr 1004314,mptcp dss ack 1969136878], length 0
20:39:28.693375 IP 112.26.2.1.37653 > 112.26.2.8.37285: Flags [.], seq 5713:7141, ack 1, win 4017, options [nop,nop,TS val 1004314 ecr 783489,mptcp dss ack 4241485850 seq 1969149730 subseq 5713 len 1428 csum 0xac3d], length 1428
20:39:28.693698 IP 112.26.2.1.37653 > 112.26.2.8.37285: Flags [.], seq 5713:7141, ack 1, win 4017, options [nop,nop,TS val 1004314 ecr 783489,mptcp dss ack 4241485850 seq 1969149730 subseq 5713 len 1428 csum 0xac3d], length 1428
20:39:28.697505 IP 112.26.2.8.37285 > 112.26.2.1.37653: Flags [.], ack 7141, win 8122, options [nop,nop,TS val 784473 ecr 1004314,mptcp dss ack 1969136878], length 0
20:39:28.825950 IP 112.26.2.1.37653 > 112.26.2.8.37285: Flags [.], seq 7141:8569, ack 1, win 4017, options [nop,nop,TS val 1004314 ecr 783489,mptcp dss ack 4241485850 seq 1969151158 subseq 7141 len 1428 csum 0x9a44], length 1428
20:39:28.826293 IP 112.26.2.1.37653 > 112.26.2.8.37285: Flags [.], seq 7141:8569, ack 1, win 4017, options [nop,nop,TS val 1004314 ecr 783489,mptcp dss ack 4241485850 seq 1969151158 subseq 7141 len 1428 csum 0x9a44], length 1428
20:39:28.831038 IP 112.26.2.8.37285 > 112.26.2.1.37653: Flags [.], ack 8569, win 8259, options [nop,nop,TS val 784606 ecr 1004314,mptcp dss ack 1969138306], length 0
20:39:28.999829 IP 112.26.2.1.37653 > 112.26.2.8.37285: Flags [.], seq 8569:9997, ack 1, win 4017, options [nop,nop,TS val 1004314 ecr 783489,mptcp dss ack 4241485850 seq 1969152586 subseq 8569 len 1428 csum 0x490d], length 1428
20:39:29.000175 IP 112.26.2.1.37653 > 112.26.2.8.37285: Flags [.], seq 8569:9997, ack 1, win 4017, options [nop,nop,TS val 1004314 ecr 783489,mptcp dss ack 4241485850 seq 1969152586 subseq 8569 len 1428 csum 0x490d], length 1428
20:39:29.004803 IP 112.26.2.8.37285 > 112.26.2.1.37653: Flags [.], ack 9997, win 8487, options [nop,nop,TS val 784780 ecr 1004314,mptcp dss ack 1969139734], length 0
20:39:29.106531 IP 112.26.2.1.37653 > 112.26.2.8.37285: Flags [.], seq 9997:11425, ack 1, win 4017, options [nop,nop,TS val 1004314 ecr 783489,mptcp dss ack 4241485850 seq 1969154014 subseq 9997 len 1428 csum 0xc1fb], length 1428
20:39:29.106766 IP 112.26.2.1.37653 > 112.26.2.8.37285: Flags [.], seq 9997:11425, ack 1, win 4017, options [nop,nop,TS val 1004314 ecr 783489,mptcp dss ack 4241485850 seq 1969154014 subseq 9997 len 1428 csum 0xc1fb], length 1428
20:39:29.130256 IP 112.26.2.8.37285 > 112.26.2.1.37653: Flags [.], ack 11425, win 8624, options [nop,nop,TS val 784896 ecr 1004314,mptcp dss ack 1969139734], length 0
20:39:29.274724 IP 112.26.2.1.37653 > 112.26.2.8.37285: Flags [.], seq 11425:12853, ack 1, win 4017, options [nop,nop,TS val 1004314 ecr 783489,mptcp dss ack 4241485850 seq 1969155442 subseq 11425 len 1428 csum 0xb869], length 1428
20:39:29.275019 IP 112.26.2.1.37653 > 112.26.2.8.37285: Flags [.], seq 11425:12853, ack 1, win 4017, options [nop,nop,TS val 1004314 ecr 783489,mptcp dss ack 4241485850 seq 1969155442 subseq 11425 len 1428 csum 0xb869], length 1428
20:39:29.280190 IP 112.26.2.8.37285 > 112.26.2.1.37653: Flags [.], ack 12853, win 8806, options [nop,nop,TS val 785055 ecr 1004314,mptcp dss ack 1969139734], length 0
20:39:29.382345 IP 112.26.2.1.37653 > 112.26.2.8.37285: Flags [.], seq 12853:14281, ack 1, win 4017, options [nop,nop,TS val 1004315 ecr 783489,mptcp dss ack 4241485850 seq 1969156870 subseq 12853 len 1428 csum 0xbd12], length 1428
20:39:29.382668 IP 112.26.2.1.37653 > 112.26.2.8.37285: Flags [.], seq 12853:14281, ack 1, win 4017, options [nop,nop,TS val 1004315 ecr 783489,mptcp dss ack 4241485850 seq 1969156870 subseq 12853 len 1428 csum 0xbd12], length 1428
20:39:29.400191 IP 112.26.2.8.37285 > 112.26.2.1.37653: Flags [.], ack 14281, win 8943, options [nop,nop,TS val 785176 ecr 1004315,mptcp dss ack 1969139734], length 0
20:39:29.531886 IP 112.26.2.1.37653 > 112.26.2.8.37285: Flags [.], seq 14281:15709, ack 1, win 4017, options [nop,nop,TS val 1004577 ecr 783710,mptcp dss ack 4241485850 seq 1969189714 subseq 14281 len 1428 csum 0xd683], length 1428
20:39:29.532148 IP 112.26.2.1.37653 > 112.26.2.8.37285: Flags [.], seq 14281:15709, ack 1, win 4017, options [nop,nop,TS val 1004577 ecr 783710,mptcp dss ack 4241485850 seq 1969189714 subseq 14281 len 1428 csum 0xd683], length 1428
20:39:29.544596 IP 112.26.2.8.37285 > 112.26.2.1.37653: Flags [.], ack 15709, win 9125, options [nop,nop,TS val 785318 ecr 1004577,mptcp dss ack 1969139734], length 0
20:39:29.629973 IP 112.26.2.1.37653 > 112.26.2.8.37285: Flags [.], seq 15709:17137, ack 1, win 4017, options [nop,nop,TS val 1004577 ecr 783710,mptcp dss ack 4241485850 seq 1969191142 subseq 15709 len 1428 csum 0x816a], length 1428
20:39:29.630303 IP 112.26.2.1.37653 > 112.26.2.8.37285: Flags [.], seq 15709:17137, ack 1, win 4017, options [nop,nop,TS val 1004577 ecr 783710,mptcp dss ack 4241485850 seq 1969191142 subseq 15709 len 1428 csum 0x816a], length 1428
20:39:29.664408 IP 112.26.2.8.37285 > 112.26.2.1.37653: Flags [.], ack 17137, win 9308, options [nop,nop,TS val 785414 ecr 1004577,mptcp dss ack 1969139734], length 0
20:39:29.821292 IP 112.26.2.1.37653 > 112.26.2.8.37285: Flags [.], seq 17137:18565, ack 1, win 4017, options [nop,nop,TS val 1004860 ecr 784020,mptcp dss ack 4241485850 seq 1969208278 subseq 17137 len 1428 csum 0x6a], length 1428
20:39:29.821587 IP 112.26.2.1.37653 > 112.26.2.8.37285: Flags [.], seq 17137:18565, ack 1, win 4017, options [nop,nop,TS val 1004860 ecr 784020,mptcp dss ack 4241485850 seq 1969208278 subseq 17137 len 1428 csum 0x6a], length 1428
20:39:29.826518 IP 112.26.2.8.37285 > 112.26.2.1.37653: Flags [.], ack 18565, win 9490, options [nop,nop,TS val 785602 ecr 1004860,mptcp dss ack 1969139734], length 0
20:39:29.900780 IP 112.26.2.1.37653 > 112.26.2.8.37285: Flags [.], seq 18565:19993, ack 1, win 4017, options [nop,nop,TS val 1004860 ecr 784020,mptcp dss ack 4241485850 seq 1969209706 subseq 18565 len 1428 csum 0xca06], length 1428
20:39:29.901087 IP 112.26.2.1.37653 > 112.26.2.8.37285: Flags [.], seq 18565:19993, ack 1, win 4017, options [nop,nop,TS val 1004860 ecr 784020,mptcp dss ack 4241485850 seq 1969209706 subseq 18565 len 1428 csum 0xca06], length 1428
20:39:29.950607 IP 112.26.2.8.37285 > 112.26.2.1.37653: Flags [.], ack 19993, win 9627, options [nop,nop,TS val 785726 ecr 1004860,mptcp dss ack 1969139734], length 0
20:39:30.065753 IP 112.26.2.1.37653 > 112.26.2.8.37285: Flags [.], seq 21421:22849, ack 1, win 4017, options [nop,nop,TS val 1004990 ecr 784176,mptcp dss ack 4241485850 seq 1969218274 subseq 21421 len 1428 csum 0xf41f], length 1428
20:39:30.066046 IP 112.26.2.1.37653 > 112.26.2.8.37285: Flags [.], seq 21421:22849, ack 1, win 4017, options [nop,nop,TS val 1004990 ecr 784176,mptcp dss ack 4241485850 seq 1969218274 subseq 21421 len 1428 csum 0xf41f], length 1428
20:39:30.094925 IP 112.26.2.8.37285 > 112.26.2.1.37653: Flags [.], ack 19993, win 9810, options [nop,nop,TS val 785845 ecr 1004860,nop,nop,sack 1 {21421:22849},mptcp dss ack 1969139734], length 0
20:39:30.140804 IP 112.26.2.8.37285 > 112.26.2.1.37653: Flags [.], ack 11425, win 8624, options [nop,nop,TS val 784896 ecr 1004314,mptcp dss ack 1969139734], length 0
20:39:30.230407 IP 112.26.2.8.37285 > 112.26.2.1.37653: Flags [.], ack 19993, win 9947, options [nop,nop,TS val 786006 ecr 1004860,nop,nop,sack 2 {29989:31417}{21421:22849},mptcp dss ack 1969139734], length 0
20:39:30.272997 IP 112.26.2.1.37653 > 112.26.2.8.37285: Flags [.], seq 24277:25705, ack 1, win 4017, options [nop,nop,TS val 1005207 ecr 784389,mptcp dss ack 4241485850 seq 1969226842 subseq 24277 len 1428 csum 0x9b78], length 1428
20:39:30.273310 IP 112.26.2.1.37653 > 112.26.2.8.37285: Flags [.], seq 24277:25705, ack 1, win 4017, options [nop,nop,TS val 1005207 ecr 784389,mptcp dss ack 4241485850 seq 1969226842 subseq 24277 len 1428 csum 0x9b78], length 1428
20:39:30.350695 IP 112.26.2.8.37285 > 112.26.2.1.37653: Flags [.], ack 19993, win 9992, options [nop,nop,TS val 786053 ecr 1004860,nop,nop,sack 2 {24277:25705}{29989:31417},mptcp dss ack 1969139734], length 0
20:39:30.485386 IP 112.26.2.8.37285 > 112.26.2.1.37653: Flags [.], ack 15709, win 9125, options [nop,nop,TS val 785318 ecr 1004577,mptcp dss ack 1969139734], length 0
20:39:30.588746 IP 112.26.2.1.37653 > 112.26.2.8.37285: Flags [.], seq 28561:29989, ack 1, win 4017, options [nop,nop,TS val 1005484 ecr 784606,mptcp dss ack 4241485850 seq 1969243978 subseq 28561 len 1428 csum 0x9aa4], length 1428
20:39:30.589008 IP 112.26.2.1.37653 > 112.26.2.8.37285: Flags [.], seq 28561:29989, ack 1, win 4017, options [nop,nop,TS val 1005484 ecr 784606,mptcp dss ack 4241485850 seq 1969243978 subseq 28561 len 1428 csum 0x9aa4], length 1428
20:39:30.627395 IP 112.26.2.8.37285 > 112.26.2.1.37653: Flags [.], ack 19993, win 10494, options [nop,nop,TS val 786398 ecr 1004860,nop,nop,sack 2 {28561:31417}{24277:25705},mptcp dss ack 1969139734], length 0
20:39:30.722861 IP 112.26.2.8.37285 > 112.26.2.1.37653: Flags [.], ack 19993, win 10540, options [nop,nop,TS val 786426 ecr 1004860,nop,nop,sack 2 {28561:32845}{24277:25705},mptcp dss ack 1969139734], length 0
20:39:30.780104 IP 112.26.2.8.37285 > 112.26.2.1.37653: Flags [.], ack 18565, win 9490, options [nop,nop,TS val 785602 ecr 1004860,mptcp dss ack 1969139734], length 0
20:39:30.801807 IP 112.26.2.8.37285 > 112.26.2.1.37653: Flags [.], ack 19993, win 10631, options [nop,nop,TS val 786538 ecr 1004860,nop,nop,sack 2 {28561:34273}{24277:25705},mptcp dss ack 1969139734], length 0
20:39:30.901700 IP 112.26.2.8.37285 > 112.26.2.1.37653: Flags [.], ack 19993, win 9627, options [nop,nop,TS val 785726 ecr 1004860,mptcp dss ack 1969139734], length 0
20:39:30.994252 IP 112.26.2.8.37285 > 112.26.2.1.37653: Flags [.], ack 19993, win 9810, options [nop,nop,TS val 785845 ecr 1004860,nop,nop,sack 1 {21421:22849},mptcp dss ack 1969139734], length 0
20:39:31.076141 IP 112.26.2.8.37285 > 112.26.2.1.37653: Flags [.], ack 19993, win 11042, options [nop,nop,TS val 786851 ecr 1004860,nop,nop,sack 2 {28561:35701}{24277:25705},mptcp dss ack 1969139734], length 0
20:39:31.104852 IP 112.26.2.8.37285 > 112.26.2.1.37653: Flags [.], ack 19993, win 9947, options [nop,nop,TS val 786006 ecr 1004860,nop,nop,sack 2 {29989:31417}{21421:22849},mptcp dss ack 1969139734], length 0
20:39:31.203381 IP 112.26.2.8.37285 > 112.26.2.1.37653: Flags [.], ack 19993, win 9992, options [nop,nop,TS val 786053 ecr 1004860,nop,nop,sack 2 {24277:25705}{29989:31417},mptcp dss ack 1969139734], length 0
20:39:31.352763 IP 112.26.2.8.37285 > 112.26.2.1.37653: Flags [.], ack 19993, win 10494, options [nop,nop,TS val 786398 ecr 1004860,nop,nop,sack 2 {28561:31417}{24277:25705},mptcp dss ack 1969139734], length 0
20:39:31.408474 IP 112.26.2.8.37285 > 112.26.2.1.37653: Flags [.], ack 19993, win 11407, options [nop,nop,TS val 787184 ecr 1004860,nop,nop,sack 2 {28561:37129}{24277:25705},mptcp dss ack 1969141162], length 0
20:39:31.485884 IP 112.26.2.8.37285 > 112.26.2.1.37653: Flags [.], ack 19993, win 10540, options [nop,nop,TS val 786426 ecr 1004860,nop,nop,sack 2 {28561:32845}{24277:25705},mptcp dss ack 1969139734], length 0
20:39:31.528477 IP 112.26.2.8.37285 > 112.26.2.1.37653: Flags [.], ack 19993, win 11589, options [nop,nop,TS val 787304 ecr 1004860,nop,nop,sack 2 {28561:38557}{24277:25705},mptcp dss ack 1969141162], length 0
20:39:31.593868 IP 112.26.2.8.37285 > 112.26.2.1.37653: Flags [.], ack 19993, win 10631, options [nop,nop,TS val 786538 ecr 1004860,nop,nop,sack 2 {28561:34273}{24277:25705},mptcp dss ack 1969139734], length 0
20:39:31.644486 IP 112.26.2.8.37285 > 112.26.2.1.37653: Flags [.], ack 19993, win 11772, options [nop,nop,TS val 787420 ecr 1004860,nop,nop,sack 2 {28561:39985}{24277:25705},mptcp dss ack 1969141162], length 0
20:39:31.762265 IP 112.26.2.8.37285 > 112.26.2.1.37653: Flags [.], ack 19993, win 11042, options [nop,nop,TS val 786851 ecr 1004860,nop,nop,sack 2 {28561:35701}{24277:25705},mptcp dss ack 1969139734], length 0
20:39:31.923208 IP 112.26.2.8.37285 > 112.26.2.1.37653: Flags [.], ack 19993, win 11954, options [nop,nop,TS val 787699 ecr 1004860,nop,nop,sack 2 {28561:41413}{24277:25705},mptcp dss ack 1969141162], length 0
20:39:31.969537 IP 112.26.2.8.37285 > 112.26.2.1.37653: Flags [.], ack 19993, win 11407, options [nop,nop,TS val 787184 ecr 1004860,nop,nop,sack 2 {28561:37129}{24277:25705},mptcp dss ack 1969141162], length 0
20:39:32.079650 IP 112.26.2.8.37285 > 112.26.2.1.37653: Flags [.], ack 19993, win 11589, options [nop,nop,TS val 787304 ecr 1004860,nop,nop,sack 2 {28561:38557}{24277:25705},mptcp dss ack 1969141162], length 0
20:39:32.127121 IP 112.26.2.8.37285 > 112.26.2.1.37653: Flags [.], ack 19993, win 12228, options [nop,nop,TS val 787901 ecr 1004860,nop,nop,sack 2 {28561:42841}{24277:25705},mptcp dss ack 1969141162], length 0
20:39:32.229955 IP 112.26.2.8.37285 > 112.26.2.1.37653: Flags [.], ack 19993, win 11772, options [nop,nop,TS val 787420 ecr 1004860,nop,nop,sack 2 {28561:39985}{24277:25705},mptcp dss ack 1969141162], length 0
20:39:32.249380 IP 112.26.2.8.37285 > 112.26.2.1.37653: Flags [.], ack 19993, win 12410, options [nop,nop,TS val 788021 ecr 1004860,nop,nop,sack 2 {28561:44269}{24277:25705},mptcp dss ack 1969141162], length 0
20:39:32.353235 IP 112.26.2.8.37285 > 112.26.2.1.37653: Flags [.], ack 19993, win 11954, options [nop,nop,TS val 787699 ecr 1004860,nop,nop,sack 2 {28561:41413}{24277:25705},mptcp dss ack 1969141162], length 0
20:39:32.419298 IP 112.26.2.8.37285 > 112.26.2.1.37653: Flags [.], ack 19993, win 12639, options [nop,nop,TS val 788194 ecr 1004860,nop,nop,sack 2 {28561:45697}{24277:25705},mptcp dss ack 1969141162], length 0
20:39:32.546811 IP 112.26.2.8.37285 > 112.26.2.1.37653: Flags [.], ack 19993, win 12775, options [nop,nop,TS val 788300 ecr 1004860,nop,nop,sack 2 {28561:47125}{24277:25705},mptcp dss ack 1969141162], length 0
20:39:32.613419 IP 112.26.2.8.37285 > 112.26.2.1.37653: Flags [.], ack 19993, win 12228, options [nop,nop,TS val 787901 ecr 1004860,nop,nop,sack 2 {28561:42841}{24277:25705},mptcp dss ack 1969141162], length 0
20:39:32.692048 IP 112.26.2.8.37285 > 112.26.2.1.37653: Flags [.], ack 19993, win 12912, options [nop,nop,TS val 788462 ecr 1004860,nop,nop,sack 2 {28561:48553}{24277:25705},mptcp dss ack 1969216846], length 0
20:39:32.872632 IP 112.26.2.8.37285 > 112.26.2.1.37653: Flags [.], ack 19993, win 12410, options [nop,nop,TS val 788021 ecr 1004860,nop,nop,sack 2 {28561:44269}{24277:25705},mptcp dss ack 1969141162], length 0
20:39:32.897068 IP 112.26.2.8.37285 > 112.26.2.1.37653: Flags [.], ack 19993, win 13095, options [nop,nop,TS val 788669 ecr 1004860,nop,nop,sack 2 {28561:49981}{24277:25705},mptcp dss ack 1969216846], length 0
20:39:33.013832 IP 112.26.2.8.37285 > 112.26.2.1.37653: Flags [.], ack 19993, win 12639, options [nop,nop,TS val 788194 ecr 1004860,nop,nop,sack 2 {28561:45697}{24277:25705},mptcp dss ack 1969141162], length 0
20:39:33.103158 IP 112.26.2.8.37285 > 112.26.2.1.37653: Flags [.], ack 19993, win 13323, options [nop,nop,TS val 788877 ecr 1004860,nop,nop,sack 2 {28561:51409}{24277:25705},mptcp dss ack 1969216846], length 0
20:39:33.201653 IP 112.26.2.8.37285 > 112.26.2.1.37653: Flags [.], ack 19993, win 12775, options [nop,nop,TS val 788300 ecr 1004860,nop,nop,sack 2 {28561:47125}{24277:25705},mptcp dss ack 1969141162], length 0
20:39:33.315271 IP 112.26.2.8.37285 > 112.26.2.1.37653: Flags [.], ack 19993, win 13597, options [nop,nop,TS val 789090 ecr 1004860,nop,nop,sack 2 {28561:52837}{24277:25705},mptcp dss ack 1969216846], length 0
20:39:33.486499 IP 112.26.2.8.37285 > 112.26.2.1.37653: Flags [.], ack 19993, win 12912, options [nop,nop,TS val 788462 ecr 1004860,nop,nop,sack 2 {28561:48553}{24277:25705},mptcp dss ack 1969216846], length 0
20:39:33.581127 IP 112.26.2.8.37285 > 112.26.2.1.37653: Flags [.], ack 19993, win 13916, options [nop,nop,TS val 789357 ecr 1004860,nop,nop,sack 2 {28561:54265}{24277:25705},mptcp dss ack 1969216846], length 0
20:39:33.784185 IP 112.26.2.8.37285 > 112.26.2.1.37653: Flags [.], ack 19993, win 13095, options [nop,nop,TS val 788669 ecr 1004860,nop,nop,sack 2 {28561:49981}{24277:25705},mptcp dss ack 1969216846], length 0
20:39:33.885224 IP 112.26.2.8.37285 > 112.26.2.1.37653: Flags [.], ack 19993, win 14235, options [nop,nop,TS val 789660 ecr 1004860,nop,nop,sack 2 {21421:25705}{28561:54265},mptcp dss ack 1969216846], length 0
20:39:33.964393 IP 112.26.2.8.37285 > 112.26.2.1.37653: Flags [.], ack 19993, win 13323, options [nop,nop,TS val 788877 ecr 1004860,nop,nop,sack 2 {28561:51409}{24277:25705},mptcp dss ack 1969216846], length 0
20:39:34.112425 IP 112.26.2.8.37285 > 112.26.2.1.37653: Flags [.], ack 19993, win 14555, options [nop,nop,TS val 789888 ecr 1004860,nop,nop,sack 2 {27133:54265}{21421:25705},mptcp dss ack 1969216846], length 0
20:39:34.244837 IP 112.26.2.8.37285 > 112.26.2.1.37653: Flags [.], ack 19993, win 13597, options [nop,nop,TS val 789090 ecr 1004860,nop,nop,sack 2 {28561:52837}{24277:25705},mptcp dss ack 1969216846], length 0
20:39:34.344441 IP 112.26.2.8.37285 > 112.26.2.1.37653: Flags [.], ack 19993, win 14829, options [nop,nop,TS val 790119 ecr 1004860,nop,nop,sack 2 {57121:58549}{27133:54265},mptcp dss ack 1969216846], length 0
20:39:34.471867 IP 112.26.2.8.37285 > 112.26.2.1.37653: Flags [.], ack 19993, win 14965, options [nop,nop,TS val 790246 ecr 1004860,nop,nop,sack 2 {57121:59977}{27133:54265},mptcp dss ack 1969216846], length 0
20:39:34.595934 IP 112.26.2.8.37285 > 112.26.2.1.37653: Flags [.], ack 19993, win 15102, options [nop,nop,TS val 790355 ecr 1004860,nop,nop,sack 2 {57121:61405}{27133:54265},mptcp dss ack 1969216846], length 0
20:39:34.759647 IP 112.26.2.8.37285 > 112.26.2.1.37653: Flags [.], ack 19993, win 14235, options [nop,nop,TS val 789660 ecr 1004860,nop,nop,sack 2 {21421:25705}{28561:54265},mptcp dss ack 1969216846], length 0
20:39:34.831548 IP 112.26.2.8.37285 > 112.26.2.1.37653: Flags [.], ack 19993, win 15422, options [nop,nop,TS val 790607 ecr 1004860,nop,nop,sack 2 {57121:62833}{27133:54265},mptcp dss ack 1969216846], length 0
20:39:34.920783 IP 112.26.2.8.37285 > 112.26.2.1.37653: Flags [.], ack 19993, win 15604, options [nop,nop,TS val 790694 ecr 1004860,nop,nop,sack 2 {57121:64261}{27133:54265},mptcp dss ack 1969216846], length 0
20:39:35.002110 IP 112.26.2.8.37285 > 112.26.2.1.37653: Flags [.], ack 19993, win 15741, options [nop,nop,TS val 790777 ecr 1004860,nop,nop,sack 2 {57121:65689}{27133:54265},mptcp dss ack 1969216846], length 0
20:39:35.129052 IP 112.26.2.8.37285 > 112.26.2.1.37653: Flags [.], ack 19993, win 15924, options [nop,nop,TS val 790903 ecr 1004860,nop,nop,sack 2 {57121:67117}{27133:54265},mptcp dss ack 1969216846], length 0
20:39:35.325777 IP 112.26.2.8.37285 > 112.26.2.1.37653: Flags [.], ack 19993, win 14965, options [nop,nop,TS val 790246 ecr 1004860,nop,nop,sack 2 {57121:59977}{27133:54265},mptcp dss ack 1969216846], length 0
20:39:35.399272 IP 112.26.2.8.37285 > 112.26.2.1.37653: Flags [.], ack 19993, win 16289, options [nop,nop,TS val 791175 ecr 1004860,nop,nop,sack 2 {68545:69973}{57121:67117},mptcp dss ack 1969216846], length 0
20:39:35.524458 IP 112.26.2.8.37285 > 112.26.2.1.37653: Flags [.], ack 19993, win 15102, options [nop,nop,TS val 790355 ecr 1004860,nop,nop,sack 2 {57121:61405}{27133:54265},mptcp dss ack 1969216846], length 0
20:39:35.607304 IP 112.26.2.8.37285 > 112.26.2.1.37653: Flags [.], ack 25705, win 16562, options [nop,nop,TS val 791383 ecr 1011294,nop,nop,sack 2 {68545:69973}{57121:67117},mptcp dss ack 1969231126], length 0
20:39:35.730670 IP 112.26.2.8.37285 > 112.26.2.1.37653: Flags [.], ack 19993, win 15422, options [nop,nop,TS val 790607 ecr 1004860,nop,nop,sack 2 {57121:62833}{27133:54265},mptcp dss ack 1969216846], length 0
20:39:35.818852 IP 112.26.2.8.37285 > 112.26.2.1.37653: Flags [.], ack 25705, win 16836, options [nop,nop,TS val 791589 ecr 1011294,nop,nop,sack 2 {27133:55693}{68545:69973},mptcp dss ack 1969231126], length 0
20:39:35.916704 IP 112.26.2.8.37285 > 112.26.2.1.37653: Flags [.], ack 19993, win 15741, options [nop,nop,TS val 790777 ecr 1004860,nop,nop,sack 2 {57121:65689}{27133:54265},mptcp dss ack 1969216846], length 0
20:39:36.074776 IP 112.26.2.8.37285 > 112.26.2.1.37653: Flags [.], ack 19993, win 15924, options [nop,nop,TS val 790903 ecr 1004860,nop,nop,sack 2 {57121:67117}{27133:54265},mptcp dss ack 1969216846], length 0
20:39:36.105268 IP 112.26.2.8.37285 > 112.26.2.1.37653: Flags [.], ack 55693, win 17201, options [nop,nop,TS val 791878 ecr 1011861,nop,nop,sack 2 {68545:69973}{57121:67117},mptcp dss ack 1969328230], length 0
20:39:36.254180 IP 112.26.2.8.37285 > 112.26.2.1.37653: Flags [.], ack 19993, win 16289, options [nop,nop,TS val 791175 ecr 1004860,nop,nop,sack 2 {68545:69973}{57121:67117},mptcp dss ack 1969216846], length 0
20:39:36.269161 IP 112.26.2.8.37285 > 112.26.2.1.37653: Flags [.], ack 67117, win 17384, options [nop,nop,TS val 792044 ecr 1011861,nop,nop,sack 1 {68545:69973},mptcp dss ack 1969398202], length 0
20:39:36.391189 IP 112.26.2.8.37285 > 112.26.2.1.37653: Flags [.], ack 67117, win 17520, options [nop,nop,TS val 792115 ecr 1011861,nop,nop,sack 1 {68545:71401},mptcp dss ack 1969398202], length 0
20:39:36.411662 IP 112.26.2.8.37285 > 112.26.2.1.37653: Flags [.], ack 25705, win 16562, options [nop,nop,TS val 791383 ecr 1011294,nop,nop,sack 2 {68545:69973}{57121:67117},mptcp dss ack 1969231126], length 0
20:39:36.599669 IP 112.26.2.8.37285 > 112.26.2.1.37653: Flags [.], ack 25705, win 16836, options [nop,nop,TS val 791589 ecr 1011294,nop,nop,sack 2 {27133:55693}{68545:69973},mptcp dss ack 1969231126], length 0
20:39:36.691355 IP 112.26.2.8.37285 > 112.26.2.1.37653: Flags [.], ack 67117, win 17931, options [nop,nop,TS val 792467 ecr 1011861,nop,nop,sack 1 {68545:72829},mptcp dss ack 1969398202], length 0
20:39:36.816510 IP 112.26.2.8.37285 > 112.26.2.1.37653: Flags [.], ack 67117, win 18068, options [nop,nop,TS val 792554 ecr 1011861,nop,nop,sack 1 {68545:74257},mptcp dss ack 1969398202], length 0
20:39:36.852848 IP 112.26.2.8.37285 > 112.26.2.1.37653: Flags [.], ack 55693, win 17201, options [nop,nop,TS val 791878 ecr 1011861,nop,nop,sack 2 {68545:69973}{57121:67117},mptcp dss ack 1969328230], length 0
20:39:36.943034 IP 112.26.2.8.37285 > 112.26.2.1.37653: Flags [.], ack 67117, win 18250, options [nop,nop,TS val 792719 ecr 1011861,nop,nop,sack 1 {68545:75685},mptcp dss ack 1969398202], length 0
20:39:37.050270 IP 112.26.2.8.37285 > 112.26.2.1.37653: Flags [.], ack 67117, win 18387, options [nop,nop,TS val 792826 ecr 1011861,nop,nop,sack 1 {68545:77113},mptcp dss ack 1969398202], length 0
20:39:37.171035 IP 112.26.2.8.37285 > 112.26.2.1.37653: Flags [.], ack 67117, win 17384, options [nop,nop,TS val 792044 ecr 1011861,nop,nop,sack 1 {68545:69973},mptcp dss ack 1969398202], length 0
20:39:37.280980 IP 112.26.2.8.37285 > 112.26.2.1.37653: Flags [.], ack 67117, win 17520, options [nop,nop,TS val 792115 ecr 1011861,nop,nop,sack 1 {68545:71401},mptcp dss ack 1969398202], length 0
20:39:37.315282 IP 112.26.2.8.37285 > 112.26.2.1.37653: Flags [.], ack 67117, win 18707, options [nop,nop,TS val 793091 ecr 1011861,nop,nop,sack 1 {68545:78541},mptcp dss ack 1969398202], length 0
20:39:37.448980 IP 112.26.2.8.37285 > 112.26.2.1.37653: Flags [.], ack 78541, win 18889, options [nop,nop,TS val 793225 ecr 1012789,mptcp dss ack 1969449610], length 0
20:39:37.540470 IP 112.26.2.8.37285 > 112.26.2.1.37653: Flags [.], ack 79969, win 19117, options [nop,nop,TS val 793316 ecr 1012945,mptcp dss ack 1969449610], length 0
20:39:37.648983 IP 112.26.2.8.37285 > 112.26.2.1.37653: Flags [.], ack 81397, win 19254, options [nop,nop,TS val 793424 ecr 1012945,mptcp dss ack 1969449610], length 0
20:39:37.733795 IP 112.26.2.8.37285 > 112.26.2.1.37653: Flags [.], ack 67117, win 18068, options [nop,nop,TS val 792554 ecr 1011861,nop,nop,sack 1 {68545:74257},mptcp dss ack 1969398202], length 0
20:39:37.922369 IP 112.26.2.8.37285 > 112.26.2.1.37653: Flags [.], ack 81397, win 19619, options [nop,nop,TS val 793697 ecr 1012945,nop,nop,sack 1 {82825:84253},mptcp dss ack 1969449610], length 0
20:39:37.963679 IP 112.26.2.1.37653 > 112.26.2.8.37285: Flags [.], seq 92821:94249, ack 1, win 4017, options [nop,nop,TS val 1014304 ecr 792554,mptcp dss ack 4241485850 seq 1969532434 subseq 92821 len 1428 csum 0x7d89], length 1428
20:39:37.964002 IP 112.26.2.1.37653 > 112.26.2.8.37285: Flags [.], seq 92821:94249, ack 1, win 4017, options [nop,nop,TS val 1014304 ecr 792554,mptcp dss ack 4241485850 seq 1969532434 subseq 92821 len 1428 csum 0x7d89], length 1428
20:39:38.039869 IP 112.26.2.8.37285 > 112.26.2.1.37653: Flags [.], ack 81397, win 19756, options [nop,nop,TS val 793746 ecr 1012945,nop,nop,sack 2 {92821:94249}{82825:84253},mptcp dss ack 1969449610], length 0
20:39:38.061925 IP 112.26.2.8.37285 > 112.26.2.1.37653: Flags [.], ack 67117, win 18250, options [nop,nop,TS val 792719 ecr 1011861,nop,nop,sack 1 {68545:75685},mptcp dss ack 1969398202], length 0
20:39:38.080726 IP 112.26.2.8.37285 > 112.26.2.1.37653: Flags [.], ack 81397, win 19802, options [nop,nop,TS val 793812 ecr 1012945,nop,nop,sack 2 {82825:85681}{92821:94249},mptcp dss ack 1969449610], length 0
20:39:38.145999 IP 112.26.2.1.37653 > 112.26.2.8.37285: Flags [.], seq 94249:95677, ack 1, win 4017, options [nop,nop,TS val 1014605 ecr 792719,mptcp dss ack 4241485850 seq 1969545286 subseq 94249 len 1428 csum 0x9b36], length 1428
20:39:38.146348 IP 112.26.2.1.37653 > 112.26.2.8.37285: Flags [.], seq 94249:95677, ack 1, win 4017, options [nop,nop,TS val 1014605 ecr 792719,mptcp dss ack 4241485850 seq 1969545286 subseq 94249 len 1428 csum 0x9b36], length 1428
20:39:38.161030 IP 112.26.2.8.37285 > 112.26.2.1.37653: Flags [.], ack 81397, win 20030, options [nop,nop,TS val 793936 ecr 1012945,nop,nop,sack 2 {92821:95677}{82825:85681},mptcp dss ack 1969449610], length 0
20:39:38.218756 IP 112.26.2.8.37285 > 112.26.2.1.37653: Flags [.], ack 67117, win 18707, options [nop,nop,TS val 793091 ecr 1011861,nop,nop,sack 1 {68545:78541},mptcp dss ack 1969398202], length 0
20:39:38.256115 IP 112.26.2.8.37285 > 112.26.2.1.37653: Flags [.], ack 81397, win 20212, options [nop,nop,TS val 794031 ecr 1012945,nop,nop,sack 2 {82825:87109}{92821:95677},mptcp dss ack 1969479598], length 0
20:39:38.317608 IP 112.26.2.1.37653 > 112.26.2.8.37285: Flags [.], seq 95677:97105, ack 1, win 4017, options [nop,nop,TS val 1014811 ecr 793091,mptcp dss ack 4241485850 seq 1969550998 subseq 95677 len 1428 csum 0x1b9e], length 1428
20:39:38.317888 IP 112.26.2.1.37653 > 112.26.2.8.37285: Flags [.], seq 95677:97105, ack 1, win 4017, options [nop,nop,TS val 1014811 ecr 793091,mptcp dss ack 4241485850 seq 1969550998 subseq 95677 len 1428 csum 0x1b9e], length 1428
20:39:38.350325 IP 112.26.2.8.37285 > 112.26.2.1.37653: Flags [.], ack 81397, win 20304, options [nop,nop,TS val 794098 ecr 1012945,nop,nop,sack 2 {92821:97105}{82825:87109},mptcp dss ack 1969479598], length 0
20:39:38.429004 IP 112.26.2.8.37285 > 112.26.2.1.37653: Flags [.], ack 79969, win 19117, options [nop,nop,TS val 793316 ecr 1012945,mptcp dss ack 1969449610], length 0
20:39:38.470870 IP 112.26.2.8.37285 > 112.26.2.1.37653: Flags [.], ack 81397, win 20395, options [nop,nop,TS val 794121 ecr 1012945,nop,nop,sack 2 {82825:88537}{92821:97105},mptcp dss ack 1969479598], length 0
20:39:38.497243 IP 112.26.2.1.37653 > 112.26.2.8.37285: Flags [.], seq 97105:98533, ack 1, win 4017, options [nop,nop,TS val 1014963 ecr 793316,mptcp dss ack 4241485850 seq 1969556710 subseq 97105 len 1428 csum 0xe07a], length 1428
20:39:38.497478 IP 112.26.2.1.37653 > 112.26.2.8.37285: Flags [.], seq 97105:98533, ack 1, win 4017, options [nop,nop,TS val 1014963 ecr 793316,mptcp dss ack 4241485850 seq 1969556710 subseq 97105 len 1428 csum 0xe07a], length 1428
20:39:38.538580 IP 112.26.2.8.37285 > 112.26.2.1.37653: Flags [.], ack 81397, win 20669, options [nop,nop,TS val 794279 ecr 1012945,nop,nop,sack 2 {92821:98533}{82825:88537},mptcp dss ack 1969479598], length 0
20:39:38.612968 IP 112.26.2.8.37285 > 112.26.2.1.37653: Flags [.], ack 81397, win 20760, options [nop,nop,TS val 794370 ecr 1012945,nop,nop,sack 2 {89965:91393}{92821:98533},mptcp dss ack 1969479598], length 0
20:39:38.619820 IP 112.26.2.8.37285 > 112.26.2.1.37653: Flags [.], ack 81397, win 19254, options [nop,nop,TS val 793424 ecr 1012945,mptcp dss ack 1969449610], length 0
20:39:38.691570 IP 112.26.2.8.37285 > 112.26.2.1.37653: Flags [.], ack 81397, win 19619, options [nop,nop,TS val 793697 ecr 1012945,nop,nop,sack 1 {82825:84253},mptcp dss ack 1969449610], length 0
20:39:38.786142 IP 112.26.2.8.37285 > 112.26.2.1.37653: Flags [.], ack 81397, win 19756, options [nop,nop,TS val 793746 ecr 1012945,nop,nop,sack 2 {92821:94249}{82825:84253},mptcp dss ack 1969449610], length 0
20:39:38.849796 IP 112.26.2.8.37285 > 112.26.2.1.37653: Flags [.], ack 81397, win 19802, options [nop,nop,TS val 793812 ecr 1012945,nop,nop,sack 2 {82825:85681}{92821:94249},mptcp dss ack 1969449610], length 0
20:39:38.932189 IP 112.26.2.8.37285 > 112.26.2.1.37653: Flags [.], ack 81397, win 20030, options [nop,nop,TS val 793936 ecr 1012945,nop,nop,sack 2 {92821:95677}{82825:85681},mptcp dss ack 1969449610], length 0
20:39:39.025595 IP 112.26.2.8.37285 > 112.26.2.1.37653: Flags [.], ack 81397, win 20212, options [nop,nop,TS val 794031 ecr 1012945,nop,nop,sack 2 {82825:87109}{92821:95677},mptcp dss ack 1969479598], length 0
20:39:39.100784 IP 112.26.2.8.37285 > 112.26.2.1.37653: Flags [.], ack 81397, win 20304, options [nop,nop,TS val 794098 ecr 1012945,nop,nop,sack 2 {92821:97105}{82825:87109},mptcp dss ack 1969479598], length 0
20:39:39.220694 IP 112.26.2.8.37285 > 112.26.2.1.37653: Flags [.], ack 81397, win 20395, options [nop,nop,TS val 794121 ecr 1012945,nop,nop,sack 2 {82825:88537}{92821:97105},mptcp dss ack 1969479598], length 0
20:39:39.319942 IP 112.26.2.8.37285 > 112.26.2.1.37653: Flags [.], ack 81397, win 21490, options [nop,nop,TS val 795096 ecr 1012945,nop,nop,sack 2 {92821:99961}{89965:91393},mptcp dss ack 1969479598], length 0
20:39:39.422555 IP 112.26.2.8.37285 > 112.26.2.1.37653: Flags [.], ack 81397, win 20669, options [nop,nop,TS val 794279 ecr 1012945,nop,nop,sack 2 {92821:98533}{82825:88537},mptcp dss ack 1969479598], length 0
20:39:39.436766 IP 112.26.2.8.37285 > 112.26.2.1.37653: Flags [.], ack 88537, win 21581, options [nop,nop,TS val 795196 ecr 1015226,nop,nop,sack 2 {92821:99961}{89965:91393},mptcp dss ack 1969503874], length 0
20:39:39.510938 IP 112.26.2.8.37285 > 112.26.2.1.37653: Flags [.], ack 81397, win 20760, options [nop,nop,TS val 794370 ecr 1012945,nop,nop,sack 2 {89965:91393}{92821:98533},mptcp dss ack 1969479598], length 0
20:39:39.540266 IP 112.26.2.8.37285 > 112.26.2.1.37653: Flags [.], ack 88537, win 21718, options [nop,nop,TS val 795305 ecr 1015226,nop,nop,sack 2 {84253:85681}{92821:99961},mptcp dss ack 1969503874], length 0
20:39:39.680778 IP 112.26.2.8.37285 > 112.26.2.1.37653: Flags [.], ack 88537, win 21900, options [nop,nop,TS val 795456 ecr 1015226,nop,nop,sack 2 {85681:87109}{92821:99961},mptcp dss ack 1969503874], length 0
20:39:39.777098 IP 112.26.2.8.37285 > 112.26.2.1.37653: Flags [.], ack 88537, win 21992, options [nop,nop,TS val 795553 ecr 1015467,nop,nop,sack 2 {87109:88537}{92821:99961},mptcp dss ack 1969503874], length 0
20:39:39.875169 IP 112.26.2.8.37285 > 112.26.2.1.37653: Flags [.], ack 91393, win 22174, options [nop,nop,TS val 795650 ecr 1015561,nop,nop,sack 1 {92821:99961},mptcp dss ack 1969521010], length 0
20:39:39.967790 IP 112.26.2.8.37285 > 112.26.2.1.37653: Flags [.], ack 91393, win 22265, options [nop,nop,TS val 795711 ecr 1015636,nop,nop,sack 2 {89965:91393}{92821:99961},mptcp dss ack 1969521010], length 0
20:39:40.095806 IP 112.26.2.8.37285 > 112.26.2.1.37653: Flags [.], ack 81397, win 21490, options [nop,nop,TS val 795096 ecr 1012945,nop,nop,sack 2 {92821:99961}{89965:91393},mptcp dss ack 1969479598], length 0
20:39:40.194003 IP 112.26.2.8.37285 > 112.26.2.1.37653: Flags [.], ack 91393, win 22539, options [nop,nop,TS val 795970 ecr 1015636,nop,nop,sack 2 {81397:82825}{92821:99961},mptcp dss ack 1969521010], length 0
20:39:40.263043 IP 112.26.2.8.37285 > 112.26.2.1.37653: Flags [.], ack 88537, win 21581, options [nop,nop,TS val 795196 ecr 1015226,nop,nop,sack 2 {92821:99961}{89965:91393},mptcp dss ack 1969503874], length 0
20:39:40.374025 IP 112.26.2.8.37285 > 112.26.2.1.37653: Flags [.], ack 99961, win 22722, options [nop,nop,TS val 796148 ecr 1015957,mptcp dss ack 1969602406], length 0
20:39:40.453601 IP 112.26.2.8.37285 > 112.26.2.1.37653: Flags [.], ack 88537, win 21718, options [nop,nop,TS val 795305 ecr 1015226,nop,nop,sack 2 {84253:85681}{92821:99961},mptcp dss ack 1969503874], length 0
20:39:40.533728 IP 112.26.2.8.37285 > 112.26.2.1.37653: Flags [.], ack 99961, win 22904, options [nop,nop,TS val 796309 ecr 1015957,nop,nop,sack 1 {88537:89965},mptcp dss ack 1969603834], length 0
20:39:40.633564 IP 112.26.2.8.37285 > 112.26.2.1.37653: Flags [.], ack 88537, win 21992, options [nop,nop,TS val 795553 ecr 1015467,nop,nop,sack 2 {87109:88537}{92821:99961},mptcp dss ack 1969503874], length 0
20:39:40.758998 IP 112.26.2.8.37285 > 112.26.2.1.37653: Flags [.], ack 91393, win 22174, options [nop,nop,TS val 795650 ecr 1015561,nop,nop,sack 1 {92821:99961},mptcp dss ack 1969521010], length 0
20:39:40.862662 IP 112.26.2.8.37285 > 112.26.2.1.37653: Flags [.], ack 91393, win 22265, options [nop,nop,TS val 795711 ecr 1015636,nop,nop,sack 2 {89965:91393}{92821:99961},mptcp dss ack 1969521010], length 0
20:39:40.925197 IP 112.26.2.8.37285 > 112.26.2.1.37653: Flags [.], ack 101389, win 23406, options [nop,nop,TS val 796700 ecr 1016685,mptcp dss ack 1969622398], length 0
20:39:41.017673 IP 112.26.2.8.37285 > 112.26.2.1.37653: Flags [.], ack 91393, win 22539, options [nop,nop,TS val 795970 ecr 1015636,nop,nop,sack 2 {81397:82825}{92821:99961},mptcp dss ack 1969521010], length 0
20:39:41.101746 IP 112.26.2.8.37285 > 112.26.2.1.37653: Flags [.], ack 102817, win 23634, options [nop,nop,TS val 796873 ecr 1016798,mptcp dss ack 1969625254], length 0
20:39:41.199442 IP 112.26.2.8.37285 > 112.26.2.1.37653: Flags [.], ack 99961, win 22722, options [nop,nop,TS val 796148 ecr 1015957,mptcp dss ack 1969602406], length 0
20:39:41.270677 IP 112.26.2.8.37285 > 112.26.2.1.37653: Flags [.], ack 104245, win 23862, options [nop,nop,TS val 797046 ecr 1016798,mptcp dss ack 1969635250], length 0
20:39:41.359773 IP 112.26.2.8.37285 > 112.26.2.1.37653: Flags [.], ack 99961, win 22904, options [nop,nop,TS val 796309 ecr 1015957,nop,nop,sack 1 {88537:89965},mptcp dss ack 1969603834], length 0
20:39:41.454156 IP 112.26.2.8.37285 > 112.26.2.1.37653: Flags [.], ack 105673, win 24136, options [nop,nop,TS val 797227 ecr 1017014,mptcp dss ack 1969642390], length 0
20:39:41.555578 IP 112.26.2.8.37285 > 112.26.2.1.37653: Flags [.], ack 107101, win 24273, options [nop,nop,TS val 797330 ecr 1017187,mptcp dss ack 1969645246], length 0
20:39:41.630903 IP 112.26.2.8.37285 > 112.26.2.1.37653: Flags [.], ack 108529, win 24364, options [nop,nop,TS val 797407 ecr 1017294,mptcp dss ack 1969645246], length 0
20:39:41.743178 IP 112.26.2.8.37285 > 112.26.2.1.37653: Flags [.], ack 101389, win 23406, options [nop,nop,TS val 796700 ecr 1016685,mptcp dss ack 1969622398], length 0
20:39:41.820589 IP 112.26.2.8.37285 > 112.26.2.1.37653: Flags [.], ack 102817, win 23634, options [nop,nop,TS val 796873 ecr 1016798,mptcp dss ack 1969625254], length 0
20:39:41.924478 IP 112.26.2.8.37285 > 112.26.2.1.37653: Flags [.], ack 109957, win 24435, options [nop,nop,TS val 797700 ecr 1017735,mptcp dss ack 1969658098], length 0
20:39:42.012372 IP 112.26.2.8.37285 > 112.26.2.1.37653: Flags [.], ack 104245, win 23862, options [nop,nop,TS val 797046 ecr 1016798,mptcp dss ack 1969635250], length 0
20:39:42.079600 IP 112.26.2.8.37285 > 112.26.2.1.37653: Flags [.], ack 111385, win 24401, options [nop,nop,TS val 797855 ecr 1017907,mptcp dss ack 1969663810], length 0
