08:03:02.848401 IP 112.26.0.8.35432 > 112.26.0.1.44905: Flags [S], seq 654320009, win 65535, options [mss 1460,sackOK,TS val 1314353 ecr 0,nop,wscale 6,mptcp capable csum {0x67404ab0b2926d9}], length 0
08:03:02.856187 IP 112.26.0.8.35432 > 112.26.0.1.44905: Flags [S], seq 654320009, win 65535, options [mss 1460,sackOK,TS val 1314353 ecr 0,nop,wscale 6,mptcp capable csum {0x67404ab0b2926d9}], length 0
08:03:02.857402 IP 112.26.0.1.44905 > 112.26.0.8.35432: Flags [S.], seq 953675558, ack 654320010, win 65535, options [mss 1460,sackOK,TS val 1530118 ecr 1314353,nop,wscale 6,mptcp capable csum {0x8e5a71dcf9dd2acf}], length 0
08:03:02.857700 IP 112.26.0.1.44905 > 112.26.0.8.35432: Flags [S.], seq 953675558, ack 654320010, win 65535, options [mss 1460,sackOK,TS val 1530118 ecr 1314353,nop,wscale 6,mptcp capable csum {0x8e5a71dcf9dd2acf}], length 0
08:03:02.954356 IP 112.26.0.1.44905 > 112.26.0.8.35432: Flags [S.], seq 953675558, ack 654320010, win 65535, options [mss 1460,sackOK,TS val 1530118 ecr 1314353,nop,wscale 6,mptcp capable csum {0x8e5a71dcf9dd2acf}], length 0
08:03:03.058874 IP 112.26.0.8.35432 > 112.26.0.1.44905: Flags [.], ack 1, win 1369, options [nop,nop,TS val 1314473 ecr 1530118,mptcp capable csum {0x67404ab0b2926d9,0x8e5a71dcf9dd2acf},mptcp dss ack 1287618136], length 0
08:03:03.062120 IP 112.26.0.8.35432 > 112.26.0.1.44905: Flags [.], ack 1, win 1369, options [nop,nop,TS val 1314473 ecr 1530118,mptcp capable csum {0x67404ab0b2926d9,0x8e5a71dcf9dd2acf},mptcp dss ack 1287618136], length 0
08:03:03.079687 IP 112.26.0.1.44905 > 112.26.0.8.35432: Flags [.], ack 1, win 1339, options [nop,nop,TS val 1530322 ecr 1314473,mptcp add-addr id 3 112.26.1.1,mptcp dss ack 1507037785], length 0
08:03:03.079966 IP 112.26.0.1.44905 > 112.26.0.8.35432: Flags [.], ack 1, win 1339, options [nop,nop,TS val 1530322 ecr 1314473,mptcp add-addr id 3 112.26.1.1,mptcp dss ack 1507037785], length 0
08:03:03.086175 IP 112.26.0.8.35432 > 112.26.0.1.44905: Flags [.], ack 1, win 1369, options [nop,nop,TS val 1314473 ecr 1530118,mptcp add-addr id 4 112.26.2.8,mptcp dss ack 1287618136], length 0
08:03:03.088858 IP 112.26.0.8.35432 > 112.26.0.1.44905: Flags [.], ack 1, win 1369, options [nop,nop,TS val 1314473 ecr 1530118,mptcp add-addr id 4 112.26.2.8,mptcp dss ack 1287618136], length 0
08:03:03.157721 IP 112.26.0.1.44905 > 112.26.0.8.35432: Flags [.], ack 1, win 1339, options [nop,nop,TS val 1530322 ecr 1314473,mptcp add-addr id 5 112.26.3.1,mptcp dss ack 1507037785], length 0
08:03:03.157945 IP 112.26.0.1.44905 > 112.26.0.8.35432: Flags [.], ack 1, win 1339, options [nop,nop,TS val 1530322 ecr 1314473,mptcp add-addr id 5 112.26.3.1,mptcp dss ack 1507037785], length 0
08:03:03.169688 IP 112.26.0.1.44905 > 112.26.0.8.35432: Flags [.], ack 1, win 1339, options [nop,nop,TS val 1530322 ecr 1314473,mptcp add-addr id 6 112.26.2.1,mptcp dss ack 1507037785], length 0
08:03:03.169913 IP 112.26.0.1.44905 > 112.26.0.8.35432: Flags [.], ack 1, win 1339, options [nop,nop,TS val 1530322 ecr 1314473,mptcp add-addr id 6 112.26.2.1,mptcp dss ack 1507037785], length 0
08:03:03.177010 IP 112.26.0.8.35432 > 112.26.0.1.44905: Flags [.], ack 1, win 1369, options [nop,nop,TS val 1314473 ecr 1530118,mptcp add-addr id 5 112.26.3.8,mptcp dss ack 1287618136], length 0
08:03:03.179072 IP 112.26.0.8.35432 > 112.26.0.1.44905: Flags [.], ack 1, win 1369, options [nop,nop,TS val 1314473 ecr 1530118,mptcp add-addr id 5 112.26.3.8,mptcp dss ack 1287618136], length 0
08:03:03.189573 IP 112.26.0.1.44905 > 112.26.0.8.35432: Flags [.], seq 1:1429, ack 1, win 1339, options [nop,nop,TS val 1530329 ecr 1314473,mptcp dss ack 1507037785 seq 1287618136 subseq 1 len 1428 csum 0xa608], length 1428
08:03:03.189734 IP 112.26.0.1.44905 > 112.26.0.8.35432: Flags [.], seq 1:1429, ack 1, win 1339, options [nop,nop,TS val 1530329 ecr 1314473,mptcp dss ack 1507037785 seq 1287618136 subseq 1 len 1428 csum 0xa608], length 1428
08:03:03.195371 IP 112.26.0.8.35432 > 112.26.0.1.44905: Flags [.], ack 1, win 1369, options [nop,nop,TS val 1314473 ecr 1530118,mptcp add-addr id 6 112.26.1.8,mptcp dss ack 1287618136], length 0
08:03:03.199357 IP 112.26.0.8.35432 > 112.26.0.1.44905: Flags [.], ack 1, win 1369, options [nop,nop,TS val 1314473 ecr 1530118,mptcp add-addr id 6 112.26.1.8,mptcp dss ack 1287618136], length 0
08:03:03.265700 IP 112.26.0.1.44905 > 112.26.0.8.35432: Flags [.], seq 1429:2857, ack 1, win 1339, options [nop,nop,TS val 1530329 ecr 1314473,mptcp dss ack 1507037785 seq 1287619564 subseq 1429 len 1428 csum 0xc556], length 1428
08:03:03.265926 IP 112.26.0.1.44905 > 112.26.0.8.35432: Flags [.], seq 1429:2857, ack 1, win 1339, options [nop,nop,TS val 1530329 ecr 1314473,mptcp dss ack 1507037785 seq 1287619564 subseq 1429 len 1428 csum 0xc556], length 1428
08:03:03.268237 IP 112.26.0.1.44905 > 112.26.0.8.35432: Flags [.], ack 1, win 1339, options [nop,nop,TS val 1530322 ecr 1314473,mptcp add-addr id 3 112.26.1.1,mptcp dss ack 1507037785], length 0
08:03:03.276066 IP 112.26.0.1.44905 > 112.26.0.8.35432: Flags [.], ack 1, win 1339, options [nop,nop,TS val 1530322 ecr 1314473,mptcp add-addr id 5 112.26.3.1,mptcp dss ack 1507037785], length 0
08:03:03.280923 IP 112.26.0.1.44905 > 112.26.0.8.35432: Flags [P.], seq 2857:4097, ack 1, win 1339, options [nop,nop,TS val 1530329 ecr 1314473,mptcp dss ack 1507037785 seq 1287620992 subseq 2857 len 1240 csum 0x629], length 1240
08:03:03.281106 IP 112.26.0.1.44905 > 112.26.0.8.35432: Flags [P.], seq 2857:4097, ack 1, win 1339, options [nop,nop,TS val 1530329 ecr 1314473,mptcp dss ack 1507037785 seq 1287620992 subseq 2857 len 1240 csum 0x629], length 1240
08:03:03.366461 IP 112.26.0.1.44905 > 112.26.0.8.35432: Flags [.], ack 1, win 1339, options [nop,nop,TS val 1530322 ecr 1314473,mptcp add-addr id 6 112.26.2.1,mptcp dss ack 1507037785], length 0
08:03:03.372071 IP 112.26.0.1.44905 > 112.26.0.8.35432: Flags [.], seq 4097:5525, ack 1, win 1339, options [nop,nop,TS val 1530330 ecr 1314473,mptcp dss ack 1507037785 seq 1287622232 subseq 4097 len 1428 csum 0xfa61], length 1428
08:03:03.372345 IP 112.26.0.1.44905 > 112.26.0.8.35432: Flags [.], seq 4097:5525, ack 1, win 1339, options [nop,nop,TS val 1530330 ecr 1314473,mptcp dss ack 1507037785 seq 1287622232 subseq 4097 len 1428 csum 0xfa61], length 1428
08:03:03.379010 IP 112.26.0.1.44905 > 112.26.0.8.35432: Flags [.], seq 1:1429, ack 1, win 1339, options [nop,nop,TS val 1530329 ecr 1314473,mptcp dss ack 1507037785 seq 1287618136 subseq 1 len 1428 csum 0xa608], length 1428
08:03:03.448494 IP 112.26.0.1.44905 > 112.26.0.8.35432: Flags [.], seq 5525:6953, ack 1, win 1339, options [nop,nop,TS val 1530330 ecr 1314473,mptcp dss ack 1507037785 seq 1287623660 subseq 5525 len 1428 csum 0x56d7], length 1428
08:03:03.448808 IP 112.26.0.1.44905 > 112.26.0.8.35432: Flags [.], seq 5525:6953, ack 1, win 1339, options [nop,nop,TS val 1530330 ecr 1314473,mptcp dss ack 1507037785 seq 1287623660 subseq 5525 len 1428 csum 0x56d7], length 1428
08:03:03.455262 IP 112.26.0.1.44905 > 112.26.0.8.35432: Flags [.], seq 1429:2857, ack 1, win 1339, options [nop,nop,TS val 1530329 ecr 1314473,mptcp dss ack 1507037785 seq 1287619564 subseq 1429 len 1428 csum 0xc556], length 1428
08:03:03.468923 IP 112.26.0.1.44905 > 112.26.0.8.35432: Flags [.], seq 6953:8381, ack 1, win 1339, options [nop,nop,TS val 1530330 ecr 1314473,mptcp dss ack 1507037785 seq 1287625088 subseq 6953 len 1428 csum 0xf0a3], length 1428
08:03:03.469063 IP 112.26.0.1.44905 > 112.26.0.8.35432: Flags [.], seq 6953:8381, ack 1, win 1339, options [nop,nop,TS val 1530330 ecr 1314473,mptcp dss ack 1507037785 seq 1287625088 subseq 6953 len 1428 csum 0xf0a3], length 1428
08:03:03.553636 IP 112.26.0.1.44905 > 112.26.0.8.35432: Flags [.], seq 8381:9809, ack 1, win 1339, options [nop,nop,TS val 1530330 ecr 1314473,mptcp dss ack 1507037785 seq 1287626516 subseq 8381 len 1428 csum 0xc035], length 1428
08:03:03.553923 IP 112.26.0.1.44905 > 112.26.0.8.35432: Flags [.], seq 8381:9809, ack 1, win 1339, options [nop,nop,TS val 1530330 ecr 1314473,mptcp dss ack 1507037785 seq 1287626516 subseq 8381 len 1428 csum 0xc035], length 1428
08:03:03.560880 IP 112.26.0.8.35432 > 112.26.0.1.44905: Flags [.], ack 1429, win 1415, options [nop,nop,TS val 1314898 ecr 1530329,mptcp dss ack 1287619564], length 0
08:03:03.563721 IP 112.26.0.8.35432 > 112.26.0.1.44905: Flags [.], ack 1429, win 1415, options [nop,nop,TS val 1314898 ecr 1530329,mptcp dss ack 1287619564], length 0
08:03:03.581900 IP 112.26.0.1.44905 > 112.26.0.8.35432: Flags [P.], seq 2857:4097, ack 1, win 1339, options [nop,nop,TS val 1530329 ecr 1314473,mptcp dss ack 1507037785 seq 1287620992 subseq 2857 len 1240 csum 0x629], length 1240
08:03:03.647621 IP 112.26.0.1.44905 > 112.26.0.8.35432: Flags [.], seq 14093:15521, ack 1, win 1339, options [nop,nop,TS val 1530824 ecr 1314898,mptcp dss ack 1507037785 seq 1287632228 subseq 14093 len 1428 csum 0x7cbe], length 1428
08:03:03.647893 IP 112.26.0.1.44905 > 112.26.0.8.35432: Flags [.], seq 14093:15521, ack 1, win 1339, options [nop,nop,TS val 1530824 ecr 1314898,mptcp dss ack 1507037785 seq 1287632228 subseq 14093 len 1428 csum 0x7cbe], length 1428
08:03:03.673124 IP 112.26.0.8.35432 > 112.26.0.1.44905: Flags [.], ack 2857, win 1460, options [nop,nop,TS val 1314975 ecr 1530329,mptcp dss ack 1287620992], length 0
08:03:03.675716 IP 112.26.0.8.35432 > 112.26.0.1.44905: Flags [.], ack 2857, win 1460, options [nop,nop,TS val 1314975 ecr 1530329,mptcp dss ack 1287620992], length 0
08:03:03.678523 IP 112.26.0.1.44905 > 112.26.0.8.35432: Flags [.], seq 15521:16949, ack 1, win 1339, options [nop,nop,TS val 1530824 ecr 1314898,mptcp dss ack 1507037785 seq 1287633656 subseq 15521 len 1428 csum 0xe819], length 1428
08:03:03.678721 IP 112.26.0.1.44905 > 112.26.0.8.35432: Flags [.], seq 15521:16949, ack 1, win 1339, options [nop,nop,TS val 1530824 ecr 1314898,mptcp dss ack 1507037785 seq 1287633656 subseq 15521 len 1428 csum 0xe819], length 1428
08:03:03.689489 IP 112.26.0.1.44905 > 112.26.0.8.35432: Flags [.], seq 4097:5525, ack 1, win 1339, options [nop,nop,TS val 1530330 ecr 1314473,mptcp dss ack 1507037785 seq 1287622232 subseq 4097 len 1428 csum 0xfa61], length 1428
08:03:03.696321 IP 112.26.0.1.44905 > 112.26.0.8.35432: Flags [.], seq 16949:18377, ack 1, win 1339, options [nop,nop,TS val 1530937 ecr 1314975,mptcp dss ack 1507037785 seq 1287635084 subseq 16949 len 1428 csum 0xd16d], length 1428
08:03:03.696571 IP 112.26.0.1.44905 > 112.26.0.8.35432: Flags [.], seq 16949:18377, ack 1, win 1339, options [nop,nop,TS val 1530937 ecr 1314975,mptcp dss ack 1507037785 seq 1287635084 subseq 16949 len 1428 csum 0xd16d], length 1428
08:03:03.762446 IP 112.26.0.1.44905 > 112.26.0.8.35432: Flags [.], seq 5525:6953, ack 1, win 1339, options [nop,nop,TS val 1530330 ecr 1314473,mptcp dss ack 1507037785 seq 1287623660 subseq 5525 len 1428 csum 0x56d7], length 1428
08:03:03.776225 IP 112.26.0.1.44905 > 112.26.0.8.35432: Flags [.], seq 18377:19805, ack 1, win 1339, options [nop,nop,TS val 1530937 ecr 1314975,mptcp dss ack 1507037785 seq 1287636512 subseq 18377 len 1428 csum 0xdab9], length 1428
08:03:03.776447 IP 112.26.0.1.44905 > 112.26.0.8.35432: Flags [.], seq 18377:19805, ack 1, win 1339, options [nop,nop,TS val 1530937 ecr 1314975,mptcp dss ack 1507037785 seq 1287636512 subseq 18377 len 1428 csum 0xdab9], length 1428
08:03:03.851288 IP 112.26.0.8.35432 > 112.26.0.1.44905: Flags [.], ack 4097, win 1506, options [nop,nop,TS val 1315100 ecr 1530329,mptcp dss ack 1287622232], length 0
08:03:03.860803 IP 112.26.0.8.35432 > 112.26.0.1.44905: Flags [.], ack 4097, win 1506, options [nop,nop,TS val 1315100 ecr 1530329,mptcp dss ack 1287622232], length 0
08:03:03.862720 IP 112.26.0.1.44905 > 112.26.0.8.35432: Flags [.], seq 19805:21233, ack 1, win 1339, options [nop,nop,TS val 1531123 ecr 1315100,mptcp dss ack 1507037785 seq 1287637940 subseq 19805 len 1428 csum 0x9a5b], length 1428
08:03:03.862926 IP 112.26.0.1.44905 > 112.26.0.8.35432: Flags [.], seq 19805:21233, ack 1, win 1339, options [nop,nop,TS val 1531123 ecr 1315100,mptcp dss ack 1507037785 seq 1287637940 subseq 19805 len 1428 csum 0x9a5b], length 1428
08:03:03.872978 IP 112.26.0.1.44905 > 112.26.0.8.35432: Flags [.], seq 6953:8381, ack 1, win 1339, options [nop,nop,TS val 1530330 ecr 1314473,mptcp dss ack 1507037785 seq 1287625088 subseq 6953 len 1428 csum 0xf0a3], length 1428
08:03:03.885647 IP 112.26.0.1.44905 > 112.26.0.8.35432: Flags [.], seq 21233:22661, ack 1, win 1339, options [nop,nop,TS val 1531123 ecr 1315100,mptcp dss ack 1507037785 seq 1287639368 subseq 21233 len 1428 csum 0xe35b], length 1428
08:03:03.885819 IP 112.26.0.1.44905 > 112.26.0.8.35432: Flags [.], seq 21233:22661, ack 1, win 1339, options [nop,nop,TS val 1531123 ecr 1315100,mptcp dss ack 1507037785 seq 1287639368 subseq 21233 len 1428 csum 0xe35b], length 1428
08:03:03.893741 IP 112.26.0.8.35432 > 112.26.0.1.44905: Flags [.], ack 5525, win 1552, options [nop,nop,TS val 1315209 ecr 1530330,mptcp dss ack 1287623660], length 0
08:03:03.949372 IP 112.26.0.8.35432 > 112.26.0.1.44905: Flags [.], ack 5525, win 1552, options [nop,nop,TS val 1315209 ecr 1530330,mptcp dss ack 1287623660], length 0
08:03:03.967576 IP 112.26.0.1.44905 > 112.26.0.8.35432: Flags [.], seq 8381:9809, ack 1, win 1339, options [nop,nop,TS val 1530330 ecr 1314473,mptcp dss ack 1507037785 seq 1287626516 subseq 8381 len 1428 csum 0xc035], length 1428
08:03:03.977978 IP 112.26.0.1.44905 > 112.26.0.8.35432: Flags [.], seq 22661:24089, ack 1, win 1339, options [nop,nop,TS val 1531157 ecr 1315209,mptcp dss ack 1507037785 seq 1287640796 subseq 22661 len 1428 csum 0x3ff6], length 1428
08:03:03.978166 IP 112.26.0.1.44905 > 112.26.0.8.35432: Flags [.], seq 22661:24089, ack 1, win 1339, options [nop,nop,TS val 1531157 ecr 1315209,mptcp dss ack 1507037785 seq 1287640796 subseq 22661 len 1428 csum 0x3ff6], length 1428
08:03:04.060869 IP 112.26.0.1.44905 > 112.26.0.8.35432: Flags [.], seq 24089:25517, ack 1, win 1339, options [nop,nop,TS val 1531157 ecr 1315209,mptcp dss ack 1507037785 seq 1287642224 subseq 24089 len 1428 csum 0xd7c4], length 1428
08:03:04.061233 IP 112.26.0.1.44905 > 112.26.0.8.35432: Flags [.], seq 24089:25517, ack 1, win 1339, options [nop,nop,TS val 1531157 ecr 1315209,mptcp dss ack 1507037785 seq 1287642224 subseq 24089 len 1428 csum 0xd7c4], length 1428
08:03:04.068835 IP 112.26.0.8.35432 > 112.26.0.1.44905: Flags [.], ack 6953, win 1597, options [nop,nop,TS val 1315282 ecr 1530330,mptcp dss ack 1287625088], length 0
08:03:04.071700 IP 112.26.0.8.35432 > 112.26.0.1.44905: Flags [.], ack 6953, win 1597, options [nop,nop,TS val 1315282 ecr 1530330,mptcp dss ack 1287625088], length 0
08:03:04.084429 IP 112.26.0.1.44905 > 112.26.0.8.35432: Flags [.], seq 25517:26945, ack 1, win 1339, options [nop,nop,TS val 1531332 ecr 1315282,mptcp dss ack 1507037785 seq 1287643652 subseq 25517 len 1428 csum 0xf1c2], length 1428
08:03:04.084630 IP 112.26.0.1.44905 > 112.26.0.8.35432: Flags [.], seq 25517:26945, ack 1, win 1339, options [nop,nop,TS val 1531332 ecr 1315282,mptcp dss ack 1507037785 seq 1287643652 subseq 25517 len 1428 csum 0xf1c2], length 1428
08:03:04.089435 IP 112.26.0.8.35432 > 112.26.0.1.44905: Flags [.], ack 8381, win 1643, options [nop,nop,TS val 1315391 ecr 1530330,mptcp dss ack 1287626516], length 0
08:03:04.155271 IP 112.26.0.8.35432 > 112.26.0.1.44905: Flags [.], ack 8381, win 1643, options [nop,nop,TS val 1315391 ecr 1530330,mptcp dss ack 1287626516], length 0
08:03:04.164177 IP 112.26.0.1.44905 > 112.26.0.8.35432: Flags [.], seq 26945:28373, ack 1, win 1339, options [nop,nop,TS val 1531332 ecr 1315282,mptcp dss ack 1507037785 seq 1287645080 subseq 26945 len 1428 csum 0x77bf], length 1428
08:03:04.164383 IP 112.26.0.1.44905 > 112.26.0.8.35432: Flags [.], seq 26945:28373, ack 1, win 1339, options [nop,nop,TS val 1531332 ecr 1315282,mptcp dss ack 1507037785 seq 1287645080 subseq 26945 len 1428 csum 0x77bf], length 1428
08:03:04.169908 IP 112.26.0.1.44905 > 112.26.0.8.35432: Flags [.], seq 14093:15521, ack 1, win 1339, options [nop,nop,TS val 1530824 ecr 1314898,mptcp dss ack 1507037785 seq 1287632228 subseq 14093 len 1428 csum 0x7cbe], length 1428
08:03:04.180988 IP 112.26.0.1.44905 > 112.26.0.8.35432: Flags [.], seq 28373:29801, ack 1, win 1339, options [nop,nop,TS val 1531417 ecr 1315391,mptcp dss ack 1507037785 seq 1287646508 subseq 28373 len 1428 csum 0x841c], length 1428
08:03:04.181205 IP 112.26.0.1.44905 > 112.26.0.8.35432: Flags [.], seq 28373:29801, ack 1, win 1339, options [nop,nop,TS val 1531417 ecr 1315391,mptcp dss ack 1507037785 seq 1287646508 subseq 28373 len 1428 csum 0x841c], length 1428
08:03:04.267787 IP 112.26.0.1.44905 > 112.26.0.8.35432: Flags [.], seq 29801:31229, ack 1, win 1339, options [nop,nop,TS val 1531417 ecr 1315391,mptcp dss ack 1507037785 seq 1287647936 subseq 29801 len 1428 csum 0xa9bd], length 1428
08:03:04.268013 IP 112.26.0.1.44905 > 112.26.0.8.35432: Flags [.], seq 29801:31229, ack 1, win 1339, options [nop,nop,TS val 1531417 ecr 1315391,mptcp dss ack 1507037785 seq 1287647936 subseq 29801 len 1428 csum 0xa9bd], length 1428
08:03:04.269095 IP 112.26.0.1.44905 > 112.26.0.8.35432: Flags [.], seq 15521:16949, ack 1, win 1339, options [nop,nop,TS val 1530824 ecr 1314898,mptcp dss ack 1507037785 seq 1287633656 subseq 15521 len 1428 csum 0xe819], length 1428
08:03:04.276232 IP 112.26.0.8.35432 > 112.26.0.1.44905: Flags [.], ack 9809, win 1689, options [nop,nop,TS val 1315487 ecr 1530330,mptcp dss ack 1287627944], length 0
08:03:04.279102 IP 112.26.0.8.35432 > 112.26.0.1.44905: Flags [.], ack 9809, win 1689, options [nop,nop,TS val 1315487 ecr 1530330,mptcp dss ack 1287627944], length 0
08:03:04.284908 IP 112.26.0.1.44905 > 112.26.0.8.35432: Flags [.], seq 31229:32657, ack 1, win 1339, options [nop,nop,TS val 1531540 ecr 1315487,mptcp dss ack 1507037785 seq 1287649364 subseq 31229 len 1428 csum 0x9cfd], length 1428
08:03:04.285120 IP 112.26.0.1.44905 > 112.26.0.8.35432: Flags [.], seq 31229:32657, ack 1, win 1339, options [nop,nop,TS val 1531540 ecr 1315487,mptcp dss ack 1507037785 seq 1287649364 subseq 31229 len 1428 csum 0x9cfd], length 1428
08:03:04.364934 IP 112.26.0.1.44905 > 112.26.0.8.35432: Flags [.], seq 32657:34085, ack 1, win 1339, options [nop,nop,TS val 1531540 ecr 1315487,mptcp dss ack 1507037785 seq 1287650792 subseq 32657 len 1428 csum 0x18a8], length 1428
08:03:04.365248 IP 112.26.0.1.44905 > 112.26.0.8.35432: Flags [.], seq 32657:34085, ack 1, win 1339, options [nop,nop,TS val 1531540 ecr 1315487,mptcp dss ack 1507037785 seq 1287650792 subseq 32657 len 1428 csum 0x18a8], length 1428
08:03:04.369108 IP 112.26.0.1.44905 > 112.26.0.8.35432: Flags [.], seq 16949:18377, ack 1, win 1339, options [nop,nop,TS val 1530937 ecr 1314975,mptcp dss ack 1507037785 seq 1287635084 subseq 16949 len 1428 csum 0xd16d], length 1428
08:03:04.380793 IP 112.26.0.1.44905 > 112.26.0.8.35432: Flags [.], seq 18377:19805, ack 1, win 1339, options [nop,nop,TS val 1530937 ecr 1314975,mptcp dss ack 1507037785 seq 1287636512 subseq 18377 len 1428 csum 0xdab9], length 1428
08:03:04.464323 IP 112.26.0.1.44905 > 112.26.0.8.35432: Flags [.], seq 19805:21233, ack 1, win 1339, options [nop,nop,TS val 1531123 ecr 1315100,mptcp dss ack 1507037785 seq 1287637940 subseq 19805 len 1428 csum 0x9a5b], length 1428
08:03:04.477944 IP 112.26.0.8.35432 > 112.26.0.1.44905: Flags [.], ack 9809, win 1734, options [nop,nop,TS val 1315689 ecr 1530330,nop,nop,sack 1 {14093:15521},mptcp dss ack 1287627944], length 0
08:03:04.553791 IP 112.26.0.1.44905 > 112.26.0.8.35432: Flags [.], seq 9809:11237, ack 1, win 1339, options [nop,nop,TS val 1531742 ecr 1315689,mptcp dss ack 1507037785 seq 1287627944 subseq 9809 len 1428 csum 0xb8a1], length 1428
08:03:04.554091 IP 112.26.0.1.44905 > 112.26.0.8.35432: Flags [.], seq 9809:11237, ack 1, win 1339, options [nop,nop,TS val 1531742 ecr 1315689,mptcp dss ack 1507037785 seq 1287627944 subseq 9809 len 1428 csum 0xb8a1], length 1428
08:03:04.555137 IP 112.26.0.8.35432 > 112.26.0.1.44905: Flags [.], ack 9809, win 1734, options [nop,nop,TS val 1315689 ecr 1530330,nop,nop,sack 1 {14093:15521},mptcp dss ack 1287627944], length 0
08:03:04.574319 IP 112.26.0.1.44905 > 112.26.0.8.35432: Flags [.], seq 21233:22661, ack 1, win 1339, options [nop,nop,TS val 1531123 ecr 1315100,mptcp dss ack 1507037785 seq 1287639368 subseq 21233 len 1428 csum 0xe35b], length 1428
08:03:04.656892 IP 112.26.0.8.35432 > 112.26.0.1.44905: Flags [.], ack 9809, win 1780, options [nop,nop,TS val 1315781 ecr 1530330,nop,nop,sack 1 {14093:16949},mptcp dss ack 1287627944], length 0
08:03:04.663097 IP 112.26.0.8.35432 > 112.26.0.1.44905: Flags [.], ack 9809, win 1780, options [nop,nop,TS val 1315781 ecr 1530330,nop,nop,sack 1 {14093:16949},mptcp dss ack 1287627944], length 0
08:03:04.665984 IP 112.26.0.1.44905 > 112.26.0.8.35432: Flags [.], seq 11237:12665, ack 1, win 1339, options [nop,nop,TS val 1531921 ecr 1315781,mptcp dss ack 1507037785 seq 1287629372 subseq 11237 len 1428 csum 0xe827], length 1428
08:03:04.666291 IP 112.26.0.1.44905 > 112.26.0.8.35432: Flags [.], seq 11237:12665, ack 1, win 1339, options [nop,nop,TS val 1531921 ecr 1315781,mptcp dss ack 1507037785 seq 1287629372 subseq 11237 len 1428 csum 0xe827], length 1428
08:03:04.765622 IP 112.26.0.1.44905 > 112.26.0.8.35432: Flags [.], seq 22661:24089, ack 1, win 1339, options [nop,nop,TS val 1531157 ecr 1315209,mptcp dss ack 1507037785 seq 1287640796 subseq 22661 len 1428 csum 0x3ff6], length 1428
08:03:04.780470 IP 112.26.0.1.44905 > 112.26.0.8.35432: Flags [.], seq 24089:25517, ack 1, win 1339, options [nop,nop,TS val 1531157 ecr 1315209,mptcp dss ack 1507037785 seq 1287642224 subseq 24089 len 1428 csum 0xd7c4], length 1428
08:03:04.862382 IP 112.26.0.8.35432 > 112.26.0.1.44905: Flags [.], ack 9809, win 1825, options [nop,nop,TS val 1315887 ecr 1530330,nop,nop,sack 1 {14093:18377},mptcp dss ack 1287627944], length 0
08:03:04.865745 IP 112.26.0.8.35432 > 112.26.0.1.44905: Flags [.], ack 9809, win 1825, options [nop,nop,TS val 1315887 ecr 1530330,nop,nop,sack 1 {14093:18377},mptcp dss ack 1287627944], length 0
08:03:04.958289 IP 112.26.0.8.35432 > 112.26.0.1.44905: Flags [.], ack 9809, win 1917, options [nop,nop,TS val 1315983 ecr 1530330,nop,nop,sack 1 {14093:21233},mptcp dss ack 1287627944], length 0
08:03:04.961816 IP 112.26.0.8.35432 > 112.26.0.1.44905: Flags [.], ack 9809, win 1917, options [nop,nop,TS val 1315983 ecr 1530330,nop,nop,sack 1 {14093:21233},mptcp dss ack 1287627944], length 0
08:03:04.975756 IP 112.26.0.1.44905 > 112.26.0.8.35432: Flags [.], seq 26945:28373, ack 1, win 1339, options [nop,nop,TS val 1531332 ecr 1315282,mptcp dss ack 1507037785 seq 1287645080 subseq 26945 len 1428 csum 0x77bf], length 1428
08:03:05.058120 IP 112.26.0.1.44905 > 112.26.0.8.35432: Flags [.], seq 28373:29801, ack 1, win 1339, options [nop,nop,TS val 1531417 ecr 1315391,mptcp dss ack 1507037785 seq 1287646508 subseq 28373 len 1428 csum 0x841c], length 1428
08:03:05.072060 IP 112.26.0.8.35432 > 112.26.0.1.44905: Flags [.], ack 9809, win 1962, options [nop,nop,TS val 1316093 ecr 1530330,nop,nop,sack 1 {14093:22661},mptcp dss ack 1287627944], length 0
08:03:05.077249 IP 112.26.0.1.44905 > 112.26.0.8.35432: Flags [.], seq 12665:14093, ack 1, win 1339, options [nop,nop,TS val 1532335 ecr 1316093,mptcp dss ack 1507037785 seq 1287630800 subseq 12665 len 1428 csum 0x2a25], length 1428
08:03:05.077500 IP 112.26.0.1.44905 > 112.26.0.8.35432: Flags [.], seq 12665:14093, ack 1, win 1339, options [nop,nop,TS val 1532335 ecr 1316093,mptcp dss ack 1507037785 seq 1287630800 subseq 12665 len 1428 csum 0x2a25], length 1428
08:03:05.084040 IP 112.26.0.8.35432 > 112.26.0.1.44905: Flags [.], ack 9809, win 1962, options [nop,nop,TS val 1316093 ecr 1530330,nop,nop,sack 1 {14093:22661},mptcp dss ack 1287627944], length 0
08:03:05.090099 IP 112.26.0.1.44905 > 112.26.0.8.35432: Flags [.], seq 31229:32657, ack 1, win 1339, options [nop,nop,TS val 1531540 ecr 1315487,mptcp dss ack 1507037785 seq 1287649364 subseq 31229 len 1428 csum 0x9cfd], length 1428
08:03:05.182944 IP 112.26.0.8.35432 > 112.26.0.1.44905: Flags [.], ack 9809, win 2008, options [nop,nop,TS val 1316285 ecr 1530330,nop,nop,sack 1 {14093:24089},mptcp dss ack 1287627944], length 0
08:03:05.186267 IP 112.26.0.8.35432 > 112.26.0.1.44905: Flags [.], ack 9809, win 2008, options [nop,nop,TS val 1316285 ecr 1530330,nop,nop,sack 1 {14093:24089},mptcp dss ack 1287627944], length 0
08:03:05.193146 IP 112.26.0.1.44905 > 112.26.0.8.35432: Flags [.], seq 32657:34085, ack 1, win 1339, options [nop,nop,TS val 1531540 ecr 1315487,mptcp dss ack 1507037785 seq 1287650792 subseq 32657 len 1428 csum 0x18a8], length 1428
08:03:05.271565 IP 112.26.0.8.35432 > 112.26.0.1.44905: Flags [.], ack 9809, win 2054, options [nop,nop,TS val 1316300 ecr 1530330,nop,nop,sack 1 {14093:25517},mptcp dss ack 1287627944], length 0
08:03:05.276344 IP 112.26.0.8.35432 > 112.26.0.1.44905: Flags [.], ack 9809, win 2054, options [nop,nop,TS val 1316300 ecr 1530330,nop,nop,sack 1 {14093:25517},mptcp dss ack 1287627944], length 0
08:03:05.280510 IP 112.26.0.1.44905 > 112.26.0.8.35432: Flags [.], seq 34085:35513, ack 1, win 1339, options [nop,nop,TS val 1532535 ecr 1316285,mptcp dss ack 1507037785 seq 1287652220 subseq 34085 len 1428 csum 0x3999], length 1428
08:03:05.280782 IP 112.26.0.1.44905 > 112.26.0.8.35432: Flags [.], seq 34085:35513, ack 1, win 1339, options [nop,nop,TS val 1532535 ecr 1316285,mptcp dss ack 1507037785 seq 1287652220 subseq 34085 len 1428 csum 0x3999], length 1428
08:03:05.363413 IP 112.26.0.1.44905 > 112.26.0.8.35432: Flags [.], seq 9809:11237, ack 1, win 1339, options [nop,nop,TS val 1531742 ecr 1315689,mptcp dss ack 1507037785 seq 1287627944 subseq 9809 len 1428 csum 0xb8a1], length 1428
08:03:05.375538 IP 112.26.0.1.44905 > 112.26.0.8.35432: Flags [.], seq 11237:12665, ack 1, win 1339, options [nop,nop,TS val 1531921 ecr 1315781,mptcp dss ack 1507037785 seq 1287629372 subseq 11237 len 1428 csum 0xe827], length 1428
08:03:05.457064 IP 112.26.0.8.35432 > 112.26.0.1.44905: Flags [.], ack 9809, win 2099, options [nop,nop,TS val 1316495 ecr 1530330,nop,nop,sack 2 {26945:28373}{14093:25517},mptcp dss ack 1287627944], length 0
08:03:05.462722 IP 112.26.0.1.44905 > 112.26.0.8.35432: Flags [.], seq 35513:36941, ack 1, win 1339, options [nop,nop,TS val 1532721 ecr 1316300,mptcp dss ack 1507037785 seq 1287653648 subseq 35513 len 1428 csum 0x263e], length 1428
08:03:05.463030 IP 112.26.0.1.44905 > 112.26.0.8.35432: Flags [.], seq 35513:36941, ack 1, win 1339, options [nop,nop,TS val 1532721 ecr 1316300,mptcp dss ack 1507037785 seq 1287653648 subseq 35513 len 1428 csum 0x263e], length 1428
08:03:05.464044 IP 112.26.0.8.35432 > 112.26.0.1.44905: Flags [.], ack 9809, win 2099, options [nop,nop,TS val 1316495 ecr 1530330,nop,nop,sack 2 {26945:28373}{14093:25517},mptcp dss ack 1287627944], length 0
08:03:05.486264 IP 112.26.0.1.44905 > 112.26.0.8.35432: Flags [.], seq 25517:26945, ack 1, win 1339, options [nop,nop,TS val 1532721 ecr 1316495,mptcp dss ack 1507037785 seq 1287643652 subseq 25517 len 1428 csum 0xf1c2], length 1428
08:03:05.486503 IP 112.26.0.1.44905 > 112.26.0.8.35432: Flags [.], seq 25517:26945, ack 1, win 1339, options [nop,nop,TS val 1532721 ecr 1316495,mptcp dss ack 1507037785 seq 1287643652 subseq 25517 len 1428 csum 0xf1c2], length 1428
08:03:05.489463 IP 112.26.0.8.35432 > 112.26.0.1.44905: Flags [.], ack 9809, win 2145, options [nop,nop,TS val 1316579 ecr 1530330,nop,nop,sack 2 {26945:29801}{14093:25517},mptcp dss ack 1287627944], length 0
08:03:05.491343 IP 112.26.0.8.35432 > 112.26.0.1.44905: Flags [.], ack 9809, win 2145, options [nop,nop,TS val 1316579 ecr 1530330,nop,nop,sack 2 {26945:29801}{14093:25517},mptcp dss ack 1287627944], length 0
08:03:05.561853 IP 112.26.0.1.44905 > 112.26.0.8.35432: Flags [.], seq 12665:14093, ack 1, win 1339, options [nop,nop,TS val 1532335 ecr 1316093,mptcp dss ack 1507037785 seq 1287630800 subseq 12665 len 1428 csum 0x2a25], length 1428
08:03:05.574199 IP 112.26.0.8.35432 > 112.26.0.1.44905: Flags [.], ack 9809, win 2190, options [nop,nop,TS val 1316609 ecr 1530330,nop,nop,sack 2 {31229:32657}{26945:29801},mptcp dss ack 1287627944], length 0
08:03:05.579061 IP 112.26.0.8.35432 > 112.26.0.1.44905: Flags [.], ack 9809, win 2190, options [nop,nop,TS val 1316609 ecr 1530330,nop,nop,sack 2 {31229:32657}{26945:29801},mptcp dss ack 1287627944], length 0
08:03:05.580830 IP 112.26.0.1.44905 > 112.26.0.8.35432: Flags [.], seq 36941:38369, ack 1, win 1339, options [nop,nop,TS val 1532838 ecr 1316579,mptcp dss ack 1507037785 seq 1287655076 subseq 36941 len 1428 csum 0x7eb1], length 1428
08:03:05.581065 IP 112.26.0.1.44905 > 112.26.0.8.35432: Flags [.], seq 36941:38369, ack 1, win 1339, options [nop,nop,TS val 1532838 ecr 1316579,mptcp dss ack 1507037785 seq 1287655076 subseq 36941 len 1428 csum 0x7eb1], length 1428
08:03:05.669595 IP 112.26.0.1.44905 > 112.26.0.8.35432: Flags [.], seq 29801:31229, ack 1, win 1339, options [nop,nop,TS val 1532838 ecr 1316609,mptcp dss ack 1507037785 seq 1287647936 subseq 29801 len 1428 csum 0xa9bd], length 1428
08:03:05.669902 IP 112.26.0.1.44905 > 112.26.0.8.35432: Flags [.], seq 29801:31229, ack 1, win 1339, options [nop,nop,TS val 1532838 ecr 1316609,mptcp dss ack 1507037785 seq 1287647936 subseq 29801 len 1428 csum 0xa9bd], length 1428
08:03:05.696589 IP 112.26.0.8.35432 > 112.26.0.1.44905: Flags [.], ack 9809, win 2236, options [nop,nop,TS val 1316712 ecr 1530330,nop,nop,sack 2 {31229:34085}{26945:29801},mptcp dss ack 1287627944], length 0
08:03:05.699994 IP 112.26.0.8.35432 > 112.26.0.1.44905: Flags [.], ack 9809, win 2236, options [nop,nop,TS val 1316712 ecr 1530330,nop,nop,sack 2 {31229:34085}{26945:29801},mptcp dss ack 1287627944], length 0
08:03:05.766540 IP 112.26.0.1.44905 > 112.26.0.8.35432: Flags [.], seq 34085:35513, ack 1, win 1339, options [nop,nop,TS val 1532535 ecr 1316285,mptcp dss ack 1507037785 seq 1287652220 subseq 34085 len 1428 csum 0x3999], length 1428
08:03:05.778246 IP 112.26.0.8.35432 > 112.26.0.1.44905: Flags [.], ack 11237, win 2282, options [nop,nop,TS val 1316883 ecr 1531742,nop,nop,sack 2 {31229:34085}{26945:29801},mptcp dss ack 1287629372], length 0
08:03:05.783944 IP 112.26.0.1.44905 > 112.26.0.8.35432: Flags [.], seq 38369:39797, ack 1, win 1339, options [nop,nop,TS val 1533042 ecr 1316712,mptcp dss ack 1507037785 seq 1287656504 subseq 38369 len 1428 csum 0x4b7], length 1428
08:03:05.784192 IP 112.26.0.1.44905 > 112.26.0.8.35432: Flags [.], seq 38369:39797, ack 1, win 1339, options [nop,nop,TS val 1533042 ecr 1316712,mptcp dss ack 1507037785 seq 1287656504 subseq 38369 len 1428 csum 0x4b7], length 1428
08:03:05.784848 IP 112.26.0.8.35432 > 112.26.0.1.44905: Flags [.], ack 11237, win 2282, options [nop,nop,TS val 1316883 ecr 1531742,nop,nop,sack 2 {31229:34085}{26945:29801},mptcp dss ack 1287629372], length 0
08:03:05.873603 IP 112.26.0.1.44905 > 112.26.0.8.35432: Flags [.], seq 39797:41225, ack 1, win 1339, options [nop,nop,TS val 1533042 ecr 1316883,mptcp dss ack 1507037785 seq 1287657932 subseq 39797 len 1428 csum 0xd119], length 1428
08:03:05.873883 IP 112.26.0.1.44905 > 112.26.0.8.35432: Flags [.], seq 39797:41225, ack 1, win 1339, options [nop,nop,TS val 1533042 ecr 1316883,mptcp dss ack 1507037785 seq 1287657932 subseq 39797 len 1428 csum 0xd119], length 1428
08:03:05.879366 IP 112.26.0.8.35432 > 112.26.0.1.44905: Flags [.], ack 12665, win 2327, options [nop,nop,TS val 1316895 ecr 1531921,nop,nop,sack 2 {31229:34085}{26945:29801},mptcp dss ack 1287630800], length 0
08:03:05.882064 IP 112.26.0.8.35432 > 112.26.0.1.44905: Flags [.], ack 12665, win 2327, options [nop,nop,TS val 1316895 ecr 1531921,nop,nop,sack 2 {31229:34085}{26945:29801},mptcp dss ack 1287630800], length 0
08:03:05.892149 IP 112.26.0.1.44905 > 112.26.0.8.35432: Flags [.], seq 35513:36941, ack 1, win 1339, options [nop,nop,TS val 1532721 ecr 1316300,mptcp dss ack 1507037785 seq 1287653648 subseq 35513 len 1428 csum 0x263e], length 1428
08:03:05.965395 IP 112.26.0.1.44905 > 112.26.0.8.35432: Flags [.], seq 41225:42653, ack 1, win 1339, options [nop,nop,TS val 1533042 ecr 1316883,mptcp dss ack 1507037785 seq 1287659360 subseq 41225 len 1428 csum 0xca52], length 1428
08:03:05.965722 IP 112.26.0.1.44905 > 112.26.0.8.35432: Flags [.], seq 41225:42653, ack 1, win 1339, options [nop,nop,TS val 1533042 ecr 1316883,mptcp dss ack 1507037785 seq 1287659360 subseq 41225 len 1428 csum 0xca52], length 1428
08:03:05.976228 IP 112.26.0.1.44905 > 112.26.0.8.35432: Flags [.], seq 42653:44081, ack 1, win 1339, options [nop,nop,TS val 1533042 ecr 1316883,mptcp dss ack 1507037785 seq 1287660788 subseq 42653 len 1428 csum 0xe9f0], length 1428
08:03:05.976441 IP 112.26.0.1.44905 > 112.26.0.8.35432: Flags [.], seq 42653:44081, ack 1, win 1339, options [nop,nop,TS val 1533042 ecr 1316883,mptcp dss ack 1507037785 seq 1287660788 subseq 42653 len 1428 csum 0xe9f0], length 1428
08:03:05.981223 IP 112.26.0.1.44905 > 112.26.0.8.35432: Flags [.], seq 25517:26945, ack 1, win 1339, options [nop,nop,TS val 1532721 ecr 1316495,mptcp dss ack 1507037785 seq 1287643652 subseq 25517 len 1428 csum 0xf1c2], length 1428
08:03:06.061044 IP 112.26.0.1.44905 > 112.26.0.8.35432: Flags [.], seq 44081:45509, ack 1, win 1339, options [nop,nop,TS val 1533143 ecr 1316895,mptcp dss ack 1507037785 seq 1287662216 subseq 44081 len 1428 csum 0xda96], length 1428
08:03:06.061345 IP 112.26.0.1.44905 > 112.26.0.8.35432: Flags [.], seq 44081:45509, ack 1, win 1339, options [nop,nop,TS val 1533143 ecr 1316895,mptcp dss ack 1507037785 seq 1287662216 subseq 44081 len 1428 csum 0xda96], length 1428
08:03:06.063633 IP 112.26.0.8.35432 > 112.26.0.1.44905: Flags [.], ack 25517, win 2373, options [nop,nop,TS val 1317079 ecr 1532335,nop,nop,sack 2 {31229:34085}{26945:29801},mptcp dss ack 1287643652], length 0
08:03:06.067732 IP 112.26.0.8.35432 > 112.26.0.1.44905: Flags [.], ack 25517, win 2373, options [nop,nop,TS val 1317079 ecr 1532335,nop,nop,sack 2 {31229:34085}{26945:29801},mptcp dss ack 1287643652], length 0
08:03:06.076954 IP 112.26.0.1.44905 > 112.26.0.8.35432: Flags [.], seq 45509:46937, ack 1, win 1339, options [nop,nop,TS val 1533330 ecr 1317079,mptcp dss ack 1507037785 seq 1287663644 subseq 45509 len 1428 csum 0x683c], length 1428
08:03:06.077172 IP 112.26.0.1.44905 > 112.26.0.8.35432: Flags [.], seq 45509:46937, ack 1, win 1339, options [nop,nop,TS val 1533330 ecr 1317079,mptcp dss ack 1507037785 seq 1287663644 subseq 45509 len 1428 csum 0x683c], length 1428
08:03:06.087817 IP 112.26.0.1.44905 > 112.26.0.8.35432: Flags [.], seq 29801:31229, ack 1, win 1339, options [nop,nop,TS val 1532838 ecr 1316609,mptcp dss ack 1507037785 seq 1287647936 subseq 29801 len 1428 csum 0xa9bd], length 1428
08:03:06.176914 IP 112.26.0.8.35432 > 112.26.0.1.44905: Flags [.], ack 25517, win 2419, options [nop,nop,TS val 1317286 ecr 1532335,nop,nop,sack 2 {31229:35513}{26945:29801},mptcp dss ack 1287643652], length 0
08:03:06.179496 IP 112.26.0.8.35432 > 112.26.0.1.44905: Flags [.], ack 25517, win 2419, options [nop,nop,TS val 1317286 ecr 1532335,nop,nop,sack 2 {31229:35513}{26945:29801},mptcp dss ack 1287643652], length 0
08:03:06.262889 IP 112.26.0.1.44905 > 112.26.0.8.35432: Flags [.], seq 38369:39797, ack 1, win 1339, options [nop,nop,TS val 1533042 ecr 1316712,mptcp dss ack 1507037785 seq 1287656504 subseq 38369 len 1428 csum 0x4b7], length 1428
08:03:06.278626 IP 112.26.0.1.44905 > 112.26.0.8.35432: Flags [.], seq 39797:41225, ack 1, win 1339, options [nop,nop,TS val 1533042 ecr 1316883,mptcp dss ack 1507037785 seq 1287657932 subseq 39797 len 1428 csum 0xd119], length 1428
08:03:06.286549 IP 112.26.0.8.35432 > 112.26.0.1.44905: Flags [.], ack 25517, win 2464, options [nop,nop,TS val 1317411 ecr 1532335,nop,nop,sack 2 {31229:36941}{26945:29801},mptcp dss ack 1287643652], length 0
08:03:06.360792 IP 112.26.0.8.35432 > 112.26.0.1.44905: Flags [.], ack 25517, win 2464, options [nop,nop,TS val 1317411 ecr 1532335,nop,nop,sack 2 {31229:36941}{26945:29801},mptcp dss ack 1287643652], length 0
08:03:06.368461 IP 112.26.0.1.44905 > 112.26.0.8.35432: Flags [.], seq 46937:48365, ack 1, win 1339, options [nop,nop,TS val 1533622 ecr 1317286,mptcp dss ack 1507037785 seq 1287665072 subseq 46937 len 1428 csum 0xb6d5], length 1428
08:03:06.368817 IP 112.26.0.1.44905 > 112.26.0.8.35432: Flags [.], seq 46937:48365, ack 1, win 1339, options [nop,nop,TS val 1533622 ecr 1317286,mptcp dss ack 1507037785 seq 1287665072 subseq 46937 len 1428 csum 0xb6d5], length 1428
08:03:06.381660 IP 112.26.0.1.44905 > 112.26.0.8.35432: Flags [.], seq 41225:42653, ack 1, win 1339, options [nop,nop,TS val 1533042 ecr 1316883,mptcp dss ack 1507037785 seq 1287659360 subseq 41225 len 1428 csum 0xca52], length 1428
08:03:06.393882 IP 112.26.0.8.35432 > 112.26.0.1.44905: Flags [.], ack 29801, win 2510, options [nop,nop,TS val 1317497 ecr 1532721,nop,nop,sack 1 {31229:36941},mptcp dss ack 1287647936], length 0
08:03:06.399978 IP 112.26.0.8.35432 > 112.26.0.1.44905: Flags [.], ack 29801, win 2510, options [nop,nop,TS val 1317497 ecr 1532721,nop,nop,sack 1 {31229:36941},mptcp dss ack 1287647936], length 0
08:03:06.400892 IP 112.26.0.1.44905 > 112.26.0.8.35432: Flags [.], seq 48365:49793, ack 1, win 1339, options [nop,nop,TS val 1533657 ecr 1317411,mptcp dss ack 1507037785 seq 1287666500 subseq 48365 len 1428 csum 0x48dc], length 1428
08:03:06.401108 IP 112.26.0.1.44905 > 112.26.0.8.35432: Flags [.], seq 48365:49793, ack 1, win 1339, options [nop,nop,TS val 1533657 ecr 1317411,mptcp dss ack 1507037785 seq 1287666500 subseq 48365 len 1428 csum 0x48dc], length 1428
08:03:06.469640 IP 112.26.0.1.44905 > 112.26.0.8.35432: Flags [.], seq 49793:51221, ack 1, win 1339, options [nop,nop,TS val 1533657 ecr 1317497,mptcp dss ack 1507037785 seq 1287667928 subseq 49793 len 1428 csum 0x48d], length 1428
08:03:06.469890 IP 112.26.0.1.44905 > 112.26.0.8.35432: Flags [.], seq 49793:51221, ack 1, win 1339, options [nop,nop,TS val 1533657 ecr 1317497,mptcp dss ack 1507037785 seq 1287667928 subseq 49793 len 1428 csum 0x48d], length 1428
08:03:06.471743 IP 112.26.0.1.44905 > 112.26.0.8.35432: Flags [.], seq 42653:44081, ack 1, win 1339, options [nop,nop,TS val 1533042 ecr 1316883,mptcp dss ack 1507037785 seq 1287660788 subseq 42653 len 1428 csum 0xe9f0], length 1428
08:03:06.487186 IP 112.26.0.8.35432 > 112.26.0.1.44905: Flags [.], ack 36941, win 2555, options [nop,nop,TS val 1317601 ecr 1532838,mptcp dss ack 1287655076], length 0
08:03:06.489959 IP 112.26.0.8.35432 > 112.26.0.1.44905: Flags [.], ack 36941, win 2555, options [nop,nop,TS val 1317601 ecr 1532838,mptcp dss ack 1287655076], length 0
08:03:06.496015 IP 112.26.0.1.44905 > 112.26.0.8.35432: Flags [.], seq 51221:52649, ack 1, win 1339, options [nop,nop,TS val 1533751 ecr 1317601,mptcp dss ack 1507037785 seq 1287669356 subseq 51221 len 1428 csum 0xd311], length 1428
08:03:06.496206 IP 112.26.0.1.44905 > 112.26.0.8.35432: Flags [.], seq 51221:52649, ack 1, win 1339, options [nop,nop,TS val 1533751 ecr 1317601,mptcp dss ack 1507037785 seq 1287669356 subseq 51221 len 1428 csum 0xd311], length 1428
08:03:06.569560 IP 112.26.0.1.44905 > 112.26.0.8.35432: Flags [.], seq 44081:45509, ack 1, win 1339, options [nop,nop,TS val 1533143 ecr 1316895,mptcp dss ack 1507037785 seq 1287662216 subseq 44081 len 1428 csum 0xda96], length 1428
08:03:06.582052 IP 112.26.0.1.44905 > 112.26.0.8.35432: Flags [.], seq 45509:46937, ack 1, win 1339, options [nop,nop,TS val 1533330 ecr 1317079,mptcp dss ack 1507037785 seq 1287663644 subseq 45509 len 1428 csum 0x683c], length 1428
08:03:06.667136 IP 112.26.0.8.35432 > 112.26.0.1.44905: Flags [.], ack 36941, win 2601, options [nop,nop,TS val 1317783 ecr 1532838,nop,nop,sack 1 {38369:39797},mptcp dss ack 1287655076], length 0
08:03:06.670947 IP 112.26.0.8.35432 > 112.26.0.1.44905: Flags [.], ack 36941, win 2601, options [nop,nop,TS val 1317783 ecr 1532838,nop,nop,sack 1 {38369:39797},mptcp dss ack 1287655076], length 0
