08:03:09.925289 IP 112.26.1.8.43037 > 112.26.1.1.44905: Flags [S], seq 3549117464, win 65535, options [mss 1460,sackOK,TS val 1321438 ecr 0,nop,wscale 6,mptcp join id 6 token 0xe65ca146 nonce 0x5a61eba9], length 0
08:03:10.033936 IP 112.26.1.8.43037 > 112.26.1.1.44905: Flags [S], seq 3549117464, win 65535, options [mss 1460,sackOK,TS val 1321438 ecr 0,nop,wscale 6,mptcp join id 6 token 0xe65ca146 nonce 0x5a61eba9], length 0
08:03:10.194846 IP 112.26.1.8.43037 > 112.26.1.1.44905: Flags [.], ack 3498645678, win 5658, options [nop,nop,TS val 1321712 ecr 1537298,mptcp join hmac 0x8b36a575312e4d581b2277bc57279a7ce3d294ca], length 0
08:03:10.228406 IP 112.26.1.8.43037 > 112.26.1.1.44905: Flags [.], ack 1, win 5658, options [nop,nop,TS val 1321712 ecr 1537298,mptcp join hmac 0x8b36a575312e4d581b2277bc57279a7ce3d294ca], length 0
08:03:10.327098 IP 112.26.1.8.43037 > 112.26.1.1.44905: Flags [.], ack 1429, win 5749, options [nop,nop,TS val 1321843 ecr 1537490,mptcp dss ack 1287710768], length 0
08:03:10.443309 IP 112.26.1.8.43037 > 112.26.1.1.44905: Flags [.], ack 1429, win 5749, options [nop,nop,TS val 1321843 ecr 1537490,mptcp dss ack 1287710768], length 0
08:03:10.512732 IP 112.26.1.8.43037 > 112.26.1.1.44905: Flags [.], ack 2857, win 5886, options [nop,nop,TS val 1322030 ecr 1537490,mptcp dss ack 1287713624], length 0
08:03:10.540711 IP 112.26.1.8.43037 > 112.26.1.1.44905: Flags [.], ack 4285, win 5932, options [nop,nop,TS val 1322059 ecr 1537492,mptcp dss ack 1287713624], length 0
08:03:10.642026 IP 112.26.1.8.43037 > 112.26.1.1.44905: Flags [.], ack 2857, win 5886, options [nop,nop,TS val 1322030 ecr 1537490,mptcp dss ack 1287713624], length 0
08:03:10.744872 IP 112.26.1.8.43037 > 112.26.1.1.44905: Flags [.], ack 4285, win 5932, options [nop,nop,TS val 1322059 ecr 1537492,mptcp dss ack 1287713624], length 0
08:03:10.798846 IP 112.26.1.8.43037 > 112.26.1.1.44905: Flags [.], ack 5713, win 6069, options [nop,nop,TS val 1322317 ecr 1537492,mptcp dss ack 1287713624], length 0
08:03:10.849247 IP 112.26.1.8.43037 > 112.26.1.1.44905: Flags [.], ack 7141, win 6114, options [nop,nop,TS val 1322349 ecr 1537493,mptcp dss ack 1287713624], length 0
08:03:10.906278 IP 112.26.1.8.43037 > 112.26.1.1.44905: Flags [.], ack 5713, win 6069, options [nop,nop,TS val 1322317 ecr 1537492,mptcp dss ack 1287713624], length 0
08:03:11.007186 IP 112.26.1.8.43037 > 112.26.1.1.44905: Flags [.], ack 7141, win 6114, options [nop,nop,TS val 1322349 ecr 1537493,mptcp dss ack 1287713624], length 0
08:03:11.012897 IP 112.26.1.8.43037 > 112.26.1.1.44905: Flags [.], ack 8569, win 6297, options [nop,nop,TS val 1322528 ecr 1537493,mptcp dss ack 1287713624], length 0
08:03:11.096706 IP 112.26.1.8.43037 > 112.26.1.1.44905: Flags [.], ack 9997, win 6342, options [nop,nop,TS val 1322614 ecr 1537493,mptcp dss ack 1287713624], length 0
08:03:11.129654 IP 112.26.1.8.43037 > 112.26.1.1.44905: Flags [.], ack 8569, win 6297, options [nop,nop,TS val 1322528 ecr 1537493,mptcp dss ack 1287713624], length 0
08:03:11.213758 IP 112.26.1.8.43037 > 112.26.1.1.44905: Flags [.], ack 9997, win 6342, options [nop,nop,TS val 1322614 ecr 1537493,mptcp dss ack 1287713624], length 0
08:03:11.289791 IP 112.26.1.8.43037 > 112.26.1.1.44905: Flags [.], ack 11425, win 6479, options [nop,nop,TS val 1322761 ecr 1537493,mptcp dss ack 1287713624], length 0
08:03:11.319768 IP 112.26.1.8.43037 > 112.26.1.1.44905: Flags [.], ack 11425, win 6570, options [nop,nop,TS val 1322836 ecr 1537493,nop,nop,sack 1 {14281:15709},mptcp dss ack 1287713624], length 0
08:03:11.409321 IP 112.26.1.8.43037 > 112.26.1.1.44905: Flags [.], ack 11425, win 6616, options [nop,nop,TS val 1322925 ecr 1537493,nop,nop,sack 1 {14281:17137},mptcp dss ack 1287713624], length 0
08:03:11.448489 IP 112.26.1.8.43037 > 112.26.1.1.44905: Flags [.], ack 11425, win 6479, options [nop,nop,TS val 1322761 ecr 1537493,mptcp dss ack 1287713624], length 0
08:03:11.525310 IP 112.26.1.8.43037 > 112.26.1.1.44905: Flags [.], ack 11425, win 6570, options [nop,nop,TS val 1322836 ecr 1537493,nop,nop,sack 1 {14281:15709},mptcp dss ack 1287713624], length 0
08:03:11.624631 IP 112.26.1.8.43037 > 112.26.1.1.44905: Flags [.], ack 11425, win 6616, options [nop,nop,TS val 1322925 ecr 1537493,nop,nop,sack 1 {14281:17137},mptcp dss ack 1287713624], length 0
08:03:11.633935 IP 112.26.1.8.43037 > 112.26.1.1.44905: Flags [.], ack 11425, win 6799, options [nop,nop,TS val 1323150 ecr 1537493,nop,nop,sack 2 {18565:19993}{14281:17137},mptcp dss ack 1287713624], length 0
08:03:11.711947 IP 112.26.1.8.43037 > 112.26.1.1.44905: Flags [.], ack 11425, win 6844, options [nop,nop,TS val 1323227 ecr 1537493,nop,nop,sack 2 {18565:21421}{14281:17137},mptcp dss ack 1287713624], length 0
08:03:11.805574 IP 112.26.1.8.43037 > 112.26.1.1.44905: Flags [.], ack 11425, win 6935, options [nop,nop,TS val 1323323 ecr 1537493,nop,nop,sack 2 {18565:22849}{14281:17137},mptcp dss ack 1287729332], length 0
08:03:11.854547 IP 112.26.1.8.43037 > 112.26.1.1.44905: Flags [.], ack 11425, win 6981, options [nop,nop,TS val 1323372 ecr 1537493,nop,nop,sack 2 {18565:24277}{14281:17137},mptcp dss ack 1287729332], length 0
08:03:12.001184 IP 112.26.1.8.43037 > 112.26.1.1.44905: Flags [.], ack 11425, win 6799, options [nop,nop,TS val 1323150 ecr 1537493,nop,nop,sack 2 {18565:19993}{14281:17137},mptcp dss ack 1287713624], length 0
08:03:12.051617 IP 112.26.1.8.43037 > 112.26.1.1.44905: Flags [.], ack 11425, win 7118, options [nop,nop,TS val 1323569 ecr 1537493,nop,nop,sack 2 {18565:25705}{14281:17137},mptcp dss ack 1287729332], length 0
08:03:12.060492 IP 112.26.1.8.43037 > 112.26.1.1.44905: Flags [.], ack 11425, win 6844, options [nop,nop,TS val 1323227 ecr 1537493,nop,nop,sack 2 {18565:21421}{14281:17137},mptcp dss ack 1287713624], length 0
08:03:12.139129 IP 112.26.1.8.43037 > 112.26.1.1.44905: Flags [.], ack 11425, win 6935, options [nop,nop,TS val 1323323 ecr 1537493,nop,nop,sack 2 {18565:22849}{14281:17137},mptcp dss ack 1287729332], length 0
08:03:12.158698 IP 112.26.1.8.43037 > 112.26.1.1.44905: Flags [.], ack 11425, win 7255, options [nop,nop,TS val 1323676 ecr 1537493,nop,nop,sack 2 {18565:27133}{14281:17137},mptcp dss ack 1287729332], length 0
08:03:12.235371 IP 112.26.1.8.43037 > 112.26.1.1.44905: Flags [.], ack 11425, win 6981, options [nop,nop,TS val 1323372 ecr 1537493,nop,nop,sack 2 {18565:24277}{14281:17137},mptcp dss ack 1287729332], length 0
08:03:12.312598 IP 112.26.1.8.43037 > 112.26.1.1.44905: Flags [.], ack 11425, win 7346, options [nop,nop,TS val 1323830 ecr 1537493,nop,nop,sack 2 {28561:29989}{18565:27133},mptcp dss ack 1287729332], length 0
08:03:12.400115 IP 112.26.1.8.43037 > 112.26.1.1.44905: Flags [.], ack 11425, win 7392, options [nop,nop,TS val 1323917 ecr 1537493,nop,nop,sack 2 {28561:31417}{18565:27133},mptcp dss ack 1287729332], length 0
08:03:12.421356 IP 112.26.1.8.43037 > 112.26.1.1.44905: Flags [.], ack 11425, win 7118, options [nop,nop,TS val 1323569 ecr 1537493,nop,nop,sack 2 {18565:25705}{14281:17137},mptcp dss ack 1287729332], length 0
08:03:12.444401 IP 112.26.1.8.43037 > 112.26.1.1.44905: Flags [.], ack 11425, win 7529, options [nop,nop,TS val 1323961 ecr 1537493,nop,nop,sack 2 {28561:32845}{18565:27133},mptcp dss ack 1287729332], length 0
08:03:12.532336 IP 112.26.1.8.43037 > 112.26.1.1.44905: Flags [.], ack 11425, win 7255, options [nop,nop,TS val 1323676 ecr 1537493,nop,nop,sack 2 {18565:27133}{14281:17137},mptcp dss ack 1287729332], length 0
08:03:12.617381 IP 112.26.1.8.43037 > 112.26.1.1.44905: Flags [.], ack 11425, win 7620, options [nop,nop,TS val 1324134 ecr 1537493,nop,nop,sack 2 {34273:35701}{28561:32845},mptcp dss ack 1287729332], length 0
08:03:12.703805 IP 112.26.1.8.43037 > 112.26.1.1.44905: Flags [.], ack 11425, win 7711, options [nop,nop,TS val 1324220 ecr 1537493,nop,nop,sack 2 {34273:37129}{28561:32845},mptcp dss ack 1287729332], length 0
08:03:12.734757 IP 112.26.1.8.43037 > 112.26.1.1.44905: Flags [.], ack 11425, win 7346, options [nop,nop,TS val 1323830 ecr 1537493,nop,nop,sack 2 {28561:29989}{18565:27133},mptcp dss ack 1287729332], length 0
08:03:12.805960 IP 112.26.1.8.43037 > 112.26.1.1.44905: Flags [.], ack 11425, win 7802, options [nop,nop,TS val 1324323 ecr 1537493,nop,nop,sack 2 {34273:38557}{28561:32845},mptcp dss ack 1287729332], length 0
08:03:12.843665 IP 112.26.1.8.43037 > 112.26.1.1.44905: Flags [.], ack 11425, win 7392, options [nop,nop,TS val 1323917 ecr 1537493,nop,nop,sack 2 {28561:31417}{18565:27133},mptcp dss ack 1287729332], length 0
08:03:12.907812 IP 112.26.1.8.43037 > 112.26.1.1.44905: Flags [.], ack 12853, win 7894, options [nop,nop,TS val 1324425 ecr 1538886,nop,nop,sack 2 {34273:38557}{28561:32845},mptcp dss ack 1287730760], length 0
08:03:12.936091 IP 112.26.1.8.43037 > 112.26.1.1.44905: Flags [.], ack 11425, win 7529, options [nop,nop,TS val 1323961 ecr 1537493,nop,nop,sack 2 {28561:32845}{18565:27133},mptcp dss ack 1287729332], length 0
08:03:13.002587 IP 112.26.1.8.43037 > 112.26.1.1.44905: Flags [.], ack 17137, win 7985, options [nop,nop,TS val 1324518 ecr 1539262,nop,nop,sack 2 {34273:38557}{28561:32845},mptcp dss ack 1287740756], length 0
08:03:13.055222 IP 112.26.1.8.43037 > 112.26.1.1.44905: Flags [.], ack 27133, win 8076, options [nop,nop,TS val 1324565 ecr 1539401,nop,nop,sack 2 {34273:38557}{28561:32845},mptcp dss ack 1287756464], length 0
08:03:13.116215 IP 112.26.1.8.43037 > 112.26.1.1.44905: Flags [.], ack 11425, win 7620, options [nop,nop,TS val 1324134 ecr 1537493,nop,nop,sack 2 {34273:35701}{28561:32845},mptcp dss ack 1287729332], length 0
08:03:13.161071 IP 112.26.1.8.43037 > 112.26.1.1.44905: Flags [.], ack 11425, win 7711, options [nop,nop,TS val 1324220 ecr 1537493,nop,nop,sack 2 {34273:37129}{28561:32845},mptcp dss ack 1287729332], length 0
08:03:13.227779 IP 112.26.1.8.43037 > 112.26.1.1.44905: Flags [.], ack 32845, win 8213, options [nop,nop,TS val 1324745 ecr 1539996,nop,nop,sack 1 {34273:38557},mptcp dss ack 1287763604], length 0
08:03:13.314400 IP 112.26.1.8.43037 > 112.26.1.1.44905: Flags [.], ack 12853, win 7894, options [nop,nop,TS val 1324425 ecr 1538886,nop,nop,sack 2 {34273:38557}{28561:32845},mptcp dss ack 1287730760], length 0
08:03:13.414559 IP 112.26.1.8.43037 > 112.26.1.1.44905: Flags [.], ack 17137, win 7985, options [nop,nop,TS val 1324518 ecr 1539262,nop,nop,sack 2 {34273:38557}{28561:32845},mptcp dss ack 1287740756], length 0
08:03:13.440779 IP 112.26.1.8.43037 > 112.26.1.1.44905: Flags [.], ack 32845, win 8350, options [nop,nop,TS val 1324958 ecr 1539996,nop,nop,sack 2 {39985:41413}{34273:38557},mptcp dss ack 1287763604], length 0
08:03:13.516661 IP 112.26.1.8.43037 > 112.26.1.1.44905: Flags [.], ack 27133, win 8076, options [nop,nop,TS val 1324565 ecr 1539401,nop,nop,sack 2 {34273:38557}{28561:32845},mptcp dss ack 1287756464], length 0
08:03:13.562348 IP 112.26.1.8.43037 > 112.26.1.1.44905: Flags [.], ack 32845, win 8487, options [nop,nop,TS val 1325080 ecr 1539996,nop,nop,sack 2 {39985:42841}{34273:38557},mptcp dss ack 1287763604], length 0
08:03:13.632114 IP 112.26.1.8.43037 > 112.26.1.1.44905: Flags [.], ack 38557, win 8532, options [nop,nop,TS val 1325143 ecr 1540377,nop,nop,sack 1 {39985:42841},mptcp dss ack 1287782168], length 0
08:03:13.713448 IP 112.26.1.8.43037 > 112.26.1.1.44905: Flags [.], ack 32845, win 8213, options [nop,nop,TS val 1324745 ecr 1539996,nop,nop,sack 1 {34273:38557},mptcp dss ack 1287763604], length 0
08:03:13.757211 IP 112.26.1.8.43037 > 112.26.1.1.44905: Flags [.], ack 38557, win 8624, options [nop,nop,TS val 1325275 ecr 1540377,nop,nop,sack 1 {39985:44269},mptcp dss ack 1287782168], length 0
08:03:13.837544 IP 112.26.1.8.43037 > 112.26.1.1.44905: Flags [.], ack 38557, win 8715, options [nop,nop,TS val 1325355 ecr 1540377,nop,nop,sack 1 {39985:45697},mptcp dss ack 1287782168], length 0
08:03:13.909257 IP 112.26.1.8.43037 > 112.26.1.1.44905: Flags [.], ack 32845, win 8350, options [nop,nop,TS val 1324958 ecr 1539996,nop,nop,sack 2 {39985:41413}{34273:38557},mptcp dss ack 1287763604], length 0
08:03:13.950006 IP 112.26.1.8.43037 > 112.26.1.1.44905: Flags [.], ack 38557, win 8806, options [nop,nop,TS val 1325465 ecr 1540377,nop,nop,sack 1 {39985:47125},mptcp dss ack 1287782168], length 0
08:03:14.033219 IP 112.26.1.8.43037 > 112.26.1.1.44905: Flags [.], ack 32845, win 8487, options [nop,nop,TS val 1325080 ecr 1539996,nop,nop,sack 2 {39985:42841}{34273:38557},mptcp dss ack 1287763604], length 0
08:03:14.116446 IP 112.26.1.8.43037 > 112.26.1.1.44905: Flags [.], ack 38557, win 8532, options [nop,nop,TS val 1325143 ecr 1540377,nop,nop,sack 1 {39985:42841},mptcp dss ack 1287782168], length 0
08:03:14.144267 IP 112.26.1.8.43037 > 112.26.1.1.44905: Flags [.], ack 38557, win 8897, options [nop,nop,TS val 1325660 ecr 1540377,nop,nop,sack 1 {39985:48553},mptcp dss ack 1287782168], length 0
08:03:14.211427 IP 112.26.1.8.43037 > 112.26.1.1.44905: Flags [.], ack 38557, win 8989, options [nop,nop,TS val 1325723 ecr 1540377,nop,nop,sack 1 {39985:49981},mptcp dss ack 1287782168], length 0
08:03:14.243929 IP 112.26.1.8.43037 > 112.26.1.1.44905: Flags [.], ack 38557, win 8624, options [nop,nop,TS val 1325275 ecr 1540377,nop,nop,sack 1 {39985:44269},mptcp dss ack 1287782168], length 0
08:03:14.306600 IP 112.26.1.8.43037 > 112.26.1.1.44905: Flags [.], ack 38557, win 9080, options [nop,nop,TS val 1325792 ecr 1540377,nop,nop,sack 1 {39985:51409},mptcp dss ack 1287782168], length 0
08:03:14.340035 IP 112.26.1.8.43037 > 112.26.1.1.44905: Flags [.], ack 38557, win 9171, options [nop,nop,TS val 1325857 ecr 1540377,nop,nop,sack 1 {39985:52837},mptcp dss ack 1287782168], length 0
08:03:14.410552 IP 112.26.1.8.43037 > 112.26.1.1.44905: Flags [.], ack 38557, win 8806, options [nop,nop,TS val 1325465 ecr 1540377,nop,nop,sack 1 {39985:47125},mptcp dss ack 1287782168], length 0
08:03:14.437886 IP 112.26.1.8.43037 > 112.26.1.1.44905: Flags [.], ack 52837, win 9262, options [nop,nop,TS val 1325950 ecr 1540975,mptcp dss ack 1287819296], length 0
08:03:14.516985 IP 112.26.1.8.43037 > 112.26.1.1.44905: Flags [.], ack 54265, win 9308, options [nop,nop,TS val 1325983 ecr 1540975,mptcp dss ack 1287823580], length 0
08:03:14.543489 IP 112.26.1.8.43037 > 112.26.1.1.44905: Flags [.], ack 38557, win 8897, options [nop,nop,TS val 1325660 ecr 1540377,nop,nop,sack 1 {39985:48553},mptcp dss ack 1287782168], length 0
08:03:14.608171 IP 112.26.1.8.43037 > 112.26.1.1.44905: Flags [.], ack 55693, win 9445, options [nop,nop,TS val 1326126 ecr 1541295,mptcp dss ack 1287823580], length 0
08:03:14.650985 IP 112.26.1.8.43037 > 112.26.1.1.44905: Flags [.], ack 38557, win 8989, options [nop,nop,TS val 1325723 ecr 1540377,nop,nop,sack 1 {39985:49981},mptcp dss ack 1287782168], length 0
08:03:14.705444 IP 112.26.1.8.43037 > 112.26.1.1.44905: Flags [.], ack 57121, win 9536, options [nop,nop,TS val 1326187 ecr 1541377,mptcp dss ack 1287823580], length 0
08:03:14.732632 IP 112.26.1.8.43037 > 112.26.1.1.44905: Flags [.], ack 38557, win 9080, options [nop,nop,TS val 1325792 ecr 1540377,nop,nop,sack 1 {39985:51409},mptcp dss ack 1287782168], length 0
08:03:14.806508 IP 112.26.1.8.43037 > 112.26.1.1.44905: Flags [.], ack 58549, win 9627, options [nop,nop,TS val 1326283 ecr 1541377,mptcp dss ack 1287823580], length 0
08:03:14.845575 IP 112.26.1.8.43037 > 112.26.1.1.44905: Flags [.], ack 38557, win 9171, options [nop,nop,TS val 1325857 ecr 1540377,nop,nop,sack 1 {39985:52837},mptcp dss ack 1287782168], length 0
08:03:14.862426 IP 112.26.1.8.43037 > 112.26.1.1.44905: Flags [.], ack 59977, win 9673, options [nop,nop,TS val 1326380 ecr 1541671,mptcp dss ack 1287823580], length 0
08:03:14.942513 IP 112.26.1.8.43037 > 112.26.1.1.44905: Flags [.], ack 52837, win 9262, options [nop,nop,TS val 1325950 ecr 1540975,mptcp dss ack 1287819296], length 0
08:03:15.018070 IP 112.26.1.8.43037 > 112.26.1.1.44905: Flags [.], ack 54265, win 9308, options [nop,nop,TS val 1325983 ecr 1540975,mptcp dss ack 1287823580], length 0
08:03:15.042726 IP 112.26.1.8.43037 > 112.26.1.1.44905: Flags [.], ack 55693, win 9445, options [nop,nop,TS val 1326126 ecr 1541295,mptcp dss ack 1287823580], length 0
08:03:15.068060 IP 112.26.1.8.43037 > 112.26.1.1.44905: Flags [.], ack 59977, win 9810, options [nop,nop,TS val 1326584 ecr 1541671,nop,nop,sack 1 {61405:62833},mptcp dss ack 1287823580], length 0
08:03:15.132612 IP 112.26.1.8.43037 > 112.26.1.1.44905: Flags [.], ack 57121, win 9536, options [nop,nop,TS val 1326187 ecr 1541377,mptcp dss ack 1287823580], length 0
08:03:15.223916 IP 112.26.1.8.43037 > 112.26.1.1.44905: Flags [.], ack 59977, win 9901, options [nop,nop,TS val 1326739 ecr 1541671,nop,nop,sack 1 {61405:64261},mptcp dss ack 1287823580], length 0
08:03:15.248141 IP 112.26.1.8.43037 > 112.26.1.1.44905: Flags [.], ack 58549, win 9627, options [nop,nop,TS val 1326283 ecr 1541377,mptcp dss ack 1287823580], length 0
08:03:15.318512 IP 112.26.1.8.43037 > 112.26.1.1.44905: Flags [.], ack 59977, win 9673, options [nop,nop,TS val 1326380 ecr 1541671,mptcp dss ack 1287823580], length 0
08:03:15.328895 IP 112.26.1.8.43037 > 112.26.1.1.44905: Flags [.], ack 59977, win 10038, options [nop,nop,TS val 1326845 ecr 1541671,nop,nop,sack 1 {61405:65689},mptcp dss ack 1287823580], length 0
08:03:15.413772 IP 112.26.1.8.43037 > 112.26.1.1.44905: Flags [.], ack 59977, win 10129, options [nop,nop,TS val 1326931 ecr 1541671,nop,nop,sack 1 {61405:67117},mptcp dss ack 1287823580], length 0
08:03:15.447230 IP 112.26.1.8.43037 > 112.26.1.1.44905: Flags [.], ack 59977, win 9810, options [nop,nop,TS val 1326584 ecr 1541671,nop,nop,sack 1 {61405:62833},mptcp dss ack 1287823580], length 0
08:03:15.531081 IP 112.26.1.8.43037 > 112.26.1.1.44905: Flags [.], ack 59977, win 10220, options [nop,nop,TS val 1327049 ecr 1541671,nop,nop,sack 1 {61405:68545},mptcp dss ack 1287823580], length 0
08:03:15.621004 IP 112.26.1.8.43037 > 112.26.1.1.44905: Flags [.], ack 59977, win 9901, options [nop,nop,TS val 1326739 ecr 1541671,nop,nop,sack 1 {61405:64261},mptcp dss ack 1287823580], length 0
08:03:15.667730 IP 112.26.1.8.43037 > 112.26.1.1.44905: Flags [.], ack 59977, win 10038, options [nop,nop,TS val 1326845 ecr 1541671,nop,nop,sack 1 {61405:65689},mptcp dss ack 1287823580], length 0
08:03:15.733407 IP 112.26.1.8.43037 > 112.26.1.1.44905: Flags [.], ack 59977, win 10403, options [nop,nop,TS val 1327249 ecr 1541671,nop,nop,sack 1 {61405:69973},mptcp dss ack 1287836432], length 0
08:03:15.761062 IP 112.26.1.8.43037 > 112.26.1.1.44905: Flags [.], ack 59977, win 10449, options [nop,nop,TS val 1327275 ecr 1541671,nop,nop,sack 1 {61405:71401},mptcp dss ack 1287836432], length 0
08:03:15.835517 IP 112.26.1.8.43037 > 112.26.1.1.44905: Flags [.], ack 59977, win 10129, options [nop,nop,TS val 1326931 ecr 1541671,nop,nop,sack 1 {61405:67117},mptcp dss ack 1287823580], length 0
08:03:15.945824 IP 112.26.1.8.43037 > 112.26.1.1.44905: Flags [.], ack 59977, win 10220, options [nop,nop,TS val 1327049 ecr 1541671,nop,nop,sack 1 {61405:68545},mptcp dss ack 1287823580], length 0
08:03:15.964673 IP 112.26.1.8.43037 > 112.26.1.1.44905: Flags [.], ack 59977, win 10540, options [nop,nop,TS val 1327482 ecr 1541671,nop,nop,sack 1 {61405:72829},mptcp dss ack 1287836432], length 0
08:03:16.036393 IP 112.26.1.8.43037 > 112.26.1.1.44905: Flags [.], ack 59977, win 10585, options [nop,nop,TS val 1327542 ecr 1541671,nop,nop,sack 1 {61405:74257},mptcp dss ack 1287836432], length 0
08:03:16.064750 IP 112.26.1.8.43037 > 112.26.1.1.44905: Flags [.], ack 59977, win 10403, options [nop,nop,TS val 1327249 ecr 1541671,nop,nop,sack 1 {61405:69973},mptcp dss ack 1287836432], length 0
08:03:16.133920 IP 112.26.1.8.43037 > 112.26.1.1.44905: Flags [.], ack 74257, win 10677, options [nop,nop,TS val 1327650 ecr 1542929,mptcp dss ack 1287866420], length 0
08:03:16.156532 IP 112.26.1.8.43037 > 112.26.1.1.44905: Flags [.], ack 59977, win 10449, options [nop,nop,TS val 1327275 ecr 1541671,nop,nop,sack 1 {61405:71401},mptcp dss ack 1287836432], length 0
08:03:16.228611 IP 112.26.1.8.43037 > 112.26.1.1.44905: Flags [.], ack 75685, win 10722, options [nop,nop,TS val 1327745 ecr 1543121,mptcp dss ack 1287866420], length 0
08:03:16.276414 IP 112.26.1.8.43037 > 112.26.1.1.44905: Flags [.], ack 59977, win 10540, options [nop,nop,TS val 1327482 ecr 1541671,nop,nop,sack 1 {61405:72829},mptcp dss ack 1287836432], length 0
08:03:16.341389 IP 112.26.1.8.43037 > 112.26.1.1.44905: Flags [.], ack 59977, win 10585, options [nop,nop,TS val 1327542 ecr 1541671,nop,nop,sack 1 {61405:74257},mptcp dss ack 1287836432], length 0
08:03:16.434348 IP 112.26.1.8.43037 > 112.26.1.1.44905: Flags [.], ack 74257, win 10677, options [nop,nop,TS val 1327650 ecr 1542929,mptcp dss ack 1287866420], length 0
08:03:16.449718 IP 112.26.1.8.43037 > 112.26.1.1.44905: Flags [.], ack 77113, win 10905, options [nop,nop,TS val 1327968 ecr 1543429,mptcp dss ack 1287872132], length 0
08:03:16.520996 IP 112.26.1.8.43037 > 112.26.1.1.44905: Flags [.], ack 75685, win 10722, options [nop,nop,TS val 1327745 ecr 1543121,mptcp dss ack 1287866420], length 0
08:03:16.540139 IP 112.26.1.8.43037 > 112.26.1.1.44905: Flags [.], ack 78541, win 10996, options [nop,nop,TS val 1328056 ecr 1543602,mptcp dss ack 1287874988], length 0
08:03:16.633290 IP 112.26.1.8.43037 > 112.26.1.1.44905: Flags [.], ack 79969, win 11087, options [nop,nop,TS val 1328149 ecr 1543628,mptcp dss ack 1287876416], length 0
08:03:16.652433 IP 112.26.1.8.43037 > 112.26.1.1.44905: Flags [.], ack 77113, win 10905, options [nop,nop,TS val 1327968 ecr 1543429,mptcp dss ack 1287872132], length 0
08:03:16.739588 IP 112.26.1.8.43037 > 112.26.1.1.44905: Flags [.], ack 81397, win 11179, options [nop,nop,TS val 1328256 ecr 1543696,mptcp dss ack 1287877844], length 0
08:03:16.762548 IP 112.26.1.8.43037 > 112.26.1.1.44905: Flags [.], ack 78541, win 10996, options [nop,nop,TS val 1328056 ecr 1543602,mptcp dss ack 1287874988], length 0
08:03:16.841132 IP 112.26.1.8.43037 > 112.26.1.1.44905: Flags [.], ack 82825, win 11315, options [nop,nop,TS val 1328357 ecr 1543786,mptcp dss ack 1287883556], length 0
08:03:16.873573 IP 112.26.1.8.43037 > 112.26.1.1.44905: Flags [.], ack 79969, win 11087, options [nop,nop,TS val 1328149 ecr 1543628,mptcp dss ack 1287876416], length 0
08:03:16.954904 IP 112.26.1.8.43037 > 112.26.1.1.44905: Flags [.], ack 84253, win 11361, options [nop,nop,TS val 1328472 ecr 1543914,mptcp dss ack 1287883556], length 0
08:03:17.036950 IP 112.26.1.8.43037 > 112.26.1.1.44905: Flags [.], ack 81397, win 11179, options [nop,nop,TS val 1328256 ecr 1543696,mptcp dss ack 1287877844], length 0
08:03:17.126878 IP 112.26.1.8.43037 > 112.26.1.1.44905: Flags [.], ack 85681, win 11498, options [nop,nop,TS val 1328641 ecr 1544024,mptcp dss ack 1287890696], length 0
08:03:17.163931 IP 112.26.1.8.43037 > 112.26.1.1.44905: Flags [.], ack 82825, win 11315, options [nop,nop,TS val 1328357 ecr 1543786,mptcp dss ack 1287883556], length 0
08:03:17.236237 IP 112.26.1.8.43037 > 112.26.1.1.44905: Flags [.], ack 87109, win 11589, options [nop,nop,TS val 1328749 ecr 1544135,mptcp dss ack 1287893552], length 0
08:03:17.288170 IP 112.26.1.8.43037 > 112.26.1.1.44905: Flags [.], ack 84253, win 11361, options [nop,nop,TS val 1328472 ecr 1543914,mptcp dss ack 1287883556], length 0
08:03:17.346976 IP 112.26.1.8.43037 > 112.26.1.1.44905: Flags [.], ack 88537, win 11726, options [nop,nop,TS val 1328862 ecr 1544135,mptcp dss ack 1287899264], length 0
08:03:17.382617 IP 112.26.1.8.43037 > 112.26.1.1.44905: Flags [.], ack 89965, win 11772, options [nop,nop,TS val 1328897 ecr 1544301,mptcp dss ack 1287899264], length 0
08:03:17.449606 IP 112.26.1.8.43037 > 112.26.1.1.44905: Flags [.], ack 85681, win 11498, options [nop,nop,TS val 1328641 ecr 1544024,mptcp dss ack 1287890696], length 0
08:03:17.467310 IP 112.26.1.8.43037 > 112.26.1.1.44905: Flags [.], ack 91393, win 11863, options [nop,nop,TS val 1328981 ecr 1544425,mptcp dss ack 1287902120], length 0
08:03:17.539313 IP 112.26.1.8.43037 > 112.26.1.1.44905: Flags [.], ack 87109, win 11589, options [nop,nop,TS val 1328749 ecr 1544135,mptcp dss ack 1287893552], length 0
08:03:17.553635 IP 112.26.1.8.43037 > 112.26.1.1.44905: Flags [.], ack 92821, win 11954, options [nop,nop,TS val 1329071 ecr 1544549,mptcp dss ack 1287903548], length 0
08:03:17.647536 IP 112.26.1.8.43037 > 112.26.1.1.44905: Flags [.], ack 88537, win 11726, options [nop,nop,TS val 1328862 ecr 1544135,mptcp dss ack 1287899264], length 0
08:03:17.725582 IP 112.26.1.8.43037 > 112.26.1.1.44905: Flags [.], ack 89965, win 11772, options [nop,nop,TS val 1328897 ecr 1544301,mptcp dss ack 1287899264], length 0
08:03:17.777806 IP 112.26.1.8.43037 > 112.26.1.1.44905: Flags [.], ack 91393, win 11863, options [nop,nop,TS val 1328981 ecr 1544425,mptcp dss ack 1287902120], length 0
08:03:17.847287 IP 112.26.1.8.43037 > 112.26.1.1.44905: Flags [.], ack 94249, win 12182, options [nop,nop,TS val 1329361 ecr 1544711,mptcp dss ack 1287912116], length 0
08:03:17.881693 IP 112.26.1.8.43037 > 112.26.1.1.44905: Flags [.], ack 92821, win 11954, options [nop,nop,TS val 1329071 ecr 1544549,mptcp dss ack 1287903548], length 0
08:03:17.952696 IP 112.26.1.8.43037 > 112.26.1.1.44905: Flags [.], ack 95677, win 12274, options [nop,nop,TS val 1329470 ecr 1544800,mptcp dss ack 1287916400], length 0
08:03:18.031323 IP 112.26.1.8.43037 > 112.26.1.1.44905: Flags [.], ack 97105, win 12365, options [nop,nop,TS val 1329502 ecr 1544908,mptcp dss ack 1287919256], length 0
08:03:18.060268 IP 112.26.1.8.43037 > 112.26.1.1.44905: Flags [.], ack 98533, win 12410, options [nop,nop,TS val 1329578 ecr 1544986,mptcp dss ack 1287920684], length 0
08:03:18.129188 IP 112.26.1.8.43037 > 112.26.1.1.44905: Flags [.], ack 99961, win 12456, options [nop,nop,TS val 1329646 ecr 1545039,mptcp dss ack 1287920684], length 0
08:03:18.161691 IP 112.26.1.8.43037 > 112.26.1.1.44905: Flags [.], ack 94249, win 12182, options [nop,nop,TS val 1329361 ecr 1544711,mptcp dss ack 1287912116], length 0
08:03:18.234979 IP 112.26.1.8.43037 > 112.26.1.1.44905: Flags [.], ack 101389, win 12502, options [nop,nop,TS val 1329752 ecr 1545143,mptcp dss ack 1287920684], length 0
08:03:18.279172 IP 112.26.1.8.43037 > 112.26.1.1.44905: Flags [.], ack 95677, win 12274, options [nop,nop,TS val 1329470 ecr 1544800,mptcp dss ack 1287916400], length 0
08:03:18.366187 IP 112.26.1.8.43037 > 112.26.1.1.44905: Flags [.], ack 97105, win 12365, options [nop,nop,TS val 1329502 ecr 1544908,mptcp dss ack 1287919256], length 0
08:03:18.448228 IP 112.26.1.8.43037 > 112.26.1.1.44905: Flags [.], ack 102817, win 12684, options [nop,nop,TS val 1329965 ecr 1545423,mptcp dss ack 1287927824], length 0
08:03:18.462181 IP 112.26.1.8.43037 > 112.26.1.1.44905: Flags [.], ack 98533, win 12410, options [nop,nop,TS val 1329578 ecr 1544986,mptcp dss ack 1287920684], length 0
08:03:18.535548 IP 112.26.1.8.43037 > 112.26.1.1.44905: Flags [.], ack 104245, win 12775, options [nop,nop,TS val 1330053 ecr 1545540,mptcp dss ack 1287929252], length 0
08:03:18.551496 IP 112.26.1.8.43037 > 112.26.1.1.44905: Flags [.], ack 99961, win 12456, options [nop,nop,TS val 1329646 ecr 1545039,mptcp dss ack 1287920684], length 0
08:03:18.626935 IP 112.26.1.8.43037 > 112.26.1.1.44905: Flags [.], ack 105673, win 12867, options [nop,nop,TS val 1330095 ecr 1545627,mptcp dss ack 1287930680], length 0
08:03:18.648779 IP 112.26.1.8.43037 > 112.26.1.1.44905: Flags [.], ack 101389, win 12502, options [nop,nop,TS val 1329752 ecr 1545143,mptcp dss ack 1287920684], length 0
08:03:18.690787 IP 112.26.1.8.43037 > 112.26.1.1.44905: Flags [.], ack 102817, win 12684, options [nop,nop,TS val 1329965 ecr 1545423,mptcp dss ack 1287927824], length 0
08:03:18.756254 IP 112.26.1.8.43037 > 112.26.1.1.44905: Flags [.], ack 107101, win 13004, options [nop,nop,TS val 1330271 ecr 1545723,mptcp dss ack 1287934964], length 0
08:03:18.835270 IP 112.26.1.8.43037 > 112.26.1.1.44905: Flags [.], ack 104245, win 12775, options [nop,nop,TS val 1330053 ecr 1545540,mptcp dss ack 1287929252], length 0
08:03:18.888607 IP 112.26.1.8.43037 > 112.26.1.1.44905: Flags [.], ack 108529, win 13095, options [nop,nop,TS val 1330406 ecr 1545813,mptcp dss ack 1287936392], length 0
08:03:18.955566 IP 112.26.1.8.43037 > 112.26.1.1.44905: Flags [.], ack 105673, win 12867, options [nop,nop,TS val 1330095 ecr 1545627,mptcp dss ack 1287930680], length 0
08:03:18.991460 IP 112.26.1.8.43037 > 112.26.1.1.44905: Flags [.], ack 109957, win 13186, options [nop,nop,TS val 1330509 ecr 1545910,mptcp dss ack 1287936392], length 0
08:03:19.071686 IP 112.26.1.8.43037 > 112.26.1.1.44905: Flags [.], ack 107101, win 13004, options [nop,nop,TS val 1330271 ecr 1545723,mptcp dss ack 1287934964], length 0
08:03:19.099462 IP 112.26.1.8.43037 > 112.26.1.1.44905: Flags [.], ack 111385, win 13277, options [nop,nop,TS val 1330615 ecr 1545952,mptcp dss ack 1287936392], length 0
08:03:19.160952 IP 112.26.1.8.43037 > 112.26.1.1.44905: Flags [.], ack 112813, win 13323, options [nop,nop,TS val 1330679 ecr 1546097,mptcp dss ack 1287936392], length 0
08:03:19.205391 IP 112.26.1.8.43037 > 112.26.1.1.44905: Flags [.], ack 108529, win 13095, options [nop,nop,TS val 1330406 ecr 1545813,mptcp dss ack 1287936392], length 0
08:03:19.269216 IP 112.26.1.8.43037 > 112.26.1.1.44905: Flags [.], ack 114241, win 13369, options [nop,nop,TS val 1330786 ecr 1546214,mptcp dss ack 1287936392], length 0
08:03:19.352612 IP 112.26.1.8.43037 > 112.26.1.1.44905: Flags [.], ack 109957, win 13186, options [nop,nop,TS val 1330509 ecr 1545910,mptcp dss ack 1287936392], length 0
08:03:19.391048 IP 112.26.1.8.43037 > 112.26.1.1.44905: Flags [.], ack 115669, win 13460, options [nop,nop,TS val 1330909 ecr 1546214,mptcp dss ack 1287936392], length 0
08:03:19.458078 IP 112.26.1.8.43037 > 112.26.1.1.44905: Flags [.], ack 111385, win 13277, options [nop,nop,TS val 1330615 ecr 1545952,mptcp dss ack 1287936392], length 0
08:03:19.535555 IP 112.26.1.8.43037 > 112.26.1.1.44905: Flags [.], ack 112813, win 13323, options [nop,nop,TS val 1330679 ecr 1546097,mptcp dss ack 1287936392], length 0
08:03:19.549104 IP 112.26.1.8.43037 > 112.26.1.1.44905: Flags [.], ack 117097, win 13597, options [nop,nop,TS val 1331067 ecr 1546333,mptcp dss ack 1287936392], length 0
08:03:19.635239 IP 112.26.1.8.43037 > 112.26.1.1.44905: Flags [.], ack 114241, win 13369, options [nop,nop,TS val 1330786 ecr 1546214,mptcp dss ack 1287936392], length 0
08:03:19.658909 IP 112.26.1.8.43037 > 112.26.1.1.44905: Flags [.], ack 118525, win 13734, options [nop,nop,TS val 1331176 ecr 1546467,mptcp dss ack 1287936392], length 0
08:03:19.695665 IP 112.26.1.8.43037 > 112.26.1.1.44905: Flags [.], ack 119953, win 13779, options [nop,nop,TS val 1331205 ecr 1546614,mptcp dss ack 1287936392], length 0
08:03:19.760999 IP 112.26.1.8.43037 > 112.26.1.1.44905: Flags [.], ack 115669, win 13460, options [nop,nop,TS val 1330909 ecr 1546214,mptcp dss ack 1287936392], length 0
08:03:19.787172 IP 112.26.1.8.43037 > 112.26.1.1.44905: Flags [.], ack 121381, win 13916, options [nop,nop,TS val 1331305 ecr 1546718,mptcp dss ack 1287936392], length 0
08:03:19.864912 IP 112.26.1.8.43037 > 112.26.1.1.44905: Flags [.], ack 122809, win 13962, options [nop,nop,TS val 1331382 ecr 1546796,mptcp dss ack 1287936392], length 0
08:03:19.896849 IP 112.26.1.8.43037 > 112.26.1.1.44905: Flags [.], ack 117097, win 13597, options [nop,nop,TS val 1331067 ecr 1546333,mptcp dss ack 1287936392], length 0
08:03:19.961854 IP 112.26.1.8.43037 > 112.26.1.1.44905: Flags [.], ack 124237, win 14007, options [nop,nop,TS val 1331480 ecr 1546796,mptcp dss ack 1287936392], length 0
08:03:20.043546 IP 112.26.1.8.43037 > 112.26.1.1.44905: Flags [.], ack 118525, win 13734, options [nop,nop,TS val 1331176 ecr 1546467,mptcp dss ack 1287936392], length 0
08:03:20.078435 IP 112.26.1.8.43037 > 112.26.1.1.44905: Flags [.], ack 125665, win 14144, options [nop,nop,TS val 1331596 ecr 1546896,mptcp dss ack 1287936392], length 0
08:03:20.159528 IP 112.26.1.8.43037 > 112.26.1.1.44905: Flags [.], ack 119953, win 13779, options [nop,nop,TS val 1331205 ecr 1546614,mptcp dss ack 1287936392], length 0
08:03:20.245102 IP 112.26.1.8.43037 > 112.26.1.1.44905: Flags [.], ack 121381, win 13916, options [nop,nop,TS val 1331305 ecr 1546718,mptcp dss ack 1287936392], length 0
08:03:20.267395 IP 112.26.1.8.43037 > 112.26.1.1.44905: Flags [.], ack 127093, win 14235, options [nop,nop,TS val 1331783 ecr 1547023,mptcp dss ack 1287936392], length 0
08:03:20.351755 IP 112.26.1.8.43037 > 112.26.1.1.44905: Flags [.], ack 122809, win 13962, options [nop,nop,TS val 1331382 ecr 1546796,mptcp dss ack 1287936392], length 0
08:03:20.390042 IP 112.26.1.8.43037 > 112.26.1.1.44905: Flags [.], ack 128521, win 14372, options [nop,nop,TS val 1331908 ecr 1547155,mptcp dss ack 1287982088], length 0
08:03:20.467001 IP 112.26.1.8.43037 > 112.26.1.1.44905: Flags [.], ack 124237, win 14007, options [nop,nop,TS val 1331480 ecr 1546796,mptcp dss ack 1287936392], length 0
08:03:20.491726 IP 112.26.1.8.43037 > 112.26.1.1.44905: Flags [.], ack 128521, win 14509, options [nop,nop,TS val 1332008 ecr 1547155,nop,nop,sack 1 {129949:131377},mptcp dss ack 1287982088], length 0
08:03:20.580254 IP 112.26.1.8.43037 > 112.26.1.1.44905: Flags [.], ack 128521, win 14600, options [nop,nop,TS val 1332098 ecr 1547155,nop,nop,sack 1 {129949:132805},mptcp dss ack 1287982088], length 0
08:03:20.664922 IP 112.26.1.8.43037 > 112.26.1.1.44905: Flags [.], ack 128521, win 14646, options [nop,nop,TS val 1332171 ecr 1547155,nop,nop,sack 1 {129949:134233},mptcp dss ack 1287982088], length 0
08:03:20.681645 IP 112.26.1.8.43037 > 112.26.1.1.44905: Flags [.], ack 127093, win 14235, options [nop,nop,TS val 1331783 ecr 1547023,mptcp dss ack 1287936392], length 0
08:03:20.754073 IP 112.26.1.8.43037 > 112.26.1.1.44905: Flags [.], ack 128521, win 14737, options [nop,nop,TS val 1332270 ecr 1547155,nop,nop,sack 1 {129949:135661},mptcp dss ack 1287982088], length 0
08:03:20.804062 IP 112.26.1.8.43037 > 112.26.1.1.44905: Flags [.], ack 128521, win 14372, options [nop,nop,TS val 1331908 ecr 1547155,mptcp dss ack 1287982088], length 0
08:03:20.865826 IP 112.26.1.8.43037 > 112.26.1.1.44905: Flags [.], ack 128521, win 14829, options [nop,nop,TS val 1332383 ecr 1547155,nop,nop,sack 1 {129949:137089},mptcp dss ack 1287982088], length 0
08:03:20.910032 IP 112.26.1.8.43037 > 112.26.1.1.44905: Flags [.], ack 128521, win 14509, options [nop,nop,TS val 1332008 ecr 1547155,nop,nop,sack 1 {129949:131377},mptcp dss ack 1287982088], length 0
08:03:20.977459 IP 112.26.1.8.43037 > 112.26.1.1.44905: Flags [.], ack 128521, win 14920, options [nop,nop,TS val 1332495 ecr 1547155,nop,nop,sack 1 {129949:138517},mptcp dss ack 1287982088], length 0
08:03:21.058788 IP 112.26.1.8.43037 > 112.26.1.1.44905: Flags [.], ack 128521, win 14600, options [nop,nop,TS val 1332098 ecr 1547155,nop,nop,sack 1 {129949:132805},mptcp dss ack 1287982088], length 0
08:03:21.107225 IP 112.26.1.8.43037 > 112.26.1.1.44905: Flags [.], ack 128521, win 14646, options [nop,nop,TS val 1332171 ecr 1547155,nop,nop,sack 1 {129949:134233},mptcp dss ack 1287982088], length 0
08:03:21.176830 IP 112.26.1.8.43037 > 112.26.1.1.44905: Flags [.], ack 128521, win 14737, options [nop,nop,TS val 1332270 ecr 1547155,nop,nop,sack 1 {129949:135661},mptcp dss ack 1287982088], length 0
08:03:21.249112 IP 112.26.1.8.43037 > 112.26.1.1.44905: Flags [.], ack 128521, win 15057, options [nop,nop,TS val 1332723 ecr 1547155,nop,nop,sack 2 {139945:141373}{129949:138517},mptcp dss ack 1287982088], length 0
08:03:21.366048 IP 112.26.1.8.43037 > 112.26.1.1.44905: Flags [.], ack 128521, win 15148, options [nop,nop,TS val 1332883 ecr 1547155,nop,nop,sack 2 {139945:142801}{129949:138517},mptcp dss ack 1287982088], length 0
08:03:21.451337 IP 112.26.1.8.43037 > 112.26.1.1.44905: Flags [.], ack 128521, win 15285, options [nop,nop,TS val 1332968 ecr 1547155,nop,nop,sack 2 {139945:144229}{129949:138517},mptcp dss ack 1287982088], length 0
08:03:21.482066 IP 112.26.1.8.43037 > 112.26.1.1.44905: Flags [.], ack 128521, win 15330, options [nop,nop,TS val 1332999 ecr 1547155,nop,nop,sack 2 {139945:145657}{129949:138517},mptcp dss ack 1287982088], length 0
08:03:21.557527 IP 112.26.1.8.43037 > 112.26.1.1.44905: Flags [.], ack 128521, win 15422, options [nop,nop,TS val 1333075 ecr 1547155,nop,nop,sack 2 {139945:147085}{129949:138517},mptcp dss ack 1287982088], length 0
08:03:21.587425 IP 112.26.1.8.43037 > 112.26.1.1.44905: Flags [.], ack 128521, win 15513, options [nop,nop,TS val 1333102 ecr 1547155,nop,nop,sack 2 {139945:148513}{129949:138517},mptcp dss ack 1287982088], length 0
08:03:21.662888 IP 112.26.1.8.43037 > 112.26.1.1.44905: Flags [.], ack 128521, win 15057, options [nop,nop,TS val 1332723 ecr 1547155,nop,nop,sack 2 {139945:141373}{129949:138517},mptcp dss ack 1287982088], length 0
08:03:21.753675 IP 112.26.1.8.43037 > 112.26.1.1.44905: Flags [.], ack 128521, win 15604, options [nop,nop,TS val 1333270 ecr 1547155,nop,nop,sack 2 {139945:149941}{129949:138517},mptcp dss ack 1287982088], length 0
08:03:21.793562 IP 112.26.1.8.43037 > 112.26.1.1.44905: Flags [.], ack 138517, win 15695, options [nop,nop,TS val 1333298 ecr 1548369,nop,nop,sack 1 {139945:149941},mptcp dss ack 1287999224], length 0
08:03:21.860680 IP 112.26.1.8.43037 > 112.26.1.1.44905: Flags [.], ack 128521, win 15148, options [nop,nop,TS val 1332883 ecr 1547155,nop,nop,sack 2 {139945:142801}{129949:138517},mptcp dss ack 1287982088], length 0
08:03:21.880067 IP 112.26.1.8.43037 > 112.26.1.1.44905: Flags [.], ack 138517, win 15741, options [nop,nop,TS val 1333397 ecr 1548369,nop,nop,sack 1 {139945:151369},mptcp dss ack 1287999224], length 0
08:03:21.966445 IP 112.26.1.8.43037 > 112.26.1.1.44905: Flags [.], ack 128521, win 15330, options [nop,nop,TS val 1332999 ecr 1547155,nop,nop,sack 2 {139945:145657}{129949:138517},mptcp dss ack 1287982088], length 0
08:03:22.087000 IP 112.26.1.8.43037 > 112.26.1.1.44905: Flags [.], ack 128521, win 15422, options [nop,nop,TS val 1333075 ecr 1547155,nop,nop,sack 2 {139945:147085}{129949:138517},mptcp dss ack 1287982088], length 0
08:03:22.097618 IP 112.26.1.8.43037 > 112.26.1.1.44905: Flags [.], ack 151369, win 15878, options [nop,nop,TS val 1333615 ecr 1548924,mptcp dss ack 1288022072], length 0
08:03:22.186284 IP 112.26.1.8.43037 > 112.26.1.1.44905: Flags [.], ack 128521, win 15513, options [nop,nop,TS val 1333102 ecr 1547155,nop,nop,sack 2 {139945:148513}{129949:138517},mptcp dss ack 1287982088], length 0
08:03:22.272122 IP 112.26.1.8.43037 > 112.26.1.1.44905: Flags [.], ack 128521, win 15604, options [nop,nop,TS val 1333270 ecr 1547155,nop,nop,sack 2 {139945:149941}{129949:138517},mptcp dss ack 1287982088], length 0
08:03:22.303349 IP 112.26.1.8.43037 > 112.26.1.1.44905: Flags [.], ack 138517, win 15695, options [nop,nop,TS val 1333298 ecr 1548369,nop,nop,sack 1 {139945:149941},mptcp dss ack 1287999224], length 0
08:03:22.366346 IP 112.26.1.8.43037 > 112.26.1.1.44905: Flags [.], ack 152797, win 16060, options [nop,nop,TS val 1333884 ecr 1549145,mptcp dss ack 1288022072], length 0
08:03:22.402737 IP 112.26.1.8.43037 > 112.26.1.1.44905: Flags [.], ack 154225, win 16152, options [nop,nop,TS val 1333920 ecr 1549233,mptcp dss ack 1288022072], length 0
08:03:22.477397 IP 112.26.1.8.43037 > 112.26.1.1.44905: Flags [.], ack 155653, win 16197, options [nop,nop,TS val 1333994 ecr 1549233,mptcp dss ack 1288022072], length 0
08:03:22.486292 IP 112.26.1.8.43037 > 112.26.1.1.44905: Flags [.], ack 138517, win 15741, options [nop,nop,TS val 1333397 ecr 1548369,nop,nop,sack 1 {139945:151369},mptcp dss ack 1287999224], length 0
08:03:22.559835 IP 112.26.1.8.43037 > 112.26.1.1.44905: Flags [.], ack 151369, win 15878, options [nop,nop,TS val 1333615 ecr 1548924,mptcp dss ack 1288022072], length 0
08:03:22.570840 IP 112.26.1.8.43037 > 112.26.1.1.44905: Flags [.], ack 157081, win 16334, options [nop,nop,TS val 1334084 ecr 1549374,mptcp dss ack 1288022072], length 0
